[I 2026-03-18 18:11:27,568] Trial 31 finished with value: -0.5528501487007823 and parameters: {'n_layers_yyx': 2, 'hidden_size_yyx_l0': 6, 'hidden_size_yyx_l1': 4, 'context_size_yyx': 4, 'num_mix_components_yyx': 2, 'context_extractor_yyx': 'gru', 'activation_func_yyx': 'Tanh', 'L2_weight_yyx': 1.3317510331129169e-05, 'L_entropy_weight_yyx': 9.95791378605322e-10, 'L_sep_weight_yyx': 4.87409422260348e-06, 'L_scale_weight_yyx': 1.0355775835723677e-06, 'learning_rate_yyx': 0.008591182038665168}. Best is trial 12 with value: -0.5830094706077523.
[I 2026-03-18 18:11:28,343] Trial 32 pruned. 
[I 2026-03-18 18:11:30,245] Trial 18 pruned. 
[I 2026-03-18 18:11:30,461] Trial 25 pruned. 
[I 2026-03-18 18:11:30,607] Trial 23 finished with value: -1.261978889789687 and parameters: {'n_layers_yyx': 1, 'hidden_size_yyx_l0': 4, 'context_size_yyx': 4, 'num_mix_components_yyx': 5, 'context_extractor_yyx': 'gru', 'activation_func_yyx': 'ReLU', 'L2_weight_yyx': 8.367731817190503e-05, 'L_entropy_weight_yyx': 1.5753590773444877e-05, 'L_sep_weight_yyx': 3.39924986980327e-10, 'L_scale_weight_yyx': 3.720059320000656e-08, 'learning_rate_yyx': 0.005477993931536243}. Best is trial 21 with value: -1.2672024513568985.
[I 2026-03-18 18:11:30,941] Trial 28 pruned. 
[I 2026-03-18 18:11:31,821] Trial 14 pruned. 
[I 2026-03-18 18:11:34,259] Trial 18 pruned. 
[I 2026-03-18 18:11:34,431] Trial 20 pruned. 
[I 2026-03-18 18:11:35,365] Trial 33 pruned. 
[I 2026-03-18 18:11:36,140] Trial 34 pruned. 
[I 2026-03-18 18:11:37,199] Trial 20 finished with value: -0.5604311222879234 and parameters: {'n_layers_yyx': 1, 'hidden_size_yyx_l0': 5, 'context_size_yyx': 4, 'num_mix_components_yyx': 1, 'context_extractor_yyx': 'lstm', 'activation_func_yyx': 'Tanh', 'L2_weight_yyx': 0.0002747103984044737, 'L_entropy_weight_yyx': 0.0008219174801613451, 'L_sep_weight_yyx': 4.955324086533917e-07, 'L_scale_weight_yyx': 5.127040004024583e-09, 'learning_rate_yyx': 0.004306566667062751}. Best is trial 19 with value: -0.5893623740341837.
[I 2026-03-18 18:11:37,598] Trial 27 pruned. 
[I 2026-03-18 18:11:38,280] Trial 33 pruned. 
[I 2026-03-18 18:11:39,433] Trial 27 finished with value: -3.1280313143912797 and parameters: {'n_layers_yyx': 2, 'hidden_size_yyx_l0': 5, 'hidden_size_yyx_l1': 6, 'context_size_yyx': 4, 'num_mix_components_yyx': 4, 'context_extractor_yyx': 'gru', 'activation_func_yyx': 'Tanh', 'L2_weight_yyx': 5.6554501234771906e-08, 'L_entropy_weight_yyx': 8.280749475496441e-10, 'L_sep_weight_yyx': 6.54919465998856e-09, 'L_scale_weight_yyx': 3.126967019928855e-08, 'learning_rate_yyx': 0.00688547226830036}. Best is trial 20 with value: -3.160948786990499.
[I 2026-03-18 18:11:42,096] Trial 29 finished with value: -3.1426435859964346 and parameters: {'n_layers_yyx': 2, 'hidden_size_yyx_l0': 4, 'hidden_size_yyx_l1': 3, 'context_size_yyx': 2, 'num_mix_components_yyx': 4, 'context_extractor_yyx': 'gru', 'activation_func_yyx': 'GELU', 'L2_weight_yyx': 1.9157085107648843e-08, 'L_entropy_weight_yyx': 1.0286562683984983e-09, 'L_sep_weight_yyx': 0.0001387462448657003, 'L_scale_weight_yyx': 3.208834038165764e-10, 'learning_rate_yyx': 0.00841155166137053}. Best is trial 1 with value: -3.1505299612690063.
[I 2026-03-18 18:11:42,155] Trial 37 pruned. 
[I 2026-03-18 18:11:45,616] Trial 34 pruned. 
[I 2026-03-18 18:11:50,715] Trial 19 pruned. 
[I 2026-03-18 18:11:50,861] Trial 22 pruned. 
[I 2026-03-18 18:11:51,505] Trial 20 finished with value: -1.2583062741320146 and parameters: {'n_layers_yyx': 1, 'hidden_size_yyx_l0': 6, 'context_size_yyx': 3, 'num_mix_components_yyx': 3, 'context_extractor_yyx': 'gru', 'activation_func_yyx': 'Tanh', 'L2_weight_yyx': 2.5962606744961134e-06, 'L_entropy_weight_yyx': 1.2596871761250005e-06, 'L_sep_weight_yyx': 1.2336244512284e-10, 'L_scale_weight_yyx': 2.488719004904264e-05, 'learning_rate_yyx': 0.0030121339515755984}. Best is trial 0 with value: -1.2691870881537193.
[I 2026-03-18 18:11:52,197] Trial 29 pruned. 
[I 2026-03-18 18:11:52,202] Trial 26 pruned. 
[I 2026-03-18 18:11:52,676] Trial 18 pruned. 
[I 2026-03-18 18:11:56,488] Trial 35 pruned. 
[I 2026-03-18 18:12:00,576] Trial 27 pruned. 
[I 2026-03-18 18:12:01,321] Trial 30 pruned. 
[I 2026-03-18 18:12:03,089] Trial 35 pruned. 
[I 2026-03-18 18:12:03,248] Trial 19 pruned. 
[I 2026-03-18 18:12:04,818] Trial 28 pruned. 
[I 2026-03-18 18:12:04,966] Trial 20 finished with value: -3.1566015750503196 and parameters: {'n_layers_yyx': 1, 'hidden_size_yyx_l0': 6, 'context_size_yyx': 3, 'num_mix_components_yyx': 1, 'context_extractor_yyx': 'gru', 'activation_func_yyx': 'GELU', 'L2_weight_yyx': 1.2329235168073962e-05, 'L_entropy_weight_yyx': 2.202294848417113e-06, 'L_sep_weight_yyx': 1.0046613384211806e-06, 'L_scale_weight_yyx': 2.7581710080226857e-08, 'learning_rate_yyx': 0.006397652256241544}. Best is trial 12 with value: -3.1893335216865584.
[I 2026-03-18 18:12:09,237] Trial 17 pruned. 
[I 2026-03-18 18:12:10,717] Trial 33 pruned. 
[I 2026-03-18 18:12:10,748] Trial 19 pruned. 
[I 2026-03-18 18:12:10,823] Trial 36 pruned. 
[I 2026-03-18 18:12:11,110] Trial 20 pruned. 
[I 2026-03-18 18:12:17,364] Trial 28 pruned. 
[I 2026-03-18 18:12:17,629] Trial 29 finished with value: -3.145130162146018 and parameters: {'n_layers_yyx': 2, 'hidden_size_yyx_l0': 5, 'hidden_size_yyx_l1': 5, 'context_size_yyx': 3, 'num_mix_components_yyx': 5, 'context_extractor_yyx': 'gru', 'activation_func_yyx': 'GELU', 'L2_weight_yyx': 1.997275272146631e-09, 'L_entropy_weight_yyx': 3.193015599106749e-05, 'L_sep_weight_yyx': 1.2366150736097367e-10, 'L_scale_weight_yyx': 5.899582815091196e-09, 'learning_rate_yyx': 0.005560081450111256}. Best is trial 20 with value: -3.1481007392302844.
[I 2026-03-18 18:12:17,855] Trial 28 pruned. 
[I 2026-03-18 18:12:18,059] Trial 34 pruned. 
[I 2026-03-18 18:12:18,814] Trial 17 finished with value: -3.1501297657244143 and parameters: {'n_layers_yyx': 2, 'hidden_size_yyx_l0': 6, 'hidden_size_yyx_l1': 3, 'context_size_yyx': 3, 'num_mix_components_yyx': 5, 'context_extractor_yyx': 'lstm', 'activation_func_yyx': 'Tanh', 'L2_weight_yyx': 1.7669080135600685e-10, 'L_entropy_weight_yyx': 6.609416468811076e-06, 'L_sep_weight_yyx': 2.1384796549283567e-09, 'L_scale_weight_yyx': 6.958801049220514e-08, 'learning_rate_yyx': 0.008017078881437347}. Best is trial 10 with value: -3.1515199681211117.
[I 2026-03-18 18:12:19,347] Trial 21 finished with value: -1.2749532063802083 and parameters: {'n_layers_yyx': 2, 'hidden_size_yyx_l0': 4, 'hidden_size_yyx_l1': 5, 'context_size_yyx': 4, 'num_mix_components_yyx': 4, 'context_extractor_yyx': 'lstm', 'activation_func_yyx': 'Tanh', 'L2_weight_yyx': 5.864914428452381e-06, 'L_entropy_weight_yyx': 2.481675992898149e-06, 'L_sep_weight_yyx': 1.619789439595674e-07, 'L_scale_weight_yyx': 2.06728603785974e-06, 'learning_rate_yyx': 0.002227825146174169}. Best is trial 2 with value: -1.2804754530695341.
[I 2026-03-18 18:12:20,436] Trial 28 pruned. 
[I 2026-03-18 18:12:22,219] Trial 21 pruned. 
[I 2026-03-18 18:12:23,094] Trial 34 pruned. 
[I 2026-03-18 18:12:26,115] Trial 25 finished with value: -3.1404854219619858 and parameters: {'n_layers_yyx': 2, 'hidden_size_yyx_l0': 6, 'hidden_size_yyx_l1': 3, 'context_size_yyx': 2, 'num_mix_components_yyx': 3, 'context_extractor_yyx': 'lstm', 'activation_func_yyx': 'ReLU', 'L2_weight_yyx': 8.68635244221742e-09, 'L_entropy_weight_yyx': 2.0660032331844952e-10, 'L_sep_weight_yyx': 3.1847281873329584e-05, 'L_scale_weight_yyx': 9.395228658263749e-10, 'learning_rate_yyx': 0.003318951149920956}. Best is trial 0 with value: -3.1460828145824977.
[I 2026-03-18 18:12:27,250] Trial 32 finished with value: -0.5565020260817412 and parameters: {'n_layers_yyx': 2, 'hidden_size_yyx_l0': 6, 'hidden_size_yyx_l1': 4, 'context_size_yyx': 4, 'num_mix_components_yyx': 2, 'context_extractor_yyx': 'gru', 'activation_func_yyx': 'Tanh', 'L2_weight_yyx': 4.5517623750369795e-06, 'L_entropy_weight_yyx': 4.6495856288239254e-10, 'L_sep_weight_yyx': 1.7047909918332428e-05, 'L_scale_weight_yyx': 0.00015207035622122957, 'learning_rate_yyx': 0.009665888343625192}. Best is trial 12 with value: -0.5830094706077523.
[I 2026-03-18 18:12:30,633] Trial 35 pruned. 
[I 2026-03-18 18:12:30,879] Trial 23 pruned. 
[I 2026-03-18 18:12:35,065] Trial 29 pruned. 
[I 2026-03-18 18:12:37,106] Trial 30 pruned. 
[I 2026-03-18 18:12:41,164] Trial 22 pruned. 
[I 2026-03-18 18:12:41,506] Trial 21 finished with value: -0.5879878027075095 and parameters: {'n_layers_yyx': 1, 'hidden_size_yyx_l0': 5, 'context_size_yyx': 4, 'num_mix_components_yyx': 5, 'context_extractor_yyx': 'lstm', 'activation_func_yyx': 'Tanh', 'L2_weight_yyx': 2.5027755315772847e-05, 'L_entropy_weight_yyx': 0.00012698136743995755, 'L_sep_weight_yyx': 4.548328002412531e-10, 'L_scale_weight_yyx': 2.3065084909464053e-05, 'learning_rate_yyx': 0.002924478996558972}. Best is trial 19 with value: -0.5893623740341837.
[I 2026-03-18 18:12:43,757] Trial 26 pruned. 
[I 2026-03-18 18:12:44,406] Trial 29 pruned. 
[I 2026-03-18 18:12:46,388] Trial 31 pruned. 
[I 2026-03-18 18:12:50,933] Trial 37 pruned. 
[I 2026-03-18 18:12:51,030] Trial 22 pruned. 
[I 2026-03-18 18:12:51,751] Trial 21 pruned. 
[I 2026-03-18 18:12:52,208] Trial 36 pruned. 
[I 2026-03-18 18:12:53,491] Trial 20 pruned. 
[I 2026-03-18 18:12:54,422] Trial 38 finished with value: -0.5795520221022825 and parameters: {'n_layers_yyx': 1, 'hidden_size_yyx_l0': 4, 'context_size_yyx': 2, 'num_mix_components_yyx': 5, 'context_extractor_yyx': 'lstm', 'activation_func_yyx': 'Tanh', 'L2_weight_yyx': 1.0924766486711415e-09, 'L_entropy_weight_yyx': 8.390377133589549e-10, 'L_sep_weight_yyx': 3.846931828318351e-06, 'L_scale_weight_yyx': 4.6776811916828044e-08, 'learning_rate_yyx': 0.004532521810060984}. Best is trial 15 with value: -0.5797879771320495.
[I 2026-03-18 18:12:54,744] Trial 30 pruned. 
[I 2026-03-18 18:13:00,047] Trial 30 pruned. 
[I 2026-03-18 18:13:00,055] Trial 15 finished with value: -3.1215014457252748 and parameters: {'n_layers_yyx': 2, 'hidden_size_yyx_l0': 5, 'hidden_size_yyx_l1': 5, 'context_size_yyx': 4, 'num_mix_components_yyx': 2, 'context_extractor_yyx': 'lstm', 'activation_func_yyx': 'ReLU', 'L2_weight_yyx': 7.565611009429432e-09, 'L_entropy_weight_yyx': 1.6683228442206568e-08, 'L_sep_weight_yyx': 8.178867990988674e-06, 'L_scale_weight_yyx': 2.6537682735807116e-08, 'learning_rate_yyx': 0.005860676345374116}. Best is trial 1 with value: -3.152505646630136.
[I 2026-03-18 18:13:00,932] Trial 29 pruned. 
[I 2026-03-18 18:13:01,585] Trial 20 finished with value: -3.1632631059923257 and parameters: {'n_layers_yyx': 2, 'hidden_size_yyx_l0': 4, 'hidden_size_yyx_l1': 5, 'context_size_yyx': 4, 'num_mix_components_yyx': 4, 'context_extractor_yyx': 'gru', 'activation_func_yyx': 'ReLU', 'L2_weight_yyx': 4.3504606730807565e-08, 'L_entropy_weight_yyx': 2.187066975534308e-05, 'L_sep_weight_yyx': 1.4051880467058948e-09, 'L_scale_weight_yyx': 3.830587250133105e-08, 'learning_rate_yyx': 0.009900970032466105}. Best is trial 12 with value: -3.1682013088461884.
[I 2026-03-18 18:13:01,907] Trial 23 pruned. 
[I 2026-03-18 18:13:02,241] Trial 38 pruned. 
[I 2026-03-18 18:13:04,384] Trial 39 pruned. 
[I 2026-03-18 18:13:07,919] Trial 24 finished with value: -1.2727326976613946 and parameters: {'n_layers_yyx': 1, 'hidden_size_yyx_l0': 4, 'context_size_yyx': 3, 'num_mix_components_yyx': 4, 'context_extractor_yyx': 'gru', 'activation_func_yyx': 'ReLU', 'L2_weight_yyx': 0.0002605622696541254, 'L_entropy_weight_yyx': 4.558517660323181e-07, 'L_sep_weight_yyx': 3.7968181428994e-08, 'L_scale_weight_yyx': 6.640430237399065e-10, 'learning_rate_yyx': 0.009979714098492475}. Best is trial 24 with value: -1.2727326976613946.
[I 2026-03-18 18:13:08,129] Trial 32 pruned. 
[I 2026-03-18 18:13:12,787] Trial 24 pruned. 
[I 2026-03-18 18:13:14,213] Trial 21 pruned. 
[I 2026-03-18 18:13:16,367] Trial 19 pruned. 
[I 2026-03-18 18:13:21,770] Trial 23 pruned. 
[I 2026-03-18 18:13:21,956] Trial 16 pruned. 
[I 2026-03-18 18:13:22,241] Trial 30 pruned. 
[I 2026-03-18 18:13:24,734] Trial 21 finished with value: -1.260939000494599 and parameters: {'n_layers_yyx': 1, 'hidden_size_yyx_l0': 6, 'context_size_yyx': 3, 'num_mix_components_yyx': 4, 'context_extractor_yyx': 'lstm', 'activation_func_yyx': 'Tanh', 'L2_weight_yyx': 0.00011928358225068369, 'L_entropy_weight_yyx': 5.102080887071738e-06, 'L_sep_weight_yyx': 1.6658230690123546e-07, 'L_scale_weight_yyx': 4.345212246932919e-08, 'learning_rate_yyx': 0.007524005693669266}. Best is trial 0 with value: -1.2691870881537193.
[I 2026-03-18 18:13:24,854] Trial 21 pruned. 
[I 2026-03-18 18:13:26,961] Trial 16 pruned. 
[I 2026-03-18 18:13:29,164] Trial 33 pruned. 
[I 2026-03-18 18:13:34,310] Trial 22 pruned. 
[I 2026-03-18 18:13:35,301] Trial 22 pruned. 
[I 2026-03-18 18:13:35,780] Trial 33 finished with value: -0.5515651781588505 and parameters: {'n_layers_yyx': 2, 'hidden_size_yyx_l0': 6, 'hidden_size_yyx_l1': 5, 'context_size_yyx': 4, 'num_mix_components_yyx': 1, 'context_extractor_yyx': 'lstm', 'activation_func_yyx': 'Tanh', 'L2_weight_yyx': 1.011309646015611e-06, 'L_entropy_weight_yyx': 1.5705208368192698e-09, 'L_sep_weight_yyx': 1.1391863289805793e-06, 'L_scale_weight_yyx': 3.6686442731320484e-05, 'learning_rate_yyx': 0.006177606357114913}. Best is trial 12 with value: -0.5830094706077523.
[I 2026-03-18 18:13:36,121] Trial 20 pruned. 
[I 2026-03-18 18:13:39,790] Trial 24 finished with value: -1.2555485018520391 and parameters: {'n_layers_yyx': 2, 'hidden_size_yyx_l0': 2, 'hidden_size_yyx_l1': 4, 'context_size_yyx': 2, 'num_mix_components_yyx': 3, 'context_extractor_yyx': 'lstm', 'activation_func_yyx': 'Tanh', 'L2_weight_yyx': 0.0007054942575736912, 'L_entropy_weight_yyx': 1.7013221133793718e-06, 'L_sep_weight_yyx': 6.347303641261048e-09, 'L_scale_weight_yyx': 3.50162277819616e-10, 'learning_rate_yyx': 0.007316795284632947}. Best is trial 7 with value: -1.272066817927052.
[I 2026-03-18 18:13:48,197] Trial 17 pruned. 
[I 2026-03-18 18:13:49,422] Trial 24 pruned. 
[I 2026-03-18 18:13:49,423] Trial 39 pruned. 
[I 2026-03-18 18:13:50,133] Trial 34 pruned. 
[I 2026-03-18 18:13:52,580] Trial 17 finished with value: -3.1492454068059788 and parameters: {'n_layers_yyx': 2, 'hidden_size_yyx_l0': 5, 'hidden_size_yyx_l1': 5, 'context_size_yyx': 3, 'num_mix_components_yyx': 2, 'context_extractor_yyx': 'lstm', 'activation_func_yyx': 'GELU', 'L2_weight_yyx': 6.360199742044806e-08, 'L_entropy_weight_yyx': 0.00036375024914620804, 'L_sep_weight_yyx': 0.000152094553599902, 'L_scale_weight_yyx': 1.8466136366680131e-06, 'learning_rate_yyx': 0.006561413302077453}. Best is trial 5 with value: -3.154335707688014.
[I 2026-03-18 18:13:54,140] Trial 18 finished with value: -3.1339941345002833 and parameters: {'n_layers_yyx': 1, 'hidden_size_yyx_l0': 6, 'context_size_yyx': 4, 'num_mix_components_yyx': 4, 'context_extractor_yyx': 'lstm', 'activation_func_yyx': 'ReLU', 'L2_weight_yyx': 1.280293190224e-06, 'L_entropy_weight_yyx': 3.2189251915237395e-05, 'L_sep_weight_yyx': 0.0001493027272501783, 'L_scale_weight_yyx': 4.961220884470809e-06, 'learning_rate_yyx': 0.002066594595224085}. Best is trial 1 with value: -3.166268711244678.
[I 2026-03-18 18:13:54,150] Trial 30 finished with value: -1.2441939602497545 and parameters: {'n_layers_yyx': 2, 'hidden_size_yyx_l0': 6, 'hidden_size_yyx_l1': 5, 'context_size_yyx': 1, 'num_mix_components_yyx': 5, 'context_extractor_yyx': 'gru', 'activation_func_yyx': 'Tanh', 'L2_weight_yyx': 7.52804106916171e-08, 'L_entropy_weight_yyx': 9.495165613910956e-08, 'L_sep_weight_yyx': 1.8927518922995717e-06, 'L_scale_weight_yyx': 3.498892705066426e-06, 'learning_rate_yyx': 0.009890342671177466}. Best is trial 11 with value: -1.2697828860467992.
[I 2026-03-18 18:13:55,818] Trial 29 finished with value: -1.2687849513704368 and parameters: {'n_layers_yyx': 2, 'hidden_size_yyx_l0': 2, 'hidden_size_yyx_l1': 4, 'context_size_yyx': 4, 'num_mix_components_yyx': 4, 'context_extractor_yyx': 'lstm', 'activation_func_yyx': 'ReLU', 'L2_weight_yyx': 7.163185069385266e-09, 'L_entropy_weight_yyx': 0.00014094384839000892, 'L_sep_weight_yyx': 3.833108965869181e-09, 'L_scale_weight_yyx': 0.0002487237549141654, 'learning_rate_yyx': 0.00726993935223406}. Best is trial 22 with value: -1.2717005505799805.
[I 2026-03-18 18:13:56,357] Trial 34 pruned. 
[I 2026-03-18 18:13:58,444] Trial 25 pruned. 
[I 2026-03-18 18:13:59,715] Trial 25 pruned. 
[I 2026-03-18 18:14:00,366] Trial 21 finished with value: -3.1184086288580155 and parameters: {'n_layers_yyx': 2, 'hidden_size_yyx_l0': 2, 'hidden_size_yyx_l1': 3, 'context_size_yyx': 3, 'num_mix_components_yyx': 3, 'context_extractor_yyx': 'gru', 'activation_func_yyx': 'ReLU', 'L2_weight_yyx': 1.162918437949528e-07, 'L_entropy_weight_yyx': 1.0870966710496889e-06, 'L_sep_weight_yyx': 1.1408330914462307e-08, 'L_scale_weight_yyx': 8.783788014516483e-08, 'learning_rate_yyx': 0.00744811946366361}. Best is trial 2 with value: -3.151229652723366.
[I 2026-03-18 18:14:00,485] Trial 36 finished with value: -1.257521659301081 and parameters: {'n_layers_yyx': 2, 'hidden_size_yyx_l0': 2, 'hidden_size_yyx_l1': 4, 'context_size_yyx': 2, 'num_mix_components_yyx': 1, 'context_extractor_yyx': 'lstm', 'activation_func_yyx': 'Tanh', 'L2_weight_yyx': 0.0008300706424382407, 'L_entropy_weight_yyx': 4.373537493103757e-07, 'L_sep_weight_yyx': 6.381677297967253e-10, 'L_scale_weight_yyx': 9.827000870305342e-09, 'learning_rate_yyx': 0.007406353474840761}. Best is trial 26 with value: -1.2726356097378264.
[I 2026-03-18 18:14:01,122] Trial 25 pruned. 
[I 2026-03-18 18:14:05,458] Trial 17 pruned. 
[I 2026-03-18 18:14:08,519] Trial 31 pruned. 
[I 2026-03-18 18:14:08,783] Trial 27 finished with value: -3.1140977089574684 and parameters: {'n_layers_yyx': 2, 'hidden_size_yyx_l0': 5, 'hidden_size_yyx_l1': 3, 'context_size_yyx': 2, 'num_mix_components_yyx': 4, 'context_extractor_yyx': 'lstm', 'activation_func_yyx': 'GELU', 'L2_weight_yyx': 3.2445350821968354e-10, 'L_entropy_weight_yyx': 3.3997074126469883e-10, 'L_sep_weight_yyx': 0.0004971755457594679, 'L_scale_weight_yyx': 1.0727131883411274e-10, 'learning_rate_yyx': 0.008437914266541799}. Best is trial 0 with value: -3.1460828145824977.
[I 2026-03-18 18:14:09,938] Trial 26 pruned. 
[I 2026-03-18 18:14:12,619] Trial 37 pruned. 
[I 2026-03-18 18:14:18,203] Trial 30 pruned. 
[I 2026-03-18 18:14:21,330] Trial 21 pruned. 
[I 2026-03-18 18:14:22,776] Trial 31 finished with value: -1.262706707233422 and parameters: {'n_layers_yyx': 1, 'hidden_size_yyx_l0': 6, 'context_size_yyx': 4, 'num_mix_components_yyx': 5, 'context_extractor_yyx': 'gru', 'activation_func_yyx': 'ReLU', 'L2_weight_yyx': 2.825641552684968e-10, 'L_entropy_weight_yyx': 0.00023750022403590907, 'L_sep_weight_yyx': 1.027848637067679e-10, 'L_scale_weight_yyx': 3.542146015507024e-10, 'learning_rate_yyx': 0.007592285661168684}. Best is trial 23 with value: -1.2721869844165175.
[I 2026-03-18 18:14:22,840] Trial 26 pruned. 
[I 2026-03-18 18:14:24,370] Trial 26 pruned. 
[I 2026-03-18 18:14:27,112] Trial 20 finished with value: -3.119796883838503 and parameters: {'n_layers_yyx': 1, 'hidden_size_yyx_l0': 6, 'context_size_yyx': 4, 'num_mix_components_yyx': 4, 'context_extractor_yyx': 'lstm', 'activation_func_yyx': 'GELU', 'L2_weight_yyx': 6.188514667225366e-06, 'L_entropy_weight_yyx': 8.081520314536036e-10, 'L_sep_weight_yyx': 1.4126604585539151e-09, 'L_scale_weight_yyx': 0.0009770905344755824, 'learning_rate_yyx': 0.005719565784135783}. Best is trial 18 with value: -3.1516461067131374.
[I 2026-03-18 18:14:27,401] Trial 18 pruned. 
[I 2026-03-18 18:14:32,287] Trial 31 finished with value: -3.1228727620634733 and parameters: {'n_layers_yyx': 2, 'hidden_size_yyx_l0': 4, 'hidden_size_yyx_l1': 4, 'context_size_yyx': 4, 'num_mix_components_yyx': 1, 'context_extractor_yyx': 'lstm', 'activation_func_yyx': 'ReLU', 'L2_weight_yyx': 7.538827968735809e-10, 'L_entropy_weight_yyx': 1.6699040219056283e-05, 'L_sep_weight_yyx': 2.359907106580431e-08, 'L_scale_weight_yyx': 2.2482548117883137e-09, 'learning_rate_yyx': 0.007077413703860518}. Best is trial 16 with value: -3.149974272486285.
[I 2026-03-18 18:14:33,227] Trial 37 finished with value: -1.2668238796720663 and parameters: {'n_layers_yyx': 2, 'hidden_size_yyx_l0': 2, 'hidden_size_yyx_l1': 6, 'context_size_yyx': 4, 'num_mix_components_yyx': 4, 'context_extractor_yyx': 'lstm', 'activation_func_yyx': 'GELU', 'L2_weight_yyx': 0.0002789322543730938, 'L_entropy_weight_yyx': 2.2035739301176592e-08, 'L_sep_weight_yyx': 6.395755630715491e-05, 'L_scale_weight_yyx': 1.3105580654564919e-09, 'learning_rate_yyx': 0.008044937680205736}. Best is trial 18 with value: -1.2691942310156972.
[I 2026-03-18 18:14:36,390] Trial 18 pruned. 
[I 2026-03-18 18:14:36,585] Trial 38 pruned. 
[I 2026-03-18 18:14:39,000] Trial 22 finished with value: -1.2761270746838447 and parameters: {'n_layers_yyx': 2, 'hidden_size_yyx_l0': 4, 'hidden_size_yyx_l1': 5, 'context_size_yyx': 4, 'num_mix_components_yyx': 4, 'context_extractor_yyx': 'lstm', 'activation_func_yyx': 'Tanh', 'L2_weight_yyx': 2.442584695194847e-07, 'L_entropy_weight_yyx': 8.710225581194594e-06, 'L_sep_weight_yyx': 2.394227795884835e-07, 'L_scale_weight_yyx': 1.254879343744265e-06, 'learning_rate_yyx': 0.0020356253214513587}. Best is trial 2 with value: -1.2804754530695341.
[I 2026-03-18 18:14:39,620] Trial 31 pruned. 
[I 2026-03-18 18:14:39,994] Trial 40 finished with value: -0.5797216108445452 and parameters: {'n_layers_yyx': 1, 'hidden_size_yyx_l0': 4, 'context_size_yyx': 2, 'num_mix_components_yyx': 5, 'context_extractor_yyx': 'lstm', 'activation_func_yyx': 'Tanh', 'L2_weight_yyx': 1.3662998419045683e-09, 'L_entropy_weight_yyx': 2.770813389328065e-09, 'L_sep_weight_yyx': 0.00013152821385271538, 'L_scale_weight_yyx': 1.0764991048594602e-05, 'learning_rate_yyx': 0.005101700100637629}. Best is trial 15 with value: -0.5797879771320495.
[I 2026-03-18 18:14:47,636] Trial 27 pruned. 
[I 2026-03-18 18:14:47,906] Trial 35 pruned. 
[I 2026-03-18 18:14:50,387] Trial 31 pruned. 
