[I 2026-03-18 19:16:08,127] Trial 0 finished with value: -1.8605448616434945 and parameters: {'n_layers_yyx': 2, 'hidden_size_yyx_l0': 5, 'hidden_size_yyx_l1': 2, 'context_size_yyx': 4, 'num_mix_components_yyx': 3, 'context_extractor_yyx': 'lstm', 'activation_func_yyx': 'GELU', 'L2_weight_yyx': 5.827472468166913e-08, 'L_entropy_weight_yyx': 9.200308511412219e-08, 'L_sep_weight_yyx': 1.8116377924945932e-07, 'L_scale_weight_yyx': 9.077238312761591e-10, 'learning_rate_yyx': 0.002301680051556782}. Best is trial 0 with value: -1.8605448616434945.
[I 2026-03-18 19:16:53,501] Trial 1 pruned. 
[I 2026-03-18 19:16:58,572] Trial 0 finished with value: -1.783729309698548 and parameters: {'n_layers_yyx': 1, 'hidden_size_yyx_l0': 4, 'context_size_yyx': 4, 'num_mix_components_yyx': 2, 'context_extractor_yyx': 'gru', 'activation_func_yyx': 'Tanh', 'L2_weight_yyx': 0.00014820472860744638, 'L_entropy_weight_yyx': 1.5775150258854472e-10, 'L_sep_weight_yyx': 6.903238494456047e-05, 'L_scale_weight_yyx': 1.0205094904399573e-09, 'learning_rate_yyx': 0.0007387796722125922}. Best is trial 0 with value: -1.783729309698548.
[I 2026-03-18 19:17:47,888] Trial 0 finished with value: -1.7931441996383402 and parameters: {'n_layers_yyx': 2, 'hidden_size_yyx_l0': 2, 'hidden_size_yyx_l1': 2, 'context_size_yyx': 1, 'num_mix_components_yyx': 3, 'context_extractor_yyx': 'lstm', 'activation_func_yyx': 'GELU', 'L2_weight_yyx': 1.1059513192381415e-08, 'L_entropy_weight_yyx': 5.2923890378842445e-09, 'L_sep_weight_yyx': 0.0003301906785567878, 'L_scale_weight_yyx': 7.348410194519832e-07, 'learning_rate_yyx': 0.0012805155368662115}. Best is trial 0 with value: -1.7931441996383402.
[I 2026-03-18 19:19:33,635] Trial 0 finished with value: -2.488813529023287 and parameters: {'n_layers_yyx': 2, 'hidden_size_yyx_l0': 4, 'hidden_size_yyx_l1': 3, 'context_size_yyx': 3, 'num_mix_components_yyx': 3, 'context_extractor_yyx': 'lstm', 'activation_func_yyx': 'ReLU', 'L2_weight_yyx': 3.677149294556316e-05, 'L_entropy_weight_yyx': 0.0009221793015863868, 'L_sep_weight_yyx': 1.8016067042160582e-09, 'L_scale_weight_yyx': 6.897079446529416e-08, 'learning_rate_yyx': 0.0006564140560609651}. Best is trial 0 with value: -2.488813529023287.
[I 2026-03-18 19:21:45,773] Trial 1 finished with value: -2.4633966237885176 and parameters: {'n_layers_yyx': 2, 'hidden_size_yyx_l0': 3, 'hidden_size_yyx_l1': 3, 'context_size_yyx': 1, 'num_mix_components_yyx': 4, 'context_extractor_yyx': 'lstm', 'activation_func_yyx': 'GELU', 'L2_weight_yyx': 7.598400895894316e-07, 'L_entropy_weight_yyx': 3.104511716951451e-05, 'L_sep_weight_yyx': 1.6359467261564847e-08, 'L_scale_weight_yyx': 0.0007927235858919831, 'learning_rate_yyx': 0.0015968684700537888}. Best is trial 1 with value: -2.4633966237885176.
[I 2026-03-18 19:23:13,394] Trial 2 pruned. 
[I 2026-03-18 19:23:42,747] Trial 1 finished with value: -1.5403017335939237 and parameters: {'n_layers_yyx': 2, 'hidden_size_yyx_l0': 4, 'hidden_size_yyx_l1': 4, 'context_size_yyx': 2, 'num_mix_components_yyx': 5, 'context_extractor_yyx': 'gru', 'activation_func_yyx': 'Tanh', 'L2_weight_yyx': 4.7065370362299407e-05, 'L_entropy_weight_yyx': 2.6816027114748236e-10, 'L_sep_weight_yyx': 1.1720525364436925e-07, 'L_scale_weight_yyx': 4.37210284797459e-08, 'learning_rate_yyx': 0.0075348602688085735}. Best is trial 0 with value: -1.5474254567427992.
[I 2026-03-18 19:25:39,927] Trial 2 finished with value: -2.4485345578030278 and parameters: {'n_layers_yyx': 2, 'hidden_size_yyx_l0': 3, 'hidden_size_yyx_l1': 4, 'context_size_yyx': 4, 'num_mix_components_yyx': 1, 'context_extractor_yyx': 'gru', 'activation_func_yyx': 'GELU', 'L2_weight_yyx': 1.2540888483209214e-10, 'L_entropy_weight_yyx': 1.6117864483562308e-09, 'L_sep_weight_yyx': 2.3958143486160657e-07, 'L_scale_weight_yyx': 4.168769645460781e-05, 'learning_rate_yyx': 0.00796227786536252}. Best is trial 0 with value: -2.4573569585183157.
[I 2026-03-18 19:27:58,970] Trial 2 pruned. 
[I 2026-03-18 19:29:51,873] Trial 3 pruned. 
[I 2026-03-18 19:31:03,768] Trial 1 finished with value: -1.9300911785393273 and parameters: {'n_layers_yyx': 2, 'hidden_size_yyx_l0': 4, 'hidden_size_yyx_l1': 5, 'context_size_yyx': 2, 'num_mix_components_yyx': 2, 'context_extractor_yyx': 'lstm', 'activation_func_yyx': 'GELU', 'L2_weight_yyx': 2.935417031308214e-06, 'L_entropy_weight_yyx': 4.076334657984628e-08, 'L_sep_weight_yyx': 2.556791015956376e-06, 'L_scale_weight_yyx': 1.7917903074303134e-09, 'learning_rate_yyx': 0.002951663292388231}. Best is trial 1 with value: -1.9300911785393273.
[I 2026-03-18 19:31:39,793] Trial 1 pruned. 
[I 2026-03-18 19:31:57,684] Trial 3 pruned. 
[I 2026-03-18 19:32:12,604] Trial 1 finished with value: -1.84511113308576 and parameters: {'n_layers_yyx': 1, 'hidden_size_yyx_l0': 5, 'context_size_yyx': 4, 'num_mix_components_yyx': 4, 'context_extractor_yyx': 'lstm', 'activation_func_yyx': 'Tanh', 'L2_weight_yyx': 0.00017497425554038298, 'L_entropy_weight_yyx': 1.329011651982919e-08, 'L_sep_weight_yyx': 2.5314257370837618e-09, 'L_scale_weight_yyx': 1.3129966117323083e-10, 'learning_rate_yyx': 0.0005147336182055502}. Best is trial 1 with value: -1.84511113308576.
[I 2026-03-18 19:33:10,932] Trial 3 finished with value: -1.8453425281952338 and parameters: {'n_layers_yyx': 2, 'hidden_size_yyx_l0': 6, 'hidden_size_yyx_l1': 3, 'context_size_yyx': 2, 'num_mix_components_yyx': 4, 'context_extractor_yyx': 'lstm', 'activation_func_yyx': 'ReLU', 'L2_weight_yyx': 0.0008913121691581553, 'L_entropy_weight_yyx': 6.879254207427278e-06, 'L_sep_weight_yyx': 2.7564420226401566e-10, 'L_scale_weight_yyx': 2.3037153543287404e-08, 'learning_rate_yyx': 0.007046783444829955}. Best is trial 0 with value: -1.8516305051550026.
[I 2026-03-18 19:34:07,706] Trial 4 pruned. 
[I 2026-03-18 19:35:19,249] Trial 4 pruned. 
[I 2026-03-18 19:35:21,172] Trial 2 finished with value: -1.4047006695087139 and parameters: {'n_layers_yyx': 1, 'hidden_size_yyx_l0': 4, 'context_size_yyx': 3, 'num_mix_components_yyx': 2, 'context_extractor_yyx': 'gru', 'activation_func_yyx': 'Tanh', 'L2_weight_yyx': 5.660812418700951e-07, 'L_entropy_weight_yyx': 5.256437256682085e-06, 'L_sep_weight_yyx': 4.02846150416906e-10, 'L_scale_weight_yyx': 0.00011253255490942895, 'learning_rate_yyx': 0.00367481181805609}. Best is trial 2 with value: -1.4047006695087139.
[I 2026-03-18 19:35:28,303] Trial 1 pruned. 
[I 2026-03-18 19:35:51,482] Trial 2 pruned. 
[I 2026-03-18 19:35:58,681] Trial 2 finished with value: -1.8360736764972605 and parameters: {'n_layers_yyx': 2, 'hidden_size_yyx_l0': 3, 'hidden_size_yyx_l1': 3, 'context_size_yyx': 3, 'num_mix_components_yyx': 3, 'context_extractor_yyx': 'lstm', 'activation_func_yyx': 'ReLU', 'L2_weight_yyx': 3.1127875680436875e-08, 'L_entropy_weight_yyx': 1.4896964243863743e-06, 'L_sep_weight_yyx': 6.479146258310449e-07, 'L_scale_weight_yyx': 0.00032371647355571514, 'learning_rate_yyx': 0.007814385032699527}. Best is trial 0 with value: -1.837857802213271.
[I 2026-03-18 19:36:11,069] Trial 3 finished with value: -1.3322836303710937 and parameters: {'n_layers_yyx': 2, 'hidden_size_yyx_l0': 5, 'hidden_size_yyx_l1': 4, 'context_size_yyx': 3, 'num_mix_components_yyx': 1, 'context_extractor_yyx': 'gru', 'activation_func_yyx': 'ReLU', 'L2_weight_yyx': 1.388402253695743e-06, 'L_entropy_weight_yyx': 2.9997776231166803e-10, 'L_sep_weight_yyx': 2.6497754471691283e-05, 'L_scale_weight_yyx': 1.3238202251343879e-08, 'learning_rate_yyx': 0.004664518070795699}. Best is trial 0 with value: -1.342767052283654.
[I 2026-03-18 19:36:38,935] Trial 3 finished with value: -1.348492316479953 and parameters: {'n_layers_yyx': 1, 'hidden_size_yyx_l0': 2, 'context_size_yyx': 3, 'num_mix_components_yyx': 2, 'context_extractor_yyx': 'gru', 'activation_func_yyx': 'GELU', 'L2_weight_yyx': 1.9246583433270085e-10, 'L_entropy_weight_yyx': 5.2215069860824933e-08, 'L_sep_weight_yyx': 6.332900514932129e-09, 'L_scale_weight_yyx': 3.1684614215885363e-10, 'learning_rate_yyx': 0.0066135809184383375}. Best is trial 0 with value: -1.4467010977883008.
[I 2026-03-18 19:36:40,454] Trial 1 finished with value: -1.287462158203125 and parameters: {'n_layers_yyx': 1, 'hidden_size_yyx_l0': 5, 'context_size_yyx': 1, 'num_mix_components_yyx': 5, 'context_extractor_yyx': 'gru', 'activation_func_yyx': 'ReLU', 'L2_weight_yyx': 5.117781179466084e-07, 'L_entropy_weight_yyx': 7.089075721088931e-06, 'L_sep_weight_yyx': 0.0003119387160421534, 'L_scale_weight_yyx': 6.335264499404088e-05, 'learning_rate_yyx': 0.0008093773029954718}. Best is trial 0 with value: -1.287627939077524.
[I 2026-03-18 19:37:01,297] Trial 4 pruned. 
[I 2026-03-18 19:37:02,518] Trial 2 pruned. 
[I 2026-03-18 19:37:03,672] Trial 1 finished with value: -1.4345258507361778 and parameters: {'n_layers_yyx': 2, 'hidden_size_yyx_l0': 2, 'hidden_size_yyx_l1': 6, 'context_size_yyx': 2, 'num_mix_components_yyx': 3, 'context_extractor_yyx': 'gru', 'activation_func_yyx': 'GELU', 'L2_weight_yyx': 6.998755670426235e-10, 'L_entropy_weight_yyx': 3.834563052481372e-06, 'L_sep_weight_yyx': 2.966289395209315e-09, 'L_scale_weight_yyx': 2.439185417406112e-07, 'learning_rate_yyx': 0.006911938230162331}. Best is trial 1 with value: -1.4345258507361778.
[I 2026-03-18 19:38:40,330] Trial 2 finished with value: -1.4517343374399039 and parameters: {'n_layers_yyx': 2, 'hidden_size_yyx_l0': 5, 'hidden_size_yyx_l1': 6, 'context_size_yyx': 1, 'num_mix_components_yyx': 2, 'context_extractor_yyx': 'lstm', 'activation_func_yyx': 'Tanh', 'L2_weight_yyx': 3.748403204445236e-06, 'L_entropy_weight_yyx': 6.309257778081142e-08, 'L_sep_weight_yyx': 0.0001792612767295002, 'L_scale_weight_yyx': 1.9788021881175112e-05, 'learning_rate_yyx': 0.006663145436450633}. Best is trial 2 with value: -1.4517343374399039.
[I 2026-03-18 19:42:58,594] Trial 3 pruned. 
[I 2026-03-18 19:43:08,715] Trial 2 pruned. 
[I 2026-03-18 19:43:15,832] Trial 1 finished with value: -1.7457473909011996 and parameters: {'n_layers_yyx': 1, 'hidden_size_yyx_l0': 2, 'context_size_yyx': 2, 'num_mix_components_yyx': 3, 'context_extractor_yyx': 'gru', 'activation_func_yyx': 'ReLU', 'L2_weight_yyx': 0.00028904114581779087, 'L_entropy_weight_yyx': 2.7274225487504068e-08, 'L_sep_weight_yyx': 6.745659727575684e-08, 'L_scale_weight_yyx': 0.0004905171829259308, 'learning_rate_yyx': 0.0005324860246933445}. Best is trial 0 with value: -1.7772347005208333.
[I 2026-03-18 19:43:25,569] Trial 5 pruned. 
[I 2026-03-18 19:43:33,768] Trial 2 finished with value: -2.4564926161269796 and parameters: {'n_layers_yyx': 2, 'hidden_size_yyx_l0': 3, 'hidden_size_yyx_l1': 3, 'context_size_yyx': 2, 'num_mix_components_yyx': 3, 'context_extractor_yyx': 'lstm', 'activation_func_yyx': 'ReLU', 'L2_weight_yyx': 8.371298823239802e-08, 'L_entropy_weight_yyx': 3.3078198547873477e-07, 'L_sep_weight_yyx': 4.882345917422185e-10, 'L_scale_weight_yyx': 0.0004797412514140991, 'learning_rate_yyx': 0.0015401318845852453}. Best is trial 0 with value: -2.4805296636382916.
[I 2026-03-18 19:43:51,164] Trial 1 finished with value: -1.8963288822393307 and parameters: {'n_layers_yyx': 1, 'hidden_size_yyx_l0': 3, 'context_size_yyx': 2, 'num_mix_components_yyx': 4, 'context_extractor_yyx': 'lstm', 'activation_func_yyx': 'ReLU', 'L2_weight_yyx': 5.4314180939391774e-05, 'L_entropy_weight_yyx': 1.3872788579062032e-10, 'L_sep_weight_yyx': 3.837149581362725e-07, 'L_scale_weight_yyx': 1.4885353651367105e-09, 'learning_rate_yyx': 0.004609892776540566}. Best is trial 1 with value: -1.8963288822393307.
[I 2026-03-18 19:44:55,738] Trial 1 finished with value: -1.8872232450699569 and parameters: {'n_layers_yyx': 1, 'hidden_size_yyx_l0': 5, 'context_size_yyx': 2, 'num_mix_components_yyx': 2, 'context_extractor_yyx': 'gru', 'activation_func_yyx': 'Tanh', 'L2_weight_yyx': 3.892277050524103e-08, 'L_entropy_weight_yyx': 1.2346306779897222e-07, 'L_sep_weight_yyx': 5.2650310575826277e-08, 'L_scale_weight_yyx': 4.6206417292467487e-10, 'learning_rate_yyx': 0.0028653094891959783}. Best is trial 1 with value: -1.8872232450699569.
[I 2026-03-18 19:45:43,886] Trial 3 finished with value: -1.3983384804647476 and parameters: {'n_layers_yyx': 1, 'hidden_size_yyx_l0': 6, 'context_size_yyx': 2, 'num_mix_components_yyx': 3, 'context_extractor_yyx': 'lstm', 'activation_func_yyx': 'Tanh', 'L2_weight_yyx': 2.4303369078733444e-05, 'L_entropy_weight_yyx': 1.2934621153804e-10, 'L_sep_weight_yyx': 1.0225786310954472e-09, 'L_scale_weight_yyx': 0.0007352113263246418, 'learning_rate_yyx': 0.0010194276129040366}. Best is trial 0 with value: -1.5190498727266906.
[I 2026-03-18 19:46:04,917] Trial 3 pruned. 
[I 2026-03-18 19:47:14,618] Trial 4 pruned. 
[I 2026-03-18 19:47:28,374] Trial 3 pruned. 
[I 2026-03-18 19:47:45,271] Trial 6 pruned. 
[I 2026-03-18 19:48:01,035] Trial 3 pruned. 
[I 2026-03-18 19:48:27,010] Trial 1 finished with value: -1.3813042743389423 and parameters: {'n_layers_yyx': 1, 'hidden_size_yyx_l0': 3, 'context_size_yyx': 3, 'num_mix_components_yyx': 4, 'context_extractor_yyx': 'lstm', 'activation_func_yyx': 'ReLU', 'L2_weight_yyx': 1.2372507166391142e-10, 'L_entropy_weight_yyx': 4.241124702946578e-08, 'L_sep_weight_yyx': 7.24634478593396e-05, 'L_scale_weight_yyx': 7.70406647230353e-07, 'learning_rate_yyx': 0.0012504832029575327}. Best is trial 1 with value: -1.3813042743389423.
[I 2026-03-18 19:49:47,480] Trial 1 finished with value: -1.927048352414433 and parameters: {'n_layers_yyx': 2, 'hidden_size_yyx_l0': 6, 'hidden_size_yyx_l1': 6, 'context_size_yyx': 2, 'num_mix_components_yyx': 4, 'context_extractor_yyx': 'gru', 'activation_func_yyx': 'GELU', 'L2_weight_yyx': 3.6502346124040484e-05, 'L_entropy_weight_yyx': 1.156794144544751e-05, 'L_sep_weight_yyx': 2.911363413688999e-08, 'L_scale_weight_yyx': 4.538775445899841e-08, 'learning_rate_yyx': 0.0005939421765772352}. Best is trial 0 with value: -1.9368961358079142.
[I 2026-03-18 19:49:52,069] Trial 1 finished with value: -1.8555367853768732 and parameters: {'n_layers_yyx': 1, 'hidden_size_yyx_l0': 6, 'context_size_yyx': 1, 'num_mix_components_yyx': 1, 'context_extractor_yyx': 'lstm', 'activation_func_yyx': 'ReLU', 'L2_weight_yyx': 0.00010933100107313904, 'L_entropy_weight_yyx': 7.218350912495066e-06, 'L_sep_weight_yyx': 2.1799437555669294e-09, 'L_scale_weight_yyx': 1.0012532128203467e-07, 'learning_rate_yyx': 0.002553716995740031}. Best is trial 1 with value: -1.8555367853768732.
[I 2026-03-18 19:49:55,906] Trial 4 pruned. 
[I 2026-03-18 19:50:40,580] Trial 1 finished with value: -1.7830976759785353 and parameters: {'n_layers_yyx': 1, 'hidden_size_yyx_l0': 6, 'context_size_yyx': 1, 'num_mix_components_yyx': 1, 'context_extractor_yyx': 'lstm', 'activation_func_yyx': 'Tanh', 'L2_weight_yyx': 3.6231652909694794e-05, 'L_entropy_weight_yyx': 1.1173838960267358e-05, 'L_sep_weight_yyx': 3.8560594815339024e-07, 'L_scale_weight_yyx': 8.750363560274514e-08, 'learning_rate_yyx': 0.003938073714090967}. Best is trial 0 with value: -1.7873705314867425.
[I 2026-03-18 19:50:40,649] Trial 5 finished with value: -2.4735891998725372 and parameters: {'n_layers_yyx': 2, 'hidden_size_yyx_l0': 5, 'hidden_size_yyx_l1': 2, 'context_size_yyx': 4, 'num_mix_components_yyx': 4, 'context_extractor_yyx': 'gru', 'activation_func_yyx': 'ReLU', 'L2_weight_yyx': 2.698931406577997e-07, 'L_entropy_weight_yyx': 2.3276248419517938e-07, 'L_sep_weight_yyx': 2.8086566069780512e-05, 'L_scale_weight_yyx': 8.270328951420278e-08, 'learning_rate_yyx': 0.008720079277359393}. Best is trial 5 with value: -2.4735891998725372.
[I 2026-03-18 19:50:59,108] Trial 5 pruned. 
[I 2026-03-18 19:51:06,589] Trial 4 pruned. 
[I 2026-03-18 19:51:17,032] Trial 7 pruned. 
[I 2026-03-18 19:51:30,329] Trial 1 finished with value: -1.8536945853230034 and parameters: {'n_layers_yyx': 2, 'hidden_size_yyx_l0': 4, 'hidden_size_yyx_l1': 3, 'context_size_yyx': 2, 'num_mix_components_yyx': 4, 'context_extractor_yyx': 'lstm', 'activation_func_yyx': 'ReLU', 'L2_weight_yyx': 7.494383195425363e-08, 'L_entropy_weight_yyx': 2.943297582772636e-05, 'L_sep_weight_yyx': 2.5234597120245957e-09, 'L_scale_weight_yyx': 0.00027720234244143344, 'learning_rate_yyx': 0.0027386445826500976}. Best is trial 0 with value: -1.8605448616434945.
[I 2026-03-18 19:52:01,516] Trial 2 pruned. 
[I 2026-03-18 19:52:21,773] Trial 1 finished with value: -1.3744548856295071 and parameters: {'n_layers_yyx': 2, 'hidden_size_yyx_l0': 2, 'hidden_size_yyx_l1': 2, 'context_size_yyx': 2, 'num_mix_components_yyx': 3, 'context_extractor_yyx': 'lstm', 'activation_func_yyx': 'GELU', 'L2_weight_yyx': 8.628630886928588e-05, 'L_entropy_weight_yyx': 8.984428292312619e-09, 'L_sep_weight_yyx': 0.0001690366103396198, 'L_scale_weight_yyx': 6.621630934434746e-05, 'learning_rate_yyx': 0.0010143839779658914}. Best is trial 1 with value: -1.3744548856295071.
[I 2026-03-18 19:52:21,790] Trial 2 pruned. 
[I 2026-03-18 19:52:53,479] Trial 2 finished with value: -1.9070392725879137 and parameters: {'n_layers_yyx': 2, 'hidden_size_yyx_l0': 5, 'hidden_size_yyx_l1': 3, 'context_size_yyx': 1, 'num_mix_components_yyx': 1, 'context_extractor_yyx': 'lstm', 'activation_func_yyx': 'Tanh', 'L2_weight_yyx': 2.0878354889917483e-10, 'L_entropy_weight_yyx': 1.516115284256329e-10, 'L_sep_weight_yyx': 0.0001088025559183133, 'L_scale_weight_yyx': 7.073531970609259e-08, 'learning_rate_yyx': 0.009106867552203248}. Best is trial 1 with value: -1.9300911785393273.
[I 2026-03-18 19:53:16,902] Trial 4 pruned. 
[I 2026-03-18 19:53:47,748] Trial 2 finished with value: -1.4588211763822116 and parameters: {'n_layers_yyx': 2, 'hidden_size_yyx_l0': 3, 'hidden_size_yyx_l1': 4, 'context_size_yyx': 1, 'num_mix_components_yyx': 4, 'context_extractor_yyx': 'lstm', 'activation_func_yyx': 'Tanh', 'L2_weight_yyx': 5.128454180970618e-08, 'L_entropy_weight_yyx': 2.2648406953992304e-07, 'L_sep_weight_yyx': 2.01603545293508e-06, 'L_scale_weight_yyx': 8.257582951543775e-10, 'learning_rate_yyx': 0.0010136514991545412}. Best is trial 2 with value: -1.4588211763822116.
[I 2026-03-18 19:53:54,239] Trial 5 pruned. 
[I 2026-03-18 19:54:02,165] Trial 2 finished with value: -2.446029644234627 and parameters: {'n_layers_yyx': 1, 'hidden_size_yyx_l0': 5, 'context_size_yyx': 2, 'num_mix_components_yyx': 5, 'context_extractor_yyx': 'gru', 'activation_func_yyx': 'GELU', 'L2_weight_yyx': 7.86923417456247e-05, 'L_entropy_weight_yyx': 9.240854256655807e-08, 'L_sep_weight_yyx': 9.544415620330648e-09, 'L_scale_weight_yyx': 3.2510951951996365e-06, 'learning_rate_yyx': 0.0012190777065611289}. Best is trial 1 with value: -2.4633966237885176.
[I 2026-03-18 19:54:10,360] Trial 6 pruned. 
[I 2026-03-18 19:54:13,209] Trial 6 pruned. 
[I 2026-03-18 19:54:47,216] Trial 3 pruned. 
[I 2026-03-18 19:54:54,222] Trial 7 pruned. 
[I 2026-03-18 19:55:02,724] Trial 7 pruned. 
[I 2026-03-18 19:55:16,939] Trial 3 finished with value: -1.8520508658448112 and parameters: {'n_layers_yyx': 1, 'hidden_size_yyx_l0': 4, 'context_size_yyx': 4, 'num_mix_components_yyx': 5, 'context_extractor_yyx': 'lstm', 'activation_func_yyx': 'GELU', 'L2_weight_yyx': 0.0005496984528121972, 'L_entropy_weight_yyx': 3.4658065971999016e-07, 'L_sep_weight_yyx': 3.0554959367102976e-06, 'L_scale_weight_yyx': 4.763770154355578e-08, 'learning_rate_yyx': 0.0007303875546714639}. Best is trial 0 with value: -1.8528113520484126.
[I 2026-03-18 19:55:29,004] Trial 3 finished with value: -1.8039611117233905 and parameters: {'n_layers_yyx': 1, 'hidden_size_yyx_l0': 6, 'context_size_yyx': 3, 'num_mix_components_yyx': 5, 'context_extractor_yyx': 'gru', 'activation_func_yyx': 'GELU', 'L2_weight_yyx': 0.0004206081447362553, 'L_entropy_weight_yyx': 0.00025471622264197906, 'L_sep_weight_yyx': 0.00019705104508650347, 'L_scale_weight_yyx': 7.006850422094301e-06, 'learning_rate_yyx': 0.0010532678628505435}. Best is trial 3 with value: -1.8039611117233905.
[I 2026-03-18 19:56:01,914] Trial 4 pruned. 
[I 2026-03-18 19:56:07,423] Trial 5 finished with value: -1.430186098580683 and parameters: {'n_layers_yyx': 1, 'hidden_size_yyx_l0': 4, 'context_size_yyx': 1, 'num_mix_components_yyx': 1, 'context_extractor_yyx': 'gru', 'activation_func_yyx': 'Tanh', 'L2_weight_yyx': 3.901612428181401e-09, 'L_entropy_weight_yyx': 5.152684747988458e-07, 'L_sep_weight_yyx': 1.099703763596545e-06, 'L_scale_weight_yyx': 3.7992901664900145e-05, 'learning_rate_yyx': 0.0013604253429865024}. Best is trial 0 with value: -1.5474254567427992.
[I 2026-03-18 19:56:26,278] Trial 3 finished with value: -1.2805735426682692 and parameters: {'n_layers_yyx': 2, 'hidden_size_yyx_l0': 6, 'hidden_size_yyx_l1': 2, 'context_size_yyx': 4, 'num_mix_components_yyx': 2, 'context_extractor_yyx': 'gru', 'activation_func_yyx': 'ReLU', 'L2_weight_yyx': 2.7400149324665434e-05, 'L_entropy_weight_yyx': 1.5063173847841794e-08, 'L_sep_weight_yyx': 3.3820171800890057e-10, 'L_scale_weight_yyx': 5.3569046457824e-06, 'learning_rate_yyx': 0.003373610630416999}. Best is trial 2 with value: -1.4047006695087139.
[I 2026-03-18 19:56:48,718] Trial 6 pruned. 
[I 2026-03-18 19:56:48,719] Trial 4 pruned. 
[I 2026-03-18 19:57:15,608] Trial 3 finished with value: -1.286060532789964 and parameters: {'n_layers_yyx': 2, 'hidden_size_yyx_l0': 4, 'hidden_size_yyx_l1': 2, 'context_size_yyx': 1, 'num_mix_components_yyx': 1, 'context_extractor_yyx': 'gru', 'activation_func_yyx': 'Tanh', 'L2_weight_yyx': 4.858440786012111e-09, 'L_entropy_weight_yyx': 1.3980948094819715e-10, 'L_sep_weight_yyx': 9.321942537029049e-08, 'L_scale_weight_yyx': 6.341453271722147e-08, 'learning_rate_yyx': 0.0022543653189200765}. Best is trial 1 with value: -1.4389243727463943.
