[I 2026-03-18 22:30:09,125] Trial 62 finished with value: -2.4190809584155524 and parameters: {'n_layers_yyx': 2, 'hidden_size_yyx_l0': 5, 'hidden_size_yyx_l1': 6, 'context_size_yyx': 4, 'num_mix_components_yyx': 5, 'context_extractor_yyx': 'lstm', 'activation_func_yyx': 'Tanh', 'L2_weight_yyx': 2.7095060032429476e-06, 'L_entropy_weight_yyx': 1.9105335656671658e-07, 'L_sep_weight_yyx': 0.0008000014446424444, 'L_scale_weight_yyx': 1.8502358691882515e-10, 'learning_rate_yyx': 0.009445918612816915}. Best is trial 59 with value: -2.4200970521907217.
[I 2026-03-18 22:30:19,160] Trial 59 pruned. 
[I 2026-03-18 22:30:19,412] Trial 50 pruned. 
[I 2026-03-18 22:30:20,009] Trial 62 pruned. 
[I 2026-03-18 22:30:27,001] Trial 60 pruned. 
[I 2026-03-18 22:30:28,009] Trial 63 pruned. 
[I 2026-03-18 22:30:28,081] Trial 51 pruned. 
[I 2026-03-18 22:30:30,400] Trial 57 pruned. 
[I 2026-03-18 22:30:39,104] Trial 63 pruned. 
[I 2026-03-18 22:30:41,160] Trial 64 pruned. 
[I 2026-03-18 22:30:41,808] Trial 56 pruned. 
[I 2026-03-18 22:30:43,167] Trial 61 pruned. 
[I 2026-03-18 22:30:52,184] Trial 47 pruned. 
[I 2026-03-18 22:30:56,120] Trial 58 pruned. 
[I 2026-03-18 22:30:56,476] Trial 64 pruned. 
[I 2026-03-18 22:30:58,901] Trial 62 pruned. 
[I 2026-03-18 22:31:06,325] Trial 63 pruned. 
[I 2026-03-18 22:31:13,344] Trial 65 pruned. 
[I 2026-03-18 22:31:23,776] Trial 53 finished with value: -2.4049037025927396 and parameters: {'n_layers_yyx': 2, 'hidden_size_yyx_l0': 6, 'hidden_size_yyx_l1': 4, 'context_size_yyx': 4, 'num_mix_components_yyx': 4, 'context_extractor_yyx': 'lstm', 'activation_func_yyx': 'GELU', 'L2_weight_yyx': 0.00027778647897374605, 'L_entropy_weight_yyx': 6.1659581751891276e-06, 'L_sep_weight_yyx': 0.0004396868462285885, 'L_scale_weight_yyx': 4.264666108385226e-05, 'learning_rate_yyx': 0.006429659049952056}. Best is trial 53 with value: -2.4049037025927396.
[I 2026-03-18 22:31:30,633] Trial 58 finished with value: -2.7611650603087137 and parameters: {'n_layers_yyx': 2, 'hidden_size_yyx_l0': 5, 'hidden_size_yyx_l1': 5, 'context_size_yyx': 4, 'num_mix_components_yyx': 5, 'context_extractor_yyx': 'gru', 'activation_func_yyx': 'ReLU', 'L2_weight_yyx': 5.3126517277496085e-08, 'L_entropy_weight_yyx': 0.0005156428315493822, 'L_sep_weight_yyx': 3.409031042695349e-10, 'L_scale_weight_yyx': 5.54311909098601e-10, 'learning_rate_yyx': 0.0077164349231866524}. Best is trial 7 with value: -2.766072426816335.
[I 2026-03-18 22:31:32,312] Trial 66 pruned. 
[I 2026-03-18 22:31:32,865] Trial 82 finished with value: -2.397775320226318 and parameters: {'n_layers_yyx': 1, 'hidden_size_yyx_l0': 5, 'context_size_yyx': 4, 'num_mix_components_yyx': 4, 'context_extractor_yyx': 'gru', 'activation_func_yyx': 'Tanh', 'L2_weight_yyx': 0.00021802150294596332, 'L_entropy_weight_yyx': 3.028738129491862e-06, 'L_sep_weight_yyx': 1.221211129265521e-05, 'L_scale_weight_yyx': 1.2012312161673786e-06, 'learning_rate_yyx': 0.006197454817571225}. Best is trial 0 with value: -2.4076941594397367.
[I 2026-03-18 22:31:35,543] Trial 56 finished with value: -2.387247585755255 and parameters: {'n_layers_yyx': 2, 'hidden_size_yyx_l0': 3, 'hidden_size_yyx_l1': 5, 'context_size_yyx': 1, 'num_mix_components_yyx': 5, 'context_extractor_yyx': 'lstm', 'activation_func_yyx': 'Tanh', 'L2_weight_yyx': 0.0009830497759059844, 'L_entropy_weight_yyx': 8.183745908958588e-10, 'L_sep_weight_yyx': 0.00025812099910198986, 'L_scale_weight_yyx': 5.363644201433643e-09, 'learning_rate_yyx': 0.005625168211838795}. Best is trial 11 with value: -2.4030680672323603.
[I 2026-03-18 22:31:41,174] Trial 83 pruned. 
[I 2026-03-18 22:31:43,773] Trial 57 pruned. 
[I 2026-03-18 22:31:44,607] Trial 56 finished with value: -2.7642854406140023 and parameters: {'n_layers_yyx': 2, 'hidden_size_yyx_l0': 4, 'hidden_size_yyx_l1': 4, 'context_size_yyx': 2, 'num_mix_components_yyx': 4, 'context_extractor_yyx': 'gru', 'activation_func_yyx': 'Tanh', 'L2_weight_yyx': 1.2436001248654718e-10, 'L_entropy_weight_yyx': 2.2836936800503208e-05, 'L_sep_weight_yyx': 1.395017832471238e-08, 'L_scale_weight_yyx': 8.624451583677969e-07, 'learning_rate_yyx': 0.009154794706437227}. Best is trial 6 with value: -2.7665796528518882.
[I 2026-03-18 22:31:48,407] Trial 52 finished with value: -2.388871353466084 and parameters: {'n_layers_yyx': 2, 'hidden_size_yyx_l0': 4, 'hidden_size_yyx_l1': 4, 'context_size_yyx': 4, 'num_mix_components_yyx': 3, 'context_extractor_yyx': 'lstm', 'activation_func_yyx': 'ReLU', 'L2_weight_yyx': 2.9435479375742244e-06, 'L_entropy_weight_yyx': 6.160260937700011e-09, 'L_sep_weight_yyx': 6.601107852007617e-06, 'L_scale_weight_yyx': 3.375176144950637e-09, 'learning_rate_yyx': 0.00926745541804609}. Best is trial 29 with value: -2.3960325303152223.
[I 2026-03-18 22:31:50,757] Trial 67 pruned. 
[I 2026-03-18 22:31:54,981] Trial 64 pruned. 
[I 2026-03-18 22:31:57,012] Trial 63 finished with value: -2.4201736292888207 and parameters: {'n_layers_yyx': 2, 'hidden_size_yyx_l0': 5, 'hidden_size_yyx_l1': 6, 'context_size_yyx': 4, 'num_mix_components_yyx': 5, 'context_extractor_yyx': 'lstm', 'activation_func_yyx': 'Tanh', 'L2_weight_yyx': 1.905828798057179e-06, 'L_entropy_weight_yyx': 5.090226664855097e-08, 'L_sep_weight_yyx': 0.0009058167780106727, 'L_scale_weight_yyx': 2.3288400296538083e-10, 'learning_rate_yyx': 0.008945241258042098}. Best is trial 63 with value: -2.4201736292888207.

Source events: 20158
Target events: 11540
Full model ln_yyx : 953.76182 nats/sec, 74.38350 nats/event
Full model Log loss : -2.40786
Full model ln_yyx : 949.08385 nats/sec, 74.01867 nats/event
Full model Log loss : -2.40897
Full model ln_yyx : 956.55036 nats/sec, 74.60098 nats/event
Full model Log loss : -2.41201
Full model ln_yyx : 960.29850 nats/sec, 74.89330 nats/event
Full model Log loss : -2.40829
Full model ln_yyx : 960.66120 nats/sec, 74.92158 nats/event
Full model Log loss : -2.40831
Full model ln_yyx : 951.84656 nats/sec, 74.23413 nats/event
Full model Log loss : -2.40785
Full model ln_yyx : 956.72203 nats/sec, 74.61437 nats/event
Full model Log loss : -2.42010
Full model ln_yyx : 957.03588 nats/sec, 74.63885 nats/event
Full model Log loss : -2.41908
Full model ln_yyx : 956.08559 nats/sec, 74.56473 nats/event
Full model Log loss : -2.42017
Optimization finished. Config saved to results/opt-full/opt_full_168_best_config.txt
[I 2026-03-18 22:31:58,342] Trial 57 pruned. 
[I 2026-03-18 22:31:59,322] Trial 59 pruned. 
[I 2026-03-18 22:32:02,903] Trial 65 pruned. 
[I 2026-03-18 22:32:10,085] Trial 58 pruned. 
[I 2026-03-18 22:32:10,520] Trial 66 pruned. 
[I 2026-03-18 22:32:10,945] Trial 60 pruned. 
[I 2026-03-18 22:32:11,715] Trial 60 finished with value: -2.4303487937899386 and parameters: {'n_layers_yyx': 2, 'hidden_size_yyx_l0': 5, 'hidden_size_yyx_l1': 5, 'context_size_yyx': 3, 'num_mix_components_yyx': 2, 'context_extractor_yyx': 'gru', 'activation_func_yyx': 'Tanh', 'L2_weight_yyx': 8.054512884274198e-07, 'L_entropy_weight_yyx': 2.7586741996343257e-06, 'L_sep_weight_yyx': 3.789808315641145e-07, 'L_scale_weight_yyx': 5.2211937926879755e-09, 'learning_rate_yyx': 0.007319055867976265}. Best is trial 11 with value: -2.43991066579963.
[I 2026-03-18 22:32:12,572] Trial 52 finished with value: -2.3933592497996794 and parameters: {'n_layers_yyx': 2, 'hidden_size_yyx_l0': 4, 'hidden_size_yyx_l1': 5, 'context_size_yyx': 3, 'num_mix_components_yyx': 2, 'context_extractor_yyx': 'lstm', 'activation_func_yyx': 'ReLU', 'L2_weight_yyx': 3.8241493624483684e-05, 'L_entropy_weight_yyx': 1.3309631000034597e-08, 'L_sep_weight_yyx': 1.5974882379724243e-10, 'L_scale_weight_yyx': 9.220668742857475e-10, 'learning_rate_yyx': 0.009561305788020898}. Best is trial 44 with value: -2.4022889279096553.
[I 2026-03-18 22:32:17,890] Trial 67 pruned. 
[I 2026-03-18 22:32:19,887] Trial 65 finished with value: -2.7626483774440174 and parameters: {'n_layers_yyx': 2, 'hidden_size_yyx_l0': 3, 'hidden_size_yyx_l1': 4, 'context_size_yyx': 3, 'num_mix_components_yyx': 3, 'context_extractor_yyx': 'lstm', 'activation_func_yyx': 'Tanh', 'L2_weight_yyx': 6.081461744627482e-09, 'L_entropy_weight_yyx': 1.4339045661964444e-08, 'L_sep_weight_yyx': 2.727472626503474e-06, 'L_scale_weight_yyx': 1.7024153684973995e-10, 'learning_rate_yyx': 0.009013865070991925}. Best is trial 25 with value: -2.762886536950096.
[I 2026-03-18 22:32:21,670] Trial 59 finished with value: -2.7663268089294433 and parameters: {'n_layers_yyx': 2, 'hidden_size_yyx_l0': 6, 'hidden_size_yyx_l1': 5, 'context_size_yyx': 4, 'num_mix_components_yyx': 5, 'context_extractor_yyx': 'gru', 'activation_func_yyx': 'GELU', 'L2_weight_yyx': 7.083541172243481e-07, 'L_entropy_weight_yyx': 8.322876136372661e-10, 'L_sep_weight_yyx': 3.0062140835227494e-05, 'L_scale_weight_yyx': 1.3770356935000749e-07, 'learning_rate_yyx': 0.004245390125384097}. Best is trial 55 with value: -2.7679802735646564.
[I 2026-03-18 22:32:26,941] Trial 38 finished with value: -2.7327241701128586 and parameters: {'n_layers_yyx': 2, 'hidden_size_yyx_l0': 2, 'hidden_size_yyx_l1': 5, 'context_size_yyx': 2, 'num_mix_components_yyx': 1, 'context_extractor_yyx': 'gru', 'activation_func_yyx': 'GELU', 'L2_weight_yyx': 3.660240802139358e-10, 'L_entropy_weight_yyx': 2.2708205758591846e-05, 'L_sep_weight_yyx': 6.705108553493794e-07, 'L_scale_weight_yyx': 1.0315322346875974e-07, 'learning_rate_yyx': 0.008106336526649726}. Best is trial 8 with value: -2.7663050128086293.
[I 2026-03-18 22:32:28,310] Trial 58 pruned. 
[I 2026-03-18 22:32:29,133] Trial 61 pruned. 
[I 2026-03-18 22:32:39,856] Trial 68 finished with value: -2.38545240031963 and parameters: {'n_layers_yyx': 2, 'hidden_size_yyx_l0': 2, 'hidden_size_yyx_l1': 5, 'context_size_yyx': 3, 'num_mix_components_yyx': 5, 'context_extractor_yyx': 'lstm', 'activation_func_yyx': 'GELU', 'L2_weight_yyx': 5.064407894453559e-05, 'L_entropy_weight_yyx': 1.8074442093055985e-07, 'L_sep_weight_yyx': 2.0522758207223143e-07, 'L_scale_weight_yyx': 0.00016296397178610885, 'learning_rate_yyx': 0.009924731418727406}. Best is trial 32 with value: -2.420807459084574.
[I 2026-03-18 22:32:47,734] Trial 69 pruned. 
[I 2026-03-18 22:32:48,943] Trial 62 pruned. 
[I 2026-03-18 22:32:54,514] Trial 57 pruned. 
[I 2026-03-18 22:32:55,122] Trial 70 pruned. 
[I 2026-03-18 22:33:01,293] Trial 48 finished with value: -2.4298988738847944 and parameters: {'n_layers_yyx': 2, 'hidden_size_yyx_l0': 5, 'hidden_size_yyx_l1': 6, 'context_size_yyx': 3, 'num_mix_components_yyx': 3, 'context_extractor_yyx': 'lstm', 'activation_func_yyx': 'Tanh', 'L2_weight_yyx': 0.0008723452401159307, 'L_entropy_weight_yyx': 3.124544096995368e-09, 'L_sep_weight_yyx': 1.8198134556122795e-08, 'L_scale_weight_yyx': 0.00029536823793100845, 'learning_rate_yyx': 0.007570766682720081}. Best is trial 24 with value: -2.4319235459143473.
[I 2026-03-18 22:33:01,601] Trial 84 finished with value: -2.3979405754954466 and parameters: {'n_layers_yyx': 1, 'hidden_size_yyx_l0': 5, 'context_size_yyx': 4, 'num_mix_components_yyx': 4, 'context_extractor_yyx': 'gru', 'activation_func_yyx': 'Tanh', 'L2_weight_yyx': 0.0002635883439706351, 'L_entropy_weight_yyx': 2.7977891430179393e-07, 'L_sep_weight_yyx': 6.731659286454974e-06, 'L_scale_weight_yyx': 1.1672628402998883e-06, 'learning_rate_yyx': 0.007987987552408182}. Best is trial 0 with value: -2.4076941594397367.
[I 2026-03-18 22:33:11,805] Trial 71 pruned. 

Source events: 20158
Target events: 10752
Full model ln_yyx : 888.97382 nats/sec, 74.41187 nats/event
Full model Log loss : -2.41166
Full model ln_yyx : 890.56699 nats/sec, 74.54523 nats/event
Full model Log loss : -2.40843
Full model ln_yyx : 889.13881 nats/sec, 74.42568 nats/event
Full model Log loss : -2.40966
Full model ln_yyx : 887.58255 nats/sec, 74.29541 nats/event
Full model Log loss : -2.42081
Full model ln_yyx : 889.19026 nats/sec, 74.42999 nats/event
Full model Log loss : -2.41144
Full model ln_yyx : 892.65902 nats/sec, 74.72034 nats/event
Full model Log loss : -2.41261
Full model ln_yyx : 884.24035 nats/sec, 74.01565 nats/event
Full model Log loss : -2.38545
Optimization finished. Config saved to results/opt-full/opt_full_161_best_config.txt
[I 2026-03-18 22:33:14,591] Trial 60 finished with value: -2.763467868169149 and parameters: {'n_layers_yyx': 2, 'hidden_size_yyx_l0': 6, 'hidden_size_yyx_l1': 6, 'context_size_yyx': 4, 'num_mix_components_yyx': 5, 'context_extractor_yyx': 'gru', 'activation_func_yyx': 'GELU', 'L2_weight_yyx': 2.022766571580355e-07, 'L_entropy_weight_yyx': 3.9396893499356836e-10, 'L_sep_weight_yyx': 8.410848216816779e-06, 'L_scale_weight_yyx': 6.241906294952041e-08, 'learning_rate_yyx': 0.00913956850544471}. Best is trial 55 with value: -2.7679802735646564.
[I 2026-03-18 22:33:19,102] Trial 61 pruned. 
[I 2026-03-18 22:33:19,997] Trial 49 pruned. 
[I 2026-03-18 22:33:21,078] Trial 53 finished with value: -2.389843881359291 and parameters: {'n_layers_yyx': 2, 'hidden_size_yyx_l0': 4, 'hidden_size_yyx_l1': 4, 'context_size_yyx': 4, 'num_mix_components_yyx': 3, 'context_extractor_yyx': 'lstm', 'activation_func_yyx': 'ReLU', 'L2_weight_yyx': 9.829804589406146e-05, 'L_entropy_weight_yyx': 6.088393103827409e-09, 'L_sep_weight_yyx': 0.00028714242115278365, 'L_scale_weight_yyx': 2.3685665687243563e-08, 'learning_rate_yyx': 0.00891284829296006}. Best is trial 29 with value: -2.3960325303152223.
[I 2026-03-18 22:33:21,569] Trial 85 pruned. 
[I 2026-03-18 22:33:24,915] Trial 54 finished with value: -2.400039700260216 and parameters: {'n_layers_yyx': 2, 'hidden_size_yyx_l0': 6, 'hidden_size_yyx_l1': 3, 'context_size_yyx': 4, 'num_mix_components_yyx': 4, 'context_extractor_yyx': 'lstm', 'activation_func_yyx': 'GELU', 'L2_weight_yyx': 0.00027597329846882544, 'L_entropy_weight_yyx': 3.679584186476551e-05, 'L_sep_weight_yyx': 0.0004854917476048379, 'L_scale_weight_yyx': 3.4023469322569566e-05, 'learning_rate_yyx': 0.009956404055270393}. Best is trial 53 with value: -2.4049037025927396.
[I 2026-03-18 22:33:36,670] Trial 63 pruned. 

Source events: 20158
Target events: 8618
Full model ln_yyx : 716.11871 nats/sec, 74.78613 nats/event
Full model Log loss : -2.42922
Full model ln_yyx : 716.42242 nats/sec, 74.81784 nats/event
Full model Log loss : -2.42933
Full model ln_yyx : 708.37781 nats/sec, 73.97772 nats/event
Full model Log loss : -2.40263
Full model ln_yyx : 711.79359 nats/sec, 74.33444 nats/event
Full model Log loss : -2.43013
Full model ln_yyx : 717.77066 nats/sec, 74.95864 nats/event
Full model Log loss : -2.42440
Full model ln_yyx : 721.21616 nats/sec, 75.31847 nats/event
Full model Log loss : -2.43240
Full model ln_yyx : 719.68973 nats/sec, 75.15906 nats/event
Full model Log loss : -2.43571
Full model ln_yyx : 718.53056 nats/sec, 75.03800 nats/event
Full model Log loss : -2.43035
Optimization finished. Config saved to results/opt-full/opt_full_165_best_config.txt
[I 2026-03-18 22:33:37,213] Trial 68 finished with value: -2.541671931431899 and parameters: {'n_layers_yyx': 2, 'hidden_size_yyx_l0': 2, 'hidden_size_yyx_l1': 6, 'context_size_yyx': 4, 'num_mix_components_yyx': 5, 'context_extractor_yyx': 'gru', 'activation_func_yyx': 'ReLU', 'L2_weight_yyx': 8.044477456274315e-09, 'L_entropy_weight_yyx': 4.303683951391082e-08, 'L_sep_weight_yyx': 1.5874206385718397e-10, 'L_scale_weight_yyx': 5.869434954570112e-10, 'learning_rate_yyx': 0.008965294723808232}. Best is trial 24 with value: -2.5511102316762146.
[I 2026-03-18 22:33:38,741] Trial 61 pruned. 
[I 2026-03-18 22:33:39,236] Trial 50 pruned. 
[I 2026-03-18 22:33:49,350] Trial 59 finished with value: -2.7669037334246385 and parameters: {'n_layers_yyx': 2, 'hidden_size_yyx_l0': 5, 'hidden_size_yyx_l1': 6, 'context_size_yyx': 4, 'num_mix_components_yyx': 4, 'context_extractor_yyx': 'gru', 'activation_func_yyx': 'ReLU', 'L2_weight_yyx': 5.748372741434422e-10, 'L_entropy_weight_yyx': 0.0004367015793824083, 'L_sep_weight_yyx': 0.0005374928461945771, 'L_scale_weight_yyx': 0.00010928264590652098, 'learning_rate_yyx': 0.007882011309157163}. Best is trial 0 with value: -2.7678615354442075.
[I 2026-03-18 22:33:49,386] Trial 66 finished with value: -2.7626257503733918 and parameters: {'n_layers_yyx': 2, 'hidden_size_yyx_l0': 3, 'hidden_size_yyx_l1': 4, 'context_size_yyx': 3, 'num_mix_components_yyx': 3, 'context_extractor_yyx': 'lstm', 'activation_func_yyx': 'Tanh', 'L2_weight_yyx': 2.3564791316033285e-09, 'L_entropy_weight_yyx': 1.5062576748422322e-08, 'L_sep_weight_yyx': 2.891081811322312e-06, 'L_scale_weight_yyx': 4.613879147325478e-09, 'learning_rate_yyx': 0.008805762987795732}. Best is trial 25 with value: -2.762886536950096.
[I 2026-03-18 22:33:49,726] Trial 59 finished with value: -2.398303538706021 and parameters: {'n_layers_yyx': 2, 'hidden_size_yyx_l0': 4, 'hidden_size_yyx_l1': 5, 'context_size_yyx': 1, 'num_mix_components_yyx': 5, 'context_extractor_yyx': 'lstm', 'activation_func_yyx': 'Tanh', 'L2_weight_yyx': 0.00037922743198805947, 'L_entropy_weight_yyx': 4.480006754989467e-08, 'L_sep_weight_yyx': 2.2779869989168803e-05, 'L_scale_weight_yyx': 1.3047037402915868e-08, 'learning_rate_yyx': 0.007694641206918348}. Best is trial 11 with value: -2.4030680672323603.
[I 2026-03-18 22:33:51,601] Trial 69 pruned. 
[I 2026-03-18 22:33:57,318] Trial 51 pruned. 
[I 2026-03-18 22:33:59,236] Trial 67 pruned. 
[I 2026-03-18 22:34:00,178] Trial 60 pruned. 
[I 2026-03-18 22:34:00,509] Trial 54 pruned. 
[I 2026-03-18 22:34:04,891] Trial 55 pruned. 
[I 2026-03-18 22:34:05,127] Trial 70 pruned. 
[I 2026-03-18 22:34:06,672] Trial 53 finished with value: -2.3935891958383415 and parameters: {'n_layers_yyx': 2, 'hidden_size_yyx_l0': 4, 'hidden_size_yyx_l1': 5, 'context_size_yyx': 3, 'num_mix_components_yyx': 2, 'context_extractor_yyx': 'lstm', 'activation_func_yyx': 'ReLU', 'L2_weight_yyx': 3.648403239284016e-05, 'L_entropy_weight_yyx': 1.7923632165934043e-08, 'L_sep_weight_yyx': 5.145734101419723e-10, 'L_scale_weight_yyx': 1.9776964942122673e-08, 'learning_rate_yyx': 0.009822299335448814}. Best is trial 44 with value: -2.4022889279096553.
[I 2026-03-18 22:34:21,798] Trial 68 pruned. 
[I 2026-03-18 22:34:31,302] Trial 69 pruned. 
[I 2026-03-18 22:34:34,583] Trial 60 pruned. 
[I 2026-03-18 22:34:36,345] Trial 62 finished with value: -2.7678240458170573 and parameters: {'n_layers_yyx': 2, 'hidden_size_yyx_l0': 6, 'hidden_size_yyx_l1': 5, 'context_size_yyx': 4, 'num_mix_components_yyx': 5, 'context_extractor_yyx': 'gru', 'activation_func_yyx': 'GELU', 'L2_weight_yyx': 1.5261118306068508e-07, 'L_entropy_weight_yyx': 2.1019668192706115e-10, 'L_sep_weight_yyx': 7.532845559563619e-05, 'L_scale_weight_yyx': 3.597161142357416e-07, 'learning_rate_yyx': 0.007837895829920685}. Best is trial 55 with value: -2.7679802735646564.
[I 2026-03-18 22:34:41,486] Trial 70 pruned. 
[I 2026-03-18 22:34:42,666] Trial 61 pruned. 
[I 2026-03-18 22:34:45,298] Trial 52 pruned. 
[I 2026-03-18 22:34:46,159] Trial 86 finished with value: -2.397562370476446 and parameters: {'n_layers_yyx': 1, 'hidden_size_yyx_l0': 5, 'context_size_yyx': 4, 'num_mix_components_yyx': 4, 'context_extractor_yyx': 'gru', 'activation_func_yyx': 'Tanh', 'L2_weight_yyx': 2.4664502007476966e-05, 'L_entropy_weight_yyx': 3.467086573007383e-06, 'L_sep_weight_yyx': 2.144809595844182e-05, 'L_scale_weight_yyx': 4.5183818315746726e-07, 'learning_rate_yyx': 0.007345975181740933}. Best is trial 0 with value: -2.4076941594397367.
[I 2026-03-18 22:34:52,728] Trial 71 pruned. 
[I 2026-03-18 22:35:00,708] Trial 56 finished with value: -2.3942444458477676 and parameters: {'n_layers_yyx': 2, 'hidden_size_yyx_l0': 6, 'hidden_size_yyx_l1': 3, 'context_size_yyx': 4, 'num_mix_components_yyx': 5, 'context_extractor_yyx': 'lstm', 'activation_func_yyx': 'GELU', 'L2_weight_yyx': 0.0005617940946807803, 'L_entropy_weight_yyx': 5.035497119115297e-05, 'L_sep_weight_yyx': 0.00033566973561570136, 'L_scale_weight_yyx': 3.928176479340409e-05, 'learning_rate_yyx': 0.009916516936701798}. Best is trial 53 with value: -2.4049037025927396.
[I 2026-03-18 22:35:01,736] Trial 39 finished with value: -2.7617907985403765 and parameters: {'n_layers_yyx': 1, 'hidden_size_yyx_l0': 5, 'context_size_yyx': 3, 'num_mix_components_yyx': 5, 'context_extractor_yyx': 'lstm', 'activation_func_yyx': 'ReLU', 'L2_weight_yyx': 1.6072600016323906e-09, 'L_entropy_weight_yyx': 1.2228490278567576e-06, 'L_sep_weight_yyx': 1.956950349472195e-05, 'L_scale_weight_yyx': 1.4945519933002002e-06, 'learning_rate_yyx': 0.004661991565696457}. Best is trial 8 with value: -2.7663050128086293.
[I 2026-03-18 22:35:04,385] Trial 72 pruned. 
[I 2026-03-18 22:35:07,297] Trial 54 finished with value: -2.36227787898137 and parameters: {'n_layers_yyx': 2, 'hidden_size_yyx_l0': 4, 'hidden_size_yyx_l1': 5, 'context_size_yyx': 3, 'num_mix_components_yyx': 1, 'context_extractor_yyx': 'lstm', 'activation_func_yyx': 'ReLU', 'L2_weight_yyx': 3.9843703669061256e-05, 'L_entropy_weight_yyx': 8.477909260721298e-09, 'L_sep_weight_yyx': 6.238540756002021e-10, 'L_scale_weight_yyx': 4.512394783423335e-09, 'learning_rate_yyx': 0.009533883545140473}. Best is trial 44 with value: -2.4022889279096553.
[I 2026-03-18 22:35:16,735] Trial 58 finished with value: -2.765134888968204 and parameters: {'n_layers_yyx': 2, 'hidden_size_yyx_l0': 3, 'hidden_size_yyx_l1': 5, 'context_size_yyx': 1, 'num_mix_components_yyx': 1, 'context_extractor_yyx': 'gru', 'activation_func_yyx': 'ReLU', 'L2_weight_yyx': 2.5283916889357903e-10, 'L_entropy_weight_yyx': 0.00021554973858661468, 'L_sep_weight_yyx': 4.073358525498954e-09, 'L_scale_weight_yyx': 1.6412049029718016e-08, 'learning_rate_yyx': 0.008052986504039643}. Best is trial 6 with value: -2.7665796528518882.
[I 2026-03-18 22:35:24,454] Trial 40 pruned. 
