[I 2026-03-18 22:23:22,277] Trial 53 finished with value: -2.4078493098622746 and parameters: {'n_layers_yyx': 2, 'hidden_size_yyx_l0': 4, 'hidden_size_yyx_l1': 5, 'context_size_yyx': 3, 'num_mix_components_yyx': 5, 'context_extractor_yyx': 'gru', 'activation_func_yyx': 'Tanh', 'L2_weight_yyx': 3.20134501515109e-07, 'L_entropy_weight_yyx': 3.4071857714164716e-06, 'L_sep_weight_yyx': 0.0004318112083997923, 'L_scale_weight_yyx': 1.8076249601346192e-10, 'learning_rate_yyx': 0.008720525519273572}. Best is trial 25 with value: -2.4120091389134988.
[I 2026-03-18 22:23:28,120] Trial 56 pruned. 
[I 2026-03-18 22:23:30,012] Trial 72 pruned. 
[I 2026-03-18 22:23:37,386] Trial 41 pruned. 
[I 2026-03-18 22:23:38,341] Trial 43 pruned. 
[I 2026-03-18 22:23:42,041] Trial 55 pruned. 
[I 2026-03-18 22:23:42,177] Trial 49 finished with value: -2.5392533797650767 and parameters: {'n_layers_yyx': 2, 'hidden_size_yyx_l0': 3, 'hidden_size_yyx_l1': 4, 'context_size_yyx': 4, 'num_mix_components_yyx': 4, 'context_extractor_yyx': 'lstm', 'activation_func_yyx': 'ReLU', 'L2_weight_yyx': 1.8519255298590612e-06, 'L_entropy_weight_yyx': 2.072111431709918e-09, 'L_sep_weight_yyx': 3.598863523888082e-05, 'L_scale_weight_yyx': 2.707228920590315e-06, 'learning_rate_yyx': 0.00352994874723545}. Best is trial 24 with value: -2.5511102316762146.
[I 2026-03-18 22:23:42,775] Trial 54 pruned. 
[I 2026-03-18 22:23:44,286] Trial 57 pruned. 
[I 2026-03-18 22:23:50,511] Trial 50 pruned. 
[I 2026-03-18 22:23:58,448] Trial 51 pruned. 
[I 2026-03-18 22:24:01,264] Trial 39 finished with value: -2.3880865911688525 and parameters: {'n_layers_yyx': 2, 'hidden_size_yyx_l0': 3, 'hidden_size_yyx_l1': 5, 'context_size_yyx': 4, 'num_mix_components_yyx': 5, 'context_extractor_yyx': 'gru', 'activation_func_yyx': 'GELU', 'L2_weight_yyx': 6.868782584320528e-08, 'L_entropy_weight_yyx': 8.516094861280415e-10, 'L_sep_weight_yyx': 6.293783515691007e-10, 'L_scale_weight_yyx': 1.0915973630861706e-07, 'learning_rate_yyx': 0.00880472523982237}. Best is trial 29 with value: -2.3960325303152223.
[I 2026-03-18 22:24:01,356] Trial 55 pruned. 
[I 2026-03-18 22:24:01,846] Trial 47 pruned. 
[I 2026-03-18 22:24:05,632] Trial 52 pruned. 
[I 2026-03-18 22:24:07,903] Trial 47 finished with value: -2.766333777911969 and parameters: {'n_layers_yyx': 2, 'hidden_size_yyx_l0': 4, 'hidden_size_yyx_l1': 5, 'context_size_yyx': 1, 'num_mix_components_yyx': 3, 'context_extractor_yyx': 'gru', 'activation_func_yyx': 'Tanh', 'L2_weight_yyx': 2.4171589205318937e-10, 'L_entropy_weight_yyx': 2.3985750300997003e-05, 'L_sep_weight_yyx': 1.062242034612082e-09, 'L_scale_weight_yyx': 4.074887154560912e-09, 'learning_rate_yyx': 0.008469717380696015}. Best is trial 6 with value: -2.7665796528518882.
[I 2026-03-18 22:24:09,857] Trial 56 pruned. 
[I 2026-03-18 22:24:17,291] Trial 52 finished with value: -2.766386397679647 and parameters: {'n_layers_yyx': 2, 'hidden_size_yyx_l0': 6, 'hidden_size_yyx_l1': 5, 'context_size_yyx': 4, 'num_mix_components_yyx': 5, 'context_extractor_yyx': 'gru', 'activation_func_yyx': 'GELU', 'L2_weight_yyx': 1.290849964984405e-07, 'L_entropy_weight_yyx': 2.2830810608336367e-10, 'L_sep_weight_yyx': 0.0002038363089130451, 'L_scale_weight_yyx': 1.027879793544497e-06, 'learning_rate_yyx': 0.007880405340521217}. Best is trial 44 with value: -2.767513561248779.
[I 2026-03-18 22:24:17,561] Trial 73 pruned. 
[I 2026-03-18 22:24:26,015] Trial 42 pruned. 
[I 2026-03-18 22:24:26,336] Trial 74 pruned. 
[I 2026-03-18 22:24:27,812] Trial 57 pruned. 
[I 2026-03-18 22:24:31,532] Trial 50 finished with value: -2.7654384763081206 and parameters: {'n_layers_yyx': 2, 'hidden_size_yyx_l0': 3, 'hidden_size_yyx_l1': 6, 'context_size_yyx': 4, 'num_mix_components_yyx': 5, 'context_extractor_yyx': 'gru', 'activation_func_yyx': 'GELU', 'L2_weight_yyx': 8.748961055202735e-10, 'L_entropy_weight_yyx': 6.486529267688793e-09, 'L_sep_weight_yyx': 5.081008986805927e-05, 'L_scale_weight_yyx': 0.0005058907899439168, 'learning_rate_yyx': 0.008875483496231653}. Best is trial 0 with value: -2.7678615354442075.
[I 2026-03-18 22:24:35,394] Trial 53 finished with value: -2.432399727866621 and parameters: {'n_layers_yyx': 2, 'hidden_size_yyx_l0': 6, 'hidden_size_yyx_l1': 4, 'context_size_yyx': 3, 'num_mix_components_yyx': 1, 'context_extractor_yyx': 'lstm', 'activation_func_yyx': 'Tanh', 'L2_weight_yyx': 4.7430816043472235e-06, 'L_entropy_weight_yyx': 2.5760942276401194e-05, 'L_sep_weight_yyx': 6.11730762135128e-06, 'L_scale_weight_yyx': 4.1271117732746964e-09, 'learning_rate_yyx': 0.007132680574045781}. Best is trial 11 with value: -2.43991066579963.
[I 2026-03-18 22:24:37,797] Trial 48 pruned. 
[I 2026-03-18 22:24:44,290] Trial 51 pruned. 
[I 2026-03-18 22:24:45,282] Trial 50 finished with value: -2.399918803371732 and parameters: {'n_layers_yyx': 2, 'hidden_size_yyx_l0': 4, 'hidden_size_yyx_l1': 5, 'context_size_yyx': 1, 'num_mix_components_yyx': 5, 'context_extractor_yyx': 'lstm', 'activation_func_yyx': 'Tanh', 'L2_weight_yyx': 0.00010539767119916967, 'L_entropy_weight_yyx': 3.308140003291803e-08, 'L_sep_weight_yyx': 0.0004387848257302382, 'L_scale_weight_yyx': 1.4205096309536347e-09, 'learning_rate_yyx': 0.005705532967608539}. Best is trial 11 with value: -2.4030680672323603.
[I 2026-03-18 22:24:55,273] Trial 32 finished with value: -2.7653399570669004 and parameters: {'n_layers_yyx': 1, 'hidden_size_yyx_l0': 3, 'context_size_yyx': 4, 'num_mix_components_yyx': 5, 'context_extractor_yyx': 'lstm', 'activation_func_yyx': 'ReLU', 'L2_weight_yyx': 6.386796225838263e-06, 'L_entropy_weight_yyx': 5.999238907232247e-06, 'L_sep_weight_yyx': 6.818902814596477e-05, 'L_scale_weight_yyx': 8.886578413386234e-06, 'learning_rate_yyx': 0.009523281586409122}. Best is trial 8 with value: -2.7663050128086293.
[I 2026-03-18 22:25:02,565] Trial 48 pruned. 
[I 2026-03-18 22:25:05,065] Trial 49 pruned. 
[I 2026-03-18 22:25:05,638] Trial 51 pruned. 
[I 2026-03-18 22:25:12,659] Trial 49 pruned. 
[I 2026-03-18 22:25:15,809] Trial 75 pruned. 
[I 2026-03-18 22:25:16,234] Trial 58 pruned. 
[I 2026-03-18 22:25:17,762] Trial 40 finished with value: -2.388861345139156 and parameters: {'n_layers_yyx': 2, 'hidden_size_yyx_l0': 4, 'hidden_size_yyx_l1': 4, 'context_size_yyx': 4, 'num_mix_components_yyx': 3, 'context_extractor_yyx': 'lstm', 'activation_func_yyx': 'ReLU', 'L2_weight_yyx': 1.3188413376715653e-06, 'L_entropy_weight_yyx': 2.873743067694947e-09, 'L_sep_weight_yyx': 6.153977069838807e-06, 'L_scale_weight_yyx': 1.8961113761091727e-09, 'learning_rate_yyx': 0.009769403512148061}. Best is trial 29 with value: -2.3960325303152223.
[I 2026-03-18 22:25:18,722] Trial 53 finished with value: -2.536664419386822 and parameters: {'n_layers_yyx': 2, 'hidden_size_yyx_l0': 2, 'hidden_size_yyx_l1': 5, 'context_size_yyx': 4, 'num_mix_components_yyx': 3, 'context_extractor_yyx': 'lstm', 'activation_func_yyx': 'ReLU', 'L2_weight_yyx': 9.239508287810165e-08, 'L_entropy_weight_yyx': 1.827450394869794e-05, 'L_sep_weight_yyx': 4.0695258059870794e-10, 'L_scale_weight_yyx': 5.490809596008265e-07, 'learning_rate_yyx': 0.008602176647534333}. Best is trial 24 with value: -2.5511102316762146.
[I 2026-03-18 22:25:21,420] Trial 54 pruned. 
[I 2026-03-18 22:25:24,362] Trial 33 pruned. 
[I 2026-03-18 22:25:25,728] Trial 41 pruned. 
[I 2026-03-18 22:25:26,126] Trial 53 finished with value: -2.7666392803192137 and parameters: {'n_layers_yyx': 2, 'hidden_size_yyx_l0': 6, 'hidden_size_yyx_l1': 5, 'context_size_yyx': 4, 'num_mix_components_yyx': 5, 'context_extractor_yyx': 'gru', 'activation_func_yyx': 'GELU', 'L2_weight_yyx': 3.554957145205042e-07, 'L_entropy_weight_yyx': 1.3295267366442798e-09, 'L_sep_weight_yyx': 0.00025538769640109823, 'L_scale_weight_yyx': 1.2129640575510863e-07, 'learning_rate_yyx': 0.008276146689707832}. Best is trial 44 with value: -2.767513561248779.
[I 2026-03-18 22:25:29,119] Trial 55 pruned. 
[I 2026-03-18 22:25:31,510] Trial 50 pruned. 
[I 2026-03-18 22:25:34,488] Trial 76 pruned. 
[I 2026-03-18 22:25:54,894] Trial 43 finished with value: -2.7632603409266707 and parameters: {'n_layers_yyx': 2, 'hidden_size_yyx_l0': 5, 'hidden_size_yyx_l1': 2, 'context_size_yyx': 3, 'num_mix_components_yyx': 4, 'context_extractor_yyx': 'gru', 'activation_func_yyx': 'GELU', 'L2_weight_yyx': 5.6090248914536825e-06, 'L_entropy_weight_yyx': 0.00010623292166596539, 'L_sep_weight_yyx': 6.441599294224868e-07, 'L_scale_weight_yyx': 7.151416966370588e-05, 'learning_rate_yyx': 0.0017525472176245721}. Best is trial 7 with value: -2.766072426816335.
[I 2026-03-18 22:25:57,168] Trial 51 pruned. 
[I 2026-03-18 22:26:01,597] Trial 56 pruned. 
[I 2026-03-18 22:26:05,531] Trial 54 pruned. 
[I 2026-03-18 22:26:08,974] Trial 44 finished with value: -2.4022889279096553 and parameters: {'n_layers_yyx': 2, 'hidden_size_yyx_l0': 3, 'hidden_size_yyx_l1': 4, 'context_size_yyx': 2, 'num_mix_components_yyx': 3, 'context_extractor_yyx': 'lstm', 'activation_func_yyx': 'ReLU', 'L2_weight_yyx': 0.0001614021784712975, 'L_entropy_weight_yyx': 2.2382568153379617e-09, 'L_sep_weight_yyx': 9.456010396635542e-10, 'L_scale_weight_yyx': 4.6281093663028715e-09, 'learning_rate_yyx': 0.009048969544386163}. Best is trial 44 with value: -2.4022889279096553.
[I 2026-03-18 22:26:09,814] Trial 57 pruned. 
[I 2026-03-18 22:26:10,480] Trial 50 pruned. 
[I 2026-03-18 22:26:12,618] Trial 42 pruned. 
[I 2026-03-18 22:26:17,681] Trial 58 pruned. 
[I 2026-03-18 22:26:19,873] Trial 44 pruned. 
[I 2026-03-18 22:26:21,635] Trial 52 pruned. 
[I 2026-03-18 22:26:22,369] Trial 55 pruned. 
[I 2026-03-18 22:26:31,053] Trial 45 pruned. 
[I 2026-03-18 22:26:32,727] Trial 51 pruned. 
[I 2026-03-18 22:26:36,015] Trial 54 pruned. 
[I 2026-03-18 22:26:39,269] Trial 34 finished with value: -2.765001868455631 and parameters: {'n_layers_yyx': 1, 'hidden_size_yyx_l0': 4, 'context_size_yyx': 4, 'num_mix_components_yyx': 5, 'context_extractor_yyx': 'lstm', 'activation_func_yyx': 'ReLU', 'L2_weight_yyx': 2.0549233374796765e-05, 'L_entropy_weight_yyx': 1.5491055245660373e-05, 'L_sep_weight_yyx': 7.965502131982225e-06, 'L_scale_weight_yyx': 0.0001543747327582634, 'learning_rate_yyx': 0.009512067035857377}. Best is trial 8 with value: -2.7663050128086293.
[I 2026-03-18 22:26:41,785] Trial 46 pruned. 
[I 2026-03-18 22:26:49,432] Trial 52 finished with value: -2.4001850361886374 and parameters: {'n_layers_yyx': 2, 'hidden_size_yyx_l0': 4, 'hidden_size_yyx_l1': 5, 'context_size_yyx': 1, 'num_mix_components_yyx': 5, 'context_extractor_yyx': 'lstm', 'activation_func_yyx': 'Tanh', 'L2_weight_yyx': 4.9925952338987225e-05, 'L_entropy_weight_yyx': 2.638993242182022e-08, 'L_sep_weight_yyx': 0.00014771546615519727, 'L_scale_weight_yyx': 2.2635309047966527e-09, 'learning_rate_yyx': 0.006001642279371994}. Best is trial 11 with value: -2.4030680672323603.
[I 2026-03-18 22:26:59,199] Trial 43 finished with value: -2.420974893227146 and parameters: {'n_layers_yyx': 1, 'hidden_size_yyx_l0': 4, 'context_size_yyx': 4, 'num_mix_components_yyx': 1, 'context_extractor_yyx': 'lstm', 'activation_func_yyx': 'Tanh', 'L2_weight_yyx': 9.805870175152033e-07, 'L_entropy_weight_yyx': 3.221278055399108e-08, 'L_sep_weight_yyx': 2.9289890100982118e-06, 'L_scale_weight_yyx': 3.4909722763544583e-07, 'learning_rate_yyx': 0.007652398168412522}. Best is trial 24 with value: -2.4319235459143473.
[I 2026-03-18 22:27:03,023] Trial 59 pruned. 
[I 2026-03-18 22:27:06,880] Trial 56 pruned. 
[I 2026-03-18 22:27:07,373] Trial 47 pruned. 
[I 2026-03-18 22:27:09,490] Trial 53 pruned. 
[I 2026-03-18 22:27:11,320] Trial 60 pruned. 
[I 2026-03-18 22:27:12,400] Trial 59 finished with value: -2.4200970521907217 and parameters: {'n_layers_yyx': 2, 'hidden_size_yyx_l0': 5, 'hidden_size_yyx_l1': 6, 'context_size_yyx': 4, 'num_mix_components_yyx': 5, 'context_extractor_yyx': 'lstm', 'activation_func_yyx': 'Tanh', 'L2_weight_yyx': 2.7759389193146246e-07, 'L_entropy_weight_yyx': 1.0747036276809654e-07, 'L_sep_weight_yyx': 0.0009025703791915203, 'L_scale_weight_yyx': 3.093717717457304e-09, 'learning_rate_yyx': 0.00909330239467397}. Best is trial 59 with value: -2.4200970521907217.
[I 2026-03-18 22:27:13,580] Trial 45 finished with value: -2.35527102739383 and parameters: {'n_layers_yyx': 2, 'hidden_size_yyx_l0': 3, 'hidden_size_yyx_l1': 4, 'context_size_yyx': 2, 'num_mix_components_yyx': 4, 'context_extractor_yyx': 'lstm', 'activation_func_yyx': 'ReLU', 'L2_weight_yyx': 8.007322896071949e-05, 'L_entropy_weight_yyx': 7.2422886464717254e-09, 'L_sep_weight_yyx': 3.8295869682966563e-10, 'L_scale_weight_yyx': 8.583135850087948e-09, 'learning_rate_yyx': 0.008258512902210578}. Best is trial 44 with value: -2.4022889279096553.
[I 2026-03-18 22:27:16,784] Trial 52 finished with value: -2.7548620007209657 and parameters: {'n_layers_yyx': 2, 'hidden_size_yyx_l0': 4, 'hidden_size_yyx_l1': 4, 'context_size_yyx': 1, 'num_mix_components_yyx': 4, 'context_extractor_yyx': 'gru', 'activation_func_yyx': 'Tanh', 'L2_weight_yyx': 1.6212353329850382e-09, 'L_entropy_weight_yyx': 2.827383731058487e-05, 'L_sep_weight_yyx': 3.475439314994931e-08, 'L_scale_weight_yyx': 2.6981967374104515e-08, 'learning_rate_yyx': 0.00887978302328119}. Best is trial 6 with value: -2.7665796528518882.
[I 2026-03-18 22:27:17,575] Trial 44 pruned. 
[I 2026-03-18 22:27:18,488] Trial 54 pruned. 
[I 2026-03-18 22:27:19,028] Trial 48 pruned. 
[I 2026-03-18 22:27:20,713] Trial 60 pruned. 
[I 2026-03-18 22:27:20,808] Trial 77 finished with value: -2.3971957367710606 and parameters: {'n_layers_yyx': 1, 'hidden_size_yyx_l0': 6, 'context_size_yyx': 4, 'num_mix_components_yyx': 4, 'context_extractor_yyx': 'gru', 'activation_func_yyx': 'Tanh', 'L2_weight_yyx': 0.00023659331692007563, 'L_entropy_weight_yyx': 4.1232248340267426e-07, 'L_sep_weight_yyx': 3.901796354087992e-05, 'L_scale_weight_yyx': 4.830484308784205e-07, 'learning_rate_yyx': 0.005498873256141498}. Best is trial 0 with value: -2.4076941594397367.
[I 2026-03-18 22:27:22,626] Trial 46 pruned. 
[I 2026-03-18 22:27:23,638] Trial 57 pruned. 
[I 2026-03-18 22:27:25,513] Trial 45 pruned. 
[I 2026-03-18 22:27:26,268] Trial 43 finished with value: -2.388009699069626 and parameters: {'n_layers_yyx': 2, 'hidden_size_yyx_l0': 4, 'hidden_size_yyx_l1': 4, 'context_size_yyx': 4, 'num_mix_components_yyx': 3, 'context_extractor_yyx': 'lstm', 'activation_func_yyx': 'ReLU', 'L2_weight_yyx': 1.2687421535599628e-06, 'L_entropy_weight_yyx': 9.994400639617727e-10, 'L_sep_weight_yyx': 3.909244490979329e-08, 'L_scale_weight_yyx': 4.6484516721556307e-10, 'learning_rate_yyx': 0.007339979506336407}. Best is trial 29 with value: -2.3960325303152223.
[I 2026-03-18 22:27:28,835] Trial 78 pruned. 
[I 2026-03-18 22:27:29,953] Trial 49 pruned. 
[I 2026-03-18 22:27:32,631] Trial 58 finished with value: -2.7615964022549715 and parameters: {'n_layers_yyx': 2, 'hidden_size_yyx_l0': 3, 'hidden_size_yyx_l1': 3, 'context_size_yyx': 3, 'num_mix_components_yyx': 3, 'context_extractor_yyx': 'lstm', 'activation_func_yyx': 'Tanh', 'L2_weight_yyx': 1.3204844951329462e-08, 'L_entropy_weight_yyx': 5.67569327378497e-09, 'L_sep_weight_yyx': 4.007342894019612e-06, 'L_scale_weight_yyx': 4.448347611322741e-10, 'learning_rate_yyx': 0.0028465983720810514}. Best is trial 25 with value: -2.762886536950096.
[I 2026-03-18 22:27:34,936] Trial 44 pruned. 
[I 2026-03-18 22:27:57,284] Trial 50 pruned. 
[I 2026-03-18 22:27:57,710] Trial 61 pruned. 
[I 2026-03-18 22:28:00,555] Trial 55 finished with value: -2.7679802735646564 and parameters: {'n_layers_yyx': 2, 'hidden_size_yyx_l0': 6, 'hidden_size_yyx_l1': 5, 'context_size_yyx': 4, 'num_mix_components_yyx': 5, 'context_extractor_yyx': 'gru', 'activation_func_yyx': 'GELU', 'L2_weight_yyx': 1.9573621862263983e-07, 'L_entropy_weight_yyx': 2.3078084119720905e-10, 'L_sep_weight_yyx': 5.816415189129721e-05, 'L_scale_weight_yyx': 5.891146737259718e-08, 'learning_rate_yyx': 0.006800524548406749}. Best is trial 55 with value: -2.7679802735646564.
[I 2026-03-18 22:28:02,296] Trial 59 pruned. 
[I 2026-03-18 22:28:04,750] Trial 35 pruned. 
[I 2026-03-18 22:28:08,913] Trial 51 pruned. 
[I 2026-03-18 22:28:11,452] Trial 61 pruned. 
[I 2026-03-18 22:28:19,141] Trial 79 pruned. 
[I 2026-03-18 22:28:20,271] Trial 52 pruned. 
[I 2026-03-18 22:28:22,894] Trial 56 finished with value: -2.4357100493222648 and parameters: {'n_layers_yyx': 2, 'hidden_size_yyx_l0': 5, 'hidden_size_yyx_l1': 5, 'context_size_yyx': 3, 'num_mix_components_yyx': 2, 'context_extractor_yyx': 'lstm', 'activation_func_yyx': 'Tanh', 'L2_weight_yyx': 7.346452934077488e-08, 'L_entropy_weight_yyx': 9.647841124002904e-06, 'L_sep_weight_yyx': 1.254379353669038e-06, 'L_scale_weight_yyx': 1.266974994262522e-08, 'learning_rate_yyx': 0.006201025413511014}. Best is trial 11 with value: -2.43991066579963.
[I 2026-03-18 22:28:26,627] Trial 53 pruned. 
[I 2026-03-18 22:28:31,650] Trial 52 finished with value: -2.4036061299406994 and parameters: {'n_layers_yyx': 2, 'hidden_size_yyx_l0': 6, 'hidden_size_yyx_l1': 4, 'context_size_yyx': 4, 'num_mix_components_yyx': 4, 'context_extractor_yyx': 'lstm', 'activation_func_yyx': 'GELU', 'L2_weight_yyx': 0.0004199158374968098, 'L_entropy_weight_yyx': 3.375397525516094e-05, 'L_sep_weight_yyx': 8.785321729192488e-06, 'L_scale_weight_yyx': 4.264654928625538e-05, 'learning_rate_yyx': 0.009805722461464026}. Best is trial 52 with value: -2.4036061299406994.
[I 2026-03-18 22:28:41,831] Trial 57 pruned. 
[I 2026-03-18 22:28:48,715] Trial 53 pruned. 
[I 2026-03-18 22:28:50,365] Trial 53 finished with value: -2.765602932587425 and parameters: {'n_layers_yyx': 2, 'hidden_size_yyx_l0': 3, 'hidden_size_yyx_l1': 6, 'context_size_yyx': 4, 'num_mix_components_yyx': 5, 'context_extractor_yyx': 'gru', 'activation_func_yyx': 'GELU', 'L2_weight_yyx': 2.9013214329239602e-09, 'L_entropy_weight_yyx': 1.500217969531275e-08, 'L_sep_weight_yyx': 0.0006062798311189752, 'L_scale_weight_yyx': 0.0009384417980933199, 'learning_rate_yyx': 0.009028228911482576}. Best is trial 0 with value: -2.7678615354442075.
[I 2026-03-18 22:28:54,599] Trial 54 pruned. 
[I 2026-03-18 22:28:59,352] Trial 58 pruned. 
[I 2026-03-18 22:29:02,780] Trial 54 pruned. 
[I 2026-03-18 22:29:07,765] Trial 47 finished with value: -2.3922650459485175 and parameters: {'n_layers_yyx': 2, 'hidden_size_yyx_l0': 4, 'hidden_size_yyx_l1': 5, 'context_size_yyx': 3, 'num_mix_components_yyx': 2, 'context_extractor_yyx': 'lstm', 'activation_func_yyx': 'ReLU', 'L2_weight_yyx': 3.6199846510700556e-05, 'L_entropy_weight_yyx': 2.0507358088667248e-08, 'L_sep_weight_yyx': 1.025778251949167e-10, 'L_scale_weight_yyx': 8.65882121133514e-10, 'learning_rate_yyx': 0.009251391615983642}. Best is trial 44 with value: -2.4022889279096553.
[I 2026-03-18 22:29:09,483] Trial 45 finished with value: -2.3898860883505075 and parameters: {'n_layers_yyx': 2, 'hidden_size_yyx_l0': 4, 'hidden_size_yyx_l1': 4, 'context_size_yyx': 4, 'num_mix_components_yyx': 3, 'context_extractor_yyx': 'lstm', 'activation_func_yyx': 'ReLU', 'L2_weight_yyx': 0.00013071975196684286, 'L_entropy_weight_yyx': 1.7800767936815775e-10, 'L_sep_weight_yyx': 8.369604084039883e-05, 'L_scale_weight_yyx': 2.5778976843841053e-07, 'learning_rate_yyx': 0.008600860341035986}. Best is trial 29 with value: -2.3960325303152223.
[I 2026-03-18 22:29:13,708] Trial 56 pruned. 
[I 2026-03-18 22:29:15,277] Trial 54 pruned. 
[I 2026-03-18 22:29:17,224] Trial 48 pruned. 
[I 2026-03-18 22:29:17,838] Trial 46 pruned. 
[I 2026-03-18 22:29:20,143] Trial 60 pruned. 
[I 2026-03-18 22:29:20,344] Trial 55 pruned. 
[I 2026-03-18 22:29:29,505] Trial 55 pruned. 
[I 2026-03-18 22:29:32,237] Trial 36 finished with value: -2.7649777090378502 and parameters: {'n_layers_yyx': 1, 'hidden_size_yyx_l0': 5, 'context_size_yyx': 4, 'num_mix_components_yyx': 4, 'context_extractor_yyx': 'lstm', 'activation_func_yyx': 'Tanh', 'L2_weight_yyx': 9.758375101063468e-07, 'L_entropy_weight_yyx': 5.558452468289293e-06, 'L_sep_weight_yyx': 4.9954845908246224e-05, 'L_scale_weight_yyx': 0.0002861461212668341, 'learning_rate_yyx': 0.0069534505684389425}. Best is trial 8 with value: -2.7663050128086293.
[I 2026-03-18 22:29:35,382] Trial 58 pruned. 
[I 2026-03-18 22:29:35,868] Trial 47 pruned. 
[I 2026-03-18 22:29:38,152] Trial 49 pruned. 
[I 2026-03-18 22:29:38,727] Trial 55 finished with value: -2.4024873648934166 and parameters: {'n_layers_yyx': 2, 'hidden_size_yyx_l0': 3, 'hidden_size_yyx_l1': 6, 'context_size_yyx': 1, 'num_mix_components_yyx': 5, 'context_extractor_yyx': 'lstm', 'activation_func_yyx': 'Tanh', 'L2_weight_yyx': 6.776809341948363e-05, 'L_entropy_weight_yyx': 1.3671971296437335e-09, 'L_sep_weight_yyx': 0.00024841886318030445, 'L_scale_weight_yyx': 5.646028810307623e-09, 'learning_rate_yyx': 0.00568748683339785}. Best is trial 11 with value: -2.4030680672323603.
[I 2026-03-18 22:29:43,171] Trial 80 finished with value: -2.397726623629105 and parameters: {'n_layers_yyx': 1, 'hidden_size_yyx_l0': 5, 'context_size_yyx': 4, 'num_mix_components_yyx': 4, 'context_extractor_yyx': 'gru', 'activation_func_yyx': 'Tanh', 'L2_weight_yyx': 0.0001530263026197306, 'L_entropy_weight_yyx': 7.695942759167773e-08, 'L_sep_weight_yyx': 1.2077352206048577e-05, 'L_scale_weight_yyx': 1.2607194515877703e-06, 'learning_rate_yyx': 0.007423972256838938}. Best is trial 0 with value: -2.4076941594397367.
[I 2026-03-18 22:29:43,755] Trial 55 pruned. 
[I 2026-03-18 22:29:43,851] Trial 37 pruned. 
[I 2026-03-18 22:29:45,760] Trial 59 pruned. 
[I 2026-03-18 22:29:46,888] Trial 50 pruned. 
[I 2026-03-18 22:29:47,349] Trial 61 pruned. 
[I 2026-03-18 22:29:53,499] Trial 48 pruned. 
[I 2026-03-18 22:29:55,320] Trial 46 pruned. 
[I 2026-03-18 22:29:56,679] Trial 51 pruned. 
[I 2026-03-18 22:29:57,166] Trial 56 pruned. 
[I 2026-03-18 22:29:59,563] Trial 62 pruned. 
[I 2026-03-18 22:30:00,895] Trial 49 pruned. 
[I 2026-03-18 22:30:00,897] Trial 81 pruned. 
[I 2026-03-18 22:30:08,673] Trial 57 pruned. 
