[I 2026-03-18 20:16:46,829] Trial 8 finished with value: -1.304496319110577 and parameters: {'n_layers_yyx': 2, 'hidden_size_yyx_l0': 2, 'hidden_size_yyx_l1': 2, 'context_size_yyx': 1, 'num_mix_components_yyx': 3, 'context_extractor_yyx': 'lstm', 'activation_func_yyx': 'Tanh', 'L2_weight_yyx': 1.7471621776655668e-09, 'L_entropy_weight_yyx': 4.499780944806082e-09, 'L_sep_weight_yyx': 5.727247965052753e-05, 'L_scale_weight_yyx': 8.423335006407895e-07, 'learning_rate_yyx': 0.0010515280849164726}. Best is trial 2 with value: -1.4517343374399039.
[I 2026-03-18 20:17:00,573] Trial 5 pruned. 
[I 2026-03-18 20:17:24,467] Trial 12 pruned. 
[I 2026-03-18 20:17:40,720] Trial 6 pruned. 
[I 2026-03-18 20:17:42,915] Trial 11 pruned. 
[I 2026-03-18 20:17:58,819] Trial 6 finished with value: -1.4129290301983173 and parameters: {'n_layers_yyx': 2, 'hidden_size_yyx_l0': 6, 'hidden_size_yyx_l1': 6, 'context_size_yyx': 4, 'num_mix_components_yyx': 5, 'context_extractor_yyx': 'gru', 'activation_func_yyx': 'ReLU', 'L2_weight_yyx': 0.0009164612651092147, 'L_entropy_weight_yyx': 1.961950387361294e-09, 'L_sep_weight_yyx': 5.09002004855312e-05, 'L_scale_weight_yyx': 0.0005460371805936216, 'learning_rate_yyx': 0.0006301402433161273}. Best is trial 3 with value: -1.4510111647385817.
[I 2026-03-18 20:18:06,806] Trial 6 pruned. 
[I 2026-03-18 20:18:14,962] Trial 3 finished with value: -1.8548018891036469 and parameters: {'n_layers_yyx': 1, 'hidden_size_yyx_l0': 5, 'context_size_yyx': 2, 'num_mix_components_yyx': 5, 'context_extractor_yyx': 'lstm', 'activation_func_yyx': 'ReLU', 'L2_weight_yyx': 2.3162853149022265e-08, 'L_entropy_weight_yyx': 2.7550679089894287e-06, 'L_sep_weight_yyx': 3.302108488713038e-05, 'L_scale_weight_yyx': 4.672885235817768e-10, 'learning_rate_yyx': 0.007974521814658722}. Best is trial 0 with value: -1.8605448616434945.
[I 2026-03-18 20:18:39,141] Trial 7 finished with value: -1.4538350266676683 and parameters: {'n_layers_yyx': 1, 'hidden_size_yyx_l0': 5, 'context_size_yyx': 2, 'num_mix_components_yyx': 4, 'context_extractor_yyx': 'lstm', 'activation_func_yyx': 'ReLU', 'L2_weight_yyx': 0.00013764728291511277, 'L_entropy_weight_yyx': 5.485293429282311e-08, 'L_sep_weight_yyx': 1.1088880779668577e-07, 'L_scale_weight_yyx': 2.34931033298669e-09, 'learning_rate_yyx': 0.009334127384067671}. Best is trial 7 with value: -1.4538350266676683.
[I 2026-03-18 20:18:52,369] Trial 4 finished with value: -1.8468073937975473 and parameters: {'n_layers_yyx': 2, 'hidden_size_yyx_l0': 2, 'hidden_size_yyx_l1': 4, 'context_size_yyx': 4, 'num_mix_components_yyx': 5, 'context_extractor_yyx': 'lstm', 'activation_func_yyx': 'GELU', 'L2_weight_yyx': 2.761827029759231e-08, 'L_entropy_weight_yyx': 7.514469160952355e-05, 'L_sep_weight_yyx': 6.262253376485974e-05, 'L_scale_weight_yyx': 6.496818001148227e-08, 'learning_rate_yyx': 0.008733970714184193}. Best is trial 4 with value: -1.8468073937975473.
[I 2026-03-18 20:18:54,050] Trial 3 finished with value: -1.7860129616477274 and parameters: {'n_layers_yyx': 1, 'hidden_size_yyx_l0': 4, 'context_size_yyx': 3, 'num_mix_components_yyx': 4, 'context_extractor_yyx': 'gru', 'activation_func_yyx': 'Tanh', 'L2_weight_yyx': 3.207924618125519e-05, 'L_entropy_weight_yyx': 4.313141993694628e-09, 'L_sep_weight_yyx': 1.9229870949864106e-06, 'L_scale_weight_yyx': 4.1471284786084635e-10, 'learning_rate_yyx': 0.007282843123799434}. Best is trial 0 with value: -1.7873705314867425.
[I 2026-03-18 20:18:55,499] Trial 13 pruned. 
[I 2026-03-18 20:19:03,927] Trial 7 pruned. 
[I 2026-03-18 20:19:14,102] Trial 9 pruned. 
[I 2026-03-18 20:19:17,463] Trial 4 finished with value: -1.896486501584108 and parameters: {'n_layers_yyx': 2, 'hidden_size_yyx_l0': 5, 'hidden_size_yyx_l1': 6, 'context_size_yyx': 4, 'num_mix_components_yyx': 5, 'context_extractor_yyx': 'lstm', 'activation_func_yyx': 'ReLU', 'L2_weight_yyx': 0.00015331669956511425, 'L_entropy_weight_yyx': 9.05024419639729e-08, 'L_sep_weight_yyx': 4.4839809115944323e-08, 'L_scale_weight_yyx': 3.1847392300164726e-08, 'learning_rate_yyx': 0.0032203862013022856}. Best is trial 4 with value: -1.896486501584108.
[I 2026-03-18 20:19:35,154] Trial 4 pruned. 
[I 2026-03-18 20:19:45,694] Trial 13 pruned. 
[I 2026-03-18 20:19:53,694] Trial 8 pruned. 
[I 2026-03-18 20:20:17,668] Trial 4 pruned. 
[I 2026-03-18 20:20:20,946] Trial 5 pruned. 
[I 2026-03-18 20:20:25,651] Trial 4 finished with value: -1.9284182429031842 and parameters: {'n_layers_yyx': 2, 'hidden_size_yyx_l0': 4, 'hidden_size_yyx_l1': 4, 'context_size_yyx': 3, 'num_mix_components_yyx': 2, 'context_extractor_yyx': 'lstm', 'activation_func_yyx': 'ReLU', 'L2_weight_yyx': 2.5468148723220906e-09, 'L_entropy_weight_yyx': 2.6176024647295526e-06, 'L_sep_weight_yyx': 7.583213986617552e-09, 'L_scale_weight_yyx': 4.1375276766091744e-05, 'learning_rate_yyx': 0.004283212073041504}. Best is trial 1 with value: -1.9300911785393273.
[I 2026-03-18 20:20:28,809] Trial 14 pruned. 
[I 2026-03-18 20:21:38,366] Trial 6 pruned. 
[I 2026-03-18 20:21:42,092] Trial 5 pruned. 
[I 2026-03-18 20:21:43,576] Trial 5 pruned. 
[I 2026-03-18 20:21:46,164] Trial 15 pruned. 
[I 2026-03-18 20:21:52,033] Trial 3 finished with value: -1.8531461032438798 and parameters: {'n_layers_yyx': 2, 'hidden_size_yyx_l0': 4, 'hidden_size_yyx_l1': 6, 'context_size_yyx': 3, 'num_mix_components_yyx': 2, 'context_extractor_yyx': 'gru', 'activation_func_yyx': 'GELU', 'L2_weight_yyx': 3.441734259254581e-06, 'L_entropy_weight_yyx': 4.8379404130096045e-05, 'L_sep_weight_yyx': 5.828364941673014e-08, 'L_scale_weight_yyx': 0.00038017919285602414, 'learning_rate_yyx': 0.0017623263254904532}. Best is trial 0 with value: -1.867639598732223.
[I 2026-03-18 20:22:37,558] Trial 6 pruned. 
[I 2026-03-18 20:23:06,727] Trial 7 pruned. 
[I 2026-03-18 20:23:13,856] Trial 6 pruned. 
[I 2026-03-18 20:23:17,547] Trial 16 pruned. 
[I 2026-03-18 20:23:46,503] Trial 6 finished with value: -2.4539701905401583 and parameters: {'n_layers_yyx': 2, 'hidden_size_yyx_l0': 2, 'hidden_size_yyx_l1': 6, 'context_size_yyx': 1, 'num_mix_components_yyx': 1, 'context_extractor_yyx': 'lstm', 'activation_func_yyx': 'Tanh', 'L2_weight_yyx': 1.681753480500508e-10, 'L_entropy_weight_yyx': 9.374786022366277e-07, 'L_sep_weight_yyx': 2.7706590880179023e-09, 'L_scale_weight_yyx': 6.037682199827269e-09, 'learning_rate_yyx': 0.002808812404418269}. Best is trial 0 with value: -2.4805296636382916.
[I 2026-03-18 20:23:53,326] Trial 7 pruned. 
[I 2026-03-18 20:24:02,478] Trial 5 finished with value: -1.8557040462514942 and parameters: {'n_layers_yyx': 2, 'hidden_size_yyx_l0': 2, 'hidden_size_yyx_l1': 4, 'context_size_yyx': 1, 'num_mix_components_yyx': 2, 'context_extractor_yyx': 'lstm', 'activation_func_yyx': 'GELU', 'L2_weight_yyx': 2.1598313991979648e-10, 'L_entropy_weight_yyx': 0.0007770986089356151, 'L_sep_weight_yyx': 4.139556270955805e-07, 'L_scale_weight_yyx': 2.3709664484802296e-08, 'learning_rate_yyx': 0.003421781815085399}. Best is trial 0 with value: -1.9368961358079142.
[I 2026-03-18 20:24:02,717] Trial 11 finished with value: -1.4558827092097355 and parameters: {'n_layers_yyx': 2, 'hidden_size_yyx_l0': 3, 'hidden_size_yyx_l1': 4, 'context_size_yyx': 2, 'num_mix_components_yyx': 3, 'context_extractor_yyx': 'gru', 'activation_func_yyx': 'Tanh', 'L2_weight_yyx': 7.059155023074509e-09, 'L_entropy_weight_yyx': 1.1719901493114366e-05, 'L_sep_weight_yyx': 1.709874233944235e-05, 'L_scale_weight_yyx': 3.6214423105179164e-09, 'learning_rate_yyx': 0.009290758127303018}. Best is trial 2 with value: -1.4588211763822116.
[I 2026-03-18 20:24:10,234] Trial 7 pruned. 
[I 2026-03-18 20:24:10,625] Trial 10 finished with value: -1.5115451473358263 and parameters: {'n_layers_yyx': 2, 'hidden_size_yyx_l0': 5, 'hidden_size_yyx_l1': 6, 'context_size_yyx': 2, 'num_mix_components_yyx': 3, 'context_extractor_yyx': 'lstm', 'activation_func_yyx': 'Tanh', 'L2_weight_yyx': 1.0904410876746254e-06, 'L_entropy_weight_yyx': 2.996150421167904e-08, 'L_sep_weight_yyx': 2.148863707849499e-08, 'L_scale_weight_yyx': 0.0008924601449379796, 'learning_rate_yyx': 0.0006282831527498569}. Best is trial 0 with value: -1.5474254567427992.
[I 2026-03-18 20:24:20,029] Trial 7 pruned. 
[I 2026-03-18 20:24:34,086] Trial 8 pruned. 
[I 2026-03-18 20:24:42,552] Trial 7 pruned. 
[I 2026-03-18 20:25:14,842] Trial 8 pruned. 
[I 2026-03-18 20:25:21,534] Trial 8 pruned. 
[I 2026-03-18 20:25:29,297] Trial 5 finished with value: -2.444277072937464 and parameters: {'n_layers_yyx': 2, 'hidden_size_yyx_l0': 5, 'hidden_size_yyx_l1': 4, 'context_size_yyx': 2, 'num_mix_components_yyx': 1, 'context_extractor_yyx': 'gru', 'activation_func_yyx': 'GELU', 'L2_weight_yyx': 5.587899742390019e-08, 'L_entropy_weight_yyx': 1.2701576968979711e-05, 'L_sep_weight_yyx': 2.8460073355114546e-05, 'L_scale_weight_yyx': 1.3826721206279059e-05, 'learning_rate_yyx': 0.0027036837961960285}. Best is trial 1 with value: -2.4633966237885176.
[I 2026-03-18 20:25:44,361] Trial 8 pruned. 
[I 2026-03-18 20:25:44,402] Trial 9 pruned. 
[I 2026-03-18 20:25:52,356] Trial 5 pruned. 
[I 2026-03-18 20:25:53,144] Trial 8 finished with value: -1.8480679036345344 and parameters: {'n_layers_yyx': 1, 'hidden_size_yyx_l0': 5, 'context_size_yyx': 4, 'num_mix_components_yyx': 5, 'context_extractor_yyx': 'gru', 'activation_func_yyx': 'Tanh', 'L2_weight_yyx': 6.422294564821378e-07, 'L_entropy_weight_yyx': 7.140793353501286e-06, 'L_sep_weight_yyx': 0.0006148374606350967, 'L_scale_weight_yyx': 3.220720811007874e-09, 'learning_rate_yyx': 0.007748424013927148}. Best is trial 0 with value: -1.8516305051550026.
[I 2026-03-18 20:26:08,101] Trial 17 pruned. 
[I 2026-03-18 20:26:11,243] Trial 9 pruned. 
[I 2026-03-18 20:26:19,371] Trial 6 finished with value: -1.8523442406499047 and parameters: {'n_layers_yyx': 2, 'hidden_size_yyx_l0': 3, 'hidden_size_yyx_l1': 3, 'context_size_yyx': 3, 'num_mix_components_yyx': 5, 'context_extractor_yyx': 'lstm', 'activation_func_yyx': 'Tanh', 'L2_weight_yyx': 2.2291495839788583e-10, 'L_entropy_weight_yyx': 7.772551811449746e-08, 'L_sep_weight_yyx': 2.3042985622706494e-08, 'L_scale_weight_yyx': 0.0002006973837148077, 'learning_rate_yyx': 0.005181258811645666}. Best is trial 6 with value: -1.8523442406499047.
[I 2026-03-18 20:26:35,458] Trial 12 pruned. 
[I 2026-03-18 20:26:39,634] Trial 4 finished with value: -1.7875800731928662 and parameters: {'n_layers_yyx': 2, 'hidden_size_yyx_l0': 5, 'hidden_size_yyx_l1': 5, 'context_size_yyx': 1, 'num_mix_components_yyx': 5, 'context_extractor_yyx': 'gru', 'activation_func_yyx': 'GELU', 'L2_weight_yyx': 2.357937031494135e-09, 'L_entropy_weight_yyx': 4.436909879587486e-06, 'L_sep_weight_yyx': 1.4778779214007513e-06, 'L_scale_weight_yyx': 7.196077607899103e-10, 'learning_rate_yyx': 0.008432777000986647}. Best is trial 4 with value: -1.7875800731928662.
[I 2026-03-18 20:26:46,806] Trial 9 pruned. 
[I 2026-03-18 20:27:05,352] Trial 6 pruned. 
[I 2026-03-18 20:27:09,706] Trial 10 pruned. 
[I 2026-03-18 20:27:22,976] Trial 6 pruned. 
[I 2026-03-18 20:27:41,244] Trial 7 pruned. 
[I 2026-03-18 20:27:44,105] Trial 18 pruned. 
[I 2026-03-18 20:28:00,826] Trial 9 pruned. 
[I 2026-03-18 20:28:05,540] Trial 13 pruned. 
[I 2026-03-18 20:28:25,512] Trial 4 pruned. 
[I 2026-03-18 20:28:25,869] Trial 5 finished with value: -1.89157565728699 and parameters: {'n_layers_yyx': 2, 'hidden_size_yyx_l0': 4, 'hidden_size_yyx_l1': 6, 'context_size_yyx': 1, 'num_mix_components_yyx': 4, 'context_extractor_yyx': 'lstm', 'activation_func_yyx': 'Tanh', 'L2_weight_yyx': 5.8329745763535016e-06, 'L_entropy_weight_yyx': 0.00015038536683015266, 'L_sep_weight_yyx': 1.4860590431523876e-09, 'L_scale_weight_yyx': 3.850044224936366e-06, 'learning_rate_yyx': 0.0032348749758274575}. Best is trial 5 with value: -1.89157565728699.
[I 2026-03-18 20:28:36,532] Trial 9 pruned. 
[I 2026-03-18 20:29:06,636] Trial 8 pruned. 
[I 2026-03-18 20:29:08,875] Trial 19 pruned. 
[I 2026-03-18 20:29:35,750] Trial 6 pruned. 
[I 2026-03-18 20:29:36,650] Trial 5 finished with value: -1.3172767521784856 and parameters: {'n_layers_yyx': 2, 'hidden_size_yyx_l0': 5, 'hidden_size_yyx_l1': 2, 'context_size_yyx': 3, 'num_mix_components_yyx': 2, 'context_extractor_yyx': 'lstm', 'activation_func_yyx': 'ReLU', 'L2_weight_yyx': 3.1933355853532284e-05, 'L_entropy_weight_yyx': 1.0969847267505341e-07, 'L_sep_weight_yyx': 3.7082786677302044e-10, 'L_scale_weight_yyx': 0.0005550236682997841, 'learning_rate_yyx': 0.002571930947832545}. Best is trial 3 with value: -1.40271482027494.
[I 2026-03-18 20:29:39,496] Trial 5 pruned. 
[I 2026-03-18 20:29:45,708] Trial 7 pruned. 
[I 2026-03-18 20:29:56,733] Trial 11 pruned. 
[I 2026-03-18 20:30:03,307] Trial 8 finished with value: -1.3715953889440318 and parameters: {'n_layers_yyx': 2, 'hidden_size_yyx_l0': 3, 'hidden_size_yyx_l1': 6, 'context_size_yyx': 3, 'num_mix_components_yyx': 2, 'context_extractor_yyx': 'gru', 'activation_func_yyx': 'Tanh', 'L2_weight_yyx': 1.3186120468584046e-05, 'L_entropy_weight_yyx': 1.5290676146669618e-09, 'L_sep_weight_yyx': 6.922164375183082e-08, 'L_scale_weight_yyx': 1.3072766748712761e-05, 'learning_rate_yyx': 0.0006133452806947369}. Best is trial 0 with value: -1.5190498727266906.
[I 2026-03-18 20:30:11,953] Trial 10 pruned. 
[I 2026-03-18 20:30:16,302] Trial 14 pruned. 
[I 2026-03-18 20:30:23,756] Trial 20 pruned. 
[I 2026-03-18 20:30:43,070] Trial 6 pruned. 
[I 2026-03-18 20:30:50,271] Trial 6 pruned. 
[I 2026-03-18 20:30:57,986] Trial 8 pruned. 
[I 2026-03-18 20:31:13,061] Trial 12 pruned. 
[I 2026-03-18 20:31:19,403] Trial 6 finished with value: -1.321272911658654 and parameters: {'n_layers_yyx': 2, 'hidden_size_yyx_l0': 4, 'hidden_size_yyx_l1': 3, 'context_size_yyx': 2, 'num_mix_components_yyx': 2, 'context_extractor_yyx': 'lstm', 'activation_func_yyx': 'ReLU', 'L2_weight_yyx': 1.3508214205339818e-07, 'L_entropy_weight_yyx': 1.2830496849687401e-10, 'L_sep_weight_yyx': 4.734111571367018e-05, 'L_scale_weight_yyx': 2.7799680497138427e-09, 'learning_rate_yyx': 0.0034116468938132044}. Best is trial 1 with value: -1.4389243727463943.
[I 2026-03-18 20:31:26,413] Trial 11 pruned. 
[I 2026-03-18 20:31:40,253] Trial 3 finished with value: -1.7796306324968434 and parameters: {'n_layers_yyx': 1, 'hidden_size_yyx_l0': 5, 'context_size_yyx': 1, 'num_mix_components_yyx': 3, 'context_extractor_yyx': 'gru', 'activation_func_yyx': 'Tanh', 'L2_weight_yyx': 8.498006299925224e-08, 'L_entropy_weight_yyx': 0.00026609052456542264, 'L_sep_weight_yyx': 1.3306776256850427e-08, 'L_scale_weight_yyx': 0.00045021114934083365, 'learning_rate_yyx': 0.006255177380906758}. Best is trial 3 with value: -1.7796306324968434.
[I 2026-03-18 20:31:49,101] Trial 7 pruned. 
[I 2026-03-18 20:31:59,708] Trial 12 finished with value: -1.8020206236161567 and parameters: {'n_layers_yyx': 1, 'hidden_size_yyx_l0': 3, 'context_size_yyx': 3, 'num_mix_components_yyx': 5, 'context_extractor_yyx': 'gru', 'activation_func_yyx': 'GELU', 'L2_weight_yyx': 9.881406101375956e-08, 'L_entropy_weight_yyx': 9.071008131733633e-09, 'L_sep_weight_yyx': 0.0009563949665752008, 'L_scale_weight_yyx': 3.2457501817191105e-08, 'learning_rate_yyx': 0.004822324500895271}. Best is trial 3 with value: -1.8039611117233905.
[I 2026-03-18 20:32:09,963] Trial 9 pruned. 
[I 2026-03-18 20:32:09,979] Trial 8 finished with value: -1.8326095189803686 and parameters: {'n_layers_yyx': 2, 'hidden_size_yyx_l0': 2, 'hidden_size_yyx_l1': 4, 'context_size_yyx': 4, 'num_mix_components_yyx': 1, 'context_extractor_yyx': 'gru', 'activation_func_yyx': 'ReLU', 'L2_weight_yyx': 2.888523112876989e-10, 'L_entropy_weight_yyx': 0.0001105443106161663, 'L_sep_weight_yyx': 3.744550516607391e-06, 'L_scale_weight_yyx': 4.5946308259024686e-08, 'learning_rate_yyx': 0.0039556979759030495}. Best is trial 0 with value: -1.8528113520484126.
[I 2026-03-18 20:32:11,522] Trial 7 finished with value: -2.4847766941812783 and parameters: {'n_layers_yyx': 1, 'hidden_size_yyx_l0': 5, 'context_size_yyx': 4, 'num_mix_components_yyx': 3, 'context_extractor_yyx': 'lstm', 'activation_func_yyx': 'ReLU', 'L2_weight_yyx': 5.045147360529414e-10, 'L_entropy_weight_yyx': 1.414098006722226e-06, 'L_sep_weight_yyx': 1.696546047549811e-05, 'L_scale_weight_yyx': 1.314605141495828e-08, 'learning_rate_yyx': 0.009574166923240616}. Best is trial 7 with value: -2.4847766941812783.
[I 2026-03-18 20:32:29,064] Trial 7 pruned. 
[I 2026-03-18 20:32:29,190] Trial 12 pruned. 
[I 2026-03-18 20:32:29,589] Trial 15 pruned. 
[I 2026-03-18 20:32:49,757] Trial 21 pruned. 
[I 2026-03-18 20:32:53,354] Trial 4 pruned. 
[I 2026-03-18 20:33:00,688] Trial 3 finished with value: -1.319349365234375 and parameters: {'n_layers_yyx': 2, 'hidden_size_yyx_l0': 3, 'hidden_size_yyx_l1': 4, 'context_size_yyx': 3, 'num_mix_components_yyx': 2, 'context_extractor_yyx': 'lstm', 'activation_func_yyx': 'Tanh', 'L2_weight_yyx': 7.558150323446135e-07, 'L_entropy_weight_yyx': 0.00022054872466087562, 'L_sep_weight_yyx': 5.104888521372072e-09, 'L_scale_weight_yyx': 1.9552017807879312e-05, 'learning_rate_yyx': 0.0008984160274106177}. Best is trial 1 with value: -1.3744548856295071.
[I 2026-03-18 20:33:10,532] Trial 13 pruned. 
[I 2026-03-18 20:33:14,062] Trial 9 pruned. 
[I 2026-03-18 20:33:21,372] Trial 10 pruned. 
[I 2026-03-18 20:33:26,338] Trial 8 pruned. 
[I 2026-03-18 20:33:33,371] Trial 8 pruned. 
[I 2026-03-18 20:33:40,561] Trial 10 pruned. 
[I 2026-03-18 20:33:44,704] Trial 4 finished with value: -1.8487364834410733 and parameters: {'n_layers_yyx': 1, 'hidden_size_yyx_l0': 5, 'context_size_yyx': 3, 'num_mix_components_yyx': 4, 'context_extractor_yyx': 'gru', 'activation_func_yyx': 'ReLU', 'L2_weight_yyx': 2.042180407477171e-07, 'L_entropy_weight_yyx': 1.112845216005585e-07, 'L_sep_weight_yyx': 2.85400236676865e-05, 'L_scale_weight_yyx': 0.0004200326219598224, 'learning_rate_yyx': 0.0012712326353682228}. Best is trial 1 with value: -1.8555367853768732.
[I 2026-03-18 20:34:00,765] Trial 8 pruned. 
[I 2026-03-18 20:34:04,123] Trial 10 finished with value: -1.4553572904146634 and parameters: {'n_layers_yyx': 2, 'hidden_size_yyx_l0': 6, 'hidden_size_yyx_l1': 6, 'context_size_yyx': 3, 'num_mix_components_yyx': 5, 'context_extractor_yyx': 'lstm', 'activation_func_yyx': 'GELU', 'L2_weight_yyx': 0.0006944848428063875, 'L_entropy_weight_yyx': 4.734415268137677e-08, 'L_sep_weight_yyx': 7.913610697812845e-07, 'L_scale_weight_yyx': 0.0005787287552598677, 'learning_rate_yyx': 0.004335754599806673}. Best is trial 10 with value: -1.4553572904146634.
[I 2026-03-18 20:34:07,504] Trial 4 pruned. 
[I 2026-03-18 20:34:25,066] Trial 14 pruned. 
[I 2026-03-18 20:34:33,724] Trial 16 pruned. 
[I 2026-03-18 20:34:45,241] Trial 9 pruned. 
[I 2026-03-18 20:34:47,627] Trial 6 finished with value: -2.4936845131005474 and parameters: {'n_layers_yyx': 1, 'hidden_size_yyx_l0': 6, 'context_size_yyx': 3, 'num_mix_components_yyx': 3, 'context_extractor_yyx': 'gru', 'activation_func_yyx': 'Tanh', 'L2_weight_yyx': 1.0656412184440262e-05, 'L_entropy_weight_yyx': 1.7712742093885644e-07, 'L_sep_weight_yyx': 2.1771398101218458e-06, 'L_scale_weight_yyx': 0.00046597592837167184, 'learning_rate_yyx': 0.002685023626487399}. Best is trial 4 with value: -2.49523174750643.
[I 2026-03-18 20:34:49,850] Trial 5 pruned. 
[I 2026-03-18 20:34:51,878] Trial 5 pruned. 
[I 2026-03-18 20:35:01,577] Trial 9 pruned. 
[I 2026-03-18 20:35:02,598] Trial 11 pruned. 
[I 2026-03-18 20:35:03,412] Trial 22 pruned. 
[I 2026-03-18 20:35:08,715] Trial 5 pruned. 
[I 2026-03-18 20:35:22,378] Trial 15 pruned. 
[I 2026-03-18 20:35:37,208] Trial 10 pruned. 
[I 2026-03-18 20:35:39,610] Trial 9 pruned. 
[I 2026-03-18 20:35:42,191] Trial 7 pruned. 
[I 2026-03-18 20:36:04,106] Trial 12 pruned. 
[I 2026-03-18 20:36:08,248] Trial 6 pruned. 
[I 2026-03-18 20:36:14,572] Trial 6 finished with value: -1.9187365381451993 and parameters: {'n_layers_yyx': 2, 'hidden_size_yyx_l0': 5, 'hidden_size_yyx_l1': 5, 'context_size_yyx': 4, 'num_mix_components_yyx': 4, 'context_extractor_yyx': 'lstm', 'activation_func_yyx': 'Tanh', 'L2_weight_yyx': 8.692854562476326e-07, 'L_entropy_weight_yyx': 1.629330407307881e-08, 'L_sep_weight_yyx': 3.248352111542271e-08, 'L_scale_weight_yyx': 0.000338965391798323, 'learning_rate_yyx': 0.001398861131098399}. Best is trial 0 with value: -1.9368961358079142.
[I 2026-03-18 20:36:26,902] Trial 17 pruned. 
[I 2026-03-18 20:37:02,241] Trial 13 pruned. 
[I 2026-03-18 20:37:09,234] Trial 13 pruned. 
[I 2026-03-18 20:37:12,868] Trial 5 finished with value: -1.7632971314709596 and parameters: {'n_layers_yyx': 1, 'hidden_size_yyx_l0': 4, 'context_size_yyx': 3, 'num_mix_components_yyx': 2, 'context_extractor_yyx': 'gru', 'activation_func_yyx': 'ReLU', 'L2_weight_yyx': 1.2998096866955026e-07, 'L_entropy_weight_yyx': 3.821038964778091e-05, 'L_sep_weight_yyx': 5.187084330827102e-06, 'L_scale_weight_yyx': 2.415455696044987e-10, 'learning_rate_yyx': 0.00796398041843822}. Best is trial 4 with value: -1.7875800731928662.
[I 2026-03-18 20:37:15,620] Trial 16 pruned. 
[I 2026-03-18 20:37:16,638] Trial 7 pruned. 
[I 2026-03-18 20:37:17,777] Trial 7 finished with value: -1.2616848050631009 and parameters: {'n_layers_yyx': 1, 'hidden_size_yyx_l0': 2, 'context_size_yyx': 2, 'num_mix_components_yyx': 1, 'context_extractor_yyx': 'lstm', 'activation_func_yyx': 'GELU', 'L2_weight_yyx': 2.7794726454764974e-10, 'L_entropy_weight_yyx': 3.663102910819462e-07, 'L_sep_weight_yyx': 4.1591523222885155e-10, 'L_scale_weight_yyx': 0.0002393167941459964, 'learning_rate_yyx': 0.001111922712853711}. Best is trial 1 with value: -1.4345258507361778.
[I 2026-03-18 20:37:45,034] Trial 8 pruned. 
[I 2026-03-18 20:38:13,162] Trial 6 pruned. 
[I 2026-03-18 20:38:14,679] Trial 10 pruned. 
[I 2026-03-18 20:38:17,910] Trial 8 pruned. 
[I 2026-03-18 20:38:17,911] Trial 8 pruned. 
[I 2026-03-18 20:38:46,207] Trial 14 pruned. 
