[I 2026-03-18 18:40:38,233] Trial 49 finished with value: -3.115589936589291 and parameters: {'n_layers_yyx': 2, 'hidden_size_yyx_l0': 3, 'hidden_size_yyx_l1': 4, 'context_size_yyx': 4, 'num_mix_components_yyx': 4, 'context_extractor_yyx': 'gru', 'activation_func_yyx': 'ReLU', 'L2_weight_yyx': 4.4086615487694663e-07, 'L_entropy_weight_yyx': 1.639185064192742e-08, 'L_sep_weight_yyx': 1.3647578473935907e-07, 'L_scale_weight_yyx': 0.0005146778908194148, 'learning_rate_yyx': 0.000945090014021688}. Best is trial 23 with value: -3.1545382986021053.

Source events: 54211
Target events: 12539
Full model ln_yyx : 3367.32967 nats/sec, 241.69365 nats/event
Full model Log loss : -3.11906
Full model ln_yyx : 3344.98791 nats/sec, 240.09005 nats/event
Full model Log loss : -3.10711
Full model ln_yyx : 3356.82748 nats/sec, 240.93985 nats/event
Full model Log loss : -3.11337
Full model ln_yyx : 3372.38445 nats/sec, 242.05646 nats/event
Full model Log loss : -3.11925
Full model ln_yyx : 3376.94239 nats/sec, 242.38362 nats/event
Full model Log loss : -3.11470
Full model ln_yyx : 3397.11139 nats/sec, 243.83127 nats/event
Full model Log loss : -3.14806
Full model ln_yyx : 3399.91471 nats/sec, 244.03248 nats/event
Full model Log loss : -3.14588
Full model ln_yyx : 3390.11662 nats/sec, 243.32921 nats/event
Full model Log loss : -3.13754
Full model ln_yyx : 3415.42427 nats/sec, 245.14569 nats/event
Full model Log loss : -3.14768
Full model ln_yyx : 3407.44705 nats/sec, 244.57312 nats/event
Full model Log loss : -3.15454
Full model ln_yyx : 3381.43195 nats/sec, 242.70586 nats/event
Full model Log loss : -3.11788
Full model ln_yyx : 3404.68050 nats/sec, 244.37455 nats/event
Full model Log loss : -3.14740
Full model ln_yyx : 3359.64296 nats/sec, 241.14193 nats/event
Full model Log loss : -3.12118
Full model ln_yyx : 3363.67943 nats/sec, 241.43165 nats/event
Full model Log loss : -3.11965
Full model ln_yyx : 3398.84443 nats/sec, 243.95566 nats/event
Full model Log loss : -3.14602
Full model ln_yyx : 3381.33562 nats/sec, 242.69894 nats/event
Full model Log loss : -3.12077
Full model ln_yyx : 3361.69720 nats/sec, 241.28938 nats/event
Full model Log loss : -3.11559
Optimization finished. Config saved to results/opt-full/opt_full_82_best_config.txt
[I 2026-03-18 18:40:44,695] Trial 37 pruned. 
[I 2026-03-18 18:40:48,278] Trial 48 finished with value: -3.1799917406594127 and parameters: {'n_layers_yyx': 2, 'hidden_size_yyx_l0': 6, 'hidden_size_yyx_l1': 4, 'context_size_yyx': 2, 'num_mix_components_yyx': 3, 'context_extractor_yyx': 'lstm', 'activation_func_yyx': 'ReLU', 'L2_weight_yyx': 2.0588325837377103e-05, 'L_entropy_weight_yyx': 1.926758560777305e-05, 'L_sep_weight_yyx': 1.1111644107319842e-10, 'L_scale_weight_yyx': 0.00020228800213878048, 'learning_rate_yyx': 0.008719077641150888}. Best is trial 12 with value: -3.1893335216865584.
[I 2026-03-18 18:40:48,503] Trial 43 pruned. 
[I 2026-03-18 18:40:55,004] Trial 38 pruned. 
[I 2026-03-18 18:41:02,249] Trial 41 pruned. 
[I 2026-03-18 18:41:11,311] Trial 49 pruned. 

Source events: 54211
Target events: 1872
Full model ln_yyx : 500.96888 nats/sec, 240.85042 nats/event
Full model Log loss : -3.14423
Full model ln_yyx : 503.40257 nats/sec, 242.02047 nats/event
Full model Log loss : -3.15044
Full model ln_yyx : 505.52056 nats/sec, 243.03873 nats/event
Full model Log loss : -3.15344
Full model ln_yyx : 503.95241 nats/sec, 242.28481 nats/event
Full model Log loss : -3.14772
Full model ln_yyx : 510.18803 nats/sec, 245.28271 nats/event
Full model Log loss : -3.18137
Full model ln_yyx : 507.13614 nats/sec, 243.81545 nats/event
Full model Log loss : -3.18062
Full model ln_yyx : 502.18235 nats/sec, 241.43382 nats/event
Full model Log loss : -3.14425
Full model ln_yyx : 501.47663 nats/sec, 241.09453 nats/event
Full model Log loss : -3.14635
Full model ln_yyx : 509.73977 nats/sec, 245.06720 nats/event
Full model Log loss : -3.18933
Full model ln_yyx : 506.89792 nats/sec, 243.70092 nats/event
Full model Log loss : -3.15934
Full model ln_yyx : 504.73382 nats/sec, 242.66049 nats/event
Full model Log loss : -3.15204
Full model ln_yyx : 506.05426 nats/sec, 243.29532 nats/event
Full model Log loss : -3.15660
Full model ln_yyx : 511.07471 nats/sec, 245.70899 nats/event
Full model Log loss : -3.18671
Full model ln_yyx : 508.66226 nats/sec, 244.54916 nats/event
Full model Log loss : -3.18067
Full model ln_yyx : 506.94956 nats/sec, 243.72575 nats/event
Full model Log loss : -3.17794
Full model ln_yyx : 508.30578 nats/sec, 244.37778 nats/event
Full model Log loss : -3.18090
Full model ln_yyx : 508.00696 nats/sec, 244.23411 nats/event
Full model Log loss : -3.18505
Full model ln_yyx : 503.70105 nats/sec, 242.16397 nats/event
Full model Log loss : -3.15191
Full model ln_yyx : 507.47045 nats/sec, 243.97618 nats/event
Full model Log loss : -3.17818
Full model ln_yyx : 509.01946 nats/sec, 244.72089 nats/event
Full model Log loss : -3.18032
Full model ln_yyx : 509.78870 nats/sec, 245.09072 nats/event
Full model Log loss : -3.18641
Full model ln_yyx : 505.42078 nats/sec, 242.99076 nats/event
Full model Log loss : -3.15734
Full model ln_yyx : 507.57368 nats/sec, 244.02581 nats/event
Full model Log loss : -3.17999
Optimization finished. Config saved to results/opt-full/opt_full_79_best_config.txt
[I 2026-03-18 18:41:26,942] Trial 42 pruned. 
[I 2026-03-18 18:41:30,210] Trial 47 finished with value: -3.145554452191514 and parameters: {'n_layers_yyx': 1, 'hidden_size_yyx_l0': 5, 'context_size_yyx': 1, 'num_mix_components_yyx': 3, 'context_extractor_yyx': 'gru', 'activation_func_yyx': 'GELU', 'L2_weight_yyx': 6.332589779641774e-07, 'L_entropy_weight_yyx': 5.646138550614629e-06, 'L_sep_weight_yyx': 3.28836939359514e-08, 'L_scale_weight_yyx': 4.0526708404666104e-10, 'learning_rate_yyx': 0.0016262117596345586}. Best is trial 24 with value: -3.1533369159995748.
[I 2026-03-18 18:41:35,796] Trial 44 finished with value: -3.1708696748887375 and parameters: {'n_layers_yyx': 2, 'hidden_size_yyx_l0': 6, 'hidden_size_yyx_l1': 5, 'context_size_yyx': 3, 'num_mix_components_yyx': 3, 'context_extractor_yyx': 'lstm', 'activation_func_yyx': 'ReLU', 'L2_weight_yyx': 3.1123734836051094e-09, 'L_entropy_weight_yyx': 1.6152433886780806e-07, 'L_sep_weight_yyx': 1.5419838930388463e-09, 'L_scale_weight_yyx': 1.4917656615986937e-07, 'learning_rate_yyx': 0.004614793440827595}. Best is trial 44 with value: -3.1708696748887375.
[I 2026-03-18 18:41:51,799] Trial 43 pruned. 
[I 2026-03-18 18:41:55,762] Trial 41 finished with value: -3.1538762865545746 and parameters: {'n_layers_yyx': 2, 'hidden_size_yyx_l0': 6, 'hidden_size_yyx_l1': 4, 'context_size_yyx': 4, 'num_mix_components_yyx': 5, 'context_extractor_yyx': 'gru', 'activation_func_yyx': 'GELU', 'L2_weight_yyx': 7.549586831906118e-07, 'L_entropy_weight_yyx': 7.528073366239852e-10, 'L_sep_weight_yyx': 0.0002021995484075617, 'L_scale_weight_yyx': 2.3999316482542705e-10, 'learning_rate_yyx': 0.00995762545651511}. Best is trial 41 with value: -3.1538762865545746.
[I 2026-03-18 18:42:00,559] Trial 49 finished with value: -3.1504074301128457 and parameters: {'n_layers_yyx': 2, 'hidden_size_yyx_l0': 2, 'hidden_size_yyx_l1': 6, 'context_size_yyx': 4, 'num_mix_components_yyx': 5, 'context_extractor_yyx': 'lstm', 'activation_func_yyx': 'GELU', 'L2_weight_yyx': 1.5016561093466195e-10, 'L_entropy_weight_yyx': 0.0009939676972416096, 'L_sep_weight_yyx': 1.0364439241039748e-09, 'L_scale_weight_yyx': 2.0298413437034892e-10, 'learning_rate_yyx': 0.009795281370785705}. Best is trial 45 with value: -3.1510005043146405.

Source events: 54211
Target events: 29032
Full model ln_yyx : 7857.82051 nats/sec, 243.59460 nats/event
Full model Log loss : -3.14608
Full model ln_yyx : 7790.13976 nats/sec, 241.49648 nats/event
Full model Log loss : -3.11720
Full model ln_yyx : 7861.48935 nats/sec, 243.70834 nats/event
Full model Log loss : -3.13784
Full model ln_yyx : 7774.55069 nats/sec, 241.01321 nats/event
Full model Log loss : -3.11105
Full model ln_yyx : 7778.21883 nats/sec, 241.12693 nats/event
Full model Log loss : -3.11442
Full model ln_yyx : 7798.46154 nats/sec, 241.75446 nats/event
Full model Log loss : -3.11990
Full model ln_yyx : 7756.06498 nats/sec, 240.44015 nats/event
Full model Log loss : -3.10839
Full model ln_yyx : 7830.30910 nats/sec, 242.74174 nats/event
Full model Log loss : -3.11998
Full model ln_yyx : 7846.46342 nats/sec, 243.24253 nats/event
Full model Log loss : -3.14049
Full model ln_yyx : 7767.39814 nats/sec, 240.79148 nats/event
Full model Log loss : -3.11410
Full model ln_yyx : 7866.52592 nats/sec, 243.86447 nats/event
Full model Log loss : -3.15048
Full model ln_yyx : 7816.20109 nats/sec, 242.30439 nats/event
Full model Log loss : -3.12112
Full model ln_yyx : 7818.36846 nats/sec, 242.37158 nats/event
Full model Log loss : -3.12117
Full model ln_yyx : 7887.50070 nats/sec, 244.51470 nats/event
Full model Log loss : -3.15016
Full model ln_yyx : 7862.72333 nats/sec, 243.74659 nats/event
Full model Log loss : -3.15055
Full model ln_yyx : 7926.94570 nats/sec, 245.73750 nats/event
Full model Log loss : -3.15092
Full model ln_yyx : 7903.62052 nats/sec, 245.01441 nats/event
Full model Log loss : -3.15100
Full model ln_yyx : 7915.05082 nats/sec, 245.36876 nats/event
Full model Log loss : -3.15043
Full model ln_yyx : 7918.51060 nats/sec, 245.47601 nats/event
Full model Log loss : -3.15041
Optimization finished. Config saved to results/opt-full/opt_full_72_best_config.txt
[I 2026-03-18 18:42:15,608] Trial 44 pruned. 
[I 2026-03-18 18:42:19,807] Trial 40 finished with value: -3.159484955881525 and parameters: {'n_layers_yyx': 1, 'hidden_size_yyx_l0': 6, 'context_size_yyx': 4, 'num_mix_components_yyx': 3, 'context_extractor_yyx': 'gru', 'activation_func_yyx': 'ReLU', 'L2_weight_yyx': 1.0613602204032877e-09, 'L_entropy_weight_yyx': 4.121800637162348e-07, 'L_sep_weight_yyx': 0.00035140255927855295, 'L_scale_weight_yyx': 9.2377443589955e-09, 'learning_rate_yyx': 0.006027411244144129}. Best is trial 39 with value: -3.1621467102733707.
[I 2026-03-18 18:42:28,274] Trial 44 finished with value: -3.1512674489486034 and parameters: {'n_layers_yyx': 1, 'hidden_size_yyx_l0': 6, 'context_size_yyx': 4, 'num_mix_components_yyx': 4, 'context_extractor_yyx': 'gru', 'activation_func_yyx': 'GELU', 'L2_weight_yyx': 2.9791771305304133e-06, 'L_entropy_weight_yyx': 0.0007143850611326061, 'L_sep_weight_yyx': 0.0008493868276322395, 'L_scale_weight_yyx': 9.479006789750465e-05, 'learning_rate_yyx': 0.008495638473047722}. Best is trial 1 with value: -3.152505646630136.
[I 2026-03-18 18:42:31,817] Trial 39 finished with value: -3.1511960283320337 and parameters: {'n_layers_yyx': 1, 'hidden_size_yyx_l0': 5, 'context_size_yyx': 4, 'num_mix_components_yyx': 3, 'context_extractor_yyx': 'lstm', 'activation_func_yyx': 'GELU', 'L2_weight_yyx': 1.0384746039436345e-08, 'L_entropy_weight_yyx': 2.769651002368916e-06, 'L_sep_weight_yyx': 7.578497455012332e-07, 'L_scale_weight_yyx': 1.9630506078624828e-08, 'learning_rate_yyx': 0.005726330234131588}. Best is trial 5 with value: -3.154335707688014.
[I 2026-03-18 18:42:34,512] Trial 48 pruned. 
[I 2026-03-18 18:42:40,235] Trial 45 pruned. 
[I 2026-03-18 18:42:44,852] Trial 41 pruned. 
[I 2026-03-18 18:42:52,816] Trial 45 pruned. 
[I 2026-03-18 18:43:04,327] Trial 46 pruned. 
[I 2026-03-18 18:43:04,862] Trial 46 pruned. 
[I 2026-03-18 18:43:14,588] Trial 47 pruned. 
[I 2026-03-18 18:43:17,308] Trial 45 finished with value: -3.1687108477493457 and parameters: {'n_layers_yyx': 2, 'hidden_size_yyx_l0': 6, 'hidden_size_yyx_l1': 5, 'context_size_yyx': 3, 'num_mix_components_yyx': 3, 'context_extractor_yyx': 'lstm', 'activation_func_yyx': 'ReLU', 'L2_weight_yyx': 9.985887000724457e-08, 'L_entropy_weight_yyx': 4.5857379970123393e-07, 'L_sep_weight_yyx': 1.8759603599620475e-09, 'L_scale_weight_yyx': 1.453706241917809e-07, 'learning_rate_yyx': 0.00322302090006961}. Best is trial 44 with value: -3.1708696748887375.
[I 2026-03-18 18:43:24,671] Trial 48 pruned. 
[I 2026-03-18 18:43:35,710] Trial 49 pruned. 

Source events: 54211
Target events: 38515
Full model ln_yyx : 10290.63310 nats/sec, 240.46657 nats/event
Full model Log loss : -3.11733
Full model ln_yyx : 10433.02000 nats/sec, 243.79379 nats/event
Full model Log loss : -3.14595
Full model ln_yyx : 10402.90093 nats/sec, 243.08999 nats/event
Full model Log loss : -3.14726
Full model ln_yyx : 10350.23874 nats/sec, 241.85940 nats/event
Full model Log loss : -3.11561
Full model ln_yyx : 10475.55201 nats/sec, 244.78766 nats/event
Full model Log loss : -3.15063
Full model ln_yyx : 10395.67668 nats/sec, 242.92117 nats/event
Full model Log loss : -3.13945
Full model ln_yyx : 10445.92177 nats/sec, 244.09528 nats/event
Full model Log loss : -3.15152
Full model ln_yyx : 10417.05370 nats/sec, 243.42070 nats/event
Full model Log loss : -3.15065
Full model ln_yyx : 10383.79548 nats/sec, 242.64354 nats/event
Full model Log loss : -3.15013
Full model ln_yyx : 10324.16465 nats/sec, 241.25012 nats/event
Full model Log loss : -3.11842
Full model ln_yyx : 10347.11544 nats/sec, 241.78642 nats/event
Full model Log loss : -3.13729
Full model ln_yyx : 10412.63557 nats/sec, 243.31746 nats/event
Full model Log loss : -3.15017
Full model ln_yyx : 10372.62514 nats/sec, 242.38252 nats/event
Full model Log loss : -3.14830
Full model ln_yyx : 10334.49820 nats/sec, 241.49158 nats/event
Full model Log loss : -3.11338
Full model ln_yyx : 10294.77230 nats/sec, 240.56329 nats/event
Full model Log loss : -3.11447
Full model ln_yyx : 10426.32656 nats/sec, 243.63739 nats/event
Full model Log loss : -3.14938
Optimization finished. Config saved to results/opt-full/opt_full_74_best_config.txt
[I 2026-03-18 18:43:40,380] Trial 49 pruned. 

Source events: 54211
Target events: 18269
Full model ln_yyx : 4886.23872 nats/sec, 240.71459 nats/event
Full model Log loss : -3.11068
Full model ln_yyx : 4887.86163 nats/sec, 240.79454 nats/event
Full model Log loss : -3.11105
Full model ln_yyx : 4987.07871 nats/sec, 245.68235 nats/event
Full model Log loss : -3.15014
Full model ln_yyx : 4892.38140 nats/sec, 241.01720 nats/event
Full model Log loss : -3.11195
Full model ln_yyx : 4948.13106 nats/sec, 243.76364 nats/event
Full model Log loss : -3.14039
Full model ln_yyx : 4882.73350 nats/sec, 240.54191 nats/event
Full model Log loss : -3.12198
Full model ln_yyx : 4907.33524 nats/sec, 241.75388 nats/event
Full model Log loss : -3.11455
Full model ln_yyx : 4947.28280 nats/sec, 243.72185 nats/event
Full model Log loss : -3.14812
Full model ln_yyx : 4925.88565 nats/sec, 242.66775 nats/event
Full model Log loss : -3.12059
Full model ln_yyx : 4902.14503 nats/sec, 241.49819 nats/event
Full model Log loss : -3.12269
Full model ln_yyx : 4990.08553 nats/sec, 245.83048 nats/event
Full model Log loss : -3.15334
Full model ln_yyx : 4965.73787 nats/sec, 244.63102 nats/event
Full model Log loss : -3.14498
Full model ln_yyx : 4971.06200 nats/sec, 244.89331 nats/event
Full model Log loss : -3.14892
Full model ln_yyx : 4902.86957 nats/sec, 241.53389 nats/event
Full model Log loss : -3.11235
Full model ln_yyx : 4948.17363 nats/sec, 243.76574 nats/event
Full model Log loss : -3.14555
Optimization finished. Config saved to results/opt-full/opt_full_77_best_config.txt
[I 2026-03-18 18:44:03,933] Trial 42 finished with value: -3.153135141261372 and parameters: {'n_layers_yyx': 2, 'hidden_size_yyx_l0': 6, 'hidden_size_yyx_l1': 4, 'context_size_yyx': 4, 'num_mix_components_yyx': 5, 'context_extractor_yyx': 'gru', 'activation_func_yyx': 'GELU', 'L2_weight_yyx': 1.5638829761058476e-07, 'L_entropy_weight_yyx': 3.907864923494477e-10, 'L_sep_weight_yyx': 0.0003180200045239453, 'L_scale_weight_yyx': 1.2550529046432481e-09, 'learning_rate_yyx': 0.009899917823872466}. Best is trial 41 with value: -3.1538762865545746.
[I 2026-03-18 18:44:19,936] Trial 46 pruned. 
[I 2026-03-18 18:44:20,302] Trial 40 finished with value: -3.1136912313529264 and parameters: {'n_layers_yyx': 2, 'hidden_size_yyx_l0': 6, 'hidden_size_yyx_l1': 5, 'context_size_yyx': 1, 'num_mix_components_yyx': 4, 'context_extractor_yyx': 'gru', 'activation_func_yyx': 'Tanh', 'L2_weight_yyx': 2.4388949933395864e-09, 'L_entropy_weight_yyx': 3.062670003941429e-08, 'L_sep_weight_yyx': 2.945673086627144e-09, 'L_scale_weight_yyx': 3.4685355611603176e-06, 'learning_rate_yyx': 0.0031516148941062613}. Best is trial 5 with value: -3.154335707688014.
[I 2026-03-18 18:44:29,207] Trial 43 pruned. 
[I 2026-03-18 18:44:43,774] Trial 41 pruned. 
[I 2026-03-18 18:44:45,491] Trial 42 finished with value: -3.1606948710744893 and parameters: {'n_layers_yyx': 1, 'hidden_size_yyx_l0': 6, 'context_size_yyx': 4, 'num_mix_components_yyx': 3, 'context_extractor_yyx': 'gru', 'activation_func_yyx': 'ReLU', 'L2_weight_yyx': 3.4392459253632313e-10, 'L_entropy_weight_yyx': 5.5512172302842915e-08, 'L_sep_weight_yyx': 0.0001492159255193011, 'L_scale_weight_yyx': 8.29829473948046e-09, 'learning_rate_yyx': 0.006387576016027974}. Best is trial 39 with value: -3.1621467102733707.
[I 2026-03-18 18:44:53,766] Trial 44 pruned. 
[I 2026-03-18 18:45:15,553] Trial 47 finished with value: -3.150147981604986 and parameters: {'n_layers_yyx': 1, 'hidden_size_yyx_l0': 5, 'context_size_yyx': 4, 'num_mix_components_yyx': 4, 'context_extractor_yyx': 'gru', 'activation_func_yyx': 'Tanh', 'L2_weight_yyx': 8.913823277486644e-06, 'L_entropy_weight_yyx': 1.0585509926949033e-07, 'L_sep_weight_yyx': 3.230390553837629e-09, 'L_scale_weight_yyx': 7.350122810623899e-05, 'learning_rate_yyx': 0.0057759781838093}. Best is trial 1 with value: -3.152505646630136.
[I 2026-03-18 18:45:17,022] Trial 45 pruned. 
[I 2026-03-18 18:45:21,489] Trial 47 pruned. 
[I 2026-03-18 18:46:16,751] Trial 46 finished with value: -3.1455144874110257 and parameters: {'n_layers_yyx': 2, 'hidden_size_yyx_l0': 6, 'hidden_size_yyx_l1': 5, 'context_size_yyx': 3, 'num_mix_components_yyx': 4, 'context_extractor_yyx': 'gru', 'activation_func_yyx': 'GELU', 'L2_weight_yyx': 3.8901170587240795e-08, 'L_entropy_weight_yyx': 3.6118627479826815e-09, 'L_sep_weight_yyx': 0.0002503440843337084, 'L_scale_weight_yyx': 6.189014835071395e-10, 'learning_rate_yyx': 0.007533873300004674}. Best is trial 41 with value: -3.1538762865545746.
[I 2026-03-18 18:46:26,809] Trial 42 finished with value: -3.152077181940211 and parameters: {'n_layers_yyx': 2, 'hidden_size_yyx_l0': 6, 'hidden_size_yyx_l1': 5, 'context_size_yyx': 4, 'num_mix_components_yyx': 3, 'context_extractor_yyx': 'lstm', 'activation_func_yyx': 'GELU', 'L2_weight_yyx': 3.498799208646362e-10, 'L_entropy_weight_yyx': 1.2353815499421588e-05, 'L_sep_weight_yyx': 4.945269416796276e-10, 'L_scale_weight_yyx': 0.0001990802748809967, 'learning_rate_yyx': 0.004329688392153973}. Best is trial 5 with value: -3.154335707688014.
[I 2026-03-18 18:46:30,342] Trial 43 finished with value: -3.1612484991810432 and parameters: {'n_layers_yyx': 1, 'hidden_size_yyx_l0': 6, 'context_size_yyx': 4, 'num_mix_components_yyx': 3, 'context_extractor_yyx': 'gru', 'activation_func_yyx': 'ReLU', 'L2_weight_yyx': 2.280845519228874e-10, 'L_entropy_weight_yyx': 3.998752831395634e-08, 'L_sep_weight_yyx': 0.00010176015636286244, 'L_scale_weight_yyx': 1.191233585848801e-08, 'learning_rate_yyx': 0.007848703497244893}. Best is trial 39 with value: -3.1621467102733707.
[I 2026-03-18 18:46:47,385] Trial 48 finished with value: -3.1658621242910403 and parameters: {'n_layers_yyx': 2, 'hidden_size_yyx_l0': 6, 'hidden_size_yyx_l1': 6, 'context_size_yyx': 3, 'num_mix_components_yyx': 4, 'context_extractor_yyx': 'lstm', 'activation_func_yyx': 'ReLU', 'L2_weight_yyx': 3.122673808569577e-09, 'L_entropy_weight_yyx': 2.0288829903088923e-06, 'L_sep_weight_yyx': 6.960703494612502e-09, 'L_scale_weight_yyx': 7.616641733015268e-07, 'learning_rate_yyx': 0.004541885474828024}. Best is trial 44 with value: -3.1708696748887375.
[I 2026-03-18 18:47:00,806] Trial 48 finished with value: -3.150673083195496 and parameters: {'n_layers_yyx': 2, 'hidden_size_yyx_l0': 6, 'hidden_size_yyx_l1': 4, 'context_size_yyx': 4, 'num_mix_components_yyx': 4, 'context_extractor_yyx': 'lstm', 'activation_func_yyx': 'Tanh', 'L2_weight_yyx': 9.627722896741358e-06, 'L_entropy_weight_yyx': 1.3422073299060993e-07, 'L_sep_weight_yyx': 3.1690166790355107e-09, 'L_scale_weight_yyx': 2.4822231835755292e-05, 'learning_rate_yyx': 0.003934737135568241}. Best is trial 1 with value: -3.152505646630136.
