[I 2026-03-18 20:39:04,602] Trial 10 finished with value: -1.847941422304018 and parameters: {'n_layers_yyx': 2, 'hidden_size_yyx_l0': 3, 'hidden_size_yyx_l1': 6, 'context_size_yyx': 1, 'num_mix_components_yyx': 4, 'context_extractor_yyx': 'lstm', 'activation_func_yyx': 'GELU', 'L2_weight_yyx': 4.181056884402421e-09, 'L_entropy_weight_yyx': 0.0004047298154168428, 'L_sep_weight_yyx': 0.0002525179695225354, 'L_scale_weight_yyx': 5.7662063912881445e-06, 'learning_rate_yyx': 0.009678833667006986}. Best is trial 10 with value: -1.847941422304018.
[I 2026-03-18 20:39:20,380] Trial 9 pruned. 
[I 2026-03-18 20:39:23,439] Trial 9 pruned. 
[I 2026-03-18 20:39:47,940] Trial 15 pruned. 
[I 2026-03-18 20:40:02,911] Trial 9 pruned. 
[I 2026-03-18 20:40:03,141] Trial 11 pruned. 
[I 2026-03-18 20:40:10,010] Trial 7 pruned. 
[I 2026-03-18 20:40:17,545] Trial 23 finished with value: -2.47258758947104 and parameters: {'n_layers_yyx': 1, 'hidden_size_yyx_l0': 6, 'context_size_yyx': 3, 'num_mix_components_yyx': 5, 'context_extractor_yyx': 'gru', 'activation_func_yyx': 'ReLU', 'L2_weight_yyx': 1.0839068145573685e-06, 'L_entropy_weight_yyx': 1.0346547944420427e-08, 'L_sep_weight_yyx': 5.8520352079903984e-05, 'L_scale_weight_yyx': 0.00010330814390511269, 'learning_rate_yyx': 0.009799662777890704}. Best is trial 5 with value: -2.4735891998725372.
[I 2026-03-18 20:40:29,233] Trial 10 pruned. 
[I 2026-03-18 20:40:47,664] Trial 18 pruned. 
[I 2026-03-18 20:41:08,072] Trial 7 finished with value: -1.2919777268629808 and parameters: {'n_layers_yyx': 2, 'hidden_size_yyx_l0': 2, 'hidden_size_yyx_l1': 4, 'context_size_yyx': 1, 'num_mix_components_yyx': 2, 'context_extractor_yyx': 'lstm', 'activation_func_yyx': 'Tanh', 'L2_weight_yyx': 0.00047644972319127937, 'L_entropy_weight_yyx': 5.944264116864294e-10, 'L_sep_weight_yyx': 5.343766648554444e-09, 'L_scale_weight_yyx': 2.9529702977724674e-05, 'learning_rate_yyx': 0.003122503436693776}. Best is trial 3 with value: -1.40271482027494.
[I 2026-03-18 20:41:21,228] Trial 24 pruned. 
[I 2026-03-18 20:41:28,049] Trial 11 finished with value: -1.8327220637365498 and parameters: {'n_layers_yyx': 1, 'hidden_size_yyx_l0': 6, 'context_size_yyx': 4, 'num_mix_components_yyx': 3, 'context_extractor_yyx': 'gru', 'activation_func_yyx': 'Tanh', 'L2_weight_yyx': 4.6395329261848837e-07, 'L_entropy_weight_yyx': 3.709772334591215e-05, 'L_sep_weight_yyx': 2.9566176463697576e-09, 'L_scale_weight_yyx': 1.5754658319534197e-09, 'learning_rate_yyx': 0.006025842381366893}. Best is trial 0 with value: -1.8516305051550026.
[I 2026-03-18 20:41:36,886] Trial 10 finished with value: -1.4455062161959134 and parameters: {'n_layers_yyx': 2, 'hidden_size_yyx_l0': 4, 'hidden_size_yyx_l1': 4, 'context_size_yyx': 2, 'num_mix_components_yyx': 3, 'context_extractor_yyx': 'lstm', 'activation_func_yyx': 'Tanh', 'L2_weight_yyx': 2.1828009106082375e-05, 'L_entropy_weight_yyx': 2.4444422053662427e-07, 'L_sep_weight_yyx': 1.1694011919163328e-10, 'L_scale_weight_yyx': 3.6076879016647297e-10, 'learning_rate_yyx': 0.005147779782702167}. Best is trial 3 with value: -1.4510111647385817.
[I 2026-03-18 20:41:46,662] Trial 12 pruned. 
[I 2026-03-18 20:41:46,989] Trial 11 finished with value: -1.4780598874951973 and parameters: {'n_layers_yyx': 1, 'hidden_size_yyx_l0': 5, 'context_size_yyx': 4, 'num_mix_components_yyx': 5, 'context_extractor_yyx': 'lstm', 'activation_func_yyx': 'ReLU', 'L2_weight_yyx': 2.394534332818569e-10, 'L_entropy_weight_yyx': 4.0236148070998225e-09, 'L_sep_weight_yyx': 0.00012635816299876927, 'L_scale_weight_yyx': 2.6010033890897313e-08, 'learning_rate_yyx': 0.009651956471117128}. Best is trial 0 with value: -1.5190498727266906.
[I 2026-03-18 20:41:56,297] Trial 8 pruned. 
[I 2026-03-18 20:42:02,855] Trial 11 finished with value: -1.4247115149864784 and parameters: {'n_layers_yyx': 1, 'hidden_size_yyx_l0': 6, 'context_size_yyx': 3, 'num_mix_components_yyx': 3, 'context_extractor_yyx': 'lstm', 'activation_func_yyx': 'ReLU', 'L2_weight_yyx': 4.0860099213969123e-10, 'L_entropy_weight_yyx': 5.8673232389789914e-09, 'L_sep_weight_yyx': 2.6589416471571663e-10, 'L_scale_weight_yyx': 4.377317365095152e-10, 'learning_rate_yyx': 0.0017004307916107981}. Best is trial 7 with value: -1.4538350266676683.
[I 2026-03-18 20:42:04,526] Trial 8 finished with value: -1.7881631007339016 and parameters: {'n_layers_yyx': 1, 'hidden_size_yyx_l0': 5, 'context_size_yyx': 4, 'num_mix_components_yyx': 5, 'context_extractor_yyx': 'gru', 'activation_func_yyx': 'Tanh', 'L2_weight_yyx': 0.0002885510337709957, 'L_entropy_weight_yyx': 2.611466519376745e-06, 'L_sep_weight_yyx': 6.494426508134187e-10, 'L_scale_weight_yyx': 2.1694431222287873e-07, 'learning_rate_yyx': 0.0018257936092339238}. Best is trial 8 with value: -1.7881631007339016.
[I 2026-03-18 20:42:06,233] Trial 10 finished with value: -2.484296875 and parameters: {'n_layers_yyx': 1, 'hidden_size_yyx_l0': 6, 'context_size_yyx': 4, 'num_mix_components_yyx': 5, 'context_extractor_yyx': 'gru', 'activation_func_yyx': 'ReLU', 'L2_weight_yyx': 3.2333155064415097e-06, 'L_entropy_weight_yyx': 0.0008095437371157374, 'L_sep_weight_yyx': 6.81430456825769e-06, 'L_scale_weight_yyx': 2.473190247291398e-07, 'learning_rate_yyx': 0.009133135567356359}. Best is trial 7 with value: -2.4847766941812783.
[I 2026-03-18 20:42:25,025] Trial 11 pruned. 
[I 2026-03-18 20:42:40,114] Trial 13 pruned. 
[I 2026-03-18 20:42:48,364] Trial 9 pruned. 
[I 2026-03-18 20:42:51,632] Trial 9 pruned. 
[I 2026-03-18 20:43:04,948] Trial 11 pruned. 
[I 2026-03-18 20:43:08,995] Trial 12 pruned. 
[I 2026-03-18 20:43:10,050] Trial 7 finished with value: -1.853951857601433 and parameters: {'n_layers_yyx': 1, 'hidden_size_yyx_l0': 6, 'context_size_yyx': 4, 'num_mix_components_yyx': 4, 'context_extractor_yyx': 'lstm', 'activation_func_yyx': 'GELU', 'L2_weight_yyx': 1.7658340763356896e-06, 'L_entropy_weight_yyx': 2.6112606229139913e-05, 'L_sep_weight_yyx': 3.6136833455503946e-09, 'L_scale_weight_yyx': 1.2358874119641306e-09, 'learning_rate_yyx': 0.0008280026412112927}. Best is trial 0 with value: -1.867639598732223.
[I 2026-03-18 20:43:15,418] Trial 14 pruned. 
[I 2026-03-18 20:43:34,953] Trial 14 finished with value: -1.4023474927218456 and parameters: {'n_layers_yyx': 1, 'hidden_size_yyx_l0': 3, 'context_size_yyx': 3, 'num_mix_components_yyx': 3, 'context_extractor_yyx': 'gru', 'activation_func_yyx': 'Tanh', 'L2_weight_yyx': 2.119911711165271e-08, 'L_entropy_weight_yyx': 0.00035848286490288724, 'L_sep_weight_yyx': 2.907474658580594e-08, 'L_scale_weight_yyx': 6.77027908601432e-07, 'learning_rate_yyx': 0.0032875151179978805}. Best is trial 0 with value: -1.4467010977883008.
[I 2026-03-18 20:43:34,966] Trial 10 pruned. 
[I 2026-03-18 20:43:44,258] Trial 9 finished with value: -1.8570869006965198 and parameters: {'n_layers_yyx': 2, 'hidden_size_yyx_l0': 5, 'hidden_size_yyx_l1': 4, 'context_size_yyx': 2, 'num_mix_components_yyx': 4, 'context_extractor_yyx': 'gru', 'activation_func_yyx': 'Tanh', 'L2_weight_yyx': 0.0001563616853632172, 'L_entropy_weight_yyx': 9.337227397361023e-07, 'L_sep_weight_yyx': 1.0886571474422762e-10, 'L_scale_weight_yyx': 7.907798621119364e-10, 'learning_rate_yyx': 0.006048104685494409}. Best is trial 9 with value: -1.8570869006965198.
[I 2026-03-18 20:43:57,886] Trial 7 finished with value: -2.4440851558277306 and parameters: {'n_layers_yyx': 2, 'hidden_size_yyx_l0': 5, 'hidden_size_yyx_l1': 2, 'context_size_yyx': 1, 'num_mix_components_yyx': 4, 'context_extractor_yyx': 'lstm', 'activation_func_yyx': 'ReLU', 'L2_weight_yyx': 1.3302999166134467e-05, 'L_entropy_weight_yyx': 1.8746263106980494e-05, 'L_sep_weight_yyx': 5.339621441955455e-07, 'L_scale_weight_yyx': 1.8608404709318086e-09, 'learning_rate_yyx': 0.0012671686748269037}. Best is trial 1 with value: -2.4633966237885176.
[I 2026-03-18 20:44:00,143] Trial 8 pruned. 
[I 2026-03-18 20:44:00,145] Trial 10 finished with value: -1.8881648729739453 and parameters: {'n_layers_yyx': 2, 'hidden_size_yyx_l0': 2, 'hidden_size_yyx_l1': 6, 'context_size_yyx': 1, 'num_mix_components_yyx': 5, 'context_extractor_yyx': 'lstm', 'activation_func_yyx': 'ReLU', 'L2_weight_yyx': 1.4339236455496831e-05, 'L_entropy_weight_yyx': 0.0009638568511056928, 'L_sep_weight_yyx': 2.350159607120021e-10, 'L_scale_weight_yyx': 2.8382307290942507e-08, 'learning_rate_yyx': 0.007646081083469967}. Best is trial 5 with value: -1.89157565728699.
[I 2026-03-18 20:44:00,225] Trial 15 pruned. 
[I 2026-03-18 20:44:14,971] Trial 7 finished with value: -1.9305760003749655 and parameters: {'n_layers_yyx': 2, 'hidden_size_yyx_l0': 6, 'hidden_size_yyx_l1': 3, 'context_size_yyx': 3, 'num_mix_components_yyx': 4, 'context_extractor_yyx': 'lstm', 'activation_func_yyx': 'ReLU', 'L2_weight_yyx': 2.512001064854393e-06, 'L_entropy_weight_yyx': 0.00012177035607271224, 'L_sep_weight_yyx': 0.00010430631904483905, 'L_scale_weight_yyx': 2.7616374907254257e-08, 'learning_rate_yyx': 0.0047251539172853615}. Best is trial 0 with value: -1.9368961358079142.
[I 2026-03-18 20:44:14,975] Trial 13 finished with value: -1.5658462904526245 and parameters: {'n_layers_yyx': 2, 'hidden_size_yyx_l0': 5, 'hidden_size_yyx_l1': 4, 'context_size_yyx': 2, 'num_mix_components_yyx': 4, 'context_extractor_yyx': 'gru', 'activation_func_yyx': 'Tanh', 'L2_weight_yyx': 1.5800827962567465e-07, 'L_entropy_weight_yyx': 9.02232250291077e-09, 'L_sep_weight_yyx': 1.5982725583371284e-08, 'L_scale_weight_yyx': 2.1588966118717863e-08, 'learning_rate_yyx': 0.001600225766589033}. Best is trial 13 with value: -1.5658462904526245.
[I 2026-03-18 20:44:25,264] Trial 11 pruned. 
[I 2026-03-18 20:44:32,040] Trial 13 pruned. 
[I 2026-03-18 20:44:37,500] Trial 11 finished with value: -1.8610449438696508 and parameters: {'n_layers_yyx': 2, 'hidden_size_yyx_l0': 5, 'hidden_size_yyx_l1': 5, 'context_size_yyx': 3, 'num_mix_components_yyx': 3, 'context_extractor_yyx': 'lstm', 'activation_func_yyx': 'ReLU', 'L2_weight_yyx': 3.5800372403905953e-06, 'L_entropy_weight_yyx': 4.466585007229166e-06, 'L_sep_weight_yyx': 1.389845954804851e-05, 'L_scale_weight_yyx': 1.0672295728103664e-10, 'learning_rate_yyx': 0.009548567536037937}. Best is trial 11 with value: -1.8610449438696508.
[I 2026-03-18 20:44:49,045] Trial 6 finished with value: -1.8550709006031272 and parameters: {'n_layers_yyx': 2, 'hidden_size_yyx_l0': 5, 'hidden_size_yyx_l1': 5, 'context_size_yyx': 1, 'num_mix_components_yyx': 3, 'context_extractor_yyx': 'lstm', 'activation_func_yyx': 'ReLU', 'L2_weight_yyx': 3.280243734430963e-08, 'L_entropy_weight_yyx': 2.3622031695908235e-07, 'L_sep_weight_yyx': 6.777685164138847e-06, 'L_scale_weight_yyx': 2.422810450578437e-06, 'learning_rate_yyx': 0.006744181784934415}. Best is trial 1 with value: -1.8555367853768732.
[I 2026-03-18 20:44:49,117] Trial 16 pruned. 
[I 2026-03-18 20:44:54,858] Trial 14 pruned. 
[I 2026-03-18 20:44:56,278] Trial 9 finished with value: -1.853392962523822 and parameters: {'n_layers_yyx': 2, 'hidden_size_yyx_l0': 5, 'hidden_size_yyx_l1': 2, 'context_size_yyx': 3, 'num_mix_components_yyx': 1, 'context_extractor_yyx': 'gru', 'activation_func_yyx': 'Tanh', 'L2_weight_yyx': 6.970327309121481e-10, 'L_entropy_weight_yyx': 1.0377346929164393e-10, 'L_sep_weight_yyx': 1.8910158891735375e-08, 'L_scale_weight_yyx': 2.124778462427687e-09, 'learning_rate_yyx': 0.0061705123120687645}. Best is trial 9 with value: -1.853392962523822.
[I 2026-03-18 20:45:00,235] Trial 12 pruned. 
[I 2026-03-18 20:45:02,671] Trial 12 pruned. 
[I 2026-03-18 20:45:05,726] Trial 12 pruned. 
[I 2026-03-18 20:45:25,866] Trial 10 finished with value: -1.4242164494441105 and parameters: {'n_layers_yyx': 2, 'hidden_size_yyx_l0': 4, 'hidden_size_yyx_l1': 2, 'context_size_yyx': 1, 'num_mix_components_yyx': 4, 'context_extractor_yyx': 'gru', 'activation_func_yyx': 'GELU', 'L2_weight_yyx': 1.223173332162325e-06, 'L_entropy_weight_yyx': 3.801497169932615e-05, 'L_sep_weight_yyx': 5.6896641510775007e-08, 'L_scale_weight_yyx': 3.2566005703382466e-08, 'learning_rate_yyx': 0.009106311859092036}. Best is trial 1 with value: -1.4345258507361778.
[I 2026-03-18 20:45:25,916] Trial 14 finished with value: -1.4535509549654446 and parameters: {'n_layers_yyx': 2, 'hidden_size_yyx_l0': 5, 'hidden_size_yyx_l1': 5, 'context_size_yyx': 3, 'num_mix_components_yyx': 4, 'context_extractor_yyx': 'lstm', 'activation_func_yyx': 'Tanh', 'L2_weight_yyx': 1.6872472627277482e-07, 'L_entropy_weight_yyx': 9.670422839148903e-06, 'L_sep_weight_yyx': 1.7633111478647778e-07, 'L_scale_weight_yyx': 6.618823310112845e-08, 'learning_rate_yyx': 0.0041782324396796924}. Best is trial 10 with value: -1.4553572904146634.
[I 2026-03-18 20:45:35,458] Trial 15 pruned. 
[I 2026-03-18 20:45:42,132] Trial 6 finished with value: -1.9042502449101777 and parameters: {'n_layers_yyx': 2, 'hidden_size_yyx_l0': 6, 'hidden_size_yyx_l1': 2, 'context_size_yyx': 4, 'num_mix_components_yyx': 1, 'context_extractor_yyx': 'gru', 'activation_func_yyx': 'Tanh', 'L2_weight_yyx': 3.320124474398036e-10, 'L_entropy_weight_yyx': 9.944022979063998e-09, 'L_sep_weight_yyx': 4.651948668678951e-10, 'L_scale_weight_yyx': 8.662630932032264e-08, 'learning_rate_yyx': 0.0005689822151256015}. Best is trial 1 with value: -1.9300911785393273.
[I 2026-03-18 20:45:47,028] Trial 13 pruned. 
[I 2026-03-18 20:45:53,641] Trial 11 pruned. 
[I 2026-03-18 20:45:57,571] Trial 7 pruned. 
[I 2026-03-18 20:46:00,590] Trial 15 pruned. 
[I 2026-03-18 20:46:01,038] Trial 11 pruned. 
[I 2026-03-18 20:46:02,838] Trial 25 finished with value: -2.4764732316599813 and parameters: {'n_layers_yyx': 1, 'hidden_size_yyx_l0': 6, 'context_size_yyx': 4, 'num_mix_components_yyx': 5, 'context_extractor_yyx': 'gru', 'activation_func_yyx': 'ReLU', 'L2_weight_yyx': 2.2442590363284632e-08, 'L_entropy_weight_yyx': 3.855285447717428e-07, 'L_sep_weight_yyx': 0.00017155785065882422, 'L_scale_weight_yyx': 0.00015176492483768406, 'learning_rate_yyx': 0.009912034190511416}. Best is trial 25 with value: -2.4764732316599813.
[I 2026-03-18 20:46:13,425] Trial 13 pruned. 
[I 2026-03-18 20:46:14,367] Trial 13 pruned. 
[I 2026-03-18 20:46:19,704] Trial 14 pruned. 
[I 2026-03-18 20:46:37,229] Trial 9 finished with value: -2.48986224985113 and parameters: {'n_layers_yyx': 1, 'hidden_size_yyx_l0': 3, 'context_size_yyx': 3, 'num_mix_components_yyx': 4, 'context_extractor_yyx': 'lstm', 'activation_func_yyx': 'GELU', 'L2_weight_yyx': 4.774819363293697e-10, 'L_entropy_weight_yyx': 3.9333805041354983e-10, 'L_sep_weight_yyx': 9.657331906960133e-09, 'L_scale_weight_yyx': 7.496546638542625e-10, 'learning_rate_yyx': 0.005412048582539042}. Best is trial 4 with value: -2.49523174750643.
[I 2026-03-18 20:46:42,559] Trial 12 pruned. 
[I 2026-03-18 20:47:16,797] Trial 14 pruned. 
[I 2026-03-18 20:47:19,981] Trial 17 pruned. 
[I 2026-03-18 20:47:21,262] Trial 26 pruned. 
[I 2026-03-18 20:47:24,183] Trial 14 pruned. 
[I 2026-03-18 20:47:38,399] Trial 19 finished with value: -1.4628589806189904 and parameters: {'n_layers_yyx': 2, 'hidden_size_yyx_l0': 3, 'hidden_size_yyx_l1': 4, 'context_size_yyx': 2, 'num_mix_components_yyx': 3, 'context_extractor_yyx': 'lstm', 'activation_func_yyx': 'GELU', 'L2_weight_yyx': 1.0243990281238773e-06, 'L_entropy_weight_yyx': 8.240113208292851e-07, 'L_sep_weight_yyx': 0.0001508595390808669, 'L_scale_weight_yyx': 5.6280866844258554e-08, 'learning_rate_yyx': 0.009731660986949208}. Best is trial 19 with value: -1.4628589806189904.
[I 2026-03-18 20:48:01,549] Trial 11 finished with value: -1.8480407565404753 and parameters: {'n_layers_yyx': 2, 'hidden_size_yyx_l0': 3, 'hidden_size_yyx_l1': 6, 'context_size_yyx': 1, 'num_mix_components_yyx': 4, 'context_extractor_yyx': 'lstm', 'activation_func_yyx': 'GELU', 'L2_weight_yyx': 6.632440535023899e-09, 'L_entropy_weight_yyx': 0.0006719198008550529, 'L_sep_weight_yyx': 0.00042258182973884675, 'L_scale_weight_yyx': 1.0493802649568627e-05, 'learning_rate_yyx': 0.009943897630575025}. Best is trial 11 with value: -1.8480407565404753.
[I 2026-03-18 20:48:06,030] Trial 16 pruned. 
[I 2026-03-18 20:48:09,844] Trial 17 finished with value: -1.804705005203914 and parameters: {'n_layers_yyx': 2, 'hidden_size_yyx_l0': 5, 'hidden_size_yyx_l1': 4, 'context_size_yyx': 3, 'num_mix_components_yyx': 3, 'context_extractor_yyx': 'gru', 'activation_func_yyx': 'GELU', 'L2_weight_yyx': 9.087820372264117e-10, 'L_entropy_weight_yyx': 1.871943050687547e-06, 'L_sep_weight_yyx': 0.00029064112134584284, 'L_scale_weight_yyx': 0.000984751531871655, 'learning_rate_yyx': 0.005136651512843263}. Best is trial 17 with value: -1.804705005203914.
[I 2026-03-18 20:48:17,356] Trial 6 finished with value: -1.781502870501894 and parameters: {'n_layers_yyx': 2, 'hidden_size_yyx_l0': 6, 'hidden_size_yyx_l1': 2, 'context_size_yyx': 3, 'num_mix_components_yyx': 2, 'context_extractor_yyx': 'gru', 'activation_func_yyx': 'GELU', 'L2_weight_yyx': 3.3890191672353114e-08, 'L_entropy_weight_yyx': 1.358815881046267e-10, 'L_sep_weight_yyx': 5.7797744519355385e-09, 'L_scale_weight_yyx': 5.392747207356458e-07, 'learning_rate_yyx': 0.005759527799863893}. Best is trial 6 with value: -1.781502870501894.
[I 2026-03-18 20:48:17,612] Trial 15 pruned. 
[I 2026-03-18 20:48:19,399] Trial 8 finished with value: -2.442726673862768 and parameters: {'n_layers_yyx': 2, 'hidden_size_yyx_l0': 6, 'hidden_size_yyx_l1': 2, 'context_size_yyx': 3, 'num_mix_components_yyx': 5, 'context_extractor_yyx': 'lstm', 'activation_func_yyx': 'Tanh', 'L2_weight_yyx': 0.00048623646440496904, 'L_entropy_weight_yyx': 1.5296259931888463e-10, 'L_sep_weight_yyx': 2.4933219257151666e-06, 'L_scale_weight_yyx': 8.629188925518071e-05, 'learning_rate_yyx': 0.009595044809604042}. Best is trial 1 with value: -2.4633966237885176.
[I 2026-03-18 20:48:25,787] Trial 7 pruned. 
[I 2026-03-18 20:48:44,758] Trial 17 pruned. 
[I 2026-03-18 20:48:46,165] Trial 18 pruned. 
[I 2026-03-18 20:49:00,819] Trial 8 pruned. 
[I 2026-03-18 20:49:01,217] Trial 12 pruned. 
[I 2026-03-18 20:49:05,690] Trial 10 finished with value: -1.7854601680871212 and parameters: {'n_layers_yyx': 2, 'hidden_size_yyx_l0': 6, 'hidden_size_yyx_l1': 6, 'context_size_yyx': 2, 'num_mix_components_yyx': 5, 'context_extractor_yyx': 'gru', 'activation_func_yyx': 'GELU', 'L2_weight_yyx': 1.7323065564467768e-09, 'L_entropy_weight_yyx': 0.0006156532214426643, 'L_sep_weight_yyx': 0.00026051258501610486, 'L_scale_weight_yyx': 1.1802018166241466e-06, 'learning_rate_yyx': 0.009975552746953597}. Best is trial 4 with value: -1.7875800731928662.
[I 2026-03-18 20:49:07,800] Trial 15 pruned. 
[I 2026-03-18 20:49:20,558] Trial 12 pruned. 
[I 2026-03-18 20:49:30,783] Trial 19 pruned. 
[I 2026-03-18 20:49:41,958] Trial 12 finished with value: -1.856298646246156 and parameters: {'n_layers_yyx': 2, 'hidden_size_yyx_l0': 5, 'hidden_size_yyx_l1': 5, 'context_size_yyx': 3, 'num_mix_components_yyx': 3, 'context_extractor_yyx': 'lstm', 'activation_func_yyx': 'GELU', 'L2_weight_yyx': 4.831434846477813e-06, 'L_entropy_weight_yyx': 5.8859981827844936e-06, 'L_sep_weight_yyx': 2.26244495322538e-10, 'L_scale_weight_yyx': 9.307411868061265e-09, 'learning_rate_yyx': 0.009354739037812839}. Best is trial 11 with value: -1.8610449438696508.
[I 2026-03-18 20:49:43,413] Trial 12 finished with value: -1.895511660082587 and parameters: {'n_layers_yyx': 2, 'hidden_size_yyx_l0': 3, 'hidden_size_yyx_l1': 6, 'context_size_yyx': 3, 'num_mix_components_yyx': 4, 'context_extractor_yyx': 'lstm', 'activation_func_yyx': 'ReLU', 'L2_weight_yyx': 2.7611976331388105e-05, 'L_entropy_weight_yyx': 5.970004502691607e-06, 'L_sep_weight_yyx': 4.304148231160338e-08, 'L_scale_weight_yyx': 1.1896067856664443e-10, 'learning_rate_yyx': 0.009812259044911809}. Best is trial 4 with value: -1.896486501584108.
[I 2026-03-18 20:49:43,923] Trial 14 finished with value: -1.5086317218717982 and parameters: {'n_layers_yyx': 2, 'hidden_size_yyx_l0': 5, 'hidden_size_yyx_l1': 4, 'context_size_yyx': 1, 'num_mix_components_yyx': 5, 'context_extractor_yyx': 'lstm', 'activation_func_yyx': 'GELU', 'L2_weight_yyx': 1.1766764694195342e-07, 'L_entropy_weight_yyx': 1.501508657813635e-08, 'L_sep_weight_yyx': 1.1426788486738886e-08, 'L_scale_weight_yyx': 3.848022334049471e-08, 'learning_rate_yyx': 0.00986807548688628}. Best is trial 0 with value: -1.5190498727266906.
[I 2026-03-18 20:49:46,190] Trial 9 pruned. 
[I 2026-03-18 20:50:06,166] Trial 8 finished with value: -1.8355990573092624 and parameters: {'n_layers_yyx': 1, 'hidden_size_yyx_l0': 6, 'context_size_yyx': 4, 'num_mix_components_yyx': 1, 'context_extractor_yyx': 'lstm', 'activation_func_yyx': 'GELU', 'L2_weight_yyx': 2.2780857815048924e-06, 'L_entropy_weight_yyx': 1.334084137682674e-06, 'L_sep_weight_yyx': 1.6579693896274016e-07, 'L_scale_weight_yyx': 1.4735886362146267e-09, 'learning_rate_yyx': 0.0050104172176018095}. Best is trial 1 with value: -1.8555367853768732.
[I 2026-03-18 20:50:19,222] Trial 15 pruned. 
[I 2026-03-18 20:50:19,225] Trial 15 pruned. 
[I 2026-03-18 20:50:21,844] Trial 13 pruned. 
[I 2026-03-18 20:50:26,669] Trial 8 finished with value: -1.9352732942840025 and parameters: {'n_layers_yyx': 2, 'hidden_size_yyx_l0': 2, 'hidden_size_yyx_l1': 4, 'context_size_yyx': 4, 'num_mix_components_yyx': 4, 'context_extractor_yyx': 'gru', 'activation_func_yyx': 'Tanh', 'L2_weight_yyx': 0.00035615918469789315, 'L_entropy_weight_yyx': 3.7215612725830295e-06, 'L_sep_weight_yyx': 4.032630195754593e-07, 'L_scale_weight_yyx': 3.240860655385202e-10, 'learning_rate_yyx': 0.006519325326044455}. Best is trial 0 with value: -1.9368961358079142.
[I 2026-03-18 20:50:35,578] Trial 13 pruned. 
