[I 2026-03-18 20:58:23,401] Trial 24 pruned. 
[I 2026-03-18 20:58:23,763] Trial 17 pruned. 
[I 2026-03-18 20:58:24,886] Trial 25 pruned. 
[I 2026-03-18 20:58:26,525] Trial 32 finished with value: -2.472016665160897 and parameters: {'n_layers_yyx': 1, 'hidden_size_yyx_l0': 6, 'context_size_yyx': 2, 'num_mix_components_yyx': 5, 'context_extractor_yyx': 'gru', 'activation_func_yyx': 'ReLU', 'L2_weight_yyx': 1.3100949679999711e-06, 'L_entropy_weight_yyx': 7.82135849661762e-09, 'L_sep_weight_yyx': 0.00012170889211303708, 'L_scale_weight_yyx': 2.102924560070744e-06, 'learning_rate_yyx': 0.009930295036273655}. Best is trial 25 with value: -2.4764732316599813.
[I 2026-03-18 20:58:29,722] Trial 17 pruned. 
[I 2026-03-18 20:58:40,074] Trial 19 pruned. 
[I 2026-03-18 20:58:40,584] Trial 20 pruned. 
[I 2026-03-18 20:58:43,536] Trial 9 pruned. 
[I 2026-03-18 20:58:45,790] Trial 23 pruned. 
[I 2026-03-18 20:58:49,571] Trial 25 pruned. 
[I 2026-03-18 20:58:49,601] Trial 14 pruned. 
[I 2026-03-18 20:58:52,449] Trial 18 pruned. 
[I 2026-03-18 20:58:57,677] Trial 33 pruned. 
[I 2026-03-18 20:58:58,944] Trial 13 pruned. 
[I 2026-03-18 20:58:59,106] Trial 15 pruned. 
[I 2026-03-18 20:59:09,334] Trial 15 finished with value: -1.8882862704237697 and parameters: {'n_layers_yyx': 2, 'hidden_size_yyx_l0': 4, 'hidden_size_yyx_l1': 5, 'context_size_yyx': 4, 'num_mix_components_yyx': 5, 'context_extractor_yyx': 'lstm', 'activation_func_yyx': 'Tanh', 'L2_weight_yyx': 2.2356137651768627e-06, 'L_entropy_weight_yyx': 7.223685915562544e-06, 'L_sep_weight_yyx': 6.10627325248575e-07, 'L_scale_weight_yyx': 6.223669517731888e-09, 'learning_rate_yyx': 0.001614280840246616}. Best is trial 5 with value: -1.89157565728699.
[I 2026-03-18 20:59:12,363] Trial 10 finished with value: -2.473193107036748 and parameters: {'n_layers_yyx': 2, 'hidden_size_yyx_l0': 2, 'hidden_size_yyx_l1': 4, 'context_size_yyx': 1, 'num_mix_components_yyx': 4, 'context_extractor_yyx': 'lstm', 'activation_func_yyx': 'Tanh', 'L2_weight_yyx': 1.2443752994821686e-10, 'L_entropy_weight_yyx': 0.0008167312102172096, 'L_sep_weight_yyx': 3.123106584480898e-10, 'L_scale_weight_yyx': 0.0007890620775971396, 'learning_rate_yyx': 0.0026892762852651886}. Best is trial 10 with value: -2.473193107036748.
[I 2026-03-18 20:59:14,434] Trial 26 pruned. 
[I 2026-03-18 20:59:16,298] Trial 26 pruned. 
[I 2026-03-18 20:59:16,804] Trial 19 pruned. 
[I 2026-03-18 20:59:17,335] Trial 13 finished with value: -1.858157596072635 and parameters: {'n_layers_yyx': 2, 'hidden_size_yyx_l0': 4, 'hidden_size_yyx_l1': 4, 'context_size_yyx': 4, 'num_mix_components_yyx': 3, 'context_extractor_yyx': 'lstm', 'activation_func_yyx': 'ReLU', 'L2_weight_yyx': 3.5294735679869414e-06, 'L_entropy_weight_yyx': 1.8421158095458897e-08, 'L_sep_weight_yyx': 8.868396209637717e-06, 'L_scale_weight_yyx': 1.2601814622350337e-10, 'learning_rate_yyx': 0.000501934484981452}. Best is trial 11 with value: -1.8610449438696508.
[I 2026-03-18 20:59:21,442] Trial 16 pruned. 
[I 2026-03-18 20:59:26,322] Trial 20 pruned. 
[I 2026-03-18 20:59:27,200] Trial 34 pruned. 
[I 2026-03-18 20:59:36,258] Trial 12 finished with value: -1.852954951740352 and parameters: {'n_layers_yyx': 2, 'hidden_size_yyx_l0': 5, 'hidden_size_yyx_l1': 3, 'context_size_yyx': 3, 'num_mix_components_yyx': 2, 'context_extractor_yyx': 'gru', 'activation_func_yyx': 'Tanh', 'L2_weight_yyx': 3.097527549146417e-05, 'L_entropy_weight_yyx': 0.0008465411952698084, 'L_sep_weight_yyx': 1.7636038703319943e-08, 'L_scale_weight_yyx': 5.359631151402918e-09, 'learning_rate_yyx': 0.008955478387765147}. Best is trial 9 with value: -1.853392962523822.
[I 2026-03-18 20:59:42,507] Trial 20 pruned. 
[I 2026-03-18 20:59:43,918] Trial 14 pruned. 
[I 2026-03-18 20:59:57,141] Trial 15 finished with value: -2.4843601969032805 and parameters: {'n_layers_yyx': 1, 'hidden_size_yyx_l0': 6, 'context_size_yyx': 3, 'num_mix_components_yyx': 2, 'context_extractor_yyx': 'gru', 'activation_func_yyx': 'ReLU', 'L2_weight_yyx': 1.267857161872788e-10, 'L_entropy_weight_yyx': 2.9241781462339555e-08, 'L_sep_weight_yyx': 6.665203284933066e-05, 'L_scale_weight_yyx': 2.088220887721651e-09, 'learning_rate_yyx': 0.00546162282519827}. Best is trial 13 with value: -2.4850502863404977.
[I 2026-03-18 20:59:58,441] Trial 35 pruned. 
[I 2026-03-18 21:00:02,817] Trial 16 pruned. 
[I 2026-03-18 21:00:09,855] Trial 15 pruned. 
[I 2026-03-18 21:00:15,642] Trial 18 pruned. 
[I 2026-03-18 21:00:25,554] Trial 36 pruned. 
[I 2026-03-18 21:00:25,587] Trial 16 pruned. 
[I 2026-03-18 21:00:27,983] Trial 21 pruned. 
[I 2026-03-18 21:00:28,701] Trial 21 pruned. 
[I 2026-03-18 21:00:31,438] Trial 13 pruned. 
[I 2026-03-18 21:00:35,790] Trial 22 finished with value: -1.3272908841646636 and parameters: {'n_layers_yyx': 2, 'hidden_size_yyx_l0': 3, 'hidden_size_yyx_l1': 4, 'context_size_yyx': 2, 'num_mix_components_yyx': 2, 'context_extractor_yyx': 'lstm', 'activation_func_yyx': 'GELU', 'L2_weight_yyx': 4.685718047051548e-08, 'L_entropy_weight_yyx': 1.913361706454357e-06, 'L_sep_weight_yyx': 0.00014712126565397576, 'L_scale_weight_yyx': 5.179365567507369e-09, 'learning_rate_yyx': 0.0072078135852123104}. Best is trial 19 with value: -1.4628589806189904.
[I 2026-03-18 21:00:41,005] Trial 19 pruned. 
[I 2026-03-18 21:00:41,774] Trial 21 finished with value: -1.8931661803146889 and parameters: {'n_layers_yyx': 2, 'hidden_size_yyx_l0': 3, 'hidden_size_yyx_l1': 6, 'context_size_yyx': 3, 'num_mix_components_yyx': 4, 'context_extractor_yyx': 'lstm', 'activation_func_yyx': 'ReLU', 'L2_weight_yyx': 2.5995728840250533e-05, 'L_entropy_weight_yyx': 2.446970637621797e-06, 'L_sep_weight_yyx': 3.3982967622460125e-07, 'L_scale_weight_yyx': 1.02194735096776e-10, 'learning_rate_yyx': 0.00990387244051647}. Best is trial 4 with value: -1.896486501584108.
[I 2026-03-18 21:00:52,398] Trial 37 pruned. 
[I 2026-03-18 21:00:59,227] Trial 11 finished with value: -1.9393307291965969 and parameters: {'n_layers_yyx': 1, 'hidden_size_yyx_l0': 3, 'context_size_yyx': 4, 'num_mix_components_yyx': 1, 'context_extractor_yyx': 'gru', 'activation_func_yyx': 'ReLU', 'L2_weight_yyx': 2.0340379152788823e-08, 'L_entropy_weight_yyx': 2.985209698902273e-10, 'L_sep_weight_yyx': 0.000944199988462787, 'L_scale_weight_yyx': 4.7798201841308665e-06, 'learning_rate_yyx': 0.009091187865188874}. Best is trial 10 with value: -1.9395614910230956.
[I 2026-03-18 21:00:59,721] Trial 27 pruned. 
[I 2026-03-18 21:01:01,834] Trial 21 finished with value: -1.4174630502554086 and parameters: {'n_layers_yyx': 2, 'hidden_size_yyx_l0': 6, 'hidden_size_yyx_l1': 5, 'context_size_yyx': 4, 'num_mix_components_yyx': 2, 'context_extractor_yyx': 'gru', 'activation_func_yyx': 'GELU', 'L2_weight_yyx': 4.8499545735426915e-08, 'L_entropy_weight_yyx': 0.00010582166790412715, 'L_sep_weight_yyx': 1.794484049914104e-07, 'L_scale_weight_yyx': 1.0011463309044815e-09, 'learning_rate_yyx': 0.009370145260720188}. Best is trial 1 with value: -1.4389243727463943.
[I 2026-03-18 21:01:06,401] Trial 20 pruned. 
[I 2026-03-18 21:01:07,276] Trial 13 finished with value: -1.4490255267803485 and parameters: {'n_layers_yyx': 1, 'hidden_size_yyx_l0': 4, 'context_size_yyx': 3, 'num_mix_components_yyx': 4, 'context_extractor_yyx': 'lstm', 'activation_func_yyx': 'ReLU', 'L2_weight_yyx': 2.452368237467495e-06, 'L_entropy_weight_yyx': 3.404772752105146e-07, 'L_sep_weight_yyx': 8.299530422090498e-06, 'L_scale_weight_yyx': 2.569094714365138e-06, 'learning_rate_yyx': 0.005372760222476147}. Best is trial 13 with value: -1.4490255267803485.
[I 2026-03-18 21:01:09,956] Trial 17 pruned. 
[I 2026-03-18 21:01:11,199] Trial 23 finished with value: -1.3940486731896033 and parameters: {'n_layers_yyx': 1, 'hidden_size_yyx_l0': 6, 'context_size_yyx': 3, 'num_mix_components_yyx': 4, 'context_extractor_yyx': 'gru', 'activation_func_yyx': 'Tanh', 'L2_weight_yyx': 8.783817612388231e-10, 'L_entropy_weight_yyx': 5.3717141838289694e-08, 'L_sep_weight_yyx': 1.1552902790388739e-09, 'L_scale_weight_yyx': 2.6202270337582087e-05, 'learning_rate_yyx': 0.004637138391610735}. Best is trial 18 with value: -1.4460073383037861.
[I 2026-03-18 21:01:11,512] Trial 22 pruned. 
[I 2026-03-18 21:01:12,256] Trial 21 pruned. 
[I 2026-03-18 21:01:17,517] Trial 23 pruned. 
[I 2026-03-18 21:01:18,341] Trial 14 pruned. 
[I 2026-03-18 21:01:23,742] Trial 18 finished with value: -1.8513545659541752 and parameters: {'n_layers_yyx': 2, 'hidden_size_yyx_l0': 4, 'hidden_size_yyx_l1': 5, 'context_size_yyx': 3, 'num_mix_components_yyx': 4, 'context_extractor_yyx': 'gru', 'activation_func_yyx': 'Tanh', 'L2_weight_yyx': 1.4749221792244265e-07, 'L_entropy_weight_yyx': 5.483073358164622e-08, 'L_sep_weight_yyx': 5.6497943365242095e-09, 'L_scale_weight_yyx': 7.661338232275556e-10, 'learning_rate_yyx': 0.00776153958799773}. Best is trial 9 with value: -1.8570869006965198.
[I 2026-03-18 21:01:28,863] Trial 22 pruned. 
[I 2026-03-18 21:01:36,905] Trial 28 pruned. 
[I 2026-03-18 21:01:37,206] Trial 24 pruned. 
[I 2026-03-18 21:01:40,838] Trial 12 pruned. 
[I 2026-03-18 21:01:42,258] Trial 38 pruned. 
[I 2026-03-18 21:01:43,122] Trial 19 finished with value: -1.3244935021033655 and parameters: {'n_layers_yyx': 1, 'hidden_size_yyx_l0': 5, 'context_size_yyx': 3, 'num_mix_components_yyx': 4, 'context_extractor_yyx': 'lstm', 'activation_func_yyx': 'Tanh', 'L2_weight_yyx': 1.1796170246973195e-05, 'L_entropy_weight_yyx': 3.002610636152977e-05, 'L_sep_weight_yyx': 1.379490188787151e-06, 'L_scale_weight_yyx': 1.3953103604003145e-05, 'learning_rate_yyx': 0.0009045608390994119}. Best is trial 7 with value: -1.4538350266676683.
[I 2026-03-18 21:01:53,132] Trial 17 finished with value: -2.457395649215215 and parameters: {'n_layers_yyx': 1, 'hidden_size_yyx_l0': 6, 'context_size_yyx': 4, 'num_mix_components_yyx': 2, 'context_extractor_yyx': 'lstm', 'activation_func_yyx': 'ReLU', 'L2_weight_yyx': 2.2440592799567403e-08, 'L_entropy_weight_yyx': 3.2001304121750935e-08, 'L_sep_weight_yyx': 4.3358158771374335e-07, 'L_scale_weight_yyx': 1.257774904033305e-06, 'learning_rate_yyx': 0.007164719889401456}. Best is trial 13 with value: -2.4850502863404977.
[I 2026-03-18 21:01:59,314] Trial 25 pruned. 
[I 2026-03-18 21:02:03,195] Trial 16 pruned. 
[I 2026-03-18 21:02:05,670] Trial 19 pruned. 
[I 2026-03-18 21:02:13,582] Trial 29 pruned. 
[I 2026-03-18 21:02:17,580] Trial 18 pruned. 
[I 2026-03-18 21:02:21,725] Trial 15 finished with value: -2.493036362551154 and parameters: {'n_layers_yyx': 1, 'hidden_size_yyx_l0': 6, 'context_size_yyx': 4, 'num_mix_components_yyx': 5, 'context_extractor_yyx': 'gru', 'activation_func_yyx': 'GELU', 'L2_weight_yyx': 9.558911431338048e-09, 'L_entropy_weight_yyx': 2.166284453818925e-06, 'L_sep_weight_yyx': 1.0946380510042282e-10, 'L_scale_weight_yyx': 1.3117295081546123e-06, 'learning_rate_yyx': 0.007294630936050253}. Best is trial 4 with value: -2.49523174750643.
[I 2026-03-18 21:02:21,943] Trial 13 pruned. 
[I 2026-03-18 21:02:29,285] Trial 22 pruned. 
[I 2026-03-18 21:02:32,236] Trial 39 pruned. 
[I 2026-03-18 21:02:34,184] Trial 23 pruned. 
[I 2026-03-18 21:02:34,255] Trial 24 pruned. 
[I 2026-03-18 21:02:35,139] Trial 16 finished with value: -1.4314359224759616 and parameters: {'n_layers_yyx': 2, 'hidden_size_yyx_l0': 2, 'hidden_size_yyx_l1': 5, 'context_size_yyx': 4, 'num_mix_components_yyx': 2, 'context_extractor_yyx': 'gru', 'activation_func_yyx': 'Tanh', 'L2_weight_yyx': 5.606020794355155e-05, 'L_entropy_weight_yyx': 9.862649778039762e-05, 'L_sep_weight_yyx': 3.381533210515898e-06, 'L_scale_weight_yyx': 5.543845187580329e-07, 'learning_rate_yyx': 0.006087240599409628}. Best is trial 13 with value: -1.4421805044320914.
[I 2026-03-18 21:02:42,745] Trial 17 pruned. 
[I 2026-03-18 21:02:43,086] Trial 20 pruned. 
[I 2026-03-18 21:02:45,404] Trial 22 finished with value: -1.3347314922626201 and parameters: {'n_layers_yyx': 2, 'hidden_size_yyx_l0': 5, 'hidden_size_yyx_l1': 6, 'context_size_yyx': 3, 'num_mix_components_yyx': 2, 'context_extractor_yyx': 'lstm', 'activation_func_yyx': 'Tanh', 'L2_weight_yyx': 0.00019919766918698731, 'L_entropy_weight_yyx': 2.3912155524845495e-07, 'L_sep_weight_yyx': 2.707540105816809e-05, 'L_scale_weight_yyx': 0.000816116955017255, 'learning_rate_yyx': 0.00641264593621678}. Best is trial 10 with value: -1.4553572904146634.
[I 2026-03-18 21:02:45,756] Trial 12 finished with value: -1.8566309981104903 and parameters: {'n_layers_yyx': 2, 'hidden_size_yyx_l0': 6, 'hidden_size_yyx_l1': 5, 'context_size_yyx': 1, 'num_mix_components_yyx': 2, 'context_extractor_yyx': 'gru', 'activation_func_yyx': 'GELU', 'L2_weight_yyx': 1.886999828182015e-05, 'L_entropy_weight_yyx': 1.0857038360081363e-10, 'L_sep_weight_yyx': 1.2353107603242224e-10, 'L_scale_weight_yyx': 1.230335732172245e-07, 'learning_rate_yyx': 0.0030783228617025367}. Best is trial 12 with value: -1.8566309981104903.
[I 2026-03-18 21:02:49,301] Trial 30 pruned. 
[I 2026-03-18 21:02:53,157] Trial 21 pruned. 
[I 2026-03-18 21:02:57,177] Trial 40 pruned. 
[I 2026-03-18 21:03:00,010] Trial 10 finished with value: -1.7781765407986112 and parameters: {'n_layers_yyx': 2, 'hidden_size_yyx_l0': 6, 'hidden_size_yyx_l1': 6, 'context_size_yyx': 4, 'num_mix_components_yyx': 5, 'context_extractor_yyx': 'gru', 'activation_func_yyx': 'ReLU', 'L2_weight_yyx': 5.6789882158660135e-09, 'L_entropy_weight_yyx': 2.3530358445735817e-06, 'L_sep_weight_yyx': 7.108706239550772e-06, 'L_scale_weight_yyx': 4.309465867866504e-10, 'learning_rate_yyx': 0.0024836682862355414}. Best is trial 7 with value: -1.7817573439472854.
[I 2026-03-18 21:03:02,579] Trial 15 pruned. 
[I 2026-03-18 21:03:07,722] Trial 7 finished with value: -1.4535823880709136 and parameters: {'n_layers_yyx': 1, 'hidden_size_yyx_l0': 6, 'context_size_yyx': 3, 'num_mix_components_yyx': 2, 'context_extractor_yyx': 'lstm', 'activation_func_yyx': 'ReLU', 'L2_weight_yyx': 0.0002804794046662363, 'L_entropy_weight_yyx': 1.583472438814564e-09, 'L_sep_weight_yyx': 4.462035035012796e-08, 'L_scale_weight_yyx': 0.00027036721125690583, 'learning_rate_yyx': 0.0017673316240262933}. Best is trial 7 with value: -1.4535823880709136.
[I 2026-03-18 21:03:09,676] Trial 18 pruned. 
[I 2026-03-18 21:03:13,217] Trial 20 pruned. 
[I 2026-03-18 21:03:15,733] Trial 17 pruned. 
[I 2026-03-18 21:03:15,754] Trial 25 pruned. 
[I 2026-03-18 21:03:16,464] Trial 27 finished with value: -1.8062570642302185 and parameters: {'n_layers_yyx': 1, 'hidden_size_yyx_l0': 5, 'context_size_yyx': 4, 'num_mix_components_yyx': 3, 'context_extractor_yyx': 'gru', 'activation_func_yyx': 'GELU', 'L2_weight_yyx': 5.148720096321342e-09, 'L_entropy_weight_yyx': 7.422264263349895e-06, 'L_sep_weight_yyx': 1.1711782664769595e-05, 'L_scale_weight_yyx': 8.707220555543346e-09, 'learning_rate_yyx': 0.009479879860902077}. Best is trial 27 with value: -1.8062570642302185.
[I 2026-03-18 21:03:23,916] Trial 11 pruned. 
[I 2026-03-18 21:03:25,602] Trial 18 pruned. 
[I 2026-03-18 21:03:26,693] Trial 23 pruned. 
[I 2026-03-18 21:03:27,555] Trial 26 pruned. 
[I 2026-03-18 21:03:29,065] Trial 8 pruned. 
[I 2026-03-18 21:03:29,861] Trial 11 finished with value: -1.8678091384441595 and parameters: {'n_layers_yyx': 1, 'hidden_size_yyx_l0': 5, 'context_size_yyx': 2, 'num_mix_components_yyx': 3, 'context_extractor_yyx': 'lstm', 'activation_func_yyx': 'ReLU', 'L2_weight_yyx': 3.0429135136872154e-08, 'L_entropy_weight_yyx': 3.038681691498349e-05, 'L_sep_weight_yyx': 0.0001638301794759551, 'L_scale_weight_yyx': 4.916771743190199e-08, 'learning_rate_yyx': 0.0035880231942364456}. Best is trial 9 with value: -1.8693153029304443.
[I 2026-03-18 21:03:38,682] Trial 14 finished with value: -1.445308603140024 and parameters: {'n_layers_yyx': 2, 'hidden_size_yyx_l0': 4, 'hidden_size_yyx_l1': 6, 'context_size_yyx': 2, 'num_mix_components_yyx': 3, 'context_extractor_yyx': 'lstm', 'activation_func_yyx': 'ReLU', 'L2_weight_yyx': 1.775908215096511e-05, 'L_entropy_weight_yyx': 9.864914875120176e-07, 'L_sep_weight_yyx': 5.36294851323033e-06, 'L_scale_weight_yyx': 8.323521767799062e-05, 'learning_rate_yyx': 0.006411385036362981}. Best is trial 13 with value: -1.4490255267803485.
[I 2026-03-18 21:03:39,005] Trial 22 pruned. 
[I 2026-03-18 21:03:43,644] Trial 14 finished with value: -1.8529119564275813 and parameters: {'n_layers_yyx': 1, 'hidden_size_yyx_l0': 5, 'context_size_yyx': 2, 'num_mix_components_yyx': 2, 'context_extractor_yyx': 'lstm', 'activation_func_yyx': 'ReLU', 'L2_weight_yyx': 3.6620072295594755e-05, 'L_entropy_weight_yyx': 2.6048732701466796e-09, 'L_sep_weight_yyx': 3.7150796296987964e-09, 'L_scale_weight_yyx': 0.0001235305800381704, 'learning_rate_yyx': 0.009805159467669144}. Best is trial 1 with value: -1.8555367853768732.
[I 2026-03-18 21:03:46,137] Trial 11 finished with value: -2.472929883499765 and parameters: {'n_layers_yyx': 2, 'hidden_size_yyx_l0': 2, 'hidden_size_yyx_l1': 4, 'context_size_yyx': 1, 'num_mix_components_yyx': 4, 'context_extractor_yyx': 'lstm', 'activation_func_yyx': 'Tanh', 'L2_weight_yyx': 1.1249652932268598e-10, 'L_entropy_weight_yyx': 0.0009320121843120337, 'L_sep_weight_yyx': 2.0231202747551042e-10, 'L_scale_weight_yyx': 0.000285270818028071, 'learning_rate_yyx': 0.0033027164499749846}. Best is trial 10 with value: -2.473193107036748.
[I 2026-03-18 21:03:48,390] Trial 19 pruned. 
[I 2026-03-18 21:03:48,454] Trial 16 pruned. 
[I 2026-03-18 21:03:48,595] Trial 24 finished with value: -1.8481194689140599 and parameters: {'n_layers_yyx': 1, 'hidden_size_yyx_l0': 2, 'context_size_yyx': 4, 'num_mix_components_yyx': 4, 'context_extractor_yyx': 'gru', 'activation_func_yyx': 'ReLU', 'L2_weight_yyx': 1.6158982467014773e-05, 'L_entropy_weight_yyx': 6.056539117241506e-07, 'L_sep_weight_yyx': 0.00020595525534682833, 'L_scale_weight_yyx': 9.442131861253433e-06, 'learning_rate_yyx': 0.006092285984393609}. Best is trial 0 with value: -1.8516305051550026.
[I 2026-03-18 21:03:54,919] Trial 12 pruned. 
[I 2026-03-18 21:03:58,669] Trial 15 pruned. 
[I 2026-03-18 21:04:05,329] Trial 14 pruned. 
[I 2026-03-18 21:04:11,025] Trial 17 pruned. 
[I 2026-03-18 21:04:16,159] Trial 19 pruned. 
[I 2026-03-18 21:04:16,371] Trial 13 pruned. 
[I 2026-03-18 21:04:21,717] Trial 22 finished with value: -1.5596884730871887 and parameters: {'n_layers_yyx': 2, 'hidden_size_yyx_l0': 4, 'hidden_size_yyx_l1': 5, 'context_size_yyx': 2, 'num_mix_components_yyx': 4, 'context_extractor_yyx': 'gru', 'activation_func_yyx': 'Tanh', 'L2_weight_yyx': 2.0221948217320507e-05, 'L_entropy_weight_yyx': 1.4327832526110652e-10, 'L_sep_weight_yyx': 8.58990774660792e-09, 'L_scale_weight_yyx': 5.56585506782511e-08, 'learning_rate_yyx': 0.005460691278666836}. Best is trial 13 with value: -1.5658462904526245.
[I 2026-03-18 21:04:22,410] Trial 14 finished with value: -1.9337542258067992 and parameters: {'n_layers_yyx': 2, 'hidden_size_yyx_l0': 4, 'hidden_size_yyx_l1': 5, 'context_size_yyx': 2, 'num_mix_components_yyx': 3, 'context_extractor_yyx': 'gru', 'activation_func_yyx': 'GELU', 'L2_weight_yyx': 1.0435844955086417e-05, 'L_entropy_weight_yyx': 0.0001674677946194936, 'L_sep_weight_yyx': 3.036859271390668e-06, 'L_scale_weight_yyx': 1.0149416397921044e-08, 'learning_rate_yyx': 0.008885284104647263}. Best is trial 14 with value: -1.9337542258067992.
[I 2026-03-18 21:04:23,689] Trial 31 pruned. 
[I 2026-03-18 21:04:23,927] Trial 23 pruned. 
[I 2026-03-18 21:04:25,435] Trial 15 pruned. 
[I 2026-03-18 21:04:29,117] Trial 21 pruned. 
[I 2026-03-18 21:04:31,892] Trial 25 pruned. 
[I 2026-03-18 21:04:32,442] Trial 18 pruned. 
[I 2026-03-18 21:04:34,124] Trial 16 pruned. 
[I 2026-03-18 21:04:34,355] Trial 13 pruned. 
[I 2026-03-18 21:04:38,373] Trial 14 pruned. 
[I 2026-03-18 21:04:42,048] Trial 20 pruned. 
[I 2026-03-18 21:04:48,361] Trial 15 pruned. 
[I 2026-03-18 21:04:52,285] Trial 23 finished with value: -1.890364339981956 and parameters: {'n_layers_yyx': 2, 'hidden_size_yyx_l0': 3, 'hidden_size_yyx_l1': 6, 'context_size_yyx': 2, 'num_mix_components_yyx': 5, 'context_extractor_yyx': 'lstm', 'activation_func_yyx': 'ReLU', 'L2_weight_yyx': 0.00011050206748598182, 'L_entropy_weight_yyx': 0.00015215628101963882, 'L_sep_weight_yyx': 1.2444160997977271e-08, 'L_scale_weight_yyx': 1.3515600372670508e-10, 'learning_rate_yyx': 0.005110933250898717}. Best is trial 4 with value: -1.896486501584108.
[I 2026-03-18 21:04:53,795] Trial 16 finished with value: -1.7806213008996212 and parameters: {'n_layers_yyx': 2, 'hidden_size_yyx_l0': 6, 'hidden_size_yyx_l1': 5, 'context_size_yyx': 2, 'num_mix_components_yyx': 5, 'context_extractor_yyx': 'gru', 'activation_func_yyx': 'ReLU', 'L2_weight_yyx': 2.5536744286961773e-08, 'L_entropy_weight_yyx': 3.0037736209417392e-06, 'L_sep_weight_yyx': 3.8149580819413625e-05, 'L_scale_weight_yyx': 1.0754152327850374e-10, 'learning_rate_yyx': 0.002243013618220602}. Best is trial 4 with value: -1.7875800731928662.
[I 2026-03-18 21:04:56,647] Trial 41 finished with value: -2.472346918336999 and parameters: {'n_layers_yyx': 1, 'hidden_size_yyx_l0': 6, 'context_size_yyx': 3, 'num_mix_components_yyx': 5, 'context_extractor_yyx': 'gru', 'activation_func_yyx': 'ReLU', 'L2_weight_yyx': 7.106045006942935e-08, 'L_entropy_weight_yyx': 8.98826669152075e-09, 'L_sep_weight_yyx': 7.20368466114741e-05, 'L_scale_weight_yyx': 0.00011733481206296142, 'learning_rate_yyx': 0.008263799608356825}. Best is trial 25 with value: -2.4764732316599813.
[I 2026-03-18 21:04:56,674] Trial 17 pruned. 
[I 2026-03-18 21:04:56,889] Trial 22 pruned. 
[I 2026-03-18 21:04:58,149] Trial 19 pruned. 
[I 2026-03-18 21:05:02,019] Trial 23 pruned. 
[I 2026-03-18 21:05:09,352] Trial 24 pruned. 
[I 2026-03-18 21:05:09,425] Trial 16 pruned. 
[I 2026-03-18 21:05:10,426] Trial 16 pruned. 
[I 2026-03-18 21:05:13,702] Trial 18 pruned. 
[I 2026-03-18 21:05:17,616] Trial 17 pruned. 
[I 2026-03-18 21:05:17,704] Trial 26 pruned. 
[I 2026-03-18 21:05:19,522] Trial 23 pruned. 
[I 2026-03-18 21:05:21,553] Trial 24 pruned. 
[I 2026-03-18 21:05:30,909] Trial 21 pruned. 
[I 2026-03-18 21:05:31,805] Trial 25 pruned. 
