Warning: Failed writing log files to directory [/var/log/nvidia-mps]. No logs will be available.
[I 2026-03-18 16:55:44,699] A new study created in RDB with name: opt_full-model_seed=42_task=78
[I 2026-03-18 16:55:44,700] A new study created in RDB with name: opt_full-model_seed=42_task=68
[I 2026-03-18 16:55:44,700] A new study created in RDB with name: opt_full-model_seed=42_task=75
[I 2026-03-18 16:55:44,704] A new study created in RDB with name: opt_full-model_seed=42_task=74
[I 2026-03-18 16:55:44,708] A new study created in RDB with name: opt_full-model_seed=42_task=81
[I 2026-03-18 16:55:44,709] A new study created in RDB with name: opt_full-model_seed=42_task=80
[I 2026-03-18 16:55:44,709] A new study created in RDB with name: opt_full-model_seed=42_task=83
[I 2026-03-18 16:55:44,709] A new study created in RDB with name: opt_full-model_seed=42_task=87
[I 2026-03-18 16:55:44,710] A new study created in RDB with name: opt_full-model_seed=42_task=77
[I 2026-03-18 16:55:44,719] A new study created in RDB with name: opt_full-model_seed=42_task=70
[I 2026-03-18 16:55:44,719] A new study created in RDB with name: opt_full-model_seed=42_task=84
[I 2026-03-18 16:55:44,719] A new study created in RDB with name: opt_full-model_seed=42_task=94
[I 2026-03-18 16:55:44,719] A new study created in RDB with name: opt_full-model_seed=42_task=88
[I 2026-03-18 16:55:44,720] A new study created in RDB with name: opt_full-model_seed=42_task=64
[I 2026-03-18 16:55:44,720] A new study created in RDB with name: opt_full-model_seed=42_task=93
[I 2026-03-18 16:55:44,721] A new study created in RDB with name: opt_full-model_seed=42_task=89
[I 2026-03-18 16:55:44,721] A new study created in RDB with name: opt_full-model_seed=42_task=85
[I 2026-03-18 16:55:44,721] A new study created in RDB with name: opt_full-model_seed=42_task=86
[I 2026-03-18 16:55:44,726] A new study created in RDB with name: opt_full-model_seed=42_task=67
[I 2026-03-18 16:55:44,727] A new study created in RDB with name: opt_full-model_seed=42_task=66
[I 2026-03-18 16:55:44,786] A new study created in RDB with name: opt_full-model_seed=42_task=69
[I 2026-03-18 16:55:44,787] A new study created in RDB with name: opt_full-model_seed=42_task=71
[I 2026-03-18 16:55:44,788] A new study created in RDB with name: opt_full-model_seed=42_task=91
[I 2026-03-18 16:55:44,789] A new study created in RDB with name: opt_full-model_seed=42_task=76
[I 2026-03-18 16:55:44,789] A new study created in RDB with name: opt_full-model_seed=42_task=82
[I 2026-03-18 16:55:44,789] A new study created in RDB with name: opt_full-model_seed=42_task=72
[I 2026-03-18 16:55:44,790] A new study created in RDB with name: opt_full-model_seed=42_task=73
[I 2026-03-18 16:55:44,791] A new study created in RDB with name: opt_full-model_seed=42_task=90
[I 2026-03-18 16:55:44,791] A new study created in RDB with name: opt_full-model_seed=42_task=92
[I 2026-03-18 16:55:44,792] A new study created in RDB with name: opt_full-model_seed=42_task=65
[I 2026-03-18 16:55:44,792] A new study created in RDB with name: opt_full-model_seed=42_task=79
[I 2026-03-18 16:55:44,793] A new study created in RDB with name: opt_full-model_seed=42_task=95
[I 2026-03-18 16:57:41,780] Trial 0 finished with value: -0.5679630662584895 and parameters: {'n_layers_yyx': 1, 'hidden_size_yyx_l0': 4, 'context_size_yyx': 4, 'num_mix_components_yyx': 5, 'context_extractor_yyx': 'gru', 'activation_func_yyx': 'ReLU', 'L2_weight_yyx': 3.5080622315949695e-08, 'L_entropy_weight_yyx': 1.0961067939235164e-05, 'L_sep_weight_yyx': 1.1561777711836916e-06, 'L_scale_weight_yyx': 1.710866522681117e-09, 'learning_rate_yyx': 0.0084646405220046}. Best is trial 0 with value: -0.5679630662584895.
[I 2026-03-18 16:58:10,021] Trial 0 finished with value: -3.1199443073044333 and parameters: {'n_layers_yyx': 2, 'hidden_size_yyx_l0': 6, 'hidden_size_yyx_l1': 3, 'context_size_yyx': 4, 'num_mix_components_yyx': 4, 'context_extractor_yyx': 'lstm', 'activation_func_yyx': 'GELU', 'L2_weight_yyx': 1.4400143830360107e-05, 'L_entropy_weight_yyx': 1.5735288749598698e-07, 'L_sep_weight_yyx': 1.0112272734921724e-10, 'L_scale_weight_yyx': 0.00013084565712181956, 'learning_rate_yyx': 0.005865199492845539}. Best is trial 0 with value: -3.1199443073044333.
[I 2026-03-18 16:58:11,049] Trial 0 finished with value: -1.255221580181016 and parameters: {'n_layers_yyx': 1, 'hidden_size_yyx_l0': 4, 'context_size_yyx': 2, 'num_mix_components_yyx': 5, 'context_extractor_yyx': 'gru', 'activation_func_yyx': 'Tanh', 'L2_weight_yyx': 1.5338129731443943e-06, 'L_entropy_weight_yyx': 1.2126206093974696e-08, 'L_sep_weight_yyx': 2.8060892573275494e-10, 'L_scale_weight_yyx': 2.4046062298685586e-10, 'learning_rate_yyx': 0.008924072060142544}. Best is trial 0 with value: -1.255221580181016.
[I 2026-03-18 16:58:25,777] Trial 0 finished with value: -3.107520882344059 and parameters: {'n_layers_yyx': 1, 'hidden_size_yyx_l0': 3, 'context_size_yyx': 4, 'num_mix_components_yyx': 3, 'context_extractor_yyx': 'gru', 'activation_func_yyx': 'ReLU', 'L2_weight_yyx': 7.423066650118769e-09, 'L_entropy_weight_yyx': 3.136027714743124e-07, 'L_sep_weight_yyx': 6.963360397943413e-06, 'L_scale_weight_yyx': 2.0709628234612953e-09, 'learning_rate_yyx': 0.0025301504583184003}. Best is trial 0 with value: -3.107520882344059.
[I 2026-03-18 16:58:35,541] Trial 1 pruned. 
[I 2026-03-18 16:58:36,827] Trial 0 finished with value: -3.1272716589782044 and parameters: {'n_layers_yyx': 2, 'hidden_size_yyx_l0': 6, 'hidden_size_yyx_l1': 4, 'context_size_yyx': 3, 'num_mix_components_yyx': 2, 'context_extractor_yyx': 'lstm', 'activation_func_yyx': 'GELU', 'L2_weight_yyx': 4.470783388244629e-09, 'L_entropy_weight_yyx': 2.9036627484003025e-09, 'L_sep_weight_yyx': 0.0002959068634123237, 'L_scale_weight_yyx': 1.1063919694761906e-09, 'learning_rate_yyx': 0.002312872191638539}. Best is trial 0 with value: -3.1272716589782044.
[I 2026-03-18 16:58:48,377] Trial 0 finished with value: -1.260856452138058 and parameters: {'n_layers_yyx': 2, 'hidden_size_yyx_l0': 2, 'hidden_size_yyx_l1': 5, 'context_size_yyx': 4, 'num_mix_components_yyx': 4, 'context_extractor_yyx': 'gru', 'activation_func_yyx': 'GELU', 'L2_weight_yyx': 1.635993479889608e-08, 'L_entropy_weight_yyx': 1.9350753822736323e-08, 'L_sep_weight_yyx': 4.728342017092798e-09, 'L_scale_weight_yyx': 0.0007734567857318634, 'learning_rate_yyx': 0.007723313658990172}. Best is trial 0 with value: -1.260856452138058.
[I 2026-03-18 16:58:49,894] Trial 0 finished with value: -3.1442269416672968 and parameters: {'n_layers_yyx': 1, 'hidden_size_yyx_l0': 5, 'context_size_yyx': 3, 'num_mix_components_yyx': 4, 'context_extractor_yyx': 'lstm', 'activation_func_yyx': 'Tanh', 'L2_weight_yyx': 0.00013631959791267202, 'L_entropy_weight_yyx': 2.110288748163731e-08, 'L_sep_weight_yyx': 1.7378838599569993e-08, 'L_scale_weight_yyx': 2.8702843412959075e-05, 'learning_rate_yyx': 0.0017508176953728131}. Best is trial 0 with value: -3.1442269416672968.
[I 2026-03-18 16:58:59,749] Trial 0 finished with value: -3.110677648313527 and parameters: {'n_layers_yyx': 1, 'hidden_size_yyx_l0': 3, 'context_size_yyx': 2, 'num_mix_components_yyx': 2, 'context_extractor_yyx': 'gru', 'activation_func_yyx': 'Tanh', 'L2_weight_yyx': 1.0505032855671818e-10, 'L_entropy_weight_yyx': 2.2087879589513126e-09, 'L_sep_weight_yyx': 3.797472835304874e-10, 'L_scale_weight_yyx': 7.299747540674474e-10, 'learning_rate_yyx': 0.004803193483738871}. Best is trial 0 with value: -3.110677648313527.
[I 2026-03-18 16:59:02,738] Trial 2 pruned. 
[I 2026-03-18 16:59:03,434] Trial 1 pruned. 
[I 2026-03-18 16:59:04,143] Trial 0 finished with value: -1.2528411103705162 and parameters: {'n_layers_yyx': 2, 'hidden_size_yyx_l0': 6, 'hidden_size_yyx_l1': 6, 'context_size_yyx': 4, 'num_mix_components_yyx': 4, 'context_extractor_yyx': 'gru', 'activation_func_yyx': 'Tanh', 'L2_weight_yyx': 0.00044232139389923937, 'L_entropy_weight_yyx': 5.36941987010099e-07, 'L_sep_weight_yyx': 8.204269000730499e-06, 'L_scale_weight_yyx': 5.50815196278194e-07, 'learning_rate_yyx': 0.0011526457799191708}. Best is trial 0 with value: -1.2528411103705162.
[I 2026-03-18 16:59:05,866] Trial 0 finished with value: -0.581007651810469 and parameters: {'n_layers_yyx': 1, 'hidden_size_yyx_l0': 5, 'context_size_yyx': 2, 'num_mix_components_yyx': 5, 'context_extractor_yyx': 'lstm', 'activation_func_yyx': 'ReLU', 'L2_weight_yyx': 0.00012428591838188765, 'L_entropy_weight_yyx': 6.250542170210348e-05, 'L_sep_weight_yyx': 7.935322799764095e-08, 'L_scale_weight_yyx': 2.4142147448705264e-09, 'learning_rate_yyx': 0.0012720204940257535}. Best is trial 0 with value: -0.581007651810469.
[I 2026-03-18 16:59:06,087] Trial 0 finished with value: -3.1391708726536716 and parameters: {'n_layers_yyx': 2, 'hidden_size_yyx_l0': 5, 'hidden_size_yyx_l1': 3, 'context_size_yyx': 2, 'num_mix_components_yyx': 4, 'context_extractor_yyx': 'lstm', 'activation_func_yyx': 'ReLU', 'L2_weight_yyx': 6.011447061282522e-09, 'L_entropy_weight_yyx': 1.0901273137049143e-09, 'L_sep_weight_yyx': 4.192912005842537e-05, 'L_scale_weight_yyx': 5.795336786128537e-10, 'learning_rate_yyx': 0.003816862074472095}. Best is trial 0 with value: -3.1391708726536716.
[I 2026-03-18 16:59:16,249] Trial 0 finished with value: -1.2286415734705334 and parameters: {'n_layers_yyx': 2, 'hidden_size_yyx_l0': 4, 'hidden_size_yyx_l1': 6, 'context_size_yyx': 2, 'num_mix_components_yyx': 4, 'context_extractor_yyx': 'lstm', 'activation_func_yyx': 'Tanh', 'L2_weight_yyx': 0.00021204061142213545, 'L_entropy_weight_yyx': 7.11667410166482e-07, 'L_sep_weight_yyx': 3.903330177687496e-08, 'L_scale_weight_yyx': 1.0315069967837717e-05, 'learning_rate_yyx': 0.001325934463536947}. Best is trial 0 with value: -1.2286415734705334.
[I 2026-03-18 16:59:26,951] Trial 3 pruned. 
[I 2026-03-18 16:59:35,412] Trial 0 finished with value: -1.2691870881537193 and parameters: {'n_layers_yyx': 2, 'hidden_size_yyx_l0': 6, 'hidden_size_yyx_l1': 4, 'context_size_yyx': 3, 'num_mix_components_yyx': 3, 'context_extractor_yyx': 'lstm', 'activation_func_yyx': 'Tanh', 'L2_weight_yyx': 1.6122556852123724e-05, 'L_entropy_weight_yyx': 0.0008184856334006685, 'L_sep_weight_yyx': 3.7139914908638534e-09, 'L_scale_weight_yyx': 3.098570835290769e-08, 'learning_rate_yyx': 0.0025414028256442464}. Best is trial 0 with value: -1.2691870881537193.
[I 2026-03-18 16:59:39,464] Trial 0 finished with value: -3.1173315818600362 and parameters: {'n_layers_yyx': 1, 'hidden_size_yyx_l0': 4, 'context_size_yyx': 1, 'num_mix_components_yyx': 1, 'context_extractor_yyx': 'gru', 'activation_func_yyx': 'ReLU', 'L2_weight_yyx': 1.5750009825643283e-05, 'L_entropy_weight_yyx': 1.1614407572411416e-05, 'L_sep_weight_yyx': 2.865815946443056e-05, 'L_scale_weight_yyx': 3.2674657200950994e-10, 'learning_rate_yyx': 0.009655530239082308}. Best is trial 0 with value: -3.1173315818600362.
[I 2026-03-18 16:59:52,539] Trial 4 pruned. 
[I 2026-03-18 16:59:58,405] Trial 0 finished with value: -3.1178842363947195 and parameters: {'n_layers_yyx': 1, 'hidden_size_yyx_l0': 2, 'context_size_yyx': 3, 'num_mix_components_yyx': 3, 'context_extractor_yyx': 'lstm', 'activation_func_yyx': 'ReLU', 'L2_weight_yyx': 1.2808022250846186e-06, 'L_entropy_weight_yyx': 2.3986771038533383e-09, 'L_sep_weight_yyx': 4.291153791079275e-06, 'L_scale_weight_yyx': 0.0003534941040565918, 'learning_rate_yyx': 0.0019322198508616604}. Best is trial 0 with value: -3.1178842363947195.
[I 2026-03-18 17:00:30,420] Trial 0 finished with value: -3.1190589761594594 and parameters: {'n_layers_yyx': 1, 'hidden_size_yyx_l0': 6, 'context_size_yyx': 3, 'num_mix_components_yyx': 1, 'context_extractor_yyx': 'gru', 'activation_func_yyx': 'Tanh', 'L2_weight_yyx': 3.63616461168423e-07, 'L_entropy_weight_yyx': 9.091981994734681e-08, 'L_sep_weight_yyx': 0.0009952886433900901, 'L_scale_weight_yyx': 1.6498262313317245e-07, 'learning_rate_yyx': 0.0017130910728419338}. Best is trial 0 with value: -3.1190589761594594.
[I 2026-03-18 17:00:37,605] Trial 1 finished with value: -0.5652332332144085 and parameters: {'n_layers_yyx': 1, 'hidden_size_yyx_l0': 5, 'context_size_yyx': 2, 'num_mix_components_yyx': 1, 'context_extractor_yyx': 'lstm', 'activation_func_yyx': 'GELU', 'L2_weight_yyx': 0.0003017564317925474, 'L_entropy_weight_yyx': 0.0007024221808481501, 'L_sep_weight_yyx': 2.9217858051016095e-07, 'L_scale_weight_yyx': 6.459465435164029e-07, 'learning_rate_yyx': 0.005435861844370445}. Best is trial 0 with value: -0.5679630662584895.
[I 2026-03-18 17:00:41,817] Trial 0 finished with value: -3.1127020689980207 and parameters: {'n_layers_yyx': 1, 'hidden_size_yyx_l0': 4, 'context_size_yyx': 3, 'num_mix_components_yyx': 1, 'context_extractor_yyx': 'gru', 'activation_func_yyx': 'GELU', 'L2_weight_yyx': 2.9533740222571616e-08, 'L_entropy_weight_yyx': 0.0009099674957644922, 'L_sep_weight_yyx': 1.8022465265665575e-07, 'L_scale_weight_yyx': 4.4950648525373855e-09, 'learning_rate_yyx': 0.001564334453188662}. Best is trial 0 with value: -3.1127020689980207.
[I 2026-03-18 17:00:43,688] Trial 0 finished with value: -1.2378643550626012 and parameters: {'n_layers_yyx': 1, 'hidden_size_yyx_l0': 6, 'context_size_yyx': 3, 'num_mix_components_yyx': 5, 'context_extractor_yyx': 'lstm', 'activation_func_yyx': 'GELU', 'L2_weight_yyx': 3.361586341684176e-08, 'L_entropy_weight_yyx': 3.7385043125326185e-07, 'L_sep_weight_yyx': 3.0899912261916728e-09, 'L_scale_weight_yyx': 2.1721829685447065e-08, 'learning_rate_yyx': 0.0014057059295119242}. Best is trial 0 with value: -1.2378643550626012.
[I 2026-03-18 17:00:46,664] Trial 0 finished with value: -3.1145298582025718 and parameters: {'n_layers_yyx': 2, 'hidden_size_yyx_l0': 4, 'hidden_size_yyx_l1': 6, 'context_size_yyx': 4, 'num_mix_components_yyx': 3, 'context_extractor_yyx': 'gru', 'activation_func_yyx': 'Tanh', 'L2_weight_yyx': 1.630567078155247e-09, 'L_entropy_weight_yyx': 3.5270862300536994e-09, 'L_sep_weight_yyx': 1.7195882242322208e-09, 'L_scale_weight_yyx': 4.879132342583379e-09, 'learning_rate_yyx': 0.0005093925642461866}. Best is trial 0 with value: -3.1145298582025718.
[I 2026-03-18 17:00:54,646] Trial 2 pruned. 
[I 2026-03-18 17:00:56,240] Trial 0 finished with value: -3.1460828145824977 and parameters: {'n_layers_yyx': 2, 'hidden_size_yyx_l0': 5, 'hidden_size_yyx_l1': 5, 'context_size_yyx': 1, 'num_mix_components_yyx': 4, 'context_extractor_yyx': 'lstm', 'activation_func_yyx': 'Tanh', 'L2_weight_yyx': 1.4836026817344914e-08, 'L_entropy_weight_yyx': 1.083188522592581e-09, 'L_sep_weight_yyx': 9.273146492480443e-10, 'L_scale_weight_yyx': 2.531768941441055e-06, 'learning_rate_yyx': 0.0027433967864071217}. Best is trial 0 with value: -3.1460828145824977.
[I 2026-03-18 17:01:00,348] Trial 1 pruned. 
[I 2026-03-18 17:01:04,834] Trial 0 finished with value: -1.243662793623101 and parameters: {'n_layers_yyx': 2, 'hidden_size_yyx_l0': 4, 'hidden_size_yyx_l1': 3, 'context_size_yyx': 1, 'num_mix_components_yyx': 3, 'context_extractor_yyx': 'lstm', 'activation_func_yyx': 'Tanh', 'L2_weight_yyx': 2.148473924895777e-07, 'L_entropy_weight_yyx': 1.6863267820234246e-10, 'L_sep_weight_yyx': 7.46106688178168e-09, 'L_scale_weight_yyx': 1.6514168386391243e-07, 'learning_rate_yyx': 0.00280495946434116}. Best is trial 0 with value: -1.243662793623101.
[I 2026-03-18 17:01:21,240] Trial 0 finished with value: -1.2747321457392233 and parameters: {'n_layers_yyx': 1, 'hidden_size_yyx_l0': 3, 'context_size_yyx': 1, 'num_mix_components_yyx': 4, 'context_extractor_yyx': 'lstm', 'activation_func_yyx': 'ReLU', 'L2_weight_yyx': 5.874493363150741e-07, 'L_entropy_weight_yyx': 5.309920646942003e-09, 'L_sep_weight_yyx': 1.2120544082374238e-05, 'L_scale_weight_yyx': 3.4015253026115834e-08, 'learning_rate_yyx': 0.0028410227341467047}. Best is trial 0 with value: -1.2747321457392233.
[I 2026-03-18 17:01:36,457] Trial 0 finished with value: -0.526919484302463 and parameters: {'n_layers_yyx': 2, 'hidden_size_yyx_l0': 6, 'hidden_size_yyx_l1': 2, 'context_size_yyx': 2, 'num_mix_components_yyx': 5, 'context_extractor_yyx': 'gru', 'activation_func_yyx': 'Tanh', 'L2_weight_yyx': 9.214470264572812e-08, 'L_entropy_weight_yyx': 6.210707859886042e-09, 'L_sep_weight_yyx': 0.0004840259604187418, 'L_scale_weight_yyx': 3.002063091441107e-10, 'learning_rate_yyx': 0.001214429190145782}. Best is trial 0 with value: -0.526919484302463.
[I 2026-03-18 17:01:43,194] Trial 0 finished with value: -1.2299382602882032 and parameters: {'n_layers_yyx': 2, 'hidden_size_yyx_l0': 5, 'hidden_size_yyx_l1': 2, 'context_size_yyx': 1, 'num_mix_components_yyx': 4, 'context_extractor_yyx': 'gru', 'activation_func_yyx': 'GELU', 'L2_weight_yyx': 1.897840088651235e-06, 'L_entropy_weight_yyx': 6.351563296400211e-06, 'L_sep_weight_yyx': 7.48126174130182e-05, 'L_scale_weight_yyx': 5.2809375509129476e-05, 'learning_rate_yyx': 0.0020620473629709905}. Best is trial 0 with value: -1.2299382602882032.
[I 2026-03-18 17:01:45,798] Trial 1 finished with value: -3.150442838019967 and parameters: {'n_layers_yyx': 1, 'hidden_size_yyx_l0': 5, 'context_size_yyx': 2, 'num_mix_components_yyx': 3, 'context_extractor_yyx': 'lstm', 'activation_func_yyx': 'GELU', 'L2_weight_yyx': 1.6463601687984565e-07, 'L_entropy_weight_yyx': 8.024643099033443e-06, 'L_sep_weight_yyx': 0.0008764284209067998, 'L_scale_weight_yyx': 1.789592302623534e-08, 'learning_rate_yyx': 0.004639712968786621}. Best is trial 1 with value: -3.150442838019967.
[I 2026-03-18 17:01:45,815] Trial 0 finished with value: -3.150597252265314 and parameters: {'n_layers_yyx': 1, 'hidden_size_yyx_l0': 2, 'context_size_yyx': 3, 'num_mix_components_yyx': 5, 'context_extractor_yyx': 'lstm', 'activation_func_yyx': 'Tanh', 'L2_weight_yyx': 1.4915879499825451e-05, 'L_entropy_weight_yyx': 1.8700284841020666e-10, 'L_sep_weight_yyx': 7.480842018930266e-07, 'L_scale_weight_yyx': 0.0003070609618891354, 'learning_rate_yyx': 0.003385248521694208}. Best is trial 0 with value: -3.150597252265314.
[I 2026-03-18 17:01:55,195] Trial 0 finished with value: -3.137361273991928 and parameters: {'n_layers_yyx': 2, 'hidden_size_yyx_l0': 6, 'hidden_size_yyx_l1': 3, 'context_size_yyx': 4, 'num_mix_components_yyx': 1, 'context_extractor_yyx': 'gru', 'activation_func_yyx': 'ReLU', 'L2_weight_yyx': 1.3295798465464332e-08, 'L_entropy_weight_yyx': 1.4104403422923684e-05, 'L_sep_weight_yyx': 3.235139556362483e-07, 'L_scale_weight_yyx': 5.5390787816999407e-08, 'learning_rate_yyx': 0.0012273403073382243}. Best is trial 0 with value: -3.137361273991928.
[I 2026-03-18 17:02:10,940] Trial 1 finished with value: -1.2594676132343172 and parameters: {'n_layers_yyx': 2, 'hidden_size_yyx_l0': 5, 'hidden_size_yyx_l1': 6, 'context_size_yyx': 4, 'num_mix_components_yyx': 2, 'context_extractor_yyx': 'gru', 'activation_func_yyx': 'ReLU', 'L2_weight_yyx': 0.00033425261541325096, 'L_entropy_weight_yyx': 9.220478403608236e-09, 'L_sep_weight_yyx': 3.873392333579669e-09, 'L_scale_weight_yyx': 1.3278915413251902e-09, 'learning_rate_yyx': 0.006913425471216307}. Best is trial 0 with value: -1.2691870881537193.
[I 2026-03-18 17:02:14,303] Trial 1 finished with value: -0.5642893291405175 and parameters: {'n_layers_yyx': 2, 'hidden_size_yyx_l0': 6, 'hidden_size_yyx_l1': 6, 'context_size_yyx': 2, 'num_mix_components_yyx': 3, 'context_extractor_yyx': 'gru', 'activation_func_yyx': 'ReLU', 'L2_weight_yyx': 0.00027531337785313004, 'L_entropy_weight_yyx': 2.0559675317884298e-08, 'L_sep_weight_yyx': 4.796167626536026e-06, 'L_scale_weight_yyx': 1.1892594873424121e-05, 'learning_rate_yyx': 0.000941207376174686}. Best is trial 0 with value: -0.581007651810469.
[I 2026-03-18 17:02:16,844] Trial 1 pruned. 
[I 2026-03-18 17:02:20,735] Trial 0 finished with value: -0.5140343709365865 and parameters: {'n_layers_yyx': 1, 'hidden_size_yyx_l0': 3, 'context_size_yyx': 1, 'num_mix_components_yyx': 1, 'context_extractor_yyx': 'gru', 'activation_func_yyx': 'Tanh', 'L2_weight_yyx': 2.890322649762074e-06, 'L_entropy_weight_yyx': 1.6454330455803072e-06, 'L_sep_weight_yyx': 0.00017881896136725162, 'L_scale_weight_yyx': 2.1221335858901594e-06, 'learning_rate_yyx': 0.0012267351088546517}. Best is trial 0 with value: -0.5140343709365865.
[I 2026-03-18 17:02:26,813] Trial 0 finished with value: -3.1464314770929143 and parameters: {'n_layers_yyx': 1, 'hidden_size_yyx_l0': 6, 'context_size_yyx': 1, 'num_mix_components_yyx': 5, 'context_extractor_yyx': 'gru', 'activation_func_yyx': 'ReLU', 'L2_weight_yyx': 1.3874164712850265e-09, 'L_entropy_weight_yyx': 1.6274573127837802e-06, 'L_sep_weight_yyx': 1.0372804351988411e-09, 'L_scale_weight_yyx': 7.933559824629173e-10, 'learning_rate_yyx': 0.0013448670741426176}. Best is trial 0 with value: -3.1464314770929143.
[I 2026-03-18 17:02:33,593] Trial 0 finished with value: -1.2656102912042586 and parameters: {'n_layers_yyx': 2, 'hidden_size_yyx_l0': 3, 'hidden_size_yyx_l1': 5, 'context_size_yyx': 2, 'num_mix_components_yyx': 4, 'context_extractor_yyx': 'lstm', 'activation_func_yyx': 'ReLU', 'L2_weight_yyx': 5.366703524238235e-10, 'L_entropy_weight_yyx': 6.819149721424894e-10, 'L_sep_weight_yyx': 5.285552638313282e-09, 'L_scale_weight_yyx': 3.111667858076528e-07, 'learning_rate_yyx': 0.0006360117979598497}. Best is trial 0 with value: -1.2656102912042586.
[I 2026-03-18 17:02:34,435] Trial 1 finished with value: -1.2598051540071555 and parameters: {'n_layers_yyx': 2, 'hidden_size_yyx_l0': 5, 'hidden_size_yyx_l1': 6, 'context_size_yyx': 2, 'num_mix_components_yyx': 2, 'context_extractor_yyx': 'lstm', 'activation_func_yyx': 'ReLU', 'L2_weight_yyx': 1.2751582479811422e-10, 'L_entropy_weight_yyx': 0.0006940373589856449, 'L_sep_weight_yyx': 5.817494494343436e-08, 'L_scale_weight_yyx': 3.656357836058845e-08, 'learning_rate_yyx': 0.003898198100378426}. Best is trial 0 with value: -1.260856452138058.
