[I 2026-03-18 20:50:42,569] Trial 16 finished with value: -1.444310560960036 and parameters: {'n_layers_yyx': 2, 'hidden_size_yyx_l0': 5, 'hidden_size_yyx_l1': 3, 'context_size_yyx': 4, 'num_mix_components_yyx': 5, 'context_extractor_yyx': 'lstm', 'activation_func_yyx': 'Tanh', 'L2_weight_yyx': 1.6500690608210938e-07, 'L_entropy_weight_yyx': 9.184142748779869e-06, 'L_sep_weight_yyx': 1.2092360874556255e-06, 'L_scale_weight_yyx': 4.1503231560837166e-08, 'learning_rate_yyx': 0.004959784901333275}. Best is trial 10 with value: -1.4553572904146634.
[I 2026-03-18 20:50:42,651] Trial 11 finished with value: -1.889158745408906 and parameters: {'n_layers_yyx': 2, 'hidden_size_yyx_l0': 2, 'hidden_size_yyx_l1': 6, 'context_size_yyx': 1, 'num_mix_components_yyx': 5, 'context_extractor_yyx': 'lstm', 'activation_func_yyx': 'ReLU', 'L2_weight_yyx': 1.6739299679397895e-05, 'L_entropy_weight_yyx': 0.0007176540805478159, 'L_sep_weight_yyx': 1.0114211791123096e-10, 'L_scale_weight_yyx': 2.7347810972477508e-08, 'learning_rate_yyx': 0.00926470459401689}. Best is trial 5 with value: -1.89157565728699.
[I 2026-03-18 20:50:45,394] Trial 27 pruned. 
[I 2026-03-18 20:50:48,907] Trial 15 pruned. 
[I 2026-03-18 20:50:50,019] Trial 5 finished with value: -1.3238758967472957 and parameters: {'n_layers_yyx': 2, 'hidden_size_yyx_l0': 3, 'hidden_size_yyx_l1': 2, 'context_size_yyx': 4, 'num_mix_components_yyx': 2, 'context_extractor_yyx': 'lstm', 'activation_func_yyx': 'ReLU', 'L2_weight_yyx': 6.378371051985607e-06, 'L_entropy_weight_yyx': 7.289091310785315e-10, 'L_sep_weight_yyx': 0.0006085335542406737, 'L_scale_weight_yyx': 2.2105198116516373e-05, 'learning_rate_yyx': 0.0014149516259591274}. Best is trial 1 with value: -1.3744548856295071.
[I 2026-03-18 20:50:57,437] Trial 16 pruned. 
[I 2026-03-18 20:50:57,529] Trial 10 pruned. 
[I 2026-03-18 20:51:01,468] Trial 14 pruned. 
[I 2026-03-18 20:51:01,573] Trial 16 pruned. 
[I 2026-03-18 20:51:06,510] Trial 9 pruned. 
[I 2026-03-18 20:51:06,512] Trial 10 finished with value: -1.8544678241943866 and parameters: {'n_layers_yyx': 1, 'hidden_size_yyx_l0': 6, 'context_size_yyx': 2, 'num_mix_components_yyx': 2, 'context_extractor_yyx': 'lstm', 'activation_func_yyx': 'Tanh', 'L2_weight_yyx': 2.036247932899307e-05, 'L_entropy_weight_yyx': 8.41564258249768e-07, 'L_sep_weight_yyx': 1.76650385374323e-10, 'L_scale_weight_yyx': 5.225539769839226e-10, 'learning_rate_yyx': 0.009901279082364668}. Best is trial 9 with value: -1.8570869006965198.
[I 2026-03-18 20:51:16,962] Trial 14 pruned. 
[I 2026-03-18 20:51:19,645] Trial 17 pruned. 
[I 2026-03-18 20:51:20,926] Trial 9 pruned. 
[I 2026-03-18 20:51:24,310] Trial 12 pruned. 
[I 2026-03-18 20:51:29,572] Trial 28 pruned. 
[I 2026-03-18 20:51:41,167] Trial 15 pruned. 
[I 2026-03-18 20:51:55,958] Trial 15 pruned. 
[I 2026-03-18 20:51:58,305] Trial 10 finished with value: -1.8505365129815814 and parameters: {'n_layers_yyx': 2, 'hidden_size_yyx_l0': 6, 'hidden_size_yyx_l1': 4, 'context_size_yyx': 3, 'num_mix_components_yyx': 2, 'context_extractor_yyx': 'gru', 'activation_func_yyx': 'Tanh', 'L2_weight_yyx': 7.545348298339291e-07, 'L_entropy_weight_yyx': 1.3477752847941503e-10, 'L_sep_weight_yyx': 6.585419995081909e-09, 'L_scale_weight_yyx': 2.494583095979905e-10, 'learning_rate_yyx': 0.006241929763743781}. Best is trial 9 with value: -1.853392962523822.
[I 2026-03-18 20:52:02,196] Trial 13 pruned. 
[I 2026-03-18 20:52:05,329] Trial 17 pruned. 
[I 2026-03-18 20:52:07,058] Trial 9 finished with value: -1.8693153029304443 and parameters: {'n_layers_yyx': 1, 'hidden_size_yyx_l0': 5, 'context_size_yyx': 3, 'num_mix_components_yyx': 5, 'context_extractor_yyx': 'lstm', 'activation_func_yyx': 'ReLU', 'L2_weight_yyx': 4.3963697768877735e-08, 'L_entropy_weight_yyx': 3.6248629730074506e-05, 'L_sep_weight_yyx': 0.0007195850000989471, 'L_scale_weight_yyx': 6.058287044026464e-07, 'learning_rate_yyx': 0.004906100454804033}. Best is trial 9 with value: -1.8693153029304443.
[I 2026-03-18 20:52:16,231] Trial 10 finished with value: -2.4827629443527646 and parameters: {'n_layers_yyx': 1, 'hidden_size_yyx_l0': 2, 'context_size_yyx': 1, 'num_mix_components_yyx': 5, 'context_extractor_yyx': 'gru', 'activation_func_yyx': 'GELU', 'L2_weight_yyx': 1.69706708111644e-08, 'L_entropy_weight_yyx': 0.0008585310988690431, 'L_sep_weight_yyx': 0.00033620539278404423, 'L_scale_weight_yyx': 6.304397908520541e-06, 'learning_rate_yyx': 0.009818489793480106}. Best is trial 4 with value: -2.49523174750643.
[I 2026-03-18 20:52:18,806] Trial 8 finished with value: -1.3261802086463341 and parameters: {'n_layers_yyx': 2, 'hidden_size_yyx_l0': 3, 'hidden_size_yyx_l1': 3, 'context_size_yyx': 3, 'num_mix_components_yyx': 2, 'context_extractor_yyx': 'gru', 'activation_func_yyx': 'GELU', 'L2_weight_yyx': 9.227661755418194e-06, 'L_entropy_weight_yyx': 5.912593777105958e-09, 'L_sep_weight_yyx': 7.602299905654298e-07, 'L_scale_weight_yyx': 8.493061730468543e-10, 'learning_rate_yyx': 0.0030826847832615993}. Best is trial 3 with value: -1.40271482027494.
[I 2026-03-18 20:52:21,843] Trial 16 pruned. 
[I 2026-03-18 20:52:39,212] Trial 18 finished with value: -1.404575406588041 and parameters: {'n_layers_yyx': 1, 'hidden_size_yyx_l0': 5, 'context_size_yyx': 3, 'num_mix_components_yyx': 4, 'context_extractor_yyx': 'gru', 'activation_func_yyx': 'ReLU', 'L2_weight_yyx': 2.001357490765565e-06, 'L_entropy_weight_yyx': 2.2333736741355522e-05, 'L_sep_weight_yyx': 9.2540783870307e-10, 'L_scale_weight_yyx': 1.4583411389732844e-10, 'learning_rate_yyx': 0.006335744491050364}. Best is trial 1 with value: -1.4389243727463943.
[I 2026-03-18 20:52:45,276] Trial 29 pruned. 
[I 2026-03-18 20:52:48,885] Trial 9 pruned. 
[I 2026-03-18 20:52:59,174] Trial 9 finished with value: -2.447373198654977 and parameters: {'n_layers_yyx': 1, 'hidden_size_yyx_l0': 6, 'context_size_yyx': 3, 'num_mix_components_yyx': 2, 'context_extractor_yyx': 'gru', 'activation_func_yyx': 'GELU', 'L2_weight_yyx': 3.10898695364583e-07, 'L_entropy_weight_yyx': 1.3446932505413596e-09, 'L_sep_weight_yyx': 1.1197670157504785e-05, 'L_scale_weight_yyx': 6.2381129685404e-08, 'learning_rate_yyx': 0.006170215572359907}. Best is trial 1 with value: -2.4633966237885176.
[I 2026-03-18 20:53:02,700] Trial 10 finished with value: -1.8553232469248093 and parameters: {'n_layers_yyx': 2, 'hidden_size_yyx_l0': 6, 'hidden_size_yyx_l1': 5, 'context_size_yyx': 1, 'num_mix_components_yyx': 2, 'context_extractor_yyx': 'gru', 'activation_func_yyx': 'GELU', 'L2_weight_yyx': 1.3843186790595174e-05, 'L_entropy_weight_yyx': 5.154401708408001e-10, 'L_sep_weight_yyx': 3.789053419098039e-06, 'L_scale_weight_yyx': 8.83209951456599e-08, 'learning_rate_yyx': 0.002108244580967631}. Best is trial 10 with value: -1.8553232469248093.
[I 2026-03-18 20:53:09,635] Trial 19 pruned. 
[I 2026-03-18 20:53:09,884] Trial 14 pruned. 
[I 2026-03-18 20:53:20,999] Trial 17 pruned. 
[I 2026-03-18 20:53:46,110] Trial 17 pruned. 
[I 2026-03-18 20:53:48,867] Trial 11 pruned. 
[I 2026-03-18 20:53:56,105] Trial 30 pruned. 
[I 2026-03-18 20:53:58,457] Trial 10 pruned. 
[I 2026-03-18 20:54:02,267] Trial 11 pruned. 
[I 2026-03-18 20:54:02,275] Trial 12 finished with value: -1.4532693716195912 and parameters: {'n_layers_yyx': 2, 'hidden_size_yyx_l0': 4, 'hidden_size_yyx_l1': 4, 'context_size_yyx': 2, 'num_mix_components_yyx': 3, 'context_extractor_yyx': 'lstm', 'activation_func_yyx': 'Tanh', 'L2_weight_yyx': 3.113541695956134e-05, 'L_entropy_weight_yyx': 3.85944174051035e-07, 'L_sep_weight_yyx': 2.2326760607933816e-09, 'L_scale_weight_yyx': 3.8545204888003677e-10, 'learning_rate_yyx': 0.003916822116808921}. Best is trial 12 with value: -1.4532693716195912.
[I 2026-03-18 20:54:09,639] Trial 18 finished with value: -1.4460073383037861 and parameters: {'n_layers_yyx': 1, 'hidden_size_yyx_l0': 5, 'context_size_yyx': 3, 'num_mix_components_yyx': 5, 'context_extractor_yyx': 'lstm', 'activation_func_yyx': 'Tanh', 'L2_weight_yyx': 0.0004009447237785503, 'L_entropy_weight_yyx': 9.250087201897844e-07, 'L_sep_weight_yyx': 0.0009957955344505013, 'L_scale_weight_yyx': 0.00020844204085511368, 'learning_rate_yyx': 0.0029600226317835136}. Best is trial 18 with value: -1.4460073383037861.
[I 2026-03-18 20:54:19,047] Trial 18 pruned. 
[I 2026-03-18 20:54:19,048] Trial 18 pruned. 
[I 2026-03-18 20:54:20,223] Trial 12 pruned. 
[I 2026-03-18 20:54:27,105] Trial 11 pruned. 
[I 2026-03-18 20:54:40,840] Trial 11 finished with value: -1.7859603851010102 and parameters: {'n_layers_yyx': 2, 'hidden_size_yyx_l0': 6, 'hidden_size_yyx_l1': 6, 'context_size_yyx': 2, 'num_mix_components_yyx': 5, 'context_extractor_yyx': 'gru', 'activation_func_yyx': 'GELU', 'L2_weight_yyx': 1.7322135832989083e-09, 'L_entropy_weight_yyx': 0.0003656354307693331, 'L_sep_weight_yyx': 0.0004512364209111971, 'L_scale_weight_yyx': 1.1401546954064333e-06, 'learning_rate_yyx': 0.009764788501299046}. Best is trial 4 with value: -1.7875800731928662.
[I 2026-03-18 20:54:57,356] Trial 13 pruned. 
[I 2026-03-18 20:54:57,356] Trial 11 pruned. 
[I 2026-03-18 20:54:57,537] Trial 20 finished with value: -1.779244540655163 and parameters: {'n_layers_yyx': 2, 'hidden_size_yyx_l0': 5, 'hidden_size_yyx_l1': 5, 'context_size_yyx': 3, 'num_mix_components_yyx': 1, 'context_extractor_yyx': 'gru', 'activation_func_yyx': 'GELU', 'L2_weight_yyx': 0.00010152352624424833, 'L_entropy_weight_yyx': 6.509811768491248e-05, 'L_sep_weight_yyx': 0.00018605676927773682, 'L_scale_weight_yyx': 8.137018250138368e-06, 'learning_rate_yyx': 0.004818988381412428}. Best is trial 17 with value: -1.804705005203914.
[I 2026-03-18 20:54:59,527] Trial 10 pruned. 
[I 2026-03-18 20:55:02,888] Trial 18 finished with value: -1.4290843525870902 and parameters: {'n_layers_yyx': 1, 'hidden_size_yyx_l0': 6, 'context_size_yyx': 3, 'num_mix_components_yyx': 5, 'context_extractor_yyx': 'gru', 'activation_func_yyx': 'Tanh', 'L2_weight_yyx': 2.674713482267613e-06, 'L_entropy_weight_yyx': 5.306282613640225e-10, 'L_sep_weight_yyx': 0.0009712937867364946, 'L_scale_weight_yyx': 0.0001010634465866792, 'learning_rate_yyx': 0.007983579403920001}. Best is trial 0 with value: -1.5190498727266906.
[I 2026-03-18 20:55:04,000] Trial 13 finished with value: -2.4850502863404977 and parameters: {'n_layers_yyx': 1, 'hidden_size_yyx_l0': 6, 'context_size_yyx': 3, 'num_mix_components_yyx': 2, 'context_extractor_yyx': 'gru', 'activation_func_yyx': 'ReLU', 'L2_weight_yyx': 2.151878797501103e-06, 'L_entropy_weight_yyx': 0.00019262625781991924, 'L_sep_weight_yyx': 8.920483931008454e-05, 'L_scale_weight_yyx': 3.7218886703033153e-07, 'learning_rate_yyx': 0.0051812156347401704}. Best is trial 13 with value: -2.4850502863404977.
[I 2026-03-18 20:55:05,042] Trial 31 pruned. 
[I 2026-03-18 20:55:09,803] Trial 19 pruned. 
[I 2026-03-18 20:55:15,004] Trial 12 pruned. 
[I 2026-03-18 20:55:21,609] Trial 19 pruned. 
[I 2026-03-18 20:55:22,713] Trial 13 pruned. 
[I 2026-03-18 20:55:29,772] Trial 21 pruned. 
[I 2026-03-18 20:55:29,915] Trial 11 pruned. 
[I 2026-03-18 20:55:39,100] Trial 14 pruned. 
[I 2026-03-18 20:55:40,450] Trial 20 pruned. 
[I 2026-03-18 20:55:41,163] Trial 18 finished with value: -1.3811345731295073 and parameters: {'n_layers_yyx': 2, 'hidden_size_yyx_l0': 5, 'hidden_size_yyx_l1': 5, 'context_size_yyx': 2, 'num_mix_components_yyx': 5, 'context_extractor_yyx': 'gru', 'activation_func_yyx': 'Tanh', 'L2_weight_yyx': 8.972993198053788e-07, 'L_entropy_weight_yyx': 4.6387979287012956e-07, 'L_sep_weight_yyx': 4.080657752402473e-06, 'L_scale_weight_yyx': 8.816654611897494e-09, 'learning_rate_yyx': 0.004554870070411589}. Best is trial 10 with value: -1.4553572904146634.
[I 2026-03-18 20:55:41,617] Trial 16 finished with value: -1.4138428673377403 and parameters: {'n_layers_yyx': 1, 'hidden_size_yyx_l0': 6, 'context_size_yyx': 4, 'num_mix_components_yyx': 2, 'context_extractor_yyx': 'lstm', 'activation_func_yyx': 'Tanh', 'L2_weight_yyx': 5.685258085239097e-05, 'L_entropy_weight_yyx': 0.00027236394889235897, 'L_sep_weight_yyx': 1.4482581428896105e-10, 'L_scale_weight_yyx': 1.6280399384785632e-06, 'learning_rate_yyx': 0.0061692252768892}. Best is trial 7 with value: -1.4538350266676683.
[I 2026-03-18 20:55:41,683] Trial 11 finished with value: -1.9049259122663638 and parameters: {'n_layers_yyx': 2, 'hidden_size_yyx_l0': 3, 'hidden_size_yyx_l1': 5, 'context_size_yyx': 3, 'num_mix_components_yyx': 2, 'context_extractor_yyx': 'lstm', 'activation_func_yyx': 'ReLU', 'L2_weight_yyx': 2.4796964416349558e-08, 'L_entropy_weight_yyx': 9.399350525572392e-06, 'L_sep_weight_yyx': 5.612294435641813e-07, 'L_scale_weight_yyx': 8.719467667008386e-06, 'learning_rate_yyx': 0.0034547523282826443}. Best is trial 1 with value: -1.9300911785393273.
[I 2026-03-18 20:55:52,434] Trial 20 pruned. 
[I 2026-03-18 20:55:52,858] Trial 14 pruned. 
[I 2026-03-18 20:55:58,798] Trial 22 pruned. 
[I 2026-03-18 20:55:59,309] Trial 19 pruned. 
[I 2026-03-18 20:56:08,635] Trial 17 pruned. 
[I 2026-03-18 20:56:15,309] Trial 13 pruned. 
[I 2026-03-18 20:56:22,189] Trial 15 pruned. 
[I 2026-03-18 20:56:26,804] Trial 23 pruned. 
[I 2026-03-18 20:56:26,804] Trial 20 pruned. 
[I 2026-03-18 20:56:29,147] Trial 13 finished with value: -1.4421805044320914 and parameters: {'n_layers_yyx': 2, 'hidden_size_yyx_l0': 3, 'hidden_size_yyx_l1': 4, 'context_size_yyx': 1, 'num_mix_components_yyx': 3, 'context_extractor_yyx': 'gru', 'activation_func_yyx': 'GELU', 'L2_weight_yyx': 8.260034194148678e-05, 'L_entropy_weight_yyx': 0.0007482848756078987, 'L_sep_weight_yyx': 4.102657636563164e-08, 'L_scale_weight_yyx': 2.5608546062139484e-06, 'learning_rate_yyx': 0.004540722132625401}. Best is trial 13 with value: -1.4421805044320914.
[I 2026-03-18 20:56:30,925] Trial 10 finished with value: -1.9395614910230956 and parameters: {'n_layers_yyx': 1, 'hidden_size_yyx_l0': 3, 'context_size_yyx': 4, 'num_mix_components_yyx': 1, 'context_extractor_yyx': 'gru', 'activation_func_yyx': 'ReLU', 'L2_weight_yyx': 2.1538344416371375e-08, 'L_entropy_weight_yyx': 5.29351455276505e-10, 'L_sep_weight_yyx': 0.0008334076713824911, 'L_scale_weight_yyx': 4.4165262406998e-06, 'learning_rate_yyx': 0.009712265094760761}. Best is trial 10 with value: -1.9395614910230956.
[I 2026-03-18 20:56:35,385] Trial 21 pruned. 
[I 2026-03-18 20:56:36,276] Trial 12 pruned. 
[I 2026-03-18 20:56:36,337] Trial 18 pruned. 
[I 2026-03-18 20:56:39,274] Trial 10 finished with value: -1.8629833408206564 and parameters: {'n_layers_yyx': 1, 'hidden_size_yyx_l0': 5, 'context_size_yyx': 3, 'num_mix_components_yyx': 5, 'context_extractor_yyx': 'gru', 'activation_func_yyx': 'ReLU', 'L2_weight_yyx': 2.1424755298705373e-10, 'L_entropy_weight_yyx': 0.0009521720510028677, 'L_sep_weight_yyx': 0.0008794296904248074, 'L_scale_weight_yyx': 8.722538646320087e-08, 'learning_rate_yyx': 0.008605187275340159}. Best is trial 9 with value: -1.8693153029304443.
[I 2026-03-18 20:56:42,848] Trial 19 pruned. 
[I 2026-03-18 20:56:45,980] Trial 14 pruned. 
[I 2026-03-18 20:56:53,439] Trial 16 pruned. 
[I 2026-03-18 20:56:54,794] Trial 21 pruned. 
[I 2026-03-18 20:57:13,126] Trial 20 pruned. 
[I 2026-03-18 20:57:13,925] Trial 7 finished with value: -1.7817573439472854 and parameters: {'n_layers_yyx': 2, 'hidden_size_yyx_l0': 6, 'hidden_size_yyx_l1': 2, 'context_size_yyx': 1, 'num_mix_components_yyx': 3, 'context_extractor_yyx': 'lstm', 'activation_func_yyx': 'ReLU', 'L2_weight_yyx': 5.006866913045636e-07, 'L_entropy_weight_yyx': 2.1184014021701877e-06, 'L_sep_weight_yyx': 3.055344176260145e-07, 'L_scale_weight_yyx': 3.476541463655007e-08, 'learning_rate_yyx': 0.009623373406373243}. Best is trial 7 with value: -1.7817573439472854.
[I 2026-03-18 20:57:16,769] Trial 15 pruned. 
[I 2026-03-18 20:57:17,673] Trial 16 finished with value: -1.516329904468034 and parameters: {'n_layers_yyx': 2, 'hidden_size_yyx_l0': 6, 'hidden_size_yyx_l1': 2, 'context_size_yyx': 2, 'num_mix_components_yyx': 4, 'context_extractor_yyx': 'gru', 'activation_func_yyx': 'Tanh', 'L2_weight_yyx': 2.1642574873772656e-08, 'L_entropy_weight_yyx': 2.9361626331901625e-06, 'L_sep_weight_yyx': 1.3360579182455088e-08, 'L_scale_weight_yyx': 0.00011953067396837669, 'learning_rate_yyx': 0.0007638322113520125}. Best is trial 13 with value: -1.5658462904526245.
[I 2026-03-18 20:57:19,377] Trial 14 pruned. 
[I 2026-03-18 20:57:20,498] Trial 6 finished with value: -1.4463800753079927 and parameters: {'n_layers_yyx': 1, 'hidden_size_yyx_l0': 4, 'context_size_yyx': 4, 'num_mix_components_yyx': 5, 'context_extractor_yyx': 'lstm', 'activation_func_yyx': 'Tanh', 'L2_weight_yyx': 2.4892080778993154e-08, 'L_entropy_weight_yyx': 2.372515117277461e-10, 'L_sep_weight_yyx': 6.328528441861214e-06, 'L_scale_weight_yyx': 1.1889133219493506e-05, 'learning_rate_yyx': 0.004425881579228917}. Best is trial 6 with value: -1.4463800753079927.
[I 2026-03-18 20:57:21,157] Trial 22 pruned. 
[I 2026-03-18 20:57:22,185] Trial 20 finished with value: -1.447952364408053 and parameters: {'n_layers_yyx': 1, 'hidden_size_yyx_l0': 4, 'context_size_yyx': 3, 'num_mix_components_yyx': 4, 'context_extractor_yyx': 'lstm', 'activation_func_yyx': 'GELU', 'L2_weight_yyx': 3.61356489746756e-05, 'L_entropy_weight_yyx': 7.025580454442417e-07, 'L_sep_weight_yyx': 0.00022909972045442468, 'L_scale_weight_yyx': 1.6886736569858034e-07, 'learning_rate_yyx': 0.000981894609693632}. Best is trial 19 with value: -1.4628589806189904.
[I 2026-03-18 20:57:22,705] Trial 22 pruned. 
[I 2026-03-18 20:57:24,098] Trial 12 pruned. 
[I 2026-03-18 20:57:24,932] Trial 13 pruned. 
[I 2026-03-18 20:57:25,694] Trial 20 finished with value: -1.417362060546875 and parameters: {'n_layers_yyx': 2, 'hidden_size_yyx_l0': 6, 'hidden_size_yyx_l1': 5, 'context_size_yyx': 4, 'num_mix_components_yyx': 2, 'context_extractor_yyx': 'gru', 'activation_func_yyx': 'GELU', 'L2_weight_yyx': 3.67647519557107e-08, 'L_entropy_weight_yyx': 0.0001280562988240101, 'L_sep_weight_yyx': 3.634886048472147e-07, 'L_scale_weight_yyx': 9.533013600905825e-10, 'learning_rate_yyx': 0.009374133020489714}. Best is trial 1 with value: -1.4389243727463943.
[I 2026-03-18 20:57:30,143] Trial 12 pruned. 
[I 2026-03-18 20:57:36,482] Trial 16 finished with value: -1.790272919625947 and parameters: {'n_layers_yyx': 2, 'hidden_size_yyx_l0': 4, 'hidden_size_yyx_l1': 4, 'context_size_yyx': 4, 'num_mix_components_yyx': 2, 'context_extractor_yyx': 'gru', 'activation_func_yyx': 'Tanh', 'L2_weight_yyx': 2.499133503442908e-08, 'L_entropy_weight_yyx': 2.0399678227611365e-10, 'L_sep_weight_yyx': 5.0452474432171776e-05, 'L_scale_weight_yyx': 4.1002341747040464e-07, 'learning_rate_yyx': 0.0052706676445479885}. Best is trial 16 with value: -1.790272919625947.
[I 2026-03-18 20:57:37,175] Trial 15 pruned. 
[I 2026-03-18 20:57:37,513] Trial 23 pruned. 
[I 2026-03-18 20:57:41,225] Trial 21 pruned. 
[I 2026-03-18 20:57:41,367] Trial 17 pruned. 
[I 2026-03-18 20:57:42,131] Trial 11 finished with value: -1.8524833145194473 and parameters: {'n_layers_yyx': 2, 'hidden_size_yyx_l0': 5, 'hidden_size_yyx_l1': 6, 'context_size_yyx': 1, 'num_mix_components_yyx': 5, 'context_extractor_yyx': 'lstm', 'activation_func_yyx': 'Tanh', 'L2_weight_yyx': 4.9925885040470076e-09, 'L_entropy_weight_yyx': 1.0053062642924001e-10, 'L_sep_weight_yyx': 3.402501567915152e-06, 'L_scale_weight_yyx': 2.2343712703585546e-05, 'learning_rate_yyx': 0.009859978453181545}. Best is trial 1 with value: -1.8555367853768732.
[I 2026-03-18 20:57:45,860] Trial 16 finished with value: -1.8488733665890609 and parameters: {'n_layers_yyx': 2, 'hidden_size_yyx_l0': 3, 'hidden_size_yyx_l1': 5, 'context_size_yyx': 2, 'num_mix_components_yyx': 4, 'context_extractor_yyx': 'lstm', 'activation_func_yyx': 'GELU', 'L2_weight_yyx': 6.443649319758862e-08, 'L_entropy_weight_yyx': 6.809102786274259e-06, 'L_sep_weight_yyx': 4.54939108534696e-06, 'L_scale_weight_yyx': 1.7505139447544923e-06, 'learning_rate_yyx': 0.009839663599125583}. Best is trial 16 with value: -1.8488733665890609.
[I 2026-03-18 20:57:50,710] Trial 17 pruned. 
[I 2026-03-18 20:57:52,807] Trial 8 pruned. 
[I 2026-03-18 20:57:54,160] Trial 13 pruned. 
[I 2026-03-18 20:57:54,917] Trial 21 pruned. 
[I 2026-03-18 20:58:00,393] Trial 24 pruned. 
[I 2026-03-18 20:58:04,277] Trial 16 finished with value: -1.3548605097164899 and parameters: {'n_layers_yyx': 1, 'hidden_size_yyx_l0': 4, 'context_size_yyx': 4, 'num_mix_components_yyx': 1, 'context_extractor_yyx': 'gru', 'activation_func_yyx': 'Tanh', 'L2_weight_yyx': 7.35146832232429e-08, 'L_entropy_weight_yyx': 7.3829781540746215e-06, 'L_sep_weight_yyx': 5.815945761871686e-08, 'L_scale_weight_yyx': 2.7654009176136844e-09, 'learning_rate_yyx': 0.0087230366943681}. Best is trial 0 with value: -1.4467010977883008.
[I 2026-03-18 20:58:06,633] Trial 12 pruned. 
[I 2026-03-18 20:58:09,457] Trial 17 pruned. 
[I 2026-03-18 20:58:10,990] Trial 14 finished with value: -1.438593515249399 and parameters: {'n_layers_yyx': 2, 'hidden_size_yyx_l0': 3, 'hidden_size_yyx_l1': 5, 'context_size_yyx': 2, 'num_mix_components_yyx': 4, 'context_extractor_yyx': 'lstm', 'activation_func_yyx': 'Tanh', 'L2_weight_yyx': 5.872107267905368e-06, 'L_entropy_weight_yyx': 1.4758732057291141e-06, 'L_sep_weight_yyx': 8.777508789804949e-09, 'L_scale_weight_yyx': 2.8904433710273216e-09, 'learning_rate_yyx': 0.009482802461453683}. Best is trial 12 with value: -1.4532693716195912.
[I 2026-03-18 20:58:14,949] Trial 18 pruned. 
[I 2026-03-18 20:58:15,702] Trial 19 finished with value: -1.451357961801382 and parameters: {'n_layers_yyx': 2, 'hidden_size_yyx_l0': 6, 'hidden_size_yyx_l1': 5, 'context_size_yyx': 4, 'num_mix_components_yyx': 4, 'context_extractor_yyx': 'lstm', 'activation_func_yyx': 'GELU', 'L2_weight_yyx': 9.33509936525752e-08, 'L_entropy_weight_yyx': 2.7312697131912322e-06, 'L_sep_weight_yyx': 1.5060045135230522e-08, 'L_scale_weight_yyx': 2.84224005720957e-07, 'learning_rate_yyx': 0.009754200254302951}. Best is trial 10 with value: -1.4553572904146634.
[I 2026-03-18 20:58:20,252] Trial 22 pruned. 
