[I 2026-03-18 18:47:11,369] Trial 49 pruned. 

Source events: 54211
Target events: 16159
Full model ln_yyx : 4372.17960 nats/sec, 243.51517 nats/event
Full model Log loss : -3.13365
Full model ln_yyx : 4386.25441 nats/sec, 244.29909 nats/event
Full model Log loss : -3.15251
Full model ln_yyx : 4335.09039 nats/sec, 241.44943 nats/event
Full model Log loss : -3.13285
Full model ln_yyx : 4329.94304 nats/sec, 241.16274 nats/event
Full model Log loss : -3.11216
Full model ln_yyx : 4396.56595 nats/sec, 244.87341 nats/event
Full model Log loss : -3.15198
Full model ln_yyx : 4392.09008 nats/sec, 244.62411 nats/event
Full model Log loss : -3.15057
Full model ln_yyx : 4352.03994 nats/sec, 242.39346 nats/event
Full model Log loss : -3.11993
Full model ln_yyx : 4356.83196 nats/sec, 242.66036 nats/event
Full model Log loss : -3.14677
Full model ln_yyx : 4391.24074 nats/sec, 244.57681 nats/event
Full model Log loss : -3.14921
Full model ln_yyx : 4331.94886 nats/sec, 241.27446 nats/event
Full model Log loss : -3.12150
Full model ln_yyx : 4392.99622 nats/sec, 244.67458 nats/event
Full model Log loss : -3.14885
Full model ln_yyx : 4380.79561 nats/sec, 243.99505 nats/event
Full model Log loss : -3.14967
Full model ln_yyx : 4397.74476 nats/sec, 244.93906 nats/event
Full model Log loss : -3.14962
Full model ln_yyx : 4356.75322 nats/sec, 242.65597 nats/event
Full model Log loss : -3.13913
Full model ln_yyx : 4402.91248 nats/sec, 245.22689 nats/event
Full model Log loss : -3.14883
Full model ln_yyx : 4351.75827 nats/sec, 242.37777 nats/event
Full model Log loss : -3.11856
Full model ln_yyx : 4387.97894 nats/sec, 244.39514 nats/event
Full model Log loss : -3.14952
Full model ln_yyx : 4407.31235 nats/sec, 245.47194 nats/event
Full model Log loss : -3.15127
Full model ln_yyx : 4381.54426 nats/sec, 244.03675 nats/event
Full model Log loss : -3.15015
Full model ln_yyx : 4383.77299 nats/sec, 244.16088 nats/event
Full model Log loss : -3.15067
Optimization finished. Config saved to results/opt-full/opt_full_84_best_config.txt
[I 2026-03-18 18:47:43,330] Trial 47 finished with value: -3.1524043881141286 and parameters: {'n_layers_yyx': 2, 'hidden_size_yyx_l0': 6, 'hidden_size_yyx_l1': 4, 'context_size_yyx': 4, 'num_mix_components_yyx': 5, 'context_extractor_yyx': 'gru', 'activation_func_yyx': 'GELU', 'L2_weight_yyx': 9.824252772270476e-07, 'L_entropy_weight_yyx': 5.206277532413101e-09, 'L_sep_weight_yyx': 0.000753801668552183, 'L_scale_weight_yyx': 1.3633712695973567e-09, 'learning_rate_yyx': 0.008493871500311556}. Best is trial 41 with value: -3.1538762865545746.
[I 2026-03-18 18:47:48,769] Trial 49 pruned. 

Source events: 54211
Target events: 3403
Full model ln_yyx : 918.55345 nats/sec, 242.93215 nats/event
Full model Log loss : -3.13736
Full model ln_yyx : 925.08826 nats/sec, 244.66043 nats/event
Full model Log loss : -3.16627
Full model ln_yyx : 921.61857 nats/sec, 243.74279 nats/event
Full model Log loss : -3.16552
Full model ln_yyx : 911.72931 nats/sec, 241.12735 nats/event
Full model Log loss : -3.12797
Full model ln_yyx : 926.08058 nats/sec, 244.92287 nats/event
Full model Log loss : -3.16581
Full model ln_yyx : 919.67334 nats/sec, 243.22833 nats/event
Full model Log loss : -3.16526
Full model ln_yyx : 924.05696 nats/sec, 244.38768 nats/event
Full model Log loss : -3.16611
Full model ln_yyx : 910.33580 nats/sec, 240.75881 nats/event
Full model Log loss : -3.13399
Full model ln_yyx : 915.99001 nats/sec, 242.25419 nats/event
Full model Log loss : -3.13663
Full model ln_yyx : 920.34056 nats/sec, 243.40479 nats/event
Full model Log loss : -3.16482
Full model ln_yyx : 927.70840 nats/sec, 245.35338 nats/event
Full model Log loss : -3.16884
Full model ln_yyx : 918.28143 nats/sec, 242.86021 nats/event
Full model Log loss : -3.13927
Full model ln_yyx : 924.22470 nats/sec, 244.43204 nats/event
Full model Log loss : -3.17087
Full model ln_yyx : 924.13231 nats/sec, 244.40760 nats/event
Full model Log loss : -3.16871
Full model ln_yyx : 924.97782 nats/sec, 244.63122 nats/event
Full model Log loss : -3.16586
Optimization finished. Config saved to results/opt-full/opt_full_71_best_config.txt
[I 2026-03-18 18:47:54,537] Trial 48 pruned. 
[I 2026-03-18 18:48:09,936] Trial 43 finished with value: -3.152704965526356 and parameters: {'n_layers_yyx': 2, 'hidden_size_yyx_l0': 6, 'hidden_size_yyx_l1': 5, 'context_size_yyx': 4, 'num_mix_components_yyx': 3, 'context_extractor_yyx': 'lstm', 'activation_func_yyx': 'GELU', 'L2_weight_yyx': 3.0455293295262205e-10, 'L_entropy_weight_yyx': 1.2814476426722248e-05, 'L_sep_weight_yyx': 2.8944000839937675e-10, 'L_scale_weight_yyx': 0.00022176697983847468, 'learning_rate_yyx': 0.005147780784723836}. Best is trial 5 with value: -3.154335707688014.
[I 2026-03-18 18:48:15,867] Trial 44 finished with value: -3.161434978772313 and parameters: {'n_layers_yyx': 1, 'hidden_size_yyx_l0': 6, 'context_size_yyx': 4, 'num_mix_components_yyx': 3, 'context_extractor_yyx': 'gru', 'activation_func_yyx': 'ReLU', 'L2_weight_yyx': 1.0112261815328172e-10, 'L_entropy_weight_yyx': 5.360015181119613e-08, 'L_sep_weight_yyx': 0.00011406678194766759, 'L_scale_weight_yyx': 7.584163062364809e-08, 'learning_rate_yyx': 0.0084466627739323}. Best is trial 39 with value: -3.1621467102733707.
[I 2026-03-18 18:48:18,306] Trial 49 pruned. 

Source events: 54211
Target events: 27060
Full model ln_yyx : 7225.05346 nats/sec, 240.30111 nats/event
Full model Log loss : -3.10752
Full model ln_yyx : 7245.36246 nats/sec, 240.97658 nats/event
Full model Log loss : -3.11616
Full model ln_yyx : 7350.40744 nats/sec, 244.47031 nats/event
Full model Log loss : -3.14726
Full model ln_yyx : 7337.87132 nats/sec, 244.05337 nats/event
Full model Log loss : -3.15014
Full model ln_yyx : 7343.18129 nats/sec, 244.22998 nats/event
Full model Log loss : -3.14648
Full model ln_yyx : 7298.51198 nats/sec, 242.74430 nats/event
Full model Log loss : -3.12115
Full model ln_yyx : 7339.31288 nats/sec, 244.10132 nats/event
Full model Log loss : -3.15165
Full model ln_yyx : 7307.30490 nats/sec, 243.03675 nats/event
Full model Log loss : -3.11980
Full model ln_yyx : 7341.43949 nats/sec, 244.17204 nats/event
Full model Log loss : -3.15170
Full model ln_yyx : 7377.28441 nats/sec, 245.36423 nats/event
Full model Log loss : -3.15275
Full model ln_yyx : 7375.65995 nats/sec, 245.31020 nats/event
Full model Log loss : -3.15013
Full model ln_yyx : 7363.66401 nats/sec, 244.91122 nats/event
Full model Log loss : -3.15229
Full model ln_yyx : 7333.04252 nats/sec, 243.89277 nats/event
Full model Log loss : -3.15085
Full model ln_yyx : 7346.51608 nats/sec, 244.34089 nats/event
Full model Log loss : -3.15326
Full model ln_yyx : 7369.48006 nats/sec, 245.10466 nats/event
Full model Log loss : -3.15293
Full model ln_yyx : 7397.60586 nats/sec, 246.04011 nats/event
Full model Log loss : -3.15334
Full model ln_yyx : 7364.46443 nats/sec, 244.93784 nats/event
Full model Log loss : -3.15388
Full model ln_yyx : 7330.71531 nats/sec, 243.81537 nats/event
Full model Log loss : -3.15314
Full model ln_yyx : 7357.93252 nats/sec, 244.72059 nats/event
Full model Log loss : -3.14551
Full model ln_yyx : 7361.48757 nats/sec, 244.83883 nats/event
Full model Log loss : -3.15240
Optimization finished. Config saved to results/opt-full/opt_full_75_best_config.txt
[I 2026-03-18 18:49:16,224] Trial 45 pruned. 
[I 2026-03-18 18:49:47,896] Trial 44 finished with value: -3.1521595081617404 and parameters: {'n_layers_yyx': 2, 'hidden_size_yyx_l0': 6, 'hidden_size_yyx_l1': 5, 'context_size_yyx': 4, 'num_mix_components_yyx': 3, 'context_extractor_yyx': 'lstm', 'activation_func_yyx': 'GELU', 'L2_weight_yyx': 2.484823696049744e-10, 'L_entropy_weight_yyx': 5.8067881836792705e-06, 'L_sep_weight_yyx': 6.13482326278295e-10, 'L_scale_weight_yyx': 0.00018097952040201692, 'learning_rate_yyx': 0.005489978267670169}. Best is trial 5 with value: -3.154335707688014.
[I 2026-03-18 18:50:36,211] Trial 45 finished with value: -3.122916544377156 and parameters: {'n_layers_yyx': 2, 'hidden_size_yyx_l0': 5, 'hidden_size_yyx_l1': 6, 'context_size_yyx': 3, 'num_mix_components_yyx': 2, 'context_extractor_yyx': 'lstm', 'activation_func_yyx': 'GELU', 'L2_weight_yyx': 3.5023284170283243e-10, 'L_entropy_weight_yyx': 5.2897288798718686e-06, 'L_sep_weight_yyx': 3.972888437037367e-10, 'L_scale_weight_yyx': 0.0008826460528739686, 'learning_rate_yyx': 0.008385948337222891}. Best is trial 5 with value: -3.154335707688014.
[I 2026-03-18 18:50:45,770] Trial 46 finished with value: -3.1603445468716664 and parameters: {'n_layers_yyx': 1, 'hidden_size_yyx_l0': 6, 'context_size_yyx': 4, 'num_mix_components_yyx': 3, 'context_extractor_yyx': 'gru', 'activation_func_yyx': 'ReLU', 'L2_weight_yyx': 2.6093950116361536e-10, 'L_entropy_weight_yyx': 3.8782194603305184e-08, 'L_sep_weight_yyx': 0.00010531494181198218, 'L_scale_weight_yyx': 2.858121531100332e-08, 'learning_rate_yyx': 0.0091224859799362}. Best is trial 39 with value: -3.1621467102733707.
[I 2026-03-18 18:50:58,356] Trial 46 pruned. 
[I 2026-03-18 18:51:08,023] Trial 47 pruned. 
[I 2026-03-18 18:51:31,439] Trial 48 pruned. 
[I 2026-03-18 18:51:46,345] Trial 47 pruned. 
[I 2026-03-18 18:51:54,013] Trial 49 pruned. 

Source events: 54211
Target events: 13628
Full model ln_yyx : 3627.69157 nats/sec, 239.57458 nats/event
Full model Log loss : -3.10894
Full model ln_yyx : 3680.26213 nats/sec, 243.04637 nats/event
Full model Log loss : -3.12356
Full model ln_yyx : 3635.74121 nats/sec, 240.10619 nats/event
Full model Log loss : -3.10768
Full model ln_yyx : 3693.92156 nats/sec, 243.94844 nats/event
Full model Log loss : -3.15434
Full model ln_yyx : 3696.23134 nats/sec, 244.10098 nats/event
Full model Log loss : -3.14518
Full model ln_yyx : 3672.61924 nats/sec, 242.54163 nats/event
Full model Log loss : -3.12234
Full model ln_yyx : 3669.69255 nats/sec, 242.34835 nats/event
Full model Log loss : -3.11896
Full model ln_yyx : 3662.44185 nats/sec, 241.86951 nats/event
Full model Log loss : -3.12216
Full model ln_yyx : 3672.70595 nats/sec, 242.54736 nats/event
Full model Log loss : -3.14925
Full model ln_yyx : 3698.39053 nats/sec, 244.24358 nats/event
Full model Log loss : -3.15122
Full model ln_yyx : 3697.01440 nats/sec, 244.15270 nats/event
Full model Log loss : -3.15122
Full model ln_yyx : 3697.69419 nats/sec, 244.19759 nats/event
Full model Log loss : -3.15122
Full model ln_yyx : 3698.59308 nats/sec, 244.25695 nats/event
Full model Log loss : -3.15122
Full model ln_yyx : 3649.07994 nats/sec, 240.98708 nats/event
Full model Log loss : -3.12356
Full model ln_yyx : 3661.28812 nats/sec, 241.79332 nats/event
Full model Log loss : -3.12209
Full model ln_yyx : 3664.09566 nats/sec, 241.97873 nats/event
Full model Log loss : -3.11600
Full model ln_yyx : 3691.97419 nats/sec, 243.81984 nats/event
Full model Log loss : -3.15116
Full model ln_yyx : 3701.80275 nats/sec, 244.46892 nats/event
Full model Log loss : -3.14902
Full model ln_yyx : 3644.10262 nats/sec, 240.65838 nats/event
Full model Log loss : -3.12139
Full model ln_yyx : 3715.54095 nats/sec, 245.37620 nats/event
Full model Log loss : -3.15240
Full model ln_yyx : 3705.49627 nats/sec, 244.71284 nats/event
Full model Log loss : -3.15120
Full model ln_yyx : 3653.60386 nats/sec, 241.28584 nats/event
Full model Log loss : -3.11369
Full model ln_yyx : 3713.93115 nats/sec, 245.26989 nats/event
Full model Log loss : -3.15208
Full model ln_yyx : 3716.27502 nats/sec, 245.42468 nats/event
Full model Log loss : -3.15270
Full model ln_yyx : 3704.14893 nats/sec, 244.62387 nats/event
Full model Log loss : -3.15216
Full model ln_yyx : 3675.09516 nats/sec, 242.70514 nats/event
Full model Log loss : -3.12292
Optimization finished. Config saved to results/opt-full/opt_full_78_best_config.txt
[I 2026-03-18 18:53:25,072] Trial 48 finished with value: -3.161253638496305 and parameters: {'n_layers_yyx': 1, 'hidden_size_yyx_l0': 6, 'context_size_yyx': 4, 'num_mix_components_yyx': 3, 'context_extractor_yyx': 'gru', 'activation_func_yyx': 'ReLU', 'L2_weight_yyx': 1.8922643004287853e-10, 'L_entropy_weight_yyx': 1.557120188772545e-07, 'L_sep_weight_yyx': 2.1018284319885877e-05, 'L_scale_weight_yyx': 2.003695345670711e-06, 'learning_rate_yyx': 0.00773526991623823}. Best is trial 39 with value: -3.1621467102733707.
[I 2026-03-18 18:53:34,659] Trial 49 pruned. 

Source events: 54211
Target events: 10752
Full model ln_yyx : 2900.49329 nats/sec, 242.78683 nats/event
Full model Log loss : -3.14643
Full model ln_yyx : 2886.26105 nats/sec, 241.59551 nats/event
Full model Log loss : -3.11986
Full model ln_yyx : 2875.68611 nats/sec, 240.71033 nats/event
Full model Log loss : -3.11535
Full model ln_yyx : 2886.64198 nats/sec, 241.62740 nats/event
Full model Log loss : -3.11595
Full model ln_yyx : 2910.97156 nats/sec, 243.66391 nats/event
Full model Log loss : -3.14716
Full model ln_yyx : 2892.11769 nats/sec, 242.08574 nats/event
Full model Log loss : -3.12769
Full model ln_yyx : 2909.90660 nats/sec, 243.57477 nats/event
Full model Log loss : -3.14506
Full model ln_yyx : 2921.22663 nats/sec, 244.52232 nats/event
Full model Log loss : -3.15591
Full model ln_yyx : 2917.64820 nats/sec, 244.22278 nats/event
Full model Log loss : -3.14810
Full model ln_yyx : 2899.53548 nats/sec, 242.70665 nats/event
Full model Log loss : -3.14708
Full model ln_yyx : 2891.15228 nats/sec, 242.00493 nats/event
Full model Log loss : -3.12006
Full model ln_yyx : 2929.52940 nats/sec, 245.21730 nats/event
Full model Log loss : -3.16194
Full model ln_yyx : 2922.74299 nats/sec, 244.64925 nats/event
Full model Log loss : -3.15357
Full model ln_yyx : 2911.46147 nats/sec, 243.70492 nats/event
Full model Log loss : -3.15270
Full model ln_yyx : 2911.49108 nats/sec, 243.70740 nats/event
Full model Log loss : -3.15269
Full model ln_yyx : 2918.01131 nats/sec, 244.25318 nats/event
Full model Log loss : -3.15551
Full model ln_yyx : 2931.49401 nats/sec, 245.38175 nats/event
Full model Log loss : -3.15454
Full model ln_yyx : 2898.16295 nats/sec, 242.59176 nats/event
Full model Log loss : -3.12684
Full model ln_yyx : 2913.13004 nats/sec, 243.84459 nats/event
Full model Log loss : -3.15307
Full model ln_yyx : 2937.42584 nats/sec, 245.87828 nats/event
Full model Log loss : -3.16215
Full model ln_yyx : 2913.90054 nats/sec, 243.90909 nats/event
Full model Log loss : -3.15948
Full model ln_yyx : 2915.38231 nats/sec, 244.03312 nats/event
Full model Log loss : -3.16069
Full model ln_yyx : 2929.54250 nats/sec, 245.21840 nats/event
Full model Log loss : -3.16125
Full model ln_yyx : 2930.97922 nats/sec, 245.33866 nats/event
Full model Log loss : -3.16143
Full model ln_yyx : 2910.07375 nats/sec, 243.58876 nats/event
Full model Log loss : -3.16034
Full model ln_yyx : 2927.76704 nats/sec, 245.06979 nats/event
Full model Log loss : -3.16125
Optimization finished. Config saved to results/opt-full/opt_full_76_best_config.txt
