[I 2026-03-18 18:24:56,695] Trial 40 finished with value: -1.2360020926988768 and parameters: {'n_layers_yyx': 2, 'hidden_size_yyx_l0': 5, 'hidden_size_yyx_l1': 4, 'context_size_yyx': 1, 'num_mix_components_yyx': 3, 'context_extractor_yyx': 'gru', 'activation_func_yyx': 'ReLU', 'L2_weight_yyx': 3.451937364720324e-09, 'L_entropy_weight_yyx': 3.3480555886809037e-10, 'L_sep_weight_yyx': 1.1864531990739008e-06, 'L_scale_weight_yyx': 1.4870368214576678e-09, 'learning_rate_yyx': 0.004297180373409486}. Best is trial 2 with value: -1.2804754530695341.
[I 2026-03-18 18:25:02,101] Trial 46 pruned. 
[I 2026-03-18 18:25:04,524] Trial 47 pruned. 
[I 2026-03-18 18:25:09,162] Trial 34 finished with value: -1.2538551006211371 and parameters: {'n_layers_yyx': 2, 'hidden_size_yyx_l0': 6, 'hidden_size_yyx_l1': 6, 'context_size_yyx': 4, 'num_mix_components_yyx': 5, 'context_extractor_yyx': 'gru', 'activation_func_yyx': 'Tanh', 'L2_weight_yyx': 1.1147793709910794e-05, 'L_entropy_weight_yyx': 1.4239181618352823e-07, 'L_sep_weight_yyx': 3.829335861133134e-07, 'L_scale_weight_yyx': 2.6401245473254256e-09, 'learning_rate_yyx': 0.003620026612894264}. Best is trial 28 with value: -1.2685478478394683.
[I 2026-03-18 18:25:12,152] Trial 30 pruned. 
[I 2026-03-18 18:25:14,370] Trial 41 pruned. 
[I 2026-03-18 18:25:14,446] Trial 38 pruned. 
[I 2026-03-18 18:25:16,568] Trial 31 finished with value: -3.1806708175248524 and parameters: {'n_layers_yyx': 2, 'hidden_size_yyx_l0': 6, 'hidden_size_yyx_l1': 5, 'context_size_yyx': 2, 'num_mix_components_yyx': 5, 'context_extractor_yyx': 'lstm', 'activation_func_yyx': 'ReLU', 'L2_weight_yyx': 0.00015023643545305221, 'L_entropy_weight_yyx': 2.161923751240171e-10, 'L_sep_weight_yyx': 2.730802755690974e-05, 'L_scale_weight_yyx': 1.2884461691548303e-05, 'learning_rate_yyx': 0.003258310952955965}. Best is trial 12 with value: -3.1893335216865584.
[I 2026-03-18 18:25:25,877] Trial 38 pruned. 
[I 2026-03-18 18:25:29,541] Trial 31 pruned. 
[I 2026-03-18 18:25:29,883] Trial 42 pruned. 
[I 2026-03-18 18:25:30,541] Trial 49 finished with value: -1.269662190717602 and parameters: {'n_layers_yyx': 2, 'hidden_size_yyx_l0': 5, 'hidden_size_yyx_l1': 6, 'context_size_yyx': 4, 'num_mix_components_yyx': 4, 'context_extractor_yyx': 'lstm', 'activation_func_yyx': 'GELU', 'L2_weight_yyx': 2.775331829748926e-08, 'L_entropy_weight_yyx': 1.3966337956979707e-08, 'L_sep_weight_yyx': 2.3644021645522524e-09, 'L_scale_weight_yyx': 1.6306286698857423e-08, 'learning_rate_yyx': 0.006025336065944348}. Best is trial 42 with value: -1.2710004090822118.

Source events: 5634
Target events: 14713
Full model ln_yyx : 228.93025 nats/sec, 14.00375 nats/event
Full model Log loss : -1.25284
Full model ln_yyx : 228.58094 nats/sec, 13.98239 nats/event
Full model Log loss : -1.24434
Full model ln_yyx : 230.22790 nats/sec, 14.08313 nats/event
Full model Log loss : -1.24551
Full model ln_yyx : 231.16979 nats/sec, 14.14075 nats/event
Full model Log loss : -1.24584
Full model ln_yyx : 230.85517 nats/sec, 14.12150 nats/event
Full model Log loss : -1.26674
Full model ln_yyx : 230.82536 nats/sec, 14.11968 nats/event
Full model Log loss : -1.26569
Full model ln_yyx : 229.50078 nats/sec, 14.03865 nats/event
Full model Log loss : -1.26919
Full model ln_yyx : 230.82341 nats/sec, 14.11956 nats/event
Full model Log loss : -1.25965
Full model ln_yyx : 230.31136 nats/sec, 14.08824 nats/event
Full model Log loss : -1.25676
Full model ln_yyx : 233.80319 nats/sec, 14.30183 nats/event
Full model Log loss : -1.26682
Full model ln_yyx : 230.73793 nats/sec, 14.11433 nats/event
Full model Log loss : -1.26682
Full model ln_yyx : 231.59202 nats/sec, 14.16657 nats/event
Full model Log loss : -1.24650
Full model ln_yyx : 230.97468 nats/sec, 14.12881 nats/event
Full model Log loss : -1.27100
Full model ln_yyx : 231.81685 nats/sec, 14.18033 nats/event
Full model Log loss : -1.27005
Full model ln_yyx : 230.63163 nats/sec, 14.10783 nats/event
Full model Log loss : -1.26966
Optimization finished. Config saved to results/opt-full/opt_full_87_best_config.txt
[I 2026-03-18 18:25:31,145] Trial 41 finished with value: -3.1236506708279257 and parameters: {'n_layers_yyx': 2, 'hidden_size_yyx_l0': 4, 'hidden_size_yyx_l1': 6, 'context_size_yyx': 4, 'num_mix_components_yyx': 1, 'context_extractor_yyx': 'lstm', 'activation_func_yyx': 'ReLU', 'L2_weight_yyx': 1.1452155843391807e-10, 'L_entropy_weight_yyx': 8.631621509631563e-05, 'L_sep_weight_yyx': 1.611577537370693e-08, 'L_scale_weight_yyx': 4.155717875159207e-06, 'learning_rate_yyx': 0.00848570580986071}. Best is trial 16 with value: -3.149974272486285.
[I 2026-03-18 18:25:34,186] Trial 49 finished with value: -1.2329696542454294 and parameters: {'n_layers_yyx': 1, 'hidden_size_yyx_l0': 6, 'context_size_yyx': 1, 'num_mix_components_yyx': 4, 'context_extractor_yyx': 'gru', 'activation_func_yyx': 'GELU', 'L2_weight_yyx': 4.6106539966866615e-09, 'L_entropy_weight_yyx': 6.408072103328329e-05, 'L_sep_weight_yyx': 1.7158535124235362e-10, 'L_scale_weight_yyx': 1.0858909866134841e-06, 'learning_rate_yyx': 0.005602045897958555}. Best is trial 23 with value: -1.2721869844165175.

Source events: 5634
Target events: 27060
Full model ln_yyx : 422.02141 nats/sec, 14.03619 nats/event
Full model Log loss : -1.25158
Full model ln_yyx : 422.97694 nats/sec, 14.06797 nats/event
Full model Log loss : -1.25055
Full model ln_yyx : 423.13603 nats/sec, 14.07326 nats/event
Full model Log loss : -1.26776
Full model ln_yyx : 422.67817 nats/sec, 14.05803 nats/event
Full model Log loss : -1.26441
Full model ln_yyx : 419.41616 nats/sec, 13.94954 nats/event
Full model Log loss : -1.26190
Full model ln_yyx : 421.72605 nats/sec, 14.02637 nats/event
Full model Log loss : -1.26985
Full model ln_yyx : 422.09576 nats/sec, 14.03866 nats/event
Full model Log loss : -1.27155
Full model ln_yyx : 418.88961 nats/sec, 13.93203 nats/event
Full model Log loss : -1.27219
Full model ln_yyx : 422.67187 nats/sec, 14.05782 nats/event
Full model Log loss : -1.26271
Full model ln_yyx : 422.03405 nats/sec, 14.03661 nats/event
Full model Log loss : -1.26451
Full model ln_yyx : 419.27534 nats/sec, 13.94486 nats/event
Full model Log loss : -1.26373
Full model ln_yyx : 418.14136 nats/sec, 13.90714 nats/event
Full model Log loss : -1.23297
Optimization finished. Config saved to results/opt-full/opt_full_92_best_config.txt
[I 2026-03-18 18:25:34,667] Trial 32 pruned. 
[I 2026-03-18 18:25:36,995] Trial 27 finished with value: -3.1501326972311916 and parameters: {'n_layers_yyx': 2, 'hidden_size_yyx_l0': 6, 'hidden_size_yyx_l1': 4, 'context_size_yyx': 4, 'num_mix_components_yyx': 4, 'context_extractor_yyx': 'lstm', 'activation_func_yyx': 'GELU', 'L2_weight_yyx': 0.0004765973136704104, 'L_entropy_weight_yyx': 9.166301012633164e-07, 'L_sep_weight_yyx': 2.00845791230785e-05, 'L_scale_weight_yyx': 2.0436982282980185e-09, 'learning_rate_yyx': 0.0052630510132674925}. Best is trial 25 with value: -3.152748146031954.
[I 2026-03-18 18:25:39,581] Trial 38 finished with value: -3.150483715419478 and parameters: {'n_layers_yyx': 2, 'hidden_size_yyx_l0': 6, 'hidden_size_yyx_l1': 5, 'context_size_yyx': 4, 'num_mix_components_yyx': 3, 'context_extractor_yyx': 'lstm', 'activation_func_yyx': 'GELU', 'L2_weight_yyx': 1.7300930812331068e-08, 'L_entropy_weight_yyx': 2.2246840274393523e-07, 'L_sep_weight_yyx': 1.1022039479873537e-06, 'L_scale_weight_yyx': 2.439962991815183e-07, 'learning_rate_yyx': 0.005851906692815366}. Best is trial 38 with value: -3.150483715419478.
[I 2026-03-18 18:25:39,651] Trial 47 pruned. 
[I 2026-03-18 18:25:41,540] Trial 48 pruned. 
[I 2026-03-18 18:25:46,801] Trial 48 pruned. 
[I 2026-03-18 18:25:47,298] Trial 29 pruned. 
[I 2026-03-18 18:25:48,270] Trial 35 pruned. 
[I 2026-03-18 18:25:57,740] Trial 49 pruned. 

Source events: 54211
Target events: 11540
Full model ln_yyx : 3114.20561 nats/sec, 242.87565 nats/event
Full model Log loss : -3.15060
Full model ln_yyx : 3140.30405 nats/sec, 244.91106 nats/event
Full model Log loss : -3.15806
Full model ln_yyx : 3099.45358 nats/sec, 241.72515 nats/event
Full model Log loss : -3.12380
Full model ln_yyx : 3078.84758 nats/sec, 240.11810 nats/event
Full model Log loss : -3.11252
Full model ln_yyx : 3133.39977 nats/sec, 244.37260 nats/event
Full model Log loss : -3.15619
Full model ln_yyx : 3113.89974 nats/sec, 242.85180 nats/event
Full model Log loss : -3.14146
Full model ln_yyx : 3130.00260 nats/sec, 244.10765 nats/event
Full model Log loss : -3.16095
Full model ln_yyx : 3091.82539 nats/sec, 241.13023 nats/event
Full model Log loss : -3.11675
Full model ln_yyx : 3082.61922 nats/sec, 240.41224 nats/event
Full model Log loss : -3.11446
Full model ln_yyx : 3103.82740 nats/sec, 242.06626 nats/event
Full model Log loss : -3.12803
Full model ln_yyx : 3095.07582 nats/sec, 241.38373 nats/event
Full model Log loss : -3.11950
Full model ln_yyx : 3090.37167 nats/sec, 241.01685 nats/event
Full model Log loss : -3.11932
Optimization finished. Config saved to results/opt-full/opt_full_83_best_config.txt
[I 2026-03-18 18:25:57,932] Trial 22 finished with value: -3.1512155485067574 and parameters: {'n_layers_yyx': 2, 'hidden_size_yyx_l0': 6, 'hidden_size_yyx_l1': 5, 'context_size_yyx': 4, 'num_mix_components_yyx': 3, 'context_extractor_yyx': 'lstm', 'activation_func_yyx': 'GELU', 'L2_weight_yyx': 1.587720666617436e-09, 'L_entropy_weight_yyx': 2.0659818408722715e-05, 'L_sep_weight_yyx': 1.5068948521821795e-08, 'L_scale_weight_yyx': 4.3656671565874644e-05, 'learning_rate_yyx': 0.0038086350312579505}. Best is trial 5 with value: -3.154335707688014.
[I 2026-03-18 18:25:58,117] Trial 32 finished with value: -3.121178207965906 and parameters: {'n_layers_yyx': 2, 'hidden_size_yyx_l0': 6, 'hidden_size_yyx_l1': 4, 'context_size_yyx': 4, 'num_mix_components_yyx': 3, 'context_extractor_yyx': 'gru', 'activation_func_yyx': 'ReLU', 'L2_weight_yyx': 1.0387784709106009e-05, 'L_entropy_weight_yyx': 2.559818913016617e-10, 'L_sep_weight_yyx': 4.573159239709776e-10, 'L_scale_weight_yyx': 2.904505280235567e-07, 'learning_rate_yyx': 0.009797779953326884}. Best is trial 23 with value: -3.1545382986021053.
[I 2026-03-18 18:25:58,152] Trial 22 finished with value: -3.15017039446166 and parameters: {'n_layers_yyx': 1, 'hidden_size_yyx_l0': 6, 'context_size_yyx': 2, 'num_mix_components_yyx': 3, 'context_extractor_yyx': 'gru', 'activation_func_yyx': 'Tanh', 'L2_weight_yyx': 1.8376077704945646e-05, 'L_entropy_weight_yyx': 0.0002236321802838134, 'L_sep_weight_yyx': 0.00042437819420677674, 'L_scale_weight_yyx': 2.1565787175134863e-07, 'learning_rate_yyx': 0.009774902254493258}. Best is trial 10 with value: -3.1515199681211117.
[I 2026-03-18 18:25:59,812] Trial 42 finished with value: -1.2559153685508064 and parameters: {'n_layers_yyx': 1, 'hidden_size_yyx_l0': 6, 'context_size_yyx': 3, 'num_mix_components_yyx': 5, 'context_extractor_yyx': 'lstm', 'activation_func_yyx': 'Tanh', 'L2_weight_yyx': 2.0281061908626975e-05, 'L_entropy_weight_yyx': 5.295567346873039e-06, 'L_sep_weight_yyx': 2.935644642959615e-08, 'L_scale_weight_yyx': 6.640023454138668e-08, 'learning_rate_yyx': 0.005080960042900301}. Best is trial 0 with value: -1.2691870881537193.
[I 2026-03-18 18:26:03,130] Trial 28 pruned. 
[I 2026-03-18 18:26:08,791] Trial 30 finished with value: -3.153565164989614 and parameters: {'n_layers_yyx': 1, 'hidden_size_yyx_l0': 4, 'context_size_yyx': 4, 'num_mix_components_yyx': 4, 'context_extractor_yyx': 'lstm', 'activation_func_yyx': 'ReLU', 'L2_weight_yyx': 2.607555909942899e-08, 'L_entropy_weight_yyx': 6.485816158801863e-09, 'L_sep_weight_yyx': 4.3255913575471365e-07, 'L_scale_weight_yyx': 8.579577953488585e-10, 'learning_rate_yyx': 0.0043614131177178}. Best is trial 27 with value: -3.161937115338458.
[I 2026-03-18 18:26:09,835] Trial 48 finished with value: -3.118371760446134 and parameters: {'n_layers_yyx': 1, 'hidden_size_yyx_l0': 5, 'context_size_yyx': 3, 'num_mix_components_yyx': 5, 'context_extractor_yyx': 'lstm', 'activation_func_yyx': 'ReLU', 'L2_weight_yyx': 1.8243664224889355e-08, 'L_entropy_weight_yyx': 1.0202721378411067e-10, 'L_sep_weight_yyx': 5.782957373628758e-07, 'L_scale_weight_yyx': 1.0560825337382726e-10, 'learning_rate_yyx': 0.006737350291638703}. Best is trial 1 with value: -3.1505299612690063.
[I 2026-03-18 18:26:11,218] Trial 28 pruned. 
[I 2026-03-18 18:26:12,444] Trial 23 pruned. 
[I 2026-03-18 18:26:15,397] Trial 49 pruned. 

Source events: 3828
Target events: 11540
Full model ln_yyx : 80.48614 nats/sec, 6.27708 nats/event
Full model Log loss : -0.52692
Full model ln_yyx : 83.35541 nats/sec, 6.50086 nats/event
Full model Log loss : -0.56703
Full model ln_yyx : 80.77062 nats/sec, 6.29927 nats/event
Full model Log loss : -0.55454
Full model ln_yyx : 82.75453 nats/sec, 6.45399 nats/event
Full model Log loss : -0.58045
Full model ln_yyx : 82.30123 nats/sec, 6.41864 nats/event
Full model Log loss : -0.56550
Full model ln_yyx : 84.29876 nats/sec, 6.57443 nats/event
Full model Log loss : -0.57631
Full model ln_yyx : 84.17640 nats/sec, 6.56488 nats/event
Full model Log loss : -0.57972
Full model ln_yyx : 83.85236 nats/sec, 6.53961 nats/event
Full model Log loss : -0.56356
Full model ln_yyx : 83.76756 nats/sec, 6.53300 nats/event
Full model Log loss : -0.57707
Full model ln_yyx : 84.89647 nats/sec, 6.62104 nats/event
Full model Log loss : -0.58936
Full model ln_yyx : 82.01762 nats/sec, 6.39652 nats/event
Full model Log loss : -0.56043
Full model ln_yyx : 85.18413 nats/sec, 6.64348 nats/event
Full model Log loss : -0.58799
Full model ln_yyx : 84.93360 nats/sec, 6.62394 nats/event
Full model Log loss : -0.58654
Full model ln_yyx : 83.81055 nats/sec, 6.53635 nats/event
Full model Log loss : -0.57468
Full model ln_yyx : 84.11973 nats/sec, 6.56046 nats/event
Full model Log loss : -0.57141
Full model ln_yyx : 82.63643 nats/sec, 6.44478 nats/event
Full model Log loss : -0.58243
Optimization finished. Config saved to results/opt-full/opt_full_66_best_config.txt
[I 2026-03-18 18:26:16,785] Trial 39 finished with value: -1.2428611854087843 and parameters: {'n_layers_yyx': 1, 'hidden_size_yyx_l0': 6, 'context_size_yyx': 3, 'num_mix_components_yyx': 1, 'context_extractor_yyx': 'lstm', 'activation_func_yyx': 'ReLU', 'L2_weight_yyx': 1.8282998032824396e-05, 'L_entropy_weight_yyx': 3.6034512650832476e-09, 'L_sep_weight_yyx': 2.5730818331887396e-07, 'L_scale_weight_yyx': 4.979348818603825e-06, 'learning_rate_yyx': 0.008504963801367591}. Best is trial 7 with value: -1.272066817927052.
[I 2026-03-18 18:26:18,332] Trial 29 pruned. 
[I 2026-03-18 18:26:19,261] Trial 35 finished with value: -1.2690898451038297 and parameters: {'n_layers_yyx': 1, 'hidden_size_yyx_l0': 5, 'context_size_yyx': 4, 'num_mix_components_yyx': 5, 'context_extractor_yyx': 'lstm', 'activation_func_yyx': 'Tanh', 'L2_weight_yyx': 7.597050434121423e-08, 'L_entropy_weight_yyx': 3.142283351986749e-08, 'L_sep_weight_yyx': 7.32692744980789e-05, 'L_scale_weight_yyx': 1.4911213884399622e-07, 'learning_rate_yyx': 0.006868071788468149}. Best is trial 35 with value: -1.2690898451038297.
[I 2026-03-18 18:26:21,164] Trial 35 finished with value: -1.2641041697503899 and parameters: {'n_layers_yyx': 1, 'hidden_size_yyx_l0': 6, 'context_size_yyx': 3, 'num_mix_components_yyx': 2, 'context_extractor_yyx': 'lstm', 'activation_func_yyx': 'Tanh', 'L2_weight_yyx': 1.3190274521601693e-06, 'L_entropy_weight_yyx': 1.719609299756567e-07, 'L_sep_weight_yyx': 3.264994498499205e-08, 'L_scale_weight_yyx': 7.185457726388067e-09, 'learning_rate_yyx': 0.009964289116036995}. Best is trial 24 with value: -1.2727326976613946.
[I 2026-03-18 18:26:24,976] Trial 29 finished with value: -3.149666472441386 and parameters: {'n_layers_yyx': 1, 'hidden_size_yyx_l0': 2, 'context_size_yyx': 4, 'num_mix_components_yyx': 3, 'context_extractor_yyx': 'gru', 'activation_func_yyx': 'GELU', 'L2_weight_yyx': 1.0523584672746465e-06, 'L_entropy_weight_yyx': 2.7861186913078236e-05, 'L_sep_weight_yyx': 7.579327862963066e-05, 'L_scale_weight_yyx': 4.305580071864373e-06, 'learning_rate_yyx': 0.008199508079398319}. Best is trial 1 with value: -3.152505646630136.
[I 2026-03-18 18:26:27,798] Trial 29 pruned. 
[I 2026-03-18 18:26:31,059] Trial 40 pruned. 
[I 2026-03-18 18:26:36,700] Trial 43 finished with value: -1.269664672055946 and parameters: {'n_layers_yyx': 2, 'hidden_size_yyx_l0': 4, 'hidden_size_yyx_l1': 6, 'context_size_yyx': 4, 'num_mix_components_yyx': 5, 'context_extractor_yyx': 'lstm', 'activation_func_yyx': 'Tanh', 'L2_weight_yyx': 4.9750339615495716e-06, 'L_entropy_weight_yyx': 1.629757765183734e-05, 'L_sep_weight_yyx': 2.508643776617729e-08, 'L_scale_weight_yyx': 5.656962421810444e-07, 'learning_rate_yyx': 0.003007507284657992}. Best is trial 2 with value: -1.2804754530695341.
[I 2026-03-18 18:26:40,406] Trial 30 pruned. 
[I 2026-03-18 18:26:47,335] Trial 49 pruned. 

Source events: 54211
Target events: 12731
Full model ln_yyx : 3451.67130 nats/sec, 244.01101 nats/event
Full model Log loss : -3.13917
Full model ln_yyx : 3463.17320 nats/sec, 244.82412 nats/event
Full model Log loss : -3.15053
Full model ln_yyx : 3432.22703 nats/sec, 242.63643 nats/event
Full model Log loss : -3.13559
Full model ln_yyx : 3423.37002 nats/sec, 242.01029 nats/event
Full model Log loss : -3.13257
Full model ln_yyx : 3442.18716 nats/sec, 243.34054 nats/event
Full model Log loss : -3.13956
Full model ln_yyx : 3434.31265 nats/sec, 242.78387 nats/event
Full model Log loss : -3.13526
Full model ln_yyx : 3406.15235 nats/sec, 240.79311 nats/event
Full model Log loss : -3.10844
Full model ln_yyx : 3452.60137 nats/sec, 244.07676 nats/event
Full model Log loss : -3.14264
Full model ln_yyx : 3420.95310 nats/sec, 241.83943 nats/event
Full model Log loss : -3.11366
Full model ln_yyx : 3421.69221 nats/sec, 241.89168 nats/event
Full model Log loss : -3.11837
Optimization finished. Config saved to results/opt-full/opt_full_69_best_config.txt
[I 2026-03-18 18:26:48,521] Trial 44 pruned. 
[I 2026-03-18 18:26:53,232] Trial 30 pruned. 
[I 2026-03-18 18:26:54,675] Trial 31 pruned. 
[I 2026-03-18 18:26:57,338] Trial 41 finished with value: -3.153552668454499 and parameters: {'n_layers_yyx': 2, 'hidden_size_yyx_l0': 4, 'hidden_size_yyx_l1': 4, 'context_size_yyx': 4, 'num_mix_components_yyx': 5, 'context_extractor_yyx': 'lstm', 'activation_func_yyx': 'Tanh', 'L2_weight_yyx': 1.0949400369187618e-07, 'L_entropy_weight_yyx': 8.859857611639407e-06, 'L_sep_weight_yyx': 4.2067856322887066e-10, 'L_scale_weight_yyx': 2.4860532697605257e-07, 'learning_rate_yyx': 0.006167957947076708}. Best is trial 41 with value: -3.153552668454499.
[I 2026-03-18 18:27:00,599] Trial 32 pruned. 
[I 2026-03-18 18:27:00,963] Trial 43 finished with value: -1.263064710578284 and parameters: {'n_layers_yyx': 1, 'hidden_size_yyx_l0': 6, 'context_size_yyx': 3, 'num_mix_components_yyx': 4, 'context_extractor_yyx': 'lstm', 'activation_func_yyx': 'Tanh', 'L2_weight_yyx': 1.927883270262692e-07, 'L_entropy_weight_yyx': 7.028777001248927e-07, 'L_sep_weight_yyx': 9.068729621320866e-08, 'L_scale_weight_yyx': 4.74219468443605e-09, 'learning_rate_yyx': 0.008191658156516833}. Best is trial 0 with value: -1.2691870881537193.
[I 2026-03-18 18:27:01,704] Trial 30 pruned. 
[I 2026-03-18 18:27:03,338] Trial 42 finished with value: -3.1234554850644467 and parameters: {'n_layers_yyx': 2, 'hidden_size_yyx_l0': 4, 'hidden_size_yyx_l1': 4, 'context_size_yyx': 4, 'num_mix_components_yyx': 1, 'context_extractor_yyx': 'lstm', 'activation_func_yyx': 'ReLU', 'L2_weight_yyx': 1.0536976182114334e-10, 'L_entropy_weight_yyx': 1.2399743405029778e-05, 'L_sep_weight_yyx': 1.9522044332062255e-08, 'L_scale_weight_yyx': 3.5206839766080302e-06, 'learning_rate_yyx': 0.008675403211564691}. Best is trial 16 with value: -3.149974272486285.
[I 2026-03-18 18:27:07,633] Trial 44 pruned. 
[I 2026-03-18 18:27:09,059] Trial 39 pruned. 
[I 2026-03-18 18:27:09,153] Trial 33 pruned. 
[I 2026-03-18 18:27:10,592] Trial 39 finished with value: -3.1606482412414523 and parameters: {'n_layers_yyx': 2, 'hidden_size_yyx_l0': 5, 'hidden_size_yyx_l1': 5, 'context_size_yyx': 3, 'num_mix_components_yyx': 5, 'context_extractor_yyx': 'gru', 'activation_func_yyx': 'Tanh', 'L2_weight_yyx': 1.2432015645947574e-08, 'L_entropy_weight_yyx': 1.6320770372289448e-09, 'L_sep_weight_yyx': 7.836000274985068e-08, 'L_scale_weight_yyx': 6.466920997246083e-06, 'learning_rate_yyx': 0.005245146419193561}. Best is trial 10 with value: -3.1611070918248854.
[I 2026-03-18 18:27:13,722] Trial 45 pruned. 
[I 2026-03-18 18:27:14,969] Trial 36 finished with value: -1.2650958077083454 and parameters: {'n_layers_yyx': 2, 'hidden_size_yyx_l0': 6, 'hidden_size_yyx_l1': 5, 'context_size_yyx': 4, 'num_mix_components_yyx': 5, 'context_extractor_yyx': 'lstm', 'activation_func_yyx': 'Tanh', 'L2_weight_yyx': 8.289557265310867e-07, 'L_entropy_weight_yyx': 2.2428190617061694e-08, 'L_sep_weight_yyx': 9.510615368085711e-05, 'L_scale_weight_yyx': 2.0547618448512146e-06, 'learning_rate_yyx': 0.0050748577193843}. Best is trial 35 with value: -1.2690898451038297.
[I 2026-03-18 18:27:19,408] Trial 36 pruned. 
[I 2026-03-18 18:27:25,856] Trial 36 finished with value: -1.2688210605473262 and parameters: {'n_layers_yyx': 1, 'hidden_size_yyx_l0': 4, 'context_size_yyx': 4, 'num_mix_components_yyx': 3, 'context_extractor_yyx': 'gru', 'activation_func_yyx': 'Tanh', 'L2_weight_yyx': 0.00017401434223417828, 'L_entropy_weight_yyx': 5.1959826106386545e-06, 'L_sep_weight_yyx': 1.3715867848125264e-07, 'L_scale_weight_yyx': 1.2907138926419788e-09, 'learning_rate_yyx': 0.00833100526120365}. Best is trial 24 with value: -1.2727326976613946.
[I 2026-03-18 18:27:26,084] Trial 31 pruned. 
[I 2026-03-18 18:27:26,947] Trial 30 pruned. 
[I 2026-03-18 18:27:27,102] Trial 46 pruned. 
