Warning: Failed writing log files to directory [/var/log/nvidia-mps]. No logs will be available.
[I 2026-03-18 18:55:46,919] A new study created in RDB with name: opt_full-model_seed=42_task=248
[I 2026-03-18 18:55:46,920] A new study created in RDB with name: opt_full-model_seed=42_task=236
[I 2026-03-18 18:55:47,374] A new study created in RDB with name: opt_full-model_seed=42_task=246
[I 2026-03-18 18:55:47,471] A new study created in RDB with name: opt_full-model_seed=42_task=230
[I 2026-03-18 18:55:47,477] A new study created in RDB with name: opt_full-model_seed=42_task=235
[I 2026-03-18 18:55:47,499] A new study created in RDB with name: opt_full-model_seed=42_task=243
[I 2026-03-18 18:55:47,499] A new study created in RDB with name: opt_full-model_seed=42_task=229
[I 2026-03-18 18:55:47,499] A new study created in RDB with name: opt_full-model_seed=42_task=249
[I 2026-03-18 18:55:47,499] A new study created in RDB with name: opt_full-model_seed=42_task=253
[I 2026-03-18 18:55:47,593] A new study created in RDB with name: opt_full-model_seed=42_task=251
[I 2026-03-18 18:55:47,593] A new study created in RDB with name: opt_full-model_seed=42_task=241
[I 2026-03-18 18:55:47,593] A new study created in RDB with name: opt_full-model_seed=42_task=224
[I 2026-03-18 18:55:47,593] A new study created in RDB with name: opt_full-model_seed=42_task=242
[I 2026-03-18 18:55:47,626] A new study created in RDB with name: opt_full-model_seed=42_task=232
[I 2026-03-18 18:55:47,626] A new study created in RDB with name: opt_full-model_seed=42_task=227
[I 2026-03-18 18:55:47,626] A new study created in RDB with name: opt_full-model_seed=42_task=244
[I 2026-03-18 18:55:47,626] A new study created in RDB with name: opt_full-model_seed=42_task=234
[I 2026-03-18 18:55:47,626] A new study created in RDB with name: opt_full-model_seed=42_task=250
[I 2026-03-18 18:55:47,626] A new study created in RDB with name: opt_full-model_seed=42_task=228
[I 2026-03-18 18:55:47,626] A new study created in RDB with name: opt_full-model_seed=42_task=225
[I 2026-03-18 18:55:47,627] A new study created in RDB with name: opt_full-model_seed=42_task=239
[I 2026-03-18 18:55:47,627] A new study created in RDB with name: opt_full-model_seed=42_task=233
[I 2026-03-18 18:55:47,627] A new study created in RDB with name: opt_full-model_seed=42_task=226
[I 2026-03-18 18:55:47,670] A new study created in RDB with name: opt_full-model_seed=42_task=245
[I 2026-03-18 18:55:47,670] A new study created in RDB with name: opt_full-model_seed=42_task=254
[I 2026-03-18 18:55:47,670] A new study created in RDB with name: opt_full-model_seed=42_task=231
[I 2026-03-18 18:55:47,914] A new study created in RDB with name: opt_full-model_seed=42_task=247
[I 2026-03-18 18:55:48,056] A new study created in RDB with name: opt_full-model_seed=42_task=255
[I 2026-03-18 18:55:48,106] A new study created in RDB with name: opt_full-model_seed=42_task=240
[I 2026-03-18 18:55:48,106] A new study created in RDB with name: opt_full-model_seed=42_task=237
[I 2026-03-18 18:55:48,130] A new study created in RDB with name: opt_full-model_seed=42_task=252
[I 2026-03-18 18:55:48,384] A new study created in RDB with name: opt_full-model_seed=42_task=238
[I 2026-03-18 19:02:48,610] Trial 0 finished with value: -1.5190498727266906 and parameters: {'n_layers_yyx': 2, 'hidden_size_yyx_l0': 5, 'hidden_size_yyx_l1': 4, 'context_size_yyx': 1, 'num_mix_components_yyx': 4, 'context_extractor_yyx': 'lstm', 'activation_func_yyx': 'ReLU', 'L2_weight_yyx': 9.670854712820307e-06, 'L_entropy_weight_yyx': 1.4565948681680082e-09, 'L_sep_weight_yyx': 4.308075797568176e-08, 'L_scale_weight_yyx': 5.741741903043395e-05, 'learning_rate_yyx': 0.008634364150909275}. Best is trial 0 with value: -1.5190498727266906.
[I 2026-03-18 19:02:53,435] Trial 0 finished with value: -2.4462359448940223 and parameters: {'n_layers_yyx': 1, 'hidden_size_yyx_l0': 2, 'context_size_yyx': 4, 'num_mix_components_yyx': 2, 'context_extractor_yyx': 'gru', 'activation_func_yyx': 'GELU', 'L2_weight_yyx': 1.6491616061114362e-05, 'L_entropy_weight_yyx': 1.4986625980602704e-06, 'L_sep_weight_yyx': 9.646698171574939e-08, 'L_scale_weight_yyx': 1.0116277121725793e-08, 'learning_rate_yyx': 0.007560934850354918}. Best is trial 0 with value: -2.4462359448940223.
[I 2026-03-18 19:03:13,481] Trial 0 finished with value: -1.2963861553485576 and parameters: {'n_layers_yyx': 2, 'hidden_size_yyx_l0': 6, 'hidden_size_yyx_l1': 2, 'context_size_yyx': 4, 'num_mix_components_yyx': 3, 'context_extractor_yyx': 'gru', 'activation_func_yyx': 'GELU', 'L2_weight_yyx': 4.231013647139595e-07, 'L_entropy_weight_yyx': 3.8162320830501924e-10, 'L_sep_weight_yyx': 3.3683148837154242e-06, 'L_scale_weight_yyx': 2.4374714347760266e-07, 'learning_rate_yyx': 0.00391245106140051}. Best is trial 0 with value: -1.2963861553485576.
[I 2026-03-18 19:03:30,787] Trial 0 finished with value: -1.342767052283654 and parameters: {'n_layers_yyx': 2, 'hidden_size_yyx_l0': 4, 'hidden_size_yyx_l1': 4, 'context_size_yyx': 3, 'num_mix_components_yyx': 1, 'context_extractor_yyx': 'lstm', 'activation_func_yyx': 'ReLU', 'L2_weight_yyx': 1.2325100376278975e-10, 'L_entropy_weight_yyx': 3.879490906528302e-09, 'L_sep_weight_yyx': 2.13492788853728e-09, 'L_scale_weight_yyx': 4.146637340849196e-09, 'learning_rate_yyx': 0.003838200858419705}. Best is trial 0 with value: -1.342767052283654.
[I 2026-03-18 19:04:01,972] Trial 1 pruned. 
[I 2026-03-18 19:04:29,106] Trial 0 finished with value: -1.8302220561029863 and parameters: {'n_layers_yyx': 2, 'hidden_size_yyx_l0': 6, 'hidden_size_yyx_l1': 4, 'context_size_yyx': 3, 'num_mix_components_yyx': 2, 'context_extractor_yyx': 'gru', 'activation_func_yyx': 'ReLU', 'L2_weight_yyx': 4.965051107041089e-07, 'L_entropy_weight_yyx': 1.8491402741734298e-10, 'L_sep_weight_yyx': 1.4692306105976517e-07, 'L_scale_weight_yyx': 1.3192086639056398e-07, 'learning_rate_yyx': 0.0020958275005572586}. Best is trial 0 with value: -1.8302220561029863.
[I 2026-03-18 19:04:29,128] Trial 0 finished with value: -1.3124835439828726 and parameters: {'n_layers_yyx': 1, 'hidden_size_yyx_l0': 4, 'context_size_yyx': 2, 'num_mix_components_yyx': 5, 'context_extractor_yyx': 'lstm', 'activation_func_yyx': 'Tanh', 'L2_weight_yyx': 4.817678433654221e-10, 'L_entropy_weight_yyx': 0.00011773347415344957, 'L_sep_weight_yyx': 8.400025343805838e-08, 'L_scale_weight_yyx': 5.024447369486496e-08, 'learning_rate_yyx': 0.0014621512535924824}. Best is trial 0 with value: -1.3124835439828726.
[I 2026-03-18 19:04:49,025] Trial 0 finished with value: -1.4467010977883008 and parameters: {'n_layers_yyx': 1, 'hidden_size_yyx_l0': 4, 'context_size_yyx': 3, 'num_mix_components_yyx': 3, 'context_extractor_yyx': 'gru', 'activation_func_yyx': 'Tanh', 'L2_weight_yyx': 2.8315062022311033e-05, 'L_entropy_weight_yyx': 2.648782853447937e-09, 'L_sep_weight_yyx': 6.716009637765265e-09, 'L_scale_weight_yyx': 3.0039576347754597e-09, 'learning_rate_yyx': 0.008333128603137148}. Best is trial 0 with value: -1.4467010977883008.
[I 2026-03-18 19:04:53,469] Trial 0 finished with value: -2.4573569585183157 and parameters: {'n_layers_yyx': 2, 'hidden_size_yyx_l0': 3, 'hidden_size_yyx_l1': 3, 'context_size_yyx': 3, 'num_mix_components_yyx': 4, 'context_extractor_yyx': 'gru', 'activation_func_yyx': 'Tanh', 'L2_weight_yyx': 0.0005870218907568577, 'L_entropy_weight_yyx': 5.2378351502601174e-05, 'L_sep_weight_yyx': 0.00061551584259553, 'L_scale_weight_yyx': 1.606150037169049e-06, 'learning_rate_yyx': 0.0024031817449448856}. Best is trial 0 with value: -2.4573569585183157.
[I 2026-03-18 19:05:27,004] Trial 0 finished with value: -1.7772347005208333 and parameters: {'n_layers_yyx': 1, 'hidden_size_yyx_l0': 5, 'context_size_yyx': 3, 'num_mix_components_yyx': 5, 'context_extractor_yyx': 'lstm', 'activation_func_yyx': 'ReLU', 'L2_weight_yyx': 7.657130363413767e-06, 'L_entropy_weight_yyx': 5.894764575667188e-05, 'L_sep_weight_yyx': 3.170290411899112e-09, 'L_scale_weight_yyx': 1.4526055226422373e-07, 'learning_rate_yyx': 0.001814886887144746}. Best is trial 0 with value: -1.7772347005208333.
[I 2026-03-18 19:05:28,849] Trial 1 pruned. 
[I 2026-03-18 19:05:55,361] Trial 0 finished with value: -1.2774384953425482 and parameters: {'n_layers_yyx': 1, 'hidden_size_yyx_l0': 6, 'context_size_yyx': 1, 'num_mix_components_yyx': 1, 'context_extractor_yyx': 'lstm', 'activation_func_yyx': 'Tanh', 'L2_weight_yyx': 4.398875408606918e-08, 'L_entropy_weight_yyx': 2.4666717716794755e-10, 'L_sep_weight_yyx': 1.540039908329344e-10, 'L_scale_weight_yyx': 1.8341373711294063e-10, 'learning_rate_yyx': 0.0007162482858605423}. Best is trial 0 with value: -1.2774384953425482.
[I 2026-03-18 19:06:19,504] Trial 0 finished with value: -1.9368961358079142 and parameters: {'n_layers_yyx': 2, 'hidden_size_yyx_l0': 2, 'hidden_size_yyx_l1': 4, 'context_size_yyx': 4, 'num_mix_components_yyx': 3, 'context_extractor_yyx': 'gru', 'activation_func_yyx': 'GELU', 'L2_weight_yyx': 0.00017963824986306937, 'L_entropy_weight_yyx': 1.7163719950880946e-07, 'L_sep_weight_yyx': 0.00012220585751845315, 'L_scale_weight_yyx': 1.4473075040851861e-06, 'learning_rate_yyx': 0.006541400383270626}. Best is trial 0 with value: -1.9368961358079142.
[I 2026-03-18 19:06:36,819] Trial 1 pruned. 
[I 2026-03-18 19:06:37,697] Trial 0 finished with value: -2.4805296636382916 and parameters: {'n_layers_yyx': 2, 'hidden_size_yyx_l0': 3, 'hidden_size_yyx_l1': 4, 'context_size_yyx': 4, 'num_mix_components_yyx': 4, 'context_extractor_yyx': 'lstm', 'activation_func_yyx': 'Tanh', 'L2_weight_yyx': 9.096335531563799e-10, 'L_entropy_weight_yyx': 2.8974853376057824e-07, 'L_sep_weight_yyx': 1.1986637738232466e-06, 'L_scale_weight_yyx': 0.000789450713683424, 'learning_rate_yyx': 0.001033399008688196}. Best is trial 0 with value: -2.4805296636382916.
[I 2026-03-18 19:06:45,882] Trial 2 pruned. 
[I 2026-03-18 19:07:02,190] Trial 0 finished with value: -1.837857802213271 and parameters: {'n_layers_yyx': 2, 'hidden_size_yyx_l0': 3, 'hidden_size_yyx_l1': 3, 'context_size_yyx': 3, 'num_mix_components_yyx': 3, 'context_extractor_yyx': 'gru', 'activation_func_yyx': 'GELU', 'L2_weight_yyx': 0.0003832809648945042, 'L_entropy_weight_yyx': 0.0003734225241406536, 'L_sep_weight_yyx': 9.175776386136518e-09, 'L_scale_weight_yyx': 2.8331920790067073e-08, 'learning_rate_yyx': 0.002970660021389536}. Best is trial 0 with value: -1.837857802213271.
[I 2026-03-18 19:08:25,479] Trial 0 finished with value: -1.867639598732223 and parameters: {'n_layers_yyx': 2, 'hidden_size_yyx_l0': 3, 'hidden_size_yyx_l1': 5, 'context_size_yyx': 1, 'num_mix_components_yyx': 3, 'context_extractor_yyx': 'lstm', 'activation_func_yyx': 'ReLU', 'L2_weight_yyx': 1.7154918562626338e-06, 'L_entropy_weight_yyx': 9.413560858417681e-06, 'L_sep_weight_yyx': 1.1250627249469872e-08, 'L_scale_weight_yyx': 6.0456475316855e-10, 'learning_rate_yyx': 0.0022180033810788257}. Best is trial 0 with value: -1.867639598732223.
[I 2026-03-18 19:08:42,946] Trial 1 pruned. 
[I 2026-03-18 19:09:03,497] Trial 0 finished with value: -1.8028399759194687 and parameters: {'n_layers_yyx': 1, 'hidden_size_yyx_l0': 4, 'context_size_yyx': 2, 'num_mix_components_yyx': 4, 'context_extractor_yyx': 'gru', 'activation_func_yyx': 'GELU', 'L2_weight_yyx': 1.6222551364850513e-09, 'L_entropy_weight_yyx': 1.0934521895801226e-08, 'L_sep_weight_yyx': 0.0009758141214827622, 'L_scale_weight_yyx': 1.2425793420566106e-08, 'learning_rate_yyx': 0.007746228240740283}. Best is trial 0 with value: -1.8028399759194687.
[I 2026-03-18 19:09:11,731] Trial 0 finished with value: -1.3248331862229568 and parameters: {'n_layers_yyx': 2, 'hidden_size_yyx_l0': 3, 'hidden_size_yyx_l1': 4, 'context_size_yyx': 3, 'num_mix_components_yyx': 4, 'context_extractor_yyx': 'lstm', 'activation_func_yyx': 'Tanh', 'L2_weight_yyx': 6.658554202122937e-07, 'L_entropy_weight_yyx': 2.0356460713027305e-05, 'L_sep_weight_yyx': 6.093863453130139e-07, 'L_scale_weight_yyx': 2.811768885416642e-10, 'learning_rate_yyx': 0.0007279100749362908}. Best is trial 0 with value: -1.3248331862229568.
[I 2026-03-18 19:09:16,132] Trial 0 finished with value: -1.8516305051550026 and parameters: {'n_layers_yyx': 2, 'hidden_size_yyx_l0': 3, 'hidden_size_yyx_l1': 2, 'context_size_yyx': 1, 'num_mix_components_yyx': 3, 'context_extractor_yyx': 'gru', 'activation_func_yyx': 'GELU', 'L2_weight_yyx': 9.856327416404536e-06, 'L_entropy_weight_yyx': 0.0003408787942352223, 'L_sep_weight_yyx': 1.4165396800827347e-10, 'L_scale_weight_yyx': 1.0744414650307604e-10, 'learning_rate_yyx': 0.008800490088620501}. Best is trial 0 with value: -1.8516305051550026.
[I 2026-03-18 19:09:18,181] Trial 0 finished with value: -1.287627939077524 and parameters: {'n_layers_yyx': 1, 'hidden_size_yyx_l0': 5, 'context_size_yyx': 1, 'num_mix_components_yyx': 5, 'context_extractor_yyx': 'gru', 'activation_func_yyx': 'ReLU', 'L2_weight_yyx': 1.5504675034114594e-08, 'L_entropy_weight_yyx': 0.00016152779898518852, 'L_sep_weight_yyx': 2.7512665735931938e-05, 'L_scale_weight_yyx': 2.3482835720095693e-05, 'learning_rate_yyx': 0.000835528586941578}. Best is trial 0 with value: -1.287627939077524.
[I 2026-03-18 19:09:28,669] Trial 0 finished with value: -1.9257698509991874 and parameters: {'n_layers_yyx': 1, 'hidden_size_yyx_l0': 2, 'context_size_yyx': 3, 'num_mix_components_yyx': 5, 'context_extractor_yyx': 'gru', 'activation_func_yyx': 'ReLU', 'L2_weight_yyx': 1.4604760971741429e-09, 'L_entropy_weight_yyx': 1.1537469893275285e-06, 'L_sep_weight_yyx': 0.00010417355945301, 'L_scale_weight_yyx': 1.2732165100214962e-09, 'learning_rate_yyx': 0.001791874940808149}. Best is trial 0 with value: -1.9257698509991874.
[I 2026-03-18 19:09:41,226] Trial 0 finished with value: -1.3208845872145432 and parameters: {'n_layers_yyx': 1, 'hidden_size_yyx_l0': 2, 'context_size_yyx': 3, 'num_mix_components_yyx': 4, 'context_extractor_yyx': 'gru', 'activation_func_yyx': 'ReLU', 'L2_weight_yyx': 8.011580869580484e-09, 'L_entropy_weight_yyx': 0.0003248422163458213, 'L_sep_weight_yyx': 2.457694764489347e-10, 'L_scale_weight_yyx': 5.54744734611268e-10, 'learning_rate_yyx': 0.0007110034732270047}. Best is trial 0 with value: -1.3208845872145432.
[I 2026-03-18 19:09:47,256] Trial 0 finished with value: -1.8953976247502469 and parameters: {'n_layers_yyx': 1, 'hidden_size_yyx_l0': 6, 'context_size_yyx': 3, 'num_mix_components_yyx': 5, 'context_extractor_yyx': 'lstm', 'activation_func_yyx': 'Tanh', 'L2_weight_yyx': 1.962979286049481e-06, 'L_entropy_weight_yyx': 4.517130347878077e-07, 'L_sep_weight_yyx': 1.2491413551034681e-09, 'L_scale_weight_yyx': 5.261135488651243e-09, 'learning_rate_yyx': 0.0011095728807636914}. Best is trial 0 with value: -1.8953976247502469.
[I 2026-03-18 19:09:49,469] Trial 0 finished with value: -1.319746586726262 and parameters: {'n_layers_yyx': 2, 'hidden_size_yyx_l0': 2, 'hidden_size_yyx_l1': 4, 'context_size_yyx': 1, 'num_mix_components_yyx': 4, 'context_extractor_yyx': 'gru', 'activation_func_yyx': 'ReLU', 'L2_weight_yyx': 8.169974928966567e-07, 'L_entropy_weight_yyx': 1.9751709082463245e-06, 'L_sep_weight_yyx': 3.8345851598236724e-09, 'L_scale_weight_yyx': 1.5486233193838095e-09, 'learning_rate_yyx': 0.0015499449165070763}. Best is trial 0 with value: -1.319746586726262.
[I 2026-03-18 19:10:25,592] Trial 1 finished with value: -1.3410127610426683 and parameters: {'n_layers_yyx': 2, 'hidden_size_yyx_l0': 5, 'hidden_size_yyx_l1': 5, 'context_size_yyx': 1, 'num_mix_components_yyx': 5, 'context_extractor_yyx': 'gru', 'activation_func_yyx': 'GELU', 'L2_weight_yyx': 6.571962711977541e-08, 'L_entropy_weight_yyx': 1.1591329509840951e-10, 'L_sep_weight_yyx': 4.38368757390637e-08, 'L_scale_weight_yyx': 0.00030817906568548787, 'learning_rate_yyx': 0.005078259118918099}. Best is trial 0 with value: -1.342767052283654.
[I 2026-03-18 19:10:50,834] Trial 0 finished with value: -1.8722783355929944 and parameters: {'n_layers_yyx': 1, 'hidden_size_yyx_l0': 5, 'context_size_yyx': 1, 'num_mix_components_yyx': 1, 'context_extractor_yyx': 'gru', 'activation_func_yyx': 'ReLU', 'L2_weight_yyx': 4.383350858937218e-09, 'L_entropy_weight_yyx': 0.00015005664627600822, 'L_sep_weight_yyx': 1.4891025982191976e-05, 'L_scale_weight_yyx': 1.5614052192727806e-06, 'learning_rate_yyx': 0.003056739670974359}. Best is trial 0 with value: -1.8722783355929944.
[I 2026-03-18 19:11:01,814] Trial 1 finished with value: -1.3107592069185696 and parameters: {'n_layers_yyx': 1, 'hidden_size_yyx_l0': 4, 'context_size_yyx': 2, 'num_mix_components_yyx': 5, 'context_extractor_yyx': 'lstm', 'activation_func_yyx': 'Tanh', 'L2_weight_yyx': 1.756149725198663e-07, 'L_entropy_weight_yyx': 1.891736851656502e-09, 'L_sep_weight_yyx': 1.6168652040781386e-08, 'L_scale_weight_yyx': 3.5507090103552346e-06, 'learning_rate_yyx': 0.003913106917458398}. Best is trial 0 with value: -1.3124835439828726.
[I 2026-03-18 19:11:05,017] Trial 1 pruned. 
[I 2026-03-18 19:11:20,400] Trial 1 pruned. 
[I 2026-03-18 19:12:20,856] Trial 2 pruned. 
[I 2026-03-18 19:12:42,832] Trial 0 finished with value: -1.8528113520484126 and parameters: {'n_layers_yyx': 2, 'hidden_size_yyx_l0': 2, 'hidden_size_yyx_l1': 2, 'context_size_yyx': 1, 'num_mix_components_yyx': 3, 'context_extractor_yyx': 'lstm', 'activation_func_yyx': 'Tanh', 'L2_weight_yyx': 0.00010757068814855378, 'L_entropy_weight_yyx': 1.996290010533053e-07, 'L_sep_weight_yyx': 4.233799256208882e-10, 'L_scale_weight_yyx': 4.7624810165955786e-07, 'learning_rate_yyx': 0.005707005633928365}. Best is trial 0 with value: -1.8528113520484126.
[I 2026-03-18 19:12:43,115] Trial 0 finished with value: -1.3586356295072115 and parameters: {'n_layers_yyx': 1, 'hidden_size_yyx_l0': 5, 'context_size_yyx': 4, 'num_mix_components_yyx': 1, 'context_extractor_yyx': 'lstm', 'activation_func_yyx': 'ReLU', 'L2_weight_yyx': 9.205848227272633e-05, 'L_entropy_weight_yyx': 1.008658908556208e-06, 'L_sep_weight_yyx': 8.010976567127675e-05, 'L_scale_weight_yyx': 5.1238710281413754e-06, 'learning_rate_yyx': 0.0017219951318102862}. Best is trial 0 with value: -1.3586356295072115.
[I 2026-03-18 19:12:53,584] Trial 2 pruned. 
[I 2026-03-18 19:12:57,628] Trial 0 finished with value: -1.7873705314867425 and parameters: {'n_layers_yyx': 2, 'hidden_size_yyx_l0': 6, 'hidden_size_yyx_l1': 3, 'context_size_yyx': 4, 'num_mix_components_yyx': 2, 'context_extractor_yyx': 'gru', 'activation_func_yyx': 'Tanh', 'L2_weight_yyx': 4.59094672281936e-06, 'L_entropy_weight_yyx': 6.084185685822783e-10, 'L_sep_weight_yyx': 2.3051860252069848e-07, 'L_scale_weight_yyx': 1.2281670060656174e-05, 'learning_rate_yyx': 0.004008596107796461}. Best is trial 0 with value: -1.7873705314867425.
[I 2026-03-18 19:12:59,754] Trial 0 finished with value: -1.5474254567427992 and parameters: {'n_layers_yyx': 1, 'hidden_size_yyx_l0': 5, 'context_size_yyx': 1, 'num_mix_components_yyx': 5, 'context_extractor_yyx': 'gru', 'activation_func_yyx': 'Tanh', 'L2_weight_yyx': 3.9154712522678484e-05, 'L_entropy_weight_yyx': 7.123786075086213e-10, 'L_sep_weight_yyx': 9.755588399368343e-09, 'L_scale_weight_yyx': 0.00023435949949786447, 'learning_rate_yyx': 0.0008627286637521054}. Best is trial 0 with value: -1.5474254567427992.
[I 2026-03-18 19:13:01,862] Trial 2 finished with value: -1.51813847276031 and parameters: {'n_layers_yyx': 1, 'hidden_size_yyx_l0': 5, 'context_size_yyx': 3, 'num_mix_components_yyx': 4, 'context_extractor_yyx': 'lstm', 'activation_func_yyx': 'Tanh', 'L2_weight_yyx': 1.240211874518553e-09, 'L_entropy_weight_yyx': 1.5579022661341416e-09, 'L_sep_weight_yyx': 0.00011007667538214837, 'L_scale_weight_yyx': 1.0301020396374314e-09, 'learning_rate_yyx': 0.006529072737898014}. Best is trial 0 with value: -1.5190498727266906.
[I 2026-03-18 19:13:45,469] Trial 1 pruned. 
[I 2026-03-18 19:14:18,624] Trial 1 finished with value: -2.4465525346781787 and parameters: {'n_layers_yyx': 2, 'hidden_size_yyx_l0': 3, 'hidden_size_yyx_l1': 3, 'context_size_yyx': 2, 'num_mix_components_yyx': 5, 'context_extractor_yyx': 'lstm', 'activation_func_yyx': 'ReLU', 'L2_weight_yyx': 5.3556821271557585e-09, 'L_entropy_weight_yyx': 2.1871877401886378e-07, 'L_sep_weight_yyx': 2.931440506131025e-05, 'L_scale_weight_yyx': 4.173223150644177e-09, 'learning_rate_yyx': 0.004069934461781118}. Best is trial 0 with value: -2.4573569585183157.
[I 2026-03-18 19:14:38,436] Trial 1 finished with value: -1.8341207206868828 and parameters: {'n_layers_yyx': 1, 'hidden_size_yyx_l0': 3, 'context_size_yyx': 3, 'num_mix_components_yyx': 1, 'context_extractor_yyx': 'gru', 'activation_func_yyx': 'GELU', 'L2_weight_yyx': 1.9790424613289823e-09, 'L_entropy_weight_yyx': 0.0004222200312819846, 'L_sep_weight_yyx': 0.000339310529292959, 'L_scale_weight_yyx': 2.508674811763295e-05, 'learning_rate_yyx': 0.0055477332054960195}. Best is trial 0 with value: -1.837857802213271.
[I 2026-03-18 19:14:38,465] Trial 0 finished with value: -1.8538678566449562 and parameters: {'n_layers_yyx': 1, 'hidden_size_yyx_l0': 4, 'context_size_yyx': 1, 'num_mix_components_yyx': 4, 'context_extractor_yyx': 'gru', 'activation_func_yyx': 'ReLU', 'L2_weight_yyx': 0.00021416414638843626, 'L_entropy_weight_yyx': 2.0134682702208868e-07, 'L_sep_weight_yyx': 0.0001284277748577226, 'L_scale_weight_yyx': 7.246209321678726e-07, 'learning_rate_yyx': 0.0024621022111314074}. Best is trial 0 with value: -1.8538678566449562.
[I 2026-03-18 19:14:44,042] Trial 2 pruned. 
[I 2026-03-18 19:14:50,678] Trial 2 pruned. 
[I 2026-03-18 19:15:28,840] Trial 1 finished with value: -1.4389243727463943 and parameters: {'n_layers_yyx': 1, 'hidden_size_yyx_l0': 4, 'context_size_yyx': 4, 'num_mix_components_yyx': 5, 'context_extractor_yyx': 'lstm', 'activation_func_yyx': 'GELU', 'L2_weight_yyx': 1.7206528653970303e-07, 'L_entropy_weight_yyx': 1.632940832215009e-07, 'L_sep_weight_yyx': 3.479205065405224e-05, 'L_scale_weight_yyx': 6.020480859585122e-08, 'learning_rate_yyx': 0.003163662476264144}. Best is trial 1 with value: -1.4389243727463943.
