[I 2026-03-18 18:07:51,907] Trial 15 finished with value: -3.137539878067381 and parameters: {'n_layers_yyx': 2, 'hidden_size_yyx_l0': 3, 'hidden_size_yyx_l1': 4, 'context_size_yyx': 1, 'num_mix_components_yyx': 4, 'context_extractor_yyx': 'gru', 'activation_func_yyx': 'Tanh', 'L2_weight_yyx': 4.032959867449289e-05, 'L_entropy_weight_yyx': 4.538910996796645e-09, 'L_sep_weight_yyx': 1.5102190603080264e-10, 'L_scale_weight_yyx': 0.000955719179137867, 'learning_rate_yyx': 0.006356733565234283}. Best is trial 10 with value: -3.148061618303045.
[I 2026-03-18 18:08:00,388] Trial 13 pruned. 
[I 2026-03-18 18:08:01,947] Trial 14 finished with value: -3.122160264510827 and parameters: {'n_layers_yyx': 2, 'hidden_size_yyx_l0': 2, 'hidden_size_yyx_l1': 6, 'context_size_yyx': 3, 'num_mix_components_yyx': 2, 'context_extractor_yyx': 'gru', 'activation_func_yyx': 'ReLU', 'L2_weight_yyx': 5.04446369414901e-08, 'L_entropy_weight_yyx': 1.0034327921271245e-10, 'L_sep_weight_yyx': 2.982144024359244e-08, 'L_scale_weight_yyx': 0.0009520782865138589, 'learning_rate_yyx': 0.009529128699403424}. Best is trial 5 with value: -3.154335707688014.
[I 2026-03-18 18:08:06,142] Trial 27 pruned. 
[I 2026-03-18 18:08:08,725] Trial 18 pruned. 
[I 2026-03-18 18:08:09,693] Trial 24 finished with value: -1.266823407241906 and parameters: {'n_layers_yyx': 2, 'hidden_size_yyx_l0': 3, 'hidden_size_yyx_l1': 4, 'context_size_yyx': 3, 'num_mix_components_yyx': 4, 'context_extractor_yyx': 'lstm', 'activation_func_yyx': 'Tanh', 'L2_weight_yyx': 0.00020485364826280827, 'L_entropy_weight_yyx': 6.24605104884273e-10, 'L_sep_weight_yyx': 1.1200468115040606e-06, 'L_scale_weight_yyx': 7.189537175946902e-10, 'learning_rate_yyx': 0.006486564088716662}. Best is trial 18 with value: -1.2691942310156972.
[I 2026-03-18 18:08:10,432] Trial 20 pruned. 
[I 2026-03-18 18:08:11,603] Trial 15 pruned. 
[I 2026-03-18 18:08:14,920] Trial 28 pruned. 
[I 2026-03-18 18:08:15,082] Trial 24 pruned. 
[I 2026-03-18 18:08:19,587] Trial 13 finished with value: -1.251378043522015 and parameters: {'n_layers_yyx': 1, 'hidden_size_yyx_l0': 3, 'context_size_yyx': 2, 'num_mix_components_yyx': 5, 'context_extractor_yyx': 'lstm', 'activation_func_yyx': 'ReLU', 'L2_weight_yyx': 5.18566869753645e-08, 'L_entropy_weight_yyx': 1.0287935272375459e-10, 'L_sep_weight_yyx': 3.226141832506631e-06, 'L_scale_weight_yyx': 1.8986174299742843e-08, 'learning_rate_yyx': 0.009452018303435266}. Best is trial 12 with value: -1.263812200860043.
[I 2026-03-18 18:08:20,317] Trial 21 pruned. 
[I 2026-03-18 18:08:22,906] Trial 22 pruned. 
[I 2026-03-18 18:08:29,297] Trial 28 pruned. 
[I 2026-03-18 18:08:31,930] Trial 25 pruned. 
[I 2026-03-18 18:08:31,941] Trial 16 pruned. 
[I 2026-03-18 18:08:32,682] Trial 28 finished with value: -0.5550964019649458 and parameters: {'n_layers_yyx': 2, 'hidden_size_yyx_l0': 5, 'hidden_size_yyx_l1': 3, 'context_size_yyx': 4, 'num_mix_components_yyx': 2, 'context_extractor_yyx': 'gru', 'activation_func_yyx': 'Tanh', 'L2_weight_yyx': 1.8424801296229063e-06, 'L_entropy_weight_yyx': 6.901711215253687e-09, 'L_sep_weight_yyx': 1.3210389761606518e-05, 'L_scale_weight_yyx': 1.7640646541197935e-07, 'learning_rate_yyx': 0.005851308578882613}. Best is trial 12 with value: -0.5830094706077523.
[I 2026-03-18 18:08:32,929] Trial 16 pruned. 
[I 2026-03-18 18:08:33,013] Trial 18 pruned. 
[I 2026-03-18 18:08:34,405] Trial 16 pruned. 
[I 2026-03-18 18:08:34,476] Trial 15 pruned. 
[I 2026-03-18 18:08:35,821] Trial 29 pruned. 
[I 2026-03-18 18:08:39,047] Trial 31 finished with value: -1.26520493202421 and parameters: {'n_layers_yyx': 2, 'hidden_size_yyx_l0': 5, 'hidden_size_yyx_l1': 5, 'context_size_yyx': 2, 'num_mix_components_yyx': 2, 'context_extractor_yyx': 'lstm', 'activation_func_yyx': 'Tanh', 'L2_weight_yyx': 0.0002770979243555567, 'L_entropy_weight_yyx': 6.479865903297275e-05, 'L_sep_weight_yyx': 3.0406600612433145e-10, 'L_scale_weight_yyx': 3.4883701872435e-08, 'learning_rate_yyx': 0.009930190732559015}. Best is trial 26 with value: -1.2726356097378264.
[I 2026-03-18 18:08:41,655] Trial 22 pruned. 
[I 2026-03-18 18:08:43,771] Trial 16 finished with value: -0.5770663926493187 and parameters: {'n_layers_yyx': 2, 'hidden_size_yyx_l0': 4, 'hidden_size_yyx_l1': 4, 'context_size_yyx': 1, 'num_mix_components_yyx': 5, 'context_extractor_yyx': 'gru', 'activation_func_yyx': 'Tanh', 'L2_weight_yyx': 7.309701590880366e-07, 'L_entropy_weight_yyx': 5.810626985967921e-07, 'L_sep_weight_yyx': 8.944607874310104e-09, 'L_scale_weight_yyx': 2.0570363619245747e-09, 'learning_rate_yyx': 0.0020178551807213388}. Best is trial 4 with value: -0.5804501078315746.
[I 2026-03-18 18:08:45,749] Trial 14 pruned. 
[I 2026-03-18 18:08:45,959] Trial 18 finished with value: -1.254435682032333 and parameters: {'n_layers_yyx': 2, 'hidden_size_yyx_l0': 5, 'hidden_size_yyx_l1': 5, 'context_size_yyx': 2, 'num_mix_components_yyx': 5, 'context_extractor_yyx': 'gru', 'activation_func_yyx': 'ReLU', 'L2_weight_yyx': 9.926821514288052e-05, 'L_entropy_weight_yyx': 1.0584145726220649e-09, 'L_sep_weight_yyx': 3.279634711551554e-05, 'L_scale_weight_yyx': 7.975607204888328e-08, 'learning_rate_yyx': 0.007490844366696576}. Best is trial 11 with value: -1.2697828860467992.
[I 2026-03-18 18:08:45,966] Trial 15 pruned. 
[I 2026-03-18 18:08:52,861] Trial 17 pruned. 
[I 2026-03-18 18:08:53,381] Trial 17 pruned. 
[I 2026-03-18 18:08:53,616] Trial 26 pruned. 
[I 2026-03-18 18:08:54,208] Trial 26 finished with value: -3.1453319976452754 and parameters: {'n_layers_yyx': 2, 'hidden_size_yyx_l0': 5, 'hidden_size_yyx_l1': 5, 'context_size_yyx': 3, 'num_mix_components_yyx': 5, 'context_extractor_yyx': 'gru', 'activation_func_yyx': 'GELU', 'L2_weight_yyx': 1.1177842635654485e-09, 'L_entropy_weight_yyx': 3.706394564015039e-06, 'L_sep_weight_yyx': 5.022358066545519e-10, 'L_scale_weight_yyx': 1.0438075344718185e-09, 'learning_rate_yyx': 0.0059288107643420684}. Best is trial 20 with value: -3.1481007392302844.
[I 2026-03-18 18:08:55,940] Trial 16 pruned. 
[I 2026-03-18 18:08:56,260] Trial 17 finished with value: -3.150301991988671 and parameters: {'n_layers_yyx': 2, 'hidden_size_yyx_l0': 3, 'hidden_size_yyx_l1': 5, 'context_size_yyx': 4, 'num_mix_components_yyx': 3, 'context_extractor_yyx': 'gru', 'activation_func_yyx': 'ReLU', 'L2_weight_yyx': 1.2919134231630614e-07, 'L_entropy_weight_yyx': 8.011462749179834e-07, 'L_sep_weight_yyx': 8.075005180693735e-09, 'L_scale_weight_yyx': 9.735268768970036e-10, 'learning_rate_yyx': 0.0067164010267810464}. Best is trial 2 with value: -3.151229652723366.
[I 2026-03-18 18:08:56,731] Trial 30 pruned. 
[I 2026-03-18 18:08:57,279] Trial 15 finished with value: -3.1205943766898674 and parameters: {'n_layers_yyx': 1, 'hidden_size_yyx_l0': 5, 'context_size_yyx': 3, 'num_mix_components_yyx': 3, 'context_extractor_yyx': 'gru', 'activation_func_yyx': 'Tanh', 'L2_weight_yyx': 3.8658553276234155e-05, 'L_entropy_weight_yyx': 3.51663239022856e-06, 'L_sep_weight_yyx': 6.863675065179808e-05, 'L_scale_weight_yyx': 6.3842507736813695e-06, 'learning_rate_yyx': 0.003488753686951316}. Best is trial 2 with value: -3.1501405578480686.
[I 2026-03-18 18:09:01,643] Trial 22 finished with value: -1.2717005505799805 and parameters: {'n_layers_yyx': 2, 'hidden_size_yyx_l0': 2, 'hidden_size_yyx_l1': 6, 'context_size_yyx': 4, 'num_mix_components_yyx': 4, 'context_extractor_yyx': 'lstm', 'activation_func_yyx': 'GELU', 'L2_weight_yyx': 5.952984590757776e-10, 'L_entropy_weight_yyx': 6.878800290052059e-09, 'L_sep_weight_yyx': 3.2911455717054815e-09, 'L_scale_weight_yyx': 0.00014296847691095248, 'learning_rate_yyx': 0.007682854702828721}. Best is trial 22 with value: -1.2717005505799805.
[I 2026-03-18 18:09:01,661] Trial 25 pruned. 
[I 2026-03-18 18:09:02,610] Trial 27 pruned. 
[I 2026-03-18 18:09:05,606] Trial 19 pruned. 
[I 2026-03-18 18:09:06,905] Trial 21 finished with value: -1.263666741729003 and parameters: {'n_layers_yyx': 2, 'hidden_size_yyx_l0': 2, 'hidden_size_yyx_l1': 6, 'context_size_yyx': 4, 'num_mix_components_yyx': 3, 'context_extractor_yyx': 'lstm', 'activation_func_yyx': 'Tanh', 'L2_weight_yyx': 6.437367424782321e-05, 'L_entropy_weight_yyx': 4.466944149089221e-08, 'L_sep_weight_yyx': 1.1048390464977499e-10, 'L_scale_weight_yyx': 3.8953039744876506e-08, 'learning_rate_yyx': 0.006461296660624423}. Best is trial 7 with value: -1.272066817927052.
[I 2026-03-18 18:09:07,093] Trial 31 pruned. 
[I 2026-03-18 18:09:07,937] Trial 21 finished with value: -1.2672024513568985 and parameters: {'n_layers_yyx': 1, 'hidden_size_yyx_l0': 4, 'context_size_yyx': 4, 'num_mix_components_yyx': 5, 'context_extractor_yyx': 'gru', 'activation_func_yyx': 'ReLU', 'L2_weight_yyx': 4.963701416163839e-05, 'L_entropy_weight_yyx': 8.206156862642745e-07, 'L_sep_weight_yyx': 2.480920033616706e-08, 'L_scale_weight_yyx': 1.5260066549307844e-10, 'learning_rate_yyx': 0.004766225726590929}. Best is trial 21 with value: -1.2672024513568985.
[I 2026-03-18 18:09:09,757] Trial 28 pruned. 
[I 2026-03-18 18:09:10,032] Trial 18 pruned. 
[I 2026-03-18 18:09:12,429] Trial 20 pruned. 
[I 2026-03-18 18:09:13,062] Trial 21 finished with value: -3.1199775288343026 and parameters: {'n_layers_yyx': 2, 'hidden_size_yyx_l0': 6, 'hidden_size_yyx_l1': 5, 'context_size_yyx': 3, 'num_mix_components_yyx': 3, 'context_extractor_yyx': 'lstm', 'activation_func_yyx': 'ReLU', 'L2_weight_yyx': 0.0004033145603815694, 'L_entropy_weight_yyx': 1.4073438905169165e-08, 'L_sep_weight_yyx': 3.7815495563262287e-06, 'L_scale_weight_yyx': 4.040475187730964e-08, 'learning_rate_yyx': 0.0017738940041943912}. Best is trial 0 with value: -3.1460828145824977.
[I 2026-03-18 18:09:13,073] Trial 29 pruned. 
[I 2026-03-18 18:09:13,144] Trial 32 pruned. 
[I 2026-03-18 18:09:16,568] Trial 16 pruned. 
[I 2026-03-18 18:09:17,849] Trial 17 pruned. 
[I 2026-03-18 18:09:19,514] Trial 24 finished with value: -1.246873450147026 and parameters: {'n_layers_yyx': 2, 'hidden_size_yyx_l0': 3, 'hidden_size_yyx_l1': 5, 'context_size_yyx': 2, 'num_mix_components_yyx': 2, 'context_extractor_yyx': 'gru', 'activation_func_yyx': 'Tanh', 'L2_weight_yyx': 7.943124569645114e-07, 'L_entropy_weight_yyx': 4.5958779647336976e-08, 'L_sep_weight_yyx': 3.742502570727694e-10, 'L_scale_weight_yyx': 5.592177046282742e-08, 'learning_rate_yyx': 0.009994558412438174}. Best is trial 0 with value: -1.255221580181016.
[I 2026-03-18 18:09:20,761] Trial 18 pruned. 
[I 2026-03-18 18:09:23,380] Trial 19 pruned. 
[I 2026-03-18 18:09:24,067] Trial 23 pruned. 
[I 2026-03-18 18:09:27,051] Trial 18 finished with value: -1.2452093653616736 and parameters: {'n_layers_yyx': 2, 'hidden_size_yyx_l0': 5, 'hidden_size_yyx_l1': 4, 'context_size_yyx': 2, 'num_mix_components_yyx': 4, 'context_extractor_yyx': 'lstm', 'activation_func_yyx': 'ReLU', 'L2_weight_yyx': 3.0616747779813048e-06, 'L_entropy_weight_yyx': 1.1314107078031797e-07, 'L_sep_weight_yyx': 1.2412844331007432e-06, 'L_scale_weight_yyx': 6.489268848508271e-08, 'learning_rate_yyx': 0.0018331293294305843}. Best is trial 2 with value: -1.2804754530695341.
[I 2026-03-18 18:09:28,991] Trial 25 pruned. 
[I 2026-03-18 18:09:30,153] Trial 15 pruned. 
[I 2026-03-18 18:09:30,420] Trial 22 pruned. 
[I 2026-03-18 18:09:30,460] Trial 33 pruned. 
[I 2026-03-18 18:09:30,497] Trial 18 pruned. 
[I 2026-03-18 18:09:33,855] Trial 24 pruned. 
[I 2026-03-18 18:09:37,351] Trial 27 pruned. 
[I 2026-03-18 18:09:39,331] Trial 25 finished with value: -3.14814801074357 and parameters: {'n_layers_yyx': 1, 'hidden_size_yyx_l0': 4, 'context_size_yyx': 4, 'num_mix_components_yyx': 1, 'context_extractor_yyx': 'lstm', 'activation_func_yyx': 'ReLU', 'L2_weight_yyx': 5.558134707986896e-10, 'L_entropy_weight_yyx': 7.810780708976242e-06, 'L_sep_weight_yyx': 4.307970883148474e-10, 'L_scale_weight_yyx': 4.451415080969468e-09, 'learning_rate_yyx': 0.006658581887419419}. Best is trial 16 with value: -3.149974272486285.
[I 2026-03-18 18:09:39,613] Trial 19 pruned. 
[I 2026-03-18 18:09:40,431] Trial 34 pruned. 
[I 2026-03-18 18:09:41,144] Trial 26 pruned. 
[I 2026-03-18 18:09:44,716] Trial 25 pruned. 
[I 2026-03-18 18:09:45,719] Trial 23 pruned. 
[I 2026-03-18 18:09:45,997] Trial 26 pruned. 
[I 2026-03-18 18:09:49,415] Trial 23 pruned. 
[I 2026-03-18 18:09:52,644] Trial 22 pruned. 
[I 2026-03-18 18:09:58,192] Trial 29 pruned. 
[I 2026-03-18 18:09:59,149] Trial 24 pruned. 
[I 2026-03-18 18:09:59,675] Trial 26 pruned. 
[I 2026-03-18 18:09:59,797] Trial 28 pruned. 
[I 2026-03-18 18:09:59,996] Trial 19 finished with value: -3.1520429360699525 and parameters: {'n_layers_yyx': 1, 'hidden_size_yyx_l0': 5, 'context_size_yyx': 4, 'num_mix_components_yyx': 4, 'context_extractor_yyx': 'lstm', 'activation_func_yyx': 'Tanh', 'L2_weight_yyx': 0.0007313075841456027, 'L_entropy_weight_yyx': 1.4255051418262424e-09, 'L_sep_weight_yyx': 3.337077387213391e-05, 'L_scale_weight_yyx': 5.026631416270585e-09, 'learning_rate_yyx': 0.0028835220679079465}. Best is trial 12 with value: -3.1893335216865584.
[I 2026-03-18 18:10:01,302] Trial 32 finished with value: -1.2653063423311866 and parameters: {'n_layers_yyx': 2, 'hidden_size_yyx_l0': 5, 'hidden_size_yyx_l1': 5, 'context_size_yyx': 2, 'num_mix_components_yyx': 2, 'context_extractor_yyx': 'lstm', 'activation_func_yyx': 'Tanh', 'L2_weight_yyx': 0.00028063328241421785, 'L_entropy_weight_yyx': 5.791451536416671e-05, 'L_sep_weight_yyx': 2.47519704063887e-10, 'L_scale_weight_yyx': 3.8012349073714874e-08, 'learning_rate_yyx': 0.009983201090082128}. Best is trial 26 with value: -1.2726356097378264.
[I 2026-03-18 18:10:01,720] Trial 21 pruned. 
[I 2026-03-18 18:10:02,578] Trial 18 pruned. 
[I 2026-03-18 18:10:05,332] Trial 26 pruned. 
[I 2026-03-18 18:10:08,439] Trial 23 finished with value: -1.2721869844165175 and parameters: {'n_layers_yyx': 1, 'hidden_size_yyx_l0': 6, 'context_size_yyx': 4, 'num_mix_components_yyx': 4, 'context_extractor_yyx': 'gru', 'activation_func_yyx': 'Tanh', 'L2_weight_yyx': 1.1997767532151584e-08, 'L_entropy_weight_yyx': 1.7137367221749422e-07, 'L_sep_weight_yyx': 5.123839721332845e-10, 'L_scale_weight_yyx': 7.259120478546028e-10, 'learning_rate_yyx': 0.006614217428741582}. Best is trial 23 with value: -1.2721869844165175.
[I 2026-03-18 18:10:09,262] Trial 24 pruned. 
[I 2026-03-18 18:10:10,282] Trial 25 pruned. 
[I 2026-03-18 18:10:12,806] Trial 19 pruned. 
[I 2026-03-18 18:10:15,194] Trial 22 pruned. 
[I 2026-03-18 18:10:16,868] Trial 27 pruned. 
[I 2026-03-18 18:10:21,223] Trial 30 pruned. 
[I 2026-03-18 18:10:22,888] Trial 19 pruned. 
[I 2026-03-18 18:10:23,774] Trial 19 pruned. 
[I 2026-03-18 18:10:27,868] Trial 30 finished with value: -0.5637991169295908 and parameters: {'n_layers_yyx': 2, 'hidden_size_yyx_l0': 5, 'hidden_size_yyx_l1': 4, 'context_size_yyx': 4, 'num_mix_components_yyx': 3, 'context_extractor_yyx': 'gru', 'activation_func_yyx': 'Tanh', 'L2_weight_yyx': 3.355991586390203e-06, 'L_entropy_weight_yyx': 2.6690506354840773e-10, 'L_sep_weight_yyx': 6.844059219526655e-05, 'L_scale_weight_yyx': 2.5075444605452833e-05, 'learning_rate_yyx': 0.008051465826270999}. Best is trial 12 with value: -0.5830094706077523.
[I 2026-03-18 18:10:27,871] Trial 19 finished with value: -0.5893623740341837 and parameters: {'n_layers_yyx': 1, 'hidden_size_yyx_l0': 5, 'context_size_yyx': 4, 'num_mix_components_yyx': 5, 'context_extractor_yyx': 'lstm', 'activation_func_yyx': 'Tanh', 'L2_weight_yyx': 0.0006199366616473545, 'L_entropy_weight_yyx': 0.0003070839615752953, 'L_sep_weight_yyx': 4.295449418760645e-10, 'L_scale_weight_yyx': 2.290169385641059e-05, 'learning_rate_yyx': 0.0034750117768890835}. Best is trial 19 with value: -0.5893623740341837.
[I 2026-03-18 18:10:29,379] Trial 24 pruned. 
[I 2026-03-18 18:10:30,785] Trial 27 pruned. 
[I 2026-03-18 18:10:30,944] Trial 20 pruned. 
[I 2026-03-18 18:10:32,250] Trial 20 pruned. 
[I 2026-03-18 18:10:33,644] Trial 28 pruned. 
[I 2026-03-18 18:10:35,135] Trial 22 finished with value: -1.2529254144749669 and parameters: {'n_layers_yyx': 2, 'hidden_size_yyx_l0': 2, 'hidden_size_yyx_l1': 6, 'context_size_yyx': 3, 'num_mix_components_yyx': 4, 'context_extractor_yyx': 'lstm', 'activation_func_yyx': 'Tanh', 'L2_weight_yyx': 0.00010689354656305378, 'L_entropy_weight_yyx': 6.998539358854739e-09, 'L_sep_weight_yyx': 1.060570814772548e-10, 'L_scale_weight_yyx': 3.097190305375441e-07, 'learning_rate_yyx': 0.00736620222798672}. Best is trial 7 with value: -1.272066817927052.
[I 2026-03-18 18:10:36,561] Trial 16 pruned. 
[I 2026-03-18 18:10:37,621] Trial 28 pruned. 
[I 2026-03-18 18:10:40,453] Trial 14 finished with value: -1.1598430358548262 and parameters: {'n_layers_yyx': 1, 'hidden_size_yyx_l0': 3, 'context_size_yyx': 2, 'num_mix_components_yyx': 3, 'context_extractor_yyx': 'lstm', 'activation_func_yyx': 'ReLU', 'L2_weight_yyx': 2.3321784668411e-09, 'L_entropy_weight_yyx': 7.550525798917931e-07, 'L_sep_weight_yyx': 9.049243343642979e-08, 'L_scale_weight_yyx': 6.05493539348834e-09, 'learning_rate_yyx': 0.004885055160108801}. Best is trial 12 with value: -1.263812200860043.
[I 2026-03-18 18:10:44,514] Trial 25 pruned. 
[I 2026-03-18 18:10:45,428] Trial 27 pruned. 
[I 2026-03-18 18:10:45,525] Trial 29 pruned. 
[I 2026-03-18 18:10:47,225] Trial 33 pruned. 
[I 2026-03-18 18:10:48,766] Trial 29 pruned. 
[I 2026-03-18 18:10:51,231] Trial 16 finished with value: -3.147676768127977 and parameters: {'n_layers_yyx': 2, 'hidden_size_yyx_l0': 5, 'hidden_size_yyx_l1': 2, 'context_size_yyx': 4, 'num_mix_components_yyx': 4, 'context_extractor_yyx': 'gru', 'activation_func_yyx': 'ReLU', 'L2_weight_yyx': 1.4859522464953966e-06, 'L_entropy_weight_yyx': 1.0182366238465032e-10, 'L_sep_weight_yyx': 1.3198361760021105e-07, 'L_scale_weight_yyx': 1.0391920043722193e-06, 'learning_rate_yyx': 0.006078792237251405}. Best is trial 10 with value: -3.148061618303045.
[I 2026-03-18 18:10:52,486] Trial 17 finished with value: -3.1481010253258046 and parameters: {'n_layers_yyx': 2, 'hidden_size_yyx_l0': 3, 'hidden_size_yyx_l1': 5, 'context_size_yyx': 3, 'num_mix_components_yyx': 5, 'context_extractor_yyx': 'lstm', 'activation_func_yyx': 'ReLU', 'L2_weight_yyx': 1.453899103455873e-07, 'L_entropy_weight_yyx': 0.0008727478436606367, 'L_sep_weight_yyx': 7.915097585277338e-09, 'L_scale_weight_yyx': 4.728606105762907e-09, 'learning_rate_yyx': 0.002061427703147324}. Best is trial 13 with value: -3.1559077725337215.
[I 2026-03-18 18:10:55,897] Trial 26 pruned. 
[I 2026-03-18 18:10:57,030] Trial 30 pruned. 
[I 2026-03-18 18:11:00,098] Trial 23 pruned. 
[I 2026-03-18 18:11:06,160] Trial 35 finished with value: -0.5473357860454995 and parameters: {'n_layers_yyx': 1, 'hidden_size_yyx_l0': 4, 'context_size_yyx': 2, 'num_mix_components_yyx': 1, 'context_extractor_yyx': 'gru', 'activation_func_yyx': 'ReLU', 'L2_weight_yyx': 1.132675385842092e-09, 'L_entropy_weight_yyx': 4.392645735896416e-06, 'L_sep_weight_yyx': 1.066792138990959e-05, 'L_scale_weight_yyx': 2.3248644668105387e-08, 'learning_rate_yyx': 0.005666209797532261}. Best is trial 15 with value: -0.5797879771320495.
[I 2026-03-18 18:11:07,015] Trial 31 pruned. 
[I 2026-03-18 18:11:07,021] Trial 30 pruned. 
[I 2026-03-18 18:11:07,549] Trial 31 pruned. 
[I 2026-03-18 18:11:09,540] Trial 24 pruned. 
[I 2026-03-18 18:11:10,302] Trial 17 finished with value: -3.122694304298609 and parameters: {'n_layers_yyx': 2, 'hidden_size_yyx_l0': 5, 'hidden_size_yyx_l1': 6, 'context_size_yyx': 4, 'num_mix_components_yyx': 4, 'context_extractor_yyx': 'lstm', 'activation_func_yyx': 'ReLU', 'L2_weight_yyx': 0.00012504429175692048, 'L_entropy_weight_yyx': 5.679642665387517e-05, 'L_sep_weight_yyx': 1.5940090461223294e-06, 'L_scale_weight_yyx': 8.087289579933286e-09, 'learning_rate_yyx': 0.009130262424514677}. Best is trial 2 with value: -3.1501405578480686.
[I 2026-03-18 18:11:11,341] Trial 21 pruned. 
[I 2026-03-18 18:11:11,505] Trial 17 pruned. 
[I 2026-03-18 18:11:12,611] Trial 13 finished with value: -3.149210554393398 and parameters: {'n_layers_yyx': 2, 'hidden_size_yyx_l0': 3, 'hidden_size_yyx_l1': 6, 'context_size_yyx': 4, 'num_mix_components_yyx': 2, 'context_extractor_yyx': 'lstm', 'activation_func_yyx': 'ReLU', 'L2_weight_yyx': 2.4452211861757537e-10, 'L_entropy_weight_yyx': 1.0537751220472845e-07, 'L_sep_weight_yyx': 4.721962143623493e-07, 'L_scale_weight_yyx': 1.0269730636766017e-06, 'learning_rate_yyx': 0.003474533957602417}. Best is trial 1 with value: -3.152505646630136.
[I 2026-03-18 18:11:15,818] Trial 31 pruned. 
[I 2026-03-18 18:11:16,333] Trial 26 finished with value: -1.2543990017085331 and parameters: {'n_layers_yyx': 2, 'hidden_size_yyx_l0': 3, 'hidden_size_yyx_l1': 6, 'context_size_yyx': 4, 'num_mix_components_yyx': 3, 'context_extractor_yyx': 'lstm', 'activation_func_yyx': 'ReLU', 'L2_weight_yyx': 8.155553287250393e-07, 'L_entropy_weight_yyx': 3.126975698164362e-06, 'L_sep_weight_yyx': 2.098606384240358e-09, 'L_scale_weight_yyx': 7.591456158177578e-06, 'learning_rate_yyx': 0.007960888792193447}. Best is trial 22 with value: -1.2717005505799805.
[I 2026-03-18 18:11:16,381] Trial 27 pruned. 
[I 2026-03-18 18:11:17,062] Trial 18 finished with value: -3.1516461067131374 and parameters: {'n_layers_yyx': 2, 'hidden_size_yyx_l0': 5, 'hidden_size_yyx_l1': 5, 'context_size_yyx': 4, 'num_mix_components_yyx': 4, 'context_extractor_yyx': 'lstm', 'activation_func_yyx': 'GELU', 'L2_weight_yyx': 7.285443955997992e-06, 'L_entropy_weight_yyx': 1.722006131925137e-08, 'L_sep_weight_yyx': 1.0274127692754495e-07, 'L_scale_weight_yyx': 1.2192753353720415e-10, 'learning_rate_yyx': 0.0060009536715392815}. Best is trial 18 with value: -3.1516461067131374.
[I 2026-03-18 18:11:22,908] Trial 36 pruned. 
[I 2026-03-18 18:11:23,039] Trial 23 pruned. 
[I 2026-03-18 18:11:24,080] Trial 32 pruned. 
[I 2026-03-18 18:11:24,082] Trial 15 pruned. 
[I 2026-03-18 18:11:27,111] Trial 32 pruned. 
[I 2026-03-18 18:11:27,512] Trial 16 pruned. 
