[I 2026-03-18 17:13:14,858] Trial 4 finished with value: -0.4386058109498582 and parameters: {'n_layers_yyx': 1, 'hidden_size_yyx_l0': 3, 'context_size_yyx': 1, 'num_mix_components_yyx': 1, 'context_extractor_yyx': 'gru', 'activation_func_yyx': 'Tanh', 'L2_weight_yyx': 1.9324410418782798e-05, 'L_entropy_weight_yyx': 1.955006669612922e-09, 'L_sep_weight_yyx': 2.10165905616577e-06, 'L_scale_weight_yyx': 4.454635798000672e-07, 'learning_rate_yyx': 0.0006402675684856286}. Best is trial 3 with value: -0.584032942865049.
[I 2026-03-18 17:13:19,373] Trial 5 finished with value: -3.123281648643965 and parameters: {'n_layers_yyx': 2, 'hidden_size_yyx_l0': 4, 'hidden_size_yyx_l1': 6, 'context_size_yyx': 4, 'num_mix_components_yyx': 1, 'context_extractor_yyx': 'lstm', 'activation_func_yyx': 'ReLU', 'L2_weight_yyx': 1.3027449723743386e-10, 'L_entropy_weight_yyx': 3.6723374529697024e-05, 'L_sep_weight_yyx': 2.4315633958287975e-08, 'L_scale_weight_yyx': 2.237244218580469e-06, 'learning_rate_yyx': 0.00714250097801833}. Best is trial 1 with value: -3.1478210420414996.
[I 2026-03-18 17:13:23,022] Trial 9 pruned. 
[I 2026-03-18 17:13:28,156] Trial 5 pruned. 
[I 2026-03-18 17:13:31,278] Trial 2 finished with value: -3.147264441929563 and parameters: {'n_layers_yyx': 2, 'hidden_size_yyx_l0': 3, 'hidden_size_yyx_l1': 5, 'context_size_yyx': 4, 'num_mix_components_yyx': 3, 'context_extractor_yyx': 'lstm', 'activation_func_yyx': 'GELU', 'L2_weight_yyx': 7.986052688279458e-10, 'L_entropy_weight_yyx': 1.1282117218218341e-08, 'L_sep_weight_yyx': 5.359516104074567e-06, 'L_scale_weight_yyx': 5.377804921905131e-09, 'learning_rate_yyx': 0.00918087003323266}. Best is trial 2 with value: -3.147264441929563.
[I 2026-03-18 17:13:41,760] Trial 4 finished with value: -3.113365581325008 and parameters: {'n_layers_yyx': 2, 'hidden_size_yyx_l0': 5, 'hidden_size_yyx_l1': 3, 'context_size_yyx': 3, 'num_mix_components_yyx': 1, 'context_extractor_yyx': 'lstm', 'activation_func_yyx': 'Tanh', 'L2_weight_yyx': 0.0005419631450148525, 'L_entropy_weight_yyx': 1.2343007605608074e-09, 'L_sep_weight_yyx': 2.016549405496989e-06, 'L_scale_weight_yyx': 1.3767596329326744e-07, 'learning_rate_yyx': 0.0007032336627127171}. Best is trial 0 with value: -3.1190589761594594.
[I 2026-03-18 17:13:52,183] Trial 4 pruned. 
[I 2026-03-18 17:14:02,462] Trial 12 finished with value: -1.2667388281407947 and parameters: {'n_layers_yyx': 2, 'hidden_size_yyx_l0': 4, 'hidden_size_yyx_l1': 5, 'context_size_yyx': 4, 'num_mix_components_yyx': 4, 'context_extractor_yyx': 'lstm', 'activation_func_yyx': 'Tanh', 'L2_weight_yyx': 0.0008480797317798304, 'L_entropy_weight_yyx': 4.528753806063836e-10, 'L_sep_weight_yyx': 0.0009695414930055795, 'L_scale_weight_yyx': 1.5710371808995097e-10, 'learning_rate_yyx': 0.004946808297943106}. Best is trial 12 with value: -1.2667388281407947.
[I 2026-03-18 17:14:16,124] Trial 7 finished with value: -3.1806195088661364 and parameters: {'n_layers_yyx': 2, 'hidden_size_yyx_l0': 6, 'hidden_size_yyx_l1': 5, 'context_size_yyx': 2, 'num_mix_components_yyx': 5, 'context_extractor_yyx': 'lstm', 'activation_func_yyx': 'ReLU', 'L2_weight_yyx': 0.00010111901429878003, 'L_entropy_weight_yyx': 1.7855616223864703e-10, 'L_sep_weight_yyx': 5.775437754909719e-06, 'L_scale_weight_yyx': 1.3112391694334559e-05, 'learning_rate_yyx': 0.0041641199943763234}. Best is trial 5 with value: -3.1813736784759756.
[I 2026-03-18 17:14:19,573] Trial 5 pruned. 
[I 2026-03-18 17:14:22,521] Trial 3 finished with value: -1.2710443848338207 and parameters: {'n_layers_yyx': 2, 'hidden_size_yyx_l0': 3, 'hidden_size_yyx_l1': 3, 'context_size_yyx': 1, 'num_mix_components_yyx': 4, 'context_extractor_yyx': 'gru', 'activation_func_yyx': 'Tanh', 'L2_weight_yyx': 1.4770551996018545e-07, 'L_entropy_weight_yyx': 1.7068086525614005e-05, 'L_sep_weight_yyx': 9.465311135892043e-06, 'L_scale_weight_yyx': 3.023613532852024e-05, 'learning_rate_yyx': 0.0015855576287573132}. Best is trial 2 with value: -1.2804754530695341.
[I 2026-03-18 17:14:27,323] Trial 7 pruned. 
[I 2026-03-18 17:14:29,036] Trial 13 pruned. 
[I 2026-03-18 17:14:34,794] Trial 11 finished with value: -0.5771698879572515 and parameters: {'n_layers_yyx': 1, 'hidden_size_yyx_l0': 4, 'context_size_yyx': 4, 'num_mix_components_yyx': 5, 'context_extractor_yyx': 'gru', 'activation_func_yyx': 'ReLU', 'L2_weight_yyx': 6.406441390079658e-08, 'L_entropy_weight_yyx': 1.3602857035471e-05, 'L_sep_weight_yyx': 9.25571167256883e-06, 'L_scale_weight_yyx': 1.2879232250890438e-08, 'learning_rate_yyx': 0.009761056176863802}. Best is trial 11 with value: -0.5771698879572515.
[I 2026-03-18 17:14:35,213] Trial 6 pruned. 
[I 2026-03-18 17:14:41,154] Trial 5 finished with value: -3.115947292942081 and parameters: {'n_layers_yyx': 2, 'hidden_size_yyx_l0': 2, 'hidden_size_yyx_l1': 6, 'context_size_yyx': 2, 'num_mix_components_yyx': 1, 'context_extractor_yyx': 'gru', 'activation_func_yyx': 'Tanh', 'L2_weight_yyx': 1.672827631711465e-05, 'L_entropy_weight_yyx': 1.0381221800602831e-10, 'L_sep_weight_yyx': 1.3762907643836088e-05, 'L_scale_weight_yyx': 1.5226111189080186e-08, 'learning_rate_yyx': 0.001106823418646555}. Best is trial 0 with value: -3.1464314770929143.
[I 2026-03-18 17:14:42,710] Trial 3 finished with value: -3.1328511976365694 and parameters: {'n_layers_yyx': 2, 'hidden_size_yyx_l0': 4, 'hidden_size_yyx_l1': 2, 'context_size_yyx': 1, 'num_mix_components_yyx': 4, 'context_extractor_yyx': 'gru', 'activation_func_yyx': 'GELU', 'L2_weight_yyx': 6.809874469056025e-08, 'L_entropy_weight_yyx': 5.506450354058924e-09, 'L_sep_weight_yyx': 5.4678397917363634e-06, 'L_scale_weight_yyx': 2.9610252491951574e-07, 'learning_rate_yyx': 0.0015481160215364924}. Best is trial 1 with value: -3.152505646630136.
[I 2026-03-18 17:14:44,228] Trial 14 pruned. 
[I 2026-03-18 17:14:49,938] Trial 10 finished with value: -1.2538347367658633 and parameters: {'n_layers_yyx': 2, 'hidden_size_yyx_l0': 2, 'hidden_size_yyx_l1': 6, 'context_size_yyx': 1, 'num_mix_components_yyx': 3, 'context_extractor_yyx': 'gru', 'activation_func_yyx': 'Tanh', 'L2_weight_yyx': 3.3620752721610277e-07, 'L_entropy_weight_yyx': 7.702887093453995e-09, 'L_sep_weight_yyx': 1.3473958158342106e-10, 'L_scale_weight_yyx': 1.496096557475209e-08, 'learning_rate_yyx': 0.00847334314926647}. Best is trial 0 with value: -1.255221580181016.
[I 2026-03-18 17:14:50,543] Trial 13 finished with value: -3.119378896306684 and parameters: {'n_layers_yyx': 2, 'hidden_size_yyx_l0': 3, 'hidden_size_yyx_l1': 2, 'context_size_yyx': 4, 'num_mix_components_yyx': 3, 'context_extractor_yyx': 'lstm', 'activation_func_yyx': 'ReLU', 'L2_weight_yyx': 6.837498056944344e-05, 'L_entropy_weight_yyx': 8.915757868478818e-06, 'L_sep_weight_yyx': 8.319859533795949e-08, 'L_scale_weight_yyx': 2.8341901074804996e-05, 'learning_rate_yyx': 0.004894779143313982}. Best is trial 0 with value: -3.1199443073044333.
[I 2026-03-18 17:14:53,602] Trial 7 finished with value: -3.1125190801407108 and parameters: {'n_layers_yyx': 1, 'hidden_size_yyx_l0': 3, 'context_size_yyx': 3, 'num_mix_components_yyx': 1, 'context_extractor_yyx': 'lstm', 'activation_func_yyx': 'Tanh', 'L2_weight_yyx': 0.0003205268011825184, 'L_entropy_weight_yyx': 1.0731624553353264e-06, 'L_sep_weight_yyx': 0.0009163388446953915, 'L_scale_weight_yyx': 5.552042586304744e-08, 'learning_rate_yyx': 0.0034903349366189984}. Best is trial 2 with value: -3.1580584124267483.
[I 2026-03-18 17:14:53,969] Trial 6 finished with value: -3.111049806078747 and parameters: {'n_layers_yyx': 1, 'hidden_size_yyx_l0': 3, 'context_size_yyx': 3, 'num_mix_components_yyx': 2, 'context_extractor_yyx': 'gru', 'activation_func_yyx': 'Tanh', 'L2_weight_yyx': 0.00044326137836802097, 'L_entropy_weight_yyx': 0.0009364117843798969, 'L_sep_weight_yyx': 9.955026443913071e-08, 'L_scale_weight_yyx': 1.2570661068507462e-10, 'learning_rate_yyx': 0.0007276592819647052}. Best is trial 1 with value: -3.126730890715153.
[I 2026-03-18 17:14:58,639] Trial 7 pruned. 
[I 2026-03-18 17:14:59,014] Trial 12 finished with value: -1.2370306074949817 and parameters: {'n_layers_yyx': 1, 'hidden_size_yyx_l0': 5, 'context_size_yyx': 3, 'num_mix_components_yyx': 4, 'context_extractor_yyx': 'gru', 'activation_func_yyx': 'Tanh', 'L2_weight_yyx': 3.1742551363885255e-05, 'L_entropy_weight_yyx': 8.040702889632661e-09, 'L_sep_weight_yyx': 0.0009169528595405031, 'L_scale_weight_yyx': 0.0009013976090769452, 'learning_rate_yyx': 0.005327305048160335}. Best is trial 1 with value: -1.2648516600321489.
[I 2026-03-18 17:15:04,313] Trial 5 finished with value: -3.1470593446970145 and parameters: {'n_layers_yyx': 1, 'hidden_size_yyx_l0': 6, 'context_size_yyx': 3, 'num_mix_components_yyx': 1, 'context_extractor_yyx': 'gru', 'activation_func_yyx': 'ReLU', 'L2_weight_yyx': 4.2531805223784583e-08, 'L_entropy_weight_yyx': 3.3906360605059532e-06, 'L_sep_weight_yyx': 6.605160708692411e-09, 'L_scale_weight_yyx': 6.808579728255902e-05, 'learning_rate_yyx': 0.008774228629874809}. Best is trial 2 with value: -3.151229652723366.
[I 2026-03-18 17:15:09,301] Trial 7 pruned. 
[I 2026-03-18 17:15:11,971] Trial 4 finished with value: -0.5804501078315746 and parameters: {'n_layers_yyx': 2, 'hidden_size_yyx_l0': 3, 'hidden_size_yyx_l1': 2, 'context_size_yyx': 3, 'num_mix_components_yyx': 5, 'context_extractor_yyx': 'lstm', 'activation_func_yyx': 'Tanh', 'L2_weight_yyx': 1.4087049799062796e-06, 'L_entropy_weight_yyx': 0.00023282414309921948, 'L_sep_weight_yyx': 4.413292776337898e-09, 'L_scale_weight_yyx': 3.003997774182138e-10, 'learning_rate_yyx': 0.0012855431568173671}. Best is trial 4 with value: -0.5804501078315746.
[I 2026-03-18 17:15:14,692] Trial 13 pruned. 
[I 2026-03-18 17:15:17,084] Trial 14 pruned. 
[I 2026-03-18 17:15:19,102] Trial 7 pruned. 
[I 2026-03-18 17:15:19,980] Trial 3 finished with value: -1.2533679334601722 and parameters: {'n_layers_yyx': 2, 'hidden_size_yyx_l0': 3, 'hidden_size_yyx_l1': 2, 'context_size_yyx': 3, 'num_mix_components_yyx': 5, 'context_extractor_yyx': 'lstm', 'activation_func_yyx': 'ReLU', 'L2_weight_yyx': 3.304971753073944e-06, 'L_entropy_weight_yyx': 6.98816048827665e-10, 'L_sep_weight_yyx': 1.5088957620483106e-05, 'L_scale_weight_yyx': 3.4857358340999915e-06, 'learning_rate_yyx': 0.006091904191705315}. Best is trial 3 with value: -1.2533679334601722.
[I 2026-03-18 17:15:20,903] Trial 8 pruned. 
[I 2026-03-18 17:15:20,945] Trial 10 finished with value: -1.2159779067400864 and parameters: {'n_layers_yyx': 1, 'hidden_size_yyx_l0': 6, 'context_size_yyx': 1, 'num_mix_components_yyx': 4, 'context_extractor_yyx': 'lstm', 'activation_func_yyx': 'Tanh', 'L2_weight_yyx': 1.6007538769537198e-10, 'L_entropy_weight_yyx': 1.1531224780442467e-05, 'L_sep_weight_yyx': 7.451128004484546e-05, 'L_scale_weight_yyx': 1.2628801380945863e-08, 'learning_rate_yyx': 0.0011289173129762056}. Best is trial 0 with value: -1.2691870881537193.
[I 2026-03-18 17:15:21,665] Trial 8 pruned. 
[I 2026-03-18 17:15:24,711] Trial 10 finished with value: -1.2677577894848948 and parameters: {'n_layers_yyx': 1, 'hidden_size_yyx_l0': 6, 'context_size_yyx': 4, 'num_mix_components_yyx': 5, 'context_extractor_yyx': 'gru', 'activation_func_yyx': 'ReLU', 'L2_weight_yyx': 1.5510891750009642e-10, 'L_entropy_weight_yyx': 0.00020957167539547328, 'L_sep_weight_yyx': 1.1076816093279434e-10, 'L_scale_weight_yyx': 1.186479776419155e-10, 'learning_rate_yyx': 0.00742192570855637}. Best is trial 10 with value: -1.2677577894848948.
[I 2026-03-18 17:15:25,070] Trial 5 pruned. 
[I 2026-03-18 17:15:26,299] Trial 6 pruned. 
[I 2026-03-18 17:15:28,961] Trial 4 pruned. 
[I 2026-03-18 17:15:34,222] Trial 14 pruned. 
[I 2026-03-18 17:15:36,558] Trial 6 pruned. 
[I 2026-03-18 17:15:43,818] Trial 6 finished with value: -3.1181001066430216 and parameters: {'n_layers_yyx': 2, 'hidden_size_yyx_l0': 4, 'hidden_size_yyx_l1': 3, 'context_size_yyx': 3, 'num_mix_components_yyx': 3, 'context_extractor_yyx': 'gru', 'activation_func_yyx': 'Tanh', 'L2_weight_yyx': 1.728086863343274e-05, 'L_entropy_weight_yyx': 2.824473624237456e-08, 'L_sep_weight_yyx': 2.3116417481064804e-06, 'L_scale_weight_yyx': 3.032362998457883e-08, 'learning_rate_yyx': 0.00830937203054426}. Best is trial 1 with value: -3.1478210420414996.
[I 2026-03-18 17:15:45,297] Trial 9 finished with value: -3.1325731362896336 and parameters: {'n_layers_yyx': 1, 'hidden_size_yyx_l0': 2, 'context_size_yyx': 1, 'num_mix_components_yyx': 4, 'context_extractor_yyx': 'lstm', 'activation_func_yyx': 'Tanh', 'L2_weight_yyx': 2.6909398611052714e-06, 'L_entropy_weight_yyx': 1.7344721587533664e-05, 'L_sep_weight_yyx': 1.1186529178739787e-08, 'L_scale_weight_yyx': 8.631856520100527e-07, 'learning_rate_yyx': 0.0037401277086639437}. Best is trial 1 with value: -3.1505299612690063.
[I 2026-03-18 17:15:47,092] Trial 8 pruned. 
[I 2026-03-18 17:15:47,448] Trial 6 finished with value: -3.115613150814609 and parameters: {'n_layers_yyx': 1, 'hidden_size_yyx_l0': 5, 'context_size_yyx': 4, 'num_mix_components_yyx': 3, 'context_extractor_yyx': 'gru', 'activation_func_yyx': 'ReLU', 'L2_weight_yyx': 0.0006435524707478571, 'L_entropy_weight_yyx': 0.00013098313642890213, 'L_sep_weight_yyx': 2.688049435600932e-06, 'L_scale_weight_yyx': 4.573130542678953e-06, 'learning_rate_yyx': 0.001340403489905453}. Best is trial 5 with value: -3.14725896745614.
[I 2026-03-18 17:16:01,126] Trial 9 pruned. 
[I 2026-03-18 17:16:09,764] Trial 6 pruned. 
[I 2026-03-18 17:16:20,705] Trial 4 pruned. 
[I 2026-03-18 17:16:32,656] Trial 7 pruned. 
[I 2026-03-18 17:16:38,840] Trial 4 finished with value: -3.1279676106849355 and parameters: {'n_layers_yyx': 1, 'hidden_size_yyx_l0': 2, 'context_size_yyx': 4, 'num_mix_components_yyx': 5, 'context_extractor_yyx': 'gru', 'activation_func_yyx': 'ReLU', 'L2_weight_yyx': 2.0263934216365499e-07, 'L_entropy_weight_yyx': 9.403063821607989e-08, 'L_sep_weight_yyx': 1.4553628595771407e-10, 'L_scale_weight_yyx': 4.049649638693123e-09, 'learning_rate_yyx': 0.0010148307441734518}. Best is trial 1 with value: -3.166268711244678.
[I 2026-03-18 17:16:42,408] Trial 9 pruned. 
[I 2026-03-18 17:16:44,670] Trial 7 pruned. 
[I 2026-03-18 17:16:46,457] Trial 7 pruned. 
[I 2026-03-18 17:16:52,433] Trial 12 finished with value: -0.5482548499861642 and parameters: {'n_layers_yyx': 1, 'hidden_size_yyx_l0': 6, 'context_size_yyx': 4, 'num_mix_components_yyx': 4, 'context_extractor_yyx': 'gru', 'activation_func_yyx': 'ReLU', 'L2_weight_yyx': 1.1773177416403066e-07, 'L_entropy_weight_yyx': 1.943841294152172e-08, 'L_sep_weight_yyx': 1.323335615452058e-05, 'L_scale_weight_yyx': 1.539282287931972e-08, 'learning_rate_yyx': 0.0027121117449037577}. Best is trial 11 with value: -0.5771698879572515.
[I 2026-03-18 17:17:03,669] Trial 5 finished with value: -1.2503299818902711 and parameters: {'n_layers_yyx': 1, 'hidden_size_yyx_l0': 6, 'context_size_yyx': 4, 'num_mix_components_yyx': 4, 'context_extractor_yyx': 'gru', 'activation_func_yyx': 'Tanh', 'L2_weight_yyx': 1.2081778524432754e-08, 'L_entropy_weight_yyx': 5.094845931017045e-07, 'L_sep_weight_yyx': 1.1491167572076032e-09, 'L_scale_weight_yyx': 3.132675376510822e-09, 'learning_rate_yyx': 0.0021305854653496164}. Best is trial 2 with value: -1.2627689975026355.
[I 2026-03-18 17:17:07,830] Trial 15 pruned. 
[I 2026-03-18 17:17:34,940] Trial 8 pruned. 
[I 2026-03-18 17:17:48,989] Trial 10 pruned. 
[I 2026-03-18 17:17:54,946] Trial 8 pruned. 
[I 2026-03-18 17:17:57,743] Trial 6 pruned. 
[I 2026-03-18 17:17:57,958] Trial 9 finished with value: -0.5449006973959228 and parameters: {'n_layers_yyx': 2, 'hidden_size_yyx_l0': 4, 'hidden_size_yyx_l1': 2, 'context_size_yyx': 1, 'num_mix_components_yyx': 1, 'context_extractor_yyx': 'gru', 'activation_func_yyx': 'ReLU', 'L2_weight_yyx': 0.0006174410882414131, 'L_entropy_weight_yyx': 1.9716198868514578e-09, 'L_sep_weight_yyx': 1.2874989594623538e-09, 'L_scale_weight_yyx': 4.032440846652155e-09, 'learning_rate_yyx': 0.0032960447641182888}. Best is trial 3 with value: -0.5628998348440724.
[I 2026-03-18 17:18:01,085] Trial 5 pruned. 
[I 2026-03-18 17:18:54,398] Trial 4 pruned. 
[I 2026-03-18 17:19:02,665] Trial 10 pruned. 
[I 2026-03-18 17:19:06,045] Trial 16 pruned. 
[I 2026-03-18 17:19:15,115] Trial 9 pruned. 
[I 2026-03-18 17:20:06,329] Trial 7 pruned. 
[I 2026-03-18 17:20:12,621] Trial 5 finished with value: -3.1192462435086177 and parameters: {'n_layers_yyx': 1, 'hidden_size_yyx_l0': 6, 'context_size_yyx': 4, 'num_mix_components_yyx': 3, 'context_extractor_yyx': 'gru', 'activation_func_yyx': 'ReLU', 'L2_weight_yyx': 7.186413030428442e-07, 'L_entropy_weight_yyx': 4.3114176779285014e-07, 'L_sep_weight_yyx': 7.525441799810716e-05, 'L_scale_weight_yyx': 1.2801006933270212e-05, 'learning_rate_yyx': 0.003309770121804373}. Best is trial 5 with value: -3.1192462435086177.
[I 2026-03-18 17:20:15,326] Trial 17 pruned. 
[I 2026-03-18 17:20:15,326] Trial 11 pruned. 
[I 2026-03-18 17:20:19,665] Trial 5 pruned. 
[I 2026-03-18 17:20:23,918] Trial 9 pruned. 
[I 2026-03-18 17:20:41,631] Trial 10 pruned. 
[I 2026-03-18 17:21:17,102] Trial 15 finished with value: -1.2656892011434446 and parameters: {'n_layers_yyx': 2, 'hidden_size_yyx_l0': 3, 'hidden_size_yyx_l1': 5, 'context_size_yyx': 4, 'num_mix_components_yyx': 4, 'context_extractor_yyx': 'lstm', 'activation_func_yyx': 'Tanh', 'L2_weight_yyx': 0.00016876119355473327, 'L_entropy_weight_yyx': 1.7535013851312974e-07, 'L_sep_weight_yyx': 1.0578712863448141e-05, 'L_scale_weight_yyx': 3.521252206450512e-09, 'learning_rate_yyx': 0.0053609373316983394}. Best is trial 12 with value: -1.2667388281407947.
[I 2026-03-18 17:21:26,436] Trial 18 pruned. 
[I 2026-03-18 17:21:27,797] Trial 5 finished with value: -3.154335707688014 and parameters: {'n_layers_yyx': 2, 'hidden_size_yyx_l0': 5, 'hidden_size_yyx_l1': 5, 'context_size_yyx': 3, 'num_mix_components_yyx': 3, 'context_extractor_yyx': 'lstm', 'activation_func_yyx': 'GELU', 'L2_weight_yyx': 1.3864764479994061e-08, 'L_entropy_weight_yyx': 4.385148102788163e-08, 'L_sep_weight_yyx': 9.907159955169044e-06, 'L_scale_weight_yyx': 3.8865894744052884e-05, 'learning_rate_yyx': 0.004605344174649629}. Best is trial 5 with value: -3.154335707688014.
[I 2026-03-18 17:21:41,448] Trial 6 pruned. 
[I 2026-03-18 17:22:01,487] Trial 8 finished with value: -3.1442509964461434 and parameters: {'n_layers_yyx': 2, 'hidden_size_yyx_l0': 4, 'hidden_size_yyx_l1': 5, 'context_size_yyx': 1, 'num_mix_components_yyx': 3, 'context_extractor_yyx': 'gru', 'activation_func_yyx': 'ReLU', 'L2_weight_yyx': 4.2256645285739146e-05, 'L_entropy_weight_yyx': 0.0008861494412415934, 'L_sep_weight_yyx': 1.8573694999045835e-10, 'L_scale_weight_yyx': 2.4606728060951884e-05, 'learning_rate_yyx': 0.0016875130232882971}. Best is trial 5 with value: -3.1813736784759756.
[I 2026-03-18 17:22:06,974] Trial 15 finished with value: -3.1209078997618023 and parameters: {'n_layers_yyx': 2, 'hidden_size_yyx_l0': 2, 'hidden_size_yyx_l1': 4, 'context_size_yyx': 4, 'num_mix_components_yyx': 4, 'context_extractor_yyx': 'lstm', 'activation_func_yyx': 'ReLU', 'L2_weight_yyx': 2.846866729156579e-05, 'L_entropy_weight_yyx': 1.2693519695380666e-09, 'L_sep_weight_yyx': 4.4892211576979203e-07, 'L_scale_weight_yyx': 1.2266811395242381e-10, 'learning_rate_yyx': 0.006387116493998355}. Best is trial 15 with value: -3.1209078997618023.
[I 2026-03-18 17:22:22,045] Trial 16 pruned. 
[I 2026-03-18 17:22:23,579] Trial 10 pruned. 
[I 2026-03-18 17:22:38,253] Trial 6 finished with value: -3.1471600213313993 and parameters: {'n_layers_yyx': 2, 'hidden_size_yyx_l0': 2, 'hidden_size_yyx_l1': 5, 'context_size_yyx': 4, 'num_mix_components_yyx': 5, 'context_extractor_yyx': 'lstm', 'activation_func_yyx': 'ReLU', 'L2_weight_yyx': 2.38194947156245e-10, 'L_entropy_weight_yyx': 9.437390819150782e-05, 'L_sep_weight_yyx': 2.6275328718078666e-09, 'L_scale_weight_yyx': 2.409459676879507e-07, 'learning_rate_yyx': 0.0018825037732445574}. Best is trial 6 with value: -3.1471600213313993.
[I 2026-03-18 17:22:45,834] Trial 11 finished with value: -1.2617519540839628 and parameters: {'n_layers_yyx': 1, 'hidden_size_yyx_l0': 6, 'context_size_yyx': 3, 'num_mix_components_yyx': 4, 'context_extractor_yyx': 'lstm', 'activation_func_yyx': 'Tanh', 'L2_weight_yyx': 0.00010646801954642917, 'L_entropy_weight_yyx': 4.860800401327719e-06, 'L_sep_weight_yyx': 2.365375770014476e-07, 'L_scale_weight_yyx': 4.1240713856000746e-08, 'learning_rate_yyx': 0.009394838295554857}. Best is trial 0 with value: -1.2691870881537193.
[I 2026-03-18 17:22:50,325] Trial 6 pruned. 
[I 2026-03-18 17:22:51,662] Trial 10 finished with value: -1.2362059136635715 and parameters: {'n_layers_yyx': 1, 'hidden_size_yyx_l0': 5, 'context_size_yyx': 3, 'num_mix_components_yyx': 1, 'context_extractor_yyx': 'lstm', 'activation_func_yyx': 'ReLU', 'L2_weight_yyx': 1.8158939108413268e-10, 'L_entropy_weight_yyx': 2.8953544066123093e-10, 'L_sep_weight_yyx': 1.7649377107652045e-10, 'L_scale_weight_yyx': 1.8604874878904882e-10, 'learning_rate_yyx': 0.0010833444212358452}. Best is trial 3 with value: -1.265314140954432.
[I 2026-03-18 17:23:00,304] Trial 11 finished with value: -1.264411023716389 and parameters: {'n_layers_yyx': 1, 'hidden_size_yyx_l0': 6, 'context_size_yyx': 4, 'num_mix_components_yyx': 5, 'context_extractor_yyx': 'gru', 'activation_func_yyx': 'ReLU', 'L2_weight_yyx': 1.0754385048390592e-09, 'L_entropy_weight_yyx': 0.0005262628412885775, 'L_sep_weight_yyx': 2.1595396014467348e-10, 'L_scale_weight_yyx': 1.7101106553323487e-10, 'learning_rate_yyx': 0.008504875737251972}. Best is trial 10 with value: -1.2677577894848948.
