[I 2026-03-18 22:09:54,053] Trial 37 finished with value: -2.7274015620430525 and parameters: {'n_layers_yyx': 2, 'hidden_size_yyx_l0': 2, 'hidden_size_yyx_l1': 5, 'context_size_yyx': 2, 'num_mix_components_yyx': 4, 'context_extractor_yyx': 'lstm', 'activation_func_yyx': 'Tanh', 'L2_weight_yyx': 3.5974702546319384e-06, 'L_entropy_weight_yyx': 8.392812977165665e-09, 'L_sep_weight_yyx': 2.5118618133135825e-06, 'L_scale_weight_yyx': 3.1056842959619336e-10, 'learning_rate_yyx': 0.00996514658436203}. Best is trial 25 with value: -2.762886536950096.
[I 2026-03-18 22:09:57,443] Trial 31 finished with value: -2.4096588111163477 and parameters: {'n_layers_yyx': 2, 'hidden_size_yyx_l0': 6, 'hidden_size_yyx_l1': 3, 'context_size_yyx': 4, 'num_mix_components_yyx': 4, 'context_extractor_yyx': 'lstm', 'activation_func_yyx': 'ReLU', 'L2_weight_yyx': 4.0162142969770435e-05, 'L_entropy_weight_yyx': 0.0002057093050472339, 'L_sep_weight_yyx': 2.741086853661889e-06, 'L_scale_weight_yyx': 1.3146309893898217e-06, 'learning_rate_yyx': 0.008219974986179747}. Best is trial 22 with value: -2.411661374750258.
[I 2026-03-18 22:09:59,687] Trial 24 pruned. 
[I 2026-03-18 22:10:01,428] Trial 39 pruned. 
[I 2026-03-18 22:10:01,440] Trial 33 pruned. 
[I 2026-03-18 22:10:04,294] Trial 28 pruned. 
[I 2026-03-18 22:10:04,529] Trial 38 pruned. 
[I 2026-03-18 22:10:12,247] Trial 29 pruned. 
[I 2026-03-18 22:10:15,573] Trial 34 pruned. 
[I 2026-03-18 22:10:15,810] Trial 20 finished with value: -2.35928227351262 and parameters: {'n_layers_yyx': 2, 'hidden_size_yyx_l0': 4, 'hidden_size_yyx_l1': 4, 'context_size_yyx': 4, 'num_mix_components_yyx': 2, 'context_extractor_yyx': 'gru', 'activation_func_yyx': 'ReLU', 'L2_weight_yyx': 8.383298464612494e-05, 'L_entropy_weight_yyx': 5.993393224278626e-06, 'L_sep_weight_yyx': 0.0007877261984164724, 'L_scale_weight_yyx': 4.820615772994975e-06, 'learning_rate_yyx': 0.004885042591700194}. Best is trial 17 with value: -2.394564459385016.
[I 2026-03-18 22:10:15,938] Trial 39 pruned. 
[I 2026-03-18 22:10:18,378] Trial 34 pruned. 
[I 2026-03-18 22:10:19,353] Trial 25 pruned. 
[I 2026-03-18 22:10:23,178] Trial 23 pruned. 
[I 2026-03-18 22:10:26,055] Trial 40 pruned. 
[I 2026-03-18 22:10:27,737] Trial 26 pruned. 
[I 2026-03-18 22:10:27,740] Trial 28 pruned. 
[I 2026-03-18 22:10:28,217] Trial 30 pruned. 
[I 2026-03-18 22:10:28,933] Trial 35 pruned. 
[I 2026-03-18 22:10:34,324] Trial 34 finished with value: -2.764094273249308 and parameters: {'n_layers_yyx': 2, 'hidden_size_yyx_l0': 6, 'hidden_size_yyx_l1': 4, 'context_size_yyx': 4, 'num_mix_components_yyx': 5, 'context_extractor_yyx': 'gru', 'activation_func_yyx': 'GELU', 'L2_weight_yyx': 7.610869972266635e-07, 'L_entropy_weight_yyx': 2.6494999571797846e-08, 'L_sep_weight_yyx': 0.0005103881089572771, 'L_scale_weight_yyx': 4.118121794250189e-06, 'learning_rate_yyx': 0.008637699574892452}. Best is trial 22 with value: -2.767345984776815.
[I 2026-03-18 22:10:37,669] Trial 53 pruned. 
[I 2026-03-18 22:10:42,604] Trial 40 pruned. 
[I 2026-03-18 22:10:45,424] Trial 27 pruned. 
[I 2026-03-18 22:10:45,755] Trial 31 pruned. 
[I 2026-03-18 22:10:48,272] Trial 25 finished with value: -2.4120091389134988 and parameters: {'n_layers_yyx': 2, 'hidden_size_yyx_l0': 4, 'hidden_size_yyx_l1': 5, 'context_size_yyx': 4, 'num_mix_components_yyx': 4, 'context_extractor_yyx': 'lstm', 'activation_func_yyx': 'Tanh', 'L2_weight_yyx': 8.793462232013464e-07, 'L_entropy_weight_yyx': 2.474747300954741e-07, 'L_sep_weight_yyx': 0.00022828320360110223, 'L_scale_weight_yyx': 2.911393206498991e-10, 'learning_rate_yyx': 0.009748580323923242}. Best is trial 25 with value: -2.4120091389134988.
[I 2026-03-18 22:10:51,317] Trial 41 pruned. 
[I 2026-03-18 22:10:59,333] Trial 35 pruned. 
[I 2026-03-18 22:11:02,625] Trial 21 pruned. 
[I 2026-03-18 22:11:05,692] Trial 28 pruned. 
[I 2026-03-18 22:11:08,119] Trial 26 pruned. 
[I 2026-03-18 22:11:10,040] Trial 36 pruned. 
[I 2026-03-18 22:11:12,609] Trial 35 pruned. 
[I 2026-03-18 22:11:13,107] Trial 29 pruned. 
[I 2026-03-18 22:11:15,854] Trial 42 pruned. 
[I 2026-03-18 22:11:20,200] Trial 17 pruned. 
[I 2026-03-18 22:11:20,908] Trial 54 pruned. 
[I 2026-03-18 22:11:21,153] Trial 35 finished with value: -2.5411648948495134 and parameters: {'n_layers_yyx': 2, 'hidden_size_yyx_l0': 2, 'hidden_size_yyx_l1': 6, 'context_size_yyx': 4, 'num_mix_components_yyx': 3, 'context_extractor_yyx': 'lstm', 'activation_func_yyx': 'ReLU', 'L2_weight_yyx': 5.331481342373464e-08, 'L_entropy_weight_yyx': 3.6759467171744187e-06, 'L_sep_weight_yyx': 2.557022974675127e-10, 'L_scale_weight_yyx': 3.691277883909958e-07, 'learning_rate_yyx': 0.008214801954095447}. Best is trial 24 with value: -2.5511102316762146.
[I 2026-03-18 22:11:21,256] Trial 22 pruned. 
[I 2026-03-18 22:11:29,150] Trial 26 finished with value: -2.7566545177338457 and parameters: {'n_layers_yyx': 1, 'hidden_size_yyx_l0': 6, 'context_size_yyx': 2, 'num_mix_components_yyx': 4, 'context_extractor_yyx': 'lstm', 'activation_func_yyx': 'ReLU', 'L2_weight_yyx': 8.507277064802836e-08, 'L_entropy_weight_yyx': 6.632003808395718e-07, 'L_sep_weight_yyx': 2.0340837347260666e-09, 'L_scale_weight_yyx': 1.6940850277824048e-06, 'learning_rate_yyx': 0.00643149190871353}. Best is trial 7 with value: -2.766072426816335.
[I 2026-03-18 22:11:30,626] Trial 30 pruned. 
[I 2026-03-18 22:11:34,158] Trial 36 pruned. 
[I 2026-03-18 22:11:35,166] Trial 37 pruned. 
[I 2026-03-18 22:11:37,579] Trial 55 pruned. 
[I 2026-03-18 22:11:46,346] Trial 38 pruned. 
[I 2026-03-18 22:11:50,199] Trial 31 pruned. 
[I 2026-03-18 22:11:53,645] Trial 36 pruned. 
[I 2026-03-18 22:12:00,285] Trial 32 pruned. 
[I 2026-03-18 22:12:01,087] Trial 32 finished with value: -2.420807459084574 and parameters: {'n_layers_yyx': 2, 'hidden_size_yyx_l0': 2, 'hidden_size_yyx_l1': 5, 'context_size_yyx': 4, 'num_mix_components_yyx': 5, 'context_extractor_yyx': 'gru', 'activation_func_yyx': 'GELU', 'L2_weight_yyx': 0.0006657484064059313, 'L_entropy_weight_yyx': 0.0001920467174291304, 'L_sep_weight_yyx': 7.071450300496416e-06, 'L_scale_weight_yyx': 9.536617288408877e-06, 'learning_rate_yyx': 0.009696802107368386}. Best is trial 32 with value: -2.420807459084574.
[I 2026-03-18 22:12:08,672] Trial 37 pruned. 
[I 2026-03-18 22:12:08,876] Trial 23 pruned. 
[I 2026-03-18 22:12:12,749] Trial 39 pruned. 
[I 2026-03-18 22:12:18,611] Trial 24 finished with value: -2.4319235459143473 and parameters: {'n_layers_yyx': 1, 'hidden_size_yyx_l0': 5, 'context_size_yyx': 4, 'num_mix_components_yyx': 5, 'context_extractor_yyx': 'lstm', 'activation_func_yyx': 'Tanh', 'L2_weight_yyx': 0.0001642703970573848, 'L_entropy_weight_yyx': 2.7993759061903945e-08, 'L_sep_weight_yyx': 2.9379302671447267e-05, 'L_scale_weight_yyx': 9.22408258666709e-07, 'learning_rate_yyx': 0.006267766773167837}. Best is trial 24 with value: -2.4319235459143473.
[I 2026-03-18 22:12:23,605] Trial 56 pruned. 
[I 2026-03-18 22:12:29,229] Trial 41 finished with value: -2.762175885368796 and parameters: {'n_layers_yyx': 2, 'hidden_size_yyx_l0': 3, 'hidden_size_yyx_l1': 4, 'context_size_yyx': 3, 'num_mix_components_yyx': 3, 'context_extractor_yyx': 'lstm', 'activation_func_yyx': 'Tanh', 'L2_weight_yyx': 1.2220668947779574e-08, 'L_entropy_weight_yyx': 1.9345058183489535e-09, 'L_sep_weight_yyx': 2.134413713811809e-07, 'L_scale_weight_yyx': 5.444265419258843e-09, 'learning_rate_yyx': 0.006976573497318861}. Best is trial 25 with value: -2.762886536950096.
[I 2026-03-18 22:12:31,430] Trial 57 pruned. 
[I 2026-03-18 22:12:38,598] Trial 58 pruned. 
[I 2026-03-18 22:12:39,430] Trial 40 pruned. 
[I 2026-03-18 22:12:39,665] Trial 42 pruned. 
[I 2026-03-18 22:12:40,819] Trial 27 pruned. 
[I 2026-03-18 22:12:45,868] Trial 33 pruned. 
[I 2026-03-18 22:12:47,818] Trial 32 finished with value: -2.429333228647056 and parameters: {'n_layers_yyx': 2, 'hidden_size_yyx_l0': 6, 'hidden_size_yyx_l1': 3, 'context_size_yyx': 3, 'num_mix_components_yyx': 3, 'context_extractor_yyx': 'lstm', 'activation_func_yyx': 'Tanh', 'L2_weight_yyx': 3.1533100096704327e-05, 'L_entropy_weight_yyx': 5.707943360502384e-05, 'L_sep_weight_yyx': 3.3784234140913316e-05, 'L_scale_weight_yyx': 7.823604844951961e-10, 'learning_rate_yyx': 0.009960489567550784}. Best is trial 11 with value: -2.43991066579963.
[I 2026-03-18 22:12:53,873] Trial 34 pruned. 
[I 2026-03-18 22:12:55,092] Trial 59 pruned. 
[I 2026-03-18 22:12:55,173] Trial 33 pruned. 
[I 2026-03-18 22:12:58,937] Trial 37 finished with value: -2.3895696441016727 and parameters: {'n_layers_yyx': 2, 'hidden_size_yyx_l0': 6, 'hidden_size_yyx_l1': 6, 'context_size_yyx': 1, 'num_mix_components_yyx': 2, 'context_extractor_yyx': 'lstm', 'activation_func_yyx': 'Tanh', 'L2_weight_yyx': 3.541514754072763e-05, 'L_entropy_weight_yyx': 2.5581021561581558e-06, 'L_sep_weight_yyx': 6.639677245199334e-09, 'L_scale_weight_yyx': 2.864671140096806e-07, 'learning_rate_yyx': 0.009458962266117971}. Best is trial 11 with value: -2.4030680672323603.
[I 2026-03-18 22:12:59,861] Trial 27 finished with value: -2.4082925068963434 and parameters: {'n_layers_yyx': 2, 'hidden_size_yyx_l0': 4, 'hidden_size_yyx_l1': 5, 'context_size_yyx': 3, 'num_mix_components_yyx': 5, 'context_extractor_yyx': 'gru', 'activation_func_yyx': 'Tanh', 'L2_weight_yyx': 7.746582318416523e-07, 'L_entropy_weight_yyx': 9.722681239987216e-07, 'L_sep_weight_yyx': 0.0007634760859779423, 'L_scale_weight_yyx': 1.7448820665342787e-09, 'learning_rate_yyx': 0.009985245312280327}. Best is trial 25 with value: -2.4120091389134988.
[I 2026-03-18 22:13:01,322] Trial 35 pruned. 
[I 2026-03-18 22:13:05,036] Trial 25 pruned. 
[I 2026-03-18 22:13:05,089] Trial 41 pruned. 
[I 2026-03-18 22:13:05,858] Trial 43 pruned. 
[I 2026-03-18 22:13:06,074] Trial 28 pruned. 
[I 2026-03-18 22:13:08,239] Trial 28 pruned. 
[I 2026-03-18 22:13:09,809] Trial 36 pruned. 
[I 2026-03-18 22:13:12,749] Trial 60 pruned. 
[I 2026-03-18 22:13:13,227] Trial 26 pruned. 
[I 2026-03-18 22:13:14,080] Trial 29 finished with value: -2.3960325303152223 and parameters: {'n_layers_yyx': 2, 'hidden_size_yyx_l0': 4, 'hidden_size_yyx_l1': 6, 'context_size_yyx': 3, 'num_mix_components_yyx': 5, 'context_extractor_yyx': 'gru', 'activation_func_yyx': 'GELU', 'L2_weight_yyx': 4.56503820953928e-05, 'L_entropy_weight_yyx': 1.3980720952163084e-09, 'L_sep_weight_yyx': 1.8225069179023877e-05, 'L_scale_weight_yyx': 1.1056055883723772e-07, 'learning_rate_yyx': 0.00840084441896404}. Best is trial 29 with value: -2.3960325303152223.
[I 2026-03-18 22:13:16,481] Trial 29 pruned. 
[I 2026-03-18 22:13:18,763] Trial 37 pruned. 
[I 2026-03-18 22:13:21,348] Trial 27 pruned. 
[I 2026-03-18 22:13:24,384] Trial 30 pruned. 
[I 2026-03-18 22:13:27,351] Trial 38 pruned. 
[I 2026-03-18 22:13:30,062] Trial 61 pruned. 
[I 2026-03-18 22:13:31,485] Trial 29 pruned. 
[I 2026-03-18 22:13:32,361] Trial 31 pruned. 
[I 2026-03-18 22:13:51,085] Trial 32 pruned. 
[I 2026-03-18 22:13:59,077] Trial 33 pruned. 
[I 2026-03-18 22:14:06,588] Trial 43 finished with value: -2.765257325237063 and parameters: {'n_layers_yyx': 2, 'hidden_size_yyx_l0': 5, 'hidden_size_yyx_l1': 4, 'context_size_yyx': 1, 'num_mix_components_yyx': 4, 'context_extractor_yyx': 'gru', 'activation_func_yyx': 'Tanh', 'L2_weight_yyx': 4.959913234158461e-05, 'L_entropy_weight_yyx': 2.350337195853492e-05, 'L_sep_weight_yyx': 6.466319548149738e-08, 'L_scale_weight_yyx': 9.46287912459128e-09, 'learning_rate_yyx': 0.00978349431339157}. Best is trial 6 with value: -2.7665796528518882.
[I 2026-03-18 22:14:07,354] Trial 38 finished with value: -2.729883740984794 and parameters: {'n_layers_yyx': 2, 'hidden_size_yyx_l0': 5, 'hidden_size_yyx_l1': 6, 'context_size_yyx': 3, 'num_mix_components_yyx': 3, 'context_extractor_yyx': 'lstm', 'activation_func_yyx': 'GELU', 'L2_weight_yyx': 3.246450075265209e-08, 'L_entropy_weight_yyx': 4.122408833217185e-06, 'L_sep_weight_yyx': 5.56705543598786e-10, 'L_scale_weight_yyx': 2.436352226756621e-07, 'learning_rate_yyx': 0.00526899125829296}. Best is trial 0 with value: -2.7678615354442075.
[I 2026-03-18 22:14:07,580] Trial 24 finished with value: -2.3633543043870193 and parameters: {'n_layers_yyx': 2, 'hidden_size_yyx_l0': 6, 'hidden_size_yyx_l1': 4, 'context_size_yyx': 3, 'num_mix_components_yyx': 3, 'context_extractor_yyx': 'lstm', 'activation_func_yyx': 'GELU', 'L2_weight_yyx': 1.106235683912634e-06, 'L_entropy_weight_yyx': 9.112328658727455e-10, 'L_sep_weight_yyx': 1.551502512911612e-06, 'L_scale_weight_yyx': 2.1146672539495774e-05, 'learning_rate_yyx': 0.0013639574322304388}. Best is trial 17 with value: -2.394564459385016.
[I 2026-03-18 22:14:11,010] Trial 34 finished with value: -2.402629504057039 and parameters: {'n_layers_yyx': 2, 'hidden_size_yyx_l0': 6, 'hidden_size_yyx_l1': 3, 'context_size_yyx': 3, 'num_mix_components_yyx': 2, 'context_extractor_yyx': 'lstm', 'activation_func_yyx': 'Tanh', 'L2_weight_yyx': 0.00040096064904272994, 'L_entropy_weight_yyx': 1.8214908145105158e-09, 'L_sep_weight_yyx': 9.821096183932797e-06, 'L_scale_weight_yyx': 3.591289415264229e-09, 'learning_rate_yyx': 0.00898479580264361}. Best is trial 11 with value: -2.43991066579963.
[I 2026-03-18 22:14:12,226] Trial 28 pruned. 
[I 2026-03-18 22:14:14,610] Trial 62 pruned. 
[I 2026-03-18 22:14:15,414] Trial 25 pruned. 
[I 2026-03-18 22:14:17,471] Trial 44 pruned. 
[I 2026-03-18 22:14:18,162] Trial 34 pruned. 
[I 2026-03-18 22:14:19,310] Trial 35 pruned. 
[I 2026-03-18 22:14:22,011] Trial 18 finished with value: -2.7303554490150344 and parameters: {'n_layers_yyx': 1, 'hidden_size_yyx_l0': 6, 'context_size_yyx': 4, 'num_mix_components_yyx': 3, 'context_extractor_yyx': 'gru', 'activation_func_yyx': 'Tanh', 'L2_weight_yyx': 1.2454439752533914e-10, 'L_entropy_weight_yyx': 8.046492520274282e-06, 'L_sep_weight_yyx': 5.285849052598945e-09, 'L_scale_weight_yyx': 0.00023862279305246261, 'learning_rate_yyx': 0.0012606040429872466}. Best is trial 8 with value: -2.7663050128086293.
[I 2026-03-18 22:14:22,492] Trial 39 pruned. 
[I 2026-03-18 22:14:26,458] Trial 35 pruned. 
[I 2026-03-18 22:14:27,547] Trial 36 pruned. 
[I 2026-03-18 22:14:30,177] Trial 45 pruned. 
[I 2026-03-18 22:14:31,868] Trial 63 pruned. 
[I 2026-03-18 22:14:35,656] Trial 37 pruned. 
[I 2026-03-18 22:14:36,704] Trial 40 pruned. 
[I 2026-03-18 22:14:38,486] Trial 30 pruned. 
[I 2026-03-18 22:14:42,459] Trial 42 finished with value: -2.765803035100301 and parameters: {'n_layers_yyx': 2, 'hidden_size_yyx_l0': 6, 'hidden_size_yyx_l1': 4, 'context_size_yyx': 4, 'num_mix_components_yyx': 5, 'context_extractor_yyx': 'gru', 'activation_func_yyx': 'GELU', 'L2_weight_yyx': 9.550722750655734e-07, 'L_entropy_weight_yyx': 2.5261058417829884e-08, 'L_sep_weight_yyx': 0.0008321769580698285, 'L_scale_weight_yyx': 4.261956429574316e-07, 'learning_rate_yyx': 0.008744081666776576}. Best is trial 22 with value: -2.767345984776815.
[I 2026-03-18 22:14:49,004] Trial 19 pruned. 
[I 2026-03-18 22:14:50,031] Trial 33 finished with value: -2.398423529417661 and parameters: {'n_layers_yyx': 2, 'hidden_size_yyx_l0': 6, 'hidden_size_yyx_l1': 5, 'context_size_yyx': 3, 'num_mix_components_yyx': 3, 'context_extractor_yyx': 'lstm', 'activation_func_yyx': 'GELU', 'L2_weight_yyx': 3.437783878094552e-10, 'L_entropy_weight_yyx': 1.4201461785512062e-06, 'L_sep_weight_yyx': 0.00013772014319438439, 'L_scale_weight_yyx': 4.2879411773728205e-06, 'learning_rate_yyx': 0.002710584925309028}. Best is trial 13 with value: -2.4034606761310786.
[I 2026-03-18 22:14:50,529] Trial 64 pruned. 
[I 2026-03-18 22:14:53,696] Trial 38 pruned. 
[I 2026-03-18 22:14:59,211] Trial 34 pruned. 
[I 2026-03-18 22:15:01,921] Trial 26 pruned. 
[I 2026-03-18 22:15:01,978] Trial 39 pruned. 
[I 2026-03-18 22:15:03,091] Trial 29 pruned. 
[I 2026-03-18 22:15:09,451] Trial 41 pruned. 
[I 2026-03-18 22:15:10,200] Trial 38 pruned. 
[I 2026-03-18 22:15:10,248] Trial 40 pruned. 
[I 2026-03-18 22:15:10,780] Trial 36 finished with value: -2.550738342268356 and parameters: {'n_layers_yyx': 2, 'hidden_size_yyx_l0': 2, 'hidden_size_yyx_l1': 5, 'context_size_yyx': 4, 'num_mix_components_yyx': 3, 'context_extractor_yyx': 'lstm', 'activation_func_yyx': 'ReLU', 'L2_weight_yyx': 6.036144083277164e-08, 'L_entropy_weight_yyx': 3.254348206733426e-05, 'L_sep_weight_yyx': 2.3259658259232822e-10, 'L_scale_weight_yyx': 1.2588198668845604e-07, 'learning_rate_yyx': 0.004857393251827755}. Best is trial 24 with value: -2.5511102316762146.
[I 2026-03-18 22:15:11,330] Trial 30 pruned. 
[I 2026-03-18 22:15:18,405] Trial 20 pruned. 
[I 2026-03-18 22:15:19,097] Trial 27 pruned. 
[I 2026-03-18 22:15:19,152] Trial 41 pruned. 
[I 2026-03-18 22:15:21,797] Trial 36 pruned. 
[I 2026-03-18 22:15:31,205] Trial 21 pruned. 
[I 2026-03-18 22:15:39,050] Trial 28 pruned. 
[I 2026-03-18 22:15:39,977] Trial 46 pruned. 
[I 2026-03-18 22:15:41,822] Trial 39 pruned. 
[I 2026-03-18 22:15:43,482] Trial 37 pruned. 
[I 2026-03-18 22:15:43,943] Trial 30 pruned. 
[I 2026-03-18 22:15:45,977] Trial 35 pruned. 
[I 2026-03-18 22:15:48,030] Trial 31 pruned. 
[I 2026-03-18 22:15:49,980] Trial 40 pruned. 
[I 2026-03-18 22:15:52,515] Trial 31 pruned. 
[I 2026-03-18 22:15:53,123] Trial 38 pruned. 
[I 2026-03-18 22:15:54,446] Trial 36 pruned. 
[I 2026-03-18 22:16:03,440] Trial 39 pruned. 
[I 2026-03-18 22:16:09,885] Trial 42 pruned. 
[I 2026-03-18 22:16:10,576] Trial 43 finished with value: -2.7644059816996256 and parameters: {'n_layers_yyx': 2, 'hidden_size_yyx_l0': 6, 'hidden_size_yyx_l1': 4, 'context_size_yyx': 4, 'num_mix_components_yyx': 5, 'context_extractor_yyx': 'gru', 'activation_func_yyx': 'GELU', 'L2_weight_yyx': 4.581802337001512e-06, 'L_entropy_weight_yyx': 7.231547050163622e-08, 'L_sep_weight_yyx': 0.0004412665078703464, 'L_scale_weight_yyx': 4.7187636077626503e-07, 'learning_rate_yyx': 0.008533297583320398}. Best is trial 22 with value: -2.767345984776815.
[I 2026-03-18 22:16:25,556] Trial 40 pruned. 
[I 2026-03-18 22:16:28,492] Trial 43 pruned. 
[I 2026-03-18 22:16:30,655] Trial 29 pruned. 
[I 2026-03-18 22:16:35,756] Trial 41 pruned. 
[I 2026-03-18 22:16:39,319] Trial 41 pruned. 
[I 2026-03-18 22:16:39,331] Trial 30 pruned. 
[I 2026-03-18 22:16:41,877] Trial 37 finished with value: -2.365909551944003 and parameters: {'n_layers_yyx': 2, 'hidden_size_yyx_l0': 6, 'hidden_size_yyx_l1': 6, 'context_size_yyx': 4, 'num_mix_components_yyx': 1, 'context_extractor_yyx': 'lstm', 'activation_func_yyx': 'ReLU', 'L2_weight_yyx': 3.3724771590285775e-08, 'L_entropy_weight_yyx': 7.959352604552902e-08, 'L_sep_weight_yyx': 0.0004089466157746208, 'L_scale_weight_yyx': 1.3798095075138674e-05, 'learning_rate_yyx': 0.007976643288900711}. Best is trial 13 with value: -2.4034606761310786.
[I 2026-03-18 22:16:45,148] Trial 42 pruned. 
[I 2026-03-18 22:16:46,071] Trial 44 pruned. 
[I 2026-03-18 22:16:47,587] Trial 31 pruned. 
[I 2026-03-18 22:16:53,014] Trial 31 finished with value: -2.4215287710919315 and parameters: {'n_layers_yyx': 1, 'hidden_size_yyx_l0': 5, 'context_size_yyx': 4, 'num_mix_components_yyx': 5, 'context_extractor_yyx': 'lstm', 'activation_func_yyx': 'GELU', 'L2_weight_yyx': 0.0004890968640817366, 'L_entropy_weight_yyx': 1.1500674403320291e-06, 'L_sep_weight_yyx': 3.480171254876213e-08, 'L_scale_weight_yyx': 8.639027418166478e-06, 'learning_rate_yyx': 0.005701699139246873}. Best is trial 24 with value: -2.4319235459143473.
[I 2026-03-18 22:16:54,854] Trial 42 finished with value: -2.7632047231385535 and parameters: {'n_layers_yyx': 2, 'hidden_size_yyx_l0': 2, 'hidden_size_yyx_l1': 4, 'context_size_yyx': 4, 'num_mix_components_yyx': 4, 'context_extractor_yyx': 'gru', 'activation_func_yyx': 'GELU', 'L2_weight_yyx': 7.930892543507328e-09, 'L_entropy_weight_yyx': 3.3917654696691326e-06, 'L_sep_weight_yyx': 3.865697220607566e-06, 'L_scale_weight_yyx': 2.174589798786443e-09, 'learning_rate_yyx': 0.00727954288361492}. Best is trial 0 with value: -2.7678615354442075.
[I 2026-03-18 22:16:54,964] Trial 43 pruned. 
[I 2026-03-18 22:16:55,529] Trial 32 pruned. 
[I 2026-03-18 22:16:56,919] Trial 32 pruned. 
[I 2026-03-18 22:17:01,380] Trial 65 pruned. 
[I 2026-03-18 22:17:01,719] Trial 39 finished with value: -2.395087982623646 and parameters: {'n_layers_yyx': 2, 'hidden_size_yyx_l0': 2, 'hidden_size_yyx_l1': 6, 'context_size_yyx': 4, 'num_mix_components_yyx': 3, 'context_extractor_yyx': 'lstm', 'activation_func_yyx': 'GELU', 'L2_weight_yyx': 4.6319402662461454e-07, 'L_entropy_weight_yyx': 4.003638998928863e-05, 'L_sep_weight_yyx': 1.0148409923672311e-05, 'L_scale_weight_yyx': 1.411330961384075e-06, 'learning_rate_yyx': 0.0065759404880258365}. Best is trial 11 with value: -2.4030680672323603.
[I 2026-03-18 22:17:02,753] Trial 44 finished with value: -2.76513111802659 and parameters: {'n_layers_yyx': 2, 'hidden_size_yyx_l0': 4, 'hidden_size_yyx_l1': 4, 'context_size_yyx': 1, 'num_mix_components_yyx': 4, 'context_extractor_yyx': 'gru', 'activation_func_yyx': 'Tanh', 'L2_weight_yyx': 5.333384840152725e-05, 'L_entropy_weight_yyx': 2.642403511673206e-05, 'L_sep_weight_yyx': 6.504818597357637e-08, 'L_scale_weight_yyx': 1.0209248139506518e-07, 'learning_rate_yyx': 0.00940289738556605}. Best is trial 6 with value: -2.7665796528518882.
[I 2026-03-18 22:17:05,394] Trial 22 finished with value: -2.7657637336263443 and parameters: {'n_layers_yyx': 1, 'hidden_size_yyx_l0': 3, 'context_size_yyx': 4, 'num_mix_components_yyx': 5, 'context_extractor_yyx': 'lstm', 'activation_func_yyx': 'ReLU', 'L2_weight_yyx': 8.903619289219994e-10, 'L_entropy_weight_yyx': 4.724290363822528e-06, 'L_sep_weight_yyx': 7.953848780669682e-05, 'L_scale_weight_yyx': 5.694890834034214e-06, 'learning_rate_yyx': 0.007595061312844012}. Best is trial 8 with value: -2.7663050128086293.
[I 2026-03-18 22:17:06,459] Trial 33 pruned. 
