[I 2026-03-18 21:11:16,327] Trial 13 finished with value: -2.4726551633566207 and parameters: {'n_layers_yyx': 2, 'hidden_size_yyx_l0': 2, 'hidden_size_yyx_l1': 6, 'context_size_yyx': 1, 'num_mix_components_yyx': 3, 'context_extractor_yyx': 'lstm', 'activation_func_yyx': 'Tanh', 'L2_weight_yyx': 1.2261750300048302e-10, 'L_entropy_weight_yyx': 0.0006016965857044804, 'L_sep_weight_yyx': 1.0167544524246391e-10, 'L_scale_weight_yyx': 1.000401937944222e-10, 'learning_rate_yyx': 0.004381029943614385}. Best is trial 12 with value: -2.4732728871279206.
[I 2026-03-18 21:11:20,324] Trial 28 pruned. 
[I 2026-03-18 21:11:21,580] Trial 33 pruned. 
[I 2026-03-18 21:11:24,064] Trial 24 pruned. 
[I 2026-03-18 21:11:37,149] Trial 44 pruned. 
[I 2026-03-18 21:11:46,987] Trial 29 pruned. 
[I 2026-03-18 21:11:47,051] Trial 19 finished with value: -1.8705803991890224 and parameters: {'n_layers_yyx': 2, 'hidden_size_yyx_l0': 4, 'hidden_size_yyx_l1': 3, 'context_size_yyx': 2, 'num_mix_components_yyx': 2, 'context_extractor_yyx': 'lstm', 'activation_func_yyx': 'ReLU', 'L2_weight_yyx': 0.0001321560310327717, 'L_entropy_weight_yyx': 1.7703464127200728e-07, 'L_sep_weight_yyx': 1.1579565766665388e-08, 'L_scale_weight_yyx': 9.563517752935033e-05, 'learning_rate_yyx': 0.0037475152318952416}. Best is trial 5 with value: -1.89157565728699.
[I 2026-03-18 21:11:47,197] Trial 21 finished with value: -1.436468529334435 and parameters: {'n_layers_yyx': 2, 'hidden_size_yyx_l0': 6, 'hidden_size_yyx_l1': 5, 'context_size_yyx': 2, 'num_mix_components_yyx': 3, 'context_extractor_yyx': 'lstm', 'activation_func_yyx': 'ReLU', 'L2_weight_yyx': 4.021791006355094e-06, 'L_entropy_weight_yyx': 0.00010498331862023871, 'L_sep_weight_yyx': 2.123046625975669e-06, 'L_scale_weight_yyx': 0.00013135124345462257, 'learning_rate_yyx': 0.009599776488215117}. Best is trial 13 with value: -1.4490255267803485.
[I 2026-03-18 21:11:49,257] Trial 34 pruned. 
[I 2026-03-18 21:11:52,254] Trial 26 finished with value: -1.4476281891828813 and parameters: {'n_layers_yyx': 1, 'hidden_size_yyx_l0': 5, 'context_size_yyx': 4, 'num_mix_components_yyx': 4, 'context_extractor_yyx': 'lstm', 'activation_func_yyx': 'Tanh', 'L2_weight_yyx': 2.2567996801543324e-07, 'L_entropy_weight_yyx': 9.904839918760226e-07, 'L_sep_weight_yyx': 1.2495067426947455e-06, 'L_scale_weight_yyx': 2.800187098751821e-09, 'learning_rate_yyx': 0.009175300519847808}. Best is trial 24 with value: -1.4518791534615763.
[I 2026-03-18 21:11:58,044] Trial 17 pruned. 
[I 2026-03-18 21:12:01,466] Trial 29 pruned. 
[I 2026-03-18 21:12:03,547] Trial 45 pruned. 
[I 2026-03-18 21:12:03,718] Trial 21 pruned. 
[I 2026-03-18 21:12:05,007] Trial 34 pruned. 
[I 2026-03-18 21:12:08,463] Trial 29 pruned. 
[I 2026-03-18 21:12:11,457] Trial 35 pruned. 
[I 2026-03-18 21:12:22,124] Trial 30 pruned. 
[I 2026-03-18 21:12:22,850] Trial 18 pruned. 
[I 2026-03-18 21:12:23,553] Trial 17 finished with value: -1.8683336237107586 and parameters: {'n_layers_yyx': 1, 'hidden_size_yyx_l0': 6, 'context_size_yyx': 4, 'num_mix_components_yyx': 4, 'context_extractor_yyx': 'lstm', 'activation_func_yyx': 'ReLU', 'L2_weight_yyx': 1.573044588104349e-09, 'L_entropy_weight_yyx': 1.3343606514920062e-07, 'L_sep_weight_yyx': 1.9023250027493582e-06, 'L_scale_weight_yyx': 6.497500356181911e-09, 'learning_rate_yyx': 0.00851099780120506}. Best is trial 15 with value: -1.8695785775072098.
[I 2026-03-18 21:12:33,164] Trial 36 pruned. 
[I 2026-03-18 21:12:34,763] Trial 30 finished with value: -1.359998779296875 and parameters: {'n_layers_yyx': 2, 'hidden_size_yyx_l0': 6, 'hidden_size_yyx_l1': 6, 'context_size_yyx': 3, 'num_mix_components_yyx': 5, 'context_extractor_yyx': 'lstm', 'activation_func_yyx': 'ReLU', 'L2_weight_yyx': 1.7855190428707048e-05, 'L_entropy_weight_yyx': 2.5193913918273878e-05, 'L_sep_weight_yyx': 0.00033885475123910904, 'L_scale_weight_yyx': 1.3281459423188908e-07, 'learning_rate_yyx': 0.007938958938690246}. Best is trial 10 with value: -1.4553572904146634.
[I 2026-03-18 21:12:42,838] Trial 22 pruned. 
[I 2026-03-18 21:12:48,192] Trial 35 pruned. 
[I 2026-03-18 21:12:48,618] Trial 30 pruned. 
[I 2026-03-18 21:12:49,271] Trial 30 pruned. 
[I 2026-03-18 21:12:50,603] Trial 29 pruned. 
[I 2026-03-18 21:12:53,020] Trial 46 pruned. 
[I 2026-03-18 21:12:53,389] Trial 11 finished with value: -1.4385918250450722 and parameters: {'n_layers_yyx': 1, 'hidden_size_yyx_l0': 6, 'context_size_yyx': 4, 'num_mix_components_yyx': 5, 'context_extractor_yyx': 'lstm', 'activation_func_yyx': 'Tanh', 'L2_weight_yyx': 1.166023163536778e-08, 'L_entropy_weight_yyx': 3.198301423237905e-10, 'L_sep_weight_yyx': 4.0374657032216445e-06, 'L_scale_weight_yyx': 1.0554256094737805e-07, 'learning_rate_yyx': 0.0070444909436614194}. Best is trial 7 with value: -1.4535823880709136.
[I 2026-03-18 21:12:55,437] Trial 31 pruned. 
[I 2026-03-18 21:12:58,493] Trial 31 pruned. 
[I 2026-03-18 21:13:04,334] Trial 18 pruned. 
[I 2026-03-18 21:13:08,076] Trial 36 pruned. 
[I 2026-03-18 21:13:08,298] Trial 21 finished with value: -1.4320289024939903 and parameters: {'n_layers_yyx': 2, 'hidden_size_yyx_l0': 2, 'hidden_size_yyx_l1': 5, 'context_size_yyx': 4, 'num_mix_components_yyx': 2, 'context_extractor_yyx': 'gru', 'activation_func_yyx': 'Tanh', 'L2_weight_yyx': 8.811480896020533e-05, 'L_entropy_weight_yyx': 0.00030570768449786454, 'L_sep_weight_yyx': 3.6565154809481224e-06, 'L_scale_weight_yyx': 5.365588272024297e-07, 'learning_rate_yyx': 0.0059439315601484775}. Best is trial 13 with value: -1.4421805044320914.
[I 2026-03-18 21:13:11,394] Trial 29 finished with value: -1.8442264809785556 and parameters: {'n_layers_yyx': 1, 'hidden_size_yyx_l0': 5, 'context_size_yyx': 2, 'num_mix_components_yyx': 5, 'context_extractor_yyx': 'gru', 'activation_func_yyx': 'ReLU', 'L2_weight_yyx': 3.552814943498161e-05, 'L_entropy_weight_yyx': 0.0003213254037996054, 'L_sep_weight_yyx': 0.0009719183904617349, 'L_scale_weight_yyx': 2.7067935955536047e-10, 'learning_rate_yyx': 0.002805267788292688}. Best is trial 0 with value: -1.8516305051550026.
[I 2026-03-18 21:13:18,309] Trial 23 finished with value: -1.4352173321063701 and parameters: {'n_layers_yyx': 1, 'hidden_size_yyx_l0': 5, 'context_size_yyx': 4, 'num_mix_components_yyx': 3, 'context_extractor_yyx': 'lstm', 'activation_func_yyx': 'Tanh', 'L2_weight_yyx': 1.1984653280712025e-05, 'L_entropy_weight_yyx': 3.5034555374590294e-05, 'L_sep_weight_yyx': 8.586020143475848e-10, 'L_scale_weight_yyx': 4.1165037983049814e-05, 'learning_rate_yyx': 0.009754321294520252}. Best is trial 7 with value: -1.4538350266676683.
[I 2026-03-18 21:13:21,149] Trial 27 pruned. 
[I 2026-03-18 21:13:24,997] Trial 23 pruned. 
[I 2026-03-18 21:13:29,746] Trial 37 pruned. 
[I 2026-03-18 21:13:32,585] Trial 21 finished with value: -1.9380270034436489 and parameters: {'n_layers_yyx': 1, 'hidden_size_yyx_l0': 5, 'context_size_yyx': 4, 'num_mix_components_yyx': 2, 'context_extractor_yyx': 'gru', 'activation_func_yyx': 'ReLU', 'L2_weight_yyx': 2.70725263402469e-10, 'L_entropy_weight_yyx': 3.503668045668089e-10, 'L_sep_weight_yyx': 0.0006536382371652874, 'L_scale_weight_yyx': 7.447898677412793e-05, 'learning_rate_yyx': 0.00992607974867243}. Best is trial 10 with value: -1.9395614910230956.
[I 2026-03-18 21:13:32,973] Trial 30 pruned. 
[I 2026-03-18 21:13:35,266] Trial 29 finished with value: -1.4683670278695913 and parameters: {'n_layers_yyx': 1, 'hidden_size_yyx_l0': 4, 'context_size_yyx': 4, 'num_mix_components_yyx': 5, 'context_extractor_yyx': 'lstm', 'activation_func_yyx': 'Tanh', 'L2_weight_yyx': 4.362572898540418e-06, 'L_entropy_weight_yyx': 4.937018293885581e-08, 'L_sep_weight_yyx': 9.845669962266927e-07, 'L_scale_weight_yyx': 5.481542618924194e-10, 'learning_rate_yyx': 0.007114463102552461}. Best is trial 29 with value: -1.4683670278695913.
[I 2026-03-18 21:13:36,408] Trial 24 pruned. 
[I 2026-03-18 21:13:42,745] Trial 22 pruned. 
[I 2026-03-18 21:13:52,321] Trial 16 finished with value: -1.9310169746032186 and parameters: {'n_layers_yyx': 2, 'hidden_size_yyx_l0': 5, 'hidden_size_yyx_l1': 6, 'context_size_yyx': 2, 'num_mix_components_yyx': 4, 'context_extractor_yyx': 'gru', 'activation_func_yyx': 'GELU', 'L2_weight_yyx': 4.645144439127319e-05, 'L_entropy_weight_yyx': 0.0005177460149726677, 'L_sep_weight_yyx': 7.624504381183527e-06, 'L_scale_weight_yyx': 1.2812070611405337e-08, 'learning_rate_yyx': 0.00800304939370631}. Best is trial 14 with value: -1.9337542258067992.
[I 2026-03-18 21:13:52,849] Trial 30 pruned. 
[I 2026-03-18 21:13:57,339] Trial 37 pruned. 
[I 2026-03-18 21:14:05,294] Trial 24 pruned. 
[I 2026-03-18 21:14:05,569] Trial 21 finished with value: -2.4936595199897376 and parameters: {'n_layers_yyx': 1, 'hidden_size_yyx_l0': 6, 'context_size_yyx': 4, 'num_mix_components_yyx': 5, 'context_extractor_yyx': 'gru', 'activation_func_yyx': 'GELU', 'L2_weight_yyx': 4.607468196458495e-09, 'L_entropy_weight_yyx': 4.070407076001674e-06, 'L_sep_weight_yyx': 1.8378887380376857e-10, 'L_scale_weight_yyx': 1.1013825911675715e-06, 'learning_rate_yyx': 0.007062261544200205}. Best is trial 4 with value: -2.49523174750643.
[I 2026-03-18 21:14:06,100] Trial 25 finished with value: -1.7829087012705176 and parameters: {'n_layers_yyx': 2, 'hidden_size_yyx_l0': 6, 'hidden_size_yyx_l1': 6, 'context_size_yyx': 2, 'num_mix_components_yyx': 5, 'context_extractor_yyx': 'gru', 'activation_func_yyx': 'GELU', 'L2_weight_yyx': 4.276212150647746e-10, 'L_entropy_weight_yyx': 0.00014368738257307867, 'L_sep_weight_yyx': 2.1845371196051346e-09, 'L_scale_weight_yyx': 1.5598558826947842e-07, 'learning_rate_yyx': 0.0071458157579752865}. Best is trial 4 with value: -1.7875800731928662.
[I 2026-03-18 21:14:08,413] Trial 38 pruned. 
[I 2026-03-18 21:14:10,378] Trial 25 pruned. 
[I 2026-03-18 21:14:11,434] Trial 17 pruned. 
[I 2026-03-18 21:14:12,556] Trial 22 pruned. 
[I 2026-03-18 21:14:19,795] Trial 17 finished with value: -1.8506774690856722 and parameters: {'n_layers_yyx': 2, 'hidden_size_yyx_l0': 5, 'hidden_size_yyx_l1': 6, 'context_size_yyx': 2, 'num_mix_components_yyx': 4, 'context_extractor_yyx': 'gru', 'activation_func_yyx': 'GELU', 'L2_weight_yyx': 7.298934113130726e-05, 'L_entropy_weight_yyx': 6.212727751022853e-08, 'L_sep_weight_yyx': 1.9340364180180477e-07, 'L_scale_weight_yyx': 0.00010110885800135185, 'learning_rate_yyx': 0.009820884517041092}. Best is trial 12 with value: -1.8566309981104903.
[I 2026-03-18 21:14:20,688] Trial 25 pruned. 
[I 2026-03-18 21:14:20,943] Trial 22 finished with value: -1.2962911517803486 and parameters: {'n_layers_yyx': 2, 'hidden_size_yyx_l0': 4, 'hidden_size_yyx_l1': 5, 'context_size_yyx': 2, 'num_mix_components_yyx': 4, 'context_extractor_yyx': 'lstm', 'activation_func_yyx': 'ReLU', 'L2_weight_yyx': 1.3025221292813246e-06, 'L_entropy_weight_yyx': 3.6269979837584036e-05, 'L_sep_weight_yyx': 2.356184184769188e-06, 'L_scale_weight_yyx': 1.4998895064716964e-05, 'learning_rate_yyx': 0.009799618507749314}. Best is trial 13 with value: -1.4490255267803485.
[I 2026-03-18 21:14:21,516] Trial 23 pruned. 
[I 2026-03-18 21:14:25,152] Trial 26 pruned. 
[I 2026-03-18 21:14:29,098] Trial 22 pruned. 
[I 2026-03-18 21:14:31,860] Trial 18 pruned. 
[I 2026-03-18 21:14:40,768] Trial 23 pruned. 
[I 2026-03-18 21:14:42,117] Trial 25 finished with value: -2.4861018806561086 and parameters: {'n_layers_yyx': 1, 'hidden_size_yyx_l0': 6, 'context_size_yyx': 4, 'num_mix_components_yyx': 3, 'context_extractor_yyx': 'gru', 'activation_func_yyx': 'ReLU', 'L2_weight_yyx': 5.938218916377812e-10, 'L_entropy_weight_yyx': 1.7776931371563525e-06, 'L_sep_weight_yyx': 3.0443341208516034e-06, 'L_scale_weight_yyx': 7.217080270796658e-07, 'learning_rate_yyx': 0.007431242586957068}. Best is trial 25 with value: -2.4861018806561086.
[I 2026-03-18 21:14:51,578] Trial 26 pruned. 
[I 2026-03-18 21:14:58,676] Trial 26 pruned. 
[I 2026-03-18 21:15:02,553] Trial 14 finished with value: -2.473233498661837 and parameters: {'n_layers_yyx': 2, 'hidden_size_yyx_l0': 3, 'hidden_size_yyx_l1': 6, 'context_size_yyx': 1, 'num_mix_components_yyx': 4, 'context_extractor_yyx': 'lstm', 'activation_func_yyx': 'Tanh', 'L2_weight_yyx': 2.131142315427649e-09, 'L_entropy_weight_yyx': 0.00019519125707275826, 'L_sep_weight_yyx': 1.2660459429238325e-09, 'L_scale_weight_yyx': 3.271566885615783e-05, 'learning_rate_yyx': 0.002144592890405733}. Best is trial 12 with value: -2.4732728871279206.
[I 2026-03-18 21:15:06,122] Trial 28 finished with value: -1.895019399708715 and parameters: {'n_layers_yyx': 1, 'hidden_size_yyx_l0': 4, 'context_size_yyx': 3, 'num_mix_components_yyx': 4, 'context_extractor_yyx': 'lstm', 'activation_func_yyx': 'GELU', 'L2_weight_yyx': 5.442535591916623e-06, 'L_entropy_weight_yyx': 8.684037729674046e-07, 'L_sep_weight_yyx': 4.471229771035486e-06, 'L_scale_weight_yyx': 3.0355923124881134e-08, 'learning_rate_yyx': 0.005456966465616104}. Best is trial 24 with value: -1.896696364742586.
[I 2026-03-18 21:15:07,279] Trial 31 pruned. 
[I 2026-03-18 21:15:09,466] Trial 19 pruned. 
[I 2026-03-18 21:15:11,667] Trial 12 finished with value: -1.460441659780649 and parameters: {'n_layers_yyx': 1, 'hidden_size_yyx_l0': 5, 'context_size_yyx': 4, 'num_mix_components_yyx': 5, 'context_extractor_yyx': 'lstm', 'activation_func_yyx': 'Tanh', 'L2_weight_yyx': 3.6313831217938906e-09, 'L_entropy_weight_yyx': 1.0106987889712083e-10, 'L_sep_weight_yyx': 5.923887409161124e-06, 'L_scale_weight_yyx': 0.00038560443937752536, 'learning_rate_yyx': 0.004617362079712865}. Best is trial 12 with value: -1.460441659780649.
[I 2026-03-18 21:15:13,771] Trial 32 finished with value: -1.569730548247748 and parameters: {'n_layers_yyx': 1, 'hidden_size_yyx_l0': 5, 'context_size_yyx': 2, 'num_mix_components_yyx': 5, 'context_extractor_yyx': 'lstm', 'activation_func_yyx': 'Tanh', 'L2_weight_yyx': 8.404247497129438e-05, 'L_entropy_weight_yyx': 1.2658866735320206e-09, 'L_sep_weight_yyx': 3.5657282649796935e-08, 'L_scale_weight_yyx': 0.0002385674703494777, 'learning_rate_yyx': 0.007479283280943759}. Best is trial 26 with value: -1.584650032885134.
[I 2026-03-18 21:15:14,618] Trial 32 finished with value: -1.4672450138972355 and parameters: {'n_layers_yyx': 2, 'hidden_size_yyx_l0': 6, 'hidden_size_yyx_l1': 5, 'context_size_yyx': 4, 'num_mix_components_yyx': 4, 'context_extractor_yyx': 'lstm', 'activation_func_yyx': 'GELU', 'L2_weight_yyx': 3.6925445494506935e-07, 'L_entropy_weight_yyx': 2.0538035363011446e-06, 'L_sep_weight_yyx': 2.3283081251044226e-06, 'L_scale_weight_yyx': 3.283340747837208e-07, 'learning_rate_yyx': 0.00839080466993694}. Best is trial 32 with value: -1.4672450138972355.
[I 2026-03-18 21:15:18,437] Trial 19 finished with value: -1.8538088689349244 and parameters: {'n_layers_yyx': 1, 'hidden_size_yyx_l0': 6, 'context_size_yyx': 4, 'num_mix_components_yyx': 4, 'context_extractor_yyx': 'lstm', 'activation_func_yyx': 'GELU', 'L2_weight_yyx': 1.0080053112254286e-10, 'L_entropy_weight_yyx': 0.0002338897965333468, 'L_sep_weight_yyx': 3.535154375349984e-05, 'L_scale_weight_yyx': 7.303662452390942e-09, 'learning_rate_yyx': 0.006563710392268118}. Best is trial 15 with value: -1.8695785775072098.
[I 2026-03-18 21:15:19,379] Trial 31 finished with value: -1.418523888221154 and parameters: {'n_layers_yyx': 2, 'hidden_size_yyx_l0': 6, 'hidden_size_yyx_l1': 5, 'context_size_yyx': 4, 'num_mix_components_yyx': 2, 'context_extractor_yyx': 'gru', 'activation_func_yyx': 'GELU', 'L2_weight_yyx': 2.7400403429030863e-08, 'L_entropy_weight_yyx': 0.00010574604098078605, 'L_sep_weight_yyx': 2.6378608426713364e-07, 'L_scale_weight_yyx': 5.930248615077827e-10, 'learning_rate_yyx': 0.008680747204310989}. Best is trial 1 with value: -1.4389243727463943.
[I 2026-03-18 21:15:20,657] Trial 27 pruned. 
[I 2026-03-18 21:15:24,850] Trial 30 finished with value: -1.8333077131150208 and parameters: {'n_layers_yyx': 2, 'hidden_size_yyx_l0': 2, 'hidden_size_yyx_l1': 5, 'context_size_yyx': 3, 'num_mix_components_yyx': 3, 'context_extractor_yyx': 'gru', 'activation_func_yyx': 'GELU', 'L2_weight_yyx': 1.8855511175513319e-06, 'L_entropy_weight_yyx': 3.852071232596171e-06, 'L_sep_weight_yyx': 1.5343749142679713e-05, 'L_scale_weight_yyx': 7.234202337427897e-05, 'learning_rate_yyx': 0.0074351241127183195}. Best is trial 0 with value: -1.8516305051550026.
[I 2026-03-18 21:15:27,377] Trial 15 pruned. 
[I 2026-03-18 21:15:29,163] Trial 26 pruned. 
[I 2026-03-18 21:15:30,318] Trial 26 pruned. 
[I 2026-03-18 21:15:33,995] Trial 22 finished with value: -1.855450075695437 and parameters: {'n_layers_yyx': 1, 'hidden_size_yyx_l0': 5, 'context_size_yyx': 1, 'num_mix_components_yyx': 5, 'context_extractor_yyx': 'gru', 'activation_func_yyx': 'ReLU', 'L2_weight_yyx': 8.511168297265105e-06, 'L_entropy_weight_yyx': 1.201569237423021e-06, 'L_sep_weight_yyx': 7.670472164147958e-05, 'L_scale_weight_yyx': 1.2292319108527391e-06, 'learning_rate_yyx': 0.0018048000679584664}. Best is trial 1 with value: -1.8555367853768732.
[I 2026-03-18 21:15:34,584] Trial 33 pruned. 
[I 2026-03-18 21:15:35,938] Trial 28 finished with value: -1.441301165886645 and parameters: {'n_layers_yyx': 1, 'hidden_size_yyx_l0': 5, 'context_size_yyx': 4, 'num_mix_components_yyx': 5, 'context_extractor_yyx': 'lstm', 'activation_func_yyx': 'Tanh', 'L2_weight_yyx': 5.329908738192594e-08, 'L_entropy_weight_yyx': 3.5328166547787174e-07, 'L_sep_weight_yyx': 0.00019910373378909, 'L_scale_weight_yyx': 1.0289419315249551e-09, 'learning_rate_yyx': 0.005558729865736019}. Best is trial 24 with value: -1.4518791534615763.
[I 2026-03-18 21:15:39,467] Trial 20 pruned. 
[I 2026-03-18 21:15:42,107] Trial 25 pruned. 
[I 2026-03-18 21:15:53,364] Trial 34 pruned. 
[I 2026-03-18 21:15:54,502] Trial 31 finished with value: -1.8475551865408577 and parameters: {'n_layers_yyx': 2, 'hidden_size_yyx_l0': 2, 'hidden_size_yyx_l1': 4, 'context_size_yyx': 3, 'num_mix_components_yyx': 5, 'context_extractor_yyx': 'lstm', 'activation_func_yyx': 'GELU', 'L2_weight_yyx': 2.009824318686866e-08, 'L_entropy_weight_yyx': 0.00011962433524349153, 'L_sep_weight_yyx': 5.4470352474587886e-05, 'L_scale_weight_yyx': 9.409896719318955e-08, 'learning_rate_yyx': 0.008833039386984431}. Best is trial 16 with value: -1.8488733665890609.
[I 2026-03-18 21:15:55,144] Trial 23 pruned. 
[I 2026-03-18 21:16:03,200] Trial 24 pruned. 
[I 2026-03-18 21:16:04,800] Trial 27 pruned. 
[I 2026-03-18 21:16:11,490] Trial 35 pruned. 
[I 2026-03-18 21:16:12,756] Trial 27 pruned. 
[I 2026-03-18 21:16:13,164] Trial 24 pruned. 
[I 2026-03-18 21:16:13,910] Trial 20 finished with value: -1.8913814712893404 and parameters: {'n_layers_yyx': 2, 'hidden_size_yyx_l0': 4, 'hidden_size_yyx_l1': 3, 'context_size_yyx': 1, 'num_mix_components_yyx': 5, 'context_extractor_yyx': 'lstm', 'activation_func_yyx': 'Tanh', 'L2_weight_yyx': 3.2239119857131843e-06, 'L_entropy_weight_yyx': 3.9832392550485443e-08, 'L_sep_weight_yyx': 9.98646422895726e-08, 'L_scale_weight_yyx': 9.239445853213966e-05, 'learning_rate_yyx': 0.006431086847738502}. Best is trial 5 with value: -1.89157565728699.
[I 2026-03-18 21:16:15,876] Trial 21 pruned. 
[I 2026-03-18 21:16:21,629] Trial 26 pruned. 
[I 2026-03-18 21:16:22,906] Trial 28 pruned. 
[I 2026-03-18 21:16:25,009] Trial 30 finished with value: -1.4419484299879808 and parameters: {'n_layers_yyx': 2, 'hidden_size_yyx_l0': 3, 'hidden_size_yyx_l1': 4, 'context_size_yyx': 2, 'num_mix_components_yyx': 4, 'context_extractor_yyx': 'lstm', 'activation_func_yyx': 'Tanh', 'L2_weight_yyx': 5.129208561202034e-10, 'L_entropy_weight_yyx': 1.374554662608421e-09, 'L_sep_weight_yyx': 9.496748691557965e-05, 'L_scale_weight_yyx': 1.4974050355587963e-08, 'learning_rate_yyx': 0.004563052357284242}. Best is trial 19 with value: -1.4628589806189904.
[I 2026-03-18 21:16:25,628] Trial 31 finished with value: -1.4651866736778847 and parameters: {'n_layers_yyx': 1, 'hidden_size_yyx_l0': 4, 'context_size_yyx': 4, 'num_mix_components_yyx': 5, 'context_extractor_yyx': 'lstm', 'activation_func_yyx': 'Tanh', 'L2_weight_yyx': 0.00019703067079932253, 'L_entropy_weight_yyx': 4.4817326166235604e-07, 'L_sep_weight_yyx': 5.859010639975673e-07, 'L_scale_weight_yyx': 2.215295268339247e-10, 'learning_rate_yyx': 0.008272651449075996}. Best is trial 29 with value: -1.4683670278695913.
[I 2026-03-18 21:16:30,526] Trial 28 pruned. 
[I 2026-03-18 21:16:31,992] Trial 21 pruned. 
[I 2026-03-18 21:16:36,203] Trial 25 pruned. 
[I 2026-03-18 21:16:40,377] Trial 29 pruned. 
[I 2026-03-18 21:16:41,107] Trial 27 pruned. 
[I 2026-03-18 21:16:41,753] Trial 32 pruned. 
[I 2026-03-18 21:16:41,962] Trial 32 pruned. 
[I 2026-03-18 21:16:44,397] Trial 36 pruned. 
[I 2026-03-18 21:16:47,073] Trial 29 pruned. 
[I 2026-03-18 21:16:49,812] Trial 39 finished with value: -1.8021400526109064 and parameters: {'n_layers_yyx': 2, 'hidden_size_yyx_l0': 5, 'hidden_size_yyx_l1': 3, 'context_size_yyx': 4, 'num_mix_components_yyx': 4, 'context_extractor_yyx': 'lstm', 'activation_func_yyx': 'GELU', 'L2_weight_yyx': 0.00024495489273912066, 'L_entropy_weight_yyx': 2.164665690650061e-06, 'L_sep_weight_yyx': 3.8076438261898404e-05, 'L_scale_weight_yyx': 6.030245167720086e-07, 'learning_rate_yyx': 0.006895733681995538}. Best is trial 27 with value: -1.8062570642302185.
[I 2026-03-18 21:16:50,174] Trial 25 pruned. 
[I 2026-03-18 21:16:51,940] Trial 29 pruned. 
[I 2026-03-18 21:16:56,666] Trial 19 finished with value: -1.7803325737847222 and parameters: {'n_layers_yyx': 2, 'hidden_size_yyx_l0': 3, 'hidden_size_yyx_l1': 5, 'context_size_yyx': 4, 'num_mix_components_yyx': 4, 'context_extractor_yyx': 'lstm', 'activation_func_yyx': 'ReLU', 'L2_weight_yyx': 9.73777358307183e-09, 'L_entropy_weight_yyx': 2.3172035470081327e-05, 'L_sep_weight_yyx': 3.6188389951269947e-10, 'L_scale_weight_yyx': 4.0809521919340084e-05, 'learning_rate_yyx': 0.004269777476149918}. Best is trial 7 with value: -1.7817573439472854.
[I 2026-03-18 21:16:59,969] Trial 33 pruned. 
[I 2026-03-18 21:17:02,361] Trial 37 pruned. 
[I 2026-03-18 21:17:08,789] Trial 26 pruned. 
