[I 2026-03-18 18:27:30,274] Trial 41 finished with value: -1.2650295969739198 and parameters: {'n_layers_yyx': 2, 'hidden_size_yyx_l0': 3, 'hidden_size_yyx_l1': 6, 'context_size_yyx': 4, 'num_mix_components_yyx': 3, 'context_extractor_yyx': 'lstm', 'activation_func_yyx': 'Tanh', 'L2_weight_yyx': 8.302766264947375e-05, 'L_entropy_weight_yyx': 2.9406716828412776e-08, 'L_sep_weight_yyx': 5.389668874634457e-09, 'L_scale_weight_yyx': 1.5991174543107715e-07, 'learning_rate_yyx': 0.00653429623859114}. Best is trial 7 with value: -1.272066817927052.
[I 2026-03-18 18:27:31,292] Trial 33 pruned. 
[I 2026-03-18 18:27:32,488] Trial 42 pruned. 
[I 2026-03-18 18:27:34,137] Trial 37 pruned. 
[I 2026-03-18 18:27:36,292] Trial 43 pruned. 
[I 2026-03-18 18:27:39,708] Trial 31 finished with value: -3.1526981775525083 and parameters: {'n_layers_yyx': 1, 'hidden_size_yyx_l0': 5, 'context_size_yyx': 4, 'num_mix_components_yyx': 4, 'context_extractor_yyx': 'lstm', 'activation_func_yyx': 'ReLU', 'L2_weight_yyx': 2.6854489991843894e-08, 'L_entropy_weight_yyx': 2.0961374616903907e-09, 'L_sep_weight_yyx': 3.0607398800678235e-07, 'L_scale_weight_yyx': 4.2404684932108627e-10, 'learning_rate_yyx': 0.004533388467614527}. Best is trial 27 with value: -3.161937115338458.
[I 2026-03-18 18:27:41,180] Trial 47 pruned. 
[I 2026-03-18 18:27:45,136] Trial 24 finished with value: -3.123557122214937 and parameters: {'n_layers_yyx': 2, 'hidden_size_yyx_l0': 6, 'hidden_size_yyx_l1': 4, 'context_size_yyx': 4, 'num_mix_components_yyx': 4, 'context_extractor_yyx': 'lstm', 'activation_func_yyx': 'GELU', 'L2_weight_yyx': 4.979865751857353e-10, 'L_entropy_weight_yyx': 2.4771880170949288e-05, 'L_sep_weight_yyx': 1.2351397811005756e-09, 'L_scale_weight_yyx': 0.0004889831783366533, 'learning_rate_yyx': 0.004396072431509379}. Best is trial 5 with value: -3.154335707688014.
[I 2026-03-18 18:27:46,632] Trial 34 pruned. 
[I 2026-03-18 18:27:54,274] Trial 48 pruned. 
[I 2026-03-18 18:28:02,906] Trial 31 pruned. 
[I 2026-03-18 18:28:08,646] Trial 49 pruned. 

Source events: 5634
Target events: 20800
Full model ln_yyx : 324.52495 nats/sec, 14.04194 nats/event
Full model Log loss : -1.26919
Full model ln_yyx : 322.95165 nats/sec, 13.97387 nats/event
Full model Log loss : -1.25947
Full model ln_yyx : 326.09603 nats/sec, 14.10992 nats/event
Full model Log loss : -1.26277
Full model ln_yyx : 324.67449 nats/sec, 14.04842 nats/event
Full model Log loss : -1.25768
Full model ln_yyx : 316.46917 nats/sec, 13.69338 nats/event
Full model Log loss : -1.21598
Full model ln_yyx : 323.87827 nats/sec, 14.01396 nats/event
Full model Log loss : -1.26175
Full model ln_yyx : 321.60824 nats/sec, 13.91574 nats/event
Full model Log loss : -1.23841
Full model ln_yyx : 324.18670 nats/sec, 14.02731 nats/event
Full model Log loss : -1.24341
Full model ln_yyx : 324.62209 nats/sec, 14.04615 nats/event
Full model Log loss : -1.25831
Full model ln_yyx : 325.44114 nats/sec, 14.08159 nats/event
Full model Log loss : -1.26094
Full model ln_yyx : 317.15795 nats/sec, 13.72318 nats/event
Full model Log loss : -1.25581
Full model ln_yyx : 321.32227 nats/sec, 13.90337 nats/event
Full model Log loss : -1.24120
Full model ln_yyx : 319.33097 nats/sec, 13.81721 nats/event
Full model Log loss : -1.26719
Full model ln_yyx : 325.71493 nats/sec, 14.09343 nats/event
Full model Log loss : -1.26078
Full model ln_yyx : 320.22372 nats/sec, 13.85583 nats/event
Full model Log loss : -1.25592
Full model ln_yyx : 324.05171 nats/sec, 14.02147 nats/event
Full model Log loss : -1.26306
Optimization finished. Config saved to results/opt-full/opt_full_85_best_config.txt
[I 2026-03-18 18:28:08,889] Trial 37 finished with value: -1.2598815748740035 and parameters: {'n_layers_yyx': 1, 'hidden_size_yyx_l0': 5, 'context_size_yyx': 4, 'num_mix_components_yyx': 5, 'context_extractor_yyx': 'gru', 'activation_func_yyx': 'Tanh', 'L2_weight_yyx': 5.065331654482532e-06, 'L_entropy_weight_yyx': 2.1901859514641745e-07, 'L_sep_weight_yyx': 5.6975090073958406e-05, 'L_scale_weight_yyx': 1.761473047079047e-05, 'learning_rate_yyx': 0.008023942955299089}. Best is trial 35 with value: -1.2690898451038297.
[I 2026-03-18 18:28:12,095] Trial 45 pruned. 
[I 2026-03-18 18:28:16,008] Trial 40 finished with value: -3.1211156001021716 and parameters: {'n_layers_yyx': 2, 'hidden_size_yyx_l0': 4, 'hidden_size_yyx_l1': 6, 'context_size_yyx': 4, 'num_mix_components_yyx': 4, 'context_extractor_yyx': 'lstm', 'activation_func_yyx': 'GELU', 'L2_weight_yyx': 7.413101969946595e-10, 'L_entropy_weight_yyx': 1.3662266374865622e-05, 'L_sep_weight_yyx': 1.8077643932001363e-08, 'L_scale_weight_yyx': 2.9091438848225385e-10, 'learning_rate_yyx': 0.007725132352644339}. Best is trial 38 with value: -3.150483715419478.
[I 2026-03-18 18:28:17,726] Trial 46 pruned. 
[I 2026-03-18 18:28:21,603] Trial 35 pruned. 
[I 2026-03-18 18:28:25,023] Trial 42 finished with value: -1.2674632046006744 and parameters: {'n_layers_yyx': 2, 'hidden_size_yyx_l0': 3, 'hidden_size_yyx_l1': 6, 'context_size_yyx': 4, 'num_mix_components_yyx': 3, 'context_extractor_yyx': 'lstm', 'activation_func_yyx': 'Tanh', 'L2_weight_yyx': 0.0004487011806714568, 'L_entropy_weight_yyx': 2.174268623127435e-08, 'L_sep_weight_yyx': 5.771226844545607e-09, 'L_scale_weight_yyx': 1.2309386384403454e-07, 'learning_rate_yyx': 0.0068869154886056685}. Best is trial 7 with value: -1.272066817927052.
[I 2026-03-18 18:28:26,557] Trial 33 pruned. 
[I 2026-03-18 18:28:27,188] Trial 47 pruned. 
[I 2026-03-18 18:28:29,574] Trial 34 finished with value: -3.177938465341038 and parameters: {'n_layers_yyx': 2, 'hidden_size_yyx_l0': 6, 'hidden_size_yyx_l1': 4, 'context_size_yyx': 2, 'num_mix_components_yyx': 4, 'context_extractor_yyx': 'lstm', 'activation_func_yyx': 'ReLU', 'L2_weight_yyx': 5.7238424158128005e-06, 'L_entropy_weight_yyx': 1.0256505045924985e-10, 'L_sep_weight_yyx': 2.1093405876780052e-06, 'L_scale_weight_yyx': 4.104477043069502e-06, 'learning_rate_yyx': 0.005001842314962581}. Best is trial 12 with value: -3.1893335216865584.
[I 2026-03-18 18:28:37,825] Trial 38 pruned. 
[I 2026-03-18 18:28:38,336] Trial 48 pruned. 
[I 2026-03-18 18:28:44,129] Trial 35 pruned. 
[I 2026-03-18 18:28:44,154] Trial 39 pruned. 
[I 2026-03-18 18:28:44,510] Trial 49 pruned. 

Source events: 5634
Target events: 3403
Full model ln_yyx : 53.33848 nats/sec, 14.10656 nats/event
Full model Log loss : -1.27473
Full model ln_yyx : 53.37241 nats/sec, 14.11554 nats/event
Full model Log loss : -1.23708
Full model ln_yyx : 53.13816 nats/sec, 14.05358 nats/event
Full model Log loss : -1.28048
Full model ln_yyx : 53.43137 nats/sec, 14.13113 nats/event
Full model Log loss : -1.27104
Full model ln_yyx : 53.38071 nats/sec, 14.11773 nats/event
Full model Log loss : -1.23965
Full model ln_yyx : 53.53849 nats/sec, 14.15946 nats/event
Full model Log loss : -1.26403
Full model ln_yyx : 53.02771 nats/sec, 14.02437 nats/event
Full model Log loss : -1.27359
Full model ln_yyx : 53.37245 nats/sec, 14.11555 nats/event
Full model Log loss : -1.24521
Full model ln_yyx : 53.29464 nats/sec, 14.09497 nats/event
Full model Log loss : -1.27495
Full model ln_yyx : 53.08869 nats/sec, 14.04050 nats/event
Full model Log loss : -1.27613
Full model ln_yyx : 54.14999 nats/sec, 14.32118 nats/event
Full model Log loss : -1.27297
Full model ln_yyx : 52.34518 nats/sec, 13.84386 nats/event
Full model Log loss : -1.23600
Full model ln_yyx : 53.57432 nats/sec, 14.16894 nats/event
Full model Log loss : -1.26966
Optimization finished. Config saved to results/opt-full/opt_full_88_best_config.txt
[I 2026-03-18 18:28:45,043] Trial 23 finished with value: -3.1483040614653537 and parameters: {'n_layers_yyx': 2, 'hidden_size_yyx_l0': 6, 'hidden_size_yyx_l1': 5, 'context_size_yyx': 2, 'num_mix_components_yyx': 4, 'context_extractor_yyx': 'gru', 'activation_func_yyx': 'Tanh', 'L2_weight_yyx': 1.1320365310465228e-06, 'L_entropy_weight_yyx': 7.25291749514278e-05, 'L_sep_weight_yyx': 4.353736792992395e-10, 'L_scale_weight_yyx': 0.00015357807190517872, 'learning_rate_yyx': 0.00810065409344946}. Best is trial 10 with value: -3.1515199681211117.
[I 2026-03-18 18:28:47,482] Trial 37 pruned. 
[I 2026-03-18 18:28:54,928] Trial 36 pruned. 
[I 2026-03-18 18:28:56,625] Trial 40 pruned. 
[I 2026-03-18 18:28:57,730] Trial 25 finished with value: -3.122093316772103 and parameters: {'n_layers_yyx': 2, 'hidden_size_yyx_l0': 5, 'hidden_size_yyx_l1': 5, 'context_size_yyx': 4, 'num_mix_components_yyx': 3, 'context_extractor_yyx': 'lstm', 'activation_func_yyx': 'GELU', 'L2_weight_yyx': 9.805916581811389e-08, 'L_entropy_weight_yyx': 7.012260226330375e-05, 'L_sep_weight_yyx': 1.0140138059687608e-07, 'L_scale_weight_yyx': 0.0001222241580083817, 'learning_rate_yyx': 0.00732522874751257}. Best is trial 5 with value: -3.154335707688014.
[I 2026-03-18 18:28:58,240] Trial 36 pruned. 
[I 2026-03-18 18:28:59,623] Trial 24 pruned. 
[I 2026-03-18 18:29:01,635] Trial 41 pruned. 
[I 2026-03-18 18:29:03,532] Trial 38 pruned. 
[I 2026-03-18 18:29:05,495] Trial 32 finished with value: -3.149617939155522 and parameters: {'n_layers_yyx': 1, 'hidden_size_yyx_l0': 2, 'context_size_yyx': 4, 'num_mix_components_yyx': 3, 'context_extractor_yyx': 'gru', 'activation_func_yyx': 'GELU', 'L2_weight_yyx': 6.570460347070112e-07, 'L_entropy_weight_yyx': 0.00027959410515639957, 'L_sep_weight_yyx': 1.4827586282007568e-05, 'L_scale_weight_yyx': 5.885737938454234e-06, 'learning_rate_yyx': 0.00829954114702393}. Best is trial 1 with value: -3.152505646630136.
[I 2026-03-18 18:29:06,890] Trial 32 finished with value: -3.152691255681953 and parameters: {'n_layers_yyx': 1, 'hidden_size_yyx_l0': 5, 'context_size_yyx': 4, 'num_mix_components_yyx': 4, 'context_extractor_yyx': 'lstm', 'activation_func_yyx': 'ReLU', 'L2_weight_yyx': 2.892123529895046e-08, 'L_entropy_weight_yyx': 4.034204445930879e-09, 'L_sep_weight_yyx': 5.768410370668037e-07, 'L_scale_weight_yyx': 4.3902459755301086e-10, 'learning_rate_yyx': 0.004524719977489017}. Best is trial 27 with value: -3.161937115338458.
[I 2026-03-18 18:29:07,838] Trial 42 pruned. 
[I 2026-03-18 18:29:11,395] Trial 37 pruned. 
[I 2026-03-18 18:29:11,423] Trial 26 pruned. 
[I 2026-03-18 18:29:12,710] Trial 43 finished with value: -1.2620537241373397 and parameters: {'n_layers_yyx': 2, 'hidden_size_yyx_l0': 3, 'hidden_size_yyx_l1': 6, 'context_size_yyx': 4, 'num_mix_components_yyx': 4, 'context_extractor_yyx': 'lstm', 'activation_func_yyx': 'Tanh', 'L2_weight_yyx': 0.0005094729463090838, 'L_entropy_weight_yyx': 2.347207443285509e-10, 'L_sep_weight_yyx': 2.9028811131011804e-08, 'L_scale_weight_yyx': 1.5884428661077364e-07, 'learning_rate_yyx': 0.0048491011777576}. Best is trial 7 with value: -1.272066817927052.
[I 2026-03-18 18:29:13,650] Trial 43 pruned. 
[I 2026-03-18 18:29:13,688] Trial 25 pruned. 
[I 2026-03-18 18:29:14,432] Trial 38 pruned. 
[I 2026-03-18 18:29:15,592] Trial 32 finished with value: -3.164821850015868 and parameters: {'n_layers_yyx': 1, 'hidden_size_yyx_l0': 4, 'context_size_yyx': 3, 'num_mix_components_yyx': 3, 'context_extractor_yyx': 'lstm', 'activation_func_yyx': 'GELU', 'L2_weight_yyx': 4.93959387607835e-09, 'L_entropy_weight_yyx': 9.449773162474229e-08, 'L_sep_weight_yyx': 2.776773461139437e-05, 'L_scale_weight_yyx': 0.00021931626081980296, 'learning_rate_yyx': 0.007016319464827085}. Best is trial 1 with value: -3.166268711244678.
[I 2026-03-18 18:29:17,494] Trial 44 pruned. 
[I 2026-03-18 18:29:18,596] Trial 33 pruned. 
[I 2026-03-18 18:29:19,521] Trial 41 finished with value: -3.121166602870972 and parameters: {'n_layers_yyx': 2, 'hidden_size_yyx_l0': 4, 'hidden_size_yyx_l1': 6, 'context_size_yyx': 4, 'num_mix_components_yyx': 4, 'context_extractor_yyx': 'lstm', 'activation_func_yyx': 'GELU', 'L2_weight_yyx': 1.5203329305815236e-09, 'L_entropy_weight_yyx': 1.0921547065626179e-05, 'L_sep_weight_yyx': 1.7273976291297018e-08, 'L_scale_weight_yyx': 2.877952281039386e-10, 'learning_rate_yyx': 0.007986877604770128}. Best is trial 38 with value: -3.150483715419478.
[I 2026-03-18 18:29:21,553] Trial 39 pruned. 
[I 2026-03-18 18:29:26,075] Trial 44 finished with value: -3.1487585351285983 and parameters: {'n_layers_yyx': 1, 'hidden_size_yyx_l0': 4, 'context_size_yyx': 4, 'num_mix_components_yyx': 1, 'context_extractor_yyx': 'lstm', 'activation_func_yyx': 'ReLU', 'L2_weight_yyx': 5.691061249075085e-10, 'L_entropy_weight_yyx': 9.015604299843092e-05, 'L_sep_weight_yyx': 3.911572639213647e-09, 'L_scale_weight_yyx': 2.6871977054698067e-06, 'learning_rate_yyx': 0.007846471764323498}. Best is trial 16 with value: -3.149974272486285.
[I 2026-03-18 18:29:30,155] Trial 40 pruned. 
[I 2026-03-18 18:29:31,406] Trial 31 finished with value: -3.152288935170318 and parameters: {'n_layers_yyx': 2, 'hidden_size_yyx_l0': 6, 'hidden_size_yyx_l1': 4, 'context_size_yyx': 4, 'num_mix_components_yyx': 5, 'context_extractor_yyx': 'lstm', 'activation_func_yyx': 'GELU', 'L2_weight_yyx': 6.05508841879813e-05, 'L_entropy_weight_yyx': 9.124347488528193e-10, 'L_sep_weight_yyx': 4.03780897646341e-06, 'L_scale_weight_yyx': 1.3897078944657188e-10, 'learning_rate_yyx': 0.004237226659536618}. Best is trial 25 with value: -3.152748146031954.
[I 2026-03-18 18:29:38,794] Trial 34 finished with value: -3.1178895797679154 and parameters: {'n_layers_yyx': 2, 'hidden_size_yyx_l0': 6, 'hidden_size_yyx_l1': 5, 'context_size_yyx': 3, 'num_mix_components_yyx': 4, 'context_extractor_yyx': 'lstm', 'activation_func_yyx': 'Tanh', 'L2_weight_yyx': 4.988309408948577e-10, 'L_entropy_weight_yyx': 1.6529854965197143e-07, 'L_sep_weight_yyx': 0.00018561964869286826, 'L_scale_weight_yyx': 1.5003844642607223e-06, 'learning_rate_yyx': 0.00478027766066552}. Best is trial 2 with value: -3.151229652723366.
[I 2026-03-18 18:29:40,094] Trial 45 pruned. 
[I 2026-03-18 18:29:41,930] Trial 45 pruned. 
[I 2026-03-18 18:29:42,130] Trial 38 pruned. 
[I 2026-03-18 18:29:42,683] Trial 43 finished with value: -3.150101785488062 and parameters: {'n_layers_yyx': 2, 'hidden_size_yyx_l0': 4, 'hidden_size_yyx_l1': 4, 'context_size_yyx': 4, 'num_mix_components_yyx': 5, 'context_extractor_yyx': 'lstm', 'activation_func_yyx': 'Tanh', 'L2_weight_yyx': 8.322464212257336e-07, 'L_entropy_weight_yyx': 4.5029950094244463e-07, 'L_sep_weight_yyx': 2.1386533222093938e-09, 'L_scale_weight_yyx': 2.238016509338195e-07, 'learning_rate_yyx': 0.009870476368147299}. Best is trial 41 with value: -3.153552668454499.
[I 2026-03-18 18:29:44,905] Trial 44 finished with value: -1.2639149790991255 and parameters: {'n_layers_yyx': 2, 'hidden_size_yyx_l0': 5, 'hidden_size_yyx_l1': 6, 'context_size_yyx': 4, 'num_mix_components_yyx': 3, 'context_extractor_yyx': 'lstm', 'activation_func_yyx': 'Tanh', 'L2_weight_yyx': 0.00012385932847350803, 'L_entropy_weight_yyx': 0.0001119211551568083, 'L_sep_weight_yyx': 1.234857622861639e-09, 'L_scale_weight_yyx': 2.194243590218439e-06, 'learning_rate_yyx': 0.009774428518978221}. Best is trial 7 with value: -1.272066817927052.
[I 2026-03-18 18:29:46,477] Trial 33 pruned. 
[I 2026-03-18 18:29:50,094] Trial 40 finished with value: -3.156214824643544 and parameters: {'n_layers_yyx': 1, 'hidden_size_yyx_l0': 5, 'context_size_yyx': 3, 'num_mix_components_yyx': 5, 'context_extractor_yyx': 'gru', 'activation_func_yyx': 'GELU', 'L2_weight_yyx': 1.550412206091032e-09, 'L_entropy_weight_yyx': 1.2923013355331717e-09, 'L_sep_weight_yyx': 4.2919482692018404e-08, 'L_scale_weight_yyx': 7.1253541812959695e-06, 'learning_rate_yyx': 0.0054488959668572865}. Best is trial 10 with value: -3.1611070918248854.
[I 2026-03-18 18:29:52,817] Trial 35 pruned. 
[I 2026-03-18 18:29:53,810] Trial 46 pruned. 
[I 2026-03-18 18:30:00,949] Trial 34 pruned. 
[I 2026-03-18 18:30:03,201] Trial 32 pruned. 
[I 2026-03-18 18:30:03,208] Trial 32 finished with value: -3.148924282322955 and parameters: {'n_layers_yyx': 1, 'hidden_size_yyx_l0': 3, 'context_size_yyx': 4, 'num_mix_components_yyx': 3, 'context_extractor_yyx': 'lstm', 'activation_func_yyx': 'GELU', 'L2_weight_yyx': 1.203951266852302e-08, 'L_entropy_weight_yyx': 3.072313075186553e-05, 'L_sep_weight_yyx': 1.5458782463419252e-07, 'L_scale_weight_yyx': 1.4935467654420168e-09, 'learning_rate_yyx': 0.004270501780593715}. Best is trial 24 with value: -3.1533369159995748.
[I 2026-03-18 18:30:11,243] Trial 39 finished with value: -3.1223412104232735 and parameters: {'n_layers_yyx': 2, 'hidden_size_yyx_l0': 6, 'hidden_size_yyx_l1': 6, 'context_size_yyx': 1, 'num_mix_components_yyx': 2, 'context_extractor_yyx': 'lstm', 'activation_func_yyx': 'GELU', 'L2_weight_yyx': 3.172444457295822e-05, 'L_entropy_weight_yyx': 1.4742759965914802e-05, 'L_sep_weight_yyx': 5.84723289816971e-10, 'L_scale_weight_yyx': 1.1410547248949433e-08, 'learning_rate_yyx': 0.0059201160665848405}. Best is trial 12 with value: -3.1682013088461884.
[I 2026-03-18 18:30:12,673] Trial 27 finished with value: -3.1159970808340125 and parameters: {'n_layers_yyx': 2, 'hidden_size_yyx_l0': 5, 'hidden_size_yyx_l1': 4, 'context_size_yyx': 4, 'num_mix_components_yyx': 2, 'context_extractor_yyx': 'lstm', 'activation_func_yyx': 'GELU', 'L2_weight_yyx': 8.811221705753778e-07, 'L_entropy_weight_yyx': 5.125530491616716e-08, 'L_sep_weight_yyx': 1.2081827551580945e-09, 'L_scale_weight_yyx': 2.1083485727045287e-05, 'learning_rate_yyx': 0.0034234237239000524}. Best is trial 5 with value: -3.154335707688014.
[I 2026-03-18 18:30:15,964] Trial 39 pruned. 
[I 2026-03-18 18:30:22,218] Trial 36 pruned. 
[I 2026-03-18 18:30:24,183] Trial 47 pruned. 
[I 2026-03-18 18:30:24,899] Trial 40 pruned. 
[I 2026-03-18 18:30:27,749] Trial 41 finished with value: -1.2662710517699969 and parameters: {'n_layers_yyx': 1, 'hidden_size_yyx_l0': 6, 'context_size_yyx': 4, 'num_mix_components_yyx': 3, 'context_extractor_yyx': 'gru', 'activation_func_yyx': 'Tanh', 'L2_weight_yyx': 3.54892964038309e-05, 'L_entropy_weight_yyx': 4.137638140359672e-06, 'L_sep_weight_yyx': 1.2956810281054994e-08, 'L_scale_weight_yyx': 2.9415574802201194e-10, 'learning_rate_yyx': 0.008393270163754928}. Best is trial 24 with value: -1.2727326976613946.
[I 2026-03-18 18:30:28,485] Trial 37 finished with value: -3.1196453235154555 and parameters: {'n_layers_yyx': 1, 'hidden_size_yyx_l0': 4, 'context_size_yyx': 4, 'num_mix_components_yyx': 3, 'context_extractor_yyx': 'lstm', 'activation_func_yyx': 'ReLU', 'L2_weight_yyx': 0.00018553624115964323, 'L_entropy_weight_yyx': 1.0512148793733054e-09, 'L_sep_weight_yyx': 5.126696570681719e-07, 'L_scale_weight_yyx': 1.1895235439104742e-08, 'learning_rate_yyx': 0.005206675793714545}. Best is trial 23 with value: -3.1545382986021053.
[I 2026-03-18 18:30:29,610] Trial 40 pruned. 
[I 2026-03-18 18:30:31,041] Trial 45 finished with value: -1.2672393855237696 and parameters: {'n_layers_yyx': 2, 'hidden_size_yyx_l0': 3, 'hidden_size_yyx_l1': 6, 'context_size_yyx': 4, 'num_mix_components_yyx': 3, 'context_extractor_yyx': 'lstm', 'activation_func_yyx': 'Tanh', 'L2_weight_yyx': 0.0004682536943381892, 'L_entropy_weight_yyx': 8.862604050402872e-10, 'L_sep_weight_yyx': 0.0009183774052531282, 'L_scale_weight_yyx': 3.389788585674561e-07, 'learning_rate_yyx': 0.006632506056861727}. Best is trial 7 with value: -1.272066817927052.
[I 2026-03-18 18:30:34,314] Trial 35 pruned. 
[I 2026-03-18 18:30:37,088] Trial 33 pruned. 
[I 2026-03-18 18:30:38,840] Trial 42 pruned. 
[I 2026-03-18 18:30:40,039] Trial 26 pruned. 
[I 2026-03-18 18:30:41,051] Trial 46 finished with value: -1.2379338798593462 and parameters: {'n_layers_yyx': 1, 'hidden_size_yyx_l0': 5, 'context_size_yyx': 1, 'num_mix_components_yyx': 4, 'context_extractor_yyx': 'lstm', 'activation_func_yyx': 'Tanh', 'L2_weight_yyx': 1.0430340373760698e-06, 'L_entropy_weight_yyx': 7.714321633622625e-10, 'L_sep_weight_yyx': 2.1282674718667856e-06, 'L_scale_weight_yyx': 1.863527011200926e-06, 'learning_rate_yyx': 0.008619885596892992}. Best is trial 35 with value: -1.2690898451038297.
[I 2026-03-18 18:30:47,484] Trial 47 pruned. 
[I 2026-03-18 18:30:48,408] Trial 36 pruned. 
[I 2026-03-18 18:30:48,600] Trial 42 finished with value: -3.1501613313869656 and parameters: {'n_layers_yyx': 2, 'hidden_size_yyx_l0': 3, 'hidden_size_yyx_l1': 6, 'context_size_yyx': 4, 'num_mix_components_yyx': 5, 'context_extractor_yyx': 'lstm', 'activation_func_yyx': 'GELU', 'L2_weight_yyx': 2.2383165590466154e-09, 'L_entropy_weight_yyx': 0.00015114219638281943, 'L_sep_weight_yyx': 2.3554586080696986e-09, 'L_scale_weight_yyx': 1.4059259595032695e-10, 'learning_rate_yyx': 0.009798543497525047}. Best is trial 38 with value: -3.150483715419478.
[I 2026-03-18 18:30:53,641] Trial 37 pruned. 
[I 2026-03-18 18:30:56,627] Trial 48 pruned. 
[I 2026-03-18 18:30:58,241] Trial 46 pruned. 
[I 2026-03-18 18:30:59,899] Trial 38 pruned. 
[I 2026-03-18 18:31:00,048] Trial 44 finished with value: -3.147773415403743 and parameters: {'n_layers_yyx': 2, 'hidden_size_yyx_l0': 4, 'hidden_size_yyx_l1': 4, 'context_size_yyx': 4, 'num_mix_components_yyx': 4, 'context_extractor_yyx': 'lstm', 'activation_func_yyx': 'Tanh', 'L2_weight_yyx': 7.345989581360199e-07, 'L_entropy_weight_yyx': 4.253560502534049e-07, 'L_sep_weight_yyx': 7.514509712375585e-09, 'L_scale_weight_yyx': 2.9888535368563376e-07, 'learning_rate_yyx': 0.009970590673595008}. Best is trial 41 with value: -3.153552668454499.
[I 2026-03-18 18:31:00,324] Trial 33 finished with value: -3.1555053664637365 and parameters: {'n_layers_yyx': 1, 'hidden_size_yyx_l0': 5, 'context_size_yyx': 4, 'num_mix_components_yyx': 3, 'context_extractor_yyx': 'lstm', 'activation_func_yyx': 'ReLU', 'L2_weight_yyx': 1.0376529964464755e-09, 'L_entropy_weight_yyx': 1.2420148527099254e-09, 'L_sep_weight_yyx': 1.9179488145963578e-07, 'L_scale_weight_yyx': 1.2384765573487238e-09, 'learning_rate_yyx': 0.006323498208903641}. Best is trial 27 with value: -3.161937115338458.
[I 2026-03-18 18:31:07,203] Trial 38 pruned. 
