[I 2026-03-18 18:31:08,097] Trial 41 finished with value: -3.1552868514378445 and parameters: {'n_layers_yyx': 2, 'hidden_size_yyx_l0': 6, 'hidden_size_yyx_l1': 5, 'context_size_yyx': 3, 'num_mix_components_yyx': 5, 'context_extractor_yyx': 'gru', 'activation_func_yyx': 'Tanh', 'L2_weight_yyx': 1.2812216291260688e-08, 'L_entropy_weight_yyx': 3.668012695252301e-10, 'L_sep_weight_yyx': 2.3169025232037117e-08, 'L_scale_weight_yyx': 2.050849331255132e-07, 'learning_rate_yyx': 0.00819527857517914}. Best is trial 10 with value: -3.1611070918248854.
[I 2026-03-18 18:31:09,853] Trial 49 pruned. 

Source events: 54211
Target events: 20800
Full model ln_yyx : 5582.49633 nats/sec, 241.55032 nats/event
Full model Log loss : -3.11453
Full model ln_yyx : 5652.76479 nats/sec, 244.59078 nats/event
Full model Log loss : -3.14782
Full model ln_yyx : 5608.15210 nats/sec, 242.66043 nats/event
Full model Log loss : -3.12099
Full model ln_yyx : 5585.89343 nats/sec, 241.69731 nats/event
Full model Log loss : -3.12328
Full model ln_yyx : 5575.62598 nats/sec, 241.25305 nats/event
Full model Log loss : -3.11810
Full model ln_yyx : 5661.28980 nats/sec, 244.95965 nats/event
Full model Log loss : -3.14997
Full model ln_yyx : 5569.94667 nats/sec, 241.00731 nats/event
Full model Log loss : -3.12031
Full model ln_yyx : 5608.45982 nats/sec, 242.67374 nats/event
Full model Log loss : -3.12223
Full model ln_yyx : 5638.58114 nats/sec, 243.97707 nats/event
Full model Log loss : -3.14815
Full model ln_yyx : 5588.08131 nats/sec, 241.79198 nats/event
Full model Log loss : -3.12287
Full model ln_yyx : 5626.32558 nats/sec, 243.44678 nats/event
Full model Log loss : -3.14817
Full model ln_yyx : 5579.55528 nats/sec, 241.42307 nats/event
Full model Log loss : -3.12173
Full model ln_yyx : 5601.52288 nats/sec, 242.37359 nats/event
Full model Log loss : -3.12365
Full model ln_yyx : 5603.19115 nats/sec, 242.44577 nats/event
Full model Log loss : -3.12346
Full model ln_yyx : 5654.15056 nats/sec, 244.65075 nats/event
Full model Log loss : -3.14876
Optimization finished. Config saved to results/opt-full/opt_full_68_best_config.txt
[I 2026-03-18 18:31:13,318] Trial 27 pruned. 
[I 2026-03-18 18:31:13,439] Trial 39 pruned. 
[I 2026-03-18 18:31:20,552] Trial 39 pruned. 
[I 2026-03-18 18:31:22,144] Trial 47 pruned. 
[I 2026-03-18 18:31:33,098] Trial 45 pruned. 
[I 2026-03-18 18:31:39,273] Trial 43 finished with value: -1.274106926486144 and parameters: {'n_layers_yyx': 1, 'hidden_size_yyx_l0': 6, 'context_size_yyx': 4, 'num_mix_components_yyx': 3, 'context_extractor_yyx': 'gru', 'activation_func_yyx': 'Tanh', 'L2_weight_yyx': 0.0009612395851958068, 'L_entropy_weight_yyx': 1.8342095761645655e-05, 'L_sep_weight_yyx': 2.3023159011488483e-09, 'L_scale_weight_yyx': 1.1998696096279648e-09, 'learning_rate_yyx': 0.008567779628626258}. Best is trial 43 with value: -1.274106926486144.
[I 2026-03-18 18:31:44,036] Trial 40 pruned. 
[I 2026-03-18 18:31:45,766] Trial 28 pruned. 
[I 2026-03-18 18:31:50,015] Trial 44 pruned. 
[I 2026-03-18 18:31:51,700] Trial 41 pruned. 
[I 2026-03-18 18:31:52,978] Trial 33 finished with value: -3.150847695286721 and parameters: {'n_layers_yyx': 2, 'hidden_size_yyx_l0': 6, 'hidden_size_yyx_l1': 4, 'context_size_yyx': 4, 'num_mix_components_yyx': 5, 'context_extractor_yyx': 'lstm', 'activation_func_yyx': 'GELU', 'L2_weight_yyx': 1.3133218059796388e-05, 'L_entropy_weight_yyx': 2.0999948165005525e-08, 'L_sep_weight_yyx': 2.5960125362734607e-06, 'L_scale_weight_yyx': 1.2586475632419757e-09, 'learning_rate_yyx': 0.0053866789936077185}. Best is trial 25 with value: -3.152748146031954.
[I 2026-03-18 18:32:01,381] Trial 48 finished with value: -1.2631503614612516 and parameters: {'n_layers_yyx': 2, 'hidden_size_yyx_l0': 4, 'hidden_size_yyx_l1': 5, 'context_size_yyx': 3, 'num_mix_components_yyx': 4, 'context_extractor_yyx': 'lstm', 'activation_func_yyx': 'GELU', 'L2_weight_yyx': 1.2534776381143822e-08, 'L_entropy_weight_yyx': 8.280463081114882e-09, 'L_sep_weight_yyx': 4.224626067090025e-06, 'L_scale_weight_yyx': 1.248930817077974e-08, 'learning_rate_yyx': 0.005489558618230139}. Best is trial 35 with value: -1.2690898451038297.
[I 2026-03-18 18:32:02,401] Trial 34 pruned. 
[I 2026-03-18 18:32:04,721] Trial 46 pruned. 
[I 2026-03-18 18:32:11,573] Trial 37 pruned. 
[I 2026-03-18 18:32:11,869] Trial 41 finished with value: -3.1809034167777 and parameters: {'n_layers_yyx': 2, 'hidden_size_yyx_l0': 6, 'hidden_size_yyx_l1': 5, 'context_size_yyx': 2, 'num_mix_components_yyx': 5, 'context_extractor_yyx': 'lstm', 'activation_func_yyx': 'ReLU', 'L2_weight_yyx': 6.531649147876468e-05, 'L_entropy_weight_yyx': 2.8524920932238204e-10, 'L_sep_weight_yyx': 5.084568339797301e-06, 'L_scale_weight_yyx': 1.0953280270086895e-05, 'learning_rate_yyx': 0.004902205388307372}. Best is trial 12 with value: -3.1893335216865584.
[I 2026-03-18 18:32:12,456] Trial 49 pruned. 

Source events: 5634
Target events: 40082
Full model ln_yyx : 619.12893 nats/sec, 13.90190 nats/event
Full model Log loss : -1.22994
Full model ln_yyx : 619.46296 nats/sec, 13.90940 nats/event
Full model Log loss : -1.23147
Full model ln_yyx : 627.12424 nats/sec, 14.08143 nats/event
Full model Log loss : -1.24405
Full model ln_yyx : 627.17973 nats/sec, 14.08267 nats/event
Full model Log loss : -1.25337
Full model ln_yyx : 627.55641 nats/sec, 14.09113 nats/event
Full model Log loss : -1.25866
Full model ln_yyx : 620.06472 nats/sec, 13.92291 nats/event
Full model Log loss : -1.26286
Full model ln_yyx : 626.78000 nats/sec, 14.07370 nats/event
Full model Log loss : -1.26381
Full model ln_yyx : 633.00070 nats/sec, 14.21338 nats/event
Full model Log loss : -1.25138
Full model ln_yyx : 607.18343 nats/sec, 13.63368 nats/event
Full model Log loss : -1.15984
Full model ln_yyx : 630.62662 nats/sec, 14.16007 nats/event
Full model Log loss : -1.26726
Full model ln_yyx : 628.71944 nats/sec, 14.11725 nats/event
Full model Log loss : -1.26523
Full model ln_yyx : 628.17337 nats/sec, 14.10499 nats/event
Full model Log loss : -1.26224
Full model ln_yyx : 632.04909 nats/sec, 14.19201 nats/event
Full model Log loss : -1.26855
Full model ln_yyx : 627.06954 nats/sec, 14.08020 nats/event
Full model Log loss : -1.26573
Full model ln_yyx : 628.99674 nats/sec, 14.12347 nats/event
Full model Log loss : -1.25386
Full model ln_yyx : 631.81876 nats/sec, 14.18684 nats/event
Full model Log loss : -1.26909
Full model ln_yyx : 628.62569 nats/sec, 14.11514 nats/event
Full model Log loss : -1.26510
Full model ln_yyx : 629.87363 nats/sec, 14.14316 nats/event
Full model Log loss : -1.25988
Full model ln_yyx : 620.32292 nats/sec, 13.92871 nats/event
Full model Log loss : -1.23793
Full model ln_yyx : 611.56716 nats/sec, 13.73211 nats/event
Full model Log loss : -1.26315
Optimization finished. Config saved to results/opt-full/opt_full_90_best_config.txt
[I 2026-03-18 18:32:13,668] Trial 34 finished with value: -3.139128288285599 and parameters: {'n_layers_yyx': 1, 'hidden_size_yyx_l0': 2, 'context_size_yyx': 4, 'num_mix_components_yyx': 4, 'context_extractor_yyx': 'gru', 'activation_func_yyx': 'GELU', 'L2_weight_yyx': 1.1882220671231379e-05, 'L_entropy_weight_yyx': 3.290303411646247e-09, 'L_sep_weight_yyx': 1.5079713408677652e-08, 'L_scale_weight_yyx': 3.7704321415488183e-07, 'learning_rate_yyx': 0.001342592993023386}. Best is trial 1 with value: -3.152505646630136.
[I 2026-03-18 18:32:14,855] Trial 28 finished with value: -3.1511555112790615 and parameters: {'n_layers_yyx': 2, 'hidden_size_yyx_l0': 6, 'hidden_size_yyx_l1': 3, 'context_size_yyx': 4, 'num_mix_components_yyx': 4, 'context_extractor_yyx': 'lstm', 'activation_func_yyx': 'GELU', 'L2_weight_yyx': 1.6431396660931776e-07, 'L_entropy_weight_yyx': 8.74731290351654e-06, 'L_sep_weight_yyx': 5.8357745080073674e-09, 'L_scale_weight_yyx': 4.304111118211702e-06, 'learning_rate_yyx': 0.005026772305288282}. Best is trial 5 with value: -3.154335707688014.
[I 2026-03-18 18:32:15,873] Trial 35 pruned. 
[I 2026-03-18 18:32:19,039] Trial 34 pruned. 
[I 2026-03-18 18:32:19,149] Trial 48 finished with value: -1.2737957219319511 and parameters: {'n_layers_yyx': 2, 'hidden_size_yyx_l0': 4, 'hidden_size_yyx_l1': 6, 'context_size_yyx': 4, 'num_mix_components_yyx': 4, 'context_extractor_yyx': 'lstm', 'activation_func_yyx': 'GELU', 'L2_weight_yyx': 6.521134542655809e-10, 'L_entropy_weight_yyx': 1.8597778369695933e-10, 'L_sep_weight_yyx': 6.478540957630656e-05, 'L_scale_weight_yyx': 1.1993449388561683e-06, 'learning_rate_yyx': 0.005709114554341207}. Best is trial 48 with value: -1.2737957219319511.
[I 2026-03-18 18:32:21,160] Trial 42 pruned. 
[I 2026-03-18 18:32:24,479] Trial 38 pruned. 
[I 2026-03-18 18:32:28,150] Trial 29 pruned. 
[I 2026-03-18 18:32:28,927] Trial 49 pruned. 

Source events: 5634
Target events: 29032
Full model ln_yyx : 459.89564 nats/sec, 14.25689 nats/event
Full model Log loss : -1.26561
Full model ln_yyx : 439.93666 nats/sec, 13.63816 nats/event
Full model Log loss : -1.14966
Full model ln_yyx : 453.50800 nats/sec, 14.05887 nats/event
Full model Log loss : -1.25254
Full model ln_yyx : 458.64021 nats/sec, 14.21797 nats/event
Full model Log loss : -1.27207
Full model ln_yyx : 449.53803 nats/sec, 13.93580 nats/event
Full model Log loss : -1.26261
Full model ln_yyx : 446.35800 nats/sec, 13.83722 nats/event
Full model Log loss : -1.26367
Full model ln_yyx : 453.49874 nats/sec, 14.05859 nats/event
Full model Log loss : -1.25293
Full model ln_yyx : 454.28389 nats/sec, 14.08293 nats/event
Full model Log loss : -1.25555
Full model ln_yyx : 440.49329 nats/sec, 13.65541 nats/event
Full model Log loss : -1.15438
Full model ln_yyx : 450.55640 nats/sec, 13.96737 nats/event
Full model Log loss : -1.26347
Full model ln_yyx : 457.10608 nats/sec, 14.17041 nats/event
Full model Log loss : -1.26325
Full model ln_yyx : 448.99438 nats/sec, 13.91895 nats/event
Full model Log loss : -1.26962
Full model ln_yyx : 452.46211 nats/sec, 14.02645 nats/event
Full model Log loss : -1.26427
Full model ln_yyx : 455.69420 nats/sec, 14.12665 nats/event
Full model Log loss : -1.24286
Full model ln_yyx : 456.87389 nats/sec, 14.16322 nats/event
Full model Log loss : -1.26503
Full model ln_yyx : 457.06212 nats/sec, 14.16905 nats/event
Full model Log loss : -1.26746
Full model ln_yyx : 455.29312 nats/sec, 14.11421 nats/event
Full model Log loss : -1.26205
Full model ln_yyx : 456.05190 nats/sec, 14.13773 nats/event
Full model Log loss : -1.26391
Full model ln_yyx : 456.09179 nats/sec, 14.13897 nats/event
Full model Log loss : -1.26724
Full model ln_yyx : 452.68046 nats/sec, 14.03322 nats/event
Full model Log loss : -1.27380
Optimization finished. Config saved to results/opt-full/opt_full_89_best_config.txt
[I 2026-03-18 18:32:36,208] Trial 47 pruned. 
[I 2026-03-18 18:32:42,058] Trial 45 finished with value: -1.2688335059090154 and parameters: {'n_layers_yyx': 1, 'hidden_size_yyx_l0': 4, 'context_size_yyx': 4, 'num_mix_components_yyx': 4, 'context_extractor_yyx': 'gru', 'activation_func_yyx': 'Tanh', 'L2_weight_yyx': 7.673923948918486e-05, 'L_entropy_weight_yyx': 1.3548554462501355e-06, 'L_sep_weight_yyx': 1.5040869394852624e-08, 'L_scale_weight_yyx': 1.0931560999766152e-10, 'learning_rate_yyx': 0.00870059987695078}. Best is trial 43 with value: -1.274106926486144.
[I 2026-03-18 18:32:43,371] Trial 40 pruned. 
[I 2026-03-18 18:32:46,028] Trial 36 pruned. 
[I 2026-03-18 18:32:50,298] Trial 29 finished with value: -3.1133766026891965 and parameters: {'n_layers_yyx': 2, 'hidden_size_yyx_l0': 6, 'hidden_size_yyx_l1': 4, 'context_size_yyx': 1, 'num_mix_components_yyx': 1, 'context_extractor_yyx': 'gru', 'activation_func_yyx': 'ReLU', 'L2_weight_yyx': 5.345020322718036e-07, 'L_entropy_weight_yyx': 0.00022773148946864886, 'L_sep_weight_yyx': 4.3251268714592685e-09, 'L_scale_weight_yyx': 1.9748789411486684e-09, 'learning_rate_yyx': 0.009996817353834989}. Best is trial 10 with value: -3.1515199681211117.
[I 2026-03-18 18:32:50,780] Trial 46 pruned. 
[I 2026-03-18 18:32:51,345] Trial 43 pruned. 
[I 2026-03-18 18:32:54,081] Trial 42 finished with value: -3.16019507158243 and parameters: {'n_layers_yyx': 2, 'hidden_size_yyx_l0': 6, 'hidden_size_yyx_l1': 6, 'context_size_yyx': 3, 'num_mix_components_yyx': 5, 'context_extractor_yyx': 'gru', 'activation_func_yyx': 'Tanh', 'L2_weight_yyx': 4.4788500227428536e-08, 'L_entropy_weight_yyx': 9.054689085992046e-09, 'L_sep_weight_yyx': 6.684379007201486e-09, 'L_scale_weight_yyx': 1.1646749085578693e-06, 'learning_rate_yyx': 0.009994640349330891}. Best is trial 10 with value: -3.1611070918248854.
[I 2026-03-18 18:32:55,276] Trial 47 pruned. 
[I 2026-03-18 18:32:56,254] Trial 41 pruned. 
[I 2026-03-18 18:32:58,589] Trial 37 pruned. 
[I 2026-03-18 18:33:03,461] Trial 48 pruned. 
[I 2026-03-18 18:33:04,402] Trial 44 pruned. 
[I 2026-03-18 18:33:04,868] Trial 43 finished with value: -3.1505459484727365 and parameters: {'n_layers_yyx': 2, 'hidden_size_yyx_l0': 2, 'hidden_size_yyx_l1': 6, 'context_size_yyx': 4, 'num_mix_components_yyx': 5, 'context_extractor_yyx': 'lstm', 'activation_func_yyx': 'GELU', 'L2_weight_yyx': 6.86571467248634e-09, 'L_entropy_weight_yyx': 0.00019627490674925627, 'L_sep_weight_yyx': 1.3723548163809352e-09, 'L_scale_weight_yyx': 1.0168966102409618e-10, 'learning_rate_yyx': 0.009378948070442636}. Best is trial 43 with value: -3.1505459484727365.
[I 2026-03-18 18:33:12,157] Trial 49 pruned. 

Source events: 5634
Target events: 18269
Full model ln_yyx : 283.55465 nats/sec, 13.96897 nats/event
Full model Log loss : -1.24366
Full model ln_yyx : 287.68530 nats/sec, 14.17247 nats/event
Full model Log loss : -1.25750
Full model ln_yyx : 285.55415 nats/sec, 14.06748 nats/event
Full model Log loss : -1.26277
Full model ln_yyx : 285.85808 nats/sec, 14.08245 nats/event
Full model Log loss : -1.25833
Full model ln_yyx : 283.79729 nats/sec, 13.98093 nats/event
Full model Log loss : -1.25033
Full model ln_yyx : 288.06935 nats/sec, 14.19138 nats/event
Full model Log loss : -1.26511
Full model ln_yyx : 284.47108 nats/sec, 14.01412 nats/event
Full model Log loss : -1.26287
Full model ln_yyx : 286.05622 nats/sec, 14.09221 nats/event
Full model Log loss : -1.26097
Full model ln_yyx : 286.60009 nats/sec, 14.11900 nats/event
Full model Log loss : -1.26720
Full model ln_yyx : 290.61010 nats/sec, 14.31655 nats/event
Full model Log loss : -1.26198
Full model ln_yyx : 283.34770 nats/sec, 13.95878 nats/event
Full model Log loss : -1.27273
Full model ln_yyx : 285.73048 nats/sec, 14.07616 nats/event
Full model Log loss : -1.26126
Full model ln_yyx : 285.58764 nats/sec, 14.06913 nats/event
Full model Log loss : -1.26575
Full model ln_yyx : 287.81611 nats/sec, 14.17891 nats/event
Full model Log loss : -1.26576
Full model ln_yyx : 288.07267 nats/sec, 14.19155 nats/event
Full model Log loss : -1.26583
Full model ln_yyx : 283.62254 nats/sec, 13.97232 nats/event
Full model Log loss : -1.26410
Full model ln_yyx : 285.25449 nats/sec, 14.05271 nats/event
Full model Log loss : -1.26882
Full model ln_yyx : 288.61533 nats/sec, 14.21828 nats/event
Full model Log loss : -1.26627
Full model ln_yyx : 283.60955 nats/sec, 13.97168 nats/event
Full model Log loss : -1.27411
Full model ln_yyx : 285.54088 nats/sec, 14.06682 nats/event
Full model Log loss : -1.26883
Optimization finished. Config saved to results/opt-full/opt_full_94_best_config.txt
[I 2026-03-18 18:33:17,321] Trial 45 pruned. 
[I 2026-03-18 18:33:18,728] Trial 41 finished with value: -3.146021744288173 and parameters: {'n_layers_yyx': 2, 'hidden_size_yyx_l0': 5, 'hidden_size_yyx_l1': 2, 'context_size_yyx': 4, 'num_mix_components_yyx': 4, 'context_extractor_yyx': 'gru', 'activation_func_yyx': 'ReLU', 'L2_weight_yyx': 6.271434790320039e-07, 'L_entropy_weight_yyx': 1.5077599804398315e-09, 'L_sep_weight_yyx': 5.348715968257042e-08, 'L_scale_weight_yyx': 0.0004711030797115124, 'learning_rate_yyx': 0.007902389242024901}. Best is trial 23 with value: -3.1545382986021053.
[I 2026-03-18 18:33:35,539] Trial 35 finished with value: -3.1488324001674686 and parameters: {'n_layers_yyx': 1, 'hidden_size_yyx_l0': 6, 'context_size_yyx': 4, 'num_mix_components_yyx': 5, 'context_extractor_yyx': 'gru', 'activation_func_yyx': 'GELU', 'L2_weight_yyx': 1.137068897462899e-06, 'L_entropy_weight_yyx': 2.469218889701984e-05, 'L_sep_weight_yyx': 4.5920483451575386e-07, 'L_scale_weight_yyx': 2.477528587190208e-08, 'learning_rate_yyx': 0.009894583123633394}. Best is trial 1 with value: -3.152505646630136.
[I 2026-03-18 18:33:36,080] Trial 34 finished with value: -3.153257338167012 and parameters: {'n_layers_yyx': 2, 'hidden_size_yyx_l0': 6, 'hidden_size_yyx_l1': 5, 'context_size_yyx': 4, 'num_mix_components_yyx': 4, 'context_extractor_yyx': 'lstm', 'activation_func_yyx': 'GELU', 'L2_weight_yyx': 2.5733954477815195e-06, 'L_entropy_weight_yyx': 5.488956879075407e-09, 'L_sep_weight_yyx': 8.287375146354684e-05, 'L_scale_weight_yyx': 3.2179398817005767e-10, 'learning_rate_yyx': 0.009106651699457631}. Best is trial 34 with value: -3.153257338167012.
[I 2026-03-18 18:33:38,979] Trial 39 pruned. 
[I 2026-03-18 18:33:42,329] Trial 30 pruned. 
[I 2026-03-18 18:33:47,936] Trial 36 pruned. 
[I 2026-03-18 18:33:48,259] Trial 42 pruned. 
[I 2026-03-18 18:33:50,125] Trial 30 finished with value: -3.1144730723177254 and parameters: {'n_layers_yyx': 1, 'hidden_size_yyx_l0': 4, 'context_size_yyx': 2, 'num_mix_components_yyx': 3, 'context_extractor_yyx': 'lstm', 'activation_func_yyx': 'ReLU', 'L2_weight_yyx': 4.3596555766204556e-09, 'L_entropy_weight_yyx': 1.015511641617674e-05, 'L_sep_weight_yyx': 5.163865674760114e-10, 'L_scale_weight_yyx': 5.679609994538361e-06, 'learning_rate_yyx': 0.00828590884814503}. Best is trial 10 with value: -3.1515199681211117.
[I 2026-03-18 18:33:53,208] Trial 48 pruned. 
[I 2026-03-18 18:33:55,406] Trial 35 finished with value: -3.154543909383593 and parameters: {'n_layers_yyx': 1, 'hidden_size_yyx_l0': 5, 'context_size_yyx': 4, 'num_mix_components_yyx': 2, 'context_extractor_yyx': 'gru', 'activation_func_yyx': 'ReLU', 'L2_weight_yyx': 4.2121350075622696e-09, 'L_entropy_weight_yyx': 3.539920140230218e-10, 'L_sep_weight_yyx': 1.1813756406035188e-07, 'L_scale_weight_yyx': 1.079897293520622e-09, 'learning_rate_yyx': 0.00856529361395112}. Best is trial 27 with value: -3.161937115338458.
[I 2026-03-18 18:33:58,847] Trial 42 finished with value: -3.185053038388031 and parameters: {'n_layers_yyx': 2, 'hidden_size_yyx_l0': 6, 'hidden_size_yyx_l1': 5, 'context_size_yyx': 2, 'num_mix_components_yyx': 5, 'context_extractor_yyx': 'lstm', 'activation_func_yyx': 'ReLU', 'L2_weight_yyx': 2.4184069549357468e-05, 'L_entropy_weight_yyx': 2.147140839923697e-10, 'L_sep_weight_yyx': 4.521526981404937e-06, 'L_scale_weight_yyx': 8.093281262899771e-06, 'learning_rate_yyx': 0.007369585332503973}. Best is trial 12 with value: -3.1893335216865584.
[I 2026-03-18 18:34:00,925] Trial 43 pruned. 
[I 2026-03-18 18:34:09,513] Trial 31 pruned. 
[I 2026-03-18 18:34:10,196] Trial 38 finished with value: -3.1123537024143704 and parameters: {'n_layers_yyx': 1, 'hidden_size_yyx_l0': 5, 'context_size_yyx': 1, 'num_mix_components_yyx': 2, 'context_extractor_yyx': 'lstm', 'activation_func_yyx': 'Tanh', 'L2_weight_yyx': 5.281024675879589e-10, 'L_entropy_weight_yyx': 0.00024447704031120636, 'L_sep_weight_yyx': 6.266824349457787e-09, 'L_scale_weight_yyx': 2.3859733175826693e-08, 'learning_rate_yyx': 0.005631423133701804}. Best is trial 24 with value: -3.1533369159995748.
[I 2026-03-18 18:34:22,234] Trial 39 pruned. 
[I 2026-03-18 18:34:23,021] Trial 49 pruned. 

Source events: 54211
Target events: 40082
Full model ln_yyx : 10777.49969 nats/sec, 241.99765 nats/event
Full model Log loss : -3.11994
Full model ln_yyx : 10740.97570 nats/sec, 241.17754 nats/event
Full model Log loss : -3.11044
Full model ln_yyx : 10807.59648 nats/sec, 242.67344 nats/event
Full model Log loss : -3.11984
Full model ln_yyx : 10814.37130 nats/sec, 242.82556 nats/event
Full model Log loss : -3.11938
Full model ln_yyx : 10829.10072 nats/sec, 243.15630 nats/event
Full model Log loss : -3.12091
Full model ln_yyx : 10858.26339 nats/sec, 243.81111 nats/event
Full model Log loss : -3.14810
Full model ln_yyx : 10860.42974 nats/sec, 243.85976 nats/event
Full model Log loss : -3.14810
Full model ln_yyx : 10869.12038 nats/sec, 244.05490 nats/event
Full model Log loss : -3.14533
Full model ln_yyx : 10861.27064 nats/sec, 243.87864 nats/event
Full model Log loss : -3.14513
Full model ln_yyx : 10817.52129 nats/sec, 242.89629 nats/event
Full model Log loss : -3.11893
Full model ln_yyx : 10900.88927 nats/sec, 244.76823 nats/event
Full model Log loss : -3.14643
Full model ln_yyx : 10886.74441 nats/sec, 244.45063 nats/event
Full model Log loss : -3.15355
Full model ln_yyx : 10928.12253 nats/sec, 245.37973 nats/event
Full model Log loss : -3.15010
Full model ln_yyx : 10878.13825 nats/sec, 244.25738 nats/event
Full model Log loss : -3.14777
Optimization finished. Config saved to results/opt-full/opt_full_73_best_config.txt
[I 2026-03-18 18:34:30,066] Trial 44 pruned. 
[I 2026-03-18 18:34:32,672] Trial 46 pruned. 
[I 2026-03-18 18:34:33,740] Trial 42 finished with value: -3.114315447545274 and parameters: {'n_layers_yyx': 2, 'hidden_size_yyx_l0': 6, 'hidden_size_yyx_l1': 4, 'context_size_yyx': 2, 'num_mix_components_yyx': 3, 'context_extractor_yyx': 'gru', 'activation_func_yyx': 'ReLU', 'L2_weight_yyx': 9.980846037493774e-08, 'L_entropy_weight_yyx': 2.630893040938592e-10, 'L_sep_weight_yyx': 4.844857303065663e-09, 'L_scale_weight_yyx': 1.6355400024961903e-09, 'learning_rate_yyx': 0.005434440700528619}. Best is trial 2 with value: -3.151229652723366.
