[I 2026-03-18 22:17:08,481] Trial 37 finished with value: -2.5472354190657365 and parameters: {'n_layers_yyx': 2, 'hidden_size_yyx_l0': 2, 'hidden_size_yyx_l1': 4, 'context_size_yyx': 4, 'num_mix_components_yyx': 3, 'context_extractor_yyx': 'lstm', 'activation_func_yyx': 'ReLU', 'L2_weight_yyx': 5.5450622072670626e-08, 'L_entropy_weight_yyx': 4.004551657062445e-05, 'L_sep_weight_yyx': 2.5387218911674177e-10, 'L_scale_weight_yyx': 1.578114161600439e-07, 'learning_rate_yyx': 0.005558153697248181}. Best is trial 24 with value: -2.5511102316762146.
[I 2026-03-18 22:17:09,301] Trial 66 pruned. 
[I 2026-03-18 22:17:15,466] Trial 34 pruned. 
[I 2026-03-18 22:17:16,245] Trial 38 pruned. 
[I 2026-03-18 22:17:17,668] Trial 44 finished with value: -2.767513561248779 and parameters: {'n_layers_yyx': 2, 'hidden_size_yyx_l0': 6, 'hidden_size_yyx_l1': 5, 'context_size_yyx': 4, 'num_mix_components_yyx': 5, 'context_extractor_yyx': 'gru', 'activation_func_yyx': 'GELU', 'L2_weight_yyx': 9.470330399238711e-07, 'L_entropy_weight_yyx': 7.928896746363139e-09, 'L_sep_weight_yyx': 0.00015572097059166493, 'L_scale_weight_yyx': 1.662900204608337e-07, 'learning_rate_yyx': 0.008350360367241324}. Best is trial 44 with value: -2.767513561248779.
[I 2026-03-18 22:17:17,923] Trial 44 pruned. 
[I 2026-03-18 22:17:19,644] Trial 40 pruned. 
[I 2026-03-18 22:17:22,154] Trial 33 pruned. 
[I 2026-03-18 22:17:26,871] Trial 67 pruned. 
[I 2026-03-18 22:17:28,703] Trial 41 pruned. 
[I 2026-03-18 22:17:29,318] Trial 38 pruned. 
[I 2026-03-18 22:17:29,915] Trial 47 finished with value: -2.7623324552321815 and parameters: {'n_layers_yyx': 2, 'hidden_size_yyx_l0': 3, 'hidden_size_yyx_l1': 4, 'context_size_yyx': 3, 'num_mix_components_yyx': 3, 'context_extractor_yyx': 'lstm', 'activation_func_yyx': 'Tanh', 'L2_weight_yyx': 0.00031278361676712984, 'L_entropy_weight_yyx': 1.0237713746795867e-09, 'L_sep_weight_yyx': 1.7184516705553848e-06, 'L_scale_weight_yyx': 2.3557592802937077e-09, 'learning_rate_yyx': 0.009116827617871906}. Best is trial 25 with value: -2.762886536950096.
[I 2026-03-18 22:17:38,410] Trial 39 pruned. 
[I 2026-03-18 22:17:40,118] Trial 32 pruned. 
[I 2026-03-18 22:17:40,191] Trial 45 pruned. 
[I 2026-03-18 22:17:44,068] Trial 48 pruned. 
[I 2026-03-18 22:17:47,440] Trial 40 pruned. 
[I 2026-03-18 22:17:47,575] Trial 32 finished with value: -2.3918022294549064 and parameters: {'n_layers_yyx': 2, 'hidden_size_yyx_l0': 4, 'hidden_size_yyx_l1': 6, 'context_size_yyx': 3, 'num_mix_components_yyx': 4, 'context_extractor_yyx': 'gru', 'activation_func_yyx': 'GELU', 'L2_weight_yyx': 0.0003778109785417255, 'L_entropy_weight_yyx': 1.2827020310954585e-09, 'L_sep_weight_yyx': 0.000221667888858129, 'L_scale_weight_yyx': 1.567362520726725e-07, 'learning_rate_yyx': 0.009975599949764883}. Best is trial 29 with value: -2.3960325303152223.
[I 2026-03-18 22:17:49,882] Trial 34 pruned. 
[I 2026-03-18 22:17:58,052] Trial 49 pruned. 
[I 2026-03-18 22:17:59,659] Trial 33 pruned. 
[I 2026-03-18 22:18:01,859] Trial 39 pruned. 
[I 2026-03-18 22:18:02,068] Trial 46 pruned. 
[I 2026-03-18 22:18:02,801] Trial 35 pruned. 
[I 2026-03-18 22:18:03,084] Trial 35 pruned. 
[I 2026-03-18 22:18:10,181] Trial 40 pruned. 
[I 2026-03-18 22:18:12,092] Trial 47 pruned. 
[I 2026-03-18 22:18:18,638] Trial 41 pruned. 
[I 2026-03-18 22:18:19,705] Trial 43 pruned. 
[I 2026-03-18 22:18:22,024] Trial 48 pruned. 
[I 2026-03-18 22:18:26,425] Trial 42 pruned. 
[I 2026-03-18 22:18:29,491] Trial 50 pruned. 
[I 2026-03-18 22:18:31,300] Trial 45 finished with value: -2.7668162027994794 and parameters: {'n_layers_yyx': 2, 'hidden_size_yyx_l0': 6, 'hidden_size_yyx_l1': 5, 'context_size_yyx': 4, 'num_mix_components_yyx': 5, 'context_extractor_yyx': 'gru', 'activation_func_yyx': 'GELU', 'L2_weight_yyx': 1.16631122816422e-06, 'L_entropy_weight_yyx': 8.129495092727164e-09, 'L_sep_weight_yyx': 0.00015776897549636294, 'L_scale_weight_yyx': 1.8433571366136217e-07, 'learning_rate_yyx': 0.008526567904090425}. Best is trial 44 with value: -2.767513561248779.
[I 2026-03-18 22:18:31,641] Trial 45 finished with value: -2.4301297581313985 and parameters: {'n_layers_yyx': 2, 'hidden_size_yyx_l0': 5, 'hidden_size_yyx_l1': 5, 'context_size_yyx': 3, 'num_mix_components_yyx': 5, 'context_extractor_yyx': 'lstm', 'activation_func_yyx': 'Tanh', 'L2_weight_yyx': 4.278518094967749e-05, 'L_entropy_weight_yyx': 0.00011785675472366015, 'L_sep_weight_yyx': 1.040280780896854e-05, 'L_scale_weight_yyx': 1.0722944005475138e-10, 'learning_rate_yyx': 0.007969781972470433}. Best is trial 11 with value: -2.43991066579963.
[I 2026-03-18 22:18:36,929] Trial 33 pruned. 
[I 2026-03-18 22:18:42,163] Trial 49 pruned. 
[I 2026-03-18 22:18:43,045] Trial 51 pruned. 
[I 2026-03-18 22:18:43,190] Trial 42 finished with value: -2.411442157994167 and parameters: {'n_layers_yyx': 2, 'hidden_size_yyx_l0': 2, 'hidden_size_yyx_l1': 4, 'context_size_yyx': 4, 'num_mix_components_yyx': 5, 'context_extractor_yyx': 'gru', 'activation_func_yyx': 'GELU', 'L2_weight_yyx': 0.0009784866848686733, 'L_entropy_weight_yyx': 0.00027998948672428546, 'L_sep_weight_yyx': 7.66800092627887e-06, 'L_scale_weight_yyx': 2.374003061847885e-06, 'learning_rate_yyx': 0.009908617938263222}. Best is trial 32 with value: -2.420807459084574.
[I 2026-03-18 22:18:46,852] Trial 34 pruned. 
[I 2026-03-18 22:18:51,103] Trial 46 pruned. 
[I 2026-03-18 22:18:51,353] Trial 23 finished with value: -2.7647729905985168 and parameters: {'n_layers_yyx': 1, 'hidden_size_yyx_l0': 4, 'context_size_yyx': 4, 'num_mix_components_yyx': 5, 'context_extractor_yyx': 'lstm', 'activation_func_yyx': 'ReLU', 'L2_weight_yyx': 6.199814314522627e-10, 'L_entropy_weight_yyx': 2.653367358254719e-06, 'L_sep_weight_yyx': 0.00010714195516375356, 'L_scale_weight_yyx': 2.501116175986577e-06, 'learning_rate_yyx': 0.005558398761190055}. Best is trial 8 with value: -2.7663050128086293.
[I 2026-03-18 22:18:52,780] Trial 50 pruned. 
[I 2026-03-18 22:18:55,154] Trial 35 pruned. 
[I 2026-03-18 22:18:55,548] Trial 42 finished with value: -2.3898413217364136 and parameters: {'n_layers_yyx': 2, 'hidden_size_yyx_l0': 3, 'hidden_size_yyx_l1': 6, 'context_size_yyx': 4, 'num_mix_components_yyx': 3, 'context_extractor_yyx': 'lstm', 'activation_func_yyx': 'GELU', 'L2_weight_yyx': 1.1389999294703308e-06, 'L_entropy_weight_yyx': 1.2427833181979255e-05, 'L_sep_weight_yyx': 3.447838159159436e-07, 'L_scale_weight_yyx': 1.0895679721020088e-06, 'learning_rate_yyx': 0.0070045856000947645}. Best is trial 11 with value: -2.4030680672323603.
[I 2026-03-18 22:19:02,790] Trial 43 pruned. 
[I 2026-03-18 22:19:11,983] Trial 43 pruned. 
[I 2026-03-18 22:19:14,045] Trial 51 pruned. 
[I 2026-03-18 22:19:14,411] Trial 41 finished with value: -2.361455254166867 and parameters: {'n_layers_yyx': 1, 'hidden_size_yyx_l0': 2, 'context_size_yyx': 3, 'num_mix_components_yyx': 3, 'context_extractor_yyx': 'lstm', 'activation_func_yyx': 'GELU', 'L2_weight_yyx': 1.3657208323943302e-07, 'L_entropy_weight_yyx': 0.00038476316165120353, 'L_sep_weight_yyx': 0.00011925472085325031, 'L_scale_weight_yyx': 0.00047502570651910625, 'learning_rate_yyx': 0.0048323941082114305}. Best is trial 13 with value: -2.4034606761310786.
[I 2026-03-18 22:19:14,471] Trial 45 finished with value: -2.761332045506387 and parameters: {'n_layers_yyx': 2, 'hidden_size_yyx_l0': 4, 'hidden_size_yyx_l1': 4, 'context_size_yyx': 1, 'num_mix_components_yyx': 3, 'context_extractor_yyx': 'gru', 'activation_func_yyx': 'Tanh', 'L2_weight_yyx': 4.224108496182221e-05, 'L_entropy_weight_yyx': 0.00030660672392309753, 'L_sep_weight_yyx': 6.497421821776874e-08, 'L_scale_weight_yyx': 8.361364896791542e-08, 'learning_rate_yyx': 0.00995119472682808}. Best is trial 6 with value: -2.7665796528518882.
[I 2026-03-18 22:19:18,061] Trial 24 pruned. 
[I 2026-03-18 22:19:25,373] Trial 36 finished with value: -2.366979010166266 and parameters: {'n_layers_yyx': 1, 'hidden_size_yyx_l0': 6, 'context_size_yyx': 4, 'num_mix_components_yyx': 1, 'context_extractor_yyx': 'gru', 'activation_func_yyx': 'GELU', 'L2_weight_yyx': 6.012505069863005e-05, 'L_entropy_weight_yyx': 3.17191323662407e-09, 'L_sep_weight_yyx': 3.5718865081195725e-09, 'L_scale_weight_yyx': 1.1223653104543894e-07, 'learning_rate_yyx': 0.006569431314889951}. Best is trial 17 with value: -2.394564459385016.
[I 2026-03-18 22:19:25,816] Trial 42 pruned. 
[I 2026-03-18 22:19:42,630] Trial 46 finished with value: -2.7661441961924234 and parameters: {'n_layers_yyx': 2, 'hidden_size_yyx_l0': 6, 'hidden_size_yyx_l1': 5, 'context_size_yyx': 4, 'num_mix_components_yyx': 5, 'context_extractor_yyx': 'gru', 'activation_func_yyx': 'GELU', 'L2_weight_yyx': 1.6703613950220832e-06, 'L_entropy_weight_yyx': 5.796386653259872e-09, 'L_sep_weight_yyx': 0.000882146300908229, 'L_scale_weight_yyx': 1.4655019131175903e-07, 'learning_rate_yyx': 0.00841877697436255}. Best is trial 44 with value: -2.767513561248779.
[I 2026-03-18 22:19:49,101] Trial 34 finished with value: -2.362825401984451 and parameters: {'n_layers_yyx': 2, 'hidden_size_yyx_l0': 4, 'hidden_size_yyx_l1': 6, 'context_size_yyx': 3, 'num_mix_components_yyx': 2, 'context_extractor_yyx': 'gru', 'activation_func_yyx': 'GELU', 'L2_weight_yyx': 0.00012061703300971008, 'L_entropy_weight_yyx': 1.3618309684759666e-10, 'L_sep_weight_yyx': 0.00017669969078656442, 'L_scale_weight_yyx': 9.912257002482618e-09, 'learning_rate_yyx': 0.009890852082393466}. Best is trial 29 with value: -2.3960325303152223.
[I 2026-03-18 22:19:50,057] Trial 68 finished with value: -2.3929939093866244 and parameters: {'n_layers_yyx': 2, 'hidden_size_yyx_l0': 6, 'hidden_size_yyx_l1': 5, 'context_size_yyx': 3, 'num_mix_components_yyx': 4, 'context_extractor_yyx': 'gru', 'activation_func_yyx': 'Tanh', 'L2_weight_yyx': 6.86959257956446e-05, 'L_entropy_weight_yyx': 3.9953512966520426e-09, 'L_sep_weight_yyx': 3.136320996360887e-06, 'L_scale_weight_yyx': 6.11930747637427e-07, 'learning_rate_yyx': 0.0054778313150421944}. Best is trial 0 with value: -2.4076941594397367.
[I 2026-03-18 22:19:50,069] Trial 43 pruned. 
[I 2026-03-18 22:19:52,052] Trial 36 finished with value: -2.758224781507499 and parameters: {'n_layers_yyx': 1, 'hidden_size_yyx_l0': 4, 'context_size_yyx': 2, 'num_mix_components_yyx': 4, 'context_extractor_yyx': 'lstm', 'activation_func_yyx': 'ReLU', 'L2_weight_yyx': 9.584590425520174e-09, 'L_entropy_weight_yyx': 3.151049052699507e-07, 'L_sep_weight_yyx': 2.2931645595646483e-05, 'L_scale_weight_yyx': 1.0961647323646046e-09, 'learning_rate_yyx': 0.005888676925760959}. Best is trial 7 with value: -2.766072426816335.
[I 2026-03-18 22:19:52,552] Trial 44 finished with value: -2.762785744375163 and parameters: {'n_layers_yyx': 2, 'hidden_size_yyx_l0': 2, 'hidden_size_yyx_l1': 4, 'context_size_yyx': 4, 'num_mix_components_yyx': 3, 'context_extractor_yyx': 'gru', 'activation_func_yyx': 'GELU', 'L2_weight_yyx': 3.3674616449866054e-10, 'L_entropy_weight_yyx': 0.00013855097387647933, 'L_sep_weight_yyx': 2.2468929299861258e-05, 'L_scale_weight_yyx': 3.3234596881233366e-09, 'learning_rate_yyx': 0.008722495030553857}. Best is trial 0 with value: -2.7678615354442075.
[I 2026-03-18 22:20:05,732] Trial 45 pruned. 
[I 2026-03-18 22:20:06,692] Trial 47 finished with value: -2.424401766319852 and parameters: {'n_layers_yyx': 2, 'hidden_size_yyx_l0': 5, 'hidden_size_yyx_l1': 5, 'context_size_yyx': 3, 'num_mix_components_yyx': 5, 'context_extractor_yyx': 'gru', 'activation_func_yyx': 'Tanh', 'L2_weight_yyx': 6.423489812380511e-05, 'L_entropy_weight_yyx': 0.0006110953005341767, 'L_sep_weight_yyx': 1.5060658175480664e-05, 'L_scale_weight_yyx': 1.024316402817678e-10, 'learning_rate_yyx': 0.00499166748443589}. Best is trial 11 with value: -2.43991066579963.
[I 2026-03-18 22:20:08,068] Trial 69 pruned. 
[I 2026-03-18 22:20:10,963] Trial 44 pruned. 
[I 2026-03-18 22:20:11,768] Trial 36 finished with value: -2.3917442146184866 and parameters: {'n_layers_yyx': 1, 'hidden_size_yyx_l0': 4, 'context_size_yyx': 3, 'num_mix_components_yyx': 4, 'context_extractor_yyx': 'lstm', 'activation_func_yyx': 'Tanh', 'L2_weight_yyx': 8.418932122235647e-10, 'L_entropy_weight_yyx': 9.748409009517222e-08, 'L_sep_weight_yyx': 2.1913776643141415e-05, 'L_scale_weight_yyx': 2.3626174012745343e-06, 'learning_rate_yyx': 0.006814965787744332}. Best is trial 24 with value: -2.4319235459143473.
[I 2026-03-18 22:20:17,641] Trial 37 pruned. 
[I 2026-03-18 22:20:24,272] Trial 43 finished with value: -2.389304209232208 and parameters: {'n_layers_yyx': 2, 'hidden_size_yyx_l0': 2, 'hidden_size_yyx_l1': 5, 'context_size_yyx': 4, 'num_mix_components_yyx': 3, 'context_extractor_yyx': 'lstm', 'activation_func_yyx': 'GELU', 'L2_weight_yyx': 2.6561469535481987e-06, 'L_entropy_weight_yyx': 1.0950746880389904e-06, 'L_sep_weight_yyx': 8.341294792035657e-06, 'L_scale_weight_yyx': 3.858257418062529e-06, 'learning_rate_yyx': 0.005526646690604772}. Best is trial 11 with value: -2.4030680672323603.
[I 2026-03-18 22:20:26,167] Trial 48 pruned. 
[I 2026-03-18 22:20:29,243] Trial 38 pruned. 
[I 2026-03-18 22:20:32,895] Trial 25 pruned. 
[I 2026-03-18 22:20:34,153] Trial 49 pruned. 
[I 2026-03-18 22:20:40,793] Trial 39 pruned. 
[I 2026-03-18 22:20:42,620] Trial 50 pruned. 
[I 2026-03-18 22:20:51,985] Trial 40 pruned. 
[I 2026-03-18 22:20:53,167] Trial 47 finished with value: -2.7672316392262775 and parameters: {'n_layers_yyx': 2, 'hidden_size_yyx_l0': 6, 'hidden_size_yyx_l1': 5, 'context_size_yyx': 4, 'num_mix_components_yyx': 5, 'context_extractor_yyx': 'gru', 'activation_func_yyx': 'GELU', 'L2_weight_yyx': 1.1609724023984026e-06, 'L_entropy_weight_yyx': 1.8811049373141577e-10, 'L_sep_weight_yyx': 7.677156752084054e-05, 'L_scale_weight_yyx': 2.0110739509624852e-07, 'learning_rate_yyx': 0.006807700790621402}. Best is trial 44 with value: -2.767513561248779.
[I 2026-03-18 22:20:55,108] Trial 52 finished with value: -2.762171307732077 and parameters: {'n_layers_yyx': 2, 'hidden_size_yyx_l0': 3, 'hidden_size_yyx_l1': 4, 'context_size_yyx': 3, 'num_mix_components_yyx': 3, 'context_extractor_yyx': 'lstm', 'activation_func_yyx': 'Tanh', 'L2_weight_yyx': 0.0004072257876989967, 'L_entropy_weight_yyx': 1.8485403198507897e-09, 'L_sep_weight_yyx': 4.0708142549475335e-09, 'L_scale_weight_yyx': 2.4651092503921148e-09, 'learning_rate_yyx': 0.009134632995140566}. Best is trial 25 with value: -2.762886536950096.
[I 2026-03-18 22:21:00,191] Trial 37 pruned. 
[I 2026-03-18 22:21:01,512] Trial 26 pruned. 
[I 2026-03-18 22:21:04,780] Trial 48 pruned. 
[I 2026-03-18 22:21:06,285] Trial 44 finished with value: -2.412614586857921 and parameters: {'n_layers_yyx': 2, 'hidden_size_yyx_l0': 2, 'hidden_size_yyx_l1': 4, 'context_size_yyx': 4, 'num_mix_components_yyx': 5, 'context_extractor_yyx': 'gru', 'activation_func_yyx': 'GELU', 'L2_weight_yyx': 0.00044988115509178383, 'L_entropy_weight_yyx': 0.00032903194247677363, 'L_sep_weight_yyx': 7.037707059797633e-06, 'L_scale_weight_yyx': 2.4923377704097387e-05, 'learning_rate_yyx': 0.008272342470686209}. Best is trial 32 with value: -2.420807459084574.
[I 2026-03-18 22:21:09,109] Trial 45 pruned. 
[I 2026-03-18 22:21:09,478] Trial 44 finished with value: -2.5477835720575714 and parameters: {'n_layers_yyx': 2, 'hidden_size_yyx_l0': 2, 'hidden_size_yyx_l1': 4, 'context_size_yyx': 4, 'num_mix_components_yyx': 3, 'context_extractor_yyx': 'lstm', 'activation_func_yyx': 'ReLU', 'L2_weight_yyx': 9.321179920955972e-08, 'L_entropy_weight_yyx': 8.945548815448573e-06, 'L_sep_weight_yyx': 3.012008448729859e-10, 'L_scale_weight_yyx': 3.1251900172115057e-06, 'learning_rate_yyx': 0.006136424020049732}. Best is trial 24 with value: -2.5511102316762146.
[I 2026-03-18 22:21:12,721] Trial 44 pruned. 
[I 2026-03-18 22:21:18,600] Trial 41 pruned. 
[I 2026-03-18 22:21:21,917] Trial 45 pruned. 
[I 2026-03-18 22:21:22,804] Trial 52 finished with value: -2.4083147343901015 and parameters: {'n_layers_yyx': 2, 'hidden_size_yyx_l0': 4, 'hidden_size_yyx_l1': 5, 'context_size_yyx': 3, 'num_mix_components_yyx': 5, 'context_extractor_yyx': 'gru', 'activation_func_yyx': 'Tanh', 'L2_weight_yyx': 9.106468904300069e-07, 'L_entropy_weight_yyx': 1.274211981860223e-06, 'L_sep_weight_yyx': 0.0006087832699264169, 'L_scale_weight_yyx': 1.5803299774529523e-09, 'learning_rate_yyx': 0.009874091039043163}. Best is trial 25 with value: -2.4120091389134988.
[I 2026-03-18 22:21:25,355] Trial 45 pruned. 
[I 2026-03-18 22:21:26,874] Trial 53 pruned. 
[I 2026-03-18 22:21:27,008] Trial 45 pruned. 
[I 2026-03-18 22:21:28,349] Trial 35 finished with value: -2.3633004534772932 and parameters: {'n_layers_yyx': 2, 'hidden_size_yyx_l0': 2, 'hidden_size_yyx_l1': 5, 'context_size_yyx': 3, 'num_mix_components_yyx': 5, 'context_extractor_yyx': 'gru', 'activation_func_yyx': 'GELU', 'L2_weight_yyx': 5.89482437580127e-07, 'L_entropy_weight_yyx': 5.163126632475813e-10, 'L_sep_weight_yyx': 3.661303042420028e-05, 'L_scale_weight_yyx': 1.9171979704647607e-07, 'learning_rate_yyx': 0.006885859659056902}. Best is trial 29 with value: -2.3960325303152223.
[I 2026-03-18 22:21:29,830] Trial 46 pruned. 
[I 2026-03-18 22:21:30,699] Trial 51 pruned. 
[I 2026-03-18 22:21:31,039] Trial 42 pruned. 
[I 2026-03-18 22:21:32,841] Trial 27 pruned. 
[I 2026-03-18 22:21:35,103] Trial 70 finished with value: -2.397656632056904 and parameters: {'n_layers_yyx': 1, 'hidden_size_yyx_l0': 5, 'context_size_yyx': 4, 'num_mix_components_yyx': 4, 'context_extractor_yyx': 'gru', 'activation_func_yyx': 'Tanh', 'L2_weight_yyx': 6.336209808845811e-05, 'L_entropy_weight_yyx': 2.722550666387214e-09, 'L_sep_weight_yyx': 4.1254171721210556e-05, 'L_scale_weight_yyx': 6.524337380984673e-07, 'learning_rate_yyx': 0.0061201770942160855}. Best is trial 0 with value: -2.4076941594397367.
[I 2026-03-18 22:21:35,767] Trial 46 pruned. 
[I 2026-03-18 22:21:36,538] Trial 36 pruned. 
[I 2026-03-18 22:21:37,825] Trial 46 finished with value: -2.764696324421236 and parameters: {'n_layers_yyx': 2, 'hidden_size_yyx_l0': 3, 'hidden_size_yyx_l1': 6, 'context_size_yyx': 4, 'num_mix_components_yyx': 4, 'context_extractor_yyx': 'gru', 'activation_func_yyx': 'GELU', 'L2_weight_yyx': 4.694494725313068e-09, 'L_entropy_weight_yyx': 1.6566058563052907e-07, 'L_sep_weight_yyx': 7.772612108659706e-05, 'L_scale_weight_yyx': 4.6399101741903437e-10, 'learning_rate_yyx': 0.00980598422240601}. Best is trial 0 with value: -2.7678615354442075.
[I 2026-03-18 22:21:41,392] Trial 46 pruned. 
[I 2026-03-18 22:21:41,901] Trial 54 pruned. 
[I 2026-03-18 22:21:43,063] Trial 46 pruned. 
[I 2026-03-18 22:21:44,152] Trial 47 pruned. 
[I 2026-03-18 22:21:45,048] Trial 37 pruned. 
[I 2026-03-18 22:21:46,832] Trial 28 pruned. 
[I 2026-03-18 22:21:47,706] Trial 38 pruned. 
[I 2026-03-18 22:21:50,182] Trial 47 pruned. 
[I 2026-03-18 22:21:52,058] Trial 48 pruned. 
[I 2026-03-18 22:21:53,221] Trial 38 pruned. 
[I 2026-03-18 22:21:55,236] Trial 37 pruned. 
[I 2026-03-18 22:22:00,387] Trial 47 pruned. 
[I 2026-03-18 22:22:00,465] Trial 47 pruned. 
[I 2026-03-18 22:22:02,032] Trial 46 finished with value: -2.765928298266016 and parameters: {'n_layers_yyx': 2, 'hidden_size_yyx_l0': 4, 'hidden_size_yyx_l1': 5, 'context_size_yyx': 1, 'num_mix_components_yyx': 4, 'context_extractor_yyx': 'gru', 'activation_func_yyx': 'Tanh', 'L2_weight_yyx': 2.603680839698349e-10, 'L_entropy_weight_yyx': 2.6922196834335124e-05, 'L_sep_weight_yyx': 2.8388691662985457e-08, 'L_scale_weight_yyx': 6.263597463946252e-09, 'learning_rate_yyx': 0.008176154757512594}. Best is trial 6 with value: -2.7665796528518882.
[I 2026-03-18 22:22:02,989] Trial 29 pruned. 
[I 2026-03-18 22:22:03,034] Trial 48 pruned. 
[I 2026-03-18 22:22:06,117] Trial 39 pruned. 
[I 2026-03-18 22:22:08,821] Trial 48 pruned. 
[I 2026-03-18 22:22:09,768] Trial 48 pruned. 
[I 2026-03-18 22:22:12,847] Trial 39 pruned. 
[I 2026-03-18 22:22:13,869] Trial 49 pruned. 
[I 2026-03-18 22:22:16,416] Trial 49 pruned. 
[I 2026-03-18 22:22:16,992] Trial 52 pruned. 
[I 2026-03-18 22:22:17,393] Trial 49 pruned. 
[I 2026-03-18 22:22:34,701] Trial 50 pruned. 
[I 2026-03-18 22:22:39,304] Trial 30 pruned. 
[I 2026-03-18 22:22:39,908] Trial 50 pruned. 
[I 2026-03-18 22:22:42,235] Trial 51 pruned. 
[I 2026-03-18 22:22:46,796] Trial 38 pruned. 
[I 2026-03-18 22:22:59,558] Trial 49 pruned. 
[I 2026-03-18 22:23:01,564] Trial 40 pruned. 
[I 2026-03-18 22:23:01,953] Trial 52 pruned. 
[I 2026-03-18 22:23:06,272] Trial 51 pruned. 
[I 2026-03-18 22:23:10,954] Trial 41 pruned. 
[I 2026-03-18 22:23:11,042] Trial 53 pruned. 
[I 2026-03-18 22:23:13,082] Trial 55 pruned. 
[I 2026-03-18 22:23:13,093] Trial 31 pruned. 
[I 2026-03-18 22:23:18,771] Trial 40 finished with value: -2.4211540212303224 and parameters: {'n_layers_yyx': 1, 'hidden_size_yyx_l0': 5, 'context_size_yyx': 4, 'num_mix_components_yyx': 5, 'context_extractor_yyx': 'lstm', 'activation_func_yyx': 'GELU', 'L2_weight_yyx': 7.112427563769674e-05, 'L_entropy_weight_yyx': 9.158951860424881e-09, 'L_sep_weight_yyx': 6.178057316127616e-06, 'L_scale_weight_yyx': 2.03288713047904e-08, 'learning_rate_yyx': 0.008707156281966458}. Best is trial 24 with value: -2.4319235459143473.
[I 2026-03-18 22:23:20,238] Trial 42 pruned. 
[I 2026-03-18 22:23:20,658] Trial 54 pruned. 
[I 2026-03-18 22:23:21,202] Trial 71 finished with value: -2.3973418265627005 and parameters: {'n_layers_yyx': 1, 'hidden_size_yyx_l0': 5, 'context_size_yyx': 4, 'num_mix_components_yyx': 4, 'context_extractor_yyx': 'gru', 'activation_func_yyx': 'Tanh', 'L2_weight_yyx': 5.845963172435367e-05, 'L_entropy_weight_yyx': 6.18023724857199e-08, 'L_sep_weight_yyx': 3.64034035316338e-05, 'L_scale_weight_yyx': 6.870314573723383e-07, 'learning_rate_yyx': 0.0037697127659746398}. Best is trial 0 with value: -2.4076941594397367.
