[I 2026-03-18 18:21:24,282] Trial 49 pruned. 

Source events: 3828
Target events: 9421
Full model ln_yyx : 61.43048 nats/sec, 5.86853 nats/event
Full model Log loss : -0.51403
Full model ln_yyx : 66.61421 nats/sec, 6.36374 nats/event
Full model Log loss : -0.55400
Full model ln_yyx : 67.89144 nats/sec, 6.48576 nats/event
Full model Log loss : -0.55290
Full model ln_yyx : 68.47867 nats/sec, 6.54185 nats/event
Full model Log loss : -0.56290
Full model ln_yyx : 67.80024 nats/sec, 6.47704 nats/event
Full model Log loss : -0.54692
Full model ln_yyx : 65.92930 nats/sec, 6.29831 nats/event
Full model Log loss : -0.54490
Full model ln_yyx : 68.24674 nats/sec, 6.51970 nats/event
Full model Log loss : -0.58301
Full model ln_yyx : 67.61662 nats/sec, 6.45950 nats/event
Full model Log loss : -0.57106
Full model ln_yyx : 68.71661 nats/sec, 6.56458 nats/event
Full model Log loss : -0.57748
Full model ln_yyx : 69.00266 nats/sec, 6.59191 nats/event
Full model Log loss : -0.57297
Full model ln_yyx : 67.29310 nats/sec, 6.42859 nats/event
Full model Log loss : -0.55510
Full model ln_yyx : 69.57491 nats/sec, 6.64658 nats/event
Full model Log loss : -0.56380
Full model ln_yyx : 68.93197 nats/sec, 6.58516 nats/event
Full model Log loss : -0.55285
Full model ln_yyx : 67.42073 nats/sec, 6.44079 nats/event
Full model Log loss : -0.55650
Full model ln_yyx : 68.99539 nats/sec, 6.59122 nats/event
Full model Log loss : -0.55157
Full model ln_yyx : 66.82187 nats/sec, 6.38358 nats/event
Full model Log loss : -0.55536
Full model ln_yyx : 68.63713 nats/sec, 6.55699 nats/event
Full model Log loss : -0.56947
Full model ln_yyx : 68.67040 nats/sec, 6.56017 nats/event
Full model Log loss : -0.56948
Full model ln_yyx : 67.74979 nats/sec, 6.47222 nats/event
Full model Log loss : -0.56825
Optimization finished. Config saved to results/opt-full/opt_full_64_best_config.txt
[I 2026-03-18 18:21:26,375] Trial 25 pruned. 
[I 2026-03-18 18:21:27,980] Trial 36 pruned. 
[I 2026-03-18 18:21:29,028] Trial 32 finished with value: -1.263250361528943 and parameters: {'n_layers_yyx': 2, 'hidden_size_yyx_l0': 2, 'hidden_size_yyx_l1': 6, 'context_size_yyx': 4, 'num_mix_components_yyx': 3, 'context_extractor_yyx': 'lstm', 'activation_func_yyx': 'Tanh', 'L2_weight_yyx': 2.82273237625913e-05, 'L_entropy_weight_yyx': 5.759853660642409e-07, 'L_sep_weight_yyx': 7.215290879228608e-10, 'L_scale_weight_yyx': 8.95936664262364e-07, 'learning_rate_yyx': 0.006107159232011162}. Best is trial 7 with value: -1.272066817927052.
[I 2026-03-18 18:21:29,645] Trial 38 pruned. 
[I 2026-03-18 18:21:29,853] Trial 43 pruned. 
[I 2026-03-18 18:21:31,863] Trial 45 pruned. 
[I 2026-03-18 18:21:32,865] Trial 28 pruned. 
[I 2026-03-18 18:21:35,573] Trial 24 finished with value: -3.1366347118217206 and parameters: {'n_layers_yyx': 2, 'hidden_size_yyx_l0': 5, 'hidden_size_yyx_l1': 5, 'context_size_yyx': 3, 'num_mix_components_yyx': 4, 'context_extractor_yyx': 'gru', 'activation_func_yyx': 'ReLU', 'L2_weight_yyx': 3.7568397305248565e-08, 'L_entropy_weight_yyx': 1.0329217139145805e-10, 'L_sep_weight_yyx': 0.00023917378495912208, 'L_scale_weight_yyx': 7.22100368493936e-10, 'learning_rate_yyx': 0.0009965923145198714}. Best is trial 1 with value: -3.166268711244678.
[I 2026-03-18 18:21:39,998] Trial 33 pruned. 
[I 2026-03-18 18:21:40,659] Trial 35 pruned. 
[I 2026-03-18 18:21:42,010] Trial 45 pruned. 
[I 2026-03-18 18:21:42,065] Trial 38 finished with value: -3.1189251404585416 and parameters: {'n_layers_yyx': 2, 'hidden_size_yyx_l0': 5, 'hidden_size_yyx_l1': 6, 'context_size_yyx': 4, 'num_mix_components_yyx': 3, 'context_extractor_yyx': 'gru', 'activation_func_yyx': 'GELU', 'L2_weight_yyx': 3.3859755787252577e-09, 'L_entropy_weight_yyx': 7.908495424622341e-07, 'L_sep_weight_yyx': 2.39870368382467e-10, 'L_scale_weight_yyx': 6.045675870316251e-08, 'learning_rate_yyx': 0.001425951793241101}. Best is trial 20 with value: -3.1481007392302844.
[I 2026-03-18 18:21:45,115] Trial 37 pruned. 
[I 2026-03-18 18:21:45,116] Trial 26 pruned. 
[I 2026-03-18 18:21:52,761] Trial 29 pruned. 
[I 2026-03-18 18:21:57,745] Trial 36 pruned. 
[I 2026-03-18 18:21:58,224] Trial 35 pruned. 
[I 2026-03-18 18:22:11,216] Trial 46 pruned. 
[I 2026-03-18 18:22:12,838] Trial 28 pruned. 
[I 2026-03-18 18:22:15,912] Trial 36 pruned. 
[I 2026-03-18 18:22:15,918] Trial 44 pruned. 
[I 2026-03-18 18:22:17,955] Trial 27 finished with value: -3.1473986186655605 and parameters: {'n_layers_yyx': 2, 'hidden_size_yyx_l0': 6, 'hidden_size_yyx_l1': 3, 'context_size_yyx': 4, 'num_mix_components_yyx': 3, 'context_extractor_yyx': 'gru', 'activation_func_yyx': 'ReLU', 'L2_weight_yyx': 1.0980356571030635e-05, 'L_entropy_weight_yyx': 2.702301639025368e-08, 'L_sep_weight_yyx': 2.244872399498186e-09, 'L_scale_weight_yyx': 3.9978061249683363e-07, 'learning_rate_yyx': 0.006258961945065306}. Best is trial 23 with value: -3.1545382986021053.
[I 2026-03-18 18:22:19,096] Trial 45 pruned. 
[I 2026-03-18 18:22:19,367] Trial 25 pruned. 
[I 2026-03-18 18:22:22,071] Trial 31 finished with value: -1.2657598752852068 and parameters: {'n_layers_yyx': 1, 'hidden_size_yyx_l0': 6, 'context_size_yyx': 4, 'num_mix_components_yyx': 3, 'context_extractor_yyx': 'gru', 'activation_func_yyx': 'Tanh', 'L2_weight_yyx': 3.755886017445353e-07, 'L_entropy_weight_yyx': 3.3086050614428475e-06, 'L_sep_weight_yyx': 7.79174441268295e-09, 'L_scale_weight_yyx': 2.0491343887462595e-06, 'learning_rate_yyx': 0.007751802320308368}. Best is trial 24 with value: -1.2727326976613946.
[I 2026-03-18 18:22:23,898] Trial 33 finished with value: -3.1602368843454687 and parameters: {'n_layers_yyx': 2, 'hidden_size_yyx_l0': 6, 'hidden_size_yyx_l1': 3, 'context_size_yyx': 2, 'num_mix_components_yyx': 5, 'context_extractor_yyx': 'lstm', 'activation_func_yyx': 'Tanh', 'L2_weight_yyx': 5.282829839614291e-06, 'L_entropy_weight_yyx': 1.5493178676192445e-09, 'L_sep_weight_yyx': 7.1183875745412205e-06, 'L_scale_weight_yyx': 2.0352263917550271e-07, 'learning_rate_yyx': 0.009909767549437282}. Best is trial 10 with value: -3.1611070918248854.
[I 2026-03-18 18:22:23,983] Trial 39 pruned. 
[I 2026-03-18 18:22:24,744] Trial 28 finished with value: -1.2685478478394683 and parameters: {'n_layers_yyx': 1, 'hidden_size_yyx_l0': 5, 'context_size_yyx': 4, 'num_mix_components_yyx': 5, 'context_extractor_yyx': 'lstm', 'activation_func_yyx': 'Tanh', 'L2_weight_yyx': 5.182362732702532e-07, 'L_entropy_weight_yyx': 1.4505396641931479e-09, 'L_sep_weight_yyx': 7.860869804656309e-07, 'L_scale_weight_yyx': 1.7215157337873968e-09, 'learning_rate_yyx': 0.006611191661090689}. Best is trial 28 with value: -1.2685478478394683.
[I 2026-03-18 18:22:26,979] Trial 37 pruned. 
[I 2026-03-18 18:22:27,936] Trial 44 finished with value: -1.2670081767930121 and parameters: {'n_layers_yyx': 2, 'hidden_size_yyx_l0': 5, 'hidden_size_yyx_l1': 3, 'context_size_yyx': 4, 'num_mix_components_yyx': 5, 'context_extractor_yyx': 'lstm', 'activation_func_yyx': 'ReLU', 'L2_weight_yyx': 1.0667824967758353e-10, 'L_entropy_weight_yyx': 2.4768797955455778e-06, 'L_sep_weight_yyx': 1.239199682389746e-09, 'L_scale_weight_yyx': 0.0009440809662779958, 'learning_rate_yyx': 0.005449656808703199}. Best is trial 35 with value: -1.2719783113095324.
[I 2026-03-18 18:22:28,055] Trial 47 pruned. 
[I 2026-03-18 18:22:29,660] Trial 29 pruned. 
[I 2026-03-18 18:22:31,353] Trial 38 pruned. 
[I 2026-03-18 18:22:33,311] Trial 30 pruned. 
[I 2026-03-18 18:22:33,749] Trial 29 pruned. 
[I 2026-03-18 18:22:36,514] Trial 45 pruned. 
[I 2026-03-18 18:22:40,653] Trial 37 pruned. 
[I 2026-03-18 18:22:42,488] Trial 34 pruned. 
[I 2026-03-18 18:22:42,938] Trial 21 pruned. 
[I 2026-03-18 18:22:45,198] Trial 38 pruned. 
[I 2026-03-18 18:22:48,659] Trial 30 pruned. 
[I 2026-03-18 18:22:48,966] Trial 38 pruned. 
[I 2026-03-18 18:22:49,040] Trial 43 finished with value: -3.119318169719304 and parameters: {'n_layers_yyx': 2, 'hidden_size_yyx_l0': 2, 'hidden_size_yyx_l1': 6, 'context_size_yyx': 2, 'num_mix_components_yyx': 2, 'context_extractor_yyx': 'gru', 'activation_func_yyx': 'Tanh', 'L2_weight_yyx': 2.5024027420494156e-08, 'L_entropy_weight_yyx': 4.4942562029149964e-08, 'L_sep_weight_yyx': 2.427926969814942e-10, 'L_scale_weight_yyx': 6.56920700269222e-05, 'learning_rate_yyx': 0.009925948301595496}. Best is trial 20 with value: -3.160948786990499.
[I 2026-03-18 18:22:52,164] Trial 31 pruned. 
[I 2026-03-18 18:22:52,538] Trial 27 finished with value: -3.161937115338458 and parameters: {'n_layers_yyx': 2, 'hidden_size_yyx_l0': 3, 'hidden_size_yyx_l1': 4, 'context_size_yyx': 4, 'num_mix_components_yyx': 4, 'context_extractor_yyx': 'lstm', 'activation_func_yyx': 'ReLU', 'L2_weight_yyx': 3.5289615177736206e-10, 'L_entropy_weight_yyx': 2.500625467802755e-07, 'L_sep_weight_yyx': 8.47410652839501e-07, 'L_scale_weight_yyx': 1.6870970129155044e-07, 'learning_rate_yyx': 0.005939519652507411}. Best is trial 27 with value: -3.161937115338458.
[I 2026-03-18 18:22:54,083] Trial 39 pruned. 
[I 2026-03-18 18:22:54,603] Trial 46 pruned. 
[I 2026-03-18 18:22:58,971] Trial 45 pruned. 
[I 2026-03-18 18:22:59,392] Trial 46 pruned. 
[I 2026-03-18 18:23:00,225] Trial 34 finished with value: -1.2696179726648242 and parameters: {'n_layers_yyx': 2, 'hidden_size_yyx_l0': 3, 'hidden_size_yyx_l1': 6, 'context_size_yyx': 4, 'num_mix_components_yyx': 3, 'context_extractor_yyx': 'lstm', 'activation_func_yyx': 'Tanh', 'L2_weight_yyx': 0.0009229769393241791, 'L_entropy_weight_yyx': 2.499045345942797e-08, 'L_sep_weight_yyx': 5.926895930166201e-09, 'L_scale_weight_yyx': 2.6114335869891864e-08, 'learning_rate_yyx': 0.009841932444542723}. Best is trial 7 with value: -1.272066817927052.
[I 2026-03-18 18:23:01,341] Trial 26 pruned. 
[I 2026-03-18 18:23:02,379] Trial 32 pruned. 
[I 2026-03-18 18:23:02,608] Trial 28 pruned. 
[I 2026-03-18 18:23:02,957] Trial 46 finished with value: -1.2637309922308226 and parameters: {'n_layers_yyx': 1, 'hidden_size_yyx_l0': 6, 'context_size_yyx': 4, 'num_mix_components_yyx': 5, 'context_extractor_yyx': 'gru', 'activation_func_yyx': 'ReLU', 'L2_weight_yyx': 2.081775554730384e-10, 'L_entropy_weight_yyx': 1.645754442585736e-05, 'L_sep_weight_yyx': 2.1241825117915076e-09, 'L_scale_weight_yyx': 2.183515201171037e-10, 'learning_rate_yyx': 0.008666238491650958}. Best is trial 23 with value: -1.2721869844165175.
[I 2026-03-18 18:23:03,674] Trial 47 pruned. 
[I 2026-03-18 18:23:08,521] Trial 48 pruned. 
[I 2026-03-18 18:23:08,691] Trial 46 pruned. 
[I 2026-03-18 18:23:09,163] Trial 32 pruned. 
[I 2026-03-18 18:23:10,278] Trial 37 pruned. 
[I 2026-03-18 18:23:11,620] Trial 40 pruned. 
[I 2026-03-18 18:23:12,288] Trial 47 pruned. 
[I 2026-03-18 18:23:15,170] Trial 39 pruned. 
[I 2026-03-18 18:23:15,808] Trial 46 finished with value: -1.2700545051842653 and parameters: {'n_layers_yyx': 2, 'hidden_size_yyx_l0': 4, 'hidden_size_yyx_l1': 6, 'context_size_yyx': 4, 'num_mix_components_yyx': 4, 'context_extractor_yyx': 'lstm', 'activation_func_yyx': 'GELU', 'L2_weight_yyx': 0.0004913368368645642, 'L_entropy_weight_yyx': 1.9901867475329028e-08, 'L_sep_weight_yyx': 6.584173873534478e-10, 'L_scale_weight_yyx': 1.070517677860999e-09, 'learning_rate_yyx': 0.005854815283622097}. Best is trial 42 with value: -1.2710004090822118.
[I 2026-03-18 18:23:19,680] Trial 48 pruned. 
[I 2026-03-18 18:23:21,460] Trial 29 pruned. 
[I 2026-03-18 18:23:22,264] Trial 21 finished with value: -3.151217994296971 and parameters: {'n_layers_yyx': 2, 'hidden_size_yyx_l0': 6, 'hidden_size_yyx_l1': 5, 'context_size_yyx': 4, 'num_mix_components_yyx': 3, 'context_extractor_yyx': 'lstm', 'activation_func_yyx': 'GELU', 'L2_weight_yyx': 1.375762354706198e-10, 'L_entropy_weight_yyx': 3.100286164527313e-05, 'L_sep_weight_yyx': 8.251008404114696e-09, 'L_scale_weight_yyx': 4.9868714220298766e-05, 'learning_rate_yyx': 0.0038624122119526546}. Best is trial 5 with value: -3.154335707688014.
[I 2026-03-18 18:23:24,385] Trial 47 pruned. 
[I 2026-03-18 18:23:26,626] Trial 28 pruned. 
[I 2026-03-18 18:23:28,392] Trial 39 pruned. 
[I 2026-03-18 18:23:28,632] Trial 44 pruned. 
[I 2026-03-18 18:23:31,765] Trial 49 pruned. 

Source events: 5634
Target events: 12731
Full model ln_yyx : 200.37670 nats/sec, 14.16535 nats/event
Full model Log loss : -1.26086
Full model ln_yyx : 199.12650 nats/sec, 14.07697 nats/event
Full model Log loss : -1.25981
Full model ln_yyx : 194.78076 nats/sec, 13.76975 nats/event
Full model Log loss : -1.26531
Full model ln_yyx : 201.12752 nats/sec, 14.21843 nats/event
Full model Log loss : -1.26029
Full model ln_yyx : 198.76400 nats/sec, 14.05134 nats/event
Full model Log loss : -1.23621
Full model ln_yyx : 200.55572 nats/sec, 14.17800 nats/event
Full model Log loss : -1.25824
Full model ln_yyx : 195.36937 nats/sec, 13.81136 nats/event
Full model Log loss : -1.26346
Full model ln_yyx : 198.14501 nats/sec, 14.00758 nats/event
Full model Log loss : -1.27170
Full model ln_yyx : 200.48912 nats/sec, 14.17329 nats/event
Full model Log loss : -1.25440
Full model ln_yyx : 200.12823 nats/sec, 14.14778 nats/event
Full model Log loss : -1.26878
Full model ln_yyx : 199.64130 nats/sec, 14.11336 nats/event
Full model Log loss : -1.27198
Full model ln_yyx : 197.48501 nats/sec, 13.96092 nats/event
Full model Log loss : -1.26701
Optimization finished. Config saved to results/opt-full/opt_full_86_best_config.txt
[I 2026-03-18 18:23:33,565] Trial 27 finished with value: -3.148845115105199 and parameters: {'n_layers_yyx': 2, 'hidden_size_yyx_l0': 3, 'hidden_size_yyx_l1': 5, 'context_size_yyx': 4, 'num_mix_components_yyx': 3, 'context_extractor_yyx': 'lstm', 'activation_func_yyx': 'ReLU', 'L2_weight_yyx': 5.961390429883877e-10, 'L_entropy_weight_yyx': 1.6408642825238826e-08, 'L_sep_weight_yyx': 4.696840839150019e-08, 'L_scale_weight_yyx': 1.1475083795483818e-08, 'learning_rate_yyx': 0.006363585022868939}. Best is trial 1 with value: -3.152505646630136.
[I 2026-03-18 18:23:38,266] Trial 30 pruned. 
[I 2026-03-18 18:23:38,661] Trial 27 pruned. 
[I 2026-03-18 18:23:39,567] Trial 48 pruned. 
[I 2026-03-18 18:23:40,263] Trial 47 pruned. 
[I 2026-03-18 18:23:41,557] Trial 49 pruned. 

Source events: 3828
Target events: 12539
Full model ln_yyx : 91.00632 nats/sec, 6.53207 nats/event
Full model Log loss : -0.58101
Full model ln_yyx : 90.43536 nats/sec, 6.49109 nats/event
Full model Log loss : -0.56429
Full model ln_yyx : 91.23445 nats/sec, 6.54845 nats/event
Full model Log loss : -0.57825
Full model ln_yyx : 92.78163 nats/sec, 6.65950 nats/event
Full model Log loss : -0.58403
Full model ln_yyx : 72.29632 nats/sec, 5.18914 nats/event
Full model Log loss : -0.43861
Full model ln_yyx : 84.21906 nats/sec, 6.04491 nats/event
Full model Log loss : -0.52876
Full model ln_yyx : 92.62437 nats/sec, 6.64821 nats/event
Full model Log loss : -0.58282
Full model ln_yyx : 90.02704 nats/sec, 6.46179 nats/event
Full model Log loss : -0.56496
Full model ln_yyx : 89.22819 nats/sec, 6.40445 nats/event
Full model Log loss : -0.55204
Full model ln_yyx : 89.17964 nats/sec, 6.40096 nats/event
Full model Log loss : -0.55324
Full model ln_yyx : 89.56251 nats/sec, 6.42844 nats/event
Full model Log loss : -0.56995
Full model ln_yyx : 90.10190 nats/sec, 6.46716 nats/event
Full model Log loss : -0.56487
Full model ln_yyx : 89.38114 nats/sec, 6.41543 nats/event
Full model Log loss : -0.56001
Optimization finished. Config saved to results/opt-full/opt_full_65_best_config.txt
[I 2026-03-18 18:23:45,634] Trial 30 finished with value: -1.2657261423615123 and parameters: {'n_layers_yyx': 1, 'hidden_size_yyx_l0': 5, 'context_size_yyx': 4, 'num_mix_components_yyx': 4, 'context_extractor_yyx': 'lstm', 'activation_func_yyx': 'Tanh', 'L2_weight_yyx': 5.55157084274382e-07, 'L_entropy_weight_yyx': 1.863858535420172e-07, 'L_sep_weight_yyx': 7.221073093191436e-06, 'L_scale_weight_yyx': 3.1282682239183115e-09, 'learning_rate_yyx': 0.005755208934966516}. Best is trial 28 with value: -1.2685478478394683.
[I 2026-03-18 18:23:45,862] Trial 49 pruned. 

Source events: 5634
Target events: 10752
Full model ln_yyx : 167.11170 nats/sec, 13.98814 nats/event
Full model Log loss : -1.22864
Full model ln_yyx : 165.58801 nats/sec, 13.86060 nats/event
Full model Log loss : -1.23125
Full model ln_yyx : 164.19767 nats/sec, 13.74422 nats/event
Full model Log loss : -1.15449
Full model ln_yyx : 167.46568 nats/sec, 14.01777 nats/event
Full model Log loss : -1.26799
Full model ln_yyx : 165.96924 nats/sec, 13.89251 nats/event
Full model Log loss : -1.21314
Full model ln_yyx : 167.03531 nats/sec, 13.98175 nats/event
Full model Log loss : -1.26978
Full model ln_yyx : 168.07958 nats/sec, 14.06916 nats/event
Full model Log loss : -1.26567
Full model ln_yyx : 166.27060 nats/sec, 13.91774 nats/event
Full model Log loss : -1.25444
Full model ln_yyx : 167.40813 nats/sec, 14.01296 nats/event
Full model Log loss : -1.24419
Full model ln_yyx : 166.52318 nats/sec, 13.93888 nats/event
Full model Log loss : -1.24306
Full model ln_yyx : 169.14746 nats/sec, 14.15855 nats/event
Full model Log loss : -1.24703
Optimization finished. Config saved to results/opt-full/opt_full_93_best_config.txt
[I 2026-03-18 18:23:46,169] Trial 45 pruned. 
[I 2026-03-18 18:23:47,393] Trial 33 pruned. 
[I 2026-03-18 18:23:48,555] Trial 28 pruned. 
[I 2026-03-18 18:23:49,400] Trial 48 pruned. 
[I 2026-03-18 18:23:51,653] Trial 31 pruned. 
[I 2026-03-18 18:23:51,967] Trial 47 pruned. 
[I 2026-03-18 18:23:59,802] Trial 26 pruned. 
[I 2026-03-18 18:24:00,463] Trial 39 finished with value: -0.5824254178935265 and parameters: {'n_layers_yyx': 1, 'hidden_size_yyx_l0': 5, 'context_size_yyx': 4, 'num_mix_components_yyx': 3, 'context_extractor_yyx': 'lstm', 'activation_func_yyx': 'GELU', 'L2_weight_yyx': 9.566643003066796e-08, 'L_entropy_weight_yyx': 2.9029737525290578e-05, 'L_sep_weight_yyx': 2.3471910534505905e-08, 'L_scale_weight_yyx': 5.1058831235686755e-08, 'learning_rate_yyx': 0.0005855130036730793}. Best is trial 19 with value: -0.5893623740341837.
[I 2026-03-18 18:24:00,486] Trial 32 pruned. 
[I 2026-03-18 18:24:01,616] Trial 29 pruned. 
[I 2026-03-18 18:24:02,229] Trial 40 pruned. 
[I 2026-03-18 18:24:04,806] Trial 34 pruned. 
[I 2026-03-18 18:24:08,357] Trial 28 finished with value: -3.144980247831214 and parameters: {'n_layers_yyx': 1, 'hidden_size_yyx_l0': 3, 'context_size_yyx': 4, 'num_mix_components_yyx': 3, 'context_extractor_yyx': 'lstm', 'activation_func_yyx': 'GELU', 'L2_weight_yyx': 3.128222212489344e-08, 'L_entropy_weight_yyx': 3.23733632107684e-05, 'L_sep_weight_yyx': 5.5868138770428504e-08, 'L_scale_weight_yyx': 1.1373787717515117e-09, 'learning_rate_yyx': 0.0017920702711162275}. Best is trial 24 with value: -3.1533369159995748.
[I 2026-03-18 18:24:08,800] Trial 33 pruned. 
[I 2026-03-18 18:24:09,115] Trial 48 pruned. 
[I 2026-03-18 18:24:13,630] Trial 35 pruned. 
[I 2026-03-18 18:24:14,026] Trial 40 pruned. 
[I 2026-03-18 18:24:14,515] Trial 35 finished with value: -1.2642676164835085 and parameters: {'n_layers_yyx': 2, 'hidden_size_yyx_l0': 3, 'hidden_size_yyx_l1': 5, 'context_size_yyx': 3, 'num_mix_components_yyx': 3, 'context_extractor_yyx': 'lstm', 'activation_func_yyx': 'Tanh', 'L2_weight_yyx': 0.0002229292271721138, 'L_entropy_weight_yyx': 1.4553501553631647e-08, 'L_sep_weight_yyx': 8.455836813462378e-09, 'L_scale_weight_yyx': 1.1653938676934672e-08, 'learning_rate_yyx': 0.008524095855214823}. Best is trial 7 with value: -1.272066817927052.
[I 2026-03-18 18:24:16,049] Trial 33 finished with value: -1.265825366797597 and parameters: {'n_layers_yyx': 1, 'hidden_size_yyx_l0': 6, 'context_size_yyx': 4, 'num_mix_components_yyx': 3, 'context_extractor_yyx': 'gru', 'activation_func_yyx': 'Tanh', 'L2_weight_yyx': 1.1835411037480969e-06, 'L_entropy_weight_yyx': 5.665217971026072e-06, 'L_sep_weight_yyx': 3.483961483752185e-08, 'L_scale_weight_yyx': 1.1223635693459664e-07, 'learning_rate_yyx': 0.008030742950907024}. Best is trial 24 with value: -1.2727326976613946.
[I 2026-03-18 18:24:17,549] Trial 28 pruned. 
[I 2026-03-18 18:24:19,050] Trial 31 pruned. 
[I 2026-03-18 18:24:19,613] Trial 27 pruned. 
[I 2026-03-18 18:24:21,875] Trial 41 pruned. 
[I 2026-03-18 18:24:22,928] Trial 36 pruned. 
[I 2026-03-18 18:24:26,114] Trial 46 pruned. 
[I 2026-03-18 18:24:27,492] Trial 41 finished with value: -1.26078362033019 and parameters: {'n_layers_yyx': 1, 'hidden_size_yyx_l0': 6, 'context_size_yyx': 3, 'num_mix_components_yyx': 4, 'context_extractor_yyx': 'lstm', 'activation_func_yyx': 'Tanh', 'L2_weight_yyx': 5.960667842573918e-05, 'L_entropy_weight_yyx': 6.639250176813984e-06, 'L_sep_weight_yyx': 1.7615902575750976e-07, 'L_scale_weight_yyx': 2.9657624280855194e-08, 'learning_rate_yyx': 0.00744427397602981}. Best is trial 0 with value: -1.2691870881537193.
[I 2026-03-18 18:24:29,549] Trial 40 finished with value: -3.1464315511351586 and parameters: {'n_layers_yyx': 2, 'hidden_size_yyx_l0': 4, 'hidden_size_yyx_l1': 4, 'context_size_yyx': 4, 'num_mix_components_yyx': 5, 'context_extractor_yyx': 'lstm', 'activation_func_yyx': 'Tanh', 'L2_weight_yyx': 9.865124883371296e-08, 'L_entropy_weight_yyx': 7.305575422127666e-06, 'L_sep_weight_yyx': 1.2129902624218772e-09, 'L_scale_weight_yyx': 2.3006402676370648e-07, 'learning_rate_yyx': 0.004517497027639906}. Best is trial 20 with value: -3.1481007392302844.
[I 2026-03-18 18:24:29,892] Trial 42 pruned. 
[I 2026-03-18 18:24:31,094] Trial 36 pruned. 
[I 2026-03-18 18:24:31,647] Trial 37 pruned. 
[I 2026-03-18 18:24:33,580] Trial 29 pruned. 
[I 2026-03-18 18:24:37,796] Trial 43 pruned. 
[I 2026-03-18 18:24:46,289] Trial 44 pruned. 
[I 2026-03-18 18:24:49,010] Trial 37 pruned. 
[I 2026-03-18 18:24:53,934] Trial 45 pruned. 
[I 2026-03-18 18:24:55,337] Trial 34 pruned. 
