[I 2026-03-18 18:14:51,220] Trial 32 pruned. 
[I 2026-03-18 18:14:51,265] Trial 41 pruned. 
[I 2026-03-18 18:14:52,372] Trial 28 pruned. 
[I 2026-03-18 18:14:55,728] Trial 31 pruned. 
[I 2026-03-18 18:14:55,780] Trial 32 pruned. 
[I 2026-03-18 18:14:56,440] Trial 35 finished with value: -0.5532361729764873 and parameters: {'n_layers_yyx': 2, 'hidden_size_yyx_l0': 2, 'hidden_size_yyx_l1': 3, 'context_size_yyx': 2, 'num_mix_components_yyx': 1, 'context_extractor_yyx': 'gru', 'activation_func_yyx': 'GELU', 'L2_weight_yyx': 1.4509824551121986e-08, 'L_entropy_weight_yyx': 9.240475347273184e-10, 'L_sep_weight_yyx': 1.0702538005348977e-08, 'L_scale_weight_yyx': 2.6617756465209697e-07, 'learning_rate_yyx': 0.007052746591416194}. Best is trial 3 with value: -0.584032942865049.
[I 2026-03-18 18:14:58,504] Trial 39 pruned. 
[I 2026-03-18 18:15:01,516] Trial 23 pruned. 
[I 2026-03-18 18:15:02,121] Trial 27 pruned. 
[I 2026-03-18 18:15:02,195] Trial 42 pruned. 
[I 2026-03-18 18:15:02,680] Trial 33 pruned. 
[I 2026-03-18 18:15:04,478] Trial 22 finished with value: -1.255811116611671 and parameters: {'n_layers_yyx': 1, 'hidden_size_yyx_l0': 6, 'context_size_yyx': 3, 'num_mix_components_yyx': 5, 'context_extractor_yyx': 'lstm', 'activation_func_yyx': 'Tanh', 'L2_weight_yyx': 0.0001277271227284186, 'L_entropy_weight_yyx': 7.358562337650154e-08, 'L_sep_weight_yyx': 3.980195703740914e-06, 'L_scale_weight_yyx': 3.0507173635932298e-09, 'learning_rate_yyx': 0.009134912814848154}. Best is trial 0 with value: -1.2691870881537193.
[I 2026-03-18 18:15:09,123] Trial 28 pruned. 
[I 2026-03-18 18:15:10,002] Trial 40 pruned. 
[I 2026-03-18 18:15:13,158] Trial 19 pruned. 
[I 2026-03-18 18:15:14,721] Trial 34 pruned. 
[I 2026-03-18 18:15:16,764] Trial 33 pruned. 
[I 2026-03-18 18:15:16,973] Trial 36 pruned. 
[I 2026-03-18 18:15:17,317] Trial 32 pruned. 
[I 2026-03-18 18:15:18,467] Trial 25 finished with value: -3.158208110301014 and parameters: {'n_layers_yyx': 2, 'hidden_size_yyx_l0': 6, 'hidden_size_yyx_l1': 3, 'context_size_yyx': 2, 'num_mix_components_yyx': 5, 'context_extractor_yyx': 'lstm', 'activation_func_yyx': 'Tanh', 'L2_weight_yyx': 5.479698090650217e-07, 'L_entropy_weight_yyx': 1.3855135038963247e-09, 'L_sep_weight_yyx': 0.0002778584280246057, 'L_scale_weight_yyx': 2.1869414082061804e-08, 'learning_rate_yyx': 0.009742435609528435}. Best is trial 10 with value: -3.1611070918248854.
[I 2026-03-18 18:15:22,711] Trial 24 pruned. 
[I 2026-03-18 18:15:26,297] Trial 23 pruned. 
[I 2026-03-18 18:15:27,497] Trial 38 pruned. 
[I 2026-03-18 18:15:31,933] Trial 23 pruned. 
[I 2026-03-18 18:15:31,936] Trial 22 finished with value: -3.118107232895566 and parameters: {'n_layers_yyx': 2, 'hidden_size_yyx_l0': 4, 'hidden_size_yyx_l1': 5, 'context_size_yyx': 3, 'num_mix_components_yyx': 2, 'context_extractor_yyx': 'gru', 'activation_func_yyx': 'ReLU', 'L2_weight_yyx': 4.623133361539524e-09, 'L_entropy_weight_yyx': 9.918422154223891e-06, 'L_sep_weight_yyx': 8.65401217120176e-09, 'L_scale_weight_yyx': 3.4693374077656203e-09, 'learning_rate_yyx': 0.009757313709670026}. Best is trial 2 with value: -3.151229652723366.
[I 2026-03-18 18:15:34,067] Trial 25 pruned. 
[I 2026-03-18 18:15:36,281] Trial 29 pruned. 
[I 2026-03-18 18:15:36,957] Trial 34 pruned. 
[I 2026-03-18 18:15:36,991] Trial 24 pruned. 
[I 2026-03-18 18:15:41,753] Trial 32 pruned. 
[I 2026-03-18 18:15:42,583] Trial 18 finished with value: -1.2672644666294515 and parameters: {'n_layers_yyx': 1, 'hidden_size_yyx_l0': 5, 'context_size_yyx': 2, 'num_mix_components_yyx': 5, 'context_extractor_yyx': 'lstm', 'activation_func_yyx': 'Tanh', 'L2_weight_yyx': 2.120361972615483e-09, 'L_entropy_weight_yyx': 3.4641282981129817e-10, 'L_sep_weight_yyx': 4.519770608971847e-07, 'L_scale_weight_yyx': 1.6912999332971912e-07, 'learning_rate_yyx': 0.007548906705901539}. Best is trial 18 with value: -1.2672644666294515.
[I 2026-03-18 18:15:43,079] Trial 22 finished with value: -3.1672050771900433 and parameters: {'n_layers_yyx': 2, 'hidden_size_yyx_l0': 5, 'hidden_size_yyx_l1': 6, 'context_size_yyx': 4, 'num_mix_components_yyx': 4, 'context_extractor_yyx': 'gru', 'activation_func_yyx': 'Tanh', 'L2_weight_yyx': 5.455353073128042e-07, 'L_entropy_weight_yyx': 2.0967346048527e-08, 'L_sep_weight_yyx': 1.1839866966960909e-08, 'L_scale_weight_yyx': 1.2107634274646234e-10, 'learning_rate_yyx': 0.007418300915710201}. Best is trial 12 with value: -3.1682013088461884.
[I 2026-03-18 18:15:43,557] Trial 32 pruned. 
[I 2026-03-18 18:15:46,430] Trial 35 finished with value: -3.113658833447519 and parameters: {'n_layers_yyx': 1, 'hidden_size_yyx_l0': 5, 'context_size_yyx': 2, 'num_mix_components_yyx': 5, 'context_extractor_yyx': 'gru', 'activation_func_yyx': 'GELU', 'L2_weight_yyx': 6.859095881609958e-07, 'L_entropy_weight_yyx': 1.4466337153276822e-10, 'L_sep_weight_yyx': 0.00015372307901074546, 'L_scale_weight_yyx': 9.955173630507187e-10, 'learning_rate_yyx': 0.00807481222672019}. Best is trial 1 with value: -3.1505299612690063.
[I 2026-03-18 18:15:52,270] Trial 19 pruned. 
[I 2026-03-18 18:15:55,388] Trial 33 pruned. 
[I 2026-03-18 18:15:55,962] Trial 26 pruned. 
[I 2026-03-18 18:15:56,415] Trial 35 pruned. 
[I 2026-03-18 18:15:58,094] Trial 20 pruned. 
[I 2026-03-18 18:15:59,247] Trial 25 pruned. 
[I 2026-03-18 18:16:02,340] Trial 29 pruned. 
[I 2026-03-18 18:16:02,560] Trial 41 pruned. 
[I 2026-03-18 18:16:03,445] Trial 36 finished with value: -0.5553595373686275 and parameters: {'n_layers_yyx': 2, 'hidden_size_yyx_l0': 6, 'hidden_size_yyx_l1': 4, 'context_size_yyx': 1, 'num_mix_components_yyx': 2, 'context_extractor_yyx': 'lstm', 'activation_func_yyx': 'ReLU', 'L2_weight_yyx': 7.001131670360362e-09, 'L_entropy_weight_yyx': 1.9523246952088859e-10, 'L_sep_weight_yyx': 1.4633104539749368e-08, 'L_scale_weight_yyx': 0.0002946975480285321, 'learning_rate_yyx': 0.003731753533317366}. Best is trial 12 with value: -0.5830094706077523.
[I 2026-03-18 18:16:04,110] Trial 33 pruned. 
[I 2026-03-18 18:16:07,692] Trial 27 pruned. 
[I 2026-03-18 18:16:11,647] Trial 33 pruned. 
[I 2026-03-18 18:16:12,839] Trial 20 pruned. 
[I 2026-03-18 18:16:19,486] Trial 36 pruned. 
[I 2026-03-18 18:16:19,613] Trial 30 pruned. 
[I 2026-03-18 18:16:20,033] Trial 22 finished with value: -3.1470813110976614 and parameters: {'n_layers_yyx': 2, 'hidden_size_yyx_l0': 3, 'hidden_size_yyx_l1': 5, 'context_size_yyx': 3, 'num_mix_components_yyx': 5, 'context_extractor_yyx': 'lstm', 'activation_func_yyx': 'ReLU', 'L2_weight_yyx': 4.421669197628383e-09, 'L_entropy_weight_yyx': 5.402835778477433e-06, 'L_sep_weight_yyx': 2.514757542496853e-09, 'L_scale_weight_yyx': 6.133445684999272e-10, 'learning_rate_yyx': 0.0028615598405745345}. Best is trial 13 with value: -3.1559077725337215.
[I 2026-03-18 18:16:21,718] Trial 43 finished with value: -0.5857075057626591 and parameters: {'n_layers_yyx': 1, 'hidden_size_yyx_l0': 4, 'context_size_yyx': 1, 'num_mix_components_yyx': 5, 'context_extractor_yyx': 'lstm', 'activation_func_yyx': 'Tanh', 'L2_weight_yyx': 3.306466238394546e-10, 'L_entropy_weight_yyx': 2.7634599687926405e-09, 'L_sep_weight_yyx': 2.8871085912339257e-06, 'L_scale_weight_yyx': 1.6355224532950648e-07, 'learning_rate_yyx': 0.006522966585496701}. Best is trial 43 with value: -0.5857075057626591.
[I 2026-03-18 18:16:21,827] Trial 39 pruned. 
[I 2026-03-18 18:16:25,677] Trial 40 finished with value: -1.2705461004965848 and parameters: {'n_layers_yyx': 1, 'hidden_size_yyx_l0': 3, 'context_size_yyx': 4, 'num_mix_components_yyx': 4, 'context_extractor_yyx': 'lstm', 'activation_func_yyx': 'GELU', 'L2_weight_yyx': 1.3303691332918382e-07, 'L_entropy_weight_yyx': 1.7146730897357103e-07, 'L_sep_weight_yyx': 2.803549501549654e-07, 'L_scale_weight_yyx': 0.0009078341496153084, 'learning_rate_yyx': 0.003241036467086772}. Best is trial 40 with value: -1.2705461004965848.
[I 2026-03-18 18:16:31,679] Trial 34 pruned. 
[I 2026-03-18 18:16:32,230] Trial 36 pruned. 
[I 2026-03-18 18:16:34,377] Trial 35 finished with value: -1.2719783113095324 and parameters: {'n_layers_yyx': 2, 'hidden_size_yyx_l0': 5, 'hidden_size_yyx_l1': 3, 'context_size_yyx': 4, 'num_mix_components_yyx': 4, 'context_extractor_yyx': 'lstm', 'activation_func_yyx': 'ReLU', 'L2_weight_yyx': 6.953735199414834e-08, 'L_entropy_weight_yyx': 3.223871130536545e-06, 'L_sep_weight_yyx': 5.3739958364117636e-08, 'L_scale_weight_yyx': 1.2921455982421882e-09, 'learning_rate_yyx': 0.008388767497113057}. Best is trial 35 with value: -1.2719783113095324.
[I 2026-03-18 18:16:35,427] Trial 41 pruned. 
[I 2026-03-18 18:16:38,729] Trial 23 pruned. 
[I 2026-03-18 18:16:41,236] Trial 42 pruned. 
[I 2026-03-18 18:16:43,049] Trial 34 pruned. 
[I 2026-03-18 18:16:44,821] Trial 26 finished with value: -3.115544692597528 and parameters: {'n_layers_yyx': 2, 'hidden_size_yyx_l0': 5, 'hidden_size_yyx_l1': 3, 'context_size_yyx': 1, 'num_mix_components_yyx': 4, 'context_extractor_yyx': 'gru', 'activation_func_yyx': 'Tanh', 'L2_weight_yyx': 2.7779270803062424e-07, 'L_entropy_weight_yyx': 1.3520661217270493e-09, 'L_sep_weight_yyx': 0.00017747685093182208, 'L_scale_weight_yyx': 1.0745079986677802e-08, 'learning_rate_yyx': 0.00905835016311631}. Best is trial 10 with value: -3.1611070918248854.
[I 2026-03-18 18:16:45,105] Trial 35 pruned. 
[I 2026-03-18 18:16:46,543] Trial 37 finished with value: -0.5699491435264786 and parameters: {'n_layers_yyx': 2, 'hidden_size_yyx_l0': 5, 'hidden_size_yyx_l1': 6, 'context_size_yyx': 3, 'num_mix_components_yyx': 3, 'context_extractor_yyx': 'lstm', 'activation_func_yyx': 'GELU', 'L2_weight_yyx': 7.257069152147238e-09, 'L_entropy_weight_yyx': 2.337488127171057e-07, 'L_sep_weight_yyx': 9.440134373271149e-05, 'L_scale_weight_yyx': 4.443957299322582e-05, 'learning_rate_yyx': 0.0031347999734065244}. Best is trial 3 with value: -0.584032942865049.
[I 2026-03-18 18:16:47,098] Trial 42 pruned. 
[I 2026-03-18 18:16:47,657] Trial 34 pruned. 
[I 2026-03-18 18:16:49,610] Trial 27 finished with value: -0.5865394141027983 and parameters: {'n_layers_yyx': 1, 'hidden_size_yyx_l0': 5, 'context_size_yyx': 3, 'num_mix_components_yyx': 2, 'context_extractor_yyx': 'lstm', 'activation_func_yyx': 'Tanh', 'L2_weight_yyx': 1.2091586239170613e-06, 'L_entropy_weight_yyx': 1.2791758334130867e-05, 'L_sep_weight_yyx': 3.438551981282784e-09, 'L_scale_weight_yyx': 0.00041729339302965505, 'learning_rate_yyx': 0.0034318581806259446}. Best is trial 19 with value: -0.5893623740341837.
[I 2026-03-18 18:16:50,218] Trial 35 pruned. 
[I 2026-03-18 18:16:50,679] Trial 36 pruned. 
[I 2026-03-18 18:16:52,882] Trial 43 pruned. 
[I 2026-03-18 18:16:53,195] Trial 21 finished with value: -3.1517048344216967 and parameters: {'n_layers_yyx': 2, 'hidden_size_yyx_l0': 5, 'hidden_size_yyx_l1': 5, 'context_size_yyx': 4, 'num_mix_components_yyx': 4, 'context_extractor_yyx': 'lstm', 'activation_func_yyx': 'GELU', 'L2_weight_yyx': 1.2205433427932246e-05, 'L_entropy_weight_yyx': 1.4490090199905986e-08, 'L_sep_weight_yyx': 1.0610110695143978e-05, 'L_scale_weight_yyx': 4.5633581095060945e-10, 'learning_rate_yyx': 0.006621910341910631}. Best is trial 21 with value: -3.1517048344216967.
[I 2026-03-18 18:16:54,139] Trial 21 pruned. 
[I 2026-03-18 18:16:54,233] Trial 24 pruned. 
[I 2026-03-18 18:16:54,306] Trial 18 finished with value: -3.1184175462387476 and parameters: {'n_layers_yyx': 2, 'hidden_size_yyx_l0': 3, 'hidden_size_yyx_l1': 4, 'context_size_yyx': 1, 'num_mix_components_yyx': 2, 'context_extractor_yyx': 'lstm', 'activation_func_yyx': 'Tanh', 'L2_weight_yyx': 2.0064148235456306e-09, 'L_entropy_weight_yyx': 1.6431020741957023e-07, 'L_sep_weight_yyx': 5.388196293974916e-07, 'L_scale_weight_yyx': 0.0001853920606391923, 'learning_rate_yyx': 0.004212780518256281}. Best is trial 10 with value: -3.1515199681211117.
[I 2026-03-18 18:16:54,707] Trial 28 pruned. 
[I 2026-03-18 18:16:59,949] Trial 27 pruned. 
[I 2026-03-18 18:17:00,981] Trial 37 finished with value: -0.5694721961775705 and parameters: {'n_layers_yyx': 2, 'hidden_size_yyx_l0': 4, 'hidden_size_yyx_l1': 6, 'context_size_yyx': 3, 'num_mix_components_yyx': 3, 'context_extractor_yyx': 'lstm', 'activation_func_yyx': 'Tanh', 'L2_weight_yyx': 0.00011886657080217802, 'L_entropy_weight_yyx': 5.287824195512893e-08, 'L_sep_weight_yyx': 1.1626439968718226e-07, 'L_scale_weight_yyx': 1.714752544785125e-05, 'learning_rate_yyx': 0.008520165227090407}. Best is trial 12 with value: -0.5830094706077523.
[I 2026-03-18 18:17:01,495] Trial 28 finished with value: -1.2612577568801626 and parameters: {'n_layers_yyx': 1, 'hidden_size_yyx_l0': 4, 'context_size_yyx': 3, 'num_mix_components_yyx': 4, 'context_extractor_yyx': 'gru', 'activation_func_yyx': 'GELU', 'L2_weight_yyx': 1.587250862726449e-05, 'L_entropy_weight_yyx': 1.6712367124501722e-08, 'L_sep_weight_yyx': 5.365182909024971e-06, 'L_scale_weight_yyx': 3.930128533750744e-10, 'learning_rate_yyx': 0.005218417067982317}. Best is trial 24 with value: -1.2727326976613946.
[I 2026-03-18 18:17:01,650] Trial 37 pruned. 
[I 2026-03-18 18:17:05,547] Trial 35 pruned. 
[I 2026-03-18 18:17:05,799] Trial 37 pruned. 
[I 2026-03-18 18:17:06,993] Trial 36 pruned. 
[I 2026-03-18 18:17:07,279] Trial 44 pruned. 
[I 2026-03-18 18:17:08,593] Trial 36 pruned. 
[I 2026-03-18 18:17:12,191] Trial 38 pruned. 
[I 2026-03-18 18:17:13,532] Trial 22 pruned. 
[I 2026-03-18 18:17:16,537] Trial 38 pruned. 
[I 2026-03-18 18:17:17,422] Trial 23 finished with value: -3.1545382986021053 and parameters: {'n_layers_yyx': 2, 'hidden_size_yyx_l0': 6, 'hidden_size_yyx_l1': 3, 'context_size_yyx': 4, 'num_mix_components_yyx': 4, 'context_extractor_yyx': 'gru', 'activation_func_yyx': 'ReLU', 'L2_weight_yyx': 7.99147834516406e-07, 'L_entropy_weight_yyx': 5.620209501735817e-10, 'L_sep_weight_yyx': 1.2597758995355784e-08, 'L_scale_weight_yyx': 2.0032202061862082e-05, 'learning_rate_yyx': 0.00640549416379962}. Best is trial 23 with value: -3.1545382986021053.
[I 2026-03-18 18:17:17,675] Trial 37 pruned. 
[I 2026-03-18 18:17:17,749] Trial 32 finished with value: -3.1481651893028846 and parameters: {'n_layers_yyx': 1, 'hidden_size_yyx_l0': 4, 'context_size_yyx': 4, 'num_mix_components_yyx': 1, 'context_extractor_yyx': 'lstm', 'activation_func_yyx': 'ReLU', 'L2_weight_yyx': 1.0693095504104505e-10, 'L_entropy_weight_yyx': 7.176129264107169e-07, 'L_sep_weight_yyx': 4.591598691754315e-09, 'L_scale_weight_yyx': 2.2056557553140074e-06, 'learning_rate_yyx': 0.007461810435280817}. Best is trial 16 with value: -3.149974272486285.
[I 2026-03-18 18:17:24,267] Trial 38 pruned. 
[I 2026-03-18 18:17:24,318] Trial 30 finished with value: -1.1543764124956677 and parameters: {'n_layers_yyx': 2, 'hidden_size_yyx_l0': 2, 'hidden_size_yyx_l1': 3, 'context_size_yyx': 1, 'num_mix_components_yyx': 4, 'context_extractor_yyx': 'lstm', 'activation_func_yyx': 'GELU', 'L2_weight_yyx': 1.8860955265379785e-08, 'L_entropy_weight_yyx': 7.693004488637055e-08, 'L_sep_weight_yyx': 3.079600529517021e-08, 'L_scale_weight_yyx': 2.2223273560863766e-07, 'learning_rate_yyx': 0.007431221387411206}. Best is trial 7 with value: -1.272066817927052.
[I 2026-03-18 18:17:28,094] Trial 45 pruned. 
[I 2026-03-18 18:17:28,879] Trial 37 pruned. 
[I 2026-03-18 18:17:31,557] Trial 23 pruned. 
[I 2026-03-18 18:17:33,021] Trial 39 pruned. 
[I 2026-03-18 18:17:33,286] Trial 43 pruned. 
[I 2026-03-18 18:17:33,841] Trial 44 finished with value: -0.5860173200478744 and parameters: {'n_layers_yyx': 1, 'hidden_size_yyx_l0': 4, 'context_size_yyx': 1, 'num_mix_components_yyx': 5, 'context_extractor_yyx': 'lstm', 'activation_func_yyx': 'Tanh', 'L2_weight_yyx': 6.516738640619297e-08, 'L_entropy_weight_yyx': 2.0884335170261624e-09, 'L_sep_weight_yyx': 2.410680843101485e-06, 'L_scale_weight_yyx': 4.7673198548295247e-07, 'learning_rate_yyx': 0.004214307498270751}. Best is trial 44 with value: -0.5860173200478744.
[I 2026-03-18 18:17:34,783] Trial 23 pruned. 
[I 2026-03-18 18:17:35,853] Trial 24 pruned. 
[I 2026-03-18 18:17:36,680] Trial 23 pruned. 
[I 2026-03-18 18:17:36,957] Trial 38 pruned. 
[I 2026-03-18 18:17:37,210] Trial 22 pruned. 
[I 2026-03-18 18:17:39,309] Trial 38 pruned. 
[I 2026-03-18 18:17:40,204] Trial 19 finished with value: -3.1512176943415673 and parameters: {'n_layers_yyx': 2, 'hidden_size_yyx_l0': 6, 'hidden_size_yyx_l1': 5, 'context_size_yyx': 4, 'num_mix_components_yyx': 3, 'context_extractor_yyx': 'lstm', 'activation_func_yyx': 'GELU', 'L2_weight_yyx': 2.998775426590924e-08, 'L_entropy_weight_yyx': 2.9068919661688095e-05, 'L_sep_weight_yyx': 3.1527597752966746e-08, 'L_scale_weight_yyx': 6.374308105285458e-05, 'learning_rate_yyx': 0.0038228471972584725}. Best is trial 5 with value: -3.154335707688014.
[I 2026-03-18 18:17:40,294] Trial 19 finished with value: -1.265229470187767 and parameters: {'n_layers_yyx': 1, 'hidden_size_yyx_l0': 5, 'context_size_yyx': 3, 'num_mix_components_yyx': 4, 'context_extractor_yyx': 'lstm', 'activation_func_yyx': 'Tanh', 'L2_weight_yyx': 2.2533159085041034e-09, 'L_entropy_weight_yyx': 3.51062081092544e-09, 'L_sep_weight_yyx': 1.642790700544877e-08, 'L_scale_weight_yyx': 9.183174061896358e-08, 'learning_rate_yyx': 0.006582719850986834}. Best is trial 18 with value: -1.2672644666294515.
[I 2026-03-18 18:17:40,457] Trial 26 finished with value: -1.2412015735111483 and parameters: {'n_layers_yyx': 1, 'hidden_size_yyx_l0': 4, 'context_size_yyx': 4, 'num_mix_components_yyx': 3, 'context_extractor_yyx': 'lstm', 'activation_func_yyx': 'Tanh', 'L2_weight_yyx': 3.849541091699137e-05, 'L_entropy_weight_yyx': 2.2557286897655312e-10, 'L_sep_weight_yyx': 4.1844677946520004e-10, 'L_scale_weight_yyx': 4.948141401330645e-07, 'learning_rate_yyx': 0.0043938164411325056}. Best is trial 0 with value: -1.2691870881537193.
[I 2026-03-18 18:17:41,184] Trial 28 pruned. 
[I 2026-03-18 18:17:42,614] Trial 44 pruned. 
[I 2026-03-18 18:17:43,526] Trial 40 pruned. 
[I 2026-03-18 18:17:46,979] Trial 46 pruned. 
[I 2026-03-18 18:17:47,163] Trial 36 pruned. 
[I 2026-03-18 18:17:49,159] Trial 21 pruned. 
[I 2026-03-18 18:17:50,199] Trial 24 finished with value: -3.186714411526843 and parameters: {'n_layers_yyx': 2, 'hidden_size_yyx_l0': 5, 'hidden_size_yyx_l1': 4, 'context_size_yyx': 3, 'num_mix_components_yyx': 4, 'context_extractor_yyx': 'lstm', 'activation_func_yyx': 'ReLU', 'L2_weight_yyx': 1.363730093437191e-05, 'L_entropy_weight_yyx': 3.99734551550011e-10, 'L_sep_weight_yyx': 1.692934979775578e-07, 'L_scale_weight_yyx': 4.965085799526928e-06, 'learning_rate_yyx': 0.002140039326098455}. Best is trial 12 with value: -3.1893335216865584.
[I 2026-03-18 18:17:50,973] Trial 39 pruned. 
[I 2026-03-18 18:17:51,431] Trial 29 finished with value: -0.5746813830516033 and parameters: {'n_layers_yyx': 1, 'hidden_size_yyx_l0': 6, 'context_size_yyx': 3, 'num_mix_components_yyx': 2, 'context_extractor_yyx': 'lstm', 'activation_func_yyx': 'Tanh', 'L2_weight_yyx': 1.9481928433268444e-07, 'L_entropy_weight_yyx': 1.1540098035072534e-05, 'L_sep_weight_yyx': 0.0006627359603893851, 'L_scale_weight_yyx': 0.0008651897234557648, 'learning_rate_yyx': 0.006740422390255927}. Best is trial 19 with value: -0.5893623740341837.
[I 2026-03-18 18:17:53,485] Trial 28 finished with value: -1.2729716309844004 and parameters: {'n_layers_yyx': 2, 'hidden_size_yyx_l0': 3, 'hidden_size_yyx_l1': 6, 'context_size_yyx': 4, 'num_mix_components_yyx': 5, 'context_extractor_yyx': 'lstm', 'activation_func_yyx': 'Tanh', 'L2_weight_yyx': 9.968224403846157e-06, 'L_entropy_weight_yyx': 4.65685205696823e-06, 'L_sep_weight_yyx': 9.794725280178002e-08, 'L_scale_weight_yyx': 0.00017402262494132243, 'learning_rate_yyx': 0.002307358033001306}. Best is trial 2 with value: -1.2804754530695341.
[I 2026-03-18 18:17:54,081] Trial 45 pruned. 
[I 2026-03-18 18:17:54,793] Trial 25 pruned. 
[I 2026-03-18 18:17:56,937] Trial 23 pruned. 
[I 2026-03-18 18:17:57,178] Trial 47 pruned. 
[I 2026-03-18 18:17:58,860] Trial 37 pruned. 
[I 2026-03-18 18:17:58,974] Trial 30 pruned. 
[I 2026-03-18 18:17:59,458] Trial 27 pruned. 
[I 2026-03-18 18:18:00,696] Trial 33 pruned. 
[I 2026-03-18 18:18:00,889] Trial 46 pruned. 
[I 2026-03-18 18:18:02,460] Trial 39 pruned. 
[I 2026-03-18 18:18:02,612] Trial 31 pruned. 
[I 2026-03-18 18:18:06,651] Trial 28 pruned. 
[I 2026-03-18 18:18:07,015] Trial 39 pruned. 
[I 2026-03-18 18:18:07,628] Trial 47 pruned. 
[I 2026-03-18 18:18:09,027] Trial 25 pruned. 
[I 2026-03-18 18:18:10,406] Trial 31 pruned. 
[I 2026-03-18 18:18:12,127] Trial 40 finished with value: -1.2464956540938006 and parameters: {'n_layers_yyx': 2, 'hidden_size_yyx_l0': 5, 'hidden_size_yyx_l1': 6, 'context_size_yyx': 1, 'num_mix_components_yyx': 2, 'context_extractor_yyx': 'gru', 'activation_func_yyx': 'GELU', 'L2_weight_yyx': 0.00041965896449314193, 'L_entropy_weight_yyx': 1.2330444480181846e-08, 'L_sep_weight_yyx': 4.259077438317029e-05, 'L_scale_weight_yyx': 0.0006126928171895135, 'learning_rate_yyx': 0.00879066245570745}. Best is trial 18 with value: -1.2691942310156972.
[I 2026-03-18 18:18:12,563] Trial 45 pruned. 
[I 2026-03-18 18:18:12,587] Trial 38 pruned. 
[I 2026-03-18 18:18:17,714] Trial 24 pruned. 
[I 2026-03-18 18:18:18,247] Trial 41 pruned. 
[I 2026-03-18 18:18:18,666] Trial 29 pruned. 
[I 2026-03-18 18:18:22,244] Trial 29 pruned. 
[I 2026-03-18 18:18:22,927] Trial 32 pruned. 
[I 2026-03-18 18:18:25,821] Trial 39 pruned. 
[I 2026-03-18 18:18:25,986] Trial 39 pruned. 
[I 2026-03-18 18:18:28,486] Trial 37 pruned. 
[I 2026-03-18 18:18:28,776] Trial 41 finished with value: -0.5694756173366038 and parameters: {'n_layers_yyx': 2, 'hidden_size_yyx_l0': 4, 'hidden_size_yyx_l1': 6, 'context_size_yyx': 3, 'num_mix_components_yyx': 3, 'context_extractor_yyx': 'lstm', 'activation_func_yyx': 'Tanh', 'L2_weight_yyx': 9.795283595448673e-05, 'L_entropy_weight_yyx': 1.4917819097540716e-07, 'L_sep_weight_yyx': 1.1075237519373792e-07, 'L_scale_weight_yyx': 2.169419675246749e-05, 'learning_rate_yyx': 0.00872810016322844}. Best is trial 12 with value: -0.5830094706077523.
