[I 2026-03-18 18:34:48,126] Trial 44 finished with value: -3.150918275595926 and parameters: {'n_layers_yyx': 2, 'hidden_size_yyx_l0': 2, 'hidden_size_yyx_l1': 6, 'context_size_yyx': 4, 'num_mix_components_yyx': 5, 'context_extractor_yyx': 'lstm', 'activation_func_yyx': 'GELU', 'L2_weight_yyx': 3.2823500387913122e-09, 'L_entropy_weight_yyx': 0.0007326251341471771, 'L_sep_weight_yyx': 3.3894206972020635e-10, 'L_scale_weight_yyx': 1.2336130848261592e-10, 'learning_rate_yyx': 0.009417429149039898}. Best is trial 44 with value: -3.150918275595926.
[I 2026-03-18 18:34:48,326] Trial 40 pruned. 
[I 2026-03-18 18:34:51,679] Trial 40 pruned. 
[I 2026-03-18 18:34:59,021] Trial 45 pruned. 
[I 2026-03-18 18:35:02,388] Trial 43 finished with value: -3.151910733220174 and parameters: {'n_layers_yyx': 2, 'hidden_size_yyx_l0': 6, 'hidden_size_yyx_l1': 4, 'context_size_yyx': 2, 'num_mix_components_yyx': 5, 'context_extractor_yyx': 'lstm', 'activation_func_yyx': 'ReLU', 'L2_weight_yyx': 3.947502932506567e-05, 'L_entropy_weight_yyx': 2.158276425446889e-09, 'L_sep_weight_yyx': 3.2840139097840567e-06, 'L_scale_weight_yyx': 5.4628038859460494e-06, 'learning_rate_yyx': 0.0075370667941828595}. Best is trial 12 with value: -3.1893335216865584.
[I 2026-03-18 18:35:03,900] Trial 41 pruned. 
[I 2026-03-18 18:35:05,399] Trial 36 finished with value: -3.1268384164093614 and parameters: {'n_layers_yyx': 1, 'hidden_size_yyx_l0': 5, 'context_size_yyx': 4, 'num_mix_components_yyx': 2, 'context_extractor_yyx': 'gru', 'activation_func_yyx': 'GELU', 'L2_weight_yyx': 2.864992676686912e-10, 'L_entropy_weight_yyx': 1.4087569746762454e-10, 'L_sep_weight_yyx': 1.169635378813014e-07, 'L_scale_weight_yyx': 5.2809231625498836e-08, 'learning_rate_yyx': 0.009956351722674195}. Best is trial 27 with value: -3.161937115338458.
[I 2026-03-18 18:35:06,270] Trial 31 pruned. 
[I 2026-03-18 18:35:16,848] Trial 42 pruned. 
[I 2026-03-18 18:35:19,398] Trial 35 finished with value: -3.152933766100806 and parameters: {'n_layers_yyx': 2, 'hidden_size_yyx_l0': 6, 'hidden_size_yyx_l1': 4, 'context_size_yyx': 4, 'num_mix_components_yyx': 5, 'context_extractor_yyx': 'gru', 'activation_func_yyx': 'GELU', 'L2_weight_yyx': 2.293665465932621e-06, 'L_entropy_weight_yyx': 2.529765355556277e-09, 'L_sep_weight_yyx': 0.0001855123297909287, 'L_scale_weight_yyx': 4.2663404088151403e-10, 'learning_rate_yyx': 0.009316360266184511}. Best is trial 34 with value: -3.153257338167012.
[I 2026-03-18 18:35:21,944] Trial 43 finished with value: -3.1553765114968924 and parameters: {'n_layers_yyx': 2, 'hidden_size_yyx_l0': 5, 'hidden_size_yyx_l1': 6, 'context_size_yyx': 3, 'num_mix_components_yyx': 5, 'context_extractor_yyx': 'gru', 'activation_func_yyx': 'Tanh', 'L2_weight_yyx': 3.822965799663451e-08, 'L_entropy_weight_yyx': 1.0993614124710532e-08, 'L_sep_weight_yyx': 3.172613342314396e-09, 'L_scale_weight_yyx': 1.152591547109001e-06, 'learning_rate_yyx': 0.0025761074644470383}. Best is trial 10 with value: -3.1611070918248854.
[I 2026-03-18 18:35:32,513] Trial 32 finished with value: -3.149023578248305 and parameters: {'n_layers_yyx': 2, 'hidden_size_yyx_l0': 6, 'hidden_size_yyx_l1': 5, 'context_size_yyx': 4, 'num_mix_components_yyx': 3, 'context_extractor_yyx': 'lstm', 'activation_func_yyx': 'GELU', 'L2_weight_yyx': 1.1793986778563173e-10, 'L_entropy_weight_yyx': 1.0945096514466222e-05, 'L_sep_weight_yyx': 1.7375577383711915e-07, 'L_scale_weight_yyx': 6.165915222805541e-05, 'learning_rate_yyx': 0.004057464638286003}. Best is trial 5 with value: -3.154335707688014.
[I 2026-03-18 18:35:35,757] Trial 32 pruned. 
[I 2026-03-18 18:35:45,890] Trial 43 pruned. 
[I 2026-03-18 18:35:50,109] Trial 36 pruned. 
[I 2026-03-18 18:35:58,143] Trial 44 pruned. 
[I 2026-03-18 18:35:58,374] Trial 44 finished with value: -3.178176084721645 and parameters: {'n_layers_yyx': 2, 'hidden_size_yyx_l0': 5, 'hidden_size_yyx_l1': 4, 'context_size_yyx': 1, 'num_mix_components_yyx': 4, 'context_extractor_yyx': 'lstm', 'activation_func_yyx': 'ReLU', 'L2_weight_yyx': 4.590920222685206e-06, 'L_entropy_weight_yyx': 1.713646761043404e-07, 'L_sep_weight_yyx': 1.0928778863744581e-05, 'L_scale_weight_yyx': 1.696847282717666e-06, 'learning_rate_yyx': 0.008333785358272356}. Best is trial 12 with value: -3.1893335216865584.
[I 2026-03-18 18:36:09,231] Trial 47 finished with value: -3.165409153508706 and parameters: {'n_layers_yyx': 2, 'hidden_size_yyx_l0': 3, 'hidden_size_yyx_l1': 5, 'context_size_yyx': 4, 'num_mix_components_yyx': 4, 'context_extractor_yyx': 'gru', 'activation_func_yyx': 'GELU', 'L2_weight_yyx': 1.1332649061666831e-08, 'L_entropy_weight_yyx': 9.656344894635904e-05, 'L_sep_weight_yyx': 1.7630039586024081e-09, 'L_scale_weight_yyx': 1.8049985940639303e-10, 'learning_rate_yyx': 0.009848184352852753}. Best is trial 12 with value: -3.1682013088461884.
[I 2026-03-18 18:36:15,951] Trial 37 finished with value: -3.11855711992287 and parameters: {'n_layers_yyx': 1, 'hidden_size_yyx_l0': 4, 'context_size_yyx': 3, 'num_mix_components_yyx': 1, 'context_extractor_yyx': 'gru', 'activation_func_yyx': 'ReLU', 'L2_weight_yyx': 2.984677861067971e-08, 'L_entropy_weight_yyx': 0.0002876256578671389, 'L_sep_weight_yyx': 5.239624069601715e-09, 'L_scale_weight_yyx': 7.061655823450905e-10, 'learning_rate_yyx': 0.002016055825208385}. Best is trial 1 with value: -3.152505646630136.
[I 2026-03-18 18:36:19,597] Trial 37 pruned. 
[I 2026-03-18 18:36:21,772] Trial 48 pruned. 
[I 2026-03-18 18:36:28,841] Trial 33 finished with value: -3.1213913403705638 and parameters: {'n_layers_yyx': 2, 'hidden_size_yyx_l0': 5, 'hidden_size_yyx_l1': 6, 'context_size_yyx': 4, 'num_mix_components_yyx': 4, 'context_extractor_yyx': 'lstm', 'activation_func_yyx': 'GELU', 'L2_weight_yyx': 1.0124739450991652e-10, 'L_entropy_weight_yyx': 1.708515271250869e-06, 'L_sep_weight_yyx': 8.3248828640869e-09, 'L_scale_weight_yyx': 0.00012105571712256375, 'learning_rate_yyx': 0.007191131859593516}. Best is trial 5 with value: -3.154335707688014.
[I 2026-03-18 18:36:32,022] Trial 46 finished with value: -3.120773049195982 and parameters: {'n_layers_yyx': 1, 'hidden_size_yyx_l0': 6, 'context_size_yyx': 4, 'num_mix_components_yyx': 3, 'context_extractor_yyx': 'gru', 'activation_func_yyx': 'ReLU', 'L2_weight_yyx': 8.223986491047097e-07, 'L_entropy_weight_yyx': 0.0001785609920711026, 'L_sep_weight_yyx': 6.608020722599068e-09, 'L_scale_weight_yyx': 2.3117322688002416e-05, 'learning_rate_yyx': 0.009217477284114092}. Best is trial 23 with value: -3.1545382986021053.
[I 2026-03-18 18:36:35,849] Trial 44 finished with value: -3.128450181910156 and parameters: {'n_layers_yyx': 2, 'hidden_size_yyx_l0': 6, 'hidden_size_yyx_l1': 5, 'context_size_yyx': 4, 'num_mix_components_yyx': 5, 'context_extractor_yyx': 'gru', 'activation_func_yyx': 'Tanh', 'L2_weight_yyx': 4.173153155103158e-08, 'L_entropy_weight_yyx': 5.732285215742771e-10, 'L_sep_weight_yyx': 1.1283378267669375e-08, 'L_scale_weight_yyx': 3.183271766481401e-06, 'learning_rate_yyx': 0.006213007150753244}. Best is trial 10 with value: -3.1611070918248854.
[I 2026-03-18 18:36:42,861] Trial 37 finished with value: -3.1530700486818164 and parameters: {'n_layers_yyx': 1, 'hidden_size_yyx_l0': 5, 'context_size_yyx': 4, 'num_mix_components_yyx': 2, 'context_extractor_yyx': 'gru', 'activation_func_yyx': 'ReLU', 'L2_weight_yyx': 3.699730363159099e-09, 'L_entropy_weight_yyx': 5.8045605255567e-10, 'L_sep_weight_yyx': 2.5229632636156412e-08, 'L_scale_weight_yyx': 1.2916701191030636e-07, 'learning_rate_yyx': 0.007079904729677935}. Best is trial 27 with value: -3.161937115338458.
[I 2026-03-18 18:36:45,765] Trial 41 finished with value: -3.168842214085981 and parameters: {'n_layers_yyx': 2, 'hidden_size_yyx_l0': 2, 'hidden_size_yyx_l1': 5, 'context_size_yyx': 3, 'num_mix_components_yyx': 3, 'context_extractor_yyx': 'lstm', 'activation_func_yyx': 'ReLU', 'L2_weight_yyx': 5.42081838191394e-10, 'L_entropy_weight_yyx': 5.5862871940797e-06, 'L_sep_weight_yyx': 5.018408349643069e-08, 'L_scale_weight_yyx': 1.3841151869837407e-08, 'learning_rate_yyx': 0.008391013859688082}. Best is trial 41 with value: -3.168842214085981.
[I 2026-03-18 18:36:47,851] Trial 45 finished with value: -3.1510005043146405 and parameters: {'n_layers_yyx': 2, 'hidden_size_yyx_l0': 2, 'hidden_size_yyx_l1': 6, 'context_size_yyx': 4, 'num_mix_components_yyx': 5, 'context_extractor_yyx': 'lstm', 'activation_func_yyx': 'GELU', 'L2_weight_yyx': 2.690732364064848e-09, 'L_entropy_weight_yyx': 0.00030835692837737533, 'L_sep_weight_yyx': 2.5967959247854073e-10, 'L_scale_weight_yyx': 1.396050707197253e-10, 'learning_rate_yyx': 0.009175694500363457}. Best is trial 45 with value: -3.1510005043146405.
[I 2026-03-18 18:36:48,322] Trial 49 pruned. 

Source events: 54211
Target events: 8618
Full model ln_yyx : 2310.62483 nats/sec, 241.30452 nats/event
Full model Log loss : -3.12727
Full model ln_yyx : 2315.16962 nats/sec, 241.77914 nats/event
Full model Log loss : -3.14518
Full model ln_yyx : 2339.98192 nats/sec, 244.37036 nats/event
Full model Log loss : -3.15438
Full model ln_yyx : 2336.22838 nats/sec, 243.97836 nats/event
Full model Log loss : -3.16367
Full model ln_yyx : 2322.01224 nats/sec, 242.49374 nats/event
Full model Log loss : -3.13526
Full model ln_yyx : 2350.23547 nats/sec, 245.44116 nats/event
Full model Log loss : -3.16820
Full model ln_yyx : 2344.14402 nats/sec, 244.80502 nats/event
Full model Log loss : -3.16820
Full model ln_yyx : 2346.80738 nats/sec, 245.08316 nats/event
Full model Log loss : -3.16326
Full model ln_yyx : 2339.76842 nats/sec, 244.34806 nats/event
Full model Log loss : -3.16721
Full model ln_yyx : 2300.48026 nats/sec, 240.24510 nats/event
Full model Log loss : -3.12234
Full model ln_yyx : 2349.56614 nats/sec, 245.37126 nats/event
Full model Log loss : -3.16541
Optimization finished. Config saved to results/opt-full/opt_full_80_best_config.txt
[I 2026-03-18 18:36:57,403] Trial 43 finished with value: -3.146947607039866 and parameters: {'n_layers_yyx': 2, 'hidden_size_yyx_l0': 6, 'hidden_size_yyx_l1': 4, 'context_size_yyx': 2, 'num_mix_components_yyx': 1, 'context_extractor_yyx': 'gru', 'activation_func_yyx': 'ReLU', 'L2_weight_yyx': 2.556435897702985e-08, 'L_entropy_weight_yyx': 5.50784921800045e-10, 'L_sep_weight_yyx': 1.0511650265712427e-09, 'L_scale_weight_yyx': 6.173726302362125e-09, 'learning_rate_yyx': 0.006572150160692262}. Best is trial 2 with value: -3.151229652723366.
[I 2026-03-18 18:37:00,204] Trial 47 pruned. 
[I 2026-03-18 18:37:01,623] Trial 45 pruned. 
[I 2026-03-18 18:37:09,137] Trial 44 pruned. 
[I 2026-03-18 18:37:09,878] Trial 38 pruned. 
[I 2026-03-18 18:37:12,708] Trial 45 pruned. 
[I 2026-03-18 18:37:19,482] Trial 45 finished with value: -3.1803185841979764 and parameters: {'n_layers_yyx': 2, 'hidden_size_yyx_l0': 6, 'hidden_size_yyx_l1': 6, 'context_size_yyx': 2, 'num_mix_components_yyx': 5, 'context_extractor_yyx': 'lstm', 'activation_func_yyx': 'ReLU', 'L2_weight_yyx': 7.961204765219668e-06, 'L_entropy_weight_yyx': 7.993863707325491e-10, 'L_sep_weight_yyx': 1.819467776308372e-07, 'L_scale_weight_yyx': 5.485857884017002e-05, 'learning_rate_yyx': 0.005988795801801539}. Best is trial 12 with value: -3.1893335216865584.
[I 2026-03-18 18:37:32,455] Trial 38 pruned. 
[I 2026-03-18 18:37:40,539] Trial 46 pruned. 
[I 2026-03-18 18:37:51,563] Trial 42 pruned. 
[I 2026-03-18 18:38:01,594] Trial 39 pruned. 
[I 2026-03-18 18:38:04,762] Trial 33 finished with value: -3.14937885322898 and parameters: {'n_layers_yyx': 1, 'hidden_size_yyx_l0': 6, 'context_size_yyx': 2, 'num_mix_components_yyx': 2, 'context_extractor_yyx': 'gru', 'activation_func_yyx': 'Tanh', 'L2_weight_yyx': 7.514172646494025e-06, 'L_entropy_weight_yyx': 6.192388422994405e-05, 'L_sep_weight_yyx': 0.0004912091991374321, 'L_scale_weight_yyx': 3.872242891320905e-08, 'learning_rate_yyx': 0.009606147844717638}. Best is trial 10 with value: -3.1515199681211117.
[I 2026-03-18 18:38:15,921] Trial 46 pruned. 
[I 2026-03-18 18:38:16,929] Trial 48 pruned. 
[I 2026-03-18 18:38:18,105] Trial 38 finished with value: -3.1533387030307227 and parameters: {'n_layers_yyx': 2, 'hidden_size_yyx_l0': 6, 'hidden_size_yyx_l1': 4, 'context_size_yyx': 4, 'num_mix_components_yyx': 5, 'context_extractor_yyx': 'gru', 'activation_func_yyx': 'GELU', 'L2_weight_yyx': 1.5807288542777683e-07, 'L_entropy_weight_yyx': 4.821582165119194e-09, 'L_sep_weight_yyx': 5.917441353740832e-05, 'L_scale_weight_yyx': 1.0410455101932289e-08, 'learning_rate_yyx': 0.008591844013460682}. Best is trial 38 with value: -3.1533387030307227.
[I 2026-03-18 18:38:18,655] Trial 34 finished with value: -3.152395307719172 and parameters: {'n_layers_yyx': 2, 'hidden_size_yyx_l0': 6, 'hidden_size_yyx_l1': 5, 'context_size_yyx': 4, 'num_mix_components_yyx': 3, 'context_extractor_yyx': 'lstm', 'activation_func_yyx': 'GELU', 'L2_weight_yyx': 1.0201032376274293e-09, 'L_entropy_weight_yyx': 0.00040797460458292444, 'L_sep_weight_yyx': 5.784355220484053e-10, 'L_scale_weight_yyx': 5.791785222750436e-06, 'learning_rate_yyx': 0.005592414399545726}. Best is trial 5 with value: -3.154335707688014.
[I 2026-03-18 18:38:20,854] Trial 46 finished with value: -3.150427587033668 and parameters: {'n_layers_yyx': 2, 'hidden_size_yyx_l0': 2, 'hidden_size_yyx_l1': 6, 'context_size_yyx': 4, 'num_mix_components_yyx': 5, 'context_extractor_yyx': 'lstm', 'activation_func_yyx': 'GELU', 'L2_weight_yyx': 5.356663409067373e-10, 'L_entropy_weight_yyx': 0.0006017248089813678, 'L_sep_weight_yyx': 3.7477598308146094e-10, 'L_scale_weight_yyx': 1.2225061525755922e-10, 'learning_rate_yyx': 0.009882851109881184}. Best is trial 45 with value: -3.1510005043146405.
[I 2026-03-18 18:38:21,586] Trial 45 finished with value: -3.1137076964060584 and parameters: {'n_layers_yyx': 2, 'hidden_size_yyx_l0': 6, 'hidden_size_yyx_l1': 5, 'context_size_yyx': 2, 'num_mix_components_yyx': 1, 'context_extractor_yyx': 'gru', 'activation_func_yyx': 'ReLU', 'L2_weight_yyx': 1.644510199803303e-08, 'L_entropy_weight_yyx': 5.140828826619172e-10, 'L_sep_weight_yyx': 1.0286516149985039e-09, 'L_scale_weight_yyx': 3.9765612464847725e-09, 'learning_rate_yyx': 0.0087153764233347}. Best is trial 2 with value: -3.151229652723366.
[I 2026-03-18 18:38:29,196] Trial 40 pruned. 
[I 2026-03-18 18:38:32,396] Trial 34 pruned. 
[I 2026-03-18 18:38:40,490] Trial 41 pruned. 
[I 2026-03-18 18:38:42,359] Trial 47 pruned. 
[I 2026-03-18 18:38:47,413] Trial 46 pruned. 
[I 2026-03-18 18:38:51,892] Trial 48 pruned. 
[I 2026-03-18 18:38:56,940] Trial 47 pruned. 
[I 2026-03-18 18:38:57,313] Trial 35 pruned. 
[I 2026-03-18 18:39:15,360] Trial 43 finished with value: -3.1392704364831086 and parameters: {'n_layers_yyx': 2, 'hidden_size_yyx_l0': 2, 'hidden_size_yyx_l1': 6, 'context_size_yyx': 3, 'num_mix_components_yyx': 3, 'context_extractor_yyx': 'lstm', 'activation_func_yyx': 'ReLU', 'L2_weight_yyx': 6.934134749878234e-10, 'L_entropy_weight_yyx': 4.542801009875271e-06, 'L_sep_weight_yyx': 7.746359261497054e-08, 'L_scale_weight_yyx': 2.5387310539026757e-09, 'learning_rate_yyx': 0.008223805042543482}. Best is trial 41 with value: -3.168842214085981.
[I 2026-03-18 18:39:15,888] Trial 46 finished with value: -3.186414120526771 and parameters: {'n_layers_yyx': 2, 'hidden_size_yyx_l0': 6, 'hidden_size_yyx_l1': 5, 'context_size_yyx': 2, 'num_mix_components_yyx': 5, 'context_extractor_yyx': 'lstm', 'activation_func_yyx': 'ReLU', 'L2_weight_yyx': 2.299273585065358e-05, 'L_entropy_weight_yyx': 2.0361681862571318e-10, 'L_sep_weight_yyx': 4.424094683527488e-07, 'L_scale_weight_yyx': 0.0009596097642292493, 'learning_rate_yyx': 0.006806759826059127}. Best is trial 12 with value: -3.1893335216865584.
[I 2026-03-18 18:39:16,621] Trial 49 pruned. 

Source events: 54211
Target events: 9421
Full model ln_yyx : 2525.98930 nats/sec, 241.31094 nats/event
Full model Log loss : -3.11788
Full model ln_yyx : 2546.42046 nats/sec, 243.26275 nats/event
Full model Log loss : -3.12673
Full model ln_yyx : 2531.34834 nats/sec, 241.82290 nats/event
Full model Log loss : -3.12218
Full model ln_yyx : 2511.32576 nats/sec, 239.91011 nats/event
Full model Log loss : -3.11105
Full model ln_yyx : 2557.33719 nats/sec, 244.30564 nats/event
Full model Log loss : -3.15773
Full model ln_yyx : 2577.47059 nats/sec, 246.22901 nats/event
Full model Log loss : -3.16111
Full model ln_yyx : 2555.15315 nats/sec, 244.09700 nats/event
Full model Log loss : -3.15485
Full model ln_yyx : 2553.62577 nats/sec, 243.95109 nats/event
Full model Log loss : -3.15821
Full model ln_yyx : 2519.44732 nats/sec, 240.68598 nats/event
Full model Log loss : -3.11554
Full model ln_yyx : 2556.50923 nats/sec, 244.22655 nats/event
Full model Log loss : -3.16024
Full model ln_yyx : 2556.89780 nats/sec, 244.26367 nats/event
Full model Log loss : -3.16065
Full model ln_yyx : 2565.18582 nats/sec, 245.05543 nats/event
Full model Log loss : -3.15621
Full model ln_yyx : 2557.15968 nats/sec, 244.28869 nats/event
Full model Log loss : -3.15529
Full model ln_yyx : 2571.96210 nats/sec, 245.70278 nats/event
Full model Log loss : -3.16020
Full model ln_yyx : 2548.12304 nats/sec, 243.42540 nats/event
Full model Log loss : -3.15538
Full model ln_yyx : 2538.47548 nats/sec, 242.50376 nats/event
Full model Log loss : -3.12845
Optimization finished. Config saved to results/opt-full/opt_full_81_best_config.txt
[I 2026-03-18 18:39:21,956] Trial 48 pruned. 
[I 2026-03-18 18:39:22,670] Trial 36 pruned. 
[I 2026-03-18 18:39:26,271] Trial 35 pruned. 
[I 2026-03-18 18:39:28,131] Trial 47 pruned. 
[I 2026-03-18 18:39:30,370] Trial 39 pruned. 
[I 2026-03-18 18:39:32,351] Trial 49 pruned. 

Source events: 54211
Target events: 14713
Full model ln_yyx : 3942.45214 nats/sec, 241.16135 nats/event
Full model Log loss : -3.11270
Full model ln_yyx : 3979.27707 nats/sec, 243.41394 nats/event
Full model Log loss : -3.14573
Full model ln_yyx : 3989.89006 nats/sec, 244.06315 nats/event
Full model Log loss : -3.15123
Full model ln_yyx : 3928.99070 nats/sec, 240.33791 nats/event
Full model Log loss : -3.10731
Full model ln_yyx : 3977.48881 nats/sec, 243.30456 nats/event
Full model Log loss : -3.14706
Full model ln_yyx : 3977.11997 nats/sec, 243.28199 nats/event
Full model Log loss : -3.14173
Full model ln_yyx : 3965.45605 nats/sec, 242.56851 nats/event
Full model Log loss : -3.15030
Full model ln_yyx : 3956.22398 nats/sec, 242.00378 nats/event
Full model Log loss : -3.11841
Full model ln_yyx : 3965.40616 nats/sec, 242.56546 nats/event
Full model Log loss : -3.11811
Full model ln_yyx : 3985.28899 nats/sec, 243.78170 nats/event
Full model Log loss : -3.14105
Full model ln_yyx : 3964.74723 nats/sec, 242.52515 nats/event
Full model Log loss : -3.11789
Full model ln_yyx : 3962.33498 nats/sec, 242.37759 nats/event
Full model Log loss : -3.11432
Full model ln_yyx : 4006.91269 nats/sec, 245.10443 nats/event
Full model Log loss : -3.14695
Full model ln_yyx : 3959.37534 nats/sec, 242.19655 nats/event
Full model Log loss : -3.11371
Optimization finished. Config saved to results/opt-full/opt_full_70_best_config.txt
[I 2026-03-18 18:39:41,775] Trial 40 pruned. 
[I 2026-03-18 18:39:48,295] Trial 37 pruned. 
[I 2026-03-18 18:40:02,056] Trial 47 finished with value: -3.157340093673615 and parameters: {'n_layers_yyx': 2, 'hidden_size_yyx_l0': 5, 'hidden_size_yyx_l1': 6, 'context_size_yyx': 4, 'num_mix_components_yyx': 4, 'context_extractor_yyx': 'gru', 'activation_func_yyx': 'GELU', 'L2_weight_yyx': 1.5372013696950169e-06, 'L_entropy_weight_yyx': 3.1887066919002294e-07, 'L_sep_weight_yyx': 4.121974121090123e-07, 'L_scale_weight_yyx': 0.00040140251400199437, 'learning_rate_yyx': 0.006875104004757133}. Best is trial 12 with value: -3.1893335216865584.
[I 2026-03-18 18:40:14,352] Trial 38 pruned. 
[I 2026-03-18 18:40:16,401] Trial 39 finished with value: -3.1621467102733707 and parameters: {'n_layers_yyx': 1, 'hidden_size_yyx_l0': 5, 'context_size_yyx': 4, 'num_mix_components_yyx': 3, 'context_extractor_yyx': 'gru', 'activation_func_yyx': 'ReLU', 'L2_weight_yyx': 1.0966096677740609e-09, 'L_entropy_weight_yyx': 4.521508056619439e-08, 'L_sep_weight_yyx': 2.7184570658859196e-05, 'L_scale_weight_yyx': 9.300608029729471e-09, 'learning_rate_yyx': 0.008733084592858514}. Best is trial 39 with value: -3.1621467102733707.
[I 2026-03-18 18:40:25,109] Trial 39 pruned. 
[I 2026-03-18 18:40:34,569] Trial 36 pruned. 
[I 2026-03-18 18:40:36,303] Trial 40 pruned. 
[I 2026-03-18 18:40:36,369] Trial 48 pruned. 
[I 2026-03-18 18:40:37,281] Trial 42 finished with value: -3.1495212180984056 and parameters: {'n_layers_yyx': 1, 'hidden_size_yyx_l0': 2, 'context_size_yyx': 4, 'num_mix_components_yyx': 3, 'context_extractor_yyx': 'gru', 'activation_func_yyx': 'GELU', 'L2_weight_yyx': 7.640306786956004e-07, 'L_entropy_weight_yyx': 9.606834432036197e-05, 'L_sep_weight_yyx': 0.00016153085446553737, 'L_scale_weight_yyx': 2.4131392747625137e-06, 'learning_rate_yyx': 0.007255273695080631}. Best is trial 1 with value: -3.152505646630136.
