[I 2026-03-18 17:23:03,139] Trial 3 finished with value: -3.1501368402794143 and parameters: {'n_layers_yyx': 1, 'hidden_size_yyx_l0': 6, 'context_size_yyx': 4, 'num_mix_components_yyx': 5, 'context_extractor_yyx': 'lstm', 'activation_func_yyx': 'GELU', 'L2_weight_yyx': 1.6682816613342906e-10, 'L_entropy_weight_yyx': 1.188562847752561e-09, 'L_sep_weight_yyx': 4.2900075946329604e-06, 'L_scale_weight_yyx': 1.9980247847415548e-06, 'learning_rate_yyx': 0.003929172079040102}. Best is trial 3 with value: -3.1501368402794143.
[I 2026-03-18 17:23:05,250] Trial 6 pruned. 
[I 2026-03-18 17:23:14,083] Trial 11 finished with value: -1.2530689768341685 and parameters: {'n_layers_yyx': 2, 'hidden_size_yyx_l0': 2, 'hidden_size_yyx_l1': 6, 'context_size_yyx': 1, 'num_mix_components_yyx': 3, 'context_extractor_yyx': 'gru', 'activation_func_yyx': 'Tanh', 'L2_weight_yyx': 3.640633263821735e-07, 'L_entropy_weight_yyx': 6.948379284595318e-09, 'L_sep_weight_yyx': 1.0646006709585985e-10, 'L_scale_weight_yyx': 9.74123375548023e-09, 'learning_rate_yyx': 0.00999785490283519}. Best is trial 0 with value: -1.255221580181016.
[I 2026-03-18 17:23:33,072] Trial 19 pruned. 
[I 2026-03-18 17:23:33,250] Trial 17 pruned. 
[I 2026-03-18 17:23:38,225] Trial 11 pruned. 
[I 2026-03-18 17:23:58,185] Trial 10 finished with value: -3.15619056189562 and parameters: {'n_layers_yyx': 2, 'hidden_size_yyx_l0': 3, 'hidden_size_yyx_l1': 6, 'context_size_yyx': 4, 'num_mix_components_yyx': 3, 'context_extractor_yyx': 'gru', 'activation_func_yyx': 'Tanh', 'L2_weight_yyx': 2.7588478976280026e-08, 'L_entropy_weight_yyx': 1.2664492672497828e-08, 'L_sep_weight_yyx': 2.382440807772922e-10, 'L_scale_weight_yyx': 3.728060449612721e-05, 'learning_rate_yyx': 0.009093066114173888}. Best is trial 2 with value: -3.1580584124267483.
[I 2026-03-18 17:24:02,108] Trial 7 pruned. 
[I 2026-03-18 17:24:06,736] Trial 4 finished with value: -1.2131372546973378 and parameters: {'n_layers_yyx': 1, 'hidden_size_yyx_l0': 2, 'context_size_yyx': 4, 'num_mix_components_yyx': 1, 'context_extractor_yyx': 'gru', 'activation_func_yyx': 'ReLU', 'L2_weight_yyx': 1.2311544315245528e-10, 'L_entropy_weight_yyx': 1.2188747730940577e-06, 'L_sep_weight_yyx': 1.8338525346365283e-07, 'L_scale_weight_yyx': 0.0009449870589967169, 'learning_rate_yyx': 0.0005893505280178668}. Best is trial 3 with value: -1.2679934898277747.
[I 2026-03-18 17:24:19,733] Trial 7 pruned. 
[I 2026-03-18 17:24:47,073] Trial 20 pruned. 
[I 2026-03-18 17:24:52,335] Trial 9 pruned. 
[I 2026-03-18 17:24:57,543] Trial 12 pruned. 
[I 2026-03-18 17:25:01,219] Trial 8 finished with value: -3.163666902197897 and parameters: {'n_layers_yyx': 2, 'hidden_size_yyx_l0': 5, 'hidden_size_yyx_l1': 5, 'context_size_yyx': 4, 'num_mix_components_yyx': 3, 'context_extractor_yyx': 'gru', 'activation_func_yyx': 'Tanh', 'L2_weight_yyx': 1.72250429647192e-06, 'L_entropy_weight_yyx': 5.42838787066186e-07, 'L_sep_weight_yyx': 4.5355349859568405e-09, 'L_scale_weight_yyx': 6.601501492218293e-10, 'learning_rate_yyx': 0.004102205466974287}. Best is trial 8 with value: -3.163666902197897.
[I 2026-03-18 17:25:01,872] Trial 16 pruned. 
[I 2026-03-18 17:25:09,339] Trial 11 pruned. 
[I 2026-03-18 17:25:12,415] Trial 5 pruned. 
[I 2026-03-18 17:25:12,534] Trial 13 finished with value: -0.5729941219870294 and parameters: {'n_layers_yyx': 1, 'hidden_size_yyx_l0': 5, 'context_size_yyx': 3, 'num_mix_components_yyx': 3, 'context_extractor_yyx': 'gru', 'activation_func_yyx': 'ReLU', 'L2_weight_yyx': 1.0379454965667737e-10, 'L_entropy_weight_yyx': 9.074706832260015e-08, 'L_sep_weight_yyx': 9.806446734221636e-06, 'L_scale_weight_yyx': 1.1812352098109034e-08, 'learning_rate_yyx': 0.009658957902724884}. Best is trial 11 with value: -0.5771698879572515.
[I 2026-03-18 17:25:22,523] Trial 12 pruned. 
[I 2026-03-18 17:26:00,089] Trial 21 pruned. 
[I 2026-03-18 17:26:18,150] Trial 9 pruned. 
[I 2026-03-18 17:26:20,351] Trial 12 pruned. 
[I 2026-03-18 17:26:20,774] Trial 6 pruned. 
[I 2026-03-18 17:26:24,993] Trial 8 pruned. 
[I 2026-03-18 17:26:30,859] Trial 12 pruned. 
[I 2026-03-18 17:26:30,888] Trial 7 finished with value: -0.565504491247206 and parameters: {'n_layers_yyx': 1, 'hidden_size_yyx_l0': 2, 'context_size_yyx': 4, 'num_mix_components_yyx': 3, 'context_extractor_yyx': 'lstm', 'activation_func_yyx': 'ReLU', 'L2_weight_yyx': 1.4960933663460197e-05, 'L_entropy_weight_yyx': 2.5718785084561263e-09, 'L_sep_weight_yyx': 1.5022683778271107e-06, 'L_scale_weight_yyx': 1.623692725295872e-08, 'learning_rate_yyx': 0.007552168698544807}. Best is trial 4 with value: -0.5804501078315746.
[I 2026-03-18 17:26:31,042] Trial 17 pruned. 
[I 2026-03-18 17:26:35,136] Trial 9 finished with value: -3.1403899797695582 and parameters: {'n_layers_yyx': 1, 'hidden_size_yyx_l0': 5, 'context_size_yyx': 2, 'num_mix_components_yyx': 5, 'context_extractor_yyx': 'gru', 'activation_func_yyx': 'ReLU', 'L2_weight_yyx': 3.07589640592013e-09, 'L_entropy_weight_yyx': 1.2919855222995474e-06, 'L_sep_weight_yyx': 1.2582129858611387e-10, 'L_scale_weight_yyx': 0.0006164526677762255, 'learning_rate_yyx': 0.002445827464538251}. Best is trial 2 with value: -3.1501405578480686.
[I 2026-03-18 17:26:40,589] Trial 11 finished with value: -3.1110516872287226 and parameters: {'n_layers_yyx': 2, 'hidden_size_yyx_l0': 2, 'hidden_size_yyx_l1': 6, 'context_size_yyx': 2, 'num_mix_components_yyx': 4, 'context_extractor_yyx': 'gru', 'activation_func_yyx': 'GELU', 'L2_weight_yyx': 1.2214431670678522e-07, 'L_entropy_weight_yyx': 5.672916222252474e-09, 'L_sep_weight_yyx': 1.9621840501580834e-08, 'L_scale_weight_yyx': 1.7552819553084133e-08, 'learning_rate_yyx': 0.0021291392879462102}. Best is trial 0 with value: -3.1460828145824977.
[I 2026-03-18 17:26:53,626] Trial 11 pruned. 
[I 2026-03-18 17:27:02,670] Trial 13 pruned. 
[I 2026-03-18 17:27:03,673] Trial 5 finished with value: -1.2396478422083224 and parameters: {'n_layers_yyx': 1, 'hidden_size_yyx_l0': 6, 'context_size_yyx': 1, 'num_mix_components_yyx': 5, 'context_extractor_yyx': 'gru', 'activation_func_yyx': 'GELU', 'L2_weight_yyx': 8.374607167337822e-09, 'L_entropy_weight_yyx': 0.00012956003814752174, 'L_sep_weight_yyx': 0.0005480649995750623, 'L_scale_weight_yyx': 5.518162353047043e-09, 'learning_rate_yyx': 0.004121986534435507}. Best is trial 2 with value: -1.2804754530695341.
[I 2026-03-18 17:27:31,157] Trial 8 finished with value: -3.1506303241940805 and parameters: {'n_layers_yyx': 1, 'hidden_size_yyx_l0': 6, 'context_size_yyx': 2, 'num_mix_components_yyx': 3, 'context_extractor_yyx': 'gru', 'activation_func_yyx': 'Tanh', 'L2_weight_yyx': 0.0001837019319063595, 'L_entropy_weight_yyx': 8.29325454322325e-05, 'L_sep_weight_yyx': 2.0091897443906859e-10, 'L_scale_weight_yyx': 3.643441257781506e-06, 'learning_rate_yyx': 0.009545983847246255}. Best is trial 8 with value: -3.1506303241940805.
[I 2026-03-18 17:27:36,195] Trial 6 pruned. 
[I 2026-03-18 17:27:36,249] Trial 9 pruned. 
[I 2026-03-18 17:27:38,351] Trial 13 pruned. 
[I 2026-03-18 17:27:39,740] Trial 8 finished with value: -3.157725544756595 and parameters: {'n_layers_yyx': 2, 'hidden_size_yyx_l0': 6, 'hidden_size_yyx_l1': 6, 'context_size_yyx': 2, 'num_mix_components_yyx': 4, 'context_extractor_yyx': 'lstm', 'activation_func_yyx': 'Tanh', 'L2_weight_yyx': 1.783112745372529e-05, 'L_entropy_weight_yyx': 5.064981396131062e-09, 'L_sep_weight_yyx': 6.958438538071416e-05, 'L_scale_weight_yyx': 0.0005916509744114078, 'learning_rate_yyx': 0.00836845527666157}. Best is trial 8 with value: -3.157725544756595.
[I 2026-03-18 17:27:50,113] Trial 10 pruned. 
[I 2026-03-18 17:28:01,930] Trial 18 pruned. 
[I 2026-03-18 17:28:03,044] Trial 13 pruned. 
[I 2026-03-18 17:28:08,292] Trial 10 pruned. 
[I 2026-03-18 17:28:10,830] Trial 22 pruned. 
[I 2026-03-18 17:28:37,445] Trial 7 pruned. 
[I 2026-03-18 17:28:38,471] Trial 12 finished with value: -0.5830094706077523 and parameters: {'n_layers_yyx': 2, 'hidden_size_yyx_l0': 5, 'hidden_size_yyx_l1': 5, 'context_size_yyx': 4, 'num_mix_components_yyx': 5, 'context_extractor_yyx': 'lstm', 'activation_func_yyx': 'GELU', 'L2_weight_yyx': 1.9571383710522097e-06, 'L_entropy_weight_yyx': 2.1415577676281945e-10, 'L_sep_weight_yyx': 5.904938239791591e-06, 'L_scale_weight_yyx': 3.536176307385855e-07, 'learning_rate_yyx': 0.009770228979245829}. Best is trial 12 with value: -0.5830094706077523.
[I 2026-03-18 17:28:54,975] Trial 11 finished with value: -3.1395587696325435 and parameters: {'n_layers_yyx': 2, 'hidden_size_yyx_l0': 5, 'hidden_size_yyx_l1': 4, 'context_size_yyx': 1, 'num_mix_components_yyx': 4, 'context_extractor_yyx': 'lstm', 'activation_func_yyx': 'ReLU', 'L2_weight_yyx': 0.0005749657568067652, 'L_entropy_weight_yyx': 1.244063768692342e-10, 'L_sep_weight_yyx': 0.00021980011882869027, 'L_scale_weight_yyx': 1.1002424877910713e-10, 'learning_rate_yyx': 0.009849985539538393}. Best is trial 1 with value: -3.1505299612690063.
[I 2026-03-18 17:29:08,258] Trial 9 pruned. 
[I 2026-03-18 17:29:15,645] Trial 14 pruned. 
[I 2026-03-18 17:29:28,093] Trial 19 pruned. 
[I 2026-03-18 17:29:45,590] Trial 13 pruned. 
[I 2026-03-18 17:29:49,695] Trial 14 pruned. 
[I 2026-03-18 17:30:29,107] Trial 15 pruned. 
[I 2026-03-18 17:30:39,582] Trial 8 finished with value: -1.265112378019943 and parameters: {'n_layers_yyx': 1, 'hidden_size_yyx_l0': 6, 'context_size_yyx': 4, 'num_mix_components_yyx': 5, 'context_extractor_yyx': 'gru', 'activation_func_yyx': 'ReLU', 'L2_weight_yyx': 3.973335234071784e-08, 'L_entropy_weight_yyx': 7.505386475886181e-07, 'L_sep_weight_yyx': 2.805315372152577e-10, 'L_scale_weight_yyx': 4.77692174007162e-06, 'learning_rate_yyx': 0.0037744111132652584}. Best is trial 8 with value: -1.265112378019943.
[I 2026-03-18 17:30:43,617] Trial 4 pruned. 
[I 2026-03-18 17:30:52,503] Trial 14 pruned. 
[I 2026-03-18 17:31:03,717] Trial 11 pruned. 
[I 2026-03-18 17:31:44,350] Trial 12 finished with value: -1.261898047822681 and parameters: {'n_layers_yyx': 1, 'hidden_size_yyx_l0': 6, 'context_size_yyx': 4, 'num_mix_components_yyx': 5, 'context_extractor_yyx': 'gru', 'activation_func_yyx': 'ReLU', 'L2_weight_yyx': 1.6934175302045773e-10, 'L_entropy_weight_yyx': 0.0005899386280692766, 'L_sep_weight_yyx': 1.286971312004189e-10, 'L_scale_weight_yyx': 1.6694705124660246e-10, 'learning_rate_yyx': 0.00963970954341728}. Best is trial 10 with value: -1.2677577894848948.
[I 2026-03-18 17:31:45,267] Trial 8 pruned. 
[I 2026-03-18 17:31:57,012] Trial 14 pruned. 
[I 2026-03-18 17:32:06,132] Trial 5 pruned. 
[I 2026-03-18 17:32:07,338] Trial 15 pruned. 
[I 2026-03-18 17:32:15,290] Trial 15 pruned. 
[I 2026-03-18 17:32:41,324] Trial 10 finished with value: -3.1219802961658463 and parameters: {'n_layers_yyx': 2, 'hidden_size_yyx_l0': 6, 'hidden_size_yyx_l1': 6, 'context_size_yyx': 4, 'num_mix_components_yyx': 2, 'context_extractor_yyx': 'lstm', 'activation_func_yyx': 'ReLU', 'L2_weight_yyx': 0.0005289322990824711, 'L_entropy_weight_yyx': 0.00029374225731798267, 'L_sep_weight_yyx': 2.5618557579940235e-09, 'L_scale_weight_yyx': 5.129180268334892e-08, 'learning_rate_yyx': 0.00936366732745801}. Best is trial 2 with value: -3.1501405578480686.
[I 2026-03-18 17:32:43,824] Trial 14 finished with value: -0.5615681854206069 and parameters: {'n_layers_yyx': 2, 'hidden_size_yyx_l0': 4, 'hidden_size_yyx_l1': 6, 'context_size_yyx': 3, 'num_mix_components_yyx': 3, 'context_extractor_yyx': 'gru', 'activation_func_yyx': 'ReLU', 'L2_weight_yyx': 1.6588724836700204e-10, 'L_entropy_weight_yyx': 1.825604208827111e-05, 'L_sep_weight_yyx': 3.4759135294705195e-06, 'L_scale_weight_yyx': 9.347376212812472e-09, 'learning_rate_yyx': 0.009713811495907224}. Best is trial 11 with value: -0.5771698879572515.
[I 2026-03-18 17:32:48,663] Trial 9 pruned. 
[I 2026-03-18 17:33:09,143] Trial 7 finished with value: -3.1147042792281665 and parameters: {'n_layers_yyx': 2, 'hidden_size_yyx_l0': 5, 'hidden_size_yyx_l1': 5, 'context_size_yyx': 2, 'num_mix_components_yyx': 1, 'context_extractor_yyx': 'gru', 'activation_func_yyx': 'GELU', 'L2_weight_yyx': 2.929548117561068e-10, 'L_entropy_weight_yyx': 7.500464455481322e-07, 'L_sep_weight_yyx': 9.475583438391316e-10, 'L_scale_weight_yyx': 2.225323426205518e-09, 'learning_rate_yyx': 0.008104165090583005}. Best is trial 5 with value: -3.1192462435086177.
[I 2026-03-18 17:33:31,476] Trial 6 pruned. 
[I 2026-03-18 17:33:33,126] Trial 23 pruned. 
[I 2026-03-18 17:33:47,605] Trial 7 finished with value: -3.1121634756779826 and parameters: {'n_layers_yyx': 1, 'hidden_size_yyx_l0': 5, 'context_size_yyx': 3, 'num_mix_components_yyx': 4, 'context_extractor_yyx': 'gru', 'activation_func_yyx': 'Tanh', 'L2_weight_yyx': 3.788924977085258e-06, 'L_entropy_weight_yyx': 0.0001317224783878095, 'L_sep_weight_yyx': 3.9326547448766096e-10, 'L_scale_weight_yyx': 2.243532504775149e-10, 'learning_rate_yyx': 0.0010350241112382533}. Best is trial 1 with value: -3.152505646630136.
[I 2026-03-18 17:33:53,987] Trial 8 pruned. 
[I 2026-03-18 17:33:56,206] Trial 13 pruned. 
[I 2026-03-18 17:34:00,152] Trial 15 pruned. 
[I 2026-03-18 17:34:08,241] Trial 11 finished with value: -3.146353254922875 and parameters: {'n_layers_yyx': 2, 'hidden_size_yyx_l0': 6, 'hidden_size_yyx_l1': 4, 'context_size_yyx': 1, 'num_mix_components_yyx': 5, 'context_extractor_yyx': 'lstm', 'activation_func_yyx': 'ReLU', 'L2_weight_yyx': 3.3113761754500273e-07, 'L_entropy_weight_yyx': 1.6322292448387304e-10, 'L_sep_weight_yyx': 8.064336378977093e-06, 'L_scale_weight_yyx': 2.401522942055675e-06, 'learning_rate_yyx': 0.003099574564767896}. Best is trial 5 with value: -3.1813736784759756.
[I 2026-03-18 17:34:17,057] Trial 7 finished with value: -1.272066817927052 and parameters: {'n_layers_yyx': 1, 'hidden_size_yyx_l0': 2, 'context_size_yyx': 1, 'num_mix_components_yyx': 2, 'context_extractor_yyx': 'gru', 'activation_func_yyx': 'Tanh', 'L2_weight_yyx': 0.0002950529498958132, 'L_entropy_weight_yyx': 2.42867314587891e-10, 'L_sep_weight_yyx': 6.56900019501034e-05, 'L_scale_weight_yyx': 1.3203550995052285e-07, 'learning_rate_yyx': 0.007349683514375227}. Best is trial 7 with value: -1.272066817927052.
[I 2026-03-18 17:34:25,007] Trial 8 pruned. 
[I 2026-03-18 17:34:39,331] Trial 24 pruned. 
[I 2026-03-18 17:34:46,269] Trial 12 finished with value: -3.1352647722919613 and parameters: {'n_layers_yyx': 2, 'hidden_size_yyx_l0': 5, 'hidden_size_yyx_l1': 5, 'context_size_yyx': 1, 'num_mix_components_yyx': 5, 'context_extractor_yyx': 'lstm', 'activation_func_yyx': 'GELU', 'L2_weight_yyx': 0.0007627256740968265, 'L_entropy_weight_yyx': 1.368056844876875e-10, 'L_sep_weight_yyx': 0.0009781211069118262, 'L_scale_weight_yyx': 1.3995636224652762e-10, 'learning_rate_yyx': 0.008508710386483353}. Best is trial 1 with value: -3.1505299612690063.
[I 2026-03-18 17:34:50,335] Trial 10 pruned. 
[I 2026-03-18 17:34:53,365] Trial 7 pruned. 
[I 2026-03-18 17:34:56,945] Trial 18 finished with value: -1.2691942310156972 and parameters: {'n_layers_yyx': 2, 'hidden_size_yyx_l0': 3, 'hidden_size_yyx_l1': 5, 'context_size_yyx': 4, 'num_mix_components_yyx': 5, 'context_extractor_yyx': 'lstm', 'activation_func_yyx': 'Tanh', 'L2_weight_yyx': 6.885121455539112e-06, 'L_entropy_weight_yyx': 2.897206837365145e-09, 'L_sep_weight_yyx': 1.1457463211956004e-05, 'L_scale_weight_yyx': 5.439518514917336e-10, 'learning_rate_yyx': 0.00508424828040892}. Best is trial 18 with value: -1.2691942310156972.
[I 2026-03-18 17:34:59,639] Trial 9 pruned. 
[I 2026-03-18 17:35:08,261] Trial 12 finished with value: -3.1414601539724654 and parameters: {'n_layers_yyx': 2, 'hidden_size_yyx_l0': 2, 'hidden_size_yyx_l1': 5, 'context_size_yyx': 2, 'num_mix_components_yyx': 2, 'context_extractor_yyx': 'gru', 'activation_func_yyx': 'Tanh', 'L2_weight_yyx': 2.5857385021758455e-08, 'L_entropy_weight_yyx': 9.595223399643253e-09, 'L_sep_weight_yyx': 1.0124114050615708e-10, 'L_scale_weight_yyx': 7.1303635235071604e-06, 'learning_rate_yyx': 0.009107906676470746}. Best is trial 2 with value: -3.1580584124267483.
[I 2026-03-18 17:35:08,524] Trial 16 pruned. 
[I 2026-03-18 17:35:27,272] Trial 8 pruned. 
[I 2026-03-18 17:35:35,192] Trial 7 finished with value: -0.5287592388084863 and parameters: {'n_layers_yyx': 1, 'hidden_size_yyx_l0': 5, 'context_size_yyx': 1, 'num_mix_components_yyx': 1, 'context_extractor_yyx': 'gru', 'activation_func_yyx': 'Tanh', 'L2_weight_yyx': 5.700675575269121e-07, 'L_entropy_weight_yyx': 3.697883908240156e-08, 'L_sep_weight_yyx': 0.00017625815312072272, 'L_scale_weight_yyx': 5.968969680872409e-07, 'learning_rate_yyx': 0.0005148096752104524}. Best is trial 3 with value: -0.584032942865049.
[I 2026-03-18 17:35:47,827] Trial 12 finished with value: -3.1144181579255816 and parameters: {'n_layers_yyx': 2, 'hidden_size_yyx_l0': 5, 'hidden_size_yyx_l1': 6, 'context_size_yyx': 1, 'num_mix_components_yyx': 4, 'context_extractor_yyx': 'gru', 'activation_func_yyx': 'GELU', 'L2_weight_yyx': 1.989152718704755e-07, 'L_entropy_weight_yyx': 4.522934745452134e-09, 'L_sep_weight_yyx': 5.4358936766869686e-08, 'L_scale_weight_yyx': 1.6499099713285414e-06, 'learning_rate_yyx': 0.002525773444783779}. Best is trial 0 with value: -3.1460828145824977.
[I 2026-03-18 17:35:56,791] Trial 14 pruned. 
[I 2026-03-18 17:35:57,268] Trial 11 pruned. 
[I 2026-03-18 17:36:08,196] Trial 13 pruned. 
[I 2026-03-18 17:36:08,366] Trial 10 finished with value: -3.135263512932324 and parameters: {'n_layers_yyx': 2, 'hidden_size_yyx_l0': 2, 'hidden_size_yyx_l1': 6, 'context_size_yyx': 4, 'num_mix_components_yyx': 1, 'context_extractor_yyx': 'gru', 'activation_func_yyx': 'Tanh', 'L2_weight_yyx': 8.13933321387513e-05, 'L_entropy_weight_yyx': 0.0009431222597467202, 'L_sep_weight_yyx': 7.365197338004569e-09, 'L_scale_weight_yyx': 3.0067345269415136e-08, 'learning_rate_yyx': 0.008110049720527061}. Best is trial 8 with value: -3.163666902197897.
[I 2026-03-18 17:36:09,973] Trial 10 pruned. 
[I 2026-03-18 17:36:13,610] Trial 17 pruned. 
[I 2026-03-18 17:36:36,395] Trial 25 pruned. 
[I 2026-03-18 17:36:39,524] Trial 8 pruned. 
[I 2026-03-18 17:36:49,099] Trial 5 finished with value: -3.1658101024797 and parameters: {'n_layers_yyx': 2, 'hidden_size_yyx_l0': 4, 'hidden_size_yyx_l1': 4, 'context_size_yyx': 4, 'num_mix_components_yyx': 4, 'context_extractor_yyx': 'gru', 'activation_func_yyx': 'ReLU', 'L2_weight_yyx': 1.6024148366102418e-05, 'L_entropy_weight_yyx': 3.4778353092266333e-10, 'L_sep_weight_yyx': 9.212656797765187e-05, 'L_scale_weight_yyx': 5.701498228063479e-10, 'learning_rate_yyx': 0.0008317299188471488}. Best is trial 1 with value: -3.166268711244678.
[I 2026-03-18 17:37:02,490] Trial 19 pruned. 
[I 2026-03-18 17:37:08,584] Trial 9 pruned. 
[I 2026-03-18 17:37:08,613] Trial 13 pruned. 
[I 2026-03-18 17:37:21,796] Trial 18 pruned. 
[I 2026-03-18 17:37:45,745] Trial 15 finished with value: -0.5797879771320495 and parameters: {'n_layers_yyx': 1, 'hidden_size_yyx_l0': 4, 'context_size_yyx': 3, 'num_mix_components_yyx': 5, 'context_extractor_yyx': 'gru', 'activation_func_yyx': 'ReLU', 'L2_weight_yyx': 1.4365582174566562e-10, 'L_entropy_weight_yyx': 1.853147937153212e-07, 'L_sep_weight_yyx': 3.9895413104917e-06, 'L_scale_weight_yyx': 2.6342753931897824e-08, 'learning_rate_yyx': 0.009917936810530477}. Best is trial 15 with value: -0.5797879771320495.
[I 2026-03-18 17:37:48,542] Trial 20 finished with value: -3.1481007392302844 and parameters: {'n_layers_yyx': 2, 'hidden_size_yyx_l0': 4, 'hidden_size_yyx_l1': 5, 'context_size_yyx': 4, 'num_mix_components_yyx': 4, 'context_extractor_yyx': 'lstm', 'activation_func_yyx': 'GELU', 'L2_weight_yyx': 9.014908210218983e-08, 'L_entropy_weight_yyx': 1.9955070975137767e-06, 'L_sep_weight_yyx': 8.340494644661127e-09, 'L_scale_weight_yyx': 7.853873529543422e-08, 'learning_rate_yyx': 0.006900091658942299}. Best is trial 20 with value: -3.1481007392302844.
[I 2026-03-18 17:37:51,583] Trial 9 finished with value: -3.1276875204183607 and parameters: {'n_layers_yyx': 2, 'hidden_size_yyx_l0': 6, 'hidden_size_yyx_l1': 6, 'context_size_yyx': 4, 'num_mix_components_yyx': 1, 'context_extractor_yyx': 'lstm', 'activation_func_yyx': 'GELU', 'L2_weight_yyx': 6.335352189277446e-08, 'L_entropy_weight_yyx': 9.124709871251658e-07, 'L_sep_weight_yyx': 2.0578787069472226e-10, 'L_scale_weight_yyx': 1.622896329269961e-06, 'learning_rate_yyx': 0.009734910373825949}. Best is trial 6 with value: -3.1471600213313993.
[I 2026-03-18 17:37:51,894] Trial 13 pruned. 
[I 2026-03-18 17:38:31,586] Trial 14 pruned. 
[I 2026-03-18 17:38:47,267] Trial 7 finished with value: -3.145182383960637 and parameters: {'n_layers_yyx': 1, 'hidden_size_yyx_l0': 3, 'context_size_yyx': 3, 'num_mix_components_yyx': 5, 'context_extractor_yyx': 'gru', 'activation_func_yyx': 'ReLU', 'L2_weight_yyx': 6.417304478385083e-05, 'L_entropy_weight_yyx': 1.2007271598451762e-09, 'L_sep_weight_yyx': 3.4374720853866466e-05, 'L_scale_weight_yyx': 6.447286526516617e-07, 'learning_rate_yyx': 0.0015126064506300076}. Best is trial 5 with value: -3.154335707688014.
[I 2026-03-18 17:39:08,013] Trial 14 pruned. 
[I 2026-03-18 17:39:08,831] Trial 8 finished with value: -0.57630985475144 and parameters: {'n_layers_yyx': 2, 'hidden_size_yyx_l0': 4, 'hidden_size_yyx_l1': 2, 'context_size_yyx': 3, 'num_mix_components_yyx': 3, 'context_extractor_yyx': 'gru', 'activation_func_yyx': 'Tanh', 'L2_weight_yyx': 0.00042291292317581846, 'L_entropy_weight_yyx': 3.6727488752208355e-08, 'L_sep_weight_yyx': 4.946418245084694e-08, 'L_scale_weight_yyx': 6.662574662425358e-08, 'learning_rate_yyx': 0.003950261440008984}. Best is trial 4 with value: -0.5804501078315746.
