Warning: Failed writing log files to directory [/var/log/nvidia-mps]. No logs will be available.
[I 2026-03-18 22:02:48,886] Using an existing study with name 'opt_full-model_seed=42_task=162' instead of creating a new one.
[I 2026-03-18 22:02:48,898] Using an existing study with name 'opt_full-model_seed=42_task=168' instead of creating a new one.
[I 2026-03-18 22:02:48,899] Using an existing study with name 'opt_full-model_seed=42_task=169' instead of creating a new one.
[I 2026-03-18 22:02:48,932] Using an existing study with name 'opt_full-model_seed=42_task=161' instead of creating a new one.
[I 2026-03-18 22:02:48,938] Using an existing study with name 'opt_full-model_seed=42_task=173' instead of creating a new one.
[I 2026-03-18 22:02:48,943] Using an existing study with name 'opt_full-model_seed=42_task=171' instead of creating a new one.
[I 2026-03-18 22:02:48,957] Using an existing study with name 'opt_full-model_seed=42_task=160' instead of creating a new one.
[I 2026-03-18 22:02:48,976] Using an existing study with name 'opt_full-model_seed=42_task=174' instead of creating a new one.
[I 2026-03-18 22:02:48,984] Using an existing study with name 'opt_full-model_seed=42_task=165' instead of creating a new one.
[I 2026-03-18 22:02:49,013] Using an existing study with name 'opt_full-model_seed=42_task=172' instead of creating a new one.
[I 2026-03-18 22:02:49,054] Using an existing study with name 'opt_full-model_seed=42_task=175' instead of creating a new one.
[I 2026-03-18 22:02:49,107] Using an existing study with name 'opt_full-model_seed=42_task=167' instead of creating a new one.
[I 2026-03-18 22:02:49,310] Using an existing study with name 'opt_full-model_seed=42_task=164' instead of creating a new one.
[I 2026-03-18 22:02:49,384] Using an existing study with name 'opt_full-model_seed=42_task=170' instead of creating a new one.
[I 2026-03-18 22:02:49,397] Using an existing study with name 'opt_full-model_seed=42_task=166' instead of creating a new one.
[I 2026-03-18 22:02:49,430] Using an existing study with name 'opt_full-model_seed=42_task=163' instead of creating a new one.
[I 2026-03-18 22:03:28,394] Trial 21 pruned. 
[I 2026-03-18 22:03:28,437] Trial 20 pruned. 
[I 2026-03-18 22:03:30,225] Trial 17 pruned. 
[I 2026-03-18 22:03:35,871] Trial 14 pruned. 
[I 2026-03-18 22:03:37,037] Trial 14 pruned. 
[I 2026-03-18 22:03:43,948] Trial 15 pruned. 
[I 2026-03-18 22:03:44,698] Trial 15 pruned. 
[I 2026-03-18 22:03:46,306] Trial 21 pruned. 
[I 2026-03-18 22:03:48,381] Trial 23 pruned. 
[I 2026-03-18 22:03:53,001] Trial 16 pruned. 
[I 2026-03-18 22:04:00,925] Trial 17 pruned. 
[I 2026-03-18 22:04:01,912] Trial 16 pruned. 
[I 2026-03-18 22:04:07,450] Trial 43 pruned. 
[I 2026-03-18 22:04:10,402] Trial 17 pruned. 
[I 2026-03-18 22:04:17,814] Trial 18 pruned. 
[I 2026-03-18 22:04:34,368] Trial 22 pruned. 
[I 2026-03-18 22:04:34,991] Trial 19 pruned. 
[I 2026-03-18 22:04:41,036] Trial 24 finished with value: -2.5511102316762146 and parameters: {'n_layers_yyx': 2, 'hidden_size_yyx_l0': 5, 'hidden_size_yyx_l1': 5, 'context_size_yyx': 3, 'num_mix_components_yyx': 5, 'context_extractor_yyx': 'gru', 'activation_func_yyx': 'Tanh', 'L2_weight_yyx': 5.332952472288953e-08, 'L_entropy_weight_yyx': 1.9636286246817003e-08, 'L_sep_weight_yyx': 1.965081296431003e-09, 'L_scale_weight_yyx': 1.931900105978233e-06, 'learning_rate_yyx': 0.009938614616702018}. Best is trial 24 with value: -2.5511102316762146.
[I 2026-03-18 22:04:42,857] Trial 20 pruned. 
[I 2026-03-18 22:04:46,373] Trial 31 pruned. 
[I 2026-03-18 22:04:50,586] Trial 21 pruned. 
[I 2026-03-18 22:04:55,270] Trial 44 pruned. 
[I 2026-03-18 22:04:55,786] Trial 18 finished with value: -2.3958004742730785 and parameters: {'n_layers_yyx': 1, 'hidden_size_yyx_l0': 5, 'context_size_yyx': 4, 'num_mix_components_yyx': 5, 'context_extractor_yyx': 'lstm', 'activation_func_yyx': 'GELU', 'L2_weight_yyx': 6.856779290364179e-05, 'L_entropy_weight_yyx': 9.522506682244779e-05, 'L_sep_weight_yyx': 2.1103390032051517e-07, 'L_scale_weight_yyx': 0.00010626038048268354, 'learning_rate_yyx': 0.003785845326151588}. Best is trial 13 with value: -2.4034606761310786.
[I 2026-03-18 22:04:57,147] Trial 19 finished with value: -2.4312495233354747 and parameters: {'n_layers_yyx': 1, 'hidden_size_yyx_l0': 5, 'context_size_yyx': 4, 'num_mix_components_yyx': 5, 'context_extractor_yyx': 'lstm', 'activation_func_yyx': 'Tanh', 'L2_weight_yyx': 0.00016115558535895105, 'L_entropy_weight_yyx': 3.1276142761823176e-07, 'L_sep_weight_yyx': 2.766294846421767e-07, 'L_scale_weight_yyx': 2.859714777969926e-06, 'learning_rate_yyx': 0.006775621065082862}. Best is trial 19 with value: -2.4312495233354747.
[I 2026-03-18 22:04:58,958] Trial 25 pruned. 
[I 2026-03-18 22:05:04,449] Trial 31 finished with value: -2.760363606335645 and parameters: {'n_layers_yyx': 2, 'hidden_size_yyx_l0': 3, 'hidden_size_yyx_l1': 6, 'context_size_yyx': 2, 'num_mix_components_yyx': 3, 'context_extractor_yyx': 'lstm', 'activation_func_yyx': 'Tanh', 'L2_weight_yyx': 0.0008715624769040677, 'L_entropy_weight_yyx': 3.7974148135847696e-10, 'L_sep_weight_yyx': 1.5571938610197753e-09, 'L_scale_weight_yyx': 9.388136331885489e-10, 'learning_rate_yyx': 0.009414372492697637}. Best is trial 25 with value: -2.762886536950096.
[I 2026-03-18 22:05:09,362] Trial 22 finished with value: -2.411661374750258 and parameters: {'n_layers_yyx': 2, 'hidden_size_yyx_l0': 2, 'hidden_size_yyx_l1': 4, 'context_size_yyx': 4, 'num_mix_components_yyx': 5, 'context_extractor_yyx': 'gru', 'activation_func_yyx': 'GELU', 'L2_weight_yyx': 0.0006680566950709151, 'L_entropy_weight_yyx': 8.155020868791366e-06, 'L_sep_weight_yyx': 6.674170948884905e-06, 'L_scale_weight_yyx': 2.025191456947291e-05, 'learning_rate_yyx': 0.00956188917035086}. Best is trial 22 with value: -2.411661374750258.
[I 2026-03-18 22:05:12,503] Trial 45 pruned. 
[I 2026-03-18 22:05:13,178] Trial 20 pruned. 
[I 2026-03-18 22:05:15,706] Trial 18 finished with value: -2.732095023627825 and parameters: {'n_layers_yyx': 2, 'hidden_size_yyx_l0': 4, 'hidden_size_yyx_l1': 6, 'context_size_yyx': 4, 'num_mix_components_yyx': 2, 'context_extractor_yyx': 'gru', 'activation_func_yyx': 'Tanh', 'L2_weight_yyx': 2.3273069672043947e-06, 'L_entropy_weight_yyx': 1.1431002463097332e-09, 'L_sep_weight_yyx': 4.126567501530877e-06, 'L_scale_weight_yyx': 2.2009331827580318e-08, 'learning_rate_yyx': 0.007358365083810109}. Best is trial 7 with value: -2.766072426816335.
[I 2026-03-18 22:05:17,395] Trial 23 pruned. 
[I 2026-03-18 22:05:18,092] Trial 32 pruned. 
[I 2026-03-18 22:05:20,559] Trial 23 pruned. 
[I 2026-03-18 22:05:23,976] Trial 15 pruned. 
[I 2026-03-18 22:05:26,091] Trial 24 pruned. 
[I 2026-03-18 22:05:26,294] Trial 24 finished with value: -2.762977451047229 and parameters: {'n_layers_yyx': 2, 'hidden_size_yyx_l0': 4, 'hidden_size_yyx_l1': 5, 'context_size_yyx': 4, 'num_mix_components_yyx': 4, 'context_extractor_yyx': 'gru', 'activation_func_yyx': 'GELU', 'L2_weight_yyx': 5.609469362995083e-10, 'L_entropy_weight_yyx': 1.2248402881241847e-05, 'L_sep_weight_yyx': 0.00014364160487271584, 'L_scale_weight_yyx': 1.9391883398925247e-06, 'learning_rate_yyx': 0.009881754085539351}. Best is trial 0 with value: -2.7678615354442075.
[I 2026-03-18 22:05:26,460] Trial 19 pruned. 
[I 2026-03-18 22:05:31,398] Trial 16 pruned. 
[I 2026-03-18 22:05:31,778] Trial 33 pruned. 
[I 2026-03-18 22:05:34,169] Trial 25 pruned. 
[I 2026-03-18 22:05:37,221] Trial 20 pruned. 
[I 2026-03-18 22:05:37,652] Trial 22 pruned. 
[I 2026-03-18 22:05:38,701] Trial 24 pruned. 
[I 2026-03-18 22:05:40,833] Trial 26 finished with value: -2.765893650054932 and parameters: {'n_layers_yyx': 2, 'hidden_size_yyx_l0': 5, 'hidden_size_yyx_l1': 4, 'context_size_yyx': 3, 'num_mix_components_yyx': 4, 'context_extractor_yyx': 'gru', 'activation_func_yyx': 'Tanh', 'L2_weight_yyx': 1.0857764759747803e-07, 'L_entropy_weight_yyx': 2.597707657405907e-10, 'L_sep_weight_yyx': 2.394584069532878e-07, 'L_scale_weight_yyx': 6.928747411893163e-07, 'learning_rate_yyx': 0.007474409135425704}. Best is trial 22 with value: -2.767345984776815.
[I 2026-03-18 22:05:41,809] Trial 26 pruned. 
[I 2026-03-18 22:05:45,386] Trial 34 pruned. 
[I 2026-03-18 22:05:47,676] Trial 21 pruned. 
[I 2026-03-18 22:05:48,757] Trial 22 finished with value: -2.387913775511225 and parameters: {'n_layers_yyx': 1, 'hidden_size_yyx_l0': 5, 'context_size_yyx': 3, 'num_mix_components_yyx': 4, 'context_extractor_yyx': 'gru', 'activation_func_yyx': 'Tanh', 'L2_weight_yyx': 0.0009857032234998403, 'L_entropy_weight_yyx': 8.953585406284238e-08, 'L_sep_weight_yyx': 0.0008595131298775977, 'L_scale_weight_yyx': 2.1008838832284703e-05, 'learning_rate_yyx': 0.005596168842626652}. Best is trial 4 with value: -2.393031095621557.
[I 2026-03-18 22:05:49,084] Trial 18 finished with value: -2.407855743722817 and parameters: {'n_layers_yyx': 1, 'hidden_size_yyx_l0': 4, 'context_size_yyx': 2, 'num_mix_components_yyx': 5, 'context_extractor_yyx': 'lstm', 'activation_func_yyx': 'Tanh', 'L2_weight_yyx': 1.5982697290350302e-08, 'L_entropy_weight_yyx': 2.1887189817654266e-05, 'L_sep_weight_yyx': 2.353774063440334e-06, 'L_scale_weight_yyx': 7.095357079356647e-10, 'learning_rate_yyx': 0.009728752889017573}. Best is trial 10 with value: -2.4114769060587147.
[I 2026-03-18 22:05:49,634] Trial 27 pruned. 
[I 2026-03-18 22:05:53,837] Trial 25 pruned. 
[I 2026-03-18 22:05:56,102] Trial 25 pruned. 
[I 2026-03-18 22:05:56,821] Trial 46 pruned. 
[I 2026-03-18 22:05:57,942] Trial 19 pruned. 
[I 2026-03-18 22:05:58,145] Trial 35 pruned. 
[I 2026-03-18 22:06:06,366] Trial 28 pruned. 
[I 2026-03-18 22:06:10,953] Trial 36 pruned. 
[I 2026-03-18 22:06:13,114] Trial 27 pruned. 
[I 2026-03-18 22:06:13,298] Trial 22 pruned. 
[I 2026-03-18 22:06:14,142] Trial 47 pruned. 
[I 2026-03-18 22:06:16,517] Trial 20 pruned. 
[I 2026-03-18 22:06:17,311] Trial 26 pruned. 
[I 2026-03-18 22:06:24,178] Trial 29 pruned. 
[I 2026-03-18 22:06:26,713] Trial 27 pruned. 
[I 2026-03-18 22:06:28,758] Trial 28 pruned. 
[I 2026-03-18 22:06:36,654] Trial 28 pruned. 
[I 2026-03-18 22:06:45,556] Trial 32 finished with value: -2.7602533350653826 and parameters: {'n_layers_yyx': 2, 'hidden_size_yyx_l0': 3, 'hidden_size_yyx_l1': 6, 'context_size_yyx': 2, 'num_mix_components_yyx': 3, 'context_extractor_yyx': 'lstm', 'activation_func_yyx': 'Tanh', 'L2_weight_yyx': 0.0008931942277425684, 'L_entropy_weight_yyx': 3.783181242000545e-10, 'L_sep_weight_yyx': 1.1100829084027447e-09, 'L_scale_weight_yyx': 1.3468187101475315e-09, 'learning_rate_yyx': 0.009267073585758534}. Best is trial 25 with value: -2.762886536950096.
[I 2026-03-18 22:06:46,388] Trial 29 pruned. 
[I 2026-03-18 22:06:52,306] Trial 19 finished with value: -2.3935050856678615 and parameters: {'n_layers_yyx': 2, 'hidden_size_yyx_l0': 4, 'hidden_size_yyx_l1': 4, 'context_size_yyx': 4, 'num_mix_components_yyx': 4, 'context_extractor_yyx': 'lstm', 'activation_func_yyx': 'GELU', 'L2_weight_yyx': 8.474916308821018e-08, 'L_entropy_weight_yyx': 7.846860063550251e-06, 'L_sep_weight_yyx': 1.358026050002933e-05, 'L_scale_weight_yyx': 0.0002317108514097011, 'learning_rate_yyx': 0.003795406703507034}. Best is trial 13 with value: -2.4034606761310786.
[I 2026-03-18 22:06:58,067] Trial 26 finished with value: -2.5330370654424557 and parameters: {'n_layers_yyx': 2, 'hidden_size_yyx_l0': 6, 'hidden_size_yyx_l1': 5, 'context_size_yyx': 3, 'num_mix_components_yyx': 5, 'context_extractor_yyx': 'gru', 'activation_func_yyx': 'Tanh', 'L2_weight_yyx': 4.887412273965111e-08, 'L_entropy_weight_yyx': 1.9610844553366693e-08, 'L_sep_weight_yyx': 9.692700939482971e-10, 'L_scale_weight_yyx': 7.407949304221506e-08, 'learning_rate_yyx': 0.004663829337658037}. Best is trial 24 with value: -2.5511102316762146.
[I 2026-03-18 22:07:00,857] Trial 20 pruned. 
[I 2026-03-18 22:07:03,048] Trial 21 pruned. 
[I 2026-03-18 22:07:03,296] Trial 29 pruned. 
[I 2026-03-18 22:07:05,117] Trial 27 pruned. 
[I 2026-03-18 22:07:08,815] Trial 21 pruned. 
[I 2026-03-18 22:07:09,146] Trial 26 pruned. 
[I 2026-03-18 22:07:09,740] Trial 30 pruned. 
[I 2026-03-18 22:07:10,271] Trial 33 pruned. 
[I 2026-03-18 22:07:16,675] Trial 30 pruned. 
[I 2026-03-18 22:07:20,189] Trial 37 pruned. 
[I 2026-03-18 22:07:20,837] Trial 22 pruned. 
[I 2026-03-18 22:07:21,659] Trial 27 pruned. 
[I 2026-03-18 22:07:30,958] Trial 31 pruned. 
[I 2026-03-18 22:07:32,159] Trial 31 pruned. 
[I 2026-03-18 22:07:35,759] Trial 28 pruned. 
[I 2026-03-18 22:07:38,836] Trial 16 finished with value: -2.760574472121496 and parameters: {'n_layers_yyx': 2, 'hidden_size_yyx_l0': 4, 'hidden_size_yyx_l1': 6, 'context_size_yyx': 3, 'num_mix_components_yyx': 4, 'context_extractor_yyx': 'lstm', 'activation_func_yyx': 'GELU', 'L2_weight_yyx': 2.4059898973453353e-06, 'L_entropy_weight_yyx': 1.1227792351763711e-07, 'L_sep_weight_yyx': 2.641767870132979e-09, 'L_scale_weight_yyx': 8.326184444149442e-07, 'learning_rate_yyx': 0.0007486176563438921}. Best is trial 8 with value: -2.7663050128086293.
[I 2026-03-18 22:07:40,476] Trial 21 finished with value: -2.4227099520986877 and parameters: {'n_layers_yyx': 2, 'hidden_size_yyx_l0': 6, 'hidden_size_yyx_l1': 3, 'context_size_yyx': 3, 'num_mix_components_yyx': 5, 'context_extractor_yyx': 'lstm', 'activation_func_yyx': 'Tanh', 'L2_weight_yyx': 0.0001632340946312332, 'L_entropy_weight_yyx': 1.70417881878472e-06, 'L_sep_weight_yyx': 3.3613720979018495e-09, 'L_scale_weight_yyx': 0.0009736872247926324, 'learning_rate_yyx': 0.006719882536824667}. Best is trial 19 with value: -2.4312495233354747.
[I 2026-03-18 22:07:42,565] Trial 23 finished with value: -2.4292163799128685 and parameters: {'n_layers_yyx': 2, 'hidden_size_yyx_l0': 6, 'hidden_size_yyx_l1': 3, 'context_size_yyx': 3, 'num_mix_components_yyx': 3, 'context_extractor_yyx': 'lstm', 'activation_func_yyx': 'Tanh', 'L2_weight_yyx': 2.1731548830824035e-05, 'L_entropy_weight_yyx': 3.701958443831907e-05, 'L_sep_weight_yyx': 4.162170596970468e-05, 'L_scale_weight_yyx': 1.0959566965758226e-09, 'learning_rate_yyx': 0.009680949286603154}. Best is trial 11 with value: -2.43991066579963.
[I 2026-03-18 22:07:43,445] Trial 23 finished with value: -2.386398890126585 and parameters: {'n_layers_yyx': 1, 'hidden_size_yyx_l0': 5, 'context_size_yyx': 3, 'num_mix_components_yyx': 4, 'context_extractor_yyx': 'gru', 'activation_func_yyx': 'Tanh', 'L2_weight_yyx': 0.00020821397183096467, 'L_entropy_weight_yyx': 1.9256668099874252e-08, 'L_sep_weight_yyx': 0.00016410007482813713, 'L_scale_weight_yyx': 1.1523523583533732e-05, 'learning_rate_yyx': 0.007997883429145765}. Best is trial 4 with value: -2.393031095621557.
[I 2026-03-18 22:07:48,712] Trial 29 pruned. 
[I 2026-03-18 22:07:49,854] Trial 28 pruned. 
[I 2026-03-18 22:07:57,409] Trial 17 finished with value: -2.394564459385016 and parameters: {'n_layers_yyx': 2, 'hidden_size_yyx_l0': 6, 'hidden_size_yyx_l1': 4, 'context_size_yyx': 4, 'num_mix_components_yyx': 2, 'context_extractor_yyx': 'gru', 'activation_func_yyx': 'GELU', 'L2_weight_yyx': 1.99101954469368e-06, 'L_entropy_weight_yyx': 1.2268397164287076e-07, 'L_sep_weight_yyx': 0.00010818645868734505, 'L_scale_weight_yyx': 7.820888450549498e-06, 'learning_rate_yyx': 0.0027080833392985684}. Best is trial 17 with value: -2.394564459385016.
[I 2026-03-18 22:08:02,510] Trial 30 pruned. 
[I 2026-03-18 22:08:03,985] Trial 24 pruned. 
[I 2026-03-18 22:08:07,036] Trial 23 finished with value: -2.762704361224311 and parameters: {'n_layers_yyx': 2, 'hidden_size_yyx_l0': 6, 'hidden_size_yyx_l1': 3, 'context_size_yyx': 3, 'num_mix_components_yyx': 4, 'context_extractor_yyx': 'lstm', 'activation_func_yyx': 'ReLU', 'L2_weight_yyx': 2.53534480038057e-10, 'L_entropy_weight_yyx': 0.0004384620330891749, 'L_sep_weight_yyx': 6.940365372342998e-10, 'L_scale_weight_yyx': 6.7412244529933055e-06, 'learning_rate_yyx': 0.00839097593583157}. Best is trial 7 with value: -2.766072426816335.
[I 2026-03-18 22:08:07,303] Trial 29 pruned. 
[I 2026-03-18 22:08:13,844] Trial 25 pruned. 
[I 2026-03-18 22:08:13,960] Trial 34 pruned. 
[I 2026-03-18 22:08:15,359] Trial 30 pruned. 
[I 2026-03-18 22:08:15,462] Trial 31 pruned. 
[I 2026-03-18 22:08:19,247] Trial 48 finished with value: -2.3961076261814953 and parameters: {'n_layers_yyx': 1, 'hidden_size_yyx_l0': 5, 'context_size_yyx': 2, 'num_mix_components_yyx': 5, 'context_extractor_yyx': 'gru', 'activation_func_yyx': 'Tanh', 'L2_weight_yyx': 4.56456020641853e-09, 'L_entropy_weight_yyx': 2.0589883591610793e-05, 'L_sep_weight_yyx': 1.6763540648505945e-06, 'L_scale_weight_yyx': 1.7557789281676973e-06, 'learning_rate_yyx': 0.006583778447084433}. Best is trial 0 with value: -2.4076941594397367.
[I 2026-03-18 22:08:19,428] Trial 30 finished with value: -2.4084342687085107 and parameters: {'n_layers_yyx': 1, 'hidden_size_yyx_l0': 5, 'context_size_yyx': 3, 'num_mix_components_yyx': 5, 'context_extractor_yyx': 'gru', 'activation_func_yyx': 'ReLU', 'L2_weight_yyx': 2.8678338152299977e-08, 'L_entropy_weight_yyx': 1.9895529634104818e-05, 'L_sep_weight_yyx': 0.00040239849847344876, 'L_scale_weight_yyx': 1.9812605079103973e-09, 'learning_rate_yyx': 0.006201419706309376}. Best is trial 22 with value: -2.411661374750258.
[I 2026-03-18 22:08:22,725] Trial 31 pruned. 
[I 2026-03-18 22:08:23,905] Trial 35 pruned. 
[I 2026-03-18 22:08:26,998] Trial 24 pruned. 
[I 2026-03-18 22:08:27,457] Trial 32 pruned. 
[I 2026-03-18 22:08:35,089] Trial 36 pruned. 
[I 2026-03-18 22:08:43,506] Trial 25 pruned. 
[I 2026-03-18 22:08:43,920] Trial 18 pruned. 
[I 2026-03-18 22:08:52,126] Trial 38 finished with value: -2.726612222331408 and parameters: {'n_layers_yyx': 2, 'hidden_size_yyx_l0': 6, 'hidden_size_yyx_l1': 3, 'context_size_yyx': 2, 'num_mix_components_yyx': 1, 'context_extractor_yyx': 'gru', 'activation_func_yyx': 'ReLU', 'L2_weight_yyx': 8.045410177757001e-05, 'L_entropy_weight_yyx': 0.00014829126790818017, 'L_sep_weight_yyx': 2.6209550234906272e-05, 'L_scale_weight_yyx': 4.152630833231015e-09, 'learning_rate_yyx': 0.00860628258956399}. Best is trial 6 with value: -2.7665796528518882.
[I 2026-03-18 22:08:52,276] Trial 22 finished with value: -2.3911726092386774 and parameters: {'n_layers_yyx': 2, 'hidden_size_yyx_l0': 6, 'hidden_size_yyx_l1': 3, 'context_size_yyx': 3, 'num_mix_components_yyx': 1, 'context_extractor_yyx': 'lstm', 'activation_func_yyx': 'Tanh', 'L2_weight_yyx': 2.134500289137379e-06, 'L_entropy_weight_yyx': 0.0002226918589104303, 'L_sep_weight_yyx': 0.00010345829827772977, 'L_scale_weight_yyx': 3.2823279415318764e-05, 'learning_rate_yyx': 0.006747215029833839}. Best is trial 13 with value: -2.4034606761310786.
[I 2026-03-18 22:08:56,168] Trial 32 finished with value: -2.7631274541219075 and parameters: {'n_layers_yyx': 2, 'hidden_size_yyx_l0': 6, 'hidden_size_yyx_l1': 4, 'context_size_yyx': 4, 'num_mix_components_yyx': 5, 'context_extractor_yyx': 'gru', 'activation_func_yyx': 'GELU', 'L2_weight_yyx': 2.4175087108593746e-07, 'L_entropy_weight_yyx': 1.0833736660804093e-08, 'L_sep_weight_yyx': 2.782929905900075e-09, 'L_scale_weight_yyx': 5.482766678810004e-07, 'learning_rate_yyx': 0.006592531027148439}. Best is trial 22 with value: -2.767345984776815.
[I 2026-03-18 22:09:06,642] Trial 49 pruned. 
[I 2026-03-18 22:09:08,208] Trial 26 pruned. 
[I 2026-03-18 22:09:08,221] Trial 33 pruned. 
[I 2026-03-18 22:09:10,176] Trial 32 pruned. 
[I 2026-03-18 22:09:10,363] Trial 23 pruned. 
[I 2026-03-18 22:09:17,781] Trial 23 finished with value: -2.4089740713847054 and parameters: {'n_layers_yyx': 2, 'hidden_size_yyx_l0': 5, 'hidden_size_yyx_l1': 4, 'context_size_yyx': 4, 'num_mix_components_yyx': 3, 'context_extractor_yyx': 'lstm', 'activation_func_yyx': 'Tanh', 'L2_weight_yyx': 5.315704253922809e-07, 'L_entropy_weight_yyx': 0.00020134452352069354, 'L_sep_weight_yyx': 8.608212336064789e-06, 'L_scale_weight_yyx': 4.6056530531876223e-10, 'learning_rate_yyx': 0.0033360422533025174}. Best is trial 10 with value: -2.4114769060587147.
[I 2026-03-18 22:09:18,465] Trial 24 finished with value: -2.729345658597007 and parameters: {'n_layers_yyx': 2, 'hidden_size_yyx_l0': 6, 'hidden_size_yyx_l1': 4, 'context_size_yyx': 4, 'num_mix_components_yyx': 3, 'context_extractor_yyx': 'lstm', 'activation_func_yyx': 'ReLU', 'L2_weight_yyx': 2.5806271832887823e-09, 'L_entropy_weight_yyx': 0.0008589286133964374, 'L_sep_weight_yyx': 1.1633456292517973e-10, 'L_scale_weight_yyx': 3.851581149945554e-10, 'learning_rate_yyx': 0.0050686049681867625}. Best is trial 7 with value: -2.766072426816335.
[I 2026-03-18 22:09:24,478] Trial 33 pruned. 
[I 2026-03-18 22:09:26,692] Trial 33 pruned. 
[I 2026-03-18 22:09:26,728] Trial 50 pruned. 
[I 2026-03-18 22:09:29,094] Trial 26 pruned. 
[I 2026-03-18 22:09:29,312] Trial 19 pruned. 
[I 2026-03-18 22:09:30,942] Trial 27 pruned. 
[I 2026-03-18 22:09:33,681] Trial 32 pruned. 
[I 2026-03-18 22:09:35,273] Trial 24 pruned. 
[I 2026-03-18 22:09:35,477] Trial 51 pruned. 
[I 2026-03-18 22:09:37,470] Trial 22 finished with value: -2.4230125709377828 and parameters: {'n_layers_yyx': 1, 'hidden_size_yyx_l0': 5, 'context_size_yyx': 4, 'num_mix_components_yyx': 4, 'context_extractor_yyx': 'lstm', 'activation_func_yyx': 'Tanh', 'L2_weight_yyx': 3.567922824437115e-07, 'L_entropy_weight_yyx': 1.3603310499919825e-07, 'L_sep_weight_yyx': 1.0233772974913896e-06, 'L_scale_weight_yyx': 6.347843854361475e-07, 'learning_rate_yyx': 0.008173390556418}. Best is trial 19 with value: -2.4312495233354747.
[I 2026-03-18 22:09:43,080] Trial 34 pruned. 
[I 2026-03-18 22:09:45,912] Trial 25 pruned. 
[I 2026-03-18 22:09:46,625] Trial 27 pruned. 
[I 2026-03-18 22:09:52,973] Trial 52 pruned. 
