[I 2026-03-18 17:02:43,318] Trial 1 finished with value: -1.2312460527402416 and parameters: {'n_layers_yyx': 2, 'hidden_size_yyx_l0': 6, 'hidden_size_yyx_l1': 3, 'context_size_yyx': 1, 'num_mix_components_yyx': 1, 'context_extractor_yyx': 'lstm', 'activation_func_yyx': 'ReLU', 'L2_weight_yyx': 1.0940521561289823e-10, 'L_entropy_weight_yyx': 1.87386504950569e-07, 'L_sep_weight_yyx': 0.00034077234394588174, 'L_scale_weight_yyx': 2.9705783617513616e-07, 'learning_rate_yyx': 0.0051975048950014145}. Best is trial 1 with value: -1.2312460527402416.
[I 2026-03-18 17:02:44,899] Trial 1 finished with value: -3.1110497742477508 and parameters: {'n_layers_yyx': 1, 'hidden_size_yyx_l0': 5, 'context_size_yyx': 2, 'num_mix_components_yyx': 4, 'context_extractor_yyx': 'lstm', 'activation_func_yyx': 'Tanh', 'L2_weight_yyx': 5.349169222896026e-09, 'L_entropy_weight_yyx': 1.0491668632608726e-09, 'L_sep_weight_yyx': 1.157095292459009e-05, 'L_scale_weight_yyx': 1.0570261648699192e-10, 'learning_rate_yyx': 0.0022961119567238082}. Best is trial 1 with value: -3.1110497742477508.
[I 2026-03-18 17:02:49,365] Trial 0 finished with value: -1.2515830500068594 and parameters: {'n_layers_yyx': 1, 'hidden_size_yyx_l0': 3, 'context_size_yyx': 3, 'num_mix_components_yyx': 2, 'context_extractor_yyx': 'gru', 'activation_func_yyx': 'ReLU', 'L2_weight_yyx': 2.1876249377129e-06, 'L_entropy_weight_yyx': 4.0823702335412897e-10, 'L_sep_weight_yyx': 2.1717607566991738e-05, 'L_scale_weight_yyx': 6.168897322066082e-08, 'learning_rate_yyx': 0.0018978883570796386}. Best is trial 0 with value: -1.2515830500068594.
[I 2026-03-18 17:02:49,407] Trial 1 finished with value: -1.2526267751528022 and parameters: {'n_layers_yyx': 2, 'hidden_size_yyx_l0': 4, 'hidden_size_yyx_l1': 3, 'context_size_yyx': 4, 'num_mix_components_yyx': 5, 'context_extractor_yyx': 'gru', 'activation_func_yyx': 'GELU', 'L2_weight_yyx': 1.0081310931399079e-05, 'L_entropy_weight_yyx': 4.969573081855397e-07, 'L_sep_weight_yyx': 0.0005980036562849601, 'L_scale_weight_yyx': 1.1182469028641696e-05, 'learning_rate_yyx': 0.0013382597111129858}. Best is trial 0 with value: -1.255221580181016.
[I 2026-03-18 17:02:53,820] Trial 2 pruned. 
[I 2026-03-18 17:03:14,865] Trial 2 pruned. 
[I 2026-03-18 17:03:22,113] Trial 0 finished with value: -3.1089389456004572 and parameters: {'n_layers_yyx': 1, 'hidden_size_yyx_l0': 3, 'context_size_yyx': 4, 'num_mix_components_yyx': 3, 'context_extractor_yyx': 'gru', 'activation_func_yyx': 'Tanh', 'L2_weight_yyx': 6.175652402157747e-10, 'L_entropy_weight_yyx': 5.913238020688336e-08, 'L_sep_weight_yyx': 5.334104386031579e-07, 'L_scale_weight_yyx': 1.5599411808156997e-06, 'learning_rate_yyx': 0.0007459352798635303}. Best is trial 0 with value: -3.1089389456004572.
[I 2026-03-18 17:03:30,773] Trial 0 finished with value: -3.133650902723724 and parameters: {'n_layers_yyx': 1, 'hidden_size_yyx_l0': 6, 'context_size_yyx': 2, 'num_mix_components_yyx': 3, 'context_extractor_yyx': 'gru', 'activation_func_yyx': 'ReLU', 'L2_weight_yyx': 1.894173172924108e-09, 'L_entropy_weight_yyx': 0.0002257546817098168, 'L_sep_weight_yyx': 0.00036617330346199405, 'L_scale_weight_yyx': 6.93491250231893e-09, 'learning_rate_yyx': 0.0006269978186135246}. Best is trial 0 with value: -3.133650902723724.
[I 2026-03-18 17:03:43,871] Trial 1 pruned. 
[I 2026-03-18 17:03:53,953] Trial 1 pruned. 
[I 2026-03-18 17:03:55,352] Trial 1 finished with value: -0.5540046114705124 and parameters: {'n_layers_yyx': 2, 'hidden_size_yyx_l0': 4, 'hidden_size_yyx_l1': 6, 'context_size_yyx': 4, 'num_mix_components_yyx': 4, 'context_extractor_yyx': 'lstm', 'activation_func_yyx': 'GELU', 'L2_weight_yyx': 1.2568614390478798e-08, 'L_entropy_weight_yyx': 2.805800078042942e-06, 'L_sep_weight_yyx': 1.6779013144036854e-05, 'L_scale_weight_yyx': 2.6947179986643186e-07, 'learning_rate_yyx': 0.004286607791375684}. Best is trial 1 with value: -0.5540046114705124.
[I 2026-03-18 17:04:02,948] Trial 3 finished with value: -0.5680763632919962 and parameters: {'n_layers_yyx': 1, 'hidden_size_yyx_l0': 5, 'context_size_yyx': 4, 'num_mix_components_yyx': 3, 'context_extractor_yyx': 'gru', 'activation_func_yyx': 'GELU', 'L2_weight_yyx': 1.8276125634068412e-07, 'L_entropy_weight_yyx': 3.421499521448139e-08, 'L_sep_weight_yyx': 7.60059689801214e-05, 'L_scale_weight_yyx': 0.0003965065930144515, 'learning_rate_yyx': 0.0035609735064651084}. Best is trial 3 with value: -0.5680763632919962.
[I 2026-03-18 17:04:09,571] Trial 1 finished with value: -3.126730890715153 and parameters: {'n_layers_yyx': 2, 'hidden_size_yyx_l0': 5, 'hidden_size_yyx_l1': 5, 'context_size_yyx': 4, 'num_mix_components_yyx': 3, 'context_extractor_yyx': 'gru', 'activation_func_yyx': 'GELU', 'L2_weight_yyx': 8.306125248169095e-08, 'L_entropy_weight_yyx': 1.865614011127462e-10, 'L_sep_weight_yyx': 4.1309711425569086e-06, 'L_scale_weight_yyx': 0.0007538405199742278, 'learning_rate_yyx': 0.0019593315889946876}. Best is trial 1 with value: -3.126730890715153.
[I 2026-03-18 17:04:21,410] Trial 1 finished with value: -1.2443446584197377 and parameters: {'n_layers_yyx': 1, 'hidden_size_yyx_l0': 2, 'context_size_yyx': 1, 'num_mix_components_yyx': 3, 'context_extractor_yyx': 'gru', 'activation_func_yyx': 'Tanh', 'L2_weight_yyx': 1.0663098923384057e-10, 'L_entropy_weight_yyx': 2.021707849045549e-05, 'L_sep_weight_yyx': 1.937863600713336e-06, 'L_scale_weight_yyx': 9.601342087268872e-08, 'learning_rate_yyx': 0.007729227066858859}. Best is trial 0 with value: -1.2528411103705162.
[I 2026-03-18 17:04:22,012] Trial 4 pruned. 
[I 2026-03-18 17:04:24,507] Trial 1 finished with value: -3.1505299612690063 and parameters: {'n_layers_yyx': 2, 'hidden_size_yyx_l0': 5, 'hidden_size_yyx_l1': 3, 'context_size_yyx': 2, 'num_mix_components_yyx': 5, 'context_extractor_yyx': 'gru', 'activation_func_yyx': 'GELU', 'L2_weight_yyx': 2.825404687923786e-07, 'L_entropy_weight_yyx': 7.032052044203604e-07, 'L_sep_weight_yyx': 1.2002295101015092e-08, 'L_scale_weight_yyx': 1.0446848934924216e-08, 'learning_rate_yyx': 0.00966222855471058}. Best is trial 1 with value: -3.1505299612690063.
[I 2026-03-18 17:04:27,518] Trial 2 pruned. 
[I 2026-03-18 17:04:32,879] Trial 3 finished with value: -3.1534373073156847 and parameters: {'n_layers_yyx': 1, 'hidden_size_yyx_l0': 3, 'context_size_yyx': 4, 'num_mix_components_yyx': 1, 'context_extractor_yyx': 'gru', 'activation_func_yyx': 'GELU', 'L2_weight_yyx': 5.288955959921119e-05, 'L_entropy_weight_yyx': 4.527971669579758e-07, 'L_sep_weight_yyx': 2.350154956015759e-07, 'L_scale_weight_yyx': 1.1185267768813275e-09, 'learning_rate_yyx': 0.0079321183891177}. Best is trial 3 with value: -3.1534373073156847.
[I 2026-03-18 17:04:35,165] Trial 2 pruned. 
[I 2026-03-18 17:04:41,154] Trial 2 finished with value: -1.2627738205209897 and parameters: {'n_layers_yyx': 2, 'hidden_size_yyx_l0': 4, 'hidden_size_yyx_l1': 4, 'context_size_yyx': 3, 'num_mix_components_yyx': 3, 'context_extractor_yyx': 'gru', 'activation_func_yyx': 'ReLU', 'L2_weight_yyx': 4.3939104421327225e-08, 'L_entropy_weight_yyx': 4.5333220210455225e-06, 'L_sep_weight_yyx': 7.62053278146267e-10, 'L_scale_weight_yyx': 0.00017469848557803306, 'learning_rate_yyx': 0.006515712461686554}. Best is trial 0 with value: -1.2691870881537193.
[I 2026-03-18 17:04:47,881] Trial 2 finished with value: -0.5782459369223908 and parameters: {'n_layers_yyx': 2, 'hidden_size_yyx_l0': 3, 'hidden_size_yyx_l1': 5, 'context_size_yyx': 2, 'num_mix_components_yyx': 3, 'context_extractor_yyx': 'lstm', 'activation_func_yyx': 'GELU', 'L2_weight_yyx': 1.5605329809501299e-09, 'L_entropy_weight_yyx': 1.1575383788697615e-07, 'L_sep_weight_yyx': 2.6535283945549595e-09, 'L_scale_weight_yyx': 8.228268045089866e-07, 'learning_rate_yyx': 0.0058552259711271495}. Best is trial 0 with value: -0.581007651810469.
[I 2026-03-18 17:04:52,260] Trial 5 pruned. 
[I 2026-03-18 17:04:52,818] Trial 2 pruned. 
[I 2026-03-18 17:04:56,512] Trial 3 pruned. 
[I 2026-03-18 17:05:00,020] Trial 3 pruned. 
[I 2026-03-18 17:05:09,998] Trial 1 finished with value: -0.5670251859431418 and parameters: {'n_layers_yyx': 2, 'hidden_size_yyx_l0': 3, 'hidden_size_yyx_l1': 6, 'context_size_yyx': 1, 'num_mix_components_yyx': 5, 'context_extractor_yyx': 'lstm', 'activation_func_yyx': 'GELU', 'L2_weight_yyx': 3.895626915949738e-08, 'L_entropy_weight_yyx': 3.498560740457536e-05, 'L_sep_weight_yyx': 1.1160146975038837e-08, 'L_scale_weight_yyx': 1.5673333058037603e-08, 'learning_rate_yyx': 0.0007882933134731391}. Best is trial 1 with value: -0.5670251859431418.
[I 2026-03-18 17:05:12,049] Trial 1 finished with value: -1.2370828880722073 and parameters: {'n_layers_yyx': 2, 'hidden_size_yyx_l0': 2, 'hidden_size_yyx_l1': 2, 'context_size_yyx': 4, 'num_mix_components_yyx': 1, 'context_extractor_yyx': 'gru', 'activation_func_yyx': 'GELU', 'L2_weight_yyx': 1.289375738804215e-08, 'L_entropy_weight_yyx': 2.847025855367744e-07, 'L_sep_weight_yyx': 3.233222832794816e-10, 'L_scale_weight_yyx': 3.818812593755468e-07, 'learning_rate_yyx': 0.004649409179387659}. Best is trial 0 with value: -1.2747321457392233.
[I 2026-03-18 17:05:13,289] Trial 3 pruned. 
[I 2026-03-18 17:05:13,438] Trial 3 finished with value: -1.265314140954432 and parameters: {'n_layers_yyx': 1, 'hidden_size_yyx_l0': 6, 'context_size_yyx': 4, 'num_mix_components_yyx': 4, 'context_extractor_yyx': 'lstm', 'activation_func_yyx': 'ReLU', 'L2_weight_yyx': 1.673279030624903e-08, 'L_entropy_weight_yyx': 1.0355249903272671e-10, 'L_sep_weight_yyx': 3.043730303456599e-08, 'L_scale_weight_yyx': 1.9707445045911754e-09, 'learning_rate_yyx': 0.00916172464110425}. Best is trial 3 with value: -1.265314140954432.
[I 2026-03-18 17:05:14,367] Trial 5 finished with value: -3.1104415241887726 and parameters: {'n_layers_yyx': 1, 'hidden_size_yyx_l0': 5, 'context_size_yyx': 4, 'num_mix_components_yyx': 4, 'context_extractor_yyx': 'lstm', 'activation_func_yyx': 'GELU', 'L2_weight_yyx': 0.0006797345660712622, 'L_entropy_weight_yyx': 0.00035511591799978234, 'L_sep_weight_yyx': 1.6373732787522727e-09, 'L_scale_weight_yyx': 5.057908553633056e-07, 'learning_rate_yyx': 0.0007429085954095351}. Best is trial 0 with value: -3.1199443073044333.
[I 2026-03-18 17:05:14,714] Trial 1 finished with value: -3.1457344405398717 and parameters: {'n_layers_yyx': 2, 'hidden_size_yyx_l0': 6, 'hidden_size_yyx_l1': 4, 'context_size_yyx': 3, 'num_mix_components_yyx': 3, 'context_extractor_yyx': 'lstm', 'activation_func_yyx': 'Tanh', 'L2_weight_yyx': 1.363165551604172e-10, 'L_entropy_weight_yyx': 1.3531725207956063e-05, 'L_sep_weight_yyx': 0.00019207418254697795, 'L_scale_weight_yyx': 1.3448407176995052e-05, 'learning_rate_yyx': 0.002648015533556386}. Best is trial 1 with value: -3.1457344405398717.
[I 2026-03-18 17:05:18,493] Trial 4 pruned. 
[I 2026-03-18 17:05:20,453] Trial 1 finished with value: -1.2648516600321489 and parameters: {'n_layers_yyx': 1, 'hidden_size_yyx_l0': 6, 'context_size_yyx': 2, 'num_mix_components_yyx': 4, 'context_extractor_yyx': 'lstm', 'activation_func_yyx': 'Tanh', 'L2_weight_yyx': 8.239986482046615e-06, 'L_entropy_weight_yyx': 2.926421769541009e-07, 'L_sep_weight_yyx': 8.088369578843908e-10, 'L_scale_weight_yyx': 9.14598026813364e-05, 'learning_rate_yyx': 0.0011966664433202487}. Best is trial 1 with value: -1.2648516600321489.
[I 2026-03-18 17:05:23,235] Trial 3 pruned. 
[I 2026-03-18 17:05:34,293] Trial 4 pruned. 
[I 2026-03-18 17:05:34,686] Trial 4 pruned. 
[I 2026-03-18 17:05:40,651] Trial 2 pruned. 
[I 2026-03-18 17:05:43,997] Trial 5 pruned. 
[I 2026-03-18 17:05:46,089] Trial 1 finished with value: -3.145951069607026 and parameters: {'n_layers_yyx': 2, 'hidden_size_yyx_l0': 2, 'hidden_size_yyx_l1': 6, 'context_size_yyx': 3, 'num_mix_components_yyx': 3, 'context_extractor_yyx': 'lstm', 'activation_func_yyx': 'ReLU', 'L2_weight_yyx': 0.0003486852015834001, 'L_entropy_weight_yyx': 1.897181724914367e-10, 'L_sep_weight_yyx': 5.800323735287389e-08, 'L_scale_weight_yyx': 5.350166794125438e-09, 'learning_rate_yyx': 0.0009496262986035271}. Best is trial 1 with value: -3.145951069607026.
[I 2026-03-18 17:05:46,962] Trial 4 pruned. 
[I 2026-03-18 17:05:50,575] Trial 2 finished with value: -0.5529010253234612 and parameters: {'n_layers_yyx': 2, 'hidden_size_yyx_l0': 5, 'hidden_size_yyx_l1': 3, 'context_size_yyx': 1, 'num_mix_components_yyx': 1, 'context_extractor_yyx': 'gru', 'activation_func_yyx': 'GELU', 'L2_weight_yyx': 0.0005684876183248996, 'L_entropy_weight_yyx': 5.2454241282437606e-08, 'L_sep_weight_yyx': 0.00023172571572946399, 'L_scale_weight_yyx': 0.0002723873112605982, 'learning_rate_yyx': 0.00659368453088576}. Best is trial 1 with value: -0.5540046114705124.
[I 2026-03-18 17:05:56,334] Trial 1 finished with value: -1.1496560031517156 and parameters: {'n_layers_yyx': 2, 'hidden_size_yyx_l0': 2, 'hidden_size_yyx_l1': 5, 'context_size_yyx': 1, 'num_mix_components_yyx': 5, 'context_extractor_yyx': 'lstm', 'activation_func_yyx': 'GELU', 'L2_weight_yyx': 7.368121903859254e-09, 'L_entropy_weight_yyx': 1.5664408596206163e-05, 'L_sep_weight_yyx': 2.614372954801189e-10, 'L_scale_weight_yyx': 2.0705602267726417e-07, 'learning_rate_yyx': 0.001963832644130092}. Best is trial 0 with value: -1.2656102912042586.
[I 2026-03-18 17:06:00,301] Trial 6 pruned. 
[I 2026-03-18 17:06:17,168] Trial 2 finished with value: -3.1071079207019827 and parameters: {'n_layers_yyx': 1, 'hidden_size_yyx_l0': 2, 'context_size_yyx': 3, 'num_mix_components_yyx': 1, 'context_extractor_yyx': 'gru', 'activation_func_yyx': 'ReLU', 'L2_weight_yyx': 2.9113290480934916e-10, 'L_entropy_weight_yyx': 1.0169468415354328e-06, 'L_sep_weight_yyx': 1.2972384874796842e-05, 'L_scale_weight_yyx': 9.448713988958329e-06, 'learning_rate_yyx': 0.0024227719318250943}. Best is trial 0 with value: -3.1190589761594594.
[I 2026-03-18 17:06:18,579] Trial 7 pruned. 
[I 2026-03-18 17:06:20,390] Trial 1 pruned. 
[I 2026-03-18 17:06:20,744] Trial 2 finished with value: -3.1501405578480686 and parameters: {'n_layers_yyx': 1, 'hidden_size_yyx_l0': 6, 'context_size_yyx': 3, 'num_mix_components_yyx': 2, 'context_extractor_yyx': 'lstm', 'activation_func_yyx': 'Tanh', 'L2_weight_yyx': 0.00025068138883036314, 'L_entropy_weight_yyx': 0.0003223153769159822, 'L_sep_weight_yyx': 7.832235762198876e-09, 'L_scale_weight_yyx': 5.35915931152388e-10, 'learning_rate_yyx': 0.0074958582295403045}. Best is trial 2 with value: -3.1501405578480686.
[I 2026-03-18 17:06:25,250] Trial 2 finished with value: -3.1235621753098126 and parameters: {'n_layers_yyx': 2, 'hidden_size_yyx_l0': 5, 'hidden_size_yyx_l1': 5, 'context_size_yyx': 4, 'num_mix_components_yyx': 1, 'context_extractor_yyx': 'lstm', 'activation_func_yyx': 'ReLU', 'L2_weight_yyx': 0.00036302544525754037, 'L_entropy_weight_yyx': 7.085564153594482e-10, 'L_sep_weight_yyx': 2.4410212642646714e-10, 'L_scale_weight_yyx': 8.807791036260954e-09, 'learning_rate_yyx': 0.00894717877620173}. Best is trial 2 with value: -3.1235621753098126.
[I 2026-03-18 17:06:36,980] Trial 5 pruned. 
[I 2026-03-18 17:06:37,592] Trial 8 pruned. 
[I 2026-03-18 17:06:40,486] Trial 2 pruned. 
[I 2026-03-18 17:06:40,757] Trial 2 pruned. 
[I 2026-03-18 17:06:41,682] Trial 1 finished with value: -3.166268711244678 and parameters: {'n_layers_yyx': 1, 'hidden_size_yyx_l0': 6, 'context_size_yyx': 4, 'num_mix_components_yyx': 5, 'context_extractor_yyx': 'gru', 'activation_func_yyx': 'ReLU', 'L2_weight_yyx': 2.1723638932907117e-09, 'L_entropy_weight_yyx': 4.019922241219083e-06, 'L_sep_weight_yyx': 1.950403750180728e-06, 'L_scale_weight_yyx': 1.6179256774769658e-10, 'learning_rate_yyx': 0.0021859999790176505}. Best is trial 1 with value: -3.166268711244678.
[I 2026-03-18 17:06:44,757] Trial 3 pruned. 
[I 2026-03-18 17:06:50,361] Trial 4 finished with value: -3.147717290077944 and parameters: {'n_layers_yyx': 2, 'hidden_size_yyx_l0': 3, 'hidden_size_yyx_l1': 3, 'context_size_yyx': 3, 'num_mix_components_yyx': 4, 'context_extractor_yyx': 'lstm', 'activation_func_yyx': 'GELU', 'L2_weight_yyx': 2.4453998554387256e-09, 'L_entropy_weight_yyx': 6.859810351889358e-09, 'L_sep_weight_yyx': 1.6641311161176863e-09, 'L_scale_weight_yyx': 2.779078634973652e-10, 'learning_rate_yyx': 0.005374489962624479}. Best is trial 3 with value: -3.1534373073156847.
[I 2026-03-18 17:06:50,375] Trial 2 finished with value: -3.1172003082834023 and parameters: {'n_layers_yyx': 2, 'hidden_size_yyx_l0': 3, 'hidden_size_yyx_l1': 2, 'context_size_yyx': 2, 'num_mix_components_yyx': 1, 'context_extractor_yyx': 'gru', 'activation_func_yyx': 'ReLU', 'L2_weight_yyx': 2.4041117073083043e-08, 'L_entropy_weight_yyx': 7.136489145250913e-05, 'L_sep_weight_yyx': 1.984808198237884e-07, 'L_scale_weight_yyx': 1.6297869637585088e-05, 'learning_rate_yyx': 0.009403175318007804}. Best is trial 0 with value: -3.1460828145824977.
[I 2026-03-18 17:06:52,807] Trial 9 pruned. 
[I 2026-03-18 17:06:59,005] Trial 6 pruned. 
[I 2026-03-18 17:07:01,407] Trial 2 finished with value: -1.241674299821836 and parameters: {'n_layers_yyx': 2, 'hidden_size_yyx_l0': 6, 'hidden_size_yyx_l1': 6, 'context_size_yyx': 2, 'num_mix_components_yyx': 4, 'context_extractor_yyx': 'lstm', 'activation_func_yyx': 'GELU', 'L2_weight_yyx': 3.692830169163529e-05, 'L_entropy_weight_yyx': 1.1500697452633733e-10, 'L_sep_weight_yyx': 1.5769765851602853e-05, 'L_scale_weight_yyx': 5.052240526669589e-05, 'learning_rate_yyx': 0.0014811610961937838}. Best is trial 0 with value: -1.255221580181016.
[I 2026-03-18 17:07:06,477] Trial 3 pruned. 
[I 2026-03-18 17:07:08,623] Trial 2 pruned. 
[I 2026-03-18 17:07:14,061] Trial 3 pruned. 
[I 2026-03-18 17:07:21,958] Trial 1 finished with value: -1.2575015563400749 and parameters: {'n_layers_yyx': 2, 'hidden_size_yyx_l0': 6, 'hidden_size_yyx_l1': 2, 'context_size_yyx': 2, 'num_mix_components_yyx': 5, 'context_extractor_yyx': 'lstm', 'activation_func_yyx': 'ReLU', 'L2_weight_yyx': 1.4077928952072657e-08, 'L_entropy_weight_yyx': 3.5288714399799865e-10, 'L_sep_weight_yyx': 1.0635323211308718e-06, 'L_scale_weight_yyx': 1.8242352361388613e-07, 'learning_rate_yyx': 0.0010224620018688439}. Best is trial 1 with value: -1.2575015563400749.
[I 2026-03-18 17:07:22,481] Trial 2 finished with value: -3.1451786024824977 and parameters: {'n_layers_yyx': 1, 'hidden_size_yyx_l0': 5, 'context_size_yyx': 1, 'num_mix_components_yyx': 2, 'context_extractor_yyx': 'gru', 'activation_func_yyx': 'Tanh', 'L2_weight_yyx': 9.363445188639774e-06, 'L_entropy_weight_yyx': 0.0001158282481567587, 'L_sep_weight_yyx': 1.4134563740135082e-07, 'L_scale_weight_yyx': 1.519650951975501e-07, 'learning_rate_yyx': 0.0006804953841613864}. Best is trial 2 with value: -3.1451786024824977.
[I 2026-03-18 17:07:32,197] Trial 7 pruned. 
[I 2026-03-18 17:07:35,760] Trial 4 pruned. 
[I 2026-03-18 17:07:42,614] Trial 1 finished with value: -3.1478210420414996 and parameters: {'n_layers_yyx': 1, 'hidden_size_yyx_l0': 2, 'context_size_yyx': 4, 'num_mix_components_yyx': 1, 'context_extractor_yyx': 'gru', 'activation_func_yyx': 'GELU', 'L2_weight_yyx': 0.0009363493623999245, 'L_entropy_weight_yyx': 3.7294558158197196e-08, 'L_sep_weight_yyx': 1.372259492026015e-09, 'L_scale_weight_yyx': 5.272399779327583e-10, 'learning_rate_yyx': 0.0014636646262568432}. Best is trial 1 with value: -3.1478210420414996.
[I 2026-03-18 17:07:44,193] Trial 4 pruned. 
[I 2026-03-18 17:07:50,016] Trial 3 pruned. 
[I 2026-03-18 17:07:50,986] Trial 8 pruned. 
[I 2026-03-18 17:07:59,172] Trial 3 finished with value: -0.5628998348440724 and parameters: {'n_layers_yyx': 2, 'hidden_size_yyx_l0': 3, 'hidden_size_yyx_l1': 5, 'context_size_yyx': 4, 'num_mix_components_yyx': 4, 'context_extractor_yyx': 'lstm', 'activation_func_yyx': 'GELU', 'L2_weight_yyx': 0.0002946484413710562, 'L_entropy_weight_yyx': 4.069469151078649e-07, 'L_sep_weight_yyx': 5.32014914023069e-09, 'L_scale_weight_yyx': 0.00023431801237384122, 'learning_rate_yyx': 0.0016993400169682882}. Best is trial 3 with value: -0.5628998348440724.
[I 2026-03-18 17:07:59,436] Trial 2 finished with value: -1.1544905854681724 and parameters: {'n_layers_yyx': 1, 'hidden_size_yyx_l0': 3, 'context_size_yyx': 1, 'num_mix_components_yyx': 1, 'context_extractor_yyx': 'gru', 'activation_func_yyx': 'Tanh', 'L2_weight_yyx': 2.047000652525923e-07, 'L_entropy_weight_yyx': 2.5753888941111617e-05, 'L_sep_weight_yyx': 0.0009788230263724827, 'L_scale_weight_yyx': 5.6325097840869596e-05, 'learning_rate_yyx': 0.0017962722273608363}. Best is trial 1 with value: -1.2312460527402416.
[I 2026-03-18 17:08:02,551] Trial 1 finished with value: -1.2314732775450195 and parameters: {'n_layers_yyx': 2, 'hidden_size_yyx_l0': 5, 'hidden_size_yyx_l1': 3, 'context_size_yyx': 4, 'num_mix_components_yyx': 1, 'context_extractor_yyx': 'gru', 'activation_func_yyx': 'Tanh', 'L2_weight_yyx': 1.2483536332002114e-05, 'L_entropy_weight_yyx': 1.882067934758042e-08, 'L_sep_weight_yyx': 1.2390537026532316e-10, 'L_scale_weight_yyx': 1.158211941070924e-07, 'learning_rate_yyx': 0.0008951927395596976}. Best is trial 1 with value: -1.2314732775450195.
[I 2026-03-18 17:08:02,614] Trial 5 finished with value: -1.2576807060876307 and parameters: {'n_layers_yyx': 2, 'hidden_size_yyx_l0': 3, 'hidden_size_yyx_l1': 5, 'context_size_yyx': 1, 'num_mix_components_yyx': 3, 'context_extractor_yyx': 'lstm', 'activation_func_yyx': 'ReLU', 'L2_weight_yyx': 9.197257131446438e-09, 'L_entropy_weight_yyx': 0.000405948678980829, 'L_sep_weight_yyx': 2.8473519189063435e-08, 'L_scale_weight_yyx': 6.093896251659671e-07, 'learning_rate_yyx': 0.005571736826133225}. Best is trial 0 with value: -1.2691870881537193.
