[I 2026-03-18 22:40:34,475] Trial 62 finished with value: -2.40357121914694 and parameters: {'n_layers_yyx': 2, 'hidden_size_yyx_l0': 6, 'hidden_size_yyx_l1': 4, 'context_size_yyx': 4, 'num_mix_components_yyx': 4, 'context_extractor_yyx': 'lstm', 'activation_func_yyx': 'GELU', 'L2_weight_yyx': 0.0007981195649290237, 'L_entropy_weight_yyx': 1.188393659071695e-05, 'L_sep_weight_yyx': 0.0004373881684896874, 'L_scale_weight_yyx': 3.899176901956964e-05, 'learning_rate_yyx': 0.00899473221185443}. Best is trial 53 with value: -2.4049037025927396.
[I 2026-03-18 22:40:37,235] Trial 60 pruned. 
[I 2026-03-18 22:40:39,957] Trial 66 pruned. 
[I 2026-03-18 22:40:50,299] Trial 67 pruned. 
[I 2026-03-18 22:40:54,367] Trial 69 finished with value: -2.3909004796196087 and parameters: {'n_layers_yyx': 2, 'hidden_size_yyx_l0': 4, 'hidden_size_yyx_l1': 6, 'context_size_yyx': 1, 'num_mix_components_yyx': 4, 'context_extractor_yyx': 'lstm', 'activation_func_yyx': 'ReLU', 'L2_weight_yyx': 4.3546255185625614e-05, 'L_entropy_weight_yyx': 5.372021366921201e-10, 'L_sep_weight_yyx': 0.0001556217412067979, 'L_scale_weight_yyx': 5.495994318913637e-09, 'learning_rate_yyx': 0.008740598806314984}. Best is trial 11 with value: -2.4030680672323603.

Source events: 20158
Target events: 12539
Full model ln_yyx : 1034.47678 nats/sec, 74.25067 nats/event
Full model Log loss : -2.38957
Full model ln_yyx : 1036.40749 nats/sec, 74.38925 nats/event
Full model Log loss : -2.39509
Full model ln_yyx : 1026.22572 nats/sec, 73.65844 nats/event
Full model Log loss : -2.38984
Full model ln_yyx : 1036.46013 nats/sec, 74.39302 nats/event
Full model Log loss : -2.38930
Full model ln_yyx : 1041.60030 nats/sec, 74.76196 nats/event
Full model Log loss : -2.39992
Full model ln_yyx : 1042.30018 nats/sec, 74.81220 nats/event
Full model Log loss : -2.40019
Full model ln_yyx : 1033.26463 nats/sec, 74.16366 nats/event
Full model Log loss : -2.40249
Full model ln_yyx : 1028.84508 nats/sec, 73.84645 nats/event
Full model Log loss : -2.38725
Full model ln_yyx : 1036.88079 nats/sec, 74.42322 nats/event
Full model Log loss : -2.39830
Full model ln_yyx : 1038.22034 nats/sec, 74.51936 nats/event
Full model Log loss : -2.39855
Full model ln_yyx : 1039.32813 nats/sec, 74.59888 nats/event
Full model Log loss : -2.39885
Full model ln_yyx : 1034.71991 nats/sec, 74.26812 nats/event
Full model Log loss : -2.38678
Full model ln_yyx : 1032.61054 nats/sec, 74.11671 nats/event
Full model Log loss : -2.39090
Optimization finished. Config saved to results/opt-full/opt_full_167_best_config.txt
[I 2026-03-18 22:40:55,227] Trial 68 pruned. 

Source events: 20158
Target events: 9421
Full model ln_yyx : 779.22466 nats/sec, 74.44031 nats/event
Full model Log loss : -2.43125
Full model ln_yyx : 783.38359 nats/sec, 74.83762 nats/event
Full model Log loss : -2.42271
Full model ln_yyx : 782.65237 nats/sec, 74.76777 nats/event
Full model Log loss : -2.42301
Full model ln_yyx : 780.62448 nats/sec, 74.57404 nats/event
Full model Log loss : -2.43192
Full model ln_yyx : 780.13658 nats/sec, 74.52743 nats/event
Full model Log loss : -2.42153
Full model ln_yyx : 774.02435 nats/sec, 73.94352 nats/event
Full model Log loss : -2.39174
Full model ln_yyx : 787.23050 nats/sec, 75.20512 nats/event
Full model Log loss : -2.42115
Full model ln_yyx : 782.08692 nats/sec, 74.71375 nats/event
Full model Log loss : -2.42097
Full model ln_yyx : 780.24511 nats/sec, 74.53780 nats/event
Full model Log loss : -2.42990
Full model ln_yyx : 782.97253 nats/sec, 74.79835 nats/event
Full model Log loss : -2.43024
Optimization finished. Config saved to results/opt-full/opt_full_166_best_config.txt
[I 2026-03-18 22:40:57,298] Trial 46 finished with value: -2.763681694737003 and parameters: {'n_layers_yyx': 1, 'hidden_size_yyx_l0': 4, 'context_size_yyx': 3, 'num_mix_components_yyx': 5, 'context_extractor_yyx': 'lstm', 'activation_func_yyx': 'ReLU', 'L2_weight_yyx': 6.32480913085103e-07, 'L_entropy_weight_yyx': 3.374660562029472e-05, 'L_sep_weight_yyx': 0.00012465304165719146, 'L_scale_weight_yyx': 1.2156227777151924e-08, 'learning_rate_yyx': 0.006474513896223818}. Best is trial 8 with value: -2.7663050128086293.
[I 2026-03-18 22:41:02,364] Trial 64 finished with value: -2.3869533983524294 and parameters: {'n_layers_yyx': 2, 'hidden_size_yyx_l0': 4, 'hidden_size_yyx_l1': 4, 'context_size_yyx': 4, 'num_mix_components_yyx': 4, 'context_extractor_yyx': 'lstm', 'activation_func_yyx': 'ReLU', 'L2_weight_yyx': 0.00030051383646394935, 'L_entropy_weight_yyx': 1.8616938419505203e-10, 'L_sep_weight_yyx': 0.0001296967449503555, 'L_scale_weight_yyx': 3.2906468889226633e-07, 'learning_rate_yyx': 0.00967971969740276}. Best is trial 55 with value: -2.400930198925506.
[I 2026-03-18 22:41:05,755] Trial 61 pruned. 
[I 2026-03-18 22:41:10,300] Trial 62 pruned. 
[I 2026-03-18 22:41:10,919] Trial 65 finished with value: -2.7667033937518317 and parameters: {'n_layers_yyx': 2, 'hidden_size_yyx_l0': 5, 'hidden_size_yyx_l1': 6, 'context_size_yyx': 4, 'num_mix_components_yyx': 4, 'context_extractor_yyx': 'gru', 'activation_func_yyx': 'ReLU', 'L2_weight_yyx': 2.030483461029749e-08, 'L_entropy_weight_yyx': 0.00016114442169413878, 'L_sep_weight_yyx': 0.00010867589177085119, 'L_scale_weight_yyx': 3.579837859369096e-05, 'learning_rate_yyx': 0.007786321985708258}. Best is trial 0 with value: -2.7678615354442075.
[I 2026-03-18 22:41:12,428] Trial 67 finished with value: -2.7635338298968652 and parameters: {'n_layers_yyx': 2, 'hidden_size_yyx_l0': 4, 'hidden_size_yyx_l1': 4, 'context_size_yyx': 1, 'num_mix_components_yyx': 2, 'context_extractor_yyx': 'gru', 'activation_func_yyx': 'Tanh', 'L2_weight_yyx': 2.9185127525525993e-09, 'L_entropy_weight_yyx': 0.0005658549621929985, 'L_sep_weight_yyx': 5.09743982507943e-10, 'L_scale_weight_yyx': 6.702864224018134e-09, 'learning_rate_yyx': 0.0026124499632756357}. Best is trial 6 with value: -2.7665796528518882.
[I 2026-03-18 22:41:19,470] Trial 72 finished with value: -2.7666109085083006 and parameters: {'n_layers_yyx': 2, 'hidden_size_yyx_l0': 6, 'hidden_size_yyx_l1': 5, 'context_size_yyx': 4, 'num_mix_components_yyx': 5, 'context_extractor_yyx': 'gru', 'activation_func_yyx': 'GELU', 'L2_weight_yyx': 2.4842923809150992e-06, 'L_entropy_weight_yyx': 5.446660394381187e-10, 'L_sep_weight_yyx': 4.1840526396299555e-05, 'L_scale_weight_yyx': 1.7605450955044237e-07, 'learning_rate_yyx': 0.008207140288124234}. Best is trial 55 with value: -2.7679802735646564.
[I 2026-03-18 22:41:29,133] Trial 68 pruned. 
[I 2026-03-18 22:41:31,410] Trial 63 finished with value: -2.4036861318853044 and parameters: {'n_layers_yyx': 2, 'hidden_size_yyx_l0': 6, 'hidden_size_yyx_l1': 4, 'context_size_yyx': 4, 'num_mix_components_yyx': 4, 'context_extractor_yyx': 'lstm', 'activation_func_yyx': 'GELU', 'L2_weight_yyx': 0.00081431388089181, 'L_entropy_weight_yyx': 6.115396265943203e-05, 'L_sep_weight_yyx': 0.0005689013003591854, 'L_scale_weight_yyx': 4.309370537505218e-05, 'learning_rate_yyx': 0.009067623985424118}. Best is trial 53 with value: -2.4049037025927396.
[I 2026-03-18 22:41:36,845] Trial 69 pruned. 
[I 2026-03-18 22:41:45,368] Trial 65 finished with value: -2.3868174258483057 and parameters: {'n_layers_yyx': 2, 'hidden_size_yyx_l0': 4, 'hidden_size_yyx_l1': 6, 'context_size_yyx': 4, 'num_mix_components_yyx': 3, 'context_extractor_yyx': 'lstm', 'activation_func_yyx': 'ReLU', 'L2_weight_yyx': 0.0005286853455593913, 'L_entropy_weight_yyx': 3.9615494659479815e-10, 'L_sep_weight_yyx': 9.722557380433179e-05, 'L_scale_weight_yyx': 1.2932107115377014e-07, 'learning_rate_yyx': 0.00840600848609758}. Best is trial 55 with value: -2.400930198925506.
[I 2026-03-18 22:41:49,819] Trial 66 pruned. 
[I 2026-03-18 22:41:54,538] Trial 67 pruned. 
[I 2026-03-18 22:41:57,457] Trial 78 finished with value: -2.759236577487884 and parameters: {'n_layers_yyx': 2, 'hidden_size_yyx_l0': 2, 'hidden_size_yyx_l1': 4, 'context_size_yyx': 3, 'num_mix_components_yyx': 3, 'context_extractor_yyx': 'gru', 'activation_func_yyx': 'Tanh', 'L2_weight_yyx': 5.214150673120871e-05, 'L_entropy_weight_yyx': 3.728273452515405e-10, 'L_sep_weight_yyx': 3.447667217067393e-05, 'L_scale_weight_yyx': 1.4645938496063816e-05, 'learning_rate_yyx': 0.00853103252565198}. Best is trial 25 with value: -2.762886536950096.
[I 2026-03-18 22:41:59,034] Trial 68 pruned. 
[I 2026-03-18 22:42:04,353] Trial 73 finished with value: -2.7679184754689534 and parameters: {'n_layers_yyx': 2, 'hidden_size_yyx_l0': 6, 'hidden_size_yyx_l1': 5, 'context_size_yyx': 4, 'num_mix_components_yyx': 5, 'context_extractor_yyx': 'gru', 'activation_func_yyx': 'GELU', 'L2_weight_yyx': 1.717690547924941e-07, 'L_entropy_weight_yyx': 1.42712787601802e-09, 'L_sep_weight_yyx': 0.0001932149919458792, 'L_scale_weight_yyx': 7.632610312245948e-08, 'learning_rate_yyx': 0.009214349712331739}. Best is trial 55 with value: -2.7679802735646564.
[I 2026-03-18 22:42:09,811] Trial 47 finished with value: -2.7647611973649364 and parameters: {'n_layers_yyx': 1, 'hidden_size_yyx_l0': 3, 'context_size_yyx': 4, 'num_mix_components_yyx': 4, 'context_extractor_yyx': 'gru', 'activation_func_yyx': 'GELU', 'L2_weight_yyx': 1.850202221303525e-05, 'L_entropy_weight_yyx': 0.0001643547417141395, 'L_sep_weight_yyx': 2.8640096709802767e-05, 'L_scale_weight_yyx': 0.00013436984921254714, 'learning_rate_yyx': 0.0076249490396132795}. Best is trial 8 with value: -2.7663050128086293.
[I 2026-03-18 22:42:22,160] Trial 70 pruned. 
[I 2026-03-18 22:42:22,183] Trial 63 finished with value: -2.3932118264222755 and parameters: {'n_layers_yyx': 2, 'hidden_size_yyx_l0': 5, 'hidden_size_yyx_l1': 3, 'context_size_yyx': 4, 'num_mix_components_yyx': 3, 'context_extractor_yyx': 'lstm', 'activation_func_yyx': 'GELU', 'L2_weight_yyx': 0.00021563709285617885, 'L_entropy_weight_yyx': 2.3643970854039992e-07, 'L_sep_weight_yyx': 2.510617922355784e-06, 'L_scale_weight_yyx': 9.350834415944479e-08, 'learning_rate_yyx': 0.009053459647476577}. Best is trial 44 with value: -2.4022889279096553.
[I 2026-03-18 22:42:23,032] Trial 64 finished with value: -2.4032604050140733 and parameters: {'n_layers_yyx': 2, 'hidden_size_yyx_l0': 6, 'hidden_size_yyx_l1': 4, 'context_size_yyx': 4, 'num_mix_components_yyx': 4, 'context_extractor_yyx': 'lstm', 'activation_func_yyx': 'GELU', 'L2_weight_yyx': 0.0009689823180859046, 'L_entropy_weight_yyx': 5.912653146468295e-05, 'L_sep_weight_yyx': 0.0004986695850775849, 'L_scale_weight_yyx': 4.374612761428504e-05, 'learning_rate_yyx': 0.008852498623960463}. Best is trial 53 with value: -2.4049037025927396.
[I 2026-03-18 22:42:23,655] Trial 66 finished with value: -2.7641697272747625 and parameters: {'n_layers_yyx': 2, 'hidden_size_yyx_l0': 5, 'hidden_size_yyx_l1': 6, 'context_size_yyx': 4, 'num_mix_components_yyx': 4, 'context_extractor_yyx': 'gru', 'activation_func_yyx': 'ReLU', 'L2_weight_yyx': 6.349993828939163e-08, 'L_entropy_weight_yyx': 7.490294780129675e-05, 'L_sep_weight_yyx': 0.0001103514757907257, 'L_scale_weight_yyx': 1.1382985870921311e-05, 'learning_rate_yyx': 0.006060217713107763}. Best is trial 0 with value: -2.7678615354442075.
[I 2026-03-18 22:42:25,694] Trial 69 pruned. 
[I 2026-03-18 22:42:27,345] Trial 48 pruned. 
[I 2026-03-18 22:42:35,535] Trial 49 pruned. 
[I 2026-03-18 22:42:36,232] Trial 70 pruned. 

Source events: 20158
Target events: 27060
Full model ln_yyx : 2239.13666 nats/sec, 74.47239 nats/event
Full model Log loss : -2.38791
Full model ln_yyx : 2231.93358 nats/sec, 74.23282 nats/event
Full model Log loss : -2.38640
Full model ln_yyx : 2237.95485 nats/sec, 74.43309 nats/event
Full model Log loss : -2.39603
Full model ln_yyx : 2239.67704 nats/sec, 74.49037 nats/event
Full model Log loss : -2.39180
Full model ln_yyx : 2218.96380 nats/sec, 73.80146 nats/event
Full model Log loss : -2.36283
Full model ln_yyx : 2211.49876 nats/sec, 73.55317 nats/event
Full model Log loss : -2.36330
Full model ln_yyx : 2217.15094 nats/sec, 73.74116 nats/event
Full model Log loss : -2.38809
Full model ln_yyx : 2237.44754 nats/sec, 74.41622 nats/event
Full model Log loss : -2.38886
Full model ln_yyx : 2231.37427 nats/sec, 74.21422 nats/event
Full model Log loss : -2.38801
Full model ln_yyx : 2232.58010 nats/sec, 74.25433 nats/event
Full model Log loss : -2.38989
Full model ln_yyx : 2236.06810 nats/sec, 74.37034 nats/event
Full model Log loss : -2.38887
Full model ln_yyx : 2231.03957 nats/sec, 74.20309 nats/event
Full model Log loss : -2.38984
Full model ln_yyx : 2227.99290 nats/sec, 74.10176 nats/event
Full model Log loss : -2.40093
Full model ln_yyx : 2243.51307 nats/sec, 74.61795 nats/event
Full model Log loss : -2.39061
Full model ln_yyx : 2228.23216 nats/sec, 74.10972 nats/event
Full model Log loss : -2.39142
Full model ln_yyx : 2243.83493 nats/sec, 74.62866 nats/event
Full model Log loss : -2.38695
Full model ln_yyx : 2221.87899 nats/sec, 73.89841 nats/event
Full model Log loss : -2.38682
Optimization finished. Config saved to results/opt-full/opt_full_160_best_config.txt
[I 2026-03-18 22:42:41,145] Trial 67 pruned. 
[I 2026-03-18 22:42:43,588] Trial 79 pruned. 
[I 2026-03-18 22:42:50,811] Trial 74 finished with value: -2.7679246107737225 and parameters: {'n_layers_yyx': 2, 'hidden_size_yyx_l0': 6, 'hidden_size_yyx_l1': 5, 'context_size_yyx': 4, 'num_mix_components_yyx': 5, 'context_extractor_yyx': 'gru', 'activation_func_yyx': 'GELU', 'L2_weight_yyx': 1.3698056514545486e-07, 'L_entropy_weight_yyx': 2.9669586957863934e-10, 'L_sep_weight_yyx': 0.00017534580241122355, 'L_scale_weight_yyx': 8.068443194643205e-08, 'learning_rate_yyx': 0.0093052448910154}. Best is trial 55 with value: -2.7679802735646564.
[I 2026-03-18 22:42:54,117] Trial 64 finished with value: -2.362754360101162 and parameters: {'n_layers_yyx': 2, 'hidden_size_yyx_l0': 4, 'hidden_size_yyx_l1': 3, 'context_size_yyx': 4, 'num_mix_components_yyx': 3, 'context_extractor_yyx': 'lstm', 'activation_func_yyx': 'GELU', 'L2_weight_yyx': 0.00023457654004985568, 'L_entropy_weight_yyx': 7.681277095637324e-07, 'L_sep_weight_yyx': 2.292225415405818e-06, 'L_scale_weight_yyx': 3.860357420611429e-08, 'learning_rate_yyx': 0.009002677592022949}. Best is trial 44 with value: -2.4022889279096553.

Source events: 20158
Target events: 16159
Full model ln_yyx : 1333.58035 nats/sec, 74.27578 nats/event
Full model Log loss : -2.39456
Full model ln_yyx : 1316.09453 nats/sec, 73.30188 nats/event
Full model Log loss : -2.35928
Full model ln_yyx : 1320.52880 nats/sec, 73.54885 nats/event
Full model Log loss : -2.36335
Full model ln_yyx : 1319.49900 nats/sec, 73.49150 nats/event
Full model Log loss : -2.36698
Full model ln_yyx : 1332.81606 nats/sec, 74.23321 nats/event
Full model Log loss : -2.40229
Full model ln_yyx : 1314.39200 nats/sec, 73.20706 nats/event
Full model Log loss : -2.35527
Full model ln_yyx : 1342.94628 nats/sec, 74.79743 nats/event
Full model Log loss : -2.39227
Full model ln_yyx : 1332.68783 nats/sec, 74.22607 nats/event
Full model Log loss : -2.39336
Full model ln_yyx : 1332.45005 nats/sec, 74.21283 nats/event
Full model Log loss : -2.39359
Full model ln_yyx : 1320.48533 nats/sec, 73.54643 nats/event
Full model Log loss : -2.36228
Full model ln_yyx : 1319.83866 nats/sec, 73.51042 nats/event
Full model Log loss : -2.36169
Full model ln_yyx : 1338.31229 nats/sec, 74.53933 nats/event
Full model Log loss : -2.39107
Full model ln_yyx : 1328.85126 nats/sec, 74.01239 nats/event
Full model Log loss : -2.38522
Full model ln_yyx : 1318.03917 nats/sec, 73.41019 nats/event
Full model Log loss : -2.35846
Full model ln_yyx : 1329.17627 nats/sec, 74.03049 nats/event
Full model Log loss : -2.39321
Full model ln_yyx : 1315.51001 nats/sec, 73.26932 nats/event
Full model Log loss : -2.36275
Optimization finished. Config saved to results/opt-full/opt_full_169_best_config.txt
[I 2026-03-18 22:43:21,022] Trial 65 finished with value: -2.4038363782938 and parameters: {'n_layers_yyx': 2, 'hidden_size_yyx_l0': 6, 'hidden_size_yyx_l1': 4, 'context_size_yyx': 4, 'num_mix_components_yyx': 4, 'context_extractor_yyx': 'lstm', 'activation_func_yyx': 'GELU', 'L2_weight_yyx': 0.0008267639517589301, 'L_entropy_weight_yyx': 1.324683971317586e-05, 'L_sep_weight_yyx': 0.00021292121167019358, 'L_scale_weight_yyx': 8.447336254532563e-05, 'learning_rate_yyx': 0.008763876503903156}. Best is trial 53 with value: -2.4049037025927396.
[I 2026-03-18 22:43:21,485] Trial 50 pruned. 
[I 2026-03-18 22:43:27,010] Trial 68 pruned. 
[I 2026-03-18 22:43:34,171] Trial 75 finished with value: -2.7679280757904055 and parameters: {'n_layers_yyx': 2, 'hidden_size_yyx_l0': 6, 'hidden_size_yyx_l1': 5, 'context_size_yyx': 4, 'num_mix_components_yyx': 5, 'context_extractor_yyx': 'gru', 'activation_func_yyx': 'GELU', 'L2_weight_yyx': 1.0306792404162924e-07, 'L_entropy_weight_yyx': 2.66696206003806e-10, 'L_sep_weight_yyx': 0.00015000428395211927, 'L_scale_weight_yyx': 8.958355322569133e-08, 'learning_rate_yyx': 0.009227107181705467}. Best is trial 55 with value: -2.7679802735646564.

Source events: 39192
Target events: 14713
Full model ln_yyx : 2653.32416 nats/sec, 162.30488 nats/event
Full model Log loss : -2.76589
Full model ln_yyx : 2676.73062 nats/sec, 163.73667 nats/event
Full model Log loss : -2.76313
Full model ln_yyx : 2680.61855 nats/sec, 163.97449 nats/event
Full model Log loss : -2.76409
Full model ln_yyx : 2665.01449 nats/sec, 163.01998 nats/event
Full model Log loss : -2.76580
Full model ln_yyx : 2675.28352 nats/sec, 163.64815 nats/event
Full model Log loss : -2.76441
Full model ln_yyx : 2655.43642 nats/sec, 162.43409 nats/event
Full model Log loss : -2.76751
Full model ln_yyx : 2661.01353 nats/sec, 162.77524 nats/event
Full model Log loss : -2.76682
Full model ln_yyx : 2680.83784 nats/sec, 163.98791 nats/event
Full model Log loss : -2.76614
Full model ln_yyx : 2655.19773 nats/sec, 162.41949 nats/event
Full model Log loss : -2.76723
Full model ln_yyx : 2665.04065 nats/sec, 163.02159 nats/event
Full model Log loss : -2.76639
Full model ln_yyx : 2674.39088 nats/sec, 163.59354 nats/event
Full model Log loss : -2.76664
Full model ln_yyx : 2650.44279 nats/sec, 162.12863 nats/event
Full model Log loss : -2.76798
Full model ln_yyx : 2655.19667 nats/sec, 162.41942 nats/event
Full model Log loss : -2.76633
Full model ln_yyx : 2654.20470 nats/sec, 162.35875 nats/event
Full model Log loss : -2.76347
Full model ln_yyx : 2639.36708 nats/sec, 161.45112 nats/event
Full model Log loss : -2.76782
Full model ln_yyx : 2654.07672 nats/sec, 162.35092 nats/event
Full model Log loss : -2.76549
Full model ln_yyx : 2674.47472 nats/sec, 163.59867 nats/event
Full model Log loss : -2.76676
Full model ln_yyx : 2663.23632 nats/sec, 162.91121 nats/event
Full model Log loss : -2.76661
Full model ln_yyx : 2651.19802 nats/sec, 162.17483 nats/event
Full model Log loss : -2.76792
Full model ln_yyx : 2651.76707 nats/sec, 162.20964 nats/event
Full model Log loss : -2.76792
Full model ln_yyx : 2651.38972 nats/sec, 162.18655 nats/event
Full model Log loss : -2.76793
Optimization finished. Config saved to results/opt-full/opt_full_172_best_config.txt
[I 2026-03-18 22:43:39,849] Trial 80 finished with value: -2.72849780403994 and parameters: {'n_layers_yyx': 2, 'hidden_size_yyx_l0': 3, 'hidden_size_yyx_l1': 5, 'context_size_yyx': 3, 'num_mix_components_yyx': 2, 'context_extractor_yyx': 'lstm', 'activation_func_yyx': 'Tanh', 'L2_weight_yyx': 0.00014430950474579235, 'L_entropy_weight_yyx': 7.180121974552448e-10, 'L_sep_weight_yyx': 8.109367604948556e-05, 'L_scale_weight_yyx': 7.219384538433715e-05, 'learning_rate_yyx': 0.006548381688418618}. Best is trial 25 with value: -2.762886536950096.

Source events: 39192
Target events: 3403
Full model ln_yyx : 613.69353 nats/sec, 162.30508 nats/event
Full model Log loss : -2.76036
Full model ln_yyx : 613.87182 nats/sec, 162.35223 nats/event
Full model Log loss : -2.76025
Full model ln_yyx : 603.43675 nats/sec, 159.59244 nats/event
Full model Log loss : -2.72740
Full model ln_yyx : 615.63382 nats/sec, 162.81823 nats/event
Full model Log loss : -2.76218
Full model ln_yyx : 615.13597 nats/sec, 162.68656 nats/event
Full model Log loss : -2.76233
Full model ln_yyx : 615.09992 nats/sec, 162.67703 nats/event
Full model Log loss : -2.76217
Full model ln_yyx : 610.32571 nats/sec, 161.41438 nats/event
Full model Log loss : -2.76160
Full model ln_yyx : 612.77205 nats/sec, 162.06137 nats/event
Full model Log loss : -2.76265
Full model ln_yyx : 612.56793 nats/sec, 162.00739 nats/event
Full model Log loss : -2.76263
Full model ln_yyx : 615.77796 nats/sec, 162.85635 nats/event
Full model Log loss : -2.76177
Full model ln_yyx : 612.98805 nats/sec, 162.11850 nats/event
Full model Log loss : -2.76255
Full model ln_yyx : 617.10387 nats/sec, 163.20702 nats/event
Full model Log loss : -2.75924
Full model ln_yyx : 605.80807 nats/sec, 160.21959 nats/event
Full model Log loss : -2.72850
Optimization finished. Config saved to results/opt-full/opt_full_173_best_config.txt
[I 2026-03-18 22:43:40,826] Trial 71 finished with value: -2.766279982327172 and parameters: {'n_layers_yyx': 2, 'hidden_size_yyx_l0': 4, 'hidden_size_yyx_l1': 3, 'context_size_yyx': 3, 'num_mix_components_yyx': 4, 'context_extractor_yyx': 'gru', 'activation_func_yyx': 'Tanh', 'L2_weight_yyx': 1.958168852016601e-10, 'L_entropy_weight_yyx': 0.0003733011765732254, 'L_sep_weight_yyx': 9.00533793988908e-09, 'L_scale_weight_yyx': 4.2426391584386964e-08, 'learning_rate_yyx': 0.006439252489311881}. Best is trial 6 with value: -2.7665796528518882.
[I 2026-03-18 22:43:43,712] Trial 69 pruned. 
