[I 2026-03-18 17:56:15,122] Trial 21 finished with value: -0.5720208966912397 and parameters: {'n_layers_yyx': 1, 'hidden_size_yyx_l0': 5, 'context_size_yyx': 3, 'num_mix_components_yyx': 3, 'context_extractor_yyx': 'gru', 'activation_func_yyx': 'ReLU', 'L2_weight_yyx': 1.1467510688664155e-10, 'L_entropy_weight_yyx': 7.418106754729418e-08, 'L_sep_weight_yyx': 6.897590557768981e-06, 'L_scale_weight_yyx': 8.527402165921912e-09, 'learning_rate_yyx': 0.009958203997348609}. Best is trial 15 with value: -0.5797879771320495.
[I 2026-03-18 17:56:16,670] Trial 21 pruned. 
[I 2026-03-18 17:56:16,694] Trial 24 pruned. 
[I 2026-03-18 17:56:22,376] Trial 14 pruned. 
[I 2026-03-18 17:56:40,229] Trial 21 finished with value: -3.1203127304300375 and parameters: {'n_layers_yyx': 2, 'hidden_size_yyx_l0': 3, 'hidden_size_yyx_l1': 5, 'context_size_yyx': 4, 'num_mix_components_yyx': 1, 'context_extractor_yyx': 'lstm', 'activation_func_yyx': 'GELU', 'L2_weight_yyx': 1.6483030143470595e-10, 'L_entropy_weight_yyx': 4.4949007218924615e-05, 'L_sep_weight_yyx': 1.2006133936368335e-08, 'L_scale_weight_yyx': 3.162035102157086e-05, 'learning_rate_yyx': 0.009579273284852604}. Best is trial 16 with value: -3.149974272486285.
[I 2026-03-18 17:56:50,420] Trial 13 finished with value: -3.145879227227111 and parameters: {'n_layers_yyx': 2, 'hidden_size_yyx_l0': 5, 'hidden_size_yyx_l1': 2, 'context_size_yyx': 4, 'num_mix_components_yyx': 4, 'context_extractor_yyx': 'gru', 'activation_func_yyx': 'ReLU', 'L2_weight_yyx': 6.991763826955346e-07, 'L_entropy_weight_yyx': 2.2560487492630763e-09, 'L_sep_weight_yyx': 6.918243946064871e-08, 'L_scale_weight_yyx': 0.0007096730031842282, 'learning_rate_yyx': 0.0074967669141996485}. Best is trial 10 with value: -3.148061618303045.
[I 2026-03-18 17:57:04,051] Trial 15 pruned. 
[I 2026-03-18 17:57:07,817] Trial 22 pruned. 
[I 2026-03-18 17:57:09,482] Trial 14 pruned. 
[I 2026-03-18 17:57:11,567] Trial 21 pruned. 
[I 2026-03-18 17:57:25,042] Trial 15 finished with value: -1.2634616929369802 and parameters: {'n_layers_yyx': 2, 'hidden_size_yyx_l0': 2, 'hidden_size_yyx_l1': 6, 'context_size_yyx': 4, 'num_mix_components_yyx': 4, 'context_extractor_yyx': 'lstm', 'activation_func_yyx': 'ReLU', 'L2_weight_yyx': 7.027866213561944e-06, 'L_entropy_weight_yyx': 4.185145986922015e-05, 'L_sep_weight_yyx': 1.4199986497074732e-09, 'L_scale_weight_yyx': 9.30096431102895e-06, 'learning_rate_yyx': 0.009881034209812085}. Best is trial 3 with value: -1.265314140954432.
[I 2026-03-18 17:57:33,432] Trial 17 pruned. 
[I 2026-03-18 17:57:47,629] Trial 19 pruned. 
[I 2026-03-18 17:57:48,751] Trial 20 finished with value: -3.160948786990499 and parameters: {'n_layers_yyx': 2, 'hidden_size_yyx_l0': 4, 'hidden_size_yyx_l1': 4, 'context_size_yyx': 4, 'num_mix_components_yyx': 4, 'context_extractor_yyx': 'gru', 'activation_func_yyx': 'Tanh', 'L2_weight_yyx': 2.481904065070855e-06, 'L_entropy_weight_yyx': 0.00086210952287102, 'L_sep_weight_yyx': 7.251511316803179e-09, 'L_scale_weight_yyx': 1.784434525926139e-07, 'learning_rate_yyx': 0.008196123263665743}. Best is trial 20 with value: -3.160948786990499.
[I 2026-03-18 17:57:50,562] Trial 10 finished with value: -3.1505735289185597 and parameters: {'n_layers_yyx': 2, 'hidden_size_yyx_l0': 2, 'hidden_size_yyx_l1': 5, 'context_size_yyx': 4, 'num_mix_components_yyx': 1, 'context_extractor_yyx': 'lstm', 'activation_func_yyx': 'ReLU', 'L2_weight_yyx': 1.735360609639844e-10, 'L_entropy_weight_yyx': 2.248298834146834e-07, 'L_sep_weight_yyx': 3.682958075205551e-08, 'L_scale_weight_yyx': 6.998244223070112e-08, 'learning_rate_yyx': 0.00848634042941309}. Best is trial 1 with value: -3.152505646630136.
[I 2026-03-18 17:58:15,359] Trial 16 pruned. 
[I 2026-03-18 17:58:27,780] Trial 23 pruned. 
[I 2026-03-18 17:58:45,304] Trial 22 pruned. 
[I 2026-03-18 17:58:45,413] Trial 22 pruned. 
[I 2026-03-18 17:58:47,068] Trial 20 pruned. 
[I 2026-03-18 17:59:01,659] Trial 12 finished with value: -3.1682013088461884 and parameters: {'n_layers_yyx': 2, 'hidden_size_yyx_l0': 4, 'hidden_size_yyx_l1': 6, 'context_size_yyx': 4, 'num_mix_components_yyx': 5, 'context_extractor_yyx': 'gru', 'activation_func_yyx': 'Tanh', 'L2_weight_yyx': 9.421995457125827e-07, 'L_entropy_weight_yyx': 2.39970754781082e-06, 'L_sep_weight_yyx': 1.1425135493095452e-08, 'L_scale_weight_yyx': 7.099485329719486e-09, 'learning_rate_yyx': 0.009143057541943727}. Best is trial 12 with value: -3.1682013088461884.
[I 2026-03-18 17:59:04,423] Trial 19 finished with value: -3.1199013011188725 and parameters: {'n_layers_yyx': 2, 'hidden_size_yyx_l0': 6, 'hidden_size_yyx_l1': 5, 'context_size_yyx': 3, 'num_mix_components_yyx': 3, 'context_extractor_yyx': 'lstm', 'activation_func_yyx': 'ReLU', 'L2_weight_yyx': 0.0005826215152801459, 'L_entropy_weight_yyx': 1.4079722856530536e-08, 'L_sep_weight_yyx': 2.591505772491316e-06, 'L_scale_weight_yyx': 3.041986154674194e-08, 'learning_rate_yyx': 0.0017233107527447745}. Best is trial 0 with value: -3.1460828145824977.
[I 2026-03-18 17:59:25,367] Trial 12 finished with value: -3.148122425535149 and parameters: {'n_layers_yyx': 1, 'hidden_size_yyx_l0': 5, 'context_size_yyx': 3, 'num_mix_components_yyx': 3, 'context_extractor_yyx': 'gru', 'activation_func_yyx': 'ReLU', 'L2_weight_yyx': 2.470299569250178e-05, 'L_entropy_weight_yyx': 6.1664889938256635e-06, 'L_sep_weight_yyx': 0.0009014156577717234, 'L_scale_weight_yyx': 1.6723269284651182e-06, 'learning_rate_yyx': 0.0014243627951946744}. Best is trial 2 with value: -3.1501405578480686.
[I 2026-03-18 17:59:27,002] Trial 13 finished with value: -1.260969334741617 and parameters: {'n_layers_yyx': 1, 'hidden_size_yyx_l0': 2, 'context_size_yyx': 4, 'num_mix_components_yyx': 4, 'context_extractor_yyx': 'gru', 'activation_func_yyx': 'ReLU', 'L2_weight_yyx': 3.5315408341804414e-06, 'L_entropy_weight_yyx': 8.793687830053158e-06, 'L_sep_weight_yyx': 1.0346236186580631e-10, 'L_scale_weight_yyx': 8.51790960978893e-06, 'learning_rate_yyx': 0.009515604668333918}. Best is trial 8 with value: -1.265112378019943.
[I 2026-03-18 17:59:28,621] Trial 14 pruned. 
[I 2026-03-18 17:59:40,881] Trial 17 pruned. 
[I 2026-03-18 17:59:43,276] Trial 21 pruned. 
[I 2026-03-18 17:59:44,452] Trial 22 pruned. 
[I 2026-03-18 17:59:44,809] Trial 14 finished with value: -1.2735925386737845 and parameters: {'n_layers_yyx': 2, 'hidden_size_yyx_l0': 4, 'hidden_size_yyx_l1': 5, 'context_size_yyx': 4, 'num_mix_components_yyx': 4, 'context_extractor_yyx': 'lstm', 'activation_func_yyx': 'Tanh', 'L2_weight_yyx': 6.659404296621831e-06, 'L_entropy_weight_yyx': 1.3897500933349282e-06, 'L_sep_weight_yyx': 7.100393411896982e-08, 'L_scale_weight_yyx': 3.196028511659947e-06, 'learning_rate_yyx': 0.002370656126840018}. Best is trial 2 with value: -1.2804754530695341.
[I 2026-03-18 17:59:45,122] Trial 12 finished with value: -1.265672976340472 and parameters: {'n_layers_yyx': 2, 'hidden_size_yyx_l0': 5, 'hidden_size_yyx_l1': 4, 'context_size_yyx': 2, 'num_mix_components_yyx': 3, 'context_extractor_yyx': 'gru', 'activation_func_yyx': 'GELU', 'L2_weight_yyx': 4.717886884196428e-09, 'L_entropy_weight_yyx': 1.7683559901707358e-10, 'L_sep_weight_yyx': 5.836451187674341e-07, 'L_scale_weight_yyx': 2.5761857040040994e-07, 'learning_rate_yyx': 0.009140775939341223}. Best is trial 11 with value: -1.2697828860467992.
[I 2026-03-18 17:59:47,018] Trial 21 pruned. 
[I 2026-03-18 17:59:50,143] Trial 25 pruned. 
[I 2026-03-18 18:00:01,518] Trial 15 pruned. 
[I 2026-03-18 18:00:10,604] Trial 15 pruned. 
[I 2026-03-18 18:00:15,637] Trial 14 pruned. 
[I 2026-03-18 18:00:24,890] Trial 18 pruned. 
[I 2026-03-18 18:00:32,028] Trial 13 pruned. 
[I 2026-03-18 18:00:39,037] Trial 23 pruned. 
[I 2026-03-18 18:00:41,715] Trial 22 pruned. 
[I 2026-03-18 18:00:47,258] Trial 16 pruned. 
[I 2026-03-18 18:00:59,366] Trial 12 pruned. 
[I 2026-03-18 18:01:02,247] Trial 18 pruned. 
[I 2026-03-18 18:01:02,455] Trial 15 pruned. 
[I 2026-03-18 18:01:03,269] Trial 13 finished with value: -3.1559077725337215 and parameters: {'n_layers_yyx': 1, 'hidden_size_yyx_l0': 3, 'context_size_yyx': 3, 'num_mix_components_yyx': 5, 'context_extractor_yyx': 'lstm', 'activation_func_yyx': 'ReLU', 'L2_weight_yyx': 1.7734081192464276e-09, 'L_entropy_weight_yyx': 2.751592711771016e-05, 'L_sep_weight_yyx': 4.882238991197957e-07, 'L_scale_weight_yyx': 2.99745160516223e-09, 'learning_rate_yyx': 0.004481809799848413}. Best is trial 13 with value: -3.1559077725337215.
[I 2026-03-18 18:01:10,801] Trial 19 pruned. 
[I 2026-03-18 18:01:13,277] Trial 23 pruned. 
[I 2026-03-18 18:01:21,894] Trial 14 pruned. 
[I 2026-03-18 18:01:23,540] Trial 13 pruned. 
[I 2026-03-18 18:01:29,493] Trial 11 finished with value: -3.118955771714187 and parameters: {'n_layers_yyx': 2, 'hidden_size_yyx_l0': 4, 'hidden_size_yyx_l1': 6, 'context_size_yyx': 3, 'num_mix_components_yyx': 2, 'context_extractor_yyx': 'lstm', 'activation_func_yyx': 'ReLU', 'L2_weight_yyx': 7.656117632346078e-06, 'L_entropy_weight_yyx': 1.2201808988137953e-08, 'L_sep_weight_yyx': 1.6119970158407443e-05, 'L_scale_weight_yyx': 1.055553910023719e-05, 'learning_rate_yyx': 0.0014995584334883672}. Best is trial 5 with value: -3.154335707688014.
[I 2026-03-18 18:01:38,997] Trial 14 finished with value: -3.154845118986846 and parameters: {'n_layers_yyx': 2, 'hidden_size_yyx_l0': 6, 'hidden_size_yyx_l1': 4, 'context_size_yyx': 2, 'num_mix_components_yyx': 5, 'context_extractor_yyx': 'lstm', 'activation_func_yyx': 'Tanh', 'L2_weight_yyx': 5.134528233024791e-05, 'L_entropy_weight_yyx': 1.4599294761027313e-06, 'L_sep_weight_yyx': 6.4588862640262405e-06, 'L_scale_weight_yyx': 5.272068348836931e-07, 'learning_rate_yyx': 0.006809419698372079}. Best is trial 10 with value: -3.1611070918248854.
[I 2026-03-18 18:01:47,705] Trial 17 finished with value: -1.2434122505117475 and parameters: {'n_layers_yyx': 1, 'hidden_size_yyx_l0': 2, 'context_size_yyx': 3, 'num_mix_components_yyx': 3, 'context_extractor_yyx': 'lstm', 'activation_func_yyx': 'ReLU', 'L2_weight_yyx': 6.607644836949687e-08, 'L_entropy_weight_yyx': 2.914324437245515e-06, 'L_sep_weight_yyx': 0.0007499887081722186, 'L_scale_weight_yyx': 1.614800472556302e-07, 'learning_rate_yyx': 0.0014447281496671577}. Best is trial 0 with value: -1.2691870881537193.
[I 2026-03-18 18:01:48,509] Trial 23 pruned. 
[I 2026-03-18 18:01:53,423] Trial 16 pruned. 
[I 2026-03-18 18:01:59,781] Trial 23 finished with value: -1.2567633877399889 and parameters: {'n_layers_yyx': 2, 'hidden_size_yyx_l0': 4, 'hidden_size_yyx_l1': 5, 'context_size_yyx': 4, 'num_mix_components_yyx': 5, 'context_extractor_yyx': 'lstm', 'activation_func_yyx': 'Tanh', 'L2_weight_yyx': 4.916445736970368e-06, 'L_entropy_weight_yyx': 5.065550274147438e-09, 'L_sep_weight_yyx': 0.0008084297819413613, 'L_scale_weight_yyx': 1.0803639840967364e-10, 'learning_rate_yyx': 0.009971696995411809}. Best is trial 18 with value: -1.2691942310156972.
[I 2026-03-18 18:02:02,006] Trial 13 pruned. 
[I 2026-03-18 18:02:02,214] Trial 14 pruned. 
[I 2026-03-18 18:02:03,030] Trial 24 pruned. 
[I 2026-03-18 18:02:10,843] Trial 16 pruned. 
[I 2026-03-18 18:02:10,845] Trial 16 pruned. 
[I 2026-03-18 18:02:17,932] Trial 15 pruned. 
[I 2026-03-18 18:02:24,283] Trial 17 pruned. 
[I 2026-03-18 18:02:32,179] Trial 14 pruned. 
[I 2026-03-18 18:02:34,056] Trial 12 pruned. 
[I 2026-03-18 18:02:41,445] Trial 22 finished with value: -3.1167485190468573 and parameters: {'n_layers_yyx': 2, 'hidden_size_yyx_l0': 5, 'hidden_size_yyx_l1': 4, 'context_size_yyx': 4, 'num_mix_components_yyx': 3, 'context_extractor_yyx': 'gru', 'activation_func_yyx': 'Tanh', 'L2_weight_yyx': 8.825044319073838e-07, 'L_entropy_weight_yyx': 0.0002793771898222409, 'L_sep_weight_yyx': 1.1239184924807296e-07, 'L_scale_weight_yyx': 5.223793027911588e-09, 'learning_rate_yyx': 0.007580528999497584}. Best is trial 20 with value: -3.160948786990499.
[I 2026-03-18 18:02:42,617] Trial 19 pruned. 
[I 2026-03-18 18:02:43,813] Trial 11 finished with value: -3.166113532127813 and parameters: {'n_layers_yyx': 1, 'hidden_size_yyx_l0': 5, 'context_size_yyx': 3, 'num_mix_components_yyx': 4, 'context_extractor_yyx': 'gru', 'activation_func_yyx': 'ReLU', 'L2_weight_yyx': 0.0001368254801806435, 'L_entropy_weight_yyx': 6.662505832553522e-09, 'L_sep_weight_yyx': 0.0006328550448226481, 'L_scale_weight_yyx': 1.0849004167946374e-10, 'learning_rate_yyx': 0.003122856075510151}. Best is trial 1 with value: -3.166268711244678.
[I 2026-03-18 18:02:54,048] Trial 11 finished with value: -3.1506541307240608 and parameters: {'n_layers_yyx': 2, 'hidden_size_yyx_l0': 5, 'hidden_size_yyx_l1': 2, 'context_size_yyx': 2, 'num_mix_components_yyx': 5, 'context_extractor_yyx': 'lstm', 'activation_func_yyx': 'Tanh', 'L2_weight_yyx': 1.9586776840564254e-10, 'L_entropy_weight_yyx': 1.962527616314127e-06, 'L_sep_weight_yyx': 1.0027550171698487e-10, 'L_scale_weight_yyx': 0.0003959767952417881, 'learning_rate_yyx': 0.009948125486938651}. Best is trial 10 with value: -3.1515199681211117.
[I 2026-03-18 18:02:57,308] Trial 11 finished with value: -3.119930540506475 and parameters: {'n_layers_yyx': 2, 'hidden_size_yyx_l0': 3, 'hidden_size_yyx_l1': 6, 'context_size_yyx': 4, 'num_mix_components_yyx': 2, 'context_extractor_yyx': 'lstm', 'activation_func_yyx': 'ReLU', 'L2_weight_yyx': 4.3396042858186236e-09, 'L_entropy_weight_yyx': 5.115044752979265e-07, 'L_sep_weight_yyx': 4.164755947422112e-08, 'L_scale_weight_yyx': 2.7192339112574705e-06, 'learning_rate_yyx': 0.0036427943683266318}. Best is trial 1 with value: -3.152505646630136.
[I 2026-03-18 18:03:05,924] Trial 16 pruned. 
[I 2026-03-18 18:03:13,984] Trial 15 pruned. 
[I 2026-03-18 18:03:14,965] Trial 14 pruned. 
[I 2026-03-18 18:03:27,866] Trial 17 pruned. 
[I 2026-03-18 18:03:31,933] Trial 13 pruned. 
[I 2026-03-18 18:03:32,907] Trial 24 pruned. 
[I 2026-03-18 18:03:37,360] Trial 12 pruned. 
[I 2026-03-18 18:03:40,471] Trial 12 finished with value: -1.263812200860043 and parameters: {'n_layers_yyx': 1, 'hidden_size_yyx_l0': 3, 'context_size_yyx': 2, 'num_mix_components_yyx': 5, 'context_extractor_yyx': 'lstm', 'activation_func_yyx': 'ReLU', 'L2_weight_yyx': 2.7235584593002164e-08, 'L_entropy_weight_yyx': 1.1042089123580776e-10, 'L_sep_weight_yyx': 1.385153442208536e-06, 'L_scale_weight_yyx': 4.3722809690975196e-08, 'learning_rate_yyx': 0.008839220554447474}. Best is trial 12 with value: -1.263812200860043.
[I 2026-03-18 18:03:48,769] Trial 15 pruned. 
[I 2026-03-18 18:03:57,104] Trial 24 pruned. 
[I 2026-03-18 18:03:59,030] Trial 18 pruned. 
[I 2026-03-18 18:04:05,264] Trial 16 pruned. 
[I 2026-03-18 18:04:07,115] Trial 20 pruned. 
[I 2026-03-18 18:04:16,859] Trial 18 pruned. 
[I 2026-03-18 18:04:17,132] Trial 13 pruned. 
[I 2026-03-18 18:04:29,538] Trial 15 finished with value: -0.5520358918621583 and parameters: {'n_layers_yyx': 1, 'hidden_size_yyx_l0': 5, 'context_size_yyx': 3, 'num_mix_components_yyx': 1, 'context_extractor_yyx': 'lstm', 'activation_func_yyx': 'Tanh', 'L2_weight_yyx': 1.0629916153709382e-05, 'L_entropy_weight_yyx': 0.0008594729773758464, 'L_sep_weight_yyx': 0.0007460263783253615, 'L_scale_weight_yyx': 1.0193785088851605e-09, 'learning_rate_yyx': 0.00898185481156376}. Best is trial 3 with value: -0.584032942865049.
[I 2026-03-18 18:04:33,387] Trial 15 finished with value: -0.5635592160231474 and parameters: {'n_layers_yyx': 1, 'hidden_size_yyx_l0': 3, 'context_size_yyx': 3, 'num_mix_components_yyx': 4, 'context_extractor_yyx': 'gru', 'activation_func_yyx': 'ReLU', 'L2_weight_yyx': 2.0102968874800355e-06, 'L_entropy_weight_yyx': 2.436734971264762e-05, 'L_sep_weight_yyx': 5.121223004594917e-10, 'L_scale_weight_yyx': 3.6778614232819628e-06, 'learning_rate_yyx': 0.004206927513249306}. Best is trial 4 with value: -0.5804501078315746.
[I 2026-03-18 18:04:38,682] Trial 25 pruned. 
[I 2026-03-18 18:04:39,549] Trial 17 pruned. 
[I 2026-03-18 18:04:44,883] Trial 19 pruned. 
[I 2026-03-18 18:04:47,394] Trial 20 pruned. 
[I 2026-03-18 18:04:53,933] Trial 17 pruned. 
[I 2026-03-18 18:05:02,039] Trial 26 finished with value: -0.5729655983359483 and parameters: {'n_layers_yyx': 2, 'hidden_size_yyx_l0': 5, 'hidden_size_yyx_l1': 4, 'context_size_yyx': 4, 'num_mix_components_yyx': 2, 'context_extractor_yyx': 'gru', 'activation_func_yyx': 'Tanh', 'L2_weight_yyx': 4.21920665473527e-06, 'L_entropy_weight_yyx': 3.3205420071016976e-10, 'L_sep_weight_yyx': 3.7177078424177966e-05, 'L_scale_weight_yyx': 5.028169070622131e-06, 'learning_rate_yyx': 0.00839261682851103}. Best is trial 12 with value: -0.5830094706077523.
[I 2026-03-18 18:05:06,135] Trial 12 pruned. 
[I 2026-03-18 18:05:20,467] Trial 16 pruned. 
[I 2026-03-18 18:05:21,381] Trial 15 pruned. 
[I 2026-03-18 18:05:36,481] Trial 20 finished with value: -3.108388508776715 and parameters: {'n_layers_yyx': 1, 'hidden_size_yyx_l0': 5, 'context_size_yyx': 1, 'num_mix_components_yyx': 2, 'context_extractor_yyx': 'lstm', 'activation_func_yyx': 'GELU', 'L2_weight_yyx': 2.7235945489230516e-08, 'L_entropy_weight_yyx': 3.426954842913024e-07, 'L_sep_weight_yyx': 4.815574885572547e-10, 'L_scale_weight_yyx': 1.7905849741066896e-09, 'learning_rate_yyx': 0.0032321850150309863}. Best is trial 0 with value: -3.1460828145824977.
[I 2026-03-18 18:05:37,450] Trial 21 pruned. 
[I 2026-03-18 18:05:37,628] Trial 20 pruned. 
[I 2026-03-18 18:05:37,738] Trial 25 pruned. 
[I 2026-03-18 18:05:39,904] Trial 29 finished with value: -1.23659924350252 and parameters: {'n_layers_yyx': 1, 'hidden_size_yyx_l0': 6, 'context_size_yyx': 3, 'num_mix_components_yyx': 5, 'context_extractor_yyx': 'lstm', 'activation_func_yyx': 'GELU', 'L2_weight_yyx': 4.157340974730742e-05, 'L_entropy_weight_yyx': 2.1647781711221867e-07, 'L_sep_weight_yyx': 1.3791337020148964e-08, 'L_scale_weight_yyx': 0.0002642601569625418, 'learning_rate_yyx': 0.0015692382736627337}. Best is trial 26 with value: -1.2726356097378264.
[I 2026-03-18 18:05:46,719] Trial 19 pruned. 
[I 2026-03-18 18:06:01,552] Trial 16 pruned. 
[I 2026-03-18 18:06:08,294] Trial 17 pruned. 
[I 2026-03-18 18:06:08,518] Trial 25 pruned. 
[I 2026-03-18 18:06:22,216] Trial 30 pruned. 
[I 2026-03-18 18:06:22,951] Trial 26 pruned. 
[I 2026-03-18 18:06:26,775] Trial 14 pruned. 
[I 2026-03-18 18:06:31,044] Trial 27 pruned. 
[I 2026-03-18 18:06:32,141] Trial 20 pruned. 
[I 2026-03-18 18:06:36,075] Trial 24 finished with value: -3.122225322786397 and parameters: {'n_layers_yyx': 2, 'hidden_size_yyx_l0': 2, 'hidden_size_yyx_l1': 5, 'context_size_yyx': 3, 'num_mix_components_yyx': 2, 'context_extractor_yyx': 'lstm', 'activation_func_yyx': 'GELU', 'L2_weight_yyx': 1.0066038394080271e-07, 'L_entropy_weight_yyx': 0.00013246383292652567, 'L_sep_weight_yyx': 3.221628852974129e-07, 'L_scale_weight_yyx': 1.1404447353511197e-07, 'learning_rate_yyx': 0.009952561424872046}. Best is trial 16 with value: -3.149974272486285.
[I 2026-03-18 18:06:59,129] Trial 27 pruned. 
[I 2026-03-18 18:07:09,116] Trial 13 pruned. 
[I 2026-03-18 18:07:11,166] Trial 12 finished with value: -3.146771382471224 and parameters: {'n_layers_yyx': 2, 'hidden_size_yyx_l0': 3, 'hidden_size_yyx_l1': 5, 'context_size_yyx': 4, 'num_mix_components_yyx': 4, 'context_extractor_yyx': 'lstm', 'activation_func_yyx': 'ReLU', 'L2_weight_yyx': 5.171938931084095e-05, 'L_entropy_weight_yyx': 4.8955372778867e-07, 'L_sep_weight_yyx': 2.965986512868175e-08, 'L_scale_weight_yyx': 0.0005035651624781863, 'learning_rate_yyx': 0.006925238770294773}. Best is trial 1 with value: -3.152505646630136.
[I 2026-03-18 18:07:12,190] Trial 17 finished with value: -3.159344773417026 and parameters: {'n_layers_yyx': 2, 'hidden_size_yyx_l0': 5, 'hidden_size_yyx_l1': 3, 'context_size_yyx': 4, 'num_mix_components_yyx': 3, 'context_extractor_yyx': 'gru', 'activation_func_yyx': 'ReLU', 'L2_weight_yyx': 1.1027692335236577e-07, 'L_entropy_weight_yyx': 6.128213961518987e-07, 'L_sep_weight_yyx': 5.0179673007147113e-08, 'L_scale_weight_yyx': 1.1135395333471952e-10, 'learning_rate_yyx': 0.009711718054205783}. Best is trial 12 with value: -3.1893335216865584.
[I 2026-03-18 18:07:16,099] Trial 14 finished with value: -3.121154813927418 and parameters: {'n_layers_yyx': 2, 'hidden_size_yyx_l0': 3, 'hidden_size_yyx_l1': 6, 'context_size_yyx': 4, 'num_mix_components_yyx': 2, 'context_extractor_yyx': 'lstm', 'activation_func_yyx': 'GELU', 'L2_weight_yyx': 6.047489945922293e-08, 'L_entropy_weight_yyx': 3.43208557486719e-08, 'L_sep_weight_yyx': 3.9939178660493975e-06, 'L_scale_weight_yyx': 4.390308320744672e-08, 'learning_rate_yyx': 0.009736146760778455}. Best is trial 3 with value: -3.1501368402794143.
[I 2026-03-18 18:07:19,980] Trial 23 finished with value: -1.2524189693429775 and parameters: {'n_layers_yyx': 2, 'hidden_size_yyx_l0': 2, 'hidden_size_yyx_l1': 6, 'context_size_yyx': 1, 'num_mix_components_yyx': 3, 'context_extractor_yyx': 'gru', 'activation_func_yyx': 'Tanh', 'L2_weight_yyx': 4.41269966214076e-06, 'L_entropy_weight_yyx': 6.3582379435724025e-09, 'L_sep_weight_yyx': 7.500391360618587e-10, 'L_scale_weight_yyx': 3.4576426671970044e-09, 'learning_rate_yyx': 0.006901589075699199}. Best is trial 0 with value: -1.255221580181016.
[I 2026-03-18 18:07:22,887] Trial 18 pruned. 
[I 2026-03-18 18:07:25,538] Trial 23 finished with value: -3.1144623508677594 and parameters: {'n_layers_yyx': 2, 'hidden_size_yyx_l0': 3, 'hidden_size_yyx_l1': 3, 'context_size_yyx': 3, 'num_mix_components_yyx': 4, 'context_extractor_yyx': 'gru', 'activation_func_yyx': 'Tanh', 'L2_weight_yyx': 1.2426738023317246e-07, 'L_entropy_weight_yyx': 2.075301035694278e-07, 'L_sep_weight_yyx': 3.456935645902097e-10, 'L_scale_weight_yyx': 2.7341176146722857e-05, 'learning_rate_yyx': 0.004462953071913129}. Best is trial 20 with value: -3.160948786990499.
[I 2026-03-18 18:07:26,161] Trial 21 pruned. 
[I 2026-03-18 18:07:36,433] Trial 17 pruned. 
[I 2026-03-18 18:07:42,817] Trial 26 pruned. 
[I 2026-03-18 18:07:45,434] Trial 14 pruned. 
[I 2026-03-18 18:07:48,102] Trial 15 pruned. 
[I 2026-03-18 18:07:49,946] Trial 19 pruned. 
