[I 2026-03-18 21:05:31,897] Trial 17 pruned. 
[I 2026-03-18 21:05:32,483] Trial 17 pruned. 
[I 2026-03-18 21:05:38,400] Trial 17 finished with value: -1.8903958034379722 and parameters: {'n_layers_yyx': 2, 'hidden_size_yyx_l0': 3, 'hidden_size_yyx_l1': 2, 'context_size_yyx': 1, 'num_mix_components_yyx': 5, 'context_extractor_yyx': 'lstm', 'activation_func_yyx': 'ReLU', 'L2_weight_yyx': 9.666503348626753e-05, 'L_entropy_weight_yyx': 1.446278691586069e-06, 'L_sep_weight_yyx': 2.84798230241716e-08, 'L_scale_weight_yyx': 0.00018657452474169962, 'learning_rate_yyx': 0.0042042539527110765}. Best is trial 5 with value: -1.89157565728699.
[I 2026-03-18 21:05:39,497] Trial 18 pruned. 
[I 2026-03-18 21:05:41,209] Trial 20 pruned. 
[I 2026-03-18 21:05:42,357] Trial 25 pruned. 
[I 2026-03-18 21:05:48,552] Trial 18 finished with value: -1.4155259587214544 and parameters: {'n_layers_yyx': 2, 'hidden_size_yyx_l0': 2, 'hidden_size_yyx_l1': 5, 'context_size_yyx': 2, 'num_mix_components_yyx': 4, 'context_extractor_yyx': 'lstm', 'activation_func_yyx': 'GELU', 'L2_weight_yyx': 3.039559440384525e-09, 'L_entropy_weight_yyx': 0.00014533859280575022, 'L_sep_weight_yyx': 1.7113185446612314e-08, 'L_scale_weight_yyx': 2.047680383969448e-05, 'learning_rate_yyx': 0.006877698217042266}. Best is trial 13 with value: -1.4421805044320914.
[I 2026-03-18 21:05:54,042] Trial 18 pruned. 
[I 2026-03-18 21:05:59,064] Trial 27 pruned. 
[I 2026-03-18 21:06:00,966] Trial 19 pruned. 
[I 2026-03-18 21:06:01,715] Trial 23 finished with value: -1.347415748009315 and parameters: {'n_layers_yyx': 2, 'hidden_size_yyx_l0': 5, 'hidden_size_yyx_l1': 6, 'context_size_yyx': 4, 'num_mix_components_yyx': 1, 'context_extractor_yyx': 'gru', 'activation_func_yyx': 'GELU', 'L2_weight_yyx': 7.686814296387914e-09, 'L_entropy_weight_yyx': 5.323412261169101e-07, 'L_sep_weight_yyx': 1.673421669442945e-08, 'L_scale_weight_yyx': 1.948162210478516e-08, 'learning_rate_yyx': 0.006901717155269119}. Best is trial 1 with value: -1.4389243727463943.
[I 2026-03-18 21:06:16,535] Trial 12 finished with value: -1.779120058001894 and parameters: {'n_layers_yyx': 2, 'hidden_size_yyx_l0': 6, 'hidden_size_yyx_l1': 5, 'context_size_yyx': 4, 'num_mix_components_yyx': 3, 'context_extractor_yyx': 'gru', 'activation_func_yyx': 'GELU', 'L2_weight_yyx': 1.3048377640947113e-08, 'L_entropy_weight_yyx': 1.1873929146907365e-06, 'L_sep_weight_yyx': 1.4308176795462062e-06, 'L_scale_weight_yyx': 6.6157806803759645e-06, 'learning_rate_yyx': 0.00929525602499733}. Best is trial 7 with value: -1.7817573439472854.
[I 2026-03-18 21:06:19,184] Trial 14 pruned. 
[I 2026-03-18 21:06:21,556] Trial 24 pruned. 
[I 2026-03-18 21:06:24,093] Trial 21 pruned. 
[I 2026-03-18 21:06:35,673] Trial 19 pruned. 
[I 2026-03-18 21:06:35,680] Trial 26 finished with value: -1.4555079064002403 and parameters: {'n_layers_yyx': 1, 'hidden_size_yyx_l0': 4, 'context_size_yyx': 4, 'num_mix_components_yyx': 5, 'context_extractor_yyx': 'gru', 'activation_func_yyx': 'Tanh', 'L2_weight_yyx': 1.9713760395302654e-07, 'L_entropy_weight_yyx': 1.2080548034513057e-05, 'L_sep_weight_yyx': 3.314184523135511e-08, 'L_scale_weight_yyx': 6.816059995810504e-06, 'learning_rate_yyx': 0.007183867471166355}. Best is trial 26 with value: -1.4555079064002403.
[I 2026-03-18 21:06:41,524] Trial 25 pruned. 
[I 2026-03-18 21:06:41,702] Trial 15 pruned. 
[I 2026-03-18 21:06:41,702] Trial 20 pruned. 
[I 2026-03-18 21:06:43,642] Trial 19 finished with value: -1.859626754158004 and parameters: {'n_layers_yyx': 2, 'hidden_size_yyx_l0': 5, 'hidden_size_yyx_l1': 5, 'context_size_yyx': 4, 'num_mix_components_yyx': 2, 'context_extractor_yyx': 'lstm', 'activation_func_yyx': 'Tanh', 'L2_weight_yyx': 6.596852813678142e-05, 'L_entropy_weight_yyx': 4.328523932465701e-09, 'L_sep_weight_yyx': 2.214175041448276e-08, 'L_scale_weight_yyx': 1.0339199480105637e-06, 'learning_rate_yyx': 0.006464867303992798}. Best is trial 11 with value: -1.8610449438696508.
[I 2026-03-18 21:06:44,556] Trial 19 pruned. 
[I 2026-03-18 21:06:45,724] Trial 28 finished with value: -1.794672322263139 and parameters: {'n_layers_yyx': 2, 'hidden_size_yyx_l0': 6, 'hidden_size_yyx_l1': 5, 'context_size_yyx': 4, 'num_mix_components_yyx': 3, 'context_extractor_yyx': 'gru', 'activation_func_yyx': 'ReLU', 'L2_weight_yyx': 6.503831774652803e-09, 'L_entropy_weight_yyx': 6.779673012620341e-06, 'L_sep_weight_yyx': 5.853134101539795e-06, 'L_scale_weight_yyx': 6.660004733540619e-07, 'learning_rate_yyx': 0.009782842141718514}. Best is trial 27 with value: -1.8062570642302185.
[I 2026-03-18 21:06:45,904] Trial 22 pruned. 
[I 2026-03-18 21:06:47,945] Trial 24 finished with value: -1.4451058725210337 and parameters: {'n_layers_yyx': 2, 'hidden_size_yyx_l0': 6, 'hidden_size_yyx_l1': 5, 'context_size_yyx': 3, 'num_mix_components_yyx': 4, 'context_extractor_yyx': 'lstm', 'activation_func_yyx': 'Tanh', 'L2_weight_yyx': 8.596419827346238e-07, 'L_entropy_weight_yyx': 1.4762314980787148e-08, 'L_sep_weight_yyx': 0.00022443617762775853, 'L_scale_weight_yyx': 8.020001521708629e-08, 'learning_rate_yyx': 0.007685755921224613}. Best is trial 10 with value: -1.4553572904146634.
[I 2026-03-18 21:06:59,442] Trial 26 pruned. 
[I 2026-03-18 21:07:03,418] Trial 24 finished with value: -1.4518791534615763 and parameters: {'n_layers_yyx': 1, 'hidden_size_yyx_l0': 4, 'context_size_yyx': 4, 'num_mix_components_yyx': 3, 'context_extractor_yyx': 'gru', 'activation_func_yyx': 'Tanh', 'L2_weight_yyx': 1.3353357890721314e-07, 'L_entropy_weight_yyx': 4.219590946351401e-06, 'L_sep_weight_yyx': 2.7920321756381407e-06, 'L_scale_weight_yyx': 8.785706413909686e-08, 'learning_rate_yyx': 0.0060615708228167605}. Best is trial 24 with value: -1.4518791534615763.
[I 2026-03-18 21:07:08,288] Trial 25 pruned. 
[I 2026-03-18 21:07:14,759] Trial 19 pruned. 
[I 2026-03-18 21:07:14,950] Trial 20 pruned. 
[I 2026-03-18 21:07:18,286] Trial 20 pruned. 
[I 2026-03-18 21:07:18,463] Trial 18 pruned. 
[I 2026-03-18 21:07:22,741] Trial 21 pruned. 
[I 2026-03-18 21:07:24,213] Trial 9 finished with value: -1.3204298753004808 and parameters: {'n_layers_yyx': 2, 'hidden_size_yyx_l0': 5, 'hidden_size_yyx_l1': 6, 'context_size_yyx': 3, 'num_mix_components_yyx': 1, 'context_extractor_yyx': 'gru', 'activation_func_yyx': 'ReLU', 'L2_weight_yyx': 2.401140982554976e-10, 'L_entropy_weight_yyx': 1.9517902537224034e-07, 'L_sep_weight_yyx': 2.696322307306097e-07, 'L_scale_weight_yyx': 5.041839499213881e-10, 'learning_rate_yyx': 0.0028201818510750635}. Best is trial 7 with value: -1.4535823880709136.
[I 2026-03-18 21:07:24,820] Trial 22 pruned. 
[I 2026-03-18 21:07:25,331] Trial 29 pruned. 
[I 2026-03-18 21:07:25,593] Trial 20 pruned. 
[I 2026-03-18 21:07:25,596] Trial 20 finished with value: -1.7865039802320075 and parameters: {'n_layers_yyx': 2, 'hidden_size_yyx_l0': 2, 'hidden_size_yyx_l1': 5, 'context_size_yyx': 4, 'num_mix_components_yyx': 2, 'context_extractor_yyx': 'gru', 'activation_func_yyx': 'Tanh', 'L2_weight_yyx': 5.822090268420519e-10, 'L_entropy_weight_yyx': 1.193705196679586e-06, 'L_sep_weight_yyx': 0.0006597173089247231, 'L_scale_weight_yyx': 2.6047694662515685e-07, 'learning_rate_yyx': 0.009831511962813426}. Best is trial 16 with value: -1.790272919625947.
[I 2026-03-18 21:07:26,671] Trial 12 finished with value: -2.4732728871279206 and parameters: {'n_layers_yyx': 2, 'hidden_size_yyx_l0': 2, 'hidden_size_yyx_l1': 6, 'context_size_yyx': 1, 'num_mix_components_yyx': 4, 'context_extractor_yyx': 'lstm', 'activation_func_yyx': 'Tanh', 'L2_weight_yyx': 1.989865763907743e-10, 'L_entropy_weight_yyx': 0.000850673606501156, 'L_sep_weight_yyx': 1.4801287301700522e-10, 'L_scale_weight_yyx': 0.0005696351324867941, 'learning_rate_yyx': 0.0034571020028417968}. Best is trial 12 with value: -2.4732728871279206.
[I 2026-03-18 21:07:27,569] Trial 27 finished with value: -1.4411741286057693 and parameters: {'n_layers_yyx': 2, 'hidden_size_yyx_l0': 4, 'hidden_size_yyx_l1': 5, 'context_size_yyx': 1, 'num_mix_components_yyx': 2, 'context_extractor_yyx': 'lstm', 'activation_func_yyx': 'ReLU', 'L2_weight_yyx': 1.8102011105780484e-08, 'L_entropy_weight_yyx': 5.30550091637724e-05, 'L_sep_weight_yyx': 5.195514893097815e-07, 'L_scale_weight_yyx': 1.7651441470302703e-09, 'learning_rate_yyx': 0.0064317973907498435}. Best is trial 19 with value: -1.4628589806189904.
[I 2026-03-18 21:07:28,825] Trial 23 pruned. 
[I 2026-03-18 21:07:33,313] Trial 15 finished with value: -1.8695785775072098 and parameters: {'n_layers_yyx': 1, 'hidden_size_yyx_l0': 5, 'context_size_yyx': 4, 'num_mix_components_yyx': 4, 'context_extractor_yyx': 'lstm', 'activation_func_yyx': 'ReLU', 'L2_weight_yyx': 1.681624948280058e-09, 'L_entropy_weight_yyx': 1.020287151532632e-05, 'L_sep_weight_yyx': 3.623831130109419e-05, 'L_scale_weight_yyx': 1.1654475985040013e-08, 'learning_rate_yyx': 0.009800664663175283}. Best is trial 15 with value: -1.8695785775072098.
[I 2026-03-18 21:07:40,187] Trial 28 pruned. 
[I 2026-03-18 21:07:42,025] Trial 21 finished with value: -1.4141503201998198 and parameters: {'n_layers_yyx': 1, 'hidden_size_yyx_l0': 6, 'context_size_yyx': 4, 'num_mix_components_yyx': 2, 'context_extractor_yyx': 'lstm', 'activation_func_yyx': 'Tanh', 'L2_weight_yyx': 0.0001082806803558554, 'L_entropy_weight_yyx': 0.0003236861028866095, 'L_sep_weight_yyx': 1.2305137216523175e-10, 'L_scale_weight_yyx': 2.6270767294085697e-06, 'learning_rate_yyx': 0.006297357900315718}. Best is trial 7 with value: -1.4538350266676683.
[I 2026-03-18 21:07:44,347] Trial 18 finished with value: -1.4371488600510818 and parameters: {'n_layers_yyx': 2, 'hidden_size_yyx_l0': 6, 'hidden_size_yyx_l1': 5, 'context_size_yyx': 2, 'num_mix_components_yyx': 3, 'context_extractor_yyx': 'lstm', 'activation_func_yyx': 'ReLU', 'L2_weight_yyx': 2.718547121642368e-06, 'L_entropy_weight_yyx': 6.361708765785353e-05, 'L_sep_weight_yyx': 2.6985185762103764e-06, 'L_scale_weight_yyx': 0.00010258245526534188, 'learning_rate_yyx': 0.009383292731284009}. Best is trial 13 with value: -1.4490255267803485.
[I 2026-03-18 21:07:49,042] Trial 28 pruned. 
[I 2026-03-18 21:07:52,307] Trial 24 pruned. 
[I 2026-03-18 21:07:54,704] Trial 13 pruned. 
[I 2026-03-18 21:07:54,911] Trial 16 finished with value: -2.486508458955472 and parameters: {'n_layers_yyx': 1, 'hidden_size_yyx_l0': 4, 'context_size_yyx': 1, 'num_mix_components_yyx': 4, 'context_extractor_yyx': 'gru', 'activation_func_yyx': 'Tanh', 'L2_weight_yyx': 1.2100714184546184e-06, 'L_entropy_weight_yyx': 4.289351257320714e-08, 'L_sep_weight_yyx': 8.201627507037797e-06, 'L_scale_weight_yyx': 4.717409846334656e-09, 'learning_rate_yyx': 0.001581526869022992}. Best is trial 4 with value: -2.49523174750643.
[I 2026-03-18 21:07:57,289] Trial 21 pruned. 
[I 2026-03-18 21:08:10,641] Trial 24 finished with value: -1.896696364742586 and parameters: {'n_layers_yyx': 2, 'hidden_size_yyx_l0': 4, 'hidden_size_yyx_l1': 5, 'context_size_yyx': 4, 'num_mix_components_yyx': 4, 'context_extractor_yyx': 'lstm', 'activation_func_yyx': 'ReLU', 'L2_weight_yyx': 1.500590123749613e-06, 'L_entropy_weight_yyx': 1.1461219945264224e-06, 'L_sep_weight_yyx': 2.966315279959134e-06, 'L_scale_weight_yyx': 4.751395960305108e-09, 'learning_rate_yyx': 0.008066512228716433}. Best is trial 24 with value: -1.896696364742586.
[I 2026-03-18 21:08:18,001] Trial 17 pruned. 
[I 2026-03-18 21:08:22,102] Trial 19 pruned. 
[I 2026-03-18 21:08:32,590] Trial 25 pruned. 
[I 2026-03-18 21:08:36,449] Trial 26 pruned. 
[I 2026-03-18 21:08:42,611] Trial 20 pruned. 
[I 2026-03-18 21:08:47,292] Trial 21 pruned. 
[I 2026-03-18 21:08:48,874] Trial 18 finished with value: -1.9380675214491772 and parameters: {'n_layers_yyx': 1, 'hidden_size_yyx_l0': 5, 'context_size_yyx': 4, 'num_mix_components_yyx': 2, 'context_extractor_yyx': 'gru', 'activation_func_yyx': 'ReLU', 'L2_weight_yyx': 1.9551129668892798e-10, 'L_entropy_weight_yyx': 4.314578046493396e-10, 'L_sep_weight_yyx': 0.0006774106795132552, 'L_scale_weight_yyx': 7.067821826419169e-05, 'learning_rate_yyx': 0.009790620311010712}. Best is trial 10 with value: -1.9395614910230956.
[I 2026-03-18 21:08:50,996] Trial 42 finished with value: -2.4748586099316627 and parameters: {'n_layers_yyx': 1, 'hidden_size_yyx_l0': 6, 'context_size_yyx': 2, 'num_mix_components_yyx': 5, 'context_extractor_yyx': 'gru', 'activation_func_yyx': 'ReLU', 'L2_weight_yyx': 1.477128367780892e-07, 'L_entropy_weight_yyx': 4.084091874348717e-09, 'L_sep_weight_yyx': 2.1351033750379884e-05, 'L_scale_weight_yyx': 0.00040614186971572424, 'learning_rate_yyx': 0.008878210283349763}. Best is trial 25 with value: -2.4764732316599813.
[I 2026-03-18 21:09:00,909] Trial 22 pruned. 
[I 2026-03-18 21:09:01,627] Trial 20 pruned. 
[I 2026-03-18 21:09:03,291] Trial 30 pruned. 
[I 2026-03-18 21:09:05,348] Trial 15 finished with value: -1.9301682781102245 and parameters: {'n_layers_yyx': 2, 'hidden_size_yyx_l0': 5, 'hidden_size_yyx_l1': 6, 'context_size_yyx': 2, 'num_mix_components_yyx': 4, 'context_extractor_yyx': 'gru', 'activation_func_yyx': 'GELU', 'L2_weight_yyx': 2.9304516896213145e-05, 'L_entropy_weight_yyx': 0.0005614028001815383, 'L_sep_weight_yyx': 7.074968806163881e-06, 'L_scale_weight_yyx': 1.0244744980557235e-08, 'learning_rate_yyx': 0.007544469581892143}. Best is trial 14 with value: -1.9337542258067992.
[I 2026-03-18 21:09:06,088] Trial 18 pruned. 
[I 2026-03-18 21:09:15,918] Trial 27 pruned. 
[I 2026-03-18 21:09:16,937] Trial 26 pruned. 
[I 2026-03-18 21:09:20,461] Trial 27 finished with value: -1.4666833965594952 and parameters: {'n_layers_yyx': 1, 'hidden_size_yyx_l0': 4, 'context_size_yyx': 4, 'num_mix_components_yyx': 5, 'context_extractor_yyx': 'lstm', 'activation_func_yyx': 'Tanh', 'L2_weight_yyx': 1.2635503805058642e-07, 'L_entropy_weight_yyx': 5.561534162847354e-08, 'L_sep_weight_yyx': 4.038677454762662e-08, 'L_scale_weight_yyx': 6.347062894374202e-06, 'learning_rate_yyx': 0.007529839362358873}. Best is trial 27 with value: -1.4666833965594952.
[I 2026-03-18 21:09:23,451] Trial 16 finished with value: -1.869386829511932 and parameters: {'n_layers_yyx': 1, 'hidden_size_yyx_l0': 6, 'context_size_yyx': 4, 'num_mix_components_yyx': 5, 'context_extractor_yyx': 'lstm', 'activation_func_yyx': 'ReLU', 'L2_weight_yyx': 2.3818568805008856e-09, 'L_entropy_weight_yyx': 4.905350926359548e-06, 'L_sep_weight_yyx': 6.460717464786129e-06, 'L_scale_weight_yyx': 6.6665971887324e-09, 'learning_rate_yyx': 0.009929668723584029}. Best is trial 15 with value: -1.8695785775072098.
[I 2026-03-18 21:09:25,342] Trial 31 pruned. 
[I 2026-03-18 21:09:26,890] Trial 22 pruned. 
[I 2026-03-18 21:09:28,233] Trial 25 finished with value: -1.3241790435599081 and parameters: {'n_layers_yyx': 1, 'hidden_size_yyx_l0': 4, 'context_size_yyx': 4, 'num_mix_components_yyx': 2, 'context_extractor_yyx': 'gru', 'activation_func_yyx': 'Tanh', 'L2_weight_yyx': 1.358772284052856e-06, 'L_entropy_weight_yyx': 2.928519093507835e-06, 'L_sep_weight_yyx': 4.580462606254837e-06, 'L_scale_weight_yyx': 6.372628955030438e-08, 'learning_rate_yyx': 0.006970244655409609}. Best is trial 24 with value: -1.4518791534615763.
[I 2026-03-18 21:09:30,588] Trial 19 pruned. 
[I 2026-03-18 21:09:31,459] Trial 19 pruned. 
[I 2026-03-18 21:09:34,777] Trial 26 finished with value: -1.8452544877811845 and parameters: {'n_layers_yyx': 2, 'hidden_size_yyx_l0': 3, 'hidden_size_yyx_l1': 6, 'context_size_yyx': 3, 'num_mix_components_yyx': 3, 'context_extractor_yyx': 'gru', 'activation_func_yyx': 'GELU', 'L2_weight_yyx': 2.020324261057052e-07, 'L_entropy_weight_yyx': 1.6718250559991698e-05, 'L_sep_weight_yyx': 0.0009438898852875164, 'L_scale_weight_yyx': 0.0006916238874363952, 'learning_rate_yyx': 0.007548569585427139}. Best is trial 16 with value: -1.8488733665890609.
[I 2026-03-18 21:09:35,229] Trial 14 pruned. 
[I 2026-03-18 21:09:37,369] Trial 25 pruned. 
[I 2026-03-18 21:09:41,371] Trial 24 finished with value: -1.8519287109375 and parameters: {'n_layers_yyx': 2, 'hidden_size_yyx_l0': 4, 'hidden_size_yyx_l1': 3, 'context_size_yyx': 2, 'num_mix_components_yyx': 5, 'context_extractor_yyx': 'lstm', 'activation_func_yyx': 'Tanh', 'L2_weight_yyx': 5.085256940645272e-05, 'L_entropy_weight_yyx': 5.693652752192465e-08, 'L_sep_weight_yyx': 4.10787091796717e-09, 'L_scale_weight_yyx': 1.5287393232800426e-07, 'learning_rate_yyx': 0.00853962694437021}. Best is trial 9 with value: -1.8570869006965198.
[I 2026-03-18 21:09:42,565] Trial 32 finished with value: -1.5064781063892803 and parameters: {'n_layers_yyx': 2, 'hidden_size_yyx_l0': 5, 'hidden_size_yyx_l1': 2, 'context_size_yyx': 2, 'num_mix_components_yyx': 2, 'context_extractor_yyx': 'lstm', 'activation_func_yyx': 'Tanh', 'L2_weight_yyx': 0.00020216852398509709, 'L_entropy_weight_yyx': 8.103525863976518e-06, 'L_sep_weight_yyx': 3.6195987866720634e-08, 'L_scale_weight_yyx': 6.548376939440467e-06, 'learning_rate_yyx': 0.008567875114123774}. Best is trial 0 with value: -1.5190498727266906.
[I 2026-03-18 21:09:44,840] Trial 23 pruned. 
[I 2026-03-18 21:09:46,991] Trial 32 pruned. 
[I 2026-03-18 21:09:47,823] Trial 23 pruned. 
[I 2026-03-18 21:09:54,178] Trial 28 pruned. 
[I 2026-03-18 21:09:58,257] Trial 27 pruned. 
[I 2026-03-18 21:09:58,402] Trial 15 pruned. 
[I 2026-03-18 21:10:01,869] Trial 26 pruned. 
[I 2026-03-18 21:10:04,509] Trial 22 finished with value: -1.4182231727013221 and parameters: {'n_layers_yyx': 1, 'hidden_size_yyx_l0': 6, 'context_size_yyx': 4, 'num_mix_components_yyx': 3, 'context_extractor_yyx': 'lstm', 'activation_func_yyx': 'Tanh', 'L2_weight_yyx': 5.053331537493188e-06, 'L_entropy_weight_yyx': 3.903324849011272e-05, 'L_sep_weight_yyx': 7.877288966813828e-10, 'L_scale_weight_yyx': 2.674990659205889e-05, 'learning_rate_yyx': 0.009769386598304428}. Best is trial 7 with value: -1.4538350266676683.
[I 2026-03-18 21:10:13,262] Trial 20 pruned. 
[I 2026-03-18 21:10:13,825] Trial 29 pruned. 
[I 2026-03-18 21:10:15,001] Trial 27 finished with value: -1.3316302490234375 and parameters: {'n_layers_yyx': 2, 'hidden_size_yyx_l0': 6, 'hidden_size_yyx_l1': 4, 'context_size_yyx': 1, 'num_mix_components_yyx': 2, 'context_extractor_yyx': 'gru', 'activation_func_yyx': 'GELU', 'L2_weight_yyx': 1.3725028234906398e-08, 'L_entropy_weight_yyx': 0.0009272149932058663, 'L_sep_weight_yyx': 1.1531706204615608e-07, 'L_scale_weight_yyx': 1.337594531902042e-07, 'learning_rate_yyx': 0.0036355906760117958}. Best is trial 1 with value: -1.4389243727463943.
[I 2026-03-18 21:10:17,220] Trial 20 pruned. 
[I 2026-03-18 21:10:19,187] Trial 16 pruned. 
[I 2026-03-18 21:10:25,209] Trial 24 pruned. 
[I 2026-03-18 21:10:25,210] Trial 27 pruned. 
[I 2026-03-18 21:10:25,354] Trial 10 finished with value: -1.4183243032602164 and parameters: {'n_layers_yyx': 1, 'hidden_size_yyx_l0': 6, 'context_size_yyx': 2, 'num_mix_components_yyx': 3, 'context_extractor_yyx': 'gru', 'activation_func_yyx': 'ReLU', 'L2_weight_yyx': 0.0005406911025129685, 'L_entropy_weight_yyx': 4.37524014587389e-09, 'L_sep_weight_yyx': 1.2688842571904937e-10, 'L_scale_weight_yyx': 0.0008885097281946593, 'learning_rate_yyx': 0.009769370283540224}. Best is trial 7 with value: -1.4535823880709136.
[I 2026-03-18 21:10:26,164] Trial 26 finished with value: -1.584650032885134 and parameters: {'n_layers_yyx': 1, 'hidden_size_yyx_l0': 5, 'context_size_yyx': 1, 'num_mix_components_yyx': 2, 'context_extractor_yyx': 'lstm', 'activation_func_yyx': 'Tanh', 'L2_weight_yyx': 0.0007287334071213496, 'L_entropy_weight_yyx': 9.10236011061037e-10, 'L_sep_weight_yyx': 3.1878821883733973e-09, 'L_scale_weight_yyx': 6.519803156247812e-09, 'learning_rate_yyx': 0.002927833912258709}. Best is trial 26 with value: -1.584650032885134.
[I 2026-03-18 21:10:28,409] Trial 24 pruned. 
[I 2026-03-18 21:10:35,288] Trial 28 pruned. 
[I 2026-03-18 21:10:38,800] Trial 16 finished with value: -1.8559013678642584 and parameters: {'n_layers_yyx': 2, 'hidden_size_yyx_l0': 5, 'hidden_size_yyx_l1': 6, 'context_size_yyx': 2, 'num_mix_components_yyx': 3, 'context_extractor_yyx': 'gru', 'activation_func_yyx': 'GELU', 'L2_weight_yyx': 5.720542588505992e-05, 'L_entropy_weight_yyx': 9.57751744336264e-10, 'L_sep_weight_yyx': 3.21067045567406e-07, 'L_scale_weight_yyx': 1.1086291888906046e-06, 'learning_rate_yyx': 0.00834329126207162}. Best is trial 12 with value: -1.8566309981104903.
[I 2026-03-18 21:10:39,250] Trial 23 finished with value: -2.482644341240102 and parameters: {'n_layers_yyx': 1, 'hidden_size_yyx_l0': 6, 'context_size_yyx': 3, 'num_mix_components_yyx': 3, 'context_extractor_yyx': 'gru', 'activation_func_yyx': 'ReLU', 'L2_weight_yyx': 1.0756971284658503e-10, 'L_entropy_weight_yyx': 5.26327269497136e-10, 'L_sep_weight_yyx': 0.00019604982099122783, 'L_scale_weight_yyx': 1.0407984795857661e-10, 'learning_rate_yyx': 0.007323253356058865}. Best is trial 13 with value: -2.4850502863404977.
[I 2026-03-18 21:10:40,305] Trial 28 pruned. 
[I 2026-03-18 21:10:45,221] Trial 27 pruned. 
[I 2026-03-18 21:10:46,050] Trial 28 pruned. 
[I 2026-03-18 21:10:48,338] Trial 43 pruned. 
[I 2026-03-18 21:10:54,435] Trial 21 finished with value: -1.8595880520318997 and parameters: {'n_layers_yyx': 2, 'hidden_size_yyx_l0': 5, 'hidden_size_yyx_l1': 5, 'context_size_yyx': 4, 'num_mix_components_yyx': 2, 'context_extractor_yyx': 'lstm', 'activation_func_yyx': 'Tanh', 'L2_weight_yyx': 8.028985792525222e-05, 'L_entropy_weight_yyx': 3.78061880941244e-09, 'L_sep_weight_yyx': 2.124694568935905e-08, 'L_scale_weight_yyx': 1.2627157755800858e-06, 'learning_rate_yyx': 0.006471946703515722}. Best is trial 11 with value: -1.8610449438696508.
[I 2026-03-18 21:10:54,454] Trial 27 pruned. 
[I 2026-03-18 21:11:01,639] Trial 25 pruned. 
[I 2026-03-18 21:11:02,260] Trial 29 pruned. 
[I 2026-03-18 21:11:07,662] Trial 28 pruned. 
[I 2026-03-18 21:11:10,439] Trial 33 pruned. 
