[I 2026-03-18 17:08:04,234] Trial 2 finished with value: -1.2494253768497827 and parameters: {'n_layers_yyx': 2, 'hidden_size_yyx_l0': 5, 'hidden_size_yyx_l1': 5, 'context_size_yyx': 1, 'num_mix_components_yyx': 1, 'context_extractor_yyx': 'lstm', 'activation_func_yyx': 'ReLU', 'L2_weight_yyx': 5.9507830604258294e-08, 'L_entropy_weight_yyx': 0.000334818581670882, 'L_sep_weight_yyx': 2.7696834564932096e-10, 'L_scale_weight_yyx': 1.2804777718204981e-08, 'learning_rate_yyx': 0.00887421194335049}. Best is trial 1 with value: -1.2648516600321489.
[I 2026-03-18 17:08:05,559] Trial 3 finished with value: -0.584032942865049 and parameters: {'n_layers_yyx': 1, 'hidden_size_yyx_l0': 5, 'context_size_yyx': 3, 'num_mix_components_yyx': 2, 'context_extractor_yyx': 'gru', 'activation_func_yyx': 'Tanh', 'L2_weight_yyx': 1.3153194567243632e-07, 'L_entropy_weight_yyx': 5.881037219568272e-08, 'L_sep_weight_yyx': 6.8552421313735285e-06, 'L_scale_weight_yyx': 6.625268871819989e-09, 'learning_rate_yyx': 0.002361367103582362}. Best is trial 3 with value: -0.584032942865049.
[I 2026-03-18 17:08:07,974] Trial 2 finished with value: -3.1580584124267483 and parameters: {'n_layers_yyx': 2, 'hidden_size_yyx_l0': 2, 'hidden_size_yyx_l1': 4, 'context_size_yyx': 2, 'num_mix_components_yyx': 4, 'context_extractor_yyx': 'gru', 'activation_func_yyx': 'Tanh', 'L2_weight_yyx': 7.907919141024496e-08, 'L_entropy_weight_yyx': 3.381984306219124e-08, 'L_sep_weight_yyx': 7.960780558491427e-09, 'L_scale_weight_yyx': 5.0093355183569385e-08, 'learning_rate_yyx': 0.00814729109495757}. Best is trial 2 with value: -3.1580584124267483.
[I 2026-03-18 17:08:18,832] Trial 4 finished with value: -3.1221837628792355 and parameters: {'n_layers_yyx': 2, 'hidden_size_yyx_l0': 2, 'hidden_size_yyx_l1': 4, 'context_size_yyx': 1, 'num_mix_components_yyx': 1, 'context_extractor_yyx': 'gru', 'activation_func_yyx': 'ReLU', 'L2_weight_yyx': 2.852360814349556e-07, 'L_entropy_weight_yyx': 0.00016743235833005803, 'L_sep_weight_yyx': 4.9576543303924416e-09, 'L_scale_weight_yyx': 2.8562242129773727e-09, 'learning_rate_yyx': 0.005156833059295071}. Best is trial 1 with value: -3.126730890715153.
[I 2026-03-18 17:08:19,331] Trial 6 pruned. 
[I 2026-03-18 17:08:20,741] Trial 3 pruned. 
[I 2026-03-18 17:08:30,942] Trial 1 finished with value: -3.152505646630136 and parameters: {'n_layers_yyx': 2, 'hidden_size_yyx_l0': 2, 'hidden_size_yyx_l1': 6, 'context_size_yyx': 4, 'num_mix_components_yyx': 3, 'context_extractor_yyx': 'lstm', 'activation_func_yyx': 'ReLU', 'L2_weight_yyx': 3.953448899825945e-09, 'L_entropy_weight_yyx': 1.3969438307672972e-07, 'L_sep_weight_yyx': 1.3115064209092256e-07, 'L_scale_weight_yyx': 3.401635567239583e-08, 'learning_rate_yyx': 0.002412213721853536}. Best is trial 1 with value: -3.152505646630136.
[I 2026-03-18 17:08:32,046] Trial 4 pruned. 
[I 2026-03-18 17:08:33,771] Trial 3 pruned. 
[I 2026-03-18 17:08:38,365] Trial 5 pruned. 
[I 2026-03-18 17:08:43,263] Trial 6 finished with value: -0.5672768405247915 and parameters: {'n_layers_yyx': 2, 'hidden_size_yyx_l0': 3, 'hidden_size_yyx_l1': 6, 'context_size_yyx': 1, 'num_mix_components_yyx': 3, 'context_extractor_yyx': 'gru', 'activation_func_yyx': 'ReLU', 'L2_weight_yyx': 1.8481543912657223e-06, 'L_entropy_weight_yyx': 1.4056996142744084e-07, 'L_sep_weight_yyx': 2.7349790781013778e-09, 'L_scale_weight_yyx': 4.386415138812711e-06, 'learning_rate_yyx': 0.0006667182879857806}. Best is trial 3 with value: -0.5680763632919962.
[I 2026-03-18 17:08:44,675] Trial 4 pruned. 
[I 2026-03-18 17:08:47,102] Trial 2 finished with value: -1.2804754530695341 and parameters: {'n_layers_yyx': 2, 'hidden_size_yyx_l0': 3, 'hidden_size_yyx_l1': 4, 'context_size_yyx': 4, 'num_mix_components_yyx': 2, 'context_extractor_yyx': 'lstm', 'activation_func_yyx': 'GELU', 'L2_weight_yyx': 1.5149719629706902e-05, 'L_entropy_weight_yyx': 1.4934444341630732e-10, 'L_sep_weight_yyx': 1.1779249945306789e-07, 'L_scale_weight_yyx': 1.8658913513478024e-07, 'learning_rate_yyx': 0.003348138714457676}. Best is trial 2 with value: -1.2804754530695341.
[I 2026-03-18 17:08:47,547] Trial 5 pruned. 
[I 2026-03-18 17:08:53,195] Trial 6 finished with value: -3.1198373821348815 and parameters: {'n_layers_yyx': 1, 'hidden_size_yyx_l0': 2, 'context_size_yyx': 4, 'num_mix_components_yyx': 5, 'context_extractor_yyx': 'lstm', 'activation_func_yyx': 'ReLU', 'L2_weight_yyx': 1.7515762353930675e-06, 'L_entropy_weight_yyx': 4.327968398112727e-10, 'L_sep_weight_yyx': 1.5438479287244944e-07, 'L_scale_weight_yyx': 1.574345614214582e-10, 'learning_rate_yyx': 0.00440792865145928}. Best is trial 0 with value: -3.1199443073044333.
[I 2026-03-18 17:08:55,197] Trial 2 pruned. 
[I 2026-03-18 17:08:58,447] Trial 7 pruned. 
[I 2026-03-18 17:09:01,959] Trial 3 finished with value: -3.111951528757999 and parameters: {'n_layers_yyx': 2, 'hidden_size_yyx_l0': 2, 'hidden_size_yyx_l1': 3, 'context_size_yyx': 1, 'num_mix_components_yyx': 5, 'context_extractor_yyx': 'lstm', 'activation_func_yyx': 'GELU', 'L2_weight_yyx': 1.3376813823389628e-06, 'L_entropy_weight_yyx': 1.1705529979466812e-07, 'L_sep_weight_yyx': 4.454333932615991e-07, 'L_scale_weight_yyx': 1.1037992151449082e-10, 'learning_rate_yyx': 0.005556128232723482}. Best is trial 2 with value: -3.1501405578480686.
[I 2026-03-18 17:09:02,740] Trial 6 pruned. 
[I 2026-03-18 17:09:04,541] Trial 1 finished with value: -3.1198637868475014 and parameters: {'n_layers_yyx': 1, 'hidden_size_yyx_l0': 6, 'context_size_yyx': 3, 'num_mix_components_yyx': 1, 'context_extractor_yyx': 'gru', 'activation_func_yyx': 'ReLU', 'L2_weight_yyx': 1.0844412320448866e-10, 'L_entropy_weight_yyx': 3.476735348257989e-08, 'L_sep_weight_yyx': 3.889615875583476e-06, 'L_scale_weight_yyx': 2.0290265765829087e-05, 'learning_rate_yyx': 0.0005733801256785682}. Best is trial 0 with value: -3.1464314770929143.
[I 2026-03-18 17:09:11,876] Trial 5 pruned. 
[I 2026-03-18 17:09:12,490] Trial 8 pruned. 
[I 2026-03-18 17:09:13,934] Trial 10 finished with value: -1.2455096006834132 and parameters: {'n_layers_yyx': 2, 'hidden_size_yyx_l0': 4, 'hidden_size_yyx_l1': 6, 'context_size_yyx': 3, 'num_mix_components_yyx': 4, 'context_extractor_yyx': 'lstm', 'activation_func_yyx': 'Tanh', 'L2_weight_yyx': 6.750287441689257e-06, 'L_entropy_weight_yyx': 1.3384508131888098e-10, 'L_sep_weight_yyx': 0.0006606369402993577, 'L_scale_weight_yyx': 1.5312237288362228e-10, 'learning_rate_yyx': 0.003284918848331742}. Best is trial 0 with value: -1.2528411103705162.
[I 2026-03-18 17:09:19,182] Trial 7 pruned. 
[I 2026-03-18 17:09:19,845] Trial 2 pruned. 
[I 2026-03-18 17:09:24,509] Trial 2 finished with value: -3.151229652723366 and parameters: {'n_layers_yyx': 2, 'hidden_size_yyx_l0': 2, 'hidden_size_yyx_l1': 5, 'context_size_yyx': 4, 'num_mix_components_yyx': 2, 'context_extractor_yyx': 'gru', 'activation_func_yyx': 'GELU', 'L2_weight_yyx': 3.2306624228181744e-05, 'L_entropy_weight_yyx': 9.494421787181373e-09, 'L_sep_weight_yyx': 0.00046687230344503484, 'L_scale_weight_yyx': 1.2771726602130146e-10, 'learning_rate_yyx': 0.009810761208564415}. Best is trial 2 with value: -3.151229652723366.
[I 2026-03-18 17:09:24,998] Trial 7 pruned. 
[I 2026-03-18 17:09:26,997] Trial 4 pruned. 
[I 2026-03-18 17:09:27,611] Trial 2 pruned. 
[I 2026-03-18 17:09:36,513] Trial 5 finished with value: -3.1355884399126297 and parameters: {'n_layers_yyx': 1, 'hidden_size_yyx_l0': 4, 'context_size_yyx': 3, 'num_mix_components_yyx': 5, 'context_extractor_yyx': 'gru', 'activation_func_yyx': 'Tanh', 'L2_weight_yyx': 5.688528890309697e-06, 'L_entropy_weight_yyx': 7.343426791941919e-09, 'L_sep_weight_yyx': 1.162399352989985e-07, 'L_scale_weight_yyx': 0.0001642352588867284, 'learning_rate_yyx': 0.001977650054370625}. Best is trial 1 with value: -3.1505299612690063.
[I 2026-03-18 17:09:41,308] Trial 8 pruned. 
[I 2026-03-18 17:09:53,930] Trial 5 finished with value: -3.1813736784759756 and parameters: {'n_layers_yyx': 1, 'hidden_size_yyx_l0': 5, 'context_size_yyx': 4, 'num_mix_components_yyx': 4, 'context_extractor_yyx': 'gru', 'activation_func_yyx': 'GELU', 'L2_weight_yyx': 8.685586021050803e-10, 'L_entropy_weight_yyx': 3.7374060070129057e-07, 'L_sep_weight_yyx': 8.6866183883976e-07, 'L_scale_weight_yyx': 4.539537783845782e-10, 'learning_rate_yyx': 0.0019773745024292224}. Best is trial 5 with value: -3.1813736784759756.
[I 2026-03-18 17:09:54,863] Trial 3 finished with value: -1.264838805701067 and parameters: {'n_layers_yyx': 1, 'hidden_size_yyx_l0': 5, 'context_size_yyx': 4, 'num_mix_components_yyx': 4, 'context_extractor_yyx': 'gru', 'activation_func_yyx': 'Tanh', 'L2_weight_yyx': 8.925979540721152e-05, 'L_entropy_weight_yyx': 4.567788243889224e-06, 'L_sep_weight_yyx': 6.211260683805453e-05, 'L_scale_weight_yyx': 0.0003022860889680702, 'learning_rate_yyx': 0.007082513129821763}. Best is trial 1 with value: -1.2648516600321489.
[I 2026-03-18 17:09:54,970] Trial 3 pruned. 
[I 2026-03-18 17:10:00,986] Trial 2 finished with value: -1.2627689975026355 and parameters: {'n_layers_yyx': 1, 'hidden_size_yyx_l0': 4, 'context_size_yyx': 4, 'num_mix_components_yyx': 5, 'context_extractor_yyx': 'gru', 'activation_func_yyx': 'ReLU', 'L2_weight_yyx': 5.001183976927571e-05, 'L_entropy_weight_yyx': 2.590186079079014e-10, 'L_sep_weight_yyx': 1.650379983895355e-08, 'L_scale_weight_yyx': 1.3639168932800383e-10, 'learning_rate_yyx': 0.004438586120934635}. Best is trial 2 with value: -1.2627689975026355.
[I 2026-03-18 17:10:01,374] Trial 6 pruned. 
[I 2026-03-18 17:10:08,722] Trial 4 pruned. 
[I 2026-03-18 17:10:12,736] Trial 7 pruned. 
[I 2026-03-18 17:10:13,600] Trial 3 pruned. 
[I 2026-03-18 17:10:22,128] Trial 1 finished with value: -3.116163131326895 and parameters: {'n_layers_yyx': 2, 'hidden_size_yyx_l0': 2, 'hidden_size_yyx_l1': 2, 'context_size_yyx': 4, 'num_mix_components_yyx': 4, 'context_extractor_yyx': 'gru', 'activation_func_yyx': 'Tanh', 'L2_weight_yyx': 3.293710863879273e-10, 'L_entropy_weight_yyx': 1.58601907253779e-08, 'L_sep_weight_yyx': 1.7262878925882173e-09, 'L_scale_weight_yyx': 0.0001957613761239699, 'learning_rate_yyx': 0.0006102033954577125}. Best is trial 1 with value: -3.116163131326895.
[I 2026-03-18 17:10:22,408] Trial 5 pruned. 
[I 2026-03-18 17:10:23,079] Trial 2 finished with value: -3.1209907247301203 and parameters: {'n_layers_yyx': 1, 'hidden_size_yyx_l0': 3, 'context_size_yyx': 3, 'num_mix_components_yyx': 3, 'context_extractor_yyx': 'gru', 'activation_func_yyx': 'GELU', 'L2_weight_yyx': 1.2871406516168109e-08, 'L_entropy_weight_yyx': 3.0169186237840517e-07, 'L_sep_weight_yyx': 0.00030620777142241815, 'L_scale_weight_yyx': 6.4157613147281134e-06, 'learning_rate_yyx': 0.0073726062302203}. Best is trial 1 with value: -3.1478210420414996.
[I 2026-03-18 17:10:31,868] Trial 9 pruned. 
[I 2026-03-18 17:10:33,545] Trial 8 pruned. 
[I 2026-03-18 17:10:43,849] Trial 4 finished with value: -0.5469237462690477 and parameters: {'n_layers_yyx': 2, 'hidden_size_yyx_l0': 3, 'hidden_size_yyx_l1': 6, 'context_size_yyx': 2, 'num_mix_components_yyx': 1, 'context_extractor_yyx': 'lstm', 'activation_func_yyx': 'Tanh', 'L2_weight_yyx': 0.0007902951560975032, 'L_entropy_weight_yyx': 1.750208264381398e-07, 'L_sep_weight_yyx': 4.7096327616250105e-05, 'L_scale_weight_yyx': 5.45092319298028e-10, 'learning_rate_yyx': 0.003046040352179242}. Best is trial 3 with value: -0.5628998348440724.
[I 2026-03-18 17:10:46,723] Trial 6 pruned. 
[I 2026-03-18 17:10:47,066] Trial 3 pruned. 
[I 2026-03-18 17:10:47,983] Trial 3 finished with value: -3.1655211954768308 and parameters: {'n_layers_yyx': 1, 'hidden_size_yyx_l0': 4, 'context_size_yyx': 3, 'num_mix_components_yyx': 3, 'context_extractor_yyx': 'lstm', 'activation_func_yyx': 'GELU', 'L2_weight_yyx': 7.269594567634619e-10, 'L_entropy_weight_yyx': 1.2232155870355416e-07, 'L_sep_weight_yyx': 0.0006917952160855111, 'L_scale_weight_yyx': 0.0002058882391042208, 'learning_rate_yyx': 0.00660145070191209}. Best is trial 1 with value: -3.166268711244678.
[I 2026-03-18 17:10:49,780] Trial 9 pruned. 
[I 2026-03-18 17:10:50,366] Trial 7 pruned. 
[I 2026-03-18 17:10:52,952] Trial 5 pruned. 
[I 2026-03-18 17:10:54,734] Trial 3 finished with value: -0.5545388579860514 and parameters: {'n_layers_yyx': 1, 'hidden_size_yyx_l0': 3, 'context_size_yyx': 2, 'num_mix_components_yyx': 1, 'context_extractor_yyx': 'lstm', 'activation_func_yyx': 'GELU', 'L2_weight_yyx': 6.853342160781475e-08, 'L_entropy_weight_yyx': 2.696959873281217e-10, 'L_sep_weight_yyx': 1.8859935262389106e-10, 'L_scale_weight_yyx': 9.520338554230348e-05, 'learning_rate_yyx': 0.0007845946791154138}. Best is trial 1 with value: -0.5670251859431418.
[I 2026-03-18 17:11:10,036] Trial 4 pruned. 
[I 2026-03-18 17:11:11,625] Trial 8 pruned. 
[I 2026-03-18 17:11:11,858] Trial 3 finished with value: -3.1073116101489595 and parameters: {'n_layers_yyx': 1, 'hidden_size_yyx_l0': 3, 'context_size_yyx': 4, 'num_mix_components_yyx': 1, 'context_extractor_yyx': 'gru', 'activation_func_yyx': 'Tanh', 'L2_weight_yyx': 3.0003807378915136e-09, 'L_entropy_weight_yyx': 1.4043652890314924e-08, 'L_sep_weight_yyx': 8.488736081430387e-07, 'L_scale_weight_yyx': 0.0001353362978272215, 'learning_rate_yyx': 0.004873145736799934}. Best is trial 2 with value: -3.151229652723366.
[I 2026-03-18 17:11:11,886] Trial 8 pruned. 
[I 2026-03-18 17:11:14,701] Trial 4 finished with value: -3.115354651182172 and parameters: {'n_layers_yyx': 2, 'hidden_size_yyx_l0': 4, 'hidden_size_yyx_l1': 3, 'context_size_yyx': 4, 'num_mix_components_yyx': 1, 'context_extractor_yyx': 'gru', 'activation_func_yyx': 'Tanh', 'L2_weight_yyx': 2.1299376936618125e-08, 'L_entropy_weight_yyx': 0.0002966187434181515, 'L_sep_weight_yyx': 7.628096185513842e-10, 'L_scale_weight_yyx': 1.626682738676216e-05, 'learning_rate_yyx': 0.007969023250935795}. Best is trial 0 with value: -3.1464314770929143.
[I 2026-03-18 17:11:16,525] Trial 6 pruned. 
[I 2026-03-18 17:11:17,426] Trial 6 pruned. 
[I 2026-03-18 17:11:18,425] Trial 11 finished with value: -1.2458375518291143 and parameters: {'n_layers_yyx': 2, 'hidden_size_yyx_l0': 4, 'hidden_size_yyx_l1': 6, 'context_size_yyx': 3, 'num_mix_components_yyx': 4, 'context_extractor_yyx': 'lstm', 'activation_func_yyx': 'Tanh', 'L2_weight_yyx': 1.851987205418616e-05, 'L_entropy_weight_yyx': 6.476213610214789e-10, 'L_sep_weight_yyx': 0.0006002060406559314, 'L_scale_weight_yyx': 1.563406664004249e-10, 'learning_rate_yyx': 0.004031601273976243}. Best is trial 0 with value: -1.2528411103705162.
[I 2026-03-18 17:11:21,967] Trial 2 finished with value: -1.244051413262838 and parameters: {'n_layers_yyx': 2, 'hidden_size_yyx_l0': 2, 'hidden_size_yyx_l1': 6, 'context_size_yyx': 1, 'num_mix_components_yyx': 2, 'context_extractor_yyx': 'gru', 'activation_func_yyx': 'GELU', 'L2_weight_yyx': 3.574459800583592e-05, 'L_entropy_weight_yyx': 1.1464606104346744e-08, 'L_sep_weight_yyx': 4.798198918000076e-07, 'L_scale_weight_yyx': 1.1885664612029127e-10, 'learning_rate_yyx': 0.00361235036397549}. Best is trial 2 with value: -1.244051413262838.
[I 2026-03-18 17:11:25,053] Trial 10 pruned. 
[I 2026-03-18 17:11:27,185] Trial 7 pruned. 
[I 2026-03-18 17:11:29,268] Trial 7 pruned. 
[I 2026-03-18 17:11:30,773] Trial 4 finished with value: -3.123798623517195 and parameters: {'n_layers_yyx': 1, 'hidden_size_yyx_l0': 6, 'context_size_yyx': 4, 'num_mix_components_yyx': 3, 'context_extractor_yyx': 'lstm', 'activation_func_yyx': 'ReLU', 'L2_weight_yyx': 3.263721149267305e-10, 'L_entropy_weight_yyx': 5.574527016041263e-05, 'L_sep_weight_yyx': 1.3760467249512526e-08, 'L_scale_weight_yyx': 7.317055261713248e-10, 'learning_rate_yyx': 0.002914415970193099}. Best is trial 2 with value: -3.1580584124267483.
[I 2026-03-18 17:11:35,477] Trial 4 pruned. 
[I 2026-03-18 17:11:42,020] Trial 3 finished with value: -3.1076836553100784 and parameters: {'n_layers_yyx': 1, 'hidden_size_yyx_l0': 2, 'context_size_yyx': 1, 'num_mix_components_yyx': 4, 'context_extractor_yyx': 'gru', 'activation_func_yyx': 'Tanh', 'L2_weight_yyx': 1.8518238224046615e-10, 'L_entropy_weight_yyx': 3.6958582256669205e-09, 'L_sep_weight_yyx': 2.3142448426762147e-05, 'L_scale_weight_yyx': 5.148497345892387e-07, 'learning_rate_yyx': 0.0017245853587456728}. Best is trial 2 with value: -3.1235621753098126.
[I 2026-03-18 17:11:43,228] Trial 5 pruned. 
[I 2026-03-18 17:11:52,276] Trial 9 finished with value: -1.260291334000621 and parameters: {'n_layers_yyx': 1, 'hidden_size_yyx_l0': 3, 'context_size_yyx': 4, 'num_mix_components_yyx': 4, 'context_extractor_yyx': 'gru', 'activation_func_yyx': 'GELU', 'L2_weight_yyx': 0.0001589937720045239, 'L_entropy_weight_yyx': 4.294124515559101e-08, 'L_sep_weight_yyx': 3.116313175344257e-08, 'L_scale_weight_yyx': 8.021716051440383e-09, 'learning_rate_yyx': 0.0022104537689930223}. Best is trial 3 with value: -1.265314140954432.
[I 2026-03-18 17:11:52,781] Trial 11 pruned. 
[I 2026-03-18 17:11:54,269] Trial 3 finished with value: -1.250546143367859 and parameters: {'n_layers_yyx': 1, 'hidden_size_yyx_l0': 4, 'context_size_yyx': 2, 'num_mix_components_yyx': 4, 'context_extractor_yyx': 'gru', 'activation_func_yyx': 'Tanh', 'L2_weight_yyx': 2.3675870581638057e-07, 'L_entropy_weight_yyx': 2.2413172937171307e-08, 'L_sep_weight_yyx': 4.411065025680847e-08, 'L_scale_weight_yyx': 2.144570022374972e-07, 'learning_rate_yyx': 0.0008900591440691856}. Best is trial 0 with value: -1.2515830500068594.
[I 2026-03-18 17:11:57,242] Trial 5 pruned. 
[I 2026-03-18 17:11:57,410] Trial 3 finished with value: -1.2679934898277747 and parameters: {'n_layers_yyx': 2, 'hidden_size_yyx_l0': 4, 'hidden_size_yyx_l1': 6, 'context_size_yyx': 1, 'num_mix_components_yyx': 4, 'context_extractor_yyx': 'gru', 'activation_func_yyx': 'ReLU', 'L2_weight_yyx': 0.0007898314668535334, 'L_entropy_weight_yyx': 2.1652784164569084e-08, 'L_sep_weight_yyx': 9.77050839921542e-07, 'L_scale_weight_yyx': 0.00014959097038034054, 'learning_rate_yyx': 0.005861948506205971}. Best is trial 3 with value: -1.2679934898277747.
[I 2026-03-18 17:12:04,983] Trial 8 pruned. 
[I 2026-03-18 17:12:06,724] Trial 4 pruned. 
[I 2026-03-18 17:12:10,534] Trial 5 finished with value: -3.14725896745614 and parameters: {'n_layers_yyx': 1, 'hidden_size_yyx_l0': 2, 'context_size_yyx': 4, 'num_mix_components_yyx': 4, 'context_extractor_yyx': 'gru', 'activation_func_yyx': 'Tanh', 'L2_weight_yyx': 1.2364474465766281e-08, 'L_entropy_weight_yyx': 8.325060569494332e-07, 'L_sep_weight_yyx': 1.3373027715321077e-10, 'L_scale_weight_yyx': 7.308361622702105e-08, 'learning_rate_yyx': 0.005128865762515052}. Best is trial 5 with value: -3.14725896745614.
[I 2026-03-18 17:12:10,986] Trial 4 pruned. 
[I 2026-03-18 17:12:11,227] Trial 6 pruned. 
[I 2026-03-18 17:12:16,596] Trial 9 pruned. 
[I 2026-03-18 17:12:18,885] Trial 9 pruned. 
[I 2026-03-18 17:12:19,837] Trial 12 pruned. 
[I 2026-03-18 17:12:22,361] Trial 6 pruned. 
[I 2026-03-18 17:12:24,530] Trial 5 pruned. 
[I 2026-03-18 17:12:32,629] Trial 10 pruned. 
[I 2026-03-18 17:12:33,480] Trial 5 finished with value: -3.137842676868572 and parameters: {'n_layers_yyx': 2, 'hidden_size_yyx_l0': 2, 'hidden_size_yyx_l1': 6, 'context_size_yyx': 2, 'num_mix_components_yyx': 3, 'context_extractor_yyx': 'gru', 'activation_func_yyx': 'GELU', 'L2_weight_yyx': 5.488739832830197e-08, 'L_entropy_weight_yyx': 3.6978737503454676e-09, 'L_sep_weight_yyx': 1.8387466351695333e-08, 'L_scale_weight_yyx': 2.351113344530424e-09, 'learning_rate_yyx': 0.0014097714033264276}. Best is trial 0 with value: -3.1460828145824977.
[I 2026-03-18 17:12:36,185] Trial 8 pruned. 
[I 2026-03-18 17:12:36,720] Trial 6 pruned. 
[I 2026-03-18 17:12:38,793] Trial 6 finished with value: -3.1543817457141574 and parameters: {'n_layers_yyx': 1, 'hidden_size_yyx_l0': 3, 'context_size_yyx': 4, 'num_mix_components_yyx': 5, 'context_extractor_yyx': 'lstm', 'activation_func_yyx': 'GELU', 'L2_weight_yyx': 1.2979991941569916e-07, 'L_entropy_weight_yyx': 1.3116390941008154e-06, 'L_sep_weight_yyx': 1.255826802067122e-05, 'L_scale_weight_yyx': 3.6750728206737776e-10, 'learning_rate_yyx': 0.0031312097926737372}. Best is trial 6 with value: -3.1543817457141574.
[I 2026-03-18 17:12:40,563] Trial 9 finished with value: -0.5643472579683202 and parameters: {'n_layers_yyx': 1, 'hidden_size_yyx_l0': 2, 'context_size_yyx': 2, 'num_mix_components_yyx': 1, 'context_extractor_yyx': 'gru', 'activation_func_yyx': 'GELU', 'L2_weight_yyx': 1.792101321717722e-05, 'L_entropy_weight_yyx': 0.0005254603543105854, 'L_sep_weight_yyx': 1.8023336257926014e-07, 'L_scale_weight_yyx': 4.958995195487183e-05, 'learning_rate_yyx': 0.005136803273568103}. Best is trial 3 with value: -0.5680763632919962.
[I 2026-03-18 17:12:44,045] Trial 3 finished with value: -1.2525392627539784 and parameters: {'n_layers_yyx': 1, 'hidden_size_yyx_l0': 5, 'context_size_yyx': 2, 'num_mix_components_yyx': 4, 'context_extractor_yyx': 'gru', 'activation_func_yyx': 'Tanh', 'L2_weight_yyx': 5.260421326463848e-08, 'L_entropy_weight_yyx': 0.00048237372097789823, 'L_sep_weight_yyx': 4.698874294857961e-08, 'L_scale_weight_yyx': 1.2404865884605097e-05, 'learning_rate_yyx': 0.0025785385223861443}. Best is trial 0 with value: -1.2656102912042586.
[I 2026-03-18 17:12:52,194] Trial 7 pruned. 
[I 2026-03-18 17:12:54,249] Trial 6 pruned. 
[I 2026-03-18 17:12:54,888] Trial 4 finished with value: -1.2583327584257848 and parameters: {'n_layers_yyx': 1, 'hidden_size_yyx_l0': 5, 'context_size_yyx': 2, 'num_mix_components_yyx': 3, 'context_extractor_yyx': 'lstm', 'activation_func_yyx': 'ReLU', 'L2_weight_yyx': 1.013903441593556e-07, 'L_entropy_weight_yyx': 1.639124169725974e-09, 'L_sep_weight_yyx': 0.00017635377815500316, 'L_scale_weight_yyx': 5.580071875911371e-07, 'learning_rate_yyx': 0.0054945489542812965}. Best is trial 2 with value: -1.2627689975026355.
[I 2026-03-18 17:12:57,562] Trial 11 pruned. 
[I 2026-03-18 17:13:06,984] Trial 8 pruned. 
[I 2026-03-18 17:13:11,958] Trial 10 pruned. 
