[I 2026-03-18 19:57:33,186] Trial 1 finished with value: -1.8501018013957466 and parameters: {'n_layers_yyx': 1, 'hidden_size_yyx_l0': 4, 'context_size_yyx': 1, 'num_mix_components_yyx': 1, 'context_extractor_yyx': 'gru', 'activation_func_yyx': 'GELU', 'L2_weight_yyx': 1.6485728244905388e-08, 'L_entropy_weight_yyx': 0.0005884133645173629, 'L_sep_weight_yyx': 0.00039233423189344676, 'L_scale_weight_yyx': 3.4459691122363322e-06, 'learning_rate_yyx': 0.0030919705992266265}. Best is trial 1 with value: -1.8501018013957466.
[I 2026-03-18 19:57:43,110] Trial 2 finished with value: -1.8732809527166958 and parameters: {'n_layers_yyx': 2, 'hidden_size_yyx_l0': 4, 'hidden_size_yyx_l1': 2, 'context_size_yyx': 2, 'num_mix_components_yyx': 5, 'context_extractor_yyx': 'lstm', 'activation_func_yyx': 'ReLU', 'L2_weight_yyx': 1.1827926927443489e-08, 'L_entropy_weight_yyx': 2.2305992981964844e-09, 'L_sep_weight_yyx': 0.00011586300132874964, 'L_scale_weight_yyx': 1.217405189604956e-07, 'learning_rate_yyx': 0.006959419779170393}. Best is trial 1 with value: -1.8963288822393307.
[I 2026-03-18 19:57:46,461] Trial 1 finished with value: -1.7612767568260732 and parameters: {'n_layers_yyx': 1, 'hidden_size_yyx_l0': 2, 'context_size_yyx': 3, 'num_mix_components_yyx': 1, 'context_extractor_yyx': 'gru', 'activation_func_yyx': 'Tanh', 'L2_weight_yyx': 3.1430221448594734e-05, 'L_entropy_weight_yyx': 3.6280762896103313e-10, 'L_sep_weight_yyx': 1.1138273238049305e-10, 'L_scale_weight_yyx': 2.0801636609781834e-05, 'learning_rate_yyx': 0.003272674694927672}. Best is trial 0 with value: -1.783729309698548.
[I 2026-03-18 19:57:48,430] Trial 4 finished with value: -1.8198218883552804 and parameters: {'n_layers_yyx': 2, 'hidden_size_yyx_l0': 2, 'hidden_size_yyx_l1': 6, 'context_size_yyx': 2, 'num_mix_components_yyx': 1, 'context_extractor_yyx': 'gru', 'activation_func_yyx': 'ReLU', 'L2_weight_yyx': 1.3449732489269544e-09, 'L_entropy_weight_yyx': 2.1274706530797165e-06, 'L_sep_weight_yyx': 2.1082771649253525e-06, 'L_scale_weight_yyx': 1.515188871845756e-06, 'learning_rate_yyx': 0.0012810294249545008}. Best is trial 0 with value: -1.8516305051550026.
[I 2026-03-18 19:58:07,276] Trial 7 pruned. 
[I 2026-03-18 19:58:48,998] Trial 8 pruned. 
[I 2026-03-18 19:58:51,043] Trial 2 finished with value: -2.4850003350561587 and parameters: {'n_layers_yyx': 2, 'hidden_size_yyx_l0': 5, 'hidden_size_yyx_l1': 2, 'context_size_yyx': 1, 'num_mix_components_yyx': 5, 'context_extractor_yyx': 'gru', 'activation_func_yyx': 'ReLU', 'L2_weight_yyx': 0.00018349725809427883, 'L_entropy_weight_yyx': 8.507365319225199e-10, 'L_sep_weight_yyx': 9.724062786161133e-09, 'L_scale_weight_yyx': 1.6760265050250137e-07, 'learning_rate_yyx': 0.0024791795339670114}. Best is trial 0 with value: -2.488813529023287.
[I 2026-03-18 19:59:03,903] Trial 2 finished with value: -1.9337386046757195 and parameters: {'n_layers_yyx': 2, 'hidden_size_yyx_l0': 6, 'hidden_size_yyx_l1': 4, 'context_size_yyx': 3, 'num_mix_components_yyx': 2, 'context_extractor_yyx': 'lstm', 'activation_func_yyx': 'GELU', 'L2_weight_yyx': 1.122656331073701e-09, 'L_entropy_weight_yyx': 5.659141581156568e-08, 'L_sep_weight_yyx': 2.595785465015544e-09, 'L_scale_weight_yyx': 2.2666255101845122e-08, 'learning_rate_yyx': 0.0030735872378849396}. Best is trial 0 with value: -1.9368961358079142.
[I 2026-03-18 19:59:19,222] Trial 4 finished with value: -2.474992576357466 and parameters: {'n_layers_yyx': 2, 'hidden_size_yyx_l0': 4, 'hidden_size_yyx_l1': 3, 'context_size_yyx': 1, 'num_mix_components_yyx': 4, 'context_extractor_yyx': 'gru', 'activation_func_yyx': 'GELU', 'L2_weight_yyx': 1.3079106923359115e-05, 'L_entropy_weight_yyx': 3.710759023795446e-07, 'L_sep_weight_yyx': 2.0323106065241958e-09, 'L_scale_weight_yyx': 9.2795092466984e-05, 'learning_rate_yyx': 0.004354095001666351}. Best is trial 0 with value: -2.4805296636382916.
[I 2026-03-18 19:59:30,364] Trial 9 pruned. 
[I 2026-03-18 19:59:39,692] Trial 3 pruned. 
[I 2026-03-18 19:59:52,313] Trial 3 finished with value: -1.4510111647385817 and parameters: {'n_layers_yyx': 2, 'hidden_size_yyx_l0': 6, 'hidden_size_yyx_l1': 4, 'context_size_yyx': 2, 'num_mix_components_yyx': 3, 'context_extractor_yyx': 'lstm', 'activation_func_yyx': 'Tanh', 'L2_weight_yyx': 2.5842006196903018e-05, 'L_entropy_weight_yyx': 1.577069571516597e-05, 'L_sep_weight_yyx': 4.756077823824709e-10, 'L_scale_weight_yyx': 3.244840166355398e-09, 'learning_rate_yyx': 0.00451858564483598}. Best is trial 3 with value: -1.4510111647385817.
[I 2026-03-18 19:59:55,695] Trial 3 finished with value: -1.4403052696814904 and parameters: {'n_layers_yyx': 2, 'hidden_size_yyx_l0': 5, 'hidden_size_yyx_l1': 5, 'context_size_yyx': 1, 'num_mix_components_yyx': 3, 'context_extractor_yyx': 'gru', 'activation_func_yyx': 'Tanh', 'L2_weight_yyx': 6.498924806726437e-09, 'L_entropy_weight_yyx': 4.014306098636578e-05, 'L_sep_weight_yyx': 4.644769124560351e-05, 'L_scale_weight_yyx': 1.1008154577651126e-07, 'learning_rate_yyx': 0.0073353413390082126}. Best is trial 2 with value: -1.4588211763822116.
[I 2026-03-18 20:00:32,238] Trial 4 pruned. 
[I 2026-03-18 20:00:37,115] Trial 4 pruned. 
[I 2026-03-18 20:01:13,888] Trial 5 pruned. 
[I 2026-03-18 20:01:20,695] Trial 5 pruned. 
[I 2026-03-18 20:01:38,184] Trial 3 pruned. 
[I 2026-03-18 20:01:38,807] Trial 8 finished with value: -2.441460319362192 and parameters: {'n_layers_yyx': 2, 'hidden_size_yyx_l0': 2, 'hidden_size_yyx_l1': 6, 'context_size_yyx': 1, 'num_mix_components_yyx': 1, 'context_extractor_yyx': 'lstm', 'activation_func_yyx': 'Tanh', 'L2_weight_yyx': 4.8242786625503914e-06, 'L_entropy_weight_yyx': 9.208223471494903e-05, 'L_sep_weight_yyx': 1.7774129281671184e-10, 'L_scale_weight_yyx': 1.1983864604072147e-05, 'learning_rate_yyx': 0.0020471158005376413}. Best is trial 5 with value: -2.4735891998725372.
[I 2026-03-18 20:02:44,477] Trial 2 finished with value: -1.7867607224589646 and parameters: {'n_layers_yyx': 2, 'hidden_size_yyx_l0': 6, 'hidden_size_yyx_l1': 6, 'context_size_yyx': 4, 'num_mix_components_yyx': 3, 'context_extractor_yyx': 'gru', 'activation_func_yyx': 'GELU', 'L2_weight_yyx': 7.586351470996414e-08, 'L_entropy_weight_yyx': 1.1709328316503165e-09, 'L_sep_weight_yyx': 3.861069746053093e-09, 'L_scale_weight_yyx': 0.0004929937333711399, 'learning_rate_yyx': 0.0024858211755571925}. Best is trial 0 with value: -1.7873705314867425.
[I 2026-03-18 20:02:59,542] Trial 9 pruned. 
[I 2026-03-18 20:03:29,907] Trial 6 pruned. 
[I 2026-03-18 20:03:30,758] Trial 2 finished with value: -1.848153517757683 and parameters: {'n_layers_yyx': 1, 'hidden_size_yyx_l0': 3, 'context_size_yyx': 2, 'num_mix_components_yyx': 1, 'context_extractor_yyx': 'lstm', 'activation_func_yyx': 'GELU', 'L2_weight_yyx': 5.999823067774477e-06, 'L_entropy_weight_yyx': 1.5275298020004706e-06, 'L_sep_weight_yyx': 1.4394148505502139e-10, 'L_scale_weight_yyx': 0.0003793928007283922, 'learning_rate_yyx': 0.0007450146616367909}. Best is trial 0 with value: -1.867639598732223.
[I 2026-03-18 20:03:39,589] Trial 4 finished with value: -1.3416039100060095 and parameters: {'n_layers_yyx': 1, 'hidden_size_yyx_l0': 3, 'context_size_yyx': 2, 'num_mix_components_yyx': 1, 'context_extractor_yyx': 'lstm', 'activation_func_yyx': 'Tanh', 'L2_weight_yyx': 2.487629857454331e-06, 'L_entropy_weight_yyx': 3.493674728266475e-08, 'L_sep_weight_yyx': 0.00026431369053843943, 'L_scale_weight_yyx': 1.4447895118739356e-07, 'learning_rate_yyx': 0.008333365427898764}. Best is trial 0 with value: -1.342767052283654.
[I 2026-03-18 20:04:48,343] Trial 7 pruned. 
[I 2026-03-18 20:04:48,344] Trial 5 pruned. 
[I 2026-03-18 20:04:59,720] Trial 2 finished with value: -1.8331531040881628 and parameters: {'n_layers_yyx': 2, 'hidden_size_yyx_l0': 3, 'hidden_size_yyx_l1': 5, 'context_size_yyx': 2, 'num_mix_components_yyx': 4, 'context_extractor_yyx': 'gru', 'activation_func_yyx': 'ReLU', 'L2_weight_yyx': 4.2316417913372664e-06, 'L_entropy_weight_yyx': 5.349901544016566e-07, 'L_sep_weight_yyx': 3.2230243672301955e-10, 'L_scale_weight_yyx': 2.7844004181815125e-08, 'learning_rate_yyx': 0.0018066723045048756}. Best is trial 1 with value: -1.8555367853768732.
[I 2026-03-18 20:05:03,884] Trial 2 finished with value: -1.27556640625 and parameters: {'n_layers_yyx': 2, 'hidden_size_yyx_l0': 4, 'hidden_size_yyx_l1': 2, 'context_size_yyx': 3, 'num_mix_components_yyx': 1, 'context_extractor_yyx': 'lstm', 'activation_func_yyx': 'ReLU', 'L2_weight_yyx': 7.633469907715866e-06, 'L_entropy_weight_yyx': 5.463426107554262e-08, 'L_sep_weight_yyx': 2.132841793361498e-09, 'L_scale_weight_yyx': 1.3713997686039753e-05, 'learning_rate_yyx': 0.0028610046048919645}. Best is trial 1 with value: -1.3744548856295071.
[I 2026-03-18 20:05:55,728] Trial 3 finished with value: -1.816115164181368 and parameters: {'n_layers_yyx': 1, 'hidden_size_yyx_l0': 2, 'context_size_yyx': 2, 'num_mix_components_yyx': 5, 'context_extractor_yyx': 'lstm', 'activation_func_yyx': 'Tanh', 'L2_weight_yyx': 5.449988005808488e-10, 'L_entropy_weight_yyx': 1.1581429062964355e-08, 'L_sep_weight_yyx': 6.404181028751023e-10, 'L_scale_weight_yyx': 0.0003574192090961668, 'learning_rate_yyx': 0.0009939153491771231}. Best is trial 1 with value: -1.84511113308576.
[I 2026-03-18 20:06:06,458] Trial 2 finished with value: -1.8471102750887907 and parameters: {'n_layers_yyx': 2, 'hidden_size_yyx_l0': 5, 'hidden_size_yyx_l1': 6, 'context_size_yyx': 2, 'num_mix_components_yyx': 5, 'context_extractor_yyx': 'gru', 'activation_func_yyx': 'Tanh', 'L2_weight_yyx': 8.28567713680158e-09, 'L_entropy_weight_yyx': 1.0634690690050587e-09, 'L_sep_weight_yyx': 1.0553632874880086e-10, 'L_scale_weight_yyx': 6.802992126133714e-05, 'learning_rate_yyx': 0.005510786677254326}. Best is trial 1 with value: -1.8501018013957466.
[I 2026-03-18 20:06:59,965] Trial 8 pruned. 
[I 2026-03-18 20:07:06,350] Trial 6 pruned. 
[I 2026-03-18 20:07:08,159] Trial 2 finished with value: -1.8520986407644122 and parameters: {'n_layers_yyx': 1, 'hidden_size_yyx_l0': 5, 'context_size_yyx': 2, 'num_mix_components_yyx': 4, 'context_extractor_yyx': 'gru', 'activation_func_yyx': 'ReLU', 'L2_weight_yyx': 1.595081617413203e-10, 'L_entropy_weight_yyx': 0.0002051823289915417, 'L_sep_weight_yyx': 7.718365774279292e-07, 'L_scale_weight_yyx': 0.0008390001910365723, 'learning_rate_yyx': 0.0035871561382210585}. Best is trial 0 with value: -1.8605448616434945.
[I 2026-03-18 20:07:26,446] Trial 3 pruned. 
[I 2026-03-18 20:07:44,117] Trial 3 finished with value: -1.91396588532089 and parameters: {'n_layers_yyx': 2, 'hidden_size_yyx_l0': 3, 'hidden_size_yyx_l1': 5, 'context_size_yyx': 1, 'num_mix_components_yyx': 3, 'context_extractor_yyx': 'lstm', 'activation_func_yyx': 'GELU', 'L2_weight_yyx': 8.423662455639668e-06, 'L_entropy_weight_yyx': 2.3250108174543954e-05, 'L_sep_weight_yyx': 3.652111159722789e-08, 'L_scale_weight_yyx': 5.7807458000907427e-05, 'learning_rate_yyx': 0.005323261402193024}. Best is trial 0 with value: -1.9368961358079142.
[I 2026-03-18 20:08:27,730] Trial 9 pruned. 
[I 2026-03-18 20:08:35,394] Trial 5 pruned. 
[I 2026-03-18 20:08:48,969] Trial 10 finished with value: -2.472539193557742 and parameters: {'n_layers_yyx': 1, 'hidden_size_yyx_l0': 6, 'context_size_yyx': 3, 'num_mix_components_yyx': 5, 'context_extractor_yyx': 'gru', 'activation_func_yyx': 'ReLU', 'L2_weight_yyx': 1.203488743521635e-07, 'L_entropy_weight_yyx': 7.809068976493586e-09, 'L_sep_weight_yyx': 1.1928555911977857e-05, 'L_scale_weight_yyx': 0.0004914141159933781, 'learning_rate_yyx': 0.008954585927112877}. Best is trial 5 with value: -2.4735891998725372.
[I 2026-03-18 20:08:50,601] Trial 4 pruned. 
[I 2026-03-18 20:08:57,255] Trial 6 finished with value: -1.499344835125032 and parameters: {'n_layers_yyx': 2, 'hidden_size_yyx_l0': 5, 'hidden_size_yyx_l1': 2, 'context_size_yyx': 2, 'num_mix_components_yyx': 2, 'context_extractor_yyx': 'lstm', 'activation_func_yyx': 'Tanh', 'L2_weight_yyx': 0.0004809099247036992, 'L_entropy_weight_yyx': 7.492999071659962e-05, 'L_sep_weight_yyx': 3.8241385191682807e-08, 'L_scale_weight_yyx': 1.3048698512824662e-06, 'learning_rate_yyx': 0.006861784607541045}. Best is trial 0 with value: -1.5190498727266906.
[I 2026-03-18 20:08:59,538] Trial 4 pruned. 
[I 2026-03-18 20:09:32,169] Trial 3 finished with value: -1.884195547524421 and parameters: {'n_layers_yyx': 2, 'hidden_size_yyx_l0': 6, 'hidden_size_yyx_l1': 5, 'context_size_yyx': 2, 'num_mix_components_yyx': 3, 'context_extractor_yyx': 'gru', 'activation_func_yyx': 'Tanh', 'L2_weight_yyx': 1.5514793172035885e-06, 'L_entropy_weight_yyx': 4.192262173461049e-09, 'L_sep_weight_yyx': 1.3076886599939138e-08, 'L_scale_weight_yyx': 4.32334888052951e-05, 'learning_rate_yyx': 0.0008737263061434847}. Best is trial 1 with value: -1.8872232450699569.
[I 2026-03-18 20:09:42,446] Trial 10 pruned. 
[I 2026-03-18 20:09:44,817] Trial 6 pruned. 
[I 2026-03-18 20:09:45,327] Trial 3 finished with value: -1.894522064033596 and parameters: {'n_layers_yyx': 1, 'hidden_size_yyx_l0': 6, 'context_size_yyx': 1, 'num_mix_components_yyx': 2, 'context_extractor_yyx': 'lstm', 'activation_func_yyx': 'ReLU', 'L2_weight_yyx': 1.1642170597235294e-07, 'L_entropy_weight_yyx': 3.2448140192621675e-09, 'L_sep_weight_yyx': 5.828539687194277e-07, 'L_scale_weight_yyx': 3.3493097744608614e-08, 'learning_rate_yyx': 0.004857742563504299}. Best is trial 1 with value: -1.8963288822393307.
[I 2026-03-18 20:09:45,399] Trial 8 finished with value: -1.44368484784972 and parameters: {'n_layers_yyx': 2, 'hidden_size_yyx_l0': 4, 'hidden_size_yyx_l1': 6, 'context_size_yyx': 4, 'num_mix_components_yyx': 4, 'context_extractor_yyx': 'lstm', 'activation_func_yyx': 'GELU', 'L2_weight_yyx': 0.00037095984258173824, 'L_entropy_weight_yyx': 9.099853135407589e-06, 'L_sep_weight_yyx': 1.5739408326830096e-06, 'L_scale_weight_yyx': 6.683818049169422e-05, 'learning_rate_yyx': 0.0007802923382339283}. Best is trial 0 with value: -1.4467010977883008.
[I 2026-03-18 20:10:12,965] Trial 5 pruned. 
[I 2026-03-18 20:10:16,365] Trial 2 pruned. 
[I 2026-03-18 20:10:20,253] Trial 7 pruned. 
[I 2026-03-18 20:10:28,489] Trial 5 finished with value: -1.846272270946774 and parameters: {'n_layers_yyx': 1, 'hidden_size_yyx_l0': 3, 'context_size_yyx': 3, 'num_mix_components_yyx': 5, 'context_extractor_yyx': 'gru', 'activation_func_yyx': 'ReLU', 'L2_weight_yyx': 1.5170039848581919e-05, 'L_entropy_weight_yyx': 8.353720295371116e-07, 'L_sep_weight_yyx': 1.4933609846049407e-06, 'L_scale_weight_yyx': 4.9698027485662095e-08, 'learning_rate_yyx': 0.0038193843542618836}. Best is trial 0 with value: -1.8516305051550026.
[I 2026-03-18 20:10:58,455] Trial 4 pruned. 
[I 2026-03-18 20:11:05,132] Trial 4 finished with value: -1.4390553870567908 and parameters: {'n_layers_yyx': 1, 'hidden_size_yyx_l0': 6, 'context_size_yyx': 1, 'num_mix_components_yyx': 4, 'context_extractor_yyx': 'lstm', 'activation_func_yyx': 'GELU', 'L2_weight_yyx': 1.095443188176722e-08, 'L_entropy_weight_yyx': 7.399336321786904e-09, 'L_sep_weight_yyx': 5.3376787218982896e-08, 'L_scale_weight_yyx': 1.0031906743243826e-05, 'learning_rate_yyx': 0.004438301340094735}. Best is trial 4 with value: -1.4390553870567908.
[I 2026-03-18 20:11:12,075] Trial 7 pruned. 
[I 2026-03-18 20:11:13,527] Trial 9 pruned. 
[I 2026-03-18 20:11:25,528] Trial 2 finished with value: -1.7659420868844697 and parameters: {'n_layers_yyx': 2, 'hidden_size_yyx_l0': 5, 'hidden_size_yyx_l1': 2, 'context_size_yyx': 1, 'num_mix_components_yyx': 1, 'context_extractor_yyx': 'lstm', 'activation_func_yyx': 'Tanh', 'L2_weight_yyx': 1.4534667242036075e-05, 'L_entropy_weight_yyx': 0.0002532727825434566, 'L_sep_weight_yyx': 1.7272281277754597e-10, 'L_scale_weight_yyx': 1.4057210921227872e-08, 'learning_rate_yyx': 0.000985291945227459}. Best is trial 0 with value: -1.7772347005208333.
[I 2026-03-18 20:11:29,633] Trial 3 pruned. 
[I 2026-03-18 20:12:24,244] Trial 8 pruned. 
[I 2026-03-18 20:12:29,225] Trial 4 finished with value: -2.444135434965005 and parameters: {'n_layers_yyx': 1, 'hidden_size_yyx_l0': 3, 'context_size_yyx': 3, 'num_mix_components_yyx': 3, 'context_extractor_yyx': 'lstm', 'activation_func_yyx': 'GELU', 'L2_weight_yyx': 3.202267599220937e-09, 'L_entropy_weight_yyx': 2.273484244044398e-05, 'L_sep_weight_yyx': 3.796656141843916e-05, 'L_scale_weight_yyx': 1.0311348389048146e-08, 'learning_rate_yyx': 0.0011632370814129397}. Best is trial 1 with value: -2.4633966237885176.
[I 2026-03-18 20:12:44,669] Trial 5 finished with value: -2.4528247401725114 and parameters: {'n_layers_yyx': 1, 'hidden_size_yyx_l0': 5, 'context_size_yyx': 3, 'num_mix_components_yyx': 4, 'context_extractor_yyx': 'gru', 'activation_func_yyx': 'GELU', 'L2_weight_yyx': 3.396762602255725e-07, 'L_entropy_weight_yyx': 7.225485664486228e-05, 'L_sep_weight_yyx': 0.0007691194451270155, 'L_scale_weight_yyx': 3.979811533680482e-08, 'learning_rate_yyx': 0.0013341329224253336}. Best is trial 0 with value: -2.4805296636382916.
[I 2026-03-18 20:12:51,811] Trial 6 pruned. 
[I 2026-03-18 20:13:01,600] Trial 5 finished with value: -1.4022024301382212 and parameters: {'n_layers_yyx': 2, 'hidden_size_yyx_l0': 5, 'hidden_size_yyx_l1': 6, 'context_size_yyx': 2, 'num_mix_components_yyx': 3, 'context_extractor_yyx': 'gru', 'activation_func_yyx': 'Tanh', 'L2_weight_yyx': 5.127595904822669e-10, 'L_entropy_weight_yyx': 3.137937098777025e-07, 'L_sep_weight_yyx': 1.8297412101152001e-09, 'L_scale_weight_yyx': 3.381360277893867e-10, 'learning_rate_yyx': 0.0012380616833701928}. Best is trial 1 with value: -1.4345258507361778.
[I 2026-03-18 20:13:04,669] Trial 3 finished with value: -1.40271482027494 and parameters: {'n_layers_yyx': 2, 'hidden_size_yyx_l0': 2, 'hidden_size_yyx_l1': 5, 'context_size_yyx': 1, 'num_mix_components_yyx': 2, 'context_extractor_yyx': 'gru', 'activation_func_yyx': 'ReLU', 'L2_weight_yyx': 0.0007498580363948868, 'L_entropy_weight_yyx': 5.645553239815003e-06, 'L_sep_weight_yyx': 1.5679381917928336e-09, 'L_scale_weight_yyx': 0.0009288310030430562, 'learning_rate_yyx': 0.001377634885471125}. Best is trial 3 with value: -1.40271482027494.
[I 2026-03-18 20:13:27,296] Trial 10 pruned. 
[I 2026-03-18 20:14:10,858] Trial 4 finished with value: -2.49523174750643 and parameters: {'n_layers_yyx': 1, 'hidden_size_yyx_l0': 4, 'context_size_yyx': 1, 'num_mix_components_yyx': 5, 'context_extractor_yyx': 'gru', 'activation_func_yyx': 'GELU', 'L2_weight_yyx': 9.610755044749778e-09, 'L_entropy_weight_yyx': 0.0001249702886685597, 'L_sep_weight_yyx': 2.1984074085574415e-07, 'L_scale_weight_yyx': 2.286482190887181e-08, 'learning_rate_yyx': 0.008880145441692652}. Best is trial 4 with value: -2.49523174750643.
[I 2026-03-18 20:14:14,269] Trial 7 pruned. 
[I 2026-03-18 20:14:27,314] Trial 4 pruned. 
[I 2026-03-18 20:14:28,292] Trial 4 finished with value: -1.4257766958383413 and parameters: {'n_layers_yyx': 2, 'hidden_size_yyx_l0': 6, 'hidden_size_yyx_l1': 6, 'context_size_yyx': 1, 'num_mix_components_yyx': 2, 'context_extractor_yyx': 'gru', 'activation_func_yyx': 'GELU', 'L2_weight_yyx': 0.00023758643252029405, 'L_entropy_weight_yyx': 2.6125463027100404e-05, 'L_sep_weight_yyx': 2.7820259604166383e-08, 'L_scale_weight_yyx': 0.000514158693622417, 'learning_rate_yyx': 0.0032087373571948086}. Best is trial 1 with value: -1.4389243727463943.
[I 2026-03-18 20:14:43,072] Trial 11 finished with value: -2.472736010755057 and parameters: {'n_layers_yyx': 1, 'hidden_size_yyx_l0': 6, 'context_size_yyx': 3, 'num_mix_components_yyx': 5, 'context_extractor_yyx': 'gru', 'activation_func_yyx': 'ReLU', 'L2_weight_yyx': 6.454182247144926e-08, 'L_entropy_weight_yyx': 1.6433397760724687e-08, 'L_sep_weight_yyx': 1.6426079828971475e-05, 'L_scale_weight_yyx': 0.0009725429183758775, 'learning_rate_yyx': 0.009958080241602158}. Best is trial 5 with value: -2.4735891998725372.
[I 2026-03-18 20:14:48,973] Trial 3 finished with value: -1.8336437539928752 and parameters: {'n_layers_yyx': 1, 'hidden_size_yyx_l0': 6, 'context_size_yyx': 2, 'num_mix_components_yyx': 1, 'context_extractor_yyx': 'lstm', 'activation_func_yyx': 'GELU', 'L2_weight_yyx': 0.000369861705083536, 'L_entropy_weight_yyx': 1.0772633917780926e-08, 'L_sep_weight_yyx': 5.512249186386646e-08, 'L_scale_weight_yyx': 2.932451119963077e-09, 'learning_rate_yyx': 0.00633312528655813}. Best is trial 1 with value: -1.8555367853768732.
[I 2026-03-18 20:14:49,832] Trial 11 pruned. 
[I 2026-03-18 20:14:53,818] Trial 9 pruned. 
[I 2026-03-18 20:15:31,225] Trial 6 pruned. 
[I 2026-03-18 20:15:32,862] Trial 5 finished with value: -1.8368031164051672 and parameters: {'n_layers_yyx': 2, 'hidden_size_yyx_l0': 3, 'hidden_size_yyx_l1': 2, 'context_size_yyx': 3, 'num_mix_components_yyx': 1, 'context_extractor_yyx': 'gru', 'activation_func_yyx': 'Tanh', 'L2_weight_yyx': 3.4951301394884872e-06, 'L_entropy_weight_yyx': 3.0765288814191717e-07, 'L_sep_weight_yyx': 1.5378880728021319e-09, 'L_scale_weight_yyx': 3.9799456495626174e-09, 'learning_rate_yyx': 0.0009273485557408685}. Best is trial 0 with value: -1.837857802213271.
[I 2026-03-18 20:15:55,128] Trial 5 pruned. 
[I 2026-03-18 20:16:15,923] Trial 12 pruned. 
[I 2026-03-18 20:16:25,387] Trial 5 finished with value: -1.8524068619588638 and parameters: {'n_layers_yyx': 2, 'hidden_size_yyx_l0': 5, 'hidden_size_yyx_l1': 2, 'context_size_yyx': 4, 'num_mix_components_yyx': 5, 'context_extractor_yyx': 'gru', 'activation_func_yyx': 'GELU', 'L2_weight_yyx': 1.2191522192545184e-08, 'L_entropy_weight_yyx': 3.481905366697189e-05, 'L_sep_weight_yyx': 6.92783904302366e-05, 'L_scale_weight_yyx': 3.945870679704206e-10, 'learning_rate_yyx': 0.0007443446878341422}. Best is trial 0 with value: -1.8528113520484126.
[I 2026-03-18 20:16:28,854] Trial 10 pruned. 
[I 2026-03-18 20:16:41,396] Trial 5 pruned. 
