[I 2026-03-18 22:35:28,121] Trial 55 finished with value: -2.400930198925506 and parameters: {'n_layers_yyx': 2, 'hidden_size_yyx_l0': 4, 'hidden_size_yyx_l1': 3, 'context_size_yyx': 4, 'num_mix_components_yyx': 4, 'context_extractor_yyx': 'lstm', 'activation_func_yyx': 'ReLU', 'L2_weight_yyx': 0.00019408113751166297, 'L_entropy_weight_yyx': 1.0364415226177532e-09, 'L_sep_weight_yyx': 0.0007170320186724693, 'L_scale_weight_yyx': 1.0993417498337715e-07, 'learning_rate_yyx': 0.008564229709802142}. Best is trial 55 with value: -2.400930198925506.
[I 2026-03-18 22:35:30,058] Trial 71 finished with value: -2.5412271270205946 and parameters: {'n_layers_yyx': 2, 'hidden_size_yyx_l0': 4, 'hidden_size_yyx_l1': 6, 'context_size_yyx': 4, 'num_mix_components_yyx': 4, 'context_extractor_yyx': 'lstm', 'activation_func_yyx': 'ReLU', 'L2_weight_yyx': 1.9693262469769744e-08, 'L_entropy_weight_yyx': 2.283939543305603e-08, 'L_sep_weight_yyx': 1.8495726491059717e-10, 'L_scale_weight_yyx': 1.1703595512628017e-10, 'learning_rate_yyx': 0.007771088513496373}. Best is trial 24 with value: -2.5511102316762146.
[I 2026-03-18 22:35:30,613] Trial 53 pruned. 
[I 2026-03-18 22:35:31,152] Trial 87 pruned. 
[I 2026-03-18 22:35:34,341] Trial 62 finished with value: -2.7642651627994317 and parameters: {'n_layers_yyx': 2, 'hidden_size_yyx_l0': 6, 'hidden_size_yyx_l1': 2, 'context_size_yyx': 3, 'num_mix_components_yyx': 4, 'context_extractor_yyx': 'lstm', 'activation_func_yyx': 'ReLU', 'L2_weight_yyx': 1.849613769807627e-10, 'L_entropy_weight_yyx': 0.0003964711629885357, 'L_sep_weight_yyx': 5.582865995198873e-09, 'L_scale_weight_yyx': 7.73880165837607e-06, 'learning_rate_yyx': 0.008199878451865154}. Best is trial 7 with value: -2.766072426816335.
[I 2026-03-18 22:35:37,145] Trial 63 pruned. 
[I 2026-03-18 22:35:38,716] Trial 59 pruned. 
[I 2026-03-18 22:35:41,479] Trial 61 finished with value: -2.762021238898883 and parameters: {'n_layers_yyx': 1, 'hidden_size_yyx_l0': 6, 'context_size_yyx': 4, 'num_mix_components_yyx': 4, 'context_extractor_yyx': 'gru', 'activation_func_yyx': 'ReLU', 'L2_weight_yyx': 0.0002738791186537695, 'L_entropy_weight_yyx': 0.0006264770250557783, 'L_sep_weight_yyx': 0.00024962563778314716, 'L_scale_weight_yyx': 1.0918543127857797e-06, 'learning_rate_yyx': 0.004528453022490576}. Best is trial 0 with value: -2.7678615354442075.
[I 2026-03-18 22:35:46,254] Trial 88 pruned. 
[I 2026-03-18 22:35:50,454] Trial 62 finished with value: -2.3985544071231737 and parameters: {'n_layers_yyx': 2, 'hidden_size_yyx_l0': 4, 'hidden_size_yyx_l1': 5, 'context_size_yyx': 1, 'num_mix_components_yyx': 5, 'context_extractor_yyx': 'lstm', 'activation_func_yyx': 'Tanh', 'L2_weight_yyx': 0.0003792143250516319, 'L_entropy_weight_yyx': 4.049418858379944e-08, 'L_sep_weight_yyx': 2.042721975605761e-05, 'L_scale_weight_yyx': 1.3440514821753484e-08, 'learning_rate_yyx': 0.008095781299881517}. Best is trial 11 with value: -2.4030680672323603.
[I 2026-03-18 22:35:52,786] Trial 89 pruned. 
[I 2026-03-18 22:35:58,030] Trial 55 finished with value: -2.3616885923727966 and parameters: {'n_layers_yyx': 2, 'hidden_size_yyx_l0': 3, 'hidden_size_yyx_l1': 5, 'context_size_yyx': 3, 'num_mix_components_yyx': 2, 'context_extractor_yyx': 'lstm', 'activation_func_yyx': 'ReLU', 'L2_weight_yyx': 1.6108433808989377e-05, 'L_entropy_weight_yyx': 1.846799658093037e-08, 'L_sep_weight_yyx': 1.0938887357096677e-09, 'L_scale_weight_yyx': 1.51455318352596e-08, 'learning_rate_yyx': 0.007984205037034599}. Best is trial 44 with value: -2.4022889279096553.
[I 2026-03-18 22:35:59,784] Trial 64 pruned. 
[I 2026-03-18 22:36:00,062] Trial 90 pruned. 
[I 2026-03-18 22:36:00,460] Trial 60 pruned. 
[I 2026-03-18 22:36:07,570] Trial 56 pruned. 
[I 2026-03-18 22:36:09,831] Trial 72 pruned. 
[I 2026-03-18 22:36:10,243] Trial 65 pruned. 
[I 2026-03-18 22:36:14,142] Trial 73 pruned. 
[I 2026-03-18 22:36:14,903] Trial 91 pruned. 
[I 2026-03-18 22:36:16,602] Trial 54 pruned. 
[I 2026-03-18 22:36:22,537] Trial 57 pruned. 
[I 2026-03-18 22:36:22,596] Trial 61 pruned. 
[I 2026-03-18 22:36:27,478] Trial 41 pruned. 
[I 2026-03-18 22:36:34,441] Trial 55 pruned. 
[I 2026-03-18 22:36:39,291] Trial 58 pruned. 
[I 2026-03-18 22:36:42,065] Trial 56 pruned. 
[I 2026-03-18 22:36:45,450] Trial 62 pruned. 
[I 2026-03-18 22:36:45,736] Trial 57 finished with value: -2.3947384280977353 and parameters: {'n_layers_yyx': 2, 'hidden_size_yyx_l0': 6, 'hidden_size_yyx_l1': 3, 'context_size_yyx': 4, 'num_mix_components_yyx': 4, 'context_extractor_yyx': 'lstm', 'activation_func_yyx': 'GELU', 'L2_weight_yyx': 0.00016670004437221092, 'L_entropy_weight_yyx': 1.549969784629606e-05, 'L_sep_weight_yyx': 7.279987972789202e-05, 'L_scale_weight_yyx': 1.804005001167154e-05, 'learning_rate_yyx': 0.0062636908889512665}. Best is trial 53 with value: -2.4049037025927396.
[I 2026-03-18 22:36:46,699] Trial 59 pruned. 
[I 2026-03-18 22:36:50,181] Trial 57 pruned. 
[I 2026-03-18 22:36:54,563] Trial 63 pruned. 
[I 2026-03-18 22:37:00,102] Trial 58 pruned. 
[I 2026-03-18 22:37:00,887] Trial 63 finished with value: -2.3988524013774515 and parameters: {'n_layers_yyx': 2, 'hidden_size_yyx_l0': 4, 'hidden_size_yyx_l1': 5, 'context_size_yyx': 1, 'num_mix_components_yyx': 5, 'context_extractor_yyx': 'lstm', 'activation_func_yyx': 'Tanh', 'L2_weight_yyx': 0.0003790527661663115, 'L_entropy_weight_yyx': 1.2116123335663389e-07, 'L_sep_weight_yyx': 0.00019385452099885886, 'L_scale_weight_yyx': 2.1546378085687088e-08, 'learning_rate_yyx': 0.008829457389268892}. Best is trial 11 with value: -2.4030680672323603.
[I 2026-03-18 22:37:04,317] Trial 64 pruned. 
[I 2026-03-18 22:37:13,294] Trial 62 finished with value: -2.766711041032414 and parameters: {'n_layers_yyx': 2, 'hidden_size_yyx_l0': 5, 'hidden_size_yyx_l1': 6, 'context_size_yyx': 4, 'num_mix_components_yyx': 4, 'context_extractor_yyx': 'gru', 'activation_func_yyx': 'ReLU', 'L2_weight_yyx': 1.7981678676553913e-08, 'L_entropy_weight_yyx': 0.00017893125111046514, 'L_sep_weight_yyx': 0.00011688749085325639, 'L_scale_weight_yyx': 0.000868866038305425, 'learning_rate_yyx': 0.007760604713682399}. Best is trial 0 with value: -2.7678615354442075.
[I 2026-03-18 22:37:13,675] Trial 65 pruned. 
[I 2026-03-18 22:37:15,542] Trial 73 finished with value: -2.539683586895515 and parameters: {'n_layers_yyx': 2, 'hidden_size_yyx_l0': 4, 'hidden_size_yyx_l1': 6, 'context_size_yyx': 4, 'num_mix_components_yyx': 4, 'context_extractor_yyx': 'lstm', 'activation_func_yyx': 'ReLU', 'L2_weight_yyx': 1.4085869700940047e-08, 'L_entropy_weight_yyx': 7.819455343223883e-08, 'L_sep_weight_yyx': 2.8609731555795577e-10, 'L_scale_weight_yyx': 4.378117263101377e-10, 'learning_rate_yyx': 0.009133059730005279}. Best is trial 24 with value: -2.5511102316762146.

Source events: 20158
Target events: 1872
Full model ln_yyx : 159.47269 nats/sec, 76.66956 nats/event
Full model Log loss : -2.55111
Full model ln_yyx : 157.03002 nats/sec, 75.49520 nats/event
Full model Log loss : -2.53304
Full model ln_yyx : 158.88324 nats/sec, 76.38618 nats/event
Full model Log loss : -2.54116
Full model ln_yyx : 157.95385 nats/sec, 75.93935 nats/event
Full model Log loss : -2.55074
Full model ln_yyx : 159.05362 nats/sec, 76.46808 nats/event
Full model Log loss : -2.54724
Full model ln_yyx : 158.20818 nats/sec, 76.06163 nats/event
Full model Log loss : -2.54778
Full model ln_yyx : 159.55589 nats/sec, 76.70956 nats/event
Full model Log loss : -2.53925
Full model ln_yyx : 158.61264 nats/sec, 76.25608 nats/event
Full model Log loss : -2.53666
Full model ln_yyx : 158.84351 nats/sec, 76.36707 nats/event
Full model Log loss : -2.54167
Full model ln_yyx : 158.61114 nats/sec, 76.25535 nats/event
Full model Log loss : -2.54123
Full model ln_yyx : 158.70171 nats/sec, 76.29890 nats/event
Full model Log loss : -2.53968
Optimization finished. Config saved to results/opt-full/opt_full_164_best_config.txt
[I 2026-03-18 22:37:20,002] Trial 92 finished with value: -2.3979629039030432 and parameters: {'n_layers_yyx': 1, 'hidden_size_yyx_l0': 5, 'context_size_yyx': 4, 'num_mix_components_yyx': 4, 'context_extractor_yyx': 'gru', 'activation_func_yyx': 'Tanh', 'L2_weight_yyx': 9.677513006440433e-06, 'L_entropy_weight_yyx': 3.776783223576652e-07, 'L_sep_weight_yyx': 1.1640278911679367e-05, 'L_scale_weight_yyx': 3.592909216144175e-07, 'learning_rate_yyx': 0.009219969031574446}. Best is trial 0 with value: -2.4076941594397367.

Source events: 20158
Target events: 18269
Full model ln_yyx : 1512.69520 nats/sec, 74.52108 nats/event
Full model Log loss : -2.39611
Full model ln_yyx : 1510.71242 nats/sec, 74.42340 nats/event
Full model Log loss : -2.39299
Full model ln_yyx : 1505.33805 nats/sec, 74.15864 nats/event
Full model Log loss : -2.39766
Full model ln_yyx : 1514.39189 nats/sec, 74.60467 nats/event
Full model Log loss : -2.39734
Full model ln_yyx : 1500.63611 nats/sec, 73.92701 nats/event
Full model Log loss : -2.39720
Full model ln_yyx : 1503.58219 nats/sec, 74.07214 nats/event
Full model Log loss : -2.39773
Full model ln_yyx : 1504.93660 nats/sec, 74.13887 nats/event
Full model Log loss : -2.39778
Full model ln_yyx : 1503.78331 nats/sec, 74.08205 nats/event
Full model Log loss : -2.39794
Full model ln_yyx : 1504.08876 nats/sec, 74.09710 nats/event
Full model Log loss : -2.39756
Full model ln_yyx : 1507.88046 nats/sec, 74.28389 nats/event
Full model Log loss : -2.39796
Optimization finished. Config saved to results/opt-full/opt_full_162_best_config.txt
[I 2026-03-18 22:37:22,565] Trial 42 finished with value: -2.764953724688315 and parameters: {'n_layers_yyx': 1, 'hidden_size_yyx_l0': 4, 'context_size_yyx': 4, 'num_mix_components_yyx': 5, 'context_extractor_yyx': 'lstm', 'activation_func_yyx': 'ReLU', 'L2_weight_yyx': 5.8270496947578516e-05, 'L_entropy_weight_yyx': 1.6879743414124245e-05, 'L_sep_weight_yyx': 5.4399732764473906e-06, 'L_scale_weight_yyx': 0.00018558264221428249, 'learning_rate_yyx': 0.009803510570160953}. Best is trial 8 with value: -2.7663050128086293.
[I 2026-03-18 22:37:22,919] Trial 66 finished with value: -2.765490245819092 and parameters: {'n_layers_yyx': 2, 'hidden_size_yyx_l0': 5, 'hidden_size_yyx_l1': 5, 'context_size_yyx': 4, 'num_mix_components_yyx': 5, 'context_extractor_yyx': 'gru', 'activation_func_yyx': 'GELU', 'L2_weight_yyx': 6.22628706566336e-07, 'L_entropy_weight_yyx': 3.5211513231935637e-10, 'L_sep_weight_yyx': 1.1732046385896367e-05, 'L_scale_weight_yyx': 1.0846650987793546e-07, 'learning_rate_yyx': 0.007526765846891637}. Best is trial 55 with value: -2.7679802735646564.
[I 2026-03-18 22:37:26,430] Trial 60 pruned. 
[I 2026-03-18 22:37:38,716] Trial 63 finished with value: -2.76446336007727 and parameters: {'n_layers_yyx': 2, 'hidden_size_yyx_l0': 6, 'hidden_size_yyx_l1': 2, 'context_size_yyx': 3, 'num_mix_components_yyx': 4, 'context_extractor_yyx': 'lstm', 'activation_func_yyx': 'ReLU', 'L2_weight_yyx': 2.620797105460802e-10, 'L_entropy_weight_yyx': 8.314261907991979e-05, 'L_sep_weight_yyx': 6.102641930262892e-09, 'L_scale_weight_yyx': 5.477240243433059e-05, 'learning_rate_yyx': 0.006531621950956166}. Best is trial 7 with value: -2.766072426816335.
[I 2026-03-18 22:37:49,263] Trial 56 finished with value: -2.3910745161007614 and parameters: {'n_layers_yyx': 2, 'hidden_size_yyx_l0': 4, 'hidden_size_yyx_l1': 6, 'context_size_yyx': 3, 'num_mix_components_yyx': 2, 'context_extractor_yyx': 'lstm', 'activation_func_yyx': 'ReLU', 'L2_weight_yyx': 1.6787391553531606e-06, 'L_entropy_weight_yyx': 1.3465894831621805e-09, 'L_sep_weight_yyx': 1.952806997196306e-10, 'L_scale_weight_yyx': 5.930887490986196e-10, 'learning_rate_yyx': 0.006216722584174905}. Best is trial 44 with value: -2.4022889279096553.
[I 2026-03-18 22:37:59,821] Trial 64 pruned. 
[I 2026-03-18 22:38:00,158] Trial 64 finished with value: -2.3867780797391696 and parameters: {'n_layers_yyx': 2, 'hidden_size_yyx_l0': 4, 'hidden_size_yyx_l1': 6, 'context_size_yyx': 1, 'num_mix_components_yyx': 5, 'context_extractor_yyx': 'lstm', 'activation_func_yyx': 'Tanh', 'L2_weight_yyx': 6.837190458196586e-05, 'L_entropy_weight_yyx': 1.2196460431091434e-07, 'L_sep_weight_yyx': 0.0002135877880375905, 'L_scale_weight_yyx': 2.7984548566475174e-08, 'learning_rate_yyx': 0.009025947842940507}. Best is trial 11 with value: -2.4030680672323603.
[I 2026-03-18 22:38:03,016] Trial 74 finished with value: -2.7617659461689503 and parameters: {'n_layers_yyx': 2, 'hidden_size_yyx_l0': 3, 'hidden_size_yyx_l1': 4, 'context_size_yyx': 3, 'num_mix_components_yyx': 3, 'context_extractor_yyx': 'lstm', 'activation_func_yyx': 'Tanh', 'L2_weight_yyx': 0.0006171722044003242, 'L_entropy_weight_yyx': 3.4705347341383513e-09, 'L_sep_weight_yyx': 7.859873252356857e-06, 'L_scale_weight_yyx': 8.211926540687081e-10, 'learning_rate_yyx': 0.005868128976705449}. Best is trial 25 with value: -2.762886536950096.
[I 2026-03-18 22:38:13,328] Trial 66 finished with value: -2.751478050001222 and parameters: {'n_layers_yyx': 2, 'hidden_size_yyx_l0': 5, 'hidden_size_yyx_l1': 6, 'context_size_yyx': 1, 'num_mix_components_yyx': 1, 'context_extractor_yyx': 'gru', 'activation_func_yyx': 'ReLU', 'L2_weight_yyx': 6.70655845654245e-08, 'L_entropy_weight_yyx': 3.718055963924475e-05, 'L_sep_weight_yyx': 4.392692348703103e-09, 'L_scale_weight_yyx': 2.253030894679119e-08, 'learning_rate_yyx': 0.00995440034150932}. Best is trial 6 with value: -2.7665796528518882.
[I 2026-03-18 22:38:16,635] Trial 43 pruned. 
[I 2026-03-18 22:38:23,212] Trial 59 finished with value: -2.394277884405272 and parameters: {'n_layers_yyx': 2, 'hidden_size_yyx_l0': 6, 'hidden_size_yyx_l1': 4, 'context_size_yyx': 4, 'num_mix_components_yyx': 4, 'context_extractor_yyx': 'lstm', 'activation_func_yyx': 'ReLU', 'L2_weight_yyx': 0.00043331659854701555, 'L_entropy_weight_yyx': 3.5433114032036104e-05, 'L_sep_weight_yyx': 2.035303463821822e-06, 'L_scale_weight_yyx': 0.00022538590894196438, 'learning_rate_yyx': 0.00840570795560177}. Best is trial 53 with value: -2.4049037025927396.
[I 2026-03-18 22:38:30,587] Trial 67 pruned. 
[I 2026-03-18 22:38:37,518] Trial 58 finished with value: -2.430235459017205 and parameters: {'n_layers_yyx': 1, 'hidden_size_yyx_l0': 5, 'context_size_yyx': 3, 'num_mix_components_yyx': 2, 'context_extractor_yyx': 'gru', 'activation_func_yyx': 'Tanh', 'L2_weight_yyx': 0.00014381548243591356, 'L_entropy_weight_yyx': 2.4391552878372585e-09, 'L_sep_weight_yyx': 5.1022496825469185e-09, 'L_scale_weight_yyx': 6.792968383049488e-08, 'learning_rate_yyx': 0.00876436123778875}. Best is trial 24 with value: -2.4319235459143473.
[I 2026-03-18 22:38:37,668] Trial 63 finished with value: -2.766508888906413 and parameters: {'n_layers_yyx': 2, 'hidden_size_yyx_l0': 5, 'hidden_size_yyx_l1': 6, 'context_size_yyx': 4, 'num_mix_components_yyx': 4, 'context_extractor_yyx': 'gru', 'activation_func_yyx': 'ReLU', 'L2_weight_yyx': 1.644295995391149e-08, 'L_entropy_weight_yyx': 0.0001434108464980948, 'L_sep_weight_yyx': 0.0004079620005010468, 'L_scale_weight_yyx': 0.0009688214474430465, 'learning_rate_yyx': 0.007748760711126874}. Best is trial 0 with value: -2.7678615354442075.
[I 2026-03-18 22:38:42,234] Trial 68 pruned. 
[I 2026-03-18 22:38:43,454] Trial 59 pruned. 
[I 2026-03-18 22:38:43,795] Trial 65 pruned. 
[I 2026-03-18 22:38:45,356] Trial 61 finished with value: -2.3906118171568744 and parameters: {'n_layers_yyx': 2, 'hidden_size_yyx_l0': 4, 'hidden_size_yyx_l1': 4, 'context_size_yyx': 4, 'num_mix_components_yyx': 3, 'context_extractor_yyx': 'lstm', 'activation_func_yyx': 'ReLU', 'L2_weight_yyx': 0.0009103986467406964, 'L_entropy_weight_yyx': 1.0491556122273856e-10, 'L_sep_weight_yyx': 4.61570554354827e-05, 'L_scale_weight_yyx': 1.6225495287170525e-07, 'learning_rate_yyx': 0.008745538863546285}. Best is trial 55 with value: -2.400930198925506.
[I 2026-03-18 22:38:48,998] Trial 60 pruned. 
[I 2026-03-18 22:38:52,939] Trial 65 pruned. 
[I 2026-03-18 22:38:54,656] Trial 61 pruned. 
[I 2026-03-18 22:38:56,790] Trial 75 pruned. 
[I 2026-03-18 22:39:11,674] Trial 57 finished with value: -2.385216549604367 and parameters: {'n_layers_yyx': 2, 'hidden_size_yyx_l0': 4, 'hidden_size_yyx_l1': 5, 'context_size_yyx': 3, 'num_mix_components_yyx': 4, 'context_extractor_yyx': 'lstm', 'activation_func_yyx': 'ReLU', 'L2_weight_yyx': 1.2914704150681894e-07, 'L_entropy_weight_yyx': 1.1624269087439382e-08, 'L_sep_weight_yyx': 2.0625167512484146e-10, 'L_scale_weight_yyx': 2.5988515303108333e-09, 'learning_rate_yyx': 0.007074552241359429}. Best is trial 44 with value: -2.4022889279096553.
[I 2026-03-18 22:39:13,131] Trial 44 pruned. 
[I 2026-03-18 22:39:15,318] Trial 60 finished with value: -2.3945655343102468 and parameters: {'n_layers_yyx': 2, 'hidden_size_yyx_l0': 6, 'hidden_size_yyx_l1': 3, 'context_size_yyx': 4, 'num_mix_components_yyx': 5, 'context_extractor_yyx': 'lstm', 'activation_func_yyx': 'GELU', 'L2_weight_yyx': 0.00011825754223899102, 'L_entropy_weight_yyx': 9.510009290727498e-05, 'L_sep_weight_yyx': 0.00029063496978230444, 'L_scale_weight_yyx': 0.0008517089270492714, 'learning_rate_yyx': 0.007632278588944613}. Best is trial 53 with value: -2.4049037025927396.
[I 2026-03-18 22:39:21,866] Trial 45 pruned. 
[I 2026-03-18 22:39:26,310] Trial 58 pruned. 
[I 2026-03-18 22:39:26,595] Trial 66 pruned. 
[I 2026-03-18 22:39:27,160] Trial 62 pruned. 
[I 2026-03-18 22:39:28,564] Trial 61 pruned. 
[I 2026-03-18 22:39:33,749] Trial 67 pruned. 
[I 2026-03-18 22:39:46,548] Trial 66 pruned. 

Source events: 39192
Target events: 12731
Full model ln_yyx : 2274.09171 nats/sec, 160.76369 nats/event
Full model Log loss : -2.73210
Full model ln_yyx : 2317.10357 nats/sec, 163.80435 nats/event
Full model Log loss : -2.76270
Full model ln_yyx : 2272.28908 nats/sec, 160.63626 nats/event
Full model Log loss : -2.72935
Full model ln_yyx : 2312.19096 nats/sec, 163.45706 nats/event
Full model Log loss : -2.75665
Full model ln_yyx : 2296.97111 nats/sec, 162.38112 nats/event
Full model Log loss : -2.75822
Full model ln_yyx : 2306.31246 nats/sec, 163.04149 nats/event
Full model Log loss : -2.76326
Full model ln_yyx : 2326.87594 nats/sec, 164.49520 nats/event
Full model Log loss : -2.76117
Full model ln_yyx : 2304.17668 nats/sec, 162.89050 nats/event
Full model Log loss : -2.76427
Full model ln_yyx : 2299.89802 nats/sec, 162.58803 nats/event
Full model Log loss : -2.76446
Optimization finished. Config saved to results/opt-full/opt_full_171_best_config.txt
[I 2026-03-18 22:39:50,335] Trial 68 pruned. 
[I 2026-03-18 22:39:51,764] Trial 69 finished with value: -2.7667562484741213 and parameters: {'n_layers_yyx': 2, 'hidden_size_yyx_l0': 6, 'hidden_size_yyx_l1': 5, 'context_size_yyx': 4, 'num_mix_components_yyx': 5, 'context_extractor_yyx': 'gru', 'activation_func_yyx': 'GELU', 'L2_weight_yyx': 6.6189493132832105e-06, 'L_entropy_weight_yyx': 5.907640733031178e-10, 'L_sep_weight_yyx': 2.1258877562321763e-05, 'L_scale_weight_yyx': 1.637543215558078e-08, 'learning_rate_yyx': 0.008252088075775321}. Best is trial 55 with value: -2.7679802735646564.
[I 2026-03-18 22:39:54,787] Trial 64 finished with value: -2.7664765668244495 and parameters: {'n_layers_yyx': 2, 'hidden_size_yyx_l0': 5, 'hidden_size_yyx_l1': 6, 'context_size_yyx': 4, 'num_mix_components_yyx': 4, 'context_extractor_yyx': 'gru', 'activation_func_yyx': 'ReLU', 'L2_weight_yyx': 2.3829648578976377e-08, 'L_entropy_weight_yyx': 0.0001611544251481799, 'L_sep_weight_yyx': 0.00015193827779177202, 'L_scale_weight_yyx': 4.084250766523422e-05, 'learning_rate_yyx': 0.007717247620967761}. Best is trial 0 with value: -2.7678615354442075.
[I 2026-03-18 22:39:59,088] Trial 63 pruned. 
[I 2026-03-18 22:40:00,576] Trial 62 finished with value: -2.3914231327964868 and parameters: {'n_layers_yyx': 2, 'hidden_size_yyx_l0': 4, 'hidden_size_yyx_l1': 4, 'context_size_yyx': 4, 'num_mix_components_yyx': 3, 'context_extractor_yyx': 'lstm', 'activation_func_yyx': 'ReLU', 'L2_weight_yyx': 0.000283869376881704, 'L_entropy_weight_yyx': 1.0725356001268903e-10, 'L_sep_weight_yyx': 5.210331716130503e-05, 'L_scale_weight_yyx': 1.606615271752993e-07, 'learning_rate_yyx': 0.009198320401695834}. Best is trial 55 with value: -2.400930198925506.
[I 2026-03-18 22:40:04,371] Trial 64 pruned. 
[I 2026-03-18 22:40:07,064] Trial 59 finished with value: -2.3584638077173476 and parameters: {'n_layers_yyx': 2, 'hidden_size_yyx_l0': 3, 'hidden_size_yyx_l1': 5, 'context_size_yyx': 3, 'num_mix_components_yyx': 2, 'context_extractor_yyx': 'lstm', 'activation_func_yyx': 'ReLU', 'L2_weight_yyx': 3.861843568274883e-06, 'L_entropy_weight_yyx': 1.433936129682691e-10, 'L_sep_weight_yyx': 2.758579818264188e-10, 'L_scale_weight_yyx': 4.1618534224974283e-10, 'learning_rate_yyx': 0.005453913878113362}. Best is trial 44 with value: -2.4022889279096553.
[I 2026-03-18 22:40:09,577] Trial 65 pruned. 
[I 2026-03-18 22:40:11,690] Trial 70 pruned. 
[I 2026-03-18 22:40:12,340] Trial 63 pruned. 
[I 2026-03-18 22:40:14,789] Trial 76 finished with value: -2.762550313205005 and parameters: {'n_layers_yyx': 2, 'hidden_size_yyx_l0': 3, 'hidden_size_yyx_l1': 4, 'context_size_yyx': 3, 'num_mix_components_yyx': 3, 'context_extractor_yyx': 'lstm', 'activation_func_yyx': 'Tanh', 'L2_weight_yyx': 0.0002670048797620436, 'L_entropy_weight_yyx': 5.866472260963167e-10, 'L_sep_weight_yyx': 8.356009427899068e-06, 'L_scale_weight_yyx': 5.8477569817052784e-06, 'learning_rate_yyx': 0.009997657108841526}. Best is trial 25 with value: -2.762886536950096.
[I 2026-03-18 22:40:24,882] Trial 77 pruned. 
[I 2026-03-18 22:40:30,818] Trial 71 pruned. 
