[I 2026-03-18 21:17:09,613] Trial 22 finished with value: -2.493565894806818 and parameters: {'n_layers_yyx': 1, 'hidden_size_yyx_l0': 6, 'context_size_yyx': 4, 'num_mix_components_yyx': 5, 'context_extractor_yyx': 'gru', 'activation_func_yyx': 'GELU', 'L2_weight_yyx': 2.4565137787656618e-09, 'L_entropy_weight_yyx': 0.0002295588856119021, 'L_sep_weight_yyx': 1.242093620723138e-10, 'L_scale_weight_yyx': 4.208033557822789e-07, 'learning_rate_yyx': 0.006719804434220734}. Best is trial 4 with value: -2.49523174750643.
[I 2026-03-18 21:17:11,288] Trial 26 pruned. 
[I 2026-03-18 21:17:12,728] Trial 30 pruned. 
[I 2026-03-18 21:17:12,802] Trial 23 finished with value: -1.9385180906497104 and parameters: {'n_layers_yyx': 1, 'hidden_size_yyx_l0': 4, 'context_size_yyx': 4, 'num_mix_components_yyx': 2, 'context_extractor_yyx': 'gru', 'activation_func_yyx': 'ReLU', 'L2_weight_yyx': 6.703058495348277e-08, 'L_entropy_weight_yyx': 1.3392405149142206e-08, 'L_sep_weight_yyx': 2.534918958497594e-05, 'L_scale_weight_yyx': 1.9327176339145054e-05, 'learning_rate_yyx': 0.005591383529959121}. Best is trial 10 with value: -1.9395614910230956.
[I 2026-03-18 21:17:15,574] Trial 20 pruned. 
[I 2026-03-18 21:17:17,148] Trial 16 pruned. 
[I 2026-03-18 21:17:18,693] Trial 28 pruned. 
[I 2026-03-18 21:17:19,338] Trial 33 pruned. 
[I 2026-03-18 21:17:19,385] Trial 27 pruned. 
[I 2026-03-18 21:17:20,491] Trial 30 pruned. 
[I 2026-03-18 21:17:21,522] Trial 29 finished with value: -1.8970592542626392 and parameters: {'n_layers_yyx': 2, 'hidden_size_yyx_l0': 4, 'hidden_size_yyx_l1': 5, 'context_size_yyx': 4, 'num_mix_components_yyx': 5, 'context_extractor_yyx': 'lstm', 'activation_func_yyx': 'Tanh', 'L2_weight_yyx': 2.1189454946870003e-06, 'L_entropy_weight_yyx': 2.0250171191661938e-07, 'L_sep_weight_yyx': 2.4959826394548364e-09, 'L_scale_weight_yyx': 4.801301336833327e-09, 'learning_rate_yyx': 0.007285581735818003}. Best is trial 29 with value: -1.8970592542626392.
[I 2026-03-18 21:17:30,365] Trial 24 pruned. 
[I 2026-03-18 21:17:40,564] Trial 30 pruned. 
[I 2026-03-18 21:17:40,622] Trial 38 finished with value: -1.3993723134525486 and parameters: {'n_layers_yyx': 1, 'hidden_size_yyx_l0': 3, 'context_size_yyx': 2, 'num_mix_components_yyx': 2, 'context_extractor_yyx': 'gru', 'activation_func_yyx': 'Tanh', 'L2_weight_yyx': 4.199290978198782e-08, 'L_entropy_weight_yyx': 2.3820793683736186e-10, 'L_sep_weight_yyx': 2.0495008464532053e-09, 'L_scale_weight_yyx': 9.762247105081327e-09, 'learning_rate_yyx': 0.008605813017249562}. Best is trial 0 with value: -1.5190498727266906.
[I 2026-03-18 21:17:40,630] Trial 28 pruned. 
[I 2026-03-18 21:17:48,645] Trial 28 finished with value: -1.8519393910324087 and parameters: {'n_layers_yyx': 1, 'hidden_size_yyx_l0': 5, 'context_size_yyx': 4, 'num_mix_components_yyx': 4, 'context_extractor_yyx': 'gru', 'activation_func_yyx': 'ReLU', 'L2_weight_yyx': 8.925695623141179e-08, 'L_entropy_weight_yyx': 9.159799573303534e-09, 'L_sep_weight_yyx': 2.632913688676319e-07, 'L_scale_weight_yyx': 1.0327669360121054e-08, 'learning_rate_yyx': 0.005635169066144476}. Best is trial 9 with value: -1.8570869006965198.
[I 2026-03-18 21:17:49,200] Trial 23 pruned. 
[I 2026-03-18 21:17:49,759] Trial 25 pruned. 
[I 2026-03-18 21:17:53,189] Trial 32 finished with value: -1.41792726956881 and parameters: {'n_layers_yyx': 2, 'hidden_size_yyx_l0': 6, 'hidden_size_yyx_l1': 5, 'context_size_yyx': 4, 'num_mix_components_yyx': 2, 'context_extractor_yyx': 'gru', 'activation_func_yyx': 'GELU', 'L2_weight_yyx': 9.327579681515254e-07, 'L_entropy_weight_yyx': 0.00017759143185270927, 'L_sep_weight_yyx': 5.7478954970043525e-08, 'L_scale_weight_yyx': 6.059818553775973e-10, 'learning_rate_yyx': 0.009864430965493677}. Best is trial 1 with value: -1.4389243727463943.
[I 2026-03-18 21:17:53,922] Trial 31 pruned. 
[I 2026-03-18 21:17:54,849] Trial 13 finished with value: -1.4471351506159855 and parameters: {'n_layers_yyx': 1, 'hidden_size_yyx_l0': 5, 'context_size_yyx': 4, 'num_mix_components_yyx': 4, 'context_extractor_yyx': 'lstm', 'activation_func_yyx': 'Tanh', 'L2_weight_yyx': 4.81381438430086e-10, 'L_entropy_weight_yyx': 1.0482170101773745e-10, 'L_sep_weight_yyx': 6.549559397745092e-06, 'L_scale_weight_yyx': 0.0009915008970633162, 'learning_rate_yyx': 0.0038954281332735075}. Best is trial 12 with value: -1.460441659780649.
[I 2026-03-18 21:17:55,410] Trial 27 finished with value: -1.7822843424479167 and parameters: {'n_layers_yyx': 2, 'hidden_size_yyx_l0': 6, 'hidden_size_yyx_l1': 6, 'context_size_yyx': 2, 'num_mix_components_yyx': 5, 'context_extractor_yyx': 'gru', 'activation_func_yyx': 'GELU', 'L2_weight_yyx': 1.0246132641884815e-10, 'L_entropy_weight_yyx': 2.3578362234847302e-05, 'L_sep_weight_yyx': 1.5742247501967122e-05, 'L_scale_weight_yyx': 9.133571058324515e-07, 'learning_rate_yyx': 0.0076943970331773545}. Best is trial 4 with value: -1.7875800731928662.
[I 2026-03-18 21:18:02,038] Trial 17 pruned. 
[I 2026-03-18 21:18:10,703] Trial 29 pruned. 
[I 2026-03-18 21:18:11,224] Trial 18 finished with value: -1.8560232055410277 and parameters: {'n_layers_yyx': 2, 'hidden_size_yyx_l0': 5, 'hidden_size_yyx_l1': 6, 'context_size_yyx': 2, 'num_mix_components_yyx': 5, 'context_extractor_yyx': 'gru', 'activation_func_yyx': 'GELU', 'L2_weight_yyx': 5.28617410497325e-07, 'L_entropy_weight_yyx': 1.1669786306204317e-09, 'L_sep_weight_yyx': 1.817556587036877e-08, 'L_scale_weight_yyx': 1.0857976429356863e-06, 'learning_rate_yyx': 0.006484895696548204}. Best is trial 12 with value: -1.8566309981104903.
[I 2026-03-18 21:18:11,659] Trial 26 pruned. 
[I 2026-03-18 21:18:13,115] Trial 33 pruned. 
[I 2026-03-18 21:18:15,267] Trial 39 pruned. 
[I 2026-03-18 21:18:17,919] Trial 40 pruned. 
[I 2026-03-18 21:18:30,567] Trial 14 pruned. 
[I 2026-03-18 21:18:30,695] Trial 27 pruned. 
[I 2026-03-18 21:18:30,695] Trial 34 pruned. 
[I 2026-03-18 21:18:31,350] Trial 30 pruned. 
[I 2026-03-18 21:18:34,157] Trial 40 pruned. 
[I 2026-03-18 21:18:35,688] Trial 28 pruned. 
[I 2026-03-18 21:18:42,412] Trial 27 pruned. 
[I 2026-03-18 21:18:44,267] Trial 33 finished with value: -1.5644134304277413 and parameters: {'n_layers_yyx': 1, 'hidden_size_yyx_l0': 5, 'context_size_yyx': 2, 'num_mix_components_yyx': 2, 'context_extractor_yyx': 'lstm', 'activation_func_yyx': 'Tanh', 'L2_weight_yyx': 0.0001494092645905965, 'L_entropy_weight_yyx': 1.6010309237319275e-09, 'L_sep_weight_yyx': 6.513745180307353e-08, 'L_scale_weight_yyx': 1.755655247298702e-07, 'learning_rate_yyx': 0.009734746313252107}. Best is trial 26 with value: -1.584650032885134.
[I 2026-03-18 21:18:47,286] Trial 21 pruned. 
[I 2026-03-18 21:18:49,186] Trial 15 pruned. 
[I 2026-03-18 21:18:55,396] Trial 23 finished with value: -1.437370370718149 and parameters: {'n_layers_yyx': 2, 'hidden_size_yyx_l0': 2, 'hidden_size_yyx_l1': 5, 'context_size_yyx': 3, 'num_mix_components_yyx': 3, 'context_extractor_yyx': 'gru', 'activation_func_yyx': 'Tanh', 'L2_weight_yyx': 5.6767962541977676e-06, 'L_entropy_weight_yyx': 0.00025016327554650724, 'L_sep_weight_yyx': 1.1909626663307762e-05, 'L_scale_weight_yyx': 1.3221527748596358e-07, 'learning_rate_yyx': 0.00503948566302627}. Best is trial 13 with value: -1.4421805044320914.
[I 2026-03-18 21:18:55,829] Trial 22 finished with value: -1.86742463200896 and parameters: {'n_layers_yyx': 1, 'hidden_size_yyx_l0': 5, 'context_size_yyx': 4, 'num_mix_components_yyx': 5, 'context_extractor_yyx': 'lstm', 'activation_func_yyx': 'ReLU', 'L2_weight_yyx': 1.2622885943899204e-09, 'L_entropy_weight_yyx': 3.021665055684134e-07, 'L_sep_weight_yyx': 6.141216546695785e-06, 'L_scale_weight_yyx': 2.4886512931915138e-05, 'learning_rate_yyx': 0.009510104289435637}. Best is trial 15 with value: -1.8695785775072098.
[I 2026-03-18 21:18:56,947] Trial 41 pruned. 
[I 2026-03-18 21:18:57,167] Trial 29 pruned. 
[I 2026-03-18 21:19:03,803] Trial 28 pruned. 
[I 2026-03-18 21:19:08,923] Trial 41 pruned. 
[I 2026-03-18 21:19:08,945] Trial 28 pruned. 
[I 2026-03-18 21:19:17,379] Trial 42 pruned. 
[I 2026-03-18 21:19:18,355] Trial 20 pruned. 
[I 2026-03-18 21:19:25,097] Trial 22 pruned. 
[I 2026-03-18 21:19:25,650] Trial 38 finished with value: -1.4223504873422477 and parameters: {'n_layers_yyx': 2, 'hidden_size_yyx_l0': 5, 'hidden_size_yyx_l1': 5, 'context_size_yyx': 1, 'num_mix_components_yyx': 4, 'context_extractor_yyx': 'lstm', 'activation_func_yyx': 'ReLU', 'L2_weight_yyx': 3.6611828647570787e-07, 'L_entropy_weight_yyx': 0.00011875609253549471, 'L_sep_weight_yyx': 9.183366672707492e-08, 'L_scale_weight_yyx': 1.6454993299599955e-06, 'learning_rate_yyx': 0.008034428367043968}. Best is trial 32 with value: -1.4672450138972355.
[I 2026-03-18 21:19:26,723] Trial 31 finished with value: -1.4314755249023436 and parameters: {'n_layers_yyx': 1, 'hidden_size_yyx_l0': 6, 'context_size_yyx': 4, 'num_mix_components_yyx': 3, 'context_extractor_yyx': 'lstm', 'activation_func_yyx': 'Tanh', 'L2_weight_yyx': 5.626449149964421e-06, 'L_entropy_weight_yyx': 7.624337867449242e-05, 'L_sep_weight_yyx': 9.715191107428214e-10, 'L_scale_weight_yyx': 2.6034373938587877e-05, 'learning_rate_yyx': 0.009269379290468742}. Best is trial 7 with value: -1.4538350266676683.
[I 2026-03-18 21:19:30,893] Trial 29 pruned. 
[I 2026-03-18 21:19:31,938] Trial 31 finished with value: -1.8933903266643655 and parameters: {'n_layers_yyx': 2, 'hidden_size_yyx_l0': 3, 'hidden_size_yyx_l1': 5, 'context_size_yyx': 4, 'num_mix_components_yyx': 5, 'context_extractor_yyx': 'lstm', 'activation_func_yyx': 'Tanh', 'L2_weight_yyx': 5.481893372680532e-07, 'L_entropy_weight_yyx': 5.006281740100927e-07, 'L_sep_weight_yyx': 1.2184095891310498e-09, 'L_scale_weight_yyx': 4.520322327332365e-09, 'learning_rate_yyx': 0.007738783167113937}. Best is trial 29 with value: -1.8970592542626392.
[I 2026-03-18 21:19:37,151] Trial 30 pruned. 
[I 2026-03-18 21:19:37,784] Trial 43 pruned. 
[I 2026-03-18 21:19:40,746] Trial 30 finished with value: -1.3683214967355788 and parameters: {'n_layers_yyx': 1, 'hidden_size_yyx_l0': 6, 'context_size_yyx': 2, 'num_mix_components_yyx': 3, 'context_extractor_yyx': 'gru', 'activation_func_yyx': 'Tanh', 'L2_weight_yyx': 2.556396098155994e-06, 'L_entropy_weight_yyx': 3.072680942142215e-08, 'L_sep_weight_yyx': 1.5303017341973516e-06, 'L_scale_weight_yyx': 5.429753209318901e-10, 'learning_rate_yyx': 0.007657834774826537}. Best is trial 24 with value: -1.4518791534615763.
[I 2026-03-18 21:19:42,107] Trial 29 pruned. 
[I 2026-03-18 21:19:44,340] Trial 23 pruned. 
[I 2026-03-18 21:19:44,426] Trial 39 pruned. 
[I 2026-03-18 21:19:46,231] Trial 32 finished with value: -1.8482694195550236 and parameters: {'n_layers_yyx': 2, 'hidden_size_yyx_l0': 2, 'hidden_size_yyx_l1': 3, 'context_size_yyx': 3, 'num_mix_components_yyx': 5, 'context_extractor_yyx': 'lstm', 'activation_func_yyx': 'GELU', 'L2_weight_yyx': 3.5817785625136565e-09, 'L_entropy_weight_yyx': 0.000348743090746842, 'L_sep_weight_yyx': 4.2680163601198863e-05, 'L_scale_weight_yyx': 9.530075651221022e-10, 'learning_rate_yyx': 0.009196677188970524}. Best is trial 16 with value: -1.8488733665890609.
[I 2026-03-18 21:19:46,351] Trial 47 finished with value: -2.462787988126812 and parameters: {'n_layers_yyx': 1, 'hidden_size_yyx_l0': 5, 'context_size_yyx': 1, 'num_mix_components_yyx': 4, 'context_extractor_yyx': 'gru', 'activation_func_yyx': 'ReLU', 'L2_weight_yyx': 5.887400010099365e-07, 'L_entropy_weight_yyx': 4.0861091626781783e-07, 'L_sep_weight_yyx': 0.00015784609562962494, 'L_scale_weight_yyx': 0.0004382931486545828, 'learning_rate_yyx': 0.001052286864657406}. Best is trial 25 with value: -2.4764732316599813.
[I 2026-03-18 21:19:48,367] Trial 34 finished with value: -1.4460007887620192 and parameters: {'n_layers_yyx': 1, 'hidden_size_yyx_l0': 4, 'context_size_yyx': 4, 'num_mix_components_yyx': 4, 'context_extractor_yyx': 'lstm', 'activation_func_yyx': 'Tanh', 'L2_weight_yyx': 6.632835705754559e-05, 'L_entropy_weight_yyx': 3.258399581097074e-07, 'L_sep_weight_yyx': 3.2839895239161156e-07, 'L_scale_weight_yyx': 1.274307038013996e-09, 'learning_rate_yyx': 0.009621870060274498}. Best is trial 29 with value: -1.4683670278695913.
[I 2026-03-18 21:19:54,096] Trial 31 pruned. 
[I 2026-03-18 21:19:59,467] Trial 30 pruned. 
[I 2026-03-18 21:20:00,145] Trial 31 finished with value: -1.8452557527700342 and parameters: {'n_layers_yyx': 1, 'hidden_size_yyx_l0': 3, 'context_size_yyx': 3, 'num_mix_components_yyx': 5, 'context_extractor_yyx': 'gru', 'activation_func_yyx': 'ReLU', 'L2_weight_yyx': 1.3161587815508807e-05, 'L_entropy_weight_yyx': 4.660560772578654e-07, 'L_sep_weight_yyx': 7.129516952470528e-05, 'L_scale_weight_yyx': 2.0917816562383057e-07, 'learning_rate_yyx': 0.004035183523544773}. Best is trial 0 with value: -1.8516305051550026.
[I 2026-03-18 21:20:01,901] Trial 24 pruned. 
[I 2026-03-18 21:20:09,612] Trial 31 pruned. 
[I 2026-03-18 21:20:09,882] Trial 32 pruned. 
[I 2026-03-18 21:20:10,763] Trial 24 pruned. 
[I 2026-03-18 21:20:11,758] Trial 24 finished with value: -1.788416686395202 and parameters: {'n_layers_yyx': 2, 'hidden_size_yyx_l0': 6, 'hidden_size_yyx_l1': 3, 'context_size_yyx': 4, 'num_mix_components_yyx': 2, 'context_extractor_yyx': 'gru', 'activation_func_yyx': 'Tanh', 'L2_weight_yyx': 6.195704180216288e-06, 'L_entropy_weight_yyx': 3.9558888609244924e-10, 'L_sep_weight_yyx': 1.0784241492440653e-10, 'L_scale_weight_yyx': 8.193961913710715e-07, 'learning_rate_yyx': 0.004993728371680099}. Best is trial 16 with value: -1.790272919625947.
[I 2026-03-18 21:20:12,608] Trial 30 pruned. 
[I 2026-03-18 21:20:14,638] Trial 40 pruned. 
[I 2026-03-18 21:20:21,118] Trial 25 pruned. 
[I 2026-03-18 21:20:25,496] Trial 32 finished with value: -1.4612882173978365 and parameters: {'n_layers_yyx': 2, 'hidden_size_yyx_l0': 3, 'hidden_size_yyx_l1': 5, 'context_size_yyx': 2, 'num_mix_components_yyx': 3, 'context_extractor_yyx': 'lstm', 'activation_func_yyx': 'Tanh', 'L2_weight_yyx': 1.127674796790998e-07, 'L_entropy_weight_yyx': 2.077236172671179e-06, 'L_sep_weight_yyx': 9.308766714666409e-10, 'L_scale_weight_yyx': 4.4530693748873265e-10, 'learning_rate_yyx': 0.008897782571768955}. Best is trial 32 with value: -1.4612882173978365.
[I 2026-03-18 21:20:32,154] Trial 41 pruned. 
[I 2026-03-18 21:20:35,590] Trial 31 pruned. 
[I 2026-03-18 21:20:38,239] Trial 18 finished with value: -2.469174130241483 and parameters: {'n_layers_yyx': 2, 'hidden_size_yyx_l0': 3, 'hidden_size_yyx_l1': 5, 'context_size_yyx': 1, 'num_mix_components_yyx': 5, 'context_extractor_yyx': 'gru', 'activation_func_yyx': 'Tanh', 'L2_weight_yyx': 1.533719518404724e-08, 'L_entropy_weight_yyx': 7.461811223907995e-09, 'L_sep_weight_yyx': 2.7912816135652298e-08, 'L_scale_weight_yyx': 7.634641273910458e-07, 'learning_rate_yyx': 0.004888267284012355}. Best is trial 12 with value: -2.4732728871279206.
[I 2026-03-18 21:20:40,882] Trial 29 pruned. 
[I 2026-03-18 21:20:42,232] Trial 32 pruned. 
[I 2026-03-18 21:20:49,265] Trial 26 pruned. 
[I 2026-03-18 21:20:55,958] Trial 33 pruned. 
[I 2026-03-18 21:20:57,965] Trial 32 pruned. 
[I 2026-03-18 21:21:01,349] Trial 27 finished with value: -1.4597027822641226 and parameters: {'n_layers_yyx': 2, 'hidden_size_yyx_l0': 4, 'hidden_size_yyx_l1': 3, 'context_size_yyx': 3, 'num_mix_components_yyx': 4, 'context_extractor_yyx': 'lstm', 'activation_func_yyx': 'ReLU', 'L2_weight_yyx': 3.228738592794337e-06, 'L_entropy_weight_yyx': 1.4012111297708482e-07, 'L_sep_weight_yyx': 0.00012520927108290703, 'L_scale_weight_yyx': 4.18421713239558e-06, 'learning_rate_yyx': 0.00823701534569103}. Best is trial 27 with value: -1.4597027822641226.
[I 2026-03-18 21:21:17,748] Trial 19 pruned. 
[I 2026-03-18 21:21:21,605] Trial 31 finished with value: -1.8520417084565033 and parameters: {'n_layers_yyx': 1, 'hidden_size_yyx_l0': 5, 'context_size_yyx': 4, 'num_mix_components_yyx': 4, 'context_extractor_yyx': 'gru', 'activation_func_yyx': 'ReLU', 'L2_weight_yyx': 1.335818517351325e-07, 'L_entropy_weight_yyx': 1.1586105329402549e-10, 'L_sep_weight_yyx': 2.729705335200328e-07, 'L_scale_weight_yyx': 7.462953032487964e-09, 'learning_rate_yyx': 0.005735605585616128}. Best is trial 9 with value: -1.8570869006965198.
[I 2026-03-18 21:21:26,154] Trial 16 finished with value: -1.45559814453125 and parameters: {'n_layers_yyx': 1, 'hidden_size_yyx_l0': 5, 'context_size_yyx': 4, 'num_mix_components_yyx': 5, 'context_extractor_yyx': 'lstm', 'activation_func_yyx': 'Tanh', 'L2_weight_yyx': 2.366097468921596e-07, 'L_entropy_weight_yyx': 2.304823434443265e-08, 'L_sep_weight_yyx': 1.5192608054557012e-06, 'L_scale_weight_yyx': 1.1263066245790802e-06, 'learning_rate_yyx': 0.006501181529886178}. Best is trial 12 with value: -1.460441659780649.
[I 2026-03-18 21:21:30,377] Trial 34 pruned. 
[I 2026-03-18 21:21:36,748] Trial 35 pruned. 
[I 2026-03-18 21:21:38,856] Trial 28 pruned. 
[I 2026-03-18 21:21:44,217] Trial 42 pruned. 
[I 2026-03-18 21:21:50,443] Trial 29 finished with value: -1.8560032623142975 and parameters: {'n_layers_yyx': 2, 'hidden_size_yyx_l0': 4, 'hidden_size_yyx_l1': 4, 'context_size_yyx': 2, 'num_mix_components_yyx': 4, 'context_extractor_yyx': 'lstm', 'activation_func_yyx': 'ReLU', 'L2_weight_yyx': 2.1588912247240995e-05, 'L_entropy_weight_yyx': 1.4813465227703665e-05, 'L_sep_weight_yyx': 2.289238358819023e-07, 'L_scale_weight_yyx': 2.836957492441684e-07, 'learning_rate_yyx': 0.005674576315289253}. Best is trial 11 with value: -1.8610449438696508.
[I 2026-03-18 21:21:53,565] Trial 23 finished with value: -1.8474350701171187 and parameters: {'n_layers_yyx': 1, 'hidden_size_yyx_l0': 6, 'context_size_yyx': 3, 'num_mix_components_yyx': 4, 'context_extractor_yyx': 'lstm', 'activation_func_yyx': 'ReLU', 'L2_weight_yyx': 1.7303260454045705e-07, 'L_entropy_weight_yyx': 0.0001764240864023806, 'L_sep_weight_yyx': 0.00017975100573271296, 'L_scale_weight_yyx': 2.9114990701682355e-07, 'learning_rate_yyx': 0.00525314899602453}. Best is trial 15 with value: -1.8695785775072098.
[I 2026-03-18 21:21:53,630] Trial 22 finished with value: -1.8903964328901528 and parameters: {'n_layers_yyx': 2, 'hidden_size_yyx_l0': 3, 'hidden_size_yyx_l1': 3, 'context_size_yyx': 1, 'num_mix_components_yyx': 5, 'context_extractor_yyx': 'lstm', 'activation_func_yyx': 'Tanh', 'L2_weight_yyx': 5.105682510553787e-07, 'L_entropy_weight_yyx': 1.217171463082565e-06, 'L_sep_weight_yyx': 2.2607073663154106e-06, 'L_scale_weight_yyx': 0.000810242544615858, 'learning_rate_yyx': 0.003984791992266254}. Best is trial 5 with value: -1.89157565728699.
[I 2026-03-18 21:21:58,555] Trial 33 pruned. 
[I 2026-03-18 21:22:01,588] Trial 33 pruned. 
[I 2026-03-18 21:22:04,833] Trial 32 pruned. 
[I 2026-03-18 21:22:06,789] Trial 27 pruned. 
[I 2026-03-18 21:22:13,110] Trial 35 pruned. 
[I 2026-03-18 21:22:27,591] Trial 43 pruned. 
[I 2026-03-18 21:22:31,451] Trial 31 pruned. 
[I 2026-03-18 21:22:37,460] Trial 24 pruned. 
[I 2026-03-18 21:22:41,822] Trial 25 pruned. 
[I 2026-03-18 21:22:41,822] Trial 34 pruned. 
slurmstepd: error: *** JOB 12215379 ON p02c02 CANCELLED AT 2026-03-18T21:22:51 DUE TO TIME LIMIT ***
