[I 2026-03-18 22:44:14,844] Trial 66 finished with value: -2.3948874528633803 and parameters: {'n_layers_yyx': 2, 'hidden_size_yyx_l0': 6, 'hidden_size_yyx_l1': 4, 'context_size_yyx': 4, 'num_mix_components_yyx': 4, 'context_extractor_yyx': 'lstm', 'activation_func_yyx': 'GELU', 'L2_weight_yyx': 0.0009959219377175367, 'L_entropy_weight_yyx': 1.1977112358275692e-05, 'L_sep_weight_yyx': 0.0002229430149349842, 'L_scale_weight_yyx': 6.924124944789201e-05, 'learning_rate_yyx': 0.008887263927373495}. Best is trial 53 with value: -2.4049037025927396.
[I 2026-03-18 22:44:23,752] Trial 67 pruned. 

Source events: 20158
Target events: 13628
Full model ln_yyx : 1124.48112 nats/sec, 74.26130 nats/event
Full model Log loss : -2.39580
Full model ln_yyx : 1120.82940 nats/sec, 74.02014 nats/event
Full model Log loss : -2.39351
Full model ln_yyx : 1121.12339 nats/sec, 74.03955 nats/event
Full model Log loss : -2.39117
Full model ln_yyx : 1120.91747 nats/sec, 74.02596 nats/event
Full model Log loss : -2.39842
Full model ln_yyx : 1118.64304 nats/sec, 73.87575 nats/event
Full model Log loss : -2.36591
Full model ln_yyx : 1114.77710 nats/sec, 73.62044 nats/event
Full model Log loss : -2.36146
Full model ln_yyx : 1118.95022 nats/sec, 73.89604 nats/event
Full model Log loss : -2.40361
Full model ln_yyx : 1128.90565 nats/sec, 74.55350 nats/event
Full model Log loss : -2.40490
Full model ln_yyx : 1130.48363 nats/sec, 74.65771 nats/event
Full model Log loss : -2.40004
Full model ln_yyx : 1128.44616 nats/sec, 74.52315 nats/event
Full model Log loss : -2.39424
Full model ln_yyx : 1135.18645 nats/sec, 74.96829 nats/event
Full model Log loss : -2.39474
Full model ln_yyx : 1115.14827 nats/sec, 73.64495 nats/event
Full model Log loss : -2.39428
Full model ln_yyx : 1127.20350 nats/sec, 74.44109 nats/event
Full model Log loss : -2.39457
Full model ln_yyx : 1122.96265 nats/sec, 74.16102 nats/event
Full model Log loss : -2.40357
Full model ln_yyx : 1123.23887 nats/sec, 74.17926 nats/event
Full model Log loss : -2.40369
Full model ln_yyx : 1121.05193 nats/sec, 74.03484 nats/event
Full model Log loss : -2.40326
Full model ln_yyx : 1118.09450 nats/sec, 73.83952 nats/event
Full model Log loss : -2.40384
Full model ln_yyx : 1121.99546 nats/sec, 74.09715 nats/event
Full model Log loss : -2.39489
Optimization finished. Config saved to results/opt-full/opt_full_163_best_config.txt
[I 2026-03-18 22:44:28,095] Trial 70 pruned. 
[I 2026-03-18 22:44:44,203] Trial 71 pruned. 
[I 2026-03-18 22:44:59,331] Trial 72 finished with value: -2.766630823097587 and parameters: {'n_layers_yyx': 2, 'hidden_size_yyx_l0': 4, 'hidden_size_yyx_l1': 3, 'context_size_yyx': 3, 'num_mix_components_yyx': 4, 'context_extractor_yyx': 'gru', 'activation_func_yyx': 'Tanh', 'L2_weight_yyx': 5.056747524278874e-10, 'L_entropy_weight_yyx': 0.000448208321156497, 'L_sep_weight_yyx': 8.648695918310274e-09, 'L_scale_weight_yyx': 3.736840480318916e-08, 'learning_rate_yyx': 0.006849946777730734}. Best is trial 72 with value: -2.766630823097587.
[I 2026-03-18 22:45:05,954] Trial 73 pruned. 
[I 2026-03-18 22:45:12,613] Trial 74 pruned. 
[I 2026-03-18 22:45:19,224] Trial 75 pruned. 
[I 2026-03-18 22:45:25,764] Trial 76 pruned. 
[I 2026-03-18 22:45:41,181] Trial 77 pruned. 
[I 2026-03-18 22:45:44,275] Trial 72 finished with value: -2.7665960774442806 and parameters: {'n_layers_yyx': 2, 'hidden_size_yyx_l0': 5, 'hidden_size_yyx_l1': 6, 'context_size_yyx': 4, 'num_mix_components_yyx': 4, 'context_extractor_yyx': 'gru', 'activation_func_yyx': 'ReLU', 'L2_weight_yyx': 4.244130808776865e-08, 'L_entropy_weight_yyx': 0.00016081079646461185, 'L_sep_weight_yyx': 0.00012278837591041098, 'L_scale_weight_yyx': 4.3327908737067556e-05, 'learning_rate_yyx': 0.008169977935234787}. Best is trial 0 with value: -2.7678615354442075.

Source events: 39192
Target events: 40082
Full model ln_yyx : 7307.97653 nats/sec, 164.09308 nats/event
Full model Log loss : -2.76298
Full model ln_yyx : 7116.75912 nats/sec, 159.79949 nats/event
Full model Log loss : -2.72988
Full model ln_yyx : 7279.69690 nats/sec, 163.45809 nats/event
Full model Log loss : -2.76320
Full model ln_yyx : 7225.19951 nats/sec, 162.23441 nats/event
Full model Log loss : -2.76279
Full model ln_yyx : 7235.83571 nats/sec, 162.47323 nats/event
Full model Log loss : -2.76470
Full model ln_yyx : 7256.09490 nats/sec, 162.92813 nats/event
Full model Log loss : -2.76544
Full model ln_yyx : 7248.38681 nats/sec, 162.75506 nats/event
Full model Log loss : -2.76560
Full model ln_yyx : 7248.61090 nats/sec, 162.76009 nats/event
Full model Log loss : -2.76690
Full model ln_yyx : 7293.25395 nats/sec, 163.76250 nats/event
Full model Log loss : -2.76202
Full model ln_yyx : 7230.53240 nats/sec, 162.35415 nats/event
Full model Log loss : -2.76671
Full model ln_yyx : 7228.98904 nats/sec, 162.31950 nats/event
Full model Log loss : -2.76651
Full model ln_yyx : 7224.40309 nats/sec, 162.21653 nats/event
Full model Log loss : -2.76648
Full model ln_yyx : 7216.76534 nats/sec, 162.04503 nats/event
Full model Log loss : -2.76670
Full model ln_yyx : 7248.39554 nats/sec, 162.75525 nats/event
Full model Log loss : -2.76417
Full model ln_yyx : 7226.80641 nats/sec, 162.27049 nats/event
Full model Log loss : -2.76660
Optimization finished. Config saved to results/opt-full/opt_full_175_best_config.txt
[I 2026-03-18 22:45:47,557] Trial 51 finished with value: -2.7658621219799135 and parameters: {'n_layers_yyx': 2, 'hidden_size_yyx_l0': 3, 'hidden_size_yyx_l1': 4, 'context_size_yyx': 1, 'num_mix_components_yyx': 4, 'context_extractor_yyx': 'lstm', 'activation_func_yyx': 'Tanh', 'L2_weight_yyx': 0.0005208285195940369, 'L_entropy_weight_yyx': 6.113008358798847e-05, 'L_sep_weight_yyx': 1.0101308685708024e-05, 'L_scale_weight_yyx': 4.902235018077993e-07, 'learning_rate_yyx': 0.0017292800733652298}. Best is trial 8 with value: -2.7663050128086293.
[I 2026-03-18 22:45:47,842] Trial 78 pruned. 
[I 2026-03-18 22:45:54,024] Trial 52 pruned. 
[I 2026-03-18 22:46:02,807] Trial 79 pruned. 
[I 2026-03-18 22:46:08,946] Trial 53 pruned. 
[I 2026-03-18 22:46:15,576] Trial 54 pruned. 
[I 2026-03-18 22:46:18,168] Trial 80 pruned. 

Source events: 39192
Target events: 29032
Full model ln_yyx : 5172.77013 nats/sec, 160.35730 nats/event
Full model Log loss : -2.72661
Full model ln_yyx : 5231.01081 nats/sec, 162.16278 nats/event
Full model Log loss : -2.76526
Full model ln_yyx : 5249.20482 nats/sec, 162.72680 nats/event
Full model Log loss : -2.76513
Full model ln_yyx : 5287.56280 nats/sec, 163.91590 nats/event
Full model Log loss : -2.76133
Full model ln_yyx : 5243.11284 nats/sec, 162.53794 nats/event
Full model Log loss : -2.76593
Full model ln_yyx : 5230.54108 nats/sec, 162.14821 nats/event
Full model Log loss : -2.76633
Full model ln_yyx : 5223.23894 nats/sec, 161.92185 nats/event
Full model Log loss : -2.75486
Full model ln_yyx : 5256.56814 nats/sec, 162.95506 nats/event
Full model Log loss : -2.76429
Full model ln_yyx : 5251.70602 nats/sec, 162.80433 nats/event
Full model Log loss : -2.76513
Full model ln_yyx : 5274.50338 nats/sec, 163.51106 nats/event
Full model Log loss : -2.75148
Full model ln_yyx : 5246.69272 nats/sec, 162.64892 nats/event
Full model Log loss : -2.76353
Full model ln_yyx : 5215.04375 nats/sec, 161.66779 nats/event
Full model Log loss : -2.76628
Full model ln_yyx : 5212.64276 nats/sec, 161.59336 nats/event
Full model Log loss : -2.76663
Optimization finished. Config saved to results/opt-full/opt_full_174_best_config.txt
[I 2026-03-18 22:46:22,047] Trial 55 pruned. 
[I 2026-03-18 22:47:02,423] Trial 56 pruned. 
[I 2026-03-18 22:47:44,665] Trial 57 pruned. 
[I 2026-03-18 22:48:23,934] Trial 58 pruned. 
[I 2026-03-18 22:49:03,374] Trial 59 pruned. 
[I 2026-03-18 22:49:09,886] Trial 60 pruned. 
[I 2026-03-18 22:49:24,181] Trial 61 pruned. 
[I 2026-03-18 22:49:39,015] Trial 62 pruned. 
[I 2026-03-18 22:49:45,227] Trial 63 pruned. 
[I 2026-03-18 22:50:21,062] Trial 64 finished with value: -2.7642459715205345 and parameters: {'n_layers_yyx': 1, 'hidden_size_yyx_l0': 5, 'context_size_yyx': 4, 'num_mix_components_yyx': 4, 'context_extractor_yyx': 'lstm', 'activation_func_yyx': 'Tanh', 'L2_weight_yyx': 1.0788187159679378e-06, 'L_entropy_weight_yyx': 1.140196544829628e-05, 'L_sep_weight_yyx': 1.8100705820457405e-05, 'L_scale_weight_yyx': 0.0007774306797822474, 'learning_rate_yyx': 0.007271042015636066}. Best is trial 8 with value: -2.7663050128086293.
[I 2026-03-18 22:51:25,332] Trial 65 finished with value: -2.764513300730321 and parameters: {'n_layers_yyx': 1, 'hidden_size_yyx_l0': 4, 'context_size_yyx': 4, 'num_mix_components_yyx': 5, 'context_extractor_yyx': 'lstm', 'activation_func_yyx': 'Tanh', 'L2_weight_yyx': 2.9346663876753655e-07, 'L_entropy_weight_yyx': 3.504606268003638e-05, 'L_sep_weight_yyx': 7.357452270355324e-06, 'L_scale_weight_yyx': 3.567016769884657e-05, 'learning_rate_yyx': 0.0055343559420981785}. Best is trial 8 with value: -2.7663050128086293.

Source events: 39192
Target events: 20800
Full model ln_yyx : 3747.74747 nats/sec, 162.16215 nats/event
Full model Log loss : -2.76057
Full model ln_yyx : 3699.88407 nats/sec, 160.09114 nats/event
Full model Log loss : -2.73036
Full model ln_yyx : 3742.38774 nats/sec, 161.93024 nats/event
Full model Log loss : -2.76576
Full model ln_yyx : 3770.58856 nats/sec, 163.15047 nats/event
Full model Log loss : -2.76477
Full model ln_yyx : 3751.59291 nats/sec, 162.32854 nats/event
Full model Log loss : -2.76534
Full model ln_yyx : 3732.56376 nats/sec, 161.50516 nats/event
Full model Log loss : -2.76500
Full model ln_yyx : 3748.00725 nats/sec, 162.17339 nats/event
Full model Log loss : -2.76498
Full model ln_yyx : 3701.62664 nats/sec, 160.16654 nats/event
Full model Log loss : -2.73272
Full model ln_yyx : 3764.53316 nats/sec, 162.88845 nats/event
Full model Log loss : -2.76179
Full model ln_yyx : 3733.49803 nats/sec, 161.54559 nats/event
Full model Log loss : -2.76495
Full model ln_yyx : 3752.09986 nats/sec, 162.35047 nats/event
Full model Log loss : -2.76368
Full model ln_yyx : 3755.88332 nats/sec, 162.51418 nats/event
Full model Log loss : -2.76476
Full model ln_yyx : 3729.51779 nats/sec, 161.37337 nats/event
Full model Log loss : -2.76586
Full model ln_yyx : 3727.81705 nats/sec, 161.29978 nats/event
Full model Log loss : -2.76425
Full model ln_yyx : 3760.05933 nats/sec, 162.69487 nats/event
Full model Log loss : -2.76451
Optimization finished. Config saved to results/opt-full/opt_full_170_best_config.txt
