[I 2026-03-18 17:39:57,602] Trial 10 finished with value: -1.2586591935642546 and parameters: {'n_layers_yyx': 1, 'hidden_size_yyx_l0': 3, 'context_size_yyx': 2, 'num_mix_components_yyx': 5, 'context_extractor_yyx': 'lstm', 'activation_func_yyx': 'ReLU', 'L2_weight_yyx': 2.0769019820590794e-08, 'L_entropy_weight_yyx': 1.2670083058529042e-10, 'L_sep_weight_yyx': 1.4634310005956328e-06, 'L_scale_weight_yyx': 5.647518877294837e-07, 'learning_rate_yyx': 0.009960314789229973}. Best is trial 10 with value: -1.2586591935642546.
[I 2026-03-18 17:41:03,466] Trial 9 pruned. 
[I 2026-03-18 17:41:03,706] Trial 6 finished with value: -1.264027203039528 and parameters: {'n_layers_yyx': 2, 'hidden_size_yyx_l0': 3, 'hidden_size_yyx_l1': 3, 'context_size_yyx': 1, 'num_mix_components_yyx': 5, 'context_extractor_yyx': 'gru', 'activation_func_yyx': 'ReLU', 'L2_weight_yyx': 9.694017754386677e-07, 'L_entropy_weight_yyx': 1.205513925505408e-09, 'L_sep_weight_yyx': 0.0004899605417665371, 'L_scale_weight_yyx': 4.168103688636046e-09, 'learning_rate_yyx': 0.004012141269660185}. Best is trial 2 with value: -1.2804754530695341.
[I 2026-03-18 17:41:26,315] Trial 8 pruned. 
[I 2026-03-18 17:41:42,618] Trial 9 finished with value: -3.1394486421464087 and parameters: {'n_layers_yyx': 1, 'hidden_size_yyx_l0': 3, 'context_size_yyx': 1, 'num_mix_components_yyx': 4, 'context_extractor_yyx': 'gru', 'activation_func_yyx': 'Tanh', 'L2_weight_yyx': 2.209378684280567e-07, 'L_entropy_weight_yyx': 0.0005293600009791565, 'L_sep_weight_yyx': 6.412410248264232e-09, 'L_scale_weight_yyx': 3.515417351158984e-06, 'learning_rate_yyx': 0.003463452054875489}. Best is trial 8 with value: -3.1506303241940805.
[I 2026-03-18 17:41:46,741] Trial 15 pruned. 
[I 2026-03-18 17:41:47,565] Trial 16 finished with value: -3.149974272486285 and parameters: {'n_layers_yyx': 1, 'hidden_size_yyx_l0': 3, 'context_size_yyx': 4, 'num_mix_components_yyx': 1, 'context_extractor_yyx': 'lstm', 'activation_func_yyx': 'GELU', 'L2_weight_yyx': 7.568957600865856e-08, 'L_entropy_weight_yyx': 5.870720718371171e-07, 'L_sep_weight_yyx': 1.7869242259195798e-08, 'L_scale_weight_yyx': 6.345252739477758e-07, 'learning_rate_yyx': 0.005608021902952019}. Best is trial 16 with value: -3.149974272486285.
[I 2026-03-18 17:42:04,619] Trial 16 finished with value: -1.2384083125595684 and parameters: {'n_layers_yyx': 2, 'hidden_size_yyx_l0': 5, 'hidden_size_yyx_l1': 4, 'context_size_yyx': 4, 'num_mix_components_yyx': 4, 'context_extractor_yyx': 'gru', 'activation_func_yyx': 'Tanh', 'L2_weight_yyx': 7.504560734821315e-10, 'L_entropy_weight_yyx': 7.633972850448939e-05, 'L_sep_weight_yyx': 5.008546171352927e-06, 'L_scale_weight_yyx': 0.0008015141413267541, 'learning_rate_yyx': 0.0020992336567274054}. Best is trial 0 with value: -1.2691870881537193.
[I 2026-03-18 17:42:06,423] Trial 19 finished with value: -0.5710613770202888 and parameters: {'n_layers_yyx': 2, 'hidden_size_yyx_l0': 6, 'hidden_size_yyx_l1': 5, 'context_size_yyx': 4, 'num_mix_components_yyx': 2, 'context_extractor_yyx': 'lstm', 'activation_func_yyx': 'Tanh', 'L2_weight_yyx': 6.941596779684358e-06, 'L_entropy_weight_yyx': 5.528864115150248e-10, 'L_sep_weight_yyx': 4.273964863421252e-09, 'L_scale_weight_yyx': 0.00011843379472865037, 'learning_rate_yyx': 0.009891408074635934}. Best is trial 12 with value: -0.5830094706077523.
[I 2026-03-18 17:42:11,000] Trial 7 pruned. 
[I 2026-03-18 17:42:24,100] Trial 16 pruned. 
[I 2026-03-18 17:43:18,089] Trial 8 pruned. 
[I 2026-03-18 17:43:31,754] Trial 17 pruned. 
[I 2026-03-18 17:44:08,587] Trial 10 finished with value: -3.1611070918248854 and parameters: {'n_layers_yyx': 2, 'hidden_size_yyx_l0': 6, 'hidden_size_yyx_l1': 6, 'context_size_yyx': 2, 'num_mix_components_yyx': 5, 'context_extractor_yyx': 'lstm', 'activation_func_yyx': 'Tanh', 'L2_weight_yyx': 0.00011845434516327719, 'L_entropy_weight_yyx': 1.9174135918374794e-07, 'L_sep_weight_yyx': 0.0009602156636814349, 'L_scale_weight_yyx': 8.906185184655351e-06, 'learning_rate_yyx': 0.009930597932119709}. Best is trial 10 with value: -3.1611070918248854.
[I 2026-03-18 17:44:10,405] Trial 9 pruned. 
[I 2026-03-18 17:44:16,576] Trial 20 pruned. 
[I 2026-03-18 17:44:17,999] Trial 16 finished with value: -1.2440326711827416 and parameters: {'n_layers_yyx': 2, 'hidden_size_yyx_l0': 3, 'hidden_size_yyx_l1': 4, 'context_size_yyx': 1, 'num_mix_components_yyx': 2, 'context_extractor_yyx': 'gru', 'activation_func_yyx': 'Tanh', 'L2_weight_yyx': 2.778770914752564e-06, 'L_entropy_weight_yyx': 1.052240711278034e-06, 'L_sep_weight_yyx': 4.5632972841855754e-10, 'L_scale_weight_yyx': 4.539886868391173e-07, 'learning_rate_yyx': 0.009027328336490559}. Best is trial 0 with value: -1.255221580181016.
[I 2026-03-18 17:44:26,335] Trial 9 pruned. 
[I 2026-03-18 17:44:26,458] Trial 17 pruned. 
[I 2026-03-18 17:44:40,447] Trial 16 pruned. 
[I 2026-03-18 17:45:25,043] Trial 15 pruned. 
[I 2026-03-18 17:45:31,290] Trial 18 pruned. 
[I 2026-03-18 17:45:36,081] Trial 10 finished with value: -3.148061618303045 and parameters: {'n_layers_yyx': 2, 'hidden_size_yyx_l0': 6, 'hidden_size_yyx_l1': 6, 'context_size_yyx': 4, 'num_mix_components_yyx': 5, 'context_extractor_yyx': 'gru', 'activation_func_yyx': 'ReLU', 'L2_weight_yyx': 2.1469780116161224e-06, 'L_entropy_weight_yyx': 2.1481269132541775e-10, 'L_sep_weight_yyx': 2.21211067900811e-08, 'L_scale_weight_yyx': 0.0009800335386653284, 'learning_rate_yyx': 0.004131229818496417}. Best is trial 10 with value: -3.148061618303045.
[I 2026-03-18 17:45:36,330] Trial 10 pruned. 
[I 2026-03-18 17:45:37,895] Trial 12 finished with value: -3.1417334822033474 and parameters: {'n_layers_yyx': 2, 'hidden_size_yyx_l0': 5, 'hidden_size_yyx_l1': 4, 'context_size_yyx': 2, 'num_mix_components_yyx': 2, 'context_extractor_yyx': 'gru', 'activation_func_yyx': 'ReLU', 'L2_weight_yyx': 3.5489646330627845e-08, 'L_entropy_weight_yyx': 2.36423810122244e-10, 'L_sep_weight_yyx': 2.1957901845988987e-09, 'L_scale_weight_yyx': 1.3787857436734929e-08, 'learning_rate_yyx': 0.005425394930953751}. Best is trial 2 with value: -3.151229652723366.
[I 2026-03-18 17:46:01,348] Trial 21 finished with value: -3.1481003134169945 and parameters: {'n_layers_yyx': 2, 'hidden_size_yyx_l0': 4, 'hidden_size_yyx_l1': 5, 'context_size_yyx': 4, 'num_mix_components_yyx': 4, 'context_extractor_yyx': 'lstm', 'activation_func_yyx': 'GELU', 'L2_weight_yyx': 1.0866585003511967e-07, 'L_entropy_weight_yyx': 8.386180220525573e-07, 'L_sep_weight_yyx': 6.761845774073651e-10, 'L_scale_weight_yyx': 1.1242814770439704e-07, 'learning_rate_yyx': 0.0068270669497271196}. Best is trial 20 with value: -3.1481007392302844.
[I 2026-03-18 17:46:08,522] Trial 17 pruned. 
[I 2026-03-18 17:46:19,031] Trial 17 pruned. 
[I 2026-03-18 17:46:25,876] Trial 21 pruned. 
[I 2026-03-18 17:46:37,808] Trial 11 finished with value: -3.114549815018566 and parameters: {'n_layers_yyx': 1, 'hidden_size_yyx_l0': 6, 'context_size_yyx': 4, 'num_mix_components_yyx': 3, 'context_extractor_yyx': 'gru', 'activation_func_yyx': 'ReLU', 'L2_weight_yyx': 0.00013848670569546797, 'L_entropy_weight_yyx': 9.800503720682617e-06, 'L_sep_weight_yyx': 1.3977226122597678e-10, 'L_scale_weight_yyx': 1.5286352321246917e-06, 'learning_rate_yyx': 0.0005501803962425682}. Best is trial 2 with value: -3.1501405578480686.
[I 2026-03-18 17:46:38,159] Trial 9 finished with value: -0.5828221254204458 and parameters: {'n_layers_yyx': 1, 'hidden_size_yyx_l0': 5, 'context_size_yyx': 4, 'num_mix_components_yyx': 3, 'context_extractor_yyx': 'lstm', 'activation_func_yyx': 'ReLU', 'L2_weight_yyx': 1.055682003486553e-05, 'L_entropy_weight_yyx': 0.0006930081491686482, 'L_sep_weight_yyx': 0.0004627188138554221, 'L_scale_weight_yyx': 5.483548360720934e-09, 'learning_rate_yyx': 0.006013397765342596}. Best is trial 3 with value: -0.584032942865049.
[I 2026-03-18 17:46:39,687] Trial 19 pruned. 
[I 2026-03-18 17:46:44,023] Trial 15 finished with value: -1.2698546954311858 and parameters: {'n_layers_yyx': 1, 'hidden_size_yyx_l0': 6, 'context_size_yyx': 4, 'num_mix_components_yyx': 4, 'context_extractor_yyx': 'gru', 'activation_func_yyx': 'ReLU', 'L2_weight_yyx': 3.0027802113213236e-09, 'L_entropy_weight_yyx': 4.3149589499507466e-05, 'L_sep_weight_yyx': 1.4469926070764623e-09, 'L_scale_weight_yyx': 1.6657526938395792e-09, 'learning_rate_yyx': 0.005368111847039257}. Best is trial 15 with value: -1.2698546954311858.
[I 2026-03-18 17:46:49,920] Trial 9 finished with value: -1.2626122846621022 and parameters: {'n_layers_yyx': 2, 'hidden_size_yyx_l0': 2, 'hidden_size_yyx_l1': 6, 'context_size_yyx': 4, 'num_mix_components_yyx': 3, 'context_extractor_yyx': 'lstm', 'activation_func_yyx': 'Tanh', 'L2_weight_yyx': 5.0864958659021727e-05, 'L_entropy_weight_yyx': 7.158125179967964e-08, 'L_sep_weight_yyx': 3.8212658190440683e-10, 'L_scale_weight_yyx': 4.6791484467897666e-08, 'learning_rate_yyx': 0.00557206424118402}. Best is trial 7 with value: -1.272066817927052.
[I 2026-03-18 17:46:51,829] Trial 13 finished with value: -1.2582408037732136 and parameters: {'n_layers_yyx': 2, 'hidden_size_yyx_l0': 3, 'hidden_size_yyx_l1': 4, 'context_size_yyx': 2, 'num_mix_components_yyx': 5, 'context_extractor_yyx': 'lstm', 'activation_func_yyx': 'ReLU', 'L2_weight_yyx': 3.0660236330465234e-07, 'L_entropy_weight_yyx': 5.234243272397197e-07, 'L_sep_weight_yyx': 1.9788889832716508e-05, 'L_scale_weight_yyx': 3.2662694683919155e-10, 'learning_rate_yyx': 0.001726413557923753}. Best is trial 3 with value: -1.265314140954432.
[I 2026-03-18 17:46:54,132] Trial 16 pruned. 
[I 2026-03-18 17:47:10,717] Trial 18 pruned. 
[I 2026-03-18 17:47:14,771] Trial 8 finished with value: -3.1519808444856237 and parameters: {'n_layers_yyx': 2, 'hidden_size_yyx_l0': 4, 'hidden_size_yyx_l1': 6, 'context_size_yyx': 4, 'num_mix_components_yyx': 4, 'context_extractor_yyx': 'lstm', 'activation_func_yyx': 'ReLU', 'L2_weight_yyx': 3.236457007416337e-05, 'L_entropy_weight_yyx': 0.000499031645598801, 'L_sep_weight_yyx': 7.122273307984846e-09, 'L_scale_weight_yyx': 4.0778316414727495e-06, 'learning_rate_yyx': 0.005290589564105043}. Best is trial 1 with value: -3.152505646630136.
[I 2026-03-18 17:47:17,747] Trial 26 finished with value: -1.2726356097378264 and parameters: {'n_layers_yyx': 2, 'hidden_size_yyx_l0': 5, 'hidden_size_yyx_l1': 5, 'context_size_yyx': 3, 'num_mix_components_yyx': 3, 'context_extractor_yyx': 'lstm', 'activation_func_yyx': 'Tanh', 'L2_weight_yyx': 0.00019243927005101153, 'L_entropy_weight_yyx': 3.688602020848289e-05, 'L_sep_weight_yyx': 2.151101246393284e-09, 'L_scale_weight_yyx': 6.310659524882262e-07, 'learning_rate_yyx': 0.00996154354347896}. Best is trial 26 with value: -1.2726356097378264.
[I 2026-03-18 17:47:23,424] Trial 6 finished with value: -3.165260441558143 and parameters: {'n_layers_yyx': 2, 'hidden_size_yyx_l0': 3, 'hidden_size_yyx_l1': 5, 'context_size_yyx': 3, 'num_mix_components_yyx': 3, 'context_extractor_yyx': 'lstm', 'activation_func_yyx': 'ReLU', 'L2_weight_yyx': 1.0615153416370245e-09, 'L_entropy_weight_yyx': 4.651129537384967e-06, 'L_sep_weight_yyx': 4.0756805145439e-10, 'L_scale_weight_yyx': 1.5604890212834205e-08, 'learning_rate_yyx': 0.008426390716225219}. Best is trial 1 with value: -3.166268711244678.
[I 2026-03-18 17:47:37,317] Trial 12 finished with value: -3.1893335216865584 and parameters: {'n_layers_yyx': 2, 'hidden_size_yyx_l0': 5, 'hidden_size_yyx_l1': 2, 'context_size_yyx': 4, 'num_mix_components_yyx': 4, 'context_extractor_yyx': 'lstm', 'activation_func_yyx': 'ReLU', 'L2_weight_yyx': 2.54761636411577e-06, 'L_entropy_weight_yyx': 2.230466184501043e-10, 'L_sep_weight_yyx': 1.9023131277731042e-06, 'L_scale_weight_yyx': 0.0009471820977461797, 'learning_rate_yyx': 0.0026619526941844074}. Best is trial 12 with value: -3.1893335216865584.
[I 2026-03-18 17:47:39,231] Trial 11 pruned. 
[I 2026-03-18 17:47:53,511] Trial 14 finished with value: -3.108441705987005 and parameters: {'n_layers_yyx': 2, 'hidden_size_yyx_l0': 3, 'hidden_size_yyx_l1': 4, 'context_size_yyx': 1, 'num_mix_components_yyx': 3, 'context_extractor_yyx': 'lstm', 'activation_func_yyx': 'ReLU', 'L2_weight_yyx': 2.3384928341775592e-07, 'L_entropy_weight_yyx': 1.7455850524863018e-06, 'L_sep_weight_yyx': 4.477081557751883e-10, 'L_scale_weight_yyx': 1.1544876419555776e-07, 'learning_rate_yyx': 0.0013197048408790883}. Best is trial 1 with value: -3.1505299612690063.
[I 2026-03-18 17:48:08,847] Trial 17 pruned. 
[I 2026-03-18 17:48:14,624] Trial 10 finished with value: -3.1450619363884265 and parameters: {'n_layers_yyx': 1, 'hidden_size_yyx_l0': 3, 'context_size_yyx': 2, 'num_mix_components_yyx': 5, 'context_extractor_yyx': 'lstm', 'activation_func_yyx': 'ReLU', 'L2_weight_yyx': 2.2309953159036172e-09, 'L_entropy_weight_yyx': 2.0346573633214424e-05, 'L_sep_weight_yyx': 5.1182211617093584e-08, 'L_scale_weight_yyx': 0.0007985736084285842, 'learning_rate_yyx': 0.0028148502445725166}. Best is trial 6 with value: -3.1471600213313993.
[I 2026-03-18 17:48:19,521] Trial 13 pruned. 
[I 2026-03-18 17:48:22,426] Trial 27 pruned. 
[I 2026-03-18 17:48:23,895] Trial 11 pruned. 
[I 2026-03-18 17:48:29,580] Trial 19 pruned. 
[I 2026-03-18 17:48:34,316] Trial 9 pruned. 
[I 2026-03-18 17:48:34,487] Trial 22 pruned. 
[I 2026-03-18 17:48:37,782] Trial 10 pruned. 
[I 2026-03-18 17:48:43,384] Trial 7 pruned. 
[I 2026-03-18 17:48:44,460] Trial 20 pruned. 
[I 2026-03-18 17:48:47,513] Trial 12 pruned. 
[I 2026-03-18 17:48:53,664] Trial 14 pruned. 
[I 2026-03-18 17:48:55,345] Trial 10 pruned. 
[I 2026-03-18 17:48:56,610] Trial 18 pruned. 
[I 2026-03-18 17:48:56,611] Trial 13 pruned. 
[I 2026-03-18 17:49:21,028] Trial 15 pruned. 
[I 2026-03-18 17:49:35,542] Trial 11 pruned. 
[I 2026-03-18 17:49:36,201] Trial 8 finished with value: -3.1464824876113653 and parameters: {'n_layers_yyx': 2, 'hidden_size_yyx_l0': 4, 'hidden_size_yyx_l1': 3, 'context_size_yyx': 3, 'num_mix_components_yyx': 4, 'context_extractor_yyx': 'gru', 'activation_func_yyx': 'ReLU', 'L2_weight_yyx': 1.0940388196371141e-07, 'L_entropy_weight_yyx': 9.355161610792171e-08, 'L_sep_weight_yyx': 2.003752232729907e-08, 'L_scale_weight_yyx': 4.1698875110804174e-05, 'learning_rate_yyx': 0.004165024131258355}. Best is trial 3 with value: -3.1501368402794143.
[I 2026-03-18 17:49:42,765] Trial 12 pruned. 
[I 2026-03-18 17:49:50,213] Trial 13 pruned. 
[I 2026-03-18 17:49:53,352] Trial 11 finished with value: -1.2697828860467992 and parameters: {'n_layers_yyx': 2, 'hidden_size_yyx_l0': 6, 'hidden_size_yyx_l1': 3, 'context_size_yyx': 2, 'num_mix_components_yyx': 3, 'context_extractor_yyx': 'gru', 'activation_func_yyx': 'GELU', 'L2_weight_yyx': 1.4315503431634035e-10, 'L_entropy_weight_yyx': 1.0956123127257858e-09, 'L_sep_weight_yyx': 1.7275038602385478e-06, 'L_scale_weight_yyx': 2.7507400689485713e-07, 'learning_rate_yyx': 0.004527716058671255}. Best is trial 11 with value: -1.2697828860467992.
[I 2026-03-18 17:49:58,915] Trial 11 pruned. 
[I 2026-03-18 17:50:01,095] Trial 11 finished with value: -3.1681993571236235 and parameters: {'n_layers_yyx': 1, 'hidden_size_yyx_l0': 4, 'context_size_yyx': 4, 'num_mix_components_yyx': 5, 'context_extractor_yyx': 'lstm', 'activation_func_yyx': 'Tanh', 'L2_weight_yyx': 1.9393915419944834e-07, 'L_entropy_weight_yyx': 1.665071718651802e-06, 'L_sep_weight_yyx': 5.465117941418478e-06, 'L_scale_weight_yyx': 1.0682007559745902e-10, 'learning_rate_yyx': 0.009799979055466807}. Best is trial 11 with value: -3.1681993571236235.
[I 2026-03-18 17:50:03,344] Trial 8 pruned. 
[I 2026-03-18 17:50:18,605] Trial 19 pruned. 
[I 2026-03-18 17:50:37,844] Trial 16 pruned. 
[I 2026-03-18 17:50:47,199] Trial 18 pruned. 
[I 2026-03-18 17:50:55,909] Trial 11 pruned. 
[I 2026-03-18 17:50:56,308] Trial 9 pruned. 
[I 2026-03-18 17:50:58,080] Trial 20 pruned. 
[I 2026-03-18 17:50:58,104] Trial 12 pruned. 
[I 2026-03-18 17:51:10,337] Trial 18 pruned. 
[I 2026-03-18 17:51:14,873] Trial 12 finished with value: -1.262873750076717 and parameters: {'n_layers_yyx': 1, 'hidden_size_yyx_l0': 3, 'context_size_yyx': 4, 'num_mix_components_yyx': 4, 'context_extractor_yyx': 'gru', 'activation_func_yyx': 'ReLU', 'L2_weight_yyx': 4.408097507871992e-06, 'L_entropy_weight_yyx': 6.989703904325934e-07, 'L_sep_weight_yyx': 4.689471678802881e-10, 'L_scale_weight_yyx': 1.0861390415487485e-10, 'learning_rate_yyx': 0.00397232290117889}. Best is trial 8 with value: -1.265112378019943.
[I 2026-03-18 17:51:20,673] Trial 9 pruned. 
[I 2026-03-18 17:51:53,956] Trial 10 finished with value: -0.5797192810982097 and parameters: {'n_layers_yyx': 1, 'hidden_size_yyx_l0': 4, 'context_size_yyx': 1, 'num_mix_components_yyx': 5, 'context_extractor_yyx': 'gru', 'activation_func_yyx': 'ReLU', 'L2_weight_yyx': 4.375987681405656e-06, 'L_entropy_weight_yyx': 4.2155960435489e-06, 'L_sep_weight_yyx': 2.0100589210521768e-10, 'L_scale_weight_yyx': 1.5985477287096442e-05, 'learning_rate_yyx': 0.0029029991198474448}. Best is trial 4 with value: -0.5804501078315746.
[I 2026-03-18 17:52:09,558] Trial 19 pruned. 
[I 2026-03-18 17:52:35,262] Trial 10 pruned. 
[I 2026-03-18 17:52:42,576] Trial 22 pruned. 
[I 2026-03-18 17:52:51,634] Trial 11 pruned. 
[I 2026-03-18 17:53:10,252] Trial 20 pruned. 
[I 2026-03-18 17:53:13,877] Trial 28 pruned. 
[I 2026-03-18 17:53:15,127] Trial 11 finished with value: -1.2628584630828688 and parameters: {'n_layers_yyx': 1, 'hidden_size_yyx_l0': 3, 'context_size_yyx': 2, 'num_mix_components_yyx': 5, 'context_extractor_yyx': 'lstm', 'activation_func_yyx': 'ReLU', 'L2_weight_yyx': 2.76756759576862e-08, 'L_entropy_weight_yyx': 5.329745917377381e-10, 'L_sep_weight_yyx': 2.032679574539261e-06, 'L_scale_weight_yyx': 9.90948115805656e-07, 'learning_rate_yyx': 0.009094145612380181}. Best is trial 11 with value: -1.2628584630828688.
[I 2026-03-18 17:53:17,865] Trial 17 pruned. 
[I 2026-03-18 17:53:27,845] Trial 10 pruned. 
[I 2026-03-18 17:53:32,618] Trial 12 pruned. 
[I 2026-03-18 17:53:50,218] Trial 10 finished with value: -3.1515199681211117 and parameters: {'n_layers_yyx': 2, 'hidden_size_yyx_l0': 5, 'hidden_size_yyx_l1': 2, 'context_size_yyx': 2, 'num_mix_components_yyx': 5, 'context_extractor_yyx': 'lstm', 'activation_func_yyx': 'Tanh', 'L2_weight_yyx': 1.4007535202517193e-10, 'L_entropy_weight_yyx': 2.4415021673046093e-06, 'L_sep_weight_yyx': 1.3198038668172366e-10, 'L_scale_weight_yyx': 0.0006392723555278126, 'learning_rate_yyx': 0.0096718850576277}. Best is trial 10 with value: -3.1515199681211117.
[I 2026-03-18 17:54:11,669] Trial 11 finished with value: -0.564961828260671 and parameters: {'n_layers_yyx': 1, 'hidden_size_yyx_l0': 4, 'context_size_yyx': 4, 'num_mix_components_yyx': 2, 'context_extractor_yyx': 'lstm', 'activation_func_yyx': 'ReLU', 'L2_weight_yyx': 1.7179329393602482e-06, 'L_entropy_weight_yyx': 0.00062620659664161, 'L_sep_weight_yyx': 0.0006579228349889326, 'L_scale_weight_yyx': 1.1165210512305961e-08, 'learning_rate_yyx': 0.008440842213525023}. Best is trial 3 with value: -0.584032942865049.
[I 2026-03-18 17:54:33,309] Trial 12 pruned. 
[I 2026-03-18 17:54:36,517] Trial 23 finished with value: -0.5774814023276307 and parameters: {'n_layers_yyx': 2, 'hidden_size_yyx_l0': 6, 'hidden_size_yyx_l1': 4, 'context_size_yyx': 4, 'num_mix_components_yyx': 2, 'context_extractor_yyx': 'lstm', 'activation_func_yyx': 'Tanh', 'L2_weight_yyx': 1.0302946726222419e-05, 'L_entropy_weight_yyx': 5.282919461571102e-10, 'L_sep_weight_yyx': 4.968776218162349e-09, 'L_scale_weight_yyx': 9.761519153667392e-06, 'learning_rate_yyx': 0.007860123222473927}. Best is trial 12 with value: -0.5830094706077523.
[I 2026-03-18 17:54:38,766] Trial 12 pruned. 
[I 2026-03-18 17:54:44,119] Trial 14 pruned. 
[I 2026-03-18 17:54:44,119] Trial 13 pruned. 
[I 2026-03-18 17:54:55,424] Trial 10 finished with value: -3.1223374920073423 and parameters: {'n_layers_yyx': 2, 'hidden_size_yyx_l0': 6, 'hidden_size_yyx_l1': 2, 'context_size_yyx': 3, 'num_mix_components_yyx': 1, 'context_extractor_yyx': 'lstm', 'activation_func_yyx': 'GELU', 'L2_weight_yyx': 1.4287491970860304e-08, 'L_entropy_weight_yyx': 0.00017232618888175514, 'L_sep_weight_yyx': 0.000447760116060315, 'L_scale_weight_yyx': 0.0004872072995847117, 'learning_rate_yyx': 0.00519078870261682}. Best is trial 5 with value: -3.154335707688014.
[I 2026-03-18 17:55:03,652] Trial 14 pruned. 
[I 2026-03-18 17:55:03,707] Trial 12 pruned. 
[I 2026-03-18 17:55:23,831] Trial 20 finished with value: -1.2596458533775343 and parameters: {'n_layers_yyx': 1, 'hidden_size_yyx_l0': 2, 'context_size_yyx': 4, 'num_mix_components_yyx': 5, 'context_extractor_yyx': 'lstm', 'activation_func_yyx': 'ReLU', 'L2_weight_yyx': 7.787882697575017e-08, 'L_entropy_weight_yyx': 4.710257367751729e-09, 'L_sep_weight_yyx': 1.0372511269304742e-05, 'L_scale_weight_yyx': 9.490400384261325e-09, 'learning_rate_yyx': 0.001997945636857492}. Best is trial 18 with value: -1.2691942310156972.
[I 2026-03-18 17:55:31,256] Trial 13 pruned. 
[I 2026-03-18 17:55:31,312] Trial 13 pruned. 
[I 2026-03-18 17:55:36,303] Trial 18 pruned. 
[I 2026-03-18 17:55:49,004] Trial 11 pruned. 
[I 2026-03-18 17:55:54,837] Trial 13 pruned. 
[I 2026-03-18 17:55:59,342] Trial 16 finished with value: -1.2715469755218562 and parameters: {'n_layers_yyx': 1, 'hidden_size_yyx_l0': 5, 'context_size_yyx': 4, 'num_mix_components_yyx': 4, 'context_extractor_yyx': 'gru', 'activation_func_yyx': 'Tanh', 'L2_weight_yyx': 2.3487696324014776e-08, 'L_entropy_weight_yyx': 1.64072467013315e-05, 'L_sep_weight_yyx': 1.8055112039585502e-09, 'L_scale_weight_yyx': 3.417309302934334e-09, 'learning_rate_yyx': 0.00517012184167703}. Best is trial 16 with value: -1.2715469755218562.
