[I 2026-03-18 18:18:29,886] Trial 25 finished with value: -3.1200597058793025 and parameters: {'n_layers_yyx': 2, 'hidden_size_yyx_l0': 3, 'hidden_size_yyx_l1': 4, 'context_size_yyx': 2, 'num_mix_components_yyx': 4, 'context_extractor_yyx': 'lstm', 'activation_func_yyx': 'ReLU', 'L2_weight_yyx': 3.691824497084361e-07, 'L_entropy_weight_yyx': 2.2365262009216793e-05, 'L_sep_weight_yyx': 2.8874771799033564e-07, 'L_scale_weight_yyx': 2.479288508486826e-06, 'learning_rate_yyx': 0.003608253396856408}. Best is trial 13 with value: -3.1559077725337215.
[I 2026-03-18 18:18:29,978] Trial 40 pruned. 
[I 2026-03-18 18:18:31,643] Trial 40 pruned. 
[I 2026-03-18 18:18:32,774] Trial 22 pruned. 
[I 2026-03-18 18:18:34,911] Trial 30 pruned. 
[I 2026-03-18 18:18:35,283] Trial 40 pruned. 
[I 2026-03-18 18:18:38,182] Trial 32 pruned. 
[I 2026-03-18 18:18:40,261] Trial 24 pruned. 
[I 2026-03-18 18:18:44,308] Trial 42 pruned. 
[I 2026-03-18 18:18:44,749] Trial 34 pruned. 
[I 2026-03-18 18:18:44,786] Trial 38 finished with value: -0.5648673580962001 and parameters: {'n_layers_yyx': 1, 'hidden_size_yyx_l0': 3, 'context_size_yyx': 2, 'num_mix_components_yyx': 2, 'context_extractor_yyx': 'gru', 'activation_func_yyx': 'ReLU', 'L2_weight_yyx': 0.0003006203862476425, 'L_entropy_weight_yyx': 3.846297066856244e-08, 'L_sep_weight_yyx': 4.728732695178534e-10, 'L_scale_weight_yyx': 2.0569185342510045e-06, 'learning_rate_yyx': 0.0013171002800892852}. Best is trial 3 with value: -0.584032942865049.
[I 2026-03-18 18:18:47,508] Trial 26 pruned. 
[I 2026-03-18 18:18:47,535] Trial 46 pruned. 
[I 2026-03-18 18:18:47,563] Trial 40 pruned. 
[I 2026-03-18 18:18:50,072] Trial 40 pruned. 
[I 2026-03-18 18:18:55,231] Trial 19 pruned. 
[I 2026-03-18 18:18:56,258] Trial 24 finished with value: -3.1533369159995748 and parameters: {'n_layers_yyx': 1, 'hidden_size_yyx_l0': 4, 'context_size_yyx': 3, 'num_mix_components_yyx': 4, 'context_extractor_yyx': 'gru', 'activation_func_yyx': 'ReLU', 'L2_weight_yyx': 1.3217892987484726e-08, 'L_entropy_weight_yyx': 1.0653956916842863e-06, 'L_sep_weight_yyx': 8.3387771720891e-09, 'L_scale_weight_yyx': 0.0007816174462514766, 'learning_rate_yyx': 0.006862314356099026}. Best is trial 24 with value: -3.1533369159995748.
[I 2026-03-18 18:18:56,327] Trial 39 pruned. 
[I 2026-03-18 18:19:00,836] Trial 29 pruned. 
[I 2026-03-18 18:19:01,789] Trial 25 pruned. 
[I 2026-03-18 18:19:06,407] Trial 35 pruned. 
[I 2026-03-18 18:19:07,397] Trial 41 pruned. 
[I 2026-03-18 18:19:09,017] Trial 31 finished with value: -1.2634683986247799 and parameters: {'n_layers_yyx': 2, 'hidden_size_yyx_l0': 2, 'hidden_size_yyx_l1': 6, 'context_size_yyx': 4, 'num_mix_components_yyx': 3, 'context_extractor_yyx': 'lstm', 'activation_func_yyx': 'Tanh', 'L2_weight_yyx': 3.640404545350221e-05, 'L_entropy_weight_yyx': 6.187259495822952e-08, 'L_sep_weight_yyx': 6.008035731623943e-10, 'L_scale_weight_yyx': 5.999542182472535e-08, 'learning_rate_yyx': 0.005536541413361307}. Best is trial 7 with value: -1.272066817927052.
[I 2026-03-18 18:19:13,412] Trial 48 finished with value: -1.261043640249538 and parameters: {'n_layers_yyx': 2, 'hidden_size_yyx_l0': 4, 'hidden_size_yyx_l1': 5, 'context_size_yyx': 4, 'num_mix_components_yyx': 3, 'context_extractor_yyx': 'gru', 'activation_func_yyx': 'Tanh', 'L2_weight_yyx': 4.832973239756599e-08, 'L_entropy_weight_yyx': 8.660937177032575e-07, 'L_sep_weight_yyx': 3.425707839361212e-06, 'L_scale_weight_yyx': 6.604249969977907e-09, 'learning_rate_yyx': 0.009948646601351292}. Best is trial 40 with value: -1.2705461004965848.
[I 2026-03-18 18:19:16,049] Trial 23 pruned. 
[I 2026-03-18 18:19:17,185] Trial 31 pruned. 
[I 2026-03-18 18:19:17,501] Trial 20 finished with value: -1.2622419981330688 and parameters: {'n_layers_yyx': 1, 'hidden_size_yyx_l0': 5, 'context_size_yyx': 3, 'num_mix_components_yyx': 4, 'context_extractor_yyx': 'lstm', 'activation_func_yyx': 'Tanh', 'L2_weight_yyx': 1.503432790114861e-09, 'L_entropy_weight_yyx': 4.387046438111659e-09, 'L_sep_weight_yyx': 3.461586557741278e-10, 'L_scale_weight_yyx': 1.2897990288571384e-09, 'learning_rate_yyx': 0.006272330601702866}. Best is trial 18 with value: -1.2672644666294515.
[I 2026-03-18 18:19:19,037] Trial 41 pruned. 
[I 2026-03-18 18:19:21,054] Trial 26 finished with value: -3.1178760120219513 and parameters: {'n_layers_yyx': 2, 'hidden_size_yyx_l0': 6, 'hidden_size_yyx_l1': 4, 'context_size_yyx': 3, 'num_mix_components_yyx': 5, 'context_extractor_yyx': 'lstm', 'activation_func_yyx': 'ReLU', 'L2_weight_yyx': 1.0567383167782438e-07, 'L_entropy_weight_yyx': 8.348460759580284e-09, 'L_sep_weight_yyx': 1.9404591280301406e-08, 'L_scale_weight_yyx': 4.806501612272438e-06, 'learning_rate_yyx': 0.004077249237853826}. Best is trial 23 with value: -3.1545382986021053.
[I 2026-03-18 18:19:22,527] Trial 26 pruned. 
[I 2026-03-18 18:19:27,420] Trial 42 pruned. 
[I 2026-03-18 18:19:29,610] Trial 48 finished with value: -1.2529016307894272 and parameters: {'n_layers_yyx': 2, 'hidden_size_yyx_l0': 6, 'hidden_size_yyx_l1': 4, 'context_size_yyx': 3, 'num_mix_components_yyx': 3, 'context_extractor_yyx': 'gru', 'activation_func_yyx': 'Tanh', 'L2_weight_yyx': 3.168176885444857e-05, 'L_entropy_weight_yyx': 1.1837112474881021e-05, 'L_sep_weight_yyx': 3.2494448321328357e-09, 'L_scale_weight_yyx': 9.223054799460168e-05, 'learning_rate_yyx': 0.008533353285094752}. Best is trial 26 with value: -1.2726356097378264.
[I 2026-03-18 18:19:36,604] Trial 24 pruned. 
[I 2026-03-18 18:19:37,026] Trial 32 pruned. 
[I 2026-03-18 18:19:39,193] Trial 21 pruned. 
[I 2026-03-18 18:19:41,210] Trial 49 pruned. 

Source events: 5634
Target events: 13628
Full model ln_yyx : 210.60043 nats/sec, 13.90816 nats/event
Full model Log loss : -1.23786
Full model ln_yyx : 212.47868 nats/sec, 14.03220 nats/event
Full model Log loss : -1.26485
Full model ln_yyx : 208.70706 nats/sec, 13.78312 nats/event
Full model Log loss : -1.24943
Full model ln_yyx : 212.10449 nats/sec, 14.00749 nats/event
Full model Log loss : -1.26484
Full model ln_yyx : 211.22352 nats/sec, 13.94931 nats/event
Full model Log loss : -1.23703
Full model ln_yyx : 211.34644 nats/sec, 13.95743 nats/event
Full model Log loss : -1.27264
Full model ln_yyx : 211.01779 nats/sec, 13.93572 nats/event
Full model Log loss : -1.23660
Full model ln_yyx : 211.53679 nats/sec, 13.97000 nats/event
Full model Log loss : -1.26520
Full model ln_yyx : 211.52713 nats/sec, 13.96936 nats/event
Full model Log loss : -1.26531
Full model ln_yyx : 213.76517 nats/sec, 14.11716 nats/event
Full model Log loss : -1.25752
Full model ln_yyx : 212.47496 nats/sec, 14.03195 nats/event
Full model Log loss : -1.25290
Optimization finished. Config saved to results/opt-full/opt_full_95_best_config.txt
[I 2026-03-18 18:19:41,623] Trial 25 pruned. 
[I 2026-03-18 18:19:42,134] Trial 41 finished with value: -1.2430629765480592 and parameters: {'n_layers_yyx': 2, 'hidden_size_yyx_l0': 6, 'hidden_size_yyx_l1': 5, 'context_size_yyx': 1, 'num_mix_components_yyx': 5, 'context_extractor_yyx': 'gru', 'activation_func_yyx': 'Tanh', 'L2_weight_yyx': 1.1050984147809563e-06, 'L_entropy_weight_yyx': 7.802097178947609e-08, 'L_sep_weight_yyx': 1.6737947112560805e-06, 'L_scale_weight_yyx': 0.0005076945472743443, 'learning_rate_yyx': 0.00965817592825529}. Best is trial 11 with value: -1.2697828860467992.
[I 2026-03-18 18:19:43,858] Trial 43 finished with value: -0.5682495620916438 and parameters: {'n_layers_yyx': 2, 'hidden_size_yyx_l0': 4, 'hidden_size_yyx_l1': 6, 'context_size_yyx': 4, 'num_mix_components_yyx': 4, 'context_extractor_yyx': 'lstm', 'activation_func_yyx': 'Tanh', 'L2_weight_yyx': 1.6068461753261887e-05, 'L_entropy_weight_yyx': 0.0009578536305152695, 'L_sep_weight_yyx': 2.3980951014495917e-09, 'L_scale_weight_yyx': 0.00015267959316932116, 'learning_rate_yyx': 0.0073693663308358566}. Best is trial 12 with value: -0.5830094706077523.
[I 2026-03-18 18:19:45,174] Trial 40 pruned. 
[I 2026-03-18 18:19:49,941] Trial 22 pruned. 
[I 2026-03-18 18:19:50,675] Trial 30 finished with value: -1.2671932848015466 and parameters: {'n_layers_yyx': 2, 'hidden_size_yyx_l0': 5, 'hidden_size_yyx_l1': 5, 'context_size_yyx': 4, 'num_mix_components_yyx': 4, 'context_extractor_yyx': 'lstm', 'activation_func_yyx': 'ReLU', 'L2_weight_yyx': 0.000317330146984929, 'L_entropy_weight_yyx': 0.0007122462635081355, 'L_sep_weight_yyx': 1.3257655217294113e-08, 'L_scale_weight_yyx': 0.00010334843595132896, 'learning_rate_yyx': 0.007306796706267844}. Best is trial 0 with value: -1.2691870881537193.
[I 2026-03-18 18:19:52,662] Trial 29 pruned. 
[I 2026-03-18 18:19:56,675] Trial 41 pruned. 
[I 2026-03-18 18:19:58,585] Trial 25 pruned. 
[I 2026-03-18 18:19:59,672] Trial 26 pruned. 
[I 2026-03-18 18:20:00,664] Trial 33 finished with value: -0.5714093277838076 and parameters: {'n_layers_yyx': 2, 'hidden_size_yyx_l0': 6, 'hidden_size_yyx_l1': 2, 'context_size_yyx': 3, 'num_mix_components_yyx': 2, 'context_extractor_yyx': 'lstm', 'activation_func_yyx': 'Tanh', 'L2_weight_yyx': 8.336405752522016e-06, 'L_entropy_weight_yyx': 2.3712311524060233e-05, 'L_sep_weight_yyx': 4.956985830215044e-10, 'L_scale_weight_yyx': 4.45743897601173e-10, 'learning_rate_yyx': 0.004644768063156384}. Best is trial 19 with value: -0.5893623740341837.
[I 2026-03-18 18:20:07,370] Trial 47 finished with value: -0.5857851219964323 and parameters: {'n_layers_yyx': 1, 'hidden_size_yyx_l0': 4, 'context_size_yyx': 1, 'num_mix_components_yyx': 5, 'context_extractor_yyx': 'lstm', 'activation_func_yyx': 'Tanh', 'L2_weight_yyx': 1.7684697726502974e-07, 'L_entropy_weight_yyx': 1.164807062769165e-10, 'L_sep_weight_yyx': 2.7173863396417428e-06, 'L_scale_weight_yyx': 0.0009647953920685045, 'learning_rate_yyx': 0.0064864931996241664}. Best is trial 44 with value: -0.5860173200478744.
[I 2026-03-18 18:20:07,681] Trial 42 pruned. 
[I 2026-03-18 18:20:07,984] Trial 41 finished with value: -1.2645136186243646 and parameters: {'n_layers_yyx': 1, 'hidden_size_yyx_l0': 6, 'context_size_yyx': 4, 'num_mix_components_yyx': 5, 'context_extractor_yyx': 'gru', 'activation_func_yyx': 'ReLU', 'L2_weight_yyx': 9.206249719040179e-10, 'L_entropy_weight_yyx': 0.0002139813237968486, 'L_sep_weight_yyx': 2.1045693454078744e-10, 'L_scale_weight_yyx': 1.7594468916479059e-10, 'learning_rate_yyx': 0.007957686169056498}. Best is trial 23 with value: -1.2721869844165175.
[I 2026-03-18 18:20:08,654] Trial 42 finished with value: -1.2710004090822118 and parameters: {'n_layers_yyx': 2, 'hidden_size_yyx_l0': 4, 'hidden_size_yyx_l1': 5, 'context_size_yyx': 4, 'num_mix_components_yyx': 4, 'context_extractor_yyx': 'lstm', 'activation_func_yyx': 'GELU', 'L2_weight_yyx': 0.0008879948190447348, 'L_entropy_weight_yyx': 8.683892122794359e-09, 'L_sep_weight_yyx': 1.1632699438973217e-10, 'L_scale_weight_yyx': 3.323601691098853e-10, 'learning_rate_yyx': 0.005852555850451642}. Best is trial 42 with value: -1.2710004090822118.
[I 2026-03-18 18:20:10,466] Trial 42 pruned. 
[I 2026-03-18 18:20:12,124] Trial 23 pruned. 
[I 2026-03-18 18:20:12,212] Trial 34 pruned. 
[I 2026-03-18 18:20:12,595] Trial 43 pruned. 
[I 2026-03-18 18:20:16,775] Trial 41 finished with value: -3.1195001468361894 and parameters: {'n_layers_yyx': 2, 'hidden_size_yyx_l0': 2, 'hidden_size_yyx_l1': 6, 'context_size_yyx': 2, 'num_mix_components_yyx': 1, 'context_extractor_yyx': 'gru', 'activation_func_yyx': 'Tanh', 'L2_weight_yyx': 1.0382659069180384e-08, 'L_entropy_weight_yyx': 1.0528689178997158e-08, 'L_sep_weight_yyx': 1.241979262157077e-10, 'L_scale_weight_yyx': 1.771316565773775e-05, 'learning_rate_yyx': 0.008601394095097196}. Best is trial 20 with value: -3.160948786990499.
[I 2026-03-18 18:20:18,510] Trial 42 pruned. 
[I 2026-03-18 18:20:19,501] Trial 27 pruned. 
[I 2026-03-18 18:20:19,653] Trial 26 pruned. 
[I 2026-03-18 18:20:22,271] Trial 24 pruned. 
[I 2026-03-18 18:20:24,627] Trial 26 pruned. 
[I 2026-03-18 18:20:27,803] Trial 48 pruned. 
[I 2026-03-18 18:20:30,961] Trial 33 pruned. 
[I 2026-03-18 18:20:31,979] Trial 44 pruned. 
[I 2026-03-18 18:20:32,305] Trial 35 pruned. 
[I 2026-03-18 18:20:33,161] Trial 44 pruned. 
[I 2026-03-18 18:20:37,370] Trial 43 pruned. 
[I 2026-03-18 18:20:39,736] Trial 20 finished with value: -3.1512165406669386 and parameters: {'n_layers_yyx': 2, 'hidden_size_yyx_l0': 6, 'hidden_size_yyx_l1': 5, 'context_size_yyx': 4, 'num_mix_components_yyx': 3, 'context_extractor_yyx': 'lstm', 'activation_func_yyx': 'GELU', 'L2_weight_yyx': 1.0233301700608587e-10, 'L_entropy_weight_yyx': 5.4445241680516865e-05, 'L_sep_weight_yyx': 6.162390829691058e-09, 'L_scale_weight_yyx': 6.555506084558507e-05, 'learning_rate_yyx': 0.00390001157533455}. Best is trial 5 with value: -3.154335707688014.
[I 2026-03-18 18:20:40,663] Trial 31 pruned. 
[I 2026-03-18 18:20:40,894] Trial 36 pruned. 
[I 2026-03-18 18:20:40,931] Trial 45 pruned. 
[I 2026-03-18 18:20:41,111] Trial 25 pruned. 
[I 2026-03-18 18:20:41,986] Trial 30 pruned. 
[I 2026-03-18 18:20:42,145] Trial 24 finished with value: -3.141045244511588 and parameters: {'n_layers_yyx': 1, 'hidden_size_yyx_l0': 2, 'context_size_yyx': 2, 'num_mix_components_yyx': 2, 'context_extractor_yyx': 'gru', 'activation_func_yyx': 'ReLU', 'L2_weight_yyx': 1.0567850831839685e-08, 'L_entropy_weight_yyx': 2.9761018219838365e-08, 'L_sep_weight_yyx': 4.36451837186006e-09, 'L_scale_weight_yyx': 1.0115423442305379e-07, 'learning_rate_yyx': 0.008304170145876786}. Best is trial 2 with value: -3.151229652723366.
[I 2026-03-18 18:20:45,037] Trial 27 pruned. 
[I 2026-03-18 18:20:45,159] Trial 49 pruned. 
[I 2026-03-18 18:20:45,257] Trial 30 finished with value: -1.2657465414727682 and parameters: {'n_layers_yyx': 1, 'hidden_size_yyx_l0': 5, 'context_size_yyx': 4, 'num_mix_components_yyx': 3, 'context_extractor_yyx': 'gru', 'activation_func_yyx': 'Tanh', 'L2_weight_yyx': 3.8977057912929906e-07, 'L_entropy_weight_yyx': 2.895692030481687e-06, 'L_sep_weight_yyx': 6.636015324449525e-09, 'L_scale_weight_yyx': 1.7785774305167368e-06, 'learning_rate_yyx': 0.00772898660646084}. Best is trial 24 with value: -1.2727326976613946.

Source events: 3828
Target events: 16159
Full model ln_yyx : 116.67595 nats/sec, 6.49844 nats/event
Full model Log loss : -0.56796
Full model ln_yyx : 116.07928 nats/sec, 6.46521 nats/event
Full model Log loss : -0.56523
Full model ln_yyx : 117.17513 nats/sec, 6.52625 nats/event
Full model Log loss : -0.56808
Full model ln_yyx : 117.05507 nats/sec, 6.51956 nats/event
Full model Log loss : -0.56728
Full model ln_yyx : 117.26051 nats/sec, 6.53100 nats/event
Full model Log loss : -0.56435
Full model ln_yyx : 119.11043 nats/sec, 6.63404 nats/event
Full model Log loss : -0.57717
Full model ln_yyx : 112.92190 nats/sec, 6.28936 nats/event
Full model Log loss : -0.54825
Full model ln_yyx : 116.21823 nats/sec, 6.47295 nats/event
Full model Log loss : -0.57299
Full model ln_yyx : 118.02622 nats/sec, 6.57365 nats/event
Full model Log loss : -0.56157
Full model ln_yyx : 117.08131 nats/sec, 6.52102 nats/event
Full model Log loss : -0.57979
Full model ln_yyx : 116.17875 nats/sec, 6.47075 nats/event
Full model Log loss : -0.57202
Full model ln_yyx : 114.60285 nats/sec, 6.38298 nats/event
Full model Log loss : -0.54734
Full model ln_yyx : 116.98674 nats/sec, 6.51575 nats/event
Full model Log loss : -0.57955
Full model ln_yyx : 117.53801 nats/sec, 6.54646 nats/event
Full model Log loss : -0.57972
Full model ln_yyx : 116.97295 nats/sec, 6.51499 nats/event
Full model Log loss : -0.58571
Full model ln_yyx : 117.15291 nats/sec, 6.52501 nats/event
Full model Log loss : -0.58602
Full model ln_yyx : 116.99173 nats/sec, 6.51603 nats/event
Full model Log loss : -0.58579
Optimization finished. Config saved to results/opt-full/opt_full_67_best_config.txt
[I 2026-03-18 18:20:48,037] Trial 46 pruned. 
[I 2026-03-18 18:20:48,939] Trial 26 pruned. 
[I 2026-03-18 18:20:49,345] Trial 32 pruned. 
[I 2026-03-18 18:20:49,628] Trial 34 pruned. 
[I 2026-03-18 18:20:50,989] Trial 31 pruned. 
[I 2026-03-18 18:20:51,062] Trial 49 finished with value: -1.2694501330363333 and parameters: {'n_layers_yyx': 2, 'hidden_size_yyx_l0': 3, 'hidden_size_yyx_l1': 5, 'context_size_yyx': 4, 'num_mix_components_yyx': 3, 'context_extractor_yyx': 'gru', 'activation_func_yyx': 'Tanh', 'L2_weight_yyx': 6.634097812746788e-08, 'L_entropy_weight_yyx': 1.504708723652762e-09, 'L_sep_weight_yyx': 3.3779457371325963e-06, 'L_scale_weight_yyx': 6.773558527203452e-09, 'learning_rate_yyx': 0.009800912995107387}. Best is trial 40 with value: -1.2705461004965848.

Source events: 5634
Target events: 38515
Full model ln_yyx : 602.64527 nats/sec, 14.08232 nats/event
Full model Log loss : -1.25522
Full model ln_yyx : 604.25940 nats/sec, 14.12004 nats/event
Full model Log loss : -1.25263
Full model ln_yyx : 598.08416 nats/sec, 13.97574 nats/event
Full model Log loss : -1.24167
Full model ln_yyx : 595.04579 nats/sec, 13.90474 nats/event
Full model Log loss : -1.25383
Full model ln_yyx : 603.71455 nats/sec, 14.10731 nats/event
Full model Log loss : -1.25307
Full model ln_yyx : 598.91163 nats/sec, 13.99508 nats/event
Full model Log loss : -1.24403
Full model ln_yyx : 591.81045 nats/sec, 13.82914 nats/event
Full model Log loss : -1.25242
Full model ln_yyx : 603.51674 nats/sec, 14.10269 nats/event
Full model Log loss : -1.24687
Full model ln_yyx : 609.09030 nats/sec, 14.23293 nats/event
Full model Log loss : -1.27055
Full model ln_yyx : 586.88371 nats/sec, 13.71402 nats/event
Full model Log loss : -1.26104
Full model ln_yyx : 594.99959 nats/sec, 13.90366 nats/event
Full model Log loss : -1.26945
Optimization finished. Config saved to results/opt-full/opt_full_91_best_config.txt
[I 2026-03-18 18:20:52,669] Trial 20 finished with value: -3.1372872531576963 and parameters: {'n_layers_yyx': 2, 'hidden_size_yyx_l0': 5, 'hidden_size_yyx_l1': 3, 'context_size_yyx': 3, 'num_mix_components_yyx': 5, 'context_extractor_yyx': 'lstm', 'activation_func_yyx': 'Tanh', 'L2_weight_yyx': 1.6127329827077096e-06, 'L_entropy_weight_yyx': 2.291943155992514e-06, 'L_sep_weight_yyx': 3.162004060019603e-08, 'L_scale_weight_yyx': 0.0008108288992741098, 'learning_rate_yyx': 0.006972086666727557}. Best is trial 10 with value: -3.1515199681211117.
[I 2026-03-18 18:20:55,473] Trial 44 pruned. 
[I 2026-03-18 18:20:56,859] Trial 43 pruned. 
[I 2026-03-18 18:20:56,901] Trial 47 pruned. 
[I 2026-03-18 18:20:58,110] Trial 27 pruned. 
[I 2026-03-18 18:20:58,729] Trial 43 pruned. 
[I 2026-03-18 18:21:00,465] Trial 33 pruned. 
[I 2026-03-18 18:21:01,670] Trial 32 pruned. 
[I 2026-03-18 18:21:02,444] Trial 36 finished with value: -3.1217261076311056 and parameters: {'n_layers_yyx': 1, 'hidden_size_yyx_l0': 5, 'context_size_yyx': 4, 'num_mix_components_yyx': 2, 'context_extractor_yyx': 'lstm', 'activation_func_yyx': 'GELU', 'L2_weight_yyx': 3.1036843679049793e-10, 'L_entropy_weight_yyx': 2.299410319322801e-08, 'L_sep_weight_yyx': 1.2651424021118998e-09, 'L_scale_weight_yyx': 1.4591622536168366e-08, 'learning_rate_yyx': 0.008445695489710527}. Best is trial 16 with value: -3.149974272486285.
[I 2026-03-18 18:21:02,901] Trial 42 pruned. 
[I 2026-03-18 18:21:08,954] Trial 44 pruned. 
[I 2026-03-18 18:21:09,103] Trial 35 pruned. 
[I 2026-03-18 18:21:10,617] Trial 34 pruned. 
[I 2026-03-18 18:21:10,913] Trial 33 pruned. 
[I 2026-03-18 18:21:11,203] Trial 25 finished with value: -3.152748146031954 and parameters: {'n_layers_yyx': 2, 'hidden_size_yyx_l0': 6, 'hidden_size_yyx_l1': 4, 'context_size_yyx': 4, 'num_mix_components_yyx': 5, 'context_extractor_yyx': 'lstm', 'activation_func_yyx': 'GELU', 'L2_weight_yyx': 2.3600120054928294e-05, 'L_entropy_weight_yyx': 1.6594326461199672e-09, 'L_sep_weight_yyx': 1.2756421039476377e-05, 'L_scale_weight_yyx': 2.6385221807310074e-10, 'learning_rate_yyx': 0.006698408801759602}. Best is trial 25 with value: -3.152748146031954.
[I 2026-03-18 18:21:11,387] Trial 42 finished with value: -1.2470302476019164 and parameters: {'n_layers_yyx': 2, 'hidden_size_yyx_l0': 6, 'hidden_size_yyx_l1': 5, 'context_size_yyx': 1, 'num_mix_components_yyx': 5, 'context_extractor_yyx': 'gru', 'activation_func_yyx': 'Tanh', 'L2_weight_yyx': 1.53944503249862e-07, 'L_entropy_weight_yyx': 2.682799233988566e-07, 'L_sep_weight_yyx': 4.6159047307843537e-07, 'L_scale_weight_yyx': 2.9341738138074845e-06, 'learning_rate_yyx': 0.009881029493324141}. Best is trial 11 with value: -1.2697828860467992.
[I 2026-03-18 18:21:13,574] Trial 43 finished with value: -0.5600101308284796 and parameters: {'n_layers_yyx': 2, 'hidden_size_yyx_l0': 6, 'hidden_size_yyx_l1': 6, 'context_size_yyx': 4, 'num_mix_components_yyx': 3, 'context_extractor_yyx': 'lstm', 'activation_func_yyx': 'GELU', 'L2_weight_yyx': 2.2732173700501604e-08, 'L_entropy_weight_yyx': 2.684663418918885e-07, 'L_sep_weight_yyx': 0.0003031468332268446, 'L_scale_weight_yyx': 0.0007733196207170118, 'learning_rate_yyx': 0.0016984127891234446}. Best is trial 3 with value: -0.584032942865049.
[I 2026-03-18 18:21:15,044] Trial 27 pruned. 
[I 2026-03-18 18:21:15,445] Trial 48 pruned. 
[I 2026-03-18 18:21:19,401] Trial 45 pruned. 
[I 2026-03-18 18:21:20,820] Trial 37 pruned. 
[I 2026-03-18 18:21:21,142] Trial 34 pruned. 
[I 2026-03-18 18:21:22,434] Trial 44 pruned. 
