Warning: Failed writing log files to directory [/var/log/nvidia-mps]. No logs will be available.
[I 2026-03-18 16:24:46,984] A new study created in RDB with name: opt_full-model_seed=42_task=0
[I 2026-03-18 16:24:46,984] A new study created in RDB with name: opt_full-model_seed=42_task=25
[I 2026-03-18 16:24:46,995] A new study created in RDB with name: opt_full-model_seed=42_task=29
[I 2026-03-18 16:24:46,995] A new study created in RDB with name: opt_full-model_seed=42_task=23
[I 2026-03-18 16:24:46,995] A new study created in RDB with name: opt_full-model_seed=42_task=13
[I 2026-03-18 16:24:46,995] A new study created in RDB with name: opt_full-model_seed=42_task=20
[I 2026-03-18 16:24:46,998] A new study created in RDB with name: opt_full-model_seed=42_task=5
[I 2026-03-18 16:24:47,003] A new study created in RDB with name: opt_full-model_seed=42_task=18
[I 2026-03-18 16:24:47,004] A new study created in RDB with name: opt_full-model_seed=42_task=31
[I 2026-03-18 16:24:47,005] A new study created in RDB with name: opt_full-model_seed=42_task=3
[I 2026-03-18 16:24:47,014] A new study created in RDB with name: opt_full-model_seed=42_task=26
[I 2026-03-18 16:24:47,015] A new study created in RDB with name: opt_full-model_seed=42_task=17
[I 2026-03-18 16:24:47,015] A new study created in RDB with name: opt_full-model_seed=42_task=11
[I 2026-03-18 16:24:47,015] A new study created in RDB with name: opt_full-model_seed=42_task=15
[I 2026-03-18 16:24:47,015] A new study created in RDB with name: opt_full-model_seed=42_task=30
[I 2026-03-18 16:24:47,015] A new study created in RDB with name: opt_full-model_seed=42_task=10
[I 2026-03-18 16:24:47,017] A new study created in RDB with name: opt_full-model_seed=42_task=19
[I 2026-03-18 16:24:47,017] A new study created in RDB with name: opt_full-model_seed=42_task=7
[I 2026-03-18 16:24:47,021] A new study created in RDB with name: opt_full-model_seed=42_task=14
[I 2026-03-18 16:24:47,022] A new study created in RDB with name: opt_full-model_seed=42_task=8
[I 2026-03-18 16:24:47,023] A new study created in RDB with name: opt_full-model_seed=42_task=12
[I 2026-03-18 16:24:47,025] A new study created in RDB with name: opt_full-model_seed=42_task=22
[I 2026-03-18 16:24:47,030] A new study created in RDB with name: opt_full-model_seed=42_task=6
[I 2026-03-18 16:24:47,043] A new study created in RDB with name: opt_full-model_seed=42_task=4
[I 2026-03-18 16:24:47,044] A new study created in RDB with name: opt_full-model_seed=42_task=1
[I 2026-03-18 16:24:47,045] A new study created in RDB with name: opt_full-model_seed=42_task=21
[I 2026-03-18 16:24:47,046] A new study created in RDB with name: opt_full-model_seed=42_task=2
[I 2026-03-18 16:24:47,048] A new study created in RDB with name: opt_full-model_seed=42_task=28
[I 2026-03-18 16:24:47,048] A new study created in RDB with name: opt_full-model_seed=42_task=16
[I 2026-03-18 16:24:47,049] A new study created in RDB with name: opt_full-model_seed=42_task=9
[I 2026-03-18 16:24:47,052] A new study created in RDB with name: opt_full-model_seed=42_task=27
[I 2026-03-18 16:24:47,062] A new study created in RDB with name: opt_full-model_seed=42_task=24
[I 2026-03-18 16:25:49,590] Trial 0 finished with value: -0.3806096599567047 and parameters: {'n_layers_yyx': 2, 'hidden_size_yyx_l0': 2, 'hidden_size_yyx_l1': 5, 'context_size_yyx': 2, 'num_mix_components_yyx': 1, 'context_extractor_yyx': 'gru', 'activation_func_yyx': 'ReLU', 'L2_weight_yyx': 2.469253599335303e-09, 'L_entropy_weight_yyx': 3.119804859321173e-05, 'L_sep_weight_yyx': 1.857032228718288e-09, 'L_scale_weight_yyx': 1.794882154809652e-07, 'learning_rate_yyx': 0.003835267538451589}. Best is trial 0 with value: -0.3806096599567047.
[I 2026-03-18 16:25:56,062] Trial 0 finished with value: -0.41448025068631483 and parameters: {'n_layers_yyx': 1, 'hidden_size_yyx_l0': 6, 'context_size_yyx': 4, 'num_mix_components_yyx': 2, 'context_extractor_yyx': 'lstm', 'activation_func_yyx': 'GELU', 'L2_weight_yyx': 3.124613139397388e-08, 'L_entropy_weight_yyx': 7.057932827936446e-08, 'L_sep_weight_yyx': 0.00045675574892738104, 'L_scale_weight_yyx': 1.1579883475330345e-07, 'learning_rate_yyx': 0.004671871806688475}. Best is trial 0 with value: -0.41448025068631483.
[I 2026-03-18 16:25:57,122] Trial 0 finished with value: -0.42318347659273414 and parameters: {'n_layers_yyx': 1, 'hidden_size_yyx_l0': 4, 'context_size_yyx': 4, 'num_mix_components_yyx': 3, 'context_extractor_yyx': 'lstm', 'activation_func_yyx': 'ReLU', 'L2_weight_yyx': 0.00021895284516954856, 'L_entropy_weight_yyx': 7.904733431708011e-05, 'L_sep_weight_yyx': 2.764892184305967e-07, 'L_scale_weight_yyx': 3.864879672857602e-09, 'learning_rate_yyx': 0.00838151017922192}. Best is trial 0 with value: -0.42318347659273414.
[I 2026-03-18 16:25:58,285] Trial 0 finished with value: -0.3628922217401558 and parameters: {'n_layers_yyx': 1, 'hidden_size_yyx_l0': 2, 'context_size_yyx': 4, 'num_mix_components_yyx': 5, 'context_extractor_yyx': 'lstm', 'activation_func_yyx': 'GELU', 'L2_weight_yyx': 8.670509116133354e-08, 'L_entropy_weight_yyx': 0.00031462728642617184, 'L_sep_weight_yyx': 3.0060086550317826e-06, 'L_scale_weight_yyx': 4.239936878596754e-06, 'learning_rate_yyx': 0.0043372966502087055}. Best is trial 0 with value: -0.3628922217401558.
[I 2026-03-18 16:26:03,496] Trial 0 finished with value: -0.42020291071558147 and parameters: {'n_layers_yyx': 1, 'hidden_size_yyx_l0': 3, 'context_size_yyx': 4, 'num_mix_components_yyx': 4, 'context_extractor_yyx': 'lstm', 'activation_func_yyx': 'Tanh', 'L2_weight_yyx': 1.1830081554852043e-10, 'L_entropy_weight_yyx': 1.182302102550067e-09, 'L_sep_weight_yyx': 2.8822742231117735e-10, 'L_scale_weight_yyx': 1.1677892328870808e-08, 'learning_rate_yyx': 0.004680838899250946}. Best is trial 0 with value: -0.42020291071558147.
[I 2026-03-18 16:26:15,624] Trial 0 finished with value: -0.4201308212044069 and parameters: {'n_layers_yyx': 2, 'hidden_size_yyx_l0': 2, 'hidden_size_yyx_l1': 5, 'context_size_yyx': 4, 'num_mix_components_yyx': 4, 'context_extractor_yyx': 'gru', 'activation_func_yyx': 'GELU', 'L2_weight_yyx': 1.4527339781126858e-06, 'L_entropy_weight_yyx': 7.574962773239221e-09, 'L_sep_weight_yyx': 4.694838508068775e-07, 'L_scale_weight_yyx': 7.199745200680921e-10, 'learning_rate_yyx': 0.002224067590539308}. Best is trial 0 with value: -0.4201308212044069.
[I 2026-03-18 16:26:16,090] Trial 0 finished with value: -0.3737496296318692 and parameters: {'n_layers_yyx': 2, 'hidden_size_yyx_l0': 2, 'hidden_size_yyx_l1': 5, 'context_size_yyx': 2, 'num_mix_components_yyx': 5, 'context_extractor_yyx': 'lstm', 'activation_func_yyx': 'ReLU', 'L2_weight_yyx': 3.637967898336577e-09, 'L_entropy_weight_yyx': 5.8873443644686966e-08, 'L_sep_weight_yyx': 3.3167489125268254e-08, 'L_scale_weight_yyx': 0.00011839728768241446, 'learning_rate_yyx': 0.003199047015728797}. Best is trial 0 with value: -0.3737496296318692.
[I 2026-03-18 16:26:17,421] Trial 1 finished with value: -0.3146674566593702 and parameters: {'n_layers_yyx': 1, 'hidden_size_yyx_l0': 5, 'context_size_yyx': 4, 'num_mix_components_yyx': 3, 'context_extractor_yyx': 'lstm', 'activation_func_yyx': 'ReLU', 'L2_weight_yyx': 5.985734422387868e-08, 'L_entropy_weight_yyx': 6.609880478562935e-10, 'L_sep_weight_yyx': 1.4054570038611648e-06, 'L_scale_weight_yyx': 1.353729489348751e-10, 'learning_rate_yyx': 0.0017409065044750463}. Best is trial 0 with value: -0.3628922217401558.
[I 2026-03-18 16:26:34,393] Trial 0 finished with value: -0.41803158030790444 and parameters: {'n_layers_yyx': 1, 'hidden_size_yyx_l0': 5, 'context_size_yyx': 2, 'num_mix_components_yyx': 1, 'context_extractor_yyx': 'gru', 'activation_func_yyx': 'Tanh', 'L2_weight_yyx': 5.399756710915507e-07, 'L_entropy_weight_yyx': 1.6887946350920511e-09, 'L_sep_weight_yyx': 2.9654314527073024e-09, 'L_scale_weight_yyx': 6.794619905691904e-08, 'learning_rate_yyx': 0.0023792734110921593}. Best is trial 0 with value: -0.41803158030790444.
[I 2026-03-18 16:26:34,961] Trial 0 finished with value: -0.38955794768436774 and parameters: {'n_layers_yyx': 2, 'hidden_size_yyx_l0': 3, 'hidden_size_yyx_l1': 4, 'context_size_yyx': 3, 'num_mix_components_yyx': 3, 'context_extractor_yyx': 'lstm', 'activation_func_yyx': 'Tanh', 'L2_weight_yyx': 6.132605399676106e-09, 'L_entropy_weight_yyx': 2.3782298315866713e-10, 'L_sep_weight_yyx': 0.00032404261655076853, 'L_scale_weight_yyx': 6.052778906609361e-09, 'learning_rate_yyx': 0.0015268745348583348}. Best is trial 0 with value: -0.38955794768436774.
[I 2026-03-18 16:26:36,174] Trial 1 finished with value: -0.4307959589057663 and parameters: {'n_layers_yyx': 2, 'hidden_size_yyx_l0': 5, 'hidden_size_yyx_l1': 4, 'context_size_yyx': 4, 'num_mix_components_yyx': 5, 'context_extractor_yyx': 'lstm', 'activation_func_yyx': 'Tanh', 'L2_weight_yyx': 1.2337665541178388e-07, 'L_entropy_weight_yyx': 3.9208428686026786e-09, 'L_sep_weight_yyx': 0.0001686728588062921, 'L_scale_weight_yyx': 0.0002674643338151963, 'learning_rate_yyx': 0.004548757772669904}. Best is trial 1 with value: -0.4307959589057663.
[I 2026-03-18 16:26:41,658] Trial 0 finished with value: -0.41402867556356426 and parameters: {'n_layers_yyx': 1, 'hidden_size_yyx_l0': 2, 'context_size_yyx': 2, 'num_mix_components_yyx': 1, 'context_extractor_yyx': 'lstm', 'activation_func_yyx': 'GELU', 'L2_weight_yyx': 7.619531773181919e-06, 'L_entropy_weight_yyx': 4.0001924258897394e-07, 'L_sep_weight_yyx': 1.1338980042111886e-06, 'L_scale_weight_yyx': 4.595791871974139e-09, 'learning_rate_yyx': 0.005365085655670386}. Best is trial 0 with value: -0.41402867556356426.
[I 2026-03-18 16:26:42,107] Trial 0 finished with value: -0.4070883830634433 and parameters: {'n_layers_yyx': 1, 'hidden_size_yyx_l0': 2, 'context_size_yyx': 2, 'num_mix_components_yyx': 1, 'context_extractor_yyx': 'lstm', 'activation_func_yyx': 'Tanh', 'L2_weight_yyx': 0.0003083836360341886, 'L_entropy_weight_yyx': 3.9953103589986687e-07, 'L_sep_weight_yyx': 0.00013334373964347422, 'L_scale_weight_yyx': 9.198937516213962e-08, 'learning_rate_yyx': 0.005476044396501104}. Best is trial 0 with value: -0.4070883830634433.
[I 2026-03-18 16:26:44,444] Trial 0 finished with value: -0.4236573021478328 and parameters: {'n_layers_yyx': 1, 'hidden_size_yyx_l0': 5, 'context_size_yyx': 1, 'num_mix_components_yyx': 1, 'context_extractor_yyx': 'gru', 'activation_func_yyx': 'Tanh', 'L2_weight_yyx': 2.7648294282283033e-07, 'L_entropy_weight_yyx': 4.0731849671716635e-06, 'L_sep_weight_yyx': 3.5984000510226164e-09, 'L_scale_weight_yyx': 6.164506362468594e-10, 'learning_rate_yyx': 0.0067548923400389425}. Best is trial 0 with value: -0.4236573021478328.
[I 2026-03-18 16:26:44,649] Trial 0 finished with value: -0.10151797551488728 and parameters: {'n_layers_yyx': 1, 'hidden_size_yyx_l0': 2, 'context_size_yyx': 1, 'num_mix_components_yyx': 1, 'context_extractor_yyx': 'gru', 'activation_func_yyx': 'ReLU', 'L2_weight_yyx': 7.133479304321945e-08, 'L_entropy_weight_yyx': 1.9151078072899317e-08, 'L_sep_weight_yyx': 8.145033614597184e-07, 'L_scale_weight_yyx': 9.091477851910092e-10, 'learning_rate_yyx': 0.0009554326407863617}. Best is trial 0 with value: -0.10151797551488728.
[I 2026-03-18 16:26:47,677] Trial 0 finished with value: -2.7804692330482275 and parameters: {'n_layers_yyx': 2, 'hidden_size_yyx_l0': 2, 'hidden_size_yyx_l1': 6, 'context_size_yyx': 4, 'num_mix_components_yyx': 3, 'context_extractor_yyx': 'gru', 'activation_func_yyx': 'ReLU', 'L2_weight_yyx': 2.0836005954464307e-08, 'L_entropy_weight_yyx': 6.835574315860529e-08, 'L_sep_weight_yyx': 0.00010462275707926425, 'L_scale_weight_yyx': 4.1717806425492297e-10, 'learning_rate_yyx': 0.005703667551670905}. Best is trial 0 with value: -2.7804692330482275.
[I 2026-03-18 16:26:48,059] Trial 0 finished with value: -0.20029324274683147 and parameters: {'n_layers_yyx': 1, 'hidden_size_yyx_l0': 2, 'context_size_yyx': 1, 'num_mix_components_yyx': 1, 'context_extractor_yyx': 'gru', 'activation_func_yyx': 'ReLU', 'L2_weight_yyx': 9.284514353138324e-06, 'L_entropy_weight_yyx': 1.6804333556074224e-05, 'L_sep_weight_yyx': 8.639833070622289e-06, 'L_scale_weight_yyx': 0.0009278746441098939, 'learning_rate_yyx': 0.0012246669765383893}. Best is trial 0 with value: -0.20029324274683147.
[I 2026-03-18 16:26:49,588] Trial 0 finished with value: -0.41437183297455493 and parameters: {'n_layers_yyx': 2, 'hidden_size_yyx_l0': 4, 'hidden_size_yyx_l1': 3, 'context_size_yyx': 2, 'num_mix_components_yyx': 2, 'context_extractor_yyx': 'lstm', 'activation_func_yyx': 'GELU', 'L2_weight_yyx': 5.590085044005043e-06, 'L_entropy_weight_yyx': 2.5868306299628656e-05, 'L_sep_weight_yyx': 3.6633720704531447e-09, 'L_scale_weight_yyx': 2.498338504619906e-05, 'learning_rate_yyx': 0.003927654172969819}. Best is trial 0 with value: -0.41437183297455493.
[I 2026-03-18 16:26:57,948] Trial 0 finished with value: -2.798090549444649 and parameters: {'n_layers_yyx': 2, 'hidden_size_yyx_l0': 5, 'hidden_size_yyx_l1': 6, 'context_size_yyx': 2, 'num_mix_components_yyx': 4, 'context_extractor_yyx': 'gru', 'activation_func_yyx': 'ReLU', 'L2_weight_yyx': 4.851209891973187e-07, 'L_entropy_weight_yyx': 2.2840284856201393e-08, 'L_sep_weight_yyx': 3.91132107378385e-08, 'L_scale_weight_yyx': 1.1883216745592972e-08, 'learning_rate_yyx': 0.00784834566766705}. Best is trial 0 with value: -2.798090549444649.
[I 2026-03-18 16:27:00,184] Trial 1 finished with value: -0.33862838508913023 and parameters: {'n_layers_yyx': 2, 'hidden_size_yyx_l0': 2, 'hidden_size_yyx_l1': 5, 'context_size_yyx': 2, 'num_mix_components_yyx': 4, 'context_extractor_yyx': 'gru', 'activation_func_yyx': 'GELU', 'L2_weight_yyx': 0.0001304203251426376, 'L_entropy_weight_yyx': 3.8849978367979206e-06, 'L_sep_weight_yyx': 6.701646554558443e-10, 'L_scale_weight_yyx': 0.00016102631253903026, 'learning_rate_yyx': 0.0073798028277460865}. Best is trial 0 with value: -0.4070883830634433.
[I 2026-03-18 16:27:00,991] Trial 1 finished with value: -0.3853979199294335 and parameters: {'n_layers_yyx': 2, 'hidden_size_yyx_l0': 5, 'hidden_size_yyx_l1': 6, 'context_size_yyx': 3, 'num_mix_components_yyx': 3, 'context_extractor_yyx': 'gru', 'activation_func_yyx': 'Tanh', 'L2_weight_yyx': 3.930467948676344e-06, 'L_entropy_weight_yyx': 9.77696027304126e-07, 'L_sep_weight_yyx': 0.00018187178028270022, 'L_scale_weight_yyx': 8.294160755462855e-09, 'learning_rate_yyx': 0.007432133087914012}. Best is trial 0 with value: -0.4236573021478328.
[I 2026-03-18 16:27:03,412] Trial 2 pruned. 
[I 2026-03-18 16:27:03,442] Trial 1 finished with value: -0.44267641427716237 and parameters: {'n_layers_yyx': 2, 'hidden_size_yyx_l0': 3, 'hidden_size_yyx_l1': 4, 'context_size_yyx': 1, 'num_mix_components_yyx': 1, 'context_extractor_yyx': 'lstm', 'activation_func_yyx': 'Tanh', 'L2_weight_yyx': 1.2648150179555586e-08, 'L_entropy_weight_yyx': 3.5249290251537785e-06, 'L_sep_weight_yyx': 2.2907360966884523e-08, 'L_scale_weight_yyx': 2.2713206148614133e-08, 'learning_rate_yyx': 0.0018113736995530592}. Best is trial 1 with value: -0.44267641427716237.
[I 2026-03-18 16:27:07,403] Trial 1 pruned. 
[I 2026-03-18 16:27:08,037] Trial 1 finished with value: -0.36080509811732053 and parameters: {'n_layers_yyx': 2, 'hidden_size_yyx_l0': 3, 'hidden_size_yyx_l1': 2, 'context_size_yyx': 3, 'num_mix_components_yyx': 2, 'context_extractor_yyx': 'gru', 'activation_func_yyx': 'Tanh', 'L2_weight_yyx': 4.143910296608397e-07, 'L_entropy_weight_yyx': 5.825016782486403e-06, 'L_sep_weight_yyx': 1.8192864033339516e-07, 'L_scale_weight_yyx': 3.892968514462846e-09, 'learning_rate_yyx': 0.00826772693412547}. Best is trial 0 with value: -0.3737496296318692.
[I 2026-03-18 16:27:10,657] Trial 2 pruned. 
[I 2026-03-18 16:27:11,811] Trial 0 finished with value: -2.775138932601483 and parameters: {'n_layers_yyx': 2, 'hidden_size_yyx_l0': 6, 'hidden_size_yyx_l1': 6, 'context_size_yyx': 1, 'num_mix_components_yyx': 1, 'context_extractor_yyx': 'gru', 'activation_func_yyx': 'ReLU', 'L2_weight_yyx': 1.9716181806208377e-06, 'L_entropy_weight_yyx': 1.1626791059012432e-07, 'L_sep_weight_yyx': 6.951529369606133e-08, 'L_scale_weight_yyx': 4.009875649821034e-05, 'learning_rate_yyx': 0.0015080404467404935}. Best is trial 0 with value: -2.775138932601483.
[I 2026-03-18 16:27:11,884] Trial 2 pruned. 
[I 2026-03-18 16:27:12,429] Trial 1 finished with value: -0.3578398382700634 and parameters: {'n_layers_yyx': 1, 'hidden_size_yyx_l0': 6, 'context_size_yyx': 3, 'num_mix_components_yyx': 5, 'context_extractor_yyx': 'gru', 'activation_func_yyx': 'Tanh', 'L2_weight_yyx': 3.887791784031536e-05, 'L_entropy_weight_yyx': 7.443673401565098e-05, 'L_sep_weight_yyx': 8.447441390791532e-06, 'L_scale_weight_yyx': 0.0008507910886168921, 'learning_rate_yyx': 0.0012113916895923416}. Best is trial 0 with value: -0.41402867556356426.
[I 2026-03-18 16:27:15,789] Trial 2 pruned. 
[I 2026-03-18 16:27:17,846] Trial 1 finished with value: -0.29747198240675793 and parameters: {'n_layers_yyx': 1, 'hidden_size_yyx_l0': 2, 'context_size_yyx': 2, 'num_mix_components_yyx': 2, 'context_extractor_yyx': 'lstm', 'activation_func_yyx': 'ReLU', 'L2_weight_yyx': 5.135297055673421e-05, 'L_entropy_weight_yyx': 0.00018509633339063974, 'L_sep_weight_yyx': 1.8380821525893027e-10, 'L_scale_weight_yyx': 1.0500658617979512e-05, 'learning_rate_yyx': 0.0005169498906447631}. Best is trial 0 with value: -0.41448025068631483.
[I 2026-03-18 16:27:18,915] Trial 3 pruned. 
[I 2026-03-18 16:27:19,047] Trial 3 pruned. 
[I 2026-03-18 16:27:19,050] Trial 1 finished with value: -0.44041338941261127 and parameters: {'n_layers_yyx': 1, 'hidden_size_yyx_l0': 6, 'context_size_yyx': 4, 'num_mix_components_yyx': 4, 'context_extractor_yyx': 'lstm', 'activation_func_yyx': 'Tanh', 'L2_weight_yyx': 2.766425752584324e-09, 'L_entropy_weight_yyx': 1.4422005282302486e-08, 'L_sep_weight_yyx': 7.40999746217043e-05, 'L_scale_weight_yyx': 5.337758634780637e-07, 'learning_rate_yyx': 0.0006032496620323902}. Best is trial 1 with value: -0.44041338941261127.
[I 2026-03-18 16:27:21,349] Trial 1 finished with value: -0.3980694466700126 and parameters: {'n_layers_yyx': 1, 'hidden_size_yyx_l0': 6, 'context_size_yyx': 2, 'num_mix_components_yyx': 4, 'context_extractor_yyx': 'lstm', 'activation_func_yyx': 'ReLU', 'L2_weight_yyx': 2.328860764083645e-09, 'L_entropy_weight_yyx': 1.2073554046514423e-10, 'L_sep_weight_yyx': 7.196481664144481e-06, 'L_scale_weight_yyx': 2.4920992276275543e-05, 'learning_rate_yyx': 0.0026993470526672034}. Best is trial 1 with value: -0.3980694466700126.
[I 2026-03-18 16:27:22,724] Trial 2 pruned. 
[I 2026-03-18 16:27:24,494] Trial 1 finished with value: -0.3680083567143963 and parameters: {'n_layers_yyx': 1, 'hidden_size_yyx_l0': 3, 'context_size_yyx': 3, 'num_mix_components_yyx': 2, 'context_extractor_yyx': 'lstm', 'activation_func_yyx': 'GELU', 'L2_weight_yyx': 0.0001794204763564864, 'L_entropy_weight_yyx': 2.0084567756689606e-08, 'L_sep_weight_yyx': 3.757356004586724e-07, 'L_scale_weight_yyx': 1.0018799743067778e-09, 'learning_rate_yyx': 0.0005740421184782872}. Best is trial 0 with value: -0.42020291071558147.
[I 2026-03-18 16:27:25,242] Trial 4 pruned. 
[I 2026-03-18 16:27:25,824] Trial 0 finished with value: -2.7834935089196224 and parameters: {'n_layers_yyx': 1, 'hidden_size_yyx_l0': 6, 'context_size_yyx': 2, 'num_mix_components_yyx': 5, 'context_extractor_yyx': 'lstm', 'activation_func_yyx': 'ReLU', 'L2_weight_yyx': 1.255423980772674e-09, 'L_entropy_weight_yyx': 5.297880911536484e-06, 'L_sep_weight_yyx': 0.0002632286192006429, 'L_scale_weight_yyx': 1.3352887187413717e-08, 'learning_rate_yyx': 0.0012294268684462908}. Best is trial 0 with value: -2.7834935089196224.
[I 2026-03-18 16:27:26,635] Trial 2 finished with value: -0.41988984571521865 and parameters: {'n_layers_yyx': 1, 'hidden_size_yyx_l0': 4, 'context_size_yyx': 3, 'num_mix_components_yyx': 3, 'context_extractor_yyx': 'gru', 'activation_func_yyx': 'Tanh', 'L2_weight_yyx': 1.6634047771876085e-08, 'L_entropy_weight_yyx': 1.839075820970411e-09, 'L_sep_weight_yyx': 0.0009004886309108014, 'L_scale_weight_yyx': 3.044237531493495e-06, 'learning_rate_yyx': 0.006480858211543912}. Best is trial 1 with value: -0.44267641427716237.
[I 2026-03-18 16:27:28,538] Trial 5 pruned. 
[I 2026-03-18 16:27:28,809] Trial 1 finished with value: -0.4204067549100232 and parameters: {'n_layers_yyx': 2, 'hidden_size_yyx_l0': 3, 'hidden_size_yyx_l1': 6, 'context_size_yyx': 4, 'num_mix_components_yyx': 1, 'context_extractor_yyx': 'lstm', 'activation_func_yyx': 'GELU', 'L2_weight_yyx': 1.0744422071208541e-07, 'L_entropy_weight_yyx': 9.490227850405843e-07, 'L_sep_weight_yyx': 2.893612334662775e-08, 'L_scale_weight_yyx': 0.0009104422463714115, 'learning_rate_yyx': 0.0029212586407246673}. Best is trial 1 with value: -0.4204067549100232.
[I 2026-03-18 16:27:30,254] Trial 3 pruned. 
[I 2026-03-18 16:27:32,025] Trial 6 pruned. 
[I 2026-03-18 16:27:32,789] Trial 0 finished with value: -2.7945694753775014 and parameters: {'n_layers_yyx': 2, 'hidden_size_yyx_l0': 5, 'hidden_size_yyx_l1': 4, 'context_size_yyx': 3, 'num_mix_components_yyx': 2, 'context_extractor_yyx': 'lstm', 'activation_func_yyx': 'Tanh', 'L2_weight_yyx': 1.4363513901398662e-05, 'L_entropy_weight_yyx': 1.361948558161947e-06, 'L_sep_weight_yyx': 4.11477645289492e-06, 'L_scale_weight_yyx': 4.559371758487078e-09, 'learning_rate_yyx': 0.009262447876244622}. Best is trial 0 with value: -2.7945694753775014.
[I 2026-03-18 16:27:33,698] Trial 4 pruned. 
[I 2026-03-18 16:27:36,857] Trial 5 pruned. 
[I 2026-03-18 16:27:38,427] Trial 7 pruned. 
