[I 2026-03-18 16:45:38,355] Trial 24 finished with value: -2.798767703717539 and parameters: {'n_layers_yyx': 1, 'hidden_size_yyx_l0': 5, 'context_size_yyx': 4, 'num_mix_components_yyx': 5, 'context_extractor_yyx': 'lstm', 'activation_func_yyx': 'Tanh', 'L2_weight_yyx': 9.646016918612799e-06, 'L_entropy_weight_yyx': 1.8313863482396821e-06, 'L_sep_weight_yyx': 8.698596040883199e-07, 'L_scale_weight_yyx': 4.0663291704526596e-05, 'learning_rate_yyx': 0.007124859747245845}. Best is trial 24 with value: -2.798767703717539.
[I 2026-03-18 16:45:41,105] Trial 10 finished with value: -2.802766876445575 and parameters: {'n_layers_yyx': 2, 'hidden_size_yyx_l0': 2, 'hidden_size_yyx_l1': 6, 'context_size_yyx': 4, 'num_mix_components_yyx': 3, 'context_extractor_yyx': 'lstm', 'activation_func_yyx': 'Tanh', 'L2_weight_yyx': 1.1840441457199692e-08, 'L_entropy_weight_yyx': 3.414576843274966e-08, 'L_sep_weight_yyx': 1.769956539574125e-07, 'L_scale_weight_yyx': 2.060508087707878e-10, 'learning_rate_yyx': 0.004083494156648047}. Best is trial 9 with value: -2.8084722793451675.
[I 2026-03-18 16:45:43,189] Trial 13 pruned. 
[I 2026-03-18 16:45:46,564] Trial 11 pruned. 
[I 2026-03-18 16:45:48,919] Trial 28 pruned. 
[I 2026-03-18 16:45:56,708] Trial 14 pruned. 
[I 2026-03-18 16:45:57,325] Trial 12 finished with value: -2.8040485834650117 and parameters: {'n_layers_yyx': 1, 'hidden_size_yyx_l0': 6, 'context_size_yyx': 4, 'num_mix_components_yyx': 2, 'context_extractor_yyx': 'lstm', 'activation_func_yyx': 'ReLU', 'L2_weight_yyx': 5.22104190553142e-07, 'L_entropy_weight_yyx': 2.4846698789122225e-09, 'L_sep_weight_yyx': 1.0242715708716019e-07, 'L_scale_weight_yyx': 3.202807868441506e-05, 'learning_rate_yyx': 0.009550453717490333}. Best is trial 7 with value: -2.8073737460176833.
[I 2026-03-18 16:46:04,037] Trial 19 pruned. 
[I 2026-03-18 16:46:10,973] Trial 13 pruned. 
[I 2026-03-18 16:46:31,248] Trial 7 finished with value: -2.792293338216945 and parameters: {'n_layers_yyx': 1, 'hidden_size_yyx_l0': 3, 'context_size_yyx': 1, 'num_mix_components_yyx': 4, 'context_extractor_yyx': 'lstm', 'activation_func_yyx': 'Tanh', 'L2_weight_yyx': 1.1771644048261462e-05, 'L_entropy_weight_yyx': 1.9606521823181113e-10, 'L_sep_weight_yyx': 6.119776209042071e-06, 'L_scale_weight_yyx': 1.4619122559996996e-08, 'learning_rate_yyx': 0.0015041297513002875}. Best is trial 6 with value: -2.805382927239302.
[I 2026-03-18 16:46:33,109] Trial 15 finished with value: -2.7976778555064636 and parameters: {'n_layers_yyx': 1, 'hidden_size_yyx_l0': 6, 'context_size_yyx': 4, 'num_mix_components_yyx': 4, 'context_extractor_yyx': 'lstm', 'activation_func_yyx': 'ReLU', 'L2_weight_yyx': 1.355179677351417e-07, 'L_entropy_weight_yyx': 9.048556744481128e-05, 'L_sep_weight_yyx': 9.273201447526541e-06, 'L_scale_weight_yyx': 1.6745788805182267e-06, 'learning_rate_yyx': 0.0034723492953914006}. Best is trial 5 with value: -2.8058216093098.
[I 2026-03-18 16:46:35,602] Trial 15 pruned. 
[I 2026-03-18 16:46:37,227] Trial 8 pruned. 
[I 2026-03-18 16:46:38,768] Trial 29 pruned. 
[I 2026-03-18 16:46:40,325] Trial 22 finished with value: -2.8044397637840572 and parameters: {'n_layers_yyx': 1, 'hidden_size_yyx_l0': 6, 'context_size_yyx': 4, 'num_mix_components_yyx': 2, 'context_extractor_yyx': 'gru', 'activation_func_yyx': 'ReLU', 'L2_weight_yyx': 2.1060589118209598e-10, 'L_entropy_weight_yyx': 0.00010181274553933305, 'L_sep_weight_yyx': 1.519324465453742e-08, 'L_scale_weight_yyx': 3.657978417328914e-10, 'learning_rate_yyx': 0.007040115503299679}. Best is trial 13 with value: -2.8082553050147787.
[I 2026-03-18 16:46:41,425] Trial 16 pruned. 
[I 2026-03-18 16:46:43,044] Trial 9 pruned. 
[I 2026-03-18 16:46:46,171] Trial 30 pruned. 
[I 2026-03-18 16:46:47,313] Trial 17 pruned. 
[I 2026-03-18 16:46:48,700] Trial 14 pruned. 
[I 2026-03-18 16:46:49,064] Trial 12 finished with value: -2.80029438840474 and parameters: {'n_layers_yyx': 2, 'hidden_size_yyx_l0': 5, 'hidden_size_yyx_l1': 6, 'context_size_yyx': 4, 'num_mix_components_yyx': 4, 'context_extractor_yyx': 'lstm', 'activation_func_yyx': 'Tanh', 'L2_weight_yyx': 9.139665509134304e-06, 'L_entropy_weight_yyx': 6.5475669300960635e-09, 'L_sep_weight_yyx': 0.0009866007789426643, 'L_scale_weight_yyx': 1.1103609615923788e-10, 'learning_rate_yyx': 0.0016077596074981421}. Best is trial 11 with value: -2.8017587322763102.
[I 2026-03-18 16:46:54,821] Trial 12 finished with value: -2.8040045752930647 and parameters: {'n_layers_yyx': 2, 'hidden_size_yyx_l0': 3, 'hidden_size_yyx_l1': 4, 'context_size_yyx': 4, 'num_mix_components_yyx': 4, 'context_extractor_yyx': 'lstm', 'activation_func_yyx': 'Tanh', 'L2_weight_yyx': 6.108082313103386e-06, 'L_entropy_weight_yyx': 0.0005915081429319264, 'L_sep_weight_yyx': 1.2703607703471293e-06, 'L_scale_weight_yyx': 0.0009723284060093595, 'learning_rate_yyx': 0.003878030236851009}. Best is trial 5 with value: -2.8051328142627483.
[I 2026-03-18 16:46:55,483] Trial 23 finished with value: -2.7952290982705366 and parameters: {'n_layers_yyx': 1, 'hidden_size_yyx_l0': 6, 'context_size_yyx': 2, 'num_mix_components_yyx': 4, 'context_extractor_yyx': 'lstm', 'activation_func_yyx': 'ReLU', 'L2_weight_yyx': 6.248997550861564e-10, 'L_entropy_weight_yyx': 3.3732862912395675e-10, 'L_sep_weight_yyx': 0.00012091911473985157, 'L_scale_weight_yyx': 2.583009107734007e-09, 'learning_rate_yyx': 0.007363260800836639}. Best is trial 1 with value: -2.804181999864486.
[I 2026-03-18 16:46:56,334] Trial 23 pruned. 
[I 2026-03-18 16:47:01,905] Trial 18 pruned. 
[I 2026-03-18 16:47:02,766] Trial 15 pruned. 
[I 2026-03-18 16:47:04,853] Trial 25 finished with value: -2.7965797367709193 and parameters: {'n_layers_yyx': 1, 'hidden_size_yyx_l0': 6, 'context_size_yyx': 4, 'num_mix_components_yyx': 5, 'context_extractor_yyx': 'lstm', 'activation_func_yyx': 'Tanh', 'L2_weight_yyx': 0.00011554436919172854, 'L_entropy_weight_yyx': 1.8484562240268499e-06, 'L_sep_weight_yyx': 1.2669912455819267e-06, 'L_scale_weight_yyx': 0.0008569734372021721, 'learning_rate_yyx': 0.00964065812473651}. Best is trial 24 with value: -2.798767703717539.
[I 2026-03-18 16:47:08,413] Trial 19 pruned. 
[I 2026-03-18 16:47:14,656] Trial 20 pruned. 
[I 2026-03-18 16:47:16,132] Trial 26 pruned. 
[I 2026-03-18 16:47:16,912] Trial 17 finished with value: -2.7919369790174184 and parameters: {'n_layers_yyx': 2, 'hidden_size_yyx_l0': 2, 'hidden_size_yyx_l1': 4, 'context_size_yyx': 3, 'num_mix_components_yyx': 4, 'context_extractor_yyx': 'gru', 'activation_func_yyx': 'ReLU', 'L2_weight_yyx': 1.488412615503853e-06, 'L_entropy_weight_yyx': 3.756570637170838e-09, 'L_sep_weight_yyx': 3.502306639280469e-09, 'L_scale_weight_yyx': 3.589733208050755e-08, 'learning_rate_yyx': 0.0030139630157198114}. Best is trial 5 with value: -2.805070761203844.
[I 2026-03-18 16:47:17,110] Trial 16 pruned. 
[I 2026-03-18 16:47:22,605] Trial 10 pruned. 
[I 2026-03-18 16:47:23,901] Trial 31 pruned. 
[I 2026-03-18 16:47:28,978] Trial 11 pruned. 
[I 2026-03-18 16:47:29,633] Trial 21 pruned. 
[I 2026-03-18 16:47:33,041] Trial 17 finished with value: -2.796054773163377 and parameters: {'n_layers_yyx': 2, 'hidden_size_yyx_l0': 4, 'hidden_size_yyx_l1': 3, 'context_size_yyx': 2, 'num_mix_components_yyx': 2, 'context_extractor_yyx': 'gru', 'activation_func_yyx': 'Tanh', 'L2_weight_yyx': 7.205665317768507e-07, 'L_entropy_weight_yyx': 8.952317437161471e-09, 'L_sep_weight_yyx': 9.608881264073048e-08, 'L_scale_weight_yyx': 4.416371494397865e-08, 'learning_rate_yyx': 0.004012435883935396}. Best is trial 5 with value: -2.803729491226789.
[I 2026-03-18 16:47:34,580] Trial 13 pruned. 
[I 2026-03-18 16:47:35,194] Trial 12 pruned. 
[I 2026-03-18 16:47:35,685] Trial 11 pruned. 
[I 2026-03-18 16:47:35,941] Trial 22 pruned. 
[I 2026-03-18 16:47:35,959] Trial 13 finished with value: -2.7639764392065382 and parameters: {'n_layers_yyx': 1, 'hidden_size_yyx_l0': 2, 'context_size_yyx': 4, 'num_mix_components_yyx': 1, 'context_extractor_yyx': 'gru', 'activation_func_yyx': 'ReLU', 'L2_weight_yyx': 2.258096334131436e-06, 'L_entropy_weight_yyx': 2.000404074596072e-06, 'L_sep_weight_yyx': 1.945597543253548e-06, 'L_scale_weight_yyx': 1.0391280101205144e-10, 'learning_rate_yyx': 0.0010221627045514726}. Best is trial 0 with value: -2.782248579189629.
[I 2026-03-18 16:47:38,217] Trial 12 pruned. 
[I 2026-03-18 16:47:39,180] Trial 18 pruned. 
[I 2026-03-18 16:47:41,259] Trial 24 pruned. 
[I 2026-03-18 16:47:41,298] Trial 13 pruned. 
[I 2026-03-18 16:47:41,938] Trial 12 pruned. 
[I 2026-03-18 16:47:43,885] Trial 13 pruned. 
[I 2026-03-18 16:47:49,020] Trial 25 pruned. 
[I 2026-03-18 16:47:49,477] Trial 14 pruned. 
[I 2026-03-18 16:47:51,081] Trial 23 pruned. 
[I 2026-03-18 16:47:53,160] Trial 19 pruned. 
[I 2026-03-18 16:47:55,841] Trial 14 pruned. 
[I 2026-03-18 16:47:56,338] Trial 20 finished with value: -2.779396556248175 and parameters: {'n_layers_yyx': 2, 'hidden_size_yyx_l0': 5, 'hidden_size_yyx_l1': 5, 'context_size_yyx': 4, 'num_mix_components_yyx': 2, 'context_extractor_yyx': 'lstm', 'activation_func_yyx': 'Tanh', 'L2_weight_yyx': 2.1474144308500537e-08, 'L_entropy_weight_yyx': 3.395757161197428e-06, 'L_sep_weight_yyx': 1.179019402234018e-10, 'L_scale_weight_yyx': 1.3333480943323124e-07, 'learning_rate_yyx': 0.0019201007024354383}. Best is trial 15 with value: -2.780911484127889.
[I 2026-03-18 16:47:56,389] Trial 26 pruned. 
[I 2026-03-18 16:47:56,511] Trial 13 pruned. 
[I 2026-03-18 16:47:56,957] Trial 24 pruned. 
[I 2026-03-18 16:47:59,903] Trial 32 pruned. 
[I 2026-03-18 16:48:02,619] Trial 24 finished with value: -2.8035538701023257 and parameters: {'n_layers_yyx': 1, 'hidden_size_yyx_l0': 6, 'context_size_yyx': 4, 'num_mix_components_yyx': 5, 'context_extractor_yyx': 'lstm', 'activation_func_yyx': 'ReLU', 'L2_weight_yyx': 6.484046284560863e-09, 'L_entropy_weight_yyx': 4.693044428290852e-09, 'L_sep_weight_yyx': 2.4882896165458587e-07, 'L_scale_weight_yyx': 2.495181902379368e-07, 'learning_rate_yyx': 0.009959083847752204}. Best is trial 1 with value: -2.804181999864486.
[I 2026-03-18 16:48:04,008] Trial 15 pruned. 
[I 2026-03-18 16:48:04,841] Trial 26 finished with value: -2.792684113831925 and parameters: {'n_layers_yyx': 1, 'hidden_size_yyx_l0': 6, 'context_size_yyx': 4, 'num_mix_components_yyx': 5, 'context_extractor_yyx': 'lstm', 'activation_func_yyx': 'Tanh', 'L2_weight_yyx': 0.0008482852173190321, 'L_entropy_weight_yyx': 4.234903280086548e-06, 'L_sep_weight_yyx': 1.1626741480458915e-06, 'L_scale_weight_yyx': 4.0734601492563934e-05, 'learning_rate_yyx': 0.009723106365474795}. Best is trial 24 with value: -2.798767703717539.
[I 2026-03-18 16:48:09,993] Trial 21 pruned. 
[I 2026-03-18 16:48:11,209] Trial 14 pruned. 
[I 2026-03-18 16:48:11,777] Trial 25 pruned. 
[I 2026-03-18 16:48:18,111] Trial 26 pruned. 
[I 2026-03-18 16:48:18,443] Trial 16 pruned. 
[I 2026-03-18 16:48:18,739] Trial 27 pruned. 
[I 2026-03-18 16:48:19,683] Trial 13 finished with value: -2.801389102170352 and parameters: {'n_layers_yyx': 2, 'hidden_size_yyx_l0': 6, 'hidden_size_yyx_l1': 5, 'context_size_yyx': 4, 'num_mix_components_yyx': 4, 'context_extractor_yyx': 'lstm', 'activation_func_yyx': 'Tanh', 'L2_weight_yyx': 0.0002466478227219588, 'L_entropy_weight_yyx': 4.640803969943474e-09, 'L_sep_weight_yyx': 4.327824958010231e-05, 'L_scale_weight_yyx': 1.2070774878970717e-09, 'learning_rate_yyx': 0.003312975812615828}. Best is trial 11 with value: -2.8017587322763102.
[I 2026-03-18 16:48:24,076] Trial 22 pruned. 
[I 2026-03-18 16:48:24,294] Trial 17 pruned. 
[I 2026-03-18 16:48:32,819] Trial 28 pruned. 
[I 2026-03-18 16:48:33,825] Trial 15 pruned. 
[I 2026-03-18 16:48:38,347] Trial 18 pruned. 
[I 2026-03-18 16:48:39,072] Trial 29 pruned. 
[I 2026-03-18 16:48:40,118] Trial 16 pruned. 
[I 2026-03-18 16:48:41,946] Trial 16 finished with value: -2.8021124975709784 and parameters: {'n_layers_yyx': 1, 'hidden_size_yyx_l0': 5, 'context_size_yyx': 3, 'num_mix_components_yyx': 4, 'context_extractor_yyx': 'gru', 'activation_func_yyx': 'ReLU', 'L2_weight_yyx': 2.327400241132151e-06, 'L_entropy_weight_yyx': 2.8623463338842788e-05, 'L_sep_weight_yyx': 0.0006643289614742938, 'L_scale_weight_yyx': 0.0009156641909315385, 'learning_rate_yyx': 0.0064669832951137355}. Best is trial 5 with value: -2.8058216093098.
[I 2026-03-18 16:48:42,885] Trial 25 pruned. 
[I 2026-03-18 16:48:42,925] Trial 18 finished with value: -2.799105446682598 and parameters: {'n_layers_yyx': 2, 'hidden_size_yyx_l0': 6, 'hidden_size_yyx_l1': 3, 'context_size_yyx': 4, 'num_mix_components_yyx': 4, 'context_extractor_yyx': 'lstm', 'activation_func_yyx': 'Tanh', 'L2_weight_yyx': 1.5511328331804185e-07, 'L_entropy_weight_yyx': 9.07456039334253e-05, 'L_sep_weight_yyx': 6.57890897311324e-05, 'L_scale_weight_yyx': 1.1946138650448247e-06, 'learning_rate_yyx': 0.006455742675021369}. Best is trial 5 with value: -2.805070761203844.
[I 2026-03-18 16:48:44,283] Trial 19 pruned. 
[I 2026-03-18 16:48:48,549] Trial 17 pruned. 
[I 2026-03-18 16:48:58,600] Trial 14 pruned. 
[I 2026-03-18 16:49:01,395] Trial 17 finished with value: -2.7973592861489527 and parameters: {'n_layers_yyx': 1, 'hidden_size_yyx_l0': 4, 'context_size_yyx': 3, 'num_mix_components_yyx': 3, 'context_extractor_yyx': 'lstm', 'activation_func_yyx': 'ReLU', 'L2_weight_yyx': 1.3674813538094902e-08, 'L_entropy_weight_yyx': 1.56320172583669e-08, 'L_sep_weight_yyx': 0.00013669862107767468, 'L_scale_weight_yyx': 7.040009441092039e-06, 'learning_rate_yyx': 0.00998461376293171}. Best is trial 7 with value: -2.8073737460176833.
[I 2026-03-18 16:49:03,005] Trial 18 pruned. 
[I 2026-03-18 16:49:07,531] Trial 18 pruned. 
[I 2026-03-18 16:49:13,065] Trial 15 pruned. 
[I 2026-03-18 16:49:19,530] Trial 16 pruned. 
[I 2026-03-18 16:49:24,262] Trial 27 finished with value: -2.804467549711841 and parameters: {'n_layers_yyx': 1, 'hidden_size_yyx_l0': 6, 'context_size_yyx': 4, 'num_mix_components_yyx': 2, 'context_extractor_yyx': 'gru', 'activation_func_yyx': 'ReLU', 'L2_weight_yyx': 2.427233016896246e-09, 'L_entropy_weight_yyx': 4.920462265988517e-08, 'L_sep_weight_yyx': 1.0718891814488233e-10, 'L_scale_weight_yyx': 1.5130096830362995e-07, 'learning_rate_yyx': 0.006795150157080798}. Best is trial 13 with value: -2.8082553050147787.
[I 2026-03-18 16:49:24,274] Trial 14 finished with value: -2.8039784145073536 and parameters: {'n_layers_yyx': 2, 'hidden_size_yyx_l0': 4, 'hidden_size_yyx_l1': 5, 'context_size_yyx': 4, 'num_mix_components_yyx': 4, 'context_extractor_yyx': 'lstm', 'activation_func_yyx': 'Tanh', 'L2_weight_yyx': 1.1336238480584618e-05, 'L_entropy_weight_yyx': 1.4619352775775171e-06, 'L_sep_weight_yyx': 2.190660626891863e-09, 'L_scale_weight_yyx': 4.8406463423510175e-05, 'learning_rate_yyx': 0.004065203964313768}. Best is trial 5 with value: -2.8051328142627483.
[I 2026-03-18 16:49:25,715] Trial 17 pruned. 
[I 2026-03-18 16:49:37,925] Trial 27 finished with value: -2.792197236061252 and parameters: {'n_layers_yyx': 2, 'hidden_size_yyx_l0': 6, 'hidden_size_yyx_l1': 2, 'context_size_yyx': 1, 'num_mix_components_yyx': 1, 'context_extractor_yyx': 'gru', 'activation_func_yyx': 'GELU', 'L2_weight_yyx': 0.0002783427172551903, 'L_entropy_weight_yyx': 6.252098884943018e-10, 'L_sep_weight_yyx': 7.480099261827388e-07, 'L_scale_weight_yyx': 6.118559068172733e-09, 'learning_rate_yyx': 0.009936576925007948}. Best is trial 0 with value: -2.8067502106217272.
[I 2026-03-18 16:49:38,922] Trial 15 pruned. 
[I 2026-03-18 16:49:41,342] Trial 28 pruned. 
[I 2026-03-18 16:49:41,362] Trial 14 finished with value: -2.7995943704403503 and parameters: {'n_layers_yyx': 2, 'hidden_size_yyx_l0': 4, 'hidden_size_yyx_l1': 3, 'context_size_yyx': 3, 'num_mix_components_yyx': 5, 'context_extractor_yyx': 'lstm', 'activation_func_yyx': 'Tanh', 'L2_weight_yyx': 5.040192131615031e-08, 'L_entropy_weight_yyx': 5.819811822974317e-06, 'L_sep_weight_yyx': 8.331371774378156e-07, 'L_scale_weight_yyx': 8.470645691393838e-08, 'learning_rate_yyx': 0.009786289873096746}. Best is trial 14 with value: -2.7995943704403503.
[I 2026-03-18 16:49:45,291] Trial 16 pruned. 
[I 2026-03-18 16:49:46,875] Trial 20 pruned. 
[I 2026-03-18 16:49:52,391] Trial 28 pruned. 
[I 2026-03-18 16:49:53,316] Trial 21 pruned. 
[I 2026-03-18 16:49:53,430] Trial 30 finished with value: -2.794295945132162 and parameters: {'n_layers_yyx': 1, 'hidden_size_yyx_l0': 5, 'context_size_yyx': 4, 'num_mix_components_yyx': 5, 'context_extractor_yyx': 'lstm', 'activation_func_yyx': 'ReLU', 'L2_weight_yyx': 1.3669421633644486e-05, 'L_entropy_weight_yyx': 0.00013707203865940336, 'L_sep_weight_yyx': 2.3997755611285473e-05, 'L_scale_weight_yyx': 0.00016606879934380543, 'learning_rate_yyx': 0.008300892174982009}. Best is trial 24 with value: -2.798767703717539.
[I 2026-03-18 16:49:54,876] Trial 15 pruned. 
[I 2026-03-18 16:49:57,156] Trial 29 pruned. 
[I 2026-03-18 16:49:59,373] Trial 22 pruned. 
[I 2026-03-18 16:49:59,747] Trial 31 pruned. 
[I 2026-03-18 16:50:09,305] Trial 16 pruned. 
[I 2026-03-18 16:50:14,026] Trial 23 pruned. 
[I 2026-03-18 16:50:14,167] Trial 32 pruned. 
[I 2026-03-18 16:50:14,262] Trial 30 pruned. 
[I 2026-03-18 16:50:16,988] Trial 19 finished with value: -2.802385642629582 and parameters: {'n_layers_yyx': 1, 'hidden_size_yyx_l0': 5, 'context_size_yyx': 4, 'num_mix_components_yyx': 3, 'context_extractor_yyx': 'gru', 'activation_func_yyx': 'ReLU', 'L2_weight_yyx': 1.3196278279567517e-07, 'L_entropy_weight_yyx': 9.51414667459441e-05, 'L_sep_weight_yyx': 5.704911141706527e-07, 'L_scale_weight_yyx': 5.131710390872008e-07, 'learning_rate_yyx': 0.006606973982168421}. Best is trial 5 with value: -2.8058216093098.
[I 2026-03-18 16:50:20,066] Trial 24 pruned. 
[I 2026-03-18 16:50:20,332] Trial 33 pruned. 
[I 2026-03-18 16:50:25,132] Trial 23 finished with value: -2.7772577750243497 and parameters: {'n_layers_yyx': 2, 'hidden_size_yyx_l0': 5, 'hidden_size_yyx_l1': 5, 'context_size_yyx': 3, 'num_mix_components_yyx': 3, 'context_extractor_yyx': 'lstm', 'activation_func_yyx': 'Tanh', 'L2_weight_yyx': 8.639879585453335e-10, 'L_entropy_weight_yyx': 6.0769300870467375e-09, 'L_sep_weight_yyx': 2.572108812604757e-08, 'L_scale_weight_yyx': 2.330530582633558e-08, 'learning_rate_yyx': 0.0017556102669152923}. Best is trial 15 with value: -2.780911484127889.
[I 2026-03-18 16:50:26,380] Trial 17 pruned. 
[I 2026-03-18 16:50:30,674] Trial 20 finished with value: -2.784672739032753 and parameters: {'n_layers_yyx': 2, 'hidden_size_yyx_l0': 4, 'hidden_size_yyx_l1': 6, 'context_size_yyx': 3, 'num_mix_components_yyx': 1, 'context_extractor_yyx': 'gru', 'activation_func_yyx': 'Tanh', 'L2_weight_yyx': 1.037771581799523e-06, 'L_entropy_weight_yyx': 2.4474817905209573e-09, 'L_sep_weight_yyx': 5.7705814438505935e-09, 'L_scale_weight_yyx': 5.261069395085258e-09, 'learning_rate_yyx': 0.006885348970669002}. Best is trial 20 with value: -2.784672739032753.
[I 2026-03-18 16:50:30,929] Trial 29 pruned. 
[I 2026-03-18 16:50:32,770] Trial 18 pruned. 
[I 2026-03-18 16:50:34,051] Trial 34 pruned. 
[I 2026-03-18 16:50:38,287] Trial 19 pruned. 
[I 2026-03-18 16:50:39,038] Trial 26 finished with value: -2.8070715765499714 and parameters: {'n_layers_yyx': 1, 'hidden_size_yyx_l0': 4, 'context_size_yyx': 4, 'num_mix_components_yyx': 5, 'context_extractor_yyx': 'lstm', 'activation_func_yyx': 'ReLU', 'L2_weight_yyx': 3.902620155263329e-08, 'L_entropy_weight_yyx': 7.341732779650861e-07, 'L_sep_weight_yyx': 3.574939464682534e-09, 'L_scale_weight_yyx': 9.274246688636832e-06, 'learning_rate_yyx': 0.006169261311770145}. Best is trial 26 with value: -2.8070715765499714.
[I 2026-03-18 16:50:40,559] Trial 35 pruned. 
[I 2026-03-18 16:50:44,475] Trial 20 pruned. 
[I 2026-03-18 16:50:44,990] Trial 27 pruned. 
[I 2026-03-18 16:50:45,898] Trial 30 pruned. 
[I 2026-03-18 16:50:47,324] Trial 19 pruned. 
[I 2026-03-18 16:50:50,844] Trial 28 pruned. 
[I 2026-03-18 16:50:55,065] Trial 36 pruned. 
[I 2026-03-18 16:50:58,820] Trial 27 finished with value: -2.791248412600247 and parameters: {'n_layers_yyx': 1, 'hidden_size_yyx_l0': 5, 'context_size_yyx': 3, 'num_mix_components_yyx': 2, 'context_extractor_yyx': 'lstm', 'activation_func_yyx': 'GELU', 'L2_weight_yyx': 2.5318695944488104e-06, 'L_entropy_weight_yyx': 0.00025611948877373857, 'L_sep_weight_yyx': 4.120074802746577e-09, 'L_scale_weight_yyx': 7.086257769430478e-09, 'learning_rate_yyx': 0.00523256383497556}. Best is trial 10 with value: -2.7964817927433896.
[I 2026-03-18 16:51:04,994] Trial 28 pruned. 
[I 2026-03-18 16:51:08,731] Trial 33 finished with value: -2.7944744446846177 and parameters: {'n_layers_yyx': 1, 'hidden_size_yyx_l0': 5, 'context_size_yyx': 2, 'num_mix_components_yyx': 3, 'context_extractor_yyx': 'lstm', 'activation_func_yyx': 'Tanh', 'L2_weight_yyx': 2.5509284686120333e-08, 'L_entropy_weight_yyx': 4.164732834348308e-08, 'L_sep_weight_yyx': 1.5958355835303722e-09, 'L_scale_weight_yyx': 8.219548599054395e-05, 'learning_rate_yyx': 0.006895800124263256}. Best is trial 6 with value: -2.7950135081496006.
[I 2026-03-18 16:51:13,863] Trial 15 finished with value: -2.8055978602935157 and parameters: {'n_layers_yyx': 2, 'hidden_size_yyx_l0': 3, 'hidden_size_yyx_l1': 3, 'context_size_yyx': 3, 'num_mix_components_yyx': 4, 'context_extractor_yyx': 'lstm', 'activation_func_yyx': 'ReLU', 'L2_weight_yyx': 1.5736527011838893e-05, 'L_entropy_weight_yyx': 1.6279752219840456e-07, 'L_sep_weight_yyx': 1.8184720475507577e-06, 'L_scale_weight_yyx': 5.623959295446294e-09, 'learning_rate_yyx': 0.0031717214355666554}. Best is trial 9 with value: -2.8084722793451675.
[I 2026-03-18 16:51:19,993] Trial 16 pruned. 
[I 2026-03-18 16:51:24,338] Trial 21 pruned. 
