[I 2026-03-18 20:09:30,693] Trial 42 finished with value: -1.6091810661509283 and parameters: {'n_layers_yyx': 2, 'hidden_size_yyx_l0': 5, 'hidden_size_yyx_l1': 3, 'context_size_yyx': 4, 'num_mix_components_yyx': 5, 'context_extractor_yyx': 'lstm', 'activation_func_yyx': 'ReLU', 'L2_weight_yyx': 1.1926900607294047e-07, 'L_entropy_weight_yyx': 1.0910395458274575e-07, 'L_sep_weight_yyx': 1.863854107036191e-05, 'L_scale_weight_yyx': 6.009488257050654e-06, 'learning_rate_yyx': 0.009859764244968521}. Best is trial 38 with value: -1.6114324329693406.
[I 2026-03-18 20:09:34,708] Trial 43 pruned. 
[I 2026-03-18 20:09:45,504] Trial 37 finished with value: -2.089431791503599 and parameters: {'n_layers_yyx': 1, 'hidden_size_yyx_l0': 5, 'context_size_yyx': 4, 'num_mix_components_yyx': 4, 'context_extractor_yyx': 'lstm', 'activation_func_yyx': 'ReLU', 'L2_weight_yyx': 1.3067807079955661e-08, 'L_entropy_weight_yyx': 7.616771144803958e-07, 'L_sep_weight_yyx': 0.00014203948898675156, 'L_scale_weight_yyx': 2.2037852362400904e-09, 'learning_rate_yyx': 0.006001220269774329}. Best is trial 2 with value: -2.093203554819634.
[I 2026-03-18 20:09:52,088] Trial 28 pruned. 
[I 2026-03-18 20:09:54,631] Trial 39 pruned. 
[I 2026-03-18 20:09:54,692] Trial 39 pruned. 
[I 2026-03-18 20:09:57,962] Trial 35 finished with value: -2.0819980012390658 and parameters: {'n_layers_yyx': 1, 'hidden_size_yyx_l0': 5, 'context_size_yyx': 2, 'num_mix_components_yyx': 5, 'context_extractor_yyx': 'lstm', 'activation_func_yyx': 'ReLU', 'L2_weight_yyx': 1.0720005076660223e-06, 'L_entropy_weight_yyx': 0.00013489894423376122, 'L_sep_weight_yyx': 1.3318183362024096e-09, 'L_scale_weight_yyx': 6.14145417308416e-06, 'learning_rate_yyx': 0.002528311045917244}. Best is trial 35 with value: -2.0819980012390658.
[I 2026-03-18 20:10:05,704] Trial 25 pruned. 
[I 2026-03-18 20:10:07,913] Trial 29 pruned. 
[I 2026-03-18 20:10:17,601] Trial 26 pruned. 
[I 2026-03-18 20:10:18,565] Trial 36 pruned. 
[I 2026-03-18 20:10:25,654] Trial 36 pruned. 
[I 2026-03-18 20:10:27,634] Trial 42 pruned. 
[I 2026-03-18 20:10:28,879] Trial 40 pruned. 
[I 2026-03-18 20:10:30,900] Trial 39 pruned. 
[I 2026-03-18 20:10:58,099] Trial 37 pruned. 
[I 2026-03-18 20:10:58,157] Trial 27 pruned. 
[I 2026-03-18 20:10:58,571] Trial 41 pruned. 
[I 2026-03-18 20:11:04,939] Trial 37 pruned. 
[I 2026-03-18 20:11:10,237] Trial 38 pruned. 
[I 2026-03-18 20:11:12,789] Trial 42 pruned. 
[I 2026-03-18 20:11:13,286] Trial 38 pruned. 
[I 2026-03-18 20:11:17,688] Trial 43 finished with value: -1.6093413885989258 and parameters: {'n_layers_yyx': 2, 'hidden_size_yyx_l0': 5, 'hidden_size_yyx_l1': 4, 'context_size_yyx': 4, 'num_mix_components_yyx': 4, 'context_extractor_yyx': 'lstm', 'activation_func_yyx': 'ReLU', 'L2_weight_yyx': 1.725666674472795e-08, 'L_entropy_weight_yyx': 5.299785778644663e-09, 'L_sep_weight_yyx': 0.00013633482049385501, 'L_scale_weight_yyx': 6.185715996025863e-07, 'learning_rate_yyx': 0.007881983321489984}. Best is trial 38 with value: -1.6114324329693406.
[I 2026-03-18 20:11:18,850] Trial 28 pruned. 
[I 2026-03-18 20:11:19,997] Trial 30 pruned. 
[I 2026-03-18 20:11:20,068] Trial 31 finished with value: -1.6096578214525437 and parameters: {'n_layers_yyx': 1, 'hidden_size_yyx_l0': 4, 'context_size_yyx': 3, 'num_mix_components_yyx': 3, 'context_extractor_yyx': 'lstm', 'activation_func_yyx': 'Tanh', 'L2_weight_yyx': 1.2941465807276027e-09, 'L_entropy_weight_yyx': 1.9979023962354355e-09, 'L_sep_weight_yyx': 7.618098571996971e-10, 'L_scale_weight_yyx': 2.321976047865812e-06, 'learning_rate_yyx': 0.0064736616143242515}. Best is trial 9 with value: -1.613731891101604.
[I 2026-03-18 20:11:24,660] Trial 29 pruned. 
[I 2026-03-18 20:11:27,822] Trial 42 finished with value: -1.6478558386583142 and parameters: {'n_layers_yyx': 2, 'hidden_size_yyx_l0': 4, 'hidden_size_yyx_l1': 6, 'context_size_yyx': 4, 'num_mix_components_yyx': 5, 'context_extractor_yyx': 'gru', 'activation_func_yyx': 'ReLU', 'L2_weight_yyx': 0.00010577069757793418, 'L_entropy_weight_yyx': 0.0001521225913170631, 'L_sep_weight_yyx': 7.14715232782189e-05, 'L_scale_weight_yyx': 8.247312908695104e-05, 'learning_rate_yyx': 0.006023917670963527}. Best is trial 12 with value: -1.6531010225123595.
[I 2026-03-18 20:11:29,051] Trial 45 finished with value: -2.0828237678392254 and parameters: {'n_layers_yyx': 1, 'hidden_size_yyx_l0': 6, 'context_size_yyx': 4, 'num_mix_components_yyx': 5, 'context_extractor_yyx': 'lstm', 'activation_func_yyx': 'ReLU', 'L2_weight_yyx': 1.5559030947718338e-08, 'L_entropy_weight_yyx': 2.9345484016904155e-08, 'L_sep_weight_yyx': 6.287077654011645e-06, 'L_scale_weight_yyx': 5.982639991570795e-05, 'learning_rate_yyx': 0.001986418567643851}. Best is trial 13 with value: -2.092152629106611.
[I 2026-03-18 20:11:29,581] Trial 30 pruned. 
[I 2026-03-18 20:11:33,298] Trial 46 pruned. 
[I 2026-03-18 20:11:47,450] Trial 39 pruned. 
[I 2026-03-18 20:11:47,663] Trial 47 pruned. 
[I 2026-03-18 20:11:48,175] Trial 38 pruned. 
[I 2026-03-18 20:11:58,630] Trial 39 pruned. 
[I 2026-03-18 20:12:00,706] Trial 33 pruned. 
[I 2026-03-18 20:12:03,517] Trial 28 finished with value: -2.1231302816079434 and parameters: {'n_layers_yyx': 1, 'hidden_size_yyx_l0': 3, 'context_size_yyx': 2, 'num_mix_components_yyx': 4, 'context_extractor_yyx': 'gru', 'activation_func_yyx': 'Tanh', 'L2_weight_yyx': 5.670670252258249e-08, 'L_entropy_weight_yyx': 4.8708286731979946e-08, 'L_sep_weight_yyx': 3.8768930151234684e-07, 'L_scale_weight_yyx': 2.9674798090424937e-09, 'learning_rate_yyx': 0.00805251421860853}. Best is trial 10 with value: -2.123509279126982.
[I 2026-03-18 20:12:11,110] Trial 44 finished with value: -1.6117607772191929 and parameters: {'n_layers_yyx': 2, 'hidden_size_yyx_l0': 3, 'hidden_size_yyx_l1': 5, 'context_size_yyx': 4, 'num_mix_components_yyx': 1, 'context_extractor_yyx': 'gru', 'activation_func_yyx': 'Tanh', 'L2_weight_yyx': 1.391426797443921e-06, 'L_entropy_weight_yyx': 7.0933198338298586e-09, 'L_sep_weight_yyx': 8.254470149267677e-10, 'L_scale_weight_yyx': 7.704490087995009e-07, 'learning_rate_yyx': 0.008805345401235306}. Best is trial 13 with value: -1.613792101823724.
[I 2026-03-18 20:12:11,167] Trial 43 pruned. 
[I 2026-03-18 20:12:26,548] Trial 39 pruned. 
[I 2026-03-18 20:12:27,440] Trial 29 pruned. 
[I 2026-03-18 20:12:31,148] Trial 48 pruned. 
[I 2026-03-18 20:12:40,794] Trial 40 pruned. 
[I 2026-03-18 20:12:40,860] Trial 40 finished with value: -2.059226643728944 and parameters: {'n_layers_yyx': 2, 'hidden_size_yyx_l0': 6, 'hidden_size_yyx_l1': 5, 'context_size_yyx': 2, 'num_mix_components_yyx': 3, 'context_extractor_yyx': 'lstm', 'activation_func_yyx': 'GELU', 'L2_weight_yyx': 7.0995981722239045e-09, 'L_entropy_weight_yyx': 3.793030951950292e-07, 'L_sep_weight_yyx': 0.00030609200195695526, 'L_scale_weight_yyx': 2.076108247032848e-05, 'learning_rate_yyx': 0.009948883794111726}. Best is trial 2 with value: -2.059868681386501.
[I 2026-03-18 20:12:41,805] Trial 34 pruned. 
[I 2026-03-18 20:12:44,274] Trial 44 finished with value: -1.6067793096845127 and parameters: {'n_layers_yyx': 2, 'hidden_size_yyx_l0': 4, 'hidden_size_yyx_l1': 5, 'context_size_yyx': 4, 'num_mix_components_yyx': 5, 'context_extractor_yyx': 'lstm', 'activation_func_yyx': 'ReLU', 'L2_weight_yyx': 6.403448403470571e-07, 'L_entropy_weight_yyx': 1.747548528850341e-08, 'L_sep_weight_yyx': 0.00044114682165694973, 'L_scale_weight_yyx': 1.4756990031662164e-06, 'learning_rate_yyx': 0.0053380515780470945}. Best is trial 38 with value: -1.6114324329693406.
[I 2026-03-18 20:12:49,376] Trial 40 pruned. 
[I 2026-03-18 20:12:49,445] Trial 44 finished with value: -2.0957249143194416 and parameters: {'n_layers_yyx': 1, 'hidden_size_yyx_l0': 6, 'context_size_yyx': 4, 'num_mix_components_yyx': 5, 'context_extractor_yyx': 'lstm', 'activation_func_yyx': 'Tanh', 'L2_weight_yyx': 2.0897878347390225e-08, 'L_entropy_weight_yyx': 2.117546586989059e-08, 'L_sep_weight_yyx': 1.425656621638873e-08, 'L_scale_weight_yyx': 2.1453702788428933e-10, 'learning_rate_yyx': 0.003074740921899505}. Best is trial 21 with value: -2.0975034066716556.
[I 2026-03-18 20:13:13,097] Trial 43 finished with value: -1.648841808137778 and parameters: {'n_layers_yyx': 2, 'hidden_size_yyx_l0': 4, 'hidden_size_yyx_l1': 6, 'context_size_yyx': 4, 'num_mix_components_yyx': 5, 'context_extractor_yyx': 'gru', 'activation_func_yyx': 'ReLU', 'L2_weight_yyx': 0.0002367324728767989, 'L_entropy_weight_yyx': 0.000588660754598059, 'L_sep_weight_yyx': 1.898509011379224e-10, 'L_scale_weight_yyx': 7.937430894649055e-06, 'learning_rate_yyx': 0.00802689380841648}. Best is trial 12 with value: -1.6531010225123595.
[I 2026-03-18 20:13:14,436] Trial 40 finished with value: -1.6120713050646314 and parameters: {'n_layers_yyx': 1, 'hidden_size_yyx_l0': 6, 'context_size_yyx': 4, 'num_mix_components_yyx': 3, 'context_extractor_yyx': 'lstm', 'activation_func_yyx': 'Tanh', 'L2_weight_yyx': 1.5207064547989046e-07, 'L_entropy_weight_yyx': 1.1459701685761298e-10, 'L_sep_weight_yyx': 3.4399131134592598e-09, 'L_scale_weight_yyx': 0.00045025374130821687, 'learning_rate_yyx': 0.004846590279451181}. Best is trial 21 with value: -1.6169303846739371.
[I 2026-03-18 20:13:30,331] Trial 44 pruned. 
[I 2026-03-18 20:13:32,157] Trial 32 finished with value: -1.6101770527707042 and parameters: {'n_layers_yyx': 1, 'hidden_size_yyx_l0': 4, 'context_size_yyx': 3, 'num_mix_components_yyx': 3, 'context_extractor_yyx': 'lstm', 'activation_func_yyx': 'Tanh', 'L2_weight_yyx': 2.8131960586857745e-10, 'L_entropy_weight_yyx': 7.259963387533787e-09, 'L_sep_weight_yyx': 2.3152758854223517e-10, 'L_scale_weight_yyx': 1.931892151137063e-07, 'learning_rate_yyx': 0.009663904643855768}. Best is trial 9 with value: -1.613731891101604.
[I 2026-03-18 20:13:32,224] Trial 35 pruned. 
[I 2026-03-18 20:13:33,689] Trial 49 pruned. 

Source events: 16159
Target events: 3828
Full model ln_yyx : 232.78357 nats/sec, 54.72968 nats/event
Full model Log loss : -2.08150
Full model ln_yyx : 231.41970 nats/sec, 54.40902 nats/event
Full model Log loss : -2.08520
Full model ln_yyx : 230.08107 nats/sec, 54.09430 nats/event
Full model Log loss : -2.06566
Full model ln_yyx : 230.50484 nats/sec, 54.19393 nats/event
Full model Log loss : -2.07601
Full model ln_yyx : 231.25349 nats/sec, 54.36994 nats/event
Full model Log loss : -2.08559
Full model ln_yyx : 234.46224 nats/sec, 55.12435 nats/event
Full model Log loss : -2.08556
Full model ln_yyx : 231.12811 nats/sec, 54.34047 nats/event
Full model Log loss : -2.08460
Full model ln_yyx : 236.28240 nats/sec, 55.55229 nats/event
Full model Log loss : -2.09215
Full model ln_yyx : 231.86298 nats/sec, 54.51324 nats/event
Full model Log loss : -2.07815
Full model ln_yyx : 231.04539 nats/sec, 54.32102 nats/event
Full model Log loss : -2.07610
Full model ln_yyx : 232.58094 nats/sec, 54.68204 nats/event
Full model Log loss : -2.08153
Full model ln_yyx : 233.15616 nats/sec, 54.81728 nats/event
Full model Log loss : -2.08157
Full model ln_yyx : 230.75447 nats/sec, 54.25262 nats/event
Full model Log loss : -2.08118
Full model ln_yyx : 230.66568 nats/sec, 54.23174 nats/event
Full model Log loss : -2.08105
Full model ln_yyx : 231.81381 nats/sec, 54.50168 nats/event
Full model Log loss : -2.08282
Optimization finished. Config saved to results/opt-full/opt_full_399_best_config.txt
[I 2026-03-18 20:13:39,699] Trial 30 pruned. 
[I 2026-03-18 20:13:41,659] Trial 41 pruned. 
[I 2026-03-18 20:13:44,366] Trial 41 pruned. 
[I 2026-03-18 20:13:49,247] Trial 30 finished with value: -2.0898413925218913 and parameters: {'n_layers_yyx': 1, 'hidden_size_yyx_l0': 5, 'context_size_yyx': 3, 'num_mix_components_yyx': 4, 'context_extractor_yyx': 'gru', 'activation_func_yyx': 'ReLU', 'L2_weight_yyx': 2.482005867012497e-10, 'L_entropy_weight_yyx': 1.820674806979473e-09, 'L_sep_weight_yyx': 0.00040567631074038166, 'L_scale_weight_yyx': 0.000801909957136237, 'learning_rate_yyx': 0.002558108184472122}. Best is trial 11 with value: -2.095012278283745.
[I 2026-03-18 20:13:49,634] Trial 33 pruned. 
[I 2026-03-18 20:13:50,720] Trial 36 pruned. 
[I 2026-03-18 20:13:50,733] Trial 43 pruned. 
[I 2026-03-18 20:13:55,841] Trial 41 finished with value: -2.068208958589886 and parameters: {'n_layers_yyx': 2, 'hidden_size_yyx_l0': 2, 'hidden_size_yyx_l1': 5, 'context_size_yyx': 3, 'num_mix_components_yyx': 2, 'context_extractor_yyx': 'lstm', 'activation_func_yyx': 'GELU', 'L2_weight_yyx': 1.4534784774691873e-05, 'L_entropy_weight_yyx': 0.00019441490571351188, 'L_sep_weight_yyx': 6.029984853136047e-07, 'L_scale_weight_yyx': 2.0786971074222055e-05, 'learning_rate_yyx': 0.007713342565113403}. Best is trial 6 with value: -2.0790188514889616.
[I 2026-03-18 20:14:10,653] Trial 45 pruned. 
[I 2026-03-18 20:14:24,105] Trial 31 finished with value: -2.091015853545739 and parameters: {'n_layers_yyx': 1, 'hidden_size_yyx_l0': 6, 'context_size_yyx': 4, 'num_mix_components_yyx': 5, 'context_extractor_yyx': 'gru', 'activation_func_yyx': 'Tanh', 'L2_weight_yyx': 1.037094638210763e-08, 'L_entropy_weight_yyx': 5.625737376115724e-09, 'L_sep_weight_yyx': 9.620884401202289e-09, 'L_scale_weight_yyx': 2.879299230952913e-10, 'learning_rate_yyx': 0.006085858009365447}. Best is trial 24 with value: -2.0962241228606584.
[I 2026-03-18 20:14:36,706] Trial 32 pruned. 
[I 2026-03-18 20:14:37,497] Trial 46 pruned. 
[I 2026-03-18 20:14:41,616] Trial 31 finished with value: -2.089858720706198 and parameters: {'n_layers_yyx': 1, 'hidden_size_yyx_l0': 6, 'context_size_yyx': 3, 'num_mix_components_yyx': 5, 'context_extractor_yyx': 'lstm', 'activation_func_yyx': 'ReLU', 'L2_weight_yyx': 0.00035367984043995095, 'L_entropy_weight_yyx': 1.8597061345785195e-06, 'L_sep_weight_yyx': 4.758055385037767e-05, 'L_scale_weight_yyx': 7.4111894575780336e-06, 'learning_rate_yyx': 0.007028665977524305}. Best is trial 31 with value: -2.089858720706198.
[I 2026-03-18 20:14:58,966] Trial 47 pruned. 
[I 2026-03-18 20:15:00,538] Trial 45 finished with value: -1.6098610558685804 and parameters: {'n_layers_yyx': 2, 'hidden_size_yyx_l0': 5, 'hidden_size_yyx_l1': 3, 'context_size_yyx': 4, 'num_mix_components_yyx': 5, 'context_extractor_yyx': 'lstm', 'activation_func_yyx': 'ReLU', 'L2_weight_yyx': 1.1301436133728069e-07, 'L_entropy_weight_yyx': 5.965912322691838e-08, 'L_sep_weight_yyx': 0.00014774901444234562, 'L_scale_weight_yyx': 2.5158287495662285e-06, 'learning_rate_yyx': 0.006799439946196032}. Best is trial 38 with value: -1.6114324329693406.
[I 2026-03-18 20:15:01,075] Trial 34 pruned. 
[I 2026-03-18 20:15:06,693] Trial 31 pruned. 
[I 2026-03-18 20:15:23,901] Trial 35 pruned. 
[I 2026-03-18 20:15:33,637] Trial 45 finished with value: -1.6129022806064548 and parameters: {'n_layers_yyx': 2, 'hidden_size_yyx_l0': 2, 'hidden_size_yyx_l1': 3, 'context_size_yyx': 4, 'num_mix_components_yyx': 2, 'context_extractor_yyx': 'gru', 'activation_func_yyx': 'Tanh', 'L2_weight_yyx': 4.3864427608674127e-07, 'L_entropy_weight_yyx': 5.032980612696491e-10, 'L_sep_weight_yyx': 1.3173321508191257e-08, 'L_scale_weight_yyx': 7.672415230966764e-05, 'learning_rate_yyx': 0.007593501350934071}. Best is trial 13 with value: -1.613792101823724.
[I 2026-03-18 20:15:36,871] Trial 44 finished with value: -1.6497307712522935 and parameters: {'n_layers_yyx': 2, 'hidden_size_yyx_l0': 4, 'hidden_size_yyx_l1': 5, 'context_size_yyx': 4, 'num_mix_components_yyx': 5, 'context_extractor_yyx': 'gru', 'activation_func_yyx': 'ReLU', 'L2_weight_yyx': 1.8752407884772974e-05, 'L_entropy_weight_yyx': 5.757551562053101e-05, 'L_sep_weight_yyx': 0.0008315250687687552, 'L_scale_weight_yyx': 0.000187169454603547, 'learning_rate_yyx': 0.009493253443165043}. Best is trial 12 with value: -1.6531010225123595.
[I 2026-03-18 20:15:46,791] Trial 32 pruned. 
[I 2026-03-18 20:15:52,946] Trial 40 finished with value: -1.6089518760769002 and parameters: {'n_layers_yyx': 1, 'hidden_size_yyx_l0': 3, 'context_size_yyx': 3, 'num_mix_components_yyx': 3, 'context_extractor_yyx': 'gru', 'activation_func_yyx': 'GELU', 'L2_weight_yyx': 4.742243432059189e-05, 'L_entropy_weight_yyx': 2.3940774550829152e-08, 'L_sep_weight_yyx': 8.061274904044579e-07, 'L_scale_weight_yyx': 0.00048546504896096124, 'learning_rate_yyx': 0.0036887812352164803}. Best is trial 30 with value: -1.6152616083569185.
[I 2026-03-18 20:15:55,479] Trial 46 pruned. 
[I 2026-03-18 20:15:58,764] Trial 45 pruned. 
[I 2026-03-18 20:16:06,678] Trial 42 finished with value: -1.6110624950263646 and parameters: {'n_layers_yyx': 2, 'hidden_size_yyx_l0': 6, 'hidden_size_yyx_l1': 5, 'context_size_yyx': 4, 'num_mix_components_yyx': 5, 'context_extractor_yyx': 'lstm', 'activation_func_yyx': 'Tanh', 'L2_weight_yyx': 3.300466986873608e-08, 'L_entropy_weight_yyx': 2.337321849913167e-10, 'L_sep_weight_yyx': 1.1151343356991307e-10, 'L_scale_weight_yyx': 4.178512252686675e-06, 'learning_rate_yyx': 0.006515866530263008}. Best is trial 21 with value: -1.6169303846739371.
[I 2026-03-18 20:16:08,706] Trial 33 pruned. 
[I 2026-03-18 20:16:17,980] Trial 41 finished with value: -2.0671816006912174 and parameters: {'n_layers_yyx': 2, 'hidden_size_yyx_l0': 6, 'hidden_size_yyx_l1': 5, 'context_size_yyx': 2, 'num_mix_components_yyx': 3, 'context_extractor_yyx': 'lstm', 'activation_func_yyx': 'GELU', 'L2_weight_yyx': 5.749085823326371e-09, 'L_entropy_weight_yyx': 2.524647281975147e-07, 'L_sep_weight_yyx': 0.00027532409939002347, 'L_scale_weight_yyx': 0.0003383980841838243, 'learning_rate_yyx': 0.009474474651860213}. Best is trial 41 with value: -2.0671816006912174.
[I 2026-03-18 20:16:29,048] Trial 41 pruned. 
[I 2026-03-18 20:16:34,691] Trial 47 pruned. 
[I 2026-03-18 20:16:35,947] Trial 46 pruned. 
[I 2026-03-18 20:16:36,930] Trial 46 pruned. 
[I 2026-03-18 20:16:43,639] Trial 41 finished with value: -2.075166523702483 and parameters: {'n_layers_yyx': 2, 'hidden_size_yyx_l0': 5, 'hidden_size_yyx_l1': 4, 'context_size_yyx': 3, 'num_mix_components_yyx': 3, 'context_extractor_yyx': 'lstm', 'activation_func_yyx': 'ReLU', 'L2_weight_yyx': 1.9460630275232298e-08, 'L_entropy_weight_yyx': 3.596018920426093e-10, 'L_sep_weight_yyx': 0.0003248762548130322, 'L_scale_weight_yyx': 3.547228994618638e-05, 'learning_rate_yyx': 0.006117278438066326}. Best is trial 35 with value: -2.0819980012390658.
[I 2026-03-18 20:16:51,729] Trial 48 pruned. 
[I 2026-03-18 20:17:09,884] Trial 47 pruned. 
[I 2026-03-18 20:17:14,111] Trial 42 finished with value: -2.0903415427859136 and parameters: {'n_layers_yyx': 1, 'hidden_size_yyx_l0': 5, 'context_size_yyx': 4, 'num_mix_components_yyx': 4, 'context_extractor_yyx': 'lstm', 'activation_func_yyx': 'ReLU', 'L2_weight_yyx': 1.8010709590427036e-07, 'L_entropy_weight_yyx': 7.223856080529069e-07, 'L_sep_weight_yyx': 4.4349867902060677e-05, 'L_scale_weight_yyx': 9.896972180603967e-09, 'learning_rate_yyx': 0.008316327396231792}. Best is trial 2 with value: -2.093203554819634.
[I 2026-03-18 20:17:23,576] Trial 37 finished with value: -1.6266954909525644 and parameters: {'n_layers_yyx': 1, 'hidden_size_yyx_l0': 6, 'context_size_yyx': 2, 'num_mix_components_yyx': 4, 'context_extractor_yyx': 'lstm', 'activation_func_yyx': 'Tanh', 'L2_weight_yyx': 8.787195655440052e-05, 'L_entropy_weight_yyx': 4.692996132582441e-10, 'L_sep_weight_yyx': 1.8077486425681251e-09, 'L_scale_weight_yyx': 4.5798480089829216e-09, 'learning_rate_yyx': 0.0067639826861982735}. Best is trial 22 with value: -1.6339605357080298.
[I 2026-03-18 20:17:44,294] Trial 47 pruned. 
[I 2026-03-18 20:17:50,431] Trial 43 finished with value: -1.6132160791577863 and parameters: {'n_layers_yyx': 2, 'hidden_size_yyx_l0': 6, 'hidden_size_yyx_l1': 4, 'context_size_yyx': 4, 'num_mix_components_yyx': 3, 'context_extractor_yyx': 'lstm', 'activation_func_yyx': 'Tanh', 'L2_weight_yyx': 2.7903559976855366e-07, 'L_entropy_weight_yyx': 9.780296278390794e-10, 'L_sep_weight_yyx': 1.1749191846309574e-07, 'L_scale_weight_yyx': 0.00014292708566769749, 'learning_rate_yyx': 0.008577497677566737}. Best is trial 21 with value: -1.6169303846739371.
[I 2026-03-18 20:17:55,125] Trial 42 finished with value: -2.073810044260031 and parameters: {'n_layers_yyx': 2, 'hidden_size_yyx_l0': 2, 'hidden_size_yyx_l1': 4, 'context_size_yyx': 3, 'num_mix_components_yyx': 2, 'context_extractor_yyx': 'lstm', 'activation_func_yyx': 'GELU', 'L2_weight_yyx': 3.907291992937638e-05, 'L_entropy_weight_yyx': 0.0004940995647978797, 'L_sep_weight_yyx': 2.501672848571686e-07, 'L_scale_weight_yyx': 4.579107195244753e-06, 'learning_rate_yyx': 0.009303049176183019}. Best is trial 6 with value: -2.0790188514889616.
[I 2026-03-18 20:17:56,757] Trial 44 pruned. 
[I 2026-03-18 20:17:59,958] Trial 33 finished with value: -2.091576947739771 and parameters: {'n_layers_yyx': 1, 'hidden_size_yyx_l0': 6, 'context_size_yyx': 4, 'num_mix_components_yyx': 4, 'context_extractor_yyx': 'gru', 'activation_func_yyx': 'Tanh', 'L2_weight_yyx': 7.991152419538218e-07, 'L_entropy_weight_yyx': 1.000229477346624e-07, 'L_sep_weight_yyx': 7.321996871493843e-09, 'L_scale_weight_yyx': 3.05218226010574e-06, 'learning_rate_yyx': 0.006444132109894584}. Best is trial 24 with value: -2.0962241228606584.
[I 2026-03-18 20:18:06,401] Trial 48 pruned. 
[I 2026-03-18 20:18:12,176] Trial 38 pruned. 
[I 2026-03-18 20:18:17,350] Trial 32 finished with value: -2.0848514420045405 and parameters: {'n_layers_yyx': 1, 'hidden_size_yyx_l0': 6, 'context_size_yyx': 3, 'num_mix_components_yyx': 5, 'context_extractor_yyx': 'lstm', 'activation_func_yyx': 'ReLU', 'L2_weight_yyx': 0.00019188088562368098, 'L_entropy_weight_yyx': 5.930566575717084e-07, 'L_sep_weight_yyx': 5.7578438722561125e-05, 'L_scale_weight_yyx': 4.2164473309094444e-05, 'learning_rate_yyx': 0.006391485984274681}. Best is trial 31 with value: -2.089858720706198.
[I 2026-03-18 20:18:31,418] Trial 45 pruned. 
[I 2026-03-18 20:18:32,481] Trial 34 pruned. 
