[I 2026-03-18 22:22:16,829] Trial 52 finished with value: -1.4600100473257211 and parameters: {'n_layers_yyx': 1, 'hidden_size_yyx_l0': 4, 'context_size_yyx': 4, 'num_mix_components_yyx': 5, 'context_extractor_yyx': 'gru', 'activation_func_yyx': 'Tanh', 'L2_weight_yyx': 1.0404812186750324e-06, 'L_entropy_weight_yyx': 2.192551467965421e-08, 'L_sep_weight_yyx': 3.1729863948447977e-09, 'L_scale_weight_yyx': 2.64630484872753e-09, 'learning_rate_yyx': 0.009061406329186308}. Best is trial 29 with value: -1.4683670278695913.
[I 2026-03-18 22:22:17,185] Trial 49 pruned. 
[I 2026-03-18 22:22:18,123] Trial 52 finished with value: -1.4483432241586538 and parameters: {'n_layers_yyx': 1, 'hidden_size_yyx_l0': 5, 'context_size_yyx': 4, 'num_mix_components_yyx': 3, 'context_extractor_yyx': 'lstm', 'activation_func_yyx': 'Tanh', 'L2_weight_yyx': 2.537840083497185e-10, 'L_entropy_weight_yyx': 0.0005257041677647205, 'L_sep_weight_yyx': 1.136039034183374e-08, 'L_scale_weight_yyx': 2.933837533881288e-08, 'learning_rate_yyx': 0.008854626111002994}. Best is trial 7 with value: -1.4538350266676683.
[I 2026-03-18 22:22:19,010] Trial 70 pruned. 
[I 2026-03-18 22:22:20,632] Trial 47 pruned. 
[I 2026-03-18 22:22:21,649] Trial 53 pruned. 
[I 2026-03-18 22:22:22,012] Trial 49 pruned. 
[I 2026-03-18 22:22:22,644] Trial 71 pruned. 
[I 2026-03-18 22:22:24,860] Trial 50 pruned. 
[I 2026-03-18 22:22:25,084] Trial 53 finished with value: -1.4418531212439905 and parameters: {'n_layers_yyx': 2, 'hidden_size_yyx_l0': 3, 'hidden_size_yyx_l1': 4, 'context_size_yyx': 2, 'num_mix_components_yyx': 4, 'context_extractor_yyx': 'lstm', 'activation_func_yyx': 'Tanh', 'L2_weight_yyx': 1.7315384769949174e-09, 'L_entropy_weight_yyx': 1.6808343175174464e-09, 'L_sep_weight_yyx': 0.00011245627172713187, 'L_scale_weight_yyx': 1.4243621424554789e-08, 'learning_rate_yyx': 0.0063255978541541386}. Best is trial 19 with value: -1.4628589806189904.
[I 2026-03-18 22:22:25,436] Trial 54 pruned. 
[I 2026-03-18 22:22:25,713] Trial 50 pruned. 
[I 2026-03-18 22:22:25,957] Trial 62 finished with value: -1.5770680980750251 and parameters: {'n_layers_yyx': 2, 'hidden_size_yyx_l0': 5, 'hidden_size_yyx_l1': 5, 'context_size_yyx': 2, 'num_mix_components_yyx': 5, 'context_extractor_yyx': 'gru', 'activation_func_yyx': 'Tanh', 'L2_weight_yyx': 1.9790639620753018e-05, 'L_entropy_weight_yyx': 1.5003591388653872e-10, 'L_sep_weight_yyx': 3.97272249044872e-07, 'L_scale_weight_yyx': 3.4393794505775553e-07, 'learning_rate_yyx': 0.008130518236728002}. Best is trial 26 with value: -1.584650032885134.
[I 2026-03-18 22:22:26,119] Trial 55 finished with value: -1.4323180213341347 and parameters: {'n_layers_yyx': 2, 'hidden_size_yyx_l0': 6, 'hidden_size_yyx_l1': 6, 'context_size_yyx': 2, 'num_mix_components_yyx': 3, 'context_extractor_yyx': 'lstm', 'activation_func_yyx': 'ReLU', 'L2_weight_yyx': 8.599570565718852e-07, 'L_entropy_weight_yyx': 5.792987340393973e-05, 'L_sep_weight_yyx': 7.921240009616025e-06, 'L_scale_weight_yyx': 0.00010673864095805472, 'learning_rate_yyx': 0.008970986349163268}. Best is trial 27 with value: -1.4597027822641226.
[I 2026-03-18 22:22:27,915] Trial 62 finished with value: -1.3670783852631192 and parameters: {'n_layers_yyx': 2, 'hidden_size_yyx_l0': 6, 'hidden_size_yyx_l1': 5, 'context_size_yyx': 4, 'num_mix_components_yyx': 3, 'context_extractor_yyx': 'gru', 'activation_func_yyx': 'ReLU', 'L2_weight_yyx': 1.9719608082647456e-05, 'L_entropy_weight_yyx': 4.5374976801068756e-09, 'L_sep_weight_yyx': 0.00018487521637682602, 'L_scale_weight_yyx': 0.0004321353867969805, 'learning_rate_yyx': 0.00745569923398048}. Best is trial 24 with value: -1.4518791534615763.
[I 2026-03-18 22:22:29,462] Trial 51 pruned. 
[I 2026-03-18 22:22:29,573] Trial 72 pruned. 
[I 2026-03-18 22:22:29,666] Trial 65 pruned. 
[I 2026-03-18 22:22:29,699] Trial 56 pruned. 
[I 2026-03-18 22:22:30,355] Trial 58 finished with value: -2.47487052792804 and parameters: {'n_layers_yyx': 2, 'hidden_size_yyx_l0': 6, 'hidden_size_yyx_l1': 5, 'context_size_yyx': 4, 'num_mix_components_yyx': 4, 'context_extractor_yyx': 'gru', 'activation_func_yyx': 'ReLU', 'L2_weight_yyx': 1.6598780300379805e-08, 'L_entropy_weight_yyx': 5.425218938788557e-07, 'L_sep_weight_yyx': 1.402367264719486e-07, 'L_scale_weight_yyx': 0.0003914399119823741, 'learning_rate_yyx': 0.006409628504676766}. Best is trial 25 with value: -2.4764732316599813.
[I 2026-03-18 22:22:31,955] Trial 35 pruned. 
[I 2026-03-18 22:22:33,000] Trial 73 pruned. 
[I 2026-03-18 22:22:36,330] Trial 74 pruned. 
[I 2026-03-18 22:22:38,300] Trial 48 pruned. 
[I 2026-03-18 22:22:39,398] Trial 75 pruned. 
[I 2026-03-18 22:22:41,740] Trial 54 pruned. 
[I 2026-03-18 22:22:44,011] Trial 55 pruned. 
[I 2026-03-18 22:22:44,989] Trial 63 pruned. 
[I 2026-03-18 22:22:46,088] Trial 49 pruned. 
[I 2026-03-18 22:22:46,438] Trial 57 pruned. 
[I 2026-03-18 22:22:46,713] Trial 66 pruned. 
[I 2026-03-18 22:22:46,765] Trial 53 finished with value: -1.4500379356971154 and parameters: {'n_layers_yyx': 1, 'hidden_size_yyx_l0': 4, 'context_size_yyx': 4, 'num_mix_components_yyx': 5, 'context_extractor_yyx': 'gru', 'activation_func_yyx': 'Tanh', 'L2_weight_yyx': 7.198846958152171e-07, 'L_entropy_weight_yyx': 1.680729638640019e-08, 'L_sep_weight_yyx': 8.009591277320903e-10, 'L_scale_weight_yyx': 1.9225550776483458e-07, 'learning_rate_yyx': 0.009114873847284129}. Best is trial 29 with value: -1.4683670278695913.
[I 2026-03-18 22:22:47,781] Trial 56 pruned. 
[I 2026-03-18 22:22:48,220] Trial 36 pruned. 
[I 2026-03-18 22:22:49,771] Trial 58 pruned. 
[I 2026-03-18 22:22:51,513] Trial 52 finished with value: -1.457707801231971 and parameters: {'n_layers_yyx': 1, 'hidden_size_yyx_l0': 4, 'context_size_yyx': 4, 'num_mix_components_yyx': 5, 'context_extractor_yyx': 'lstm', 'activation_func_yyx': 'Tanh', 'L2_weight_yyx': 1.7533900715489091e-09, 'L_entropy_weight_yyx': 1.0581637303452366e-10, 'L_sep_weight_yyx': 2.5354056793662436e-05, 'L_scale_weight_yyx': 8.030085563310393e-05, 'learning_rate_yyx': 0.004764003799310957}. Best is trial 49 with value: -1.4726762272761418.
[I 2026-03-18 22:22:53,302] Trial 67 pruned. 
[I 2026-03-18 22:22:53,316] Trial 59 pruned. 
[I 2026-03-18 22:22:54,132] Trial 50 pruned. 
[I 2026-03-18 22:22:54,661] Trial 63 finished with value: -1.569660308946494 and parameters: {'n_layers_yyx': 2, 'hidden_size_yyx_l0': 5, 'hidden_size_yyx_l1': 5, 'context_size_yyx': 2, 'num_mix_components_yyx': 5, 'context_extractor_yyx': 'gru', 'activation_func_yyx': 'Tanh', 'L2_weight_yyx': 5.252388813822346e-05, 'L_entropy_weight_yyx': 8.622804028583629e-10, 'L_sep_weight_yyx': 4.6004068198916986e-07, 'L_scale_weight_yyx': 2.4993676453992367e-07, 'learning_rate_yyx': 0.008446835121085149}. Best is trial 26 with value: -1.584650032885134.
[I 2026-03-18 22:23:00,853] Trial 60 pruned. 
[I 2026-03-18 22:23:01,410] Trial 51 pruned. 
[I 2026-03-18 22:23:03,105] Trial 54 pruned. 
[I 2026-03-18 22:23:03,269] Trial 51 finished with value: -1.4564813701923076 and parameters: {'n_layers_yyx': 2, 'hidden_size_yyx_l0': 4, 'hidden_size_yyx_l1': 5, 'context_size_yyx': 1, 'num_mix_components_yyx': 3, 'context_extractor_yyx': 'lstm', 'activation_func_yyx': 'Tanh', 'L2_weight_yyx': 8.767023615580939e-05, 'L_entropy_weight_yyx': 0.00012793743146012046, 'L_sep_weight_yyx': 2.5584555174920713e-10, 'L_scale_weight_yyx': 1.8499288842616677e-10, 'learning_rate_yyx': 0.007708769570432326}. Best is trial 32 with value: -1.4612882173978365.
[I 2026-03-18 22:23:04,256] Trial 30 finished with value: -2.474835118092794 and parameters: {'n_layers_yyx': 1, 'hidden_size_yyx_l0': 4, 'context_size_yyx': 4, 'num_mix_components_yyx': 2, 'context_extractor_yyx': 'gru', 'activation_func_yyx': 'ReLU', 'L2_weight_yyx': 1.4509084628901392e-06, 'L_entropy_weight_yyx': 5.586080396573943e-06, 'L_sep_weight_yyx': 8.622388928329588e-07, 'L_scale_weight_yyx': 3.229467778727771e-07, 'learning_rate_yyx': 0.0074658618031242605}. Best is trial 30 with value: -2.474835118092794.
[I 2026-03-18 22:23:05,564] Trial 57 pruned. 
[I 2026-03-18 22:23:07,750] Trial 52 finished with value: -1.4474527681790865 and parameters: {'n_layers_yyx': 1, 'hidden_size_yyx_l0': 5, 'context_size_yyx': 4, 'num_mix_components_yyx': 3, 'context_extractor_yyx': 'lstm', 'activation_func_yyx': 'Tanh', 'L2_weight_yyx': 2.2442920862503512e-10, 'L_entropy_weight_yyx': 1.1453002357517294e-10, 'L_sep_weight_yyx': 2.0605106915236954e-06, 'L_scale_weight_yyx': 0.0009860636441477166, 'learning_rate_yyx': 0.0037344837608157396}. Best is trial 12 with value: -1.460441659780649.
[I 2026-03-18 22:23:08,336] Trial 64 finished with value: -1.4106387972081982 and parameters: {'n_layers_yyx': 2, 'hidden_size_yyx_l0': 6, 'hidden_size_yyx_l1': 5, 'context_size_yyx': 4, 'num_mix_components_yyx': 4, 'context_extractor_yyx': 'gru', 'activation_func_yyx': 'ReLU', 'L2_weight_yyx': 5.600637271942362e-06, 'L_entropy_weight_yyx': 2.7621535032053128e-08, 'L_sep_weight_yyx': 1.0001696671196221e-05, 'L_scale_weight_yyx': 0.00012631910029773218, 'learning_rate_yyx': 0.009290513754774764}. Best is trial 24 with value: -1.4518791534615763.
[I 2026-03-18 22:23:10,615] Trial 68 pruned. 
[I 2026-03-18 22:23:11,962] Trial 53 pruned. 
[I 2026-03-18 22:23:13,202] Trial 58 pruned. 
[I 2026-03-18 22:23:14,411] Trial 55 finished with value: -1.4387256798377404 and parameters: {'n_layers_yyx': 2, 'hidden_size_yyx_l0': 3, 'hidden_size_yyx_l1': 4, 'context_size_yyx': 2, 'num_mix_components_yyx': 4, 'context_extractor_yyx': 'lstm', 'activation_func_yyx': 'Tanh', 'L2_weight_yyx': 5.093098268342495e-09, 'L_entropy_weight_yyx': 2.169497370565139e-09, 'L_sep_weight_yyx': 3.9328895615474795e-05, 'L_scale_weight_yyx': 7.3442888056410075e-09, 'learning_rate_yyx': 0.008926239921139716}. Best is trial 19 with value: -1.4628589806189904.
[I 2026-03-18 22:23:16,187] Trial 37 finished with value: -1.3962881704477164 and parameters: {'n_layers_yyx': 2, 'hidden_size_yyx_l0': 5, 'hidden_size_yyx_l1': 6, 'context_size_yyx': 3, 'num_mix_components_yyx': 3, 'context_extractor_yyx': 'gru', 'activation_func_yyx': 'Tanh', 'L2_weight_yyx': 1.0262773312536245e-07, 'L_entropy_weight_yyx': 4.4624791124722326e-08, 'L_sep_weight_yyx': 4.0099222006502476e-10, 'L_scale_weight_yyx': 2.154508021688184e-09, 'learning_rate_yyx': 0.008087475973995357}. Best is trial 13 with value: -1.4421805044320914.
[I 2026-03-18 22:23:16,927] Trial 59 pruned. 
[I 2026-03-18 22:23:18,098] Trial 34 finished with value: -2.493789125353962 and parameters: {'n_layers_yyx': 1, 'hidden_size_yyx_l0': 6, 'context_size_yyx': 4, 'num_mix_components_yyx': 5, 'context_extractor_yyx': 'gru', 'activation_func_yyx': 'GELU', 'L2_weight_yyx': 1.498061793568838e-10, 'L_entropy_weight_yyx': 3.1138893047995674e-05, 'L_sep_weight_yyx': 4.851672778077346e-10, 'L_scale_weight_yyx': 1.2833151142263258e-07, 'learning_rate_yyx': 0.006080306206850753}. Best is trial 4 with value: -2.49523174750643.
[I 2026-03-18 22:23:18,864] Trial 52 pruned. 
[I 2026-03-18 22:23:19,223] Trial 54 pruned. 
[I 2026-03-18 22:23:20,101] Trial 52 pruned. 
[I 2026-03-18 22:23:22,789] Trial 64 finished with value: -1.5633588227512998 and parameters: {'n_layers_yyx': 2, 'hidden_size_yyx_l0': 5, 'hidden_size_yyx_l1': 5, 'context_size_yyx': 2, 'num_mix_components_yyx': 5, 'context_extractor_yyx': 'gru', 'activation_func_yyx': 'Tanh', 'L2_weight_yyx': 2.7837112892216604e-06, 'L_entropy_weight_yyx': 9.243984372711998e-10, 'L_sep_weight_yyx': 1.6862001096403198e-06, 'L_scale_weight_yyx': 6.326571809803194e-07, 'learning_rate_yyx': 0.006630441770707939}. Best is trial 26 with value: -1.584650032885134.
[I 2026-03-18 22:23:23,096] Trial 38 pruned. 
[I 2026-03-18 22:23:23,505] Trial 55 pruned. 
[I 2026-03-18 22:23:24,223] Trial 60 pruned. 
[I 2026-03-18 22:23:25,109] Trial 65 pruned. 
[I 2026-03-18 22:23:26,510] Trial 39 pruned. 
[I 2026-03-18 22:23:27,128] Trial 56 pruned. 
[I 2026-03-18 22:23:28,364] Trial 61 pruned. 
[I 2026-03-18 22:23:28,613] Trial 53 finished with value: -1.461368924654447 and parameters: {'n_layers_yyx': 1, 'hidden_size_yyx_l0': 4, 'context_size_yyx': 4, 'num_mix_components_yyx': 5, 'context_extractor_yyx': 'lstm', 'activation_func_yyx': 'Tanh', 'L2_weight_yyx': 1.9308897970658126e-09, 'L_entropy_weight_yyx': 1.7879331014310371e-10, 'L_sep_weight_yyx': 9.31636651205157e-05, 'L_scale_weight_yyx': 9.050132259062348e-05, 'learning_rate_yyx': 0.004708391010574516}. Best is trial 49 with value: -1.4726762272761418.
[I 2026-03-18 22:23:31,197] Trial 56 pruned. 
[I 2026-03-18 22:23:32,218] Trial 62 pruned. 
[I 2026-03-18 22:23:32,749] Trial 59 finished with value: -2.4754074088636044 and parameters: {'n_layers_yyx': 2, 'hidden_size_yyx_l0': 6, 'hidden_size_yyx_l1': 5, 'context_size_yyx': 4, 'num_mix_components_yyx': 3, 'context_extractor_yyx': 'gru', 'activation_func_yyx': 'ReLU', 'L2_weight_yyx': 1.905440430618835e-09, 'L_entropy_weight_yyx': 1.3519188144641988e-06, 'L_sep_weight_yyx': 3.0099388841994632e-09, 'L_scale_weight_yyx': 5.6534901979985945e-05, 'learning_rate_yyx': 0.006582573026951313}. Best is trial 25 with value: -2.4764732316599813.
[I 2026-03-18 22:23:33,152] Trial 55 finished with value: -1.4111086331881009 and parameters: {'n_layers_yyx': 1, 'hidden_size_yyx_l0': 5, 'context_size_yyx': 4, 'num_mix_components_yyx': 5, 'context_extractor_yyx': 'gru', 'activation_func_yyx': 'Tanh', 'L2_weight_yyx': 3.5415917651265575e-07, 'L_entropy_weight_yyx': 7.013975993501239e-10, 'L_sep_weight_yyx': 6.397730782665501e-10, 'L_scale_weight_yyx': 2.1101045201584335e-09, 'learning_rate_yyx': 0.007619319866776115}. Best is trial 29 with value: -1.4683670278695913.
[I 2026-03-18 22:23:33,935] Trial 40 pruned. 
[I 2026-03-18 22:23:34,848] Trial 57 pruned. 
[I 2026-03-18 22:23:35,220] Trial 61 finished with value: -1.4413824932391828 and parameters: {'n_layers_yyx': 2, 'hidden_size_yyx_l0': 5, 'hidden_size_yyx_l1': 6, 'context_size_yyx': 2, 'num_mix_components_yyx': 3, 'context_extractor_yyx': 'lstm', 'activation_func_yyx': 'ReLU', 'L2_weight_yyx': 2.5697889389015185e-05, 'L_entropy_weight_yyx': 3.6189936364488696e-06, 'L_sep_weight_yyx': 5.997324608261081e-07, 'L_scale_weight_yyx': 0.0009804117946654125, 'learning_rate_yyx': 0.007860214244733816}. Best is trial 27 with value: -1.4597027822641226.
[I 2026-03-18 22:23:35,802] Trial 63 pruned. 
[I 2026-03-18 22:23:36,222] Trial 54 pruned. 
[I 2026-03-18 22:23:36,649] Trial 56 pruned. 
[I 2026-03-18 22:23:38,068] Trial 76 finished with value: -1.4864199028640497 and parameters: {'n_layers_yyx': 1, 'hidden_size_yyx_l0': 2, 'context_size_yyx': 1, 'num_mix_components_yyx': 2, 'context_extractor_yyx': 'lstm', 'activation_func_yyx': 'Tanh', 'L2_weight_yyx': 1.760282163344633e-08, 'L_entropy_weight_yyx': 1.958351114647724e-09, 'L_sep_weight_yyx': 1.6588244860949812e-08, 'L_scale_weight_yyx': 2.6230157317316757e-06, 'learning_rate_yyx': 0.008393987296642817}. Best is trial 67 with value: -1.5294848582783684.
[I 2026-03-18 22:23:38,580] Trial 58 pruned. 
[I 2026-03-18 22:23:38,628] Trial 53 pruned. 
[I 2026-03-18 22:23:40,092] Trial 55 pruned. 
[I 2026-03-18 22:23:41,941] Trial 66 pruned. 
[I 2026-03-18 22:23:42,452] Trial 62 pruned. 
[I 2026-03-18 22:23:43,953] Trial 64 pruned. 
[I 2026-03-18 22:23:44,050] Trial 56 pruned. 
[I 2026-03-18 22:23:46,188] Trial 54 pruned. 
[I 2026-03-18 22:23:46,351] Trial 69 finished with value: -1.408121830866887 and parameters: {'n_layers_yyx': 2, 'hidden_size_yyx_l0': 2, 'hidden_size_yyx_l1': 4, 'context_size_yyx': 2, 'num_mix_components_yyx': 5, 'context_extractor_yyx': 'lstm', 'activation_func_yyx': 'Tanh', 'L2_weight_yyx': 4.509928979037904e-08, 'L_entropy_weight_yyx': 7.418671832496243e-10, 'L_sep_weight_yyx': 1.8565998342046296e-05, 'L_scale_weight_yyx': 5.143945213816157e-08, 'learning_rate_yyx': 0.008345740348357349}. Best is trial 32 with value: -1.4672450138972355.
[I 2026-03-18 22:23:47,743] Trial 57 pruned. 
[I 2026-03-18 22:23:50,171] Trial 55 pruned. 
[I 2026-03-18 22:23:50,627] Trial 65 finished with value: -1.5807001242858234 and parameters: {'n_layers_yyx': 2, 'hidden_size_yyx_l0': 5, 'hidden_size_yyx_l1': 5, 'context_size_yyx': 2, 'num_mix_components_yyx': 5, 'context_extractor_yyx': 'gru', 'activation_func_yyx': 'Tanh', 'L2_weight_yyx': 1.4707140953628277e-05, 'L_entropy_weight_yyx': 2.6976652272063105e-10, 'L_sep_weight_yyx': 7.333712834563158e-06, 'L_scale_weight_yyx': 2.6570729550636865e-06, 'learning_rate_yyx': 0.008381283938280542}. Best is trial 26 with value: -1.584650032885134.
[I 2026-03-18 22:23:51,313] Trial 65 pruned. 
[I 2026-03-18 22:23:52,861] Trial 70 pruned. 
[I 2026-03-18 22:23:54,083] Trial 57 pruned. 
[I 2026-03-18 22:23:54,528] Trial 77 pruned. 
[I 2026-03-18 22:23:55,270] Trial 58 pruned. 
[I 2026-03-18 22:23:55,947] Trial 59 pruned. 
[I 2026-03-18 22:23:56,660] Trial 71 pruned. 
[I 2026-03-18 22:23:57,019] Trial 58 pruned. 
[I 2026-03-18 22:23:57,207] Trial 56 pruned. 
[I 2026-03-18 22:23:58,437] Trial 67 pruned. 
[I 2026-03-18 22:23:59,431] Trial 60 pruned. 
[I 2026-03-18 22:23:59,951] Trial 72 pruned. 
[I 2026-03-18 22:24:00,409] Trial 59 pruned. 
[I 2026-03-18 22:24:00,742] Trial 78 pruned. 
[I 2026-03-18 22:24:00,920] Trial 57 pruned. 
[I 2026-03-18 22:24:01,564] Trial 68 pruned. 
[I 2026-03-18 22:24:03,550] Trial 60 pruned. 
[I 2026-03-18 22:24:03,789] Trial 73 pruned. 
[I 2026-03-18 22:24:03,867] Trial 79 pruned. 
[I 2026-03-18 22:24:07,433] Trial 74 pruned. 
[I 2026-03-18 22:24:07,588] Trial 58 pruned. 
[I 2026-03-18 22:24:08,228] Trial 63 finished with value: -1.4004306265024038 and parameters: {'n_layers_yyx': 2, 'hidden_size_yyx_l0': 6, 'hidden_size_yyx_l1': 6, 'context_size_yyx': 2, 'num_mix_components_yyx': 3, 'context_extractor_yyx': 'lstm', 'activation_func_yyx': 'ReLU', 'L2_weight_yyx': 1.1470457296853153e-05, 'L_entropy_weight_yyx': 3.1785332846629885e-06, 'L_sep_weight_yyx': 7.450373102698966e-07, 'L_scale_weight_yyx': 0.0006046399165213496, 'learning_rate_yyx': 0.009023004447588478}. Best is trial 27 with value: -1.4597027822641226.
[I 2026-03-18 22:24:08,395] Trial 69 pruned. 
[I 2026-03-18 22:24:08,857] Trial 66 pruned. 
[I 2026-03-18 22:24:09,753] Trial 61 pruned. 
[I 2026-03-18 22:24:11,102] Trial 75 pruned. 
[I 2026-03-18 22:24:11,583] Trial 70 pruned. 
[I 2026-03-18 22:24:11,667] Trial 64 pruned. 
[I 2026-03-18 22:24:12,388] Trial 67 pruned. 
[I 2026-03-18 22:24:12,905] Trial 59 pruned. 
[I 2026-03-18 22:24:14,187] Trial 53 finished with value: -2.4848587740384613 and parameters: {'n_layers_yyx': 1, 'hidden_size_yyx_l0': 6, 'context_size_yyx': 4, 'num_mix_components_yyx': 5, 'context_extractor_yyx': 'gru', 'activation_func_yyx': 'ReLU', 'L2_weight_yyx': 2.4711803985272642e-05, 'L_entropy_weight_yyx': 0.00015893245276646226, 'L_sep_weight_yyx': 7.163004466201544e-05, 'L_scale_weight_yyx': 1.3025060793772995e-06, 'learning_rate_yyx': 0.006600675088190618}. Best is trial 46 with value: -2.4875562296733595.
[I 2026-03-18 22:24:15,339] Trial 65 pruned. 
[I 2026-03-18 22:24:16,868] Trial 31 finished with value: -2.4747782100269493 and parameters: {'n_layers_yyx': 1, 'hidden_size_yyx_l0': 4, 'context_size_yyx': 4, 'num_mix_components_yyx': 2, 'context_extractor_yyx': 'gru', 'activation_func_yyx': 'ReLU', 'L2_weight_yyx': 2.531172228390515e-06, 'L_entropy_weight_yyx': 2.030410935237888e-06, 'L_sep_weight_yyx': 5.188851976173544e-07, 'L_scale_weight_yyx': 3.921289673871278e-08, 'learning_rate_yyx': 0.008937185071762816}. Best is trial 30 with value: -2.474835118092794.
[I 2026-03-18 22:24:17,990] Trial 76 pruned. 
[I 2026-03-18 22:24:18,515] Trial 66 finished with value: -1.5736568627408392 and parameters: {'n_layers_yyx': 2, 'hidden_size_yyx_l0': 5, 'hidden_size_yyx_l1': 5, 'context_size_yyx': 2, 'num_mix_components_yyx': 5, 'context_extractor_yyx': 'gru', 'activation_func_yyx': 'Tanh', 'L2_weight_yyx': 1.3005833042576787e-05, 'L_entropy_weight_yyx': 2.2330562765044457e-10, 'L_sep_weight_yyx': 8.78099885288922e-06, 'L_scale_weight_yyx': 1.0792949788332926e-05, 'learning_rate_yyx': 0.008094569962546238}. Best is trial 26 with value: -1.584650032885134.
[I 2026-03-18 22:24:20,175] Trial 80 pruned. 
[I 2026-03-18 22:24:20,469] Trial 60 pruned. 
[I 2026-03-18 22:24:22,397] Trial 41 pruned. 
[I 2026-03-18 22:24:26,127] Trial 61 finished with value: -1.355027794471154 and parameters: {'n_layers_yyx': 2, 'hidden_size_yyx_l0': 3, 'hidden_size_yyx_l1': 5, 'context_size_yyx': 1, 'num_mix_components_yyx': 3, 'context_extractor_yyx': 'lstm', 'activation_func_yyx': 'GELU', 'L2_weight_yyx': 9.033034967140774e-10, 'L_entropy_weight_yyx': 9.066610723922415e-05, 'L_sep_weight_yyx': 3.970913193403411e-09, 'L_scale_weight_yyx': 6.96773495650816e-10, 'learning_rate_yyx': 0.009537111957377971}. Best is trial 19 with value: -1.4628589806189904.
[I 2026-03-18 22:24:30,748] Trial 60 pruned. 
[I 2026-03-18 22:24:31,724] Trial 66 pruned. 
[I 2026-03-18 22:24:31,864] Trial 54 pruned. 
[I 2026-03-18 22:24:33,378] Trial 35 finished with value: -2.497237209565205 and parameters: {'n_layers_yyx': 2, 'hidden_size_yyx_l0': 6, 'hidden_size_yyx_l1': 4, 'context_size_yyx': 4, 'num_mix_components_yyx': 5, 'context_extractor_yyx': 'gru', 'activation_func_yyx': 'GELU', 'L2_weight_yyx': 1.2615428186136745e-10, 'L_entropy_weight_yyx': 2.035667800559902e-05, 'L_sep_weight_yyx': 3.5284201860476975e-09, 'L_scale_weight_yyx': 1.0793199879036811e-07, 'learning_rate_yyx': 0.009985419040591815}. Best is trial 35 with value: -2.497237209565205.
[I 2026-03-18 22:24:33,499] Trial 62 pruned. 
[I 2026-03-18 22:24:35,338] Trial 77 pruned. 
