[I 2026-03-18 18:32:28,995] Trial 3 finished with value: -2.7323789488256267 and parameters: {'n_layers_yyx': 2, 'hidden_size_yyx_l0': 5, 'hidden_size_yyx_l1': 5, 'context_size_yyx': 3, 'num_mix_components_yyx': 1, 'context_extractor_yyx': 'lstm', 'activation_func_yyx': 'GELU', 'L2_weight_yyx': 6.814394350124216e-08, 'L_entropy_weight_yyx': 5.7943622513720775e-08, 'L_sep_weight_yyx': 4.0832062312013657e-08, 'L_scale_weight_yyx': 6.431685958697781e-09, 'learning_rate_yyx': 0.009032142049913393}. Best is trial 1 with value: -2.7617047121530724.
[I 2026-03-18 18:32:50,859] Trial 1 pruned. 
[I 2026-03-18 18:32:52,302] Trial 2 pruned. 
[I 2026-03-18 18:32:56,359] Trial 2 finished with value: -0.7963133999304722 and parameters: {'n_layers_yyx': 2, 'hidden_size_yyx_l0': 6, 'hidden_size_yyx_l1': 6, 'context_size_yyx': 3, 'num_mix_components_yyx': 2, 'context_extractor_yyx': 'gru', 'activation_func_yyx': 'Tanh', 'L2_weight_yyx': 3.474641881575996e-07, 'L_entropy_weight_yyx': 1.4410109383289822e-10, 'L_sep_weight_yyx': 6.326847873795463e-10, 'L_scale_weight_yyx': 8.941248265230817e-05, 'learning_rate_yyx': 0.005244924828979699}. Best is trial 0 with value: -0.8087707474453587.
[I 2026-03-18 18:32:58,032] Trial 3 pruned. 
[I 2026-03-18 18:33:31,954] Trial 2 pruned. 
[I 2026-03-18 18:33:45,550] Trial 3 pruned. 
[I 2026-03-18 18:34:05,153] Trial 1 finished with value: -2.7655291239420574 and parameters: {'n_layers_yyx': 2, 'hidden_size_yyx_l0': 6, 'hidden_size_yyx_l1': 4, 'context_size_yyx': 4, 'num_mix_components_yyx': 5, 'context_extractor_yyx': 'lstm', 'activation_func_yyx': 'GELU', 'L2_weight_yyx': 0.00025735983452477543, 'L_entropy_weight_yyx': 2.420143476254127e-08, 'L_sep_weight_yyx': 3.1402813195927276e-09, 'L_scale_weight_yyx': 2.6164344365681397e-07, 'learning_rate_yyx': 0.003676953405636809}. Best is trial 1 with value: -2.7655291239420574.
[I 2026-03-18 18:34:13,783] Trial 4 pruned. 
[I 2026-03-18 18:34:16,797] Trial 0 finished with value: -2.374773037310728 and parameters: {'n_layers_yyx': 2, 'hidden_size_yyx_l0': 6, 'hidden_size_yyx_l1': 2, 'context_size_yyx': 1, 'num_mix_components_yyx': 2, 'context_extractor_yyx': 'gru', 'activation_func_yyx': 'ReLU', 'L2_weight_yyx': 2.219577246805363e-09, 'L_entropy_weight_yyx': 7.859746308867054e-10, 'L_sep_weight_yyx': 6.979925782954044e-10, 'L_scale_weight_yyx': 0.0006107982379738549, 'learning_rate_yyx': 0.000644683382141599}. Best is trial 0 with value: -2.374773037310728.
[I 2026-03-18 18:34:26,855] Trial 3 pruned. 
[I 2026-03-18 18:34:28,415] Trial 2 finished with value: -2.388921567118843 and parameters: {'n_layers_yyx': 1, 'hidden_size_yyx_l0': 5, 'context_size_yyx': 3, 'num_mix_components_yyx': 4, 'context_extractor_yyx': 'gru', 'activation_func_yyx': 'ReLU', 'L2_weight_yyx': 8.584258745727983e-05, 'L_entropy_weight_yyx': 7.84394652220046e-09, 'L_sep_weight_yyx': 1.4257982358234998e-10, 'L_scale_weight_yyx': 1.2827898692748787e-08, 'learning_rate_yyx': 0.005706039986428823}. Best is trial 2 with value: -2.388921567118843.
[I 2026-03-18 18:34:36,367] Trial 4 pruned. 
[I 2026-03-18 18:35:06,637] Trial 5 pruned. 
[I 2026-03-18 18:36:07,118] Trial 0 finished with value: -2.7660925649378423 and parameters: {'n_layers_yyx': 1, 'hidden_size_yyx_l0': 4, 'context_size_yyx': 3, 'num_mix_components_yyx': 2, 'context_extractor_yyx': 'lstm', 'activation_func_yyx': 'GELU', 'L2_weight_yyx': 2.150599046456177e-10, 'L_entropy_weight_yyx': 2.8781158505445195e-06, 'L_sep_weight_yyx': 3.5407674517818416e-08, 'L_scale_weight_yyx': 5.0272448672235535e-09, 'learning_rate_yyx': 0.0007098470744669367}. Best is trial 0 with value: -2.7660925649378423.
[I 2026-03-18 18:36:08,330] Trial 4 pruned. 
[I 2026-03-18 18:36:12,086] Trial 1 finished with value: -2.766161832317774 and parameters: {'n_layers_yyx': 1, 'hidden_size_yyx_l0': 6, 'context_size_yyx': 4, 'num_mix_components_yyx': 5, 'context_extractor_yyx': 'lstm', 'activation_func_yyx': 'GELU', 'L2_weight_yyx': 1.4412795202840191e-05, 'L_entropy_weight_yyx': 6.025200352158806e-06, 'L_sep_weight_yyx': 2.619211526415769e-09, 'L_scale_weight_yyx': 0.00019036961672295666, 'learning_rate_yyx': 0.0005274966665489985}. Best is trial 1 with value: -2.766161832317774.
[I 2026-03-18 18:36:26,560] Trial 0 finished with value: -2.7636347023115175 and parameters: {'n_layers_yyx': 2, 'hidden_size_yyx_l0': 3, 'hidden_size_yyx_l1': 5, 'context_size_yyx': 2, 'num_mix_components_yyx': 4, 'context_extractor_yyx': 'gru', 'activation_func_yyx': 'ReLU', 'L2_weight_yyx': 4.8256326474072684e-05, 'L_entropy_weight_yyx': 0.0002844178452462989, 'L_sep_weight_yyx': 9.568935607861219e-09, 'L_scale_weight_yyx': 3.6201436102826383e-10, 'learning_rate_yyx': 0.0005730538512727697}. Best is trial 0 with value: -2.7636347023115175.
[I 2026-03-18 18:36:41,183] Trial 1 finished with value: -2.403239696425078 and parameters: {'n_layers_yyx': 1, 'hidden_size_yyx_l0': 3, 'context_size_yyx': 4, 'num_mix_components_yyx': 2, 'context_extractor_yyx': 'lstm', 'activation_func_yyx': 'GELU', 'L2_weight_yyx': 7.349084347146097e-09, 'L_entropy_weight_yyx': 8.740850974884417e-09, 'L_sep_weight_yyx': 4.285701996580478e-07, 'L_scale_weight_yyx': 1.9004638446628465e-07, 'learning_rate_yyx': 0.002992344796789493}. Best is trial 0 with value: -2.431222564426635.
[I 2026-03-18 18:36:53,313] Trial 1 finished with value: -2.7579125810001064 and parameters: {'n_layers_yyx': 2, 'hidden_size_yyx_l0': 5, 'hidden_size_yyx_l1': 4, 'context_size_yyx': 2, 'num_mix_components_yyx': 5, 'context_extractor_yyx': 'gru', 'activation_func_yyx': 'ReLU', 'L2_weight_yyx': 1.7272325693330252e-06, 'L_entropy_weight_yyx': 2.755851272405454e-08, 'L_sep_weight_yyx': 3.47806685512118e-09, 'L_scale_weight_yyx': 0.00011774322059606038, 'learning_rate_yyx': 0.003202176354955883}. Best is trial 0 with value: -2.7636622336554546.
[I 2026-03-18 18:36:54,107] Trial 6 pruned. 
[I 2026-03-18 18:37:05,825] Trial 2 pruned. 
[I 2026-03-18 18:37:32,307] Trial 1 finished with value: -2.728555048176744 and parameters: {'n_layers_yyx': 1, 'hidden_size_yyx_l0': 6, 'context_size_yyx': 3, 'num_mix_components_yyx': 5, 'context_extractor_yyx': 'lstm', 'activation_func_yyx': 'ReLU', 'L2_weight_yyx': 0.00016942367121785507, 'L_entropy_weight_yyx': 0.0001105002490349991, 'L_sep_weight_yyx': 0.00013045586340948215, 'L_scale_weight_yyx': 3.1191812664590697e-07, 'learning_rate_yyx': 0.004616856693990204}. Best is trial 0 with value: -2.763455357633574.
[I 2026-03-18 18:37:41,864] Trial 2 pruned. 
[I 2026-03-18 18:37:42,757] Trial 5 pruned. 
[I 2026-03-18 18:37:45,285] Trial 7 pruned. 
[I 2026-03-18 18:38:18,023] Trial 2 pruned. 
[I 2026-03-18 18:38:32,777] Trial 8 pruned. 
[I 2026-03-18 18:38:33,360] Trial 6 pruned. 
[I 2026-03-18 18:39:01,219] Trial 3 pruned. 
[I 2026-03-18 18:39:15,603] Trial 7 pruned. 
[I 2026-03-18 18:39:44,380] Trial 4 finished with value: -2.7243981835676387 and parameters: {'n_layers_yyx': 2, 'hidden_size_yyx_l0': 4, 'hidden_size_yyx_l1': 4, 'context_size_yyx': 2, 'num_mix_components_yyx': 1, 'context_extractor_yyx': 'gru', 'activation_func_yyx': 'GELU', 'L2_weight_yyx': 7.540314423569577e-07, 'L_entropy_weight_yyx': 2.3300494508569205e-05, 'L_sep_weight_yyx': 1.0646221966933519e-08, 'L_scale_weight_yyx': 4.680727598267217e-07, 'learning_rate_yyx': 0.00608681465110752}. Best is trial 1 with value: -2.7580840003681693.
[I 2026-03-18 18:39:47,220] Trial 2 finished with value: -2.761776557452162 and parameters: {'n_layers_yyx': 2, 'hidden_size_yyx_l0': 3, 'hidden_size_yyx_l1': 5, 'context_size_yyx': 3, 'num_mix_components_yyx': 5, 'context_extractor_yyx': 'lstm', 'activation_func_yyx': 'GELU', 'L2_weight_yyx': 5.448856210247942e-10, 'L_entropy_weight_yyx': 0.0002783371793904037, 'L_sep_weight_yyx': 1.471285434167462e-07, 'L_scale_weight_yyx': 3.992824167678858e-07, 'learning_rate_yyx': 0.0008631375395234741}. Best is trial 2 with value: -2.761776557452162.
[I 2026-03-18 18:39:59,235] Trial 6 finished with value: -2.7666481379132684 and parameters: {'n_layers_yyx': 2, 'hidden_size_yyx_l0': 4, 'hidden_size_yyx_l1': 2, 'context_size_yyx': 1, 'num_mix_components_yyx': 1, 'context_extractor_yyx': 'gru', 'activation_func_yyx': 'Tanh', 'L2_weight_yyx': 1.99132609918177e-09, 'L_entropy_weight_yyx': 2.4419391231924045e-09, 'L_sep_weight_yyx': 0.0004677207631228281, 'L_scale_weight_yyx': 3.207469983697655e-09, 'learning_rate_yyx': 0.005297750615245195}. Best is trial 0 with value: -2.8001684201127572.
[I 2026-03-18 18:40:03,180] Trial 9 pruned. 
[I 2026-03-18 18:40:36,316] Trial 1 finished with value: -2.7517246605052583 and parameters: {'n_layers_yyx': 2, 'hidden_size_yyx_l0': 3, 'hidden_size_yyx_l1': 4, 'context_size_yyx': 1, 'num_mix_components_yyx': 3, 'context_extractor_yyx': 'lstm', 'activation_func_yyx': 'GELU', 'L2_weight_yyx': 7.483918859901472e-09, 'L_entropy_weight_yyx': 4.705262962454707e-08, 'L_sep_weight_yyx': 4.912020986921845e-10, 'L_scale_weight_yyx': 2.1021999533443012e-06, 'learning_rate_yyx': 0.0007029287983001832}. Best is trial 1 with value: -2.7517246605052583.
[I 2026-03-18 18:40:44,537] Trial 7 pruned. 
[I 2026-03-18 18:40:47,045] Trial 10 pruned. 
[I 2026-03-18 18:40:53,757] Trial 1 finished with value: -2.763214675732409 and parameters: {'n_layers_yyx': 2, 'hidden_size_yyx_l0': 4, 'hidden_size_yyx_l1': 5, 'context_size_yyx': 3, 'num_mix_components_yyx': 5, 'context_extractor_yyx': 'lstm', 'activation_func_yyx': 'ReLU', 'L2_weight_yyx': 3.335577384018549e-06, 'L_entropy_weight_yyx': 4.419316488359456e-05, 'L_sep_weight_yyx': 1.8515777252392945e-08, 'L_scale_weight_yyx': 2.688050055369323e-07, 'learning_rate_yyx': 0.0005735323714066901}. Best is trial 0 with value: -2.7678615354442075.
[I 2026-03-18 18:41:07,500] Trial 1 finished with value: -0.8307161542478305 and parameters: {'n_layers_yyx': 2, 'hidden_size_yyx_l0': 4, 'hidden_size_yyx_l1': 2, 'context_size_yyx': 4, 'num_mix_components_yyx': 4, 'context_extractor_yyx': 'lstm', 'activation_func_yyx': 'GELU', 'L2_weight_yyx': 3.6113563743652956e-10, 'L_entropy_weight_yyx': 4.373773319166571e-06, 'L_sep_weight_yyx': 2.4580115174736636e-08, 'L_scale_weight_yyx': 0.0005186723688111441, 'learning_rate_yyx': 0.002210176910474172}. Best is trial 1 with value: -0.8307161542478305.
[I 2026-03-18 18:41:16,174] Trial 5 pruned. 
[I 2026-03-18 18:41:34,729] Trial 11 pruned. 
[I 2026-03-18 18:41:35,650] Trial 1 pruned. 
[I 2026-03-18 18:41:59,314] Trial 5 finished with value: -2.390187474465682 and parameters: {'n_layers_yyx': 2, 'hidden_size_yyx_l0': 6, 'hidden_size_yyx_l1': 5, 'context_size_yyx': 1, 'num_mix_components_yyx': 3, 'context_extractor_yyx': 'lstm', 'activation_func_yyx': 'Tanh', 'L2_weight_yyx': 2.4069086713045758e-08, 'L_entropy_weight_yyx': 8.802898374778789e-05, 'L_sep_weight_yyx': 1.0841768099419677e-08, 'L_scale_weight_yyx': 2.0889442391686532e-05, 'learning_rate_yyx': 0.009709243049193675}. Best is trial 0 with value: -2.4017951846031065.
[I 2026-03-18 18:42:18,665] Trial 12 pruned. 
[I 2026-03-18 18:42:22,395] Trial 2 finished with value: -0.8065716561749907 and parameters: {'n_layers_yyx': 2, 'hidden_size_yyx_l0': 3, 'hidden_size_yyx_l1': 2, 'context_size_yyx': 4, 'num_mix_components_yyx': 5, 'context_extractor_yyx': 'gru', 'activation_func_yyx': 'ReLU', 'L2_weight_yyx': 0.0007809927138531795, 'L_entropy_weight_yyx': 7.326516328380846e-10, 'L_sep_weight_yyx': 2.0783712206374864e-06, 'L_scale_weight_yyx': 1.1825261530235605e-07, 'learning_rate_yyx': 0.0018856747798252438}. Best is trial 0 with value: -0.8217222363064878.
[I 2026-03-18 18:42:27,038] Trial 1 finished with value: -2.5400440164613816 and parameters: {'n_layers_yyx': 2, 'hidden_size_yyx_l0': 2, 'hidden_size_yyx_l1': 6, 'context_size_yyx': 4, 'num_mix_components_yyx': 5, 'context_extractor_yyx': 'gru', 'activation_func_yyx': 'Tanh', 'L2_weight_yyx': 1.2770634253043535e-05, 'L_entropy_weight_yyx': 9.265535134444478e-06, 'L_sep_weight_yyx': 1.8568472367267784e-09, 'L_scale_weight_yyx': 1.056457424159631e-08, 'learning_rate_yyx': 0.0020543386817718666}. Best is trial 1 with value: -2.5400440164613816.
[I 2026-03-18 18:42:37,412] Trial 2 finished with value: -2.762987867182404 and parameters: {'n_layers_yyx': 1, 'hidden_size_yyx_l0': 6, 'context_size_yyx': 3, 'num_mix_components_yyx': 5, 'context_extractor_yyx': 'gru', 'activation_func_yyx': 'Tanh', 'L2_weight_yyx': 1.918276513181534e-09, 'L_entropy_weight_yyx': 0.0006073616925210467, 'L_sep_weight_yyx': 7.209730541895392e-09, 'L_scale_weight_yyx': 6.970456247303098e-08, 'learning_rate_yyx': 0.0006652654204668603}. Best is trial 2 with value: -2.762987867182404.
[I 2026-03-18 18:42:42,829] Trial 1 finished with value: -2.762434471701954 and parameters: {'n_layers_yyx': 2, 'hidden_size_yyx_l0': 3, 'hidden_size_yyx_l1': 3, 'context_size_yyx': 1, 'num_mix_components_yyx': 2, 'context_extractor_yyx': 'lstm', 'activation_func_yyx': 'ReLU', 'L2_weight_yyx': 3.5226408947045485e-10, 'L_entropy_weight_yyx': 4.493539228517982e-08, 'L_sep_weight_yyx': 0.0005394223241383248, 'L_scale_weight_yyx': 1.7387857652815732e-07, 'learning_rate_yyx': 0.0030475946474783065}. Best is trial 1 with value: -2.762434471701954.
[I 2026-03-18 18:42:46,155] Trial 1 finished with value: -2.3744330763909027 and parameters: {'n_layers_yyx': 1, 'hidden_size_yyx_l0': 2, 'context_size_yyx': 1, 'num_mix_components_yyx': 3, 'context_extractor_yyx': 'gru', 'activation_func_yyx': 'Tanh', 'L2_weight_yyx': 2.6306307927338237e-09, 'L_entropy_weight_yyx': 6.090249170599414e-05, 'L_sep_weight_yyx': 0.0001932587136631709, 'L_scale_weight_yyx': 4.968534750121113e-10, 'learning_rate_yyx': 0.0007893165816742985}. Best is trial 0 with value: -2.4083293020863543.
[I 2026-03-18 18:42:55,855] Trial 1 finished with value: -2.393392615685096 and parameters: {'n_layers_yyx': 2, 'hidden_size_yyx_l0': 5, 'hidden_size_yyx_l1': 3, 'context_size_yyx': 3, 'num_mix_components_yyx': 4, 'context_extractor_yyx': 'lstm', 'activation_func_yyx': 'GELU', 'L2_weight_yyx': 3.4668026638004975e-07, 'L_entropy_weight_yyx': 7.064672161138301e-10, 'L_sep_weight_yyx': 2.2131183470988396e-06, 'L_scale_weight_yyx': 1.107309900689975e-09, 'learning_rate_yyx': 0.0010083405846537203}. Best is trial 1 with value: -2.393392615685096.
[I 2026-03-18 18:42:59,415] Trial 3 pruned. 
[I 2026-03-18 18:43:02,893] Trial 13 pruned. 
[I 2026-03-18 18:43:18,045] Trial 3 pruned. 
[I 2026-03-18 18:43:22,863] Trial 2 finished with value: -2.39978509736055 and parameters: {'n_layers_yyx': 2, 'hidden_size_yyx_l0': 6, 'hidden_size_yyx_l1': 3, 'context_size_yyx': 3, 'num_mix_components_yyx': 2, 'context_extractor_yyx': 'lstm', 'activation_func_yyx': 'Tanh', 'L2_weight_yyx': 3.0217994077046786e-06, 'L_entropy_weight_yyx': 0.00021026433343926656, 'L_sep_weight_yyx': 0.0001804808748651281, 'L_scale_weight_yyx': 2.8660349941540772e-05, 'learning_rate_yyx': 0.0061963597595693426}. Best is trial 2 with value: -2.39978509736055.
[I 2026-03-18 18:43:50,571] Trial 1 finished with value: -2.766246985643131 and parameters: {'n_layers_yyx': 1, 'hidden_size_yyx_l0': 4, 'context_size_yyx': 4, 'num_mix_components_yyx': 5, 'context_extractor_yyx': 'lstm', 'activation_func_yyx': 'Tanh', 'L2_weight_yyx': 2.813384105187481e-08, 'L_entropy_weight_yyx': 0.0001786049709393929, 'L_sep_weight_yyx': 1.993258291889233e-10, 'L_scale_weight_yyx': 0.0002328268856916144, 'learning_rate_yyx': 0.0009510144914385942}. Best is trial 1 with value: -2.766246985643131.
[I 2026-03-18 18:43:59,019] Trial 2 finished with value: -2.4184476873626197 and parameters: {'n_layers_yyx': 1, 'hidden_size_yyx_l0': 3, 'context_size_yyx': 2, 'num_mix_components_yyx': 2, 'context_extractor_yyx': 'lstm', 'activation_func_yyx': 'Tanh', 'L2_weight_yyx': 2.1762620585185354e-09, 'L_entropy_weight_yyx': 4.055449602945565e-05, 'L_sep_weight_yyx': 5.0591068843053405e-06, 'L_scale_weight_yyx': 1.3268054348625947e-09, 'learning_rate_yyx': 0.005013078950511773}. Best is trial 2 with value: -2.4184476873626197.
[I 2026-03-18 18:44:02,115] Trial 3 finished with value: -2.731385979548731 and parameters: {'n_layers_yyx': 2, 'hidden_size_yyx_l0': 5, 'hidden_size_yyx_l1': 5, 'context_size_yyx': 1, 'num_mix_components_yyx': 1, 'context_extractor_yyx': 'gru', 'activation_func_yyx': 'GELU', 'L2_weight_yyx': 4.669937206480867e-05, 'L_entropy_weight_yyx': 1.289704689184499e-06, 'L_sep_weight_yyx': 2.6886255594984383e-09, 'L_scale_weight_yyx': 1.2993987102556426e-05, 'learning_rate_yyx': 0.00832854666285578}. Best is trial 1 with value: -2.766161832317774.
[I 2026-03-18 18:44:14,532] Trial 8 pruned. 
[I 2026-03-18 18:44:19,024] Trial 1 finished with value: -2.2791091447024003 and parameters: {'n_layers_yyx': 2, 'hidden_size_yyx_l0': 3, 'hidden_size_yyx_l1': 6, 'context_size_yyx': 1, 'num_mix_components_yyx': 3, 'context_extractor_yyx': 'lstm', 'activation_func_yyx': 'ReLU', 'L2_weight_yyx': 1.7004164579281767e-05, 'L_entropy_weight_yyx': 6.260860941303508e-10, 'L_sep_weight_yyx': 8.510201945001105e-07, 'L_scale_weight_yyx': 1.0028070527313775e-09, 'learning_rate_yyx': 0.0015032565399948632}. Best is trial 0 with value: -2.374773037310728.
[I 2026-03-18 18:44:25,631] Trial 14 pruned. 
[I 2026-03-18 18:44:40,328] Trial 1 finished with value: -0.8019591969612606 and parameters: {'n_layers_yyx': 2, 'hidden_size_yyx_l0': 2, 'hidden_size_yyx_l1': 3, 'context_size_yyx': 4, 'num_mix_components_yyx': 3, 'context_extractor_yyx': 'lstm', 'activation_func_yyx': 'GELU', 'L2_weight_yyx': 1.9838865212416786e-05, 'L_entropy_weight_yyx': 2.4627537567330186e-08, 'L_sep_weight_yyx': 2.3864418496613635e-05, 'L_scale_weight_yyx': 2.3391493741233276e-10, 'learning_rate_yyx': 0.000604061566191168}. Best is trial 0 with value: -0.843539329540078.
[I 2026-03-18 18:44:41,208] Trial 4 pruned. 
[I 2026-03-18 18:44:46,915] Trial 3 finished with value: -2.386212062811259 and parameters: {'n_layers_yyx': 1, 'hidden_size_yyx_l0': 3, 'context_size_yyx': 4, 'num_mix_components_yyx': 2, 'context_extractor_yyx': 'gru', 'activation_func_yyx': 'ReLU', 'L2_weight_yyx': 1.1791870255036893e-05, 'L_entropy_weight_yyx': 2.0852656479001348e-10, 'L_sep_weight_yyx': 3.670890543220296e-10, 'L_scale_weight_yyx': 4.580420646586097e-09, 'learning_rate_yyx': 0.0029948301619367426}. Best is trial 2 with value: -2.388921567118843.
[I 2026-03-18 18:44:55,794] Trial 6 pruned. 
[I 2026-03-18 18:45:03,919] Trial 3 finished with value: -2.764943250652336 and parameters: {'n_layers_yyx': 2, 'hidden_size_yyx_l0': 6, 'hidden_size_yyx_l1': 4, 'context_size_yyx': 4, 'num_mix_components_yyx': 3, 'context_extractor_yyx': 'gru', 'activation_func_yyx': 'Tanh', 'L2_weight_yyx': 0.0005568043197504204, 'L_entropy_weight_yyx': 2.5597475716348157e-06, 'L_sep_weight_yyx': 3.147856114434544e-05, 'L_scale_weight_yyx': 4.35335556987147e-05, 'learning_rate_yyx': 0.005737442436279573}. Best is trial 3 with value: -2.764943250652336.
[I 2026-03-18 18:45:07,239] Trial 6 pruned. 
[I 2026-03-18 18:45:09,537] Trial 1 finished with value: -2.7649723884335895 and parameters: {'n_layers_yyx': 2, 'hidden_size_yyx_l0': 5, 'hidden_size_yyx_l1': 4, 'context_size_yyx': 1, 'num_mix_components_yyx': 5, 'context_extractor_yyx': 'gru', 'activation_func_yyx': 'Tanh', 'L2_weight_yyx': 8.499794789528821e-05, 'L_entropy_weight_yyx': 6.643076791494403e-06, 'L_sep_weight_yyx': 1.5680744397463666e-07, 'L_scale_weight_yyx': 7.948976418527337e-09, 'learning_rate_yyx': 0.007434106822489978}. Best is trial 0 with value: -2.7660925649378423.
[I 2026-03-18 18:45:17,408] Trial 2 pruned. 
[I 2026-03-18 18:45:38,365] Trial 7 pruned. 
[I 2026-03-18 18:45:57,535] Trial 5 pruned. 
[I 2026-03-18 18:46:10,848] Trial 1 finished with value: -0.7754104817107298 and parameters: {'n_layers_yyx': 1, 'hidden_size_yyx_l0': 4, 'context_size_yyx': 1, 'num_mix_components_yyx': 2, 'context_extractor_yyx': 'lstm', 'activation_func_yyx': 'ReLU', 'L2_weight_yyx': 0.0006879890361029767, 'L_entropy_weight_yyx': 2.4369257321209807e-10, 'L_sep_weight_yyx': 2.8663066112481595e-09, 'L_scale_weight_yyx': 6.9409443466619056e-09, 'learning_rate_yyx': 0.0009895962427026216}. Best is trial 0 with value: -0.8180432904242061.
[I 2026-03-18 18:46:40,692] Trial 6 pruned. 
[I 2026-03-18 18:46:57,243] Trial 8 pruned. 
[I 2026-03-18 18:47:11,848] Trial 1 finished with value: -2.723799799977801 and parameters: {'n_layers_yyx': 1, 'hidden_size_yyx_l0': 2, 'context_size_yyx': 1, 'num_mix_components_yyx': 1, 'context_extractor_yyx': 'gru', 'activation_func_yyx': 'Tanh', 'L2_weight_yyx': 6.073205017757816e-10, 'L_entropy_weight_yyx': 1.953705330100214e-07, 'L_sep_weight_yyx': 3.9876131979388006e-09, 'L_scale_weight_yyx': 4.4359575316319e-07, 'learning_rate_yyx': 0.0007275759570214206}. Best is trial 0 with value: -2.76381727105261.
[I 2026-03-18 18:47:18,168] Trial 2 finished with value: -2.73286266679657 and parameters: {'n_layers_yyx': 1, 'hidden_size_yyx_l0': 5, 'context_size_yyx': 4, 'num_mix_components_yyx': 1, 'context_extractor_yyx': 'lstm', 'activation_func_yyx': 'ReLU', 'L2_weight_yyx': 6.206339280172626e-06, 'L_entropy_weight_yyx': 5.380198855391077e-09, 'L_sep_weight_yyx': 2.4311010767779268e-05, 'L_scale_weight_yyx': 2.2008615702741816e-08, 'learning_rate_yyx': 0.0036286944107409686}. Best is trial 0 with value: -2.7678615354442075.
[I 2026-03-18 18:47:26,547] Trial 2 finished with value: -0.8123008919607413 and parameters: {'n_layers_yyx': 2, 'hidden_size_yyx_l0': 3, 'hidden_size_yyx_l1': 6, 'context_size_yyx': 1, 'num_mix_components_yyx': 4, 'context_extractor_yyx': 'gru', 'activation_func_yyx': 'ReLU', 'L2_weight_yyx': 4.9709234455352856e-08, 'L_entropy_weight_yyx': 2.9154366058325023e-06, 'L_sep_weight_yyx': 8.11671400489736e-09, 'L_scale_weight_yyx': 0.0001596156720253355, 'learning_rate_yyx': 0.0021168597024519425}. Best is trial 1 with value: -0.8307161542478305.
