[I 2026-03-18 19:01:32,618] Trial 43 finished with value: -2.637264550490013 and parameters: {'n_layers_yyx': 1, 'hidden_size_yyx_l0': 5, 'context_size_yyx': 3, 'num_mix_components_yyx': 5, 'context_extractor_yyx': 'gru', 'activation_func_yyx': 'Tanh', 'L2_weight_yyx': 3.622824538850813e-05, 'L_entropy_weight_yyx': 0.00021536963627058557, 'L_sep_weight_yyx': 2.8450700613247915e-08, 'L_scale_weight_yyx': 0.00012055020122556234, 'learning_rate_yyx': 0.006949655442966011}. Best is trial 21 with value: -2.6405605351488926.
[I 2026-03-18 19:01:33,412] Trial 48 pruned. 
[I 2026-03-18 19:01:44,675] Trial 44 pruned. 
[I 2026-03-18 19:01:45,557] Trial 49 pruned. 

Source events: 32635
Target events: 38515
Full model ln_yyx : 5426.22685 nats/sec, 126.79746 nats/event
Full model Log loss : -2.59996
Full model ln_yyx : 5486.44708 nats/sec, 128.20466 nats/event
Full model Log loss : -2.63719
Full model ln_yyx : 5418.46211 nats/sec, 126.61602 nats/event
Full model Log loss : -2.59936
Full model ln_yyx : 5453.19919 nats/sec, 127.42774 nats/event
Full model Log loss : -2.60538
Full model ln_yyx : 5479.15898 nats/sec, 128.03435 nats/event
Full model Log loss : -2.63396
Full model ln_yyx : 5499.72551 nats/sec, 128.51494 nats/event
Full model Log loss : -2.63513
Full model ln_yyx : 5519.56987 nats/sec, 128.97865 nats/event
Full model Log loss : -2.64067
Full model ln_yyx : 5520.42696 nats/sec, 128.99868 nats/event
Full model Log loss : -2.63676
Full model ln_yyx : 5438.91988 nats/sec, 127.09406 nats/event
Full model Log loss : -2.60432
Full model ln_yyx : 5528.09133 nats/sec, 129.17778 nats/event
Full model Log loss : -2.63697
Full model ln_yyx : 5502.74775 nats/sec, 128.58556 nats/event
Full model Log loss : -2.63462
Full model ln_yyx : 5427.83553 nats/sec, 126.83505 nats/event
Full model Log loss : -2.60171
Full model ln_yyx : 5526.66937 nats/sec, 129.14455 nats/event
Full model Log loss : -2.63692
Full model ln_yyx : 5484.58958 nats/sec, 128.16125 nats/event
Full model Log loss : -2.63543
Full model ln_yyx : 5527.97929 nats/sec, 129.17516 nats/event
Full model Log loss : -2.63601
Full model ln_yyx : 5517.86548 nats/sec, 128.93883 nats/event
Full model Log loss : -2.64381
Full model ln_yyx : 5552.87472 nats/sec, 129.75691 nats/event
Full model Log loss : -2.64288
Full model ln_yyx : 5458.92295 nats/sec, 127.56149 nats/event
Full model Log loss : -2.63329
Full model ln_yyx : 5467.61714 nats/sec, 127.76465 nats/event
Full model Log loss : -2.60332
Optimization finished. Config saved to results/opt-full/opt_full_125_best_config.txt
[I 2026-03-18 19:03:12,954] Trial 45 finished with value: -2.6397908081572017 and parameters: {'n_layers_yyx': 1, 'hidden_size_yyx_l0': 5, 'context_size_yyx': 4, 'num_mix_components_yyx': 5, 'context_extractor_yyx': 'gru', 'activation_func_yyx': 'Tanh', 'L2_weight_yyx': 0.0003718589143644284, 'L_entropy_weight_yyx': 7.348026943223802e-09, 'L_sep_weight_yyx': 1.9560115615320958e-08, 'L_scale_weight_yyx': 0.00024705346846946223, 'learning_rate_yyx': 0.007189510101216786}. Best is trial 21 with value: -2.6405605351488926.
[I 2026-03-18 19:03:46,863] Trial 46 pruned. 
[I 2026-03-18 19:04:43,382] Trial 47 finished with value: -2.638111158211402 and parameters: {'n_layers_yyx': 1, 'hidden_size_yyx_l0': 5, 'context_size_yyx': 4, 'num_mix_components_yyx': 5, 'context_extractor_yyx': 'gru', 'activation_func_yyx': 'Tanh', 'L2_weight_yyx': 5.651610315537067e-06, 'L_entropy_weight_yyx': 2.590188943289635e-10, 'L_sep_weight_yyx': 4.809362937912876e-09, 'L_scale_weight_yyx': 0.0002711449564363475, 'learning_rate_yyx': 0.0071508311943757445}. Best is trial 21 with value: -2.6405605351488926.
[I 2026-03-18 19:05:17,098] Trial 48 pruned. 
[I 2026-03-18 19:05:50,646] Trial 49 pruned. 

Source events: 32635
Target events: 27060
Full model ln_yyx : 3848.55550 nats/sec, 128.00074 nats/event
Full model Log loss : -2.63352
Full model ln_yyx : 3854.89054 nats/sec, 128.21144 nats/event
Full model Log loss : -2.63142
Full model ln_yyx : 3818.78881 nats/sec, 127.01071 nats/event
Full model Log loss : -2.62635
Full model ln_yyx : 3855.71818 nats/sec, 128.23896 nats/event
Full model Log loss : -2.63207
Full model ln_yyx : 3840.07149 nats/sec, 127.71856 nats/event
Full model Log loss : -2.63100
Full model ln_yyx : 3865.73149 nats/sec, 128.57200 nats/event
Full model Log loss : -2.63513
Full model ln_yyx : 3871.77064 nats/sec, 128.77286 nats/event
Full model Log loss : -2.63015
Full model ln_yyx : 3890.34407 nats/sec, 129.39060 nats/event
Full model Log loss : -2.63419
Full model ln_yyx : 3876.21094 nats/sec, 128.92054 nats/event
Full model Log loss : -2.64056
Full model ln_yyx : 3859.82159 nats/sec, 128.37544 nats/event
Full model Log loss : -2.63662
Full model ln_yyx : 3874.42708 nats/sec, 128.86121 nats/event
Full model Log loss : -2.63578
Full model ln_yyx : 3874.47530 nats/sec, 128.86281 nats/event
Full model Log loss : -2.63581
Full model ln_yyx : 3846.06538 nats/sec, 127.91792 nats/event
Full model Log loss : -2.62976
Full model ln_yyx : 3860.56918 nats/sec, 128.40031 nats/event
Full model Log loss : -2.63484
Full model ln_yyx : 3870.63072 nats/sec, 128.73495 nats/event
Full model Log loss : -2.63526
Full model ln_yyx : 3811.71996 nats/sec, 126.77561 nats/event
Full model Log loss : -2.59946
Full model ln_yyx : 3873.39902 nats/sec, 128.82702 nats/event
Full model Log loss : -2.63558
Full model ln_yyx : 3882.73625 nats/sec, 129.13757 nats/event
Full model Log loss : -2.63726
Full model ln_yyx : 3878.53672 nats/sec, 128.99790 nats/event
Full model Log loss : -2.63979
Full model ln_yyx : 3857.64146 nats/sec, 128.30293 nats/event
Full model Log loss : -2.63811
Optimization finished. Config saved to results/opt-full/opt_full_126_best_config.txt
