[I 2026-03-18 16:34:25,467] Trial 44 pruned. 
[I 2026-03-18 16:34:26,449] Trial 32 pruned. 
[I 2026-03-18 16:34:28,639] Trial 38 pruned. 
[I 2026-03-18 16:34:29,057] Trial 31 pruned. 
[I 2026-03-18 16:34:29,831] Trial 36 pruned. 
[I 2026-03-18 16:34:29,874] Trial 33 pruned. 
[I 2026-03-18 16:34:31,663] Trial 4 finished with value: -2.7871850717862188 and parameters: {'n_layers_yyx': 1, 'hidden_size_yyx_l0': 3, 'context_size_yyx': 1, 'num_mix_components_yyx': 1, 'context_extractor_yyx': 'gru', 'activation_func_yyx': 'GELU', 'L2_weight_yyx': 1.8607351485620405e-08, 'L_entropy_weight_yyx': 1.1019233444218889e-05, 'L_sep_weight_yyx': 0.0005604500787286932, 'L_scale_weight_yyx': 1.7402535621568365e-08, 'learning_rate_yyx': 0.0012267611395906032}. Best is trial 2 with value: -2.799719036396502.
[I 2026-03-18 16:34:31,924] Trial 10 finished with value: -2.801940448544377 and parameters: {'n_layers_yyx': 2, 'hidden_size_yyx_l0': 6, 'hidden_size_yyx_l1': 2, 'context_size_yyx': 4, 'num_mix_components_yyx': 1, 'context_extractor_yyx': 'gru', 'activation_func_yyx': 'GELU', 'L2_weight_yyx': 0.0009401191955204068, 'L_entropy_weight_yyx': 4.180945948479245e-08, 'L_sep_weight_yyx': 4.241022692045601e-08, 'L_scale_weight_yyx': 2.9682744202618857e-08, 'learning_rate_yyx': 0.009666353046448889}. Best is trial 0 with value: -2.8067502106217272.
[I 2026-03-18 16:34:32,071] Trial 18 pruned. 
[I 2026-03-18 16:34:32,453] Trial 39 pruned. 
[I 2026-03-18 16:34:32,473] Trial 34 pruned. 
[I 2026-03-18 16:34:33,931] Trial 40 pruned. 
[I 2026-03-18 16:34:35,365] Trial 33 pruned. 
[I 2026-03-18 16:34:35,559] Trial 32 pruned. 
[I 2026-03-18 16:34:35,799] Trial 31 pruned. 
[I 2026-03-18 16:34:35,947] Trial 40 pruned. 
[I 2026-03-18 16:34:36,818] Trial 34 pruned. 
[I 2026-03-18 16:34:39,664] Trial 35 pruned. 
[I 2026-03-18 16:34:39,697] Trial 32 pruned. 
[I 2026-03-18 16:34:39,705] Trial 41 pruned. 
[I 2026-03-18 16:34:40,499] Trial 11 pruned. 
[I 2026-03-18 16:34:40,740] Trial 30 finished with value: -0.42045871982633515 and parameters: {'n_layers_yyx': 1, 'hidden_size_yyx_l0': 6, 'context_size_yyx': 2, 'num_mix_components_yyx': 3, 'context_extractor_yyx': 'lstm', 'activation_func_yyx': 'Tanh', 'L2_weight_yyx': 2.2293713702015887e-09, 'L_entropy_weight_yyx': 1.1585131607043962e-09, 'L_sep_weight_yyx': 4.5485010599876904e-07, 'L_scale_weight_yyx': 0.00027632568640374657, 'learning_rate_yyx': 0.007689357492265808}. Best is trial 2 with value: -0.4289537553816757.
[I 2026-03-18 16:34:41,457] Trial 41 pruned. 
[I 2026-03-18 16:34:41,747] Trial 35 finished with value: -0.38840000400602265 and parameters: {'n_layers_yyx': 2, 'hidden_size_yyx_l0': 4, 'hidden_size_yyx_l1': 3, 'context_size_yyx': 3, 'num_mix_components_yyx': 4, 'context_extractor_yyx': 'gru', 'activation_func_yyx': 'Tanh', 'L2_weight_yyx': 5.4962378474436105e-08, 'L_entropy_weight_yyx': 1.2161071215106781e-09, 'L_sep_weight_yyx': 1.812258368274639e-07, 'L_scale_weight_yyx': 1.570414275328189e-08, 'learning_rate_yyx': 0.006690000674126697}. Best is trial 28 with value: -0.4286294943038893.
[I 2026-03-18 16:34:41,752] Trial 26 pruned. 
[I 2026-03-18 16:34:42,283] Trial 34 pruned. 
[I 2026-03-18 16:34:44,716] Trial 37 pruned. 
[I 2026-03-18 16:34:45,588] Trial 36 pruned. 
[I 2026-03-18 16:34:45,726] Trial 35 pruned. 
[I 2026-03-18 16:34:48,202] Trial 38 pruned. 
[I 2026-03-18 16:34:49,427] Trial 12 pruned. 
[I 2026-03-18 16:34:50,154] Trial 20 finished with value: -0.4276414995223007 and parameters: {'n_layers_yyx': 2, 'hidden_size_yyx_l0': 5, 'hidden_size_yyx_l1': 4, 'context_size_yyx': 1, 'num_mix_components_yyx': 4, 'context_extractor_yyx': 'lstm', 'activation_func_yyx': 'GELU', 'L2_weight_yyx': 0.0009699593961500789, 'L_entropy_weight_yyx': 7.92261058562627e-07, 'L_sep_weight_yyx': 2.2843433242008734e-05, 'L_scale_weight_yyx': 5.514187438248469e-07, 'learning_rate_yyx': 0.009959159878537193}. Best is trial 1 with value: -0.45911608244243424.
[I 2026-03-18 16:34:51,506] Trial 39 pruned. 
[I 2026-03-18 16:34:51,996] Trial 36 pruned. 
[I 2026-03-18 16:34:52,112] Trial 37 pruned. 
[I 2026-03-18 16:34:54,345] Trial 2 finished with value: -2.7992022282419184 and parameters: {'n_layers_yyx': 2, 'hidden_size_yyx_l0': 3, 'hidden_size_yyx_l1': 3, 'context_size_yyx': 2, 'num_mix_components_yyx': 2, 'context_extractor_yyx': 'lstm', 'activation_func_yyx': 'ReLU', 'L2_weight_yyx': 2.539666128135038e-09, 'L_entropy_weight_yyx': 1.4315095110187679e-09, 'L_sep_weight_yyx': 1.8299992580849054e-08, 'L_scale_weight_yyx': 2.2300524966544706e-07, 'learning_rate_yyx': 0.0020013129952307614}. Best is trial 1 with value: -2.8024164192943366.
[I 2026-03-18 16:34:55,934] Trial 36 pruned. 
[I 2026-03-18 16:34:56,337] Trial 33 pruned. 
[I 2026-03-18 16:34:57,152] Trial 31 finished with value: -0.42454080020680146 and parameters: {'n_layers_yyx': 1, 'hidden_size_yyx_l0': 3, 'context_size_yyx': 3, 'num_mix_components_yyx': 2, 'context_extractor_yyx': 'lstm', 'activation_func_yyx': 'ReLU', 'L2_weight_yyx': 1.1028928718211793e-08, 'L_entropy_weight_yyx': 1.1013926404298897e-10, 'L_sep_weight_yyx': 0.00020453046672804057, 'L_scale_weight_yyx': 8.343025939725533e-10, 'learning_rate_yyx': 0.005334647747325542}. Best is trial 9 with value: -0.4271615326589106.
[I 2026-03-18 16:34:57,875] Trial 13 pruned. 
[I 2026-03-18 16:34:57,991] Trial 27 pruned. 
[I 2026-03-18 16:34:58,891] Trial 38 pruned. 
[I 2026-03-18 16:35:00,476] Trial 32 pruned. 
[I 2026-03-18 16:35:02,692] Trial 3 pruned. 
[I 2026-03-18 16:35:03,094] Trial 34 pruned. 
[I 2026-03-18 16:35:05,030] Trial 33 finished with value: -0.44058718843725814 and parameters: {'n_layers_yyx': 2, 'hidden_size_yyx_l0': 5, 'hidden_size_yyx_l1': 5, 'context_size_yyx': 3, 'num_mix_components_yyx': 5, 'context_extractor_yyx': 'lstm', 'activation_func_yyx': 'Tanh', 'L2_weight_yyx': 1.4026127134982715e-05, 'L_entropy_weight_yyx': 1.0728735692927971e-10, 'L_sep_weight_yyx': 5.980695130181356e-07, 'L_scale_weight_yyx': 2.2762004661730627e-05, 'learning_rate_yyx': 0.00414987239822084}. Best is trial 7 with value: -0.44963234349300985.
[I 2026-03-18 16:35:06,864] Trial 21 pruned. 
[I 2026-03-18 16:35:06,891] Trial 42 finished with value: -0.43303375716548953 and parameters: {'n_layers_yyx': 2, 'hidden_size_yyx_l0': 2, 'hidden_size_yyx_l1': 4, 'context_size_yyx': 4, 'num_mix_components_yyx': 2, 'context_extractor_yyx': 'gru', 'activation_func_yyx': 'Tanh', 'L2_weight_yyx': 3.8552715364828245e-10, 'L_entropy_weight_yyx': 9.879417500857718e-07, 'L_sep_weight_yyx': 1.6567001463532452e-09, 'L_scale_weight_yyx': 8.427541151699626e-07, 'learning_rate_yyx': 0.008322111237606525}. Best is trial 35 with value: -0.4510425295992163.
[I 2026-03-18 16:35:06,968] Trial 33 pruned. 
[I 2026-03-18 16:35:09,522] Trial 2 finished with value: -2.6536894017943036 and parameters: {'n_layers_yyx': 2, 'hidden_size_yyx_l0': 6, 'hidden_size_yyx_l1': 3, 'context_size_yyx': 2, 'num_mix_components_yyx': 1, 'context_extractor_yyx': 'gru', 'activation_func_yyx': 'Tanh', 'L2_weight_yyx': 4.070552569961928e-06, 'L_entropy_weight_yyx': 2.2982416147276927e-10, 'L_sep_weight_yyx': 0.0004811289977534373, 'L_scale_weight_yyx': 2.682397237116884e-05, 'learning_rate_yyx': 0.0018975803558887955}. Best is trial 0 with value: -2.792252838699443.
[I 2026-03-18 16:35:09,785] Trial 45 pruned. 
[I 2026-03-18 16:35:10,393] Trial 34 pruned. 
[I 2026-03-18 16:35:11,913] Trial 35 finished with value: -0.43290918308883997 and parameters: {'n_layers_yyx': 1, 'hidden_size_yyx_l0': 5, 'context_size_yyx': 3, 'num_mix_components_yyx': 2, 'context_extractor_yyx': 'lstm', 'activation_func_yyx': 'Tanh', 'L2_weight_yyx': 0.0001434189014044708, 'L_entropy_weight_yyx': 1.0608209833968359e-07, 'L_sep_weight_yyx': 3.6380579965065607e-07, 'L_scale_weight_yyx': 2.668526217932526e-10, 'learning_rate_yyx': 0.007168221465630721}. Best is trial 25 with value: -0.44456373279677824.
[I 2026-03-18 16:35:12,553] Trial 37 pruned. 
[I 2026-03-18 16:35:12,955] Trial 46 pruned. 
[I 2026-03-18 16:35:14,550] Trial 31 finished with value: -0.41957928447900544 and parameters: {'n_layers_yyx': 1, 'hidden_size_yyx_l0': 6, 'context_size_yyx': 2, 'num_mix_components_yyx': 3, 'context_extractor_yyx': 'lstm', 'activation_func_yyx': 'Tanh', 'L2_weight_yyx': 1.3057884171724395e-09, 'L_entropy_weight_yyx': 1.0686150883126912e-09, 'L_sep_weight_yyx': 5.899886554390841e-07, 'L_scale_weight_yyx': 0.00035120698875333166, 'learning_rate_yyx': 0.007917888653855973}. Best is trial 2 with value: -0.4289537553816757.
[I 2026-03-18 16:35:16,419] Trial 38 pruned. 
[I 2026-03-18 16:35:16,535] Trial 47 pruned. 
[I 2026-03-18 16:35:16,768] Trial 42 finished with value: -0.39439226746928213 and parameters: {'n_layers_yyx': 2, 'hidden_size_yyx_l0': 3, 'hidden_size_yyx_l1': 6, 'context_size_yyx': 4, 'num_mix_components_yyx': 2, 'context_extractor_yyx': 'gru', 'activation_func_yyx': 'Tanh', 'L2_weight_yyx': 1.5448745016821005e-08, 'L_entropy_weight_yyx': 2.761730976449895e-06, 'L_sep_weight_yyx': 1.2566420118456227e-09, 'L_scale_weight_yyx': 2.408746734810573e-05, 'learning_rate_yyx': 0.003313550728850566}. Best is trial 1 with value: -0.44267641427716237.
[I 2026-03-18 16:35:17,937] Trial 35 pruned. 
[I 2026-03-18 16:35:18,864] Trial 19 pruned. 
[I 2026-03-18 16:35:19,049] Trial 36 pruned. 
[I 2026-03-18 16:35:19,272] Trial 35 pruned. 
[I 2026-03-18 16:35:19,566] Trial 39 pruned. 
[I 2026-03-18 16:35:20,017] Trial 37 finished with value: -0.3485604867846604 and parameters: {'n_layers_yyx': 2, 'hidden_size_yyx_l0': 2, 'hidden_size_yyx_l1': 5, 'context_size_yyx': 2, 'num_mix_components_yyx': 3, 'context_extractor_yyx': 'gru', 'activation_func_yyx': 'Tanh', 'L2_weight_yyx': 1.191979864788895e-09, 'L_entropy_weight_yyx': 4.418780645074346e-07, 'L_sep_weight_yyx': 1.15784085481065e-10, 'L_scale_weight_yyx': 0.00021823717015517335, 'learning_rate_yyx': 0.006128307139111346}. Best is trial 1 with value: -0.43281404005115615.
[I 2026-03-18 16:35:21,696] Trial 4 pruned. 
[I 2026-03-18 16:35:22,449] Trial 37 pruned. 
[I 2026-03-18 16:35:22,658] Trial 40 pruned. 
[I 2026-03-18 16:35:23,191] Trial 48 pruned. 
[I 2026-03-18 16:35:23,391] Trial 22 pruned. 
[I 2026-03-18 16:35:25,752] Trial 5 finished with value: -2.7926982429925804 and parameters: {'n_layers_yyx': 1, 'hidden_size_yyx_l0': 5, 'context_size_yyx': 3, 'num_mix_components_yyx': 1, 'context_extractor_yyx': 'lstm', 'activation_func_yyx': 'Tanh', 'L2_weight_yyx': 7.472299657997252e-06, 'L_entropy_weight_yyx': 1.38993346706161e-09, 'L_sep_weight_yyx': 9.763271151116501e-09, 'L_scale_weight_yyx': 2.6755424844706325e-10, 'learning_rate_yyx': 0.007438909056529706}. Best is trial 5 with value: -2.7926982429925804.
[I 2026-03-18 16:35:25,911] Trial 39 finished with value: -0.43937692553635355 and parameters: {'n_layers_yyx': 2, 'hidden_size_yyx_l0': 4, 'hidden_size_yyx_l1': 3, 'context_size_yyx': 4, 'num_mix_components_yyx': 4, 'context_extractor_yyx': 'gru', 'activation_func_yyx': 'Tanh', 'L2_weight_yyx': 1.009701104235812e-10, 'L_entropy_weight_yyx': 2.7600501978094966e-10, 'L_sep_weight_yyx': 2.4180653716725904e-06, 'L_scale_weight_yyx': 4.906305982396795e-10, 'learning_rate_yyx': 0.009931933757909541}. Best is trial 39 with value: -0.43937692553635355.
[I 2026-03-18 16:35:26,002] Trial 36 pruned. 
[I 2026-03-18 16:35:26,506] Trial 49 pruned. 

Source events: 1783
Target events: 3403
Full model ln_yyx : 10.87118 nats/sec, 2.87513 nats/event
Full model Log loss : -0.41403
Full model ln_yyx : 11.22000 nats/sec, 2.96738 nats/event
Full model Log loss : -0.35784
Full model ln_yyx : 11.38823 nats/sec, 3.01188 nats/event
Full model Log loss : -0.43762
Full model ln_yyx : 11.29552 nats/sec, 2.98736 nats/event
Full model Log loss : -0.42445
Full model ln_yyx : 11.41710 nats/sec, 3.01951 nats/event
Full model Log loss : -0.42998
Full model ln_yyx : 11.35527 nats/sec, 3.00316 nats/event
Full model Log loss : -0.37495
Full model ln_yyx : 11.52614 nats/sec, 3.04835 nats/event
Full model Log loss : -0.40995
Full model ln_yyx : 11.50434 nats/sec, 3.04258 nats/event
Full model Log loss : -0.37555
Optimization finished. Config saved to results/opt-full/opt_full_20_best_config.txt
[I 2026-03-18 16:35:27,937] Trial 40 finished with value: -0.4348042963459027 and parameters: {'n_layers_yyx': 2, 'hidden_size_yyx_l0': 5, 'hidden_size_yyx_l1': 4, 'context_size_yyx': 3, 'num_mix_components_yyx': 2, 'context_extractor_yyx': 'gru', 'activation_func_yyx': 'GELU', 'L2_weight_yyx': 6.979055311649675e-09, 'L_entropy_weight_yyx': 1.6636717807297577e-05, 'L_sep_weight_yyx': 6.36492120696773e-07, 'L_scale_weight_yyx': 1.3785537144467096e-06, 'learning_rate_yyx': 0.009404771033859786}. Best is trial 40 with value: -0.4348042963459027.
[I 2026-03-18 16:35:28,059] Trial 28 finished with value: -0.4072473484665248 and parameters: {'n_layers_yyx': 1, 'hidden_size_yyx_l0': 4, 'context_size_yyx': 3, 'num_mix_components_yyx': 4, 'context_extractor_yyx': 'lstm', 'activation_func_yyx': 'ReLU', 'L2_weight_yyx': 2.1065511710269833e-07, 'L_entropy_weight_yyx': 1.088643460688968e-10, 'L_sep_weight_yyx': 5.5758364278122506e-08, 'L_scale_weight_yyx': 0.0009600868811529811, 'learning_rate_yyx': 0.005862903608255952}. Best is trial 5 with value: -0.44982475540586303.
[I 2026-03-18 16:35:29,190] Trial 2 finished with value: -2.792062201645854 and parameters: {'n_layers_yyx': 2, 'hidden_size_yyx_l0': 5, 'hidden_size_yyx_l1': 2, 'context_size_yyx': 2, 'num_mix_components_yyx': 5, 'context_extractor_yyx': 'gru', 'activation_func_yyx': 'Tanh', 'L2_weight_yyx': 6.221211759722141e-07, 'L_entropy_weight_yyx': 0.0006669322040318735, 'L_sep_weight_yyx': 8.500651336753057e-10, 'L_scale_weight_yyx': 0.00010724352925476405, 'learning_rate_yyx': 0.008777633588598652}. Best is trial 1 with value: -2.8037735806844215.
[I 2026-03-18 16:35:29,473] Trial 37 pruned. 
[I 2026-03-18 16:35:29,980] Trial 3 finished with value: -2.7914248238200217 and parameters: {'n_layers_yyx': 1, 'hidden_size_yyx_l0': 6, 'context_size_yyx': 4, 'num_mix_components_yyx': 2, 'context_extractor_yyx': 'gru', 'activation_func_yyx': 'ReLU', 'L2_weight_yyx': 0.0006073627398889953, 'L_entropy_weight_yyx': 2.8555221232027617e-07, 'L_sep_weight_yyx': 0.0008050552507216723, 'L_scale_weight_yyx': 0.00019306095144640864, 'learning_rate_yyx': 0.0027961086286698343}. Best is trial 1 with value: -2.794794619613311.
[I 2026-03-18 16:35:30,428] Trial 23 pruned. 
[I 2026-03-18 16:35:31,150] Trial 41 pruned. 
[I 2026-03-18 16:35:31,187] Trial 29 pruned. 
[I 2026-03-18 16:35:32,632] Trial 38 pruned. 
[I 2026-03-18 16:35:33,117] Trial 2 finished with value: -2.658798120297144 and parameters: {'n_layers_yyx': 1, 'hidden_size_yyx_l0': 3, 'context_size_yyx': 1, 'num_mix_components_yyx': 1, 'context_extractor_yyx': 'lstm', 'activation_func_yyx': 'ReLU', 'L2_weight_yyx': 2.016037682779096e-07, 'L_entropy_weight_yyx': 4.566962398887983e-10, 'L_sep_weight_yyx': 9.453141421373382e-08, 'L_scale_weight_yyx': 2.0462026463605332e-08, 'learning_rate_yyx': 0.005154047737433053}. Best is trial 0 with value: -2.79162831599355.
[I 2026-03-18 16:35:33,126] Trial 34 finished with value: -0.4537457445457624 and parameters: {'n_layers_yyx': 1, 'hidden_size_yyx_l0': 5, 'context_size_yyx': 4, 'num_mix_components_yyx': 4, 'context_extractor_yyx': 'gru', 'activation_func_yyx': 'Tanh', 'L2_weight_yyx': 1.6210418740876533e-05, 'L_entropy_weight_yyx': 7.688545579014326e-08, 'L_sep_weight_yyx': 4.877250781441815e-06, 'L_scale_weight_yyx': 2.3126930962287222e-05, 'learning_rate_yyx': 0.004286366102176048}. Best is trial 34 with value: -0.4537457445457624.
[I 2026-03-18 16:35:33,299] Trial 36 pruned. 
[I 2026-03-18 16:35:33,892] Trial 6 pruned. 
[I 2026-03-18 16:35:34,177] Trial 8 finished with value: -2.8019612829963387 and parameters: {'n_layers_yyx': 2, 'hidden_size_yyx_l0': 2, 'hidden_size_yyx_l1': 6, 'context_size_yyx': 2, 'num_mix_components_yyx': 4, 'context_extractor_yyx': 'lstm', 'activation_func_yyx': 'Tanh', 'L2_weight_yyx': 6.417485696049738e-09, 'L_entropy_weight_yyx': 3.2269658673616955e-09, 'L_sep_weight_yyx': 1.7322771047776798e-10, 'L_scale_weight_yyx': 3.7168811898589545e-05, 'learning_rate_yyx': 0.0018580308520225594}. Best is trial 1 with value: -2.8044746609917057.
[I 2026-03-18 16:35:34,785] Trial 30 pruned. 
[I 2026-03-18 16:35:34,823] Trial 38 pruned. 
[I 2026-03-18 16:35:36,074] Trial 43 finished with value: -0.4258531033070095 and parameters: {'n_layers_yyx': 2, 'hidden_size_yyx_l0': 3, 'hidden_size_yyx_l1': 4, 'context_size_yyx': 4, 'num_mix_components_yyx': 2, 'context_extractor_yyx': 'gru', 'activation_func_yyx': 'Tanh', 'L2_weight_yyx': 4.545150634680917e-10, 'L_entropy_weight_yyx': 8.90213159276637e-07, 'L_sep_weight_yyx': 1.9179992718182144e-08, 'L_scale_weight_yyx': 9.258585186246402e-07, 'learning_rate_yyx': 0.009882265481795768}. Best is trial 35 with value: -0.4510425295992163.
[I 2026-03-18 16:35:36,712] Trial 24 pruned. 
[I 2026-03-18 16:35:37,014] Trial 38 pruned. 
[I 2026-03-18 16:35:37,575] Trial 3 pruned. 
[I 2026-03-18 16:35:38,769] Trial 2 finished with value: -2.7722441744413393 and parameters: {'n_layers_yyx': 2, 'hidden_size_yyx_l0': 6, 'hidden_size_yyx_l1': 5, 'context_size_yyx': 2, 'num_mix_components_yyx': 2, 'context_extractor_yyx': 'lstm', 'activation_func_yyx': 'Tanh', 'L2_weight_yyx': 0.00022787290879398717, 'L_entropy_weight_yyx': 1.33376957089994e-09, 'L_sep_weight_yyx': 0.00019319332443052358, 'L_scale_weight_yyx': 2.8906801648697233e-05, 'learning_rate_yyx': 0.0014184660864765438}. Best is trial 2 with value: -2.7722441744413393.
[I 2026-03-18 16:35:39,169] Trial 2 finished with value: -2.661197700576935 and parameters: {'n_layers_yyx': 2, 'hidden_size_yyx_l0': 3, 'hidden_size_yyx_l1': 5, 'context_size_yyx': 4, 'num_mix_components_yyx': 1, 'context_extractor_yyx': 'lstm', 'activation_func_yyx': 'GELU', 'L2_weight_yyx': 8.358841013723818e-09, 'L_entropy_weight_yyx': 0.00012427876945849065, 'L_sep_weight_yyx': 1.1713180611924697e-09, 'L_scale_weight_yyx': 2.4105475214982285e-08, 'learning_rate_yyx': 0.007681064855754556}. Best is trial 0 with value: -2.782248579189629.
[I 2026-03-18 16:35:39,840] Trial 20 finished with value: -0.40663855585151415 and parameters: {'n_layers_yyx': 2, 'hidden_size_yyx_l0': 5, 'hidden_size_yyx_l1': 5, 'context_size_yyx': 2, 'num_mix_components_yyx': 1, 'context_extractor_yyx': 'gru', 'activation_func_yyx': 'Tanh', 'L2_weight_yyx': 2.928468113990906e-09, 'L_entropy_weight_yyx': 2.797722934568177e-09, 'L_sep_weight_yyx': 9.382325815836697e-08, 'L_scale_weight_yyx': 1.1548953268249207e-09, 'learning_rate_yyx': 0.004520759316448147}. Best is trial 9 with value: -0.430995315221072.
[I 2026-03-18 16:35:41,286] Trial 39 pruned. 
[I 2026-03-18 16:35:42,411] Trial 44 pruned. 
[I 2026-03-18 16:35:42,784] Trial 39 pruned. 
[I 2026-03-18 16:35:43,096] Trial 9 pruned. 
[I 2026-03-18 16:35:43,205] Trial 25 pruned. 
[I 2026-03-18 16:35:44,634] Trial 40 pruned. 
[I 2026-03-18 16:35:46,145] Trial 4 pruned. 
[I 2026-03-18 16:35:46,343] Trial 3 pruned. 
[I 2026-03-18 16:35:46,344] Trial 26 pruned. 
[I 2026-03-18 16:35:46,583] Trial 32 finished with value: -0.42019360427147834 and parameters: {'n_layers_yyx': 1, 'hidden_size_yyx_l0': 6, 'context_size_yyx': 2, 'num_mix_components_yyx': 3, 'context_extractor_yyx': 'lstm', 'activation_func_yyx': 'Tanh', 'L2_weight_yyx': 1.3443840093357007e-09, 'L_entropy_weight_yyx': 1.1934988372068798e-09, 'L_sep_weight_yyx': 4.80749940565497e-07, 'L_scale_weight_yyx': 0.00031531431255665175, 'learning_rate_yyx': 0.007758240210445849}. Best is trial 2 with value: -0.4289537553816757.
[I 2026-03-18 16:35:47,055] Trial 3 pruned. 
[I 2026-03-18 16:35:47,321] Trial 39 pruned. 
[I 2026-03-18 16:35:48,046] Trial 14 pruned. 
[I 2026-03-18 16:35:48,054] Trial 41 pruned. 
[I 2026-03-18 16:35:48,848] Trial 40 pruned. 
[I 2026-03-18 16:35:49,093] Trial 27 pruned. 
[I 2026-03-18 16:35:49,522] Trial 43 finished with value: -0.4228591210332817 and parameters: {'n_layers_yyx': 2, 'hidden_size_yyx_l0': 3, 'hidden_size_yyx_l1': 6, 'context_size_yyx': 4, 'num_mix_components_yyx': 1, 'context_extractor_yyx': 'gru', 'activation_func_yyx': 'Tanh', 'L2_weight_yyx': 2.2465018788375226e-08, 'L_entropy_weight_yyx': 1.7635686703253428e-06, 'L_sep_weight_yyx': 1.1963251865537576e-09, 'L_scale_weight_yyx': 0.00044673461440362976, 'learning_rate_yyx': 0.0034583735183817575}. Best is trial 1 with value: -0.44267641427716237.
[I 2026-03-18 16:35:51,249] Trial 42 pruned. 
[I 2026-03-18 16:35:51,269] Trial 42 finished with value: -0.41265590419710235 and parameters: {'n_layers_yyx': 2, 'hidden_size_yyx_l0': 6, 'hidden_size_yyx_l1': 4, 'context_size_yyx': 3, 'num_mix_components_yyx': 2, 'context_extractor_yyx': 'gru', 'activation_func_yyx': 'GELU', 'L2_weight_yyx': 4.1571721771642415e-09, 'L_entropy_weight_yyx': 1.6713757631596885e-05, 'L_sep_weight_yyx': 0.00022039796705958944, 'L_scale_weight_yyx': 6.933233441230178e-07, 'learning_rate_yyx': 0.009803251048190614}. Best is trial 40 with value: -0.4348042963459027.
[I 2026-03-18 16:35:51,330] Trial 40 finished with value: -0.41700461183908183 and parameters: {'n_layers_yyx': 2, 'hidden_size_yyx_l0': 4, 'hidden_size_yyx_l1': 4, 'context_size_yyx': 4, 'num_mix_components_yyx': 4, 'context_extractor_yyx': 'gru', 'activation_func_yyx': 'Tanh', 'L2_weight_yyx': 1.331480295771483e-10, 'L_entropy_weight_yyx': 1.3085259674271195e-09, 'L_sep_weight_yyx': 2.5873629241339275e-06, 'L_scale_weight_yyx': 9.97614485936604e-09, 'learning_rate_yyx': 0.0068144531121155}. Best is trial 39 with value: -0.43937692553635355.
