Warning: Failed writing log files to directory [/var/log/nvidia-mps]. No logs will be available.
[I 2026-03-18 17:17:39,300] A new study created in RDB with name: opt_full-model_seed=42_task=118
[I 2026-03-18 17:17:39,300] A new study created in RDB with name: opt_full-model_seed=42_task=109
[I 2026-03-18 17:17:40,063] A new study created in RDB with name: opt_full-model_seed=42_task=101
[I 2026-03-18 17:17:40,292] A new study created in RDB with name: opt_full-model_seed=42_task=107
[I 2026-03-18 17:17:40,473] A new study created in RDB with name: opt_full-model_seed=42_task=121
[I 2026-03-18 17:17:40,479] A new study created in RDB with name: opt_full-model_seed=42_task=98
[I 2026-03-18 17:17:40,736] A new study created in RDB with name: opt_full-model_seed=42_task=105
[I 2026-03-18 17:17:41,085] A new study created in RDB with name: opt_full-model_seed=42_task=102
[I 2026-03-18 17:17:41,085] A new study created in RDB with name: opt_full-model_seed=42_task=108
[I 2026-03-18 17:17:42,047] A new study created in RDB with name: opt_full-model_seed=42_task=113
[I 2026-03-18 17:17:42,057] A new study created in RDB with name: opt_full-model_seed=42_task=123
[I 2026-03-18 17:17:42,079] A new study created in RDB with name: opt_full-model_seed=42_task=112
[I 2026-03-18 17:17:42,080] A new study created in RDB with name: opt_full-model_seed=42_task=125
[I 2026-03-18 17:17:42,119] A new study created in RDB with name: opt_full-model_seed=42_task=126
[I 2026-03-18 17:17:42,123] A new study created in RDB with name: opt_full-model_seed=42_task=119
[I 2026-03-18 17:17:42,244] A new study created in RDB with name: opt_full-model_seed=42_task=114
[I 2026-03-18 17:17:42,504] A new study created in RDB with name: opt_full-model_seed=42_task=120
[I 2026-03-18 17:17:42,505] A new study created in RDB with name: opt_full-model_seed=42_task=97
[I 2026-03-18 17:17:42,505] A new study created in RDB with name: opt_full-model_seed=42_task=96
[I 2026-03-18 17:17:42,758] A new study created in RDB with name: opt_full-model_seed=42_task=115
[I 2026-03-18 17:17:42,759] A new study created in RDB with name: opt_full-model_seed=42_task=100
[I 2026-03-18 17:17:42,870] A new study created in RDB with name: opt_full-model_seed=42_task=103
[I 2026-03-18 17:17:43,632] A new study created in RDB with name: opt_full-model_seed=42_task=111
[I 2026-03-18 17:17:43,644] A new study created in RDB with name: opt_full-model_seed=42_task=127
[I 2026-03-18 17:17:43,644] A new study created in RDB with name: opt_full-model_seed=42_task=104
[I 2026-03-18 17:17:43,743] A new study created in RDB with name: opt_full-model_seed=42_task=117
[I 2026-03-18 17:17:43,764] A new study created in RDB with name: opt_full-model_seed=42_task=116
[I 2026-03-18 17:17:44,277] A new study created in RDB with name: opt_full-model_seed=42_task=122
[I 2026-03-18 17:17:44,277] A new study created in RDB with name: opt_full-model_seed=42_task=110
[I 2026-03-18 17:17:44,278] A new study created in RDB with name: opt_full-model_seed=42_task=99
[I 2026-03-18 17:17:44,278] A new study created in RDB with name: opt_full-model_seed=42_task=106
[I 2026-03-18 17:17:44,488] A new study created in RDB with name: opt_full-model_seed=42_task=124
[I 2026-03-18 17:21:54,188] Trial 0 finished with value: -1.2678299096914438 and parameters: {'n_layers_yyx': 1, 'hidden_size_yyx_l0': 5, 'context_size_yyx': 4, 'num_mix_components_yyx': 3, 'context_extractor_yyx': 'gru', 'activation_func_yyx': 'ReLU', 'L2_weight_yyx': 4.063408896544304e-08, 'L_entropy_weight_yyx': 2.7807962005115746e-08, 'L_sep_weight_yyx': 0.0005154671697439628, 'L_scale_weight_yyx': 1.5027019575616756e-08, 'learning_rate_yyx': 0.00831166276359205}. Best is trial 0 with value: -1.2678299096914438.
[I 2026-03-18 17:22:55,598] Trial 0 finished with value: -1.147240488894986 and parameters: {'n_layers_yyx': 1, 'hidden_size_yyx_l0': 4, 'context_size_yyx': 1, 'num_mix_components_yyx': 3, 'context_extractor_yyx': 'gru', 'activation_func_yyx': 'ReLU', 'L2_weight_yyx': 2.186517883666955e-09, 'L_entropy_weight_yyx': 3.5539597682617615e-06, 'L_sep_weight_yyx': 5.0733072828849065e-06, 'L_scale_weight_yyx': 1.1279548811181661e-06, 'learning_rate_yyx': 0.007350208028503507}. Best is trial 0 with value: -1.147240488894986.
[I 2026-03-18 17:23:34,075] Trial 0 finished with value: -2.612719272929431 and parameters: {'n_layers_yyx': 2, 'hidden_size_yyx_l0': 3, 'hidden_size_yyx_l1': 3, 'context_size_yyx': 1, 'num_mix_components_yyx': 2, 'context_extractor_yyx': 'lstm', 'activation_func_yyx': 'GELU', 'L2_weight_yyx': 1.2322174110259893e-07, 'L_entropy_weight_yyx': 9.211324509434872e-10, 'L_sep_weight_yyx': 1.0247744298842432e-09, 'L_scale_weight_yyx': 1.04389277621134e-06, 'learning_rate_yyx': 0.0061870250090958635}. Best is trial 0 with value: -2.612719272929431.
[I 2026-03-18 17:24:17,860] Trial 0 finished with value: -2.629910309959649 and parameters: {'n_layers_yyx': 2, 'hidden_size_yyx_l0': 4, 'hidden_size_yyx_l1': 2, 'context_size_yyx': 2, 'num_mix_components_yyx': 3, 'context_extractor_yyx': 'gru', 'activation_func_yyx': 'Tanh', 'L2_weight_yyx': 3.8160830105522956e-05, 'L_entropy_weight_yyx': 5.918918899849241e-08, 'L_sep_weight_yyx': 6.215717285599827e-07, 'L_scale_weight_yyx': 2.161032559714238e-08, 'learning_rate_yyx': 0.008898412174583483}. Best is trial 0 with value: -2.629910309959649.
[I 2026-03-18 17:24:21,990] Trial 1 pruned. 
[I 2026-03-18 17:25:03,230] Trial 0 finished with value: -2.5999649344789706 and parameters: {'n_layers_yyx': 1, 'hidden_size_yyx_l0': 6, 'context_size_yyx': 1, 'num_mix_components_yyx': 2, 'context_extractor_yyx': 'lstm', 'activation_func_yyx': 'ReLU', 'L2_weight_yyx': 0.0006831172036125296, 'L_entropy_weight_yyx': 5.325565943109203e-10, 'L_sep_weight_yyx': 1.9829654337912937e-06, 'L_scale_weight_yyx': 0.000682482012139302, 'learning_rate_yyx': 0.0013233700094899131}. Best is trial 0 with value: -2.5999649344789706.
[I 2026-03-18 17:25:36,024] Trial 0 finished with value: -2.633521153514828 and parameters: {'n_layers_yyx': 1, 'hidden_size_yyx_l0': 4, 'context_size_yyx': 2, 'num_mix_components_yyx': 4, 'context_extractor_yyx': 'gru', 'activation_func_yyx': 'Tanh', 'L2_weight_yyx': 0.00026574815258744046, 'L_entropy_weight_yyx': 0.0008995162655067895, 'L_sep_weight_yyx': 9.017266710992384e-07, 'L_scale_weight_yyx': 1.1031843901078265e-10, 'learning_rate_yyx': 0.005350932071080775}. Best is trial 0 with value: -2.633521153514828.
[I 2026-03-18 17:25:41,547] Trial 0 finished with value: -1.257956034154416 and parameters: {'n_layers_yyx': 1, 'hidden_size_yyx_l0': 6, 'context_size_yyx': 3, 'num_mix_components_yyx': 3, 'context_extractor_yyx': 'lstm', 'activation_func_yyx': 'GELU', 'L2_weight_yyx': 9.271468180362944e-05, 'L_entropy_weight_yyx': 0.0005978645275153488, 'L_sep_weight_yyx': 2.829363684352029e-05, 'L_scale_weight_yyx': 1.8345126494436026e-10, 'learning_rate_yyx': 0.0028588206254831095}. Best is trial 0 with value: -1.257956034154416.
[I 2026-03-18 17:25:43,116] Trial 0 finished with value: -2.600449350976869 and parameters: {'n_layers_yyx': 1, 'hidden_size_yyx_l0': 6, 'context_size_yyx': 2, 'num_mix_components_yyx': 4, 'context_extractor_yyx': 'gru', 'activation_func_yyx': 'GELU', 'L2_weight_yyx': 1.4259799067085595e-07, 'L_entropy_weight_yyx': 1.726974334985594e-09, 'L_sep_weight_yyx': 9.557221976124145e-07, 'L_scale_weight_yyx': 1.905704342274383e-09, 'learning_rate_yyx': 0.003822298227701411}. Best is trial 0 with value: -2.600449350976869.
[I 2026-03-18 17:25:50,109] Trial 0 finished with value: -1.1551165342771632 and parameters: {'n_layers_yyx': 1, 'hidden_size_yyx_l0': 3, 'context_size_yyx': 1, 'num_mix_components_yyx': 1, 'context_extractor_yyx': 'gru', 'activation_func_yyx': 'Tanh', 'L2_weight_yyx': 5.901761639934031e-10, 'L_entropy_weight_yyx': 1.165682140451981e-06, 'L_sep_weight_yyx': 6.044338168156357e-06, 'L_scale_weight_yyx': 1.4439585679745942e-06, 'learning_rate_yyx': 0.003167682419356828}. Best is trial 0 with value: -1.1551165342771632.
[I 2026-03-18 17:25:52,738] Trial 0 finished with value: -2.6273212037742026 and parameters: {'n_layers_yyx': 2, 'hidden_size_yyx_l0': 6, 'hidden_size_yyx_l1': 5, 'context_size_yyx': 2, 'num_mix_components_yyx': 5, 'context_extractor_yyx': 'gru', 'activation_func_yyx': 'ReLU', 'L2_weight_yyx': 4.388325524883274e-07, 'L_entropy_weight_yyx': 1.4671786587467512e-06, 'L_sep_weight_yyx': 7.001112662564049e-07, 'L_scale_weight_yyx': 4.664610679028381e-06, 'learning_rate_yyx': 0.0038371414700636374}. Best is trial 0 with value: -2.6273212037742026.
[I 2026-03-18 17:26:00,208] Trial 0 finished with value: -1.6641703377100456 and parameters: {'n_layers_yyx': 1, 'hidden_size_yyx_l0': 3, 'context_size_yyx': 4, 'num_mix_components_yyx': 2, 'context_extractor_yyx': 'gru', 'activation_func_yyx': 'Tanh', 'L2_weight_yyx': 7.641552311146655e-10, 'L_entropy_weight_yyx': 1.879728326930139e-06, 'L_sep_weight_yyx': 1.422328036237055e-08, 'L_scale_weight_yyx': 0.0007726822328066029, 'learning_rate_yyx': 0.00882441047081606}. Best is trial 0 with value: -1.6641703377100456.
[I 2026-03-18 17:26:27,755] Trial 0 finished with value: -2.6330643191486622 and parameters: {'n_layers_yyx': 1, 'hidden_size_yyx_l0': 4, 'context_size_yyx': 1, 'num_mix_components_yyx': 5, 'context_extractor_yyx': 'lstm', 'activation_func_yyx': 'Tanh', 'L2_weight_yyx': 4.642398687509384e-10, 'L_entropy_weight_yyx': 4.781059865391552e-06, 'L_sep_weight_yyx': 8.204163166286604e-10, 'L_scale_weight_yyx': 3.602797376632347e-07, 'learning_rate_yyx': 0.0040733723063843905}. Best is trial 0 with value: -2.6330643191486622.
[I 2026-03-18 17:26:53,411] Trial 0 finished with value: -1.6699023361499776 and parameters: {'n_layers_yyx': 1, 'hidden_size_yyx_l0': 5, 'context_size_yyx': 2, 'num_mix_components_yyx': 3, 'context_extractor_yyx': 'lstm', 'activation_func_yyx': 'GELU', 'L2_weight_yyx': 3.877023324706021e-05, 'L_entropy_weight_yyx': 8.931786642323061e-07, 'L_sep_weight_yyx': 1.841029924936087e-08, 'L_scale_weight_yyx': 9.133211999120907e-05, 'learning_rate_yyx': 0.008268405391132955}. Best is trial 0 with value: -1.6699023361499776.
[I 2026-03-18 17:26:57,640] Trial 0 finished with value: -1.2372134802742498 and parameters: {'n_layers_yyx': 1, 'hidden_size_yyx_l0': 3, 'context_size_yyx': 3, 'num_mix_components_yyx': 2, 'context_extractor_yyx': 'gru', 'activation_func_yyx': 'ReLU', 'L2_weight_yyx': 8.467791928221309e-06, 'L_entropy_weight_yyx': 4.211327332733036e-08, 'L_sep_weight_yyx': 3.459519224520683e-05, 'L_scale_weight_yyx': 1.2752230127948498e-05, 'learning_rate_yyx': 0.0021040825107299234}. Best is trial 0 with value: -1.2372134802742498.
[I 2026-03-18 17:27:23,495] Trial 0 finished with value: -2.600604043989611 and parameters: {'n_layers_yyx': 2, 'hidden_size_yyx_l0': 3, 'hidden_size_yyx_l1': 6, 'context_size_yyx': 4, 'num_mix_components_yyx': 3, 'context_extractor_yyx': 'gru', 'activation_func_yyx': 'ReLU', 'L2_weight_yyx': 0.0009025192347687712, 'L_entropy_weight_yyx': 0.00013322647230552766, 'L_sep_weight_yyx': 4.580658481765548e-06, 'L_scale_weight_yyx': 3.1684160462693857e-09, 'learning_rate_yyx': 0.0009451850734521947}. Best is trial 0 with value: -2.600604043989611.
[I 2026-03-18 17:27:28,214] Trial 0 finished with value: -1.6702967433543936 and parameters: {'n_layers_yyx': 1, 'hidden_size_yyx_l0': 3, 'context_size_yyx': 4, 'num_mix_components_yyx': 3, 'context_extractor_yyx': 'lstm', 'activation_func_yyx': 'Tanh', 'L2_weight_yyx': 4.0423363719757185e-08, 'L_entropy_weight_yyx': 5.6281778196893764e-08, 'L_sep_weight_yyx': 0.00012966632192062526, 'L_scale_weight_yyx': 8.26592567899365e-10, 'learning_rate_yyx': 0.003995353465452519}. Best is trial 0 with value: -1.6702967433543936.
[I 2026-03-18 17:27:33,769] Trial 0 finished with value: -1.6683178048964529 and parameters: {'n_layers_yyx': 2, 'hidden_size_yyx_l0': 2, 'hidden_size_yyx_l1': 6, 'context_size_yyx': 4, 'num_mix_components_yyx': 2, 'context_extractor_yyx': 'lstm', 'activation_func_yyx': 'Tanh', 'L2_weight_yyx': 1.5582714834475112e-06, 'L_entropy_weight_yyx': 1.1129539569272505e-07, 'L_sep_weight_yyx': 1.343078489243586e-08, 'L_scale_weight_yyx': 0.0006166145078058494, 'learning_rate_yyx': 0.002483171236995464}. Best is trial 0 with value: -1.6683178048964529.
[I 2026-03-18 17:27:35,878] Trial 1 pruned. 
[I 2026-03-18 17:27:38,216] Trial 0 finished with value: -1.2615266048974338 and parameters: {'n_layers_yyx': 2, 'hidden_size_yyx_l0': 5, 'hidden_size_yyx_l1': 5, 'context_size_yyx': 3, 'num_mix_components_yyx': 2, 'context_extractor_yyx': 'lstm', 'activation_func_yyx': 'Tanh', 'L2_weight_yyx': 2.991549511748481e-09, 'L_entropy_weight_yyx': 0.000414181534206698, 'L_sep_weight_yyx': 3.995454172505001e-09, 'L_scale_weight_yyx': 5.66681828975106e-10, 'learning_rate_yyx': 0.0019205417785553725}. Best is trial 0 with value: -1.2615266048974338.
[I 2026-03-18 17:28:07,640] Trial 0 finished with value: -1.66519233145544 and parameters: {'n_layers_yyx': 1, 'hidden_size_yyx_l0': 5, 'context_size_yyx': 3, 'num_mix_components_yyx': 1, 'context_extractor_yyx': 'gru', 'activation_func_yyx': 'ReLU', 'L2_weight_yyx': 0.0001829014382763315, 'L_entropy_weight_yyx': 1.6267705556567786e-05, 'L_sep_weight_yyx': 6.405753965780596e-07, 'L_scale_weight_yyx': 1.3217584605994493e-08, 'learning_rate_yyx': 0.003099017901856914}. Best is trial 0 with value: -1.66519233145544.
[I 2026-03-18 17:28:14,096] Trial 0 finished with value: -1.6656935052073152 and parameters: {'n_layers_yyx': 2, 'hidden_size_yyx_l0': 5, 'hidden_size_yyx_l1': 4, 'context_size_yyx': 4, 'num_mix_components_yyx': 4, 'context_extractor_yyx': 'lstm', 'activation_func_yyx': 'ReLU', 'L2_weight_yyx': 0.0007930617899134604, 'L_entropy_weight_yyx': 3.044058401505371e-08, 'L_sep_weight_yyx': 2.0074304365575486e-05, 'L_scale_weight_yyx': 8.135244629788892e-07, 'learning_rate_yyx': 0.002242352141821721}. Best is trial 0 with value: -1.6656935052073152.
[I 2026-03-18 17:28:22,262] Trial 0 finished with value: -1.6746319320135328 and parameters: {'n_layers_yyx': 2, 'hidden_size_yyx_l0': 5, 'hidden_size_yyx_l1': 3, 'context_size_yyx': 4, 'num_mix_components_yyx': 1, 'context_extractor_yyx': 'lstm', 'activation_func_yyx': 'Tanh', 'L2_weight_yyx': 7.539191021535968e-10, 'L_entropy_weight_yyx': 0.00031741072375522905, 'L_sep_weight_yyx': 6.957282958778923e-08, 'L_scale_weight_yyx': 5.690245069290792e-08, 'learning_rate_yyx': 0.003025713011503171}. Best is trial 0 with value: -1.6746319320135328.
[I 2026-03-18 17:30:02,328] Trial 2 finished with value: -2.638852726968267 and parameters: {'n_layers_yyx': 2, 'hidden_size_yyx_l0': 6, 'hidden_size_yyx_l1': 3, 'context_size_yyx': 1, 'num_mix_components_yyx': 4, 'context_extractor_yyx': 'gru', 'activation_func_yyx': 'Tanh', 'L2_weight_yyx': 1.0837289688786722e-05, 'L_entropy_weight_yyx': 9.215565497808944e-09, 'L_sep_weight_yyx': 1.9093518028485848e-07, 'L_scale_weight_yyx': 2.4329255988819935e-07, 'learning_rate_yyx': 0.005102111910047131}. Best is trial 2 with value: -2.638852726968267.
[I 2026-03-18 17:30:16,585] Trial 0 finished with value: -1.6151760881261308 and parameters: {'n_layers_yyx': 1, 'hidden_size_yyx_l0': 2, 'context_size_yyx': 3, 'num_mix_components_yyx': 1, 'context_extractor_yyx': 'lstm', 'activation_func_yyx': 'Tanh', 'L2_weight_yyx': 2.511741272458661e-10, 'L_entropy_weight_yyx': 3.5882820362573195e-09, 'L_sep_weight_yyx': 1.381650612892442e-10, 'L_scale_weight_yyx': 0.0007609344025977443, 'learning_rate_yyx': 0.0017514120142935075}. Best is trial 0 with value: -1.6151760881261308.
[I 2026-03-18 17:30:23,888] Trial 0 finished with value: -1.6702748905361788 and parameters: {'n_layers_yyx': 1, 'hidden_size_yyx_l0': 2, 'context_size_yyx': 3, 'num_mix_components_yyx': 2, 'context_extractor_yyx': 'gru', 'activation_func_yyx': 'ReLU', 'L2_weight_yyx': 1.7310642802008727e-10, 'L_entropy_weight_yyx': 2.8468024959499065e-07, 'L_sep_weight_yyx': 1.5598604843727248e-09, 'L_scale_weight_yyx': 1.2581232896605242e-09, 'learning_rate_yyx': 0.00929130663784604}. Best is trial 0 with value: -1.6702748905361788.
[I 2026-03-18 17:30:28,901] Trial 1 finished with value: -2.598635016281152 and parameters: {'n_layers_yyx': 1, 'hidden_size_yyx_l0': 5, 'context_size_yyx': 2, 'num_mix_components_yyx': 3, 'context_extractor_yyx': 'lstm', 'activation_func_yyx': 'Tanh', 'L2_weight_yyx': 3.6504012783041716e-05, 'L_entropy_weight_yyx': 8.619788088540185e-08, 'L_sep_weight_yyx': 1.2451397798365565e-09, 'L_scale_weight_yyx': 0.00011740758158783359, 'learning_rate_yyx': 0.005303069622085455}. Best is trial 0 with value: -2.600449350976869.
[I 2026-03-18 17:31:05,732] Trial 1 pruned. 
[I 2026-03-18 17:31:13,418] Trial 1 finished with value: -1.2555656715153325 and parameters: {'n_layers_yyx': 1, 'hidden_size_yyx_l0': 4, 'context_size_yyx': 2, 'num_mix_components_yyx': 3, 'context_extractor_yyx': 'gru', 'activation_func_yyx': 'Tanh', 'L2_weight_yyx': 5.354961046600594e-08, 'L_entropy_weight_yyx': 2.9423286067080066e-07, 'L_sep_weight_yyx': 4.1805791075389155e-08, 'L_scale_weight_yyx': 1.282045776362343e-09, 'learning_rate_yyx': 0.00939342583984015}. Best is trial 1 with value: -1.2555656715153325.
[I 2026-03-18 17:32:08,848] Trial 1 finished with value: -2.5992197354584676 and parameters: {'n_layers_yyx': 1, 'hidden_size_yyx_l0': 3, 'context_size_yyx': 2, 'num_mix_components_yyx': 3, 'context_extractor_yyx': 'lstm', 'activation_func_yyx': 'Tanh', 'L2_weight_yyx': 1.1230728847729164e-07, 'L_entropy_weight_yyx': 6.077002259979933e-06, 'L_sep_weight_yyx': 1.1984454886865238e-07, 'L_scale_weight_yyx': 9.317288858763261e-05, 'learning_rate_yyx': 0.007840967595485538}. Best is trial 0 with value: -2.6330643191486622.
[I 2026-03-18 17:32:10,804] Trial 0 finished with value: -1.6607491582259177 and parameters: {'n_layers_yyx': 2, 'hidden_size_yyx_l0': 2, 'hidden_size_yyx_l1': 6, 'context_size_yyx': 4, 'num_mix_components_yyx': 4, 'context_extractor_yyx': 'lstm', 'activation_func_yyx': 'GELU', 'L2_weight_yyx': 2.0889970769601487e-08, 'L_entropy_weight_yyx': 1.0192864178910817e-08, 'L_sep_weight_yyx': 1.2711957408792144e-09, 'L_scale_weight_yyx': 1.0137385363856754e-07, 'learning_rate_yyx': 0.0006137379164685463}. Best is trial 0 with value: -1.6607491582259177.
[I 2026-03-18 17:32:13,562] Trial 0 finished with value: -1.6431313146054454 and parameters: {'n_layers_yyx': 1, 'hidden_size_yyx_l0': 3, 'context_size_yyx': 4, 'num_mix_components_yyx': 3, 'context_extractor_yyx': 'lstm', 'activation_func_yyx': 'GELU', 'L2_weight_yyx': 1.2621807306738453e-10, 'L_entropy_weight_yyx': 1.33501539815836e-09, 'L_sep_weight_yyx': 1.4210298948357137e-09, 'L_scale_weight_yyx': 1.061870345740819e-06, 'learning_rate_yyx': 0.0008867406411203149}. Best is trial 0 with value: -1.6431313146054454.
[I 2026-03-18 17:32:24,131] Trial 2 pruned. 
[I 2026-03-18 17:32:29,377] Trial 0 finished with value: -1.6735557119242839 and parameters: {'n_layers_yyx': 2, 'hidden_size_yyx_l0': 6, 'hidden_size_yyx_l1': 5, 'context_size_yyx': 2, 'num_mix_components_yyx': 2, 'context_extractor_yyx': 'lstm', 'activation_func_yyx': 'ReLU', 'L2_weight_yyx': 3.9582810719454875e-05, 'L_entropy_weight_yyx': 0.0006543475445933429, 'L_sep_weight_yyx': 1.05709882225828e-05, 'L_scale_weight_yyx': 2.096022599703375e-10, 'learning_rate_yyx': 0.0006487590410203379}. Best is trial 0 with value: -1.6735557119242839.
[I 2026-03-18 17:32:58,643] Trial 1 finished with value: -1.2947146562429575 and parameters: {'n_layers_yyx': 2, 'hidden_size_yyx_l0': 5, 'hidden_size_yyx_l1': 6, 'context_size_yyx': 3, 'num_mix_components_yyx': 2, 'context_extractor_yyx': 'lstm', 'activation_func_yyx': 'Tanh', 'L2_weight_yyx': 0.000796428559450987, 'L_entropy_weight_yyx': 1.0572535231806233e-10, 'L_sep_weight_yyx': 1.1416837454568495e-09, 'L_scale_weight_yyx': 1.0755415600993769e-05, 'learning_rate_yyx': 0.003313209485003155}. Best is trial 1 with value: -1.2947146562429575.
[I 2026-03-18 17:33:00,401] Trial 0 finished with value: -2.631078101143863 and parameters: {'n_layers_yyx': 1, 'hidden_size_yyx_l0': 2, 'context_size_yyx': 4, 'num_mix_components_yyx': 3, 'context_extractor_yyx': 'gru', 'activation_func_yyx': 'Tanh', 'L2_weight_yyx': 2.9917595060672786e-05, 'L_entropy_weight_yyx': 6.711740607762276e-10, 'L_sep_weight_yyx': 9.122416870301124e-05, 'L_scale_weight_yyx': 2.5125758974883936e-07, 'learning_rate_yyx': 0.0013344923725937636}. Best is trial 0 with value: -2.631078101143863.
[I 2026-03-18 17:33:00,544] Trial 0 finished with value: -1.7111583081981805 and parameters: {'n_layers_yyx': 2, 'hidden_size_yyx_l0': 2, 'hidden_size_yyx_l1': 2, 'context_size_yyx': 1, 'num_mix_components_yyx': 4, 'context_extractor_yyx': 'lstm', 'activation_func_yyx': 'ReLU', 'L2_weight_yyx': 0.000444421079370741, 'L_entropy_weight_yyx': 1.2092117295034358e-06, 'L_sep_weight_yyx': 3.834001536267659e-09, 'L_scale_weight_yyx': 1.2637599529566545e-07, 'learning_rate_yyx': 0.004472609353187508}. Best is trial 0 with value: -1.7111583081981805.
[I 2026-03-18 17:33:09,168] Trial 0 finished with value: -1.6475350138542169 and parameters: {'n_layers_yyx': 1, 'hidden_size_yyx_l0': 3, 'context_size_yyx': 2, 'num_mix_components_yyx': 5, 'context_extractor_yyx': 'gru', 'activation_func_yyx': 'GELU', 'L2_weight_yyx': 1.6902862705772564e-09, 'L_entropy_weight_yyx': 6.038173218712295e-10, 'L_sep_weight_yyx': 5.29492027957987e-10, 'L_scale_weight_yyx': 3.4894785638111406e-05, 'learning_rate_yyx': 0.0010444109008824198}. Best is trial 0 with value: -1.6475350138542169.
