[I 2026-03-18 19:19:34,403] Trial 23 finished with value: -2.2642834399850895 and parameters: {'n_layers_yyx': 2, 'hidden_size_yyx_l0': 2, 'hidden_size_yyx_l1': 5, 'context_size_yyx': 4, 'num_mix_components_yyx': 5, 'context_extractor_yyx': 'lstm', 'activation_func_yyx': 'Tanh', 'L2_weight_yyx': 2.8982512183909556e-08, 'L_entropy_weight_yyx': 0.00029082274600270686, 'L_sep_weight_yyx': 9.114037275732173e-05, 'L_scale_weight_yyx': 6.839854266358476e-08, 'learning_rate_yyx': 0.006198691732964746}. Best is trial 21 with value: -2.2734326463096424.
[I 2026-03-18 19:19:35,898] Trial 36 pruned. 
[I 2026-03-18 19:19:36,012] Trial 40 pruned. 
[I 2026-03-18 19:19:38,191] Trial 21 finished with value: -2.280471689063654 and parameters: {'n_layers_yyx': 2, 'hidden_size_yyx_l0': 3, 'hidden_size_yyx_l1': 6, 'context_size_yyx': 4, 'num_mix_components_yyx': 5, 'context_extractor_yyx': 'lstm', 'activation_func_yyx': 'GELU', 'L2_weight_yyx': 3.7569709352667594e-06, 'L_entropy_weight_yyx': 0.00016609138804967908, 'L_sep_weight_yyx': 0.0008367263120415158, 'L_scale_weight_yyx': 0.00028369618609563977, 'learning_rate_yyx': 0.009814002580316153}. Best is trial 15 with value: -2.2836040757900973.
[I 2026-03-18 19:19:39,193] Trial 28 pruned. 
[I 2026-03-18 19:19:39,233] Trial 19 finished with value: -2.286228705678167 and parameters: {'n_layers_yyx': 1, 'hidden_size_yyx_l0': 6, 'context_size_yyx': 4, 'num_mix_components_yyx': 2, 'context_extractor_yyx': 'gru', 'activation_func_yyx': 'ReLU', 'L2_weight_yyx': 4.050961648267357e-07, 'L_entropy_weight_yyx': 6.867306492038837e-07, 'L_sep_weight_yyx': 0.0007025690744251481, 'L_scale_weight_yyx': 2.8059397373599604e-09, 'learning_rate_yyx': 0.005794373027044326}. Best is trial 19 with value: -2.286228705678167.
[I 2026-03-18 19:19:43,487] Trial 38 pruned. 
[I 2026-03-18 19:19:44,014] Trial 37 pruned. 
[I 2026-03-18 19:19:44,029] Trial 24 pruned. 
[I 2026-03-18 19:19:44,036] Trial 36 pruned. 
[I 2026-03-18 19:19:46,767] Trial 21 finished with value: -2.207878730583672 and parameters: {'n_layers_yyx': 2, 'hidden_size_yyx_l0': 6, 'hidden_size_yyx_l1': 5, 'context_size_yyx': 3, 'num_mix_components_yyx': 5, 'context_extractor_yyx': 'lstm', 'activation_func_yyx': 'GELU', 'L2_weight_yyx': 1.8760651421285226e-10, 'L_entropy_weight_yyx': 6.916458738879566e-05, 'L_sep_weight_yyx': 1.6091057175659663e-05, 'L_scale_weight_yyx': 5.526937503738828e-10, 'learning_rate_yyx': 0.007948872888360761}. Best is trial 12 with value: -2.2168161654612635.
[I 2026-03-18 19:19:47,062] Trial 22 pruned. 
[I 2026-03-18 19:19:47,986] Trial 29 pruned. 
[I 2026-03-18 19:19:50,345] Trial 39 pruned. 
[I 2026-03-18 19:19:52,204] Trial 38 pruned. 
[I 2026-03-18 19:19:52,393] Trial 28 pruned. 
[I 2026-03-18 19:19:52,632] Trial 37 pruned. 
[I 2026-03-18 19:19:53,639] Trial 25 pruned. 
[I 2026-03-18 19:19:59,779] Trial 24 finished with value: -1.8613912361819729 and parameters: {'n_layers_yyx': 2, 'hidden_size_yyx_l0': 4, 'hidden_size_yyx_l1': 4, 'context_size_yyx': 3, 'num_mix_components_yyx': 1, 'context_extractor_yyx': 'lstm', 'activation_func_yyx': 'GELU', 'L2_weight_yyx': 1.287695071808027e-09, 'L_entropy_weight_yyx': 2.2559409509874035e-05, 'L_sep_weight_yyx': 5.142947333904445e-08, 'L_scale_weight_yyx': 2.6056595912080153e-09, 'learning_rate_yyx': 0.002419769330629116}. Best is trial 5 with value: -1.864091702761834.
[I 2026-03-18 19:20:07,164] Trial 30 pruned. 
[I 2026-03-18 19:20:08,351] Trial 49 finished with value: -0.8073073461805876 and parameters: {'n_layers_yyx': 2, 'hidden_size_yyx_l0': 2, 'hidden_size_yyx_l1': 4, 'context_size_yyx': 2, 'num_mix_components_yyx': 5, 'context_extractor_yyx': 'gru', 'activation_func_yyx': 'Tanh', 'L2_weight_yyx': 0.0006358258294886086, 'L_entropy_weight_yyx': 1.444904964637083e-06, 'L_sep_weight_yyx': 1.8295053479045566e-10, 'L_scale_weight_yyx': 2.5830699306139156e-10, 'learning_rate_yyx': 0.005541255196603324}. Best is trial 33 with value: -0.8347344222413913.

Source events: 3618
Target events: 8618
Full model ln_yyx : 69.30724 nats/sec, 7.23793 nats/event
Full model Log loss : -0.82455
Full model ln_yyx : 68.65689 nats/sec, 7.17002 nats/event
Full model Log loss : -0.81017
Full model ln_yyx : 68.04590 nats/sec, 7.10621 nats/event
Full model Log loss : -0.79822
Full model ln_yyx : 69.56857 nats/sec, 7.26523 nats/event
Full model Log loss : -0.83203
Full model ln_yyx : 69.86499 nats/sec, 7.29618 nats/event
Full model Log loss : -0.83457
Full model ln_yyx : 69.78358 nats/sec, 7.28768 nats/event
Full model Log loss : -0.83421
Full model ln_yyx : 70.21329 nats/sec, 7.33256 nats/event
Full model Log loss : -0.83410
Full model ln_yyx : 68.84438 nats/sec, 7.18960 nats/event
Full model Log loss : -0.81704
Full model ln_yyx : 70.19570 nats/sec, 7.33072 nats/event
Full model Log loss : -0.83469
Full model ln_yyx : 68.65709 nats/sec, 7.17004 nats/event
Full model Log loss : -0.81355
Full model ln_yyx : 70.06341 nats/sec, 7.31690 nats/event
Full model Log loss : -0.83414
Full model ln_yyx : 69.99280 nats/sec, 7.30953 nats/event
Full model Log loss : -0.83473
Full model ln_yyx : 69.22188 nats/sec, 7.22902 nats/event
Full model Log loss : -0.80141
Full model ln_yyx : 68.13902 nats/sec, 7.11593 nats/event
Full model Log loss : -0.80731
Optimization finished. Config saved to results/opt-full/opt_full_199_best_config.txt
[I 2026-03-18 19:20:09,608] Trial 29 pruned. 
[I 2026-03-18 19:20:10,187] Trial 38 pruned. 
[I 2026-03-18 19:20:11,215] Trial 32 finished with value: -2.2821268443524327 and parameters: {'n_layers_yyx': 2, 'hidden_size_yyx_l0': 4, 'hidden_size_yyx_l1': 5, 'context_size_yyx': 3, 'num_mix_components_yyx': 5, 'context_extractor_yyx': 'gru', 'activation_func_yyx': 'Tanh', 'L2_weight_yyx': 1.7863430909976057e-07, 'L_entropy_weight_yyx': 4.431348836157602e-09, 'L_sep_weight_yyx': 1.1780007929195691e-06, 'L_scale_weight_yyx': 5.799801797934703e-05, 'learning_rate_yyx': 0.0081608291348283}. Best is trial 22 with value: -2.2897814149518054.
[I 2026-03-18 19:20:16,319] Trial 25 pruned. 
[I 2026-03-18 19:20:17,629] Trial 30 pruned. 
[I 2026-03-18 19:20:19,037] Trial 39 pruned. 
[I 2026-03-18 19:20:24,969] Trial 26 pruned. 
[I 2026-03-18 19:20:25,408] Trial 25 finished with value: -2.2735596009603314 and parameters: {'n_layers_yyx': 2, 'hidden_size_yyx_l0': 4, 'hidden_size_yyx_l1': 4, 'context_size_yyx': 4, 'num_mix_components_yyx': 1, 'context_extractor_yyx': 'lstm', 'activation_func_yyx': 'ReLU', 'L2_weight_yyx': 0.0009644093365145919, 'L_entropy_weight_yyx': 1.7254234040455837e-07, 'L_sep_weight_yyx': 1.6325456000375543e-06, 'L_scale_weight_yyx': 3.082878189196012e-10, 'learning_rate_yyx': 0.007732115203321125}. Best is trial 25 with value: -2.2735596009603314.
[I 2026-03-18 19:20:28,385] Trial 40 pruned. 
[I 2026-03-18 19:20:32,370] Trial 27 pruned. 
[I 2026-03-18 19:20:34,429] Trial 40 pruned. 
[I 2026-03-18 19:20:39,155] Trial 39 pruned. 
[I 2026-03-18 19:20:46,041] Trial 26 pruned. 
[I 2026-03-18 19:20:48,961] Trial 41 finished with value: -2.2832451996634027 and parameters: {'n_layers_yyx': 1, 'hidden_size_yyx_l0': 6, 'context_size_yyx': 4, 'num_mix_components_yyx': 4, 'context_extractor_yyx': 'gru', 'activation_func_yyx': 'Tanh', 'L2_weight_yyx': 0.000180246033176373, 'L_entropy_weight_yyx': 9.197902508983947e-09, 'L_sep_weight_yyx': 1.6512201346422383e-09, 'L_scale_weight_yyx': 1.0130925907712372e-06, 'learning_rate_yyx': 0.009294157163483113}. Best is trial 1 with value: -2.2881647079635865.
[I 2026-03-18 19:20:50,803] Trial 40 pruned. 
[I 2026-03-18 19:21:13,080] Trial 31 finished with value: -1.7813104926215277 and parameters: {'n_layers_yyx': 2, 'hidden_size_yyx_l0': 4, 'hidden_size_yyx_l1': 3, 'context_size_yyx': 4, 'num_mix_components_yyx': 1, 'context_extractor_yyx': 'lstm', 'activation_func_yyx': 'ReLU', 'L2_weight_yyx': 6.096922012814847e-06, 'L_entropy_weight_yyx': 1.553713484385896e-08, 'L_sep_weight_yyx': 5.039645198410227e-09, 'L_scale_weight_yyx': 2.269161048930196e-05, 'learning_rate_yyx': 0.003401322185901508}. Best is trial 18 with value: -1.7861539220328282.
[I 2026-03-18 19:21:13,333] Trial 20 finished with value: -2.265898993315866 and parameters: {'n_layers_yyx': 2, 'hidden_size_yyx_l0': 6, 'hidden_size_yyx_l1': 2, 'context_size_yyx': 4, 'num_mix_components_yyx': 2, 'context_extractor_yyx': 'gru', 'activation_func_yyx': 'ReLU', 'L2_weight_yyx': 7.605761668701131e-07, 'L_entropy_weight_yyx': 7.96346303431848e-07, 'L_sep_weight_yyx': 0.00024234987666475134, 'L_scale_weight_yyx': 7.98997167178459e-08, 'learning_rate_yyx': 0.006276845456429713}. Best is trial 19 with value: -2.286228705678167.
[I 2026-03-18 19:21:19,116] Trial 41 pruned. 
[I 2026-03-18 19:21:24,266] Trial 37 finished with value: -1.7647841268137305 and parameters: {'n_layers_yyx': 2, 'hidden_size_yyx_l0': 6, 'hidden_size_yyx_l1': 4, 'context_size_yyx': 2, 'num_mix_components_yyx': 1, 'context_extractor_yyx': 'lstm', 'activation_func_yyx': 'ReLU', 'L2_weight_yyx': 1.3437561322367186e-10, 'L_entropy_weight_yyx': 1.1661776990639739e-09, 'L_sep_weight_yyx': 2.1178455587914417e-08, 'L_scale_weight_yyx': 3.23132615147488e-07, 'learning_rate_yyx': 0.007755712359899616}. Best is trial 1 with value: -1.7684712210476057.
[I 2026-03-18 19:21:25,435] Trial 39 finished with value: -1.7797506614436482 and parameters: {'n_layers_yyx': 2, 'hidden_size_yyx_l0': 2, 'hidden_size_yyx_l1': 3, 'context_size_yyx': 4, 'num_mix_components_yyx': 3, 'context_extractor_yyx': 'gru', 'activation_func_yyx': 'Tanh', 'L2_weight_yyx': 3.6353263371124544e-08, 'L_entropy_weight_yyx': 5.195577271532575e-10, 'L_sep_weight_yyx': 7.031060709670647e-08, 'L_scale_weight_yyx': 4.536620056269706e-06, 'learning_rate_yyx': 0.008367634021620359}. Best is trial 4 with value: -1.7807932306351817.
[I 2026-03-18 19:21:29,046] Trial 22 finished with value: -2.2874691014190636 and parameters: {'n_layers_yyx': 1, 'hidden_size_yyx_l0': 5, 'context_size_yyx': 4, 'num_mix_components_yyx': 3, 'context_extractor_yyx': 'gru', 'activation_func_yyx': 'ReLU', 'L2_weight_yyx': 7.767430482848701e-07, 'L_entropy_weight_yyx': 6.699887338077361e-07, 'L_sep_weight_yyx': 3.3477100432005095e-08, 'L_scale_weight_yyx': 1.1236385800305806e-05, 'learning_rate_yyx': 0.0014959382422701296}. Best is trial 17 with value: -2.288314778247399.
[I 2026-03-18 19:21:30,793] Trial 21 pruned. 
[I 2026-03-18 19:21:34,435] Trial 22 finished with value: -2.2121418883199953 and parameters: {'n_layers_yyx': 2, 'hidden_size_yyx_l0': 5, 'hidden_size_yyx_l1': 5, 'context_size_yyx': 3, 'num_mix_components_yyx': 5, 'context_extractor_yyx': 'lstm', 'activation_func_yyx': 'GELU', 'L2_weight_yyx': 1.2246793856742744e-09, 'L_entropy_weight_yyx': 1.178239635940156e-06, 'L_sep_weight_yyx': 6.37671333104981e-05, 'L_scale_weight_yyx': 1.1955895604629772e-08, 'learning_rate_yyx': 0.009725113731189962}. Best is trial 12 with value: -2.2168161654612635.
[I 2026-03-18 19:21:35,825] Trial 41 pruned. 
[I 2026-03-18 19:21:40,713] Trial 42 pruned. 
[I 2026-03-18 19:21:42,925] Trial 27 finished with value: -2.2520643919519285 and parameters: {'n_layers_yyx': 2, 'hidden_size_yyx_l0': 5, 'hidden_size_yyx_l1': 5, 'context_size_yyx': 3, 'num_mix_components_yyx': 1, 'context_extractor_yyx': 'lstm', 'activation_func_yyx': 'ReLU', 'L2_weight_yyx': 7.557627367743249e-05, 'L_entropy_weight_yyx': 1.0440514302599228e-08, 'L_sep_weight_yyx': 2.0080567899023364e-08, 'L_scale_weight_yyx': 3.5961200957188344e-10, 'learning_rate_yyx': 0.0097890549207997}. Best is trial 25 with value: -2.2735596009603314.
[I 2026-03-18 19:21:42,989] Trial 31 finished with value: -2.2817167060319767 and parameters: {'n_layers_yyx': 2, 'hidden_size_yyx_l0': 4, 'hidden_size_yyx_l1': 6, 'context_size_yyx': 4, 'num_mix_components_yyx': 5, 'context_extractor_yyx': 'gru', 'activation_func_yyx': 'ReLU', 'L2_weight_yyx': 5.336651422749938e-10, 'L_entropy_weight_yyx': 1.1797756481547906e-08, 'L_sep_weight_yyx': 5.394937784455307e-05, 'L_scale_weight_yyx': 9.90138589102103e-05, 'learning_rate_yyx': 0.006728705062631317}. Best is trial 1 with value: -2.2866954714752907.
[I 2026-03-18 19:21:46,847] Trial 23 pruned. 
[I 2026-03-18 19:21:48,149] Trial 27 finished with value: -2.2621699127400614 and parameters: {'n_layers_yyx': 2, 'hidden_size_yyx_l0': 4, 'hidden_size_yyx_l1': 3, 'context_size_yyx': 3, 'num_mix_components_yyx': 5, 'context_extractor_yyx': 'lstm', 'activation_func_yyx': 'Tanh', 'L2_weight_yyx': 1.1779976200773196e-07, 'L_entropy_weight_yyx': 3.4155481520286903e-07, 'L_sep_weight_yyx': 0.00024244739053962553, 'L_scale_weight_yyx': 5.611249711470994e-10, 'learning_rate_yyx': 0.0024007056869245137}. Best is trial 2 with value: -2.272224617884258.
[I 2026-03-18 19:21:51,121] Trial 26 finished with value: -2.2706809830712986 and parameters: {'n_layers_yyx': 2, 'hidden_size_yyx_l0': 5, 'hidden_size_yyx_l1': 5, 'context_size_yyx': 2, 'num_mix_components_yyx': 5, 'context_extractor_yyx': 'lstm', 'activation_func_yyx': 'Tanh', 'L2_weight_yyx': 8.567507759874042e-09, 'L_entropy_weight_yyx': 4.746917154410501e-05, 'L_sep_weight_yyx': 7.070028788531005e-08, 'L_scale_weight_yyx': 5.5567514157049744e-08, 'learning_rate_yyx': 0.007733608434244139}. Best is trial 21 with value: -2.2734326463096424.
[I 2026-03-18 19:21:51,494] Trial 23 pruned. 
[I 2026-03-18 19:21:53,814] Trial 28 pruned. 
[I 2026-03-18 19:21:56,147] Trial 24 pruned. 
[I 2026-03-18 19:22:01,755] Trial 24 pruned. 
[I 2026-03-18 19:22:02,853] Trial 32 pruned. 
[I 2026-03-18 19:22:06,235] Trial 41 finished with value: -1.774423695637751 and parameters: {'n_layers_yyx': 2, 'hidden_size_yyx_l0': 5, 'hidden_size_yyx_l1': 5, 'context_size_yyx': 3, 'num_mix_components_yyx': 2, 'context_extractor_yyx': 'lstm', 'activation_func_yyx': 'ReLU', 'L2_weight_yyx': 4.736990125729908e-10, 'L_entropy_weight_yyx': 2.108975789898158e-05, 'L_sep_weight_yyx': 5.917835361558368e-09, 'L_scale_weight_yyx': 6.650791288406477e-06, 'learning_rate_yyx': 0.009028486891044308}. Best is trial 4 with value: -1.7775746924677662.
[I 2026-03-18 19:22:09,366] Trial 33 finished with value: -2.285021031355187 and parameters: {'n_layers_yyx': 2, 'hidden_size_yyx_l0': 3, 'hidden_size_yyx_l1': 6, 'context_size_yyx': 4, 'num_mix_components_yyx': 5, 'context_extractor_yyx': 'gru', 'activation_func_yyx': 'Tanh', 'L2_weight_yyx': 3.5134672269401077e-09, 'L_entropy_weight_yyx': 1.3162205697332254e-05, 'L_sep_weight_yyx': 4.542763456329584e-07, 'L_scale_weight_yyx': 0.00018370010760308418, 'learning_rate_yyx': 0.007281177692050718}. Best is trial 22 with value: -2.2897814149518054.
[I 2026-03-18 19:22:09,763] Trial 26 finished with value: -1.7844007703993054 and parameters: {'n_layers_yyx': 2, 'hidden_size_yyx_l0': 3, 'hidden_size_yyx_l1': 4, 'context_size_yyx': 2, 'num_mix_components_yyx': 4, 'context_extractor_yyx': 'gru', 'activation_func_yyx': 'Tanh', 'L2_weight_yyx': 4.3284504756531624e-07, 'L_entropy_weight_yyx': 0.000937901720034981, 'L_sep_weight_yyx': 1.7626801100443568e-08, 'L_scale_weight_yyx': 1.1750612943374156e-10, 'learning_rate_yyx': 0.0028298398003375083}. Best is trial 4 with value: -1.784507205847538.
[I 2026-03-18 19:22:12,065] Trial 30 finished with value: -2.2721891097382603 and parameters: {'n_layers_yyx': 2, 'hidden_size_yyx_l0': 5, 'hidden_size_yyx_l1': 5, 'context_size_yyx': 3, 'num_mix_components_yyx': 4, 'context_extractor_yyx': 'gru', 'activation_func_yyx': 'Tanh', 'L2_weight_yyx': 6.918519243598885e-09, 'L_entropy_weight_yyx': 1.0044752681867825e-10, 'L_sep_weight_yyx': 6.980513109995267e-07, 'L_scale_weight_yyx': 0.000161104294160581, 'learning_rate_yyx': 0.0014983829184315254}. Best is trial 3 with value: -2.278758564192965.
[I 2026-03-18 19:22:13,999] Trial 25 pruned. 
[I 2026-03-18 19:22:14,549] Trial 33 pruned. 
[I 2026-03-18 19:22:16,246] Trial 42 pruned. 
[I 2026-03-18 19:22:17,075] Trial 29 pruned. 
[I 2026-03-18 19:22:17,080] Trial 27 pruned. 
[I 2026-03-18 19:22:18,560] Trial 38 pruned. 
[I 2026-03-18 19:22:18,567] Trial 40 pruned. 
[I 2026-03-18 19:22:21,599] Trial 27 pruned. 
[I 2026-03-18 19:22:25,095] Trial 26 pruned. 
[I 2026-03-18 19:22:27,544] Trial 30 pruned. 
[I 2026-03-18 19:22:27,973] Trial 34 pruned. 
[I 2026-03-18 19:22:45,017] Trial 28 pruned. 
[I 2026-03-18 19:22:49,460] Trial 27 pruned. 
[I 2026-03-18 19:22:49,605] Trial 28 pruned. 
[I 2026-03-18 19:22:50,347] Trial 31 finished with value: -1.7763324275679653 and parameters: {'n_layers_yyx': 1, 'hidden_size_yyx_l0': 3, 'context_size_yyx': 2, 'num_mix_components_yyx': 4, 'context_extractor_yyx': 'gru', 'activation_func_yyx': 'Tanh', 'L2_weight_yyx': 3.076328774430924e-10, 'L_entropy_weight_yyx': 0.00014267315608405994, 'L_sep_weight_yyx': 3.4765880572152187e-07, 'L_scale_weight_yyx': 1.0304576835734559e-07, 'learning_rate_yyx': 0.009688714471223919}. Best is trial 2 with value: -1.776406202226865.
[I 2026-03-18 19:22:51,673] Trial 31 pruned. 
[I 2026-03-18 19:23:04,111] Trial 32 pruned. 
[I 2026-03-18 19:23:07,516] Trial 23 finished with value: -2.281484283642602 and parameters: {'n_layers_yyx': 2, 'hidden_size_yyx_l0': 4, 'hidden_size_yyx_l1': 6, 'context_size_yyx': 4, 'num_mix_components_yyx': 5, 'context_extractor_yyx': 'lstm', 'activation_func_yyx': 'GELU', 'L2_weight_yyx': 3.6443026902176225e-06, 'L_entropy_weight_yyx': 5.0203908020019276e-05, 'L_sep_weight_yyx': 1.938076480477233e-05, 'L_scale_weight_yyx': 0.0008068187040348473, 'learning_rate_yyx': 0.004502598616659169}. Best is trial 15 with value: -2.2836040757900973.
[I 2026-03-18 19:23:10,121] Trial 32 pruned. 
[I 2026-03-18 19:23:10,608] Trial 29 pruned. 
[I 2026-03-18 19:23:12,179] Trial 34 pruned. 
[I 2026-03-18 19:23:13,941] Trial 41 pruned. 
[I 2026-03-18 19:23:14,358] Trial 33 pruned. 
[I 2026-03-18 19:23:16,940] Trial 28 pruned. 
[I 2026-03-18 19:23:18,668] Trial 24 pruned. 
[I 2026-03-18 19:23:19,887] Trial 30 pruned. 
[I 2026-03-18 19:23:23,328] Trial 35 pruned. 
[I 2026-03-18 19:23:26,096] Trial 34 pruned. 
[I 2026-03-18 19:23:29,790] Trial 33 pruned. 
[I 2026-03-18 19:23:31,023] Trial 31 pruned. 
[I 2026-03-18 19:23:39,732] Trial 35 pruned. 
[I 2026-03-18 19:23:45,464] Trial 43 finished with value: -2.2830831165850674 and parameters: {'n_layers_yyx': 1, 'hidden_size_yyx_l0': 6, 'context_size_yyx': 4, 'num_mix_components_yyx': 4, 'context_extractor_yyx': 'gru', 'activation_func_yyx': 'Tanh', 'L2_weight_yyx': 0.0009523339358880825, 'L_entropy_weight_yyx': 1.3970972499611954e-07, 'L_sep_weight_yyx': 1.8396928450840895e-10, 'L_scale_weight_yyx': 1.375605293803941e-06, 'learning_rate_yyx': 0.005554812045632911}. Best is trial 1 with value: -2.2881647079635865.
[I 2026-03-18 19:23:46,725] Trial 25 pruned. 
[I 2026-03-18 19:23:49,334] Trial 36 pruned. 
[I 2026-03-18 19:23:53,041] Trial 25 finished with value: -2.203982177118722 and parameters: {'n_layers_yyx': 1, 'hidden_size_yyx_l0': 6, 'context_size_yyx': 3, 'num_mix_components_yyx': 4, 'context_extractor_yyx': 'lstm', 'activation_func_yyx': 'Tanh', 'L2_weight_yyx': 4.928670936208712e-08, 'L_entropy_weight_yyx': 9.715001054823622e-09, 'L_sep_weight_yyx': 0.0007661754168879873, 'L_scale_weight_yyx': 1.5544224173374943e-07, 'learning_rate_yyx': 0.007640403655005437}. Best is trial 12 with value: -2.2168161654612635.
[I 2026-03-18 19:23:53,511] Trial 34 pruned. 
[I 2026-03-18 19:23:58,586] Trial 31 finished with value: -2.275594537224038 and parameters: {'n_layers_yyx': 2, 'hidden_size_yyx_l0': 6, 'hidden_size_yyx_l1': 5, 'context_size_yyx': 4, 'num_mix_components_yyx': 3, 'context_extractor_yyx': 'gru', 'activation_func_yyx': 'ReLU', 'L2_weight_yyx': 2.1597186553169657e-08, 'L_entropy_weight_yyx': 1.770939595877847e-07, 'L_sep_weight_yyx': 1.3549375492200567e-06, 'L_scale_weight_yyx': 5.276519525480833e-07, 'learning_rate_yyx': 0.004263192903116683}. Best is trial 3 with value: -2.278758564192965.
[I 2026-03-18 19:23:59,815] Trial 26 pruned. 
[I 2026-03-18 19:24:03,803] Trial 32 finished with value: -2.2843620309631274 and parameters: {'n_layers_yyx': 2, 'hidden_size_yyx_l0': 3, 'hidden_size_yyx_l1': 6, 'context_size_yyx': 4, 'num_mix_components_yyx': 5, 'context_extractor_yyx': 'gru', 'activation_func_yyx': 'ReLU', 'L2_weight_yyx': 1.545809337448397e-08, 'L_entropy_weight_yyx': 4.093343291919131e-10, 'L_sep_weight_yyx': 0.0002871395182980017, 'L_scale_weight_yyx': 0.00030857071791890627, 'learning_rate_yyx': 0.006117150024993107}. Best is trial 1 with value: -2.2866954714752907.
[I 2026-03-18 19:24:11,036] Trial 44 pruned. 
[I 2026-03-18 19:24:15,060] Trial 37 pruned. 
[I 2026-03-18 19:24:15,820] Trial 33 pruned. 
[I 2026-03-18 19:24:17,535] Trial 42 finished with value: -1.7696138016922769 and parameters: {'n_layers_yyx': 2, 'hidden_size_yyx_l0': 5, 'hidden_size_yyx_l1': 5, 'context_size_yyx': 3, 'num_mix_components_yyx': 2, 'context_extractor_yyx': 'lstm', 'activation_func_yyx': 'ReLU', 'L2_weight_yyx': 3.1305456522248236e-10, 'L_entropy_weight_yyx': 5.889622661105074e-06, 'L_sep_weight_yyx': 6.735082971001603e-10, 'L_scale_weight_yyx': 0.0001332590799836639, 'learning_rate_yyx': 0.005719564671111585}. Best is trial 4 with value: -1.7775746924677662.
[I 2026-03-18 19:24:21,081] Trial 29 pruned. 
[I 2026-03-18 19:24:22,452] Trial 32 pruned. 
[I 2026-03-18 19:24:22,782] Trial 27 pruned. 
[I 2026-03-18 19:24:27,238] Trial 34 pruned. 
[I 2026-03-18 19:24:28,555] Trial 42 finished with value: -1.7836044773910984 and parameters: {'n_layers_yyx': 1, 'hidden_size_yyx_l0': 5, 'context_size_yyx': 1, 'num_mix_components_yyx': 5, 'context_extractor_yyx': 'gru', 'activation_func_yyx': 'ReLU', 'L2_weight_yyx': 0.00027582780883394305, 'L_entropy_weight_yyx': 4.583791117225071e-10, 'L_sep_weight_yyx': 1.3772401865090544e-05, 'L_scale_weight_yyx': 1.970878814266358e-09, 'learning_rate_yyx': 0.008601068899976149}. Best is trial 12 with value: -1.7867913016887627.
