Warning: Failed writing log files to directory [/var/log/nvidia-mps]. No logs will be available.
[I 2026-03-18 18:08:28,753] A new study created in RDB with name: opt_full-model_seed=42_task=176
[I 2026-03-18 18:08:30,635] A new study created in RDB with name: opt_full-model_seed=42_task=165
[I 2026-03-18 18:08:30,635] A new study created in RDB with name: opt_full-model_seed=42_task=170
[I 2026-03-18 18:08:32,834] A new study created in RDB with name: opt_full-model_seed=42_task=172
[I 2026-03-18 18:08:32,932] A new study created in RDB with name: opt_full-model_seed=42_task=161
[I 2026-03-18 18:08:32,989] A new study created in RDB with name: opt_full-model_seed=42_task=183
[I 2026-03-18 18:08:33,069] A new study created in RDB with name: opt_full-model_seed=42_task=164
[I 2026-03-18 18:08:33,256] A new study created in RDB with name: opt_full-model_seed=42_task=166
[I 2026-03-18 18:08:33,256] A new study created in RDB with name: opt_full-model_seed=42_task=188
[I 2026-03-18 18:08:33,686] A new study created in RDB with name: opt_full-model_seed=42_task=181
[I 2026-03-18 18:08:33,686] A new study created in RDB with name: opt_full-model_seed=42_task=191
[I 2026-03-18 18:08:33,686] A new study created in RDB with name: opt_full-model_seed=42_task=185
[I 2026-03-18 18:08:33,686] A new study created in RDB with name: opt_full-model_seed=42_task=186
[I 2026-03-18 18:08:35,283] A new study created in RDB with name: opt_full-model_seed=42_task=174
[I 2026-03-18 18:08:35,677] A new study created in RDB with name: opt_full-model_seed=42_task=189
[I 2026-03-18 18:08:35,813] A new study created in RDB with name: opt_full-model_seed=42_task=184
[I 2026-03-18 18:08:35,813] A new study created in RDB with name: opt_full-model_seed=42_task=167
[I 2026-03-18 18:08:35,813] A new study created in RDB with name: opt_full-model_seed=42_task=182
[I 2026-03-18 18:08:35,813] A new study created in RDB with name: opt_full-model_seed=42_task=168
[I 2026-03-18 18:08:35,814] A new study created in RDB with name: opt_full-model_seed=42_task=162
[I 2026-03-18 18:08:35,814] A new study created in RDB with name: opt_full-model_seed=42_task=179
[I 2026-03-18 18:08:35,814] A new study created in RDB with name: opt_full-model_seed=42_task=178
[I 2026-03-18 18:08:35,814] A new study created in RDB with name: opt_full-model_seed=42_task=187
[I 2026-03-18 18:08:35,815] A new study created in RDB with name: opt_full-model_seed=42_task=173
[I 2026-03-18 18:08:35,816] A new study created in RDB with name: opt_full-model_seed=42_task=190
[I 2026-03-18 18:08:36,181] A new study created in RDB with name: opt_full-model_seed=42_task=163
[I 2026-03-18 18:08:36,181] A new study created in RDB with name: opt_full-model_seed=42_task=175
[I 2026-03-18 18:08:36,419] A new study created in RDB with name: opt_full-model_seed=42_task=177
[I 2026-03-18 18:08:36,419] A new study created in RDB with name: opt_full-model_seed=42_task=171
[I 2026-03-18 18:08:37,891] A new study created in RDB with name: opt_full-model_seed=42_task=160
[I 2026-03-18 18:08:37,998] A new study created in RDB with name: opt_full-model_seed=42_task=180
[I 2026-03-18 18:08:38,326] A new study created in RDB with name: opt_full-model_seed=42_task=169
[I 2026-03-18 18:15:56,187] Trial 0 finished with value: -2.7302822226795476 and parameters: {'n_layers_yyx': 2, 'hidden_size_yyx_l0': 5, 'hidden_size_yyx_l1': 6, 'context_size_yyx': 4, 'num_mix_components_yyx': 1, 'context_extractor_yyx': 'gru', 'activation_func_yyx': 'GELU', 'L2_weight_yyx': 4.1769440512113955e-05, 'L_entropy_weight_yyx': 1.9265559674157215e-07, 'L_sep_weight_yyx': 0.00033221008961260097, 'L_scale_weight_yyx': 0.0009121722529403177, 'learning_rate_yyx': 0.002329669004264525}. Best is trial 0 with value: -2.7302822226795476.
[I 2026-03-18 18:16:35,069] Trial 0 finished with value: -2.7324673680957448 and parameters: {'n_layers_yyx': 2, 'hidden_size_yyx_l0': 3, 'hidden_size_yyx_l1': 5, 'context_size_yyx': 4, 'num_mix_components_yyx': 2, 'context_extractor_yyx': 'lstm', 'activation_func_yyx': 'ReLU', 'L2_weight_yyx': 5.312546911792611e-09, 'L_entropy_weight_yyx': 1.4286684582542123e-09, 'L_sep_weight_yyx': 0.0003172522140031772, 'L_scale_weight_yyx': 0.000548541493552503, 'learning_rate_yyx': 0.005298314046734252}. Best is trial 0 with value: -2.7324673680957448.
[I 2026-03-18 18:17:33,813] Trial 0 finished with value: -2.7505801407137205 and parameters: {'n_layers_yyx': 2, 'hidden_size_yyx_l0': 3, 'hidden_size_yyx_l1': 3, 'context_size_yyx': 1, 'num_mix_components_yyx': 4, 'context_extractor_yyx': 'lstm', 'activation_func_yyx': 'GELU', 'L2_weight_yyx': 0.00018797845205939024, 'L_entropy_weight_yyx': 0.0007795493013192622, 'L_sep_weight_yyx': 1.9899762519765103e-06, 'L_scale_weight_yyx': 2.2295068498351633e-08, 'learning_rate_yyx': 0.007626576923067626}. Best is trial 0 with value: -2.7505801407137205.
[I 2026-03-18 18:17:38,781] Trial 0 finished with value: -2.757114683753029 and parameters: {'n_layers_yyx': 2, 'hidden_size_yyx_l0': 3, 'hidden_size_yyx_l1': 5, 'context_size_yyx': 3, 'num_mix_components_yyx': 1, 'context_extractor_yyx': 'lstm', 'activation_func_yyx': 'ReLU', 'L2_weight_yyx': 1.0320552283800314e-09, 'L_entropy_weight_yyx': 4.076966978808723e-05, 'L_sep_weight_yyx': 2.4809560798700262e-05, 'L_scale_weight_yyx': 1.2452919947166084e-09, 'learning_rate_yyx': 0.005747176263041957}. Best is trial 0 with value: -2.757114683753029.
[I 2026-03-18 18:19:59,890] Trial 0 finished with value: -2.7678615354442075 and parameters: {'n_layers_yyx': 1, 'hidden_size_yyx_l0': 2, 'context_size_yyx': 4, 'num_mix_components_yyx': 4, 'context_extractor_yyx': 'gru', 'activation_func_yyx': 'GELU', 'L2_weight_yyx': 3.156269120069855e-07, 'L_entropy_weight_yyx': 0.00023194657004673756, 'L_sep_weight_yyx': 6.126696787449921e-05, 'L_scale_weight_yyx': 2.1381708565767825e-09, 'learning_rate_yyx': 0.008621337029517692}. Best is trial 0 with value: -2.7678615354442075.
[I 2026-03-18 18:20:36,822] Trial 0 finished with value: -2.4076941594397367 and parameters: {'n_layers_yyx': 1, 'hidden_size_yyx_l0': 5, 'context_size_yyx': 4, 'num_mix_components_yyx': 5, 'context_extractor_yyx': 'gru', 'activation_func_yyx': 'Tanh', 'L2_weight_yyx': 1.379380448547841e-07, 'L_entropy_weight_yyx': 1.8329641016580133e-10, 'L_sep_weight_yyx': 2.91848652766034e-10, 'L_scale_weight_yyx': 4.1605044851501907e-07, 'learning_rate_yyx': 0.006864062743297457}. Best is trial 0 with value: -2.4076941594397367.
[I 2026-03-18 18:20:41,465] Trial 0 finished with value: -2.4083293020863543 and parameters: {'n_layers_yyx': 1, 'hidden_size_yyx_l0': 6, 'context_size_yyx': 3, 'num_mix_components_yyx': 5, 'context_extractor_yyx': 'gru', 'activation_func_yyx': 'ReLU', 'L2_weight_yyx': 1.8090201846836022e-08, 'L_entropy_weight_yyx': 0.00010341859568167302, 'L_sep_weight_yyx': 2.417715170699584e-08, 'L_scale_weight_yyx': 2.510125555076055e-09, 'learning_rate_yyx': 0.006020086874588631}. Best is trial 0 with value: -2.4083293020863543.
[I 2026-03-18 18:21:41,763] Trial 0 finished with value: -0.8227732220287689 and parameters: {'n_layers_yyx': 2, 'hidden_size_yyx_l0': 5, 'hidden_size_yyx_l1': 6, 'context_size_yyx': 1, 'num_mix_components_yyx': 4, 'context_extractor_yyx': 'lstm', 'activation_func_yyx': 'Tanh', 'L2_weight_yyx': 1.1948162392194011e-05, 'L_entropy_weight_yyx': 6.358777998937512e-08, 'L_sep_weight_yyx': 0.00014758298146582628, 'L_scale_weight_yyx': 2.351530026950719e-06, 'learning_rate_yyx': 0.0016389345342836866}. Best is trial 0 with value: -0.8227732220287689.
[I 2026-03-18 18:22:04,692] Trial 0 finished with value: -2.7283710835575667 and parameters: {'n_layers_yyx': 2, 'hidden_size_yyx_l0': 4, 'hidden_size_yyx_l1': 5, 'context_size_yyx': 1, 'num_mix_components_yyx': 1, 'context_extractor_yyx': 'lstm', 'activation_func_yyx': 'Tanh', 'L2_weight_yyx': 0.00010891290702646345, 'L_entropy_weight_yyx': 1.3630723458712748e-07, 'L_sep_weight_yyx': 1.0081785946873154e-08, 'L_scale_weight_yyx': 1.3944360014670906e-10, 'learning_rate_yyx': 0.002779685739299886}. Best is trial 0 with value: -2.7283710835575667.
[I 2026-03-18 18:22:57,579] Trial 0 finished with value: -2.7253746754118913 and parameters: {'n_layers_yyx': 1, 'hidden_size_yyx_l0': 6, 'context_size_yyx': 2, 'num_mix_components_yyx': 1, 'context_extractor_yyx': 'lstm', 'activation_func_yyx': 'ReLU', 'L2_weight_yyx': 5.569843305272134e-06, 'L_entropy_weight_yyx': 5.16400568946961e-10, 'L_sep_weight_yyx': 8.131501045662743e-09, 'L_scale_weight_yyx': 6.834060455362634e-09, 'learning_rate_yyx': 0.0013060638144569475}. Best is trial 0 with value: -2.7253746754118913.
[I 2026-03-18 18:23:10,822] Trial 0 finished with value: -2.352283302832957 and parameters: {'n_layers_yyx': 2, 'hidden_size_yyx_l0': 4, 'hidden_size_yyx_l1': 5, 'context_size_yyx': 1, 'num_mix_components_yyx': 2, 'context_extractor_yyx': 'lstm', 'activation_func_yyx': 'ReLU', 'L2_weight_yyx': 2.6534175928987684e-10, 'L_entropy_weight_yyx': 5.84497913507481e-10, 'L_sep_weight_yyx': 3.216408254466478e-10, 'L_scale_weight_yyx': 6.351995939676721e-10, 'learning_rate_yyx': 0.002235590928952523}. Best is trial 0 with value: -2.352283302832957.
[I 2026-03-18 18:23:19,696] Trial 0 finished with value: -2.8001684201127572 and parameters: {'n_layers_yyx': 2, 'hidden_size_yyx_l0': 6, 'hidden_size_yyx_l1': 2, 'context_size_yyx': 4, 'num_mix_components_yyx': 2, 'context_extractor_yyx': 'gru', 'activation_func_yyx': 'Tanh', 'L2_weight_yyx': 9.244890874853065e-06, 'L_entropy_weight_yyx': 3.366824939352515e-05, 'L_sep_weight_yyx': 6.075997563649663e-09, 'L_scale_weight_yyx': 2.0075156851439313e-09, 'learning_rate_yyx': 0.0031164358950710176}. Best is trial 0 with value: -2.8001684201127572.
[I 2026-03-18 18:23:20,869] Trial 1 pruned. 
[I 2026-03-18 18:23:25,436] Trial 1 finished with value: -2.7617047121530724 and parameters: {'n_layers_yyx': 1, 'hidden_size_yyx_l0': 4, 'context_size_yyx': 3, 'num_mix_components_yyx': 3, 'context_extractor_yyx': 'gru', 'activation_func_yyx': 'ReLU', 'L2_weight_yyx': 5.511044421396363e-09, 'L_entropy_weight_yyx': 0.00019085055911958681, 'L_sep_weight_yyx': 2.372861727349302e-06, 'L_scale_weight_yyx': 3.415761517734592e-05, 'learning_rate_yyx': 0.009127816385482948}. Best is trial 1 with value: -2.7617047121530724.
[I 2026-03-18 18:23:58,437] Trial 0 finished with value: -2.3646864368574785 and parameters: {'n_layers_yyx': 1, 'hidden_size_yyx_l0': 5, 'context_size_yyx': 3, 'num_mix_components_yyx': 2, 'context_extractor_yyx': 'lstm', 'activation_func_yyx': 'GELU', 'L2_weight_yyx': 2.515260453764904e-10, 'L_entropy_weight_yyx': 6.119741126731196e-09, 'L_sep_weight_yyx': 1.688106755598472e-08, 'L_scale_weight_yyx': 1.0300196779595004e-10, 'learning_rate_yyx': 0.0009713836627146127}. Best is trial 0 with value: -2.3646864368574785.
[I 2026-03-18 18:24:16,536] Trial 1 pruned. 
[I 2026-03-18 18:24:26,677] Trial 1 pruned. 
[I 2026-03-18 18:24:26,718] Trial 1 finished with value: -2.7608617662514496 and parameters: {'n_layers_yyx': 2, 'hidden_size_yyx_l0': 3, 'hidden_size_yyx_l1': 5, 'context_size_yyx': 4, 'num_mix_components_yyx': 4, 'context_extractor_yyx': 'gru', 'activation_func_yyx': 'ReLU', 'L2_weight_yyx': 1.374226405946799e-07, 'L_entropy_weight_yyx': 2.4413961100838064e-10, 'L_sep_weight_yyx': 6.110183323874712e-10, 'L_scale_weight_yyx': 1.5292104650311591e-09, 'learning_rate_yyx': 0.005006352494811802}. Best is trial 1 with value: -2.7608617662514496.
[I 2026-03-18 18:24:54,539] Trial 0 finished with value: -2.354674322666266 and parameters: {'n_layers_yyx': 2, 'hidden_size_yyx_l0': 3, 'hidden_size_yyx_l1': 6, 'context_size_yyx': 2, 'num_mix_components_yyx': 1, 'context_extractor_yyx': 'lstm', 'activation_func_yyx': 'GELU', 'L2_weight_yyx': 9.179283235400848e-06, 'L_entropy_weight_yyx': 4.7876703370163376e-05, 'L_sep_weight_yyx': 1.0905813511887096e-05, 'L_scale_weight_yyx': 7.264658515641858e-09, 'learning_rate_yyx': 0.0009602815275376798}. Best is trial 0 with value: -2.354674322666266.
[I 2026-03-18 18:24:59,610] Trial 0 finished with value: -0.8087707474453587 and parameters: {'n_layers_yyx': 2, 'hidden_size_yyx_l0': 3, 'hidden_size_yyx_l1': 4, 'context_size_yyx': 2, 'num_mix_components_yyx': 5, 'context_extractor_yyx': 'lstm', 'activation_func_yyx': 'Tanh', 'L2_weight_yyx': 2.235561170548036e-08, 'L_entropy_weight_yyx': 4.885780833451782e-08, 'L_sep_weight_yyx': 2.2160882783320232e-06, 'L_scale_weight_yyx': 0.00016869405580490713, 'learning_rate_yyx': 0.0010701824271690885}. Best is trial 0 with value: -0.8087707474453587.
[I 2026-03-18 18:25:09,978] Trial 0 finished with value: -2.76381727105261 and parameters: {'n_layers_yyx': 2, 'hidden_size_yyx_l0': 4, 'hidden_size_yyx_l1': 2, 'context_size_yyx': 3, 'num_mix_components_yyx': 2, 'context_extractor_yyx': 'lstm', 'activation_func_yyx': 'ReLU', 'L2_weight_yyx': 0.000370799525149103, 'L_entropy_weight_yyx': 1.1921529291880987e-06, 'L_sep_weight_yyx': 9.314282387873029e-05, 'L_scale_weight_yyx': 7.361213945509117e-08, 'learning_rate_yyx': 0.004469691092828562}. Best is trial 0 with value: -2.76381727105261.
[I 2026-03-18 18:25:37,918] Trial 2 pruned. 
[I 2026-03-18 18:25:41,774] Trial 2 pruned. 
[I 2026-03-18 18:25:45,018] Trial 0 finished with value: -2.415180783386467 and parameters: {'n_layers_yyx': 1, 'hidden_size_yyx_l0': 4, 'context_size_yyx': 3, 'num_mix_components_yyx': 3, 'context_extractor_yyx': 'lstm', 'activation_func_yyx': 'GELU', 'L2_weight_yyx': 0.0008176581702789644, 'L_entropy_weight_yyx': 1.3767249045012732e-09, 'L_sep_weight_yyx': 4.08399511591956e-08, 'L_scale_weight_yyx': 1.1658124641269832e-08, 'learning_rate_yyx': 0.0011149129621312547}. Best is trial 0 with value: -2.415180783386467.
[I 2026-03-18 18:25:51,745] Trial 0 finished with value: -2.7636622336554546 and parameters: {'n_layers_yyx': 1, 'hidden_size_yyx_l0': 2, 'context_size_yyx': 3, 'num_mix_components_yyx': 5, 'context_extractor_yyx': 'gru', 'activation_func_yyx': 'Tanh', 'L2_weight_yyx': 6.9824955783622695e-06, 'L_entropy_weight_yyx': 4.599597457789767e-09, 'L_sep_weight_yyx': 2.0251722850902246e-10, 'L_scale_weight_yyx': 2.012830819518989e-08, 'learning_rate_yyx': 0.003844496441770862}. Best is trial 0 with value: -2.7636622336554546.
[I 2026-03-18 18:25:54,597] Trial 0 finished with value: -2.731634251276652 and parameters: {'n_layers_yyx': 1, 'hidden_size_yyx_l0': 5, 'context_size_yyx': 2, 'num_mix_components_yyx': 2, 'context_extractor_yyx': 'lstm', 'activation_func_yyx': 'GELU', 'L2_weight_yyx': 0.00015675904906857849, 'L_entropy_weight_yyx': 1.06277563975816e-10, 'L_sep_weight_yyx': 0.0001551075704000515, 'L_scale_weight_yyx': 2.2741429159121193e-06, 'learning_rate_yyx': 0.0027638268288453414}. Best is trial 0 with value: -2.731634251276652.
[I 2026-03-18 18:26:18,359] Trial 1 pruned. 
[I 2026-03-18 18:26:43,577] Trial 1 finished with value: -2.7580840003681693 and parameters: {'n_layers_yyx': 2, 'hidden_size_yyx_l0': 2, 'hidden_size_yyx_l1': 2, 'context_size_yyx': 4, 'num_mix_components_yyx': 5, 'context_extractor_yyx': 'gru', 'activation_func_yyx': 'ReLU', 'L2_weight_yyx': 7.263486806012229e-05, 'L_entropy_weight_yyx': 1.5669634860136557e-09, 'L_sep_weight_yyx': 5.940943483020674e-05, 'L_scale_weight_yyx': 5.3346094776363156e-05, 'learning_rate_yyx': 0.004543099643658085}. Best is trial 1 with value: -2.7580840003681693.
[I 2026-03-18 18:26:51,240] Trial 0 finished with value: -2.4017951846031065 and parameters: {'n_layers_yyx': 2, 'hidden_size_yyx_l0': 3, 'hidden_size_yyx_l1': 5, 'context_size_yyx': 1, 'num_mix_components_yyx': 3, 'context_extractor_yyx': 'lstm', 'activation_func_yyx': 'Tanh', 'L2_weight_yyx': 3.1023504277874412e-06, 'L_entropy_weight_yyx': 8.272660563791518e-07, 'L_sep_weight_yyx': 0.0006392777452972353, 'L_scale_weight_yyx': 3.12589374211962e-08, 'learning_rate_yyx': 0.003801349562362292}. Best is trial 0 with value: -2.4017951846031065.
[I 2026-03-18 18:26:56,687] Trial 3 pruned. 
[I 2026-03-18 18:27:10,947] Trial 0 finished with value: -2.7599662179356677 and parameters: {'n_layers_yyx': 2, 'hidden_size_yyx_l0': 3, 'hidden_size_yyx_l1': 5, 'context_size_yyx': 2, 'num_mix_components_yyx': 5, 'context_extractor_yyx': 'lstm', 'activation_func_yyx': 'ReLU', 'L2_weight_yyx': 7.1637022261274056e-06, 'L_entropy_weight_yyx': 1.2699942545643548e-06, 'L_sep_weight_yyx': 5.112449162261875e-09, 'L_scale_weight_yyx': 4.8336644249851456e-08, 'learning_rate_yyx': 0.0010223708495445034}. Best is trial 0 with value: -2.7599662179356677.
[I 2026-03-18 18:27:50,298] Trial 2 pruned. 
[I 2026-03-18 18:28:02,078] Trial 1 pruned. 
[I 2026-03-18 18:28:10,080] Trial 4 pruned. 
[I 2026-03-18 18:28:11,093] Trial 0 finished with value: -0.843539329540078 and parameters: {'n_layers_yyx': 2, 'hidden_size_yyx_l0': 3, 'hidden_size_yyx_l1': 5, 'context_size_yyx': 4, 'num_mix_components_yyx': 3, 'context_extractor_yyx': 'lstm', 'activation_func_yyx': 'Tanh', 'L2_weight_yyx': 2.975874610846617e-07, 'L_entropy_weight_yyx': 8.15491144005522e-08, 'L_sep_weight_yyx': 1.5655175805342144e-08, 'L_scale_weight_yyx': 4.3962080243247883e-10, 'learning_rate_yyx': 0.0008037772364080422}. Best is trial 0 with value: -0.843539329540078.
[I 2026-03-18 18:28:51,556] Trial 0 finished with value: -2.763455357633574 and parameters: {'n_layers_yyx': 2, 'hidden_size_yyx_l0': 5, 'hidden_size_yyx_l1': 2, 'context_size_yyx': 3, 'num_mix_components_yyx': 4, 'context_extractor_yyx': 'gru', 'activation_func_yyx': 'GELU', 'L2_weight_yyx': 4.473669084396041e-07, 'L_entropy_weight_yyx': 1.459420536472462e-05, 'L_sep_weight_yyx': 4.265332452300627e-07, 'L_scale_weight_yyx': 0.00016493582403803817, 'learning_rate_yyx': 0.001711960604635443}. Best is trial 0 with value: -2.763455357633574.
[I 2026-03-18 18:28:51,970] Trial 0 finished with value: -2.431222564426635 and parameters: {'n_layers_yyx': 2, 'hidden_size_yyx_l0': 4, 'hidden_size_yyx_l1': 5, 'context_size_yyx': 4, 'num_mix_components_yyx': 5, 'context_extractor_yyx': 'gru', 'activation_func_yyx': 'Tanh', 'L2_weight_yyx': 4.264303745383036e-07, 'L_entropy_weight_yyx': 0.0001284979848537222, 'L_sep_weight_yyx': 5.641052498895117e-10, 'L_scale_weight_yyx': 4.098999570166662e-09, 'learning_rate_yyx': 0.0006887527824474379}. Best is trial 0 with value: -2.431222564426635.
[I 2026-03-18 18:29:13,599] Trial 5 pruned. 
[I 2026-03-18 18:29:16,388] Trial 1 pruned. 
[I 2026-03-18 18:29:20,074] Trial 0 finished with value: -2.7627715824660735 and parameters: {'n_layers_yyx': 1, 'hidden_size_yyx_l0': 3, 'context_size_yyx': 4, 'num_mix_components_yyx': 4, 'context_extractor_yyx': 'gru', 'activation_func_yyx': 'Tanh', 'L2_weight_yyx': 2.1300391177430262e-08, 'L_entropy_weight_yyx': 3.085337440663739e-06, 'L_sep_weight_yyx': 8.533896684937806e-09, 'L_scale_weight_yyx': 6.211357815228211e-08, 'learning_rate_yyx': 0.0008482221522511117}. Best is trial 0 with value: -2.7627715824660735.
[I 2026-03-18 18:29:55,924] Trial 0 finished with value: -2.7274412152664604 and parameters: {'n_layers_yyx': 1, 'hidden_size_yyx_l0': 3, 'context_size_yyx': 4, 'num_mix_components_yyx': 2, 'context_extractor_yyx': 'gru', 'activation_func_yyx': 'ReLU', 'L2_weight_yyx': 5.8604171705054184e-05, 'L_entropy_weight_yyx': 3.714965792315917e-06, 'L_sep_weight_yyx': 1.617946493197472e-05, 'L_scale_weight_yyx': 1.8195446546305322e-05, 'learning_rate_yyx': 0.0006146913237375088}. Best is trial 0 with value: -2.7274412152664604.
[I 2026-03-18 18:30:55,568] Trial 0 finished with value: -2.537297159326723 and parameters: {'n_layers_yyx': 1, 'hidden_size_yyx_l0': 6, 'context_size_yyx': 2, 'num_mix_components_yyx': 1, 'context_extractor_yyx': 'gru', 'activation_func_yyx': 'Tanh', 'L2_weight_yyx': 2.809525674931975e-06, 'L_entropy_weight_yyx': 0.00020559128177300193, 'L_sep_weight_yyx': 5.699680911027552e-10, 'L_scale_weight_yyx': 1.0717456753285577e-07, 'learning_rate_yyx': 0.006716754514146671}. Best is trial 0 with value: -2.537297159326723.
[I 2026-03-18 18:31:05,082] Trial 0 finished with value: -0.8180432904242061 and parameters: {'n_layers_yyx': 1, 'hidden_size_yyx_l0': 3, 'context_size_yyx': 3, 'num_mix_components_yyx': 5, 'context_extractor_yyx': 'lstm', 'activation_func_yyx': 'GELU', 'L2_weight_yyx': 3.291000902338777e-08, 'L_entropy_weight_yyx': 6.226684233260643e-08, 'L_sep_weight_yyx': 1.6450193495570172e-10, 'L_scale_weight_yyx': 5.955616909983267e-09, 'learning_rate_yyx': 0.0008239575283379491}. Best is trial 0 with value: -0.8180432904242061.
[I 2026-03-18 18:31:37,763] Trial 1 finished with value: -2.3911814408280287 and parameters: {'n_layers_yyx': 2, 'hidden_size_yyx_l0': 6, 'hidden_size_yyx_l1': 6, 'context_size_yyx': 3, 'num_mix_components_yyx': 2, 'context_extractor_yyx': 'gru', 'activation_func_yyx': 'ReLU', 'L2_weight_yyx': 0.00023718094148808953, 'L_entropy_weight_yyx': 6.101960824580268e-10, 'L_sep_weight_yyx': 1.0151537747487128e-09, 'L_scale_weight_yyx': 1.2396211940661326e-07, 'learning_rate_yyx': 0.008718767067472084}. Best is trial 0 with value: -2.4076941594397367.
[I 2026-03-18 18:31:53,166] Trial 0 finished with value: -0.8217222363064878 and parameters: {'n_layers_yyx': 1, 'hidden_size_yyx_l0': 3, 'context_size_yyx': 1, 'num_mix_components_yyx': 3, 'context_extractor_yyx': 'lstm', 'activation_func_yyx': 'Tanh', 'L2_weight_yyx': 4.966429520625054e-06, 'L_entropy_weight_yyx': 6.10883948082374e-06, 'L_sep_weight_yyx': 4.98662943732346e-09, 'L_scale_weight_yyx': 4.0761393071104796e-06, 'learning_rate_yyx': 0.0013421957916920047}. Best is trial 0 with value: -0.8217222363064878.
[I 2026-03-18 18:31:56,949] Trial 1 pruned. 
