[I 2026-03-18 17:01:08,281] Trial 49 pruned. 

Source events: 31112
Target events: 38515
Full model ln_yyx : 5489.24981 nats/sec, 128.27015 nats/event
Full model Log loss : -2.79809
Full model ln_yyx : 5541.64781 nats/sec, 129.49456 nats/event
Full model Log loss : -2.80447
Full model ln_yyx : 5534.28620 nats/sec, 129.32254 nats/event
Full model Log loss : -2.80310
Full model ln_yyx : 5507.32908 nats/sec, 128.69262 nats/event
Full model Log loss : -2.80196
Full model ln_yyx : 5532.42028 nats/sec, 129.27894 nats/event
Full model Log loss : -2.80298
Full model ln_yyx : 5550.72801 nats/sec, 129.70674 nats/event
Full model Log loss : -2.80826
Full model ln_yyx : 5507.00364 nats/sec, 128.68501 nats/event
Full model Log loss : -2.80326
Full model ln_yyx : 5535.81970 nats/sec, 129.35837 nats/event
Full model Log loss : -2.80665
Full model ln_yyx : 5530.03681 nats/sec, 129.22324 nats/event
Full model Log loss : -2.80444
Full model ln_yyx : 5534.49788 nats/sec, 129.32749 nats/event
Full model Log loss : -2.80447
Full model ln_yyx : 5526.24201 nats/sec, 129.13457 nats/event
Full model Log loss : -2.80532
Full model ln_yyx : 5535.82063 nats/sec, 129.35839 nats/event
Full model Log loss : -2.80650
Full model ln_yyx : 5549.16701 nats/sec, 129.67027 nats/event
Full model Log loss : -2.80541
Full model ln_yyx : 5546.96119 nats/sec, 129.61872 nats/event
Full model Log loss : -2.80532
Full model ln_yyx : 5547.58130 nats/sec, 129.63321 nats/event
Full model Log loss : -2.80535
Full model ln_yyx : 5552.36734 nats/sec, 129.74505 nats/event
Full model Log loss : -2.80552
Optimization finished. Config saved to results/opt-full/opt_full_6_best_config.txt
[I 2026-03-18 17:01:12,208] Trial 32 pruned. 
[I 2026-03-18 17:01:13,803] Trial 36 pruned. 
[I 2026-03-18 17:01:15,220] Trial 45 finished with value: -2.8037207654485763 and parameters: {'n_layers_yyx': 2, 'hidden_size_yyx_l0': 5, 'hidden_size_yyx_l1': 6, 'context_size_yyx': 4, 'num_mix_components_yyx': 2, 'context_extractor_yyx': 'lstm', 'activation_func_yyx': 'ReLU', 'L2_weight_yyx': 0.0001215821642100397, 'L_entropy_weight_yyx': 1.1450198275820468e-09, 'L_sep_weight_yyx': 5.06608138143263e-07, 'L_scale_weight_yyx': 1.1135648596480906e-08, 'learning_rate_yyx': 0.008514226910473656}. Best is trial 0 with value: -2.8067502106217272.
[I 2026-03-18 17:01:17,202] Trial 33 finished with value: -2.8073687293397946 and parameters: {'n_layers_yyx': 2, 'hidden_size_yyx_l0': 2, 'hidden_size_yyx_l1': 5, 'context_size_yyx': 4, 'num_mix_components_yyx': 4, 'context_extractor_yyx': 'lstm', 'activation_func_yyx': 'Tanh', 'L2_weight_yyx': 9.3932023598353e-10, 'L_entropy_weight_yyx': 4.371628299348363e-09, 'L_sep_weight_yyx': 1.07029456175299e-06, 'L_scale_weight_yyx': 5.312184723000125e-10, 'learning_rate_yyx': 0.0051285956774008296}. Best is trial 9 with value: -2.8084722793451675.
[I 2026-03-18 17:01:18,022] Trial 33 pruned. 
[I 2026-03-18 17:01:20,829] Trial 32 pruned. 
[I 2026-03-18 17:01:21,475] Trial 32 pruned. 
[I 2026-03-18 17:01:21,832] Trial 31 finished with value: -2.8004576686949734 and parameters: {'n_layers_yyx': 2, 'hidden_size_yyx_l0': 5, 'hidden_size_yyx_l1': 5, 'context_size_yyx': 3, 'num_mix_components_yyx': 2, 'context_extractor_yyx': 'lstm', 'activation_func_yyx': 'Tanh', 'L2_weight_yyx': 6.490434046324023e-05, 'L_entropy_weight_yyx': 3.384687127499029e-10, 'L_sep_weight_yyx': 0.00021982661789348812, 'L_scale_weight_yyx': 3.0580786569381795e-09, 'learning_rate_yyx': 0.009663736567982592}. Best is trial 24 with value: -2.806529472032402.
[I 2026-03-18 17:01:23,817] Trial 34 pruned. 
[I 2026-03-18 17:01:24,887] Trial 44 finished with value: -2.8031088720679107 and parameters: {'n_layers_yyx': 1, 'hidden_size_yyx_l0': 6, 'context_size_yyx': 4, 'num_mix_components_yyx': 5, 'context_extractor_yyx': 'lstm', 'activation_func_yyx': 'GELU', 'L2_weight_yyx': 1.8142497224431323e-08, 'L_entropy_weight_yyx': 1.3508504034891237e-05, 'L_sep_weight_yyx': 4.431320772450073e-10, 'L_scale_weight_yyx': 4.7334430574350496e-07, 'learning_rate_yyx': 0.008681726585610054}. Best is trial 27 with value: -2.804336680449664.
[I 2026-03-18 17:01:26,076] Trial 41 finished with value: -2.7955750335703407 and parameters: {'n_layers_yyx': 1, 'hidden_size_yyx_l0': 6, 'context_size_yyx': 4, 'num_mix_components_yyx': 4, 'context_extractor_yyx': 'lstm', 'activation_func_yyx': 'Tanh', 'L2_weight_yyx': 7.861223254285207e-08, 'L_entropy_weight_yyx': 8.336515717688479e-05, 'L_sep_weight_yyx': 8.878940708837432e-05, 'L_scale_weight_yyx': 6.9994588247853125e-09, 'learning_rate_yyx': 0.008835296295631786}. Best is trial 14 with value: -2.7995943704403503.
[I 2026-03-18 17:01:28,863] Trial 41 pruned. 
[I 2026-03-18 17:01:29,115] Trial 46 pruned. 
[I 2026-03-18 17:01:29,374] Trial 35 pruned. 
[I 2026-03-18 17:01:34,954] Trial 33 pruned. 
[I 2026-03-18 17:01:41,457] Trial 41 finished with value: -2.794259756882564 and parameters: {'n_layers_yyx': 1, 'hidden_size_yyx_l0': 4, 'context_size_yyx': 4, 'num_mix_components_yyx': 4, 'context_extractor_yyx': 'lstm', 'activation_func_yyx': 'GELU', 'L2_weight_yyx': 1.3688507854088306e-08, 'L_entropy_weight_yyx': 2.647565264448569e-09, 'L_sep_weight_yyx': 1.8356867062403727e-07, 'L_scale_weight_yyx': 4.305641657935839e-06, 'learning_rate_yyx': 0.004782398307789513}. Best is trial 37 with value: -2.796764404134978.
[I 2026-03-18 17:01:42,927] Trial 43 pruned. 
[I 2026-03-18 17:01:43,658] Trial 36 pruned. 
[I 2026-03-18 17:01:50,845] Trial 37 pruned. 
[I 2026-03-18 17:01:53,282] Trial 29 finished with value: -2.781238512588328 and parameters: {'n_layers_yyx': 2, 'hidden_size_yyx_l0': 3, 'hidden_size_yyx_l1': 5, 'context_size_yyx': 2, 'num_mix_components_yyx': 2, 'context_extractor_yyx': 'lstm', 'activation_func_yyx': 'Tanh', 'L2_weight_yyx': 8.036552487965963e-06, 'L_entropy_weight_yyx': 2.6854583441826897e-10, 'L_sep_weight_yyx': 2.8080444955157378e-08, 'L_scale_weight_yyx': 2.531707288051424e-07, 'learning_rate_yyx': 0.009705041774912174}. Best is trial 21 with value: -2.786583013031271.
[I 2026-03-18 17:01:56,659] Trial 34 pruned. 
[I 2026-03-18 17:01:57,060] Trial 44 pruned. 
[I 2026-03-18 17:02:02,192] Trial 45 finished with value: -2.7996897741425806 and parameters: {'n_layers_yyx': 1, 'hidden_size_yyx_l0': 5, 'context_size_yyx': 4, 'num_mix_components_yyx': 4, 'context_extractor_yyx': 'lstm', 'activation_func_yyx': 'Tanh', 'L2_weight_yyx': 3.9304886164770784e-05, 'L_entropy_weight_yyx': 3.061109630897904e-06, 'L_sep_weight_yyx': 2.044132316409823e-10, 'L_scale_weight_yyx': 3.8538996027792846e-05, 'learning_rate_yyx': 0.00799017856871788}. Best is trial 45 with value: -2.7996897741425806.
[I 2026-03-18 17:02:04,844] Trial 42 pruned. 
[I 2026-03-18 17:02:07,235] Trial 30 pruned. 
[I 2026-03-18 17:02:10,938] Trial 35 pruned. 
[I 2026-03-18 17:02:11,790] Trial 41 finished with value: -2.8073655760360414 and parameters: {'n_layers_yyx': 1, 'hidden_size_yyx_l0': 3, 'context_size_yyx': 4, 'num_mix_components_yyx': 5, 'context_extractor_yyx': 'lstm', 'activation_func_yyx': 'ReLU', 'L2_weight_yyx': 4.9057570693561576e-09, 'L_entropy_weight_yyx': 1.3944389941956028e-09, 'L_sep_weight_yyx': 3.3486852590456146e-05, 'L_scale_weight_yyx': 2.1739364073055997e-07, 'learning_rate_yyx': 0.009953700223310684}. Best is trial 41 with value: -2.8073655760360414.
[I 2026-03-18 17:02:21,706] Trial 37 pruned. 
[I 2026-03-18 17:02:26,020] Trial 45 finished with value: -2.7992780778931485 and parameters: {'n_layers_yyx': 1, 'hidden_size_yyx_l0': 5, 'context_size_yyx': 4, 'num_mix_components_yyx': 5, 'context_extractor_yyx': 'lstm', 'activation_func_yyx': 'GELU', 'L2_weight_yyx': 1.799972263999135e-08, 'L_entropy_weight_yyx': 3.976644895824532e-06, 'L_sep_weight_yyx': 3.9809341066777516e-10, 'L_scale_weight_yyx': 4.781715035778812e-07, 'learning_rate_yyx': 0.009606353882636786}. Best is trial 27 with value: -2.804336680449664.
[I 2026-03-18 17:02:34,299] Trial 42 finished with value: -2.799544951458059 and parameters: {'n_layers_yyx': 1, 'hidden_size_yyx_l0': 6, 'context_size_yyx': 4, 'num_mix_components_yyx': 4, 'context_extractor_yyx': 'lstm', 'activation_func_yyx': 'Tanh', 'L2_weight_yyx': 7.405500057005134e-08, 'L_entropy_weight_yyx': 8.173291260112485e-05, 'L_sep_weight_yyx': 0.0004228302926345853, 'L_scale_weight_yyx': 3.427946015946956e-09, 'learning_rate_yyx': 0.008649912220002493}. Best is trial 14 with value: -2.7995943704403503.
[I 2026-03-18 17:02:35,610] Trial 45 pruned. 
[I 2026-03-18 17:02:41,261] Trial 46 pruned. 
[I 2026-03-18 17:02:41,605] Trial 34 finished with value: -2.8043707484134655 and parameters: {'n_layers_yyx': 2, 'hidden_size_yyx_l0': 5, 'hidden_size_yyx_l1': 3, 'context_size_yyx': 4, 'num_mix_components_yyx': 5, 'context_extractor_yyx': 'lstm', 'activation_func_yyx': 'ReLU', 'L2_weight_yyx': 2.301747952867069e-10, 'L_entropy_weight_yyx': 9.045619973706111e-07, 'L_sep_weight_yyx': 2.9570507917854595e-06, 'L_scale_weight_yyx': 5.0760987991177104e-06, 'learning_rate_yyx': 0.007765245873309595}. Best is trial 6 with value: -2.805382927239302.
[I 2026-03-18 17:02:45,888] Trial 31 pruned. 
[I 2026-03-18 17:02:47,011] Trial 47 pruned. 
[I 2026-03-18 17:02:49,591] Trial 42 pruned. 
[I 2026-03-18 17:02:50,497] Trial 36 pruned. 
[I 2026-03-18 17:03:00,764] Trial 48 pruned. 
[I 2026-03-18 17:03:03,496] Trial 43 pruned. 
[I 2026-03-18 17:03:03,966] Trial 32 finished with value: -2.806106134987971 and parameters: {'n_layers_yyx': 2, 'hidden_size_yyx_l0': 5, 'hidden_size_yyx_l1': 5, 'context_size_yyx': 3, 'num_mix_components_yyx': 3, 'context_extractor_yyx': 'lstm', 'activation_func_yyx': 'Tanh', 'L2_weight_yyx': 4.719667180389675e-05, 'L_entropy_weight_yyx': 3.007066540297588e-10, 'L_sep_weight_yyx': 5.1611452961997586e-05, 'L_scale_weight_yyx': 7.366822695621047e-09, 'learning_rate_yyx': 0.008463638724602651}. Best is trial 24 with value: -2.806529472032402.
[I 2026-03-18 17:03:04,494] Trial 46 pruned. 
[I 2026-03-18 17:03:06,493] Trial 33 finished with value: -2.804840652198648 and parameters: {'n_layers_yyx': 2, 'hidden_size_yyx_l0': 4, 'hidden_size_yyx_l1': 4, 'context_size_yyx': 4, 'num_mix_components_yyx': 5, 'context_extractor_yyx': 'lstm', 'activation_func_yyx': 'Tanh', 'L2_weight_yyx': 3.7719830642867984e-07, 'L_entropy_weight_yyx': 3.5750189394555216e-08, 'L_sep_weight_yyx': 2.0651364300248502e-05, 'L_scale_weight_yyx': 0.0003430163991992134, 'learning_rate_yyx': 0.008133121587570265}. Best is trial 5 with value: -2.8058216093098.
[I 2026-03-18 17:03:10,452] Trial 47 pruned. 
[I 2026-03-18 17:03:14,610] Trial 49 pruned. 

Source events: 31112
Target events: 13628
Full model ln_yyx : 1919.33996 nats/sec, 126.75418 nats/event
Full model Log loss : -2.77514
Full model ln_yyx : 1949.64089 nats/sec, 128.75527 nats/event
Full model Log loss : -2.80242
Full model ln_yyx : 1947.93376 nats/sec, 128.64253 nats/event
Full model Log loss : -2.79920
Full model ln_yyx : 1946.43722 nats/sec, 128.54370 nats/event
Full model Log loss : -2.80513
Full model ln_yyx : 1952.14824 nats/sec, 128.92086 nats/event
Full model Log loss : -2.80159
Full model ln_yyx : 1938.84371 nats/sec, 128.04222 nats/event
Full model Log loss : -2.79773
Full model ln_yyx : 1940.45456 nats/sec, 128.14860 nats/event
Full model Log loss : -2.78995
Full model ln_yyx : 1943.35333 nats/sec, 128.34004 nats/event
Full model Log loss : -2.80400
Full model ln_yyx : 1953.39050 nats/sec, 129.00289 nats/event
Full model Log loss : -2.80398
Full model ln_yyx : 1949.39092 nats/sec, 128.73876 nats/event
Full model Log loss : -2.80242
Full model ln_yyx : 1949.90493 nats/sec, 128.77271 nats/event
Full model Log loss : -2.80255
Full model ln_yyx : 1949.34989 nats/sec, 128.73605 nats/event
Full model Log loss : -2.80241
Full model ln_yyx : 1951.57418 nats/sec, 128.88294 nats/event
Full model Log loss : -2.80348
Optimization finished. Config saved to results/opt-full/opt_full_10_best_config.txt
[I 2026-03-18 17:03:16,456] Trial 48 pruned. 
[I 2026-03-18 17:03:17,173] Trial 44 pruned. 
[I 2026-03-18 17:03:18,081] Trial 33 pruned. 
[I 2026-03-18 17:03:19,289] Trial 43 finished with value: -2.795633757550111 and parameters: {'n_layers_yyx': 1, 'hidden_size_yyx_l0': 6, 'context_size_yyx': 4, 'num_mix_components_yyx': 4, 'context_extractor_yyx': 'lstm', 'activation_func_yyx': 'Tanh', 'L2_weight_yyx': 5.7156248511770986e-08, 'L_entropy_weight_yyx': 8.61300235457485e-05, 'L_sep_weight_yyx': 0.00047043928097125084, 'L_scale_weight_yyx': 2.3959401131985025e-09, 'learning_rate_yyx': 0.008955350257909755}. Best is trial 14 with value: -2.7995943704403503.
[I 2026-03-18 17:03:20,320] Trial 34 pruned. 
[I 2026-03-18 17:03:21,595] Trial 49 pruned. 

Source events: 31112
Target events: 18269
Full model ln_yyx : 2579.68441 nats/sec, 127.08501 nats/event
Full model Log loss : -2.78216
Full model ln_yyx : 2613.32249 nats/sec, 128.74214 nats/event
Full model Log loss : -2.79557
Full model ln_yyx : 2619.02054 nats/sec, 129.02285 nats/event
Full model Log loss : -2.80141
Full model ln_yyx : 2614.01585 nats/sec, 128.77630 nats/event
Full model Log loss : -2.80373
Full model ln_yyx : 2623.93459 nats/sec, 129.26494 nats/event
Full model Log loss : -2.80085
Full model ln_yyx : 2600.23010 nats/sec, 128.09716 nats/event
Full model Log loss : -2.80343
Full model ln_yyx : 2603.27567 nats/sec, 128.24720 nats/event
Full model Log loss : -2.80142
Full model ln_yyx : 2602.45622 nats/sec, 128.20683 nats/event
Full model Log loss : -2.79605
Full model ln_yyx : 2620.50876 nats/sec, 129.09617 nats/event
Full model Log loss : -2.79842
Full model ln_yyx : 2604.75459 nats/sec, 128.32006 nats/event
Full model Log loss : -2.80434
Full model ln_yyx : 2615.81896 nats/sec, 128.86513 nats/event
Full model Log loss : -2.80311
Full model ln_yyx : 2602.68491 nats/sec, 128.21810 nats/event
Full model Log loss : -2.79928
Optimization finished. Config saved to results/opt-full/opt_full_9_best_config.txt
[I 2026-03-18 17:03:23,653] Trial 34 pruned. 
[I 2026-03-18 17:03:26,219] Trial 35 pruned. 
[I 2026-03-18 17:03:29,181] Trial 37 pruned. 
[I 2026-03-18 17:03:29,432] Trial 46 finished with value: -2.7997979326210474 and parameters: {'n_layers_yyx': 1, 'hidden_size_yyx_l0': 5, 'context_size_yyx': 4, 'num_mix_components_yyx': 4, 'context_extractor_yyx': 'lstm', 'activation_func_yyx': 'Tanh', 'L2_weight_yyx': 2.6217109313139608e-05, 'L_entropy_weight_yyx': 1.8638798245036627e-06, 'L_sep_weight_yyx': 2.3844244467307164e-10, 'L_scale_weight_yyx': 2.3980477835262265e-05, 'learning_rate_yyx': 0.007909517260637842}. Best is trial 46 with value: -2.7997979326210474.
[I 2026-03-18 17:03:30,388] Trial 42 finished with value: -2.7950189524683458 and parameters: {'n_layers_yyx': 1, 'hidden_size_yyx_l0': 4, 'context_size_yyx': 4, 'num_mix_components_yyx': 4, 'context_extractor_yyx': 'lstm', 'activation_func_yyx': 'GELU', 'L2_weight_yyx': 2.0322503418588128e-08, 'L_entropy_weight_yyx': 9.362310934243527e-10, 'L_sep_weight_yyx': 2.476485484183998e-07, 'L_scale_weight_yyx': 6.109714557397501e-06, 'learning_rate_yyx': 0.004828587427722819}. Best is trial 37 with value: -2.796764404134978.
[I 2026-03-18 17:03:37,211] Trial 35 pruned. 
[I 2026-03-18 17:03:47,604] Trial 32 finished with value: -2.7803865788217057 and parameters: {'n_layers_yyx': 2, 'hidden_size_yyx_l0': 4, 'hidden_size_yyx_l1': 6, 'context_size_yyx': 3, 'num_mix_components_yyx': 1, 'context_extractor_yyx': 'lstm', 'activation_func_yyx': 'Tanh', 'L2_weight_yyx': 8.198307266651736e-07, 'L_entropy_weight_yyx': 1.8432288300335993e-09, 'L_sep_weight_yyx': 8.931543020888378e-09, 'L_scale_weight_yyx': 7.899932054653479e-08, 'learning_rate_yyx': 0.00976744062883271}. Best is trial 21 with value: -2.786583013031271.
[I 2026-03-18 17:03:48,547] Trial 43 pruned. 
[I 2026-03-18 17:03:50,810] Trial 36 pruned. 
[I 2026-03-18 17:03:53,359] Trial 33 pruned. 
[I 2026-03-18 17:03:53,644] Trial 44 pruned. 
[I 2026-03-18 17:03:54,244] Trial 45 pruned. 
[I 2026-03-18 17:03:55,953] Trial 44 pruned. 
[I 2026-03-18 17:03:56,434] Trial 37 pruned. 
[I 2026-03-18 17:03:59,778] Trial 47 finished with value: -2.8064091088943095 and parameters: {'n_layers_yyx': 2, 'hidden_size_yyx_l0': 4, 'hidden_size_yyx_l1': 5, 'context_size_yyx': 3, 'num_mix_components_yyx': 3, 'context_extractor_yyx': 'gru', 'activation_func_yyx': 'GELU', 'L2_weight_yyx': 0.00010690513291058612, 'L_entropy_weight_yyx': 3.1537711626198657e-10, 'L_sep_weight_yyx': 5.12201821050108e-09, 'L_scale_weight_yyx': 5.0329138261546706e-08, 'learning_rate_yyx': 0.005824603972017089}. Best is trial 0 with value: -2.8067502106217272.
[I 2026-03-18 17:04:01,882] Trial 38 pruned. 
[I 2026-03-18 17:04:05,351] Trial 48 pruned. 
[I 2026-03-18 17:04:07,179] Trial 38 finished with value: -2.795466424127794 and parameters: {'n_layers_yyx': 2, 'hidden_size_yyx_l0': 5, 'hidden_size_yyx_l1': 4, 'context_size_yyx': 3, 'num_mix_components_yyx': 1, 'context_extractor_yyx': 'gru', 'activation_func_yyx': 'ReLU', 'L2_weight_yyx': 3.3676830428201672e-09, 'L_entropy_weight_yyx': 1.4167878087275014e-07, 'L_sep_weight_yyx': 2.8246703298342874e-08, 'L_scale_weight_yyx': 6.706004198761085e-08, 'learning_rate_yyx': 0.005560748512265695}. Best is trial 5 with value: -2.805070761203844.
[I 2026-03-18 17:04:07,424] Trial 38 pruned. 
[I 2026-03-18 17:04:19,286] Trial 47 finished with value: -2.7935033504199605 and parameters: {'n_layers_yyx': 1, 'hidden_size_yyx_l0': 6, 'context_size_yyx': 4, 'num_mix_components_yyx': 4, 'context_extractor_yyx': 'lstm', 'activation_func_yyx': 'Tanh', 'L2_weight_yyx': 3.805793091635147e-05, 'L_entropy_weight_yyx': 2.0048011223370872e-06, 'L_sep_weight_yyx': 2.481527079351925e-10, 'L_scale_weight_yyx': 2.5460126888373595e-05, 'learning_rate_yyx': 0.00827785239524178}. Best is trial 46 with value: -2.7997979326210474.
[I 2026-03-18 17:04:20,560] Trial 39 pruned. 
[I 2026-03-18 17:04:29,002] Trial 45 pruned. 
[I 2026-03-18 17:04:30,797] Trial 34 pruned. 
[I 2026-03-18 17:04:32,967] Trial 38 finished with value: -2.802642387798386 and parameters: {'n_layers_yyx': 1, 'hidden_size_yyx_l0': 6, 'context_size_yyx': 4, 'num_mix_components_yyx': 1, 'context_extractor_yyx': 'lstm', 'activation_func_yyx': 'ReLU', 'L2_weight_yyx': 1.7671025420953383e-06, 'L_entropy_weight_yyx': 2.8753199181781573e-05, 'L_sep_weight_yyx': 5.871570162579431e-07, 'L_scale_weight_yyx': 3.5485856863821577e-06, 'learning_rate_yyx': 0.0008478288138002367}. Best is trial 7 with value: -2.8073737460176833.
[I 2026-03-18 17:04:40,327] Trial 35 finished with value: -2.800542123226814 and parameters: {'n_layers_yyx': 2, 'hidden_size_yyx_l0': 5, 'hidden_size_yyx_l1': 2, 'context_size_yyx': 3, 'num_mix_components_yyx': 4, 'context_extractor_yyx': 'lstm', 'activation_func_yyx': 'ReLU', 'L2_weight_yyx': 1.1083551236893432e-10, 'L_entropy_weight_yyx': 4.811706905557436e-06, 'L_sep_weight_yyx': 2.149464016077005e-06, 'L_scale_weight_yyx': 7.2168424872979885e-06, 'learning_rate_yyx': 0.007014676033676565}. Best is trial 6 with value: -2.805382927239302.
[I 2026-03-18 17:04:41,532] Trial 46 pruned. 
[I 2026-03-18 17:04:44,070] Trial 39 pruned. 
[I 2026-03-18 17:04:44,325] Trial 35 pruned. 
[I 2026-03-18 17:04:46,358] Trial 39 pruned. 
[I 2026-03-18 17:04:49,761] Trial 36 pruned. 
[I 2026-03-18 17:04:52,039] Trial 40 pruned. 
[I 2026-03-18 17:04:54,306] Trial 47 pruned. 
[I 2026-03-18 17:04:54,404] Trial 48 pruned. 
[I 2026-03-18 17:04:57,551] Trial 40 pruned. 
[I 2026-03-18 17:04:57,773] Trial 40 pruned. 
[I 2026-03-18 17:05:05,194] Trial 41 pruned. 
[I 2026-03-18 17:05:07,396] Trial 48 pruned. 
[I 2026-03-18 17:05:08,969] Trial 49 finished with value: -2.7961457542303325 and parameters: {'n_layers_yyx': 2, 'hidden_size_yyx_l0': 4, 'hidden_size_yyx_l1': 6, 'context_size_yyx': 4, 'num_mix_components_yyx': 2, 'context_extractor_yyx': 'lstm', 'activation_func_yyx': 'ReLU', 'L2_weight_yyx': 0.00010263092103820196, 'L_entropy_weight_yyx': 0.00028737591359839966, 'L_sep_weight_yyx': 6.254835101594444e-09, 'L_scale_weight_yyx': 4.761697913154921e-08, 'learning_rate_yyx': 0.008776030846209086}. Best is trial 0 with value: -2.8067502106217272.

Source events: 31112
Target events: 12539
Full model ln_yyx : 1796.87871 nats/sec, 128.97287 nats/event
Full model Log loss : -2.80675
Full model ln_yyx : 1768.63995 nats/sec, 126.94600 nats/event
Full model Log loss : -2.76613
Full model ln_yyx : 1800.88179 nats/sec, 129.26020 nats/event
Full model Log loss : -2.80194
Full model ln_yyx : 1800.79390 nats/sec, 129.25389 nats/event
Full model Log loss : -2.80151
Full model ln_yyx : 1798.28310 nats/sec, 129.07367 nats/event
Full model Log loss : -2.79943
Full model ln_yyx : 1790.31671 nats/sec, 128.50188 nats/event
Full model Log loss : -2.79497
Full model ln_yyx : 1789.52557 nats/sec, 128.44509 nats/event
Full model Log loss : -2.79220
Full model ln_yyx : 1799.00442 nats/sec, 129.12545 nats/event
Full model Log loss : -2.79921
Full model ln_yyx : 1798.12417 nats/sec, 129.06227 nats/event
Full model Log loss : -2.80229
Full model ln_yyx : 1794.92377 nats/sec, 128.83255 nats/event
Full model Log loss : -2.80003
Full model ln_yyx : 1791.82037 nats/sec, 128.60980 nats/event
Full model Log loss : -2.80146
Full model ln_yyx : 1803.26737 nats/sec, 129.43142 nats/event
Full model Log loss : -2.80118
Full model ln_yyx : 1805.69119 nats/sec, 129.60540 nats/event
Full model Log loss : -2.80372
Full model ln_yyx : 1795.80949 nats/sec, 128.89613 nats/event
Full model Log loss : -2.80641
Full model ln_yyx : 1783.03157 nats/sec, 127.97898 nats/event
Full model Log loss : -2.79615
Optimization finished. Config saved to results/opt-full/opt_full_14_best_config.txt
[I 2026-03-18 17:05:11,262] Trial 41 pruned. 
[I 2026-03-18 17:05:11,735] Trial 41 pruned. 
