[I 2026-03-18 19:24:29,069] Trial 43 finished with value: -2.286580094859241 and parameters: {'n_layers_yyx': 2, 'hidden_size_yyx_l0': 6, 'hidden_size_yyx_l1': 6, 'context_size_yyx': 4, 'num_mix_components_yyx': 2, 'context_extractor_yyx': 'lstm', 'activation_func_yyx': 'ReLU', 'L2_weight_yyx': 1.9152389182860137e-07, 'L_entropy_weight_yyx': 0.0001642634117701, 'L_sep_weight_yyx': 2.0543654671564694e-06, 'L_scale_weight_yyx': 1.0721214512330077e-10, 'learning_rate_yyx': 0.006697863097045982}. Best is trial 43 with value: -2.286580094859241.
[I 2026-03-18 19:24:34,775] Trial 39 finished with value: -1.7655972362640355 and parameters: {'n_layers_yyx': 2, 'hidden_size_yyx_l0': 6, 'hidden_size_yyx_l1': 4, 'context_size_yyx': 2, 'num_mix_components_yyx': 1, 'context_extractor_yyx': 'lstm', 'activation_func_yyx': 'ReLU', 'L2_weight_yyx': 6.9089680889994985e-09, 'L_entropy_weight_yyx': 8.907234768356389e-10, 'L_sep_weight_yyx': 4.807181542798913e-10, 'L_scale_weight_yyx': 1.4472960533010922e-07, 'learning_rate_yyx': 0.008420656022532107}. Best is trial 1 with value: -1.7684712210476057.
[I 2026-03-18 19:24:34,812] Trial 22 finished with value: -2.2858763901373162 and parameters: {'n_layers_yyx': 1, 'hidden_size_yyx_l0': 5, 'context_size_yyx': 3, 'num_mix_components_yyx': 2, 'context_extractor_yyx': 'gru', 'activation_func_yyx': 'ReLU', 'L2_weight_yyx': 5.468208102600835e-10, 'L_entropy_weight_yyx': 7.027503808773627e-08, 'L_sep_weight_yyx': 8.973310294158337e-08, 'L_scale_weight_yyx': 2.396874376371241e-10, 'learning_rate_yyx': 0.006539006161168464}. Best is trial 19 with value: -2.286228705678167.
[I 2026-03-18 19:24:39,724] Trial 35 pruned. 
[I 2026-03-18 19:24:39,801] Trial 44 pruned. 
[I 2026-03-18 19:24:44,310] Trial 30 pruned. 
[I 2026-03-18 19:24:46,649] Trial 28 pruned. 
[I 2026-03-18 19:24:56,388] Trial 40 pruned. 
[I 2026-03-18 19:24:58,583] Trial 29 pruned. 
[I 2026-03-18 19:25:00,769] Trial 28 finished with value: -2.2702968642382912 and parameters: {'n_layers_yyx': 2, 'hidden_size_yyx_l0': 2, 'hidden_size_yyx_l1': 6, 'context_size_yyx': 4, 'num_mix_components_yyx': 4, 'context_extractor_yyx': 'lstm', 'activation_func_yyx': 'GELU', 'L2_weight_yyx': 2.0744108494642417e-06, 'L_entropy_weight_yyx': 7.257441038782611e-10, 'L_sep_weight_yyx': 3.181041616147889e-05, 'L_scale_weight_yyx': 2.706105426643739e-08, 'learning_rate_yyx': 0.003793891965399124}. Best is trial 2 with value: -2.272224617884258.
[I 2026-03-18 19:25:02,355] Trial 36 pruned. 
[I 2026-03-18 19:25:03,654] Trial 45 pruned. 
[I 2026-03-18 19:25:10,592] Trial 45 pruned. 
[I 2026-03-18 19:25:11,881] Trial 29 pruned. 
[I 2026-03-18 19:25:11,940] Trial 29 pruned. 
[I 2026-03-18 19:25:12,005] Trial 35 finished with value: -1.7833586351799242 and parameters: {'n_layers_yyx': 2, 'hidden_size_yyx_l0': 2, 'hidden_size_yyx_l1': 5, 'context_size_yyx': 4, 'num_mix_components_yyx': 5, 'context_extractor_yyx': 'lstm', 'activation_func_yyx': 'ReLU', 'L2_weight_yyx': 4.0882614520716586e-05, 'L_entropy_weight_yyx': 1.7348389207254718e-07, 'L_sep_weight_yyx': 4.2884337374176155e-07, 'L_scale_weight_yyx': 0.00028571500338994433, 'learning_rate_yyx': 0.005399214972145304}. Best is trial 18 with value: -1.7861539220328282.
[I 2026-03-18 19:25:15,810] Trial 46 pruned. 
[I 2026-03-18 19:25:21,329] Trial 33 pruned. 
[I 2026-03-18 19:25:22,227] Trial 30 pruned. 
[I 2026-03-18 19:25:22,613] Trial 30 pruned. 
[I 2026-03-18 19:25:28,880] Trial 42 finished with value: -1.7806226687323778 and parameters: {'n_layers_yyx': 2, 'hidden_size_yyx_l0': 2, 'hidden_size_yyx_l1': 4, 'context_size_yyx': 4, 'num_mix_components_yyx': 3, 'context_extractor_yyx': 'gru', 'activation_func_yyx': 'Tanh', 'L2_weight_yyx': 3.2632790978113976e-09, 'L_entropy_weight_yyx': 2.6383232002611875e-10, 'L_sep_weight_yyx': 1.3068999747852686e-06, 'L_scale_weight_yyx': 4.338068849369035e-07, 'learning_rate_yyx': 0.009953850243030757}. Best is trial 4 with value: -1.7807932306351817.
[I 2026-03-18 19:25:34,806] Trial 36 pruned. 
[I 2026-03-18 19:25:39,027] Trial 47 pruned. 
[I 2026-03-18 19:25:44,915] Trial 31 pruned. 
[I 2026-03-18 19:25:46,638] Trial 31 pruned. 
[I 2026-03-18 19:25:49,884] Trial 41 pruned. 
[I 2026-03-18 19:25:50,727] Trial 48 pruned. 
[I 2026-03-18 19:25:51,968] Trial 43 finished with value: -1.7746188362077335 and parameters: {'n_layers_yyx': 2, 'hidden_size_yyx_l0': 6, 'hidden_size_yyx_l1': 6, 'context_size_yyx': 3, 'num_mix_components_yyx': 3, 'context_extractor_yyx': 'lstm', 'activation_func_yyx': 'ReLU', 'L2_weight_yyx': 3.4289823805053773e-09, 'L_entropy_weight_yyx': 5.5435610796088776e-05, 'L_sep_weight_yyx': 3.5620498846851986e-09, 'L_scale_weight_yyx': 2.110594261937724e-06, 'learning_rate_yyx': 0.007243440028954042}. Best is trial 4 with value: -1.7775746924677662.
[I 2026-03-18 19:26:03,844] Trial 49 pruned. 

Source events: 20800
Target events: 54211
Full model ln_yyx : 4494.01504 nats/sec, 74.60872 nats/event
Full model Log loss : -2.27402
Full model ln_yyx : 4404.25880 nats/sec, 73.11861 nats/event
Full model Log loss : -2.25922
Full model ln_yyx : 4465.23539 nats/sec, 74.13093 nats/event
Full model Log loss : -2.27611
Full model ln_yyx : 4454.22819 nats/sec, 73.94819 nats/event
Full model Log loss : -2.27222
Full model ln_yyx : 4491.29677 nats/sec, 74.56360 nats/event
Full model Log loss : -2.28534
Full model ln_yyx : 4496.26672 nats/sec, 74.64611 nats/event
Full model Log loss : -2.28511
Full model ln_yyx : 4469.92026 nats/sec, 74.20871 nats/event
Full model Log loss : -2.28341
Full model ln_yyx : 4484.60486 nats/sec, 74.45250 nats/event
Full model Log loss : -2.28416
Full model ln_yyx : 4499.73335 nats/sec, 74.70366 nats/event
Full model Log loss : -2.28423
Full model ln_yyx : 4446.54328 nats/sec, 73.82061 nats/event
Full model Log loss : -2.27964
Full model ln_yyx : 4435.60578 nats/sec, 73.63903 nats/event
Full model Log loss : -2.26403
Full model ln_yyx : 4467.51174 nats/sec, 74.16872 nats/event
Full model Log loss : -2.28177
Full model ln_yyx : 4501.18997 nats/sec, 74.72784 nats/event
Full model Log loss : -2.28658
Optimization finished. Config saved to results/opt-full/opt_full_208_best_config.txt
[I 2026-03-18 19:26:05,662] Trial 32 pruned. 
[I 2026-03-18 19:26:08,983] Trial 30 pruned. 
[I 2026-03-18 19:26:10,668] Trial 46 pruned. 
[I 2026-03-18 19:26:11,473] Trial 42 pruned. 
[I 2026-03-18 19:26:11,641] Trial 35 finished with value: -1.7759152835017071 and parameters: {'n_layers_yyx': 1, 'hidden_size_yyx_l0': 4, 'context_size_yyx': 3, 'num_mix_components_yyx': 5, 'context_extractor_yyx': 'gru', 'activation_func_yyx': 'Tanh', 'L2_weight_yyx': 4.418359335671064e-06, 'L_entropy_weight_yyx': 0.0005939090815726615, 'L_sep_weight_yyx': 2.0212622243248403e-06, 'L_scale_weight_yyx': 1.679042501715025e-05, 'learning_rate_yyx': 0.005914879178864398}. Best is trial 2 with value: -1.776406202226865.
[I 2026-03-18 19:26:13,892] Trial 23 finished with value: -2.2764368736612606 and parameters: {'n_layers_yyx': 1, 'hidden_size_yyx_l0': 5, 'context_size_yyx': 3, 'num_mix_components_yyx': 2, 'context_extractor_yyx': 'gru', 'activation_func_yyx': 'ReLU', 'L2_weight_yyx': 3.9151331394527447e-10, 'L_entropy_weight_yyx': 4.916285564412125e-09, 'L_sep_weight_yyx': 8.229736669596965e-08, 'L_scale_weight_yyx': 1.0984098178128942e-10, 'learning_rate_yyx': 0.006978521899856135}. Best is trial 19 with value: -2.286228705678167.
[I 2026-03-18 19:26:20,525] Trial 43 pruned. 
[I 2026-03-18 19:26:21,867] Trial 38 finished with value: -2.2704473899365056 and parameters: {'n_layers_yyx': 2, 'hidden_size_yyx_l0': 3, 'hidden_size_yyx_l1': 5, 'context_size_yyx': 4, 'num_mix_components_yyx': 5, 'context_extractor_yyx': 'gru', 'activation_func_yyx': 'GELU', 'L2_weight_yyx': 7.36220571990284e-09, 'L_entropy_weight_yyx': 9.434311790846936e-09, 'L_sep_weight_yyx': 0.00019758659458986354, 'L_scale_weight_yyx': 5.615642656005959e-07, 'learning_rate_yyx': 0.0023832988341606354}. Best is trial 22 with value: -2.2897814149518054.
[I 2026-03-18 19:26:26,091] Trial 33 pruned. 
[I 2026-03-18 19:26:33,802] Trial 47 pruned. 
[I 2026-03-18 19:26:34,283] Trial 43 pruned. 
[I 2026-03-18 19:26:35,856] Trial 26 finished with value: -2.213527347033483 and parameters: {'n_layers_yyx': 2, 'hidden_size_yyx_l0': 5, 'hidden_size_yyx_l1': 5, 'context_size_yyx': 4, 'num_mix_components_yyx': 5, 'context_extractor_yyx': 'gru', 'activation_func_yyx': 'GELU', 'L2_weight_yyx': 7.533553012427304e-07, 'L_entropy_weight_yyx': 2.0585153781751524e-06, 'L_sep_weight_yyx': 5.7848157619557665e-06, 'L_scale_weight_yyx': 1.6353028952438935e-08, 'learning_rate_yyx': 0.009588614432380524}. Best is trial 12 with value: -2.2168161654612635.
[I 2026-03-18 19:26:38,122] Trial 34 pruned. 
[I 2026-03-18 19:26:45,367] Trial 48 pruned. 
[I 2026-03-18 19:26:47,403] Trial 27 pruned. 
[I 2026-03-18 19:26:59,244] Trial 49 pruned. 

Source events: 20800
Target events: 31112
Full model ln_yyx : 2557.61037 nats/sec, 73.98590 nats/event
Full model Log loss : -2.28386
Full model ln_yyx : 2577.68086 nats/sec, 74.56649 nats/event
Full model Log loss : -2.28816
Full model ln_yyx : 2548.28229 nats/sec, 73.71606 nats/event
Full model Log loss : -2.26805
Full model ln_yyx : 2546.83794 nats/sec, 73.67428 nats/event
Full model Log loss : -2.26327
Full model ln_yyx : 2563.22888 nats/sec, 74.14843 nats/event
Full model Log loss : -2.27156
Full model ln_yyx : 2538.74683 nats/sec, 73.44022 nats/event
Full model Log loss : -2.26684
Full model ln_yyx : 2576.35615 nats/sec, 74.52817 nats/event
Full model Log loss : -2.28449
Full model ln_yyx : 2561.65734 nats/sec, 74.10297 nats/event
Full model Log loss : -2.26539
Full model ln_yyx : 2580.29066 nats/sec, 74.64199 nats/event
Full model Log loss : -2.28315
Full model ln_yyx : 2580.21385 nats/sec, 74.63977 nats/event
Full model Log loss : -2.28321
Full model ln_yyx : 2553.12919 nats/sec, 73.85627 nats/event
Full model Log loss : -2.26491
Full model ln_yyx : 2579.11785 nats/sec, 74.60806 nats/event
Full model Log loss : -2.28325
Full model ln_yyx : 2544.07096 nats/sec, 73.59424 nats/event
Full model Log loss : -2.28308
Optimization finished. Config saved to results/opt-full/opt_full_204_best_config.txt
[I 2026-03-18 19:27:06,464] Trial 32 finished with value: -1.862962815334467 and parameters: {'n_layers_yyx': 2, 'hidden_size_yyx_l0': 4, 'hidden_size_yyx_l1': 4, 'context_size_yyx': 4, 'num_mix_components_yyx': 5, 'context_extractor_yyx': 'lstm', 'activation_func_yyx': 'ReLU', 'L2_weight_yyx': 1.0139265654539862e-09, 'L_entropy_weight_yyx': 0.00016172632236244512, 'L_sep_weight_yyx': 1.3266361400580878e-06, 'L_scale_weight_yyx': 0.0005162404354849395, 'learning_rate_yyx': 0.0013929935683858407}. Best is trial 5 with value: -1.864091702761834.
[I 2026-03-18 19:27:07,309] Trial 28 finished with value: -2.2734211243497553 and parameters: {'n_layers_yyx': 1, 'hidden_size_yyx_l0': 5, 'context_size_yyx': 3, 'num_mix_components_yyx': 3, 'context_extractor_yyx': 'gru', 'activation_func_yyx': 'Tanh', 'L2_weight_yyx': 0.00011334912865665617, 'L_entropy_weight_yyx': 8.946847975534628e-08, 'L_sep_weight_yyx': 1.9842073118791113e-08, 'L_scale_weight_yyx': 1.1412365163886851e-07, 'learning_rate_yyx': 0.0029964853996678883}. Best is trial 17 with value: -2.288314778247399.
[I 2026-03-18 19:27:08,138] Trial 36 pruned. 
[I 2026-03-18 19:27:08,571] Trial 37 finished with value: -1.7827013050426137 and parameters: {'n_layers_yyx': 2, 'hidden_size_yyx_l0': 2, 'hidden_size_yyx_l1': 5, 'context_size_yyx': 4, 'num_mix_components_yyx': 5, 'context_extractor_yyx': 'lstm', 'activation_func_yyx': 'ReLU', 'L2_weight_yyx': 4.136356559035373e-05, 'L_entropy_weight_yyx': 9.043670267906752e-06, 'L_sep_weight_yyx': 2.8273639843065705e-06, 'L_scale_weight_yyx': 0.000987916055665579, 'learning_rate_yyx': 0.007278205046581719}. Best is trial 18 with value: -1.7861539220328282.
[I 2026-03-18 19:27:13,728] Trial 37 finished with value: -2.285742247265147 and parameters: {'n_layers_yyx': 2, 'hidden_size_yyx_l0': 3, 'hidden_size_yyx_l1': 6, 'context_size_yyx': 4, 'num_mix_components_yyx': 4, 'context_extractor_yyx': 'gru', 'activation_func_yyx': 'GELU', 'L2_weight_yyx': 3.788493117739005e-06, 'L_entropy_weight_yyx': 6.331988995809619e-07, 'L_sep_weight_yyx': 0.00025287079325955416, 'L_scale_weight_yyx': 8.394402528622744e-07, 'learning_rate_yyx': 0.006727841480101318}. Best is trial 1 with value: -2.2866954714752907.
[I 2026-03-18 19:27:16,477] Trial 44 pruned. 
[I 2026-03-18 19:27:20,028] Trial 39 pruned. 
[I 2026-03-18 19:27:24,713] Trial 31 pruned. 
[I 2026-03-18 19:27:26,737] Trial 45 pruned. 
[I 2026-03-18 19:27:28,095] Trial 44 pruned. 
[I 2026-03-18 19:27:28,097] Trial 38 pruned. 
[I 2026-03-18 19:27:30,168] Trial 40 pruned. 
[I 2026-03-18 19:27:30,269] Trial 34 finished with value: -2.275425583962213 and parameters: {'n_layers_yyx': 2, 'hidden_size_yyx_l0': 6, 'hidden_size_yyx_l1': 5, 'context_size_yyx': 4, 'num_mix_components_yyx': 2, 'context_extractor_yyx': 'gru', 'activation_func_yyx': 'ReLU', 'L2_weight_yyx': 1.484819197162587e-07, 'L_entropy_weight_yyx': 4.136854862416571e-09, 'L_sep_weight_yyx': 6.369387791514431e-06, 'L_scale_weight_yyx': 1.0161957858888877e-05, 'learning_rate_yyx': 0.0049329668038223876}. Best is trial 3 with value: -2.278758564192965.
[I 2026-03-18 19:27:31,036] Trial 44 finished with value: -1.7767811090173855 and parameters: {'n_layers_yyx': 2, 'hidden_size_yyx_l0': 6, 'hidden_size_yyx_l1': 6, 'context_size_yyx': 3, 'num_mix_components_yyx': 3, 'context_extractor_yyx': 'lstm', 'activation_func_yyx': 'ReLU', 'L2_weight_yyx': 3.0273494423258882e-09, 'L_entropy_weight_yyx': 0.0009937448126016545, 'L_sep_weight_yyx': 1.6330260410256168e-10, 'L_scale_weight_yyx': 1.2390877391520697e-06, 'learning_rate_yyx': 0.006554600231888904}. Best is trial 4 with value: -1.7775746924677662.
[I 2026-03-18 19:27:40,601] Trial 35 pruned. 
[I 2026-03-18 19:27:41,201] Trial 36 finished with value: -2.2770053366455874 and parameters: {'n_layers_yyx': 2, 'hidden_size_yyx_l0': 3, 'hidden_size_yyx_l1': 4, 'context_size_yyx': 3, 'num_mix_components_yyx': 1, 'context_extractor_yyx': 'lstm', 'activation_func_yyx': 'ReLU', 'L2_weight_yyx': 2.3742550902267974e-08, 'L_entropy_weight_yyx': 3.3527719222779575e-09, 'L_sep_weight_yyx': 7.549236524251995e-09, 'L_scale_weight_yyx': 2.0190912063492017e-10, 'learning_rate_yyx': 0.008732257929692951}. Best is trial 36 with value: -2.2770053366455874.
[I 2026-03-18 19:27:45,571] Trial 46 pruned. 
[I 2026-03-18 19:27:46,446] Trial 39 pruned. 
[I 2026-03-18 19:27:54,540] Trial 43 finished with value: -1.7827380741003789 and parameters: {'n_layers_yyx': 1, 'hidden_size_yyx_l0': 4, 'context_size_yyx': 1, 'num_mix_components_yyx': 5, 'context_extractor_yyx': 'gru', 'activation_func_yyx': 'ReLU', 'L2_weight_yyx': 7.00271730473525e-05, 'L_entropy_weight_yyx': 1.1517204148278758e-09, 'L_sep_weight_yyx': 0.0008375742404940523, 'L_scale_weight_yyx': 2.2805409282889956e-07, 'learning_rate_yyx': 0.00690366877021253}. Best is trial 12 with value: -1.7867913016887627.
[I 2026-03-18 19:28:02,508] Trial 37 pruned. 
[I 2026-03-18 19:28:07,375] Trial 40 pruned. 
[I 2026-03-18 19:28:12,533] Trial 24 finished with value: -2.285491383061123 and parameters: {'n_layers_yyx': 1, 'hidden_size_yyx_l0': 6, 'context_size_yyx': 4, 'num_mix_components_yyx': 2, 'context_extractor_yyx': 'gru', 'activation_func_yyx': 'ReLU', 'L2_weight_yyx': 1.581335706028034e-08, 'L_entropy_weight_yyx': 6.239153223309991e-08, 'L_sep_weight_yyx': 1.166194061169572e-08, 'L_scale_weight_yyx': 3.207469169830123e-10, 'learning_rate_yyx': 0.00938552603311085}. Best is trial 19 with value: -2.286228705678167.
[I 2026-03-18 19:28:24,739] Trial 45 pruned. 
[I 2026-03-18 19:28:35,616] Trial 32 finished with value: -2.283618801160143 and parameters: {'n_layers_yyx': 2, 'hidden_size_yyx_l0': 3, 'hidden_size_yyx_l1': 6, 'context_size_yyx': 4, 'num_mix_components_yyx': 5, 'context_extractor_yyx': 'lstm', 'activation_func_yyx': 'GELU', 'L2_weight_yyx': 4.297451623141875e-06, 'L_entropy_weight_yyx': 0.00034845601989354897, 'L_sep_weight_yyx': 0.00028936816271424775, 'L_scale_weight_yyx': 0.0004173228359271411, 'learning_rate_yyx': 0.008062804804130266}. Best is trial 32 with value: -2.283618801160143.
[I 2026-03-18 19:28:46,103] Trial 28 finished with value: -2.2086617386150706 and parameters: {'n_layers_yyx': 2, 'hidden_size_yyx_l0': 5, 'hidden_size_yyx_l1': 5, 'context_size_yyx': 4, 'num_mix_components_yyx': 3, 'context_extractor_yyx': 'gru', 'activation_func_yyx': 'ReLU', 'L2_weight_yyx': 9.875107083694831e-06, 'L_entropy_weight_yyx': 2.869694885445828e-06, 'L_sep_weight_yyx': 5.412513048040555e-07, 'L_scale_weight_yyx': 9.22849765829859e-07, 'learning_rate_yyx': 0.0076842494736365455}. Best is trial 12 with value: -2.2168161654612635.
[I 2026-03-18 19:28:55,488] Trial 37 finished with value: -1.7712387912282155 and parameters: {'n_layers_yyx': 2, 'hidden_size_yyx_l0': 4, 'hidden_size_yyx_l1': 4, 'context_size_yyx': 3, 'num_mix_components_yyx': 5, 'context_extractor_yyx': 'lstm', 'activation_func_yyx': 'Tanh', 'L2_weight_yyx': 5.710014887119916e-06, 'L_entropy_weight_yyx': 9.068702175688317e-05, 'L_sep_weight_yyx': 2.4047823069289765e-05, 'L_scale_weight_yyx': 1.3981889079799735e-05, 'learning_rate_yyx': 0.0069729357249154285}. Best is trial 2 with value: -1.776406202226865.
[I 2026-03-18 19:28:57,091] Trial 29 finished with value: -2.2872250803243572 and parameters: {'n_layers_yyx': 2, 'hidden_size_yyx_l0': 4, 'hidden_size_yyx_l1': 6, 'context_size_yyx': 4, 'num_mix_components_yyx': 3, 'context_extractor_yyx': 'lstm', 'activation_func_yyx': 'GELU', 'L2_weight_yyx': 8.177498988583786e-07, 'L_entropy_weight_yyx': 9.417580942055056e-09, 'L_sep_weight_yyx': 4.150689315092678e-08, 'L_scale_weight_yyx': 0.0007889020691351689, 'learning_rate_yyx': 0.007157545500022194}. Best is trial 17 with value: -2.288314778247399.
[I 2026-03-18 19:29:04,937] Trial 45 finished with value: -1.7626704778506972 and parameters: {'n_layers_yyx': 2, 'hidden_size_yyx_l0': 6, 'hidden_size_yyx_l1': 4, 'context_size_yyx': 1, 'num_mix_components_yyx': 2, 'context_extractor_yyx': 'lstm', 'activation_func_yyx': 'ReLU', 'L2_weight_yyx': 1.9948049870654695e-09, 'L_entropy_weight_yyx': 5.840789613617019e-10, 'L_sep_weight_yyx': 6.151623955764754e-10, 'L_scale_weight_yyx': 1.488640216909716e-08, 'learning_rate_yyx': 0.009660955982819623}. Best is trial 1 with value: -1.7684712210476057.
[I 2026-03-18 19:29:05,221] Trial 35 pruned. 
[I 2026-03-18 19:29:06,224] Trial 30 pruned. 
[I 2026-03-18 19:29:15,142] Trial 46 pruned. 
[I 2026-03-18 19:29:16,407] Trial 31 pruned. 
[I 2026-03-18 19:29:17,301] Trial 46 pruned. 
[I 2026-03-18 19:29:23,395] Trial 31 finished with value: -2.2773129352235233 and parameters: {'n_layers_yyx': 2, 'hidden_size_yyx_l0': 3, 'hidden_size_yyx_l1': 6, 'context_size_yyx': 4, 'num_mix_components_yyx': 4, 'context_extractor_yyx': 'lstm', 'activation_func_yyx': 'GELU', 'L2_weight_yyx': 5.814580689506732e-10, 'L_entropy_weight_yyx': 6.976635222966328e-10, 'L_sep_weight_yyx': 5.4200584801025296e-05, 'L_scale_weight_yyx': 3.748107810802541e-09, 'learning_rate_yyx': 0.006661977236906993}. Best is trial 31 with value: -2.2773129352235233.
[I 2026-03-18 19:29:25,766] Trial 32 pruned. 
[I 2026-03-18 19:29:26,272] Trial 44 finished with value: -1.781391478259154 and parameters: {'n_layers_yyx': 1, 'hidden_size_yyx_l0': 4, 'context_size_yyx': 4, 'num_mix_components_yyx': 4, 'context_extractor_yyx': 'gru', 'activation_func_yyx': 'ReLU', 'L2_weight_yyx': 0.0009773800615567128, 'L_entropy_weight_yyx': 1.5854395146371687e-10, 'L_sep_weight_yyx': 9.954739818117572e-06, 'L_scale_weight_yyx': 4.464738253860189e-10, 'learning_rate_yyx': 0.009858596009050879}. Best is trial 12 with value: -1.7867913016887627.
[I 2026-03-18 19:29:28,559] Trial 33 finished with value: -1.861068552583794 and parameters: {'n_layers_yyx': 2, 'hidden_size_yyx_l0': 5, 'hidden_size_yyx_l1': 4, 'context_size_yyx': 4, 'num_mix_components_yyx': 5, 'context_extractor_yyx': 'lstm', 'activation_func_yyx': 'ReLU', 'L2_weight_yyx': 1.014610655876162e-10, 'L_entropy_weight_yyx': 7.848330825795197e-08, 'L_sep_weight_yyx': 9.620004963467589e-06, 'L_scale_weight_yyx': 3.833824970716845e-05, 'learning_rate_yyx': 0.0020857846156683165}. Best is trial 5 with value: -1.864091702761834.
[I 2026-03-18 19:29:31,430] Trial 41 finished with value: -2.288967413651316 and parameters: {'n_layers_yyx': 2, 'hidden_size_yyx_l0': 4, 'hidden_size_yyx_l1': 6, 'context_size_yyx': 4, 'num_mix_components_yyx': 5, 'context_extractor_yyx': 'lstm', 'activation_func_yyx': 'Tanh', 'L2_weight_yyx': 6.096326919505836e-07, 'L_entropy_weight_yyx': 0.00019642703337153936, 'L_sep_weight_yyx': 2.508227981099636e-06, 'L_scale_weight_yyx': 0.0003889257564507595, 'learning_rate_yyx': 0.008641904397005186}. Best is trial 22 with value: -2.2897814149518054.
[I 2026-03-18 19:29:35,712] Trial 45 pruned. 
[I 2026-03-18 19:29:36,081] Trial 47 pruned. 
[I 2026-03-18 19:29:36,172] Trial 34 pruned. 
[I 2026-03-18 19:29:36,495] Trial 33 pruned. 
[I 2026-03-18 19:29:38,019] Trial 38 finished with value: -2.287633037216952 and parameters: {'n_layers_yyx': 2, 'hidden_size_yyx_l0': 3, 'hidden_size_yyx_l1': 6, 'context_size_yyx': 4, 'num_mix_components_yyx': 3, 'context_extractor_yyx': 'lstm', 'activation_func_yyx': 'GELU', 'L2_weight_yyx': 3.935613643382355e-09, 'L_entropy_weight_yyx': 6.997005147760402e-07, 'L_sep_weight_yyx': 0.0002946466336834893, 'L_scale_weight_yyx': 6.542057275958256e-09, 'learning_rate_yyx': 0.0054225327435908285}. Best is trial 38 with value: -2.287633037216952.
[I 2026-03-18 19:29:40,173] Trial 29 pruned. 
[I 2026-03-18 19:29:45,797] Trial 46 pruned. 
[I 2026-03-18 19:29:45,807] Trial 38 pruned. 
[I 2026-03-18 19:29:47,458] Trial 34 pruned. 
[I 2026-03-18 19:29:48,351] Trial 39 pruned. 
[I 2026-03-18 19:29:52,972] Trial 36 pruned. 
