[I 2026-03-18 17:58:32,791] Trial 49 pruned. 

Source events: 20315
Target events: 14713
Full model ln_yyx : 1378.43742 nats/sec, 84.31956 nats/event
Full model Log loss : -2.89407
Full model ln_yyx : 1386.86891 nats/sec, 84.83532 nats/event
Full model Log loss : -2.90726
Full model ln_yyx : 1351.78033 nats/sec, 82.68893 nats/event
Full model Log loss : -2.79589
Full model ln_yyx : 1410.95886 nats/sec, 86.30891 nats/event
Full model Log loss : -2.95616
Full model ln_yyx : 1370.41684 nats/sec, 83.82894 nats/event
Full model Log loss : -2.83972
Full model ln_yyx : 1406.48388 nats/sec, 86.03517 nats/event
Full model Log loss : -2.95302
Full model ln_yyx : 1414.68690 nats/sec, 86.53695 nats/event
Full model Log loss : -2.95475
Full model ln_yyx : 1415.81700 nats/sec, 86.60608 nats/event
Full model Log loss : -2.96762
Full model ln_yyx : 1418.02222 nats/sec, 86.74098 nats/event
Full model Log loss : -2.96488
Full model ln_yyx : 1407.69226 nats/sec, 86.10909 nats/event
Full model Log loss : -2.96406
Full model ln_yyx : 1409.83483 nats/sec, 86.24015 nats/event
Full model Log loss : -2.94880
Full model ln_yyx : 1415.74577 nats/sec, 86.60173 nats/event
Full model Log loss : -2.96357
Optimization finished. Config saved to results/opt-full/opt_full_36_best_config.txt
[I 2026-03-18 17:58:42,979] Trial 48 pruned. 
[I 2026-03-18 17:58:51,463] Trial 40 pruned. 
[I 2026-03-18 17:58:53,123] Trial 49 pruned. 

Source events: 20315
Target events: 38515
Full model ln_yyx : 3595.24879 nats/sec, 84.01204 nats/event
Full model Log loss : -2.87166
Full model ln_yyx : 3584.01126 nats/sec, 83.74945 nats/event
Full model Log loss : -2.85843
Full model ln_yyx : 3643.77639 nats/sec, 85.14601 nats/event
Full model Log loss : -2.91687
Full model ln_yyx : 3641.72785 nats/sec, 85.09815 nats/event
Full model Log loss : -2.93631
Full model ln_yyx : 3674.12530 nats/sec, 85.85519 nats/event
Full model Log loss : -2.95492
Full model ln_yyx : 3587.91559 nats/sec, 83.84069 nats/event
Full model Log loss : -2.86358
Full model ln_yyx : 3701.72171 nats/sec, 86.50005 nats/event
Full model Log loss : -2.98059
Full model ln_yyx : 3719.76046 nats/sec, 86.92157 nats/event
Full model Log loss : -2.97722
Full model ln_yyx : 3721.99941 nats/sec, 86.97389 nats/event
Full model Log loss : -2.97130
Full model ln_yyx : 3685.88618 nats/sec, 86.13002 nats/event
Full model Log loss : -2.96179
Full model ln_yyx : 3711.33429 nats/sec, 86.72468 nats/event
Full model Log loss : -2.98350
Full model ln_yyx : 3687.62725 nats/sec, 86.17070 nats/event
Full model Log loss : -2.98023
Optimization finished. Config saved to results/opt-full/opt_full_40_best_config.txt
[I 2026-03-18 17:59:10,134] Trial 43 finished with value: -2.967799582226365 and parameters: {'n_layers_yyx': 1, 'hidden_size_yyx_l0': 6, 'context_size_yyx': 4, 'num_mix_components_yyx': 5, 'context_extractor_yyx': 'lstm', 'activation_func_yyx': 'ReLU', 'L2_weight_yyx': 4.0051043770606135e-09, 'L_entropy_weight_yyx': 2.0012376625082887e-08, 'L_sep_weight_yyx': 3.940393970015003e-10, 'L_scale_weight_yyx': 2.0631197153106326e-05, 'learning_rate_yyx': 0.008843524006549062}. Best is trial 35 with value: -2.9708089664894204.
[I 2026-03-18 17:59:19,207] Trial 41 finished with value: -2.9509555895522093 and parameters: {'n_layers_yyx': 2, 'hidden_size_yyx_l0': 4, 'hidden_size_yyx_l1': 5, 'context_size_yyx': 4, 'num_mix_components_yyx': 4, 'context_extractor_yyx': 'lstm', 'activation_func_yyx': 'ReLU', 'L2_weight_yyx': 3.502113748960145e-08, 'L_entropy_weight_yyx': 0.0002064592894732722, 'L_sep_weight_yyx': 0.0003520244380821852, 'L_scale_weight_yyx': 0.0009662719556815374, 'learning_rate_yyx': 0.006707768366647028}. Best is trial 29 with value: -2.9659173901010147.
[I 2026-03-18 17:59:48,941] Trial 46 pruned. 
[I 2026-03-18 17:59:54,554] Trial 47 pruned. 
[I 2026-03-18 17:59:58,967] Trial 41 finished with value: -2.96560977777291 and parameters: {'n_layers_yyx': 2, 'hidden_size_yyx_l0': 4, 'hidden_size_yyx_l1': 4, 'context_size_yyx': 2, 'num_mix_components_yyx': 4, 'context_extractor_yyx': 'gru', 'activation_func_yyx': 'Tanh', 'L2_weight_yyx': 2.229460929332128e-07, 'L_entropy_weight_yyx': 1.1321156405670823e-05, 'L_sep_weight_yyx': 1.1202360905446256e-06, 'L_scale_weight_yyx': 2.4477552055327606e-05, 'learning_rate_yyx': 0.007908554939376712}. Best is trial 5 with value: -2.9729516240610265.
[I 2026-03-18 18:00:00,526] Trial 48 pruned. 
[I 2026-03-18 18:00:11,218] Trial 42 pruned. 
[I 2026-03-18 18:00:11,544] Trial 49 pruned. 

Source events: 20315
Target events: 12539
Full model ln_yyx : 1201.96991 nats/sec, 86.27266 nats/event
Full model Log loss : -2.93525
Full model ln_yyx : 1023.13363 nats/sec, 73.43650 nats/event
Full model Log loss : -2.35744
Full model ln_yyx : 1185.05412 nats/sec, 85.05851 nats/event
Full model Log loss : -2.89138
Full model ln_yyx : 1199.21458 nats/sec, 86.07490 nats/event
Full model Log loss : -2.95110
Full model ln_yyx : 1195.89098 nats/sec, 85.83634 nats/event
Full model Log loss : -2.92183
Full model ln_yyx : 1195.59030 nats/sec, 85.81476 nats/event
Full model Log loss : -2.93316
Full model ln_yyx : 1188.01300 nats/sec, 85.27089 nats/event
Full model Log loss : -2.92749
Full model ln_yyx : 1194.04979 nats/sec, 85.70419 nats/event
Full model Log loss : -2.93353
Full model ln_yyx : 1188.91808 nats/sec, 85.33585 nats/event
Full model Log loss : -2.92721
Full model ln_yyx : 1193.89310 nats/sec, 85.69294 nats/event
Full model Log loss : -2.95704
Full model ln_yyx : 1197.32592 nats/sec, 85.93934 nats/event
Full model Log loss : -2.95279
Full model ln_yyx : 1202.67844 nats/sec, 86.32352 nats/event
Full model Log loss : -2.95464
Full model ln_yyx : 1186.40790 nats/sec, 85.15568 nats/event
Full model Log loss : -2.94678
Full model ln_yyx : 1186.69885 nats/sec, 85.17657 nats/event
Full model Log loss : -2.94605
Optimization finished. Config saved to results/opt-full/opt_full_48_best_config.txt
[I 2026-03-18 18:00:12,617] Trial 49 pruned. 

Source events: 20315
Target events: 10752
Full model ln_yyx : 991.35152 nats/sec, 82.98143 nats/event
Full model Log loss : -2.80935
Full model ln_yyx : 1014.08752 nats/sec, 84.88456 nats/event
Full model Log loss : -2.89170
Full model ln_yyx : 1014.78918 nats/sec, 84.94329 nats/event
Full model Log loss : -2.89335
Full model ln_yyx : 1033.42991 nats/sec, 86.50362 nats/event
Full model Log loss : -2.96137
Full model ln_yyx : 893.71951 nats/sec, 74.80911 nats/event
Full model Log loss : -2.39562
Full model ln_yyx : 1011.95935 nats/sec, 84.70642 nats/event
Full model Log loss : -2.88866
Full model ln_yyx : 1026.28270 nats/sec, 85.90536 nats/event
Full model Log loss : -2.95773
Full model ln_yyx : 1031.72142 nats/sec, 86.36061 nats/event
Full model Log loss : -2.95184
Full model ln_yyx : 1040.33007 nats/sec, 87.08120 nats/event
Full model Log loss : -2.97089
Full model ln_yyx : 1041.28995 nats/sec, 87.16155 nats/event
Full model Log loss : -2.96646
Full model ln_yyx : 1042.43578 nats/sec, 87.25746 nats/event
Full model Log loss : -2.97718
Full model ln_yyx : 1033.03465 nats/sec, 86.47053 nats/event
Full model Log loss : -2.97641
Full model ln_yyx : 1031.13343 nats/sec, 86.31139 nats/event
Full model Log loss : -2.97413
Optimization finished. Config saved to results/opt-full/opt_full_42_best_config.txt
[I 2026-03-18 18:00:19,368] Trial 44 finished with value: -2.96869995856261 and parameters: {'n_layers_yyx': 1, 'hidden_size_yyx_l0': 6, 'context_size_yyx': 4, 'num_mix_components_yyx': 5, 'context_extractor_yyx': 'lstm', 'activation_func_yyx': 'ReLU', 'L2_weight_yyx': 6.07862664848411e-09, 'L_entropy_weight_yyx': 1.3619354068761385e-08, 'L_sep_weight_yyx': 5.570818661632883e-10, 'L_scale_weight_yyx': 0.00019627466079323905, 'learning_rate_yyx': 0.008744550857309656}. Best is trial 35 with value: -2.9708089664894204.
[I 2026-03-18 18:00:47,440] Trial 42 pruned. 
[I 2026-03-18 18:01:07,144] Trial 41 finished with value: -2.9582440120910554 and parameters: {'n_layers_yyx': 1, 'hidden_size_yyx_l0': 5, 'context_size_yyx': 3, 'num_mix_components_yyx': 3, 'context_extractor_yyx': 'lstm', 'activation_func_yyx': 'Tanh', 'L2_weight_yyx': 5.77167848343609e-09, 'L_entropy_weight_yyx': 0.00013319089682438943, 'L_sep_weight_yyx': 2.324790361574166e-05, 'L_scale_weight_yyx': 1.5645040932109112e-09, 'learning_rate_yyx': 0.006512855260863137}. Best is trial 22 with value: -2.970223923614394.
[I 2026-03-18 18:01:12,541] Trial 42 pruned. 
[I 2026-03-18 18:01:37,438] Trial 43 pruned. 
[I 2026-03-18 18:01:43,622] Trial 45 finished with value: -2.9709360871377553 and parameters: {'n_layers_yyx': 1, 'hidden_size_yyx_l0': 6, 'context_size_yyx': 4, 'num_mix_components_yyx': 5, 'context_extractor_yyx': 'lstm', 'activation_func_yyx': 'ReLU', 'L2_weight_yyx': 3.3916228308183156e-09, 'L_entropy_weight_yyx': 1.3842063856959673e-08, 'L_sep_weight_yyx': 5.32606675110433e-10, 'L_scale_weight_yyx': 0.00017995254254106436, 'learning_rate_yyx': 0.008554069202807395}. Best is trial 45 with value: -2.9709360871377553.
[I 2026-03-18 18:01:49,189] Trial 44 pruned. 
[I 2026-03-18 18:02:10,970] Trial 43 finished with value: -2.955751789379649 and parameters: {'n_layers_yyx': 2, 'hidden_size_yyx_l0': 4, 'hidden_size_yyx_l1': 5, 'context_size_yyx': 4, 'num_mix_components_yyx': 4, 'context_extractor_yyx': 'lstm', 'activation_func_yyx': 'ReLU', 'L2_weight_yyx': 9.242801179553968e-08, 'L_entropy_weight_yyx': 6.355995035968653e-05, 'L_sep_weight_yyx': 8.393533144617583e-05, 'L_scale_weight_yyx': 0.00018646525401129756, 'learning_rate_yyx': 0.008330467608999564}. Best is trial 29 with value: -2.9659173901010147.
[I 2026-03-18 18:02:19,931] Trial 45 pruned. 
[I 2026-03-18 18:02:22,981] Trial 44 pruned. 
[I 2026-03-18 18:02:31,917] Trial 46 pruned. 
[I 2026-03-18 18:02:37,614] Trial 47 pruned. 
[I 2026-03-18 18:02:49,404] Trial 48 pruned. 
[I 2026-03-18 18:02:54,001] Trial 46 finished with value: -2.9660120404933465 and parameters: {'n_layers_yyx': 1, 'hidden_size_yyx_l0': 6, 'context_size_yyx': 4, 'num_mix_components_yyx': 5, 'context_extractor_yyx': 'lstm', 'activation_func_yyx': 'ReLU', 'L2_weight_yyx': 4.81237828756767e-09, 'L_entropy_weight_yyx': 1.5126326649472843e-08, 'L_sep_weight_yyx': 8.489504714089659e-10, 'L_scale_weight_yyx': 0.00021845942213746163, 'learning_rate_yyx': 0.008901023416219782}. Best is trial 45 with value: -2.9709360871377553.
[I 2026-03-18 18:03:07,256] Trial 43 finished with value: -2.9697848890865326 and parameters: {'n_layers_yyx': 1, 'hidden_size_yyx_l0': 5, 'context_size_yyx': 4, 'num_mix_components_yyx': 2, 'context_extractor_yyx': 'lstm', 'activation_func_yyx': 'Tanh', 'L2_weight_yyx': 2.059572403184716e-09, 'L_entropy_weight_yyx': 1.874720517585937e-05, 'L_sep_weight_yyx': 6.705655484222702e-05, 'L_scale_weight_yyx': 0.00019633617523546698, 'learning_rate_yyx': 0.00862133175801695}. Best is trial 22 with value: -2.970223923614394.
[I 2026-03-18 18:03:20,401] Trial 49 pruned. 

Source events: 20315
Target events: 8618
Full model ln_yyx : 815.30344 nats/sec, 85.14424 nats/event
Full model Log loss : -2.90750
Full model ln_yyx : 818.67889 nats/sec, 85.49675 nats/event
Full model Log loss : -2.92379
Full model ln_yyx : 790.81663 nats/sec, 82.58702 nats/event
Full model Log loss : -2.80406
Full model ln_yyx : 824.05158 nats/sec, 86.05784 nats/event
Full model Log loss : -2.97295
Full model ln_yyx : 831.11879 nats/sec, 86.79588 nats/event
Full model Log loss : -2.95795
Full model ln_yyx : 803.24823 nats/sec, 83.88529 nats/event
Full model Log loss : -2.84870
Full model ln_yyx : 702.43931 nats/sec, 73.35755 nats/event
Full model Log loss : -2.36572
Full model ln_yyx : 824.65250 nats/sec, 86.12059 nats/event
Full model Log loss : -2.96967
Full model ln_yyx : 823.82242 nats/sec, 86.03390 nats/event
Full model Log loss : -2.96380
Full model ln_yyx : 825.53559 nats/sec, 86.21281 nats/event
Full model Log loss : -2.96753
Full model ln_yyx : 821.29539 nats/sec, 85.77000 nats/event
Full model Log loss : -2.96101
Full model ln_yyx : 822.81270 nats/sec, 85.92846 nats/event
Full model Log loss : -2.96697
Full model ln_yyx : 828.89296 nats/sec, 86.56343 nats/event
Full model Log loss : -2.96598
Full model ln_yyx : 826.59795 nats/sec, 86.32376 nats/event
Full model Log loss : -2.96561
Optimization finished. Config saved to results/opt-full/opt_full_46_best_config.txt
[I 2026-03-18 18:03:20,729] Trial 45 finished with value: -2.888620165941755 and parameters: {'n_layers_yyx': 2, 'hidden_size_yyx_l0': 4, 'hidden_size_yyx_l1': 3, 'context_size_yyx': 3, 'num_mix_components_yyx': 4, 'context_extractor_yyx': 'lstm', 'activation_func_yyx': 'ReLU', 'L2_weight_yyx': 4.260844892359933e-06, 'L_entropy_weight_yyx': 6.153762789882448e-06, 'L_sep_weight_yyx': 2.8947126706678162e-05, 'L_scale_weight_yyx': 1.9311314124944723e-05, 'learning_rate_yyx': 0.008478232516966513}. Best is trial 29 with value: -2.9659173901010147.
[I 2026-03-18 18:03:38,208] Trial 44 pruned. 
[I 2026-03-18 18:03:43,864] Trial 45 pruned. 
[I 2026-03-18 18:04:13,647] Trial 46 pruned. 
[I 2026-03-18 18:04:41,673] Trial 46 finished with value: -2.8977715304206852 and parameters: {'n_layers_yyx': 1, 'hidden_size_yyx_l0': 3, 'context_size_yyx': 4, 'num_mix_components_yyx': 3, 'context_extractor_yyx': 'lstm', 'activation_func_yyx': 'ReLU', 'L2_weight_yyx': 9.861485179122493e-08, 'L_entropy_weight_yyx': 2.147822972494941e-06, 'L_sep_weight_yyx': 0.0005781734028385867, 'L_scale_weight_yyx': 0.0001038022083304605, 'learning_rate_yyx': 0.00982346182192829}. Best is trial 29 with value: -2.9659173901010147.
[I 2026-03-18 18:04:43,689] Trial 47 finished with value: -2.951708226824625 and parameters: {'n_layers_yyx': 1, 'hidden_size_yyx_l0': 6, 'context_size_yyx': 3, 'num_mix_components_yyx': 5, 'context_extractor_yyx': 'lstm', 'activation_func_yyx': 'Tanh', 'L2_weight_yyx': 3.370754586511965e-09, 'L_entropy_weight_yyx': 1.2651790906546709e-08, 'L_sep_weight_yyx': 6.170554058661743e-10, 'L_scale_weight_yyx': 0.0008137313118289839, 'learning_rate_yyx': 0.009941804001896277}. Best is trial 45 with value: -2.9709360871377553.
[I 2026-03-18 18:05:13,425] Trial 48 pruned. 
[I 2026-03-18 18:05:25,043] Trial 49 pruned. 

Source events: 20315
Target events: 11540
Full model ln_yyx : 1069.57791 nats/sec, 83.41596 nats/event
Full model Log loss : -2.83888
Full model ln_yyx : 1101.58062 nats/sec, 85.91183 nats/event
Full model Log loss : -2.94978
Full model ln_yyx : 1086.72804 nats/sec, 84.75349 nats/event
Full model Log loss : -2.88712
Full model ln_yyx : 1100.24386 nats/sec, 85.80758 nats/event
Full model Log loss : -2.94814
Full model ln_yyx : 1090.78602 nats/sec, 85.06997 nats/event
Full model Log loss : -2.91906
Full model ln_yyx : 1101.62544 nats/sec, 85.91533 nats/event
Full model Log loss : -2.95420
Full model ln_yyx : 1100.46658 nats/sec, 85.82495 nats/event
Full model Log loss : -2.93874
Full model ln_yyx : 1095.41475 nats/sec, 85.43096 nats/event
Full model Log loss : -2.94962
Full model ln_yyx : 1102.66027 nats/sec, 85.99603 nats/event
Full model Log loss : -2.96016
Full model ln_yyx : 1104.30058 nats/sec, 86.12396 nats/event
Full model Log loss : -2.97081
Full model ln_yyx : 1086.54566 nats/sec, 84.73926 nats/event
Full model Log loss : -2.90316
Full model ln_yyx : 1106.14141 nats/sec, 86.26753 nats/event
Full model Log loss : -2.93798
Full model ln_yyx : 1104.25589 nats/sec, 86.12048 nats/event
Full model Log loss : -2.97068
Full model ln_yyx : 1105.03654 nats/sec, 86.18136 nats/event
Full model Log loss : -2.96780
Full model ln_yyx : 1103.06348 nats/sec, 86.02748 nats/event
Full model Log loss : -2.96870
Full model ln_yyx : 1103.90983 nats/sec, 86.09349 nats/event
Full model Log loss : -2.97094
Full model ln_yyx : 1096.25676 nats/sec, 85.49663 nats/event
Full model Log loss : -2.96601
Full model ln_yyx : 1099.49647 nats/sec, 85.74929 nats/event
Full model Log loss : -2.95171
Optimization finished. Config saved to results/opt-full/opt_full_49_best_config.txt
[I 2026-03-18 18:06:00,156] Trial 47 finished with value: -2.9049891607964575 and parameters: {'n_layers_yyx': 2, 'hidden_size_yyx_l0': 5, 'hidden_size_yyx_l1': 5, 'context_size_yyx': 3, 'num_mix_components_yyx': 5, 'context_extractor_yyx': 'lstm', 'activation_func_yyx': 'GELU', 'L2_weight_yyx': 2.693443536839829e-08, 'L_entropy_weight_yyx': 2.4841146072255045e-05, 'L_sep_weight_yyx': 1.2774185678338685e-05, 'L_scale_weight_yyx': 0.00022291845590905325, 'learning_rate_yyx': 0.004952373790171067}. Best is trial 29 with value: -2.9659173901010147.
[I 2026-03-18 18:06:05,347] Trial 48 pruned. 
[I 2026-03-18 18:06:10,203] Trial 49 pruned. 

Source events: 20315
Target events: 12731
Full model ln_yyx : 1194.13975 nats/sec, 84.41802 nats/event
Full model Log loss : -2.86171
Full model ln_yyx : 1205.95321 nats/sec, 85.25315 nats/event
Full model Log loss : -2.91545
Full model ln_yyx : 1202.95297 nats/sec, 85.04105 nats/event
Full model Log loss : -2.89649
Full model ln_yyx : 1171.05651 nats/sec, 82.78618 nats/event
Full model Log loss : -2.80128
Full model ln_yyx : 1228.50326 nats/sec, 86.84730 nats/event
Full model Log loss : -2.94098
Full model ln_yyx : 1228.31003 nats/sec, 86.83364 nats/event
Full model Log loss : -2.94165
Full model ln_yyx : 1212.54688 nats/sec, 85.71928 nats/event
Full model Log loss : -2.93795
Full model ln_yyx : 1205.17845 nats/sec, 85.19838 nats/event
Full model Log loss : -2.91085
Full model ln_yyx : 1223.15535 nats/sec, 86.46923 nats/event
Full model Log loss : -2.96373
Full model ln_yyx : 1213.18533 nats/sec, 85.76442 nats/event
Full model Log loss : -2.95393
Full model ln_yyx : 1200.48730 nats/sec, 84.86675 nats/event
Full model Log loss : -2.90425
Full model ln_yyx : 1217.13826 nats/sec, 86.04386 nats/event
Full model Log loss : -2.96592
Full model ln_yyx : 1215.96570 nats/sec, 85.96097 nats/event
Full model Log loss : -2.95148
Full model ln_yyx : 1217.41860 nats/sec, 86.06368 nats/event
Full model Log loss : -2.95166
Full model ln_yyx : 1215.18794 nats/sec, 85.90599 nats/event
Full model Log loss : -2.95096
Full model ln_yyx : 1210.37098 nats/sec, 85.56546 nats/event
Full model Log loss : -2.95575
Full model ln_yyx : 1201.78998 nats/sec, 84.95884 nats/event
Full model Log loss : -2.88862
Full model ln_yyx : 1206.95949 nats/sec, 85.32429 nats/event
Full model Log loss : -2.89777
Full model ln_yyx : 1203.89507 nats/sec, 85.10766 nats/event
Full model Log loss : -2.90499
Optimization finished. Config saved to results/opt-full/opt_full_35_best_config.txt
[I 2026-03-18 18:06:30,227] Trial 47 finished with value: -2.9654600727275593 and parameters: {'n_layers_yyx': 1, 'hidden_size_yyx_l0': 5, 'context_size_yyx': 4, 'num_mix_components_yyx': 2, 'context_extractor_yyx': 'lstm', 'activation_func_yyx': 'Tanh', 'L2_weight_yyx': 1.2070339281232059e-05, 'L_entropy_weight_yyx': 6.510296475746617e-06, 'L_sep_weight_yyx': 9.350059587356351e-05, 'L_scale_weight_yyx': 3.1600134671020994e-05, 'learning_rate_yyx': 0.005154142227452133}. Best is trial 22 with value: -2.970223923614394.
[I 2026-03-18 18:06:41,344] Trial 48 pruned. 
[I 2026-03-18 18:06:52,836] Trial 49 pruned. 

Source events: 20315
Target events: 13628
Full model ln_yyx : 1229.61940 nats/sec, 81.20469 nats/event
Full model Log loss : -2.73512
Full model ln_yyx : 1276.74682 nats/sec, 84.31700 nats/event
Full model Log loss : -2.87196
Full model ln_yyx : 1107.74671 nats/sec, 73.15615 nats/event
Full model Log loss : -2.35497
Full model ln_yyx : 1282.87595 nats/sec, 84.72178 nats/event
Full model Log loss : -2.88062
Full model ln_yyx : 1283.46414 nats/sec, 84.76062 nats/event
Full model Log loss : -2.88631
Full model ln_yyx : 1296.18832 nats/sec, 85.60093 nats/event
Full model Log loss : -2.91898
Full model ln_yyx : 1294.18664 nats/sec, 85.46874 nats/event
Full model Log loss : -2.92729
Full model ln_yyx : 1301.59864 nats/sec, 85.95823 nats/event
Full model Log loss : -2.91550
Full model ln_yyx : 1301.56971 nats/sec, 85.95632 nats/event
Full model Log loss : -2.93615
Full model ln_yyx : 1283.08733 nats/sec, 84.73574 nats/event
Full model Log loss : -2.89171
Full model ln_yyx : 1296.49792 nats/sec, 85.62138 nats/event
Full model Log loss : -2.95564
Full model ln_yyx : 1310.34716 nats/sec, 86.53599 nats/event
Full model Log loss : -2.97022
Full model ln_yyx : 1300.37645 nats/sec, 85.87752 nats/event
Full model Log loss : -2.96447
Full model ln_yyx : 1312.18697 nats/sec, 86.65749 nats/event
Full model Log loss : -2.96009
Full model ln_yyx : 1306.20632 nats/sec, 86.26252 nats/event
Full model Log loss : -2.96585
Full model ln_yyx : 1306.93315 nats/sec, 86.31052 nats/event
Full model Log loss : -2.95824
Full model ln_yyx : 1318.66769 nats/sec, 87.08548 nats/event
Full model Log loss : -2.96978
Full model ln_yyx : 1310.77464 nats/sec, 86.56422 nats/event
Full model Log loss : -2.96546
Optimization finished. Config saved to results/opt-full/opt_full_44_best_config.txt
