[I 2026-03-18 17:02:07,457] Trial 29 pruned. 
[I 2026-03-18 17:02:12,755] Trial 25 pruned. 
[I 2026-03-18 17:02:13,296] Trial 5 pruned. 
[I 2026-03-18 17:02:14,584] Trial 16 pruned. 
[I 2026-03-18 17:02:17,182] Trial 14 pruned. 
[I 2026-03-18 17:02:20,920] Trial 30 pruned. 
[I 2026-03-18 17:02:21,526] Trial 6 pruned. 
[I 2026-03-18 17:02:26,657] Trial 8 pruned. 
[I 2026-03-18 17:02:27,846] Trial 3 pruned. 
[I 2026-03-18 17:02:29,493] Trial 30 pruned. 
[I 2026-03-18 17:02:33,341] Trial 11 finished with value: -2.9204485379140666 and parameters: {'n_layers_yyx': 2, 'hidden_size_yyx_l0': 6, 'hidden_size_yyx_l1': 3, 'context_size_yyx': 3, 'num_mix_components_yyx': 5, 'context_extractor_yyx': 'gru', 'activation_func_yyx': 'ReLU', 'L2_weight_yyx': 2.6194118794686174e-09, 'L_entropy_weight_yyx': 1.5602578143347662e-10, 'L_sep_weight_yyx': 3.632087752692252e-07, 'L_scale_weight_yyx': 4.37504559057486e-08, 'learning_rate_yyx': 0.009525381744177941}. Best is trial 11 with value: -2.9204485379140666.
[I 2026-03-18 17:02:36,736] Trial 4 pruned. 
[I 2026-03-18 17:02:37,544] Trial 17 pruned. 
[I 2026-03-18 17:02:40,667] Trial 11 finished with value: -0.5761553778772996 and parameters: {'n_layers_yyx': 2, 'hidden_size_yyx_l0': 4, 'hidden_size_yyx_l1': 6, 'context_size_yyx': 4, 'num_mix_components_yyx': 4, 'context_extractor_yyx': 'gru', 'activation_func_yyx': 'GELU', 'L2_weight_yyx': 5.218596736054223e-08, 'L_entropy_weight_yyx': 1.20570166906927e-09, 'L_sep_weight_yyx': 1.882340426799741e-08, 'L_scale_weight_yyx': 0.00045171333877837185, 'learning_rate_yyx': 0.00914848077011499}. Best is trial 10 with value: -0.57893176387068.
[I 2026-03-18 17:02:50,961] Trial 31 pruned. 
[I 2026-03-18 17:02:54,652] Trial 12 pruned. 
[I 2026-03-18 17:02:56,179] Trial 7 pruned. 
[I 2026-03-18 17:02:56,780] Trial 15 pruned. 
[I 2026-03-18 17:02:57,617] Trial 18 pruned. 
[I 2026-03-18 17:03:01,406] Trial 7 finished with value: -2.8871191738833093 and parameters: {'n_layers_yyx': 2, 'hidden_size_yyx_l0': 5, 'hidden_size_yyx_l1': 4, 'context_size_yyx': 4, 'num_mix_components_yyx': 2, 'context_extractor_yyx': 'lstm', 'activation_func_yyx': 'GELU', 'L2_weight_yyx': 0.0001388314516241046, 'L_entropy_weight_yyx': 4.944456605701257e-10, 'L_sep_weight_yyx': 1.0664485955557455e-05, 'L_scale_weight_yyx': 2.9146103760457896e-10, 'learning_rate_yyx': 0.0006289231641662484}. Best is trial 1 with value: -2.9497769660834225.
[I 2026-03-18 17:03:01,417] Trial 10 finished with value: -0.5570569569667727 and parameters: {'n_layers_yyx': 1, 'hidden_size_yyx_l0': 6, 'context_size_yyx': 3, 'num_mix_components_yyx': 5, 'context_extractor_yyx': 'lstm', 'activation_func_yyx': 'ReLU', 'L2_weight_yyx': 1.815633248209746e-10, 'L_entropy_weight_yyx': 0.0006962835201890566, 'L_sep_weight_yyx': 1.0510124643345552e-05, 'L_scale_weight_yyx': 0.0004451431055505439, 'learning_rate_yyx': 0.009606717298705679}. Best is trial 0 with value: -0.5748618229547262.
[I 2026-03-18 17:03:04,341] Trial 6 pruned. 
[I 2026-03-18 17:03:04,384] Trial 12 pruned. 
[I 2026-03-18 17:03:24,042] Trial 11 pruned. 
[I 2026-03-18 17:03:25,601] Trial 13 pruned. 
[I 2026-03-18 17:03:28,660] Trial 7 pruned. 
[I 2026-03-18 17:03:32,461] Trial 7 finished with value: -2.8128439295041128 and parameters: {'n_layers_yyx': 2, 'hidden_size_yyx_l0': 4, 'hidden_size_yyx_l1': 2, 'context_size_yyx': 3, 'num_mix_components_yyx': 2, 'context_extractor_yyx': 'lstm', 'activation_func_yyx': 'ReLU', 'L2_weight_yyx': 5.106236643224026e-06, 'L_entropy_weight_yyx': 1.1297017363102803e-10, 'L_sep_weight_yyx': 2.2063743114855544e-05, 'L_scale_weight_yyx': 7.212106318355453e-08, 'learning_rate_yyx': 0.0013749098684867718}. Best is trial 0 with value: -2.973312761552399.
[I 2026-03-18 17:03:36,576] Trial 19 pruned. 
[I 2026-03-18 17:03:37,077] Trial 16 pruned. 
[I 2026-03-18 17:03:42,750] Trial 15 finished with value: -0.5780454108278886 and parameters: {'n_layers_yyx': 1, 'hidden_size_yyx_l0': 4, 'context_size_yyx': 1, 'num_mix_components_yyx': 5, 'context_extractor_yyx': 'lstm', 'activation_func_yyx': 'ReLU', 'L2_weight_yyx': 0.00011595440349947803, 'L_entropy_weight_yyx': 3.747796306356045e-05, 'L_sep_weight_yyx': 1.3482754917601928e-06, 'L_scale_weight_yyx': 1.733065099138587e-09, 'learning_rate_yyx': 0.0015352603433304232}. Best is trial 15 with value: -0.5780454108278886.
[I 2026-03-18 17:03:45,357] Trial 14 pruned. 
[I 2026-03-18 17:03:47,887] Trial 8 pruned. 
[I 2026-03-18 17:03:50,799] Trial 31 pruned. 
[I 2026-03-18 17:03:53,135] Trial 15 finished with value: -0.555470630588033 and parameters: {'n_layers_yyx': 1, 'hidden_size_yyx_l0': 6, 'context_size_yyx': 2, 'num_mix_components_yyx': 3, 'context_extractor_yyx': 'gru', 'activation_func_yyx': 'Tanh', 'L2_weight_yyx': 1.4735382535342733e-10, 'L_entropy_weight_yyx': 7.062906897418437e-09, 'L_sep_weight_yyx': 2.0785793595539077e-08, 'L_scale_weight_yyx': 5.138057636734824e-05, 'learning_rate_yyx': 0.004904975226843092}. Best is trial 1 with value: -0.5777964847779832.
[I 2026-03-18 17:03:54,914] Trial 15 finished with value: -0.5782953233469631 and parameters: {'n_layers_yyx': 1, 'hidden_size_yyx_l0': 4, 'context_size_yyx': 3, 'num_mix_components_yyx': 4, 'context_extractor_yyx': 'lstm', 'activation_func_yyx': 'Tanh', 'L2_weight_yyx': 2.4177282110444007e-06, 'L_entropy_weight_yyx': 1.392550387486686e-05, 'L_sep_weight_yyx': 2.571783223256605e-07, 'L_scale_weight_yyx': 2.3918837359992783e-08, 'learning_rate_yyx': 0.005231046235548413}. Best is trial 15 with value: -0.5782953233469631.
[I 2026-03-18 17:04:04,114] Trial 16 pruned. 
[I 2026-03-18 17:04:16,546] Trial 16 pruned. 
[I 2026-03-18 17:04:17,105] Trial 20 pruned. 
[I 2026-03-18 17:04:18,395] Trial 17 pruned. 
[I 2026-03-18 17:04:24,895] Trial 32 pruned. 
[I 2026-03-18 17:04:27,602] Trial 17 pruned. 
[I 2026-03-18 17:04:28,521] Trial 11 finished with value: -0.5728435280234483 and parameters: {'n_layers_yyx': 1, 'hidden_size_yyx_l0': 4, 'context_size_yyx': 3, 'num_mix_components_yyx': 3, 'context_extractor_yyx': 'gru', 'activation_func_yyx': 'GELU', 'L2_weight_yyx': 4.030145322407194e-09, 'L_entropy_weight_yyx': 1.9053148744155212e-05, 'L_sep_weight_yyx': 2.3255085053829744e-06, 'L_scale_weight_yyx': 5.801807812858133e-08, 'learning_rate_yyx': 0.00557748231986395}. Best is trial 1 with value: -0.5818196838462861.
[I 2026-03-18 17:04:29,388] Trial 12 finished with value: -0.46022137621238873 and parameters: {'n_layers_yyx': 2, 'hidden_size_yyx_l0': 4, 'hidden_size_yyx_l1': 4, 'context_size_yyx': 4, 'num_mix_components_yyx': 2, 'context_extractor_yyx': 'gru', 'activation_func_yyx': 'Tanh', 'L2_weight_yyx': 2.5941236424050647e-05, 'L_entropy_weight_yyx': 4.264574066412853e-09, 'L_sep_weight_yyx': 3.385056771122806e-05, 'L_scale_weight_yyx': 3.055788258114377e-05, 'learning_rate_yyx': 0.00462671014453844}. Best is trial 12 with value: -0.46022137621238873.
[I 2026-03-18 17:04:34,320] Trial 16 pruned. 
[I 2026-03-18 17:04:41,571] Trial 21 pruned. 
[I 2026-03-18 17:04:41,822] Trial 18 pruned. 
[I 2026-03-18 17:04:45,611] Trial 7 finished with value: -2.9168673162801784 and parameters: {'n_layers_yyx': 2, 'hidden_size_yyx_l0': 6, 'hidden_size_yyx_l1': 6, 'context_size_yyx': 2, 'num_mix_components_yyx': 2, 'context_extractor_yyx': 'gru', 'activation_func_yyx': 'ReLU', 'L2_weight_yyx': 5.476720703425567e-07, 'L_entropy_weight_yyx': 0.0003762575217417664, 'L_sep_weight_yyx': 6.323907044651769e-07, 'L_scale_weight_yyx': 6.977025440108343e-08, 'learning_rate_yyx': 0.0010281226124629812}. Best is trial 7 with value: -2.9168673162801784.
[I 2026-03-18 17:04:46,340] Trial 33 pruned. 
[I 2026-03-18 17:04:46,811] Trial 26 finished with value: -0.566987993956596 and parameters: {'n_layers_yyx': 1, 'hidden_size_yyx_l0': 4, 'context_size_yyx': 4, 'num_mix_components_yyx': 4, 'context_extractor_yyx': 'lstm', 'activation_func_yyx': 'Tanh', 'L2_weight_yyx': 6.608631336866411e-06, 'L_entropy_weight_yyx': 1.4271650239117627e-08, 'L_sep_weight_yyx': 0.0009254529051446082, 'L_scale_weight_yyx': 7.990911860321645e-07, 'learning_rate_yyx': 0.003894535279104625}. Best is trial 3 with value: -0.5836324153936877.
[I 2026-03-18 17:04:49,430] Trial 13 pruned. 
[I 2026-03-18 17:04:49,754] Trial 4 finished with value: -2.8806189278791603 and parameters: {'n_layers_yyx': 2, 'hidden_size_yyx_l0': 3, 'hidden_size_yyx_l1': 4, 'context_size_yyx': 1, 'num_mix_components_yyx': 2, 'context_extractor_yyx': 'lstm', 'activation_func_yyx': 'ReLU', 'L2_weight_yyx': 2.6676475632773283e-06, 'L_entropy_weight_yyx': 2.170276984290212e-09, 'L_sep_weight_yyx': 7.849455003273806e-10, 'L_scale_weight_yyx': 1.060209168877911e-05, 'learning_rate_yyx': 0.0007882553965799124}. Best is trial 4 with value: -2.8806189278791603.
[I 2026-03-18 17:04:50,225] Trial 13 finished with value: -0.5742619447563833 and parameters: {'n_layers_yyx': 2, 'hidden_size_yyx_l0': 4, 'hidden_size_yyx_l1': 6, 'context_size_yyx': 2, 'num_mix_components_yyx': 3, 'context_extractor_yyx': 'lstm', 'activation_func_yyx': 'ReLU', 'L2_weight_yyx': 3.606984491253295e-08, 'L_entropy_weight_yyx': 3.54288479554998e-07, 'L_sep_weight_yyx': 0.0007390100047867557, 'L_scale_weight_yyx': 7.78072901341661e-07, 'learning_rate_yyx': 0.008424764651727982}. Best is trial 13 with value: -0.5742619447563833.
[I 2026-03-18 17:04:58,089] Trial 17 pruned. 
[I 2026-03-18 17:04:59,215] Trial 17 pruned. 
[I 2026-03-18 17:05:02,190] Trial 12 pruned. 
[I 2026-03-18 17:05:07,152] Trial 18 pruned. 
[I 2026-03-18 17:05:11,116] Trial 14 pruned. 
[I 2026-03-18 17:05:15,484] Trial 5 pruned. 
[I 2026-03-18 17:05:20,811] Trial 18 pruned. 
[I 2026-03-18 17:05:26,111] Trial 32 pruned. 
[I 2026-03-18 17:05:27,597] Trial 34 pruned. 
[I 2026-03-18 17:05:29,281] Trial 27 pruned. 
[I 2026-03-18 17:05:33,272] Trial 15 pruned. 
[I 2026-03-18 17:05:38,378] Trial 8 pruned. 
[I 2026-03-18 17:05:40,420] Trial 18 pruned. 
[I 2026-03-18 17:05:40,771] Trial 13 pruned. 
[I 2026-03-18 17:05:41,663] Trial 6 pruned. 
[I 2026-03-18 17:05:49,241] Trial 19 pruned. 
[I 2026-03-18 17:06:07,116] Trial 9 pruned. 
[I 2026-03-18 17:06:10,571] Trial 35 pruned. 
[I 2026-03-18 17:06:11,808] Trial 28 pruned. 
[I 2026-03-18 17:06:19,591] Trial 19 pruned. 
[I 2026-03-18 17:06:23,042] Trial 19 pruned. 
[I 2026-03-18 17:06:31,424] Trial 10 pruned. 
[I 2026-03-18 17:06:31,424] Trial 29 pruned. 
[I 2026-03-18 17:06:32,780] Trial 36 pruned. 
[I 2026-03-18 17:06:36,173] Trial 22 finished with value: -0.6072377900084143 and parameters: {'n_layers_yyx': 2, 'hidden_size_yyx_l0': 5, 'hidden_size_yyx_l1': 4, 'context_size_yyx': 4, 'num_mix_components_yyx': 4, 'context_extractor_yyx': 'lstm', 'activation_func_yyx': 'ReLU', 'L2_weight_yyx': 1.2994263325918506e-10, 'L_entropy_weight_yyx': 3.6262354839989875e-09, 'L_sep_weight_yyx': 2.0093925698064256e-06, 'L_scale_weight_yyx': 0.00012842233318784263, 'learning_rate_yyx': 0.008535735033813396}. Best is trial 2 with value: -0.6113786030767988.
[I 2026-03-18 17:06:38,749] Trial 15 finished with value: -0.5634607789932944 and parameters: {'n_layers_yyx': 2, 'hidden_size_yyx_l0': 3, 'hidden_size_yyx_l1': 2, 'context_size_yyx': 1, 'num_mix_components_yyx': 3, 'context_extractor_yyx': 'gru', 'activation_func_yyx': 'Tanh', 'L2_weight_yyx': 2.024414180831034e-07, 'L_entropy_weight_yyx': 3.310780215851761e-08, 'L_sep_weight_yyx': 3.06880466241881e-07, 'L_scale_weight_yyx': 4.04869173649101e-07, 'learning_rate_yyx': 0.0016641964356497012}. Best is trial 6 with value: -0.5805135147115715.
[I 2026-03-18 17:06:47,747] Trial 9 pruned. 
[I 2026-03-18 17:06:53,000] Trial 33 pruned. 
[I 2026-03-18 17:06:54,164] Trial 37 pruned. 
[I 2026-03-18 17:06:58,437] Trial 23 pruned. 
[I 2026-03-18 17:07:06,418] Trial 16 pruned. 
[I 2026-03-18 17:07:09,147] Trial 3 finished with value: -2.8107348815787274 and parameters: {'n_layers_yyx': 2, 'hidden_size_yyx_l0': 3, 'hidden_size_yyx_l1': 5, 'context_size_yyx': 3, 'num_mix_components_yyx': 1, 'context_extractor_yyx': 'gru', 'activation_func_yyx': 'ReLU', 'L2_weight_yyx': 2.3053301359816995e-05, 'L_entropy_weight_yyx': 6.2384189024741475e-06, 'L_sep_weight_yyx': 7.008550340145499e-05, 'L_scale_weight_yyx': 1.704171380034856e-10, 'learning_rate_yyx': 0.004900809804369251}. Best is trial 1 with value: -2.875781089897074.
[I 2026-03-18 17:07:11,010] Trial 15 finished with value: -0.5738120518491554 and parameters: {'n_layers_yyx': 2, 'hidden_size_yyx_l0': 3, 'hidden_size_yyx_l1': 6, 'context_size_yyx': 4, 'num_mix_components_yyx': 3, 'context_extractor_yyx': 'gru', 'activation_func_yyx': 'GELU', 'L2_weight_yyx': 0.00034548966057072294, 'L_entropy_weight_yyx': 6.395288865112628e-09, 'L_sep_weight_yyx': 5.3454404945344435e-08, 'L_scale_weight_yyx': 9.678702080207899e-05, 'learning_rate_yyx': 0.005676448895879253}. Best is trial 10 with value: -0.57893176387068.
[I 2026-03-18 17:07:14,677] Trial 4 finished with value: -2.9105176593820916 and parameters: {'n_layers_yyx': 1, 'hidden_size_yyx_l0': 5, 'context_size_yyx': 1, 'num_mix_components_yyx': 4, 'context_extractor_yyx': 'lstm', 'activation_func_yyx': 'Tanh', 'L2_weight_yyx': 6.475948140264596e-10, 'L_entropy_weight_yyx': 1.931292848561865e-09, 'L_sep_weight_yyx': 2.3643327168328435e-06, 'L_scale_weight_yyx': 2.922425930076486e-08, 'learning_rate_yyx': 0.0025378633145485144}. Best is trial 0 with value: -2.957957273051406.
[I 2026-03-18 17:07:16,574] Trial 38 pruned. 
[I 2026-03-18 17:07:23,517] Trial 11 pruned. 
[I 2026-03-18 17:07:23,835] Trial 20 pruned. 
[I 2026-03-18 17:07:25,509] Trial 19 finished with value: -0.5552007578098135 and parameters: {'n_layers_yyx': 1, 'hidden_size_yyx_l0': 4, 'context_size_yyx': 4, 'num_mix_components_yyx': 3, 'context_extractor_yyx': 'lstm', 'activation_func_yyx': 'Tanh', 'L2_weight_yyx': 1.0107334553504955e-07, 'L_entropy_weight_yyx': 3.174392399040093e-06, 'L_sep_weight_yyx': 2.4702444743485348e-08, 'L_scale_weight_yyx': 1.3366578384215232e-05, 'learning_rate_yyx': 0.006561259212857783}. Best is trial 15 with value: -0.5782953233469631.
[I 2026-03-18 17:07:26,082] Trial 17 pruned. 
[I 2026-03-18 17:07:31,113] Trial 16 pruned. 
[I 2026-03-18 17:07:31,966] Trial 6 finished with value: -2.966045431578574 and parameters: {'n_layers_yyx': 2, 'hidden_size_yyx_l0': 4, 'hidden_size_yyx_l1': 6, 'context_size_yyx': 4, 'num_mix_components_yyx': 3, 'context_extractor_yyx': 'gru', 'activation_func_yyx': 'Tanh', 'L2_weight_yyx': 2.0716122860833722e-08, 'L_entropy_weight_yyx': 0.00026457951043022096, 'L_sep_weight_yyx': 1.313115542128068e-06, 'L_scale_weight_yyx': 1.5255918192109873e-08, 'learning_rate_yyx': 0.0074381128584254585}. Best is trial 6 with value: -2.966045431578574.
[I 2026-03-18 17:07:32,967] Trial 12 finished with value: -2.9421728675676846 and parameters: {'n_layers_yyx': 1, 'hidden_size_yyx_l0': 6, 'context_size_yyx': 3, 'num_mix_components_yyx': 4, 'context_extractor_yyx': 'gru', 'activation_func_yyx': 'ReLU', 'L2_weight_yyx': 4.860110212175072e-07, 'L_entropy_weight_yyx': 0.0005364793743400282, 'L_sep_weight_yyx': 1.1625629991913117e-10, 'L_scale_weight_yyx': 4.398273844511148e-09, 'learning_rate_yyx': 0.009762341672467059}. Best is trial 10 with value: -2.9487242821305313.
[I 2026-03-18 17:07:35,493] Trial 39 pruned. 
[I 2026-03-18 17:07:36,138] Trial 24 pruned. 
[I 2026-03-18 17:07:38,303] Trial 5 pruned. 
[I 2026-03-18 17:07:44,401] Trial 21 pruned. 
[I 2026-03-18 17:07:45,441] Trial 20 pruned. 
[I 2026-03-18 17:07:46,442] Trial 18 pruned. 
[I 2026-03-18 17:07:47,883] Trial 3 finished with value: -2.95615718224045 and parameters: {'n_layers_yyx': 1, 'hidden_size_yyx_l0': 5, 'context_size_yyx': 4, 'num_mix_components_yyx': 4, 'context_extractor_yyx': 'gru', 'activation_func_yyx': 'GELU', 'L2_weight_yyx': 0.0008879087918861301, 'L_entropy_weight_yyx': 2.602159814731076e-10, 'L_sep_weight_yyx': 4.230566539719847e-06, 'L_scale_weight_yyx': 2.3200954775284842e-10, 'learning_rate_yyx': 0.0030782816863757514}. Best is trial 3 with value: -2.95615718224045.
[I 2026-03-18 17:07:47,886] Trial 14 finished with value: -0.5603950846801926 and parameters: {'n_layers_yyx': 1, 'hidden_size_yyx_l0': 5, 'context_size_yyx': 3, 'num_mix_components_yyx': 4, 'context_extractor_yyx': 'lstm', 'activation_func_yyx': 'Tanh', 'L2_weight_yyx': 2.2557174668899183e-08, 'L_entropy_weight_yyx': 0.0007035101216257835, 'L_sep_weight_yyx': 1.9639135197897917e-05, 'L_scale_weight_yyx': 1.2678031423299841e-10, 'learning_rate_yyx': 0.009052651674189467}. Best is trial 0 with value: -0.5748618229547262.
[I 2026-03-18 17:07:48,992] Trial 14 finished with value: -0.570086325707101 and parameters: {'n_layers_yyx': 2, 'hidden_size_yyx_l0': 4, 'hidden_size_yyx_l1': 5, 'context_size_yyx': 2, 'num_mix_components_yyx': 3, 'context_extractor_yyx': 'lstm', 'activation_func_yyx': 'ReLU', 'L2_weight_yyx': 1.3137312536547415e-05, 'L_entropy_weight_yyx': 1.345518731006722e-07, 'L_sep_weight_yyx': 1.3875926531757054e-05, 'L_scale_weight_yyx': 5.068389982775337e-07, 'learning_rate_yyx': 0.006949868118716916}. Best is trial 13 with value: -0.5742619447563833.
[I 2026-03-18 17:07:49,173] Trial 12 pruned. 
[I 2026-03-18 17:07:49,754] Trial 17 pruned. 
[I 2026-03-18 17:07:52,732] Trial 8 finished with value: -2.801282520072964 and parameters: {'n_layers_yyx': 1, 'hidden_size_yyx_l0': 6, 'context_size_yyx': 1, 'num_mix_components_yyx': 1, 'context_extractor_yyx': 'lstm', 'activation_func_yyx': 'ReLU', 'L2_weight_yyx': 1.77729821723622e-06, 'L_entropy_weight_yyx': 1.8345467806250973e-10, 'L_sep_weight_yyx': 1.9254072155572158e-10, 'L_scale_weight_yyx': 9.78113970527145e-10, 'learning_rate_yyx': 0.0037100202722427983}. Best is trial 1 with value: -2.915453504445994.
[I 2026-03-18 17:07:55,609] Trial 12 finished with value: -2.9595510816550052 and parameters: {'n_layers_yyx': 2, 'hidden_size_yyx_l0': 6, 'hidden_size_yyx_l1': 6, 'context_size_yyx': 3, 'num_mix_components_yyx': 5, 'context_extractor_yyx': 'lstm', 'activation_func_yyx': 'Tanh', 'L2_weight_yyx': 8.808393424041131e-09, 'L_entropy_weight_yyx': 7.069653720092432e-09, 'L_sep_weight_yyx': 7.883739002404854e-08, 'L_scale_weight_yyx': 1.7756488865917386e-07, 'learning_rate_yyx': 0.008726492680561717}. Best is trial 12 with value: -2.9595510816550052.
[I 2026-03-18 17:07:56,058] Trial 13 pruned. 
[I 2026-03-18 17:08:02,752] Trial 21 pruned. 
[I 2026-03-18 17:08:03,346] Trial 22 pruned. 
[I 2026-03-18 17:08:06,798] Trial 15 pruned. 
[I 2026-03-18 17:08:07,147] Trial 15 pruned. 
[I 2026-03-18 17:08:08,261] Trial 16 pruned. 
[I 2026-03-18 17:08:08,593] Trial 18 pruned. 
[I 2026-03-18 17:08:12,240] Trial 40 pruned. 
[I 2026-03-18 17:08:12,362] Trial 13 pruned. 
[I 2026-03-18 17:08:12,522] Trial 9 pruned. 
[I 2026-03-18 17:08:16,432] Trial 7 pruned. 
[I 2026-03-18 17:08:17,195] Trial 10 pruned. 
[I 2026-03-18 17:08:17,387] Trial 14 pruned. 
[I 2026-03-18 17:08:21,968] Trial 22 pruned. 
[I 2026-03-18 17:08:26,916] Trial 16 pruned. 
[I 2026-03-18 17:08:26,948] Trial 16 pruned. 
[I 2026-03-18 17:08:40,856] Trial 23 pruned. 
[I 2026-03-18 17:08:40,857] Trial 8 pruned. 
[I 2026-03-18 17:08:42,529] Trial 23 pruned. 
[I 2026-03-18 17:08:47,613] Trial 17 pruned. 
[I 2026-03-18 17:08:48,622] Trial 34 finished with value: -0.38914770829050166 and parameters: {'n_layers_yyx': 1, 'hidden_size_yyx_l0': 6, 'context_size_yyx': 2, 'num_mix_components_yyx': 4, 'context_extractor_yyx': 'gru', 'activation_func_yyx': 'Tanh', 'L2_weight_yyx': 4.3295988268192893e-10, 'L_entropy_weight_yyx': 2.2776794727193603e-07, 'L_sep_weight_yyx': 3.256274878496426e-06, 'L_scale_weight_yyx': 2.0079854412662383e-09, 'learning_rate_yyx': 0.004074913562570375}. Best is trial 7 with value: -0.427185200316249.
[I 2026-03-18 17:08:49,274] Trial 12 finished with value: -0.5757319937054032 and parameters: {'n_layers_yyx': 1, 'hidden_size_yyx_l0': 4, 'context_size_yyx': 2, 'num_mix_components_yyx': 3, 'context_extractor_yyx': 'gru', 'activation_func_yyx': 'GELU', 'L2_weight_yyx': 3.796556127732477e-09, 'L_entropy_weight_yyx': 7.476536955622694e-06, 'L_sep_weight_yyx': 1.0451132470889987e-10, 'L_scale_weight_yyx': 1.6725949078488604e-10, 'learning_rate_yyx': 0.003758059408357294}. Best is trial 1 with value: -0.5818196838462861.
[I 2026-03-18 17:08:55,830] Trial 20 finished with value: -0.5691178438588055 and parameters: {'n_layers_yyx': 1, 'hidden_size_yyx_l0': 5, 'context_size_yyx': 3, 'num_mix_components_yyx': 4, 'context_extractor_yyx': 'lstm', 'activation_func_yyx': 'Tanh', 'L2_weight_yyx': 7.598968271470411e-10, 'L_entropy_weight_yyx': 7.998729549442032e-05, 'L_sep_weight_yyx': 6.904629284300523e-07, 'L_scale_weight_yyx': 9.103194960479358e-09, 'learning_rate_yyx': 0.008878712378748932}. Best is trial 6 with value: -0.5907732977991746.
[I 2026-03-18 17:08:59,600] Trial 8 pruned. 
[I 2026-03-18 17:09:00,335] Trial 24 pruned. 
[I 2026-03-18 17:09:02,078] Trial 24 pruned. 
[I 2026-03-18 17:09:02,516] Trial 25 pruned. 
[I 2026-03-18 17:09:04,121] Trial 9 pruned. 
[I 2026-03-18 17:09:18,937] Trial 25 pruned. 
[I 2026-03-18 17:09:20,517] Trial 9 pruned. 
[I 2026-03-18 17:09:21,575] Trial 35 pruned. 
[I 2026-03-18 17:09:21,639] Trial 26 pruned. 
[I 2026-03-18 17:09:35,316] Trial 25 pruned. 
[I 2026-03-18 17:09:38,769] Trial 41 pruned. 
[I 2026-03-18 17:09:39,689] Trial 27 pruned. 
[I 2026-03-18 17:09:40,957] Trial 9 finished with value: -2.9510968045279404 and parameters: {'n_layers_yyx': 1, 'hidden_size_yyx_l0': 3, 'context_size_yyx': 2, 'num_mix_components_yyx': 4, 'context_extractor_yyx': 'gru', 'activation_func_yyx': 'Tanh', 'L2_weight_yyx': 1.3745620162788158e-08, 'L_entropy_weight_yyx': 5.290610344183938e-06, 'L_sep_weight_yyx': 1.6617712259362114e-09, 'L_scale_weight_yyx': 2.537479872187443e-07, 'learning_rate_yyx': 0.007899745410433801}. Best is trial 9 with value: -2.9510968045279404.
