[I 2026-03-18 19:48:59,843] Trial 33 finished with value: -1.7042731037290078 and parameters: {'n_layers_yyx': 2, 'hidden_size_yyx_l0': 4, 'hidden_size_yyx_l1': 4, 'context_size_yyx': 2, 'num_mix_components_yyx': 2, 'context_extractor_yyx': 'lstm', 'activation_func_yyx': 'GELU', 'L2_weight_yyx': 2.420878350262542e-05, 'L_entropy_weight_yyx': 3.077872233376047e-08, 'L_sep_weight_yyx': 4.849958426397016e-10, 'L_scale_weight_yyx': 2.8304939533220318e-08, 'learning_rate_yyx': 0.007977704517613624}. Best is trial 5 with value: -1.704671424204909.
[I 2026-03-18 19:49:15,336] Trial 21 pruned. 
[I 2026-03-18 19:49:22,252] Trial 15 pruned. 
[I 2026-03-18 19:49:28,385] Trial 33 pruned. 
[I 2026-03-18 19:49:41,695] Trial 15 finished with value: -2.5083286396200726 and parameters: {'n_layers_yyx': 2, 'hidden_size_yyx_l0': 3, 'hidden_size_yyx_l1': 4, 'context_size_yyx': 3, 'num_mix_components_yyx': 1, 'context_extractor_yyx': 'lstm', 'activation_func_yyx': 'ReLU', 'L2_weight_yyx': 1.2374338880959578e-10, 'L_entropy_weight_yyx': 3.161337100738058e-08, 'L_sep_weight_yyx': 4.0314018726579834e-07, 'L_scale_weight_yyx': 7.744264386874995e-06, 'learning_rate_yyx': 0.003118203113317128}. Best is trial 1 with value: -2.511856338115334.
[I 2026-03-18 19:49:45,632] Trial 16 pruned. 
[I 2026-03-18 19:49:49,115] Trial 17 pruned. 
[I 2026-03-18 19:49:49,398] Trial 34 pruned. 
[I 2026-03-18 19:49:52,229] Trial 35 pruned. 
[I 2026-03-18 19:50:00,103] Trial 34 pruned. 
[I 2026-03-18 19:50:05,380] Trial 26 finished with value: -1.6792720737851394 and parameters: {'n_layers_yyx': 1, 'hidden_size_yyx_l0': 4, 'context_size_yyx': 3, 'num_mix_components_yyx': 4, 'context_extractor_yyx': 'gru', 'activation_func_yyx': 'GELU', 'L2_weight_yyx': 5.528207195458257e-09, 'L_entropy_weight_yyx': 2.087069660925081e-07, 'L_sep_weight_yyx': 1.2750426963100234e-08, 'L_scale_weight_yyx': 5.121225730186457e-10, 'learning_rate_yyx': 0.007063130795891903}. Best is trial 12 with value: -1.6796893990996478.
[I 2026-03-18 19:50:12,389] Trial 38 finished with value: -1.7080230214237389 and parameters: {'n_layers_yyx': 2, 'hidden_size_yyx_l0': 4, 'hidden_size_yyx_l1': 5, 'context_size_yyx': 3, 'num_mix_components_yyx': 5, 'context_extractor_yyx': 'lstm', 'activation_func_yyx': 'Tanh', 'L2_weight_yyx': 3.4537393231568623e-10, 'L_entropy_weight_yyx': 6.145518142927621e-07, 'L_sep_weight_yyx': 9.66343588480545e-07, 'L_scale_weight_yyx': 1.5269362895126555e-10, 'learning_rate_yyx': 0.0019729425292601796}. Best is trial 28 with value: -1.7181546080346202.
[I 2026-03-18 19:50:19,510] Trial 24 pruned. 
[I 2026-03-18 19:50:20,059] Trial 23 pruned. 
[I 2026-03-18 19:50:26,808] Trial 29 finished with value: -2.1089354378484115 and parameters: {'n_layers_yyx': 2, 'hidden_size_yyx_l0': 3, 'hidden_size_yyx_l1': 6, 'context_size_yyx': 1, 'num_mix_components_yyx': 1, 'context_extractor_yyx': 'lstm', 'activation_func_yyx': 'ReLU', 'L2_weight_yyx': 1.1257942227341067e-10, 'L_entropy_weight_yyx': 1.4933436872643252e-09, 'L_sep_weight_yyx': 9.65250585041111e-07, 'L_scale_weight_yyx': 3.38049142286882e-06, 'learning_rate_yyx': 0.008709288416452583}. Best is trial 0 with value: -2.1143376288427875.
[I 2026-03-18 19:50:35,542] Trial 16 pruned. 
[I 2026-03-18 19:50:46,552] Trial 15 finished with value: -2.5139556361607145 and parameters: {'n_layers_yyx': 1, 'hidden_size_yyx_l0': 5, 'context_size_yyx': 4, 'num_mix_components_yyx': 4, 'context_extractor_yyx': 'gru', 'activation_func_yyx': 'Tanh', 'L2_weight_yyx': 5.4034342632139306e-05, 'L_entropy_weight_yyx': 1.9183057517260754e-09, 'L_sep_weight_yyx': 0.0009220575934100283, 'L_scale_weight_yyx': 5.8327940657861954e-08, 'learning_rate_yyx': 0.006412733264620317}. Best is trial 5 with value: -2.5140323195684524.
[I 2026-03-18 19:50:47,728] Trial 24 pruned. 
[I 2026-03-18 19:50:53,780] Trial 35 pruned. 
[I 2026-03-18 19:50:54,489] Trial 40 pruned. 
[I 2026-03-18 19:50:56,222] Trial 35 pruned. 
[I 2026-03-18 19:50:57,055] Trial 30 pruned. 
[I 2026-03-18 19:50:57,147] Trial 18 pruned. 
[I 2026-03-18 19:51:11,562] Trial 25 pruned. 
[I 2026-03-18 19:51:16,901] Trial 29 pruned. 
[I 2026-03-18 19:51:18,621] Trial 36 pruned. 
[I 2026-03-18 19:51:19,574] Trial 22 finished with value: -1.9826049975606448 and parameters: {'n_layers_yyx': 1, 'hidden_size_yyx_l0': 5, 'context_size_yyx': 4, 'num_mix_components_yyx': 4, 'context_extractor_yyx': 'gru', 'activation_func_yyx': 'Tanh', 'L2_weight_yyx': 7.515670037840917e-07, 'L_entropy_weight_yyx': 0.00010441757855303858, 'L_sep_weight_yyx': 2.0053907358818615e-06, 'L_scale_weight_yyx': 4.6979598283203366e-07, 'learning_rate_yyx': 0.007739710046526773}. Best is trial 12 with value: -1.983840502266522.
[I 2026-03-18 19:51:25,885] Trial 19 pruned. 
[I 2026-03-18 19:51:30,862] Trial 15 finished with value: -2.0349881399350007 and parameters: {'n_layers_yyx': 1, 'hidden_size_yyx_l0': 6, 'context_size_yyx': 4, 'num_mix_components_yyx': 5, 'context_extractor_yyx': 'lstm', 'activation_func_yyx': 'ReLU', 'L2_weight_yyx': 2.515002842587149e-08, 'L_entropy_weight_yyx': 6.3651252136983e-09, 'L_sep_weight_yyx': 6.740156604472285e-08, 'L_scale_weight_yyx': 4.718070377759565e-09, 'learning_rate_yyx': 0.009674674240566162}. Best is trial 8 with value: -2.0365283470022115.
[I 2026-03-18 19:51:43,402] Trial 41 pruned. 
[I 2026-03-18 19:51:48,264] Trial 36 pruned. 
[I 2026-03-18 19:51:53,372] Trial 23 pruned. 
[I 2026-03-18 19:52:02,989] Trial 26 pruned. 
[I 2026-03-18 19:52:07,300] Trial 26 finished with value: -2.546194276609621 and parameters: {'n_layers_yyx': 2, 'hidden_size_yyx_l0': 2, 'hidden_size_yyx_l1': 6, 'context_size_yyx': 4, 'num_mix_components_yyx': 4, 'context_extractor_yyx': 'gru', 'activation_func_yyx': 'Tanh', 'L2_weight_yyx': 7.055241285943629e-09, 'L_entropy_weight_yyx': 2.063265794236042e-05, 'L_sep_weight_yyx': 5.067271921917713e-05, 'L_scale_weight_yyx': 4.07762675839056e-05, 'learning_rate_yyx': 0.009935881896011899}. Best is trial 16 with value: -2.5482089436137594.
[I 2026-03-18 19:52:12,969] Trial 27 pruned. 
[I 2026-03-18 19:52:13,544] Trial 33 pruned. 
[I 2026-03-18 19:52:17,349] Trial 39 pruned. 
[I 2026-03-18 19:52:17,350] Trial 30 pruned. 
[I 2026-03-18 19:52:19,954] Trial 37 pruned. 
[I 2026-03-18 19:52:28,704] Trial 25 pruned. 
[I 2026-03-18 19:52:30,772] Trial 13 finished with value: -2.514098890989485 and parameters: {'n_layers_yyx': 1, 'hidden_size_yyx_l0': 5, 'context_size_yyx': 1, 'num_mix_components_yyx': 4, 'context_extractor_yyx': 'lstm', 'activation_func_yyx': 'ReLU', 'L2_weight_yyx': 1.0790631261489671e-10, 'L_entropy_weight_yyx': 6.755820723161125e-09, 'L_sep_weight_yyx': 9.62723643002388e-07, 'L_scale_weight_yyx': 4.752428582437952e-09, 'learning_rate_yyx': 0.009187271539191976}. Best is trial 12 with value: -2.51518345292619.
[I 2026-03-18 19:52:31,339] Trial 37 finished with value: -1.666143328987033 and parameters: {'n_layers_yyx': 2, 'hidden_size_yyx_l0': 3, 'hidden_size_yyx_l1': 5, 'context_size_yyx': 4, 'num_mix_components_yyx': 2, 'context_extractor_yyx': 'gru', 'activation_func_yyx': 'GELU', 'L2_weight_yyx': 1.0037436129399658e-06, 'L_entropy_weight_yyx': 1.6001014923839827e-06, 'L_sep_weight_yyx': 4.058381330453965e-09, 'L_scale_weight_yyx': 4.853727706056569e-10, 'learning_rate_yyx': 0.008580572647828265}. Best is trial 23 with value: -1.668135777403489.
[I 2026-03-18 19:52:34,188] Trial 17 pruned. 
[I 2026-03-18 19:52:34,212] Trial 20 pruned. 
[I 2026-03-18 19:52:40,957] Trial 16 pruned. 
[I 2026-03-18 19:52:41,985] Trial 25 finished with value: -2.5130216403823584 and parameters: {'n_layers_yyx': 1, 'hidden_size_yyx_l0': 6, 'context_size_yyx': 1, 'num_mix_components_yyx': 5, 'context_extractor_yyx': 'lstm', 'activation_func_yyx': 'ReLU', 'L2_weight_yyx': 9.361564050802015e-05, 'L_entropy_weight_yyx': 1.3994318343935374e-07, 'L_sep_weight_yyx': 3.852164196963947e-07, 'L_scale_weight_yyx': 6.430283679861392e-09, 'learning_rate_yyx': 0.009337329556737817}. Best is trial 23 with value: -2.5132993257512335.
[I 2026-03-18 19:52:49,217] Trial 20 pruned. 
[I 2026-03-18 19:52:49,990] Trial 38 pruned. 
[I 2026-03-18 19:52:55,912] Trial 27 pruned. 
[I 2026-03-18 19:53:02,963] Trial 34 pruned. 
[I 2026-03-18 19:53:04,294] Trial 18 pruned. 
[I 2026-03-18 19:53:08,303] Trial 17 pruned. 
[I 2026-03-18 19:53:10,798] Trial 31 pruned. 
[I 2026-03-18 19:53:12,957] Trial 26 pruned. 
[I 2026-03-18 19:53:17,174] Trial 35 pruned. 
[I 2026-03-18 19:53:19,105] Trial 20 finished with value: -2.510878363203935 and parameters: {'n_layers_yyx': 1, 'hidden_size_yyx_l0': 4, 'context_size_yyx': 4, 'num_mix_components_yyx': 3, 'context_extractor_yyx': 'lstm', 'activation_func_yyx': 'GELU', 'L2_weight_yyx': 6.526866159608946e-06, 'L_entropy_weight_yyx': 4.260058532298428e-06, 'L_sep_weight_yyx': 7.911862330059027e-05, 'L_scale_weight_yyx': 5.766618226434733e-08, 'learning_rate_yyx': 0.004590858909063959}. Best is trial 1 with value: -2.5125601952756833.
[I 2026-03-18 19:53:21,649] Trial 23 finished with value: -2.513824905841335 and parameters: {'n_layers_yyx': 1, 'hidden_size_yyx_l0': 6, 'context_size_yyx': 4, 'num_mix_components_yyx': 2, 'context_extractor_yyx': 'gru', 'activation_func_yyx': 'GELU', 'L2_weight_yyx': 1.270863535765666e-06, 'L_entropy_weight_yyx': 0.00015203496867927238, 'L_sep_weight_yyx': 5.835812300184384e-09, 'L_scale_weight_yyx': 5.080850784614216e-10, 'learning_rate_yyx': 0.00726299681992776}. Best is trial 23 with value: -2.513824905841335.
[I 2026-03-18 19:53:21,703] Trial 18 pruned. 
[I 2026-03-18 19:53:24,088] Trial 39 pruned. 
[I 2026-03-18 19:53:24,779] Trial 37 finished with value: -1.725399361703164 and parameters: {'n_layers_yyx': 1, 'hidden_size_yyx_l0': 4, 'context_size_yyx': 2, 'num_mix_components_yyx': 4, 'context_extractor_yyx': 'lstm', 'activation_func_yyx': 'ReLU', 'L2_weight_yyx': 2.4996079201367816e-07, 'L_entropy_weight_yyx': 2.419791642414329e-07, 'L_sep_weight_yyx': 0.000111192222462229, 'L_scale_weight_yyx': 6.800372790141857e-08, 'learning_rate_yyx': 0.009991412957385721}. Best is trial 8 with value: -1.7294919135267302.
[I 2026-03-18 19:53:26,165] Trial 34 finished with value: -1.7027542835145484 and parameters: {'n_layers_yyx': 2, 'hidden_size_yyx_l0': 3, 'hidden_size_yyx_l1': 6, 'context_size_yyx': 3, 'num_mix_components_yyx': 1, 'context_extractor_yyx': 'lstm', 'activation_func_yyx': 'GELU', 'L2_weight_yyx': 2.0250872162243194e-05, 'L_entropy_weight_yyx': 3.8494467245318814e-08, 'L_sep_weight_yyx': 5.023801261308753e-10, 'L_scale_weight_yyx': 3.009437439700252e-08, 'learning_rate_yyx': 0.00831830253699165}. Best is trial 5 with value: -1.704671424204909.
[I 2026-03-18 19:53:28,398] Trial 16 pruned. 
[I 2026-03-18 19:53:33,977] Trial 27 pruned. 
[I 2026-03-18 19:53:35,249] Trial 19 pruned. 
[I 2026-03-18 19:53:36,461] Trial 32 pruned. 
[I 2026-03-18 19:53:37,276] Trial 19 finished with value: -2.013455176002442 and parameters: {'n_layers_yyx': 1, 'hidden_size_yyx_l0': 5, 'context_size_yyx': 4, 'num_mix_components_yyx': 1, 'context_extractor_yyx': 'gru', 'activation_func_yyx': 'GELU', 'L2_weight_yyx': 1.2025516880767941e-07, 'L_entropy_weight_yyx': 1.1789572083960169e-05, 'L_sep_weight_yyx': 6.261604924497309e-05, 'L_scale_weight_yyx': 8.139505548073884e-07, 'learning_rate_yyx': 0.004480714817234318}. Best is trial 0 with value: -2.0138799336866504.
[I 2026-03-18 19:53:38,689] Trial 33 finished with value: -1.6979314061450446 and parameters: {'n_layers_yyx': 1, 'hidden_size_yyx_l0': 2, 'context_size_yyx': 4, 'num_mix_components_yyx': 5, 'context_extractor_yyx': 'lstm', 'activation_func_yyx': 'Tanh', 'L2_weight_yyx': 8.91622153732466e-05, 'L_entropy_weight_yyx': 1.2729345392068366e-09, 'L_sep_weight_yyx': 2.106868401528166e-05, 'L_scale_weight_yyx': 9.920759731358551e-08, 'learning_rate_yyx': 0.007677343454752695}. Best is trial 18 with value: -1.7002973458681911.
[I 2026-03-18 19:53:39,550] Trial 24 pruned. 
[I 2026-03-18 19:53:40,043] Trial 36 pruned. 
[I 2026-03-18 19:53:40,490] Trial 17 pruned. 
[I 2026-03-18 19:53:41,879] Trial 36 finished with value: -1.971430254412127 and parameters: {'n_layers_yyx': 2, 'hidden_size_yyx_l0': 6, 'hidden_size_yyx_l1': 4, 'context_size_yyx': 4, 'num_mix_components_yyx': 2, 'context_extractor_yyx': 'lstm', 'activation_func_yyx': 'GELU', 'L2_weight_yyx': 3.201241242434939e-09, 'L_entropy_weight_yyx': 6.007401118867006e-08, 'L_sep_weight_yyx': 3.6855631432641605e-06, 'L_scale_weight_yyx': 1.2246588384351737e-07, 'learning_rate_yyx': 0.006315084793464032}. Best is trial 15 with value: -1.9940496908651817.
[I 2026-03-18 19:53:44,714] Trial 38 pruned. 
[I 2026-03-18 19:53:45,800] Trial 38 pruned. 
[I 2026-03-18 19:53:47,456] Trial 21 pruned. 
[I 2026-03-18 19:53:49,724] Trial 40 pruned. 
[I 2026-03-18 19:53:53,620] Trial 37 pruned. 
[I 2026-03-18 19:53:56,212] Trial 39 pruned. 
[I 2026-03-18 19:53:56,683] Trial 28 pruned. 
[I 2026-03-18 19:53:59,216] Trial 34 pruned. 
[I 2026-03-18 19:54:00,414] Trial 22 pruned. 
[I 2026-03-18 19:54:01,705] Trial 33 pruned. 
[I 2026-03-18 19:54:02,351] Trial 20 pruned. 
[I 2026-03-18 19:54:04,025] Trial 20 pruned. 
[I 2026-03-18 19:54:04,136] Trial 18 pruned. 
[I 2026-03-18 19:54:04,493] Trial 21 pruned. 
[I 2026-03-18 19:54:06,208] Trial 38 pruned. 
[I 2026-03-18 19:54:06,851] Trial 39 pruned. 
[I 2026-03-18 19:54:08,688] Trial 42 finished with value: -1.672129057738026 and parameters: {'n_layers_yyx': 1, 'hidden_size_yyx_l0': 5, 'context_size_yyx': 4, 'num_mix_components_yyx': 5, 'context_extractor_yyx': 'gru', 'activation_func_yyx': 'Tanh', 'L2_weight_yyx': 5.5042204454192745e-05, 'L_entropy_weight_yyx': 0.00017058590934616074, 'L_sep_weight_yyx': 6.06874647077559e-07, 'L_scale_weight_yyx': 0.0005847596811828053, 'learning_rate_yyx': 0.005406308735833014}. Best is trial 30 with value: -1.6758763736283075.
[I 2026-03-18 19:54:09,404] Trial 26 pruned. 
[I 2026-03-18 19:54:09,765] Trial 35 pruned. 
[I 2026-03-18 19:54:10,547] Trial 29 finished with value: -2.0228596854332306 and parameters: {'n_layers_yyx': 1, 'hidden_size_yyx_l0': 3, 'context_size_yyx': 3, 'num_mix_components_yyx': 4, 'context_extractor_yyx': 'gru', 'activation_func_yyx': 'Tanh', 'L2_weight_yyx': 6.814731352554335e-05, 'L_entropy_weight_yyx': 0.00013382634436830015, 'L_sep_weight_yyx': 2.6438300267312485e-09, 'L_scale_weight_yyx': 0.00022965855151692, 'learning_rate_yyx': 0.007908050265464055}. Best is trial 29 with value: -2.0228596854332306.
[I 2026-03-18 19:54:14,120] Trial 41 pruned. 
[I 2026-03-18 19:54:16,387] Trial 19 pruned. 
[I 2026-03-18 19:54:20,619] Trial 36 pruned. 
[I 2026-03-18 19:54:27,770] Trial 34 pruned. 
[I 2026-03-18 19:54:30,156] Trial 23 pruned. 
[I 2026-03-18 19:54:30,679] Trial 43 pruned. 
[I 2026-03-18 19:54:34,801] Trial 16 finished with value: -2.512398414248512 and parameters: {'n_layers_yyx': 1, 'hidden_size_yyx_l0': 5, 'context_size_yyx': 3, 'num_mix_components_yyx': 4, 'context_extractor_yyx': 'gru', 'activation_func_yyx': 'Tanh', 'L2_weight_yyx': 6.845110580413008e-05, 'L_entropy_weight_yyx': 1.112542023451895e-09, 'L_sep_weight_yyx': 2.5276051676407677e-06, 'L_scale_weight_yyx': 3.905368078679175e-08, 'learning_rate_yyx': 0.006086938393078249}. Best is trial 5 with value: -2.5140323195684524.
[I 2026-03-18 19:54:40,209] Trial 35 pruned. 
[I 2026-03-18 19:54:41,975] Trial 25 pruned. 
[I 2026-03-18 19:54:45,961] Trial 28 finished with value: -1.668398313141969 and parameters: {'n_layers_yyx': 1, 'hidden_size_yyx_l0': 6, 'context_size_yyx': 3, 'num_mix_components_yyx': 4, 'context_extractor_yyx': 'gru', 'activation_func_yyx': 'GELU', 'L2_weight_yyx': 9.931721738997483e-09, 'L_entropy_weight_yyx': 1.6461811329003813e-09, 'L_sep_weight_yyx': 9.392598328171495e-09, 'L_scale_weight_yyx': 1.9178435646763054e-07, 'learning_rate_yyx': 0.008478012758974808}. Best is trial 12 with value: -1.6796893990996478.
[I 2026-03-18 19:54:47,840] Trial 17 pruned. 
[I 2026-03-18 19:54:48,557] Trial 40 pruned. 
[I 2026-03-18 19:54:50,853] Trial 29 pruned. 
[I 2026-03-18 19:54:51,357] Trial 22 finished with value: -2.5155989726836543 and parameters: {'n_layers_yyx': 2, 'hidden_size_yyx_l0': 4, 'hidden_size_yyx_l1': 2, 'context_size_yyx': 4, 'num_mix_components_yyx': 4, 'context_extractor_yyx': 'gru', 'activation_func_yyx': 'ReLU', 'L2_weight_yyx': 2.227264980920233e-05, 'L_entropy_weight_yyx': 1.1562429717761013e-06, 'L_sep_weight_yyx': 2.838088412897911e-06, 'L_scale_weight_yyx': 6.912253222610118e-05, 'learning_rate_yyx': 0.007171613300452486}. Best is trial 22 with value: -2.5155989726836543.
[I 2026-03-18 19:54:52,843] Trial 21 finished with value: -1.6800487615465258 and parameters: {'n_layers_yyx': 2, 'hidden_size_yyx_l0': 4, 'hidden_size_yyx_l1': 4, 'context_size_yyx': 4, 'num_mix_components_yyx': 4, 'context_extractor_yyx': 'gru', 'activation_func_yyx': 'Tanh', 'L2_weight_yyx': 1.4453490336539438e-08, 'L_entropy_weight_yyx': 1.5843860568232308e-10, 'L_sep_weight_yyx': 0.00013679337889618314, 'L_scale_weight_yyx': 8.293681139222993e-07, 'learning_rate_yyx': 0.00914519067962076}. Best is trial 15 with value: -1.6819845856754096.
[I 2026-03-18 19:54:59,018] Trial 19 finished with value: -2.5120953271346314 and parameters: {'n_layers_yyx': 2, 'hidden_size_yyx_l0': 6, 'hidden_size_yyx_l1': 5, 'context_size_yyx': 4, 'num_mix_components_yyx': 4, 'context_extractor_yyx': 'gru', 'activation_func_yyx': 'ReLU', 'L2_weight_yyx': 5.964687070617994e-09, 'L_entropy_weight_yyx': 4.457919986928791e-10, 'L_sep_weight_yyx': 0.00014579059492396485, 'L_scale_weight_yyx': 5.391849978283772e-05, 'learning_rate_yyx': 0.009859312084418412}. Best is trial 10 with value: -2.5122732552574223.
[I 2026-03-18 19:54:59,446] Trial 41 pruned. 
[I 2026-03-18 19:55:01,142] Trial 37 pruned. 
[I 2026-03-18 19:55:01,273] Trial 40 pruned. 
[I 2026-03-18 19:55:02,439] Trial 30 pruned. 
[I 2026-03-18 19:55:04,813] Trial 21 pruned. 
[I 2026-03-18 19:55:05,022] Trial 35 finished with value: -1.7037148663378137 and parameters: {'n_layers_yyx': 2, 'hidden_size_yyx_l0': 3, 'hidden_size_yyx_l1': 6, 'context_size_yyx': 4, 'num_mix_components_yyx': 1, 'context_extractor_yyx': 'lstm', 'activation_func_yyx': 'GELU', 'L2_weight_yyx': 2.4363328355884705e-05, 'L_entropy_weight_yyx': 3.887983449770471e-08, 'L_sep_weight_yyx': 4.889978472207174e-10, 'L_scale_weight_yyx': 2.1007564283931143e-07, 'learning_rate_yyx': 0.007272526040905259}. Best is trial 5 with value: -1.704671424204909.
[I 2026-03-18 19:55:08,072] Trial 39 pruned. 
[I 2026-03-18 19:55:08,079] Trial 29 pruned. 
[I 2026-03-18 19:55:10,153] Trial 42 pruned. 
[I 2026-03-18 19:55:12,130] Trial 20 pruned. 
[I 2026-03-18 19:55:12,132] Trial 17 finished with value: -2.509193077936392 and parameters: {'n_layers_yyx': 1, 'hidden_size_yyx_l0': 5, 'context_size_yyx': 4, 'num_mix_components_yyx': 2, 'context_extractor_yyx': 'gru', 'activation_func_yyx': 'ReLU', 'L2_weight_yyx': 7.863380269006208e-07, 'L_entropy_weight_yyx': 4.016821997503164e-06, 'L_sep_weight_yyx': 1.3693419662758327e-08, 'L_scale_weight_yyx': 2.586046002534927e-07, 'learning_rate_yyx': 0.006882376446467839}. Best is trial 1 with value: -2.511856338115334.
[I 2026-03-18 19:55:13,559] Trial 30 pruned. 
[I 2026-03-18 19:55:14,306] Trial 22 pruned. 
[I 2026-03-18 19:55:15,054] Trial 36 pruned. 
[I 2026-03-18 19:55:16,167] Trial 22 pruned. 
[I 2026-03-18 19:55:16,271] Trial 21 pruned. 
[I 2026-03-18 19:55:16,272] Trial 22 pruned. 
[I 2026-03-18 19:55:17,357] Trial 42 pruned. 
[I 2026-03-18 19:55:18,458] Trial 30 pruned. 
[I 2026-03-18 19:55:18,616] Trial 20 pruned. 
[I 2026-03-18 19:55:19,093] Trial 40 finished with value: -1.718781614615247 and parameters: {'n_layers_yyx': 2, 'hidden_size_yyx_l0': 4, 'hidden_size_yyx_l1': 3, 'context_size_yyx': 3, 'num_mix_components_yyx': 4, 'context_extractor_yyx': 'lstm', 'activation_func_yyx': 'GELU', 'L2_weight_yyx': 4.5444059201718005e-05, 'L_entropy_weight_yyx': 8.110988638850483e-09, 'L_sep_weight_yyx': 4.4819028719050244e-09, 'L_scale_weight_yyx': 0.00047422485525976934, 'learning_rate_yyx': 0.009838733873539883}. Best is trial 40 with value: -1.718781614615247.
[I 2026-03-18 19:55:20,446] Trial 27 pruned. 
[I 2026-03-18 19:55:21,362] Trial 38 pruned. 
[I 2026-03-18 19:55:24,154] Trial 31 pruned. 
[I 2026-03-18 19:55:25,448] Trial 37 pruned. 
[I 2026-03-18 19:55:25,764] Trial 23 pruned. 
[I 2026-03-18 19:55:27,165] Trial 18 pruned. 
[I 2026-03-18 19:55:28,868] Trial 23 pruned. 
[I 2026-03-18 19:55:30,344] Trial 41 pruned. 
[I 2026-03-18 19:55:35,945] Trial 32 pruned. 
[I 2026-03-18 19:55:37,270] Trial 28 finished with value: -1.6772628556874325 and parameters: {'n_layers_yyx': 2, 'hidden_size_yyx_l0': 5, 'hidden_size_yyx_l1': 4, 'context_size_yyx': 3, 'num_mix_components_yyx': 3, 'context_extractor_yyx': 'lstm', 'activation_func_yyx': 'Tanh', 'L2_weight_yyx': 3.7689887503242826e-06, 'L_entropy_weight_yyx': 6.479139422476798e-08, 'L_sep_weight_yyx': 3.5978710219713655e-09, 'L_scale_weight_yyx': 2.9324681860189393e-09, 'learning_rate_yyx': 0.004121634833753371}. Best is trial 7 with value: -1.6801514889058558.
[I 2026-03-18 19:55:39,378] Trial 15 finished with value: -2.5103594895919237 and parameters: {'n_layers_yyx': 1, 'hidden_size_yyx_l0': 6, 'context_size_yyx': 2, 'num_mix_components_yyx': 4, 'context_extractor_yyx': 'gru', 'activation_func_yyx': 'Tanh', 'L2_weight_yyx': 9.829564200135691e-08, 'L_entropy_weight_yyx': 3.7041506773863285e-06, 'L_sep_weight_yyx': 7.94111579839378e-06, 'L_scale_weight_yyx': 2.1183560059627936e-09, 'learning_rate_yyx': 0.0017761330604647528}. Best is trial 0 with value: -2.511745534136428.
[I 2026-03-18 19:55:40,472] Trial 42 pruned. 
