[I 2026-03-18 20:22:37,557] Trial 49 finished with value: -1.9814932039891662 and parameters: {'n_layers_yyx': 1, 'hidden_size_yyx_l0': 6, 'context_size_yyx': 4, 'num_mix_components_yyx': 3, 'context_extractor_yyx': 'gru', 'activation_func_yyx': 'Tanh', 'L2_weight_yyx': 1.4856994027577745e-05, 'L_entropy_weight_yyx': 1.5092216316417095e-08, 'L_sep_weight_yyx': 1.348706263215785e-08, 'L_scale_weight_yyx': 9.082954866364843e-05, 'learning_rate_yyx': 0.00464477675666208}. Best is trial 12 with value: -1.983840502266522.

Source events: 18269
Target events: 54211
Full model ln_yyx : 3584.79410 nats/sec, 59.51402 nats/event
Full model Log loss : -1.95711
Full model ln_yyx : 3609.22504 nats/sec, 59.91962 nats/event
Full model Log loss : -1.97904
Full model ln_yyx : 3625.80149 nats/sec, 60.19482 nats/event
Full model Log loss : -1.98098
Full model ln_yyx : 3644.00623 nats/sec, 60.49705 nats/event
Full model Log loss : -1.98019
Full model ln_yyx : 3651.89067 nats/sec, 60.62795 nats/event
Full model Log loss : -1.98136
Full model ln_yyx : 3594.28610 nats/sec, 59.67161 nats/event
Full model Log loss : -1.95482
Full model ln_yyx : 3569.78835 nats/sec, 59.26490 nats/event
Full model Log loss : -1.95600
Full model ln_yyx : 3609.79468 nats/sec, 59.92908 nats/event
Full model Log loss : -1.98384
Full model ln_yyx : 3612.85316 nats/sec, 59.97985 nats/event
Full model Log loss : -1.98302
Full model ln_yyx : 3592.29615 nats/sec, 59.63857 nats/event
Full model Log loss : -1.98316
Full model ln_yyx : 3617.70611 nats/sec, 60.06042 nats/event
Full model Log loss : -1.98284
Full model ln_yyx : 3623.48016 nats/sec, 60.15628 nats/event
Full model Log loss : -1.98260
Full model ln_yyx : 3619.10766 nats/sec, 60.08369 nats/event
Full model Log loss : -1.98279
Full model ln_yyx : 3618.46826 nats/sec, 60.07307 nats/event
Full model Log loss : -1.98199
Full model ln_yyx : 3625.09002 nats/sec, 60.18301 nats/event
Full model Log loss : -1.98264
Full model ln_yyx : 3624.56020 nats/sec, 60.17421 nats/event
Full model Log loss : -1.98256
Full model ln_yyx : 3611.25810 nats/sec, 59.95337 nats/event
Full model Log loss : -1.98149
Optimization finished. Config saved to results/opt-full/opt_full_316_best_config.txt
[I 2026-03-18 20:22:44,130] Trial 40 pruned. 
[I 2026-03-18 20:22:53,321] Trial 46 pruned. 
[I 2026-03-18 20:22:57,779] Trial 41 finished with value: -2.5106392848727617 and parameters: {'n_layers_yyx': 1, 'hidden_size_yyx_l0': 4, 'context_size_yyx': 4, 'num_mix_components_yyx': 3, 'context_extractor_yyx': 'lstm', 'activation_func_yyx': 'GELU', 'L2_weight_yyx': 8.295425396466976e-06, 'L_entropy_weight_yyx': 1.1561843123091465e-07, 'L_sep_weight_yyx': 6.175409277982841e-05, 'L_scale_weight_yyx': 3.3615275940889484e-08, 'learning_rate_yyx': 0.00496135185172835}. Best is trial 33 with value: -2.512931905705113.
[I 2026-03-18 20:22:59,109] Trial 41 pruned. 
[I 2026-03-18 20:23:07,015] Trial 28 pruned. 
[I 2026-03-18 20:23:13,474] Trial 42 pruned. 
[I 2026-03-18 20:23:21,551] Trial 47 pruned. 
[I 2026-03-18 20:23:21,656] Trial 29 pruned. 
[I 2026-03-18 20:23:25,173] Trial 44 finished with value: -2.496439389616223 and parameters: {'n_layers_yyx': 2, 'hidden_size_yyx_l0': 5, 'hidden_size_yyx_l1': 6, 'context_size_yyx': 4, 'num_mix_components_yyx': 3, 'context_extractor_yyx': 'lstm', 'activation_func_yyx': 'ReLU', 'L2_weight_yyx': 2.0975955085467143e-06, 'L_entropy_weight_yyx': 2.3164532441054014e-10, 'L_sep_weight_yyx': 0.00059955543387093, 'L_scale_weight_yyx': 1.2397783047525425e-09, 'learning_rate_yyx': 0.006480945594459009}. Best is trial 21 with value: -2.5132035092741223.
[I 2026-03-18 20:23:26,446] Trial 25 pruned. 
[I 2026-03-18 20:23:42,315] Trial 45 pruned. 
[I 2026-03-18 20:24:04,306] Trial 34 finished with value: -2.509862967354911 and parameters: {'n_layers_yyx': 1, 'hidden_size_yyx_l0': 5, 'context_size_yyx': 4, 'num_mix_components_yyx': 3, 'context_extractor_yyx': 'gru', 'activation_func_yyx': 'ReLU', 'L2_weight_yyx': 1.479523842498984e-09, 'L_entropy_weight_yyx': 2.432950854034106e-09, 'L_sep_weight_yyx': 0.0003659186972623777, 'L_scale_weight_yyx': 2.6366172919637913e-08, 'learning_rate_yyx': 0.000695560342138312}. Best is trial 5 with value: -2.5140323195684524.
[I 2026-03-18 20:24:10,233] Trial 41 pruned. 
[I 2026-03-18 20:24:17,131] Trial 35 pruned. 
[I 2026-03-18 20:24:23,095] Trial 48 pruned. 
[I 2026-03-18 20:24:24,268] Trial 42 finished with value: -2.513434798575931 and parameters: {'n_layers_yyx': 1, 'hidden_size_yyx_l0': 6, 'context_size_yyx': 4, 'num_mix_components_yyx': 2, 'context_extractor_yyx': 'gru', 'activation_func_yyx': 'GELU', 'L2_weight_yyx': 7.497820119141675e-06, 'L_entropy_weight_yyx': 4.3783304162645e-05, 'L_sep_weight_yyx': 1.2504501418335345e-09, 'L_scale_weight_yyx': 1.519274720386653e-08, 'learning_rate_yyx': 0.009936988314818165}. Best is trial 23 with value: -2.513824905841335.
[I 2026-03-18 20:24:26,994] Trial 45 finished with value: -2.503818860904191 and parameters: {'n_layers_yyx': 1, 'hidden_size_yyx_l0': 6, 'context_size_yyx': 4, 'num_mix_components_yyx': 4, 'context_extractor_yyx': 'gru', 'activation_func_yyx': 'Tanh', 'L2_weight_yyx': 4.450237138185257e-06, 'L_entropy_weight_yyx': 0.0009739405989088218, 'L_sep_weight_yyx': 5.864085793482139e-08, 'L_scale_weight_yyx': 4.680310378557679e-09, 'learning_rate_yyx': 0.008023060701573109}. Best is trial 44 with value: -2.5046955552212027.
[I 2026-03-18 20:24:27,026] Trial 43 finished with value: -2.012674420228226 and parameters: {'n_layers_yyx': 1, 'hidden_size_yyx_l0': 4, 'context_size_yyx': 4, 'num_mix_components_yyx': 2, 'context_extractor_yyx': 'gru', 'activation_func_yyx': 'GELU', 'L2_weight_yyx': 4.477578890253222e-06, 'L_entropy_weight_yyx': 3.2587603802739346e-06, 'L_sep_weight_yyx': 1.0932764637749434e-05, 'L_scale_weight_yyx': 0.0001877998164703725, 'learning_rate_yyx': 0.008486465479757574}. Best is trial 0 with value: -2.0138799336866504.
[I 2026-03-18 20:24:30,312] Trial 49 pruned. 

Source events: 18269
Target events: 3828
Full model ln_yyx : 255.83455 nats/sec, 60.14919 nats/event
Full model Log loss : -2.00856
Full model ln_yyx : 259.07758 nats/sec, 60.91166 nats/event
Full model Log loss : -2.03470
Full model ln_yyx : 259.65961 nats/sec, 61.04850 nats/event
Full model Log loss : -2.02661
Full model ln_yyx : 256.84157 nats/sec, 60.38595 nats/event
Full model Log loss : -2.03257
Full model ln_yyx : 257.17554 nats/sec, 60.46447 nats/event
Full model Log loss : -2.03288
Full model ln_yyx : 258.81231 nats/sec, 60.84929 nats/event
Full model Log loss : -2.03308
Full model ln_yyx : 256.76195 nats/sec, 60.36723 nats/event
Full model Log loss : -2.03653
Full model ln_yyx : 258.24951 nats/sec, 60.71697 nats/event
Full model Log loss : -2.03613
Full model ln_yyx : 259.91459 nats/sec, 61.10845 nats/event
Full model Log loss : -2.03496
Full model ln_yyx : 255.96051 nats/sec, 60.17880 nats/event
Full model Log loss : -2.03499
Full model ln_yyx : 256.69993 nats/sec, 60.35265 nats/event
Full model Log loss : -2.03569
Full model ln_yyx : 256.05163 nats/sec, 60.20023 nats/event
Full model Log loss : -2.03497
Full model ln_yyx : 255.98369 nats/sec, 60.18425 nats/event
Full model Log loss : -2.03498
Full model ln_yyx : 257.22071 nats/sec, 60.47509 nats/event
Full model Log loss : -2.03239
Full model ln_yyx : 255.96619 nats/sec, 60.18014 nats/event
Full model Log loss : -2.03528
Full model ln_yyx : 255.92794 nats/sec, 60.17115 nats/event
Full model Log loss : -2.03498
Full model ln_yyx : 256.29362 nats/sec, 60.25712 nats/event
Full model Log loss : -2.03511
Optimization finished. Config saved to results/opt-full/opt_full_315_best_config.txt
[I 2026-03-18 20:24:33,498] Trial 44 pruned. 
[I 2026-03-18 20:24:34,856] Trial 26 pruned. 
[I 2026-03-18 20:24:52,292] Trial 46 pruned. 
[I 2026-03-18 20:25:02,722] Trial 27 pruned. 
[I 2026-03-18 20:25:04,346] Trial 47 pruned. 
[I 2026-03-18 20:25:10,935] Trial 36 finished with value: -2.5139452208666837 and parameters: {'n_layers_yyx': 2, 'hidden_size_yyx_l0': 5, 'hidden_size_yyx_l1': 4, 'context_size_yyx': 1, 'num_mix_components_yyx': 2, 'context_extractor_yyx': 'gru', 'activation_func_yyx': 'ReLU', 'L2_weight_yyx': 3.766797692206302e-10, 'L_entropy_weight_yyx': 7.669876964551786e-09, 'L_sep_weight_yyx': 3.019561398117813e-08, 'L_scale_weight_yyx': 1.853632574897456e-05, 'learning_rate_yyx': 0.009757077566884046}. Best is trial 36 with value: -2.5139452208666837.
[I 2026-03-18 20:25:11,564] Trial 42 pruned. 
[I 2026-03-18 20:25:15,396] Trial 38 finished with value: -2.51086937300762 and parameters: {'n_layers_yyx': 2, 'hidden_size_yyx_l0': 5, 'hidden_size_yyx_l1': 4, 'context_size_yyx': 4, 'num_mix_components_yyx': 4, 'context_extractor_yyx': 'gru', 'activation_func_yyx': 'ReLU', 'L2_weight_yyx': 7.472571416474814e-07, 'L_entropy_weight_yyx': 1.0548842740863918e-06, 'L_sep_weight_yyx': 3.107959611204128e-09, 'L_scale_weight_yyx': 1.4992554029845953e-05, 'learning_rate_yyx': 0.00280271873608131}. Best is trial 22 with value: -2.5155989726836543.
[I 2026-03-18 20:25:23,635] Trial 43 pruned. 
[I 2026-03-18 20:25:23,635] Trial 37 pruned. 
[I 2026-03-18 20:25:27,707] Trial 30 finished with value: -2.496977407903069 and parameters: {'n_layers_yyx': 2, 'hidden_size_yyx_l0': 4, 'hidden_size_yyx_l1': 6, 'context_size_yyx': 2, 'num_mix_components_yyx': 3, 'context_extractor_yyx': 'lstm', 'activation_func_yyx': 'Tanh', 'L2_weight_yyx': 4.294872253311411e-05, 'L_entropy_weight_yyx': 1.935097706404697e-10, 'L_sep_weight_yyx': 6.107714483223556e-07, 'L_scale_weight_yyx': 0.0008244617509435918, 'learning_rate_yyx': 0.0062512692526259985}. Best is trial 26 with value: -2.512613867095458.
[I 2026-03-18 20:25:30,976] Trial 46 finished with value: -2.5125202606805197 and parameters: {'n_layers_yyx': 2, 'hidden_size_yyx_l0': 5, 'hidden_size_yyx_l1': 4, 'context_size_yyx': 4, 'num_mix_components_yyx': 3, 'context_extractor_yyx': 'lstm', 'activation_func_yyx': 'ReLU', 'L2_weight_yyx': 5.649854123652857e-06, 'L_entropy_weight_yyx': 0.000322100117368942, 'L_sep_weight_yyx': 9.695467483799372e-06, 'L_scale_weight_yyx': 6.993158602729086e-07, 'learning_rate_yyx': 0.008909002682875282}. Best is trial 21 with value: -2.5132035092741223.
[I 2026-03-18 20:25:38,745] Trial 38 pruned. 
[I 2026-03-18 20:25:43,539] Trial 31 pruned. 
[I 2026-03-18 20:25:53,549] Trial 44 pruned. 
[I 2026-03-18 20:25:55,698] Trial 42 finished with value: -2.5115835317171085 and parameters: {'n_layers_yyx': 1, 'hidden_size_yyx_l0': 6, 'context_size_yyx': 1, 'num_mix_components_yyx': 5, 'context_extractor_yyx': 'lstm', 'activation_func_yyx': 'ReLU', 'L2_weight_yyx': 0.00046951403415716443, 'L_entropy_weight_yyx': 2.112329765642922e-08, 'L_sep_weight_yyx': 8.800892174465453e-07, 'L_scale_weight_yyx': 1.4716264556849292e-08, 'learning_rate_yyx': 0.009970459146956254}. Best is trial 23 with value: -2.5132993257512335.
[I 2026-03-18 20:26:04,285] Trial 47 pruned. 
[I 2026-03-18 20:26:06,088] Trial 45 pruned. 
[I 2026-03-18 20:26:18,802] Trial 43 finished with value: -2.4979930075916 and parameters: {'n_layers_yyx': 1, 'hidden_size_yyx_l0': 6, 'context_size_yyx': 4, 'num_mix_components_yyx': 3, 'context_extractor_yyx': 'gru', 'activation_func_yyx': 'GELU', 'L2_weight_yyx': 9.69588833899066e-06, 'L_entropy_weight_yyx': 7.344816593432454e-07, 'L_sep_weight_yyx': 1.621845023041469e-09, 'L_scale_weight_yyx': 1.0571218412034204e-06, 'learning_rate_yyx': 0.009274114002700205}. Best is trial 23 with value: -2.513824905841335.
[I 2026-03-18 20:26:19,843] Trial 48 pruned. 
[I 2026-03-18 20:26:24,065] Trial 43 pruned. 
[I 2026-03-18 20:26:31,675] Trial 49 pruned. 

Source events: 27060
Target events: 39192
Full model ln_yyx : 4491.96952 nats/sec, 103.15300 nats/event
Full model Log loss : -2.50646
Full model ln_yyx : 4486.98165 nats/sec, 103.03846 nats/event
Full model Log loss : -2.50854
Full model ln_yyx : 4490.96150 nats/sec, 103.12986 nats/event
Full model Log loss : -2.50638
Full model ln_yyx : 4454.59299 nats/sec, 102.29470 nats/event
Full model Log loss : -2.49408
Full model ln_yyx : 4512.42005 nats/sec, 103.62263 nats/event
Full model Log loss : -2.51227
Full model ln_yyx : 4514.61557 nats/sec, 103.67305 nats/event
Full model Log loss : -2.51210
Full model ln_yyx : 4539.47564 nats/sec, 104.24393 nats/event
Full model Log loss : -2.51131
Full model ln_yyx : 4494.90290 nats/sec, 103.22037 nats/event
Full model Log loss : -2.51210
Full model ln_yyx : 4515.47592 nats/sec, 103.69280 nats/event
Full model Log loss : -2.51320
Full model ln_yyx : 4508.71558 nats/sec, 103.53756 nats/event
Full model Log loss : -2.49688
Full model ln_yyx : 4518.02090 nats/sec, 103.75125 nats/event
Full model Log loss : -2.51083
Full model ln_yyx : 4501.11056 nats/sec, 103.36292 nats/event
Full model Log loss : -2.51181
Full model ln_yyx : 4547.24068 nats/sec, 104.42224 nats/event
Full model Log loss : -2.51194
Full model ln_yyx : 4485.52588 nats/sec, 103.00503 nats/event
Full model Log loss : -2.49644
Full model ln_yyx : 4539.26958 nats/sec, 104.23920 nats/event
Full model Log loss : -2.51252
Optimization finished. Config saved to results/opt-full/opt_full_298_best_config.txt
[I 2026-03-18 20:26:32,386] Trial 46 pruned. 
[I 2026-03-18 20:26:45,622] Trial 45 finished with value: -2.011945419916345 and parameters: {'n_layers_yyx': 1, 'hidden_size_yyx_l0': 5, 'context_size_yyx': 4, 'num_mix_components_yyx': 4, 'context_extractor_yyx': 'gru', 'activation_func_yyx': 'ReLU', 'L2_weight_yyx': 8.967987636424415e-05, 'L_entropy_weight_yyx': 5.259802241252319e-10, 'L_sep_weight_yyx': 2.2617812011091414e-05, 'L_scale_weight_yyx': 3.984807975175569e-06, 'learning_rate_yyx': 0.004663833470183707}. Best is trial 0 with value: -2.0138799336866504.
[I 2026-03-18 20:26:55,254] Trial 39 pruned. 
[I 2026-03-18 20:27:10,379] Trial 43 finished with value: -2.511268666057964 and parameters: {'n_layers_yyx': 1, 'hidden_size_yyx_l0': 3, 'context_size_yyx': 4, 'num_mix_components_yyx': 2, 'context_extractor_yyx': 'lstm', 'activation_func_yyx': 'GELU', 'L2_weight_yyx': 0.00012486182044687196, 'L_entropy_weight_yyx': 3.2956443970828387e-07, 'L_sep_weight_yyx': 5.824953633657283e-06, 'L_scale_weight_yyx': 5.280909704815832e-08, 'learning_rate_yyx': 0.005205274486281059}. Best is trial 33 with value: -2.512931905705113.
[I 2026-03-18 20:27:20,504] Trial 36 finished with value: -2.5089616059802826 and parameters: {'n_layers_yyx': 2, 'hidden_size_yyx_l0': 5, 'hidden_size_yyx_l1': 5, 'context_size_yyx': 2, 'num_mix_components_yyx': 4, 'context_extractor_yyx': 'gru', 'activation_func_yyx': 'ReLU', 'L2_weight_yyx': 6.484609025078159e-08, 'L_entropy_weight_yyx': 1.438597226908519e-06, 'L_sep_weight_yyx': 6.588190870315319e-05, 'L_scale_weight_yyx': 9.846279443704588e-09, 'learning_rate_yyx': 0.006795855065846143}. Best is trial 5 with value: -2.5140323195684524.
[I 2026-03-18 20:27:26,655] Trial 40 pruned. 
[I 2026-03-18 20:27:29,473] Trial 48 finished with value: -2.5042858389920966 and parameters: {'n_layers_yyx': 1, 'hidden_size_yyx_l0': 6, 'context_size_yyx': 4, 'num_mix_components_yyx': 4, 'context_extractor_yyx': 'lstm', 'activation_func_yyx': 'Tanh', 'L2_weight_yyx': 9.816986721113025e-10, 'L_entropy_weight_yyx': 4.963076319286974e-06, 'L_sep_weight_yyx': 2.731488028886886e-07, 'L_scale_weight_yyx': 7.956112092232268e-07, 'learning_rate_yyx': 0.00549442026855197}. Best is trial 44 with value: -2.5046955552212027.
[I 2026-03-18 20:27:32,855] Trial 39 finished with value: -2.5150903405951515 and parameters: {'n_layers_yyx': 2, 'hidden_size_yyx_l0': 2, 'hidden_size_yyx_l1': 5, 'context_size_yyx': 3, 'num_mix_components_yyx': 5, 'context_extractor_yyx': 'lstm', 'activation_func_yyx': 'ReLU', 'L2_weight_yyx': 2.585009231493996e-05, 'L_entropy_weight_yyx': 3.922328215118745e-06, 'L_sep_weight_yyx': 1.480773091823871e-07, 'L_scale_weight_yyx': 0.00012834016359035812, 'learning_rate_yyx': 0.008714050666849958}. Best is trial 22 with value: -2.5155989726836543.
[I 2026-03-18 20:27:33,892] Trial 37 pruned. 
[I 2026-03-18 20:27:38,465] Trial 44 pruned. 
[I 2026-03-18 20:27:47,338] Trial 46 pruned. 
[I 2026-03-18 20:27:55,584] Trial 41 pruned. 
[I 2026-03-18 20:28:00,373] Trial 44 finished with value: -2.498242659213743 and parameters: {'n_layers_yyx': 1, 'hidden_size_yyx_l0': 6, 'context_size_yyx': 4, 'num_mix_components_yyx': 1, 'context_extractor_yyx': 'lstm', 'activation_func_yyx': 'GELU', 'L2_weight_yyx': 4.7271428439425934e-05, 'L_entropy_weight_yyx': 3.981150473072349e-06, 'L_sep_weight_yyx': 6.698651476709425e-10, 'L_scale_weight_yyx': 1.2987643093343501e-08, 'learning_rate_yyx': 0.008732091435763544}. Best is trial 23 with value: -2.513824905841335.
[I 2026-03-18 20:28:00,757] Trial 40 pruned. 
[I 2026-03-18 20:28:04,061] Trial 28 finished with value: -2.5113498008217485 and parameters: {'n_layers_yyx': 1, 'hidden_size_yyx_l0': 6, 'context_size_yyx': 1, 'num_mix_components_yyx': 5, 'context_extractor_yyx': 'lstm', 'activation_func_yyx': 'Tanh', 'L2_weight_yyx': 1.0568506370869746e-09, 'L_entropy_weight_yyx': 3.8484167623373844e-10, 'L_sep_weight_yyx': 7.747900063277539e-07, 'L_scale_weight_yyx': 3.678384312036656e-10, 'learning_rate_yyx': 0.007443831408160844}. Best is trial 12 with value: -2.51518345292619.
[I 2026-03-18 20:28:04,943] Trial 38 pruned. 
[I 2026-03-18 20:28:13,661] Trial 32 finished with value: -2.508142193390669 and parameters: {'n_layers_yyx': 2, 'hidden_size_yyx_l0': 5, 'hidden_size_yyx_l1': 4, 'context_size_yyx': 2, 'num_mix_components_yyx': 4, 'context_extractor_yyx': 'lstm', 'activation_func_yyx': 'Tanh', 'L2_weight_yyx': 2.287743340036362e-06, 'L_entropy_weight_yyx': 6.323431993174077e-09, 'L_sep_weight_yyx': 1.7652491491306722e-05, 'L_scale_weight_yyx': 1.010882313099856e-07, 'learning_rate_yyx': 0.006757272354043252}. Best is trial 26 with value: -2.512613867095458.
[I 2026-03-18 20:28:15,574] Trial 41 pruned. 
[I 2026-03-18 20:28:17,194] Trial 39 pruned. 
[I 2026-03-18 20:28:17,207] Trial 29 pruned. 
[I 2026-03-18 20:28:18,142] Trial 47 finished with value: -2.4784571193594465 and parameters: {'n_layers_yyx': 2, 'hidden_size_yyx_l0': 3, 'hidden_size_yyx_l1': 6, 'context_size_yyx': 1, 'num_mix_components_yyx': 3, 'context_extractor_yyx': 'lstm', 'activation_func_yyx': 'Tanh', 'L2_weight_yyx': 3.6004458100482496e-08, 'L_entropy_weight_yyx': 2.7625506067564556e-07, 'L_sep_weight_yyx': 1.2765925533320806e-08, 'L_scale_weight_yyx': 1.1983755987034577e-05, 'learning_rate_yyx': 0.008804120150492456}. Best is trial 7 with value: -2.4950542279753494.
[I 2026-03-18 20:28:28,714] Trial 30 pruned. 
[I 2026-03-18 20:28:29,845] Trial 48 pruned. 
[I 2026-03-18 20:28:34,899] Trial 33 pruned. 
[I 2026-03-18 20:28:36,707] Trial 49 pruned. 

Source events: 27060
Target events: 3828
Full model ln_yyx : 431.55546 nats/sec, 101.46288 nats/event
Full model Log loss : -2.45209
Full model ln_yyx : 439.26620 nats/sec, 103.27575 nats/event
Full model Log loss : -2.48862
Full model ln_yyx : 437.66170 nats/sec, 102.89852 nats/event
Full model Log loss : -2.48910
Full model ln_yyx : 435.74947 nats/sec, 102.44894 nats/event
Full model Log loss : -2.48976
Full model ln_yyx : 439.76002 nats/sec, 103.39185 nats/event
Full model Log loss : -2.49976
Full model ln_yyx : 441.44248 nats/sec, 103.78742 nats/event
Full model Log loss : -2.50338
Full model ln_yyx : 441.98673 nats/sec, 103.91538 nats/event
Full model Log loss : -2.50247
Full model ln_yyx : 441.69689 nats/sec, 103.84723 nats/event
Full model Log loss : -2.50330
Full model ln_yyx : 440.15161 nats/sec, 103.48392 nats/event
Full model Log loss : -2.50395
Full model ln_yyx : 442.26375 nats/sec, 103.98051 nats/event
Full model Log loss : -2.50398
Full model ln_yyx : 440.78226 nats/sec, 103.63219 nats/event
Full model Log loss : -2.50194
Full model ln_yyx : 441.36457 nats/sec, 103.76910 nats/event
Full model Log loss : -2.50466
Full model ln_yyx : 442.98266 nats/sec, 104.14953 nats/event
Full model Log loss : -2.50420
Full model ln_yyx : 441.99136 nats/sec, 103.91646 nats/event
Full model Log loss : -2.50272
Full model ln_yyx : 441.30835 nats/sec, 103.75588 nats/event
Full model Log loss : -2.50227
Full model ln_yyx : 441.35579 nats/sec, 103.76704 nats/event
Full model Log loss : -2.50470
Full model ln_yyx : 440.11866 nats/sec, 103.47617 nats/event
Full model Log loss : -2.50382
Full model ln_yyx : 441.85514 nats/sec, 103.88444 nats/event
Full model Log loss : -2.50429
Optimization finished. Config saved to results/opt-full/opt_full_291_best_config.txt
[I 2026-03-18 20:28:39,253] Trial 40 pruned. 
[I 2026-03-18 20:28:43,032] Trial 34 pruned. 
[I 2026-03-18 20:29:03,660] Trial 45 pruned. 
[I 2026-03-18 20:29:11,550] Trial 46 pruned. 
[I 2026-03-18 20:29:22,843] Trial 49 pruned. 

Source events: 27060
Target events: 3618
Full model ln_yyx : 414.61139 nats/sec, 103.13716 nats/event
Full model Log loss : -2.47920
Full model ln_yyx : 416.80946 nats/sec, 103.68395 nats/event
Full model Log loss : -2.49022
Full model ln_yyx : 415.60255 nats/sec, 103.38372 nats/event
Full model Log loss : -2.49190
Full model ln_yyx : 416.46378 nats/sec, 103.59796 nats/event
Full model Log loss : -2.49336
Full model ln_yyx : 419.08310 nats/sec, 104.24953 nats/event
Full model Log loss : -2.49505
Full model ln_yyx : 419.92515 nats/sec, 104.45899 nats/event
Full model Log loss : -2.49293
Full model ln_yyx : 414.55458 nats/sec, 103.12303 nats/event
Full model Log loss : -2.49289
Full model ln_yyx : 414.63463 nats/sec, 103.14294 nats/event
Full model Log loss : -2.48045
Full model ln_yyx : 416.57038 nats/sec, 103.62447 nats/event
Full model Log loss : -2.49190
Full model ln_yyx : 418.92711 nats/sec, 104.21072 nats/event
Full model Log loss : -2.49327
Full model ln_yyx : 415.77048 nats/sec, 103.42549 nats/event
Full model Log loss : -2.47846
Optimization finished. Config saved to results/opt-full/opt_full_299_best_config.txt
[I 2026-03-18 20:29:24,488] Trial 31 pruned. 
