[I 2026-03-18 18:44:23,090] Trial 28 finished with value: -1.6553564438806116 and parameters: {'n_layers_yyx': 2, 'hidden_size_yyx_l0': 6, 'hidden_size_yyx_l1': 6, 'context_size_yyx': 2, 'num_mix_components_yyx': 4, 'context_extractor_yyx': 'lstm', 'activation_func_yyx': 'Tanh', 'L2_weight_yyx': 5.366517172978955e-10, 'L_entropy_weight_yyx': 4.361207265616162e-08, 'L_sep_weight_yyx': 0.0002284497102334006, 'L_scale_weight_yyx': 3.8230419743468333e-10, 'learning_rate_yyx': 0.005664644816100111}. Best is trial 27 with value: -1.6742712595465095.
[I 2026-03-18 18:44:25,131] Trial 37 pruned. 
[I 2026-03-18 18:44:27,183] Trial 30 finished with value: -2.601710480560092 and parameters: {'n_layers_yyx': 1, 'hidden_size_yyx_l0': 4, 'context_size_yyx': 3, 'num_mix_components_yyx': 1, 'context_extractor_yyx': 'gru', 'activation_func_yyx': 'ReLU', 'L2_weight_yyx': 7.368921344708341e-07, 'L_entropy_weight_yyx': 3.451271669452672e-09, 'L_sep_weight_yyx': 1.6723127434679933e-07, 'L_scale_weight_yyx': 0.0007190749381319934, 'learning_rate_yyx': 0.0029236363409779254}. Best is trial 10 with value: -2.640669339569724.
[I 2026-03-18 18:44:29,901] Trial 38 pruned. 
[I 2026-03-18 18:44:32,493] Trial 43 pruned. 
[I 2026-03-18 18:44:34,088] Trial 26 finished with value: -1.6701976998249308 and parameters: {'n_layers_yyx': 1, 'hidden_size_yyx_l0': 4, 'context_size_yyx': 4, 'num_mix_components_yyx': 3, 'context_extractor_yyx': 'gru', 'activation_func_yyx': 'GELU', 'L2_weight_yyx': 4.042514777335429e-06, 'L_entropy_weight_yyx': 2.356684099014067e-08, 'L_sep_weight_yyx': 1.8957571308538234e-10, 'L_scale_weight_yyx': 2.153835800221799e-06, 'learning_rate_yyx': 0.006958519495804358}. Best is trial 2 with value: -1.6799626520210098.
[I 2026-03-18 18:44:36,804] Trial 35 finished with value: -1.2414107543042758 and parameters: {'n_layers_yyx': 2, 'hidden_size_yyx_l0': 5, 'hidden_size_yyx_l1': 5, 'context_size_yyx': 3, 'num_mix_components_yyx': 1, 'context_extractor_yyx': 'gru', 'activation_func_yyx': 'Tanh', 'L2_weight_yyx': 4.306566840377997e-05, 'L_entropy_weight_yyx': 1.2370140012541596e-07, 'L_sep_weight_yyx': 1.9541830209665273e-07, 'L_scale_weight_yyx': 2.5135383387052605e-09, 'learning_rate_yyx': 0.0032401189950564675}. Best is trial 3 with value: -1.2710647653519778.
[I 2026-03-18 18:44:38,140] Trial 29 finished with value: -1.6665437494595539 and parameters: {'n_layers_yyx': 1, 'hidden_size_yyx_l0': 3, 'context_size_yyx': 4, 'num_mix_components_yyx': 5, 'context_extractor_yyx': 'lstm', 'activation_func_yyx': 'GELU', 'L2_weight_yyx': 9.610523186642432e-10, 'L_entropy_weight_yyx': 6.519291993666974e-05, 'L_sep_weight_yyx': 2.372861015544639e-10, 'L_scale_weight_yyx': 3.1511945773205543e-09, 'learning_rate_yyx': 0.009909978758804767}. Best is trial 13 with value: -1.6722197537243195.
[I 2026-03-18 18:44:38,846] Trial 33 pruned. 
[I 2026-03-18 18:44:41,386] Trial 44 pruned. 
[I 2026-03-18 18:44:41,800] Trial 41 finished with value: -2.6036799703304148 and parameters: {'n_layers_yyx': 2, 'hidden_size_yyx_l0': 2, 'hidden_size_yyx_l1': 6, 'context_size_yyx': 4, 'num_mix_components_yyx': 5, 'context_extractor_yyx': 'gru', 'activation_func_yyx': 'Tanh', 'L2_weight_yyx': 5.781323626715887e-09, 'L_entropy_weight_yyx': 1.628180011391903e-09, 'L_sep_weight_yyx': 0.00038113475369134885, 'L_scale_weight_yyx': 1.655433070795238e-08, 'learning_rate_yyx': 0.0099032504434352}. Best is trial 0 with value: -2.6330643191486622.
[I 2026-03-18 18:44:45,932] Trial 34 finished with value: -1.2487017337143311 and parameters: {'n_layers_yyx': 1, 'hidden_size_yyx_l0': 5, 'context_size_yyx': 3, 'num_mix_components_yyx': 5, 'context_extractor_yyx': 'gru', 'activation_func_yyx': 'Tanh', 'L2_weight_yyx': 5.7634742423739454e-05, 'L_entropy_weight_yyx': 1.45583004431277e-05, 'L_sep_weight_yyx': 1.0000111046832398e-08, 'L_scale_weight_yyx': 0.0001991323940878615, 'learning_rate_yyx': 0.0032632583006356177}. Best is trial 6 with value: -1.270142151555821.
[I 2026-03-18 18:44:46,476] Trial 38 pruned. 
[I 2026-03-18 18:44:46,582] Trial 36 pruned. 
[I 2026-03-18 18:44:49,188] Trial 45 pruned. 
[I 2026-03-18 18:44:49,741] Trial 39 pruned. 
[I 2026-03-18 18:44:52,636] Trial 35 pruned. 
[I 2026-03-18 18:44:52,878] Trial 15 finished with value: -1.663180151651072 and parameters: {'n_layers_yyx': 2, 'hidden_size_yyx_l0': 4, 'hidden_size_yyx_l1': 4, 'context_size_yyx': 4, 'num_mix_components_yyx': 5, 'context_extractor_yyx': 'lstm', 'activation_func_yyx': 'ReLU', 'L2_weight_yyx': 0.0008132442480955372, 'L_entropy_weight_yyx': 7.477503738765499e-05, 'L_sep_weight_yyx': 9.660411532072016e-09, 'L_scale_weight_yyx': 1.455228766386303e-06, 'learning_rate_yyx': 0.004718175643931119}. Best is trial 13 with value: -1.6705420913622362.
[I 2026-03-18 18:44:53,726] Trial 37 pruned. 
[I 2026-03-18 18:44:55,605] Trial 30 pruned. 
[I 2026-03-18 18:44:56,949] Trial 30 pruned. 
[I 2026-03-18 18:44:57,428] Trial 46 pruned. 
[I 2026-03-18 18:44:57,936] Trial 34 pruned. 
[I 2026-03-18 18:44:59,307] Trial 32 finished with value: -1.6636288012301728 and parameters: {'n_layers_yyx': 2, 'hidden_size_yyx_l0': 6, 'hidden_size_yyx_l1': 6, 'context_size_yyx': 3, 'num_mix_components_yyx': 2, 'context_extractor_yyx': 'gru', 'activation_func_yyx': 'GELU', 'L2_weight_yyx': 5.149384636074508e-10, 'L_entropy_weight_yyx': 2.5062792038805366e-05, 'L_sep_weight_yyx': 2.3831929048359508e-08, 'L_scale_weight_yyx': 3.030015382131497e-10, 'learning_rate_yyx': 0.007154930412671995}. Best is trial 11 with value: -1.6687842250673444.
[I 2026-03-18 18:45:03,662] Trial 39 pruned. 
[I 2026-03-18 18:45:04,545] Trial 47 pruned. 
[I 2026-03-18 18:45:06,068] Trial 36 pruned. 
[I 2026-03-18 18:45:08,334] Trial 38 pruned. 
[I 2026-03-18 18:45:09,109] Trial 40 pruned. 
[I 2026-03-18 18:45:10,454] Trial 29 pruned. 
[I 2026-03-18 18:45:12,402] Trial 48 pruned. 
[I 2026-03-18 18:45:13,906] Trial 37 pruned. 
[I 2026-03-18 18:45:17,051] Trial 30 finished with value: -1.6672611071354386 and parameters: {'n_layers_yyx': 2, 'hidden_size_yyx_l0': 5, 'hidden_size_yyx_l1': 5, 'context_size_yyx': 4, 'num_mix_components_yyx': 4, 'context_extractor_yyx': 'gru', 'activation_func_yyx': 'GELU', 'L2_weight_yyx': 2.1470595935731273e-09, 'L_entropy_weight_yyx': 1.0078967531471274e-06, 'L_sep_weight_yyx': 1.291315478875039e-07, 'L_scale_weight_yyx': 6.134634833092344e-05, 'learning_rate_yyx': 0.00977399496366773}. Best is trial 23 with value: -1.675936991716372.
[I 2026-03-18 18:45:22,362] Trial 27 pruned. 
[I 2026-03-18 18:45:23,328] Trial 28 finished with value: -1.6687359144414584 and parameters: {'n_layers_yyx': 2, 'hidden_size_yyx_l0': 5, 'hidden_size_yyx_l1': 2, 'context_size_yyx': 4, 'num_mix_components_yyx': 1, 'context_extractor_yyx': 'lstm', 'activation_func_yyx': 'ReLU', 'L2_weight_yyx': 3.835193436339942e-10, 'L_entropy_weight_yyx': 3.047268867342741e-05, 'L_sep_weight_yyx': 3.6350185709565896e-10, 'L_scale_weight_yyx': 4.753622900056863e-09, 'learning_rate_yyx': 0.005072077563322184}. Best is trial 22 with value: -1.6757910143766872.
[I 2026-03-18 18:45:24,000] Trial 31 finished with value: -1.6656745767455703 and parameters: {'n_layers_yyx': 2, 'hidden_size_yyx_l0': 4, 'hidden_size_yyx_l1': 6, 'context_size_yyx': 2, 'num_mix_components_yyx': 5, 'context_extractor_yyx': 'gru', 'activation_func_yyx': 'GELU', 'L2_weight_yyx': 0.0006911274575539217, 'L_entropy_weight_yyx': 6.0617188820874176e-09, 'L_sep_weight_yyx': 3.388383579525249e-10, 'L_scale_weight_yyx': 1.8962826574725106e-06, 'learning_rate_yyx': 0.008763888441558116}. Best is trial 19 with value: -1.6674850489567747.
[I 2026-03-18 18:45:24,362] Trial 29 pruned. 
[I 2026-03-18 18:45:24,363] Trial 31 pruned. 
[I 2026-03-18 18:45:25,430] Trial 39 pruned. 
[I 2026-03-18 18:45:26,532] Trial 32 finished with value: -1.672754257429782 and parameters: {'n_layers_yyx': 1, 'hidden_size_yyx_l0': 5, 'context_size_yyx': 4, 'num_mix_components_yyx': 3, 'context_extractor_yyx': 'lstm', 'activation_func_yyx': 'Tanh', 'L2_weight_yyx': 8.525217455441463e-08, 'L_entropy_weight_yyx': 1.5109406110817267e-07, 'L_sep_weight_yyx': 1.6491846648855936e-07, 'L_scale_weight_yyx': 1.778130830147998e-08, 'learning_rate_yyx': 0.009939827653687183}. Best is trial 23 with value: -1.6757874282308216.
[I 2026-03-18 18:45:28,609] Trial 41 pruned. 
[I 2026-03-18 18:45:29,466] Trial 49 pruned. 

Source events: 5634
Target events: 9421
Full model ln_yyx : 145.28102 nats/sec, 13.87888 nats/event
Full model Log loss : -1.25796
Full model ln_yyx : 145.71298 nats/sec, 13.92014 nats/event
Full model Log loss : -1.26637
Full model ln_yyx : 148.24308 nats/sec, 14.16185 nats/event
Full model Log loss : -1.26639
Full model ln_yyx : 145.33660 nats/sec, 13.88419 nats/event
Full model Log loss : -1.23290
Full model ln_yyx : 142.23403 nats/sec, 13.58780 nats/event
Full model Log loss : -1.23648
Full model ln_yyx : 145.51917 nats/sec, 13.90163 nats/event
Full model Log loss : -1.23837
Full model ln_yyx : 147.13047 nats/sec, 14.05556 nats/event
Full model Log loss : -1.25843
Full model ln_yyx : 148.01110 nats/sec, 14.13969 nats/event
Full model Log loss : -1.26824
Full model ln_yyx : 142.21120 nats/sec, 13.58561 nats/event
Full model Log loss : -1.23560
Full model ln_yyx : 144.45524 nats/sec, 13.79999 nats/event
Full model Log loss : -1.24978
Full model ln_yyx : 146.47315 nats/sec, 13.99276 nats/event
Full model Log loss : -1.24124
Optimization finished. Config saved to results/opt-full/opt_full_98_best_config.txt
[I 2026-03-18 18:45:32,415] Trial 28 pruned. 
[I 2026-03-18 18:45:34,392] Trial 29 pruned. 
[I 2026-03-18 18:45:37,838] Trial 45 pruned. 
[I 2026-03-18 18:45:38,771] Trial 42 pruned. 
[I 2026-03-18 18:45:39,075] Trial 29 pruned. 
[I 2026-03-18 18:45:44,606] Trial 43 pruned. 
[I 2026-03-18 18:45:46,332] Trial 33 pruned. 
[I 2026-03-18 18:45:49,669] Trial 46 pruned. 
[I 2026-03-18 18:45:50,528] Trial 30 pruned. 
[I 2026-03-18 18:45:50,979] Trial 40 pruned. 
[I 2026-03-18 18:45:51,121] Trial 44 pruned. 
[I 2026-03-18 18:45:52,604] Trial 34 pruned. 
[I 2026-03-18 18:45:52,809] Trial 43 pruned. 
[I 2026-03-18 18:45:52,839] Trial 48 pruned. 
[I 2026-03-18 18:45:56,090] Trial 30 pruned. 
[I 2026-03-18 18:45:56,585] Trial 24 finished with value: -1.6750054529243301 and parameters: {'n_layers_yyx': 1, 'hidden_size_yyx_l0': 6, 'context_size_yyx': 4, 'num_mix_components_yyx': 5, 'context_extractor_yyx': 'lstm', 'activation_func_yyx': 'Tanh', 'L2_weight_yyx': 4.0222486458374115e-07, 'L_entropy_weight_yyx': 6.698409645912301e-10, 'L_sep_weight_yyx': 0.0007958410794759588, 'L_scale_weight_yyx': 0.0003593528698894759, 'learning_rate_yyx': 0.005050870528157612}. Best is trial 24 with value: -1.6750054529243301.
[I 2026-03-18 18:45:59,146] Trial 41 pruned. 
[I 2026-03-18 18:46:01,877] Trial 49 pruned. 

Source events: 10683
Target events: 11540
Full model ln_yyx : 388.52111 nats/sec, 30.30061 nats/event
Full model Log loss : -1.66569
Full model ln_yyx : 391.76492 nats/sec, 30.55359 nats/event
Full model Log loss : -1.66069
Full model ln_yyx : 390.75722 nats/sec, 30.47500 nats/event
Full model Log loss : -1.66321
Full model ln_yyx : 391.13348 nats/sec, 30.50434 nats/event
Full model Log loss : -1.64813
Full model ln_yyx : 392.81274 nats/sec, 30.63531 nats/event
Full model Log loss : -1.66206
Full model ln_yyx : 391.96046 nats/sec, 30.56884 nats/event
Full model Log loss : -1.67159
Full model ln_yyx : 391.51165 nats/sec, 30.53384 nats/event
Full model Log loss : -1.65326
Optimization finished. Config saved to results/opt-full/opt_full_117_best_config.txt
[I 2026-03-18 18:46:02,354] Trial 44 pruned. 
[I 2026-03-18 18:46:02,429] Trial 31 pruned. 
[I 2026-03-18 18:46:04,017] Trial 36 finished with value: -1.2706139471085807 and parameters: {'n_layers_yyx': 2, 'hidden_size_yyx_l0': 6, 'hidden_size_yyx_l1': 6, 'context_size_yyx': 2, 'num_mix_components_yyx': 4, 'context_extractor_yyx': 'lstm', 'activation_func_yyx': 'GELU', 'L2_weight_yyx': 2.8950001776374076e-08, 'L_entropy_weight_yyx': 6.000295215382457e-06, 'L_sep_weight_yyx': 1.125822464642175e-09, 'L_scale_weight_yyx': 3.163079180524536e-07, 'learning_rate_yyx': 0.004164153893404504}. Best is trial 3 with value: -1.2710647653519778.
[I 2026-03-18 18:46:05,021] Trial 31 pruned. 
[I 2026-03-18 18:46:07,087] Trial 42 pruned. 
[I 2026-03-18 18:46:07,310] Trial 45 pruned. 
[I 2026-03-18 18:46:09,629] Trial 35 pruned. 
[I 2026-03-18 18:46:10,028] Trial 45 pruned. 
[I 2026-03-18 18:46:10,031] Trial 32 pruned. 
[I 2026-03-18 18:46:10,435] Trial 35 finished with value: -2.638270553216115 and parameters: {'n_layers_yyx': 1, 'hidden_size_yyx_l0': 3, 'context_size_yyx': 3, 'num_mix_components_yyx': 5, 'context_extractor_yyx': 'lstm', 'activation_func_yyx': 'ReLU', 'L2_weight_yyx': 5.7767877364267586e-05, 'L_entropy_weight_yyx': 2.386080167019397e-07, 'L_sep_weight_yyx': 7.815909796259388e-09, 'L_scale_weight_yyx': 0.00035238739809096553, 'learning_rate_yyx': 0.006187615013438111}. Best is trial 31 with value: -2.642702042239214.
[I 2026-03-18 18:46:16,254] Trial 29 pruned. 
[I 2026-03-18 18:46:17,431] Trial 47 pruned. 
[I 2026-03-18 18:46:17,432] Trial 46 pruned. 
[I 2026-03-18 18:46:18,759] Trial 35 finished with value: -2.6491521871683785 and parameters: {'n_layers_yyx': 1, 'hidden_size_yyx_l0': 4, 'context_size_yyx': 4, 'num_mix_components_yyx': 5, 'context_extractor_yyx': 'gru', 'activation_func_yyx': 'GELU', 'L2_weight_yyx': 2.406143317566775e-09, 'L_entropy_weight_yyx': 1.198537682066879e-05, 'L_sep_weight_yyx': 7.737078106923654e-10, 'L_scale_weight_yyx': 2.4363427220954956e-10, 'learning_rate_yyx': 0.005863510445034193}. Best is trial 10 with value: -2.6537577311197915.
[I 2026-03-18 18:46:19,250] Trial 36 pruned. 
[I 2026-03-18 18:46:23,371] Trial 32 pruned. 
[I 2026-03-18 18:46:23,396] Trial 36 pruned. 
[I 2026-03-18 18:46:26,010] Trial 43 pruned. 
[I 2026-03-18 18:46:29,389] Trial 46 pruned. 
[I 2026-03-18 18:46:29,558] Trial 48 pruned. 
[I 2026-03-18 18:46:34,745] Trial 30 pruned. 
[I 2026-03-18 18:46:34,904] Trial 37 pruned. 
[I 2026-03-18 18:46:35,499] Trial 47 pruned. 
[I 2026-03-18 18:46:35,503] Trial 31 pruned. 
[I 2026-03-18 18:46:37,009] Trial 32 pruned. 
[I 2026-03-18 18:46:39,064] Trial 47 pruned. 
[I 2026-03-18 18:46:42,577] Trial 24 finished with value: -2.6357785346013674 and parameters: {'n_layers_yyx': 1, 'hidden_size_yyx_l0': 4, 'context_size_yyx': 3, 'num_mix_components_yyx': 5, 'context_extractor_yyx': 'gru', 'activation_func_yyx': 'Tanh', 'L2_weight_yyx': 9.011009223233581e-05, 'L_entropy_weight_yyx': 0.00012269591273067883, 'L_sep_weight_yyx': 1.1808090553816812e-07, 'L_scale_weight_yyx': 6.914891661396306e-09, 'learning_rate_yyx': 0.009536190097223134}. Best is trial 21 with value: -2.6405605351488926.
[I 2026-03-18 18:46:44,749] Trial 31 pruned. 
[I 2026-03-18 18:46:47,738] Trial 48 pruned. 
[I 2026-03-18 18:46:48,414] Trial 33 pruned. 
[I 2026-03-18 18:46:48,419] Trial 36 pruned. 
[I 2026-03-18 18:46:53,625] Trial 48 pruned. 
[I 2026-03-18 18:46:55,624] Trial 32 finished with value: -1.666002615009855 and parameters: {'n_layers_yyx': 2, 'hidden_size_yyx_l0': 4, 'hidden_size_yyx_l1': 6, 'context_size_yyx': 2, 'num_mix_components_yyx': 5, 'context_extractor_yyx': 'gru', 'activation_func_yyx': 'GELU', 'L2_weight_yyx': 0.00010371037624895621, 'L_entropy_weight_yyx': 9.764954600177398e-09, 'L_sep_weight_yyx': 5.811500291145414e-10, 'L_scale_weight_yyx': 1.1728356009469053e-06, 'learning_rate_yyx': 0.009888321176948628}. Best is trial 19 with value: -1.6674850489567747.
[I 2026-03-18 18:46:56,368] Trial 38 pruned. 
[I 2026-03-18 18:46:56,665] Trial 39 finished with value: -2.6312935092239247 and parameters: {'n_layers_yyx': 1, 'hidden_size_yyx_l0': 5, 'context_size_yyx': 3, 'num_mix_components_yyx': 5, 'context_extractor_yyx': 'gru', 'activation_func_yyx': 'ReLU', 'L2_weight_yyx': 0.0005777180703341101, 'L_entropy_weight_yyx': 2.393942868163291e-08, 'L_sep_weight_yyx': 1.4921302164160744e-05, 'L_scale_weight_yyx': 4.41621484209233e-08, 'learning_rate_yyx': 0.009667325815425041}. Best is trial 12 with value: -2.6375437257353878.
[I 2026-03-18 18:47:00,656] Trial 40 finished with value: -1.265859374717952 and parameters: {'n_layers_yyx': 1, 'hidden_size_yyx_l0': 6, 'context_size_yyx': 4, 'num_mix_components_yyx': 5, 'context_extractor_yyx': 'lstm', 'activation_func_yyx': 'GELU', 'L2_weight_yyx': 6.222839767636641e-07, 'L_entropy_weight_yyx': 5.197062884955219e-05, 'L_sep_weight_yyx': 4.956539203119303e-09, 'L_scale_weight_yyx': 9.349637779881664e-09, 'learning_rate_yyx': 0.0026034619569882084}. Best is trial 5 with value: -1.2714442113851663.
[I 2026-03-18 18:47:01,105] Trial 34 pruned. 
[I 2026-03-18 18:47:03,124] Trial 16 pruned. 
[I 2026-03-18 18:47:03,187] Trial 31 finished with value: -2.636915208106511 and parameters: {'n_layers_yyx': 1, 'hidden_size_yyx_l0': 4, 'context_size_yyx': 3, 'num_mix_components_yyx': 5, 'context_extractor_yyx': 'gru', 'activation_func_yyx': 'Tanh', 'L2_weight_yyx': 3.623090744536291e-05, 'L_entropy_weight_yyx': 1.7757089876189433e-08, 'L_sep_weight_yyx': 8.581678992881649e-08, 'L_scale_weight_yyx': 2.19837076904032e-09, 'learning_rate_yyx': 0.00980256073763264}. Best is trial 10 with value: -2.640669339569724.
[I 2026-03-18 18:47:04,251] Trial 35 pruned. 
[I 2026-03-18 18:47:04,732] Trial 32 pruned. 
[I 2026-03-18 18:47:08,073] Trial 29 finished with value: -1.6833607836109268 and parameters: {'n_layers_yyx': 2, 'hidden_size_yyx_l0': 6, 'hidden_size_yyx_l1': 6, 'context_size_yyx': 2, 'num_mix_components_yyx': 2, 'context_extractor_yyx': 'lstm', 'activation_func_yyx': 'GELU', 'L2_weight_yyx': 6.486841977392342e-05, 'L_entropy_weight_yyx': 2.8437692506911582e-05, 'L_sep_weight_yyx': 5.5349659919335094e-06, 'L_scale_weight_yyx': 5.049696754783411e-10, 'learning_rate_yyx': 0.0021437897131309273}. Best is trial 29 with value: -1.6833607836109268.
[I 2026-03-18 18:47:08,139] Trial 41 pruned. 
[I 2026-03-18 18:47:09,796] Trial 42 finished with value: -2.635504814712335 and parameters: {'n_layers_yyx': 2, 'hidden_size_yyx_l0': 2, 'hidden_size_yyx_l1': 5, 'context_size_yyx': 4, 'num_mix_components_yyx': 5, 'context_extractor_yyx': 'gru', 'activation_func_yyx': 'Tanh', 'L2_weight_yyx': 3.774830677937176e-09, 'L_entropy_weight_yyx': 3.9789852189217625e-08, 'L_sep_weight_yyx': 0.0001102614739264875, 'L_scale_weight_yyx': 3.820364652217158e-08, 'learning_rate_yyx': 0.007666885340556693}. Best is trial 42 with value: -2.635504814712335.
[I 2026-03-18 18:47:09,935] Trial 33 finished with value: -1.6649620140597037 and parameters: {'n_layers_yyx': 1, 'hidden_size_yyx_l0': 4, 'context_size_yyx': 4, 'num_mix_components_yyx': 3, 'context_extractor_yyx': 'lstm', 'activation_func_yyx': 'Tanh', 'L2_weight_yyx': 2.8145556413188402e-08, 'L_entropy_weight_yyx': 1.5013647496841276e-07, 'L_sep_weight_yyx': 2.811965567661034e-07, 'L_scale_weight_yyx': 2.4923244976331914e-08, 'learning_rate_yyx': 0.00768103786405998}. Best is trial 23 with value: -1.6757874282308216.
[I 2026-03-18 18:47:10,663] Trial 33 pruned. 
[I 2026-03-18 18:47:11,225] Trial 49 pruned. 

Source events: 10683
Target events: 40082
Full model ln_yyx : 1368.71238 nats/sec, 30.73303 nats/event
Full model Log loss : -1.66990
Full model ln_yyx : 1366.72352 nats/sec, 30.68837 nats/event
Full model Log loss : -1.67459
Full model ln_yyx : 1363.15696 nats/sec, 30.60828 nats/event
Full model Log loss : -1.67022
Full model ln_yyx : 1347.20311 nats/sec, 30.25006 nats/event
Full model Log loss : -1.65869
Full model ln_yyx : 1353.76061 nats/sec, 30.39730 nats/event
Full model Log loss : -1.66820
Full model ln_yyx : 1354.80670 nats/sec, 30.42079 nats/event
Full model Log loss : -1.66458
Full model ln_yyx : 1351.27853 nats/sec, 30.34157 nats/event
Full model Log loss : -1.66828
Optimization finished. Config saved to results/opt-full/opt_full_107_best_config.txt
[I 2026-03-18 18:47:11,374] Trial 33 pruned. 
[I 2026-03-18 18:47:12,364] Trial 44 pruned. 
[I 2026-03-18 18:47:13,303] Trial 35 pruned. 
[I 2026-03-18 18:47:17,923] Trial 34 pruned. 
[I 2026-03-18 18:47:17,925] Trial 37 pruned. 
[I 2026-03-18 18:47:19,359] Trial 36 pruned. 
[I 2026-03-18 18:47:20,818] Trial 45 pruned. 
[I 2026-03-18 18:47:21,330] Trial 25 finished with value: -1.6562429764043607 and parameters: {'n_layers_yyx': 1, 'hidden_size_yyx_l0': 6, 'context_size_yyx': 3, 'num_mix_components_yyx': 5, 'context_extractor_yyx': 'lstm', 'activation_func_yyx': 'Tanh', 'L2_weight_yyx': 4.6494321946591694e-07, 'L_entropy_weight_yyx': 4.92421032633301e-10, 'L_sep_weight_yyx': 0.0007833606635033891, 'L_scale_weight_yyx': 0.00017150686608613262, 'learning_rate_yyx': 0.005858530219458038}. Best is trial 24 with value: -1.6750054529243301.
[I 2026-03-18 18:47:21,332] Trial 32 pruned. 
[I 2026-03-18 18:47:23,603] Trial 30 pruned. 
[I 2026-03-18 18:47:27,760] Trial 37 pruned. 
[I 2026-03-18 18:47:29,578] Trial 32 pruned. 
[I 2026-03-18 18:47:29,970] Trial 37 finished with value: -1.258329042445269 and parameters: {'n_layers_yyx': 2, 'hidden_size_yyx_l0': 6, 'hidden_size_yyx_l1': 5, 'context_size_yyx': 3, 'num_mix_components_yyx': 4, 'context_extractor_yyx': 'lstm', 'activation_func_yyx': 'GELU', 'L2_weight_yyx': 1.71669896386734e-08, 'L_entropy_weight_yyx': 6.707762683363574e-06, 'L_sep_weight_yyx': 7.170461741593572e-10, 'L_scale_weight_yyx': 0.00010410911362495703, 'learning_rate_yyx': 0.004277180282421475}. Best is trial 3 with value: -1.2710647653519778.
[I 2026-03-18 18:47:31,640] Trial 31 finished with value: -1.6708081688757006 and parameters: {'n_layers_yyx': 1, 'hidden_size_yyx_l0': 3, 'context_size_yyx': 4, 'num_mix_components_yyx': 2, 'context_extractor_yyx': 'lstm', 'activation_func_yyx': 'Tanh', 'L2_weight_yyx': 2.489223170943454e-10, 'L_entropy_weight_yyx': 1.9868435732535026e-07, 'L_sep_weight_yyx': 1.9154386614788153e-09, 'L_scale_weight_yyx': 0.00021546362336573655, 'learning_rate_yyx': 0.00805531300216871}. Best is trial 13 with value: -1.6722197537243195.
[I 2026-03-18 18:47:32,612] Trial 39 pruned. 
