[I 2026-03-18 19:04:50,345] Trial 18 finished with value: -0.8170419352093334 and parameters: {'n_layers_yyx': 1, 'hidden_size_yyx_l0': 5, 'context_size_yyx': 2, 'num_mix_components_yyx': 4, 'context_extractor_yyx': 'gru', 'activation_func_yyx': 'Tanh', 'L2_weight_yyx': 4.432066197021473e-06, 'L_entropy_weight_yyx': 2.780736308275611e-07, 'L_sep_weight_yyx': 2.5960751348314008e-06, 'L_scale_weight_yyx': 2.4643935083515647e-08, 'learning_rate_yyx': 0.005922347767034817}. Best is trial 10 with value: -0.8345733146723827.
[I 2026-03-18 19:04:50,760] Trial 23 pruned. 
[I 2026-03-18 19:04:53,413] Trial 32 pruned. 
[I 2026-03-18 19:04:55,600] Trial 13 pruned. 
[I 2026-03-18 19:04:56,145] Trial 19 pruned. 
[I 2026-03-18 19:04:56,764] Trial 34 pruned. 
[I 2026-03-18 19:04:57,138] Trial 13 pruned. 
[I 2026-03-18 19:04:57,621] Trial 19 pruned. 
[I 2026-03-18 19:04:57,623] Trial 19 finished with value: -1.7745283201102293 and parameters: {'n_layers_yyx': 2, 'hidden_size_yyx_l0': 5, 'hidden_size_yyx_l1': 5, 'context_size_yyx': 3, 'num_mix_components_yyx': 2, 'context_extractor_yyx': 'lstm', 'activation_func_yyx': 'ReLU', 'L2_weight_yyx': 4.995836868624157e-10, 'L_entropy_weight_yyx': 4.8125081928622595e-05, 'L_sep_weight_yyx': 3.110391052319939e-09, 'L_scale_weight_yyx': 5.594164601219178e-06, 'learning_rate_yyx': 0.009984582904263984}. Best is trial 4 with value: -1.7775746924677662.
[I 2026-03-18 19:04:57,691] Trial 15 pruned. 
[I 2026-03-18 19:04:58,769] Trial 24 pruned. 
[I 2026-03-18 19:04:58,883] Trial 19 pruned. 
[I 2026-03-18 19:04:59,386] Trial 19 finished with value: -0.8044738093366299 and parameters: {'n_layers_yyx': 1, 'hidden_size_yyx_l0': 4, 'context_size_yyx': 2, 'num_mix_components_yyx': 5, 'context_extractor_yyx': 'gru', 'activation_func_yyx': 'GELU', 'L2_weight_yyx': 0.00020293579865386953, 'L_entropy_weight_yyx': 1.1168795542855896e-10, 'L_sep_weight_yyx': 3.489839708670096e-05, 'L_scale_weight_yyx': 1.2891978546911253e-10, 'learning_rate_yyx': 0.006420235978516611}. Best is trial 10 with value: -0.8355233715063007.
[I 2026-03-18 19:04:59,766] Trial 16 pruned. 
[I 2026-03-18 19:05:00,811] Trial 10 finished with value: -2.2811953358201777 and parameters: {'n_layers_yyx': 2, 'hidden_size_yyx_l0': 3, 'hidden_size_yyx_l1': 6, 'context_size_yyx': 4, 'num_mix_components_yyx': 5, 'context_extractor_yyx': 'lstm', 'activation_func_yyx': 'GELU', 'L2_weight_yyx': 9.423850646522617e-07, 'L_entropy_weight_yyx': 0.000562276244939101, 'L_sep_weight_yyx': 0.0009254141160653317, 'L_scale_weight_yyx': 0.0002574401685158638, 'learning_rate_yyx': 0.008114948067485455}. Best is trial 10 with value: -2.2811953358201777.
[I 2026-03-18 19:05:02,044] Trial 32 finished with value: -0.8265818112710026 and parameters: {'n_layers_yyx': 2, 'hidden_size_yyx_l0': 3, 'hidden_size_yyx_l1': 6, 'context_size_yyx': 3, 'num_mix_components_yyx': 2, 'context_extractor_yyx': 'gru', 'activation_func_yyx': 'Tanh', 'L2_weight_yyx': 1.0985299790772235e-08, 'L_entropy_weight_yyx': 6.048546721273496e-09, 'L_sep_weight_yyx': 2.789303667370562e-09, 'L_scale_weight_yyx': 1.1448201432700483e-07, 'learning_rate_yyx': 0.0036209170286451227}. Best is trial 32 with value: -0.8265818112710026.
[I 2026-03-18 19:05:06,429] Trial 14 pruned. 
[I 2026-03-18 19:05:06,437] Trial 20 pruned. 
[I 2026-03-18 19:05:06,583] Trial 9 pruned. 
[I 2026-03-18 19:05:07,547] Trial 16 pruned. 
[I 2026-03-18 19:05:08,164] Trial 26 finished with value: -0.9154252905895685 and parameters: {'n_layers_yyx': 1, 'hidden_size_yyx_l0': 6, 'context_size_yyx': 3, 'num_mix_components_yyx': 2, 'context_extractor_yyx': 'lstm', 'activation_func_yyx': 'Tanh', 'L2_weight_yyx': 0.00011479986007572396, 'L_entropy_weight_yyx': 8.663388549653885e-10, 'L_sep_weight_yyx': 5.665548343816519e-08, 'L_scale_weight_yyx': 4.5807417965050494e-07, 'learning_rate_yyx': 0.005688598181089351}. Best is trial 12 with value: -0.9172403773089042.
[I 2026-03-18 19:05:08,859] Trial 33 pruned. 
[I 2026-03-18 19:05:09,235] Trial 38 finished with value: -0.8126970119279103 and parameters: {'n_layers_yyx': 1, 'hidden_size_yyx_l0': 6, 'context_size_yyx': 2, 'num_mix_components_yyx': 2, 'context_extractor_yyx': 'lstm', 'activation_func_yyx': 'ReLU', 'L2_weight_yyx': 2.0420194014065848e-05, 'L_entropy_weight_yyx': 2.133059419425493e-05, 'L_sep_weight_yyx': 3.2091561408425388e-09, 'L_scale_weight_yyx': 7.975715674409413e-10, 'learning_rate_yyx': 0.00983869912873622}. Best is trial 1 with value: -0.8328681168211087.
[I 2026-03-18 19:05:09,947] Trial 35 pruned. 
[I 2026-03-18 19:05:10,015] Trial 12 finished with value: -0.8169520728873362 and parameters: {'n_layers_yyx': 2, 'hidden_size_yyx_l0': 5, 'hidden_size_yyx_l1': 6, 'context_size_yyx': 3, 'num_mix_components_yyx': 2, 'context_extractor_yyx': 'lstm', 'activation_func_yyx': 'ReLU', 'L2_weight_yyx': 2.4769761553768183e-10, 'L_entropy_weight_yyx': 5.43044412581805e-10, 'L_sep_weight_yyx': 3.144790283631304e-08, 'L_scale_weight_yyx': 2.9466606419810415e-06, 'learning_rate_yyx': 0.008945632937549308}. Best is trial 11 with value: -0.831068616497992.
[I 2026-03-18 19:05:15,147] Trial 25 pruned. 
[I 2026-03-18 19:05:15,746] Trial 34 pruned. 
[I 2026-03-18 19:05:16,134] Trial 39 pruned. 
[I 2026-03-18 19:05:16,481] Trial 13 pruned. 
[I 2026-03-18 19:05:21,278] Trial 27 pruned. 
[I 2026-03-18 19:05:21,890] Trial 36 pruned. 
[I 2026-03-18 19:05:21,936] Trial 41 pruned. 
[I 2026-03-18 19:05:22,078] Trial 40 pruned. 
[I 2026-03-18 19:05:22,428] Trial 35 pruned. 
[I 2026-03-18 19:05:26,697] Trial 13 finished with value: -2.270597014228108 and parameters: {'n_layers_yyx': 2, 'hidden_size_yyx_l0': 5, 'hidden_size_yyx_l1': 5, 'context_size_yyx': 2, 'num_mix_components_yyx': 4, 'context_extractor_yyx': 'lstm', 'activation_func_yyx': 'Tanh', 'L2_weight_yyx': 1.9374344564188545e-07, 'L_entropy_weight_yyx': 9.7545850144145e-06, 'L_sep_weight_yyx': 2.6790064811453214e-05, 'L_scale_weight_yyx': 2.022513847446342e-08, 'learning_rate_yyx': 0.0038247287593028353}. Best is trial 13 with value: -2.270597014228108.
[I 2026-03-18 19:05:26,785] Trial 15 pruned. 
[I 2026-03-18 19:05:26,949] Trial 9 finished with value: -2.26680252280638 and parameters: {'n_layers_yyx': 2, 'hidden_size_yyx_l0': 4, 'hidden_size_yyx_l1': 5, 'context_size_yyx': 4, 'num_mix_components_yyx': 1, 'context_extractor_yyx': 'gru', 'activation_func_yyx': 'ReLU', 'L2_weight_yyx': 6.393647265023405e-10, 'L_entropy_weight_yyx': 0.0006966268845443233, 'L_sep_weight_yyx': 2.1109446091780656e-09, 'L_scale_weight_yyx': 4.7811168242339214e-08, 'learning_rate_yyx': 0.0007720206977327428}. Best is trial 1 with value: -2.2866954714752907.
[I 2026-03-18 19:05:27,187] Trial 10 pruned. 
[I 2026-03-18 19:05:27,759] Trial 20 pruned. 
[I 2026-03-18 19:05:28,058] Trial 14 pruned. 
[I 2026-03-18 19:05:29,173] Trial 17 pruned. 
[I 2026-03-18 19:05:30,986] Trial 9 finished with value: -2.209955294013992 and parameters: {'n_layers_yyx': 2, 'hidden_size_yyx_l0': 5, 'hidden_size_yyx_l1': 6, 'context_size_yyx': 3, 'num_mix_components_yyx': 5, 'context_extractor_yyx': 'lstm', 'activation_func_yyx': 'GELU', 'L2_weight_yyx': 2.326852501649969e-10, 'L_entropy_weight_yyx': 7.435167757921024e-05, 'L_sep_weight_yyx': 2.312312293063779e-05, 'L_scale_weight_yyx': 6.360636552516868e-09, 'learning_rate_yyx': 0.008816117310106737}. Best is trial 7 with value: -2.2149018094999913.
[I 2026-03-18 19:05:31,570] Trial 34 finished with value: -0.8222789454495361 and parameters: {'n_layers_yyx': 2, 'hidden_size_yyx_l0': 6, 'hidden_size_yyx_l1': 5, 'context_size_yyx': 4, 'num_mix_components_yyx': 2, 'context_extractor_yyx': 'lstm', 'activation_func_yyx': 'Tanh', 'L2_weight_yyx': 1.97742347553639e-09, 'L_entropy_weight_yyx': 6.416153085916138e-07, 'L_sep_weight_yyx': 2.928932815756641e-05, 'L_scale_weight_yyx': 5.097002081443566e-07, 'learning_rate_yyx': 0.005435253067844503}. Best is trial 18 with value: -0.8278672008429884.
[I 2026-03-18 19:05:36,506] Trial 14 pruned. 
[I 2026-03-18 19:05:36,553] Trial 10 pruned. 
[I 2026-03-18 19:05:38,929] Trial 18 pruned. 
[I 2026-03-18 19:05:41,185] Trial 15 pruned. 
[I 2026-03-18 19:05:41,966] Trial 33 finished with value: -0.8152928993303984 and parameters: {'n_layers_yyx': 1, 'hidden_size_yyx_l0': 6, 'context_size_yyx': 4, 'num_mix_components_yyx': 4, 'context_extractor_yyx': 'gru', 'activation_func_yyx': 'ReLU', 'L2_weight_yyx': 4.0262465196941266e-07, 'L_entropy_weight_yyx': 2.5000642124889117e-08, 'L_sep_weight_yyx': 1.0318987028044782e-08, 'L_scale_weight_yyx': 0.00019089597813274, 'learning_rate_yyx': 0.00559259333379039}. Best is trial 0 with value: -0.8324342893885016.
[I 2026-03-18 19:05:43,412] Trial 35 pruned. 
[I 2026-03-18 19:05:46,276] Trial 20 finished with value: -0.7869647883946294 and parameters: {'n_layers_yyx': 2, 'hidden_size_yyx_l0': 4, 'hidden_size_yyx_l1': 6, 'context_size_yyx': 3, 'num_mix_components_yyx': 3, 'context_extractor_yyx': 'gru', 'activation_func_yyx': 'Tanh', 'L2_weight_yyx': 2.2989928054345538e-07, 'L_entropy_weight_yyx': 1.641254342912554e-07, 'L_sep_weight_yyx': 0.00011122613086608696, 'L_scale_weight_yyx': 7.78249027357791e-09, 'learning_rate_yyx': 0.00735716705132111}. Best is trial 10 with value: -0.8371109842725836.
[I 2026-03-18 19:05:46,425] Trial 15 pruned. 
[I 2026-03-18 19:05:48,066] Trial 34 pruned. 
[I 2026-03-18 19:05:48,977] Trial 19 pruned. 
[I 2026-03-18 19:05:49,609] Trial 10 pruned. 
[I 2026-03-18 19:05:50,826] Trial 38 finished with value: -0.836914287888317 and parameters: {'n_layers_yyx': 2, 'hidden_size_yyx_l0': 4, 'hidden_size_yyx_l1': 5, 'context_size_yyx': 1, 'num_mix_components_yyx': 1, 'context_extractor_yyx': 'lstm', 'activation_func_yyx': 'Tanh', 'L2_weight_yyx': 0.00017473446662043347, 'L_entropy_weight_yyx': 0.0008303783018547244, 'L_sep_weight_yyx': 3.5076121514424134e-05, 'L_scale_weight_yyx': 4.552029086882551e-05, 'learning_rate_yyx': 0.008670045394883667}. Best is trial 38 with value: -0.836914287888317.
[I 2026-03-18 19:05:51,842] Trial 12 finished with value: -1.7812394205729167 and parameters: {'n_layers_yyx': 2, 'hidden_size_yyx_l0': 3, 'hidden_size_yyx_l1': 5, 'context_size_yyx': 2, 'num_mix_components_yyx': 3, 'context_extractor_yyx': 'lstm', 'activation_func_yyx': 'Tanh', 'L2_weight_yyx': 2.833764148896304e-05, 'L_entropy_weight_yyx': 1.5806743766771063e-05, 'L_sep_weight_yyx': 0.0008144822670276274, 'L_scale_weight_yyx': 1.2428509253802344e-07, 'learning_rate_yyx': 0.0036501121122578515}. Best is trial 4 with value: -1.784507205847538.
[I 2026-03-18 19:05:51,895] Trial 41 pruned. 
[I 2026-03-18 19:05:51,904] Trial 37 pruned. 
[I 2026-03-18 19:05:52,155] Trial 36 pruned. 
[I 2026-03-18 19:05:53,644] Trial 42 pruned. 
[I 2026-03-18 19:05:56,668] Trial 36 pruned. 
[I 2026-03-18 19:05:56,828] Trial 11 pruned. 
[I 2026-03-18 19:05:57,802] Trial 26 pruned. 
[I 2026-03-18 19:05:58,213] Trial 42 pruned. 
[I 2026-03-18 19:06:03,548] Trial 37 pruned. 
[I 2026-03-18 19:06:06,335] Trial 16 pruned. 
[I 2026-03-18 19:06:08,529] Trial 11 pruned. 
[I 2026-03-18 19:06:09,261] Trial 12 finished with value: -2.2829879107060895 and parameters: {'n_layers_yyx': 1, 'hidden_size_yyx_l0': 5, 'context_size_yyx': 3, 'num_mix_components_yyx': 5, 'context_extractor_yyx': 'gru', 'activation_func_yyx': 'ReLU', 'L2_weight_yyx': 1.4542708355432753e-10, 'L_entropy_weight_yyx': 2.4714411904220497e-08, 'L_sep_weight_yyx': 5.092198261237501e-09, 'L_scale_weight_yyx': 6.417059820563722e-09, 'learning_rate_yyx': 0.00880066881377555}. Best is trial 10 with value: -2.2831751549112607.
[I 2026-03-18 19:06:09,936] Trial 43 pruned. 
[I 2026-03-18 19:06:10,000] Trial 11 finished with value: -1.7849394827178031 and parameters: {'n_layers_yyx': 1, 'hidden_size_yyx_l0': 4, 'context_size_yyx': 1, 'num_mix_components_yyx': 4, 'context_extractor_yyx': 'gru', 'activation_func_yyx': 'Tanh', 'L2_weight_yyx': 0.0007565669503014776, 'L_entropy_weight_yyx': 1.1287276120631379e-08, 'L_sep_weight_yyx': 5.907809079201383e-08, 'L_scale_weight_yyx': 6.755588910089181e-09, 'learning_rate_yyx': 0.009644861419433295}. Best is trial 3 with value: -1.785882901278409.
[I 2026-03-18 19:06:10,285] Trial 38 pruned. 
[I 2026-03-18 19:06:12,194] Trial 16 pruned. 
[I 2026-03-18 19:06:15,743] Trial 21 finished with value: -0.8320598517774302 and parameters: {'n_layers_yyx': 1, 'hidden_size_yyx_l0': 3, 'context_size_yyx': 1, 'num_mix_components_yyx': 5, 'context_extractor_yyx': 'gru', 'activation_func_yyx': 'Tanh', 'L2_weight_yyx': 1.0211420654889217e-10, 'L_entropy_weight_yyx': 2.983339790377996e-08, 'L_sep_weight_yyx': 7.059623672391302e-06, 'L_scale_weight_yyx': 9.139281578875409e-10, 'learning_rate_yyx': 0.009658036078610323}. Best is trial 10 with value: -0.8355233715063007.
[I 2026-03-18 19:06:15,884] Trial 44 pruned. 
[I 2026-03-18 19:06:16,759] Trial 21 pruned. 
[I 2026-03-18 19:06:18,951] Trial 16 pruned. 
[I 2026-03-18 19:06:19,940] Trial 35 pruned. 
[I 2026-03-18 19:06:23,484] Trial 39 finished with value: -0.7646165788613887 and parameters: {'n_layers_yyx': 2, 'hidden_size_yyx_l0': 4, 'hidden_size_yyx_l1': 4, 'context_size_yyx': 1, 'num_mix_components_yyx': 5, 'context_extractor_yyx': 'gru', 'activation_func_yyx': 'Tanh', 'L2_weight_yyx': 0.0003502204171074001, 'L_entropy_weight_yyx': 0.0009272645005317725, 'L_sep_weight_yyx': 9.960276029405018e-05, 'L_scale_weight_yyx': 4.047739601553039e-05, 'learning_rate_yyx': 0.008844857677411413}. Best is trial 38 with value: -0.836914287888317.
[I 2026-03-18 19:06:24,444] Trial 43 pruned. 
[I 2026-03-18 19:06:26,394] Trial 36 pruned. 
[I 2026-03-18 19:06:27,090] Trial 28 finished with value: -0.9116961752278158 and parameters: {'n_layers_yyx': 2, 'hidden_size_yyx_l0': 6, 'hidden_size_yyx_l1': 4, 'context_size_yyx': 4, 'num_mix_components_yyx': 2, 'context_extractor_yyx': 'lstm', 'activation_func_yyx': 'Tanh', 'L2_weight_yyx': 0.0008767286893464864, 'L_entropy_weight_yyx': 2.09808305810412e-09, 'L_sep_weight_yyx': 5.615622232451806e-09, 'L_scale_weight_yyx': 0.00016255692772966076, 'learning_rate_yyx': 0.007543143530802912}. Best is trial 12 with value: -0.9172403773089042.
[I 2026-03-18 19:06:29,862] Trial 22 pruned. 
[I 2026-03-18 19:06:38,405] Trial 15 finished with value: -1.763766056401892 and parameters: {'n_layers_yyx': 1, 'hidden_size_yyx_l0': 4, 'context_size_yyx': 3, 'num_mix_components_yyx': 3, 'context_extractor_yyx': 'gru', 'activation_func_yyx': 'GELU', 'L2_weight_yyx': 1.787008166654499e-05, 'L_entropy_weight_yyx': 1.3793434473751671e-08, 'L_sep_weight_yyx': 8.21412017350972e-06, 'L_scale_weight_yyx': 1.2361046413635496e-06, 'learning_rate_yyx': 0.003334068155283325}. Best is trial 1 with value: -1.7684712210476057.
[I 2026-03-18 19:06:39,226] Trial 29 pruned. 
[I 2026-03-18 19:06:43,559] Trial 39 pruned. 
[I 2026-03-18 19:06:43,902] Trial 23 pruned. 
[I 2026-03-18 19:06:45,482] Trial 17 pruned. 
[I 2026-03-18 19:06:46,478] Trial 16 pruned. 
[I 2026-03-18 19:06:47,145] Trial 22 pruned. 
[I 2026-03-18 19:06:47,723] Trial 11 finished with value: -2.26814474210708 and parameters: {'n_layers_yyx': 2, 'hidden_size_yyx_l0': 4, 'hidden_size_yyx_l1': 3, 'context_size_yyx': 4, 'num_mix_components_yyx': 5, 'context_extractor_yyx': 'lstm', 'activation_func_yyx': 'ReLU', 'L2_weight_yyx': 4.718879602343849e-10, 'L_entropy_weight_yyx': 1.5955157422992362e-05, 'L_sep_weight_yyx': 1.489182386635931e-06, 'L_scale_weight_yyx': 0.00024032385240555187, 'learning_rate_yyx': 0.0029063342644031296}. Best is trial 8 with value: -2.2706079849369587.
[I 2026-03-18 19:06:47,821] Trial 20 finished with value: -1.7734189669554552 and parameters: {'n_layers_yyx': 1, 'hidden_size_yyx_l0': 3, 'context_size_yyx': 4, 'num_mix_components_yyx': 3, 'context_extractor_yyx': 'lstm', 'activation_func_yyx': 'GELU', 'L2_weight_yyx': 1.5378279380026202e-07, 'L_entropy_weight_yyx': 6.102348324288268e-07, 'L_sep_weight_yyx': 7.798838439305931e-08, 'L_scale_weight_yyx': 3.3697411638937672e-09, 'learning_rate_yyx': 0.004711997482827701}. Best is trial 4 with value: -1.7775746924677662.
[I 2026-03-18 19:06:48,498] Trial 45 pruned. 
[I 2026-03-18 19:06:50,405] Trial 21 finished with value: -0.8346943481986244 and parameters: {'n_layers_yyx': 1, 'hidden_size_yyx_l0': 2, 'context_size_yyx': 2, 'num_mix_components_yyx': 5, 'context_extractor_yyx': 'gru', 'activation_func_yyx': 'Tanh', 'L2_weight_yyx': 0.0001194084148623784, 'L_entropy_weight_yyx': 3.074944927430069e-08, 'L_sep_weight_yyx': 5.452216076918375e-07, 'L_scale_weight_yyx': 1.7758530783676364e-10, 'learning_rate_yyx': 0.009382215863936231}. Best is trial 21 with value: -0.8346943481986244.
[I 2026-03-18 19:06:52,131] Trial 30 pruned. 
[I 2026-03-18 19:06:53,542] Trial 23 pruned. 
[I 2026-03-18 19:06:54,685] Trial 17 pruned. 
[I 2026-03-18 19:06:56,243] Trial 21 pruned. 
[I 2026-03-18 19:06:57,057] Trial 20 finished with value: -2.2851266363697214 and parameters: {'n_layers_yyx': 2, 'hidden_size_yyx_l0': 3, 'hidden_size_yyx_l1': 6, 'context_size_yyx': 4, 'num_mix_components_yyx': 3, 'context_extractor_yyx': 'gru', 'activation_func_yyx': 'Tanh', 'L2_weight_yyx': 4.1665280356346284e-08, 'L_entropy_weight_yyx': 3.505448260992061e-08, 'L_sep_weight_yyx': 4.3832290107149644e-05, 'L_scale_weight_yyx': 1.0891871787709132e-05, 'learning_rate_yyx': 0.009999200496154973}. Best is trial 20 with value: -2.2851266363697214.
[I 2026-03-18 19:06:57,422] Trial 22 pruned. 
[I 2026-03-18 19:06:57,449] Trial 12 pruned. 
[I 2026-03-18 19:06:58,137] Trial 17 pruned. 
[I 2026-03-18 19:06:58,853] Trial 18 pruned. 
[I 2026-03-18 19:07:00,612] Trial 46 pruned. 
[I 2026-03-18 19:07:00,780] Trial 24 pruned. 
[I 2026-03-18 19:07:04,607] Trial 11 finished with value: -2.280183793053376 and parameters: {'n_layers_yyx': 2, 'hidden_size_yyx_l0': 3, 'hidden_size_yyx_l1': 6, 'context_size_yyx': 4, 'num_mix_components_yyx': 5, 'context_extractor_yyx': 'lstm', 'activation_func_yyx': 'GELU', 'L2_weight_yyx': 1.263169139449918e-06, 'L_entropy_weight_yyx': 0.000854003686021418, 'L_sep_weight_yyx': 0.000820552742506136, 'L_scale_weight_yyx': 0.0007966577175444992, 'learning_rate_yyx': 0.00903425290799841}. Best is trial 10 with value: -2.2811953358201777.
[I 2026-03-18 19:07:05,349] Trial 10 finished with value: -1.80444056366036 and parameters: {'n_layers_yyx': 1, 'hidden_size_yyx_l0': 5, 'context_size_yyx': 1, 'num_mix_components_yyx': 4, 'context_extractor_yyx': 'lstm', 'activation_func_yyx': 'GELU', 'L2_weight_yyx': 0.00036716481206718944, 'L_entropy_weight_yyx': 7.663923379505158e-06, 'L_sep_weight_yyx': 0.0009615503433743184, 'L_scale_weight_yyx': 4.011562606152957e-06, 'learning_rate_yyx': 0.0005553253843422024}. Best is trial 5 with value: -1.864091702761834.
[I 2026-03-18 19:07:05,950] Trial 17 finished with value: -1.7756828622238712 and parameters: {'n_layers_yyx': 1, 'hidden_size_yyx_l0': 5, 'context_size_yyx': 3, 'num_mix_components_yyx': 4, 'context_extractor_yyx': 'gru', 'activation_func_yyx': 'Tanh', 'L2_weight_yyx': 6.293378518708798e-10, 'L_entropy_weight_yyx': 0.00012435687403362594, 'L_sep_weight_yyx': 6.243602911248951e-08, 'L_scale_weight_yyx': 1.6196465682134579e-06, 'learning_rate_yyx': 0.0050345508271470345}. Best is trial 2 with value: -1.776406202226865.
[I 2026-03-18 19:07:06,682] Trial 23 pruned. 
[I 2026-03-18 19:07:07,560] Trial 19 pruned. 
[I 2026-03-18 19:07:09,256] Trial 25 pruned. 
[I 2026-03-18 19:07:09,468] Trial 14 finished with value: -2.2682730134155693 and parameters: {'n_layers_yyx': 2, 'hidden_size_yyx_l0': 5, 'hidden_size_yyx_l1': 6, 'context_size_yyx': 1, 'num_mix_components_yyx': 4, 'context_extractor_yyx': 'lstm', 'activation_func_yyx': 'ReLU', 'L2_weight_yyx': 1.0806316079182942e-10, 'L_entropy_weight_yyx': 2.579253360495946e-06, 'L_sep_weight_yyx': 1.6973097833381955e-06, 'L_scale_weight_yyx': 3.3998809152606973e-05, 'learning_rate_yyx': 0.0031530588938441153}. Best is trial 3 with value: -2.278758564192965.
[I 2026-03-18 19:07:12,420] Trial 18 pruned. 
[I 2026-03-18 19:07:15,176] Trial 47 pruned. 
[I 2026-03-18 19:07:15,507] Trial 26 pruned. 
[I 2026-03-18 19:07:19,172] Trial 15 pruned. 
[I 2026-03-18 19:07:21,187] Trial 20 pruned. 
[I 2026-03-18 19:07:23,643] Trial 38 pruned. 
[I 2026-03-18 19:07:25,621] Trial 31 pruned. 
[I 2026-03-18 19:07:27,203] Trial 37 finished with value: -0.8339115745736013 and parameters: {'n_layers_yyx': 2, 'hidden_size_yyx_l0': 3, 'hidden_size_yyx_l1': 6, 'context_size_yyx': 2, 'num_mix_components_yyx': 1, 'context_extractor_yyx': 'lstm', 'activation_func_yyx': 'Tanh', 'L2_weight_yyx': 2.0995089760165576e-07, 'L_entropy_weight_yyx': 6.703807609356304e-09, 'L_sep_weight_yyx': 3.1236170856092993e-09, 'L_scale_weight_yyx': 4.1162293805507916e-06, 'learning_rate_yyx': 0.004220985362039831}. Best is trial 37 with value: -0.8339115745736013.
[I 2026-03-18 19:07:28,670] Trial 27 pruned. 
[I 2026-03-18 19:07:30,909] Trial 44 finished with value: -0.8306488082187038 and parameters: {'n_layers_yyx': 2, 'hidden_size_yyx_l0': 4, 'hidden_size_yyx_l1': 5, 'context_size_yyx': 2, 'num_mix_components_yyx': 1, 'context_extractor_yyx': 'gru', 'activation_func_yyx': 'ReLU', 'L2_weight_yyx': 0.00014994965027218302, 'L_entropy_weight_yyx': 2.9719064557565847e-10, 'L_sep_weight_yyx': 3.967559567335673e-07, 'L_scale_weight_yyx': 2.1074421048594083e-06, 'learning_rate_yyx': 0.009833138889384911}. Best is trial 44 with value: -0.8306488082187038.
[I 2026-03-18 19:07:31,399] Trial 19 pruned. 
[I 2026-03-18 19:07:32,092] Trial 20 finished with value: -2.2841635509103426 and parameters: {'n_layers_yyx': 2, 'hidden_size_yyx_l0': 6, 'hidden_size_yyx_l1': 6, 'context_size_yyx': 4, 'num_mix_components_yyx': 3, 'context_extractor_yyx': 'lstm', 'activation_func_yyx': 'ReLU', 'L2_weight_yyx': 8.40098340290776e-08, 'L_entropy_weight_yyx': 4.2142263379819665e-06, 'L_sep_weight_yyx': 1.0891455004596522e-09, 'L_scale_weight_yyx': 6.483946340762848e-08, 'learning_rate_yyx': 0.007385471330851454}. Best is trial 10 with value: -2.2853422092545133.
[I 2026-03-18 19:07:32,748] Trial 32 pruned. 
