[I 2026-03-18 20:29:40,990] Trial 42 finished with value: -2.0881053331589983 and parameters: {'n_layers_yyx': 1, 'hidden_size_yyx_l0': 6, 'context_size_yyx': 3, 'num_mix_components_yyx': 5, 'context_extractor_yyx': 'lstm', 'activation_func_yyx': 'ReLU', 'L2_weight_yyx': 0.0003989715064754532, 'L_entropy_weight_yyx': 2.5072945795622372e-06, 'L_sep_weight_yyx': 0.00035126304297808045, 'L_scale_weight_yyx': 1.290657382582032e-06, 'learning_rate_yyx': 0.008668325379565354}. Best is trial 31 with value: -2.089858720706198.
[I 2026-03-18 20:29:42,374] Trial 46 pruned. 
[I 2026-03-18 20:29:43,513] Trial 39 pruned. 
[I 2026-03-18 20:29:44,554] Trial 42 finished with value: -2.121502961137222 and parameters: {'n_layers_yyx': 1, 'hidden_size_yyx_l0': 3, 'context_size_yyx': 2, 'num_mix_components_yyx': 5, 'context_extractor_yyx': 'gru', 'activation_func_yyx': 'Tanh', 'L2_weight_yyx': 1.3840286252376941e-06, 'L_entropy_weight_yyx': 3.1002751662392365e-06, 'L_sep_weight_yyx': 1.3460114682415782e-07, 'L_scale_weight_yyx': 1.0114554880660575e-10, 'learning_rate_yyx': 0.009825848165102746}. Best is trial 10 with value: -2.123509279126982.
[I 2026-03-18 20:29:45,599] Trial 47 pruned. 
[I 2026-03-18 20:29:47,199] Trial 40 pruned. 
[I 2026-03-18 20:29:48,052] Trial 43 pruned. 
[I 2026-03-18 20:30:16,304] Trial 43 finished with value: -2.0951208807223245 and parameters: {'n_layers_yyx': 2, 'hidden_size_yyx_l0': 3, 'hidden_size_yyx_l1': 5, 'context_size_yyx': 4, 'num_mix_components_yyx': 4, 'context_extractor_yyx': 'gru', 'activation_func_yyx': 'Tanh', 'L2_weight_yyx': 1.977342683190854e-06, 'L_entropy_weight_yyx': 0.0001817810782958495, 'L_sep_weight_yyx': 1.307249428399198e-10, 'L_scale_weight_yyx': 2.6504518909002147e-07, 'learning_rate_yyx': 0.00857574654358597}. Best is trial 24 with value: -2.0962241228606584.
[I 2026-03-18 20:30:56,214] Trial 43 finished with value: -2.08588645171639 and parameters: {'n_layers_yyx': 1, 'hidden_size_yyx_l0': 6, 'context_size_yyx': 3, 'num_mix_components_yyx': 5, 'context_extractor_yyx': 'lstm', 'activation_func_yyx': 'ReLU', 'L2_weight_yyx': 0.0009992966557164638, 'L_entropy_weight_yyx': 2.4108131119912086e-06, 'L_sep_weight_yyx': 0.00034179116472029966, 'L_scale_weight_yyx': 1.61933558513401e-06, 'learning_rate_yyx': 0.008386320732232132}. Best is trial 31 with value: -2.089858720706198.
[I 2026-03-18 20:31:14,941] Trial 44 pruned. 
[I 2026-03-18 20:31:19,102] Trial 45 pruned. 
[I 2026-03-18 20:31:22,458] Trial 48 finished with value: -1.6289958320925588 and parameters: {'n_layers_yyx': 2, 'hidden_size_yyx_l0': 3, 'hidden_size_yyx_l1': 5, 'context_size_yyx': 2, 'num_mix_components_yyx': 4, 'context_extractor_yyx': 'gru', 'activation_func_yyx': 'GELU', 'L2_weight_yyx': 0.00015338244690553407, 'L_entropy_weight_yyx': 2.139490852868217e-06, 'L_sep_weight_yyx': 1.7686642232937442e-09, 'L_scale_weight_yyx': 1.8110336205395023e-06, 'learning_rate_yyx': 0.0050058361667176445}. Best is trial 22 with value: -1.6339605357080298.
[I 2026-03-18 20:31:25,620] Trial 46 pruned. 
[I 2026-03-18 20:31:36,574] Trial 47 pruned. 
[I 2026-03-18 20:31:37,202] Trial 41 finished with value: -2.0924374512563793 and parameters: {'n_layers_yyx': 1, 'hidden_size_yyx_l0': 4, 'context_size_yyx': 2, 'num_mix_components_yyx': 4, 'context_extractor_yyx': 'gru', 'activation_func_yyx': 'Tanh', 'L2_weight_yyx': 1.7739678308977766e-06, 'L_entropy_weight_yyx': 3.0832399583169804e-10, 'L_sep_weight_yyx': 1.0381889074437565e-05, 'L_scale_weight_yyx': 0.00011631045309198077, 'learning_rate_yyx': 0.00818068240515785}. Best is trial 11 with value: -2.095012278283745.
[I 2026-03-18 20:31:43,164] Trial 44 finished with value: -2.095289169129071 and parameters: {'n_layers_yyx': 2, 'hidden_size_yyx_l0': 3, 'hidden_size_yyx_l1': 5, 'context_size_yyx': 4, 'num_mix_components_yyx': 4, 'context_extractor_yyx': 'gru', 'activation_func_yyx': 'Tanh', 'L2_weight_yyx': 2.6663757871440465e-07, 'L_entropy_weight_yyx': 0.00021539550572094243, 'L_sep_weight_yyx': 1.305555516225208e-10, 'L_scale_weight_yyx': 1.0000843080449722e-07, 'learning_rate_yyx': 0.008228088013237139}. Best is trial 24 with value: -2.0962241228606584.
[I 2026-03-18 20:31:45,674] Trial 42 pruned. 
[I 2026-03-18 20:31:47,411] Trial 49 pruned. 

Source events: 11540
Target events: 5634
Full model ln_yyx : 208.92450 nats/sec, 33.37452 nats/event
Full model Log loss : -1.62963
Full model ln_yyx : 208.88223 nats/sec, 33.36777 nats/event
Full model Log loss : -1.62829
Full model ln_yyx : 209.73715 nats/sec, 33.50434 nats/event
Full model Log loss : -1.63079
Full model ln_yyx : 207.74947 nats/sec, 33.18682 nats/event
Full model Log loss : -1.62632
Full model ln_yyx : 206.84394 nats/sec, 33.04216 nats/event
Full model Log loss : -1.60129
Full model ln_yyx : 208.90132 nats/sec, 33.37082 nats/event
Full model Log loss : -1.62818
Full model ln_yyx : 207.19788 nats/sec, 33.09870 nats/event
Full model Log loss : -1.62193
Full model ln_yyx : 207.09805 nats/sec, 33.08276 nats/event
Full model Log loss : -1.60057
Full model ln_yyx : 209.84726 nats/sec, 33.52193 nats/event
Full model Log loss : -1.62840
Full model ln_yyx : 206.25786 nats/sec, 32.94854 nats/event
Full model Log loss : -1.62367
Full model ln_yyx : 209.74123 nats/sec, 33.50499 nats/event
Full model Log loss : -1.63396
Full model ln_yyx : 206.94719 nats/sec, 33.05866 nats/event
Full model Log loss : -1.61755
Full model ln_yyx : 205.62246 nats/sec, 32.84704 nats/event
Full model Log loss : -1.60832
Full model ln_yyx : 206.79776 nats/sec, 33.03479 nats/event
Full model Log loss : -1.62670
Full model ln_yyx : 209.37061 nats/sec, 33.44578 nats/event
Full model Log loss : -1.62915
Full model ln_yyx : 209.62218 nats/sec, 33.48597 nats/event
Full model Log loss : -1.63205
Full model ln_yyx : 206.76648 nats/sec, 33.02979 nats/event
Full model Log loss : -1.62602
Full model ln_yyx : 208.30989 nats/sec, 33.27634 nats/event
Full model Log loss : -1.62889
Full model ln_yyx : 209.63457 nats/sec, 33.48795 nats/event
Full model Log loss : -1.62282
Full model ln_yyx : 208.88484 nats/sec, 33.36819 nats/event
Full model Log loss : -1.62900
Optimization finished. Config saved to results/opt-full/opt_full_389_best_config.txt
[I 2026-03-18 20:32:11,142] Trial 45 pruned. 
[I 2026-03-18 20:32:15,624] Trial 44 finished with value: -2.088319109850068 and parameters: {'n_layers_yyx': 1, 'hidden_size_yyx_l0': 6, 'context_size_yyx': 3, 'num_mix_components_yyx': 5, 'context_extractor_yyx': 'lstm', 'activation_func_yyx': 'ReLU', 'L2_weight_yyx': 0.0004702786520490455, 'L_entropy_weight_yyx': 5.617629928096282e-07, 'L_sep_weight_yyx': 0.0008320762754023754, 'L_scale_weight_yyx': 1.6726757021544684e-06, 'learning_rate_yyx': 0.008882348277843725}. Best is trial 31 with value: -2.089858720706198.
[I 2026-03-18 20:32:45,761] Trial 48 finished with value: -2.1081576201703602 and parameters: {'n_layers_yyx': 1, 'hidden_size_yyx_l0': 3, 'context_size_yyx': 3, 'num_mix_components_yyx': 5, 'context_extractor_yyx': 'gru', 'activation_func_yyx': 'Tanh', 'L2_weight_yyx': 6.79694838704901e-06, 'L_entropy_weight_yyx': 1.1638495091865956e-07, 'L_sep_weight_yyx': 1.7705910568796144e-07, 'L_scale_weight_yyx': 1.0249441218430082e-10, 'learning_rate_yyx': 0.007656130078104713}. Best is trial 10 with value: -2.123509279126982.
[I 2026-03-18 20:32:55,988] Trial 49 pruned. 

Source events: 16159
Target events: 3618
Full model ln_yyx : 221.28455 nats/sec, 55.04591 nats/event
Full model Log loss : -2.11030
Full model ln_yyx : 217.65351 nats/sec, 54.14267 nats/event
Full model Log loss : -2.08869
Full model ln_yyx : 220.95691 nats/sec, 54.96440 nats/event
Full model Log loss : -2.10597
Full model ln_yyx : 219.34351 nats/sec, 54.56306 nats/event
Full model Log loss : -2.10813
Full model ln_yyx : 221.25468 nats/sec, 55.03848 nats/event
Full model Log loss : -2.12351
Full model ln_yyx : 220.12467 nats/sec, 54.75738 nats/event
Full model Log loss : -2.11996
Full model ln_yyx : 221.04365 nats/sec, 54.98598 nats/event
Full model Log loss : -2.12202
Full model ln_yyx : 220.26548 nats/sec, 54.79241 nats/event
Full model Log loss : -2.11295
Full model ln_yyx : 218.19465 nats/sec, 54.27728 nats/event
Full model Log loss : -2.09399
Full model ln_yyx : 221.30176 nats/sec, 55.05019 nats/event
Full model Log loss : -2.12181
Full model ln_yyx : 223.32233 nats/sec, 55.55282 nats/event
Full model Log loss : -2.12313
Full model ln_yyx : 220.77663 nats/sec, 54.91956 nats/event
Full model Log loss : -2.11473
Full model ln_yyx : 219.42937 nats/sec, 54.58442 nats/event
Full model Log loss : -2.11614
Full model ln_yyx : 223.25683 nats/sec, 55.53653 nats/event
Full model Log loss : -2.11739
Full model ln_yyx : 222.36824 nats/sec, 55.31548 nats/event
Full model Log loss : -2.12150
Full model ln_yyx : 219.95124 nats/sec, 54.71424 nats/event
Full model Log loss : -2.10816
Optimization finished. Config saved to results/opt-full/opt_full_407_best_config.txt
[I 2026-03-18 20:32:59,799] Trial 45 finished with value: -2.078080625636087 and parameters: {'n_layers_yyx': 1, 'hidden_size_yyx_l0': 6, 'context_size_yyx': 4, 'num_mix_components_yyx': 5, 'context_extractor_yyx': 'lstm', 'activation_func_yyx': 'ReLU', 'L2_weight_yyx': 0.0003257952684185524, 'L_entropy_weight_yyx': 4.839810920018562e-07, 'L_sep_weight_yyx': 0.0006747987560990248, 'L_scale_weight_yyx': 4.153933977727776e-06, 'learning_rate_yyx': 0.00682639098439624}. Best is trial 31 with value: -2.089858720706198.
[I 2026-03-18 20:33:03,183] Trial 46 pruned. 
[I 2026-03-18 20:33:11,012] Trial 43 pruned. 
[I 2026-03-18 20:33:14,211] Trial 47 pruned. 
[I 2026-03-18 20:33:35,715] Trial 46 pruned. 
[I 2026-03-18 20:33:49,262] Trial 47 pruned. 
[I 2026-03-18 20:34:02,446] Trial 48 pruned. 
[I 2026-03-18 20:34:08,855] Trial 49 pruned. 

Source events: 16159
Target events: 20158
Full model ln_yyx : 1220.03438 nats/sec, 54.47122 nats/event
Full model Log loss : -2.08130
Full model ln_yyx : 1218.46650 nats/sec, 54.40122 nats/event
Full model Log loss : -2.08082
Full model ln_yyx : 1229.06630 nats/sec, 54.87448 nats/event
Full model Log loss : -2.08007
Full model ln_yyx : 1218.96888 nats/sec, 54.42365 nats/event
Full model Log loss : -2.07933
Full model ln_yyx : 1213.62483 nats/sec, 54.18506 nats/event
Full model Log loss : -2.08679
Full model ln_yyx : 1221.23815 nats/sec, 54.52497 nats/event
Full model Log loss : -2.09101
Full model ln_yyx : 1222.45001 nats/sec, 54.57908 nats/event
Full model Log loss : -2.09085
Full model ln_yyx : 1227.16456 nats/sec, 54.78957 nats/event
Full model Log loss : -2.09098
Full model ln_yyx : 1232.43672 nats/sec, 55.02496 nats/event
Full model Log loss : -2.09361
Full model ln_yyx : 1217.19108 nats/sec, 54.34428 nats/event
Full model Log loss : -2.08137
Full model ln_yyx : 1227.23890 nats/sec, 54.79289 nats/event
Full model Log loss : -2.09099
Full model ln_yyx : 1240.50931 nats/sec, 55.38537 nats/event
Full model Log loss : -2.09009
Full model ln_yyx : 1232.97633 nats/sec, 55.04905 nats/event
Full model Log loss : -2.09622
Full model ln_yyx : 1228.90329 nats/sec, 54.86720 nats/event
Full model Log loss : -2.09102
Full model ln_yyx : 1229.86604 nats/sec, 54.91018 nats/event
Full model Log loss : -2.09158
Full model ln_yyx : 1229.55618 nats/sec, 54.89635 nats/event
Full model Log loss : -2.08838
Full model ln_yyx : 1230.19487 nats/sec, 54.92486 nats/event
Full model Log loss : -2.09464
Full model ln_yyx : 1229.95385 nats/sec, 54.91410 nats/event
Full model Log loss : -2.09518
Full model ln_yyx : 1223.74478 nats/sec, 54.63688 nats/event
Full model Log loss : -2.09524
Full model ln_yyx : 1223.58483 nats/sec, 54.62974 nats/event
Full model Log loss : -2.09512
Full model ln_yyx : 1223.36108 nats/sec, 54.61975 nats/event
Full model Log loss : -2.09529
Optimization finished. Config saved to results/opt-full/opt_full_405_best_config.txt
[I 2026-03-18 20:34:36,018] Trial 48 finished with value: -2.0917419231935743 and parameters: {'n_layers_yyx': 1, 'hidden_size_yyx_l0': 6, 'context_size_yyx': 3, 'num_mix_components_yyx': 5, 'context_extractor_yyx': 'lstm', 'activation_func_yyx': 'ReLU', 'L2_weight_yyx': 0.0001882655659540673, 'L_entropy_weight_yyx': 5.607461918610474e-09, 'L_sep_weight_yyx': 0.0005334861189286005, 'L_scale_weight_yyx': 9.226445196069703e-06, 'learning_rate_yyx': 0.00877055667076527}. Best is trial 48 with value: -2.0917419231935743.
[I 2026-03-18 20:34:40,802] Trial 44 pruned. 
[I 2026-03-18 20:34:45,008] Trial 49 pruned. 

Source events: 16159
Target events: 32635
Full model ln_yyx : 1955.09872 nats/sec, 53.91723 nats/event
Full model Log loss : -2.07011
Full model ln_yyx : 1955.21372 nats/sec, 53.92040 nats/event
Full model Log loss : -2.06390
Full model ln_yyx : 1941.06192 nats/sec, 53.53013 nats/event
Full model Log loss : -2.05562
Full model ln_yyx : 1973.43475 nats/sec, 54.42290 nats/event
Full model Log loss : -2.08282
Full model ln_yyx : 1984.42900 nats/sec, 54.72609 nats/event
Full model Log loss : -2.08006
Full model ln_yyx : 1981.52662 nats/sec, 54.64605 nats/event
Full model Log loss : -2.08550
Full model ln_yyx : 1968.01526 nats/sec, 54.27344 nats/event
Full model Log loss : -2.07917
Full model ln_yyx : 1966.66697 nats/sec, 54.23626 nats/event
Full model Log loss : -2.07956
Full model ln_yyx : 1986.96337 nats/sec, 54.79599 nats/event
Full model Log loss : -2.08739
Full model ln_yyx : 1977.89935 nats/sec, 54.54602 nats/event
Full model Log loss : -2.08834
Full model ln_yyx : 1978.53225 nats/sec, 54.56348 nats/event
Full model Log loss : -2.08501
Full model ln_yyx : 1977.47742 nats/sec, 54.53439 nats/event
Full model Log loss : -2.08073
Full model ln_yyx : 1983.90932 nats/sec, 54.71176 nats/event
Full model Log loss : -2.08986
Full model ln_yyx : 2002.25824 nats/sec, 55.21779 nats/event
Full model Log loss : -2.08485
Full model ln_yyx : 1983.20702 nats/sec, 54.69240 nats/event
Full model Log loss : -2.08586
Full model ln_yyx : 1979.04123 nats/sec, 54.57751 nats/event
Full model Log loss : -2.08811
Full model ln_yyx : 1980.93239 nats/sec, 54.62967 nats/event
Full model Log loss : -2.08589
Full model ln_yyx : 1989.01454 nats/sec, 54.85255 nats/event
Full model Log loss : -2.08832
Full model ln_yyx : 1976.23997 nats/sec, 54.50026 nats/event
Full model Log loss : -2.07808
Full model ln_yyx : 1985.04623 nats/sec, 54.74312 nats/event
Full model Log loss : -2.09174
Optimization finished. Config saved to results/opt-full/opt_full_403_best_config.txt
[I 2026-03-18 20:34:52,379] Trial 45 pruned. 
[I 2026-03-18 20:35:47,935] Trial 46 finished with value: -2.071190058022194 and parameters: {'n_layers_yyx': 1, 'hidden_size_yyx_l0': 5, 'context_size_yyx': 1, 'num_mix_components_yyx': 4, 'context_extractor_yyx': 'lstm', 'activation_func_yyx': 'GELU', 'L2_weight_yyx': 2.0382915260416562e-10, 'L_entropy_weight_yyx': 2.9390281473645614e-09, 'L_sep_weight_yyx': 2.7323292650934264e-05, 'L_scale_weight_yyx': 0.0003638052656895663, 'learning_rate_yyx': 0.008889164248653526}. Best is trial 11 with value: -2.095012278283745.
[I 2026-03-18 20:37:05,758] Trial 47 pruned. 
[I 2026-03-18 20:38:19,323] Trial 48 pruned. 
[I 2026-03-18 20:38:24,427] Trial 49 pruned. 

Source events: 16159
Target events: 54211
Full model ln_yyx : 3295.25400 nats/sec, 54.70714 nats/event
Full model Log loss : -2.09109
Full model ln_yyx : 3279.04767 nats/sec, 54.43808 nats/event
Full model Log loss : -2.07732
Full model ln_yyx : 3308.80007 nats/sec, 54.93203 nats/event
Full model Log loss : -2.09221
Full model ln_yyx : 3282.81526 nats/sec, 54.50063 nats/event
Full model Log loss : -2.09456
Full model ln_yyx : 3329.28318 nats/sec, 55.27208 nats/event
Full model Log loss : -2.09501
Full model ln_yyx : 3266.73705 nats/sec, 54.23370 nats/event
Full model Log loss : -2.06971
Full model ln_yyx : 3289.59422 nats/sec, 54.61317 nats/event
Full model Log loss : -2.07818
Full model ln_yyx : 3286.29334 nats/sec, 54.55837 nats/event
Full model Log loss : -2.09297
Full model ln_yyx : 3300.34827 nats/sec, 54.79171 nats/event
Full model Log loss : -2.08984
Full model ln_yyx : 3305.60590 nats/sec, 54.87900 nats/event
Full model Log loss : -2.09265
Full model ln_yyx : 3308.31590 nats/sec, 54.92399 nats/event
Full model Log loss : -2.09246
Full model ln_yyx : 3306.64998 nats/sec, 54.89633 nats/event
Full model Log loss : -2.09244
Full model ln_yyx : 3249.27025 nats/sec, 53.94372 nats/event
Full model Log loss : -2.07119
Optimization finished. Config saved to results/opt-full/opt_full_400_best_config.txt
