Warning: Failed writing log files to directory [/var/log/nvidia-mps]. No logs will be available.
Result file already exists: results/opt-full/opt_full_262_best_config.txt
Result file already exists: results/opt-full/opt_full_258_best_config.txt
Result file already exists: results/opt-full/opt_full_282_best_config.txt
Result file already exists: results/opt-full/opt_full_274_best_config.txt
Result file already exists: results/opt-full/opt_full_283_best_config.txt
Result file already exists: results/opt-full/opt_full_273_best_config.txt
Result file already exists: results/opt-full/opt_full_256_best_config.txt
Result file already exists: results/opt-full/opt_full_275_best_config.txt
Result file already exists: results/opt-full/opt_full_259_best_config.txt
Result file already exists: results/opt-full/opt_full_276_best_config.txt
Result file already exists: results/opt-full/opt_full_279_best_config.txt
Result file already exists: results/opt-full/opt_full_264_best_config.txt
Result file already exists: results/opt-full/opt_full_277_best_config.txt
Result file already exists: results/opt-full/opt_full_257_best_config.txt
Result file already exists: results/opt-full/opt_full_261_best_config.txt
Result file already exists: results/opt-full/opt_full_278_best_config.txt
Result file already exists: results/opt-full/opt_full_280_best_config.txt
Result file already exists: results/opt-full/opt_full_265_best_config.txt
Result file already exists: results/opt-full/opt_full_267_best_config.txt
Result file already exists: results/opt-full/opt_full_268_best_config.txt
Result file already exists: results/opt-full/opt_full_281_best_config.txt
Result file already exists: results/opt-full/opt_full_266_best_config.txt
Result file already exists: results/opt-full/opt_full_286_best_config.txt
Result file already exists: results/opt-full/opt_full_260_best_config.txt
Result file already exists: results/opt-full/opt_full_272_best_config.txt
Result file already exists: results/opt-full/opt_full_287_best_config.txt
Result file already exists: results/opt-full/opt_full_284_best_config.txt
Result file already exists: results/opt-full/opt_full_269_best_config.txt
Result file already exists: results/opt-full/opt_full_285_best_config.txt
Result file already exists: results/opt-full/opt_full_263_best_config.txt
Result file already exists: results/opt-full/opt_full_270_best_config.txt
[I 2026-03-18 22:37:48,274] Using an existing study with name 'opt_full-model_seed=42_task=271' instead of creating a new one.
[I 2026-03-18 22:38:15,142] Trial 13 pruned. 
[I 2026-03-18 22:38:22,295] Trial 14 pruned. 
[I 2026-03-18 22:39:21,319] Trial 15 finished with value: -2.8101366821630127 and parameters: {'n_layers_yyx': 2, 'hidden_size_yyx_l0': 2, 'hidden_size_yyx_l1': 6, 'context_size_yyx': 3, 'num_mix_components_yyx': 4, 'context_extractor_yyx': 'lstm', 'activation_func_yyx': 'ReLU', 'L2_weight_yyx': 6.161450466290462e-07, 'L_entropy_weight_yyx': 7.60451243033395e-10, 'L_sep_weight_yyx': 1.076062765962474e-06, 'L_scale_weight_yyx': 1.597475014517568e-10, 'learning_rate_yyx': 0.004748699373741516}. Best is trial 0 with value: -2.8336381241243926.
[I 2026-03-18 22:40:52,373] Trial 16 finished with value: -2.832999743208959 and parameters: {'n_layers_yyx': 2, 'hidden_size_yyx_l0': 4, 'hidden_size_yyx_l1': 4, 'context_size_yyx': 4, 'num_mix_components_yyx': 3, 'context_extractor_yyx': 'lstm', 'activation_func_yyx': 'ReLU', 'L2_weight_yyx': 4.6901893547063066e-05, 'L_entropy_weight_yyx': 3.217785377068318e-08, 'L_sep_weight_yyx': 2.8251425527667042e-05, 'L_scale_weight_yyx': 1.781983431867199e-08, 'learning_rate_yyx': 0.0019567731572747095}. Best is trial 0 with value: -2.8336381241243926.
[I 2026-03-18 22:41:08,032] Trial 17 pruned. 
[I 2026-03-18 22:41:14,540] Trial 18 pruned. 
[I 2026-03-18 22:41:21,464] Trial 19 pruned. 
[I 2026-03-18 22:42:04,812] Trial 20 pruned. 
[I 2026-03-18 22:42:11,144] Trial 21 pruned. 
[I 2026-03-18 22:42:27,038] Trial 22 pruned. 
[I 2026-03-18 22:43:09,581] Trial 23 pruned. 
[I 2026-03-18 22:43:25,006] Trial 24 pruned. 
[I 2026-03-18 22:44:06,573] Trial 25 pruned. 
[I 2026-03-18 22:44:12,768] Trial 26 pruned. 
[I 2026-03-18 22:44:19,285] Trial 27 pruned. 
[I 2026-03-18 22:44:25,640] Trial 28 pruned. 
[I 2026-03-18 22:44:31,846] Trial 29 pruned. 
[I 2026-03-18 22:44:38,246] Trial 30 pruned. 
[I 2026-03-18 22:44:44,315] Trial 31 pruned. 
[I 2026-03-18 22:45:28,211] Trial 32 finished with value: -2.8286095992968354 and parameters: {'n_layers_yyx': 1, 'hidden_size_yyx_l0': 5, 'context_size_yyx': 1, 'num_mix_components_yyx': 5, 'context_extractor_yyx': 'lstm', 'activation_func_yyx': 'Tanh', 'L2_weight_yyx': 9.659265989858291e-05, 'L_entropy_weight_yyx': 1.1556710959354548e-07, 'L_sep_weight_yyx': 7.893251211768524e-09, 'L_scale_weight_yyx': 1.518132092117906e-08, 'learning_rate_yyx': 0.006691111540599927}. Best is trial 0 with value: -2.8336381241243926.
[I 2026-03-18 22:45:34,312] Trial 33 pruned. 
[I 2026-03-18 22:45:40,285] Trial 34 pruned. 
[I 2026-03-18 22:45:46,352] Trial 35 pruned. 
[I 2026-03-18 22:46:53,294] Trial 36 finished with value: -2.8257000113853743 and parameters: {'n_layers_yyx': 1, 'hidden_size_yyx_l0': 6, 'context_size_yyx': 1, 'num_mix_components_yyx': 5, 'context_extractor_yyx': 'lstm', 'activation_func_yyx': 'Tanh', 'L2_weight_yyx': 0.0009650598744913351, 'L_entropy_weight_yyx': 1.2540054951261984e-07, 'L_sep_weight_yyx': 5.523643906104416e-05, 'L_scale_weight_yyx': 9.278067099859758e-08, 'learning_rate_yyx': 0.0020111981729392515}. Best is trial 0 with value: -2.8336381241243926.
[I 2026-03-18 22:47:34,572] Trial 37 finished with value: -2.8125196422511984 and parameters: {'n_layers_yyx': 1, 'hidden_size_yyx_l0': 4, 'context_size_yyx': 4, 'num_mix_components_yyx': 4, 'context_extractor_yyx': 'gru', 'activation_func_yyx': 'Tanh', 'L2_weight_yyx': 3.141692297484674e-06, 'L_entropy_weight_yyx': 2.3295489102244996e-10, 'L_sep_weight_yyx': 4.6077241403768745e-06, 'L_scale_weight_yyx': 1.5769818447171534e-09, 'learning_rate_yyx': 0.009371652088273305}. Best is trial 0 with value: -2.8336381241243926.
[I 2026-03-18 22:48:48,141] Trial 38 finished with value: -2.833889109306539 and parameters: {'n_layers_yyx': 2, 'hidden_size_yyx_l0': 4, 'hidden_size_yyx_l1': 6, 'context_size_yyx': 1, 'num_mix_components_yyx': 5, 'context_extractor_yyx': 'lstm', 'activation_func_yyx': 'GELU', 'L2_weight_yyx': 2.5167704466486327e-05, 'L_entropy_weight_yyx': 2.7393898513676938e-08, 'L_sep_weight_yyx': 1.3606779437383802e-08, 'L_scale_weight_yyx': 2.996355992801194e-08, 'learning_rate_yyx': 0.004099886239847979}. Best is trial 38 with value: -2.833889109306539.
[I 2026-03-18 22:49:02,665] Trial 39 pruned. 
[I 2026-03-18 22:49:17,324] Trial 40 pruned. 
[I 2026-03-18 22:49:32,472] Trial 41 pruned. 
[I 2026-03-18 22:50:10,577] Trial 42 finished with value: -2.8095556389477037 and parameters: {'n_layers_yyx': 2, 'hidden_size_yyx_l0': 4, 'hidden_size_yyx_l1': 4, 'context_size_yyx': 1, 'num_mix_components_yyx': 5, 'context_extractor_yyx': 'lstm', 'activation_func_yyx': 'GELU', 'L2_weight_yyx': 0.00034029539032549334, 'L_entropy_weight_yyx': 7.059980706917132e-08, 'L_sep_weight_yyx': 1.6662571388855123e-09, 'L_scale_weight_yyx': 1.2151593394714989e-08, 'learning_rate_yyx': 0.00812903293431783}. Best is trial 38 with value: -2.833889109306539.
[I 2026-03-18 22:50:16,643] Trial 43 pruned. 
[I 2026-03-18 22:50:31,168] Trial 44 pruned. 
[I 2026-03-18 22:51:26,164] Trial 45 finished with value: -2.8303973697180793 and parameters: {'n_layers_yyx': 2, 'hidden_size_yyx_l0': 4, 'hidden_size_yyx_l1': 2, 'context_size_yyx': 2, 'num_mix_components_yyx': 5, 'context_extractor_yyx': 'lstm', 'activation_func_yyx': 'ReLU', 'L2_weight_yyx': 2.3279967373018994e-06, 'L_entropy_weight_yyx': 3.4800829985608845e-08, 'L_sep_weight_yyx': 8.129635516318565e-08, 'L_scale_weight_yyx': 1.4288384813167726e-07, 'learning_rate_yyx': 0.007801377671331231}. Best is trial 38 with value: -2.833889109306539.
[I 2026-03-18 22:51:32,123] Trial 46 pruned. 
[I 2026-03-18 22:51:38,148] Trial 47 pruned. 
[I 2026-03-18 22:52:29,617] Trial 48 finished with value: -2.811513515605156 and parameters: {'n_layers_yyx': 2, 'hidden_size_yyx_l0': 4, 'hidden_size_yyx_l1': 3, 'context_size_yyx': 4, 'num_mix_components_yyx': 3, 'context_extractor_yyx': 'lstm', 'activation_func_yyx': 'ReLU', 'L2_weight_yyx': 1.5641083710380936e-06, 'L_entropy_weight_yyx': 3.897296342874945e-08, 'L_sep_weight_yyx': 0.0003299907730074797, 'L_scale_weight_yyx': 4.983108876462284e-07, 'learning_rate_yyx': 0.004144212411716933}. Best is trial 38 with value: -2.833889109306539.
[I 2026-03-18 22:53:24,660] Trial 49 finished with value: -2.8341666820662743 and parameters: {'n_layers_yyx': 2, 'hidden_size_yyx_l0': 3, 'hidden_size_yyx_l1': 6, 'context_size_yyx': 3, 'num_mix_components_yyx': 5, 'context_extractor_yyx': 'lstm', 'activation_func_yyx': 'ReLU', 'L2_weight_yyx': 3.9648892123378573e-07, 'L_entropy_weight_yyx': 3.4877023706805305e-09, 'L_sep_weight_yyx': 6.853054529812804e-07, 'L_scale_weight_yyx': 1.903819880927168e-05, 'learning_rate_yyx': 0.007828988935933973}. Best is trial 49 with value: -2.8341666820662743.
[I 2026-03-18 22:54:06,056] Trial 50 finished with value: -2.808592742307555 and parameters: {'n_layers_yyx': 2, 'hidden_size_yyx_l0': 2, 'hidden_size_yyx_l1': 6, 'context_size_yyx': 3, 'num_mix_components_yyx': 1, 'context_extractor_yyx': 'lstm', 'activation_func_yyx': 'ReLU', 'L2_weight_yyx': 8.928728086329467e-09, 'L_entropy_weight_yyx': 3.194594314347107e-10, 'L_sep_weight_yyx': 1.5513925982452784e-06, 'L_scale_weight_yyx': 1.9919537019538935e-05, 'learning_rate_yyx': 0.003534634860081239}. Best is trial 49 with value: -2.8341666820662743.
[I 2026-03-18 22:54:21,248] Trial 51 pruned. 
[I 2026-03-18 22:55:14,074] Trial 52 finished with value: -2.811707062317933 and parameters: {'n_layers_yyx': 2, 'hidden_size_yyx_l0': 4, 'hidden_size_yyx_l1': 6, 'context_size_yyx': 3, 'num_mix_components_yyx': 5, 'context_extractor_yyx': 'lstm', 'activation_func_yyx': 'ReLU', 'L2_weight_yyx': 2.963170912075601e-07, 'L_entropy_weight_yyx': 1.201239141687118e-07, 'L_sep_weight_yyx': 7.701885437058386e-07, 'L_scale_weight_yyx': 1.785666519787358e-05, 'learning_rate_yyx': 0.0076814249772755696}. Best is trial 49 with value: -2.8341666820662743.
[I 2026-03-18 22:55:55,809] Trial 53 finished with value: -2.834288093502945 and parameters: {'n_layers_yyx': 2, 'hidden_size_yyx_l0': 3, 'hidden_size_yyx_l1': 6, 'context_size_yyx': 3, 'num_mix_components_yyx': 5, 'context_extractor_yyx': 'lstm', 'activation_func_yyx': 'ReLU', 'L2_weight_yyx': 7.013265096196253e-07, 'L_entropy_weight_yyx': 2.662696411608091e-09, 'L_sep_weight_yyx': 1.5333242881765457e-08, 'L_scale_weight_yyx': 2.9106629373765138e-08, 'learning_rate_yyx': 0.008716934273590373}. Best is trial 53 with value: -2.834288093502945.
[I 2026-03-18 22:56:10,356] Trial 54 pruned. 
[I 2026-03-18 22:56:52,121] Trial 55 finished with value: -2.834514413474628 and parameters: {'n_layers_yyx': 2, 'hidden_size_yyx_l0': 3, 'hidden_size_yyx_l1': 6, 'context_size_yyx': 3, 'num_mix_components_yyx': 5, 'context_extractor_yyx': 'lstm', 'activation_func_yyx': 'ReLU', 'L2_weight_yyx': 1.714813656451379e-07, 'L_entropy_weight_yyx': 1.1363544531583996e-10, 'L_sep_weight_yyx': 1.1227909948978314e-08, 'L_scale_weight_yyx': 1.0597981960743073e-08, 'learning_rate_yyx': 0.009882294065019583}. Best is trial 55 with value: -2.834514413474628.
[I 2026-03-18 22:57:32,205] Trial 56 pruned. 
[I 2026-03-18 22:57:46,704] Trial 57 pruned. 
[I 2026-03-18 22:58:01,224] Trial 58 pruned. 
[I 2026-03-18 22:58:41,050] Trial 59 pruned. 
[I 2026-03-18 22:58:47,109] Trial 60 pruned. 
[I 2026-03-18 22:59:46,984] Trial 61 finished with value: -2.838636619717087 and parameters: {'n_layers_yyx': 2, 'hidden_size_yyx_l0': 3, 'hidden_size_yyx_l1': 4, 'context_size_yyx': 3, 'num_mix_components_yyx': 5, 'context_extractor_yyx': 'lstm', 'activation_func_yyx': 'GELU', 'L2_weight_yyx': 2.550624868419862e-08, 'L_entropy_weight_yyx': 3.4025729503518837e-09, 'L_sep_weight_yyx': 1.457544860721016e-07, 'L_scale_weight_yyx': 8.204189088615585e-09, 'learning_rate_yyx': 0.009617889157059}. Best is trial 61 with value: -2.838636619717087.
[I 2026-03-18 23:00:47,242] Trial 62 finished with value: -2.838673842325712 and parameters: {'n_layers_yyx': 2, 'hidden_size_yyx_l0': 3, 'hidden_size_yyx_l1': 4, 'context_size_yyx': 3, 'num_mix_components_yyx': 5, 'context_extractor_yyx': 'lstm', 'activation_func_yyx': 'GELU', 'L2_weight_yyx': 2.447773760809787e-08, 'L_entropy_weight_yyx': 3.1479269864038144e-09, 'L_sep_weight_yyx': 1.955846647048406e-07, 'L_scale_weight_yyx': 3.1480166370765295e-09, 'learning_rate_yyx': 0.009750920404258673}. Best is trial 62 with value: -2.838673842325712.

Source events: 40082
Target events: 32635
Full model ln_yyx : 6059.91919 nats/sec, 167.11896 nats/event
Full model Log loss : -2.81014
Full model ln_yyx : 6112.53187 nats/sec, 168.56990 nats/event
Full model Log loss : -2.83300
Full model ln_yyx : 6092.36339 nats/sec, 168.01370 nats/event
Full model Log loss : -2.82861
Full model ln_yyx : 6053.32899 nats/sec, 166.93722 nats/event
Full model Log loss : -2.82570
Full model ln_yyx : 6063.34771 nats/sec, 167.21351 nats/event
Full model Log loss : -2.81252
Full model ln_yyx : 6092.74548 nats/sec, 168.02424 nats/event
Full model Log loss : -2.83389
Full model ln_yyx : 6031.77071 nats/sec, 166.34269 nats/event
Full model Log loss : -2.80956
Full model ln_yyx : 6090.52164 nats/sec, 167.96291 nats/event
Full model Log loss : -2.83040
Full model ln_yyx : 6037.24741 nats/sec, 166.49372 nats/event
Full model Log loss : -2.81151
Full model ln_yyx : 6080.40187 nats/sec, 167.68383 nats/event
Full model Log loss : -2.83417
Full model ln_yyx : 6032.76934 nats/sec, 166.37023 nats/event
Full model Log loss : -2.80859
Full model ln_yyx : 6053.45964 nats/sec, 166.94082 nats/event
Full model Log loss : -2.81171
Full model ln_yyx : 6093.68964 nats/sec, 168.05027 nats/event
Full model Log loss : -2.83429
Full model ln_yyx : 6090.58400 nats/sec, 167.96463 nats/event
Full model Log loss : -2.83451
Full model ln_yyx : 6095.56297 nats/sec, 168.10194 nats/event
Full model Log loss : -2.83864
Full model ln_yyx : 6097.05224 nats/sec, 168.14301 nats/event
Full model Log loss : -2.83867
Optimization finished. Config saved to results/opt-full/opt_full_271_best_config.txt
