[I 2026-03-18 20:02:57,781] Trial 32 finished with value: -1.6134005631885242 and parameters: {'n_layers_yyx': 1, 'hidden_size_yyx_l0': 6, 'context_size_yyx': 3, 'num_mix_components_yyx': 5, 'context_extractor_yyx': 'gru', 'activation_func_yyx': 'GELU', 'L2_weight_yyx': 0.00019568903939039907, 'L_entropy_weight_yyx': 9.342514735036764e-08, 'L_sep_weight_yyx': 5.578573733100159e-06, 'L_scale_weight_yyx': 0.0006501311613012488, 'learning_rate_yyx': 0.004508232419326198}. Best is trial 30 with value: -1.6152616083569185.
[I 2026-03-18 20:02:58,883] Trial 23 pruned. 
[I 2026-03-18 20:03:00,422] Trial 22 pruned. 
[I 2026-03-18 20:03:04,800] Trial 31 pruned. 
[I 2026-03-18 20:03:06,057] Trial 25 pruned. 
[I 2026-03-18 20:03:10,445] Trial 29 pruned. 
[I 2026-03-18 20:03:11,449] Trial 44 pruned. 
[I 2026-03-18 20:03:17,399] Trial 37 pruned. 
[I 2026-03-18 20:03:27,073] Trial 38 finished with value: -1.613907427994734 and parameters: {'n_layers_yyx': 2, 'hidden_size_yyx_l0': 3, 'hidden_size_yyx_l1': 5, 'context_size_yyx': 3, 'num_mix_components_yyx': 4, 'context_extractor_yyx': 'gru', 'activation_func_yyx': 'GELU', 'L2_weight_yyx': 1.0136385302860173e-08, 'L_entropy_weight_yyx': 0.0007327921029503634, 'L_sep_weight_yyx': 4.672362144286512e-08, 'L_scale_weight_yyx': 1.0750272206682562e-06, 'learning_rate_yyx': 0.004579314487582633}. Best is trial 38 with value: -1.613907427994734.
[I 2026-03-18 20:03:27,941] Trial 35 finished with value: -2.079243596955018 and parameters: {'n_layers_yyx': 2, 'hidden_size_yyx_l0': 4, 'hidden_size_yyx_l1': 6, 'context_size_yyx': 4, 'num_mix_components_yyx': 4, 'context_extractor_yyx': 'lstm', 'activation_func_yyx': 'ReLU', 'L2_weight_yyx': 2.1235100533491213e-05, 'L_entropy_weight_yyx': 1.7596159446993298e-06, 'L_sep_weight_yyx': 2.2638029650681659e-07, 'L_scale_weight_yyx': 5.921914437165526e-09, 'learning_rate_yyx': 0.00793289279358549}. Best is trial 2 with value: -2.093203554819634.
[I 2026-03-18 20:03:35,345] Trial 41 finished with value: -2.081181934461455 and parameters: {'n_layers_yyx': 1, 'hidden_size_yyx_l0': 6, 'context_size_yyx': 4, 'num_mix_components_yyx': 5, 'context_extractor_yyx': 'lstm', 'activation_func_yyx': 'ReLU', 'L2_weight_yyx': 1.583547085123095e-08, 'L_entropy_weight_yyx': 2.081151681381674e-08, 'L_sep_weight_yyx': 4.169345144108944e-05, 'L_scale_weight_yyx': 0.00046057137216280655, 'learning_rate_yyx': 0.008864712311550295}. Best is trial 13 with value: -2.092152629106611.
[I 2026-03-18 20:03:38,908] Trial 30 pruned. 
[I 2026-03-18 20:03:42,528] Trial 23 pruned. 
[I 2026-03-18 20:03:47,892] Trial 39 finished with value: -1.6117266915982755 and parameters: {'n_layers_yyx': 2, 'hidden_size_yyx_l0': 4, 'hidden_size_yyx_l1': 4, 'context_size_yyx': 4, 'num_mix_components_yyx': 5, 'context_extractor_yyx': 'lstm', 'activation_func_yyx': 'Tanh', 'L2_weight_yyx': 0.00022873207463957546, 'L_entropy_weight_yyx': 3.012439144885483e-08, 'L_sep_weight_yyx': 6.067760051728912e-07, 'L_scale_weight_yyx': 6.264854819503989e-09, 'learning_rate_yyx': 0.008475155288497703}. Best is trial 13 with value: -1.613792101823724.
[I 2026-03-18 20:03:48,357] Trial 45 pruned. 
[I 2026-03-18 20:03:48,483] Trial 48 finished with value: -1.6119998631169037 and parameters: {'n_layers_yyx': 1, 'hidden_size_yyx_l0': 6, 'context_size_yyx': 4, 'num_mix_components_yyx': 4, 'context_extractor_yyx': 'lstm', 'activation_func_yyx': 'GELU', 'L2_weight_yyx': 6.074106192448493e-07, 'L_entropy_weight_yyx': 1.0679040395552037e-09, 'L_sep_weight_yyx': 1.46571583582684e-09, 'L_scale_weight_yyx': 8.506851694155119e-06, 'learning_rate_yyx': 0.007457362855297295}. Best is trial 26 with value: -1.6132763574564741.
[I 2026-03-18 20:03:49,623] Trial 31 pruned. 
[I 2026-03-18 20:03:53,662] Trial 39 pruned. 
[I 2026-03-18 20:03:54,930] Trial 40 pruned. 
[I 2026-03-18 20:03:55,427] Trial 49 pruned. 

Source events: 11540
Target events: 32635
Full model ln_yyx : 1185.42895 nats/sec, 32.69147 nats/event
Full model Log loss : -1.58793
Full model ln_yyx : 1217.97130 nats/sec, 33.58891 nats/event
Full model Log loss : -1.60254
Full model ln_yyx : 1218.07545 nats/sec, 33.59178 nats/event
Full model Log loss : -1.60974
Full model ln_yyx : 1210.53505 nats/sec, 33.38384 nats/event
Full model Log loss : -1.61212
Full model ln_yyx : 1206.74699 nats/sec, 33.27937 nats/event
Full model Log loss : -1.61140
Full model ln_yyx : 1197.64768 nats/sec, 33.02843 nats/event
Full model Log loss : -1.61235
Full model ln_yyx : 1201.00045 nats/sec, 33.12089 nats/event
Full model Log loss : -1.61094
Full model ln_yyx : 1204.56658 nats/sec, 33.21924 nats/event
Full model Log loss : -1.61328
Full model ln_yyx : 1212.73455 nats/sec, 33.44449 nats/event
Full model Log loss : -1.61285
Full model ln_yyx : 1206.09724 nats/sec, 33.26145 nats/event
Full model Log loss : -1.61236
Full model ln_yyx : 1214.76465 nats/sec, 33.50048 nats/event
Full model Log loss : -1.61307
Full model ln_yyx : 1214.05204 nats/sec, 33.48083 nats/event
Full model Log loss : -1.61232
Full model ln_yyx : 1217.38412 nats/sec, 33.57272 nats/event
Full model Log loss : -1.61242
Full model ln_yyx : 1214.09412 nats/sec, 33.48199 nats/event
Full model Log loss : -1.61242
Full model ln_yyx : 1214.60401 nats/sec, 33.49605 nats/event
Full model Log loss : -1.61255
Full model ln_yyx : 1206.45992 nats/sec, 33.27145 nats/event
Full model Log loss : -1.61200
Optimization finished. Config saved to results/opt-full/opt_full_391_best_config.txt
[I 2026-03-18 20:03:56,886] Trial 46 pruned. 
[I 2026-03-18 20:04:00,222] Trial 18 finished with value: -2.0807251927235955 and parameters: {'n_layers_yyx': 1, 'hidden_size_yyx_l0': 6, 'context_size_yyx': 4, 'num_mix_components_yyx': 5, 'context_extractor_yyx': 'lstm', 'activation_func_yyx': 'GELU', 'L2_weight_yyx': 5.580406833915405e-06, 'L_entropy_weight_yyx': 0.0009462513149147568, 'L_sep_weight_yyx': 1.1623192701773272e-07, 'L_scale_weight_yyx': 2.9038977929526605e-05, 'learning_rate_yyx': 0.005830512297467201}. Best is trial 16 with value: -2.0883428670836364.
[I 2026-03-18 20:04:01,527] Trial 32 pruned. 
[I 2026-03-18 20:04:04,406] Trial 40 pruned. 
[I 2026-03-18 20:04:05,974] Trial 33 pruned. 
[I 2026-03-18 20:04:10,363] Trial 27 pruned. 
[I 2026-03-18 20:04:11,833] Trial 37 finished with value: -1.6454981993206839 and parameters: {'n_layers_yyx': 2, 'hidden_size_yyx_l0': 3, 'hidden_size_yyx_l1': 5, 'context_size_yyx': 3, 'num_mix_components_yyx': 4, 'context_extractor_yyx': 'gru', 'activation_func_yyx': 'ReLU', 'L2_weight_yyx': 1.5833967821561734e-07, 'L_entropy_weight_yyx': 8.120217284020044e-05, 'L_sep_weight_yyx': 3.502935553476736e-06, 'L_scale_weight_yyx': 1.8547618646974477e-06, 'learning_rate_yyx': 0.002622803075406358}. Best is trial 12 with value: -1.6531010225123595.
[I 2026-03-18 20:04:16,157] Trial 33 pruned. 
[I 2026-03-18 20:04:22,594] Trial 33 pruned. 
[I 2026-03-18 20:04:22,837] Trial 24 pruned. 
[I 2026-03-18 20:04:29,665] Trial 41 pruned. 
[I 2026-03-18 20:04:30,376] Trial 32 pruned. 
[I 2026-03-18 20:04:30,376] Trial 26 pruned. 
[I 2026-03-18 20:04:32,545] Trial 34 pruned. 
[I 2026-03-18 20:04:45,012] Trial 25 pruned. 
[I 2026-03-18 20:04:45,014] Trial 39 finished with value: -1.6107655241522274 and parameters: {'n_layers_yyx': 2, 'hidden_size_yyx_l0': 5, 'hidden_size_yyx_l1': 3, 'context_size_yyx': 4, 'num_mix_components_yyx': 5, 'context_extractor_yyx': 'lstm', 'activation_func_yyx': 'ReLU', 'L2_weight_yyx': 4.4432753741669375e-07, 'L_entropy_weight_yyx': 1.87433085443672e-08, 'L_sep_weight_yyx': 0.00022953413693726216, 'L_scale_weight_yyx': 1.0841141490924989e-06, 'learning_rate_yyx': 0.008144076443370138}. Best is trial 38 with value: -1.6114324329693406.
[I 2026-03-18 20:04:47,961] Trial 33 finished with value: -2.06821877894009 and parameters: {'n_layers_yyx': 2, 'hidden_size_yyx_l0': 2, 'hidden_size_yyx_l1': 5, 'context_size_yyx': 3, 'num_mix_components_yyx': 2, 'context_extractor_yyx': 'lstm', 'activation_func_yyx': 'GELU', 'L2_weight_yyx': 1.625700081438846e-05, 'L_entropy_weight_yyx': 0.00025349226202217844, 'L_sep_weight_yyx': 6.528600949553018e-07, 'L_scale_weight_yyx': 1.1227487270818551e-05, 'learning_rate_yyx': 0.0076505581403286645}. Best is trial 6 with value: -2.0790188514889616.
[I 2026-03-18 20:04:50,908] Trial 42 pruned. 
[I 2026-03-18 20:04:50,910] Trial 36 finished with value: -2.0942088775922847 and parameters: {'n_layers_yyx': 1, 'hidden_size_yyx_l0': 2, 'context_size_yyx': 3, 'num_mix_components_yyx': 5, 'context_extractor_yyx': 'gru', 'activation_func_yyx': 'ReLU', 'L2_weight_yyx': 8.536660150337207e-08, 'L_entropy_weight_yyx': 1.0402622473716717e-06, 'L_sep_weight_yyx': 4.859664009886803e-05, 'L_scale_weight_yyx': 6.522188656781153e-07, 'learning_rate_yyx': 0.0038164358475066412}. Best is trial 12 with value: -2.0975572887346234.
[I 2026-03-18 20:05:02,208] Trial 34 pruned. 
[I 2026-03-18 20:05:03,370] Trial 34 pruned. 
[I 2026-03-18 20:05:04,230] Trial 27 pruned. 
[I 2026-03-18 20:05:05,527] Trial 22 finished with value: -2.090087660158708 and parameters: {'n_layers_yyx': 1, 'hidden_size_yyx_l0': 6, 'context_size_yyx': 4, 'num_mix_components_yyx': 5, 'context_extractor_yyx': 'gru', 'activation_func_yyx': 'Tanh', 'L2_weight_yyx': 7.060071275606834e-09, 'L_entropy_weight_yyx': 1.7565643039968326e-07, 'L_sep_weight_yyx': 3.094236436192751e-09, 'L_scale_weight_yyx': 7.418859925659514e-10, 'learning_rate_yyx': 0.006629489244622642}. Best is trial 14 with value: -2.0936086041286655.
[I 2026-03-18 20:05:05,770] Trial 37 pruned. 
[I 2026-03-18 20:05:05,891] Trial 43 pruned. 
[I 2026-03-18 20:05:10,479] Trial 35 pruned. 
[I 2026-03-18 20:05:12,397] Trial 40 pruned. 
[I 2026-03-18 20:05:18,994] Trial 47 pruned. 
[I 2026-03-18 20:05:19,651] Trial 41 pruned. 
[I 2026-03-18 20:05:21,369] Trial 23 pruned. 
[I 2026-03-18 20:05:24,604] Trial 38 pruned. 
[I 2026-03-18 20:05:29,230] Trial 19 pruned. 
[I 2026-03-18 20:05:32,190] Trial 35 pruned. 
[I 2026-03-18 20:05:32,903] Trial 38 pruned. 
[I 2026-03-18 20:05:33,034] Trial 44 pruned. 
[I 2026-03-18 20:05:35,208] Trial 39 pruned. 
[I 2026-03-18 20:05:41,776] Trial 36 pruned. 
[I 2026-03-18 20:05:41,776] Trial 34 pruned. 
[I 2026-03-18 20:05:47,720] Trial 33 pruned. 
[I 2026-03-18 20:05:54,109] Trial 20 pruned. 
[I 2026-03-18 20:06:02,792] Trial 45 pruned. 
[I 2026-03-18 20:06:03,230] Trial 39 pruned. 
[I 2026-03-18 20:06:04,596] Trial 26 pruned. 
[I 2026-03-18 20:06:05,874] Trial 38 finished with value: -2.048265081356006 and parameters: {'n_layers_yyx': 2, 'hidden_size_yyx_l0': 3, 'hidden_size_yyx_l1': 4, 'context_size_yyx': 3, 'num_mix_components_yyx': 4, 'context_extractor_yyx': 'lstm', 'activation_func_yyx': 'GELU', 'L2_weight_yyx': 2.1992514428429843e-10, 'L_entropy_weight_yyx': 1.9059400573967456e-09, 'L_sep_weight_yyx': 7.2518740949961e-05, 'L_scale_weight_yyx': 0.0001073917933875242, 'learning_rate_yyx': 0.006989408251947019}. Best is trial 2 with value: -2.059868681386501.
[I 2026-03-18 20:06:13,642] Trial 21 pruned. 
[I 2026-03-18 20:06:20,528] Trial 46 pruned. 
[I 2026-03-18 20:06:21,806] Trial 27 pruned. 
[I 2026-03-18 20:06:24,440] Trial 42 finished with value: -2.0810508308965288 and parameters: {'n_layers_yyx': 1, 'hidden_size_yyx_l0': 6, 'context_size_yyx': 4, 'num_mix_components_yyx': 5, 'context_extractor_yyx': 'lstm', 'activation_func_yyx': 'ReLU', 'L2_weight_yyx': 1.747062194044538e-09, 'L_entropy_weight_yyx': 1.0614798152701363e-07, 'L_sep_weight_yyx': 6.047960978684832e-05, 'L_scale_weight_yyx': 0.00010767563282628957, 'learning_rate_yyx': 0.008964334196945119}. Best is trial 13 with value: -2.092152629106611.
[I 2026-03-18 20:06:24,583] Trial 22 pruned. 
[I 2026-03-18 20:06:24,885] Trial 48 pruned. 
[I 2026-03-18 20:06:25,854] Trial 47 pruned. 
[I 2026-03-18 20:06:26,265] Trial 38 finished with value: -2.0810705246386165 and parameters: {'n_layers_yyx': 2, 'hidden_size_yyx_l0': 2, 'hidden_size_yyx_l1': 5, 'context_size_yyx': 1, 'num_mix_components_yyx': 2, 'context_extractor_yyx': 'lstm', 'activation_func_yyx': 'GELU', 'L2_weight_yyx': 2.6386058787238565e-06, 'L_entropy_weight_yyx': 1.3161363772661889e-08, 'L_sep_weight_yyx': 2.393785438042604e-10, 'L_scale_weight_yyx': 3.3548531920874955e-09, 'learning_rate_yyx': 0.005602623061208703}. Best is trial 21 with value: -2.0975034066716556.
[I 2026-03-18 20:06:29,588] Trial 40 pruned. 
[I 2026-03-18 20:06:45,143] Trial 36 finished with value: -2.088844981112519 and parameters: {'n_layers_yyx': 1, 'hidden_size_yyx_l0': 5, 'context_size_yyx': 4, 'num_mix_components_yyx': 4, 'context_extractor_yyx': 'lstm', 'activation_func_yyx': 'GELU', 'L2_weight_yyx': 1.9377651081652316e-08, 'L_entropy_weight_yyx': 1.1104111411799003e-06, 'L_sep_weight_yyx': 7.186737517884743e-05, 'L_scale_weight_yyx': 2.7079843760661024e-09, 'learning_rate_yyx': 0.006073455321350769}. Best is trial 2 with value: -2.093203554819634.
[I 2026-03-18 20:06:50,756] Trial 39 pruned. 
[I 2026-03-18 20:06:50,815] Trial 48 pruned. 
[I 2026-03-18 20:06:54,549] Trial 43 pruned. 
[I 2026-03-18 20:06:54,595] Trial 23 pruned. 
[I 2026-03-18 20:06:55,000] Trial 34 pruned. 
[I 2026-03-18 20:06:55,079] Trial 49 pruned. 

Source events: 11540
Target events: 24874
Full model ln_yyx : 927.42184 nats/sec, 33.55631 nats/event
Full model Log loss : -1.61342
Full model ln_yyx : 934.14419 nats/sec, 33.79954 nats/event
Full model Log loss : -1.60677
Full model ln_yyx : 909.32768 nats/sec, 32.90162 nats/event
Full model Log loss : -1.58761
Full model ln_yyx : 920.73422 nats/sec, 33.31434 nats/event
Full model Log loss : -1.61200
Full model ln_yyx : 919.34717 nats/sec, 33.26415 nats/event
Full model Log loss : -1.61441
Full model ln_yyx : 919.53808 nats/sec, 33.27106 nats/event
Full model Log loss : -1.61358
Full model ln_yyx : 923.01278 nats/sec, 33.39678 nats/event
Full model Log loss : -1.60819
Full model ln_yyx : 918.96120 nats/sec, 33.25018 nats/event
Full model Log loss : -1.61265
Full model ln_yyx : 922.03651 nats/sec, 33.36146 nats/event
Full model Log loss : -1.61068
Full model ln_yyx : 918.54542 nats/sec, 33.23514 nats/event
Full model Log loss : -1.61618
Full model ln_yyx : 922.85736 nats/sec, 33.39116 nats/event
Full model Log loss : -1.61147
Full model ln_yyx : 919.12655 nats/sec, 33.25617 nats/event
Full model Log loss : -1.61224
Optimization finished. Config saved to results/opt-full/opt_full_392_best_config.txt
[I 2026-03-18 20:06:55,139] Trial 40 pruned. 
[I 2026-03-18 20:06:59,943] Trial 37 pruned. 
[I 2026-03-18 20:07:01,715] Trial 40 pruned. 
[I 2026-03-18 20:07:04,890] Trial 28 finished with value: -1.6083247437070838 and parameters: {'n_layers_yyx': 2, 'hidden_size_yyx_l0': 4, 'hidden_size_yyx_l1': 6, 'context_size_yyx': 4, 'num_mix_components_yyx': 1, 'context_extractor_yyx': 'lstm', 'activation_func_yyx': 'ReLU', 'L2_weight_yyx': 3.1632493926368445e-05, 'L_entropy_weight_yyx': 5.5996227074046125e-09, 'L_sep_weight_yyx': 1.947586611050104e-05, 'L_scale_weight_yyx': 1.2243269957068471e-09, 'learning_rate_yyx': 0.0022365356328209888}. Best is trial 22 with value: -1.6339605357080298.
[I 2026-03-18 20:07:19,865] Trial 49 pruned. 

Source events: 11540
Target events: 39192
Full model ln_yyx : 1440.79296 nats/sec, 33.08618 nats/event
Full model Log loss : -1.58698
Full model ln_yyx : 1431.28086 nats/sec, 32.86775 nats/event
Full model Log loss : -1.58315
Full model ln_yyx : 1432.43422 nats/sec, 32.89423 nats/event
Full model Log loss : -1.58771
Full model ln_yyx : 1434.64190 nats/sec, 32.94493 nats/event
Full model Log loss : -1.61047
Full model ln_yyx : 1451.32749 nats/sec, 33.32810 nats/event
Full model Log loss : -1.60839
Full model ln_yyx : 1428.69307 nats/sec, 32.80832 nats/event
Full model Log loss : -1.58939
Full model ln_yyx : 1438.98881 nats/sec, 33.04475 nats/event
Full model Log loss : -1.61154
Full model ln_yyx : 1449.84037 nats/sec, 33.29395 nats/event
Full model Log loss : -1.61091
Full model ln_yyx : 1442.46738 nats/sec, 33.12463 nats/event
Full model Log loss : -1.61191
Full model ln_yyx : 1440.14766 nats/sec, 33.07136 nats/event
Full model Log loss : -1.61171
Full model ln_yyx : 1444.54199 nats/sec, 33.17227 nats/event
Full model Log loss : -1.60662
Full model ln_yyx : 1448.10168 nats/sec, 33.25402 nats/event
Full model Log loss : -1.61121
Full model ln_yyx : 1443.89477 nats/sec, 33.15741 nats/event
Full model Log loss : -1.61184
Full model ln_yyx : 1442.99753 nats/sec, 33.13681 nats/event
Full model Log loss : -1.60793
Full model ln_yyx : 1432.01015 nats/sec, 32.88450 nats/event
Full model Log loss : -1.58859
Full model ln_yyx : 1452.04626 nats/sec, 33.34460 nats/event
Full model Log loss : -1.61391
Optimization finished. Config saved to results/opt-full/opt_full_394_best_config.txt
[I 2026-03-18 20:07:20,855] Trial 28 finished with value: -1.5854285132895538 and parameters: {'n_layers_yyx': 2, 'hidden_size_yyx_l0': 6, 'hidden_size_yyx_l1': 6, 'context_size_yyx': 3, 'num_mix_components_yyx': 3, 'context_extractor_yyx': 'lstm', 'activation_func_yyx': 'ReLU', 'L2_weight_yyx': 1.423393895113211e-07, 'L_entropy_weight_yyx': 5.617184762107337e-09, 'L_sep_weight_yyx': 1.6909064489889525e-06, 'L_scale_weight_yyx': 3.547686792616609e-07, 'learning_rate_yyx': 0.00719473688077972}. Best is trial 9 with value: -1.613731891101604.
[I 2026-03-18 20:07:22,455] Trial 38 pruned. 
[I 2026-03-18 20:07:30,210] Trial 44 pruned. 
[I 2026-03-18 20:07:33,953] Trial 35 pruned. 
[I 2026-03-18 20:07:34,189] Trial 41 finished with value: -1.611079262224183 and parameters: {'n_layers_yyx': 2, 'hidden_size_yyx_l0': 5, 'hidden_size_yyx_l1': 4, 'context_size_yyx': 4, 'num_mix_components_yyx': 5, 'context_extractor_yyx': 'lstm', 'activation_func_yyx': 'ReLU', 'L2_weight_yyx': 5.828130567589607e-07, 'L_entropy_weight_yyx': 1.0183509395058579e-07, 'L_sep_weight_yyx': 0.00037367490083554006, 'L_scale_weight_yyx': 2.4979223926473447e-06, 'learning_rate_yyx': 0.005409580545455142}. Best is trial 38 with value: -1.6114324329693406.
[I 2026-03-18 20:07:36,058] Trial 24 pruned. 
[I 2026-03-18 20:07:44,117] Trial 39 pruned. 
[I 2026-03-18 20:07:45,411] Trial 41 pruned. 
[I 2026-03-18 20:07:55,997] Trial 25 pruned. 
[I 2026-03-18 20:07:56,702] Trial 29 pruned. 
[I 2026-03-18 20:08:01,086] Trial 36 finished with value: -2.067352957077367 and parameters: {'n_layers_yyx': 2, 'hidden_size_yyx_l0': 6, 'hidden_size_yyx_l1': 6, 'context_size_yyx': 4, 'num_mix_components_yyx': 1, 'context_extractor_yyx': 'lstm', 'activation_func_yyx': 'Tanh', 'L2_weight_yyx': 0.0009609831929478314, 'L_entropy_weight_yyx': 0.00022635623435202594, 'L_sep_weight_yyx': 1.4935473695243352e-07, 'L_scale_weight_yyx': 0.00016867504127413157, 'learning_rate_yyx': 0.006575642200338569}. Best is trial 6 with value: -2.0790188514889616.
[I 2026-03-18 20:08:05,968] Trial 36 pruned. 
[I 2026-03-18 20:08:16,867] Trial 42 pruned. 
[I 2026-03-18 20:08:20,967] Trial 24 pruned. 
[I 2026-03-18 20:08:23,409] Trial 37 pruned. 
[I 2026-03-18 20:08:25,486] Trial 26 pruned. 
[I 2026-03-18 20:08:27,264] Trial 30 pruned. 
[I 2026-03-18 20:08:31,047] Trial 42 finished with value: -1.6128483004439078 and parameters: {'n_layers_yyx': 2, 'hidden_size_yyx_l0': 2, 'hidden_size_yyx_l1': 3, 'context_size_yyx': 4, 'num_mix_components_yyx': 2, 'context_extractor_yyx': 'gru', 'activation_func_yyx': 'Tanh', 'L2_weight_yyx': 4.597573719083667e-06, 'L_entropy_weight_yyx': 3.2262469806255755e-09, 'L_sep_weight_yyx': 4.107099598006237e-09, 'L_scale_weight_yyx': 2.13119428891586e-05, 'learning_rate_yyx': 0.009024860352147954}. Best is trial 13 with value: -1.613792101823724.
[I 2026-03-18 20:08:36,427] Trial 29 pruned. 
[I 2026-03-18 20:08:40,597] Trial 25 pruned. 
[I 2026-03-18 20:08:41,096] Trial 37 pruned. 
[I 2026-03-18 20:08:46,170] Trial 30 pruned. 
[I 2026-03-18 20:08:47,896] Trial 38 pruned. 
[I 2026-03-18 20:08:50,601] Trial 27 pruned. 
[I 2026-03-18 20:08:50,710] Trial 24 finished with value: -2.0962241228606584 and parameters: {'n_layers_yyx': 1, 'hidden_size_yyx_l0': 5, 'context_size_yyx': 3, 'num_mix_components_yyx': 4, 'context_extractor_yyx': 'gru', 'activation_func_yyx': 'Tanh', 'L2_weight_yyx': 4.659307664555692e-07, 'L_entropy_weight_yyx': 2.123242819931148e-08, 'L_sep_weight_yyx': 6.970072320861333e-08, 'L_scale_weight_yyx': 3.369383721975658e-10, 'learning_rate_yyx': 0.009585161635124646}. Best is trial 24 with value: -2.0962241228606584.
[I 2026-03-18 20:08:55,350] Trial 40 pruned. 
[I 2026-03-18 20:08:55,691] Trial 26 pruned. 
[I 2026-03-18 20:08:57,395] Trial 31 pruned. 
[I 2026-03-18 20:08:58,229] Trial 28 pruned. 
[I 2026-03-18 20:09:04,581] Trial 35 finished with value: -1.6103315868664887 and parameters: {'n_layers_yyx': 1, 'hidden_size_yyx_l0': 4, 'context_size_yyx': 3, 'num_mix_components_yyx': 5, 'context_extractor_yyx': 'gru', 'activation_func_yyx': 'GELU', 'L2_weight_yyx': 0.00018194282923437655, 'L_entropy_weight_yyx': 2.5386701222024693e-09, 'L_sep_weight_yyx': 1.598782372955753e-05, 'L_scale_weight_yyx': 0.0003507569981783267, 'learning_rate_yyx': 0.00703839233676304}. Best is trial 30 with value: -1.6152616083569185.
[I 2026-03-18 20:09:08,422] Trial 41 pruned. 
[I 2026-03-18 20:09:15,962] Trial 32 pruned. 
[I 2026-03-18 20:09:18,182] Trial 29 pruned. 
[I 2026-03-18 20:09:21,243] Trial 41 finished with value: -1.6499487316064043 and parameters: {'n_layers_yyx': 2, 'hidden_size_yyx_l0': 4, 'hidden_size_yyx_l1': 5, 'context_size_yyx': 4, 'num_mix_components_yyx': 5, 'context_extractor_yyx': 'gru', 'activation_func_yyx': 'ReLU', 'L2_weight_yyx': 0.00012667260408814012, 'L_entropy_weight_yyx': 0.0002177146439757775, 'L_sep_weight_yyx': 5.101482125333714e-05, 'L_scale_weight_yyx': 5.34957030949002e-05, 'learning_rate_yyx': 0.005394016227800575}. Best is trial 12 with value: -1.6531010225123595.
[I 2026-03-18 20:09:23,239] Trial 38 pruned. 
[I 2026-03-18 20:09:24,036] Trial 43 pruned. 
[I 2026-03-18 20:09:25,837] Trial 27 pruned. 
