[I 2026-03-18 16:50:35,805] Trial 1 finished with value: -2.8982837772538264 and parameters: {'n_layers_yyx': 2, 'hidden_size_yyx_l0': 2, 'hidden_size_yyx_l1': 6, 'context_size_yyx': 1, 'num_mix_components_yyx': 5, 'context_extractor_yyx': 'gru', 'activation_func_yyx': 'GELU', 'L2_weight_yyx': 7.518322418184812e-05, 'L_entropy_weight_yyx': 1.1447389429034403e-08, 'L_sep_weight_yyx': 2.464334290593675e-06, 'L_scale_weight_yyx': 6.9720816405592014e-09, 'learning_rate_yyx': 0.007872137097432275}. Best is trial 1 with value: -2.8982837772538264.
[I 2026-03-18 16:50:40,264] Trial 2 finished with value: -0.5151019824420242 and parameters: {'n_layers_yyx': 1, 'hidden_size_yyx_l0': 3, 'context_size_yyx': 1, 'num_mix_components_yyx': 2, 'context_extractor_yyx': 'gru', 'activation_func_yyx': 'ReLU', 'L2_weight_yyx': 1.876823926841476e-06, 'L_entropy_weight_yyx': 3.356728049823609e-09, 'L_sep_weight_yyx': 7.047775491372455e-07, 'L_scale_weight_yyx': 1.6366943449235676e-10, 'learning_rate_yyx': 0.001015972336163787}. Best is trial 1 with value: -0.5777964847779832.
[I 2026-03-18 16:50:41,696] Trial 1 finished with value: -2.8187045021845845 and parameters: {'n_layers_yyx': 1, 'hidden_size_yyx_l0': 5, 'context_size_yyx': 3, 'num_mix_components_yyx': 1, 'context_extractor_yyx': 'lstm', 'activation_func_yyx': 'ReLU', 'L2_weight_yyx': 7.298804541861979e-10, 'L_entropy_weight_yyx': 6.858588048111759e-08, 'L_sep_weight_yyx': 0.0003980165283977675, 'L_scale_weight_yyx': 1.4256490580876246e-08, 'learning_rate_yyx': 0.0059386992762474585}. Best is trial 0 with value: -2.9085693359375.
[I 2026-03-18 16:50:45,287] Trial 16 pruned. 
[I 2026-03-18 16:50:47,210] Trial 1 finished with value: -2.900570252418999 and parameters: {'n_layers_yyx': 2, 'hidden_size_yyx_l0': 5, 'hidden_size_yyx_l1': 3, 'context_size_yyx': 3, 'num_mix_components_yyx': 5, 'context_extractor_yyx': 'lstm', 'activation_func_yyx': 'Tanh', 'L2_weight_yyx': 1.119006044131068e-09, 'L_entropy_weight_yyx': 2.2912025425544733e-05, 'L_sep_weight_yyx': 1.7133470687091311e-06, 'L_scale_weight_yyx': 4.982698375586858e-05, 'learning_rate_yyx': 0.0005664951171345552}. Best is trial 1 with value: -2.900570252418999.
[I 2026-03-18 16:50:47,687] Trial 15 pruned. 
[I 2026-03-18 16:50:49,747] Trial 8 finished with value: -0.5564177669226057 and parameters: {'n_layers_yyx': 1, 'hidden_size_yyx_l0': 2, 'context_size_yyx': 3, 'num_mix_components_yyx': 5, 'context_extractor_yyx': 'lstm', 'activation_func_yyx': 'ReLU', 'L2_weight_yyx': 1.7658476385691927e-09, 'L_entropy_weight_yyx': 6.60917213960297e-05, 'L_sep_weight_yyx': 5.390363165087973e-05, 'L_scale_weight_yyx': 0.0009361143673104216, 'learning_rate_yyx': 0.003628196593250998}. Best is trial 8 with value: -0.5564177669226057.
[I 2026-03-18 16:50:50,265] Trial 1 finished with value: -2.9237901005488465 and parameters: {'n_layers_yyx': 1, 'hidden_size_yyx_l0': 6, 'context_size_yyx': 2, 'num_mix_components_yyx': 2, 'context_extractor_yyx': 'lstm', 'activation_func_yyx': 'GELU', 'L2_weight_yyx': 1.1867877916824452e-06, 'L_entropy_weight_yyx': 1.5035371830579136e-09, 'L_sep_weight_yyx': 7.472801249878183e-08, 'L_scale_weight_yyx': 5.664112220802855e-10, 'learning_rate_yyx': 0.009214104257947628}. Best is trial 1 with value: -2.9237901005488465.
[I 2026-03-18 16:50:51,187] Trial 9 pruned. 
[I 2026-03-18 16:50:53,188] Trial 2 pruned. 
[I 2026-03-18 16:50:56,370] Trial 3 pruned. 
[I 2026-03-18 16:51:00,758] Trial 2 pruned. 
[I 2026-03-18 16:51:04,699] Trial 16 pruned. 
[I 2026-03-18 16:51:04,708] Trial 1 finished with value: -2.907263897671221 and parameters: {'n_layers_yyx': 1, 'hidden_size_yyx_l0': 5, 'context_size_yyx': 1, 'num_mix_components_yyx': 4, 'context_extractor_yyx': 'lstm', 'activation_func_yyx': 'Tanh', 'L2_weight_yyx': 4.240015593158563e-07, 'L_entropy_weight_yyx': 2.167933024373657e-10, 'L_sep_weight_yyx': 0.0004700020527638474, 'L_scale_weight_yyx': 0.0002730646161692267, 'learning_rate_yyx': 0.001078608166780912}. Best is trial 1 with value: -2.907263897671221.
[I 2026-03-18 16:51:04,908] Trial 8 finished with value: -0.608750848049104 and parameters: {'n_layers_yyx': 2, 'hidden_size_yyx_l0': 5, 'hidden_size_yyx_l1': 4, 'context_size_yyx': 4, 'num_mix_components_yyx': 4, 'context_extractor_yyx': 'lstm', 'activation_func_yyx': 'ReLU', 'L2_weight_yyx': 2.2236038767364934e-10, 'L_entropy_weight_yyx': 6.582115948658853e-09, 'L_sep_weight_yyx': 7.095970077577562e-07, 'L_scale_weight_yyx': 0.00037593269627426783, 'learning_rate_yyx': 0.008885466864339707}. Best is trial 2 with value: -0.6113786030767988.
[I 2026-03-18 16:51:15,787] Trial 17 pruned. 
[I 2026-03-18 16:51:16,514] Trial 3 finished with value: -0.5576903541281594 and parameters: {'n_layers_yyx': 2, 'hidden_size_yyx_l0': 6, 'hidden_size_yyx_l1': 4, 'context_size_yyx': 2, 'num_mix_components_yyx': 4, 'context_extractor_yyx': 'gru', 'activation_func_yyx': 'GELU', 'L2_weight_yyx': 2.0974667449070705e-06, 'L_entropy_weight_yyx': 1.3258213393407006e-10, 'L_sep_weight_yyx': 2.3526467823563234e-07, 'L_scale_weight_yyx': 6.912834827805723e-08, 'learning_rate_yyx': 0.0008107340454644332}. Best is trial 3 with value: -0.5576903541281594.
[I 2026-03-18 16:51:19,753] Trial 3 pruned. 
[I 2026-03-18 16:51:19,753] Trial 9 pruned. 
[I 2026-03-18 16:51:20,172] Trial 17 pruned. 
[I 2026-03-18 16:51:27,233] Trial 1 finished with value: -2.875781089897074 and parameters: {'n_layers_yyx': 2, 'hidden_size_yyx_l0': 4, 'hidden_size_yyx_l1': 2, 'context_size_yyx': 3, 'num_mix_components_yyx': 5, 'context_extractor_yyx': 'lstm', 'activation_func_yyx': 'GELU', 'L2_weight_yyx': 2.0915418512327618e-10, 'L_entropy_weight_yyx': 2.3155300695341786e-05, 'L_sep_weight_yyx': 7.731898673516289e-05, 'L_scale_weight_yyx': 1.0413553898006703e-06, 'learning_rate_yyx': 0.0012210370067227097}. Best is trial 1 with value: -2.875781089897074.
[I 2026-03-18 16:51:27,296] Trial 4 pruned. 
[I 2026-03-18 16:51:27,613] Trial 15 pruned. 
[I 2026-03-18 16:51:32,376] Trial 18 pruned. 
[I 2026-03-18 16:51:36,727] Trial 18 pruned. 
[I 2026-03-18 16:51:43,847] Trial 5 pruned. 
[I 2026-03-18 16:51:52,201] Trial 19 pruned. 
[I 2026-03-18 16:51:54,354] Trial 6 finished with value: -0.5907732977991746 and parameters: {'n_layers_yyx': 2, 'hidden_size_yyx_l0': 5, 'hidden_size_yyx_l1': 5, 'context_size_yyx': 2, 'num_mix_components_yyx': 3, 'context_extractor_yyx': 'lstm', 'activation_func_yyx': 'Tanh', 'L2_weight_yyx': 1.6912998235165662e-09, 'L_entropy_weight_yyx': 4.0146357720180544e-07, 'L_sep_weight_yyx': 3.5919993319186133e-10, 'L_scale_weight_yyx': 2.6589283716768232e-08, 'learning_rate_yyx': 0.0030588374474018274}. Best is trial 6 with value: -0.5907732977991746.
[I 2026-03-18 16:51:58,716] Trial 1 finished with value: -2.9497769660834225 and parameters: {'n_layers_yyx': 1, 'hidden_size_yyx_l0': 4, 'context_size_yyx': 4, 'num_mix_components_yyx': 3, 'context_extractor_yyx': 'gru', 'activation_func_yyx': 'ReLU', 'L2_weight_yyx': 3.0553054706247046e-07, 'L_entropy_weight_yyx': 9.649798848251926e-09, 'L_sep_weight_yyx': 3.8165156297577896e-08, 'L_scale_weight_yyx': 1.284609766147523e-07, 'learning_rate_yyx': 0.004986585930610154}. Best is trial 1 with value: -2.9497769660834225.
[I 2026-03-18 16:51:59,566] Trial 3 finished with value: -2.912014575059884 and parameters: {'n_layers_yyx': 2, 'hidden_size_yyx_l0': 5, 'hidden_size_yyx_l1': 6, 'context_size_yyx': 2, 'num_mix_components_yyx': 4, 'context_extractor_yyx': 'lstm', 'activation_func_yyx': 'Tanh', 'L2_weight_yyx': 1.9648663509896283e-08, 'L_entropy_weight_yyx': 8.608872795515117e-10, 'L_sep_weight_yyx': 1.446793237966339e-07, 'L_scale_weight_yyx': 7.316832686447764e-05, 'learning_rate_yyx': 0.001434540761211372}. Best is trial 3 with value: -2.912014575059884.
[I 2026-03-18 16:52:02,459] Trial 19 pruned. 
[I 2026-03-18 16:52:07,053] Trial 20 pruned. 
[I 2026-03-18 16:52:07,144] Trial 1 finished with value: -2.891695626271848 and parameters: {'n_layers_yyx': 2, 'hidden_size_yyx_l0': 2, 'hidden_size_yyx_l1': 4, 'context_size_yyx': 2, 'num_mix_components_yyx': 5, 'context_extractor_yyx': 'gru', 'activation_func_yyx': 'ReLU', 'L2_weight_yyx': 2.958495940748133e-08, 'L_entropy_weight_yyx': 1.0156201234301259e-05, 'L_sep_weight_yyx': 3.200132944531452e-10, 'L_scale_weight_yyx': 3.919949616175285e-05, 'learning_rate_yyx': 0.0022127178966365522}. Best is trial 1 with value: -2.891695626271848.
[I 2026-03-18 16:52:13,218] Trial 5 finished with value: -2.4759888218558923 and parameters: {'n_layers_yyx': 1, 'hidden_size_yyx_l0': 2, 'context_size_yyx': 2, 'num_mix_components_yyx': 2, 'context_extractor_yyx': 'gru', 'activation_func_yyx': 'ReLU', 'L2_weight_yyx': 3.7411067189108904e-07, 'L_entropy_weight_yyx': 3.256915207740267e-09, 'L_sep_weight_yyx': 0.0007677329790869167, 'L_scale_weight_yyx': 1.3472199185419277e-06, 'learning_rate_yyx': 0.0005806227906388886}. Best is trial 0 with value: -2.9702180140077377.
[I 2026-03-18 16:52:18,190] Trial 2 pruned. 
[I 2026-03-18 16:52:19,008] Trial 20 pruned. 
[I 2026-03-18 16:52:19,405] Trial 4 pruned. 
[I 2026-03-18 16:52:23,821] Trial 4 finished with value: -0.5664484163098027 and parameters: {'n_layers_yyx': 1, 'hidden_size_yyx_l0': 2, 'context_size_yyx': 4, 'num_mix_components_yyx': 5, 'context_extractor_yyx': 'lstm', 'activation_func_yyx': 'Tanh', 'L2_weight_yyx': 0.00010917088073056933, 'L_entropy_weight_yyx': 0.0006360766728444028, 'L_sep_weight_yyx': 1.434509685944024e-08, 'L_scale_weight_yyx': 1.916887612354433e-06, 'learning_rate_yyx': 0.000797601043663495}. Best is trial 1 with value: -0.5818196838462861.
[I 2026-03-18 16:52:30,137] Trial 3 pruned. 
[I 2026-03-18 16:52:37,204] Trial 21 pruned. 
[I 2026-03-18 16:52:39,600] Trial 5 pruned. 
[I 2026-03-18 16:52:41,676] Trial 5 finished with value: -0.5632802761240543 and parameters: {'n_layers_yyx': 1, 'hidden_size_yyx_l0': 6, 'context_size_yyx': 1, 'num_mix_components_yyx': 1, 'context_extractor_yyx': 'gru', 'activation_func_yyx': 'Tanh', 'L2_weight_yyx': 6.433344045677344e-07, 'L_entropy_weight_yyx': 6.095676713789605e-05, 'L_sep_weight_yyx': 3.017298298507621e-07, 'L_scale_weight_yyx': 5.5704660588655796e-08, 'learning_rate_yyx': 0.006179921665906685}. Best is trial 0 with value: -0.5748618229547262.
[I 2026-03-18 16:52:49,883] Trial 21 pruned. 
[I 2026-03-18 16:52:50,579] Trial 4 pruned. 
[I 2026-03-18 16:53:04,119] Trial 5 finished with value: -0.5610687801565724 and parameters: {'n_layers_yyx': 1, 'hidden_size_yyx_l0': 3, 'context_size_yyx': 4, 'num_mix_components_yyx': 5, 'context_extractor_yyx': 'gru', 'activation_func_yyx': 'GELU', 'L2_weight_yyx': 5.687176345295648e-08, 'L_entropy_weight_yyx': 3.0061377805084386e-08, 'L_sep_weight_yyx': 0.0006160363185093847, 'L_scale_weight_yyx': 2.6869989036529528e-08, 'learning_rate_yyx': 0.0023591310625775685}. Best is trial 0 with value: -0.5683635517524394.
[I 2026-03-18 16:53:05,931] Trial 22 pruned. 
[I 2026-03-18 16:53:07,184] Trial 22 pruned. 
[I 2026-03-18 16:53:10,199] Trial 5 pruned. 
[I 2026-03-18 16:53:13,027] Trial 6 pruned. 
[I 2026-03-18 16:53:16,568] Trial 3 finished with value: -2.9139764119320004 and parameters: {'n_layers_yyx': 2, 'hidden_size_yyx_l0': 2, 'hidden_size_yyx_l1': 6, 'context_size_yyx': 3, 'num_mix_components_yyx': 4, 'context_extractor_yyx': 'gru', 'activation_func_yyx': 'GELU', 'L2_weight_yyx': 5.603609525209779e-07, 'L_entropy_weight_yyx': 1.442979369443659e-09, 'L_sep_weight_yyx': 1.5131934405336868e-05, 'L_scale_weight_yyx': 7.344465821168406e-06, 'learning_rate_yyx': 0.0006401682301772456}. Best is trial 0 with value: -2.973312761552399.
[I 2026-03-18 16:53:20,094] Trial 6 pruned. 
[I 2026-03-18 16:53:21,484] Trial 1 finished with value: -2.871956090883841 and parameters: {'n_layers_yyx': 1, 'hidden_size_yyx_l0': 5, 'context_size_yyx': 4, 'num_mix_components_yyx': 1, 'context_extractor_yyx': 'gru', 'activation_func_yyx': 'Tanh', 'L2_weight_yyx': 1.2049016992723832e-10, 'L_entropy_weight_yyx': 7.895740514402735e-06, 'L_sep_weight_yyx': 5.524026854780184e-07, 'L_scale_weight_yyx': 0.0001123091276582463, 'learning_rate_yyx': 0.0018043220227843015}. Best is trial 1 with value: -2.871956090883841.
[I 2026-03-18 16:53:23,519] Trial 1 finished with value: -2.915453504445994 and parameters: {'n_layers_yyx': 1, 'hidden_size_yyx_l0': 3, 'context_size_yyx': 4, 'num_mix_components_yyx': 4, 'context_extractor_yyx': 'gru', 'activation_func_yyx': 'Tanh', 'L2_weight_yyx': 1.1840273508285564e-08, 'L_entropy_weight_yyx': 4.854099851034312e-05, 'L_sep_weight_yyx': 4.157052523320403e-08, 'L_scale_weight_yyx': 1.2969864819992873e-06, 'learning_rate_yyx': 0.001072107378112853}. Best is trial 1 with value: -2.915453504445994.
[I 2026-03-18 16:53:23,827] Trial 10 finished with value: -0.5701662716872099 and parameters: {'n_layers_yyx': 2, 'hidden_size_yyx_l0': 4, 'hidden_size_yyx_l1': 2, 'context_size_yyx': 2, 'num_mix_components_yyx': 5, 'context_extractor_yyx': 'lstm', 'activation_func_yyx': 'ReLU', 'L2_weight_yyx': 0.0008221034905681558, 'L_entropy_weight_yyx': 3.121935655230575e-10, 'L_sep_weight_yyx': 0.000810387435053332, 'L_scale_weight_yyx': 2.836133994845198e-10, 'learning_rate_yyx': 0.008066368756984157}. Best is trial 3 with value: -0.572887373429709.
[I 2026-03-18 16:53:34,611] Trial 6 pruned. 
[I 2026-03-18 16:53:36,014] Trial 4 pruned. 
[I 2026-03-18 16:53:36,571] Trial 2 finished with value: -2.829140805981704 and parameters: {'n_layers_yyx': 1, 'hidden_size_yyx_l0': 6, 'context_size_yyx': 1, 'num_mix_components_yyx': 2, 'context_extractor_yyx': 'gru', 'activation_func_yyx': 'Tanh', 'L2_weight_yyx': 5.557640149145353e-09, 'L_entropy_weight_yyx': 3.543012618923995e-07, 'L_sep_weight_yyx': 2.410280988605279e-07, 'L_scale_weight_yyx': 5.181084035671273e-05, 'learning_rate_yyx': 0.004123284120431656}. Best is trial 0 with value: -2.957957273051406.
[I 2026-03-18 16:53:41,621] Trial 16 finished with value: -0.5755853456184985 and parameters: {'n_layers_yyx': 1, 'hidden_size_yyx_l0': 6, 'context_size_yyx': 3, 'num_mix_components_yyx': 3, 'context_extractor_yyx': 'gru', 'activation_func_yyx': 'Tanh', 'L2_weight_yyx': 0.00011803373712593038, 'L_entropy_weight_yyx': 5.891395481470648e-08, 'L_sep_weight_yyx': 6.445248170656542e-07, 'L_scale_weight_yyx': 1.7176503144298726e-07, 'learning_rate_yyx': 0.0021241608955027504}. Best is trial 3 with value: -0.5836324153936877.
[I 2026-03-18 16:53:43,535] Trial 7 pruned. 
[I 2026-03-18 16:53:45,640] Trial 6 finished with value: -0.5523537238329608 and parameters: {'n_layers_yyx': 2, 'hidden_size_yyx_l0': 4, 'hidden_size_yyx_l1': 6, 'context_size_yyx': 1, 'num_mix_components_yyx': 5, 'context_extractor_yyx': 'gru', 'activation_func_yyx': 'GELU', 'L2_weight_yyx': 1.2841615186659414e-07, 'L_entropy_weight_yyx': 1.3381078026063695e-05, 'L_sep_weight_yyx': 2.2485108254834437e-05, 'L_scale_weight_yyx': 1.110301812560939e-07, 'learning_rate_yyx': 0.0053566502512468455}. Best is trial 1 with value: -0.5777964847779832.
[I 2026-03-18 16:53:47,527] Trial 2 finished with value: -2.8584319560502554 and parameters: {'n_layers_yyx': 2, 'hidden_size_yyx_l0': 5, 'hidden_size_yyx_l1': 5, 'context_size_yyx': 3, 'num_mix_components_yyx': 1, 'context_extractor_yyx': 'gru', 'activation_func_yyx': 'Tanh', 'L2_weight_yyx': 0.0008239127504569817, 'L_entropy_weight_yyx': 0.0002898096040765984, 'L_sep_weight_yyx': 3.313784758566496e-08, 'L_scale_weight_yyx': 0.00020782150429488652, 'learning_rate_yyx': 0.003138054184554327}. Best is trial 0 with value: -2.8716595948373675.
[I 2026-03-18 16:53:49,723] Trial 4 finished with value: -0.5462330814240888 and parameters: {'n_layers_yyx': 1, 'hidden_size_yyx_l0': 2, 'context_size_yyx': 3, 'num_mix_components_yyx': 1, 'context_extractor_yyx': 'lstm', 'activation_func_yyx': 'Tanh', 'L2_weight_yyx': 1.0929694436419224e-10, 'L_entropy_weight_yyx': 4.5685914554571126e-05, 'L_sep_weight_yyx': 1.2667627480990595e-08, 'L_scale_weight_yyx': 5.014502592715742e-06, 'learning_rate_yyx': 0.0068642613085868566}. Best is trial 3 with value: -0.5576903541281594.
[I 2026-03-18 16:53:50,104] Trial 7 pruned. 
[I 2026-03-18 16:53:56,164] Trial 5 pruned. 
[I 2026-03-18 16:53:57,060] Trial 3 pruned. 
[I 2026-03-18 16:54:02,474] Trial 7 pruned. 
[I 2026-03-18 16:54:06,938] Trial 8 pruned. 
[I 2026-03-18 16:54:07,214] Trial 3 pruned. 
[I 2026-03-18 16:54:16,767] Trial 6 pruned. 
[I 2026-03-18 16:54:17,334] Trial 23 pruned. 
[I 2026-03-18 16:54:19,221] Trial 8 pruned. 
[I 2026-03-18 16:54:21,125] Trial 5 pruned. 
[I 2026-03-18 16:54:23,369] Trial 9 pruned. 
[I 2026-03-18 16:54:27,245] Trial 4 pruned. 
[I 2026-03-18 16:54:33,420] Trial 24 pruned. 
[I 2026-03-18 16:54:35,738] Trial 4 pruned. 
[I 2026-03-18 16:54:43,343] Trial 4 finished with value: -0.38636701837781784 and parameters: {'n_layers_yyx': 2, 'hidden_size_yyx_l0': 5, 'hidden_size_yyx_l1': 6, 'context_size_yyx': 1, 'num_mix_components_yyx': 3, 'context_extractor_yyx': 'gru', 'activation_func_yyx': 'GELU', 'L2_weight_yyx': 1.8020697722559886e-08, 'L_entropy_weight_yyx': 7.331387570476581e-07, 'L_sep_weight_yyx': 0.0002464524949326566, 'L_scale_weight_yyx': 3.4494491332057297e-06, 'learning_rate_yyx': 0.000675858120273133}. Best is trial 0 with value: -0.4346305445620888.
[I 2026-03-18 16:54:43,361] Trial 7 finished with value: -0.5825375605482183 and parameters: {'n_layers_yyx': 1, 'hidden_size_yyx_l0': 5, 'context_size_yyx': 4, 'num_mix_components_yyx': 5, 'context_extractor_yyx': 'lstm', 'activation_func_yyx': 'ReLU', 'L2_weight_yyx': 4.185633275356061e-09, 'L_entropy_weight_yyx': 4.860686115085817e-08, 'L_sep_weight_yyx': 1.4644799137986941e-08, 'L_scale_weight_yyx': 1.3821639686338318e-07, 'learning_rate_yyx': 0.0010139495595922487}. Best is trial 6 with value: -0.5907732977991746.
[I 2026-03-18 16:54:45,888] Trial 5 finished with value: -0.564299004933857 and parameters: {'n_layers_yyx': 1, 'hidden_size_yyx_l0': 5, 'context_size_yyx': 3, 'num_mix_components_yyx': 4, 'context_extractor_yyx': 'lstm', 'activation_func_yyx': 'ReLU', 'L2_weight_yyx': 8.900857271298275e-06, 'L_entropy_weight_yyx': 8.558740629025965e-10, 'L_sep_weight_yyx': 5.2204013813111344e-05, 'L_scale_weight_yyx': 4.036930471565271e-05, 'learning_rate_yyx': 0.0021022382822498075}. Best is trial 1 with value: -0.5818196838462861.
[I 2026-03-18 16:54:47,700] Trial 5 pruned. 
[I 2026-03-18 16:54:53,495] Trial 10 pruned. 
[I 2026-03-18 16:54:56,164] Trial 5 pruned. 
[I 2026-03-18 16:54:56,560] Trial 17 pruned. 
[I 2026-03-18 16:54:57,000] Trial 23 finished with value: -0.38641707004039283 and parameters: {'n_layers_yyx': 1, 'hidden_size_yyx_l0': 6, 'context_size_yyx': 2, 'num_mix_components_yyx': 4, 'context_extractor_yyx': 'gru', 'activation_func_yyx': 'Tanh', 'L2_weight_yyx': 2.9208713910274694e-09, 'L_entropy_weight_yyx': 3.785684264224797e-08, 'L_sep_weight_yyx': 4.804264779510529e-08, 'L_scale_weight_yyx': 1.6716242498988675e-10, 'learning_rate_yyx': 0.0025784101519743803}. Best is trial 7 with value: -0.427185200316249.
[I 2026-03-18 16:54:59,634] Trial 5 pruned. 
[I 2026-03-18 16:54:59,655] Trial 8 pruned. 
[I 2026-03-18 16:55:05,408] Trial 10 finished with value: -0.6044878340651747 and parameters: {'n_layers_yyx': 2, 'hidden_size_yyx_l0': 3, 'hidden_size_yyx_l1': 6, 'context_size_yyx': 3, 'num_mix_components_yyx': 5, 'context_extractor_yyx': 'gru', 'activation_func_yyx': 'ReLU', 'L2_weight_yyx': 6.667003556109978e-09, 'L_entropy_weight_yyx': 1.878411213620596e-06, 'L_sep_weight_yyx': 2.0036849023925204e-10, 'L_scale_weight_yyx': 9.942595387943846e-09, 'learning_rate_yyx': 0.0006347704194663745}. Best is trial 2 with value: -0.6113786030767988.
[I 2026-03-18 16:55:07,647] Trial 6 pruned. 
[I 2026-03-18 16:55:09,783] Trial 11 pruned. 
[I 2026-03-18 16:55:14,766] Trial 6 pruned. 
[I 2026-03-18 16:55:15,900] Trial 6 pruned. 
[I 2026-03-18 16:55:17,590] Trial 6 pruned. 
[I 2026-03-18 16:55:21,875] Trial 9 finished with value: -0.5543689334244971 and parameters: {'n_layers_yyx': 1, 'hidden_size_yyx_l0': 2, 'context_size_yyx': 2, 'num_mix_components_yyx': 2, 'context_extractor_yyx': 'gru', 'activation_func_yyx': 'ReLU', 'L2_weight_yyx': 2.013619852404032e-08, 'L_entropy_weight_yyx': 6.1490654893038745e-06, 'L_sep_weight_yyx': 0.0004364310996710407, 'L_scale_weight_yyx': 5.518139736823613e-05, 'learning_rate_yyx': 0.0006441891194057613}. Best is trial 6 with value: -0.5805135147115715.
[I 2026-03-18 16:55:24,463] Trial 24 pruned. 
[I 2026-03-18 16:55:27,044] Trial 18 pruned. 
[I 2026-03-18 16:55:28,952] Trial 11 finished with value: -0.5770469571078168 and parameters: {'n_layers_yyx': 1, 'hidden_size_yyx_l0': 5, 'context_size_yyx': 2, 'num_mix_components_yyx': 5, 'context_extractor_yyx': 'lstm', 'activation_func_yyx': 'ReLU', 'L2_weight_yyx': 0.0004920778648365475, 'L_entropy_weight_yyx': 0.0008092258131207802, 'L_sep_weight_yyx': 1.387709840136777e-07, 'L_scale_weight_yyx': 1.5507668350587528e-07, 'learning_rate_yyx': 0.005920629987401161}. Best is trial 11 with value: -0.5770469571078168.
[I 2026-03-18 16:55:30,663] Trial 9 pruned. 
[I 2026-03-18 16:55:36,707] Trial 2 finished with value: -2.3549706655743745 and parameters: {'n_layers_yyx': 2, 'hidden_size_yyx_l0': 3, 'hidden_size_yyx_l1': 2, 'context_size_yyx': 4, 'num_mix_components_yyx': 1, 'context_extractor_yyx': 'gru', 'activation_func_yyx': 'Tanh', 'L2_weight_yyx': 5.1213101600139184e-06, 'L_entropy_weight_yyx': 9.005470345008071e-05, 'L_sep_weight_yyx': 1.817296713233901e-08, 'L_scale_weight_yyx': 2.2601179569112843e-06, 'learning_rate_yyx': 0.008829678371036978}. Best is trial 1 with value: -2.871956090883841.
[I 2026-03-18 16:55:40,803] Trial 10 pruned. 
[I 2026-03-18 16:55:48,056] Trial 19 pruned. 
[I 2026-03-18 16:55:49,109] Trial 7 pruned. 
[I 2026-03-18 16:55:49,817] Trial 25 pruned. 
