[I 2026-03-18 19:12:00,630] Trial 0 finished with value: -2.512397478376116 and parameters: {'n_layers_yyx': 1, 'hidden_size_yyx_l0': 2, 'context_size_yyx': 1, 'num_mix_components_yyx': 3, 'context_extractor_yyx': 'gru', 'activation_func_yyx': 'GELU', 'L2_weight_yyx': 1.4882719239314341e-08, 'L_entropy_weight_yyx': 0.000526044351920457, 'L_sep_weight_yyx': 5.277716933984515e-06, 'L_scale_weight_yyx': 1.2441733352185754e-06, 'learning_rate_yyx': 0.004243714681826175}. Best is trial 0 with value: -2.512397478376116.
[I 2026-03-18 19:12:08,242] Trial 1 finished with value: -2.0874493411163124 and parameters: {'n_layers_yyx': 2, 'hidden_size_yyx_l0': 3, 'hidden_size_yyx_l1': 3, 'context_size_yyx': 2, 'num_mix_components_yyx': 1, 'context_extractor_yyx': 'lstm', 'activation_func_yyx': 'ReLU', 'L2_weight_yyx': 1.6733357337190813e-10, 'L_entropy_weight_yyx': 0.0007601036501130634, 'L_sep_weight_yyx': 5.783818758853897e-07, 'L_scale_weight_yyx': 9.436844648240322e-05, 'learning_rate_yyx': 0.008137176509046213}. Best is trial 0 with value: -2.1143376288427875.
[I 2026-03-18 19:12:11,923] Trial 2 pruned. 
[I 2026-03-18 19:12:18,807] Trial 3 pruned. 
[I 2026-03-18 19:12:19,269] Trial 0 finished with value: -2.5120461423480207 and parameters: {'n_layers_yyx': 1, 'hidden_size_yyx_l0': 4, 'context_size_yyx': 2, 'num_mix_components_yyx': 5, 'context_extractor_yyx': 'lstm', 'activation_func_yyx': 'ReLU', 'L2_weight_yyx': 8.426519050200548e-07, 'L_entropy_weight_yyx': 1.7528832994740845e-07, 'L_sep_weight_yyx': 5.042320951034047e-08, 'L_scale_weight_yyx': 4.970211000739982e-10, 'learning_rate_yyx': 0.0019742446257960886}. Best is trial 0 with value: -2.5120461423480207.
[I 2026-03-18 19:12:25,936] Trial 4 pruned. 
[I 2026-03-18 19:12:25,944] Trial 1 finished with value: -1.6815051967246275 and parameters: {'n_layers_yyx': 2, 'hidden_size_yyx_l0': 5, 'hidden_size_yyx_l1': 5, 'context_size_yyx': 2, 'num_mix_components_yyx': 1, 'context_extractor_yyx': 'lstm', 'activation_func_yyx': 'ReLU', 'L2_weight_yyx': 1.7173854778158435e-07, 'L_entropy_weight_yyx': 1.827534978131892e-05, 'L_sep_weight_yyx': 0.000987366456929262, 'L_scale_weight_yyx': 0.0008360316354076985, 'learning_rate_yyx': 0.0007835361952146591}. Best is trial 0 with value: -1.6885144001225116.
[I 2026-03-18 19:12:26,076] Trial 2 pruned. 
[I 2026-03-18 19:12:29,520] Trial 3 finished with value: -1.9930066460961695 and parameters: {'n_layers_yyx': 2, 'hidden_size_yyx_l0': 5, 'hidden_size_yyx_l1': 6, 'context_size_yyx': 4, 'num_mix_components_yyx': 5, 'context_extractor_yyx': 'lstm', 'activation_func_yyx': 'ReLU', 'L2_weight_yyx': 1.3804505530535935e-07, 'L_entropy_weight_yyx': 1.6887607521202335e-07, 'L_sep_weight_yyx': 2.2106109776631208e-10, 'L_scale_weight_yyx': 6.217071357439366e-10, 'learning_rate_yyx': 0.009167630368699019}. Best is trial 3 with value: -1.9930066460961695.
[I 2026-03-18 19:12:32,830] Trial 1 finished with value: -1.713800251613775 and parameters: {'n_layers_yyx': 1, 'hidden_size_yyx_l0': 2, 'context_size_yyx': 4, 'num_mix_components_yyx': 2, 'context_extractor_yyx': 'lstm', 'activation_func_yyx': 'Tanh', 'L2_weight_yyx': 5.696215078308987e-07, 'L_entropy_weight_yyx': 2.9292661565901785e-05, 'L_sep_weight_yyx': 1.3191074444133534e-10, 'L_scale_weight_yyx': 4.216115356086618e-05, 'learning_rate_yyx': 0.0030736081500019933}. Best is trial 0 with value: -1.7166840796377145.
[I 2026-03-18 19:12:37,771] Trial 4 pruned. 
[I 2026-03-18 19:12:40,266] Trial 5 pruned. 
[I 2026-03-18 19:12:42,791] Trial 0 finished with value: -2.4955396216934647 and parameters: {'n_layers_yyx': 1, 'hidden_size_yyx_l0': 3, 'context_size_yyx': 4, 'num_mix_components_yyx': 1, 'context_extractor_yyx': 'gru', 'activation_func_yyx': 'ReLU', 'L2_weight_yyx': 1.1564236369659198e-08, 'L_entropy_weight_yyx': 8.282954338351148e-09, 'L_sep_weight_yyx': 0.0003188358357170486, 'L_scale_weight_yyx': 0.00014925135886653863, 'learning_rate_yyx': 0.0005109672629265184}. Best is trial 0 with value: -2.4955396216934647.
[I 2026-03-18 19:12:42,797] Trial 0 finished with value: -2.510351792604265 and parameters: {'n_layers_yyx': 1, 'hidden_size_yyx_l0': 2, 'context_size_yyx': 2, 'num_mix_components_yyx': 5, 'context_extractor_yyx': 'gru', 'activation_func_yyx': 'GELU', 'L2_weight_yyx': 2.037430257698363e-06, 'L_entropy_weight_yyx': 0.0002244875271802167, 'L_sep_weight_yyx': 1.7591310769885828e-09, 'L_scale_weight_yyx': 1.2038776198682701e-08, 'learning_rate_yyx': 0.005697591263382661}. Best is trial 0 with value: -2.510351792604265.
[I 2026-03-18 19:12:44,762] Trial 1 finished with value: -1.6767316357210702 and parameters: {'n_layers_yyx': 1, 'hidden_size_yyx_l0': 2, 'context_size_yyx': 4, 'num_mix_components_yyx': 5, 'context_extractor_yyx': 'lstm', 'activation_func_yyx': 'Tanh', 'L2_weight_yyx': 2.745064586202872e-07, 'L_entropy_weight_yyx': 0.0005825668331069134, 'L_sep_weight_yyx': 1.3926125163999405e-06, 'L_scale_weight_yyx': 3.0181442448459433e-09, 'learning_rate_yyx': 0.0012698647929172066}. Best is trial 0 with value: -1.6784554536041303.
[I 2026-03-18 19:12:46,847] Trial 6 pruned. 
[I 2026-03-18 19:12:46,888] Trial 5 pruned. 
[I 2026-03-18 19:12:48,091] Trial 2 pruned. 
[I 2026-03-18 19:12:54,908] Trial 6 finished with value: -1.674548906640672 and parameters: {'n_layers_yyx': 1, 'hidden_size_yyx_l0': 5, 'context_size_yyx': 4, 'num_mix_components_yyx': 2, 'context_extractor_yyx': 'gru', 'activation_func_yyx': 'Tanh', 'L2_weight_yyx': 3.0333248856778925e-10, 'L_entropy_weight_yyx': 1.589357538418865e-06, 'L_sep_weight_yyx': 1.337868025368281e-08, 'L_scale_weight_yyx': 3.33804503838473e-06, 'learning_rate_yyx': 0.001968110354840756}. Best is trial 6 with value: -1.674548906640672.
[I 2026-03-18 19:12:57,500] Trial 0 finished with value: -2.5064611091577818 and parameters: {'n_layers_yyx': 2, 'hidden_size_yyx_l0': 3, 'hidden_size_yyx_l1': 2, 'context_size_yyx': 2, 'num_mix_components_yyx': 2, 'context_extractor_yyx': 'lstm', 'activation_func_yyx': 'GELU', 'L2_weight_yyx': 7.152182159161604e-09, 'L_entropy_weight_yyx': 0.00017123754375133145, 'L_sep_weight_yyx': 1.4738857047084033e-06, 'L_scale_weight_yyx': 8.316652725375827e-05, 'learning_rate_yyx': 0.001612439313681294}. Best is trial 0 with value: -2.5064611091577818.
[I 2026-03-18 19:13:01,338] Trial 7 pruned. 
[I 2026-03-18 19:13:02,513] Trial 2 finished with value: -1.6635388910970912 and parameters: {'n_layers_yyx': 1, 'hidden_size_yyx_l0': 2, 'context_size_yyx': 4, 'num_mix_components_yyx': 5, 'context_extractor_yyx': 'gru', 'activation_func_yyx': 'Tanh', 'L2_weight_yyx': 0.00039496636674704177, 'L_entropy_weight_yyx': 1.9952651198132876e-06, 'L_sep_weight_yyx': 3.960459121895443e-07, 'L_scale_weight_yyx': 9.014702382773908e-06, 'learning_rate_yyx': 0.0005733887446075436}. Best is trial 0 with value: -1.6685281118368198.
[I 2026-03-18 19:13:04,431] Trial 1 pruned. 
[I 2026-03-18 19:13:05,016] Trial 3 finished with value: -1.9793726467879271 and parameters: {'n_layers_yyx': 2, 'hidden_size_yyx_l0': 2, 'hidden_size_yyx_l1': 4, 'context_size_yyx': 2, 'num_mix_components_yyx': 2, 'context_extractor_yyx': 'lstm', 'activation_func_yyx': 'ReLU', 'L2_weight_yyx': 3.30018911156598e-06, 'L_entropy_weight_yyx': 0.0009335348237993359, 'L_sep_weight_yyx': 0.00019021185844959767, 'L_scale_weight_yyx': 2.055105570321056e-05, 'learning_rate_yyx': 0.008473983640590784}. Best is trial 2 with value: -1.9828319095557092.
[I 2026-03-18 19:13:08,331] Trial 1 finished with value: -1.9828018961884801 and parameters: {'n_layers_yyx': 1, 'hidden_size_yyx_l0': 4, 'context_size_yyx': 2, 'num_mix_components_yyx': 5, 'context_extractor_yyx': 'lstm', 'activation_func_yyx': 'ReLU', 'L2_weight_yyx': 3.572680206349136e-06, 'L_entropy_weight_yyx': 4.9417143649923445e-08, 'L_sep_weight_yyx': 2.0798454015207804e-09, 'L_scale_weight_yyx': 2.8419884589673473e-07, 'learning_rate_yyx': 0.009034605348866659}. Best is trial 1 with value: -1.9828018961884801.
[I 2026-03-18 19:13:11,267] Trial 1 finished with value: -1.9859949036863145 and parameters: {'n_layers_yyx': 2, 'hidden_size_yyx_l0': 3, 'hidden_size_yyx_l1': 3, 'context_size_yyx': 1, 'num_mix_components_yyx': 3, 'context_extractor_yyx': 'gru', 'activation_func_yyx': 'Tanh', 'L2_weight_yyx': 1.1990758187524264e-07, 'L_entropy_weight_yyx': 2.0597652273441465e-10, 'L_sep_weight_yyx': 1.3082830295128179e-06, 'L_scale_weight_yyx': 0.00016195484250585993, 'learning_rate_yyx': 0.006328590105046373}. Best is trial 0 with value: -2.018971523147818.
[I 2026-03-18 19:13:12,365] Trial 5 finished with value: -1.704671424204909 and parameters: {'n_layers_yyx': 2, 'hidden_size_yyx_l0': 6, 'hidden_size_yyx_l1': 5, 'context_size_yyx': 2, 'num_mix_components_yyx': 2, 'context_extractor_yyx': 'lstm', 'activation_func_yyx': 'GELU', 'L2_weight_yyx': 2.3587523069370894e-10, 'L_entropy_weight_yyx': 4.261347926206884e-08, 'L_sep_weight_yyx': 2.9319320981013923e-09, 'L_scale_weight_yyx': 3.9789104893456985e-10, 'learning_rate_yyx': 0.00935222780860124}. Best is trial 5 with value: -1.704671424204909.
[I 2026-03-18 19:13:18,357] Trial 1 finished with value: -1.968093923912178 and parameters: {'n_layers_yyx': 1, 'hidden_size_yyx_l0': 4, 'context_size_yyx': 1, 'num_mix_components_yyx': 2, 'context_extractor_yyx': 'lstm', 'activation_func_yyx': 'GELU', 'L2_weight_yyx': 6.426996355250616e-10, 'L_entropy_weight_yyx': 0.000398947701142039, 'L_sep_weight_yyx': 4.368916360014808e-07, 'L_scale_weight_yyx': 0.0003220134752516605, 'learning_rate_yyx': 0.0025025333915897}. Best is trial 0 with value: -2.0138799336866504.
[I 2026-03-18 19:13:24,668] Trial 1 finished with value: -1.6388965131693365 and parameters: {'n_layers_yyx': 1, 'hidden_size_yyx_l0': 3, 'context_size_yyx': 2, 'num_mix_components_yyx': 2, 'context_extractor_yyx': 'lstm', 'activation_func_yyx': 'GELU', 'L2_weight_yyx': 0.00043140281159000554, 'L_entropy_weight_yyx': 4.108525658133014e-09, 'L_sep_weight_yyx': 2.4333085601302634e-10, 'L_scale_weight_yyx': 5.045623821679672e-05, 'learning_rate_yyx': 0.0005305803205776434}. Best is trial 0 with value: -1.6628499528155825.
[I 2026-03-18 19:13:25,402] Trial 2 pruned. 
[I 2026-03-18 19:13:27,075] Trial 6 pruned. 
[I 2026-03-18 19:13:29,710] Trial 2 pruned. 
[I 2026-03-18 19:13:33,006] Trial 3 pruned. 
[I 2026-03-18 19:13:33,408] Trial 5 pruned. 
[I 2026-03-18 19:13:38,153] Trial 3 pruned. 
[I 2026-03-18 19:13:40,405] Trial 1 finished with value: -2.488616099098856 and parameters: {'n_layers_yyx': 2, 'hidden_size_yyx_l0': 5, 'hidden_size_yyx_l1': 2, 'context_size_yyx': 3, 'num_mix_components_yyx': 1, 'context_extractor_yyx': 'lstm', 'activation_func_yyx': 'GELU', 'L2_weight_yyx': 2.3368986949572473e-09, 'L_entropy_weight_yyx': 3.309710925336863e-09, 'L_sep_weight_yyx': 6.016779605504518e-08, 'L_scale_weight_yyx': 1.7745077712754997e-05, 'learning_rate_yyx': 0.0032095330419906745}. Best is trial 1 with value: -2.488616099098856.
[I 2026-03-18 19:13:50,513] Trial 2 pruned. 
[I 2026-03-18 19:14:13,693] Trial 2 finished with value: -1.680426359749482 and parameters: {'n_layers_yyx': 2, 'hidden_size_yyx_l0': 3, 'hidden_size_yyx_l1': 2, 'context_size_yyx': 2, 'num_mix_components_yyx': 4, 'context_extractor_yyx': 'gru', 'activation_func_yyx': 'Tanh', 'L2_weight_yyx': 2.77589597595092e-07, 'L_entropy_weight_yyx': 1.649260414514068e-10, 'L_sep_weight_yyx': 6.0861173607703245e-05, 'L_scale_weight_yyx': 6.10918433613832e-06, 'learning_rate_yyx': 0.0027818386283871917}. Best is trial 2 with value: -1.680426359749482.
[I 2026-03-18 19:14:20,728] Trial 3 pruned. 
[I 2026-03-18 19:14:21,320] Trial 4 finished with value: -2.491023264461593 and parameters: {'n_layers_yyx': 2, 'hidden_size_yyx_l0': 3, 'hidden_size_yyx_l1': 5, 'context_size_yyx': 3, 'num_mix_components_yyx': 2, 'context_extractor_yyx': 'gru', 'activation_func_yyx': 'Tanh', 'L2_weight_yyx': 1.4838675646768864e-05, 'L_entropy_weight_yyx': 1.3463417877839104e-10, 'L_sep_weight_yyx': 0.0002918337492519928, 'L_scale_weight_yyx': 8.566048470765003e-06, 'learning_rate_yyx': 0.0005816602128781265}. Best is trial 0 with value: -2.511745534136428.
[I 2026-03-18 19:14:21,414] Trial 1 finished with value: -1.6713062306541138 and parameters: {'n_layers_yyx': 1, 'hidden_size_yyx_l0': 3, 'context_size_yyx': 4, 'num_mix_components_yyx': 2, 'context_extractor_yyx': 'lstm', 'activation_func_yyx': 'Tanh', 'L2_weight_yyx': 8.663690427858061e-09, 'L_entropy_weight_yyx': 1.1324458099492855e-08, 'L_sep_weight_yyx': 8.088803710847306e-07, 'L_scale_weight_yyx': 9.509419589603509e-05, 'learning_rate_yyx': 0.0017569059856425526}. Best is trial 0 with value: -1.6755450137356964.
[I 2026-03-18 19:14:25,305] Trial 1 pruned. 
[I 2026-03-18 19:14:29,473] Trial 4 finished with value: -1.6640185420757185 and parameters: {'n_layers_yyx': 2, 'hidden_size_yyx_l0': 5, 'hidden_size_yyx_l1': 6, 'context_size_yyx': 2, 'num_mix_components_yyx': 4, 'context_extractor_yyx': 'gru', 'activation_func_yyx': 'Tanh', 'L2_weight_yyx': 2.6342110490504293e-08, 'L_entropy_weight_yyx': 1.853165852977368e-07, 'L_sep_weight_yyx': 4.4887224325660276e-07, 'L_scale_weight_yyx': 0.0002898952063885384, 'learning_rate_yyx': 0.007452742028818832}. Best is trial 0 with value: -1.6784554536041303.
[I 2026-03-18 19:14:31,333] Trial 5 pruned. 
[I 2026-03-18 19:14:34,068] Trial 8 finished with value: -1.7294919135267302 and parameters: {'n_layers_yyx': 1, 'hidden_size_yyx_l0': 5, 'context_size_yyx': 3, 'num_mix_components_yyx': 3, 'context_extractor_yyx': 'gru', 'activation_func_yyx': 'ReLU', 'L2_weight_yyx': 6.476902724448622e-07, 'L_entropy_weight_yyx': 1.0944063681265982e-09, 'L_sep_weight_yyx': 4.3602482389501e-10, 'L_scale_weight_yyx': 1.3949725443860246e-06, 'learning_rate_yyx': 0.009302276686750459}. Best is trial 8 with value: -1.7294919135267302.
[I 2026-03-18 19:14:35,361] Trial 2 pruned. 
[I 2026-03-18 19:14:37,077] Trial 5 pruned. 
[I 2026-03-18 19:14:37,116] Trial 1 finished with value: -2.5092641587756246 and parameters: {'n_layers_yyx': 2, 'hidden_size_yyx_l0': 3, 'hidden_size_yyx_l1': 5, 'context_size_yyx': 3, 'num_mix_components_yyx': 2, 'context_extractor_yyx': 'lstm', 'activation_func_yyx': 'ReLU', 'L2_weight_yyx': 8.802370053932244e-05, 'L_entropy_weight_yyx': 0.00010700723970420115, 'L_sep_weight_yyx': 2.0765629972551677e-07, 'L_scale_weight_yyx': 3.2195049360396694e-08, 'learning_rate_yyx': 0.002372192132891457}. Best is trial 0 with value: -2.5120178855442976.
[I 2026-03-18 19:14:37,993] Trial 4 pruned. 
[I 2026-03-18 19:14:39,652] Trial 1 finished with value: -2.4902220299951665 and parameters: {'n_layers_yyx': 2, 'hidden_size_yyx_l0': 6, 'hidden_size_yyx_l1': 6, 'context_size_yyx': 2, 'num_mix_components_yyx': 5, 'context_extractor_yyx': 'lstm', 'activation_func_yyx': 'Tanh', 'L2_weight_yyx': 3.891648850194226e-10, 'L_entropy_weight_yyx': 7.979694067568594e-05, 'L_sep_weight_yyx': 7.564574595507737e-07, 'L_scale_weight_yyx': 0.00018658931044908189, 'learning_rate_yyx': 0.0020117488766846787}. Best is trial 1 with value: -2.4902220299951665.
[I 2026-03-18 19:14:42,178] Trial 6 pruned. 
[I 2026-03-18 19:14:43,339] Trial 1 finished with value: -1.654917326986303 and parameters: {'n_layers_yyx': 2, 'hidden_size_yyx_l0': 5, 'hidden_size_yyx_l1': 3, 'context_size_yyx': 1, 'num_mix_components_yyx': 4, 'context_extractor_yyx': 'gru', 'activation_func_yyx': 'ReLU', 'L2_weight_yyx': 3.80761245055579e-10, 'L_entropy_weight_yyx': 5.023342446713572e-08, 'L_sep_weight_yyx': 2.4476470246483023e-05, 'L_scale_weight_yyx': 6.831588524582047e-10, 'learning_rate_yyx': 0.0007713498110314642}. Best is trial 0 with value: -1.6753394453643549.
[I 2026-03-18 19:14:44,686] Trial 6 pruned. 
[I 2026-03-18 19:14:45,390] Trial 5 pruned. 
[I 2026-03-18 19:14:51,821] Trial 2 finished with value: -1.6965485290020457 and parameters: {'n_layers_yyx': 2, 'hidden_size_yyx_l0': 5, 'hidden_size_yyx_l1': 2, 'context_size_yyx': 3, 'num_mix_components_yyx': 4, 'context_extractor_yyx': 'gru', 'activation_func_yyx': 'Tanh', 'L2_weight_yyx': 4.9898694780408245e-08, 'L_entropy_weight_yyx': 1.145279408286234e-06, 'L_sep_weight_yyx': 6.6394246576448905e-06, 'L_scale_weight_yyx': 1.7285840589004215e-06, 'learning_rate_yyx': 0.005997669675207427}. Best is trial 2 with value: -1.6965485290020457.
[I 2026-03-18 19:14:55,469] Trial 4 finished with value: -1.9790352698769165 and parameters: {'n_layers_yyx': 2, 'hidden_size_yyx_l0': 5, 'hidden_size_yyx_l1': 2, 'context_size_yyx': 3, 'num_mix_components_yyx': 5, 'context_extractor_yyx': 'lstm', 'activation_func_yyx': 'GELU', 'L2_weight_yyx': 3.617406745415872e-06, 'L_entropy_weight_yyx': 1.085144120783767e-08, 'L_sep_weight_yyx': 1.1932972534517992e-08, 'L_scale_weight_yyx': 2.5609039337414445e-06, 'learning_rate_yyx': 0.001154773071499154}. Best is trial 4 with value: -1.9790352698769165.
[I 2026-03-18 19:15:01,630] Trial 2 finished with value: -1.981469582990584 and parameters: {'n_layers_yyx': 2, 'hidden_size_yyx_l0': 6, 'hidden_size_yyx_l1': 5, 'context_size_yyx': 2, 'num_mix_components_yyx': 4, 'context_extractor_yyx': 'lstm', 'activation_func_yyx': 'Tanh', 'L2_weight_yyx': 2.3148829173651895e-10, 'L_entropy_weight_yyx': 9.054472399901921e-08, 'L_sep_weight_yyx': 6.114697178763124e-07, 'L_scale_weight_yyx': 0.00017514934911998318, 'learning_rate_yyx': 0.005645262654812664}. Best is trial 1 with value: -1.9828018961884801.
[I 2026-03-18 19:15:05,606] Trial 1 finished with value: -2.54628860366928 and parameters: {'n_layers_yyx': 1, 'hidden_size_yyx_l0': 4, 'context_size_yyx': 1, 'num_mix_components_yyx': 5, 'context_extractor_yyx': 'lstm', 'activation_func_yyx': 'Tanh', 'L2_weight_yyx': 0.00015341286386562, 'L_entropy_weight_yyx': 9.131747257465283e-07, 'L_sep_weight_yyx': 2.368021343936652e-05, 'L_scale_weight_yyx': 4.767810417260356e-07, 'learning_rate_yyx': 0.002420761779798036}. Best is trial 1 with value: -2.54628860366928.
[I 2026-03-18 19:15:09,754] Trial 1 finished with value: -2.5125601952756833 and parameters: {'n_layers_yyx': 2, 'hidden_size_yyx_l0': 3, 'hidden_size_yyx_l1': 6, 'context_size_yyx': 4, 'num_mix_components_yyx': 5, 'context_extractor_yyx': 'lstm', 'activation_func_yyx': 'ReLU', 'L2_weight_yyx': 3.169979955997292e-07, 'L_entropy_weight_yyx': 2.344867411627175e-07, 'L_sep_weight_yyx': 9.497799628060934e-06, 'L_scale_weight_yyx': 2.3891386876944864e-09, 'learning_rate_yyx': 0.006363816328980663}. Best is trial 1 with value: -2.5125601952756833.
[I 2026-03-18 19:15:13,106] Trial 9 pruned. 
[I 2026-03-18 19:15:20,317] Trial 1 finished with value: -2.508543311145146 and parameters: {'n_layers_yyx': 2, 'hidden_size_yyx_l0': 6, 'hidden_size_yyx_l1': 2, 'context_size_yyx': 3, 'num_mix_components_yyx': 4, 'context_extractor_yyx': 'lstm', 'activation_func_yyx': 'GELU', 'L2_weight_yyx': 1.1313646176089598e-09, 'L_entropy_weight_yyx': 0.0007473371237115403, 'L_sep_weight_yyx': 0.0006823149733483612, 'L_scale_weight_yyx': 1.1094231000394028e-07, 'learning_rate_yyx': 0.008167018911946234}. Best is trial 1 with value: -2.508543311145146.
[I 2026-03-18 19:15:20,904] Trial 3 pruned. 
[I 2026-03-18 19:15:22,309] Trial 7 finished with value: -1.6723661848927047 and parameters: {'n_layers_yyx': 2, 'hidden_size_yyx_l0': 2, 'hidden_size_yyx_l1': 6, 'context_size_yyx': 4, 'num_mix_components_yyx': 5, 'context_extractor_yyx': 'gru', 'activation_func_yyx': 'Tanh', 'L2_weight_yyx': 2.0643384400095014e-09, 'L_entropy_weight_yyx': 1.3122692834855594e-08, 'L_sep_weight_yyx': 1.306321744342726e-05, 'L_scale_weight_yyx': 0.000567481321710804, 'learning_rate_yyx': 0.0013642987740780446}. Best is trial 6 with value: -1.674548906640672.
[I 2026-03-18 19:15:24,384] Trial 3 finished with value: -1.6593932298901333 and parameters: {'n_layers_yyx': 1, 'hidden_size_yyx_l0': 6, 'context_size_yyx': 1, 'num_mix_components_yyx': 1, 'context_extractor_yyx': 'gru', 'activation_func_yyx': 'Tanh', 'L2_weight_yyx': 1.1759211804145234e-07, 'L_entropy_weight_yyx': 1.308009046259588e-07, 'L_sep_weight_yyx': 0.00018988828406684755, 'L_scale_weight_yyx': 1.3443179302991708e-06, 'learning_rate_yyx': 0.003410554989683391}. Best is trial 0 with value: -1.6685281118368198.
[I 2026-03-18 19:15:31,243] Trial 8 pruned. 
[I 2026-03-18 19:15:32,430] Trial 3 pruned. 
[I 2026-03-18 19:15:34,423] Trial 1 finished with value: -2.511856338115334 and parameters: {'n_layers_yyx': 2, 'hidden_size_yyx_l0': 3, 'hidden_size_yyx_l1': 3, 'context_size_yyx': 3, 'num_mix_components_yyx': 4, 'context_extractor_yyx': 'gru', 'activation_func_yyx': 'Tanh', 'L2_weight_yyx': 3.465780536623839e-10, 'L_entropy_weight_yyx': 1.8015037404685626e-07, 'L_sep_weight_yyx': 7.554481038800045e-07, 'L_scale_weight_yyx': 4.2500453657578674e-10, 'learning_rate_yyx': 0.006916609386896689}. Best is trial 1 with value: -2.511856338115334.
[I 2026-03-18 19:15:35,354] Trial 4 finished with value: -1.9831584331135361 and parameters: {'n_layers_yyx': 1, 'hidden_size_yyx_l0': 4, 'context_size_yyx': 3, 'num_mix_components_yyx': 5, 'context_extractor_yyx': 'gru', 'activation_func_yyx': 'ReLU', 'L2_weight_yyx': 2.6550648471417584e-06, 'L_entropy_weight_yyx': 2.687189843815114e-10, 'L_sep_weight_yyx': 0.00031226490773759026, 'L_scale_weight_yyx': 2.4031609392954078e-05, 'learning_rate_yyx': 0.004712900867501283}. Best is trial 4 with value: -1.9831584331135361.
[I 2026-03-18 19:15:38,331] Trial 2 finished with value: -2.026610098993545 and parameters: {'n_layers_yyx': 1, 'hidden_size_yyx_l0': 4, 'context_size_yyx': 1, 'num_mix_components_yyx': 3, 'context_extractor_yyx': 'gru', 'activation_func_yyx': 'Tanh', 'L2_weight_yyx': 4.126934934377395e-06, 'L_entropy_weight_yyx': 2.0267756897351772e-09, 'L_sep_weight_yyx': 1.2421372698294114e-06, 'L_scale_weight_yyx': 9.193631429983555e-09, 'learning_rate_yyx': 0.001462981231598002}. Best is trial 1 with value: -2.0346981000296678.
