[I 2026-03-18 18:02:24,098] Trial 6 finished with value: -1.270142151555821 and parameters: {'n_layers_yyx': 1, 'hidden_size_yyx_l0': 5, 'context_size_yyx': 4, 'num_mix_components_yyx': 4, 'context_extractor_yyx': 'lstm', 'activation_func_yyx': 'Tanh', 'L2_weight_yyx': 5.602841468911275e-08, 'L_entropy_weight_yyx': 0.00014566407005052446, 'L_sep_weight_yyx': 2.5074268256720848e-06, 'L_scale_weight_yyx': 1.3330380090429887e-05, 'learning_rate_yyx': 0.0013047923036646845}. Best is trial 6 with value: -1.270142151555821.
[I 2026-03-18 18:02:26,136] Trial 13 pruned. 
[I 2026-03-18 18:02:32,623] Trial 9 pruned. 
[I 2026-03-18 18:02:38,671] Trial 7 pruned. 
[I 2026-03-18 18:02:46,099] Trial 12 finished with value: -2.633138790386131 and parameters: {'n_layers_yyx': 1, 'hidden_size_yyx_l0': 5, 'context_size_yyx': 4, 'num_mix_components_yyx': 3, 'context_extractor_yyx': 'lstm', 'activation_func_yyx': 'GELU', 'L2_weight_yyx': 6.175768772092683e-06, 'L_entropy_weight_yyx': 7.602885194383158e-09, 'L_sep_weight_yyx': 1.1300617761031194e-10, 'L_scale_weight_yyx': 1.9731267388961387e-05, 'learning_rate_yyx': 0.0053010823178616445}. Best is trial 12 with value: -2.633138790386131.
[I 2026-03-18 18:02:55,222] Trial 11 finished with value: -2.653526598227515 and parameters: {'n_layers_yyx': 2, 'hidden_size_yyx_l0': 2, 'hidden_size_yyx_l1': 6, 'context_size_yyx': 4, 'num_mix_components_yyx': 5, 'context_extractor_yyx': 'gru', 'activation_func_yyx': 'ReLU', 'L2_weight_yyx': 1.4072759721788022e-10, 'L_entropy_weight_yyx': 2.193955995619197e-05, 'L_sep_weight_yyx': 3.966481864134527e-06, 'L_scale_weight_yyx': 1.3639061567529108e-10, 'learning_rate_yyx': 0.009451101602575748}. Best is trial 10 with value: -2.6537577311197915.
[I 2026-03-18 18:03:02,585] Trial 4 finished with value: -1.6618624541252365 and parameters: {'n_layers_yyx': 2, 'hidden_size_yyx_l0': 6, 'hidden_size_yyx_l1': 5, 'context_size_yyx': 3, 'num_mix_components_yyx': 3, 'context_extractor_yyx': 'lstm', 'activation_func_yyx': 'GELU', 'L2_weight_yyx': 1.062341801024656e-08, 'L_entropy_weight_yyx': 1.4420186659361888e-08, 'L_sep_weight_yyx': 6.620504687278957e-07, 'L_scale_weight_yyx': 4.39636347503664e-05, 'learning_rate_yyx': 0.0026853258246745705}. Best is trial 1 with value: -1.671168294287967.
[I 2026-03-18 18:03:09,399] Trial 7 pruned. 
[I 2026-03-18 18:03:09,560] Trial 8 pruned. 
[I 2026-03-18 18:03:13,964] Trial 9 finished with value: -1.2813680547934312 and parameters: {'n_layers_yyx': 2, 'hidden_size_yyx_l0': 3, 'hidden_size_yyx_l1': 3, 'context_size_yyx': 3, 'num_mix_components_yyx': 5, 'context_extractor_yyx': 'lstm', 'activation_func_yyx': 'GELU', 'L2_weight_yyx': 3.357778815981582e-07, 'L_entropy_weight_yyx': 1.7027558076383145e-09, 'L_sep_weight_yyx': 3.4704634284953395e-10, 'L_scale_weight_yyx': 0.00015261383343425833, 'learning_rate_yyx': 0.008158622573751667}. Best is trial 8 with value: -1.3030293492170482.
[I 2026-03-18 18:03:15,249] Trial 13 pruned. 
[I 2026-03-18 18:03:24,862] Trial 5 pruned. 
[I 2026-03-18 18:03:30,605] Trial 5 finished with value: -1.2714442113851663 and parameters: {'n_layers_yyx': 2, 'hidden_size_yyx_l0': 3, 'hidden_size_yyx_l1': 3, 'context_size_yyx': 3, 'num_mix_components_yyx': 3, 'context_extractor_yyx': 'gru', 'activation_func_yyx': 'GELU', 'L2_weight_yyx': 1.4666697393754451e-05, 'L_entropy_weight_yyx': 3.5263815137093516e-05, 'L_sep_weight_yyx': 1.0544712797209596e-08, 'L_scale_weight_yyx': 0.00013103749726357762, 'learning_rate_yyx': 0.003355204144078238}. Best is trial 5 with value: -1.2714442113851663.
[I 2026-03-18 18:03:40,202] Trial 14 finished with value: -2.6415204441902964 and parameters: {'n_layers_yyx': 2, 'hidden_size_yyx_l0': 3, 'hidden_size_yyx_l1': 4, 'context_size_yyx': 1, 'num_mix_components_yyx': 5, 'context_extractor_yyx': 'lstm', 'activation_func_yyx': 'Tanh', 'L2_weight_yyx': 1.696738612344362e-05, 'L_entropy_weight_yyx': 3.0312583162173297e-06, 'L_sep_weight_yyx': 2.5462279613233508e-05, 'L_scale_weight_yyx': 3.794123116148993e-09, 'learning_rate_yyx': 0.00961362689908958}. Best is trial 14 with value: -2.6415204441902964.
[I 2026-03-18 18:03:46,016] Trial 6 pruned. 
[I 2026-03-18 18:03:54,294] Trial 9 pruned. 
[I 2026-03-18 18:03:54,900] Trial 5 pruned. 
[I 2026-03-18 18:03:54,976] Trial 10 pruned. 
[I 2026-03-18 18:04:00,793] Trial 10 finished with value: -1.7137381638152689 and parameters: {'n_layers_yyx': 2, 'hidden_size_yyx_l0': 6, 'hidden_size_yyx_l1': 6, 'context_size_yyx': 4, 'num_mix_components_yyx': 3, 'context_extractor_yyx': 'gru', 'activation_func_yyx': 'Tanh', 'L2_weight_yyx': 1.5152818787935913e-10, 'L_entropy_weight_yyx': 2.4434111003925054e-09, 'L_sep_weight_yyx': 1.3017894586725584e-07, 'L_scale_weight_yyx': 1.2360233494119863e-10, 'learning_rate_yyx': 0.009761587955087036}. Best is trial 2 with value: -1.719859356457674.
[I 2026-03-18 18:04:05,208] Trial 28 finished with value: -1.2590248897644156 and parameters: {'n_layers_yyx': 1, 'hidden_size_yyx_l0': 5, 'context_size_yyx': 2, 'num_mix_components_yyx': 2, 'context_extractor_yyx': 'lstm', 'activation_func_yyx': 'Tanh', 'L2_weight_yyx': 9.834266284294169e-09, 'L_entropy_weight_yyx': 7.419364961441081e-08, 'L_sep_weight_yyx': 0.00010034384599420744, 'L_scale_weight_yyx': 5.700641095389145e-05, 'learning_rate_yyx': 0.003845693589914422}. Best is trial 28 with value: -1.2590248897644156.
[I 2026-03-18 18:04:09,244] Trial 14 pruned. 
[I 2026-03-18 18:04:10,385] Trial 6 pruned. 
[I 2026-03-18 18:04:23,904] Trial 6 pruned. 
[I 2026-03-18 18:04:29,105] Trial 7 pruned. 
[I 2026-03-18 18:04:34,084] Trial 15 pruned. 
[I 2026-03-18 18:04:43,125] Trial 8 pruned. 
[I 2026-03-18 18:04:46,421] Trial 8 pruned. 
[I 2026-03-18 18:04:47,101] Trial 7 pruned. 
[I 2026-03-18 18:04:54,777] Trial 6 finished with value: -1.6595080635430608 and parameters: {'n_layers_yyx': 1, 'hidden_size_yyx_l0': 2, 'context_size_yyx': 2, 'num_mix_components_yyx': 2, 'context_extractor_yyx': 'lstm', 'activation_func_yyx': 'Tanh', 'L2_weight_yyx': 1.6725827910628924e-08, 'L_entropy_weight_yyx': 7.678626155934903e-09, 'L_sep_weight_yyx': 4.130926696802838e-06, 'L_scale_weight_yyx': 0.00016895486478361475, 'learning_rate_yyx': 0.00307479338788024}. Best is trial 2 with value: -1.6777834079951708.
[I 2026-03-18 18:04:59,394] Trial 16 pruned. 
[I 2026-03-18 18:05:08,390] Trial 9 pruned. 
[I 2026-03-18 18:05:17,677] Trial 12 pruned. 
[I 2026-03-18 18:05:21,348] Trial 10 finished with value: -1.6641911863707028 and parameters: {'n_layers_yyx': 2, 'hidden_size_yyx_l0': 4, 'hidden_size_yyx_l1': 6, 'context_size_yyx': 2, 'num_mix_components_yyx': 5, 'context_extractor_yyx': 'gru', 'activation_func_yyx': 'GELU', 'L2_weight_yyx': 0.0006033926210739084, 'L_entropy_weight_yyx': 4.33066402821404e-09, 'L_sep_weight_yyx': 2.25535915226579e-10, 'L_scale_weight_yyx': 3.030345436734765e-06, 'learning_rate_yyx': 0.008001201837188375}. Best is trial 0 with value: -1.66519233145544.
[I 2026-03-18 18:05:23,092] Trial 9 pruned. 
[I 2026-03-18 18:05:25,120] Trial 11 pruned. 
[I 2026-03-18 18:05:29,631] Trial 11 pruned. 
[I 2026-03-18 18:05:32,592] Trial 11 finished with value: -1.2364762988416633 and parameters: {'n_layers_yyx': 1, 'hidden_size_yyx_l0': 5, 'context_size_yyx': 4, 'num_mix_components_yyx': 1, 'context_extractor_yyx': 'lstm', 'activation_func_yyx': 'Tanh', 'L2_weight_yyx': 2.9103324840915173e-06, 'L_entropy_weight_yyx': 1.8184685019734947e-08, 'L_sep_weight_yyx': 1.2208205546478292e-07, 'L_scale_weight_yyx': 2.0968299447873465e-09, 'learning_rate_yyx': 0.009329876642528165}. Best is trial 2 with value: -1.266387742019625.
[I 2026-03-18 18:05:33,211] Trial 8 finished with value: -1.6486027454159602 and parameters: {'n_layers_yyx': 2, 'hidden_size_yyx_l0': 6, 'hidden_size_yyx_l1': 5, 'context_size_yyx': 1, 'num_mix_components_yyx': 5, 'context_extractor_yyx': 'gru', 'activation_func_yyx': 'GELU', 'L2_weight_yyx': 9.465119868327663e-08, 'L_entropy_weight_yyx': 1.523856361009284e-05, 'L_sep_weight_yyx': 1.49605744010776e-07, 'L_scale_weight_yyx': 3.756284456662148e-05, 'learning_rate_yyx': 0.007805182634414258}. Best is trial 2 with value: -1.6799626520210098.
[I 2026-03-18 18:05:39,903] Trial 7 pruned. 
[I 2026-03-18 18:05:43,360] Trial 13 pruned. 
[I 2026-03-18 18:05:43,561] Trial 7 finished with value: -1.6501351669502442 and parameters: {'n_layers_yyx': 2, 'hidden_size_yyx_l0': 3, 'hidden_size_yyx_l1': 2, 'context_size_yyx': 3, 'num_mix_components_yyx': 2, 'context_extractor_yyx': 'gru', 'activation_func_yyx': 'GELU', 'L2_weight_yyx': 2.4337821059339073e-06, 'L_entropy_weight_yyx': 0.00016216669467221766, 'L_sep_weight_yyx': 2.2411801448086334e-08, 'L_scale_weight_yyx': 5.613200315657201e-06, 'learning_rate_yyx': 0.0067499323620722924}. Best is trial 0 with value: -1.6702967433543936.
[I 2026-03-18 18:05:43,968] Trial 12 pruned. 
[I 2026-03-18 18:05:44,738] Trial 8 finished with value: -2.630995317374382 and parameters: {'n_layers_yyx': 1, 'hidden_size_yyx_l0': 6, 'context_size_yyx': 2, 'num_mix_components_yyx': 5, 'context_extractor_yyx': 'lstm', 'activation_func_yyx': 'GELU', 'L2_weight_yyx': 0.00045862031741472615, 'L_entropy_weight_yyx': 4.252047052730106e-08, 'L_sep_weight_yyx': 3.7778356973082453e-06, 'L_scale_weight_yyx': 1.8140474108961135e-05, 'learning_rate_yyx': 0.0019192703749785769}. Best is trial 0 with value: -2.633521153514828.
[I 2026-03-18 18:05:52,065] Trial 9 pruned. 
[I 2026-03-18 18:05:53,474] Trial 17 pruned. 
[I 2026-03-18 18:05:55,831] Trial 7 finished with value: -2.595128947745469 and parameters: {'n_layers_yyx': 1, 'hidden_size_yyx_l0': 6, 'context_size_yyx': 1, 'num_mix_components_yyx': 3, 'context_extractor_yyx': 'lstm', 'activation_func_yyx': 'GELU', 'L2_weight_yyx': 1.9675165935566794e-07, 'L_entropy_weight_yyx': 1.480016546333107e-10, 'L_sep_weight_yyx': 5.30960389987421e-08, 'L_scale_weight_yyx': 2.7855782698507645e-06, 'learning_rate_yyx': 0.0014708266619848783}. Best is trial 6 with value: -2.642843521506465.
[I 2026-03-18 18:06:01,582] Trial 8 pruned. 
[I 2026-03-18 18:06:02,888] Trial 8 pruned. 
[I 2026-03-18 18:06:03,007] Trial 16 finished with value: -2.602912017865376 and parameters: {'n_layers_yyx': 1, 'hidden_size_yyx_l0': 6, 'context_size_yyx': 4, 'num_mix_components_yyx': 2, 'context_extractor_yyx': 'gru', 'activation_func_yyx': 'GELU', 'L2_weight_yyx': 2.3437052868962928e-08, 'L_entropy_weight_yyx': 2.2632819995354112e-10, 'L_sep_weight_yyx': 0.00010430429807182938, 'L_scale_weight_yyx': 2.2641910238088517e-08, 'learning_rate_yyx': 0.006718287245018606}. Best is trial 12 with value: -2.6375437257353878.
[I 2026-03-18 18:06:04,789] Trial 13 pruned. 
[I 2026-03-18 18:06:08,042] Trial 14 pruned. 
[I 2026-03-18 18:06:18,539] Trial 18 pruned. 
[I 2026-03-18 18:06:20,443] Trial 9 pruned. 
[I 2026-03-18 18:06:24,990] Trial 17 pruned. 
[I 2026-03-18 18:06:26,342] Trial 8 pruned. 
[I 2026-03-18 18:06:34,869] Trial 10 finished with value: -1.6754296736951282 and parameters: {'n_layers_yyx': 1, 'hidden_size_yyx_l0': 4, 'context_size_yyx': 4, 'num_mix_components_yyx': 3, 'context_extractor_yyx': 'gru', 'activation_func_yyx': 'Tanh', 'L2_weight_yyx': 0.0005110210493737174, 'L_entropy_weight_yyx': 0.0007017356218778802, 'L_sep_weight_yyx': 0.0009770138087165118, 'L_scale_weight_yyx': 1.7256113421436806e-10, 'learning_rate_yyx': 0.009222036078921235}. Best is trial 10 with value: -1.6754296736951282.
[I 2026-03-18 18:06:38,772] Trial 10 pruned. 
[I 2026-03-18 18:06:39,352] Trial 9 pruned. 
[I 2026-03-18 18:06:44,908] Trial 10 pruned. 
[I 2026-03-18 18:06:45,547] Trial 11 finished with value: -1.7190314725079114 and parameters: {'n_layers_yyx': 2, 'hidden_size_yyx_l0': 6, 'hidden_size_yyx_l1': 6, 'context_size_yyx': 4, 'num_mix_components_yyx': 3, 'context_extractor_yyx': 'gru', 'activation_func_yyx': 'GELU', 'L2_weight_yyx': 8.2850076191798e-10, 'L_entropy_weight_yyx': 8.834612112259597e-09, 'L_sep_weight_yyx': 0.0003895017034123639, 'L_scale_weight_yyx': 3.823396589831972e-09, 'learning_rate_yyx': 0.007106965049796318}. Best is trial 2 with value: -1.719859356457674.
[I 2026-03-18 18:06:46,828] Trial 9 finished with value: -1.6671910822907816 and parameters: {'n_layers_yyx': 1, 'hidden_size_yyx_l0': 2, 'context_size_yyx': 3, 'num_mix_components_yyx': 4, 'context_extractor_yyx': 'lstm', 'activation_func_yyx': 'GELU', 'L2_weight_yyx': 2.344406393368755e-09, 'L_entropy_weight_yyx': 6.367354621035998e-07, 'L_sep_weight_yyx': 2.6656893636092263e-08, 'L_scale_weight_yyx': 1.693527269993367e-10, 'learning_rate_yyx': 0.0028256323887356086}. Best is trial 9 with value: -1.6671910822907816.
[I 2026-03-18 18:06:53,174] Trial 12 pruned. 
[I 2026-03-18 18:07:01,063] Trial 11 pruned. 
[I 2026-03-18 18:07:01,982] Trial 19 pruned. 
[I 2026-03-18 18:07:02,652] Trial 9 pruned. 
[I 2026-03-18 18:07:13,762] Trial 11 pruned. 
[I 2026-03-18 18:07:20,755] Trial 10 pruned. 
[I 2026-03-18 18:07:22,331] Trial 9 finished with value: -1.6581350460548143 and parameters: {'n_layers_yyx': 2, 'hidden_size_yyx_l0': 2, 'hidden_size_yyx_l1': 6, 'context_size_yyx': 2, 'num_mix_components_yyx': 1, 'context_extractor_yyx': 'gru', 'activation_func_yyx': 'ReLU', 'L2_weight_yyx': 2.2714714326143227e-08, 'L_entropy_weight_yyx': 2.2080847186303686e-07, 'L_sep_weight_yyx': 6.386428193553247e-09, 'L_scale_weight_yyx': 2.1744440464955684e-05, 'learning_rate_yyx': 0.0035374519904540075}. Best is trial 0 with value: -1.6746319320135328.
[I 2026-03-18 18:07:35,293] Trial 7 finished with value: -1.655484379427839 and parameters: {'n_layers_yyx': 1, 'hidden_size_yyx_l0': 2, 'context_size_yyx': 3, 'num_mix_components_yyx': 5, 'context_extractor_yyx': 'lstm', 'activation_func_yyx': 'ReLU', 'L2_weight_yyx': 0.0001786433374356686, 'L_entropy_weight_yyx': 4.607346945787446e-10, 'L_sep_weight_yyx': 1.2679235307927596e-07, 'L_scale_weight_yyx': 0.00016053088355169026, 'learning_rate_yyx': 0.00872856118609498}. Best is trial 2 with value: -1.6720916355195472.
[I 2026-03-18 18:07:37,175] Trial 15 finished with value: -2.6258526228839867 and parameters: {'n_layers_yyx': 2, 'hidden_size_yyx_l0': 4, 'hidden_size_yyx_l1': 2, 'context_size_yyx': 1, 'num_mix_components_yyx': 2, 'context_extractor_yyx': 'gru', 'activation_func_yyx': 'Tanh', 'L2_weight_yyx': 1.2654734112088946e-08, 'L_entropy_weight_yyx': 6.71442482001621e-05, 'L_sep_weight_yyx': 6.225718149144814e-10, 'L_scale_weight_yyx': 5.143372138654469e-07, 'learning_rate_yyx': 0.002982216939671407}. Best is trial 0 with value: -2.6330643191486622.
[I 2026-03-18 18:07:39,318] Trial 14 pruned. 
[I 2026-03-18 18:07:48,055] Trial 12 pruned. 
[I 2026-03-18 18:07:48,055] Trial 12 pruned. 
[I 2026-03-18 18:07:56,762] Trial 14 finished with value: -1.6715868333994597 and parameters: {'n_layers_yyx': 2, 'hidden_size_yyx_l0': 4, 'hidden_size_yyx_l1': 5, 'context_size_yyx': 3, 'num_mix_components_yyx': 4, 'context_extractor_yyx': 'gru', 'activation_func_yyx': 'Tanh', 'L2_weight_yyx': 1.4886115183268378e-07, 'L_entropy_weight_yyx': 2.2924712250726184e-05, 'L_sep_weight_yyx': 2.0190394264602168e-08, 'L_scale_weight_yyx': 5.004959198619234e-10, 'learning_rate_yyx': 0.0023158275432034886}. Best is trial 14 with value: -1.6715868333994597.
[I 2026-03-18 18:08:02,211] Trial 10 finished with value: -1.260685587546301 and parameters: {'n_layers_yyx': 2, 'hidden_size_yyx_l0': 6, 'hidden_size_yyx_l1': 6, 'context_size_yyx': 3, 'num_mix_components_yyx': 5, 'context_extractor_yyx': 'lstm', 'activation_func_yyx': 'ReLU', 'L2_weight_yyx': 2.8683140874033897e-08, 'L_entropy_weight_yyx': 1.2915440867578195e-05, 'L_sep_weight_yyx': 3.279235698073604e-10, 'L_scale_weight_yyx': 1.9021510637808846e-07, 'learning_rate_yyx': 0.0085351249599427}. Best is trial 5 with value: -1.2714442113851663.
[I 2026-03-18 18:08:13,604] Trial 8 pruned. 
[I 2026-03-18 18:08:23,592] Trial 11 finished with value: -2.635494617718387 and parameters: {'n_layers_yyx': 2, 'hidden_size_yyx_l0': 2, 'hidden_size_yyx_l1': 4, 'context_size_yyx': 3, 'num_mix_components_yyx': 4, 'context_extractor_yyx': 'lstm', 'activation_func_yyx': 'GELU', 'L2_weight_yyx': 4.095074057349298e-06, 'L_entropy_weight_yyx': 0.0006350176732625916, 'L_sep_weight_yyx': 1.6363955390822254e-09, 'L_scale_weight_yyx': 1.2404056955333718e-10, 'learning_rate_yyx': 0.000589249983399354}. Best is trial 11 with value: -2.635494617718387.
[I 2026-03-18 18:08:31,225] Trial 10 finished with value: -1.6604440144926107 and parameters: {'n_layers_yyx': 2, 'hidden_size_yyx_l0': 4, 'hidden_size_yyx_l1': 6, 'context_size_yyx': 1, 'num_mix_components_yyx': 4, 'context_extractor_yyx': 'gru', 'activation_func_yyx': 'ReLU', 'L2_weight_yyx': 0.000967069615303107, 'L_entropy_weight_yyx': 4.604369818650958e-05, 'L_sep_weight_yyx': 1.0828561558777591e-10, 'L_scale_weight_yyx': 5.8752665733204464e-08, 'learning_rate_yyx': 0.008485792146258124}. Best is trial 7 with value: -1.6637274000173419.
[I 2026-03-18 18:08:31,229] Trial 15 pruned. 
[I 2026-03-18 18:08:37,026] Trial 10 pruned. 
[I 2026-03-18 18:08:39,656] Trial 11 pruned. 
[I 2026-03-18 18:08:41,444] Trial 15 finished with value: -2.6409888730131477 and parameters: {'n_layers_yyx': 2, 'hidden_size_yyx_l0': 4, 'hidden_size_yyx_l1': 5, 'context_size_yyx': 1, 'num_mix_components_yyx': 5, 'context_extractor_yyx': 'lstm', 'activation_func_yyx': 'Tanh', 'L2_weight_yyx': 1.342691805254812e-05, 'L_entropy_weight_yyx': 1.4743520556543783e-08, 'L_sep_weight_yyx': 5.0205138932317146e-05, 'L_scale_weight_yyx': 2.6129749020858867e-09, 'learning_rate_yyx': 0.009695275754893894}. Best is trial 14 with value: -2.6415204441902964.
[I 2026-03-18 18:08:45,975] Trial 15 pruned. 
[I 2026-03-18 18:08:46,362] Trial 13 pruned. 
[I 2026-03-18 18:08:52,456] Trial 12 pruned. 
[I 2026-03-18 18:08:55,585] Trial 12 finished with value: -1.2623623554523176 and parameters: {'n_layers_yyx': 2, 'hidden_size_yyx_l0': 5, 'hidden_size_yyx_l1': 5, 'context_size_yyx': 4, 'num_mix_components_yyx': 1, 'context_extractor_yyx': 'lstm', 'activation_func_yyx': 'Tanh', 'L2_weight_yyx': 1.7118744451664605e-05, 'L_entropy_weight_yyx': 6.869026016946154e-09, 'L_sep_weight_yyx': 1.6866202710635627e-06, 'L_scale_weight_yyx': 3.2728506146566617e-06, 'learning_rate_yyx': 0.004953334968540671}. Best is trial 8 with value: -1.3030293492170482.
[I 2026-03-18 18:08:57,062] Trial 16 pruned. 
[I 2026-03-18 18:09:02,970] Trial 12 pruned. 
[I 2026-03-18 18:09:03,191] Trial 11 finished with value: -1.6659153643654905 and parameters: {'n_layers_yyx': 2, 'hidden_size_yyx_l0': 4, 'hidden_size_yyx_l1': 6, 'context_size_yyx': 2, 'num_mix_components_yyx': 5, 'context_extractor_yyx': 'gru', 'activation_func_yyx': 'GELU', 'L2_weight_yyx': 0.0008596656854307541, 'L_entropy_weight_yyx': 1.257475715372692e-09, 'L_sep_weight_yyx': 5.274427175933252e-10, 'L_scale_weight_yyx': 2.9123550325677113e-06, 'learning_rate_yyx': 0.009658325716692763}. Best is trial 11 with value: -1.6659153643654905.
[I 2026-03-18 18:09:03,222] Trial 16 pruned. 
[I 2026-03-18 18:09:05,361] Trial 12 finished with value: -1.2432301745176757 and parameters: {'n_layers_yyx': 2, 'hidden_size_yyx_l0': 4, 'hidden_size_yyx_l1': 6, 'context_size_yyx': 2, 'num_mix_components_yyx': 1, 'context_extractor_yyx': 'gru', 'activation_func_yyx': 'Tanh', 'L2_weight_yyx': 1.0558933959028868e-07, 'L_entropy_weight_yyx': 3.1013310001160364e-06, 'L_sep_weight_yyx': 2.660697791582774e-08, 'L_scale_weight_yyx': 1.117619219007847e-08, 'learning_rate_yyx': 0.0028779289765148513}. Best is trial 3 with value: -1.2710647653519778.
[I 2026-03-18 18:09:07,858] Trial 16 pruned. 
[I 2026-03-18 18:09:08,003] Trial 14 pruned. 
[I 2026-03-18 18:09:08,079] Trial 8 finished with value: -2.602214998993677 and parameters: {'n_layers_yyx': 1, 'hidden_size_yyx_l0': 6, 'context_size_yyx': 3, 'num_mix_components_yyx': 4, 'context_extractor_yyx': 'lstm', 'activation_func_yyx': 'Tanh', 'L2_weight_yyx': 1.304970430861363e-10, 'L_entropy_weight_yyx': 2.1399546113567928e-06, 'L_sep_weight_yyx': 3.2611142606216036e-10, 'L_scale_weight_yyx': 2.3359758444542268e-08, 'learning_rate_yyx': 0.005851056779273223}. Best is trial 6 with value: -2.642843521506465.
[I 2026-03-18 18:09:10,446] Trial 16 pruned. 
[I 2026-03-18 18:09:19,328] Trial 17 pruned. 
[I 2026-03-18 18:09:19,329] Trial 17 pruned. 
[I 2026-03-18 18:09:21,691] Trial 12 pruned. 
[I 2026-03-18 18:09:27,109] Trial 17 pruned. 
[I 2026-03-18 18:09:32,353] Trial 13 pruned. 
[I 2026-03-18 18:09:32,890] Trial 9 pruned. 
[I 2026-03-18 18:09:34,063] Trial 13 pruned. 
[I 2026-03-18 18:09:38,002] Trial 17 pruned. 
[I 2026-03-18 18:09:39,054] Trial 18 finished with value: -2.5979153548243508 and parameters: {'n_layers_yyx': 2, 'hidden_size_yyx_l0': 2, 'hidden_size_yyx_l1': 3, 'context_size_yyx': 2, 'num_mix_components_yyx': 1, 'context_extractor_yyx': 'gru', 'activation_func_yyx': 'GELU', 'L2_weight_yyx': 2.464654816600151e-09, 'L_entropy_weight_yyx': 1.5765875523481766e-05, 'L_sep_weight_yyx': 1.2268046069125013e-07, 'L_scale_weight_yyx': 1.055895324795315e-10, 'learning_rate_yyx': 0.007586827624524667}. Best is trial 12 with value: -2.6375437257353878.
[I 2026-03-18 18:09:52,389] Trial 18 pruned. 
[I 2026-03-18 18:10:00,668] Trial 10 finished with value: -2.640669339569724 and parameters: {'n_layers_yyx': 1, 'hidden_size_yyx_l0': 4, 'context_size_yyx': 1, 'num_mix_components_yyx': 5, 'context_extractor_yyx': 'gru', 'activation_func_yyx': 'Tanh', 'L2_weight_yyx': 5.053960162306289e-05, 'L_entropy_weight_yyx': 1.0967604435536654e-08, 'L_sep_weight_yyx': 8.931050022426821e-08, 'L_scale_weight_yyx': 2.554334715861821e-10, 'learning_rate_yyx': 0.009464563037000214}. Best is trial 10 with value: -2.640669339569724.
