[I 2026-03-18 18:55:31,056] Trial 49 pruned. 

Source events: 10683
Target events: 13628
Full model ln_yyx : 460.11048 nats/sec, 30.38593 nats/event
Full model Log loss : -1.65454
Full model ln_yyx : 464.57431 nats/sec, 30.68072 nats/event
Full model Log loss : -1.65270
Full model ln_yyx : 469.67821 nats/sec, 31.01779 nats/event
Full model Log loss : -1.67996
Full model ln_yyx : 448.28554 nats/sec, 29.60500 nats/event
Full model Log loss : -1.58225
Full model ln_yyx : 456.89245 nats/sec, 30.17341 nats/event
Full model Log loss : -1.64860
Full model ln_yyx : 463.31757 nats/sec, 30.59773 nats/event
Full model Log loss : -1.66032
Full model ln_yyx : 463.06200 nats/sec, 30.58085 nats/event
Full model Log loss : -1.66726
Full model ln_yyx : 461.34257 nats/sec, 30.46730 nats/event
Full model Log loss : -1.66306
Full model ln_yyx : 457.76468 nats/sec, 30.23101 nats/event
Full model Log loss : -1.66377
Full model ln_yyx : 464.58762 nats/sec, 30.68160 nats/event
Full model Log loss : -1.66399
Full model ln_yyx : 468.56866 nats/sec, 30.94451 nats/event
Full model Log loss : -1.67020
Full model ln_yyx : 460.37042 nats/sec, 30.40309 nats/event
Full model Log loss : -1.65928
Full model ln_yyx : 462.11835 nats/sec, 30.51853 nats/event
Full model Log loss : -1.66439
Full model ln_yyx : 456.42953 nats/sec, 30.14284 nats/event
Full model Log loss : -1.66195
Optimization finished. Config saved to results/opt-full/opt_full_112_best_config.txt
[I 2026-03-18 18:55:31,835] Trial 39 pruned. 
[I 2026-03-18 18:55:31,945] Trial 41 finished with value: -2.6374896568132953 and parameters: {'n_layers_yyx': 1, 'hidden_size_yyx_l0': 4, 'context_size_yyx': 3, 'num_mix_components_yyx': 5, 'context_extractor_yyx': 'lstm', 'activation_func_yyx': 'GELU', 'L2_weight_yyx': 7.972998571803921e-08, 'L_entropy_weight_yyx': 8.706023716108408e-10, 'L_sep_weight_yyx': 1.648607148689176e-06, 'L_scale_weight_yyx': 9.86929943737998e-06, 'learning_rate_yyx': 0.009127591868728639}. Best is trial 6 with value: -2.642843521506465.
[I 2026-03-18 18:55:34,264] Trial 40 pruned. 
[I 2026-03-18 18:55:38,970] Trial 49 pruned. 

Source events: 32635
Target events: 40082
Full model ln_yyx : 5649.54247 nats/sec, 126.85465 nats/event
Full model Log loss : -2.60060
Full model ln_yyx : 5634.91553 nats/sec, 126.52622 nats/event
Full model Log loss : -2.60614
Full model ln_yyx : 5693.99956 nats/sec, 127.85289 nats/event
Full model Log loss : -2.63674
Full model ln_yyx : 5654.26344 nats/sec, 126.96066 nats/event
Full model Log loss : -2.60038
Full model ln_yyx : 5642.63982 nats/sec, 126.69966 nats/event
Full model Log loss : -2.60034
Full model ln_yyx : 5730.26104 nats/sec, 128.66711 nats/event
Full model Log loss : -2.63754
Full model ln_yyx : 5684.31710 nats/sec, 127.63548 nats/event
Full model Log loss : -2.60291
Full model ln_yyx : 5655.54329 nats/sec, 126.98940 nats/event
Full model Log loss : -2.59792
Full model ln_yyx : 5639.17684 nats/sec, 126.62190 nats/event
Full model Log loss : -2.59998
Full model ln_yyx : 5686.04058 nats/sec, 127.67418 nats/event
Full model Log loss : -2.60270
Full model ln_yyx : 5684.37541 nats/sec, 127.63679 nats/event
Full model Log loss : -2.60271
Full model ln_yyx : 5726.40011 nats/sec, 128.58041 nats/event
Full model Log loss : -2.63220
Full model ln_yyx : 5647.64650 nats/sec, 126.81208 nats/event
Full model Log loss : -2.59990
Full model ln_yyx : 5708.13721 nats/sec, 128.17034 nats/event
Full model Log loss : -2.63129
Full model ln_yyx : 5731.64974 nats/sec, 128.69829 nats/event
Full model Log loss : -2.63895
Full model ln_yyx : 5713.20462 nats/sec, 128.28412 nats/event
Full model Log loss : -2.63063
Full model ln_yyx : 5698.16321 nats/sec, 127.94638 nats/event
Full model Log loss : -2.62991
Optimization finished. Config saved to results/opt-full/opt_full_124_best_config.txt
[I 2026-03-18 18:55:44,743] Trial 47 finished with value: -2.64574760254923 and parameters: {'n_layers_yyx': 2, 'hidden_size_yyx_l0': 2, 'hidden_size_yyx_l1': 6, 'context_size_yyx': 4, 'num_mix_components_yyx': 5, 'context_extractor_yyx': 'lstm', 'activation_func_yyx': 'ReLU', 'L2_weight_yyx': 5.15538149059083e-10, 'L_entropy_weight_yyx': 4.132394533916029e-06, 'L_sep_weight_yyx': 5.356395524949791e-06, 'L_scale_weight_yyx': 1.675891062038553e-10, 'learning_rate_yyx': 0.009963383163066929}. Best is trial 10 with value: -2.6537577311197915.
[I 2026-03-18 18:55:46,286] Trial 42 pruned. 
[I 2026-03-18 18:55:50,423] Trial 48 pruned. 
[I 2026-03-18 18:55:51,608] Trial 45 finished with value: -1.6704744920923345 and parameters: {'n_layers_yyx': 2, 'hidden_size_yyx_l0': 6, 'hidden_size_yyx_l1': 4, 'context_size_yyx': 4, 'num_mix_components_yyx': 3, 'context_extractor_yyx': 'gru', 'activation_func_yyx': 'Tanh', 'L2_weight_yyx': 1.820513976941824e-05, 'L_entropy_weight_yyx': 1.2117823200318872e-06, 'L_sep_weight_yyx': 4.5919740680144e-09, 'L_scale_weight_yyx': 5.2649728133600245e-05, 'learning_rate_yyx': 0.009920862426265387}. Best is trial 42 with value: -1.6728958702638128.
[I 2026-03-18 18:55:53,681] Trial 46 finished with value: -1.6585887251735536 and parameters: {'n_layers_yyx': 2, 'hidden_size_yyx_l0': 4, 'hidden_size_yyx_l1': 6, 'context_size_yyx': 3, 'num_mix_components_yyx': 3, 'context_extractor_yyx': 'gru', 'activation_func_yyx': 'Tanh', 'L2_weight_yyx': 1.060632807785244e-09, 'L_entropy_weight_yyx': 3.636350217675721e-10, 'L_sep_weight_yyx': 2.2941902622484666e-06, 'L_scale_weight_yyx': 2.22254089636318e-05, 'learning_rate_yyx': 0.004141797428451486}. Best is trial 23 with value: -1.675936991716372.
[I 2026-03-18 18:55:56,730] Trial 47 pruned. 
[I 2026-03-18 18:55:57,673] Trial 46 finished with value: -1.674180764206564 and parameters: {'n_layers_yyx': 2, 'hidden_size_yyx_l0': 4, 'hidden_size_yyx_l1': 6, 'context_size_yyx': 4, 'num_mix_components_yyx': 3, 'context_extractor_yyx': 'lstm', 'activation_func_yyx': 'ReLU', 'L2_weight_yyx': 2.082934357316761e-10, 'L_entropy_weight_yyx': 0.00017412675260605872, 'L_sep_weight_yyx': 8.205351862506134e-10, 'L_scale_weight_yyx': 4.0068381657269215e-09, 'learning_rate_yyx': 0.009989558393123777}. Best is trial 41 with value: -1.6811530321578319.
[I 2026-03-18 18:55:59,214] Trial 48 pruned. 
[I 2026-03-18 18:55:59,227] Trial 43 pruned. 
[I 2026-03-18 18:56:01,765] Trial 28 pruned. 
[I 2026-03-18 18:56:04,272] Trial 49 pruned. 

Source events: 32635
Target events: 3403
Full model ln_yyx : 477.48999 nats/sec, 126.28298 nats/event
Full model Log loss : -2.61272
Full model ln_yyx : 480.93659 nats/sec, 127.19451 nats/event
Full model Log loss : -2.63885
Full model ln_yyx : 482.91044 nats/sec, 127.71654 nats/event
Full model Log loss : -2.64488
Full model ln_yyx : 480.01306 nats/sec, 126.95027 nats/event
Full model Log loss : -2.61714
Full model ln_yyx : 485.04641 nats/sec, 128.28145 nats/event
Full model Log loss : -2.64772
Full model ln_yyx : 486.27414 nats/sec, 128.60615 nats/event
Full model Log loss : -2.65376
Full model ln_yyx : 488.72475 nats/sec, 129.25427 nats/event
Full model Log loss : -2.65353
Full model ln_yyx : 484.60997 nats/sec, 128.16602 nats/event
Full model Log loss : -2.64367
Full model ln_yyx : 486.71702 nats/sec, 128.72328 nats/event
Full model Log loss : -2.64634
Full model ln_yyx : 488.56217 nats/sec, 129.21127 nats/event
Full model Log loss : -2.65270
Full model ln_yyx : 481.87910 nats/sec, 127.44378 nats/event
Full model Log loss : -2.61322
Full model ln_yyx : 487.17122 nats/sec, 128.84340 nats/event
Full model Log loss : -2.65128
Full model ln_yyx : 482.41628 nats/sec, 127.58585 nats/event
Full model Log loss : -2.61422
Full model ln_yyx : 487.43345 nats/sec, 128.91276 nats/event
Full model Log loss : -2.65054
Full model ln_yyx : 488.47174 nats/sec, 129.18735 nats/event
Full model Log loss : -2.65310
Full model ln_yyx : 487.12125 nats/sec, 128.83019 nats/event
Full model Log loss : -2.64915
Full model ln_yyx : 485.72251 nats/sec, 128.46026 nats/event
Full model Log loss : -2.64295
Full model ln_yyx : 480.10513 nats/sec, 126.97462 nats/event
Full model Log loss : -2.61546
Full model ln_yyx : 487.06707 nats/sec, 128.81586 nats/event
Full model Log loss : -2.65041
Full model ln_yyx : 487.37439 nats/sec, 128.89714 nats/event
Full model Log loss : -2.65112
Full model ln_yyx : 487.54043 nats/sec, 128.94105 nats/event
Full model Log loss : -2.64575
Optimization finished. Config saved to results/opt-full/opt_full_122_best_config.txt
[I 2026-03-18 18:56:04,676] Trial 29 pruned. 
[I 2026-03-18 18:56:05,650] Trial 41 finished with value: -1.6618984394973007 and parameters: {'n_layers_yyx': 1, 'hidden_size_yyx_l0': 6, 'context_size_yyx': 3, 'num_mix_components_yyx': 5, 'context_extractor_yyx': 'lstm', 'activation_func_yyx': 'Tanh', 'L2_weight_yyx': 5.225159759515608e-08, 'L_entropy_weight_yyx': 0.00041926590979146704, 'L_sep_weight_yyx': 0.00038183341456879925, 'L_scale_weight_yyx': 2.5350726153060092e-05, 'learning_rate_yyx': 0.007962064606815086}. Best is trial 26 with value: -1.6790522813108588.
[I 2026-03-18 18:56:06,427] Trial 49 pruned. 

Source events: 10683
Target events: 18269
Full model ln_yyx : 598.78023 nats/sec, 29.49818 nats/event
Full model Log loss : -1.58234
Full model ln_yyx : 617.62099 nats/sec, 30.42634 nats/event
Full model Log loss : -1.67209
Full model ln_yyx : 600.72325 nats/sec, 29.59390 nats/event
Full model Log loss : -1.58365
Full model ln_yyx : 614.85917 nats/sec, 30.29029 nats/event
Full model Log loss : -1.65548
Full model ln_yyx : 617.52698 nats/sec, 30.42171 nats/event
Full model Log loss : -1.66914
Full model ln_yyx : 614.35390 nats/sec, 30.26540 nats/event
Full model Log loss : -1.66571
Full model ln_yyx : 619.07451 nats/sec, 30.49795 nats/event
Full model Log loss : -1.66111
Full model ln_yyx : 626.41183 nats/sec, 30.85941 nats/event
Full model Log loss : -1.67594
Full model ln_yyx : 610.17451 nats/sec, 30.05950 nats/event
Full model Log loss : -1.65142
Full model ln_yyx : 619.33665 nats/sec, 30.51086 nats/event
Full model Log loss : -1.66726
Full model ln_yyx : 620.36486 nats/sec, 30.56152 nats/event
Full model Log loss : -1.65557
Full model ln_yyx : 606.99346 nats/sec, 29.90279 nats/event
Full model Log loss : -1.65435
Full model ln_yyx : 620.51154 nats/sec, 30.56874 nats/event
Full model Log loss : -1.67166
Full model ln_yyx : 600.36610 nats/sec, 29.57630 nats/event
Full model Log loss : -1.58099
Full model ln_yyx : 614.70436 nats/sec, 30.28266 nats/event
Full model Log loss : -1.66307
Full model ln_yyx : 624.57596 nats/sec, 30.76897 nats/event
Full model Log loss : -1.65859
Optimization finished. Config saved to results/opt-full/opt_full_111_best_config.txt
[I 2026-03-18 18:56:07,371] Trial 30 pruned. 
[I 2026-03-18 18:56:23,496] Trial 44 finished with value: -1.673134731259681 and parameters: {'n_layers_yyx': 2, 'hidden_size_yyx_l0': 6, 'hidden_size_yyx_l1': 4, 'context_size_yyx': 4, 'num_mix_components_yyx': 1, 'context_extractor_yyx': 'gru', 'activation_func_yyx': 'Tanh', 'L2_weight_yyx': 5.21508155245743e-06, 'L_entropy_weight_yyx': 1.8810013801681245e-05, 'L_sep_weight_yyx': 6.144673832345058e-07, 'L_scale_weight_yyx': 1.5749608869262284e-07, 'learning_rate_yyx': 0.009420654418110878}. Best is trial 29 with value: -1.6833607836109268.
[I 2026-03-18 18:56:23,536] Trial 31 pruned. 
[I 2026-03-18 18:56:25,363] Trial 46 finished with value: -1.6647173153654213 and parameters: {'n_layers_yyx': 2, 'hidden_size_yyx_l0': 6, 'hidden_size_yyx_l1': 4, 'context_size_yyx': 4, 'num_mix_components_yyx': 2, 'context_extractor_yyx': 'gru', 'activation_func_yyx': 'Tanh', 'L2_weight_yyx': 2.4421943970359835e-05, 'L_entropy_weight_yyx': 6.235196048124376e-08, 'L_sep_weight_yyx': 2.338013347137348e-09, 'L_scale_weight_yyx': 4.520647616678549e-05, 'learning_rate_yyx': 0.009969557831289647}. Best is trial 42 with value: -1.6728958702638128.
[I 2026-03-18 18:56:26,107] Trial 45 pruned. 
[I 2026-03-18 18:56:35,827] Trial 42 finished with value: -1.678768793129944 and parameters: {'n_layers_yyx': 1, 'hidden_size_yyx_l0': 6, 'context_size_yyx': 4, 'num_mix_components_yyx': 5, 'context_extractor_yyx': 'lstm', 'activation_func_yyx': 'Tanh', 'L2_weight_yyx': 1.3982348496327425e-08, 'L_entropy_weight_yyx': 0.0008849923592873939, 'L_sep_weight_yyx': 2.79310493027175e-05, 'L_scale_weight_yyx': 0.00010358158998088066, 'learning_rate_yyx': 0.007166558332574503}. Best is trial 26 with value: -1.6790522813108588.
[I 2026-03-18 18:56:38,445] Trial 43 pruned. 
[I 2026-03-18 18:56:39,686] Trial 32 pruned. 
[I 2026-03-18 18:56:39,859] Trial 47 finished with value: -1.677968887094125 and parameters: {'n_layers_yyx': 2, 'hidden_size_yyx_l0': 6, 'hidden_size_yyx_l1': 4, 'context_size_yyx': 4, 'num_mix_components_yyx': 4, 'context_extractor_yyx': 'lstm', 'activation_func_yyx': 'Tanh', 'L2_weight_yyx': 1.08565613071598e-10, 'L_entropy_weight_yyx': 6.934897085563245e-05, 'L_sep_weight_yyx': 2.5571439914108653e-05, 'L_scale_weight_yyx': 1.2241771132296898e-08, 'learning_rate_yyx': 0.008395936730407215}. Best is trial 41 with value: -1.6811530321578319.
[I 2026-03-18 18:56:42,141] Trial 33 pruned. 
[I 2026-03-18 18:56:46,643] Trial 44 pruned. 
[I 2026-03-18 18:56:46,829] Trial 32 finished with value: -2.6352566270135185 and parameters: {'n_layers_yyx': 1, 'hidden_size_yyx_l0': 4, 'context_size_yyx': 3, 'num_mix_components_yyx': 5, 'context_extractor_yyx': 'gru', 'activation_func_yyx': 'Tanh', 'L2_weight_yyx': 0.0002231163687659952, 'L_entropy_weight_yyx': 7.389508723572107e-05, 'L_sep_weight_yyx': 3.957802149888151e-08, 'L_scale_weight_yyx': 7.93149732479627e-09, 'learning_rate_yyx': 0.00829560443712423}. Best is trial 21 with value: -2.6405605351488926.
[I 2026-03-18 18:56:47,981] Trial 34 pruned. 
[I 2026-03-18 18:56:49,337] Trial 47 finished with value: -2.6423312235575036 and parameters: {'n_layers_yyx': 2, 'hidden_size_yyx_l0': 2, 'hidden_size_yyx_l1': 5, 'context_size_yyx': 3, 'num_mix_components_yyx': 5, 'context_extractor_yyx': 'gru', 'activation_func_yyx': 'Tanh', 'L2_weight_yyx': 1.24727718497011e-10, 'L_entropy_weight_yyx': 3.3063879749932705e-08, 'L_sep_weight_yyx': 0.0007249242139549273, 'L_scale_weight_yyx': 4.612719396457091e-10, 'learning_rate_yyx': 0.007800595387459472}. Best is trial 46 with value: -2.64244432121314.
[I 2026-03-18 18:56:52,974] Trial 45 pruned. 
[I 2026-03-18 18:56:54,055] Trial 35 pruned. 
[I 2026-03-18 18:56:56,785] Trial 36 pruned. 
[I 2026-03-18 18:56:59,189] Trial 46 pruned. 
[I 2026-03-18 18:57:00,229] Trial 47 finished with value: -1.6620724772580893 and parameters: {'n_layers_yyx': 2, 'hidden_size_yyx_l0': 6, 'hidden_size_yyx_l1': 4, 'context_size_yyx': 4, 'num_mix_components_yyx': 3, 'context_extractor_yyx': 'gru', 'activation_func_yyx': 'ReLU', 'L2_weight_yyx': 5.449413517667036e-05, 'L_entropy_weight_yyx': 1.5284407959540982e-08, 'L_sep_weight_yyx': 3.688866704745293e-08, 'L_scale_weight_yyx': 1.845906309695084e-05, 'learning_rate_yyx': 0.008087822642317263}. Best is trial 42 with value: -1.6728958702638128.
[I 2026-03-18 18:57:01,337] Trial 33 pruned. 
[I 2026-03-18 18:57:02,047] Trial 46 finished with value: -1.5900619862972256 and parameters: {'n_layers_yyx': 2, 'hidden_size_yyx_l0': 3, 'hidden_size_yyx_l1': 2, 'context_size_yyx': 4, 'num_mix_components_yyx': 1, 'context_extractor_yyx': 'gru', 'activation_func_yyx': 'ReLU', 'L2_weight_yyx': 1.937291366057987e-09, 'L_entropy_weight_yyx': 4.56895922691184e-05, 'L_sep_weight_yyx': 1.6185675285782158e-06, 'L_scale_weight_yyx': 8.518023227203447e-08, 'learning_rate_yyx': 0.008338895620511775}. Best is trial 29 with value: -1.6833607836109268.
[I 2026-03-18 18:57:02,075] Trial 40 finished with value: -2.643809374218382 and parameters: {'n_layers_yyx': 1, 'hidden_size_yyx_l0': 5, 'context_size_yyx': 3, 'num_mix_components_yyx': 5, 'context_extractor_yyx': 'lstm', 'activation_func_yyx': 'Tanh', 'L2_weight_yyx': 0.0003640528804609064, 'L_entropy_weight_yyx': 1.692725280577572e-05, 'L_sep_weight_yyx': 5.174738041377676e-09, 'L_scale_weight_yyx': 2.0436649603365067e-08, 'learning_rate_yyx': 0.006612633906529768}. Best is trial 40 with value: -2.643809374218382.
[I 2026-03-18 18:57:06,150] Trial 48 finished with value: -1.6638646681109108 and parameters: {'n_layers_yyx': 2, 'hidden_size_yyx_l0': 6, 'hidden_size_yyx_l1': 4, 'context_size_yyx': 4, 'num_mix_components_yyx': 5, 'context_extractor_yyx': 'lstm', 'activation_func_yyx': 'Tanh', 'L2_weight_yyx': 1.0899625037563474e-10, 'L_entropy_weight_yyx': 4.776223937422457e-05, 'L_sep_weight_yyx': 3.475823959030408e-05, 'L_scale_weight_yyx': 9.622194188268118e-09, 'learning_rate_yyx': 0.008669459614803863}. Best is trial 41 with value: -1.6811530321578319.
[I 2026-03-18 18:57:07,321] Trial 34 pruned. 
[I 2026-03-18 18:57:12,516] Trial 37 pruned. 
[I 2026-03-18 18:57:13,010] Trial 44 finished with value: -1.6696226158545955 and parameters: {'n_layers_yyx': 1, 'hidden_size_yyx_l0': 6, 'context_size_yyx': 4, 'num_mix_components_yyx': 4, 'context_extractor_yyx': 'gru', 'activation_func_yyx': 'Tanh', 'L2_weight_yyx': 1.11982007739091e-08, 'L_entropy_weight_yyx': 1.6530807640403634e-05, 'L_sep_weight_yyx': 3.126034715052931e-05, 'L_scale_weight_yyx': 0.0005076711291464557, 'learning_rate_yyx': 0.0065106544384420754}. Best is trial 26 with value: -1.6790522813108588.
[I 2026-03-18 18:57:15,445] Trial 38 pruned. 
[I 2026-03-18 18:57:17,392] Trial 48 pruned. 
[I 2026-03-18 18:57:18,041] Trial 39 pruned. 
[I 2026-03-18 18:57:21,372] Trial 35 pruned. 
[I 2026-03-18 18:57:23,685] Trial 49 pruned. 

Source events: 10683
Target events: 29032
Full model ln_yyx : 987.37313 nats/sec, 30.60884 nats/event
Full model Log loss : -1.66832
Full model ln_yyx : 978.27136 nats/sec, 30.32668 nats/event
Full model Log loss : -1.64546
Full model ln_yyx : 955.10452 nats/sec, 29.60850 nats/event
Full model Log loss : -1.57353
Full model ln_yyx : 976.38845 nats/sec, 30.26831 nats/event
Full model Log loss : -1.66132
Full model ln_yyx : 963.13182 nats/sec, 29.85735 nats/event
Full model Log loss : -1.62912
Full model ln_yyx : 978.45104 nats/sec, 30.33225 nats/event
Full model Log loss : -1.65934
Full model ln_yyx : 984.13467 nats/sec, 30.50845 nats/event
Full model Log loss : -1.65607
Full model ln_yyx : 980.26612 nats/sec, 30.38852 nats/event
Full model Log loss : -1.66635
Full model ln_yyx : 993.70889 nats/sec, 30.80525 nats/event
Full model Log loss : -1.66540
Full model ln_yyx : 980.05695 nats/sec, 30.38204 nats/event
Full model Log loss : -1.66262
Full model ln_yyx : 988.31884 nats/sec, 30.63816 nats/event
Full model Log loss : -1.67187
Full model ln_yyx : 990.01055 nats/sec, 30.69060 nats/event
Full model Log loss : -1.67290
Full model ln_yyx : 992.16108 nats/sec, 30.75727 nats/event
Full model Log loss : -1.67057
Full model ln_yyx : 978.91579 nats/sec, 30.34666 nats/event
Full model Log loss : -1.67047
Full model ln_yyx : 994.14973 nats/sec, 30.81892 nats/event
Full model Log loss : -1.66472
Full model ln_yyx : 976.51854 nats/sec, 30.27234 nats/event
Full model Log loss : -1.66207
Optimization finished. Config saved to results/opt-full/opt_full_106_best_config.txt
[I 2026-03-18 18:57:25,896] Trial 43 finished with value: -2.637085181454087 and parameters: {'n_layers_yyx': 1, 'hidden_size_yyx_l0': 4, 'context_size_yyx': 3, 'num_mix_components_yyx': 5, 'context_extractor_yyx': 'lstm', 'activation_func_yyx': 'GELU', 'L2_weight_yyx': 1.3138373144025078e-08, 'L_entropy_weight_yyx': 9.608740118383079e-10, 'L_sep_weight_yyx': 1.0869669676421577e-10, 'L_scale_weight_yyx': 1.4989304713282084e-05, 'learning_rate_yyx': 0.0062139397966685305}. Best is trial 6 with value: -2.642843521506465.
[I 2026-03-18 18:57:29,179] Trial 45 pruned. 
[I 2026-03-18 18:57:31,729] Trial 44 pruned. 
[I 2026-03-18 18:57:34,152] Trial 40 pruned. 
[I 2026-03-18 18:57:35,744] Trial 36 pruned. 
