[I 2026-03-18 19:20:02,092] Trial 5 finished with value: -2.489891709004743 and parameters: {'n_layers_yyx': 2, 'hidden_size_yyx_l0': 2, 'hidden_size_yyx_l1': 6, 'context_size_yyx': 2, 'num_mix_components_yyx': 2, 'context_extractor_yyx': 'lstm', 'activation_func_yyx': 'ReLU', 'L2_weight_yyx': 6.605769808284331e-08, 'L_entropy_weight_yyx': 2.0317568325646674e-10, 'L_sep_weight_yyx': 1.009032476208772e-09, 'L_scale_weight_yyx': 2.015472273411015e-07, 'learning_rate_yyx': 0.005041200495712548}. Best is trial 0 with value: -2.510808245268653.
[I 2026-03-18 19:20:03,849] Trial 11 pruned. 
[I 2026-03-18 19:20:03,850] Trial 9 pruned. 
[I 2026-03-18 19:20:03,951] Trial 11 finished with value: -1.9821340133081595 and parameters: {'n_layers_yyx': 2, 'hidden_size_yyx_l0': 4, 'hidden_size_yyx_l1': 6, 'context_size_yyx': 2, 'num_mix_components_yyx': 4, 'context_extractor_yyx': 'lstm', 'activation_func_yyx': 'Tanh', 'L2_weight_yyx': 6.088879140741881e-07, 'L_entropy_weight_yyx': 1.874384980911263e-08, 'L_sep_weight_yyx': 4.6294632702719046e-07, 'L_scale_weight_yyx': 3.278493103605286e-06, 'learning_rate_yyx': 0.009567194102146471}. Best is trial 1 with value: -1.9828018961884801.
[I 2026-03-18 19:20:06,163] Trial 6 finished with value: -1.9801872806768062 and parameters: {'n_layers_yyx': 2, 'hidden_size_yyx_l0': 2, 'hidden_size_yyx_l1': 6, 'context_size_yyx': 1, 'num_mix_components_yyx': 1, 'context_extractor_yyx': 'lstm', 'activation_func_yyx': 'Tanh', 'L2_weight_yyx': 0.00031821095155622014, 'L_entropy_weight_yyx': 1.4198452364918959e-06, 'L_sep_weight_yyx': 3.98887897342474e-06, 'L_scale_weight_yyx': 2.3414646827029944e-08, 'learning_rate_yyx': 0.003135063851113547}. Best is trial 5 with value: -1.980981746129848.
[I 2026-03-18 19:20:08,821] Trial 3 finished with value: -2.5104539358874294 and parameters: {'n_layers_yyx': 2, 'hidden_size_yyx_l0': 5, 'hidden_size_yyx_l1': 3, 'context_size_yyx': 1, 'num_mix_components_yyx': 5, 'context_extractor_yyx': 'gru', 'activation_func_yyx': 'Tanh', 'L2_weight_yyx': 4.577929668762281e-09, 'L_entropy_weight_yyx': 5.428387420376848e-09, 'L_sep_weight_yyx': 4.90203113333268e-10, 'L_scale_weight_yyx': 4.901413253089353e-09, 'learning_rate_yyx': 0.00894004260195424}. Best is trial 0 with value: -2.5120178855442976.
[I 2026-03-18 19:20:11,195] Trial 10 finished with value: -2.018302208072991 and parameters: {'n_layers_yyx': 2, 'hidden_size_yyx_l0': 5, 'hidden_size_yyx_l1': 6, 'context_size_yyx': 1, 'num_mix_components_yyx': 5, 'context_extractor_yyx': 'gru', 'activation_func_yyx': 'ReLU', 'L2_weight_yyx': 3.2398124633885227e-10, 'L_entropy_weight_yyx': 0.0007179252680814713, 'L_sep_weight_yyx': 2.9678961074566052e-08, 'L_scale_weight_yyx': 8.443738898674038e-06, 'learning_rate_yyx': 0.009757945871027525}. Best is trial 4 with value: -2.021612486156544.
[I 2026-03-18 19:20:16,830] Trial 12 finished with value: -1.6796893990996478 and parameters: {'n_layers_yyx': 1, 'hidden_size_yyx_l0': 2, 'context_size_yyx': 4, 'num_mix_components_yyx': 5, 'context_extractor_yyx': 'lstm', 'activation_func_yyx': 'GELU', 'L2_weight_yyx': 5.873087308239574e-07, 'L_entropy_weight_yyx': 7.719927623592062e-09, 'L_sep_weight_yyx': 1.1348499893510617e-08, 'L_scale_weight_yyx': 2.1221454680252677e-08, 'learning_rate_yyx': 0.005778225908018196}. Best is trial 12 with value: -1.6796893990996478.
[I 2026-03-18 19:20:16,875] Trial 11 pruned. 
[I 2026-03-18 19:20:20,602] Trial 4 pruned. 
[I 2026-03-18 19:20:21,175] Trial 11 pruned. 
[I 2026-03-18 19:20:21,598] Trial 4 finished with value: -2.0325711582829133 and parameters: {'n_layers_yyx': 2, 'hidden_size_yyx_l0': 4, 'hidden_size_yyx_l1': 2, 'context_size_yyx': 3, 'num_mix_components_yyx': 3, 'context_extractor_yyx': 'lstm', 'activation_func_yyx': 'ReLU', 'L2_weight_yyx': 2.0485568465587075e-07, 'L_entropy_weight_yyx': 1.3092171704385117e-05, 'L_sep_weight_yyx': 9.1096113976791e-05, 'L_scale_weight_yyx': 4.487074596313741e-06, 'learning_rate_yyx': 0.0024204574233939887}. Best is trial 1 with value: -2.0346981000296678.
[I 2026-03-18 19:20:21,602] Trial 12 pruned. 
[I 2026-03-18 19:20:21,608] Trial 14 pruned. 
[I 2026-03-18 19:20:22,590] Trial 10 pruned. 
[I 2026-03-18 19:20:23,594] Trial 5 finished with value: -1.6722906315229307 and parameters: {'n_layers_yyx': 2, 'hidden_size_yyx_l0': 4, 'hidden_size_yyx_l1': 3, 'context_size_yyx': 2, 'num_mix_components_yyx': 2, 'context_extractor_yyx': 'gru', 'activation_func_yyx': 'ReLU', 'L2_weight_yyx': 1.4981951770247961e-06, 'L_entropy_weight_yyx': 0.0001007326950406359, 'L_sep_weight_yyx': 8.29199338047766e-09, 'L_scale_weight_yyx': 1.1050274273814978e-05, 'learning_rate_yyx': 0.00556434769841686}. Best is trial 4 with value: -1.673415532769749.
[I 2026-03-18 19:20:26,366] Trial 12 pruned. 
[I 2026-03-18 19:20:31,004] Trial 13 pruned. 
[I 2026-03-18 19:20:32,163] Trial 11 pruned. 
[I 2026-03-18 19:20:35,016] Trial 2 finished with value: -2.510844146832121 and parameters: {'n_layers_yyx': 2, 'hidden_size_yyx_l0': 5, 'hidden_size_yyx_l1': 3, 'context_size_yyx': 2, 'num_mix_components_yyx': 1, 'context_extractor_yyx': 'lstm', 'activation_func_yyx': 'ReLU', 'L2_weight_yyx': 9.310029751698755e-10, 'L_entropy_weight_yyx': 3.247127174500252e-08, 'L_sep_weight_yyx': 6.862638045680031e-07, 'L_scale_weight_yyx': 2.8123259395896727e-08, 'learning_rate_yyx': 0.0021087526320327085}. Best is trial 1 with value: -2.511856338115334.
[I 2026-03-18 19:20:42,421] Trial 14 pruned. 
[I 2026-03-18 19:20:43,695] Trial 12 pruned. 
[I 2026-03-18 19:20:45,371] Trial 4 finished with value: -2.0852915754296655 and parameters: {'n_layers_yyx': 1, 'hidden_size_yyx_l0': 5, 'context_size_yyx': 4, 'num_mix_components_yyx': 2, 'context_extractor_yyx': 'gru', 'activation_func_yyx': 'GELU', 'L2_weight_yyx': 8.357693339459227e-06, 'L_entropy_weight_yyx': 8.689137521915988e-09, 'L_sep_weight_yyx': 1.5058571636384276e-07, 'L_scale_weight_yyx': 8.447795007626088e-08, 'learning_rate_yyx': 0.0008143958659268534}. Best is trial 0 with value: -2.1143376288427875.
[I 2026-03-18 19:20:45,898] Trial 6 pruned. 
[I 2026-03-18 19:20:46,415] Trial 10 pruned. 
[I 2026-03-18 19:20:46,797] Trial 15 pruned. 
[I 2026-03-18 19:20:48,527] Trial 3 pruned. 
[I 2026-03-18 19:20:49,341] Trial 5 pruned. 
[I 2026-03-18 19:20:54,382] Trial 15 pruned. 
[I 2026-03-18 19:20:54,988] Trial 7 finished with value: -1.6571876492882966 and parameters: {'n_layers_yyx': 1, 'hidden_size_yyx_l0': 6, 'context_size_yyx': 1, 'num_mix_components_yyx': 1, 'context_extractor_yyx': 'lstm', 'activation_func_yyx': 'Tanh', 'L2_weight_yyx': 1.8269471528772703e-06, 'L_entropy_weight_yyx': 5.393586296903399e-10, 'L_sep_weight_yyx': 3.046821228439405e-05, 'L_scale_weight_yyx': 2.5445686968955084e-05, 'learning_rate_yyx': 0.0021728800825753566}. Best is trial 2 with value: -1.680426359749482.
[I 2026-03-18 19:20:55,865] Trial 2 finished with value: -2.5084870391471785 and parameters: {'n_layers_yyx': 2, 'hidden_size_yyx_l0': 3, 'hidden_size_yyx_l1': 4, 'context_size_yyx': 2, 'num_mix_components_yyx': 2, 'context_extractor_yyx': 'lstm', 'activation_func_yyx': 'GELU', 'L2_weight_yyx': 1.065817986158645e-09, 'L_entropy_weight_yyx': 3.0234574495032606e-08, 'L_sep_weight_yyx': 6.66828409195369e-08, 'L_scale_weight_yyx': 7.81710278028246e-10, 'learning_rate_yyx': 0.0008706461158279748}. Best is trial 1 with value: -2.5125601952756833.
[I 2026-03-18 19:21:03,231] Trial 13 pruned. 
[I 2026-03-18 19:21:03,327] Trial 8 pruned. 
[I 2026-03-18 19:21:03,612] Trial 16 pruned. 
[I 2026-03-18 19:21:03,793] Trial 6 pruned. 
[I 2026-03-18 19:21:06,785] Trial 5 pruned. 
[I 2026-03-18 19:21:07,682] Trial 7 pruned. 
[I 2026-03-18 19:21:20,162] Trial 14 pruned. 
[I 2026-03-18 19:21:20,958] Trial 11 finished with value: -1.669701616103004 and parameters: {'n_layers_yyx': 1, 'hidden_size_yyx_l0': 6, 'context_size_yyx': 4, 'num_mix_components_yyx': 1, 'context_extractor_yyx': 'lstm', 'activation_func_yyx': 'ReLU', 'L2_weight_yyx': 5.691348216367372e-06, 'L_entropy_weight_yyx': 2.8308517572222422e-08, 'L_sep_weight_yyx': 5.841440688834885e-06, 'L_scale_weight_yyx': 8.24444369429519e-06, 'learning_rate_yyx': 0.005177648658892556}. Best is trial 0 with value: -1.6761095192729139.
[I 2026-03-18 19:21:21,331] Trial 9 pruned. 
[I 2026-03-18 19:21:24,277] Trial 4 finished with value: -2.4897580139396727 and parameters: {'n_layers_yyx': 2, 'hidden_size_yyx_l0': 6, 'hidden_size_yyx_l1': 5, 'context_size_yyx': 3, 'num_mix_components_yyx': 3, 'context_extractor_yyx': 'gru', 'activation_func_yyx': 'GELU', 'L2_weight_yyx': 1.5985662915827328e-05, 'L_entropy_weight_yyx': 5.378939862732359e-10, 'L_sep_weight_yyx': 6.375661594333741e-10, 'L_scale_weight_yyx': 3.1571539259552475e-10, 'learning_rate_yyx': 0.0006002420309895686}. Best is trial 4 with value: -2.4897580139396727.
[I 2026-03-18 19:21:26,043] Trial 5 finished with value: -2.0113605918322657 and parameters: {'n_layers_yyx': 2, 'hidden_size_yyx_l0': 2, 'hidden_size_yyx_l1': 3, 'context_size_yyx': 2, 'num_mix_components_yyx': 3, 'context_extractor_yyx': 'gru', 'activation_func_yyx': 'ReLU', 'L2_weight_yyx': 6.226579446558639e-06, 'L_entropy_weight_yyx': 5.249299153315164e-09, 'L_sep_weight_yyx': 3.6474934004969984e-07, 'L_scale_weight_yyx': 0.00012334304630219316, 'learning_rate_yyx': 0.00750192576664836}. Best is trial 0 with value: -2.0138799336866504.
[I 2026-03-18 19:21:30,590] Trial 10 pruned. 
[I 2026-03-18 19:21:30,848] Trial 12 pruned. 
[I 2026-03-18 19:21:34,847] Trial 13 finished with value: -1.7208678133767146 and parameters: {'n_layers_yyx': 1, 'hidden_size_yyx_l0': 5, 'context_size_yyx': 4, 'num_mix_components_yyx': 3, 'context_extractor_yyx': 'gru', 'activation_func_yyx': 'ReLU', 'L2_weight_yyx': 0.0008929858922634257, 'L_entropy_weight_yyx': 2.915722867625933e-09, 'L_sep_weight_yyx': 3.119967671858247e-09, 'L_scale_weight_yyx': 3.0108190537446543e-09, 'learning_rate_yyx': 0.0005888172627025774}. Best is trial 8 with value: -1.7294919135267302.
[I 2026-03-18 19:21:38,678] Trial 5 pruned. 
[I 2026-03-18 19:21:38,737] Trial 2 finished with value: -2.508588848779159 and parameters: {'n_layers_yyx': 2, 'hidden_size_yyx_l0': 5, 'hidden_size_yyx_l1': 2, 'context_size_yyx': 3, 'num_mix_components_yyx': 2, 'context_extractor_yyx': 'gru', 'activation_func_yyx': 'ReLU', 'L2_weight_yyx': 8.343073957724945e-05, 'L_entropy_weight_yyx': 2.4465863435922845e-06, 'L_sep_weight_yyx': 4.020767307616187e-06, 'L_scale_weight_yyx': 0.00047792887359273046, 'learning_rate_yyx': 0.0043349678677023105}. Best is trial 0 with value: -2.5120461423480207.
[I 2026-03-18 19:21:40,458] Trial 4 finished with value: -2.547155606996763 and parameters: {'n_layers_yyx': 2, 'hidden_size_yyx_l0': 3, 'hidden_size_yyx_l1': 4, 'context_size_yyx': 3, 'num_mix_components_yyx': 3, 'context_extractor_yyx': 'lstm', 'activation_func_yyx': 'Tanh', 'L2_weight_yyx': 2.6712456011115137e-09, 'L_entropy_weight_yyx': 9.503016787165415e-05, 'L_sep_weight_yyx': 1.348856577488765e-06, 'L_scale_weight_yyx': 4.665177664296996e-10, 'learning_rate_yyx': 0.0019414455326233788}. Best is trial 4 with value: -2.547155606996763.
[I 2026-03-18 19:21:45,493] Trial 16 pruned. 
[I 2026-03-18 19:21:46,853] Trial 14 pruned. 
[I 2026-03-18 19:21:49,913] Trial 8 finished with value: -2.504671967962123 and parameters: {'n_layers_yyx': 1, 'hidden_size_yyx_l0': 2, 'context_size_yyx': 4, 'num_mix_components_yyx': 3, 'context_extractor_yyx': 'gru', 'activation_func_yyx': 'GELU', 'L2_weight_yyx': 5.094017857603697e-06, 'L_entropy_weight_yyx': 5.6672151519916665e-05, 'L_sep_weight_yyx': 0.0002653037238158385, 'L_scale_weight_yyx': 1.4950328419562527e-08, 'learning_rate_yyx': 0.0005438681171438404}. Best is trial 0 with value: -2.511745534136428.
[I 2026-03-18 19:21:56,328] Trial 6 pruned. 
[I 2026-03-18 19:21:56,426] Trial 3 finished with value: -2.4933646083138137 and parameters: {'n_layers_yyx': 2, 'hidden_size_yyx_l0': 2, 'hidden_size_yyx_l1': 6, 'context_size_yyx': 2, 'num_mix_components_yyx': 5, 'context_extractor_yyx': 'lstm', 'activation_func_yyx': 'GELU', 'L2_weight_yyx': 2.609865636064298e-10, 'L_entropy_weight_yyx': 2.3353394707473907e-06, 'L_sep_weight_yyx': 5.545427329093374e-05, 'L_scale_weight_yyx': 0.0002569626573433095, 'learning_rate_yyx': 0.002167693408567146}. Best is trial 3 with value: -2.4933646083138137.
[I 2026-03-18 19:21:58,973] Trial 15 pruned. 
[I 2026-03-18 19:22:06,572] Trial 12 finished with value: -1.9806638027031993 and parameters: {'n_layers_yyx': 2, 'hidden_size_yyx_l0': 4, 'hidden_size_yyx_l1': 6, 'context_size_yyx': 1, 'num_mix_components_yyx': 4, 'context_extractor_yyx': 'lstm', 'activation_func_yyx': 'Tanh', 'L2_weight_yyx': 4.701334493010773e-07, 'L_entropy_weight_yyx': 1.0304406209396058e-08, 'L_sep_weight_yyx': 7.199958852321823e-07, 'L_scale_weight_yyx': 1.1813122842922665e-06, 'learning_rate_yyx': 0.007113873757471365}. Best is trial 1 with value: -1.9828018961884801.
[I 2026-03-18 19:22:07,710] Trial 9 pruned. 
[I 2026-03-18 19:22:11,200] Trial 4 pruned. 
[I 2026-03-18 19:22:11,259] Trial 7 finished with value: -1.7093179241504544 and parameters: {'n_layers_yyx': 2, 'hidden_size_yyx_l0': 6, 'hidden_size_yyx_l1': 4, 'context_size_yyx': 2, 'num_mix_components_yyx': 5, 'context_extractor_yyx': 'gru', 'activation_func_yyx': 'Tanh', 'L2_weight_yyx': 2.8616011558887413e-08, 'L_entropy_weight_yyx': 0.0007490430634375329, 'L_sep_weight_yyx': 9.543448091798522e-10, 'L_scale_weight_yyx': 0.00029528548254169427, 'learning_rate_yyx': 0.0008948221406830843}. Best is trial 0 with value: -1.7166840796377145.
[I 2026-03-18 19:22:12,455] Trial 16 pruned. 
[I 2026-03-18 19:22:15,725] Trial 3 pruned. 
[I 2026-03-18 19:22:20,294] Trial 5 finished with value: -1.6751211332278089 and parameters: {'n_layers_yyx': 2, 'hidden_size_yyx_l0': 6, 'hidden_size_yyx_l1': 5, 'context_size_yyx': 2, 'num_mix_components_yyx': 4, 'context_extractor_yyx': 'gru', 'activation_func_yyx': 'GELU', 'L2_weight_yyx': 6.411780404084168e-10, 'L_entropy_weight_yyx': 0.00012331932048996206, 'L_sep_weight_yyx': 4.369896172436773e-08, 'L_scale_weight_yyx': 2.878826355029152e-06, 'learning_rate_yyx': 0.007517432353892202}. Best is trial 3 with value: -1.6796541081088945.
[I 2026-03-18 19:22:22,505] Trial 15 pruned. 
[I 2026-03-18 19:22:25,859] Trial 8 pruned. 
[I 2026-03-18 19:22:30,991] Trial 4 pruned. 
[I 2026-03-18 19:22:33,791] Trial 6 pruned. 
[I 2026-03-18 19:22:36,567] Trial 16 pruned. 
[I 2026-03-18 19:22:37,648] Trial 8 finished with value: -1.656861561413627 and parameters: {'n_layers_yyx': 2, 'hidden_size_yyx_l0': 5, 'hidden_size_yyx_l1': 5, 'context_size_yyx': 2, 'num_mix_components_yyx': 1, 'context_extractor_yyx': 'gru', 'activation_func_yyx': 'Tanh', 'L2_weight_yyx': 2.1355124691165894e-06, 'L_entropy_weight_yyx': 1.763238973998162e-08, 'L_sep_weight_yyx': 4.181556111555512e-05, 'L_scale_weight_yyx': 1.1783111422712201e-06, 'learning_rate_yyx': 0.009291728940653367}. Best is trial 4 with value: -1.673415532769749.
[I 2026-03-18 19:22:41,719] Trial 4 finished with value: -2.5120768112909224 and parameters: {'n_layers_yyx': 2, 'hidden_size_yyx_l0': 5, 'hidden_size_yyx_l1': 3, 'context_size_yyx': 1, 'num_mix_components_yyx': 5, 'context_extractor_yyx': 'lstm', 'activation_func_yyx': 'ReLU', 'L2_weight_yyx': 2.3597858429678626e-10, 'L_entropy_weight_yyx': 2.6844738476529902e-05, 'L_sep_weight_yyx': 2.265656094803677e-10, 'L_scale_weight_yyx': 4.108870403746099e-07, 'learning_rate_yyx': 0.004936376229290137}. Best is trial 0 with value: -2.512397478376116.
[I 2026-03-18 19:22:41,733] Trial 7 finished with value: -1.9813599213936923 and parameters: {'n_layers_yyx': 2, 'hidden_size_yyx_l0': 3, 'hidden_size_yyx_l1': 3, 'context_size_yyx': 2, 'num_mix_components_yyx': 3, 'context_extractor_yyx': 'lstm', 'activation_func_yyx': 'GELU', 'L2_weight_yyx': 8.639387707091337e-06, 'L_entropy_weight_yyx': 4.787024431581484e-07, 'L_sep_weight_yyx': 1.8761020935371705e-09, 'L_scale_weight_yyx': 8.496426613031887e-08, 'learning_rate_yyx': 0.009736441839146353}. Best is trial 7 with value: -1.9813599213936923.
[I 2026-03-18 19:22:51,883] Trial 9 pruned. 
[I 2026-03-18 19:23:01,888] Trial 17 pruned. 
[I 2026-03-18 19:23:04,104] Trial 10 pruned. 
[I 2026-03-18 19:23:04,913] Trial 17 finished with value: -1.6920228034738336 and parameters: {'n_layers_yyx': 1, 'hidden_size_yyx_l0': 5, 'context_size_yyx': 4, 'num_mix_components_yyx': 4, 'context_extractor_yyx': 'gru', 'activation_func_yyx': 'ReLU', 'L2_weight_yyx': 7.563377877592902e-06, 'L_entropy_weight_yyx': 1.0414303600451228e-07, 'L_sep_weight_yyx': 0.00015760863740168444, 'L_scale_weight_yyx': 1.8022627280533304e-09, 'learning_rate_yyx': 0.009811128532296034}. Best is trial 2 with value: -1.6965485290020457.
[I 2026-03-18 19:23:10,949] Trial 8 pruned. 
[I 2026-03-18 19:23:14,787] Trial 13 pruned. 
[I 2026-03-18 19:23:14,893] Trial 18 pruned. 
[I 2026-03-18 19:23:16,555] Trial 5 finished with value: -1.567794139885891 and parameters: {'n_layers_yyx': 2, 'hidden_size_yyx_l0': 2, 'hidden_size_yyx_l1': 4, 'context_size_yyx': 1, 'num_mix_components_yyx': 3, 'context_extractor_yyx': 'gru', 'activation_func_yyx': 'GELU', 'L2_weight_yyx': 7.336141881284366e-10, 'L_entropy_weight_yyx': 5.640773265028541e-05, 'L_sep_weight_yyx': 4.764025236387182e-05, 'L_scale_weight_yyx': 0.00029656313021697003, 'learning_rate_yyx': 0.002218049677053183}. Best is trial 2 with value: -1.6776522224422603.
[I 2026-03-18 19:23:17,873] Trial 11 pruned. 
[I 2026-03-18 19:23:17,911] Trial 17 pruned. 
[I 2026-03-18 19:23:21,171] Trial 13 finished with value: -1.6754691047430152 and parameters: {'n_layers_yyx': 1, 'hidden_size_yyx_l0': 3, 'context_size_yyx': 3, 'num_mix_components_yyx': 4, 'context_extractor_yyx': 'lstm', 'activation_func_yyx': 'GELU', 'L2_weight_yyx': 1.1454953978763625e-06, 'L_entropy_weight_yyx': 5.084267747336372e-09, 'L_sep_weight_yyx': 3.9819858829398235e-09, 'L_scale_weight_yyx': 8.621229987999748e-07, 'learning_rate_yyx': 0.006905886067959615}. Best is trial 12 with value: -1.6796893990996478.
[I 2026-03-18 19:23:22,807] Trial 6 finished with value: -2.513252855536577 and parameters: {'n_layers_yyx': 1, 'hidden_size_yyx_l0': 6, 'context_size_yyx': 1, 'num_mix_components_yyx': 4, 'context_extractor_yyx': 'lstm', 'activation_func_yyx': 'ReLU', 'L2_weight_yyx': 2.3393597603024415e-09, 'L_entropy_weight_yyx': 7.054846452524323e-05, 'L_sep_weight_yyx': 2.3403624851737928e-06, 'L_scale_weight_yyx': 1.4488120637876335e-08, 'learning_rate_yyx': 0.006152141607367437}. Best is trial 6 with value: -2.513252855536577.
[I 2026-03-18 19:23:32,789] Trial 18 pruned. 
[I 2026-03-18 19:23:36,774] Trial 11 finished with value: -1.7020476033368448 and parameters: {'n_layers_yyx': 2, 'hidden_size_yyx_l0': 5, 'hidden_size_yyx_l1': 4, 'context_size_yyx': 1, 'num_mix_components_yyx': 2, 'context_extractor_yyx': 'gru', 'activation_func_yyx': 'ReLU', 'L2_weight_yyx': 7.508437661531867e-09, 'L_entropy_weight_yyx': 4.113738958538894e-07, 'L_sep_weight_yyx': 1.8760933295340117e-06, 'L_scale_weight_yyx': 0.00040157347208091875, 'learning_rate_yyx': 0.0054578514203379}. Best is trial 5 with value: -1.704671424204909.
[I 2026-03-18 19:23:43,870] Trial 5 pruned. 
[I 2026-03-18 19:23:44,313] Trial 19 pruned. 
[I 2026-03-18 19:23:45,180] Trial 6 finished with value: -2.498188572848526 and parameters: {'n_layers_yyx': 2, 'hidden_size_yyx_l0': 4, 'hidden_size_yyx_l1': 4, 'context_size_yyx': 4, 'num_mix_components_yyx': 2, 'context_extractor_yyx': 'lstm', 'activation_func_yyx': 'GELU', 'L2_weight_yyx': 1.0709845050984267e-06, 'L_entropy_weight_yyx': 7.776104939893843e-06, 'L_sep_weight_yyx': 1.8739824134144757e-06, 'L_scale_weight_yyx': 4.513221673314624e-09, 'learning_rate_yyx': 0.0016226737715744623}. Best is trial 0 with value: -2.510808245268653.
[I 2026-03-18 19:23:45,819] Trial 9 pruned. 
[I 2026-03-18 19:23:47,246] Trial 19 pruned. 
[I 2026-03-18 19:23:51,716] Trial 14 pruned. 
[I 2026-03-18 19:23:52,963] Trial 12 pruned. 
[I 2026-03-18 19:24:00,422] Trial 7 finished with value: -2.4975944670048893 and parameters: {'n_layers_yyx': 2, 'hidden_size_yyx_l0': 5, 'hidden_size_yyx_l1': 3, 'context_size_yyx': 4, 'num_mix_components_yyx': 1, 'context_extractor_yyx': 'gru', 'activation_func_yyx': 'ReLU', 'L2_weight_yyx': 4.026947484754721e-05, 'L_entropy_weight_yyx': 1.4026609147175051e-06, 'L_sep_weight_yyx': 7.045786064733256e-09, 'L_scale_weight_yyx': 1.1786989934343198e-10, 'learning_rate_yyx': 0.004326142869715969}. Best is trial 0 with value: -2.5120178855442976.
[I 2026-03-18 19:24:00,814] Trial 5 pruned. 
[I 2026-03-18 19:24:04,269] Trial 7 pruned. 
[I 2026-03-18 19:24:04,520] Trial 13 pruned. 
[I 2026-03-18 19:24:11,173] Trial 15 finished with value: -1.9940496908651817 and parameters: {'n_layers_yyx': 2, 'hidden_size_yyx_l0': 5, 'hidden_size_yyx_l1': 5, 'context_size_yyx': 1, 'num_mix_components_yyx': 5, 'context_extractor_yyx': 'gru', 'activation_func_yyx': 'ReLU', 'L2_weight_yyx': 1.2799484871049693e-10, 'L_entropy_weight_yyx': 1.1696335327797825e-07, 'L_sep_weight_yyx': 2.491139242741022e-07, 'L_scale_weight_yyx': 2.0711124591729488e-07, 'learning_rate_yyx': 0.0032963176348844324}. Best is trial 15 with value: -1.9940496908651817.
[I 2026-03-18 19:24:12,825] Trial 10 pruned. 
[I 2026-03-18 19:24:14,105] Trial 20 pruned. 
[I 2026-03-18 19:24:16,515] Trial 15 pruned. 
[I 2026-03-18 19:24:17,388] Trial 14 pruned. 
[I 2026-03-18 19:24:19,549] Trial 8 pruned. 
[I 2026-03-18 19:24:25,116] Trial 11 pruned. 
