[I 2026-03-18 19:30:01,393] Trial 41 finished with value: -1.7824347971906567 and parameters: {'n_layers_yyx': 2, 'hidden_size_yyx_l0': 2, 'hidden_size_yyx_l1': 5, 'context_size_yyx': 4, 'num_mix_components_yyx': 5, 'context_extractor_yyx': 'lstm', 'activation_func_yyx': 'ReLU', 'L2_weight_yyx': 3.4176358391787364e-05, 'L_entropy_weight_yyx': 1.4317721575344659e-05, 'L_sep_weight_yyx': 4.8434720652794845e-06, 'L_scale_weight_yyx': 0.0004468942304205979, 'learning_rate_yyx': 0.007112529727336725}. Best is trial 18 with value: -1.7861539220328282.
[I 2026-03-18 19:30:01,900] Trial 37 pruned. 
[I 2026-03-18 19:30:03,072] Trial 47 pruned. 
[I 2026-03-18 19:30:03,466] Trial 32 finished with value: -2.272765491402173 and parameters: {'n_layers_yyx': 2, 'hidden_size_yyx_l0': 5, 'hidden_size_yyx_l1': 5, 'context_size_yyx': 2, 'num_mix_components_yyx': 4, 'context_extractor_yyx': 'lstm', 'activation_func_yyx': 'Tanh', 'L2_weight_yyx': 9.44176483481724e-09, 'L_entropy_weight_yyx': 4.1389329819482435e-05, 'L_sep_weight_yyx': 7.466553495493647e-07, 'L_scale_weight_yyx': 1.947680378161579e-10, 'learning_rate_yyx': 0.009699468913575206}. Best is trial 21 with value: -2.2734326463096424.
[I 2026-03-18 19:30:07,988] Trial 47 pruned. 
[I 2026-03-18 19:30:08,830] Trial 35 pruned. 
[I 2026-03-18 19:30:10,168] Trial 25 finished with value: -2.286349879513464 and parameters: {'n_layers_yyx': 1, 'hidden_size_yyx_l0': 6, 'context_size_yyx': 4, 'num_mix_components_yyx': 2, 'context_extractor_yyx': 'gru', 'activation_func_yyx': 'ReLU', 'L2_weight_yyx': 1.317533358448377e-08, 'L_entropy_weight_yyx': 5.671525859116173e-08, 'L_sep_weight_yyx': 2.9601429991657278e-08, 'L_scale_weight_yyx': 2.770573331416092e-10, 'learning_rate_yyx': 0.009538970383248134}. Best is trial 25 with value: -2.286349879513464.
[I 2026-03-18 19:30:12,099] Trial 38 pruned. 
[I 2026-03-18 19:30:12,549] Trial 48 pruned. 
[I 2026-03-18 19:30:17,536] Trial 36 pruned. 
[I 2026-03-18 19:30:20,533] Trial 35 pruned. 
[I 2026-03-18 19:30:20,937] Trial 49 pruned. 

Source events: 12731
Target events: 31112
Full model ln_yyx : 1339.06926 nats/sec, 38.73625 nats/event
Full model Log loss : -1.78243
Full model ln_yyx : 1337.29428 nats/sec, 38.68491 nats/event
Full model Log loss : -1.78588
Full model ln_yyx : 1341.09325 nats/sec, 38.79480 nats/event
Full model Log loss : -1.78452
Full model ln_yyx : 1340.12328 nats/sec, 38.76674 nats/event
Full model Log loss : -1.77991
Full model ln_yyx : 1348.60204 nats/sec, 39.01202 nats/event
Full model Log loss : -1.78025
Full model ln_yyx : 1334.03577 nats/sec, 38.59065 nats/event
Full model Log loss : -1.78494
Full model ln_yyx : 1341.26617 nats/sec, 38.79981 nats/event
Full model Log loss : -1.78679
Full model ln_yyx : 1340.26039 nats/sec, 38.77071 nats/event
Full model Log loss : -1.78484
Full model ln_yyx : 1335.96141 nats/sec, 38.64635 nats/event
Full model Log loss : -1.78357
Full model ln_yyx : 1321.76866 nats/sec, 38.23579 nats/event
Full model Log loss : -1.78360
Full model ln_yyx : 1334.19628 nats/sec, 38.59529 nats/event
Full model Log loss : -1.78274
Full model ln_yyx : 1344.18803 nats/sec, 38.88433 nats/event
Full model Log loss : -1.78139
Optimization finished. Config saved to results/opt-full/opt_full_216_best_config.txt
[I 2026-03-18 19:30:22,570] Trial 42 pruned. 
[I 2026-03-18 19:30:23,099] Trial 48 pruned. 
[I 2026-03-18 19:30:25,122] Trial 48 pruned. 
[I 2026-03-18 19:30:30,229] Trial 30 pruned. 
[I 2026-03-18 19:30:30,230] Trial 47 finished with value: -1.7392037370539377 and parameters: {'n_layers_yyx': 2, 'hidden_size_yyx_l0': 6, 'hidden_size_yyx_l1': 5, 'context_size_yyx': 2, 'num_mix_components_yyx': 1, 'context_extractor_yyx': 'lstm', 'activation_func_yyx': 'ReLU', 'L2_weight_yyx': 4.454308310666025e-09, 'L_entropy_weight_yyx': 1.244489197222954e-09, 'L_sep_weight_yyx': 3.5651000786839695e-08, 'L_scale_weight_yyx': 1.2769568292010507e-07, 'learning_rate_yyx': 0.008404029486297598}. Best is trial 1 with value: -1.7684712210476057.
[I 2026-03-18 19:30:34,455] Trial 39 pruned. 
[I 2026-03-18 19:30:38,180] Trial 36 pruned. 
[I 2026-03-18 19:30:38,468] Trial 38 pruned. 
[I 2026-03-18 19:30:42,267] Trial 49 pruned. 

Source events: 12731
Target events: 5634
Full model ln_yyx : 241.26517 nats/sec, 38.54076 nats/event
Full model Log loss : -1.77566
Full model ln_yyx : 239.16008 nats/sec, 38.20449 nats/event
Full model Log loss : -1.75001
Full model ln_yyx : 235.19637 nats/sec, 37.57131 nats/event
Full model Log loss : -1.71264
Full model ln_yyx : 242.78386 nats/sec, 38.78336 nats/event
Full model Log loss : -1.77757
Full model ln_yyx : 240.54316 nats/sec, 38.42542 nats/event
Full model Log loss : -1.77531
Full model ln_yyx : 241.61083 nats/sec, 38.59598 nats/event
Full model Log loss : -1.77249
Full model ln_yyx : 241.53969 nats/sec, 38.58462 nats/event
Full model Log loss : -1.77453
Full model ln_yyx : 240.12426 nats/sec, 38.35851 nats/event
Full model Log loss : -1.77342
Full model ln_yyx : 239.12277 nats/sec, 38.19853 nats/event
Full model Log loss : -1.77273
Full model ln_yyx : 240.65737 nats/sec, 38.44367 nats/event
Full model Log loss : -1.77518
Full model ln_yyx : 238.19701 nats/sec, 38.05064 nats/event
Full model Log loss : -1.75078
Full model ln_yyx : 240.16036 nats/sec, 38.36427 nats/event
Full model Log loss : -1.77383
Full model ln_yyx : 241.84496 nats/sec, 38.63338 nats/event
Full model Log loss : -1.77442
Full model ln_yyx : 242.36679 nats/sec, 38.71674 nats/event
Full model Log loss : -1.76961
Full model ln_yyx : 239.76882 nats/sec, 38.30173 nats/event
Full model Log loss : -1.77462
Full model ln_yyx : 241.46019 nats/sec, 38.57192 nats/event
Full model Log loss : -1.77678
Optimization finished. Config saved to results/opt-full/opt_full_221_best_config.txt
[I 2026-03-18 19:30:47,229] Trial 48 pruned. 
[I 2026-03-18 19:30:50,727] Trial 40 pruned. 
[I 2026-03-18 19:30:55,676] Trial 37 pruned. 
[I 2026-03-18 19:30:58,192] Trial 39 pruned. 
[I 2026-03-18 19:30:59,025] Trial 41 pruned. 
[I 2026-03-18 19:31:02,405] Trial 38 pruned. 
[I 2026-03-18 19:31:03,248] Trial 36 finished with value: -2.281234206739293 and parameters: {'n_layers_yyx': 2, 'hidden_size_yyx_l0': 3, 'hidden_size_yyx_l1': 3, 'context_size_yyx': 4, 'num_mix_components_yyx': 3, 'context_extractor_yyx': 'gru', 'activation_func_yyx': 'GELU', 'L2_weight_yyx': 6.0982708856628115e-09, 'L_entropy_weight_yyx': 2.0806391807511174e-08, 'L_sep_weight_yyx': 8.693846058914041e-07, 'L_scale_weight_yyx': 1.3578399695245732e-06, 'learning_rate_yyx': 0.0036464466274384474}. Best is trial 36 with value: -2.281234206739293.
[I 2026-03-18 19:31:06,144] Trial 37 pruned. 
[I 2026-03-18 19:31:06,167] Trial 33 finished with value: -2.2800559227481845 and parameters: {'n_layers_yyx': 2, 'hidden_size_yyx_l0': 4, 'hidden_size_yyx_l1': 5, 'context_size_yyx': 4, 'num_mix_components_yyx': 5, 'context_extractor_yyx': 'lstm', 'activation_func_yyx': 'GELU', 'L2_weight_yyx': 1.2148680123610894e-05, 'L_entropy_weight_yyx': 6.747317280349307e-05, 'L_sep_weight_yyx': 1.6997048186386474e-05, 'L_scale_weight_yyx': 0.00024357237269148532, 'learning_rate_yyx': 0.004678625160556879}. Best is trial 32 with value: -2.283618801160143.
[I 2026-03-18 19:31:06,540] Trial 33 finished with value: -2.2580958645102043 and parameters: {'n_layers_yyx': 2, 'hidden_size_yyx_l0': 6, 'hidden_size_yyx_l1': 6, 'context_size_yyx': 2, 'num_mix_components_yyx': 5, 'context_extractor_yyx': 'lstm', 'activation_func_yyx': 'Tanh', 'L2_weight_yyx': 2.9817759566642523e-10, 'L_entropy_weight_yyx': 3.895243700987202e-05, 'L_sep_weight_yyx': 4.913971435042845e-10, 'L_scale_weight_yyx': 1.7085365457945694e-10, 'learning_rate_yyx': 0.009803743045276817}. Best is trial 21 with value: -2.2734326463096424.
[I 2026-03-18 19:31:10,189] Trial 49 pruned. 

Source events: 12731
Target events: 3828
Full model ln_yyx : 164.65625 nats/sec, 38.71228 nats/event
Full model Log loss : -1.77930
Full model ln_yyx : 160.36090 nats/sec, 37.70241 nats/event
Full model Log loss : -1.75710
Full model ln_yyx : 164.87531 nats/sec, 38.76379 nats/event
Full model Log loss : -1.78079
Full model ln_yyx : 163.38134 nats/sec, 38.41254 nats/event
Full model Log loss : -1.77722
Full model ln_yyx : 165.93642 nats/sec, 39.01327 nats/event
Full model Log loss : -1.77567
Full model ln_yyx : 161.65147 nats/sec, 38.00583 nats/event
Full model Log loss : -1.77380
Full model ln_yyx : 161.45322 nats/sec, 37.95922 nats/event
Full model Log loss : -1.77968
Full model ln_yyx : 162.45466 nats/sec, 38.19467 nats/event
Full model Log loss : -1.77918
Full model ln_yyx : 161.65448 nats/sec, 38.00654 nats/event
Full model Log loss : -1.77803
Full model ln_yyx : 161.11938 nats/sec, 37.88073 nats/event
Full model Log loss : -1.77804
Full model ln_yyx : 163.64658 nats/sec, 38.47490 nats/event
Full model Log loss : -1.77975
Full model ln_yyx : 163.90484 nats/sec, 38.53562 nats/event
Full model Log loss : -1.78062
Optimization finished. Config saved to results/opt-full/opt_full_219_best_config.txt
[I 2026-03-18 19:31:11,410] Trial 37 pruned. 
[I 2026-03-18 19:31:16,401] Trial 34 pruned. 
[I 2026-03-18 19:31:24,787] Trial 32 finished with value: -2.2668590301247757 and parameters: {'n_layers_yyx': 2, 'hidden_size_yyx_l0': 2, 'hidden_size_yyx_l1': 6, 'context_size_yyx': 4, 'num_mix_components_yyx': 4, 'context_extractor_yyx': 'lstm', 'activation_func_yyx': 'GELU', 'L2_weight_yyx': 9.1870131820422e-10, 'L_entropy_weight_yyx': 6.575098549716097e-10, 'L_sep_weight_yyx': 3.182174618385215e-05, 'L_scale_weight_yyx': 5.565492311785411e-09, 'learning_rate_yyx': 0.006258118491845844}. Best is trial 31 with value: -2.2773129352235233.
[I 2026-03-18 19:31:25,533] Trial 38 pruned. 
[I 2026-03-18 19:31:27,573] Trial 39 pruned. 
[I 2026-03-18 19:31:28,891] Trial 49 pruned. 

Source events: 12731
Target events: 10683
Full model ln_yyx : 449.34786 nats/sec, 37.85576 nats/event
Full model Log loss : -1.75031
Full model ln_yyx : 456.85876 nats/sec, 38.48852 nats/event
Full model Log loss : -1.76847
Full model ln_yyx : 447.23171 nats/sec, 37.67748 nats/event
Full model Log loss : -1.73793
Full model ln_yyx : 448.33461 nats/sec, 37.77040 nats/event
Full model Log loss : -1.73914
Full model ln_yyx : 453.93686 nats/sec, 38.24236 nats/event
Full model Log loss : -1.76417
Full model ln_yyx : 456.79666 nats/sec, 38.48329 nats/event
Full model Log loss : -1.76188
Full model ln_yyx : 457.65297 nats/sec, 38.55543 nats/event
Full model Log loss : -1.76183
Full model ln_yyx : 456.15230 nats/sec, 38.42901 nats/event
Full model Log loss : -1.76377
Full model ln_yyx : 454.90140 nats/sec, 38.32362 nats/event
Full model Log loss : -1.76577
Full model ln_yyx : 461.82782 nats/sec, 38.90715 nats/event
Full model Log loss : -1.76639
Full model ln_yyx : 452.84625 nats/sec, 38.15048 nats/event
Full model Log loss : -1.76466
Full model ln_yyx : 453.36219 nats/sec, 38.19395 nats/event
Full model Log loss : -1.76478
Full model ln_yyx : 454.86596 nats/sec, 38.32064 nats/event
Full model Log loss : -1.76560
Full model ln_yyx : 456.13470 nats/sec, 38.42752 nats/event
Full model Log loss : -1.76267
Full model ln_yyx : 448.06618 nats/sec, 37.74778 nats/event
Full model Log loss : -1.73920
Optimization finished. Config saved to results/opt-full/opt_full_222_best_config.txt
[I 2026-03-18 19:31:41,608] Trial 40 pruned. 
[I 2026-03-18 19:31:44,075] Trial 40 pruned. 
[I 2026-03-18 19:31:44,486] Trial 39 pruned. 
[I 2026-03-18 19:31:45,840] Trial 42 finished with value: -1.7838965583570077 and parameters: {'n_layers_yyx': 2, 'hidden_size_yyx_l0': 2, 'hidden_size_yyx_l1': 5, 'context_size_yyx': 4, 'num_mix_components_yyx': 5, 'context_extractor_yyx': 'lstm', 'activation_func_yyx': 'ReLU', 'L2_weight_yyx': 5.0694584309769826e-05, 'L_entropy_weight_yyx': 0.0005573098191320906, 'L_sep_weight_yyx': 1.934851198947127e-06, 'L_scale_weight_yyx': 0.0007579655010104456, 'learning_rate_yyx': 0.008736313668835078}. Best is trial 18 with value: -1.7861539220328282.
[I 2026-03-18 19:31:51,644] Trial 26 finished with value: -2.283589476791998 and parameters: {'n_layers_yyx': 1, 'hidden_size_yyx_l0': 6, 'context_size_yyx': 4, 'num_mix_components_yyx': 3, 'context_extractor_yyx': 'gru', 'activation_func_yyx': 'ReLU', 'L2_weight_yyx': 7.425499893301018e-07, 'L_entropy_weight_yyx': 9.6394984529577e-07, 'L_sep_weight_yyx': 1.5214287244606828e-07, 'L_scale_weight_yyx': 3.370922514782444e-10, 'learning_rate_yyx': 0.006843647211241475}. Best is trial 25 with value: -2.286349879513464.
[I 2026-03-18 19:31:52,320] Trial 41 pruned. 
[I 2026-03-18 19:31:52,664] Trial 40 pruned. 
[I 2026-03-18 19:31:53,110] Trial 34 pruned. 
[I 2026-03-18 19:31:58,005] Trial 43 finished with value: -2.2876348600539322 and parameters: {'n_layers_yyx': 2, 'hidden_size_yyx_l0': 4, 'hidden_size_yyx_l1': 6, 'context_size_yyx': 4, 'num_mix_components_yyx': 5, 'context_extractor_yyx': 'lstm', 'activation_func_yyx': 'Tanh', 'L2_weight_yyx': 2.810630794245061e-06, 'L_entropy_weight_yyx': 0.0002987633475873237, 'L_sep_weight_yyx': 2.7759676197024485e-07, 'L_scale_weight_yyx': 3.4442089544203514e-05, 'learning_rate_yyx': 0.0074417047685340085}. Best is trial 22 with value: -2.2897814149518054.
[I 2026-03-18 19:31:58,863] Trial 41 pruned. 
[I 2026-03-18 19:32:00,079] Trial 38 pruned. 
[I 2026-03-18 19:32:00,476] Trial 41 pruned. 
[I 2026-03-18 19:32:01,287] Trial 42 pruned. 
[I 2026-03-18 19:32:02,021] Trial 35 pruned. 
[I 2026-03-18 19:32:07,600] Trial 42 pruned. 
[I 2026-03-18 19:32:08,900] Trial 42 pruned. 
[I 2026-03-18 19:32:09,639] Trial 27 pruned. 
[I 2026-03-18 19:32:10,100] Trial 31 finished with value: -2.2120900366546126 and parameters: {'n_layers_yyx': 2, 'hidden_size_yyx_l0': 5, 'hidden_size_yyx_l1': 5, 'context_size_yyx': 3, 'num_mix_components_yyx': 5, 'context_extractor_yyx': 'lstm', 'activation_func_yyx': 'GELU', 'L2_weight_yyx': 2.002424092580537e-08, 'L_entropy_weight_yyx': 2.5565274115567505e-07, 'L_sep_weight_yyx': 9.179968500002943e-06, 'L_scale_weight_yyx': 7.92438250680544e-09, 'learning_rate_yyx': 0.009742361762186336}. Best is trial 12 with value: -2.2168161654612635.
[I 2026-03-18 19:32:10,101] Trial 43 pruned. 
[I 2026-03-18 19:32:14,031] Trial 43 pruned. 
[I 2026-03-18 19:32:28,183] Trial 43 pruned. 
[I 2026-03-18 19:32:30,167] Trial 44 pruned. 
[I 2026-03-18 19:32:30,662] Trial 40 finished with value: -2.2849710378098225 and parameters: {'n_layers_yyx': 2, 'hidden_size_yyx_l0': 2, 'hidden_size_yyx_l1': 5, 'context_size_yyx': 4, 'num_mix_components_yyx': 3, 'context_extractor_yyx': 'lstm', 'activation_func_yyx': 'GELU', 'L2_weight_yyx': 3.551042571190412e-10, 'L_entropy_weight_yyx': 4.568905757746234e-07, 'L_sep_weight_yyx': 1.7123603346681518e-07, 'L_scale_weight_yyx': 1.748956681970138e-08, 'learning_rate_yyx': 0.005154686374495884}. Best is trial 38 with value: -2.287633037216952.
[I 2026-03-18 19:32:39,419] Trial 41 pruned. 
[I 2026-03-18 19:32:48,116] Trial 45 pruned. 
[I 2026-03-18 19:32:52,039] Trial 43 pruned. 
[I 2026-03-18 19:32:54,886] Trial 33 finished with value: -2.27196295819852 and parameters: {'n_layers_yyx': 2, 'hidden_size_yyx_l0': 3, 'hidden_size_yyx_l1': 6, 'context_size_yyx': 4, 'num_mix_components_yyx': 3, 'context_extractor_yyx': 'lstm', 'activation_func_yyx': 'GELU', 'L2_weight_yyx': 5.83757537153861e-10, 'L_entropy_weight_yyx': 1.3768523152618635e-10, 'L_sep_weight_yyx': 0.0001805141605909507, 'L_scale_weight_yyx': 2.325783614626824e-08, 'learning_rate_yyx': 0.008359389975594352}. Best is trial 31 with value: -2.2773129352235233.
[I 2026-03-18 19:32:55,352] Trial 36 finished with value: -2.2540352974923894 and parameters: {'n_layers_yyx': 2, 'hidden_size_yyx_l0': 5, 'hidden_size_yyx_l1': 4, 'context_size_yyx': 1, 'num_mix_components_yyx': 5, 'context_extractor_yyx': 'lstm', 'activation_func_yyx': 'Tanh', 'L2_weight_yyx': 2.3687640290890855e-08, 'L_entropy_weight_yyx': 4.2454555988390287e-05, 'L_sep_weight_yyx': 9.242645415087162e-09, 'L_scale_weight_yyx': 8.704601810055684e-05, 'learning_rate_yyx': 0.009902504186122384}. Best is trial 21 with value: -2.2734326463096424.
[I 2026-03-18 19:32:55,737] Trial 32 pruned. 
[I 2026-03-18 19:32:56,482] Trial 28 pruned. 
[I 2026-03-18 19:32:58,937] Trial 44 pruned. 
[I 2026-03-18 19:32:58,957] Trial 44 pruned. 
[I 2026-03-18 19:32:59,708] Trial 42 pruned. 
[I 2026-03-18 19:33:06,668] Trial 45 pruned. 
[I 2026-03-18 19:33:07,151] Trial 43 pruned. 
[I 2026-03-18 19:33:07,883] Trial 35 finished with value: -2.278882881739291 and parameters: {'n_layers_yyx': 2, 'hidden_size_yyx_l0': 3, 'hidden_size_yyx_l1': 6, 'context_size_yyx': 4, 'num_mix_components_yyx': 5, 'context_extractor_yyx': 'gru', 'activation_func_yyx': 'GELU', 'L2_weight_yyx': 2.250369839722716e-05, 'L_entropy_weight_yyx': 4.754054596716289e-05, 'L_sep_weight_yyx': 5.42630081405685e-07, 'L_scale_weight_yyx': 1.9688615982930104e-05, 'learning_rate_yyx': 0.00817796858894747}. Best is trial 32 with value: -2.283618801160143.
[I 2026-03-18 19:33:11,694] Trial 44 pruned. 
[I 2026-03-18 19:33:12,979] Trial 33 pruned. 
[I 2026-03-18 19:33:14,108] Trial 46 pruned. 
[I 2026-03-18 19:33:14,145] Trial 29 pruned. 
[I 2026-03-18 19:33:15,438] Trial 45 pruned. 
[I 2026-03-18 19:33:15,882] Trial 36 pruned. 
[I 2026-03-18 19:33:23,372] Trial 44 pruned. 
[I 2026-03-18 19:33:25,232] Trial 42 pruned. 
[I 2026-03-18 19:33:30,827] Trial 45 pruned. 
[I 2026-03-18 19:33:30,890] Trial 46 pruned. 
[I 2026-03-18 19:33:31,286] Trial 34 pruned. 
[I 2026-03-18 19:33:31,683] Trial 30 pruned. 
[I 2026-03-18 19:33:34,628] Trial 46 pruned. 
[I 2026-03-18 19:33:36,410] Trial 39 pruned. 
[I 2026-03-18 19:33:37,149] Trial 44 finished with value: -2.2887490318046204 and parameters: {'n_layers_yyx': 2, 'hidden_size_yyx_l0': 4, 'hidden_size_yyx_l1': 6, 'context_size_yyx': 4, 'num_mix_components_yyx': 5, 'context_extractor_yyx': 'lstm', 'activation_func_yyx': 'Tanh', 'L2_weight_yyx': 4.014035280729742e-06, 'L_entropy_weight_yyx': 0.0002988451917546314, 'L_sep_weight_yyx': 1.260772346936501e-08, 'L_scale_weight_yyx': 0.00019619380008195815, 'learning_rate_yyx': 0.00853783216446163}. Best is trial 22 with value: -2.2897814149518054.
[I 2026-03-18 19:33:38,834] Trial 47 pruned. 
[I 2026-03-18 19:33:39,012] Trial 35 pruned. 
[I 2026-03-18 19:33:41,431] Trial 37 pruned. 
[I 2026-03-18 19:33:42,827] Trial 43 pruned. 
[I 2026-03-18 19:33:50,879] Trial 47 pruned. 
[I 2026-03-18 19:33:52,671] Trial 48 pruned. 
[I 2026-03-18 19:33:55,425] Trial 45 pruned. 
[I 2026-03-18 19:33:57,756] Trial 48 pruned. 
[I 2026-03-18 19:33:58,720] Trial 38 pruned. 
[I 2026-03-18 19:34:06,272] Trial 39 pruned. 
[I 2026-03-18 19:34:09,961] Trial 49 pruned. 

Source events: 12731
Target events: 32635
Full model ln_yyx : 1369.82349 nats/sec, 37.77666 nats/event
Full model Log loss : -1.76006
Full model ln_yyx : 1383.44985 nats/sec, 38.15244 nats/event
Full model Log loss : -1.76150
Full model ln_yyx : 1407.82901 nats/sec, 38.82476 nats/event
Full model Log loss : -1.78451
Full model ln_yyx : 1388.08232 nats/sec, 38.28019 nats/event
Full model Log loss : -1.77820
Full model ln_yyx : 1376.40728 nats/sec, 37.95822 nats/event
Full model Log loss : -1.75471
Full model ln_yyx : 1373.86419 nats/sec, 37.88809 nats/event
Full model Log loss : -1.72597
Full model ln_yyx : 1410.76787 nats/sec, 38.90581 nats/event
Full model Log loss : -1.78124
Full model ln_yyx : 1399.26438 nats/sec, 38.58857 nats/event
Full model Log loss : -1.78369
Full model ln_yyx : 1404.01870 nats/sec, 38.71968 nats/event
Full model Log loss : -1.78308
Full model ln_yyx : 1404.71274 nats/sec, 38.73882 nats/event
Full model Log loss : -1.78293
Full model ln_yyx : 1409.98399 nats/sec, 38.88419 nats/event
Full model Log loss : -1.78247
Full model ln_yyx : 1395.81794 nats/sec, 38.49352 nats/event
Full model Log loss : -1.78447
Full model ln_yyx : 1407.48453 nats/sec, 38.81526 nats/event
Full model Log loss : -1.78440
Optimization finished. Config saved to results/opt-full/opt_full_223_best_config.txt
[I 2026-03-18 19:34:11,992] Trial 46 pruned. 
[I 2026-03-18 19:34:12,042] Trial 39 pruned. 
[I 2026-03-18 19:34:15,235] Trial 40 pruned. 
[I 2026-03-18 19:34:16,818] Trial 49 pruned. 

Source events: 20800
Target events: 3828
Full model ln_yyx : 314.35175 nats/sec, 73.90715 nats/event
Full model Log loss : -2.25964
Full model ln_yyx : 315.65957 nats/sec, 74.21463 nats/event
Full model Log loss : -2.26334
Full model ln_yyx : 316.57595 nats/sec, 74.43008 nats/event
Full model Log loss : -2.26813
Full model ln_yyx : 316.72119 nats/sec, 74.46423 nats/event
Full model Log loss : -2.25774
Full model ln_yyx : 315.94113 nats/sec, 74.28083 nats/event
Full model Log loss : -2.27061
Full model ln_yyx : 318.64809 nats/sec, 74.91726 nats/event
Full model Log loss : -2.26814
Full model ln_yyx : 314.93033 nats/sec, 74.04318 nats/event
Full model Log loss : -2.25785
Full model ln_yyx : 315.16095 nats/sec, 74.09740 nats/event
Full model Log loss : -2.26995
Full model ln_yyx : 315.69517 nats/sec, 74.22300 nats/event
Full model Log loss : -2.27356
Full model ln_yyx : 313.31187 nats/sec, 73.66266 nats/event
Full model Log loss : -2.25206
Full model ln_yyx : 318.09040 nats/sec, 74.78614 nats/event
Full model Log loss : -2.27701
Optimization finished. Config saved to results/opt-full/opt_full_207_best_config.txt
[I 2026-03-18 19:34:19,613] Trial 47 pruned. 
[I 2026-03-18 19:34:26,274] Trial 48 pruned. 
[I 2026-03-18 19:34:32,865] Trial 41 pruned. 
