[I 2026-03-18 22:19:39,962] Trial 30 finished with value: -2.4892611902818076 and parameters: {'n_layers_yyx': 2, 'hidden_size_yyx_l0': 4, 'hidden_size_yyx_l1': 5, 'context_size_yyx': 3, 'num_mix_components_yyx': 3, 'context_extractor_yyx': 'lstm', 'activation_func_yyx': 'Tanh', 'L2_weight_yyx': 6.573947322433701e-05, 'L_entropy_weight_yyx': 0.0006378874631615939, 'L_sep_weight_yyx': 2.650596561994054e-08, 'L_scale_weight_yyx': 6.062092467377187e-08, 'learning_rate_yyx': 0.0061155385151905745}. Best is trial 4 with value: -2.49523174750643.
[I 2026-03-18 22:19:40,274] Trial 45 pruned. 
[I 2026-03-18 22:19:40,739] Trial 41 pruned. 
[I 2026-03-18 22:19:41,361] Trial 51 pruned. 
[I 2026-03-18 22:19:43,925] Trial 41 pruned. 
[I 2026-03-18 22:19:44,813] Trial 53 finished with value: -2.472607612777439 and parameters: {'n_layers_yyx': 1, 'hidden_size_yyx_l0': 6, 'context_size_yyx': 3, 'num_mix_components_yyx': 5, 'context_extractor_yyx': 'gru', 'activation_func_yyx': 'ReLU', 'L2_weight_yyx': 2.88247895047464e-07, 'L_entropy_weight_yyx': 3.261511667943039e-08, 'L_sep_weight_yyx': 2.544570048978092e-07, 'L_scale_weight_yyx': 0.00018883208915314396, 'learning_rate_yyx': 0.009892118064882034}. Best is trial 25 with value: -2.4764732316599813.
[I 2026-03-18 22:19:47,005] Trial 43 pruned. 
[I 2026-03-18 22:19:48,408] Trial 52 pruned. 
[I 2026-03-18 22:19:55,465] Trial 27 pruned. 
[I 2026-03-18 22:19:56,021] Trial 31 pruned. 
[I 2026-03-18 22:19:56,311] Trial 41 pruned. 
[I 2026-03-18 22:19:56,934] Trial 45 finished with value: -1.4564744215745193 and parameters: {'n_layers_yyx': 1, 'hidden_size_yyx_l0': 4, 'context_size_yyx': 4, 'num_mix_components_yyx': 5, 'context_extractor_yyx': 'gru', 'activation_func_yyx': 'Tanh', 'L2_weight_yyx': 5.24848440380492e-07, 'L_entropy_weight_yyx': 2.279600471234158e-06, 'L_sep_weight_yyx': 5.073149157548812e-10, 'L_scale_weight_yyx': 2.334076980193822e-08, 'learning_rate_yyx': 0.00810935822017376}. Best is trial 29 with value: -1.4683670278695913.
[I 2026-03-18 22:19:59,872] Trial 42 pruned. 
[I 2026-03-18 22:20:01,166] Trial 55 finished with value: -1.480258804071145 and parameters: {'n_layers_yyx': 1, 'hidden_size_yyx_l0': 5, 'context_size_yyx': 4, 'num_mix_components_yyx': 4, 'context_extractor_yyx': 'lstm', 'activation_func_yyx': 'ReLU', 'L2_weight_yyx': 1.633463989079786e-10, 'L_entropy_weight_yyx': 7.5925798056749e-10, 'L_sep_weight_yyx': 4.279222437986908e-05, 'L_scale_weight_yyx': 1.6349395205905186e-08, 'learning_rate_yyx': 0.007672994023637117}. Best is trial 0 with value: -1.5190498727266906.
[I 2026-03-18 22:20:02,014] Trial 55 finished with value: -1.4324410071739784 and parameters: {'n_layers_yyx': 2, 'hidden_size_yyx_l0': 6, 'hidden_size_yyx_l1': 6, 'context_size_yyx': 3, 'num_mix_components_yyx': 4, 'context_extractor_yyx': 'lstm', 'activation_func_yyx': 'Tanh', 'L2_weight_yyx': 0.0009524050397587358, 'L_entropy_weight_yyx': 6.5237435353070434e-09, 'L_sep_weight_yyx': 0.0005560937159364052, 'L_scale_weight_yyx': 2.675903214258918e-08, 'learning_rate_yyx': 0.008454142023643432}. Best is trial 32 with value: -1.4672450138972355.
[I 2026-03-18 22:20:02,115] Trial 42 pruned. 
[I 2026-03-18 22:20:03,290] Trial 34 finished with value: -1.4114558762770433 and parameters: {'n_layers_yyx': 1, 'hidden_size_yyx_l0': 6, 'context_size_yyx': 4, 'num_mix_components_yyx': 3, 'context_extractor_yyx': 'lstm', 'activation_func_yyx': 'ReLU', 'L2_weight_yyx': 2.40379952845957e-06, 'L_entropy_weight_yyx': 1.082314033996324e-10, 'L_sep_weight_yyx': 7.871193158521525e-09, 'L_scale_weight_yyx': 0.0003097123386760616, 'learning_rate_yyx': 0.006155729898669729}. Best is trial 12 with value: -1.460441659780649.
[I 2026-03-18 22:20:04,475] Trial 44 pruned. 
[I 2026-03-18 22:20:04,527] Trial 53 pruned. 
[I 2026-03-18 22:20:05,910] Trial 43 pruned. 
[I 2026-03-18 22:20:06,350] Trial 43 pruned. 
[I 2026-03-18 22:20:06,640] Trial 50 finished with value: -1.379633105775845 and parameters: {'n_layers_yyx': 2, 'hidden_size_yyx_l0': 6, 'hidden_size_yyx_l1': 5, 'context_size_yyx': 4, 'num_mix_components_yyx': 3, 'context_extractor_yyx': 'gru', 'activation_func_yyx': 'ReLU', 'L2_weight_yyx': 2.1146041574091924e-05, 'L_entropy_weight_yyx': 1.6413770864858617e-08, 'L_sep_weight_yyx': 0.00018137236878682306, 'L_scale_weight_yyx': 0.00043589935312519663, 'learning_rate_yyx': 0.007153892306903029}. Best is trial 24 with value: -1.4518791534615763.
[I 2026-03-18 22:20:06,896] Trial 35 pruned. 
[I 2026-03-18 22:20:08,721] Trial 56 pruned. 
[I 2026-03-18 22:20:11,824] Trial 32 finished with value: -1.4344869760366588 and parameters: {'n_layers_yyx': 2, 'hidden_size_yyx_l0': 2, 'hidden_size_yyx_l1': 5, 'context_size_yyx': 4, 'num_mix_components_yyx': 2, 'context_extractor_yyx': 'gru', 'activation_func_yyx': 'Tanh', 'L2_weight_yyx': 0.00016977978854308912, 'L_entropy_weight_yyx': 0.00039946203967594027, 'L_sep_weight_yyx': 1.2740382947770508e-05, 'L_scale_weight_yyx': 3.717138401785737e-07, 'learning_rate_yyx': 0.005684975856238764}. Best is trial 13 with value: -1.4421805044320914.
[I 2026-03-18 22:20:12,073] Trial 42 finished with value: -1.4389837646484376 and parameters: {'n_layers_yyx': 2, 'hidden_size_yyx_l0': 3, 'hidden_size_yyx_l1': 5, 'context_size_yyx': 2, 'num_mix_components_yyx': 4, 'context_extractor_yyx': 'lstm', 'activation_func_yyx': 'Tanh', 'L2_weight_yyx': 9.43325910500542e-06, 'L_entropy_weight_yyx': 2.053525238857292e-06, 'L_sep_weight_yyx': 7.52945476607033e-09, 'L_scale_weight_yyx': 2.273943992619589e-09, 'learning_rate_yyx': 0.009804321227947029}. Best is trial 32 with value: -1.4612882173978365.
[I 2026-03-18 22:20:13,733] Trial 51 pruned. 
[I 2026-03-18 22:20:13,897] Trial 36 pruned. 
[I 2026-03-18 22:20:14,769] Trial 44 finished with value: -1.4539102407602162 and parameters: {'n_layers_yyx': 2, 'hidden_size_yyx_l0': 6, 'hidden_size_yyx_l1': 3, 'context_size_yyx': 4, 'num_mix_components_yyx': 4, 'context_extractor_yyx': 'lstm', 'activation_func_yyx': 'Tanh', 'L2_weight_yyx': 1.1439310042600765e-08, 'L_entropy_weight_yyx': 1.4729558969346198e-09, 'L_sep_weight_yyx': 0.00017691089604000588, 'L_scale_weight_yyx': 0.00016169189201746062, 'learning_rate_yyx': 0.00793997423671466}. Best is trial 44 with value: -1.4539102407602162.
[I 2026-03-18 22:20:16,281] Trial 57 pruned. 
[I 2026-03-18 22:20:17,300] Trial 37 pruned. 
[I 2026-03-18 22:20:18,742] Trial 56 pruned. 
[I 2026-03-18 22:20:19,433] Trial 43 pruned. 
[I 2026-03-18 22:20:20,730] Trial 52 pruned. 
[I 2026-03-18 22:20:21,293] Trial 54 pruned. 
[I 2026-03-18 22:20:21,774] Trial 38 pruned. 
[I 2026-03-18 22:20:21,964] Trial 45 pruned. 
[I 2026-03-18 22:20:23,392] Trial 44 pruned. 
[I 2026-03-18 22:20:25,015] Trial 55 pruned. 
[I 2026-03-18 22:20:25,097] Trial 44 pruned. 
[I 2026-03-18 22:20:25,857] Trial 57 pruned. 
[I 2026-03-18 22:20:29,063] Trial 46 pruned. 
[I 2026-03-18 22:20:31,620] Trial 56 pruned. 
[I 2026-03-18 22:20:33,258] Trial 58 pruned. 
[I 2026-03-18 22:20:33,937] Trial 54 finished with value: -2.4730695457371357 and parameters: {'n_layers_yyx': 1, 'hidden_size_yyx_l0': 6, 'context_size_yyx': 3, 'num_mix_components_yyx': 5, 'context_extractor_yyx': 'gru', 'activation_func_yyx': 'ReLU', 'L2_weight_yyx': 2.0290368774662172e-07, 'L_entropy_weight_yyx': 2.7275609439227922e-08, 'L_sep_weight_yyx': 3.232868830606485e-07, 'L_scale_weight_yyx': 0.0005335513047183264, 'learning_rate_yyx': 0.007547068373811991}. Best is trial 25 with value: -2.4764732316599813.
[I 2026-03-18 22:20:33,940] Trial 46 finished with value: -1.4578504122220552 and parameters: {'n_layers_yyx': 1, 'hidden_size_yyx_l0': 4, 'context_size_yyx': 4, 'num_mix_components_yyx': 5, 'context_extractor_yyx': 'gru', 'activation_func_yyx': 'Tanh', 'L2_weight_yyx': 6.867247229008508e-07, 'L_entropy_weight_yyx': 2.597555326844379e-06, 'L_sep_weight_yyx': 1.7508401462982494e-10, 'L_scale_weight_yyx': 2.611919579329532e-08, 'learning_rate_yyx': 0.008539002132306064}. Best is trial 29 with value: -1.4683670278695913.
[I 2026-03-18 22:20:34,932] Trial 57 pruned. 
[I 2026-03-18 22:20:35,968] Trial 47 pruned. 
[I 2026-03-18 22:20:36,784] Trial 59 pruned. 
[I 2026-03-18 22:20:38,075] Trial 53 pruned. 
[I 2026-03-18 22:20:39,497] Trial 39 pruned. 
[I 2026-03-18 22:20:39,705] Trial 48 pruned. 
[I 2026-03-18 22:20:40,171] Trial 60 pruned. 
[I 2026-03-18 22:20:43,845] Trial 58 finished with value: -1.3929036067082332 and parameters: {'n_layers_yyx': 2, 'hidden_size_yyx_l0': 6, 'hidden_size_yyx_l1': 5, 'context_size_yyx': 2, 'num_mix_components_yyx': 4, 'context_extractor_yyx': 'gru', 'activation_func_yyx': 'Tanh', 'L2_weight_yyx': 6.0269141297413e-08, 'L_entropy_weight_yyx': 1.4087338592900287e-08, 'L_sep_weight_yyx': 2.8917985060596302e-05, 'L_scale_weight_yyx': 1.0347691616759094e-09, 'learning_rate_yyx': 0.009956967194958649}. Best is trial 32 with value: -1.4672450138972355.
[I 2026-03-18 22:20:43,954] Trial 61 pruned. 
[I 2026-03-18 22:20:47,188] Trial 49 pruned. 
[I 2026-03-18 22:20:47,267] Trial 40 pruned. 
[I 2026-03-18 22:20:47,670] Trial 62 pruned. 
[I 2026-03-18 22:20:50,903] Trial 50 pruned. 
[I 2026-03-18 22:20:50,912] Trial 41 pruned. 
[I 2026-03-18 22:20:51,226] Trial 59 pruned. 
[I 2026-03-18 22:20:51,474] Trial 63 pruned. 
[I 2026-03-18 22:20:51,923] Trial 45 finished with value: -1.4540170522836537 and parameters: {'n_layers_yyx': 2, 'hidden_size_yyx_l0': 6, 'hidden_size_yyx_l1': 3, 'context_size_yyx': 4, 'num_mix_components_yyx': 4, 'context_extractor_yyx': 'lstm', 'activation_func_yyx': 'Tanh', 'L2_weight_yyx': 1.4382691641160464e-09, 'L_entropy_weight_yyx': 1.3568389995285492e-09, 'L_sep_weight_yyx': 0.0001671705175461347, 'L_scale_weight_yyx': 0.0001744703031071347, 'learning_rate_yyx': 0.007974349920764458}. Best is trial 45 with value: -1.4540170522836537.
[I 2026-03-18 22:20:52,091] Trial 47 pruned. 
[I 2026-03-18 22:20:52,529] Trial 55 pruned. 
[I 2026-03-18 22:20:54,496] Trial 44 pruned. 
[I 2026-03-18 22:20:54,518] Trial 51 pruned. 
[I 2026-03-18 22:20:54,808] Trial 45 finished with value: -1.418960735614483 and parameters: {'n_layers_yyx': 1, 'hidden_size_yyx_l0': 6, 'context_size_yyx': 4, 'num_mix_components_yyx': 3, 'context_extractor_yyx': 'lstm', 'activation_func_yyx': 'Tanh', 'L2_weight_yyx': 2.808480403486567e-05, 'L_entropy_weight_yyx': 0.0001357960225128584, 'L_sep_weight_yyx': 1.0567296971249504e-10, 'L_scale_weight_yyx': 9.154713483118414e-06, 'learning_rate_yyx': 0.009982792465361484}. Best is trial 7 with value: -1.4538350266676683.
[I 2026-03-18 22:20:54,930] Trial 64 pruned. 
[I 2026-03-18 22:20:55,459] Trial 54 pruned. 
[I 2026-03-18 22:20:57,906] Trial 33 finished with value: -1.4308134577824518 and parameters: {'n_layers_yyx': 2, 'hidden_size_yyx_l0': 2, 'hidden_size_yyx_l1': 5, 'context_size_yyx': 4, 'num_mix_components_yyx': 2, 'context_extractor_yyx': 'gru', 'activation_func_yyx': 'Tanh', 'L2_weight_yyx': 0.00022814747726733546, 'L_entropy_weight_yyx': 0.0003237365193892198, 'L_sep_weight_yyx': 1.040193307464784e-05, 'L_scale_weight_yyx': 1.2570016931503853e-06, 'learning_rate_yyx': 0.00785420139132888}. Best is trial 13 with value: -1.4421805044320914.
[I 2026-03-18 22:20:58,019] Trial 60 pruned. 
[I 2026-03-18 22:20:58,314] Trial 46 pruned. 
[I 2026-03-18 22:20:58,429] Trial 65 pruned. 
[I 2026-03-18 22:20:58,882] Trial 46 pruned. 
[I 2026-03-18 22:21:01,431] Trial 45 pruned. 
[I 2026-03-18 22:21:04,906] Trial 46 pruned. 
[I 2026-03-18 22:21:05,067] Trial 66 pruned. 
[I 2026-03-18 22:21:05,156] Trial 61 pruned. 
[I 2026-03-18 22:21:05,608] Trial 45 finished with value: -1.4366891714242789 and parameters: {'n_layers_yyx': 2, 'hidden_size_yyx_l0': 3, 'hidden_size_yyx_l1': 5, 'context_size_yyx': 2, 'num_mix_components_yyx': 4, 'context_extractor_yyx': 'lstm', 'activation_func_yyx': 'Tanh', 'L2_weight_yyx': 0.00011173144675728086, 'L_entropy_weight_yyx': 2.3429080140931854e-07, 'L_sep_weight_yyx': 3.275534279173265e-09, 'L_scale_weight_yyx': 9.182897681532184e-06, 'learning_rate_yyx': 0.005558849429825374}. Best is trial 32 with value: -1.4612882173978365.
[I 2026-03-18 22:21:05,612] Trial 28 finished with value: -2.4742031077214275 and parameters: {'n_layers_yyx': 2, 'hidden_size_yyx_l0': 4, 'hidden_size_yyx_l1': 6, 'context_size_yyx': 1, 'num_mix_components_yyx': 4, 'context_extractor_yyx': 'lstm', 'activation_func_yyx': 'ReLU', 'L2_weight_yyx': 4.064905258313674e-08, 'L_entropy_weight_yyx': 0.00032799901214707343, 'L_sep_weight_yyx': 4.073307551054412e-08, 'L_scale_weight_yyx': 2.553872828058986e-06, 'learning_rate_yyx': 0.006040649232098684}. Best is trial 28 with value: -2.4742031077214275.
[I 2026-03-18 22:21:05,929] Trial 47 pruned. 
[I 2026-03-18 22:21:06,427] Trial 47 pruned. 
[I 2026-03-18 22:21:06,817] Trial 58 finished with value: -1.5792045729016069 and parameters: {'n_layers_yyx': 2, 'hidden_size_yyx_l0': 5, 'hidden_size_yyx_l1': 5, 'context_size_yyx': 2, 'num_mix_components_yyx': 5, 'context_extractor_yyx': 'gru', 'activation_func_yyx': 'Tanh', 'L2_weight_yyx': 5.4152942959157974e-05, 'L_entropy_weight_yyx': 3.9495161353099224e-10, 'L_sep_weight_yyx': 4.894317824407834e-07, 'L_scale_weight_yyx': 5.302898317245125e-07, 'learning_rate_yyx': 0.009192077911244668}. Best is trial 26 with value: -1.584650032885134.
[I 2026-03-18 22:21:06,961] Trial 32 finished with value: -2.4932584176797206 and parameters: {'n_layers_yyx': 1, 'hidden_size_yyx_l0': 6, 'context_size_yyx': 4, 'num_mix_components_yyx': 5, 'context_extractor_yyx': 'gru', 'activation_func_yyx': 'GELU', 'L2_weight_yyx': 2.738359199213135e-09, 'L_entropy_weight_yyx': 0.0003285684278916151, 'L_sep_weight_yyx': 1.0817804983692989e-10, 'L_scale_weight_yyx': 7.214205596426418e-07, 'learning_rate_yyx': 0.0076078324743902755}. Best is trial 4 with value: -2.49523174750643.
[I 2026-03-18 22:21:09,466] Trial 46 pruned. 
[I 2026-03-18 22:21:09,768] Trial 48 pruned. 
[I 2026-03-18 22:21:10,053] Trial 48 pruned. 
[I 2026-03-18 22:21:10,177] Trial 56 pruned. 
[I 2026-03-18 22:21:11,236] Trial 52 pruned. 
[I 2026-03-18 22:21:11,828] Trial 47 pruned. 
[I 2026-03-18 22:21:12,085] Trial 55 pruned. 
[I 2026-03-18 22:21:13,151] Trial 47 pruned. 
[I 2026-03-18 22:21:13,726] Trial 49 pruned. 
[I 2026-03-18 22:21:13,986] Trial 49 pruned. 
[I 2026-03-18 22:21:15,353] Trial 48 pruned. 
[I 2026-03-18 22:21:18,001] Trial 57 pruned. 
[I 2026-03-18 22:21:22,058] Trial 50 pruned. 
[I 2026-03-18 22:21:22,969] Trial 49 pruned. 
[I 2026-03-18 22:21:28,958] Trial 53 pruned. 
[I 2026-03-18 22:21:28,968] Trial 42 finished with value: -1.449471200796274 and parameters: {'n_layers_yyx': 1, 'hidden_size_yyx_l0': 5, 'context_size_yyx': 4, 'num_mix_components_yyx': 4, 'context_extractor_yyx': 'lstm', 'activation_func_yyx': 'Tanh', 'L2_weight_yyx': 5.776853838320967e-10, 'L_entropy_weight_yyx': 1.4421144528957444e-10, 'L_sep_weight_yyx': 6.1892514132908195e-06, 'L_scale_weight_yyx': 0.0005221585709070995, 'learning_rate_yyx': 0.003917539604710592}. Best is trial 12 with value: -1.460441659780649.
[I 2026-03-18 22:21:29,486] Trial 56 pruned. 
[I 2026-03-18 22:21:30,499] Trial 50 pruned. 
[I 2026-03-18 22:21:31,996] Trial 48 finished with value: -1.4610194279597355 and parameters: {'n_layers_yyx': 2, 'hidden_size_yyx_l0': 4, 'hidden_size_yyx_l1': 3, 'context_size_yyx': 4, 'num_mix_components_yyx': 5, 'context_extractor_yyx': 'lstm', 'activation_func_yyx': 'Tanh', 'L2_weight_yyx': 4.8644047679623475e-09, 'L_entropy_weight_yyx': 1.9809922675116672e-10, 'L_sep_weight_yyx': 0.00011207655687701342, 'L_scale_weight_yyx': 2.923133776504649e-05, 'learning_rate_yyx': 0.008228634092167982}. Best is trial 48 with value: -1.4610194279597355.
[I 2026-03-18 22:21:32,772] Trial 57 pruned. 
[I 2026-03-18 22:21:32,946] Trial 50 pruned. 
[I 2026-03-18 22:21:33,303] Trial 62 finished with value: -1.4505547626201922 and parameters: {'n_layers_yyx': 2, 'hidden_size_yyx_l0': 6, 'hidden_size_yyx_l1': 5, 'context_size_yyx': 3, 'num_mix_components_yyx': 4, 'context_extractor_yyx': 'lstm', 'activation_func_yyx': 'Tanh', 'L2_weight_yyx': 9.8154915270176e-08, 'L_entropy_weight_yyx': 9.901253562502867e-09, 'L_sep_weight_yyx': 6.23887880048993e-05, 'L_scale_weight_yyx': 3.394073588299263e-08, 'learning_rate_yyx': 0.009743255632573515}. Best is trial 32 with value: -1.4672450138972355.
[I 2026-03-18 22:21:34,134] Trial 51 pruned. 
[I 2026-03-18 22:21:34,294] Trial 59 finished with value: -1.5706077385627502 and parameters: {'n_layers_yyx': 2, 'hidden_size_yyx_l0': 5, 'hidden_size_yyx_l1': 5, 'context_size_yyx': 2, 'num_mix_components_yyx': 5, 'context_extractor_yyx': 'gru', 'activation_func_yyx': 'Tanh', 'L2_weight_yyx': 4.9495278421413216e-05, 'L_entropy_weight_yyx': 4.0837329794055636e-10, 'L_sep_weight_yyx': 2.188315391677781e-06, 'L_scale_weight_yyx': 5.896222995338721e-07, 'learning_rate_yyx': 0.008852966187353688}. Best is trial 26 with value: -1.584650032885134.
[I 2026-03-18 22:21:36,500] Trial 43 pruned. 
[I 2026-03-18 22:21:37,173] Trial 63 pruned. 
[I 2026-03-18 22:21:40,719] Trial 51 pruned. 
[I 2026-03-18 22:21:41,587] Trial 52 pruned. 
[I 2026-03-18 22:21:45,529] Trial 34 pruned. 
[I 2026-03-18 22:21:48,569] Trial 67 finished with value: -1.5294848582783684 and parameters: {'n_layers_yyx': 1, 'hidden_size_yyx_l0': 5, 'context_size_yyx': 1, 'num_mix_components_yyx': 5, 'context_extractor_yyx': 'lstm', 'activation_func_yyx': 'Tanh', 'L2_weight_yyx': 6.010680956456034e-08, 'L_entropy_weight_yyx': 4.2797311553631924e-08, 'L_sep_weight_yyx': 1.6702686568429663e-08, 'L_scale_weight_yyx': 2.6942163045735864e-07, 'learning_rate_yyx': 0.009948298712518467}. Best is trial 67 with value: -1.5294848582783684.
[I 2026-03-18 22:21:49,925] Trial 33 pruned. 
[I 2026-03-18 22:21:50,270] Trial 58 pruned. 
[I 2026-03-18 22:21:50,314] Trial 51 finished with value: -1.448351816030649 and parameters: {'n_layers_yyx': 1, 'hidden_size_yyx_l0': 5, 'context_size_yyx': 4, 'num_mix_components_yyx': 3, 'context_extractor_yyx': 'lstm', 'activation_func_yyx': 'Tanh', 'L2_weight_yyx': 1.6167475742347395e-08, 'L_entropy_weight_yyx': 0.0004398690727365325, 'L_sep_weight_yyx': 5.361586035832908e-09, 'L_scale_weight_yyx': 2.1637788179026845e-07, 'learning_rate_yyx': 0.008888081961911182}. Best is trial 7 with value: -1.4538350266676683.
[I 2026-03-18 22:21:51,372] Trial 60 pruned. 
[I 2026-03-18 22:21:53,296] Trial 29 pruned. 
[I 2026-03-18 22:21:53,558] Trial 59 pruned. 
[I 2026-03-18 22:21:54,635] Trial 61 pruned. 
[I 2026-03-18 22:21:55,418] Trial 44 pruned. 
[I 2026-03-18 22:21:56,709] Trial 60 pruned. 
[I 2026-03-18 22:21:58,801] Trial 48 finished with value: -1.4039104755108174 and parameters: {'n_layers_yyx': 2, 'hidden_size_yyx_l0': 2, 'hidden_size_yyx_l1': 6, 'context_size_yyx': 3, 'num_mix_components_yyx': 3, 'context_extractor_yyx': 'lstm', 'activation_func_yyx': 'Tanh', 'L2_weight_yyx': 0.0006731294840878929, 'L_entropy_weight_yyx': 5.212858212432654e-07, 'L_sep_weight_yyx': 1.2402206083079248e-09, 'L_scale_weight_yyx': 2.8263210069661267e-10, 'learning_rate_yyx': 0.003086911959204414}. Best is trial 32 with value: -1.4612882173978365.
[I 2026-03-18 22:21:59,448] Trial 54 finished with value: -1.4165079439603365 and parameters: {'n_layers_yyx': 2, 'hidden_size_yyx_l0': 6, 'hidden_size_yyx_l1': 6, 'context_size_yyx': 2, 'num_mix_components_yyx': 3, 'context_extractor_yyx': 'lstm', 'activation_func_yyx': 'ReLU', 'L2_weight_yyx': 7.0953655533130165e-06, 'L_entropy_weight_yyx': 0.00032537780029139106, 'L_sep_weight_yyx': 1.8421252868111278e-06, 'L_scale_weight_yyx': 4.792121472793035e-09, 'learning_rate_yyx': 0.00714992256075161}. Best is trial 27 with value: -1.4597027822641226.
[I 2026-03-18 22:22:00,380] Trial 61 pruned. 
[I 2026-03-18 22:22:03,025] Trial 45 pruned. 
[I 2026-03-18 22:22:03,852] Trial 49 finished with value: -1.4726762272761418 and parameters: {'n_layers_yyx': 1, 'hidden_size_yyx_l0': 4, 'context_size_yyx': 4, 'num_mix_components_yyx': 5, 'context_extractor_yyx': 'lstm', 'activation_func_yyx': 'Tanh', 'L2_weight_yyx': 4.000774370933989e-10, 'L_entropy_weight_yyx': 2.088567630554434e-10, 'L_sep_weight_yyx': 9.358862745815493e-05, 'L_scale_weight_yyx': 4.493393645730873e-05, 'learning_rate_yyx': 0.005181326871169629}. Best is trial 49 with value: -1.4726762272761418.
[I 2026-03-18 22:22:05,688] Trial 68 pruned. 
[I 2026-03-18 22:22:06,658] Trial 46 pruned. 
[I 2026-03-18 22:22:07,656] Trial 50 pruned. 
[I 2026-03-18 22:22:10,734] Trial 47 pruned. 
[I 2026-03-18 22:22:12,410] Trial 69 pruned. 
[I 2026-03-18 22:22:12,781] Trial 64 finished with value: -1.4601979417067308 and parameters: {'n_layers_yyx': 2, 'hidden_size_yyx_l0': 6, 'hidden_size_yyx_l1': 5, 'context_size_yyx': 3, 'num_mix_components_yyx': 4, 'context_extractor_yyx': 'lstm', 'activation_func_yyx': 'Tanh', 'L2_weight_yyx': 4.2438529850257905e-07, 'L_entropy_weight_yyx': 2.4727188308808007e-08, 'L_sep_weight_yyx': 0.0005693921567736423, 'L_scale_weight_yyx': 1.6482400467923966e-08, 'learning_rate_yyx': 0.007194380432475705}. Best is trial 32 with value: -1.4672450138972355.
[I 2026-03-18 22:22:13,336] Trial 46 finished with value: -2.4875562296733595 and parameters: {'n_layers_yyx': 1, 'hidden_size_yyx_l0': 5, 'context_size_yyx': 4, 'num_mix_components_yyx': 3, 'context_extractor_yyx': 'gru', 'activation_func_yyx': 'ReLU', 'L2_weight_yyx': 0.0001259396735947516, 'L_entropy_weight_yyx': 3.2336816539548145e-05, 'L_sep_weight_yyx': 4.896956398971254e-06, 'L_scale_weight_yyx': 2.6375537464719626e-08, 'learning_rate_yyx': 0.005620113517098078}. Best is trial 46 with value: -2.4875562296733595.
[I 2026-03-18 22:22:14,639] Trial 48 pruned. 
[I 2026-03-18 22:22:15,459] Trial 51 pruned. 
