[I 2026-03-18 19:39:16,024] Trial 5 finished with value: -2.07374848814321 and parameters: {'n_layers_yyx': 1, 'hidden_size_yyx_l0': 5, 'context_size_yyx': 3, 'num_mix_components_yyx': 5, 'context_extractor_yyx': 'gru', 'activation_func_yyx': 'ReLU', 'L2_weight_yyx': 4.808964675332886e-09, 'L_entropy_weight_yyx': 3.908603804224037e-05, 'L_sep_weight_yyx': 1.3956884399583227e-05, 'L_scale_weight_yyx': 2.6194282187249815e-05, 'learning_rate_yyx': 0.0018088212270161398}. Best is trial 5 with value: -2.07374848814321.
[I 2026-03-18 19:39:16,057] Trial 3 finished with value: -2.082817649001067 and parameters: {'n_layers_yyx': 1, 'hidden_size_yyx_l0': 5, 'context_size_yyx': 2, 'num_mix_components_yyx': 5, 'context_extractor_yyx': 'lstm', 'activation_func_yyx': 'ReLU', 'L2_weight_yyx': 1.4573939593582474e-08, 'L_entropy_weight_yyx': 2.70871351775301e-10, 'L_sep_weight_yyx': 1.702606081485893e-10, 'L_scale_weight_yyx': 2.9595703630623933e-09, 'learning_rate_yyx': 0.0005926529653277823}. Best is trial 3 with value: -2.082817649001067.
[I 2026-03-18 19:39:19,627] Trial 7 pruned. 
[I 2026-03-18 19:39:20,839] Trial 7 pruned. 
[I 2026-03-18 19:39:27,288] Trial 4 pruned. 
[I 2026-03-18 19:39:28,177] Trial 6 finished with value: -2.0688438112869676 and parameters: {'n_layers_yyx': 1, 'hidden_size_yyx_l0': 2, 'context_size_yyx': 3, 'num_mix_components_yyx': 5, 'context_extractor_yyx': 'gru', 'activation_func_yyx': 'Tanh', 'L2_weight_yyx': 6.39628115875868e-06, 'L_entropy_weight_yyx': 4.5902564352712917e-07, 'L_sep_weight_yyx': 2.3020234830549803e-07, 'L_scale_weight_yyx': 2.7820259983971435e-10, 'learning_rate_yyx': 0.0034375077853257712}. Best is trial 1 with value: -2.0819965339546846.
[I 2026-03-18 19:39:32,457] Trial 11 finished with value: -1.64795371248471 and parameters: {'n_layers_yyx': 2, 'hidden_size_yyx_l0': 4, 'hidden_size_yyx_l1': 6, 'context_size_yyx': 4, 'num_mix_components_yyx': 5, 'context_extractor_yyx': 'gru', 'activation_func_yyx': 'ReLU', 'L2_weight_yyx': 6.61313429470079e-06, 'L_entropy_weight_yyx': 0.0007203030471072945, 'L_sep_weight_yyx': 1.1348544390910981e-10, 'L_scale_weight_yyx': 0.0008102029232067766, 'learning_rate_yyx': 0.005238301820247039}. Best is trial 10 with value: -1.6494968268544676.
[I 2026-03-18 19:39:35,432] Trial 8 finished with value: -1.638393987643513 and parameters: {'n_layers_yyx': 2, 'hidden_size_yyx_l0': 3, 'hidden_size_yyx_l1': 3, 'context_size_yyx': 3, 'num_mix_components_yyx': 3, 'context_extractor_yyx': 'lstm', 'activation_func_yyx': 'Tanh', 'L2_weight_yyx': 7.200205641039688e-05, 'L_entropy_weight_yyx': 5.4200791019173675e-06, 'L_sep_weight_yyx': 1.0716767258819926e-10, 'L_scale_weight_yyx': 3.0387415865897545e-08, 'learning_rate_yyx': 0.0015642688791203043}. Best is trial 0 with value: -1.6395011021807235.
[I 2026-03-18 19:39:36,264] Trial 7 finished with value: -1.6135808304414165 and parameters: {'n_layers_yyx': 1, 'hidden_size_yyx_l0': 6, 'context_size_yyx': 4, 'num_mix_components_yyx': 1, 'context_extractor_yyx': 'gru', 'activation_func_yyx': 'ReLU', 'L2_weight_yyx': 6.700694715736584e-07, 'L_entropy_weight_yyx': 1.762678547447968e-08, 'L_sep_weight_yyx': 6.6132072415060115e-06, 'L_scale_weight_yyx': 1.5834815858359983e-09, 'learning_rate_yyx': 0.0038170947485008317}. Best is trial 5 with value: -1.6144105896050156.
[I 2026-03-18 19:39:38,199] Trial 9 finished with value: -1.6021237324825506 and parameters: {'n_layers_yyx': 1, 'hidden_size_yyx_l0': 3, 'context_size_yyx': 4, 'num_mix_components_yyx': 1, 'context_extractor_yyx': 'lstm', 'activation_func_yyx': 'Tanh', 'L2_weight_yyx': 5.7505163582038986e-05, 'L_entropy_weight_yyx': 8.395128422964754e-06, 'L_sep_weight_yyx': 8.021986669913404e-05, 'L_scale_weight_yyx': 3.223158276817921e-08, 'learning_rate_yyx': 0.009331750882973753}. Best is trial 7 with value: -1.6077896387869492.
[I 2026-03-18 19:39:42,769] Trial 9 pruned. 
[I 2026-03-18 19:39:44,939] Trial 8 pruned. 
[I 2026-03-18 19:39:52,869] Trial 9 pruned. 
[I 2026-03-18 19:39:54,852] Trial 10 pruned. 
[I 2026-03-18 19:39:56,116] Trial 14 finished with value: -1.6123494772492941 and parameters: {'n_layers_yyx': 1, 'hidden_size_yyx_l0': 3, 'context_size_yyx': 4, 'num_mix_components_yyx': 3, 'context_extractor_yyx': 'gru', 'activation_func_yyx': 'ReLU', 'L2_weight_yyx': 1.1353482400631418e-09, 'L_entropy_weight_yyx': 3.9524770248316816e-07, 'L_sep_weight_yyx': 2.6731936651907036e-08, 'L_scale_weight_yyx': 1.3446778189734036e-07, 'learning_rate_yyx': 0.00392271172203436}. Best is trial 14 with value: -1.6123494772492941.
[I 2026-03-18 19:39:56,616] Trial 9 pruned. 
[I 2026-03-18 19:39:57,961] Trial 8 pruned. 
[I 2026-03-18 19:40:01,251] Trial 10 finished with value: -1.6132063211013619 and parameters: {'n_layers_yyx': 2, 'hidden_size_yyx_l0': 3, 'hidden_size_yyx_l1': 2, 'context_size_yyx': 3, 'num_mix_components_yyx': 2, 'context_extractor_yyx': 'gru', 'activation_func_yyx': 'Tanh', 'L2_weight_yyx': 1.191492936400381e-10, 'L_entropy_weight_yyx': 2.0437582419857688e-08, 'L_sep_weight_yyx': 0.0006329940121465457, 'L_scale_weight_yyx': 2.2257629472563705e-06, 'learning_rate_yyx': 0.00954554912783596}. Best is trial 8 with value: -1.6134523538702668.
[I 2026-03-18 19:40:06,524] Trial 11 pruned. 
[I 2026-03-18 19:40:06,526] Trial 10 pruned. 
[I 2026-03-18 19:40:11,299] Trial 14 pruned. 
[I 2026-03-18 19:40:12,062] Trial 8 pruned. 
[I 2026-03-18 19:40:18,076] Trial 12 pruned. 
[I 2026-03-18 19:40:22,825] Trial 5 finished with value: -2.086789821963253 and parameters: {'n_layers_yyx': 1, 'hidden_size_yyx_l0': 4, 'context_size_yyx': 3, 'num_mix_components_yyx': 5, 'context_extractor_yyx': 'lstm', 'activation_func_yyx': 'Tanh', 'L2_weight_yyx': 9.63419807369915e-08, 'L_entropy_weight_yyx': 2.3869921533219906e-05, 'L_sep_weight_yyx': 1.700848206488574e-08, 'L_scale_weight_yyx': 0.00017717419059738108, 'learning_rate_yyx': 0.0031757465147948397}. Best is trial 5 with value: -2.086789821963253.
[I 2026-03-18 19:40:22,939] Trial 7 finished with value: -2.0922062983671923 and parameters: {'n_layers_yyx': 1, 'hidden_size_yyx_l0': 4, 'context_size_yyx': 2, 'num_mix_components_yyx': 4, 'context_extractor_yyx': 'gru', 'activation_func_yyx': 'Tanh', 'L2_weight_yyx': 1.8386641382857984e-05, 'L_entropy_weight_yyx': 1.5415135709533901e-09, 'L_sep_weight_yyx': 3.802089985596197e-05, 'L_scale_weight_yyx': 0.0001729321113829242, 'learning_rate_yyx': 0.00790822496431476}. Best is trial 7 with value: -2.0922062983671923.
[I 2026-03-18 19:40:24,475] Trial 9 pruned. 
[I 2026-03-18 19:40:24,944] Trial 15 pruned. 
[I 2026-03-18 19:40:26,510] Trial 5 finished with value: -2.0797241575842462 and parameters: {'n_layers_yyx': 2, 'hidden_size_yyx_l0': 2, 'hidden_size_yyx_l1': 2, 'context_size_yyx': 4, 'num_mix_components_yyx': 4, 'context_extractor_yyx': 'gru', 'activation_func_yyx': 'ReLU', 'L2_weight_yyx': 5.768921526473487e-07, 'L_entropy_weight_yyx': 5.987291134273906e-07, 'L_sep_weight_yyx': 3.7216764798983934e-06, 'L_scale_weight_yyx': 4.8444223179807554e-08, 'learning_rate_yyx': 0.004532705789411308}. Best is trial 0 with value: -2.0940855781262293.
[I 2026-03-18 19:40:31,225] Trial 11 finished with value: -2.095823093975788 and parameters: {'n_layers_yyx': 1, 'hidden_size_yyx_l0': 4, 'context_size_yyx': 4, 'num_mix_components_yyx': 5, 'context_extractor_yyx': 'lstm', 'activation_func_yyx': 'Tanh', 'L2_weight_yyx': 2.043085842224386e-08, 'L_entropy_weight_yyx': 2.913093111125666e-08, 'L_sep_weight_yyx': 5.261325153707595e-09, 'L_scale_weight_yyx': 1.46333567746989e-10, 'learning_rate_yyx': 0.009626003254027026}. Best is trial 11 with value: -2.095823093975788.
[I 2026-03-18 19:40:31,226] Trial 11 pruned. 
[I 2026-03-18 19:40:31,852] Trial 6 pruned. 
[I 2026-03-18 19:40:33,848] Trial 8 pruned. 
[I 2026-03-18 19:40:34,729] Trial 10 finished with value: -2.085590097553703 and parameters: {'n_layers_yyx': 1, 'hidden_size_yyx_l0': 6, 'context_size_yyx': 4, 'num_mix_components_yyx': 5, 'context_extractor_yyx': 'lstm', 'activation_func_yyx': 'ReLU', 'L2_weight_yyx': 1.2178299817123823e-10, 'L_entropy_weight_yyx': 8.627370549972165e-09, 'L_sep_weight_yyx': 1.547737152441152e-05, 'L_scale_weight_yyx': 0.0009708722590373918, 'learning_rate_yyx': 0.009857596532160645}. Best is trial 10 with value: -2.085590097553703.
[I 2026-03-18 19:40:42,422] Trial 12 pruned. 
[I 2026-03-18 19:40:48,567] Trial 6 pruned. 
[I 2026-03-18 19:40:50,173] Trial 13 pruned. 
[I 2026-03-18 19:40:58,394] Trial 7 pruned. 
[I 2026-03-18 19:41:00,455] Trial 14 pruned. 
[I 2026-03-18 19:41:23,213] Trial 9 finished with value: -1.5893878514414028 and parameters: {'n_layers_yyx': 2, 'hidden_size_yyx_l0': 5, 'hidden_size_yyx_l1': 6, 'context_size_yyx': 1, 'num_mix_components_yyx': 1, 'context_extractor_yyx': 'lstm', 'activation_func_yyx': 'ReLU', 'L2_weight_yyx': 1.2520259169592876e-05, 'L_entropy_weight_yyx': 4.049109577723724e-05, 'L_sep_weight_yyx': 7.938380189190345e-06, 'L_scale_weight_yyx': 3.63681125796195e-05, 'learning_rate_yyx': 0.009673001763275948}. Best is trial 3 with value: -1.6104712811479323.
[I 2026-03-18 19:41:24,744] Trial 6 finished with value: -1.5768649132511487 and parameters: {'n_layers_yyx': 2, 'hidden_size_yyx_l0': 4, 'hidden_size_yyx_l1': 2, 'context_size_yyx': 4, 'num_mix_components_yyx': 3, 'context_extractor_yyx': 'lstm', 'activation_func_yyx': 'GELU', 'L2_weight_yyx': 5.050438631959267e-05, 'L_entropy_weight_yyx': 0.00010517524275942053, 'L_sep_weight_yyx': 7.83595940905958e-06, 'L_scale_weight_yyx': 7.196876454332859e-10, 'learning_rate_yyx': 0.0015899132463516115}. Best is trial 0 with value: -1.613474194617056.
[I 2026-03-18 19:41:46,662] Trial 10 pruned. 
[I 2026-03-18 19:41:52,094] Trial 8 pruned. 
[I 2026-03-18 19:41:55,308] Trial 11 pruned. 
[I 2026-03-18 19:41:56,892] Trial 5 finished with value: -2.0800588714618815 and parameters: {'n_layers_yyx': 2, 'hidden_size_yyx_l0': 3, 'hidden_size_yyx_l1': 5, 'context_size_yyx': 4, 'num_mix_components_yyx': 1, 'context_extractor_yyx': 'gru', 'activation_func_yyx': 'ReLU', 'L2_weight_yyx': 4.061223837097153e-05, 'L_entropy_weight_yyx': 2.5268482172075133e-08, 'L_sep_weight_yyx': 2.513894584377164e-09, 'L_scale_weight_yyx': 0.00013451199630185262, 'learning_rate_yyx': 0.005170155925195742}. Best is trial 3 with value: -2.082817649001067.
[I 2026-03-18 19:41:56,895] Trial 12 finished with value: -1.6531010225123595 and parameters: {'n_layers_yyx': 2, 'hidden_size_yyx_l0': 4, 'hidden_size_yyx_l1': 4, 'context_size_yyx': 4, 'num_mix_components_yyx': 5, 'context_extractor_yyx': 'gru', 'activation_func_yyx': 'ReLU', 'L2_weight_yyx': 3.4430526449578717e-06, 'L_entropy_weight_yyx': 0.0008604794416870042, 'L_sep_weight_yyx': 1.0676272393845264e-10, 'L_scale_weight_yyx': 0.0008231312820910485, 'learning_rate_yyx': 0.004609907301919657}. Best is trial 12 with value: -1.6531010225123595.
[I 2026-03-18 19:41:58,491] Trial 8 pruned. 
[I 2026-03-18 19:42:02,479] Trial 9 pruned. 
[I 2026-03-18 19:42:05,157] Trial 12 pruned. 
[I 2026-03-18 19:42:06,273] Trial 6 finished with value: -2.0790188514889616 and parameters: {'n_layers_yyx': 2, 'hidden_size_yyx_l0': 4, 'hidden_size_yyx_l1': 5, 'context_size_yyx': 3, 'num_mix_components_yyx': 5, 'context_extractor_yyx': 'gru', 'activation_func_yyx': 'GELU', 'L2_weight_yyx': 0.0001328127100451527, 'L_entropy_weight_yyx': 0.00026454282969267306, 'L_sep_weight_yyx': 1.4991248841942264e-06, 'L_scale_weight_yyx': 9.589693904302543e-10, 'learning_rate_yyx': 0.006499502934729562}. Best is trial 6 with value: -2.0790188514889616.
[I 2026-03-18 19:42:07,809] Trial 9 pruned. 
[I 2026-03-18 19:42:16,085] Trial 13 pruned. 
[I 2026-03-18 19:42:16,090] Trial 13 pruned. 
[I 2026-03-18 19:42:17,199] Trial 7 pruned. 
[I 2026-03-18 19:42:19,687] Trial 11 finished with value: -2.0855603441475665 and parameters: {'n_layers_yyx': 1, 'hidden_size_yyx_l0': 6, 'context_size_yyx': 4, 'num_mix_components_yyx': 5, 'context_extractor_yyx': 'lstm', 'activation_func_yyx': 'ReLU', 'L2_weight_yyx': 1.2832884751924166e-10, 'L_entropy_weight_yyx': 4.954921686233025e-09, 'L_sep_weight_yyx': 2.9289622696231072e-05, 'L_scale_weight_yyx': 0.0009138277603605496, 'learning_rate_yyx': 0.009703657430812623}. Best is trial 10 with value: -2.085590097553703.
[I 2026-03-18 19:42:25,816] Trial 14 pruned. 
[I 2026-03-18 19:42:28,048] Trial 8 pruned. 
[I 2026-03-18 19:42:31,094] Trial 10 pruned. 
[I 2026-03-18 19:42:31,922] Trial 8 finished with value: -1.6281780431088846 and parameters: {'n_layers_yyx': 2, 'hidden_size_yyx_l0': 2, 'hidden_size_yyx_l1': 4, 'context_size_yyx': 4, 'num_mix_components_yyx': 4, 'context_extractor_yyx': 'lstm', 'activation_func_yyx': 'GELU', 'L2_weight_yyx': 1.380847342948724e-07, 'L_entropy_weight_yyx': 2.0016024743877906e-09, 'L_sep_weight_yyx': 7.938458928971566e-07, 'L_scale_weight_yyx': 0.0005326040574729044, 'learning_rate_yyx': 0.0016355468476341142}. Best is trial 3 with value: -1.6307942617099915.
[I 2026-03-18 19:42:37,501] Trial 15 finished with value: -1.6081928155187803 and parameters: {'n_layers_yyx': 1, 'hidden_size_yyx_l0': 6, 'context_size_yyx': 4, 'num_mix_components_yyx': 2, 'context_extractor_yyx': 'gru', 'activation_func_yyx': 'ReLU', 'L2_weight_yyx': 2.586240188971915e-08, 'L_entropy_weight_yyx': 9.925231583453876e-07, 'L_sep_weight_yyx': 1.4429153770002039e-06, 'L_scale_weight_yyx': 1.502066230487957e-08, 'learning_rate_yyx': 0.005026494342838548}. Best is trial 5 with value: -1.6144105896050156.
[I 2026-03-18 19:42:42,699] Trial 15 finished with value: -1.6109435197206807 and parameters: {'n_layers_yyx': 1, 'hidden_size_yyx_l0': 3, 'context_size_yyx': 4, 'num_mix_components_yyx': 3, 'context_extractor_yyx': 'gru', 'activation_func_yyx': 'ReLU', 'L2_weight_yyx': 2.3140155411774257e-09, 'L_entropy_weight_yyx': 8.378712914142474e-07, 'L_sep_weight_yyx': 2.978596372457418e-08, 'L_scale_weight_yyx': 1.4786359089495974e-07, 'learning_rate_yyx': 0.007205582327626116}. Best is trial 14 with value: -1.6123494772492941.
[I 2026-03-18 19:42:48,473] Trial 15 pruned. 
[I 2026-03-18 19:42:50,543] Trial 9 pruned. 
[I 2026-03-18 19:42:52,651] Trial 7 finished with value: -1.6120685749712826 and parameters: {'n_layers_yyx': 2, 'hidden_size_yyx_l0': 6, 'hidden_size_yyx_l1': 4, 'context_size_yyx': 2, 'num_mix_components_yyx': 4, 'context_extractor_yyx': 'lstm', 'activation_func_yyx': 'ReLU', 'L2_weight_yyx': 1.1560532593447555e-06, 'L_entropy_weight_yyx': 1.397892383672583e-07, 'L_sep_weight_yyx': 1.1343738757683314e-07, 'L_scale_weight_yyx': 1.0793612753508702e-09, 'learning_rate_yyx': 0.0012560210768961806}. Best is trial 2 with value: -1.6133203092563246.
[I 2026-03-18 19:42:53,968] Trial 10 pruned. 
[I 2026-03-18 19:42:54,792] Trial 16 pruned. 
[I 2026-03-18 19:42:56,381] Trial 11 finished with value: -1.6131160252911523 and parameters: {'n_layers_yyx': 2, 'hidden_size_yyx_l0': 3, 'hidden_size_yyx_l1': 2, 'context_size_yyx': 3, 'num_mix_components_yyx': 2, 'context_extractor_yyx': 'gru', 'activation_func_yyx': 'Tanh', 'L2_weight_yyx': 1.015249194532586e-10, 'L_entropy_weight_yyx': 1.8345000234730912e-08, 'L_sep_weight_yyx': 0.0004523921887640619, 'L_scale_weight_yyx': 2.42610389194793e-06, 'learning_rate_yyx': 0.009915156709433093}. Best is trial 8 with value: -1.6134523538702668.
[I 2026-03-18 19:42:58,299] Trial 16 pruned. 
[I 2026-03-18 19:43:01,076] Trial 16 pruned. 
[I 2026-03-18 19:43:04,171] Trial 16 finished with value: -2.0394322278331205 and parameters: {'n_layers_yyx': 1, 'hidden_size_yyx_l0': 4, 'context_size_yyx': 3, 'num_mix_components_yyx': 1, 'context_extractor_yyx': 'gru', 'activation_func_yyx': 'ReLU', 'L2_weight_yyx': 3.5167939793766935e-09, 'L_entropy_weight_yyx': 5.4153546263197274e-08, 'L_sep_weight_yyx': 2.227459033628949e-05, 'L_scale_weight_yyx': 2.783370430873943e-09, 'learning_rate_yyx': 0.005789364720453494}. Best is trial 2 with value: -2.059868681386501.
[I 2026-03-18 19:43:06,194] Trial 12 finished with value: -2.0961440394215396 and parameters: {'n_layers_yyx': 1, 'hidden_size_yyx_l0': 4, 'context_size_yyx': 4, 'num_mix_components_yyx': 4, 'context_extractor_yyx': 'lstm', 'activation_func_yyx': 'Tanh', 'L2_weight_yyx': 4.016058346437981e-08, 'L_entropy_weight_yyx': 3.940065156031846e-08, 'L_sep_weight_yyx': 9.002892077681658e-09, 'L_scale_weight_yyx': 1.8308261223098573e-10, 'learning_rate_yyx': 0.009182858026102478}. Best is trial 12 with value: -2.0961440394215396.
[I 2026-03-18 19:43:10,392] Trial 8 finished with value: -2.0851807543284644 and parameters: {'n_layers_yyx': 2, 'hidden_size_yyx_l0': 5, 'hidden_size_yyx_l1': 6, 'context_size_yyx': 3, 'num_mix_components_yyx': 2, 'context_extractor_yyx': 'lstm', 'activation_func_yyx': 'ReLU', 'L2_weight_yyx': 9.722724412475494e-09, 'L_entropy_weight_yyx': 1.216872513396122e-10, 'L_sep_weight_yyx': 1.1277090767190491e-08, 'L_scale_weight_yyx': 2.5241058056430185e-05, 'learning_rate_yyx': 0.0014473442620559387}. Best is trial 8 with value: -2.0851807543284644.
[I 2026-03-18 19:43:12,262] Trial 17 pruned. 
[I 2026-03-18 19:43:14,596] Trial 11 pruned. 
[I 2026-03-18 19:43:14,997] Trial 17 pruned. 
[I 2026-03-18 19:43:15,794] Trial 13 finished with value: -1.640321681328409 and parameters: {'n_layers_yyx': 2, 'hidden_size_yyx_l0': 3, 'hidden_size_yyx_l1': 3, 'context_size_yyx': 3, 'num_mix_components_yyx': 4, 'context_extractor_yyx': 'gru', 'activation_func_yyx': 'Tanh', 'L2_weight_yyx': 2.6992262269542365e-05, 'L_entropy_weight_yyx': 3.045469817606596e-06, 'L_sep_weight_yyx': 8.447801225158105e-06, 'L_scale_weight_yyx': 6.585890992250749e-10, 'learning_rate_yyx': 0.004479226103322093}. Best is trial 13 with value: -1.640321681328409.
[I 2026-03-18 19:43:15,874] Trial 17 pruned. 
[I 2026-03-18 19:43:17,826] Trial 13 finished with value: -1.5802027870676898 and parameters: {'n_layers_yyx': 1, 'hidden_size_yyx_l0': 2, 'context_size_yyx': 1, 'num_mix_components_yyx': 2, 'context_extractor_yyx': 'lstm', 'activation_func_yyx': 'Tanh', 'L2_weight_yyx': 2.412144773894559e-05, 'L_entropy_weight_yyx': 0.0009403276759636433, 'L_sep_weight_yyx': 5.453205392884507e-06, 'L_scale_weight_yyx': 1.2540316854606741e-05, 'learning_rate_yyx': 0.0015604623047932628}. Best is trial 1 with value: -1.6113757535901372.
[I 2026-03-18 19:43:18,546] Trial 7 pruned. 
[I 2026-03-18 19:43:22,688] Trial 12 pruned. 
[I 2026-03-18 19:43:25,019] Trial 18 pruned. 
[I 2026-03-18 19:43:29,623] Trial 13 pruned. 
[I 2026-03-18 19:43:34,769] Trial 18 pruned. 
[I 2026-03-18 19:43:35,150] Trial 19 pruned. 
[I 2026-03-18 19:43:35,583] Trial 14 pruned. 
[I 2026-03-18 19:43:37,550] Trial 14 pruned. 
[I 2026-03-18 19:43:40,143] Trial 8 pruned. 
[I 2026-03-18 19:43:41,609] Trial 14 pruned. 
[I 2026-03-18 19:43:44,776] Trial 13 pruned. 
[I 2026-03-18 19:43:46,680] Trial 19 pruned. 
[I 2026-03-18 19:43:49,209] Trial 8 pruned. 
[I 2026-03-18 19:43:50,095] Trial 9 finished with value: -2.0945611069080887 and parameters: {'n_layers_yyx': 2, 'hidden_size_yyx_l0': 5, 'hidden_size_yyx_l1': 4, 'context_size_yyx': 1, 'num_mix_components_yyx': 4, 'context_extractor_yyx': 'gru', 'activation_func_yyx': 'Tanh', 'L2_weight_yyx': 9.467578365298717e-10, 'L_entropy_weight_yyx': 6.760678660322687e-09, 'L_sep_weight_yyx': 9.511190700896293e-10, 'L_scale_weight_yyx': 6.290193656851107e-05, 'learning_rate_yyx': 0.005964441015570126}. Best is trial 9 with value: -2.0945611069080887.
[I 2026-03-18 19:43:55,519] Trial 14 pruned. 
[I 2026-03-18 19:43:59,531] Trial 17 pruned. 
[I 2026-03-18 19:44:00,321] Trial 20 pruned. 
[I 2026-03-18 19:44:06,364] Trial 12 finished with value: -2.084600761056139 and parameters: {'n_layers_yyx': 1, 'hidden_size_yyx_l0': 6, 'context_size_yyx': 4, 'num_mix_components_yyx': 5, 'context_extractor_yyx': 'lstm', 'activation_func_yyx': 'ReLU', 'L2_weight_yyx': 7.600134007905266e-09, 'L_entropy_weight_yyx': 1.683554004082416e-08, 'L_sep_weight_yyx': 4.049749826349066e-05, 'L_scale_weight_yyx': 0.0003863234522553885, 'learning_rate_yyx': 0.00921348936310124}. Best is trial 10 with value: -2.085590097553703.
[I 2026-03-18 19:44:06,396] Trial 10 finished with value: -1.5791248552417398 and parameters: {'n_layers_yyx': 2, 'hidden_size_yyx_l0': 4, 'hidden_size_yyx_l1': 2, 'context_size_yyx': 1, 'num_mix_components_yyx': 5, 'context_extractor_yyx': 'gru', 'activation_func_yyx': 'Tanh', 'L2_weight_yyx': 3.0594086508931663e-06, 'L_entropy_weight_yyx': 8.750725595325626e-09, 'L_sep_weight_yyx': 2.79708994501762e-10, 'L_scale_weight_yyx': 2.0127679213694777e-05, 'learning_rate_yyx': 0.0005414120828764219}. Best is trial 7 with value: -1.6077896387869492.
[I 2026-03-18 19:44:08,451] Trial 7 finished with value: -2.079061664955384 and parameters: {'n_layers_yyx': 2, 'hidden_size_yyx_l0': 4, 'hidden_size_yyx_l1': 5, 'context_size_yyx': 3, 'num_mix_components_yyx': 5, 'context_extractor_yyx': 'lstm', 'activation_func_yyx': 'ReLU', 'L2_weight_yyx': 4.063939193382004e-10, 'L_entropy_weight_yyx': 1.8162730453302194e-08, 'L_sep_weight_yyx': 1.2106997328195013e-07, 'L_scale_weight_yyx': 7.345657172015713e-08, 'learning_rate_yyx': 0.0021274325459017347}. Best is trial 1 with value: -2.0819965339546846.
[I 2026-03-18 19:44:08,797] Trial 15 pruned. 
[I 2026-03-18 19:44:09,609] Trial 14 finished with value: -1.6524487412764663 and parameters: {'n_layers_yyx': 2, 'hidden_size_yyx_l0': 4, 'hidden_size_yyx_l1': 3, 'context_size_yyx': 4, 'num_mix_components_yyx': 4, 'context_extractor_yyx': 'gru', 'activation_func_yyx': 'ReLU', 'L2_weight_yyx': 5.392085585531971e-06, 'L_entropy_weight_yyx': 9.524107063830347e-05, 'L_sep_weight_yyx': 8.857090854512022e-10, 'L_scale_weight_yyx': 8.517559595771342e-05, 'learning_rate_yyx': 0.007708820774141365}. Best is trial 12 with value: -1.6531010225123595.
[I 2026-03-18 19:44:11,138] Trial 9 pruned. 
[I 2026-03-18 19:44:13,658] Trial 10 pruned. 
