[I 2026-03-18 19:34:33,817] Trial 49 pruned. 

Source events: 12731
Target events: 54211
Full model ln_yyx : 2317.48494 nats/sec, 38.47441 nats/event
Full model Log loss : -1.77805
Full model ln_yyx : 2330.28842 nats/sec, 38.68697 nats/event
Full model Log loss : -1.78175
Full model ln_yyx : 2312.05745 nats/sec, 38.38431 nats/event
Full model Log loss : -1.78583
Full model ln_yyx : 2268.60652 nats/sec, 37.66294 nats/event
Full model Log loss : -1.75901
Full model ln_yyx : 2329.90935 nats/sec, 38.68068 nats/event
Full model Log loss : -1.78361
Full model ln_yyx : 2325.51605 nats/sec, 38.60774 nats/event
Full model Log loss : -1.77984
Full model ln_yyx : 2323.62417 nats/sec, 38.57634 nats/event
Full model Log loss : -1.78615
Full model ln_yyx : 2317.97677 nats/sec, 38.48258 nats/event
Full model Log loss : -1.78064
Full model ln_yyx : 2279.69957 nats/sec, 37.84711 nats/event
Full model Log loss : -1.75950
Full model ln_yyx : 2298.50541 nats/sec, 38.15932 nats/event
Full model Log loss : -1.78131
Full model ln_yyx : 2317.11528 nats/sec, 38.46828 nats/event
Full model Log loss : -1.78336
Full model ln_yyx : 2326.80779 nats/sec, 38.62919 nats/event
Full model Log loss : -1.78270
Full model ln_yyx : 2340.47143 nats/sec, 38.85603 nats/event
Full model Log loss : -1.78243
Full model ln_yyx : 2333.40286 nats/sec, 38.73868 nats/event
Full model Log loss : -1.78390
Optimization finished. Config saved to results/opt-full/opt_full_220_best_config.txt
[I 2026-03-18 19:34:37,398] Trial 34 finished with value: -2.269939193842901 and parameters: {'n_layers_yyx': 2, 'hidden_size_yyx_l0': 3, 'hidden_size_yyx_l1': 6, 'context_size_yyx': 4, 'num_mix_components_yyx': 3, 'context_extractor_yyx': 'gru', 'activation_func_yyx': 'GELU', 'L2_weight_yyx': 1.090575564012134e-10, 'L_entropy_weight_yyx': 1.1510828460462118e-10, 'L_sep_weight_yyx': 0.0003204455480242814, 'L_scale_weight_yyx': 1.3849756644268058e-07, 'learning_rate_yyx': 0.009923359132630517}. Best is trial 31 with value: -2.2773129352235233.
[I 2026-03-18 19:34:52,764] Trial 45 finished with value: -2.286325943572139 and parameters: {'n_layers_yyx': 2, 'hidden_size_yyx_l0': 4, 'hidden_size_yyx_l1': 6, 'context_size_yyx': 4, 'num_mix_components_yyx': 4, 'context_extractor_yyx': 'lstm', 'activation_func_yyx': 'Tanh', 'L2_weight_yyx': 5.3029067878085444e-06, 'L_entropy_weight_yyx': 0.00025126501803245186, 'L_sep_weight_yyx': 6.800261907778902e-09, 'L_scale_weight_yyx': 6.313762648940558e-05, 'learning_rate_yyx': 0.009266700172006006}. Best is trial 22 with value: -2.2897814149518054.
[I 2026-03-18 19:34:57,567] Trial 47 finished with value: -1.8577265386949051 and parameters: {'n_layers_yyx': 1, 'hidden_size_yyx_l0': 5, 'context_size_yyx': 3, 'num_mix_components_yyx': 3, 'context_extractor_yyx': 'gru', 'activation_func_yyx': 'Tanh', 'L2_weight_yyx': 5.391381179172822e-07, 'L_entropy_weight_yyx': 0.0002838989198555505, 'L_sep_weight_yyx': 3.076085501953691e-10, 'L_scale_weight_yyx': 5.6015517647418e-08, 'learning_rate_yyx': 0.008196175006763734}. Best is trial 5 with value: -1.864091702761834.
[I 2026-03-18 19:34:59,097] Trial 36 finished with value: -2.205253859733994 and parameters: {'n_layers_yyx': 2, 'hidden_size_yyx_l0': 5, 'hidden_size_yyx_l1': 6, 'context_size_yyx': 3, 'num_mix_components_yyx': 5, 'context_extractor_yyx': 'gru', 'activation_func_yyx': 'GELU', 'L2_weight_yyx': 2.401096926922807e-06, 'L_entropy_weight_yyx': 0.0007821763231576962, 'L_sep_weight_yyx': 2.2745970276379256e-06, 'L_scale_weight_yyx': 9.141351878084666e-05, 'learning_rate_yyx': 0.00995471624392766}. Best is trial 12 with value: -2.2168161654612635.
[I 2026-03-18 19:35:00,764] Trial 46 pruned. 
[I 2026-03-18 19:35:06,684] Trial 37 pruned. 
[I 2026-03-18 19:35:13,280] Trial 31 finished with value: -2.286266507133568 and parameters: {'n_layers_yyx': 1, 'hidden_size_yyx_l0': 6, 'context_size_yyx': 4, 'num_mix_components_yyx': 2, 'context_extractor_yyx': 'gru', 'activation_func_yyx': 'ReLU', 'L2_weight_yyx': 2.624437513026888e-08, 'L_entropy_weight_yyx': 5.9506972509750895e-08, 'L_sep_weight_yyx': 1.4145065460023833e-08, 'L_scale_weight_yyx': 5.720504814824623e-10, 'learning_rate_yyx': 0.007789786956916719}. Best is trial 25 with value: -2.286349879513464.
[I 2026-03-18 19:35:13,668] Trial 38 pruned. 
[I 2026-03-18 19:35:16,955] Trial 46 finished with value: -1.7781128725906417 and parameters: {'n_layers_yyx': 1, 'hidden_size_yyx_l0': 5, 'context_size_yyx': 2, 'num_mix_components_yyx': 5, 'context_extractor_yyx': 'gru', 'activation_func_yyx': 'Tanh', 'L2_weight_yyx': 2.0487143694752323e-10, 'L_entropy_weight_yyx': 8.02762356183103e-09, 'L_sep_weight_yyx': 1.3353212184017177e-07, 'L_scale_weight_yyx': 9.374526741443225e-06, 'learning_rate_yyx': 0.0055971277263843055}. Best is trial 46 with value: -1.7781128725906417.
[I 2026-03-18 19:35:18,107] Trial 47 pruned. 
[I 2026-03-18 19:35:24,248] Trial 35 pruned. 
[I 2026-03-18 19:35:28,432] Trial 37 pruned. 
[I 2026-03-18 19:35:31,852] Trial 39 pruned. 
[I 2026-03-18 19:35:32,655] Trial 36 pruned. 
[I 2026-03-18 19:35:36,499] Trial 48 pruned. 
[I 2026-03-18 19:35:42,796] Trial 37 pruned. 
[I 2026-03-18 19:35:45,584] Trial 38 pruned. 
[I 2026-03-18 19:35:47,976] Trial 40 pruned. 
[I 2026-03-18 19:35:51,245] Trial 40 pruned. 
[I 2026-03-18 19:35:55,863] Trial 49 pruned. 

Source events: 20800
Target events: 24874
Full model ln_yyx : 2056.49419 nats/sec, 74.40881 nats/event
Full model Log loss : -2.27362
Full model ln_yyx : 2051.58067 nats/sec, 74.23103 nats/event
Full model Log loss : -2.28403
Full model ln_yyx : 2051.14194 nats/sec, 74.21515 nats/event
Full model Log loss : -2.28012
Full model ln_yyx : 2056.34106 nats/sec, 74.40327 nats/event
Full model Log loss : -2.27727
Full model ln_yyx : 2061.68048 nats/sec, 74.59646 nats/event
Full model Log loss : -2.28360
Full model ln_yyx : 2061.31251 nats/sec, 74.58315 nats/event
Full model Log loss : -2.28513
Full model ln_yyx : 2065.84991 nats/sec, 74.74732 nats/event
Full model Log loss : -2.28978
Full model ln_yyx : 2065.81491 nats/sec, 74.74606 nats/event
Full model Log loss : -2.28484
Full model ln_yyx : 2059.52289 nats/sec, 74.51840 nats/event
Full model Log loss : -2.28274
Full model ln_yyx : 2047.71916 nats/sec, 74.09131 nats/event
Full model Log loss : -2.28213
Full model ln_yyx : 2041.32546 nats/sec, 73.85997 nats/event
Full model Log loss : -2.28502
Full model ln_yyx : 2063.15794 nats/sec, 74.64992 nats/event
Full model Log loss : -2.27045
Full model ln_yyx : 2056.42087 nats/sec, 74.40616 nats/event
Full model Log loss : -2.28897
Full model ln_yyx : 2049.56339 nats/sec, 74.15804 nats/event
Full model Log loss : -2.28763
Full model ln_yyx : 2056.03404 nats/sec, 74.39216 nats/event
Full model Log loss : -2.28875
Full model ln_yyx : 2065.28490 nats/sec, 74.72688 nats/event
Full model Log loss : -2.28633
Optimization finished. Config saved to results/opt-full/opt_full_212_best_config.txt
[I 2026-03-18 19:36:05,610] Trial 39 pruned. 
[I 2026-03-18 19:36:07,105] Trial 32 pruned. 
[I 2026-03-18 19:36:13,163] Trial 44 finished with value: -2.288667930500306 and parameters: {'n_layers_yyx': 2, 'hidden_size_yyx_l0': 3, 'hidden_size_yyx_l1': 6, 'context_size_yyx': 4, 'num_mix_components_yyx': 2, 'context_extractor_yyx': 'lstm', 'activation_func_yyx': 'GELU', 'L2_weight_yyx': 1.126530485753854e-09, 'L_entropy_weight_yyx': 1.514208964368897e-07, 'L_sep_weight_yyx': 9.276237149583188e-06, 'L_scale_weight_yyx': 1.1086465316234872e-08, 'learning_rate_yyx': 0.0041861957409254}. Best is trial 44 with value: -2.288667930500306.
[I 2026-03-18 19:36:21,132] Trial 45 pruned. 
[I 2026-03-18 19:36:25,572] Trial 40 pruned. 
[I 2026-03-18 19:36:30,011] Trial 46 pruned. 
[I 2026-03-18 19:36:32,086] Trial 38 pruned. 
[I 2026-03-18 19:36:37,656] Trial 42 finished with value: -2.2740763973289173 and parameters: {'n_layers_yyx': 2, 'hidden_size_yyx_l0': 5, 'hidden_size_yyx_l1': 5, 'context_size_yyx': 2, 'num_mix_components_yyx': 3, 'context_extractor_yyx': 'lstm', 'activation_func_yyx': 'Tanh', 'L2_weight_yyx': 3.316063998266832e-08, 'L_entropy_weight_yyx': 4.375679788993418e-05, 'L_sep_weight_yyx': 6.13999485787216e-06, 'L_scale_weight_yyx': 3.005057509003167e-08, 'learning_rate_yyx': 0.008679966740627525}. Best is trial 42 with value: -2.2740763973289173.
[I 2026-03-18 19:36:46,724] Trial 40 finished with value: -2.281068851751357 and parameters: {'n_layers_yyx': 2, 'hidden_size_yyx_l0': 2, 'hidden_size_yyx_l1': 4, 'context_size_yyx': 4, 'num_mix_components_yyx': 2, 'context_extractor_yyx': 'lstm', 'activation_func_yyx': 'GELU', 'L2_weight_yyx': 3.672507692828535e-06, 'L_entropy_weight_yyx': 6.506373498082424e-09, 'L_sep_weight_yyx': 1.1195937678593825e-08, 'L_scale_weight_yyx': 1.39996861252275e-07, 'learning_rate_yyx': 0.005491635066996192}. Best is trial 36 with value: -2.281234206739293.
[I 2026-03-18 19:36:47,922] Trial 48 finished with value: -1.8632524070826246 and parameters: {'n_layers_yyx': 2, 'hidden_size_yyx_l0': 3, 'hidden_size_yyx_l1': 5, 'context_size_yyx': 4, 'num_mix_components_yyx': 4, 'context_extractor_yyx': 'lstm', 'activation_func_yyx': 'ReLU', 'L2_weight_yyx': 9.766904511594917e-08, 'L_entropy_weight_yyx': 2.2264385411979846e-05, 'L_sep_weight_yyx': 1.8162759637293227e-05, 'L_scale_weight_yyx': 8.497384085271019e-05, 'learning_rate_yyx': 0.0031948730856470697}. Best is trial 5 with value: -1.864091702761834.
[I 2026-03-18 19:36:51,057] Trial 47 pruned. 
[I 2026-03-18 19:36:51,074] Trial 39 pruned. 
[I 2026-03-18 19:36:55,533] Trial 49 pruned. 

Source events: 12731
Target events: 1783
Full model ln_yyx : 78.11227 nats/sec, 39.42851 nats/event
Full model Log loss : -1.86242
Full model ln_yyx : 77.74328 nats/sec, 39.24226 nats/event
Full model Log loss : -1.86369
Full model ln_yyx : 77.52083 nats/sec, 39.12998 nats/event
Full model Log loss : -1.86403
Full model ln_yyx : 78.24043 nats/sec, 39.49321 nats/event
Full model Log loss : -1.86409
Full model ln_yyx : 78.08421 nats/sec, 39.41435 nats/event
Full model Log loss : -1.85619
Full model ln_yyx : 78.60170 nats/sec, 39.67556 nats/event
Full model Log loss : -1.86281
Full model ln_yyx : 75.66600 nats/sec, 38.19372 nats/event
Full model Log loss : -1.80444
Full model ln_yyx : 77.31766 nats/sec, 39.02742 nats/event
Full model Log loss : -1.83963
Full model ln_yyx : 77.28644 nats/sec, 39.01166 nats/event
Full model Log loss : -1.86372
Full model ln_yyx : 77.69319 nats/sec, 39.21698 nats/event
Full model Log loss : -1.86004
Full model ln_yyx : 77.93835 nats/sec, 39.34072 nats/event
Full model Log loss : -1.86139
Full model ln_yyx : 77.72592 nats/sec, 39.23350 nats/event
Full model Log loss : -1.86296
Full model ln_yyx : 77.86822 nats/sec, 39.30532 nats/event
Full model Log loss : -1.86107
Full model ln_yyx : 77.25468 nats/sec, 38.99563 nats/event
Full model Log loss : -1.85773
Full model ln_yyx : 77.94902 nats/sec, 39.34611 nats/event
Full model Log loss : -1.86325
Optimization finished. Config saved to results/opt-full/opt_full_217_best_config.txt
[I 2026-03-18 19:36:58,611] Trial 48 pruned. 
[I 2026-03-18 19:37:05,880] Trial 47 finished with value: -1.773229064816997 and parameters: {'n_layers_yyx': 1, 'hidden_size_yyx_l0': 6, 'context_size_yyx': 3, 'num_mix_components_yyx': 5, 'context_extractor_yyx': 'gru', 'activation_func_yyx': 'Tanh', 'L2_weight_yyx': 1.5452890646965584e-10, 'L_entropy_weight_yyx': 1.5152446578700787e-09, 'L_sep_weight_yyx': 1.212455091090368e-07, 'L_scale_weight_yyx': 1.0313291969581016e-06, 'learning_rate_yyx': 0.005694788744679588}. Best is trial 46 with value: -1.7781128725906417.
[I 2026-03-18 19:37:11,051] Trial 40 pruned. 
[I 2026-03-18 19:37:17,766] Trial 41 pruned. 
[I 2026-03-18 19:37:18,797] Trial 41 pruned. 
[I 2026-03-18 19:37:25,988] Trial 43 pruned. 
[I 2026-03-18 19:37:26,010] Trial 41 finished with value: -2.2872270525742042 and parameters: {'n_layers_yyx': 2, 'hidden_size_yyx_l0': 4, 'hidden_size_yyx_l1': 6, 'context_size_yyx': 4, 'num_mix_components_yyx': 3, 'context_extractor_yyx': 'lstm', 'activation_func_yyx': 'GELU', 'L2_weight_yyx': 8.225616656270544e-07, 'L_entropy_weight_yyx': 1.1449517459246062e-08, 'L_sep_weight_yyx': 5.115212587410675e-08, 'L_scale_weight_yyx': 0.000688070345393052, 'learning_rate_yyx': 0.007936113318876127}. Best is trial 17 with value: -2.288314778247399.
[I 2026-03-18 19:37:36,181] Trial 41 finished with value: -2.212157792689654 and parameters: {'n_layers_yyx': 2, 'hidden_size_yyx_l0': 5, 'hidden_size_yyx_l1': 5, 'context_size_yyx': 3, 'num_mix_components_yyx': 5, 'context_extractor_yyx': 'lstm', 'activation_func_yyx': 'GELU', 'L2_weight_yyx': 2.5524642063271694e-08, 'L_entropy_weight_yyx': 3.686038386924295e-07, 'L_sep_weight_yyx': 1.140375400324198e-05, 'L_scale_weight_yyx': 9.451085114720371e-09, 'learning_rate_yyx': 0.009869270201167995}. Best is trial 12 with value: -2.2168161654612635.
[I 2026-03-18 19:37:43,711] Trial 49 pruned. 

Source events: 20800
Target events: 39192
Full model ln_yyx : 3221.10932 nats/sec, 73.96914 nats/event
Full model Log loss : -2.26285
Full model ln_yyx : 3237.78205 nats/sec, 74.35201 nats/event
Full model Log loss : -2.28670
Full model ln_yyx : 3246.39726 nats/sec, 74.54985 nats/event
Full model Log loss : -2.26935
Full model ln_yyx : 3203.26586 nats/sec, 73.55938 nats/event
Full model Log loss : -2.26202
Full model ln_yyx : 3253.46685 nats/sec, 74.71219 nats/event
Full model Log loss : -2.27935
Full model ln_yyx : 3223.94096 nats/sec, 74.03416 nats/event
Full model Log loss : -2.28047
Full model ln_yyx : 3218.67799 nats/sec, 73.91330 nats/event
Full model Log loss : -2.26680
Full model ln_yyx : 3259.75769 nats/sec, 74.85665 nats/event
Full model Log loss : -2.28653
Full model ln_yyx : 3211.34501 nats/sec, 73.74491 nats/event
Full model Log loss : -2.28266
Full model ln_yyx : 3274.41057 nats/sec, 75.19314 nats/event
Full model Log loss : -2.28239
Full model ln_yyx : 3240.58612 nats/sec, 74.41640 nats/event
Full model Log loss : -2.27428
Full model ln_yyx : 3259.68970 nats/sec, 74.85509 nats/event
Full model Log loss : -2.28172
Full model ln_yyx : 3214.25534 nats/sec, 73.81174 nats/event
Full model Log loss : -2.28436
Full model ln_yyx : 3250.01715 nats/sec, 74.63297 nats/event
Full model Log loss : -2.28574
Full model ln_yyx : 3262.83798 nats/sec, 74.92739 nats/event
Full model Log loss : -2.28763
Full model ln_yyx : 3249.21867 nats/sec, 74.61464 nats/event
Full model Log loss : -2.28497
Full model ln_yyx : 3237.58760 nats/sec, 74.34754 nats/event
Full model Log loss : -2.28867
Optimization finished. Config saved to results/opt-full/opt_full_214_best_config.txt
[I 2026-03-18 19:38:00,842] Trial 41 finished with value: -2.2595000151759836 and parameters: {'n_layers_yyx': 2, 'hidden_size_yyx_l0': 2, 'hidden_size_yyx_l1': 4, 'context_size_yyx': 4, 'num_mix_components_yyx': 1, 'context_extractor_yyx': 'lstm', 'activation_func_yyx': 'GELU', 'L2_weight_yyx': 7.968830943924183e-06, 'L_entropy_weight_yyx': 5.419972199742832e-09, 'L_sep_weight_yyx': 8.660924560894012e-09, 'L_scale_weight_yyx': 1.5749554599868052e-07, 'learning_rate_yyx': 0.006057667859041021}. Best is trial 36 with value: -2.281234206739293.
[I 2026-03-18 19:38:01,252] Trial 42 pruned. 
[I 2026-03-18 19:38:07,464] Trial 42 pruned. 
[I 2026-03-18 19:38:08,199] Trial 33 finished with value: -2.2855618162867195 and parameters: {'n_layers_yyx': 1, 'hidden_size_yyx_l0': 6, 'context_size_yyx': 4, 'num_mix_components_yyx': 2, 'context_extractor_yyx': 'gru', 'activation_func_yyx': 'ReLU', 'L2_weight_yyx': 7.361232044826656e-09, 'L_entropy_weight_yyx': 3.968677835726782e-07, 'L_sep_weight_yyx': 1.7241892264015506e-08, 'L_scale_weight_yyx': 4.841640818580754e-10, 'learning_rate_yyx': 0.005976519917231792}. Best is trial 25 with value: -2.286349879513464.
[I 2026-03-18 19:38:15,887] Trial 34 pruned. 
[I 2026-03-18 19:38:17,442] Trial 42 pruned. 
[I 2026-03-18 19:38:33,695] Trial 48 finished with value: -1.7784923704312958 and parameters: {'n_layers_yyx': 1, 'hidden_size_yyx_l0': 5, 'context_size_yyx': 2, 'num_mix_components_yyx': 5, 'context_extractor_yyx': 'gru', 'activation_func_yyx': 'Tanh', 'L2_weight_yyx': 2.1568395222506874e-10, 'L_entropy_weight_yyx': 8.794232280351718e-09, 'L_sep_weight_yyx': 1.5120266876110042e-07, 'L_scale_weight_yyx': 8.59346509725982e-06, 'learning_rate_yyx': 0.007334486381818328}. Best is trial 48 with value: -1.7784923704312958.
[I 2026-03-18 19:38:43,124] Trial 44 finished with value: -2.2640731235147706 and parameters: {'n_layers_yyx': 2, 'hidden_size_yyx_l0': 6, 'hidden_size_yyx_l1': 6, 'context_size_yyx': 2, 'num_mix_components_yyx': 3, 'context_extractor_yyx': 'lstm', 'activation_func_yyx': 'Tanh', 'L2_weight_yyx': 6.8579699144400874e-09, 'L_entropy_weight_yyx': 0.0009340086801138271, 'L_sep_weight_yyx': 8.649693973922181e-07, 'L_scale_weight_yyx': 4.860778672668805e-07, 'learning_rate_yyx': 0.009880834834690913}. Best is trial 42 with value: -2.2740763973289173.
[I 2026-03-18 19:38:50,616] Trial 43 finished with value: -2.2573207258648864 and parameters: {'n_layers_yyx': 2, 'hidden_size_yyx_l0': 2, 'hidden_size_yyx_l1': 3, 'context_size_yyx': 4, 'num_mix_components_yyx': 1, 'context_extractor_yyx': 'lstm', 'activation_func_yyx': 'GELU', 'L2_weight_yyx': 7.999163651709054e-07, 'L_entropy_weight_yyx': 9.757957091599267e-10, 'L_sep_weight_yyx': 5.616311019091494e-09, 'L_scale_weight_yyx': 3.5078232588651347e-09, 'learning_rate_yyx': 0.008129972842212797}. Best is trial 36 with value: -2.281234206739293.
[I 2026-03-18 19:38:55,422] Trial 42 finished with value: -2.285908603551484 and parameters: {'n_layers_yyx': 2, 'hidden_size_yyx_l0': 4, 'hidden_size_yyx_l1': 5, 'context_size_yyx': 4, 'num_mix_components_yyx': 3, 'context_extractor_yyx': 'lstm', 'activation_func_yyx': 'GELU', 'L2_weight_yyx': 3.3403315197397e-07, 'L_entropy_weight_yyx': 1.6846078221530184e-08, 'L_sep_weight_yyx': 3.4327075479097466e-08, 'L_scale_weight_yyx': 0.00045769916977239964, 'learning_rate_yyx': 0.005955154455319893}. Best is trial 17 with value: -2.288314778247399.
[I 2026-03-18 19:38:58,326] Trial 35 pruned. 
[I 2026-03-18 19:38:58,785] Trial 43 pruned. 
[I 2026-03-18 19:38:59,564] Trial 45 pruned. 
[I 2026-03-18 19:39:02,145] Trial 42 finished with value: -2.2802392986829148 and parameters: {'n_layers_yyx': 2, 'hidden_size_yyx_l0': 3, 'hidden_size_yyx_l1': 6, 'context_size_yyx': 4, 'num_mix_components_yyx': 5, 'context_extractor_yyx': 'lstm', 'activation_func_yyx': 'GELU', 'L2_weight_yyx': 5.363620759525008e-06, 'L_entropy_weight_yyx': 0.0004211322048890126, 'L_sep_weight_yyx': 0.00011462109806124138, 'L_scale_weight_yyx': 0.00014282682729823621, 'learning_rate_yyx': 0.009749241793126816}. Best is trial 32 with value: -2.283618801160143.
[I 2026-03-18 19:39:16,055] Trial 46 pruned. 
[I 2026-03-18 19:39:34,143] Trial 43 finished with value: -2.2756855396171036 and parameters: {'n_layers_yyx': 2, 'hidden_size_yyx_l0': 2, 'hidden_size_yyx_l1': 6, 'context_size_yyx': 4, 'num_mix_components_yyx': 5, 'context_extractor_yyx': 'lstm', 'activation_func_yyx': 'GELU', 'L2_weight_yyx': 5.264451086458447e-09, 'L_entropy_weight_yyx': 2.1604038734477822e-10, 'L_sep_weight_yyx': 2.904657077319773e-05, 'L_scale_weight_yyx': 1.3158082890938274e-08, 'learning_rate_yyx': 0.006308362210903524}. Best is trial 31 with value: -2.2773129352235233.
[I 2026-03-18 19:39:37,028] Trial 43 pruned. 
[I 2026-03-18 19:39:38,709] Trial 36 pruned. 
[I 2026-03-18 19:39:43,420] Trial 43 pruned. 
[I 2026-03-18 19:39:43,748] Trial 44 pruned. 
[I 2026-03-18 19:39:45,719] Trial 37 pruned. 
[I 2026-03-18 19:39:53,333] Trial 38 pruned. 
[I 2026-03-18 19:39:58,319] Trial 49 finished with value: -1.7776018991015465 and parameters: {'n_layers_yyx': 1, 'hidden_size_yyx_l0': 5, 'context_size_yyx': 2, 'num_mix_components_yyx': 5, 'context_extractor_yyx': 'gru', 'activation_func_yyx': 'Tanh', 'L2_weight_yyx': 1.8788597599646043e-10, 'L_entropy_weight_yyx': 1.1944258717506132e-08, 'L_sep_weight_yyx': 1.9837101612960097e-07, 'L_scale_weight_yyx': 8.906831451404394e-06, 'learning_rate_yyx': 0.0068605145261376385}. Best is trial 48 with value: -1.7784923704312958.

Source events: 12731
Target events: 20315
Full model ln_yyx : 871.07392 nats/sec, 38.59053 nats/event
Full model Log loss : -1.77565
Full model ln_yyx : 874.12840 nats/sec, 38.72585 nats/event
Full model Log loss : -1.77371
Full model ln_yyx : 866.22424 nats/sec, 38.37567 nats/event
Full model Log loss : -1.77641
Full model ln_yyx : 863.76660 nats/sec, 38.26679 nats/event
Full model Log loss : -1.76920
Full model ln_yyx : 870.47090 nats/sec, 38.56381 nats/event
Full model Log loss : -1.77389
Full model ln_yyx : 871.56245 nats/sec, 38.61217 nats/event
Full model Log loss : -1.77568
Full model ln_yyx : 859.30027 nats/sec, 38.06893 nats/event
Full model Log loss : -1.77232
Full model ln_yyx : 854.40496 nats/sec, 37.85205 nats/event
Full model Log loss : -1.75569
Full model ln_yyx : 862.92849 nats/sec, 38.22966 nats/event
Full model Log loss : -1.77289
Full model ln_yyx : 861.49710 nats/sec, 38.16625 nats/event
Full model Log loss : -1.77548
Full model ln_yyx : 869.77493 nats/sec, 38.53298 nats/event
Full model Log loss : -1.77633
Full model ln_yyx : 873.32294 nats/sec, 38.69016 nats/event
Full model Log loss : -1.77592
Full model ln_yyx : 862.96214 nats/sec, 38.23116 nats/event
Full model Log loss : -1.77124
Full model ln_yyx : 871.17748 nats/sec, 38.59511 nats/event
Full model Log loss : -1.77811
Full model ln_yyx : 871.19034 nats/sec, 38.59568 nats/event
Full model Log loss : -1.77323
Full model ln_yyx : 872.50150 nats/sec, 38.65377 nats/event
Full model Log loss : -1.77849
Full model ln_yyx : 874.94603 nats/sec, 38.76207 nats/event
Full model Log loss : -1.77760
Optimization finished. Config saved to results/opt-full/opt_full_218_best_config.txt
[I 2026-03-18 19:40:00,225] Trial 47 pruned. 
[I 2026-03-18 19:40:01,645] Trial 44 pruned. 
[I 2026-03-18 19:40:02,014] Trial 39 pruned. 
