[I 2026-03-18 18:36:14,718] Trial 31 finished with value: -1.6645833860806711 and parameters: {'n_layers_yyx': 1, 'hidden_size_yyx_l0': 5, 'context_size_yyx': 2, 'num_mix_components_yyx': 3, 'context_extractor_yyx': 'lstm', 'activation_func_yyx': 'GELU', 'L2_weight_yyx': 0.0008915321540153395, 'L_entropy_weight_yyx': 4.007558606437078e-07, 'L_sep_weight_yyx': 9.052248997946103e-09, 'L_scale_weight_yyx': 3.083456678434539e-05, 'learning_rate_yyx': 0.009573307256458014}. Best is trial 2 with value: -1.6745893480229308.
[I 2026-03-18 18:36:21,858] Trial 24 pruned. 
[I 2026-03-18 18:36:21,877] Trial 29 finished with value: -1.2497791776815756 and parameters: {'n_layers_yyx': 1, 'hidden_size_yyx_l0': 6, 'context_size_yyx': 3, 'num_mix_components_yyx': 2, 'context_extractor_yyx': 'lstm', 'activation_func_yyx': 'Tanh', 'L2_weight_yyx': 1.9974803809938542e-07, 'L_entropy_weight_yyx': 6.635839435368326e-08, 'L_sep_weight_yyx': 2.295121476840932e-07, 'L_scale_weight_yyx': 1.418823209567482e-09, 'learning_rate_yyx': 0.009087933941282626}. Best is trial 26 with value: -1.2682363612374183.
[I 2026-03-18 18:36:24,575] Trial 23 finished with value: -1.6757874282308216 and parameters: {'n_layers_yyx': 1, 'hidden_size_yyx_l0': 5, 'context_size_yyx': 4, 'num_mix_components_yyx': 3, 'context_extractor_yyx': 'lstm', 'activation_func_yyx': 'Tanh', 'L2_weight_yyx': 1.1880324149045363e-06, 'L_entropy_weight_yyx': 2.5721500595610315e-08, 'L_sep_weight_yyx': 7.1098267345589325e-09, 'L_scale_weight_yyx': 1.2532161595520654e-07, 'learning_rate_yyx': 0.0074625678931406}. Best is trial 23 with value: -1.6757874282308216.
[I 2026-03-18 18:36:30,798] Trial 33 pruned. 
[I 2026-03-18 18:36:31,690] Trial 32 pruned. 
[I 2026-03-18 18:36:38,828] Trial 32 finished with value: -2.6027079127007386 and parameters: {'n_layers_yyx': 1, 'hidden_size_yyx_l0': 6, 'context_size_yyx': 4, 'num_mix_components_yyx': 2, 'context_extractor_yyx': 'gru', 'activation_func_yyx': 'GELU', 'L2_weight_yyx': 1.0868343114179438e-08, 'L_entropy_weight_yyx': 9.170004638391254e-09, 'L_sep_weight_yyx': 0.0006237462785066547, 'L_scale_weight_yyx': 1.5755673141915115e-09, 'learning_rate_yyx': 0.006641126456644775}. Best is trial 12 with value: -2.6375437257353878.
[I 2026-03-18 18:36:38,991] Trial 26 pruned. 
[I 2026-03-18 18:36:39,363] Trial 30 pruned. 
[I 2026-03-18 18:36:41,959] Trial 20 pruned. 
[I 2026-03-18 18:36:44,101] Trial 24 pruned. 
[I 2026-03-18 18:36:47,515] Trial 32 pruned. 
[I 2026-03-18 18:36:48,212] Trial 21 finished with value: -1.2461041293611368 and parameters: {'n_layers_yyx': 2, 'hidden_size_yyx_l0': 4, 'hidden_size_yyx_l1': 6, 'context_size_yyx': 2, 'num_mix_components_yyx': 1, 'context_extractor_yyx': 'gru', 'activation_func_yyx': 'Tanh', 'L2_weight_yyx': 5.623379358165522e-08, 'L_entropy_weight_yyx': 4.58482803290615e-06, 'L_sep_weight_yyx': 8.212368108024121e-08, 'L_scale_weight_yyx': 7.36252229000431e-09, 'learning_rate_yyx': 0.003693966597961865}. Best is trial 3 with value: -1.2710647653519778.
[I 2026-03-18 18:36:48,831] Trial 15 finished with value: -1.6735151417560596 and parameters: {'n_layers_yyx': 1, 'hidden_size_yyx_l0': 5, 'context_size_yyx': 4, 'num_mix_components_yyx': 4, 'context_extractor_yyx': 'lstm', 'activation_func_yyx': 'Tanh', 'L2_weight_yyx': 3.7975054045390434e-09, 'L_entropy_weight_yyx': 1.762688957519312e-10, 'L_sep_weight_yyx': 0.0005947475156509473, 'L_scale_weight_yyx': 5.495474311728896e-05, 'learning_rate_yyx': 0.0029752817811748004}. Best is trial 15 with value: -1.6735151417560596.
[I 2026-03-18 18:36:48,915] Trial 31 pruned. 
[I 2026-03-18 18:36:49,294] Trial 34 pruned. 
[I 2026-03-18 18:36:50,810] Trial 21 pruned. 
[I 2026-03-18 18:36:54,334] Trial 21 finished with value: -1.6803123136342317 and parameters: {'n_layers_yyx': 2, 'hidden_size_yyx_l0': 6, 'hidden_size_yyx_l1': 5, 'context_size_yyx': 3, 'num_mix_components_yyx': 1, 'context_extractor_yyx': 'gru', 'activation_func_yyx': 'Tanh', 'L2_weight_yyx': 2.692442971063352e-05, 'L_entropy_weight_yyx': 2.1800989135460275e-07, 'L_sep_weight_yyx': 7.519670042295942e-06, 'L_scale_weight_yyx': 8.152477818104101e-09, 'learning_rate_yyx': 0.004302714269569513}. Best is trial 2 with value: -1.6820484414711034.
[I 2026-03-18 18:36:55,451] Trial 45 pruned. 
[I 2026-03-18 18:36:58,467] Trial 33 pruned. 
[I 2026-03-18 18:36:58,557] Trial 32 pruned. 
[I 2026-03-18 18:36:58,624] Trial 22 pruned. 
[I 2026-03-18 18:37:00,355] Trial 33 pruned. 
[I 2026-03-18 18:37:02,781] Trial 27 pruned. 
[I 2026-03-18 18:37:04,243] Trial 28 finished with value: -2.6142169366409127 and parameters: {'n_layers_yyx': 2, 'hidden_size_yyx_l0': 3, 'hidden_size_yyx_l1': 5, 'context_size_yyx': 3, 'num_mix_components_yyx': 1, 'context_extractor_yyx': 'gru', 'activation_func_yyx': 'ReLU', 'L2_weight_yyx': 6.605901535593571e-09, 'L_entropy_weight_yyx': 2.4468125822330396e-06, 'L_sep_weight_yyx': 6.879984062120358e-06, 'L_scale_weight_yyx': 4.998188277242571e-10, 'learning_rate_yyx': 0.009705649146882649}. Best is trial 10 with value: -2.6537577311197915.
[I 2026-03-18 18:37:07,518] Trial 22 pruned. 
[I 2026-03-18 18:37:08,225] Trial 25 pruned. 
[I 2026-03-18 18:37:09,395] Trial 26 finished with value: -1.6692976708361686 and parameters: {'n_layers_yyx': 1, 'hidden_size_yyx_l0': 4, 'context_size_yyx': 4, 'num_mix_components_yyx': 2, 'context_extractor_yyx': 'gru', 'activation_func_yyx': 'ReLU', 'L2_weight_yyx': 1.2272542463050162e-09, 'L_entropy_weight_yyx': 3.284539779038421e-08, 'L_sep_weight_yyx': 4.7003889388592745e-05, 'L_scale_weight_yyx': 8.591754816574482e-07, 'learning_rate_yyx': 0.004141233035324877}. Best is trial 2 with value: -1.6777834079951708.
[I 2026-03-18 18:37:09,400] Trial 35 pruned. 
[I 2026-03-18 18:37:11,406] Trial 23 pruned. 
[I 2026-03-18 18:37:26,518] Trial 25 pruned. 
[I 2026-03-18 18:37:26,907] Trial 46 pruned. 
[I 2026-03-18 18:37:29,404] Trial 27 pruned. 
[I 2026-03-18 18:37:35,144] Trial 28 pruned. 
[I 2026-03-18 18:37:35,338] Trial 23 pruned. 
[I 2026-03-18 18:37:37,489] Trial 34 pruned. 
[I 2026-03-18 18:37:37,900] Trial 23 finished with value: -1.6463234779781353 and parameters: {'n_layers_yyx': 2, 'hidden_size_yyx_l0': 4, 'hidden_size_yyx_l1': 6, 'context_size_yyx': 1, 'num_mix_components_yyx': 5, 'context_extractor_yyx': 'gru', 'activation_func_yyx': 'ReLU', 'L2_weight_yyx': 0.0002579565611153219, 'L_entropy_weight_yyx': 0.0005449613408913823, 'L_sep_weight_yyx': 5.932888308234994e-10, 'L_scale_weight_yyx': 8.956053633777541e-09, 'learning_rate_yyx': 0.005187966744703005}. Best is trial 12 with value: -1.6645964610425732.
[I 2026-03-18 18:37:39,329] Trial 34 pruned. 
[I 2026-03-18 18:37:39,332] Trial 21 finished with value: -2.602454444708049 and parameters: {'n_layers_yyx': 2, 'hidden_size_yyx_l0': 5, 'hidden_size_yyx_l1': 6, 'context_size_yyx': 4, 'num_mix_components_yyx': 2, 'context_extractor_yyx': 'lstm', 'activation_func_yyx': 'GELU', 'L2_weight_yyx': 6.646187273487646e-10, 'L_entropy_weight_yyx': 3.55915493793165e-08, 'L_sep_weight_yyx': 1.3245541746746494e-07, 'L_scale_weight_yyx': 1.0801849746674668e-07, 'learning_rate_yyx': 0.00638346394217109}. Best is trial 15 with value: -2.6388607085013045.
[I 2026-03-18 18:37:46,340] Trial 47 pruned. 
[I 2026-03-18 18:37:46,481] Trial 26 pruned. 
[I 2026-03-18 18:37:50,542] Trial 26 pruned. 
[I 2026-03-18 18:37:50,947] Trial 24 pruned. 
[I 2026-03-18 18:37:52,637] Trial 29 pruned. 
[I 2026-03-18 18:37:54,672] Trial 31 finished with value: -2.642702042239214 and parameters: {'n_layers_yyx': 1, 'hidden_size_yyx_l0': 3, 'context_size_yyx': 3, 'num_mix_components_yyx': 5, 'context_extractor_yyx': 'lstm', 'activation_func_yyx': 'ReLU', 'L2_weight_yyx': 0.00025636240370757865, 'L_entropy_weight_yyx': 3.2366352887839805e-08, 'L_sep_weight_yyx': 1.615994643504616e-09, 'L_scale_weight_yyx': 5.738001891064637e-05, 'learning_rate_yyx': 0.009566898278880798}. Best is trial 31 with value: -2.642702042239214.
[I 2026-03-18 18:37:55,092] Trial 22 finished with value: -1.6701380827888144 and parameters: {'n_layers_yyx': 2, 'hidden_size_yyx_l0': 2, 'hidden_size_yyx_l1': 6, 'context_size_yyx': 4, 'num_mix_components_yyx': 2, 'context_extractor_yyx': 'lstm', 'activation_func_yyx': 'Tanh', 'L2_weight_yyx': 5.395354906500648e-10, 'L_entropy_weight_yyx': 6.350460548040306e-08, 'L_sep_weight_yyx': 2.437077289607097e-07, 'L_scale_weight_yyx': 3.819512220077424e-08, 'learning_rate_yyx': 0.00929501129202677}. Best is trial 11 with value: -1.6739410945609627.
[I 2026-03-18 18:37:55,266] Trial 24 finished with value: -1.7170856408227848 and parameters: {'n_layers_yyx': 2, 'hidden_size_yyx_l0': 6, 'hidden_size_yyx_l1': 5, 'context_size_yyx': 4, 'num_mix_components_yyx': 2, 'context_extractor_yyx': 'gru', 'activation_func_yyx': 'ReLU', 'L2_weight_yyx': 7.889720297829746e-08, 'L_entropy_weight_yyx': 3.545057103233412e-08, 'L_sep_weight_yyx': 4.91372957156252e-06, 'L_scale_weight_yyx': 1.996052306173221e-06, 'learning_rate_yyx': 0.0032020832247250347}. Best is trial 15 with value: -1.72713993893394.
[I 2026-03-18 18:38:03,485] Trial 48 pruned. 
[I 2026-03-18 18:38:04,413] Trial 22 finished with value: -1.6757910143766872 and parameters: {'n_layers_yyx': 2, 'hidden_size_yyx_l0': 6, 'hidden_size_yyx_l1': 3, 'context_size_yyx': 4, 'num_mix_components_yyx': 2, 'context_extractor_yyx': 'lstm', 'activation_func_yyx': 'Tanh', 'L2_weight_yyx': 3.382315124473698e-09, 'L_entropy_weight_yyx': 0.0007290351929666949, 'L_sep_weight_yyx': 5.1926486308277255e-09, 'L_scale_weight_yyx': 1.0034548286320142e-07, 'learning_rate_yyx': 0.009054297221464851}. Best is trial 22 with value: -1.6757910143766872.
[I 2026-03-18 18:38:04,752] Trial 36 pruned. 
[I 2026-03-18 18:38:07,163] Trial 21 finished with value: -1.6637657998959758 and parameters: {'n_layers_yyx': 1, 'hidden_size_yyx_l0': 3, 'context_size_yyx': 3, 'num_mix_components_yyx': 4, 'context_extractor_yyx': 'gru', 'activation_func_yyx': 'Tanh', 'L2_weight_yyx': 0.0004084522637074536, 'L_entropy_weight_yyx': 6.318952797472806e-09, 'L_sep_weight_yyx': 1.2560815622993842e-06, 'L_scale_weight_yyx': 1.1042374707803836e-08, 'learning_rate_yyx': 0.009993947837744682}. Best is trial 2 with value: -1.6799626520210098.
[I 2026-03-18 18:38:09,532] Trial 25 pruned. 
[I 2026-03-18 18:38:10,222] Trial 24 pruned. 
[I 2026-03-18 18:38:13,622] Trial 35 pruned. 
[I 2026-03-18 18:38:18,467] Trial 24 finished with value: -1.2401225430247083 and parameters: {'n_layers_yyx': 2, 'hidden_size_yyx_l0': 5, 'hidden_size_yyx_l1': 6, 'context_size_yyx': 4, 'num_mix_components_yyx': 1, 'context_extractor_yyx': 'lstm', 'activation_func_yyx': 'Tanh', 'L2_weight_yyx': 1.5114387029375847e-08, 'L_entropy_weight_yyx': 1.260149984964498e-05, 'L_sep_weight_yyx': 5.291193826013004e-10, 'L_scale_weight_yyx': 4.948507220784975e-10, 'learning_rate_yyx': 0.0036320415243141155}. Best is trial 6 with value: -1.270142151555821.
[I 2026-03-18 18:38:26,006] Trial 22 pruned. 
[I 2026-03-18 18:38:28,548] Trial 22 pruned. 
[I 2026-03-18 18:38:28,702] Trial 25 pruned. 
[I 2026-03-18 18:38:30,459] Trial 37 pruned. 
[I 2026-03-18 18:38:32,721] Trial 33 pruned. 
[I 2026-03-18 18:38:33,638] Trial 23 pruned. 
[I 2026-03-18 18:38:33,883] Trial 25 pruned. 
[I 2026-03-18 18:38:34,634] Trial 36 pruned. 
[I 2026-03-18 18:38:38,393] Trial 25 finished with value: -1.663724932335568 and parameters: {'n_layers_yyx': 2, 'hidden_size_yyx_l0': 6, 'hidden_size_yyx_l1': 6, 'context_size_yyx': 3, 'num_mix_components_yyx': 2, 'context_extractor_yyx': 'gru', 'activation_func_yyx': 'GELU', 'L2_weight_yyx': 4.711642540506567e-09, 'L_entropy_weight_yyx': 0.00010062954434172728, 'L_sep_weight_yyx': 5.367300859066044e-09, 'L_scale_weight_yyx': 2.0033609356351388e-09, 'learning_rate_yyx': 0.00719630389690111}. Best is trial 11 with value: -1.6687842250673444.
[I 2026-03-18 18:38:38,696] Trial 22 pruned. 
[I 2026-03-18 18:38:42,622] Trial 29 pruned. 
[I 2026-03-18 18:38:43,948] Trial 26 pruned. 
[I 2026-03-18 18:38:44,082] Trial 21 finished with value: -2.6405605351488926 and parameters: {'n_layers_yyx': 1, 'hidden_size_yyx_l0': 4, 'context_size_yyx': 2, 'num_mix_components_yyx': 4, 'context_extractor_yyx': 'gru', 'activation_func_yyx': 'Tanh', 'L2_weight_yyx': 0.00012538872716141112, 'L_entropy_weight_yyx': 0.0001545121512539232, 'L_sep_weight_yyx': 1.7279394338389893e-06, 'L_scale_weight_yyx': 4.574251246196254e-10, 'learning_rate_yyx': 0.006486079076814045}. Best is trial 21 with value: -2.6405605351488926.
[I 2026-03-18 18:38:45,796] Trial 24 finished with value: -2.632891291535354 and parameters: {'n_layers_yyx': 2, 'hidden_size_yyx_l0': 4, 'hidden_size_yyx_l1': 5, 'context_size_yyx': 3, 'num_mix_components_yyx': 4, 'context_extractor_yyx': 'lstm', 'activation_func_yyx': 'ReLU', 'L2_weight_yyx': 7.449245245945898e-05, 'L_entropy_weight_yyx': 1.1430503111592515e-08, 'L_sep_weight_yyx': 5.68242708814923e-07, 'L_scale_weight_yyx': 7.022460683822063e-06, 'learning_rate_yyx': 0.006696647345286659}. Best is trial 6 with value: -2.642843521506465.
[I 2026-03-18 18:38:46,933] Trial 24 pruned. 
[I 2026-03-18 18:38:50,217] Trial 27 pruned. 
[I 2026-03-18 18:38:51,337] Trial 26 pruned. 
[I 2026-03-18 18:38:53,510] Trial 25 pruned. 
[I 2026-03-18 18:38:53,654] Trial 27 pruned. 
[I 2026-03-18 18:38:53,865] Trial 12 finished with value: -1.6534286450970082 and parameters: {'n_layers_yyx': 1, 'hidden_size_yyx_l0': 5, 'context_size_yyx': 3, 'num_mix_components_yyx': 4, 'context_extractor_yyx': 'lstm', 'activation_func_yyx': 'Tanh', 'L2_weight_yyx': 5.8885914609917e-08, 'L_entropy_weight_yyx': 5.636664327418052e-06, 'L_sep_weight_yyx': 3.458297738564883e-09, 'L_scale_weight_yyx': 2.132086261718007e-09, 'learning_rate_yyx': 0.000980620350324976}. Best is trial 9 with value: -1.6703570914822956.
[I 2026-03-18 18:38:54,462] Trial 41 finished with value: -1.2838789242964523 and parameters: {'n_layers_yyx': 1, 'hidden_size_yyx_l0': 3, 'context_size_yyx': 4, 'num_mix_components_yyx': 3, 'context_extractor_yyx': 'lstm', 'activation_func_yyx': 'Tanh', 'L2_weight_yyx': 3.522336059561228e-08, 'L_entropy_weight_yyx': 1.194052410427329e-08, 'L_sep_weight_yyx': 8.684192241751131e-08, 'L_scale_weight_yyx': 1.3845554149671368e-06, 'learning_rate_yyx': 0.0010899300014126803}. Best is trial 8 with value: -1.3030293492170482.
[I 2026-03-18 18:38:55,365] Trial 25 pruned. 
[I 2026-03-18 18:38:56,401] Trial 28 pruned. 
[I 2026-03-18 18:38:56,671] Trial 38 pruned. 
[I 2026-03-18 18:38:58,556] Trial 28 pruned. 
[I 2026-03-18 18:38:59,939] Trial 42 pruned. 
[I 2026-03-18 18:39:00,268] Trial 23 pruned. 
[I 2026-03-18 18:39:01,298] Trial 25 finished with value: -1.650975327404562 and parameters: {'n_layers_yyx': 2, 'hidden_size_yyx_l0': 5, 'hidden_size_yyx_l1': 4, 'context_size_yyx': 2, 'num_mix_components_yyx': 1, 'context_extractor_yyx': 'gru', 'activation_func_yyx': 'ReLU', 'L2_weight_yyx': 2.3545273940798016e-06, 'L_entropy_weight_yyx': 8.996079885011878e-10, 'L_sep_weight_yyx': 2.5101756099755533e-09, 'L_scale_weight_yyx': 3.8515025568293875e-08, 'learning_rate_yyx': 0.00945756325866386}. Best is trial 19 with value: -1.6674850489567747.
[I 2026-03-18 18:39:03,197] Trial 29 pruned. 
[I 2026-03-18 18:39:08,563] Trial 29 pruned. 
[I 2026-03-18 18:39:09,755] Trial 39 pruned. 
[I 2026-03-18 18:39:10,506] Trial 27 pruned. 
[I 2026-03-18 18:39:13,594] Trial 26 pruned. 
[I 2026-03-18 18:39:14,049] Trial 26 pruned. 
[I 2026-03-18 18:39:16,517] Trial 24 pruned. 
[I 2026-03-18 18:39:16,672] Trial 23 pruned. 
[I 2026-03-18 18:39:20,596] Trial 30 pruned. 
[I 2026-03-18 18:39:20,723] Trial 43 pruned. 
[I 2026-03-18 18:39:20,778] Trial 25 finished with value: -1.256745780902517 and parameters: {'n_layers_yyx': 2, 'hidden_size_yyx_l0': 6, 'hidden_size_yyx_l1': 4, 'context_size_yyx': 2, 'num_mix_components_yyx': 3, 'context_extractor_yyx': 'lstm', 'activation_func_yyx': 'Tanh', 'L2_weight_yyx': 7.516655747877041e-08, 'L_entropy_weight_yyx': 9.495726106639462e-05, 'L_sep_weight_yyx': 5.638184892714759e-07, 'L_scale_weight_yyx': 3.140034005194149e-10, 'learning_rate_yyx': 0.009717626612268281}. Best is trial 6 with value: -1.270142151555821.
[I 2026-03-18 18:39:21,237] Trial 23 pruned. 
[I 2026-03-18 18:39:22,030] Trial 30 pruned. 
[I 2026-03-18 18:39:22,844] Trial 22 finished with value: -1.666347348540878 and parameters: {'n_layers_yyx': 1, 'hidden_size_yyx_l0': 4, 'context_size_yyx': 3, 'num_mix_components_yyx': 3, 'context_extractor_yyx': 'lstm', 'activation_func_yyx': 'Tanh', 'L2_weight_yyx': 3.9202732456432264e-09, 'L_entropy_weight_yyx': 1.4430181373057675e-06, 'L_sep_weight_yyx': 5.481609812652889e-09, 'L_scale_weight_yyx': 0.0009731163801550763, 'learning_rate_yyx': 0.0017183962267633816}. Best is trial 0 with value: -1.6683178048964529.
[I 2026-03-18 18:39:24,081] Trial 49 finished with value: -1.2721565514527495 and parameters: {'n_layers_yyx': 2, 'hidden_size_yyx_l0': 5, 'hidden_size_yyx_l1': 6, 'context_size_yyx': 4, 'num_mix_components_yyx': 3, 'context_extractor_yyx': 'lstm', 'activation_func_yyx': 'GELU', 'L2_weight_yyx': 5.011694684909645e-05, 'L_entropy_weight_yyx': 4.23243737749148e-09, 'L_sep_weight_yyx': 5.358073715966057e-10, 'L_scale_weight_yyx': 5.524101255017381e-09, 'learning_rate_yyx': 0.00868273365412266}. Best is trial 40 with value: -1.2736812175532146.

Source events: 5634
Target events: 8618
Full model ln_yyx : 130.26886 nats/sec, 13.60431 nats/event
Full model Log loss : -1.14724
Full model ln_yyx : 133.42439 nats/sec, 13.93385 nats/event
Full model Log loss : -1.25557
Full model ln_yyx : 134.95819 nats/sec, 14.09403 nats/event
Full model Log loss : -1.25693
Full model ln_yyx : 132.65863 nats/sec, 13.85388 nats/event
Full model Log loss : -1.24633
Full model ln_yyx : 134.67999 nats/sec, 14.06498 nats/event
Full model Log loss : -1.25902
Full model ln_yyx : 133.46343 nats/sec, 13.93793 nats/event
Full model Log loss : -1.25841
Full model ln_yyx : 136.22767 nats/sec, 14.22661 nats/event
Full model Log loss : -1.26528
Full model ln_yyx : 133.03191 nats/sec, 13.89287 nats/event
Full model Log loss : -1.27160
Full model ln_yyx : 134.91543 nats/sec, 14.08957 nats/event
Full model Log loss : -1.27368
Full model ln_yyx : 134.32693 nats/sec, 14.02811 nats/event
Full model Log loss : -1.27283
Full model ln_yyx : 135.83605 nats/sec, 14.18571 nats/event
Full model Log loss : -1.27216
Optimization finished. Config saved to results/opt-full/opt_full_97_best_config.txt
[I 2026-03-18 18:39:26,960] Trial 36 finished with value: -2.601337071582476 and parameters: {'n_layers_yyx': 2, 'hidden_size_yyx_l0': 6, 'hidden_size_yyx_l1': 2, 'context_size_yyx': 1, 'num_mix_components_yyx': 2, 'context_extractor_yyx': 'lstm', 'activation_func_yyx': 'ReLU', 'L2_weight_yyx': 5.397697586254007e-09, 'L_entropy_weight_yyx': 0.000950026554605879, 'L_sep_weight_yyx': 1.7694393161649696e-08, 'L_scale_weight_yyx': 2.3357828158962292e-06, 'learning_rate_yyx': 0.008146909097350647}. Best is trial 0 with value: -2.6330643191486622.
[I 2026-03-18 18:39:27,166] Trial 26 pruned. 
[I 2026-03-18 18:39:28,675] Trial 44 pruned. 
[I 2026-03-18 18:39:28,729] Trial 25 pruned. 
[I 2026-03-18 18:39:29,669] Trial 30 pruned. 
[I 2026-03-18 18:39:32,040] Trial 24 pruned. 
[I 2026-03-18 18:39:35,352] Trial 33 pruned. 
[I 2026-03-18 18:39:41,705] Trial 45 pruned. 
[I 2026-03-18 18:39:42,292] Trial 26 pruned. 
[I 2026-03-18 18:39:42,698] Trial 31 pruned. 
[I 2026-03-18 18:39:45,978] Trial 16 pruned. 
[I 2026-03-18 18:39:50,552] Trial 23 pruned. 
[I 2026-03-18 18:39:51,241] Trial 23 pruned. 
[I 2026-03-18 18:39:52,192] Trial 27 pruned. 
[I 2026-03-18 18:39:52,236] Trial 32 pruned. 
[I 2026-03-18 18:39:53,625] Trial 35 finished with value: -1.6532573644878545 and parameters: {'n_layers_yyx': 1, 'hidden_size_yyx_l0': 6, 'context_size_yyx': 2, 'num_mix_components_yyx': 5, 'context_extractor_yyx': 'lstm', 'activation_func_yyx': 'ReLU', 'L2_weight_yyx': 8.371905483066842e-09, 'L_entropy_weight_yyx': 1.90044634865901e-10, 'L_sep_weight_yyx': 3.5675433621379123e-06, 'L_scale_weight_yyx': 2.056347336332522e-08, 'learning_rate_yyx': 0.009665943863651003}. Best is trial 14 with value: -1.6715868333994597.
[I 2026-03-18 18:39:54,241] Trial 34 pruned. 
[I 2026-03-18 18:39:58,851] Trial 24 pruned. 
[I 2026-03-18 18:40:01,807] Trial 37 pruned. 
[I 2026-03-18 18:40:05,591] Trial 35 pruned. 
[I 2026-03-18 18:40:06,115] Trial 24 pruned. 
[I 2026-03-18 18:40:06,713] Trial 22 pruned. 
[I 2026-03-18 18:40:07,371] Trial 17 pruned. 
[I 2026-03-18 18:40:07,992] Trial 28 pruned. 
[I 2026-03-18 18:40:08,723] Trial 24 pruned. 
[I 2026-03-18 18:40:14,378] Trial 36 pruned. 
[I 2026-03-18 18:40:16,479] Trial 29 pruned. 
[I 2026-03-18 18:40:17,704] Trial 38 pruned. 
[I 2026-03-18 18:40:20,190] Trial 25 pruned. 
[I 2026-03-18 18:40:24,573] Trial 36 pruned. 
[I 2026-03-18 18:40:25,425] Trial 25 pruned. 
[I 2026-03-18 18:40:27,052] Trial 37 pruned. 
[I 2026-03-18 18:40:27,734] Trial 46 pruned. 
[I 2026-03-18 18:40:27,749] Trial 28 pruned. 
[I 2026-03-18 18:40:28,334] Trial 30 pruned. 
[I 2026-03-18 18:40:28,585] Trial 26 pruned. 
[I 2026-03-18 18:40:34,170] Trial 23 finished with value: -1.675936991716372 and parameters: {'n_layers_yyx': 1, 'hidden_size_yyx_l0': 5, 'context_size_yyx': 3, 'num_mix_components_yyx': 3, 'context_extractor_yyx': 'gru', 'activation_func_yyx': 'GELU', 'L2_weight_yyx': 1.1618952365548086e-06, 'L_entropy_weight_yyx': 4.718750469864641e-06, 'L_sep_weight_yyx': 3.627520593433232e-06, 'L_scale_weight_yyx': 1.4498321617111937e-10, 'learning_rate_yyx': 0.005610079248584522}. Best is trial 23 with value: -1.675936991716372.
