[I 2026-03-18 17:27:36,227] Trial 49 pruned. 

Source events: 3828
Target events: 13628
Full model ln_yyx : 95.88126 nats/sec, 6.33205 nats/event
Full model Log loss : -0.54718
Full model ln_yyx : 99.65319 nats/sec, 6.58115 nats/event
Full model Log loss : -0.54933
Full model ln_yyx : 97.71286 nats/sec, 6.45301 nats/event
Full model Log loss : -0.55642
Full model ln_yyx : 96.61186 nats/sec, 6.38030 nats/event
Full model Log loss : -0.54324
Full model ln_yyx : 100.01229 nats/sec, 6.60486 nats/event
Full model Log loss : -0.56672
Full model ln_yyx : 100.07764 nats/sec, 6.60918 nats/event
Full model Log loss : -0.56657
Full model ln_yyx : 100.29910 nats/sec, 6.62380 nats/event
Full model Log loss : -0.57426
Full model ln_yyx : 100.74595 nats/sec, 6.65331 nats/event
Full model Log loss : -0.57009
Full model ln_yyx : 98.33788 nats/sec, 6.49428 nats/event
Full model Log loss : -0.57530
Full model ln_yyx : 101.89700 nats/sec, 6.72933 nats/event
Full model Log loss : -0.57656
Full model ln_yyx : 100.90932 nats/sec, 6.66410 nats/event
Full model Log loss : -0.58238
Full model ln_yyx : 99.39331 nats/sec, 6.56398 nats/event
Full model Log loss : -0.57927
Full model ln_yyx : 98.72095 nats/sec, 6.51958 nats/event
Full model Log loss : -0.54907
Optimization finished. Config saved to results/opt-full/opt_full_61_best_config.txt
[I 2026-03-18 17:27:36,553] Trial 26 pruned. 
[I 2026-03-18 17:27:41,010] Trial 21 pruned. 
[I 2026-03-18 17:27:42,505] Trial 44 pruned. 
[I 2026-03-18 17:27:44,547] Trial 31 pruned. 
[I 2026-03-18 17:27:45,350] Trial 49 pruned. 

Source events: 3828
Target events: 12731
Full model ln_yyx : 92.79615 nats/sec, 6.56009 nats/event
Full model Log loss : -0.56836
Full model ln_yyx : 92.76431 nats/sec, 6.55784 nats/event
Full model Log loss : -0.54585
Full model ln_yyx : 93.16815 nats/sec, 6.58639 nats/event
Full model Log loss : -0.56206
Full model ln_yyx : 91.84126 nats/sec, 6.49259 nats/event
Full model Log loss : -0.55000
Full model ln_yyx : 93.21640 nats/sec, 6.58980 nats/event
Full model Log loss : -0.56107
Full model ln_yyx : 94.05852 nats/sec, 6.64933 nats/event
Full model Log loss : -0.56389
Full model ln_yyx : 93.17493 nats/sec, 6.58687 nats/event
Full model Log loss : -0.57805
Full model ln_yyx : 95.35941 nats/sec, 6.74130 nats/event
Full model Log loss : -0.57307
Full model ln_yyx : 90.71845 nats/sec, 6.41321 nats/event
Full model Log loss : -0.55655
Full model ln_yyx : 91.16103 nats/sec, 6.44450 nats/event
Full model Log loss : -0.55111
Full model ln_yyx : 92.06059 nats/sec, 6.50809 nats/event
Full model Log loss : -0.56493
Optimization finished. Config saved to results/opt-full/opt_full_52_best_config.txt
[I 2026-03-18 17:27:46,631] Trial 44 pruned. 
[I 2026-03-18 17:27:46,912] Trial 27 pruned. 
[I 2026-03-18 17:27:49,781] Trial 45 pruned. 
[I 2026-03-18 17:27:59,850] Trial 45 pruned. 
[I 2026-03-18 17:28:02,167] Trial 22 pruned. 
[I 2026-03-18 17:28:02,946] Trial 46 pruned. 
[I 2026-03-18 17:28:05,867] Trial 32 pruned. 
[I 2026-03-18 17:28:07,351] Trial 46 pruned. 
[I 2026-03-18 17:28:07,533] Trial 28 pruned. 
[I 2026-03-18 17:28:10,675] Trial 45 finished with value: -0.4022762900904605 and parameters: {'n_layers_yyx': 2, 'hidden_size_yyx_l0': 4, 'hidden_size_yyx_l1': 4, 'context_size_yyx': 3, 'num_mix_components_yyx': 5, 'context_extractor_yyx': 'gru', 'activation_func_yyx': 'Tanh', 'L2_weight_yyx': 5.670711591578875e-10, 'L_entropy_weight_yyx': 2.539315913270272e-06, 'L_sep_weight_yyx': 9.189686553696421e-07, 'L_scale_weight_yyx': 9.499262827469154e-07, 'learning_rate_yyx': 0.003319263444409779}. Best is trial 12 with value: -0.46022137621238873.
[I 2026-03-18 17:28:11,031] Trial 47 pruned. 
[I 2026-03-18 17:28:11,484] Trial 35 finished with value: -0.5770481114866317 and parameters: {'n_layers_yyx': 1, 'hidden_size_yyx_l0': 4, 'context_size_yyx': 3, 'num_mix_components_yyx': 4, 'context_extractor_yyx': 'gru', 'activation_func_yyx': 'Tanh', 'L2_weight_yyx': 1.2474767021779368e-07, 'L_entropy_weight_yyx': 7.037641571108488e-05, 'L_sep_weight_yyx': 6.476741242772283e-08, 'L_scale_weight_yyx': 6.925696805909664e-10, 'learning_rate_yyx': 0.009347508552514247}. Best is trial 35 with value: -0.5770481114866317.
[I 2026-03-18 17:28:13,246] Trial 23 pruned. 
[I 2026-03-18 17:28:14,558] Trial 47 pruned. 
[I 2026-03-18 17:28:17,210] Trial 46 pruned. 
[I 2026-03-18 17:28:17,597] Trial 45 finished with value: -0.5745646438703577 and parameters: {'n_layers_yyx': 1, 'hidden_size_yyx_l0': 6, 'context_size_yyx': 3, 'num_mix_components_yyx': 4, 'context_extractor_yyx': 'lstm', 'activation_func_yyx': 'Tanh', 'L2_weight_yyx': 2.423584649942021e-08, 'L_entropy_weight_yyx': 1.7990285893882792e-05, 'L_sep_weight_yyx': 7.773944722252969e-06, 'L_scale_weight_yyx': 1.0492524248676359e-07, 'learning_rate_yyx': 0.0070099695796426035}. Best is trial 27 with value: -0.5752265017167082.
[I 2026-03-18 17:28:17,624] Trial 29 pruned. 
[I 2026-03-18 17:28:17,891] Trial 48 pruned. 
[I 2026-03-18 17:28:18,741] Trial 14 finished with value: -2.9272898002158976 and parameters: {'n_layers_yyx': 2, 'hidden_size_yyx_l0': 4, 'hidden_size_yyx_l1': 6, 'context_size_yyx': 3, 'num_mix_components_yyx': 4, 'context_extractor_yyx': 'lstm', 'activation_func_yyx': 'ReLU', 'L2_weight_yyx': 3.0776461461348587e-08, 'L_entropy_weight_yyx': 5.842386941878348e-06, 'L_sep_weight_yyx': 2.7588475717330787e-06, 'L_scale_weight_yyx': 7.74218886635489e-08, 'learning_rate_yyx': 0.0037171985561022317}. Best is trial 14 with value: -2.9272898002158976.
[I 2026-03-18 17:28:23,571] Trial 24 pruned. 
[I 2026-03-18 17:28:24,293] Trial 47 pruned. 
[I 2026-03-18 17:28:24,554] Trial 46 pruned. 
[I 2026-03-18 17:28:24,812] Trial 42 finished with value: -0.5733150392975735 and parameters: {'n_layers_yyx': 1, 'hidden_size_yyx_l0': 3, 'context_size_yyx': 4, 'num_mix_components_yyx': 3, 'context_extractor_yyx': 'gru', 'activation_func_yyx': 'Tanh', 'L2_weight_yyx': 3.765145046315318e-09, 'L_entropy_weight_yyx': 3.834482992959409e-06, 'L_sep_weight_yyx': 9.130343204851781e-09, 'L_scale_weight_yyx': 1.3343711221025307e-07, 'learning_rate_yyx': 0.007846588573836263}. Best is trial 23 with value: -0.5844188202198138.
[I 2026-03-18 17:28:25,225] Trial 16 finished with value: -2.927486386974833 and parameters: {'n_layers_yyx': 1, 'hidden_size_yyx_l0': 6, 'context_size_yyx': 2, 'num_mix_components_yyx': 3, 'context_extractor_yyx': 'gru', 'activation_func_yyx': 'GELU', 'L2_weight_yyx': 2.2634449353213318e-08, 'L_entropy_weight_yyx': 8.385884642689823e-05, 'L_sep_weight_yyx': 3.979990793487557e-05, 'L_scale_weight_yyx': 7.572708760676978e-07, 'learning_rate_yyx': 0.007433585725679883}. Best is trial 9 with value: -2.9510968045279404.
[I 2026-03-18 17:28:25,505] Trial 12 pruned. 
[I 2026-03-18 17:28:27,957] Trial 48 pruned. 
[I 2026-03-18 17:28:27,964] Trial 33 pruned. 
[I 2026-03-18 17:28:28,502] Trial 23 finished with value: -2.933065301892256 and parameters: {'n_layers_yyx': 1, 'hidden_size_yyx_l0': 5, 'context_size_yyx': 3, 'num_mix_components_yyx': 5, 'context_extractor_yyx': 'gru', 'activation_func_yyx': 'ReLU', 'L2_weight_yyx': 3.604003959669997e-07, 'L_entropy_weight_yyx': 0.0007971108371678015, 'L_sep_weight_yyx': 1.0007385497098487e-10, 'L_scale_weight_yyx': 2.468330830717168e-10, 'learning_rate_yyx': 0.0079978775851018}. Best is trial 15 with value: -2.9509930170610343.
[I 2026-03-18 17:28:28,689] Trial 15 finished with value: -2.9501157174853443 and parameters: {'n_layers_yyx': 1, 'hidden_size_yyx_l0': 5, 'context_size_yyx': 3, 'num_mix_components_yyx': 4, 'context_extractor_yyx': 'gru', 'activation_func_yyx': 'Tanh', 'L2_weight_yyx': 1.7799868769537583e-08, 'L_entropy_weight_yyx': 4.6907014632659737e-08, 'L_sep_weight_yyx': 8.973502007570425e-06, 'L_scale_weight_yyx': 1.9892452902273314e-09, 'learning_rate_yyx': 0.008561676438355169}. Best is trial 15 with value: -2.9501157174853443.
[I 2026-03-18 17:28:30,393] Trial 17 finished with value: -2.8143413996292375 and parameters: {'n_layers_yyx': 2, 'hidden_size_yyx_l0': 5, 'hidden_size_yyx_l1': 4, 'context_size_yyx': 4, 'num_mix_components_yyx': 2, 'context_extractor_yyx': 'gru', 'activation_func_yyx': 'ReLU', 'L2_weight_yyx': 1.0065468606750928e-06, 'L_entropy_weight_yyx': 0.0002633954975978471, 'L_sep_weight_yyx': 5.494063638066248e-07, 'L_scale_weight_yyx': 4.96565709560206e-07, 'learning_rate_yyx': 0.0018073723203427855}. Best is trial 8 with value: -2.955956673037092.
[I 2026-03-18 17:28:31,559] Trial 49 pruned. 

Source events: 3828
Target events: 10752
Full model ln_yyx : 76.76422 nats/sec, 6.42558 nats/event
Full model Log loss : -0.55946
Full model ln_yyx : 76.79847 nats/sec, 6.42844 nats/event
Full model Log loss : -0.55191
Full model ln_yyx : 77.81446 nats/sec, 6.51349 nats/event
Full model Log loss : -0.56931
Full model ln_yyx : 79.22161 nats/sec, 6.63127 nats/event
Full model Log loss : -0.58051
Full model ln_yyx : 74.38484 nats/sec, 6.22641 nats/event
Full model Log loss : -0.55437
Full model ln_yyx : 78.63929 nats/sec, 6.58253 nats/event
Full model Log loss : -0.56572
Full model ln_yyx : 74.93660 nats/sec, 6.27259 nats/event
Full model Log loss : -0.56346
Full model ln_yyx : 77.73143 nats/sec, 6.50654 nats/event
Full model Log loss : -0.58646
Full model ln_yyx : 78.81768 nats/sec, 6.59746 nats/event
Full model Log loss : -0.56758
Full model ln_yyx : 77.96741 nats/sec, 6.52629 nats/event
Full model Log loss : -0.57389
Full model ln_yyx : 77.86575 nats/sec, 6.51778 nats/event
Full model Log loss : -0.57476
Full model ln_yyx : 77.85127 nats/sec, 6.51657 nats/event
Full model Log loss : -0.57352
Full model ln_yyx : 78.83367 nats/sec, 6.59880 nats/event
Full model Log loss : -0.56297
Full model ln_yyx : 77.53896 nats/sec, 6.49043 nats/event
Full model Log loss : -0.57698
Full model ln_yyx : 77.97261 nats/sec, 6.52673 nats/event
Full model Log loss : -0.57818
Optimization finished. Config saved to results/opt-full/opt_full_59_best_config.txt
[I 2026-03-18 17:28:32,767] Trial 17 pruned. 
[I 2026-03-18 17:28:34,205] Trial 25 pruned. 
[I 2026-03-18 17:28:35,649] Trial 17 pruned. 
[I 2026-03-18 17:28:35,807] Trial 48 pruned. 
[I 2026-03-18 17:28:38,411] Trial 47 pruned. 
[I 2026-03-18 17:28:38,737] Trial 24 pruned. 
[I 2026-03-18 17:28:38,737] Trial 34 pruned. 
[I 2026-03-18 17:28:42,639] Trial 18 pruned. 
[I 2026-03-18 17:28:44,641] Trial 18 pruned. 
[I 2026-03-18 17:28:45,091] Trial 36 pruned. 
[I 2026-03-18 17:28:45,429] Trial 13 pruned. 
[I 2026-03-18 17:28:46,911] Trial 49 pruned. 

Source events: 1783
Target events: 11540
Full model ln_yyx : 38.29972 nats/sec, 2.98698 nats/event
Full model Log loss : -0.43463
Full model ln_yyx : 37.98058 nats/sec, 2.96209 nats/event
Full model Log loss : -0.39250
Full model ln_yyx : 37.43428 nats/sec, 2.91948 nats/event
Full model Log loss : -0.42497
Full model ln_yyx : 37.29784 nats/sec, 2.90884 nats/event
Full model Log loss : -0.39083
Full model ln_yyx : 38.31175 nats/sec, 2.98792 nats/event
Full model Log loss : -0.38637
Full model ln_yyx : 37.71446 nats/sec, 2.94134 nats/event
Full model Log loss : -0.38775
Full model ln_yyx : 38.15018 nats/sec, 2.97532 nats/event
Full model Log loss : -0.46022
Full model ln_yyx : 38.34545 nats/sec, 2.99055 nats/event
Full model Log loss : -0.35684
Full model ln_yyx : 38.13256 nats/sec, 2.97394 nats/event
Full model Log loss : -0.43434
Full model ln_yyx : 36.58842 nats/sec, 2.85352 nats/event
Full model Log loss : -0.39112
Full model ln_yyx : 38.21855 nats/sec, 2.98065 nats/event
Full model Log loss : -0.43311
Full model ln_yyx : 37.27599 nats/sec, 2.90714 nats/event
Full model Log loss : -0.42050
Full model ln_yyx : 37.77409 nats/sec, 2.94599 nats/event
Full model Log loss : -0.43582
Full model ln_yyx : 36.88503 nats/sec, 2.87665 nats/event
Full model Log loss : -0.40228
Optimization finished. Config saved to results/opt-full/opt_full_32_best_config.txt
[I 2026-03-18 17:28:50,328] Trial 48 pruned. 
[I 2026-03-18 17:28:54,236] Trial 26 pruned. 
[I 2026-03-18 17:28:57,233] Trial 49 pruned. 

Source events: 3828
Target events: 29032
Full model ln_yyx : 209.74308 nats/sec, 6.50209 nats/event
Full model Log loss : -0.57486
Full model ln_yyx : 207.77464 nats/sec, 6.44107 nats/event
Full model Log loss : -0.55439
Full model ln_yyx : 207.42126 nats/sec, 6.43012 nats/event
Full model Log loss : -0.56137
Full model ln_yyx : 208.96385 nats/sec, 6.47794 nats/event
Full model Log loss : -0.56328
Full model ln_yyx : 209.44761 nats/sec, 6.49293 nats/event
Full model Log loss : -0.55666
Full model ln_yyx : 207.95880 nats/sec, 6.44678 nats/event
Full model Log loss : -0.57100
Full model ln_yyx : 205.58816 nats/sec, 6.37329 nats/event
Full model Log loss : -0.55706
Full model ln_yyx : 211.22978 nats/sec, 6.54818 nats/event
Full model Log loss : -0.56040
Full model ln_yyx : 211.90387 nats/sec, 6.56908 nats/event
Full model Log loss : -0.57126
Full model ln_yyx : 210.03864 nats/sec, 6.51126 nats/event
Full model Log loss : -0.56968
Full model ln_yyx : 212.49196 nats/sec, 6.58731 nats/event
Full model Log loss : -0.57495
Full model ln_yyx : 212.54509 nats/sec, 6.58896 nats/event
Full model Log loss : -0.57523
Full model ln_yyx : 204.53034 nats/sec, 6.34050 nats/event
Full model Log loss : -0.55202
Full model ln_yyx : 212.76369 nats/sec, 6.59573 nats/event
Full model Log loss : -0.57451
Full model ln_yyx : 210.21818 nats/sec, 6.51682 nats/event
Full model Log loss : -0.57502
Full model ln_yyx : 210.00007 nats/sec, 6.51006 nats/event
Full model Log loss : -0.56144
Full model ln_yyx : 212.62881 nats/sec, 6.59155 nats/event
Full model Log loss : -0.57456
Optimization finished. Config saved to results/opt-full/opt_full_55_best_config.txt
[I 2026-03-18 17:28:57,285] Trial 43 pruned. 
[I 2026-03-18 17:28:57,691] Trial 37 pruned. 
[I 2026-03-18 17:28:59,208] Trial 25 pruned. 
[I 2026-03-18 17:29:00,398] Trial 49 pruned. 

Source events: 3828
Target events: 38515
Full model ln_yyx : 268.26877 nats/sec, 6.26878 nats/event
Full model Log loss : -0.54367
Full model ln_yyx : 279.07817 nats/sec, 6.52136 nats/event
Full model Log loss : -0.57780
Full model ln_yyx : 267.61075 nats/sec, 6.25340 nats/event
Full model Log loss : -0.51510
Full model ln_yyx : 274.13527 nats/sec, 6.40586 nats/event
Full model Log loss : -0.55235
Full model ln_yyx : 276.77432 nats/sec, 6.46753 nats/event
Full model Log loss : -0.56281
Full model ln_yyx : 275.42082 nats/sec, 6.43590 nats/event
Full model Log loss : -0.57686
Full model ln_yyx : 278.62976 nats/sec, 6.51089 nats/event
Full model Log loss : -0.57539
Full model ln_yyx : 276.32603 nats/sec, 6.45705 nats/event
Full model Log loss : -0.55547
Full model ln_yyx : 273.39436 nats/sec, 6.38855 nats/event
Full model Log loss : -0.55875
Full model ln_yyx : 278.31217 nats/sec, 6.50346 nats/event
Full model Log loss : -0.57095
Full model ln_yyx : 279.72585 nats/sec, 6.53650 nats/event
Full model Log loss : -0.57024
Full model ln_yyx : 278.51551 nats/sec, 6.50822 nats/event
Full model Log loss : -0.57541
Full model ln_yyx : 277.77237 nats/sec, 6.49085 nats/event
Full model Log loss : -0.56251
Full model ln_yyx : 276.99117 nats/sec, 6.47260 nats/event
Full model Log loss : -0.56809
Full model ln_yyx : 275.03878 nats/sec, 6.42697 nats/event
Full model Log loss : -0.57037
Optimization finished. Config saved to results/opt-full/opt_full_57_best_config.txt
[I 2026-03-18 17:29:02,091] Trial 19 pruned. 
[I 2026-03-18 17:29:03,521] Trial 19 pruned. 
[I 2026-03-18 17:29:08,086] Trial 38 pruned. 
[I 2026-03-18 17:29:11,588] Trial 14 finished with value: -2.919056358298909 and parameters: {'n_layers_yyx': 1, 'hidden_size_yyx_l0': 4, 'context_size_yyx': 3, 'num_mix_components_yyx': 4, 'context_extractor_yyx': 'lstm', 'activation_func_yyx': 'ReLU', 'L2_weight_yyx': 1.9856705803701682e-09, 'L_entropy_weight_yyx': 6.9688597718933294e-09, 'L_sep_weight_yyx': 7.435236154942651e-09, 'L_scale_weight_yyx': 1.6576218245916246e-06, 'learning_rate_yyx': 0.005313509895206839}. Best is trial 1 with value: -2.9497769660834225.
[I 2026-03-18 17:29:12,884] Trial 39 pruned. 
[I 2026-03-18 17:29:12,884] Trial 27 pruned. 
[I 2026-03-18 17:29:17,095] Trial 26 pruned. 
[I 2026-03-18 17:29:20,035] Trial 15 pruned. 
[I 2026-03-18 17:29:21,342] Trial 20 pruned. 
[I 2026-03-18 17:29:21,533] Trial 28 pruned. 
[I 2026-03-18 17:29:21,555] Trial 16 pruned. 
[I 2026-03-18 17:29:22,102] Trial 13 finished with value: -2.9379485145218736 and parameters: {'n_layers_yyx': 1, 'hidden_size_yyx_l0': 3, 'context_size_yyx': 2, 'num_mix_components_yyx': 5, 'context_extractor_yyx': 'gru', 'activation_func_yyx': 'Tanh', 'L2_weight_yyx': 1.2827092509550544e-10, 'L_entropy_weight_yyx': 9.320570646425488e-08, 'L_sep_weight_yyx': 3.1393869764052044e-07, 'L_scale_weight_yyx': 5.576755541822981e-08, 'learning_rate_yyx': 0.009442108946266112}. Best is trial 12 with value: -2.9416514371178453.
[I 2026-03-18 17:29:23,547] Trial 40 pruned. 
[I 2026-03-18 17:29:28,261] Trial 19 finished with value: -2.9530185963009803 and parameters: {'n_layers_yyx': 1, 'hidden_size_yyx_l0': 6, 'context_size_yyx': 3, 'num_mix_components_yyx': 2, 'context_extractor_yyx': 'gru', 'activation_func_yyx': 'GELU', 'L2_weight_yyx': 1.2989518930515442e-08, 'L_entropy_weight_yyx': 2.673528575715285e-08, 'L_sep_weight_yyx': 2.2990871159379416e-09, 'L_scale_weight_yyx': 0.0008594638178393686, 'learning_rate_yyx': 0.006862716906849941}. Best is trial 3 with value: -2.95615718224045.
[I 2026-03-18 17:29:30,694] Trial 29 pruned. 
[I 2026-03-18 17:29:34,991] Trial 27 pruned. 
[I 2026-03-18 17:29:37,855] Trial 18 finished with value: -2.8860899319444884 and parameters: {'n_layers_yyx': 1, 'hidden_size_yyx_l0': 3, 'context_size_yyx': 4, 'num_mix_components_yyx': 3, 'context_extractor_yyx': 'lstm', 'activation_func_yyx': 'GELU', 'L2_weight_yyx': 4.476119367810919e-05, 'L_entropy_weight_yyx': 6.229196655633775e-06, 'L_sep_weight_yyx': 0.00047606311868616933, 'L_scale_weight_yyx': 4.445750328058683e-08, 'learning_rate_yyx': 0.009827225143546104}. Best is trial 8 with value: -2.955956673037092.
[I 2026-03-18 17:29:38,403] Trial 44 finished with value: -0.5843341937583283 and parameters: {'n_layers_yyx': 1, 'hidden_size_yyx_l0': 4, 'context_size_yyx': 4, 'num_mix_components_yyx': 3, 'context_extractor_yyx': 'gru', 'activation_func_yyx': 'Tanh', 'L2_weight_yyx': 2.2499368115307634e-08, 'L_entropy_weight_yyx': 9.71886786470679e-06, 'L_sep_weight_yyx': 7.879306213026242e-05, 'L_scale_weight_yyx': 1.5205495430916362e-09, 'learning_rate_yyx': 0.006153277146543173}. Best is trial 23 with value: -0.5844188202198138.
[I 2026-03-18 17:29:38,549] Trial 16 pruned. 
[I 2026-03-18 17:29:47,110] Trial 17 pruned. 
[I 2026-03-18 17:29:48,761] Trial 30 pruned. 
[I 2026-03-18 17:29:49,340] Trial 41 pruned. 
[I 2026-03-18 17:29:56,235] Trial 19 pruned. 
[I 2026-03-18 17:30:03,876] Trial 18 pruned. 
[I 2026-03-18 17:30:04,248] Trial 45 pruned. 
[I 2026-03-18 17:30:07,324] Trial 11 finished with value: -2.9696741310759465 and parameters: {'n_layers_yyx': 2, 'hidden_size_yyx_l0': 4, 'hidden_size_yyx_l1': 4, 'context_size_yyx': 3, 'num_mix_components_yyx': 5, 'context_extractor_yyx': 'gru', 'activation_func_yyx': 'Tanh', 'L2_weight_yyx': 3.8262329056694434e-07, 'L_entropy_weight_yyx': 9.185282124473083e-07, 'L_sep_weight_yyx': 0.0006902424603312806, 'L_scale_weight_yyx': 4.093618709624475e-06, 'learning_rate_yyx': 0.0032945141490085847}. Best is trial 5 with value: -2.9729516240610265.
[I 2026-03-18 17:30:08,185] Trial 21 pruned. 
[I 2026-03-18 17:30:10,122] Trial 46 pruned. 
[I 2026-03-18 17:30:13,036] Trial 20 pruned. 
[I 2026-03-18 17:30:16,267] Trial 47 pruned. 
[I 2026-03-18 17:30:16,564] Trial 20 pruned. 
[I 2026-03-18 17:30:16,576] Trial 42 pruned. 
[I 2026-03-18 17:30:20,920] Trial 21 pruned. 
[I 2026-03-18 17:30:22,101] Trial 48 pruned. 
[I 2026-03-18 17:30:27,792] Trial 43 pruned. 
[I 2026-03-18 17:30:29,047] Trial 22 pruned. 
[I 2026-03-18 17:30:33,787] Trial 44 pruned. 
[I 2026-03-18 17:30:35,215] Trial 21 pruned. 
[I 2026-03-18 17:30:36,493] Trial 14 finished with value: -2.8923891953788936 and parameters: {'n_layers_yyx': 1, 'hidden_size_yyx_l0': 6, 'context_size_yyx': 2, 'num_mix_components_yyx': 4, 'context_extractor_yyx': 'lstm', 'activation_func_yyx': 'Tanh', 'L2_weight_yyx': 1.3645827451579376e-10, 'L_entropy_weight_yyx': 1.4259797096652035e-06, 'L_sep_weight_yyx': 8.883034392901475e-05, 'L_scale_weight_yyx': 8.721913316471503e-07, 'learning_rate_yyx': 0.0068471595788706175}. Best is trial 14 with value: -2.8923891953788936.
[I 2026-03-18 17:30:37,441] Trial 30 finished with value: -2.9493813872998613 and parameters: {'n_layers_yyx': 2, 'hidden_size_yyx_l0': 6, 'hidden_size_yyx_l1': 6, 'context_size_yyx': 3, 'num_mix_components_yyx': 5, 'context_extractor_yyx': 'gru', 'activation_func_yyx': 'Tanh', 'L2_weight_yyx': 5.075762255434893e-07, 'L_entropy_weight_yyx': 1.470000376829843e-08, 'L_sep_weight_yyx': 3.4053997071667675e-07, 'L_scale_weight_yyx': 1.1802376465054462e-09, 'learning_rate_yyx': 0.005036741271172736}. Best is trial 12 with value: -2.9595510816550052.
[I 2026-03-18 17:30:37,696] Trial 23 pruned. 
