[I 2026-03-18 20:03:45,174] Trial 41 pruned. 
[I 2026-03-18 20:03:46,502] Trial 45 pruned. 
[I 2026-03-18 20:03:47,543] Trial 40 pruned. 
[I 2026-03-18 20:03:47,546] Trial 43 finished with value: -1.981774451117728 and parameters: {'n_layers_yyx': 2, 'hidden_size_yyx_l0': 5, 'hidden_size_yyx_l1': 6, 'context_size_yyx': 3, 'num_mix_components_yyx': 4, 'context_extractor_yyx': 'lstm', 'activation_func_yyx': 'Tanh', 'L2_weight_yyx': 0.00032128852134578943, 'L_entropy_weight_yyx': 1.937196688969589e-06, 'L_sep_weight_yyx': 3.8531321064866844e-10, 'L_scale_weight_yyx': 5.6540706457170564e-08, 'learning_rate_yyx': 0.009780228175107576}. Best is trial 1 with value: -1.9828018961884801.
[I 2026-03-18 20:03:49,909] Trial 47 pruned. 
[I 2026-03-18 20:03:50,378] Trial 37 pruned. 
[I 2026-03-18 20:03:53,331] Trial 31 finished with value: -2.5110693731769085 and parameters: {'n_layers_yyx': 1, 'hidden_size_yyx_l0': 6, 'context_size_yyx': 1, 'num_mix_components_yyx': 5, 'context_extractor_yyx': 'lstm', 'activation_func_yyx': 'ReLU', 'L2_weight_yyx': 4.8729581827328226e-05, 'L_entropy_weight_yyx': 1.9713868360088575e-07, 'L_sep_weight_yyx': 3.94310754582678e-07, 'L_scale_weight_yyx': 4.423490263194851e-09, 'learning_rate_yyx': 0.009589536446686451}. Best is trial 23 with value: -2.5132993257512335.
[I 2026-03-18 20:03:55,010] Trial 28 pruned. 
[I 2026-03-18 20:03:55,121] Trial 42 pruned. 
[I 2026-03-18 20:03:55,460] Trial 24 finished with value: -2.5134071858723956 and parameters: {'n_layers_yyx': 1, 'hidden_size_yyx_l0': 4, 'context_size_yyx': 4, 'num_mix_components_yyx': 3, 'context_extractor_yyx': 'gru', 'activation_func_yyx': 'ReLU', 'L2_weight_yyx': 0.0001929748996921931, 'L_entropy_weight_yyx': 4.3541172307308386e-07, 'L_sep_weight_yyx': 0.0007295027496277352, 'L_scale_weight_yyx': 1.8054869145665524e-07, 'learning_rate_yyx': 0.008067525902967825}. Best is trial 5 with value: -2.5140323195684524.
[I 2026-03-18 20:04:03,535] Trial 48 pruned. 
[I 2026-03-18 20:04:06,296] Trial 28 pruned. 
[I 2026-03-18 20:04:07,873] Trial 36 pruned. 
[I 2026-03-18 20:04:10,994] Trial 41 pruned. 
[I 2026-03-18 20:04:15,892] Trial 46 pruned. 
[I 2026-03-18 20:04:19,825] Trial 29 pruned. 
[I 2026-03-18 20:04:20,017] Trial 33 pruned. 
[I 2026-03-18 20:04:20,137] Trial 41 pruned. 
[I 2026-03-18 20:04:30,843] Trial 49 pruned. 

Source events: 10752
Target events: 5634
Full model ln_yyx : 196.11269 nats/sec, 31.32791 nats/event
Full model Log loss : -1.68851
Full model ln_yyx : 194.75787 nats/sec, 31.11148 nats/event
Full model Log loss : -1.68151
Full model ln_yyx : 196.55814 nats/sec, 31.39906 nats/event
Full model Log loss : -1.69655
Full model ln_yyx : 193.33997 nats/sec, 30.88498 nats/event
Full model Log loss : -1.67353
Full model ln_yyx : 194.58944 nats/sec, 31.08457 nats/event
Full model Log loss : -1.69202
Full model ln_yyx : 196.52627 nats/sec, 31.39397 nats/event
Full model Log loss : -1.70030
Full model ln_yyx : 196.56321 nats/sec, 31.39987 nats/event
Full model Log loss : -1.69718
Full model ln_yyx : 195.96649 nats/sec, 31.30455 nats/event
Full model Log loss : -1.69719
Full model ln_yyx : 196.55465 nats/sec, 31.39851 nats/event
Full model Log loss : -1.69761
Full model ln_yyx : 195.99554 nats/sec, 31.30919 nats/event
Full model Log loss : -1.69584
Full model ln_yyx : 197.26368 nats/sec, 31.51177 nats/event
Full model Log loss : -1.69793
Full model ln_yyx : 194.25904 nats/sec, 31.03180 nats/event
Full model Log loss : -1.69310
Full model ln_yyx : 195.22102 nats/sec, 31.18547 nats/event
Full model Log loss : -1.69386
Optimization finished. Config saved to results/opt-full/opt_full_305_best_config.txt
[I 2026-03-18 20:04:32,578] Trial 32 finished with value: -2.034980343729772 and parameters: {'n_layers_yyx': 1, 'hidden_size_yyx_l0': 6, 'context_size_yyx': 4, 'num_mix_components_yyx': 5, 'context_extractor_yyx': 'lstm', 'activation_func_yyx': 'ReLU', 'L2_weight_yyx': 1.2022092896472286e-07, 'L_entropy_weight_yyx': 4.830882799354902e-10, 'L_sep_weight_yyx': 7.957292172578608e-07, 'L_scale_weight_yyx': 4.1438927198172365e-10, 'learning_rate_yyx': 0.009712010824890491}. Best is trial 8 with value: -2.0365283470022115.
[I 2026-03-18 20:04:36,028] Trial 38 pruned. 
[I 2026-03-18 20:04:49,243] Trial 25 pruned. 
[I 2026-03-18 20:04:50,406] Trial 42 pruned. 
[I 2026-03-18 20:04:55,736] Trial 29 pruned. 
[I 2026-03-18 20:05:03,889] Trial 46 finished with value: -1.671285193909366 and parameters: {'n_layers_yyx': 1, 'hidden_size_yyx_l0': 4, 'context_size_yyx': 2, 'num_mix_components_yyx': 5, 'context_extractor_yyx': 'gru', 'activation_func_yyx': 'Tanh', 'L2_weight_yyx': 1.9620099432011522e-10, 'L_entropy_weight_yyx': 6.466574605928432e-06, 'L_sep_weight_yyx': 1.0611542789831279e-10, 'L_scale_weight_yyx': 3.96893975689069e-07, 'learning_rate_yyx': 0.004197356787777734}. Best is trial 22 with value: -1.6797879616381284.
[I 2026-03-18 20:05:07,137] Trial 42 pruned. 
[I 2026-03-18 20:05:15,502] Trial 30 pruned. 
[I 2026-03-18 20:05:19,506] Trial 33 pruned. 
[I 2026-03-18 20:05:28,139] Trial 35 finished with value: -1.6753530140280553 and parameters: {'n_layers_yyx': 2, 'hidden_size_yyx_l0': 3, 'hidden_size_yyx_l1': 6, 'context_size_yyx': 4, 'num_mix_components_yyx': 5, 'context_extractor_yyx': 'lstm', 'activation_func_yyx': 'Tanh', 'L2_weight_yyx': 5.262991869811784e-08, 'L_entropy_weight_yyx': 4.091569772509761e-09, 'L_sep_weight_yyx': 3.1152855942901796e-10, 'L_scale_weight_yyx': 6.208559926175213e-07, 'learning_rate_yyx': 0.008505436237726389}. Best is trial 32 with value: -1.6813953661792613.
[I 2026-03-18 20:05:29,982] Trial 43 pruned. 
[I 2026-03-18 20:05:32,261] Trial 43 finished with value: -1.6766934044254564 and parameters: {'n_layers_yyx': 1, 'hidden_size_yyx_l0': 6, 'context_size_yyx': 4, 'num_mix_components_yyx': 4, 'context_extractor_yyx': 'lstm', 'activation_func_yyx': 'Tanh', 'L2_weight_yyx': 0.00011460162730869351, 'L_entropy_weight_yyx': 2.839512200730831e-10, 'L_sep_weight_yyx': 1.7060993992237103e-07, 'L_scale_weight_yyx': 2.282364972416662e-08, 'learning_rate_yyx': 0.008195245830684232}. Best is trial 42 with value: -1.6806136813660988.
[I 2026-03-18 20:05:45,184] Trial 43 pruned. 
[I 2026-03-18 20:05:46,834] Trial 44 pruned. 
[I 2026-03-18 20:05:50,185] Trial 31 finished with value: -2.5108348734978794 and parameters: {'n_layers_yyx': 1, 'hidden_size_yyx_l0': 4, 'context_size_yyx': 4, 'num_mix_components_yyx': 3, 'context_extractor_yyx': 'lstm', 'activation_func_yyx': 'GELU', 'L2_weight_yyx': 5.555092245628276e-06, 'L_entropy_weight_yyx': 4.614935734426116e-06, 'L_sep_weight_yyx': 6.44192381341538e-05, 'L_scale_weight_yyx': 7.512800975628005e-08, 'learning_rate_yyx': 0.004542730624189272}. Best is trial 1 with value: -2.5125601952756833.
[I 2026-03-18 20:05:55,960] Trial 27 finished with value: -2.514055277390782 and parameters: {'n_layers_yyx': 2, 'hidden_size_yyx_l0': 3, 'hidden_size_yyx_l1': 4, 'context_size_yyx': 3, 'num_mix_components_yyx': 4, 'context_extractor_yyx': 'gru', 'activation_func_yyx': 'ReLU', 'L2_weight_yyx': 5.397827437506844e-06, 'L_entropy_weight_yyx': 9.468559945275365e-07, 'L_sep_weight_yyx': 2.3940083174405305e-07, 'L_scale_weight_yyx': 2.194506030164865e-05, 'learning_rate_yyx': 0.007567462326500823}. Best is trial 22 with value: -2.5155989726836543.
[I 2026-03-18 20:05:56,593] Trial 29 pruned. 
[I 2026-03-18 20:06:07,166] Trial 29 finished with value: -2.5108338840495406 and parameters: {'n_layers_yyx': 2, 'hidden_size_yyx_l0': 6, 'hidden_size_yyx_l1': 4, 'context_size_yyx': 1, 'num_mix_components_yyx': 3, 'context_extractor_yyx': 'gru', 'activation_func_yyx': 'ReLU', 'L2_weight_yyx': 9.052575734345286e-09, 'L_entropy_weight_yyx': 2.3032724653492865e-10, 'L_sep_weight_yyx': 1.1783675527583663e-10, 'L_scale_weight_yyx': 9.516662427052293e-05, 'learning_rate_yyx': 0.008132533646861586}. Best is trial 21 with value: -2.5132035092741223.
[I 2026-03-18 20:06:08,247] Trial 19 finished with value: -2.509295821122467 and parameters: {'n_layers_yyx': 2, 'hidden_size_yyx_l0': 6, 'hidden_size_yyx_l1': 2, 'context_size_yyx': 3, 'num_mix_components_yyx': 4, 'context_extractor_yyx': 'gru', 'activation_func_yyx': 'Tanh', 'L2_weight_yyx': 1.867508054862968e-05, 'L_entropy_weight_yyx': 1.2240062878070897e-08, 'L_sep_weight_yyx': 0.0009735400212694744, 'L_scale_weight_yyx': 1.6066021411809735e-06, 'learning_rate_yyx': 0.005786405048363306}. Best is trial 0 with value: -2.511745534136428.
[I 2026-03-18 20:06:14,504] Trial 32 pruned. 
[I 2026-03-18 20:06:20,503] Trial 39 pruned. 
[I 2026-03-18 20:06:21,473] Trial 30 pruned. 
[I 2026-03-18 20:06:22,062] Trial 45 pruned. 
[I 2026-03-18 20:06:22,411] Trial 34 pruned. 
[I 2026-03-18 20:06:23,307] Trial 30 pruned. 
[I 2026-03-18 20:06:24,423] Trial 46 finished with value: -1.9641318106436514 and parameters: {'n_layers_yyx': 2, 'hidden_size_yyx_l0': 3, 'hidden_size_yyx_l1': 3, 'context_size_yyx': 4, 'num_mix_components_yyx': 1, 'context_extractor_yyx': 'lstm', 'activation_func_yyx': 'ReLU', 'L2_weight_yyx': 9.170011689366356e-10, 'L_entropy_weight_yyx': 5.741428179209525e-08, 'L_sep_weight_yyx': 3.480345605075807e-08, 'L_scale_weight_yyx': 2.1035052801701913e-06, 'learning_rate_yyx': 0.005910632482990257}. Best is trial 15 with value: -1.9940496908651817.
[I 2026-03-18 20:06:28,331] Trial 44 finished with value: -1.9816246235681094 and parameters: {'n_layers_yyx': 2, 'hidden_size_yyx_l0': 5, 'hidden_size_yyx_l1': 6, 'context_size_yyx': 3, 'num_mix_components_yyx': 4, 'context_extractor_yyx': 'lstm', 'activation_func_yyx': 'Tanh', 'L2_weight_yyx': 0.0004441250762772825, 'L_entropy_weight_yyx': 2.00208466785354e-06, 'L_sep_weight_yyx': 3.2240870966607444e-10, 'L_scale_weight_yyx': 7.236276220535796e-08, 'learning_rate_yyx': 0.009726261961208507}. Best is trial 1 with value: -1.9828018961884801.
[I 2026-03-18 20:06:32,561] Trial 47 pruned. 
[I 2026-03-18 20:06:35,795] Trial 33 finished with value: -1.6714483258358737 and parameters: {'n_layers_yyx': 2, 'hidden_size_yyx_l0': 5, 'hidden_size_yyx_l1': 4, 'context_size_yyx': 4, 'num_mix_components_yyx': 4, 'context_extractor_yyx': 'gru', 'activation_func_yyx': 'Tanh', 'L2_weight_yyx': 2.405987807764728e-07, 'L_entropy_weight_yyx': 2.34337780119493e-10, 'L_sep_weight_yyx': 1.629069020511173e-05, 'L_scale_weight_yyx': 4.462694574691037e-07, 'learning_rate_yyx': 0.007794578641535409}. Best is trial 15 with value: -1.6819845856754096.
[I 2026-03-18 20:06:43,253] Trial 35 pruned. 
[I 2026-03-18 20:06:45,237] Trial 26 pruned. 
[I 2026-03-18 20:06:49,329] Trial 47 pruned. 
[I 2026-03-18 20:06:54,485] Trial 48 pruned. 
[I 2026-03-18 20:06:55,188] Trial 34 pruned. 
[I 2026-03-18 20:06:56,411] Trial 36 pruned. 
[I 2026-03-18 20:07:00,381] Trial 30 pruned. 
[I 2026-03-18 20:07:07,960] Trial 34 pruned. 
[I 2026-03-18 20:07:08,689] Trial 31 pruned. 
[I 2026-03-18 20:07:10,247] Trial 36 pruned. 
[I 2026-03-18 20:07:17,712] Trial 49 pruned. 

Source events: 10752
Target events: 32635
Full model ln_yyx : 1134.57811 nats/sec, 31.28912 nats/event
Full model Log loss : -1.67534
Full model ln_yyx : 1127.56981 nats/sec, 31.09584 nats/event
Full model Log loss : -1.65492
Full model ln_yyx : 1129.59706 nats/sec, 31.15175 nats/event
Full model Log loss : -1.67765
Full model ln_yyx : 1129.46464 nats/sec, 31.14810 nats/event
Full model Log loss : -1.67635
Full model ln_yyx : 1083.07444 nats/sec, 29.86876 nats/event
Full model Log loss : -1.56779
Full model ln_yyx : 1129.31220 nats/sec, 31.14389 nats/event
Full model Log loss : -1.67306
Full model ln_yyx : 1130.89738 nats/sec, 31.18761 nats/event
Full model Log loss : -1.66150
Full model ln_yyx : 1135.70200 nats/sec, 31.32011 nats/event
Full model Log loss : -1.67838
Full model ln_yyx : 1130.42594 nats/sec, 31.17461 nats/event
Full model Log loss : -1.67425
Full model ln_yyx : 1125.23013 nats/sec, 31.03132 nats/event
Full model Log loss : -1.67433
Full model ln_yyx : 1141.36427 nats/sec, 31.47626 nats/event
Full model Log loss : -1.67979
Full model ln_yyx : 1128.57293 nats/sec, 31.12351 nats/event
Full model Log loss : -1.67470
Full model ln_yyx : 1124.14537 nats/sec, 31.00140 nats/event
Full model Log loss : -1.67129
Optimization finished. Config saved to results/opt-full/opt_full_307_best_config.txt
[I 2026-03-18 20:07:22,374] Trial 31 pruned. 
[I 2026-03-18 20:07:24,548] Trial 35 pruned. 
[I 2026-03-18 20:07:31,759] Trial 44 pruned. 
[I 2026-03-18 20:07:52,729] Trial 36 pruned. 
[I 2026-03-18 20:08:05,403] Trial 37 pruned. 
[I 2026-03-18 20:08:07,398] Trial 37 pruned. 
[I 2026-03-18 20:08:08,364] Trial 40 pruned. 
[I 2026-03-18 20:08:20,615] Trial 47 finished with value: -1.7008289727639025 and parameters: {'n_layers_yyx': 2, 'hidden_size_yyx_l0': 2, 'hidden_size_yyx_l1': 4, 'context_size_yyx': 4, 'num_mix_components_yyx': 3, 'context_extractor_yyx': 'lstm', 'activation_func_yyx': 'GELU', 'L2_weight_yyx': 1.1119346130742861e-07, 'L_entropy_weight_yyx': 2.4943657578489345e-07, 'L_sep_weight_yyx': 4.568822995810961e-10, 'L_scale_weight_yyx': 1.1305206836045506e-07, 'learning_rate_yyx': 0.006319120216370467}. Best is trial 5 with value: -1.704671424204909.
[I 2026-03-18 20:08:27,382] Trial 27 finished with value: -2.5094734574659325 and parameters: {'n_layers_yyx': 2, 'hidden_size_yyx_l0': 4, 'hidden_size_yyx_l1': 5, 'context_size_yyx': 2, 'num_mix_components_yyx': 1, 'context_extractor_yyx': 'gru', 'activation_func_yyx': 'ReLU', 'L2_weight_yyx': 2.881345352607325e-07, 'L_entropy_weight_yyx': 3.358850311771146e-09, 'L_sep_weight_yyx': 7.038150373602258e-07, 'L_scale_weight_yyx': 1.151137957244836e-07, 'learning_rate_yyx': 0.0036893453241395053}. Best is trial 1 with value: -2.511856338115334.
[I 2026-03-18 20:08:29,093] Trial 38 pruned. 
[I 2026-03-18 20:08:33,455] Trial 38 pruned. 
[I 2026-03-18 20:08:35,889] Trial 41 pruned. 
[I 2026-03-18 20:08:42,745] Trial 48 pruned. 
[I 2026-03-18 20:08:47,196] Trial 37 pruned. 
[I 2026-03-18 20:08:47,447] Trial 39 pruned. 
[I 2026-03-18 20:08:50,668] Trial 44 finished with value: -1.676850006822094 and parameters: {'n_layers_yyx': 1, 'hidden_size_yyx_l0': 6, 'context_size_yyx': 4, 'num_mix_components_yyx': 4, 'context_extractor_yyx': 'lstm', 'activation_func_yyx': 'Tanh', 'L2_weight_yyx': 9.435499599864947e-05, 'L_entropy_weight_yyx': 2.484376334185606e-10, 'L_sep_weight_yyx': 1.973220614345762e-07, 'L_scale_weight_yyx': 9.068446758742444e-09, 'learning_rate_yyx': 0.008196508223917548}. Best is trial 42 with value: -1.6806136813660988.
[I 2026-03-18 20:08:51,267] Trial 49 pruned. 

Source events: 10752
Target events: 3828
Full model ln_yyx : 132.36973 nats/sec, 31.12141 nats/event
Full model Log loss : -1.68936
Full model ln_yyx : 132.80054 nats/sec, 31.22270 nats/event
Full model Log loss : -1.70327
Full model ln_yyx : 132.60727 nats/sec, 31.17726 nats/event
Full model Log loss : -1.70467
Full model ln_yyx : 131.87207 nats/sec, 31.00441 nats/event
Full model Log loss : -1.69959
Full model ln_yyx : 132.90223 nats/sec, 31.24661 nats/event
Full model Log loss : -1.70134
Full model ln_yyx : 132.96950 nats/sec, 31.26242 nats/event
Full model Log loss : -1.70205
Full model ln_yyx : 132.86324 nats/sec, 31.23744 nats/event
Full model Log loss : -1.68721
Full model ln_yyx : 132.83730 nats/sec, 31.23134 nats/event
Full model Log loss : -1.70220
Full model ln_yyx : 132.87513 nats/sec, 31.24023 nats/event
Full model Log loss : -1.70427
Full model ln_yyx : 132.47484 nats/sec, 31.14612 nats/event
Full model Log loss : -1.70275
Full model ln_yyx : 133.39717 nats/sec, 31.36297 nats/event
Full model Log loss : -1.70371
Full model ln_yyx : 132.48868 nats/sec, 31.14938 nats/event
Full model Log loss : -1.70268
Full model ln_yyx : 132.29352 nats/sec, 31.10349 nats/event
Full model Log loss : -1.70083
Optimization finished. Config saved to results/opt-full/opt_full_303_best_config.txt
[I 2026-03-18 20:08:56,273] Trial 40 pruned. 
[I 2026-03-18 20:09:10,783] Trial 31 pruned. 
[I 2026-03-18 20:09:10,796] Trial 32 pruned. 
[I 2026-03-18 20:09:11,805] Trial 28 pruned. 
[I 2026-03-18 20:09:11,808] Trial 37 finished with value: -1.9819899628189759 and parameters: {'n_layers_yyx': 2, 'hidden_size_yyx_l0': 5, 'hidden_size_yyx_l1': 3, 'context_size_yyx': 4, 'num_mix_components_yyx': 5, 'context_extractor_yyx': 'gru', 'activation_func_yyx': 'Tanh', 'L2_weight_yyx': 9.949951546150867e-08, 'L_entropy_weight_yyx': 2.3054541286452417e-05, 'L_sep_weight_yyx': 9.707940860220311e-09, 'L_scale_weight_yyx': 8.585787656407121e-07, 'learning_rate_yyx': 0.0067247466645795695}. Best is trial 12 with value: -1.983840502266522.
[I 2026-03-18 20:09:12,728] Trial 18 finished with value: -2.5135148288392437 and parameters: {'n_layers_yyx': 1, 'hidden_size_yyx_l0': 6, 'context_size_yyx': 2, 'num_mix_components_yyx': 5, 'context_extractor_yyx': 'lstm', 'activation_func_yyx': 'GELU', 'L2_weight_yyx': 3.3220583209620286e-08, 'L_entropy_weight_yyx': 8.435217808834012e-10, 'L_sep_weight_yyx': 5.318868954198863e-05, 'L_scale_weight_yyx': 1.801825539744478e-08, 'learning_rate_yyx': 0.0031305450345240297}. Best is trial 12 with value: -2.51518345292619.
[I 2026-03-18 20:09:27,721] Trial 32 finished with value: -2.5129029514784094 and parameters: {'n_layers_yyx': 1, 'hidden_size_yyx_l0': 6, 'context_size_yyx': 1, 'num_mix_components_yyx': 5, 'context_extractor_yyx': 'lstm', 'activation_func_yyx': 'ReLU', 'L2_weight_yyx': 0.00011821900062459131, 'L_entropy_weight_yyx': 3.723613683195964e-08, 'L_sep_weight_yyx': 5.879291156058661e-07, 'L_scale_weight_yyx': 1.1544304576276435e-08, 'learning_rate_yyx': 0.0078694048841694}. Best is trial 23 with value: -2.5132993257512335.
[I 2026-03-18 20:09:28,134] Trial 45 finished with value: -1.980358729473318 and parameters: {'n_layers_yyx': 2, 'hidden_size_yyx_l0': 5, 'hidden_size_yyx_l1': 6, 'context_size_yyx': 3, 'num_mix_components_yyx': 5, 'context_extractor_yyx': 'lstm', 'activation_func_yyx': 'Tanh', 'L2_weight_yyx': 0.00018003075435909656, 'L_entropy_weight_yyx': 3.025540981223259e-07, 'L_sep_weight_yyx': 7.699875334819047e-10, 'L_scale_weight_yyx': 6.4571162195126705e-09, 'learning_rate_yyx': 0.008697166269735046}. Best is trial 1 with value: -1.9828018961884801.
[I 2026-03-18 20:09:28,845] Trial 38 pruned. 
[I 2026-03-18 20:09:28,905] Trial 41 pruned. 
[I 2026-03-18 20:09:29,632] Trial 33 pruned. 
[I 2026-03-18 20:09:37,767] Trial 42 pruned. 
[I 2026-03-18 20:09:41,646] Trial 43 finished with value: -2.547192927007075 and parameters: {'n_layers_yyx': 2, 'hidden_size_yyx_l0': 5, 'hidden_size_yyx_l1': 4, 'context_size_yyx': 4, 'num_mix_components_yyx': 4, 'context_extractor_yyx': 'gru', 'activation_func_yyx': 'GELU', 'L2_weight_yyx': 3.4284541517930414e-08, 'L_entropy_weight_yyx': 0.0003640054505370873, 'L_sep_weight_yyx': 8.383431043314136e-08, 'L_scale_weight_yyx': 4.0923037839009656e-08, 'learning_rate_yyx': 0.009120136948438289}. Best is trial 16 with value: -2.5482089436137594.
[I 2026-03-18 20:09:50,662] Trial 35 finished with value: -2.03239200359384 and parameters: {'n_layers_yyx': 1, 'hidden_size_yyx_l0': 6, 'context_size_yyx': 4, 'num_mix_components_yyx': 4, 'context_extractor_yyx': 'gru', 'activation_func_yyx': 'ReLU', 'L2_weight_yyx': 2.735173564881076e-07, 'L_entropy_weight_yyx': 1.5039625672519709e-09, 'L_sep_weight_yyx': 8.361187193941064e-08, 'L_scale_weight_yyx': 8.634513673149871e-08, 'learning_rate_yyx': 0.008391624056715402}. Best is trial 8 with value: -2.0365283470022115.
[I 2026-03-18 20:10:11,144] Trial 36 pruned. 
[I 2026-03-18 20:10:13,227] Trial 39 pruned. 
[I 2026-03-18 20:10:14,396] Trial 45 pruned. 
[I 2026-03-18 20:10:23,236] Trial 43 pruned. 
[I 2026-03-18 20:10:35,932] Trial 44 pruned. 
[I 2026-03-18 20:10:36,180] Trial 46 pruned. 
[I 2026-03-18 20:10:37,795] Trial 37 pruned. 
[I 2026-03-18 20:10:40,528] Trial 20 finished with value: -2.5081354283252826 and parameters: {'n_layers_yyx': 2, 'hidden_size_yyx_l0': 3, 'hidden_size_yyx_l1': 3, 'context_size_yyx': 3, 'num_mix_components_yyx': 3, 'context_extractor_yyx': 'gru', 'activation_func_yyx': 'Tanh', 'L2_weight_yyx': 0.0008951622385199959, 'L_entropy_weight_yyx': 3.4712403064180065e-09, 'L_sep_weight_yyx': 1.2935023193562868e-10, 'L_scale_weight_yyx': 4.113147191581349e-08, 'learning_rate_yyx': 0.009919005779310788}. Best is trial 0 with value: -2.511745534136428.
[I 2026-03-18 20:10:47,981] Trial 31 finished with value: -2.0130025101140023 and parameters: {'n_layers_yyx': 1, 'hidden_size_yyx_l0': 4, 'context_size_yyx': 4, 'num_mix_components_yyx': 2, 'context_extractor_yyx': 'gru', 'activation_func_yyx': 'GELU', 'L2_weight_yyx': 1.0706224859707757e-05, 'L_entropy_weight_yyx': 1.386987377056386e-06, 'L_sep_weight_yyx': 7.753163866106481e-07, 'L_scale_weight_yyx': 0.0007757599403865971, 'learning_rate_yyx': 0.005693759250052427}. Best is trial 0 with value: -2.0138799336866504.
[I 2026-03-18 20:10:57,564] Trial 38 finished with value: -1.6780851988308938 and parameters: {'n_layers_yyx': 2, 'hidden_size_yyx_l0': 4, 'hidden_size_yyx_l1': 5, 'context_size_yyx': 4, 'num_mix_components_yyx': 5, 'context_extractor_yyx': 'gru', 'activation_func_yyx': 'Tanh', 'L2_weight_yyx': 4.189691247468208e-10, 'L_entropy_weight_yyx': 2.450997214818269e-08, 'L_sep_weight_yyx': 7.411410010327191e-10, 'L_scale_weight_yyx': 1.5228521094565945e-06, 'learning_rate_yyx': 0.0057754911784041775}. Best is trial 32 with value: -1.6813953661792613.
[I 2026-03-18 20:10:58,407] Trial 28 finished with value: -2.49653665414578 and parameters: {'n_layers_yyx': 2, 'hidden_size_yyx_l0': 3, 'hidden_size_yyx_l1': 5, 'context_size_yyx': 2, 'num_mix_components_yyx': 4, 'context_extractor_yyx': 'gru', 'activation_func_yyx': 'ReLU', 'L2_weight_yyx': 6.319726505546025e-06, 'L_entropy_weight_yyx': 3.9785131900097795e-08, 'L_sep_weight_yyx': 2.3697768159731922e-08, 'L_scale_weight_yyx': 0.000190059631044082, 'learning_rate_yyx': 0.0043558319788293744}. Best is trial 22 with value: -2.5155989726836543.
