[I 2026-03-18 19:15:40,515] Trial 2 finished with value: -2.513158018005324 and parameters: {'n_layers_yyx': 1, 'hidden_size_yyx_l0': 5, 'context_size_yyx': 1, 'num_mix_components_yyx': 5, 'context_extractor_yyx': 'lstm', 'activation_func_yyx': 'ReLU', 'L2_weight_yyx': 0.00039836983759236394, 'L_entropy_weight_yyx': 1.2188526950155673e-05, 'L_sep_weight_yyx': 9.412489964240578e-10, 'L_scale_weight_yyx': 2.959380114116545e-09, 'learning_rate_yyx': 0.004607654489391168}. Best is trial 2 with value: -2.513158018005324.
[I 2026-03-18 19:15:41,554] Trial 4 pruned. 
[I 2026-03-18 19:15:45,521] Trial 7 pruned. 
[I 2026-03-18 19:15:45,558] Trial 5 pruned. 
[I 2026-03-18 19:15:54,916] Trial 6 pruned. 
[I 2026-03-18 19:15:55,376] Trial 10 pruned. 
[I 2026-03-18 19:16:03,650] Trial 5 pruned. 
[I 2026-03-18 19:16:05,624] Trial 7 finished with value: -1.699586793193667 and parameters: {'n_layers_yyx': 2, 'hidden_size_yyx_l0': 4, 'hidden_size_yyx_l1': 6, 'context_size_yyx': 2, 'num_mix_components_yyx': 1, 'context_extractor_yyx': 'gru', 'activation_func_yyx': 'GELU', 'L2_weight_yyx': 9.574444913868466e-06, 'L_entropy_weight_yyx': 4.821142040934006e-08, 'L_sep_weight_yyx': 1.8796215498394773e-08, 'L_scale_weight_yyx': 6.005179690936388e-10, 'learning_rate_yyx': 0.0023891594365898607}. Best is trial 5 with value: -1.704671424204909.
[I 2026-03-18 19:16:13,523] Trial 6 pruned. 
[I 2026-03-18 19:16:13,771] Trial 3 finished with value: -1.7164732822925177 and parameters: {'n_layers_yyx': 2, 'hidden_size_yyx_l0': 6, 'hidden_size_yyx_l1': 3, 'context_size_yyx': 1, 'num_mix_components_yyx': 3, 'context_extractor_yyx': 'gru', 'activation_func_yyx': 'Tanh', 'L2_weight_yyx': 8.191994177774803e-08, 'L_entropy_weight_yyx': 0.0005482574169996366, 'L_sep_weight_yyx': 2.540115832582414e-05, 'L_scale_weight_yyx': 0.0008419193617686075, 'learning_rate_yyx': 0.0028341921675373045}. Best is trial 0 with value: -1.7166840796377145.
[I 2026-03-18 19:16:16,204] Trial 7 pruned. 
[I 2026-03-18 19:16:20,341] Trial 4 finished with value: -2.021612486156544 and parameters: {'n_layers_yyx': 2, 'hidden_size_yyx_l0': 2, 'hidden_size_yyx_l1': 5, 'context_size_yyx': 1, 'num_mix_components_yyx': 5, 'context_extractor_yyx': 'gru', 'activation_func_yyx': 'ReLU', 'L2_weight_yyx': 1.7812556915530133e-07, 'L_entropy_weight_yyx': 0.00020820294354255216, 'L_sep_weight_yyx': 2.0195239956444097e-07, 'L_scale_weight_yyx': 0.00020678238153639203, 'learning_rate_yyx': 0.006634628962740444}. Best is trial 4 with value: -2.021612486156544.
[I 2026-03-18 19:16:23,531] Trial 7 pruned. 
[I 2026-03-18 19:16:23,911] Trial 3 finished with value: -2.1138287904075233 and parameters: {'n_layers_yyx': 1, 'hidden_size_yyx_l0': 4, 'context_size_yyx': 3, 'num_mix_components_yyx': 4, 'context_extractor_yyx': 'gru', 'activation_func_yyx': 'Tanh', 'L2_weight_yyx': 9.255743079659542e-09, 'L_entropy_weight_yyx': 2.340286747238958e-10, 'L_sep_weight_yyx': 9.975860506959063e-06, 'L_scale_weight_yyx': 2.2529130934960234e-06, 'learning_rate_yyx': 0.0016152816867552916}. Best is trial 0 with value: -2.1143376288427875.
[I 2026-03-18 19:16:25,526] Trial 8 pruned. 
[I 2026-03-18 19:16:25,745] Trial 2 finished with value: -1.6769895759813491 and parameters: {'n_layers_yyx': 1, 'hidden_size_yyx_l0': 5, 'context_size_yyx': 3, 'num_mix_components_yyx': 1, 'context_extractor_yyx': 'lstm', 'activation_func_yyx': 'Tanh', 'L2_weight_yyx': 5.028055210489446e-06, 'L_entropy_weight_yyx': 2.7279406193289513e-08, 'L_sep_weight_yyx': 1.0636146705949648e-07, 'L_scale_weight_yyx': 1.0948867098162115e-08, 'learning_rate_yyx': 0.006271096336353393}. Best is trial 2 with value: -1.6769895759813491.
[I 2026-03-18 19:16:30,650] Trial 4 pruned. 
[I 2026-03-18 19:16:32,987] Trial 3 pruned. 
[I 2026-03-18 19:16:34,161] Trial 9 pruned. 
[I 2026-03-18 19:16:35,909] Trial 6 finished with value: -1.670439353990532 and parameters: {'n_layers_yyx': 1, 'hidden_size_yyx_l0': 3, 'context_size_yyx': 2, 'num_mix_components_yyx': 2, 'context_extractor_yyx': 'lstm', 'activation_func_yyx': 'Tanh', 'L2_weight_yyx': 6.465889013167901e-10, 'L_entropy_weight_yyx': 7.411025314728724e-07, 'L_sep_weight_yyx': 1.0600943314759721e-08, 'L_scale_weight_yyx': 3.714604279472016e-05, 'learning_rate_yyx': 0.0029733236515404257}. Best is trial 0 with value: -1.6761095192729139.
[I 2026-03-18 19:16:41,647] Trial 5 pruned. 
[I 2026-03-18 19:16:43,101] Trial 10 pruned. 
[I 2026-03-18 19:16:43,868] Trial 8 pruned. 
[I 2026-03-18 19:16:46,896] Trial 5 finished with value: -1.980981746129848 and parameters: {'n_layers_yyx': 2, 'hidden_size_yyx_l0': 6, 'hidden_size_yyx_l1': 5, 'context_size_yyx': 3, 'num_mix_components_yyx': 5, 'context_extractor_yyx': 'gru', 'activation_func_yyx': 'Tanh', 'L2_weight_yyx': 4.7791297271122984e-05, 'L_entropy_weight_yyx': 1.961549429358311e-09, 'L_sep_weight_yyx': 0.00043216891672662855, 'L_scale_weight_yyx': 0.0003645171297279371, 'learning_rate_yyx': 0.0039789813387573775}. Best is trial 5 with value: -1.980981746129848.
[I 2026-03-18 19:16:47,492] Trial 8 pruned. 
[I 2026-03-18 19:16:48,645] Trial 3 finished with value: -2.4890964034915894 and parameters: {'n_layers_yyx': 2, 'hidden_size_yyx_l0': 4, 'hidden_size_yyx_l1': 3, 'context_size_yyx': 2, 'num_mix_components_yyx': 2, 'context_extractor_yyx': 'lstm', 'activation_func_yyx': 'GELU', 'L2_weight_yyx': 2.933654232735396e-08, 'L_entropy_weight_yyx': 5.291636750089759e-10, 'L_sep_weight_yyx': 1.450281366721736e-09, 'L_scale_weight_yyx': 0.00035632227404522446, 'learning_rate_yyx': 0.004254450172078483}. Best is trial 3 with value: -2.4890964034915894.
[I 2026-03-18 19:16:49,694] Trial 7 finished with value: -1.669005541088832 and parameters: {'n_layers_yyx': 2, 'hidden_size_yyx_l0': 5, 'hidden_size_yyx_l1': 5, 'context_size_yyx': 3, 'num_mix_components_yyx': 3, 'context_extractor_yyx': 'gru', 'activation_func_yyx': 'Tanh', 'L2_weight_yyx': 0.00015802324005274345, 'L_entropy_weight_yyx': 2.650594905207593e-10, 'L_sep_weight_yyx': 8.32195900473785e-08, 'L_scale_weight_yyx': 7.470358993660301e-06, 'learning_rate_yyx': 0.0016650887539278536}. Best is trial 0 with value: -1.6784554536041303.
[I 2026-03-18 19:16:50,163] Trial 6 finished with value: -1.992500064609287 and parameters: {'n_layers_yyx': 1, 'hidden_size_yyx_l0': 3, 'context_size_yyx': 2, 'num_mix_components_yyx': 5, 'context_extractor_yyx': 'gru', 'activation_func_yyx': 'ReLU', 'L2_weight_yyx': 4.70958078604798e-10, 'L_entropy_weight_yyx': 4.280799415186437e-08, 'L_sep_weight_yyx': 2.7756865938841972e-09, 'L_scale_weight_yyx': 5.174608945676984e-09, 'learning_rate_yyx': 0.0028827997097703464}. Best is trial 3 with value: -1.9930066460961695.
[I 2026-03-18 19:16:50,278] Trial 6 pruned. 
[I 2026-03-18 19:16:53,076] Trial 7 pruned. 
[I 2026-03-18 19:16:59,666] Trial 8 pruned. 
[I 2026-03-18 19:17:03,089] Trial 7 pruned. 
[I 2026-03-18 19:17:06,184] Trial 2 finished with value: -1.664362500533174 and parameters: {'n_layers_yyx': 1, 'hidden_size_yyx_l0': 4, 'context_size_yyx': 2, 'num_mix_components_yyx': 3, 'context_extractor_yyx': 'lstm', 'activation_func_yyx': 'ReLU', 'L2_weight_yyx': 7.443012681353053e-05, 'L_entropy_weight_yyx': 1.558951722853279e-09, 'L_sep_weight_yyx': 0.0008082733722307903, 'L_scale_weight_yyx': 2.4451283282938124e-06, 'learning_rate_yyx': 0.0008877830131645983}. Best is trial 2 with value: -1.664362500533174.
[I 2026-03-18 19:17:06,980] Trial 9 pruned. 
[I 2026-03-18 19:17:08,503] Trial 4 finished with value: -1.673415532769749 and parameters: {'n_layers_yyx': 1, 'hidden_size_yyx_l0': 5, 'context_size_yyx': 4, 'num_mix_components_yyx': 5, 'context_extractor_yyx': 'lstm', 'activation_func_yyx': 'Tanh', 'L2_weight_yyx': 1.245254521609416e-10, 'L_entropy_weight_yyx': 1.3455651732625456e-09, 'L_sep_weight_yyx': 1.3635557991171324e-05, 'L_scale_weight_yyx': 6.292627291263872e-07, 'learning_rate_yyx': 0.003789360540095756}. Best is trial 4 with value: -1.673415532769749.
[I 2026-03-18 19:17:12,710] Trial 7 pruned. 
[I 2026-03-18 19:17:13,203] Trial 3 pruned. 
[I 2026-03-18 19:17:17,281] Trial 2 finished with value: -2.5467595987386638 and parameters: {'n_layers_yyx': 2, 'hidden_size_yyx_l0': 5, 'hidden_size_yyx_l1': 3, 'context_size_yyx': 4, 'num_mix_components_yyx': 4, 'context_extractor_yyx': 'gru', 'activation_func_yyx': 'Tanh', 'L2_weight_yyx': 2.7547706836576786e-09, 'L_entropy_weight_yyx': 0.0004857456604453458, 'L_sep_weight_yyx': 3.851587372200559e-08, 'L_scale_weight_yyx': 3.2299726831465534e-09, 'learning_rate_yyx': 0.008337368807834412}. Best is trial 2 with value: -2.5467595987386638.
[I 2026-03-18 19:17:17,891] Trial 9 finished with value: -1.6755619223217504 and parameters: {'n_layers_yyx': 1, 'hidden_size_yyx_l0': 6, 'context_size_yyx': 2, 'num_mix_components_yyx': 5, 'context_extractor_yyx': 'lstm', 'activation_func_yyx': 'Tanh', 'L2_weight_yyx': 1.4112578685634088e-05, 'L_entropy_weight_yyx': 4.234102440966794e-08, 'L_sep_weight_yyx': 2.124605145396603e-06, 'L_scale_weight_yyx': 1.5292077582504218e-05, 'learning_rate_yyx': 0.006989540855347581}. Best is trial 9 with value: -1.6755619223217504.
[I 2026-03-18 19:17:18,835] Trial 2 finished with value: -2.008324196492559 and parameters: {'n_layers_yyx': 2, 'hidden_size_yyx_l0': 3, 'hidden_size_yyx_l1': 3, 'context_size_yyx': 3, 'num_mix_components_yyx': 5, 'context_extractor_yyx': 'gru', 'activation_func_yyx': 'ReLU', 'L2_weight_yyx': 5.59328457711883e-06, 'L_entropy_weight_yyx': 1.012492290800521e-06, 'L_sep_weight_yyx': 4.6357044132427173e-10, 'L_scale_weight_yyx': 2.9515566205908268e-08, 'learning_rate_yyx': 0.0008966027236235482}. Best is trial 0 with value: -2.0138799336866504.
[I 2026-03-18 19:17:22,613] Trial 10 pruned. 
[I 2026-03-18 19:17:23,657] Trial 8 pruned. 
[I 2026-03-18 19:17:27,695] Trial 3 pruned. 
[I 2026-03-18 19:17:29,735] Trial 2 finished with value: -2.4965531416595486 and parameters: {'n_layers_yyx': 1, 'hidden_size_yyx_l0': 4, 'context_size_yyx': 3, 'num_mix_components_yyx': 1, 'context_extractor_yyx': 'gru', 'activation_func_yyx': 'Tanh', 'L2_weight_yyx': 7.1576692449203e-08, 'L_entropy_weight_yyx': 3.443331626416766e-07, 'L_sep_weight_yyx': 0.00026698193794187777, 'L_scale_weight_yyx': 4.424926776898846e-05, 'learning_rate_yyx': 0.0056450049951590996}. Best is trial 0 with value: -2.5120178855442976.
[I 2026-03-18 19:17:30,679] Trial 11 pruned. 
[I 2026-03-18 19:17:31,421] Trial 4 pruned. 
[I 2026-03-18 19:17:33,420] Trial 8 pruned. 
[I 2026-03-18 19:17:33,523] Trial 9 pruned. 
[I 2026-03-18 19:17:41,385] Trial 9 pruned. 
[I 2026-03-18 19:17:42,009] Trial 9 pruned. 
[I 2026-03-18 19:17:43,497] Trial 11 finished with value: -1.7102992944883884 and parameters: {'n_layers_yyx': 2, 'hidden_size_yyx_l0': 4, 'hidden_size_yyx_l1': 4, 'context_size_yyx': 4, 'num_mix_components_yyx': 2, 'context_extractor_yyx': 'gru', 'activation_func_yyx': 'ReLU', 'L2_weight_yyx': 1.1541158723149445e-05, 'L_entropy_weight_yyx': 1.2001365238012355e-08, 'L_sep_weight_yyx': 4.708667747753914e-10, 'L_scale_weight_yyx': 0.0007179580586967442, 'learning_rate_yyx': 0.004311652087309168}. Best is trial 8 with value: -1.7294919135267302.
[I 2026-03-18 19:17:47,443] Trial 5 pruned. 
[I 2026-03-18 19:17:48,878] Trial 3 finished with value: -2.458127488014063 and parameters: {'n_layers_yyx': 2, 'hidden_size_yyx_l0': 3, 'hidden_size_yyx_l1': 3, 'context_size_yyx': 1, 'num_mix_components_yyx': 5, 'context_extractor_yyx': 'lstm', 'activation_func_yyx': 'ReLU', 'L2_weight_yyx': 1.0788952188688199e-06, 'L_entropy_weight_yyx': 5.667304097855767e-05, 'L_sep_weight_yyx': 6.251963843229233e-08, 'L_scale_weight_yyx': 1.8134245842260648e-09, 'learning_rate_yyx': 0.004247976255553562}. Best is trial 2 with value: -2.513158018005324.
[I 2026-03-18 19:17:54,316] Trial 2 finished with value: -2.4919030323592106 and parameters: {'n_layers_yyx': 2, 'hidden_size_yyx_l0': 4, 'hidden_size_yyx_l1': 3, 'context_size_yyx': 2, 'num_mix_components_yyx': 1, 'context_extractor_yyx': 'lstm', 'activation_func_yyx': 'ReLU', 'L2_weight_yyx': 1.2974275778924244e-06, 'L_entropy_weight_yyx': 2.2662507790739376e-06, 'L_sep_weight_yyx': 1.8952407589908862e-06, 'L_scale_weight_yyx': 4.7158225631204724e-05, 'learning_rate_yyx': 0.004936092068053859}. Best is trial 2 with value: -2.4919030323592106.
[I 2026-03-18 19:17:54,509] Trial 10 pruned. 
[I 2026-03-18 19:17:56,222] Trial 4 finished with value: -1.6735272428496732 and parameters: {'n_layers_yyx': 2, 'hidden_size_yyx_l0': 6, 'hidden_size_yyx_l1': 5, 'context_size_yyx': 1, 'num_mix_components_yyx': 1, 'context_extractor_yyx': 'lstm', 'activation_func_yyx': 'ReLU', 'L2_weight_yyx': 4.9931157412198485e-09, 'L_entropy_weight_yyx': 0.0008820576274933526, 'L_sep_weight_yyx': 8.674510834936866e-09, 'L_scale_weight_yyx': 7.104949661322115e-06, 'learning_rate_yyx': 0.0016969520950253364}. Best is trial 2 with value: -1.6965485290020457.
[I 2026-03-18 19:17:56,740] Trial 1 finished with value: -2.508642106411257 and parameters: {'n_layers_yyx': 1, 'hidden_size_yyx_l0': 3, 'context_size_yyx': 1, 'num_mix_components_yyx': 2, 'context_extractor_yyx': 'lstm', 'activation_func_yyx': 'ReLU', 'L2_weight_yyx': 1.2039197988371926e-05, 'L_entropy_weight_yyx': 3.2809847793166013e-07, 'L_sep_weight_yyx': 7.345752370159378e-09, 'L_scale_weight_yyx': 2.7729174938878413e-09, 'learning_rate_yyx': 0.0011597130611276005}. Best is trial 0 with value: -2.5120461423480207.
[I 2026-03-18 19:18:00,176] Trial 12 pruned. 
[I 2026-03-18 19:18:01,904] Trial 10 pruned. 
[I 2026-03-18 19:18:07,889] Trial 2 finished with value: -1.6776522224422603 and parameters: {'n_layers_yyx': 2, 'hidden_size_yyx_l0': 5, 'hidden_size_yyx_l1': 4, 'context_size_yyx': 4, 'num_mix_components_yyx': 4, 'context_extractor_yyx': 'lstm', 'activation_func_yyx': 'Tanh', 'L2_weight_yyx': 7.390034516443757e-10, 'L_entropy_weight_yyx': 5.708977072425861e-06, 'L_sep_weight_yyx': 1.999423192797491e-10, 'L_scale_weight_yyx': 4.791228334037378e-06, 'learning_rate_yyx': 0.0010986864963087545}. Best is trial 2 with value: -1.6776522224422603.
[I 2026-03-18 19:18:10,236] Trial 3 pruned. 
[I 2026-03-18 19:18:12,534] Trial 5 pruned. 
[I 2026-03-18 19:18:12,534] Trial 4 pruned. 
[I 2026-03-18 19:18:17,785] Trial 3 pruned. 
[I 2026-03-18 19:18:19,896] Trial 4 pruned. 
[I 2026-03-18 19:18:28,433] Trial 5 pruned. 
[I 2026-03-18 19:18:28,685] Trial 3 finished with value: -2.5106750881757796 and parameters: {'n_layers_yyx': 2, 'hidden_size_yyx_l0': 5, 'hidden_size_yyx_l1': 2, 'context_size_yyx': 4, 'num_mix_components_yyx': 4, 'context_extractor_yyx': 'lstm', 'activation_func_yyx': 'Tanh', 'L2_weight_yyx': 2.0833532236879547e-09, 'L_entropy_weight_yyx': 1.8762472490128608e-06, 'L_sep_weight_yyx': 2.632136462188776e-09, 'L_scale_weight_yyx': 8.400402477541337e-10, 'learning_rate_yyx': 0.0061355087404097956}. Best is trial 0 with value: -2.510808245268653.
[I 2026-03-18 19:18:28,690] Trial 3 finished with value: -1.6796541081088945 and parameters: {'n_layers_yyx': 1, 'hidden_size_yyx_l0': 5, 'context_size_yyx': 4, 'num_mix_components_yyx': 4, 'context_extractor_yyx': 'gru', 'activation_func_yyx': 'ReLU', 'L2_weight_yyx': 6.184630069133207e-08, 'L_entropy_weight_yyx': 4.0136690491292605e-05, 'L_sep_weight_yyx': 2.488178884378488e-10, 'L_scale_weight_yyx': 2.8023206601468324e-08, 'learning_rate_yyx': 0.0033227913248744536}. Best is trial 3 with value: -1.6796541081088945.
[I 2026-03-18 19:18:30,091] Trial 6 finished with value: -1.6708868302616118 and parameters: {'n_layers_yyx': 1, 'hidden_size_yyx_l0': 2, 'context_size_yyx': 1, 'num_mix_components_yyx': 1, 'context_extractor_yyx': 'gru', 'activation_func_yyx': 'ReLU', 'L2_weight_yyx': 2.4076388005661617e-06, 'L_entropy_weight_yyx': 5.429334185581048e-06, 'L_sep_weight_yyx': 2.5253171495901066e-10, 'L_scale_weight_yyx': 2.8921524015783608e-08, 'learning_rate_yyx': 0.0025961686426804026}. Best is trial 2 with value: -1.680426359749482.
[I 2026-03-18 19:18:33,674] Trial 2 finished with value: -2.5078118838355654 and parameters: {'n_layers_yyx': 2, 'hidden_size_yyx_l0': 2, 'hidden_size_yyx_l1': 4, 'context_size_yyx': 2, 'num_mix_components_yyx': 5, 'context_extractor_yyx': 'lstm', 'activation_func_yyx': 'Tanh', 'L2_weight_yyx': 3.919560995017288e-05, 'L_entropy_weight_yyx': 1.2505350953019418e-07, 'L_sep_weight_yyx': 1.6740983427385191e-07, 'L_scale_weight_yyx': 6.401679672432059e-10, 'learning_rate_yyx': 0.0010074513614785775}. Best is trial 0 with value: -2.512397478376116.
[I 2026-03-18 19:18:35,095] Trial 6 pruned. 
[I 2026-03-18 19:18:40,158] Trial 4 pruned. 
[I 2026-03-18 19:18:42,383] Trial 7 pruned. 
[I 2026-03-18 19:18:43,665] Trial 5 pruned. 
[I 2026-03-18 19:18:45,717] Trial 3 pruned. 
[I 2026-03-18 19:18:46,544] Trial 11 finished with value: -1.9852781357200364 and parameters: {'n_layers_yyx': 1, 'hidden_size_yyx_l0': 4, 'context_size_yyx': 4, 'num_mix_components_yyx': 5, 'context_extractor_yyx': 'gru', 'activation_func_yyx': 'Tanh', 'L2_weight_yyx': 2.7362663881949028e-05, 'L_entropy_weight_yyx': 5.0711034557473515e-06, 'L_sep_weight_yyx': 8.699424693118549e-06, 'L_scale_weight_yyx': 3.347145729057696e-06, 'learning_rate_yyx': 0.00991177464392241}. Best is trial 11 with value: -1.9852781357200364.
[I 2026-03-18 19:18:51,190] Trial 11 pruned. 
[I 2026-03-18 19:18:51,548] Trial 6 pruned. 
[I 2026-03-18 19:18:55,522] Trial 8 finished with value: -1.6504343226229783 and parameters: {'n_layers_yyx': 2, 'hidden_size_yyx_l0': 4, 'hidden_size_yyx_l1': 2, 'context_size_yyx': 1, 'num_mix_components_yyx': 1, 'context_extractor_yyx': 'gru', 'activation_func_yyx': 'GELU', 'L2_weight_yyx': 1.1016780145970014e-07, 'L_entropy_weight_yyx': 0.00016783042561744664, 'L_sep_weight_yyx': 0.00016987666563949655, 'L_scale_weight_yyx': 2.5527689162219563e-06, 'learning_rate_yyx': 0.009025872960697618}. Best is trial 0 with value: -1.6761095192729139.
[I 2026-03-18 19:19:02,087] Trial 12 pruned. 
[I 2026-03-18 19:19:10,657] Trial 2 finished with value: -2.506383276390198 and parameters: {'n_layers_yyx': 1, 'hidden_size_yyx_l0': 4, 'context_size_yyx': 3, 'num_mix_components_yyx': 3, 'context_extractor_yyx': 'lstm', 'activation_func_yyx': 'ReLU', 'L2_weight_yyx': 5.6570050902717414e-05, 'L_entropy_weight_yyx': 3.0723026455159795e-09, 'L_sep_weight_yyx': 3.2686744606911566e-10, 'L_scale_weight_yyx': 1.3509043639283925e-10, 'learning_rate_yyx': 0.0014728712461616021}. Best is trial 1 with value: -2.508543311145146.
[I 2026-03-18 19:19:11,585] Trial 13 pruned. 
[I 2026-03-18 19:19:13,272] Trial 9 pruned. 
[I 2026-03-18 19:19:21,775] Trial 10 pruned. 
[I 2026-03-18 19:19:22,133] Trial 3 pruned. 
[I 2026-03-18 19:19:26,775] Trial 6 finished with value: -1.6656622665729302 and parameters: {'n_layers_yyx': 2, 'hidden_size_yyx_l0': 2, 'hidden_size_yyx_l1': 6, 'context_size_yyx': 4, 'num_mix_components_yyx': 3, 'context_extractor_yyx': 'gru', 'activation_func_yyx': 'Tanh', 'L2_weight_yyx': 3.377980539355636e-05, 'L_entropy_weight_yyx': 2.717883347838271e-06, 'L_sep_weight_yyx': 7.511696045354674e-09, 'L_scale_weight_yyx': 2.1902102726478852e-10, 'learning_rate_yyx': 0.006533336517626727}. Best is trial 6 with value: -1.6656622665729302.
[I 2026-03-18 19:19:28,867] Trial 8 pruned. 
[I 2026-03-18 19:19:31,264] Trial 14 pruned. 
[I 2026-03-18 19:19:32,818] Trial 4 pruned. 
[I 2026-03-18 19:19:35,882] Trial 7 pruned. 
[I 2026-03-18 19:19:37,682] Trial 9 pruned. 
[I 2026-03-18 19:19:40,208] Trial 12 pruned. 
[I 2026-03-18 19:19:43,989] Trial 5 pruned. 
[I 2026-03-18 19:19:46,621] Trial 10 pruned. 
[I 2026-03-18 19:19:55,108] Trial 8 pruned. 
[I 2026-03-18 19:19:56,416] Trial 6 pruned. 
[I 2026-03-18 19:19:58,212] Trial 9 finished with value: -1.701336267426258 and parameters: {'n_layers_yyx': 2, 'hidden_size_yyx_l0': 2, 'hidden_size_yyx_l1': 6, 'context_size_yyx': 3, 'num_mix_components_yyx': 5, 'context_extractor_yyx': 'gru', 'activation_func_yyx': 'Tanh', 'L2_weight_yyx': 1.7301199888346314e-06, 'L_entropy_weight_yyx': 9.42586319491217e-09, 'L_sep_weight_yyx': 0.00013740721652762776, 'L_scale_weight_yyx': 6.721875385781789e-08, 'learning_rate_yyx': 0.0006068506072987463}. Best is trial 5 with value: -1.704671424204909.
[I 2026-03-18 19:19:59,585] Trial 10 finished with value: -1.6769862653887198 and parameters: {'n_layers_yyx': 1, 'hidden_size_yyx_l0': 6, 'context_size_yyx': 1, 'num_mix_components_yyx': 3, 'context_extractor_yyx': 'lstm', 'activation_func_yyx': 'Tanh', 'L2_weight_yyx': 1.0155481100790046e-07, 'L_entropy_weight_yyx': 1.314162420736617e-10, 'L_sep_weight_yyx': 2.0538611944332388e-07, 'L_scale_weight_yyx': 2.4951971311008396e-05, 'learning_rate_yyx': 0.004417705812290013}. Best is trial 10 with value: -1.6769862653887198.
[I 2026-03-18 19:19:59,624] Trial 4 finished with value: -1.676351555490196 and parameters: {'n_layers_yyx': 1, 'hidden_size_yyx_l0': 5, 'context_size_yyx': 3, 'num_mix_components_yyx': 5, 'context_extractor_yyx': 'gru', 'activation_func_yyx': 'GELU', 'L2_weight_yyx': 1.2046939968016021e-10, 'L_entropy_weight_yyx': 3.794037457031334e-09, 'L_sep_weight_yyx': 2.629346766215583e-10, 'L_scale_weight_yyx': 9.786157100148952e-10, 'learning_rate_yyx': 0.009057626044248705}. Best is trial 2 with value: -1.6776522224422603.
[I 2026-03-18 19:20:00,116] Trial 4 finished with value: -1.6738805152200151 and parameters: {'n_layers_yyx': 2, 'hidden_size_yyx_l0': 6, 'hidden_size_yyx_l1': 5, 'context_size_yyx': 3, 'num_mix_components_yyx': 5, 'context_extractor_yyx': 'gru', 'activation_func_yyx': 'GELU', 'L2_weight_yyx': 0.000594862846484481, 'L_entropy_weight_yyx': 1.6479387460958963e-09, 'L_sep_weight_yyx': 6.583410111199003e-09, 'L_scale_weight_yyx': 1.2480134692355556e-07, 'learning_rate_yyx': 0.003892158109236098}. Best is trial 3 with value: -1.6796541081088945.
[I 2026-03-18 19:20:01,240] Trial 13 pruned. 
