[I 2026-03-18 18:18:14,793] Trial 23 finished with value: -2.5999781150979535 and parameters: {'n_layers_yyx': 1, 'hidden_size_yyx_l0': 2, 'context_size_yyx': 3, 'num_mix_components_yyx': 1, 'context_extractor_yyx': 'lstm', 'activation_func_yyx': 'ReLU', 'L2_weight_yyx': 6.3708978840547745e-09, 'L_entropy_weight_yyx': 1.5391081642442582e-07, 'L_sep_weight_yyx': 1.8222644461026682e-08, 'L_scale_weight_yyx': 2.391880672549567e-07, 'learning_rate_yyx': 0.0015085768487191095}. Best is trial 12 with value: -2.6375437257353878.
[I 2026-03-18 18:18:16,041] Trial 16 pruned. 
[I 2026-03-18 18:18:16,522] Trial 14 finished with value: -1.2475992579997799 and parameters: {'n_layers_yyx': 2, 'hidden_size_yyx_l0': 4, 'hidden_size_yyx_l1': 6, 'context_size_yyx': 2, 'num_mix_components_yyx': 1, 'context_extractor_yyx': 'gru', 'activation_func_yyx': 'Tanh', 'L2_weight_yyx': 3.778294199349191e-08, 'L_entropy_weight_yyx': 1.6973941378385632e-10, 'L_sep_weight_yyx': 0.0008894792070630002, 'L_scale_weight_yyx': 8.54077528311525e-09, 'learning_rate_yyx': 0.008975596658292798}. Best is trial 3 with value: -1.2710647653519778.
[I 2026-03-18 18:18:20,221] Trial 15 pruned. 
[I 2026-03-18 18:18:20,631] Trial 13 finished with value: -1.6722197537243195 and parameters: {'n_layers_yyx': 1, 'hidden_size_yyx_l0': 3, 'context_size_yyx': 4, 'num_mix_components_yyx': 4, 'context_extractor_yyx': 'lstm', 'activation_func_yyx': 'GELU', 'L2_weight_yyx': 4.9084176669998395e-09, 'L_entropy_weight_yyx': 2.8548949669970704e-09, 'L_sep_weight_yyx': 1.1759196123237047e-09, 'L_scale_weight_yyx': 1.3589195493174451e-08, 'learning_rate_yyx': 0.009662748307867517}. Best is trial 13 with value: -1.6722197537243195.
[I 2026-03-18 18:18:20,721] Trial 14 pruned. 
[I 2026-03-18 18:18:20,991] Trial 36 pruned. 
[I 2026-03-18 18:18:24,486] Trial 22 pruned. 
[I 2026-03-18 18:18:27,186] Trial 11 finished with value: -1.667259539401336 and parameters: {'n_layers_yyx': 1, 'hidden_size_yyx_l0': 3, 'context_size_yyx': 3, 'num_mix_components_yyx': 3, 'context_extractor_yyx': 'gru', 'activation_func_yyx': 'Tanh', 'L2_weight_yyx': 0.0009999006511755837, 'L_entropy_weight_yyx': 1.0177252908422301e-10, 'L_sep_weight_yyx': 7.106571096689153e-06, 'L_scale_weight_yyx': 1.0317450068369406e-08, 'learning_rate_yyx': 0.009217030062047682}. Best is trial 2 with value: -1.6799626520210098.
[I 2026-03-18 18:18:27,720] Trial 13 pruned. 
[I 2026-03-18 18:18:27,767] Trial 18 pruned. 
[I 2026-03-18 18:18:28,675] Trial 8 finished with value: -1.650956576184709 and parameters: {'n_layers_yyx': 2, 'hidden_size_yyx_l0': 3, 'hidden_size_yyx_l1': 6, 'context_size_yyx': 1, 'num_mix_components_yyx': 4, 'context_extractor_yyx': 'gru', 'activation_func_yyx': 'Tanh', 'L2_weight_yyx': 7.125759723472948e-05, 'L_entropy_weight_yyx': 3.8377869036285716e-08, 'L_sep_weight_yyx': 2.1081550364050884e-07, 'L_scale_weight_yyx': 1.4256495374154995e-10, 'learning_rate_yyx': 0.0028933959097282116}. Best is trial 2 with value: -1.666246732076009.
[I 2026-03-18 18:18:29,960] Trial 15 pruned. 
[I 2026-03-18 18:18:30,061] Trial 14 pruned. 
[I 2026-03-18 18:18:31,812] Trial 12 finished with value: -1.669586442317724 and parameters: {'n_layers_yyx': 2, 'hidden_size_yyx_l0': 5, 'hidden_size_yyx_l1': 3, 'context_size_yyx': 1, 'num_mix_components_yyx': 5, 'context_extractor_yyx': 'lstm', 'activation_func_yyx': 'Tanh', 'L2_weight_yyx': 1.586862585035959e-10, 'L_entropy_weight_yyx': 5.2811882400239726e-09, 'L_sep_weight_yyx': 3.42826049589133e-09, 'L_scale_weight_yyx': 8.230042313583247e-09, 'learning_rate_yyx': 0.008920413087604055}. Best is trial 0 with value: -1.6746319320135328.
[I 2026-03-18 18:18:32,735] Trial 15 pruned. 
[I 2026-03-18 18:18:32,951] Trial 16 pruned. 
[I 2026-03-18 18:18:33,135] Trial 17 pruned. 
[I 2026-03-18 18:18:34,179] Trial 21 finished with value: -1.258429627762264 and parameters: {'n_layers_yyx': 1, 'hidden_size_yyx_l0': 6, 'context_size_yyx': 3, 'num_mix_components_yyx': 3, 'context_extractor_yyx': 'lstm', 'activation_func_yyx': 'GELU', 'L2_weight_yyx': 0.00010877359181349157, 'L_entropy_weight_yyx': 0.0006693982046522309, 'L_sep_weight_yyx': 3.623647155951676e-05, 'L_scale_weight_yyx': 1.0872281058469556e-10, 'learning_rate_yyx': 0.003032024020591921}. Best is trial 2 with value: -1.266387742019625.
[I 2026-03-18 18:18:45,160] Trial 16 pruned. 
[I 2026-03-18 18:18:45,161] Trial 15 pruned. 
[I 2026-03-18 18:18:45,161] Trial 14 pruned. 
[I 2026-03-18 18:18:49,922] Trial 21 finished with value: -1.6681976850728097 and parameters: {'n_layers_yyx': 1, 'hidden_size_yyx_l0': 5, 'context_size_yyx': 2, 'num_mix_components_yyx': 3, 'context_extractor_yyx': 'lstm', 'activation_func_yyx': 'GELU', 'L2_weight_yyx': 6.75426689500575e-05, 'L_entropy_weight_yyx': 4.687337321947997e-07, 'L_sep_weight_yyx': 1.0890874853219482e-08, 'L_scale_weight_yyx': 2.9581357348395527e-05, 'learning_rate_yyx': 0.008883018114663072}. Best is trial 2 with value: -1.6745893480229308.
[I 2026-03-18 18:18:57,712] Trial 24 pruned. 
[I 2026-03-18 18:19:03,738] Trial 22 pruned. 
[I 2026-03-18 18:19:17,367] Trial 21 finished with value: -2.6257202953675938 and parameters: {'n_layers_yyx': 2, 'hidden_size_yyx_l0': 4, 'hidden_size_yyx_l1': 2, 'context_size_yyx': 1, 'num_mix_components_yyx': 2, 'context_extractor_yyx': 'gru', 'activation_func_yyx': 'Tanh', 'L2_weight_yyx': 1.7926679611800197e-08, 'L_entropy_weight_yyx': 6.216896792559645e-05, 'L_sep_weight_yyx': 2.543110305075912e-10, 'L_scale_weight_yyx': 1.0541169608003632e-06, 'learning_rate_yyx': 0.002912863857096521}. Best is trial 0 with value: -2.6330643191486622.
[I 2026-03-18 18:19:23,585] Trial 16 pruned. 
[I 2026-03-18 18:19:25,064] Trial 19 pruned. 
[I 2026-03-18 18:19:36,626] Trial 17 pruned. 
[I 2026-03-18 18:19:38,600] Trial 17 pruned. 
[I 2026-03-18 18:19:38,600] Trial 25 pruned. 
[I 2026-03-18 18:19:56,271] Trial 17 pruned. 
[I 2026-03-18 18:20:00,765] Trial 22 pruned. 
[I 2026-03-18 18:20:02,529] Trial 15 pruned. 
[I 2026-03-18 18:20:02,980] Trial 11 finished with value: -1.6739410945609627 and parameters: {'n_layers_yyx': 2, 'hidden_size_yyx_l0': 6, 'hidden_size_yyx_l1': 6, 'context_size_yyx': 4, 'num_mix_components_yyx': 2, 'context_extractor_yyx': 'lstm', 'activation_func_yyx': 'Tanh', 'L2_weight_yyx': 2.0375197554504267e-10, 'L_entropy_weight_yyx': 5.1444624938407494e-08, 'L_sep_weight_yyx': 3.608732663370621e-06, 'L_scale_weight_yyx': 1.529079336189601e-10, 'learning_rate_yyx': 0.0035929826670746986}. Best is trial 11 with value: -1.6739410945609627.
[I 2026-03-18 18:20:07,333] Trial 11 finished with value: -1.6657074312388152 and parameters: {'n_layers_yyx': 1, 'hidden_size_yyx_l0': 5, 'context_size_yyx': 4, 'num_mix_components_yyx': 3, 'context_extractor_yyx': 'gru', 'activation_func_yyx': 'GELU', 'L2_weight_yyx': 2.0807113708044486e-06, 'L_entropy_weight_yyx': 8.009141123527286e-05, 'L_sep_weight_yyx': 1.960186889244663e-06, 'L_scale_weight_yyx': 1.4649590955731366e-10, 'learning_rate_yyx': 0.005002020228313533}. Best is trial 2 with value: -1.6720916355195472.
[I 2026-03-18 18:20:27,181] Trial 14 finished with value: -1.6593422508790472 and parameters: {'n_layers_yyx': 1, 'hidden_size_yyx_l0': 3, 'context_size_yyx': 3, 'num_mix_components_yyx': 2, 'context_extractor_yyx': 'lstm', 'activation_func_yyx': 'Tanh', 'L2_weight_yyx': 1.8240271721211882e-09, 'L_entropy_weight_yyx': 4.1346755153631284e-05, 'L_sep_weight_yyx': 9.189131116341581e-10, 'L_scale_weight_yyx': 0.0009169138778140674, 'learning_rate_yyx': 0.0012744148818597614}. Best is trial 0 with value: -1.6683178048964529.
[I 2026-03-18 18:20:40,899] Trial 15 finished with value: -2.6388607085013045 and parameters: {'n_layers_yyx': 2, 'hidden_size_yyx_l0': 5, 'hidden_size_yyx_l1': 6, 'context_size_yyx': 4, 'num_mix_components_yyx': 4, 'context_extractor_yyx': 'lstm', 'activation_func_yyx': 'Tanh', 'L2_weight_yyx': 1.8271180280668473e-10, 'L_entropy_weight_yyx': 6.746068830139218e-07, 'L_sep_weight_yyx': 1.866121371204335e-10, 'L_scale_weight_yyx': 5.062750019902209e-09, 'learning_rate_yyx': 0.006383985589714907}. Best is trial 15 with value: -2.6388607085013045.
[I 2026-03-18 18:20:41,766] Trial 23 pruned. 
[I 2026-03-18 18:20:44,912] Trial 11 finished with value: -1.6587469304720868 and parameters: {'n_layers_yyx': 1, 'hidden_size_yyx_l0': 2, 'context_size_yyx': 4, 'num_mix_components_yyx': 4, 'context_extractor_yyx': 'lstm', 'activation_func_yyx': 'Tanh', 'L2_weight_yyx': 6.773120299003942e-05, 'L_entropy_weight_yyx': 2.367536952007461e-09, 'L_sep_weight_yyx': 5.063346692046786e-06, 'L_scale_weight_yyx': 0.0008222028209862997, 'learning_rate_yyx': 0.0044105742905852586}. Best is trial 0 with value: -1.6702967433543936.
[I 2026-03-18 18:20:56,185] Trial 12 pruned. 
[I 2026-03-18 18:21:16,899] Trial 22 pruned. 
[I 2026-03-18 18:21:17,832] Trial 23 pruned. 
[I 2026-03-18 18:21:47,611] Trial 24 pruned. 
[I 2026-03-18 18:21:48,979] Trial 19 finished with value: -1.6726601722724628 and parameters: {'n_layers_yyx': 1, 'hidden_size_yyx_l0': 5, 'context_size_yyx': 4, 'num_mix_components_yyx': 3, 'context_extractor_yyx': 'lstm', 'activation_func_yyx': 'Tanh', 'L2_weight_yyx': 7.560926348581603e-07, 'L_entropy_weight_yyx': 5.866567138597172e-08, 'L_sep_weight_yyx': 7.397376185401511e-08, 'L_scale_weight_yyx': 4.988041090998195e-09, 'learning_rate_yyx': 0.009779690423737795}. Best is trial 10 with value: -1.6754296736951282.
[I 2026-03-18 18:21:48,980] Trial 18 finished with value: -1.6611632309473972 and parameters: {'n_layers_yyx': 1, 'hidden_size_yyx_l0': 6, 'context_size_yyx': 3, 'num_mix_components_yyx': 4, 'context_extractor_yyx': 'gru', 'activation_func_yyx': 'ReLU', 'L2_weight_yyx': 2.065131001014554e-06, 'L_entropy_weight_yyx': 2.9310316065818183e-09, 'L_sep_weight_yyx': 9.253647132288104e-08, 'L_scale_weight_yyx': 1.2862250642655638e-06, 'learning_rate_yyx': 0.0009228653269754887}. Best is trial 2 with value: -1.6777834079951708.
[I 2026-03-18 18:21:50,604] Trial 24 pruned. 
[I 2026-03-18 18:21:59,594] Trial 23 finished with value: -2.6311014268237343 and parameters: {'n_layers_yyx': 2, 'hidden_size_yyx_l0': 5, 'hidden_size_yyx_l1': 4, 'context_size_yyx': 1, 'num_mix_components_yyx': 4, 'context_extractor_yyx': 'lstm', 'activation_func_yyx': 'Tanh', 'L2_weight_yyx': 2.820124303994313e-07, 'L_entropy_weight_yyx': 1.1064581879982819e-06, 'L_sep_weight_yyx': 3.710885162850423e-05, 'L_scale_weight_yyx': 8.637892796386799e-10, 'learning_rate_yyx': 0.0078372275105738}. Best is trial 14 with value: -2.6415204441902964.
[I 2026-03-18 18:22:04,002] Trial 29 finished with value: -1.2898682832717896 and parameters: {'n_layers_yyx': 1, 'hidden_size_yyx_l0': 5, 'context_size_yyx': 4, 'num_mix_components_yyx': 3, 'context_extractor_yyx': 'gru', 'activation_func_yyx': 'Tanh', 'L2_weight_yyx': 4.155470266150229e-08, 'L_entropy_weight_yyx': 1.1402672087072055e-08, 'L_sep_weight_yyx': 2.996834486058796e-08, 'L_scale_weight_yyx': 2.6515189574536068e-05, 'learning_rate_yyx': 0.008977120727079528}. Best is trial 8 with value: -1.3030293492170482.
[I 2026-03-18 18:22:04,135] Trial 18 pruned. 
[I 2026-03-18 18:22:13,428] Trial 23 pruned. 
[I 2026-03-18 18:22:20,282] Trial 11 finished with value: -1.6687842250673444 and parameters: {'n_layers_yyx': 2, 'hidden_size_yyx_l0': 5, 'hidden_size_yyx_l1': 6, 'context_size_yyx': 4, 'num_mix_components_yyx': 2, 'context_extractor_yyx': 'gru', 'activation_func_yyx': 'Tanh', 'L2_weight_yyx': 1.119392583517347e-10, 'L_entropy_weight_yyx': 4.303966338746932e-06, 'L_sep_weight_yyx': 1.9733890234898947e-08, 'L_scale_weight_yyx': 3.4539466273358855e-09, 'learning_rate_yyx': 0.003683497976700311}. Best is trial 11 with value: -1.6687842250673444.
[I 2026-03-18 18:22:32,216] Trial 24 pruned. 
[I 2026-03-18 18:22:35,845] Trial 37 finished with value: -1.2716001485940929 and parameters: {'n_layers_yyx': 1, 'hidden_size_yyx_l0': 6, 'context_size_yyx': 4, 'num_mix_components_yyx': 2, 'context_extractor_yyx': 'lstm', 'activation_func_yyx': 'GELU', 'L2_weight_yyx': 2.5752531640563844e-05, 'L_entropy_weight_yyx': 2.82708576849711e-09, 'L_sep_weight_yyx': 3.728727119374053e-10, 'L_scale_weight_yyx': 3.065376780955542e-10, 'learning_rate_yyx': 0.006702978166521126}. Best is trial 37 with value: -1.2716001485940929.
[I 2026-03-18 18:22:36,113] Trial 26 finished with value: -2.6038618371841755 and parameters: {'n_layers_yyx': 2, 'hidden_size_yyx_l0': 5, 'hidden_size_yyx_l1': 5, 'context_size_yyx': 3, 'num_mix_components_yyx': 3, 'context_extractor_yyx': 'gru', 'activation_func_yyx': 'GELU', 'L2_weight_yyx': 1.8933384758393343e-06, 'L_entropy_weight_yyx': 1.1040513236397186e-09, 'L_sep_weight_yyx': 1.4462463804388686e-10, 'L_scale_weight_yyx': 2.98115680280093e-06, 'learning_rate_yyx': 0.008650138763286125}. Best is trial 20 with value: -2.635415358426911.
[I 2026-03-18 18:22:37,731] Trial 14 finished with value: -2.6043183541642145 and parameters: {'n_layers_yyx': 1, 'hidden_size_yyx_l0': 2, 'context_size_yyx': 3, 'num_mix_components_yyx': 4, 'context_extractor_yyx': 'lstm', 'activation_func_yyx': 'ReLU', 'L2_weight_yyx': 2.834521469586243e-07, 'L_entropy_weight_yyx': 1.890914874594776e-09, 'L_sep_weight_yyx': 7.60341496702958e-08, 'L_scale_weight_yyx': 6.966432356532164e-09, 'learning_rate_yyx': 0.0045980316430449695}. Best is trial 10 with value: -2.640669339569724.
[I 2026-03-18 18:22:42,367] Trial 18 pruned. 
[I 2026-03-18 18:22:44,740] Trial 26 pruned. 
[I 2026-03-18 18:22:48,229] Trial 15 pruned. 
[I 2026-03-18 18:22:49,456] Trial 25 pruned. 
[I 2026-03-18 18:22:50,791] Trial 24 pruned. 
[I 2026-03-18 18:22:53,336] Trial 19 pruned. 
[I 2026-03-18 18:23:02,188] Trial 30 pruned. 
[I 2026-03-18 18:23:03,681] Trial 25 pruned. 
[I 2026-03-18 18:23:03,681] Trial 19 pruned. 
[I 2026-03-18 18:23:06,713] Trial 16 finished with value: -1.2693103712720042 and parameters: {'n_layers_yyx': 2, 'hidden_size_yyx_l0': 3, 'hidden_size_yyx_l1': 2, 'context_size_yyx': 4, 'num_mix_components_yyx': 2, 'context_extractor_yyx': 'lstm', 'activation_func_yyx': 'ReLU', 'L2_weight_yyx': 8.388393061895415e-05, 'L_entropy_weight_yyx': 5.8531986756456505e-05, 'L_sep_weight_yyx': 1.1317801403110533e-10, 'L_scale_weight_yyx': 2.9449800981931998e-08, 'learning_rate_yyx': 0.003047511480197071}. Best is trial 5 with value: -1.2714442113851663.
[I 2026-03-18 18:23:09,124] Trial 18 finished with value: -1.260811345634531 and parameters: {'n_layers_yyx': 1, 'hidden_size_yyx_l0': 4, 'context_size_yyx': 4, 'num_mix_components_yyx': 4, 'context_extractor_yyx': 'gru', 'activation_func_yyx': 'Tanh', 'L2_weight_yyx': 1.2116865514064583e-06, 'L_entropy_weight_yyx': 0.0008797718860807599, 'L_sep_weight_yyx': 2.9732879271348993e-07, 'L_scale_weight_yyx': 0.0005804353098155255, 'learning_rate_yyx': 0.0045448229590029}. Best is trial 6 with value: -1.270142151555821.
[I 2026-03-18 18:23:09,238] Trial 38 pruned. 
[I 2026-03-18 18:23:09,693] Trial 25 pruned. 
[I 2026-03-18 18:23:09,841] Trial 27 pruned. 
[I 2026-03-18 18:23:10,602] Trial 15 pruned. 
[I 2026-03-18 18:23:14,737] Trial 19 pruned. 
[I 2026-03-18 18:23:20,851] Trial 20 pruned. 
[I 2026-03-18 18:23:21,271] Trial 12 pruned. 
[I 2026-03-18 18:23:22,122] Trial 16 finished with value: -2.629931203838571 and parameters: {'n_layers_yyx': 2, 'hidden_size_yyx_l0': 5, 'hidden_size_yyx_l1': 6, 'context_size_yyx': 3, 'num_mix_components_yyx': 4, 'context_extractor_yyx': 'lstm', 'activation_func_yyx': 'Tanh', 'L2_weight_yyx': 0.0009190364284685364, 'L_entropy_weight_yyx': 0.0004116961115184732, 'L_sep_weight_yyx': 1.7372794939164355e-10, 'L_scale_weight_yyx': 4.332614675812749e-09, 'learning_rate_yyx': 0.005914599338262433}. Best is trial 15 with value: -2.6388607085013045.
[I 2026-03-18 18:23:23,033] Trial 25 pruned. 
[I 2026-03-18 18:23:23,676] Trial 31 pruned. 
[I 2026-03-18 18:23:24,821] Trial 20 pruned. 
[I 2026-03-18 18:23:25,316] Trial 19 pruned. 
[I 2026-03-18 18:23:28,610] Trial 16 pruned. 
[I 2026-03-18 18:23:30,066] Trial 26 pruned. 
[I 2026-03-18 18:23:31,349] Trial 16 pruned. 
[I 2026-03-18 18:23:33,620] Trial 32 pruned. 
[I 2026-03-18 18:23:33,857] Trial 17 pruned. 
[I 2026-03-18 18:23:33,959] Trial 17 finished with value: -1.2404427942639138 and parameters: {'n_layers_yyx': 2, 'hidden_size_yyx_l0': 4, 'hidden_size_yyx_l1': 4, 'context_size_yyx': 4, 'num_mix_components_yyx': 3, 'context_extractor_yyx': 'gru', 'activation_func_yyx': 'GELU', 'L2_weight_yyx': 1.465904285402908e-06, 'L_entropy_weight_yyx': 3.0608701025428917e-10, 'L_sep_weight_yyx': 1.4210787289881904e-05, 'L_scale_weight_yyx': 1.7891646338387448e-09, 'learning_rate_yyx': 0.009573883816885955}. Best is trial 3 with value: -1.2710647653519778.
[I 2026-03-18 18:23:34,140] Trial 39 pruned. 
[I 2026-03-18 18:23:34,683] Trial 20 pruned. 
[I 2026-03-18 18:23:38,851] Trial 20 pruned. 
[I 2026-03-18 18:23:41,019] Trial 21 pruned. 
[I 2026-03-18 18:23:42,232] Trial 17 finished with value: -1.6802871197433398 and parameters: {'n_layers_yyx': 2, 'hidden_size_yyx_l0': 6, 'hidden_size_yyx_l1': 5, 'context_size_yyx': 3, 'num_mix_components_yyx': 1, 'context_extractor_yyx': 'gru', 'activation_func_yyx': 'Tanh', 'L2_weight_yyx': 1.6577372181221057e-05, 'L_entropy_weight_yyx': 1.770232594776417e-07, 'L_sep_weight_yyx': 1.5030591618734356e-05, 'L_scale_weight_yyx': 1.8137345520255176e-08, 'learning_rate_yyx': 0.004255674161531122}. Best is trial 2 with value: -1.6820484414711034.
[I 2026-03-18 18:23:45,100] Trial 21 pruned. 
[I 2026-03-18 18:23:45,580] Trial 17 pruned. 
[I 2026-03-18 18:23:48,928] Trial 28 pruned. 
[I 2026-03-18 18:23:54,064] Trial 18 pruned. 
[I 2026-03-18 18:23:54,064] Trial 20 pruned. 
[I 2026-03-18 18:24:00,095] Trial 18 pruned. 
[I 2026-03-18 18:24:14,666] Trial 13 finished with value: -1.669436284965684 and parameters: {'n_layers_yyx': 2, 'hidden_size_yyx_l0': 6, 'hidden_size_yyx_l1': 3, 'context_size_yyx': 4, 'num_mix_components_yyx': 2, 'context_extractor_yyx': 'lstm', 'activation_func_yyx': 'Tanh', 'L2_weight_yyx': 1.6637520634111572e-09, 'L_entropy_weight_yyx': 0.0008807534270363303, 'L_sep_weight_yyx': 1.4990650019667542e-09, 'L_scale_weight_yyx': 3.9278216499039085e-07, 'learning_rate_yyx': 0.005399748271373988}. Best is trial 0 with value: -1.6746319320135328.
[I 2026-03-18 18:24:17,668] Trial 18 pruned. 
[I 2026-03-18 18:24:21,361] Trial 27 pruned. 
[I 2026-03-18 18:24:23,469] Trial 25 pruned. 
[I 2026-03-18 18:24:54,465] Trial 12 finished with value: -1.66306493096448 and parameters: {'n_layers_yyx': 1, 'hidden_size_yyx_l0': 3, 'context_size_yyx': 3, 'num_mix_components_yyx': 4, 'context_extractor_yyx': 'gru', 'activation_func_yyx': 'Tanh', 'L2_weight_yyx': 0.0009993538735674759, 'L_entropy_weight_yyx': 3.4969557771098443e-09, 'L_sep_weight_yyx': 3.1257637984908217e-06, 'L_scale_weight_yyx': 1.3009676578490452e-08, 'learning_rate_yyx': 0.009765974773045187}. Best is trial 2 with value: -1.6799626520210098.
[I 2026-03-18 18:25:01,754] Trial 19 pruned. 
[I 2026-03-18 18:25:11,552] Trial 19 pruned. 
[I 2026-03-18 18:25:15,189] Trial 29 pruned. 
[I 2026-03-18 18:25:19,720] Trial 20 finished with value: -2.652704652257403 and parameters: {'n_layers_yyx': 2, 'hidden_size_yyx_l0': 3, 'hidden_size_yyx_l1': 4, 'context_size_yyx': 4, 'num_mix_components_yyx': 3, 'context_extractor_yyx': 'gru', 'activation_func_yyx': 'ReLU', 'L2_weight_yyx': 9.946920074928204e-07, 'L_entropy_weight_yyx': 4.739945293089286e-05, 'L_sep_weight_yyx': 4.400263527409149e-07, 'L_scale_weight_yyx': 5.064054390152768e-09, 'learning_rate_yyx': 0.0041050399623701805}. Best is trial 10 with value: -2.6537577311197915.
[I 2026-03-18 18:25:19,747] Trial 27 pruned. 
[I 2026-03-18 18:25:21,249] Trial 13 pruned. 
[I 2026-03-18 18:25:40,520] Trial 26 pruned. 
[I 2026-03-18 18:25:40,600] Trial 26 pruned. 
[I 2026-03-18 18:25:52,334] Trial 9 finished with value: -1.6703570914822956 and parameters: {'n_layers_yyx': 1, 'hidden_size_yyx_l0': 5, 'context_size_yyx': 4, 'num_mix_components_yyx': 4, 'context_extractor_yyx': 'lstm', 'activation_func_yyx': 'ReLU', 'L2_weight_yyx': 0.00019856057423130348, 'L_entropy_weight_yyx': 4.148970926594453e-06, 'L_sep_weight_yyx': 1.4082680685914685e-07, 'L_scale_weight_yyx': 8.251164315598686e-09, 'learning_rate_yyx': 0.0022990380217877623}. Best is trial 9 with value: -1.6703570914822956.
[I 2026-03-18 18:25:55,971] Trial 18 finished with value: -1.6543789846146761 and parameters: {'n_layers_yyx': 1, 'hidden_size_yyx_l0': 6, 'context_size_yyx': 2, 'num_mix_components_yyx': 4, 'context_extractor_yyx': 'gru', 'activation_func_yyx': 'ReLU', 'L2_weight_yyx': 4.073557972855761e-06, 'L_entropy_weight_yyx': 1.7508030348729422e-10, 'L_sep_weight_yyx': 1.1248196957360269e-07, 'L_scale_weight_yyx': 1.151112542273304e-08, 'learning_rate_yyx': 0.0005557119995545383}. Best is trial 11 with value: -1.6659153643654905.
[I 2026-03-18 18:25:59,990] Trial 14 pruned. 
[I 2026-03-18 18:26:01,158] Trial 13 finished with value: -1.6699067226846822 and parameters: {'n_layers_yyx': 2, 'hidden_size_yyx_l0': 2, 'hidden_size_yyx_l1': 6, 'context_size_yyx': 4, 'num_mix_components_yyx': 2, 'context_extractor_yyx': 'lstm', 'activation_func_yyx': 'Tanh', 'L2_weight_yyx': 1.0360270826597096e-10, 'L_entropy_weight_yyx': 2.998686079417713e-08, 'L_sep_weight_yyx': 6.245597450867087e-06, 'L_scale_weight_yyx': 7.885511195969629e-09, 'learning_rate_yyx': 0.009456061114725396}. Best is trial 11 with value: -1.6739410945609627.
[I 2026-03-18 18:26:01,453] Trial 21 pruned. 
[I 2026-03-18 18:26:01,743] Trial 13 pruned. 
[I 2026-03-18 18:26:03,272] Trial 27 pruned. 
[I 2026-03-18 18:26:04,926] Trial 22 pruned. 
[I 2026-03-18 18:26:06,004] Trial 12 pruned. 
[I 2026-03-18 18:26:07,346] Trial 10 pruned. 
[I 2026-03-18 18:26:10,718] Trial 27 pruned. 
[I 2026-03-18 18:26:14,511] Trial 20 pruned. 
[I 2026-03-18 18:26:19,256] Trial 14 pruned. 
