Warning: Failed writing log files to directory [/var/log/nvidia-mps]. No logs will be available.
[I 2026-03-18 18:30:24,805] A new study created in RDB with name: opt_full-model_seed=42_task=206
[I 2026-03-18 18:30:28,394] A new study created in RDB with name: opt_full-model_seed=42_task=208
[I 2026-03-18 18:30:28,471] A new study created in RDB with name: opt_full-model_seed=42_task=198
[I 2026-03-18 18:30:28,589] A new study created in RDB with name: opt_full-model_seed=42_task=207
[I 2026-03-18 18:30:28,613] A new study created in RDB with name: opt_full-model_seed=42_task=197
[I 2026-03-18 18:30:28,614] A new study created in RDB with name: opt_full-model_seed=42_task=223
[I 2026-03-18 18:30:28,615] A new study created in RDB with name: opt_full-model_seed=42_task=217
[I 2026-03-18 18:30:28,755] A new study created in RDB with name: opt_full-model_seed=42_task=220
[I 2026-03-18 18:30:31,127] A new study created in RDB with name: opt_full-model_seed=42_task=205
[I 2026-03-18 18:30:31,649] A new study created in RDB with name: opt_full-model_seed=42_task=212
[I 2026-03-18 18:30:31,653] A new study created in RDB with name: opt_full-model_seed=42_task=195
[I 2026-03-18 18:30:31,654] A new study created in RDB with name: opt_full-model_seed=42_task=218
[I 2026-03-18 18:30:31,933] A new study created in RDB with name: opt_full-model_seed=42_task=215
[I 2026-03-18 18:30:31,933] A new study created in RDB with name: opt_full-model_seed=42_task=222
[I 2026-03-18 18:30:31,934] A new study created in RDB with name: opt_full-model_seed=42_task=204
[I 2026-03-18 18:30:31,935] A new study created in RDB with name: opt_full-model_seed=42_task=201
[I 2026-03-18 18:30:31,935] A new study created in RDB with name: opt_full-model_seed=42_task=211
[I 2026-03-18 18:30:31,935] A new study created in RDB with name: opt_full-model_seed=42_task=194
[I 2026-03-18 18:30:31,935] A new study created in RDB with name: opt_full-model_seed=42_task=213
[I 2026-03-18 18:30:32,323] A new study created in RDB with name: opt_full-model_seed=42_task=210
[I 2026-03-18 18:30:33,746] A new study created in RDB with name: opt_full-model_seed=42_task=200
[I 2026-03-18 18:30:34,251] A new study created in RDB with name: opt_full-model_seed=42_task=202
[I 2026-03-18 18:30:34,840] A new study created in RDB with name: opt_full-model_seed=42_task=193
[I 2026-03-18 18:30:34,841] A new study created in RDB with name: opt_full-model_seed=42_task=199
[I 2026-03-18 18:30:34,841] A new study created in RDB with name: opt_full-model_seed=42_task=192
[I 2026-03-18 18:30:34,842] A new study created in RDB with name: opt_full-model_seed=42_task=219
[I 2026-03-18 18:30:35,324] A new study created in RDB with name: opt_full-model_seed=42_task=221
[I 2026-03-18 18:30:35,324] A new study created in RDB with name: opt_full-model_seed=42_task=196
[I 2026-03-18 18:30:35,325] A new study created in RDB with name: opt_full-model_seed=42_task=209
[I 2026-03-18 18:30:35,720] A new study created in RDB with name: opt_full-model_seed=42_task=216
[I 2026-03-18 18:30:37,376] A new study created in RDB with name: opt_full-model_seed=42_task=214
[I 2026-03-18 18:30:38,342] A new study created in RDB with name: opt_full-model_seed=42_task=203
[I 2026-03-18 18:38:46,846] Trial 0 finished with value: -0.8124127071048167 and parameters: {'n_layers_yyx': 2, 'hidden_size_yyx_l0': 6, 'hidden_size_yyx_l1': 5, 'context_size_yyx': 4, 'num_mix_components_yyx': 5, 'context_extractor_yyx': 'gru', 'activation_func_yyx': 'Tanh', 'L2_weight_yyx': 1.4552397091115512e-10, 'L_entropy_weight_yyx': 2.5810890802872164e-10, 'L_sep_weight_yyx': 2.772740854686751e-06, 'L_scale_weight_yyx': 2.6980727166075488e-05, 'learning_rate_yyx': 0.0008204272960266021}. Best is trial 0 with value: -0.8124127071048167.
[I 2026-03-18 18:38:56,969] Trial 0 finished with value: -0.8245499130542028 and parameters: {'n_layers_yyx': 1, 'hidden_size_yyx_l0': 6, 'context_size_yyx': 1, 'num_mix_components_yyx': 2, 'context_extractor_yyx': 'lstm', 'activation_func_yyx': 'GELU', 'L2_weight_yyx': 9.415691896374684e-10, 'L_entropy_weight_yyx': 7.627421919724774e-05, 'L_sep_weight_yyx': 7.382904691009926e-05, 'L_scale_weight_yyx': 5.535022909365983e-05, 'learning_rate_yyx': 0.006561146423176365}. Best is trial 0 with value: -0.8245499130542028.
[I 2026-03-18 18:39:12,844] Trial 0 finished with value: -0.8279563193835395 and parameters: {'n_layers_yyx': 2, 'hidden_size_yyx_l0': 3, 'hidden_size_yyx_l1': 6, 'context_size_yyx': 4, 'num_mix_components_yyx': 3, 'context_extractor_yyx': 'gru', 'activation_func_yyx': 'GELU', 'L2_weight_yyx': 5.587163867001556e-06, 'L_entropy_weight_yyx': 1.4802864223729392e-06, 'L_sep_weight_yyx': 0.00015004074247313933, 'L_scale_weight_yyx': 4.30835104761261e-08, 'learning_rate_yyx': 0.004420911665417208}. Best is trial 0 with value: -0.8279563193835395.
[I 2026-03-18 18:39:21,742] Trial 0 finished with value: -2.283856477585679 and parameters: {'n_layers_yyx': 1, 'hidden_size_yyx_l0': 5, 'context_size_yyx': 3, 'num_mix_components_yyx': 3, 'context_extractor_yyx': 'gru', 'activation_func_yyx': 'Tanh', 'L2_weight_yyx': 9.377894691023418e-05, 'L_entropy_weight_yyx': 1.743898527385635e-10, 'L_sep_weight_yyx': 5.9056137253217466e-09, 'L_scale_weight_yyx': 2.438368455189833e-07, 'learning_rate_yyx': 0.009704519880995285}. Best is trial 0 with value: -2.283856477585679.
[I 2026-03-18 18:39:55,370] Trial 0 finished with value: -0.8087924974179515 and parameters: {'n_layers_yyx': 2, 'hidden_size_yyx_l0': 5, 'hidden_size_yyx_l1': 2, 'context_size_yyx': 2, 'num_mix_components_yyx': 2, 'context_extractor_yyx': 'gru', 'activation_func_yyx': 'ReLU', 'L2_weight_yyx': 0.0009274625543395309, 'L_entropy_weight_yyx': 1.060060953565348e-08, 'L_sep_weight_yyx': 5.368864096032676e-09, 'L_scale_weight_yyx': 1.218556749663536e-06, 'learning_rate_yyx': 0.005470632228062151}. Best is trial 0 with value: -0.8087924974179515.
[I 2026-03-18 18:40:01,136] Trial 0 finished with value: -2.277465192778458 and parameters: {'n_layers_yyx': 1, 'hidden_size_yyx_l0': 6, 'context_size_yyx': 2, 'num_mix_components_yyx': 4, 'context_extractor_yyx': 'lstm', 'activation_func_yyx': 'Tanh', 'L2_weight_yyx': 1.4292929757635145e-10, 'L_entropy_weight_yyx': 1.0524202330927216e-09, 'L_sep_weight_yyx': 6.298176159676727e-07, 'L_scale_weight_yyx': 2.8188233807600363e-08, 'learning_rate_yyx': 0.007565700937283643}. Best is trial 0 with value: -2.277465192778458.
[I 2026-03-18 18:40:01,191] Trial 0 finished with value: -0.8324342893885016 and parameters: {'n_layers_yyx': 1, 'hidden_size_yyx_l0': 6, 'context_size_yyx': 4, 'num_mix_components_yyx': 1, 'context_extractor_yyx': 'lstm', 'activation_func_yyx': 'Tanh', 'L2_weight_yyx': 4.988908959940638e-08, 'L_entropy_weight_yyx': 1.2355781203273529e-09, 'L_sep_weight_yyx': 1.159581327542246e-08, 'L_scale_weight_yyx': 8.50275132333833e-07, 'learning_rate_yyx': 0.0020011807869271363}. Best is trial 0 with value: -0.8324342893885016.
[I 2026-03-18 18:40:07,626] Trial 0 finished with value: -0.7936519245277304 and parameters: {'n_layers_yyx': 2, 'hidden_size_yyx_l0': 4, 'hidden_size_yyx_l1': 6, 'context_size_yyx': 2, 'num_mix_components_yyx': 3, 'context_extractor_yyx': 'gru', 'activation_func_yyx': 'ReLU', 'L2_weight_yyx': 5.605277648772952e-10, 'L_entropy_weight_yyx': 2.6778463193291668e-05, 'L_sep_weight_yyx': 8.31901430493911e-06, 'L_scale_weight_yyx': 2.654885421398464e-06, 'learning_rate_yyx': 0.003975141406906304}. Best is trial 0 with value: -0.7936519245277304.
[I 2026-03-18 18:40:29,308] Trial 0 finished with value: -0.7169699281498108 and parameters: {'n_layers_yyx': 1, 'hidden_size_yyx_l0': 5, 'context_size_yyx': 1, 'num_mix_components_yyx': 1, 'context_extractor_yyx': 'lstm', 'activation_func_yyx': 'GELU', 'L2_weight_yyx': 7.3274896397796396e-06, 'L_entropy_weight_yyx': 0.0002175218886656662, 'L_sep_weight_yyx': 9.92341577542456e-07, 'L_scale_weight_yyx': 1.8218214684858247e-05, 'learning_rate_yyx': 0.0014658663606248632}. Best is trial 0 with value: -0.7169699281498108.
[I 2026-03-18 18:40:34,697] Trial 0 finished with value: -0.8167597941140833 and parameters: {'n_layers_yyx': 2, 'hidden_size_yyx_l0': 4, 'hidden_size_yyx_l1': 6, 'context_size_yyx': 1, 'num_mix_components_yyx': 2, 'context_extractor_yyx': 'gru', 'activation_func_yyx': 'ReLU', 'L2_weight_yyx': 3.132862279310771e-07, 'L_entropy_weight_yyx': 2.653935439779186e-06, 'L_sep_weight_yyx': 1.8701869390854492e-07, 'L_scale_weight_yyx': 1.3051617509232163e-06, 'learning_rate_yyx': 0.004277056168554589}. Best is trial 0 with value: -0.8167597941140833.
[I 2026-03-18 18:41:08,118] Trial 0 finished with value: -1.7756637156059056 and parameters: {'n_layers_yyx': 2, 'hidden_size_yyx_l0': 3, 'hidden_size_yyx_l1': 4, 'context_size_yyx': 4, 'num_mix_components_yyx': 5, 'context_extractor_yyx': 'lstm', 'activation_func_yyx': 'Tanh', 'L2_weight_yyx': 4.926859551400965e-10, 'L_entropy_weight_yyx': 9.725181874029338e-07, 'L_sep_weight_yyx': 2.4279534480619484e-08, 'L_scale_weight_yyx': 1.1383418196117808e-07, 'learning_rate_yyx': 0.002016268499741939}. Best is trial 0 with value: -1.7756637156059056.
[I 2026-03-18 18:41:09,767] Trial 0 finished with value: -0.7850043833519895 and parameters: {'n_layers_yyx': 1, 'hidden_size_yyx_l0': 6, 'context_size_yyx': 1, 'num_mix_components_yyx': 2, 'context_extractor_yyx': 'gru', 'activation_func_yyx': 'Tanh', 'L2_weight_yyx': 2.8156375870206327e-08, 'L_entropy_weight_yyx': 1.0516342240540308e-09, 'L_sep_weight_yyx': 2.3784998376150684e-09, 'L_scale_weight_yyx': 0.0001524610120125836, 'learning_rate_yyx': 0.0024056937554009328}. Best is trial 0 with value: -0.7850043833519895.
[I 2026-03-18 18:41:12,886] Trial 0 finished with value: -0.9147985592774902 and parameters: {'n_layers_yyx': 1, 'hidden_size_yyx_l0': 4, 'context_size_yyx': 2, 'num_mix_components_yyx': 2, 'context_extractor_yyx': 'lstm', 'activation_func_yyx': 'ReLU', 'L2_weight_yyx': 6.938162083565269e-07, 'L_entropy_weight_yyx': 0.00023256421427544528, 'L_sep_weight_yyx': 3.9410788220049277e-07, 'L_scale_weight_yyx': 1.6035500165347557e-09, 'learning_rate_yyx': 0.00414302718316926}. Best is trial 0 with value: -0.9147985592774902.
[I 2026-03-18 18:41:15,832] Trial 0 finished with value: -2.2736224731295898 and parameters: {'n_layers_yyx': 1, 'hidden_size_yyx_l0': 3, 'context_size_yyx': 1, 'num_mix_components_yyx': 5, 'context_extractor_yyx': 'lstm', 'activation_func_yyx': 'ReLU', 'L2_weight_yyx': 1.1083504132807618e-05, 'L_entropy_weight_yyx': 1.0372928795444336e-05, 'L_sep_weight_yyx': 1.0580170003679796e-08, 'L_scale_weight_yyx': 0.00011705583194375423, 'learning_rate_yyx': 0.007193188167372997}. Best is trial 0 with value: -2.2736224731295898.
[I 2026-03-18 18:41:26,069] Trial 0 finished with value: -2.1700690331730264 and parameters: {'n_layers_yyx': 2, 'hidden_size_yyx_l0': 4, 'hidden_size_yyx_l1': 6, 'context_size_yyx': 2, 'num_mix_components_yyx': 1, 'context_extractor_yyx': 'lstm', 'activation_func_yyx': 'Tanh', 'L2_weight_yyx': 2.3648124871492162e-05, 'L_entropy_weight_yyx': 0.00029689946959187026, 'L_sep_weight_yyx': 2.4761154315686484e-06, 'L_scale_weight_yyx': 1.0133049295130846e-06, 'learning_rate_yyx': 0.0006774741867431146}. Best is trial 0 with value: -2.1700690331730264.
[I 2026-03-18 18:41:27,540] Trial 1 pruned. 
[I 2026-03-18 18:41:29,878] Trial 1 pruned. 
[I 2026-03-18 18:41:37,753] Trial 0 finished with value: -2.253211525389624 and parameters: {'n_layers_yyx': 1, 'hidden_size_yyx_l0': 6, 'context_size_yyx': 2, 'num_mix_components_yyx': 4, 'context_extractor_yyx': 'gru', 'activation_func_yyx': 'ReLU', 'L2_weight_yyx': 8.953418389959895e-10, 'L_entropy_weight_yyx': 2.229219010128774e-10, 'L_sep_weight_yyx': 2.0056906836330152e-10, 'L_scale_weight_yyx': 6.225606414315664e-05, 'learning_rate_yyx': 0.0018784033190652172}. Best is trial 0 with value: -2.253211525389624.
[I 2026-03-18 18:41:46,782] Trial 0 finished with value: -1.7600618982796716 and parameters: {'n_layers_yyx': 2, 'hidden_size_yyx_l0': 4, 'hidden_size_yyx_l1': 3, 'context_size_yyx': 2, 'num_mix_components_yyx': 2, 'context_extractor_yyx': 'lstm', 'activation_func_yyx': 'Tanh', 'L2_weight_yyx': 4.086464386079763e-08, 'L_entropy_weight_yyx': 1.6122052325560906e-06, 'L_sep_weight_yyx': 2.3951464471798678e-08, 'L_scale_weight_yyx': 4.5634530758458807e-10, 'learning_rate_yyx': 0.00669041996937312}. Best is trial 0 with value: -1.7600618982796716.
[I 2026-03-18 18:41:50,687] Trial 1 pruned. 
[I 2026-03-18 18:41:52,619] Trial 0 finished with value: -2.2738088197393527 and parameters: {'n_layers_yyx': 1, 'hidden_size_yyx_l0': 5, 'context_size_yyx': 3, 'num_mix_components_yyx': 2, 'context_extractor_yyx': 'lstm', 'activation_func_yyx': 'Tanh', 'L2_weight_yyx': 1.5666936697175462e-10, 'L_entropy_weight_yyx': 5.52173403197166e-07, 'L_sep_weight_yyx': 5.402817591915514e-07, 'L_scale_weight_yyx': 7.646293915414114e-09, 'learning_rate_yyx': 0.0020064694139764728}. Best is trial 0 with value: -2.2738088197393527.
[I 2026-03-18 18:41:52,971] Trial 0 finished with value: -1.862420681977218 and parameters: {'n_layers_yyx': 1, 'hidden_size_yyx_l0': 4, 'context_size_yyx': 4, 'num_mix_components_yyx': 1, 'context_extractor_yyx': 'gru', 'activation_func_yyx': 'Tanh', 'L2_weight_yyx': 2.0231510796679934e-05, 'L_entropy_weight_yyx': 3.305726083162799e-08, 'L_sep_weight_yyx': 3.533713800531223e-06, 'L_scale_weight_yyx': 6.8386340627148655e-06, 'learning_rate_yyx': 0.004732774436978448}. Best is trial 0 with value: -1.862420681977218.
[I 2026-03-18 18:41:55,940] Trial 0 finished with value: -2.218563532741738 and parameters: {'n_layers_yyx': 2, 'hidden_size_yyx_l0': 2, 'hidden_size_yyx_l1': 6, 'context_size_yyx': 1, 'num_mix_components_yyx': 3, 'context_extractor_yyx': 'lstm', 'activation_func_yyx': 'GELU', 'L2_weight_yyx': 5.4470532517958506e-05, 'L_entropy_weight_yyx': 0.00020705070661315852, 'L_sep_weight_yyx': 1.0641387230377396e-07, 'L_scale_weight_yyx': 0.0005078275299868404, 'learning_rate_yyx': 0.0009945517238085595}. Best is trial 0 with value: -2.218563532741738.
[I 2026-03-18 18:41:58,552] Trial 0 finished with value: -0.7971011320984698 and parameters: {'n_layers_yyx': 1, 'hidden_size_yyx_l0': 4, 'context_size_yyx': 1, 'num_mix_components_yyx': 3, 'context_extractor_yyx': 'gru', 'activation_func_yyx': 'GELU', 'L2_weight_yyx': 0.00011902745552511714, 'L_entropy_weight_yyx': 2.6875125918524474e-08, 'L_sep_weight_yyx': 3.0551212157928154e-05, 'L_scale_weight_yyx': 0.00015336956844629854, 'learning_rate_yyx': 0.005168602730804774}. Best is trial 0 with value: -0.7971011320984698.
[I 2026-03-18 18:41:59,015] Trial 0 finished with value: -1.7824255494397097 and parameters: {'n_layers_yyx': 2, 'hidden_size_yyx_l0': 5, 'hidden_size_yyx_l1': 3, 'context_size_yyx': 2, 'num_mix_components_yyx': 3, 'context_extractor_yyx': 'lstm', 'activation_func_yyx': 'GELU', 'L2_weight_yyx': 1.0138949194804261e-06, 'L_entropy_weight_yyx': 4.978516440476136e-07, 'L_sep_weight_yyx': 0.0002881600189534124, 'L_scale_weight_yyx': 6.650023508252991e-10, 'learning_rate_yyx': 0.001955925434384352}. Best is trial 0 with value: -1.7824255494397097.
[I 2026-03-18 18:42:01,394] Trial 0 finished with value: -2.2740171920421512 and parameters: {'n_layers_yyx': 1, 'hidden_size_yyx_l0': 3, 'context_size_yyx': 1, 'num_mix_components_yyx': 5, 'context_extractor_yyx': 'lstm', 'activation_func_yyx': 'ReLU', 'L2_weight_yyx': 1.0868993655483288e-08, 'L_entropy_weight_yyx': 2.8554751905257473e-05, 'L_sep_weight_yyx': 9.250148616638262e-10, 'L_scale_weight_yyx': 1.985943565887847e-07, 'learning_rate_yyx': 0.004947631720228008}. Best is trial 0 with value: -2.2740171920421512.
[I 2026-03-18 18:42:15,425] Trial 1 pruned. 
[I 2026-03-18 18:42:15,809] Trial 1 pruned. 
[I 2026-03-18 18:42:26,297] Trial 1 pruned. 
[I 2026-03-18 18:42:44,156] Trial 0 finished with value: -1.7793034017335003 and parameters: {'n_layers_yyx': 1, 'hidden_size_yyx_l0': 2, 'context_size_yyx': 2, 'num_mix_components_yyx': 2, 'context_extractor_yyx': 'gru', 'activation_func_yyx': 'ReLU', 'L2_weight_yyx': 0.00015798660112529146, 'L_entropy_weight_yyx': 6.830466286736667e-09, 'L_sep_weight_yyx': 0.00016064113531985983, 'L_scale_weight_yyx': 3.0256774597996963e-06, 'learning_rate_yyx': 0.005847436682094726}. Best is trial 0 with value: -1.7793034017335003.
[I 2026-03-18 18:42:47,160] Trial 2 finished with value: -0.8470963645374578 and parameters: {'n_layers_yyx': 2, 'hidden_size_yyx_l0': 3, 'hidden_size_yyx_l1': 6, 'context_size_yyx': 2, 'num_mix_components_yyx': 4, 'context_extractor_yyx': 'gru', 'activation_func_yyx': 'Tanh', 'L2_weight_yyx': 5.438679190171137e-09, 'L_entropy_weight_yyx': 7.048357258810216e-07, 'L_sep_weight_yyx': 3.1177312296655564e-07, 'L_scale_weight_yyx': 6.825142318882992e-08, 'learning_rate_yyx': 0.00516459577971415}. Best is trial 0 with value: -0.9147985592774902.
[I 2026-03-18 18:42:55,202] Trial 2 pruned. 
[I 2026-03-18 18:42:56,448] Trial 0 finished with value: -0.8035945920507525 and parameters: {'n_layers_yyx': 2, 'hidden_size_yyx_l0': 5, 'hidden_size_yyx_l1': 4, 'context_size_yyx': 2, 'num_mix_components_yyx': 4, 'context_extractor_yyx': 'gru', 'activation_func_yyx': 'ReLU', 'L2_weight_yyx': 4.6798400479534505e-06, 'L_entropy_weight_yyx': 1.590195907853281e-07, 'L_sep_weight_yyx': 4.6822547308859556e-05, 'L_scale_weight_yyx': 1.101158477788944e-06, 'learning_rate_yyx': 0.0008779003406537034}. Best is trial 0 with value: -0.8035945920507525.
[I 2026-03-18 18:43:04,759] Trial 3 pruned. 
[I 2026-03-18 18:43:07,958] Trial 1 finished with value: -0.8246437647494115 and parameters: {'n_layers_yyx': 2, 'hidden_size_yyx_l0': 6, 'hidden_size_yyx_l1': 6, 'context_size_yyx': 3, 'num_mix_components_yyx': 5, 'context_extractor_yyx': 'gru', 'activation_func_yyx': 'GELU', 'L2_weight_yyx': 0.0003123164613298769, 'L_entropy_weight_yyx': 2.020525996807221e-10, 'L_sep_weight_yyx': 8.317349899515308e-06, 'L_scale_weight_yyx': 0.000122693213122586, 'learning_rate_yyx': 0.0012714859953975339}. Best is trial 1 with value: -0.8246437647494115.
[I 2026-03-18 18:43:15,015] Trial 4 pruned. 
[I 2026-03-18 18:43:19,324] Trial 0 finished with value: -1.7780535087200127 and parameters: {'n_layers_yyx': 2, 'hidden_size_yyx_l0': 4, 'hidden_size_yyx_l1': 6, 'context_size_yyx': 1, 'num_mix_components_yyx': 4, 'context_extractor_yyx': 'gru', 'activation_func_yyx': 'Tanh', 'L2_weight_yyx': 2.200029381234367e-07, 'L_entropy_weight_yyx': 2.4983259521367807e-08, 'L_sep_weight_yyx': 1.388835865506963e-10, 'L_scale_weight_yyx': 8.69843602627931e-09, 'learning_rate_yyx': 0.0014433942794693426}. Best is trial 0 with value: -1.7780535087200127.
[I 2026-03-18 18:43:39,014] Trial 1 pruned. 
[I 2026-03-18 18:43:55,729] Trial 0 finished with value: -2.2633646515681303 and parameters: {'n_layers_yyx': 1, 'hidden_size_yyx_l0': 3, 'context_size_yyx': 1, 'num_mix_components_yyx': 5, 'context_extractor_yyx': 'lstm', 'activation_func_yyx': 'Tanh', 'L2_weight_yyx': 1.5149002114423775e-08, 'L_entropy_weight_yyx': 1.043991108352402e-09, 'L_sep_weight_yyx': 1.7708852065428995e-07, 'L_scale_weight_yyx': 4.61539510561026e-05, 'learning_rate_yyx': 0.001698273128439342}. Best is trial 0 with value: -2.2633646515681303.
[I 2026-03-18 18:44:02,262] Trial 0 finished with value: -1.775654347633956 and parameters: {'n_layers_yyx': 1, 'hidden_size_yyx_l0': 4, 'context_size_yyx': 2, 'num_mix_components_yyx': 3, 'context_extractor_yyx': 'gru', 'activation_func_yyx': 'GELU', 'L2_weight_yyx': 2.3426147200514022e-09, 'L_entropy_weight_yyx': 0.0002447020062268841, 'L_sep_weight_yyx': 1.0147541632888047e-09, 'L_scale_weight_yyx': 4.540031660728047e-09, 'learning_rate_yyx': 0.0006764685104256217}. Best is trial 0 with value: -1.775654347633956.
[I 2026-03-18 18:44:03,006] Trial 2 pruned. 
[I 2026-03-18 18:44:13,991] Trial 0 finished with value: -1.7503072787152636 and parameters: {'n_layers_yyx': 1, 'hidden_size_yyx_l0': 3, 'context_size_yyx': 2, 'num_mix_components_yyx': 3, 'context_extractor_yyx': 'lstm', 'activation_func_yyx': 'Tanh', 'L2_weight_yyx': 1.1269470197449298e-08, 'L_entropy_weight_yyx': 8.268510934168919e-10, 'L_sep_weight_yyx': 0.0008416705919118128, 'L_scale_weight_yyx': 2.3990695438274522e-05, 'learning_rate_yyx': 0.0006795859695130816}. Best is trial 0 with value: -1.7503072787152636.
[I 2026-03-18 18:44:15,708] Trial 1 finished with value: -1.750011959249754 and parameters: {'n_layers_yyx': 2, 'hidden_size_yyx_l0': 5, 'hidden_size_yyx_l1': 2, 'context_size_yyx': 2, 'num_mix_components_yyx': 2, 'context_extractor_yyx': 'lstm', 'activation_func_yyx': 'GELU', 'L2_weight_yyx': 6.308178846128996e-07, 'L_entropy_weight_yyx': 7.36162810257527e-06, 'L_sep_weight_yyx': 2.1327511837899947e-09, 'L_scale_weight_yyx': 3.822402708405625e-05, 'learning_rate_yyx': 0.008049155521664877}. Best is trial 0 with value: -1.7756637156059056.
[I 2026-03-18 18:44:30,372] Trial 1 finished with value: -0.8101650221132985 and parameters: {'n_layers_yyx': 1, 'hidden_size_yyx_l0': 4, 'context_size_yyx': 4, 'num_mix_components_yyx': 1, 'context_extractor_yyx': 'gru', 'activation_func_yyx': 'GELU', 'L2_weight_yyx': 0.00037727721853426834, 'L_entropy_weight_yyx': 9.208642242312038e-10, 'L_sep_weight_yyx': 0.0002481641134965464, 'L_scale_weight_yyx': 3.210546750987729e-06, 'learning_rate_yyx': 0.002307102092594054}. Best is trial 0 with value: -0.8245499130542028.
[I 2026-03-18 18:44:32,211] Trial 1 finished with value: -0.8328681168211087 and parameters: {'n_layers_yyx': 2, 'hidden_size_yyx_l0': 2, 'hidden_size_yyx_l1': 2, 'context_size_yyx': 4, 'num_mix_components_yyx': 2, 'context_extractor_yyx': 'lstm', 'activation_func_yyx': 'GELU', 'L2_weight_yyx': 0.00010786046020662349, 'L_entropy_weight_yyx': 4.507359266755823e-05, 'L_sep_weight_yyx': 7.906883319970634e-10, 'L_scale_weight_yyx': 6.450848035483595e-08, 'learning_rate_yyx': 0.005180359031390606}. Best is trial 1 with value: -0.8328681168211087.
[I 2026-03-18 18:44:36,211] Trial 2 pruned. 
