[I 2026-03-18 19:40:36,740] Trial 45 finished with value: -2.2701364617598685 and parameters: {'n_layers_yyx': 2, 'hidden_size_yyx_l0': 3, 'hidden_size_yyx_l1': 5, 'context_size_yyx': 4, 'num_mix_components_yyx': 3, 'context_extractor_yyx': 'lstm', 'activation_func_yyx': 'GELU', 'L2_weight_yyx': 5.982372338286434e-06, 'L_entropy_weight_yyx': 2.6122079133924206e-07, 'L_sep_weight_yyx': 7.018686708573605e-08, 'L_scale_weight_yyx': 4.708119059015118e-07, 'learning_rate_yyx': 0.007941418943996458}. Best is trial 17 with value: -2.288314778247399.
[I 2026-03-18 19:40:40,117] Trial 44 finished with value: -2.20674105510888 and parameters: {'n_layers_yyx': 2, 'hidden_size_yyx_l0': 6, 'hidden_size_yyx_l1': 5, 'context_size_yyx': 3, 'num_mix_components_yyx': 5, 'context_extractor_yyx': 'lstm', 'activation_func_yyx': 'GELU', 'L2_weight_yyx': 1.0524209216635916e-07, 'L_entropy_weight_yyx': 3.256173066056716e-08, 'L_sep_weight_yyx': 9.33415402267337e-06, 'L_scale_weight_yyx': 3.179122193617706e-10, 'learning_rate_yyx': 0.008690801379932963}. Best is trial 12 with value: -2.2168161654612635.
[I 2026-03-18 19:40:47,367] Trial 45 pruned. 
[I 2026-03-18 19:41:04,686] Trial 40 finished with value: -2.281507796961062 and parameters: {'n_layers_yyx': 2, 'hidden_size_yyx_l0': 5, 'hidden_size_yyx_l1': 6, 'context_size_yyx': 4, 'num_mix_components_yyx': 1, 'context_extractor_yyx': 'lstm', 'activation_func_yyx': 'ReLU', 'L2_weight_yyx': 2.7491656453891786e-05, 'L_entropy_weight_yyx': 1.157424982765171e-09, 'L_sep_weight_yyx': 3.86782669423599e-07, 'L_scale_weight_yyx': 1.1331537706884975e-07, 'learning_rate_yyx': 0.007990221448655074}. Best is trial 25 with value: -2.286349879513464.
[I 2026-03-18 19:41:37,830] Trial 44 finished with value: -2.2834811857550026 and parameters: {'n_layers_yyx': 2, 'hidden_size_yyx_l0': 3, 'hidden_size_yyx_l1': 4, 'context_size_yyx': 4, 'num_mix_components_yyx': 3, 'context_extractor_yyx': 'lstm', 'activation_func_yyx': 'GELU', 'L2_weight_yyx': 1.5231934101329053e-06, 'L_entropy_weight_yyx': 2.680985132575778e-07, 'L_sep_weight_yyx': 8.736426335583014e-08, 'L_scale_weight_yyx': 5.162148819474657e-08, 'learning_rate_yyx': 0.00557848871477364}. Best is trial 44 with value: -2.2834811857550026.
[I 2026-03-18 19:41:40,153] Trial 44 finished with value: -2.277691503355651 and parameters: {'n_layers_yyx': 2, 'hidden_size_yyx_l0': 3, 'hidden_size_yyx_l1': 5, 'context_size_yyx': 4, 'num_mix_components_yyx': 5, 'context_extractor_yyx': 'lstm', 'activation_func_yyx': 'GELU', 'L2_weight_yyx': 6.0083824271711885e-09, 'L_entropy_weight_yyx': 1.1318888466732585e-10, 'L_sep_weight_yyx': 0.00048033844992331916, 'L_scale_weight_yyx': 3.613696276643537e-09, 'learning_rate_yyx': 0.006396318058431093}. Best is trial 44 with value: -2.277691503355651.
[I 2026-03-18 19:41:52,926] Trial 45 pruned. 
[I 2026-03-18 19:41:52,935] Trial 48 pruned. 
[I 2026-03-18 19:41:52,938] Trial 45 finished with value: -2.276075715328425 and parameters: {'n_layers_yyx': 2, 'hidden_size_yyx_l0': 3, 'hidden_size_yyx_l1': 5, 'context_size_yyx': 4, 'num_mix_components_yyx': 5, 'context_extractor_yyx': 'gru', 'activation_func_yyx': 'GELU', 'L2_weight_yyx': 1.917312218142712e-05, 'L_entropy_weight_yyx': 2.2907480034917086e-08, 'L_sep_weight_yyx': 0.0004053234851361896, 'L_scale_weight_yyx': 0.00014481628006184343, 'learning_rate_yyx': 0.006957471522098858}. Best is trial 32 with value: -2.283618801160143.
[I 2026-03-18 19:42:00,433] Trial 46 pruned. 
[I 2026-03-18 19:42:30,665] Trial 46 pruned. 
[I 2026-03-18 19:42:31,555] Trial 46 pruned. 
[I 2026-03-18 19:42:31,555] Trial 49 pruned. 

Source events: 20800
Target events: 5634
Full model ln_yyx : 466.33285 nats/sec, 74.49407 nats/event
Full model Log loss : -2.26336
Full model ln_yyx : 465.85166 nats/sec, 74.41720 nats/event
Full model Log loss : -2.26119
Full model ln_yyx : 466.66976 nats/sec, 74.54789 nats/event
Full model Log loss : -2.26993
Full model ln_yyx : 457.64726 nats/sec, 73.10659 nats/event
Full model Log loss : -2.24791
Full model ln_yyx : 461.39806 nats/sec, 73.70576 nats/event
Full model Log loss : -2.26666
Full model ln_yyx : 464.54339 nats/sec, 74.20821 nats/event
Full model Log loss : -2.27060
Full model ln_yyx : 461.82521 nats/sec, 73.77399 nats/event
Full model Log loss : -2.27326
Full model ln_yyx : 465.42820 nats/sec, 74.34955 nats/event
Full model Log loss : -2.26667
Full model ln_yyx : 464.01835 nats/sec, 74.12434 nats/event
Full model Log loss : -2.26488
Full model ln_yyx : 467.69631 nats/sec, 74.71187 nats/event
Full model Log loss : -2.27343
Full model ln_yyx : 460.83279 nats/sec, 73.61546 nats/event
Full model Log loss : -2.26428
Full model ln_yyx : 464.43550 nats/sec, 74.19098 nats/event
Full model Log loss : -2.27068
Full model ln_yyx : 467.41088 nats/sec, 74.66628 nats/event
Full model Log loss : -2.27277
Full model ln_yyx : 464.59078 nats/sec, 74.21578 nats/event
Full model Log loss : -2.25810
Full model ln_yyx : 460.25898 nats/sec, 73.52380 nats/event
Full model Log loss : -2.25404
Full model ln_yyx : 468.56725 nats/sec, 74.85100 nats/event
Full model Log loss : -2.27408
Full model ln_yyx : 460.10471 nats/sec, 73.49915 nats/event
Full model Log loss : -2.26407
Optimization finished. Config saved to results/opt-full/opt_full_209_best_config.txt
[I 2026-03-18 19:42:36,149] Trial 46 pruned. 
[I 2026-03-18 19:42:36,633] Trial 47 pruned. 
[I 2026-03-18 19:42:38,623] Trial 47 pruned. 
[I 2026-03-18 19:42:41,495] Trial 41 finished with value: -2.285449427928014 and parameters: {'n_layers_yyx': 1, 'hidden_size_yyx_l0': 6, 'context_size_yyx': 4, 'num_mix_components_yyx': 2, 'context_extractor_yyx': 'gru', 'activation_func_yyx': 'ReLU', 'L2_weight_yyx': 8.429759903918237e-09, 'L_entropy_weight_yyx': 4.72331893762107e-07, 'L_sep_weight_yyx': 1.674546363138976e-08, 'L_scale_weight_yyx': 5.093908816053859e-10, 'learning_rate_yyx': 0.005952366620174192}. Best is trial 25 with value: -2.286349879513464.
[I 2026-03-18 19:42:45,770] Trial 48 pruned. 
[I 2026-03-18 19:42:49,334] Trial 47 pruned. 
[I 2026-03-18 19:42:51,017] Trial 49 pruned. 

Source events: 20800
Target events: 10683
Full model ln_yyx : 869.47588 nats/sec, 73.24986 nats/event
Full model Log loss : -2.25544
Full model ln_yyx : 874.93524 nats/sec, 73.70979 nats/event
Full model Log loss : -2.27250
Full model ln_yyx : 869.51597 nats/sec, 73.25324 nats/event
Full model Log loss : -2.25401
Full model ln_yyx : 882.45997 nats/sec, 74.34372 nats/event
Full model Log loss : -2.27876
Full model ln_yyx : 873.51437 nats/sec, 73.59009 nats/event
Full model Log loss : -2.26827
Full model ln_yyx : 886.69942 nats/sec, 74.70088 nats/event
Full model Log loss : -2.27772
Full model ln_yyx : 885.49205 nats/sec, 74.59916 nats/event
Full model Log loss : -2.27720
Full model ln_yyx : 881.95625 nats/sec, 74.30128 nats/event
Full model Log loss : -2.27349
Full model ln_yyx : 873.99779 nats/sec, 73.63082 nats/event
Full model Log loss : -2.27219
Full model ln_yyx : 884.23662 nats/sec, 74.49340 nats/event
Full model Log loss : -2.27559
Full model ln_yyx : 879.09621 nats/sec, 74.06034 nats/event
Full model Log loss : -2.27543
Full model ln_yyx : 880.21179 nats/sec, 74.15432 nats/event
Full model Log loss : -2.28123
Full model ln_yyx : 888.28118 nats/sec, 74.83413 nats/event
Full model Log loss : -2.28107
Full model ln_yyx : 880.06873 nats/sec, 74.14227 nats/event
Full model Log loss : -2.25950
Full model ln_yyx : 873.14527 nats/sec, 73.55900 nats/event
Full model Log loss : -2.25732
Full model ln_yyx : 891.79380 nats/sec, 75.13006 nats/event
Full model Log loss : -2.28348
Optimization finished. Config saved to results/opt-full/opt_full_210_best_config.txt
[I 2026-03-18 19:42:55,980] Trial 42 pruned. 
[I 2026-03-18 19:43:02,272] Trial 43 pruned. 
[I 2026-03-18 19:43:12,304] Trial 45 finished with value: -2.2759665015536905 and parameters: {'n_layers_yyx': 2, 'hidden_size_yyx_l0': 3, 'hidden_size_yyx_l1': 4, 'context_size_yyx': 4, 'num_mix_components_yyx': 5, 'context_extractor_yyx': 'lstm', 'activation_func_yyx': 'GELU', 'L2_weight_yyx': 1.2520604396675035e-08, 'L_entropy_weight_yyx': 1.0885724962072986e-10, 'L_sep_weight_yyx': 0.0004041503360825593, 'L_scale_weight_yyx': 5.499492758594109e-09, 'learning_rate_yyx': 0.00890456648210872}. Best is trial 44 with value: -2.277691503355651.
[I 2026-03-18 19:43:21,492] Trial 47 finished with value: -2.2790399623703688 and parameters: {'n_layers_yyx': 2, 'hidden_size_yyx_l0': 2, 'hidden_size_yyx_l1': 5, 'context_size_yyx': 4, 'num_mix_components_yyx': 5, 'context_extractor_yyx': 'lstm', 'activation_func_yyx': 'GELU', 'L2_weight_yyx': 7.653084793554566e-06, 'L_entropy_weight_yyx': 0.00011597431132519372, 'L_sep_weight_yyx': 2.833851687733286e-05, 'L_scale_weight_yyx': 8.025417629884447e-05, 'learning_rate_yyx': 0.008898079185911144}. Best is trial 32 with value: -2.283618801160143.
[I 2026-03-18 19:43:25,276] Trial 48 pruned. 
[I 2026-03-18 19:43:50,062] Trial 46 pruned. 
[I 2026-03-18 19:44:00,205] Trial 48 finished with value: -2.2897698503958845 and parameters: {'n_layers_yyx': 1, 'hidden_size_yyx_l0': 5, 'context_size_yyx': 4, 'num_mix_components_yyx': 4, 'context_extractor_yyx': 'lstm', 'activation_func_yyx': 'Tanh', 'L2_weight_yyx': 4.907404338869762e-07, 'L_entropy_weight_yyx': 8.91077575963876e-09, 'L_sep_weight_yyx': 4.257404344331006e-05, 'L_scale_weight_yyx': 1.3019169886290068e-10, 'learning_rate_yyx': 0.0065279097843171105}. Best is trial 48 with value: -2.2897698503958845.
[I 2026-03-18 19:44:01,044] Trial 48 pruned. 
[I 2026-03-18 19:44:14,836] Trial 49 pruned. 

Source events: 20800
Target events: 20315
Full model ln_yyx : 1683.24495 nats/sec, 74.57152 nats/event
Full model Log loss : -2.27381
Full model ln_yyx : 1668.22667 nats/sec, 73.90618 nats/event
Full model Log loss : -2.27969
Full model ln_yyx : 1670.74686 nats/sec, 74.01783 nats/event
Full model Log loss : -2.26125
Full model ln_yyx : 1666.53398 nats/sec, 73.83119 nats/event
Full model Log loss : -2.25598
Full model ln_yyx : 1670.15367 nats/sec, 73.99155 nats/event
Full model Log loss : -2.27586
Full model ln_yyx : 1665.88591 nats/sec, 73.80248 nats/event
Full model Log loss : -2.28120
Full model ln_yyx : 1669.18490 nats/sec, 73.94863 nats/event
Full model Log loss : -2.28018
Full model ln_yyx : 1686.35944 nats/sec, 74.70950 nats/event
Full model Log loss : -2.28102
Full model ln_yyx : 1673.89269 nats/sec, 74.15720 nats/event
Full model Log loss : -2.26904
Full model ln_yyx : 1676.85427 nats/sec, 74.28840 nats/event
Full model Log loss : -2.28360
Full model ln_yyx : 1699.04415 nats/sec, 75.27146 nats/event
Full model Log loss : -2.27648
Full model ln_yyx : 1682.08920 nats/sec, 74.52032 nats/event
Full model Log loss : -2.28047
Full model ln_yyx : 1680.72972 nats/sec, 74.46009 nats/event
Full model Log loss : -2.28148
Full model ln_yyx : 1691.17603 nats/sec, 74.92289 nats/event
Full model Log loss : -2.28362
Full model ln_yyx : 1680.35773 nats/sec, 74.44361 nats/event
Full model Log loss : -2.28006
Full model ln_yyx : 1681.03753 nats/sec, 74.47373 nats/event
Full model Log loss : -2.27888
Full model ln_yyx : 1672.08328 nats/sec, 74.07703 nats/event
Full model Log loss : -2.28024
Full model ln_yyx : 1680.65066 nats/sec, 74.45659 nats/event
Full model Log loss : -2.27608
Full model ln_yyx : 1670.52282 nats/sec, 74.00790 nats/event
Full model Log loss : -2.27904
Optimization finished. Config saved to results/opt-full/opt_full_206_best_config.txt
[I 2026-03-18 19:44:24,536] Trial 44 finished with value: -2.2863740545153766 and parameters: {'n_layers_yyx': 1, 'hidden_size_yyx_l0': 6, 'context_size_yyx': 4, 'num_mix_components_yyx': 2, 'context_extractor_yyx': 'gru', 'activation_func_yyx': 'ReLU', 'L2_weight_yyx': 5.9474066721759264e-08, 'L_entropy_weight_yyx': 1.3014196835250848e-07, 'L_sep_weight_yyx': 4.131231333014846e-09, 'L_scale_weight_yyx': 5.791285694198368e-10, 'learning_rate_yyx': 0.009882680216803937}. Best is trial 44 with value: -2.2863740545153766.
[I 2026-03-18 19:44:30,169] Trial 45 pruned. 
[I 2026-03-18 19:44:54,823] Trial 49 finished with value: -2.201161374695731 and parameters: {'n_layers_yyx': 2, 'hidden_size_yyx_l0': 4, 'hidden_size_yyx_l1': 6, 'context_size_yyx': 3, 'num_mix_components_yyx': 5, 'context_extractor_yyx': 'lstm', 'activation_func_yyx': 'GELU', 'L2_weight_yyx': 2.0491778227950437e-09, 'L_entropy_weight_yyx': 6.838785088933614e-08, 'L_sep_weight_yyx': 4.501633688612619e-05, 'L_scale_weight_yyx': 1.6484583135391209e-06, 'learning_rate_yyx': 0.004999330543216188}. Best is trial 12 with value: -2.2168161654612635.

Source events: 20800
Target events: 1783
Full model ln_yyx : 142.33754 nats/sec, 71.84733 nats/event
Full model Log loss : -2.17007
Full model ln_yyx : 146.01020 nats/sec, 73.70117 nats/event
Full model Log loss : -2.20833
Full model ln_yyx : 143.85403 nats/sec, 72.61280 nats/event
Full model Log loss : -2.19013
Full model ln_yyx : 146.08228 nats/sec, 73.73755 nats/event
Full model Log loss : -2.20261
Full model ln_yyx : 143.23524 nats/sec, 72.30046 nats/event
Full model Log loss : -2.17547
Full model ln_yyx : 144.54544 nats/sec, 72.96180 nats/event
Full model Log loss : -2.21490
Full model ln_yyx : 144.95184 nats/sec, 73.16694 nats/event
Full model Log loss : -2.20996
Full model ln_yyx : 145.82459 nats/sec, 73.60748 nats/event
Full model Log loss : -2.21682
Full model ln_yyx : 145.23662 nats/sec, 73.31069 nats/event
Full model Log loss : -2.20877
Full model ln_yyx : 143.24786 nats/sec, 72.30683 nats/event
Full model Log loss : -2.16123
Full model ln_yyx : 144.97785 nats/sec, 73.18007 nats/event
Full model Log loss : -2.20788
Full model ln_yyx : 144.92263 nats/sec, 73.15220 nats/event
Full model Log loss : -2.21214
Full model ln_yyx : 146.77722 nats/sec, 74.08833 nats/event
Full model Log loss : -2.20398
Full model ln_yyx : 145.89995 nats/sec, 73.64552 nats/event
Full model Log loss : -2.21353
Full model ln_yyx : 145.09469 nats/sec, 73.23905 nats/event
Full model Log loss : -2.20866
Full model ln_yyx : 145.04513 nats/sec, 73.21403 nats/event
Full model Log loss : -2.21209
Full model ln_yyx : 144.72510 nats/sec, 73.05249 nats/event
Full model Log loss : -2.20525
Full model ln_yyx : 144.89169 nats/sec, 73.13658 nats/event
Full model Log loss : -2.21216
Full model ln_yyx : 146.00176 nats/sec, 73.69691 nats/event
Full model Log loss : -2.20674
Full model ln_yyx : 147.01651 nats/sec, 74.20912 nats/event
Full model Log loss : -2.20116
Optimization finished. Config saved to results/opt-full/opt_full_205_best_config.txt
[I 2026-03-18 19:45:08,080] Trial 46 pruned. 
[I 2026-03-18 19:45:29,693] Trial 47 finished with value: -2.27670114459532 and parameters: {'n_layers_yyx': 2, 'hidden_size_yyx_l0': 4, 'hidden_size_yyx_l1': 4, 'context_size_yyx': 4, 'num_mix_components_yyx': 5, 'context_extractor_yyx': 'lstm', 'activation_func_yyx': 'GELU', 'L2_weight_yyx': 4.128393505770729e-08, 'L_entropy_weight_yyx': 3.091909924730104e-10, 'L_sep_weight_yyx': 1.607893380977339e-05, 'L_scale_weight_yyx': 6.100042880526262e-08, 'learning_rate_yyx': 0.009055516784548327}. Best is trial 44 with value: -2.277691503355651.
[I 2026-03-18 19:45:39,290] Trial 49 finished with value: -2.28688035495716 and parameters: {'n_layers_yyx': 1, 'hidden_size_yyx_l0': 6, 'context_size_yyx': 4, 'num_mix_components_yyx': 4, 'context_extractor_yyx': 'gru', 'activation_func_yyx': 'Tanh', 'L2_weight_yyx': 4.0197454660702147e-07, 'L_entropy_weight_yyx': 1.3685687714599906e-10, 'L_sep_weight_yyx': 0.0002922735770486155, 'L_scale_weight_yyx': 3.089491614858214e-09, 'learning_rate_yyx': 0.004672612617825825}. Best is trial 48 with value: -2.2897698503958845.

Source events: 20800
Target events: 20158
Full model ln_yyx : 1601.69712 nats/sec, 71.51143 nats/event
Full model Log loss : -2.21856
Full model ln_yyx : 1664.37657 nats/sec, 74.30990 nats/event
Full model Log loss : -2.27953
Full model ln_yyx : 1653.52197 nats/sec, 73.82527 nats/event
Full model Log loss : -2.27007
Full model ln_yyx : 1650.15051 nats/sec, 73.67474 nats/event
Full model Log loss : -2.27715
Full model ln_yyx : 1674.33985 nats/sec, 74.75473 nats/event
Full model Log loss : -2.28734
Full model ln_yyx : 1676.22286 nats/sec, 74.83880 nats/event
Full model Log loss : -2.27922
Full model ln_yyx : 1676.40772 nats/sec, 74.84706 nats/event
Full model Log loss : -2.28790
Full model ln_yyx : 1671.95164 nats/sec, 74.64810 nats/event
Full model Log loss : -2.27448
Full model ln_yyx : 1674.02282 nats/sec, 74.74058 nats/event
Full model Log loss : -2.28831
Full model ln_yyx : 1669.69572 nats/sec, 74.54738 nats/event
Full model Log loss : -2.28747
Full model ln_yyx : 1660.74553 nats/sec, 74.14778 nats/event
Full model Log loss : -2.27342
Full model ln_yyx : 1671.19751 nats/sec, 74.61443 nats/event
Full model Log loss : -2.28723
Full model ln_yyx : 1675.97686 nats/sec, 74.82782 nats/event
Full model Log loss : -2.28723
Full model ln_yyx : 1659.66226 nats/sec, 74.09942 nats/event
Full model Log loss : -2.28591
Full model ln_yyx : 1662.88591 nats/sec, 74.24334 nats/event
Full model Log loss : -2.27014
Full model ln_yyx : 1673.90801 nats/sec, 74.73545 nats/event
Full model Log loss : -2.28977
Full model ln_yyx : 1661.56765 nats/sec, 74.18449 nats/event
Full model Log loss : -2.28688
Optimization finished. Config saved to results/opt-full/opt_full_213_best_config.txt
[I 2026-03-18 19:45:47,007] Trial 47 pruned. 
[I 2026-03-18 19:46:02,302] Trial 48 pruned. 
[I 2026-03-18 19:46:43,615] Trial 48 finished with value: -2.275007051421947 and parameters: {'n_layers_yyx': 2, 'hidden_size_yyx_l0': 5, 'hidden_size_yyx_l1': 4, 'context_size_yyx': 4, 'num_mix_components_yyx': 5, 'context_extractor_yyx': 'lstm', 'activation_func_yyx': 'GELU', 'L2_weight_yyx': 4.986070358512673e-08, 'L_entropy_weight_yyx': 1.2139241534038644e-10, 'L_sep_weight_yyx': 1.4840702953595842e-05, 'L_scale_weight_yyx': 6.467656934232714e-08, 'learning_rate_yyx': 0.00987933149222575}. Best is trial 44 with value: -2.277691503355651.
[I 2026-03-18 19:47:22,279] Trial 49 pruned. 

Source events: 20800
Target events: 3618
Full model ln_yyx : 296.22380 nats/sec, 73.68751 nats/event
Full model Log loss : -2.25321
Full model ln_yyx : 300.67360 nats/sec, 74.79443 nats/event
Full model Log loss : -2.27222
Full model ln_yyx : 297.38950 nats/sec, 73.97749 nats/event
Full model Log loss : -2.26709
Full model ln_yyx : 295.89704 nats/sec, 73.60623 nats/event
Full model Log loss : -2.24823
Full model ln_yyx : 298.41086 nats/sec, 74.23156 nats/event
Full model Log loss : -2.26328
Full model ln_yyx : 297.50039 nats/sec, 74.00507 nats/event
Full model Log loss : -2.26918
Full model ln_yyx : 300.18537 nats/sec, 74.67298 nats/event
Full model Log loss : -2.27036
Full model ln_yyx : 298.35081 nats/sec, 74.21662 nats/event
Full model Log loss : -2.25746
Full model ln_yyx : 297.40724 nats/sec, 73.98190 nats/event
Full model Log loss : -2.25326
Full model ln_yyx : 300.40957 nats/sec, 74.72875 nats/event
Full model Log loss : -2.26217
Full model ln_yyx : 298.74899 nats/sec, 74.31567 nats/event
Full model Log loss : -2.27030
Full model ln_yyx : 301.58655 nats/sec, 75.02153 nats/event
Full model Log loss : -2.27731
Full model ln_yyx : 298.77844 nats/sec, 74.32299 nats/event
Full model Log loss : -2.26686
Full model ln_yyx : 299.19236 nats/sec, 74.42596 nats/event
Full model Log loss : -2.27196
Full model ln_yyx : 303.47592 nats/sec, 75.49152 nats/event
Full model Log loss : -2.26994
Full model ln_yyx : 297.79455 nats/sec, 74.07825 nats/event
Full model Log loss : -2.27569
Full model ln_yyx : 302.64710 nats/sec, 75.28535 nats/event
Full model Log loss : -2.27769
Full model ln_yyx : 301.82807 nats/sec, 75.08161 nats/event
Full model Log loss : -2.27597
Full model ln_yyx : 299.97380 nats/sec, 74.62035 nats/event
Full model Log loss : -2.27670
Full model ln_yyx : 298.74756 nats/sec, 74.31531 nats/event
Full model Log loss : -2.27501
Optimization finished. Config saved to results/opt-full/opt_full_215_best_config.txt
