[I 2026-03-18 17:45:50,833] Trial 25 finished with value: -2.9675326107899327 and parameters: {'n_layers_yyx': 2, 'hidden_size_yyx_l0': 5, 'hidden_size_yyx_l1': 5, 'context_size_yyx': 2, 'num_mix_components_yyx': 5, 'context_extractor_yyx': 'gru', 'activation_func_yyx': 'Tanh', 'L2_weight_yyx': 5.183826016758702e-07, 'L_entropy_weight_yyx': 9.389632162605448e-07, 'L_sep_weight_yyx': 1.4651904005723957e-06, 'L_scale_weight_yyx': 1.1035642731943036e-05, 'learning_rate_yyx': 0.004356249764945674}. Best is trial 5 with value: -2.9729516240610265.
[I 2026-03-18 17:45:52,010] Trial 31 finished with value: -2.9640582340026946 and parameters: {'n_layers_yyx': 1, 'hidden_size_yyx_l0': 5, 'context_size_yyx': 4, 'num_mix_components_yyx': 3, 'context_extractor_yyx': 'gru', 'activation_func_yyx': 'GELU', 'L2_weight_yyx': 2.814533905692679e-10, 'L_entropy_weight_yyx': 1.084791600447145e-09, 'L_sep_weight_yyx': 6.106400902244132e-08, 'L_scale_weight_yyx': 2.4295826592087743e-05, 'learning_rate_yyx': 0.008617021419283749}. Best is trial 24 with value: -2.9676210496741837.
[I 2026-03-18 17:45:55,465] Trial 42 pruned. 
[I 2026-03-18 17:45:58,752] Trial 26 pruned. 
[I 2026-03-18 17:46:09,090] Trial 25 finished with value: -2.9771827108507383 and parameters: {'n_layers_yyx': 1, 'hidden_size_yyx_l0': 6, 'context_size_yyx': 4, 'num_mix_components_yyx': 4, 'context_extractor_yyx': 'gru', 'activation_func_yyx': 'Tanh', 'L2_weight_yyx': 0.0001745253066087797, 'L_entropy_weight_yyx': 1.6117558351761173e-08, 'L_sep_weight_yyx': 5.971486086083696e-09, 'L_scale_weight_yyx': 7.376988981451069e-08, 'learning_rate_yyx': 0.007986212782212803}. Best is trial 25 with value: -2.9771827108507383.
[I 2026-03-18 17:46:15,589] Trial 27 pruned. 
[I 2026-03-18 17:46:17,378] Trial 26 pruned. 
[I 2026-03-18 17:46:19,880] Trial 33 finished with value: -2.949624131834952 and parameters: {'n_layers_yyx': 1, 'hidden_size_yyx_l0': 5, 'context_size_yyx': 4, 'num_mix_components_yyx': 5, 'context_extractor_yyx': 'lstm', 'activation_func_yyx': 'ReLU', 'L2_weight_yyx': 3.633831506440255e-08, 'L_entropy_weight_yyx': 8.045390380683626e-08, 'L_sep_weight_yyx': 1.049809923076832e-10, 'L_scale_weight_yyx': 4.0830061675445835e-06, 'learning_rate_yyx': 0.007366929376772736}. Best is trial 23 with value: -2.9542045708741957.
[I 2026-03-18 17:46:23,056] Trial 28 pruned. 
[I 2026-03-18 17:46:30,316] Trial 37 pruned. 
[I 2026-03-18 17:46:31,206] Trial 42 finished with value: -2.9643146863082293 and parameters: {'n_layers_yyx': 2, 'hidden_size_yyx_l0': 5, 'hidden_size_yyx_l1': 4, 'context_size_yyx': 4, 'num_mix_components_yyx': 2, 'context_extractor_yyx': 'lstm', 'activation_func_yyx': 'ReLU', 'L2_weight_yyx': 0.0004603161946593785, 'L_entropy_weight_yyx': 1.013044134723353e-08, 'L_sep_weight_yyx': 4.474040347129102e-10, 'L_scale_weight_yyx': 1.3545323830910281e-08, 'learning_rate_yyx': 0.0049123830877877955}. Best is trial 38 with value: -2.9771706662392052.
[I 2026-03-18 17:46:33,602] Trial 47 pruned. 
[I 2026-03-18 17:46:38,591] Trial 29 pruned. 
[I 2026-03-18 17:46:41,440] Trial 48 pruned. 
[I 2026-03-18 17:46:49,417] Trial 49 pruned. 

Source events: 20315
Target events: 27060
Full model ln_yyx : 2199.99893 nats/sec, 73.17070 nats/event
Full model Log loss : -2.36053
Full model ln_yyx : 2209.68742 nats/sec, 73.49293 nats/event
Full model Log loss : -2.36386
Full model ln_yyx : 2561.91650 nats/sec, 85.20787 nats/event
Full model Log loss : -2.91201
Full model ln_yyx : 2237.84856 nats/sec, 74.42955 nats/event
Full model Log loss : -2.39263
Full model ln_yyx : 2572.14060 nats/sec, 85.54791 nats/event
Full model Log loss : -2.92045
Full model ln_yyx : 2622.25210 nats/sec, 87.21459 nats/event
Full model Log loss : -2.95955
Full model ln_yyx : 2578.11830 nats/sec, 85.74673 nats/event
Full model Log loss : -2.94368
Full model ln_yyx : 2582.71238 nats/sec, 85.89952 nats/event
Full model Log loss : -2.95384
Full model ln_yyx : 2553.87740 nats/sec, 84.94049 nats/event
Full model Log loss : -2.90371
Full model ln_yyx : 2616.62863 nats/sec, 87.02756 nats/event
Full model Log loss : -2.94938
Full model ln_yyx : 2610.92933 nats/sec, 86.83800 nats/event
Full model Log loss : -2.94903
Full model ln_yyx : 2608.15404 nats/sec, 86.74570 nats/event
Full model Log loss : -2.94925
Full model ln_yyx : 2566.72430 nats/sec, 85.36777 nats/event
Full model Log loss : -2.91107
Full model ln_yyx : 2613.88880 nats/sec, 86.93643 nats/event
Full model Log loss : -2.95966
Full model ln_yyx : 2577.87044 nats/sec, 85.73848 nats/event
Full model Log loss : -2.95634
Optimization finished. Config saved to results/opt-full/opt_full_41_best_config.txt
[I 2026-03-18 17:46:50,316] Trial 45 finished with value: -2.9488026151979323 and parameters: {'n_layers_yyx': 2, 'hidden_size_yyx_l0': 2, 'hidden_size_yyx_l1': 4, 'context_size_yyx': 3, 'num_mix_components_yyx': 5, 'context_extractor_yyx': 'gru', 'activation_func_yyx': 'Tanh', 'L2_weight_yyx': 1.5598557589605507e-09, 'L_entropy_weight_yyx': 6.454812181897706e-06, 'L_sep_weight_yyx': 6.192117901646751e-06, 'L_scale_weight_yyx': 3.161444269281853e-08, 'learning_rate_yyx': 0.007228451072020193}. Best is trial 34 with value: -2.96234983443252.
[I 2026-03-18 17:46:54,839] Trial 30 pruned. 
[I 2026-03-18 17:46:57,632] Trial 46 pruned. 
[I 2026-03-18 17:46:59,012] Trial 23 finished with value: -2.964466089199603 and parameters: {'n_layers_yyx': 1, 'hidden_size_yyx_l0': 5, 'context_size_yyx': 3, 'num_mix_components_yyx': 3, 'context_extractor_yyx': 'lstm', 'activation_func_yyx': 'GELU', 'L2_weight_yyx': 1.5730487528094922e-10, 'L_entropy_weight_yyx': 0.00020570272352309285, 'L_sep_weight_yyx': 1.4189171248005813e-05, 'L_scale_weight_yyx': 6.841753984136931e-10, 'learning_rate_yyx': 0.009602086471289285}. Best is trial 22 with value: -2.970223923614394.
[I 2026-03-18 17:47:00,397] Trial 27 pruned. 
[I 2026-03-18 17:47:05,028] Trial 35 finished with value: -2.965906964258514 and parameters: {'n_layers_yyx': 2, 'hidden_size_yyx_l0': 4, 'hidden_size_yyx_l1': 3, 'context_size_yyx': 3, 'num_mix_components_yyx': 5, 'context_extractor_yyx': 'gru', 'activation_func_yyx': 'Tanh', 'L2_weight_yyx': 2.3158410401059324e-08, 'L_entropy_weight_yyx': 2.6103526343109627e-06, 'L_sep_weight_yyx': 4.2386848811694186e-07, 'L_scale_weight_yyx': 4.5030437881819966e-08, 'learning_rate_yyx': 0.008254118755271612}. Best is trial 0 with value: -2.973312761552399.
[I 2026-03-18 17:47:13,096] Trial 40 finished with value: -2.958608160822066 and parameters: {'n_layers_yyx': 2, 'hidden_size_yyx_l0': 5, 'hidden_size_yyx_l1': 6, 'context_size_yyx': 2, 'num_mix_components_yyx': 5, 'context_extractor_yyx': 'gru', 'activation_func_yyx': 'Tanh', 'L2_weight_yyx': 3.261101295455336e-07, 'L_entropy_weight_yyx': 7.669586358310336e-08, 'L_sep_weight_yyx': 1.9611784204105698e-05, 'L_scale_weight_yyx': 3.4688069332175816e-10, 'learning_rate_yyx': 0.0055251329569765625}. Best is trial 0 with value: -2.9702180140077377.
[I 2026-03-18 17:47:13,343] Trial 47 pruned. 
[I 2026-03-18 17:47:15,539] Trial 24 pruned. 
[I 2026-03-18 17:47:15,569] Trial 43 pruned. 
[I 2026-03-18 17:47:20,493] Trial 36 pruned. 
[I 2026-03-18 17:47:23,409] Trial 44 pruned. 
[I 2026-03-18 17:47:24,768] Trial 44 pruned. 
[I 2026-03-18 17:47:33,423] Trial 33 finished with value: -2.941857842442007 and parameters: {'n_layers_yyx': 1, 'hidden_size_yyx_l0': 5, 'context_size_yyx': 3, 'num_mix_components_yyx': 2, 'context_extractor_yyx': 'gru', 'activation_func_yyx': 'Tanh', 'L2_weight_yyx': 1.42849650275454e-07, 'L_entropy_weight_yyx': 3.2273647268745147e-09, 'L_sep_weight_yyx': 1.468260157143065e-05, 'L_scale_weight_yyx': 4.687884330048533e-09, 'learning_rate_yyx': 0.008186515408865886}. Best is trial 22 with value: -2.9660620215680944.
[I 2026-03-18 17:47:38,724] Trial 40 finished with value: -2.961788606475353 and parameters: {'n_layers_yyx': 1, 'hidden_size_yyx_l0': 3, 'context_size_yyx': 3, 'num_mix_components_yyx': 4, 'context_extractor_yyx': 'lstm', 'activation_func_yyx': 'Tanh', 'L2_weight_yyx': 0.0001366501624320057, 'L_entropy_weight_yyx': 1.0291675530237928e-09, 'L_sep_weight_yyx': 9.807902663673381e-05, 'L_scale_weight_yyx': 1.594010169769116e-09, 'learning_rate_yyx': 0.009808539626144247}. Best is trial 37 with value: -2.980594852387875.
[I 2026-03-18 17:47:40,147] Trial 45 pruned. 
[I 2026-03-18 17:47:40,602] Trial 45 pruned. 
[I 2026-03-18 17:47:40,833] Trial 34 pruned. 
[I 2026-03-18 17:47:41,519] Trial 21 pruned. 
[I 2026-03-18 17:47:49,713] Trial 47 pruned. 
[I 2026-03-18 17:47:55,415] Trial 32 pruned. 
[I 2026-03-18 17:47:55,551] Trial 43 finished with value: -2.9545683509755247 and parameters: {'n_layers_yyx': 2, 'hidden_size_yyx_l0': 3, 'hidden_size_yyx_l1': 6, 'context_size_yyx': 4, 'num_mix_components_yyx': 4, 'context_extractor_yyx': 'gru', 'activation_func_yyx': 'GELU', 'L2_weight_yyx': 0.00011397652264855926, 'L_entropy_weight_yyx': 7.5697325822345e-07, 'L_sep_weight_yyx': 5.31213993586228e-06, 'L_scale_weight_yyx': 9.545545626898305e-10, 'learning_rate_yyx': 0.009129147275456708}. Best is trial 8 with value: -2.955956673037092.
[I 2026-03-18 17:47:56,613] Trial 25 pruned. 
[I 2026-03-18 17:47:57,919] Trial 22 pruned. 
[I 2026-03-18 17:48:02,019] Trial 37 pruned. 
[I 2026-03-18 17:48:03,006] Trial 44 pruned. 
[I 2026-03-18 17:48:03,084] Trial 33 pruned. 
[I 2026-03-18 17:48:05,694] Trial 23 pruned. 
[I 2026-03-18 17:48:06,259] Trial 48 pruned. 
[I 2026-03-18 17:48:10,502] Trial 34 pruned. 
[I 2026-03-18 17:48:13,620] Trial 24 pruned. 
[I 2026-03-18 17:48:17,984] Trial 35 pruned. 
[I 2026-03-18 17:48:20,327] Trial 41 pruned. 
[I 2026-03-18 17:48:21,039] Trial 25 pruned. 
[I 2026-03-18 17:48:22,903] Trial 49 pruned. 

Source events: 20315
Target events: 18269
Full model ln_yyx : 1722.76496 nats/sec, 84.86991 nats/event
Full model Log loss : -2.90857
Full model ln_yyx : 1686.00484 nats/sec, 83.05897 nats/event
Full model Log loss : -2.81870
Full model ln_yyx : 1529.01847 nats/sec, 75.32523 nats/event
Full model Log loss : -2.39860
Full model ln_yyx : 1757.22728 nats/sec, 86.56766 nats/event
Full model Log loss : -2.96605
Full model ln_yyx : 1738.10194 nats/sec, 85.62547 nats/event
Full model Log loss : -2.90918
Full model ln_yyx : 1713.88429 nats/sec, 84.43242 nats/event
Full model Log loss : -2.90231
Full model ln_yyx : 1725.29205 nats/sec, 84.99441 nats/event
Full model Log loss : -2.90625
Full model ln_yyx : 1748.48758 nats/sec, 86.13711 nats/event
Full model Log loss : -2.95281
Full model ln_yyx : 1759.79150 nats/sec, 86.69398 nats/event
Full model Log loss : -2.95664
Full model ln_yyx : 1758.68527 nats/sec, 86.63948 nats/event
Full model Log loss : -2.95110
Full model ln_yyx : 1745.80767 nats/sec, 86.00509 nats/event
Full model Log loss : -2.94783
Optimization finished. Config saved to results/opt-full/opt_full_43_best_config.txt
[I 2026-03-18 17:48:24,368] Trial 35 pruned. 
[I 2026-03-18 17:48:31,861] Trial 36 pruned. 
[I 2026-03-18 17:48:38,832] Trial 37 pruned. 
[I 2026-03-18 17:48:39,027] Trial 26 pruned. 
[I 2026-03-18 17:48:43,208] Trial 38 pruned. 
[I 2026-03-18 17:48:45,866] Trial 38 pruned. 
[I 2026-03-18 17:48:45,931] Trial 27 pruned. 
[I 2026-03-18 17:48:50,300] Trial 39 pruned. 
[I 2026-03-18 17:48:51,304] Trial 31 pruned. 
[I 2026-03-18 17:48:53,413] Trial 28 pruned. 
[I 2026-03-18 17:48:53,639] Trial 34 finished with value: -2.960161195633751 and parameters: {'n_layers_yyx': 1, 'hidden_size_yyx_l0': 5, 'context_size_yyx': 4, 'num_mix_components_yyx': 5, 'context_extractor_yyx': 'lstm', 'activation_func_yyx': 'ReLU', 'L2_weight_yyx': 6.670095706753683e-08, 'L_entropy_weight_yyx': 1.2639665239317475e-07, 'L_sep_weight_yyx': 1.2487591574441728e-10, 'L_scale_weight_yyx': 3.675781625087185e-05, 'learning_rate_yyx': 0.007872171767968152}. Best is trial 34 with value: -2.960161195633751.
[I 2026-03-18 17:48:54,403] Trial 38 finished with value: -2.952789999172655 and parameters: {'n_layers_yyx': 1, 'hidden_size_yyx_l0': 6, 'context_size_yyx': 3, 'num_mix_components_yyx': 5, 'context_extractor_yyx': 'gru', 'activation_func_yyx': 'Tanh', 'L2_weight_yyx': 0.00017225918225784523, 'L_entropy_weight_yyx': 0.000915863717752844, 'L_sep_weight_yyx': 1.1750244739941305e-09, 'L_scale_weight_yyx': 1.8517530969349242e-06, 'learning_rate_yyx': 0.00661036528656217}. Best is trial 36 with value: -2.9570429460965078.
[I 2026-03-18 17:48:59,425] Trial 36 pruned. 
[I 2026-03-18 17:49:00,364] Trial 42 pruned. 
[I 2026-03-18 17:49:01,438] Trial 39 pruned. 
[I 2026-03-18 17:49:01,734] Trial 39 pruned. 
[I 2026-03-18 17:49:05,197] Trial 40 pruned. 
[I 2026-03-18 17:49:08,714] Trial 29 pruned. 
[I 2026-03-18 17:49:12,514] Trial 48 pruned. 
[I 2026-03-18 17:49:12,516] Trial 41 pruned. 
[I 2026-03-18 17:49:16,141] Trial 30 pruned. 
[I 2026-03-18 17:49:16,598] Trial 40 pruned. 
[I 2026-03-18 17:49:17,304] Trial 40 pruned. 
[I 2026-03-18 17:49:20,587] Trial 41 pruned. 
[I 2026-03-18 17:49:27,834] Trial 42 pruned. 
[I 2026-03-18 17:49:28,063] Trial 46 finished with value: -2.8872975220772132 and parameters: {'n_layers_yyx': 2, 'hidden_size_yyx_l0': 2, 'hidden_size_yyx_l1': 5, 'context_size_yyx': 3, 'num_mix_components_yyx': 5, 'context_extractor_yyx': 'lstm', 'activation_func_yyx': 'GELU', 'L2_weight_yyx': 1.3169259294024245e-07, 'L_entropy_weight_yyx': 7.158623800386849e-05, 'L_sep_weight_yyx': 0.0006201461481964238, 'L_scale_weight_yyx': 3.540174561350593e-07, 'learning_rate_yyx': 0.008673562861918758}. Best is trial 42 with value: -2.930198489726228.
[I 2026-03-18 17:49:31,349] Trial 31 pruned. 
[I 2026-03-18 17:49:33,603] Trial 41 pruned. 
[I 2026-03-18 17:49:35,253] Trial 47 pruned. 
[I 2026-03-18 17:49:39,446] Trial 26 finished with value: -2.9042486747707073 and parameters: {'n_layers_yyx': 2, 'hidden_size_yyx_l0': 3, 'hidden_size_yyx_l1': 6, 'context_size_yyx': 3, 'num_mix_components_yyx': 5, 'context_extractor_yyx': 'lstm', 'activation_func_yyx': 'Tanh', 'L2_weight_yyx': 2.400459776140056e-09, 'L_entropy_weight_yyx': 0.00011736513140468306, 'L_sep_weight_yyx': 8.768223189644053e-07, 'L_scale_weight_yyx': 1.6586267384938097e-06, 'learning_rate_yyx': 0.0045009225024869376}. Best is trial 16 with value: -2.9637252953818396.
[I 2026-03-18 17:49:42,553] Trial 46 finished with value: -2.9695731589605394 and parameters: {'n_layers_yyx': 2, 'hidden_size_yyx_l0': 4, 'hidden_size_yyx_l1': 4, 'context_size_yyx': 4, 'num_mix_components_yyx': 3, 'context_extractor_yyx': 'lstm', 'activation_func_yyx': 'ReLU', 'L2_weight_yyx': 8.827067102061977e-05, 'L_entropy_weight_yyx': 0.00024641295892978383, 'L_sep_weight_yyx': 2.2499605247818383e-10, 'L_scale_weight_yyx': 2.0988306951683523e-10, 'learning_rate_yyx': 0.009968452785488005}. Best is trial 38 with value: -2.9771706662392052.
[I 2026-03-18 17:49:43,356] Trial 43 pruned. 
[I 2026-03-18 17:49:46,285] Trial 32 pruned. 
[I 2026-03-18 17:49:46,285] Trial 27 pruned. 
[I 2026-03-18 17:49:50,041] Trial 42 pruned. 
[I 2026-03-18 17:49:53,817] Trial 28 pruned. 
[I 2026-03-18 17:50:24,637] Trial 44 pruned. 
[I 2026-03-18 17:50:25,399] Trial 28 finished with value: -2.976413902040084 and parameters: {'n_layers_yyx': 1, 'hidden_size_yyx_l0': 5, 'context_size_yyx': 4, 'num_mix_components_yyx': 4, 'context_extractor_yyx': 'lstm', 'activation_func_yyx': 'Tanh', 'L2_weight_yyx': 5.118724099313379e-06, 'L_entropy_weight_yyx': 1.0863205468418324e-07, 'L_sep_weight_yyx': 7.92966626653354e-10, 'L_scale_weight_yyx': 1.471030483838434e-09, 'learning_rate_yyx': 0.0025863205577348358}. Best is trial 25 with value: -2.9771827108507383.
[I 2026-03-18 17:50:39,681] Trial 45 pruned. 
[I 2026-03-18 17:50:40,956] Trial 45 finished with value: -2.9791716178278365 and parameters: {'n_layers_yyx': 2, 'hidden_size_yyx_l0': 2, 'hidden_size_yyx_l1': 6, 'context_size_yyx': 4, 'num_mix_components_yyx': 5, 'context_extractor_yyx': 'gru', 'activation_func_yyx': 'Tanh', 'L2_weight_yyx': 1.5683471977444746e-05, 'L_entropy_weight_yyx': 7.207425031759232e-09, 'L_sep_weight_yyx': 6.116145940917824e-06, 'L_scale_weight_yyx': 5.300231249377561e-09, 'learning_rate_yyx': 0.005783478602627515}. Best is trial 45 with value: -2.9791716178278365.
[I 2026-03-18 17:50:45,731] Trial 35 finished with value: -2.9708089664894204 and parameters: {'n_layers_yyx': 1, 'hidden_size_yyx_l0': 6, 'context_size_yyx': 4, 'num_mix_components_yyx': 5, 'context_extractor_yyx': 'lstm', 'activation_func_yyx': 'ReLU', 'L2_weight_yyx': 1.0689818616078055e-07, 'L_entropy_weight_yyx': 1.2631438141936742e-07, 'L_sep_weight_yyx': 1.2183328958284453e-10, 'L_scale_weight_yyx': 4.0177746513996e-05, 'learning_rate_yyx': 0.007803310262731747}. Best is trial 35 with value: -2.9708089664894204.
[I 2026-03-18 17:50:46,686] Trial 46 pruned. 
[I 2026-03-18 17:50:47,384] Trial 42 finished with value: -2.9393403500063036 and parameters: {'n_layers_yyx': 2, 'hidden_size_yyx_l0': 6, 'hidden_size_yyx_l1': 6, 'context_size_yyx': 2, 'num_mix_components_yyx': 5, 'context_extractor_yyx': 'gru', 'activation_func_yyx': 'Tanh', 'L2_weight_yyx': 2.6195157732096163e-07, 'L_entropy_weight_yyx': 1.4298647664636632e-08, 'L_sep_weight_yyx': 0.00041283367339537243, 'L_scale_weight_yyx': 1.1879254379830735e-09, 'learning_rate_yyx': 0.007746769476505428}. Best is trial 0 with value: -2.9702180140077377.
[I 2026-03-18 17:50:56,892] Trial 46 pruned. 
[I 2026-03-18 17:51:02,913] Trial 43 pruned. 
[I 2026-03-18 17:51:04,256] Trial 29 pruned. 
[I 2026-03-18 17:51:10,985] Trial 30 pruned. 
[I 2026-03-18 17:51:13,084] Trial 41 pruned. 
[I 2026-03-18 17:51:26,445] Trial 47 pruned. 
[I 2026-03-18 17:51:34,430] Trial 47 finished with value: -2.9620703900635874 and parameters: {'n_layers_yyx': 2, 'hidden_size_yyx_l0': 5, 'hidden_size_yyx_l1': 4, 'context_size_yyx': 4, 'num_mix_components_yyx': 2, 'context_extractor_yyx': 'lstm', 'activation_func_yyx': 'ReLU', 'L2_weight_yyx': 7.958531612439144e-05, 'L_entropy_weight_yyx': 0.00026306294776998743, 'L_sep_weight_yyx': 2.5041669524540894e-10, 'L_scale_weight_yyx': 1.8256221878341582e-10, 'learning_rate_yyx': 0.009768216309884888}. Best is trial 38 with value: -2.9771706662392052.
[I 2026-03-18 17:51:43,629] Trial 43 pruned. 
[I 2026-03-18 17:51:43,956] Trial 32 finished with value: -2.9610051318695434 and parameters: {'n_layers_yyx': 2, 'hidden_size_yyx_l0': 5, 'hidden_size_yyx_l1': 5, 'context_size_yyx': 2, 'num_mix_components_yyx': 5, 'context_extractor_yyx': 'gru', 'activation_func_yyx': 'Tanh', 'L2_weight_yyx': 7.912655542075193e-09, 'L_entropy_weight_yyx': 0.00012871619160656093, 'L_sep_weight_yyx': 1.2564478508788843e-07, 'L_scale_weight_yyx': 1.3744816390197676e-07, 'learning_rate_yyx': 0.006073768785697558}. Best is trial 5 with value: -2.9729516240610265.
[I 2026-03-18 17:51:50,470] Trial 44 pruned. 
[I 2026-03-18 17:51:51,547] Trial 37 finished with value: -2.9487951358520075 and parameters: {'n_layers_yyx': 2, 'hidden_size_yyx_l0': 6, 'hidden_size_yyx_l1': 6, 'context_size_yyx': 3, 'num_mix_components_yyx': 5, 'context_extractor_yyx': 'gru', 'activation_func_yyx': 'GELU', 'L2_weight_yyx': 1.0956364050997158e-10, 'L_entropy_weight_yyx': 1.0334698296545425e-08, 'L_sep_weight_yyx': 4.875015566414746e-06, 'L_scale_weight_yyx': 0.00016766419679586746, 'learning_rate_yyx': 0.006278668526075232}. Best is trial 24 with value: -2.9676210496741837.
[I 2026-03-18 17:52:13,323] Trial 48 finished with value: -2.9497564507756038 and parameters: {'n_layers_yyx': 2, 'hidden_size_yyx_l0': 3, 'hidden_size_yyx_l1': 5, 'context_size_yyx': 4, 'num_mix_components_yyx': 5, 'context_extractor_yyx': 'lstm', 'activation_func_yyx': 'GELU', 'L2_weight_yyx': 2.035348588137125e-09, 'L_entropy_weight_yyx': 0.00033366947084239587, 'L_sep_weight_yyx': 0.0003579030859731552, 'L_scale_weight_yyx': 3.220899983242566e-07, 'learning_rate_yyx': 0.008156217444743943}. Best is trial 48 with value: -2.9497564507756038.
[I 2026-03-18 17:52:15,007] Trial 43 finished with value: -2.9834979774371218 and parameters: {'n_layers_yyx': 1, 'hidden_size_yyx_l0': 3, 'context_size_yyx': 3, 'num_mix_components_yyx': 5, 'context_extractor_yyx': 'lstm', 'activation_func_yyx': 'Tanh', 'L2_weight_yyx': 6.333265207606985e-05, 'L_entropy_weight_yyx': 7.077138163122768e-10, 'L_sep_weight_yyx': 5.0998065776967174e-05, 'L_scale_weight_yyx': 1.2288330044323951e-09, 'learning_rate_yyx': 0.009820777132151966}. Best is trial 43 with value: -2.9834979774371218.
[I 2026-03-18 17:52:19,662] Trial 49 pruned. 

Source events: 20315
Target events: 1872
Full model ln_yyx : 171.26920 nats/sec, 82.34096 nats/event
Full model Log loss : -2.78368
Full model ln_yyx : 175.16022 nats/sec, 84.21164 nats/event
Full model Log loss : -2.87578
Full model ln_yyx : 153.89153 nats/sec, 73.98631 nats/event
Full model Log loss : -2.39070
Full model ln_yyx : 173.00478 nats/sec, 83.17537 nats/event
Full model Log loss : -2.81073
Full model ln_yyx : 172.44967 nats/sec, 82.90850 nats/event
Full model Log loss : -2.80814
Full model ln_yyx : 172.26977 nats/sec, 82.82201 nats/event
Full model Log loss : -2.80500
Full model ln_yyx : 175.92515 nats/sec, 84.57940 nats/event
Full model Log loss : -2.88619
Full model ln_yyx : 175.07129 nats/sec, 84.16889 nats/event
Full model Log loss : -2.88832
Full model ln_yyx : 175.71136 nats/sec, 84.47661 nats/event
Full model Log loss : -2.89239
Full model ln_yyx : 175.27611 nats/sec, 84.26736 nats/event
Full model Log loss : -2.87538
Full model ln_yyx : 178.34975 nats/sec, 85.74507 nats/event
Full model Log loss : -2.93020
Full model ln_yyx : 176.29561 nats/sec, 84.75751 nats/event
Full model Log loss : -2.89320
Full model ln_yyx : 175.91376 nats/sec, 84.57392 nats/event
Full model Log loss : -2.88730
Full model ln_yyx : 178.72019 nats/sec, 85.92317 nats/event
Full model Log loss : -2.94976
Optimization finished. Config saved to results/opt-full/opt_full_45_best_config.txt
