[I 2026-03-18 19:59:12,749] Trial 36 finished with value: -1.6079302670366475 and parameters: {'n_layers_yyx': 2, 'hidden_size_yyx_l0': 3, 'hidden_size_yyx_l1': 5, 'context_size_yyx': 4, 'num_mix_components_yyx': 1, 'context_extractor_yyx': 'gru', 'activation_func_yyx': 'GELU', 'L2_weight_yyx': 1.3733741142049807e-08, 'L_entropy_weight_yyx': 4.2972670644798745e-07, 'L_sep_weight_yyx': 2.7617445415119414e-07, 'L_scale_weight_yyx': 3.3475502893055145e-06, 'learning_rate_yyx': 0.00827908213352545}. Best is trial 21 with value: -1.6119054721666712.
[I 2026-03-18 19:59:14,187] Trial 32 pruned. 
[I 2026-03-18 19:59:14,194] Trial 25 pruned. 
[I 2026-03-18 19:59:15,692] Trial 34 pruned. 
[I 2026-03-18 19:59:16,376] Trial 32 pruned. 
[I 2026-03-18 19:59:16,729] Trial 31 pruned. 
[I 2026-03-18 19:59:19,125] Trial 20 pruned. 
[I 2026-03-18 19:59:21,169] Trial 26 pruned. 
[I 2026-03-18 19:59:22,254] Trial 35 pruned. 
[I 2026-03-18 19:59:22,347] Trial 23 pruned. 
[I 2026-03-18 19:59:23,600] Trial 33 pruned. 
[I 2026-03-18 19:59:24,768] Trial 32 pruned. 
[I 2026-03-18 19:59:26,060] Trial 21 pruned. 
[I 2026-03-18 19:59:27,150] Trial 27 pruned. 
[I 2026-03-18 19:59:27,774] Trial 20 finished with value: -1.6070137395596906 and parameters: {'n_layers_yyx': 1, 'hidden_size_yyx_l0': 5, 'context_size_yyx': 3, 'num_mix_components_yyx': 2, 'context_extractor_yyx': 'gru', 'activation_func_yyx': 'GELU', 'L2_weight_yyx': 1.1767555932673102e-05, 'L_entropy_weight_yyx': 3.6827531155728166e-06, 'L_sep_weight_yyx': 3.283025619627302e-06, 'L_scale_weight_yyx': 6.860191080057238e-10, 'learning_rate_yyx': 0.0007986679337290062}. Best is trial 9 with value: -1.613731891101604.
[I 2026-03-18 19:59:27,961] Trial 18 pruned. 
[I 2026-03-18 19:59:30,137] Trial 30 pruned. 
[I 2026-03-18 19:59:30,902] Trial 34 pruned. 
[I 2026-03-18 19:59:31,768] Trial 42 finished with value: -1.6124192703287616 and parameters: {'n_layers_yyx': 1, 'hidden_size_yyx_l0': 6, 'context_size_yyx': 4, 'num_mix_components_yyx': 5, 'context_extractor_yyx': 'lstm', 'activation_func_yyx': 'GELU', 'L2_weight_yyx': 2.9442547297963596e-07, 'L_entropy_weight_yyx': 4.271611453237779e-10, 'L_sep_weight_yyx': 2.805727431566623e-09, 'L_scale_weight_yyx': 0.00011875634465493517, 'learning_rate_yyx': 0.009704762375364218}. Best is trial 26 with value: -1.6132763574564741.
[I 2026-03-18 19:59:33,330] Trial 28 pruned. 
[I 2026-03-18 19:59:33,426] Trial 35 finished with value: -2.0527333312761384 and parameters: {'n_layers_yyx': 2, 'hidden_size_yyx_l0': 2, 'hidden_size_yyx_l1': 6, 'context_size_yyx': 3, 'num_mix_components_yyx': 2, 'context_extractor_yyx': 'gru', 'activation_func_yyx': 'GELU', 'L2_weight_yyx': 1.00833511339324e-09, 'L_entropy_weight_yyx': 4.77754874606237e-09, 'L_sep_weight_yyx': 8.316823263337139e-06, 'L_scale_weight_yyx': 0.0009102818455068836, 'learning_rate_yyx': 0.008985222625834972}. Best is trial 2 with value: -2.059868681386501.
[I 2026-03-18 19:59:35,094] Trial 19 pruned. 
[I 2026-03-18 19:59:35,334] Trial 36 pruned. 
[I 2026-03-18 19:59:39,779] Trial 33 pruned. 
[I 2026-03-18 19:59:40,481] Trial 21 pruned. 
[I 2026-03-18 19:59:41,403] Trial 37 pruned. 
[I 2026-03-18 19:59:44,853] Trial 43 finished with value: -1.6337547198303388 and parameters: {'n_layers_yyx': 2, 'hidden_size_yyx_l0': 3, 'hidden_size_yyx_l1': 6, 'context_size_yyx': 4, 'num_mix_components_yyx': 4, 'context_extractor_yyx': 'gru', 'activation_func_yyx': 'Tanh', 'L2_weight_yyx': 3.4576832220643206e-10, 'L_entropy_weight_yyx': 4.2249837972572817e-10, 'L_sep_weight_yyx': 7.946200329668362e-06, 'L_scale_weight_yyx': 4.517338864691295e-06, 'learning_rate_yyx': 0.005684895701222939}. Best is trial 13 with value: -1.640321681328409.
[I 2026-03-18 19:59:46,683] Trial 31 pruned. 
[I 2026-03-18 19:59:46,748] Trial 29 pruned. 
[I 2026-03-18 19:59:46,818] Trial 18 finished with value: -2.0781788426873966 and parameters: {'n_layers_yyx': 2, 'hidden_size_yyx_l0': 6, 'hidden_size_yyx_l1': 4, 'context_size_yyx': 1, 'num_mix_components_yyx': 3, 'context_extractor_yyx': 'gru', 'activation_func_yyx': 'Tanh', 'L2_weight_yyx': 7.409951951520608e-08, 'L_entropy_weight_yyx': 2.296669484675742e-06, 'L_sep_weight_yyx': 2.2138052655052966e-07, 'L_scale_weight_yyx': 9.06206899252411e-07, 'learning_rate_yyx': 0.0034821673493441664}. Best is trial 11 with value: -2.095012278283745.
[I 2026-03-18 19:59:48,555] Trial 34 finished with value: -1.6090419933816071 and parameters: {'n_layers_yyx': 2, 'hidden_size_yyx_l0': 6, 'hidden_size_yyx_l1': 4, 'context_size_yyx': 4, 'num_mix_components_yyx': 5, 'context_extractor_yyx': 'lstm', 'activation_func_yyx': 'ReLU', 'L2_weight_yyx': 2.2791735780106093e-06, 'L_entropy_weight_yyx': 1.6787132230941544e-09, 'L_sep_weight_yyx': 0.00030717989153733894, 'L_scale_weight_yyx': 1.0083484923305448e-07, 'learning_rate_yyx': 0.004870651001416356}. Best is trial 1 with value: -1.6113757535901372.
[I 2026-03-18 19:59:50,178] Trial 33 pruned. 
[I 2026-03-18 19:59:53,289] Trial 30 pruned. 
[I 2026-03-18 19:59:53,344] Trial 19 pruned. 
[I 2026-03-18 19:59:53,558] Trial 32 pruned. 
[I 2026-03-18 19:59:53,776] Trial 22 pruned. 
[I 2026-03-18 19:59:53,838] Trial 38 pruned. 
[I 2026-03-18 19:59:54,456] Trial 35 pruned. 
[I 2026-03-18 19:59:55,275] Trial 27 pruned. 
[I 2026-03-18 19:59:56,280] Trial 34 pruned. 
[I 2026-03-18 19:59:58,928] Trial 43 pruned. 
[I 2026-03-18 19:59:59,773] Trial 31 pruned. 
[I 2026-03-18 20:00:00,136] Trial 20 pruned. 
[I 2026-03-18 20:00:00,459] Trial 23 pruned. 
[I 2026-03-18 20:00:01,943] Trial 16 finished with value: -2.0883428670836364 and parameters: {'n_layers_yyx': 1, 'hidden_size_yyx_l0': 6, 'context_size_yyx': 3, 'num_mix_components_yyx': 5, 'context_extractor_yyx': 'lstm', 'activation_func_yyx': 'ReLU', 'L2_weight_yyx': 9.914159395769689e-06, 'L_entropy_weight_yyx': 8.055605537306128e-06, 'L_sep_weight_yyx': 2.9605695408852117e-07, 'L_scale_weight_yyx': 1.2142078838313988e-05, 'learning_rate_yyx': 0.006189822826392906}. Best is trial 16 with value: -2.0883428670836364.
[I 2026-03-18 20:00:02,802] Trial 35 pruned. 
[I 2026-03-18 20:00:04,386] Trial 44 pruned. 
[I 2026-03-18 20:00:04,726] Trial 35 finished with value: -2.0960752832987453 and parameters: {'n_layers_yyx': 1, 'hidden_size_yyx_l0': 5, 'context_size_yyx': 4, 'num_mix_components_yyx': 5, 'context_extractor_yyx': 'lstm', 'activation_func_yyx': 'Tanh', 'L2_weight_yyx': 1.909098473170292e-07, 'L_entropy_weight_yyx': 1.7761849118530448e-08, 'L_sep_weight_yyx': 1.0424214905649129e-09, 'L_scale_weight_yyx': 4.109983004564517e-09, 'learning_rate_yyx': 0.008798519818899241}. Best is trial 21 with value: -2.0975034066716556.
[I 2026-03-18 20:00:05,956] Trial 39 pruned. 
[I 2026-03-18 20:00:06,802] Trial 32 pruned. 
[I 2026-03-18 20:00:07,938] Trial 36 pruned. 
[I 2026-03-18 20:00:09,482] Trial 33 pruned. 
[I 2026-03-18 20:00:15,355] Trial 20 pruned. 
[I 2026-03-18 20:00:15,954] Trial 36 pruned. 
[I 2026-03-18 20:00:16,200] Trial 34 pruned. 
[I 2026-03-18 20:00:18,483] Trial 40 pruned. 
[I 2026-03-18 20:00:19,769] Trial 36 pruned. 
[I 2026-03-18 20:00:20,773] Trial 33 pruned. 
[I 2026-03-18 20:00:21,365] Trial 44 pruned. 
[I 2026-03-18 20:00:25,223] Trial 41 pruned. 
[I 2026-03-18 20:00:27,960] Trial 34 pruned. 
[I 2026-03-18 20:00:30,625] Trial 37 pruned. 
[I 2026-03-18 20:00:32,721] Trial 43 finished with value: -1.612546246700101 and parameters: {'n_layers_yyx': 1, 'hidden_size_yyx_l0': 6, 'context_size_yyx': 4, 'num_mix_components_yyx': 5, 'context_extractor_yyx': 'lstm', 'activation_func_yyx': 'GELU', 'L2_weight_yyx': 2.1461790932509917e-07, 'L_entropy_weight_yyx': 3.3341303441830226e-10, 'L_sep_weight_yyx': 3.3354815373486243e-09, 'L_scale_weight_yyx': 9.993132775416046e-05, 'learning_rate_yyx': 0.009933438939072248}. Best is trial 26 with value: -1.6132763574564741.
[I 2026-03-18 20:00:34,805] Trial 37 pruned. 
[I 2026-03-18 20:00:36,234] Trial 30 finished with value: -1.6152616083569185 and parameters: {'n_layers_yyx': 1, 'hidden_size_yyx_l0': 6, 'context_size_yyx': 3, 'num_mix_components_yyx': 5, 'context_extractor_yyx': 'gru', 'activation_func_yyx': 'GELU', 'L2_weight_yyx': 0.0003062449874587427, 'L_entropy_weight_yyx': 1.8800582678450897e-07, 'L_sep_weight_yyx': 2.892717516335664e-05, 'L_scale_weight_yyx': 0.00018929309028931912, 'learning_rate_yyx': 0.0029729873578508773}. Best is trial 30 with value: -1.6152616083569185.
[I 2026-03-18 20:00:36,293] Trial 37 finished with value: -1.5885930969400466 and parameters: {'n_layers_yyx': 2, 'hidden_size_yyx_l0': 3, 'hidden_size_yyx_l1': 6, 'context_size_yyx': 4, 'num_mix_components_yyx': 1, 'context_extractor_yyx': 'gru', 'activation_func_yyx': 'Tanh', 'L2_weight_yyx': 5.555214080433733e-10, 'L_entropy_weight_yyx': 1.731085560115291e-05, 'L_sep_weight_yyx': 2.680212593923957e-07, 'L_scale_weight_yyx': 0.0004739697189199762, 'learning_rate_yyx': 0.006902789534943489}. Best is trial 21 with value: -1.6119054721666712.
[I 2026-03-18 20:00:37,123] Trial 38 pruned. 
[I 2026-03-18 20:00:38,795] Trial 44 pruned. 
[I 2026-03-18 20:00:39,682] Trial 36 finished with value: -2.040569364980251 and parameters: {'n_layers_yyx': 2, 'hidden_size_yyx_l0': 6, 'hidden_size_yyx_l1': 5, 'context_size_yyx': 2, 'num_mix_components_yyx': 2, 'context_extractor_yyx': 'lstm', 'activation_func_yyx': 'GELU', 'L2_weight_yyx': 1.4928989138980164e-08, 'L_entropy_weight_yyx': 0.0009565753276471858, 'L_sep_weight_yyx': 0.00033052411292859037, 'L_scale_weight_yyx': 2.6745040518580535e-05, 'learning_rate_yyx': 0.006314091369885757}. Best is trial 2 with value: -2.059868681386501.
[I 2026-03-18 20:00:41,310] Trial 35 pruned. 
[I 2026-03-18 20:00:42,745] Trial 31 pruned. 
[I 2026-03-18 20:00:47,331] Trial 36 pruned. 
[I 2026-03-18 20:00:50,365] Trial 39 pruned. 
[I 2026-03-18 20:00:51,048] Trial 45 pruned. 
[I 2026-03-18 20:00:51,681] Trial 35 pruned. 
[I 2026-03-18 20:00:53,014] Trial 45 finished with value: -1.6065019833320082 and parameters: {'n_layers_yyx': 2, 'hidden_size_yyx_l0': 6, 'hidden_size_yyx_l1': 4, 'context_size_yyx': 4, 'num_mix_components_yyx': 5, 'context_extractor_yyx': 'lstm', 'activation_func_yyx': 'GELU', 'L2_weight_yyx': 0.00041021585693095416, 'L_entropy_weight_yyx': 8.862290129062389e-06, 'L_sep_weight_yyx': 4.0600246952644234e-10, 'L_scale_weight_yyx': 3.3445293291907475e-06, 'learning_rate_yyx': 0.009484635987064794}. Best is trial 39 with value: -1.6090295482077699.
[I 2026-03-18 20:00:53,733] Trial 37 pruned. 
[I 2026-03-18 20:00:55,646] Trial 45 pruned. 
[I 2026-03-18 20:00:56,023] Trial 28 finished with value: -1.6128544634269126 and parameters: {'n_layers_yyx': 2, 'hidden_size_yyx_l0': 5, 'hidden_size_yyx_l1': 4, 'context_size_yyx': 4, 'num_mix_components_yyx': 4, 'context_extractor_yyx': 'lstm', 'activation_func_yyx': 'Tanh', 'L2_weight_yyx': 2.9922133280477703e-07, 'L_entropy_weight_yyx': 9.334001682296185e-10, 'L_sep_weight_yyx': 5.528763486520798e-10, 'L_scale_weight_yyx': 2.099107244555286e-06, 'learning_rate_yyx': 0.00969021623102708}. Best is trial 21 with value: -1.6169303846739371.
[I 2026-03-18 20:00:57,138] Trial 46 pruned. 
[I 2026-03-18 20:00:58,409] Trial 37 finished with value: -1.6094954962622277 and parameters: {'n_layers_yyx': 2, 'hidden_size_yyx_l0': 5, 'hidden_size_yyx_l1': 4, 'context_size_yyx': 4, 'num_mix_components_yyx': 4, 'context_extractor_yyx': 'lstm', 'activation_func_yyx': 'ReLU', 'L2_weight_yyx': 4.100985831340343e-07, 'L_entropy_weight_yyx': 2.2431160955394936e-08, 'L_sep_weight_yyx': 0.00022537572527396596, 'L_scale_weight_yyx': 8.903025324330158e-07, 'learning_rate_yyx': 0.005539313964477792}. Best is trial 1 with value: -1.6113757535901372.
[I 2026-03-18 20:00:58,610] Trial 46 pruned. 
[I 2026-03-18 20:01:00,188] Trial 24 finished with value: -2.0807476343787488 and parameters: {'n_layers_yyx': 1, 'hidden_size_yyx_l0': 4, 'context_size_yyx': 4, 'num_mix_components_yyx': 2, 'context_extractor_yyx': 'gru', 'activation_func_yyx': 'ReLU', 'L2_weight_yyx': 7.638935310394653e-08, 'L_entropy_weight_yyx': 3.4268462677273407e-07, 'L_sep_weight_yyx': 2.0240889280518443e-08, 'L_scale_weight_yyx': 8.318070052064994e-05, 'learning_rate_yyx': 0.004279099296734423}. Best is trial 8 with value: -2.0851807543284644.
[I 2026-03-18 20:01:00,897] Trial 35 pruned. 
[I 2026-03-18 20:01:02,455] Trial 46 pruned. 
[I 2026-03-18 20:01:04,858] Trial 47 pruned. 
[I 2026-03-18 20:01:05,506] Trial 40 pruned. 
[I 2026-03-18 20:01:07,193] Trial 32 finished with value: -2.0752181081765766 and parameters: {'n_layers_yyx': 2, 'hidden_size_yyx_l0': 2, 'hidden_size_yyx_l1': 4, 'context_size_yyx': 3, 'num_mix_components_yyx': 2, 'context_extractor_yyx': 'lstm', 'activation_func_yyx': 'GELU', 'L2_weight_yyx': 1.662484960871282e-05, 'L_entropy_weight_yyx': 0.0002453390018995408, 'L_sep_weight_yyx': 4.046479387095773e-06, 'L_scale_weight_yyx': 2.222021101275219e-06, 'learning_rate_yyx': 0.006892939734087531}. Best is trial 6 with value: -2.0790188514889616.
[I 2026-03-18 20:01:13,692] Trial 26 finished with value: -1.6175509739349776 and parameters: {'n_layers_yyx': 2, 'hidden_size_yyx_l0': 5, 'hidden_size_yyx_l1': 5, 'context_size_yyx': 2, 'num_mix_components_yyx': 4, 'context_extractor_yyx': 'gru', 'activation_func_yyx': 'ReLU', 'L2_weight_yyx': 0.00031102980515378863, 'L_entropy_weight_yyx': 5.943933883853299e-07, 'L_sep_weight_yyx': 3.896307512826015e-10, 'L_scale_weight_yyx': 7.867732759636442e-08, 'learning_rate_yyx': 0.0015745658017981901}. Best is trial 22 with value: -1.6339605357080298.
[I 2026-03-18 20:01:15,539] Trial 36 pruned. 
[I 2026-03-18 20:01:15,717] Trial 47 pruned. 
[I 2026-03-18 20:01:22,712] Trial 34 finished with value: -2.0912578191451114 and parameters: {'n_layers_yyx': 1, 'hidden_size_yyx_l0': 5, 'context_size_yyx': 4, 'num_mix_components_yyx': 4, 'context_extractor_yyx': 'gru', 'activation_func_yyx': 'GELU', 'L2_weight_yyx': 1.869679335365704e-05, 'L_entropy_weight_yyx': 1.1095951378872731e-06, 'L_sep_weight_yyx': 2.4701181132215427e-05, 'L_scale_weight_yyx': 1.8932131652154655e-09, 'learning_rate_yyx': 0.006114848947996716}. Best is trial 2 with value: -2.093203554819634.
[I 2026-03-18 20:01:28,104] Trial 47 pruned. 
[I 2026-03-18 20:01:28,143] Trial 48 pruned. 
[I 2026-03-18 20:01:28,400] Trial 38 pruned. 
[I 2026-03-18 20:01:28,735] Trial 27 finished with value: -2.0760695234399793 and parameters: {'n_layers_yyx': 2, 'hidden_size_yyx_l0': 5, 'hidden_size_yyx_l1': 5, 'context_size_yyx': 3, 'num_mix_components_yyx': 5, 'context_extractor_yyx': 'lstm', 'activation_func_yyx': 'ReLU', 'L2_weight_yyx': 8.932432186173716e-09, 'L_entropy_weight_yyx': 4.571040939673777e-06, 'L_sep_weight_yyx': 8.430610285648524e-05, 'L_scale_weight_yyx': 0.0007597598777827967, 'learning_rate_yyx': 0.0008035665437163814}. Best is trial 1 with value: -2.0819965339546846.
[I 2026-03-18 20:01:29,851] Trial 29 pruned. 
[I 2026-03-18 20:01:34,240] Trial 17 finished with value: -2.085006872312763 and parameters: {'n_layers_yyx': 1, 'hidden_size_yyx_l0': 6, 'context_size_yyx': 3, 'num_mix_components_yyx': 5, 'context_extractor_yyx': 'lstm', 'activation_func_yyx': 'ReLU', 'L2_weight_yyx': 0.0008328347804330741, 'L_entropy_weight_yyx': 1.766434488429393e-06, 'L_sep_weight_yyx': 0.0009457547736809519, 'L_scale_weight_yyx': 1.6553505742728484e-05, 'learning_rate_yyx': 0.007623022459438585}. Best is trial 16 with value: -2.0883428670836364.
[I 2026-03-18 20:01:34,871] Trial 49 pruned. 

Source events: 11540
Target events: 3828
Full model ln_yyx : 141.60812 nats/sec, 33.29345 nats/event
Full model Log loss : -1.63950
Full model ln_yyx : 141.42887 nats/sec, 33.25130 nats/event
Full model Log loss : -1.63473
Full model ln_yyx : 141.71860 nats/sec, 33.31942 nats/event
Full model Log loss : -1.63813
Full model ln_yyx : 142.58354 nats/sec, 33.52278 nats/event
Full model Log loss : -1.63640
Full model ln_yyx : 140.30851 nats/sec, 32.98789 nats/event
Full model Log loss : -1.61389
Full model ln_yyx : 142.60738 nats/sec, 33.52838 nats/event
Full model Log loss : -1.63839
Full model ln_yyx : 142.08920 nats/sec, 33.40655 nats/event
Full model Log loss : -1.64032
Full model ln_yyx : 141.98330 nats/sec, 33.38165 nats/event
Full model Log loss : -1.63789
Full model ln_yyx : 142.05477 nats/sec, 33.39846 nats/event
Full model Log loss : -1.63246
Full model ln_yyx : 142.19731 nats/sec, 33.43197 nats/event
Full model Log loss : -1.63387
Full model ln_yyx : 142.21816 nats/sec, 33.43687 nats/event
Full model Log loss : -1.63375
Optimization finished. Config saved to results/opt-full/opt_full_387_best_config.txt
[I 2026-03-18 20:01:35,226] Trial 48 pruned. 
[I 2026-03-18 20:01:35,518] Trial 28 pruned. 
[I 2026-03-18 20:01:39,803] Trial 25 pruned. 
[I 2026-03-18 20:01:42,836] Trial 29 pruned. 
[I 2026-03-18 20:01:43,057] Trial 30 pruned. 
[I 2026-03-18 20:01:46,040] Trial 21 finished with value: -2.090990742322707 and parameters: {'n_layers_yyx': 1, 'hidden_size_yyx_l0': 6, 'context_size_yyx': 4, 'num_mix_components_yyx': 5, 'context_extractor_yyx': 'gru', 'activation_func_yyx': 'Tanh', 'L2_weight_yyx': 1.1545687469132739e-08, 'L_entropy_weight_yyx': 5.1019396239853564e-09, 'L_sep_weight_yyx': 4.223128982751716e-09, 'L_scale_weight_yyx': 2.184036428159316e-10, 'learning_rate_yyx': 0.005414995140030307}. Best is trial 14 with value: -2.0936086041286655.
[I 2026-03-18 20:01:46,686] Trial 26 pruned. 
[I 2026-03-18 20:01:48,397] Trial 38 finished with value: -1.6114324329693406 and parameters: {'n_layers_yyx': 2, 'hidden_size_yyx_l0': 5, 'hidden_size_yyx_l1': 5, 'context_size_yyx': 4, 'num_mix_components_yyx': 5, 'context_extractor_yyx': 'lstm', 'activation_func_yyx': 'ReLU', 'L2_weight_yyx': 4.7014214231589897e-07, 'L_entropy_weight_yyx': 2.550623013954942e-08, 'L_sep_weight_yyx': 0.00020062887461850203, 'L_scale_weight_yyx': 7.392743309163541e-07, 'learning_rate_yyx': 0.007273491954831584}. Best is trial 38 with value: -1.6114324329693406.
[I 2026-03-18 20:01:55,199] Trial 30 pruned. 
[I 2026-03-18 20:02:12,390] Trial 27 pruned. 
[I 2026-03-18 20:02:22,559] Trial 22 finished with value: -2.121808744838355 and parameters: {'n_layers_yyx': 1, 'hidden_size_yyx_l0': 4, 'context_size_yyx': 2, 'num_mix_components_yyx': 5, 'context_extractor_yyx': 'gru', 'activation_func_yyx': 'Tanh', 'L2_weight_yyx': 0.00014493887487997806, 'L_entropy_weight_yyx': 0.0009647737525507094, 'L_sep_weight_yyx': 5.943174998439767e-08, 'L_scale_weight_yyx': 1.6039792614650997e-07, 'learning_rate_yyx': 0.0050455100070453986}. Best is trial 10 with value: -2.123509279126982.
[I 2026-03-18 20:02:23,832] Trial 42 finished with value: -1.6122350295736687 and parameters: {'n_layers_yyx': 1, 'hidden_size_yyx_l0': 6, 'context_size_yyx': 3, 'num_mix_components_yyx': 4, 'context_extractor_yyx': 'gru', 'activation_func_yyx': 'ReLU', 'L2_weight_yyx': 1.6071010329677192e-06, 'L_entropy_weight_yyx': 6.074290583750158e-06, 'L_sep_weight_yyx': 2.6531617606294372e-09, 'L_scale_weight_yyx': 3.140455463742864e-10, 'learning_rate_yyx': 0.0035283983015192396}. Best is trial 20 with value: -1.6161773654609999.
[I 2026-03-18 20:02:26,872] Trial 21 finished with value: -2.092973693501957 and parameters: {'n_layers_yyx': 1, 'hidden_size_yyx_l0': 4, 'context_size_yyx': 2, 'num_mix_components_yyx': 4, 'context_extractor_yyx': 'gru', 'activation_func_yyx': 'Tanh', 'L2_weight_yyx': 7.847396663545023e-10, 'L_entropy_weight_yyx': 7.618087269913735e-10, 'L_sep_weight_yyx': 4.6430970366008725e-05, 'L_scale_weight_yyx': 6.659111178222323e-05, 'learning_rate_yyx': 0.009912500859070599}. Best is trial 11 with value: -2.095012278283745.
[I 2026-03-18 20:02:26,969] Trial 31 pruned. 
[I 2026-03-18 20:02:38,209] Trial 24 finished with value: -1.6085328878397642 and parameters: {'n_layers_yyx': 1, 'hidden_size_yyx_l0': 4, 'context_size_yyx': 2, 'num_mix_components_yyx': 2, 'context_extractor_yyx': 'gru', 'activation_func_yyx': 'Tanh', 'L2_weight_yyx': 3.185196006460086e-09, 'L_entropy_weight_yyx': 0.0007732204039562951, 'L_sep_weight_yyx': 6.667341325237393e-09, 'L_scale_weight_yyx': 7.07062557184076e-06, 'learning_rate_yyx': 0.009649685447531475}. Best is trial 9 with value: -1.613731891101604.
[I 2026-03-18 20:02:43,022] Trial 28 pruned. 
[I 2026-03-18 20:02:48,096] Trial 43 pruned. 
[I 2026-03-18 20:02:50,071] Trial 32 pruned. 
[I 2026-03-18 20:02:50,320] Trial 49 pruned. 

Source events: 11540
Target events: 1783
Full model ln_yyx : 64.71438 nats/sec, 32.66570 nats/event
Full model Log loss : -1.60698
Full model ln_yyx : 63.26848 nats/sec, 31.93586 nats/event
Full model Log loss : -1.56677
Full model ln_yyx : 64.29657 nats/sec, 32.45480 nats/event
Full model Log loss : -1.59763
Full model ln_yyx : 65.17197 nats/sec, 32.89667 nats/event
Full model Log loss : -1.60671
Full model ln_yyx : 64.71048 nats/sec, 32.66373 nats/event
Full model Log loss : -1.60468
Full model ln_yyx : 64.46820 nats/sec, 32.54144 nats/event
Full model Log loss : -1.60779
Full model ln_yyx : 64.60903 nats/sec, 32.61252 nats/event
Full model Log loss : -1.60212
Full model ln_yyx : 63.85244 nats/sec, 32.23062 nats/event
Full model Log loss : -1.57912
Full model ln_yyx : 64.52235 nats/sec, 32.56877 nats/event
Full model Log loss : -1.58332
Full model ln_yyx : 64.80855 nats/sec, 32.71324 nats/event
Full model Log loss : -1.60511
Full model ln_yyx : 63.98971 nats/sec, 32.29991 nats/event
Full model Log loss : -1.59613
Full model ln_yyx : 64.93330 nats/sec, 32.77621 nats/event
Full model Log loss : -1.60903
Full model ln_yyx : 65.10822 nats/sec, 32.86450 nats/event
Full model Log loss : -1.60650
Optimization finished. Config saved to results/opt-full/opt_full_385_best_config.txt
