[I 2026-03-18 19:07:35,320] Trial 16 finished with value: -2.265386148590499 and parameters: {'n_layers_yyx': 1, 'hidden_size_yyx_l0': 6, 'context_size_yyx': 2, 'num_mix_components_yyx': 2, 'context_extractor_yyx': 'gru', 'activation_func_yyx': 'Tanh', 'L2_weight_yyx': 1.4287075284500068e-10, 'L_entropy_weight_yyx': 1.1684582090293023e-08, 'L_sep_weight_yyx': 9.004189588747759e-07, 'L_scale_weight_yyx': 1.2371184025312056e-10, 'learning_rate_yyx': 0.007045075020018987}. Best is trial 1 with value: -2.2881647079635865.
[I 2026-03-18 19:07:36,125] Trial 38 pruned. 
[I 2026-03-18 19:07:36,919] Trial 21 pruned. 
[I 2026-03-18 19:07:39,330] Trial 16 finished with value: -1.7798434540719696 and parameters: {'n_layers_yyx': 1, 'hidden_size_yyx_l0': 6, 'context_size_yyx': 3, 'num_mix_components_yyx': 3, 'context_extractor_yyx': 'gru', 'activation_func_yyx': 'GELU', 'L2_weight_yyx': 1.10200956232768e-10, 'L_entropy_weight_yyx': 3.336530463939966e-07, 'L_sep_weight_yyx': 0.0001728243079865628, 'L_scale_weight_yyx': 2.577199012617847e-07, 'learning_rate_yyx': 0.0026208256573532185}. Best is trial 2 with value: -1.7858329634232954.
[I 2026-03-18 19:07:40,087] Trial 24 pruned. 
[I 2026-03-18 19:07:40,335] Trial 16 pruned. 
[I 2026-03-18 19:07:42,207] Trial 40 finished with value: -0.8107211001690593 and parameters: {'n_layers_yyx': 2, 'hidden_size_yyx_l0': 6, 'hidden_size_yyx_l1': 3, 'context_size_yyx': 4, 'num_mix_components_yyx': 1, 'context_extractor_yyx': 'lstm', 'activation_func_yyx': 'ReLU', 'L2_weight_yyx': 9.931428926588433e-09, 'L_entropy_weight_yyx': 5.369511587276577e-05, 'L_sep_weight_yyx': 0.00011119008861157768, 'L_scale_weight_yyx': 1.2426137885806389e-08, 'learning_rate_yyx': 0.0057887709151973376}. Best is trial 18 with value: -0.8278672008429884.
[I 2026-03-18 19:07:44,019] Trial 39 pruned. 
[I 2026-03-18 19:07:45,627] Trial 17 pruned. 
[I 2026-03-18 19:07:46,983] Trial 33 pruned. 
[I 2026-03-18 19:07:49,595] Trial 20 pruned. 
[I 2026-03-18 19:07:50,597] Trial 11 finished with value: -2.287895645272338 and parameters: {'n_layers_yyx': 1, 'hidden_size_yyx_l0': 4, 'context_size_yyx': 4, 'num_mix_components_yyx': 2, 'context_extractor_yyx': 'gru', 'activation_func_yyx': 'GELU', 'L2_weight_yyx': 2.939804802324437e-10, 'L_entropy_weight_yyx': 1.9515314350518679e-10, 'L_sep_weight_yyx': 5.079473333651428e-06, 'L_scale_weight_yyx': 1.34215700847154e-05, 'learning_rate_yyx': 0.00881381862918835}. Best is trial 11 with value: -2.287895645272338.
[I 2026-03-18 19:07:51,672] Trial 13 pruned. 
[I 2026-03-18 19:07:52,487] Trial 37 finished with value: -0.8340322474785358 and parameters: {'n_layers_yyx': 1, 'hidden_size_yyx_l0': 5, 'context_size_yyx': 4, 'num_mix_components_yyx': 4, 'context_extractor_yyx': 'lstm', 'activation_func_yyx': 'Tanh', 'L2_weight_yyx': 2.570090279863524e-08, 'L_entropy_weight_yyx': 1.3632772386493222e-09, 'L_sep_weight_yyx': 5.285319876374404e-06, 'L_scale_weight_yyx': 1.511524509739876e-06, 'learning_rate_yyx': 0.0023787138112746063}. Best is trial 37 with value: -0.8340322474785358.
[I 2026-03-18 19:07:53,772] Trial 21 pruned. 
[I 2026-03-18 19:07:54,981] Trial 21 pruned. 
[I 2026-03-18 19:07:56,037] Trial 40 pruned. 
[I 2026-03-18 19:07:56,039] Trial 18 pruned. 
[I 2026-03-18 19:07:56,496] Trial 41 pruned. 
[I 2026-03-18 19:07:58,374] Trial 17 pruned. 
[I 2026-03-18 19:07:58,925] Trial 39 pruned. 
[I 2026-03-18 19:07:59,139] Trial 21 pruned. 
[I 2026-03-18 19:07:59,491] Trial 13 finished with value: -1.7836867947048611 and parameters: {'n_layers_yyx': 2, 'hidden_size_yyx_l0': 2, 'hidden_size_yyx_l1': 5, 'context_size_yyx': 2, 'num_mix_components_yyx': 4, 'context_extractor_yyx': 'lstm', 'activation_func_yyx': 'Tanh', 'L2_weight_yyx': 4.9419697090540574e-05, 'L_entropy_weight_yyx': 1.0035897357838386e-05, 'L_sep_weight_yyx': 1.8735225668150224e-06, 'L_scale_weight_yyx': 6.218644477489202e-08, 'learning_rate_yyx': 0.009336756221678403}. Best is trial 4 with value: -1.784507205847538.
[I 2026-03-18 19:08:03,326] Trial 17 pruned. 
[I 2026-03-18 19:08:05,993] Trial 19 pruned. 
[I 2026-03-18 19:08:06,179] Trial 40 pruned. 
[I 2026-03-18 19:08:06,709] Trial 38 pruned. 
[I 2026-03-18 19:08:08,491] Trial 22 pruned. 
[I 2026-03-18 19:08:11,490] Trial 41 pruned. 
[I 2026-03-18 19:08:11,827] Trial 42 pruned. 
[I 2026-03-18 19:08:13,731] Trial 45 finished with value: -0.7970387446123177 and parameters: {'n_layers_yyx': 2, 'hidden_size_yyx_l0': 3, 'hidden_size_yyx_l1': 5, 'context_size_yyx': 1, 'num_mix_components_yyx': 2, 'context_extractor_yyx': 'gru', 'activation_func_yyx': 'ReLU', 'L2_weight_yyx': 0.00013475604557984354, 'L_entropy_weight_yyx': 2.368243237401601e-10, 'L_sep_weight_yyx': 0.00010231684351836997, 'L_scale_weight_yyx': 2.244195905896693e-06, 'learning_rate_yyx': 0.009501491590768643}. Best is trial 44 with value: -0.8306488082187038.
[I 2026-03-18 19:08:17,529] Trial 23 pruned. 
[I 2026-03-18 19:08:17,536] Trial 12 finished with value: -1.7867913016887627 and parameters: {'n_layers_yyx': 1, 'hidden_size_yyx_l0': 4, 'context_size_yyx': 2, 'num_mix_components_yyx': 4, 'context_extractor_yyx': 'gru', 'activation_func_yyx': 'Tanh', 'L2_weight_yyx': 3.765785572208888e-08, 'L_entropy_weight_yyx': 9.634071893395138e-08, 'L_sep_weight_yyx': 1.1991708895051493e-10, 'L_scale_weight_yyx': 3.459805794429812e-08, 'learning_rate_yyx': 0.009311121357063685}. Best is trial 12 with value: -1.7867913016887627.
[I 2026-03-18 19:08:18,925] Trial 27 finished with value: -1.773798127520951 and parameters: {'n_layers_yyx': 1, 'hidden_size_yyx_l0': 3, 'context_size_yyx': 3, 'num_mix_components_yyx': 1, 'context_extractor_yyx': 'lstm', 'activation_func_yyx': 'GELU', 'L2_weight_yyx': 0.00030323602369714756, 'L_entropy_weight_yyx': 2.9352038508450928e-08, 'L_sep_weight_yyx': 4.7321139353498525e-05, 'L_scale_weight_yyx': 2.359163085803576e-06, 'learning_rate_yyx': 0.0028668034576352724}. Best is trial 4 with value: -1.7807932306351817.
[I 2026-03-18 19:08:22,362] Trial 24 finished with value: -0.8303083591658397 and parameters: {'n_layers_yyx': 1, 'hidden_size_yyx_l0': 3, 'context_size_yyx': 2, 'num_mix_components_yyx': 5, 'context_extractor_yyx': 'gru', 'activation_func_yyx': 'Tanh', 'L2_weight_yyx': 5.479886633347996e-10, 'L_entropy_weight_yyx': 6.086452597667681e-10, 'L_sep_weight_yyx': 5.62842024700102e-07, 'L_scale_weight_yyx': 1.174240407829532e-09, 'learning_rate_yyx': 0.006996008920856947}. Best is trial 10 with value: -0.8355233715063007.
[I 2026-03-18 19:08:27,050] Trial 24 pruned. 
[I 2026-03-18 19:08:29,169] Trial 20 pruned. 
[I 2026-03-18 19:08:35,826] Trial 12 finished with value: -2.2865257384581548 and parameters: {'n_layers_yyx': 1, 'hidden_size_yyx_l0': 5, 'context_size_yyx': 4, 'num_mix_components_yyx': 4, 'context_extractor_yyx': 'gru', 'activation_func_yyx': 'ReLU', 'L2_weight_yyx': 1.018312538695754e-06, 'L_entropy_weight_yyx': 1.0264516882307735e-10, 'L_sep_weight_yyx': 7.958515559961077e-06, 'L_scale_weight_yyx': 3.184708360860178e-05, 'learning_rate_yyx': 0.005010584039835999}. Best is trial 1 with value: -2.2866954714752907.
[I 2026-03-18 19:08:36,027] Trial 13 pruned. 
[I 2026-03-18 19:08:36,476] Trial 22 finished with value: -0.8052633671499954 and parameters: {'n_layers_yyx': 2, 'hidden_size_yyx_l0': 4, 'hidden_size_yyx_l1': 6, 'context_size_yyx': 4, 'num_mix_components_yyx': 2, 'context_extractor_yyx': 'lstm', 'activation_func_yyx': 'ReLU', 'L2_weight_yyx': 5.883063238224447e-10, 'L_entropy_weight_yyx': 5.944380601659047e-10, 'L_sep_weight_yyx': 1.2960466187323162e-08, 'L_scale_weight_yyx': 7.435068193013656e-06, 'learning_rate_yyx': 0.009384321523550105}. Best is trial 11 with value: -0.831068616497992.
[I 2026-03-18 19:08:36,895] Trial 25 pruned. 
[I 2026-03-18 19:08:39,965] Trial 11 finished with value: -1.8396262101845946 and parameters: {'n_layers_yyx': 1, 'hidden_size_yyx_l0': 3, 'context_size_yyx': 3, 'num_mix_components_yyx': 3, 'context_extractor_yyx': 'gru', 'activation_func_yyx': 'Tanh', 'L2_weight_yyx': 4.671522801011911e-06, 'L_entropy_weight_yyx': 4.328857799385402e-06, 'L_sep_weight_yyx': 2.105068575046222e-05, 'L_scale_weight_yyx': 5.013326424458289e-09, 'learning_rate_yyx': 0.00922437579135248}. Best is trial 5 with value: -1.864091702761834.
[I 2026-03-18 19:08:42,873] Trial 25 finished with value: -0.8135464779559407 and parameters: {'n_layers_yyx': 1, 'hidden_size_yyx_l0': 5, 'context_size_yyx': 3, 'num_mix_components_yyx': 5, 'context_extractor_yyx': 'gru', 'activation_func_yyx': 'Tanh', 'L2_weight_yyx': 0.00013695326884371437, 'L_entropy_weight_yyx': 5.750192372116951e-09, 'L_sep_weight_yyx': 7.952441387237744e-05, 'L_scale_weight_yyx': 3.035769995577722e-10, 'learning_rate_yyx': 0.005207464242598992}. Best is trial 21 with value: -0.8346943481986244.
[I 2026-03-18 19:08:44,028] Trial 23 pruned. 
[I 2026-03-18 19:08:46,228] Trial 42 pruned. 
[I 2026-03-18 19:08:47,935] Trial 48 finished with value: -0.81854671776911 and parameters: {'n_layers_yyx': 1, 'hidden_size_yyx_l0': 6, 'context_size_yyx': 3, 'num_mix_components_yyx': 1, 'context_extractor_yyx': 'lstm', 'activation_func_yyx': 'Tanh', 'L2_weight_yyx': 8.5986050613284e-05, 'L_entropy_weight_yyx': 5.032615251446002e-09, 'L_sep_weight_yyx': 2.299921407532058e-07, 'L_scale_weight_yyx': 1.7259226278580282e-06, 'learning_rate_yyx': 0.008101281475023613}. Best is trial 1 with value: -0.8328681168211087.
[I 2026-03-18 19:08:49,675] Trial 14 pruned. 
[I 2026-03-18 19:08:50,308] Trial 26 pruned. 
[I 2026-03-18 19:08:50,334] Trial 21 pruned. 
[I 2026-03-18 19:08:55,039] Trial 49 pruned. 

Source events: 3618
Target events: 16159
Full model ln_yyx : 127.86730 nats/sec, 7.12176 nats/event
Full model Log loss : -0.79365
Full model ln_yyx : 132.25821 nats/sec, 7.36632 nats/event
Full model Log loss : -0.83287
Full model ln_yyx : 128.56104 nats/sec, 7.16040 nats/event
Full model Log loss : -0.82210
Full model ln_yyx : 128.87600 nats/sec, 7.17794 nats/event
Full model Log loss : -0.82043
Full model ln_yyx : 128.17218 nats/sec, 7.13874 nats/event
Full model Log loss : -0.82682
Full model ln_yyx : 130.09946 nats/sec, 7.24609 nats/event
Full model Log loss : -0.82411
Full model ln_yyx : 130.06839 nats/sec, 7.24436 nats/event
Full model Log loss : -0.81533
Full model ln_yyx : 127.99174 nats/sec, 7.12869 nats/event
Full model Log loss : -0.82954
Full model ln_yyx : 128.74001 nats/sec, 7.17037 nats/event
Full model Log loss : -0.81270
Full model ln_yyx : 128.36384 nats/sec, 7.14942 nats/event
Full model Log loss : -0.81855
Optimization finished. Config saved to results/opt-full/opt_full_203_best_config.txt
[I 2026-03-18 19:08:55,578] Trial 18 finished with value: -1.7723244854833367 and parameters: {'n_layers_yyx': 1, 'hidden_size_yyx_l0': 5, 'context_size_yyx': 3, 'num_mix_components_yyx': 4, 'context_extractor_yyx': 'lstm', 'activation_func_yyx': 'Tanh', 'L2_weight_yyx': 3.9344988071277895e-10, 'L_entropy_weight_yyx': 4.863571501560525e-05, 'L_sep_weight_yyx': 1.3056361566822684e-07, 'L_scale_weight_yyx': 5.71570564407648e-05, 'learning_rate_yyx': 0.00950402284828971}. Best is trial 2 with value: -1.776406202226865.
[I 2026-03-18 19:08:57,146] Trial 12 pruned. 
[I 2026-03-18 19:08:58,518] Trial 17 finished with value: -2.269182792753516 and parameters: {'n_layers_yyx': 2, 'hidden_size_yyx_l0': 4, 'hidden_size_yyx_l1': 5, 'context_size_yyx': 3, 'num_mix_components_yyx': 4, 'context_extractor_yyx': 'lstm', 'activation_func_yyx': 'ReLU', 'L2_weight_yyx': 1.0279196883689943e-07, 'L_entropy_weight_yyx': 8.204974688441502e-09, 'L_sep_weight_yyx': 9.482255998453404e-05, 'L_scale_weight_yyx': 1.4307086832980088e-09, 'learning_rate_yyx': 0.00538781887578365}. Best is trial 2 with value: -2.272224617884258.
[I 2026-03-18 19:08:58,776] Trial 25 pruned. 
[I 2026-03-18 19:08:59,316] Trial 24 pruned. 
[I 2026-03-18 19:09:01,938] Trial 43 pruned. 
[I 2026-03-18 19:09:01,938] Trial 18 pruned. 
[I 2026-03-18 19:09:06,161] Trial 27 pruned. 
[I 2026-03-18 19:09:06,590] Trial 26 pruned. 
[I 2026-03-18 19:09:07,311] Trial 25 pruned. 
[I 2026-03-18 19:09:08,194] Trial 28 finished with value: -0.8137075855249493 and parameters: {'n_layers_yyx': 1, 'hidden_size_yyx_l0': 3, 'context_size_yyx': 4, 'num_mix_components_yyx': 4, 'context_extractor_yyx': 'gru', 'activation_func_yyx': 'Tanh', 'L2_weight_yyx': 4.309790776312737e-05, 'L_entropy_weight_yyx': 8.667193951535988e-06, 'L_sep_weight_yyx': 4.0206576057834444e-05, 'L_scale_weight_yyx': 8.404100866271348e-07, 'learning_rate_yyx': 0.007239553062008078}. Best is trial 10 with value: -0.8371109842725836.
[I 2026-03-18 19:09:10,265] Trial 46 finished with value: -0.8404465961315432 and parameters: {'n_layers_yyx': 2, 'hidden_size_yyx_l0': 5, 'hidden_size_yyx_l1': 5, 'context_size_yyx': 4, 'num_mix_components_yyx': 1, 'context_extractor_yyx': 'gru', 'activation_func_yyx': 'ReLU', 'L2_weight_yyx': 0.00026041087614004694, 'L_entropy_weight_yyx': 6.035982765318241e-09, 'L_sep_weight_yyx': 2.028086938481579e-06, 'L_scale_weight_yyx': 1.7272405024646304e-08, 'learning_rate_yyx': 0.00874591196801331}. Best is trial 46 with value: -0.8404465961315432.
[I 2026-03-18 19:09:10,265] Trial 43 finished with value: -0.8290619392338673 and parameters: {'n_layers_yyx': 2, 'hidden_size_yyx_l0': 6, 'hidden_size_yyx_l1': 4, 'context_size_yyx': 4, 'num_mix_components_yyx': 3, 'context_extractor_yyx': 'lstm', 'activation_func_yyx': 'Tanh', 'L2_weight_yyx': 2.7093145159558015e-08, 'L_entropy_weight_yyx': 0.00032942827750406887, 'L_sep_weight_yyx': 0.0006390568605126743, 'L_scale_weight_yyx': 4.6885928446683054e-07, 'learning_rate_yyx': 0.005442499911879313}. Best is trial 43 with value: -0.8290619392338673.
[I 2026-03-18 19:09:10,578] Trial 44 pruned. 
[I 2026-03-18 19:09:14,219] Trial 19 pruned. 
[I 2026-03-18 19:09:15,231] Trial 26 pruned. 
[I 2026-03-18 19:09:15,529] Trial 29 pruned. 
[I 2026-03-18 19:09:15,893] Trial 12 finished with value: -2.281020704952148 and parameters: {'n_layers_yyx': 2, 'hidden_size_yyx_l0': 3, 'hidden_size_yyx_l1': 6, 'context_size_yyx': 4, 'num_mix_components_yyx': 5, 'context_extractor_yyx': 'lstm', 'activation_func_yyx': 'GELU', 'L2_weight_yyx': 3.276567774342165e-06, 'L_entropy_weight_yyx': 0.0008606836346691736, 'L_sep_weight_yyx': 0.0004570283117532054, 'L_scale_weight_yyx': 0.0009748085106786138, 'learning_rate_yyx': 0.009602153211347777}. Best is trial 10 with value: -2.2811953358201777.
[I 2026-03-18 19:09:20,692] Trial 28 pruned. 
[I 2026-03-18 19:09:23,846] Trial 30 pruned. 
[I 2026-03-18 19:09:24,031] Trial 14 pruned. 
[I 2026-03-18 19:09:24,055] Trial 27 pruned. 
[I 2026-03-18 19:09:25,595] Trial 47 pruned. 
[I 2026-03-18 19:09:25,616] Trial 45 pruned. 
[I 2026-03-18 19:09:25,866] Trial 44 pruned. 
[I 2026-03-18 19:09:26,395] Trial 26 pruned. 
[I 2026-03-18 19:09:27,949] Trial 29 pruned. 
[I 2026-03-18 19:09:31,126] Trial 22 finished with value: -2.2842254974850826 and parameters: {'n_layers_yyx': 2, 'hidden_size_yyx_l0': 6, 'hidden_size_yyx_l1': 5, 'context_size_yyx': 4, 'num_mix_components_yyx': 3, 'context_extractor_yyx': 'lstm', 'activation_func_yyx': 'ReLU', 'L2_weight_yyx': 5.160418259462458e-09, 'L_entropy_weight_yyx': 0.0001461614002820126, 'L_sep_weight_yyx': 1.3619218515133654e-08, 'L_scale_weight_yyx': 5.570803887690418e-10, 'learning_rate_yyx': 0.009482295874588412}. Best is trial 10 with value: -2.2853422092545133.
[I 2026-03-18 19:09:31,242] Trial 28 pruned. 
[I 2026-03-18 19:09:32,529] Trial 15 pruned. 
[I 2026-03-18 19:09:34,075] Trial 46 pruned. 
[I 2026-03-18 19:09:34,122] Trial 13 finished with value: -2.283141656546435 and parameters: {'n_layers_yyx': 1, 'hidden_size_yyx_l0': 5, 'context_size_yyx': 3, 'num_mix_components_yyx': 5, 'context_extractor_yyx': 'gru', 'activation_func_yyx': 'ReLU', 'L2_weight_yyx': 3.190173839755007e-09, 'L_entropy_weight_yyx': 2.255080795123366e-07, 'L_sep_weight_yyx': 1.032066691959563e-10, 'L_scale_weight_yyx': 1.4289653622678367e-09, 'learning_rate_yyx': 0.0034652797798809263}. Best is trial 10 with value: -2.2831751549112607.
[I 2026-03-18 19:09:34,452] Trial 12 finished with value: -2.2168161654612635 and parameters: {'n_layers_yyx': 1, 'hidden_size_yyx_l0': 4, 'context_size_yyx': 3, 'num_mix_components_yyx': 5, 'context_extractor_yyx': 'lstm', 'activation_func_yyx': 'GELU', 'L2_weight_yyx': 3.2712888418225928e-09, 'L_entropy_weight_yyx': 1.2706354575923745e-07, 'L_sep_weight_yyx': 3.896324387326389e-05, 'L_scale_weight_yyx': 2.320213827131064e-10, 'learning_rate_yyx': 0.005526729023748831}. Best is trial 12 with value: -2.2168161654612635.
[I 2026-03-18 19:09:35,637] Trial 41 finished with value: -0.8143173961554884 and parameters: {'n_layers_yyx': 2, 'hidden_size_yyx_l0': 3, 'hidden_size_yyx_l1': 6, 'context_size_yyx': 1, 'num_mix_components_yyx': 1, 'context_extractor_yyx': 'lstm', 'activation_func_yyx': 'Tanh', 'L2_weight_yyx': 4.6677636146672774e-08, 'L_entropy_weight_yyx': 5.082734575389275e-10, 'L_sep_weight_yyx': 2.567713442936793e-10, 'L_scale_weight_yyx': 2.491652148762023e-08, 'learning_rate_yyx': 0.006674526414228973}. Best is trial 2 with value: -0.8370103483890325.
[I 2026-03-18 19:09:36,109] Trial 30 pruned. 
[I 2026-03-18 19:09:36,691] Trial 40 finished with value: -0.8152623592134417 and parameters: {'n_layers_yyx': 1, 'hidden_size_yyx_l0': 6, 'context_size_yyx': 2, 'num_mix_components_yyx': 1, 'context_extractor_yyx': 'lstm', 'activation_func_yyx': 'GELU', 'L2_weight_yyx': 1.4709762136081286e-06, 'L_entropy_weight_yyx': 7.653402309971785e-10, 'L_sep_weight_yyx': 1.5171212039555024e-09, 'L_scale_weight_yyx': 0.00021751008089545548, 'learning_rate_yyx': 0.004326748584907533}. Best is trial 37 with value: -0.8339115745736013.
[I 2026-03-18 19:09:40,498] Trial 45 pruned. 
[I 2026-03-18 19:09:41,186] Trial 16 pruned. 
[I 2026-03-18 19:09:42,800] Trial 13 pruned. 
[I 2026-03-18 19:09:42,845] Trial 27 pruned. 
[I 2026-03-18 19:09:43,514] Trial 14 pruned. 
[I 2026-03-18 19:09:45,004] Trial 27 pruned. 
[I 2026-03-18 19:09:45,290] Trial 22 finished with value: -1.7727337246999921 and parameters: {'n_layers_yyx': 1, 'hidden_size_yyx_l0': 4, 'context_size_yyx': 4, 'num_mix_components_yyx': 1, 'context_extractor_yyx': 'lstm', 'activation_func_yyx': 'GELU', 'L2_weight_yyx': 4.613343742054354e-09, 'L_entropy_weight_yyx': 5.355780332713108e-09, 'L_sep_weight_yyx': 3.9087449323407386e-05, 'L_scale_weight_yyx': 3.6439529960215104e-05, 'learning_rate_yyx': 0.001189766192883625}. Best is trial 4 with value: -1.7775746924677662.
[I 2026-03-18 19:09:48,396] Trial 46 pruned. 
[I 2026-03-18 19:09:49,504] Trial 47 pruned. 
[I 2026-03-18 19:09:49,590] Trial 39 finished with value: -0.8186853090452478 and parameters: {'n_layers_yyx': 1, 'hidden_size_yyx_l0': 6, 'context_size_yyx': 4, 'num_mix_components_yyx': 4, 'context_extractor_yyx': 'lstm', 'activation_func_yyx': 'Tanh', 'L2_weight_yyx': 1.205901800252395e-08, 'L_entropy_weight_yyx': 0.00012761802989641352, 'L_sep_weight_yyx': 0.00012469192382357053, 'L_scale_weight_yyx': 1.4891708139696539e-06, 'learning_rate_yyx': 0.0014461547007261735}. Best is trial 37 with value: -0.8340322474785358.
[I 2026-03-18 19:09:49,891] Trial 28 pruned. 
[I 2026-03-18 19:09:54,366] Trial 23 pruned. 
[I 2026-03-18 19:09:55,888] Trial 47 pruned. 
[I 2026-03-18 19:09:57,870] Trial 48 pruned. 
[I 2026-03-18 19:09:59,181] Trial 14 finished with value: -1.783081572561553 and parameters: {'n_layers_yyx': 2, 'hidden_size_yyx_l0': 2, 'hidden_size_yyx_l1': 5, 'context_size_yyx': 1, 'num_mix_components_yyx': 5, 'context_extractor_yyx': 'gru', 'activation_func_yyx': 'ReLU', 'L2_weight_yyx': 0.0001116814642477657, 'L_entropy_weight_yyx': 1.1735260143172802e-05, 'L_sep_weight_yyx': 6.005427703954174e-07, 'L_scale_weight_yyx': 1.5269798293867108e-08, 'learning_rate_yyx': 0.009646014998433735}. Best is trial 4 with value: -1.784507205847538.
[I 2026-03-18 19:10:00,156] Trial 19 pruned. 
[I 2026-03-18 19:10:00,227] Trial 20 pruned. 
[I 2026-03-18 19:10:02,755] Trial 18 finished with value: -1.7861539220328282 and parameters: {'n_layers_yyx': 1, 'hidden_size_yyx_l0': 5, 'context_size_yyx': 1, 'num_mix_components_yyx': 5, 'context_extractor_yyx': 'lstm', 'activation_func_yyx': 'GELU', 'L2_weight_yyx': 0.00014387493073071906, 'L_entropy_weight_yyx': 5.537275157635528e-09, 'L_sep_weight_yyx': 1.8638574094544232e-05, 'L_scale_weight_yyx': 0.0006425843178043751, 'learning_rate_yyx': 0.009408335329957678}. Best is trial 18 with value: -1.7861539220328282.
[I 2026-03-18 19:10:04,092] Trial 48 pruned. 
[I 2026-03-18 19:10:04,805] Trial 28 pruned. 
[I 2026-03-18 19:10:04,806] Trial 29 pruned. 
[I 2026-03-18 19:10:05,170] Trial 15 pruned. 
[I 2026-03-18 19:10:07,232] Trial 18 finished with value: -2.2732639198985773 and parameters: {'n_layers_yyx': 2, 'hidden_size_yyx_l0': 3, 'hidden_size_yyx_l1': 5, 'context_size_yyx': 2, 'num_mix_components_yyx': 5, 'context_extractor_yyx': 'lstm', 'activation_func_yyx': 'Tanh', 'L2_weight_yyx': 1.181682607817234e-07, 'L_entropy_weight_yyx': 0.0004840599478522792, 'L_sep_weight_yyx': 1.6761673994411442e-08, 'L_scale_weight_yyx': 4.26427739976207e-06, 'learning_rate_yyx': 0.006487744115831226}. Best is trial 18 with value: -2.2732639198985773.
[I 2026-03-18 19:10:09,242] Trial 15 pruned. 
[I 2026-03-18 19:10:09,409] Trial 21 pruned. 
[I 2026-03-18 19:10:10,627] Trial 42 pruned. 
[I 2026-03-18 19:10:11,505] Trial 41 pruned. 
[I 2026-03-18 19:10:11,928] Trial 30 pruned. 
