[I 2026-03-18 17:52:22,298] Trial 29 finished with value: -2.9659173901010147 and parameters: {'n_layers_yyx': 1, 'hidden_size_yyx_l0': 4, 'context_size_yyx': 4, 'num_mix_components_yyx': 4, 'context_extractor_yyx': 'lstm', 'activation_func_yyx': 'ReLU', 'L2_weight_yyx': 3.982348251320297e-08, 'L_entropy_weight_yyx': 3.3002556655127876e-05, 'L_sep_weight_yyx': 0.0002607709443310825, 'L_scale_weight_yyx': 0.00014767007372860238, 'learning_rate_yyx': 0.007564884617051339}. Best is trial 29 with value: -2.9659173901010147.
[I 2026-03-18 17:52:32,206] Trial 33 finished with value: -2.960089994691203 and parameters: {'n_layers_yyx': 1, 'hidden_size_yyx_l0': 5, 'context_size_yyx': 3, 'num_mix_components_yyx': 3, 'context_extractor_yyx': 'lstm', 'activation_func_yyx': 'Tanh', 'L2_weight_yyx': 2.077453868377173e-09, 'L_entropy_weight_yyx': 1.23180154827351e-05, 'L_sep_weight_yyx': 3.1064098055953174e-05, 'L_scale_weight_yyx': 5.759926315106515e-09, 'learning_rate_yyx': 0.008261597861061079}. Best is trial 22 with value: -2.970223923614394.
[I 2026-03-18 17:52:40,276] Trial 36 pruned. 
[I 2026-03-18 17:52:44,874] Trial 49 finished with value: -2.905646050511378 and parameters: {'n_layers_yyx': 2, 'hidden_size_yyx_l0': 2, 'hidden_size_yyx_l1': 3, 'context_size_yyx': 3, 'num_mix_components_yyx': 5, 'context_extractor_yyx': 'gru', 'activation_func_yyx': 'Tanh', 'L2_weight_yyx': 1.1702827233782574e-08, 'L_entropy_weight_yyx': 7.361492534316146e-06, 'L_sep_weight_yyx': 8.542619218255805e-05, 'L_scale_weight_yyx': 4.9085357708214594e-08, 'learning_rate_yyx': 0.0005469828396670327}. Best is trial 34 with value: -2.96234983443252.

Source events: 20315
Target events: 20800
Full model ln_yyx : 1971.95670 nats/sec, 85.32505 nats/event
Full model Log loss : -2.89714
Full model ln_yyx : 1917.22513 nats/sec, 82.95686 nats/event
Full model Log loss : -2.80386
Full model ln_yyx : 1991.78415 nats/sec, 86.18297 nats/event
Full model Log loss : -2.94872
Full model ln_yyx : 1964.43521 nats/sec, 84.99960 nats/event
Full model Log loss : -2.93336
Full model ln_yyx : 1987.83332 nats/sec, 86.01202 nats/event
Full model Log loss : -2.94217
Full model ln_yyx : 1982.74110 nats/sec, 85.79168 nats/event
Full model Log loss : -2.95099
Full model ln_yyx : 1998.32033 nats/sec, 86.46578 nats/event
Full model Log loss : -2.94783
Full model ln_yyx : 1976.86861 nats/sec, 85.53758 nats/event
Full model Log loss : -2.93307
Full model ln_yyx : 1986.67856 nats/sec, 85.96205 nats/event
Full model Log loss : -2.94230
Full model ln_yyx : 2000.51453 nats/sec, 86.56072 nats/event
Full model Log loss : -2.96235
Full model ln_yyx : 1988.47846 nats/sec, 86.03993 nats/event
Full model Log loss : -2.95876
Full model ln_yyx : 1989.13483 nats/sec, 86.06833 nats/event
Full model Log loss : -2.95866
Full model ln_yyx : 1974.34357 nats/sec, 85.42833 nats/event
Full model Log loss : -2.94880
Full model ln_yyx : 1960.28830 nats/sec, 84.82017 nats/event
Full model Log loss : -2.90565
Optimization finished. Config saved to results/opt-full/opt_full_34_best_config.txt
[I 2026-03-18 17:52:52,102] Trial 47 pruned. 
[I 2026-03-18 17:52:57,454] Trial 44 pruned. 
[I 2026-03-18 17:52:58,924] Trial 48 pruned. 
[I 2026-03-18 17:53:10,040] Trial 42 finished with value: -2.9546447846243855 and parameters: {'n_layers_yyx': 1, 'hidden_size_yyx_l0': 6, 'context_size_yyx': 3, 'num_mix_components_yyx': 5, 'context_extractor_yyx': 'gru', 'activation_func_yyx': 'Tanh', 'L2_weight_yyx': 6.119952128176939e-10, 'L_entropy_weight_yyx': 0.00011261331498829787, 'L_sep_weight_yyx': 1.2616631470820204e-09, 'L_scale_weight_yyx': 0.00018306942787123267, 'learning_rate_yyx': 0.008739466812150907}. Best is trial 36 with value: -2.9570429460965078.
[I 2026-03-18 17:53:10,218] Trial 34 pruned. 
[I 2026-03-18 17:53:10,278] Trial 31 finished with value: -2.9741267012201855 and parameters: {'n_layers_yyx': 1, 'hidden_size_yyx_l0': 5, 'context_size_yyx': 4, 'num_mix_components_yyx': 4, 'context_extractor_yyx': 'lstm', 'activation_func_yyx': 'Tanh', 'L2_weight_yyx': 0.00014707424622458743, 'L_entropy_weight_yyx': 1.5999240937651348e-08, 'L_sep_weight_yyx': 4.1127309881656616e-10, 'L_scale_weight_yyx': 3.632838137679912e-08, 'learning_rate_yyx': 0.007517018531420024}. Best is trial 25 with value: -2.9771827108507383.
[I 2026-03-18 17:53:18,908] Trial 48 pruned. 
[I 2026-03-18 17:53:24,651] Trial 32 pruned. 
[I 2026-03-18 17:53:27,438] Trial 48 pruned. 
[I 2026-03-18 17:53:31,755] Trial 33 pruned. 
[I 2026-03-18 17:53:41,239] Trial 45 pruned. 
[I 2026-03-18 17:53:42,553] Trial 49 pruned. 

Source events: 20315
Target events: 40082
Full model ln_yyx : 3821.30810 nats/sec, 85.80354 nats/event
Full model Log loss : -2.95796
Full model ln_yyx : 3814.07068 nats/sec, 85.64103 nats/event
Full model Log loss : -2.91691
Full model ln_yyx : 3733.21730 nats/sec, 83.82555 nats/event
Full model Log loss : -2.82914
Full model ln_yyx : 3868.62829 nats/sec, 86.86606 nats/event
Full model Log loss : -2.94327
Full model ln_yyx : 3795.11153 nats/sec, 85.21532 nats/event
Full model Log loss : -2.91052
Full model ln_yyx : 3839.42500 nats/sec, 86.21033 nats/event
Full model Log loss : -2.94783
Full model ln_yyx : 3883.71318 nats/sec, 87.20478 nats/event
Full model Log loss : -2.94496
Full model ln_yyx : 3832.01227 nats/sec, 86.04389 nats/event
Full model Log loss : -2.94354
Full model ln_yyx : 3781.51541 nats/sec, 84.91003 nats/event
Full model Log loss : -2.90146
Full model ln_yyx : 3783.62055 nats/sec, 84.95730 nats/event
Full model Log loss : -2.90529
Full model ln_yyx : 3889.31813 nats/sec, 87.33063 nats/event
Full model Log loss : -2.97717
Full model ln_yyx : 3844.03087 nats/sec, 86.31375 nats/event
Full model Log loss : -2.96873
Full model ln_yyx : 3855.09028 nats/sec, 86.56208 nats/event
Full model Log loss : -2.96431
Full model ln_yyx : 3878.71779 nats/sec, 87.09261 nats/event
Full model Log loss : -2.96957
Full model ln_yyx : 3814.12830 nats/sec, 85.64232 nats/event
Full model Log loss : -2.96207
Optimization finished. Config saved to results/opt-full/opt_full_39_best_config.txt
[I 2026-03-18 17:53:44,072] Trial 38 pruned. 
[I 2026-03-18 17:53:46,417] Trial 34 pruned. 
[I 2026-03-18 17:53:48,014] Trial 46 pruned. 
[I 2026-03-18 17:53:51,029] Trial 39 pruned. 
[I 2026-03-18 17:53:52,932] Trial 35 pruned. 
[I 2026-03-18 17:54:04,589] Trial 30 finished with value: -2.9514814829862424 and parameters: {'n_layers_yyx': 2, 'hidden_size_yyx_l0': 4, 'hidden_size_yyx_l1': 5, 'context_size_yyx': 4, 'num_mix_components_yyx': 4, 'context_extractor_yyx': 'lstm', 'activation_func_yyx': 'ReLU', 'L2_weight_yyx': 5.735221352835036e-08, 'L_entropy_weight_yyx': 0.0002679782259238723, 'L_sep_weight_yyx': 0.000322153144977074, 'L_scale_weight_yyx': 0.0008994958456254166, 'learning_rate_yyx': 0.006567919078946737}. Best is trial 29 with value: -2.9659173901010147.
[I 2026-03-18 17:54:05,610] Trial 40 pruned. 
[I 2026-03-18 17:54:12,491] Trial 37 finished with value: -2.903162982220847 and parameters: {'n_layers_yyx': 1, 'hidden_size_yyx_l0': 6, 'context_size_yyx': 4, 'num_mix_components_yyx': 5, 'context_extractor_yyx': 'lstm', 'activation_func_yyx': 'GELU', 'L2_weight_yyx': 8.500997338109189e-08, 'L_entropy_weight_yyx': 5.671283687698519e-07, 'L_sep_weight_yyx': 9.91410692345234e-10, 'L_scale_weight_yyx': 0.00013073679219456082, 'learning_rate_yyx': 0.009350708818533338}. Best is trial 35 with value: -2.9708089664894204.
[I 2026-03-18 17:54:19,781] Trial 41 pruned. 
[I 2026-03-18 17:54:29,588] Trial 36 pruned. 
[I 2026-03-18 17:54:30,941] Trial 45 finished with value: -2.940917353165973 and parameters: {'n_layers_yyx': 2, 'hidden_size_yyx_l0': 6, 'hidden_size_yyx_l1': 5, 'context_size_yyx': 3, 'num_mix_components_yyx': 5, 'context_extractor_yyx': 'gru', 'activation_func_yyx': 'ReLU', 'L2_weight_yyx': 4.580211201407359e-08, 'L_entropy_weight_yyx': 5.8749732974703365e-08, 'L_sep_weight_yyx': 9.894161236378075e-06, 'L_scale_weight_yyx': 4.771610289204833e-10, 'learning_rate_yyx': 0.005324786107492782}. Best is trial 0 with value: -2.9702180140077377.
[I 2026-03-18 17:54:33,281] Trial 33 finished with value: -2.9669679227970462 and parameters: {'n_layers_yyx': 2, 'hidden_size_yyx_l0': 4, 'hidden_size_yyx_l1': 4, 'context_size_yyx': 2, 'num_mix_components_yyx': 4, 'context_extractor_yyx': 'gru', 'activation_func_yyx': 'Tanh', 'L2_weight_yyx': 2.5303445580201944e-07, 'L_entropy_weight_yyx': 2.2169497347221672e-05, 'L_sep_weight_yyx': 9.164098322812639e-07, 'L_scale_weight_yyx': 1.614826764018518e-05, 'learning_rate_yyx': 0.007759038869098851}. Best is trial 5 with value: -2.9729516240610265.
[I 2026-03-18 17:54:37,391] Trial 46 pruned. 
[I 2026-03-18 17:54:41,641] Trial 43 finished with value: -2.9467791597228787 and parameters: {'n_layers_yyx': 1, 'hidden_size_yyx_l0': 6, 'context_size_yyx': 4, 'num_mix_components_yyx': 5, 'context_extractor_yyx': 'gru', 'activation_func_yyx': 'Tanh', 'L2_weight_yyx': 5.23602810346376e-10, 'L_entropy_weight_yyx': 7.409231968029446e-05, 'L_sep_weight_yyx': 6.349508013418333e-10, 'L_scale_weight_yyx': 0.0002331677577977592, 'learning_rate_yyx': 0.008989767050496478}. Best is trial 36 with value: -2.9570429460965078.
[I 2026-03-18 17:54:43,748] Trial 37 pruned. 
[I 2026-03-18 17:54:44,005] Trial 47 pruned. 
[I 2026-03-18 17:54:58,094] Trial 48 pruned. 
[I 2026-03-18 17:55:02,300] Trial 49 pruned. 

Source events: 20315
Target events: 3403
Full model ln_yyx : 324.90564 nats/sec, 85.92862 nats/event
Full model Log loss : -2.97331
Full model ln_yyx : 321.67089 nats/sec, 85.07311 nats/event
Full model Log loss : -2.91398
Full model ln_yyx : 312.51212 nats/sec, 82.65087 nats/event
Full model Log loss : -2.81284
Full model ln_yyx : 317.94652 nats/sec, 84.08812 nats/event
Full model Log loss : -2.86157
Full model ln_yyx : 325.88496 nats/sec, 86.18762 nats/event
Full model Log loss : -2.94693
Full model ln_yyx : 326.56729 nats/sec, 86.36808 nats/event
Full model Log loss : -2.96210
Full model ln_yyx : 324.41064 nats/sec, 85.79770 nats/event
Full model Log loss : -2.93925
Full model ln_yyx : 327.29006 nats/sec, 86.55923 nats/event
Full model Log loss : -2.96591
Optimization finished. Config saved to results/opt-full/opt_full_37_best_config.txt
[I 2026-03-18 17:55:14,532] Trial 49 finished with value: -2.9617262786471508 and parameters: {'n_layers_yyx': 1, 'hidden_size_yyx_l0': 4, 'context_size_yyx': 4, 'num_mix_components_yyx': 5, 'context_extractor_yyx': 'gru', 'activation_func_yyx': 'Tanh', 'L2_weight_yyx': 4.575712298333818e-06, 'L_entropy_weight_yyx': 2.077974244484233e-08, 'L_sep_weight_yyx': 0.0001131242404011027, 'L_scale_weight_yyx': 4.630267672730589e-05, 'learning_rate_yyx': 0.006176806672298028}. Best is trial 45 with value: -2.9791716178278365.

Source events: 20315
Target events: 9421
Full model ln_yyx : 883.12662 nats/sec, 84.36620 nats/event
Full model Log loss : -2.88550
Full model ln_yyx : 893.57152 nats/sec, 85.36401 nats/event
Full model Log loss : -2.89828
Full model ln_yyx : 882.54510 nats/sec, 84.31065 nats/event
Full model Log loss : -2.85755
Full model ln_yyx : 905.40490 nats/sec, 86.49447 nats/event
Full model Log loss : -2.95596
Full model ln_yyx : 901.57098 nats/sec, 86.12821 nats/event
Full model Log loss : -2.91785
Full model ln_yyx : 909.05636 nats/sec, 86.84330 nats/event
Full model Log loss : -2.94950
Full model ln_yyx : 869.89553 nats/sec, 83.10222 nats/event
Full model Log loss : -2.81434
Full model ln_yyx : 886.51233 nats/sec, 84.68964 nats/event
Full model Log loss : -2.88609
Full model ln_yyx : 888.33995 nats/sec, 84.86423 nats/event
Full model Log loss : -2.88615
Full model ln_yyx : 891.08618 nats/sec, 85.12659 nats/event
Full model Log loss : -2.91172
Full model ln_yyx : 893.22807 nats/sec, 85.33120 nats/event
Full model Log loss : -2.90558
Full model ln_yyx : 890.04998 nats/sec, 85.02760 nats/event
Full model Log loss : -2.91325
Full model ln_yyx : 900.59103 nats/sec, 86.03460 nats/event
Full model Log loss : -2.95457
Full model ln_yyx : 904.99224 nats/sec, 86.45505 nats/event
Full model Log loss : -2.97917
Full model ln_yyx : 902.37015 nats/sec, 86.20456 nats/event
Full model Log loss : -2.96173
Optimization finished. Config saved to results/opt-full/opt_full_47_best_config.txt
[I 2026-03-18 17:55:21,861] Trial 35 finished with value: -2.965853184687027 and parameters: {'n_layers_yyx': 1, 'hidden_size_yyx_l0': 5, 'context_size_yyx': 4, 'num_mix_components_yyx': 2, 'context_extractor_yyx': 'lstm', 'activation_func_yyx': 'Tanh', 'L2_weight_yyx': 1.9472594156462226e-09, 'L_entropy_weight_yyx': 3.5295400846976116e-06, 'L_sep_weight_yyx': 0.00034899468761776333, 'L_scale_weight_yyx': 8.910021562526108e-09, 'learning_rate_yyx': 0.009995343472372622}. Best is trial 22 with value: -2.970223923614394.
[I 2026-03-18 17:55:27,569] Trial 44 finished with value: -2.980228733787979 and parameters: {'n_layers_yyx': 1, 'hidden_size_yyx_l0': 3, 'context_size_yyx': 3, 'num_mix_components_yyx': 5, 'context_extractor_yyx': 'lstm', 'activation_func_yyx': 'Tanh', 'L2_weight_yyx': 6.0074429124645006e-05, 'L_entropy_weight_yyx': 5.592719470579894e-10, 'L_sep_weight_yyx': 4.815990237676022e-05, 'L_scale_weight_yyx': 1.278978921378673e-09, 'learning_rate_yyx': 0.009007942649024159}. Best is trial 43 with value: -2.9834979774371218.
[I 2026-03-18 17:55:33,441] Trial 49 pruned. 

Source events: 20315
Target events: 16159
Full model ln_yyx : 1561.68143 nats/sec, 86.98021 nats/event
Full model Log loss : -2.97022
Full model ln_yyx : 1345.69435 nats/sec, 74.95049 nats/event
Full model Log loss : -2.47599
Full model ln_yyx : 1491.16889 nats/sec, 83.05291 nats/event
Full model Log loss : -2.85133
Full model ln_yyx : 1522.58001 nats/sec, 84.80240 nats/event
Full model Log loss : -2.89577
Full model ln_yyx : 1560.03700 nats/sec, 86.88863 nats/event
Full model Log loss : -2.96896
Full model ln_yyx : 1541.68570 nats/sec, 85.86652 nats/event
Full model Log loss : -2.96058
Full model ln_yyx : 1555.97962 nats/sec, 86.66264 nats/event
Full model Log loss : -2.96862
Full model ln_yyx : 1524.92992 nats/sec, 84.93328 nats/event
Full model Log loss : -2.92033
Full model ln_yyx : 1548.32882 nats/sec, 86.23652 nats/event
Full model Log loss : -2.95861
Full model ln_yyx : 1558.03135 nats/sec, 86.77692 nats/event
Full model Log loss : -2.93934
Full model ln_yyx : 1539.80012 nats/sec, 85.76150 nats/event
Full model Log loss : -2.94092
Optimization finished. Config saved to results/opt-full/opt_full_50_best_config.txt
[I 2026-03-18 17:55:39,169] Trial 47 finished with value: -2.9468019978902706 and parameters: {'n_layers_yyx': 2, 'hidden_size_yyx_l0': 5, 'hidden_size_yyx_l1': 5, 'context_size_yyx': 4, 'num_mix_components_yyx': 3, 'context_extractor_yyx': 'gru', 'activation_func_yyx': 'GELU', 'L2_weight_yyx': 8.569948952248327e-08, 'L_entropy_weight_yyx': 5.902211207635631e-09, 'L_sep_weight_yyx': 0.0004219284648226851, 'L_scale_weight_yyx': 1.852809553832435e-08, 'learning_rate_yyx': 0.007852945077958706}. Best is trial 22 with value: -2.9660620215680944.
[I 2026-03-18 17:55:44,746] Trial 31 finished with value: -2.9516588327443425 and parameters: {'n_layers_yyx': 2, 'hidden_size_yyx_l0': 4, 'hidden_size_yyx_l1': 5, 'context_size_yyx': 4, 'num_mix_components_yyx': 4, 'context_extractor_yyx': 'lstm', 'activation_func_yyx': 'ReLU', 'L2_weight_yyx': 4.051172731339274e-08, 'L_entropy_weight_yyx': 0.00034508081861435235, 'L_sep_weight_yyx': 0.00027381208946461883, 'L_scale_weight_yyx': 0.0008923216359795514, 'learning_rate_yyx': 0.007212788244019569}. Best is trial 29 with value: -2.9659173901010147.
[I 2026-03-18 17:55:45,547] Trial 48 pruned. 
[I 2026-03-18 17:55:51,026] Trial 32 pruned. 
[I 2026-03-18 17:56:01,568] Trial 45 pruned. 
[I 2026-03-18 17:56:02,833] Trial 38 finished with value: -2.9379843087297397 and parameters: {'n_layers_yyx': 2, 'hidden_size_yyx_l0': 5, 'hidden_size_yyx_l1': 5, 'context_size_yyx': 4, 'num_mix_components_yyx': 5, 'context_extractor_yyx': 'gru', 'activation_func_yyx': 'ReLU', 'L2_weight_yyx': 1.2684966040710938e-07, 'L_entropy_weight_yyx': 2.0152495637995997e-07, 'L_sep_weight_yyx': 2.997747288562663e-10, 'L_scale_weight_yyx': 1.807736595537897e-08, 'learning_rate_yyx': 0.007881912572115478}. Best is trial 35 with value: -2.9708089664894204.
[I 2026-03-18 17:56:07,192] Trial 44 finished with value: -2.9460547712194276 and parameters: {'n_layers_yyx': 1, 'hidden_size_yyx_l0': 6, 'context_size_yyx': 4, 'num_mix_components_yyx': 5, 'context_extractor_yyx': 'gru', 'activation_func_yyx': 'Tanh', 'L2_weight_yyx': 5.910464718626964e-10, 'L_entropy_weight_yyx': 9.624505814386346e-05, 'L_sep_weight_yyx': 6.318501439375067e-10, 'L_scale_weight_yyx': 0.0009983497367019665, 'learning_rate_yyx': 0.008859241310885837}. Best is trial 36 with value: -2.9570429460965078.
[I 2026-03-18 17:56:08,734] Trial 39 pruned. 
[I 2026-03-18 17:56:14,579] Trial 40 pruned. 
[I 2026-03-18 17:56:20,297] Trial 49 pruned. 

Source events: 20315
Target events: 29032
Full model ln_yyx : 2370.56326 nats/sec, 73.48811 nats/event
Full model Log loss : -2.35773
Full model ln_yyx : 2745.55802 nats/sec, 85.11306 nats/event
Full model Log loss : -2.90057
Full model ln_yyx : 2761.51614 nats/sec, 85.60776 nats/event
Full model Log loss : -2.94147
Full model ln_yyx : 2756.23504 nats/sec, 85.44405 nats/event
Full model Log loss : -2.92254
Full model ln_yyx : 2769.63141 nats/sec, 85.85934 nats/event
Full model Log loss : -2.93129
Full model ln_yyx : 2789.37243 nats/sec, 86.47131 nats/event
Full model Log loss : -2.95012
Full model ln_yyx : 2781.83868 nats/sec, 86.23777 nats/event
Full model Log loss : -2.96318
Full model ln_yyx : 2777.67783 nats/sec, 86.10878 nats/event
Full model Log loss : -2.95565
Full model ln_yyx : 2816.95681 nats/sec, 87.32644 nats/event
Full model Log loss : -2.96606
Full model ln_yyx : 2760.02411 nats/sec, 85.56151 nats/event
Full model Log loss : -2.94186
Full model ln_yyx : 2807.64326 nats/sec, 87.03771 nats/event
Full model Log loss : -2.94680
Optimization finished. Config saved to results/opt-full/opt_full_38_best_config.txt
[I 2026-03-18 17:56:20,878] Trial 45 pruned. 
[I 2026-03-18 17:56:22,704] Trial 38 pruned. 
[I 2026-03-18 17:56:25,391] Trial 33 pruned. 
[I 2026-03-18 17:56:27,386] Trial 41 pruned. 
[I 2026-03-18 17:56:28,543] Trial 39 pruned. 
[I 2026-03-18 17:56:31,247] Trial 34 pruned. 
[I 2026-03-18 17:56:34,371] Trial 40 pruned. 
[I 2026-03-18 17:56:34,594] Trial 42 finished with value: -2.9635659206773197 and parameters: {'n_layers_yyx': 1, 'hidden_size_yyx_l0': 5, 'context_size_yyx': 4, 'num_mix_components_yyx': 3, 'context_extractor_yyx': 'gru', 'activation_func_yyx': 'GELU', 'L2_weight_yyx': 1.1957287046128721e-09, 'L_entropy_weight_yyx': 3.663335743234397e-08, 'L_sep_weight_yyx': 2.1505521076952507e-07, 'L_scale_weight_yyx': 3.187244220150589e-05, 'learning_rate_yyx': 0.0077021439517238385}. Best is trial 24 with value: -2.9676210496741837.
[I 2026-03-18 17:56:44,094] Trial 35 pruned. 
[I 2026-03-18 17:56:47,483] Trial 43 pruned. 
[I 2026-03-18 17:56:55,062] Trial 46 pruned. 
[I 2026-03-18 17:56:57,529] Trial 36 pruned. 
[I 2026-03-18 17:56:59,793] Trial 36 pruned. 
[I 2026-03-18 17:57:03,391] Trial 37 pruned. 
[I 2026-03-18 17:57:03,544] Trial 34 finished with value: -2.9659763621092754 and parameters: {'n_layers_yyx': 2, 'hidden_size_yyx_l0': 4, 'hidden_size_yyx_l1': 4, 'context_size_yyx': 2, 'num_mix_components_yyx': 4, 'context_extractor_yyx': 'gru', 'activation_func_yyx': 'Tanh', 'L2_weight_yyx': 2.3893578494107086e-07, 'L_entropy_weight_yyx': 1.3749705066390729e-05, 'L_sep_weight_yyx': 1.429624298819875e-06, 'L_scale_weight_yyx': 1.5810062025764698e-05, 'learning_rate_yyx': 0.00805164463069419}. Best is trial 5 with value: -2.9729516240610265.
[I 2026-03-18 17:57:08,029] Trial 41 pruned. 
[I 2026-03-18 17:57:09,197] Trial 35 pruned. 
[I 2026-03-18 17:57:09,548] Trial 38 pruned. 
[I 2026-03-18 17:57:14,921] Trial 36 pruned. 
[I 2026-03-18 17:57:20,452] Trial 37 pruned. 
[I 2026-03-18 17:57:20,699] Trial 42 pruned. 
[I 2026-03-18 17:57:21,591] Trial 44 pruned. 
[I 2026-03-18 17:57:26,865] Trial 38 pruned. 
[I 2026-03-18 17:57:31,744] Trial 37 pruned. 
[I 2026-03-18 17:57:32,485] Trial 39 pruned. 
[I 2026-03-18 17:57:33,714] Trial 43 pruned. 
[I 2026-03-18 17:57:34,598] Trial 45 pruned. 
[I 2026-03-18 17:57:36,293] Trial 46 pruned. 
[I 2026-03-18 17:57:38,328] Trial 40 pruned. 
[I 2026-03-18 17:57:42,616] Trial 39 pruned. 
[I 2026-03-18 17:57:48,671] Trial 40 pruned. 
[I 2026-03-18 17:57:57,935] Trial 42 finished with value: -2.9706796902099364 and parameters: {'n_layers_yyx': 1, 'hidden_size_yyx_l0': 6, 'context_size_yyx': 4, 'num_mix_components_yyx': 5, 'context_extractor_yyx': 'lstm', 'activation_func_yyx': 'ReLU', 'L2_weight_yyx': 1.4045862198195967e-08, 'L_entropy_weight_yyx': 1.3136936987461451e-08, 'L_sep_weight_yyx': 6.591358776567107e-10, 'L_scale_weight_yyx': 2.3282467332246575e-05, 'learning_rate_yyx': 0.008110769252262192}. Best is trial 35 with value: -2.9708089664894204.
[I 2026-03-18 17:58:04,971] Trial 38 pruned. 
[I 2026-03-18 17:58:07,024] Trial 44 pruned. 
[I 2026-03-18 17:58:07,765] Trial 46 pruned. 
[I 2026-03-18 17:58:08,484] Trial 47 pruned. 
[I 2026-03-18 17:58:18,555] Trial 39 pruned. 
[I 2026-03-18 17:58:19,552] Trial 45 pruned. 
[I 2026-03-18 17:58:21,108] Trial 47 pruned. 
[I 2026-03-18 17:58:21,312] Trial 48 pruned. 
[I 2026-03-18 17:58:27,207] Trial 48 pruned. 
[I 2026-03-18 17:58:30,303] Trial 47 pruned. 
