[I 2026-03-18 16:30:51,112] Trial 19 pruned. 
[I 2026-03-18 16:30:51,272] Trial 24 pruned. 
[I 2026-03-18 16:30:51,640] Trial 25 pruned. 
[I 2026-03-18 16:30:51,799] Trial 15 pruned. 
[I 2026-03-18 16:30:52,096] Trial 12 pruned. 
[I 2026-03-18 16:30:52,464] Trial 13 pruned. 
[I 2026-03-18 16:30:52,573] Trial 18 pruned. 
[I 2026-03-18 16:30:55,041] Trial 26 pruned. 
[I 2026-03-18 16:30:55,068] Trial 13 pruned. 
[I 2026-03-18 16:30:55,355] Trial 16 pruned. 
[I 2026-03-18 16:30:55,514] Trial 24 pruned. 
[I 2026-03-18 16:30:55,763] Trial 14 pruned. 
[I 2026-03-18 16:30:55,803] Trial 19 pruned. 
[I 2026-03-18 16:30:56,773] Trial 11 pruned. 
[I 2026-03-18 16:30:56,934] Trial 15 finished with value: -0.4042332415979344 and parameters: {'n_layers_yyx': 1, 'hidden_size_yyx_l0': 3, 'context_size_yyx': 3, 'num_mix_components_yyx': 2, 'context_extractor_yyx': 'lstm', 'activation_func_yyx': 'ReLU', 'L2_weight_yyx': 6.033291958047065e-06, 'L_entropy_weight_yyx': 1.1373307311964233e-09, 'L_sep_weight_yyx': 3.537458500807753e-07, 'L_scale_weight_yyx': 1.2075356227617456e-07, 'learning_rate_yyx': 0.003151874103152952}. Best is trial 1 with value: -0.43281404005115615.
[I 2026-03-18 16:30:57,809] Trial 21 pruned. 
[I 2026-03-18 16:30:59,594] Trial 3 pruned. 
[I 2026-03-18 16:31:00,288] Trial 16 pruned. 
[I 2026-03-18 16:31:00,311] Trial 12 pruned. 
[I 2026-03-18 16:31:01,988] Trial 17 pruned. 
[I 2026-03-18 16:31:02,204] Trial 20 pruned. 
[I 2026-03-18 16:31:05,121] Trial 21 pruned. 
[I 2026-03-18 16:31:06,125] Trial 13 pruned. 
[I 2026-03-18 16:31:06,330] Trial 4 pruned. 
[I 2026-03-18 16:31:08,414] Trial 11 finished with value: -0.3953570906222789 and parameters: {'n_layers_yyx': 1, 'hidden_size_yyx_l0': 4, 'context_size_yyx': 3, 'num_mix_components_yyx': 4, 'context_extractor_yyx': 'gru', 'activation_func_yyx': 'Tanh', 'L2_weight_yyx': 8.701418585653652e-05, 'L_entropy_weight_yyx': 5.688736498710305e-06, 'L_sep_weight_yyx': 0.0005915711510200406, 'L_scale_weight_yyx': 4.1232819439809e-06, 'learning_rate_yyx': 0.009112395229515197}. Best is trial 9 with value: -0.4271615326589106.
[I 2026-03-18 16:31:08,882] Trial 18 pruned. 
[I 2026-03-18 16:31:10,917] Trial 15 pruned. 
[I 2026-03-18 16:31:11,732] Trial 22 pruned. 
[I 2026-03-18 16:31:12,494] Trial 19 pruned. 
[I 2026-03-18 16:31:14,263] Trial 5 pruned. 
[I 2026-03-18 16:31:14,532] Trial 25 finished with value: -0.3675374837113608 and parameters: {'n_layers_yyx': 2, 'hidden_size_yyx_l0': 4, 'hidden_size_yyx_l1': 4, 'context_size_yyx': 3, 'num_mix_components_yyx': 1, 'context_extractor_yyx': 'gru', 'activation_func_yyx': 'ReLU', 'L2_weight_yyx': 1.1066843037598989e-08, 'L_entropy_weight_yyx': 0.00020789156965584147, 'L_sep_weight_yyx': 4.1596210872575155e-10, 'L_scale_weight_yyx': 3.789553465864658e-09, 'learning_rate_yyx': 0.007871727955646212}. Best is trial 1 with value: -0.44267641427716237.
[I 2026-03-18 16:31:15,029] Trial 12 pruned. 
[I 2026-03-18 16:31:15,896] Trial 20 pruned. 
[I 2026-03-18 16:31:19,155] Trial 22 finished with value: -0.4127115066575561 and parameters: {'n_layers_yyx': 1, 'hidden_size_yyx_l0': 6, 'context_size_yyx': 3, 'num_mix_components_yyx': 5, 'context_extractor_yyx': 'gru', 'activation_func_yyx': 'Tanh', 'L2_weight_yyx': 1.6592631669164142e-05, 'L_entropy_weight_yyx': 3.134415268518125e-05, 'L_sep_weight_yyx': 0.00013579313377671995, 'L_scale_weight_yyx': 7.048255055439272e-08, 'learning_rate_yyx': 0.0039606717748055815}. Best is trial 0 with value: -0.41448025068631483.
[I 2026-03-18 16:31:24,375] Trial 6 finished with value: -0.4410483062082769 and parameters: {'n_layers_yyx': 2, 'hidden_size_yyx_l0': 2, 'hidden_size_yyx_l1': 5, 'context_size_yyx': 4, 'num_mix_components_yyx': 5, 'context_extractor_yyx': 'lstm', 'activation_func_yyx': 'GELU', 'L2_weight_yyx': 6.366739305533509e-10, 'L_entropy_weight_yyx': 1.9698841707479795e-08, 'L_sep_weight_yyx': 1.0433532489718315e-07, 'L_scale_weight_yyx': 9.325664967130786e-07, 'learning_rate_yyx': 0.0023279097172650785}. Best is trial 5 with value: -0.44982475540586303.
[I 2026-03-18 16:31:26,635] Trial 23 pruned. 
[I 2026-03-18 16:31:26,831] Trial 16 pruned. 
[I 2026-03-18 16:31:27,968] Trial 7 pruned. 
[I 2026-03-18 16:31:30,023] Trial 20 finished with value: -0.425445556640625 and parameters: {'n_layers_yyx': 2, 'hidden_size_yyx_l0': 6, 'hidden_size_yyx_l1': 5, 'context_size_yyx': 4, 'num_mix_components_yyx': 2, 'context_extractor_yyx': 'lstm', 'activation_func_yyx': 'Tanh', 'L2_weight_yyx': 0.00010277050270180479, 'L_entropy_weight_yyx': 1.4962082280047828e-09, 'L_sep_weight_yyx': 1.5216704932714103e-08, 'L_scale_weight_yyx': 1.4791384377603862e-09, 'learning_rate_yyx': 0.00200556382448843}. Best is trial 1 with value: -0.44041338941261127.
[I 2026-03-18 16:31:30,224] Trial 26 pruned. 
[I 2026-03-18 16:31:30,749] Trial 14 finished with value: -0.3894151622665925 and parameters: {'n_layers_yyx': 1, 'hidden_size_yyx_l0': 4, 'context_size_yyx': 3, 'num_mix_components_yyx': 5, 'context_extractor_yyx': 'lstm', 'activation_func_yyx': 'Tanh', 'L2_weight_yyx': 3.891690610997292e-06, 'L_entropy_weight_yyx': 1.8940898421498524e-07, 'L_sep_weight_yyx': 1.3392123691917468e-10, 'L_scale_weight_yyx': 2.071779491064708e-09, 'learning_rate_yyx': 0.009573611787811739}. Best is trial 0 with value: -0.42020291071558147.
[I 2026-03-18 16:31:31,139] Trial 8 pruned. 
[I 2026-03-18 16:31:31,375] Trial 13 pruned. 
[I 2026-03-18 16:31:33,069] Trial 6 pruned. 
[I 2026-03-18 16:31:33,098] Trial 25 finished with value: -0.3914630759980287 and parameters: {'n_layers_yyx': 2, 'hidden_size_yyx_l0': 2, 'hidden_size_yyx_l1': 3, 'context_size_yyx': 3, 'num_mix_components_yyx': 5, 'context_extractor_yyx': 'lstm', 'activation_func_yyx': 'GELU', 'L2_weight_yyx': 1.5957547044523616e-08, 'L_entropy_weight_yyx': 6.088755188091726e-09, 'L_sep_weight_yyx': 2.597082810123635e-06, 'L_scale_weight_yyx': 6.040812673622918e-10, 'learning_rate_yyx': 0.005917860590502496}. Best is trial 25 with value: -0.3914630759980287.
[I 2026-03-18 16:31:34,094] Trial 17 finished with value: -0.373567681563528 and parameters: {'n_layers_yyx': 2, 'hidden_size_yyx_l0': 5, 'hidden_size_yyx_l1': 4, 'context_size_yyx': 2, 'num_mix_components_yyx': 2, 'context_extractor_yyx': 'gru', 'activation_func_yyx': 'Tanh', 'L2_weight_yyx': 1.3125636729478923e-10, 'L_entropy_weight_yyx': 3.3422715290084776e-08, 'L_sep_weight_yyx': 2.1826441649578573e-09, 'L_scale_weight_yyx': 2.693766787701085e-10, 'learning_rate_yyx': 0.006975490056668733}. Best is trial 1 with value: -0.43281404005115615.
[I 2026-03-18 16:31:34,838] Trial 14 pruned. 
[I 2026-03-18 16:31:36,516] Trial 15 pruned. 
[I 2026-03-18 16:31:37,119] Trial 21 finished with value: -0.43066897554663314 and parameters: {'n_layers_yyx': 2, 'hidden_size_yyx_l0': 6, 'hidden_size_yyx_l1': 5, 'context_size_yyx': 2, 'num_mix_components_yyx': 5, 'context_extractor_yyx': 'lstm', 'activation_func_yyx': 'Tanh', 'L2_weight_yyx': 3.1634592021674697e-06, 'L_entropy_weight_yyx': 1.6622258567478386e-10, 'L_sep_weight_yyx': 4.015975652791237e-08, 'L_scale_weight_yyx': 8.229664967453465e-07, 'learning_rate_yyx': 0.003012254402340604}. Best is trial 7 with value: -0.44963234349300985.
[I 2026-03-18 16:31:37,619] Trial 18 pruned. 
[I 2026-03-18 16:31:37,758] Trial 9 pruned. 
[I 2026-03-18 16:31:37,816] Trial 14 pruned. 
[I 2026-03-18 16:31:38,390] Trial 8 finished with value: -0.4356537337642705 and parameters: {'n_layers_yyx': 2, 'hidden_size_yyx_l0': 2, 'hidden_size_yyx_l1': 6, 'context_size_yyx': 1, 'num_mix_components_yyx': 4, 'context_extractor_yyx': 'lstm', 'activation_func_yyx': 'Tanh', 'L2_weight_yyx': 1.8766971840411137e-09, 'L_entropy_weight_yyx': 7.059407280552405e-10, 'L_sep_weight_yyx': 3.746051811225904e-09, 'L_scale_weight_yyx': 1.958424612745286e-10, 'learning_rate_yyx': 0.002486504834335364}. Best is trial 1 with value: -0.45911608244243424.
[I 2026-03-18 16:31:40,755] Trial 23 finished with value: -0.4099525947688903 and parameters: {'n_layers_yyx': 1, 'hidden_size_yyx_l0': 2, 'context_size_yyx': 3, 'num_mix_components_yyx': 3, 'context_extractor_yyx': 'lstm', 'activation_func_yyx': 'ReLU', 'L2_weight_yyx': 6.74474515476181e-10, 'L_entropy_weight_yyx': 1.937352129885711e-06, 'L_sep_weight_yyx': 1.827186918750638e-07, 'L_scale_weight_yyx': 7.403809991995246e-07, 'learning_rate_yyx': 0.0050107985841936365}. Best is trial 4 with value: -0.43761569280004353.
[I 2026-03-18 16:31:41,167] Trial 9 finished with value: -0.430995315221072 and parameters: {'n_layers_yyx': 2, 'hidden_size_yyx_l0': 4, 'hidden_size_yyx_l1': 6, 'context_size_yyx': 1, 'num_mix_components_yyx': 1, 'context_extractor_yyx': 'gru', 'activation_func_yyx': 'Tanh', 'L2_weight_yyx': 4.719754678903519e-10, 'L_entropy_weight_yyx': 3.905478778504837e-09, 'L_sep_weight_yyx': 3.8296665286681126e-05, 'L_scale_weight_yyx': 1.395582711567221e-06, 'learning_rate_yyx': 0.0036009287755452276}. Best is trial 9 with value: -0.430995315221072.
[I 2026-03-18 16:31:41,292] Trial 7 pruned. 
[I 2026-03-18 16:31:41,718] Trial 15 pruned. 
[I 2026-03-18 16:31:41,973] Trial 9 pruned. 
[I 2026-03-18 16:31:43,492] Trial 19 pruned. 
[I 2026-03-18 16:31:43,701] Trial 24 finished with value: -0.412091990373452 and parameters: {'n_layers_yyx': 1, 'hidden_size_yyx_l0': 6, 'context_size_yyx': 2, 'num_mix_components_yyx': 4, 'context_extractor_yyx': 'gru', 'activation_func_yyx': 'Tanh', 'L2_weight_yyx': 2.626580340474651e-05, 'L_entropy_weight_yyx': 4.584342816249785e-07, 'L_sep_weight_yyx': 7.379889089121039e-06, 'L_scale_weight_yyx': 4.466675070617068e-07, 'learning_rate_yyx': 0.006548285481065648}. Best is trial 0 with value: -0.41448025068631483.
[I 2026-03-18 16:31:43,766] Trial 24 pruned. 
[I 2026-03-18 16:31:45,039] Trial 16 pruned. 
[I 2026-03-18 16:31:45,459] Trial 10 pruned. 
[I 2026-03-18 16:31:45,562] Trial 21 pruned. 
[I 2026-03-18 16:31:46,818] Trial 20 pruned. 
[I 2026-03-18 16:31:46,848] Trial 25 pruned. 
[I 2026-03-18 16:31:47,194] Trial 4 finished with value: -2.770821090115232 and parameters: {'n_layers_yyx': 2, 'hidden_size_yyx_l0': 3, 'hidden_size_yyx_l1': 2, 'context_size_yyx': 4, 'num_mix_components_yyx': 4, 'context_extractor_yyx': 'gru', 'activation_func_yyx': 'GELU', 'L2_weight_yyx': 5.063549195684648e-08, 'L_entropy_weight_yyx': 5.517081403014982e-09, 'L_sep_weight_yyx': 0.0004016917436945943, 'L_scale_weight_yyx': 3.774052936810994e-07, 'learning_rate_yyx': 0.0008362620563543962}. Best is trial 0 with value: -2.7945694753775014.
[I 2026-03-18 16:31:48,600] Trial 17 pruned. 
[I 2026-03-18 16:31:49,257] Trial 8 pruned. 
[I 2026-03-18 16:31:49,971] Trial 26 pruned. 
[I 2026-03-18 16:31:49,980] Trial 15 pruned. 
[I 2026-03-18 16:31:50,098] Trial 25 pruned. 
[I 2026-03-18 16:31:51,944] Trial 2 finished with value: -2.795571655733778 and parameters: {'n_layers_yyx': 1, 'hidden_size_yyx_l0': 3, 'context_size_yyx': 1, 'num_mix_components_yyx': 3, 'context_extractor_yyx': 'lstm', 'activation_func_yyx': 'Tanh', 'L2_weight_yyx': 1.1561217163824675e-07, 'L_entropy_weight_yyx': 2.2023856530309354e-07, 'L_sep_weight_yyx': 2.0031462304264593e-10, 'L_scale_weight_yyx': 3.458248572692021e-08, 'learning_rate_yyx': 0.0057959472098858085}. Best is trial 2 with value: -2.795571655733778.
[I 2026-03-18 16:31:52,158] Trial 1 pruned. 
[I 2026-03-18 16:31:52,488] Trial 22 pruned. 
[I 2026-03-18 16:31:53,107] Trial 16 pruned. 
[I 2026-03-18 16:31:53,728] Trial 21 pruned. 
[I 2026-03-18 16:31:56,325] Trial 26 pruned. 
[I 2026-03-18 16:31:56,373] Trial 27 pruned. 
[I 2026-03-18 16:31:59,206] Trial 17 finished with value: -0.46708542200803016 and parameters: {'n_layers_yyx': 1, 'hidden_size_yyx_l0': 6, 'context_size_yyx': 3, 'num_mix_components_yyx': 4, 'context_extractor_yyx': 'lstm', 'activation_func_yyx': 'GELU', 'L2_weight_yyx': 0.0008153529160539292, 'L_entropy_weight_yyx': 5.380048184555183e-09, 'L_sep_weight_yyx': 8.914874397720807e-08, 'L_scale_weight_yyx': 6.936958727054193e-08, 'learning_rate_yyx': 0.008605691071621992}. Best is trial 17 with value: -0.46708542200803016.
[I 2026-03-18 16:31:59,638] Trial 26 finished with value: -0.42678166912067045 and parameters: {'n_layers_yyx': 2, 'hidden_size_yyx_l0': 3, 'hidden_size_yyx_l1': 3, 'context_size_yyx': 3, 'num_mix_components_yyx': 4, 'context_extractor_yyx': 'gru', 'activation_func_yyx': 'Tanh', 'L2_weight_yyx': 3.863337292003702e-09, 'L_entropy_weight_yyx': 6.342052892841685e-10, 'L_sep_weight_yyx': 7.589695468518276e-05, 'L_scale_weight_yyx': 5.643717362617803e-10, 'learning_rate_yyx': 0.008677553896574498}. Best is trial 26 with value: -0.42678166912067045.
[I 2026-03-18 16:31:59,647] Trial 17 pruned. 
[I 2026-03-18 16:31:59,825] Trial 22 finished with value: -0.4400104251070288 and parameters: {'n_layers_yyx': 2, 'hidden_size_yyx_l0': 6, 'hidden_size_yyx_l1': 5, 'context_size_yyx': 2, 'num_mix_components_yyx': 5, 'context_extractor_yyx': 'lstm', 'activation_func_yyx': 'Tanh', 'L2_weight_yyx': 1.3925448882274711e-06, 'L_entropy_weight_yyx': 1.4798984746794237e-10, 'L_sep_weight_yyx': 3.804639346760632e-08, 'L_scale_weight_yyx': 1.5608560862423146e-06, 'learning_rate_yyx': 0.002736277999607469}. Best is trial 7 with value: -0.44963234349300985.
[I 2026-03-18 16:31:59,967] Trial 27 pruned. 
[I 2026-03-18 16:32:00,004] Trial 3 pruned. 
[I 2026-03-18 16:32:00,091] Trial 28 pruned. 
[I 2026-03-18 16:32:00,272] Trial 22 pruned. 
[I 2026-03-18 16:32:01,936] Trial 6 finished with value: -2.8030962312773586 and parameters: {'n_layers_yyx': 1, 'hidden_size_yyx_l0': 6, 'context_size_yyx': 3, 'num_mix_components_yyx': 2, 'context_extractor_yyx': 'lstm', 'activation_func_yyx': 'Tanh', 'L2_weight_yyx': 2.9313226592116858e-08, 'L_entropy_weight_yyx': 1.2975557793183987e-09, 'L_sep_weight_yyx': 0.0004797662808614136, 'L_scale_weight_yyx': 0.00017588147800272686, 'learning_rate_yyx': 0.006010580362134471}. Best is trial 1 with value: -2.8044746609917057.
[I 2026-03-18 16:32:02,598] Trial 18 pruned. 
[I 2026-03-18 16:32:03,440] Trial 29 pruned. 
[I 2026-03-18 16:32:03,808] Trial 1 finished with value: -2.794794619613311 and parameters: {'n_layers_yyx': 2, 'hidden_size_yyx_l0': 3, 'hidden_size_yyx_l1': 4, 'context_size_yyx': 2, 'num_mix_components_yyx': 4, 'context_extractor_yyx': 'lstm', 'activation_func_yyx': 'GELU', 'L2_weight_yyx': 5.157711453914026e-08, 'L_entropy_weight_yyx': 4.5408723293075954e-07, 'L_sep_weight_yyx': 1.07672925697542e-07, 'L_scale_weight_yyx': 0.00017354915994585393, 'learning_rate_yyx': 0.006824276012518846}. Best is trial 1 with value: -2.794794619613311.
[I 2026-03-18 16:32:06,127] Trial 27 finished with value: -0.3898024189951988 and parameters: {'n_layers_yyx': 2, 'hidden_size_yyx_l0': 3, 'hidden_size_yyx_l1': 6, 'context_size_yyx': 4, 'num_mix_components_yyx': 2, 'context_extractor_yyx': 'gru', 'activation_func_yyx': 'Tanh', 'L2_weight_yyx': 9.795837310065329e-09, 'L_entropy_weight_yyx': 6.844382470228354e-06, 'L_sep_weight_yyx': 7.0684089012751176e-09, 'L_scale_weight_yyx': 8.421867415598592e-06, 'learning_rate_yyx': 0.0026244772001018765}. Best is trial 1 with value: -0.44267641427716237.
[I 2026-03-18 16:32:06,385] Trial 23 pruned. 
[I 2026-03-18 16:32:07,074] Trial 23 pruned. 
[I 2026-03-18 16:32:07,309] Trial 9 pruned. 
[I 2026-03-18 16:32:14,297] Trial 27 finished with value: -0.4490980969124903 and parameters: {'n_layers_yyx': 2, 'hidden_size_yyx_l0': 2, 'hidden_size_yyx_l1': 6, 'context_size_yyx': 3, 'num_mix_components_yyx': 1, 'context_extractor_yyx': 'gru', 'activation_func_yyx': 'Tanh', 'L2_weight_yyx': 0.00023224074489477855, 'L_entropy_weight_yyx': 5.953221343499127e-09, 'L_sep_weight_yyx': 3.307220183719589e-10, 'L_scale_weight_yyx': 1.197726907208522e-06, 'learning_rate_yyx': 0.0018342873956789247}. Best is trial 27 with value: -0.4490980969124903.
[I 2026-03-18 16:32:15,464] Trial 18 pruned. 
[I 2026-03-18 16:32:15,534] Trial 16 finished with value: -0.42072478019785214 and parameters: {'n_layers_yyx': 1, 'hidden_size_yyx_l0': 4, 'context_size_yyx': 2, 'num_mix_components_yyx': 5, 'context_extractor_yyx': 'lstm', 'activation_func_yyx': 'ReLU', 'L2_weight_yyx': 3.3018130945345914e-09, 'L_entropy_weight_yyx': 2.660093297958653e-09, 'L_sep_weight_yyx': 5.318157614083247e-06, 'L_scale_weight_yyx': 7.907834801964699e-07, 'learning_rate_yyx': 0.0052130027184982}. Best is trial 16 with value: -0.42072478019785214.
[I 2026-03-18 16:32:17,631] Trial 28 pruned. 
[I 2026-03-18 16:32:18,514] Trial 19 pruned. 
[I 2026-03-18 16:32:18,564] Trial 17 pruned. 
[I 2026-03-18 16:32:20,314] Trial 7 pruned. 
[I 2026-03-18 16:32:21,145] Trial 10 pruned. 
[I 2026-03-18 16:32:21,437] Trial 23 finished with value: -0.42190802134227456 and parameters: {'n_layers_yyx': 2, 'hidden_size_yyx_l0': 5, 'hidden_size_yyx_l1': 5, 'context_size_yyx': 3, 'num_mix_components_yyx': 2, 'context_extractor_yyx': 'lstm', 'activation_func_yyx': 'Tanh', 'L2_weight_yyx': 3.8641382673699705e-07, 'L_entropy_weight_yyx': 5.091973326344736e-08, 'L_sep_weight_yyx': 1.4879450154241778e-09, 'L_scale_weight_yyx': 1.0101140870566173e-10, 'learning_rate_yyx': 0.005926605829440481}. Best is trial 1 with value: -0.44041338941261127.
[I 2026-03-18 16:32:21,550] Trial 27 finished with value: -0.42307737368179177 and parameters: {'n_layers_yyx': 2, 'hidden_size_yyx_l0': 3, 'hidden_size_yyx_l1': 3, 'context_size_yyx': 3, 'num_mix_components_yyx': 4, 'context_extractor_yyx': 'gru', 'activation_func_yyx': 'Tanh', 'L2_weight_yyx': 5.603376660719691e-09, 'L_entropy_weight_yyx': 2.731716263486539e-10, 'L_sep_weight_yyx': 1.685642197012991e-07, 'L_scale_weight_yyx': 9.820633957860298e-10, 'learning_rate_yyx': 0.009985268384482814}. Best is trial 26 with value: -0.42678166912067045.
[I 2026-03-18 16:32:21,722] Trial 20 pruned. 
[I 2026-03-18 16:32:21,966] Trial 19 pruned. 
[I 2026-03-18 16:32:22,461] Trial 18 pruned. 
[I 2026-03-18 16:32:22,475] Trial 24 pruned. 
[I 2026-03-18 16:32:24,815] Trial 11 pruned. 
[I 2026-03-18 16:32:25,288] Trial 21 pruned. 
[I 2026-03-18 16:32:25,521] Trial 20 pruned. 
[I 2026-03-18 16:32:28,175] Trial 1 finished with value: -2.8037735806844215 and parameters: {'n_layers_yyx': 1, 'hidden_size_yyx_l0': 4, 'context_size_yyx': 4, 'num_mix_components_yyx': 2, 'context_extractor_yyx': 'gru', 'activation_func_yyx': 'GELU', 'L2_weight_yyx': 9.36885953006221e-06, 'L_entropy_weight_yyx': 3.5302440608198165e-09, 'L_sep_weight_yyx': 1.2919163749012346e-07, 'L_scale_weight_yyx': 3.647567240262011e-08, 'learning_rate_yyx': 0.006216347229311733}. Best is trial 1 with value: -2.8037735806844215.
[I 2026-03-18 16:32:28,432] Trial 24 pruned. 
[I 2026-03-18 16:32:28,734] Trial 22 pruned. 
[I 2026-03-18 16:32:29,144] Trial 21 pruned. 
[I 2026-03-18 16:32:29,198] Trial 19 pruned. 
[I 2026-03-18 16:32:30,359] Trial 11 finished with value: -0.4126914765443595 and parameters: {'n_layers_yyx': 2, 'hidden_size_yyx_l0': 4, 'hidden_size_yyx_l1': 4, 'context_size_yyx': 3, 'num_mix_components_yyx': 3, 'context_extractor_yyx': 'lstm', 'activation_func_yyx': 'ReLU', 'L2_weight_yyx': 9.122967041587491e-08, 'L_entropy_weight_yyx': 0.0008800726095330577, 'L_sep_weight_yyx': 1.5112803022943481e-07, 'L_scale_weight_yyx': 2.4679902305765115e-08, 'learning_rate_yyx': 0.004312761280227984}. Best is trial 1 with value: -0.45911608244243424.
[I 2026-03-18 16:32:30,823] Trial 12 pruned. 
[I 2026-03-18 16:32:31,635] Trial 24 finished with value: -0.40877677043525057 and parameters: {'n_layers_yyx': 2, 'hidden_size_yyx_l0': 6, 'hidden_size_yyx_l1': 5, 'context_size_yyx': 3, 'num_mix_components_yyx': 5, 'context_extractor_yyx': 'lstm', 'activation_func_yyx': 'Tanh', 'L2_weight_yyx': 3.099409912327768e-07, 'L_entropy_weight_yyx': 8.069294686694365e-10, 'L_sep_weight_yyx': 4.58332517592531e-08, 'L_scale_weight_yyx': 1.558690947035777e-07, 'learning_rate_yyx': 0.0025596853255691297}. Best is trial 7 with value: -0.44963234349300985.
[I 2026-03-18 16:32:31,795] Trial 23 pruned. 
[I 2026-03-18 16:32:32,335] Trial 22 pruned. 
[I 2026-03-18 16:32:32,472] Trial 20 pruned. 
[I 2026-03-18 16:32:33,137] Trial 29 pruned. 
[I 2026-03-18 16:32:33,651] Trial 12 pruned. 
[I 2026-03-18 16:32:35,322] Trial 24 pruned. 
[I 2026-03-18 16:32:37,253] Trial 13 pruned. 
[I 2026-03-18 16:32:38,561] Trial 25 pruned. 
[I 2026-03-18 16:32:38,740] Trial 25 pruned. 
[I 2026-03-18 16:32:38,740] Trial 23 pruned. 
[I 2026-03-18 16:32:38,990] Trial 21 pruned. 
[I 2026-03-18 16:32:40,079] Trial 30 pruned. 
[I 2026-03-18 16:32:40,196] Trial 13 pruned. 
[I 2026-03-18 16:32:40,928] Trial 14 pruned. 
[I 2026-03-18 16:32:42,175] Trial 22 pruned. 
[I 2026-03-18 16:32:42,393] Trial 28 finished with value: -0.4252559319369195 and parameters: {'n_layers_yyx': 1, 'hidden_size_yyx_l0': 4, 'context_size_yyx': 3, 'num_mix_components_yyx': 1, 'context_extractor_yyx': 'lstm', 'activation_func_yyx': 'GELU', 'L2_weight_yyx': 5.24484288358495e-07, 'L_entropy_weight_yyx': 1.9840089960951983e-08, 'L_sep_weight_yyx': 2.2779634226198995e-06, 'L_scale_weight_yyx': 8.31219266179765e-09, 'learning_rate_yyx': 0.0070943830121377284}. Best is trial 1 with value: -0.44267641427716237.
[I 2026-03-18 16:32:43,501] Trial 31 pruned. 
[I 2026-03-18 16:32:45,403] Trial 24 pruned. 
[I 2026-03-18 16:32:45,510] Trial 5 finished with value: -2.7758619185335864 and parameters: {'n_layers_yyx': 2, 'hidden_size_yyx_l0': 6, 'hidden_size_yyx_l1': 6, 'context_size_yyx': 1, 'num_mix_components_yyx': 5, 'context_extractor_yyx': 'lstm', 'activation_func_yyx': 'Tanh', 'L2_weight_yyx': 2.0820521180206715e-06, 'L_entropy_weight_yyx': 5.508552974903627e-05, 'L_sep_weight_yyx': 3.5880325110954145e-09, 'L_scale_weight_yyx': 0.0006974680438304943, 'learning_rate_yyx': 0.007282441039360331}. Best is trial 0 with value: -2.7945694753775014.
[I 2026-03-18 16:32:45,746] Trial 29 pruned. 
[I 2026-03-18 16:32:46,313] Trial 30 pruned. 
[I 2026-03-18 16:32:46,500] Trial 32 pruned. 
[I 2026-03-18 16:32:47,203] Trial 15 pruned. 
