[I 2026-03-18 18:47:26,861] Trial 3 finished with value: -2.766124988596948 and parameters: {'n_layers_yyx': 1, 'hidden_size_yyx_l0': 3, 'context_size_yyx': 1, 'num_mix_components_yyx': 4, 'context_extractor_yyx': 'gru', 'activation_func_yyx': 'GELU', 'L2_weight_yyx': 2.0853878899040665e-05, 'L_entropy_weight_yyx': 7.435132469985868e-08, 'L_sep_weight_yyx': 1.2977820492652144e-05, 'L_scale_weight_yyx': 0.0002406062688886182, 'learning_rate_yyx': 0.006570060321910442}. Best is trial 3 with value: -2.766124988596948.
[I 2026-03-18 18:47:30,026] Trial 3 finished with value: -0.8038585668476504 and parameters: {'n_layers_yyx': 1, 'hidden_size_yyx_l0': 2, 'context_size_yyx': 2, 'num_mix_components_yyx': 1, 'context_extractor_yyx': 'lstm', 'activation_func_yyx': 'ReLU', 'L2_weight_yyx': 1.2283734266822795e-05, 'L_entropy_weight_yyx': 8.72235536107745e-05, 'L_sep_weight_yyx': 1.049266851512824e-08, 'L_scale_weight_yyx': 1.2398224866481098e-08, 'learning_rate_yyx': 0.001777850525272532}. Best is trial 0 with value: -0.8087707474453587.
[I 2026-03-18 18:47:38,543] Trial 8 finished with value: -2.39264415508053 and parameters: {'n_layers_yyx': 2, 'hidden_size_yyx_l0': 5, 'hidden_size_yyx_l1': 3, 'context_size_yyx': 2, 'num_mix_components_yyx': 5, 'context_extractor_yyx': 'gru', 'activation_func_yyx': 'Tanh', 'L2_weight_yyx': 1.3849995296700914e-07, 'L_entropy_weight_yyx': 1.526420532498642e-10, 'L_sep_weight_yyx': 2.8082000682145224e-09, 'L_scale_weight_yyx': 0.0005626297060385092, 'learning_rate_yyx': 0.005918850699555876}. Best is trial 0 with value: -2.4076941594397367.
[I 2026-03-18 18:47:45,008] Trial 1 finished with value: -2.76558573285036 and parameters: {'n_layers_yyx': 2, 'hidden_size_yyx_l0': 3, 'hidden_size_yyx_l1': 2, 'context_size_yyx': 3, 'num_mix_components_yyx': 5, 'context_extractor_yyx': 'lstm', 'activation_func_yyx': 'ReLU', 'L2_weight_yyx': 2.559870567375597e-06, 'L_entropy_weight_yyx': 0.0007586804620817149, 'L_sep_weight_yyx': 0.0002526644588560035, 'L_scale_weight_yyx': 2.1128876639300076e-08, 'learning_rate_yyx': 0.002767203080444155}. Best is trial 1 with value: -2.76558573285036.
[I 2026-03-18 18:47:52,457] Trial 2 pruned. 
[I 2026-03-18 18:47:54,262] Trial 15 pruned. 
[I 2026-03-18 18:48:02,575] Trial 4 pruned. 
[I 2026-03-18 18:48:14,568] Trial 2 finished with value: -2.7647061180279695 and parameters: {'n_layers_yyx': 1, 'hidden_size_yyx_l0': 6, 'context_size_yyx': 4, 'num_mix_components_yyx': 3, 'context_extractor_yyx': 'gru', 'activation_func_yyx': 'ReLU', 'L2_weight_yyx': 3.950636539648232e-06, 'L_entropy_weight_yyx': 9.730759542600378e-09, 'L_sep_weight_yyx': 5.2157835816354074e-06, 'L_scale_weight_yyx': 3.090663844369726e-07, 'learning_rate_yyx': 0.0027743084636687957}. Best is trial 2 with value: -2.7647061180279695.
[I 2026-03-18 18:48:25,150] Trial 3 pruned. 
[I 2026-03-18 18:48:29,003] Trial 4 finished with value: -2.3972043478681697 and parameters: {'n_layers_yyx': 2, 'hidden_size_yyx_l0': 5, 'hidden_size_yyx_l1': 2, 'context_size_yyx': 1, 'num_mix_components_yyx': 2, 'context_extractor_yyx': 'lstm', 'activation_func_yyx': 'ReLU', 'L2_weight_yyx': 7.097964907496566e-08, 'L_entropy_weight_yyx': 4.008540886992344e-07, 'L_sep_weight_yyx': 6.5152635695594205e-09, 'L_scale_weight_yyx': 6.462591726217968e-05, 'learning_rate_yyx': 0.0028640457221516267}. Best is trial 0 with value: -2.431222564426635.
[I 2026-03-18 18:48:32,242] Trial 16 pruned. 
[I 2026-03-18 18:48:32,414] Trial 3 pruned. 
[I 2026-03-18 18:48:34,094] Trial 4 pruned. 
[I 2026-03-18 18:48:36,088] Trial 5 pruned. 
[I 2026-03-18 18:48:41,788] Trial 3 pruned. 
[I 2026-03-18 18:48:50,030] Trial 4 pruned. 
[I 2026-03-18 18:49:01,222] Trial 2 finished with value: -2.7621158440907796 and parameters: {'n_layers_yyx': 2, 'hidden_size_yyx_l0': 5, 'hidden_size_yyx_l1': 4, 'context_size_yyx': 1, 'num_mix_components_yyx': 2, 'context_extractor_yyx': 'lstm', 'activation_func_yyx': 'GELU', 'L2_weight_yyx': 5.161218251369141e-09, 'L_entropy_weight_yyx': 8.078693746588035e-07, 'L_sep_weight_yyx': 2.5946515004694957e-07, 'L_scale_weight_yyx': 5.878492107262465e-06, 'learning_rate_yyx': 0.0014109593854014536}. Best is trial 1 with value: -2.7655291239420574.
[I 2026-03-18 18:49:15,466] Trial 17 pruned. 
[I 2026-03-18 18:49:17,081] Trial 4 pruned. 
[I 2026-03-18 18:49:25,305] Trial 4 pruned. 
[I 2026-03-18 18:49:31,436] Trial 4 pruned. 
[I 2026-03-18 18:49:54,862] Trial 18 pruned. 
[I 2026-03-18 18:49:59,096] Trial 5 pruned. 
[I 2026-03-18 18:50:03,265] Trial 5 pruned. 
[I 2026-03-18 18:50:07,146] Trial 2 finished with value: -2.3583619885566907 and parameters: {'n_layers_yyx': 2, 'hidden_size_yyx_l0': 6, 'hidden_size_yyx_l1': 3, 'context_size_yyx': 2, 'num_mix_components_yyx': 4, 'context_extractor_yyx': 'gru', 'activation_func_yyx': 'GELU', 'L2_weight_yyx': 1.1558442881909214e-06, 'L_entropy_weight_yyx': 0.0005152317447589951, 'L_sep_weight_yyx': 0.00020803754579831757, 'L_scale_weight_yyx': 2.532831628693757e-10, 'learning_rate_yyx': 0.0034505803682848813}. Best is trial 1 with value: -2.393392615685096.
[I 2026-03-18 18:50:08,759] Trial 2 finished with value: -2.407757820050741 and parameters: {'n_layers_yyx': 2, 'hidden_size_yyx_l0': 3, 'hidden_size_yyx_l1': 5, 'context_size_yyx': 4, 'num_mix_components_yyx': 1, 'context_extractor_yyx': 'gru', 'activation_func_yyx': 'ReLU', 'L2_weight_yyx': 2.8971663206896853e-06, 'L_entropy_weight_yyx': 1.4906693585131417e-07, 'L_sep_weight_yyx': 1.3400815511091424e-09, 'L_scale_weight_yyx': 2.2196801076688224e-09, 'learning_rate_yyx': 0.005875939523402825}. Best is trial 2 with value: -2.407757820050741.
[I 2026-03-18 18:50:24,670] Trial 9 pruned. 
[I 2026-03-18 18:50:31,284] Trial 2 finished with value: -2.7610655187550894 and parameters: {'n_layers_yyx': 1, 'hidden_size_yyx_l0': 6, 'context_size_yyx': 3, 'num_mix_components_yyx': 4, 'context_extractor_yyx': 'gru', 'activation_func_yyx': 'Tanh', 'L2_weight_yyx': 2.363362460480754e-05, 'L_entropy_weight_yyx': 1.6598156198952763e-09, 'L_sep_weight_yyx': 0.00018998074772250115, 'L_scale_weight_yyx': 5.15763007840696e-10, 'learning_rate_yyx': 0.002266932348546651}. Best is trial 1 with value: -2.762434471701954.
[I 2026-03-18 18:50:48,377] Trial 5 pruned. 
[I 2026-03-18 18:51:08,658] Trial 4 finished with value: -0.8236861799457048 and parameters: {'n_layers_yyx': 1, 'hidden_size_yyx_l0': 6, 'context_size_yyx': 3, 'num_mix_components_yyx': 3, 'context_extractor_yyx': 'lstm', 'activation_func_yyx': 'ReLU', 'L2_weight_yyx': 2.3146661094116155e-05, 'L_entropy_weight_yyx': 9.492305254764095e-05, 'L_sep_weight_yyx': 2.394244477206685e-05, 'L_scale_weight_yyx': 1.506098021054564e-10, 'learning_rate_yyx': 0.0009153931182932813}. Best is trial 4 with value: -0.8236861799457048.
[I 2026-03-18 18:51:09,902] Trial 6 pruned. 
[I 2026-03-18 18:51:14,775] Trial 3 pruned. 
[I 2026-03-18 18:51:21,153] Trial 6 pruned. 
[I 2026-03-18 18:51:21,918] Trial 2 finished with value: -2.76191821212689 and parameters: {'n_layers_yyx': 1, 'hidden_size_yyx_l0': 6, 'context_size_yyx': 4, 'num_mix_components_yyx': 5, 'context_extractor_yyx': 'lstm', 'activation_func_yyx': 'Tanh', 'L2_weight_yyx': 4.058127059961517e-06, 'L_entropy_weight_yyx': 5.521873593314682e-10, 'L_sep_weight_yyx': 4.731221026965791e-06, 'L_scale_weight_yyx': 0.00010091222079301058, 'learning_rate_yyx': 0.0029258080754376815}. Best is trial 0 with value: -2.7660925649378423.
[I 2026-03-18 18:51:47,087] Trial 10 pruned. 
[I 2026-03-18 18:52:02,793] Trial 2 finished with value: -2.7638839154171033 and parameters: {'n_layers_yyx': 1, 'hidden_size_yyx_l0': 3, 'context_size_yyx': 3, 'num_mix_components_yyx': 5, 'context_extractor_yyx': 'gru', 'activation_func_yyx': 'ReLU', 'L2_weight_yyx': 1.6711611494304762e-09, 'L_entropy_weight_yyx': 1.0545602130099072e-09, 'L_sep_weight_yyx': 1.2159145638891056e-06, 'L_scale_weight_yyx': 1.551308264430786e-09, 'learning_rate_yyx': 0.0014244441324669523}. Best is trial 2 with value: -2.7638839154171033.
[I 2026-03-18 18:52:03,867] Trial 3 pruned. 
[I 2026-03-18 18:52:04,398] Trial 5 pruned. 
[I 2026-03-18 18:52:12,119] Trial 4 finished with value: -2.393031095621557 and parameters: {'n_layers_yyx': 2, 'hidden_size_yyx_l0': 6, 'hidden_size_yyx_l1': 5, 'context_size_yyx': 3, 'num_mix_components_yyx': 4, 'context_extractor_yyx': 'gru', 'activation_func_yyx': 'GELU', 'L2_weight_yyx': 1.8032777950890898e-08, 'L_entropy_weight_yyx': 3.745490905467662e-10, 'L_sep_weight_yyx': 0.00037034362054331094, 'L_scale_weight_yyx': 3.223814078267778e-05, 'learning_rate_yyx': 0.006626883141288314}. Best is trial 4 with value: -2.393031095621557.
[I 2026-03-18 18:52:14,101] Trial 7 pruned. 
[I 2026-03-18 18:52:14,207] Trial 5 pruned. 
[I 2026-03-18 18:52:26,382] Trial 3 pruned. 
[I 2026-03-18 18:52:42,283] Trial 3 pruned. 
[I 2026-03-18 18:52:46,652] Trial 4 pruned. 
[I 2026-03-18 18:53:00,926] Trial 2 finished with value: -2.4109094575005234 and parameters: {'n_layers_yyx': 2, 'hidden_size_yyx_l0': 6, 'hidden_size_yyx_l1': 3, 'context_size_yyx': 1, 'num_mix_components_yyx': 2, 'context_extractor_yyx': 'lstm', 'activation_func_yyx': 'GELU', 'L2_weight_yyx': 1.887674848436299e-06, 'L_entropy_weight_yyx': 9.065627963934373e-10, 'L_sep_weight_yyx': 0.00019216989055628278, 'L_scale_weight_yyx': 3.472119824622199e-05, 'learning_rate_yyx': 0.0035467354341598262}. Best is trial 2 with value: -2.4109094575005234.
[I 2026-03-18 18:53:07,868] Trial 11 pruned. 
[I 2026-03-18 18:53:26,462] Trial 2 finished with value: -0.8019417969831864 and parameters: {'n_layers_yyx': 2, 'hidden_size_yyx_l0': 3, 'hidden_size_yyx_l1': 5, 'context_size_yyx': 1, 'num_mix_components_yyx': 1, 'context_extractor_yyx': 'gru', 'activation_func_yyx': 'ReLU', 'L2_weight_yyx': 1.3971136171148533e-09, 'L_entropy_weight_yyx': 1.845253412513826e-06, 'L_sep_weight_yyx': 1.5957170984966985e-08, 'L_scale_weight_yyx': 3.3959927382121204e-09, 'learning_rate_yyx': 0.0032861932114920177}. Best is trial 0 with value: -0.8180432904242061.
[I 2026-03-18 18:53:33,385] Trial 3 finished with value: -2.359373763646835 and parameters: {'n_layers_yyx': 2, 'hidden_size_yyx_l0': 2, 'hidden_size_yyx_l1': 6, 'context_size_yyx': 2, 'num_mix_components_yyx': 5, 'context_extractor_yyx': 'lstm', 'activation_func_yyx': 'GELU', 'L2_weight_yyx': 1.5031347305731865e-09, 'L_entropy_weight_yyx': 1.564161792191135e-09, 'L_sep_weight_yyx': 8.370818428236488e-07, 'L_scale_weight_yyx': 1.7370496308759388e-07, 'learning_rate_yyx': 0.009805853464059761}. Best is trial 1 with value: -2.393392615685096.
[I 2026-03-18 18:53:41,202] Trial 3 pruned. 
[I 2026-03-18 18:53:49,012] Trial 12 pruned. 
[I 2026-03-18 18:53:50,404] Trial 4 finished with value: -2.72974927570022 and parameters: {'n_layers_yyx': 2, 'hidden_size_yyx_l0': 2, 'hidden_size_yyx_l1': 2, 'context_size_yyx': 3, 'num_mix_components_yyx': 2, 'context_extractor_yyx': 'gru', 'activation_func_yyx': 'GELU', 'L2_weight_yyx': 4.123741804227087e-09, 'L_entropy_weight_yyx': 7.947429025577185e-09, 'L_sep_weight_yyx': 9.61040588269212e-06, 'L_scale_weight_yyx': 0.0009504059149550673, 'learning_rate_yyx': 0.0013415916379674834}. Best is trial 2 with value: -2.762987867182404.
[I 2026-03-18 18:53:59,215] Trial 3 pruned. 
[I 2026-03-18 18:54:04,139] Trial 3 finished with value: -2.7657987594604494 and parameters: {'n_layers_yyx': 2, 'hidden_size_yyx_l0': 4, 'hidden_size_yyx_l1': 5, 'context_size_yyx': 3, 'num_mix_components_yyx': 3, 'context_extractor_yyx': 'gru', 'activation_func_yyx': 'Tanh', 'L2_weight_yyx': 2.910894148836457e-06, 'L_entropy_weight_yyx': 1.1934819033020574e-08, 'L_sep_weight_yyx': 9.139688530203267e-07, 'L_scale_weight_yyx': 0.0009711446378006417, 'learning_rate_yyx': 0.009593845607025189}. Best is trial 3 with value: -2.7657987594604494.
[I 2026-03-18 18:54:27,179] Trial 9 finished with value: -2.3949321905364127 and parameters: {'n_layers_yyx': 2, 'hidden_size_yyx_l0': 3, 'hidden_size_yyx_l1': 5, 'context_size_yyx': 3, 'num_mix_components_yyx': 5, 'context_extractor_yyx': 'lstm', 'activation_func_yyx': 'Tanh', 'L2_weight_yyx': 4.214055932990697e-09, 'L_entropy_weight_yyx': 0.00022831709641505318, 'L_sep_weight_yyx': 1.0635070026643645e-05, 'L_scale_weight_yyx': 7.814945678359585e-08, 'learning_rate_yyx': 0.005711712682815645}. Best is trial 0 with value: -2.4076941594397367.
[I 2026-03-18 18:54:31,227] Trial 5 pruned. 
[I 2026-03-18 18:54:35,239] Trial 4 pruned. 
[I 2026-03-18 18:54:49,180] Trial 4 pruned. 
[I 2026-03-18 18:55:02,017] Trial 3 pruned. 
[I 2026-03-18 18:55:08,401] Trial 5 pruned. 
[I 2026-03-18 18:55:20,227] Trial 19 finished with value: -2.7345542892776726 and parameters: {'n_layers_yyx': 2, 'hidden_size_yyx_l0': 5, 'hidden_size_yyx_l1': 3, 'context_size_yyx': 4, 'num_mix_components_yyx': 3, 'context_extractor_yyx': 'gru', 'activation_func_yyx': 'Tanh', 'L2_weight_yyx': 0.00012087099261500668, 'L_entropy_weight_yyx': 0.0007121863826340056, 'L_sep_weight_yyx': 1.0040640220213372e-05, 'L_scale_weight_yyx': 2.1174647361098733e-06, 'learning_rate_yyx': 0.007790706076754023}. Best is trial 1 with value: -2.7617047121530724.
[I 2026-03-18 18:55:24,644] Trial 2 finished with value: -2.7657870500891577 and parameters: {'n_layers_yyx': 1, 'hidden_size_yyx_l0': 5, 'context_size_yyx': 1, 'num_mix_components_yyx': 4, 'context_extractor_yyx': 'lstm', 'activation_func_yyx': 'Tanh', 'L2_weight_yyx': 5.4347513576869425e-06, 'L_entropy_weight_yyx': 6.789528000473286e-10, 'L_sep_weight_yyx': 3.818813123260454e-09, 'L_scale_weight_yyx': 2.0052360371911253e-10, 'learning_rate_yyx': 0.0009465601539847312}. Best is trial 2 with value: -2.7657870500891577.
[I 2026-03-18 18:55:40,878] Trial 5 pruned. 
[I 2026-03-18 18:55:51,325] Trial 6 pruned. 
[I 2026-03-18 18:55:54,269] Trial 10 pruned. 
[I 2026-03-18 18:55:56,327] Trial 4 pruned. 
[I 2026-03-18 18:56:03,052] Trial 2 finished with value: -2.7646987045677798 and parameters: {'n_layers_yyx': 1, 'hidden_size_yyx_l0': 2, 'context_size_yyx': 1, 'num_mix_components_yyx': 4, 'context_extractor_yyx': 'lstm', 'activation_func_yyx': 'ReLU', 'L2_weight_yyx': 3.304063021949438e-10, 'L_entropy_weight_yyx': 0.0002149697670173382, 'L_sep_weight_yyx': 3.60155088647482e-05, 'L_scale_weight_yyx': 3.219355500025248e-08, 'learning_rate_yyx': 0.008933373809000418}. Best is trial 1 with value: -2.76558573285036.
[I 2026-03-18 18:56:05,273] Trial 8 finished with value: -0.8140652880534816 and parameters: {'n_layers_yyx': 2, 'hidden_size_yyx_l0': 4, 'hidden_size_yyx_l1': 4, 'context_size_yyx': 4, 'num_mix_components_yyx': 5, 'context_extractor_yyx': 'gru', 'activation_func_yyx': 'ReLU', 'L2_weight_yyx': 4.237618611257058e-06, 'L_entropy_weight_yyx': 7.079401680965702e-09, 'L_sep_weight_yyx': 0.0007192557944238994, 'L_scale_weight_yyx': 3.824735645050183e-06, 'learning_rate_yyx': 0.00877347944817742}. Best is trial 1 with value: -0.8307161542478305.
[I 2026-03-18 18:56:16,523] Trial 3 pruned. 
[I 2026-03-18 18:56:28,999] Trial 6 pruned. 
[I 2026-03-18 18:56:36,336] Trial 5 pruned. 
[I 2026-03-18 18:56:41,654] Trial 5 pruned. 
[I 2026-03-18 18:56:42,199] Trial 4 finished with value: -2.72512448786136 and parameters: {'n_layers_yyx': 1, 'hidden_size_yyx_l0': 4, 'context_size_yyx': 2, 'num_mix_components_yyx': 1, 'context_extractor_yyx': 'lstm', 'activation_func_yyx': 'Tanh', 'L2_weight_yyx': 7.143118253989061e-10, 'L_entropy_weight_yyx': 0.00012878398666512503, 'L_sep_weight_yyx': 2.3792414178417175e-05, 'L_scale_weight_yyx': 1.322253870360832e-09, 'learning_rate_yyx': 0.0036777023295338335}. Best is trial 1 with value: -2.762434471701954.
[I 2026-03-18 18:56:48,687] Trial 5 pruned. 
[I 2026-03-18 18:56:50,567] Trial 3 pruned. 
[I 2026-03-18 18:57:06,993] Trial 7 pruned. 
[I 2026-03-18 18:57:12,654] Trial 9 pruned. 
[I 2026-03-18 18:57:20,424] Trial 11 pruned. 
[I 2026-03-18 18:57:29,576] Trial 2 finished with value: -0.7704842819597028 and parameters: {'n_layers_yyx': 1, 'hidden_size_yyx_l0': 2, 'context_size_yyx': 2, 'num_mix_components_yyx': 1, 'context_extractor_yyx': 'gru', 'activation_func_yyx': 'GELU', 'L2_weight_yyx': 3.2496884761870046e-05, 'L_entropy_weight_yyx': 9.838661996467761e-06, 'L_sep_weight_yyx': 2.619772285740222e-10, 'L_scale_weight_yyx': 1.0141222200157764e-07, 'learning_rate_yyx': 0.0008896127402815418}. Best is trial 0 with value: -0.843539329540078.
[I 2026-03-18 18:57:36,568] Trial 7 pruned. 
[I 2026-03-18 18:57:39,975] Trial 4 pruned. 
[I 2026-03-18 18:57:48,908] Trial 6 finished with value: -2.7646931561671635 and parameters: {'n_layers_yyx': 2, 'hidden_size_yyx_l0': 6, 'hidden_size_yyx_l1': 5, 'context_size_yyx': 3, 'num_mix_components_yyx': 4, 'context_extractor_yyx': 'lstm', 'activation_func_yyx': 'Tanh', 'L2_weight_yyx': 0.0004803185209688028, 'L_entropy_weight_yyx': 1.6703737459394434e-08, 'L_sep_weight_yyx': 5.145019047748041e-05, 'L_scale_weight_yyx': 0.00035017500851899973, 'learning_rate_yyx': 0.006644236833921138}. Best is trial 3 with value: -2.764943250652336.
[I 2026-03-18 18:57:55,468] Trial 13 pruned. 
[I 2026-03-18 18:57:59,631] Trial 4 pruned. 
[I 2026-03-18 18:58:04,519] Trial 2 finished with value: -2.534330211065047 and parameters: {'n_layers_yyx': 1, 'hidden_size_yyx_l0': 2, 'context_size_yyx': 4, 'num_mix_components_yyx': 3, 'context_extractor_yyx': 'lstm', 'activation_func_yyx': 'ReLU', 'L2_weight_yyx': 9.673396508908127e-09, 'L_entropy_weight_yyx': 1.062459485673181e-09, 'L_sep_weight_yyx': 1.457831530635989e-10, 'L_scale_weight_yyx': 9.719899970071075e-06, 'learning_rate_yyx': 0.004791990179823302}. Best is trial 1 with value: -2.5400440164613816.
[I 2026-03-18 18:58:05,637] Trial 3 finished with value: -2.391103680390164 and parameters: {'n_layers_yyx': 1, 'hidden_size_yyx_l0': 2, 'context_size_yyx': 4, 'num_mix_components_yyx': 1, 'context_extractor_yyx': 'lstm', 'activation_func_yyx': 'Tanh', 'L2_weight_yyx': 3.761162639649847e-06, 'L_entropy_weight_yyx': 9.748687959616714e-10, 'L_sep_weight_yyx': 2.9570623476525396e-08, 'L_scale_weight_yyx': 2.0172058066342302e-05, 'learning_rate_yyx': 0.0012141483641304974}. Best is trial 2 with value: -2.39978509736055.
[I 2026-03-18 18:58:14,610] Trial 7 finished with value: -2.7627564206624338 and parameters: {'n_layers_yyx': 1, 'hidden_size_yyx_l0': 6, 'context_size_yyx': 1, 'num_mix_components_yyx': 2, 'context_extractor_yyx': 'lstm', 'activation_func_yyx': 'GELU', 'L2_weight_yyx': 1.8177648206346027e-06, 'L_entropy_weight_yyx': 0.0001166373279674224, 'L_sep_weight_yyx': 9.605814649314479e-09, 'L_scale_weight_yyx': 3.5051439303583684e-05, 'learning_rate_yyx': 0.004309945755241694}. Best is trial 1 with value: -2.766161832317774.
[I 2026-03-18 18:58:24,661] Trial 5 pruned. 
[I 2026-03-18 18:58:38,192] Trial 7 finished with value: -2.3485195665474397 and parameters: {'n_layers_yyx': 2, 'hidden_size_yyx_l0': 2, 'hidden_size_yyx_l1': 2, 'context_size_yyx': 4, 'num_mix_components_yyx': 2, 'context_extractor_yyx': 'gru', 'activation_func_yyx': 'ReLU', 'L2_weight_yyx': 3.772623207575369e-08, 'L_entropy_weight_yyx': 2.022768853255986e-06, 'L_sep_weight_yyx': 3.909283186130696e-10, 'L_scale_weight_yyx': 1.264926930542744e-10, 'learning_rate_yyx': 0.0005724950715645591}. Best is trial 0 with value: -2.4017951846031065.
[I 2026-03-18 18:58:39,015] Trial 7 pruned. 
[I 2026-03-18 18:58:40,260] Trial 6 pruned. 
[I 2026-03-18 18:58:41,596] Trial 12 pruned. 
[I 2026-03-18 18:58:44,022] Trial 6 pruned. 
[I 2026-03-18 18:58:45,013] Trial 14 pruned. 
[I 2026-03-18 18:58:45,167] Trial 5 pruned. 
[I 2026-03-18 18:59:00,278] Trial 8 pruned. 
[I 2026-03-18 18:59:03,948] Trial 6 pruned. 
[I 2026-03-18 18:59:05,697] Trial 9 finished with value: -2.7994139496934944 and parameters: {'n_layers_yyx': 1, 'hidden_size_yyx_l0': 3, 'context_size_yyx': 3, 'num_mix_components_yyx': 5, 'context_extractor_yyx': 'lstm', 'activation_func_yyx': 'Tanh', 'L2_weight_yyx': 3.525840788138366e-09, 'L_entropy_weight_yyx': 1.6073246379839426e-06, 'L_sep_weight_yyx': 1.496384242182745e-10, 'L_scale_weight_yyx': 1.1859603140419148e-08, 'learning_rate_yyx': 0.0014752215723304193}. Best is trial 0 with value: -2.8001684201127572.
[I 2026-03-18 18:59:19,705] Trial 8 pruned. 
[I 2026-03-18 18:59:20,666] Trial 5 pruned. 
[I 2026-03-18 18:59:25,439] Trial 13 pruned. 
[I 2026-03-18 18:59:26,187] Trial 7 pruned. 
[I 2026-03-18 18:59:27,207] Trial 3 pruned. 
[I 2026-03-18 18:59:27,251] Trial 8 pruned. 
[I 2026-03-18 18:59:39,390] Trial 7 pruned. 
[I 2026-03-18 18:59:49,817] Trial 9 pruned. 
[I 2026-03-18 18:59:59,330] Trial 6 finished with value: -2.765753874961334 and parameters: {'n_layers_yyx': 2, 'hidden_size_yyx_l0': 6, 'hidden_size_yyx_l1': 6, 'context_size_yyx': 2, 'num_mix_components_yyx': 5, 'context_extractor_yyx': 'gru', 'activation_func_yyx': 'Tanh', 'L2_weight_yyx': 0.0006029196867544781, 'L_entropy_weight_yyx': 0.00020848561075578168, 'L_sep_weight_yyx': 2.3754603421657652e-08, 'L_scale_weight_yyx': 0.000884169901332623, 'learning_rate_yyx': 0.004039685630874686}. Best is trial 0 with value: -2.7678615354442075.
[I 2026-03-18 19:00:04,774] Trial 10 pruned. 
[I 2026-03-18 19:00:07,212] Trial 6 pruned. 
[I 2026-03-18 19:00:09,913] Trial 3 pruned. 
[I 2026-03-18 19:00:10,779] Trial 4 pruned. 
[I 2026-03-18 19:00:33,032] Trial 4 finished with value: -2.7628401630895185 and parameters: {'n_layers_yyx': 2, 'hidden_size_yyx_l0': 4, 'hidden_size_yyx_l1': 6, 'context_size_yyx': 4, 'num_mix_components_yyx': 5, 'context_extractor_yyx': 'lstm', 'activation_func_yyx': 'Tanh', 'L2_weight_yyx': 5.414179464774314e-08, 'L_entropy_weight_yyx': 1.571607164760481e-10, 'L_sep_weight_yyx': 2.4655386244756018e-05, 'L_scale_weight_yyx': 1.536606559141358e-07, 'learning_rate_yyx': 0.0016250281917572675}. Best is trial 2 with value: -2.7638839154171033.
[I 2026-03-18 19:00:41,529] Trial 10 pruned. 
[I 2026-03-18 19:00:46,645] Trial 14 pruned. 
[I 2026-03-18 19:00:49,396] Trial 8 pruned. 
[I 2026-03-18 19:00:53,824] Trial 5 pruned. 
