[I 2026-03-18 17:24:13,759] Trial 12 pruned. 
[I 2026-03-18 17:24:14,914] Trial 32 finished with value: -0.5732199184832252 and parameters: {'n_layers_yyx': 1, 'hidden_size_yyx_l0': 3, 'context_size_yyx': 4, 'num_mix_components_yyx': 3, 'context_extractor_yyx': 'gru', 'activation_func_yyx': 'Tanh', 'L2_weight_yyx': 2.554937151651705e-10, 'L_entropy_weight_yyx': 5.1443722609257115e-05, 'L_sep_weight_yyx': 1.2008619461600346e-09, 'L_scale_weight_yyx': 2.7420586164975795e-08, 'learning_rate_yyx': 0.007607646975403733}. Best is trial 23 with value: -0.5844188202198138.
[I 2026-03-18 17:24:16,230] Trial 28 finished with value: -0.566847033808943 and parameters: {'n_layers_yyx': 1, 'hidden_size_yyx_l0': 5, 'context_size_yyx': 2, 'num_mix_components_yyx': 3, 'context_extractor_yyx': 'gru', 'activation_func_yyx': 'ReLU', 'L2_weight_yyx': 3.331681385950057e-07, 'L_entropy_weight_yyx': 0.00026124353751955104, 'L_sep_weight_yyx': 2.7392095343410007e-09, 'L_scale_weight_yyx': 4.625742854108378e-09, 'learning_rate_yyx': 0.00458154567629201}. Best is trial 13 with value: -0.5746682860992306.
[I 2026-03-18 17:24:19,097] Trial 46 pruned. 
[I 2026-03-18 17:24:20,499] Trial 39 pruned. 
[I 2026-03-18 17:24:20,707] Trial 13 pruned. 
[I 2026-03-18 17:24:23,333] Trial 33 pruned. 
[I 2026-03-18 17:24:23,333] Trial 36 pruned. 
[I 2026-03-18 17:24:24,787] Trial 16 pruned. 
[I 2026-03-18 17:24:25,319] Trial 12 finished with value: -2.9416514371178453 and parameters: {'n_layers_yyx': 1, 'hidden_size_yyx_l0': 3, 'context_size_yyx': 2, 'num_mix_components_yyx': 5, 'context_extractor_yyx': 'gru', 'activation_func_yyx': 'Tanh', 'L2_weight_yyx': 1.0602216558535254e-10, 'L_entropy_weight_yyx': 8.635271133870356e-06, 'L_sep_weight_yyx': 1.0452942894084911e-07, 'L_scale_weight_yyx': 1.0337313919806273e-07, 'learning_rate_yyx': 0.009268745701466751}. Best is trial 12 with value: -2.9416514371178453.
[I 2026-03-18 17:24:25,974] Trial 35 pruned. 
[I 2026-03-18 17:24:27,554] Trial 43 pruned. 
[I 2026-03-18 17:24:27,554] Trial 47 pruned. 
[I 2026-03-18 17:24:28,544] Trial 40 pruned. 
[I 2026-03-18 17:24:29,329] Trial 13 finished with value: -2.9189767380645644 and parameters: {'n_layers_yyx': 2, 'hidden_size_yyx_l0': 4, 'hidden_size_yyx_l1': 4, 'context_size_yyx': 1, 'num_mix_components_yyx': 4, 'context_extractor_yyx': 'lstm', 'activation_func_yyx': 'ReLU', 'L2_weight_yyx': 2.939223617853918e-08, 'L_entropy_weight_yyx': 6.0192777503351626e-06, 'L_sep_weight_yyx': 1.1425898192633848e-06, 'L_scale_weight_yyx': 2.690861050612244e-07, 'learning_rate_yyx': 0.0037750854829820602}. Best is trial 13 with value: -2.9189767380645644.
[I 2026-03-18 17:24:31,941] Trial 37 pruned. 
[I 2026-03-18 17:24:32,087] Trial 14 pruned. 
[I 2026-03-18 17:24:32,131] Trial 34 pruned. 
[I 2026-03-18 17:24:36,233] Trial 17 pruned. 
[I 2026-03-18 17:24:37,217] Trial 13 pruned. 
[I 2026-03-18 17:24:37,620] Trial 48 finished with value: -0.5754932681664804 and parameters: {'n_layers_yyx': 2, 'hidden_size_yyx_l0': 2, 'hidden_size_yyx_l1': 2, 'context_size_yyx': 4, 'num_mix_components_yyx': 4, 'context_extractor_yyx': 'gru', 'activation_func_yyx': 'GELU', 'L2_weight_yyx': 1.7648658522764269e-07, 'L_entropy_weight_yyx': 6.05295949810178e-08, 'L_sep_weight_yyx': 4.375267281729713e-07, 'L_scale_weight_yyx': 0.00010268676510297362, 'learning_rate_yyx': 0.007344387408591673}. Best is trial 22 with value: -0.5821973965945237.
[I 2026-03-18 17:24:42,013] Trial 41 pruned. 
[I 2026-03-18 17:24:44,944] Trial 21 finished with value: -2.947834793991112 and parameters: {'n_layers_yyx': 1, 'hidden_size_yyx_l0': 6, 'context_size_yyx': 3, 'num_mix_components_yyx': 4, 'context_extractor_yyx': 'gru', 'activation_func_yyx': 'ReLU', 'L2_weight_yyx': 4.605581539213702e-07, 'L_entropy_weight_yyx': 0.0008678536089736113, 'L_sep_weight_yyx': 1.0486992798977215e-10, 'L_scale_weight_yyx': 2.5395700237819966e-09, 'learning_rate_yyx': 0.009848980324302797}. Best is trial 15 with value: -2.9509930170610343.
[I 2026-03-18 17:24:45,915] Trial 43 pruned. 
[I 2026-03-18 17:24:47,209] Trial 38 pruned. 
[I 2026-03-18 17:24:47,612] Trial 18 pruned. 
[I 2026-03-18 17:24:49,378] Trial 35 pruned. 
[I 2026-03-18 17:24:53,936] Trial 49 pruned. 

Source events: 3828
Target events: 40082
Full model ln_yyx : 289.95572 nats/sec, 6.51066 nats/event
Full model Log loss : -0.57443
Full model ln_yyx : 288.39235 nats/sec, 6.47555 nats/event
Full model Log loss : -0.56491
Full model ln_yyx : 289.57749 nats/sec, 6.50216 nats/event
Full model Log loss : -0.55961
Full model ln_yyx : 286.24167 nats/sec, 6.42726 nats/event
Full model Log loss : -0.55712
Full model ln_yyx : 284.30630 nats/sec, 6.38380 nats/event
Full model Log loss : -0.56318
Full model ln_yyx : 294.61700 nats/sec, 6.61532 nats/event
Full model Log loss : -0.57893
Full model ln_yyx : 291.70837 nats/sec, 6.55001 nats/event
Full model Log loss : -0.57616
Full model ln_yyx : 293.08902 nats/sec, 6.58101 nats/event
Full model Log loss : -0.57381
Full model ln_yyx : 294.79234 nats/sec, 6.61926 nats/event
Full model Log loss : -0.57788
Full model ln_yyx : 300.05080 nats/sec, 6.73733 nats/event
Full model Log loss : -0.58220
Full model ln_yyx : 292.34970 nats/sec, 6.56441 nats/event
Full model Log loss : -0.56106
Full model ln_yyx : 290.93803 nats/sec, 6.53271 nats/event
Full model Log loss : -0.57332
Full model ln_yyx : 293.96478 nats/sec, 6.60068 nats/event
Full model Log loss : -0.57549
Optimization finished. Config saved to results/opt-full/opt_full_56_best_config.txt
[I 2026-03-18 17:24:58,638] Trial 36 pruned. 
[I 2026-03-18 17:25:02,790] Trial 44 pruned. 
[I 2026-03-18 17:25:03,255] Trial 20 finished with value: -2.9549177653610377 and parameters: {'n_layers_yyx': 1, 'hidden_size_yyx_l0': 5, 'context_size_yyx': 3, 'num_mix_components_yyx': 2, 'context_extractor_yyx': 'gru', 'activation_func_yyx': 'ReLU', 'L2_weight_yyx': 2.744974068764848e-08, 'L_entropy_weight_yyx': 4.6458743495452843e-07, 'L_sep_weight_yyx': 8.241838693024124e-08, 'L_scale_weight_yyx': 1.1713532007242355e-08, 'learning_rate_yyx': 0.0007321186257348481}. Best is trial 20 with value: -2.9549177653610377.
[I 2026-03-18 17:25:03,911] Trial 39 pruned. 
[I 2026-03-18 17:25:04,998] Trial 9 finished with value: -2.8861885152485947 and parameters: {'n_layers_yyx': 2, 'hidden_size_yyx_l0': 2, 'hidden_size_yyx_l1': 3, 'context_size_yyx': 2, 'num_mix_components_yyx': 2, 'context_extractor_yyx': 'gru', 'activation_func_yyx': 'Tanh', 'L2_weight_yyx': 4.325226184691719e-05, 'L_entropy_weight_yyx': 3.320992488114758e-08, 'L_sep_weight_yyx': 9.766421310004714e-05, 'L_scale_weight_yyx': 2.1145800214574967e-05, 'learning_rate_yyx': 0.009962411890525989}. Best is trial 9 with value: -2.8861885152485947.
[I 2026-03-18 17:25:06,270] Trial 37 pruned. 
[I 2026-03-18 17:25:08,959] Trial 36 finished with value: -0.561444813808352 and parameters: {'n_layers_yyx': 1, 'hidden_size_yyx_l0': 6, 'context_size_yyx': 4, 'num_mix_components_yyx': 5, 'context_extractor_yyx': 'gru', 'activation_func_yyx': 'Tanh', 'L2_weight_yyx': 2.508903020159089e-10, 'L_entropy_weight_yyx': 0.00010175648365248203, 'L_sep_weight_yyx': 1.1912540506338524e-07, 'L_scale_weight_yyx': 8.297694778411466e-06, 'learning_rate_yyx': 0.006265411674719832}. Best is trial 27 with value: -0.5752265017167082.
[I 2026-03-18 17:25:14,349] Trial 38 pruned. 
[I 2026-03-18 17:25:15,009] Trial 9 finished with value: -2.365723589747164 and parameters: {'n_layers_yyx': 1, 'hidden_size_yyx_l0': 2, 'context_size_yyx': 2, 'num_mix_components_yyx': 1, 'context_extractor_yyx': 'lstm', 'activation_func_yyx': 'Tanh', 'L2_weight_yyx': 1.0810829681185133e-09, 'L_entropy_weight_yyx': 0.0004131228623105144, 'L_sep_weight_yyx': 1.928942746660646e-06, 'L_scale_weight_yyx': 1.9407171385234576e-10, 'learning_rate_yyx': 0.009367026514888747}. Best is trial 5 with value: -2.9729516240610265.
[I 2026-03-18 17:25:15,561] Trial 10 pruned. 
[I 2026-03-18 17:25:17,260] Trial 37 pruned. 
[I 2026-03-18 17:25:19,236] Trial 45 pruned. 
[I 2026-03-18 17:25:24,246] Trial 12 pruned. 
[I 2026-03-18 17:25:25,904] Trial 44 finished with value: -0.5511064595008651 and parameters: {'n_layers_yyx': 2, 'hidden_size_yyx_l0': 6, 'hidden_size_yyx_l1': 3, 'context_size_yyx': 4, 'num_mix_components_yyx': 2, 'context_extractor_yyx': 'gru', 'activation_func_yyx': 'GELU', 'L2_weight_yyx': 0.00042738391976981124, 'L_entropy_weight_yyx': 5.687846506163673e-05, 'L_sep_weight_yyx': 6.461719726818076e-10, 'L_scale_weight_yyx': 4.602866484612086e-09, 'learning_rate_yyx': 0.007979759833566637}. Best is trial 15 with value: -0.5780454108278886.
[I 2026-03-18 17:25:26,244] Trial 38 pruned. 
[I 2026-03-18 17:25:26,717] Trial 10 pruned. 
[I 2026-03-18 17:25:27,587] Trial 21 pruned. 
[I 2026-03-18 17:25:28,470] Trial 39 finished with value: -0.5680939938048057 and parameters: {'n_layers_yyx': 2, 'hidden_size_yyx_l0': 5, 'hidden_size_yyx_l1': 3, 'context_size_yyx': 2, 'num_mix_components_yyx': 5, 'context_extractor_yyx': 'gru', 'activation_func_yyx': 'GELU', 'L2_weight_yyx': 3.9446965053316985e-09, 'L_entropy_weight_yyx': 3.2950140519695186e-06, 'L_sep_weight_yyx': 0.0005368033920777245, 'L_scale_weight_yyx': 5.033085201536033e-09, 'learning_rate_yyx': 0.0011089032750143054}. Best is trial 1 with value: -0.5777964847779832.
[I 2026-03-18 17:25:32,941] Trial 14 finished with value: -2.9449554920436998 and parameters: {'n_layers_yyx': 2, 'hidden_size_yyx_l0': 2, 'hidden_size_yyx_l1': 6, 'context_size_yyx': 2, 'num_mix_components_yyx': 2, 'context_extractor_yyx': 'gru', 'activation_func_yyx': 'ReLU', 'L2_weight_yyx': 2.308218092111308e-08, 'L_entropy_weight_yyx': 1.1429717819846084e-10, 'L_sep_weight_yyx': 2.4811584999626865e-05, 'L_scale_weight_yyx': 4.222193788478572e-09, 'learning_rate_yyx': 0.004004819369011231}. Best is trial 0 with value: -2.957957273051406.
[I 2026-03-18 17:25:33,759] Trial 39 pruned. 
[I 2026-03-18 17:25:34,975] Trial 42 finished with value: -0.4205025120785362 and parameters: {'n_layers_yyx': 2, 'hidden_size_yyx_l0': 4, 'hidden_size_yyx_l1': 2, 'context_size_yyx': 3, 'num_mix_components_yyx': 5, 'context_extractor_yyx': 'gru', 'activation_func_yyx': 'Tanh', 'L2_weight_yyx': 4.483129918259491e-10, 'L_entropy_weight_yyx': 1.969636372875593e-05, 'L_sep_weight_yyx': 8.733340266158047e-05, 'L_scale_weight_yyx': 1.0962962000662957e-05, 'learning_rate_yyx': 0.008293749009308139}. Best is trial 12 with value: -0.46022137621238873.
[I 2026-03-18 17:25:35,656] Trial 46 pruned. 
[I 2026-03-18 17:25:36,670] Trial 29 finished with value: -0.5751003805840031 and parameters: {'n_layers_yyx': 1, 'hidden_size_yyx_l0': 3, 'context_size_yyx': 2, 'num_mix_components_yyx': 4, 'context_extractor_yyx': 'gru', 'activation_func_yyx': 'Tanh', 'L2_weight_yyx': 5.512951792327208e-05, 'L_entropy_weight_yyx': 1.1293342244285504e-05, 'L_sep_weight_yyx': 0.000438885227847895, 'L_scale_weight_yyx': 1.2106647514116982e-09, 'learning_rate_yyx': 0.009653401729857567}. Best is trial 29 with value: -0.5751003805840031.
[I 2026-03-18 17:25:38,394] Trial 22 pruned. 
[I 2026-03-18 17:25:40,319] Trial 48 finished with value: -0.5898591137325911 and parameters: {'n_layers_yyx': 2, 'hidden_size_yyx_l0': 5, 'hidden_size_yyx_l1': 4, 'context_size_yyx': 1, 'num_mix_components_yyx': 5, 'context_extractor_yyx': 'lstm', 'activation_func_yyx': 'Tanh', 'L2_weight_yyx': 1.0531781052726348e-10, 'L_entropy_weight_yyx': 0.0008129927827501273, 'L_sep_weight_yyx': 2.5884086340646647e-09, 'L_scale_weight_yyx': 1.958414789867198e-06, 'learning_rate_yyx': 0.007488597979772113}. Best is trial 6 with value: -0.5907732977991746.
[I 2026-03-18 17:25:40,799] Trial 45 pruned. 
[I 2026-03-18 17:25:46,107] Trial 22 pruned. 
[I 2026-03-18 17:25:47,518] Trial 16 finished with value: -2.960582277237377 and parameters: {'n_layers_yyx': 2, 'hidden_size_yyx_l0': 6, 'hidden_size_yyx_l1': 4, 'context_size_yyx': 3, 'num_mix_components_yyx': 4, 'context_extractor_yyx': 'gru', 'activation_func_yyx': 'Tanh', 'L2_weight_yyx': 0.000690195063425353, 'L_entropy_weight_yyx': 1.0586433923359402e-06, 'L_sep_weight_yyx': 2.3608583731524936e-07, 'L_scale_weight_yyx': 1.5655321984018133e-08, 'learning_rate_yyx': 0.0022413530795818517}. Best is trial 0 with value: -2.9702180140077377.
[I 2026-03-18 17:25:48,347] Trial 40 pruned. 
[I 2026-03-18 17:25:48,681] Trial 13 pruned. 
[I 2026-03-18 17:25:50,855] Trial 39 pruned. 
[I 2026-03-18 17:25:51,523] Trial 47 pruned. 
[I 2026-03-18 17:25:51,704] Trial 30 pruned. 
[I 2026-03-18 17:25:56,001] Trial 15 pruned. 
[I 2026-03-18 17:26:01,706] Trial 23 pruned. 
[I 2026-03-18 17:26:07,978] Trial 40 finished with value: -0.5703747944785935 and parameters: {'n_layers_yyx': 1, 'hidden_size_yyx_l0': 6, 'context_size_yyx': 3, 'num_mix_components_yyx': 4, 'context_extractor_yyx': 'lstm', 'activation_func_yyx': 'Tanh', 'L2_weight_yyx': 1.5709857408655926e-08, 'L_entropy_weight_yyx': 1.0717920993804538e-09, 'L_sep_weight_yyx': 1.048645638438315e-08, 'L_scale_weight_yyx': 8.539642277298302e-07, 'learning_rate_yyx': 0.006023296801113271}. Best is trial 1 with value: -0.5777964847779832.
[I 2026-03-18 17:26:12,176] Trial 14 pruned. 
[I 2026-03-18 17:26:12,951] Trial 24 pruned. 
[I 2026-03-18 17:26:13,395] Trial 23 finished with value: -2.903714871081931 and parameters: {'n_layers_yyx': 2, 'hidden_size_yyx_l0': 5, 'hidden_size_yyx_l1': 5, 'context_size_yyx': 2, 'num_mix_components_yyx': 4, 'context_extractor_yyx': 'gru', 'activation_func_yyx': 'GELU', 'L2_weight_yyx': 8.205800670301424e-10, 'L_entropy_weight_yyx': 4.4719795716508496e-08, 'L_sep_weight_yyx': 4.0515751342020344e-08, 'L_scale_weight_yyx': 9.681454940017524e-08, 'learning_rate_yyx': 0.00519645593574321}. Best is trial 12 with value: -2.9595510816550052.
[I 2026-03-18 17:26:18,701] Trial 16 pruned. 
[I 2026-03-18 17:26:20,100] Trial 46 pruned. 
[I 2026-03-18 17:26:20,290] Trial 9 finished with value: -2.888661276265144 and parameters: {'n_layers_yyx': 1, 'hidden_size_yyx_l0': 2, 'context_size_yyx': 1, 'num_mix_components_yyx': 4, 'context_extractor_yyx': 'gru', 'activation_func_yyx': 'Tanh', 'L2_weight_yyx': 3.291114179118122e-05, 'L_entropy_weight_yyx': 7.917575582734544e-08, 'L_sep_weight_yyx': 8.889296691604359e-07, 'L_scale_weight_yyx': 1.6131225865367445e-08, 'learning_rate_yyx': 0.0014141319784355723}. Best is trial 4 with value: -2.961367919552152.
[I 2026-03-18 17:26:24,838] Trial 25 pruned. 
[I 2026-03-18 17:26:26,976] Trial 41 pruned. 
[I 2026-03-18 17:26:29,699] Trial 40 pruned. 
[I 2026-03-18 17:26:30,383] Trial 31 pruned. 
[I 2026-03-18 17:26:34,812] Trial 15 pruned. 
[I 2026-03-18 17:26:35,051] Trial 42 pruned. 
[I 2026-03-18 17:26:36,393] Trial 26 pruned. 
[I 2026-03-18 17:26:40,252] Trial 49 finished with value: -0.5881286579116338 and parameters: {'n_layers_yyx': 2, 'hidden_size_yyx_l0': 4, 'hidden_size_yyx_l1': 5, 'context_size_yyx': 1, 'num_mix_components_yyx': 5, 'context_extractor_yyx': 'lstm', 'activation_func_yyx': 'Tanh', 'L2_weight_yyx': 7.363200652075849e-10, 'L_entropy_weight_yyx': 0.0007478217905989838, 'L_sep_weight_yyx': 2.874614606420177e-09, 'L_scale_weight_yyx': 1.8586659121031558e-06, 'learning_rate_yyx': 0.006691094134580499}. Best is trial 6 with value: -0.5907732977991746.

Source events: 3828
Target events: 18269
Full model ln_yyx : 133.30478 nats/sec, 6.56710 nats/event
Full model Log loss : -0.57658
Full model ln_yyx : 133.49015 nats/sec, 6.57623 nats/event
Full model Log loss : -0.55555
Full model ln_yyx : 132.20960 nats/sec, 6.51314 nats/event
Full model Log loss : -0.55178
Full model ln_yyx : 132.20652 nats/sec, 6.51299 nats/event
Full model Log loss : -0.59026
Full model ln_yyx : 137.46371 nats/sec, 6.77198 nats/event
Full model Log loss : -0.59077
Full model ln_yyx : 133.95883 nats/sec, 6.59932 nats/event
Full model Log loss : -0.58254
Full model ln_yyx : 134.32830 nats/sec, 6.61752 nats/event
Full model Log loss : -0.58316
Full model ln_yyx : 133.65867 nats/sec, 6.58453 nats/event
Full model Log loss : -0.56912
Full model ln_yyx : 132.65984 nats/sec, 6.53533 nats/event
Full model Log loss : -0.57488
Full model ln_yyx : 133.21126 nats/sec, 6.56249 nats/event
Full model Log loss : -0.58986
Full model ln_yyx : 134.95135 nats/sec, 6.64821 nats/event
Full model Log loss : -0.58813
Optimization finished. Config saved to results/opt-full/opt_full_60_best_config.txt
[I 2026-03-18 17:26:43,658] Trial 17 pruned. 
[I 2026-03-18 17:26:43,709] Trial 43 pruned. 
[I 2026-03-18 17:26:44,726] Trial 10 pruned. 
[I 2026-03-18 17:26:45,893] Trial 32 pruned. 
[I 2026-03-18 17:26:46,317] Trial 41 pruned. 
[I 2026-03-18 17:26:47,774] Trial 27 pruned. 
[I 2026-03-18 17:26:55,361] Trial 40 finished with value: -0.5781804731492327 and parameters: {'n_layers_yyx': 1, 'hidden_size_yyx_l0': 5, 'context_size_yyx': 4, 'num_mix_components_yyx': 4, 'context_extractor_yyx': 'gru', 'activation_func_yyx': 'GELU', 'L2_weight_yyx': 1.794203444656314e-07, 'L_entropy_weight_yyx': 1.6987167243329814e-08, 'L_sep_weight_yyx': 0.000998376956439019, 'L_scale_weight_yyx': 3.6216619002743208e-06, 'learning_rate_yyx': 0.001945227823814706}. Best is trial 17 with value: -0.5864613361174992.
[I 2026-03-18 17:26:55,591] Trial 18 pruned. 
[I 2026-03-18 17:26:55,947] Trial 11 pruned. 
[I 2026-03-18 17:26:58,232] Trial 16 pruned. 
[I 2026-03-18 17:26:58,634] Trial 48 finished with value: -0.5490691592965526 and parameters: {'n_layers_yyx': 1, 'hidden_size_yyx_l0': 3, 'context_size_yyx': 1, 'num_mix_components_yyx': 3, 'context_extractor_yyx': 'lstm', 'activation_func_yyx': 'ReLU', 'L2_weight_yyx': 7.33426167288993e-06, 'L_entropy_weight_yyx': 7.232088268605936e-08, 'L_sep_weight_yyx': 4.030846960161681e-06, 'L_scale_weight_yyx': 4.182904363001766e-06, 'learning_rate_yyx': 0.005507295003613352}. Best is trial 33 with value: -0.5823817613856173.
[I 2026-03-18 17:26:59,406] Trial 28 pruned. 
[I 2026-03-18 17:27:00,801] Trial 33 pruned. 
[I 2026-03-18 17:27:02,179] Trial 42 pruned. 
[I 2026-03-18 17:27:03,548] Trial 41 pruned. 
[I 2026-03-18 17:27:10,343] Trial 43 pruned. 
[I 2026-03-18 17:27:10,517] Trial 29 pruned. 
[I 2026-03-18 17:27:14,448] Trial 43 finished with value: -0.43582290318728234 and parameters: {'n_layers_yyx': 2, 'hidden_size_yyx_l0': 4, 'hidden_size_yyx_l1': 2, 'context_size_yyx': 3, 'num_mix_components_yyx': 5, 'context_extractor_yyx': 'gru', 'activation_func_yyx': 'Tanh', 'L2_weight_yyx': 5.634126979703836e-09, 'L_entropy_weight_yyx': 3.321307204949661e-06, 'L_sep_weight_yyx': 1.2980687067391331e-06, 'L_scale_weight_yyx': 1.0231230489832602e-06, 'learning_rate_yyx': 0.0044509259917431465}. Best is trial 12 with value: -0.46022137621238873.
[I 2026-03-18 17:27:14,474] Trial 24 pruned. 
[I 2026-03-18 17:27:15,980] Trial 47 finished with value: -0.5649276166703383 and parameters: {'n_layers_yyx': 1, 'hidden_size_yyx_l0': 6, 'context_size_yyx': 2, 'num_mix_components_yyx': 5, 'context_extractor_yyx': 'gru', 'activation_func_yyx': 'ReLU', 'L2_weight_yyx': 0.0001846227130909683, 'L_entropy_weight_yyx': 7.783316413275931e-06, 'L_sep_weight_yyx': 4.574040974935661e-06, 'L_scale_weight_yyx': 2.014670628580253e-10, 'learning_rate_yyx': 0.006738919103990434}. Best is trial 15 with value: -0.5780454108278886.
[I 2026-03-18 17:27:16,009] Trial 34 pruned. 
[I 2026-03-18 17:27:18,879] Trial 19 pruned. 
[I 2026-03-18 17:27:19,334] Trial 42 pruned. 
[I 2026-03-18 17:27:20,358] Trial 12 pruned. 
[I 2026-03-18 17:27:20,462] Trial 44 pruned. 
[I 2026-03-18 17:27:21,289] Trial 17 pruned. 
[I 2026-03-18 17:27:22,250] Trial 30 pruned. 
[I 2026-03-18 17:27:25,523] Trial 41 finished with value: -0.572399469976412 and parameters: {'n_layers_yyx': 1, 'hidden_size_yyx_l0': 3, 'context_size_yyx': 4, 'num_mix_components_yyx': 3, 'context_extractor_yyx': 'gru', 'activation_func_yyx': 'Tanh', 'L2_weight_yyx': 1.582581736879628e-09, 'L_entropy_weight_yyx': 6.755796765098676e-06, 'L_sep_weight_yyx': 4.228421060907266e-09, 'L_scale_weight_yyx': 1.3034149850979893e-08, 'learning_rate_yyx': 0.009992458543661112}. Best is trial 23 with value: -0.5844188202198138.
[I 2026-03-18 17:27:26,022] Trial 25 pruned. 
[I 2026-03-18 17:27:28,540] Trial 44 pruned. 
[I 2026-03-18 17:27:29,447] Trial 20 pruned. 
[I 2026-03-18 17:27:30,134] Trial 48 pruned. 
[I 2026-03-18 17:27:30,769] Trial 18 pruned. 
[I 2026-03-18 17:27:30,956] Trial 13 pruned. 
[I 2026-03-18 17:27:31,346] Trial 11 finished with value: -2.8883242229322805 and parameters: {'n_layers_yyx': 1, 'hidden_size_yyx_l0': 5, 'context_size_yyx': 2, 'num_mix_components_yyx': 5, 'context_extractor_yyx': 'lstm', 'activation_func_yyx': 'Tanh', 'L2_weight_yyx': 1.0673986280222176e-10, 'L_entropy_weight_yyx': 0.00022987554505498334, 'L_sep_weight_yyx': 0.0009583539526351358, 'L_scale_weight_yyx': 1.762968035590686e-06, 'learning_rate_yyx': 0.008676956501885498}. Best is trial 11 with value: -2.8883242229322805.
[I 2026-03-18 17:27:32,841] Trial 23 finished with value: -2.9528067122789805 and parameters: {'n_layers_yyx': 2, 'hidden_size_yyx_l0': 4, 'hidden_size_yyx_l1': 3, 'context_size_yyx': 2, 'num_mix_components_yyx': 5, 'context_extractor_yyx': 'lstm', 'activation_func_yyx': 'ReLU', 'L2_weight_yyx': 1.2993696201637203e-10, 'L_entropy_weight_yyx': 6.56680732862294e-09, 'L_sep_weight_yyx': 1.4623885179138327e-05, 'L_scale_weight_yyx': 6.371370817676437e-07, 'learning_rate_yyx': 0.008421216903038906}. Best is trial 6 with value: -2.966045431578574.
[I 2026-03-18 17:27:34,629] Trial 43 pruned. 
