[I 2026-03-18 19:29:32,465] Trial 8 finished with value: -2.4952799304780506 and parameters: {'n_layers_yyx': 2, 'hidden_size_yyx_l0': 6, 'hidden_size_yyx_l1': 6, 'context_size_yyx': 3, 'num_mix_components_yyx': 1, 'context_extractor_yyx': 'gru', 'activation_func_yyx': 'ReLU', 'L2_weight_yyx': 3.082311510481393e-10, 'L_entropy_weight_yyx': 2.4344345508585667e-06, 'L_sep_weight_yyx': 1.3766791026706708e-07, 'L_scale_weight_yyx': 7.606308905923892e-07, 'learning_rate_yyx': 0.004676272156777117}. Best is trial 5 with value: -2.5140323195684524.
[I 2026-03-18 19:29:32,545] Trial 24 pruned. 
[I 2026-03-18 19:29:32,804] Trial 25 pruned. 
[I 2026-03-18 19:29:35,047] Trial 17 pruned. 
[I 2026-03-18 19:29:45,702] Trial 7 finished with value: -2.4973940692006362 and parameters: {'n_layers_yyx': 2, 'hidden_size_yyx_l0': 3, 'hidden_size_yyx_l1': 5, 'context_size_yyx': 4, 'num_mix_components_yyx': 2, 'context_extractor_yyx': 'gru', 'activation_func_yyx': 'GELU', 'L2_weight_yyx': 7.50959011744567e-07, 'L_entropy_weight_yyx': 2.9078881766363988e-06, 'L_sep_weight_yyx': 1.6451458412790411e-10, 'L_scale_weight_yyx': 1.6718307657863254e-05, 'learning_rate_yyx': 0.002999854773294404}. Best is trial 0 with value: -2.5120461423480207.
[I 2026-03-18 19:29:47,020] Trial 7 pruned. 
[I 2026-03-18 19:29:47,434] Trial 11 pruned. 
[I 2026-03-18 19:29:49,521] Trial 26 pruned. 
[I 2026-03-18 19:29:49,917] Trial 18 pruned. 
[I 2026-03-18 19:29:50,738] Trial 23 pruned. 
[I 2026-03-18 19:29:54,986] Trial 9 pruned. 
[I 2026-03-18 19:29:56,729] Trial 9 pruned. 
[I 2026-03-18 19:30:02,218] Trial 19 pruned. 
[I 2026-03-18 19:30:02,227] Trial 10 finished with value: -2.11089892530765 and parameters: {'n_layers_yyx': 2, 'hidden_size_yyx_l0': 2, 'hidden_size_yyx_l1': 6, 'context_size_yyx': 1, 'num_mix_components_yyx': 5, 'context_extractor_yyx': 'lstm', 'activation_func_yyx': 'Tanh', 'L2_weight_yyx': 0.0007453473568553862, 'L_entropy_weight_yyx': 7.29686353493749e-09, 'L_sep_weight_yyx': 4.039058102281044e-09, 'L_scale_weight_yyx': 1.4797288404354252e-10, 'learning_rate_yyx': 0.009934244559441002}. Best is trial 0 with value: -2.1143376288427875.
[I 2026-03-18 19:30:06,394] Trial 9 finished with value: -1.661497450631035 and parameters: {'n_layers_yyx': 2, 'hidden_size_yyx_l0': 2, 'hidden_size_yyx_l1': 2, 'context_size_yyx': 3, 'num_mix_components_yyx': 1, 'context_extractor_yyx': 'gru', 'activation_func_yyx': 'Tanh', 'L2_weight_yyx': 7.188001962832645e-08, 'L_entropy_weight_yyx': 1.572707572213152e-08, 'L_sep_weight_yyx': 1.393421769322275e-09, 'L_scale_weight_yyx': 8.277904096573186e-08, 'learning_rate_yyx': 0.009811900271664108}. Best is trial 2 with value: -1.6776522224422603.
[I 2026-03-18 19:30:06,554] Trial 25 pruned. 
[I 2026-03-18 19:30:06,570] Trial 8 pruned. 
[I 2026-03-18 19:30:15,555] Trial 7 finished with value: -2.4913907736393694 and parameters: {'n_layers_yyx': 2, 'hidden_size_yyx_l0': 6, 'hidden_size_yyx_l1': 3, 'context_size_yyx': 1, 'num_mix_components_yyx': 3, 'context_extractor_yyx': 'gru', 'activation_func_yyx': 'ReLU', 'L2_weight_yyx': 0.00021208680687400316, 'L_entropy_weight_yyx': 6.424422659962436e-05, 'L_sep_weight_yyx': 9.61195846791767e-08, 'L_scale_weight_yyx': 0.00020434885516927077, 'learning_rate_yyx': 0.003094886410155755}. Best is trial 1 with value: -2.511856338115334.
[I 2026-03-18 19:30:17,143] Trial 11 pruned. 
[I 2026-03-18 19:30:17,652] Trial 27 pruned. 
[I 2026-03-18 19:30:21,832] Trial 10 pruned. 
[I 2026-03-18 19:30:23,464] Trial 8 pruned. 
[I 2026-03-18 19:30:25,125] Trial 26 pruned. 
[I 2026-03-18 19:30:26,605] Trial 23 finished with value: -1.668135777403489 and parameters: {'n_layers_yyx': 2, 'hidden_size_yyx_l0': 4, 'hidden_size_yyx_l1': 6, 'context_size_yyx': 4, 'num_mix_components_yyx': 3, 'context_extractor_yyx': 'lstm', 'activation_func_yyx': 'ReLU', 'L2_weight_yyx': 1.0994973678644302e-09, 'L_entropy_weight_yyx': 1.3708970364016778e-07, 'L_sep_weight_yyx': 1.0512113844567298e-10, 'L_scale_weight_yyx': 4.036033339298446e-09, 'learning_rate_yyx': 0.007239330327957853}. Best is trial 23 with value: -1.668135777403489.
[I 2026-03-18 19:30:27,279] Trial 21 pruned. 
[I 2026-03-18 19:30:29,003] Trial 8 finished with value: -2.0094201162474343 and parameters: {'n_layers_yyx': 1, 'hidden_size_yyx_l0': 6, 'context_size_yyx': 1, 'num_mix_components_yyx': 4, 'context_extractor_yyx': 'gru', 'activation_func_yyx': 'GELU', 'L2_weight_yyx': 5.539030372710284e-10, 'L_entropy_weight_yyx': 3.072035434103776e-05, 'L_sep_weight_yyx': 1.5182997746061116e-05, 'L_scale_weight_yyx': 1.075221439455022e-06, 'learning_rate_yyx': 0.007606942275841609}. Best is trial 0 with value: -2.0138799336866504.
[I 2026-03-18 19:30:30,599] Trial 26 finished with value: -1.7276052118239558 and parameters: {'n_layers_yyx': 1, 'hidden_size_yyx_l0': 6, 'context_size_yyx': 4, 'num_mix_components_yyx': 3, 'context_extractor_yyx': 'lstm', 'activation_func_yyx': 'ReLU', 'L2_weight_yyx': 2.310303463543551e-05, 'L_entropy_weight_yyx': 6.583951257260284e-08, 'L_sep_weight_yyx': 2.442339943718775e-09, 'L_scale_weight_yyx': 7.738134708473504e-05, 'learning_rate_yyx': 0.007041278822157069}. Best is trial 8 with value: -1.7294919135267302.
[I 2026-03-18 19:30:35,499] Trial 8 pruned. 
[I 2026-03-18 19:30:35,793] Trial 10 finished with value: -2.503375894709151 and parameters: {'n_layers_yyx': 1, 'hidden_size_yyx_l0': 6, 'context_size_yyx': 4, 'num_mix_components_yyx': 5, 'context_extractor_yyx': 'lstm', 'activation_func_yyx': 'Tanh', 'L2_weight_yyx': 1.1220675357427562e-10, 'L_entropy_weight_yyx': 0.00018323796853099504, 'L_sep_weight_yyx': 0.0009500180400012471, 'L_scale_weight_yyx': 1.3135814749469396e-08, 'learning_rate_yyx': 0.009860306718997965}. Best is trial 10 with value: -2.503375894709151.
[I 2026-03-18 19:30:36,541] Trial 19 finished with value: -1.6971817501125885 and parameters: {'n_layers_yyx': 1, 'hidden_size_yyx_l0': 3, 'context_size_yyx': 4, 'num_mix_components_yyx': 5, 'context_extractor_yyx': 'gru', 'activation_func_yyx': 'Tanh', 'L2_weight_yyx': 9.171736168644078e-07, 'L_entropy_weight_yyx': 2.328022075129139e-10, 'L_sep_weight_yyx': 0.0006394864693146722, 'L_scale_weight_yyx': 1.0769644649925293e-10, 'learning_rate_yyx': 0.004480835707574752}. Best is trial 18 with value: -1.7002973458681911.
[I 2026-03-18 19:30:37,306] Trial 11 pruned. 
[I 2026-03-18 19:30:39,406] Trial 18 finished with value: -1.6748094022531799 and parameters: {'n_layers_yyx': 1, 'hidden_size_yyx_l0': 6, 'context_size_yyx': 4, 'num_mix_components_yyx': 5, 'context_extractor_yyx': 'gru', 'activation_func_yyx': 'ReLU', 'L2_weight_yyx': 1.2862628776855823e-06, 'L_entropy_weight_yyx': 7.59934837709934e-06, 'L_sep_weight_yyx': 3.7834199330167506e-10, 'L_scale_weight_yyx': 3.95938543417016e-09, 'learning_rate_yyx': 0.007086780491648473}. Best is trial 13 with value: -1.6789194095140463.
[I 2026-03-18 19:30:41,957] Trial 9 pruned. 
[I 2026-03-18 19:30:46,884] Trial 28 pruned. 
[I 2026-03-18 19:30:49,330] Trial 12 pruned. 
[I 2026-03-18 19:30:51,097] Trial 20 pruned. 
[I 2026-03-18 19:30:54,058] Trial 12 pruned. 
[I 2026-03-18 19:31:06,470] Trial 21 pruned. 
[I 2026-03-18 19:31:09,104] Trial 13 pruned. 
[I 2026-03-18 19:31:10,634] Trial 19 pruned. 
[I 2026-03-18 19:31:20,635] Trial 20 pruned. 
[I 2026-03-18 19:31:21,720] Trial 13 pruned. 
[I 2026-03-18 19:31:22,726] Trial 10 finished with value: -2.4984645272096904 and parameters: {'n_layers_yyx': 1, 'hidden_size_yyx_l0': 6, 'context_size_yyx': 3, 'num_mix_components_yyx': 1, 'context_extractor_yyx': 'gru', 'activation_func_yyx': 'GELU', 'L2_weight_yyx': 6.19147192803282e-05, 'L_entropy_weight_yyx': 1.1580905662546156e-07, 'L_sep_weight_yyx': 0.0007326089055075311, 'L_scale_weight_yyx': 2.5945533970778472e-05, 'learning_rate_yyx': 0.0005758675562908843}. Best is trial 0 with value: -2.510808245268653.
[I 2026-03-18 19:31:25,471] Trial 14 pruned. 
[I 2026-03-18 19:31:27,928] Trial 7 finished with value: -2.4950542279753494 and parameters: {'n_layers_yyx': 1, 'hidden_size_yyx_l0': 3, 'context_size_yyx': 1, 'num_mix_components_yyx': 2, 'context_extractor_yyx': 'gru', 'activation_func_yyx': 'GELU', 'L2_weight_yyx': 4.57570152129015e-08, 'L_entropy_weight_yyx': 2.6199246668458694e-09, 'L_sep_weight_yyx': 0.0004740464495183157, 'L_scale_weight_yyx': 9.701238738293356e-06, 'learning_rate_yyx': 0.009714848482231458}. Best is trial 7 with value: -2.4950542279753494.
[I 2026-03-18 19:31:36,434] Trial 14 pruned. 
[I 2026-03-18 19:31:40,623] Trial 27 pruned. 
[I 2026-03-18 19:31:42,890] Trial 24 pruned. 
[I 2026-03-18 19:31:44,484] Trial 8 pruned. 
[I 2026-03-18 19:31:49,002] Trial 21 pruned. 
[I 2026-03-18 19:31:52,706] Trial 19 finished with value: -1.6399740927612363 and parameters: {'n_layers_yyx': 1, 'hidden_size_yyx_l0': 5, 'context_size_yyx': 2, 'num_mix_components_yyx': 4, 'context_extractor_yyx': 'gru', 'activation_func_yyx': 'GELU', 'L2_weight_yyx': 8.937961554481013e-08, 'L_entropy_weight_yyx': 9.698711340975798e-09, 'L_sep_weight_yyx': 1.1434270705117841e-10, 'L_scale_weight_yyx': 2.499509471122376e-06, 'learning_rate_yyx': 0.0005115627344263009}. Best is trial 12 with value: -1.6796893990996478.
[I 2026-03-18 19:31:53,933] Trial 9 pruned. 
[I 2026-03-18 19:31:59,628] Trial 25 pruned. 
[I 2026-03-18 19:32:02,802] Trial 12 finished with value: -1.6727305553900056 and parameters: {'n_layers_yyx': 2, 'hidden_size_yyx_l0': 2, 'hidden_size_yyx_l1': 3, 'context_size_yyx': 3, 'num_mix_components_yyx': 2, 'context_extractor_yyx': 'gru', 'activation_func_yyx': 'Tanh', 'L2_weight_yyx': 1.2435415967491531e-05, 'L_entropy_weight_yyx': 8.504145982082095e-09, 'L_sep_weight_yyx': 5.54680426985829e-07, 'L_scale_weight_yyx': 8.676341758012909e-09, 'learning_rate_yyx': 0.0038542041388455323}. Best is trial 2 with value: -1.680426359749482.
[I 2026-03-18 19:32:04,959] Trial 20 finished with value: -1.9820871986083644 and parameters: {'n_layers_yyx': 2, 'hidden_size_yyx_l0': 3, 'hidden_size_yyx_l1': 6, 'context_size_yyx': 4, 'num_mix_components_yyx': 3, 'context_extractor_yyx': 'gru', 'activation_func_yyx': 'ReLU', 'L2_weight_yyx': 1.2403967017783434e-08, 'L_entropy_weight_yyx': 1.979202764453146e-06, 'L_sep_weight_yyx': 2.4912221108563697e-06, 'L_scale_weight_yyx': 2.784437814744013e-09, 'learning_rate_yyx': 0.00982599209534081}. Best is trial 11 with value: -1.9852781357200364.
[I 2026-03-18 19:32:12,066] Trial 15 pruned. 
[I 2026-03-18 19:32:13,285] Trial 12 finished with value: -1.983840502266522 and parameters: {'n_layers_yyx': 2, 'hidden_size_yyx_l0': 6, 'hidden_size_yyx_l1': 5, 'context_size_yyx': 4, 'num_mix_components_yyx': 4, 'context_extractor_yyx': 'gru', 'activation_func_yyx': 'Tanh', 'L2_weight_yyx': 6.921639792047756e-05, 'L_entropy_weight_yyx': 2.324963683282132e-05, 'L_sep_weight_yyx': 0.0001708990151815951, 'L_scale_weight_yyx': 0.0005601269502997056, 'learning_rate_yyx': 0.009061530724179472}. Best is trial 12 with value: -1.983840502266522.
[I 2026-03-18 19:32:14,439] Trial 28 pruned. 
[I 2026-03-18 19:32:14,513] Trial 10 pruned. 
[I 2026-03-18 19:32:21,155] Trial 13 pruned. 
[I 2026-03-18 19:32:21,942] Trial 22 pruned. 
[I 2026-03-18 19:32:21,944] Trial 22 pruned. 
[I 2026-03-18 19:32:22,398] Trial 9 pruned. 
[I 2026-03-18 19:32:26,311] Trial 20 pruned. 
[I 2026-03-18 19:32:27,679] Trial 9 pruned. 
[I 2026-03-18 19:32:29,374] Trial 20 pruned. 
[I 2026-03-18 19:32:31,024] Trial 16 pruned. 
[I 2026-03-18 19:32:31,352] Trial 13 pruned. 
[I 2026-03-18 19:32:35,632] Trial 26 pruned. 
[I 2026-03-18 19:32:37,896] Trial 23 pruned. 
[I 2026-03-18 19:32:39,031] Trial 23 pruned. 
[I 2026-03-18 19:32:39,444] Trial 21 pruned. 
[I 2026-03-18 19:32:41,021] Trial 6 finished with value: -2.033081546340082 and parameters: {'n_layers_yyx': 2, 'hidden_size_yyx_l0': 4, 'hidden_size_yyx_l1': 5, 'context_size_yyx': 3, 'num_mix_components_yyx': 5, 'context_extractor_yyx': 'lstm', 'activation_func_yyx': 'Tanh', 'L2_weight_yyx': 0.000599905931373637, 'L_entropy_weight_yyx': 4.671192639145314e-08, 'L_sep_weight_yyx': 6.0660917136448105e-09, 'L_scale_weight_yyx': 1.1223619438421517e-06, 'learning_rate_yyx': 0.001162632832398037}. Best is trial 1 with value: -2.0346981000296678.
[I 2026-03-18 19:32:42,641] Trial 21 pruned. 
[I 2026-03-18 19:32:47,191] Trial 29 pruned. 
[I 2026-03-18 19:32:48,056] Trial 16 finished with value: -2.5482089436137594 and parameters: {'n_layers_yyx': 2, 'hidden_size_yyx_l0': 3, 'hidden_size_yyx_l1': 5, 'context_size_yyx': 3, 'num_mix_components_yyx': 4, 'context_extractor_yyx': 'gru', 'activation_func_yyx': 'Tanh', 'L2_weight_yyx': 1.1137864931202583e-08, 'L_entropy_weight_yyx': 8.274059845631195e-06, 'L_sep_weight_yyx': 2.0564543735651522e-07, 'L_scale_weight_yyx': 4.284859889752782e-09, 'learning_rate_yyx': 0.0064955998267322715}. Best is trial 16 with value: -2.5482089436137594.
[I 2026-03-18 19:32:56,105] Trial 24 pruned. 
[I 2026-03-18 19:32:58,508] Trial 22 pruned. 
[I 2026-03-18 19:32:58,509] Trial 7 pruned. 
[I 2026-03-18 19:33:04,622] Trial 11 finished with value: -2.5024675531904825 and parameters: {'n_layers_yyx': 1, 'hidden_size_yyx_l0': 6, 'context_size_yyx': 4, 'num_mix_components_yyx': 5, 'context_extractor_yyx': 'lstm', 'activation_func_yyx': 'Tanh', 'L2_weight_yyx': 1.0678891097550938e-10, 'L_entropy_weight_yyx': 0.00033384386673199044, 'L_sep_weight_yyx': 0.0004066970851486393, 'L_scale_weight_yyx': 7.174789767267198e-09, 'learning_rate_yyx': 0.00976807960845037}. Best is trial 10 with value: -2.503375894709151.
[I 2026-03-18 19:33:05,044] Trial 17 pruned. 
[I 2026-03-18 19:33:05,054] Trial 10 pruned. 
[I 2026-03-18 19:33:07,543] Trial 27 pruned. 
[I 2026-03-18 19:33:07,543] Trial 17 pruned. 
[I 2026-03-18 19:33:11,758] Trial 24 pruned. 
[I 2026-03-18 19:33:12,881] Trial 25 pruned. 
[I 2026-03-18 19:33:18,595] Trial 14 finished with value: -2.0195751026978304 and parameters: {'n_layers_yyx': 2, 'hidden_size_yyx_l0': 5, 'hidden_size_yyx_l1': 5, 'context_size_yyx': 1, 'num_mix_components_yyx': 5, 'context_extractor_yyx': 'gru', 'activation_func_yyx': 'ReLU', 'L2_weight_yyx': 5.508523447684898e-06, 'L_entropy_weight_yyx': 3.929921125813451e-05, 'L_sep_weight_yyx': 1.3047422929867638e-07, 'L_scale_weight_yyx': 1.931964691294052e-05, 'learning_rate_yyx': 0.004516328522661238}. Best is trial 13 with value: -2.0221624466873753.
[I 2026-03-18 19:33:20,235] Trial 18 pruned. 
[I 2026-03-18 19:33:23,403] Trial 24 pruned. 
[I 2026-03-18 19:33:25,653] Trial 28 pruned. 
[I 2026-03-18 19:33:29,374] Trial 10 pruned. 
[I 2026-03-18 19:33:32,894] Trial 15 finished with value: -1.9800529212919613 and parameters: {'n_layers_yyx': 1, 'hidden_size_yyx_l0': 3, 'context_size_yyx': 3, 'num_mix_components_yyx': 5, 'context_extractor_yyx': 'lstm', 'activation_func_yyx': 'Tanh', 'L2_weight_yyx': 6.166828946753947e-06, 'L_entropy_weight_yyx': 1.6644565153311864e-10, 'L_sep_weight_yyx': 8.637963315049803e-06, 'L_scale_weight_yyx': 8.612187571525029e-06, 'learning_rate_yyx': 0.0010535537239772478}. Best is trial 1 with value: -1.9828018961884801.
[I 2026-03-18 19:33:33,282] Trial 29 finished with value: -1.6724951550228444 and parameters: {'n_layers_yyx': 2, 'hidden_size_yyx_l0': 6, 'hidden_size_yyx_l1': 5, 'context_size_yyx': 3, 'num_mix_components_yyx': 5, 'context_extractor_yyx': 'lstm', 'activation_func_yyx': 'Tanh', 'L2_weight_yyx': 8.463013798002673e-06, 'L_entropy_weight_yyx': 0.0009362698521719576, 'L_sep_weight_yyx': 8.33376860772804e-06, 'L_scale_weight_yyx': 0.0007821052900521121, 'learning_rate_yyx': 0.0070739813265384135}. Best is trial 4 with value: -1.673415532769749.
[I 2026-03-18 19:33:37,981] Trial 19 pruned. 
[I 2026-03-18 19:33:39,356] Trial 25 pruned. 
[I 2026-03-18 19:33:45,288] Trial 11 pruned. 
[I 2026-03-18 19:33:47,862] Trial 21 pruned. 
[I 2026-03-18 19:33:53,879] Trial 10 finished with value: -2.5122732552574223 and parameters: {'n_layers_yyx': 2, 'hidden_size_yyx_l0': 5, 'hidden_size_yyx_l1': 4, 'context_size_yyx': 3, 'num_mix_components_yyx': 5, 'context_extractor_yyx': 'gru', 'activation_func_yyx': 'GELU', 'L2_weight_yyx': 1.7437595743025064e-10, 'L_entropy_weight_yyx': 1.9329406909471784e-10, 'L_sep_weight_yyx': 0.0008769579706646936, 'L_scale_weight_yyx': 1.561839786166804e-05, 'learning_rate_yyx': 0.00973729456475199}. Best is trial 10 with value: -2.5122732552574223.
[I 2026-03-18 19:33:55,936] Trial 22 pruned. 
[I 2026-03-18 19:33:59,085] Trial 11 pruned. 
[I 2026-03-18 19:34:03,331] Trial 15 finished with value: -1.67837664463496 and parameters: {'n_layers_yyx': 2, 'hidden_size_yyx_l0': 5, 'hidden_size_yyx_l1': 4, 'context_size_yyx': 2, 'num_mix_components_yyx': 5, 'context_extractor_yyx': 'lstm', 'activation_func_yyx': 'Tanh', 'L2_weight_yyx': 2.5375911661456373e-08, 'L_entropy_weight_yyx': 0.0009648778371727126, 'L_sep_weight_yyx': 4.978778543138118e-07, 'L_scale_weight_yyx': 5.374666406166102e-09, 'learning_rate_yyx': 0.009625617660153183}. Best is trial 15 with value: -1.67837664463496.
[I 2026-03-18 19:34:05,006] Trial 12 pruned. 
[I 2026-03-18 19:34:08,618] Trial 26 pruned. 
[I 2026-03-18 19:34:08,735] Trial 13 finished with value: -2.511071305630007 and parameters: {'n_layers_yyx': 1, 'hidden_size_yyx_l0': 5, 'context_size_yyx': 1, 'num_mix_components_yyx': 3, 'context_extractor_yyx': 'gru', 'activation_func_yyx': 'Tanh', 'L2_weight_yyx': 1.4159267734893486e-06, 'L_entropy_weight_yyx': 1.4855008195001082e-10, 'L_sep_weight_yyx': 3.185249917808316e-08, 'L_scale_weight_yyx': 2.40869505996571e-09, 'learning_rate_yyx': 0.0032458042703929608}. Best is trial 0 with value: -2.5120178855442976.
[I 2026-03-18 19:34:10,311] Trial 23 pruned. 
[I 2026-03-18 19:34:11,219] Trial 20 pruned. 
[I 2026-03-18 19:34:11,632] Trial 16 finished with value: -2.5102561634499936 and parameters: {'n_layers_yyx': 1, 'hidden_size_yyx_l0': 5, 'context_size_yyx': 1, 'num_mix_components_yyx': 5, 'context_extractor_yyx': 'lstm', 'activation_func_yyx': 'ReLU', 'L2_weight_yyx': 1.6802646912629592e-06, 'L_entropy_weight_yyx': 3.078295935830672e-06, 'L_sep_weight_yyx': 1.052533697922832e-10, 'L_scale_weight_yyx': 1.5156190996167766e-09, 'learning_rate_yyx': 0.004041484831976963}. Best is trial 6 with value: -2.513252855536577.
[I 2026-03-18 19:34:24,638] Trial 27 pruned. 
[I 2026-03-18 19:34:25,441] Trial 9 finished with value: -2.5118133835565475 and parameters: {'n_layers_yyx': 1, 'hidden_size_yyx_l0': 4, 'context_size_yyx': 2, 'num_mix_components_yyx': 5, 'context_extractor_yyx': 'lstm', 'activation_func_yyx': 'GELU', 'L2_weight_yyx': 1.3139099020450639e-08, 'L_entropy_weight_yyx': 8.494038178569349e-06, 'L_sep_weight_yyx': 5.973346634136305e-07, 'L_scale_weight_yyx': 3.1417134106814982e-06, 'learning_rate_yyx': 0.007382922188897735}. Best is trial 5 with value: -2.5140323195684524.
[I 2026-03-18 19:34:30,851] Trial 17 pruned. 
[I 2026-03-18 19:34:33,745] Trial 16 pruned. 
[I 2026-03-18 19:34:33,749] Trial 27 pruned. 
[I 2026-03-18 19:34:41,390] Trial 24 pruned. 
[I 2026-03-18 19:34:45,850] Trial 21 pruned. 
[I 2026-03-18 19:34:51,179] Trial 14 pruned. 
[I 2026-03-18 19:34:51,206] Trial 9 finished with value: -2.5077267401404923 and parameters: {'n_layers_yyx': 2, 'hidden_size_yyx_l0': 4, 'hidden_size_yyx_l1': 4, 'context_size_yyx': 3, 'num_mix_components_yyx': 4, 'context_extractor_yyx': 'gru', 'activation_func_yyx': 'Tanh', 'L2_weight_yyx': 4.377397003544396e-06, 'L_entropy_weight_yyx': 3.012710929810598e-08, 'L_sep_weight_yyx': 1.3183121674959945e-08, 'L_scale_weight_yyx': 0.0004623222121617193, 'learning_rate_yyx': 0.0021759052401883806}. Best is trial 1 with value: -2.5125601952756833.
[I 2026-03-18 19:34:55,212] Trial 28 pruned. 
[I 2026-03-18 19:35:02,046] Trial 16 pruned. 
[I 2026-03-18 19:35:07,116] Trial 22 pruned. 
[I 2026-03-18 19:35:13,649] Trial 15 pruned. 
[I 2026-03-18 19:35:15,908] Trial 25 pruned. 
[I 2026-03-18 19:35:15,909] Trial 18 pruned. 
[I 2026-03-18 19:35:29,941] Trial 22 pruned. 
[I 2026-03-18 19:35:35,747] Trial 11 finished with value: -2.5102784008489927 and parameters: {'n_layers_yyx': 1, 'hidden_size_yyx_l0': 6, 'context_size_yyx': 1, 'num_mix_components_yyx': 5, 'context_extractor_yyx': 'gru', 'activation_func_yyx': 'ReLU', 'L2_weight_yyx': 2.2776030197147605e-10, 'L_entropy_weight_yyx': 3.535809669762626e-07, 'L_sep_weight_yyx': 1.8997258482397655e-06, 'L_scale_weight_yyx': 1.0254440900001168e-10, 'learning_rate_yyx': 0.0012078375180731033}. Best is trial 0 with value: -2.511745534136428.
[I 2026-03-18 19:35:36,480] Trial 11 finished with value: -2.511853029658318 and parameters: {'n_layers_yyx': 2, 'hidden_size_yyx_l0': 5, 'hidden_size_yyx_l1': 2, 'context_size_yyx': 4, 'num_mix_components_yyx': 4, 'context_extractor_yyx': 'gru', 'activation_func_yyx': 'Tanh', 'L2_weight_yyx': 3.4352370416524627e-09, 'L_entropy_weight_yyx': 2.842147349810409e-06, 'L_sep_weight_yyx': 1.88628611008175e-05, 'L_scale_weight_yyx': 1.0178356193560096e-10, 'learning_rate_yyx': 0.009324486185728677}. Best is trial 11 with value: -2.511853029658318.
[I 2026-03-18 19:35:41,598] Trial 14 finished with value: -1.9830179719222556 and parameters: {'n_layers_yyx': 1, 'hidden_size_yyx_l0': 5, 'context_size_yyx': 4, 'num_mix_components_yyx': 4, 'context_extractor_yyx': 'gru', 'activation_func_yyx': 'Tanh', 'L2_weight_yyx': 2.0782239255439856e-07, 'L_entropy_weight_yyx': 2.669767033778109e-05, 'L_sep_weight_yyx': 1.9691502579920864e-07, 'L_scale_weight_yyx': 1.1367109739946968e-06, 'learning_rate_yyx': 0.008635519867456802}. Best is trial 12 with value: -1.983840502266522.
