Warning: Failed writing log files to directory [/var/log/nvidia-mps]. No logs will be available.
[I 2026-03-18 22:13:41,760] Using an existing study with name 'opt_full-model_seed=42_task=231' instead of creating a new one.
[I 2026-03-18 22:13:41,760] Using an existing study with name 'opt_full-model_seed=42_task=238' instead of creating a new one.
[I 2026-03-18 22:13:41,765] Using an existing study with name 'opt_full-model_seed=42_task=234' instead of creating a new one.
[I 2026-03-18 22:13:41,765] Using an existing study with name 'opt_full-model_seed=42_task=232' instead of creating a new one.
[I 2026-03-18 22:13:41,768] Using an existing study with name 'opt_full-model_seed=42_task=239' instead of creating a new one.
[I 2026-03-18 22:13:41,768] Using an existing study with name 'opt_full-model_seed=42_task=229' instead of creating a new one.
[I 2026-03-18 22:13:41,769] Using an existing study with name 'opt_full-model_seed=42_task=225' instead of creating a new one.
[I 2026-03-18 22:13:41,780] Using an existing study with name 'opt_full-model_seed=42_task=228' instead of creating a new one.
[I 2026-03-18 22:13:41,781] Using an existing study with name 'opt_full-model_seed=42_task=237' instead of creating a new one.
[I 2026-03-18 22:13:41,791] Using an existing study with name 'opt_full-model_seed=42_task=235' instead of creating a new one.
[I 2026-03-18 22:13:41,791] Using an existing study with name 'opt_full-model_seed=42_task=230' instead of creating a new one.
[I 2026-03-18 22:13:41,792] Using an existing study with name 'opt_full-model_seed=42_task=224' instead of creating a new one.
[I 2026-03-18 22:13:41,801] Using an existing study with name 'opt_full-model_seed=42_task=226' instead of creating a new one.
[I 2026-03-18 22:13:41,817] Using an existing study with name 'opt_full-model_seed=42_task=233' instead of creating a new one.
[I 2026-03-18 22:13:41,836] Using an existing study with name 'opt_full-model_seed=42_task=227' instead of creating a new one.
[I 2026-03-18 22:13:41,848] Using an existing study with name 'opt_full-model_seed=42_task=236' instead of creating a new one.
[I 2026-03-18 22:14:08,691] Trial 20 pruned. 
[I 2026-03-18 22:14:08,857] Trial 34 pruned. 
[I 2026-03-18 22:14:09,056] Trial 33 pruned. 
[I 2026-03-18 22:14:09,303] Trial 35 pruned. 
[I 2026-03-18 22:14:09,377] Trial 35 pruned. 
[I 2026-03-18 22:14:09,563] Trial 36 pruned. 
[I 2026-03-18 22:14:16,947] Trial 24 pruned. 
[I 2026-03-18 22:14:18,394] Trial 26 pruned. 
[I 2026-03-18 22:14:18,787] Trial 31 pruned. 
[I 2026-03-18 22:14:18,910] Trial 35 pruned. 
[I 2026-03-18 22:14:19,181] Trial 34 pruned. 
[I 2026-03-18 22:14:19,229] Trial 31 pruned. 
[I 2026-03-18 22:14:19,403] Trial 29 pruned. 
[I 2026-03-18 22:14:19,897] Trial 36 pruned. 
[I 2026-03-18 22:14:27,398] Trial 25 pruned. 
[I 2026-03-18 22:14:29,636] Trial 37 pruned. 
[I 2026-03-18 22:14:29,640] Trial 36 pruned. 
[I 2026-03-18 22:14:30,479] Trial 37 pruned. 
[I 2026-03-18 22:14:37,003] Trial 26 pruned. 
[I 2026-03-18 22:14:37,842] Trial 30 pruned. 
[I 2026-03-18 22:14:38,743] Trial 32 pruned. 
[I 2026-03-18 22:14:38,773] Trial 35 pruned. 
[I 2026-03-18 22:14:40,448] Trial 38 pruned. 
[I 2026-03-18 22:14:47,347] Trial 22 pruned. 
[I 2026-03-18 22:14:48,448] Trial 36 pruned. 
[I 2026-03-18 22:14:49,367] Trial 38 pruned. 
[I 2026-03-18 22:14:50,956] Trial 39 pruned. 
[I 2026-03-18 22:14:55,682] Trial 33 pruned. 
[I 2026-03-18 22:14:56,003] Trial 23 pruned. 
[I 2026-03-18 22:14:57,220] Trial 31 pruned. 
[I 2026-03-18 22:14:57,679] Trial 33 pruned. 
[I 2026-03-18 22:14:58,427] Trial 27 pruned. 
[I 2026-03-18 22:14:59,621] Trial 40 pruned. 
[I 2026-03-18 22:15:05,323] Trial 36 pruned. 
[I 2026-03-18 22:15:06,636] Trial 37 pruned. 
[I 2026-03-18 22:15:07,229] Trial 28 pruned. 
[I 2026-03-18 22:15:15,074] Trial 37 pruned. 
[I 2026-03-18 22:15:15,974] Trial 32 pruned. 
[I 2026-03-18 22:15:16,293] Trial 38 pruned. 
[I 2026-03-18 22:15:17,770] Trial 29 pruned. 
[I 2026-03-18 22:15:17,915] Trial 45 finished with value: -1.8033939016841456 and parameters: {'n_layers_yyx': 2, 'hidden_size_yyx_l0': 5, 'hidden_size_yyx_l1': 4, 'context_size_yyx': 4, 'num_mix_components_yyx': 3, 'context_extractor_yyx': 'lstm', 'activation_func_yyx': 'GELU', 'L2_weight_yyx': 0.00034966684495355975, 'L_entropy_weight_yyx': 1.2688135119936552e-06, 'L_sep_weight_yyx': 1.1446611927467079e-05, 'L_scale_weight_yyx': 5.608313054704346e-07, 'learning_rate_yyx': 0.008775753837164594}. Best is trial 27 with value: -1.8062570642302185.
[I 2026-03-18 22:15:26,993] Trial 30 pruned. 
[I 2026-03-18 22:15:34,420] Trial 33 pruned. 
[I 2026-03-18 22:15:36,178] Trial 39 pruned. 
[I 2026-03-18 22:15:36,777] Trial 31 pruned. 
[I 2026-03-18 22:15:36,848] Trial 39 pruned. 
[I 2026-03-18 22:15:43,969] Trial 34 pruned. 
[I 2026-03-18 22:15:44,999] Trial 40 pruned. 
[I 2026-03-18 22:15:47,478] Trial 32 pruned. 
[I 2026-03-18 22:15:49,224] Trial 34 finished with value: -1.8520601712740385 and parameters: {'n_layers_yyx': 1, 'hidden_size_yyx_l0': 4, 'context_size_yyx': 4, 'num_mix_components_yyx': 4, 'context_extractor_yyx': 'gru', 'activation_func_yyx': 'ReLU', 'L2_weight_yyx': 3.269790466139421e-06, 'L_entropy_weight_yyx': 2.1886112624833167e-09, 'L_sep_weight_yyx': 7.587456684234667e-06, 'L_scale_weight_yyx': 8.630727724803552e-09, 'learning_rate_yyx': 0.008888111737494733}. Best is trial 9 with value: -1.8570869006965198.
[I 2026-03-18 22:15:50,953] Trial 32 finished with value: -1.8608821834529843 and parameters: {'n_layers_yyx': 2, 'hidden_size_yyx_l0': 5, 'hidden_size_yyx_l1': 5, 'context_size_yyx': 4, 'num_mix_components_yyx': 2, 'context_extractor_yyx': 'lstm', 'activation_func_yyx': 'Tanh', 'L2_weight_yyx': 0.00015817993155279643, 'L_entropy_weight_yyx': 1.727220798410328e-09, 'L_sep_weight_yyx': 2.2063603016194543e-08, 'L_scale_weight_yyx': 8.076159928736413e-07, 'learning_rate_yyx': 0.00833655069292817}. Best is trial 11 with value: -1.8610449438696508.
[I 2026-03-18 22:15:51,769] Trial 34 pruned. 
[I 2026-03-18 22:15:52,539] Trial 35 pruned. 
[I 2026-03-18 22:15:54,370] Trial 41 pruned. 
[I 2026-03-18 22:15:56,442] Trial 34 finished with value: -1.936639626528595 and parameters: {'n_layers_yyx': 1, 'hidden_size_yyx_l0': 6, 'context_size_yyx': 4, 'num_mix_components_yyx': 2, 'context_extractor_yyx': 'gru', 'activation_func_yyx': 'ReLU', 'L2_weight_yyx': 1.013904434009252e-08, 'L_entropy_weight_yyx': 1.5878462345272391e-09, 'L_sep_weight_yyx': 3.3391308759013154e-05, 'L_scale_weight_yyx': 7.724162864180513e-06, 'learning_rate_yyx': 0.008783167294919974}. Best is trial 10 with value: -1.9395614910230956.
[I 2026-03-18 22:15:57,159] Trial 33 pruned. 
[I 2026-03-18 22:16:01,939] Trial 46 pruned. 
[I 2026-03-18 22:16:03,945] Trial 38 pruned. 
[I 2026-03-18 22:16:05,793] Trial 35 pruned. 
[I 2026-03-18 22:16:06,034] Trial 34 pruned. 
[I 2026-03-18 22:16:07,965] Trial 35 pruned. 
[I 2026-03-18 22:16:09,736] Trial 26 finished with value: -1.8660584893517194 and parameters: {'n_layers_yyx': 1, 'hidden_size_yyx_l0': 5, 'context_size_yyx': 3, 'num_mix_components_yyx': 4, 'context_extractor_yyx': 'lstm', 'activation_func_yyx': 'ReLU', 'L2_weight_yyx': 7.987004674830455e-09, 'L_entropy_weight_yyx': 0.00016536737335961097, 'L_sep_weight_yyx': 0.0002851828865261943, 'L_scale_weight_yyx': 1.9131633167932606e-07, 'learning_rate_yyx': 0.003116336629760596}. Best is trial 15 with value: -1.8695785775072098.
[I 2026-03-18 22:16:11,319] Trial 36 pruned. 
[I 2026-03-18 22:16:14,085] Trial 36 pruned. 
[I 2026-03-18 22:16:15,661] Trial 27 finished with value: -1.7830110677083333 and parameters: {'n_layers_yyx': 1, 'hidden_size_yyx_l0': 4, 'context_size_yyx': 3, 'num_mix_components_yyx': 1, 'context_extractor_yyx': 'lstm', 'activation_func_yyx': 'Tanh', 'L2_weight_yyx': 9.04631360943658e-06, 'L_entropy_weight_yyx': 8.166258116534565e-08, 'L_sep_weight_yyx': 2.1375277656491495e-09, 'L_scale_weight_yyx': 8.854248207988068e-07, 'learning_rate_yyx': 0.007923470550773328}. Best is trial 16 with value: -1.790272919625947.
[I 2026-03-18 22:16:16,802] Trial 36 pruned. 
[I 2026-03-18 22:16:20,595] Trial 37 pruned. 
[I 2026-03-18 22:16:22,549] Trial 39 pruned. 
[I 2026-03-18 22:16:22,795] Trial 37 pruned. 
[I 2026-03-18 22:16:26,144] Trial 37 pruned. 
[I 2026-03-18 22:16:30,118] Trial 38 pruned. 
[I 2026-03-18 22:16:31,278] Trial 27 pruned. 
[I 2026-03-18 22:16:32,143] Trial 40 pruned. 
[I 2026-03-18 22:16:34,280] Trial 28 pruned. 
[I 2026-03-18 22:16:36,237] Trial 35 pruned. 
[I 2026-03-18 22:16:39,748] Trial 33 pruned. 
[I 2026-03-18 22:16:43,597] Trial 29 pruned. 
[I 2026-03-18 22:16:44,646] Trial 36 pruned. 
[I 2026-03-18 22:16:45,075] Trial 40 finished with value: -1.8528004393177733 and parameters: {'n_layers_yyx': 1, 'hidden_size_yyx_l0': 6, 'context_size_yyx': 4, 'num_mix_components_yyx': 5, 'context_extractor_yyx': 'gru', 'activation_func_yyx': 'ReLU', 'L2_weight_yyx': 4.21488774812536e-06, 'L_entropy_weight_yyx': 3.098489002115252e-06, 'L_sep_weight_yyx': 1.3019433806349327e-10, 'L_scale_weight_yyx': 7.511434631603851e-10, 'learning_rate_yyx': 0.00671995717784057}. Best is trial 1 with value: -1.8555367853768732.
[I 2026-03-18 22:16:46,233] Trial 37 pruned. 
[I 2026-03-18 22:16:48,591] Trial 39 pruned. 
[I 2026-03-18 22:16:49,464] Trial 28 pruned. 
[I 2026-03-18 22:16:52,924] Trial 30 pruned. 
[I 2026-03-18 22:16:55,173] Trial 41 pruned. 
[I 2026-03-18 22:16:56,352] Trial 38 pruned. 
[I 2026-03-18 22:16:59,623] Trial 29 pruned. 
[I 2026-03-18 22:17:03,879] Trial 37 pruned. 
[I 2026-03-18 22:17:09,451] Trial 40 pruned. 
[I 2026-03-18 22:17:13,029] Trial 24 finished with value: -1.932463661716903 and parameters: {'n_layers_yyx': 2, 'hidden_size_yyx_l0': 6, 'hidden_size_yyx_l1': 6, 'context_size_yyx': 2, 'num_mix_components_yyx': 3, 'context_extractor_yyx': 'gru', 'activation_func_yyx': 'GELU', 'L2_weight_yyx': 1.4642252466018182e-05, 'L_entropy_weight_yyx': 2.959352612663875e-05, 'L_sep_weight_yyx': 2.255542219537902e-06, 'L_scale_weight_yyx': 1.474741223122336e-10, 'learning_rate_yyx': 0.007772569633725863}. Best is trial 14 with value: -1.9337542258067992.
[I 2026-03-18 22:17:13,665] Trial 38 pruned. 
[I 2026-03-18 22:17:15,349] Trial 38 pruned. 
[I 2026-03-18 22:17:20,844] Trial 41 pruned. 
[I 2026-03-18 22:17:21,663] Trial 41 pruned. 
[I 2026-03-18 22:17:21,889] Trial 41 pruned. 
[I 2026-03-18 22:17:22,345] Trial 30 pruned. 
[I 2026-03-18 22:17:34,725] Trial 42 finished with value: -1.847521221191577 and parameters: {'n_layers_yyx': 2, 'hidden_size_yyx_l0': 2, 'hidden_size_yyx_l1': 4, 'context_size_yyx': 3, 'num_mix_components_yyx': 5, 'context_extractor_yyx': 'lstm', 'activation_func_yyx': 'GELU', 'L2_weight_yyx': 1.6914751519254844e-08, 'L_entropy_weight_yyx': 0.00011119311614412928, 'L_sep_weight_yyx': 5.74097648333562e-05, 'L_scale_weight_yyx': 3.314542796137272e-09, 'learning_rate_yyx': 0.008734143645881686}. Best is trial 16 with value: -1.8488733665890609.
[I 2026-03-18 22:17:35,713] Trial 31 pruned. 
[I 2026-03-18 22:17:38,106] Trial 39 pruned. 
[I 2026-03-18 22:17:39,932] Trial 21 finished with value: -1.8543207984125953 and parameters: {'n_layers_yyx': 1, 'hidden_size_yyx_l0': 5, 'context_size_yyx': 2, 'num_mix_components_yyx': 5, 'context_extractor_yyx': 'gru', 'activation_func_yyx': 'GELU', 'L2_weight_yyx': 2.703563941947818e-09, 'L_entropy_weight_yyx': 3.5356984446066426e-09, 'L_sep_weight_yyx': 1.284155495575087e-08, 'L_scale_weight_yyx': 7.610804451212706e-07, 'learning_rate_yyx': 0.006182511139436208}. Best is trial 12 with value: -1.8566309981104903.
[I 2026-03-18 22:17:44,602] Trial 42 pruned. 
[I 2026-03-18 22:17:45,505] Trial 42 pruned. 
[I 2026-03-18 22:17:49,307] Trial 40 pruned. 
[I 2026-03-18 22:18:00,439] Trial 41 pruned. 
[I 2026-03-18 22:18:07,532] Trial 47 finished with value: -1.8032300364025378 and parameters: {'n_layers_yyx': 2, 'hidden_size_yyx_l0': 4, 'hidden_size_yyx_l1': 5, 'context_size_yyx': 3, 'num_mix_components_yyx': 3, 'context_extractor_yyx': 'gru', 'activation_func_yyx': 'GELU', 'L2_weight_yyx': 2.6091609776254407e-05, 'L_entropy_weight_yyx': 1.0169390128092053e-06, 'L_sep_weight_yyx': 1.070560988965098e-05, 'L_scale_weight_yyx': 4.555042253146937e-06, 'learning_rate_yyx': 0.009608464231046686}. Best is trial 27 with value: -1.8062570642302185.
[I 2026-03-18 22:18:10,867] Trial 39 pruned. 
[I 2026-03-18 22:18:21,692] Trial 40 pruned. 
[I 2026-03-18 22:18:38,594] Trial 43 pruned. 
[I 2026-03-18 22:18:38,968] Trial 34 finished with value: -1.8576005392411643 and parameters: {'n_layers_yyx': 2, 'hidden_size_yyx_l0': 5, 'hidden_size_yyx_l1': 5, 'context_size_yyx': 4, 'num_mix_components_yyx': 3, 'context_extractor_yyx': 'lstm', 'activation_func_yyx': 'Tanh', 'L2_weight_yyx': 7.951023854163357e-06, 'L_entropy_weight_yyx': 4.876107393716102e-10, 'L_sep_weight_yyx': 4.884889202349267e-07, 'L_scale_weight_yyx': 9.781851119683449e-05, 'learning_rate_yyx': 0.00917040016990571}. Best is trial 11 with value: -1.8610449438696508.
[I 2026-03-18 22:18:40,834] Trial 25 finished with value: -1.9073679197294868 and parameters: {'n_layers_yyx': 2, 'hidden_size_yyx_l0': 6, 'hidden_size_yyx_l1': 5, 'context_size_yyx': 3, 'num_mix_components_yyx': 3, 'context_extractor_yyx': 'gru', 'activation_func_yyx': 'GELU', 'L2_weight_yyx': 1.3436201550288445e-06, 'L_entropy_weight_yyx': 2.0299103023826564e-05, 'L_sep_weight_yyx': 1.3193263469428532e-06, 'L_scale_weight_yyx': 1.521271954467025e-10, 'learning_rate_yyx': 0.009844325222496038}. Best is trial 14 with value: -1.9337542258067992.
[I 2026-03-18 22:18:42,390] Trial 41 pruned. 
[I 2026-03-18 22:18:42,909] Trial 43 pruned. 
[I 2026-03-18 22:18:47,802] Trial 38 finished with value: -1.8497971754807692 and parameters: {'n_layers_yyx': 2, 'hidden_size_yyx_l0': 2, 'hidden_size_yyx_l1': 3, 'context_size_yyx': 3, 'num_mix_components_yyx': 4, 'context_extractor_yyx': 'gru', 'activation_func_yyx': 'GELU', 'L2_weight_yyx': 7.946559086122613e-06, 'L_entropy_weight_yyx': 1.5707261320315028e-09, 'L_sep_weight_yyx': 1.3438934357068737e-08, 'L_scale_weight_yyx': 2.105250132330498e-10, 'learning_rate_yyx': 0.00651664314855675}. Best is trial 9 with value: -1.8570869006965198.
[I 2026-03-18 22:18:51,119] Trial 35 finished with value: -1.889977999126928 and parameters: {'n_layers_yyx': 2, 'hidden_size_yyx_l0': 5, 'hidden_size_yyx_l1': 3, 'context_size_yyx': 2, 'num_mix_components_yyx': 5, 'context_extractor_yyx': 'lstm', 'activation_func_yyx': 'Tanh', 'L2_weight_yyx': 0.0009933759129392785, 'L_entropy_weight_yyx': 1.2058929055761342e-07, 'L_sep_weight_yyx': 5.124416139267878e-09, 'L_scale_weight_yyx': 2.069190469256386e-06, 'learning_rate_yyx': 0.0055867873765043175}. Best is trial 5 with value: -1.89157565728699.
[I 2026-03-18 22:18:53,738] Trial 44 pruned. 
[I 2026-03-18 22:18:54,308] Trial 42 pruned. 
[I 2026-03-18 22:18:59,201] Trial 44 pruned. 
[I 2026-03-18 22:19:01,357] Trial 36 pruned. 
[I 2026-03-18 22:19:04,508] Trial 26 pruned. 
[I 2026-03-18 22:19:04,530] Trial 45 pruned. 
[I 2026-03-18 22:19:11,691] Trial 37 pruned. 
[I 2026-03-18 22:19:14,475] Trial 43 pruned. 
[I 2026-03-18 22:19:17,377] Trial 32 finished with value: -1.868217680562588 and parameters: {'n_layers_yyx': 1, 'hidden_size_yyx_l0': 6, 'context_size_yyx': 4, 'num_mix_components_yyx': 3, 'context_extractor_yyx': 'lstm', 'activation_func_yyx': 'ReLU', 'L2_weight_yyx': 1.4015926509872367e-09, 'L_entropy_weight_yyx': 1.1009898563142791e-07, 'L_sep_weight_yyx': 1.8197833573751484e-06, 'L_scale_weight_yyx': 1.5141691769105557e-08, 'learning_rate_yyx': 0.008069449353195255}. Best is trial 15 with value: -1.8695785775072098.
[I 2026-03-18 22:19:20,342] Trial 45 pruned. 
[I 2026-03-18 22:19:21,670] Trial 38 pruned. 
[I 2026-03-18 22:19:24,691] Trial 39 finished with value: -1.8358029308041515 and parameters: {'n_layers_yyx': 2, 'hidden_size_yyx_l0': 3, 'hidden_size_yyx_l1': 5, 'context_size_yyx': 2, 'num_mix_components_yyx': 1, 'context_extractor_yyx': 'gru', 'activation_func_yyx': 'Tanh', 'L2_weight_yyx': 2.740989661139086e-10, 'L_entropy_weight_yyx': 2.828870356961229e-10, 'L_sep_weight_yyx': 5.5581898415314556e-08, 'L_scale_weight_yyx': 1.4576576577676127e-08, 'learning_rate_yyx': 0.008206937882430121}. Best is trial 9 with value: -1.853392962523822.
[I 2026-03-18 22:19:26,914] Trial 46 pruned. 
[I 2026-03-18 22:19:27,548] Trial 31 pruned. 
[I 2026-03-18 22:19:27,933] Trial 43 finished with value: -1.8474813209792542 and parameters: {'n_layers_yyx': 2, 'hidden_size_yyx_l0': 2, 'hidden_size_yyx_l1': 4, 'context_size_yyx': 3, 'num_mix_components_yyx': 5, 'context_extractor_yyx': 'lstm', 'activation_func_yyx': 'GELU', 'L2_weight_yyx': 4.823895589968408e-09, 'L_entropy_weight_yyx': 4.659904422931448e-05, 'L_sep_weight_yyx': 9.669056631536172e-05, 'L_scale_weight_yyx': 5.9389793060414606e-08, 'learning_rate_yyx': 0.008442956493021445}. Best is trial 16 with value: -1.8488733665890609.
[I 2026-03-18 22:19:35,772] Trial 40 pruned. 
[I 2026-03-18 22:19:35,978] Trial 42 finished with value: -1.8518337321132732 and parameters: {'n_layers_yyx': 1, 'hidden_size_yyx_l0': 5, 'context_size_yyx': 2, 'num_mix_components_yyx': 2, 'context_extractor_yyx': 'lstm', 'activation_func_yyx': 'ReLU', 'L2_weight_yyx': 3.485601739875704e-05, 'L_entropy_weight_yyx': 4.0376422787940815e-09, 'L_sep_weight_yyx': 4.6191110845308066e-09, 'L_scale_weight_yyx': 0.00018409511790856727, 'learning_rate_yyx': 0.008262793398116145}. Best is trial 1 with value: -1.8555367853768732.
[I 2026-03-18 22:19:42,724] Trial 22 finished with value: -1.851198700014618 and parameters: {'n_layers_yyx': 2, 'hidden_size_yyx_l0': 5, 'hidden_size_yyx_l1': 6, 'context_size_yyx': 2, 'num_mix_components_yyx': 4, 'context_extractor_yyx': 'gru', 'activation_func_yyx': 'GELU', 'L2_weight_yyx': 6.040480014379874e-05, 'L_entropy_weight_yyx': 6.102376636828931e-10, 'L_sep_weight_yyx': 5.943554976126841e-08, 'L_scale_weight_yyx': 5.313972932013028e-07, 'learning_rate_yyx': 0.009809029529674915}. Best is trial 12 with value: -1.8566309981104903.
[I 2026-03-18 22:19:42,771] Trial 39 pruned. 
[I 2026-03-18 22:19:43,429] Trial 48 finished with value: -1.802411694014836 and parameters: {'n_layers_yyx': 2, 'hidden_size_yyx_l0': 5, 'hidden_size_yyx_l1': 5, 'context_size_yyx': 3, 'num_mix_components_yyx': 3, 'context_extractor_yyx': 'gru', 'activation_func_yyx': 'GELU', 'L2_weight_yyx': 2.827523634590005e-05, 'L_entropy_weight_yyx': 1.1231282614347746e-06, 'L_sep_weight_yyx': 7.83156153177411e-06, 'L_scale_weight_yyx': 6.382167903066673e-06, 'learning_rate_yyx': 0.0097093660215857}. Best is trial 27 with value: -1.8062570642302185.
[I 2026-03-18 22:19:44,151] Trial 39 pruned. 
[I 2026-03-18 22:19:49,523] Trial 32 pruned. 
[I 2026-03-18 22:19:50,314] Trial 42 finished with value: -1.8491906030688672 and parameters: {'n_layers_yyx': 2, 'hidden_size_yyx_l0': 6, 'hidden_size_yyx_l1': 3, 'context_size_yyx': 1, 'num_mix_components_yyx': 4, 'context_extractor_yyx': 'lstm', 'activation_func_yyx': 'ReLU', 'L2_weight_yyx': 0.0006489037914984648, 'L_entropy_weight_yyx': 2.0082803155459536e-06, 'L_sep_weight_yyx': 2.3321061245605407e-10, 'L_scale_weight_yyx': 1.5627835983881357e-08, 'learning_rate_yyx': 0.00699413960511649}. Best is trial 0 with value: -1.8516305051550026.
[I 2026-03-18 22:19:57,415] Trial 27 pruned. 
[I 2026-03-18 22:19:58,548] Trial 41 pruned. 
[I 2026-03-18 22:20:03,432] Trial 40 pruned. 
[I 2026-03-18 22:20:03,791] Trial 49 pruned. 
[I 2026-03-18 22:20:06,557] Trial 44 pruned. 
[I 2026-03-18 22:20:09,139] Trial 42 pruned. 
[I 2026-03-18 22:20:11,692] Trial 42 finished with value: -1.779115569760101 and parameters: {'n_layers_yyx': 2, 'hidden_size_yyx_l0': 6, 'hidden_size_yyx_l1': 5, 'context_size_yyx': 4, 'num_mix_components_yyx': 3, 'context_extractor_yyx': 'gru', 'activation_func_yyx': 'GELU', 'L2_weight_yyx': 1.5809135862378322e-08, 'L_entropy_weight_yyx': 1.0376467540227555e-06, 'L_sep_weight_yyx': 1.186108363143382e-06, 'L_scale_weight_yyx': 4.999376822351935e-06, 'learning_rate_yyx': 0.009142951366235679}. Best is trial 7 with value: -1.7817573439472854.
[I 2026-03-18 22:20:21,441] Trial 43 pruned. 
[I 2026-03-18 22:20:25,084] Trial 44 pruned. 
[I 2026-03-18 22:20:25,435] Trial 41 pruned. 
[I 2026-03-18 22:20:30,602] Trial 43 pruned. 
[I 2026-03-18 22:20:34,077] Trial 44 pruned. 
[I 2026-03-18 22:20:34,184] Trial 35 finished with value: -1.860028410321379 and parameters: {'n_layers_yyx': 2, 'hidden_size_yyx_l0': 5, 'hidden_size_yyx_l1': 6, 'context_size_yyx': 4, 'num_mix_components_yyx': 1, 'context_extractor_yyx': 'lstm', 'activation_func_yyx': 'Tanh', 'L2_weight_yyx': 3.528254900344782e-05, 'L_entropy_weight_yyx': 1.8203292678690317e-09, 'L_sep_weight_yyx': 6.342164479877636e-08, 'L_scale_weight_yyx': 3.9566922560963826e-10, 'learning_rate_yyx': 0.00783380407394036}. Best is trial 11 with value: -1.8610449438696508.
[I 2026-03-18 22:20:36,101] Trial 33 finished with value: -1.8683452760723958 and parameters: {'n_layers_yyx': 1, 'hidden_size_yyx_l0': 6, 'context_size_yyx': 4, 'num_mix_components_yyx': 4, 'context_extractor_yyx': 'lstm', 'activation_func_yyx': 'ReLU', 'L2_weight_yyx': 1.2367936724297711e-09, 'L_entropy_weight_yyx': 2.072436881152042e-08, 'L_sep_weight_yyx': 2.7394371698717905e-06, 'L_scale_weight_yyx': 3.7148440512585524e-09, 'learning_rate_yyx': 0.009490039019761694}. Best is trial 15 with value: -1.8695785775072098.
[I 2026-03-18 22:20:36,531] Trial 42 pruned. 
[I 2026-03-18 22:20:42,414] Trial 40 pruned. 
[I 2026-03-18 22:20:45,667] Trial 43 pruned. 
[I 2026-03-18 22:20:45,921] Trial 33 pruned. 
[I 2026-03-18 22:20:46,480] Trial 45 pruned. 
[I 2026-03-18 22:20:47,208] Trial 45 pruned. 
[I 2026-03-18 22:20:48,252] Trial 43 pruned. 
[I 2026-03-18 22:20:53,120] Trial 41 pruned. 
[I 2026-03-18 22:20:55,780] Trial 50 pruned. 
[I 2026-03-18 22:20:56,268] Trial 36 pruned. 
[I 2026-03-18 22:21:06,796] Trial 44 pruned. 
