[I 2026-03-18 17:37:25,278] Trial 36 finished with value: -2.9052901506063256 and parameters: {'n_layers_yyx': 2, 'hidden_size_yyx_l0': 5, 'hidden_size_yyx_l1': 6, 'context_size_yyx': 1, 'num_mix_components_yyx': 4, 'context_extractor_yyx': 'gru', 'activation_func_yyx': 'ReLU', 'L2_weight_yyx': 4.033026354674147e-05, 'L_entropy_weight_yyx': 3.2137597760743334e-10, 'L_sep_weight_yyx': 4.771051009835288e-10, 'L_scale_weight_yyx': 0.0001210128134390667, 'learning_rate_yyx': 0.00566306727564375}. Best is trial 0 with value: -2.957957273051406.
[I 2026-03-18 17:37:26,345] Trial 28 pruned. 
[I 2026-03-18 17:37:27,957] Trial 19 finished with value: -2.8917082124326305 and parameters: {'n_layers_yyx': 2, 'hidden_size_yyx_l0': 3, 'hidden_size_yyx_l1': 5, 'context_size_yyx': 3, 'num_mix_components_yyx': 5, 'context_extractor_yyx': 'lstm', 'activation_func_yyx': 'ReLU', 'L2_weight_yyx': 1.500916338769997e-07, 'L_entropy_weight_yyx': 0.0007374944418679544, 'L_sep_weight_yyx': 8.06715267354e-08, 'L_scale_weight_yyx': 2.867701147307872e-09, 'learning_rate_yyx': 0.006554806559124416}. Best is trial 18 with value: -2.936145807478804.
[I 2026-03-18 17:37:29,831] Trial 36 pruned. 
[I 2026-03-18 17:37:30,250] Trial 38 pruned. 
[I 2026-03-18 17:37:34,698] Trial 37 pruned. 
[I 2026-03-18 17:37:35,677] Trial 29 pruned. 
[I 2026-03-18 17:37:37,247] Trial 18 pruned. 
[I 2026-03-18 17:37:38,807] Trial 37 pruned. 
[I 2026-03-18 17:37:47,094] Trial 38 pruned. 
[I 2026-03-18 17:37:54,468] Trial 19 pruned. 
[I 2026-03-18 17:37:57,441] Trial 24 finished with value: -2.9676210496741837 and parameters: {'n_layers_yyx': 1, 'hidden_size_yyx_l0': 5, 'context_size_yyx': 4, 'num_mix_components_yyx': 3, 'context_extractor_yyx': 'gru', 'activation_func_yyx': 'GELU', 'L2_weight_yyx': 9.007148465610554e-10, 'L_entropy_weight_yyx': 6.1332107335517794e-09, 'L_sep_weight_yyx': 3.4680959205261266e-09, 'L_scale_weight_yyx': 3.944317175205265e-06, 'learning_rate_yyx': 0.007245669605430986}. Best is trial 24 with value: -2.9676210496741837.
[I 2026-03-18 17:38:04,237] Trial 20 pruned. 
[I 2026-03-18 17:38:10,761] Trial 37 finished with value: -2.911071407993334 and parameters: {'n_layers_yyx': 2, 'hidden_size_yyx_l0': 5, 'hidden_size_yyx_l1': 6, 'context_size_yyx': 2, 'num_mix_components_yyx': 5, 'context_extractor_yyx': 'lstm', 'activation_func_yyx': 'Tanh', 'L2_weight_yyx': 3.74633178826339e-08, 'L_entropy_weight_yyx': 2.8928682761588164e-05, 'L_sep_weight_yyx': 1.262446405215742e-06, 'L_scale_weight_yyx': 1.0512994794067928e-10, 'learning_rate_yyx': 0.008009099021643703}. Best is trial 12 with value: -2.9595510816550052.
[I 2026-03-18 17:38:19,828] Trial 38 pruned. 
[I 2026-03-18 17:38:40,995] Trial 39 pruned. 
[I 2026-03-18 17:38:42,574] Trial 18 finished with value: -2.9708932860218953 and parameters: {'n_layers_yyx': 1, 'hidden_size_yyx_l0': 5, 'context_size_yyx': 3, 'num_mix_components_yyx': 2, 'context_extractor_yyx': 'lstm', 'activation_func_yyx': 'Tanh', 'L2_weight_yyx': 5.6988068500346646e-08, 'L_entropy_weight_yyx': 1.0671195408449603e-06, 'L_sep_weight_yyx': 1.5928271235038158e-07, 'L_scale_weight_yyx': 1.9106866883071e-09, 'learning_rate_yyx': 0.006802849686238188}. Best is trial 18 with value: -2.9708932860218953.
[I 2026-03-18 17:38:50,037] Trial 29 pruned. 
[I 2026-03-18 17:38:52,881] Trial 16 finished with value: -2.9637252953818396 and parameters: {'n_layers_yyx': 1, 'hidden_size_yyx_l0': 4, 'context_size_yyx': 3, 'num_mix_components_yyx': 4, 'context_extractor_yyx': 'gru', 'activation_func_yyx': 'Tanh', 'L2_weight_yyx': 9.537232546262148e-07, 'L_entropy_weight_yyx': 8.684697227329462e-06, 'L_sep_weight_yyx': 0.0007822221670948211, 'L_scale_weight_yyx': 3.4425811045121833e-07, 'learning_rate_yyx': 0.0061389538767922915}. Best is trial 16 with value: -2.9637252953818396.
[I 2026-03-18 17:38:53,046] Trial 21 pruned. 
[I 2026-03-18 17:38:54,233] Trial 29 finished with value: -2.9478307311365355 and parameters: {'n_layers_yyx': 2, 'hidden_size_yyx_l0': 3, 'hidden_size_yyx_l1': 4, 'context_size_yyx': 4, 'num_mix_components_yyx': 3, 'context_extractor_yyx': 'lstm', 'activation_func_yyx': 'ReLU', 'L2_weight_yyx': 1.0418932868026613e-10, 'L_entropy_weight_yyx': 8.459227091212404e-07, 'L_sep_weight_yyx': 3.7679032595505155e-05, 'L_scale_weight_yyx': 2.67517929148172e-08, 'learning_rate_yyx': 0.006610628955996513}. Best is trial 6 with value: -2.966045431578574.
[I 2026-03-18 17:38:59,561] Trial 19 pruned. 
[I 2026-03-18 17:39:00,105] Trial 40 pruned. 
[I 2026-03-18 17:39:14,724] Trial 30 pruned. 
[I 2026-03-18 17:39:18,480] Trial 20 pruned. 
[I 2026-03-18 17:39:23,137] Trial 39 finished with value: -2.8753787577790417 and parameters: {'n_layers_yyx': 2, 'hidden_size_yyx_l0': 3, 'hidden_size_yyx_l1': 2, 'context_size_yyx': 3, 'num_mix_components_yyx': 5, 'context_extractor_yyx': 'lstm', 'activation_func_yyx': 'GELU', 'L2_weight_yyx': 7.929825012864721e-09, 'L_entropy_weight_yyx': 0.0001972794136179407, 'L_sep_weight_yyx': 0.0002625388270063986, 'L_scale_weight_yyx': 1.7383738258469885e-08, 'learning_rate_yyx': 0.006384337986645516}. Best is trial 14 with value: -2.8923891953788936.
[I 2026-03-18 17:39:27,373] Trial 26 finished with value: -2.90557532451619 and parameters: {'n_layers_yyx': 2, 'hidden_size_yyx_l0': 5, 'hidden_size_yyx_l1': 5, 'context_size_yyx': 3, 'num_mix_components_yyx': 2, 'context_extractor_yyx': 'lstm', 'activation_func_yyx': 'GELU', 'L2_weight_yyx': 2.3208584261366903e-05, 'L_entropy_weight_yyx': 6.865029684394924e-05, 'L_sep_weight_yyx': 1.2428435981432583e-08, 'L_scale_weight_yyx': 3.855519389159609e-08, 'learning_rate_yyx': 0.006406075697165686}. Best is trial 8 with value: -2.955956673037092.
[I 2026-03-18 17:39:33,272] Trial 40 pruned. 
[I 2026-03-18 17:39:38,223] Trial 21 pruned. 
[I 2026-03-18 17:39:42,013] Trial 41 pruned. 
[I 2026-03-18 17:39:43,469] Trial 17 pruned. 
[I 2026-03-18 17:39:44,590] Trial 22 pruned. 
[I 2026-03-18 17:39:47,887] Trial 22 pruned. 
[I 2026-03-18 17:39:48,147] Trial 27 pruned. 
[I 2026-03-18 17:39:51,415] Trial 41 pruned. 
[I 2026-03-18 17:39:54,390] Trial 27 finished with value: -2.9392531871061682 and parameters: {'n_layers_yyx': 2, 'hidden_size_yyx_l0': 3, 'hidden_size_yyx_l1': 2, 'context_size_yyx': 2, 'num_mix_components_yyx': 5, 'context_extractor_yyx': 'gru', 'activation_func_yyx': 'Tanh', 'L2_weight_yyx': 1.2124947985701544e-07, 'L_entropy_weight_yyx': 2.570520207347111e-08, 'L_sep_weight_yyx': 1.1864223141131432e-07, 'L_scale_weight_yyx': 6.351101993150137e-07, 'learning_rate_yyx': 0.004830620134537323}. Best is trial 0 with value: -2.973312761552399.
[I 2026-03-18 17:39:56,807] Trial 28 pruned. 
[I 2026-03-18 17:39:57,979] Trial 30 pruned. 
[I 2026-03-18 17:40:03,202] Trial 28 pruned. 
[I 2026-03-18 17:40:05,589] Trial 31 pruned. 
[I 2026-03-18 17:40:05,957] Trial 29 pruned. 
[I 2026-03-18 17:40:06,485] Trial 23 pruned. 
[I 2026-03-18 17:40:14,975] Trial 32 pruned. 
[I 2026-03-18 17:40:21,845] Trial 29 pruned. 
[I 2026-03-18 17:40:24,466] Trial 30 pruned. 
[I 2026-03-18 17:40:31,357] Trial 38 finished with value: -2.9771706662392052 and parameters: {'n_layers_yyx': 2, 'hidden_size_yyx_l0': 5, 'hidden_size_yyx_l1': 4, 'context_size_yyx': 4, 'num_mix_components_yyx': 2, 'context_extractor_yyx': 'lstm', 'activation_func_yyx': 'ReLU', 'L2_weight_yyx': 1.7110390408183637e-07, 'L_entropy_weight_yyx': 3.7198190922542967e-09, 'L_sep_weight_yyx': 1.4161543725398289e-09, 'L_scale_weight_yyx': 2.773096614246603e-10, 'learning_rate_yyx': 0.007587196137513148}. Best is trial 38 with value: -2.9771706662392052.
[I 2026-03-18 17:40:34,291] Trial 39 finished with value: -2.958758517220594 and parameters: {'n_layers_yyx': 2, 'hidden_size_yyx_l0': 2, 'hidden_size_yyx_l1': 5, 'context_size_yyx': 3, 'num_mix_components_yyx': 5, 'context_extractor_yyx': 'gru', 'activation_func_yyx': 'Tanh', 'L2_weight_yyx': 1.657301325059182e-07, 'L_entropy_weight_yyx': 6.6275137354364685e-06, 'L_sep_weight_yyx': 6.710489502722389e-06, 'L_scale_weight_yyx': 1.1814485229164894e-08, 'learning_rate_yyx': 0.008567773662817808}. Best is trial 34 with value: -2.96234983443252.
[I 2026-03-18 17:40:34,478] Trial 33 pruned. 
[I 2026-03-18 17:40:39,929] Trial 42 pruned. 
[I 2026-03-18 17:40:44,017] Trial 32 finished with value: -2.9272066040346854 and parameters: {'n_layers_yyx': 1, 'hidden_size_yyx_l0': 6, 'context_size_yyx': 2, 'num_mix_components_yyx': 3, 'context_extractor_yyx': 'gru', 'activation_func_yyx': 'GELU', 'L2_weight_yyx': 5.42618820097096e-07, 'L_entropy_weight_yyx': 0.00022987371407466153, 'L_sep_weight_yyx': 0.0002224917383998809, 'L_scale_weight_yyx': 3.5939460864830957e-07, 'learning_rate_yyx': 0.00801626776334257}. Best is trial 9 with value: -2.9510968045279404.
[I 2026-03-18 17:40:45,730] Trial 31 pruned. 
[I 2026-03-18 17:40:47,660] Trial 39 pruned. 
[I 2026-03-18 17:40:50,952] Trial 40 pruned. 
[I 2026-03-18 17:40:51,741] Trial 34 pruned. 
[I 2026-03-18 17:40:52,504] Trial 20 finished with value: -2.9556409226964355 and parameters: {'n_layers_yyx': 1, 'hidden_size_yyx_l0': 4, 'context_size_yyx': 3, 'num_mix_components_yyx': 4, 'context_extractor_yyx': 'lstm', 'activation_func_yyx': 'GELU', 'L2_weight_yyx': 3.789745633428058e-09, 'L_entropy_weight_yyx': 6.283706155893215e-05, 'L_sep_weight_yyx': 3.404646870843344e-05, 'L_scale_weight_yyx': 1.8360587802158252e-10, 'learning_rate_yyx': 0.005834158334027024}. Best is trial 20 with value: -2.9556409226964355.
[I 2026-03-18 17:40:59,820] Trial 21 pruned. 
[I 2026-03-18 17:41:00,338] Trial 33 pruned. 
[I 2026-03-18 17:41:04,328] Trial 40 pruned. 
[I 2026-03-18 17:41:05,323] Trial 30 pruned. 
[I 2026-03-18 17:41:07,372] Trial 25 finished with value: -2.9648780072510874 and parameters: {'n_layers_yyx': 1, 'hidden_size_yyx_l0': 5, 'context_size_yyx': 4, 'num_mix_components_yyx': 3, 'context_extractor_yyx': 'gru', 'activation_func_yyx': 'GELU', 'L2_weight_yyx': 5.476462607742717e-10, 'L_entropy_weight_yyx': 6.968445401738632e-09, 'L_sep_weight_yyx': 1.1965113310461768e-08, 'L_scale_weight_yyx': 2.604818523504261e-06, 'learning_rate_yyx': 0.007329563277621787}. Best is trial 24 with value: -2.9676210496741837.
[I 2026-03-18 17:41:07,791] Trial 22 finished with value: -2.9660620215680944 and parameters: {'n_layers_yyx': 1, 'hidden_size_yyx_l0': 5, 'context_size_yyx': 4, 'num_mix_components_yyx': 2, 'context_extractor_yyx': 'gru', 'activation_func_yyx': 'ReLU', 'L2_weight_yyx': 1.4564025934759542e-09, 'L_entropy_weight_yyx': 1.9233328288028893e-05, 'L_sep_weight_yyx': 4.1634027696746624e-05, 'L_scale_weight_yyx': 3.0184331272241233e-09, 'learning_rate_yyx': 0.005596530096379092}. Best is trial 22 with value: -2.9660620215680944.
[I 2026-03-18 17:41:08,278] Trial 35 pruned. 
[I 2026-03-18 17:41:14,542] Trial 26 pruned. 
[I 2026-03-18 17:41:16,113] Trial 34 pruned. 
[I 2026-03-18 17:41:16,146] Trial 36 pruned. 
[I 2026-03-18 17:41:17,199] Trial 38 finished with value: -2.9772164964699948 and parameters: {'n_layers_yyx': 2, 'hidden_size_yyx_l0': 3, 'hidden_size_yyx_l1': 2, 'context_size_yyx': 3, 'num_mix_components_yyx': 4, 'context_extractor_yyx': 'lstm', 'activation_func_yyx': 'Tanh', 'L2_weight_yyx': 9.455084785716405e-06, 'L_entropy_weight_yyx': 7.119186921555104e-09, 'L_sep_weight_yyx': 5.141106182979833e-05, 'L_scale_weight_yyx': 2.0776489263839363e-09, 'learning_rate_yyx': 0.009636908219771097}. Best is trial 37 with value: -2.980594852387875.
[I 2026-03-18 17:41:23,710] Trial 35 pruned. 
[I 2026-03-18 17:41:24,106] Trial 23 pruned. 
[I 2026-03-18 17:41:29,669] Trial 32 pruned. 
[I 2026-03-18 17:41:31,910] Trial 24 pruned. 
[I 2026-03-18 17:41:37,932] Trial 33 pruned. 
[I 2026-03-18 17:41:40,016] Trial 25 pruned. 
[I 2026-03-18 17:41:45,781] Trial 34 pruned. 
[I 2026-03-18 17:41:48,566] Trial 31 pruned. 
[I 2026-03-18 17:41:50,429] Trial 18 pruned. 
[I 2026-03-18 17:41:50,802] Trial 23 pruned. 
[I 2026-03-18 17:41:53,602] Trial 35 pruned. 
[I 2026-03-18 17:41:56,769] Trial 26 pruned. 
[I 2026-03-18 17:41:58,026] Trial 19 pruned. 
[I 2026-03-18 17:41:58,032] Trial 27 pruned. 
[I 2026-03-18 17:42:01,085] Trial 37 pruned. 
[I 2026-03-18 17:42:03,332] Trial 31 finished with value: -2.9132549769360296 and parameters: {'n_layers_yyx': 2, 'hidden_size_yyx_l0': 3, 'hidden_size_yyx_l1': 5, 'context_size_yyx': 4, 'num_mix_components_yyx': 4, 'context_extractor_yyx': 'gru', 'activation_func_yyx': 'GELU', 'L2_weight_yyx': 0.0009435568374838084, 'L_entropy_weight_yyx': 5.608530129303255e-07, 'L_sep_weight_yyx': 1.316043738375049e-06, 'L_scale_weight_yyx': 5.934549844448109e-10, 'learning_rate_yyx': 0.009727188314824293}. Best is trial 8 with value: -2.955956673037092.
[I 2026-03-18 17:42:04,344] Trial 27 pruned. 
[I 2026-03-18 17:42:05,685] Trial 28 pruned. 
[I 2026-03-18 17:42:07,205] Trial 24 pruned. 
[I 2026-03-18 17:42:11,477] Trial 32 pruned. 
[I 2026-03-18 17:42:17,260] Trial 38 pruned. 
[I 2026-03-18 17:42:18,899] Trial 33 pruned. 
[I 2026-03-18 17:42:20,761] Trial 28 pruned. 
[I 2026-03-18 17:42:22,188] Trial 30 pruned. 
[I 2026-03-18 17:42:28,520] Trial 29 pruned. 
[I 2026-03-18 17:42:30,176] Trial 31 pruned. 
[I 2026-03-18 17:42:36,348] Trial 34 pruned. 
[I 2026-03-18 17:42:36,688] Trial 30 pruned. 
[I 2026-03-18 17:42:39,785] Trial 43 finished with value: -2.9596577623668368 and parameters: {'n_layers_yyx': 2, 'hidden_size_yyx_l0': 6, 'hidden_size_yyx_l1': 6, 'context_size_yyx': 3, 'num_mix_components_yyx': 5, 'context_extractor_yyx': 'gru', 'activation_func_yyx': 'Tanh', 'L2_weight_yyx': 1.4509058558722437e-06, 'L_entropy_weight_yyx': 5.2604516537653956e-08, 'L_sep_weight_yyx': 5.8121289417917656e-08, 'L_scale_weight_yyx': 6.01222251393598e-10, 'learning_rate_yyx': 0.008366328112888581}. Best is trial 43 with value: -2.9596577623668368.
[I 2026-03-18 17:42:47,346] Trial 32 pruned. 
[I 2026-03-18 17:42:49,607] Trial 29 pruned. 
[I 2026-03-18 17:42:57,083] Trial 24 finished with value: -2.966457345761295 and parameters: {'n_layers_yyx': 1, 'hidden_size_yyx_l0': 5, 'context_size_yyx': 4, 'num_mix_components_yyx': 4, 'context_extractor_yyx': 'gru', 'activation_func_yyx': 'Tanh', 'L2_weight_yyx': 0.00012485400204213166, 'L_entropy_weight_yyx': 1.6682911929258614e-08, 'L_sep_weight_yyx': 8.512868483970883e-09, 'L_scale_weight_yyx': 1.0723607885547399e-05, 'learning_rate_yyx': 0.0077061051960913025}. Best is trial 18 with value: -2.9708932860218953.
[I 2026-03-18 17:43:01,203] Trial 39 pruned. 
[I 2026-03-18 17:43:04,638] Trial 33 pruned. 
[I 2026-03-18 17:43:06,783] Trial 30 pruned. 
[I 2026-03-18 17:43:08,930] Trial 40 pruned. 
[I 2026-03-18 17:43:15,102] Trial 41 finished with value: -2.958662701566834 and parameters: {'n_layers_yyx': 2, 'hidden_size_yyx_l0': 2, 'hidden_size_yyx_l1': 5, 'context_size_yyx': 3, 'num_mix_components_yyx': 5, 'context_extractor_yyx': 'gru', 'activation_func_yyx': 'Tanh', 'L2_weight_yyx': 1.8905189638798607e-07, 'L_entropy_weight_yyx': 5.161243922746876e-07, 'L_sep_weight_yyx': 0.0001563493195133415, 'L_scale_weight_yyx': 4.95149734374386e-09, 'learning_rate_yyx': 0.008559421732907291}. Best is trial 34 with value: -2.96234983443252.
[I 2026-03-18 17:43:17,313] Trial 41 pruned. 
[I 2026-03-18 17:43:20,841] Trial 35 pruned. 
[I 2026-03-18 17:43:25,556] Trial 42 pruned. 
[I 2026-03-18 17:43:25,751] Trial 42 finished with value: -2.930198489726228 and parameters: {'n_layers_yyx': 2, 'hidden_size_yyx_l0': 3, 'hidden_size_yyx_l1': 2, 'context_size_yyx': 3, 'num_mix_components_yyx': 5, 'context_extractor_yyx': 'lstm', 'activation_func_yyx': 'GELU', 'L2_weight_yyx': 1.939906682619038e-09, 'L_entropy_weight_yyx': 0.0005915879699896973, 'L_sep_weight_yyx': 0.000438270151248862, 'L_scale_weight_yyx': 3.649825214178828e-08, 'learning_rate_yyx': 0.00869376215498419}. Best is trial 42 with value: -2.930198489726228.
[I 2026-03-18 17:43:32,954] Trial 42 pruned. 
[I 2026-03-18 17:43:41,475] Trial 41 finished with value: -2.9687267924821925 and parameters: {'n_layers_yyx': 2, 'hidden_size_yyx_l0': 5, 'hidden_size_yyx_l1': 4, 'context_size_yyx': 4, 'num_mix_components_yyx': 2, 'context_extractor_yyx': 'lstm', 'activation_func_yyx': 'ReLU', 'L2_weight_yyx': 0.00024212697394603684, 'L_entropy_weight_yyx': 1.0627447215489741e-08, 'L_sep_weight_yyx': 2.102463922543524e-09, 'L_scale_weight_yyx': 6.41686978761947e-09, 'learning_rate_yyx': 0.0073881275039876645}. Best is trial 38 with value: -2.9771706662392052.
[I 2026-03-18 17:43:47,742] Trial 34 pruned. 
[I 2026-03-18 17:43:49,166] Trial 36 finished with value: -2.920325513446325 and parameters: {'n_layers_yyx': 1, 'hidden_size_yyx_l0': 6, 'context_size_yyx': 3, 'num_mix_components_yyx': 4, 'context_extractor_yyx': 'lstm', 'activation_func_yyx': 'Tanh', 'L2_weight_yyx': 9.338212186296344e-05, 'L_entropy_weight_yyx': 3.257258372407348e-06, 'L_sep_weight_yyx': 2.7574169735351663e-08, 'L_scale_weight_yyx': 2.7773961686952505e-06, 'learning_rate_yyx': 0.0034976222337936127}. Best is trial 0 with value: -2.9702180140077377.
[I 2026-03-18 17:43:54,911] Trial 22 finished with value: -2.970223923614394 and parameters: {'n_layers_yyx': 1, 'hidden_size_yyx_l0': 5, 'context_size_yyx': 3, 'num_mix_components_yyx': 3, 'context_extractor_yyx': 'lstm', 'activation_func_yyx': 'GELU', 'L2_weight_yyx': 5.5674858134691e-10, 'L_entropy_weight_yyx': 4.429055695909329e-05, 'L_sep_weight_yyx': 1.7764050369957315e-05, 'L_scale_weight_yyx': 8.310588769119039e-10, 'learning_rate_yyx': 0.009910263438680057}. Best is trial 22 with value: -2.970223923614394.
[I 2026-03-18 17:43:56,994] Trial 37 pruned. 
[I 2026-03-18 17:44:05,170] Trial 36 pruned. 
[I 2026-03-18 17:44:05,313] Trial 38 pruned. 
[I 2026-03-18 17:44:10,676] Trial 43 pruned. 
[I 2026-03-18 17:44:13,883] Trial 39 pruned. 
[I 2026-03-18 17:44:17,457] Trial 43 pruned. 
[I 2026-03-18 17:44:21,419] Trial 32 finished with value: -2.9387384716846148 and parameters: {'n_layers_yyx': 1, 'hidden_size_yyx_l0': 4, 'context_size_yyx': 4, 'num_mix_components_yyx': 5, 'context_extractor_yyx': 'lstm', 'activation_func_yyx': 'ReLU', 'L2_weight_yyx': 1.8539080241423124e-08, 'L_entropy_weight_yyx': 2.330559875236244e-08, 'L_sep_weight_yyx': 2.6056315101428633e-10, 'L_scale_weight_yyx': 5.2630642849667315e-06, 'learning_rate_yyx': 0.006299567904867196}. Best is trial 23 with value: -2.9542045708741957.
[I 2026-03-18 17:44:25,940] Trial 44 pruned. 
[I 2026-03-18 17:44:27,156] Trial 36 finished with value: -2.9570429460965078 and parameters: {'n_layers_yyx': 1, 'hidden_size_yyx_l0': 5, 'context_size_yyx': 3, 'num_mix_components_yyx': 5, 'context_extractor_yyx': 'gru', 'activation_func_yyx': 'Tanh', 'L2_weight_yyx': 4.171650875568964e-10, 'L_entropy_weight_yyx': 0.0001560999278003963, 'L_sep_weight_yyx': 3.7766705396558407e-07, 'L_scale_weight_yyx': 1.8759237238104651e-06, 'learning_rate_yyx': 0.005823065629303203}. Best is trial 36 with value: -2.9570429460965078.
[I 2026-03-18 17:44:43,763] Trial 31 pruned. 
[I 2026-03-18 17:44:48,811] Trial 37 pruned. 
[I 2026-03-18 17:44:54,262] Trial 44 pruned. 
[I 2026-03-18 17:44:55,624] Trial 44 finished with value: -2.9563375175810798 and parameters: {'n_layers_yyx': 2, 'hidden_size_yyx_l0': 6, 'hidden_size_yyx_l1': 5, 'context_size_yyx': 3, 'num_mix_components_yyx': 5, 'context_extractor_yyx': 'gru', 'activation_func_yyx': 'Tanh', 'L2_weight_yyx': 9.19224698793806e-05, 'L_entropy_weight_yyx': 3.919645388606861e-08, 'L_sep_weight_yyx': 2.387287080730307e-07, 'L_scale_weight_yyx': 1.959783186809884e-09, 'learning_rate_yyx': 0.008297411917486073}. Best is trial 43 with value: -2.9596577623668368.
[I 2026-03-18 17:44:57,015] Trial 38 pruned. 
[I 2026-03-18 17:44:59,910] Trial 32 pruned. 
[I 2026-03-18 17:45:03,387] Trial 39 finished with value: -2.971304704490119 and parameters: {'n_layers_yyx': 1, 'hidden_size_yyx_l0': 3, 'context_size_yyx': 3, 'num_mix_components_yyx': 4, 'context_extractor_yyx': 'lstm', 'activation_func_yyx': 'Tanh', 'L2_weight_yyx': 6.862810053189754e-05, 'L_entropy_weight_yyx': 6.999474493494093e-09, 'L_sep_weight_yyx': 8.577503223283608e-05, 'L_scale_weight_yyx': 2.2538087830732523e-09, 'learning_rate_yyx': 0.009491327653113892}. Best is trial 37 with value: -2.980594852387875.
[I 2026-03-18 17:45:04,668] Trial 39 pruned. 
[I 2026-03-18 17:45:21,007] Trial 40 pruned. 
[I 2026-03-18 17:45:26,976] Trial 43 finished with value: -2.8931987607249354 and parameters: {'n_layers_yyx': 2, 'hidden_size_yyx_l0': 2, 'hidden_size_yyx_l1': 3, 'context_size_yyx': 3, 'num_mix_components_yyx': 5, 'context_extractor_yyx': 'lstm', 'activation_func_yyx': 'GELU', 'L2_weight_yyx': 1.6275313006067364e-09, 'L_entropy_weight_yyx': 0.0006065971646115105, 'L_sep_weight_yyx': 0.000445558140929219, 'L_scale_weight_yyx': 1.2328453434993225e-07, 'learning_rate_yyx': 0.008581657622880514}. Best is trial 42 with value: -2.930198489726228.
[I 2026-03-18 17:45:35,778] Trial 20 finished with value: -2.953930922607791 and parameters: {'n_layers_yyx': 2, 'hidden_size_yyx_l0': 4, 'hidden_size_yyx_l1': 3, 'context_size_yyx': 2, 'num_mix_components_yyx': 4, 'context_extractor_yyx': 'gru', 'activation_func_yyx': 'Tanh', 'L2_weight_yyx': 1.642371033863466e-07, 'L_entropy_weight_yyx': 1.2786016307060768e-05, 'L_sep_weight_yyx': 0.00011915543933448567, 'L_scale_weight_yyx': 1.2189752888028652e-10, 'learning_rate_yyx': 0.006877011815330833}. Best is trial 16 with value: -2.9637252953818396.
[I 2026-03-18 17:45:38,465] Trial 45 pruned. 
[I 2026-03-18 17:45:38,485] Trial 41 pruned. 
[I 2026-03-18 17:45:42,254] Trial 45 pruned. 
[I 2026-03-18 17:45:46,163] Trial 46 pruned. 
[I 2026-03-18 17:45:50,023] Trial 46 pruned. 
