[I 2026-03-18 20:17:13,920] Trial 49 finished with value: -1.9843098798808982 and parameters: {'n_layers_yyx': 1, 'hidden_size_yyx_l0': 4, 'context_size_yyx': 4, 'num_mix_components_yyx': 4, 'context_extractor_yyx': 'lstm', 'activation_func_yyx': 'ReLU', 'L2_weight_yyx': 1.5135270989017365e-05, 'L_entropy_weight_yyx': 5.659159874366035e-05, 'L_sep_weight_yyx': 1.1055827346689893e-09, 'L_scale_weight_yyx': 1.0284778522476113e-08, 'learning_rate_yyx': 0.00980077964519694}. Best is trial 46 with value: -1.984403099075014.

Source events: 18269
Target events: 32635
Full model ln_yyx : 2192.76333 nats/sec, 60.47149 nats/event
Full model Log loss : -1.97162
Full model ln_yyx : 2184.32499 nats/sec, 60.23878 nats/event
Full model Log loss : -1.98280
Full model ln_yyx : 2151.56671 nats/sec, 59.33538 nats/event
Full model Log loss : -1.98147
Full model ln_yyx : 2190.30979 nats/sec, 60.40382 nats/event
Full model Log loss : -1.98213
Full model ln_yyx : 2181.93900 nats/sec, 60.17298 nats/event
Full model Log loss : -1.98066
Full model ln_yyx : 2179.03119 nats/sec, 60.09279 nats/event
Full model Log loss : -1.97953
Full model ln_yyx : 2183.06662 nats/sec, 60.20407 nats/event
Full model Log loss : -1.97931
Full model ln_yyx : 2189.63503 nats/sec, 60.38522 nats/event
Full model Log loss : -1.98005
Full model ln_yyx : 2180.11186 nats/sec, 60.12259 nats/event
Full model Log loss : -1.97957
Full model ln_yyx : 2187.04162 nats/sec, 60.31370 nats/event
Full model Log loss : -1.97920
Full model ln_yyx : 2176.62479 nats/sec, 60.02642 nats/event
Full model Log loss : -1.98166
Full model ln_yyx : 2173.15813 nats/sec, 59.93082 nats/event
Full model Log loss : -1.98274
Full model ln_yyx : 2172.05052 nats/sec, 59.90027 nats/event
Full model Log loss : -1.98046
Full model ln_yyx : 2170.77214 nats/sec, 59.86502 nats/event
Full model Log loss : -1.98177
Full model ln_yyx : 2171.05662 nats/sec, 59.87287 nats/event
Full model Log loss : -1.98162
Full model ln_yyx : 2165.08054 nats/sec, 59.70806 nats/event
Full model Log loss : -1.98036
Full model ln_yyx : 2162.87958 nats/sec, 59.64736 nats/event
Full model Log loss : -1.98440
Full model ln_yyx : 2172.41325 nats/sec, 59.91028 nats/event
Full model Log loss : -1.98431
Optimization finished. Config saved to results/opt-full/opt_full_319_best_config.txt
[I 2026-03-18 20:17:18,816] Trial 37 pruned. 
[I 2026-03-18 20:17:18,852] Trial 42 finished with value: -1.6770729457226468 and parameters: {'n_layers_yyx': 2, 'hidden_size_yyx_l0': 4, 'hidden_size_yyx_l1': 5, 'context_size_yyx': 4, 'num_mix_components_yyx': 5, 'context_extractor_yyx': 'lstm', 'activation_func_yyx': 'Tanh', 'L2_weight_yyx': 2.3089426326692384e-10, 'L_entropy_weight_yyx': 6.669493100214208e-10, 'L_sep_weight_yyx': 1.0464751989543002e-10, 'L_scale_weight_yyx': 2.1626845776401028e-07, 'learning_rate_yyx': 0.008634103503346865}. Best is trial 32 with value: -1.6813953661792613.
[I 2026-03-18 20:17:21,401] Trial 49 pruned. 

Source events: 10752
Target events: 31112
Full model ln_yyx : 1073.59672 nats/sec, 31.05673 nats/event
Full model Log loss : -1.66308
Full model ln_yyx : 1075.71568 nats/sec, 31.11803 nats/event
Full model Log loss : -1.67455
Full model ln_yyx : 1071.60807 nats/sec, 30.99921 nats/event
Full model Log loss : -1.67237
Full model ln_yyx : 1068.14013 nats/sec, 30.89889 nats/event
Full model Log loss : -1.67556
Full model ln_yyx : 1079.08928 nats/sec, 31.21562 nats/event
Full model Log loss : -1.67699
Full model ln_yyx : 1079.57308 nats/sec, 31.22961 nats/event
Full model Log loss : -1.67311
Full model ln_yyx : 1074.71448 nats/sec, 31.08907 nats/event
Full model Log loss : -1.67480
Full model ln_yyx : 1075.66310 nats/sec, 31.11651 nats/event
Full model Log loss : -1.66601
Full model ln_yyx : 1074.62231 nats/sec, 31.08640 nats/event
Full model Log loss : -1.66989
Full model ln_yyx : 1076.26925 nats/sec, 31.13404 nats/event
Full model Log loss : -1.67162
Full model ln_yyx : 1078.30022 nats/sec, 31.19279 nats/event
Full model Log loss : -1.67801
Full model ln_yyx : 1086.51050 nats/sec, 31.43030 nats/event
Full model Log loss : -1.68061
Full model ln_yyx : 1076.08985 nats/sec, 31.12885 nats/event
Full model Log loss : -1.67669
Full model ln_yyx : 1076.54366 nats/sec, 31.14198 nats/event
Full model Log loss : -1.67685
Full model ln_yyx : 1079.99851 nats/sec, 31.24192 nats/event
Full model Log loss : -1.67703
Full model ln_yyx : 1080.08650 nats/sec, 31.24447 nats/event
Full model Log loss : -1.67730
Optimization finished. Config saved to results/opt-full/opt_full_300_best_config.txt
[I 2026-03-18 20:17:23,290] Trial 25 pruned. 
[I 2026-03-18 20:17:23,528] Trial 31 finished with value: -2.513539515904018 and parameters: {'n_layers_yyx': 1, 'hidden_size_yyx_l0': 4, 'context_size_yyx': 4, 'num_mix_components_yyx': 3, 'context_extractor_yyx': 'gru', 'activation_func_yyx': 'ReLU', 'L2_weight_yyx': 6.409484822276486e-09, 'L_entropy_weight_yyx': 3.3848815754365906e-08, 'L_sep_weight_yyx': 0.0003087069479884668, 'L_scale_weight_yyx': 3.7313004646112664e-10, 'learning_rate_yyx': 0.008410720919660357}. Best is trial 5 with value: -2.5140323195684524.
[I 2026-03-18 20:17:25,728] Trial 41 finished with value: -2.502272845423499 and parameters: {'n_layers_yyx': 1, 'hidden_size_yyx_l0': 6, 'context_size_yyx': 4, 'num_mix_components_yyx': 5, 'context_extractor_yyx': 'lstm', 'activation_func_yyx': 'Tanh', 'L2_weight_yyx': 2.0972564514843303e-10, 'L_entropy_weight_yyx': 0.000383303051413128, 'L_sep_weight_yyx': 0.0009467240918764257, 'L_scale_weight_yyx': 1.5606939008323047e-08, 'learning_rate_yyx': 0.008919585947359431}. Best is trial 25 with value: -2.504659714809684.
[I 2026-03-18 20:17:33,434] Trial 49 pruned. 

Source events: 18269
Target events: 5634
Full model ln_yyx : 379.33626 nats/sec, 60.59685 nats/event
Full model Log loss : -2.01897
Full model ln_yyx : 378.85938 nats/sec, 60.52067 nats/event
Full model Log loss : -1.98599
Full model ln_yyx : 381.05190 nats/sec, 60.87091 nats/event
Full model Log loss : -2.02161
Full model ln_yyx : 378.12221 nats/sec, 60.40291 nats/event
Full model Log loss : -2.01830
Full model ln_yyx : 377.29082 nats/sec, 60.27010 nats/event
Full model Log loss : -2.02045
Full model ln_yyx : 376.06349 nats/sec, 60.07404 nats/event
Full model Log loss : -2.02216
Full model ln_yyx : 379.95092 nats/sec, 60.69503 nats/event
Full model Log loss : -2.01958
Full model ln_yyx : 382.78143 nats/sec, 61.14719 nats/event
Full model Log loss : -2.01859
Full model ln_yyx : 378.89665 nats/sec, 60.52662 nats/event
Full model Log loss : -2.02286
Full model ln_yyx : 381.81112 nats/sec, 60.99219 nats/event
Full model Log loss : -2.02238
Optimization finished. Config saved to results/opt-full/opt_full_317_best_config.txt
[I 2026-03-18 20:17:35,454] Trial 43 pruned. 
[I 2026-03-18 20:17:42,806] Trial 44 pruned. 
[I 2026-03-18 20:17:43,398] Trial 38 pruned. 
[I 2026-03-18 20:17:46,077] Trial 37 pruned. 
[I 2026-03-18 20:17:48,190] Trial 32 pruned. 
[I 2026-03-18 20:18:02,759] Trial 39 pruned. 
[I 2026-03-18 20:18:05,709] Trial 33 pruned. 
[I 2026-03-18 20:18:05,731] Trial 45 pruned. 
[I 2026-03-18 20:18:10,558] Trial 42 finished with value: -2.0349750760235366 and parameters: {'n_layers_yyx': 1, 'hidden_size_yyx_l0': 6, 'context_size_yyx': 4, 'num_mix_components_yyx': 5, 'context_extractor_yyx': 'lstm', 'activation_func_yyx': 'ReLU', 'L2_weight_yyx': 6.272323151989023e-07, 'L_entropy_weight_yyx': 1.7743543596165581e-09, 'L_sep_weight_yyx': 3.2296021266325636e-06, 'L_scale_weight_yyx': 9.453860351512485e-10, 'learning_rate_yyx': 0.007310089583691085}. Best is trial 8 with value: -2.0365283470022115.
[I 2026-03-18 20:18:11,393] Trial 39 pruned. 
[I 2026-03-18 20:18:12,171] Trial 46 pruned. 
[I 2026-03-18 20:18:12,914] Trial 45 pruned. 
[I 2026-03-18 20:18:15,157] Trial 40 pruned. 
[I 2026-03-18 20:18:20,792] Trial 38 pruned. 
[I 2026-03-18 20:18:21,372] Trial 48 finished with value: -1.679342538447749 and parameters: {'n_layers_yyx': 1, 'hidden_size_yyx_l0': 3, 'context_size_yyx': 3, 'num_mix_components_yyx': 3, 'context_extractor_yyx': 'gru', 'activation_func_yyx': 'GELU', 'L2_weight_yyx': 0.0007429953851058741, 'L_entropy_weight_yyx': 0.0005003705198418203, 'L_sep_weight_yyx': 1.6672755279511515e-07, 'L_scale_weight_yyx': 5.383715723277995e-10, 'learning_rate_yyx': 0.007250113028931204}. Best is trial 12 with value: -1.6796893990996478.
[I 2026-03-18 20:18:27,274] Trial 47 pruned. 
[I 2026-03-18 20:18:44,598] Trial 48 pruned. 
[I 2026-03-18 20:18:49,108] Trial 42 pruned. 
[I 2026-03-18 20:18:50,668] Trial 40 finished with value: -1.985801584453302 and parameters: {'n_layers_yyx': 1, 'hidden_size_yyx_l0': 5, 'context_size_yyx': 4, 'num_mix_components_yyx': 2, 'context_extractor_yyx': 'lstm', 'activation_func_yyx': 'GELU', 'L2_weight_yyx': 0.00030681222010440183, 'L_entropy_weight_yyx': 0.00018205289616135686, 'L_sep_weight_yyx': 7.146618181702026e-08, 'L_scale_weight_yyx': 2.8562544611732295e-07, 'learning_rate_yyx': 0.0035469319767537444}. Best is trial 0 with value: -2.0138799336866504.
[I 2026-03-18 20:18:51,146] Trial 46 pruned. 
[I 2026-03-18 20:19:03,407] Trial 39 pruned. 
[I 2026-03-18 20:19:05,268] Trial 41 pruned. 
[I 2026-03-18 20:19:17,541] Trial 40 pruned. 
[I 2026-03-18 20:19:20,447] Trial 47 pruned. 
[I 2026-03-18 20:19:40,666] Trial 32 finished with value: -2.5142106948406986 and parameters: {'n_layers_yyx': 2, 'hidden_size_yyx_l0': 4, 'hidden_size_yyx_l1': 5, 'context_size_yyx': 3, 'num_mix_components_yyx': 5, 'context_extractor_yyx': 'gru', 'activation_func_yyx': 'ReLU', 'L2_weight_yyx': 2.995114454869945e-06, 'L_entropy_weight_yyx': 1.1254414357908998e-06, 'L_sep_weight_yyx': 2.3005649472561117e-07, 'L_scale_weight_yyx': 4.3882107270760155e-06, 'learning_rate_yyx': 0.008124704675109585}. Best is trial 22 with value: -2.5155989726836543.
[I 2026-03-18 20:19:43,273] Trial 40 pruned. 
[I 2026-03-18 20:20:15,527] Trial 22 finished with value: -2.5151705555821455 and parameters: {'n_layers_yyx': 1, 'hidden_size_yyx_l0': 5, 'context_size_yyx': 1, 'num_mix_components_yyx': 4, 'context_extractor_yyx': 'lstm', 'activation_func_yyx': 'ReLU', 'L2_weight_yyx': 1.1185222658280691e-10, 'L_entropy_weight_yyx': 5.4487139702903394e-08, 'L_sep_weight_yyx': 3.780697259904993e-08, 'L_scale_weight_yyx': 2.5393591586909426e-09, 'learning_rate_yyx': 0.009799716504164132}. Best is trial 12 with value: -2.51518345292619.
[I 2026-03-18 20:20:17,393] Trial 26 finished with value: -2.512613867095458 and parameters: {'n_layers_yyx': 2, 'hidden_size_yyx_l0': 5, 'hidden_size_yyx_l1': 4, 'context_size_yyx': 2, 'num_mix_components_yyx': 3, 'context_extractor_yyx': 'lstm', 'activation_func_yyx': 'Tanh', 'L2_weight_yyx': 2.7312428051323575e-07, 'L_entropy_weight_yyx': 0.0008005410741911569, 'L_sep_weight_yyx': 5.028536806088347e-07, 'L_scale_weight_yyx': 1.1372302059613674e-07, 'learning_rate_yyx': 0.007684724060051094}. Best is trial 26 with value: -2.512613867095458.
[I 2026-03-18 20:20:19,478] Trial 43 pruned. 
[I 2026-03-18 20:20:33,628] Trial 43 finished with value: -2.035109051352129 and parameters: {'n_layers_yyx': 1, 'hidden_size_yyx_l0': 6, 'context_size_yyx': 4, 'num_mix_components_yyx': 5, 'context_extractor_yyx': 'lstm', 'activation_func_yyx': 'ReLU', 'L2_weight_yyx': 3.492883300907844e-07, 'L_entropy_weight_yyx': 2.105162271249023e-10, 'L_sep_weight_yyx': 4.6411750907311664e-07, 'L_scale_weight_yyx': 3.980436695578777e-09, 'learning_rate_yyx': 0.008785618649891178}. Best is trial 8 with value: -2.0365283470022115.
[I 2026-03-18 20:20:40,651] Trial 48 pruned. 
[I 2026-03-18 20:20:48,457] Trial 23 pruned. 
[I 2026-03-18 20:20:49,097] Trial 44 pruned. 
[I 2026-03-18 20:20:49,186] Trial 33 pruned. 
[I 2026-03-18 20:20:49,280] Trial 38 finished with value: -2.507940355302367 and parameters: {'n_layers_yyx': 1, 'hidden_size_yyx_l0': 6, 'context_size_yyx': 3, 'num_mix_components_yyx': 5, 'context_extractor_yyx': 'lstm', 'activation_func_yyx': 'ReLU', 'L2_weight_yyx': 5.922400938011909e-06, 'L_entropy_weight_yyx': 2.0979781820967535e-10, 'L_sep_weight_yyx': 6.71981370464953e-08, 'L_scale_weight_yyx': 2.063338089560367e-09, 'learning_rate_yyx': 0.005553814061638186}. Best is trial 23 with value: -2.5132993257512335.
[I 2026-03-18 20:20:50,811] Trial 36 finished with value: -2.4932689708351923 and parameters: {'n_layers_yyx': 2, 'hidden_size_yyx_l0': 2, 'hidden_size_yyx_l1': 5, 'context_size_yyx': 2, 'num_mix_components_yyx': 5, 'context_extractor_yyx': 'gru', 'activation_func_yyx': 'Tanh', 'L2_weight_yyx': 4.7828075581263474e-05, 'L_entropy_weight_yyx': 7.845544952898111e-09, 'L_sep_weight_yyx': 5.6517523493923247e-05, 'L_scale_weight_yyx': 0.00011282168812022798, 'learning_rate_yyx': 0.006995441561960697}. Best is trial 7 with value: -2.4950542279753494.
[I 2026-03-18 20:20:52,147] Trial 49 finished with value: -1.6735344061423012 and parameters: {'n_layers_yyx': 2, 'hidden_size_yyx_l0': 3, 'hidden_size_yyx_l1': 6, 'context_size_yyx': 3, 'num_mix_components_yyx': 4, 'context_extractor_yyx': 'gru', 'activation_func_yyx': 'Tanh', 'L2_weight_yyx': 7.692047488843271e-07, 'L_entropy_weight_yyx': 3.3029141108149854e-06, 'L_sep_weight_yyx': 4.5275466655037724e-10, 'L_scale_weight_yyx': 3.093481907241024e-07, 'learning_rate_yyx': 0.004917587743966414}. Best is trial 32 with value: -1.6813953661792613.

Source events: 10752
Target events: 20315
Full model ln_yyx : 702.04290 nats/sec, 31.10207 nats/event
Full model Log loss : -1.67555
Full model ln_yyx : 706.60985 nats/sec, 31.30440 nats/event
Full model Log loss : -1.67131
Full model ln_yyx : 705.45928 nats/sec, 31.25343 nats/event
Full model Log loss : -1.67699
Full model ln_yyx : 702.25890 nats/sec, 31.11164 nats/event
Full model Log loss : -1.67965
Full model ln_yyx : 707.08064 nats/sec, 31.32526 nats/event
Full model Log loss : -1.67388
Full model ln_yyx : 695.71776 nats/sec, 30.82185 nats/event
Full model Log loss : -1.67512
Full model ln_yyx : 706.79306 nats/sec, 31.31252 nats/event
Full model Log loss : -1.68015
Full model ln_yyx : 699.48332 nats/sec, 30.98868 nats/event
Full model Log loss : -1.67100
Full model ln_yyx : 701.74324 nats/sec, 31.08880 nats/event
Full model Log loss : -1.66810
Full model ln_yyx : 709.02583 nats/sec, 31.41143 nats/event
Full model Log loss : -1.67726
Full model ln_yyx : 706.30950 nats/sec, 31.29109 nats/event
Full model Log loss : -1.67746
Full model ln_yyx : 708.57828 nats/sec, 31.39160 nats/event
Full model Log loss : -1.68140
Full model ln_yyx : 702.10364 nats/sec, 31.10476 nats/event
Full model Log loss : -1.67894
Full model ln_yyx : 697.21664 nats/sec, 30.88826 nats/event
Full model Log loss : -1.67916
Full model ln_yyx : 703.84319 nats/sec, 31.18183 nats/event
Full model Log loss : -1.67535
Full model ln_yyx : 701.03662 nats/sec, 31.05749 nats/event
Full model Log loss : -1.67809
Full model ln_yyx : 708.69939 nats/sec, 31.39697 nats/event
Full model Log loss : -1.67919
Full model ln_yyx : 700.80935 nats/sec, 31.04742 nats/event
Full model Log loss : -1.67707
Full model ln_yyx : 704.26502 nats/sec, 31.20052 nats/event
Full model Log loss : -1.67353
Optimization finished. Config saved to results/opt-full/opt_full_302_best_config.txt
[I 2026-03-18 20:20:58,362] Trial 41 finished with value: -2.5119430096165174 and parameters: {'n_layers_yyx': 2, 'hidden_size_yyx_l0': 6, 'hidden_size_yyx_l1': 5, 'context_size_yyx': 4, 'num_mix_components_yyx': 3, 'context_extractor_yyx': 'lstm', 'activation_func_yyx': 'ReLU', 'L2_weight_yyx': 1.6572741224195154e-07, 'L_entropy_weight_yyx': 8.445409011243332e-09, 'L_sep_weight_yyx': 1.5393044283190643e-05, 'L_scale_weight_yyx': 1.0773922639837533e-10, 'learning_rate_yyx': 0.008399690550012065}. Best is trial 21 with value: -2.5132035092741223.
[I 2026-03-18 20:20:59,097] Trial 34 pruned. 
[I 2026-03-18 20:21:04,354] Trial 33 pruned. 
[I 2026-03-18 20:21:11,145] Trial 39 pruned. 
[I 2026-03-18 20:21:14,425] Trial 37 pruned. 
[I 2026-03-18 20:21:15,285] Trial 41 finished with value: -2.513338292847255 and parameters: {'n_layers_yyx': 1, 'hidden_size_yyx_l0': 6, 'context_size_yyx': 4, 'num_mix_components_yyx': 2, 'context_extractor_yyx': 'gru', 'activation_func_yyx': 'GELU', 'L2_weight_yyx': 1.2620474563971224e-05, 'L_entropy_weight_yyx': 2.796146838874841e-05, 'L_sep_weight_yyx': 3.500541882240839e-09, 'L_scale_weight_yyx': 8.905532675419045e-09, 'learning_rate_yyx': 0.007950584333511486}. Best is trial 23 with value: -2.513824905841335.
[I 2026-03-18 20:21:17,684] Trial 34 pruned. 
[I 2026-03-18 20:21:32,129] Trial 42 pruned. 
[I 2026-03-18 20:21:32,206] Trial 35 pruned. 
[I 2026-03-18 20:21:35,734] Trial 35 pruned. 
[I 2026-03-18 20:21:44,374] Trial 40 pruned. 
[I 2026-03-18 20:21:45,851] Trial 38 pruned. 
[I 2026-03-18 20:21:46,863] Trial 45 pruned. 
[I 2026-03-18 20:21:55,185] Trial 49 finished with value: -1.6759426258092658 and parameters: {'n_layers_yyx': 1, 'hidden_size_yyx_l0': 4, 'context_size_yyx': 3, 'num_mix_components_yyx': 3, 'context_extractor_yyx': 'gru', 'activation_func_yyx': 'GELU', 'L2_weight_yyx': 0.0006788598742691312, 'L_entropy_weight_yyx': 0.0009524599422250134, 'L_sep_weight_yyx': 1.618079447550221e-08, 'L_scale_weight_yyx': 5.032588470809214e-10, 'learning_rate_yyx': 0.007063712063643534}. Best is trial 12 with value: -1.6796893990996478.

Source events: 10752
Target events: 54211
Full model ln_yyx : 1884.84840 nats/sec, 31.29187 nats/event
Full model Log loss : -1.67846
Full model ln_yyx : 1884.30509 nats/sec, 31.28285 nats/event
Full model Log loss : -1.67673
Full model ln_yyx : 1875.25491 nats/sec, 31.13260 nats/event
Full model Log loss : -1.66402
Full model ln_yyx : 1880.01684 nats/sec, 31.21166 nats/event
Full model Log loss : -1.66901
Full model ln_yyx : 1885.44612 nats/sec, 31.30179 nats/event
Full model Log loss : -1.67969
Full model ln_yyx : 1857.42942 nats/sec, 30.83667 nats/event
Full model Log loss : -1.67547
Full model ln_yyx : 1858.32915 nats/sec, 30.85160 nats/event
Full model Log loss : -1.63997
Full model ln_yyx : 1874.25595 nats/sec, 31.11602 nats/event
Full model Log loss : -1.67737
Full model ln_yyx : 1877.80093 nats/sec, 31.17487 nats/event
Full model Log loss : -1.67927
Full model ln_yyx : 1855.24808 nats/sec, 30.80045 nats/event
Full model Log loss : -1.66840
Full model ln_yyx : 1894.46521 nats/sec, 31.45153 nats/event
Full model Log loss : -1.67063
Full model ln_yyx : 1877.52572 nats/sec, 31.17030 nats/event
Full model Log loss : -1.67934
Full model ln_yyx : 1910.50646 nats/sec, 31.71784 nats/event
Full model Log loss : -1.67594
Optimization finished. Config saved to results/opt-full/opt_full_304_best_config.txt
[I 2026-03-18 20:21:58,405] Trial 43 pruned. 
[I 2026-03-18 20:21:58,742] Trial 24 pruned. 
[I 2026-03-18 20:22:02,532] Trial 36 pruned. 
[I 2026-03-18 20:22:04,066] Trial 42 finished with value: -2.013488216551352 and parameters: {'n_layers_yyx': 1, 'hidden_size_yyx_l0': 4, 'context_size_yyx': 4, 'num_mix_components_yyx': 2, 'context_extractor_yyx': 'gru', 'activation_func_yyx': 'GELU', 'L2_weight_yyx': 7.782521526700583e-06, 'L_entropy_weight_yyx': 2.4360785324428177e-06, 'L_sep_weight_yyx': 1.6211228603805954e-06, 'L_scale_weight_yyx': 0.0004338241916283001, 'learning_rate_yyx': 0.0062940294840142085}. Best is trial 0 with value: -2.0138799336866504.
[I 2026-03-18 20:22:08,350] Trial 44 finished with value: -2.5046955552212027 and parameters: {'n_layers_yyx': 1, 'hidden_size_yyx_l0': 6, 'context_size_yyx': 4, 'num_mix_components_yyx': 4, 'context_extractor_yyx': 'lstm', 'activation_func_yyx': 'Tanh', 'L2_weight_yyx': 1.5531534866554522e-10, 'L_entropy_weight_yyx': 0.00085032359981061, 'L_sep_weight_yyx': 0.0004944669162928293, 'L_scale_weight_yyx': 9.981238832181694e-09, 'learning_rate_yyx': 0.009923429818370993}. Best is trial 44 with value: -2.5046955552212027.
[I 2026-03-18 20:22:12,750] Trial 39 pruned. 
[I 2026-03-18 20:22:19,051] Trial 37 pruned. 
[I 2026-03-18 20:22:33,433] Trial 27 finished with value: -2.494800126833471 and parameters: {'n_layers_yyx': 2, 'hidden_size_yyx_l0': 5, 'hidden_size_yyx_l1': 4, 'context_size_yyx': 1, 'num_mix_components_yyx': 3, 'context_extractor_yyx': 'lstm', 'activation_func_yyx': 'Tanh', 'L2_weight_yyx': 0.0001759097930111491, 'L_entropy_weight_yyx': 0.0004799980677575793, 'L_sep_weight_yyx': 1.1746570014652776e-08, 'L_scale_weight_yyx': 8.105308262361304e-07, 'learning_rate_yyx': 0.007297061310309008}. Best is trial 26 with value: -2.512613867095458.
