[I 2026-03-18 19:48:46,861] Trial 49 finished with value: -2.2889438064182985 and parameters: {'n_layers_yyx': 1, 'hidden_size_yyx_l0': 5, 'context_size_yyx': 3, 'num_mix_components_yyx': 3, 'context_extractor_yyx': 'lstm', 'activation_func_yyx': 'ReLU', 'L2_weight_yyx': 3.9282347629191355e-07, 'L_entropy_weight_yyx': 2.2598249741377245e-08, 'L_sep_weight_yyx': 4.178034315642641e-06, 'L_scale_weight_yyx': 1.1885701255886091e-09, 'learning_rate_yyx': 0.009847140458420651}. Best is trial 49 with value: -2.2889438064182985.

Source events: 20800
Target events: 32635
Full model ln_yyx : 2645.18857 nats/sec, 72.94836 nats/event
Full model Log loss : -2.27747
Full model ln_yyx : 2648.95958 nats/sec, 73.05236 nats/event
Full model Log loss : -2.26517
Full model ln_yyx : 2674.61177 nats/sec, 73.75979 nats/event
Full model Log loss : -2.26894
Full model ln_yyx : 2688.55842 nats/sec, 74.14440 nats/event
Full model Log loss : -2.26490
Full model ln_yyx : 2703.53199 nats/sec, 74.55734 nats/event
Full model Log loss : -2.28318
Full model ln_yyx : 2705.52053 nats/sec, 74.61218 nats/event
Full model Log loss : -2.28262
Full model ln_yyx : 2701.14461 nats/sec, 74.49150 nats/event
Full model Log loss : -2.28299
Full model ln_yyx : 2697.17110 nats/sec, 74.38192 nats/event
Full model Log loss : -2.28314
Full model ln_yyx : 2676.26716 nats/sec, 73.80544 nats/event
Full model Log loss : -2.27018
Full model ln_yyx : 2686.90342 nats/sec, 74.09876 nats/event
Full model Log loss : -2.27432
Full model ln_yyx : 2681.34796 nats/sec, 73.94555 nats/event
Full model Log loss : -2.28623
Full model ln_yyx : 2705.45857 nats/sec, 74.61047 nats/event
Full model Log loss : -2.26590
Full model ln_yyx : 2698.73347 nats/sec, 74.42501 nats/event
Full model Log loss : -2.28588
Full model ln_yyx : 2685.54870 nats/sec, 74.06140 nats/event
Full model Log loss : -2.27644
Full model ln_yyx : 2698.47436 nats/sec, 74.41786 nats/event
Full model Log loss : -2.28549
Full model ln_yyx : 2715.94953 nats/sec, 74.89979 nats/event
Full model Log loss : -2.28635
Full model ln_yyx : 2703.64878 nats/sec, 74.56056 nats/event
Full model Log loss : -2.28359
Full model ln_yyx : 2701.99972 nats/sec, 74.51508 nats/event
Full model Log loss : -2.28627
Full model ln_yyx : 2686.66569 nats/sec, 74.09221 nats/event
Full model Log loss : -2.28556
Full model ln_yyx : 2695.98582 nats/sec, 74.34923 nats/event
Full model Log loss : -2.28151
Full model ln_yyx : 2684.75653 nats/sec, 74.03956 nats/event
Full model Log loss : -2.28545
Full model ln_yyx : 2692.26747 nats/sec, 74.24669 nats/event
Full model Log loss : -2.28637
Full model ln_yyx : 2705.54606 nats/sec, 74.61288 nats/event
Full model Log loss : -2.28894
Optimization finished. Config saved to results/opt-full/opt_full_211_best_config.txt
