[I 2026-03-18 16:27:38,759] Trial 0 finished with value: -2.8027179551346957 and parameters: {'n_layers_yyx': 1, 'hidden_size_yyx_l0': 2, 'context_size_yyx': 4, 'num_mix_components_yyx': 2, 'context_extractor_yyx': 'gru', 'activation_func_yyx': 'Tanh', 'L2_weight_yyx': 1.4259926317561975e-10, 'L_entropy_weight_yyx': 5.059827966461974e-06, 'L_sep_weight_yyx': 8.73962281957222e-10, 'L_scale_weight_yyx': 4.014409167074202e-06, 'learning_rate_yyx': 0.009701013264994488}. Best is trial 0 with value: -2.8027179551346957.
[I 2026-03-18 16:27:39,051] Trial 3 finished with value: -0.42374077669976296 and parameters: {'n_layers_yyx': 2, 'hidden_size_yyx_l0': 4, 'hidden_size_yyx_l1': 5, 'context_size_yyx': 3, 'num_mix_components_yyx': 3, 'context_extractor_yyx': 'gru', 'activation_func_yyx': 'GELU', 'L2_weight_yyx': 1.3300941183354917e-07, 'L_entropy_weight_yyx': 1.1059871589411907e-06, 'L_sep_weight_yyx': 0.00015191584162358977, 'L_scale_weight_yyx': 2.765059737917246e-06, 'learning_rate_yyx': 0.0074273720164454715}. Best is trial 3 with value: -0.42374077669976296.
[I 2026-03-18 16:27:39,451] Trial 1 finished with value: -0.45911608244243424 and parameters: {'n_layers_yyx': 1, 'hidden_size_yyx_l0': 6, 'context_size_yyx': 2, 'num_mix_components_yyx': 4, 'context_extractor_yyx': 'lstm', 'activation_func_yyx': 'GELU', 'L2_weight_yyx': 1.1849951059140117e-07, 'L_entropy_weight_yyx': 0.0005986227370561306, 'L_sep_weight_yyx': 4.120596721198201e-06, 'L_scale_weight_yyx': 1.5123876846318088e-07, 'learning_rate_yyx': 0.002429436143950396}. Best is trial 1 with value: -0.45911608244243424.
[I 2026-03-18 16:27:40,743] Trial 6 pruned. 
[I 2026-03-18 16:27:41,115] Trial 2 finished with value: -0.3708274770447344 and parameters: {'n_layers_yyx': 2, 'hidden_size_yyx_l0': 2, 'hidden_size_yyx_l1': 6, 'context_size_yyx': 1, 'num_mix_components_yyx': 1, 'context_extractor_yyx': 'lstm', 'activation_func_yyx': 'ReLU', 'L2_weight_yyx': 9.085626616835995e-05, 'L_entropy_weight_yyx': 1.646103642373085e-07, 'L_sep_weight_yyx': 0.00019333859184085314, 'L_scale_weight_yyx': 2.8251792756524364e-08, 'learning_rate_yyx': 0.0006433175403751504}. Best is trial 2 with value: -0.3708274770447344.
[I 2026-03-18 16:27:41,132] Trial 1 pruned. 
[I 2026-03-18 16:27:41,831] Trial 8 pruned. 
[I 2026-03-18 16:27:44,199] Trial 7 pruned. 
[I 2026-03-18 16:27:44,420] Trial 2 finished with value: -0.3384913158121493 and parameters: {'n_layers_yyx': 2, 'hidden_size_yyx_l0': 5, 'hidden_size_yyx_l1': 5, 'context_size_yyx': 1, 'num_mix_components_yyx': 5, 'context_extractor_yyx': 'gru', 'activation_func_yyx': 'Tanh', 'L2_weight_yyx': 6.077828974759423e-05, 'L_entropy_weight_yyx': 7.330794101224254e-07, 'L_sep_weight_yyx': 0.00012326495177386956, 'L_scale_weight_yyx': 0.0002939346687188137, 'learning_rate_yyx': 0.007812250612576002}. Best is trial 0 with value: -0.42020291071558147.
[I 2026-03-18 16:27:45,176] Trial 3 pruned. 
[I 2026-03-18 16:27:45,536] Trial 2 finished with value: -0.34490286528879643 and parameters: {'n_layers_yyx': 2, 'hidden_size_yyx_l0': 2, 'hidden_size_yyx_l1': 4, 'context_size_yyx': 1, 'num_mix_components_yyx': 4, 'context_extractor_yyx': 'gru', 'activation_func_yyx': 'ReLU', 'L2_weight_yyx': 8.887317728527991e-08, 'L_entropy_weight_yyx': 5.1930721832269845e-09, 'L_sep_weight_yyx': 9.89798642187862e-08, 'L_scale_weight_yyx': 9.115007553657939e-05, 'learning_rate_yyx': 0.005168510734743083}. Best is trial 0 with value: -0.4236573021478328.
[I 2026-03-18 16:27:45,569] Trial 3 finished with value: -0.37987773411045134 and parameters: {'n_layers_yyx': 2, 'hidden_size_yyx_l0': 5, 'hidden_size_yyx_l1': 4, 'context_size_yyx': 2, 'num_mix_components_yyx': 5, 'context_extractor_yyx': 'lstm', 'activation_func_yyx': 'Tanh', 'L2_weight_yyx': 5.420642838090882e-06, 'L_entropy_weight_yyx': 3.1927675303221474e-09, 'L_sep_weight_yyx': 3.086482596533436e-08, 'L_scale_weight_yyx': 5.413746084486332e-07, 'learning_rate_yyx': 0.0029444268220202756}. Best is trial 0 with value: -0.41437183297455493.
[I 2026-03-18 16:27:47,601] Trial 3 pruned. 
[I 2026-03-18 16:27:47,856] Trial 8 pruned. 
[I 2026-03-18 16:27:48,337] Trial 9 pruned. 
[I 2026-03-18 16:27:49,331] Trial 4 pruned. 
[I 2026-03-18 16:27:49,508] Trial 2 pruned. 
[I 2026-03-18 16:27:51,042] Trial 9 pruned. 
[I 2026-03-18 16:27:51,582] Trial 10 pruned. 
[I 2026-03-18 16:27:54,434] Trial 10 pruned. 
[I 2026-03-18 16:27:55,131] Trial 1 finished with value: -0.43281404005115615 and parameters: {'n_layers_yyx': 1, 'hidden_size_yyx_l0': 2, 'context_size_yyx': 2, 'num_mix_components_yyx': 2, 'context_extractor_yyx': 'lstm', 'activation_func_yyx': 'ReLU', 'L2_weight_yyx': 1.3780735825996504e-09, 'L_entropy_weight_yyx': 2.9282760971849457e-08, 'L_sep_weight_yyx': 1.9029588278267421e-06, 'L_scale_weight_yyx': 1.6722841830395295e-09, 'learning_rate_yyx': 0.0065995690082376384}. Best is trial 1 with value: -0.43281404005115615.
[I 2026-03-18 16:27:55,284] Trial 2 finished with value: -0.4289537553816757 and parameters: {'n_layers_yyx': 1, 'hidden_size_yyx_l0': 5, 'context_size_yyx': 3, 'num_mix_components_yyx': 2, 'context_extractor_yyx': 'gru', 'activation_func_yyx': 'GELU', 'L2_weight_yyx': 8.656446404801701e-10, 'L_entropy_weight_yyx': 9.507515332881054e-10, 'L_sep_weight_yyx': 2.1332493233967312e-05, 'L_scale_weight_yyx': 3.5938375325452307e-07, 'learning_rate_yyx': 0.006153193952459367}. Best is trial 2 with value: -0.4289537553816757.
[I 2026-03-18 16:27:55,372] Trial 0 finished with value: -2.782160293471522 and parameters: {'n_layers_yyx': 1, 'hidden_size_yyx_l0': 4, 'context_size_yyx': 1, 'num_mix_components_yyx': 2, 'context_extractor_yyx': 'lstm', 'activation_func_yyx': 'ReLU', 'L2_weight_yyx': 0.000132863576051417, 'L_entropy_weight_yyx': 1.2031190927417459e-06, 'L_sep_weight_yyx': 9.820412533475242e-09, 'L_scale_weight_yyx': 3.984062484248516e-07, 'learning_rate_yyx': 0.003481201885841216}. Best is trial 0 with value: -2.782160293471522.
[I 2026-03-18 16:27:56,054] Trial 2 finished with value: -0.38654539976326674 and parameters: {'n_layers_yyx': 1, 'hidden_size_yyx_l0': 5, 'context_size_yyx': 3, 'num_mix_components_yyx': 3, 'context_extractor_yyx': 'lstm', 'activation_func_yyx': 'ReLU', 'L2_weight_yyx': 9.749849926672432e-10, 'L_entropy_weight_yyx': 1.3768046059212103e-09, 'L_sep_weight_yyx': 1.2209549850236644e-09, 'L_scale_weight_yyx': 1.7128308843469007e-05, 'learning_rate_yyx': 0.0006714611235611043}. Best is trial 1 with value: -0.4307959589057663.
[I 2026-03-18 16:27:57,350] Trial 3 pruned. 
[I 2026-03-18 16:27:58,037] Trial 11 pruned. 
[I 2026-03-18 16:28:01,908] Trial 2 finished with value: -0.3395334722087848 and parameters: {'n_layers_yyx': 2, 'hidden_size_yyx_l0': 6, 'hidden_size_yyx_l1': 6, 'context_size_yyx': 2, 'num_mix_components_yyx': 5, 'context_extractor_yyx': 'gru', 'activation_func_yyx': 'Tanh', 'L2_weight_yyx': 3.0020330862214863e-09, 'L_entropy_weight_yyx': 1.3442024573441777e-08, 'L_sep_weight_yyx': 1.4251695655461058e-06, 'L_scale_weight_yyx': 0.0003213236784856006, 'learning_rate_yyx': 0.0005445695086687308}. Best is trial 0 with value: -0.41448025068631483.
[I 2026-03-18 16:28:05,142] Trial 12 pruned. 
[I 2026-03-18 16:28:09,069] Trial 13 pruned. 
[I 2026-03-18 16:28:09,181] Trial 4 finished with value: -0.3800905776835817 and parameters: {'n_layers_yyx': 2, 'hidden_size_yyx_l0': 6, 'hidden_size_yyx_l1': 5, 'context_size_yyx': 2, 'num_mix_components_yyx': 5, 'context_extractor_yyx': 'gru', 'activation_func_yyx': 'Tanh', 'L2_weight_yyx': 5.108001223620183e-06, 'L_entropy_weight_yyx': 1.2849657086127954e-08, 'L_sep_weight_yyx': 2.8224657490016702e-08, 'L_scale_weight_yyx': 3.043148118219583e-09, 'learning_rate_yyx': 0.0016584165739519942}. Best is trial 4 with value: -0.3800905776835817.
[I 2026-03-18 16:28:10,025] Trial 11 pruned. 
[I 2026-03-18 16:28:10,848] Trial 0 finished with value: -2.7981637642702535 and parameters: {'n_layers_yyx': 2, 'hidden_size_yyx_l0': 4, 'hidden_size_yyx_l1': 2, 'context_size_yyx': 4, 'num_mix_components_yyx': 4, 'context_extractor_yyx': 'gru', 'activation_func_yyx': 'ReLU', 'L2_weight_yyx': 2.2179083095702763e-06, 'L_entropy_weight_yyx': 2.8006766084297644e-08, 'L_sep_weight_yyx': 0.00099142145861518, 'L_scale_weight_yyx': 0.0001462852316285173, 'learning_rate_yyx': 0.003246588213280893}. Best is trial 0 with value: -2.7981637642702535.
[I 2026-03-18 16:28:11,538] Trial 4 finished with value: -0.4224036249213913 and parameters: {'n_layers_yyx': 1, 'hidden_size_yyx_l0': 6, 'context_size_yyx': 4, 'num_mix_components_yyx': 2, 'context_extractor_yyx': 'gru', 'activation_func_yyx': 'GELU', 'L2_weight_yyx': 2.594585164624491e-10, 'L_entropy_weight_yyx': 1.9977033513001846e-07, 'L_sep_weight_yyx': 1.1366452753340526e-08, 'L_scale_weight_yyx': 0.00043559467366098814, 'learning_rate_yyx': 0.003952232338038545}. Best is trial 3 with value: -0.42374077669976296.
[I 2026-03-18 16:28:12,826] Trial 14 pruned. 
[I 2026-03-18 16:28:13,284] Trial 12 pruned. 
[I 2026-03-18 16:28:13,415] Trial 1 pruned. 
[I 2026-03-18 16:28:14,965] Trial 5 pruned. 
[I 2026-03-18 16:28:15,099] Trial 4 finished with value: -0.43761569280004353 and parameters: {'n_layers_yyx': 1, 'hidden_size_yyx_l0': 3, 'context_size_yyx': 3, 'num_mix_components_yyx': 2, 'context_extractor_yyx': 'lstm', 'activation_func_yyx': 'Tanh', 'L2_weight_yyx': 4.063189605718859e-08, 'L_entropy_weight_yyx': 1.1278987209767864e-06, 'L_sep_weight_yyx': 2.783181396530671e-09, 'L_scale_weight_yyx': 6.096313632372954e-06, 'learning_rate_yyx': 0.006337514334965356}. Best is trial 4 with value: -0.43761569280004353.
[I 2026-03-18 16:28:16,460] Trial 13 pruned. 
[I 2026-03-18 16:28:16,669] Trial 5 pruned. 
[I 2026-03-18 16:28:18,047] Trial 5 pruned. 
[I 2026-03-18 16:28:18,322] Trial 6 pruned. 
[I 2026-03-18 16:28:19,273] Trial 1 pruned. 
[I 2026-03-18 16:28:19,788] Trial 14 pruned. 
[I 2026-03-18 16:28:20,888] Trial 6 pruned. 
[I 2026-03-18 16:28:23,503] Trial 0 finished with value: -2.8067502106217272 and parameters: {'n_layers_yyx': 2, 'hidden_size_yyx_l0': 3, 'hidden_size_yyx_l1': 3, 'context_size_yyx': 4, 'num_mix_components_yyx': 3, 'context_extractor_yyx': 'gru', 'activation_func_yyx': 'GELU', 'L2_weight_yyx': 4.812262542234052e-05, 'L_entropy_weight_yyx': 0.0003617528953585001, 'L_sep_weight_yyx': 8.026758237620788e-05, 'L_scale_weight_yyx': 3.2274320314093496e-05, 'learning_rate_yyx': 0.0064201129609348885}. Best is trial 0 with value: -2.8067502106217272.
[I 2026-03-18 16:28:24,027] Trial 5 finished with value: -0.3156533256034733 and parameters: {'n_layers_yyx': 1, 'hidden_size_yyx_l0': 2, 'context_size_yyx': 2, 'num_mix_components_yyx': 4, 'context_extractor_yyx': 'lstm', 'activation_func_yyx': 'GELU', 'L2_weight_yyx': 1.4883254945006468e-09, 'L_entropy_weight_yyx': 1.4426069178240264e-06, 'L_sep_weight_yyx': 3.908829872192074e-09, 'L_scale_weight_yyx': 1.148169618767008e-07, 'learning_rate_yyx': 0.0035751911008162964}. Best is trial 0 with value: -0.41437183297455493.
[I 2026-03-18 16:28:24,174] Trial 7 pruned. 
[I 2026-03-18 16:28:27,422] Trial 8 pruned. 
[I 2026-03-18 16:28:28,811] Trial 15 pruned. 
[I 2026-03-18 16:28:32,694] Trial 4 finished with value: -0.4171642858546585 and parameters: {'n_layers_yyx': 2, 'hidden_size_yyx_l0': 3, 'hidden_size_yyx_l1': 4, 'context_size_yyx': 2, 'num_mix_components_yyx': 5, 'context_extractor_yyx': 'lstm', 'activation_func_yyx': 'ReLU', 'L2_weight_yyx': 1.6082936194307054e-05, 'L_entropy_weight_yyx': 3.6778330371028055e-10, 'L_sep_weight_yyx': 9.152450507385979e-06, 'L_scale_weight_yyx': 9.80077257554611e-10, 'learning_rate_yyx': 0.0023629182017266465}. Best is trial 0 with value: -0.42020291071558147.
[I 2026-03-18 16:28:33,396] Trial 3 finished with value: -0.3967581828681308 and parameters: {'n_layers_yyx': 1, 'hidden_size_yyx_l0': 5, 'context_size_yyx': 2, 'num_mix_components_yyx': 3, 'context_extractor_yyx': 'gru', 'activation_func_yyx': 'GELU', 'L2_weight_yyx': 4.925416055030005e-06, 'L_entropy_weight_yyx': 6.918887530239986e-07, 'L_sep_weight_yyx': 4.7912868329230294e-06, 'L_scale_weight_yyx': 4.3837646162565784e-10, 'learning_rate_yyx': 0.001517320261915857}. Best is trial 1 with value: -0.44041338941261127.
[I 2026-03-18 16:28:34,394] Trial 6 pruned. 
[I 2026-03-18 16:28:35,220] Trial 3 finished with value: -0.33751137559258904 and parameters: {'n_layers_yyx': 1, 'hidden_size_yyx_l0': 5, 'context_size_yyx': 2, 'num_mix_components_yyx': 5, 'context_extractor_yyx': 'gru', 'activation_func_yyx': 'GELU', 'L2_weight_yyx': 0.00020183928472581448, 'L_entropy_weight_yyx': 1.7355475644831793e-07, 'L_sep_weight_yyx': 0.00017238449208763874, 'L_scale_weight_yyx': 2.9479612513471074e-08, 'learning_rate_yyx': 0.001591961372946616}. Best is trial 2 with value: -0.4289537553816757.
[I 2026-03-18 16:28:36,072] Trial 16 pruned. 
[I 2026-03-18 16:28:36,120] Trial 15 pruned. 
[I 2026-03-18 16:28:40,366] Trial 4 pruned. 
[I 2026-03-18 16:28:40,624] Trial 6 pruned. 
[I 2026-03-18 16:28:41,314] Trial 7 pruned. 
[I 2026-03-18 16:28:41,413] Trial 3 pruned. 
[I 2026-03-18 16:28:42,086] Trial 3 finished with value: -0.4136522606061339 and parameters: {'n_layers_yyx': 2, 'hidden_size_yyx_l0': 4, 'hidden_size_yyx_l1': 4, 'context_size_yyx': 3, 'num_mix_components_yyx': 2, 'context_extractor_yyx': 'gru', 'activation_func_yyx': 'Tanh', 'L2_weight_yyx': 5.1729689099799106e-05, 'L_entropy_weight_yyx': 6.56422510496769e-05, 'L_sep_weight_yyx': 7.200772674307717e-05, 'L_scale_weight_yyx': 2.2152566445705876e-05, 'learning_rate_yyx': 0.004578042376625541}. Best is trial 0 with value: -0.41448025068631483.
[I 2026-03-18 16:28:42,696] Trial 16 pruned. 
[I 2026-03-18 16:28:43,484] Trial 2 finished with value: -0.41750503398316563 and parameters: {'n_layers_yyx': 2, 'hidden_size_yyx_l0': 2, 'hidden_size_yyx_l1': 3, 'context_size_yyx': 3, 'num_mix_components_yyx': 5, 'context_extractor_yyx': 'lstm', 'activation_func_yyx': 'Tanh', 'L2_weight_yyx': 2.4030789443815527e-09, 'L_entropy_weight_yyx': 5.168822699742762e-07, 'L_sep_weight_yyx': 8.476308935978287e-06, 'L_scale_weight_yyx': 9.31328480256289e-10, 'learning_rate_yyx': 0.003259156474333693}. Best is trial 1 with value: -0.43281404005115615.
[I 2026-03-18 16:28:44,660] Trial 8 pruned. 
[I 2026-03-18 16:28:45,419] Trial 4 pruned. 
[I 2026-03-18 16:28:46,239] Trial 2 finished with value: -0.3570247213168779 and parameters: {'n_layers_yyx': 1, 'hidden_size_yyx_l0': 2, 'context_size_yyx': 4, 'num_mix_components_yyx': 1, 'context_extractor_yyx': 'lstm', 'activation_func_yyx': 'Tanh', 'L2_weight_yyx': 1.6519326626097376e-10, 'L_entropy_weight_yyx': 0.00034720499231070164, 'L_sep_weight_yyx': 4.719237640345993e-07, 'L_scale_weight_yyx': 5.481739712157561e-06, 'learning_rate_yyx': 0.0005611520713700561}. Best is trial 1 with value: -0.4204067549100232.
[I 2026-03-18 16:28:47,048] Trial 5 pruned. 
[I 2026-03-18 16:28:48,503] Trial 7 finished with value: -0.32091746610753674 and parameters: {'n_layers_yyx': 2, 'hidden_size_yyx_l0': 5, 'hidden_size_yyx_l1': 6, 'context_size_yyx': 1, 'num_mix_components_yyx': 1, 'context_extractor_yyx': 'lstm', 'activation_func_yyx': 'GELU', 'L2_weight_yyx': 3.387760619865711e-06, 'L_entropy_weight_yyx': 2.9093357615664273e-09, 'L_sep_weight_yyx': 1.92269081581456e-10, 'L_scale_weight_yyx': 5.441759381590778e-07, 'learning_rate_yyx': 0.0032916183858135257}. Best is trial 3 with value: -0.42374077669976296.
[I 2026-03-18 16:28:49,054] Trial 2 finished with value: -0.4323124841270801 and parameters: {'n_layers_yyx': 1, 'hidden_size_yyx_l0': 2, 'context_size_yyx': 4, 'num_mix_components_yyx': 2, 'context_extractor_yyx': 'gru', 'activation_func_yyx': 'GELU', 'L2_weight_yyx': 1.7347506107140485e-05, 'L_entropy_weight_yyx': 3.1596979653356154e-09, 'L_sep_weight_yyx': 0.000109514176234337, 'L_scale_weight_yyx': 2.3694603298883404e-07, 'learning_rate_yyx': 0.008521821173824815}. Best is trial 1 with value: -0.45911608244243424.
[I 2026-03-18 16:28:49,157] Trial 5 pruned. 
[I 2026-03-18 16:28:50,939] Trial 6 pruned. 
[I 2026-03-18 16:28:52,074] Trial 17 pruned. 
[I 2026-03-18 16:28:52,563] Trial 6 pruned. 
[I 2026-03-18 16:28:55,787] Trial 3 pruned. 
[I 2026-03-18 16:28:58,630] Trial 18 pruned. 
[I 2026-03-18 16:28:58,701] Trial 17 pruned. 
[I 2026-03-18 16:28:59,833] Trial 0 finished with value: -2.791594042385921 and parameters: {'n_layers_yyx': 2, 'hidden_size_yyx_l0': 3, 'hidden_size_yyx_l1': 6, 'context_size_yyx': 3, 'num_mix_components_yyx': 5, 'context_extractor_yyx': 'gru', 'activation_func_yyx': 'Tanh', 'L2_weight_yyx': 0.00022174809280354636, 'L_entropy_weight_yyx': 9.815934341907468e-06, 'L_sep_weight_yyx': 1.0190196473409523e-10, 'L_scale_weight_yyx': 0.000833741758944475, 'learning_rate_yyx': 0.0010905607954623145}. Best is trial 0 with value: -2.791594042385921.
[I 2026-03-18 16:29:01,852] Trial 9 pruned. 
[I 2026-03-18 16:29:02,002] Trial 19 pruned. 
[I 2026-03-18 16:29:02,218] Trial 18 pruned. 
[I 2026-03-18 16:29:02,426] Trial 3 pruned. 
[I 2026-03-18 16:29:05,438] Trial 3 finished with value: -0.3915605102161136 and parameters: {'n_layers_yyx': 2, 'hidden_size_yyx_l0': 4, 'hidden_size_yyx_l1': 4, 'context_size_yyx': 3, 'num_mix_components_yyx': 5, 'context_extractor_yyx': 'lstm', 'activation_func_yyx': 'ReLU', 'L2_weight_yyx': 6.028602480960354e-10, 'L_entropy_weight_yyx': 3.8936823197450054e-10, 'L_sep_weight_yyx': 7.51950201675909e-09, 'L_scale_weight_yyx': 2.7046397937477572e-09, 'learning_rate_yyx': 0.000531535325228138}. Best is trial 0 with value: -0.4236573021478328.
[I 2026-03-18 16:29:05,490] Trial 0 finished with value: -2.7560188059827233 and parameters: {'n_layers_yyx': 2, 'hidden_size_yyx_l0': 2, 'hidden_size_yyx_l1': 5, 'context_size_yyx': 1, 'num_mix_components_yyx': 5, 'context_extractor_yyx': 'lstm', 'activation_func_yyx': 'GELU', 'L2_weight_yyx': 1.7227701497394454e-06, 'L_entropy_weight_yyx': 1.9302266406709466e-07, 'L_sep_weight_yyx': 0.00026344381764528945, 'L_scale_weight_yyx': 5.868897816991705e-07, 'learning_rate_yyx': 0.0005742959600912867}. Best is trial 0 with value: -2.7560188059827233.
[I 2026-03-18 16:29:05,511] Trial 19 pruned. 
[I 2026-03-18 16:29:05,746] Trial 4 pruned. 
[I 2026-03-18 16:29:06,093] Trial 7 finished with value: -0.44963234349300985 and parameters: {'n_layers_yyx': 1, 'hidden_size_yyx_l0': 6, 'context_size_yyx': 1, 'num_mix_components_yyx': 5, 'context_extractor_yyx': 'lstm', 'activation_func_yyx': 'Tanh', 'L2_weight_yyx': 0.0008054540864714381, 'L_entropy_weight_yyx': 0.0008647312542281796, 'L_sep_weight_yyx': 5.774778137416092e-06, 'L_scale_weight_yyx': 8.307527206797182e-09, 'learning_rate_yyx': 0.006490631882312635}. Best is trial 7 with value: -0.44963234349300985.
[I 2026-03-18 16:29:08,280] Trial 20 pruned. 
[I 2026-03-18 16:29:08,370] Trial 10 pruned. 
[I 2026-03-18 16:29:11,705] Trial 4 finished with value: -0.3668225881854078 and parameters: {'n_layers_yyx': 1, 'hidden_size_yyx_l0': 6, 'context_size_yyx': 1, 'num_mix_components_yyx': 3, 'context_extractor_yyx': 'gru', 'activation_func_yyx': 'Tanh', 'L2_weight_yyx': 5.867329312155237e-07, 'L_entropy_weight_yyx': 4.232309236307426e-07, 'L_sep_weight_yyx': 1.1468868124934915e-09, 'L_scale_weight_yyx': 0.000959895773951866, 'learning_rate_yyx': 0.0035951145048122818}. Best is trial 2 with value: -0.4289537553816757.
[I 2026-03-18 16:29:11,759] Trial 4 pruned. 
[I 2026-03-18 16:29:11,956] Trial 9 finished with value: -0.42445208192240713 and parameters: {'n_layers_yyx': 1, 'hidden_size_yyx_l0': 3, 'context_size_yyx': 4, 'num_mix_components_yyx': 3, 'context_extractor_yyx': 'lstm', 'activation_func_yyx': 'ReLU', 'L2_weight_yyx': 0.00010198362985428291, 'L_entropy_weight_yyx': 1.832224416385032e-06, 'L_sep_weight_yyx': 7.811586044336937e-08, 'L_scale_weight_yyx': 3.93574634232752e-07, 'learning_rate_yyx': 0.0030045103165866342}. Best is trial 4 with value: -0.43761569280004353.
[I 2026-03-18 16:29:13,420] Trial 3 finished with value: -0.336222999974301 and parameters: {'n_layers_yyx': 2, 'hidden_size_yyx_l0': 4, 'hidden_size_yyx_l1': 6, 'context_size_yyx': 2, 'num_mix_components_yyx': 4, 'context_extractor_yyx': 'gru', 'activation_func_yyx': 'Tanh', 'L2_weight_yyx': 1.3931070543601921e-08, 'L_entropy_weight_yyx': 2.5467188724110857e-07, 'L_sep_weight_yyx': 4.20992103014792e-07, 'L_scale_weight_yyx': 4.4867909319090936e-06, 'learning_rate_yyx': 0.00169998545304847}. Best is trial 1 with value: -0.43281404005115615.
[I 2026-03-18 16:29:13,620] Trial 0 finished with value: -2.782248579189629 and parameters: {'n_layers_yyx': 1, 'hidden_size_yyx_l0': 2, 'context_size_yyx': 4, 'num_mix_components_yyx': 2, 'context_extractor_yyx': 'gru', 'activation_func_yyx': 'ReLU', 'L2_weight_yyx': 6.216453307781006e-08, 'L_entropy_weight_yyx': 2.9101405540357706e-07, 'L_sep_weight_yyx': 2.7363167353173635e-10, 'L_scale_weight_yyx': 1.3200060473986583e-08, 'learning_rate_yyx': 0.0019023625162924867}. Best is trial 0 with value: -2.782248579189629.
[I 2026-03-18 16:29:14,325] Trial 11 pruned. 
[I 2026-03-18 16:29:14,487] Trial 4 finished with value: -0.38703594857325124 and parameters: {'n_layers_yyx': 2, 'hidden_size_yyx_l0': 3, 'hidden_size_yyx_l1': 5, 'context_size_yyx': 3, 'num_mix_components_yyx': 5, 'context_extractor_yyx': 'gru', 'activation_func_yyx': 'ReLU', 'L2_weight_yyx': 4.157325527834637e-06, 'L_entropy_weight_yyx': 5.65350880838945e-06, 'L_sep_weight_yyx': 1.0340569479632471e-06, 'L_scale_weight_yyx': 1.559253772422313e-06, 'learning_rate_yyx': 0.00285876030409451}. Best is trial 1 with value: -0.4307959589057663.
