[I 2026-03-18 19:44:14,064] Trial 7 finished with value: -1.606665639142424 and parameters: {'n_layers_yyx': 2, 'hidden_size_yyx_l0': 3, 'hidden_size_yyx_l1': 4, 'context_size_yyx': 4, 'num_mix_components_yyx': 2, 'context_extractor_yyx': 'gru', 'activation_func_yyx': 'ReLU', 'L2_weight_yyx': 0.00024817644756846137, 'L_entropy_weight_yyx': 1.019523432705092e-06, 'L_sep_weight_yyx': 1.9230340426002456e-10, 'L_scale_weight_yyx': 1.6175199011362864e-09, 'learning_rate_yyx': 0.0026673599108589883}. Best is trial 0 with value: -1.613474194617056.
[I 2026-03-18 19:44:15,282] Trial 11 pruned. 
[I 2026-03-18 19:44:18,528] Trial 15 pruned. 
[I 2026-03-18 19:44:19,337] Trial 16 pruned. 
[I 2026-03-18 19:44:21,792] Trial 21 pruned. 
[I 2026-03-18 19:44:23,062] Trial 8 pruned. 
[I 2026-03-18 19:44:24,607] Trial 12 pruned. 
[I 2026-03-18 19:44:30,145] Trial 22 pruned. 
[I 2026-03-18 19:44:30,956] Trial 17 pruned. 
[I 2026-03-18 19:44:33,894] Trial 13 pruned. 
[I 2026-03-18 19:44:34,097] Trial 9 finished with value: -1.6219343655847114 and parameters: {'n_layers_yyx': 2, 'hidden_size_yyx_l0': 4, 'hidden_size_yyx_l1': 5, 'context_size_yyx': 1, 'num_mix_components_yyx': 4, 'context_extractor_yyx': 'gru', 'activation_func_yyx': 'ReLU', 'L2_weight_yyx': 2.2101214629940565e-10, 'L_entropy_weight_yyx': 2.5439009626558453e-08, 'L_sep_weight_yyx': 1.9743728113614313e-06, 'L_scale_weight_yyx': 0.00039547158782992655, 'learning_rate_yyx': 0.004006046628613697}. Best is trial 3 with value: -1.6307942617099915.
[I 2026-03-18 19:44:41,772] Trial 18 pruned. 
[I 2026-03-18 19:44:47,603] Trial 20 pruned. 
[I 2026-03-18 19:44:51,321] Trial 23 pruned. 
[I 2026-03-18 19:44:51,384] Trial 19 pruned. 
[I 2026-03-18 19:44:56,411] Trial 21 pruned. 
[I 2026-03-18 19:45:01,419] Trial 20 pruned. 
[I 2026-03-18 19:45:14,551] Trial 24 pruned. 
[I 2026-03-18 19:45:14,925] Trial 10 finished with value: -2.123509279126982 and parameters: {'n_layers_yyx': 1, 'hidden_size_yyx_l0': 3, 'context_size_yyx': 1, 'num_mix_components_yyx': 4, 'context_extractor_yyx': 'gru', 'activation_func_yyx': 'Tanh', 'L2_weight_yyx': 0.0008316133238711591, 'L_entropy_weight_yyx': 1.4438656047076365e-06, 'L_sep_weight_yyx': 1.8753748577960807e-07, 'L_scale_weight_yyx': 7.76344190312376e-08, 'learning_rate_yyx': 0.005009167894887443}. Best is trial 10 with value: -2.123509279126982.
[I 2026-03-18 19:45:15,729] Trial 18 finished with value: -1.6115376123609113 and parameters: {'n_layers_yyx': 2, 'hidden_size_yyx_l0': 3, 'hidden_size_yyx_l1': 5, 'context_size_yyx': 4, 'num_mix_components_yyx': 2, 'context_extractor_yyx': 'gru', 'activation_func_yyx': 'GELU', 'L2_weight_yyx': 2.9722608053803927e-09, 'L_entropy_weight_yyx': 1.7404904385276736e-08, 'L_sep_weight_yyx': 7.964092621597119e-07, 'L_scale_weight_yyx': 5.5568877218434164e-05, 'learning_rate_yyx': 0.009181670487416398}. Best is trial 18 with value: -1.6115376123609113.
[I 2026-03-18 19:45:16,920] Trial 15 finished with value: -1.6378937737710035 and parameters: {'n_layers_yyx': 2, 'hidden_size_yyx_l0': 2, 'hidden_size_yyx_l1': 6, 'context_size_yyx': 4, 'num_mix_components_yyx': 4, 'context_extractor_yyx': 'gru', 'activation_func_yyx': 'Tanh', 'L2_weight_yyx': 3.2981609167141943e-09, 'L_entropy_weight_yyx': 2.097236279037102e-09, 'L_sep_weight_yyx': 2.8220360775878306e-05, 'L_scale_weight_yyx': 1.5101266057974166e-05, 'learning_rate_yyx': 0.005919664562801839}. Best is trial 13 with value: -1.640321681328409.
[I 2026-03-18 19:45:17,358] Trial 16 pruned. 
[I 2026-03-18 19:45:19,671] Trial 22 pruned. 
[I 2026-03-18 19:45:24,999] Trial 25 pruned. 
[I 2026-03-18 19:45:27,763] Trial 16 pruned. 
[I 2026-03-18 19:45:29,034] Trial 15 finished with value: -1.6056868645179108 and parameters: {'n_layers_yyx': 2, 'hidden_size_yyx_l0': 6, 'hidden_size_yyx_l1': 5, 'context_size_yyx': 3, 'num_mix_components_yyx': 3, 'context_extractor_yyx': 'lstm', 'activation_func_yyx': 'ReLU', 'L2_weight_yyx': 5.119854314830387e-06, 'L_entropy_weight_yyx': 1.414010890045817e-10, 'L_sep_weight_yyx': 5.641408115309399e-05, 'L_scale_weight_yyx': 7.131329687360375e-09, 'learning_rate_yyx': 0.0033680577133157023}. Best is trial 1 with value: -1.6113757535901372.
[I 2026-03-18 19:45:30,164] Trial 23 pruned. 
[I 2026-03-18 19:45:39,785] Trial 16 pruned. 
[I 2026-03-18 19:45:40,076] Trial 10 pruned. 
[I 2026-03-18 19:45:51,196] Trial 17 pruned. 
[I 2026-03-18 19:45:53,149] Trial 10 finished with value: -2.0805055247379443 and parameters: {'n_layers_yyx': 1, 'hidden_size_yyx_l0': 6, 'context_size_yyx': 1, 'num_mix_components_yyx': 5, 'context_extractor_yyx': 'gru', 'activation_func_yyx': 'GELU', 'L2_weight_yyx': 0.0006743528009175417, 'L_entropy_weight_yyx': 8.577724169850199e-10, 'L_sep_weight_yyx': 1.9231278487776862e-05, 'L_scale_weight_yyx': 1.8628082355777517e-10, 'learning_rate_yyx': 0.0030139256114359234}. Best is trial 2 with value: -2.093203554819634.
[I 2026-03-18 19:45:53,527] Trial 12 finished with value: -1.6115339632262373 and parameters: {'n_layers_yyx': 2, 'hidden_size_yyx_l0': 2, 'hidden_size_yyx_l1': 3, 'context_size_yyx': 4, 'num_mix_components_yyx': 2, 'context_extractor_yyx': 'gru', 'activation_func_yyx': 'Tanh', 'L2_weight_yyx': 1.9823524712569897e-07, 'L_entropy_weight_yyx': 1.0869574332710873e-10, 'L_sep_weight_yyx': 0.0006195700864160306, 'L_scale_weight_yyx': 4.8153142931348354e-08, 'learning_rate_yyx': 0.0048616815981256355}. Best is trial 8 with value: -1.6134523538702668.
[I 2026-03-18 19:46:00,302] Trial 11 finished with value: -2.0785980080567943 and parameters: {'n_layers_yyx': 1, 'hidden_size_yyx_l0': 4, 'context_size_yyx': 3, 'num_mix_components_yyx': 4, 'context_extractor_yyx': 'gru', 'activation_func_yyx': 'ReLU', 'L2_weight_yyx': 7.81839822812128e-06, 'L_entropy_weight_yyx': 1.2251841790710185e-08, 'L_sep_weight_yyx': 0.0007412055412450445, 'L_scale_weight_yyx': 2.434874907470774e-06, 'learning_rate_yyx': 0.0020414464794172083}. Best is trial 0 with value: -2.0940855781262293.
[I 2026-03-18 19:46:01,923] Trial 18 pruned. 
[I 2026-03-18 19:46:10,143] Trial 15 finished with value: -1.6137187677320914 and parameters: {'n_layers_yyx': 2, 'hidden_size_yyx_l0': 4, 'hidden_size_yyx_l1': 6, 'context_size_yyx': 3, 'num_mix_components_yyx': 5, 'context_extractor_yyx': 'gru', 'activation_func_yyx': 'ReLU', 'L2_weight_yyx': 8.308307769898755e-10, 'L_entropy_weight_yyx': 1.961727653325324e-09, 'L_sep_weight_yyx': 4.266932076077001e-05, 'L_scale_weight_yyx': 2.9203048482234935e-05, 'learning_rate_yyx': 0.003234730177613188}. Best is trial 15 with value: -1.6137187677320914.
[I 2026-03-18 19:46:23,195] Trial 19 pruned. 
[I 2026-03-18 19:46:27,534] Trial 13 finished with value: -2.092152629106611 and parameters: {'n_layers_yyx': 1, 'hidden_size_yyx_l0': 4, 'context_size_yyx': 4, 'num_mix_components_yyx': 4, 'context_extractor_yyx': 'lstm', 'activation_func_yyx': 'ReLU', 'L2_weight_yyx': 1.2308473705046724e-08, 'L_entropy_weight_yyx': 1.2201681899953665e-08, 'L_sep_weight_yyx': 1.935490558589076e-05, 'L_scale_weight_yyx': 0.000914639290187134, 'learning_rate_yyx': 0.009664558695067748}. Best is trial 13 with value: -2.092152629106611.
[I 2026-03-18 19:46:30,145] Trial 18 finished with value: -1.612652085120959 and parameters: {'n_layers_yyx': 1, 'hidden_size_yyx_l0': 5, 'context_size_yyx': 3, 'num_mix_components_yyx': 4, 'context_extractor_yyx': 'gru', 'activation_func_yyx': 'ReLU', 'L2_weight_yyx': 1.2766522307827163e-07, 'L_entropy_weight_yyx': 3.696319490433978e-06, 'L_sep_weight_yyx': 1.3180723236402023e-10, 'L_scale_weight_yyx': 1.4126516804076025e-10, 'learning_rate_yyx': 0.0031495019871882212}. Best is trial 5 with value: -1.6144105896050156.
[I 2026-03-18 19:46:33,691] Trial 24 pruned. 
[I 2026-03-18 19:46:37,504] Trial 14 finished with value: -1.5833228284430236 and parameters: {'n_layers_yyx': 2, 'hidden_size_yyx_l0': 5, 'hidden_size_yyx_l1': 2, 'context_size_yyx': 4, 'num_mix_components_yyx': 3, 'context_extractor_yyx': 'gru', 'activation_func_yyx': 'GELU', 'L2_weight_yyx': 0.000799034505062007, 'L_entropy_weight_yyx': 2.6393426006835015e-05, 'L_sep_weight_yyx': 1.232569275107217e-07, 'L_scale_weight_yyx': 3.2585703417799e-07, 'learning_rate_yyx': 0.005450357421272975}. Best is trial 7 with value: -1.6077896387869492.
[I 2026-03-18 19:46:41,555] Trial 6 finished with value: -2.0854983656867034 and parameters: {'n_layers_yyx': 1, 'hidden_size_yyx_l0': 4, 'context_size_yyx': 1, 'num_mix_components_yyx': 4, 'context_extractor_yyx': 'gru', 'activation_func_yyx': 'ReLU', 'L2_weight_yyx': 7.697834017322042e-07, 'L_entropy_weight_yyx': 2.779486894308715e-05, 'L_sep_weight_yyx': 5.409561989290972e-06, 'L_scale_weight_yyx': 1.1452299089216085e-10, 'learning_rate_yyx': 0.0031682280865924124}. Best is trial 6 with value: -2.0854983656867034.
[I 2026-03-18 19:46:42,899] Trial 11 pruned. 
[I 2026-03-18 19:46:45,365] Trial 20 pruned. 
[I 2026-03-18 19:46:46,156] Trial 8 finished with value: -2.059241137176194 and parameters: {'n_layers_yyx': 1, 'hidden_size_yyx_l0': 5, 'context_size_yyx': 3, 'num_mix_components_yyx': 2, 'context_extractor_yyx': 'gru', 'activation_func_yyx': 'ReLU', 'L2_weight_yyx': 7.38391350185436e-05, 'L_entropy_weight_yyx': 6.542110763133284e-08, 'L_sep_weight_yyx': 2.3855387957970833e-08, 'L_scale_weight_yyx': 2.692099335877415e-08, 'learning_rate_yyx': 0.00569173563079683}. Best is trial 1 with value: -2.0819965339546846.
[I 2026-03-18 19:46:46,492] Trial 10 pruned. 
[I 2026-03-18 19:46:47,307] Trial 15 pruned. 
[I 2026-03-18 19:46:49,816] Trial 9 finished with value: -2.067889185353898 and parameters: {'n_layers_yyx': 1, 'hidden_size_yyx_l0': 5, 'context_size_yyx': 4, 'num_mix_components_yyx': 1, 'context_extractor_yyx': 'lstm', 'activation_func_yyx': 'ReLU', 'L2_weight_yyx': 1.2659189998604392e-07, 'L_entropy_weight_yyx': 1.819584898469674e-05, 'L_sep_weight_yyx': 0.00014856530287769279, 'L_scale_weight_yyx': 4.055373140338691e-09, 'learning_rate_yyx': 0.0013612849167916007}. Best is trial 8 with value: -2.0851807543284644.
[I 2026-03-18 19:46:50,218] Trial 9 pruned. 
[I 2026-03-18 19:46:50,225] Trial 14 pruned. 
[I 2026-03-18 19:46:51,812] Trial 10 finished with value: -1.6005695702249159 and parameters: {'n_layers_yyx': 1, 'hidden_size_yyx_l0': 5, 'context_size_yyx': 2, 'num_mix_components_yyx': 1, 'context_extractor_yyx': 'gru', 'activation_func_yyx': 'ReLU', 'L2_weight_yyx': 6.267188891250168e-06, 'L_entropy_weight_yyx': 1.10111189891625e-10, 'L_sep_weight_yyx': 0.0007695906023062037, 'L_scale_weight_yyx': 2.9783096093090215e-08, 'learning_rate_yyx': 0.009497135747455997}. Best is trial 3 with value: -1.6307942617099915.
[I 2026-03-18 19:46:54,683] Trial 25 pruned. 
[I 2026-03-18 19:46:55,421] Trial 21 pruned. 
[I 2026-03-18 19:46:55,793] Trial 19 finished with value: -1.6109068256442372 and parameters: {'n_layers_yyx': 2, 'hidden_size_yyx_l0': 2, 'hidden_size_yyx_l1': 5, 'context_size_yyx': 4, 'num_mix_components_yyx': 2, 'context_extractor_yyx': 'gru', 'activation_func_yyx': 'GELU', 'L2_weight_yyx': 4.893727513842139e-08, 'L_entropy_weight_yyx': 3.113686349762648e-08, 'L_sep_weight_yyx': 8.509837185283257e-07, 'L_scale_weight_yyx': 6.0586156473759655e-05, 'learning_rate_yyx': 0.009538246238222957}. Best is trial 18 with value: -1.6115376123609113.
[I 2026-03-18 19:46:58,897] Trial 11 pruned. 
[I 2026-03-18 19:47:06,564] Trial 20 pruned. 
[I 2026-03-18 19:47:13,986] Trial 11 pruned. 
[I 2026-03-18 19:47:14,809] Trial 15 pruned. 
[I 2026-03-18 19:47:16,317] Trial 17 finished with value: -1.5869052423907153 and parameters: {'n_layers_yyx': 2, 'hidden_size_yyx_l0': 4, 'hidden_size_yyx_l1': 4, 'context_size_yyx': 4, 'num_mix_components_yyx': 2, 'context_extractor_yyx': 'lstm', 'activation_func_yyx': 'Tanh', 'L2_weight_yyx': 0.0009607577273176554, 'L_entropy_weight_yyx': 1.8910642493054195e-07, 'L_sep_weight_yyx': 1.34430482428798e-06, 'L_scale_weight_yyx': 1.091654568361089e-10, 'learning_rate_yyx': 0.006618676217381058}. Best is trial 1 with value: -1.6113757535901372.
[I 2026-03-18 19:47:17,586] Trial 10 pruned. 
[I 2026-03-18 19:47:24,111] Trial 12 pruned. 
[I 2026-03-18 19:47:28,458] Trial 26 finished with value: -2.0512741599384294 and parameters: {'n_layers_yyx': 2, 'hidden_size_yyx_l0': 3, 'hidden_size_yyx_l1': 6, 'context_size_yyx': 3, 'num_mix_components_yyx': 2, 'context_extractor_yyx': 'gru', 'activation_func_yyx': 'ReLU', 'L2_weight_yyx': 8.033677420128854e-07, 'L_entropy_weight_yyx': 1.8189557013375693e-08, 'L_sep_weight_yyx': 1.5410717350673384e-07, 'L_scale_weight_yyx': 3.858884548465856e-07, 'learning_rate_yyx': 0.007765323176470435}. Best is trial 2 with value: -2.059868681386501.
[I 2026-03-18 19:47:31,354] Trial 21 finished with value: -2.0975034066716556 and parameters: {'n_layers_yyx': 1, 'hidden_size_yyx_l0': 4, 'context_size_yyx': 4, 'num_mix_components_yyx': 5, 'context_extractor_yyx': 'lstm', 'activation_func_yyx': 'Tanh', 'L2_weight_yyx': 2.512596887343944e-08, 'L_entropy_weight_yyx': 9.915821987258537e-09, 'L_sep_weight_yyx': 1.0469107845083748e-08, 'L_scale_weight_yyx': 1.0685029645149928e-10, 'learning_rate_yyx': 0.009909368941845888}. Best is trial 21 with value: -2.0975034066716556.
[I 2026-03-18 19:47:33,270] Trial 13 pruned. 
[I 2026-03-18 19:47:37,687] Trial 27 pruned. 
[I 2026-03-18 19:47:38,251] Trial 16 pruned. 
[I 2026-03-18 19:47:40,723] Trial 11 finished with value: -2.095012278283745 and parameters: {'n_layers_yyx': 1, 'hidden_size_yyx_l0': 4, 'context_size_yyx': 1, 'num_mix_components_yyx': 3, 'context_extractor_yyx': 'gru', 'activation_func_yyx': 'Tanh', 'L2_weight_yyx': 4.060720841362853e-09, 'L_entropy_weight_yyx': 1.3860109652814205e-08, 'L_sep_weight_yyx': 0.000890109056525604, 'L_scale_weight_yyx': 2.4048958490539155e-10, 'learning_rate_yyx': 0.009539856777249}. Best is trial 11 with value: -2.095012278283745.
[I 2026-03-18 19:47:41,653] Trial 9 pruned. 
[I 2026-03-18 19:47:42,689] Trial 14 pruned. 
[I 2026-03-18 19:47:47,697] Trial 22 pruned. 
[I 2026-03-18 19:47:52,259] Trial 9 finished with value: -1.613731891101604 and parameters: {'n_layers_yyx': 2, 'hidden_size_yyx_l0': 5, 'hidden_size_yyx_l1': 2, 'context_size_yyx': 3, 'num_mix_components_yyx': 2, 'context_extractor_yyx': 'gru', 'activation_func_yyx': 'GELU', 'L2_weight_yyx': 4.3723915226757385e-07, 'L_entropy_weight_yyx': 1.5467354283889534e-08, 'L_sep_weight_yyx': 6.628157773518982e-06, 'L_scale_weight_yyx': 1.6935551171966986e-09, 'learning_rate_yyx': 0.008036831256346006}. Best is trial 9 with value: -1.613731891101604.
[I 2026-03-18 19:47:54,982] Trial 22 pruned. 
[I 2026-03-18 19:47:58,315] Trial 28 pruned. 
[I 2026-03-18 19:47:58,702] Trial 17 pruned. 
[I 2026-03-18 19:48:04,884] Trial 12 pruned. 
[I 2026-03-18 19:48:07,296] Trial 29 pruned. 
[I 2026-03-18 19:48:07,829] Trial 18 pruned. 
[I 2026-03-18 19:48:07,865] Trial 11 pruned. 
[I 2026-03-18 19:48:23,148] Trial 13 pruned. 
[I 2026-03-18 19:48:26,187] Trial 19 pruned. 
[I 2026-03-18 19:48:34,625] Trial 20 pruned. 
[I 2026-03-18 19:48:37,675] Trial 12 pruned. 
[I 2026-03-18 19:48:39,619] Trial 23 pruned. 
[I 2026-03-18 19:48:40,423] Trial 26 finished with value: -1.6132763574564741 and parameters: {'n_layers_yyx': 1, 'hidden_size_yyx_l0': 3, 'context_size_yyx': 4, 'num_mix_components_yyx': 4, 'context_extractor_yyx': 'lstm', 'activation_func_yyx': 'ReLU', 'L2_weight_yyx': 3.488307512999631e-10, 'L_entropy_weight_yyx': 7.489047217706581e-07, 'L_sep_weight_yyx': 2.6729564912570955e-09, 'L_scale_weight_yyx': 1.020688736243376e-05, 'learning_rate_yyx': 0.008205102830401483}. Best is trial 26 with value: -1.6132763574564741.
[I 2026-03-18 19:48:45,736] Trial 10 pruned. 
[I 2026-03-18 19:48:46,821] Trial 16 finished with value: -1.614054069147372 and parameters: {'n_layers_yyx': 2, 'hidden_size_yyx_l0': 4, 'hidden_size_yyx_l1': 6, 'context_size_yyx': 3, 'num_mix_components_yyx': 3, 'context_extractor_yyx': 'gru', 'activation_func_yyx': 'ReLU', 'L2_weight_yyx': 1.3124778175650646e-09, 'L_entropy_weight_yyx': 1.602650720748608e-09, 'L_sep_weight_yyx': 5.798411372901635e-07, 'L_scale_weight_yyx': 3.809593308153598e-05, 'learning_rate_yyx': 0.003401703820249301}. Best is trial 16 with value: -1.614054069147372.
[I 2026-03-18 19:48:51,365] Trial 11 finished with value: -1.6118875103148873 and parameters: {'n_layers_yyx': 2, 'hidden_size_yyx_l0': 2, 'hidden_size_yyx_l1': 6, 'context_size_yyx': 4, 'num_mix_components_yyx': 3, 'context_extractor_yyx': 'gru', 'activation_func_yyx': 'ReLU', 'L2_weight_yyx': 7.57094546528649e-05, 'L_entropy_weight_yyx': 4.836575661757138e-06, 'L_sep_weight_yyx': 2.884826747146721e-06, 'L_scale_weight_yyx': 8.497057177523556e-07, 'learning_rate_yyx': 0.007999009699845442}. Best is trial 2 with value: -1.6133203092563246.
[I 2026-03-18 19:48:55,675] Trial 21 pruned. 
[I 2026-03-18 19:49:01,658] Trial 12 pruned. 
[I 2026-03-18 19:49:01,700] Trial 13 finished with value: -1.613792101823724 and parameters: {'n_layers_yyx': 2, 'hidden_size_yyx_l0': 3, 'hidden_size_yyx_l1': 3, 'context_size_yyx': 3, 'num_mix_components_yyx': 2, 'context_extractor_yyx': 'gru', 'activation_func_yyx': 'Tanh', 'L2_weight_yyx': 6.052938971330608e-06, 'L_entropy_weight_yyx': 4.091322599156778e-08, 'L_sep_weight_yyx': 5.0692477984265905e-05, 'L_scale_weight_yyx': 2.2376321576077918e-05, 'learning_rate_yyx': 0.009424271060883645}. Best is trial 13 with value: -1.613792101823724.
[I 2026-03-18 19:49:04,035] Trial 24 pruned. 
[I 2026-03-18 19:49:07,763] Trial 12 pruned. 
[I 2026-03-18 19:49:08,429] Trial 22 pruned. 
[I 2026-03-18 19:49:14,887] Trial 17 pruned. 
[I 2026-03-18 19:49:15,999] Trial 21 finished with value: -1.6119054721666712 and parameters: {'n_layers_yyx': 2, 'hidden_size_yyx_l0': 3, 'hidden_size_yyx_l1': 5, 'context_size_yyx': 4, 'num_mix_components_yyx': 2, 'context_extractor_yyx': 'gru', 'activation_func_yyx': 'GELU', 'L2_weight_yyx': 3.4424512777517756e-08, 'L_entropy_weight_yyx': 2.2484956454236183e-07, 'L_sep_weight_yyx': 6.214931839302536e-07, 'L_scale_weight_yyx': 7.335154136856083e-05, 'learning_rate_yyx': 0.009932551498010488}. Best is trial 21 with value: -1.6119054721666712.
[I 2026-03-18 19:49:25,775] Trial 23 pruned. 
[I 2026-03-18 19:49:35,412] Trial 14 pruned. 
[I 2026-03-18 19:49:41,720] Trial 12 finished with value: -2.0975572887346234 and parameters: {'n_layers_yyx': 1, 'hidden_size_yyx_l0': 5, 'context_size_yyx': 1, 'num_mix_components_yyx': 5, 'context_extractor_yyx': 'gru', 'activation_func_yyx': 'ReLU', 'L2_weight_yyx': 1.2811237651262165e-09, 'L_entropy_weight_yyx': 1.1900062667038152e-08, 'L_sep_weight_yyx': 9.868534959318995e-05, 'L_scale_weight_yyx': 1.7770406061753167e-09, 'learning_rate_yyx': 0.004436208295566918}. Best is trial 12 with value: -2.0975572887346234.
[I 2026-03-18 19:49:41,770] Trial 10 finished with value: -2.091011705152489 and parameters: {'n_layers_yyx': 1, 'hidden_size_yyx_l0': 6, 'context_size_yyx': 4, 'num_mix_components_yyx': 5, 'context_extractor_yyx': 'gru', 'activation_func_yyx': 'Tanh', 'L2_weight_yyx': 2.0444987089283187e-08, 'L_entropy_weight_yyx': 4.435974073861384e-09, 'L_sep_weight_yyx': 2.705822263160701e-08, 'L_scale_weight_yyx': 2.8720072758270074e-06, 'learning_rate_yyx': 0.0038998859227859194}. Best is trial 10 with value: -2.091011705152489.
[I 2026-03-18 19:49:55,324] Trial 27 pruned. 
[I 2026-03-18 19:50:09,521] Trial 11 finished with value: -2.0771111451731756 and parameters: {'n_layers_yyx': 2, 'hidden_size_yyx_l0': 2, 'hidden_size_yyx_l1': 6, 'context_size_yyx': 4, 'num_mix_components_yyx': 2, 'context_extractor_yyx': 'gru', 'activation_func_yyx': 'ReLU', 'L2_weight_yyx': 1.0798207324842967e-10, 'L_entropy_weight_yyx': 1.1012599719120529e-10, 'L_sep_weight_yyx': 1.3267666650751251e-08, 'L_scale_weight_yyx': 5.207998521779835e-07, 'learning_rate_yyx': 0.00946913494436455}. Best is trial 8 with value: -2.0851807543284644.
[I 2026-03-18 19:50:11,926] Trial 11 pruned. 
[I 2026-03-18 19:50:15,642] Trial 17 finished with value: -1.6510014956173003 and parameters: {'n_layers_yyx': 2, 'hidden_size_yyx_l0': 4, 'hidden_size_yyx_l1': 3, 'context_size_yyx': 2, 'num_mix_components_yyx': 3, 'context_extractor_yyx': 'gru', 'activation_func_yyx': 'ReLU', 'L2_weight_yyx': 3.6702573987734874e-05, 'L_entropy_weight_yyx': 8.885920605633978e-05, 'L_sep_weight_yyx': 6.95300805643135e-06, 'L_scale_weight_yyx': 4.823034283529978e-05, 'learning_rate_yyx': 0.003097704635898366}. Best is trial 12 with value: -1.6531010225123595.
[I 2026-03-18 19:50:22,413] Trial 18 finished with value: -1.5852524896047548 and parameters: {'n_layers_yyx': 2, 'hidden_size_yyx_l0': 5, 'hidden_size_yyx_l1': 2, 'context_size_yyx': 3, 'num_mix_components_yyx': 4, 'context_extractor_yyx': 'lstm', 'activation_func_yyx': 'ReLU', 'L2_weight_yyx': 3.9282384966947235e-06, 'L_entropy_weight_yyx': 3.1233174200763294e-06, 'L_sep_weight_yyx': 2.722228756265935e-10, 'L_scale_weight_yyx': 6.409140162892522e-07, 'learning_rate_yyx': 0.002032844303747401}. Best is trial 1 with value: -1.6113757535901372.
[I 2026-03-18 19:50:27,898] Trial 11 pruned. 
[I 2026-03-18 19:50:32,431] Trial 19 finished with value: -1.6106800792278495 and parameters: {'n_layers_yyx': 1, 'hidden_size_yyx_l0': 6, 'context_size_yyx': 2, 'num_mix_components_yyx': 2, 'context_extractor_yyx': 'gru', 'activation_func_yyx': 'GELU', 'L2_weight_yyx': 2.5271277603024463e-09, 'L_entropy_weight_yyx': 1.270035866052372e-10, 'L_sep_weight_yyx': 3.5292824805477044e-05, 'L_scale_weight_yyx': 1.052253699359622e-08, 'learning_rate_yyx': 0.008188758117189162}. Best is trial 5 with value: -1.6144105896050156.
