[I 2026-03-18 19:00:58,596] Trial 5 finished with value: -2.4307832195538683 and parameters: {'n_layers_yyx': 2, 'hidden_size_yyx_l0': 6, 'hidden_size_yyx_l1': 2, 'context_size_yyx': 3, 'num_mix_components_yyx': 2, 'context_extractor_yyx': 'lstm', 'activation_func_yyx': 'Tanh', 'L2_weight_yyx': 1.430290632062969e-05, 'L_entropy_weight_yyx': 3.904644972417227e-05, 'L_sep_weight_yyx': 1.3758937741474798e-05, 'L_scale_weight_yyx': 7.360746765222969e-09, 'learning_rate_yyx': 0.006971615127025084}. Best is trial 0 with value: -2.431222564426635.
[I 2026-03-18 19:00:59,642] Trial 6 pruned. 
[I 2026-03-18 19:01:12,415] Trial 11 pruned. 
[I 2026-03-18 19:01:19,901] Trial 5 pruned. 
[I 2026-03-18 19:01:24,992] Trial 4 finished with value: -2.4173248898683974 and parameters: {'n_layers_yyx': 1, 'hidden_size_yyx_l0': 3, 'context_size_yyx': 1, 'num_mix_components_yyx': 4, 'context_extractor_yyx': 'gru', 'activation_func_yyx': 'ReLU', 'L2_weight_yyx': 3.698198299899285e-08, 'L_entropy_weight_yyx': 3.0453539180719733e-05, 'L_sep_weight_yyx': 2.147911492205573e-07, 'L_scale_weight_yyx': 3.8018162815669643e-06, 'learning_rate_yyx': 0.007588632300754984}. Best is trial 2 with value: -2.4184476873626197.
[I 2026-03-18 19:01:26,633] Trial 10 pruned. 
[I 2026-03-18 19:01:36,234] Trial 7 pruned. 
[I 2026-03-18 19:01:40,534] Trial 8 pruned. 
[I 2026-03-18 19:01:40,566] Trial 6 finished with value: -2.7638935883839926 and parameters: {'n_layers_yyx': 2, 'hidden_size_yyx_l0': 5, 'hidden_size_yyx_l1': 5, 'context_size_yyx': 4, 'num_mix_components_yyx': 5, 'context_extractor_yyx': 'gru', 'activation_func_yyx': 'ReLU', 'L2_weight_yyx': 4.7077097596846006e-07, 'L_entropy_weight_yyx': 1.2803751815896167e-09, 'L_sep_weight_yyx': 4.501866332379873e-09, 'L_scale_weight_yyx': 2.5111811224400374e-07, 'learning_rate_yyx': 0.0066080929645233885}. Best is trial 3 with value: -2.7657987594604494.
[I 2026-03-18 19:01:49,237] Trial 6 finished with value: -0.8189613421171067 and parameters: {'n_layers_yyx': 2, 'hidden_size_yyx_l0': 3, 'hidden_size_yyx_l1': 3, 'context_size_yyx': 1, 'num_mix_components_yyx': 4, 'context_extractor_yyx': 'lstm', 'activation_func_yyx': 'ReLU', 'L2_weight_yyx': 1.8613153142258795e-05, 'L_entropy_weight_yyx': 2.5175572735441486e-09, 'L_sep_weight_yyx': 0.00031271089336000794, 'L_scale_weight_yyx': 6.344561696147683e-10, 'learning_rate_yyx': 0.0011775149201318717}. Best is trial 6 with value: -0.8189613421171067.
[I 2026-03-18 19:02:06,788] Trial 6 pruned. 
[I 2026-03-18 19:02:06,789] Trial 15 pruned. 
[I 2026-03-18 19:02:11,294] Trial 11 pruned. 
[I 2026-03-18 19:02:22,991] Trial 7 pruned. 
[I 2026-03-18 19:02:24,041] Trial 12 pruned. 
[I 2026-03-18 19:02:28,034] Trial 9 pruned. 
[I 2026-03-18 19:02:39,605] Trial 9 pruned. 
[I 2026-03-18 19:02:46,454] Trial 5 pruned. 
[I 2026-03-18 19:02:50,657] Trial 16 pruned. 
[I 2026-03-18 19:02:57,244] Trial 12 pruned. 
[I 2026-03-18 19:03:06,079] Trial 6 finished with value: -2.7665796528518882 and parameters: {'n_layers_yyx': 2, 'hidden_size_yyx_l0': 4, 'hidden_size_yyx_l1': 3, 'context_size_yyx': 4, 'num_mix_components_yyx': 5, 'context_extractor_yyx': 'lstm', 'activation_func_yyx': 'ReLU', 'L2_weight_yyx': 2.777472865097559e-07, 'L_entropy_weight_yyx': 6.57446787682854e-07, 'L_sep_weight_yyx': 6.958156303055962e-08, 'L_scale_weight_yyx': 0.00021926134534185326, 'learning_rate_yyx': 0.009634156309460679}. Best is trial 6 with value: -2.7665796528518882.
[I 2026-03-18 19:03:11,660] Trial 8 pruned. 
[I 2026-03-18 19:03:12,607] Trial 4 finished with value: -2.4107272646481857 and parameters: {'n_layers_yyx': 2, 'hidden_size_yyx_l0': 2, 'hidden_size_yyx_l1': 3, 'context_size_yyx': 3, 'num_mix_components_yyx': 2, 'context_extractor_yyx': 'lstm', 'activation_func_yyx': 'GELU', 'L2_weight_yyx': 0.0004169666971962174, 'L_entropy_weight_yyx': 1.4357623846565867e-07, 'L_sep_weight_yyx': 7.567613306108035e-05, 'L_scale_weight_yyx': 8.14637587315105e-09, 'learning_rate_yyx': 0.009091367648194357}. Best is trial 2 with value: -2.4109094575005234.
[I 2026-03-18 19:03:13,648] Trial 10 pruned. 
[I 2026-03-18 19:03:21,018] Trial 10 pruned. 
[I 2026-03-18 19:03:27,454] Trial 6 pruned. 
[I 2026-03-18 19:03:55,090] Trial 3 finished with value: -2.379263824777505 and parameters: {'n_layers_yyx': 1, 'hidden_size_yyx_l0': 5, 'context_size_yyx': 1, 'num_mix_components_yyx': 1, 'context_extractor_yyx': 'gru', 'activation_func_yyx': 'ReLU', 'L2_weight_yyx': 5.671166220101926e-06, 'L_entropy_weight_yyx': 0.0005665704017985837, 'L_sep_weight_yyx': 1.1840668631596102e-09, 'L_scale_weight_yyx': 8.267191141711324e-09, 'learning_rate_yyx': 0.0011094109598381496}. Best is trial 2 with value: -2.407757820050741.
[I 2026-03-18 19:04:29,878] Trial 7 finished with value: -2.761001489369292 and parameters: {'n_layers_yyx': 2, 'hidden_size_yyx_l0': 4, 'hidden_size_yyx_l1': 5, 'context_size_yyx': 2, 'num_mix_components_yyx': 4, 'context_extractor_yyx': 'gru', 'activation_func_yyx': 'ReLU', 'L2_weight_yyx': 2.350291629614126e-10, 'L_entropy_weight_yyx': 3.449964917138364e-05, 'L_sep_weight_yyx': 9.598529436557449e-08, 'L_scale_weight_yyx': 1.496483470718805e-05, 'learning_rate_yyx': 0.009463978902497613}. Best is trial 2 with value: -2.762987867182404.
[I 2026-03-18 19:04:29,908] Trial 13 pruned. 
[I 2026-03-18 19:04:38,768] Trial 7 pruned. 
[I 2026-03-18 19:04:44,511] Trial 7 pruned. 
[I 2026-03-18 19:04:57,490] Trial 5 finished with value: -2.7599099304000405 and parameters: {'n_layers_yyx': 2, 'hidden_size_yyx_l0': 5, 'hidden_size_yyx_l1': 4, 'context_size_yyx': 2, 'num_mix_components_yyx': 3, 'context_extractor_yyx': 'lstm', 'activation_func_yyx': 'GELU', 'L2_weight_yyx': 0.00019380353456194637, 'L_entropy_weight_yyx': 3.3352947057446203e-09, 'L_sep_weight_yyx': 7.63275460129555e-09, 'L_scale_weight_yyx': 6.866601261945084e-09, 'learning_rate_yyx': 0.004785118276473725}. Best is trial 1 with value: -2.762434471701954.
[I 2026-03-18 19:05:13,298] Trial 14 pruned. 
[I 2026-03-18 19:05:20,187] Trial 9 finished with value: -2.7619469381626907 and parameters: {'n_layers_yyx': 1, 'hidden_size_yyx_l0': 5, 'context_size_yyx': 2, 'num_mix_components_yyx': 2, 'context_extractor_yyx': 'lstm', 'activation_func_yyx': 'ReLU', 'L2_weight_yyx': 0.0002747708497061657, 'L_entropy_weight_yyx': 9.66578501677178e-08, 'L_sep_weight_yyx': 8.727916159464775e-05, 'L_scale_weight_yyx': 3.3584860916909975e-05, 'learning_rate_yyx': 0.009009638630056048}. Best is trial 3 with value: -2.764943250652336.
[I 2026-03-18 19:05:22,062] Trial 6 finished with value: -2.732089680268654 and parameters: {'n_layers_yyx': 2, 'hidden_size_yyx_l0': 5, 'hidden_size_yyx_l1': 4, 'context_size_yyx': 4, 'num_mix_components_yyx': 2, 'context_extractor_yyx': 'gru', 'activation_func_yyx': 'Tanh', 'L2_weight_yyx': 7.1842268506206695e-09, 'L_entropy_weight_yyx': 1.2503907853516231e-06, 'L_sep_weight_yyx': 4.501774229871737e-05, 'L_scale_weight_yyx': 5.705460222176908e-07, 'learning_rate_yyx': 0.004348251397822419}. Best is trial 2 with value: -2.7657870500891577.
[I 2026-03-18 19:05:23,945] Trial 8 pruned. 
[I 2026-03-18 19:05:24,911] Trial 8 pruned. 
[I 2026-03-18 19:06:04,519] Trial 7 pruned. 
[I 2026-03-18 19:06:21,730] Trial 15 finished with value: -2.7581294911430483 and parameters: {'n_layers_yyx': 2, 'hidden_size_yyx_l0': 3, 'hidden_size_yyx_l1': 3, 'context_size_yyx': 3, 'num_mix_components_yyx': 5, 'context_extractor_yyx': 'lstm', 'activation_func_yyx': 'GELU', 'L2_weight_yyx': 1.3183182129893513e-07, 'L_entropy_weight_yyx': 1.7601841011379656e-08, 'L_sep_weight_yyx': 2.91633277655865e-05, 'L_scale_weight_yyx': 4.015433557841047e-08, 'learning_rate_yyx': 0.0045448143878994455}. Best is trial 15 with value: -2.7581294911430483.
[I 2026-03-18 19:06:44,156] Trial 4 finished with value: -2.267426319611378 and parameters: {'n_layers_yyx': 2, 'hidden_size_yyx_l0': 2, 'hidden_size_yyx_l1': 2, 'context_size_yyx': 1, 'num_mix_components_yyx': 1, 'context_extractor_yyx': 'gru', 'activation_func_yyx': 'ReLU', 'L2_weight_yyx': 1.1292495568569786e-08, 'L_entropy_weight_yyx': 1.8788395506456736e-10, 'L_sep_weight_yyx': 2.081918101112675e-05, 'L_scale_weight_yyx': 6.1911688085679275e-09, 'learning_rate_yyx': 0.0018555501658971704}. Best is trial 1 with value: -2.393392615685096.
[I 2026-03-18 19:06:56,397] Trial 9 pruned. 
[I 2026-03-18 19:07:19,006] Trial 4 pruned. 
[I 2026-03-18 19:08:05,469] Trial 3 finished with value: -2.7235705372441963 and parameters: {'n_layers_yyx': 1, 'hidden_size_yyx_l0': 2, 'context_size_yyx': 1, 'num_mix_components_yyx': 1, 'context_extractor_yyx': 'gru', 'activation_func_yyx': 'ReLU', 'L2_weight_yyx': 1.4463352160518752e-10, 'L_entropy_weight_yyx': 1.120368380697877e-08, 'L_sep_weight_yyx': 1.6878699926000487e-06, 'L_scale_weight_yyx': 1.3445659641436393e-08, 'learning_rate_yyx': 0.0007473222206803466}. Best is trial 2 with value: -2.7647061180279695.
[I 2026-03-18 19:08:45,663] Trial 4 finished with value: -0.8398728250928961 and parameters: {'n_layers_yyx': 2, 'hidden_size_yyx_l0': 4, 'hidden_size_yyx_l1': 3, 'context_size_yyx': 3, 'num_mix_components_yyx': 2, 'context_extractor_yyx': 'lstm', 'activation_func_yyx': 'GELU', 'L2_weight_yyx': 3.2104298625782825e-09, 'L_entropy_weight_yyx': 1.9585515532928507e-07, 'L_sep_weight_yyx': 4.123134885671391e-09, 'L_scale_weight_yyx': 5.542339536457317e-05, 'learning_rate_yyx': 0.0038721933881763065}. Best is trial 0 with value: -0.843539329540078.
[I 2026-03-18 19:09:09,349] Trial 10 pruned. 
[I 2026-03-18 19:09:13,148] Trial 6 finished with value: -2.5462433457735516 and parameters: {'n_layers_yyx': 2, 'hidden_size_yyx_l0': 4, 'hidden_size_yyx_l1': 6, 'context_size_yyx': 4, 'num_mix_components_yyx': 4, 'context_extractor_yyx': 'gru', 'activation_func_yyx': 'GELU', 'L2_weight_yyx': 1.583647772915343e-08, 'L_entropy_weight_yyx': 2.9693426499596523e-05, 'L_sep_weight_yyx': 2.236117514075448e-09, 'L_scale_weight_yyx': 1.6162391379022784e-06, 'learning_rate_yyx': 0.008397200291173334}. Best is trial 6 with value: -2.5462433457735516.
[I 2026-03-18 19:09:15,880] Trial 4 pruned. 
[I 2026-03-18 19:09:18,829] Trial 5 pruned. 
[I 2026-03-18 19:09:25,355] Trial 8 finished with value: -0.753705045849393 and parameters: {'n_layers_yyx': 2, 'hidden_size_yyx_l0': 5, 'hidden_size_yyx_l1': 2, 'context_size_yyx': 2, 'num_mix_components_yyx': 5, 'context_extractor_yyx': 'gru', 'activation_func_yyx': 'GELU', 'L2_weight_yyx': 8.807499793422085e-05, 'L_entropy_weight_yyx': 4.6152532447193367e-08, 'L_sep_weight_yyx': 4.6086652412254814e-05, 'L_scale_weight_yyx': 6.708612831156721e-08, 'learning_rate_yyx': 0.0006647436415836265}. Best is trial 0 with value: -0.8180432904242061.
[I 2026-03-18 19:09:39,843] Trial 6 finished with value: -2.731388913629886 and parameters: {'n_layers_yyx': 2, 'hidden_size_yyx_l0': 2, 'hidden_size_yyx_l1': 6, 'context_size_yyx': 4, 'num_mix_components_yyx': 2, 'context_extractor_yyx': 'gru', 'activation_func_yyx': 'GELU', 'L2_weight_yyx': 6.576180004462429e-10, 'L_entropy_weight_yyx': 2.3548031137952964e-08, 'L_sep_weight_yyx': 0.0007562438778060286, 'L_scale_weight_yyx': 3.7238351953729924e-08, 'learning_rate_yyx': 0.0063419354348233726}. Best is trial 1 with value: -2.762434471701954.
[I 2026-03-18 19:09:47,319] Trial 11 finished with value: -2.764072311109084 and parameters: {'n_layers_yyx': 1, 'hidden_size_yyx_l0': 3, 'context_size_yyx': 4, 'num_mix_components_yyx': 5, 'context_extractor_yyx': 'gru', 'activation_func_yyx': 'GELU', 'L2_weight_yyx': 3.144913226066955e-05, 'L_entropy_weight_yyx': 5.163352174845881e-10, 'L_sep_weight_yyx': 0.0008919093145877779, 'L_scale_weight_yyx': 1.9617972106349059e-10, 'learning_rate_yyx': 0.008724932341479695}. Best is trial 3 with value: -2.766124988596948.
[I 2026-03-18 19:09:49,369] Trial 9 finished with value: -2.7324928442637124 and parameters: {'n_layers_yyx': 1, 'hidden_size_yyx_l0': 2, 'context_size_yyx': 4, 'num_mix_components_yyx': 1, 'context_extractor_yyx': 'lstm', 'activation_func_yyx': 'ReLU', 'L2_weight_yyx': 0.00037729940468441846, 'L_entropy_weight_yyx': 7.987715229841715e-06, 'L_sep_weight_yyx': 8.704947823780111e-08, 'L_scale_weight_yyx': 7.014126230147149e-06, 'learning_rate_yyx': 0.008746639202004663}. Best is trial 3 with value: -2.7657987594604494.
[I 2026-03-18 19:10:06,240] Trial 15 pruned. 
[I 2026-03-18 19:10:18,145] Trial 11 pruned. 
[I 2026-03-18 19:10:18,168] Trial 10 pruned. 
[I 2026-03-18 19:10:22,384] Trial 9 pruned. 
[I 2026-03-18 19:10:26,810] Trial 4 finished with value: -2.3984721602003543 and parameters: {'n_layers_yyx': 2, 'hidden_size_yyx_l0': 6, 'hidden_size_yyx_l1': 5, 'context_size_yyx': 3, 'num_mix_components_yyx': 3, 'context_extractor_yyx': 'lstm', 'activation_func_yyx': 'GELU', 'L2_weight_yyx': 2.2821504190339757e-10, 'L_entropy_weight_yyx': 3.842600511840071e-06, 'L_sep_weight_yyx': 9.575324354758716e-05, 'L_scale_weight_yyx': 1.2166592616674098e-05, 'learning_rate_yyx': 0.0028624284319260125}. Best is trial 2 with value: -2.39978509736055.
[I 2026-03-18 19:11:10,592] Trial 10 pruned. 
[I 2026-03-18 19:11:15,899] Trial 7 pruned. 
[I 2026-03-18 19:11:18,212] Trial 16 pruned. 
[I 2026-03-18 19:11:21,385] Trial 12 pruned. 
[I 2026-03-18 19:11:44,477] Trial 9 finished with value: -0.8005357345062661 and parameters: {'n_layers_yyx': 1, 'hidden_size_yyx_l0': 2, 'context_size_yyx': 4, 'num_mix_components_yyx': 3, 'context_extractor_yyx': 'lstm', 'activation_func_yyx': 'ReLU', 'L2_weight_yyx': 2.646788989656928e-10, 'L_entropy_weight_yyx': 3.2651642226512116e-09, 'L_sep_weight_yyx': 4.933742804041892e-07, 'L_scale_weight_yyx': 2.4293032049393e-07, 'learning_rate_yyx': 0.003501553851907895}. Best is trial 4 with value: -0.8236861799457048.
[I 2026-03-18 19:11:59,225] Trial 16 pruned. 
[I 2026-03-18 19:12:06,894] Trial 10 pruned. 
[I 2026-03-18 19:12:18,980] Trial 8 pruned. 
[I 2026-03-18 19:12:38,451] Trial 11 finished with value: -2.4030680672323603 and parameters: {'n_layers_yyx': 2, 'hidden_size_yyx_l0': 6, 'hidden_size_yyx_l1': 6, 'context_size_yyx': 1, 'num_mix_components_yyx': 3, 'context_extractor_yyx': 'lstm', 'activation_func_yyx': 'Tanh', 'L2_weight_yyx': 1.351145978002885e-06, 'L_entropy_weight_yyx': 7.110028295100903e-06, 'L_sep_weight_yyx': 0.0009734455156105208, 'L_scale_weight_yyx': 5.101464020512449e-09, 'learning_rate_yyx': 0.009485596955639075}. Best is trial 11 with value: -2.4030680672323603.
[I 2026-03-18 19:12:51,973] Trial 8 finished with value: -2.7574404602647995 and parameters: {'n_layers_yyx': 1, 'hidden_size_yyx_l0': 5, 'context_size_yyx': 2, 'num_mix_components_yyx': 5, 'context_extractor_yyx': 'lstm', 'activation_func_yyx': 'ReLU', 'L2_weight_yyx': 2.1118146442456533e-05, 'L_entropy_weight_yyx': 9.706693996898999e-06, 'L_sep_weight_yyx': 1.054505368763103e-06, 'L_scale_weight_yyx': 2.15839658509186e-06, 'learning_rate_yyx': 0.005869169503443147}. Best is trial 2 with value: -2.762987867182404.
[I 2026-03-18 19:12:53,819] Trial 7 finished with value: -2.763916974920187 and parameters: {'n_layers_yyx': 2, 'hidden_size_yyx_l0': 5, 'hidden_size_yyx_l1': 6, 'context_size_yyx': 1, 'num_mix_components_yyx': 2, 'context_extractor_yyx': 'gru', 'activation_func_yyx': 'Tanh', 'L2_weight_yyx': 4.314566849545307e-08, 'L_entropy_weight_yyx': 3.2153484940024505e-07, 'L_sep_weight_yyx': 0.0005808744940140607, 'L_scale_weight_yyx': 1.0815385069611269e-05, 'learning_rate_yyx': 0.00450334899464166}. Best is trial 1 with value: -2.76558573285036.
[I 2026-03-18 19:13:12,769] Trial 11 finished with value: -2.79739590967713 and parameters: {'n_layers_yyx': 1, 'hidden_size_yyx_l0': 2, 'context_size_yyx': 4, 'num_mix_components_yyx': 5, 'context_extractor_yyx': 'lstm', 'activation_func_yyx': 'Tanh', 'L2_weight_yyx': 1.0462442428684002e-10, 'L_entropy_weight_yyx': 9.661628228361591e-06, 'L_sep_weight_yyx': 1.0259294856377607e-10, 'L_scale_weight_yyx': 5.482818466270793e-08, 'learning_rate_yyx': 0.003153653398253155}. Best is trial 0 with value: -2.8001684201127572.
[I 2026-03-18 19:13:12,956] Trial 8 finished with value: -2.3870067865213858 and parameters: {'n_layers_yyx': 2, 'hidden_size_yyx_l0': 6, 'hidden_size_yyx_l1': 4, 'context_size_yyx': 2, 'num_mix_components_yyx': 4, 'context_extractor_yyx': 'lstm', 'activation_func_yyx': 'ReLU', 'L2_weight_yyx': 3.379433601264256e-06, 'L_entropy_weight_yyx': 6.786531130436867e-09, 'L_sep_weight_yyx': 1.2137550439533686e-05, 'L_scale_weight_yyx': 2.4903002701531625e-10, 'learning_rate_yyx': 0.0019158325620225718}. Best is trial 4 with value: -2.393031095621557.
[I 2026-03-18 19:13:19,864] Trial 9 pruned. 
[I 2026-03-18 19:13:42,867] Trial 13 pruned. 
[I 2026-03-18 19:13:56,086] Trial 7 finished with value: -0.830295985347235 and parameters: {'n_layers_yyx': 1, 'hidden_size_yyx_l0': 4, 'context_size_yyx': 1, 'num_mix_components_yyx': 4, 'context_extractor_yyx': 'lstm', 'activation_func_yyx': 'ReLU', 'L2_weight_yyx': 5.850730922595608e-06, 'L_entropy_weight_yyx': 1.063515791295072e-06, 'L_sep_weight_yyx': 5.59675892335131e-09, 'L_scale_weight_yyx': 0.0001565000286735568, 'learning_rate_yyx': 0.0022520822902473148}. Best is trial 7 with value: -0.830295985347235.
[I 2026-03-18 19:14:01,808] Trial 7 finished with value: -2.7580646598426095 and parameters: {'n_layers_yyx': 2, 'hidden_size_yyx_l0': 4, 'hidden_size_yyx_l1': 2, 'context_size_yyx': 1, 'num_mix_components_yyx': 4, 'context_extractor_yyx': 'gru', 'activation_func_yyx': 'ReLU', 'L2_weight_yyx': 7.714008463098421e-07, 'L_entropy_weight_yyx': 2.6056569724916858e-09, 'L_sep_weight_yyx': 1.2387194179634857e-07, 'L_scale_weight_yyx': 0.0001663472487211342, 'learning_rate_yyx': 0.0007840148111839497}. Best is trial 0 with value: -2.76381727105261.
[I 2026-03-18 19:14:10,533] Trial 7 finished with value: -2.766072426816335 and parameters: {'n_layers_yyx': 1, 'hidden_size_yyx_l0': 6, 'context_size_yyx': 4, 'num_mix_components_yyx': 4, 'context_extractor_yyx': 'gru', 'activation_func_yyx': 'GELU', 'L2_weight_yyx': 8.70927083617859e-09, 'L_entropy_weight_yyx': 1.610977963938306e-08, 'L_sep_weight_yyx': 1.3164102038346812e-06, 'L_scale_weight_yyx': 2.1603434333985257e-10, 'learning_rate_yyx': 0.008949086513848455}. Best is trial 7 with value: -2.766072426816335.
[I 2026-03-18 19:14:11,700] Trial 17 pruned. 
[I 2026-03-18 19:14:20,454] Trial 12 pruned. 
[I 2026-03-18 19:14:24,714] Trial 11 pruned. 
[I 2026-03-18 19:14:50,632] Trial 8 pruned. 
[I 2026-03-18 19:15:06,148] Trial 8 pruned. 
[I 2026-03-18 19:15:16,963] Trial 18 pruned. 
[I 2026-03-18 19:15:24,216] Trial 13 pruned. 
[I 2026-03-18 19:15:33,256] Trial 5 pruned. 
[I 2026-03-18 19:15:37,621] Trial 17 finished with value: -2.3950007885403974 and parameters: {'n_layers_yyx': 1, 'hidden_size_yyx_l0': 5, 'context_size_yyx': 4, 'num_mix_components_yyx': 4, 'context_extractor_yyx': 'gru', 'activation_func_yyx': 'Tanh', 'L2_weight_yyx': 1.6421899339937392e-06, 'L_entropy_weight_yyx': 1.2132129472012766e-06, 'L_sep_weight_yyx': 7.74749131607308e-06, 'L_scale_weight_yyx': 1.625646611906586e-07, 'learning_rate_yyx': 0.001339081116234844}. Best is trial 0 with value: -2.4076941594397367.
[I 2026-03-18 19:15:49,317] Trial 12 pruned. 
[I 2026-03-18 19:16:46,970] Trial 18 pruned. 
[I 2026-03-18 19:16:47,808] Trial 6 finished with value: -2.3967751596019986 and parameters: {'n_layers_yyx': 2, 'hidden_size_yyx_l0': 6, 'hidden_size_yyx_l1': 3, 'context_size_yyx': 3, 'num_mix_components_yyx': 1, 'context_extractor_yyx': 'gru', 'activation_func_yyx': 'Tanh', 'L2_weight_yyx': 0.00019002849373234227, 'L_entropy_weight_yyx': 1.8161636554126752e-10, 'L_sep_weight_yyx': 1.0826040346782564e-08, 'L_scale_weight_yyx': 0.0001022350085524723, 'learning_rate_yyx': 0.001044634786913843}. Best is trial 0 with value: -2.431222564426635.
[I 2026-03-18 19:16:48,796] Trial 6 pruned. 
[I 2026-03-18 19:17:51,548] Trial 19 pruned. 
[I 2026-03-18 19:17:53,550] Trial 9 pruned. 
[I 2026-03-18 19:17:57,375] Trial 7 pruned. 
[I 2026-03-18 19:18:08,509] Trial 7 pruned. 
[I 2026-03-18 19:18:18,386] Trial 9 finished with value: -2.4237415519893895 and parameters: {'n_layers_yyx': 1, 'hidden_size_yyx_l0': 4, 'context_size_yyx': 4, 'num_mix_components_yyx': 4, 'context_extractor_yyx': 'lstm', 'activation_func_yyx': 'Tanh', 'L2_weight_yyx': 0.00024500866145771093, 'L_entropy_weight_yyx': 6.857925715467982e-09, 'L_sep_weight_yyx': 2.864497112227697e-09, 'L_scale_weight_yyx': 0.0002261054060176785, 'learning_rate_yyx': 0.005993117837957842}. Best is trial 9 with value: -2.4237415519893895.
[I 2026-03-18 19:18:32,729] Trial 10 finished with value: -0.7997886398518279 and parameters: {'n_layers_yyx': 1, 'hidden_size_yyx_l0': 6, 'context_size_yyx': 3, 'num_mix_components_yyx': 5, 'context_extractor_yyx': 'gru', 'activation_func_yyx': 'GELU', 'L2_weight_yyx': 9.749671863817192e-07, 'L_entropy_weight_yyx': 0.00037255160255293305, 'L_sep_weight_yyx': 0.00046028421632007024, 'L_scale_weight_yyx': 1.306808494958064e-10, 'learning_rate_yyx': 0.007508550085394269}. Best is trial 4 with value: -0.8236861799457048.
[I 2026-03-18 19:18:39,305] Trial 13 pruned. 
[I 2026-03-18 19:18:44,263] Trial 5 finished with value: -2.4067040109302495 and parameters: {'n_layers_yyx': 2, 'hidden_size_yyx_l0': 3, 'hidden_size_yyx_l1': 4, 'context_size_yyx': 3, 'num_mix_components_yyx': 4, 'context_extractor_yyx': 'lstm', 'activation_func_yyx': 'ReLU', 'L2_weight_yyx': 7.877379561511606e-07, 'L_entropy_weight_yyx': 1.856535542004233e-10, 'L_sep_weight_yyx': 1.918703451790304e-05, 'L_scale_weight_yyx': 2.684250042154165e-07, 'learning_rate_yyx': 0.003405037129893274}. Best is trial 2 with value: -2.4109094575005234.
[I 2026-03-18 19:19:29,173] Trial 20 pruned. 
