[I 2026-03-18 16:44:31,597] Trial 1 finished with value: -0.41937586545206074 and parameters: {'n_layers_yyx': 2, 'hidden_size_yyx_l0': 5, 'hidden_size_yyx_l1': 6, 'context_size_yyx': 4, 'num_mix_components_yyx': 5, 'context_extractor_yyx': 'lstm', 'activation_func_yyx': 'Tanh', 'L2_weight_yyx': 2.3673027373458255e-05, 'L_entropy_weight_yyx': 9.623203162444248e-09, 'L_sep_weight_yyx': 8.675618127237806e-07, 'L_scale_weight_yyx': 3.6477169502560666e-07, 'learning_rate_yyx': 0.0019148623600227627}. Best is trial 1 with value: -0.41937586545206074.
[I 2026-03-18 16:44:33,035] Trial 0 finished with value: -2.973312761552399 and parameters: {'n_layers_yyx': 1, 'hidden_size_yyx_l0': 4, 'context_size_yyx': 3, 'num_mix_components_yyx': 2, 'context_extractor_yyx': 'gru', 'activation_func_yyx': 'Tanh', 'L2_weight_yyx': 9.786175660955574e-10, 'L_entropy_weight_yyx': 2.8206839456031154e-07, 'L_sep_weight_yyx': 1.2543473139605498e-06, 'L_scale_weight_yyx': 9.720874118439613e-07, 'learning_rate_yyx': 0.00875638823304299}. Best is trial 0 with value: -2.973312761552399.
[I 2026-03-18 16:44:33,194] Trial 5 finished with value: -0.564910888671875 and parameters: {'n_layers_yyx': 2, 'hidden_size_yyx_l0': 2, 'hidden_size_yyx_l1': 3, 'context_size_yyx': 1, 'num_mix_components_yyx': 2, 'context_extractor_yyx': 'lstm', 'activation_func_yyx': 'GELU', 'L2_weight_yyx': 7.861198948300181e-06, 'L_entropy_weight_yyx': 4.36382385845678e-08, 'L_sep_weight_yyx': 0.00020956730847422885, 'L_scale_weight_yyx': 6.51191896596034e-10, 'learning_rate_yyx': 0.001972628541291004}. Best is trial 0 with value: -0.5744275876219695.
[I 2026-03-18 16:44:45,513] Trial 1 finished with value: -0.5777964847779832 and parameters: {'n_layers_yyx': 1, 'hidden_size_yyx_l0': 6, 'context_size_yyx': 1, 'num_mix_components_yyx': 4, 'context_extractor_yyx': 'gru', 'activation_func_yyx': 'ReLU', 'L2_weight_yyx': 1.9341014455335463e-09, 'L_entropy_weight_yyx': 7.019407598306078e-09, 'L_sep_weight_yyx': 5.905971403766935e-08, 'L_scale_weight_yyx': 2.237368645117869e-10, 'learning_rate_yyx': 0.0008346243873308095}. Best is trial 1 with value: -0.5777964847779832.
[I 2026-03-18 16:44:47,843] Trial 2 pruned. 
[I 2026-03-18 16:44:50,849] Trial 1 pruned. 
[I 2026-03-18 16:44:55,082] Trial 2 finished with value: -0.5623486924204243 and parameters: {'n_layers_yyx': 1, 'hidden_size_yyx_l0': 2, 'context_size_yyx': 1, 'num_mix_components_yyx': 4, 'context_extractor_yyx': 'gru', 'activation_func_yyx': 'ReLU', 'L2_weight_yyx': 1.6454787811530586e-05, 'L_entropy_weight_yyx': 0.0008135382542838474, 'L_sep_weight_yyx': 1.641804918820031e-09, 'L_scale_weight_yyx': 1.0904747469905066e-05, 'learning_rate_yyx': 0.0025753747873030965}. Best is trial 0 with value: -0.5716951519783786.
[I 2026-03-18 16:44:59,118] Trial 9 pruned. 
[I 2026-03-18 16:45:00,453] Trial 3 finished with value: -0.5693094497533743 and parameters: {'n_layers_yyx': 2, 'hidden_size_yyx_l0': 5, 'hidden_size_yyx_l1': 3, 'context_size_yyx': 2, 'num_mix_components_yyx': 4, 'context_extractor_yyx': 'gru', 'activation_func_yyx': 'Tanh', 'L2_weight_yyx': 9.103236287823716e-08, 'L_entropy_weight_yyx': 6.747514953513758e-07, 'L_sep_weight_yyx': 1.442742143836542e-06, 'L_scale_weight_yyx': 2.879681722828644e-07, 'learning_rate_yyx': 0.002392988557033178}. Best is trial 3 with value: -0.5693094497533743.
[I 2026-03-18 16:45:03,025] Trial 0 finished with value: -2.735118687062689 and parameters: {'n_layers_yyx': 1, 'hidden_size_yyx_l0': 6, 'context_size_yyx': 1, 'num_mix_components_yyx': 1, 'context_extractor_yyx': 'gru', 'activation_func_yyx': 'Tanh', 'L2_weight_yyx': 1.3245665139839873e-09, 'L_entropy_weight_yyx': 4.142364672454753e-10, 'L_sep_weight_yyx': 2.6948229964344608e-05, 'L_scale_weight_yyx': 0.0002800032091200598, 'learning_rate_yyx': 0.0005348289508372904}. Best is trial 0 with value: -2.735118687062689.
[I 2026-03-18 16:45:03,891] Trial 3 pruned. 
[I 2026-03-18 16:45:04,547] Trial 0 finished with value: -2.9075013218319845 and parameters: {'n_layers_yyx': 1, 'hidden_size_yyx_l0': 6, 'context_size_yyx': 1, 'num_mix_components_yyx': 2, 'context_extractor_yyx': 'lstm', 'activation_func_yyx': 'GELU', 'L2_weight_yyx': 1.3656381746503164e-08, 'L_entropy_weight_yyx': 1.967715855720982e-10, 'L_sep_weight_yyx': 3.1289133453044794e-06, 'L_scale_weight_yyx': 2.227814400375689e-07, 'learning_rate_yyx': 0.001363067718579763}. Best is trial 0 with value: -2.9075013218319845.
[I 2026-03-18 16:45:07,170] Trial 0 finished with value: -2.8617084635909134 and parameters: {'n_layers_yyx': 2, 'hidden_size_yyx_l0': 2, 'hidden_size_yyx_l1': 5, 'context_size_yyx': 4, 'num_mix_components_yyx': 1, 'context_extractor_yyx': 'lstm', 'activation_func_yyx': 'ReLU', 'L2_weight_yyx': 2.687898618181995e-09, 'L_entropy_weight_yyx': 3.793127313451231e-05, 'L_sep_weight_yyx': 0.0003304270382722533, 'L_scale_weight_yyx': 0.0005149248574644151, 'learning_rate_yyx': 0.0025746421369665005}. Best is trial 0 with value: -2.8617084635909134.
[I 2026-03-18 16:45:09,446] Trial 0 finished with value: -2.8716595948373675 and parameters: {'n_layers_yyx': 2, 'hidden_size_yyx_l0': 4, 'hidden_size_yyx_l1': 4, 'context_size_yyx': 4, 'num_mix_components_yyx': 1, 'context_extractor_yyx': 'gru', 'activation_func_yyx': 'Tanh', 'L2_weight_yyx': 1.6656826063918554e-05, 'L_entropy_weight_yyx': 6.450758282787081e-06, 'L_sep_weight_yyx': 2.594709449587019e-10, 'L_scale_weight_yyx': 1.7221721646196677e-10, 'learning_rate_yyx': 0.0013900572489542018}. Best is trial 0 with value: -2.8716595948373675.
[I 2026-03-18 16:45:09,990] Trial 2 pruned. 
[I 2026-03-18 16:45:10,504] Trial 0 finished with value: -2.8855004555480015 and parameters: {'n_layers_yyx': 2, 'hidden_size_yyx_l0': 3, 'hidden_size_yyx_l1': 3, 'context_size_yyx': 2, 'num_mix_components_yyx': 5, 'context_extractor_yyx': 'lstm', 'activation_func_yyx': 'Tanh', 'L2_weight_yyx': 1.6242327447511907e-09, 'L_entropy_weight_yyx': 1.1820763799816926e-08, 'L_sep_weight_yyx': 1.7196752238968422e-10, 'L_scale_weight_yyx': 2.5201189040291563e-05, 'learning_rate_yyx': 0.0005060835024550811}. Best is trial 0 with value: -2.8855004555480015.
[I 2026-03-18 16:45:16,572] Trial 0 finished with value: -2.8093452742459615 and parameters: {'n_layers_yyx': 1, 'hidden_size_yyx_l0': 2, 'context_size_yyx': 4, 'num_mix_components_yyx': 1, 'context_extractor_yyx': 'gru', 'activation_func_yyx': 'GELU', 'L2_weight_yyx': 9.336097822031672e-07, 'L_entropy_weight_yyx': 1.7843053450486785e-05, 'L_sep_weight_yyx': 4.322099479299773e-06, 'L_scale_weight_yyx': 1.6583267041720607e-08, 'learning_rate_yyx': 0.000610304137246925}. Best is trial 0 with value: -2.8093452742459615.
[I 2026-03-18 16:45:17,114] Trial 4 pruned. 
[I 2026-03-18 16:45:19,247] Trial 0 finished with value: -2.838884401754462 and parameters: {'n_layers_yyx': 2, 'hidden_size_yyx_l0': 6, 'hidden_size_yyx_l1': 2, 'context_size_yyx': 3, 'num_mix_components_yyx': 1, 'context_extractor_yyx': 'gru', 'activation_func_yyx': 'Tanh', 'L2_weight_yyx': 4.611739582816005e-08, 'L_entropy_weight_yyx': 1.4714987157039715e-09, 'L_sep_weight_yyx': 4.0434646693060906e-06, 'L_scale_weight_yyx': 4.633843709559469e-05, 'learning_rate_yyx': 0.005092470961658618}. Best is trial 0 with value: -2.838884401754462.
[I 2026-03-18 16:45:20,517] Trial 4 pruned. 
[I 2026-03-18 16:45:20,772] Trial 1 finished with value: -0.545853920455156 and parameters: {'n_layers_yyx': 2, 'hidden_size_yyx_l0': 5, 'hidden_size_yyx_l1': 4, 'context_size_yyx': 2, 'num_mix_components_yyx': 1, 'context_extractor_yyx': 'gru', 'activation_func_yyx': 'GELU', 'L2_weight_yyx': 5.680170281738923e-07, 'L_entropy_weight_yyx': 1.2825845854345475e-07, 'L_sep_weight_yyx': 2.362571626726871e-09, 'L_scale_weight_yyx': 0.0001715165996335633, 'learning_rate_yyx': 0.0020094452537398628}. Best is trial 0 with value: -0.5683635517524394.
[I 2026-03-18 16:45:29,537] Trial 1 pruned. 
[I 2026-03-18 16:45:29,669] Trial 10 pruned. 
[I 2026-03-18 16:45:33,465] Trial 5 pruned. 
[I 2026-03-18 16:45:36,728] Trial 5 pruned. 
[I 2026-03-18 16:45:37,672] Trial 4 finished with value: -0.5517787382396084 and parameters: {'n_layers_yyx': 1, 'hidden_size_yyx_l0': 5, 'context_size_yyx': 4, 'num_mix_components_yyx': 1, 'context_extractor_yyx': 'lstm', 'activation_func_yyx': 'GELU', 'L2_weight_yyx': 1.457282030856155e-09, 'L_entropy_weight_yyx': 2.9440090818272396e-09, 'L_sep_weight_yyx': 1.9185331125733034e-07, 'L_scale_weight_yyx': 1.7469468435539067e-08, 'learning_rate_yyx': 0.005633797947622516}. Best is trial 0 with value: -0.5765754458336916.
[I 2026-03-18 16:46:01,335] Trial 3 pruned. 
[I 2026-03-18 16:46:05,114] Trial 6 pruned. 
[I 2026-03-18 16:46:24,601] Trial 1 finished with value: -0.5493257672127536 and parameters: {'n_layers_yyx': 1, 'hidden_size_yyx_l0': 2, 'context_size_yyx': 4, 'num_mix_components_yyx': 1, 'context_extractor_yyx': 'gru', 'activation_func_yyx': 'Tanh', 'L2_weight_yyx': 9.165854733715224e-05, 'L_entropy_weight_yyx': 5.98076113799964e-08, 'L_sep_weight_yyx': 1.4378776418170868e-10, 'L_scale_weight_yyx': 4.2942021823065953e-10, 'learning_rate_yyx': 0.00502628419862065}. Best is trial 1 with value: -0.5493257672127536.
[I 2026-03-18 16:46:29,499] Trial 1 finished with value: -2.8038587392248173 and parameters: {'n_layers_yyx': 2, 'hidden_size_yyx_l0': 2, 'hidden_size_yyx_l1': 4, 'context_size_yyx': 2, 'num_mix_components_yyx': 1, 'context_extractor_yyx': 'gru', 'activation_func_yyx': 'GELU', 'L2_weight_yyx': 1.309513052946482e-09, 'L_entropy_weight_yyx': 1.3884457955941975e-06, 'L_sep_weight_yyx': 0.0005921767132377855, 'L_scale_weight_yyx': 0.00023757321354626778, 'learning_rate_yyx': 0.005209043033035188}. Best is trial 0 with value: -2.8971408338061018.
[I 2026-03-18 16:46:39,629] Trial 2 pruned. 
[I 2026-03-18 16:46:41,469] Trial 11 pruned. 
[I 2026-03-18 16:46:49,707] Trial 2 finished with value: -0.6113786030767988 and parameters: {'n_layers_yyx': 1, 'hidden_size_yyx_l0': 5, 'context_size_yyx': 3, 'num_mix_components_yyx': 4, 'context_extractor_yyx': 'gru', 'activation_func_yyx': 'ReLU', 'L2_weight_yyx': 0.00042030140321541666, 'L_entropy_weight_yyx': 7.703808072992863e-10, 'L_sep_weight_yyx': 3.292475363054188e-09, 'L_scale_weight_yyx': 2.0808077587512106e-10, 'learning_rate_yyx': 0.0025394418604195693}. Best is trial 2 with value: -0.6113786030767988.
[I 2026-03-18 16:46:49,910] Trial 2 pruned. 
[I 2026-03-18 16:46:53,463] Trial 7 finished with value: -0.5557623316202072 and parameters: {'n_layers_yyx': 2, 'hidden_size_yyx_l0': 6, 'hidden_size_yyx_l1': 5, 'context_size_yyx': 1, 'num_mix_components_yyx': 5, 'context_extractor_yyx': 'lstm', 'activation_func_yyx': 'ReLU', 'L2_weight_yyx': 7.037379636181291e-08, 'L_entropy_weight_yyx': 0.00035648719422271924, 'L_sep_weight_yyx': 1.3329379953683263e-05, 'L_scale_weight_yyx': 1.455376120500542e-10, 'learning_rate_yyx': 0.007670067449250727}. Best is trial 0 with value: -0.5660314966592697.
[I 2026-03-18 16:46:55,874] Trial 3 pruned. 
[I 2026-03-18 16:46:57,630] Trial 12 pruned. 
[I 2026-03-18 16:47:10,231] Trial 3 pruned. 
[I 2026-03-18 16:47:11,434] Trial 4 pruned. 
[I 2026-03-18 16:47:12,898] Trial 13 pruned. 
[I 2026-03-18 16:47:14,122] Trial 2 finished with value: -2.363855097429715 and parameters: {'n_layers_yyx': 1, 'hidden_size_yyx_l0': 4, 'context_size_yyx': 1, 'num_mix_components_yyx': 2, 'context_extractor_yyx': 'lstm', 'activation_func_yyx': 'ReLU', 'L2_weight_yyx': 2.391267189297489e-08, 'L_entropy_weight_yyx': 7.397804045459029e-10, 'L_sep_weight_yyx': 1.2139491814233109e-05, 'L_scale_weight_yyx': 2.1323562569885854e-07, 'learning_rate_yyx': 0.003315233343302003}. Best is trial 2 with value: -2.363855097429715.
[I 2026-03-18 16:47:18,871] Trial 3 pruned. 
[I 2026-03-18 16:47:20,018] Trial 7 finished with value: -0.427185200316249 and parameters: {'n_layers_yyx': 2, 'hidden_size_yyx_l0': 4, 'hidden_size_yyx_l1': 5, 'context_size_yyx': 3, 'num_mix_components_yyx': 5, 'context_extractor_yyx': 'gru', 'activation_func_yyx': 'Tanh', 'L2_weight_yyx': 2.9186759869580786e-10, 'L_entropy_weight_yyx': 3.6764637042534755e-07, 'L_sep_weight_yyx': 1.1799495368645607e-08, 'L_scale_weight_yyx': 5.898996529645679e-07, 'learning_rate_yyx': 0.009578916158173901}. Best is trial 7 with value: -0.427185200316249.
[I 2026-03-18 16:47:20,423] Trial 1 finished with value: -0.54679270328485 and parameters: {'n_layers_yyx': 1, 'hidden_size_yyx_l0': 4, 'context_size_yyx': 2, 'num_mix_components_yyx': 1, 'context_extractor_yyx': 'gru', 'activation_func_yyx': 'Tanh', 'L2_weight_yyx': 6.491893360501327e-07, 'L_entropy_weight_yyx': 1.5736643580326035e-05, 'L_sep_weight_yyx': 1.895360572464645e-10, 'L_scale_weight_yyx': 3.6321154277793445e-07, 'learning_rate_yyx': 0.0005899140713976108}. Best is trial 1 with value: -0.54679270328485.
[I 2026-03-18 16:47:23,405] Trial 8 pruned. 
[I 2026-03-18 16:47:27,223] Trial 5 pruned. 
[I 2026-03-18 16:47:27,768] Trial 4 pruned. 
[I 2026-03-18 16:47:37,113] Trial 2 pruned. 
[I 2026-03-18 16:47:40,868] Trial 9 pruned. 
[I 2026-03-18 16:47:43,549] Trial 6 pruned. 
[I 2026-03-18 16:47:45,514] Trial 1 finished with value: -2.916914962483847 and parameters: {'n_layers_yyx': 2, 'hidden_size_yyx_l0': 2, 'hidden_size_yyx_l1': 6, 'context_size_yyx': 3, 'num_mix_components_yyx': 2, 'context_extractor_yyx': 'gru', 'activation_func_yyx': 'ReLU', 'L2_weight_yyx': 3.3920826865084995e-06, 'L_entropy_weight_yyx': 9.758938616541517e-08, 'L_sep_weight_yyx': 9.064251542463894e-09, 'L_scale_weight_yyx': 0.00014303204556578253, 'learning_rate_yyx': 0.005783776915960425}. Best is trial 0 with value: -2.957957273051406.
[I 2026-03-18 16:47:47,219] Trial 5 pruned. 
[I 2026-03-18 16:47:47,695] Trial 2 finished with value: -0.5621351953057836 and parameters: {'n_layers_yyx': 2, 'hidden_size_yyx_l0': 2, 'hidden_size_yyx_l1': 2, 'context_size_yyx': 4, 'num_mix_components_yyx': 5, 'context_extractor_yyx': 'lstm', 'activation_func_yyx': 'Tanh', 'L2_weight_yyx': 5.224380592072501e-10, 'L_entropy_weight_yyx': 1.5760424479547685e-10, 'L_sep_weight_yyx': 3.6564676398236715e-08, 'L_scale_weight_yyx': 1.105622082739733e-07, 'learning_rate_yyx': 0.0014783196610553596}. Best is trial 1 with value: -0.5818196838462861.
[I 2026-03-18 16:47:48,947] Trial 8 pruned. 
[I 2026-03-18 16:47:49,605] Trial 4 pruned. 
[I 2026-03-18 16:47:55,637] Trial 6 finished with value: -0.5596096033571183 and parameters: {'n_layers_yyx': 1, 'hidden_size_yyx_l0': 5, 'context_size_yyx': 3, 'num_mix_components_yyx': 2, 'context_extractor_yyx': 'gru', 'activation_func_yyx': 'Tanh', 'L2_weight_yyx': 6.209985258284808e-06, 'L_entropy_weight_yyx': 7.351513499912152e-06, 'L_sep_weight_yyx': 6.043805403497189e-05, 'L_scale_weight_yyx': 1.282091503985535e-06, 'learning_rate_yyx': 0.00201799480443422}. Best is trial 0 with value: -0.5744275876219695.
[I 2026-03-18 16:48:00,019] Trial 7 pruned. 
[I 2026-03-18 16:48:03,769] Trial 2 finished with value: -0.562058061812242 and parameters: {'n_layers_yyx': 2, 'hidden_size_yyx_l0': 6, 'hidden_size_yyx_l1': 2, 'context_size_yyx': 3, 'num_mix_components_yyx': 2, 'context_extractor_yyx': 'lstm', 'activation_func_yyx': 'GELU', 'L2_weight_yyx': 1.9781344605758716e-05, 'L_entropy_weight_yyx': 1.283181177028342e-05, 'L_sep_weight_yyx': 1.638660522781733e-08, 'L_scale_weight_yyx': 3.617509128616097e-09, 'learning_rate_yyx': 0.007950186037122777}. Best is trial 0 with value: -0.5683635517524394.
[I 2026-03-18 16:48:06,027] Trial 9 pruned. 
[I 2026-03-18 16:48:06,809] Trial 5 pruned. 
[I 2026-03-18 16:48:12,105] Trial 10 pruned. 
[I 2026-03-18 16:48:17,579] Trial 3 finished with value: -0.572887373429709 and parameters: {'n_layers_yyx': 1, 'hidden_size_yyx_l0': 5, 'context_size_yyx': 1, 'num_mix_components_yyx': 5, 'context_extractor_yyx': 'lstm', 'activation_func_yyx': 'ReLU', 'L2_weight_yyx': 0.000285172453871288, 'L_entropy_weight_yyx': 0.0005762204161241341, 'L_sep_weight_yyx': 6.483124561853417e-05, 'L_scale_weight_yyx': 1.1771363029383163e-09, 'learning_rate_yyx': 0.001913031735977317}. Best is trial 3 with value: -0.572887373429709.
[I 2026-03-18 16:48:18,086] Trial 3 pruned. 
[I 2026-03-18 16:48:18,602] Trial 1 finished with value: -2.357441542909654 and parameters: {'n_layers_yyx': 2, 'hidden_size_yyx_l0': 6, 'hidden_size_yyx_l1': 2, 'context_size_yyx': 1, 'num_mix_components_yyx': 1, 'context_extractor_yyx': 'gru', 'activation_func_yyx': 'Tanh', 'L2_weight_yyx': 0.00035214916372198633, 'L_entropy_weight_yyx': 1.911420392493783e-07, 'L_sep_weight_yyx': 2.8139856421405925e-10, 'L_scale_weight_yyx': 0.00032706676618768875, 'learning_rate_yyx': 0.0020868541485963145}. Best is trial 0 with value: -2.9352535799904658.
[I 2026-03-18 16:48:28,163] Trial 11 pruned. 
[I 2026-03-18 16:48:33,867] Trial 4 pruned. 
[I 2026-03-18 16:48:34,771] Trial 10 pruned. 
[I 2026-03-18 16:48:35,018] Trial 6 finished with value: -0.5805135147115715 and parameters: {'n_layers_yyx': 1, 'hidden_size_yyx_l0': 4, 'context_size_yyx': 4, 'num_mix_components_yyx': 5, 'context_extractor_yyx': 'gru', 'activation_func_yyx': 'ReLU', 'L2_weight_yyx': 0.00016509124602281152, 'L_entropy_weight_yyx': 1.0095643697331008e-10, 'L_sep_weight_yyx': 2.3965623103145607e-05, 'L_scale_weight_yyx': 0.00026691250701750546, 'learning_rate_yyx': 0.001868962520299958}. Best is trial 6 with value: -0.5805135147115715.
[I 2026-03-18 16:48:37,795] Trial 2 pruned. 
[I 2026-03-18 16:48:44,892] Trial 12 pruned. 
[I 2026-03-18 16:48:49,632] Trial 5 pruned. 
[I 2026-03-18 16:48:56,576] Trial 3 pruned. 
[I 2026-03-18 16:49:04,691] Trial 6 pruned. 
[I 2026-03-18 16:49:05,197] Trial 3 finished with value: -0.39083356827774285 and parameters: {'n_layers_yyx': 2, 'hidden_size_yyx_l0': 3, 'hidden_size_yyx_l1': 2, 'context_size_yyx': 2, 'num_mix_components_yyx': 5, 'context_extractor_yyx': 'gru', 'activation_func_yyx': 'GELU', 'L2_weight_yyx': 1.3031172557360853e-08, 'L_entropy_weight_yyx': 0.0001458784458409225, 'L_sep_weight_yyx': 2.204121685286819e-08, 'L_scale_weight_yyx': 2.2964757931379064e-10, 'learning_rate_yyx': 0.0008352319751372298}. Best is trial 0 with value: -0.4346305445620888.
[I 2026-03-18 16:49:05,705] Trial 7 pruned. 
[I 2026-03-18 16:49:08,083] Trial 5 finished with value: -0.5902560521352734 and parameters: {'n_layers_yyx': 1, 'hidden_size_yyx_l0': 5, 'context_size_yyx': 1, 'num_mix_components_yyx': 4, 'context_extractor_yyx': 'lstm', 'activation_func_yyx': 'Tanh', 'L2_weight_yyx': 8.218160730227408e-10, 'L_entropy_weight_yyx': 0.00011967695055603677, 'L_sep_weight_yyx': 1.25256331655115e-06, 'L_scale_weight_yyx': 9.932029775984807e-10, 'learning_rate_yyx': 0.0012937210120425712}. Best is trial 5 with value: -0.5902560521352734.
[I 2026-03-18 16:49:13,542] Trial 13 pruned. 
[I 2026-03-18 16:49:15,736] Trial 4 pruned. 
[I 2026-03-18 16:49:19,191] Trial 6 pruned. 
[I 2026-03-18 16:49:21,164] Trial 7 pruned. 
[I 2026-03-18 16:49:22,220] Trial 8 pruned. 
[I 2026-03-18 16:49:23,043] Trial 6 pruned. 
[I 2026-03-18 16:49:35,101] Trial 7 pruned. 
[I 2026-03-18 16:49:43,196] Trial 7 pruned. 
[I 2026-03-18 16:49:44,166] Trial 14 pruned. 
[I 2026-03-18 16:49:44,396] Trial 11 pruned. 
[I 2026-03-18 16:49:46,488] Trial 7 finished with value: -0.5571249603733236 and parameters: {'n_layers_yyx': 2, 'hidden_size_yyx_l0': 2, 'hidden_size_yyx_l1': 6, 'context_size_yyx': 2, 'num_mix_components_yyx': 2, 'context_extractor_yyx': 'lstm', 'activation_func_yyx': 'GELU', 'L2_weight_yyx': 2.0250744856769473e-10, 'L_entropy_weight_yyx': 0.00021743949522179393, 'L_sep_weight_yyx': 6.0836757335136304e-06, 'L_scale_weight_yyx': 3.3561280419928127e-06, 'learning_rate_yyx': 0.003353836841370929}. Best is trial 0 with value: -0.5744275876219695.
[I 2026-03-18 16:49:54,897] Trial 3 finished with value: -0.5499960625188058 and parameters: {'n_layers_yyx': 2, 'hidden_size_yyx_l0': 6, 'hidden_size_yyx_l1': 6, 'context_size_yyx': 2, 'num_mix_components_yyx': 2, 'context_extractor_yyx': 'gru', 'activation_func_yyx': 'Tanh', 'L2_weight_yyx': 0.0009949231553901007, 'L_entropy_weight_yyx': 2.812601316288814e-10, 'L_sep_weight_yyx': 1.5106018364888666e-05, 'L_scale_weight_yyx': 4.2593516134511596e-10, 'learning_rate_yyx': 0.004168225440071821}. Best is trial 0 with value: -0.5683635517524394.
[I 2026-03-18 16:50:01,018] Trial 12 pruned. 
[I 2026-03-18 16:50:03,257] Trial 8 pruned. 
[I 2026-03-18 16:50:11,813] Trial 4 pruned. 
[I 2026-03-18 16:50:13,578] Trial 15 pruned. 
[I 2026-03-18 16:50:16,336] Trial 4 finished with value: -0.561374291757114 and parameters: {'n_layers_yyx': 1, 'hidden_size_yyx_l0': 2, 'context_size_yyx': 4, 'num_mix_components_yyx': 4, 'context_extractor_yyx': 'lstm', 'activation_func_yyx': 'GELU', 'L2_weight_yyx': 0.000174306288482848, 'L_entropy_weight_yyx': 5.1619328570879065e-06, 'L_sep_weight_yyx': 2.0740745229568625e-08, 'L_scale_weight_yyx': 2.6044561741397213e-06, 'learning_rate_yyx': 0.0006336806160098439}. Best is trial 0 with value: -0.5748618229547262.
[I 2026-03-18 16:50:17,555] Trial 13 pruned. 
[I 2026-03-18 16:50:18,468] Trial 14 finished with value: -0.5810668189719094 and parameters: {'n_layers_yyx': 1, 'hidden_size_yyx_l0': 4, 'context_size_yyx': 3, 'num_mix_components_yyx': 4, 'context_extractor_yyx': 'gru', 'activation_func_yyx': 'Tanh', 'L2_weight_yyx': 1.0736761917945909e-05, 'L_entropy_weight_yyx': 4.760739164773218e-05, 'L_sep_weight_yyx': 6.422678983449344e-05, 'L_scale_weight_yyx': 2.225641053802872e-08, 'learning_rate_yyx': 0.0022308352621147583}. Best is trial 3 with value: -0.5836324153936877.
[I 2026-03-18 16:50:23,557] Trial 9 pruned. 
[I 2026-03-18 16:50:31,999] Trial 14 pruned. 
[I 2026-03-18 16:50:34,809] Trial 8 pruned. 
