[I 2026-03-18 22:28:44,716] Trial 74 finished with value: -1.465376915564904 and parameters: {'n_layers_yyx': 1, 'hidden_size_yyx_l0': 4, 'context_size_yyx': 4, 'num_mix_components_yyx': 5, 'context_extractor_yyx': 'lstm', 'activation_func_yyx': 'Tanh', 'L2_weight_yyx': 0.00011571900989162701, 'L_entropy_weight_yyx': 2.163463300631359e-09, 'L_sep_weight_yyx': 1.4693652239373482e-08, 'L_scale_weight_yyx': 1.0526339759776869e-09, 'learning_rate_yyx': 0.009098930954866372}. Best is trial 29 with value: -1.4683670278695913.
[I 2026-03-18 22:28:44,766] Trial 70 pruned. 
[I 2026-03-18 22:28:45,241] Trial 79 pruned. 
[I 2026-03-18 22:28:45,804] Trial 92 finished with value: -1.451388667179988 and parameters: {'n_layers_yyx': 2, 'hidden_size_yyx_l0': 6, 'hidden_size_yyx_l1': 5, 'context_size_yyx': 3, 'num_mix_components_yyx': 4, 'context_extractor_yyx': 'lstm', 'activation_func_yyx': 'Tanh', 'L2_weight_yyx': 7.505386926501627e-08, 'L_entropy_weight_yyx': 2.9804840924875e-08, 'L_sep_weight_yyx': 0.0002667025457323821, 'L_scale_weight_yyx': 2.960173326393945e-08, 'learning_rate_yyx': 0.009149360047631915}. Best is trial 32 with value: -1.4672450138972355.
[I 2026-03-18 22:28:48,087] Trial 80 pruned. 
[I 2026-03-18 22:28:49,590] Trial 75 pruned. 
[I 2026-03-18 22:28:50,822] Trial 76 finished with value: -1.4517383986253005 and parameters: {'n_layers_yyx': 1, 'hidden_size_yyx_l0': 5, 'context_size_yyx': 3, 'num_mix_components_yyx': 4, 'context_extractor_yyx': 'lstm', 'activation_func_yyx': 'Tanh', 'L2_weight_yyx': 2.1666022776163557e-07, 'L_entropy_weight_yyx': 3.045463674232073e-07, 'L_sep_weight_yyx': 1.6790686154308102e-05, 'L_scale_weight_yyx': 1.24633559547965e-07, 'learning_rate_yyx': 0.00978180168389825}. Best is trial 19 with value: -1.4628589806189904.
[I 2026-03-18 22:28:50,897] Trial 66 pruned. 
[I 2026-03-18 22:28:53,146] Trial 81 pruned. 
[I 2026-03-18 22:28:53,488] Trial 53 finished with value: -1.4396224271334135 and parameters: {'n_layers_yyx': 2, 'hidden_size_yyx_l0': 3, 'hidden_size_yyx_l1': 4, 'context_size_yyx': 4, 'num_mix_components_yyx': 5, 'context_extractor_yyx': 'gru', 'activation_func_yyx': 'Tanh', 'L2_weight_yyx': 9.041107072537116e-07, 'L_entropy_weight_yyx': 8.834967334243829e-05, 'L_sep_weight_yyx': 6.818006808111662e-09, 'L_scale_weight_yyx': 7.29209949609667e-08, 'learning_rate_yyx': 0.007776237505122816}. Best is trial 45 with value: -1.4586368032602164.
[I 2026-03-18 22:28:55,354] Trial 82 pruned. 
[I 2026-03-18 22:28:56,210] Trial 77 pruned. 
[I 2026-03-18 22:28:57,751] Trial 93 pruned. 
[I 2026-03-18 22:28:59,729] Trial 71 pruned. 
[I 2026-03-18 22:29:02,811] Trial 94 pruned. 

Source events: 3403
Target events: 20158
Full model ln_yyx : 205.60342 nats/sec, 9.17963 nats/event
Full model Log loss : -1.44338
Full model ln_yyx : 204.69103 nats/sec, 9.13890 nats/event
Full model Log loss : -1.45624
Full model ln_yyx : 203.61027 nats/sec, 9.09065 nats/event
Full model Log loss : -1.45493
Full model ln_yyx : 202.96877 nats/sec, 9.06200 nats/event
Full model Log loss : -1.43244
Full model ln_yyx : 199.36570 nats/sec, 8.90114 nats/event
Full model Log loss : -1.39290
Full model ln_yyx : 199.15471 nats/sec, 8.89172 nats/event
Full model Log loss : -1.45055
Full model ln_yyx : 202.91945 nats/sec, 9.05980 nats/event
Full model Log loss : -1.46020
Full model ln_yyx : 200.42368 nats/sec, 8.94837 nats/event
Full model Log loss : -1.40812
Full model ln_yyx : 204.23446 nats/sec, 9.11851 nats/event
Full model Log loss : -1.44736
Full model ln_yyx : 206.35112 nats/sec, 9.21302 nats/event
Full model Log loss : -1.45362
Full model ln_yyx : 202.47860 nats/sec, 9.04012 nats/event
Full model Log loss : -1.44378
Full model ln_yyx : 200.49849 nats/sec, 8.95171 nats/event
Full model Log loss : -1.45131
Full model ln_yyx : 201.40655 nats/sec, 8.99226 nats/event
Full model Log loss : -1.43847
Full model ln_yyx : 202.70786 nats/sec, 9.05036 nats/event
Full model Log loss : -1.37420
Full model ln_yyx : 204.96121 nats/sec, 9.15096 nats/event
Full model Log loss : -1.45139
Optimization finished. Config saved to results/opt-full/opt_full_249_best_config.txt
[I 2026-03-18 22:29:06,831] Trial 73 finished with value: -1.3895217191256009 and parameters: {'n_layers_yyx': 2, 'hidden_size_yyx_l0': 3, 'hidden_size_yyx_l1': 4, 'context_size_yyx': 1, 'num_mix_components_yyx': 3, 'context_extractor_yyx': 'lstm', 'activation_func_yyx': 'ReLU', 'L2_weight_yyx': 4.397766975880996e-05, 'L_entropy_weight_yyx': 1.3903833995827914e-05, 'L_sep_weight_yyx': 2.7687078071762944e-07, 'L_scale_weight_yyx': 2.5842159724550915e-10, 'learning_rate_yyx': 0.004654134072620945}. Best is trial 63 with value: -1.4621721942608172.
[I 2026-03-18 22:29:07,480] Trial 83 pruned. 
[I 2026-03-18 22:29:09,580] Trial 74 pruned. 
[I 2026-03-18 22:29:13,829] Trial 76 finished with value: -1.4553011850210336 and parameters: {'n_layers_yyx': 1, 'hidden_size_yyx_l0': 4, 'context_size_yyx': 4, 'num_mix_components_yyx': 5, 'context_extractor_yyx': 'lstm', 'activation_func_yyx': 'Tanh', 'L2_weight_yyx': 0.00011945412433173371, 'L_entropy_weight_yyx': 2.432209282247163e-09, 'L_sep_weight_yyx': 3.744293203447496e-08, 'L_scale_weight_yyx': 1.0817588285470839e-09, 'learning_rate_yyx': 0.008247061382541583}. Best is trial 29 with value: -1.4683670278695913.
[I 2026-03-18 22:29:14,645] Trial 75 pruned. 
[I 2026-03-18 22:29:16,035] Trial 77 pruned. 
[I 2026-03-18 22:29:16,916] Trial 78 finished with value: -1.4575289682241586 and parameters: {'n_layers_yyx': 1, 'hidden_size_yyx_l0': 6, 'context_size_yyx': 4, 'num_mix_components_yyx': 5, 'context_extractor_yyx': 'lstm', 'activation_func_yyx': 'Tanh', 'L2_weight_yyx': 6.404720173650351e-07, 'L_entropy_weight_yyx': 3.2576411749890056e-08, 'L_sep_weight_yyx': 3.7186024330882287e-06, 'L_scale_weight_yyx': 8.183283717976983e-08, 'learning_rate_yyx': 0.008412122477718652}. Best is trial 19 with value: -1.4628589806189904.
[I 2026-03-18 22:29:17,008] Trial 76 pruned. 
[I 2026-03-18 22:29:18,728] Trial 82 finished with value: -1.45536135160006 and parameters: {'n_layers_yyx': 2, 'hidden_size_yyx_l0': 6, 'hidden_size_yyx_l1': 3, 'context_size_yyx': 4, 'num_mix_components_yyx': 4, 'context_extractor_yyx': 'lstm', 'activation_func_yyx': 'Tanh', 'L2_weight_yyx': 1.1387222013196644e-09, 'L_entropy_weight_yyx': 1.1329958931620865e-08, 'L_sep_weight_yyx': 0.000149158109727663, 'L_scale_weight_yyx': 0.0004030254921369262, 'learning_rate_yyx': 0.007993511056773255}. Best is trial 49 with value: -1.4726762272761418.
[I 2026-03-18 22:29:20,933] Trial 42 finished with value: -2.4929611110165277 and parameters: {'n_layers_yyx': 1, 'hidden_size_yyx_l0': 6, 'context_size_yyx': 4, 'num_mix_components_yyx': 5, 'context_extractor_yyx': 'gru', 'activation_func_yyx': 'GELU', 'L2_weight_yyx': 9.13288183847648e-10, 'L_entropy_weight_yyx': 5.529797616664988e-06, 'L_sep_weight_yyx': 3.6375368314989583e-10, 'L_scale_weight_yyx': 7.342389568875523e-08, 'learning_rate_yyx': 0.00835660622267147}. Best is trial 35 with value: -2.497237209565205.
[I 2026-03-18 22:29:22,151] Trial 79 pruned. 
[I 2026-03-18 22:29:22,154] Trial 54 finished with value: -1.4451107788085937 and parameters: {'n_layers_yyx': 2, 'hidden_size_yyx_l0': 3, 'hidden_size_yyx_l1': 4, 'context_size_yyx': 4, 'num_mix_components_yyx': 5, 'context_extractor_yyx': 'gru', 'activation_func_yyx': 'Tanh', 'L2_weight_yyx': 7.728821810881505e-07, 'L_entropy_weight_yyx': 0.00012624763579826347, 'L_sep_weight_yyx': 3.480042009702761e-09, 'L_scale_weight_yyx': 9.776263316856803e-08, 'learning_rate_yyx': 0.00785901288836546}. Best is trial 45 with value: -1.4586368032602164.
[I 2026-03-18 22:29:23,184] Trial 67 finished with value: -2.454583679475396 and parameters: {'n_layers_yyx': 1, 'hidden_size_yyx_l0': 6, 'context_size_yyx': 4, 'num_mix_components_yyx': 3, 'context_extractor_yyx': 'gru', 'activation_func_yyx': 'Tanh', 'L2_weight_yyx': 8.548312078998836e-10, 'L_entropy_weight_yyx': 4.601615150915912e-08, 'L_sep_weight_yyx': 1.1622929858654979e-05, 'L_scale_weight_yyx': 6.24396098272653e-07, 'learning_rate_yyx': 0.005697727534233445}. Best is trial 46 with value: -2.4875562296733595.
[I 2026-03-18 22:29:24,439] Trial 80 pruned. 
[I 2026-03-18 22:29:26,492] Trial 84 finished with value: -1.5801074072135302 and parameters: {'n_layers_yyx': 2, 'hidden_size_yyx_l0': 5, 'hidden_size_yyx_l1': 5, 'context_size_yyx': 2, 'num_mix_components_yyx': 5, 'context_extractor_yyx': 'gru', 'activation_func_yyx': 'Tanh', 'L2_weight_yyx': 7.794646810879083e-10, 'L_entropy_weight_yyx': 2.963677201821157e-10, 'L_sep_weight_yyx': 2.9364790380275256e-07, 'L_scale_weight_yyx': 0.00013575005180943984, 'learning_rate_yyx': 0.009533545258328571}. Best is trial 81 with value: -1.5962556995106763.

Source events: 3403
Target events: 1783
Full model ln_yyx : 18.50416 nats/sec, 9.34029 nats/event
Full model Log loss : -1.57920
Full model ln_yyx : 18.67049 nats/sec, 9.42425 nats/event
Full model Log loss : -1.57061
Full model ln_yyx : 18.30975 nats/sec, 9.24216 nats/event
Full model Log loss : -1.57707
Full model ln_yyx : 18.51278 nats/sec, 9.34465 nats/event
Full model Log loss : -1.56966
Full model ln_yyx : 18.25399 nats/sec, 9.21402 nats/event
Full model Log loss : -1.56336
Full model ln_yyx : 18.63104 nats/sec, 9.40434 nats/event
Full model Log loss : -1.58070
Full model ln_yyx : 18.37860 nats/sec, 9.27691 nats/event
Full model Log loss : -1.57366
Full model ln_yyx : 17.87216 nats/sec, 9.02128 nats/event
Full model Log loss : -1.53409
Full model ln_yyx : 18.43075 nats/sec, 9.30324 nats/event
Full model Log loss : -1.56678
Full model ln_yyx : 18.19845 nats/sec, 9.18598 nats/event
Full model Log loss : -1.56257
Full model ln_yyx : 18.48834 nats/sec, 9.33231 nats/event
Full model Log loss : -1.58754
Full model ln_yyx : 18.62061 nats/sec, 9.39907 nats/event
Full model Log loss : -1.57102
Full model ln_yyx : 18.52528 nats/sec, 9.35096 nats/event
Full model Log loss : -1.58100
Full model ln_yyx : 18.80741 nats/sec, 9.49336 nats/event
Full model Log loss : -1.59626
Full model ln_yyx : 18.42559 nats/sec, 9.30063 nats/event
Full model Log loss : -1.58011
Optimization finished. Config saved to results/opt-full/opt_full_241_best_config.txt
[I 2026-03-18 22:29:27,080] Trial 78 pruned. 
[I 2026-03-18 22:29:29,104] Trial 68 pruned. 
[I 2026-03-18 22:29:29,172] Trial 81 pruned. 

Source events: 3403
Target events: 20315
Full model ln_yyx : 204.06756 nats/sec, 9.04065 nats/event
Full model Log loss : -1.44662
Full model ln_yyx : 203.05971 nats/sec, 8.99600 nats/event
Full model Log loss : -1.44185
Full model ln_yyx : 203.68499 nats/sec, 9.02370 nats/event
Full model Log loss : -1.43873
Full model ln_yyx : 197.74981 nats/sec, 8.76076 nats/event
Full model Log loss : -1.35503
Full model ln_yyx : 202.53801 nats/sec, 8.97289 nats/event
Full model Log loss : -1.43642
Full model ln_yyx : 205.03917 nats/sec, 9.08369 nats/event
Full model Log loss : -1.44764
Full model ln_yyx : 205.66476 nats/sec, 9.11141 nats/event
Full model Log loss : -1.44719
Full model ln_yyx : 193.38500 nats/sec, 8.56739 nats/event
Full model Log loss : -1.32600
Full model ln_yyx : 205.49031 nats/sec, 9.10368 nats/event
Full model Log loss : -1.45651
Full model ln_yyx : 200.04291 nats/sec, 8.86235 nats/event
Full model Log loss : -1.40718
Full model ln_yyx : 205.28155 nats/sec, 9.09443 nats/event
Full model Log loss : -1.45174
Full model ln_yyx : 207.21334 nats/sec, 9.18002 nats/event
Full model Log loss : -1.45753
Optimization finished. Config saved to results/opt-full/opt_full_242_best_config.txt
[I 2026-03-18 22:29:30,900] Trial 79 pruned. 
[I 2026-03-18 22:29:32,170] Trial 35 finished with value: -2.4757675012008824 and parameters: {'n_layers_yyx': 1, 'hidden_size_yyx_l0': 5, 'context_size_yyx': 4, 'num_mix_components_yyx': 2, 'context_extractor_yyx': 'gru', 'activation_func_yyx': 'ReLU', 'L2_weight_yyx': 5.634993276320586e-06, 'L_entropy_weight_yyx': 1.1080504864973794e-07, 'L_sep_weight_yyx': 2.5982392699438674e-06, 'L_scale_weight_yyx': 6.381372804977655e-09, 'learning_rate_yyx': 0.007541929443649097}. Best is trial 34 with value: -2.477771523391826.
[I 2026-03-18 22:29:33,834] Trial 43 pruned. 
[I 2026-03-18 22:29:36,436] Trial 83 finished with value: -1.4531894625150241 and parameters: {'n_layers_yyx': 2, 'hidden_size_yyx_l0': 6, 'hidden_size_yyx_l1': 3, 'context_size_yyx': 4, 'num_mix_components_yyx': 4, 'context_extractor_yyx': 'lstm', 'activation_func_yyx': 'Tanh', 'L2_weight_yyx': 1.2630414113839547e-09, 'L_entropy_weight_yyx': 1.2356426829451455e-08, 'L_sep_weight_yyx': 0.0001606204708077629, 'L_scale_weight_yyx': 0.00015469284207389792, 'learning_rate_yyx': 0.009017282657403331}. Best is trial 49 with value: -1.4726762272761418.
[I 2026-03-18 22:29:39,292] Trial 72 pruned. 
[I 2026-03-18 22:29:40,406] Trial 80 pruned. 
[I 2026-03-18 22:29:42,213] Trial 81 pruned. 
[I 2026-03-18 22:29:43,852] Trial 55 finished with value: -1.4550770686222956 and parameters: {'n_layers_yyx': 2, 'hidden_size_yyx_l0': 3, 'hidden_size_yyx_l1': 4, 'context_size_yyx': 4, 'num_mix_components_yyx': 5, 'context_extractor_yyx': 'gru', 'activation_func_yyx': 'Tanh', 'L2_weight_yyx': 1.8534199231283353e-07, 'L_entropy_weight_yyx': 4.833951025453536e-05, 'L_sep_weight_yyx': 1.1365977918439936e-08, 'L_scale_weight_yyx': 1.0041553153475775e-08, 'learning_rate_yyx': 0.008504540384758908}. Best is trial 45 with value: -1.4586368032602164.
[I 2026-03-18 22:29:45,630] Trial 44 pruned. 
[I 2026-03-18 22:29:46,136] Trial 36 pruned. 
[I 2026-03-18 22:29:50,770] Trial 45 pruned. 
[I 2026-03-18 22:29:52,492] Trial 77 finished with value: -1.4526081026517428 and parameters: {'n_layers_yyx': 2, 'hidden_size_yyx_l0': 4, 'hidden_size_yyx_l1': 4, 'context_size_yyx': 1, 'num_mix_components_yyx': 3, 'context_extractor_yyx': 'lstm', 'activation_func_yyx': 'GELU', 'L2_weight_yyx': 1.7340666713650037e-05, 'L_entropy_weight_yyx': 4.5781416498670806e-06, 'L_sep_weight_yyx': 1.8970770073347848e-06, 'L_scale_weight_yyx': 7.386637044286795e-07, 'learning_rate_yyx': 0.006219892683210151}. Best is trial 63 with value: -1.4621721942608172.
[I 2026-03-18 22:29:53,525] Trial 84 finished with value: -1.4523145235501802 and parameters: {'n_layers_yyx': 2, 'hidden_size_yyx_l0': 6, 'hidden_size_yyx_l1': 3, 'context_size_yyx': 4, 'num_mix_components_yyx': 4, 'context_extractor_yyx': 'lstm', 'activation_func_yyx': 'Tanh', 'L2_weight_yyx': 1.3203434911702828e-09, 'L_entropy_weight_yyx': 1.7290218843016983e-08, 'L_sep_weight_yyx': 0.0001232376158588985, 'L_scale_weight_yyx': 0.0004241884953106141, 'learning_rate_yyx': 0.00899039210214727}. Best is trial 49 with value: -1.4726762272761418.
[I 2026-03-18 22:29:54,789] Trial 78 pruned. 
[I 2026-03-18 22:29:57,109] Trial 79 pruned. 
[I 2026-03-18 22:29:59,203] Trial 80 pruned. 
[I 2026-03-18 22:30:00,794] Trial 82 finished with value: -1.4628918691781851 and parameters: {'n_layers_yyx': 1, 'hidden_size_yyx_l0': 4, 'context_size_yyx': 4, 'num_mix_components_yyx': 5, 'context_extractor_yyx': 'lstm', 'activation_func_yyx': 'Tanh', 'L2_weight_yyx': 4.7566341267276765e-05, 'L_entropy_weight_yyx': 1.3609163394624178e-08, 'L_sep_weight_yyx': 1.5694355882011354e-08, 'L_scale_weight_yyx': 1.7083423658008928e-09, 'learning_rate_yyx': 0.009174101768787213}. Best is trial 29 with value: -1.4683670278695913.
[I 2026-03-18 22:30:01,493] Trial 81 pruned. 
[I 2026-03-18 22:30:02,320] Trial 46 pruned. 
[I 2026-03-18 22:30:03,708] Trial 56 finished with value: -1.4388630089393029 and parameters: {'n_layers_yyx': 2, 'hidden_size_yyx_l0': 3, 'hidden_size_yyx_l1': 4, 'context_size_yyx': 4, 'num_mix_components_yyx': 5, 'context_extractor_yyx': 'gru', 'activation_func_yyx': 'Tanh', 'L2_weight_yyx': 1.6207322744536603e-07, 'L_entropy_weight_yyx': 4.363282233825335e-05, 'L_sep_weight_yyx': 8.525106993026008e-09, 'L_scale_weight_yyx': 6.238990854213619e-09, 'learning_rate_yyx': 0.009911209394557434}. Best is trial 45 with value: -1.4586368032602164.
[I 2026-03-18 22:30:04,381] Trial 69 pruned. 
[I 2026-03-18 22:30:05,724] Trial 82 pruned. 
[I 2026-03-18 22:30:07,781] Trial 47 pruned. 
[I 2026-03-18 22:30:07,952] Trial 83 pruned. 

Source events: 3403
Target events: 32635
Full model ln_yyx : 326.05134 nats/sec, 8.99176 nats/event
Full model Log loss : -1.43898
Full model ln_yyx : 327.13324 nats/sec, 9.02160 nats/event
Full model Log loss : -1.43669
Full model ln_yyx : 321.12359 nats/sec, 8.85587 nats/event
Full model Log loss : -1.40391
Full model ln_yyx : 328.09921 nats/sec, 9.04824 nats/event
Full model Log loss : -1.45648
Full model ln_yyx : 328.46046 nats/sec, 9.05820 nats/event
Full model Log loss : -1.45913
Full model ln_yyx : 329.91351 nats/sec, 9.09827 nats/event
Full model Log loss : -1.46217
Full model ln_yyx : 326.87751 nats/sec, 9.01455 nats/event
Full model Log loss : -1.44028
Full model ln_yyx : 320.20356 nats/sec, 8.83050 nats/event
Full model Log loss : -1.38952
Full model ln_yyx : 329.21246 nats/sec, 9.07894 nats/event
Full model Log loss : -1.45261
Optimization finished. Config saved to results/opt-full/opt_full_247_best_config.txt
[I 2026-03-18 22:30:10,221] Trial 70 pruned. 
[I 2026-03-18 22:30:13,619] Trial 57 pruned. 
[I 2026-03-18 22:30:15,191] Trial 85 finished with value: -1.4532755220853366 and parameters: {'n_layers_yyx': 2, 'hidden_size_yyx_l0': 6, 'hidden_size_yyx_l1': 3, 'context_size_yyx': 4, 'num_mix_components_yyx': 4, 'context_extractor_yyx': 'lstm', 'activation_func_yyx': 'Tanh', 'L2_weight_yyx': 2.148643467307661e-09, 'L_entropy_weight_yyx': 1.0884654726958182e-08, 'L_sep_weight_yyx': 6.843314900262717e-05, 'L_scale_weight_yyx': 0.0007743857918052129, 'learning_rate_yyx': 0.006511328157577656}. Best is trial 49 with value: -1.4726762272761418.

Source events: 3403
Target events: 54211
Full model ln_yyx : 550.20639 nats/sec, 9.13441 nats/event
Full model Log loss : -1.43156
Full model ln_yyx : 541.18174 nats/sec, 8.98459 nats/event
Full model Log loss : -1.41814
Full model ln_yyx : 543.41980 nats/sec, 9.02175 nats/event
Full model Log loss : -1.43398
Full model ln_yyx : 549.80477 nats/sec, 9.12775 nats/event
Full model Log loss : -1.45105
Full model ln_yyx : 550.93530 nats/sec, 9.14652 nats/event
Full model Log loss : -1.45391
Full model ln_yyx : 552.06490 nats/sec, 9.16527 nats/event
Full model Log loss : -1.45402
Full model ln_yyx : 548.51499 nats/sec, 9.10633 nats/event
Full model Log loss : -1.46102
Full model ln_yyx : 549.53656 nats/sec, 9.12329 nats/event
Full model Log loss : -1.47268
Full model ln_yyx : 547.21365 nats/sec, 9.08473 nats/event
Full model Log loss : -1.45771
Full model ln_yyx : 550.31064 nats/sec, 9.13615 nats/event
Full model Log loss : -1.46137
Full model ln_yyx : 546.55889 nats/sec, 9.07386 nats/event
Full model Log loss : -1.44338
Full model ln_yyx : 531.47097 nats/sec, 8.82337 nats/event
Full model Log loss : -1.41637
Full model ln_yyx : 545.37577 nats/sec, 9.05422 nats/event
Full model Log loss : -1.44662
Full model ln_yyx : 550.60122 nats/sec, 9.14097 nats/event
Full model Log loss : -1.45385
Full model ln_yyx : 552.88215 nats/sec, 9.17884 nats/event
Full model Log loss : -1.45536
Full model ln_yyx : 550.79069 nats/sec, 9.14412 nats/event
Full model Log loss : -1.45319
Full model ln_yyx : 550.51824 nats/sec, 9.13959 nats/event
Full model Log loss : -1.45231
Full model ln_yyx : 549.46572 nats/sec, 9.12212 nats/event
Full model Log loss : -1.45328
Optimization finished. Config saved to results/opt-full/opt_full_244_best_config.txt
[I 2026-03-18 22:30:15,652] Trial 71 pruned. 
[I 2026-03-18 22:30:15,730] Trial 73 pruned. 
[I 2026-03-18 22:30:19,235] Trial 83 finished with value: -1.463613750751202 and parameters: {'n_layers_yyx': 1, 'hidden_size_yyx_l0': 4, 'context_size_yyx': 4, 'num_mix_components_yyx': 5, 'context_extractor_yyx': 'lstm', 'activation_func_yyx': 'Tanh', 'L2_weight_yyx': 2.3208263120223155e-05, 'L_entropy_weight_yyx': 3.667933600028889e-08, 'L_sep_weight_yyx': 1.2417670922076941e-08, 'L_scale_weight_yyx': 1.0170807478764698e-09, 'learning_rate_yyx': 0.008497017015792679}. Best is trial 29 with value: -1.4683670278695913.
[I 2026-03-18 22:30:19,287] Trial 48 pruned. 
[I 2026-03-18 22:30:20,804] Trial 84 pruned. 
[I 2026-03-18 22:30:22,470] Trial 85 pruned. 
