[I 2026-03-18 16:35:52,682] Trial 41 finished with value: -0.4025651677843218 and parameters: {'n_layers_yyx': 1, 'hidden_size_yyx_l0': 6, 'context_size_yyx': 1, 'num_mix_components_yyx': 4, 'context_extractor_yyx': 'gru', 'activation_func_yyx': 'ReLU', 'L2_weight_yyx': 6.170442846392066e-08, 'L_entropy_weight_yyx': 1.3435575112117775e-08, 'L_sep_weight_yyx': 1.5714389441193272e-07, 'L_scale_weight_yyx': 4.654569477650167e-07, 'learning_rate_yyx': 0.009172151645372264}. Best is trial 17 with value: -0.46708542200803016.
[I 2026-03-18 16:35:52,823] Trial 28 pruned. 
[I 2026-03-18 16:35:53,212] Trial 31 finished with value: -0.4284786070832527 and parameters: {'n_layers_yyx': 2, 'hidden_size_yyx_l0': 6, 'hidden_size_yyx_l1': 4, 'context_size_yyx': 4, 'num_mix_components_yyx': 5, 'context_extractor_yyx': 'lstm', 'activation_func_yyx': 'Tanh', 'L2_weight_yyx': 2.859196744804712e-09, 'L_entropy_weight_yyx': 6.870721309955769e-10, 'L_sep_weight_yyx': 7.318595468358852e-05, 'L_scale_weight_yyx': 0.00023827097174566173, 'learning_rate_yyx': 0.003629111112867764}. Best is trial 5 with value: -0.44982475540586303.
[I 2026-03-18 16:35:53,470] Trial 40 pruned. 
[I 2026-03-18 16:35:54,367] Trial 43 pruned. 
[I 2026-03-18 16:35:54,610] Trial 41 pruned. 
[I 2026-03-18 16:35:55,051] Trial 4 pruned. 
[I 2026-03-18 16:35:55,774] Trial 6 finished with value: -2.7950135081496006 and parameters: {'n_layers_yyx': 1, 'hidden_size_yyx_l0': 4, 'context_size_yyx': 4, 'num_mix_components_yyx': 3, 'context_extractor_yyx': 'lstm', 'activation_func_yyx': 'ReLU', 'L2_weight_yyx': 6.161054195362976e-09, 'L_entropy_weight_yyx': 2.3111887993530464e-06, 'L_sep_weight_yyx': 4.467784455144246e-09, 'L_scale_weight_yyx': 0.0005841621065459528, 'learning_rate_yyx': 0.0018652549940793247}. Best is trial 6 with value: -2.7950135081496006.
[I 2026-03-18 16:35:55,962] Trial 29 pruned. 
[I 2026-03-18 16:35:56,126] Trial 44 pruned. 
[I 2026-03-18 16:35:56,654] Trial 15 pruned. 
[I 2026-03-18 16:35:57,336] Trial 43 pruned. 
[I 2026-03-18 16:35:59,190] Trial 30 pruned. 
[I 2026-03-18 16:36:00,518] Trial 44 pruned. 
[I 2026-03-18 16:36:01,135] Trial 21 finished with value: -0.41174070753918346 and parameters: {'n_layers_yyx': 2, 'hidden_size_yyx_l0': 5, 'hidden_size_yyx_l1': 5, 'context_size_yyx': 2, 'num_mix_components_yyx': 1, 'context_extractor_yyx': 'gru', 'activation_func_yyx': 'Tanh', 'L2_weight_yyx': 4.06669841316575e-09, 'L_entropy_weight_yyx': 2.392496496365076e-09, 'L_sep_weight_yyx': 1.3093307786954072e-07, 'L_scale_weight_yyx': 3.4010493348982522e-09, 'learning_rate_yyx': 0.004302247782838389}. Best is trial 9 with value: -0.430995315221072.
[I 2026-03-18 16:36:01,404] Trial 42 pruned. 
[I 2026-03-18 16:36:03,522] Trial 7 pruned. 
[I 2026-03-18 16:36:04,076] Trial 35 finished with value: -0.4350403115476248 and parameters: {'n_layers_yyx': 1, 'hidden_size_yyx_l0': 5, 'context_size_yyx': 4, 'num_mix_components_yyx': 3, 'context_extractor_yyx': 'gru', 'activation_func_yyx': 'Tanh', 'L2_weight_yyx': 1.4322859262726365e-05, 'L_entropy_weight_yyx': 3.4225005798976735e-07, 'L_sep_weight_yyx': 4.483619840456256e-06, 'L_scale_weight_yyx': 0.00011780049153505977, 'learning_rate_yyx': 0.004219837596544593}. Best is trial 34 with value: -0.4537457445457624.
[I 2026-03-18 16:36:05,323] Trial 31 pruned. 
[I 2026-03-18 16:36:06,720] Trial 45 pruned. 
[I 2026-03-18 16:36:07,307] Trial 36 pruned. 
[I 2026-03-18 16:36:07,349] Trial 22 pruned. 
[I 2026-03-18 16:36:07,842] Trial 32 finished with value: -0.42122912333107587 and parameters: {'n_layers_yyx': 2, 'hidden_size_yyx_l0': 6, 'hidden_size_yyx_l1': 4, 'context_size_yyx': 4, 'num_mix_components_yyx': 5, 'context_extractor_yyx': 'lstm', 'activation_func_yyx': 'Tanh', 'L2_weight_yyx': 1.1121890559152015e-08, 'L_entropy_weight_yyx': 1.6818296219099056e-09, 'L_sep_weight_yyx': 0.00020298912364898115, 'L_scale_weight_yyx': 0.00011000522182161776, 'learning_rate_yyx': 0.00778346139983131}. Best is trial 5 with value: -0.44982475540586303.
[I 2026-03-18 16:36:08,317] Trial 41 pruned. 
[I 2026-03-18 16:36:08,561] Trial 32 pruned. 
[I 2026-03-18 16:36:09,413] Trial 41 finished with value: -0.43114733622170087 and parameters: {'n_layers_yyx': 1, 'hidden_size_yyx_l0': 5, 'context_size_yyx': 4, 'num_mix_components_yyx': 4, 'context_extractor_yyx': 'lstm', 'activation_func_yyx': 'Tanh', 'L2_weight_yyx': 0.0003575182777484405, 'L_entropy_weight_yyx': 1.7217292937344762e-09, 'L_sep_weight_yyx': 2.190073734374965e-06, 'L_scale_weight_yyx': 2.5831760254335033e-10, 'learning_rate_yyx': 0.008302823791483884}. Best is trial 25 with value: -0.44456373279677824.
[I 2026-03-18 16:36:09,870] Trial 46 pruned. 
[I 2026-03-18 16:36:11,383] Trial 45 pruned. 
[I 2026-03-18 16:36:11,785] Trial 8 pruned. 
[I 2026-03-18 16:36:11,801] Trial 42 pruned. 
[I 2026-03-18 16:36:13,138] Trial 47 pruned. 
[I 2026-03-18 16:36:14,273] Trial 23 pruned. 
[I 2026-03-18 16:36:14,541] Trial 33 pruned. 
[I 2026-03-18 16:36:14,790] Trial 46 pruned. 
[I 2026-03-18 16:36:15,102] Trial 44 finished with value: -0.42912882990881385 and parameters: {'n_layers_yyx': 2, 'hidden_size_yyx_l0': 4, 'hidden_size_yyx_l1': 4, 'context_size_yyx': 4, 'num_mix_components_yyx': 1, 'context_extractor_yyx': 'gru', 'activation_func_yyx': 'GELU', 'L2_weight_yyx': 3.574216184665053e-08, 'L_entropy_weight_yyx': 3.0642373800379868e-06, 'L_sep_weight_yyx': 8.869972701058103e-08, 'L_scale_weight_yyx': 1.1389457959333103e-06, 'learning_rate_yyx': 0.006067153944533825}. Best is trial 40 with value: -0.4348042963459027.
[I 2026-03-18 16:36:15,502] Trial 37 pruned. 
[I 2026-03-18 16:36:16,227] Trial 48 pruned. 
[I 2026-03-18 16:36:18,421] Trial 34 pruned. 
[I 2026-03-18 16:36:18,605] Trial 43 pruned. 
[I 2026-03-18 16:36:19,016] Trial 45 pruned. 
[I 2026-03-18 16:36:19,413] Trial 33 finished with value: -0.42012075890697564 and parameters: {'n_layers_yyx': 1, 'hidden_size_yyx_l0': 6, 'context_size_yyx': 2, 'num_mix_components_yyx': 3, 'context_extractor_yyx': 'lstm', 'activation_func_yyx': 'Tanh', 'L2_weight_yyx': 9.69260413976476e-10, 'L_entropy_weight_yyx': 7.227828655550023e-08, 'L_sep_weight_yyx': 3.5224499148327257e-07, 'L_scale_weight_yyx': 0.00028005367168233085, 'learning_rate_yyx': 0.007782545898307277}. Best is trial 2 with value: -0.4289537553816757.
[I 2026-03-18 16:36:20,232] Trial 42 finished with value: -0.4012485657683098 and parameters: {'n_layers_yyx': 1, 'hidden_size_yyx_l0': 6, 'context_size_yyx': 1, 'num_mix_components_yyx': 4, 'context_extractor_yyx': 'gru', 'activation_func_yyx': 'ReLU', 'L2_weight_yyx': 4.0051873167230624e-08, 'L_entropy_weight_yyx': 1.740987907353283e-08, 'L_sep_weight_yyx': 9.23411509502916e-07, 'L_scale_weight_yyx': 1.1479602468937146e-07, 'learning_rate_yyx': 0.009521341406976294}. Best is trial 17 with value: -0.46708542200803016.
[I 2026-03-18 16:36:21,463] Trial 47 pruned. 
[I 2026-03-18 16:36:22,319] Trial 44 pruned. 
[I 2026-03-18 16:36:23,557] Trial 3 finished with value: -2.765245976377006 and parameters: {'n_layers_yyx': 1, 'hidden_size_yyx_l0': 5, 'context_size_yyx': 1, 'num_mix_components_yyx': 5, 'context_extractor_yyx': 'lstm', 'activation_func_yyx': 'GELU', 'L2_weight_yyx': 7.905244179532948e-07, 'L_entropy_weight_yyx': 1.7716043216111506e-06, 'L_sep_weight_yyx': 8.560499189013092e-05, 'L_scale_weight_yyx': 1.0725740889745153e-07, 'learning_rate_yyx': 0.00828712779793353}. Best is trial 0 with value: -2.792252838699443.
[I 2026-03-18 16:36:24,090] Trial 7 pruned. 
[I 2026-03-18 16:36:24,483] Trial 48 pruned. 
[I 2026-03-18 16:36:25,076] Trial 43 finished with value: -0.40196520920508416 and parameters: {'n_layers_yyx': 2, 'hidden_size_yyx_l0': 4, 'hidden_size_yyx_l1': 3, 'context_size_yyx': 3, 'num_mix_components_yyx': 3, 'context_extractor_yyx': 'gru', 'activation_func_yyx': 'Tanh', 'L2_weight_yyx': 6.450937250391327e-09, 'L_entropy_weight_yyx': 4.89545500898838e-09, 'L_sep_weight_yyx': 1.5341017837476909e-06, 'L_scale_weight_yyx': 5.408985875097927e-10, 'learning_rate_yyx': 0.007230181655828383}. Best is trial 39 with value: -0.43937692553635355.
[I 2026-03-18 16:36:25,364] Trial 45 pruned. 
[I 2026-03-18 16:36:25,476] Trial 45 finished with value: -0.45107781850147544 and parameters: {'n_layers_yyx': 2, 'hidden_size_yyx_l0': 5, 'hidden_size_yyx_l1': 5, 'context_size_yyx': 4, 'num_mix_components_yyx': 1, 'context_extractor_yyx': 'gru', 'activation_func_yyx': 'Tanh', 'L2_weight_yyx': 1.1558495583839532e-07, 'L_entropy_weight_yyx': 3.5995006721907455e-08, 'L_sep_weight_yyx': 5.31891272329804e-09, 'L_scale_weight_yyx': 9.372880205858023e-05, 'learning_rate_yyx': 0.002284268752817153}. Best is trial 45 with value: -0.45107781850147544.
[I 2026-03-18 16:36:25,883] Trial 7 finished with value: -2.7863086169215863 and parameters: {'n_layers_yyx': 2, 'hidden_size_yyx_l0': 4, 'hidden_size_yyx_l1': 5, 'context_size_yyx': 1, 'num_mix_components_yyx': 5, 'context_extractor_yyx': 'lstm', 'activation_func_yyx': 'ReLU', 'L2_weight_yyx': 1.226427276712354e-06, 'L_entropy_weight_yyx': 0.0002413301572014236, 'L_sep_weight_yyx': 2.1616341021021309e-10, 'L_scale_weight_yyx': 6.055323503409647e-10, 'learning_rate_yyx': 0.004303791249682648}. Best is trial 1 with value: -2.804181999864486.
[I 2026-03-18 16:36:28,814] Trial 46 pruned. 
[I 2026-03-18 16:36:29,558] Trial 37 finished with value: -0.45712648751934987 and parameters: {'n_layers_yyx': 1, 'hidden_size_yyx_l0': 5, 'context_size_yyx': 4, 'num_mix_components_yyx': 4, 'context_extractor_yyx': 'gru', 'activation_func_yyx': 'Tanh', 'L2_weight_yyx': 6.315923202636452e-05, 'L_entropy_weight_yyx': 4.039723588571725e-07, 'L_sep_weight_yyx': 7.432942971184606e-07, 'L_scale_weight_yyx': 8.47269731865263e-05, 'learning_rate_yyx': 0.007702028724315537}. Best is trial 37 with value: -0.45712648751934987.
[I 2026-03-18 16:36:30,414] Trial 42 finished with value: -0.43201307172745745 and parameters: {'n_layers_yyx': 1, 'hidden_size_yyx_l0': 5, 'context_size_yyx': 4, 'num_mix_components_yyx': 4, 'context_extractor_yyx': 'lstm', 'activation_func_yyx': 'Tanh', 'L2_weight_yyx': 8.447359093112845e-05, 'L_entropy_weight_yyx': 1.7866544180930868e-09, 'L_sep_weight_yyx': 3.5029541184532443e-06, 'L_scale_weight_yyx': 1.200449491524547e-10, 'learning_rate_yyx': 0.008337227252444578}. Best is trial 25 with value: -0.44456373279677824.
[I 2026-03-18 16:36:30,581] Trial 24 pruned. 
[I 2026-03-18 16:36:32,311] Trial 8 pruned. 
[I 2026-03-18 16:36:32,587] Trial 44 pruned. 
[I 2026-03-18 16:36:32,750] Trial 47 pruned. 
[I 2026-03-18 16:36:33,922] Trial 5 finished with value: -2.805070761203844 and parameters: {'n_layers_yyx': 1, 'hidden_size_yyx_l0': 4, 'context_size_yyx': 4, 'num_mix_components_yyx': 3, 'context_extractor_yyx': 'gru', 'activation_func_yyx': 'Tanh', 'L2_weight_yyx': 4.411903515239152e-09, 'L_entropy_weight_yyx': 1.6191165912036509e-06, 'L_sep_weight_yyx': 3.534371365675712e-06, 'L_scale_weight_yyx': 4.902607650818045e-10, 'learning_rate_yyx': 0.007826385313337056}. Best is trial 5 with value: -2.805070761203844.
[I 2026-03-18 16:36:34,029] Trial 8 pruned. 
[I 2026-03-18 16:36:34,215] Trial 35 pruned. 
[I 2026-03-18 16:36:34,540] Trial 3 finished with value: -2.798843026726906 and parameters: {'n_layers_yyx': 2, 'hidden_size_yyx_l0': 3, 'hidden_size_yyx_l1': 6, 'context_size_yyx': 3, 'num_mix_components_yyx': 5, 'context_extractor_yyx': 'lstm', 'activation_func_yyx': 'ReLU', 'L2_weight_yyx': 1.942648977126674e-05, 'L_entropy_weight_yyx': 3.621320178747415e-07, 'L_sep_weight_yyx': 9.935615003598423e-06, 'L_scale_weight_yyx': 0.00010590964764478831, 'learning_rate_yyx': 0.003603517988607572}. Best is trial 1 with value: -2.8010403323029167.
[I 2026-03-18 16:36:35,327] Trial 46 pruned. 
[I 2026-03-18 16:36:36,057] Trial 48 pruned. 
[I 2026-03-18 16:36:37,268] Trial 2 finished with value: -2.7929117217936628 and parameters: {'n_layers_yyx': 1, 'hidden_size_yyx_l0': 4, 'context_size_yyx': 4, 'num_mix_components_yyx': 4, 'context_extractor_yyx': 'lstm', 'activation_func_yyx': 'ReLU', 'L2_weight_yyx': 8.964979062014113e-10, 'L_entropy_weight_yyx': 4.670780509710912e-07, 'L_sep_weight_yyx': 1.3485290405573503e-09, 'L_scale_weight_yyx': 7.665505792638986e-09, 'learning_rate_yyx': 0.0022183856537254095}. Best is trial 2 with value: -2.7929117217936628.
[I 2026-03-18 16:36:38,801] Trial 45 pruned. 
[I 2026-03-18 16:36:39,529] Trial 49 pruned. 

Source events: 1783
Target events: 8618
Full model ln_yyx : 28.60945 nats/sec, 2.98776 nats/event
Full model Log loss : -0.38061
Full model ln_yyx : 28.01775 nats/sec, 2.92597 nats/event
Full model Log loss : -0.44268
Full model ln_yyx : 28.19213 nats/sec, 2.94418 nats/event
Full model Log loss : -0.41989
Full model ln_yyx : 28.70386 nats/sec, 2.99762 nats/event
Full model Log loss : -0.43436
Full model ln_yyx : 27.44191 nats/sec, 2.86583 nats/event
Full model Log loss : -0.36754
Full model ln_yyx : 27.22594 nats/sec, 2.84327 nats/event
Full model Log loss : -0.38980
Full model ln_yyx : 28.74562 nats/sec, 3.00198 nats/event
Full model Log loss : -0.42526
Full model ln_yyx : 27.94685 nats/sec, 2.91856 nats/event
Full model Log loss : -0.38599
Full model ln_yyx : 27.35827 nats/sec, 2.85709 nats/event
Full model Log loss : -0.39439
Full model ln_yyx : 27.88502 nats/sec, 2.91210 nats/event
Full model Log loss : -0.42286
Optimization finished. Config saved to results/opt-full/opt_full_29_best_config.txt
[I 2026-03-18 16:36:40,317] Trial 36 pruned. 
[I 2026-03-18 16:36:42,147] Trial 6 pruned. 
[I 2026-03-18 16:36:42,147] Trial 49 finished with value: -0.4271888851012239 and parameters: {'n_layers_yyx': 1, 'hidden_size_yyx_l0': 6, 'context_size_yyx': 2, 'num_mix_components_yyx': 3, 'context_extractor_yyx': 'lstm', 'activation_func_yyx': 'Tanh', 'L2_weight_yyx': 8.852880569891763e-08, 'L_entropy_weight_yyx': 5.580606369994391e-09, 'L_sep_weight_yyx': 1.3489722058340811e-09, 'L_scale_weight_yyx': 8.706098470242482e-07, 'learning_rate_yyx': 0.004841776636799254}. Best is trial 1 with value: -0.43281404005115615.

Source events: 1783
Target events: 18269
Full model ln_yyx : 59.60029 nats/sec, 2.93614 nats/event
Full model Log loss : -0.41803
Full model ln_yyx : 59.31195 nats/sec, 2.92193 nats/event
Full model Log loss : -0.43281
Full model ln_yyx : 60.38787 nats/sec, 2.97493 nats/event
Full model Log loss : -0.41751
Full model ln_yyx : 57.11822 nats/sec, 2.81386 nats/event
Full model Log loss : -0.33622
Full model ln_yyx : 60.44719 nats/sec, 2.97786 nats/event
Full model Log loss : -0.40423
Full model ln_yyx : 58.75925 nats/sec, 2.89470 nats/event
Full model Log loss : -0.37357
Full model ln_yyx : 59.37877 nats/sec, 2.92522 nats/event
Full model Log loss : -0.41677
Full model ln_yyx : 60.42636 nats/sec, 2.97683 nats/event
Full model Log loss : -0.42804
Full model ln_yyx : 56.44017 nats/sec, 2.78046 nats/event
Full model Log loss : -0.34856
Full model ln_yyx : 58.32154 nats/sec, 2.87314 nats/event
Full model Log loss : -0.42719
Optimization finished. Config saved to results/opt-full/opt_full_26_best_config.txt
[I 2026-03-18 16:36:42,374] Trial 9 pruned. 
[I 2026-03-18 16:36:42,862] Trial 49 pruned. 

Source events: 1783
Target events: 14713
Full model ln_yyx : 46.81145 nats/sec, 2.86347 nats/event
Full model Log loss : -0.40709
Full model ln_yyx : 49.77608 nats/sec, 3.04482 nats/event
Full model Log loss : -0.33863
Full model ln_yyx : 48.53651 nats/sec, 2.96900 nats/event
Full model Log loss : -0.44385
Full model ln_yyx : 47.73942 nats/sec, 2.92024 nats/event
Full model Log loss : -0.43584
Full model ln_yyx : 48.15517 nats/sec, 2.94567 nats/event
Full model Log loss : -0.44910
Full model ln_yyx : 48.97321 nats/sec, 2.99571 nats/event
Full model Log loss : -0.42760
Full model ln_yyx : 49.91644 nats/sec, 3.05341 nats/event
Full model Log loss : -0.45104
Full model ln_yyx : 49.17438 nats/sec, 3.00802 nats/event
Full model Log loss : -0.43303
Full model ln_yyx : 50.36253 nats/sec, 3.08070 nats/event
Full model Log loss : -0.42585
Full model ln_yyx : 48.92796 nats/sec, 2.99294 nats/event
Full model Log loss : -0.45108
Optimization finished. Config saved to results/opt-full/opt_full_19_best_config.txt
[I 2026-03-18 16:36:47,689] Trial 43 finished with value: -0.4027770901612084 and parameters: {'n_layers_yyx': 1, 'hidden_size_yyx_l0': 6, 'context_size_yyx': 1, 'num_mix_components_yyx': 4, 'context_extractor_yyx': 'gru', 'activation_func_yyx': 'ReLU', 'L2_weight_yyx': 4.172958464494447e-08, 'L_entropy_weight_yyx': 1.1341713033617789e-08, 'L_sep_weight_yyx': 7.62854730149468e-07, 'L_scale_weight_yyx': 1.228886179539274e-07, 'learning_rate_yyx': 0.00987655782057432}. Best is trial 17 with value: -0.46708542200803016.
[I 2026-03-18 16:36:47,906] Trial 25 finished with value: -0.3569411286628652 and parameters: {'n_layers_yyx': 2, 'hidden_size_yyx_l0': 5, 'hidden_size_yyx_l1': 6, 'context_size_yyx': 2, 'num_mix_components_yyx': 2, 'context_extractor_yyx': 'gru', 'activation_func_yyx': 'Tanh', 'L2_weight_yyx': 4.912252998415614e-10, 'L_entropy_weight_yyx': 2.392114842577355e-06, 'L_sep_weight_yyx': 6.7874113068546e-10, 'L_scale_weight_yyx': 4.649988211006657e-07, 'learning_rate_yyx': 0.0063250307188361206}. Best is trial 9 with value: -0.430995315221072.
[I 2026-03-18 16:36:50,283] Trial 7 pruned. 
[I 2026-03-18 16:36:50,918] Trial 43 finished with value: -0.4312773902349797 and parameters: {'n_layers_yyx': 1, 'hidden_size_yyx_l0': 5, 'context_size_yyx': 4, 'num_mix_components_yyx': 4, 'context_extractor_yyx': 'lstm', 'activation_func_yyx': 'Tanh', 'L2_weight_yyx': 0.0005486756091996383, 'L_entropy_weight_yyx': 3.1623828729411116e-09, 'L_sep_weight_yyx': 3.1905627125411205e-06, 'L_scale_weight_yyx': 2.3250577329568428e-10, 'learning_rate_yyx': 0.007957251148026775}. Best is trial 25 with value: -0.44456373279677824.
[I 2026-03-18 16:36:50,959] Trial 34 finished with value: -0.418735941128096 and parameters: {'n_layers_yyx': 1, 'hidden_size_yyx_l0': 6, 'context_size_yyx': 2, 'num_mix_components_yyx': 3, 'context_extractor_yyx': 'lstm', 'activation_func_yyx': 'Tanh', 'L2_weight_yyx': 3.2962498057904814e-10, 'L_entropy_weight_yyx': 9.249803425732763e-08, 'L_sep_weight_yyx': 2.9318215252002143e-07, 'L_scale_weight_yyx': 0.0002184419123024812, 'learning_rate_yyx': 0.008137315673741935}. Best is trial 2 with value: -0.4289537553816757.
[I 2026-03-18 16:36:51,558] Trial 33 pruned. 
[I 2026-03-18 16:36:53,036] Trial 44 pruned. 
[I 2026-03-18 16:36:53,472] Trial 38 finished with value: -0.44392702084945823 and parameters: {'n_layers_yyx': 1, 'hidden_size_yyx_l0': 4, 'context_size_yyx': 4, 'num_mix_components_yyx': 4, 'context_extractor_yyx': 'gru', 'activation_func_yyx': 'Tanh', 'L2_weight_yyx': 7.510365251474489e-05, 'L_entropy_weight_yyx': 3.7840917196416317e-07, 'L_sep_weight_yyx': 3.944465898176036e-06, 'L_scale_weight_yyx': 7.865907437362525e-05, 'learning_rate_yyx': 0.007822977948680426}. Best is trial 37 with value: -0.45712648751934987.
[I 2026-03-18 16:36:53,527] Trial 46 pruned. 
[I 2026-03-18 16:36:54,401] Trial 34 pruned. 
[I 2026-03-18 16:36:56,366] Trial 38 pruned. 
[I 2026-03-18 16:36:56,467] Trial 47 pruned. 
[I 2026-03-18 16:36:56,886] Trial 44 pruned. 
[I 2026-03-18 16:36:57,263] Trial 35 pruned. 
[I 2026-03-18 16:36:57,473] Trial 47 finished with value: -0.3951571674169771 and parameters: {'n_layers_yyx': 2, 'hidden_size_yyx_l0': 5, 'hidden_size_yyx_l1': 3, 'context_size_yyx': 4, 'num_mix_components_yyx': 1, 'context_extractor_yyx': 'lstm', 'activation_func_yyx': 'GELU', 'L2_weight_yyx': 2.4995696188688348e-08, 'L_entropy_weight_yyx': 5.40188378510688e-07, 'L_sep_weight_yyx': 2.0692506173236318e-07, 'L_scale_weight_yyx': 1.0722473921418556e-06, 'learning_rate_yyx': 0.008289873271510996}. Best is trial 40 with value: -0.4348042963459027.
[I 2026-03-18 16:36:59,349] Trial 48 pruned. 
[I 2026-03-18 16:37:00,130] Trial 36 pruned. 
[I 2026-03-18 16:37:00,488] Trial 48 pruned. 
[I 2026-03-18 16:37:02,135] Trial 39 pruned. 
[I 2026-03-18 16:37:05,373] Trial 37 pruned. 
[I 2026-03-18 16:37:07,751] Trial 40 pruned. 
[I 2026-03-18 16:37:08,011] Trial 39 pruned. 
[I 2026-03-18 16:37:08,123] Trial 37 finished with value: -0.44267438292134287 and parameters: {'n_layers_yyx': 2, 'hidden_size_yyx_l0': 5, 'hidden_size_yyx_l1': 4, 'context_size_yyx': 4, 'num_mix_components_yyx': 3, 'context_extractor_yyx': 'gru', 'activation_func_yyx': 'Tanh', 'L2_weight_yyx': 2.728982459489607e-10, 'L_entropy_weight_yyx': 4.942067515173988e-09, 'L_sep_weight_yyx': 1.5564065978201523e-06, 'L_scale_weight_yyx': 4.98709199507054e-05, 'learning_rate_yyx': 0.004780082619862717}. Best is trial 5 with value: -0.44982475540586303.
[I 2026-03-18 16:37:10,467] Trial 45 pruned. 
[I 2026-03-18 16:37:10,766] Trial 41 pruned. 
[I 2026-03-18 16:37:12,027] Trial 5 finished with value: -2.803729491226789 and parameters: {'n_layers_yyx': 2, 'hidden_size_yyx_l0': 4, 'hidden_size_yyx_l1': 4, 'context_size_yyx': 2, 'num_mix_components_yyx': 3, 'context_extractor_yyx': 'gru', 'activation_func_yyx': 'Tanh', 'L2_weight_yyx': 0.0002761570400180212, 'L_entropy_weight_yyx': 4.3720897030586275e-09, 'L_sep_weight_yyx': 4.687807503957829e-05, 'L_scale_weight_yyx': 6.359215683405751e-10, 'learning_rate_yyx': 0.004628494391365462}. Best is trial 5 with value: -2.803729491226789.
[I 2026-03-18 16:37:12,352] Trial 46 finished with value: -0.3873639416768455 and parameters: {'n_layers_yyx': 1, 'hidden_size_yyx_l0': 3, 'context_size_yyx': 4, 'num_mix_components_yyx': 4, 'context_extractor_yyx': 'gru', 'activation_func_yyx': 'ReLU', 'L2_weight_yyx': 0.000498565434889803, 'L_entropy_weight_yyx': 3.4907263883529927e-09, 'L_sep_weight_yyx': 4.875620699993383e-10, 'L_scale_weight_yyx': 2.199399176829336e-08, 'learning_rate_yyx': 0.0035131015053019316}. Best is trial 23 with value: -0.4237596257921343.
