[I 2026-03-18 22:21:07,017] Trial 47 finished with value: -1.897081660128188 and parameters: {'n_layers_yyx': 2, 'hidden_size_yyx_l0': 3, 'hidden_size_yyx_l1': 6, 'context_size_yyx': 4, 'num_mix_components_yyx': 5, 'context_extractor_yyx': 'lstm', 'activation_func_yyx': 'ReLU', 'L2_weight_yyx': 9.132211724390566e-06, 'L_entropy_weight_yyx': 1.0144494431714189e-10, 'L_sep_weight_yyx': 1.0606268912354323e-08, 'L_scale_weight_yyx': 2.992453863375429e-10, 'learning_rate_yyx': 0.00879897930411768}. Best is trial 47 with value: -1.897081660128188.
[I 2026-03-18 22:21:07,086] Trial 37 pruned. 
[I 2026-03-18 22:21:08,522] Trial 46 pruned. 
[I 2026-03-18 22:21:08,927] Trial 45 finished with value: -1.9371442496666973 and parameters: {'n_layers_yyx': 1, 'hidden_size_yyx_l0': 6, 'context_size_yyx': 4, 'num_mix_components_yyx': 2, 'context_extractor_yyx': 'gru', 'activation_func_yyx': 'ReLU', 'L2_weight_yyx': 3.1315726685120824e-10, 'L_entropy_weight_yyx': 6.396145637769765e-09, 'L_sep_weight_yyx': 5.365368528181556e-05, 'L_scale_weight_yyx': 0.00026610566693140614, 'learning_rate_yyx': 0.009932556246345045}. Best is trial 10 with value: -1.9395614910230956.
[I 2026-03-18 22:21:11,464] Trial 46 pruned. 
[I 2026-03-18 22:21:17,884] Trial 51 pruned. 
[I 2026-03-18 22:21:18,093] Trial 38 pruned. 
[I 2026-03-18 22:21:18,456] Trial 45 pruned. 
[I 2026-03-18 22:21:18,748] Trial 48 pruned. 
[I 2026-03-18 22:21:23,421] Trial 47 pruned. 
[I 2026-03-18 22:21:25,875] Trial 44 pruned. 
[I 2026-03-18 22:21:30,010] Trial 49 pruned. 
[I 2026-03-18 22:21:30,234] Trial 39 pruned. 
[I 2026-03-18 22:21:34,587] Trial 43 finished with value: -1.7776278162484218 and parameters: {'n_layers_yyx': 2, 'hidden_size_yyx_l0': 6, 'hidden_size_yyx_l1': 5, 'context_size_yyx': 4, 'num_mix_components_yyx': 3, 'context_extractor_yyx': 'gru', 'activation_func_yyx': 'GELU', 'L2_weight_yyx': 1.8436821342282346e-09, 'L_entropy_weight_yyx': 1.2624275538329616e-07, 'L_sep_weight_yyx': 9.466989900186985e-06, 'L_scale_weight_yyx': 2.4316573822943797e-06, 'learning_rate_yyx': 0.0067573290603195335}. Best is trial 7 with value: -1.7817573439472854.
[I 2026-03-18 22:21:35,732] Trial 48 pruned. 
[I 2026-03-18 22:21:41,947] Trial 50 pruned. 
[I 2026-03-18 22:21:51,013] Trial 45 pruned. 
[I 2026-03-18 22:21:55,518] Trial 46 finished with value: -1.7801819464172979 and parameters: {'n_layers_yyx': 2, 'hidden_size_yyx_l0': 5, 'hidden_size_yyx_l1': 5, 'context_size_yyx': 3, 'num_mix_components_yyx': 5, 'context_extractor_yyx': 'gru', 'activation_func_yyx': 'GELU', 'L2_weight_yyx': 1.1573458057576961e-07, 'L_entropy_weight_yyx': 0.00031361903968754373, 'L_sep_weight_yyx': 4.946996869056445e-10, 'L_scale_weight_yyx': 5.015510424170749e-10, 'learning_rate_yyx': 0.0035520747270441715}. Best is trial 4 with value: -1.7875800731928662.
[I 2026-03-18 22:21:59,671] Trial 49 pruned. 
[I 2026-03-18 22:22:00,521] Trial 34 finished with value: -1.8698354669337796 and parameters: {'n_layers_yyx': 1, 'hidden_size_yyx_l0': 6, 'context_size_yyx': 4, 'num_mix_components_yyx': 4, 'context_extractor_yyx': 'lstm', 'activation_func_yyx': 'ReLU', 'L2_weight_yyx': 1.6175444398439202e-10, 'L_entropy_weight_yyx': 6.636944931203073e-09, 'L_sep_weight_yyx': 3.5632154112221015e-06, 'L_scale_weight_yyx': 3.885607502750097e-08, 'learning_rate_yyx': 0.009937092726362813}. Best is trial 34 with value: -1.8698354669337796.
[I 2026-03-18 22:22:11,218] Trial 23 finished with value: -1.8517309705664198 and parameters: {'n_layers_yyx': 2, 'hidden_size_yyx_l0': 6, 'hidden_size_yyx_l1': 6, 'context_size_yyx': 2, 'num_mix_components_yyx': 3, 'context_extractor_yyx': 'gru', 'activation_func_yyx': 'GELU', 'L2_weight_yyx': 1.349594696168626e-06, 'L_entropy_weight_yyx': 3.1665600721340263e-09, 'L_sep_weight_yyx': 6.650819103634571e-07, 'L_scale_weight_yyx': 1.5847730711027543e-06, 'learning_rate_yyx': 0.007097777983408145}. Best is trial 12 with value: -1.8566309981104903.
[I 2026-03-18 22:22:12,815] Trial 52 pruned. 
[I 2026-03-18 22:22:16,577] Trial 46 pruned. 
[I 2026-03-18 22:22:20,960] Trial 28 finished with value: -1.928245502348675 and parameters: {'n_layers_yyx': 2, 'hidden_size_yyx_l0': 4, 'hidden_size_yyx_l1': 6, 'context_size_yyx': 2, 'num_mix_components_yyx': 3, 'context_extractor_yyx': 'gru', 'activation_func_yyx': 'GELU', 'L2_weight_yyx': 0.0006062161164166717, 'L_entropy_weight_yyx': 6.033934524632379e-05, 'L_sep_weight_yyx': 2.7924067386806248e-05, 'L_scale_weight_yyx': 4.397228195623779e-09, 'learning_rate_yyx': 0.006174330230262426}. Best is trial 14 with value: -1.9337542258067992.
[I 2026-03-18 22:22:21,698] Trial 24 pruned. 
[I 2026-03-18 22:22:22,923] Trial 44 finished with value: -1.8514540706007991 and parameters: {'n_layers_yyx': 1, 'hidden_size_yyx_l0': 5, 'context_size_yyx': 4, 'num_mix_components_yyx': 4, 'context_extractor_yyx': 'gru', 'activation_func_yyx': 'ReLU', 'L2_weight_yyx': 9.867810793729672e-09, 'L_entropy_weight_yyx': 4.759419386614752e-09, 'L_sep_weight_yyx': 2.1169002115842018e-10, 'L_scale_weight_yyx': 8.43646478640769e-09, 'learning_rate_yyx': 0.005078842925912819}. Best is trial 9 with value: -1.8570869006965198.
[I 2026-03-18 22:22:24,571] Trial 50 pruned. 
[I 2026-03-18 22:22:26,257] Trial 40 pruned. 
[I 2026-03-18 22:22:29,200] Trial 44 pruned. 
[I 2026-03-18 22:22:32,629] Trial 29 pruned. 
[I 2026-03-18 22:22:32,764] Trial 53 pruned. 
[I 2026-03-18 22:22:33,425] Trial 45 pruned. 
[I 2026-03-18 22:22:33,483] Trial 25 pruned. 
[I 2026-03-18 22:22:36,175] Trial 46 finished with value: -1.9354802054839786 and parameters: {'n_layers_yyx': 2, 'hidden_size_yyx_l0': 5, 'hidden_size_yyx_l1': 6, 'context_size_yyx': 4, 'num_mix_components_yyx': 3, 'context_extractor_yyx': 'gru', 'activation_func_yyx': 'GELU', 'L2_weight_yyx': 1.2241610454044955e-09, 'L_entropy_weight_yyx': 2.2646797557945907e-10, 'L_sep_weight_yyx': 0.0009818329220037012, 'L_scale_weight_yyx': 4.34730117789088e-06, 'learning_rate_yyx': 0.008205009757676312}. Best is trial 10 with value: -1.9395614910230956.
[I 2026-03-18 22:22:37,973] Trial 51 pruned. 
[I 2026-03-18 22:22:38,432] Trial 47 pruned. 
[I 2026-03-18 22:22:42,659] Trial 30 pruned. 
[I 2026-03-18 22:22:42,788] Trial 54 pruned. 
[I 2026-03-18 22:22:45,651] Trial 47 finished with value: -1.8470042049572075 and parameters: {'n_layers_yyx': 2, 'hidden_size_yyx_l0': 3, 'hidden_size_yyx_l1': 6, 'context_size_yyx': 3, 'num_mix_components_yyx': 4, 'context_extractor_yyx': 'lstm', 'activation_func_yyx': 'GELU', 'L2_weight_yyx': 2.431357281034789e-09, 'L_entropy_weight_yyx': 8.452651613711894e-07, 'L_sep_weight_yyx': 0.00022073893438938173, 'L_scale_weight_yyx': 5.747662707447503e-06, 'learning_rate_yyx': 0.009949716874553462}. Best is trial 16 with value: -1.8488733665890609.
[I 2026-03-18 22:22:46,025] Trial 47 pruned. 
[I 2026-03-18 22:22:47,035] Trial 47 pruned. 
[I 2026-03-18 22:22:47,260] Trial 41 pruned. 
[I 2026-03-18 22:22:49,754] Trial 45 pruned. 
[I 2026-03-18 22:22:50,010] Trial 34 finished with value: -1.7897586706912878 and parameters: {'n_layers_yyx': 2, 'hidden_size_yyx_l0': 6, 'hidden_size_yyx_l1': 4, 'context_size_yyx': 4, 'num_mix_components_yyx': 3, 'context_extractor_yyx': 'gru', 'activation_func_yyx': 'Tanh', 'L2_weight_yyx': 5.1328237582618394e-05, 'L_entropy_weight_yyx': 6.442552463327704e-10, 'L_sep_weight_yyx': 2.1746799759893904e-06, 'L_scale_weight_yyx': 0.00011287941361123643, 'learning_rate_yyx': 0.006376565632559699}. Best is trial 16 with value: -1.790272919625947.
[I 2026-03-18 22:22:53,200] Trial 55 pruned. 
[I 2026-03-18 22:22:54,031] Trial 31 pruned. 
[I 2026-03-18 22:22:55,115] Trial 46 pruned. 
[I 2026-03-18 22:23:00,812] Trial 46 pruned. 
[I 2026-03-18 22:23:03,347] Trial 56 pruned. 
[I 2026-03-18 22:23:09,067] Trial 48 pruned. 
[I 2026-03-18 22:23:14,747] Trial 57 pruned. 
[I 2026-03-18 22:23:16,044] Trial 32 pruned. 
[I 2026-03-18 22:23:18,522] Trial 42 finished with value: -1.8899415451635846 and parameters: {'n_layers_yyx': 2, 'hidden_size_yyx_l0': 5, 'hidden_size_yyx_l1': 3, 'context_size_yyx': 2, 'num_mix_components_yyx': 5, 'context_extractor_yyx': 'lstm', 'activation_func_yyx': 'Tanh', 'L2_weight_yyx': 0.000803924784913116, 'L_entropy_weight_yyx': 1.562182874513809e-07, 'L_sep_weight_yyx': 4.841889150077698e-09, 'L_scale_weight_yyx': 3.007955213643833e-06, 'learning_rate_yyx': 0.005389548500870786}. Best is trial 5 with value: -1.89157565728699.
[I 2026-03-18 22:23:27,996] Trial 26 pruned. 
[I 2026-03-18 22:23:30,237] Trial 49 pruned. 
[I 2026-03-18 22:23:32,053] Trial 48 pruned. 
[I 2026-03-18 22:23:32,959] Trial 52 pruned. 
[I 2026-03-18 22:23:35,553] Trial 58 pruned. 
[I 2026-03-18 22:23:38,552] Trial 27 pruned. 
[I 2026-03-18 22:23:40,474] Trial 43 pruned. 
[I 2026-03-18 22:23:42,368] Trial 48 pruned. 
[I 2026-03-18 22:23:43,921] Trial 35 pruned. 
[I 2026-03-18 22:23:44,709] Trial 42 pruned. 
[I 2026-03-18 22:23:45,979] Trial 59 pruned. 
[I 2026-03-18 22:23:46,496] Trial 51 finished with value: -1.837517688775013 and parameters: {'n_layers_yyx': 2, 'hidden_size_yyx_l0': 6, 'hidden_size_yyx_l1': 4, 'context_size_yyx': 4, 'num_mix_components_yyx': 1, 'context_extractor_yyx': 'gru', 'activation_func_yyx': 'GELU', 'L2_weight_yyx': 5.5081154363631666e-06, 'L_entropy_weight_yyx': 7.534537938823262e-10, 'L_sep_weight_yyx': 3.217938102130379e-10, 'L_scale_weight_yyx': 9.141942069160104e-07, 'learning_rate_yyx': 0.006672389353352682}. Best is trial 9 with value: -1.853392962523822.
[I 2026-03-18 22:23:49,966] Trial 47 pruned. 
[I 2026-03-18 22:23:50,230] Trial 28 pruned. 
[I 2026-03-18 22:23:53,936] Trial 49 pruned. 
[I 2026-03-18 22:23:56,228] Trial 53 pruned. 
[I 2026-03-18 22:24:07,050] Trial 43 pruned. 
[I 2026-03-18 22:24:07,075] Trial 60 pruned. 
[I 2026-03-18 22:24:08,665] Trial 33 pruned. 
[I 2026-03-18 22:24:16,075] Trial 50 pruned. 
[I 2026-03-18 22:24:18,109] Trial 54 pruned. 
[I 2026-03-18 22:24:31,067] Trial 46 pruned. 
[I 2026-03-18 22:24:37,741] Trial 51 pruned. 
[I 2026-03-18 22:24:41,980] Trial 35 pruned. 
[I 2026-03-18 22:24:46,684] Trial 48 pruned. 
[I 2026-03-18 22:24:53,936] Trial 47 pruned. 
[I 2026-03-18 22:25:02,726] Trial 44 pruned. 
[I 2026-03-18 22:25:04,512] Trial 36 pruned. 
[I 2026-03-18 22:25:04,983] Trial 48 pruned. 
[I 2026-03-18 22:25:15,269] Trial 36 finished with value: -1.7639563604797979 and parameters: {'n_layers_yyx': 2, 'hidden_size_yyx_l0': 5, 'hidden_size_yyx_l1': 5, 'context_size_yyx': 4, 'num_mix_components_yyx': 3, 'context_extractor_yyx': 'gru', 'activation_func_yyx': 'Tanh', 'L2_weight_yyx': 0.00034850384514085005, 'L_entropy_weight_yyx': 5.111651418606685e-10, 'L_sep_weight_yyx': 8.209422459550093e-05, 'L_scale_weight_yyx': 1.7458776090209887e-10, 'learning_rate_yyx': 0.006632766756554762}. Best is trial 16 with value: -1.790272919625947.
[I 2026-03-18 22:25:16,146] Trial 37 pruned. 
[I 2026-03-18 22:25:16,828] Trial 49 pruned. 
[I 2026-03-18 22:25:25,690] Trial 37 pruned. 
[I 2026-03-18 22:25:27,859] Trial 50 pruned. 
[I 2026-03-18 22:25:32,618] Trial 44 finished with value: -1.890528400795558 and parameters: {'n_layers_yyx': 2, 'hidden_size_yyx_l0': 6, 'hidden_size_yyx_l1': 4, 'context_size_yyx': 1, 'num_mix_components_yyx': 5, 'context_extractor_yyx': 'lstm', 'activation_func_yyx': 'Tanh', 'L2_weight_yyx': 4.095908161224425e-05, 'L_entropy_weight_yyx': 5.036629436695844e-09, 'L_sep_weight_yyx': 7.61322314221537e-09, 'L_scale_weight_yyx': 0.0005015411850490091, 'learning_rate_yyx': 0.008096969044397415}. Best is trial 5 with value: -1.89157565728699.
[I 2026-03-18 22:25:47,193] Trial 38 pruned. 
[I 2026-03-18 22:25:53,020] Trial 45 pruned. 
[I 2026-03-18 22:25:54,513] Trial 50 pruned. 
[I 2026-03-18 22:25:57,721] Trial 39 pruned. 
[I 2026-03-18 22:25:57,835] Trial 45 pruned. 
[I 2026-03-18 22:26:01,748] Trial 52 finished with value: -1.850547383414815 and parameters: {'n_layers_yyx': 2, 'hidden_size_yyx_l0': 6, 'hidden_size_yyx_l1': 4, 'context_size_yyx': 3, 'num_mix_components_yyx': 2, 'context_extractor_yyx': 'gru', 'activation_func_yyx': 'Tanh', 'L2_weight_yyx': 4.148853346505748e-08, 'L_entropy_weight_yyx': 1.7609546154239768e-10, 'L_sep_weight_yyx': 4.543029817915047e-08, 'L_scale_weight_yyx': 2.261994047935058e-10, 'learning_rate_yyx': 0.0062769014951480325}. Best is trial 9 with value: -1.853392962523822.
[I 2026-03-18 22:26:03,466] Trial 46 pruned. 
[I 2026-03-18 22:26:08,144] Trial 46 pruned. 
[I 2026-03-18 22:26:09,329] Trial 48 finished with value: -1.9362118865865783 and parameters: {'n_layers_yyx': 1, 'hidden_size_yyx_l0': 4, 'context_size_yyx': 1, 'num_mix_components_yyx': 5, 'context_extractor_yyx': 'gru', 'activation_func_yyx': 'ReLU', 'L2_weight_yyx': 1.880497194060332e-07, 'L_entropy_weight_yyx': 1.6074583125655311e-09, 'L_sep_weight_yyx': 0.00013688507179258433, 'L_scale_weight_yyx': 3.8701165747449695e-05, 'learning_rate_yyx': 0.003393300651947853}. Best is trial 10 with value: -1.9395614910230956.
[I 2026-03-18 22:26:10,305] Trial 55 finished with value: -1.8982689846521137 and parameters: {'n_layers_yyx': 2, 'hidden_size_yyx_l0': 3, 'hidden_size_yyx_l1': 6, 'context_size_yyx': 4, 'num_mix_components_yyx': 3, 'context_extractor_yyx': 'lstm', 'activation_func_yyx': 'ReLU', 'L2_weight_yyx': 8.370894674249711e-05, 'L_entropy_weight_yyx': 5.525940912897711e-10, 'L_sep_weight_yyx': 1.788321120048456e-08, 'L_scale_weight_yyx': 2.8957904529246043e-09, 'learning_rate_yyx': 0.009136345197189305}. Best is trial 55 with value: -1.8982689846521137.
[I 2026-03-18 22:26:16,704] Trial 49 finished with value: -1.8544310888976416 and parameters: {'n_layers_yyx': 1, 'hidden_size_yyx_l0': 6, 'context_size_yyx': 3, 'num_mix_components_yyx': 4, 'context_extractor_yyx': 'lstm', 'activation_func_yyx': 'Tanh', 'L2_weight_yyx': 5.657973358291306e-06, 'L_entropy_weight_yyx': 1.222623143239684e-07, 'L_sep_weight_yyx': 7.149952805308739e-10, 'L_scale_weight_yyx': 6.025331549510963e-09, 'learning_rate_yyx': 0.009866288574173663}. Best is trial 9 with value: -1.8570869006965198.
[I 2026-03-18 22:26:20,152] Trial 49 pruned. 
[I 2026-03-18 22:26:22,054] Trial 47 finished with value: -1.7776506520280935 and parameters: {'n_layers_yyx': 2, 'hidden_size_yyx_l0': 5, 'hidden_size_yyx_l1': 5, 'context_size_yyx': 4, 'num_mix_components_yyx': 3, 'context_extractor_yyx': 'gru', 'activation_func_yyx': 'GELU', 'L2_weight_yyx': 9.795693448077866e-10, 'L_entropy_weight_yyx': 1.971783642613844e-08, 'L_sep_weight_yyx': 3.7990062519996575e-08, 'L_scale_weight_yyx': 0.00022106468330087734, 'learning_rate_yyx': 0.0005925727715495706}. Best is trial 7 with value: -1.7817573439472854.
[I 2026-03-18 22:26:22,288] Trial 49 finished with value: -1.8482286584993817 and parameters: {'n_layers_yyx': 1, 'hidden_size_yyx_l0': 4, 'context_size_yyx': 4, 'num_mix_components_yyx': 5, 'context_extractor_yyx': 'gru', 'activation_func_yyx': 'ReLU', 'L2_weight_yyx': 4.408398926256933e-10, 'L_entropy_weight_yyx': 6.297283778002488e-08, 'L_sep_weight_yyx': 2.6574576859427853e-10, 'L_scale_weight_yyx': 2.0165202841590715e-06, 'learning_rate_yyx': 0.00573600729265398}. Best is trial 0 with value: -1.8516305051550026.
[I 2026-03-18 22:26:22,905] Trial 52 finished with value: -1.8475427831040683 and parameters: {'n_layers_yyx': 2, 'hidden_size_yyx_l0': 2, 'hidden_size_yyx_l1': 4, 'context_size_yyx': 3, 'num_mix_components_yyx': 5, 'context_extractor_yyx': 'lstm', 'activation_func_yyx': 'GELU', 'L2_weight_yyx': 1.0021787448299741e-08, 'L_entropy_weight_yyx': 0.0001044567446220154, 'L_sep_weight_yyx': 5.784149457426324e-05, 'L_scale_weight_yyx': 2.2060681432919e-09, 'learning_rate_yyx': 0.008803079988346712}. Best is trial 16 with value: -1.8488733665890609.
[I 2026-03-18 22:26:24,159] Trial 51 pruned. 
[I 2026-03-18 22:26:30,313] Trial 47 pruned. 
[I 2026-03-18 22:26:30,572] Trial 50 pruned. 
[I 2026-03-18 22:26:32,032] Trial 48 pruned. 
[I 2026-03-18 22:26:36,715] Trial 34 finished with value: -1.930367159411323 and parameters: {'n_layers_yyx': 2, 'hidden_size_yyx_l0': 5, 'hidden_size_yyx_l1': 5, 'context_size_yyx': 2, 'num_mix_components_yyx': 5, 'context_extractor_yyx': 'gru', 'activation_func_yyx': 'GELU', 'L2_weight_yyx': 1.8540814839152272e-06, 'L_entropy_weight_yyx': 0.0009032659583442768, 'L_sep_weight_yyx': 2.0282235420810373e-06, 'L_scale_weight_yyx': 2.8539058235914412e-08, 'learning_rate_yyx': 0.008578449943340666}. Best is trial 14 with value: -1.9337542258067992.
[I 2026-03-18 22:26:43,328] Trial 49 pruned. 
[I 2026-03-18 22:26:44,710] Trial 38 finished with value: -1.867601954294536 and parameters: {'n_layers_yyx': 2, 'hidden_size_yyx_l0': 6, 'hidden_size_yyx_l1': 4, 'context_size_yyx': 4, 'num_mix_components_yyx': 5, 'context_extractor_yyx': 'gru', 'activation_func_yyx': 'ReLU', 'L2_weight_yyx': 1.0579114281776526e-07, 'L_entropy_weight_yyx': 5.6831865918388295e-05, 'L_sep_weight_yyx': 2.051679602164299e-10, 'L_scale_weight_yyx': 5.9170685541554084e-05, 'learning_rate_yyx': 0.007897687914192871}. Best is trial 34 with value: -1.8698354669337796.
[I 2026-03-18 22:26:45,512] Trial 51 pruned. 
[I 2026-03-18 22:26:49,141] Trial 29 finished with value: -1.8570256329045391 and parameters: {'n_layers_yyx': 2, 'hidden_size_yyx_l0': 5, 'hidden_size_yyx_l1': 4, 'context_size_yyx': 2, 'num_mix_components_yyx': 4, 'context_extractor_yyx': 'gru', 'activation_func_yyx': 'Tanh', 'L2_weight_yyx': 0.0009522173822462464, 'L_entropy_weight_yyx': 1.1589119856516436e-07, 'L_sep_weight_yyx': 1.0607972186173603e-06, 'L_scale_weight_yyx': 2.7107670764954296e-07, 'learning_rate_yyx': 0.008563424215717578}. Best is trial 29 with value: -1.8570256329045391.
[I 2026-03-18 22:26:52,262] Trial 51 pruned. 
[I 2026-03-18 22:27:03,913] Trial 56 pruned. 
[I 2026-03-18 22:27:05,840] Trial 39 pruned. 
[I 2026-03-18 22:27:06,922] Trial 52 pruned. 
[I 2026-03-18 22:27:08,721] Trial 61 finished with value: -1.8027478923320164 and parameters: {'n_layers_yyx': 1, 'hidden_size_yyx_l0': 4, 'context_size_yyx': 3, 'num_mix_components_yyx': 5, 'context_extractor_yyx': 'gru', 'activation_func_yyx': 'GELU', 'L2_weight_yyx': 1.011829751160963e-09, 'L_entropy_weight_yyx': 8.664355258973871e-07, 'L_sep_weight_yyx': 0.00025851275278038915, 'L_scale_weight_yyx': 1.2218095122412402e-05, 'learning_rate_yyx': 0.002391014352299906}. Best is trial 27 with value: -1.8062570642302185.
[I 2026-03-18 22:27:09,925] Trial 30 pruned. 
[I 2026-03-18 22:27:16,830] Trial 40 pruned. 
[I 2026-03-18 22:27:17,756] Trial 62 pruned. 
[I 2026-03-18 22:27:27,804] Trial 41 pruned. 
[I 2026-03-18 22:27:30,360] Trial 50 finished with value: -1.8518626212412834 and parameters: {'n_layers_yyx': 1, 'hidden_size_yyx_l0': 6, 'context_size_yyx': 3, 'num_mix_components_yyx': 3, 'context_extractor_yyx': 'lstm', 'activation_func_yyx': 'Tanh', 'L2_weight_yyx': 6.815683176525224e-06, 'L_entropy_weight_yyx': 1.1553295150909732e-07, 'L_sep_weight_yyx': 2.763931949704495e-10, 'L_scale_weight_yyx': 8.130659857912194e-08, 'learning_rate_yyx': 0.009448160778292445}. Best is trial 9 with value: -1.8570869006965198.
[I 2026-03-18 22:27:32,084] Trial 31 pruned. 
[I 2026-03-18 22:27:40,390] Trial 52 finished with value: -1.852442603266578 and parameters: {'n_layers_yyx': 1, 'hidden_size_yyx_l0': 6, 'context_size_yyx': 4, 'num_mix_components_yyx': 5, 'context_extractor_yyx': 'gru', 'activation_func_yyx': 'ReLU', 'L2_weight_yyx': 3.222247170950897e-05, 'L_entropy_weight_yyx': 3.8667992040404925e-06, 'L_sep_weight_yyx': 3.408125756999885e-10, 'L_scale_weight_yyx': 1.8545506762848207e-09, 'learning_rate_yyx': 0.007119859380109163}. Best is trial 1 with value: -1.8555367853768732.
[I 2026-03-18 22:27:51,487] Trial 52 finished with value: -1.937141679410945 and parameters: {'n_layers_yyx': 1, 'hidden_size_yyx_l0': 6, 'context_size_yyx': 4, 'num_mix_components_yyx': 2, 'context_extractor_yyx': 'gru', 'activation_func_yyx': 'ReLU', 'L2_weight_yyx': 2.0023184766029137e-10, 'L_entropy_weight_yyx': 4.20332834036018e-09, 'L_sep_weight_yyx': 6.0088395289483564e-05, 'L_scale_weight_yyx': 0.0004356579650613378, 'learning_rate_yyx': 0.009975879128869866}. Best is trial 10 with value: -1.9395614910230956.
[I 2026-03-18 22:28:01,804] Trial 47 finished with value: -1.8248339852432098 and parameters: {'n_layers_yyx': 2, 'hidden_size_yyx_l0': 2, 'hidden_size_yyx_l1': 5, 'context_size_yyx': 1, 'num_mix_components_yyx': 5, 'context_extractor_yyx': 'lstm', 'activation_func_yyx': 'GELU', 'L2_weight_yyx': 2.6625158175110637e-06, 'L_entropy_weight_yyx': 9.088138055254677e-09, 'L_sep_weight_yyx': 8.434989955751002e-08, 'L_scale_weight_yyx': 1.520034912123083e-10, 'learning_rate_yyx': 0.004943292954173208}. Best is trial 5 with value: -1.89157565728699.
[I 2026-03-18 22:28:06,497] Trial 53 finished with value: -1.855205638988598 and parameters: {'n_layers_yyx': 2, 'hidden_size_yyx_l0': 6, 'hidden_size_yyx_l1': 5, 'context_size_yyx': 3, 'num_mix_components_yyx': 2, 'context_extractor_yyx': 'gru', 'activation_func_yyx': 'Tanh', 'L2_weight_yyx': 5.063194731032189e-08, 'L_entropy_weight_yyx': 3.855878155434613e-10, 'L_sep_weight_yyx': 5.4114598335328415e-08, 'L_scale_weight_yyx': 2.0948702362139326e-10, 'learning_rate_yyx': 0.0077158361326641325}. Best is trial 53 with value: -1.855205638988598.
[I 2026-03-18 22:28:10,063] Trial 53 finished with value: -1.8475435516474839 and parameters: {'n_layers_yyx': 2, 'hidden_size_yyx_l0': 2, 'hidden_size_yyx_l1': 4, 'context_size_yyx': 3, 'num_mix_components_yyx': 5, 'context_extractor_yyx': 'lstm', 'activation_func_yyx': 'GELU', 'L2_weight_yyx': 4.502678343635977e-09, 'L_entropy_weight_yyx': 0.00022296365063391002, 'L_sep_weight_yyx': 0.00014795876625252775, 'L_scale_weight_yyx': 5.496136379127717e-10, 'learning_rate_yyx': 0.008851451809916113}. Best is trial 16 with value: -1.8488733665890609.
