[I 2026-03-18 16:32:47,762] Trial 28 finished with value: -0.4286294943038893 and parameters: {'n_layers_yyx': 2, 'hidden_size_yyx_l0': 3, 'hidden_size_yyx_l1': 3, 'context_size_yyx': 3, 'num_mix_components_yyx': 4, 'context_extractor_yyx': 'gru', 'activation_func_yyx': 'Tanh', 'L2_weight_yyx': 7.241814289645954e-09, 'L_entropy_weight_yyx': 1.0181402693424345e-10, 'L_sep_weight_yyx': 9.970985092510002e-07, 'L_scale_weight_yyx': 4.1761693913940627e-10, 'learning_rate_yyx': 0.009250281287549567}. Best is trial 28 with value: -0.4286294943038893.
[I 2026-03-18 16:32:48,930] Trial 30 pruned. 
[I 2026-03-18 16:32:49,031] Trial 25 finished with value: -0.4167749741498162 and parameters: {'n_layers_yyx': 1, 'hidden_size_yyx_l0': 5, 'context_size_yyx': 3, 'num_mix_components_yyx': 4, 'context_extractor_yyx': 'lstm', 'activation_func_yyx': 'Tanh', 'L2_weight_yyx': 3.252723405482851e-10, 'L_entropy_weight_yyx': 4.944419123196685e-10, 'L_sep_weight_yyx': 1.1718827996835596e-07, 'L_scale_weight_yyx': 5.622114243820394e-08, 'learning_rate_yyx': 0.004015507707971017}. Best is trial 1 with value: -0.43281404005115615.
[I 2026-03-18 16:32:50,491] Trial 16 pruned. 
[I 2026-03-18 16:32:51,962] Trial 31 pruned. 
[I 2026-03-18 16:32:52,097] Trial 25 pruned. 
[I 2026-03-18 16:32:52,944] Trial 2 pruned. 
[I 2026-03-18 16:32:54,149] Trial 26 pruned. 
[I 2026-03-18 16:32:55,232] Trial 26 pruned. 
[I 2026-03-18 16:32:55,243] Trial 32 pruned. 
[I 2026-03-18 16:32:55,937] Trial 14 pruned. 
[I 2026-03-18 16:32:56,633] Trial 17 pruned. 
[I 2026-03-18 16:32:58,375] Trial 33 pruned. 
[I 2026-03-18 16:32:59,015] Trial 15 pruned. 
[I 2026-03-18 16:33:01,122] Trial 31 pruned. 
[I 2026-03-18 16:33:01,725] Trial 34 pruned. 
[I 2026-03-18 16:33:01,872] Trial 23 finished with value: -0.4237596257921343 and parameters: {'n_layers_yyx': 1, 'hidden_size_yyx_l0': 4, 'context_size_yyx': 4, 'num_mix_components_yyx': 5, 'context_extractor_yyx': 'lstm', 'activation_func_yyx': 'ReLU', 'L2_weight_yyx': 8.423787741922727e-07, 'L_entropy_weight_yyx': 8.253674424831604e-10, 'L_sep_weight_yyx': 4.1079884769598635e-08, 'L_scale_weight_yyx': 4.266268054426548e-10, 'learning_rate_yyx': 0.007541236672285208}. Best is trial 23 with value: -0.4237596257921343.
[I 2026-03-18 16:33:02,362] Trial 16 pruned. 
[I 2026-03-18 16:33:02,778] Trial 18 pruned. 
[I 2026-03-18 16:33:04,574] Trial 32 pruned. 
[I 2026-03-18 16:33:04,778] Trial 25 finished with value: -0.44456373279677824 and parameters: {'n_layers_yyx': 1, 'hidden_size_yyx_l0': 5, 'context_size_yyx': 4, 'num_mix_components_yyx': 2, 'context_extractor_yyx': 'lstm', 'activation_func_yyx': 'Tanh', 'L2_weight_yyx': 2.7990122629666815e-05, 'L_entropy_weight_yyx': 2.3249295680369946e-09, 'L_sep_weight_yyx': 5.290185197872457e-07, 'L_scale_weight_yyx': 1.7496276210512415e-08, 'learning_rate_yyx': 0.003888363497525448}. Best is trial 25 with value: -0.44456373279677824.
[I 2026-03-18 16:33:05,474] Trial 35 pruned. 
[I 2026-03-18 16:33:05,515] Trial 17 pruned. 
[I 2026-03-18 16:33:05,904] Trial 19 pruned. 
[I 2026-03-18 16:33:07,271] Trial 18 finished with value: -0.39296994046899186 and parameters: {'n_layers_yyx': 1, 'hidden_size_yyx_l0': 5, 'context_size_yyx': 2, 'num_mix_components_yyx': 1, 'context_extractor_yyx': 'gru', 'activation_func_yyx': 'GELU', 'L2_weight_yyx': 1.0352314528840727e-10, 'L_entropy_weight_yyx': 4.154549571490943e-06, 'L_sep_weight_yyx': 3.099209040312409e-08, 'L_scale_weight_yyx': 0.00013446642619001974, 'learning_rate_yyx': 0.0007851159436484862}. Best is trial 2 with value: -0.4289537553816757.
[I 2026-03-18 16:33:07,648] Trial 10 finished with value: -0.38793279216754545 and parameters: {'n_layers_yyx': 2, 'hidden_size_yyx_l0': 3, 'hidden_size_yyx_l1': 2, 'context_size_yyx': 2, 'num_mix_components_yyx': 2, 'context_extractor_yyx': 'gru', 'activation_func_yyx': 'Tanh', 'L2_weight_yyx': 1.3545410358400836e-08, 'L_entropy_weight_yyx': 7.815160354045073e-05, 'L_sep_weight_yyx': 6.092671358543268e-06, 'L_scale_weight_yyx': 3.1523944372765225e-06, 'learning_rate_yyx': 0.0015059827674472758}. Best is trial 9 with value: -0.430995315221072.
[I 2026-03-18 16:33:09,173] Trial 27 pruned. 
[I 2026-03-18 16:33:09,390] Trial 20 pruned. 
[I 2026-03-18 16:33:10,627] Trial 29 finished with value: -0.4226142717957866 and parameters: {'n_layers_yyx': 2, 'hidden_size_yyx_l0': 3, 'hidden_size_yyx_l1': 3, 'context_size_yyx': 3, 'num_mix_components_yyx': 4, 'context_extractor_yyx': 'gru', 'activation_func_yyx': 'Tanh', 'L2_weight_yyx': 3.4262924365154217e-09, 'L_entropy_weight_yyx': 1.5290078547082515e-10, 'L_sep_weight_yyx': 6.727503432074349e-07, 'L_scale_weight_yyx': 6.143663278880703e-10, 'learning_rate_yyx': 0.009849191807149148}. Best is trial 28 with value: -0.4286294943038893.
[I 2026-03-18 16:33:10,934] Trial 19 pruned. 
[I 2026-03-18 16:33:11,386] Trial 33 pruned. 
[I 2026-03-18 16:33:11,506] Trial 11 pruned. 
[I 2026-03-18 16:33:11,804] Trial 36 pruned. 
[I 2026-03-18 16:33:13,323] Trial 1 finished with value: -2.7889067289265905 and parameters: {'n_layers_yyx': 1, 'hidden_size_yyx_l0': 3, 'context_size_yyx': 2, 'num_mix_components_yyx': 5, 'context_extractor_yyx': 'gru', 'activation_func_yyx': 'GELU', 'L2_weight_yyx': 4.6507219691485967e-10, 'L_entropy_weight_yyx': 4.8443688949527544e-05, 'L_sep_weight_yyx': 3.837510403881629e-10, 'L_scale_weight_yyx': 3.226544849779207e-06, 'learning_rate_yyx': 0.0016592328843611625}. Best is trial 0 with value: -2.792252838699443.
[I 2026-03-18 16:33:15,265] Trial 33 finished with value: -0.4275962428042763 and parameters: {'n_layers_yyx': 2, 'hidden_size_yyx_l0': 2, 'hidden_size_yyx_l1': 4, 'context_size_yyx': 4, 'num_mix_components_yyx': 2, 'context_extractor_yyx': 'gru', 'activation_func_yyx': 'Tanh', 'L2_weight_yyx': 1.1828444442181195e-10, 'L_entropy_weight_yyx': 2.733785320618532e-07, 'L_sep_weight_yyx': 1.0119559357443889e-10, 'L_scale_weight_yyx': 3.9034954462758395e-07, 'learning_rate_yyx': 0.006793156256809028}. Best is trial 27 with value: -0.4490980969124903.
[I 2026-03-18 16:33:17,230] Trial 30 pruned. 
[I 2026-03-18 16:33:17,497] Trial 20 pruned. 
[I 2026-03-18 16:33:17,565] Trial 27 finished with value: -0.4054274426156153 and parameters: {'n_layers_yyx': 2, 'hidden_size_yyx_l0': 5, 'hidden_size_yyx_l1': 6, 'context_size_yyx': 2, 'num_mix_components_yyx': 5, 'context_extractor_yyx': 'lstm', 'activation_func_yyx': 'Tanh', 'L2_weight_yyx': 0.00016903538549686126, 'L_entropy_weight_yyx': 5.815748967842099e-10, 'L_sep_weight_yyx': 4.941591626716561e-05, 'L_scale_weight_yyx': 4.731304204500469e-06, 'learning_rate_yyx': 0.0023279302707316304}. Best is trial 7 with value: -0.44963234349300985.
[I 2026-03-18 16:33:17,761] Trial 34 pruned. 
[I 2026-03-18 16:33:18,428] Trial 28 finished with value: -0.4153360183763061 and parameters: {'n_layers_yyx': 2, 'hidden_size_yyx_l0': 4, 'hidden_size_yyx_l1': 4, 'context_size_yyx': 2, 'num_mix_components_yyx': 2, 'context_extractor_yyx': 'lstm', 'activation_func_yyx': 'Tanh', 'L2_weight_yyx': 7.77920792513298e-08, 'L_entropy_weight_yyx': 1.7976102903773155e-07, 'L_sep_weight_yyx': 8.140660336780286e-05, 'L_scale_weight_yyx': 7.452903931312723e-09, 'learning_rate_yyx': 0.0015908374487812928}. Best is trial 28 with value: -0.4153360183763061.
[I 2026-03-18 16:33:18,673] Trial 34 pruned. 
[I 2026-03-18 16:33:18,821] Trial 12 pruned. 
[I 2026-03-18 16:33:20,751] Trial 35 pruned. 
[I 2026-03-18 16:33:20,880] Trial 21 pruned. 
[I 2026-03-18 16:33:20,928] Trial 26 pruned. 
[I 2026-03-18 16:33:24,132] Trial 28 pruned. 
[I 2026-03-18 16:33:24,721] Trial 1 finished with value: -2.77191214725889 and parameters: {'n_layers_yyx': 2, 'hidden_size_yyx_l0': 2, 'hidden_size_yyx_l1': 2, 'context_size_yyx': 3, 'num_mix_components_yyx': 5, 'context_extractor_yyx': 'gru', 'activation_func_yyx': 'GELU', 'L2_weight_yyx': 7.662658982213315e-10, 'L_entropy_weight_yyx': 5.586943192910718e-07, 'L_sep_weight_yyx': 3.291961946731513e-05, 'L_scale_weight_yyx': 1.7241615373283065e-05, 'learning_rate_yyx': 0.0005818977205514962}. Best is trial 0 with value: -2.791594042385921.
[I 2026-03-18 16:33:24,752] Trial 24 finished with value: -0.41350227096132447 and parameters: {'n_layers_yyx': 1, 'hidden_size_yyx_l0': 4, 'context_size_yyx': 3, 'num_mix_components_yyx': 4, 'context_extractor_yyx': 'lstm', 'activation_func_yyx': 'ReLU', 'L2_weight_yyx': 2.1369457533735196e-06, 'L_entropy_weight_yyx': 6.806785397844092e-10, 'L_sep_weight_yyx': 1.1550232577010986e-07, 'L_scale_weight_yyx': 5.10664606277953e-10, 'learning_rate_yyx': 0.009567765444529003}. Best is trial 23 with value: -0.4237596257921343.
[I 2026-03-18 16:33:24,792] Trial 29 pruned. 
[I 2026-03-18 16:33:25,506] Trial 21 pruned. 
[I 2026-03-18 16:33:25,537] Trial 13 pruned. 
[I 2026-03-18 16:33:26,382] Trial 22 pruned. 
[I 2026-03-18 16:33:27,238] Trial 36 pruned. 
[I 2026-03-18 16:33:27,663] Trial 25 pruned. 
[I 2026-03-18 16:33:27,691] Trial 4 finished with value: -2.801406152327738 and parameters: {'n_layers_yyx': 1, 'hidden_size_yyx_l0': 6, 'context_size_yyx': 4, 'num_mix_components_yyx': 4, 'context_extractor_yyx': 'lstm', 'activation_func_yyx': 'ReLU', 'L2_weight_yyx': 5.222260261422739e-07, 'L_entropy_weight_yyx': 0.0002189884633804979, 'L_sep_weight_yyx': 7.039952103823046e-09, 'L_scale_weight_yyx': 4.823483604892239e-06, 'learning_rate_yyx': 0.006319361753814144}. Best is trial 4 with value: -2.801406152327738.
[I 2026-03-18 16:33:27,867] Trial 4 finished with value: -2.782491554706822 and parameters: {'n_layers_yyx': 2, 'hidden_size_yyx_l0': 3, 'hidden_size_yyx_l1': 2, 'context_size_yyx': 3, 'num_mix_components_yyx': 3, 'context_extractor_yyx': 'lstm', 'activation_func_yyx': 'Tanh', 'L2_weight_yyx': 1.7867869264550208e-07, 'L_entropy_weight_yyx': 1.08070852786083e-10, 'L_sep_weight_yyx': 1.0512939965214977e-07, 'L_scale_weight_yyx': 5.374726187262936e-06, 'learning_rate_yyx': 0.004096824656021659}. Best is trial 4 with value: -2.782491554706822.
[I 2026-03-18 16:33:27,904] Trial 27 pruned. 
[I 2026-03-18 16:33:29,198] Trial 14 pruned. 
[I 2026-03-18 16:33:29,707] Trial 23 pruned. 
[I 2026-03-18 16:33:30,086] Trial 26 finished with value: -0.42803662184960334 and parameters: {'n_layers_yyx': 2, 'hidden_size_yyx_l0': 3, 'hidden_size_yyx_l1': 6, 'context_size_yyx': 2, 'num_mix_components_yyx': 1, 'context_extractor_yyx': 'lstm', 'activation_func_yyx': 'Tanh', 'L2_weight_yyx': 3.714462287474147e-09, 'L_entropy_weight_yyx': 9.788619978218095e-06, 'L_sep_weight_yyx': 2.6476341967779543e-06, 'L_scale_weight_yyx': 0.0006895888566748539, 'learning_rate_yyx': 0.006968556322733257}. Best is trial 1 with value: -0.43281404005115615.
[I 2026-03-18 16:33:30,372] Trial 37 pruned. 
[I 2026-03-18 16:33:30,931] Trial 26 pruned. 
[I 2026-03-18 16:33:32,863] Trial 24 pruned. 
[I 2026-03-18 16:33:32,949] Trial 31 pruned. 
[I 2026-03-18 16:33:33,324] Trial 27 pruned. 
[I 2026-03-18 16:33:33,450] Trial 26 finished with value: -0.4162433730559452 and parameters: {'n_layers_yyx': 2, 'hidden_size_yyx_l0': 4, 'hidden_size_yyx_l1': 5, 'context_size_yyx': 4, 'num_mix_components_yyx': 1, 'context_extractor_yyx': 'lstm', 'activation_func_yyx': 'GELU', 'L2_weight_yyx': 1.8230994875710185e-05, 'L_entropy_weight_yyx': 5.208784241783388e-07, 'L_sep_weight_yyx': 1.2669047958497086e-08, 'L_scale_weight_yyx': 0.00010703269967149006, 'learning_rate_yyx': 0.0015860286314047056}. Best is trial 9 with value: -0.4271615326589106.
[I 2026-03-18 16:33:33,889] Trial 28 pruned. 
[I 2026-03-18 16:33:34,074] Trial 2 finished with value: -2.802563464577197 and parameters: {'n_layers_yyx': 2, 'hidden_size_yyx_l0': 6, 'hidden_size_yyx_l1': 5, 'context_size_yyx': 4, 'num_mix_components_yyx': 2, 'context_extractor_yyx': 'lstm', 'activation_func_yyx': 'GELU', 'L2_weight_yyx': 6.932654226877424e-07, 'L_entropy_weight_yyx': 5.480798408463648e-10, 'L_sep_weight_yyx': 4.215059627676233e-07, 'L_scale_weight_yyx': 3.2869678554024926e-05, 'learning_rate_yyx': 0.001196114024090342}. Best is trial 2 with value: -2.802563464577197.
[I 2026-03-18 16:33:34,937] Trial 1 finished with value: -2.7682212875457948 and parameters: {'n_layers_yyx': 2, 'hidden_size_yyx_l0': 2, 'hidden_size_yyx_l1': 4, 'context_size_yyx': 3, 'num_mix_components_yyx': 3, 'context_extractor_yyx': 'lstm', 'activation_func_yyx': 'ReLU', 'L2_weight_yyx': 1.2002425150511416e-10, 'L_entropy_weight_yyx': 1.7073765861125894e-10, 'L_sep_weight_yyx': 2.64314131835921e-07, 'L_scale_weight_yyx': 2.6806657968205297e-05, 'learning_rate_yyx': 0.0005072540469574487}. Best is trial 0 with value: -2.782248579189629.
[I 2026-03-18 16:33:36,049] Trial 25 pruned. 
[I 2026-03-18 16:33:36,727] Trial 28 pruned. 
[I 2026-03-18 16:33:36,839] Trial 27 pruned. 
[I 2026-03-18 16:33:37,193] Trial 29 pruned. 
[I 2026-03-18 16:33:37,219] Trial 27 pruned. 
[I 2026-03-18 16:33:39,752] Trial 30 pruned. 
[I 2026-03-18 16:33:40,444] Trial 28 pruned. 
[I 2026-03-18 16:33:43,400] Trial 31 pruned. 
[I 2026-03-18 16:33:43,876] Trial 29 pruned. 
[I 2026-03-18 16:33:45,672] Trial 22 finished with value: -0.4286539178145559 and parameters: {'n_layers_yyx': 2, 'hidden_size_yyx_l0': 6, 'hidden_size_yyx_l1': 4, 'context_size_yyx': 4, 'num_mix_components_yyx': 5, 'context_extractor_yyx': 'lstm', 'activation_func_yyx': 'Tanh', 'L2_weight_yyx': 3.347278510568003e-09, 'L_entropy_weight_yyx': 1.010711061487008e-09, 'L_sep_weight_yyx': 8.598177526160803e-05, 'L_scale_weight_yyx': 0.00013554533393745626, 'learning_rate_yyx': 0.00366962965161795}. Best is trial 5 with value: -0.44982475540586303.
[I 2026-03-18 16:33:45,731] Trial 29 finished with value: -0.3956407009632595 and parameters: {'n_layers_yyx': 1, 'hidden_size_yyx_l0': 6, 'context_size_yyx': 1, 'num_mix_components_yyx': 4, 'context_extractor_yyx': 'gru', 'activation_func_yyx': 'ReLU', 'L2_weight_yyx': 1.204997935690123e-07, 'L_entropy_weight_yyx': 1.22959104402649e-08, 'L_sep_weight_yyx': 1.8861044681134125e-07, 'L_scale_weight_yyx': 4.887964953050606e-07, 'learning_rate_yyx': 0.008537897449657524}. Best is trial 17 with value: -0.46708542200803016.
[I 2026-03-18 16:33:46,663] Trial 4 finished with value: -2.7877676078485516 and parameters: {'n_layers_yyx': 2, 'hidden_size_yyx_l0': 4, 'hidden_size_yyx_l1': 3, 'context_size_yyx': 2, 'num_mix_components_yyx': 1, 'context_extractor_yyx': 'gru', 'activation_func_yyx': 'ReLU', 'L2_weight_yyx': 8.112010103860632e-06, 'L_entropy_weight_yyx': 6.351311229087044e-09, 'L_sep_weight_yyx': 0.00012716371763783183, 'L_scale_weight_yyx': 3.1380317602033564e-06, 'learning_rate_yyx': 0.0028572082759884708}. Best is trial 1 with value: -2.804181999864486.
[I 2026-03-18 16:33:47,097] Trial 32 pruned. 
[I 2026-03-18 16:33:49,090] Trial 30 pruned. 
[I 2026-03-18 16:33:50,659] Trial 30 pruned. 
[I 2026-03-18 16:33:51,772] Trial 28 pruned. 
[I 2026-03-18 16:33:51,777] Trial 26 pruned. 
[I 2026-03-18 16:33:53,316] Trial 29 pruned. 
[I 2026-03-18 16:33:53,589] Trial 30 pruned. 
[I 2026-03-18 16:33:54,329] Trial 37 pruned. 
[I 2026-03-18 16:33:54,592] Trial 5 pruned. 
[I 2026-03-18 16:33:55,079] Trial 27 pruned. 
[I 2026-03-18 16:33:55,141] Trial 2 finished with value: -2.7794673659371933 and parameters: {'n_layers_yyx': 2, 'hidden_size_yyx_l0': 5, 'hidden_size_yyx_l1': 3, 'context_size_yyx': 2, 'num_mix_components_yyx': 2, 'context_extractor_yyx': 'lstm', 'activation_func_yyx': 'ReLU', 'L2_weight_yyx': 5.779810629824056e-09, 'L_entropy_weight_yyx': 2.7339300414256453e-06, 'L_sep_weight_yyx': 1.8392715794787052e-07, 'L_scale_weight_yyx': 4.729717194686176e-09, 'learning_rate_yyx': 0.0008582038583366706}. Best is trial 1 with value: -2.8010403323029167.
[I 2026-03-18 16:33:55,306] Trial 38 finished with value: -0.37554527731502757 and parameters: {'n_layers_yyx': 2, 'hidden_size_yyx_l0': 5, 'hidden_size_yyx_l1': 6, 'context_size_yyx': 2, 'num_mix_components_yyx': 4, 'context_extractor_yyx': 'gru', 'activation_func_yyx': 'Tanh', 'L2_weight_yyx': 1.6651341387470238e-05, 'L_entropy_weight_yyx': 0.0001546456481217231, 'L_sep_weight_yyx': 6.027559530788166e-05, 'L_scale_weight_yyx': 4.8040395440807235e-06, 'learning_rate_yyx': 0.002085124645097512}. Best is trial 4 with value: -0.43761569280004353.
[I 2026-03-18 16:33:55,390] Trial 18 finished with value: -0.42921083999492066 and parameters: {'n_layers_yyx': 1, 'hidden_size_yyx_l0': 3, 'context_size_yyx': 3, 'num_mix_components_yyx': 2, 'context_extractor_yyx': 'lstm', 'activation_func_yyx': 'GELU', 'L2_weight_yyx': 1.8499939689228975e-06, 'L_entropy_weight_yyx': 5.733221495317705e-06, 'L_sep_weight_yyx': 5.092279861831575e-05, 'L_scale_weight_yyx': 2.8414762766881835e-05, 'learning_rate_yyx': 0.006261721610703896}. Best is trial 1 with value: -0.45911608244243424.
[I 2026-03-18 16:33:57,737] Trial 38 pruned. 
[I 2026-03-18 16:33:58,607] Trial 29 pruned. 
[I 2026-03-18 16:33:58,896] Trial 39 pruned. 
[I 2026-03-18 16:33:59,782] Trial 32 finished with value: -0.4032989596434791 and parameters: {'n_layers_yyx': 2, 'hidden_size_yyx_l0': 4, 'hidden_size_yyx_l1': 3, 'context_size_yyx': 3, 'num_mix_components_yyx': 3, 'context_extractor_yyx': 'gru', 'activation_func_yyx': 'Tanh', 'L2_weight_yyx': 5.156914424457133e-09, 'L_entropy_weight_yyx': 7.975082046464784e-10, 'L_sep_weight_yyx': 7.334790121988956e-07, 'L_scale_weight_yyx': 2.736446678693977e-10, 'learning_rate_yyx': 0.007390118337429674}. Best is trial 28 with value: -0.4286294943038893.
[I 2026-03-18 16:34:00,237] Trial 30 pruned. 
[I 2026-03-18 16:34:01,794] Trial 35 finished with value: -0.4510425295992163 and parameters: {'n_layers_yyx': 2, 'hidden_size_yyx_l0': 3, 'hidden_size_yyx_l1': 3, 'context_size_yyx': 4, 'num_mix_components_yyx': 2, 'context_extractor_yyx': 'gru', 'activation_func_yyx': 'Tanh', 'L2_weight_yyx': 4.973723859553285e-09, 'L_entropy_weight_yyx': 3.801229769083059e-08, 'L_sep_weight_yyx': 4.118824451066714e-09, 'L_scale_weight_yyx': 1.6921235106671539e-06, 'learning_rate_yyx': 0.006730803397955583}. Best is trial 35 with value: -0.4510425295992163.
[I 2026-03-18 16:34:01,984] Trial 30 pruned. 
[I 2026-03-18 16:34:02,252] Trial 28 pruned. 
[I 2026-03-18 16:34:02,397] Trial 40 pruned. 
[I 2026-03-18 16:34:02,421] Trial 23 pruned. 
[I 2026-03-18 16:34:02,794] Trial 33 pruned. 
[I 2026-03-18 16:34:03,040] Trial 33 pruned. 
[I 2026-03-18 16:34:03,067] Trial 28 finished with value: -0.4440207939029847 and parameters: {'n_layers_yyx': 1, 'hidden_size_yyx_l0': 6, 'context_size_yyx': 3, 'num_mix_components_yyx': 4, 'context_extractor_yyx': 'lstm', 'activation_func_yyx': 'Tanh', 'L2_weight_yyx': 1.7324719441406098e-06, 'L_entropy_weight_yyx': 3.2299291403255194e-08, 'L_sep_weight_yyx': 3.9617127120493845e-08, 'L_scale_weight_yyx': 1.3016566753427932e-08, 'learning_rate_yyx': 0.003257959243175042}. Best is trial 7 with value: -0.44963234349300985.
[I 2026-03-18 16:34:03,211] Trial 6 pruned. 
[I 2026-03-18 16:34:05,049] Trial 36 pruned. 
[I 2026-03-18 16:34:05,096] Trial 31 pruned. 
[I 2026-03-18 16:34:05,739] Trial 29 pruned. 
[I 2026-03-18 16:34:06,802] Trial 34 pruned. 
[I 2026-03-18 16:34:06,807] Trial 29 pruned. 
[I 2026-03-18 16:34:09,145] Trial 24 pruned. 
[I 2026-03-18 16:34:09,156] Trial 32 pruned. 
[I 2026-03-18 16:34:09,427] Trial 41 pruned. 
[I 2026-03-18 16:34:12,394] Trial 37 pruned. 
[I 2026-03-18 16:34:12,809] Trial 19 pruned. 
[I 2026-03-18 16:34:13,383] Trial 35 pruned. 
[I 2026-03-18 16:34:14,823] Trial 15 finished with value: -0.39276231700790926 and parameters: {'n_layers_yyx': 2, 'hidden_size_yyx_l0': 6, 'hidden_size_yyx_l1': 2, 'context_size_yyx': 2, 'num_mix_components_yyx': 2, 'context_extractor_yyx': 'gru', 'activation_func_yyx': 'Tanh', 'L2_weight_yyx': 6.905790873296471e-09, 'L_entropy_weight_yyx': 6.854564045047547e-10, 'L_sep_weight_yyx': 1.6955276250786067e-10, 'L_scale_weight_yyx': 1.0140003000244699e-10, 'learning_rate_yyx': 0.009929371790952891}. Best is trial 9 with value: -0.430995315221072.
[I 2026-03-18 16:34:15,767] Trial 42 pruned. 
[I 2026-03-18 16:34:15,816] Trial 33 pruned. 
[I 2026-03-18 16:34:16,235] Trial 31 pruned. 
[I 2026-03-18 16:34:17,062] Trial 39 finished with value: -0.38598665881083105 and parameters: {'n_layers_yyx': 2, 'hidden_size_yyx_l0': 5, 'hidden_size_yyx_l1': 5, 'context_size_yyx': 3, 'num_mix_components_yyx': 4, 'context_extractor_yyx': 'gru', 'activation_func_yyx': 'GELU', 'L2_weight_yyx': 7.414962589356709e-08, 'L_entropy_weight_yyx': 0.00011735301386314875, 'L_sep_weight_yyx': 2.1730385438870275e-09, 'L_scale_weight_yyx': 1.6344857425308867e-07, 'learning_rate_yyx': 0.005641970340729641}. Best is trial 1 with value: -0.44267641427716237.
[I 2026-03-18 16:34:18,255] Trial 1 finished with value: -2.7875097976172194 and parameters: {'n_layers_yyx': 1, 'hidden_size_yyx_l0': 2, 'context_size_yyx': 3, 'num_mix_components_yyx': 3, 'context_extractor_yyx': 'gru', 'activation_func_yyx': 'ReLU', 'L2_weight_yyx': 0.0005035365099848565, 'L_entropy_weight_yyx': 9.706422643376533e-08, 'L_sep_weight_yyx': 1.216630557374157e-09, 'L_scale_weight_yyx': 1.769670379456067e-10, 'learning_rate_yyx': 0.0006653817176739834}. Best is trial 0 with value: -2.79162831599355.
[I 2026-03-18 16:34:18,552] Trial 16 pruned. 
[I 2026-03-18 16:34:19,037] Trial 43 pruned. 
[I 2026-03-18 16:34:19,442] Trial 34 pruned. 
[I 2026-03-18 16:34:19,814] Trial 32 pruned. 
[I 2026-03-18 16:34:22,876] Trial 30 pruned. 
[I 2026-03-18 16:34:23,306] Trial 31 finished with value: -0.40450771083772735 and parameters: {'n_layers_yyx': 1, 'hidden_size_yyx_l0': 4, 'context_size_yyx': 4, 'num_mix_components_yyx': 2, 'context_extractor_yyx': 'lstm', 'activation_func_yyx': 'ReLU', 'L2_weight_yyx': 0.0009793272047254663, 'L_entropy_weight_yyx': 7.728068143699312e-09, 'L_sep_weight_yyx': 4.0159428172741607e-07, 'L_scale_weight_yyx': 3.207069973258423e-10, 'learning_rate_yyx': 0.008225615541922627}. Best is trial 25 with value: -0.44456373279677824.
[I 2026-03-18 16:34:24,141] Trial 3 pruned. 
[I 2026-03-18 16:34:24,973] Trial 25 pruned. 
[I 2026-03-18 16:34:25,344] Trial 17 pruned. 
