[I 2026-03-18 17:20:33,368] Trial 42 finished with value: -0.5746915625738802 and parameters: {'n_layers_yyx': 1, 'hidden_size_yyx_l0': 5, 'context_size_yyx': 2, 'num_mix_components_yyx': 4, 'context_extractor_yyx': 'lstm', 'activation_func_yyx': 'ReLU', 'L2_weight_yyx': 1.4209652452071571e-05, 'L_entropy_weight_yyx': 1.2148758351924687e-06, 'L_sep_weight_yyx': 1.8971760305676316e-10, 'L_scale_weight_yyx': 1.3817900017557064e-09, 'learning_rate_yyx': 0.008451459905614791}. Best is trial 15 with value: -0.5782953233469631.
[I 2026-03-18 17:20:38,679] Trial 42 pruned. 
[I 2026-03-18 17:20:39,192] Trial 15 pruned. 
[I 2026-03-18 17:20:39,835] Trial 19 pruned. 
[I 2026-03-18 17:20:39,879] Trial 28 pruned. 
[I 2026-03-18 17:20:41,137] Trial 36 pruned. 
[I 2026-03-18 17:20:41,644] Trial 8 pruned. 
[I 2026-03-18 17:20:41,758] Trial 27 pruned. 
[I 2026-03-18 17:20:41,759] Trial 40 pruned. 
[I 2026-03-18 17:20:42,815] Trial 24 pruned. 
[I 2026-03-18 17:20:43,664] Trial 7 pruned. 
[I 2026-03-18 17:20:45,587] Trial 49 pruned. 

Source events: 3828
Target events: 1872
Full model ln_yyx : 13.78319 nats/sec, 6.62654 nats/event
Full model Log loss : -0.60839
Full model ln_yyx : 13.75538 nats/sec, 6.61316 nats/event
Full model Log loss : -0.61056
Full model ln_yyx : 13.73070 nats/sec, 6.60130 nats/event
Full model Log loss : -0.61138
Full model ln_yyx : 13.93090 nats/sec, 6.69755 nats/event
Full model Log loss : -0.60875
Full model ln_yyx : 13.52938 nats/sec, 6.50451 nats/event
Full model Log loss : -0.60449
Full model ln_yyx : 13.99293 nats/sec, 6.72737 nats/event
Full model Log loss : -0.60363
Full model ln_yyx : 13.32175 nats/sec, 6.40469 nats/event
Full model Log loss : -0.56605
Full model ln_yyx : 13.78943 nats/sec, 6.62953 nats/event
Full model Log loss : -0.60724
Optimization finished. Config saved to results/opt-full/opt_full_62_best_config.txt
[I 2026-03-18 17:20:51,872] Trial 8 finished with value: -2.804995289706571 and parameters: {'n_layers_yyx': 2, 'hidden_size_yyx_l0': 5, 'hidden_size_yyx_l1': 6, 'context_size_yyx': 1, 'num_mix_components_yyx': 1, 'context_extractor_yyx': 'gru', 'activation_func_yyx': 'GELU', 'L2_weight_yyx': 5.275813099641826e-05, 'L_entropy_weight_yyx': 2.6485964691271557e-08, 'L_sep_weight_yyx': 6.722013135113273e-08, 'L_scale_weight_yyx': 6.256322069315603e-06, 'learning_rate_yyx': 0.0016583037280078724}. Best is trial 1 with value: -2.875781089897074.
[I 2026-03-18 17:20:51,977] Trial 43 pruned. 
[I 2026-03-18 17:20:52,109] Trial 10 pruned. 
[I 2026-03-18 17:20:52,444] Trial 41 pruned. 
[I 2026-03-18 17:20:52,932] Trial 20 pruned. 
[I 2026-03-18 17:20:54,293] Trial 19 pruned. 
[I 2026-03-18 17:20:55,757] Trial 28 pruned. 
[I 2026-03-18 17:20:58,164] Trial 43 pruned. 
[I 2026-03-18 17:20:58,347] Trial 12 pruned. 
[I 2026-03-18 17:21:00,294] Trial 37 pruned. 
[I 2026-03-18 17:21:01,853] Trial 32 finished with value: -0.575409313343578 and parameters: {'n_layers_yyx': 1, 'hidden_size_yyx_l0': 6, 'context_size_yyx': 3, 'num_mix_components_yyx': 5, 'context_extractor_yyx': 'gru', 'activation_func_yyx': 'GELU', 'L2_weight_yyx': 4.344577080475491e-09, 'L_entropy_weight_yyx': 2.0663476571029492e-10, 'L_sep_weight_yyx': 2.306692698608129e-06, 'L_scale_weight_yyx': 1.1122808263805657e-10, 'learning_rate_yyx': 0.009904053450835254}. Best is trial 1 with value: -0.5777964847779832.
[I 2026-03-18 17:21:05,729] Trial 11 pruned. 
[I 2026-03-18 17:21:09,411] Trial 44 pruned. 
[I 2026-03-18 17:21:09,714] Trial 38 pruned. 
[I 2026-03-18 17:21:09,940] Trial 44 pruned. 
[I 2026-03-18 17:21:11,085] Trial 33 pruned. 
[I 2026-03-18 17:21:11,452] Trial 42 pruned. 
[I 2026-03-18 17:21:20,872] Trial 33 finished with value: -0.5823817613856173 and parameters: {'n_layers_yyx': 2, 'hidden_size_yyx_l0': 5, 'hidden_size_yyx_l1': 5, 'context_size_yyx': 2, 'num_mix_components_yyx': 4, 'context_extractor_yyx': 'lstm', 'activation_func_yyx': 'GELU', 'L2_weight_yyx': 5.605997606532918e-05, 'L_entropy_weight_yyx': 2.3868597854913703e-08, 'L_sep_weight_yyx': 1.5606322633739722e-06, 'L_scale_weight_yyx': 3.4111767537406797e-07, 'learning_rate_yyx': 0.0072105760153521265}. Best is trial 33 with value: -0.5823817613856173.
[I 2026-03-18 17:21:21,134] Trial 34 pruned. 
[I 2026-03-18 17:21:21,593] Trial 20 pruned. 
[I 2026-03-18 17:21:21,953] Trial 20 finished with value: -2.9023057376863495 and parameters: {'n_layers_yyx': 2, 'hidden_size_yyx_l0': 5, 'hidden_size_yyx_l1': 5, 'context_size_yyx': 4, 'num_mix_components_yyx': 4, 'context_extractor_yyx': 'lstm', 'activation_func_yyx': 'GELU', 'L2_weight_yyx': 1.1513178519483848e-05, 'L_entropy_weight_yyx': 2.1698728551594587e-05, 'L_sep_weight_yyx': 2.0604544927584346e-07, 'L_scale_weight_yyx': 4.049753278836737e-09, 'learning_rate_yyx': 0.009752700356058365}. Best is trial 6 with value: -2.966045431578574.
[I 2026-03-18 17:21:23,207] Trial 29 finished with value: -0.5520222911808481 and parameters: {'n_layers_yyx': 1, 'hidden_size_yyx_l0': 6, 'context_size_yyx': 3, 'num_mix_components_yyx': 4, 'context_extractor_yyx': 'lstm', 'activation_func_yyx': 'ReLU', 'L2_weight_yyx': 4.497812720207341e-10, 'L_entropy_weight_yyx': 0.0002260359481164832, 'L_sep_weight_yyx': 2.5076780249368546e-09, 'L_scale_weight_yyx': 2.6485096923570377e-06, 'learning_rate_yyx': 0.009784609990426043}. Best is trial 27 with value: -0.5752265017167082.
[I 2026-03-18 17:21:27,868] Trial 45 pruned. 
[I 2026-03-18 17:21:28,608] Trial 39 pruned. 
[I 2026-03-18 17:21:28,698] Trial 45 pruned. 
[I 2026-03-18 17:21:30,362] Trial 43 pruned. 
[I 2026-03-18 17:21:30,717] Trial 35 pruned. 
[I 2026-03-18 17:21:33,626] Trial 30 pruned. 
[I 2026-03-18 17:21:37,487] Trial 29 pruned. 
[I 2026-03-18 17:21:37,649] Trial 27 finished with value: -0.5629691395503783 and parameters: {'n_layers_yyx': 1, 'hidden_size_yyx_l0': 3, 'context_size_yyx': 3, 'num_mix_components_yyx': 1, 'context_extractor_yyx': 'gru', 'activation_func_yyx': 'ReLU', 'L2_weight_yyx': 0.0002006373980989812, 'L_entropy_weight_yyx': 1.1166869810086719e-09, 'L_sep_weight_yyx': 0.0002863554324246797, 'L_scale_weight_yyx': 6.009242752118638e-06, 'learning_rate_yyx': 0.0075315313695816415}. Best is trial 17 with value: -0.5864613361174992.
[I 2026-03-18 17:21:38,612] Trial 40 pruned. 
[I 2026-03-18 17:21:39,982] Trial 34 pruned. 
[I 2026-03-18 17:21:45,141] Trial 28 finished with value: -0.5575911615049003 and parameters: {'n_layers_yyx': 1, 'hidden_size_yyx_l0': 5, 'context_size_yyx': 4, 'num_mix_components_yyx': 4, 'context_extractor_yyx': 'gru', 'activation_func_yyx': 'ReLU', 'L2_weight_yyx': 5.042067556100019e-08, 'L_entropy_weight_yyx': 2.643376504749562e-07, 'L_sep_weight_yyx': 4.747146023445161e-08, 'L_scale_weight_yyx': 7.265516443291088e-09, 'learning_rate_yyx': 0.004805187832868182}. Best is trial 23 with value: -0.5844188202198138.
[I 2026-03-18 17:21:46,526] Trial 30 pruned. 
[I 2026-03-18 17:21:46,858] Trial 46 pruned. 
[I 2026-03-18 17:21:49,338] Trial 21 pruned. 
[I 2026-03-18 17:21:49,754] Trial 35 pruned. 
[I 2026-03-18 17:21:49,976] Trial 36 pruned. 
[I 2026-03-18 17:21:54,067] Trial 8 pruned. 
[I 2026-03-18 17:21:54,551] Trial 29 pruned. 
[I 2026-03-18 17:21:54,564] Trial 44 finished with value: -0.46261247097523217 and parameters: {'n_layers_yyx': 2, 'hidden_size_yyx_l0': 2, 'hidden_size_yyx_l1': 6, 'context_size_yyx': 1, 'num_mix_components_yyx': 5, 'context_extractor_yyx': 'lstm', 'activation_func_yyx': 'Tanh', 'L2_weight_yyx': 6.891809215126056e-05, 'L_entropy_weight_yyx': 5.304131135995281e-06, 'L_sep_weight_yyx': 4.056165866036507e-05, 'L_scale_weight_yyx': 2.036043280683862e-05, 'learning_rate_yyx': 0.0055022197144468914}. Best is trial 40 with value: -0.47338191643587946.
[I 2026-03-18 17:21:58,004] Trial 41 pruned. 
[I 2026-03-18 17:21:58,520] Trial 28 pruned. 
[I 2026-03-18 17:22:04,178] Trial 31 pruned. 
[I 2026-03-18 17:22:04,383] Trial 12 finished with value: -2.949499082480869 and parameters: {'n_layers_yyx': 2, 'hidden_size_yyx_l0': 4, 'hidden_size_yyx_l1': 4, 'context_size_yyx': 4, 'num_mix_components_yyx': 4, 'context_extractor_yyx': 'gru', 'activation_func_yyx': 'GELU', 'L2_weight_yyx': 6.288934265658869e-06, 'L_entropy_weight_yyx': 3.4948378542790875e-06, 'L_sep_weight_yyx': 4.801760954145014e-06, 'L_scale_weight_yyx': 0.0009069019130797485, 'learning_rate_yyx': 0.009937216240519497}. Best is trial 8 with value: -2.955956673037092.
[I 2026-03-18 17:22:04,937] Trial 45 pruned. 
[I 2026-03-18 17:22:06,913] Trial 47 pruned. 
[I 2026-03-18 17:22:07,894] Trial 42 pruned. 
[I 2026-03-18 17:22:07,905] Trial 9 pruned. 
[I 2026-03-18 17:22:09,461] Trial 29 pruned. 
[I 2026-03-18 17:22:13,554] Trial 46 pruned. 
[I 2026-03-18 17:22:14,798] Trial 46 pruned. 
[I 2026-03-18 17:22:17,521] Trial 13 pruned. 
[I 2026-03-18 17:22:18,021] Trial 43 pruned. 
[I 2026-03-18 17:22:20,303] Trial 40 finished with value: -0.5565509612491403 and parameters: {'n_layers_yyx': 1, 'hidden_size_yyx_l0': 2, 'context_size_yyx': 4, 'num_mix_components_yyx': 2, 'context_extractor_yyx': 'lstm', 'activation_func_yyx': 'Tanh', 'L2_weight_yyx': 2.7106931478851833e-06, 'L_entropy_weight_yyx': 0.00041689866372221696, 'L_sep_weight_yyx': 2.2687848602512646e-07, 'L_scale_weight_yyx': 2.9235961859271837e-05, 'learning_rate_yyx': 0.002635618383409301}. Best is trial 15 with value: -0.5780454108278886.
[I 2026-03-18 17:22:20,639] Trial 10 pruned. 
[I 2026-03-18 17:22:23,723] Trial 47 pruned. 
[I 2026-03-18 17:22:23,972] Trial 31 finished with value: -0.5745063582345576 and parameters: {'n_layers_yyx': 1, 'hidden_size_yyx_l0': 6, 'context_size_yyx': 4, 'num_mix_components_yyx': 5, 'context_extractor_yyx': 'lstm', 'activation_func_yyx': 'Tanh', 'L2_weight_yyx': 5.068985656560501e-09, 'L_entropy_weight_yyx': 0.00013854458969501541, 'L_sep_weight_yyx': 6.802263484868654e-07, 'L_scale_weight_yyx': 1.6337616634069588e-08, 'learning_rate_yyx': 0.0077141079565933995}. Best is trial 27 with value: -0.5752265017167082.
[I 2026-03-18 17:22:24,957] Trial 11 finished with value: -2.9469286007046884 and parameters: {'n_layers_yyx': 2, 'hidden_size_yyx_l0': 3, 'hidden_size_yyx_l1': 6, 'context_size_yyx': 2, 'num_mix_components_yyx': 5, 'context_extractor_yyx': 'gru', 'activation_func_yyx': 'Tanh', 'L2_weight_yyx': 1.4068755025424775e-06, 'L_entropy_weight_yyx': 2.743146709069608e-07, 'L_sep_weight_yyx': 7.067665872857376e-07, 'L_scale_weight_yyx': 1.2958262402150739e-05, 'learning_rate_yyx': 0.008945220308801313}. Best is trial 0 with value: -2.973312761552399.
[I 2026-03-18 17:22:25,200] Trial 32 pruned. 
[I 2026-03-18 17:22:25,470] Trial 25 finished with value: -0.5701838182451965 and parameters: {'n_layers_yyx': 1, 'hidden_size_yyx_l0': 5, 'context_size_yyx': 3, 'num_mix_components_yyx': 3, 'context_extractor_yyx': 'gru', 'activation_func_yyx': 'GELU', 'L2_weight_yyx': 5.756991443581417e-07, 'L_entropy_weight_yyx': 2.3575336897150246e-09, 'L_sep_weight_yyx': 2.6198564301504527e-09, 'L_scale_weight_yyx': 1.5154281206698742e-08, 'learning_rate_yyx': 0.004368654118537017}. Best is trial 13 with value: -0.5746682860992306.
[I 2026-03-18 17:22:26,780] Trial 48 pruned. 
[I 2026-03-18 17:22:27,904] Trial 30 pruned. 
[I 2026-03-18 17:22:28,184] Trial 44 pruned. 
[I 2026-03-18 17:22:30,646] Trial 14 pruned. 
[I 2026-03-18 17:22:32,203] Trial 47 pruned. 
[I 2026-03-18 17:22:34,084] Trial 48 pruned. 
[I 2026-03-18 17:22:36,714] Trial 26 pruned. 
[I 2026-03-18 17:22:36,818] Trial 49 pruned. 

Source events: 3828
Target events: 27060
Full model ln_yyx : 194.44733 nats/sec, 6.46721 nats/event
Full model Log loss : -0.56830
Full model ln_yyx : 205.00736 nats/sec, 6.81843 nats/event
Full model Log loss : -0.58363
Full model ln_yyx : 194.94357 nats/sec, 6.48371 nats/event
Full model Log loss : -0.58107
Full model ln_yyx : 195.42843 nats/sec, 6.49984 nats/event
Full model Log loss : -0.57559
Full model ln_yyx : 197.01522 nats/sec, 6.55261 nats/event
Full model Log loss : -0.57729
Full model ln_yyx : 195.16100 nats/sec, 6.49094 nats/event
Full model Log loss : -0.56699
Full model ln_yyx : 199.29046 nats/sec, 6.62829 nats/event
Full model Log loss : -0.58278
Full model ln_yyx : 194.36520 nats/sec, 6.46447 nats/event
Full model Log loss : -0.56953
Optimization finished. Config saved to results/opt-full/opt_full_58_best_config.txt
[I 2026-03-18 17:22:37,863] Trial 31 pruned. 
[I 2026-03-18 17:22:38,303] Trial 7 finished with value: -2.8486994019643768 and parameters: {'n_layers_yyx': 2, 'hidden_size_yyx_l0': 3, 'hidden_size_yyx_l1': 6, 'context_size_yyx': 4, 'num_mix_components_yyx': 1, 'context_extractor_yyx': 'gru', 'activation_func_yyx': 'GELU', 'L2_weight_yyx': 1.8342293299585014e-10, 'L_entropy_weight_yyx': 0.0002511545481680856, 'L_sep_weight_yyx': 2.8185601501496543e-10, 'L_scale_weight_yyx': 1.0436231035782107e-08, 'learning_rate_yyx': 0.0032285763466725075}. Best is trial 5 with value: -2.9729516240610265.
[I 2026-03-18 17:22:38,588] Trial 45 pruned. 
[I 2026-03-18 17:22:41,971] Trial 30 pruned. 
[I 2026-03-18 17:22:42,677] Trial 33 pruned. 
[I 2026-03-18 17:22:43,148] Trial 15 pruned. 
[I 2026-03-18 17:22:45,328] Trial 27 pruned. 
[I 2026-03-18 17:22:47,338] Trial 11 pruned. 
[I 2026-03-18 17:22:50,983] Trial 34 pruned. 
[I 2026-03-18 17:22:51,832] Trial 44 finished with value: -0.5748796843432986 and parameters: {'n_layers_yyx': 2, 'hidden_size_yyx_l0': 5, 'hidden_size_yyx_l1': 5, 'context_size_yyx': 4, 'num_mix_components_yyx': 3, 'context_extractor_yyx': 'gru', 'activation_func_yyx': 'Tanh', 'L2_weight_yyx': 2.46719667137495e-10, 'L_entropy_weight_yyx': 5.095521594636091e-07, 'L_sep_weight_yyx': 1.2277475696006719e-09, 'L_scale_weight_yyx': 7.305615834539687e-08, 'learning_rate_yyx': 0.003518007080289752}. Best is trial 6 with value: -0.5907732977991746.
[I 2026-03-18 17:22:56,447] Trial 46 pruned. 
[I 2026-03-18 17:22:58,775] Trial 12 pruned. 
[I 2026-03-18 17:23:00,461] Trial 31 pruned. 
[I 2026-03-18 17:23:02,964] Trial 22 pruned. 
[I 2026-03-18 17:23:06,039] Trial 41 pruned. 
[I 2026-03-18 17:23:06,735] Trial 47 pruned. 
[I 2026-03-18 17:23:10,243] Trial 16 pruned. 
[I 2026-03-18 17:23:10,273] Trial 32 pruned. 
[I 2026-03-18 17:23:10,562] Trial 13 pruned. 
[I 2026-03-18 17:23:12,766] Trial 37 finished with value: -0.5625105153415685 and parameters: {'n_layers_yyx': 1, 'hidden_size_yyx_l0': 3, 'context_size_yyx': 1, 'num_mix_components_yyx': 1, 'context_extractor_yyx': 'lstm', 'activation_func_yyx': 'ReLU', 'L2_weight_yyx': 2.9077984390218177e-06, 'L_entropy_weight_yyx': 3.6090130284960884e-10, 'L_sep_weight_yyx': 1.3615600560223842e-09, 'L_scale_weight_yyx': 2.1701509940636893e-10, 'learning_rate_yyx': 0.009739179528701167}. Best is trial 1 with value: -0.5777964847779832.
[I 2026-03-18 17:23:13,892] Trial 36 finished with value: -0.579265694178774 and parameters: {'n_layers_yyx': 1, 'hidden_size_yyx_l0': 5, 'context_size_yyx': 1, 'num_mix_components_yyx': 4, 'context_extractor_yyx': 'gru', 'activation_func_yyx': 'GELU', 'L2_weight_yyx': 1.897949696550708e-10, 'L_entropy_weight_yyx': 1.7484112160433062e-08, 'L_sep_weight_yyx': 7.75241316951151e-08, 'L_scale_weight_yyx': 1.6016626844632013e-07, 'learning_rate_yyx': 0.0054834879383187565}. Best is trial 33 with value: -0.5823817613856173.
[I 2026-03-18 17:23:18,448] Trial 49 pruned. 

Source events: 3828
Target events: 14713
Full model ln_yyx : 106.89711 nats/sec, 6.53894 nats/event
Full model Log loss : -0.57170
Full model ln_yyx : 106.04226 nats/sec, 6.48665 nats/event
Full model Log loss : -0.56235
Full model ln_yyx : 105.85572 nats/sec, 6.47524 nats/event
Full model Log loss : -0.57289
Full model ln_yyx : 107.29584 nats/sec, 6.56333 nats/event
Full model Log loss : -0.57017
Full model ln_yyx : 106.98138 nats/sec, 6.54409 nats/event
Full model Log loss : -0.57705
Full model ln_yyx : 108.73734 nats/sec, 6.65151 nats/event
Full model Log loss : -0.57507
Full model ln_yyx : 108.15389 nats/sec, 6.61582 nats/event
Full model Log loss : -0.56608
Full model ln_yyx : 107.80124 nats/sec, 6.59424 nats/event
Full model Log loss : -0.57830
Full model ln_yyx : 103.96257 nats/sec, 6.35943 nats/event
Full model Log loss : -0.55520
Full model ln_yyx : 109.17935 nats/sec, 6.67854 nats/event
Full model Log loss : -0.57413
Full model ln_yyx : 106.14888 nats/sec, 6.49317 nats/event
Full model Log loss : -0.57356
Full model ln_yyx : 105.23682 nats/sec, 6.43738 nats/event
Full model Log loss : -0.56411
Full model ln_yyx : 108.13524 nats/sec, 6.61468 nats/event
Full model Log loss : -0.57469
Optimization finished. Config saved to results/opt-full/opt_full_53_best_config.txt
[I 2026-03-18 17:23:22,407] Trial 37 pruned. 
[I 2026-03-18 17:23:23,986] Trial 12 finished with value: -2.9331557311857823 and parameters: {'n_layers_yyx': 1, 'hidden_size_yyx_l0': 5, 'context_size_yyx': 2, 'num_mix_components_yyx': 3, 'context_extractor_yyx': 'gru', 'activation_func_yyx': 'GELU', 'L2_weight_yyx': 1.6535349436807047e-07, 'L_entropy_weight_yyx': 5.164914692112361e-08, 'L_sep_weight_yyx': 9.947349354491458e-06, 'L_scale_weight_yyx': 1.0552723194591583e-09, 'learning_rate_yyx': 0.005757992925722868}. Best is trial 9 with value: -2.9510968045279404.
[I 2026-03-18 17:23:26,720] Trial 48 finished with value: -0.4415303044274865 and parameters: {'n_layers_yyx': 2, 'hidden_size_yyx_l0': 3, 'hidden_size_yyx_l1': 6, 'context_size_yyx': 1, 'num_mix_components_yyx': 5, 'context_extractor_yyx': 'lstm', 'activation_func_yyx': 'Tanh', 'L2_weight_yyx': 0.00024399950251992753, 'L_entropy_weight_yyx': 4.11967112399899e-06, 'L_sep_weight_yyx': 3.192529908191207e-05, 'L_scale_weight_yyx': 9.797151529749981e-05, 'learning_rate_yyx': 0.00868043014120754}. Best is trial 40 with value: -0.47338191643587946.
[I 2026-03-18 17:23:31,489] Trial 35 pruned. 
[I 2026-03-18 17:23:31,735] Trial 38 pruned. 
[I 2026-03-18 17:23:32,712] Trial 32 finished with value: -0.5769778412998624 and parameters: {'n_layers_yyx': 1, 'hidden_size_yyx_l0': 4, 'context_size_yyx': 4, 'num_mix_components_yyx': 5, 'context_extractor_yyx': 'gru', 'activation_func_yyx': 'ReLU', 'L2_weight_yyx': 1.7323815921889452e-07, 'L_entropy_weight_yyx': 1.5232153642108053e-07, 'L_sep_weight_yyx': 9.703567726253273e-05, 'L_scale_weight_yyx': 6.200207019947108e-05, 'learning_rate_yyx': 0.008782563978772974}. Best is trial 17 with value: -0.5864613361174992.
[I 2026-03-18 17:23:35,933] Trial 45 pruned. 
[I 2026-03-18 17:23:36,010] Trial 14 pruned. 
[I 2026-03-18 17:23:41,180] Trial 39 pruned. 
[I 2026-03-18 17:23:41,365] Trial 33 pruned. 
[I 2026-03-18 17:23:42,603] Trial 49 pruned. 

Source events: 1783
Target events: 16159
Full model ln_yyx : 51.00741 nats/sec, 2.84093 nats/event
Full model Log loss : -0.38948
Full model ln_yyx : 53.34307 nats/sec, 2.97102 nats/event
Full model Log loss : -0.41938
Full model ln_yyx : 52.74626 nats/sec, 2.93778 nats/event
Full model Log loss : -0.42719
Full model ln_yyx : 51.84106 nats/sec, 2.88737 nats/event
Full model Log loss : -0.38642
Full model ln_yyx : 52.29497 nats/sec, 2.91265 nats/event
Full model Log loss : -0.38915
Full model ln_yyx : 54.19015 nats/sec, 3.01820 nats/event
Full model Log loss : -0.45211
Full model ln_yyx : 53.65520 nats/sec, 2.98841 nats/event
Full model Log loss : -0.47301
Full model ln_yyx : 53.71226 nats/sec, 2.99159 nats/event
Full model Log loss : -0.47338
Full model ln_yyx : 54.42177 nats/sec, 3.03110 nats/event
Full model Log loss : -0.45835
Full model ln_yyx : 54.75651 nats/sec, 3.04975 nats/event
Full model Log loss : -0.46261
Full model ln_yyx : 53.07593 nats/sec, 2.95614 nats/event
Full model Log loss : -0.44153
Optimization finished. Config saved to results/opt-full/opt_full_33_best_config.txt
[I 2026-03-18 17:23:44,681] Trial 8 pruned. 
[I 2026-03-18 17:23:47,260] Trial 36 pruned. 
[I 2026-03-18 17:23:47,584] Trial 42 pruned. 
[I 2026-03-18 17:23:49,808] Trial 13 pruned. 
[I 2026-03-18 17:23:49,873] Trial 40 pruned. 
[I 2026-03-18 17:23:49,948] Trial 21 finished with value: -2.9062497229871878 and parameters: {'n_layers_yyx': 2, 'hidden_size_yyx_l0': 6, 'hidden_size_yyx_l1': 6, 'context_size_yyx': 2, 'num_mix_components_yyx': 5, 'context_extractor_yyx': 'lstm', 'activation_func_yyx': 'GELU', 'L2_weight_yyx': 4.764229121218348e-10, 'L_entropy_weight_yyx': 1.1100949404533174e-09, 'L_sep_weight_yyx': 3.3163967592915697e-09, 'L_scale_weight_yyx': 4.136112987866794e-08, 'learning_rate_yyx': 0.004953892870818098}. Best is trial 6 with value: -2.966045431578574.
[I 2026-03-18 17:23:52,588] Trial 33 finished with value: -0.5750165097159238 and parameters: {'n_layers_yyx': 1, 'hidden_size_yyx_l0': 6, 'context_size_yyx': 4, 'num_mix_components_yyx': 5, 'context_extractor_yyx': 'lstm', 'activation_func_yyx': 'Tanh', 'L2_weight_yyx': 4.378332916078759e-10, 'L_entropy_weight_yyx': 2.0182714521979934e-05, 'L_sep_weight_yyx': 1.5096140954887568e-07, 'L_scale_weight_yyx': 2.6525562341148903e-08, 'learning_rate_yyx': 0.00577981702615092}. Best is trial 27 with value: -0.5752265017167082.
[I 2026-03-18 17:23:52,854] Trial 38 pruned. 
[I 2026-03-18 17:23:57,064] Trial 34 pruned. 
[I 2026-03-18 17:23:57,799] Trial 41 pruned. 
[I 2026-03-18 17:24:00,084] Trial 15 pruned. 
[I 2026-03-18 17:24:00,637] Trial 14 pruned. 
[I 2026-03-18 17:24:01,976] Trial 22 pruned. 
[I 2026-03-18 17:24:02,465] Trial 37 pruned. 
[I 2026-03-18 17:24:06,108] Trial 35 pruned. 
[I 2026-03-18 17:24:07,373] Trial 42 pruned. 
[I 2026-03-18 17:24:08,438] Trial 12 finished with value: -2.9312883878199067 and parameters: {'n_layers_yyx': 1, 'hidden_size_yyx_l0': 4, 'context_size_yyx': 3, 'num_mix_components_yyx': 4, 'context_extractor_yyx': 'gru', 'activation_func_yyx': 'Tanh', 'L2_weight_yyx': 0.00015690852785983859, 'L_entropy_weight_yyx': 1.5726578419795647e-08, 'L_sep_weight_yyx': 3.0236351182865397e-10, 'L_scale_weight_yyx': 0.0009497299632718975, 'learning_rate_yyx': 0.0016002989005996903}. Best is trial 2 with value: -2.9414705477515914.
[I 2026-03-18 17:24:09,385] Trial 34 pruned. 
[I 2026-03-18 17:24:11,309] Trial 38 pruned. 
[I 2026-03-18 17:24:12,154] Trial 15 pruned. 
