[I 2026-03-18 22:44:53,299] Trial 94 pruned. 

Source events: 12731
Target events: 3618
Full model ln_yyx : 156.94347 nats/sec, 39.04066 nats/event
Full model Log loss : -1.80339
Full model ln_yyx : 155.19771 nats/sec, 38.60640 nats/event
Full model Log loss : -1.80323
Full model ln_yyx : 156.81113 nats/sec, 39.00774 nats/event
Full model Log loss : -1.80241
Full model ln_yyx : 155.51209 nats/sec, 38.68460 nats/event
Full model Log loss : -1.80275
Full model ln_yyx : 155.50635 nats/sec, 38.68317 nats/event
Full model Log loss : -1.80273
Full model ln_yyx : 155.26444 nats/sec, 38.62299 nats/event
Full model Log loss : -1.79789
Full model ln_yyx : 156.05924 nats/sec, 38.82071 nats/event
Full model Log loss : -1.80130
Full model ln_yyx : 156.23493 nats/sec, 38.86441 nats/event
Full model Log loss : -1.79920
Full model ln_yyx : 156.58545 nats/sec, 38.95160 nats/event
Full model Log loss : -1.80521
Full model ln_yyx : 156.20541 nats/sec, 38.85707 nats/event
Full model Log loss : -1.79241
Full model ln_yyx : 156.54891 nats/sec, 38.94251 nats/event
Full model Log loss : -1.80259
Optimization finished. Config saved to results/opt-full/opt_full_227_best_config.txt
[I 2026-03-18 22:44:55,901] Trial 75 finished with value: -1.8531808833322505 and parameters: {'n_layers_yyx': 1, 'hidden_size_yyx_l0': 5, 'context_size_yyx': 4, 'num_mix_components_yyx': 4, 'context_extractor_yyx': 'gru', 'activation_func_yyx': 'Tanh', 'L2_weight_yyx': 1.4179224373918465e-05, 'L_entropy_weight_yyx': 0.0004242003936601908, 'L_sep_weight_yyx': 1.8595025137783027e-05, 'L_scale_weight_yyx': 1.6539138735596395e-06, 'learning_rate_yyx': 0.008065259822787793}. Best is trial 53 with value: -1.855205638988598.
[I 2026-03-18 22:44:56,290] Trial 68 finished with value: -1.9047449711648567 and parameters: {'n_layers_yyx': 2, 'hidden_size_yyx_l0': 4, 'hidden_size_yyx_l1': 6, 'context_size_yyx': 3, 'num_mix_components_yyx': 2, 'context_extractor_yyx': 'gru', 'activation_func_yyx': 'GELU', 'L2_weight_yyx': 8.852145595418669e-06, 'L_entropy_weight_yyx': 4.4736658351488365e-07, 'L_sep_weight_yyx': 3.081793183587859e-06, 'L_scale_weight_yyx': 5.250585400632728e-10, 'learning_rate_yyx': 0.009899622993714764}. Best is trial 47 with value: -1.9352030291906768.
[I 2026-03-18 22:44:57,171] Trial 69 pruned. 
[I 2026-03-18 22:44:57,640] Trial 51 pruned. 
[I 2026-03-18 22:44:59,823] Trial 70 pruned. 
[I 2026-03-18 22:45:00,109] Trial 69 pruned. 
[I 2026-03-18 22:45:01,439] Trial 76 finished with value: -1.8488837205767423 and parameters: {'n_layers_yyx': 2, 'hidden_size_yyx_l0': 2, 'hidden_size_yyx_l1': 6, 'context_size_yyx': 4, 'num_mix_components_yyx': 4, 'context_extractor_yyx': 'lstm', 'activation_func_yyx': 'ReLU', 'L2_weight_yyx': 5.811168687415231e-10, 'L_entropy_weight_yyx': 0.0001675296656679634, 'L_sep_weight_yyx': 1.9860518205136275e-07, 'L_scale_weight_yyx': 9.992106204629207e-07, 'learning_rate_yyx': 0.007079345234035004}. Best is trial 60 with value: -1.8490650754743791.
[I 2026-03-18 22:45:02,669] Trial 72 finished with value: -1.84847593456455 and parameters: {'n_layers_yyx': 2, 'hidden_size_yyx_l0': 5, 'hidden_size_yyx_l1': 2, 'context_size_yyx': 4, 'num_mix_components_yyx': 5, 'context_extractor_yyx': 'gru', 'activation_func_yyx': 'ReLU', 'L2_weight_yyx': 1.8643067677313207e-09, 'L_entropy_weight_yyx': 2.542864175825305e-08, 'L_sep_weight_yyx': 1.0039753985927712e-10, 'L_scale_weight_yyx': 6.2956607323795216e-06, 'learning_rate_yyx': 0.009088254278182922}. Best is trial 0 with value: -1.8516305051550026.
[I 2026-03-18 22:45:06,218] Trial 71 pruned. 
[I 2026-03-18 22:45:06,907] Trial 52 pruned. 
[I 2026-03-18 22:45:17,183] Trial 80 pruned. 
[I 2026-03-18 22:45:17,527] Trial 77 finished with value: -1.780794221511995 and parameters: {'n_layers_yyx': 2, 'hidden_size_yyx_l0': 6, 'hidden_size_yyx_l1': 6, 'context_size_yyx': 3, 'num_mix_components_yyx': 5, 'context_extractor_yyx': 'lstm', 'activation_func_yyx': 'ReLU', 'L2_weight_yyx': 5.270268100814851e-09, 'L_entropy_weight_yyx': 4.0475121843669566e-07, 'L_sep_weight_yyx': 4.961947022313635e-06, 'L_scale_weight_yyx': 1.24629778897316e-06, 'learning_rate_yyx': 0.0069985047904497985}. Best is trial 4 with value: -1.7875800731928662.
[I 2026-03-18 22:45:19,009] Trial 77 pruned. 
[I 2026-03-18 22:45:20,160] Trial 78 pruned. 
[I 2026-03-18 22:45:22,528] Trial 79 pruned. 
[I 2026-03-18 22:45:22,972] Trial 70 pruned. 
[I 2026-03-18 22:45:23,716] Trial 81 pruned. 
[I 2026-03-18 22:45:25,733] Trial 78 pruned. 
[I 2026-03-18 22:45:26,351] Trial 76 finished with value: -1.8537630225252295 and parameters: {'n_layers_yyx': 1, 'hidden_size_yyx_l0': 5, 'context_size_yyx': 4, 'num_mix_components_yyx': 4, 'context_extractor_yyx': 'gru', 'activation_func_yyx': 'Tanh', 'L2_weight_yyx': 1.5253490829592268e-05, 'L_entropy_weight_yyx': 0.0004263288462925964, 'L_sep_weight_yyx': 2.8609240297468586e-05, 'L_scale_weight_yyx': 1.961777663054249e-06, 'learning_rate_yyx': 0.009318930531657514}. Best is trial 53 with value: -1.855205638988598.
[I 2026-03-18 22:45:34,590] Trial 72 finished with value: -1.8685950063911698 and parameters: {'n_layers_yyx': 1, 'hidden_size_yyx_l0': 6, 'context_size_yyx': 4, 'num_mix_components_yyx': 3, 'context_extractor_yyx': 'lstm', 'activation_func_yyx': 'ReLU', 'L2_weight_yyx': 5.259558529894321e-10, 'L_entropy_weight_yyx': 9.854724709989117e-10, 'L_sep_weight_yyx': 1.9171219008295538e-07, 'L_scale_weight_yyx': 6.036393485204288e-06, 'learning_rate_yyx': 0.008941192995181268}. Best is trial 42 with value: -1.8699069075199783.
[I 2026-03-18 22:45:43,882] Trial 79 pruned. 
[I 2026-03-18 22:45:44,936] Trial 73 finished with value: -1.849494528911131 and parameters: {'n_layers_yyx': 2, 'hidden_size_yyx_l0': 5, 'hidden_size_yyx_l1': 2, 'context_size_yyx': 4, 'num_mix_components_yyx': 5, 'context_extractor_yyx': 'gru', 'activation_func_yyx': 'ReLU', 'L2_weight_yyx': 1.0835234834251252e-08, 'L_entropy_weight_yyx': 1.2805620732748815e-08, 'L_sep_weight_yyx': 7.257421045746621e-10, 'L_scale_weight_yyx': 8.580220478005767e-06, 'learning_rate_yyx': 0.008820078557685513}. Best is trial 0 with value: -1.8516305051550026.
[I 2026-03-18 22:45:49,626] Trial 82 finished with value: -1.853154214818033 and parameters: {'n_layers_yyx': 1, 'hidden_size_yyx_l0': 6, 'context_size_yyx': 4, 'num_mix_components_yyx': 5, 'context_extractor_yyx': 'gru', 'activation_func_yyx': 'ReLU', 'L2_weight_yyx': 8.676964824214344e-06, 'L_entropy_weight_yyx': 5.333980665244455e-06, 'L_sep_weight_yyx': 7.98690515424003e-09, 'L_scale_weight_yyx': 7.017943458912351e-07, 'learning_rate_yyx': 0.007832173873070027}. Best is trial 1 with value: -1.8555367853768732.

Source events: 14713
Target events: 39192
Full model ln_yyx : 2026.57980 nats/sec, 46.53812 nats/event
Full model Log loss : -1.85280
Full model ln_yyx : 2029.77373 nats/sec, 46.61146 nats/event
Full model Log loss : -1.85183
Full model ln_yyx : 2034.26730 nats/sec, 46.71465 nats/event
Full model Log loss : -1.85244
Full model ln_yyx : 2029.16788 nats/sec, 46.59755 nats/event
Full model Log loss : -1.85210
Full model ln_yyx : 2028.73554 nats/sec, 46.58762 nats/event
Full model Log loss : -1.85016
Full model ln_yyx : 2030.91917 nats/sec, 46.63776 nats/event
Full model Log loss : -1.85382
Full model ln_yyx : 2033.97844 nats/sec, 46.70802 nats/event
Full model Log loss : -1.85422
Full model ln_yyx : 2041.71742 nats/sec, 46.88573 nats/event
Full model Log loss : -1.85378
Full model ln_yyx : 1991.89787 nats/sec, 45.74168 nats/event
Full model Log loss : -1.83740
Full model ln_yyx : 2021.10500 nats/sec, 46.41239 nats/event
Full model Log loss : -1.85315
Optimization finished. Config saved to results/opt-full/opt_full_238_best_config.txt
[I 2026-03-18 22:45:49,777] Trial 80 finished with value: -1.774760372277462 and parameters: {'n_layers_yyx': 2, 'hidden_size_yyx_l0': 6, 'hidden_size_yyx_l1': 6, 'context_size_yyx': 2, 'num_mix_components_yyx': 4, 'context_extractor_yyx': 'gru', 'activation_func_yyx': 'Tanh', 'L2_weight_yyx': 3.1575386598853366e-07, 'L_entropy_weight_yyx': 0.00031324592787558737, 'L_sep_weight_yyx': 0.00010615105218525103, 'L_scale_weight_yyx': 7.447908285301766e-07, 'learning_rate_yyx': 0.009476047272797206}. Best is trial 4 with value: -1.7875800731928662.
[I 2026-03-18 22:45:51,776] Trial 74 pruned. 
[I 2026-03-18 22:45:52,405] Trial 81 pruned. 
[I 2026-03-18 22:45:56,223] Trial 77 finished with value: -1.8537740832967884 and parameters: {'n_layers_yyx': 1, 'hidden_size_yyx_l0': 5, 'context_size_yyx': 4, 'num_mix_components_yyx': 4, 'context_extractor_yyx': 'gru', 'activation_func_yyx': 'Tanh', 'L2_weight_yyx': 9.077867219466755e-06, 'L_entropy_weight_yyx': 0.00045402644765291566, 'L_sep_weight_yyx': 2.341462301650824e-05, 'L_scale_weight_yyx': 1.913815714986955e-06, 'learning_rate_yyx': 0.00931853739503411}. Best is trial 53 with value: -1.855205638988598.
[I 2026-03-18 22:46:02,105] Trial 53 finished with value: -1.8555029263037075 and parameters: {'n_layers_yyx': 1, 'hidden_size_yyx_l0': 4, 'context_size_yyx': 4, 'num_mix_components_yyx': 2, 'context_extractor_yyx': 'lstm', 'activation_func_yyx': 'Tanh', 'L2_weight_yyx': 5.958098332609945e-10, 'L_entropy_weight_yyx': 3.014725017312378e-05, 'L_sep_weight_yyx': 1.5243671255200002e-10, 'L_scale_weight_yyx': 6.651983901440297e-10, 'learning_rate_yyx': 0.009991415707709518}. Best is trial 40 with value: -1.861402018567546.
[I 2026-03-18 22:46:04,534] Trial 73 finished with value: -1.8682501867817674 and parameters: {'n_layers_yyx': 1, 'hidden_size_yyx_l0': 6, 'context_size_yyx': 4, 'num_mix_components_yyx': 3, 'context_extractor_yyx': 'lstm', 'activation_func_yyx': 'ReLU', 'L2_weight_yyx': 1.3757442061534205e-09, 'L_entropy_weight_yyx': 1.2542408473691244e-09, 'L_sep_weight_yyx': 3.025158694964875e-08, 'L_scale_weight_yyx': 1.536456001841317e-05, 'learning_rate_yyx': 0.008162262212065561}. Best is trial 42 with value: -1.8699069075199783.
[I 2026-03-18 22:46:13,123] Trial 71 finished with value: -1.923847315722887 and parameters: {'n_layers_yyx': 2, 'hidden_size_yyx_l0': 6, 'hidden_size_yyx_l1': 5, 'context_size_yyx': 1, 'num_mix_components_yyx': 4, 'context_extractor_yyx': 'gru', 'activation_func_yyx': 'GELU', 'L2_weight_yyx': 4.075601130394809e-06, 'L_entropy_weight_yyx': 0.00024191828581929733, 'L_sep_weight_yyx': 7.672347935561232e-06, 'L_scale_weight_yyx': 2.118762179752923e-10, 'learning_rate_yyx': 0.007564101884698849}. Best is trial 47 with value: -1.9352030291906768.

Source events: 14713
Target events: 1783
Full model ln_yyx : 93.21282 nats/sec, 47.05078 nats/event
Full model Log loss : -1.93246
Full model ln_yyx : 91.56231 nats/sec, 46.21765 nats/event
Full model Log loss : -1.90737
Full model ln_yyx : 92.82962 nats/sec, 46.85735 nats/event
Full model Log loss : -1.92825
Full model ln_yyx : 92.13441 nats/sec, 46.50643 nats/event
Full model Log loss : -1.93037
Full model ln_yyx : 92.24792 nats/sec, 46.56373 nats/event
Full model Log loss : -1.93079
Full model ln_yyx : 92.27125 nats/sec, 46.57551 nats/event
Full model Log loss : -1.93077
Full model ln_yyx : 94.49016 nats/sec, 47.69554 nats/event
Full model Log loss : -1.93344
Full model ln_yyx : 92.83833 nats/sec, 46.86175 nats/event
Full model Log loss : -1.93520
Full model ln_yyx : 93.46977 nats/sec, 47.18048 nats/event
Full model Log loss : -1.93463
Full model ln_yyx : 93.57531 nats/sec, 47.23375 nats/event
Full model Log loss : -1.93473
Full model ln_yyx : 92.09442 nats/sec, 46.48625 nats/event
Full model Log loss : -1.90474
Full model ln_yyx : 92.24731 nats/sec, 46.56342 nats/event
Full model Log loss : -1.92385
Optimization finished. Config saved to results/opt-full/opt_full_229_best_config.txt
[I 2026-03-18 22:46:22,256] Trial 80 finished with value: -1.8484254765652326 and parameters: {'n_layers_yyx': 2, 'hidden_size_yyx_l0': 2, 'hidden_size_yyx_l1': 5, 'context_size_yyx': 4, 'num_mix_components_yyx': 4, 'context_extractor_yyx': 'lstm', 'activation_func_yyx': 'ReLU', 'L2_weight_yyx': 8.562722950646981e-07, 'L_entropy_weight_yyx': 1.3833483863723627e-05, 'L_sep_weight_yyx': 1.945092125549468e-07, 'L_scale_weight_yyx': 1.4714847668925212e-06, 'learning_rate_yyx': 0.005608660081524198}. Best is trial 60 with value: -1.8490650754743791.
[I 2026-03-18 22:46:25,610] Trial 78 finished with value: -1.853628559072895 and parameters: {'n_layers_yyx': 1, 'hidden_size_yyx_l0': 5, 'context_size_yyx': 4, 'num_mix_components_yyx': 4, 'context_extractor_yyx': 'gru', 'activation_func_yyx': 'Tanh', 'L2_weight_yyx': 4.397963692452912e-06, 'L_entropy_weight_yyx': 0.0003763759660159318, 'L_sep_weight_yyx': 8.359812078764404e-05, 'L_scale_weight_yyx': 6.244108104086219e-07, 'learning_rate_yyx': 0.008923017587446437}. Best is trial 53 with value: -1.855205638988598.
[I 2026-03-18 22:46:27,106] Trial 82 finished with value: -1.7818305121527778 and parameters: {'n_layers_yyx': 2, 'hidden_size_yyx_l0': 6, 'hidden_size_yyx_l1': 6, 'context_size_yyx': 2, 'num_mix_components_yyx': 5, 'context_extractor_yyx': 'gru', 'activation_func_yyx': 'GELU', 'L2_weight_yyx': 1.5443847304233624e-10, 'L_entropy_weight_yyx': 9.376739992698505e-06, 'L_sep_weight_yyx': 9.010042789882987e-06, 'L_scale_weight_yyx': 7.203783991163334e-07, 'learning_rate_yyx': 0.007875721545252203}. Best is trial 4 with value: -1.7875800731928662.
[I 2026-03-18 22:46:28,649] Trial 81 pruned. 
[I 2026-03-18 22:46:29,503] Trial 75 finished with value: -1.8489345986162031 and parameters: {'n_layers_yyx': 2, 'hidden_size_yyx_l0': 5, 'hidden_size_yyx_l1': 2, 'context_size_yyx': 4, 'num_mix_components_yyx': 5, 'context_extractor_yyx': 'gru', 'activation_func_yyx': 'ReLU', 'L2_weight_yyx': 9.906384716793212e-10, 'L_entropy_weight_yyx': 5.284652189208529e-09, 'L_sep_weight_yyx': 4.910293689249269e-10, 'L_scale_weight_yyx': 1.4934273649462265e-05, 'learning_rate_yyx': 0.00802265509248811}. Best is trial 0 with value: -1.8516305051550026.
[I 2026-03-18 22:46:32,107] Trial 74 finished with value: -1.8685652735200555 and parameters: {'n_layers_yyx': 1, 'hidden_size_yyx_l0': 6, 'context_size_yyx': 4, 'num_mix_components_yyx': 3, 'context_extractor_yyx': 'lstm', 'activation_func_yyx': 'ReLU', 'L2_weight_yyx': 1.6468092574060086e-10, 'L_entropy_weight_yyx': 2.846414379843164e-09, 'L_sep_weight_yyx': 2.970470631631194e-07, 'L_scale_weight_yyx': 1.1008871305337996e-06, 'learning_rate_yyx': 0.009205268798295887}. Best is trial 42 with value: -1.8699069075199783.
[I 2026-03-18 22:46:32,692] Trial 83 pruned. 

Source events: 12731
Target events: 24874
Full model ln_yyx : 1078.90198 nats/sec, 39.03722 nats/event
Full model Log loss : -1.78018
Full model ln_yyx : 1064.50057 nats/sec, 38.51614 nats/event
Full model Log loss : -1.78233
Full model ln_yyx : 1061.82222 nats/sec, 38.41923 nats/event
Full model Log loss : -1.78177
Full model ln_yyx : 1056.28492 nats/sec, 38.21888 nats/event
Full model Log loss : -1.77358
Full model ln_yyx : 1081.59366 nats/sec, 39.13461 nats/event
Full model Log loss : -1.78086
Full model ln_yyx : 1085.32241 nats/sec, 39.26953 nats/event
Full model Log loss : -1.78026
Full model ln_yyx : 1073.90420 nats/sec, 38.85639 nats/event
Full model Log loss : -1.77885
Full model ln_yyx : 1059.80459 nats/sec, 38.34623 nats/event
Full model Log loss : -1.77923
Full model ln_yyx : 1061.56360 nats/sec, 38.40988 nats/event
Full model Log loss : -1.77811
Full model ln_yyx : 1076.45589 nats/sec, 38.94871 nats/event
Full model Log loss : -1.78051
Full model ln_yyx : 1075.35587 nats/sec, 38.90891 nats/event
Full model Log loss : -1.77987
Full model ln_yyx : 1062.99065 nats/sec, 38.46151 nats/event
Full model Log loss : -1.78079
Full model ln_yyx : 1058.00143 nats/sec, 38.28099 nats/event
Full model Log loss : -1.77476
Full model ln_yyx : 1059.18160 nats/sec, 38.32369 nats/event
Full model Log loss : -1.78183
Optimization finished. Config saved to results/opt-full/opt_full_224_best_config.txt
[I 2026-03-18 22:46:35,998] Trial 76 pruned. 
[I 2026-03-18 22:46:37,966] Trial 75 pruned. 

Source events: 14713
Target events: 10683
Full model ln_yyx : 552.17707 nats/sec, 46.51871 nats/event
Full model Log loss : -1.86606
Full model ln_yyx : 555.00198 nats/sec, 46.75670 nats/event
Full model Log loss : -1.86822
Full model ln_yyx : 558.18054 nats/sec, 47.02448 nats/event
Full model Log loss : -1.86835
Full model ln_yyx : 554.75849 nats/sec, 46.73618 nats/event
Full model Log loss : -1.86984
Full model ln_yyx : 554.37083 nats/sec, 46.70352 nats/event
Full model Log loss : -1.86760
Full model ln_yyx : 552.63711 nats/sec, 46.55747 nats/event
Full model Log loss : -1.86991
Full model ln_yyx : 550.79532 nats/sec, 46.40230 nats/event
Full model Log loss : -1.86866
Full model ln_yyx : 553.53326 nats/sec, 46.63296 nats/event
Full model Log loss : -1.86849
Full model ln_yyx : 554.41322 nats/sec, 46.70710 nats/event
Full model Log loss : -1.86818
Full model ln_yyx : 551.75243 nats/sec, 46.48293 nats/event
Full model Log loss : -1.86847
Full model ln_yyx : 552.51094 nats/sec, 46.54684 nats/event
Full model Log loss : -1.86932
Full model ln_yyx : 558.69553 nats/sec, 47.06786 nats/event
Full model Log loss : -1.86824
Full model ln_yyx : 556.65334 nats/sec, 46.89582 nats/event
Full model Log loss : -1.86815
Full model ln_yyx : 552.79257 nats/sec, 46.57056 nats/event
Full model Log loss : -1.86860
Full model ln_yyx : 552.99631 nats/sec, 46.58773 nats/event
Full model Log loss : -1.86860
Full model ln_yyx : 555.21556 nats/sec, 46.77469 nats/event
Full model Log loss : -1.86825
Full model ln_yyx : 552.51249 nats/sec, 46.54697 nats/event
Full model Log loss : -1.86857
Optimization finished. Config saved to results/opt-full/opt_full_234_best_config.txt
[I 2026-03-18 22:46:41,949] Trial 77 pruned. 
[I 2026-03-18 22:46:44,594] Trial 78 pruned. 
[I 2026-03-18 22:46:45,104] Trial 82 pruned. 
[I 2026-03-18 22:46:53,973] Trial 79 finished with value: -1.8538773947099143 and parameters: {'n_layers_yyx': 1, 'hidden_size_yyx_l0': 5, 'context_size_yyx': 4, 'num_mix_components_yyx': 4, 'context_extractor_yyx': 'gru', 'activation_func_yyx': 'Tanh', 'L2_weight_yyx': 3.6822491354178957e-06, 'L_entropy_weight_yyx': 0.00010720567082110282, 'L_sep_weight_yyx': 0.00010474860550983012, 'L_scale_weight_yyx': 1.8459363632559093e-05, 'learning_rate_yyx': 0.009496297611592557}. Best is trial 53 with value: -1.855205638988598.
[I 2026-03-18 22:47:01,143] Trial 79 pruned. 
[I 2026-03-18 22:47:03,827] Trial 80 pruned. 
[I 2026-03-18 22:47:10,721] Trial 83 finished with value: -1.84774911566271 and parameters: {'n_layers_yyx': 2, 'hidden_size_yyx_l0': 2, 'hidden_size_yyx_l1': 6, 'context_size_yyx': 4, 'num_mix_components_yyx': 4, 'context_extractor_yyx': 'lstm', 'activation_func_yyx': 'ReLU', 'L2_weight_yyx': 9.398501400456945e-06, 'L_entropy_weight_yyx': 2.909834148438484e-05, 'L_sep_weight_yyx': 4.961054716445471e-07, 'L_scale_weight_yyx': 7.544458118737864e-06, 'learning_rate_yyx': 0.007543358062754987}. Best is trial 60 with value: -1.8490650754743791.
[I 2026-03-18 22:47:13,131] Trial 84 pruned. 

Source events: 14713
Target events: 20315
Full model ln_yyx : 1048.17602 nats/sec, 46.43655 nats/event
Full model Log loss : -1.84752
Full model ln_yyx : 1047.23274 nats/sec, 46.39476 nats/event
Full model Log loss : -1.84748
Full model ln_yyx : 1039.54644 nats/sec, 46.05424 nats/event
Full model Log loss : -1.84700
Full model ln_yyx : 1048.36034 nats/sec, 46.44471 nats/event
Full model Log loss : -1.84754
Full model ln_yyx : 1048.45137 nats/sec, 46.44874 nats/event
Full model Log loss : -1.84754
Full model ln_yyx : 1047.68393 nats/sec, 46.41474 nats/event
Full model Log loss : -1.84803
Full model ln_yyx : 1039.61622 nats/sec, 46.05733 nats/event
Full model Log loss : -1.84694
Full model ln_yyx : 1050.97169 nats/sec, 46.56040 nats/event
Full model Log loss : -1.84907
Full model ln_yyx : 1047.84717 nats/sec, 46.42198 nats/event
Full model Log loss : -1.84590
Full model ln_yyx : 1048.25982 nats/sec, 46.44026 nats/event
Full model Log loss : -1.84798
Full model ln_yyx : 1052.11251 nats/sec, 46.61094 nats/event
Full model Log loss : -1.84882
Full model ln_yyx : 1048.36221 nats/sec, 46.44479 nats/event
Full model Log loss : -1.84803
Full model ln_yyx : 1047.44636 nats/sec, 46.40422 nats/event
Full model Log loss : -1.84885
Full model ln_yyx : 1050.95723 nats/sec, 46.55976 nats/event
Full model Log loss : -1.84596
Full model ln_yyx : 1057.08618 nats/sec, 46.83129 nats/event
Full model Log loss : -1.84851
Full model ln_yyx : 1044.81069 nats/sec, 46.28745 nats/event
Full model Log loss : -1.84867
Full model ln_yyx : 1053.84169 nats/sec, 46.68755 nats/event
Full model Log loss : -1.84807
Full model ln_yyx : 1045.02886 nats/sec, 46.29712 nats/event
Full model Log loss : -1.84717
Full model ln_yyx : 1050.23281 nats/sec, 46.52767 nats/event
Full model Log loss : -1.84888
Full model ln_yyx : 1050.28743 nats/sec, 46.53009 nats/event
Full model Log loss : -1.84843
Full model ln_yyx : 1053.81301 nats/sec, 46.68628 nats/event
Full model Log loss : -1.84775
Optimization finished. Config saved to results/opt-full/opt_full_230_best_config.txt
[I 2026-03-18 22:47:18,603] Trial 54 finished with value: -1.8566708634152482 and parameters: {'n_layers_yyx': 1, 'hidden_size_yyx_l0': 4, 'context_size_yyx': 4, 'num_mix_components_yyx': 4, 'context_extractor_yyx': 'lstm', 'activation_func_yyx': 'Tanh', 'L2_weight_yyx': 3.316188095995094e-10, 'L_entropy_weight_yyx': 0.0004190199335221516, 'L_sep_weight_yyx': 1.0100835788858066e-10, 'L_scale_weight_yyx': 2.9819486096711925e-06, 'learning_rate_yyx': 0.0012652934377518298}. Best is trial 40 with value: -1.861402018567546.
[I 2026-03-18 22:47:20,951] Trial 55 pruned. 
