[I 2026-03-18 22:26:41,339] Trial 75 pruned. 
[I 2026-03-18 22:26:42,826] Trial 33 finished with value: -2.4752025233954456 and parameters: {'n_layers_yyx': 1, 'hidden_size_yyx_l0': 4, 'context_size_yyx': 4, 'num_mix_components_yyx': 2, 'context_extractor_yyx': 'gru', 'activation_func_yyx': 'ReLU', 'L2_weight_yyx': 3.1238267909871793e-06, 'L_entropy_weight_yyx': 7.917380991245881e-07, 'L_sep_weight_yyx': 7.754850257291424e-07, 'L_scale_weight_yyx': 2.3424239034711875e-08, 'learning_rate_yyx': 0.009364319961440905}. Best is trial 33 with value: -2.4752025233954456.
[I 2026-03-18 22:26:44,684] Trial 76 pruned. 
[I 2026-03-18 22:26:45,988] Trial 82 pruned. 

Source events: 3403
Target events: 39192
Full model ln_yyx : 395.98266 nats/sec, 9.09329 nats/event
Full model Log loss : -1.43231
Full model ln_yyx : 388.49166 nats/sec, 8.92127 nats/event
Full model Log loss : -1.40730
Full model ln_yyx : 393.85434 nats/sec, 9.04442 nats/event
Full model Log loss : -1.41862
Full model ln_yyx : 393.47543 nats/sec, 9.03572 nats/event
Full model Log loss : -1.41896
Full model ln_yyx : 394.23638 nats/sec, 9.05319 nats/event
Full model Log loss : -1.44835
Full model ln_yyx : 394.22131 nats/sec, 9.05285 nats/event
Full model Log loss : -1.44834
Full model ln_yyx : 396.40972 nats/sec, 9.10310 nats/event
Full model Log loss : -1.44780
Optimization finished. Config saved to results/opt-full/opt_full_250_best_config.txt
[I 2026-03-18 22:26:46,396] Trial 89 pruned. 
[I 2026-03-18 22:26:47,080] Trial 73 pruned. 
[I 2026-03-18 22:26:47,974] Trial 77 pruned. 
[I 2026-03-18 22:26:48,630] Trial 63 pruned. 
[I 2026-03-18 22:26:52,125] Trial 69 pruned. 
[I 2026-03-18 22:26:52,953] Trial 90 pruned. 
[I 2026-03-18 22:26:54,439] Trial 67 finished with value: -1.435750732421875 and parameters: {'n_layers_yyx': 1, 'hidden_size_yyx_l0': 4, 'context_size_yyx': 4, 'num_mix_components_yyx': 5, 'context_extractor_yyx': 'lstm', 'activation_func_yyx': 'ReLU', 'L2_weight_yyx': 6.362233861659792e-05, 'L_entropy_weight_yyx': 3.3569744182491885e-08, 'L_sep_weight_yyx': 1.777029191951042e-07, 'L_scale_weight_yyx': 2.6970220139376556e-10, 'learning_rate_yyx': 0.005650431541700506}. Best is trial 29 with value: -1.4683670278695913.
[I 2026-03-18 22:26:54,849] Trial 84 finished with value: -1.4513138052133414 and parameters: {'n_layers_yyx': 2, 'hidden_size_yyx_l0': 6, 'hidden_size_yyx_l1': 5, 'context_size_yyx': 3, 'num_mix_components_yyx': 4, 'context_extractor_yyx': 'lstm', 'activation_func_yyx': 'Tanh', 'L2_weight_yyx': 8.243518297436465e-08, 'L_entropy_weight_yyx': 3.4813149670395654e-08, 'L_sep_weight_yyx': 0.00034645269314949166, 'L_scale_weight_yyx': 2.2562266803452767e-08, 'learning_rate_yyx': 0.009276772355144668}. Best is trial 32 with value: -1.4672450138972355.
[I 2026-03-18 22:26:56,714] Trial 91 pruned. 
[I 2026-03-18 22:27:00,935] Trial 47 finished with value: -1.354379648061899 and parameters: {'n_layers_yyx': 2, 'hidden_size_yyx_l0': 4, 'hidden_size_yyx_l1': 6, 'context_size_yyx': 3, 'num_mix_components_yyx': 1, 'context_extractor_yyx': 'gru', 'activation_func_yyx': 'GELU', 'L2_weight_yyx': 0.0004915021679543238, 'L_entropy_weight_yyx': 5.2109000206966186e-06, 'L_sep_weight_yyx': 0.0001810550694504461, 'L_scale_weight_yyx': 1.026729576526654e-07, 'learning_rate_yyx': 0.009480867202969806}. Best is trial 45 with value: -1.4586368032602164.
[I 2026-03-18 22:27:01,846] Trial 74 pruned. 
[I 2026-03-18 22:27:02,699] Trial 67 finished with value: -1.3259963989257812 and parameters: {'n_layers_yyx': 2, 'hidden_size_yyx_l0': 3, 'hidden_size_yyx_l1': 4, 'context_size_yyx': 3, 'num_mix_components_yyx': 3, 'context_extractor_yyx': 'gru', 'activation_func_yyx': 'Tanh', 'L2_weight_yyx': 3.1499024394896227e-09, 'L_entropy_weight_yyx': 1.4253550384391083e-06, 'L_sep_weight_yyx': 0.0009053928179753683, 'L_scale_weight_yyx': 3.758085925705953e-08, 'learning_rate_yyx': 0.008950378637689051}. Best is trial 19 with value: -1.4628589806189904.
[I 2026-03-18 22:27:04,225] Trial 78 finished with value: -1.4170277913411458 and parameters: {'n_layers_yyx': 1, 'hidden_size_yyx_l0': 6, 'context_size_yyx': 4, 'num_mix_components_yyx': 4, 'context_extractor_yyx': 'lstm', 'activation_func_yyx': 'Tanh', 'L2_weight_yyx': 9.419713984621e-06, 'L_entropy_weight_yyx': 1.044171545725183e-05, 'L_sep_weight_yyx': 3.1587947881571114e-06, 'L_scale_weight_yyx': 2.319749606229934e-09, 'learning_rate_yyx': 0.008401822657756674}. Best is trial 24 with value: -1.4518791534615763.
[I 2026-03-18 22:27:05,764] Trial 64 pruned. 
[I 2026-03-18 22:27:07,439] Trial 75 pruned. 
[I 2026-03-18 22:27:08,205] Trial 70 pruned. 
[I 2026-03-18 22:27:08,445] Trial 40 finished with value: -2.4852120465012417 and parameters: {'n_layers_yyx': 2, 'hidden_size_yyx_l0': 5, 'hidden_size_yyx_l1': 5, 'context_size_yyx': 1, 'num_mix_components_yyx': 5, 'context_extractor_yyx': 'lstm', 'activation_func_yyx': 'GELU', 'L2_weight_yyx': 2.3712113724282787e-07, 'L_entropy_weight_yyx': 1.6691899515424647e-07, 'L_sep_weight_yyx': 5.6476554142658006e-09, 'L_scale_weight_yyx': 1.65729212529891e-08, 'learning_rate_yyx': 0.005862461892406849}. Best is trial 35 with value: -2.497237209565205.
[I 2026-03-18 22:27:09,173] Trial 85 pruned. 
[I 2026-03-18 22:27:09,796] Trial 79 pruned. 
[I 2026-03-18 22:27:16,254] Trial 80 pruned. 
[I 2026-03-18 22:27:16,272] Trial 48 pruned. 
[I 2026-03-18 22:27:17,681] Trial 62 finished with value: -2.4841048103436085 and parameters: {'n_layers_yyx': 1, 'hidden_size_yyx_l0': 6, 'context_size_yyx': 4, 'num_mix_components_yyx': 5, 'context_extractor_yyx': 'gru', 'activation_func_yyx': 'ReLU', 'L2_weight_yyx': 5.8334323847866276e-05, 'L_entropy_weight_yyx': 0.00014762619302066343, 'L_sep_weight_yyx': 3.2747728741563403e-06, 'L_scale_weight_yyx': 8.856495963819303e-07, 'learning_rate_yyx': 0.009181285527854369}. Best is trial 46 with value: -2.4875562296733595.
[I 2026-03-18 22:27:18,088] Trial 78 finished with value: -1.4289117901141828 and parameters: {'n_layers_yyx': 2, 'hidden_size_yyx_l0': 4, 'hidden_size_yyx_l1': 3, 'context_size_yyx': 2, 'num_mix_components_yyx': 5, 'context_extractor_yyx': 'lstm', 'activation_func_yyx': 'ReLU', 'L2_weight_yyx': 4.681400595594838e-05, 'L_entropy_weight_yyx': 0.00025857182522964945, 'L_sep_weight_yyx': 5.359569475997292e-07, 'L_scale_weight_yyx': 4.248670294158862e-05, 'learning_rate_yyx': 0.005018613804666589}. Best is trial 27 with value: -1.4597027822641226.
[I 2026-03-18 22:27:18,989] Trial 81 pruned. 
[I 2026-03-18 22:27:19,215] Trial 49 pruned. 
[I 2026-03-18 22:27:19,537] Trial 67 finished with value: -1.4402753624549278 and parameters: {'n_layers_yyx': 2, 'hidden_size_yyx_l0': 3, 'hidden_size_yyx_l1': 4, 'context_size_yyx': 1, 'num_mix_components_yyx': 3, 'context_extractor_yyx': 'lstm', 'activation_func_yyx': 'ReLU', 'L2_weight_yyx': 5.416601122416782e-05, 'L_entropy_weight_yyx': 2.7195462882860855e-05, 'L_sep_weight_yyx': 2.250248383227067e-07, 'L_scale_weight_yyx': 1.591633975428276e-10, 'learning_rate_yyx': 0.00645197221325333}. Best is trial 63 with value: -1.4621721942608172.
[I 2026-03-18 22:27:22,239] Trial 65 pruned. 
[I 2026-03-18 22:27:22,537] Trial 50 pruned. 
[I 2026-03-18 22:27:22,557] Trial 68 finished with value: -1.4631113140399639 and parameters: {'n_layers_yyx': 1, 'hidden_size_yyx_l0': 4, 'context_size_yyx': 4, 'num_mix_components_yyx': 5, 'context_extractor_yyx': 'lstm', 'activation_func_yyx': 'Tanh', 'L2_weight_yyx': 0.00018650895004985348, 'L_entropy_weight_yyx': 6.4002879864415505e-09, 'L_sep_weight_yyx': 4.947684281843718e-07, 'L_scale_weight_yyx': 1.20507733818418e-09, 'learning_rate_yyx': 0.009116106589773245}. Best is trial 29 with value: -1.4683670278695913.
[I 2026-03-18 22:27:23,349] Trial 86 pruned. 
[I 2026-03-18 22:27:33,667] Trial 63 pruned. 
[I 2026-03-18 22:27:33,755] Trial 82 pruned. 
[I 2026-03-18 22:27:35,569] Trial 68 finished with value: -1.4565111835186297 and parameters: {'n_layers_yyx': 1, 'hidden_size_yyx_l0': 4, 'context_size_yyx': 2, 'num_mix_components_yyx': 4, 'context_extractor_yyx': 'lstm', 'activation_func_yyx': 'Tanh', 'L2_weight_yyx': 1.4464730399706651e-08, 'L_entropy_weight_yyx': 1.098535613856677e-05, 'L_sep_weight_yyx': 0.0002494903617255313, 'L_scale_weight_yyx': 8.272945605221992e-07, 'learning_rate_yyx': 0.009518713735994746}. Best is trial 19 with value: -1.4628589806189904.
[I 2026-03-18 22:27:35,644] Trial 76 finished with value: -1.5710180017871789 and parameters: {'n_layers_yyx': 2, 'hidden_size_yyx_l0': 5, 'hidden_size_yyx_l1': 5, 'context_size_yyx': 2, 'num_mix_components_yyx': 5, 'context_extractor_yyx': 'gru', 'activation_func_yyx': 'Tanh', 'L2_weight_yyx': 3.4732419655051254e-05, 'L_entropy_weight_yyx': 2.0665169988206106e-10, 'L_sep_weight_yyx': 3.00913213815044e-07, 'L_scale_weight_yyx': 0.0001042702590232202, 'learning_rate_yyx': 0.006830170303590965}. Best is trial 72 with value: -1.5875397135778677.
[I 2026-03-18 22:27:35,962] Trial 68 pruned. 
[I 2026-03-18 22:27:38,864] Trial 66 pruned. 
[I 2026-03-18 22:27:39,512] Trial 71 finished with value: -1.4466248262845554 and parameters: {'n_layers_yyx': 1, 'hidden_size_yyx_l0': 3, 'context_size_yyx': 4, 'num_mix_components_yyx': 4, 'context_extractor_yyx': 'lstm', 'activation_func_yyx': 'Tanh', 'L2_weight_yyx': 6.553969749376634e-10, 'L_entropy_weight_yyx': 7.275725416849219e-09, 'L_sep_weight_yyx': 1.9692494029041367e-05, 'L_scale_weight_yyx': 0.0002612034798026385, 'learning_rate_yyx': 0.00815926697459787}. Best is trial 49 with value: -1.4726762272761418.
[I 2026-03-18 22:27:40,912] Trial 92 finished with value: -1.5097517795250064 and parameters: {'n_layers_yyx': 1, 'hidden_size_yyx_l0': 5, 'context_size_yyx': 4, 'num_mix_components_yyx': 2, 'context_extractor_yyx': 'lstm', 'activation_func_yyx': 'Tanh', 'L2_weight_yyx': 3.773384074014507e-08, 'L_entropy_weight_yyx': 2.113991643753508e-07, 'L_sep_weight_yyx': 8.346105522186799e-05, 'L_scale_weight_yyx': 1.2635949988180542e-10, 'learning_rate_yyx': 0.009310486291935713}. Best is trial 67 with value: -1.5294848582783684.

Source events: 3403
Target events: 3618
Full model ln_yyx : 35.35163 nats/sec, 8.79394 nats/event
Full model Log loss : -1.40955
Full model ln_yyx : 36.94391 nats/sec, 9.19003 nats/event
Full model Log loss : -1.48026
Full model ln_yyx : 36.85563 nats/sec, 9.16807 nats/event
Full model Log loss : -1.52948
Full model ln_yyx : 35.85544 nats/sec, 8.91926 nats/event
Full model Log loss : -1.48642
Full model ln_yyx : 36.88212 nats/sec, 9.17466 nats/event
Full model Log loss : -1.52678
Full model ln_yyx : 36.75573 nats/sec, 9.14322 nats/event
Full model Log loss : -1.50975
Optimization finished. Config saved to results/opt-full/opt_full_251_best_config.txt
[I 2026-03-18 22:27:41,616] Trial 77 pruned. 
[I 2026-03-18 22:27:42,619] Trial 69 pruned. 
[I 2026-03-18 22:27:45,701] Trial 72 pruned. 
[I 2026-03-18 22:27:48,680] Trial 73 pruned. 
[I 2026-03-18 22:27:48,683] Trial 87 finished with value: -1.4384678532527044 and parameters: {'n_layers_yyx': 2, 'hidden_size_yyx_l0': 6, 'hidden_size_yyx_l1': 4, 'context_size_yyx': 3, 'num_mix_components_yyx': 5, 'context_extractor_yyx': 'lstm', 'activation_func_yyx': 'Tanh', 'L2_weight_yyx': 7.577454422102703e-07, 'L_entropy_weight_yyx': 3.6947530310119704e-07, 'L_sep_weight_yyx': 0.0006650378657177307, 'L_scale_weight_yyx': 2.677056414500152e-07, 'learning_rate_yyx': 0.004597677605307175}. Best is trial 32 with value: -1.4672450138972355.
[I 2026-03-18 22:27:50,304] Trial 69 finished with value: -1.464608882023738 and parameters: {'n_layers_yyx': 1, 'hidden_size_yyx_l0': 4, 'context_size_yyx': 4, 'num_mix_components_yyx': 5, 'context_extractor_yyx': 'lstm', 'activation_func_yyx': 'Tanh', 'L2_weight_yyx': 0.00017813836549253033, 'L_entropy_weight_yyx': 8.921673280340935e-09, 'L_sep_weight_yyx': 1.7226757990318455e-08, 'L_scale_weight_yyx': 1.1294769441954108e-09, 'learning_rate_yyx': 0.009202041229362379}. Best is trial 29 with value: -1.4683670278695913.
[I 2026-03-18 22:27:51,769] Trial 88 pruned. 
[I 2026-03-18 22:27:52,903] Trial 51 finished with value: -1.4480335881159856 and parameters: {'n_layers_yyx': 2, 'hidden_size_yyx_l0': 3, 'hidden_size_yyx_l1': 4, 'context_size_yyx': 4, 'num_mix_components_yyx': 4, 'context_extractor_yyx': 'gru', 'activation_func_yyx': 'Tanh', 'L2_weight_yyx': 7.357617310821915e-07, 'L_entropy_weight_yyx': 8.345212549518418e-05, 'L_sep_weight_yyx': 3.5438092066929273e-09, 'L_scale_weight_yyx': 1.172835535465115e-07, 'learning_rate_yyx': 0.007874354596767849}. Best is trial 45 with value: -1.4586368032602164.
[I 2026-03-18 22:27:54,492] Trial 74 pruned. 
[I 2026-03-18 22:27:55,526] Trial 67 pruned. 
[I 2026-03-18 22:27:56,614] Trial 70 pruned. 
[I 2026-03-18 22:27:56,720] Trial 69 finished with value: -1.407183368389423 and parameters: {'n_layers_yyx': 2, 'hidden_size_yyx_l0': 3, 'hidden_size_yyx_l1': 5, 'context_size_yyx': 2, 'num_mix_components_yyx': 4, 'context_extractor_yyx': 'lstm', 'activation_func_yyx': 'Tanh', 'L2_weight_yyx': 1.523294349273461e-08, 'L_entropy_weight_yyx': 1.091584989075165e-05, 'L_sep_weight_yyx': 0.00024858320290254646, 'L_scale_weight_yyx': 1.6572940377794765e-10, 'learning_rate_yyx': 0.008436965745536361}. Best is trial 19 with value: -1.4628589806189904.
[I 2026-03-18 22:27:57,007] Trial 79 finished with value: -1.4283969350961538 and parameters: {'n_layers_yyx': 2, 'hidden_size_yyx_l0': 3, 'hidden_size_yyx_l1': 4, 'context_size_yyx': 3, 'num_mix_components_yyx': 3, 'context_extractor_yyx': 'lstm', 'activation_func_yyx': 'ReLU', 'L2_weight_yyx': 2.2933807737513054e-07, 'L_entropy_weight_yyx': 0.0009773535641706128, 'L_sep_weight_yyx': 0.0005485068699655834, 'L_scale_weight_yyx': 0.0009901710305881275, 'learning_rate_yyx': 0.007062332020773308}. Best is trial 27 with value: -1.4597027822641226.

Source events: 3403
Target events: 10683
Full model ln_yyx : 105.79311 nats/sec, 8.91265 nats/event
Full model Log loss : -1.39544
Full model ln_yyx : 106.22121 nats/sec, 8.94871 nats/event
Full model Log loss : -1.44066
Full model ln_yyx : 108.06551 nats/sec, 9.10409 nats/event
Full model Log loss : -1.43834
Full model ln_yyx : 107.39327 nats/sec, 9.04745 nats/event
Full model Log loss : -1.41651
Full model ln_yyx : 108.62071 nats/sec, 9.15086 nats/event
Full model Log loss : -1.43232
Full model ln_yyx : 110.00651 nats/sec, 9.26761 nats/event
Full model Log loss : -1.44138
Full model ln_yyx : 108.28344 nats/sec, 9.12245 nats/event
Full model Log loss : -1.40043
Full model ln_yyx : 108.44139 nats/sec, 9.13575 nats/event
Full model Log loss : -1.44022
Full model ln_yyx : 107.79653 nats/sec, 9.08143 nats/event
Full model Log loss : -1.45127
Full model ln_yyx : 107.09056 nats/sec, 9.02195 nats/event
Full model Log loss : -1.42891
Full model ln_yyx : 107.93501 nats/sec, 9.09309 nats/event
Full model Log loss : -1.42840
Optimization finished. Config saved to results/opt-full/opt_full_246_best_config.txt
[I 2026-03-18 22:27:57,154] Trial 89 pruned. 
[I 2026-03-18 22:28:02,314] Trial 70 pruned. 
[I 2026-03-18 22:28:02,448] Trial 71 pruned. 
[I 2026-03-18 22:28:05,235] Trial 72 pruned. 
[I 2026-03-18 22:28:05,827] Trial 78 finished with value: -1.5809977928514583 and parameters: {'n_layers_yyx': 2, 'hidden_size_yyx_l0': 5, 'hidden_size_yyx_l1': 5, 'context_size_yyx': 2, 'num_mix_components_yyx': 5, 'context_extractor_yyx': 'gru', 'activation_func_yyx': 'Tanh', 'L2_weight_yyx': 1.7530829484441396e-05, 'L_entropy_weight_yyx': 1.0862413939036716e-10, 'L_sep_weight_yyx': 2.5117256686808374e-06, 'L_scale_weight_yyx': 0.00010039439768682186, 'learning_rate_yyx': 0.00916671637476551}. Best is trial 72 with value: -1.5875397135778677.
[I 2026-03-18 22:28:07,867] Trial 71 pruned. 
[I 2026-03-18 22:28:07,911] Trial 75 pruned. 
[I 2026-03-18 22:28:08,333] Trial 83 finished with value: -1.4132271532742482 and parameters: {'n_layers_yyx': 1, 'hidden_size_yyx_l0': 6, 'context_size_yyx': 4, 'num_mix_components_yyx': 3, 'context_extractor_yyx': 'lstm', 'activation_func_yyx': 'Tanh', 'L2_weight_yyx': 3.2748528903279984e-05, 'L_entropy_weight_yyx': 9.059569868217741e-10, 'L_sep_weight_yyx': 4.568011638074615e-06, 'L_scale_weight_yyx': 1.0239946852736029e-08, 'learning_rate_yyx': 0.00825764193451284}. Best is trial 24 with value: -1.4518791534615763.
[I 2026-03-18 22:28:10,765] Trial 76 pruned. 
[I 2026-03-18 22:28:11,221] Trial 79 pruned. 
[I 2026-03-18 22:28:11,790] Trial 68 pruned. 
[I 2026-03-18 22:28:13,049] Trial 72 pruned. 
[I 2026-03-18 22:28:15,818] Trial 73 pruned. 
[I 2026-03-18 22:28:16,439] Trial 80 pruned. 
[I 2026-03-18 22:28:18,466] Trial 74 pruned. 
[I 2026-03-18 22:28:18,826] Trial 73 pruned. 
[I 2026-03-18 22:28:19,909] Trial 64 finished with value: -2.485264423076923 and parameters: {'n_layers_yyx': 1, 'hidden_size_yyx_l0': 6, 'context_size_yyx': 4, 'num_mix_components_yyx': 5, 'context_extractor_yyx': 'gru', 'activation_func_yyx': 'ReLU', 'L2_weight_yyx': 6.871041248123934e-06, 'L_entropy_weight_yyx': 0.0004889773355840556, 'L_sep_weight_yyx': 2.274839937287955e-05, 'L_scale_weight_yyx': 3.127423661424374e-07, 'learning_rate_yyx': 0.00741258747086932}. Best is trial 46 with value: -2.4875562296733595.
[I 2026-03-18 22:28:21,013] Trial 90 finished with value: -1.3741959087665265 and parameters: {'n_layers_yyx': 2, 'hidden_size_yyx_l0': 5, 'hidden_size_yyx_l1': 6, 'context_size_yyx': 4, 'num_mix_components_yyx': 4, 'context_extractor_yyx': 'lstm', 'activation_func_yyx': 'Tanh', 'L2_weight_yyx': 4.443324720175443e-07, 'L_entropy_weight_yyx': 1.4108132822941762e-07, 'L_sep_weight_yyx': 1.3947149632520776e-06, 'L_scale_weight_yyx': 1.5649798700200726e-05, 'learning_rate_yyx': 0.00991646168740297}. Best is trial 32 with value: -1.4672450138972355.
[I 2026-03-18 22:28:21,805] Trial 52 finished with value: -1.4370253342848558 and parameters: {'n_layers_yyx': 2, 'hidden_size_yyx_l0': 3, 'hidden_size_yyx_l1': 4, 'context_size_yyx': 4, 'num_mix_components_yyx': 5, 'context_extractor_yyx': 'gru', 'activation_func_yyx': 'Tanh', 'L2_weight_yyx': 7.481373496557403e-07, 'L_entropy_weight_yyx': 0.00012786927590313654, 'L_sep_weight_yyx': 4.6984778194378264e-09, 'L_scale_weight_yyx': 1.2661186811628555e-07, 'learning_rate_yyx': 0.007793883336221991}. Best is trial 45 with value: -1.4586368032602164.
[I 2026-03-18 22:28:22,593] Trial 84 pruned. 
[I 2026-03-18 22:28:23,408] Trial 41 finished with value: -2.4904704237960544 and parameters: {'n_layers_yyx': 2, 'hidden_size_yyx_l0': 6, 'hidden_size_yyx_l1': 4, 'context_size_yyx': 3, 'num_mix_components_yyx': 4, 'context_extractor_yyx': 'gru', 'activation_func_yyx': 'Tanh', 'L2_weight_yyx': 4.3551051275945175e-10, 'L_entropy_weight_yyx': 7.096342654269831e-07, 'L_sep_weight_yyx': 1.53750647951582e-08, 'L_scale_weight_yyx': 1.5777316399167722e-07, 'learning_rate_yyx': 0.0020902126990841323}. Best is trial 35 with value: -2.497237209565205.
[I 2026-03-18 22:28:23,631] Trial 70 pruned. 
[I 2026-03-18 22:28:23,728] Trial 75 pruned. 
[I 2026-03-18 22:28:23,812] Trial 91 pruned. 
[I 2026-03-18 22:28:26,737] Trial 71 pruned. 
[I 2026-03-18 22:28:27,760] Trial 69 pruned. 
[I 2026-03-18 22:28:30,160] Trial 34 finished with value: -2.477771523391826 and parameters: {'n_layers_yyx': 1, 'hidden_size_yyx_l0': 4, 'context_size_yyx': 4, 'num_mix_components_yyx': 2, 'context_extractor_yyx': 'gru', 'activation_func_yyx': 'ReLU', 'L2_weight_yyx': 3.948782419000453e-06, 'L_entropy_weight_yyx': 3.827855520872612e-07, 'L_sep_weight_yyx': 7.721513542892622e-07, 'L_scale_weight_yyx': 2.5362885381675862e-08, 'learning_rate_yyx': 0.009605754691455668}. Best is trial 34 with value: -2.477771523391826.
[I 2026-03-18 22:28:33,256] Trial 72 pruned. 
[I 2026-03-18 22:28:35,731] Trial 65 pruned. 
[I 2026-03-18 22:28:37,556] Trial 85 pruned. 
[I 2026-03-18 22:28:39,364] Trial 77 finished with value: -1.4538535954402043 and parameters: {'n_layers_yyx': 2, 'hidden_size_yyx_l0': 6, 'hidden_size_yyx_l1': 3, 'context_size_yyx': 4, 'num_mix_components_yyx': 4, 'context_extractor_yyx': 'lstm', 'activation_func_yyx': 'Tanh', 'L2_weight_yyx': 6.081886494786821e-09, 'L_entropy_weight_yyx': 2.868941120130645e-08, 'L_sep_weight_yyx': 0.0003660693367335287, 'L_scale_weight_yyx': 8.308638753674713e-05, 'learning_rate_yyx': 0.007852041865394649}. Best is trial 49 with value: -1.4726762272761418.
[I 2026-03-18 22:28:42,110] Trial 78 pruned. 
[I 2026-03-18 22:28:43,387] Trial 86 pruned. 

Source events: 3403
Target events: 3828
Full model ln_yyx : 36.69317 nats/sec, 8.62692 nats/event
Full model Log loss : -1.32581
Full model ln_yyx : 37.14064 nats/sec, 8.73212 nats/event
Full model Log loss : -1.37963
Full model ln_yyx : 37.29128 nats/sec, 8.76754 nats/event
Full model Log loss : -1.36708
Full model ln_yyx : 38.36530 nats/sec, 9.02006 nats/event
Full model Log loss : -1.41064
Full model ln_yyx : 37.26745 nats/sec, 8.76194 nats/event
Full model Log loss : -1.39086
Full model ln_yyx : 37.97449 nats/sec, 8.92817 nats/event
Full model Log loss : -1.38628
Full model ln_yyx : 38.10353 nats/sec, 8.95851 nats/event
Full model Log loss : -1.38223
Full model ln_yyx : 38.30660 nats/sec, 9.00625 nats/event
Full model Log loss : -1.41703
Full model ln_yyx : 38.05257 nats/sec, 8.94653 nats/event
Full model Log loss : -1.41323
Optimization finished. Config saved to results/opt-full/opt_full_243_best_config.txt
[I 2026-03-18 22:28:43,987] Trial 81 finished with value: -1.5962556995106763 and parameters: {'n_layers_yyx': 2, 'hidden_size_yyx_l0': 5, 'hidden_size_yyx_l1': 4, 'context_size_yyx': 2, 'num_mix_components_yyx': 5, 'context_extractor_yyx': 'gru', 'activation_func_yyx': 'Tanh', 'L2_weight_yyx': 7.08756371747079e-10, 'L_entropy_weight_yyx': 2.3003405415523213e-10, 'L_sep_weight_yyx': 2.7371492883829965e-05, 'L_scale_weight_yyx': 1.9210540252310777e-10, 'learning_rate_yyx': 0.009970979086012521}. Best is trial 81 with value: -1.5962556995106763.
