[I 2026-03-18 19:24:34,381] Trial 12 finished with value: -2.020448587856086 and parameters: {'n_layers_yyx': 2, 'hidden_size_yyx_l0': 4, 'hidden_size_yyx_l1': 5, 'context_size_yyx': 1, 'num_mix_components_yyx': 4, 'context_extractor_yyx': 'gru', 'activation_func_yyx': 'Tanh', 'L2_weight_yyx': 6.577227995145613e-06, 'L_entropy_weight_yyx': 0.0007851832290856917, 'L_sep_weight_yyx': 4.2212246068275016e-10, 'L_scale_weight_yyx': 5.684262199996267e-06, 'learning_rate_yyx': 0.00382849992800167}. Best is trial 4 with value: -2.021612486156544.
[I 2026-03-18 19:24:36,449] Trial 9 pruned. 
[I 2026-03-18 19:24:36,591] Trial 8 pruned. 
[I 2026-03-18 19:24:38,936] Trial 12 pruned. 
[I 2026-03-18 19:24:41,522] Trial 16 pruned. 
[I 2026-03-18 19:24:49,873] Trial 7 pruned. 
[I 2026-03-18 19:24:56,416] Trial 17 pruned. 
[I 2026-03-18 19:24:56,451] Trial 13 finished with value: -1.9795279779276638 and parameters: {'n_layers_yyx': 1, 'hidden_size_yyx_l0': 4, 'context_size_yyx': 3, 'num_mix_components_yyx': 5, 'context_extractor_yyx': 'lstm', 'activation_func_yyx': 'Tanh', 'L2_weight_yyx': 9.331666036660238e-06, 'L_entropy_weight_yyx': 3.091017445989723e-09, 'L_sep_weight_yyx': 3.697620099588313e-09, 'L_scale_weight_yyx': 6.739266380468512e-08, 'learning_rate_yyx': 0.00953758477464732}. Best is trial 1 with value: -1.9828018961884801.
[I 2026-03-18 19:25:02,047] Trial 5 finished with value: -2.5470815805288463 and parameters: {'n_layers_yyx': 2, 'hidden_size_yyx_l0': 3, 'hidden_size_yyx_l1': 4, 'context_size_yyx': 4, 'num_mix_components_yyx': 4, 'context_extractor_yyx': 'gru', 'activation_func_yyx': 'Tanh', 'L2_weight_yyx': 8.148293766036347e-09, 'L_entropy_weight_yyx': 1.591335348588666e-07, 'L_sep_weight_yyx': 9.997013109532462e-08, 'L_scale_weight_yyx': 7.619445053360795e-07, 'learning_rate_yyx': 0.007585148615213576}. Best is trial 4 with value: -2.547155606996763.
[I 2026-03-18 19:25:03,692] Trial 17 finished with value: -1.9810969967763319 and parameters: {'n_layers_yyx': 1, 'hidden_size_yyx_l0': 4, 'context_size_yyx': 4, 'num_mix_components_yyx': 4, 'context_extractor_yyx': 'gru', 'activation_func_yyx': 'Tanh', 'L2_weight_yyx': 6.012774313395738e-05, 'L_entropy_weight_yyx': 1.313835172230702e-08, 'L_sep_weight_yyx': 4.065297989601035e-06, 'L_scale_weight_yyx': 1.3654356981600622e-07, 'learning_rate_yyx': 0.0032820636564977637}. Best is trial 11 with value: -1.9852781357200364.
[I 2026-03-18 19:25:06,894] Trial 13 pruned. 
[I 2026-03-18 19:25:13,703] Trial 9 pruned. 
[I 2026-03-18 19:25:18,063] Trial 13 finished with value: -1.6789194095140463 and parameters: {'n_layers_yyx': 1, 'hidden_size_yyx_l0': 5, 'context_size_yyx': 3, 'num_mix_components_yyx': 3, 'context_extractor_yyx': 'lstm', 'activation_func_yyx': 'GELU', 'L2_weight_yyx': 0.0009505601238293297, 'L_entropy_weight_yyx': 5.5035436257891654e-06, 'L_sep_weight_yyx': 8.068742596038639e-09, 'L_scale_weight_yyx': 1.4027252221175722e-07, 'learning_rate_yyx': 0.004681185085240849}. Best is trial 13 with value: -1.6789194095140463.
[I 2026-03-18 19:25:19,827] Trial 14 pruned. 
[I 2026-03-18 19:25:21,068] Trial 14 finished with value: -1.67310954308865 and parameters: {'n_layers_yyx': 1, 'hidden_size_yyx_l0': 6, 'context_size_yyx': 3, 'num_mix_components_yyx': 4, 'context_extractor_yyx': 'lstm', 'activation_func_yyx': 'Tanh', 'L2_weight_yyx': 2.7432154753009294e-06, 'L_entropy_weight_yyx': 1.1636929816348791e-10, 'L_sep_weight_yyx': 1.6693699317666072e-08, 'L_scale_weight_yyx': 1.3512116797268246e-08, 'learning_rate_yyx': 0.009328401212152842}. Best is trial 10 with value: -1.6769862653887198.
[I 2026-03-18 19:25:21,115] Trial 7 finished with value: -2.494076356878829 and parameters: {'n_layers_yyx': 2, 'hidden_size_yyx_l0': 2, 'hidden_size_yyx_l1': 2, 'context_size_yyx': 4, 'num_mix_components_yyx': 2, 'context_extractor_yyx': 'lstm', 'activation_func_yyx': 'ReLU', 'L2_weight_yyx': 2.7944132249233478e-05, 'L_entropy_weight_yyx': 4.283334519358467e-05, 'L_sep_weight_yyx': 4.593071326488917e-07, 'L_scale_weight_yyx': 7.654324951428037e-07, 'learning_rate_yyx': 0.0007483074252452687}. Best is trial 1 with value: -2.508543311145146.
[I 2026-03-18 19:25:21,348] Trial 16 pruned. 
[I 2026-03-18 19:25:22,625] Trial 8 pruned. 
[I 2026-03-18 19:25:24,863] Trial 3 finished with value: -2.497647931730826 and parameters: {'n_layers_yyx': 1, 'hidden_size_yyx_l0': 4, 'context_size_yyx': 4, 'num_mix_components_yyx': 3, 'context_extractor_yyx': 'gru', 'activation_func_yyx': 'GELU', 'L2_weight_yyx': 7.635671813320132e-09, 'L_entropy_weight_yyx': 1.0390645022263842e-07, 'L_sep_weight_yyx': 0.00015255232241976667, 'L_scale_weight_yyx': 1.0276416925005478e-09, 'learning_rate_yyx': 0.005183216033982087}. Best is trial 0 with value: -2.5120461423480207.
[I 2026-03-18 19:25:27,125] Trial 18 pruned. 
[I 2026-03-18 19:25:28,874] Trial 6 pruned. 
[I 2026-03-18 19:25:29,742] Trial 10 pruned. 
[I 2026-03-18 19:25:30,690] Trial 14 pruned. 
[I 2026-03-18 19:25:33,579] Trial 6 pruned. 
[I 2026-03-18 19:25:33,958] Trial 15 pruned. 
[I 2026-03-18 19:25:35,331] Trial 17 pruned. 
[I 2026-03-18 19:25:38,196] Trial 8 pruned. 
[I 2026-03-18 19:25:41,756] Trial 9 pruned. 
[I 2026-03-18 19:25:43,475] Trial 4 pruned. 
[I 2026-03-18 19:25:47,825] Trial 7 finished with value: -1.6801514889058558 and parameters: {'n_layers_yyx': 2, 'hidden_size_yyx_l0': 4, 'hidden_size_yyx_l1': 5, 'context_size_yyx': 4, 'num_mix_components_yyx': 1, 'context_extractor_yyx': 'gru', 'activation_func_yyx': 'Tanh', 'L2_weight_yyx': 1.7082554080164736e-10, 'L_entropy_weight_yyx': 4.699786103136014e-07, 'L_sep_weight_yyx': 4.461773916405327e-09, 'L_scale_weight_yyx': 8.793928581353473e-10, 'learning_rate_yyx': 0.005385821097425811}. Best is trial 7 with value: -1.6801514889058558.
[I 2026-03-18 19:25:49,593] Trial 7 pruned. 
[I 2026-03-18 19:25:56,679] Trial 15 pruned. 
[I 2026-03-18 19:25:56,717] Trial 5 finished with value: -2.5140323195684524 and parameters: {'n_layers_yyx': 1, 'hidden_size_yyx_l0': 5, 'context_size_yyx': 4, 'num_mix_components_yyx': 3, 'context_extractor_yyx': 'gru', 'activation_func_yyx': 'ReLU', 'L2_weight_yyx': 0.00015687784350004077, 'L_entropy_weight_yyx': 7.290612804749775e-10, 'L_sep_weight_yyx': 0.0003656576367625248, 'L_scale_weight_yyx': 3.7316259064719105e-09, 'learning_rate_yyx': 0.00960728651785722}. Best is trial 5 with value: -2.5140323195684524.
[I 2026-03-18 19:25:58,074] Trial 10 pruned. 
[I 2026-03-18 19:26:00,188] Trial 5 pruned. 
[I 2026-03-18 19:26:01,033] Trial 16 pruned. 
[I 2026-03-18 19:26:02,444] Trial 18 pruned. 
[I 2026-03-18 19:26:03,241] Trial 12 finished with value: -1.6974110322840072 and parameters: {'n_layers_yyx': 2, 'hidden_size_yyx_l0': 4, 'hidden_size_yyx_l1': 6, 'context_size_yyx': 1, 'num_mix_components_yyx': 2, 'context_extractor_yyx': 'lstm', 'activation_func_yyx': 'ReLU', 'L2_weight_yyx': 2.53366140880338e-06, 'L_entropy_weight_yyx': 3.1943723689225054e-09, 'L_sep_weight_yyx': 7.720784847203977e-08, 'L_scale_weight_yyx': 7.957215383715292e-06, 'learning_rate_yyx': 0.004485395385019031}. Best is trial 0 with value: -1.7166840796377145.
[I 2026-03-18 19:26:03,562] Trial 20 finished with value: -1.6668760141350587 and parameters: {'n_layers_yyx': 2, 'hidden_size_yyx_l0': 4, 'hidden_size_yyx_l1': 5, 'context_size_yyx': 4, 'num_mix_components_yyx': 3, 'context_extractor_yyx': 'lstm', 'activation_func_yyx': 'ReLU', 'L2_weight_yyx': 5.15439645129125e-07, 'L_entropy_weight_yyx': 6.105933344924375e-07, 'L_sep_weight_yyx': 2.299728370963893e-09, 'L_scale_weight_yyx': 1.5529994502045723e-09, 'learning_rate_yyx': 0.007466691738755965}. Best is trial 20 with value: -1.6668760141350587.
[I 2026-03-18 19:26:12,425] Trial 6 finished with value: -2.5074780614184506 and parameters: {'n_layers_yyx': 2, 'hidden_size_yyx_l0': 4, 'hidden_size_yyx_l1': 6, 'context_size_yyx': 2, 'num_mix_components_yyx': 3, 'context_extractor_yyx': 'gru', 'activation_func_yyx': 'ReLU', 'L2_weight_yyx': 9.14017811449779e-09, 'L_entropy_weight_yyx': 3.923708748738412e-05, 'L_sep_weight_yyx': 6.226224293072557e-05, 'L_scale_weight_yyx': 3.8473796921826624e-08, 'learning_rate_yyx': 0.009018629084900413}. Best is trial 1 with value: -2.511856338115334.
[I 2026-03-18 19:26:12,804] Trial 17 pruned. 
[I 2026-03-18 19:26:13,809] Trial 11 pruned. 
[I 2026-03-18 19:26:14,308] Trial 15 finished with value: -1.6872136574091874 and parameters: {'n_layers_yyx': 2, 'hidden_size_yyx_l0': 6, 'hidden_size_yyx_l1': 5, 'context_size_yyx': 1, 'num_mix_components_yyx': 3, 'context_extractor_yyx': 'lstm', 'activation_func_yyx': 'ReLU', 'L2_weight_yyx': 5.987401805024754e-05, 'L_entropy_weight_yyx': 2.5473751904127184e-08, 'L_sep_weight_yyx': 6.998791079201042e-05, 'L_scale_weight_yyx': 3.5826636963073424e-05, 'learning_rate_yyx': 0.009894650716265963}. Best is trial 5 with value: -1.704671424204909.
[I 2026-03-18 19:26:15,446] Trial 6 pruned. 
[I 2026-03-18 19:26:17,629] Trial 9 finished with value: -1.9548240710760292 and parameters: {'n_layers_yyx': 2, 'hidden_size_yyx_l0': 5, 'hidden_size_yyx_l1': 4, 'context_size_yyx': 2, 'num_mix_components_yyx': 1, 'context_extractor_yyx': 'gru', 'activation_func_yyx': 'GELU', 'L2_weight_yyx': 3.1870378317124736e-08, 'L_entropy_weight_yyx': 2.172591502086137e-09, 'L_sep_weight_yyx': 7.253088575945648e-10, 'L_scale_weight_yyx': 1.0461263300242244e-07, 'learning_rate_yyx': 0.006273867325524791}. Best is trial 7 with value: -1.9813599213936923.
[I 2026-03-18 19:26:20,918] Trial 8 pruned. 
[I 2026-03-18 19:26:26,893] Trial 5 finished with value: -2.032878388469595 and parameters: {'n_layers_yyx': 2, 'hidden_size_yyx_l0': 2, 'hidden_size_yyx_l1': 4, 'context_size_yyx': 3, 'num_mix_components_yyx': 5, 'context_extractor_yyx': 'lstm', 'activation_func_yyx': 'ReLU', 'L2_weight_yyx': 3.775557286450563e-06, 'L_entropy_weight_yyx': 1.0113177385984852e-09, 'L_sep_weight_yyx': 3.257425100671387e-07, 'L_scale_weight_yyx': 0.0007681109084208688, 'learning_rate_yyx': 0.0010153351067538272}. Best is trial 1 with value: -2.0346981000296678.
[I 2026-03-18 19:26:26,947] Trial 16 pruned. 
[I 2026-03-18 19:26:31,639] Trial 6 pruned. 
[I 2026-03-18 19:26:34,259] Trial 6 finished with value: -1.6730625165419646 and parameters: {'n_layers_yyx': 1, 'hidden_size_yyx_l0': 2, 'context_size_yyx': 2, 'num_mix_components_yyx': 5, 'context_extractor_yyx': 'lstm', 'activation_func_yyx': 'ReLU', 'L2_weight_yyx': 1.2633412030589018e-07, 'L_entropy_weight_yyx': 1.418625986500657e-07, 'L_sep_weight_yyx': 1.6243027852064123e-09, 'L_scale_weight_yyx': 3.6891230984849115e-08, 'learning_rate_yyx': 0.006354101071432628}. Best is trial 2 with value: -1.6776522224422603.
[I 2026-03-18 19:26:38,159] Trial 18 pruned. 
[I 2026-03-18 19:26:38,360] Trial 9 pruned. 
[I 2026-03-18 19:26:42,544] Trial 19 pruned. 
[I 2026-03-18 19:26:45,402] Trial 18 finished with value: -1.9818904538075819 and parameters: {'n_layers_yyx': 1, 'hidden_size_yyx_l0': 5, 'context_size_yyx': 3, 'num_mix_components_yyx': 3, 'context_extractor_yyx': 'gru', 'activation_func_yyx': 'Tanh', 'L2_weight_yyx': 3.912979377138977e-06, 'L_entropy_weight_yyx': 7.554500031136512e-08, 'L_sep_weight_yyx': 0.00010325939331013566, 'L_scale_weight_yyx': 0.00012704951849210904, 'learning_rate_yyx': 0.007489865692712196}. Best is trial 11 with value: -1.9852781357200364.
[I 2026-03-18 19:26:47,942] Trial 7 pruned. 
[I 2026-03-18 19:26:49,132] Trial 7 pruned. 
[I 2026-03-18 19:26:52,865] Trial 8 pruned. 
[I 2026-03-18 19:26:53,280] Trial 7 finished with value: -2.0105456031462343 and parameters: {'n_layers_yyx': 1, 'hidden_size_yyx_l0': 5, 'context_size_yyx': 1, 'num_mix_components_yyx': 1, 'context_extractor_yyx': 'lstm', 'activation_func_yyx': 'Tanh', 'L2_weight_yyx': 3.568701810800904e-07, 'L_entropy_weight_yyx': 1.794680590604671e-07, 'L_sep_weight_yyx': 5.0583846901762005e-06, 'L_scale_weight_yyx': 9.796309791399966e-08, 'learning_rate_yyx': 0.003674514010899876}. Best is trial 0 with value: -2.0138799336866504.
[I 2026-03-18 19:26:53,281] Trial 17 pruned. 
[I 2026-03-18 19:26:54,164] Trial 10 pruned. 
[I 2026-03-18 19:26:54,663] Trial 14 finished with value: -1.9793084154473537 and parameters: {'n_layers_yyx': 2, 'hidden_size_yyx_l0': 3, 'hidden_size_yyx_l1': 6, 'context_size_yyx': 2, 'num_mix_components_yyx': 4, 'context_extractor_yyx': 'lstm', 'activation_func_yyx': 'ReLU', 'L2_weight_yyx': 5.8149682447612105e-08, 'L_entropy_weight_yyx': 7.66783946209893e-06, 'L_sep_weight_yyx': 6.922439055000153e-08, 'L_scale_weight_yyx': 1.0130499467199934e-05, 'learning_rate_yyx': 0.009641396047808459}. Best is trial 1 with value: -1.9828018961884801.
[I 2026-03-18 19:26:56,409] Trial 6 finished with value: -2.4997556612473124 and parameters: {'n_layers_yyx': 1, 'hidden_size_yyx_l0': 6, 'context_size_yyx': 3, 'num_mix_components_yyx': 5, 'context_extractor_yyx': 'lstm', 'activation_func_yyx': 'GELU', 'L2_weight_yyx': 9.423474635328761e-08, 'L_entropy_weight_yyx': 2.6765227412936e-06, 'L_sep_weight_yyx': 3.315015502168347e-10, 'L_scale_weight_yyx': 2.460954145066257e-10, 'learning_rate_yyx': 0.001644184493589749}. Best is trial 6 with value: -2.4997556612473124.
[I 2026-03-18 19:26:58,110] Trial 20 pruned. 
[I 2026-03-18 19:26:59,865] Trial 11 pruned. 
[I 2026-03-18 19:27:03,764] Trial 6 finished with value: -2.112494948763621 and parameters: {'n_layers_yyx': 1, 'hidden_size_yyx_l0': 4, 'context_size_yyx': 1, 'num_mix_components_yyx': 4, 'context_extractor_yyx': 'gru', 'activation_func_yyx': 'Tanh', 'L2_weight_yyx': 2.087723451777188e-09, 'L_entropy_weight_yyx': 2.0304645824242872e-10, 'L_sep_weight_yyx': 1.7424628740275578e-08, 'L_scale_weight_yyx': 6.380296766291444e-10, 'learning_rate_yyx': 0.0024199820555031513}. Best is trial 0 with value: -2.1143376288427875.
[I 2026-03-18 19:27:04,196] Trial 11 finished with value: -1.6707008798096055 and parameters: {'n_layers_yyx': 2, 'hidden_size_yyx_l0': 3, 'hidden_size_yyx_l1': 2, 'context_size_yyx': 1, 'num_mix_components_yyx': 2, 'context_extractor_yyx': 'gru', 'activation_func_yyx': 'ReLU', 'L2_weight_yyx': 2.0669913674813422e-08, 'L_entropy_weight_yyx': 5.611622393150433e-06, 'L_sep_weight_yyx': 3.136709250567825e-10, 'L_scale_weight_yyx': 4.029077700356696e-06, 'learning_rate_yyx': 0.004252528652110601}. Best is trial 2 with value: -1.680426359749482.
[I 2026-03-18 19:27:05,042] Trial 13 pruned. 
[I 2026-03-18 19:27:05,048] Trial 18 pruned. 
[I 2026-03-18 19:27:12,444] Trial 21 pruned. 
[I 2026-03-18 19:27:12,989] Trial 7 pruned. 
[I 2026-03-18 19:27:13,458] Trial 21 pruned. 
[I 2026-03-18 19:27:14,002] Trial 8 pruned. 
[I 2026-03-18 19:27:17,847] Trial 12 pruned. 
[I 2026-03-18 19:27:20,390] Trial 19 pruned. 
[I 2026-03-18 19:27:22,570] Trial 18 finished with value: -1.7002973458681911 and parameters: {'n_layers_yyx': 1, 'hidden_size_yyx_l0': 3, 'context_size_yyx': 4, 'num_mix_components_yyx': 4, 'context_extractor_yyx': 'gru', 'activation_func_yyx': 'Tanh', 'L2_weight_yyx': 6.380950824254073e-06, 'L_entropy_weight_yyx': 1.253801946520959e-10, 'L_sep_weight_yyx': 0.00025257602539955764, 'L_scale_weight_yyx': 3.4615422289882496e-10, 'learning_rate_yyx': 0.004800139615117416}. Best is trial 18 with value: -1.7002973458681911.
[I 2026-03-18 19:27:25,922] Trial 22 pruned. 
[I 2026-03-18 19:27:28,918] Trial 8 pruned. 
[I 2026-03-18 19:27:31,523] Trial 14 pruned. 
[I 2026-03-18 19:27:33,304] Trial 7 pruned. 
[I 2026-03-18 19:27:38,289] Trial 23 pruned. 
[I 2026-03-18 19:27:40,563] Trial 22 pruned. 
[I 2026-03-18 19:27:41,172] Trial 19 pruned. 
[I 2026-03-18 19:27:41,552] Trial 4 finished with value: -2.512273117194863 and parameters: {'n_layers_yyx': 2, 'hidden_size_yyx_l0': 3, 'hidden_size_yyx_l1': 5, 'context_size_yyx': 2, 'num_mix_components_yyx': 4, 'context_extractor_yyx': 'gru', 'activation_func_yyx': 'GELU', 'L2_weight_yyx': 1.329695132283002e-10, 'L_entropy_weight_yyx': 0.00016827462413373433, 'L_sep_weight_yyx': 1.4782729009079348e-08, 'L_scale_weight_yyx': 0.00026708142387686103, 'learning_rate_yyx': 0.0035996598339968896}. Best is trial 1 with value: -2.5125601952756833.
[I 2026-03-18 19:27:43,173] Trial 20 pruned. 
[I 2026-03-18 19:27:43,339] Trial 15 pruned. 
[I 2026-03-18 19:27:49,052] Trial 8 pruned. 
[I 2026-03-18 19:27:53,260] Trial 24 pruned. 
[I 2026-03-18 19:27:55,657] Trial 20 pruned. 
[I 2026-03-18 19:27:56,550] Trial 16 finished with value: -1.677800179902663 and parameters: {'n_layers_yyx': 1, 'hidden_size_yyx_l0': 6, 'context_size_yyx': 4, 'num_mix_components_yyx': 3, 'context_extractor_yyx': 'lstm', 'activation_func_yyx': 'GELU', 'L2_weight_yyx': 3.5891200068665245e-06, 'L_entropy_weight_yyx': 1.3834979106979978e-07, 'L_sep_weight_yyx': 8.215132891881085e-09, 'L_scale_weight_yyx': 3.343635368396474e-07, 'learning_rate_yyx': 0.007315429546309572}. Best is trial 13 with value: -1.6789194095140463.
[I 2026-03-18 19:27:59,481] Trial 16 pruned. 
[I 2026-03-18 19:28:02,994] Trial 9 pruned. 
[I 2026-03-18 19:28:08,217] Trial 25 pruned. 
[I 2026-03-18 19:28:10,871] Trial 21 pruned. 
[I 2026-03-18 19:28:10,882] Trial 21 pruned. 
[I 2026-03-18 19:28:11,738] Trial 23 pruned. 
[I 2026-03-18 19:28:15,547] Trial 12 finished with value: -2.4902563614746467 and parameters: {'n_layers_yyx': 1, 'hidden_size_yyx_l0': 5, 'context_size_yyx': 2, 'num_mix_components_yyx': 4, 'context_extractor_yyx': 'lstm', 'activation_func_yyx': 'ReLU', 'L2_weight_yyx': 5.718692820829777e-08, 'L_entropy_weight_yyx': 2.9958546471982043e-06, 'L_sep_weight_yyx': 6.3947043224592e-09, 'L_scale_weight_yyx': 4.198522668514558e-09, 'learning_rate_yyx': 0.009568717016559099}. Best is trial 6 with value: -2.513252855536577.
[I 2026-03-18 19:28:17,760] Trial 9 pruned. 
[I 2026-03-18 19:28:17,882] Trial 10 finished with value: -2.510032718525418 and parameters: {'n_layers_yyx': 1, 'hidden_size_yyx_l0': 6, 'context_size_yyx': 1, 'num_mix_components_yyx': 5, 'context_extractor_yyx': 'gru', 'activation_func_yyx': 'ReLU', 'L2_weight_yyx': 1.0358665785859876e-10, 'L_entropy_weight_yyx': 4.254280320382105e-07, 'L_sep_weight_yyx': 1.9646567489696425e-06, 'L_scale_weight_yyx': 1.1877505779985766e-10, 'learning_rate_yyx': 0.001137171443879688}. Best is trial 0 with value: -2.511745534136428.
[I 2026-03-18 19:28:18,162] Trial 11 pruned. 
[I 2026-03-18 19:28:21,665] Trial 21 finished with value: -1.6658270699637276 and parameters: {'n_layers_yyx': 2, 'hidden_size_yyx_l0': 4, 'hidden_size_yyx_l1': 5, 'context_size_yyx': 4, 'num_mix_components_yyx': 3, 'context_extractor_yyx': 'lstm', 'activation_func_yyx': 'ReLU', 'L2_weight_yyx': 1.140811331022163e-08, 'L_entropy_weight_yyx': 5.37269642206101e-07, 'L_sep_weight_yyx': 2.6277492357190732e-09, 'L_scale_weight_yyx': 1.9992473598907864e-09, 'learning_rate_yyx': 0.007082990971857676}. Best is trial 20 with value: -1.6668760141350587.
[I 2026-03-18 19:28:23,100] Trial 22 pruned. 
[I 2026-03-18 19:28:23,208] Trial 17 pruned. 
[I 2026-03-18 19:28:24,818] Trial 10 finished with value: -1.9560015829829267 and parameters: {'n_layers_yyx': 1, 'hidden_size_yyx_l0': 2, 'context_size_yyx': 4, 'num_mix_components_yyx': 2, 'context_extractor_yyx': 'lstm', 'activation_func_yyx': 'ReLU', 'L2_weight_yyx': 6.028137255714321e-08, 'L_entropy_weight_yyx': 3.744694679758592e-06, 'L_sep_weight_yyx': 1.1660887682762744e-10, 'L_scale_weight_yyx': 7.498118203523717e-06, 'learning_rate_yyx': 0.009455351923070792}. Best is trial 7 with value: -1.9813599213936923.
[I 2026-03-18 19:28:26,508] Trial 17 pruned. 
[I 2026-03-18 19:28:34,009] Trial 13 pruned. 
[I 2026-03-18 19:28:35,005] Trial 12 pruned. 
[I 2026-03-18 19:28:35,635] Trial 22 pruned. 
[I 2026-03-18 19:28:38,048] Trial 22 pruned. 
[I 2026-03-18 19:28:39,495] Trial 18 pruned. 
[I 2026-03-18 19:28:44,062] Trial 13 finished with value: -2.0221624466873753 and parameters: {'n_layers_yyx': 2, 'hidden_size_yyx_l0': 4, 'hidden_size_yyx_l1': 5, 'context_size_yyx': 1, 'num_mix_components_yyx': 5, 'context_extractor_yyx': 'gru', 'activation_func_yyx': 'ReLU', 'L2_weight_yyx': 5.6211960855729e-06, 'L_entropy_weight_yyx': 0.0006955031901188302, 'L_sep_weight_yyx': 1.0676649736040271e-10, 'L_scale_weight_yyx': 6.728531840801297e-06, 'learning_rate_yyx': 0.004551426851692057}. Best is trial 13 with value: -2.0221624466873753.
[I 2026-03-18 19:28:50,602] Trial 23 pruned. 
[I 2026-03-18 19:28:51,199] Trial 13 pruned. 
[I 2026-03-18 19:28:51,641] Trial 14 pruned. 
[I 2026-03-18 19:28:52,023] Trial 15 finished with value: -1.6747996097914821 and parameters: {'n_layers_yyx': 1, 'hidden_size_yyx_l0': 5, 'context_size_yyx': 1, 'num_mix_components_yyx': 2, 'context_extractor_yyx': 'lstm', 'activation_func_yyx': 'Tanh', 'L2_weight_yyx': 1.6269136542675145e-08, 'L_entropy_weight_yyx': 1.0292700329130156e-09, 'L_sep_weight_yyx': 4.140148848462521e-08, 'L_scale_weight_yyx': 0.00010197081000850595, 'learning_rate_yyx': 0.00537963109321349}. Best is trial 10 with value: -1.6769862653887198.
[I 2026-03-18 19:29:05,263] Trial 24 pruned. 
[I 2026-03-18 19:29:06,674] Trial 19 pruned. 
[I 2026-03-18 19:29:06,674] Trial 16 pruned. 
[I 2026-03-18 19:29:07,968] Trial 14 pruned. 
[I 2026-03-18 19:29:08,474] Trial 15 pruned. 
[I 2026-03-18 19:29:10,409] Trial 5 pruned. 
[I 2026-03-18 19:29:17,634] Trial 20 pruned. 
[I 2026-03-18 19:29:23,271] Trial 15 pruned. 
[I 2026-03-18 19:29:28,216] Trial 6 pruned. 
[I 2026-03-18 19:29:31,430] Trial 19 finished with value: -1.9837723568820447 and parameters: {'n_layers_yyx': 1, 'hidden_size_yyx_l0': 3, 'context_size_yyx': 4, 'num_mix_components_yyx': 5, 'context_extractor_yyx': 'gru', 'activation_func_yyx': 'ReLU', 'L2_weight_yyx': 2.9340840592219245e-08, 'L_entropy_weight_yyx': 1.4213407242858312e-06, 'L_sep_weight_yyx': 3.6679065927540044e-06, 'L_scale_weight_yyx': 0.0009667094445028444, 'learning_rate_yyx': 0.006513564029363863}. Best is trial 11 with value: -1.9852781357200364.
