[I 2026-03-18 16:29:14,488] Trial 5 finished with value: -0.37645147459425793 and parameters: {'n_layers_yyx': 2, 'hidden_size_yyx_l0': 3, 'hidden_size_yyx_l1': 5, 'context_size_yyx': 3, 'num_mix_components_yyx': 4, 'context_extractor_yyx': 'lstm', 'activation_func_yyx': 'GELU', 'L2_weight_yyx': 2.704834609394415e-07, 'L_entropy_weight_yyx': 1.0162321044567609e-07, 'L_sep_weight_yyx': 5.592542248676704e-09, 'L_scale_weight_yyx': 5.813450439592586e-10, 'learning_rate_yyx': 0.009110011171642392}. Best is trial 0 with value: -0.41448025068631483.
[I 2026-03-18 16:29:14,800] Trial 5 pruned. 
[I 2026-03-18 16:29:14,968] Trial 10 pruned. 
[I 2026-03-18 16:29:16,752] Trial 4 pruned. 
[I 2026-03-18 16:29:17,691] Trial 6 pruned. 
[I 2026-03-18 16:29:18,642] Trial 11 pruned. 
[I 2026-03-18 16:29:18,836] Trial 1 finished with value: -2.7703040265290086 and parameters: {'n_layers_yyx': 1, 'hidden_size_yyx_l0': 6, 'context_size_yyx': 1, 'num_mix_components_yyx': 2, 'context_extractor_yyx': 'gru', 'activation_func_yyx': 'Tanh', 'L2_weight_yyx': 1.783169389552852e-10, 'L_entropy_weight_yyx': 1.8003990996980777e-06, 'L_sep_weight_yyx': 4.5347360521572567e-10, 'L_scale_weight_yyx': 0.00018125343566212498, 'learning_rate_yyx': 0.0035071733889717005}. Best is trial 0 with value: -2.7804692330482275.
[I 2026-03-18 16:29:20,061] Trial 5 pruned. 
[I 2026-03-18 16:29:21,860] Trial 12 pruned. 
[I 2026-03-18 16:29:23,183] Trial 6 pruned. 
[I 2026-03-18 16:29:23,997] Trial 21 pruned. 
[I 2026-03-18 16:29:24,141] Trial 0 finished with value: -2.792252838699443 and parameters: {'n_layers_yyx': 1, 'hidden_size_yyx_l0': 5, 'context_size_yyx': 1, 'num_mix_components_yyx': 4, 'context_extractor_yyx': 'lstm', 'activation_func_yyx': 'GELU', 'L2_weight_yyx': 3.1874293753637825e-10, 'L_entropy_weight_yyx': 6.64281202868365e-07, 'L_sep_weight_yyx': 1.374595373936225e-09, 'L_scale_weight_yyx': 2.6451374830409494e-06, 'learning_rate_yyx': 0.0008324530106842482}. Best is trial 0 with value: -2.792252838699443.
[I 2026-03-18 16:29:26,813] Trial 0 finished with value: -2.7964025593256525 and parameters: {'n_layers_yyx': 2, 'hidden_size_yyx_l0': 3, 'hidden_size_yyx_l1': 3, 'context_size_yyx': 2, 'num_mix_components_yyx': 2, 'context_extractor_yyx': 'gru', 'activation_func_yyx': 'Tanh', 'L2_weight_yyx': 2.3654615857899946e-05, 'L_entropy_weight_yyx': 6.477419489858504e-08, 'L_sep_weight_yyx': 5.807583204511858e-10, 'L_scale_weight_yyx': 2.631171295834645e-05, 'learning_rate_yyx': 0.0022868893267270793}. Best is trial 0 with value: -2.7964025593256525.
[I 2026-03-18 16:29:29,251] Trial 7 pruned. 
[I 2026-03-18 16:29:29,505] Trial 12 pruned. 
[I 2026-03-18 16:29:32,440] Trial 8 pruned. 
[I 2026-03-18 16:29:32,892] Trial 1 finished with value: -2.8044746609917057 and parameters: {'n_layers_yyx': 2, 'hidden_size_yyx_l0': 5, 'hidden_size_yyx_l1': 2, 'context_size_yyx': 3, 'num_mix_components_yyx': 4, 'context_extractor_yyx': 'gru', 'activation_func_yyx': 'ReLU', 'L2_weight_yyx': 7.898731690953955e-06, 'L_entropy_weight_yyx': 0.00021592577235062712, 'L_sep_weight_yyx': 4.1817721955939315e-09, 'L_scale_weight_yyx': 5.891316029172239e-09, 'learning_rate_yyx': 0.0068160944250704025}. Best is trial 1 with value: -2.8044746609917057.
[I 2026-03-18 16:29:33,624] Trial 7 pruned. 
[I 2026-03-18 16:29:35,005] Trial 6 finished with value: -0.3830794343269277 and parameters: {'n_layers_yyx': 2, 'hidden_size_yyx_l0': 5, 'hidden_size_yyx_l1': 6, 'context_size_yyx': 3, 'num_mix_components_yyx': 4, 'context_extractor_yyx': 'lstm', 'activation_func_yyx': 'ReLU', 'L2_weight_yyx': 3.639291765458961e-10, 'L_entropy_weight_yyx': 1.862122641158854e-09, 'L_sep_weight_yyx': 2.3588017375554058e-05, 'L_scale_weight_yyx': 2.3774091341855947e-09, 'learning_rate_yyx': 0.0062850365355354675}. Best is trial 2 with value: -0.4289537553816757.
[I 2026-03-18 16:29:35,579] Trial 7 finished with value: -0.39725184957309406 and parameters: {'n_layers_yyx': 1, 'hidden_size_yyx_l0': 6, 'context_size_yyx': 3, 'num_mix_components_yyx': 5, 'context_extractor_yyx': 'gru', 'activation_func_yyx': 'Tanh', 'L2_weight_yyx': 4.622410482677485e-06, 'L_entropy_weight_yyx': 4.530009655913098e-06, 'L_sep_weight_yyx': 5.0775354702749534e-05, 'L_scale_weight_yyx': 8.423139422881898e-08, 'learning_rate_yyx': 0.004646005260764882}. Best is trial 0 with value: -0.41448025068631483.
[I 2026-03-18 16:29:36,239] Trial 9 pruned. 
[I 2026-03-18 16:29:36,313] Trial 0 finished with value: -2.7690257269372136 and parameters: {'n_layers_yyx': 1, 'hidden_size_yyx_l0': 3, 'context_size_yyx': 4, 'num_mix_components_yyx': 3, 'context_extractor_yyx': 'lstm', 'activation_func_yyx': 'GELU', 'L2_weight_yyx': 4.71301665635351e-09, 'L_entropy_weight_yyx': 4.1091984861033886e-10, 'L_sep_weight_yyx': 5.665119262094283e-10, 'L_scale_weight_yyx': 0.00014414268743697298, 'learning_rate_yyx': 0.0006740774606800716}. Best is trial 0 with value: -2.7690257269372136.
[I 2026-03-18 16:29:36,398] Trial 5 finished with value: -0.3966640791287732 and parameters: {'n_layers_yyx': 2, 'hidden_size_yyx_l0': 3, 'hidden_size_yyx_l1': 2, 'context_size_yyx': 1, 'num_mix_components_yyx': 5, 'context_extractor_yyx': 'lstm', 'activation_func_yyx': 'ReLU', 'L2_weight_yyx': 4.273769169678559e-06, 'L_entropy_weight_yyx': 8.922048675216474e-10, 'L_sep_weight_yyx': 5.461585420037274e-06, 'L_scale_weight_yyx': 2.1316951108200684e-07, 'learning_rate_yyx': 0.00621534147872125}. Best is trial 1 with value: -0.4204067549100232.
[I 2026-03-18 16:29:37,069] Trial 2 pruned. 
[I 2026-03-18 16:29:37,952] Trial 7 pruned. 
[I 2026-03-18 16:29:38,583] Trial 8 pruned. 
[I 2026-03-18 16:29:39,462] Trial 10 pruned. 
[I 2026-03-18 16:29:40,585] Trial 2 pruned. 
[I 2026-03-18 16:29:40,822] Trial 5 finished with value: -0.3613124882842734 and parameters: {'n_layers_yyx': 2, 'hidden_size_yyx_l0': 5, 'hidden_size_yyx_l1': 5, 'context_size_yyx': 4, 'num_mix_components_yyx': 5, 'context_extractor_yyx': 'lstm', 'activation_func_yyx': 'GELU', 'L2_weight_yyx': 1.5582828350105162e-09, 'L_entropy_weight_yyx': 0.00024463784344984244, 'L_sep_weight_yyx': 0.0007737306038038983, 'L_scale_weight_yyx': 8.285700753523215e-05, 'learning_rate_yyx': 0.00128361069101724}. Best is trial 0 with value: -0.4236573021478328.
[I 2026-03-18 16:29:41,896] Trial 9 pruned. 
[I 2026-03-18 16:29:42,538] Trial 11 pruned. 
[I 2026-03-18 16:29:44,170] Trial 6 pruned. 
[I 2026-03-18 16:29:44,253] Trial 13 pruned. 
[I 2026-03-18 16:29:45,560] Trial 12 pruned. 
[I 2026-03-18 16:29:45,907] Trial 8 finished with value: -0.42177754216149865 and parameters: {'n_layers_yyx': 1, 'hidden_size_yyx_l0': 3, 'context_size_yyx': 3, 'num_mix_components_yyx': 2, 'context_extractor_yyx': 'lstm', 'activation_func_yyx': 'ReLU', 'L2_weight_yyx': 5.0150628351548236e-09, 'L_entropy_weight_yyx': 7.523284575303689e-10, 'L_sep_weight_yyx': 6.540724855244137e-05, 'L_scale_weight_yyx': 8.320255612806906e-10, 'learning_rate_yyx': 0.005340756280094445}. Best is trial 3 with value: -0.42374077669976296.
[I 2026-03-18 16:29:47,276] Trial 14 pruned. 
[I 2026-03-18 16:29:47,287] Trial 20 pruned. 
[I 2026-03-18 16:29:47,832] Trial 7 pruned. 
[I 2026-03-18 16:29:48,633] Trial 10 pruned. 
[I 2026-03-18 16:29:49,238] Trial 13 pruned. 
[I 2026-03-18 16:29:51,318] Trial 0 finished with value: -2.79162831599355 and parameters: {'n_layers_yyx': 2, 'hidden_size_yyx_l0': 4, 'hidden_size_yyx_l1': 4, 'context_size_yyx': 3, 'num_mix_components_yyx': 2, 'context_extractor_yyx': 'lstm', 'activation_func_yyx': 'GELU', 'L2_weight_yyx': 1.8871484997013255e-07, 'L_entropy_weight_yyx': 0.0008246842541416545, 'L_sep_weight_yyx': 1.0061291343840274e-06, 'L_scale_weight_yyx': 3.834782692960455e-05, 'learning_rate_yyx': 0.0006648080354075828}. Best is trial 0 with value: -2.79162831599355.
[I 2026-03-18 16:29:52,336] Trial 11 pruned. 
[I 2026-03-18 16:29:52,473] Trial 14 pruned. 
[I 2026-03-18 16:29:52,984] Trial 8 pruned. 
[I 2026-03-18 16:29:53,432] Trial 21 pruned. 
[I 2026-03-18 16:29:53,882] Trial 15 pruned. 
[I 2026-03-18 16:29:55,329] Trial 12 pruned. 
[I 2026-03-18 16:29:55,545] Trial 13 finished with value: -0.42997949558883997 and parameters: {'n_layers_yyx': 1, 'hidden_size_yyx_l0': 3, 'context_size_yyx': 4, 'num_mix_components_yyx': 2, 'context_extractor_yyx': 'lstm', 'activation_func_yyx': 'ReLU', 'L2_weight_yyx': 4.1837589581257496e-07, 'L_entropy_weight_yyx': 1.4178698631617977e-10, 'L_sep_weight_yyx': 4.781412011803401e-07, 'L_scale_weight_yyx': 6.498710175212069e-06, 'learning_rate_yyx': 0.005113810333530895}. Best is trial 4 with value: -0.43761569280004353.
[I 2026-03-18 16:29:55,683] Trial 8 finished with value: -0.41401152714118133 and parameters: {'n_layers_yyx': 2, 'hidden_size_yyx_l0': 6, 'hidden_size_yyx_l1': 3, 'context_size_yyx': 4, 'num_mix_components_yyx': 4, 'context_extractor_yyx': 'lstm', 'activation_func_yyx': 'Tanh', 'L2_weight_yyx': 1.5264879508582627e-06, 'L_entropy_weight_yyx': 7.692611027169944e-06, 'L_sep_weight_yyx': 1.2503418389290368e-10, 'L_scale_weight_yyx': 4.139010440127698e-06, 'learning_rate_yyx': 0.005389744345356956}. Best is trial 1 with value: -0.44041338941261127.
[I 2026-03-18 16:29:56,372] Trial 4 finished with value: -0.44564611476272253 and parameters: {'n_layers_yyx': 1, 'hidden_size_yyx_l0': 3, 'context_size_yyx': 3, 'num_mix_components_yyx': 1, 'context_extractor_yyx': 'gru', 'activation_func_yyx': 'ReLU', 'L2_weight_yyx': 6.20330334185307e-07, 'L_entropy_weight_yyx': 6.13201655053134e-05, 'L_sep_weight_yyx': 1.2332892770829629e-10, 'L_scale_weight_yyx': 3.5059285788305676e-08, 'learning_rate_yyx': 0.008369224505304106}. Best is trial 1 with value: -0.45911608244243424.
[I 2026-03-18 16:29:56,543] Trial 22 pruned. 
[I 2026-03-18 16:29:56,975] Trial 22 finished with value: -0.4438516244799729 and parameters: {'n_layers_yyx': 2, 'hidden_size_yyx_l0': 3, 'hidden_size_yyx_l1': 6, 'context_size_yyx': 4, 'num_mix_components_yyx': 1, 'context_extractor_yyx': 'gru', 'activation_func_yyx': 'Tanh', 'L2_weight_yyx': 0.00018901076681908, 'L_entropy_weight_yyx': 4.120818335047293e-09, 'L_sep_weight_yyx': 1.855782763472025e-09, 'L_scale_weight_yyx': 5.6902282271665736e-05, 'learning_rate_yyx': 0.002825394115186412}. Best is trial 22 with value: -0.4438516244799729.
[I 2026-03-18 16:29:59,447] Trial 9 pruned. 
[I 2026-03-18 16:29:59,803] Trial 7 finished with value: -0.41716891545629353 and parameters: {'n_layers_yyx': 1, 'hidden_size_yyx_l0': 5, 'context_size_yyx': 4, 'num_mix_components_yyx': 5, 'context_extractor_yyx': 'lstm', 'activation_func_yyx': 'Tanh', 'L2_weight_yyx': 0.00014658539056275365, 'L_entropy_weight_yyx': 8.248204014219668e-08, 'L_sep_weight_yyx': 2.3935297778488455e-08, 'L_scale_weight_yyx': 2.2198883416626197e-10, 'learning_rate_yyx': 0.0009117793056998352}. Best is trial 0 with value: -0.42020291071558147.
[I 2026-03-18 16:29:59,843] Trial 3 pruned. 
[I 2026-03-18 16:30:02,548] Trial 13 pruned. 
[I 2026-03-18 16:30:02,935] Trial 10 pruned. 
[I 2026-03-18 16:30:04,065] Trial 6 finished with value: -0.44637499357524674 and parameters: {'n_layers_yyx': 1, 'hidden_size_yyx_l0': 6, 'context_size_yyx': 4, 'num_mix_components_yyx': 4, 'context_extractor_yyx': 'gru', 'activation_func_yyx': 'GELU', 'L2_weight_yyx': 2.6729153918282106e-05, 'L_entropy_weight_yyx': 8.021641349162347e-05, 'L_sep_weight_yyx': 1.998114753694191e-08, 'L_scale_weight_yyx': 1.3189551352636854e-05, 'learning_rate_yyx': 0.006282682876002625}. Best is trial 6 with value: -0.44637499357524674.
[I 2026-03-18 16:30:05,399] Trial 14 pruned. 
[I 2026-03-18 16:30:06,908] Trial 7 pruned. 
[I 2026-03-18 16:30:07,837] Trial 4 pruned. 
[I 2026-03-18 16:30:09,067] Trial 15 pruned. 
[I 2026-03-18 16:30:10,384] Trial 16 pruned. 
[I 2026-03-18 16:30:10,435] Trial 8 pruned. 
[I 2026-03-18 16:30:10,713] Trial 1 finished with value: -2.7661289220706 and parameters: {'n_layers_yyx': 1, 'hidden_size_yyx_l0': 5, 'context_size_yyx': 1, 'num_mix_components_yyx': 4, 'context_extractor_yyx': 'lstm', 'activation_func_yyx': 'GELU', 'L2_weight_yyx': 5.867156002463164e-06, 'L_entropy_weight_yyx': 7.060750653673966e-05, 'L_sep_weight_yyx': 0.00020648795754921986, 'L_scale_weight_yyx': 0.0004142667940863473, 'learning_rate_yyx': 0.005068930703099266}. Best is trial 0 with value: -2.8067502106217272.
[I 2026-03-18 16:30:11,308] Trial 9 pruned. 
[I 2026-03-18 16:30:12,290] Trial 16 pruned. 
[I 2026-03-18 16:30:14,176] Trial 17 pruned. 
[I 2026-03-18 16:30:14,845] Trial 10 pruned. 
[I 2026-03-18 16:30:15,687] Trial 1 pruned. 
[I 2026-03-18 16:30:15,991] Trial 0 finished with value: -2.790148867852285 and parameters: {'n_layers_yyx': 2, 'hidden_size_yyx_l0': 3, 'hidden_size_yyx_l1': 3, 'context_size_yyx': 3, 'num_mix_components_yyx': 5, 'context_extractor_yyx': 'gru', 'activation_func_yyx': 'Tanh', 'L2_weight_yyx': 1.2894036787278549e-08, 'L_entropy_weight_yyx': 4.0623899365857777e-07, 'L_sep_weight_yyx': 3.875048190429137e-09, 'L_scale_weight_yyx': 0.0002708378229510064, 'learning_rate_yyx': 0.000563654932565759}. Best is trial 0 with value: -2.790148867852285.
[I 2026-03-18 16:30:16,243] Trial 5 pruned. 
[I 2026-03-18 16:30:16,289] Trial 8 finished with value: -0.30517653710332815 and parameters: {'n_layers_yyx': 1, 'hidden_size_yyx_l0': 2, 'context_size_yyx': 1, 'num_mix_components_yyx': 5, 'context_extractor_yyx': 'lstm', 'activation_func_yyx': 'Tanh', 'L2_weight_yyx': 9.804340255710043e-05, 'L_entropy_weight_yyx': 6.481358758360626e-09, 'L_sep_weight_yyx': 0.00021485741950773106, 'L_scale_weight_yyx': 4.510162109380251e-08, 'learning_rate_yyx': 0.0028493898165633832}. Best is trial 7 with value: -0.44963234349300985.
[I 2026-03-18 16:30:18,238] Trial 11 pruned. 
[I 2026-03-18 16:30:19,832] Trial 2 finished with value: -2.799719036396502 and parameters: {'n_layers_yyx': 2, 'hidden_size_yyx_l0': 5, 'hidden_size_yyx_l1': 5, 'context_size_yyx': 2, 'num_mix_components_yyx': 3, 'context_extractor_yyx': 'lstm', 'activation_func_yyx': 'Tanh', 'L2_weight_yyx': 4.564218566140177e-09, 'L_entropy_weight_yyx': 8.146540467544699e-07, 'L_sep_weight_yyx': 5.312716491584198e-06, 'L_scale_weight_yyx': 8.93797944058671e-09, 'learning_rate_yyx': 0.006541330868967777}. Best is trial 2 with value: -2.799719036396502.
[I 2026-03-18 16:30:20,698] Trial 18 pruned. 
[I 2026-03-18 16:30:23,042] Trial 9 pruned. 
[I 2026-03-18 16:30:24,642] Trial 12 pruned. 
[I 2026-03-18 16:30:25,224] Trial 8 finished with value: -0.40076401654411764 and parameters: {'n_layers_yyx': 1, 'hidden_size_yyx_l0': 5, 'context_size_yyx': 3, 'num_mix_components_yyx': 3, 'context_extractor_yyx': 'gru', 'activation_func_yyx': 'GELU', 'L2_weight_yyx': 0.0005649605164782199, 'L_entropy_weight_yyx': 4.962640893194618e-09, 'L_sep_weight_yyx': 3.0669832889176504e-08, 'L_scale_weight_yyx': 8.889493041104613e-10, 'learning_rate_yyx': 0.0038731003772962255}. Best is trial 0 with value: -0.4236573021478328.
[I 2026-03-18 16:30:25,940] Trial 3 pruned. 
[I 2026-03-18 16:30:26,039] Trial 9 pruned. 
[I 2026-03-18 16:30:26,567] Trial 10 pruned. 
[I 2026-03-18 16:30:26,590] Trial 17 pruned. 
[I 2026-03-18 16:30:26,831] Trial 19 pruned. 
[I 2026-03-18 16:30:27,964] Trial 13 pruned. 
[I 2026-03-18 16:30:28,102] Trial 3 pruned. 
[I 2026-03-18 16:30:28,627] Trial 1 finished with value: -2.8024164192943366 and parameters: {'n_layers_yyx': 2, 'hidden_size_yyx_l0': 3, 'hidden_size_yyx_l1': 3, 'context_size_yyx': 3, 'num_mix_components_yyx': 4, 'context_extractor_yyx': 'lstm', 'activation_func_yyx': 'Tanh', 'L2_weight_yyx': 6.97147651089637e-07, 'L_entropy_weight_yyx': 1.7228306798518697e-05, 'L_sep_weight_yyx': 3.883059513716969e-07, 'L_scale_weight_yyx': 3.84305556628311e-08, 'learning_rate_yyx': 0.0021818051352706304}. Best is trial 1 with value: -2.8024164192943366.
[I 2026-03-18 16:30:28,922] Trial 5 finished with value: -0.44982475540586303 and parameters: {'n_layers_yyx': 1, 'hidden_size_yyx_l0': 2, 'context_size_yyx': 2, 'num_mix_components_yyx': 1, 'context_extractor_yyx': 'lstm', 'activation_func_yyx': 'Tanh', 'L2_weight_yyx': 3.1332748840080446e-10, 'L_entropy_weight_yyx': 0.0002472923078701876, 'L_sep_weight_yyx': 8.008548032048231e-06, 'L_scale_weight_yyx': 6.951032054841851e-06, 'learning_rate_yyx': 0.006513947702251344}. Best is trial 5 with value: -0.44982475540586303.
[I 2026-03-18 16:30:29,178] Trial 23 finished with value: -0.4358419412429857 and parameters: {'n_layers_yyx': 2, 'hidden_size_yyx_l0': 2, 'hidden_size_yyx_l1': 5, 'context_size_yyx': 4, 'num_mix_components_yyx': 1, 'context_extractor_yyx': 'gru', 'activation_func_yyx': 'Tanh', 'L2_weight_yyx': 0.00015960379403447386, 'L_entropy_weight_yyx': 1.4799930062627928e-09, 'L_sep_weight_yyx': 3.543291960566159e-09, 'L_scale_weight_yyx': 7.58822530948392e-08, 'learning_rate_yyx': 0.003965750199016819}. Best is trial 22 with value: -0.4438516244799729.
[I 2026-03-18 16:30:29,239] Trial 10 pruned. 
[I 2026-03-18 16:30:29,708] Trial 2 pruned. 
[I 2026-03-18 16:30:29,887] Trial 20 pruned. 
[I 2026-03-18 16:30:31,179] Trial 14 pruned. 
[I 2026-03-18 16:30:32,350] Trial 1 finished with value: -2.804181999864486 and parameters: {'n_layers_yyx': 1, 'hidden_size_yyx_l0': 3, 'context_size_yyx': 2, 'num_mix_components_yyx': 4, 'context_extractor_yyx': 'gru', 'activation_func_yyx': 'ReLU', 'L2_weight_yyx': 1.875829274098855e-08, 'L_entropy_weight_yyx': 1.5548580288773526e-09, 'L_sep_weight_yyx': 8.791665972735413e-06, 'L_scale_weight_yyx': 5.590624065495872e-09, 'learning_rate_yyx': 0.0049345130845888365}. Best is trial 1 with value: -2.804181999864486.
[I 2026-03-18 16:30:32,462] Trial 18 pruned. 
[I 2026-03-18 16:30:32,665] Trial 11 pruned. 
[I 2026-03-18 16:30:32,740] Trial 11 pruned. 
[I 2026-03-18 16:30:33,529] Trial 21 pruned. 
[I 2026-03-18 16:30:33,613] Trial 5 finished with value: -0.4289297097976732 and parameters: {'n_layers_yyx': 1, 'hidden_size_yyx_l0': 2, 'context_size_yyx': 3, 'num_mix_components_yyx': 3, 'context_extractor_yyx': 'gru', 'activation_func_yyx': 'GELU', 'L2_weight_yyx': 2.3083768065181835e-05, 'L_entropy_weight_yyx': 3.354621757128558e-06, 'L_sep_weight_yyx': 2.569661568048169e-10, 'L_scale_weight_yyx': 0.000643286452304237, 'learning_rate_yyx': 0.006503344574465658}. Best is trial 1 with value: -0.45911608244243424.
[I 2026-03-18 16:30:34,427] Trial 14 finished with value: -0.374952239517826 and parameters: {'n_layers_yyx': 2, 'hidden_size_yyx_l0': 3, 'hidden_size_yyx_l1': 6, 'context_size_yyx': 2, 'num_mix_components_yyx': 2, 'context_extractor_yyx': 'gru', 'activation_func_yyx': 'Tanh', 'L2_weight_yyx': 1.2911457642430093e-07, 'L_entropy_weight_yyx': 1.5826303512830257e-10, 'L_sep_weight_yyx': 1.0015428336693426e-10, 'L_scale_weight_yyx': 1.855728832969616e-05, 'learning_rate_yyx': 0.005738187075330613}. Best is trial 4 with value: -0.43761569280004353.
[I 2026-03-18 16:30:34,695] Trial 15 pruned. 
[I 2026-03-18 16:30:36,151] Trial 12 pruned. 
[I 2026-03-18 16:30:36,783] Trial 12 pruned. 
[I 2026-03-18 16:30:37,058] Trial 22 pruned. 
[I 2026-03-18 16:30:37,107] Trial 6 pruned. 
[I 2026-03-18 16:30:37,367] Trial 15 pruned. 
[I 2026-03-18 16:30:39,017] Trial 19 pruned. 
[I 2026-03-18 16:30:39,253] Trial 9 finished with value: -0.4271615326589106 and parameters: {'n_layers_yyx': 1, 'hidden_size_yyx_l0': 6, 'context_size_yyx': 3, 'num_mix_components_yyx': 1, 'context_extractor_yyx': 'gru', 'activation_func_yyx': 'Tanh', 'L2_weight_yyx': 3.1939207197397525e-05, 'L_entropy_weight_yyx': 1.92168889842066e-05, 'L_sep_weight_yyx': 4.994521160273748e-08, 'L_scale_weight_yyx': 8.046479265210699e-06, 'learning_rate_yyx': 0.0027125652718204166}. Best is trial 9 with value: -0.4271615326589106.
[I 2026-03-18 16:30:40,164] Trial 13 pruned. 
[I 2026-03-18 16:30:40,226] Trial 7 pruned. 
[I 2026-03-18 16:30:40,569] Trial 23 pruned. 
[I 2026-03-18 16:30:40,615] Trial 2 pruned. 
[I 2026-03-18 16:30:40,816] Trial 8 pruned. 
[I 2026-03-18 16:30:41,241] Trial 16 pruned. 
[I 2026-03-18 16:30:42,848] Trial 20 pruned. 
[I 2026-03-18 16:30:43,071] Trial 1 finished with value: -2.8010403323029167 and parameters: {'n_layers_yyx': 1, 'hidden_size_yyx_l0': 4, 'context_size_yyx': 3, 'num_mix_components_yyx': 2, 'context_extractor_yyx': 'gru', 'activation_func_yyx': 'ReLU', 'L2_weight_yyx': 1.5569408326161345e-06, 'L_entropy_weight_yyx': 1.9243497917108635e-07, 'L_sep_weight_yyx': 1.4796856976332905e-05, 'L_scale_weight_yyx': 5.478776196352405e-09, 'learning_rate_yyx': 0.0031183501979386587}. Best is trial 1 with value: -2.8010403323029167.
[I 2026-03-18 16:30:43,336] Trial 16 pruned. 
[I 2026-03-18 16:30:44,141] Trial 14 pruned. 
[I 2026-03-18 16:30:44,890] Trial 17 pruned. 
[I 2026-03-18 16:30:45,454] Trial 24 pruned. 
[I 2026-03-18 16:30:45,715] Trial 10 pruned. 
[I 2026-03-18 16:30:45,751] Trial 11 finished with value: -0.40602121264572855 and parameters: {'n_layers_yyx': 1, 'hidden_size_yyx_l0': 6, 'context_size_yyx': 2, 'num_mix_components_yyx': 2, 'context_extractor_yyx': 'lstm', 'activation_func_yyx': 'GELU', 'L2_weight_yyx': 1.3646312491775326e-08, 'L_entropy_weight_yyx': 1.247891342064265e-10, 'L_sep_weight_yyx': 4.079135730589985e-06, 'L_scale_weight_yyx': 4.15639459367422e-06, 'learning_rate_yyx': 0.0038932486405071193}. Best is trial 2 with value: -0.4289537553816757.
[I 2026-03-18 16:30:46,126] Trial 17 pruned. 
[I 2026-03-18 16:30:47,198] Trial 9 pruned. 
[I 2026-03-18 16:30:48,113] Trial 3 pruned. 
[I 2026-03-18 16:30:48,125] Trial 18 pruned. 
[I 2026-03-18 16:30:48,167] Trial 23 finished with value: -0.4343582484006144 and parameters: {'n_layers_yyx': 2, 'hidden_size_yyx_l0': 2, 'hidden_size_yyx_l1': 5, 'context_size_yyx': 3, 'num_mix_components_yyx': 1, 'context_extractor_yyx': 'gru', 'activation_func_yyx': 'ReLU', 'L2_weight_yyx': 9.288141079132014e-09, 'L_entropy_weight_yyx': 0.0002774292368865672, 'L_sep_weight_yyx': 4.9389233999987534e-09, 'L_scale_weight_yyx': 1.568815230941061e-07, 'learning_rate_yyx': 0.004678721416894076}. Best is trial 1 with value: -0.44267641427716237.
[I 2026-03-18 16:30:50,644] Trial 10 pruned. 
