[I 2026-03-18 19:35:43,535] Trial 30 finished with value: -1.6758763736283075 and parameters: {'n_layers_yyx': 2, 'hidden_size_yyx_l0': 5, 'hidden_size_yyx_l1': 5, 'context_size_yyx': 4, 'num_mix_components_yyx': 5, 'context_extractor_yyx': 'lstm', 'activation_func_yyx': 'Tanh', 'L2_weight_yyx': 7.704665586442709e-06, 'L_entropy_weight_yyx': 0.00015355822881540394, 'L_sep_weight_yyx': 2.340431231171533e-07, 'L_scale_weight_yyx': 0.00023721079480474636, 'learning_rate_yyx': 0.007833007375870818}. Best is trial 30 with value: -1.6758763736283075.
[I 2026-03-18 19:35:50,147] Trial 10 finished with value: -2.514490747047302 and parameters: {'n_layers_yyx': 1, 'hidden_size_yyx_l0': 5, 'context_size_yyx': 1, 'num_mix_components_yyx': 4, 'context_extractor_yyx': 'lstm', 'activation_func_yyx': 'ReLU', 'L2_weight_yyx': 2.7808754010729677e-10, 'L_entropy_weight_yyx': 2.071506685066822e-08, 'L_sep_weight_yyx': 3.5089144686294354e-08, 'L_scale_weight_yyx': 1.2601887725412812e-10, 'learning_rate_yyx': 0.008807978631410484}. Best is trial 10 with value: -2.514490747047302.
[I 2026-03-18 19:35:51,970] Trial 17 pruned. 
[I 2026-03-18 19:35:57,435] Trial 12 finished with value: -2.503297067982282 and parameters: {'n_layers_yyx': 1, 'hidden_size_yyx_l0': 6, 'context_size_yyx': 4, 'num_mix_components_yyx': 5, 'context_extractor_yyx': 'lstm', 'activation_func_yyx': 'Tanh', 'L2_weight_yyx': 1.1438774788485979e-10, 'L_entropy_weight_yyx': 0.0006462288670306301, 'L_sep_weight_yyx': 0.0009574464837757517, 'L_scale_weight_yyx': 6.583523376517107e-09, 'learning_rate_yyx': 0.009936669999348655}. Best is trial 10 with value: -2.503375894709151.
[I 2026-03-18 19:35:57,806] Trial 26 pruned. 
[I 2026-03-18 19:36:08,252] Trial 12 pruned. 
[I 2026-03-18 19:36:08,664] Trial 12 pruned. 
[I 2026-03-18 19:36:14,384] Trial 11 finished with value: -2.0082515314778275 and parameters: {'n_layers_yyx': 2, 'hidden_size_yyx_l0': 2, 'hidden_size_yyx_l1': 6, 'context_size_yyx': 2, 'num_mix_components_yyx': 3, 'context_extractor_yyx': 'gru', 'activation_func_yyx': 'ReLU', 'L2_weight_yyx': 9.005266146813528e-05, 'L_entropy_weight_yyx': 2.113783349130871e-09, 'L_sep_weight_yyx': 3.688415119141753e-08, 'L_scale_weight_yyx': 0.0004738118454976903, 'learning_rate_yyx': 0.00996206687106609}. Best is trial 0 with value: -2.0138799336866504.
[I 2026-03-18 19:36:33,370] Trial 13 pruned. 
[I 2026-03-18 19:36:51,049] Trial 8 finished with value: -2.0365283470022115 and parameters: {'n_layers_yyx': 1, 'hidden_size_yyx_l0': 6, 'context_size_yyx': 4, 'num_mix_components_yyx': 5, 'context_extractor_yyx': 'lstm', 'activation_func_yyx': 'ReLU', 'L2_weight_yyx': 0.0005331568815546056, 'L_entropy_weight_yyx': 1.1417015595661803e-10, 'L_sep_weight_yyx': 4.360184832276414e-10, 'L_scale_weight_yyx': 4.121578799618705e-09, 'learning_rate_yyx': 0.004484445894725073}. Best is trial 8 with value: -2.0365283470022115.
[I 2026-03-18 19:36:52,333] Trial 22 pruned. 
[I 2026-03-18 19:36:52,344] Trial 30 pruned. 
[I 2026-03-18 19:36:58,198] Trial 23 pruned. 
[I 2026-03-18 19:37:03,704] Trial 12 pruned. 
[I 2026-03-18 19:37:11,962] Trial 10 finished with value: -2.4972452262569216 and parameters: {'n_layers_yyx': 1, 'hidden_size_yyx_l0': 6, 'context_size_yyx': 4, 'num_mix_components_yyx': 1, 'context_extractor_yyx': 'lstm', 'activation_func_yyx': 'ReLU', 'L2_weight_yyx': 0.0003280072658068025, 'L_entropy_weight_yyx': 1.2489480389817172e-10, 'L_sep_weight_yyx': 7.2537810505291385e-06, 'L_scale_weight_yyx': 6.276307810426861e-08, 'learning_rate_yyx': 0.009165814622896744}. Best is trial 1 with value: -2.5125601952756833.
[I 2026-03-18 19:37:11,999] Trial 25 finished with value: -1.6660143344921312 and parameters: {'n_layers_yyx': 1, 'hidden_size_yyx_l0': 5, 'context_size_yyx': 2, 'num_mix_components_yyx': 3, 'context_extractor_yyx': 'lstm', 'activation_func_yyx': 'Tanh', 'L2_weight_yyx': 3.780521427348594e-09, 'L_entropy_weight_yyx': 1.275183570794208e-10, 'L_sep_weight_yyx': 1.4355278141343502e-07, 'L_scale_weight_yyx': 0.0009653864556776607, 'learning_rate_yyx': 0.0037764334640429807}. Best is trial 10 with value: -1.6769862653887198.
[I 2026-03-18 19:37:14,025] Trial 26 finished with value: -1.6971896217692812 and parameters: {'n_layers_yyx': 1, 'hidden_size_yyx_l0': 2, 'context_size_yyx': 4, 'num_mix_components_yyx': 5, 'context_extractor_yyx': 'lstm', 'activation_func_yyx': 'Tanh', 'L2_weight_yyx': 1.1452154346051934e-05, 'L_entropy_weight_yyx': 5.895272057735521e-10, 'L_sep_weight_yyx': 4.510147296282402e-06, 'L_scale_weight_yyx': 5.892502761141986e-09, 'learning_rate_yyx': 0.007099533269471397}. Best is trial 18 with value: -1.7002973458681911.
[I 2026-03-18 19:37:28,616] Trial 23 finished with value: -1.9816290845526463 and parameters: {'n_layers_yyx': 1, 'hidden_size_yyx_l0': 4, 'context_size_yyx': 4, 'num_mix_components_yyx': 4, 'context_extractor_yyx': 'gru', 'activation_func_yyx': 'ReLU', 'L2_weight_yyx': 1.0673794874409723e-06, 'L_entropy_weight_yyx': 1.315158079101006e-06, 'L_sep_weight_yyx': 0.00021257046143408274, 'L_scale_weight_yyx': 5.910387366192421e-06, 'learning_rate_yyx': 0.006713343552064822}. Best is trial 11 with value: -1.9852781357200364.
[I 2026-03-18 19:37:33,197] Trial 31 pruned. 
[I 2026-03-18 19:37:34,549] Trial 9 pruned. 
[I 2026-03-18 19:37:34,550] Trial 23 pruned. 
[I 2026-03-18 19:37:36,172] Trial 11 pruned. 
[I 2026-03-18 19:37:36,661] Trial 27 pruned. 
[I 2026-03-18 19:37:38,961] Trial 15 finished with value: -2.018587746758904 and parameters: {'n_layers_yyx': 2, 'hidden_size_yyx_l0': 5, 'hidden_size_yyx_l1': 5, 'context_size_yyx': 1, 'num_mix_components_yyx': 5, 'context_extractor_yyx': 'gru', 'activation_func_yyx': 'ReLU', 'L2_weight_yyx': 6.933168578219414e-09, 'L_entropy_weight_yyx': 7.055273538974266e-05, 'L_sep_weight_yyx': 0.00042938285392469405, 'L_scale_weight_yyx': 0.0006324088535772595, 'learning_rate_yyx': 0.009540057677708247}. Best is trial 13 with value: -2.0221624466873753.
[I 2026-03-18 19:37:39,726] Trial 14 finished with value: -1.6739947471636984 and parameters: {'n_layers_yyx': 2, 'hidden_size_yyx_l0': 2, 'hidden_size_yyx_l1': 3, 'context_size_yyx': 3, 'num_mix_components_yyx': 2, 'context_extractor_yyx': 'gru', 'activation_func_yyx': 'Tanh', 'L2_weight_yyx': 1.5532596470224872e-05, 'L_entropy_weight_yyx': 1.0519488258759916e-10, 'L_sep_weight_yyx': 8.177106376265027e-06, 'L_scale_weight_yyx': 9.62419588466516e-07, 'learning_rate_yyx': 0.008839618312034007}. Best is trial 2 with value: -1.680426359749482.
[I 2026-03-18 19:37:42,915] Trial 13 pruned. 
[I 2026-03-18 19:37:44,740] Trial 19 pruned. 
[I 2026-03-18 19:37:46,755] Trial 27 pruned. 
[I 2026-03-18 19:38:05,809] Trial 20 pruned. 
[I 2026-03-18 19:38:08,966] Trial 10 pruned. 
[I 2026-03-18 19:38:10,577] Trial 12 finished with value: -1.6710036065588771 and parameters: {'n_layers_yyx': 2, 'hidden_size_yyx_l0': 4, 'hidden_size_yyx_l1': 6, 'context_size_yyx': 2, 'num_mix_components_yyx': 4, 'context_extractor_yyx': 'gru', 'activation_func_yyx': 'ReLU', 'L2_weight_yyx': 1.023621913337169e-07, 'L_entropy_weight_yyx': 0.0009019652492110174, 'L_sep_weight_yyx': 3.9323235279832734e-09, 'L_scale_weight_yyx': 5.410192117638405e-09, 'learning_rate_yyx': 0.0033187419399479134}. Best is trial 7 with value: -1.6801514889058558.
[I 2026-03-18 19:38:10,691] Trial 24 pruned. 
[I 2026-03-18 19:38:16,273] Trial 31 pruned. 
[I 2026-03-18 19:38:18,220] Trial 10 finished with value: -2.512694167364211 and parameters: {'n_layers_yyx': 1, 'hidden_size_yyx_l0': 4, 'context_size_yyx': 4, 'num_mix_components_yyx': 3, 'context_extractor_yyx': 'gru', 'activation_func_yyx': 'ReLU', 'L2_weight_yyx': 4.303400873575829e-06, 'L_entropy_weight_yyx': 1.4426927846705993e-08, 'L_sep_weight_yyx': 0.0009456246777483653, 'L_scale_weight_yyx': 1.0202958717179451e-10, 'learning_rate_yyx': 0.009843001662684113}. Best is trial 5 with value: -2.5140323195684524.
[I 2026-03-18 19:38:20,363] Trial 29 finished with value: -1.6625218483471962 and parameters: {'n_layers_yyx': 2, 'hidden_size_yyx_l0': 3, 'hidden_size_yyx_l1': 6, 'context_size_yyx': 3, 'num_mix_components_yyx': 1, 'context_extractor_yyx': 'lstm', 'activation_func_yyx': 'ReLU', 'L2_weight_yyx': 1.3793500588851222e-08, 'L_entropy_weight_yyx': 3.39034144119847e-07, 'L_sep_weight_yyx': 3.6993138298973615e-10, 'L_scale_weight_yyx': 5.085074325078615e-10, 'learning_rate_yyx': 0.003556783658037536}. Best is trial 23 with value: -1.668135777403489.
[I 2026-03-18 19:38:25,673] Trial 21 pruned. 
[I 2026-03-18 19:38:26,924] Trial 13 pruned. 
[I 2026-03-18 19:38:29,091] Trial 11 pruned. 
[I 2026-03-18 19:38:35,034] Trial 18 pruned. 
[I 2026-03-18 19:38:38,162] Trial 30 pruned. 
[I 2026-03-18 19:38:43,575] Trial 11 finished with value: -2.5121038870132835 and parameters: {'n_layers_yyx': 2, 'hidden_size_yyx_l0': 5, 'hidden_size_yyx_l1': 4, 'context_size_yyx': 3, 'num_mix_components_yyx': 5, 'context_extractor_yyx': 'gru', 'activation_func_yyx': 'GELU', 'L2_weight_yyx': 1.0001615722655164e-10, 'L_entropy_weight_yyx': 1.8558072924035973e-10, 'L_sep_weight_yyx': 0.0009977679183201596, 'L_scale_weight_yyx': 1.6617710658031232e-05, 'learning_rate_yyx': 0.009760569456065933}. Best is trial 10 with value: -2.5122732552574223.
[I 2026-03-18 19:38:45,132] Trial 28 pruned. 
[I 2026-03-18 19:38:45,132] Trial 14 pruned. 
[I 2026-03-18 19:38:47,644] Trial 12 pruned. 
[I 2026-03-18 19:38:54,956] Trial 19 pruned. 
[I 2026-03-18 19:39:02,445] Trial 32 pruned. 
[I 2026-03-18 19:39:06,958] Trial 17 finished with value: -1.6742529073969095 and parameters: {'n_layers_yyx': 2, 'hidden_size_yyx_l0': 6, 'hidden_size_yyx_l1': 4, 'context_size_yyx': 2, 'num_mix_components_yyx': 5, 'context_extractor_yyx': 'lstm', 'activation_func_yyx': 'Tanh', 'L2_weight_yyx': 1.3507505620013399e-06, 'L_entropy_weight_yyx': 0.0005605336914648737, 'L_sep_weight_yyx': 5.730624961033191e-06, 'L_scale_weight_yyx': 1.5327443052699499e-06, 'learning_rate_yyx': 0.0030411389658285214}. Best is trial 15 with value: -1.67837664463496.
[I 2026-03-18 19:39:09,440] Trial 28 pruned. 
[I 2026-03-18 19:39:09,919] Trial 24 pruned. 
[I 2026-03-18 19:39:09,962] Trial 18 finished with value: -1.9795663663233338 and parameters: {'n_layers_yyx': 2, 'hidden_size_yyx_l0': 5, 'hidden_size_yyx_l1': 6, 'context_size_yyx': 3, 'num_mix_components_yyx': 5, 'context_extractor_yyx': 'lstm', 'activation_func_yyx': 'Tanh', 'L2_weight_yyx': 1.3407371386321523e-06, 'L_entropy_weight_yyx': 1.2216111482468774e-09, 'L_sep_weight_yyx': 1.5917289124450203e-06, 'L_scale_weight_yyx': 8.286195274693793e-08, 'learning_rate_yyx': 0.007476027498099721}. Best is trial 1 with value: -1.9828018961884801.
[I 2026-03-18 19:39:14,443] Trial 20 pruned. 
[I 2026-03-18 19:39:20,875] Trial 15 pruned. 
[I 2026-03-18 19:39:24,536] Trial 13 finished with value: -2.5039549864539805 and parameters: {'n_layers_yyx': 1, 'hidden_size_yyx_l0': 5, 'context_size_yyx': 4, 'num_mix_components_yyx': 4, 'context_extractor_yyx': 'lstm', 'activation_func_yyx': 'Tanh', 'L2_weight_yyx': 1.0955022184953296e-10, 'L_entropy_weight_yyx': 8.614333139001106e-05, 'L_sep_weight_yyx': 0.0008922394128663226, 'L_scale_weight_yyx': 8.280232203313346e-07, 'learning_rate_yyx': 0.009338730211213314}. Best is trial 13 with value: -2.5039549864539805.
[I 2026-03-18 19:39:30,135] Trial 13 finished with value: -2.508279753400378 and parameters: {'n_layers_yyx': 2, 'hidden_size_yyx_l0': 6, 'hidden_size_yyx_l1': 2, 'context_size_yyx': 3, 'num_mix_components_yyx': 3, 'context_extractor_yyx': 'gru', 'activation_func_yyx': 'ReLU', 'L2_weight_yyx': 1.430365880877738e-10, 'L_entropy_weight_yyx': 7.862360939145966e-07, 'L_sep_weight_yyx': 1.6695510972382968e-05, 'L_scale_weight_yyx': 1.1186858474282497e-05, 'learning_rate_yyx': 0.009368630238114803}. Best is trial 11 with value: -2.511853029658318.
[I 2026-03-18 19:39:43,355] Trial 18 pruned. 
[I 2026-03-18 19:39:47,369] Trial 15 finished with value: -1.9831613558275432 and parameters: {'n_layers_yyx': 1, 'hidden_size_yyx_l0': 5, 'context_size_yyx': 4, 'num_mix_components_yyx': 4, 'context_extractor_yyx': 'gru', 'activation_func_yyx': 'Tanh', 'L2_weight_yyx': 3.238052735517472e-09, 'L_entropy_weight_yyx': 3.726233242903526e-05, 'L_sep_weight_yyx': 3.6065047527021094e-07, 'L_scale_weight_yyx': 5.273079208094715e-05, 'learning_rate_yyx': 0.006135413925668486}. Best is trial 12 with value: -1.983840502266522.
[I 2026-03-18 19:39:49,033] Trial 25 pruned. 
[I 2026-03-18 19:39:56,599] Trial 16 pruned. 
[I 2026-03-18 19:40:06,568] Trial 31 pruned. 
[I 2026-03-18 19:40:07,334] Trial 24 finished with value: -1.6784337129459994 and parameters: {'n_layers_yyx': 1, 'hidden_size_yyx_l0': 6, 'context_size_yyx': 4, 'num_mix_components_yyx': 4, 'context_extractor_yyx': 'lstm', 'activation_func_yyx': 'GELU', 'L2_weight_yyx': 0.0009238552532907801, 'L_entropy_weight_yyx': 2.2671768276910505e-06, 'L_sep_weight_yyx': 3.5279056391252405e-05, 'L_scale_weight_yyx': 9.779854821431969e-09, 'learning_rate_yyx': 0.009717979483460575}. Best is trial 13 with value: -1.6789194095140463.
[I 2026-03-18 19:40:08,096] Trial 14 pruned. 
[I 2026-03-18 19:40:10,180] Trial 29 finished with value: -1.9921845272854641 and parameters: {'n_layers_yyx': 2, 'hidden_size_yyx_l0': 4, 'hidden_size_yyx_l1': 4, 'context_size_yyx': 2, 'num_mix_components_yyx': 5, 'context_extractor_yyx': 'gru', 'activation_func_yyx': 'Tanh', 'L2_weight_yyx': 2.067927318650307e-07, 'L_entropy_weight_yyx': 2.4630943111120064e-08, 'L_sep_weight_yyx': 9.881360221803176e-08, 'L_scale_weight_yyx': 3.4309818258590742e-06, 'learning_rate_yyx': 0.005168759944777309}. Best is trial 15 with value: -1.9940496908651817.
[I 2026-03-18 19:40:15,278] Trial 14 pruned. 
[I 2026-03-18 19:40:20,487] Trial 19 pruned. 
[I 2026-03-18 19:40:26,922] Trial 22 pruned. 
[I 2026-03-18 19:40:29,602] Trial 25 finished with value: -1.9803655320474394 and parameters: {'n_layers_yyx': 1, 'hidden_size_yyx_l0': 4, 'context_size_yyx': 4, 'num_mix_components_yyx': 4, 'context_extractor_yyx': 'gru', 'activation_func_yyx': 'Tanh', 'L2_weight_yyx': 1.0695967312942064e-09, 'L_entropy_weight_yyx': 8.658977064124723e-07, 'L_sep_weight_yyx': 1.3067750941606713e-06, 'L_scale_weight_yyx': 4.0089207372562924e-05, 'learning_rate_yyx': 0.009779840769754062}. Best is trial 11 with value: -1.9852781357200364.
[I 2026-03-18 19:40:33,064] Trial 33 pruned. 
[I 2026-03-18 19:40:34,293] Trial 28 finished with value: -1.7181546080346202 and parameters: {'n_layers_yyx': 2, 'hidden_size_yyx_l0': 5, 'hidden_size_yyx_l1': 4, 'context_size_yyx': 4, 'num_mix_components_yyx': 4, 'context_extractor_yyx': 'gru', 'activation_func_yyx': 'GELU', 'L2_weight_yyx': 2.565906622697347e-07, 'L_entropy_weight_yyx': 1.668751972272465e-08, 'L_sep_weight_yyx': 1.1104169668385235e-10, 'L_scale_weight_yyx': 1.75759304970751e-06, 'learning_rate_yyx': 0.009401025731398463}. Best is trial 28 with value: -1.7181546080346202.
[I 2026-03-18 19:40:40,430] Trial 10 finished with value: -2.036132127698189 and parameters: {'n_layers_yyx': 1, 'hidden_size_yyx_l0': 6, 'context_size_yyx': 4, 'num_mix_components_yyx': 4, 'context_extractor_yyx': 'lstm', 'activation_func_yyx': 'ReLU', 'L2_weight_yyx': 8.588679774810167e-10, 'L_entropy_weight_yyx': 8.556105683563618e-07, 'L_sep_weight_yyx': 6.211448635386532e-09, 'L_scale_weight_yyx': 3.6342128297594474e-08, 'learning_rate_yyx': 0.006137059150694207}. Best is trial 8 with value: -2.0365283470022115.
[I 2026-03-18 19:40:46,946] Trial 26 finished with value: -1.6698893336708989 and parameters: {'n_layers_yyx': 1, 'hidden_size_yyx_l0': 6, 'context_size_yyx': 1, 'num_mix_components_yyx': 4, 'context_extractor_yyx': 'gru', 'activation_func_yyx': 'Tanh', 'L2_weight_yyx': 3.053717023313808e-08, 'L_entropy_weight_yyx': 4.954597943416949e-10, 'L_sep_weight_yyx': 3.842484695126831e-08, 'L_scale_weight_yyx': 5.98441683927721e-07, 'learning_rate_yyx': 0.005579509974773767}. Best is trial 10 with value: -1.6769862653887198.
[I 2026-03-18 19:40:47,446] Trial 23 pruned. 
[I 2026-03-18 19:40:49,391] Trial 12 pruned. 
[I 2026-03-18 19:40:51,303] Trial 26 pruned. 
[I 2026-03-18 19:40:52,029] Trial 30 pruned. 
[I 2026-03-18 19:40:53,227] Trial 19 pruned. 
[I 2026-03-18 19:40:55,582] Trial 20 pruned. 
[I 2026-03-18 19:41:04,307] Trial 27 pruned. 
[I 2026-03-18 19:41:04,768] Trial 15 pruned. 
[I 2026-03-18 19:41:05,745] Trial 32 finished with value: -1.7267489540309382 and parameters: {'n_layers_yyx': 1, 'hidden_size_yyx_l0': 4, 'context_size_yyx': 4, 'num_mix_components_yyx': 4, 'context_extractor_yyx': 'lstm', 'activation_func_yyx': 'ReLU', 'L2_weight_yyx': 2.211713556263397e-05, 'L_entropy_weight_yyx': 1.0222434651576261e-07, 'L_sep_weight_yyx': 2.832459318804659e-10, 'L_scale_weight_yyx': 1.3233326955024835e-06, 'learning_rate_yyx': 0.00998441892574619}. Best is trial 8 with value: -1.7294919135267302.
[I 2026-03-18 19:41:09,125] Trial 34 pruned. 
[I 2026-03-18 19:41:10,608] Trial 29 pruned. 
[I 2026-03-18 19:41:10,674] Trial 21 pruned. 
[I 2026-03-18 19:41:11,117] Trial 27 pruned. 
[I 2026-03-18 19:41:15,629] Trial 16 finished with value: -2.4909655313015433 and parameters: {'n_layers_yyx': 1, 'hidden_size_yyx_l0': 5, 'context_size_yyx': 1, 'num_mix_components_yyx': 2, 'context_extractor_yyx': 'gru', 'activation_func_yyx': 'Tanh', 'L2_weight_yyx': 2.609627794601845e-07, 'L_entropy_weight_yyx': 1.1782881152945871e-07, 'L_sep_weight_yyx': 3.219748186662496e-08, 'L_scale_weight_yyx': 1.846447068005987e-07, 'learning_rate_yyx': 0.003489225070396384}. Best is trial 0 with value: -2.5120178855442976.
[I 2026-03-18 19:41:21,634] Trial 24 pruned. 
[I 2026-03-18 19:41:26,227] Trial 11 finished with value: -2.514569603778864 and parameters: {'n_layers_yyx': 1, 'hidden_size_yyx_l0': 5, 'context_size_yyx': 1, 'num_mix_components_yyx': 4, 'context_extractor_yyx': 'lstm', 'activation_func_yyx': 'ReLU', 'L2_weight_yyx': 2.537634050237795e-10, 'L_entropy_weight_yyx': 1.2848738002851937e-08, 'L_sep_weight_yyx': 3.690754284438477e-08, 'L_scale_weight_yyx': 1.1790771799838307e-10, 'learning_rate_yyx': 0.009346506049388381}. Best is trial 11 with value: -2.514569603778864.
[I 2026-03-18 19:41:27,402] Trial 30 pruned. 
[I 2026-03-18 19:41:28,667] Trial 20 pruned. 
[I 2026-03-18 19:41:31,303] Trial 31 pruned. 
[I 2026-03-18 19:41:32,926] Trial 16 pruned. 
[I 2026-03-18 19:41:37,048] Trial 13 pruned. 
[I 2026-03-18 19:41:37,054] Trial 17 pruned. 
[I 2026-03-18 19:41:41,313] Trial 11 finished with value: -2.5127596377418153 and parameters: {'n_layers_yyx': 1, 'hidden_size_yyx_l0': 4, 'context_size_yyx': 4, 'num_mix_components_yyx': 3, 'context_extractor_yyx': 'gru', 'activation_func_yyx': 'ReLU', 'L2_weight_yyx': 5.414159302866916e-06, 'L_entropy_weight_yyx': 1.3368385722263612e-08, 'L_sep_weight_yyx': 0.000807388137803764, 'L_scale_weight_yyx': 1.0775219340542947e-10, 'learning_rate_yyx': 0.009982946858539819}. Best is trial 5 with value: -2.5140323195684524.
[I 2026-03-18 19:41:46,934] Trial 21 pruned. 
[I 2026-03-18 19:41:51,724] Trial 22 pruned. 
[I 2026-03-18 19:41:51,761] Trial 28 pruned. 
[I 2026-03-18 19:41:59,678] Trial 14 pruned. 
[I 2026-03-18 19:42:11,973] Trial 17 pruned. 
[I 2026-03-18 19:42:11,987] Trial 29 pruned. 
[I 2026-03-18 19:42:12,951] Trial 15 finished with value: -1.6819845856754096 and parameters: {'n_layers_yyx': 2, 'hidden_size_yyx_l0': 3, 'hidden_size_yyx_l1': 3, 'context_size_yyx': 3, 'num_mix_components_yyx': 4, 'context_extractor_yyx': 'gru', 'activation_func_yyx': 'Tanh', 'L2_weight_yyx': 2.0065369516929067e-08, 'L_entropy_weight_yyx': 1.0177961381508833e-10, 'L_sep_weight_yyx': 1.6931070583388673e-05, 'L_scale_weight_yyx': 2.5810845600397712e-06, 'learning_rate_yyx': 0.009530236856433913}. Best is trial 15 with value: -1.6819845856754096.
[I 2026-03-18 19:42:19,683] Trial 16 pruned. 
[I 2026-03-18 19:42:19,905] Trial 17 finished with value: -1.6681016979739964 and parameters: {'n_layers_yyx': 2, 'hidden_size_yyx_l0': 4, 'hidden_size_yyx_l1': 6, 'context_size_yyx': 3, 'num_mix_components_yyx': 2, 'context_extractor_yyx': 'gru', 'activation_func_yyx': 'Tanh', 'L2_weight_yyx': 7.283435240917603e-05, 'L_entropy_weight_yyx': 2.8638557868435526e-10, 'L_sep_weight_yyx': 1.0892699077265851e-08, 'L_scale_weight_yyx': 3.234610286326625e-08, 'learning_rate_yyx': 0.009993938236077023}. Best is trial 7 with value: -1.6801514889058558.
[I 2026-03-18 19:42:21,598] Trial 22 pruned. 
[I 2026-03-18 19:42:22,014] Trial 18 pruned. 
[I 2026-03-18 19:42:23,831] Trial 12 pruned. 
[I 2026-03-18 19:42:26,542] Trial 29 finished with value: -1.7022003714493879 and parameters: {'n_layers_yyx': 2, 'hidden_size_yyx_l0': 4, 'hidden_size_yyx_l1': 5, 'context_size_yyx': 2, 'num_mix_components_yyx': 2, 'context_extractor_yyx': 'lstm', 'activation_func_yyx': 'GELU', 'L2_weight_yyx': 0.00020883828247993038, 'L_entropy_weight_yyx': 3.039649024562196e-09, 'L_sep_weight_yyx': 4.253414526451877e-06, 'L_scale_weight_yyx': 1.6396694007811417e-08, 'learning_rate_yyx': 0.009392026512918063}. Best is trial 5 with value: -1.704671424204909.
[I 2026-03-18 19:42:27,231] Trial 33 pruned. 
[I 2026-03-18 19:42:29,144] Trial 30 pruned. 
[I 2026-03-18 19:42:31,100] Trial 18 pruned. 
[I 2026-03-18 19:42:33,913] Trial 14 finished with value: -2.0104517866504015 and parameters: {'n_layers_yyx': 1, 'hidden_size_yyx_l0': 3, 'context_size_yyx': 4, 'num_mix_components_yyx': 4, 'context_extractor_yyx': 'lstm', 'activation_func_yyx': 'Tanh', 'L2_weight_yyx': 3.481853989435088e-08, 'L_entropy_weight_yyx': 6.40525680930963e-09, 'L_sep_weight_yyx': 2.391681271476399e-07, 'L_scale_weight_yyx': 6.0899033897468106e-05, 'learning_rate_yyx': 0.005226273244699366}. Best is trial 0 with value: -2.0138799336866504.
