[I 2026-03-18 18:50:54,210] Trial 49 pruned. 

Source events: 10683
Target events: 9421
Full model ln_yyx : 320.01616 nats/sec, 30.57155 nats/event
Full model Log loss : -1.67027
Full model ln_yyx : 321.63013 nats/sec, 30.72573 nats/event
Full model Log loss : -1.67436
Full model ln_yyx : 323.54800 nats/sec, 30.90895 nats/event
Full model Log loss : -1.67778
Full model ln_yyx : 318.75775 nats/sec, 30.45133 nats/event
Full model Log loss : -1.65953
Full model ln_yyx : 316.79873 nats/sec, 30.26418 nats/event
Full model Log loss : -1.65951
Full model ln_yyx : 320.80247 nats/sec, 30.64666 nats/event
Full model Log loss : -1.66066
Full model ln_yyx : 317.70637 nats/sec, 30.35089 nats/event
Full model Log loss : -1.66116
Full model ln_yyx : 319.90632 nats/sec, 30.56105 nats/event
Full model Log loss : -1.66930
Optimization finished. Config saved to results/opt-full/opt_full_115_best_config.txt
[I 2026-03-18 18:50:56,337] Trial 48 pruned. 
[I 2026-03-18 18:50:57,305] Trial 43 pruned. 
[I 2026-03-18 18:50:59,516] Trial 39 finished with value: -1.6665113667551432 and parameters: {'n_layers_yyx': 2, 'hidden_size_yyx_l0': 5, 'hidden_size_yyx_l1': 6, 'context_size_yyx': 3, 'num_mix_components_yyx': 5, 'context_extractor_yyx': 'lstm', 'activation_func_yyx': 'Tanh', 'L2_weight_yyx': 2.835030939804659e-06, 'L_entropy_weight_yyx': 1.4945226660784076e-06, 'L_sep_weight_yyx': 2.1153698021712224e-09, 'L_scale_weight_yyx': 3.886823503693529e-08, 'learning_rate_yyx': 0.008069732839892886}. Best is trial 34 with value: -1.6777112637722686.
[I 2026-03-18 18:51:00,021] Trial 42 pruned. 
[I 2026-03-18 18:51:01,277] Trial 49 pruned. 

Source events: 5634
Target events: 16159
Full model ln_yyx : 247.48610 nats/sec, 13.78411 nats/event
Full model Log loss : -1.15512
Full model ln_yyx : 248.60615 nats/sec, 13.84650 nats/event
Full model Log loss : -1.23935
Full model ln_yyx : 252.81064 nats/sec, 14.08067 nats/event
Full model Log loss : -1.25995
Full model ln_yyx : 251.14483 nats/sec, 13.98789 nats/event
Full model Log loss : -1.23763
Full model ln_yyx : 255.08755 nats/sec, 14.20749 nats/event
Full model Log loss : -1.27144
Full model ln_yyx : 254.54313 nats/sec, 14.17717 nats/event
Full model Log loss : -1.26069
Full model ln_yyx : 256.03160 nats/sec, 14.26007 nats/event
Full model Log loss : -1.25421
Full model ln_yyx : 254.68310 nats/sec, 14.18496 nats/event
Full model Log loss : -1.26143
Full model ln_yyx : 252.42182 nats/sec, 14.05902 nats/event
Full model Log loss : -1.26931
Full model ln_yyx : 253.48659 nats/sec, 14.11832 nats/event
Full model Log loss : -1.24926
Full model ln_yyx : 248.53205 nats/sec, 13.84237 nats/event
Full model Log loss : -1.25631
Full model ln_yyx : 252.59326 nats/sec, 14.06856 nats/event
Full model Log loss : -1.25201
Full model ln_yyx : 252.00460 nats/sec, 14.03578 nats/event
Full model Log loss : -1.26586
Full model ln_yyx : 251.79758 nats/sec, 14.02425 nats/event
Full model Log loss : -1.26540
Full model ln_yyx : 255.48614 nats/sec, 14.22969 nats/event
Full model Log loss : -1.27573
Optimization finished. Config saved to results/opt-full/opt_full_101_best_config.txt
[I 2026-03-18 18:51:01,949] Trial 43 pruned. 
[I 2026-03-18 18:51:03,003] Trial 44 pruned. 
[I 2026-03-18 18:51:04,595] Trial 35 pruned. 
[I 2026-03-18 18:51:05,464] Trial 19 finished with value: -1.659598893897478 and parameters: {'n_layers_yyx': 2, 'hidden_size_yyx_l0': 6, 'hidden_size_yyx_l1': 5, 'context_size_yyx': 3, 'num_mix_components_yyx': 2, 'context_extractor_yyx': 'lstm', 'activation_func_yyx': 'GELU', 'L2_weight_yyx': 1.2120718166694837e-05, 'L_entropy_weight_yyx': 1.647850183650692e-08, 'L_sep_weight_yyx': 0.0007168198673113553, 'L_scale_weight_yyx': 1.0493468480359563e-09, 'learning_rate_yyx': 0.00899869790407839}. Best is trial 18 with value: -1.6716810843741248.
[I 2026-03-18 18:51:05,488] Trial 42 finished with value: -1.667231500091406 and parameters: {'n_layers_yyx': 2, 'hidden_size_yyx_l0': 2, 'hidden_size_yyx_l1': 6, 'context_size_yyx': 4, 'num_mix_components_yyx': 2, 'context_extractor_yyx': 'lstm', 'activation_func_yyx': 'Tanh', 'L2_weight_yyx': 3.074014608880959e-10, 'L_entropy_weight_yyx': 6.248929559668363e-08, 'L_sep_weight_yyx': 5.2325997115329575e-08, 'L_scale_weight_yyx': 1.0514979866437309e-07, 'learning_rate_yyx': 0.007234107829915399}. Best is trial 27 with value: -1.6742712595465095.
[I 2026-03-18 18:51:06,388] Trial 38 pruned. 
[I 2026-03-18 18:51:07,262] Trial 45 pruned. 
[I 2026-03-18 18:51:12,014] Trial 36 pruned. 
[I 2026-03-18 18:51:13,647] Trial 46 pruned. 
[I 2026-03-18 18:51:13,881] Trial 39 pruned. 
[I 2026-03-18 18:51:19,934] Trial 43 pruned. 
[I 2026-03-18 18:51:19,971] Trial 47 pruned. 
[I 2026-03-18 18:51:20,300] Trial 44 finished with value: -1.7284493979924842 and parameters: {'n_layers_yyx': 2, 'hidden_size_yyx_l0': 6, 'hidden_size_yyx_l1': 6, 'context_size_yyx': 4, 'num_mix_components_yyx': 2, 'context_extractor_yyx': 'lstm', 'activation_func_yyx': 'ReLU', 'L2_weight_yyx': 3.045668978074978e-10, 'L_entropy_weight_yyx': 0.0008968561572024995, 'L_sep_weight_yyx': 4.983888085937406e-05, 'L_scale_weight_yyx': 7.019722468153161e-09, 'learning_rate_yyx': 0.004226036557109014}. Best is trial 44 with value: -1.7284493979924842.
[I 2026-03-18 18:51:20,349] Trial 38 finished with value: -1.6626718124595252 and parameters: {'n_layers_yyx': 2, 'hidden_size_yyx_l0': 4, 'hidden_size_yyx_l1': 6, 'context_size_yyx': 2, 'num_mix_components_yyx': 5, 'context_extractor_yyx': 'lstm', 'activation_func_yyx': 'GELU', 'L2_weight_yyx': 0.00011666945517471009, 'L_entropy_weight_yyx': 2.026693708314971e-09, 'L_sep_weight_yyx': 5.94495472514482e-10, 'L_scale_weight_yyx': 4.767366649918306e-08, 'learning_rate_yyx': 0.009948396845528331}. Best is trial 19 with value: -1.6674850489567747.
[I 2026-03-18 18:51:23,286] Trial 43 pruned. 
[I 2026-03-18 18:51:24,526] Trial 37 finished with value: -1.6716565122044464 and parameters: {'n_layers_yyx': 2, 'hidden_size_yyx_l0': 4, 'hidden_size_yyx_l1': 5, 'context_size_yyx': 4, 'num_mix_components_yyx': 4, 'context_extractor_yyx': 'lstm', 'activation_func_yyx': 'Tanh', 'L2_weight_yyx': 1.0602114549875627e-10, 'L_entropy_weight_yyx': 7.112104208701186e-07, 'L_sep_weight_yyx': 6.705517108950371e-08, 'L_scale_weight_yyx': 0.00012527917046201444, 'learning_rate_yyx': 0.005337860219269456}. Best is trial 23 with value: -1.675936991716372.
[I 2026-03-18 18:51:24,810] Trial 38 pruned. 
[I 2026-03-18 18:51:27,897] Trial 37 pruned. 
[I 2026-03-18 18:51:28,222] Trial 36 pruned. 
[I 2026-03-18 18:51:28,609] Trial 45 pruned. 
[I 2026-03-18 18:51:30,629] Trial 38 pruned. 
[I 2026-03-18 18:51:33,711] Trial 32 finished with value: -2.637233464477424 and parameters: {'n_layers_yyx': 1, 'hidden_size_yyx_l0': 4, 'context_size_yyx': 3, 'num_mix_components_yyx': 5, 'context_extractor_yyx': 'lstm', 'activation_func_yyx': 'GELU', 'L2_weight_yyx': 1.1061040071914972e-08, 'L_entropy_weight_yyx': 7.512960403621268e-10, 'L_sep_weight_yyx': 1.3399565221846794e-06, 'L_scale_weight_yyx': 1.3961427559511452e-05, 'learning_rate_yyx': 0.006656952154749942}. Best is trial 6 with value: -2.642843521506465.
[I 2026-03-18 18:51:34,112] Trial 39 pruned. 
[I 2026-03-18 18:51:34,182] Trial 40 pruned. 
[I 2026-03-18 18:51:34,329] Trial 28 finished with value: -1.6653919073110366 and parameters: {'n_layers_yyx': 1, 'hidden_size_yyx_l0': 6, 'context_size_yyx': 4, 'num_mix_components_yyx': 5, 'context_extractor_yyx': 'lstm', 'activation_func_yyx': 'ReLU', 'L2_weight_yyx': 2.075771397655278e-07, 'L_entropy_weight_yyx': 2.9036876484654e-06, 'L_sep_weight_yyx': 0.0007520761326157433, 'L_scale_weight_yyx': 8.381014764087223e-07, 'learning_rate_yyx': 0.008569304300629889}. Best is trial 26 with value: -1.6790522813108588.
[I 2026-03-18 18:51:36,985] Trial 45 finished with value: -1.2602566985237842 and parameters: {'n_layers_yyx': 1, 'hidden_size_yyx_l0': 4, 'context_size_yyx': 4, 'num_mix_components_yyx': 3, 'context_extractor_yyx': 'gru', 'activation_func_yyx': 'Tanh', 'L2_weight_yyx': 0.00018242994574171211, 'L_entropy_weight_yyx': 0.00016771303581883227, 'L_sep_weight_yyx': 5.702189809641429e-07, 'L_scale_weight_yyx': 3.144814137382104e-05, 'learning_rate_yyx': 0.009040867752336909}. Best is trial 6 with value: -1.270142151555821.
[I 2026-03-18 18:51:38,704] Trial 41 finished with value: -2.6504123387725502 and parameters: {'n_layers_yyx': 2, 'hidden_size_yyx_l0': 4, 'hidden_size_yyx_l1': 6, 'context_size_yyx': 4, 'num_mix_components_yyx': 5, 'context_extractor_yyx': 'gru', 'activation_func_yyx': 'ReLU', 'L2_weight_yyx': 2.8878387906898074e-10, 'L_entropy_weight_yyx': 0.00037351331718164755, 'L_sep_weight_yyx': 1.829789839733294e-08, 'L_scale_weight_yyx': 2.3454594439132578e-09, 'learning_rate_yyx': 0.008316848417146217}. Best is trial 10 with value: -2.6537577311197915.
[I 2026-03-18 18:51:39,065] Trial 44 finished with value: -2.6424019503335066 and parameters: {'n_layers_yyx': 2, 'hidden_size_yyx_l0': 2, 'hidden_size_yyx_l1': 5, 'context_size_yyx': 3, 'num_mix_components_yyx': 5, 'context_extractor_yyx': 'gru', 'activation_func_yyx': 'Tanh', 'L2_weight_yyx': 2.715997060342287e-10, 'L_entropy_weight_yyx': 2.8124559175640958e-08, 'L_sep_weight_yyx': 0.0008791904463194289, 'L_scale_weight_yyx': 4.5551925973257515e-10, 'learning_rate_yyx': 0.007975329388660916}. Best is trial 44 with value: -2.6424019503335066.
[I 2026-03-18 18:51:41,823] Trial 35 finished with value: -1.6626554779184908 and parameters: {'n_layers_yyx': 2, 'hidden_size_yyx_l0': 6, 'hidden_size_yyx_l1': 5, 'context_size_yyx': 4, 'num_mix_components_yyx': 4, 'context_extractor_yyx': 'gru', 'activation_func_yyx': 'GELU', 'L2_weight_yyx': 7.957574211409114e-08, 'L_entropy_weight_yyx': 2.2707127561398698e-05, 'L_sep_weight_yyx': 1.465911496335362e-10, 'L_scale_weight_yyx': 2.4296591922749607e-08, 'learning_rate_yyx': 0.006312151217577559}. Best is trial 34 with value: -1.6809483015043902.
[I 2026-03-18 18:51:43,575] Trial 33 pruned. 
[I 2026-03-18 18:51:47,592] Trial 40 pruned. 
[I 2026-03-18 18:51:49,154] Trial 40 pruned. 
[I 2026-03-18 18:51:50,358] Trial 37 pruned. 
[I 2026-03-18 18:51:54,442] Trial 34 pruned. 
[I 2026-03-18 18:51:55,175] Trial 45 pruned. 
[I 2026-03-18 18:51:55,260] Trial 36 pruned. 
[I 2026-03-18 18:51:55,909] Trial 27 finished with value: -2.6297571113094245 and parameters: {'n_layers_yyx': 1, 'hidden_size_yyx_l0': 4, 'context_size_yyx': 2, 'num_mix_components_yyx': 5, 'context_extractor_yyx': 'gru', 'activation_func_yyx': 'Tanh', 'L2_weight_yyx': 4.943254403903744e-06, 'L_entropy_weight_yyx': 0.0003240815262225743, 'L_sep_weight_yyx': 9.725926887219367e-09, 'L_scale_weight_yyx': 6.180409938388248e-08, 'learning_rate_yyx': 0.006708261479938949}. Best is trial 21 with value: -2.6405605351488926.
[I 2026-03-18 18:51:58,717] Trial 43 finished with value: -2.6306336474295144 and parameters: {'n_layers_yyx': 1, 'hidden_size_yyx_l0': 6, 'context_size_yyx': 2, 'num_mix_components_yyx': 5, 'context_extractor_yyx': 'gru', 'activation_func_yyx': 'ReLU', 'L2_weight_yyx': 8.801764201934218e-05, 'L_entropy_weight_yyx': 9.311093317200162e-08, 'L_sep_weight_yyx': 3.805915781459703e-06, 'L_scale_weight_yyx': 7.774953891651155e-07, 'learning_rate_yyx': 0.008758112219119}. Best is trial 40 with value: -2.6389502359323496.
[I 2026-03-18 18:52:02,705] Trial 38 pruned. 
[I 2026-03-18 18:52:02,767] Trial 41 pruned. 
[I 2026-03-18 18:52:03,936] Trial 44 pruned. 
[I 2026-03-18 18:52:04,627] Trial 35 pruned. 
[I 2026-03-18 18:52:08,446] Trial 37 pruned. 
[I 2026-03-18 18:52:13,952] Trial 38 pruned. 
[I 2026-03-18 18:52:14,639] Trial 36 pruned. 
[I 2026-03-18 18:52:17,769] Trial 33 finished with value: -1.6702194434157693 and parameters: {'n_layers_yyx': 1, 'hidden_size_yyx_l0': 4, 'context_size_yyx': 4, 'num_mix_components_yyx': 1, 'context_extractor_yyx': 'lstm', 'activation_func_yyx': 'Tanh', 'L2_weight_yyx': 1.4974679855445266e-09, 'L_entropy_weight_yyx': 1.0822357679439335e-06, 'L_sep_weight_yyx': 4.860840905585528e-09, 'L_scale_weight_yyx': 1.1387697778917116e-06, 'learning_rate_yyx': 0.004299567834710998}. Best is trial 13 with value: -1.6722197537243195.
[I 2026-03-18 18:52:19,735] Trial 46 finished with value: -1.2603173599666235 and parameters: {'n_layers_yyx': 1, 'hidden_size_yyx_l0': 4, 'context_size_yyx': 4, 'num_mix_components_yyx': 4, 'context_extractor_yyx': 'gru', 'activation_func_yyx': 'Tanh', 'L2_weight_yyx': 7.15993962237431e-07, 'L_entropy_weight_yyx': 0.0005088676949872043, 'L_sep_weight_yyx': 1.92348576022509e-08, 'L_scale_weight_yyx': 0.00024154332027353058, 'learning_rate_yyx': 0.008232771921891716}. Best is trial 6 with value: -1.270142151555821.
[I 2026-03-18 18:52:20,280] Trial 39 pruned. 
[I 2026-03-18 18:52:22,135] Trial 44 pruned. 
[I 2026-03-18 18:52:22,598] Trial 34 pruned. 
[I 2026-03-18 18:52:22,788] Trial 47 pruned. 
[I 2026-03-18 18:52:24,476] Trial 37 pruned. 
[I 2026-03-18 18:52:27,445] Trial 46 pruned. 
[I 2026-03-18 18:52:30,957] Trial 48 pruned. 
[I 2026-03-18 18:52:31,696] Trial 45 pruned. 
[I 2026-03-18 18:52:32,953] Trial 47 pruned. 
[I 2026-03-18 18:52:34,892] Trial 42 pruned. 
[I 2026-03-18 18:52:36,641] Trial 39 pruned. 
[I 2026-03-18 18:52:37,599] Trial 44 finished with value: -1.6659853359732752 and parameters: {'n_layers_yyx': 2, 'hidden_size_yyx_l0': 3, 'hidden_size_yyx_l1': 5, 'context_size_yyx': 4, 'num_mix_components_yyx': 3, 'context_extractor_yyx': 'lstm', 'activation_func_yyx': 'Tanh', 'L2_weight_yyx': 3.3102379609605696e-09, 'L_entropy_weight_yyx': 3.373107566489059e-07, 'L_sep_weight_yyx': 2.9209764369304855e-07, 'L_scale_weight_yyx': 4.9669834878199724e-08, 'learning_rate_yyx': 0.008407873205722052}. Best is trial 27 with value: -1.6742712595465095.
[I 2026-03-18 18:52:46,509] Trial 20 pruned. 
[I 2026-03-18 18:52:49,112] Trial 38 pruned. 
[I 2026-03-18 18:52:49,595] Trial 43 pruned. 
[I 2026-03-18 18:52:52,018] Trial 40 pruned. 
[I 2026-03-18 18:52:52,564] Trial 38 pruned. 
[I 2026-03-18 18:52:52,978] Trial 21 pruned. 
[I 2026-03-18 18:52:53,378] Trial 46 finished with value: -1.669363981950042 and parameters: {'n_layers_yyx': 2, 'hidden_size_yyx_l0': 2, 'hidden_size_yyx_l1': 6, 'context_size_yyx': 4, 'num_mix_components_yyx': 3, 'context_extractor_yyx': 'gru', 'activation_func_yyx': 'Tanh', 'L2_weight_yyx': 1.3748950204239534e-07, 'L_entropy_weight_yyx': 1.1733375722391775e-05, 'L_sep_weight_yyx': 1.0401016952736749e-10, 'L_scale_weight_yyx': 7.743652141466844e-05, 'learning_rate_yyx': 0.005059218740089078}. Best is trial 37 with value: -1.6754623372699344.
[I 2026-03-18 18:52:54,762] Trial 46 pruned. 
[I 2026-03-18 18:52:55,024] Trial 40 pruned. 
[I 2026-03-18 18:52:55,190] Trial 41 finished with value: -1.6642986798768324 and parameters: {'n_layers_yyx': 2, 'hidden_size_yyx_l0': 4, 'hidden_size_yyx_l1': 6, 'context_size_yyx': 2, 'num_mix_components_yyx': 5, 'context_extractor_yyx': 'gru', 'activation_func_yyx': 'GELU', 'L2_weight_yyx': 0.0009695746641384732, 'L_entropy_weight_yyx': 7.702593028685852e-09, 'L_sep_weight_yyx': 3.438544739703707e-10, 'L_scale_weight_yyx': 2.1042652843916013e-06, 'learning_rate_yyx': 0.008892517835481008}. Best is trial 19 with value: -1.6674850489567747.
[I 2026-03-18 18:52:57,360] Trial 28 pruned. 
[I 2026-03-18 18:52:58,133] Trial 22 pruned. 
[I 2026-03-18 18:52:58,514] Trial 35 pruned. 
[I 2026-03-18 18:53:01,059] Trial 42 pruned. 
[I 2026-03-18 18:53:01,438] Trial 39 pruned. 
[I 2026-03-18 18:53:03,020] Trial 23 pruned. 
[I 2026-03-18 18:53:03,491] Trial 29 finished with value: -1.6773154412013505 and parameters: {'n_layers_yyx': 1, 'hidden_size_yyx_l0': 5, 'context_size_yyx': 4, 'num_mix_components_yyx': 5, 'context_extractor_yyx': 'lstm', 'activation_func_yyx': 'Tanh', 'L2_weight_yyx': 3.237927802053493e-08, 'L_entropy_weight_yyx': 2.3459343308995245e-10, 'L_sep_weight_yyx': 0.00016140407168156588, 'L_scale_weight_yyx': 0.00034491218225438347, 'learning_rate_yyx': 0.0048428814296753156}. Best is trial 26 with value: -1.6790522813108588.
[I 2026-03-18 18:53:05,016] Trial 42 finished with value: -2.651123340172243 and parameters: {'n_layers_yyx': 2, 'hidden_size_yyx_l0': 4, 'hidden_size_yyx_l1': 6, 'context_size_yyx': 4, 'num_mix_components_yyx': 5, 'context_extractor_yyx': 'gru', 'activation_func_yyx': 'ReLU', 'L2_weight_yyx': 1.0213067082181203e-09, 'L_entropy_weight_yyx': 0.00020926292962879407, 'L_sep_weight_yyx': 5.220544110346173e-09, 'L_scale_weight_yyx': 0.0009603290750041974, 'learning_rate_yyx': 0.007777404996177585}. Best is trial 10 with value: -2.6537577311197915.
[I 2026-03-18 18:53:07,546] Trial 43 pruned. 
[I 2026-03-18 18:53:07,783] Trial 48 pruned. 
[I 2026-03-18 18:53:07,794] Trial 40 pruned. 
[I 2026-03-18 18:53:07,915] Trial 44 finished with value: -2.6299067245624705 and parameters: {'n_layers_yyx': 1, 'hidden_size_yyx_l0': 5, 'context_size_yyx': 3, 'num_mix_components_yyx': 4, 'context_extractor_yyx': 'gru', 'activation_func_yyx': 'ReLU', 'L2_weight_yyx': 5.3364195252026535e-05, 'L_entropy_weight_yyx': 6.604971524752374e-07, 'L_sep_weight_yyx': 1.662585592955295e-06, 'L_scale_weight_yyx': 3.46126550933964e-10, 'learning_rate_yyx': 0.0072352024237520695}. Best is trial 40 with value: -2.6389502359323496.
[I 2026-03-18 18:53:09,528] Trial 36 pruned. 
[I 2026-03-18 18:53:09,573] Trial 45 pruned. 
[I 2026-03-18 18:53:10,444] Trial 45 pruned. 
[I 2026-03-18 18:53:11,299] Trial 39 pruned. 
[I 2026-03-18 18:53:12,860] Trial 49 pruned. 

Source events: 10683
Target events: 1872
Full model ln_yyx : 63.84101 nats/sec, 30.69279 nats/event
Full model Log loss : -1.71116
Full model ln_yyx : 64.82855 nats/sec, 31.16757 nats/event
Full model Log loss : -1.71986
Full model ln_yyx : 64.12373 nats/sec, 30.82871 nats/event
Full model Log loss : -1.70856
Full model ln_yyx : 64.98786 nats/sec, 31.24416 nats/event
Full model Log loss : -1.71971
Full model ln_yyx : 64.22437 nats/sec, 30.87710 nats/event
Full model Log loss : -1.71374
Full model ln_yyx : 64.91532 nats/sec, 31.20929 nats/event
Full model Log loss : -1.71903
Full model ln_yyx : 64.76996 nats/sec, 31.13940 nats/event
Full model Log loss : -1.72714
Full model ln_yyx : 63.75617 nats/sec, 30.65201 nats/event
Full model Log loss : -1.71879
Full model ln_yyx : 65.45391 nats/sec, 31.46822 nats/event
Full model Log loss : -1.72674
Full model ln_yyx : 65.22349 nats/sec, 31.35745 nats/event
Full model Log loss : -1.71709
Full model ln_yyx : 64.22616 nats/sec, 30.87796 nats/event
Full model Log loss : -1.72455
Full model ln_yyx : 65.51727 nats/sec, 31.49869 nats/event
Full model Log loss : -1.72845
Optimization finished. Config saved to results/opt-full/opt_full_113_best_config.txt
[I 2026-03-18 18:53:13,370] Trial 44 pruned. 
[I 2026-03-18 18:53:15,667] Trial 30 pruned. 
[I 2026-03-18 18:53:16,286] Trial 47 pruned. 
[I 2026-03-18 18:53:16,452] Trial 48 finished with value: -1.2649143804243443 and parameters: {'n_layers_yyx': 1, 'hidden_size_yyx_l0': 5, 'context_size_yyx': 4, 'num_mix_components_yyx': 4, 'context_extractor_yyx': 'gru', 'activation_func_yyx': 'Tanh', 'L2_weight_yyx': 1.4277191518122986e-09, 'L_entropy_weight_yyx': 5.172055026658212e-05, 'L_sep_weight_yyx': 1.8812623384402843e-05, 'L_scale_weight_yyx': 0.000923091400703281, 'learning_rate_yyx': 0.006637031077742544}. Best is trial 6 with value: -1.270142151555821.
[I 2026-03-18 18:53:16,780] Trial 41 finished with value: -1.6752931816974894 and parameters: {'n_layers_yyx': 1, 'hidden_size_yyx_l0': 5, 'context_size_yyx': 4, 'num_mix_components_yyx': 3, 'context_extractor_yyx': 'lstm', 'activation_func_yyx': 'Tanh', 'L2_weight_yyx': 9.624237547151972e-08, 'L_entropy_weight_yyx': 2.1434632946886813e-07, 'L_sep_weight_yyx': 4.9125168300756576e-08, 'L_scale_weight_yyx': 1.5120651088721654e-08, 'learning_rate_yyx': 0.006916479543037275}. Best is trial 34 with value: -1.6777112637722686.
[I 2026-03-18 18:53:17,791] Trial 46 pruned. 
[I 2026-03-18 18:53:17,990] Trial 29 pruned. 
[I 2026-03-18 18:53:18,752] Trial 45 pruned. 
[I 2026-03-18 18:53:20,889] Trial 44 pruned. 
[I 2026-03-18 18:53:24,042] Trial 41 pruned. 
[I 2026-03-18 18:53:24,496] Trial 47 pruned. 
[I 2026-03-18 18:53:28,745] Trial 43 pruned. 
[I 2026-03-18 18:53:28,788] Trial 42 pruned. 
[I 2026-03-18 18:53:29,077] Trial 47 pruned. 
[I 2026-03-18 18:53:30,631] Trial 48 pruned. 
[I 2026-03-18 18:53:33,720] Trial 40 pruned. 
[I 2026-03-18 18:53:33,727] Trial 45 pruned. 
[I 2026-03-18 18:53:37,150] Trial 30 pruned. 
[I 2026-03-18 18:53:37,215] Trial 49 pruned. 

Source events: 5634
Target events: 12539
Full model ln_yyx : 197.36719 nats/sec, 14.16624 nats/event
Full model Log loss : -1.26153
Full model ln_yyx : 196.43337 nats/sec, 14.09921 nats/event
Full model Log loss : -1.25440
Full model ln_yyx : 196.50592 nats/sec, 14.10442 nats/event
Full model Log loss : -1.26320
Full model ln_yyx : 191.98398 nats/sec, 13.77985 nats/event
Full model Log loss : -1.22151
Full model ln_yyx : 195.22690 nats/sec, 14.01262 nats/event
Full model Log loss : -1.27014
Full model ln_yyx : 196.36754 nats/sec, 14.09449 nats/event
Full model Log loss : -1.26081
Full model ln_yyx : 190.43825 nats/sec, 13.66891 nats/event
Full model Log loss : -1.24012
Full model ln_yyx : 196.21240 nats/sec, 14.08335 nats/event
Full model Log loss : -1.25675
Full model ln_yyx : 197.02406 nats/sec, 14.14161 nats/event
Full model Log loss : -1.26654
Full model ln_yyx : 195.52599 nats/sec, 14.03409 nats/event
Full model Log loss : -1.24870
Full model ln_yyx : 197.29291 nats/sec, 14.16091 nats/event
Full model Log loss : -1.26234
Full model ln_yyx : 195.74958 nats/sec, 14.05013 nats/event
Full model Log loss : -1.26408
Full model ln_yyx : 197.09132 nats/sec, 14.14644 nats/event
Full model Log loss : -1.26026
Full model ln_yyx : 197.87863 nats/sec, 14.20295 nats/event
Full model Log loss : -1.26032
Full model ln_yyx : 195.23978 nats/sec, 14.01354 nats/event
Full model Log loss : -1.26491
Optimization finished. Config saved to results/opt-full/opt_full_99_best_config.txt
