[I 2026-03-18 16:41:07,596] Trial 12 finished with value: -2.780667498216409 and parameters: {'n_layers_yyx': 2, 'hidden_size_yyx_l0': 5, 'hidden_size_yyx_l1': 6, 'context_size_yyx': 3, 'num_mix_components_yyx': 4, 'context_extractor_yyx': 'lstm', 'activation_func_yyx': 'Tanh', 'L2_weight_yyx': 1.046012574431257e-06, 'L_entropy_weight_yyx': 0.0009916755188484918, 'L_sep_weight_yyx': 1.9877920569777027e-07, 'L_scale_weight_yyx': 3.7966161168925723e-10, 'learning_rate_yyx': 0.009201643354335163}. Best is trial 12 with value: -2.780667498216409.
[I 2026-03-18 16:41:08,781] Trial 17 finished with value: -2.791473635227741 and parameters: {'n_layers_yyx': 1, 'hidden_size_yyx_l0': 5, 'context_size_yyx': 4, 'num_mix_components_yyx': 4, 'context_extractor_yyx': 'lstm', 'activation_func_yyx': 'Tanh', 'L2_weight_yyx': 8.252566049809128e-07, 'L_entropy_weight_yyx': 3.780980796608189e-05, 'L_sep_weight_yyx': 2.5409075154090596e-08, 'L_scale_weight_yyx': 0.0006032468278833323, 'learning_rate_yyx': 0.009359842361696845}. Best is trial 16 with value: -2.795719508385717.
[I 2026-03-18 16:41:09,829] Trial 8 pruned. 
[I 2026-03-18 16:41:10,878] Trial 7 finished with value: -2.802945514464702 and parameters: {'n_layers_yyx': 2, 'hidden_size_yyx_l0': 6, 'hidden_size_yyx_l1': 2, 'context_size_yyx': 4, 'num_mix_components_yyx': 2, 'context_extractor_yyx': 'lstm', 'activation_func_yyx': 'GELU', 'L2_weight_yyx': 6.875778817880087e-07, 'L_entropy_weight_yyx': 0.0005749314678812164, 'L_sep_weight_yyx': 7.845034245964372e-10, 'L_scale_weight_yyx': 2.4255369785023617e-06, 'learning_rate_yyx': 0.0010215174529293548}. Best is trial 7 with value: -2.802945514464702.
[I 2026-03-18 16:41:11,161] Trial 19 pruned. 
[I 2026-03-18 16:41:13,698] Trial 5 finished with value: -2.794410140333028 and parameters: {'n_layers_yyx': 2, 'hidden_size_yyx_l0': 2, 'hidden_size_yyx_l1': 3, 'context_size_yyx': 4, 'num_mix_components_yyx': 4, 'context_extractor_yyx': 'lstm', 'activation_func_yyx': 'ReLU', 'L2_weight_yyx': 5.487277835716662e-10, 'L_entropy_weight_yyx': 0.0008852354265749271, 'L_sep_weight_yyx': 0.0004042551706949131, 'L_scale_weight_yyx': 2.2125990391382518e-08, 'learning_rate_yyx': 0.0019893975383493954}. Best is trial 1 with value: -2.794794619613311.
[I 2026-03-18 16:41:15,639] Trial 18 finished with value: -2.799426411357337 and parameters: {'n_layers_yyx': 2, 'hidden_size_yyx_l0': 5, 'hidden_size_yyx_l1': 6, 'context_size_yyx': 4, 'num_mix_components_yyx': 1, 'context_extractor_yyx': 'lstm', 'activation_func_yyx': 'ReLU', 'L2_weight_yyx': 3.95478204781794e-09, 'L_entropy_weight_yyx': 5.627260170147115e-07, 'L_sep_weight_yyx': 2.8064225550526028e-08, 'L_scale_weight_yyx': 3.680733487542394e-07, 'learning_rate_yyx': 0.006594677922101546}. Best is trial 0 with value: -2.8067502106217272.
[I 2026-03-18 16:41:19,778] Trial 6 pruned. 
[I 2026-03-18 16:41:21,115] Trial 13 pruned. 
[I 2026-03-18 16:41:24,210] Trial 9 pruned. 
[I 2026-03-18 16:41:25,483] Trial 8 pruned. 
[I 2026-03-18 16:41:27,153] Trial 8 finished with value: -2.775107404750908 and parameters: {'n_layers_yyx': 1, 'hidden_size_yyx_l0': 5, 'context_size_yyx': 2, 'num_mix_components_yyx': 5, 'context_extractor_yyx': 'gru', 'activation_func_yyx': 'GELU', 'L2_weight_yyx': 0.00029635367275537204, 'L_entropy_weight_yyx': 0.0001931996652636306, 'L_sep_weight_yyx': 4.601010220588581e-10, 'L_scale_weight_yyx': 0.0004661547985778085, 'learning_rate_yyx': 0.0019175811214377256}. Best is trial 0 with value: -2.782248579189629.
[I 2026-03-18 16:41:32,832] Trial 9 pruned. 
[I 2026-03-18 16:41:41,414] Trial 5 finished with value: -2.7916290927413168 and parameters: {'n_layers_yyx': 2, 'hidden_size_yyx_l0': 6, 'hidden_size_yyx_l1': 6, 'context_size_yyx': 2, 'num_mix_components_yyx': 2, 'context_extractor_yyx': 'gru', 'activation_func_yyx': 'GELU', 'L2_weight_yyx': 4.033315176062587e-09, 'L_entropy_weight_yyx': 8.286165379733247e-08, 'L_sep_weight_yyx': 2.4696208028684886e-06, 'L_scale_weight_yyx': 3.159298089390603e-08, 'learning_rate_yyx': 0.0005167420331078638}. Best is trial 1 with value: -2.8010403323029167.
[I 2026-03-18 16:41:42,749] Trial 8 finished with value: -2.8037041658037247 and parameters: {'n_layers_yyx': 1, 'hidden_size_yyx_l0': 2, 'context_size_yyx': 3, 'num_mix_components_yyx': 2, 'context_extractor_yyx': 'lstm', 'activation_func_yyx': 'GELU', 'L2_weight_yyx': 6.349695395375351e-06, 'L_entropy_weight_yyx': 8.929237352158904e-08, 'L_sep_weight_yyx': 1.5675522669018763e-08, 'L_scale_weight_yyx': 1.7033129933882245e-05, 'learning_rate_yyx': 0.009317159544246854}. Best is trial 5 with value: -2.8058216093098.
[I 2026-03-18 16:41:46,401] Trial 18 pruned. 
[I 2026-03-18 16:41:48,239] Trial 11 pruned. 
[I 2026-03-18 16:41:49,295] Trial 9 pruned. 
[I 2026-03-18 16:41:52,359] Trial 19 pruned. 
[I 2026-03-18 16:41:54,661] Trial 9 finished with value: -2.797726868096437 and parameters: {'n_layers_yyx': 1, 'hidden_size_yyx_l0': 4, 'context_size_yyx': 4, 'num_mix_components_yyx': 4, 'context_extractor_yyx': 'lstm', 'activation_func_yyx': 'ReLU', 'L2_weight_yyx': 1.0339693816960507e-07, 'L_entropy_weight_yyx': 3.164633078022588e-08, 'L_sep_weight_yyx': 2.3882502161525483e-08, 'L_scale_weight_yyx': 4.9085651381226566e-06, 'learning_rate_yyx': 0.006942438713582217}. Best is trial 5 with value: -2.8051328142627483.
[I 2026-03-18 16:41:55,506] Trial 6 finished with value: -2.776034488412418 and parameters: {'n_layers_yyx': 1, 'hidden_size_yyx_l0': 2, 'context_size_yyx': 3, 'num_mix_components_yyx': 5, 'context_extractor_yyx': 'lstm', 'activation_func_yyx': 'GELU', 'L2_weight_yyx': 1.0743186338393893e-05, 'L_entropy_weight_yyx': 4.370407477253691e-07, 'L_sep_weight_yyx': 1.632775615335231e-10, 'L_scale_weight_yyx': 6.878301794546324e-06, 'learning_rate_yyx': 0.0006758321475396057}. Best is trial 3 with value: -2.7991263324759417.
[I 2026-03-18 16:41:57,719] Trial 9 finished with value: -2.803433792457011 and parameters: {'n_layers_yyx': 2, 'hidden_size_yyx_l0': 4, 'hidden_size_yyx_l1': 5, 'context_size_yyx': 3, 'num_mix_components_yyx': 5, 'context_extractor_yyx': 'gru', 'activation_func_yyx': 'Tanh', 'L2_weight_yyx': 2.5987345215249953e-07, 'L_entropy_weight_yyx': 1.3934525841751068e-10, 'L_sep_weight_yyx': 1.263782994486203e-05, 'L_scale_weight_yyx': 4.3507433623698657e-10, 'learning_rate_yyx': 0.0012341097041193851}. Best is trial 5 with value: -2.803729491226789.
[I 2026-03-18 16:41:58,273] Trial 20 pruned. 
[I 2026-03-18 16:41:59,879] Trial 15 finished with value: -2.803256794388449 and parameters: {'n_layers_yyx': 1, 'hidden_size_yyx_l0': 6, 'context_size_yyx': 4, 'num_mix_components_yyx': 2, 'context_extractor_yyx': 'gru', 'activation_func_yyx': 'ReLU', 'L2_weight_yyx': 9.354240125537267e-10, 'L_entropy_weight_yyx': 6.82776581570806e-06, 'L_sep_weight_yyx': 6.24066633778697e-09, 'L_scale_weight_yyx': 8.11226952782829e-10, 'learning_rate_yyx': 0.005134304330987224}. Best is trial 13 with value: -2.8082553050147787.
[I 2026-03-18 16:42:01,405] Trial 7 pruned. 
[I 2026-03-18 16:42:01,968] Trial 12 pruned. 
[I 2026-03-18 16:42:04,034] Trial 10 pruned. 
[I 2026-03-18 16:42:04,132] Trial 10 pruned. 
[I 2026-03-18 16:42:07,744] Trial 8 pruned. 
[I 2026-03-18 16:42:07,856] Trial 13 pruned. 
[I 2026-03-18 16:42:10,116] Trial 11 pruned. 
[I 2026-03-18 16:42:10,595] Trial 11 pruned. 
[I 2026-03-18 16:42:14,053] Trial 9 pruned. 
[I 2026-03-18 16:42:15,116] Trial 16 pruned. 
[I 2026-03-18 16:42:16,776] Trial 12 pruned. 
[I 2026-03-18 16:42:21,859] Trial 17 pruned. 
[I 2026-03-18 16:42:21,975] Trial 14 pruned. 
[I 2026-03-18 16:42:25,177] Trial 12 pruned. 
[I 2026-03-18 16:42:27,210] Trial 6 finished with value: -2.799622790549317 and parameters: {'n_layers_yyx': 1, 'hidden_size_yyx_l0': 5, 'context_size_yyx': 4, 'num_mix_components_yyx': 1, 'context_extractor_yyx': 'lstm', 'activation_func_yyx': 'Tanh', 'L2_weight_yyx': 0.00011302034233330711, 'L_entropy_weight_yyx': 3.751764466770172e-09, 'L_sep_weight_yyx': 1.385853627298599e-06, 'L_scale_weight_yyx': 6.579875152449702e-06, 'learning_rate_yyx': 0.0006477242886895749}. Best is trial 2 with value: -2.802563464577197.
[I 2026-03-18 16:42:27,733] Trial 15 pruned. 
[I 2026-03-18 16:42:31,021] Trial 13 pruned. 
[I 2026-03-18 16:42:31,635] Trial 13 pruned. 
[I 2026-03-18 16:42:33,807] Trial 16 pruned. 
[I 2026-03-18 16:42:34,869] Trial 14 finished with value: -2.775905036690836 and parameters: {'n_layers_yyx': 2, 'hidden_size_yyx_l0': 6, 'hidden_size_yyx_l1': 6, 'context_size_yyx': 3, 'num_mix_components_yyx': 4, 'context_extractor_yyx': 'lstm', 'activation_func_yyx': 'Tanh', 'L2_weight_yyx': 4.482108870932658e-06, 'L_entropy_weight_yyx': 7.574151822539648e-05, 'L_sep_weight_yyx': 5.246889907821633e-09, 'L_scale_weight_yyx': 0.0008780777648500404, 'learning_rate_yyx': 0.005960166124830839}. Best is trial 12 with value: -2.780667498216409.
[I 2026-03-18 16:42:36,121] Trial 18 pruned. 
[I 2026-03-18 16:42:46,449] Trial 14 pruned. 
[I 2026-03-18 16:42:47,416] Trial 17 pruned. 
[I 2026-03-18 16:42:50,834] Trial 19 pruned. 
[I 2026-03-18 16:42:53,155] Trial 9 finished with value: -2.8012427265522657 and parameters: {'n_layers_yyx': 2, 'hidden_size_yyx_l0': 3, 'hidden_size_yyx_l1': 4, 'context_size_yyx': 4, 'num_mix_components_yyx': 5, 'context_extractor_yyx': 'lstm', 'activation_func_yyx': 'ReLU', 'L2_weight_yyx': 0.000379017922903716, 'L_entropy_weight_yyx': 0.0003490889274008485, 'L_sep_weight_yyx': 8.880294731122825e-10, 'L_scale_weight_yyx': 1.3823758839330571e-08, 'learning_rate_yyx': 0.0011032459370365517}. Best is trial 5 with value: -2.805070761203844.
[I 2026-03-18 16:42:53,649] Trial 18 pruned. 
[I 2026-03-18 16:43:00,256] Trial 19 pruned. 
[I 2026-03-18 16:43:09,782] Trial 20 pruned. 
[I 2026-03-18 16:43:12,448] Trial 7 pruned. 
[I 2026-03-18 16:43:15,536] Trial 6 finished with value: -2.805382927239302 and parameters: {'n_layers_yyx': 1, 'hidden_size_yyx_l0': 5, 'context_size_yyx': 3, 'num_mix_components_yyx': 5, 'context_extractor_yyx': 'gru', 'activation_func_yyx': 'GELU', 'L2_weight_yyx': 1.3504791005059508e-08, 'L_entropy_weight_yyx': 6.019619970957316e-09, 'L_sep_weight_yyx': 3.8042751461367266e-05, 'L_scale_weight_yyx': 7.144259604809999e-06, 'learning_rate_yyx': 0.008007559910501736}. Best is trial 6 with value: -2.805382927239302.
[I 2026-03-18 16:43:19,997] Trial 20 pruned. 
[I 2026-03-18 16:43:20,378] Trial 10 finished with value: -2.7964817927433896 and parameters: {'n_layers_yyx': 1, 'hidden_size_yyx_l0': 6, 'context_size_yyx': 4, 'num_mix_components_yyx': 3, 'context_extractor_yyx': 'lstm', 'activation_func_yyx': 'GELU', 'L2_weight_yyx': 9.873920122272621e-06, 'L_entropy_weight_yyx': 0.0004843487777104329, 'L_sep_weight_yyx': 3.609184211491655e-09, 'L_scale_weight_yyx': 4.0403377610469466e-10, 'learning_rate_yyx': 0.009742228446750855}. Best is trial 10 with value: -2.7964817927433896.
[I 2026-03-18 16:43:23,191] Trial 21 finished with value: -2.7963082234130257 and parameters: {'n_layers_yyx': 1, 'hidden_size_yyx_l0': 5, 'context_size_yyx': 4, 'num_mix_components_yyx': 4, 'context_extractor_yyx': 'lstm', 'activation_func_yyx': 'Tanh', 'L2_weight_yyx': 3.5272110766383586e-07, 'L_entropy_weight_yyx': 9.737025577740677e-05, 'L_sep_weight_yyx': 5.425492064109367e-08, 'L_scale_weight_yyx': 0.0004801594195460993, 'learning_rate_yyx': 0.008989508067852254}. Best is trial 21 with value: -2.7963082234130257.
[I 2026-03-18 16:43:29,033] Trial 21 pruned. 
[I 2026-03-18 16:43:30,431] Trial 20 pruned. 
[I 2026-03-18 16:43:34,166] Trial 19 finished with value: -2.79497425077473 and parameters: {'n_layers_yyx': 2, 'hidden_size_yyx_l0': 2, 'hidden_size_yyx_l1': 3, 'context_size_yyx': 3, 'num_mix_components_yyx': 4, 'context_extractor_yyx': 'gru', 'activation_func_yyx': 'Tanh', 'L2_weight_yyx': 0.00019988876636695515, 'L_entropy_weight_yyx': 7.187555104892838e-08, 'L_sep_weight_yyx': 8.889961516877628e-07, 'L_scale_weight_yyx': 1.0999254854314973e-06, 'learning_rate_yyx': 0.004589819367391451}. Best is trial 0 with value: -2.8067502106217272.
[I 2026-03-18 16:43:37,731] Trial 22 pruned. 
[I 2026-03-18 16:43:39,220] Trial 10 finished with value: -2.801164416813831 and parameters: {'n_layers_yyx': 2, 'hidden_size_yyx_l0': 6, 'hidden_size_yyx_l1': 6, 'context_size_yyx': 4, 'num_mix_components_yyx': 4, 'context_extractor_yyx': 'lstm', 'activation_func_yyx': 'Tanh', 'L2_weight_yyx': 1.5415944027678143e-05, 'L_entropy_weight_yyx': 2.3685170077664403e-08, 'L_sep_weight_yyx': 0.0007848287449336877, 'L_scale_weight_yyx': 3.072679350144776e-10, 'learning_rate_yyx': 0.002242168971962644}. Best is trial 10 with value: -2.801164416813831.
[I 2026-03-18 16:43:40,116] Trial 20 pruned. 
[I 2026-03-18 16:43:47,497] Trial 23 pruned. 
[I 2026-03-18 16:43:57,465] Trial 24 pruned. 
[I 2026-03-18 16:44:00,896] Trial 9 finished with value: -2.8084722793451675 and parameters: {'n_layers_yyx': 2, 'hidden_size_yyx_l0': 3, 'hidden_size_yyx_l1': 6, 'context_size_yyx': 4, 'num_mix_components_yyx': 4, 'context_extractor_yyx': 'lstm', 'activation_func_yyx': 'GELU', 'L2_weight_yyx': 1.700191722988903e-08, 'L_entropy_weight_yyx': 2.4028218412497636e-08, 'L_sep_weight_yyx': 1.0721102745544063e-09, 'L_scale_weight_yyx': 4.89851216606011e-10, 'learning_rate_yyx': 0.0029261548002064326}. Best is trial 9 with value: -2.8084722793451675.
[I 2026-03-18 16:44:01,315] Trial 22 pruned. 
[I 2026-03-18 16:44:07,161] Trial 23 pruned. 
[I 2026-03-18 16:44:07,949] Trial 10 finished with value: -2.798106716837492 and parameters: {'n_layers_yyx': 1, 'hidden_size_yyx_l0': 6, 'context_size_yyx': 3, 'num_mix_components_yyx': 3, 'context_extractor_yyx': 'gru', 'activation_func_yyx': 'Tanh', 'L2_weight_yyx': 7.214583048875591e-08, 'L_entropy_weight_yyx': 7.902083765941482e-10, 'L_sep_weight_yyx': 4.8117576733103705e-08, 'L_scale_weight_yyx': 1.0446514778247411e-10, 'learning_rate_yyx': 0.00939121739524505}. Best is trial 5 with value: -2.805070761203844.
[I 2026-03-18 16:44:13,656] Trial 11 pruned. 
[I 2026-03-18 16:44:18,555] Trial 21 pruned. 
[I 2026-03-18 16:44:19,326] Trial 25 pruned. 
[I 2026-03-18 16:44:20,430] Trial 7 finished with value: -2.8073737460176833 and parameters: {'n_layers_yyx': 1, 'hidden_size_yyx_l0': 3, 'context_size_yyx': 2, 'num_mix_components_yyx': 5, 'context_extractor_yyx': 'lstm', 'activation_func_yyx': 'ReLU', 'L2_weight_yyx': 2.156272970059869e-08, 'L_entropy_weight_yyx': 7.646981038291994e-08, 'L_sep_weight_yyx': 3.714534489173377e-05, 'L_scale_weight_yyx': 9.292425163754986e-05, 'learning_rate_yyx': 0.00872396863390485}. Best is trial 7 with value: -2.8073737460176833.
[I 2026-03-18 16:44:24,516] Trial 22 pruned. 
[I 2026-03-18 16:44:24,760] Trial 11 finished with value: -2.794205015470874 and parameters: {'n_layers_yyx': 1, 'hidden_size_yyx_l0': 6, 'context_size_yyx': 4, 'num_mix_components_yyx': 3, 'context_extractor_yyx': 'lstm', 'activation_func_yyx': 'GELU', 'L2_weight_yyx': 4.153451065973505e-06, 'L_entropy_weight_yyx': 0.0006533978180324886, 'L_sep_weight_yyx': 6.305805442491031e-09, 'L_scale_weight_yyx': 2.1610965948936533e-10, 'learning_rate_yyx': 0.009560386419160266}. Best is trial 10 with value: -2.7964817927433896.
[I 2026-03-18 16:44:26,359] Trial 8 pruned. 
[I 2026-03-18 16:44:27,571] Trial 14 finished with value: -2.8039510630484474 and parameters: {'n_layers_yyx': 1, 'hidden_size_yyx_l0': 5, 'context_size_yyx': 4, 'num_mix_components_yyx': 3, 'context_extractor_yyx': 'gru', 'activation_func_yyx': 'ReLU', 'L2_weight_yyx': 5.8765049335333525e-06, 'L_entropy_weight_yyx': 3.6038712658529496e-05, 'L_sep_weight_yyx': 7.5203931150712615e-06, 'L_scale_weight_yyx': 2.030732006762967e-06, 'learning_rate_yyx': 0.0060173855657554235}. Best is trial 5 with value: -2.8058216093098.
[I 2026-03-18 16:44:28,188] Trial 12 pruned. 
[I 2026-03-18 16:44:32,008] Trial 9 pruned. 
[I 2026-03-18 16:44:33,612] Trial 21 finished with value: -2.8006804935515874 and parameters: {'n_layers_yyx': 1, 'hidden_size_yyx_l0': 6, 'context_size_yyx': 3, 'num_mix_components_yyx': 4, 'context_extractor_yyx': 'lstm', 'activation_func_yyx': 'ReLU', 'L2_weight_yyx': 4.1711292255331434e-10, 'L_entropy_weight_yyx': 4.1127554696364065e-10, 'L_sep_weight_yyx': 0.0006184659209907377, 'L_scale_weight_yyx': 1.2870088330279989e-08, 'learning_rate_yyx': 0.008392574270881312}. Best is trial 1 with value: -2.804181999864486.
[I 2026-03-18 16:44:33,913] Trial 10 finished with value: -2.776277612190527 and parameters: {'n_layers_yyx': 1, 'hidden_size_yyx_l0': 4, 'context_size_yyx': 4, 'num_mix_components_yyx': 1, 'context_extractor_yyx': 'gru', 'activation_func_yyx': 'ReLU', 'L2_weight_yyx': 2.884253822005112e-07, 'L_entropy_weight_yyx': 5.395015910065596e-08, 'L_sep_weight_yyx': 6.342470443491098e-08, 'L_scale_weight_yyx': 5.301977603889688e-09, 'learning_rate_yyx': 0.0009647889345444675}. Best is trial 0 with value: -2.782248579189629.
[I 2026-03-18 16:44:34,021] Trial 13 pruned. 
[I 2026-03-18 16:44:39,787] Trial 11 pruned. 
[I 2026-03-18 16:44:40,774] Trial 15 finished with value: -2.801416820220272 and parameters: {'n_layers_yyx': 2, 'hidden_size_yyx_l0': 5, 'hidden_size_yyx_l1': 5, 'context_size_yyx': 4, 'num_mix_components_yyx': 4, 'context_extractor_yyx': 'gru', 'activation_func_yyx': 'ReLU', 'L2_weight_yyx': 0.0008599259173693772, 'L_entropy_weight_yyx': 8.696402518556755e-07, 'L_sep_weight_yyx': 1.424519938164281e-06, 'L_scale_weight_yyx': 5.414316679051094e-06, 'learning_rate_yyx': 0.002062390122866175}. Best is trial 5 with value: -2.803729491226789.
[I 2026-03-18 16:44:45,315] Trial 10 finished with value: -2.789951646214514 and parameters: {'n_layers_yyx': 2, 'hidden_size_yyx_l0': 2, 'hidden_size_yyx_l1': 4, 'context_size_yyx': 3, 'num_mix_components_yyx': 5, 'context_extractor_yyx': 'lstm', 'activation_func_yyx': 'Tanh', 'L2_weight_yyx': 1.0086833356089826e-10, 'L_entropy_weight_yyx': 1.9102990437418963e-10, 'L_sep_weight_yyx': 2.353592417436168e-05, 'L_scale_weight_yyx': 0.0004940216225310058, 'learning_rate_yyx': 0.000776411440640838}. Best is trial 5 with value: -2.8051328142627483.
[I 2026-03-18 16:44:45,776] Trial 10 pruned. 
[I 2026-03-18 16:44:45,809] Trial 12 pruned. 
[I 2026-03-18 16:44:48,414] Trial 8 finished with value: -2.7912823347657536 and parameters: {'n_layers_yyx': 2, 'hidden_size_yyx_l0': 3, 'hidden_size_yyx_l1': 6, 'context_size_yyx': 4, 'num_mix_components_yyx': 3, 'context_extractor_yyx': 'gru', 'activation_func_yyx': 'ReLU', 'L2_weight_yyx': 7.293697114980961e-05, 'L_entropy_weight_yyx': 1.6933152881579705e-07, 'L_sep_weight_yyx': 2.214295292852741e-05, 'L_scale_weight_yyx': 1.579283202990566e-10, 'learning_rate_yyx': 0.007065956500818118}. Best is trial 1 with value: -2.794794619613311.
[I 2026-03-18 16:44:48,921] Trial 14 pruned. 
[I 2026-03-18 16:44:54,736] Trial 9 pruned. 
[I 2026-03-18 16:44:56,596] Trial 15 finished with value: -2.780911484127889 and parameters: {'n_layers_yyx': 2, 'hidden_size_yyx_l0': 5, 'hidden_size_yyx_l1': 4, 'context_size_yyx': 3, 'num_mix_components_yyx': 5, 'context_extractor_yyx': 'lstm', 'activation_func_yyx': 'Tanh', 'L2_weight_yyx': 2.0446791092450546e-09, 'L_entropy_weight_yyx': 1.0231938572805664e-08, 'L_sep_weight_yyx': 1.279594208551184e-10, 'L_scale_weight_yyx': 1.2036952998066632e-07, 'learning_rate_yyx': 0.002436091738424352}. Best is trial 15 with value: -2.780911484127889.
[I 2026-03-18 16:44:59,201] Trial 11 pruned. 
[I 2026-03-18 16:44:59,474] Trial 11 pruned. 
[I 2026-03-18 16:45:02,953] Trial 23 pruned. 
[I 2026-03-18 16:45:03,162] Trial 15 pruned. 
[I 2026-03-18 16:45:08,448] Trial 11 finished with value: -2.8017587322763102 and parameters: {'n_layers_yyx': 2, 'hidden_size_yyx_l0': 6, 'hidden_size_yyx_l1': 6, 'context_size_yyx': 4, 'num_mix_components_yyx': 4, 'context_extractor_yyx': 'lstm', 'activation_func_yyx': 'Tanh', 'L2_weight_yyx': 2.268467557716358e-05, 'L_entropy_weight_yyx': 1.6389676251623114e-08, 'L_sep_weight_yyx': 0.0008733723223031105, 'L_scale_weight_yyx': 2.405033732120061e-10, 'learning_rate_yyx': 0.0018005108801495613}. Best is trial 11 with value: -2.8017587322763102.
[I 2026-03-18 16:45:09,241] Trial 16 pruned. 
[I 2026-03-18 16:45:09,792] Trial 16 pruned. 
[I 2026-03-18 16:45:12,077] Trial 22 pruned. 
[I 2026-03-18 16:45:16,852] Trial 24 pruned. 
[I 2026-03-18 16:45:17,003] Trial 26 pruned. 
[I 2026-03-18 16:45:20,028] Trial 16 pruned. 
[I 2026-03-18 16:45:22,505] Trial 17 pruned. 
[I 2026-03-18 16:45:23,070] Trial 25 pruned. 
[I 2026-03-18 16:45:23,982] Trial 21 finished with value: -2.806654048539519 and parameters: {'n_layers_yyx': 1, 'hidden_size_yyx_l0': 6, 'context_size_yyx': 4, 'num_mix_components_yyx': 2, 'context_extractor_yyx': 'gru', 'activation_func_yyx': 'ReLU', 'L2_weight_yyx': 1.4280026107317155e-10, 'L_entropy_weight_yyx': 3.0490054809663963e-06, 'L_sep_weight_yyx': 8.315124431899814e-09, 'L_scale_weight_yyx': 5.991667447912286e-10, 'learning_rate_yyx': 0.005275093325096213}. Best is trial 13 with value: -2.8082553050147787.
[I 2026-03-18 16:45:27,546] Trial 27 pruned. 
[I 2026-03-18 16:45:27,844] Trial 18 pruned. 
[I 2026-03-18 16:45:29,677] Trial 12 finished with value: -2.7942098926169803 and parameters: {'n_layers_yyx': 1, 'hidden_size_yyx_l0': 6, 'context_size_yyx': 4, 'num_mix_components_yyx': 3, 'context_extractor_yyx': 'lstm', 'activation_func_yyx': 'GELU', 'L2_weight_yyx': 1.1472642836576187e-05, 'L_entropy_weight_yyx': 0.0009836692471834566, 'L_sep_weight_yyx': 7.449228263422485e-09, 'L_scale_weight_yyx': 1.2217290977160756e-10, 'learning_rate_yyx': 0.009835414068233777}. Best is trial 10 with value: -2.7964817927433896.
[I 2026-03-18 16:45:32,856] Trial 10 pruned. 
