[I 2026-03-18 22:47:21,175] Trial 80 finished with value: -1.8538439163133988 and parameters: {'n_layers_yyx': 1, 'hidden_size_yyx_l0': 5, 'context_size_yyx': 4, 'num_mix_components_yyx': 4, 'context_extractor_yyx': 'gru', 'activation_func_yyx': 'Tanh', 'L2_weight_yyx': 4.070277358539945e-06, 'L_entropy_weight_yyx': 0.00010582330006082674, 'L_sep_weight_yyx': 8.721360055361077e-05, 'L_scale_weight_yyx': 3.6328391277116185e-05, 'learning_rate_yyx': 0.009421738584844602}. Best is trial 53 with value: -1.855205638988598.
[I 2026-03-18 22:47:23,465] Trial 56 pruned. 
[I 2026-03-18 22:47:38,474] Trial 57 pruned. 
[I 2026-03-18 22:47:41,057] Trial 58 pruned. 
[I 2026-03-18 22:47:48,004] Trial 81 finished with value: -1.853797008490612 and parameters: {'n_layers_yyx': 1, 'hidden_size_yyx_l0': 5, 'context_size_yyx': 4, 'num_mix_components_yyx': 4, 'context_extractor_yyx': 'gru', 'activation_func_yyx': 'Tanh', 'L2_weight_yyx': 3.6105053078539857e-06, 'L_entropy_weight_yyx': 0.0006034319102282592, 'L_sep_weight_yyx': 0.00010017151850321188, 'L_scale_weight_yyx': 5.569570371744181e-05, 'learning_rate_yyx': 0.00936784700378064}. Best is trial 53 with value: -1.855205638988598.
[I 2026-03-18 22:47:55,710] Trial 81 finished with value: -1.849353688328434 and parameters: {'n_layers_yyx': 2, 'hidden_size_yyx_l0': 6, 'hidden_size_yyx_l1': 3, 'context_size_yyx': 1, 'num_mix_components_yyx': 4, 'context_extractor_yyx': 'lstm', 'activation_func_yyx': 'ReLU', 'L2_weight_yyx': 3.129525100856408e-10, 'L_entropy_weight_yyx': 2.8446599959444173e-08, 'L_sep_weight_yyx': 1.0875104333465438e-09, 'L_scale_weight_yyx': 0.0002977366904724558, 'learning_rate_yyx': 0.004957530564052319}. Best is trial 0 with value: -1.8516305051550026.
[I 2026-03-18 22:47:58,237] Trial 82 pruned. 
[I 2026-03-18 22:48:03,954] Trial 83 pruned. 
[I 2026-03-18 22:48:06,454] Trial 84 pruned. 
[I 2026-03-18 22:48:12,240] Trial 85 pruned. 

Source events: 14713
Target events: 31112
Full model ln_yyx : 1609.93058 nats/sec, 46.57166 nats/event
Full model Log loss : -1.84919
Full model ln_yyx : 1603.02155 nats/sec, 46.37180 nats/event
Full model Log loss : -1.84823
Full model ln_yyx : 1604.97122 nats/sec, 46.42820 nats/event
Full model Log loss : -1.84795
Full model ln_yyx : 1605.15374 nats/sec, 46.43348 nats/event
Full model Log loss : -1.84818
Full model ln_yyx : 1608.23886 nats/sec, 46.52272 nats/event
Full model Log loss : -1.84396
Full model ln_yyx : 1613.92866 nats/sec, 46.68732 nats/event
Full model Log loss : -1.84754
Full model ln_yyx : 1601.88667 nats/sec, 46.33897 nats/event
Full model Log loss : -1.84876
Full model ln_yyx : 1611.81619 nats/sec, 46.62621 nats/event
Full model Log loss : -1.84912
Full model ln_yyx : 1610.57023 nats/sec, 46.59016 nats/event
Full model Log loss : -1.84884
Full model ln_yyx : 1600.83915 nats/sec, 46.30867 nats/event
Full model Log loss : -1.84964
Full model ln_yyx : 1599.72492 nats/sec, 46.27643 nats/event
Full model Log loss : -1.84844
Full model ln_yyx : 1600.09677 nats/sec, 46.28719 nats/event
Full model Log loss : -1.84850
Full model ln_yyx : 1599.85702 nats/sec, 46.28026 nats/event
Full model Log loss : -1.84848
Full model ln_yyx : 1605.39425 nats/sec, 46.44044 nats/event
Full model Log loss : -1.84949
Full model ln_yyx : 1610.49101 nats/sec, 46.58787 nats/event
Full model Log loss : -1.84893
Full model ln_yyx : 1613.52458 nats/sec, 46.67563 nats/event
Full model Log loss : -1.84935
Optimization finished. Config saved to results/opt-full/opt_full_228_best_config.txt
[I 2026-03-18 22:48:15,042] Trial 82 finished with value: -1.8538039241164241 and parameters: {'n_layers_yyx': 1, 'hidden_size_yyx_l0': 5, 'context_size_yyx': 4, 'num_mix_components_yyx': 4, 'context_extractor_yyx': 'gru', 'activation_func_yyx': 'Tanh', 'L2_weight_yyx': 3.8590206065236834e-06, 'L_entropy_weight_yyx': 0.00015461959778158876, 'L_sep_weight_yyx': 0.00010416111162781854, 'L_scale_weight_yyx': 2.7041571904254976e-05, 'learning_rate_yyx': 0.009331076942521931}. Best is trial 53 with value: -1.855205638988598.
[I 2026-03-18 22:48:41,821] Trial 83 finished with value: -1.8538419494840392 and parameters: {'n_layers_yyx': 1, 'hidden_size_yyx_l0': 5, 'context_size_yyx': 4, 'num_mix_components_yyx': 4, 'context_extractor_yyx': 'gru', 'activation_func_yyx': 'Tanh', 'L2_weight_yyx': 2.906466824341759e-06, 'L_entropy_weight_yyx': 0.0001611261346779126, 'L_sep_weight_yyx': 8.995070639927603e-05, 'L_scale_weight_yyx': 2.943110143636658e-05, 'learning_rate_yyx': 0.009416308463555793}. Best is trial 53 with value: -1.855205638988598.
[I 2026-03-18 22:48:46,039] Trial 59 finished with value: -1.853504077808277 and parameters: {'n_layers_yyx': 1, 'hidden_size_yyx_l0': 3, 'context_size_yyx': 4, 'num_mix_components_yyx': 3, 'context_extractor_yyx': 'lstm', 'activation_func_yyx': 'ReLU', 'L2_weight_yyx': 2.135046226891737e-10, 'L_entropy_weight_yyx': 0.0002019919035103746, 'L_sep_weight_yyx': 2.1297564612576579e-10, 'L_scale_weight_yyx': 2.5934430017210953e-06, 'learning_rate_yyx': 0.0007436663974657179}. Best is trial 40 with value: -1.861402018567546.
[I 2026-03-18 22:48:48,385] Trial 60 pruned. 
[I 2026-03-18 22:49:08,353] Trial 84 finished with value: -1.8538208219299528 and parameters: {'n_layers_yyx': 1, 'hidden_size_yyx_l0': 5, 'context_size_yyx': 4, 'num_mix_components_yyx': 4, 'context_extractor_yyx': 'gru', 'activation_func_yyx': 'Tanh', 'L2_weight_yyx': 3.7047432989783794e-06, 'L_entropy_weight_yyx': 0.00011633894441567243, 'L_sep_weight_yyx': 0.00016062107983793683, 'L_scale_weight_yyx': 2.7143918794228295e-05, 'learning_rate_yyx': 0.009366495067527474}. Best is trial 53 with value: -1.855205638988598.

Source events: 14713
Target events: 54211
Full model ln_yyx : 2796.20228 nats/sec, 46.42198 nats/event
Full model Log loss : -1.83580
Full model ln_yyx : 2780.63861 nats/sec, 46.16360 nats/event
Full model Log loss : -1.83752
Full model ln_yyx : 2816.93219 nats/sec, 46.76614 nats/event
Full model Log loss : -1.85055
Full model ln_yyx : 2814.24473 nats/sec, 46.72152 nats/event
Full model Log loss : -1.85521
Full model ln_yyx : 2801.67874 nats/sec, 46.51290 nats/event
Full model Log loss : -1.84754
Full model ln_yyx : 2779.71752 nats/sec, 46.14831 nats/event
Full model Log loss : -1.83626
Full model ln_yyx : 2799.92688 nats/sec, 46.48382 nats/event
Full model Log loss : -1.85089
Full model ln_yyx : 2808.87805 nats/sec, 46.63242 nats/event
Full model Log loss : -1.85343
Full model ln_yyx : 2807.19608 nats/sec, 46.60450 nats/event
Full model Log loss : -1.85332
Full model ln_yyx : 2802.48314 nats/sec, 46.52626 nats/event
Full model Log loss : -1.85330
Full model ln_yyx : 2795.64646 nats/sec, 46.41275 nats/event
Full model Log loss : -1.85373
Full model ln_yyx : 2817.57933 nats/sec, 46.77688 nats/event
Full model Log loss : -1.85318
Full model ln_yyx : 2795.46547 nats/sec, 46.40975 nats/event
Full model Log loss : -1.85376
Full model ln_yyx : 2795.50767 nats/sec, 46.41045 nats/event
Full model Log loss : -1.85377
Full model ln_yyx : 2795.97250 nats/sec, 46.41817 nats/event
Full model Log loss : -1.85363
Full model ln_yyx : 2794.67756 nats/sec, 46.39667 nats/event
Full model Log loss : -1.85388
Full model ln_yyx : 2794.97196 nats/sec, 46.40156 nats/event
Full model Log loss : -1.85384
Full model ln_yyx : 2795.43943 nats/sec, 46.40932 nats/event
Full model Log loss : -1.85380
Full model ln_yyx : 2795.24427 nats/sec, 46.40608 nats/event
Full model Log loss : -1.85380
Full model ln_yyx : 2795.02042 nats/sec, 46.40236 nats/event
Full model Log loss : -1.85384
Full model ln_yyx : 2795.04020 nats/sec, 46.40269 nats/event
Full model Log loss : -1.85382
Optimization finished. Config saved to results/opt-full/opt_full_232_best_config.txt
[I 2026-03-18 22:49:32,149] Trial 61 pruned. 
[I 2026-03-18 22:49:34,680] Trial 62 pruned. 
[I 2026-03-18 22:50:25,658] Trial 63 finished with value: -1.8568231975214398 and parameters: {'n_layers_yyx': 1, 'hidden_size_yyx_l0': 4, 'context_size_yyx': 4, 'num_mix_components_yyx': 4, 'context_extractor_yyx': 'gru', 'activation_func_yyx': 'Tanh', 'L2_weight_yyx': 1.0468654582462358e-10, 'L_entropy_weight_yyx': 9.774693657848233e-05, 'L_sep_weight_yyx': 1.0810756357583606e-10, 'L_scale_weight_yyx': 1.4378098007676553e-07, 'learning_rate_yyx': 0.006535696708496645}. Best is trial 40 with value: -1.861402018567546.
[I 2026-03-18 22:50:31,541] Trial 64 pruned. 
[I 2026-03-18 22:50:34,111] Trial 65 pruned. 
[I 2026-03-18 22:51:11,565] Trial 66 finished with value: -1.8564577902346457 and parameters: {'n_layers_yyx': 1, 'hidden_size_yyx_l0': 4, 'context_size_yyx': 4, 'num_mix_components_yyx': 4, 'context_extractor_yyx': 'gru', 'activation_func_yyx': 'Tanh', 'L2_weight_yyx': 1.107723454697171e-10, 'L_entropy_weight_yyx': 1.81692544157471e-07, 'L_sep_weight_yyx': 2.3527092565678527e-10, 'L_scale_weight_yyx': 1.3913220682383857e-08, 'learning_rate_yyx': 0.008985318411353705}. Best is trial 40 with value: -1.861402018567546.
[I 2026-03-18 22:51:17,415] Trial 67 pruned. 
[I 2026-03-18 22:51:19,876] Trial 68 pruned. 
[I 2026-03-18 22:51:22,405] Trial 69 pruned. 

Source events: 14713
Target events: 24874
Full model ln_yyx : 1287.55634 nats/sec, 46.58683 nats/event
Full model Log loss : -1.85432
Full model ln_yyx : 1304.39281 nats/sec, 47.19601 nats/event
Full model Log loss : -1.85120
Full model ln_yyx : 1292.38863 nats/sec, 46.76167 nats/event
Full model Log loss : -1.85173
Full model ln_yyx : 1293.72218 nats/sec, 46.80992 nats/event
Full model Log loss : -1.85703
Full model ln_yyx : 1286.19239 nats/sec, 46.53748 nats/event
Full model Log loss : -1.85104
Full model ln_yyx : 1280.49851 nats/sec, 46.33146 nats/event
Full model Log loss : -1.85097
Full model ln_yyx : 1289.75678 nats/sec, 46.66644 nats/event
Full model Log loss : -1.85485
Full model ln_yyx : 1289.14235 nats/sec, 46.64421 nats/event
Full model Log loss : -1.85670
Full model ln_yyx : 1282.31171 nats/sec, 46.39706 nats/event
Full model Log loss : -1.86140
Full model ln_yyx : 1299.17374 nats/sec, 47.00717 nats/event
Full model Log loss : -1.85885
Full model ln_yyx : 1285.15003 nats/sec, 46.49976 nats/event
Full model Log loss : -1.85923
Full model ln_yyx : 1297.79935 nats/sec, 46.95744 nats/event
Full model Log loss : -1.85528
Full model ln_yyx : 1291.40330 nats/sec, 46.72602 nats/event
Full model Log loss : -1.85550
Full model ln_yyx : 1287.65043 nats/sec, 46.59023 nats/event
Full model Log loss : -1.85667
Full model ln_yyx : 1277.98162 nats/sec, 46.24039 nats/event
Full model Log loss : -1.85350
Full model ln_yyx : 1289.66860 nats/sec, 46.66325 nats/event
Full model Log loss : -1.85682
Full model ln_yyx : 1290.78992 nats/sec, 46.70382 nats/event
Full model Log loss : -1.85646
Optimization finished. Config saved to results/opt-full/opt_full_236_best_config.txt
