[I 2026-03-18 20:11:05,009] Trial 27 finished with value: -2.5137655552455356 and parameters: {'n_layers_yyx': 1, 'hidden_size_yyx_l0': 5, 'context_size_yyx': 4, 'num_mix_components_yyx': 3, 'context_extractor_yyx': 'gru', 'activation_func_yyx': 'ReLU', 'L2_weight_yyx': 2.4231083318497455e-08, 'L_entropy_weight_yyx': 3.288605888512338e-08, 'L_sep_weight_yyx': 0.0002940171852366251, 'L_scale_weight_yyx': 3.5375919819723056e-09, 'learning_rate_yyx': 0.008517112738820214}. Best is trial 5 with value: -2.5140323195684524.
[I 2026-03-18 20:11:07,465] Trial 21 pruned. 
[I 2026-03-18 20:11:09,841] Trial 44 pruned. 
[I 2026-03-18 20:11:12,873] Trial 19 pruned. 
[I 2026-03-18 20:11:13,010] Trial 32 pruned. 
[I 2026-03-18 20:11:16,618] Trial 32 finished with value: -2.513388777722962 and parameters: {'n_layers_yyx': 1, 'hidden_size_yyx_l0': 6, 'context_size_yyx': 4, 'num_mix_components_yyx': 2, 'context_extractor_yyx': 'gru', 'activation_func_yyx': 'GELU', 'L2_weight_yyx': 1.58601794617511e-05, 'L_entropy_weight_yyx': 5.669314604392178e-06, 'L_sep_weight_yyx': 1.344735346544868e-09, 'L_scale_weight_yyx': 9.695843165867538e-09, 'learning_rate_yyx': 0.008011061728711027}. Best is trial 23 with value: -2.513824905841335.
[I 2026-03-18 20:11:17,422] Trial 33 pruned. 
[I 2026-03-18 20:11:17,569] Trial 33 finished with value: -2.512931905705113 and parameters: {'n_layers_yyx': 1, 'hidden_size_yyx_l0': 5, 'context_size_yyx': 4, 'num_mix_components_yyx': 3, 'context_extractor_yyx': 'lstm', 'activation_func_yyx': 'GELU', 'L2_weight_yyx': 3.5901680093905665e-05, 'L_entropy_weight_yyx': 6.005506703382573e-07, 'L_sep_weight_yyx': 2.4634921987955785e-05, 'L_scale_weight_yyx': 6.406645267765982e-09, 'learning_rate_yyx': 0.0027105854296562565}. Best is trial 33 with value: -2.512931905705113.
[I 2026-03-18 20:11:19,262] Trial 45 pruned. 
[I 2026-03-18 20:11:23,847] Trial 20 pruned. 
[I 2026-03-18 20:11:25,094] Trial 46 pruned. 
[I 2026-03-18 20:11:32,449] Trial 28 pruned. 
[I 2026-03-18 20:11:34,585] Trial 46 finished with value: -1.984403099075014 and parameters: {'n_layers_yyx': 2, 'hidden_size_yyx_l0': 4, 'hidden_size_yyx_l1': 6, 'context_size_yyx': 4, 'num_mix_components_yyx': 4, 'context_extractor_yyx': 'lstm', 'activation_func_yyx': 'Tanh', 'L2_weight_yyx': 1.2929864796167392e-05, 'L_entropy_weight_yyx': 8.208497928816919e-07, 'L_sep_weight_yyx': 1.0098070054376188e-10, 'L_scale_weight_yyx': 3.3906423947185215e-08, 'learning_rate_yyx': 0.006320105046511785}. Best is trial 46 with value: -1.984403099075014.
[I 2026-03-18 20:11:42,184] Trial 33 pruned. 
[I 2026-03-18 20:11:42,412] Trial 48 finished with value: -1.9915798634022206 and parameters: {'n_layers_yyx': 1, 'hidden_size_yyx_l0': 2, 'context_size_yyx': 3, 'num_mix_components_yyx': 4, 'context_extractor_yyx': 'lstm', 'activation_func_yyx': 'Tanh', 'L2_weight_yyx': 3.200615593200007e-10, 'L_entropy_weight_yyx': 1.2053188915802044e-08, 'L_sep_weight_yyx': 4.337017272933946e-09, 'L_scale_weight_yyx': 0.0007118295958777307, 'learning_rate_yyx': 0.00786490430618334}. Best is trial 15 with value: -1.9940496908651817.
[I 2026-03-18 20:11:49,435] Trial 29 pruned. 
[I 2026-03-18 20:11:54,558] Trial 38 pruned. 
[I 2026-03-18 20:11:59,992] Trial 39 finished with value: -1.9826420186047327 and parameters: {'n_layers_yyx': 2, 'hidden_size_yyx_l0': 5, 'hidden_size_yyx_l1': 5, 'context_size_yyx': 4, 'num_mix_components_yyx': 3, 'context_extractor_yyx': 'gru', 'activation_func_yyx': 'GELU', 'L2_weight_yyx': 4.985771273840174e-06, 'L_entropy_weight_yyx': 5.845607113270158e-07, 'L_sep_weight_yyx': 5.815501168015089e-07, 'L_scale_weight_yyx': 1.6165663031019524e-05, 'learning_rate_yyx': 0.008420591346242342}. Best is trial 12 with value: -1.983840502266522.
[I 2026-03-18 20:12:04,307] Trial 49 pruned. 

Source events: 18269
Target events: 20315
Full model ln_yyx : 1342.37150 nats/sec, 59.47006 nats/event
Full model Log loss : -1.96904
Full model ln_yyx : 1343.03739 nats/sec, 59.49956 nats/event
Full model Log loss : -1.95403
Full model ln_yyx : 1345.50569 nats/sec, 59.60892 nats/event
Full model Log loss : -1.99301
Full model ln_yyx : 1355.71810 nats/sec, 60.06135 nats/event
Full model Log loss : -1.99250
Full model ln_yyx : 1360.68185 nats/sec, 60.28125 nats/event
Full model Log loss : -1.99405
Full model ln_yyx : 1355.67099 nats/sec, 60.05926 nats/event
Full model Log loss : -1.99218
Full model ln_yyx : 1358.92036 nats/sec, 60.20322 nats/event
Full model Log loss : -1.99199
Full model ln_yyx : 1340.90582 nats/sec, 59.40513 nats/event
Full model Log loss : -1.97143
Full model ln_yyx : 1362.85893 nats/sec, 60.37770 nats/event
Full model Log loss : -1.99056
Full model ln_yyx : 1337.15607 nats/sec, 59.23901 nats/event
Full model Log loss : -1.96413
Full model ln_yyx : 1361.84651 nats/sec, 60.33285 nats/event
Full model Log loss : -1.99158
Optimization finished. Config saved to results/opt-full/opt_full_314_best_config.txt
[I 2026-03-18 20:12:07,649] Trial 32 pruned. 
[I 2026-03-18 20:12:08,283] Trial 45 pruned. 
[I 2026-03-18 20:12:23,366] Trial 39 pruned. 
[I 2026-03-18 20:12:38,514] Trial 33 pruned. 
[I 2026-03-18 20:12:39,257] Trial 34 pruned. 
[I 2026-03-18 20:12:40,834] Trial 46 pruned. 
[I 2026-03-18 20:12:41,486] Trial 45 finished with value: -2.111558116835142 and parameters: {'n_layers_yyx': 1, 'hidden_size_yyx_l0': 4, 'context_size_yyx': 3, 'num_mix_components_yyx': 4, 'context_extractor_yyx': 'lstm', 'activation_func_yyx': 'Tanh', 'L2_weight_yyx': 0.00039966200241795175, 'L_entropy_weight_yyx': 6.003425681631137e-09, 'L_sep_weight_yyx': 7.531650606922413e-09, 'L_scale_weight_yyx': 2.853357272232299e-06, 'learning_rate_yyx': 0.004972785002852516}. Best is trial 0 with value: -2.1143376288427875.
[I 2026-03-18 20:12:45,689] Trial 40 pruned. 
[I 2026-03-18 20:12:47,259] Trial 42 pruned. 
[I 2026-03-18 20:12:48,860] Trial 46 pruned. 
[I 2026-03-18 20:12:49,253] Trial 34 pruned. 
[I 2026-03-18 20:12:49,392] Trial 33 pruned. 
[I 2026-03-18 20:12:50,490] Trial 35 pruned. 
[I 2026-03-18 20:12:50,626] Trial 34 pruned. 
[I 2026-03-18 20:12:51,739] Trial 46 finished with value: -1.6770309895520483 and parameters: {'n_layers_yyx': 1, 'hidden_size_yyx_l0': 6, 'context_size_yyx': 4, 'num_mix_components_yyx': 4, 'context_extractor_yyx': 'lstm', 'activation_func_yyx': 'Tanh', 'L2_weight_yyx': 0.00019272911896289823, 'L_entropy_weight_yyx': 1.0351412254420825e-10, 'L_sep_weight_yyx': 1.8673497241519974e-07, 'L_scale_weight_yyx': 3.0253058708197924e-09, 'learning_rate_yyx': 0.008942363725780327}. Best is trial 42 with value: -1.6806136813660988.
[I 2026-03-18 20:13:00,312] Trial 40 pruned. 
[I 2026-03-18 20:13:01,996] Trial 47 pruned. 
[I 2026-03-18 20:13:05,925] Trial 35 pruned. 
[I 2026-03-18 20:13:09,091] Trial 47 pruned. 
[I 2026-03-18 20:13:13,490] Trial 47 pruned. 
[I 2026-03-18 20:13:20,199] Trial 35 pruned. 
[I 2026-03-18 20:13:23,941] Trial 39 finished with value: -1.6791899798868484 and parameters: {'n_layers_yyx': 2, 'hidden_size_yyx_l0': 4, 'hidden_size_yyx_l1': 5, 'context_size_yyx': 4, 'num_mix_components_yyx': 4, 'context_extractor_yyx': 'lstm', 'activation_func_yyx': 'Tanh', 'L2_weight_yyx': 2.180141469130384e-09, 'L_entropy_weight_yyx': 1.1163049268282163e-09, 'L_sep_weight_yyx': 2.0832242506459364e-10, 'L_scale_weight_yyx': 1.8875080027411213e-05, 'learning_rate_yyx': 0.004666233799585844}. Best is trial 32 with value: -1.6813953661792613.
[I 2026-03-18 20:13:27,499] Trial 36 pruned. 
[I 2026-03-18 20:13:27,730] Trial 48 pruned. 
[I 2026-03-18 20:13:28,716] Trial 36 pruned. 
[I 2026-03-18 20:13:28,763] Trial 48 pruned. 
[I 2026-03-18 20:13:33,746] Trial 34 finished with value: -2.48044679525611 and parameters: {'n_layers_yyx': 2, 'hidden_size_yyx_l0': 3, 'hidden_size_yyx_l1': 5, 'context_size_yyx': 2, 'num_mix_components_yyx': 4, 'context_extractor_yyx': 'gru', 'activation_func_yyx': 'GELU', 'L2_weight_yyx': 5.303585067875497e-10, 'L_entropy_weight_yyx': 1.1182701508846446e-09, 'L_sep_weight_yyx': 0.0009671989007548036, 'L_scale_weight_yyx': 0.0004463839021712612, 'learning_rate_yyx': 0.00982714334372991}. Best is trial 7 with value: -2.4950542279753494.
[I 2026-03-18 20:13:37,334] Trial 30 pruned. 
[I 2026-03-18 20:13:41,317] Trial 36 pruned. 
[I 2026-03-18 20:13:51,477] Trial 49 pruned. 

Source events: 27060
Target events: 1783
Full model ln_yyx : 205.39600 nats/sec, 103.67717 nats/event
Full model Log loss : -2.54480
Full model ln_yyx : 205.27136 nats/sec, 103.61426 nats/event
Full model Log loss : -2.54629
Full model ln_yyx : 206.88854 nats/sec, 104.43056 nats/event
Full model Log loss : -2.54676
Full model ln_yyx : 207.30416 nats/sec, 104.64035 nats/event
Full model Log loss : -2.54716
Full model ln_yyx : 205.56075 nats/sec, 103.76033 nats/event
Full model Log loss : -2.54708
Full model ln_yyx : 206.73260 nats/sec, 104.35185 nats/event
Full model Log loss : -2.54821
Full model ln_yyx : 205.88784 nats/sec, 103.92544 nats/event
Full model Log loss : -2.53445
Full model ln_yyx : 206.46702 nats/sec, 104.21779 nats/event
Full model Log loss : -2.54619
Full model ln_yyx : 207.20178 nats/sec, 104.58867 nats/event
Full model Log loss : -2.54730
Full model ln_yyx : 207.09793 nats/sec, 104.53625 nats/event
Full model Log loss : -2.54196
Full model ln_yyx : 206.83574 nats/sec, 104.40391 nats/event
Full model Log loss : -2.54719
Optimization finished. Config saved to results/opt-full/opt_full_289_best_config.txt
[I 2026-03-18 20:14:00,478] Trial 29 finished with value: -2.5130348596149745 and parameters: {'n_layers_yyx': 2, 'hidden_size_yyx_l0': 4, 'hidden_size_yyx_l1': 4, 'context_size_yyx': 3, 'num_mix_components_yyx': 5, 'context_extractor_yyx': 'gru', 'activation_func_yyx': 'ReLU', 'L2_weight_yyx': 3.493475625585765e-05, 'L_entropy_weight_yyx': 6.199342809389971e-07, 'L_sep_weight_yyx': 2.1350997389225362e-07, 'L_scale_weight_yyx': 6.49975895704792e-06, 'learning_rate_yyx': 0.00784247822515123}. Best is trial 22 with value: -2.5155989726836543.
[I 2026-03-18 20:14:03,660] Trial 40 pruned. 
[I 2026-03-18 20:14:15,701] Trial 47 pruned. 
[I 2026-03-18 20:14:16,187] Trial 29 pruned. 
[I 2026-03-18 20:14:18,501] Trial 37 pruned. 
[I 2026-03-18 20:14:22,672] Trial 40 finished with value: -2.50272050014762 and parameters: {'n_layers_yyx': 1, 'hidden_size_yyx_l0': 5, 'context_size_yyx': 4, 'num_mix_components_yyx': 3, 'context_extractor_yyx': 'lstm', 'activation_func_yyx': 'Tanh', 'L2_weight_yyx': 0.0006825058307468972, 'L_entropy_weight_yyx': 1.169071687056516e-06, 'L_sep_weight_yyx': 0.0005261621466073075, 'L_scale_weight_yyx': 3.6142197691010537e-06, 'learning_rate_yyx': 0.004204339253559697}. Best is trial 25 with value: -2.504659714809684.
[I 2026-03-18 20:14:24,371] Trial 43 pruned. 
[I 2026-03-18 20:14:24,512] Trial 30 pruned. 
[I 2026-03-18 20:14:24,695] Trial 41 pruned. 
[I 2026-03-18 20:14:24,949] Trial 37 pruned. 
[I 2026-03-18 20:14:26,564] Trial 34 finished with value: -2.511808087980826 and parameters: {'n_layers_yyx': 2, 'hidden_size_yyx_l0': 6, 'hidden_size_yyx_l1': 5, 'context_size_yyx': 4, 'num_mix_components_yyx': 3, 'context_extractor_yyx': 'lstm', 'activation_func_yyx': 'ReLU', 'L2_weight_yyx': 1.3690576345300228e-07, 'L_entropy_weight_yyx': 7.680230467639158e-09, 'L_sep_weight_yyx': 1.800156467039099e-05, 'L_scale_weight_yyx': 1.054913540846262e-10, 'learning_rate_yyx': 0.008719270413277793}. Best is trial 21 with value: -2.5132035092741223.
[I 2026-03-18 20:14:33,338] Trial 30 pruned. 
[I 2026-03-18 20:14:39,148] Trial 48 pruned. 
[I 2026-03-18 20:14:40,405] Trial 44 pruned. 
[I 2026-03-18 20:15:07,423] Trial 49 pruned. 

Source events: 18269
Target events: 1783
Full model ln_yyx : 122.22305 nats/sec, 61.69419 nats/event
Full model Log loss : -2.11434
Full model ln_yyx : 120.42636 nats/sec, 60.78728 nats/event
Full model Log loss : -2.08745
Full model ln_yyx : 121.73468 nats/sec, 61.44768 nats/event
Full model Log loss : -2.11383
Full model ln_yyx : 119.80889 nats/sec, 60.47560 nats/event
Full model Log loss : -2.08529
Full model ln_yyx : 121.98898 nats/sec, 61.57604 nats/event
Full model Log loss : -2.11249
Full model ln_yyx : 121.38633 nats/sec, 61.27184 nats/event
Full model Log loss : -2.11090
Full model ln_yyx : 122.13944 nats/sec, 61.65199 nats/event
Full model Log loss : -2.11189
Full model ln_yyx : 119.03971 nats/sec, 60.08735 nats/event
Full model Log loss : -2.10894
Full model ln_yyx : 122.13969 nats/sec, 61.65212 nats/event
Full model Log loss : -2.11189
Full model ln_yyx : 121.38073 nats/sec, 61.26902 nats/event
Full model Log loss : -2.11274
Full model ln_yyx : 120.79388 nats/sec, 60.97280 nats/event
Full model Log loss : -2.11156
Optimization finished. Config saved to results/opt-full/opt_full_313_best_config.txt
[I 2026-03-18 20:15:16,639] Trial 35 pruned. 
[I 2026-03-18 20:15:25,925] Trial 34 finished with value: -2.4966779617180137 and parameters: {'n_layers_yyx': 1, 'hidden_size_yyx_l0': 5, 'context_size_yyx': 4, 'num_mix_components_yyx': 2, 'context_extractor_yyx': 'lstm', 'activation_func_yyx': 'GELU', 'L2_weight_yyx': 3.9189686696803486e-05, 'L_entropy_weight_yyx': 5.265439536800724e-07, 'L_sep_weight_yyx': 1.1787809457438485e-07, 'L_scale_weight_yyx': 5.134348261235081e-09, 'learning_rate_yyx': 0.0025334902030977532}. Best is trial 33 with value: -2.512931905705113.
[I 2026-03-18 20:15:27,807] Trial 47 finished with value: -1.6790185513145817 and parameters: {'n_layers_yyx': 2, 'hidden_size_yyx_l0': 2, 'hidden_size_yyx_l1': 6, 'context_size_yyx': 3, 'num_mix_components_yyx': 3, 'context_extractor_yyx': 'gru', 'activation_func_yyx': 'Tanh', 'L2_weight_yyx': 1.569056277716452e-08, 'L_entropy_weight_yyx': 1.1113253479193877e-09, 'L_sep_weight_yyx': 9.848886763394386e-06, 'L_scale_weight_yyx': 1.2694621715529326e-08, 'learning_rate_yyx': 0.004209229521164342}. Best is trial 15 with value: -1.6819845856754096.
[I 2026-03-18 20:15:28,229] Trial 41 finished with value: -2.0352760025217562 and parameters: {'n_layers_yyx': 1, 'hidden_size_yyx_l0': 6, 'context_size_yyx': 4, 'num_mix_components_yyx': 5, 'context_extractor_yyx': 'lstm', 'activation_func_yyx': 'ReLU', 'L2_weight_yyx': 1.3921351088018718e-07, 'L_entropy_weight_yyx': 5.121782232839556e-10, 'L_sep_weight_yyx': 9.015765006928841e-07, 'L_scale_weight_yyx': 5.337275055125995e-10, 'learning_rate_yyx': 0.009358116961768515}. Best is trial 8 with value: -2.0365283470022115.
[I 2026-03-18 20:15:28,440] Trial 31 pruned. 
[I 2026-03-18 20:15:28,441] Trial 45 pruned. 
[I 2026-03-18 20:15:39,728] Trial 41 finished with value: -1.9825618063425423 and parameters: {'n_layers_yyx': 1, 'hidden_size_yyx_l0': 5, 'context_size_yyx': 4, 'num_mix_components_yyx': 4, 'context_extractor_yyx': 'gru', 'activation_func_yyx': 'Tanh', 'L2_weight_yyx': 4.521745504014473e-08, 'L_entropy_weight_yyx': 3.275598642366823e-05, 'L_sep_weight_yyx': 1.404505761057089e-07, 'L_scale_weight_yyx': 1.5319133976249355e-06, 'learning_rate_yyx': 0.008482007064117255}. Best is trial 12 with value: -1.983840502266522.
[I 2026-03-18 20:15:47,103] Trial 48 pruned. 
[I 2026-03-18 20:16:03,707] Trial 47 finished with value: -1.6772978973755293 and parameters: {'n_layers_yyx': 1, 'hidden_size_yyx_l0': 6, 'context_size_yyx': 4, 'num_mix_components_yyx': 4, 'context_extractor_yyx': 'lstm', 'activation_func_yyx': 'Tanh', 'L2_weight_yyx': 0.00029687484259895337, 'L_entropy_weight_yyx': 1.1674421783957553e-10, 'L_sep_weight_yyx': 1.0683704718874946e-07, 'L_scale_weight_yyx': 4.399352839259046e-09, 'learning_rate_yyx': 0.00885024233300857}. Best is trial 42 with value: -1.6806136813660988.
[I 2026-03-18 20:16:05,666] Trial 42 pruned. 
[I 2026-03-18 20:16:10,438] Trial 36 pruned. 
[I 2026-03-18 20:16:11,641] Trial 21 finished with value: -2.5143157757643144 and parameters: {'n_layers_yyx': 1, 'hidden_size_yyx_l0': 5, 'context_size_yyx': 1, 'num_mix_components_yyx': 4, 'context_extractor_yyx': 'lstm', 'activation_func_yyx': 'ReLU', 'L2_weight_yyx': 4.468823743431282e-10, 'L_entropy_weight_yyx': 1.2799140069610064e-08, 'L_sep_weight_yyx': 1.9838299536017937e-07, 'L_scale_weight_yyx': 3.217275009703431e-10, 'learning_rate_yyx': 0.008572270735713879}. Best is trial 12 with value: -2.51518345292619.
[I 2026-03-18 20:16:13,610] Trial 49 pruned. 
[I 2026-03-18 20:16:13,610] Trial 35 pruned. 

Source events: 10752
Target events: 24874
Full model ln_yyx : 858.80872 nats/sec, 31.07373 nats/event
Full model Log loss : -1.66625
Full model ln_yyx : 866.73000 nats/sec, 31.36034 nats/event
Full model Log loss : -1.68043
Full model ln_yyx : 856.81850 nats/sec, 31.00171 nats/event
Full model Log loss : -1.67089
Full model ln_yyx : 861.35899 nats/sec, 31.16600 nats/event
Full model Log loss : -1.65719
Full model ln_yyx : 856.64077 nats/sec, 30.99528 nats/event
Full model Log loss : -1.67070
Full model ln_yyx : 862.82370 nats/sec, 31.21900 nats/event
Full model Log loss : -1.67273
Full model ln_yyx : 860.74157 nats/sec, 31.14366 nats/event
Full model Log loss : -1.67399
Full model ln_yyx : 869.18116 nats/sec, 31.44902 nats/event
Full model Log loss : -1.68198
Full model ln_yyx : 867.88113 nats/sec, 31.40199 nats/event
Full model Log loss : -1.68030
Full model ln_yyx : 866.21495 nats/sec, 31.34170 nats/event
Full model Log loss : -1.68005
Full model ln_yyx : 855.48273 nats/sec, 30.95338 nats/event
Full model Log loss : -1.67468
Full model ln_yyx : 855.70523 nats/sec, 30.96143 nats/event
Full model Log loss : -1.67280
Full model ln_yyx : 870.13248 nats/sec, 31.48345 nats/event
Full model Log loss : -1.67145
Full model ln_yyx : 851.00985 nats/sec, 30.79154 nats/event
Full model Log loss : -1.67902
Optimization finished. Config saved to results/opt-full/opt_full_308_best_config.txt
[I 2026-03-18 20:16:16,568] Trial 22 pruned. 
[I 2026-03-18 20:16:19,261] Trial 38 pruned. 
[I 2026-03-18 20:16:20,851] Trial 46 pruned. 
[I 2026-03-18 20:16:22,601] Trial 32 pruned. 
[I 2026-03-18 20:16:25,909] Trial 38 pruned. 
[I 2026-03-18 20:16:29,792] Trial 43 pruned. 
[I 2026-03-18 20:16:38,011] Trial 39 pruned. 
[I 2026-03-18 20:16:38,661] Trial 23 pruned. 
[I 2026-03-18 20:16:42,010] Trial 47 pruned. 
[I 2026-03-18 20:16:45,184] Trial 48 pruned. 
[I 2026-03-18 20:16:49,253] Trial 37 finished with value: -2.5126368331616415 and parameters: {'n_layers_yyx': 2, 'hidden_size_yyx_l0': 4, 'hidden_size_yyx_l1': 6, 'context_size_yyx': 1, 'num_mix_components_yyx': 4, 'context_extractor_yyx': 'lstm', 'activation_func_yyx': 'Tanh', 'L2_weight_yyx': 5.336145048135005e-07, 'L_entropy_weight_yyx': 1.1125353487950186e-06, 'L_sep_weight_yyx': 2.878096694984221e-10, 'L_scale_weight_yyx': 2.5685677129806008e-08, 'learning_rate_yyx': 0.008587154026178519}. Best is trial 23 with value: -2.5132993257512335.
[I 2026-03-18 20:16:52,976] Trial 35 finished with value: -2.4919040490066675 and parameters: {'n_layers_yyx': 2, 'hidden_size_yyx_l0': 5, 'hidden_size_yyx_l1': 6, 'context_size_yyx': 1, 'num_mix_components_yyx': 5, 'context_extractor_yyx': 'lstm', 'activation_func_yyx': 'ReLU', 'L2_weight_yyx': 3.275078755733464e-06, 'L_entropy_weight_yyx': 2.2976477810477493e-10, 'L_sep_weight_yyx': 5.897087730598113e-07, 'L_scale_weight_yyx': 2.6347698875956327e-05, 'learning_rate_yyx': 0.005302305795456726}. Best is trial 7 with value: -2.4950542279753494.
[I 2026-03-18 20:16:55,861] Trial 36 pruned. 
[I 2026-03-18 20:17:02,133] Trial 24 pruned. 
[I 2026-03-18 20:17:04,727] Trial 48 pruned. 
[I 2026-03-18 20:17:10,777] Trial 31 finished with value: -2.5102200788397386 and parameters: {'n_layers_yyx': 2, 'hidden_size_yyx_l0': 4, 'hidden_size_yyx_l1': 4, 'context_size_yyx': 3, 'num_mix_components_yyx': 5, 'context_extractor_yyx': 'gru', 'activation_func_yyx': 'ReLU', 'L2_weight_yyx': 1.679162348274791e-05, 'L_entropy_weight_yyx': 8.824473894401167e-07, 'L_sep_weight_yyx': 1.7577075813883766e-07, 'L_scale_weight_yyx': 4.554738019443628e-05, 'learning_rate_yyx': 0.007884897076666583}. Best is trial 22 with value: -2.5155989726836543.
[I 2026-03-18 20:17:13,842] Trial 44 pruned. 
