Warning: Failed writing log files to directory [/var/log/nvidia-mps]. No logs will be available.
[I 2026-03-18 22:16:24,739] Using an existing study with name 'opt_full-model_seed=42_task=247' instead of creating a new one.
[I 2026-03-18 22:16:24,742] Using an existing study with name 'opt_full-model_seed=42_task=249' instead of creating a new one.
[I 2026-03-18 22:16:24,742] Using an existing study with name 'opt_full-model_seed=42_task=241' instead of creating a new one.
[I 2026-03-18 22:16:24,743] Using an existing study with name 'opt_full-model_seed=42_task=251' instead of creating a new one.
[I 2026-03-18 22:16:24,753] Using an existing study with name 'opt_full-model_seed=42_task=242' instead of creating a new one.
[I 2026-03-18 22:16:24,753] Using an existing study with name 'opt_full-model_seed=42_task=244' instead of creating a new one.
[I 2026-03-18 22:16:24,755] Using an existing study with name 'opt_full-model_seed=42_task=252' instead of creating a new one.
[I 2026-03-18 22:16:24,765] Using an existing study with name 'opt_full-model_seed=42_task=254' instead of creating a new one.
[I 2026-03-18 22:16:24,787] Using an existing study with name 'opt_full-model_seed=42_task=255' instead of creating a new one.
[I 2026-03-18 22:16:24,788] Using an existing study with name 'opt_full-model_seed=42_task=245' instead of creating a new one.
[I 2026-03-18 22:16:24,799] Using an existing study with name 'opt_full-model_seed=42_task=253' instead of creating a new one.
[I 2026-03-18 22:16:24,819] Using an existing study with name 'opt_full-model_seed=42_task=250' instead of creating a new one.
[I 2026-03-18 22:16:24,823] Using an existing study with name 'opt_full-model_seed=42_task=243' instead of creating a new one.
[I 2026-03-18 22:16:24,826] Using an existing study with name 'opt_full-model_seed=42_task=246' instead of creating a new one.
[I 2026-03-18 22:16:24,836] Using an existing study with name 'opt_full-model_seed=42_task=248' instead of creating a new one.
[I 2026-03-18 22:16:24,849] Using an existing study with name 'opt_full-model_seed=42_task=240' instead of creating a new one.
[I 2026-03-18 22:16:55,021] Trial 35 pruned. 
[I 2026-03-18 22:16:55,050] Trial 45 pruned. 
[I 2026-03-18 22:16:55,131] Trial 32 pruned. 
[I 2026-03-18 22:16:55,134] Trial 27 pruned. 
[I 2026-03-18 22:16:57,605] Trial 25 pruned. 
[I 2026-03-18 22:16:58,589] Trial 30 pruned. 
[I 2026-03-18 22:16:58,850] Trial 46 pruned. 
[I 2026-03-18 22:17:04,964] Trial 26 pruned. 
[I 2026-03-18 22:17:05,774] Trial 31 pruned. 
[I 2026-03-18 22:17:07,917] Trial 33 pruned. 
[I 2026-03-18 22:17:08,008] Trial 49 pruned. 
[I 2026-03-18 22:17:08,990] Trial 43 pruned. 
[I 2026-03-18 22:17:09,282] Trial 32 pruned. 
[I 2026-03-18 22:17:12,311] Trial 28 pruned. 
[I 2026-03-18 22:17:12,626] Trial 36 pruned. 
[I 2026-03-18 22:17:13,341] Trial 33 pruned. 
[I 2026-03-18 22:17:15,786] Trial 34 pruned. 
[I 2026-03-18 22:17:17,271] Trial 34 pruned. 
[I 2026-03-18 22:17:19,471] Trial 37 pruned. 
[I 2026-03-18 22:17:23,241] Trial 38 pruned. 
[I 2026-03-18 22:17:23,614] Trial 35 pruned. 
[I 2026-03-18 22:17:23,685] Trial 34 pruned. 
[I 2026-03-18 22:17:23,950] Trial 18 finished with value: -1.4536573439378004 and parameters: {'n_layers_yyx': 1, 'hidden_size_yyx_l0': 5, 'context_size_yyx': 4, 'num_mix_components_yyx': 5, 'context_extractor_yyx': 'lstm', 'activation_func_yyx': 'Tanh', 'L2_weight_yyx': 7.538903534723198e-08, 'L_entropy_weight_yyx': 3.410007936570009e-08, 'L_sep_weight_yyx': 1.4380025865201948e-06, 'L_scale_weight_yyx': 1.5340108805112915e-08, 'learning_rate_yyx': 0.007214708572860085}. Best is trial 12 with value: -1.460441659780649.
[I 2026-03-18 22:17:23,984] Trial 37 finished with value: -1.4219808255709134 and parameters: {'n_layers_yyx': 2, 'hidden_size_yyx_l0': 3, 'hidden_size_yyx_l1': 5, 'context_size_yyx': 4, 'num_mix_components_yyx': 5, 'context_extractor_yyx': 'gru', 'activation_func_yyx': 'Tanh', 'L2_weight_yyx': 2.672392286819808e-07, 'L_entropy_weight_yyx': 1.968967499512301e-08, 'L_sep_weight_yyx': 2.2500960607169315e-08, 'L_scale_weight_yyx': 1.1265910638520375e-06, 'learning_rate_yyx': 0.0053815463322667385}. Best is trial 29 with value: -1.4683670278695913.
[I 2026-03-18 22:17:25,825] Trial 50 pruned. 
[I 2026-03-18 22:17:26,826] Trial 33 finished with value: -1.4323148522010216 and parameters: {'n_layers_yyx': 1, 'hidden_size_yyx_l0': 6, 'context_size_yyx': 4, 'num_mix_components_yyx': 3, 'context_extractor_yyx': 'lstm', 'activation_func_yyx': 'Tanh', 'L2_weight_yyx': 3.5150011240637816e-05, 'L_entropy_weight_yyx': 8.676974602977741e-06, 'L_sep_weight_yyx': 2.034163938462431e-08, 'L_scale_weight_yyx': 0.00026445732677472415, 'learning_rate_yyx': 0.008583381349825772}. Best is trial 7 with value: -1.4538350266676683.
[I 2026-03-18 22:17:27,434] Trial 38 pruned. 
[I 2026-03-18 22:17:28,267] Trial 36 finished with value: -1.4315606219951924 and parameters: {'n_layers_yyx': 2, 'hidden_size_yyx_l0': 6, 'hidden_size_yyx_l1': 4, 'context_size_yyx': 4, 'num_mix_components_yyx': 2, 'context_extractor_yyx': 'gru', 'activation_func_yyx': 'Tanh', 'L2_weight_yyx': 2.3851168640308436e-07, 'L_entropy_weight_yyx': 0.00023579613941856196, 'L_sep_weight_yyx': 6.510982578329882e-08, 'L_scale_weight_yyx': 1.3936446046342833e-07, 'learning_rate_yyx': 0.009980261526272311}. Best is trial 1 with value: -1.4389243727463943.
[I 2026-03-18 22:17:29,852] Trial 39 pruned. 
[I 2026-03-18 22:17:31,038] Trial 36 pruned. 
[I 2026-03-18 22:17:31,376] Trial 19 pruned. 
[I 2026-03-18 22:17:35,766] Trial 37 pruned. 
[I 2026-03-18 22:17:37,085] Trial 40 pruned. 
[I 2026-03-18 22:17:38,157] Trial 37 pruned. 
[I 2026-03-18 22:17:38,313] Trial 20 pruned. 
[I 2026-03-18 22:17:38,446] Trial 37 pruned. 
[I 2026-03-18 22:17:40,698] Trial 47 finished with value: -1.4433821458082932 and parameters: {'n_layers_yyx': 2, 'hidden_size_yyx_l0': 3, 'hidden_size_yyx_l1': 6, 'context_size_yyx': 3, 'num_mix_components_yyx': 4, 'context_extractor_yyx': 'lstm', 'activation_func_yyx': 'GELU', 'L2_weight_yyx': 2.5726846147965877e-07, 'L_entropy_weight_yyx': 1.931808381570464e-07, 'L_sep_weight_yyx': 0.00011261474970736172, 'L_scale_weight_yyx': 2.1807940903398343e-05, 'learning_rate_yyx': 0.0071211884063890705}. Best is trial 32 with value: -1.4672450138972355.
[I 2026-03-18 22:17:41,846] Trial 21 pruned. 
[I 2026-03-18 22:17:44,557] Trial 41 pruned. 
[I 2026-03-18 22:17:44,953] Trial 38 pruned. 
[I 2026-03-18 22:17:46,288] Trial 38 pruned. 
[I 2026-03-18 22:17:47,993] Trial 42 pruned. 
[I 2026-03-18 22:17:48,048] Trial 48 pruned. 
[I 2026-03-18 22:17:48,484] Trial 44 finished with value: -1.4095544533651383 and parameters: {'n_layers_yyx': 2, 'hidden_size_yyx_l0': 5, 'hidden_size_yyx_l1': 2, 'context_size_yyx': 3, 'num_mix_components_yyx': 3, 'context_extractor_yyx': 'lstm', 'activation_func_yyx': 'Tanh', 'L2_weight_yyx': 2.0888893321285875e-05, 'L_entropy_weight_yyx': 8.618970845768207e-05, 'L_sep_weight_yyx': 5.388387443559962e-07, 'L_scale_weight_yyx': 8.741917015353608e-07, 'learning_rate_yyx': 0.009069843020728621}. Best is trial 0 with value: -1.5190498727266906.
[I 2026-03-18 22:17:50,005] Trial 35 finished with value: -1.395443068284255 and parameters: {'n_layers_yyx': 2, 'hidden_size_yyx_l0': 4, 'hidden_size_yyx_l1': 5, 'context_size_yyx': 3, 'num_mix_components_yyx': 4, 'context_extractor_yyx': 'lstm', 'activation_func_yyx': 'ReLU', 'L2_weight_yyx': 5.758774141963135e-06, 'L_entropy_weight_yyx': 4.697456067969584e-08, 'L_sep_weight_yyx': 8.311900297923997e-05, 'L_scale_weight_yyx': 0.000250763475923299, 'learning_rate_yyx': 0.005499906957530362}. Best is trial 27 with value: -1.4597027822641226.
[I 2026-03-18 22:17:51,637] Trial 43 pruned. 
[I 2026-03-18 22:17:51,917] Trial 49 pruned. 
[I 2026-03-18 22:17:53,377] Trial 39 pruned. 
[I 2026-03-18 22:17:53,765] Trial 36 pruned. 
[I 2026-03-18 22:17:54,705] Trial 44 pruned. 
[I 2026-03-18 22:17:55,338] Trial 45 pruned. 
[I 2026-03-18 22:17:57,269] Trial 37 pruned. 
[I 2026-03-18 22:17:58,015] Trial 33 finished with value: -1.4466177368164062 and parameters: {'n_layers_yyx': 1, 'hidden_size_yyx_l0': 4, 'context_size_yyx': 3, 'num_mix_components_yyx': 4, 'context_extractor_yyx': 'lstm', 'activation_func_yyx': 'GELU', 'L2_weight_yyx': 3.9125843797365776e-05, 'L_entropy_weight_yyx': 8.062875407917209e-07, 'L_sep_weight_yyx': 1.079068672903242e-05, 'L_scale_weight_yyx': 2.0636093732231593e-07, 'learning_rate_yyx': 0.0012268662126109185}. Best is trial 19 with value: -1.4628589806189904.
[I 2026-03-18 22:17:58,756] Trial 50 pruned. 
[I 2026-03-18 22:17:59,053] Trial 46 pruned. 
[I 2026-03-18 22:18:01,030] Trial 39 pruned. 
[I 2026-03-18 22:18:02,399] Trial 45 pruned. 
[I 2026-03-18 22:18:02,707] Trial 47 pruned. 
[I 2026-03-18 22:18:02,844] Trial 22 finished with value: -1.4437252103365386 and parameters: {'n_layers_yyx': 1, 'hidden_size_yyx_l0': 5, 'context_size_yyx': 4, 'num_mix_components_yyx': 5, 'context_extractor_yyx': 'lstm', 'activation_func_yyx': 'Tanh', 'L2_weight_yyx': 1.612791413601558e-07, 'L_entropy_weight_yyx': 4.840466962159288e-08, 'L_sep_weight_yyx': 1.29655682589115e-06, 'L_scale_weight_yyx': 1.007653404905428e-08, 'learning_rate_yyx': 0.007069813398567804}. Best is trial 12 with value: -1.460441659780649.
[I 2026-03-18 22:18:02,871] Trial 51 pruned. 
[I 2026-03-18 22:18:04,151] Trial 38 pruned. 
[I 2026-03-18 22:18:04,894] Trial 34 pruned. 
[I 2026-03-18 22:18:06,261] Trial 38 finished with value: -1.4181401883638822 and parameters: {'n_layers_yyx': 2, 'hidden_size_yyx_l0': 6, 'hidden_size_yyx_l1': 4, 'context_size_yyx': 4, 'num_mix_components_yyx': 4, 'context_extractor_yyx': 'lstm', 'activation_func_yyx': 'Tanh', 'L2_weight_yyx': 8.71427748452933e-09, 'L_entropy_weight_yyx': 1.6717010890360932e-08, 'L_sep_weight_yyx': 0.00019310860997250978, 'L_scale_weight_yyx': 9.672516029293438e-07, 'learning_rate_yyx': 0.007358521381197151}. Best is trial 1 with value: -1.4389243727463943.
[I 2026-03-18 22:18:06,262] Trial 39 finished with value: -1.4557222806490384 and parameters: {'n_layers_yyx': 1, 'hidden_size_yyx_l0': 4, 'context_size_yyx': 4, 'num_mix_components_yyx': 5, 'context_extractor_yyx': 'gru', 'activation_func_yyx': 'Tanh', 'L2_weight_yyx': 2.834910954265219e-06, 'L_entropy_weight_yyx': 0.0002847328916790768, 'L_sep_weight_yyx': 6.8303059677597536e-09, 'L_scale_weight_yyx': 3.702505334648544e-09, 'learning_rate_yyx': 0.008512242682626158}. Best is trial 29 with value: -1.4683670278695913.
[I 2026-03-18 22:18:06,368] Trial 48 pruned. 
[I 2026-03-18 22:18:07,468] Trial 39 pruned. 
[I 2026-03-18 22:18:07,824] Trial 40 pruned. 
[I 2026-03-18 22:18:08,368] Trial 35 pruned. 
[I 2026-03-18 22:18:09,340] Trial 40 pruned. 
[I 2026-03-18 22:18:09,499] Trial 23 pruned. 
[I 2026-03-18 22:18:09,785] Trial 40 pruned. 
[I 2026-03-18 22:18:10,016] Trial 49 pruned. 
[I 2026-03-18 22:18:10,895] Trial 41 pruned. 
[I 2026-03-18 22:18:12,188] Trial 36 pruned. 
[I 2026-03-18 22:18:13,105] Trial 34 finished with value: -1.40730226956881 and parameters: {'n_layers_yyx': 1, 'hidden_size_yyx_l0': 6, 'context_size_yyx': 4, 'num_mix_components_yyx': 2, 'context_extractor_yyx': 'lstm', 'activation_func_yyx': 'Tanh', 'L2_weight_yyx': 3.439718153869319e-05, 'L_entropy_weight_yyx': 1.0860914613487076e-05, 'L_sep_weight_yyx': 2.3040507083717126e-08, 'L_scale_weight_yyx': 0.00032892536432514203, 'learning_rate_yyx': 0.008204902800841565}. Best is trial 7 with value: -1.4538350266676683.
[I 2026-03-18 22:18:13,206] Trial 24 pruned. 
[I 2026-03-18 22:18:13,312] Trial 39 pruned. 
[I 2026-03-18 22:18:13,353] Trial 51 pruned. 
[I 2026-03-18 22:18:13,515] Trial 41 pruned. 
[I 2026-03-18 22:18:13,730] Trial 35 pruned. 
[I 2026-03-18 22:18:14,102] Trial 42 pruned. 
[I 2026-03-18 22:18:14,159] Trial 40 pruned. 
[I 2026-03-18 22:18:15,455] Trial 37 pruned. 
[I 2026-03-18 22:18:16,674] Trial 41 pruned. 
[I 2026-03-18 22:18:17,454] Trial 43 pruned. 
[I 2026-03-18 22:18:17,700] Trial 41 pruned. 
[I 2026-03-18 22:18:18,987] Trial 46 pruned. 
[I 2026-03-18 22:18:20,823] Trial 40 pruned. 
[I 2026-03-18 22:18:21,037] Trial 44 pruned. 
[I 2026-03-18 22:18:23,638] Trial 29 finished with value: -1.3514117431640624 and parameters: {'n_layers_yyx': 2, 'hidden_size_yyx_l0': 2, 'hidden_size_yyx_l1': 4, 'context_size_yyx': 2, 'num_mix_components_yyx': 3, 'context_extractor_yyx': 'gru', 'activation_func_yyx': 'ReLU', 'L2_weight_yyx': 1.234416365175826e-09, 'L_entropy_weight_yyx': 0.0009357574121246194, 'L_sep_weight_yyx': 1.0234627677621929e-10, 'L_scale_weight_yyx': 1.0292719909747294e-08, 'learning_rate_yyx': 0.003007435558384999}. Best is trial 13 with value: -1.4421805044320914.
[I 2026-03-18 22:18:24,490] Trial 45 pruned. 
[I 2026-03-18 22:18:25,433] Trial 27 finished with value: -2.490398512924754 and parameters: {'n_layers_yyx': 1, 'hidden_size_yyx_l0': 4, 'context_size_yyx': 2, 'num_mix_components_yyx': 3, 'context_extractor_yyx': 'lstm', 'activation_func_yyx': 'Tanh', 'L2_weight_yyx': 4.1432053221847544e-09, 'L_entropy_weight_yyx': 1.3050540582208754e-07, 'L_sep_weight_yyx': 5.8513757916337276e-06, 'L_scale_weight_yyx': 1.361113360190363e-09, 'learning_rate_yyx': 0.0067809928674243325}. Best is trial 4 with value: -2.49523174750643.
[I 2026-03-18 22:18:25,829] Trial 47 pruned. 
[I 2026-03-18 22:18:27,428] Trial 50 pruned. 
[I 2026-03-18 22:18:27,750] Trial 21 finished with value: -2.4422125972878415 and parameters: {'n_layers_yyx': 1, 'hidden_size_yyx_l0': 2, 'context_size_yyx': 1, 'num_mix_components_yyx': 3, 'context_extractor_yyx': 'lstm', 'activation_func_yyx': 'ReLU', 'L2_weight_yyx': 5.220725333456019e-10, 'L_entropy_weight_yyx': 0.00015742472584872572, 'L_sep_weight_yyx': 5.3001938822214394e-09, 'L_scale_weight_yyx': 0.00012901237507855032, 'learning_rate_yyx': 0.0032846563110922656}. Best is trial 12 with value: -2.4732728871279206.
[I 2026-03-18 22:18:27,947] Trial 41 pruned. 
[I 2026-03-18 22:18:30,641] Trial 46 pruned. 
[I 2026-03-18 22:18:30,704] Trial 30 pruned. 
[I 2026-03-18 22:18:30,833] Trial 35 pruned. 
[I 2026-03-18 22:18:31,293] Trial 51 pruned. 
[I 2026-03-18 22:18:32,346] Trial 28 pruned. 
[I 2026-03-18 22:18:32,527] Trial 52 finished with value: -1.456236337515024 and parameters: {'n_layers_yyx': 2, 'hidden_size_yyx_l0': 6, 'hidden_size_yyx_l1': 5, 'context_size_yyx': 3, 'num_mix_components_yyx': 4, 'context_extractor_yyx': 'lstm', 'activation_func_yyx': 'Tanh', 'L2_weight_yyx': 1.2103281997971555e-07, 'L_entropy_weight_yyx': 1.2445820366877256e-08, 'L_sep_weight_yyx': 0.00017944489793854422, 'L_scale_weight_yyx': 8.176759114732561e-08, 'learning_rate_yyx': 0.00996942848342421}. Best is trial 32 with value: -1.4672450138972355.
[I 2026-03-18 22:18:35,344] Trial 52 pruned. 
[I 2026-03-18 22:18:37,375] Trial 47 pruned. 
[I 2026-03-18 22:18:41,399] Trial 25 finished with value: -1.4383455716646634 and parameters: {'n_layers_yyx': 1, 'hidden_size_yyx_l0': 6, 'context_size_yyx': 4, 'num_mix_components_yyx': 5, 'context_extractor_yyx': 'lstm', 'activation_func_yyx': 'Tanh', 'L2_weight_yyx': 5.910833723791444e-09, 'L_entropy_weight_yyx': 1.001919764164895e-05, 'L_sep_weight_yyx': 2.358498312055399e-06, 'L_scale_weight_yyx': 6.559321309959009e-08, 'learning_rate_yyx': 0.007758788116842966}. Best is trial 12 with value: -1.460441659780649.
[I 2026-03-18 22:18:43,178] Trial 48 pruned. 
[I 2026-03-18 22:18:45,104] Trial 42 finished with value: -1.4509664212740385 and parameters: {'n_layers_yyx': 1, 'hidden_size_yyx_l0': 4, 'context_size_yyx': 4, 'num_mix_components_yyx': 5, 'context_extractor_yyx': 'gru', 'activation_func_yyx': 'Tanh', 'L2_weight_yyx': 1.4513360228406162e-07, 'L_entropy_weight_yyx': 0.00021990724217300786, 'L_sep_weight_yyx': 5.50273713638147e-08, 'L_scale_weight_yyx': 3.0291152390269588e-09, 'learning_rate_yyx': 0.008251253180416203}. Best is trial 29 with value: -1.4683670278695913.
[I 2026-03-18 22:18:45,158] Trial 26 pruned. 
[I 2026-03-18 22:18:46,019] Trial 22 pruned. 
[I 2026-03-18 22:18:47,105] Trial 42 finished with value: -1.4406649076021634 and parameters: {'n_layers_yyx': 2, 'hidden_size_yyx_l0': 6, 'hidden_size_yyx_l1': 5, 'context_size_yyx': 2, 'num_mix_components_yyx': 3, 'context_extractor_yyx': 'lstm', 'activation_func_yyx': 'ReLU', 'L2_weight_yyx': 5.686198334199724e-06, 'L_entropy_weight_yyx': 4.073776337717067e-05, 'L_sep_weight_yyx': 2.048469377345365e-06, 'L_scale_weight_yyx': 0.0001618975446231688, 'learning_rate_yyx': 0.008660176823057772}. Best is trial 27 with value: -1.4597027822641226.
[I 2026-03-18 22:18:47,245] Trial 29 pruned. 
[I 2026-03-18 22:18:49,130] Trial 27 pruned. 
[I 2026-03-18 22:18:49,561] Trial 49 pruned. 
[I 2026-03-18 22:18:52,749] Trial 28 pruned. 
[I 2026-03-18 22:18:56,485] Trial 50 pruned. 
[I 2026-03-18 22:18:56,619] Trial 29 pruned. 
[I 2026-03-18 22:18:58,723] Trial 52 finished with value: -2.4726841989750814 and parameters: {'n_layers_yyx': 1, 'hidden_size_yyx_l0': 6, 'context_size_yyx': 3, 'num_mix_components_yyx': 5, 'context_extractor_yyx': 'gru', 'activation_func_yyx': 'ReLU', 'L2_weight_yyx': 1.4271323473617133e-07, 'L_entropy_weight_yyx': 2.880965396367217e-08, 'L_sep_weight_yyx': 2.700874009397589e-07, 'L_scale_weight_yyx': 0.0004551459559725367, 'learning_rate_yyx': 0.009932167984163647}. Best is trial 25 with value: -2.4764732316599813.
[I 2026-03-18 22:18:59,737] Trial 36 finished with value: -1.418621567946214 and parameters: {'n_layers_yyx': 1, 'hidden_size_yyx_l0': 6, 'context_size_yyx': 4, 'num_mix_components_yyx': 3, 'context_extractor_yyx': 'lstm', 'activation_func_yyx': 'Tanh', 'L2_weight_yyx': 3.967516996661373e-06, 'L_entropy_weight_yyx': 0.00010397798845015714, 'L_sep_weight_yyx': 3.195634845968274e-09, 'L_scale_weight_yyx': 0.00024055925789493718, 'learning_rate_yyx': 0.009817036324091024}. Best is trial 7 with value: -1.4538350266676683.
[I 2026-03-18 22:19:00,979] Trial 42 pruned. 
[I 2026-03-18 22:19:02,739] Trial 38 pruned. 
[I 2026-03-18 22:19:03,084] Trial 43 pruned. 
[I 2026-03-18 22:19:03,743] Trial 42 finished with value: -1.4339773559570312 and parameters: {'n_layers_yyx': 2, 'hidden_size_yyx_l0': 6, 'hidden_size_yyx_l1': 4, 'context_size_yyx': 4, 'num_mix_components_yyx': 4, 'context_extractor_yyx': 'lstm', 'activation_func_yyx': 'Tanh', 'L2_weight_yyx': 8.265810748637517e-09, 'L_entropy_weight_yyx': 1.9814237779951092e-08, 'L_sep_weight_yyx': 0.00028291304118263264, 'L_scale_weight_yyx': 8.423239654229166e-07, 'learning_rate_yyx': 0.008268248063720047}. Best is trial 1 with value: -1.4389243727463943.
[I 2026-03-18 22:19:03,824] Trial 23 pruned. 
[I 2026-03-18 22:19:04,078] Trial 30 pruned. 
[I 2026-03-18 22:19:04,199] Trial 36 pruned. 
[I 2026-03-18 22:19:04,610] Trial 43 pruned. 
[I 2026-03-18 22:19:06,070] Trial 39 pruned. 
[I 2026-03-18 22:19:07,392] Trial 37 pruned. 
[I 2026-03-18 22:19:08,012] Trial 37 pruned. 
[I 2026-03-18 22:19:09,521] Trial 40 pruned. 
[I 2026-03-18 22:19:10,106] Trial 53 finished with value: -1.4549348801832933 and parameters: {'n_layers_yyx': 2, 'hidden_size_yyx_l0': 6, 'hidden_size_yyx_l1': 5, 'context_size_yyx': 3, 'num_mix_components_yyx': 4, 'context_extractor_yyx': 'lstm', 'activation_func_yyx': 'Tanh', 'L2_weight_yyx': 4.6116039030619497e-08, 'L_entropy_weight_yyx': 1.0350116807020135e-08, 'L_sep_weight_yyx': 0.0003356708469940386, 'L_scale_weight_yyx': 5.5120534410128375e-08, 'learning_rate_yyx': 0.008835643963582197}. Best is trial 32 with value: -1.4672450138972355.
[I 2026-03-18 22:19:11,538] Trial 24 pruned. 
[I 2026-03-18 22:19:11,820] Trial 38 pruned. 
[I 2026-03-18 22:19:18,789] Trial 31 pruned. 
[I 2026-03-18 22:19:19,341] Trial 39 pruned. 
[I 2026-03-18 22:19:19,610] Trial 25 pruned. 
[I 2026-03-18 22:19:20,400] Trial 44 pruned. 
[I 2026-03-18 22:19:20,944] Trial 31 pruned. 
[I 2026-03-18 22:19:21,310] Trial 48 finished with value: -1.32581468498182 and parameters: {'n_layers_yyx': 2, 'hidden_size_yyx_l0': 4, 'hidden_size_yyx_l1': 2, 'context_size_yyx': 4, 'num_mix_components_yyx': 2, 'context_extractor_yyx': 'gru', 'activation_func_yyx': 'Tanh', 'L2_weight_yyx': 3.122265759536245e-07, 'L_entropy_weight_yyx': 1.0582818385073455e-06, 'L_sep_weight_yyx': 3.643311732071982e-05, 'L_scale_weight_yyx': 2.3733967136889045e-10, 'learning_rate_yyx': 0.008998853483018618}. Best is trial 24 with value: -1.4518791534615763.
[I 2026-03-18 22:19:23,942] Trial 53 pruned. 
[I 2026-03-18 22:19:24,828] Trial 38 pruned. 
[I 2026-03-18 22:19:27,360] Trial 54 pruned. 
[I 2026-03-18 22:19:27,523] Trial 54 pruned. 
[I 2026-03-18 22:19:27,807] Trial 32 pruned. 
[I 2026-03-18 22:19:31,662] Trial 33 pruned. 
[I 2026-03-18 22:19:32,196] Trial 39 pruned. 
[I 2026-03-18 22:19:35,481] Trial 43 finished with value: -1.451051001915565 and parameters: {'n_layers_yyx': 2, 'hidden_size_yyx_l0': 6, 'hidden_size_yyx_l1': 3, 'context_size_yyx': 4, 'num_mix_components_yyx': 4, 'context_extractor_yyx': 'lstm', 'activation_func_yyx': 'Tanh', 'L2_weight_yyx': 2.0303979676200673e-08, 'L_entropy_weight_yyx': 1.9451746283604918e-07, 'L_sep_weight_yyx': 0.0002353232171081732, 'L_scale_weight_yyx': 0.00016106346055920728, 'learning_rate_yyx': 0.008187738650823954}. Best is trial 43 with value: -1.451051001915565.
[I 2026-03-18 22:19:35,901] Trial 44 finished with value: -1.4383400080754207 and parameters: {'n_layers_yyx': 2, 'hidden_size_yyx_l0': 6, 'hidden_size_yyx_l1': 4, 'context_size_yyx': 1, 'num_mix_components_yyx': 2, 'context_extractor_yyx': 'lstm', 'activation_func_yyx': 'ReLU', 'L2_weight_yyx': 9.333465004539049e-06, 'L_entropy_weight_yyx': 0.0002549390165764291, 'L_sep_weight_yyx': 6.195312320201413e-06, 'L_scale_weight_yyx': 0.00012376932409601706, 'learning_rate_yyx': 0.008642538029315095}. Best is trial 27 with value: -1.4597027822641226.
[I 2026-03-18 22:19:35,983] Trial 40 pruned. 
[I 2026-03-18 22:19:36,904] Trial 40 pruned. 
[I 2026-03-18 22:19:37,062] Trial 49 pruned. 
[I 2026-03-18 22:19:37,281] Trial 26 pruned. 
