[I 2026-03-18 20:35:37,912] Trial 41 finished with value: -2.51063739801779 and parameters: {'n_layers_yyx': 1, 'hidden_size_yyx_l0': 5, 'context_size_yyx': 4, 'num_mix_components_yyx': 5, 'context_extractor_yyx': 'gru', 'activation_func_yyx': 'GELU', 'L2_weight_yyx': 5.795031734458251e-10, 'L_entropy_weight_yyx': 3.3357967313992316e-06, 'L_sep_weight_yyx': 5.09235074979903e-09, 'L_scale_weight_yyx': 1.7766164664776966e-06, 'learning_rate_yyx': 0.008344879795316347}. Best is trial 26 with value: -2.512613867095458.
[I 2026-03-18 20:35:46,249] Trial 48 finished with value: -2.512610772193096 and parameters: {'n_layers_yyx': 1, 'hidden_size_yyx_l0': 3, 'context_size_yyx': 4, 'num_mix_components_yyx': 1, 'context_extractor_yyx': 'lstm', 'activation_func_yyx': 'ReLU', 'L2_weight_yyx': 0.00021230855157913065, 'L_entropy_weight_yyx': 4.803351600077129e-10, 'L_sep_weight_yyx': 3.3602075678896104e-06, 'L_scale_weight_yyx': 1.8073834164169537e-05, 'learning_rate_yyx': 0.006085092807056581}. Best is trial 33 with value: -2.512931905705113.
[I 2026-03-18 20:35:46,554] Trial 42 pruned. 
[I 2026-03-18 20:35:55,514] Trial 49 pruned. 

Source events: 27060
Target events: 20158
Full model ln_yyx : 2325.95081 nats/sec, 103.84739 nats/event
Full model Log loss : -2.51035
Full model ln_yyx : 2323.56216 nats/sec, 103.74075 nats/event
Full model Log loss : -2.51256
Full model ln_yyx : 2305.65228 nats/sec, 102.94112 nats/event
Full model Log loss : -2.50849
Full model ln_yyx : 2321.78062 nats/sec, 103.66120 nats/event
Full model Log loss : -2.51227
Full model ln_yyx : 2304.78459 nats/sec, 102.90238 nats/event
Full model Log loss : -2.50773
Full model ln_yyx : 2306.01225 nats/sec, 102.95719 nats/event
Full model Log loss : -2.49725
Full model ln_yyx : 2331.19432 nats/sec, 104.08150 nats/event
Full model Log loss : -2.51104
Full model ln_yyx : 2327.56848 nats/sec, 103.91962 nats/event
Full model Log loss : -2.51088
Full model ln_yyx : 2319.75903 nats/sec, 103.57095 nats/event
Full model Log loss : -2.51007
Full model ln_yyx : 2327.00899 nats/sec, 103.89464 nats/event
Full model Log loss : -2.51083
Full model ln_yyx : 2313.67030 nats/sec, 103.29910 nats/event
Full model Log loss : -2.51293
Full model ln_yyx : 2297.75247 nats/sec, 102.58841 nats/event
Full model Log loss : -2.49668
Full model ln_yyx : 2333.11896 nats/sec, 104.16743 nats/event
Full model Log loss : -2.51064
Full model ln_yyx : 2324.05425 nats/sec, 103.76272 nats/event
Full model Log loss : -2.51127
Full model ln_yyx : 2331.31862 nats/sec, 104.08705 nats/event
Full model Log loss : -2.51229
Full model ln_yyx : 2337.39758 nats/sec, 104.35846 nats/event
Full model Log loss : -2.51201
Full model ln_yyx : 2345.39264 nats/sec, 104.71542 nats/event
Full model Log loss : -2.51173
Full model ln_yyx : 2323.30574 nats/sec, 103.72930 nats/event
Full model Log loss : -2.51261
Optimization finished. Config saved to results/opt-full/opt_full_297_best_config.txt
[I 2026-03-18 20:36:09,869] Trial 46 pruned. 
[I 2026-03-18 20:36:17,789] Trial 47 pruned. 
[I 2026-03-18 20:36:33,716] Trial 48 pruned. 
[I 2026-03-18 20:36:41,062] Trial 49 finished with value: -2.5094127446379315 and parameters: {'n_layers_yyx': 2, 'hidden_size_yyx_l0': 6, 'hidden_size_yyx_l1': 6, 'context_size_yyx': 1, 'num_mix_components_yyx': 5, 'context_extractor_yyx': 'lstm', 'activation_func_yyx': 'Tanh', 'L2_weight_yyx': 4.032033030211815e-09, 'L_entropy_weight_yyx': 6.858092300566886e-08, 'L_sep_weight_yyx': 3.255282148807975e-10, 'L_scale_weight_yyx': 8.492450771223925e-10, 'learning_rate_yyx': 0.008226945523920587}. Best is trial 36 with value: -2.5139452208666837.

Source events: 27060
Target events: 31112
Full model ln_yyx : 3544.17392 nats/sec, 102.52496 nats/event
Full model Log loss : -2.49554
Full model ln_yyx : 3592.41727 nats/sec, 103.92053 nats/event
Full model Log loss : -2.51186
Full model ln_yyx : 3580.51153 nats/sec, 103.57612 nats/event
Full model Log loss : -2.51084
Full model ln_yyx : 3570.19164 nats/sec, 103.27759 nats/event
Full model Log loss : -2.50748
Full model ln_yyx : 3540.96526 nats/sec, 102.43214 nats/event
Full model Log loss : -2.49139
Full model ln_yyx : 3550.91934 nats/sec, 102.72009 nats/event
Full model Log loss : -2.50052
Full model ln_yyx : 3589.69285 nats/sec, 103.84172 nats/event
Full model Log loss : -2.50833
Full model ln_yyx : 3574.00710 nats/sec, 103.38797 nats/event
Full model Log loss : -2.50919
Full model ln_yyx : 3573.55831 nats/sec, 103.37498 nats/event
Full model Log loss : -2.50914
Full model ln_yyx : 3592.61225 nats/sec, 103.92617 nats/event
Full model Log loss : -2.50947
Full model ln_yyx : 3580.18455 nats/sec, 103.56667 nats/event
Full model Log loss : -2.51395
Full model ln_yyx : 3544.32251 nats/sec, 102.52926 nats/event
Full model Log loss : -2.47942
Full model ln_yyx : 3593.14099 nats/sec, 103.94147 nats/event
Full model Log loss : -2.51201
Full model ln_yyx : 3597.13748 nats/sec, 104.05708 nats/event
Full model Log loss : -2.51153
Full model ln_yyx : 3593.18738 nats/sec, 103.94281 nats/event
Full model Log loss : -2.51140
Full model ln_yyx : 3595.77602 nats/sec, 104.01769 nats/event
Full model Log loss : -2.51151
Full model ln_yyx : 3576.18203 nats/sec, 103.45088 nats/event
Full model Log loss : -2.50941
Optimization finished. Config saved to results/opt-full/opt_full_288_best_config.txt
[I 2026-03-18 20:36:59,535] Trial 43 finished with value: -2.509641506759543 and parameters: {'n_layers_yyx': 1, 'hidden_size_yyx_l0': 5, 'context_size_yyx': 4, 'num_mix_components_yyx': 5, 'context_extractor_yyx': 'gru', 'activation_func_yyx': 'GELU', 'L2_weight_yyx': 8.121122389677902e-10, 'L_entropy_weight_yyx': 6.429961256886458e-07, 'L_sep_weight_yyx': 3.4219660112760503e-09, 'L_scale_weight_yyx': 4.022592317751109e-06, 'learning_rate_yyx': 0.008500933252369464}. Best is trial 26 with value: -2.512613867095458.
[I 2026-03-18 20:37:14,001] Trial 44 pruned. 
[I 2026-03-18 20:38:21,625] Trial 45 finished with value: -2.5096347301889432 and parameters: {'n_layers_yyx': 1, 'hidden_size_yyx_l0': 5, 'context_size_yyx': 4, 'num_mix_components_yyx': 5, 'context_extractor_yyx': 'gru', 'activation_func_yyx': 'GELU', 'L2_weight_yyx': 3.5561847842942405e-09, 'L_entropy_weight_yyx': 1.9195163890322315e-05, 'L_sep_weight_yyx': 8.78347360707898e-09, 'L_scale_weight_yyx': 2.5445968265350187e-05, 'learning_rate_yyx': 0.008491455981970854}. Best is trial 26 with value: -2.512613867095458.
[I 2026-03-18 20:38:25,495] Trial 49 pruned. 

Source events: 27060
Target events: 10683
Full model ln_yyx : 1229.48581 nats/sec, 103.57926 nats/event
Full model Log loss : -2.51240
Full model ln_yyx : 1224.79800 nats/sec, 103.18433 nats/event
Full model Log loss : -2.50781
Full model ln_yyx : 1233.25097 nats/sec, 103.89646 nats/event
Full model Log loss : -2.51208
Full model ln_yyx : 1236.45639 nats/sec, 104.16650 nats/event
Full model Log loss : -2.51403
Full model ln_yyx : 1227.46984 nats/sec, 103.40942 nats/event
Full model Log loss : -2.49528
Full model ln_yyx : 1228.89116 nats/sec, 103.52916 nats/event
Full model Log loss : -2.51181
Full model ln_yyx : 1227.98642 nats/sec, 103.45294 nats/event
Full model Log loss : -2.51269
Full model ln_yyx : 1227.89932 nats/sec, 103.44560 nats/event
Full model Log loss : -2.51276
Full model ln_yyx : 1243.12983 nats/sec, 104.72871 nats/event
Full model Log loss : -2.51050
Full model ln_yyx : 1231.89112 nats/sec, 103.78190 nats/event
Full model Log loss : -2.51396
Full model ln_yyx : 1240.26248 nats/sec, 104.48715 nats/event
Full model Log loss : -2.51240
Full model ln_yyx : 1238.47668 nats/sec, 104.33670 nats/event
Full model Log loss : -2.51357
Full model ln_yyx : 1231.64486 nats/sec, 103.76115 nats/event
Full model Log loss : -2.51341
Full model ln_yyx : 1234.39372 nats/sec, 103.99273 nats/event
Full model Log loss : -2.51377
Full model ln_yyx : 1231.15823 nats/sec, 103.72015 nats/event
Full model Log loss : -2.51354
Full model ln_yyx : 1223.13971 nats/sec, 103.04463 nats/event
Full model Log loss : -2.50986
Full model ln_yyx : 1232.73988 nats/sec, 103.85340 nats/event
Full model Log loss : -2.50896
Full model ln_yyx : 1230.70874 nats/sec, 103.68229 nats/event
Full model Log loss : -2.51351
Full model ln_yyx : 1238.08355 nats/sec, 104.30358 nats/event
Full model Log loss : -2.51370
Full model ln_yyx : 1229.08720 nats/sec, 103.54568 nats/event
Full model Log loss : -2.51299
Full model ln_yyx : 1234.74199 nats/sec, 104.02207 nats/event
Full model Log loss : -2.51394
Optimization finished. Config saved to results/opt-full/opt_full_294_best_config.txt
[I 2026-03-18 20:38:37,951] Trial 46 pruned. 
[I 2026-03-18 20:38:45,378] Trial 47 pruned. 
[I 2026-03-18 20:38:52,621] Trial 48 pruned. 
[I 2026-03-18 20:39:00,255] Trial 49 pruned. 

Source events: 27060
Target events: 24874
Full model ln_yyx : 2857.91621 nats/sec, 103.40615 nats/event
Full model Log loss : -2.51175
Full model ln_yyx : 2822.62149 nats/sec, 102.12910 nats/event
Full model Log loss : -2.49102
Full model ln_yyx : 2834.06727 nats/sec, 102.54324 nats/event
Full model Log loss : -2.50467
Full model ln_yyx : 2864.91923 nats/sec, 103.65954 nats/event
Full model Log loss : -2.51003
Full model ln_yyx : 2865.64970 nats/sec, 103.68597 nats/event
Full model Log loss : -2.51028
Full model ln_yyx : 2797.67081 nats/sec, 101.22633 nats/event
Full model Log loss : -2.46332
Full model ln_yyx : 2866.40759 nats/sec, 103.71339 nats/event
Full model Log loss : -2.51036
Full model ln_yyx : 2851.89167 nats/sec, 103.18817 nats/event
Full model Log loss : -2.51058
Full model ln_yyx : 2866.56519 nats/sec, 103.71909 nats/event
Full model Log loss : -2.50930
Full model ln_yyx : 2848.85469 nats/sec, 103.07828 nats/event
Full model Log loss : -2.50814
Full model ln_yyx : 2862.87459 nats/sec, 103.58556 nats/event
Full model Log loss : -2.51261
Full model ln_yyx : 2829.40723 nats/sec, 102.37463 nats/event
Full model Log loss : -2.49480
Full model ln_yyx : 2849.60897 nats/sec, 103.10557 nats/event
Full model Log loss : -2.49698
Full model ln_yyx : 2846.86670 nats/sec, 103.00635 nats/event
Full model Log loss : -2.50814
Full model ln_yyx : 2856.85758 nats/sec, 103.36785 nats/event
Full model Log loss : -2.51222
Full model ln_yyx : 2850.93490 nats/sec, 103.15355 nats/event
Full model Log loss : -2.49402
Full model ln_yyx : 2850.14476 nats/sec, 103.12496 nats/event
Full model Log loss : -2.51064
Full model ln_yyx : 2864.66128 nats/sec, 103.65020 nats/event
Full model Log loss : -2.50964
Full model ln_yyx : 2864.65404 nats/sec, 103.64994 nats/event
Full model Log loss : -2.50963
Optimization finished. Config saved to results/opt-full/opt_full_296_best_config.txt
