[I 2026-03-18 18:59:00,857] Trial 8 finished with value: -0.823189559327975 and parameters: {'n_layers_yyx': 2, 'hidden_size_yyx_l0': 3, 'hidden_size_yyx_l1': 6, 'context_size_yyx': 2, 'num_mix_components_yyx': 5, 'context_extractor_yyx': 'lstm', 'activation_func_yyx': 'Tanh', 'L2_weight_yyx': 1.2355980552732019e-07, 'L_entropy_weight_yyx': 9.027902386131392e-07, 'L_sep_weight_yyx': 0.0001178360011146492, 'L_scale_weight_yyx': 1.509547484355926e-07, 'learning_rate_yyx': 0.0020067059238609744}. Best is trial 1 with value: -0.8348051941729366.
[I 2026-03-18 18:59:02,613] Trial 11 pruned. 
[I 2026-03-18 18:59:02,960] Trial 9 pruned. 
[I 2026-03-18 18:59:03,657] Trial 16 finished with value: -0.7989643271599773 and parameters: {'n_layers_yyx': 1, 'hidden_size_yyx_l0': 5, 'context_size_yyx': 2, 'num_mix_components_yyx': 5, 'context_extractor_yyx': 'gru', 'activation_func_yyx': 'Tanh', 'L2_weight_yyx': 5.889797677801633e-06, 'L_entropy_weight_yyx': 2.534038388267818e-09, 'L_sep_weight_yyx': 2.2569700901190758e-08, 'L_scale_weight_yyx': 9.639467891631254e-10, 'learning_rate_yyx': 0.0010761370075128179}. Best is trial 2 with value: -0.8277896221842689.
[I 2026-03-18 18:59:07,305] Trial 9 pruned. 
[I 2026-03-18 18:59:09,393] Trial 22 pruned. 
[I 2026-03-18 18:59:11,902] Trial 9 pruned. 
[I 2026-03-18 18:59:13,349] Trial 18 pruned. 
[I 2026-03-18 18:59:18,197] Trial 17 pruned. 
[I 2026-03-18 18:59:18,279] Trial 10 finished with value: -0.8371109842725836 and parameters: {'n_layers_yyx': 1, 'hidden_size_yyx_l0': 2, 'context_size_yyx': 4, 'num_mix_components_yyx': 3, 'context_extractor_yyx': 'gru', 'activation_func_yyx': 'ReLU', 'L2_weight_yyx': 1.3245161546460228e-06, 'L_entropy_weight_yyx': 7.745151884054319e-07, 'L_sep_weight_yyx': 5.239103994253271e-05, 'L_scale_weight_yyx': 4.5710242462874025e-10, 'learning_rate_yyx': 0.006959472219234622}. Best is trial 10 with value: -0.8371109842725836.
[I 2026-03-18 18:59:22,131] Trial 28 pruned. 
[I 2026-03-18 18:59:24,437] Trial 8 pruned. 
[I 2026-03-18 18:59:25,877] Trial 19 pruned. 
[I 2026-03-18 18:59:32,801] Trial 10 pruned. 
[I 2026-03-18 18:59:32,952] Trial 6 finished with value: -2.2793509923404986 and parameters: {'n_layers_yyx': 2, 'hidden_size_yyx_l0': 5, 'hidden_size_yyx_l1': 3, 'context_size_yyx': 2, 'num_mix_components_yyx': 2, 'context_extractor_yyx': 'lstm', 'activation_func_yyx': 'ReLU', 'L2_weight_yyx': 0.0004216287458835646, 'L_entropy_weight_yyx': 3.77271482145356e-05, 'L_sep_weight_yyx': 0.0004505224218676929, 'L_scale_weight_yyx': 5.265888478470861e-09, 'learning_rate_yyx': 0.007632079823497923}. Best is trial 1 with value: -2.2866954714752907.
[I 2026-03-18 18:59:34,179] Trial 29 pruned. 
[I 2026-03-18 18:59:36,049] Trial 3 finished with value: -1.7692011177321136 and parameters: {'n_layers_yyx': 2, 'hidden_size_yyx_l0': 6, 'hidden_size_yyx_l1': 5, 'context_size_yyx': 2, 'num_mix_components_yyx': 2, 'context_extractor_yyx': 'lstm', 'activation_func_yyx': 'Tanh', 'L2_weight_yyx': 3.42314629585301e-05, 'L_entropy_weight_yyx': 5.668334941437297e-09, 'L_sep_weight_yyx': 9.704566619752732e-07, 'L_scale_weight_yyx': 2.211207089339454e-08, 'learning_rate_yyx': 0.0005640528752903159}. Best is trial 2 with value: -1.776406202226865.
[I 2026-03-18 18:59:40,022] Trial 20 pruned. 
[I 2026-03-18 18:59:42,501] Trial 6 finished with value: -2.2559780043841933 and parameters: {'n_layers_yyx': 2, 'hidden_size_yyx_l0': 3, 'hidden_size_yyx_l1': 5, 'context_size_yyx': 2, 'num_mix_components_yyx': 2, 'context_extractor_yyx': 'gru', 'activation_func_yyx': 'ReLU', 'L2_weight_yyx': 1.240948798012073e-10, 'L_entropy_weight_yyx': 1.9388957686117527e-05, 'L_sep_weight_yyx': 1.1842966219684686e-10, 'L_scale_weight_yyx': 1.0075088332725142e-10, 'learning_rate_yyx': 0.000704341015367801}. Best is trial 1 with value: -2.279694369835903.
[I 2026-03-18 18:59:43,827] Trial 7 pruned. 
[I 2026-03-18 18:59:44,773] Trial 7 pruned. 
[I 2026-03-18 18:59:47,724] Trial 11 finished with value: -0.8342068783465657 and parameters: {'n_layers_yyx': 1, 'hidden_size_yyx_l0': 2, 'context_size_yyx': 2, 'num_mix_components_yyx': 5, 'context_extractor_yyx': 'gru', 'activation_func_yyx': 'Tanh', 'L2_weight_yyx': 0.0009125513928101696, 'L_entropy_weight_yyx': 3.468929170074672e-08, 'L_sep_weight_yyx': 1.424944824104057e-06, 'L_scale_weight_yyx': 1.61961281660585e-09, 'learning_rate_yyx': 0.009047964815539761}. Best is trial 10 with value: -0.8345733146723827.
[I 2026-03-18 18:59:49,177] Trial 25 finished with value: -0.8114715080317577 and parameters: {'n_layers_yyx': 2, 'hidden_size_yyx_l0': 3, 'hidden_size_yyx_l1': 5, 'context_size_yyx': 3, 'num_mix_components_yyx': 1, 'context_extractor_yyx': 'lstm', 'activation_func_yyx': 'ReLU', 'L2_weight_yyx': 3.953251324046497e-06, 'L_entropy_weight_yyx': 9.059135994958368e-05, 'L_sep_weight_yyx': 9.468777898018453e-07, 'L_scale_weight_yyx': 0.00040200866063023794, 'learning_rate_yyx': 0.0044200695879601645}. Best is trial 0 with value: -0.8279563193835395.
[I 2026-03-18 18:59:52,094] Trial 8 pruned. 
[I 2026-03-18 18:59:53,551] Trial 21 pruned. 
[I 2026-03-18 18:59:55,376] Trial 26 pruned. 
[I 2026-03-18 19:00:00,397] Trial 9 pruned. 
[I 2026-03-18 19:00:00,631] Trial 18 finished with value: -0.9029266952217251 and parameters: {'n_layers_yyx': 1, 'hidden_size_yyx_l0': 6, 'context_size_yyx': 3, 'num_mix_components_yyx': 2, 'context_extractor_yyx': 'gru', 'activation_func_yyx': 'Tanh', 'L2_weight_yyx': 1.9052489642988093e-07, 'L_entropy_weight_yyx': 3.2999669822585907e-10, 'L_sep_weight_yyx': 2.782644449122594e-05, 'L_scale_weight_yyx': 5.277283435456679e-05, 'learning_rate_yyx': 0.006276091273518521}. Best is trial 12 with value: -0.9172403773089042.
[I 2026-03-18 19:00:05,384] Trial 30 pruned. 
[I 2026-03-18 19:00:07,500] Trial 22 pruned. 
[I 2026-03-18 19:00:07,554] Trial 19 finished with value: -0.820722255960349 and parameters: {'n_layers_yyx': 1, 'hidden_size_yyx_l0': 6, 'context_size_yyx': 3, 'num_mix_components_yyx': 5, 'context_extractor_yyx': 'lstm', 'activation_func_yyx': 'GELU', 'L2_weight_yyx': 1.453612480678705e-07, 'L_entropy_weight_yyx': 1.1465722866563436e-10, 'L_sep_weight_yyx': 1.3876110361452058e-09, 'L_scale_weight_yyx': 1.0209827751677581e-10, 'learning_rate_yyx': 0.005467304954707198}. Best is trial 0 with value: -0.8324342893885016.
[I 2026-03-18 19:00:07,771] Trial 19 pruned. 
[I 2026-03-18 19:00:08,371] Trial 27 pruned. 
[I 2026-03-18 19:00:08,825] Trial 23 finished with value: -0.8189144613471658 and parameters: {'n_layers_yyx': 2, 'hidden_size_yyx_l0': 2, 'hidden_size_yyx_l1': 5, 'context_size_yyx': 3, 'num_mix_components_yyx': 3, 'context_extractor_yyx': 'gru', 'activation_func_yyx': 'Tanh', 'L2_weight_yyx': 2.2986348194834876e-08, 'L_entropy_weight_yyx': 1.6805923365751972e-09, 'L_sep_weight_yyx': 2.2366719438410923e-08, 'L_scale_weight_yyx': 5.53731550112831e-10, 'learning_rate_yyx': 0.005332230561815534}. Best is trial 8 with value: -0.8257869568321871.
[I 2026-03-18 19:00:09,170] Trial 12 finished with value: -0.8288468286240999 and parameters: {'n_layers_yyx': 1, 'hidden_size_yyx_l0': 3, 'context_size_yyx': 4, 'num_mix_components_yyx': 4, 'context_extractor_yyx': 'gru', 'activation_func_yyx': 'Tanh', 'L2_weight_yyx': 1.8707076970985914e-08, 'L_entropy_weight_yyx': 2.7690695970683e-06, 'L_sep_weight_yyx': 8.044140960192045e-07, 'L_scale_weight_yyx': 1.7615823138451665e-10, 'learning_rate_yyx': 0.009459125371687515}. Best is trial 2 with value: -0.8370103483890325.
[I 2026-03-18 19:00:09,944] Trial 7 finished with value: -2.2577418873964348 and parameters: {'n_layers_yyx': 2, 'hidden_size_yyx_l0': 2, 'hidden_size_yyx_l1': 6, 'context_size_yyx': 1, 'num_mix_components_yyx': 2, 'context_extractor_yyx': 'lstm', 'activation_func_yyx': 'ReLU', 'L2_weight_yyx': 0.00016023816655044351, 'L_entropy_weight_yyx': 1.1898972866484143e-08, 'L_sep_weight_yyx': 4.955810869275219e-05, 'L_scale_weight_yyx': 1.5506801790860505e-08, 'learning_rate_yyx': 0.007666472950877712}. Best is trial 6 with value: -2.268126138873415.
[I 2026-03-18 19:00:10,407] Trial 10 pruned. 
[I 2026-03-18 19:00:14,314] Trial 20 pruned. 
[I 2026-03-18 19:00:16,243] Trial 28 pruned. 
[I 2026-03-18 19:00:18,327] Trial 7 finished with value: -1.754708190301452 and parameters: {'n_layers_yyx': 2, 'hidden_size_yyx_l0': 5, 'hidden_size_yyx_l1': 4, 'context_size_yyx': 3, 'num_mix_components_yyx': 2, 'context_extractor_yyx': 'lstm', 'activation_func_yyx': 'GELU', 'L2_weight_yyx': 2.6150374580170003e-09, 'L_entropy_weight_yyx': 5.0431896916399054e-08, 'L_sep_weight_yyx': 3.819676817984512e-09, 'L_scale_weight_yyx': 3.74403990685221e-05, 'learning_rate_yyx': 0.0007648754082255335}. Best is trial 4 with value: -1.784507205847538.
[I 2026-03-18 19:00:19,461] Trial 6 finished with value: -2.175471593632889 and parameters: {'n_layers_yyx': 2, 'hidden_size_yyx_l0': 5, 'hidden_size_yyx_l1': 4, 'context_size_yyx': 2, 'num_mix_components_yyx': 2, 'context_extractor_yyx': 'gru', 'activation_func_yyx': 'ReLU', 'L2_weight_yyx': 6.921075635694292e-06, 'L_entropy_weight_yyx': 7.349504956276484e-06, 'L_sep_weight_yyx': 1.8333009761780232e-09, 'L_scale_weight_yyx': 2.5861969634645557e-05, 'learning_rate_yyx': 0.0014190877201943162}. Best is trial 2 with value: -2.2083321590322043.
[I 2026-03-18 19:00:20,084] Trial 4 pruned. 
[I 2026-03-18 19:00:20,492] Trial 9 finished with value: -2.2668390094285495 and parameters: {'n_layers_yyx': 1, 'hidden_size_yyx_l0': 5, 'context_size_yyx': 3, 'num_mix_components_yyx': 2, 'context_extractor_yyx': 'lstm', 'activation_func_yyx': 'ReLU', 'L2_weight_yyx': 9.05183857638693e-05, 'L_entropy_weight_yyx': 8.425776607026733e-07, 'L_sep_weight_yyx': 1.3245637041780413e-07, 'L_scale_weight_yyx': 2.9292354209754674e-05, 'learning_rate_yyx': 0.001079731965177617}. Best is trial 1 with value: -2.2881647079635865.
[I 2026-03-18 19:00:20,827] Trial 23 pruned. 
[I 2026-03-18 19:00:21,078] Trial 20 pruned. 
[I 2026-03-18 19:00:21,243] Trial 21 pruned. 
[I 2026-03-18 19:00:22,569] Trial 13 pruned. 
[I 2026-03-18 19:00:23,284] Trial 24 pruned. 
[I 2026-03-18 19:00:23,601] Trial 18 finished with value: -0.8278672008429884 and parameters: {'n_layers_yyx': 1, 'hidden_size_yyx_l0': 5, 'context_size_yyx': 4, 'num_mix_components_yyx': 2, 'context_extractor_yyx': 'lstm', 'activation_func_yyx': 'GELU', 'L2_weight_yyx': 1.121713639058799e-06, 'L_entropy_weight_yyx': 1.183644646532176e-10, 'L_sep_weight_yyx': 0.0003330752835577704, 'L_scale_weight_yyx': 2.8139496803238284e-07, 'learning_rate_yyx': 0.005745477393233529}. Best is trial 18 with value: -0.8278672008429884.
[I 2026-03-18 19:00:24,311] Trial 11 pruned. 
[I 2026-03-18 19:00:26,223] Trial 5 pruned. 
[I 2026-03-18 19:00:27,195] Trial 7 finished with value: -0.8129149398916405 and parameters: {'n_layers_yyx': 1, 'hidden_size_yyx_l0': 2, 'context_size_yyx': 1, 'num_mix_components_yyx': 1, 'context_extractor_yyx': 'lstm', 'activation_func_yyx': 'Tanh', 'L2_weight_yyx': 1.6914093325386028e-06, 'L_entropy_weight_yyx': 1.463745813198114e-07, 'L_sep_weight_yyx': 1.319394103938411e-06, 'L_scale_weight_yyx': 0.0004612278237943668, 'learning_rate_yyx': 0.0053775120877554185}. Best is trial 1 with value: -0.8235284532014517.
[I 2026-03-18 19:00:27,565] Trial 11 pruned. 
[I 2026-03-18 19:00:28,533] Trial 6 finished with value: -1.7618846064028533 and parameters: {'n_layers_yyx': 2, 'hidden_size_yyx_l0': 6, 'hidden_size_yyx_l1': 4, 'context_size_yyx': 2, 'num_mix_components_yyx': 1, 'context_extractor_yyx': 'lstm', 'activation_func_yyx': 'ReLU', 'L2_weight_yyx': 3.4903081583021326e-10, 'L_entropy_weight_yyx': 7.934648705164932e-10, 'L_sep_weight_yyx': 6.450873962355332e-09, 'L_scale_weight_yyx': 2.2789206641954607e-08, 'learning_rate_yyx': 0.006322680034733146}. Best is trial 1 with value: -1.7684712210476057.
[I 2026-03-18 19:00:28,950] Trial 14 pruned. 
[I 2026-03-18 19:00:29,092] Trial 22 pruned. 
[I 2026-03-18 19:00:29,970] Trial 19 pruned. 
[I 2026-03-18 19:00:34,277] Trial 21 pruned. 
[I 2026-03-18 19:00:34,654] Trial 12 pruned. 
[I 2026-03-18 19:00:36,826] Trial 15 pruned. 
[I 2026-03-18 19:00:37,229] Trial 10 finished with value: -0.8355233715063007 and parameters: {'n_layers_yyx': 1, 'hidden_size_yyx_l0': 3, 'context_size_yyx': 1, 'num_mix_components_yyx': 5, 'context_extractor_yyx': 'gru', 'activation_func_yyx': 'Tanh', 'L2_weight_yyx': 1.6291484925668757e-10, 'L_entropy_weight_yyx': 1.0525135955490686e-10, 'L_sep_weight_yyx': 1.0290547847534382e-05, 'L_scale_weight_yyx': 5.016240810169921e-10, 'learning_rate_yyx': 0.007906383536820537}. Best is trial 10 with value: -0.8355233715063007.
[I 2026-03-18 19:00:37,803] Trial 7 pruned. 
[I 2026-03-18 19:00:41,701] Trial 10 finished with value: -2.2853422092545133 and parameters: {'n_layers_yyx': 2, 'hidden_size_yyx_l0': 5, 'hidden_size_yyx_l1': 6, 'context_size_yyx': 4, 'num_mix_components_yyx': 3, 'context_extractor_yyx': 'lstm', 'activation_func_yyx': 'ReLU', 'L2_weight_yyx': 5.8385615143302626e-08, 'L_entropy_weight_yyx': 0.0008284068662817377, 'L_sep_weight_yyx': 1.5010102254659578e-08, 'L_scale_weight_yyx': 2.525100436880836e-10, 'learning_rate_yyx': 0.009037774443227401}. Best is trial 10 with value: -2.2853422092545133.
[I 2026-03-18 19:00:41,982] Trial 10 pruned. 
[I 2026-03-18 19:00:43,017] Trial 11 finished with value: -0.8311195767964711 and parameters: {'n_layers_yyx': 1, 'hidden_size_yyx_l0': 2, 'context_size_yyx': 4, 'num_mix_components_yyx': 3, 'context_extractor_yyx': 'gru', 'activation_func_yyx': 'ReLU', 'L2_weight_yyx': 1.5251745859507706e-06, 'L_entropy_weight_yyx': 8.881862006405272e-07, 'L_sep_weight_yyx': 3.0049045219777877e-05, 'L_scale_weight_yyx': 1.5332636231355138e-10, 'learning_rate_yyx': 0.009050017858441797}. Best is trial 10 with value: -0.8371109842725836.
[I 2026-03-18 19:00:43,984] Trial 16 pruned. 
[I 2026-03-18 19:00:44,334] Trial 13 pruned. 
[I 2026-03-18 19:00:45,181] Trial 12 pruned. 
[I 2026-03-18 19:00:46,178] Trial 6 pruned. 
[I 2026-03-18 19:00:46,272] Trial 8 pruned. 
[I 2026-03-18 19:00:49,746] Trial 29 pruned. 
[I 2026-03-18 19:00:54,344] Trial 14 pruned. 
[I 2026-03-18 19:00:54,730] Trial 9 pruned. 
[I 2026-03-18 19:00:56,513] Trial 30 pruned. 
[I 2026-03-18 19:01:02,503] Trial 31 finished with value: -0.8241069573947563 and parameters: {'n_layers_yyx': 1, 'hidden_size_yyx_l0': 6, 'context_size_yyx': 3, 'num_mix_components_yyx': 4, 'context_extractor_yyx': 'lstm', 'activation_func_yyx': 'GELU', 'L2_weight_yyx': 0.0004020868865294066, 'L_entropy_weight_yyx': 2.3825067263769132e-05, 'L_sep_weight_yyx': 6.101753720333032e-08, 'L_scale_weight_yyx': 9.532731788033854e-09, 'learning_rate_yyx': 0.00711879709834193}. Best is trial 1 with value: -0.8328681168211087.
[I 2026-03-18 19:01:02,729] Trial 20 pruned. 
[I 2026-03-18 19:01:02,967] Trial 11 pruned. 
[I 2026-03-18 19:01:03,660] Trial 13 pruned. 
[I 2026-03-18 19:01:03,873] Trial 31 pruned. 
[I 2026-03-18 19:01:05,847] Trial 5 pruned. 
[I 2026-03-18 19:01:06,865] Trial 7 pruned. 
[I 2026-03-18 19:01:11,168] Trial 5 finished with value: -2.2873410844744493 and parameters: {'n_layers_yyx': 1, 'hidden_size_yyx_l0': 6, 'context_size_yyx': 4, 'num_mix_components_yyx': 4, 'context_extractor_yyx': 'gru', 'activation_func_yyx': 'ReLU', 'L2_weight_yyx': 2.367948137800441e-06, 'L_entropy_weight_yyx': 0.00016242121515788957, 'L_sep_weight_yyx': 1.6792476651774033e-07, 'L_scale_weight_yyx': 4.175125503329197e-05, 'learning_rate_yyx': 0.0008466226026974092}. Best is trial 5 with value: -2.2873410844744493.
[I 2026-03-18 19:01:11,525] Trial 12 finished with value: -0.8341015318471889 and parameters: {'n_layers_yyx': 1, 'hidden_size_yyx_l0': 2, 'context_size_yyx': 2, 'num_mix_components_yyx': 5, 'context_extractor_yyx': 'gru', 'activation_func_yyx': 'Tanh', 'L2_weight_yyx': 4.423421353649007e-05, 'L_entropy_weight_yyx': 2.2681679858413498e-08, 'L_sep_weight_yyx': 7.034016287409044e-07, 'L_scale_weight_yyx': 3.3571899898410356e-10, 'learning_rate_yyx': 0.00944086037301349}. Best is trial 10 with value: -0.8345733146723827.
[I 2026-03-18 19:01:11,960] Trial 14 pruned. 
[I 2026-03-18 19:01:15,624] Trial 21 pruned. 
[I 2026-03-18 19:01:16,908] Trial 17 pruned. 
[I 2026-03-18 19:01:21,156] Trial 6 pruned. 
[I 2026-03-18 19:01:22,016] Trial 22 pruned. 
[I 2026-03-18 19:01:22,028] Trial 7 finished with value: -1.856194777715774 and parameters: {'n_layers_yyx': 2, 'hidden_size_yyx_l0': 6, 'hidden_size_yyx_l1': 6, 'context_size_yyx': 2, 'num_mix_components_yyx': 2, 'context_extractor_yyx': 'lstm', 'activation_func_yyx': 'ReLU', 'L2_weight_yyx': 7.337051702412811e-08, 'L_entropy_weight_yyx': 1.5819490290708987e-07, 'L_sep_weight_yyx': 2.1463550738176463e-09, 'L_scale_weight_yyx': 3.2318258367533177e-10, 'learning_rate_yyx': 0.0030625386209728813}. Best is trial 5 with value: -1.864091702761834.
[I 2026-03-18 19:01:22,682] Trial 10 finished with value: -2.2831751549112607 and parameters: {'n_layers_yyx': 1, 'hidden_size_yyx_l0': 5, 'context_size_yyx': 3, 'num_mix_components_yyx': 5, 'context_extractor_yyx': 'gru', 'activation_func_yyx': 'ReLU', 'L2_weight_yyx': 1.9385665762540972e-10, 'L_entropy_weight_yyx': 1.2195638735633577e-08, 'L_sep_weight_yyx': 6.836794579557095e-09, 'L_scale_weight_yyx': 8.714622410794514e-09, 'learning_rate_yyx': 0.009192441873537958}. Best is trial 10 with value: -2.2831751549112607.
[I 2026-03-18 19:01:24,466] Trial 6 pruned. 
[I 2026-03-18 19:01:26,744] Trial 22 finished with value: -0.9148309298719781 and parameters: {'n_layers_yyx': 1, 'hidden_size_yyx_l0': 6, 'context_size_yyx': 4, 'num_mix_components_yyx': 2, 'context_extractor_yyx': 'gru', 'activation_func_yyx': 'Tanh', 'L2_weight_yyx': 1.2551829777169478e-05, 'L_entropy_weight_yyx': 1.3822337256720066e-10, 'L_sep_weight_yyx': 1.2141220743072951e-05, 'L_scale_weight_yyx': 6.26255446347015e-05, 'learning_rate_yyx': 0.005428006600117333}. Best is trial 12 with value: -0.9172403773089042.
[I 2026-03-18 19:01:26,833] Trial 8 pruned. 
[I 2026-03-18 19:01:28,568] Trial 23 pruned. 
[I 2026-03-18 19:01:29,250] Trial 18 pruned. 
[I 2026-03-18 19:01:29,732] Trial 9 finished with value: -2.2632771643047636 and parameters: {'n_layers_yyx': 1, 'hidden_size_yyx_l0': 2, 'context_size_yyx': 4, 'num_mix_components_yyx': 2, 'context_extractor_yyx': 'lstm', 'activation_func_yyx': 'Tanh', 'L2_weight_yyx': 0.00034228740752599763, 'L_entropy_weight_yyx': 2.2388464025389192e-06, 'L_sep_weight_yyx': 0.0004681271522315475, 'L_scale_weight_yyx': 1.2337234547085571e-06, 'learning_rate_yyx': 0.006543581689039845}. Best is trial 2 with value: -2.272224617884258.
[I 2026-03-18 19:01:31,337] Trial 8 finished with value: -2.266658138328234 and parameters: {'n_layers_yyx': 2, 'hidden_size_yyx_l0': 5, 'hidden_size_yyx_l1': 6, 'context_size_yyx': 2, 'num_mix_components_yyx': 2, 'context_extractor_yyx': 'gru', 'activation_func_yyx': 'Tanh', 'L2_weight_yyx': 6.5124659154911445e-06, 'L_entropy_weight_yyx': 5.467189238077672e-09, 'L_sep_weight_yyx': 0.000505589382746686, 'L_scale_weight_yyx': 5.059676233066399e-05, 'learning_rate_yyx': 0.004548066530371764}. Best is trial 3 with value: -2.2699321951591234.
[I 2026-03-18 19:01:31,431] Trial 23 finished with value: -0.8294262118318408 and parameters: {'n_layers_yyx': 1, 'hidden_size_yyx_l0': 6, 'context_size_yyx': 4, 'num_mix_components_yyx': 5, 'context_extractor_yyx': 'gru', 'activation_func_yyx': 'ReLU', 'L2_weight_yyx': 1.520608088638795e-08, 'L_entropy_weight_yyx': 7.78200825223628e-09, 'L_sep_weight_yyx': 1.3937849859528628e-10, 'L_scale_weight_yyx': 1.074209750891927e-05, 'learning_rate_yyx': 0.0039012268209539084}. Best is trial 0 with value: -0.8324342893885016.
[I 2026-03-18 19:01:31,433] Trial 24 finished with value: -0.8079588987274395 and parameters: {'n_layers_yyx': 2, 'hidden_size_yyx_l0': 4, 'hidden_size_yyx_l1': 6, 'context_size_yyx': 2, 'num_mix_components_yyx': 1, 'context_extractor_yyx': 'gru', 'activation_func_yyx': 'ReLU', 'L2_weight_yyx': 8.570838572525673e-06, 'L_entropy_weight_yyx': 3.7249724634995756e-10, 'L_sep_weight_yyx': 9.038048939389821e-08, 'L_scale_weight_yyx': 9.152263606996029e-06, 'learning_rate_yyx': 0.00515756781540595}. Best is trial 2 with value: -0.8228697107672868.
[I 2026-03-18 19:01:36,686] Trial 19 pruned. 
[I 2026-03-18 19:01:38,617] Trial 10 pruned. 
[I 2026-03-18 19:01:39,501] Trial 10 pruned. 
[I 2026-03-18 19:01:39,549] Trial 23 pruned. 
[I 2026-03-18 19:01:39,959] Trial 9 pruned. 
[I 2026-03-18 19:01:44,578] Trial 25 pruned. 
[I 2026-03-18 19:01:45,518] Trial 15 pruned. 
[I 2026-03-18 19:01:50,930] Trial 10 pruned. 
[I 2026-03-18 19:01:51,928] Trial 26 pruned. 
[I 2026-03-18 19:01:52,201] Trial 25 pruned. 
[I 2026-03-18 19:01:57,620] Trial 8 pruned. 
[I 2026-03-18 19:01:58,087] Trial 8 finished with value: -2.2804669271630202 and parameters: {'n_layers_yyx': 1, 'hidden_size_yyx_l0': 6, 'context_size_yyx': 4, 'num_mix_components_yyx': 4, 'context_extractor_yyx': 'gru', 'activation_func_yyx': 'ReLU', 'L2_weight_yyx': 1.0747889053997885e-07, 'L_entropy_weight_yyx': 1.0079269987724622e-07, 'L_sep_weight_yyx': 7.3708150893901915e-06, 'L_scale_weight_yyx': 1.376679974015173e-10, 'learning_rate_yyx': 0.005188168843216265}. Best is trial 1 with value: -2.2866954714752907.
[I 2026-03-18 19:01:59,138] Trial 11 finished with value: -0.8306387108221012 and parameters: {'n_layers_yyx': 1, 'hidden_size_yyx_l0': 3, 'context_size_yyx': 1, 'num_mix_components_yyx': 5, 'context_extractor_yyx': 'gru', 'activation_func_yyx': 'Tanh', 'L2_weight_yyx': 1.1418511172967445e-10, 'L_entropy_weight_yyx': 2.5452601404956455e-08, 'L_sep_weight_yyx': 8.258133574598124e-06, 'L_scale_weight_yyx': 4.686769850145972e-10, 'learning_rate_yyx': 0.009850032665254495}. Best is trial 10 with value: -0.8355233715063007.
[I 2026-03-18 19:01:59,195] Trial 26 pruned. 
[I 2026-03-18 19:01:59,898] Trial 27 pruned. 
[I 2026-03-18 19:02:00,815] Trial 24 pruned. 
