Warning: Failed writing log files to directory [/var/log/nvidia-mps]. No logs will be available.
Error: Task ID 408 not found in hpc/tasks_full.csv
Warning: Task ID 408 not found. Exiting.
Error: Task ID 409 not found in hpc/tasks_full.csv
Warning: Task ID 409 not found. Exiting.
Error: Task ID 412 not found in hpc/tasks_full.csv
Warning: Task ID 412 not found. Exiting.
Error: Task ID 413 not found in hpc/tasks_full.csv
Warning: Task ID 413 not found. Exiting.
Error: Task ID 411 not found in hpc/tasks_full.csv
Warning: Task ID 411 not found. Exiting.
Error: Task ID 415 not found in hpc/tasks_full.csv
Warning: Task ID 415 not found. Exiting.
Error: Task ID 410 not found in hpc/tasks_full.csv
Warning: Task ID 410 not found. Exiting.
Error: Task ID 414 not found in hpc/tasks_full.csv
Warning: Task ID 414 not found. Exiting.
[I 2026-03-18 19:20:47,763] A new study created in RDB with name: opt_full-model_seed=42_task=394
[I 2026-03-18 19:20:47,764] A new study created in RDB with name: opt_full-model_seed=42_task=387
[I 2026-03-18 19:20:47,764] A new study created in RDB with name: opt_full-model_seed=42_task=404
[I 2026-03-18 19:20:47,763] A new study created in RDB with name: opt_full-model_seed=42_task=388
[I 2026-03-18 19:20:47,765] A new study created in RDB with name: opt_full-model_seed=42_task=395
[I 2026-03-18 19:20:47,764] A new study created in RDB with name: opt_full-model_seed=42_task=386
[I 2026-03-18 19:20:47,764] A new study created in RDB with name: opt_full-model_seed=42_task=391
[I 2026-03-18 19:20:47,764] A new study created in RDB with name: opt_full-model_seed=42_task=406
[I 2026-03-18 19:20:48,098] A new study created in RDB with name: opt_full-model_seed=42_task=407
[I 2026-03-18 19:20:48,101] A new study created in RDB with name: opt_full-model_seed=42_task=399
[I 2026-03-18 19:20:48,113] A new study created in RDB with name: opt_full-model_seed=42_task=401
[I 2026-03-18 19:20:48,115] A new study created in RDB with name: opt_full-model_seed=42_task=400
[I 2026-03-18 19:20:48,117] A new study created in RDB with name: opt_full-model_seed=42_task=392
[I 2026-03-18 19:20:48,119] A new study created in RDB with name: opt_full-model_seed=42_task=390
[I 2026-03-18 19:20:48,119] A new study created in RDB with name: opt_full-model_seed=42_task=405
[I 2026-03-18 19:20:48,119] A new study created in RDB with name: opt_full-model_seed=42_task=398
[I 2026-03-18 19:20:48,120] A new study created in RDB with name: opt_full-model_seed=42_task=384
[I 2026-03-18 19:20:48,120] A new study created in RDB with name: opt_full-model_seed=42_task=397
[I 2026-03-18 19:20:48,122] A new study created in RDB with name: opt_full-model_seed=42_task=402
[I 2026-03-18 19:20:48,123] A new study created in RDB with name: opt_full-model_seed=42_task=385
[I 2026-03-18 19:20:48,124] A new study created in RDB with name: opt_full-model_seed=42_task=396
[I 2026-03-18 19:20:48,124] A new study created in RDB with name: opt_full-model_seed=42_task=393
[I 2026-03-18 19:20:48,127] A new study created in RDB with name: opt_full-model_seed=42_task=389
[I 2026-03-18 19:20:48,127] A new study created in RDB with name: opt_full-model_seed=42_task=403
[I 2026-03-18 19:22:44,311] Trial 0 finished with value: -1.6069830560914067 and parameters: {'n_layers_yyx': 1, 'hidden_size_yyx_l0': 6, 'context_size_yyx': 4, 'num_mix_components_yyx': 2, 'context_extractor_yyx': 'lstm', 'activation_func_yyx': 'GELU', 'L2_weight_yyx': 2.1109259713066118e-10, 'L_entropy_weight_yyx': 3.097633154459078e-06, 'L_sep_weight_yyx': 1.2860446186013522e-06, 'L_scale_weight_yyx': 1.9030208719373987e-08, 'learning_rate_yyx': 0.00872143929170659}. Best is trial 0 with value: -1.6069830560914067.
[I 2026-03-18 19:23:40,605] Trial 0 finished with value: -1.6093905696412754 and parameters: {'n_layers_yyx': 2, 'hidden_size_yyx_l0': 2, 'hidden_size_yyx_l1': 5, 'context_size_yyx': 2, 'num_mix_components_yyx': 5, 'context_extractor_yyx': 'gru', 'activation_func_yyx': 'ReLU', 'L2_weight_yyx': 2.5536042252020936e-06, 'L_entropy_weight_yyx': 4.003505483758644e-06, 'L_sep_weight_yyx': 1.8060212608700004e-05, 'L_scale_weight_yyx': 1.0727846186676382e-05, 'learning_rate_yyx': 0.008572056516865172}. Best is trial 0 with value: -1.6093905696412754.
[I 2026-03-18 19:24:04,267] Trial 0 finished with value: -1.6395011021807235 and parameters: {'n_layers_yyx': 1, 'hidden_size_yyx_l0': 3, 'context_size_yyx': 4, 'num_mix_components_yyx': 3, 'context_extractor_yyx': 'gru', 'activation_func_yyx': 'GELU', 'L2_weight_yyx': 3.6917858824457323e-08, 'L_entropy_weight_yyx': 6.083664074003812e-07, 'L_sep_weight_yyx': 4.0439775700451995e-05, 'L_scale_weight_yyx': 1.5878638304391302e-06, 'learning_rate_yyx': 0.003931738968398698}. Best is trial 0 with value: -1.6395011021807235.
[I 2026-03-18 19:24:04,309] Trial 0 finished with value: -1.6285068337759567 and parameters: {'n_layers_yyx': 1, 'hidden_size_yyx_l0': 5, 'context_size_yyx': 1, 'num_mix_components_yyx': 1, 'context_extractor_yyx': 'lstm', 'activation_func_yyx': 'GELU', 'L2_weight_yyx': 7.2541385939993335e-09, 'L_entropy_weight_yyx': 1.0371811287517821e-08, 'L_sep_weight_yyx': 4.626795849100122e-09, 'L_scale_weight_yyx': 4.497683371081251e-09, 'learning_rate_yyx': 0.003825308985439772}. Best is trial 0 with value: -1.6285068337759567.
[I 2026-03-18 19:24:05,858] Trial 0 finished with value: -2.0812970228057153 and parameters: {'n_layers_yyx': 2, 'hidden_size_yyx_l0': 4, 'hidden_size_yyx_l1': 6, 'context_size_yyx': 4, 'num_mix_components_yyx': 3, 'context_extractor_yyx': 'lstm', 'activation_func_yyx': 'GELU', 'L2_weight_yyx': 7.570748557537103e-05, 'L_entropy_weight_yyx': 1.78779239221462e-05, 'L_sep_weight_yyx': 4.714361651876257e-10, 'L_scale_weight_yyx': 3.4291454375887253e-08, 'learning_rate_yyx': 0.000672453950646556}. Best is trial 0 with value: -2.0812970228057153.
[I 2026-03-18 19:24:21,491] Trial 1 pruned. 
[I 2026-03-18 19:24:21,634] Trial 1 pruned. 
[I 2026-03-18 19:24:26,099] Trial 0 finished with value: -2.078490826827014 and parameters: {'n_layers_yyx': 2, 'hidden_size_yyx_l0': 3, 'hidden_size_yyx_l1': 4, 'context_size_yyx': 3, 'num_mix_components_yyx': 2, 'context_extractor_yyx': 'gru', 'activation_func_yyx': 'GELU', 'L2_weight_yyx': 2.9286769412875513e-10, 'L_entropy_weight_yyx': 2.0577464203082423e-09, 'L_sep_weight_yyx': 1.1256256179118662e-10, 'L_scale_weight_yyx': 1.1673482732387374e-07, 'learning_rate_yyx': 0.007502221393718441}. Best is trial 0 with value: -2.078490826827014.
[I 2026-03-18 19:24:27,287] Trial 0 finished with value: -2.059541723542054 and parameters: {'n_layers_yyx': 1, 'hidden_size_yyx_l0': 6, 'context_size_yyx': 1, 'num_mix_components_yyx': 2, 'context_extractor_yyx': 'gru', 'activation_func_yyx': 'GELU', 'L2_weight_yyx': 1.0641155985852587e-10, 'L_entropy_weight_yyx': 1.328431957110486e-06, 'L_sep_weight_yyx': 3.8359371199597896e-08, 'L_scale_weight_yyx': 6.400272319471105e-07, 'learning_rate_yyx': 0.004263131827772239}. Best is trial 0 with value: -2.059541723542054.
[I 2026-03-18 19:24:27,287] Trial 0 finished with value: -1.6134249177836442 and parameters: {'n_layers_yyx': 1, 'hidden_size_yyx_l0': 6, 'context_size_yyx': 2, 'num_mix_components_yyx': 4, 'context_extractor_yyx': 'lstm', 'activation_func_yyx': 'Tanh', 'L2_weight_yyx': 1.2754201735373185e-08, 'L_entropy_weight_yyx': 3.6720677567515405e-06, 'L_sep_weight_yyx': 2.8690640749256585e-06, 'L_scale_weight_yyx': 1.1261508013814974e-09, 'learning_rate_yyx': 0.0013986651271836908}. Best is trial 0 with value: -1.6134249177836442.
[I 2026-03-18 19:24:27,310] Trial 0 finished with value: -1.5887905827024746 and parameters: {'n_layers_yyx': 1, 'hidden_size_yyx_l0': 6, 'context_size_yyx': 1, 'num_mix_components_yyx': 4, 'context_extractor_yyx': 'lstm', 'activation_func_yyx': 'GELU', 'L2_weight_yyx': 4.088101159619934e-10, 'L_entropy_weight_yyx': 4.838538517039547e-10, 'L_sep_weight_yyx': 3.4347751295165445e-05, 'L_scale_weight_yyx': 0.0002874474452194379, 'learning_rate_yyx': 0.0041611410197302835}. Best is trial 0 with value: -1.5887905827024746.
[I 2026-03-18 19:24:27,345] Trial 1 pruned. 
[I 2026-03-18 19:24:29,541] Trial 2 pruned. 
[I 2026-03-18 19:24:35,285] Trial 0 finished with value: -1.62963133670824 and parameters: {'n_layers_yyx': 2, 'hidden_size_yyx_l0': 6, 'hidden_size_yyx_l1': 6, 'context_size_yyx': 4, 'num_mix_components_yyx': 3, 'context_extractor_yyx': 'lstm', 'activation_func_yyx': 'GELU', 'L2_weight_yyx': 4.4647981995959886e-10, 'L_entropy_weight_yyx': 1.558958697819067e-06, 'L_sep_weight_yyx': 3.220043834252858e-09, 'L_scale_weight_yyx': 2.645310439308399e-07, 'learning_rate_yyx': 0.0005213654261252816}. Best is trial 0 with value: -1.62963133670824.
[I 2026-03-18 19:24:36,189] Trial 1 pruned. 
[I 2026-03-18 19:24:37,274] Trial 3 pruned. 
[I 2026-03-18 19:24:47,107] Trial 0 finished with value: -2.110296626806576 and parameters: {'n_layers_yyx': 1, 'hidden_size_yyx_l0': 3, 'context_size_yyx': 2, 'num_mix_components_yyx': 4, 'context_extractor_yyx': 'gru', 'activation_func_yyx': 'ReLU', 'L2_weight_yyx': 1.4478854013182327e-05, 'L_entropy_weight_yyx': 8.94612374943684e-10, 'L_sep_weight_yyx': 6.735745801999096e-10, 'L_scale_weight_yyx': 3.8802705423533213e-10, 'learning_rate_yyx': 0.003541340912406946}. Best is trial 0 with value: -2.110296626806576.
[I 2026-03-18 19:24:49,799] Trial 1 finished with value: -1.5667659880071638 and parameters: {'n_layers_yyx': 2, 'hidden_size_yyx_l0': 2, 'hidden_size_yyx_l1': 4, 'context_size_yyx': 1, 'num_mix_components_yyx': 2, 'context_extractor_yyx': 'lstm', 'activation_func_yyx': 'GELU', 'L2_weight_yyx': 8.972032857003704e-09, 'L_entropy_weight_yyx': 1.2156638064425233e-07, 'L_sep_weight_yyx': 4.93347743147605e-10, 'L_scale_weight_yyx': 1.0839377264165784e-06, 'learning_rate_yyx': 0.00205704483431025}. Best is trial 0 with value: -1.6069830560914067.
[I 2026-03-18 19:24:49,911] Trial 0 finished with value: -1.6116411666937693 and parameters: {'n_layers_yyx': 1, 'hidden_size_yyx_l0': 6, 'context_size_yyx': 1, 'num_mix_components_yyx': 1, 'context_extractor_yyx': 'lstm', 'activation_func_yyx': 'ReLU', 'L2_weight_yyx': 3.5734678777344637e-09, 'L_entropy_weight_yyx': 9.092252777257936e-05, 'L_sep_weight_yyx': 7.4256777538530045e-09, 'L_scale_weight_yyx': 0.0001373939611410736, 'learning_rate_yyx': 0.0016958582531097209}. Best is trial 0 with value: -1.6116411666937693.
[I 2026-03-18 19:24:50,786] Trial 0 finished with value: -2.0815027659081875 and parameters: {'n_layers_yyx': 1, 'hidden_size_yyx_l0': 5, 'context_size_yyx': 1, 'num_mix_components_yyx': 5, 'context_extractor_yyx': 'gru', 'activation_func_yyx': 'GELU', 'L2_weight_yyx': 5.098886086472532e-10, 'L_entropy_weight_yyx': 1.8041560776792438e-07, 'L_sep_weight_yyx': 2.4658240477696565e-07, 'L_scale_weight_yyx': 1.4628565134864037e-07, 'learning_rate_yyx': 0.0023442853733354656}. Best is trial 0 with value: -2.0815027659081875.
[I 2026-03-18 19:25:10,248] Trial 0 finished with value: -2.0522123123115676 and parameters: {'n_layers_yyx': 2, 'hidden_size_yyx_l0': 3, 'hidden_size_yyx_l1': 3, 'context_size_yyx': 2, 'num_mix_components_yyx': 1, 'context_extractor_yyx': 'lstm', 'activation_func_yyx': 'GELU', 'L2_weight_yyx': 4.510829856003714e-05, 'L_entropy_weight_yyx': 1.1119591829606415e-05, 'L_sep_weight_yyx': 1.4310918448412462e-09, 'L_scale_weight_yyx': 2.3209606503920118e-10, 'learning_rate_yyx': 0.0006605791432535117}. Best is trial 0 with value: -2.0522123123115676.
[I 2026-03-18 19:25:10,621] Trial 0 finished with value: -2.08424706136736 and parameters: {'n_layers_yyx': 2, 'hidden_size_yyx_l0': 5, 'hidden_size_yyx_l1': 6, 'context_size_yyx': 3, 'num_mix_components_yyx': 1, 'context_extractor_yyx': 'gru', 'activation_func_yyx': 'Tanh', 'L2_weight_yyx': 1.1556306046765774e-06, 'L_entropy_weight_yyx': 5.0865397250259944e-05, 'L_sep_weight_yyx': 5.782385918341947e-08, 'L_scale_weight_yyx': 2.763150925606522e-07, 'learning_rate_yyx': 0.001612306401368289}. Best is trial 0 with value: -2.08424706136736.
[I 2026-03-18 19:25:14,102] Trial 0 finished with value: -1.5869808281492195 and parameters: {'n_layers_yyx': 1, 'hidden_size_yyx_l0': 4, 'context_size_yyx': 1, 'num_mix_components_yyx': 4, 'context_extractor_yyx': 'gru', 'activation_func_yyx': 'ReLU', 'L2_weight_yyx': 0.0002568859495706125, 'L_entropy_weight_yyx': 6.924419241803117e-07, 'L_sep_weight_yyx': 1.7345567398305318e-09, 'L_scale_weight_yyx': 1.5467847182956214e-07, 'learning_rate_yyx': 0.0007423483436404939}. Best is trial 0 with value: -1.5869808281492195.
[I 2026-03-18 19:25:19,292] Trial 0 finished with value: -1.6071675573258253 and parameters: {'n_layers_yyx': 1, 'hidden_size_yyx_l0': 6, 'context_size_yyx': 2, 'num_mix_components_yyx': 3, 'context_extractor_yyx': 'gru', 'activation_func_yyx': 'GELU', 'L2_weight_yyx': 1.6084630765513246e-10, 'L_entropy_weight_yyx': 1.699112779631325e-09, 'L_sep_weight_yyx': 6.103761409932374e-09, 'L_scale_weight_yyx': 4.04118287755782e-08, 'learning_rate_yyx': 0.0009427482767064957}. Best is trial 0 with value: -1.6071675573258253.
[I 2026-03-18 19:25:24,060] Trial 1 pruned. 
[I 2026-03-18 19:25:26,137] Trial 0 finished with value: -1.5879318196758747 and parameters: {'n_layers_yyx': 1, 'hidden_size_yyx_l0': 5, 'context_size_yyx': 2, 'num_mix_components_yyx': 1, 'context_extractor_yyx': 'gru', 'activation_func_yyx': 'Tanh', 'L2_weight_yyx': 2.8459584484716414e-10, 'L_entropy_weight_yyx': 8.59173093725456e-05, 'L_sep_weight_yyx': 0.0007796477298092115, 'L_scale_weight_yyx': 2.2631614854010877e-08, 'learning_rate_yyx': 0.001438995118096418}. Best is trial 0 with value: -1.5879318196758747.
[I 2026-03-18 19:25:28,853] Trial 0 finished with value: -1.613474194617056 and parameters: {'n_layers_yyx': 1, 'hidden_size_yyx_l0': 4, 'context_size_yyx': 2, 'num_mix_components_yyx': 3, 'context_extractor_yyx': 'lstm', 'activation_func_yyx': 'Tanh', 'L2_weight_yyx': 4.593687346604214e-09, 'L_entropy_weight_yyx': 3.691685779131135e-10, 'L_sep_weight_yyx': 0.0002936395096246731, 'L_scale_weight_yyx': 2.127189176232436e-10, 'learning_rate_yyx': 0.0005555066866137645}. Best is trial 0 with value: -1.613474194617056.
[I 2026-03-18 19:25:31,112] Trial 0 finished with value: -2.070886092188975 and parameters: {'n_layers_yyx': 2, 'hidden_size_yyx_l0': 4, 'hidden_size_yyx_l1': 4, 'context_size_yyx': 1, 'num_mix_components_yyx': 1, 'context_extractor_yyx': 'gru', 'activation_func_yyx': 'ReLU', 'L2_weight_yyx': 0.0006236682078545409, 'L_entropy_weight_yyx': 0.0007888344063467128, 'L_sep_weight_yyx': 9.928020751816e-10, 'L_scale_weight_yyx': 2.5180234692277632e-05, 'learning_rate_yyx': 0.0013737839141552352}. Best is trial 0 with value: -2.070886092188975.
[I 2026-03-18 19:25:33,649] Trial 2 pruned. 
[I 2026-03-18 19:25:34,883] Trial 1 pruned. 
[I 2026-03-18 19:25:36,946] Trial 0 finished with value: -2.091085118269155 and parameters: {'n_layers_yyx': 1, 'hidden_size_yyx_l0': 2, 'context_size_yyx': 2, 'num_mix_components_yyx': 5, 'context_extractor_yyx': 'lstm', 'activation_func_yyx': 'ReLU', 'L2_weight_yyx': 2.832511387601816e-10, 'L_entropy_weight_yyx': 4.5155493864754666e-10, 'L_sep_weight_yyx': 0.0003875709943217871, 'L_scale_weight_yyx': 1.2513819194696737e-05, 'learning_rate_yyx': 0.0026315581276534937}. Best is trial 0 with value: -2.091085118269155.
[I 2026-03-18 19:25:42,132] Trial 0 finished with value: -2.0701083356738468 and parameters: {'n_layers_yyx': 2, 'hidden_size_yyx_l0': 5, 'hidden_size_yyx_l1': 2, 'context_size_yyx': 2, 'num_mix_components_yyx': 3, 'context_extractor_yyx': 'gru', 'activation_func_yyx': 'GELU', 'L2_weight_yyx': 1.2503625708018718e-05, 'L_entropy_weight_yyx': 5.351603514849097e-05, 'L_sep_weight_yyx': 1.0386369014989565e-08, 'L_scale_weight_yyx': 1.0539303409412134e-06, 'learning_rate_yyx': 0.0017658333462838905}. Best is trial 0 with value: -2.0701083356738468.
[I 2026-03-18 19:25:47,466] Trial 0 finished with value: -2.0940855781262293 and parameters: {'n_layers_yyx': 1, 'hidden_size_yyx_l0': 3, 'context_size_yyx': 4, 'num_mix_components_yyx': 5, 'context_extractor_yyx': 'gru', 'activation_func_yyx': 'ReLU', 'L2_weight_yyx': 9.258268940500805e-06, 'L_entropy_weight_yyx': 0.00025295232095968735, 'L_sep_weight_yyx': 0.0006514913610047489, 'L_scale_weight_yyx': 1.9854661170228246e-07, 'learning_rate_yyx': 0.0008532362007787412}. Best is trial 0 with value: -2.0940855781262293.
[I 2026-03-18 19:25:56,396] Trial 1 pruned. 
[I 2026-03-18 19:25:58,585] Trial 0 finished with value: -2.0586936478410927 and parameters: {'n_layers_yyx': 1, 'hidden_size_yyx_l0': 5, 'context_size_yyx': 1, 'num_mix_components_yyx': 3, 'context_extractor_yyx': 'lstm', 'activation_func_yyx': 'ReLU', 'L2_weight_yyx': 4.903985578164247e-07, 'L_entropy_weight_yyx': 9.250551413123767e-06, 'L_sep_weight_yyx': 0.0002449122476972689, 'L_scale_weight_yyx': 5.869492834819539e-06, 'learning_rate_yyx': 0.0006479011107961715}. Best is trial 0 with value: -2.0586936478410927.
[I 2026-03-18 19:26:10,797] Trial 2 finished with value: -1.6347284135116869 and parameters: {'n_layers_yyx': 2, 'hidden_size_yyx_l0': 4, 'hidden_size_yyx_l1': 4, 'context_size_yyx': 4, 'num_mix_components_yyx': 5, 'context_extractor_yyx': 'gru', 'activation_func_yyx': 'Tanh', 'L2_weight_yyx': 6.221642071478242e-10, 'L_entropy_weight_yyx': 1.1790633235521543e-05, 'L_sep_weight_yyx': 2.271252278904138e-07, 'L_scale_weight_yyx': 2.1716223597440256e-08, 'learning_rate_yyx': 0.008599992563309412}. Best is trial 0 with value: -1.6395011021807235.
[I 2026-03-18 19:26:18,115] Trial 3 pruned. 
[I 2026-03-18 19:26:20,286] Trial 1 finished with value: -1.6067748969376245 and parameters: {'n_layers_yyx': 1, 'hidden_size_yyx_l0': 5, 'context_size_yyx': 1, 'num_mix_components_yyx': 4, 'context_extractor_yyx': 'gru', 'activation_func_yyx': 'ReLU', 'L2_weight_yyx': 2.1104913979881272e-10, 'L_entropy_weight_yyx': 5.1741819613674874e-05, 'L_sep_weight_yyx': 1.6368716677713224e-07, 'L_scale_weight_yyx': 2.3752486794270355e-09, 'learning_rate_yyx': 0.00751032391276112}. Best is trial 0 with value: -1.6134249177836442.
[I 2026-03-18 19:26:24,521] Trial 1 finished with value: -1.6112415459010325 and parameters: {'n_layers_yyx': 1, 'hidden_size_yyx_l0': 3, 'context_size_yyx': 4, 'num_mix_components_yyx': 2, 'context_extractor_yyx': 'lstm', 'activation_func_yyx': 'Tanh', 'L2_weight_yyx': 9.288162180595311e-09, 'L_entropy_weight_yyx': 4.171587828448187e-08, 'L_sep_weight_yyx': 6.4169599654739545e-09, 'L_scale_weight_yyx': 1.251928527999205e-07, 'learning_rate_yyx': 0.005251359971318395}. Best is trial 1 with value: -1.6112415459010325.
[I 2026-03-18 19:26:29,519] Trial 2 pruned. 
[I 2026-03-18 19:26:41,263] Trial 4 pruned. 
[I 2026-03-18 19:26:44,597] Trial 2 pruned. 
[I 2026-03-18 19:26:58,458] Trial 5 pruned. 
[I 2026-03-18 19:27:02,318] Trial 1 pruned. 
[I 2026-03-18 19:27:03,755] Trial 2 finished with value: -1.6282887548609164 and parameters: {'n_layers_yyx': 2, 'hidden_size_yyx_l0': 2, 'hidden_size_yyx_l1': 5, 'context_size_yyx': 3, 'num_mix_components_yyx': 5, 'context_extractor_yyx': 'gru', 'activation_func_yyx': 'GELU', 'L2_weight_yyx': 6.175652536162189e-05, 'L_entropy_weight_yyx': 1.5295121291425544e-06, 'L_sep_weight_yyx': 1.180125467741226e-09, 'L_scale_weight_yyx': 4.90324538389411e-05, 'learning_rate_yyx': 0.004759290405558001}. Best is trial 0 with value: -1.62963133670824.
[I 2026-03-18 19:27:14,945] Trial 2 finished with value: -2.059868681386501 and parameters: {'n_layers_yyx': 2, 'hidden_size_yyx_l0': 4, 'hidden_size_yyx_l1': 3, 'context_size_yyx': 3, 'num_mix_components_yyx': 2, 'context_extractor_yyx': 'lstm', 'activation_func_yyx': 'ReLU', 'L2_weight_yyx': 1.2718126697462808e-08, 'L_entropy_weight_yyx': 1.0803862561038014e-09, 'L_sep_weight_yyx': 3.0487154265410895e-05, 'L_scale_weight_yyx': 1.6457977808374276e-10, 'learning_rate_yyx': 0.007695004067065978}. Best is trial 2 with value: -2.059868681386501.
[I 2026-03-18 19:27:17,014] Trial 2 finished with value: -1.602544184803857 and parameters: {'n_layers_yyx': 2, 'hidden_size_yyx_l0': 6, 'hidden_size_yyx_l1': 2, 'context_size_yyx': 1, 'num_mix_components_yyx': 3, 'context_extractor_yyx': 'gru', 'activation_func_yyx': 'ReLU', 'L2_weight_yyx': 8.377971979039833e-06, 'L_entropy_weight_yyx': 7.86886550276859e-09, 'L_sep_weight_yyx': 0.000762585533351428, 'L_scale_weight_yyx': 1.5180249731906843e-05, 'learning_rate_yyx': 0.00910985703727472}. Best is trial 2 with value: -1.602544184803857.
[I 2026-03-18 19:27:24,687] Trial 3 pruned. 
[I 2026-03-18 19:27:25,586] Trial 3 pruned. 
[I 2026-03-18 19:27:34,258] Trial 4 pruned. 
[I 2026-03-18 19:27:53,405] Trial 1 finished with value: -1.6089063429853576 and parameters: {'n_layers_yyx': 1, 'hidden_size_yyx_l0': 4, 'context_size_yyx': 4, 'num_mix_components_yyx': 3, 'context_extractor_yyx': 'gru', 'activation_func_yyx': 'ReLU', 'L2_weight_yyx': 8.107396818198855e-09, 'L_entropy_weight_yyx': 2.926991905735921e-07, 'L_sep_weight_yyx': 2.9774016377656473e-10, 'L_scale_weight_yyx': 0.0005425979448745112, 'learning_rate_yyx': 0.0005465856319646636}. Best is trial 0 with value: -1.6093905696412754.
[I 2026-03-18 19:27:54,838] Trial 1 finished with value: -1.6113757535901372 and parameters: {'n_layers_yyx': 1, 'hidden_size_yyx_l0': 3, 'context_size_yyx': 1, 'num_mix_components_yyx': 2, 'context_extractor_yyx': 'lstm', 'activation_func_yyx': 'Tanh', 'L2_weight_yyx': 1.84485832703867e-05, 'L_entropy_weight_yyx': 2.4702596797221914e-08, 'L_sep_weight_yyx': 5.3393432424629454e-08, 'L_scale_weight_yyx': 3.1640873336034737e-09, 'learning_rate_yyx': 0.0031010347449255187}. Best is trial 1 with value: -1.6113757535901372.
[I 2026-03-18 19:28:01,355] Trial 2 pruned. 
