[I 2026-03-18 20:23:51,423] Trial 47 finished with value: -2.077836874722674 and parameters: {'n_layers_yyx': 2, 'hidden_size_yyx_l0': 3, 'hidden_size_yyx_l1': 4, 'context_size_yyx': 4, 'num_mix_components_yyx': 5, 'context_extractor_yyx': 'lstm', 'activation_func_yyx': 'ReLU', 'L2_weight_yyx': 8.517673745204343e-06, 'L_entropy_weight_yyx': 3.180400113439167e-08, 'L_sep_weight_yyx': 1.0870248094694356e-06, 'L_scale_weight_yyx': 5.250618305085253e-05, 'learning_rate_yyx': 0.004760520634982617}. Best is trial 6 with value: -2.0790188514889616.
[I 2026-03-18 20:23:57,242] Trial 40 pruned. 
[I 2026-03-18 20:24:03,355] Trial 38 pruned. 
[I 2026-03-18 20:24:04,197] Trial 48 pruned. 
[I 2026-03-18 20:24:13,755] Trial 39 pruned. 
[I 2026-03-18 20:24:20,671] Trial 47 finished with value: -2.087119619226666 and parameters: {'n_layers_yyx': 2, 'hidden_size_yyx_l0': 3, 'hidden_size_yyx_l1': 6, 'context_size_yyx': 4, 'num_mix_components_yyx': 3, 'context_extractor_yyx': 'lstm', 'activation_func_yyx': 'ReLU', 'L2_weight_yyx': 1.5386622464319235e-08, 'L_entropy_weight_yyx': 5.20021884085667e-07, 'L_sep_weight_yyx': 2.1123070390813884e-08, 'L_scale_weight_yyx': 5.165195228925257e-07, 'learning_rate_yyx': 0.008564361677518359}. Best is trial 47 with value: -2.087119619226666.
[I 2026-03-18 20:24:30,521] Trial 47 finished with value: -2.0794355849787602 and parameters: {'n_layers_yyx': 1, 'hidden_size_yyx_l0': 4, 'context_size_yyx': 4, 'num_mix_components_yyx': 5, 'context_extractor_yyx': 'lstm', 'activation_func_yyx': 'Tanh', 'L2_weight_yyx': 2.6292354692982e-07, 'L_entropy_weight_yyx': 4.0479185581429324e-07, 'L_sep_weight_yyx': 7.846528955638245e-07, 'L_scale_weight_yyx': 2.0799086712479904e-05, 'learning_rate_yyx': 0.00839038753693499}. Best is trial 2 with value: -2.093203554819634.
[I 2026-03-18 20:24:54,199] Trial 46 finished with value: -2.0380199786898814 and parameters: {'n_layers_yyx': 2, 'hidden_size_yyx_l0': 5, 'hidden_size_yyx_l1': 6, 'context_size_yyx': 3, 'num_mix_components_yyx': 4, 'context_extractor_yyx': 'gru', 'activation_func_yyx': 'ReLU', 'L2_weight_yyx': 8.174276268884038e-08, 'L_entropy_weight_yyx': 4.066184593762796e-06, 'L_sep_weight_yyx': 0.000160296954046351, 'L_scale_weight_yyx': 0.0006743138076150846, 'learning_rate_yyx': 0.009333431899685109}. Best is trial 41 with value: -2.0671816006912174.
[I 2026-03-18 20:25:28,722] Trial 39 pruned. 
[I 2026-03-18 20:25:41,658] Trial 34 pruned. 
[I 2026-03-18 20:25:43,177] Trial 40 pruned. 
[I 2026-03-18 20:25:49,340] Trial 48 pruned. 
[I 2026-03-18 20:25:49,778] Trial 40 finished with value: -2.095176024583993 and parameters: {'n_layers_yyx': 2, 'hidden_size_yyx_l0': 3, 'hidden_size_yyx_l1': 5, 'context_size_yyx': 4, 'num_mix_components_yyx': 4, 'context_extractor_yyx': 'gru', 'activation_func_yyx': 'Tanh', 'L2_weight_yyx': 4.3016846086390734e-07, 'L_entropy_weight_yyx': 0.00014140322444573296, 'L_sep_weight_yyx': 1.1260223857711681e-10, 'L_scale_weight_yyx': 2.1997819583846687e-06, 'learning_rate_yyx': 0.009961173883903789}. Best is trial 24 with value: -2.0962241228606584.
[I 2026-03-18 20:25:53,591] Trial 37 finished with value: -2.117391234216779 and parameters: {'n_layers_yyx': 1, 'hidden_size_yyx_l0': 6, 'context_size_yyx': 3, 'num_mix_components_yyx': 5, 'context_extractor_yyx': 'gru', 'activation_func_yyx': 'Tanh', 'L2_weight_yyx': 2.7211595837218392e-05, 'L_entropy_weight_yyx': 1.0257864945232274e-05, 'L_sep_weight_yyx': 4.450122627211315e-07, 'L_scale_weight_yyx': 1.217022319061504e-09, 'learning_rate_yyx': 0.0039587099079700224}. Best is trial 10 with value: -2.123509279126982.
[I 2026-03-18 20:25:54,022] Trial 47 pruned. 
[I 2026-03-18 20:25:58,939] Trial 42 finished with value: -1.6320522975493974 and parameters: {'n_layers_yyx': 2, 'hidden_size_yyx_l0': 2, 'hidden_size_yyx_l1': 5, 'context_size_yyx': 3, 'num_mix_components_yyx': 4, 'context_extractor_yyx': 'gru', 'activation_func_yyx': 'GELU', 'L2_weight_yyx': 0.0003897263020183075, 'L_entropy_weight_yyx': 1.1701880363050554e-06, 'L_sep_weight_yyx': 9.184227586169647e-09, 'L_scale_weight_yyx': 1.964888947427869e-05, 'learning_rate_yyx': 0.006682239204013109}. Best is trial 22 with value: -1.6339605357080298.
[I 2026-03-18 20:26:09,306] Trial 35 pruned. 
[I 2026-03-18 20:26:12,866] Trial 49 pruned. 

Source events: 16159
Target events: 10683
Full model ln_yyx : 637.23915 nats/sec, 53.68485 nats/event
Full model Log loss : -2.05221
Full model ln_yyx : 653.45485 nats/sec, 55.05096 nats/event
Full model Log loss : -2.08200
Full model ln_yyx : 645.04853 nats/sec, 54.34276 nats/event
Full model Log loss : -2.06600
Full model ln_yyx : 647.87064 nats/sec, 54.58051 nats/event
Full model Log loss : -2.06884
Full model ln_yyx : 646.78699 nats/sec, 54.48922 nats/event
Full model Log loss : -2.07906
Full model ln_yyx : 646.05925 nats/sec, 54.42791 nats/event
Full model Log loss : -2.05924
Full model ln_yyx : 646.73501 nats/sec, 54.48484 nats/event
Full model Log loss : -2.06984
Full model ln_yyx : 640.54267 nats/sec, 53.96316 nats/event
Full model Log loss : -2.06128
Full model ln_yyx : 648.03482 nats/sec, 54.59434 nats/event
Full model Log loss : -2.06972
Full model ln_yyx : 647.03385 nats/sec, 54.51001 nats/event
Full model Log loss : -2.07607
Full model ln_yyx : 648.40501 nats/sec, 54.62553 nats/event
Full model Log loss : -2.08200
Full model ln_yyx : 646.89585 nats/sec, 54.49839 nats/event
Full model Log loss : -2.07517
Full model ln_yyx : 649.93969 nats/sec, 54.75482 nats/event
Full model Log loss : -2.07701
Optimization finished. Config saved to results/opt-full/opt_full_402_best_config.txt
[I 2026-03-18 20:26:21,959] Trial 47 finished with value: -2.0948811285596287 and parameters: {'n_layers_yyx': 1, 'hidden_size_yyx_l0': 3, 'context_size_yyx': 2, 'num_mix_components_yyx': 5, 'context_extractor_yyx': 'gru', 'activation_func_yyx': 'ReLU', 'L2_weight_yyx': 3.04827146525768e-09, 'L_entropy_weight_yyx': 6.499890980208684e-09, 'L_sep_weight_yyx': 4.2844343061822e-09, 'L_scale_weight_yyx': 1.2518944082824026e-07, 'learning_rate_yyx': 0.008406872268493064}. Best is trial 12 with value: -2.0975572887346234.
[I 2026-03-18 20:26:32,029] Trial 48 pruned. 
[I 2026-03-18 20:26:40,068] Trial 49 pruned. 

Source events: 16159
Target events: 5634
Full model ln_yyx : 339.25152 nats/sec, 54.19353 nats/event
Full model Log loss : -2.05869
Full model ln_yyx : 337.62558 nats/sec, 53.93380 nats/event
Full model Log loss : -2.05930
Full model ln_yyx : 328.87692 nats/sec, 52.53625 nats/event
Full model Log loss : -2.01357
Full model ln_yyx : 339.03760 nats/sec, 54.15936 nats/event
Full model Log loss : -2.05872
Full model ln_yyx : 339.20712 nats/sec, 54.18644 nats/event
Full model Log loss : -2.07375
Full model ln_yyx : 341.29457 nats/sec, 54.51990 nats/event
Full model Log loss : -2.07902
Full model ln_yyx : 341.72109 nats/sec, 54.58803 nats/event
Full model Log loss : -2.07573
Full model ln_yyx : 340.64063 nats/sec, 54.41544 nats/event
Full model Log loss : -2.07522
Full model ln_yyx : 341.03667 nats/sec, 54.47870 nats/event
Full model Log loss : -2.06822
Full model ln_yyx : 344.99994 nats/sec, 55.11181 nats/event
Full model Log loss : -2.06735
Full model ln_yyx : 341.00179 nats/sec, 54.47313 nats/event
Full model Log loss : -2.06821
Full model ln_yyx : 342.22696 nats/sec, 54.66884 nats/event
Full model Log loss : -2.07381
Full model ln_yyx : 336.89211 nats/sec, 53.81663 nats/event
Full model Log loss : -2.05901
Full model ln_yyx : 341.38374 nats/sec, 54.53414 nats/event
Full model Log loss : -2.07784
Optimization finished. Config saved to results/opt-full/opt_full_401_best_config.txt
[I 2026-03-18 20:26:45,013] Trial 48 finished with value: -2.0896087512045707 and parameters: {'n_layers_yyx': 1, 'hidden_size_yyx_l0': 5, 'context_size_yyx': 4, 'num_mix_components_yyx': 4, 'context_extractor_yyx': 'lstm', 'activation_func_yyx': 'ReLU', 'L2_weight_yyx': 1.4951456134900334e-06, 'L_entropy_weight_yyx': 2.3846641571049364e-05, 'L_sep_weight_yyx': 1.5119432176824611e-05, 'L_scale_weight_yyx': 8.528368090702295e-09, 'learning_rate_yyx': 0.0069066593961327844}. Best is trial 2 with value: -2.093203554819634.
[I 2026-03-18 20:26:48,831] Trial 38 pruned. 
[I 2026-03-18 20:26:49,116] Trial 41 finished with value: -1.6122739131309165 and parameters: {'n_layers_yyx': 1, 'hidden_size_yyx_l0': 5, 'context_size_yyx': 2, 'num_mix_components_yyx': 5, 'context_extractor_yyx': 'lstm', 'activation_func_yyx': 'GELU', 'L2_weight_yyx': 0.0002454507270289184, 'L_entropy_weight_yyx': 2.3071292847984848e-05, 'L_sep_weight_yyx': 0.0003411409702671158, 'L_scale_weight_yyx': 5.644124269147713e-08, 'learning_rate_yyx': 0.007561361653655877}. Best is trial 9 with value: -1.613731891101604.
[I 2026-03-18 20:26:50,517] Trial 41 pruned. 
[I 2026-03-18 20:27:00,096] Trial 39 pruned. 
[I 2026-03-18 20:27:00,344] Trial 48 finished with value: -2.086435220765197 and parameters: {'n_layers_yyx': 2, 'hidden_size_yyx_l0': 3, 'hidden_size_yyx_l1': 6, 'context_size_yyx': 3, 'num_mix_components_yyx': 3, 'context_extractor_yyx': 'lstm', 'activation_func_yyx': 'ReLU', 'L2_weight_yyx': 1.7910925336734173e-08, 'L_entropy_weight_yyx': 6.50196916561216e-07, 'L_sep_weight_yyx': 0.00024226947264120868, 'L_scale_weight_yyx': 5.540493737528175e-07, 'learning_rate_yyx': 0.008686923060836968}. Best is trial 47 with value: -2.087119619226666.
[I 2026-03-18 20:27:00,723] Trial 42 pruned. 
[I 2026-03-18 20:27:06,206] Trial 49 pruned. 

Source events: 16159
Target events: 31112
Full model ln_yyx : 1892.40040 nats/sec, 54.74288 nats/event
Full model Log loss : -2.07849
Full model ln_yyx : 1870.98459 nats/sec, 54.12337 nats/event
Full model Log loss : -2.07962
Full model ln_yyx : 1894.84107 nats/sec, 54.81348 nats/event
Full model Log loss : -2.09320
Full model ln_yyx : 1893.69067 nats/sec, 54.78020 nats/event
Full model Log loss : -2.07871
Full model ln_yyx : 1884.02023 nats/sec, 54.50046 nats/event
Full model Log loss : -2.07707
Full model ln_yyx : 1871.53125 nats/sec, 54.13918 nats/event
Full model Log loss : -2.08051
Full model ln_yyx : 1870.27386 nats/sec, 54.10281 nats/event
Full model Log loss : -2.08082
Full model ln_yyx : 1902.81220 nats/sec, 55.04407 nats/event
Full model Log loss : -2.09281
Full model ln_yyx : 1891.06003 nats/sec, 54.70410 nats/event
Full model Log loss : -2.09126
Full model ln_yyx : 1886.22708 nats/sec, 54.56430 nats/event
Full model Log loss : -2.07924
Full model ln_yyx : 1888.77568 nats/sec, 54.63802 nats/event
Full model Log loss : -2.08884
Full model ln_yyx : 1891.27174 nats/sec, 54.71023 nats/event
Full model Log loss : -2.08943
Full model ln_yyx : 1904.05786 nats/sec, 55.08010 nats/event
Full model Log loss : -2.09034
Full model ln_yyx : 1886.84046 nats/sec, 54.58204 nats/event
Full model Log loss : -2.08957
Full model ln_yyx : 1877.47018 nats/sec, 54.31098 nats/event
Full model Log loss : -2.07944
Full model ln_yyx : 1887.25102 nats/sec, 54.59392 nats/event
Full model Log loss : -2.08961
Optimization finished. Config saved to results/opt-full/opt_full_396_best_config.txt
[I 2026-03-18 20:27:12,687] Trial 43 pruned. 
[I 2026-03-18 20:27:13,496] Trial 40 pruned. 
[I 2026-03-18 20:27:18,199] Trial 43 finished with value: -1.6260151679205788 and parameters: {'n_layers_yyx': 2, 'hidden_size_yyx_l0': 2, 'hidden_size_yyx_l1': 5, 'context_size_yyx': 3, 'num_mix_components_yyx': 5, 'context_extractor_yyx': 'gru', 'activation_func_yyx': 'GELU', 'L2_weight_yyx': 0.00030376592701278636, 'L_entropy_weight_yyx': 9.595444643354465e-06, 'L_sep_weight_yyx': 9.368232500167168e-09, 'L_scale_weight_yyx': 5.3646365184702323e-05, 'learning_rate_yyx': 0.0063998797959724}. Best is trial 22 with value: -1.6339605357080298.
[I 2026-03-18 20:27:29,087] Trial 44 pruned. 
[I 2026-03-18 20:27:30,865] Trial 41 pruned. 
[I 2026-03-18 20:27:45,882] Trial 45 pruned. 
[I 2026-03-18 20:27:52,469] Trial 48 finished with value: -2.0501215938298674 and parameters: {'n_layers_yyx': 2, 'hidden_size_yyx_l0': 6, 'hidden_size_yyx_l1': 6, 'context_size_yyx': 3, 'num_mix_components_yyx': 4, 'context_extractor_yyx': 'gru', 'activation_func_yyx': 'ReLU', 'L2_weight_yyx': 2.9629137273655428e-08, 'L_entropy_weight_yyx': 0.00037779990607966345, 'L_sep_weight_yyx': 0.0008583282175994818, 'L_scale_weight_yyx': 5.462764082138044e-09, 'learning_rate_yyx': 0.007467368893844635}. Best is trial 41 with value: -2.0671816006912174.
[I 2026-03-18 20:28:06,824] Trial 46 pruned. 
[I 2026-03-18 20:28:07,566] Trial 41 finished with value: -2.085862915346351 and parameters: {'n_layers_yyx': 1, 'hidden_size_yyx_l0': 6, 'context_size_yyx': 3, 'num_mix_components_yyx': 5, 'context_extractor_yyx': 'lstm', 'activation_func_yyx': 'ReLU', 'L2_weight_yyx': 0.0009736289710591252, 'L_entropy_weight_yyx': 2.3938839362963085e-06, 'L_sep_weight_yyx': 0.00027295805360245273, 'L_scale_weight_yyx': 2.2549686751182493e-05, 'learning_rate_yyx': 0.008063181766187132}. Best is trial 31 with value: -2.089858720706198.
[I 2026-03-18 20:28:12,502] Trial 49 pruned. 

Source events: 16159
Target events: 1783
Full model ln_yyx : 107.78939 nats/sec, 54.40855 nats/event
Full model Log loss : -2.05954
Full model ln_yyx : 108.72351 nats/sec, 54.88007 nats/event
Full model Log loss : -2.05987
Full model ln_yyx : 107.06506 nats/sec, 54.04294 nats/event
Full model Log loss : -2.05485
Full model ln_yyx : 106.56623 nats/sec, 53.79114 nats/event
Full model Log loss : -2.04136
Full model ln_yyx : 108.11107 nats/sec, 54.57093 nats/event
Full model Log loss : -2.05603
Full model ln_yyx : 107.26709 nats/sec, 54.14491 nats/event
Full model Log loss : -2.05164
Full model ln_yyx : 107.23249 nats/sec, 54.12745 nats/event
Full model Log loss : -2.03943
Full model ln_yyx : 108.92655 nats/sec, 54.98256 nats/event
Full model Log loss : -2.05127
Full model ln_yyx : 109.24222 nats/sec, 55.14189 nats/event
Full model Log loss : -2.05795
Full model ln_yyx : 108.53775 nats/sec, 54.78630 nats/event
Full model Log loss : -2.05825
Full model ln_yyx : 108.33447 nats/sec, 54.68369 nats/event
Full model Log loss : -2.05273
Full model ln_yyx : 106.54195 nats/sec, 53.77889 nats/event
Full model Log loss : -2.04057
Full model ln_yyx : 107.33135 nats/sec, 54.17735 nats/event
Full model Log loss : -2.04827
Full model ln_yyx : 108.16766 nats/sec, 54.59949 nats/event
Full model Log loss : -2.05923
Full model ln_yyx : 108.41718 nats/sec, 54.72544 nats/event
Full model Log loss : -2.06718
Full model ln_yyx : 108.44660 nats/sec, 54.74029 nats/event
Full model Log loss : -2.06104
Full model ln_yyx : 107.54971 nats/sec, 54.28757 nats/event
Full model Log loss : -2.06073
Full model ln_yyx : 106.87499 nats/sec, 53.94699 nats/event
Full model Log loss : -2.03802
Full model ln_yyx : 107.27329 nats/sec, 54.14804 nats/event
Full model Log loss : -2.05012
Optimization finished. Config saved to results/opt-full/opt_full_397_best_config.txt
[I 2026-03-18 20:28:15,761] Trial 47 pruned. 
[I 2026-03-18 20:28:28,717] Trial 48 pruned. 
[I 2026-03-18 20:28:33,330] Trial 36 pruned. 
[I 2026-03-18 20:28:35,594] Trial 44 finished with value: -1.6288868309671034 and parameters: {'n_layers_yyx': 2, 'hidden_size_yyx_l0': 2, 'hidden_size_yyx_l1': 5, 'context_size_yyx': 4, 'num_mix_components_yyx': 5, 'context_extractor_yyx': 'gru', 'activation_func_yyx': 'GELU', 'L2_weight_yyx': 0.0005755171725075146, 'L_entropy_weight_yyx': 1.1740497035930093e-06, 'L_sep_weight_yyx': 1.2646083090797245e-09, 'L_scale_weight_yyx': 0.0001862625532053213, 'learning_rate_yyx': 0.008354672763935032}. Best is trial 22 with value: -1.6339605357080298.
[I 2026-03-18 20:28:38,288] Trial 37 pruned. 
[I 2026-03-18 20:28:45,895] Trial 49 pruned. 

Source events: 16159
Target events: 24874
Full model ln_yyx : 1510.55331 nats/sec, 54.65538 nats/event
Full model Log loss : -2.09409
Full model ln_yyx : 1507.78290 nats/sec, 54.55514 nats/event
Full model Log loss : -2.07843
Full model ln_yyx : 1503.83372 nats/sec, 54.41225 nats/event
Full model Log loss : -2.07810
Full model ln_yyx : 1507.84259 nats/sec, 54.55730 nats/event
Full model Log loss : -2.08097
Full model ln_yyx : 1509.17415 nats/sec, 54.60548 nats/event
Full model Log loss : -2.07972
Full model ln_yyx : 1503.96596 nats/sec, 54.41704 nats/event
Full model Log loss : -2.07860
Full model ln_yyx : 1514.00347 nats/sec, 54.78022 nats/event
Full model Log loss : -2.09756
Full model ln_yyx : 1522.80705 nats/sec, 55.09875 nats/event
Full model Log loss : -2.09421
Full model ln_yyx : 1512.45369 nats/sec, 54.72414 nats/event
Full model Log loss : -2.08690
Full model ln_yyx : 1509.96906 nats/sec, 54.63424 nats/event
Full model Log loss : -2.09551
Full model ln_yyx : 1521.08726 nats/sec, 55.03653 nats/event
Full model Log loss : -2.09488
Optimization finished. Config saved to results/opt-full/opt_full_404_best_config.txt
[I 2026-03-18 20:28:54,250] Trial 42 finished with value: -2.0952442618118585 and parameters: {'n_layers_yyx': 2, 'hidden_size_yyx_l0': 3, 'hidden_size_yyx_l1': 5, 'context_size_yyx': 4, 'num_mix_components_yyx': 4, 'context_extractor_yyx': 'gru', 'activation_func_yyx': 'Tanh', 'L2_weight_yyx': 3.4837661670442765e-07, 'L_entropy_weight_yyx': 0.00015524875100223441, 'L_sep_weight_yyx': 2.3226612550197507e-10, 'L_scale_weight_yyx': 4.763239329458752e-07, 'learning_rate_yyx': 0.008357859191130218}. Best is trial 24 with value: -2.0962241228606584.
[I 2026-03-18 20:28:54,831] Trial 49 finished with value: -2.0823405117565463 and parameters: {'n_layers_yyx': 2, 'hidden_size_yyx_l0': 3, 'hidden_size_yyx_l1': 6, 'context_size_yyx': 2, 'num_mix_components_yyx': 3, 'context_extractor_yyx': 'lstm', 'activation_func_yyx': 'ReLU', 'L2_weight_yyx': 1.881218808952793e-09, 'L_entropy_weight_yyx': 1.546123601755512e-06, 'L_sep_weight_yyx': 0.00018554750864996174, 'L_scale_weight_yyx': 6.621344555331026e-08, 'learning_rate_yyx': 0.009963252799329003}. Best is trial 47 with value: -2.087119619226666.

Source events: 16159
Target events: 39192
Full model ln_yyx : 2344.70068 nats/sec, 53.84340 nats/event
Full model Log loss : -2.07089
Full model ln_yyx : 2339.68528 nats/sec, 53.72823 nats/event
Full model Log loss : -2.06883
Full model ln_yyx : 2342.39407 nats/sec, 53.79043 nats/event
Full model Log loss : -2.06941
Full model ln_yyx : 2375.63983 nats/sec, 54.55388 nats/event
Full model Log loss : -2.08387
Full model ln_yyx : 2381.02050 nats/sec, 54.67745 nats/event
Full model Log loss : -2.08518
Full model ln_yyx : 2349.39987 nats/sec, 53.95131 nats/event
Full model Log loss : -2.06789
Full model ln_yyx : 2355.78872 nats/sec, 54.09803 nats/event
Full model Log loss : -2.07711
Full model ln_yyx : 2373.36465 nats/sec, 54.50164 nats/event
Full model Log loss : -2.07742
Full model ln_yyx : 2384.02169 nats/sec, 54.74636 nats/event
Full model Log loss : -2.08190
Full model ln_yyx : 2368.70737 nats/sec, 54.39469 nats/event
Full model Log loss : -2.08075
Full model ln_yyx : 2380.44307 nats/sec, 54.66419 nats/event
Full model Log loss : -2.08172
Full model ln_yyx : 2366.93604 nats/sec, 54.35401 nats/event
Full model Log loss : -2.08712
Full model ln_yyx : 2381.35648 nats/sec, 54.68516 nats/event
Full model Log loss : -2.08644
Full model ln_yyx : 2375.12479 nats/sec, 54.54206 nats/event
Full model Log loss : -2.08234
Optimization finished. Config saved to results/opt-full/opt_full_406_best_config.txt
[I 2026-03-18 20:28:57,158] Trial 49 pruned. 

Source events: 11540
Target events: 20158
Full model ln_yyx : 748.83181 nats/sec, 33.43331 nats/event
Full model Log loss : -1.61347
Full model ln_yyx : 735.60939 nats/sec, 32.84296 nats/event
Full model Log loss : -1.61248
Full model ln_yyx : 744.19342 nats/sec, 33.22622 nats/event
Full model Log loss : -1.61070
Full model ln_yyx : 729.76595 nats/sec, 32.58207 nats/event
Full model Log loss : -1.58829
Full model ln_yyx : 703.13440 nats/sec, 31.39304 nats/event
Full model Log loss : -1.57686
Full model ln_yyx : 746.29490 nats/sec, 33.32004 nats/event
Full model Log loss : -1.60667
Full model ln_yyx : 746.02290 nats/sec, 33.30790 nats/event
Full model Log loss : -1.61373
Full model ln_yyx : 736.80547 nats/sec, 32.89636 nats/event
Full model Log loss : -1.58348
Full model ln_yyx : 745.27976 nats/sec, 33.27472 nats/event
Full model Log loss : -1.60701
Full model ln_yyx : 740.17368 nats/sec, 33.04675 nats/event
Full model Log loss : -1.60853
Full model ln_yyx : 730.62613 nats/sec, 32.62047 nats/event
Full model Log loss : -1.58543
Full model ln_yyx : 746.75700 nats/sec, 33.34067 nats/event
Full model Log loss : -1.60966
Full model ln_yyx : 744.39544 nats/sec, 33.23524 nats/event
Full model Log loss : -1.61018
Full model ln_yyx : 738.85374 nats/sec, 32.98781 nats/event
Full model Log loss : -1.61246
Full model ln_yyx : 736.46705 nats/sec, 32.88126 nats/event
Full model Log loss : -1.61184
Full model ln_yyx : 741.60803 nats/sec, 33.11079 nats/event
Full model Log loss : -1.61227
Optimization finished. Config saved to results/opt-full/opt_full_393_best_config.txt
[I 2026-03-18 20:29:09,792] Trial 38 pruned. 
[I 2026-03-18 20:29:37,092] Trial 45 finished with value: -1.6228170078431545 and parameters: {'n_layers_yyx': 2, 'hidden_size_yyx_l0': 2, 'hidden_size_yyx_l1': 6, 'context_size_yyx': 3, 'num_mix_components_yyx': 4, 'context_extractor_yyx': 'gru', 'activation_func_yyx': 'GELU', 'L2_weight_yyx': 0.00012989919614925837, 'L_entropy_weight_yyx': 3.979889798674831e-06, 'L_sep_weight_yyx': 4.448186161018248e-10, 'L_scale_weight_yyx': 0.00015840836381877775, 'learning_rate_yyx': 0.005336700672340726}. Best is trial 22 with value: -1.6339605357080298.
