[I 2026-03-18 20:29:29,331] Trial 42 finished with value: -2.479420814816343 and parameters: {'n_layers_yyx': 2, 'hidden_size_yyx_l0': 5, 'hidden_size_yyx_l1': 6, 'context_size_yyx': 1, 'num_mix_components_yyx': 2, 'context_extractor_yyx': 'gru', 'activation_func_yyx': 'ReLU', 'L2_weight_yyx': 1.8198099489305886e-07, 'L_entropy_weight_yyx': 8.330533393727046e-05, 'L_sep_weight_yyx': 6.524418080652997e-08, 'L_scale_weight_yyx': 4.074309482309084e-07, 'learning_rate_yyx': 0.006417834471899577}. Best is trial 36 with value: -2.5139452208666837.
[I 2026-03-18 20:29:35,224] Trial 47 pruned. 
[I 2026-03-18 20:29:42,127] Trial 35 pruned. 
[I 2026-03-18 20:29:44,646] Trial 32 pruned. 
[I 2026-03-18 20:29:45,275] Trial 44 finished with value: -2.512287728815681 and parameters: {'n_layers_yyx': 1, 'hidden_size_yyx_l0': 3, 'context_size_yyx': 4, 'num_mix_components_yyx': 1, 'context_extractor_yyx': 'lstm', 'activation_func_yyx': 'ReLU', 'L2_weight_yyx': 0.00019849262903362769, 'L_entropy_weight_yyx': 3.404649222071397e-07, 'L_sep_weight_yyx': 4.599368387319151e-06, 'L_scale_weight_yyx': 6.014396140849627e-07, 'learning_rate_yyx': 0.005992744775595252}. Best is trial 33 with value: -2.512931905705113.
[I 2026-03-18 20:29:48,241] Trial 43 pruned. 
[I 2026-03-18 20:29:51,517] Trial 33 pruned. 
[I 2026-03-18 20:29:52,883] Trial 48 pruned. 
[I 2026-03-18 20:29:55,220] Trial 42 finished with value: -2.5150204117116397 and parameters: {'n_layers_yyx': 2, 'hidden_size_yyx_l0': 2, 'hidden_size_yyx_l1': 5, 'context_size_yyx': 3, 'num_mix_components_yyx': 5, 'context_extractor_yyx': 'lstm', 'activation_func_yyx': 'ReLU', 'L2_weight_yyx': 1.878591233568284e-06, 'L_entropy_weight_yyx': 4.832324362550549e-06, 'L_sep_weight_yyx': 1.1625589034167784e-08, 'L_scale_weight_yyx': 6.516715568869952e-05, 'learning_rate_yyx': 0.008607043176057455}. Best is trial 22 with value: -2.5155989726836543.
[I 2026-03-18 20:29:58,117] Trial 36 pruned. 
[I 2026-03-18 20:29:59,605] Trial 47 finished with value: -2.011560079330496 and parameters: {'n_layers_yyx': 1, 'hidden_size_yyx_l0': 4, 'context_size_yyx': 3, 'num_mix_components_yyx': 5, 'context_extractor_yyx': 'lstm', 'activation_func_yyx': 'GELU', 'L2_weight_yyx': 3.80940131816967e-07, 'L_entropy_weight_yyx': 5.883923822437679e-06, 'L_sep_weight_yyx': 1.7032861651724788e-08, 'L_scale_weight_yyx': 6.889922524726418e-05, 'learning_rate_yyx': 0.008314040314522368}. Best is trial 0 with value: -2.0138799336866504.
[I 2026-03-18 20:30:11,018] Trial 34 pruned. 
[I 2026-03-18 20:30:12,756] Trial 49 pruned. 

Source events: 27060
Target events: 54211
Full model ln_yyx : 6239.95305 nats/sec, 103.59443 nats/event
Full model Log loss : -2.51202
Full model ln_yyx : 6230.44047 nats/sec, 103.43651 nats/event
Full model Log loss : -2.50926
Full model ln_yyx : 6200.00208 nats/sec, 102.93117 nats/event
Full model Log loss : -2.49655
Full model ln_yyx : 6225.47993 nats/sec, 103.35415 nats/event
Full model Log loss : -2.51045
Full model ln_yyx : 6209.67687 nats/sec, 103.09179 nats/event
Full model Log loss : -2.49759
Full model ln_yyx : 6246.15290 nats/sec, 103.69736 nats/event
Full model Log loss : -2.51107
Full model ln_yyx : 6159.49550 nats/sec, 102.25869 nats/event
Full model Log loss : -2.49097
Full model ln_yyx : 6236.17008 nats/sec, 103.53163 nats/event
Full model Log loss : -2.51370
Full model ln_yyx : 6241.47542 nats/sec, 103.61971 nats/event
Full model Log loss : -2.51382
Full model ln_yyx : 6269.26246 nats/sec, 104.08102 nats/event
Full model Log loss : -2.51315
Full model ln_yyx : 6220.61857 nats/sec, 103.27344 nats/event
Full model Log loss : -2.49608
Full model ln_yyx : 6273.02835 nats/sec, 104.14354 nats/event
Full model Log loss : -2.51314
Full model ln_yyx : 6245.07581 nats/sec, 103.67948 nats/event
Full model Log loss : -2.51339
Full model ln_yyx : 6244.55893 nats/sec, 103.67090 nats/event
Full model Log loss : -2.51334
Full model ln_yyx : 6276.75285 nats/sec, 104.20537 nats/event
Full model Log loss : -2.51343
Full model ln_yyx : 6233.98766 nats/sec, 103.49540 nats/event
Full model Log loss : -2.49799
Full model ln_yyx : 6265.97601 nats/sec, 104.02646 nats/event
Full model Log loss : -2.49824
Optimization finished. Config saved to results/opt-full/opt_full_292_best_config.txt
[I 2026-03-18 20:30:13,748] Trial 45 finished with value: -2.513625390147211 and parameters: {'n_layers_yyx': 1, 'hidden_size_yyx_l0': 6, 'context_size_yyx': 1, 'num_mix_components_yyx': 5, 'context_extractor_yyx': 'lstm', 'activation_func_yyx': 'ReLU', 'L2_weight_yyx': 9.636169934870766e-05, 'L_entropy_weight_yyx': 3.7385869764698985e-08, 'L_sep_weight_yyx': 5.874820942720862e-07, 'L_scale_weight_yyx': 2.721051538615588e-10, 'learning_rate_yyx': 0.008079071732022672}. Best is trial 45 with value: -2.513625390147211.
[I 2026-03-18 20:30:15,070] Trial 48 pruned. 
[I 2026-03-18 20:30:17,921] Trial 41 finished with value: -2.5135128231956845 and parameters: {'n_layers_yyx': 1, 'hidden_size_yyx_l0': 4, 'context_size_yyx': 4, 'num_mix_components_yyx': 3, 'context_extractor_yyx': 'gru', 'activation_func_yyx': 'ReLU', 'L2_weight_yyx': 7.404167468060123e-09, 'L_entropy_weight_yyx': 4.011168017517934e-08, 'L_sep_weight_yyx': 1.1932966592730537e-10, 'L_scale_weight_yyx': 2.3283487924934304e-10, 'learning_rate_yyx': 0.008694619634027616}. Best is trial 5 with value: -2.5140323195684524.
[I 2026-03-18 20:30:27,748] Trial 35 pruned. 
[I 2026-03-18 20:30:31,024] Trial 46 pruned. 
[I 2026-03-18 20:30:38,543] Trial 47 pruned. 
[I 2026-03-18 20:30:47,131] Trial 36 pruned. 
[I 2026-03-18 20:30:49,535] Trial 37 pruned. 
[I 2026-03-18 20:30:54,649] Trial 49 pruned. 

Source events: 18269
Target events: 10683
Full model ln_yyx : 716.26270 nats/sec, 60.34227 nats/event
Full model Log loss : -2.01388
Full model ln_yyx : 705.50821 nats/sec, 59.43624 nats/event
Full model Log loss : -1.96809
Full model ln_yyx : 720.58525 nats/sec, 60.70642 nats/event
Full model Log loss : -2.00832
Full model ln_yyx : 713.45511 nats/sec, 60.10574 nats/event
Full model Log loss : -2.01136
Full model ln_yyx : 716.72186 nats/sec, 60.38095 nats/event
Full model Log loss : -2.01055
Full model ln_yyx : 717.62627 nats/sec, 60.45714 nats/event
Full model Log loss : -2.00942
Full model ln_yyx : 717.75137 nats/sec, 60.46768 nats/event
Full model Log loss : -2.00825
Full model ln_yyx : 720.79651 nats/sec, 60.72422 nats/event
Full model Log loss : -2.01045
Full model ln_yyx : 714.15286 nats/sec, 60.16452 nats/event
Full model Log loss : -2.01285
Full model ln_yyx : 713.75894 nats/sec, 60.13133 nats/event
Full model Log loss : -2.01346
Full model ln_yyx : 720.05948 nats/sec, 60.66213 nats/event
Full model Log loss : -2.01381
Full model ln_yyx : 705.05403 nats/sec, 59.39798 nats/event
Full model Log loss : -1.98929
Full model ln_yyx : 716.12278 nats/sec, 60.33048 nats/event
Full model Log loss : -2.01300
Full model ln_yyx : 709.92137 nats/sec, 59.80803 nats/event
Full model Log loss : -1.98580
Full model ln_yyx : 713.55208 nats/sec, 60.11391 nats/event
Full model Log loss : -2.01349
Full model ln_yyx : 714.42279 nats/sec, 60.18726 nats/event
Full model Log loss : -2.01267
Full model ln_yyx : 709.73281 nats/sec, 59.79215 nats/event
Full model Log loss : -2.01195
Full model ln_yyx : 715.79915 nats/sec, 60.30321 nats/event
Full model Log loss : -2.01156
Optimization finished. Config saved to results/opt-full/opt_full_318_best_config.txt
[I 2026-03-18 20:30:59,114] Trial 48 pruned. 
[I 2026-03-18 20:31:00,272] Trial 38 pruned. 
[I 2026-03-18 20:31:19,423] Trial 49 pruned. 

Source events: 27060
Target events: 5634
Full model ln_yyx : 645.84180 nats/sec, 103.16962 nats/event
Full model Log loss : -2.49803
Full model ln_yyx : 648.25128 nats/sec, 103.55452 nats/event
Full model Log loss : -2.51316
Full model ln_yyx : 630.80465 nats/sec, 100.76752 nats/event
Full model Log loss : -2.45813
Full model ln_yyx : 650.75782 nats/sec, 103.95492 nats/event
Full model Log loss : -2.51325
Full model ln_yyx : 638.73868 nats/sec, 102.03493 nats/event
Full model Log loss : -2.49026
Full model ln_yyx : 649.44199 nats/sec, 103.74473 nats/event
Full model Log loss : -2.51026
Full model ln_yyx : 651.70634 nats/sec, 104.10644 nats/event
Full model Log loss : -2.51330
Full model ln_yyx : 647.43545 nats/sec, 103.42419 nats/event
Full model Log loss : -2.51302
Full model ln_yyx : 649.94151 nats/sec, 103.82452 nats/event
Full model Log loss : -2.51100
Full model ln_yyx : 649.60831 nats/sec, 103.77130 nats/event
Full model Log loss : -2.51107
Full model ln_yyx : 651.49723 nats/sec, 104.07304 nats/event
Full model Log loss : -2.51290
Full model ln_yyx : 654.22726 nats/sec, 104.50915 nats/event
Full model Log loss : -2.51264
Full model ln_yyx : 647.99166 nats/sec, 103.51304 nats/event
Full model Log loss : -2.50794
Full model ln_yyx : 653.81813 nats/sec, 104.44379 nats/event
Full model Log loss : -2.51158
Full model ln_yyx : 651.11630 nats/sec, 104.01219 nats/event
Full model Log loss : -2.51363
Optimization finished. Config saved to results/opt-full/opt_full_293_best_config.txt
[I 2026-03-18 20:31:29,652] Trial 43 finished with value: -2.515220795429969 and parameters: {'n_layers_yyx': 2, 'hidden_size_yyx_l0': 2, 'hidden_size_yyx_l1': 5, 'context_size_yyx': 3, 'num_mix_components_yyx': 5, 'context_extractor_yyx': 'lstm', 'activation_func_yyx': 'ReLU', 'L2_weight_yyx': 1.02695370605973e-06, 'L_entropy_weight_yyx': 2.188369537533603e-05, 'L_sep_weight_yyx': 1.429951791647051e-09, 'L_scale_weight_yyx': 6.82902877527617e-05, 'learning_rate_yyx': 0.009000382653703658}. Best is trial 22 with value: -2.5155989726836543.
[I 2026-03-18 20:31:39,394] Trial 45 finished with value: -2.5120075998836593 and parameters: {'n_layers_yyx': 1, 'hidden_size_yyx_l0': 3, 'context_size_yyx': 4, 'num_mix_components_yyx': 1, 'context_extractor_yyx': 'lstm', 'activation_func_yyx': 'ReLU', 'L2_weight_yyx': 0.0007174785556219671, 'L_entropy_weight_yyx': 2.3554638173818237e-08, 'L_sep_weight_yyx': 4.476784121014556e-06, 'L_scale_weight_yyx': 5.98658558214346e-07, 'learning_rate_yyx': 0.007461350493304551}. Best is trial 33 with value: -2.512931905705113.
[I 2026-03-18 20:31:47,209] Trial 42 finished with value: -2.5136954868861605 and parameters: {'n_layers_yyx': 1, 'hidden_size_yyx_l0': 4, 'context_size_yyx': 4, 'num_mix_components_yyx': 3, 'context_extractor_yyx': 'gru', 'activation_func_yyx': 'ReLU', 'L2_weight_yyx': 1.0826519704785638e-10, 'L_entropy_weight_yyx': 2.16326025590873e-08, 'L_sep_weight_yyx': 0.00043014015115349854, 'L_scale_weight_yyx': 4.414279080366604e-10, 'learning_rate_yyx': 0.009818991426769275}. Best is trial 5 with value: -2.5140323195684524.
[I 2026-03-18 20:31:47,224] Trial 37 finished with value: -2.512633667567448 and parameters: {'n_layers_yyx': 2, 'hidden_size_yyx_l0': 5, 'hidden_size_yyx_l1': 6, 'context_size_yyx': 4, 'num_mix_components_yyx': 3, 'context_extractor_yyx': 'gru', 'activation_func_yyx': 'GELU', 'L2_weight_yyx': 1.1571030309669585e-08, 'L_entropy_weight_yyx': 1.3991302002967303e-07, 'L_sep_weight_yyx': 1.0084236979257884e-06, 'L_scale_weight_yyx': 6.134409992670069e-10, 'learning_rate_yyx': 0.009862231213721396}. Best is trial 12 with value: -2.51518345292619.
[I 2026-03-18 20:32:06,396] Trial 44 finished with value: -2.5120074640171164 and parameters: {'n_layers_yyx': 2, 'hidden_size_yyx_l0': 5, 'hidden_size_yyx_l1': 6, 'context_size_yyx': 1, 'num_mix_components_yyx': 4, 'context_extractor_yyx': 'gru', 'activation_func_yyx': 'ReLU', 'L2_weight_yyx': 4.196898339709386e-09, 'L_entropy_weight_yyx': 3.8294595114462775e-07, 'L_sep_weight_yyx': 1.1754248735741594e-09, 'L_scale_weight_yyx': 2.562430708027214e-08, 'learning_rate_yyx': 0.007962384776188415}. Best is trial 36 with value: -2.5139452208666837.
[I 2026-03-18 20:32:17,045] Trial 45 pruned. 
[I 2026-03-18 20:32:19,068] Trial 44 finished with value: -2.5080835706228375 and parameters: {'n_layers_yyx': 2, 'hidden_size_yyx_l0': 2, 'hidden_size_yyx_l1': 6, 'context_size_yyx': 4, 'num_mix_components_yyx': 5, 'context_extractor_yyx': 'lstm', 'activation_func_yyx': 'ReLU', 'L2_weight_yyx': 1.3285956923963245e-06, 'L_entropy_weight_yyx': 2.613249514338588e-05, 'L_sep_weight_yyx': 5.480315565238648e-10, 'L_scale_weight_yyx': 6.0805211309119465e-05, 'learning_rate_yyx': 0.009953079374693325}. Best is trial 22 with value: -2.5155989726836543.
[I 2026-03-18 20:32:27,988] Trial 45 pruned. 
[I 2026-03-18 20:32:35,162] Trial 38 pruned. 
[I 2026-03-18 20:32:48,219] Trial 46 pruned. 
[I 2026-03-18 20:32:54,822] Trial 39 pruned. 
[I 2026-03-18 20:33:00,617] Trial 39 finished with value: -2.51221927279689 and parameters: {'n_layers_yyx': 1, 'hidden_size_yyx_l0': 4, 'context_size_yyx': 4, 'num_mix_components_yyx': 5, 'context_extractor_yyx': 'gru', 'activation_func_yyx': 'GELU', 'L2_weight_yyx': 2.4562602545176875e-09, 'L_entropy_weight_yyx': 6.242682784817471e-07, 'L_sep_weight_yyx': 2.6029657359052692e-08, 'L_scale_weight_yyx': 3.904217399945611e-05, 'learning_rate_yyx': 0.008679756681493398}. Best is trial 26 with value: -2.512613867095458.
[I 2026-03-18 20:33:04,370] Trial 43 finished with value: -2.5129935535249257 and parameters: {'n_layers_yyx': 1, 'hidden_size_yyx_l0': 4, 'context_size_yyx': 4, 'num_mix_components_yyx': 3, 'context_extractor_yyx': 'gru', 'activation_func_yyx': 'ReLU', 'L2_weight_yyx': 7.014803930843982e-10, 'L_entropy_weight_yyx': 2.464872570014433e-07, 'L_sep_weight_yyx': 0.0005320254196599985, 'L_scale_weight_yyx': 2.5414970222575388e-09, 'learning_rate_yyx': 0.009963037639477887}. Best is trial 5 with value: -2.5140323195684524.
[I 2026-03-18 20:33:10,041] Trial 40 pruned. 
[I 2026-03-18 20:33:23,906] Trial 46 finished with value: -2.511532455783932 and parameters: {'n_layers_yyx': 2, 'hidden_size_yyx_l0': 5, 'hidden_size_yyx_l1': 6, 'context_size_yyx': 1, 'num_mix_components_yyx': 5, 'context_extractor_yyx': 'lstm', 'activation_func_yyx': 'ReLU', 'L2_weight_yyx': 4.354689540241232e-09, 'L_entropy_weight_yyx': 2.8826183783694932e-08, 'L_sep_weight_yyx': 3.1295608563577924e-10, 'L_scale_weight_yyx': 3.1192840837357895e-10, 'learning_rate_yyx': 0.009871510951138977}. Best is trial 36 with value: -2.5139452208666837.
[I 2026-03-18 20:33:27,692] Trial 46 finished with value: -2.511733488178163 and parameters: {'n_layers_yyx': 1, 'hidden_size_yyx_l0': 3, 'context_size_yyx': 4, 'num_mix_components_yyx': 1, 'context_extractor_yyx': 'lstm', 'activation_func_yyx': 'ReLU', 'L2_weight_yyx': 0.0009724307871560989, 'L_entropy_weight_yyx': 1.5569686185029443e-08, 'L_sep_weight_yyx': 8.838641227792627e-07, 'L_scale_weight_yyx': 4.647569262769449e-06, 'learning_rate_yyx': 0.008312058133832567}. Best is trial 33 with value: -2.512931905705113.
[I 2026-03-18 20:33:29,055] Trial 41 pruned. 
[I 2026-03-18 20:33:47,485] Trial 47 pruned. 
[I 2026-03-18 20:33:48,348] Trial 42 pruned. 
[I 2026-03-18 20:33:53,328] Trial 44 pruned. 
[I 2026-03-18 20:33:57,412] Trial 40 finished with value: -2.494021730126355 and parameters: {'n_layers_yyx': 2, 'hidden_size_yyx_l0': 4, 'hidden_size_yyx_l1': 4, 'context_size_yyx': 4, 'num_mix_components_yyx': 5, 'context_extractor_yyx': 'lstm', 'activation_func_yyx': 'GELU', 'L2_weight_yyx': 1.91610415117699e-09, 'L_entropy_weight_yyx': 7.05947614681257e-07, 'L_sep_weight_yyx': 2.616867885801385e-08, 'L_scale_weight_yyx': 0.00017024101513923436, 'learning_rate_yyx': 0.008652970373693707}. Best is trial 26 with value: -2.512613867095458.
[I 2026-03-18 20:34:08,380] Trial 43 pruned. 
[I 2026-03-18 20:34:09,047] Trial 47 finished with value: -2.512549946061309 and parameters: {'n_layers_yyx': 2, 'hidden_size_yyx_l0': 2, 'hidden_size_yyx_l1': 5, 'context_size_yyx': 4, 'num_mix_components_yyx': 5, 'context_extractor_yyx': 'lstm', 'activation_func_yyx': 'ReLU', 'L2_weight_yyx': 0.0007895299595707551, 'L_entropy_weight_yyx': 1.6488950910709083e-05, 'L_sep_weight_yyx': 5.958730847150837e-09, 'L_scale_weight_yyx': 0.0005449880512576195, 'learning_rate_yyx': 0.006428420825706469}. Best is trial 22 with value: -2.5155989726836543.
[I 2026-03-18 20:34:15,254] Trial 44 pruned. 
[I 2026-03-18 20:34:16,792] Trial 48 pruned. 
[I 2026-03-18 20:34:24,527] Trial 45 pruned. 
[I 2026-03-18 20:34:26,366] Trial 49 pruned. 

Source events: 27060
Target events: 20315
Full model ln_yyx : 2341.34407 nats/sec, 103.72679 nats/event
Full model Log loss : -2.51081
Full model ln_yyx : 2336.67208 nats/sec, 103.51981 nats/event
Full model Log loss : -2.51068
Full model ln_yyx : 2318.15964 nats/sec, 102.69966 nats/event
Full model Log loss : -2.48989
Full model ln_yyx : 2330.43649 nats/sec, 103.24356 nats/event
Full model Log loss : -2.49819
Full model ln_yyx : 2315.00347 nats/sec, 102.55984 nats/event
Full model Log loss : -2.49846
Full model ln_yyx : 2343.45231 nats/sec, 103.82019 nats/event
Full model Log loss : -2.51185
Full model ln_yyx : 2332.10852 nats/sec, 103.31763 nats/event
Full model Log loss : -2.50828
Full model ln_yyx : 2346.75231 nats/sec, 103.96638 nats/event
Full model Log loss : -2.51227
Full model ln_yyx : 2340.48454 nats/sec, 103.68871 nats/event
Full model Log loss : -2.51560
Full model ln_yyx : 2357.22072 nats/sec, 104.43016 nats/event
Full model Log loss : -2.51534
Full model ln_yyx : 2316.39081 nats/sec, 102.62130 nats/event
Full model Log loss : -2.49814
Full model ln_yyx : 2368.56154 nats/sec, 104.93258 nats/event
Full model Log loss : -2.51406
Full model ln_yyx : 2318.60822 nats/sec, 102.71954 nats/event
Full model Log loss : -2.49654
Full model ln_yyx : 2359.26113 nats/sec, 104.52055 nats/event
Full model Log loss : -2.51303
Full model ln_yyx : 2336.43467 nats/sec, 103.50929 nats/event
Full model Log loss : -2.51022
Full model ln_yyx : 2347.64824 nats/sec, 104.00608 nats/event
Full model Log loss : -2.51421
Full model ln_yyx : 2340.36695 nats/sec, 103.68350 nats/event
Full model Log loss : -2.51087
Full model ln_yyx : 2341.57010 nats/sec, 103.73680 nats/event
Full model Log loss : -2.51509
Full model ln_yyx : 2345.69869 nats/sec, 103.91971 nats/event
Full model Log loss : -2.51502
Full model ln_yyx : 2342.72077 nats/sec, 103.78778 nats/event
Full model Log loss : -2.51522
Full model ln_yyx : 2340.56995 nats/sec, 103.69249 nats/event
Full model Log loss : -2.50808
Full model ln_yyx : 2340.72368 nats/sec, 103.69930 nats/event
Full model Log loss : -2.51255
Optimization finished. Config saved to results/opt-full/opt_full_290_best_config.txt
[I 2026-03-18 20:34:34,861] Trial 47 finished with value: -2.5114044223988294 and parameters: {'n_layers_yyx': 2, 'hidden_size_yyx_l0': 5, 'hidden_size_yyx_l1': 6, 'context_size_yyx': 1, 'num_mix_components_yyx': 5, 'context_extractor_yyx': 'lstm', 'activation_func_yyx': 'ReLU', 'L2_weight_yyx': 6.786846054947509e-10, 'L_entropy_weight_yyx': 2.0897236365899355e-08, 'L_sep_weight_yyx': 1.1168259953165761e-10, 'L_scale_weight_yyx': 2.0670872776078776e-10, 'learning_rate_yyx': 0.009591381217886288}. Best is trial 36 with value: -2.5139452208666837.
[I 2026-03-18 20:35:08,935] Trial 46 pruned. 
[I 2026-03-18 20:35:16,917] Trial 47 pruned. 
[I 2026-03-18 20:35:25,719] Trial 48 pruned. 
[I 2026-03-18 20:35:27,792] Trial 45 finished with value: -2.513943371000744 and parameters: {'n_layers_yyx': 1, 'hidden_size_yyx_l0': 4, 'context_size_yyx': 4, 'num_mix_components_yyx': 3, 'context_extractor_yyx': 'gru', 'activation_func_yyx': 'ReLU', 'L2_weight_yyx': 1.1836573618580834e-10, 'L_entropy_weight_yyx': 9.92293020797065e-09, 'L_sep_weight_yyx': 0.000893929167891452, 'L_scale_weight_yyx': 6.40570365756436e-09, 'learning_rate_yyx': 0.0072671905033773005}. Best is trial 5 with value: -2.5140323195684524.
[I 2026-03-18 20:35:33,330] Trial 49 pruned. 

Source events: 27060
Target events: 32635
Full model ln_yyx : 3757.39572 nats/sec, 103.62053 nats/event
Full model Log loss : -2.51205
Full model ln_yyx : 3739.91317 nats/sec, 103.13841 nats/event
Full model Log loss : -2.50864
Full model ln_yyx : 3753.66816 nats/sec, 103.51774 nats/event
Full model Log loss : -2.50859
Full model ln_yyx : 3748.83118 nats/sec, 103.38434 nats/event
Full model Log loss : -2.49765
Full model ln_yyx : 3741.36775 nats/sec, 103.17852 nats/event
Full model Log loss : -2.49739
Full model ln_yyx : 3767.12226 nats/sec, 103.88877 nats/event
Full model Log loss : -2.51449
Full model ln_yyx : 3764.45587 nats/sec, 103.81524 nats/event
Full model Log loss : -2.51457
Full model ln_yyx : 3771.52789 nats/sec, 104.01027 nats/event
Full model Log loss : -2.51518
Full model ln_yyx : 3786.30570 nats/sec, 104.41781 nats/event
Full model Log loss : -2.51410
Full model ln_yyx : 3781.07533 nats/sec, 104.27356 nats/event
Full model Log loss : -2.51431
Full model ln_yyx : 3764.75636 nats/sec, 103.82352 nats/event
Full model Log loss : -2.51078
Full model ln_yyx : 3769.56803 nats/sec, 103.95622 nats/event
Full model Log loss : -2.51484
Full model ln_yyx : 3749.28981 nats/sec, 103.39699 nats/event
Full model Log loss : -2.51351
Full model ln_yyx : 3765.60403 nats/sec, 103.84690 nats/event
Full model Log loss : -2.51432
Full model ln_yyx : 3771.00916 nats/sec, 103.99596 nats/event
Full model Log loss : -2.51517
Full model ln_yyx : 3749.95166 nats/sec, 103.41524 nats/event
Full model Log loss : -2.51135
Full model ln_yyx : 3746.53881 nats/sec, 103.32113 nats/event
Full model Log loss : -2.51263
Optimization finished. Config saved to results/opt-full/opt_full_295_best_config.txt
[I 2026-03-18 20:35:36,464] Trial 48 finished with value: -2.5115083387238895 and parameters: {'n_layers_yyx': 2, 'hidden_size_yyx_l0': 5, 'hidden_size_yyx_l1': 6, 'context_size_yyx': 1, 'num_mix_components_yyx': 5, 'context_extractor_yyx': 'lstm', 'activation_func_yyx': 'ReLU', 'L2_weight_yyx': 4.544921788139215e-09, 'L_entropy_weight_yyx': 1.796933368253401e-08, 'L_sep_weight_yyx': 1.6418899817335693e-10, 'L_scale_weight_yyx': 3.116099139059804e-10, 'learning_rate_yyx': 0.009781539179351215}. Best is trial 36 with value: -2.5139452208666837.
