[I 2026-03-18 16:55:51,409] Trial 2 finished with value: -2.804056782641035 and parameters: {'n_layers_yyx': 2, 'hidden_size_yyx_l0': 3, 'hidden_size_yyx_l1': 2, 'context_size_yyx': 1, 'num_mix_components_yyx': 3, 'context_extractor_yyx': 'gru', 'activation_func_yyx': 'GELU', 'L2_weight_yyx': 4.0028913832338045e-10, 'L_entropy_weight_yyx': 2.8290730604543517e-09, 'L_sep_weight_yyx': 2.543060732918777e-07, 'L_scale_weight_yyx': 3.7406083142713086e-05, 'learning_rate_yyx': 0.00562016543272226}. Best is trial 1 with value: -2.9237901005488465.
[I 2026-03-18 16:55:51,902] Trial 10 pruned. 
[I 2026-03-18 16:55:52,804] Trial 10 finished with value: -2.9487242821305313 and parameters: {'n_layers_yyx': 1, 'hidden_size_yyx_l0': 6, 'context_size_yyx': 3, 'num_mix_components_yyx': 4, 'context_extractor_yyx': 'gru', 'activation_func_yyx': 'ReLU', 'L2_weight_yyx': 1.6685635380028957e-06, 'L_entropy_weight_yyx': 0.0009681344845742726, 'L_sep_weight_yyx': 1.8798442864373496e-10, 'L_scale_weight_yyx': 7.755462513238952e-09, 'learning_rate_yyx': 0.009339770351499004}. Best is trial 10 with value: -2.9487242821305313.
[I 2026-03-18 16:55:52,845] Trial 8 finished with value: -0.563180642737975 and parameters: {'n_layers_yyx': 1, 'hidden_size_yyx_l0': 2, 'context_size_yyx': 1, 'num_mix_components_yyx': 4, 'context_extractor_yyx': 'gru', 'activation_func_yyx': 'ReLU', 'L2_weight_yyx': 1.3377262855936819e-08, 'L_entropy_weight_yyx': 7.984517735093523e-05, 'L_sep_weight_yyx': 1.9319216200572544e-09, 'L_scale_weight_yyx': 4.230834538492503e-10, 'learning_rate_yyx': 0.0009525964078264172}. Best is trial 0 with value: -0.5744275876219695.
[I 2026-03-18 16:55:54,786] Trial 7 pruned. 
[I 2026-03-18 16:56:00,430] Trial 3 pruned. 
[I 2026-03-18 16:56:07,489] Trial 20 pruned. 
[I 2026-03-18 16:56:17,603] Trial 9 finished with value: -0.5628077364033485 and parameters: {'n_layers_yyx': 1, 'hidden_size_yyx_l0': 5, 'context_size_yyx': 3, 'num_mix_components_yyx': 5, 'context_extractor_yyx': 'gru', 'activation_func_yyx': 'ReLU', 'L2_weight_yyx': 7.48595414665371e-07, 'L_entropy_weight_yyx': 3.1025053034368587e-06, 'L_sep_weight_yyx': 5.025365987507127e-09, 'L_scale_weight_yyx': 9.099621339614524e-09, 'learning_rate_yyx': 0.006120656001013082}. Best is trial 1 with value: -0.5777964847779832.
[I 2026-03-18 16:56:27,809] Trial 11 pruned. 
[I 2026-03-18 16:56:28,209] Trial 21 pruned. 
[I 2026-03-18 16:56:37,459] Trial 10 pruned. 
[I 2026-03-18 16:56:40,864] Trial 3 pruned. 
[I 2026-03-18 16:56:50,604] Trial 22 pruned. 
[I 2026-03-18 16:56:52,265] Trial 25 pruned. 
[I 2026-03-18 16:56:58,707] Trial 11 pruned. 
[I 2026-03-18 16:57:02,360] Trial 2 finished with value: -2.795888126467552 and parameters: {'n_layers_yyx': 2, 'hidden_size_yyx_l0': 6, 'hidden_size_yyx_l1': 3, 'context_size_yyx': 3, 'num_mix_components_yyx': 1, 'context_extractor_yyx': 'lstm', 'activation_func_yyx': 'Tanh', 'L2_weight_yyx': 9.593289165328833e-08, 'L_entropy_weight_yyx': 1.8878540281794172e-08, 'L_sep_weight_yyx': 4.839410512142621e-06, 'L_scale_weight_yyx': 1.0684782720595203e-05, 'learning_rate_yyx': 0.0022162194981441897}. Best is trial 1 with value: -2.907263897671221.
[I 2026-03-18 16:57:09,670] Trial 7 finished with value: -2.3926267561381116 and parameters: {'n_layers_yyx': 2, 'hidden_size_yyx_l0': 5, 'hidden_size_yyx_l1': 3, 'context_size_yyx': 4, 'num_mix_components_yyx': 1, 'context_extractor_yyx': 'gru', 'activation_func_yyx': 'ReLU', 'L2_weight_yyx': 6.608577612735899e-10, 'L_entropy_weight_yyx': 1.4646093636510008e-10, 'L_sep_weight_yyx': 3.0761107625082074e-06, 'L_scale_weight_yyx': 1.7060282903499488e-08, 'learning_rate_yyx': 0.00940526612733429}. Best is trial 3 with value: -2.912014575059884.
[I 2026-03-18 16:57:10,986] Trial 9 finished with value: -0.5432441218191196 and parameters: {'n_layers_yyx': 1, 'hidden_size_yyx_l0': 3, 'context_size_yyx': 1, 'num_mix_components_yyx': 1, 'context_extractor_yyx': 'gru', 'activation_func_yyx': 'ReLU', 'L2_weight_yyx': 2.416434028440803e-07, 'L_entropy_weight_yyx': 2.8551861167364524e-09, 'L_sep_weight_yyx': 1.1831617652682785e-07, 'L_scale_weight_yyx': 0.00012649219887870208, 'learning_rate_yyx': 0.0013397268429734554}. Best is trial 8 with value: -0.5564177669226057.
[I 2026-03-18 16:57:15,434] Trial 5 finished with value: -2.8913845691305786 and parameters: {'n_layers_yyx': 2, 'hidden_size_yyx_l0': 2, 'hidden_size_yyx_l1': 2, 'context_size_yyx': 3, 'num_mix_components_yyx': 3, 'context_extractor_yyx': 'lstm', 'activation_func_yyx': 'Tanh', 'L2_weight_yyx': 2.0108294820011165e-10, 'L_entropy_weight_yyx': 2.6302870052950903e-07, 'L_sep_weight_yyx': 4.592525227287066e-07, 'L_scale_weight_yyx': 4.948535546472423e-05, 'learning_rate_yyx': 0.0023810252963645307}. Best is trial 0 with value: -2.9352535799904658.
[I 2026-03-18 16:57:20,459] Trial 12 finished with value: -0.5638868077421123 and parameters: {'n_layers_yyx': 2, 'hidden_size_yyx_l0': 5, 'hidden_size_yyx_l1': 2, 'context_size_yyx': 4, 'num_mix_components_yyx': 4, 'context_extractor_yyx': 'lstm', 'activation_func_yyx': 'GELU', 'L2_weight_yyx': 1.3675346764759541e-05, 'L_entropy_weight_yyx': 2.5119114077435284e-05, 'L_sep_weight_yyx': 2.8073889307996666e-05, 'L_scale_weight_yyx': 1.2954673765908458e-09, 'learning_rate_yyx': 0.009546486728648941}. Best is trial 0 with value: -0.5683635517524394.
[I 2026-03-18 16:57:25,416] Trial 26 pruned. 
[I 2026-03-18 16:57:28,261] Trial 12 finished with value: -0.5750686456609461 and parameters: {'n_layers_yyx': 1, 'hidden_size_yyx_l0': 5, 'context_size_yyx': 2, 'num_mix_components_yyx': 4, 'context_extractor_yyx': 'lstm', 'activation_func_yyx': 'ReLU', 'L2_weight_yyx': 4.993884580859955e-05, 'L_entropy_weight_yyx': 0.0008536834793035493, 'L_sep_weight_yyx': 2.8130684977811064e-07, 'L_scale_weight_yyx': 3.5144804776080185e-08, 'learning_rate_yyx': 0.009327066913812115}. Best is trial 11 with value: -0.5770469571078168.
[I 2026-03-18 16:57:28,395] Trial 9 pruned. 
[I 2026-03-18 16:57:38,415] Trial 8 pruned. 
[I 2026-03-18 16:57:43,708] Trial 13 pruned. 
[I 2026-03-18 16:57:44,555] Trial 8 finished with value: -0.5566644681697043 and parameters: {'n_layers_yyx': 2, 'hidden_size_yyx_l0': 4, 'hidden_size_yyx_l1': 2, 'context_size_yyx': 1, 'num_mix_components_yyx': 2, 'context_extractor_yyx': 'gru', 'activation_func_yyx': 'Tanh', 'L2_weight_yyx': 8.990278065708632e-10, 'L_entropy_weight_yyx': 2.8206370707503146e-06, 'L_sep_weight_yyx': 4.477232494497626e-08, 'L_scale_weight_yyx': 6.75882972107152e-10, 'learning_rate_yyx': 0.005466923722376394}. Best is trial 0 with value: -0.5748618229547262.
[I 2026-03-18 16:57:51,690] Trial 13 pruned. 
[I 2026-03-18 16:57:58,826] Trial 11 finished with value: -0.6036315569693964 and parameters: {'n_layers_yyx': 1, 'hidden_size_yyx_l0': 5, 'context_size_yyx': 3, 'num_mix_components_yyx': 3, 'context_extractor_yyx': 'gru', 'activation_func_yyx': 'Tanh', 'L2_weight_yyx': 0.0005204350895217593, 'L_entropy_weight_yyx': 1.0974821760490962e-08, 'L_sep_weight_yyx': 0.0008308493665793763, 'L_scale_weight_yyx': 2.155832328449052e-06, 'learning_rate_yyx': 0.005891298253142268}. Best is trial 2 with value: -0.6113786030767988.
[I 2026-03-18 16:58:08,953] Trial 6 pruned. 
[I 2026-03-18 16:58:10,548] Trial 27 pruned. 
[I 2026-03-18 16:58:11,301] Trial 6 finished with value: -0.5554226923841558 and parameters: {'n_layers_yyx': 1, 'hidden_size_yyx_l0': 5, 'context_size_yyx': 3, 'num_mix_components_yyx': 5, 'context_extractor_yyx': 'lstm', 'activation_func_yyx': 'GELU', 'L2_weight_yyx': 2.0802142393756744e-08, 'L_entropy_weight_yyx': 5.285551668461417e-08, 'L_sep_weight_yyx': 3.9785699606242196e-08, 'L_scale_weight_yyx': 3.9430047387747023e-07, 'learning_rate_yyx': 0.002141576217977029}. Best is trial 3 with value: -0.5576903541281594.
[I 2026-03-18 16:58:29,016] Trial 14 pruned. 
[I 2026-03-18 16:58:33,212] Trial 26 pruned. 
[I 2026-03-18 16:58:33,534] Trial 9 pruned. 
[I 2026-03-18 16:58:35,750] Trial 7 pruned. 
[I 2026-03-18 16:58:42,972] Trial 12 pruned. 
[I 2026-03-18 16:58:55,605] Trial 8 finished with value: -0.5746158982897395 and parameters: {'n_layers_yyx': 1, 'hidden_size_yyx_l0': 3, 'context_size_yyx': 4, 'num_mix_components_yyx': 3, 'context_extractor_yyx': 'gru', 'activation_func_yyx': 'Tanh', 'L2_weight_yyx': 4.2343518343942466e-10, 'L_entropy_weight_yyx': 8.174739439789369e-06, 'L_sep_weight_yyx': 8.01780535446901e-09, 'L_scale_weight_yyx': 3.8851748916540155e-08, 'learning_rate_yyx': 0.00900267145550588}. Best is trial 1 with value: -0.5818196838462861.
[I 2026-03-18 16:58:55,716] Trial 3 finished with value: -2.9432662371367564 and parameters: {'n_layers_yyx': 2, 'hidden_size_yyx_l0': 5, 'hidden_size_yyx_l1': 5, 'context_size_yyx': 3, 'num_mix_components_yyx': 5, 'context_extractor_yyx': 'gru', 'activation_func_yyx': 'ReLU', 'L2_weight_yyx': 9.131243063674102e-06, 'L_entropy_weight_yyx': 1.1324464051338913e-09, 'L_sep_weight_yyx': 1.493058177893912e-09, 'L_scale_weight_yyx': 0.00010731482423092881, 'learning_rate_yyx': 0.008026763332974982}. Best is trial 0 with value: -2.957957273051406.
[I 2026-03-18 16:58:59,153] Trial 10 pruned. 
[I 2026-03-18 16:59:02,965] Trial 8 pruned. 
[I 2026-03-18 16:59:05,324] Trial 12 finished with value: -0.5768598008188618 and parameters: {'n_layers_yyx': 1, 'hidden_size_yyx_l0': 6, 'context_size_yyx': 3, 'num_mix_components_yyx': 5, 'context_extractor_yyx': 'gru', 'activation_func_yyx': 'ReLU', 'L2_weight_yyx': 2.2043572502223387e-09, 'L_entropy_weight_yyx': 2.7926568890035242e-08, 'L_sep_weight_yyx': 1.3597433077799126e-08, 'L_scale_weight_yyx': 1.7387605747520413e-08, 'learning_rate_yyx': 0.009791567856299348}. Best is trial 1 with value: -0.5777964847779832.
[I 2026-03-18 16:59:19,147] Trial 10 finished with value: -0.5667190236927226 and parameters: {'n_layers_yyx': 2, 'hidden_size_yyx_l0': 4, 'hidden_size_yyx_l1': 6, 'context_size_yyx': 2, 'num_mix_components_yyx': 4, 'context_extractor_yyx': 'lstm', 'activation_func_yyx': 'ReLU', 'L2_weight_yyx': 3.7266475705561895e-08, 'L_entropy_weight_yyx': 6.455024866277349e-07, 'L_sep_weight_yyx': 0.00028405582831631855, 'L_scale_weight_yyx': 0.0008790564851249861, 'learning_rate_yyx': 0.008192683418142888}. Best is trial 10 with value: -0.5667190236927226.
[I 2026-03-18 16:59:22,053] Trial 2 finished with value: -2.3907007221491483 and parameters: {'n_layers_yyx': 2, 'hidden_size_yyx_l0': 3, 'hidden_size_yyx_l1': 3, 'context_size_yyx': 1, 'num_mix_components_yyx': 1, 'context_extractor_yyx': 'lstm', 'activation_func_yyx': 'GELU', 'L2_weight_yyx': 2.890733789061715e-09, 'L_entropy_weight_yyx': 5.231753560100271e-09, 'L_sep_weight_yyx': 1.468445265615073e-05, 'L_scale_weight_yyx': 9.772319136749248e-10, 'learning_rate_yyx': 0.0010712399864283395}. Best is trial 1 with value: -2.875781089897074.
[I 2026-03-18 16:59:23,368] Trial 13 pruned. 
[I 2026-03-18 16:59:40,716] Trial 4 finished with value: -2.398597382561342 and parameters: {'n_layers_yyx': 1, 'hidden_size_yyx_l0': 4, 'context_size_yyx': 3, 'num_mix_components_yyx': 1, 'context_extractor_yyx': 'gru', 'activation_func_yyx': 'Tanh', 'L2_weight_yyx': 2.0130622643542307e-08, 'L_entropy_weight_yyx': 2.2691286973715095e-07, 'L_sep_weight_yyx': 6.108381252303407e-05, 'L_scale_weight_yyx': 2.9794287954516625e-05, 'learning_rate_yyx': 0.0070403724253940226}. Best is trial 0 with value: -2.9085693359375.
[I 2026-03-18 16:59:47,255] Trial 13 pruned. 
[I 2026-03-18 16:59:57,903] Trial 11 finished with value: -0.565715889491274 and parameters: {'n_layers_yyx': 2, 'hidden_size_yyx_l0': 4, 'hidden_size_yyx_l1': 2, 'context_size_yyx': 3, 'num_mix_components_yyx': 4, 'context_extractor_yyx': 'lstm', 'activation_func_yyx': 'ReLU', 'L2_weight_yyx': 9.639471724827796e-08, 'L_entropy_weight_yyx': 0.0008059548311523302, 'L_sep_weight_yyx': 4.3085059282105475e-05, 'L_scale_weight_yyx': 6.813508244209443e-08, 'learning_rate_yyx': 0.0018666176811672635}. Best is trial 6 with value: -0.5805135147115715.
[I 2026-03-18 16:59:58,061] Trial 23 finished with value: -0.5772900482975305 and parameters: {'n_layers_yyx': 1, 'hidden_size_yyx_l0': 6, 'context_size_yyx': 3, 'num_mix_components_yyx': 3, 'context_extractor_yyx': 'gru', 'activation_func_yyx': 'Tanh', 'L2_weight_yyx': 5.052368817603992e-05, 'L_entropy_weight_yyx': 7.013218297657095e-08, 'L_sep_weight_yyx': 6.973890596898652e-07, 'L_scale_weight_yyx': 9.5983267966311e-09, 'learning_rate_yyx': 0.0026331924336921125}. Best is trial 3 with value: -0.5836324153936877.
[I 2026-03-18 17:00:05,179] Trial 10 finished with value: -0.57893176387068 and parameters: {'n_layers_yyx': 2, 'hidden_size_yyx_l0': 4, 'hidden_size_yyx_l1': 6, 'context_size_yyx': 4, 'num_mix_components_yyx': 4, 'context_extractor_yyx': 'gru', 'activation_func_yyx': 'GELU', 'L2_weight_yyx': 5.7554305678459205e-08, 'L_entropy_weight_yyx': 2.100837284960818e-09, 'L_sep_weight_yyx': 1.8528563193467374e-08, 'L_scale_weight_yyx': 0.0006026616357218944, 'learning_rate_yyx': 0.009130301534602007}. Best is trial 10 with value: -0.57893176387068.
[I 2026-03-18 17:00:06,404] Trial 27 pruned. 
[I 2026-03-18 17:00:08,520] Trial 5 pruned. 
[I 2026-03-18 17:00:12,610] Trial 8 finished with value: -0.3877515290912829 and parameters: {'n_layers_yyx': 1, 'hidden_size_yyx_l0': 6, 'context_size_yyx': 4, 'num_mix_components_yyx': 1, 'context_extractor_yyx': 'lstm', 'activation_func_yyx': 'Tanh', 'L2_weight_yyx': 0.000919650594938724, 'L_entropy_weight_yyx': 1.5401801629849645e-07, 'L_sep_weight_yyx': 4.994464462463541e-07, 'L_scale_weight_yyx': 2.3453292284233706e-08, 'learning_rate_yyx': 0.000704246710693032}. Best is trial 0 with value: -0.4346305445620888.
[I 2026-03-18 17:00:13,939] Trial 2 finished with value: -2.9414705477515914 and parameters: {'n_layers_yyx': 2, 'hidden_size_yyx_l0': 4, 'hidden_size_yyx_l1': 3, 'context_size_yyx': 3, 'num_mix_components_yyx': 3, 'context_extractor_yyx': 'gru', 'activation_func_yyx': 'Tanh', 'L2_weight_yyx': 5.770468300100458e-07, 'L_entropy_weight_yyx': 2.3196698930593954e-08, 'L_sep_weight_yyx': 0.00015149955357665173, 'L_scale_weight_yyx': 1.1828268802106409e-08, 'learning_rate_yyx': 0.0030084596223943247}. Best is trial 2 with value: -2.9414705477515914.
[I 2026-03-18 17:00:17,288] Trial 12 finished with value: -0.5831595188649845 and parameters: {'n_layers_yyx': 2, 'hidden_size_yyx_l0': 4, 'hidden_size_yyx_l1': 6, 'context_size_yyx': 1, 'num_mix_components_yyx': 3, 'context_extractor_yyx': 'lstm', 'activation_func_yyx': 'Tanh', 'L2_weight_yyx': 1.4824355019932366e-10, 'L_entropy_weight_yyx': 1.514967995899622e-05, 'L_sep_weight_yyx': 1.4834381638357675e-06, 'L_scale_weight_yyx': 4.0185123821828346e-06, 'learning_rate_yyx': 0.0018097114882233288}. Best is trial 6 with value: -0.5907732977991746.
[I 2026-03-18 17:00:31,456] Trial 9 pruned. 
[I 2026-03-18 17:00:32,562] Trial 9 pruned. 
[I 2026-03-18 17:00:38,915] Trial 13 pruned. 
[I 2026-03-18 17:00:49,343] Trial 14 finished with value: -0.5660837795252321 and parameters: {'n_layers_yyx': 1, 'hidden_size_yyx_l0': 5, 'context_size_yyx': 2, 'num_mix_components_yyx': 3, 'context_extractor_yyx': 'lstm', 'activation_func_yyx': 'ReLU', 'L2_weight_yyx': 6.758381716980352e-05, 'L_entropy_weight_yyx': 0.0002330597304030456, 'L_sep_weight_yyx': 2.6149056802127e-07, 'L_scale_weight_yyx': 1.8641055788863595e-07, 'learning_rate_yyx': 0.00617240248386712}. Best is trial 11 with value: -0.5770469571078168.
[I 2026-03-18 17:00:53,323] Trial 10 pruned. 
[I 2026-03-18 17:00:53,534] Trial 2 finished with value: -2.8964856061680533 and parameters: {'n_layers_yyx': 1, 'hidden_size_yyx_l0': 2, 'context_size_yyx': 1, 'num_mix_components_yyx': 4, 'context_extractor_yyx': 'gru', 'activation_func_yyx': 'Tanh', 'L2_weight_yyx': 2.37327092996715e-10, 'L_entropy_weight_yyx': 2.200960341685569e-06, 'L_sep_weight_yyx': 4.1671097253696984e-06, 'L_scale_weight_yyx': 6.536865234356484e-05, 'learning_rate_yyx': 0.005455097210705528}. Best is trial 1 with value: -2.915453504445994.
[I 2026-03-18 17:00:54,597] Trial 10 pruned. 
[I 2026-03-18 17:01:03,855] Trial 3 pruned. 
[I 2026-03-18 17:01:08,291] Trial 6 finished with value: -2.8575542593738144 and parameters: {'n_layers_yyx': 1, 'hidden_size_yyx_l0': 6, 'context_size_yyx': 3, 'num_mix_components_yyx': 1, 'context_extractor_yyx': 'gru', 'activation_func_yyx': 'Tanh', 'L2_weight_yyx': 0.000213457773269976, 'L_entropy_weight_yyx': 1.6347596118572301e-10, 'L_sep_weight_yyx': 3.2343029645552516e-10, 'L_scale_weight_yyx': 8.162189323971164e-06, 'learning_rate_yyx': 0.005417698957299125}. Best is trial 1 with value: -2.8982837772538264.
[I 2026-03-18 17:01:14,377] Trial 14 finished with value: -0.5660515103632645 and parameters: {'n_layers_yyx': 1, 'hidden_size_yyx_l0': 5, 'context_size_yyx': 2, 'num_mix_components_yyx': 2, 'context_extractor_yyx': 'gru', 'activation_func_yyx': 'ReLU', 'L2_weight_yyx': 2.0000021186940445e-05, 'L_entropy_weight_yyx': 1.3739985513295807e-09, 'L_sep_weight_yyx': 0.00013680350645731195, 'L_scale_weight_yyx': 1.491739972074704e-10, 'learning_rate_yyx': 0.009112765747485407}. Best is trial 2 with value: -0.6113786030767988.
[I 2026-03-18 17:01:16,907] Trial 11 finished with value: -0.5665682198420844 and parameters: {'n_layers_yyx': 2, 'hidden_size_yyx_l0': 4, 'hidden_size_yyx_l1': 6, 'context_size_yyx': 2, 'num_mix_components_yyx': 4, 'context_extractor_yyx': 'lstm', 'activation_func_yyx': 'ReLU', 'L2_weight_yyx': 1.9529821851211486e-08, 'L_entropy_weight_yyx': 7.002972420122481e-07, 'L_sep_weight_yyx': 0.000899557333347511, 'L_scale_weight_yyx': 0.0009299083926970738, 'learning_rate_yyx': 0.008237082639320546}. Best is trial 10 with value: -0.5667190236927226.
[I 2026-03-18 17:01:20,005] Trial 3 pruned. 
[I 2026-03-18 17:01:20,871] Trial 14 pruned. 
[I 2026-03-18 17:01:22,575] Trial 9 finished with value: -0.5709985368353464 and parameters: {'n_layers_yyx': 2, 'hidden_size_yyx_l0': 4, 'hidden_size_yyx_l1': 4, 'context_size_yyx': 1, 'num_mix_components_yyx': 1, 'context_extractor_yyx': 'lstm', 'activation_func_yyx': 'Tanh', 'L2_weight_yyx': 1.805470775688805e-06, 'L_entropy_weight_yyx': 7.709049305472048e-08, 'L_sep_weight_yyx': 0.0002444144875300046, 'L_scale_weight_yyx': 2.467105947649467e-10, 'learning_rate_yyx': 0.003774298340039285}. Best is trial 0 with value: -0.5748618229547262.
[I 2026-03-18 17:01:30,489] Trial 4 pruned. 
[I 2026-03-18 17:01:31,966] Trial 24 pruned. 
[I 2026-03-18 17:01:32,662] Trial 12 pruned. 
[I 2026-03-18 17:01:34,440] Trial 14 finished with value: -0.5753870863042146 and parameters: {'n_layers_yyx': 1, 'hidden_size_yyx_l0': 6, 'context_size_yyx': 3, 'num_mix_components_yyx': 5, 'context_extractor_yyx': 'gru', 'activation_func_yyx': 'GELU', 'L2_weight_yyx': 4.1884361355766015e-09, 'L_entropy_weight_yyx': 1.1544938659054754e-10, 'L_sep_weight_yyx': 3.8448540505952975e-06, 'L_scale_weight_yyx': 2.330156628505109e-09, 'learning_rate_yyx': 0.009989751898098522}. Best is trial 1 with value: -0.5777964847779832.
[I 2026-03-18 17:01:39,071] Trial 28 pruned. 
[I 2026-03-18 17:01:39,135] Trial 11 pruned. 
[I 2026-03-18 17:01:43,550] Trial 28 finished with value: -0.5658929502127751 and parameters: {'n_layers_yyx': 2, 'hidden_size_yyx_l0': 6, 'hidden_size_yyx_l1': 4, 'context_size_yyx': 3, 'num_mix_components_yyx': 1, 'context_extractor_yyx': 'lstm', 'activation_func_yyx': 'GELU', 'L2_weight_yyx': 2.7948702557241655e-10, 'L_entropy_weight_yyx': 3.186524932646845e-07, 'L_sep_weight_yyx': 0.0003234124082058103, 'L_scale_weight_yyx': 5.351199180241526e-07, 'learning_rate_yyx': 0.005532250370201779}. Best is trial 0 with value: -0.5660314966592697.
[I 2026-03-18 17:01:46,486] Trial 4 pruned. 
[I 2026-03-18 17:01:48,866] Trial 11 finished with value: -2.9333633061195945 and parameters: {'n_layers_yyx': 1, 'hidden_size_yyx_l0': 6, 'context_size_yyx': 3, 'num_mix_components_yyx': 4, 'context_extractor_yyx': 'gru', 'activation_func_yyx': 'ReLU', 'L2_weight_yyx': 2.228174929878433e-06, 'L_entropy_weight_yyx': 0.0007767685149087588, 'L_sep_weight_yyx': 1.1881456421812688e-10, 'L_scale_weight_yyx': 5.734287586066446e-09, 'learning_rate_yyx': 0.009559424218707388}. Best is trial 10 with value: -2.9487242821305313.
[I 2026-03-18 17:01:52,542] Trial 15 pruned. 
[I 2026-03-18 17:01:55,299] Trial 5 pruned. 
[I 2026-03-18 17:01:55,323] Trial 13 pruned. 
[I 2026-03-18 17:01:59,832] Trial 29 pruned. 
[I 2026-03-18 17:02:00,069] Trial 7 pruned. 
[I 2026-03-18 17:02:01,468] Trial 2 finished with value: -2.8933541742254545 and parameters: {'n_layers_yyx': 2, 'hidden_size_yyx_l0': 3, 'hidden_size_yyx_l1': 2, 'context_size_yyx': 2, 'num_mix_components_yyx': 3, 'context_extractor_yyx': 'gru', 'activation_func_yyx': 'ReLU', 'L2_weight_yyx': 1.5438855455057883e-06, 'L_entropy_weight_yyx': 1.6735343945570176e-09, 'L_sep_weight_yyx': 1.455319198861107e-08, 'L_scale_weight_yyx': 3.135354980381654e-06, 'learning_rate_yyx': 0.0010794825611800504}. Best is trial 2 with value: -2.8933541742254545.
[I 2026-03-18 17:02:02,165] Trial 7 finished with value: -0.5371155876568948 and parameters: {'n_layers_yyx': 1, 'hidden_size_yyx_l0': 5, 'context_size_yyx': 2, 'num_mix_components_yyx': 1, 'context_extractor_yyx': 'lstm', 'activation_func_yyx': 'Tanh', 'L2_weight_yyx': 5.468100893281564e-06, 'L_entropy_weight_yyx': 1.9570718733445648e-07, 'L_sep_weight_yyx': 6.577726044587271e-09, 'L_scale_weight_yyx': 8.4140925036862e-05, 'learning_rate_yyx': 0.003747427561700958}. Best is trial 3 with value: -0.5576903541281594.
[I 2026-03-18 17:02:04,641] Trial 6 finished with value: -2.851325161578495 and parameters: {'n_layers_yyx': 1, 'hidden_size_yyx_l0': 2, 'context_size_yyx': 2, 'num_mix_components_yyx': 5, 'context_extractor_yyx': 'gru', 'activation_func_yyx': 'Tanh', 'L2_weight_yyx': 4.659025164103776e-07, 'L_entropy_weight_yyx': 0.000171539226482831, 'L_sep_weight_yyx': 7.720236873724807e-06, 'L_scale_weight_yyx': 1.5161916814454162e-07, 'learning_rate_yyx': 0.0005425464701584844}. Best is trial 0 with value: -2.9702180140077377.
