[I 2026-03-18 20:18:38,681] Trial 42 finished with value: -2.06104018200729 and parameters: {'n_layers_yyx': 2, 'hidden_size_yyx_l0': 6, 'hidden_size_yyx_l1': 6, 'context_size_yyx': 2, 'num_mix_components_yyx': 4, 'context_extractor_yyx': 'lstm', 'activation_func_yyx': 'GELU', 'L2_weight_yyx': 3.171373483507601e-08, 'L_entropy_weight_yyx': 4.782609721138742e-07, 'L_sep_weight_yyx': 0.00029702669364305634, 'L_scale_weight_yyx': 0.00035523754279802387, 'learning_rate_yyx': 0.009954528221121656}. Best is trial 41 with value: -2.0671816006912174.
[I 2026-03-18 20:18:42,301] Trial 31 finished with value: -2.092647833371027 and parameters: {'n_layers_yyx': 1, 'hidden_size_yyx_l0': 4, 'context_size_yyx': 2, 'num_mix_components_yyx': 4, 'context_extractor_yyx': 'gru', 'activation_func_yyx': 'Tanh', 'L2_weight_yyx': 4.298345411783373e-05, 'L_entropy_weight_yyx': 4.339764890067466e-10, 'L_sep_weight_yyx': 3.827108735294462e-05, 'L_scale_weight_yyx': 8.741066318942894e-05, 'learning_rate_yyx': 0.008496680020396101}. Best is trial 11 with value: -2.095012278283745.
[I 2026-03-18 20:19:01,498] Trial 33 pruned. 
[I 2026-03-18 20:19:03,046] Trial 48 pruned. 
[I 2026-03-18 20:19:03,516] Trial 48 pruned. 
[I 2026-03-18 20:19:11,384] Trial 42 finished with value: -1.6027406839483918 and parameters: {'n_layers_yyx': 1, 'hidden_size_yyx_l0': 6, 'context_size_yyx': 2, 'num_mix_components_yyx': 5, 'context_extractor_yyx': 'gru', 'activation_func_yyx': 'GELU', 'L2_weight_yyx': 8.531952691770826e-07, 'L_entropy_weight_yyx': 9.043320639157332e-08, 'L_sep_weight_yyx': 6.78730817074651e-07, 'L_scale_weight_yyx': 0.00023125440232825482, 'learning_rate_yyx': 0.005022024047434387}. Best is trial 30 with value: -1.6152616083569185.
[I 2026-03-18 20:19:11,525] Trial 44 pruned. 
[I 2026-03-18 20:19:12,730] Trial 35 pruned. 
[I 2026-03-18 20:19:16,503] Trial 49 pruned. 

Source events: 16159
Target events: 20315
Full model ln_yyx : 1235.72100 nats/sec, 54.74521 nats/event
Full model Log loss : -2.08425
Full model ln_yyx : 1241.37351 nats/sec, 54.99563 nats/event
Full model Log loss : -2.08187
Full model ln_yyx : 1217.87627 nats/sec, 53.95465 nats/event
Full model Log loss : -2.09023
Full model ln_yyx : 1222.51137 nats/sec, 54.15999 nats/event
Full model Log loss : -2.09405
Full model ln_yyx : 1232.53582 nats/sec, 54.60410 nats/event
Full model Log loss : -2.09562
Full model ln_yyx : 1232.70630 nats/sec, 54.61165 nats/event
Full model Log loss : -2.09582
Full model ln_yyx : 1242.63585 nats/sec, 55.05155 nats/event
Full model Log loss : -2.09614
Full model ln_yyx : 1240.31471 nats/sec, 54.94872 nats/event
Full model Log loss : -2.09750
Full model ln_yyx : 1239.49652 nats/sec, 54.91247 nats/event
Full model Log loss : -2.09488
Full model ln_yyx : 1224.46232 nats/sec, 54.24642 nats/event
Full model Log loss : -2.09430
Full model ln_yyx : 1240.41222 nats/sec, 54.95304 nats/event
Full model Log loss : -2.09640
Full model ln_yyx : 1237.25331 nats/sec, 54.81309 nats/event
Full model Log loss : -2.09608
Full model ln_yyx : 1217.63790 nats/sec, 53.94409 nats/event
Full model Log loss : -2.08107
Full model ln_yyx : 1236.88312 nats/sec, 54.79669 nats/event
Full model Log loss : -2.09572
Optimization finished. Config saved to results/opt-full/opt_full_398_best_config.txt
[I 2026-03-18 20:19:22,891] Trial 49 pruned. 

Source events: 11540
Target events: 10683
Full model ln_yyx : 396.15939 nats/sec, 33.37484 nats/event
Full model Log loss : -1.60717
Full model ln_yyx : 395.51824 nats/sec, 33.32083 nats/event
Full model Log loss : -1.61138
Full model ln_yyx : 382.44918 nats/sec, 32.21981 nats/event
Full model Log loss : -1.55208
Full model ln_yyx : 393.74954 nats/sec, 33.17182 nats/event
Full model Log loss : -1.60798
Full model ln_yyx : 385.19494 nats/sec, 32.45113 nats/event
Full model Log loss : -1.58672
Full model ln_yyx : 392.56112 nats/sec, 33.07170 nats/event
Full model Log loss : -1.58020
Full model ln_yyx : 395.53612 nats/sec, 33.32234 nats/event
Full model Log loss : -1.60569
Full model ln_yyx : 388.28557 nats/sec, 32.71151 nats/event
Full model Log loss : -1.58691
Full model ln_yyx : 389.97745 nats/sec, 32.85404 nats/event
Full model Log loss : -1.58525
Full model ln_yyx : 393.74248 nats/sec, 33.17123 nats/event
Full model Log loss : -1.60402
Full model ln_yyx : 391.90339 nats/sec, 33.01629 nats/event
Full model Log loss : -1.60893
Full model ln_yyx : 395.34523 nats/sec, 33.30625 nats/event
Full model Log loss : -1.60904
Full model ln_yyx : 394.57609 nats/sec, 33.24146 nats/event
Full model Log loss : -1.60950
Full model ln_yyx : 390.39352 nats/sec, 32.88909 nats/event
Full model Log loss : -1.61143
Full model ln_yyx : 394.36683 nats/sec, 33.22383 nats/event
Full model Log loss : -1.61077
Full model ln_yyx : 393.65195 nats/sec, 33.16360 nats/event
Full model Log loss : -1.61108
Full model ln_yyx : 392.26199 nats/sec, 33.04650 nats/event
Full model Log loss : -1.60918
Full model ln_yyx : 396.94322 nats/sec, 33.44088 nats/event
Full model Log loss : -1.60934
Full model ln_yyx : 394.25502 nats/sec, 33.21441 nats/event
Full model Log loss : -1.60678
Full model ln_yyx : 394.18627 nats/sec, 33.20862 nats/event
Full model Log loss : -1.60986
Optimization finished. Config saved to results/opt-full/opt_full_390_best_config.txt
[I 2026-03-18 20:19:23,954] Trial 45 pruned. 
[I 2026-03-18 20:19:30,055] Trial 34 pruned. 
[I 2026-03-18 20:19:35,327] Trial 45 finished with value: -2.0869042292715543 and parameters: {'n_layers_yyx': 1, 'hidden_size_yyx_l0': 3, 'context_size_yyx': 2, 'num_mix_components_yyx': 4, 'context_extractor_yyx': 'gru', 'activation_func_yyx': 'ReLU', 'L2_weight_yyx': 7.1648610308013e-08, 'L_entropy_weight_yyx': 1.0155030018939803e-07, 'L_sep_weight_yyx': 5.618120557287378e-05, 'L_scale_weight_yyx': 1.0623302082148919e-07, 'learning_rate_yyx': 0.008061085654330571}. Best is trial 12 with value: -2.0975572887346234.
[I 2026-03-18 20:19:38,462] Trial 43 pruned. 
[I 2026-03-18 20:19:43,157] Trial 36 finished with value: -1.6124555454304832 and parameters: {'n_layers_yyx': 1, 'hidden_size_yyx_l0': 5, 'context_size_yyx': 2, 'num_mix_components_yyx': 4, 'context_extractor_yyx': 'lstm', 'activation_func_yyx': 'GELU', 'L2_weight_yyx': 0.0003566753255484924, 'L_entropy_weight_yyx': 2.5902228116176746e-05, 'L_sep_weight_yyx': 0.00028138563848744325, 'L_scale_weight_yyx': 7.705271723731787e-08, 'learning_rate_yyx': 0.008201432186659285}. Best is trial 9 with value: -1.613731891101604.
[I 2026-03-18 20:19:45,721] Trial 35 pruned. 
[I 2026-03-18 20:19:52,255] Trial 34 finished with value: -2.1147271266496515 and parameters: {'n_layers_yyx': 1, 'hidden_size_yyx_l0': 2, 'context_size_yyx': 3, 'num_mix_components_yyx': 4, 'context_extractor_yyx': 'lstm', 'activation_func_yyx': 'ReLU', 'L2_weight_yyx': 3.1616404151328755e-08, 'L_entropy_weight_yyx': 5.8733132256154496e-05, 'L_sep_weight_yyx': 2.1871000880802992e-06, 'L_scale_weight_yyx': 1.2571784084520186e-08, 'learning_rate_yyx': 0.008210074837240112}. Best is trial 10 with value: -2.123509279126982.
[I 2026-03-18 20:19:56,078] Trial 46 pruned. 
[I 2026-03-18 20:20:02,737] Trial 49 finished with value: -1.6117957413354946 and parameters: {'n_layers_yyx': 2, 'hidden_size_yyx_l0': 2, 'hidden_size_yyx_l1': 4, 'context_size_yyx': 4, 'num_mix_components_yyx': 2, 'context_extractor_yyx': 'gru', 'activation_func_yyx': 'Tanh', 'L2_weight_yyx': 7.620109779896198e-08, 'L_entropy_weight_yyx': 1.4199536349613454e-06, 'L_sep_weight_yyx': 1.2355832093899955e-07, 'L_scale_weight_yyx': 3.1493272432450634e-05, 'learning_rate_yyx': 0.0076542079211610456}. Best is trial 13 with value: -1.613792101823724.

Source events: 11540
Target events: 31112
Full model ln_yyx : 1143.14566 nats/sec, 33.06863 nats/event
Full model Log loss : -1.61164
Full model ln_yyx : 1130.61771 nats/sec, 32.70622 nats/event
Full model Log loss : -1.58885
Full model ln_yyx : 1156.41024 nats/sec, 33.45234 nats/event
Full model Log loss : -1.60782
Full model ln_yyx : 1147.61315 nats/sec, 33.19786 nats/event
Full model Log loss : -1.61345
Full model ln_yyx : 1142.81945 nats/sec, 33.05919 nats/event
Full model Log loss : -1.61321
Full model ln_yyx : 1150.38728 nats/sec, 33.27811 nats/event
Full model Log loss : -1.61312
Full model ln_yyx : 1145.92301 nats/sec, 33.14897 nats/event
Full model Log loss : -1.61153
Full model ln_yyx : 1144.21163 nats/sec, 33.09946 nats/event
Full model Log loss : -1.61379
Full model ln_yyx : 1157.59219 nats/sec, 33.48653 nats/event
Full model Log loss : -1.61256
Full model ln_yyx : 1148.29478 nats/sec, 33.21758 nats/event
Full model Log loss : -1.61173
Full model ln_yyx : 1151.74466 nats/sec, 33.31738 nats/event
Full model Log loss : -1.61285
Full model ln_yyx : 1143.25121 nats/sec, 33.07168 nats/event
Full model Log loss : -1.61176
Full model ln_yyx : 1145.21587 nats/sec, 33.12851 nats/event
Full model Log loss : -1.61290
Full model ln_yyx : 1143.29739 nats/sec, 33.07302 nats/event
Full model Log loss : -1.61180
Optimization finished. Config saved to results/opt-full/opt_full_384_best_config.txt
[I 2026-03-18 20:20:07,149] Trial 43 pruned. 
[I 2026-03-18 20:20:09,775] Trial 44 pruned. 
[I 2026-03-18 20:20:10,942] Trial 47 pruned. 
[I 2026-03-18 20:20:15,007] Trial 49 pruned. 

Source events: 11540
Target events: 3618
Full model ln_yyx : 133.31047 nats/sec, 33.16181 nats/event
Full model Log loss : -1.62851
Full model ln_yyx : 133.11902 nats/sec, 33.11418 nats/event
Full model Log loss : -1.63082
Full model ln_yyx : 135.03654 nats/sec, 33.59118 nats/event
Full model Log loss : -1.64699
Full model ln_yyx : 133.08884 nats/sec, 33.10668 nats/event
Full model Log loss : -1.63324
Full model ln_yyx : 135.48639 nats/sec, 33.70308 nats/event
Full model Log loss : -1.64950
Full model ln_yyx : 136.12990 nats/sec, 33.86316 nats/event
Full model Log loss : -1.64795
Full model ln_yyx : 136.95615 nats/sec, 34.06869 nats/event
Full model Log loss : -1.65310
Full model ln_yyx : 134.58943 nats/sec, 33.47996 nats/event
Full model Log loss : -1.65245
Full model ln_yyx : 135.23187 nats/sec, 33.63977 nats/event
Full model Log loss : -1.65100
Full model ln_yyx : 133.97125 nats/sec, 33.32618 nats/event
Full model Log loss : -1.64186
Full model ln_yyx : 135.47230 nats/sec, 33.69958 nats/event
Full model Log loss : -1.64855
Full model ln_yyx : 135.83876 nats/sec, 33.79074 nats/event
Full model Log loss : -1.64550
Full model ln_yyx : 135.10807 nats/sec, 33.60897 nats/event
Full model Log loss : -1.64995
Full model ln_yyx : 136.74612 nats/sec, 34.01645 nats/event
Full model Log loss : -1.64786
Full model ln_yyx : 136.21819 nats/sec, 33.88512 nats/event
Full model Log loss : -1.64884
Full model ln_yyx : 134.50535 nats/sec, 33.45904 nats/event
Full model Log loss : -1.64973
Optimization finished. Config saved to results/opt-full/opt_full_395_best_config.txt
[I 2026-03-18 20:20:29,927] Trial 43 finished with value: -2.0895725007774395 and parameters: {'n_layers_yyx': 1, 'hidden_size_yyx_l0': 5, 'context_size_yyx': 4, 'num_mix_components_yyx': 4, 'context_extractor_yyx': 'lstm', 'activation_func_yyx': 'ReLU', 'L2_weight_yyx': 1.2529928743553923e-07, 'L_entropy_weight_yyx': 3.434565662790666e-07, 'L_sep_weight_yyx': 3.320670932348083e-05, 'L_scale_weight_yyx': 7.433722874049749e-09, 'learning_rate_yyx': 0.008636109050672521}. Best is trial 2 with value: -2.093203554819634.
[I 2026-03-18 20:20:32,923] Trial 45 pruned. 
[I 2026-03-18 20:20:38,526] Trial 48 pruned. 
[I 2026-03-18 20:20:50,582] Trial 49 pruned. 

Source events: 11540
Target events: 20315
Full model ln_yyx : 759.29517 nats/sec, 33.63848 nats/event
Full model Log loss : -1.60939
Full model ln_yyx : 755.52531 nats/sec, 33.47146 nats/event
Full model Log loss : -1.60891
Full model ln_yyx : 747.13089 nats/sec, 33.09957 nats/event
Full model Log loss : -1.61230
Full model ln_yyx : 740.55179 nats/sec, 32.80810 nats/event
Full model Log loss : -1.58837
Full model ln_yyx : 742.14220 nats/sec, 32.87856 nats/event
Full model Log loss : -1.58748
Full model ln_yyx : 750.61438 nats/sec, 33.25390 nats/event
Full model Log loss : -1.61372
Full model ln_yyx : 754.43546 nats/sec, 33.42318 nats/event
Full model Log loss : -1.61405
Full model ln_yyx : 742.38536 nats/sec, 32.88933 nats/event
Full model Log loss : -1.61599
Full model ln_yyx : 748.48025 nats/sec, 33.15935 nats/event
Full model Log loss : -1.61673
Full model ln_yyx : 748.64118 nats/sec, 33.16648 nats/event
Full model Log loss : -1.61671
Full model ln_yyx : 746.71739 nats/sec, 33.08125 nats/event
Full model Log loss : -1.61693
Full model ln_yyx : 743.21824 nats/sec, 32.92623 nats/event
Full model Log loss : -1.61506
Full model ln_yyx : 751.94851 nats/sec, 33.31300 nats/event
Full model Log loss : -1.61285
Full model ln_yyx : 756.27887 nats/sec, 33.50485 nats/event
Full model Log loss : -1.61207
Full model ln_yyx : 754.25131 nats/sec, 33.41502 nats/event
Full model Log loss : -1.61106
Full model ln_yyx : 744.64364 nats/sec, 32.98938 nats/event
Full model Log loss : -1.61322
Optimization finished. Config saved to results/opt-full/opt_full_386_best_config.txt
[I 2026-03-18 20:20:51,461] Trial 43 finished with value: -2.059012441629046 and parameters: {'n_layers_yyx': 2, 'hidden_size_yyx_l0': 2, 'hidden_size_yyx_l1': 4, 'context_size_yyx': 3, 'num_mix_components_yyx': 1, 'context_extractor_yyx': 'lstm', 'activation_func_yyx': 'GELU', 'L2_weight_yyx': 3.374873222699538e-05, 'L_entropy_weight_yyx': 0.0007323113288424866, 'L_sep_weight_yyx': 2.4125495046694584e-07, 'L_scale_weight_yyx': 6.164392356058203e-06, 'learning_rate_yyx': 0.009737697522810845}. Best is trial 6 with value: -2.0790188514889616.
[I 2026-03-18 20:20:53,343] Trial 36 pruned. 
[I 2026-03-18 20:20:53,614] Trial 46 pruned. 
[I 2026-03-18 20:20:54,221] Trial 44 pruned. 
[I 2026-03-18 20:20:56,392] Trial 35 pruned. 
[I 2026-03-18 20:20:57,888] Trial 47 pruned. 
[I 2026-03-18 20:21:05,598] Trial 44 pruned. 
[I 2026-03-18 20:21:06,103] Trial 48 pruned. 
[I 2026-03-18 20:21:11,135] Trial 39 pruned. 
[I 2026-03-18 20:21:14,867] Trial 45 pruned. 
[I 2026-03-18 20:21:16,514] Trial 42 finished with value: -2.0770050939852305 and parameters: {'n_layers_yyx': 2, 'hidden_size_yyx_l0': 5, 'hidden_size_yyx_l1': 3, 'context_size_yyx': 3, 'num_mix_components_yyx': 5, 'context_extractor_yyx': 'lstm', 'activation_func_yyx': 'ReLU', 'L2_weight_yyx': 3.0352809877235873e-09, 'L_entropy_weight_yyx': 1.4435638013866558e-06, 'L_sep_weight_yyx': 0.0001779590949444491, 'L_scale_weight_yyx': 6.633683885144722e-05, 'learning_rate_yyx': 0.0028583652023766656}. Best is trial 35 with value: -2.0819980012390658.
[I 2026-03-18 20:21:25,716] Trial 40 pruned. 
[I 2026-03-18 20:21:32,851] Trial 46 pruned. 
[I 2026-03-18 20:21:43,351] Trial 36 finished with value: -2.0883816238316895 and parameters: {'n_layers_yyx': 1, 'hidden_size_yyx_l0': 6, 'context_size_yyx': 3, 'num_mix_components_yyx': 4, 'context_extractor_yyx': 'lstm', 'activation_func_yyx': 'Tanh', 'L2_weight_yyx': 1.3358961779681866e-06, 'L_entropy_weight_yyx': 7.763007521481639e-06, 'L_sep_weight_yyx': 8.704007118918781e-08, 'L_scale_weight_yyx': 1.184637922296669e-09, 'learning_rate_yyx': 0.007836363941962129}. Best is trial 24 with value: -2.0962241228606584.
[I 2026-03-18 20:21:47,275] Trial 45 pruned. 
[I 2026-03-18 20:21:48,845] Trial 37 pruned. 
[I 2026-03-18 20:21:56,238] Trial 49 pruned. 

Source events: 11540
Target events: 54211
Full model ln_yyx : 1964.86028 nats/sec, 32.62021 nats/event
Full model Log loss : -1.58879
Full model ln_yyx : 2002.79810 nats/sec, 33.25005 nats/event
Full model Log loss : -1.61124
Full model ln_yyx : 1999.47490 nats/sec, 33.19488 nats/event
Full model Log loss : -1.61332
Full model ln_yyx : 2010.51752 nats/sec, 33.37820 nats/event
Full model Log loss : -1.60698
Full model ln_yyx : 2003.58842 nats/sec, 33.26317 nats/event
Full model Log loss : -1.61260
Full model ln_yyx : 2015.75810 nats/sec, 33.46521 nats/event
Full model Log loss : -1.61192
Full model ln_yyx : 1997.76985 nats/sec, 33.16657 nats/event
Full model Log loss : -1.61207
Full model ln_yyx : 1994.99342 nats/sec, 33.12048 nats/event
Full model Log loss : -1.61189
Full model ln_yyx : 2013.67333 nats/sec, 33.43060 nats/event
Full model Log loss : -1.60761
Full model ln_yyx : 2005.49770 nats/sec, 33.29487 nats/event
Full model Log loss : -1.61526
Full model ln_yyx : 1981.10414 nats/sec, 32.88989 nats/event
Full model Log loss : -1.61340
Full model ln_yyx : 2008.08577 nats/sec, 33.33783 nats/event
Full model Log loss : -1.61033
Full model ln_yyx : 2007.48068 nats/sec, 33.32779 nats/event
Full model Log loss : -1.60895
Full model ln_yyx : 2015.31428 nats/sec, 33.45784 nats/event
Full model Log loss : -1.60274
Optimization finished. Config saved to results/opt-full/opt_full_388_best_config.txt
[I 2026-03-18 20:22:04,325] Trial 44 finished with value: -2.060731035537436 and parameters: {'n_layers_yyx': 2, 'hidden_size_yyx_l0': 6, 'hidden_size_yyx_l1': 6, 'context_size_yyx': 2, 'num_mix_components_yyx': 4, 'context_extractor_yyx': 'lstm', 'activation_func_yyx': 'GELU', 'L2_weight_yyx': 2.114677364864377e-08, 'L_entropy_weight_yyx': 2.0236784999509072e-07, 'L_sep_weight_yyx': 0.0005962174302337349, 'L_scale_weight_yyx': 0.00029031001520574086, 'learning_rate_yyx': 0.009196522750413511}. Best is trial 41 with value: -2.0671816006912174.
[I 2026-03-18 20:22:14,774] Trial 46 finished with value: -2.0817178926653948 and parameters: {'n_layers_yyx': 2, 'hidden_size_yyx_l0': 3, 'hidden_size_yyx_l1': 5, 'context_size_yyx': 3, 'num_mix_components_yyx': 2, 'context_extractor_yyx': 'lstm', 'activation_func_yyx': 'ReLU', 'L2_weight_yyx': 1.5327859289902047e-08, 'L_entropy_weight_yyx': 6.566629678761004e-07, 'L_sep_weight_yyx': 2.3553325095506624e-08, 'L_scale_weight_yyx': 4.244204300551626e-07, 'learning_rate_yyx': 0.005012331410971551}. Best is trial 8 with value: -2.0851807543284644.
[I 2026-03-18 20:22:17,057] Trial 43 pruned. 
[I 2026-03-18 20:22:26,057] Trial 44 pruned. 
[I 2026-03-18 20:22:32,132] Trial 32 finished with value: -2.092461587799053 and parameters: {'n_layers_yyx': 1, 'hidden_size_yyx_l0': 4, 'context_size_yyx': 2, 'num_mix_components_yyx': 4, 'context_extractor_yyx': 'gru', 'activation_func_yyx': 'Tanh', 'L2_weight_yyx': 2.1218995242263873e-06, 'L_entropy_weight_yyx': 2.872232835065503e-10, 'L_sep_weight_yyx': 1.770585356435464e-06, 'L_scale_weight_yyx': 9.136782631534546e-05, 'learning_rate_yyx': 0.008079893186075448}. Best is trial 11 with value: -2.095012278283745.
[I 2026-03-18 20:22:32,225] Trial 37 finished with value: -1.6118405446001025 and parameters: {'n_layers_yyx': 1, 'hidden_size_yyx_l0': 5, 'context_size_yyx': 2, 'num_mix_components_yyx': 5, 'context_extractor_yyx': 'lstm', 'activation_func_yyx': 'GELU', 'L2_weight_yyx': 0.000656928174233327, 'L_entropy_weight_yyx': 3.0443479296377655e-05, 'L_sep_weight_yyx': 0.00018842449793346402, 'L_scale_weight_yyx': 4.206297648975709e-08, 'learning_rate_yyx': 0.007634392812074437}. Best is trial 9 with value: -1.613731891101604.
[I 2026-03-18 20:22:39,130] Trial 45 pruned. 
[I 2026-03-18 20:22:39,132] Trial 46 finished with value: -2.0955084337987113 and parameters: {'n_layers_yyx': 1, 'hidden_size_yyx_l0': 4, 'context_size_yyx': 2, 'num_mix_components_yyx': 5, 'context_extractor_yyx': 'gru', 'activation_func_yyx': 'ReLU', 'L2_weight_yyx': 5.181046399962316e-09, 'L_entropy_weight_yyx': 1.0517242972351308e-07, 'L_sep_weight_yyx': 8.174004943048937e-09, 'L_scale_weight_yyx': 4.1510873520952776e-05, 'learning_rate_yyx': 0.008315705562837021}. Best is trial 12 with value: -2.0975572887346234.
[I 2026-03-18 20:22:47,764] Trial 33 pruned. 
[I 2026-03-18 20:22:48,643] Trial 46 pruned. 
[I 2026-03-18 20:22:50,044] Trial 38 pruned. 
[I 2026-03-18 20:22:53,800] Trial 46 pruned. 
[I 2026-03-18 20:23:06,080] Trial 45 pruned. 
[I 2026-03-18 20:23:06,477] Trial 47 pruned. 
[I 2026-03-18 20:23:19,417] Trial 41 finished with value: -1.6291499937596343 and parameters: {'n_layers_yyx': 2, 'hidden_size_yyx_l0': 2, 'hidden_size_yyx_l1': 5, 'context_size_yyx': 3, 'num_mix_components_yyx': 5, 'context_extractor_yyx': 'gru', 'activation_func_yyx': 'GELU', 'L2_weight_yyx': 0.0004863461567827222, 'L_entropy_weight_yyx': 1.2870177411306102e-06, 'L_sep_weight_yyx': 1.54702414253707e-09, 'L_scale_weight_yyx': 0.00014703700076955866, 'learning_rate_yyx': 0.004591100508365301}. Best is trial 22 with value: -1.6339605357080298.
[I 2026-03-18 20:23:31,748] Trial 38 pruned. 
[I 2026-03-18 20:23:40,280] Trial 36 finished with value: -2.116139831137689 and parameters: {'n_layers_yyx': 1, 'hidden_size_yyx_l0': 5, 'context_size_yyx': 1, 'num_mix_components_yyx': 5, 'context_extractor_yyx': 'lstm', 'activation_func_yyx': 'ReLU', 'L2_weight_yyx': 2.672203178218583e-09, 'L_entropy_weight_yyx': 3.0063865093918655e-09, 'L_sep_weight_yyx': 3.553715321670325e-08, 'L_scale_weight_yyx': 1.0215707061229264e-05, 'learning_rate_yyx': 0.006975036305144076}. Best is trial 10 with value: -2.123509279126982.
[I 2026-03-18 20:23:44,628] Trial 39 pruned. 
[I 2026-03-18 20:23:49,610] Trial 37 finished with value: -2.0946354899037325 and parameters: {'n_layers_yyx': 2, 'hidden_size_yyx_l0': 4, 'hidden_size_yyx_l1': 5, 'context_size_yyx': 4, 'num_mix_components_yyx': 4, 'context_extractor_yyx': 'gru', 'activation_func_yyx': 'Tanh', 'L2_weight_yyx': 4.2347852713598863e-07, 'L_entropy_weight_yyx': 4.454026585670179e-06, 'L_sep_weight_yyx': 9.37589045566054e-09, 'L_scale_weight_yyx': 4.304782655232337e-07, 'learning_rate_yyx': 0.008930853073335318}. Best is trial 24 with value: -2.0962241228606584.
