[I 2026-03-18 22:34:13,924] Trial 60 finished with value: -1.8490650754743791 and parameters: {'n_layers_yyx': 2, 'hidden_size_yyx_l0': 2, 'hidden_size_yyx_l1': 6, 'context_size_yyx': 4, 'num_mix_components_yyx': 4, 'context_extractor_yyx': 'lstm', 'activation_func_yyx': 'ReLU', 'L2_weight_yyx': 6.519341001287645e-09, 'L_entropy_weight_yyx': 7.106191972992085e-05, 'L_sep_weight_yyx': 3.4435038987278254e-05, 'L_scale_weight_yyx': 1.7777195840271942e-06, 'learning_rate_yyx': 0.006914405963182572}. Best is trial 60 with value: -1.8490650754743791.
[I 2026-03-18 22:34:17,466] Trial 44 finished with value: -1.9307703810286767 and parameters: {'n_layers_yyx': 2, 'hidden_size_yyx_l0': 5, 'hidden_size_yyx_l1': 5, 'context_size_yyx': 2, 'num_mix_components_yyx': 5, 'context_extractor_yyx': 'gru', 'activation_func_yyx': 'GELU', 'L2_weight_yyx': 2.0298750007673354e-06, 'L_entropy_weight_yyx': 0.00037268098116351395, 'L_sep_weight_yyx': 2.65625719700201e-06, 'L_scale_weight_yyx': 2.694749014002157e-08, 'learning_rate_yyx': 0.008876555787429602}. Best is trial 14 with value: -1.9337542258067992.
[I 2026-03-18 22:34:19,037] Trial 54 pruned. 
[I 2026-03-18 22:34:22,194] Trial 58 pruned. 
[I 2026-03-18 22:34:30,800] Trial 68 pruned. 
[I 2026-03-18 22:34:30,975] Trial 55 pruned. 
[I 2026-03-18 22:34:31,916] Trial 59 pruned. 
[I 2026-03-18 22:34:39,571] Trial 69 pruned. 
[I 2026-03-18 22:34:46,725] Trial 36 finished with value: -1.8548546128197008 and parameters: {'n_layers_yyx': 1, 'hidden_size_yyx_l0': 6, 'context_size_yyx': 3, 'num_mix_components_yyx': 3, 'context_extractor_yyx': 'lstm', 'activation_func_yyx': 'Tanh', 'L2_weight_yyx': 5.934385502719266e-09, 'L_entropy_weight_yyx': 1.0111189138018009e-05, 'L_sep_weight_yyx': 1.4506350845165127e-05, 'L_scale_weight_yyx': 2.3262452673121967e-05, 'learning_rate_yyx': 0.00797462010627248}. Best is trial 29 with value: -1.8570256329045391.
[I 2026-03-18 22:34:48,530] Trial 70 pruned. 
[I 2026-03-18 22:34:50,495] Trial 71 pruned. 
[I 2026-03-18 22:34:52,580] Trial 60 pruned. 
[I 2026-03-18 22:34:56,930] Trial 57 pruned. 
[I 2026-03-18 22:34:58,033] Trial 52 finished with value: -1.8684898771505702 and parameters: {'n_layers_yyx': 1, 'hidden_size_yyx_l0': 6, 'context_size_yyx': 4, 'num_mix_components_yyx': 3, 'context_extractor_yyx': 'lstm', 'activation_func_yyx': 'ReLU', 'L2_weight_yyx': 1.3080636929503021e-05, 'L_entropy_weight_yyx': 4.062690901178774e-10, 'L_sep_weight_yyx': 5.921664059249261e-05, 'L_scale_weight_yyx': 0.00011537279596244543, 'learning_rate_yyx': 0.008606516203146349}. Best is trial 42 with value: -1.8699069075199783.
[I 2026-03-18 22:34:58,709] Trial 72 pruned. 
[I 2026-03-18 22:35:07,279] Trial 73 pruned. 
[I 2026-03-18 22:35:07,550] Trial 37 pruned. 
[I 2026-03-18 22:35:17,748] Trial 38 pruned. 
[I 2026-03-18 22:35:24,489] Trial 74 pruned. 
[I 2026-03-18 22:35:24,756] Trial 55 finished with value: -1.8521101456587297 and parameters: {'n_layers_yyx': 2, 'hidden_size_yyx_l0': 6, 'hidden_size_yyx_l1': 4, 'context_size_yyx': 3, 'num_mix_components_yyx': 5, 'context_extractor_yyx': 'lstm', 'activation_func_yyx': 'Tanh', 'L2_weight_yyx': 1.2393742841528412e-05, 'L_entropy_weight_yyx': 3.954941794138728e-07, 'L_sep_weight_yyx': 2.1100536253660784e-09, 'L_scale_weight_yyx': 3.203754880215435e-07, 'learning_rate_yyx': 0.006321301126959642}. Best is trial 9 with value: -1.8570869006965198.
[I 2026-03-18 22:35:25,762] Trial 64 finished with value: -1.8967893096222275 and parameters: {'n_layers_yyx': 2, 'hidden_size_yyx_l0': 4, 'hidden_size_yyx_l1': 5, 'context_size_yyx': 4, 'num_mix_components_yyx': 3, 'context_extractor_yyx': 'lstm', 'activation_func_yyx': 'ReLU', 'L2_weight_yyx': 6.7454205048372985e-06, 'L_entropy_weight_yyx': 5.31722661636783e-09, 'L_sep_weight_yyx': 1.3925540153911204e-08, 'L_scale_weight_yyx': 5.59747050791542e-09, 'learning_rate_yyx': 0.007734239854744532}. Best is trial 55 with value: -1.8982689846521137.
[I 2026-03-18 22:35:26,187] Trial 62 finished with value: -1.850892318757309 and parameters: {'n_layers_yyx': 2, 'hidden_size_yyx_l0': 6, 'hidden_size_yyx_l1': 4, 'context_size_yyx': 3, 'num_mix_components_yyx': 2, 'context_extractor_yyx': 'gru', 'activation_func_yyx': 'Tanh', 'L2_weight_yyx': 4.4607926133174975e-08, 'L_entropy_weight_yyx': 1.8712118222060932e-10, 'L_sep_weight_yyx': 4.771167256884192e-08, 'L_scale_weight_yyx': 2.158266767552731e-10, 'learning_rate_yyx': 0.006596185750890514}. Best is trial 53 with value: -1.855205638988598.
[I 2026-03-18 22:35:29,781] Trial 57 finished with value: -1.8542249101941484 and parameters: {'n_layers_yyx': 1, 'hidden_size_yyx_l0': 5, 'context_size_yyx': 3, 'num_mix_components_yyx': 2, 'context_extractor_yyx': 'lstm', 'activation_func_yyx': 'GELU', 'L2_weight_yyx': 6.858371605880609e-09, 'L_entropy_weight_yyx': 6.92697328272479e-05, 'L_sep_weight_yyx': 0.0005582729910506027, 'L_scale_weight_yyx': 1.4272052864063151e-06, 'learning_rate_yyx': 0.0023557735971408817}. Best is trial 1 with value: -1.8555367853768732.
[I 2026-03-18 22:35:33,362] Trial 71 pruned. 
[I 2026-03-18 22:35:36,379] Trial 61 finished with value: -1.8458979294074087 and parameters: {'n_layers_yyx': 2, 'hidden_size_yyx_l0': 4, 'hidden_size_yyx_l1': 6, 'context_size_yyx': 4, 'num_mix_components_yyx': 3, 'context_extractor_yyx': 'gru', 'activation_func_yyx': 'ReLU', 'L2_weight_yyx': 6.2653047149907326e-09, 'L_entropy_weight_yyx': 0.0002242348424521324, 'L_sep_weight_yyx': 0.00014552057811385958, 'L_scale_weight_yyx': 4.793815537196471e-06, 'learning_rate_yyx': 0.0069343100622268035}. Best is trial 60 with value: -1.8490650754743791.
[I 2026-03-18 22:35:38,663] Trial 58 pruned. 
[I 2026-03-18 22:35:40,250] Trial 75 pruned. 
[I 2026-03-18 22:35:40,446] Trial 61 finished with value: -1.7815633631234218 and parameters: {'n_layers_yyx': 2, 'hidden_size_yyx_l0': 5, 'hidden_size_yyx_l1': 2, 'context_size_yyx': 1, 'num_mix_components_yyx': 3, 'context_extractor_yyx': 'lstm', 'activation_func_yyx': 'ReLU', 'L2_weight_yyx': 2.267463779335708e-06, 'L_entropy_weight_yyx': 0.00041779253445860216, 'L_sep_weight_yyx': 0.00031896349764970396, 'L_scale_weight_yyx': 5.569338805880465e-05, 'learning_rate_yyx': 0.00900519403751097}. Best is trial 50 with value: -1.7853193803267045.
[I 2026-03-18 22:35:49,066] Trial 62 pruned. 
[I 2026-03-18 22:35:57,272] Trial 59 pruned. 
[I 2026-03-18 22:36:13,839] Trial 63 pruned. 
[I 2026-03-18 22:36:14,458] Trial 55 finished with value: -1.7880207346906565 and parameters: {'n_layers_yyx': 2, 'hidden_size_yyx_l0': 4, 'hidden_size_yyx_l1': 4, 'context_size_yyx': 4, 'num_mix_components_yyx': 1, 'context_extractor_yyx': 'gru', 'activation_func_yyx': 'Tanh', 'L2_weight_yyx': 1.568477542035316e-08, 'L_entropy_weight_yyx': 4.1675023842615206e-10, 'L_sep_weight_yyx': 9.162321655110579e-08, 'L_scale_weight_yyx': 1.8070902468112113e-05, 'learning_rate_yyx': 0.007719335637762997}. Best is trial 16 with value: -1.790272919625947.
[I 2026-03-18 22:36:15,079] Trial 53 finished with value: -1.8681843143905204 and parameters: {'n_layers_yyx': 1, 'hidden_size_yyx_l0': 6, 'context_size_yyx': 4, 'num_mix_components_yyx': 3, 'context_extractor_yyx': 'lstm', 'activation_func_yyx': 'ReLU', 'L2_weight_yyx': 7.149815137072349e-10, 'L_entropy_weight_yyx': 7.566097425349861e-10, 'L_sep_weight_yyx': 0.00012929695430517583, 'L_scale_weight_yyx': 0.0004083938079778836, 'learning_rate_yyx': 0.009838912625322152}. Best is trial 42 with value: -1.8699069075199783.
[I 2026-03-18 22:36:18,161] Trial 60 finished with value: -1.8367958835488132 and parameters: {'n_layers_yyx': 2, 'hidden_size_yyx_l0': 4, 'hidden_size_yyx_l1': 6, 'context_size_yyx': 3, 'num_mix_components_yyx': 1, 'context_extractor_yyx': 'lstm', 'activation_func_yyx': 'ReLU', 'L2_weight_yyx': 6.197975062242886e-05, 'L_entropy_weight_yyx': 1.4958569935469543e-06, 'L_sep_weight_yyx': 9.422464751845901e-07, 'L_scale_weight_yyx': 6.519659969144043e-06, 'learning_rate_yyx': 0.0014631580855130433}. Best is trial 11 with value: -1.8610449438696508.
[I 2026-03-18 22:36:22,768] Trial 76 pruned. 
[I 2026-03-18 22:36:23,726] Trial 56 finished with value: -1.8898047803984597 and parameters: {'n_layers_yyx': 2, 'hidden_size_yyx_l0': 4, 'hidden_size_yyx_l1': 6, 'context_size_yyx': 1, 'num_mix_components_yyx': 4, 'context_extractor_yyx': 'lstm', 'activation_func_yyx': 'ReLU', 'L2_weight_yyx': 6.581618254600811e-07, 'L_entropy_weight_yyx': 3.354820337786734e-06, 'L_sep_weight_yyx': 5.8460897964774226e-08, 'L_scale_weight_yyx': 1.5075448983650134e-07, 'learning_rate_yyx': 0.006540459735356125}. Best is trial 5 with value: -1.89157565728699.
[I 2026-03-18 22:36:24,632] Trial 72 finished with value: -1.9370685337483335 and parameters: {'n_layers_yyx': 1, 'hidden_size_yyx_l0': 6, 'context_size_yyx': 4, 'num_mix_components_yyx': 2, 'context_extractor_yyx': 'gru', 'activation_func_yyx': 'ReLU', 'L2_weight_yyx': 1.572119345009533e-10, 'L_entropy_weight_yyx': 5.7384693170291306e-09, 'L_sep_weight_yyx': 5.2494716282944e-05, 'L_scale_weight_yyx': 0.00047791414915381383, 'learning_rate_yyx': 0.00989113838546467}. Best is trial 10 with value: -1.9395614910230956.
[I 2026-03-18 22:36:27,853] Trial 58 finished with value: -1.847542611479304 and parameters: {'n_layers_yyx': 1, 'hidden_size_yyx_l0': 6, 'context_size_yyx': 4, 'num_mix_components_yyx': 3, 'context_extractor_yyx': 'gru', 'activation_func_yyx': 'GELU', 'L2_weight_yyx': 2.3388284375880694e-10, 'L_entropy_weight_yyx': 1.5323916200944666e-06, 'L_sep_weight_yyx': 7.426807815610709e-10, 'L_scale_weight_yyx': 7.081836340461514e-05, 'learning_rate_yyx': 0.007806189310991241}. Best is trial 0 with value: -1.8516305051550026.
[I 2026-03-18 22:36:38,004] Trial 59 pruned. 
[I 2026-03-18 22:36:38,593] Trial 61 finished with value: -1.7735796440972222 and parameters: {'n_layers_yyx': 2, 'hidden_size_yyx_l0': 6, 'hidden_size_yyx_l1': 6, 'context_size_yyx': 1, 'num_mix_components_yyx': 5, 'context_extractor_yyx': 'gru', 'activation_func_yyx': 'GELU', 'L2_weight_yyx': 2.8378137058101614e-09, 'L_entropy_weight_yyx': 0.0003080923803677277, 'L_sep_weight_yyx': 0.0005475840042231414, 'L_scale_weight_yyx': 1.1349547276935801e-06, 'learning_rate_yyx': 0.009949202459710683}. Best is trial 4 with value: -1.7875800731928662.
[I 2026-03-18 22:36:39,827] Trial 77 pruned. 
[I 2026-03-18 22:36:42,593] Trial 57 pruned. 
[I 2026-03-18 22:36:46,183] Trial 56 finished with value: -1.8507107782925654 and parameters: {'n_layers_yyx': 2, 'hidden_size_yyx_l0': 6, 'hidden_size_yyx_l1': 5, 'context_size_yyx': 3, 'num_mix_components_yyx': 5, 'context_extractor_yyx': 'lstm', 'activation_func_yyx': 'Tanh', 'L2_weight_yyx': 1.3889015154480682e-06, 'L_entropy_weight_yyx': 3.5485091179486624e-06, 'L_sep_weight_yyx': 1.0153755776904886e-10, 'L_scale_weight_yyx': 1.4548193841773933e-10, 'learning_rate_yyx': 0.009876832214663114}. Best is trial 9 with value: -1.8570869006965198.
[I 2026-03-18 22:36:49,774] Trial 65 finished with value: -1.897123961613096 and parameters: {'n_layers_yyx': 2, 'hidden_size_yyx_l0': 4, 'hidden_size_yyx_l1': 5, 'context_size_yyx': 4, 'num_mix_components_yyx': 3, 'context_extractor_yyx': 'lstm', 'activation_func_yyx': 'ReLU', 'L2_weight_yyx': 2.4970015509915464e-06, 'L_entropy_weight_yyx': 6.964220535938315e-09, 'L_sep_weight_yyx': 1.4169398636373098e-08, 'L_scale_weight_yyx': 8.66112350180915e-09, 'learning_rate_yyx': 0.009012814221320945}. Best is trial 55 with value: -1.8982689846521137.
[I 2026-03-18 22:36:52,070] Trial 58 pruned. 
[I 2026-03-18 22:36:55,211] Trial 62 finished with value: -1.847984588825857 and parameters: {'n_layers_yyx': 2, 'hidden_size_yyx_l0': 2, 'hidden_size_yyx_l1': 6, 'context_size_yyx': 4, 'num_mix_components_yyx': 4, 'context_extractor_yyx': 'lstm', 'activation_func_yyx': 'ReLU', 'L2_weight_yyx': 3.3936345022725205e-09, 'L_entropy_weight_yyx': 7.516005200432461e-05, 'L_sep_weight_yyx': 1.5561025814225227e-05, 'L_scale_weight_yyx': 1.8030203617419492e-06, 'learning_rate_yyx': 0.008014884287366405}. Best is trial 60 with value: -1.8490650754743791.
[I 2026-03-18 22:36:55,870] Trial 45 finished with value: -1.933444528902864 and parameters: {'n_layers_yyx': 2, 'hidden_size_yyx_l0': 4, 'hidden_size_yyx_l1': 5, 'context_size_yyx': 2, 'num_mix_components_yyx': 3, 'context_extractor_yyx': 'gru', 'activation_func_yyx': 'GELU', 'L2_weight_yyx': 3.744685588832317e-06, 'L_entropy_weight_yyx': 0.00024259135581036157, 'L_sep_weight_yyx': 5.684776708725589e-07, 'L_scale_weight_yyx': 5.12499276573955e-09, 'learning_rate_yyx': 0.009967195150760572}. Best is trial 14 with value: -1.9337542258067992.
[I 2026-03-18 22:36:57,101] Trial 60 pruned. 
[I 2026-03-18 22:36:58,880] Trial 39 finished with value: -1.8566961361150813 and parameters: {'n_layers_yyx': 2, 'hidden_size_yyx_l0': 4, 'hidden_size_yyx_l1': 4, 'context_size_yyx': 3, 'num_mix_components_yyx': 3, 'context_extractor_yyx': 'gru', 'activation_func_yyx': 'Tanh', 'L2_weight_yyx': 2.4581366965292516e-10, 'L_entropy_weight_yyx': 7.517204087369691e-05, 'L_sep_weight_yyx': 4.689219255681258e-08, 'L_scale_weight_yyx': 2.1320465564401835e-06, 'learning_rate_yyx': 0.009164593156524396}. Best is trial 29 with value: -1.8570256329045391.
[I 2026-03-18 22:36:59,424] Trial 64 pruned. 
[I 2026-03-18 22:37:02,153] Trial 61 pruned. 
[I 2026-03-18 22:37:02,958] Trial 57 pruned. 
[I 2026-03-18 22:37:03,511] Trial 61 pruned. 
[I 2026-03-18 22:37:06,270] Trial 65 pruned. 
[I 2026-03-18 22:37:12,239] Trial 66 pruned. 
[I 2026-03-18 22:37:14,674] Trial 62 pruned. 
[I 2026-03-18 22:37:16,280] Trial 78 pruned. 
[I 2026-03-18 22:37:18,284] Trial 67 pruned. 
[I 2026-03-18 22:37:27,202] Trial 59 pruned. 
[I 2026-03-18 22:37:28,011] Trial 46 pruned. 
[I 2026-03-18 22:37:28,037] Trial 54 finished with value: -1.868472656593981 and parameters: {'n_layers_yyx': 1, 'hidden_size_yyx_l0': 6, 'context_size_yyx': 4, 'num_mix_components_yyx': 3, 'context_extractor_yyx': 'lstm', 'activation_func_yyx': 'ReLU', 'L2_weight_yyx': 1.6266483730064697e-10, 'L_entropy_weight_yyx': 1.0301634768416204e-09, 'L_sep_weight_yyx': 4.053132928078208e-05, 'L_scale_weight_yyx': 7.976092429345385e-09, 'learning_rate_yyx': 0.008017335643114219}. Best is trial 42 with value: -1.8699069075199783.
[I 2026-03-18 22:37:37,707] Trial 58 pruned. 
[I 2026-03-18 22:37:39,383] Trial 60 pruned. 
[I 2026-03-18 22:37:40,236] Trial 63 finished with value: -1.7836824790877526 and parameters: {'n_layers_yyx': 2, 'hidden_size_yyx_l0': 5, 'hidden_size_yyx_l1': 2, 'context_size_yyx': 1, 'num_mix_components_yyx': 3, 'context_extractor_yyx': 'lstm', 'activation_func_yyx': 'ReLU', 'L2_weight_yyx': 1.8304066622644269e-06, 'L_entropy_weight_yyx': 0.0003764550510534231, 'L_sep_weight_yyx': 0.00033845488085625547, 'L_scale_weight_yyx': 6.915016260278927e-05, 'learning_rate_yyx': 0.00882917298319449}. Best is trial 50 with value: -1.7853193803267045.
[I 2026-03-18 22:37:42,312] Trial 73 finished with value: -1.939915535335113 and parameters: {'n_layers_yyx': 1, 'hidden_size_yyx_l0': 6, 'context_size_yyx': 4, 'num_mix_components_yyx': 2, 'context_extractor_yyx': 'gru', 'activation_func_yyx': 'ReLU', 'L2_weight_yyx': 3.2810918161892324e-10, 'L_entropy_weight_yyx': 1.93027097382505e-08, 'L_sep_weight_yyx': 9.760310509281355e-05, 'L_scale_weight_yyx': 0.00061718227994017, 'learning_rate_yyx': 0.007496701902784605}. Best is trial 73 with value: -1.939915535335113.
[I 2026-03-18 22:37:45,141] Trial 55 pruned. 
[I 2026-03-18 22:37:46,846] Trial 64 pruned. 
[I 2026-03-18 22:37:47,742] Trial 79 pruned. 
[I 2026-03-18 22:37:50,984] Trial 63 pruned. 
[I 2026-03-18 22:37:52,149] Trial 59 pruned. 
[I 2026-03-18 22:37:52,193] Trial 80 pruned. 
[I 2026-03-18 22:37:54,596] Trial 63 finished with value: -1.8488209348493791 and parameters: {'n_layers_yyx': 2, 'hidden_size_yyx_l0': 2, 'hidden_size_yyx_l1': 6, 'context_size_yyx': 4, 'num_mix_components_yyx': 4, 'context_extractor_yyx': 'lstm', 'activation_func_yyx': 'ReLU', 'L2_weight_yyx': 2.7681603142472887e-09, 'L_entropy_weight_yyx': 0.0002602802725449995, 'L_sep_weight_yyx': 1.6688595641554502e-05, 'L_scale_weight_yyx': 1.292817612346426e-06, 'learning_rate_yyx': 0.008025480260639112}. Best is trial 60 with value: -1.8490650754743791.
[I 2026-03-18 22:37:55,277] Trial 74 pruned. 
[I 2026-03-18 22:37:55,680] Trial 66 finished with value: -1.8972276490310143 and parameters: {'n_layers_yyx': 2, 'hidden_size_yyx_l0': 4, 'hidden_size_yyx_l1': 5, 'context_size_yyx': 4, 'num_mix_components_yyx': 3, 'context_extractor_yyx': 'lstm', 'activation_func_yyx': 'ReLU', 'L2_weight_yyx': 6.648980918695162e-06, 'L_entropy_weight_yyx': 5.3788138692825544e-09, 'L_sep_weight_yyx': 1.3433028940545917e-08, 'L_scale_weight_yyx': 7.094053364325299e-09, 'learning_rate_yyx': 0.00902054136565183}. Best is trial 55 with value: -1.8982689846521137.
[I 2026-03-18 22:37:56,281] Trial 62 finished with value: -1.7808585611979166 and parameters: {'n_layers_yyx': 2, 'hidden_size_yyx_l0': 6, 'hidden_size_yyx_l1': 6, 'context_size_yyx': 2, 'num_mix_components_yyx': 5, 'context_extractor_yyx': 'gru', 'activation_func_yyx': 'GELU', 'L2_weight_yyx': 1.5265459148889689e-10, 'L_entropy_weight_yyx': 2.2791821196599842e-05, 'L_sep_weight_yyx': 9.039674483552508e-06, 'L_scale_weight_yyx': 7.203244896272632e-07, 'learning_rate_yyx': 0.007904857752590732}. Best is trial 4 with value: -1.7875800731928662.
[I 2026-03-18 22:37:58,371] Trial 60 pruned. 
[I 2026-03-18 22:37:58,804] Trial 65 pruned. 
[I 2026-03-18 22:38:01,563] Trial 67 pruned. 
[I 2026-03-18 22:38:04,124] Trial 64 pruned. 
[I 2026-03-18 22:38:07,947] Trial 75 pruned. 
[I 2026-03-18 22:38:08,589] Trial 63 pruned. 
[I 2026-03-18 22:38:11,646] Trial 61 pruned. 
[I 2026-03-18 22:38:13,922] Trial 76 pruned. 
[I 2026-03-18 22:38:15,973] Trial 60 finished with value: -1.8537820986551454 and parameters: {'n_layers_yyx': 1, 'hidden_size_yyx_l0': 4, 'context_size_yyx': 3, 'num_mix_components_yyx': 5, 'context_extractor_yyx': 'gru', 'activation_func_yyx': 'GELU', 'L2_weight_yyx': 2.025931423449866e-09, 'L_entropy_weight_yyx': 0.00017409420297595586, 'L_sep_weight_yyx': 0.00011949358361476829, 'L_scale_weight_yyx': 3.7534082069131593e-07, 'learning_rate_yyx': 0.003120224116931696}. Best is trial 1 with value: -1.8555367853768732.
[I 2026-03-18 22:38:18,156] Trial 65 pruned. 
[I 2026-03-18 22:38:20,778] Trial 56 finished with value: -1.7852891956676136 and parameters: {'n_layers_yyx': 2, 'hidden_size_yyx_l0': 4, 'hidden_size_yyx_l1': 4, 'context_size_yyx': 4, 'num_mix_components_yyx': 1, 'context_extractor_yyx': 'gru', 'activation_func_yyx': 'Tanh', 'L2_weight_yyx': 1.8430446094529125e-08, 'L_entropy_weight_yyx': 3.488143566743771e-10, 'L_sep_weight_yyx': 7.28576151254352e-08, 'L_scale_weight_yyx': 1.8372478849974466e-05, 'learning_rate_yyx': 0.008229824820339347}. Best is trial 16 with value: -1.790272919625947.
[I 2026-03-18 22:38:23,827] Trial 56 pruned. 
[I 2026-03-18 22:38:24,654] Trial 62 pruned. 
[I 2026-03-18 22:38:27,338] Trial 77 pruned. 
[I 2026-03-18 22:38:32,255] Trial 66 pruned. 
[I 2026-03-18 22:38:32,280] Trial 66 pruned. 
[I 2026-03-18 22:38:35,779] Trial 81 finished with value: -1.797890923313534 and parameters: {'n_layers_yyx': 2, 'hidden_size_yyx_l0': 6, 'hidden_size_yyx_l1': 5, 'context_size_yyx': 3, 'num_mix_components_yyx': 4, 'context_extractor_yyx': 'gru', 'activation_func_yyx': 'GELU', 'L2_weight_yyx': 4.892369360143412e-10, 'L_entropy_weight_yyx': 0.0001815637901115612, 'L_sep_weight_yyx': 1.4469017945783615e-09, 'L_scale_weight_yyx': 1.7139774352934692e-07, 'learning_rate_yyx': 0.00819107444339569}. Best is trial 27 with value: -1.8062570642302185.
[I 2026-03-18 22:38:37,789] Trial 63 pruned. 
[I 2026-03-18 22:38:37,979] Trial 67 pruned. 
[I 2026-03-18 22:38:39,238] Trial 78 pruned. 
[I 2026-03-18 22:38:41,136] Trial 62 finished with value: -1.848757107280187 and parameters: {'n_layers_yyx': 2, 'hidden_size_yyx_l0': 5, 'hidden_size_yyx_l1': 2, 'context_size_yyx': 4, 'num_mix_components_yyx': 5, 'context_extractor_yyx': 'gru', 'activation_func_yyx': 'ReLU', 'L2_weight_yyx': 4.5045562781730646e-10, 'L_entropy_weight_yyx': 5.886829735978626e-08, 'L_sep_weight_yyx': 1.1283473692717475e-10, 'L_scale_weight_yyx': 2.109551444574301e-06, 'learning_rate_yyx': 0.006915734158519784}. Best is trial 0 with value: -1.8516305051550026.
[I 2026-03-18 22:38:43,314] Trial 64 pruned. 
[I 2026-03-18 22:38:43,402] Trial 68 finished with value: -1.8981653958901592 and parameters: {'n_layers_yyx': 2, 'hidden_size_yyx_l0': 4, 'hidden_size_yyx_l1': 4, 'context_size_yyx': 4, 'num_mix_components_yyx': 3, 'context_extractor_yyx': 'lstm', 'activation_func_yyx': 'ReLU', 'L2_weight_yyx': 7.97411102213484e-07, 'L_entropy_weight_yyx': 5.244702150499069e-10, 'L_sep_weight_yyx': 3.0463227069811656e-09, 'L_scale_weight_yyx': 6.07803935329618e-10, 'learning_rate_yyx': 0.006882750262309704}. Best is trial 55 with value: -1.8982689846521137.
[I 2026-03-18 22:38:45,393] Trial 67 pruned. 
[I 2026-03-18 22:38:46,592] Trial 40 finished with value: -1.861402018567546 and parameters: {'n_layers_yyx': 1, 'hidden_size_yyx_l0': 4, 'context_size_yyx': 4, 'num_mix_components_yyx': 4, 'context_extractor_yyx': 'lstm', 'activation_func_yyx': 'Tanh', 'L2_weight_yyx': 2.671534384087553e-10, 'L_entropy_weight_yyx': 9.871012054464234e-05, 'L_sep_weight_yyx': 7.325097385583665e-10, 'L_scale_weight_yyx': 5.0461345658299366e-09, 'learning_rate_yyx': 0.009671176916762567}. Best is trial 40 with value: -1.861402018567546.
[I 2026-03-18 22:38:49,258] Trial 65 pruned. 
[I 2026-03-18 22:38:49,809] Trial 68 pruned. 
[I 2026-03-18 22:38:51,294] Trial 79 pruned. 
[I 2026-03-18 22:38:51,501] Trial 68 pruned. 
