[I 2026-03-18 16:37:14,017] Trial 49 finished with value: -0.4280843350909443 and parameters: {'n_layers_yyx': 2, 'hidden_size_yyx_l0': 4, 'hidden_size_yyx_l1': 4, 'context_size_yyx': 4, 'num_mix_components_yyx': 1, 'context_extractor_yyx': 'gru', 'activation_func_yyx': 'GELU', 'L2_weight_yyx': 1.0062143142375447e-10, 'L_entropy_weight_yyx': 1.1091462134073257e-05, 'L_sep_weight_yyx': 1.0044044456998368e-06, 'L_scale_weight_yyx': 1.9136660924722528e-05, 'learning_rate_yyx': 0.008620847860205493}. Best is trial 40 with value: -0.4348042963459027.

Source events: 1783
Target events: 27060
Full model ln_yyx : 89.96788 nats/sec, 2.99228 nats/event
Full model Log loss : -0.41448
Full model ln_yyx : 80.75385 nats/sec, 2.68583 nats/event
Full model Log loss : -0.29747
Full model ln_yyx : 84.08802 nats/sec, 2.79672 nats/event
Full model Log loss : -0.33953
Full model ln_yyx : 86.48685 nats/sec, 2.87650 nats/event
Full model Log loss : -0.41365
Full model ln_yyx : 87.33161 nats/sec, 2.90460 nats/event
Full model Log loss : -0.37645
Full model ln_yyx : 85.62432 nats/sec, 2.84782 nats/event
Full model Log loss : -0.39725
Full model ln_yyx : 86.91484 nats/sec, 2.89074 nats/event
Full model Log loss : -0.41271
Full model ln_yyx : 86.96778 nats/sec, 2.89250 nats/event
Full model Log loss : -0.41209
Full model ln_yyx : 88.05537 nats/sec, 2.92867 nats/event
Full model Log loss : -0.41534
Full model ln_yyx : 88.76152 nats/sec, 2.95216 nats/event
Full model Log loss : -0.43480
Full model ln_yyx : 86.40757 nats/sec, 2.87387 nats/event
Full model Log loss : -0.41266
Full model ln_yyx : 89.61623 nats/sec, 2.98058 nats/event
Full model Log loss : -0.42913
Full model ln_yyx : 87.72361 nats/sec, 2.91764 nats/event
Full model Log loss : -0.39516
Full model ln_yyx : 89.77438 nats/sec, 2.98584 nats/event
Full model Log loss : -0.42808
Optimization finished. Config saved to results/opt-full/opt_full_24_best_config.txt
[I 2026-03-18 16:37:16,941] Trial 49 finished with value: -0.39873960512710427 and parameters: {'n_layers_yyx': 2, 'hidden_size_yyx_l0': 3, 'hidden_size_yyx_l1': 4, 'context_size_yyx': 4, 'num_mix_components_yyx': 5, 'context_extractor_yyx': 'gru', 'activation_func_yyx': 'ReLU', 'L2_weight_yyx': 3.1056857400672333e-10, 'L_entropy_weight_yyx': 3.4286198359096803e-10, 'L_sep_weight_yyx': 1.1158408276346449e-07, 'L_scale_weight_yyx': 4.1162992452411284e-10, 'learning_rate_yyx': 0.009825139985153638}. Best is trial 39 with value: -0.43937692553635355.

Source events: 1783
Target events: 38515
Full model ln_yyx : 129.37356 nats/sec, 3.02314 nats/event
Full model Log loss : -0.36289
Full model ln_yyx : 123.54336 nats/sec, 2.88690 nats/event
Full model Log loss : -0.31467
Full model ln_yyx : 124.61880 nats/sec, 2.91203 nats/event
Full model Log loss : -0.37083
Full model ln_yyx : 117.86993 nats/sec, 2.75433 nats/event
Full model Log loss : -0.38009
Full model ln_yyx : 126.31202 nats/sec, 2.95160 nats/event
Full model Log loss : -0.39146
Full model ln_yyx : 126.39396 nats/sec, 2.95351 nats/event
Full model Log loss : -0.42678
Full model ln_yyx : 126.25880 nats/sec, 2.95035 nats/event
Full model Log loss : -0.42308
Full model ln_yyx : 126.41572 nats/sec, 2.95402 nats/event
Full model Log loss : -0.42863
Full model ln_yyx : 126.23733 nats/sec, 2.94985 nats/event
Full model Log loss : -0.42261
Full model ln_yyx : 125.66017 nats/sec, 2.93637 nats/event
Full model Log loss : -0.40330
Full model ln_yyx : 125.19113 nats/sec, 2.92541 nats/event
Full model Log loss : -0.38840
Full model ln_yyx : 129.51736 nats/sec, 3.02650 nats/event
Full model Log loss : -0.43938
Full model ln_yyx : 127.27323 nats/sec, 2.97406 nats/event
Full model Log loss : -0.41700
Full model ln_yyx : 126.41832 nats/sec, 2.95408 nats/event
Full model Log loss : -0.40197
Full model ln_yyx : 128.03701 nats/sec, 2.99191 nats/event
Full model Log loss : -0.39874
Optimization finished. Config saved to results/opt-full/opt_full_23_best_config.txt
[I 2026-03-18 16:37:17,448] Trial 45 finished with value: -0.4006535674765383 and parameters: {'n_layers_yyx': 1, 'hidden_size_yyx_l0': 6, 'context_size_yyx': 1, 'num_mix_components_yyx': 4, 'context_extractor_yyx': 'gru', 'activation_func_yyx': 'ReLU', 'L2_weight_yyx': 1.654853254912558e-08, 'L_entropy_weight_yyx': 1.310116236544553e-07, 'L_sep_weight_yyx': 2.644188174330594e-08, 'L_scale_weight_yyx': 1.3911371071767643e-08, 'learning_rate_yyx': 0.007205850157772468}. Best is trial 17 with value: -0.46708542200803016.
[I 2026-03-18 16:37:17,858] Trial 47 pruned. 
[I 2026-03-18 16:37:18,550] Trial 38 pruned. 
[I 2026-03-18 16:37:19,917] Trial 6 pruned. 
[I 2026-03-18 16:37:20,287] Trial 9 pruned. 
[I 2026-03-18 16:37:20,500] Trial 48 pruned. 
[I 2026-03-18 16:37:21,698] Trial 38 pruned. 
[I 2026-03-18 16:37:21,997] Trial 46 pruned. 
[I 2026-03-18 16:37:24,141] Trial 39 pruned. 
[I 2026-03-18 16:37:24,555] Trial 47 pruned. 
[I 2026-03-18 16:37:26,901] Trial 3 pruned. 
[I 2026-03-18 16:37:27,428] Trial 35 finished with value: -0.4098671361019737 and parameters: {'n_layers_yyx': 1, 'hidden_size_yyx_l0': 5, 'context_size_yyx': 1, 'num_mix_components_yyx': 3, 'context_extractor_yyx': 'lstm', 'activation_func_yyx': 'Tanh', 'L2_weight_yyx': 3.352879631210816e-09, 'L_entropy_weight_yyx': 1.5104102838253126e-06, 'L_sep_weight_yyx': 4.448671390384508e-08, 'L_scale_weight_yyx': 0.0008569335540482276, 'learning_rate_yyx': 0.006494297157284296}. Best is trial 2 with value: -0.4289537553816757.
[I 2026-03-18 16:37:28,615] Trial 40 finished with value: -0.45545099689495455 and parameters: {'n_layers_yyx': 1, 'hidden_size_yyx_l0': 5, 'context_size_yyx': 4, 'num_mix_components_yyx': 4, 'context_extractor_yyx': 'gru', 'activation_func_yyx': 'Tanh', 'L2_weight_yyx': 6.385494823180245e-05, 'L_entropy_weight_yyx': 3.392589736527449e-06, 'L_sep_weight_yyx': 7.30324539365512e-06, 'L_scale_weight_yyx': 1.2049927192792945e-10, 'learning_rate_yyx': 0.007056574848895919}. Best is trial 37 with value: -0.45712648751934987.
[I 2026-03-18 16:37:30,060] Trial 39 pruned. 
[I 2026-03-18 16:37:32,461] Trial 46 finished with value: -0.4255640366498162 and parameters: {'n_layers_yyx': 1, 'hidden_size_yyx_l0': 5, 'context_size_yyx': 4, 'num_mix_components_yyx': 4, 'context_extractor_yyx': 'lstm', 'activation_func_yyx': 'GELU', 'L2_weight_yyx': 0.000394492476284533, 'L_entropy_weight_yyx': 3.2647008084638336e-10, 'L_sep_weight_yyx': 0.00018752392705301767, 'L_scale_weight_yyx': 6.19584687779169e-10, 'learning_rate_yyx': 0.009367535208053559}. Best is trial 25 with value: -0.44456373279677824.
[I 2026-03-18 16:37:32,812] Trial 40 pruned. 
[I 2026-03-18 16:37:32,920] Trial 4 finished with value: -2.777686147163457 and parameters: {'n_layers_yyx': 2, 'hidden_size_yyx_l0': 6, 'hidden_size_yyx_l1': 6, 'context_size_yyx': 3, 'num_mix_components_yyx': 5, 'context_extractor_yyx': 'lstm', 'activation_func_yyx': 'Tanh', 'L2_weight_yyx': 8.081076623304677e-09, 'L_entropy_weight_yyx': 0.0009675318537439636, 'L_sep_weight_yyx': 2.4940448738252266e-09, 'L_scale_weight_yyx': 0.00012975046480954213, 'learning_rate_yyx': 0.0026720491391945154}. Best is trial 4 with value: -2.777686147163457.
[I 2026-03-18 16:37:32,944] Trial 49 pruned. 

Source events: 1783
Target events: 13628
Full model ln_yyx : 45.03155 nats/sec, 2.97391 nats/event
Full model Log loss : -0.42020
Full model ln_yyx : 44.31641 nats/sec, 2.92668 nats/event
Full model Log loss : -0.36801
Full model ln_yyx : 43.83625 nats/sec, 2.89497 nats/event
Full model Log loss : -0.33849
Full model ln_yyx : 44.68806 nats/sec, 2.95122 nats/event
Full model Log loss : -0.41716
Full model ln_yyx : 44.18342 nats/sec, 2.91790 nats/event
Full model Log loss : -0.41717
Full model ln_yyx : 43.18151 nats/sec, 2.85173 nats/event
Full model Log loss : -0.38942
Full model ln_yyx : 44.23886 nats/sec, 2.92156 nats/event
Full model Log loss : -0.42072
Full model ln_yyx : 44.36900 nats/sec, 2.93015 nats/event
Full model Log loss : -0.42376
Full model ln_yyx : 44.74952 nats/sec, 2.95528 nats/event
Full model Log loss : -0.41350
Full model ln_yyx : 43.14846 nats/sec, 2.84955 nats/event
Full model Log loss : -0.38736
Optimization finished. Config saved to results/opt-full/opt_full_27_best_config.txt
[I 2026-03-18 16:37:35,421] Trial 41 pruned. 
[I 2026-03-18 16:37:37,450] Trial 10 pruned. 
[I 2026-03-18 16:37:37,596] Trial 42 pruned. 
[I 2026-03-18 16:37:37,616] Trial 47 pruned. 
[I 2026-03-18 16:37:38,291] Trial 48 finished with value: -0.384558686530996 and parameters: {'n_layers_yyx': 1, 'hidden_size_yyx_l0': 6, 'context_size_yyx': 4, 'num_mix_components_yyx': 3, 'context_extractor_yyx': 'gru', 'activation_func_yyx': 'Tanh', 'L2_weight_yyx': 7.322475699083883e-10, 'L_entropy_weight_yyx': 0.00032449754022765545, 'L_sep_weight_yyx': 9.046876087166475e-07, 'L_scale_weight_yyx': 3.183719493202349e-07, 'learning_rate_yyx': 0.006150259476468011}. Best is trial 17 with value: -0.46708542200803016.
[I 2026-03-18 16:37:39,676] Trial 36 pruned. 
[I 2026-03-18 16:37:39,775] Trial 5 pruned. 
[I 2026-03-18 16:37:39,856] Trial 43 pruned. 
[I 2026-03-18 16:37:41,771] Trial 37 pruned. 
[I 2026-03-18 16:37:42,226] Trial 44 pruned. 
[I 2026-03-18 16:37:42,669] Trial 40 finished with value: -0.40687367347740905 and parameters: {'n_layers_yyx': 2, 'hidden_size_yyx_l0': 4, 'hidden_size_yyx_l1': 5, 'context_size_yyx': 4, 'num_mix_components_yyx': 4, 'context_extractor_yyx': 'gru', 'activation_func_yyx': 'ReLU', 'L2_weight_yyx': 2.9189676079274357e-06, 'L_entropy_weight_yyx': 1.354233368925462e-07, 'L_sep_weight_yyx': 2.0279369098166315e-08, 'L_scale_weight_yyx': 6.839608321570394e-08, 'learning_rate_yyx': 0.005010690674385285}. Best is trial 5 with value: -0.44982475540586303.
[I 2026-03-18 16:37:43,138] Trial 49 pruned. 

Source events: 1783
Target events: 12539
Full model ln_yyx : 16.85854 nats/sec, 1.21004 nats/event
Full model Log loss : -0.10152
Full model ln_yyx : 41.95316 nats/sec, 3.01123 nats/event
Full model Log loss : -0.42041
Full model ln_yyx : 36.56980 nats/sec, 2.62484 nats/event
Full model Log loss : -0.35702
Full model ln_yyx : 40.85535 nats/sec, 2.93244 nats/event
Full model Log loss : -0.39666
Full model ln_yyx : 43.10677 nats/sec, 3.09403 nats/event
Full model Log loss : -0.44637
Full model ln_yyx : 43.60536 nats/sec, 3.12982 nats/event
Full model Log loss : -0.46709
Full model ln_yyx : 40.94172 nats/sec, 2.93864 nats/event
Full model Log loss : -0.39564
Full model ln_yyx : 41.43457 nats/sec, 2.97401 nats/event
Full model Log loss : -0.40257
Full model ln_yyx : 41.37285 nats/sec, 2.96958 nats/event
Full model Log loss : -0.40125
Full model ln_yyx : 41.29858 nats/sec, 2.96425 nats/event
Full model Log loss : -0.40278
Full model ln_yyx : 40.77731 nats/sec, 2.92683 nats/event
Full model Log loss : -0.40065
Full model ln_yyx : 40.53769 nats/sec, 2.90964 nats/event
Full model Log loss : -0.38456
Optimization finished. Config saved to results/opt-full/opt_full_31_best_config.txt
[I 2026-03-18 16:37:44,190] Trial 42 pruned. 
[I 2026-03-18 16:37:44,677] Trial 45 pruned. 
[I 2026-03-18 16:37:46,768] Trial 41 finished with value: -0.45540451191527187 and parameters: {'n_layers_yyx': 1, 'hidden_size_yyx_l0': 5, 'context_size_yyx': 4, 'num_mix_components_yyx': 4, 'context_extractor_yyx': 'gru', 'activation_func_yyx': 'Tanh', 'L2_weight_yyx': 5.837223031238945e-05, 'L_entropy_weight_yyx': 4.150686904940326e-06, 'L_sep_weight_yyx': 9.41666954188797e-06, 'L_scale_weight_yyx': 1.1391419246795313e-10, 'learning_rate_yyx': 0.007150257836707363}. Best is trial 37 with value: -0.45712648751934987.
[I 2026-03-18 16:37:47,259] Trial 6 pruned. 
[I 2026-03-18 16:37:48,434] Trial 43 pruned. 
[I 2026-03-18 16:37:50,280] Trial 9 finished with value: -2.777970626891366 and parameters: {'n_layers_yyx': 1, 'hidden_size_yyx_l0': 5, 'context_size_yyx': 1, 'num_mix_components_yyx': 5, 'context_extractor_yyx': 'lstm', 'activation_func_yyx': 'Tanh', 'L2_weight_yyx': 3.1449003262586993e-08, 'L_entropy_weight_yyx': 2.0053982755811926e-08, 'L_sep_weight_yyx': 4.603858755100098e-08, 'L_scale_weight_yyx': 1.6819450079015833e-07, 'learning_rate_yyx': 0.00919831474778867}. Best is trial 6 with value: -2.7950135081496006.
[I 2026-03-18 16:37:50,629] Trial 44 pruned. 
[I 2026-03-18 16:37:51,775] Trial 4 finished with value: -2.7856611908213673 and parameters: {'n_layers_yyx': 1, 'hidden_size_yyx_l0': 4, 'context_size_yyx': 2, 'num_mix_components_yyx': 4, 'context_extractor_yyx': 'lstm', 'activation_func_yyx': 'GELU', 'L2_weight_yyx': 5.880395190682976e-05, 'L_entropy_weight_yyx': 0.0005297506700800491, 'L_sep_weight_yyx': 2.665902264501619e-05, 'L_scale_weight_yyx': 4.78642953755467e-07, 'learning_rate_yyx': 0.0007161759464854025}. Best is trial 2 with value: -2.802563464577197.
[I 2026-03-18 16:37:51,815] Trial 41 finished with value: -0.41115940908898513 and parameters: {'n_layers_yyx': 2, 'hidden_size_yyx_l0': 6, 'hidden_size_yyx_l1': 4, 'context_size_yyx': 4, 'num_mix_components_yyx': 4, 'context_extractor_yyx': 'gru', 'activation_func_yyx': 'Tanh', 'L2_weight_yyx': 9.8468083561466e-10, 'L_entropy_weight_yyx': 2.7022156446458196e-09, 'L_sep_weight_yyx': 3.5261657091513743e-06, 'L_scale_weight_yyx': 0.0001524961242847334, 'learning_rate_yyx': 0.005763093721644032}. Best is trial 5 with value: -0.44982475540586303.
[I 2026-03-18 16:37:52,704] Trial 5 finished with value: -2.8051328142627483 and parameters: {'n_layers_yyx': 2, 'hidden_size_yyx_l0': 3, 'hidden_size_yyx_l1': 4, 'context_size_yyx': 4, 'num_mix_components_yyx': 4, 'context_extractor_yyx': 'lstm', 'activation_func_yyx': 'Tanh', 'L2_weight_yyx': 5.069665816410846e-09, 'L_entropy_weight_yyx': 8.343052475576762e-08, 'L_sep_weight_yyx': 1.0842346514744064e-08, 'L_scale_weight_yyx': 8.382911809695921e-05, 'learning_rate_yyx': 0.0037600752191295737}. Best is trial 5 with value: -2.8051328142627483.
[I 2026-03-18 16:37:53,841] Trial 11 pruned. 
[I 2026-03-18 16:37:53,877] Trial 7 pruned. 
[I 2026-03-18 16:37:53,885] Trial 4 finished with value: -2.7785759065864477 and parameters: {'n_layers_yyx': 2, 'hidden_size_yyx_l0': 3, 'hidden_size_yyx_l1': 4, 'context_size_yyx': 1, 'num_mix_components_yyx': 4, 'context_extractor_yyx': 'gru', 'activation_func_yyx': 'GELU', 'L2_weight_yyx': 0.0007822658204084088, 'L_entropy_weight_yyx': 2.8196299648605932e-05, 'L_sep_weight_yyx': 8.01178630422819e-10, 'L_scale_weight_yyx': 0.00010806219300306757, 'learning_rate_yyx': 0.007027977707007606}. Best is trial 0 with value: -2.792252838699443.
[I 2026-03-18 16:37:54,846] Trial 26 finished with value: -0.43197839695602747 and parameters: {'n_layers_yyx': 1, 'hidden_size_yyx_l0': 5, 'context_size_yyx': 1, 'num_mix_components_yyx': 1, 'context_extractor_yyx': 'lstm', 'activation_func_yyx': 'Tanh', 'L2_weight_yyx': 5.700795302910876e-09, 'L_entropy_weight_yyx': 1.7430675599664974e-10, 'L_sep_weight_yyx': 6.8144416506916384e-06, 'L_scale_weight_yyx': 6.891561331956727e-10, 'learning_rate_yyx': 0.003410545634039886}. Best is trial 26 with value: -0.43197839695602747.
[I 2026-03-18 16:37:55,055] Trial 46 pruned. 
[I 2026-03-18 16:37:55,867] Trial 48 finished with value: -0.40154793092709945 and parameters: {'n_layers_yyx': 1, 'hidden_size_yyx_l0': 4, 'context_size_yyx': 3, 'num_mix_components_yyx': 4, 'context_extractor_yyx': 'gru', 'activation_func_yyx': 'Tanh', 'L2_weight_yyx': 5.40651982864163e-06, 'L_entropy_weight_yyx': 7.81295788111939e-09, 'L_sep_weight_yyx': 2.882366714520021e-05, 'L_scale_weight_yyx': 1.9669792772919524e-06, 'learning_rate_yyx': 0.006172399392194373}. Best is trial 25 with value: -0.44456373279677824.
[I 2026-03-18 16:37:56,906] Trial 3 finished with value: -2.7991263324759417 and parameters: {'n_layers_yyx': 2, 'hidden_size_yyx_l0': 6, 'hidden_size_yyx_l1': 6, 'context_size_yyx': 3, 'num_mix_components_yyx': 5, 'context_extractor_yyx': 'lstm', 'activation_func_yyx': 'Tanh', 'L2_weight_yyx': 2.6283068633710388e-05, 'L_entropy_weight_yyx': 1.434418990969941e-07, 'L_sep_weight_yyx': 0.0003930022553034395, 'L_scale_weight_yyx': 1.0413810052655144e-08, 'learning_rate_yyx': 0.002025317701487016}. Best is trial 3 with value: -2.7991263324759417.
[I 2026-03-18 16:37:59,267] Trial 27 pruned. 
[I 2026-03-18 16:37:59,289] Trial 47 pruned. 
[I 2026-03-18 16:38:00,207] Trial 6 pruned. 
[I 2026-03-18 16:38:00,920] Trial 5 pruned. 
[I 2026-03-18 16:38:01,522] Trial 42 finished with value: -0.4120061065390383 and parameters: {'n_layers_yyx': 2, 'hidden_size_yyx_l0': 5, 'hidden_size_yyx_l1': 4, 'context_size_yyx': 4, 'num_mix_components_yyx': 5, 'context_extractor_yyx': 'gru', 'activation_func_yyx': 'Tanh', 'L2_weight_yyx': 4.549065154683657e-09, 'L_entropy_weight_yyx': 2.1285278230824198e-08, 'L_sep_weight_yyx': 3.977419085251118e-05, 'L_scale_weight_yyx': 1.0954773892889991e-05, 'learning_rate_yyx': 0.00417814712001741}. Best is trial 5 with value: -0.44982475540586303.
[I 2026-03-18 16:38:03,557] Trial 48 pruned. 
[I 2026-03-18 16:38:04,075] Trial 5 finished with value: -2.8058216093098 and parameters: {'n_layers_yyx': 1, 'hidden_size_yyx_l0': 4, 'context_size_yyx': 4, 'num_mix_components_yyx': 5, 'context_extractor_yyx': 'lstm', 'activation_func_yyx': 'Tanh', 'L2_weight_yyx': 1.4830380178823188e-06, 'L_entropy_weight_yyx': 0.0008552529968099523, 'L_sep_weight_yyx': 3.391290789218034e-08, 'L_scale_weight_yyx': 2.0032013948434537e-05, 'learning_rate_yyx': 0.0072988620962422725}. Best is trial 5 with value: -2.8058216093098.
[I 2026-03-18 16:38:04,087] Trial 42 finished with value: -0.4442221815741099 and parameters: {'n_layers_yyx': 1, 'hidden_size_yyx_l0': 4, 'context_size_yyx': 4, 'num_mix_components_yyx': 4, 'context_extractor_yyx': 'gru', 'activation_func_yyx': 'Tanh', 'L2_weight_yyx': 7.06029231595862e-05, 'L_entropy_weight_yyx': 4.4138915572005045e-06, 'L_sep_weight_yyx': 0.0007329075554028634, 'L_scale_weight_yyx': 1.848792056046449e-10, 'learning_rate_yyx': 0.007690457509904951}. Best is trial 37 with value: -0.45712648751934987.
[I 2026-03-18 16:38:06,146] Trial 4 finished with value: -2.783566160581989 and parameters: {'n_layers_yyx': 1, 'hidden_size_yyx_l0': 5, 'context_size_yyx': 1, 'num_mix_components_yyx': 5, 'context_extractor_yyx': 'gru', 'activation_func_yyx': 'ReLU', 'L2_weight_yyx': 2.993392315559969e-06, 'L_entropy_weight_yyx': 9.04538840545661e-09, 'L_sep_weight_yyx': 3.1593575833125913e-06, 'L_scale_weight_yyx': 3.438673361219735e-05, 'learning_rate_yyx': 0.007701796255984365}. Best is trial 1 with value: -2.794794619613311.
[I 2026-03-18 16:38:06,545] Trial 43 pruned. 
[I 2026-03-18 16:38:06,831] Trial 7 pruned. 
[I 2026-03-18 16:38:07,550] Trial 49 pruned. 

Source events: 1783
Target events: 20800
Full model ln_yyx : 35.40109 nats/sec, 1.53178 nats/event
Full model Log loss : -0.20029
Full model ln_yyx : 68.77558 nats/sec, 2.97587 nats/event
Full model Log loss : -0.45912
Full model ln_yyx : 71.75398 nats/sec, 3.10474 nats/event
Full model Log loss : -0.43231
Full model ln_yyx : 70.62084 nats/sec, 3.05571 nats/event
Full model Log loss : -0.44565
Full model ln_yyx : 68.34402 nats/sec, 2.95719 nats/event
Full model Log loss : -0.42893
Full model ln_yyx : 68.05575 nats/sec, 2.94472 nats/event
Full model Log loss : -0.43565
Full model ln_yyx : 69.04418 nats/sec, 2.98749 nats/event
Full model Log loss : -0.41269
Full model ln_yyx : 68.67791 nats/sec, 2.97164 nats/event
Full model Log loss : -0.42921
Full model ln_yyx : 68.61688 nats/sec, 2.96900 nats/event
Full model Log loss : -0.42764
Optimization finished. Config saved to results/opt-full/opt_full_17_best_config.txt
[I 2026-03-18 16:38:07,715] Trial 6 pruned. 
[I 2026-03-18 16:38:09,697] Trial 12 pruned. 
[I 2026-03-18 16:38:09,964] Trial 8 pruned. 
[I 2026-03-18 16:38:10,293] Trial 4 finished with value: -2.7975229055123445 and parameters: {'n_layers_yyx': 1, 'hidden_size_yyx_l0': 6, 'context_size_yyx': 3, 'num_mix_components_yyx': 4, 'context_extractor_yyx': 'gru', 'activation_func_yyx': 'ReLU', 'L2_weight_yyx': 1.3315835399303537e-07, 'L_entropy_weight_yyx': 0.00021353541272602086, 'L_sep_weight_yyx': 9.644376060352032e-07, 'L_scale_weight_yyx': 2.7383847605649196e-07, 'learning_rate_yyx': 0.006528984651985165}. Best is trial 1 with value: -2.8010403323029167.
[I 2026-03-18 16:38:10,452] Trial 28 pruned. 
[I 2026-03-18 16:38:10,926] Trial 6 pruned. 
[I 2026-03-18 16:38:11,420] Trial 10 finished with value: -2.8029779762863587 and parameters: {'n_layers_yyx': 2, 'hidden_size_yyx_l0': 3, 'hidden_size_yyx_l1': 2, 'context_size_yyx': 4, 'num_mix_components_yyx': 1, 'context_extractor_yyx': 'gru', 'activation_func_yyx': 'ReLU', 'L2_weight_yyx': 1.5540657175425394e-10, 'L_entropy_weight_yyx': 0.0001456456142148155, 'L_sep_weight_yyx': 2.6449863028280686e-10, 'L_scale_weight_yyx': 1.291369429621596e-10, 'learning_rate_yyx': 0.004122247267499989}. Best is trial 1 with value: -2.8044746609917057.
[I 2026-03-18 16:38:12,188] Trial 4 pruned. 
[I 2026-03-18 16:38:12,409] Trial 29 pruned. 
[I 2026-03-18 16:38:13,098] Trial 4 pruned. 
[I 2026-03-18 16:38:13,969] Trial 5 finished with value: -2.773387534346036 and parameters: {'n_layers_yyx': 1, 'hidden_size_yyx_l0': 6, 'context_size_yyx': 1, 'num_mix_components_yyx': 5, 'context_extractor_yyx': 'lstm', 'activation_func_yyx': 'Tanh', 'L2_weight_yyx': 3.63965014973278e-07, 'L_entropy_weight_yyx': 3.409220177897744e-05, 'L_sep_weight_yyx': 4.588362134933934e-05, 'L_scale_weight_yyx': 7.232440662496119e-07, 'learning_rate_yyx': 0.004941750464995151}. Best is trial 0 with value: -2.782248579189629.
[I 2026-03-18 16:38:14,460] Trial 30 pruned. 
