[I 2026-03-18 17:33:10,821] Trial 1 finished with value: -1.2393506062449458 and parameters: {'n_layers_yyx': 2, 'hidden_size_yyx_l0': 4, 'hidden_size_yyx_l1': 3, 'context_size_yyx': 4, 'num_mix_components_yyx': 3, 'context_extractor_yyx': 'gru', 'activation_func_yyx': 'GELU', 'L2_weight_yyx': 2.984130661389166e-10, 'L_entropy_weight_yyx': 3.0733989311755586e-09, 'L_sep_weight_yyx': 1.1376059038610379e-07, 'L_scale_weight_yyx': 8.14060017934268e-10, 'learning_rate_yyx': 0.004329597993992258}. Best is trial 1 with value: -1.2393506062449458.
[I 2026-03-18 17:33:12,316] Trial 0 finished with value: -1.6545376635377973 and parameters: {'n_layers_yyx': 2, 'hidden_size_yyx_l0': 4, 'hidden_size_yyx_l1': 3, 'context_size_yyx': 2, 'num_mix_components_yyx': 5, 'context_extractor_yyx': 'lstm', 'activation_func_yyx': 'ReLU', 'L2_weight_yyx': 2.5305360600188675e-05, 'L_entropy_weight_yyx': 8.031844296379648e-09, 'L_sep_weight_yyx': 9.867175238077043e-10, 'L_scale_weight_yyx': 4.776715192706489e-07, 'learning_rate_yyx': 0.0006572250144027039}. Best is trial 0 with value: -1.6545376635377973.
[I 2026-03-18 17:33:12,690] Trial 0 finished with value: -1.582342447055086 and parameters: {'n_layers_yyx': 2, 'hidden_size_yyx_l0': 6, 'hidden_size_yyx_l1': 4, 'context_size_yyx': 4, 'num_mix_components_yyx': 1, 'context_extractor_yyx': 'gru', 'activation_func_yyx': 'GELU', 'L2_weight_yyx': 8.152709648807703e-10, 'L_entropy_weight_yyx': 1.4733184035885785e-06, 'L_sep_weight_yyx': 0.0002098849063094327, 'L_scale_weight_yyx': 1.3321993129653227e-08, 'learning_rate_yyx': 0.00058560974464456}. Best is trial 0 with value: -1.582342447055086.
[I 2026-03-18 17:33:20,196] Trial 0 finished with value: -1.6521224388144589 and parameters: {'n_layers_yyx': 2, 'hidden_size_yyx_l0': 4, 'hidden_size_yyx_l1': 3, 'context_size_yyx': 3, 'num_mix_components_yyx': 4, 'context_extractor_yyx': 'gru', 'activation_func_yyx': 'GELU', 'L2_weight_yyx': 1.4566840194703136e-05, 'L_entropy_weight_yyx': 0.00028116736042559744, 'L_sep_weight_yyx': 4.740013015992936e-08, 'L_scale_weight_yyx': 3.107801411778397e-10, 'learning_rate_yyx': 0.0005586493036309699}. Best is trial 0 with value: -1.6521224388144589.
[I 2026-03-18 17:33:29,241] Trial 2 pruned. 
[I 2026-03-18 17:33:32,562] Trial 2 pruned. 
[I 2026-03-18 17:33:48,746] Trial 1 finished with value: -2.631415751979183 and parameters: {'n_layers_yyx': 2, 'hidden_size_yyx_l0': 5, 'hidden_size_yyx_l1': 3, 'context_size_yyx': 3, 'num_mix_components_yyx': 2, 'context_extractor_yyx': 'lstm', 'activation_func_yyx': 'ReLU', 'L2_weight_yyx': 0.0004610044958448966, 'L_entropy_weight_yyx': 3.830408158395018e-09, 'L_sep_weight_yyx': 5.090143521036272e-08, 'L_scale_weight_yyx': 1.7111703056907955e-05, 'learning_rate_yyx': 0.0021562452158256037}. Best is trial 0 with value: -2.633521153514828.
[I 2026-03-18 17:34:04,675] Trial 3 pruned. 
[I 2026-03-18 17:34:08,201] Trial 1 pruned. 
[I 2026-03-18 17:34:39,016] Trial 4 pruned. 
[I 2026-03-18 17:34:50,113] Trial 3 pruned. 
[I 2026-03-18 17:35:02,994] Trial 1 pruned. 
[I 2026-03-18 17:35:05,147] Trial 1 finished with value: -2.6376398477844947 and parameters: {'n_layers_yyx': 1, 'hidden_size_yyx_l0': 4, 'context_size_yyx': 4, 'num_mix_components_yyx': 5, 'context_extractor_yyx': 'lstm', 'activation_func_yyx': 'ReLU', 'L2_weight_yyx': 3.894139060167503e-05, 'L_entropy_weight_yyx': 1.4552745466625423e-10, 'L_sep_weight_yyx': 1.2676244551800483e-06, 'L_scale_weight_yyx': 2.0035862934304512e-07, 'learning_rate_yyx': 0.0008997290275892102}. Best is trial 1 with value: -2.6376398477844947.
[I 2026-03-18 17:35:07,387] Trial 2 pruned. 
[I 2026-03-18 17:35:16,298] Trial 1 finished with value: -2.6371932379943503 and parameters: {'n_layers_yyx': 1, 'hidden_size_yyx_l0': 4, 'context_size_yyx': 3, 'num_mix_components_yyx': 4, 'context_extractor_yyx': 'lstm', 'activation_func_yyx': 'ReLU', 'L2_weight_yyx': 0.00022773211345719331, 'L_entropy_weight_yyx': 4.094188333286454e-10, 'L_sep_weight_yyx': 1.5921240872413118e-06, 'L_scale_weight_yyx': 0.00012192033802384055, 'learning_rate_yyx': 0.0013258656421542528}. Best is trial 1 with value: -2.6371932379943503.
[I 2026-03-18 17:35:24,317] Trial 1 finished with value: -1.2663685063557792 and parameters: {'n_layers_yyx': 1, 'hidden_size_yyx_l0': 6, 'context_size_yyx': 3, 'num_mix_components_yyx': 2, 'context_extractor_yyx': 'lstm', 'activation_func_yyx': 'Tanh', 'L2_weight_yyx': 0.0006056762489815372, 'L_entropy_weight_yyx': 8.783355169999487e-07, 'L_sep_weight_yyx': 1.7943221054636145e-08, 'L_scale_weight_yyx': 1.3856826112182941e-09, 'learning_rate_yyx': 0.006499429677701151}. Best is trial 1 with value: -1.2663685063557792.
[I 2026-03-18 17:35:30,275] Trial 4 pruned. 
[I 2026-03-18 17:35:33,389] Trial 1 finished with value: -1.1473582438752743 and parameters: {'n_layers_yyx': 2, 'hidden_size_yyx_l0': 3, 'hidden_size_yyx_l1': 2, 'context_size_yyx': 1, 'num_mix_components_yyx': 1, 'context_extractor_yyx': 'lstm', 'activation_func_yyx': 'GELU', 'L2_weight_yyx': 2.2438095265977006e-05, 'L_entropy_weight_yyx': 3.2530163077573147e-08, 'L_sep_weight_yyx': 2.7860848984270146e-09, 'L_scale_weight_yyx': 2.3999567550658948e-06, 'learning_rate_yyx': 0.0008033246652647569}. Best is trial 0 with value: -1.2372134802742498.
[I 2026-03-18 17:35:52,515] Trial 1 finished with value: -1.6545329199488974 and parameters: {'n_layers_yyx': 1, 'hidden_size_yyx_l0': 4, 'context_size_yyx': 1, 'num_mix_components_yyx': 5, 'context_extractor_yyx': 'lstm', 'activation_func_yyx': 'Tanh', 'L2_weight_yyx': 1.2283145213520006e-07, 'L_entropy_weight_yyx': 0.000127610947336705, 'L_sep_weight_yyx': 1.3616981401690653e-07, 'L_scale_weight_yyx': 6.532873346214405e-09, 'learning_rate_yyx': 0.003522277459885122}. Best is trial 0 with value: -1.6641703377100456.
[I 2026-03-18 17:36:11,214] Trial 5 pruned. 
[I 2026-03-18 17:36:11,927] Trial 1 finished with value: -1.6743634327658101 and parameters: {'n_layers_yyx': 2, 'hidden_size_yyx_l0': 5, 'hidden_size_yyx_l1': 5, 'context_size_yyx': 3, 'num_mix_components_yyx': 4, 'context_extractor_yyx': 'lstm', 'activation_func_yyx': 'Tanh', 'L2_weight_yyx': 5.05486397900061e-08, 'L_entropy_weight_yyx': 6.781708490644671e-10, 'L_sep_weight_yyx': 5.9974666621047864e-05, 'L_scale_weight_yyx': 6.737724924433893e-06, 'learning_rate_yyx': 0.009572934933061234}. Best is trial 1 with value: -1.6743634327658101.
[I 2026-03-18 17:37:01,088] Trial 3 finished with value: -2.644878924551748 and parameters: {'n_layers_yyx': 1, 'hidden_size_yyx_l0': 4, 'context_size_yyx': 1, 'num_mix_components_yyx': 5, 'context_extractor_yyx': 'gru', 'activation_func_yyx': 'Tanh', 'L2_weight_yyx': 2.6282181764592676e-05, 'L_entropy_weight_yyx': 1.5948102192352078e-09, 'L_sep_weight_yyx': 1.5933319604168568e-05, 'L_scale_weight_yyx': 0.00026632933371561487, 'learning_rate_yyx': 0.002729657386919864}. Best is trial 3 with value: -2.644878924551748.
[I 2026-03-18 17:37:19,810] Trial 1 finished with value: -2.5996049404520045 and parameters: {'n_layers_yyx': 1, 'hidden_size_yyx_l0': 3, 'context_size_yyx': 2, 'num_mix_components_yyx': 1, 'context_extractor_yyx': 'gru', 'activation_func_yyx': 'ReLU', 'L2_weight_yyx': 2.4453384589275527e-05, 'L_entropy_weight_yyx': 6.959653971560136e-06, 'L_sep_weight_yyx': 6.896799899977146e-09, 'L_scale_weight_yyx': 3.1332534728737153e-09, 'learning_rate_yyx': 0.009254713686126808}. Best is trial 0 with value: -2.631078101143863.
[I 2026-03-18 17:37:30,470] Trial 6 pruned. 
[I 2026-03-18 17:37:40,564] Trial 2 finished with value: -2.6061400409172175 and parameters: {'n_layers_yyx': 1, 'hidden_size_yyx_l0': 3, 'context_size_yyx': 4, 'num_mix_components_yyx': 2, 'context_extractor_yyx': 'lstm', 'activation_func_yyx': 'ReLU', 'L2_weight_yyx': 3.869312713446235e-10, 'L_entropy_weight_yyx': 4.943108744733191e-08, 'L_sep_weight_yyx': 3.5412385179265337e-06, 'L_scale_weight_yyx': 3.7540046340790785e-07, 'learning_rate_yyx': 0.0012235404643325088}. Best is trial 2 with value: -2.6061400409172175.
[I 2026-03-18 17:37:45,071] Trial 4 pruned. 
[I 2026-03-18 17:38:10,545] Trial 7 pruned. 
[I 2026-03-18 17:38:12,595] Trial 2 pruned. 
[I 2026-03-18 17:38:16,210] Trial 2 finished with value: -2.601009350930877 and parameters: {'n_layers_yyx': 2, 'hidden_size_yyx_l0': 3, 'hidden_size_yyx_l1': 3, 'context_size_yyx': 1, 'num_mix_components_yyx': 3, 'context_extractor_yyx': 'gru', 'activation_func_yyx': 'ReLU', 'L2_weight_yyx': 0.0005064920921240277, 'L_entropy_weight_yyx': 1.9752638830977426e-05, 'L_sep_weight_yyx': 2.72071854091588e-07, 'L_scale_weight_yyx': 6.21228727101026e-08, 'learning_rate_yyx': 0.007044283737587925}. Best is trial 2 with value: -2.601009350930877.
[I 2026-03-18 17:38:17,635] Trial 1 finished with value: -1.6606928666585679 and parameters: {'n_layers_yyx': 1, 'hidden_size_yyx_l0': 5, 'context_size_yyx': 2, 'num_mix_components_yyx': 4, 'context_extractor_yyx': 'lstm', 'activation_func_yyx': 'ReLU', 'L2_weight_yyx': 3.634643781318293e-05, 'L_entropy_weight_yyx': 1.196874073484411e-07, 'L_sep_weight_yyx': 6.682179670719579e-07, 'L_scale_weight_yyx': 2.250230548117233e-09, 'learning_rate_yyx': 0.00382085446550096}. Best is trial 0 with value: -1.6656935052073152.
[I 2026-03-18 17:38:27,624] Trial 2 pruned. 
[I 2026-03-18 17:38:30,737] Trial 2 pruned. 
[I 2026-03-18 17:38:36,231] Trial 2 pruned. 
[I 2026-03-18 17:38:51,583] Trial 2 pruned. 
[I 2026-03-18 17:38:54,437] Trial 8 pruned. 
[I 2026-03-18 17:38:54,757] Trial 1 finished with value: -1.6454550933103589 and parameters: {'n_layers_yyx': 2, 'hidden_size_yyx_l0': 6, 'hidden_size_yyx_l1': 4, 'context_size_yyx': 1, 'num_mix_components_yyx': 1, 'context_extractor_yyx': 'gru', 'activation_func_yyx': 'GELU', 'L2_weight_yyx': 1.0797550639249233e-06, 'L_entropy_weight_yyx': 1.318370105225988e-10, 'L_sep_weight_yyx': 3.8440639885869366e-05, 'L_scale_weight_yyx': 1.0386585870427706e-06, 'learning_rate_yyx': 0.0037895066044893564}. Best is trial 0 with value: -1.6683178048964529.
[I 2026-03-18 17:38:58,871] Trial 3 pruned. 
[I 2026-03-18 17:39:02,489] Trial 1 finished with value: -2.631634364394519 and parameters: {'n_layers_yyx': 2, 'hidden_size_yyx_l0': 3, 'hidden_size_yyx_l1': 4, 'context_size_yyx': 3, 'num_mix_components_yyx': 3, 'context_extractor_yyx': 'lstm', 'activation_func_yyx': 'GELU', 'L2_weight_yyx': 0.0001022261818311894, 'L_entropy_weight_yyx': 0.00011854333862949, 'L_sep_weight_yyx': 1.3294066341329288e-06, 'L_scale_weight_yyx': 1.5367343491785556e-10, 'learning_rate_yyx': 0.0011666583342559403}. Best is trial 1 with value: -2.631634364394519.
[I 2026-03-18 17:39:10,398] Trial 3 pruned. 
[I 2026-03-18 17:39:17,257] Trial 2 finished with value: -1.6745893480229308 and parameters: {'n_layers_yyx': 1, 'hidden_size_yyx_l0': 2, 'context_size_yyx': 4, 'num_mix_components_yyx': 5, 'context_extractor_yyx': 'lstm', 'activation_func_yyx': 'Tanh', 'L2_weight_yyx': 2.3784299535426703e-05, 'L_entropy_weight_yyx': 4.925206206589161e-07, 'L_sep_weight_yyx': 2.6755899538210534e-08, 'L_scale_weight_yyx': 7.002188038258811e-10, 'learning_rate_yyx': 0.0046639429314582715}. Best is trial 2 with value: -1.6745893480229308.
[I 2026-03-18 17:39:26,675] Trial 3 finished with value: -1.2569327504269077 and parameters: {'n_layers_yyx': 1, 'hidden_size_yyx_l0': 6, 'context_size_yyx': 3, 'num_mix_components_yyx': 2, 'context_extractor_yyx': 'lstm', 'activation_func_yyx': 'Tanh', 'L2_weight_yyx': 7.130529664297416e-09, 'L_entropy_weight_yyx': 2.807726003323337e-08, 'L_sep_weight_yyx': 1.2687411086395992e-09, 'L_scale_weight_yyx': 0.00033395036591680544, 'learning_rate_yyx': 0.0060929214306744296}. Best is trial 3 with value: -1.2569327504269077.
[I 2026-03-18 17:39:33,084] Trial 9 pruned. 
[I 2026-03-18 17:39:38,247] Trial 1 finished with value: -1.6551611095351366 and parameters: {'n_layers_yyx': 2, 'hidden_size_yyx_l0': 5, 'hidden_size_yyx_l1': 6, 'context_size_yyx': 4, 'num_mix_components_yyx': 3, 'context_extractor_yyx': 'gru', 'activation_func_yyx': 'ReLU', 'L2_weight_yyx': 1.7381617930966765e-06, 'L_entropy_weight_yyx': 3.1626696984360503e-07, 'L_sep_weight_yyx': 9.169224194607695e-09, 'L_scale_weight_yyx': 7.420107844494813e-06, 'learning_rate_yyx': 0.0005710202318659726}. Best is trial 0 with value: -1.6702967433543936.
[I 2026-03-18 17:40:00,103] Trial 3 pruned. 
[I 2026-03-18 17:40:01,685] Trial 4 pruned. 
[I 2026-03-18 17:40:03,244] Trial 2 pruned. 
[I 2026-03-18 17:40:12,709] Trial 1 finished with value: -1.6678952161111547 and parameters: {'n_layers_yyx': 1, 'hidden_size_yyx_l0': 5, 'context_size_yyx': 4, 'num_mix_components_yyx': 5, 'context_extractor_yyx': 'gru', 'activation_func_yyx': 'ReLU', 'L2_weight_yyx': 7.759536997217363e-06, 'L_entropy_weight_yyx': 3.4078316727839094e-07, 'L_sep_weight_yyx': 3.1474191277811325e-10, 'L_scale_weight_yyx': 0.0002297991545554998, 'learning_rate_yyx': 0.002749073938549264}. Best is trial 1 with value: -1.6678952161111547.
[I 2026-03-18 17:40:33,480] Trial 5 finished with value: -1.2860820430975695 and parameters: {'n_layers_yyx': 1, 'hidden_size_yyx_l0': 3, 'context_size_yyx': 4, 'num_mix_components_yyx': 3, 'context_extractor_yyx': 'gru', 'activation_func_yyx': 'GELU', 'L2_weight_yyx': 9.79719444831779e-10, 'L_entropy_weight_yyx': 3.1128311470808057e-07, 'L_sep_weight_yyx': 7.75933945612772e-06, 'L_scale_weight_yyx': 3.527433963081774e-05, 'learning_rate_yyx': 0.006664319983632968}. Best is trial 1 with value: -1.2947146562429575.
[I 2026-03-18 17:40:37,811] Trial 5 pruned. 
[I 2026-03-18 17:40:41,073] Trial 3 pruned. 
[I 2026-03-18 17:40:48,095] Trial 1 pruned. 
[I 2026-03-18 17:41:12,066] Trial 6 pruned. 
[I 2026-03-18 17:41:13,875] Trial 2 finished with value: -2.602049242144405 and parameters: {'n_layers_yyx': 1, 'hidden_size_yyx_l0': 6, 'context_size_yyx': 4, 'num_mix_components_yyx': 1, 'context_extractor_yyx': 'gru', 'activation_func_yyx': 'GELU', 'L2_weight_yyx': 1.4015292501427703e-08, 'L_entropy_weight_yyx': 0.0001179902704314115, 'L_sep_weight_yyx': 1.8283517455376027e-09, 'L_scale_weight_yyx': 0.0005563964918035224, 'learning_rate_yyx': 0.0038797447307201164}. Best is trial 0 with value: -2.631078101143863.
[I 2026-03-18 17:41:47,921] Trial 1 finished with value: -1.6638326745863943 and parameters: {'n_layers_yyx': 2, 'hidden_size_yyx_l0': 4, 'hidden_size_yyx_l1': 2, 'context_size_yyx': 4, 'num_mix_components_yyx': 1, 'context_extractor_yyx': 'gru', 'activation_func_yyx': 'ReLU', 'L2_weight_yyx': 6.158556488248867e-07, 'L_entropy_weight_yyx': 8.424510637257172e-10, 'L_sep_weight_yyx': 0.00011346386959979245, 'L_scale_weight_yyx': 2.1385325429972642e-08, 'learning_rate_yyx': 0.0009209611100444159}. Best is trial 0 with value: -1.66519233145544.
[I 2026-03-18 17:41:51,056] Trial 7 pruned. 
[I 2026-03-18 17:41:55,405] Trial 4 pruned. 
[I 2026-03-18 17:42:16,601] Trial 2 finished with value: -1.2599548227024606 and parameters: {'n_layers_yyx': 2, 'hidden_size_yyx_l0': 2, 'hidden_size_yyx_l1': 3, 'context_size_yyx': 3, 'num_mix_components_yyx': 2, 'context_extractor_yyx': 'gru', 'activation_func_yyx': 'ReLU', 'L2_weight_yyx': 1.1393978609441552e-07, 'L_entropy_weight_yyx': 0.00023973651377055274, 'L_sep_weight_yyx': 2.3003061023384593e-06, 'L_scale_weight_yyx': 0.00039879100140538553, 'learning_rate_yyx': 0.0024052285047543582}. Best is trial 2 with value: -1.2599548227024606.
[I 2026-03-18 17:42:19,437] Trial 1 finished with value: -1.5759189741558703 and parameters: {'n_layers_yyx': 1, 'hidden_size_yyx_l0': 2, 'context_size_yyx': 3, 'num_mix_components_yyx': 1, 'context_extractor_yyx': 'gru', 'activation_func_yyx': 'ReLU', 'L2_weight_yyx': 2.8448089731719556e-07, 'L_entropy_weight_yyx': 5.999477254764014e-06, 'L_sep_weight_yyx': 1.9322374468028065e-07, 'L_scale_weight_yyx': 2.1224410526706198e-10, 'learning_rate_yyx': 0.000529854445778928}. Best is trial 0 with value: -1.6746319320135328.
[I 2026-03-18 17:42:20,012] Trial 2 finished with value: -1.719859356457674 and parameters: {'n_layers_yyx': 1, 'hidden_size_yyx_l0': 4, 'context_size_yyx': 4, 'num_mix_components_yyx': 3, 'context_extractor_yyx': 'gru', 'activation_func_yyx': 'Tanh', 'L2_weight_yyx': 1.5668214487225155e-09, 'L_entropy_weight_yyx': 1.70478812444423e-07, 'L_sep_weight_yyx': 7.53300481508638e-07, 'L_scale_weight_yyx': 2.0783078377449237e-10, 'learning_rate_yyx': 0.005543536777741921}. Best is trial 2 with value: -1.719859356457674.
[I 2026-03-18 17:42:23,805] Trial 2 pruned. 
[I 2026-03-18 17:42:26,787] Trial 8 pruned. 
[I 2026-03-18 17:42:47,648] Trial 4 pruned. 
[I 2026-03-18 17:43:01,697] Trial 9 pruned. 
[I 2026-03-18 17:43:04,734] Trial 3 pruned. 
[I 2026-03-18 17:43:24,099] Trial 5 finished with value: -2.617136231641939 and parameters: {'n_layers_yyx': 1, 'hidden_size_yyx_l0': 5, 'context_size_yyx': 4, 'num_mix_components_yyx': 3, 'context_extractor_yyx': 'lstm', 'activation_func_yyx': 'ReLU', 'L2_weight_yyx': 2.3358163555747244e-07, 'L_entropy_weight_yyx': 2.511671055421886e-09, 'L_sep_weight_yyx': 8.308719662942018e-08, 'L_scale_weight_yyx': 0.00034128891424021877, 'learning_rate_yyx': 0.0019050969173152043}. Best is trial 3 with value: -2.644878924551748.
[I 2026-03-18 17:43:25,986] Trial 1 finished with value: -1.6526962753898027 and parameters: {'n_layers_yyx': 2, 'hidden_size_yyx_l0': 5, 'hidden_size_yyx_l1': 3, 'context_size_yyx': 2, 'num_mix_components_yyx': 2, 'context_extractor_yyx': 'lstm', 'activation_func_yyx': 'ReLU', 'L2_weight_yyx': 7.604917050636613e-10, 'L_entropy_weight_yyx': 4.7275652063358e-07, 'L_sep_weight_yyx': 4.1766642204277994e-08, 'L_scale_weight_yyx': 1.025532199761123e-09, 'learning_rate_yyx': 0.0034469152592635603}. Best is trial 0 with value: -1.6545376635377973.
[I 2026-03-18 17:43:45,096] Trial 3 finished with value: -2.5993619584767833 and parameters: {'n_layers_yyx': 2, 'hidden_size_yyx_l0': 4, 'hidden_size_yyx_l1': 5, 'context_size_yyx': 2, 'num_mix_components_yyx': 2, 'context_extractor_yyx': 'lstm', 'activation_func_yyx': 'GELU', 'L2_weight_yyx': 2.3877157366960382e-06, 'L_entropy_weight_yyx': 4.968462888343975e-07, 'L_sep_weight_yyx': 2.333794391558075e-09, 'L_scale_weight_yyx': 1.3377251014231775e-07, 'learning_rate_yyx': 0.0022462499301640466}. Best is trial 1 with value: -2.6371932379943503.
[I 2026-03-18 17:43:45,404] Trial 4 pruned. 
[I 2026-03-18 17:43:50,767] Trial 3 finished with value: -2.5988988417931935 and parameters: {'n_layers_yyx': 2, 'hidden_size_yyx_l0': 3, 'hidden_size_yyx_l1': 6, 'context_size_yyx': 3, 'num_mix_components_yyx': 1, 'context_extractor_yyx': 'lstm', 'activation_func_yyx': 'GELU', 'L2_weight_yyx': 9.884540537197944e-06, 'L_entropy_weight_yyx': 1.2775410337974046e-06, 'L_sep_weight_yyx': 2.787400098653833e-07, 'L_scale_weight_yyx': 2.6197641962316945e-06, 'learning_rate_yyx': 0.0018594133077229685}. Best is trial 1 with value: -2.6376398477844947.
[I 2026-03-18 17:43:58,785] Trial 1 finished with value: -1.680687313245052 and parameters: {'n_layers_yyx': 1, 'hidden_size_yyx_l0': 5, 'context_size_yyx': 3, 'num_mix_components_yyx': 3, 'context_extractor_yyx': 'gru', 'activation_func_yyx': 'GELU', 'L2_weight_yyx': 4.6503427717578684e-07, 'L_entropy_weight_yyx': 7.405289936452812e-05, 'L_sep_weight_yyx': 2.1941741980154405e-06, 'L_scale_weight_yyx': 2.6680320287328128e-08, 'learning_rate_yyx': 0.00168385192634287}. Best is trial 1 with value: -1.680687313245052.
[I 2026-03-18 17:44:06,205] Trial 6 pruned. 
[I 2026-03-18 17:44:08,104] Trial 10 pruned. 
[I 2026-03-18 17:44:08,479] Trial 1 finished with value: -1.6559154479078544 and parameters: {'n_layers_yyx': 1, 'hidden_size_yyx_l0': 4, 'context_size_yyx': 4, 'num_mix_components_yyx': 2, 'context_extractor_yyx': 'lstm', 'activation_func_yyx': 'GELU', 'L2_weight_yyx': 4.8669833287247016e-05, 'L_entropy_weight_yyx': 5.6814433583948e-10, 'L_sep_weight_yyx': 2.404752981971399e-06, 'L_scale_weight_yyx': 0.0004445051394262327, 'learning_rate_yyx': 0.0012559684848099718}. Best is trial 1 with value: -1.6559154479078544.
[I 2026-03-18 17:44:26,311] Trial 5 pruned. 
[I 2026-03-18 17:44:39,900] Trial 11 pruned. 
[I 2026-03-18 17:44:46,243] Trial 7 pruned. 
[I 2026-03-18 17:45:04,633] Trial 3 pruned. 
[I 2026-03-18 17:45:26,479] Trial 10 finished with value: -2.603713272691466 and parameters: {'n_layers_yyx': 2, 'hidden_size_yyx_l0': 2, 'hidden_size_yyx_l1': 6, 'context_size_yyx': 4, 'num_mix_components_yyx': 5, 'context_extractor_yyx': 'gru', 'activation_func_yyx': 'Tanh', 'L2_weight_yyx': 3.8642486417315594e-09, 'L_entropy_weight_yyx': 1.1130901444625266e-10, 'L_sep_weight_yyx': 0.0002704398322047582, 'L_scale_weight_yyx': 2.8892220857956293e-08, 'learning_rate_yyx': 0.009694875302340155}. Best is trial 0 with value: -2.6330643191486622.
[I 2026-03-18 17:45:44,046] Trial 12 pruned. 
[I 2026-03-18 17:45:44,825] Trial 1 finished with value: -1.6549765462420352 and parameters: {'n_layers_yyx': 1, 'hidden_size_yyx_l0': 2, 'context_size_yyx': 3, 'num_mix_components_yyx': 1, 'context_extractor_yyx': 'lstm', 'activation_func_yyx': 'Tanh', 'L2_weight_yyx': 7.522843883600801e-06, 'L_entropy_weight_yyx': 5.836205010113073e-10, 'L_sep_weight_yyx': 0.0005627202907382149, 'L_scale_weight_yyx': 4.114745061098505e-06, 'learning_rate_yyx': 0.0016332893563951142}. Best is trial 1 with value: -1.6549765462420352.
[I 2026-03-18 17:45:50,638] Trial 2 finished with value: -1.6777834079951708 and parameters: {'n_layers_yyx': 1, 'hidden_size_yyx_l0': 5, 'context_size_yyx': 4, 'num_mix_components_yyx': 3, 'context_extractor_yyx': 'lstm', 'activation_func_yyx': 'ReLU', 'L2_weight_yyx': 9.044217943037375e-09, 'L_entropy_weight_yyx': 7.164750957816428e-09, 'L_sep_weight_yyx': 1.081785278351349e-07, 'L_scale_weight_yyx': 4.568078118606742e-05, 'learning_rate_yyx': 0.0029567751540125393}. Best is trial 2 with value: -1.6777834079951708.
