[I 2026-03-18 18:53:39,448] Trial 49 pruned. 

Source events: 5634
Target events: 11540
Full model ln_yyx : 179.01050 nats/sec, 13.96096 nats/event
Full model Log loss : -1.23721
Full model ln_yyx : 171.65251 nats/sec, 13.38711 nats/event
Full model Log loss : -1.14736
Full model ln_yyx : 181.81440 nats/sec, 14.17963 nats/event
Full model Log loss : -1.27106
Full model ln_yyx : 179.22419 nats/sec, 13.97762 nats/event
Full model Log loss : -1.23884
Full model ln_yyx : 179.27574 nats/sec, 13.98164 nats/event
Full model Log loss : -1.24176
Full model ln_yyx : 179.12695 nats/sec, 13.97004 nats/event
Full model Log loss : -1.24323
Full model ln_yyx : 177.88580 nats/sec, 13.87324 nats/event
Full model Log loss : -1.24760
Full model ln_yyx : 176.58162 nats/sec, 13.77153 nats/event
Full model Log loss : -1.24044
Full model ln_yyx : 179.36027 nats/sec, 13.98824 nats/event
Full model Log loss : -1.23293
Full model ln_yyx : 178.17116 nats/sec, 13.89550 nats/event
Full model Log loss : -1.24610
Full model ln_yyx : 179.55388 nats/sec, 14.00334 nats/event
Full model Log loss : -1.24141
Full model ln_yyx : 183.18678 nats/sec, 14.28666 nats/event
Full model Log loss : -1.27061
Full model ln_yyx : 179.48150 nats/sec, 13.99769 nats/event
Full model Log loss : -1.25833
Full model ln_yyx : 181.60007 nats/sec, 14.16292 nats/event
Full model Log loss : -1.27473
Full model ln_yyx : 180.72048 nats/sec, 14.09432 nats/event
Full model Log loss : -1.27692
Optimization finished. Config saved to results/opt-full/opt_full_100_best_config.txt
[I 2026-03-18 18:53:40,500] Trial 48 pruned. 
[I 2026-03-18 18:53:44,258] Trial 31 pruned. 
[I 2026-03-18 18:53:46,032] Trial 49 pruned. 

Source events: 10683
Target events: 10752
Full model ln_yyx : 361.87620 nats/sec, 30.29098 nats/event
Full model Log loss : -1.64754
Full model ln_yyx : 368.24891 nats/sec, 30.82441 nats/event
Full model Log loss : -1.67117
Full model ln_yyx : 357.09166 nats/sec, 29.89049 nats/event
Full model Log loss : -1.59333
Full model ln_yyx : 361.83241 nats/sec, 30.28731 nats/event
Full model Log loss : -1.66186
Full model ln_yyx : 358.42635 nats/sec, 30.00221 nats/event
Full model Log loss : -1.64505
Full model ln_yyx : 365.18374 nats/sec, 30.56784 nats/event
Full model Log loss : -1.67394
Full model ln_yyx : 359.63827 nats/sec, 30.10365 nats/event
Full model Log loss : -1.66991
Full model ln_yyx : 364.16158 nats/sec, 30.48227 nats/event
Full model Log loss : -1.67243
Full model ln_yyx : 359.71272 nats/sec, 30.10988 nats/event
Full model Log loss : -1.67014
Full model ln_yyx : 361.84783 nats/sec, 30.28860 nats/event
Full model Log loss : -1.67427
Full model ln_yyx : 363.86030 nats/sec, 30.45706 nats/event
Full model Log loss : -1.65536
Full model ln_yyx : 365.40066 nats/sec, 30.58599 nats/event
Full model Log loss : -1.66723
Full model ln_yyx : 362.94221 nats/sec, 30.38021 nats/event
Full model Log loss : -1.66599
Optimization finished. Config saved to results/opt-full/opt_full_110_best_config.txt
[I 2026-03-18 18:53:47,200] Trial 45 finished with value: -2.6423651490197257 and parameters: {'n_layers_yyx': 2, 'hidden_size_yyx_l0': 2, 'hidden_size_yyx_l1': 5, 'context_size_yyx': 3, 'num_mix_components_yyx': 5, 'context_extractor_yyx': 'gru', 'activation_func_yyx': 'Tanh', 'L2_weight_yyx': 2.4778681880761494e-10, 'L_entropy_weight_yyx': 1.720003546189357e-08, 'L_sep_weight_yyx': 0.0007712195341694231, 'L_scale_weight_yyx': 6.124046205005099e-10, 'learning_rate_yyx': 0.008002431245857903}. Best is trial 44 with value: -2.6424019503335066.
[I 2026-03-18 18:53:49,005] Trial 32 pruned. 
[I 2026-03-18 18:53:55,545] Trial 49 pruned. 

Source events: 10683
Target events: 12539
Full model ln_yyx : 419.83606 nats/sec, 30.13418 nats/event
Full model Log loss : -1.65212
Full model ln_yyx : 420.37012 nats/sec, 30.17251 nats/event
Full model Log loss : -1.64964
Full model ln_yyx : 417.31784 nats/sec, 29.95343 nats/event
Full model Log loss : -1.65570
Full model ln_yyx : 420.23752 nats/sec, 30.16299 nats/event
Full model Log loss : -1.66296
Full model ln_yyx : 426.82853 nats/sec, 30.63607 nats/event
Full model Log loss : -1.66499
Full model ln_yyx : 411.73688 nats/sec, 29.55285 nats/event
Full model Log loss : -1.59559
Full model ln_yyx : 426.37518 nats/sec, 30.60353 nats/event
Full model Log loss : -1.66877
Full model ln_yyx : 426.35234 nats/sec, 30.60189 nats/event
Full model Log loss : -1.66878
Full model ln_yyx : 425.08694 nats/sec, 30.51106 nats/event
Full model Log loss : -1.66372
Full model ln_yyx : 419.16913 nats/sec, 30.08631 nats/event
Full model Log loss : -1.66364
Full model ln_yyx : 427.28243 nats/sec, 30.66865 nats/event
Full model Log loss : -1.66345
Full model ln_yyx : 424.89738 nats/sec, 30.49746 nats/event
Full model Log loss : -1.66363
Full model ln_yyx : 426.49222 nats/sec, 30.61193 nats/event
Full model Log loss : -1.67546
Full model ln_yyx : 422.70510 nats/sec, 30.34011 nats/event
Full model Log loss : -1.66936
Optimization finished. Config saved to results/opt-full/opt_full_116_best_config.txt
[I 2026-03-18 18:53:55,950] Trial 33 pruned. 
[I 2026-03-18 18:54:01,196] Trial 46 pruned. 
[I 2026-03-18 18:54:01,254] Trial 45 pruned. 
[I 2026-03-18 18:54:04,220] Trial 39 finished with value: -1.580986210196149 and parameters: {'n_layers_yyx': 2, 'hidden_size_yyx_l0': 4, 'hidden_size_yyx_l1': 4, 'context_size_yyx': 1, 'num_mix_components_yyx': 2, 'context_extractor_yyx': 'lstm', 'activation_func_yyx': 'Tanh', 'L2_weight_yyx': 6.287594540347332e-07, 'L_entropy_weight_yyx': 6.950797639005517e-06, 'L_sep_weight_yyx': 1.9495959829971197e-08, 'L_scale_weight_yyx': 2.4734419967533782e-05, 'learning_rate_yyx': 0.0007163058025280643}. Best is trial 23 with value: -1.675936991716372.
[I 2026-03-18 18:54:04,962] Trial 34 pruned. 
[I 2026-03-18 18:54:09,300] Trial 46 pruned. 
[I 2026-03-18 18:54:09,380] Trial 47 pruned. 
[I 2026-03-18 18:54:11,756] Trial 40 pruned. 
[I 2026-03-18 18:54:13,599] Trial 24 pruned. 
[I 2026-03-18 18:54:15,797] Trial 48 pruned. 
[I 2026-03-18 18:54:16,002] Trial 47 pruned. 
[I 2026-03-18 18:54:16,816] Trial 41 finished with value: -1.6811530321578319 and parameters: {'n_layers_yyx': 2, 'hidden_size_yyx_l0': 5, 'hidden_size_yyx_l1': 4, 'context_size_yyx': 3, 'num_mix_components_yyx': 4, 'context_extractor_yyx': 'lstm', 'activation_func_yyx': 'Tanh', 'L2_weight_yyx': 1.0248646787263467e-10, 'L_entropy_weight_yyx': 7.72676194030125e-08, 'L_sep_weight_yyx': 3.1360424405293186e-09, 'L_scale_weight_yyx': 6.131394560471423e-08, 'learning_rate_yyx': 0.008770876614607171}. Best is trial 41 with value: -1.6811530321578319.
[I 2026-03-18 18:54:16,856] Trial 42 finished with value: -1.6728958702638128 and parameters: {'n_layers_yyx': 2, 'hidden_size_yyx_l0': 6, 'hidden_size_yyx_l1': 5, 'context_size_yyx': 4, 'num_mix_components_yyx': 4, 'context_extractor_yyx': 'gru', 'activation_func_yyx': 'Tanh', 'L2_weight_yyx': 6.27610070520616e-06, 'L_entropy_weight_yyx': 3.6372698290725852e-06, 'L_sep_weight_yyx': 3.466149976228714e-08, 'L_scale_weight_yyx': 8.92172487287817e-05, 'learning_rate_yyx': 0.00810524439766459}. Best is trial 42 with value: -1.6728958702638128.
[I 2026-03-18 18:54:18,150] Trial 44 pruned. 
[I 2026-03-18 18:54:18,483] Trial 37 pruned. 
[I 2026-03-18 18:54:18,852] Trial 41 pruned. 
[I 2026-03-18 18:54:19,542] Trial 46 finished with value: -1.668990949349867 and parameters: {'n_layers_yyx': 2, 'hidden_size_yyx_l0': 5, 'hidden_size_yyx_l1': 6, 'context_size_yyx': 1, 'num_mix_components_yyx': 4, 'context_extractor_yyx': 'lstm', 'activation_func_yyx': 'GELU', 'L2_weight_yyx': 1.3784391665214296e-07, 'L_entropy_weight_yyx': 4.424002884339782e-09, 'L_sep_weight_yyx': 3.7095505905741384e-09, 'L_scale_weight_yyx': 1.908431046135951e-06, 'learning_rate_yyx': 0.004951403885247009}. Best is trial 46 with value: -1.668990949349867.
[I 2026-03-18 18:54:22,445] Trial 47 pruned. 
[I 2026-03-18 18:54:23,571] Trial 42 pruned. 
[I 2026-03-18 18:54:24,883] Trial 41 finished with value: -1.6803232069997631 and parameters: {'n_layers_yyx': 2, 'hidden_size_yyx_l0': 6, 'hidden_size_yyx_l1': 5, 'context_size_yyx': 3, 'num_mix_components_yyx': 1, 'context_extractor_yyx': 'gru', 'activation_func_yyx': 'Tanh', 'L2_weight_yyx': 1.8349750606228804e-05, 'L_entropy_weight_yyx': 2.23897905336647e-07, 'L_sep_weight_yyx': 1.2742741618067192e-05, 'L_scale_weight_yyx': 1.801007259319243e-08, 'learning_rate_yyx': 0.004319117176243435}. Best is trial 29 with value: -1.6833607836109268.
[I 2026-03-18 18:54:25,380] Trial 38 pruned. 
[I 2026-03-18 18:54:25,545] Trial 48 pruned. 
[I 2026-03-18 18:54:25,679] Trial 46 finished with value: -1.6643948660548544 and parameters: {'n_layers_yyx': 1, 'hidden_size_yyx_l0': 6, 'context_size_yyx': 4, 'num_mix_components_yyx': 3, 'context_extractor_yyx': 'gru', 'activation_func_yyx': 'Tanh', 'L2_weight_yyx': 0.0002332578650019528, 'L_entropy_weight_yyx': 2.8129052295654448e-08, 'L_sep_weight_yyx': 8.27976972657461e-09, 'L_scale_weight_yyx': 7.454881703494631e-09, 'learning_rate_yyx': 0.0056111724682444295}. Best is trial 2 with value: -1.6799626520210098.
[I 2026-03-18 18:54:25,776] Trial 42 pruned. 
[I 2026-03-18 18:54:31,262] Trial 48 finished with value: -2.6335219905874823 and parameters: {'n_layers_yyx': 2, 'hidden_size_yyx_l0': 4, 'hidden_size_yyx_l1': 5, 'context_size_yyx': 4, 'num_mix_components_yyx': 4, 'context_extractor_yyx': 'lstm', 'activation_func_yyx': 'GELU', 'L2_weight_yyx': 2.2375757695092066e-10, 'L_entropy_weight_yyx': 2.0567767772967182e-10, 'L_sep_weight_yyx': 4.970373297455027e-09, 'L_scale_weight_yyx': 4.188938305222518e-08, 'learning_rate_yyx': 0.007188500306502695}. Best is trial 15 with value: -2.6388607085013045.
[I 2026-03-18 18:54:31,426] Trial 43 pruned. 
[I 2026-03-18 18:54:33,660] Trial 45 pruned. 
[I 2026-03-18 18:54:34,566] Trial 44 pruned. 
[I 2026-03-18 18:54:35,335] Trial 35 finished with value: -1.6693891556476377 and parameters: {'n_layers_yyx': 1, 'hidden_size_yyx_l0': 6, 'context_size_yyx': 4, 'num_mix_components_yyx': 5, 'context_extractor_yyx': 'lstm', 'activation_func_yyx': 'Tanh', 'L2_weight_yyx': 3.761336052508902e-10, 'L_entropy_weight_yyx': 1.3038501945313052e-05, 'L_sep_weight_yyx': 1.759814412519284e-05, 'L_scale_weight_yyx': 6.315564723428926e-05, 'learning_rate_yyx': 0.008190207950760156}. Best is trial 26 with value: -1.6790522813108588.
[I 2026-03-18 18:54:41,640] Trial 45 pruned. 
[I 2026-03-18 18:54:43,086] Trial 43 pruned. 
[I 2026-03-18 18:54:43,889] Trial 42 pruned. 
[I 2026-03-18 18:54:44,071] Trial 49 pruned. 

Source events: 10683
Target events: 12731
Full model ln_yyx : 430.10086 nats/sec, 30.40537 nats/event
Full model Log loss : -1.66519
Full model ln_yyx : 434.50591 nats/sec, 30.71678 nats/event
Full model Log loss : -1.66383
Full model ln_yyx : 428.69973 nats/sec, 30.30632 nats/event
Full model Log loss : -1.65628
Full model ln_yyx : 434.12110 nats/sec, 30.68958 nats/event
Full model Log loss : -1.66419
Full model ln_yyx : 434.60287 nats/sec, 30.72363 nats/event
Full model Log loss : -1.66592
Full model ln_yyx : 431.33589 nats/sec, 30.49268 nats/event
Full model Log loss : -1.66070
Full model ln_yyx : 429.31789 nats/sec, 30.35002 nats/event
Full model Log loss : -1.65438
Full model ln_yyx : 430.24074 nats/sec, 30.41526 nats/event
Full model Log loss : -1.66749
Full model ln_yyx : 421.47258 nats/sec, 29.79541 nats/event
Full model Log loss : -1.65098
Full model ln_yyx : 423.86021 nats/sec, 29.96420 nats/event
Full model Log loss : -1.61979
Full model ln_yyx : 430.81820 nats/sec, 30.45608 nats/event
Full model Log loss : -1.66567
Full model ln_yyx : 435.07840 nats/sec, 30.75725 nats/event
Full model Log loss : -1.66600
Full model ln_yyx : 435.18142 nats/sec, 30.76453 nats/event
Full model Log loss : -1.66594
Full model ln_yyx : 432.75224 nats/sec, 30.59281 nats/event
Full model Log loss : -1.65669
Full model ln_yyx : 432.72005 nats/sec, 30.59053 nats/event
Full model Log loss : -1.66267
Full model ln_yyx : 432.86824 nats/sec, 30.60101 nats/event
Full model Log loss : -1.66430
Full model ln_yyx : 435.21482 nats/sec, 30.76689 nats/event
Full model Log loss : -1.66899
Optimization finished. Config saved to results/opt-full/opt_full_103_best_config.txt
[I 2026-03-18 18:54:44,382] Trial 39 pruned. 
[I 2026-03-18 18:54:44,550] Trial 46 pruned. 
[I 2026-03-18 18:54:47,821] Trial 47 pruned. 
[I 2026-03-18 18:54:50,331] Trial 44 pruned. 
[I 2026-03-18 18:54:51,105] Trial 40 pruned. 
[I 2026-03-18 18:54:52,537] Trial 43 finished with value: -1.6705700302491173 and parameters: {'n_layers_yyx': 2, 'hidden_size_yyx_l0': 6, 'hidden_size_yyx_l1': 4, 'context_size_yyx': 4, 'num_mix_components_yyx': 3, 'context_extractor_yyx': 'gru', 'activation_func_yyx': 'Tanh', 'L2_weight_yyx': 6.1450201439348384e-06, 'L_entropy_weight_yyx': 3.495401604282234e-06, 'L_sep_weight_yyx': 1.883997787488114e-08, 'L_scale_weight_yyx': 0.000464847756377594, 'learning_rate_yyx': 0.008098125720640937}. Best is trial 42 with value: -1.6728958702638128.
[I 2026-03-18 18:54:54,354] Trial 48 pruned. 
[I 2026-03-18 18:54:54,354] Trial 41 pruned. 
[I 2026-03-18 18:54:54,431] Trial 36 pruned. 
[I 2026-03-18 18:54:57,568] Trial 49 pruned. 

Source events: 10683
Target events: 16159
Full model ln_yyx : 546.56887 nats/sec, 30.44198 nats/event
Full model Log loss : -1.66075
Full model ln_yyx : 548.05094 nats/sec, 30.52453 nats/event
Full model Log loss : -1.66790
Full model ln_yyx : 546.36772 nats/sec, 30.43078 nats/event
Full model Log loss : -1.67167
Full model ln_yyx : 549.09629 nats/sec, 30.58275 nats/event
Full model Log loss : -1.66646
Full model ln_yyx : 553.80561 nats/sec, 30.84504 nats/event
Full model Log loss : -1.67543
Full model ln_yyx : 543.92345 nats/sec, 30.29464 nats/event
Full model Log loss : -1.65871
Full model ln_yyx : 550.69552 nats/sec, 30.67182 nats/event
Full model Log loss : -1.67266
Full model ln_yyx : 548.34604 nats/sec, 30.54096 nats/event
Full model Log loss : -1.67552
Full model ln_yyx : 545.62269 nats/sec, 30.38928 nats/event
Full model Log loss : -1.67579
Full model ln_yyx : 549.17442 nats/sec, 30.58710 nats/event
Full model Log loss : -1.67179
Full model ln_yyx : 551.04687 nats/sec, 30.69139 nats/event
Full model Log loss : -1.67275
Full model ln_yyx : 539.90628 nats/sec, 30.07090 nats/event
Full model Log loss : -1.66496
Full model ln_yyx : 549.09156 nats/sec, 30.58249 nats/event
Full model Log loss : -1.67771
Full model ln_yyx : 546.58598 nats/sec, 30.44293 nats/event
Full model Log loss : -1.66651
Full model ln_yyx : 547.22882 nats/sec, 30.47874 nats/event
Full model Log loss : -1.67529
Optimization finished. Config saved to results/opt-full/opt_full_118_best_config.txt
[I 2026-03-18 18:54:57,954] Trial 49 pruned. 

Source events: 32635
Target events: 10752
Full model ln_yyx : 1524.62355 nats/sec, 127.61916 nats/event
Full model Log loss : -2.63108
Full model ln_yyx : 1514.19497 nats/sec, 126.74623 nats/event
Full model Log loss : -2.59960
Full model ln_yyx : 1515.93248 nats/sec, 126.89167 nats/event
Full model Log loss : -2.60205
Full model ln_yyx : 1497.32454 nats/sec, 125.33409 nats/event
Full model Log loss : -2.59583
Full model ln_yyx : 1515.08414 nats/sec, 126.82066 nats/event
Full model Log loss : -2.60108
Full model ln_yyx : 1521.54574 nats/sec, 127.36153 nats/event
Full model Log loss : -2.60357
Full model ln_yyx : 1546.12004 nats/sec, 129.41853 nats/event
Full model Log loss : -2.63314
Full model ln_yyx : 1549.65278 nats/sec, 129.71424 nats/event
Full model Log loss : -2.63542
Full model ln_yyx : 1518.63310 nats/sec, 127.11773 nats/event
Full model Log loss : -2.60386
Full model ln_yyx : 1535.88817 nats/sec, 128.56207 nats/event
Full model Log loss : -2.64260
Full model ln_yyx : 1537.34154 nats/sec, 128.68372 nats/event
Full model Log loss : -2.64270
Full model ln_yyx : 1540.61436 nats/sec, 128.95767 nats/event
Full model Log loss : -2.64247
Full model ln_yyx : 1537.65303 nats/sec, 128.70980 nats/event
Full model Log loss : -2.63827
Optimization finished. Config saved to results/opt-full/opt_full_127_best_config.txt
[I 2026-03-18 18:54:58,863] Trial 48 pruned. 
[I 2026-03-18 18:55:02,043] Trial 43 finished with value: -1.66307224644504 and parameters: {'n_layers_yyx': 2, 'hidden_size_yyx_l0': 5, 'hidden_size_yyx_l1': 6, 'context_size_yyx': 4, 'num_mix_components_yyx': 5, 'context_extractor_yyx': 'lstm', 'activation_func_yyx': 'ReLU', 'L2_weight_yyx': 1.1820311546910122e-10, 'L_entropy_weight_yyx': 1.976324434562642e-07, 'L_sep_weight_yyx': 9.040962341790396e-09, 'L_scale_weight_yyx': 0.0007462689823915706, 'learning_rate_yyx': 0.00865822202485747}. Best is trial 23 with value: -1.675936991716372.
[I 2026-03-18 18:55:05,091] Trial 25 pruned. 
[I 2026-03-18 18:55:06,385] Trial 47 finished with value: -1.6619548072484505 and parameters: {'n_layers_yyx': 1, 'hidden_size_yyx_l0': 6, 'context_size_yyx': 4, 'num_mix_components_yyx': 3, 'context_extractor_yyx': 'gru', 'activation_func_yyx': 'Tanh', 'L2_weight_yyx': 2.162509792095978e-05, 'L_entropy_weight_yyx': 6.991768395656943e-08, 'L_sep_weight_yyx': 1.3926870032060655e-08, 'L_scale_weight_yyx': 6.864521090645577e-10, 'learning_rate_yyx': 0.00561684300652126}. Best is trial 2 with value: -1.6799626520210098.
[I 2026-03-18 18:55:08,263] Trial 44 pruned. 
[I 2026-03-18 18:55:10,451] Trial 44 pruned. 
[I 2026-03-18 18:55:11,061] Trial 42 pruned. 
[I 2026-03-18 18:55:11,405] Trial 26 pruned. 
[I 2026-03-18 18:55:12,098] Trial 37 pruned. 
[I 2026-03-18 18:55:13,263] Trial 48 pruned. 
[I 2026-03-18 18:55:13,349] Trial 49 pruned. 

Source events: 32635
Target events: 14713
Full model ln_yyx : 2101.19442 nats/sec, 128.53089 nats/event
Full model Log loss : -2.62732
Full model ln_yyx : 2100.16028 nats/sec, 128.46763 nats/event
Full model Log loss : -2.63163
Full model ln_yyx : 2092.15713 nats/sec, 127.97807 nats/event
Full model Log loss : -2.63256
Full model ln_yyx : 2100.07949 nats/sec, 128.46269 nats/event
Full model Log loss : -2.63549
Full model ln_yyx : 2090.17462 nats/sec, 127.85680 nats/event
Full model Log loss : -2.62929
Full model ln_yyx : 2064.96037 nats/sec, 126.31444 nats/event
Full model Log loss : -2.59743
Full model ln_yyx : 2108.15790 nats/sec, 128.95685 nats/event
Full model Log loss : -2.63886
Full model ln_yyx : 2116.49809 nats/sec, 129.46702 nats/event
Full model Log loss : -2.62993
Full model ln_yyx : 2096.28139 nats/sec, 128.23036 nats/event
Full model Log loss : -2.62990
Full model ln_yyx : 2069.67812 nats/sec, 126.60303 nats/event
Full model Log loss : -2.60245
Full model ln_yyx : 2089.35768 nats/sec, 127.80683 nats/event
Full model Log loss : -2.62931
Full model ln_yyx : 2089.55920 nats/sec, 127.81916 nats/event
Full model Log loss : -2.63352
Optimization finished. Config saved to results/opt-full/opt_full_121_best_config.txt
[I 2026-03-18 18:55:13,794] Trial 46 pruned. 
[I 2026-03-18 18:55:14,018] Trial 27 pruned. 
[I 2026-03-18 18:55:14,861] Trial 31 finished with value: -2.634839574202809 and parameters: {'n_layers_yyx': 1, 'hidden_size_yyx_l0': 4, 'context_size_yyx': 3, 'num_mix_components_yyx': 5, 'context_extractor_yyx': 'gru', 'activation_func_yyx': 'Tanh', 'L2_weight_yyx': 0.00014353349679889678, 'L_entropy_weight_yyx': 0.00026390275688547145, 'L_sep_weight_yyx': 2.801521384616144e-07, 'L_scale_weight_yyx': 6.633951152419334e-09, 'learning_rate_yyx': 0.00979728740831097}. Best is trial 21 with value: -2.6405605351488926.
[I 2026-03-18 18:55:15,114] Trial 45 pruned. 
[I 2026-03-18 18:55:17,336] Trial 45 finished with value: -1.6656710585226109 and parameters: {'n_layers_yyx': 2, 'hidden_size_yyx_l0': 5, 'hidden_size_yyx_l1': 5, 'context_size_yyx': 3, 'num_mix_components_yyx': 4, 'context_extractor_yyx': 'lstm', 'activation_func_yyx': 'Tanh', 'L2_weight_yyx': 2.203055453852361e-09, 'L_entropy_weight_yyx': 0.0004713130790001645, 'L_sep_weight_yyx': 4.904881707903937e-08, 'L_scale_weight_yyx': 8.530121017594764e-08, 'learning_rate_yyx': 0.0073909025072033}. Best is trial 41 with value: -1.6811530321578319.
[I 2026-03-18 18:55:18,002] Trial 39 finished with value: -2.6360087230081315 and parameters: {'n_layers_yyx': 1, 'hidden_size_yyx_l0': 2, 'context_size_yyx': 3, 'num_mix_components_yyx': 4, 'context_extractor_yyx': 'gru', 'activation_func_yyx': 'GELU', 'L2_weight_yyx': 5.848460159820323e-06, 'L_entropy_weight_yyx': 1.1324274510215718e-09, 'L_sep_weight_yyx': 1.6084427232675074e-08, 'L_scale_weight_yyx': 1.0015496616542687e-07, 'learning_rate_yyx': 0.005354962010542391}. Best is trial 10 with value: -2.640669339569724.
[I 2026-03-18 18:55:23,545] Trial 46 finished with value: -2.64244432121314 and parameters: {'n_layers_yyx': 2, 'hidden_size_yyx_l0': 2, 'hidden_size_yyx_l1': 5, 'context_size_yyx': 3, 'num_mix_components_yyx': 5, 'context_extractor_yyx': 'gru', 'activation_func_yyx': 'Tanh', 'L2_weight_yyx': 2.7556981315462123e-10, 'L_entropy_weight_yyx': 2.9298869841324734e-08, 'L_sep_weight_yyx': 0.00012203473239878609, 'L_scale_weight_yyx': 5.262435677079491e-10, 'learning_rate_yyx': 0.008347939067296655}. Best is trial 46 with value: -2.64244432121314.
[I 2026-03-18 18:55:28,346] Trial 43 finished with value: -1.682986207141454 and parameters: {'n_layers_yyx': 2, 'hidden_size_yyx_l0': 6, 'hidden_size_yyx_l1': 5, 'context_size_yyx': 3, 'num_mix_components_yyx': 1, 'context_extractor_yyx': 'gru', 'activation_func_yyx': 'Tanh', 'L2_weight_yyx': 2.3020219306497468e-05, 'L_entropy_weight_yyx': 4.907631303567203e-07, 'L_sep_weight_yyx': 5.505133106727501e-07, 'L_scale_weight_yyx': 1.0501492540802345e-08, 'learning_rate_yyx': 0.009308077462904461}. Best is trial 29 with value: -1.6833607836109268.
[I 2026-03-18 18:55:28,826] Trial 38 pruned. 
