[I 2026-03-18 18:56:14,511] Trial 4 finished with value: -1.7391358172922862 and parameters: {'n_layers_yyx': 1, 'hidden_size_yyx_l0': 6, 'context_size_yyx': 4, 'num_mix_components_yyx': 1, 'context_extractor_yyx': 'gru', 'activation_func_yyx': 'ReLU', 'L2_weight_yyx': 1.866477124836045e-08, 'L_entropy_weight_yyx': 0.00026332301671118456, 'L_sep_weight_yyx': 1.057222649410788e-09, 'L_scale_weight_yyx': 1.895476010245058e-07, 'learning_rate_yyx': 0.002717496562507918}. Best is trial 1 with value: -1.7684712210476057.
[I 2026-03-18 18:56:14,902] Trial 8 finished with value: -0.8009145671895195 and parameters: {'n_layers_yyx': 2, 'hidden_size_yyx_l0': 6, 'hidden_size_yyx_l1': 4, 'context_size_yyx': 4, 'num_mix_components_yyx': 1, 'context_extractor_yyx': 'lstm', 'activation_func_yyx': 'Tanh', 'L2_weight_yyx': 4.209221071332944e-08, 'L_entropy_weight_yyx': 2.8286828513671247e-05, 'L_sep_weight_yyx': 0.0001569490278083734, 'L_scale_weight_yyx': 1.5607461756006456e-10, 'learning_rate_yyx': 0.008854684580293856}. Best is trial 2 with value: -0.8277896221842689.
[I 2026-03-18 18:56:15,462] Trial 6 pruned. 
[I 2026-03-18 18:56:16,342] Trial 17 pruned. 
[I 2026-03-18 18:56:16,744] Trial 20 pruned. 
[I 2026-03-18 18:56:19,029] Trial 7 pruned. 
[I 2026-03-18 18:56:19,750] Trial 13 pruned. 
[I 2026-03-18 18:56:24,314] Trial 21 pruned. 
[I 2026-03-18 18:56:24,846] Trial 7 pruned. 
[I 2026-03-18 18:56:28,362] Trial 9 pruned. 
[I 2026-03-18 18:56:31,503] Trial 22 pruned. 
[I 2026-03-18 18:56:33,870] Trial 14 pruned. 
[I 2026-03-18 18:56:34,617] Trial 4 finished with value: -0.7895222470890648 and parameters: {'n_layers_yyx': 1, 'hidden_size_yyx_l0': 3, 'context_size_yyx': 3, 'num_mix_components_yyx': 1, 'context_extractor_yyx': 'gru', 'activation_func_yyx': 'Tanh', 'L2_weight_yyx': 1.0952446231364829e-08, 'L_entropy_weight_yyx': 1.473208680963426e-10, 'L_sep_weight_yyx': 4.005591723383195e-09, 'L_scale_weight_yyx': 7.197051228775913e-05, 'learning_rate_yyx': 0.001447315372669701}. Best is trial 1 with value: -0.8100041624714388.
[I 2026-03-18 18:56:36,225] Trial 3 finished with value: -2.2699321951591234 and parameters: {'n_layers_yyx': 1, 'hidden_size_yyx_l0': 3, 'context_size_yyx': 3, 'num_mix_components_yyx': 3, 'context_extractor_yyx': 'lstm', 'activation_func_yyx': 'Tanh', 'L2_weight_yyx': 5.578117011716429e-08, 'L_entropy_weight_yyx': 1.3797051222078877e-05, 'L_sep_weight_yyx': 2.353791917549735e-10, 'L_scale_weight_yyx': 3.3536141428077686e-07, 'learning_rate_yyx': 0.0013272998644033524}. Best is trial 3 with value: -2.2699321951591234.
[I 2026-03-18 18:56:37,068] Trial 11 finished with value: -0.8210734109582718 and parameters: {'n_layers_yyx': 2, 'hidden_size_yyx_l0': 5, 'hidden_size_yyx_l1': 6, 'context_size_yyx': 1, 'num_mix_components_yyx': 1, 'context_extractor_yyx': 'gru', 'activation_func_yyx': 'ReLU', 'L2_weight_yyx': 0.0007741807440744018, 'L_entropy_weight_yyx': 1.441247459026502e-07, 'L_sep_weight_yyx': 3.640237475143361e-08, 'L_scale_weight_yyx': 1.5685773045534775e-06, 'learning_rate_yyx': 0.008929772902465188}. Best is trial 2 with value: -0.8228697107672868.
[I 2026-03-18 18:56:38,389] Trial 23 pruned. 
[I 2026-03-18 18:56:42,232] Trial 10 pruned. 
[I 2026-03-18 18:56:44,815] Trial 24 pruned. 
[I 2026-03-18 18:56:46,618] Trial 15 pruned. 
[I 2026-03-18 18:56:48,916] Trial 12 pruned. 
[I 2026-03-18 18:56:51,453] Trial 8 pruned. 
[I 2026-03-18 18:56:52,095] Trial 6 pruned. 
[I 2026-03-18 18:56:53,200] Trial 12 finished with value: -0.8237387855788981 and parameters: {'n_layers_yyx': 1, 'hidden_size_yyx_l0': 5, 'context_size_yyx': 4, 'num_mix_components_yyx': 4, 'context_extractor_yyx': 'gru', 'activation_func_yyx': 'ReLU', 'L2_weight_yyx': 8.621606543405063e-07, 'L_entropy_weight_yyx': 1.4539761813796906e-08, 'L_sep_weight_yyx': 9.723693710375002e-09, 'L_scale_weight_yyx': 1.4117600542492275e-05, 'learning_rate_yyx': 0.004005498414222829}. Best is trial 0 with value: -0.8324342893885016.
[I 2026-03-18 18:56:53,214] Trial 16 pruned. 
[I 2026-03-18 18:56:54,058] Trial 11 pruned. 
[I 2026-03-18 18:56:55,954] Trial 5 finished with value: -1.7753098937432037 and parameters: {'n_layers_yyx': 1, 'hidden_size_yyx_l0': 3, 'context_size_yyx': 4, 'num_mix_components_yyx': 1, 'context_extractor_yyx': 'lstm', 'activation_func_yyx': 'GELU', 'L2_weight_yyx': 7.846189894854626e-08, 'L_entropy_weight_yyx': 1.0535334511598544e-07, 'L_sep_weight_yyx': 4.346300337379453e-05, 'L_scale_weight_yyx': 0.0002611827803925818, 'learning_rate_yyx': 0.0005295138457608722}. Best is trial 4 with value: -1.7775746924677662.
[I 2026-03-18 18:56:58,020] Trial 9 pruned. 
[I 2026-03-18 18:56:58,174] Trial 8 finished with value: -0.7732811030468173 and parameters: {'n_layers_yyx': 2, 'hidden_size_yyx_l0': 5, 'hidden_size_yyx_l1': 4, 'context_size_yyx': 2, 'num_mix_components_yyx': 5, 'context_extractor_yyx': 'gru', 'activation_func_yyx': 'GELU', 'L2_weight_yyx': 1.3503882709668039e-05, 'L_entropy_weight_yyx': 5.467032823640907e-10, 'L_sep_weight_yyx': 2.1309463671132284e-05, 'L_scale_weight_yyx': 8.74271785423122e-06, 'learning_rate_yyx': 0.001612289837581078}. Best is trial 2 with value: -0.8370103483890325.
[I 2026-03-18 18:56:58,900] Trial 4 finished with value: -2.262020175518283 and parameters: {'n_layers_yyx': 2, 'hidden_size_yyx_l0': 6, 'hidden_size_yyx_l1': 4, 'context_size_yyx': 3, 'num_mix_components_yyx': 1, 'context_extractor_yyx': 'lstm', 'activation_func_yyx': 'ReLU', 'L2_weight_yyx': 5.0381185428571006e-08, 'L_entropy_weight_yyx': 2.3582565100062416e-05, 'L_sep_weight_yyx': 6.78948411786979e-06, 'L_scale_weight_yyx': 1.5032816755067993e-08, 'learning_rate_yyx': 0.0014508627747892324}. Best is trial 1 with value: -2.2866954714752907.
[I 2026-03-18 18:57:00,011] Trial 3 finished with value: -2.278758564192965 and parameters: {'n_layers_yyx': 1, 'hidden_size_yyx_l0': 4, 'context_size_yyx': 4, 'num_mix_components_yyx': 4, 'context_extractor_yyx': 'gru', 'activation_func_yyx': 'Tanh', 'L2_weight_yyx': 1.3332217297649142e-07, 'L_entropy_weight_yyx': 8.777633182404025e-07, 'L_sep_weight_yyx': 6.548566267137483e-05, 'L_scale_weight_yyx': 3.2310274636430474e-06, 'learning_rate_yyx': 0.0015031475338799023}. Best is trial 3 with value: -2.278758564192965.
[I 2026-03-18 18:57:00,571] Trial 17 pruned. 
[I 2026-03-18 18:57:01,439] Trial 7 pruned. 
[I 2026-03-18 18:57:01,759] Trial 6 pruned. 
[I 2026-03-18 18:57:02,047] Trial 12 pruned. 
[I 2026-03-18 18:57:05,976] Trial 5 pruned. 
[I 2026-03-18 18:57:07,655] Trial 13 pruned. 
[I 2026-03-18 18:57:09,533] Trial 5 pruned. 
[I 2026-03-18 18:57:09,931] Trial 13 pruned. 
[I 2026-03-18 18:57:12,222] Trial 7 pruned. 
[I 2026-03-18 18:57:12,588] Trial 9 pruned. 
[I 2026-03-18 18:57:13,242] Trial 6 pruned. 
[I 2026-03-18 18:57:14,330] Trial 12 finished with value: -0.9172403773089042 and parameters: {'n_layers_yyx': 2, 'hidden_size_yyx_l0': 3, 'hidden_size_yyx_l1': 3, 'context_size_yyx': 2, 'num_mix_components_yyx': 2, 'context_extractor_yyx': 'gru', 'activation_func_yyx': 'Tanh', 'L2_weight_yyx': 2.6928663908603136e-05, 'L_entropy_weight_yyx': 1.9055829424784903e-08, 'L_sep_weight_yyx': 3.7273939074572844e-06, 'L_scale_weight_yyx': 2.687335203285027e-05, 'learning_rate_yyx': 0.006824429718545349}. Best is trial 12 with value: -0.9172403773089042.
[I 2026-03-18 18:57:14,704] Trial 18 pruned. 
[I 2026-03-18 18:57:15,101] Trial 5 finished with value: -0.8179649229063769 and parameters: {'n_layers_yyx': 2, 'hidden_size_yyx_l0': 6, 'hidden_size_yyx_l1': 2, 'context_size_yyx': 3, 'num_mix_components_yyx': 4, 'context_extractor_yyx': 'gru', 'activation_func_yyx': 'GELU', 'L2_weight_yyx': 2.3170005860215763e-06, 'L_entropy_weight_yyx': 9.271655278300144e-09, 'L_sep_weight_yyx': 1.3314769174043657e-09, 'L_scale_weight_yyx': 4.825568549467206e-08, 'learning_rate_yyx': 0.0007690631337986187}. Best is trial 1 with value: -0.8235284532014517.
[I 2026-03-18 18:57:16,821] Trial 14 pruned. 
[I 2026-03-18 18:57:18,599] Trial 8 pruned. 
[I 2026-03-18 18:57:19,247] Trial 18 finished with value: -0.8052474321959818 and parameters: {'n_layers_yyx': 2, 'hidden_size_yyx_l0': 2, 'hidden_size_yyx_l1': 5, 'context_size_yyx': 3, 'num_mix_components_yyx': 1, 'context_extractor_yyx': 'lstm', 'activation_func_yyx': 'ReLU', 'L2_weight_yyx': 2.041017804813415e-06, 'L_entropy_weight_yyx': 1.4339987328165247e-05, 'L_sep_weight_yyx': 1.4059545864348042e-05, 'L_scale_weight_yyx': 0.00043218105356882246, 'learning_rate_yyx': 0.0069299245524933805}. Best is trial 0 with value: -0.8279563193835395.
[I 2026-03-18 18:57:20,407] Trial 7 pruned. 
[I 2026-03-18 18:57:20,944] Trial 14 pruned. 
[I 2026-03-18 18:57:21,718] Trial 13 pruned. 
[I 2026-03-18 18:57:22,111] Trial 19 pruned. 
[I 2026-03-18 18:57:22,985] Trial 13 pruned. 
[I 2026-03-18 18:57:23,379] Trial 4 finished with value: -2.202605611171065 and parameters: {'n_layers_yyx': 2, 'hidden_size_yyx_l0': 6, 'hidden_size_yyx_l1': 3, 'context_size_yyx': 3, 'num_mix_components_yyx': 5, 'context_extractor_yyx': 'gru', 'activation_func_yyx': 'GELU', 'L2_weight_yyx': 1.8331332012916456e-06, 'L_entropy_weight_yyx': 1.621564585705416e-05, 'L_sep_weight_yyx': 1.118208792847739e-06, 'L_scale_weight_yyx': 0.0001866801684957443, 'learning_rate_yyx': 0.0015967843390628322}. Best is trial 2 with value: -2.2083321590322043.
[I 2026-03-18 18:57:27,341] Trial 9 pruned. 
[I 2026-03-18 18:57:27,367] Trial 19 pruned. 
[I 2026-03-18 18:57:28,653] Trial 14 pruned. 
[I 2026-03-18 18:57:28,958] Trial 20 pruned. 
[I 2026-03-18 18:57:29,765] Trial 15 pruned. 
[I 2026-03-18 18:57:30,055] Trial 7 finished with value: -2.271563683349908 and parameters: {'n_layers_yyx': 2, 'hidden_size_yyx_l0': 2, 'hidden_size_yyx_l1': 3, 'context_size_yyx': 3, 'num_mix_components_yyx': 5, 'context_extractor_yyx': 'gru', 'activation_func_yyx': 'ReLU', 'L2_weight_yyx': 1.1115038340399129e-07, 'L_entropy_weight_yyx': 5.665247258011629e-06, 'L_sep_weight_yyx': 2.7344040243957375e-07, 'L_scale_weight_yyx': 8.681277482969082e-08, 'learning_rate_yyx': 0.005746118084225198}. Best is trial 1 with value: -2.2881647079635865.
[I 2026-03-18 18:57:33,323] Trial 5 pruned. 
[I 2026-03-18 18:57:34,194] Trial 8 pruned. 
[I 2026-03-18 18:57:34,291] Trial 20 pruned. 
[I 2026-03-18 18:57:34,537] Trial 10 pruned. 
[I 2026-03-18 18:57:35,794] Trial 4 finished with value: -2.2771544140146878 and parameters: {'n_layers_yyx': 2, 'hidden_size_yyx_l0': 5, 'hidden_size_yyx_l1': 4, 'context_size_yyx': 2, 'num_mix_components_yyx': 5, 'context_extractor_yyx': 'lstm', 'activation_func_yyx': 'GELU', 'L2_weight_yyx': 0.00041596646444220706, 'L_entropy_weight_yyx': 4.9271100385034765e-08, 'L_sep_weight_yyx': 0.00019557504089851344, 'L_scale_weight_yyx': 3.860047199448658e-07, 'learning_rate_yyx': 0.0024842175937161647}. Best is trial 2 with value: -2.279533784042228.
[I 2026-03-18 18:57:37,449] Trial 7 finished with value: -0.8269715527487999 and parameters: {'n_layers_yyx': 1, 'hidden_size_yyx_l0': 5, 'context_size_yyx': 2, 'num_mix_components_yyx': 3, 'context_extractor_yyx': 'gru', 'activation_func_yyx': 'ReLU', 'L2_weight_yyx': 3.283852062580489e-07, 'L_entropy_weight_yyx': 0.00033288572828360714, 'L_sep_weight_yyx': 1.097100731688461e-06, 'L_scale_weight_yyx': 6.626331882811002e-08, 'learning_rate_yyx': 0.0021861616937563664}. Best is trial 1 with value: -0.8348051941729366.
[I 2026-03-18 18:57:37,750] Trial 6 finished with value: -1.778199401238952 and parameters: {'n_layers_yyx': 1, 'hidden_size_yyx_l0': 3, 'context_size_yyx': 3, 'num_mix_components_yyx': 2, 'context_extractor_yyx': 'lstm', 'activation_func_yyx': 'Tanh', 'L2_weight_yyx': 1.0678787901604286e-06, 'L_entropy_weight_yyx': 0.00031134881825728997, 'L_sep_weight_yyx': 0.00014173023754201664, 'L_scale_weight_yyx': 0.00012583002595347784, 'learning_rate_yyx': 0.004162439139396148}. Best is trial 4 with value: -1.784507205847538.
[I 2026-03-18 18:57:40,067] Trial 8 pruned. 
[I 2026-03-18 18:57:41,613] Trial 21 pruned. 
[I 2026-03-18 18:57:43,341] Trial 11 pruned. 
[I 2026-03-18 18:57:46,153] Trial 6 pruned. 
[I 2026-03-18 18:57:47,146] Trial 9 pruned. 
[I 2026-03-18 18:57:52,250] Trial 12 pruned. 
[I 2026-03-18 18:57:54,848] Trial 4 pruned. 
[I 2026-03-18 18:57:55,092] Trial 22 pruned. 
[I 2026-03-18 18:57:55,249] Trial 14 pruned. 
[I 2026-03-18 18:57:58,467] Trial 7 finished with value: -1.784522914693813 and parameters: {'n_layers_yyx': 1, 'hidden_size_yyx_l0': 5, 'context_size_yyx': 1, 'num_mix_components_yyx': 5, 'context_extractor_yyx': 'gru', 'activation_func_yyx': 'ReLU', 'L2_weight_yyx': 0.0002820942458463928, 'L_entropy_weight_yyx': 6.986120991443234e-10, 'L_sep_weight_yyx': 9.013719618990248e-06, 'L_scale_weight_yyx': 1.0622698540079017e-09, 'learning_rate_yyx': 0.005666837187729917}. Best is trial 3 with value: -1.785882901278409.
[I 2026-03-18 18:57:58,946] Trial 15 pruned. 
[I 2026-03-18 18:58:00,404] Trial 13 pruned. 
[I 2026-03-18 18:58:03,396] Trial 5 finished with value: -1.864091702761834 and parameters: {'n_layers_yyx': 1, 'hidden_size_yyx_l0': 4, 'context_size_yyx': 3, 'num_mix_components_yyx': 4, 'context_extractor_yyx': 'lstm', 'activation_func_yyx': 'GELU', 'L2_weight_yyx': 7.872522687541945e-05, 'L_entropy_weight_yyx': 1.8861521314818964e-07, 'L_sep_weight_yyx': 8.707297693976537e-05, 'L_scale_weight_yyx': 5.502040192993101e-07, 'learning_rate_yyx': 0.0020226364568637903}. Best is trial 5 with value: -1.864091702761834.
[I 2026-03-18 18:58:04,478] Trial 25 finished with value: -0.8268245995661004 and parameters: {'n_layers_yyx': 1, 'hidden_size_yyx_l0': 6, 'context_size_yyx': 3, 'num_mix_components_yyx': 3, 'context_extractor_yyx': 'lstm', 'activation_func_yyx': 'Tanh', 'L2_weight_yyx': 0.0001281993632598512, 'L_entropy_weight_yyx': 1.1683258308716178e-10, 'L_sep_weight_yyx': 6.329392006537948e-08, 'L_scale_weight_yyx': 1.473815750984069e-06, 'learning_rate_yyx': 0.002453949063599228}. Best is trial 1 with value: -0.8328681168211087.
[I 2026-03-18 18:58:08,658] Trial 15 pruned. 
[I 2026-03-18 18:58:08,766] Trial 23 pruned. 
[I 2026-03-18 18:58:12,009] Trial 16 pruned. 
[I 2026-03-18 18:58:12,371] Trial 6 finished with value: -2.268126138873415 and parameters: {'n_layers_yyx': 2, 'hidden_size_yyx_l0': 3, 'hidden_size_yyx_l1': 3, 'context_size_yyx': 4, 'num_mix_components_yyx': 5, 'context_extractor_yyx': 'gru', 'activation_func_yyx': 'Tanh', 'L2_weight_yyx': 1.141743673868603e-09, 'L_entropy_weight_yyx': 1.7362209076654753e-05, 'L_sep_weight_yyx': 1.5231948497643394e-08, 'L_scale_weight_yyx': 1.2482445591682445e-05, 'learning_rate_yyx': 0.0020370533044855445}. Best is trial 6 with value: -2.268126138873415.
[I 2026-03-18 18:58:12,397] Trial 7 finished with value: -2.2649003774766676 and parameters: {'n_layers_yyx': 2, 'hidden_size_yyx_l0': 2, 'hidden_size_yyx_l1': 3, 'context_size_yyx': 2, 'num_mix_components_yyx': 1, 'context_extractor_yyx': 'lstm', 'activation_func_yyx': 'Tanh', 'L2_weight_yyx': 7.458239995610904e-06, 'L_entropy_weight_yyx': 4.707716513290697e-10, 'L_sep_weight_yyx': 3.724178791999015e-07, 'L_scale_weight_yyx': 5.602000929116051e-06, 'learning_rate_yyx': 0.0056072333824408955}. Best is trial 0 with value: -2.277465192778458.
[I 2026-03-18 18:58:15,075] Trial 16 pruned. 
[I 2026-03-18 18:58:15,131] Trial 4 finished with value: -2.2479146574410955 and parameters: {'n_layers_yyx': 1, 'hidden_size_yyx_l0': 6, 'context_size_yyx': 1, 'num_mix_components_yyx': 1, 'context_extractor_yyx': 'lstm', 'activation_func_yyx': 'GELU', 'L2_weight_yyx': 6.60998692624301e-10, 'L_entropy_weight_yyx': 1.499497374428582e-09, 'L_sep_weight_yyx': 1.8096250563512234e-09, 'L_scale_weight_yyx': 0.00017538614322560995, 'learning_rate_yyx': 0.004843237452819019}. Best is trial 3 with value: -2.2699321951591234.
[I 2026-03-18 18:58:15,943] Trial 24 pruned. 
[I 2026-03-18 18:58:17,411] Trial 14 pruned. 
[I 2026-03-18 18:58:18,461] Trial 26 pruned. 
[I 2026-03-18 18:58:18,557] Trial 8 finished with value: -2.2482330150203422 and parameters: {'n_layers_yyx': 2, 'hidden_size_yyx_l0': 4, 'hidden_size_yyx_l1': 4, 'context_size_yyx': 1, 'num_mix_components_yyx': 3, 'context_extractor_yyx': 'gru', 'activation_func_yyx': 'ReLU', 'L2_weight_yyx': 0.00028223636293530946, 'L_entropy_weight_yyx': 1.750085384759852e-10, 'L_sep_weight_yyx': 2.5370052559549283e-10, 'L_scale_weight_yyx': 9.179324271236056e-08, 'learning_rate_yyx': 0.00389432017479979}. Best is trial 2 with value: -2.272224617884258.
[I 2026-03-18 18:58:23,072] Trial 10 finished with value: -0.8345733146723827 and parameters: {'n_layers_yyx': 1, 'hidden_size_yyx_l0': 2, 'context_size_yyx': 2, 'num_mix_components_yyx': 5, 'context_extractor_yyx': 'gru', 'activation_func_yyx': 'Tanh', 'L2_weight_yyx': 0.0009915994871886734, 'L_entropy_weight_yyx': 4.637202955718426e-08, 'L_sep_weight_yyx': 1.136331064644418e-06, 'L_scale_weight_yyx': 1.5738860617600071e-09, 'learning_rate_yyx': 0.009588204224365812}. Best is trial 10 with value: -0.8345733146723827.
[I 2026-03-18 18:58:30,547] Trial 15 finished with value: -0.8083212780635501 and parameters: {'n_layers_yyx': 1, 'hidden_size_yyx_l0': 6, 'context_size_yyx': 4, 'num_mix_components_yyx': 5, 'context_extractor_yyx': 'gru', 'activation_func_yyx': 'Tanh', 'L2_weight_yyx': 4.938768588022207e-07, 'L_entropy_weight_yyx': 3.557333155082184e-08, 'L_sep_weight_yyx': 2.352051205406265e-09, 'L_scale_weight_yyx': 1.3145320637427427e-06, 'learning_rate_yyx': 0.0022583968972388437}. Best is trial 0 with value: -0.8324342893885016.
[I 2026-03-18 18:58:31,424] Trial 6 finished with value: -1.7590132033222854 and parameters: {'n_layers_yyx': 2, 'hidden_size_yyx_l0': 2, 'hidden_size_yyx_l1': 2, 'context_size_yyx': 2, 'num_mix_components_yyx': 1, 'context_extractor_yyx': 'gru', 'activation_func_yyx': 'GELU', 'L2_weight_yyx': 0.000701305935839197, 'L_entropy_weight_yyx': 4.681116261275729e-07, 'L_sep_weight_yyx': 2.4342627608437136e-09, 'L_scale_weight_yyx': 1.5690373703119425e-10, 'learning_rate_yyx': 0.006564974707941361}. Best is trial 2 with value: -1.7858329634232954.
[I 2026-03-18 18:58:31,898] Trial 10 finished with value: -0.8144059061475836 and parameters: {'n_layers_yyx': 2, 'hidden_size_yyx_l0': 3, 'hidden_size_yyx_l1': 6, 'context_size_yyx': 1, 'num_mix_components_yyx': 1, 'context_extractor_yyx': 'lstm', 'activation_func_yyx': 'Tanh', 'L2_weight_yyx': 5.225775894912404e-08, 'L_entropy_weight_yyx': 5.487043162184477e-09, 'L_sep_weight_yyx': 0.0008111252265827266, 'L_scale_weight_yyx': 9.878967816898312e-09, 'learning_rate_yyx': 0.006661857971591618}. Best is trial 2 with value: -0.8370103483890325.
[I 2026-03-18 18:58:33,075] Trial 8 pruned. 
[I 2026-03-18 18:58:35,422] Trial 5 pruned. 
[I 2026-03-18 18:58:35,861] Trial 21 finished with value: -0.8210714726187454 and parameters: {'n_layers_yyx': 2, 'hidden_size_yyx_l0': 3, 'hidden_size_yyx_l1': 6, 'context_size_yyx': 3, 'num_mix_components_yyx': 3, 'context_extractor_yyx': 'gru', 'activation_func_yyx': 'Tanh', 'L2_weight_yyx': 1.3040361831017494e-08, 'L_entropy_weight_yyx': 8.133640428371353e-09, 'L_sep_weight_yyx': 1.060948031012448e-08, 'L_scale_weight_yyx': 2.9117164709332986e-08, 'learning_rate_yyx': 0.003697688856483455}. Best is trial 8 with value: -0.8257869568321871.
[I 2026-03-18 18:58:37,641] Trial 16 pruned. 
[I 2026-03-18 18:58:40,683] Trial 7 pruned. 
[I 2026-03-18 18:58:42,407] Trial 8 pruned. 
[I 2026-03-18 18:58:44,927] Trial 6 pruned. 
[I 2026-03-18 18:58:44,988] Trial 17 pruned. 
[I 2026-03-18 18:58:45,467] Trial 17 pruned. 
[I 2026-03-18 18:58:46,291] Trial 6 pruned. 
[I 2026-03-18 18:58:49,746] Trial 27 pruned. 
[I 2026-03-18 18:58:51,506] Trial 8 finished with value: -2.2772691929792686 and parameters: {'n_layers_yyx': 2, 'hidden_size_yyx_l0': 5, 'hidden_size_yyx_l1': 5, 'context_size_yyx': 1, 'num_mix_components_yyx': 3, 'context_extractor_yyx': 'lstm', 'activation_func_yyx': 'ReLU', 'L2_weight_yyx': 1.970049978844536e-09, 'L_entropy_weight_yyx': 2.0469446195048677e-09, 'L_sep_weight_yyx': 1.5189499397615634e-07, 'L_scale_weight_yyx': 7.52159142152115e-08, 'learning_rate_yyx': 0.007804185592139026}. Best is trial 1 with value: -2.2840327548863986.
[I 2026-03-18 18:58:52,582] Trial 8 finished with value: -2.2722153625114747 and parameters: {'n_layers_yyx': 1, 'hidden_size_yyx_l0': 2, 'context_size_yyx': 4, 'num_mix_components_yyx': 5, 'context_extractor_yyx': 'lstm', 'activation_func_yyx': 'Tanh', 'L2_weight_yyx': 1.9729688971043982e-06, 'L_entropy_weight_yyx': 9.632234136061822e-08, 'L_sep_weight_yyx': 0.0009954121163161973, 'L_scale_weight_yyx': 4.9804564066033785e-06, 'learning_rate_yyx': 0.0015518536756717457}. Best is trial 5 with value: -2.276108344648868.
[I 2026-03-18 18:58:52,594] Trial 18 pruned. 
[I 2026-03-18 18:58:52,646] Trial 9 pruned. 
[I 2026-03-18 18:58:53,873] Trial 5 finished with value: -1.7641685179161968 and parameters: {'n_layers_yyx': 1, 'hidden_size_yyx_l0': 5, 'context_size_yyx': 4, 'num_mix_components_yyx': 3, 'context_extractor_yyx': 'gru', 'activation_func_yyx': 'GELU', 'L2_weight_yyx': 5.871446209180751e-05, 'L_entropy_weight_yyx': 0.00021229371577164403, 'L_sep_weight_yyx': 5.433637478966851e-09, 'L_scale_weight_yyx': 2.3427755394979428e-09, 'learning_rate_yyx': 0.002164139797700148}. Best is trial 1 with value: -1.7684712210476057.
[I 2026-03-18 18:58:54,880] Trial 7 pruned. 
[I 2026-03-18 18:58:57,838] Trial 6 pruned. 
[I 2026-03-18 18:58:59,981] Trial 15 pruned. 
[I 2026-03-18 18:59:00,170] Trial 17 finished with value: -0.8072157258297175 and parameters: {'n_layers_yyx': 1, 'hidden_size_yyx_l0': 5, 'context_size_yyx': 1, 'num_mix_components_yyx': 4, 'context_extractor_yyx': 'gru', 'activation_func_yyx': 'ReLU', 'L2_weight_yyx': 2.748251887749834e-06, 'L_entropy_weight_yyx': 1.2823460825995128e-10, 'L_sep_weight_yyx': 2.1724489715036813e-07, 'L_scale_weight_yyx': 6.809161969808945e-06, 'learning_rate_yyx': 0.009446908161482252}. Best is trial 2 with value: -0.8228697107672868.
