[I 2026-03-18 19:50:34,449] Trial 10 finished with value: -2.069843123958664 and parameters: {'n_layers_yyx': 2, 'hidden_size_yyx_l0': 5, 'hidden_size_yyx_l1': 6, 'context_size_yyx': 4, 'num_mix_components_yyx': 3, 'context_extractor_yyx': 'lstm', 'activation_func_yyx': 'Tanh', 'L2_weight_yyx': 5.7599786268234097e-08, 'L_entropy_weight_yyx': 1.8810650568440863e-09, 'L_sep_weight_yyx': 9.754581490071879e-06, 'L_scale_weight_yyx': 1.569203121251364e-05, 'learning_rate_yyx': 0.009703462053815096}. Best is trial 1 with value: -2.0819965339546846.
[I 2026-03-18 19:50:34,525] Trial 18 pruned. 
[I 2026-03-18 19:50:38,863] Trial 23 finished with value: -2.0948849820819597 and parameters: {'n_layers_yyx': 1, 'hidden_size_yyx_l0': 4, 'context_size_yyx': 4, 'num_mix_components_yyx': 4, 'context_extractor_yyx': 'lstm', 'activation_func_yyx': 'Tanh', 'L2_weight_yyx': 1.6303048679916737e-09, 'L_entropy_weight_yyx': 3.996920526215832e-09, 'L_sep_weight_yyx': 4.2063991090465106e-10, 'L_scale_weight_yyx': 1.0128755378667856e-10, 'learning_rate_yyx': 0.00779165809989264}. Best is trial 21 with value: -2.0975034066716556.
[I 2026-03-18 19:50:39,503] Trial 19 pruned. 
[I 2026-03-18 19:50:50,644] Trial 11 pruned. 
[I 2026-03-18 19:50:51,450] Trial 19 pruned. 
[I 2026-03-18 19:50:54,586] Trial 24 pruned. 
[I 2026-03-18 19:51:03,042] Trial 16 finished with value: -2.078147534445915 and parameters: {'n_layers_yyx': 1, 'hidden_size_yyx_l0': 4, 'context_size_yyx': 4, 'num_mix_components_yyx': 4, 'context_extractor_yyx': 'lstm', 'activation_func_yyx': 'ReLU', 'L2_weight_yyx': 3.53582209789435e-08, 'L_entropy_weight_yyx': 3.179077460598749e-06, 'L_sep_weight_yyx': 2.673610975015941e-06, 'L_scale_weight_yyx': 5.671728218474072e-05, 'learning_rate_yyx': 0.0014892651669656128}. Best is trial 13 with value: -2.092152629106611.
[I 2026-03-18 19:51:11,675] Trial 20 pruned. 
[I 2026-03-18 19:51:14,774] Trial 28 pruned. 
[I 2026-03-18 19:51:16,946] Trial 17 pruned. 
[I 2026-03-18 19:51:19,124] Trial 12 pruned. 
[I 2026-03-18 19:51:25,861] Trial 21 pruned. 
[I 2026-03-18 19:51:29,082] Trial 29 pruned. 
[I 2026-03-18 19:51:51,137] Trial 12 pruned. 
[I 2026-03-18 19:51:51,262] Trial 15 finished with value: -2.080816903903546 and parameters: {'n_layers_yyx': 1, 'hidden_size_yyx_l0': 5, 'context_size_yyx': 1, 'num_mix_components_yyx': 5, 'context_extractor_yyx': 'gru', 'activation_func_yyx': 'GELU', 'L2_weight_yyx': 8.222629033886114e-05, 'L_entropy_weight_yyx': 9.597761606643387e-06, 'L_sep_weight_yyx': 1.8304567970527898e-06, 'L_scale_weight_yyx': 1.438136481964724e-08, 'learning_rate_yyx': 0.004959314821136198}. Best is trial 2 with value: -2.093203554819634.
[I 2026-03-18 19:51:54,820] Trial 13 pruned. 
[I 2026-03-18 19:52:03,190] Trial 30 pruned. 
[I 2026-03-18 19:52:08,588] Trial 16 pruned. 
[I 2026-03-18 19:52:09,898] Trial 18 finished with value: -1.6159899080612683 and parameters: {'n_layers_yyx': 2, 'hidden_size_yyx_l0': 4, 'hidden_size_yyx_l1': 6, 'context_size_yyx': 3, 'num_mix_components_yyx': 3, 'context_extractor_yyx': 'lstm', 'activation_func_yyx': 'Tanh', 'L2_weight_yyx': 1.7802044360051586e-09, 'L_entropy_weight_yyx': 2.7824323358007856e-10, 'L_sep_weight_yyx': 3.495729960835755e-07, 'L_scale_weight_yyx': 9.907813820727324e-05, 'learning_rate_yyx': 0.005425452128979159}. Best is trial 18 with value: -1.6159899080612683.
[I 2026-03-18 19:52:20,630] Trial 7 finished with value: -2.0791704047018813 and parameters: {'n_layers_yyx': 2, 'hidden_size_yyx_l0': 6, 'hidden_size_yyx_l1': 4, 'context_size_yyx': 3, 'num_mix_components_yyx': 2, 'context_extractor_yyx': 'gru', 'activation_func_yyx': 'Tanh', 'L2_weight_yyx': 4.55762583867994e-08, 'L_entropy_weight_yyx': 9.8888661347472e-06, 'L_sep_weight_yyx': 1.769250807246882e-08, 'L_scale_weight_yyx': 2.9551398223243044e-10, 'learning_rate_yyx': 0.0017425345987802307}. Best is trial 6 with value: -2.0854983656867034.
[I 2026-03-18 19:52:23,491] Trial 24 finished with value: -1.6051080966289502 and parameters: {'n_layers_yyx': 2, 'hidden_size_yyx_l0': 5, 'hidden_size_yyx_l1': 3, 'context_size_yyx': 2, 'num_mix_components_yyx': 2, 'context_extractor_yyx': 'lstm', 'activation_func_yyx': 'ReLU', 'L2_weight_yyx': 0.00016399236390830734, 'L_entropy_weight_yyx': 4.682148847418162e-09, 'L_sep_weight_yyx': 5.614086481307436e-10, 'L_scale_weight_yyx': 8.295625547101667e-10, 'learning_rate_yyx': 0.009758378810603941}. Best is trial 7 with value: -1.6077896387869492.
[I 2026-03-18 19:52:24,102] Trial 17 pruned. 
[I 2026-03-18 19:52:27,477] Trial 22 finished with value: -1.6117076350060895 and parameters: {'n_layers_yyx': 2, 'hidden_size_yyx_l0': 3, 'hidden_size_yyx_l1': 5, 'context_size_yyx': 4, 'num_mix_components_yyx': 2, 'context_extractor_yyx': 'gru', 'activation_func_yyx': 'GELU', 'L2_weight_yyx': 6.811619573805242e-08, 'L_entropy_weight_yyx': 2.568248503044138e-08, 'L_sep_weight_yyx': 1.7652498758223536e-06, 'L_scale_weight_yyx': 6.628564351519544e-05, 'learning_rate_yyx': 0.009532537979180147}. Best is trial 21 with value: -1.6119054721666712.
[I 2026-03-18 19:52:28,733] Trial 13 pruned. 
[I 2026-03-18 19:52:28,764] Trial 14 pruned. 
[I 2026-03-18 19:52:30,772] Trial 14 finished with value: -1.6283982349618134 and parameters: {'n_layers_yyx': 1, 'hidden_size_yyx_l0': 5, 'context_size_yyx': 3, 'num_mix_components_yyx': 2, 'context_extractor_yyx': 'lstm', 'activation_func_yyx': 'Tanh', 'L2_weight_yyx': 1.6435357548359981e-06, 'L_entropy_weight_yyx': 2.3548303369347792e-07, 'L_sep_weight_yyx': 3.307645305497233e-05, 'L_scale_weight_yyx': 5.0524997215079185e-09, 'learning_rate_yyx': 0.0018634151208526042}. Best is trial 3 with value: -1.6307942617099915.
[I 2026-03-18 19:52:33,713] Trial 31 pruned. 
[I 2026-03-18 19:52:34,879] Trial 8 pruned. 
[I 2026-03-18 19:52:37,475] Trial 25 pruned. 
[I 2026-03-18 19:52:43,051] Trial 23 pruned. 
[I 2026-03-18 19:52:47,103] Trial 15 pruned. 
[I 2026-03-18 19:52:50,429] Trial 32 pruned. 
[I 2026-03-18 19:52:50,832] Trial 22 pruned. 
[I 2026-03-18 19:52:56,016] Trial 13 pruned. 
[I 2026-03-18 19:52:56,898] Trial 18 pruned. 
[I 2026-03-18 19:53:00,678] Trial 15 pruned. 
[I 2026-03-18 19:53:03,325] Trial 14 pruned. 
[I 2026-03-18 19:53:04,099] Trial 13 pruned. 
[I 2026-03-18 19:53:06,326] Trial 25 pruned. 
[I 2026-03-18 19:53:08,258] Trial 26 pruned. 
[I 2026-03-18 19:53:10,528] Trial 12 finished with value: -2.0757315513352794 and parameters: {'n_layers_yyx': 1, 'hidden_size_yyx_l0': 4, 'context_size_yyx': 4, 'num_mix_components_yyx': 5, 'context_extractor_yyx': 'gru', 'activation_func_yyx': 'GELU', 'L2_weight_yyx': 4.702013759343052e-08, 'L_entropy_weight_yyx': 3.562562906002147e-10, 'L_sep_weight_yyx': 8.31210030682003e-07, 'L_scale_weight_yyx': 2.6388477551208157e-08, 'learning_rate_yyx': 0.001393564287476487}. Best is trial 6 with value: -2.0790188514889616.
[I 2026-03-18 19:53:10,864] Trial 16 pruned. 
[I 2026-03-18 19:53:11,667] Trial 16 pruned. 
[I 2026-03-18 19:53:15,354] Trial 15 finished with value: -1.612562275862039 and parameters: {'n_layers_yyx': 2, 'hidden_size_yyx_l0': 2, 'hidden_size_yyx_l1': 3, 'context_size_yyx': 4, 'num_mix_components_yyx': 2, 'context_extractor_yyx': 'gru', 'activation_func_yyx': 'Tanh', 'L2_weight_yyx': 1.2716239881058246e-05, 'L_entropy_weight_yyx': 1.1117234678630065e-07, 'L_sep_weight_yyx': 5.529161659774471e-08, 'L_scale_weight_yyx': 1.5942770915928626e-05, 'learning_rate_yyx': 0.006780156914396981}. Best is trial 13 with value: -1.613792101823724.
[I 2026-03-18 19:53:17,323] Trial 17 pruned. 
[I 2026-03-18 19:53:17,377] Trial 13 pruned. 
[I 2026-03-18 19:53:18,811] Trial 17 pruned. 
[I 2026-03-18 19:53:20,459] Trial 30 finished with value: -2.057946210102521 and parameters: {'n_layers_yyx': 2, 'hidden_size_yyx_l0': 2, 'hidden_size_yyx_l1': 5, 'context_size_yyx': 2, 'num_mix_components_yyx': 3, 'context_extractor_yyx': 'lstm', 'activation_func_yyx': 'GELU', 'L2_weight_yyx': 2.8895112346681427e-09, 'L_entropy_weight_yyx': 3.3423289874135616e-09, 'L_sep_weight_yyx': 7.221237489808892e-05, 'L_scale_weight_yyx': 3.5662404174759984e-05, 'learning_rate_yyx': 0.0063057691606202846}. Best is trial 2 with value: -2.059868681386501.
[I 2026-03-18 19:53:20,618] Trial 27 pruned. 
[I 2026-03-18 19:53:20,722] Trial 26 pruned. 
[I 2026-03-18 19:53:22,529] Trial 15 pruned. 
[I 2026-03-18 19:53:24,432] Trial 14 pruned. 
[I 2026-03-18 19:53:24,795] Trial 12 finished with value: -1.583475239621104 and parameters: {'n_layers_yyx': 2, 'hidden_size_yyx_l0': 5, 'hidden_size_yyx_l1': 6, 'context_size_yyx': 2, 'num_mix_components_yyx': 2, 'context_extractor_yyx': 'gru', 'activation_func_yyx': 'GELU', 'L2_weight_yyx': 1.7812887074980795e-08, 'L_entropy_weight_yyx': 4.577147817573255e-09, 'L_sep_weight_yyx': 2.5717362784394327e-05, 'L_scale_weight_yyx': 4.446989847894753e-09, 'learning_rate_yyx': 0.005062322648877202}. Best is trial 9 with value: -1.613731891101604.
[I 2026-03-18 19:53:26,575] Trial 28 pruned. 
[I 2026-03-18 19:53:27,843] Trial 13 pruned. 
[I 2026-03-18 19:53:28,595] Trial 16 pruned. 
[I 2026-03-18 19:53:31,065] Trial 13 pruned. 
[I 2026-03-18 19:53:31,071] Trial 18 finished with value: -2.0761023390466447 and parameters: {'n_layers_yyx': 1, 'hidden_size_yyx_l0': 3, 'context_size_yyx': 4, 'num_mix_components_yyx': 2, 'context_extractor_yyx': 'lstm', 'activation_func_yyx': 'ReLU', 'L2_weight_yyx': 1.3993043570224682e-10, 'L_entropy_weight_yyx': 5.85412241457618e-10, 'L_sep_weight_yyx': 7.550907254626588e-07, 'L_scale_weight_yyx': 0.000990238269124377, 'learning_rate_yyx': 0.009893281575948596}. Best is trial 13 with value: -2.092152629106611.
[I 2026-03-18 19:53:31,137] Trial 15 pruned. 
[I 2026-03-18 19:53:32,902] Trial 29 pruned. 
[I 2026-03-18 19:53:33,589] Trial 18 pruned. 
[I 2026-03-18 19:53:33,963] Trial 27 pruned. 
[I 2026-03-18 19:53:37,488] Trial 16 pruned. 
[I 2026-03-18 19:53:38,358] Trial 14 pruned. 
[I 2026-03-18 19:53:38,722] Trial 19 pruned. 
[I 2026-03-18 19:53:39,383] Trial 12 finished with value: -2.0908513390245194 and parameters: {'n_layers_yyx': 1, 'hidden_size_yyx_l0': 6, 'context_size_yyx': 4, 'num_mix_components_yyx': 5, 'context_extractor_yyx': 'gru', 'activation_func_yyx': 'Tanh', 'L2_weight_yyx': 4.253776381312908e-08, 'L_entropy_weight_yyx': 7.758480190269035e-08, 'L_sep_weight_yyx': 1.31746174180318e-08, 'L_scale_weight_yyx': 1.711707929042008e-05, 'learning_rate_yyx': 0.0038687148997089164}. Best is trial 10 with value: -2.091011705152489.
[I 2026-03-18 19:53:45,444] Trial 20 pruned. 
[I 2026-03-18 19:53:45,606] Trial 30 pruned. 
[I 2026-03-18 19:53:46,168] Trial 13 finished with value: -2.1199620666098626 and parameters: {'n_layers_yyx': 1, 'hidden_size_yyx_l0': 3, 'context_size_yyx': 2, 'num_mix_components_yyx': 5, 'context_extractor_yyx': 'gru', 'activation_func_yyx': 'Tanh', 'L2_weight_yyx': 2.182770151325851e-05, 'L_entropy_weight_yyx': 2.9990688553102755e-05, 'L_sep_weight_yyx': 1.5823795588075302e-08, 'L_scale_weight_yyx': 4.6129007142678164e-07, 'learning_rate_yyx': 0.00996774475828284}. Best is trial 10 with value: -2.123509279126982.
[I 2026-03-18 19:53:46,977] Trial 20 finished with value: -1.6418637207258782 and parameters: {'n_layers_yyx': 1, 'hidden_size_yyx_l0': 5, 'context_size_yyx': 2, 'num_mix_components_yyx': 5, 'context_extractor_yyx': 'gru', 'activation_func_yyx': 'ReLU', 'L2_weight_yyx': 4.0394625703550974e-08, 'L_entropy_weight_yyx': 3.6590654429179055e-09, 'L_sep_weight_yyx': 2.2957460446094464e-05, 'L_scale_weight_yyx': 9.441187615451442e-07, 'learning_rate_yyx': 0.006713867266273795}. Best is trial 12 with value: -1.6531010225123595.
[I 2026-03-18 19:53:48,088] Trial 16 pruned. 
[I 2026-03-18 19:53:53,164] Trial 19 finished with value: -1.6167309256757225 and parameters: {'n_layers_yyx': 2, 'hidden_size_yyx_l0': 6, 'hidden_size_yyx_l1': 5, 'context_size_yyx': 4, 'num_mix_components_yyx': 3, 'context_extractor_yyx': 'lstm', 'activation_func_yyx': 'Tanh', 'L2_weight_yyx': 9.946594829334165e-08, 'L_entropy_weight_yyx': 1.3895341312746382e-10, 'L_sep_weight_yyx': 5.875403881087147e-07, 'L_scale_weight_yyx': 0.0001538770683129286, 'learning_rate_yyx': 0.005720076831155004}. Best is trial 19 with value: -1.6167309256757225.
[I 2026-03-18 19:53:54,996] Trial 17 pruned. 
[I 2026-03-18 19:53:56,070] Trial 17 pruned. 
[I 2026-03-18 19:53:56,158] Trial 33 finished with value: -1.6128542066359541 and parameters: {'n_layers_yyx': 1, 'hidden_size_yyx_l0': 5, 'context_size_yyx': 4, 'num_mix_components_yyx': 4, 'context_extractor_yyx': 'lstm', 'activation_func_yyx': 'ReLU', 'L2_weight_yyx': 1.3893068434550096e-09, 'L_entropy_weight_yyx': 4.01282023277742e-08, 'L_sep_weight_yyx': 2.0639884998800025e-10, 'L_scale_weight_yyx': 5.248611008976372e-05, 'learning_rate_yyx': 0.00832238224028358}. Best is trial 26 with value: -1.6132763574564741.
[I 2026-03-18 19:53:58,756] Trial 20 finished with value: -1.6161773654609999 and parameters: {'n_layers_yyx': 2, 'hidden_size_yyx_l0': 2, 'hidden_size_yyx_l1': 4, 'context_size_yyx': 4, 'num_mix_components_yyx': 3, 'context_extractor_yyx': 'gru', 'activation_func_yyx': 'Tanh', 'L2_weight_yyx': 4.725041758024548e-05, 'L_entropy_weight_yyx': 4.2754024241101343e-07, 'L_sep_weight_yyx': 1.1960313064486728e-06, 'L_scale_weight_yyx': 4.82587257584416e-05, 'learning_rate_yyx': 0.005821120644309251}. Best is trial 20 with value: -1.6161773654609999.
[I 2026-03-18 19:53:59,995] Trial 21 pruned. 
[I 2026-03-18 19:54:01,209] Trial 14 pruned. 
[I 2026-03-18 19:54:04,809] Trial 14 finished with value: -1.6076135897235178 and parameters: {'n_layers_yyx': 1, 'hidden_size_yyx_l0': 4, 'context_size_yyx': 4, 'num_mix_components_yyx': 5, 'context_extractor_yyx': 'gru', 'activation_func_yyx': 'ReLU', 'L2_weight_yyx': 1.4431649794863707e-07, 'L_entropy_weight_yyx': 4.676481545480718e-07, 'L_sep_weight_yyx': 4.199063654066847e-07, 'L_scale_weight_yyx': 4.945228582530696e-05, 'learning_rate_yyx': 0.009451980072366646}. Best is trial 2 with value: -1.6133203092563246.
[I 2026-03-18 19:54:05,486] Trial 24 finished with value: -1.606624498527804 and parameters: {'n_layers_yyx': 2, 'hidden_size_yyx_l0': 3, 'hidden_size_yyx_l1': 5, 'context_size_yyx': 4, 'num_mix_components_yyx': 1, 'context_extractor_yyx': 'gru', 'activation_func_yyx': 'GELU', 'L2_weight_yyx': 1.0404533033961497e-07, 'L_entropy_weight_yyx': 2.606075451119025e-07, 'L_sep_weight_yyx': 1.0701282437539807e-05, 'L_scale_weight_yyx': 9.933781384059293e-06, 'learning_rate_yyx': 0.007635044401422461}. Best is trial 21 with value: -1.6119054721666712.
[I 2026-03-18 19:54:06,791] Trial 22 pruned. 
[I 2026-03-18 19:54:11,041] Trial 15 pruned. 
[I 2026-03-18 19:54:12,144] Trial 19 pruned. 
[I 2026-03-18 19:54:13,121] Trial 25 pruned. 
[I 2026-03-18 19:54:13,507] Trial 21 pruned. 
[I 2026-03-18 19:54:15,069] Trial 15 pruned. 
[I 2026-03-18 19:54:17,078] Trial 31 pruned. 
[I 2026-03-18 19:54:25,163] Trial 21 pruned. 
[I 2026-03-18 19:54:25,951] Trial 16 pruned. 
[I 2026-03-18 19:54:26,223] Trial 25 finished with value: -2.094295658345322 and parameters: {'n_layers_yyx': 1, 'hidden_size_yyx_l0': 3, 'context_size_yyx': 4, 'num_mix_components_yyx': 4, 'context_extractor_yyx': 'lstm', 'activation_func_yyx': 'Tanh', 'L2_weight_yyx': 1.17711118898392e-08, 'L_entropy_weight_yyx': 7.473985830530855e-10, 'L_sep_weight_yyx': 7.79317202422217e-09, 'L_scale_weight_yyx': 5.210661720615367e-09, 'learning_rate_yyx': 0.007281786488529081}. Best is trial 21 with value: -2.0975034066716556.
[I 2026-03-18 19:54:27,848] Trial 26 pruned. 
[I 2026-03-18 19:54:37,885] Trial 18 pruned. 
[I 2026-03-18 19:54:39,797] Trial 26 pruned. 
[I 2026-03-18 19:54:41,752] Trial 27 pruned. 
[I 2026-03-18 19:54:42,796] Trial 34 finished with value: -1.6123572215239912 and parameters: {'n_layers_yyx': 1, 'hidden_size_yyx_l0': 6, 'context_size_yyx': 4, 'num_mix_components_yyx': 4, 'context_extractor_yyx': 'lstm', 'activation_func_yyx': 'ReLU', 'L2_weight_yyx': 4.365717641505938e-09, 'L_entropy_weight_yyx': 3.6548057714893715e-08, 'L_sep_weight_yyx': 1.0432562287759958e-09, 'L_scale_weight_yyx': 4.309884394361559e-05, 'learning_rate_yyx': 0.008163414597461949}. Best is trial 26 with value: -1.6132763574564741.
[I 2026-03-18 19:54:44,606] Trial 19 pruned. 
[I 2026-03-18 19:54:45,998] Trial 32 pruned. 
[I 2026-03-18 19:54:46,976] Trial 9 finished with value: -2.079563642613463 and parameters: {'n_layers_yyx': 2, 'hidden_size_yyx_l0': 5, 'hidden_size_yyx_l1': 4, 'context_size_yyx': 1, 'num_mix_components_yyx': 4, 'context_extractor_yyx': 'lstm', 'activation_func_yyx': 'GELU', 'L2_weight_yyx': 2.429546245727533e-07, 'L_entropy_weight_yyx': 0.0002720975230007864, 'L_sep_weight_yyx': 3.5981260210928697e-09, 'L_scale_weight_yyx': 1.444058439337976e-09, 'learning_rate_yyx': 0.003871776930351284}. Best is trial 6 with value: -2.0854983656867034.
[I 2026-03-18 19:54:48,871] Trial 16 pruned. 
[I 2026-03-18 19:54:49,628] Trial 22 pruned. 
[I 2026-03-18 19:54:50,526] Trial 18 finished with value: -1.623667107141606 and parameters: {'n_layers_yyx': 2, 'hidden_size_yyx_l0': 6, 'hidden_size_yyx_l1': 6, 'context_size_yyx': 2, 'num_mix_components_yyx': 5, 'context_extractor_yyx': 'gru', 'activation_func_yyx': 'ReLU', 'L2_weight_yyx': 8.443673436498937e-05, 'L_entropy_weight_yyx': 1.7808455512157588e-07, 'L_sep_weight_yyx': 1.7424193206467914e-08, 'L_scale_weight_yyx': 2.0802577735871763e-08, 'learning_rate_yyx': 0.002570114156380585}. Best is trial 3 with value: -1.6307942617099915.
[I 2026-03-18 19:54:51,337] Trial 20 pruned. 
[I 2026-03-18 19:54:51,862] Trial 33 pruned. 
[I 2026-03-18 19:54:52,143] Trial 14 pruned. 
[I 2026-03-18 19:54:55,487] Trial 17 pruned. 
[I 2026-03-18 19:54:57,750] Trial 34 pruned. 
[I 2026-03-18 19:54:59,177] Trial 15 pruned. 
[I 2026-03-18 19:54:59,306] Trial 21 pruned. 
[I 2026-03-18 19:54:59,548] Trial 17 pruned. 
[I 2026-03-18 19:55:03,955] Trial 23 pruned. 
[I 2026-03-18 19:55:04,942] Trial 20 finished with value: -1.6167068819328152 and parameters: {'n_layers_yyx': 2, 'hidden_size_yyx_l0': 6, 'hidden_size_yyx_l1': 5, 'context_size_yyx': 4, 'num_mix_components_yyx': 3, 'context_extractor_yyx': 'lstm', 'activation_func_yyx': 'Tanh', 'L2_weight_yyx': 8.552341083152221e-08, 'L_entropy_weight_yyx': 3.300280863367713e-10, 'L_sep_weight_yyx': 9.441738648069708e-09, 'L_scale_weight_yyx': 0.00013421810954207742, 'learning_rate_yyx': 0.005683750101471175}. Best is trial 19 with value: -1.6167309256757225.
[I 2026-03-18 19:55:06,292] Trial 16 pruned. 
[I 2026-03-18 19:55:08,098] Trial 19 finished with value: -2.0928059332471287 and parameters: {'n_layers_yyx': 1, 'hidden_size_yyx_l0': 4, 'context_size_yyx': 1, 'num_mix_components_yyx': 5, 'context_extractor_yyx': 'gru', 'activation_func_yyx': 'Tanh', 'L2_weight_yyx': 1.0683808757137862e-05, 'L_entropy_weight_yyx': 4.086504021210168e-05, 'L_sep_weight_yyx': 1.4551513367516252e-06, 'L_scale_weight_yyx': 1.6759105238895998e-09, 'learning_rate_yyx': 0.006786664928477724}. Best is trial 2 with value: -2.093203554819634.
[I 2026-03-18 19:55:10,362] Trial 17 pruned. 
[I 2026-03-18 19:55:11,720] Trial 13 finished with value: -2.0909758676441306 and parameters: {'n_layers_yyx': 1, 'hidden_size_yyx_l0': 6, 'context_size_yyx': 4, 'num_mix_components_yyx': 5, 'context_extractor_yyx': 'gru', 'activation_func_yyx': 'Tanh', 'L2_weight_yyx': 8.796031753502227e-09, 'L_entropy_weight_yyx': 5.653066857299963e-09, 'L_sep_weight_yyx': 5.997934401646961e-09, 'L_scale_weight_yyx': 1.0139163618234102e-10, 'learning_rate_yyx': 0.005291503677025066}. Best is trial 10 with value: -2.091011705152489.
[I 2026-03-18 19:55:13,833] Trial 18 pruned. 
[I 2026-03-18 19:55:17,722] Trial 24 pruned. 
[I 2026-03-18 19:55:18,514] Trial 14 pruned. 
[I 2026-03-18 19:55:18,595] Trial 28 pruned. 
[I 2026-03-18 19:55:22,436] Trial 20 pruned. 
[I 2026-03-18 19:55:23,282] Trial 18 pruned. 
[I 2026-03-18 19:55:23,641] Trial 25 pruned. 
[I 2026-03-18 19:55:24,786] Trial 29 pruned. 
[I 2026-03-18 19:55:25,232] Trial 15 pruned. 
[I 2026-03-18 19:55:27,899] Trial 19 pruned. 
[I 2026-03-18 19:55:28,754] Trial 10 pruned. 
[I 2026-03-18 19:55:32,430] Trial 16 pruned. 
[I 2026-03-18 19:55:34,356] Trial 20 pruned. 
[I 2026-03-18 19:55:35,705] Trial 11 pruned. 
[I 2026-03-18 19:55:37,592] Trial 21 pruned. 
[I 2026-03-18 19:55:38,870] Trial 22 pruned. 
[I 2026-03-18 19:55:39,454] Trial 17 pruned. 
[I 2026-03-18 19:55:40,009] Trial 28 finished with value: -1.632462337816119 and parameters: {'n_layers_yyx': 1, 'hidden_size_yyx_l0': 2, 'context_size_yyx': 2, 'num_mix_components_yyx': 5, 'context_extractor_yyx': 'lstm', 'activation_func_yyx': 'ReLU', 'L2_weight_yyx': 1.8782774564730403e-08, 'L_entropy_weight_yyx': 1.0100814678316077e-06, 'L_sep_weight_yyx': 1.595811162560335e-09, 'L_scale_weight_yyx': 2.950942973880056e-05, 'learning_rate_yyx': 0.001905138589959071}. Best is trial 13 with value: -1.640321681328409.
[I 2026-03-18 19:55:40,042] Trial 30 pruned. 
[I 2026-03-18 19:55:42,925] Trial 12 pruned. 
[I 2026-03-18 19:55:43,515] Trial 35 finished with value: -1.6130707625058818 and parameters: {'n_layers_yyx': 1, 'hidden_size_yyx_l0': 6, 'context_size_yyx': 4, 'num_mix_components_yyx': 5, 'context_extractor_yyx': 'lstm', 'activation_func_yyx': 'GELU', 'L2_weight_yyx': 6.1420403116751226e-09, 'L_entropy_weight_yyx': 3.431196162709265e-09, 'L_sep_weight_yyx': 9.502395339636115e-10, 'L_scale_weight_yyx': 0.0009388507522646101, 'learning_rate_yyx': 0.008396304518535513}. Best is trial 26 with value: -1.6132763574564741.
[I 2026-03-18 19:55:44,166] Trial 23 pruned. 
