[I 2026-03-18 17:09:45,015] Trial 5 finished with value: -2.9729516240610265 and parameters: {'n_layers_yyx': 2, 'hidden_size_yyx_l0': 4, 'hidden_size_yyx_l1': 4, 'context_size_yyx': 2, 'num_mix_components_yyx': 5, 'context_extractor_yyx': 'lstm', 'activation_func_yyx': 'Tanh', 'L2_weight_yyx': 1.4332728430156233e-06, 'L_entropy_weight_yyx': 6.335826954377947e-06, 'L_sep_weight_yyx': 2.732464189751836e-08, 'L_scale_weight_yyx': 1.82724285487601e-05, 'learning_rate_yyx': 0.00988075471149131}. Best is trial 5 with value: -2.9729516240610265.
[I 2026-03-18 17:09:54,355] Trial 26 pruned. 
[I 2026-03-18 17:10:00,803] Trial 19 finished with value: -0.5778842175679161 and parameters: {'n_layers_yyx': 2, 'hidden_size_yyx_l0': 3, 'hidden_size_yyx_l1': 6, 'context_size_yyx': 4, 'num_mix_components_yyx': 4, 'context_extractor_yyx': 'gru', 'activation_func_yyx': 'ReLU', 'L2_weight_yyx': 1.0794755883348092e-06, 'L_entropy_weight_yyx': 1.9125434248082917e-08, 'L_sep_weight_yyx': 1.0646456211117589e-10, 'L_scale_weight_yyx': 1.914571021813523e-05, 'learning_rate_yyx': 0.00802443014031236}. Best is trial 10 with value: -0.57893176387068.
[I 2026-03-18 17:10:05,707] Trial 10 pruned. 
[I 2026-03-18 17:10:19,029] Trial 21 pruned. 
[I 2026-03-18 17:10:20,353] Trial 20 pruned. 
[I 2026-03-18 17:10:27,804] Trial 27 pruned. 
[I 2026-03-18 17:10:33,406] Trial 17 finished with value: -0.5864613361174992 and parameters: {'n_layers_yyx': 2, 'hidden_size_yyx_l0': 4, 'hidden_size_yyx_l1': 4, 'context_size_yyx': 3, 'num_mix_components_yyx': 5, 'context_extractor_yyx': 'gru', 'activation_func_yyx': 'ReLU', 'L2_weight_yyx': 1.1844412603310823e-09, 'L_entropy_weight_yyx': 0.00014792651133516257, 'L_sep_weight_yyx': 0.0001529654716048806, 'L_scale_weight_yyx': 8.30527373082104e-06, 'learning_rate_yyx': 0.005172110108349153}. Best is trial 17 with value: -0.5864613361174992.
[I 2026-03-18 17:10:35,481] Trial 30 finished with value: -0.5827773984885445 and parameters: {'n_layers_yyx': 1, 'hidden_size_yyx_l0': 4, 'context_size_yyx': 4, 'num_mix_components_yyx': 4, 'context_extractor_yyx': 'gru', 'activation_func_yyx': 'Tanh', 'L2_weight_yyx': 6.541686413321331e-07, 'L_entropy_weight_yyx': 2.307396833982753e-07, 'L_sep_weight_yyx': 0.000207463966832127, 'L_scale_weight_yyx': 5.04863963406706e-10, 'learning_rate_yyx': 0.00150354351884933}. Best is trial 3 with value: -0.5836324153936877.
[I 2026-03-18 17:10:37,907] Trial 22 pruned. 
[I 2026-03-18 17:10:38,101] Trial 17 finished with value: -0.5712623228889057 and parameters: {'n_layers_yyx': 2, 'hidden_size_yyx_l0': 3, 'hidden_size_yyx_l1': 4, 'context_size_yyx': 4, 'num_mix_components_yyx': 5, 'context_extractor_yyx': 'lstm', 'activation_func_yyx': 'Tanh', 'L2_weight_yyx': 1.4595353350290349e-05, 'L_entropy_weight_yyx': 5.475422057814679e-10, 'L_sep_weight_yyx': 0.00012770564191700044, 'L_scale_weight_yyx': 7.203501758890498e-09, 'learning_rate_yyx': 0.006948232988619507}. Best is trial 0 with value: -0.5748618229547262.
[I 2026-03-18 17:10:45,656] Trial 28 pruned. 
[I 2026-03-18 17:10:45,701] Trial 11 finished with value: -0.5621938167608752 and parameters: {'n_layers_yyx': 1, 'hidden_size_yyx_l0': 6, 'context_size_yyx': 3, 'num_mix_components_yyx': 5, 'context_extractor_yyx': 'gru', 'activation_func_yyx': 'GELU', 'L2_weight_yyx': 2.3026655807342126e-08, 'L_entropy_weight_yyx': 2.2356048329983377e-08, 'L_sep_weight_yyx': 2.8694900210614e-07, 'L_scale_weight_yyx': 3.702805157675737e-07, 'learning_rate_yyx': 0.0024376187808587586}. Best is trial 11 with value: -0.5621938167608752.
[I 2026-03-18 17:10:46,541] Trial 8 finished with value: -2.955956673037092 and parameters: {'n_layers_yyx': 1, 'hidden_size_yyx_l0': 4, 'context_size_yyx': 4, 'num_mix_components_yyx': 5, 'context_extractor_yyx': 'gru', 'activation_func_yyx': 'GELU', 'L2_weight_yyx': 6.523081520664916e-10, 'L_entropy_weight_yyx': 3.608502608277493e-05, 'L_sep_weight_yyx': 4.353546622103034e-06, 'L_scale_weight_yyx': 1.1755457311134821e-07, 'learning_rate_yyx': 0.008843235807633772}. Best is trial 8 with value: -2.955956673037092.
[I 2026-03-18 17:10:56,409] Trial 31 pruned. 
[I 2026-03-18 17:10:57,550] Trial 10 pruned. 
[I 2026-03-18 17:10:58,250] Trial 18 pruned. 
[I 2026-03-18 17:11:01,227] Trial 26 pruned. 
[I 2026-03-18 17:11:03,936] Trial 42 pruned. 
[I 2026-03-18 17:11:05,555] Trial 28 pruned. 
[I 2026-03-18 17:11:12,480] Trial 32 pruned. 
[I 2026-03-18 17:11:15,322] Trial 23 pruned. 
[I 2026-03-18 17:11:22,098] Trial 29 pruned. 
[I 2026-03-18 17:11:22,211] Trial 11 pruned. 
[I 2026-03-18 17:11:22,767] Trial 12 pruned. 
[I 2026-03-18 17:11:23,087] Trial 7 finished with value: -2.886311725841528 and parameters: {'n_layers_yyx': 2, 'hidden_size_yyx_l0': 6, 'hidden_size_yyx_l1': 3, 'context_size_yyx': 1, 'num_mix_components_yyx': 4, 'context_extractor_yyx': 'lstm', 'activation_func_yyx': 'ReLU', 'L2_weight_yyx': 0.00016751662701782678, 'L_entropy_weight_yyx': 1.5881731397604406e-05, 'L_sep_weight_yyx': 7.559492848086995e-07, 'L_scale_weight_yyx': 3.781205838330522e-08, 'learning_rate_yyx': 0.0017523805510583385}. Best is trial 7 with value: -2.886311725841528.
[I 2026-03-18 17:11:23,171] Trial 13 finished with value: -0.5488422503989533 and parameters: {'n_layers_yyx': 1, 'hidden_size_yyx_l0': 5, 'context_size_yyx': 2, 'num_mix_components_yyx': 2, 'context_extractor_yyx': 'gru', 'activation_func_yyx': 'GELU', 'L2_weight_yyx': 1.3771713443823151e-08, 'L_entropy_weight_yyx': 9.737354539660547e-07, 'L_sep_weight_yyx': 7.542497336530615e-05, 'L_scale_weight_yyx': 1.082916800988347e-10, 'learning_rate_yyx': 0.0037814602846447678}. Best is trial 1 with value: -0.5818196838462861.
[I 2026-03-18 17:11:28,871] Trial 9 pruned. 
[I 2026-03-18 17:11:32,368] Trial 10 pruned. 
[I 2026-03-18 17:11:33,033] Trial 19 pruned. 
[I 2026-03-18 17:11:40,047] Trial 29 pruned. 
[I 2026-03-18 17:11:41,313] Trial 18 finished with value: -0.5752995424126333 and parameters: {'n_layers_yyx': 2, 'hidden_size_yyx_l0': 5, 'hidden_size_yyx_l1': 4, 'context_size_yyx': 3, 'num_mix_components_yyx': 2, 'context_extractor_yyx': 'lstm', 'activation_func_yyx': 'Tanh', 'L2_weight_yyx': 1.5241247202767256e-07, 'L_entropy_weight_yyx': 8.845295515250769e-08, 'L_sep_weight_yyx': 3.868233198150543e-06, 'L_scale_weight_yyx': 8.203089656978083e-08, 'learning_rate_yyx': 0.006497256053290121}. Best is trial 18 with value: -0.5752995424126333.
[I 2026-03-18 17:11:43,378] Trial 21 pruned. 
[I 2026-03-18 17:11:48,492] Trial 10 pruned. 
[I 2026-03-18 17:11:50,772] Trial 36 finished with value: -0.45210743245694657 and parameters: {'n_layers_yyx': 2, 'hidden_size_yyx_l0': 3, 'hidden_size_yyx_l1': 5, 'context_size_yyx': 1, 'num_mix_components_yyx': 5, 'context_extractor_yyx': 'lstm', 'activation_func_yyx': 'Tanh', 'L2_weight_yyx': 2.0448271399716577e-10, 'L_entropy_weight_yyx': 6.798442185814492e-07, 'L_sep_weight_yyx': 1.2026310808415995e-05, 'L_scale_weight_yyx': 4.184398138115807e-08, 'learning_rate_yyx': 0.008204661103187197}. Best is trial 36 with value: -0.45210743245694657.
[I 2026-03-18 17:11:54,482] Trial 14 pruned. 
[I 2026-03-18 17:12:02,358] Trial 12 pruned. 
[I 2026-03-18 17:12:06,113] Trial 20 pruned. 
[I 2026-03-18 17:12:08,039] Trial 19 finished with value: -0.3568389939818958 and parameters: {'n_layers_yyx': 1, 'hidden_size_yyx_l0': 3, 'context_size_yyx': 2, 'num_mix_components_yyx': 3, 'context_extractor_yyx': 'gru', 'activation_func_yyx': 'ReLU', 'L2_weight_yyx': 4.412465292681855e-06, 'L_entropy_weight_yyx': 1.0173735356896122e-10, 'L_sep_weight_yyx': 3.0136838762383387e-10, 'L_scale_weight_yyx': 3.4626917868760235e-05, 'learning_rate_yyx': 0.0034524751115392154}. Best is trial 12 with value: -0.46022137621238873.
[I 2026-03-18 17:12:11,938] Trial 15 pruned. 
[I 2026-03-18 17:12:14,299] Trial 30 pruned. 
[I 2026-03-18 17:12:19,896] Trial 7 finished with value: -2.9225441398370524 and parameters: {'n_layers_yyx': 1, 'hidden_size_yyx_l0': 6, 'context_size_yyx': 3, 'num_mix_components_yyx': 5, 'context_extractor_yyx': 'gru', 'activation_func_yyx': 'Tanh', 'L2_weight_yyx': 1.1461394827893237e-05, 'L_entropy_weight_yyx': 4.0275067663230347e-07, 'L_sep_weight_yyx': 2.0574546050837923e-08, 'L_scale_weight_yyx': 0.0008851728507144226, 'learning_rate_yyx': 0.0006510354245062442}. Best is trial 2 with value: -2.9414705477515914.
[I 2026-03-18 17:12:25,045] Trial 13 pruned. 
[I 2026-03-18 17:12:27,242] Trial 4 finished with value: -2.961367919552152 and parameters: {'n_layers_yyx': 1, 'hidden_size_yyx_l0': 6, 'context_size_yyx': 4, 'num_mix_components_yyx': 3, 'context_extractor_yyx': 'gru', 'activation_func_yyx': 'GELU', 'L2_weight_yyx': 0.0006388922890674039, 'L_entropy_weight_yyx': 1.133177904984534e-09, 'L_sep_weight_yyx': 1.9133423063673848e-08, 'L_scale_weight_yyx': 3.792866817715891e-07, 'learning_rate_yyx': 0.008973050241785494}. Best is trial 4 with value: -2.961367919552152.
[I 2026-03-18 17:12:30,432] Trial 16 pruned. 
[I 2026-03-18 17:12:31,131] Trial 31 pruned. 
[I 2026-03-18 17:12:31,800] Trial 33 pruned. 
[I 2026-03-18 17:12:34,478] Trial 20 finished with value: -0.5587496121287182 and parameters: {'n_layers_yyx': 2, 'hidden_size_yyx_l0': 4, 'hidden_size_yyx_l1': 2, 'context_size_yyx': 1, 'num_mix_components_yyx': 3, 'context_extractor_yyx': 'gru', 'activation_func_yyx': 'ReLU', 'L2_weight_yyx': 6.224484323098506e-10, 'L_entropy_weight_yyx': 1.4780030788235864e-08, 'L_sep_weight_yyx': 7.760491129582595e-10, 'L_scale_weight_yyx': 3.478436464743355e-10, 'learning_rate_yyx': 0.0007813773294151752}. Best is trial 1 with value: -0.5777964847779832.
[I 2026-03-18 17:12:37,630] Trial 24 pruned. 
[I 2026-03-18 17:12:40,234] Trial 13 finished with value: -2.943676616228174 and parameters: {'n_layers_yyx': 2, 'hidden_size_yyx_l0': 6, 'hidden_size_yyx_l1': 4, 'context_size_yyx': 3, 'num_mix_components_yyx': 5, 'context_extractor_yyx': 'gru', 'activation_func_yyx': 'ReLU', 'L2_weight_yyx': 2.8856936165750394e-09, 'L_entropy_weight_yyx': 1.2529436025928239e-08, 'L_sep_weight_yyx': 4.295525042862529e-09, 'L_scale_weight_yyx': 6.682665726665178e-08, 'learning_rate_yyx': 0.009444679481744302}. Best is trial 12 with value: -2.9595510816550052.
[I 2026-03-18 17:12:42,141] Trial 21 pruned. 
[I 2026-03-18 17:12:45,311] Trial 9 finished with value: -2.8957740525915594 and parameters: {'n_layers_yyx': 1, 'hidden_size_yyx_l0': 5, 'context_size_yyx': 1, 'num_mix_components_yyx': 2, 'context_extractor_yyx': 'gru', 'activation_func_yyx': 'GELU', 'L2_weight_yyx': 5.985924389199985e-06, 'L_entropy_weight_yyx': 2.5984006668045625e-07, 'L_sep_weight_yyx': 1.2369237342508942e-10, 'L_scale_weight_yyx': 2.427866853908239e-09, 'learning_rate_yyx': 0.0032523634021723938}. Best is trial 0 with value: -2.9702180140077377.
[I 2026-03-18 17:12:49,351] Trial 5 pruned. 
[I 2026-03-18 17:12:49,433] Trial 14 pruned. 
[I 2026-03-18 17:12:52,161] Trial 43 finished with value: -0.5573887044494713 and parameters: {'n_layers_yyx': 1, 'hidden_size_yyx_l0': 6, 'context_size_yyx': 3, 'num_mix_components_yyx': 2, 'context_extractor_yyx': 'gru', 'activation_func_yyx': 'Tanh', 'L2_weight_yyx': 1.0389839522951375e-10, 'L_entropy_weight_yyx': 0.0006767659685095446, 'L_sep_weight_yyx': 1.0283702420349935e-06, 'L_scale_weight_yyx': 3.9096775765617325e-08, 'learning_rate_yyx': 0.007188636452234875}. Best is trial 0 with value: -0.5660314966592697.
[I 2026-03-18 17:12:52,362] Trial 8 finished with value: -2.9481354221686584 and parameters: {'n_layers_yyx': 1, 'hidden_size_yyx_l0': 3, 'context_size_yyx': 4, 'num_mix_components_yyx': 2, 'context_extractor_yyx': 'lstm', 'activation_func_yyx': 'ReLU', 'L2_weight_yyx': 1.2776702282251347e-09, 'L_entropy_weight_yyx': 2.9740075885968575e-08, 'L_sep_weight_yyx': 9.785903567125114e-07, 'L_scale_weight_yyx': 1.2818064939085973e-06, 'learning_rate_yyx': 0.0016884988802012856}. Best is trial 1 with value: -2.9497769660834225.
[I 2026-03-18 17:12:53,472] Trial 18 finished with value: -0.567581743452867 and parameters: {'n_layers_yyx': 1, 'hidden_size_yyx_l0': 2, 'context_size_yyx': 4, 'num_mix_components_yyx': 5, 'context_extractor_yyx': 'lstm', 'activation_func_yyx': 'ReLU', 'L2_weight_yyx': 8.913351306460996e-10, 'L_entropy_weight_yyx': 0.00022039572861236838, 'L_sep_weight_yyx': 0.00010721947517092758, 'L_scale_weight_yyx': 0.0009047617114420709, 'learning_rate_yyx': 0.006935073446574075}. Best is trial 17 with value: -0.5864613361174992.
[I 2026-03-18 17:12:58,864] Trial 4 finished with value: -2.8081357984522426 and parameters: {'n_layers_yyx': 2, 'hidden_size_yyx_l0': 2, 'hidden_size_yyx_l1': 6, 'context_size_yyx': 3, 'num_mix_components_yyx': 1, 'context_extractor_yyx': 'gru', 'activation_func_yyx': 'ReLU', 'L2_weight_yyx': 0.0004747222814162962, 'L_entropy_weight_yyx': 7.359336360162046e-10, 'L_sep_weight_yyx': 9.809941048698932e-06, 'L_scale_weight_yyx': 1.7103993416720534e-07, 'learning_rate_yyx': 0.006655650570160318}. Best is trial 1 with value: -2.875781089897074.
[I 2026-03-18 17:13:04,127] Trial 8 pruned. 
[I 2026-03-18 17:13:04,499] Trial 32 pruned. 
[I 2026-03-18 17:13:05,121] Trial 17 pruned. 
[I 2026-03-18 17:13:05,939] Trial 37 pruned. 
[I 2026-03-18 17:13:07,650] Trial 10 pruned. 
[I 2026-03-18 17:13:11,501] Trial 19 pruned. 
[I 2026-03-18 17:13:11,889] Trial 25 pruned. 
[I 2026-03-18 17:13:19,919] Trial 5 pruned. 
[I 2026-03-18 17:13:21,549] Trial 33 pruned. 
[I 2026-03-18 17:13:22,447] Trial 38 pruned. 
[I 2026-03-18 17:13:23,089] Trial 14 pruned. 
[I 2026-03-18 17:13:23,399] Trial 20 pruned. 
[I 2026-03-18 17:13:23,949] Trial 44 pruned. 
[I 2026-03-18 17:13:24,071] Trial 9 pruned. 
[I 2026-03-18 17:13:27,439] Trial 30 finished with value: -0.5741291282265517 and parameters: {'n_layers_yyx': 1, 'hidden_size_yyx_l0': 5, 'context_size_yyx': 4, 'num_mix_components_yyx': 4, 'context_extractor_yyx': 'lstm', 'activation_func_yyx': 'ReLU', 'L2_weight_yyx': 3.5338171694520426e-07, 'L_entropy_weight_yyx': 8.888363919410446e-08, 'L_sep_weight_yyx': 4.478294741354531e-08, 'L_scale_weight_yyx': 1.1101055298208873e-07, 'learning_rate_yyx': 0.009925440331089741}. Best is trial 15 with value: -0.5782953233469631.
[I 2026-03-18 17:13:34,648] Trial 15 pruned. 
[I 2026-03-18 17:13:37,325] Trial 18 pruned. 
[I 2026-03-18 17:13:45,325] Trial 22 finished with value: -0.5821973965945237 and parameters: {'n_layers_yyx': 2, 'hidden_size_yyx_l0': 3, 'hidden_size_yyx_l1': 6, 'context_size_yyx': 4, 'num_mix_components_yyx': 4, 'context_extractor_yyx': 'gru', 'activation_func_yyx': 'ReLU', 'L2_weight_yyx': 1.2434552931628954e-06, 'L_entropy_weight_yyx': 8.069284259630872e-09, 'L_sep_weight_yyx': 2.6014495172930044e-08, 'L_scale_weight_yyx': 2.6925608667557952e-05, 'learning_rate_yyx': 0.007341957104189236}. Best is trial 22 with value: -0.5821973965945237.
[I 2026-03-18 17:13:45,387] Trial 31 pruned. 
[I 2026-03-18 17:13:54,245] Trial 34 pruned. 
[I 2026-03-18 17:13:55,235] Trial 13 finished with value: -0.5746682860992306 and parameters: {'n_layers_yyx': 1, 'hidden_size_yyx_l0': 6, 'context_size_yyx': 3, 'num_mix_components_yyx': 4, 'context_extractor_yyx': 'gru', 'activation_func_yyx': 'GELU', 'L2_weight_yyx': 4.4751912779593475e-08, 'L_entropy_weight_yyx': 0.0009398485582517812, 'L_sep_weight_yyx': 3.2310910328944975e-07, 'L_scale_weight_yyx': 4.8599051482629246e-08, 'learning_rate_yyx': 0.003797477414657627}. Best is trial 13 with value: -0.5746682860992306.
[I 2026-03-18 17:13:57,797] Trial 45 pruned. 
[I 2026-03-18 17:13:58,334] Trial 21 finished with value: -0.5709547963726144 and parameters: {'n_layers_yyx': 1, 'hidden_size_yyx_l0': 6, 'context_size_yyx': 3, 'num_mix_components_yyx': 5, 'context_extractor_yyx': 'gru', 'activation_func_yyx': 'GELU', 'L2_weight_yyx': 3.7113935515383444e-09, 'L_entropy_weight_yyx': 1.5158886283527433e-10, 'L_sep_weight_yyx': 2.985068632402288e-06, 'L_scale_weight_yyx': 2.838956265547066e-09, 'learning_rate_yyx': 0.009290254376288404}. Best is trial 1 with value: -0.5777964847779832.
[I 2026-03-18 17:14:01,696] Trial 6 pruned. 
[I 2026-03-18 17:14:01,696] Trial 32 pruned. 
[I 2026-03-18 17:14:03,635] Trial 22 pruned. 
[I 2026-03-18 17:14:05,231] Trial 15 pruned. 
[I 2026-03-18 17:14:10,955] Trial 19 pruned. 
[I 2026-03-18 17:14:15,991] Trial 16 pruned. 
[I 2026-03-18 17:14:16,178] Trial 46 pruned. 
[I 2026-03-18 17:14:19,543] Trial 23 pruned. 
[I 2026-03-18 17:14:20,036] Trial 33 pruned. 
[I 2026-03-18 17:14:23,049] Trial 7 pruned. 
[I 2026-03-18 17:14:31,548] Trial 22 pruned. 
[I 2026-03-18 17:14:32,533] Trial 19 finished with value: -0.5765580671853507 and parameters: {'n_layers_yyx': 2, 'hidden_size_yyx_l0': 5, 'hidden_size_yyx_l1': 4, 'context_size_yyx': 4, 'num_mix_components_yyx': 2, 'context_extractor_yyx': 'lstm', 'activation_func_yyx': 'Tanh', 'L2_weight_yyx': 3.632058774605969e-07, 'L_entropy_weight_yyx': 2.1973464784993754e-06, 'L_sep_weight_yyx': 1.2737972148098906e-06, 'L_scale_weight_yyx': 5.401624909327472e-09, 'learning_rate_yyx': 0.005735039040885174}. Best is trial 19 with value: -0.5765580671853507.
[I 2026-03-18 17:14:34,439] Trial 26 pruned. 
[I 2026-03-18 17:14:44,083] Trial 20 finished with value: -0.573890318732806 and parameters: {'n_layers_yyx': 1, 'hidden_size_yyx_l0': 4, 'context_size_yyx': 4, 'num_mix_components_yyx': 5, 'context_extractor_yyx': 'gru', 'activation_func_yyx': 'ReLU', 'L2_weight_yyx': 2.8767029441068464e-06, 'L_entropy_weight_yyx': 5.332494100493267e-09, 'L_sep_weight_yyx': 1.1765791234448475e-05, 'L_scale_weight_yyx': 0.00013280250286361515, 'learning_rate_yyx': 0.009941229557949547}. Best is trial 17 with value: -0.5864613361174992.
[I 2026-03-18 17:14:47,224] Trial 16 pruned. 
[I 2026-03-18 17:14:50,835] Trial 20 pruned. 
[I 2026-03-18 17:14:52,650] Trial 24 pruned. 
[I 2026-03-18 17:14:55,123] Trial 17 pruned. 
[I 2026-03-18 17:14:57,469] Trial 15 finished with value: -2.9509930170610343 and parameters: {'n_layers_yyx': 1, 'hidden_size_yyx_l0': 5, 'context_size_yyx': 3, 'num_mix_components_yyx': 5, 'context_extractor_yyx': 'gru', 'activation_func_yyx': 'ReLU', 'L2_weight_yyx': 1.2568529237631699e-08, 'L_entropy_weight_yyx': 0.00017071392924480016, 'L_sep_weight_yyx': 9.776191185110757e-10, 'L_scale_weight_yyx': 1.824368253681913e-09, 'learning_rate_yyx': 0.006244770551177317}. Best is trial 15 with value: -2.9509930170610343.
[I 2026-03-18 17:15:01,855] Trial 21 pruned. 
[I 2026-03-18 17:15:02,961] Trial 23 pruned. 
[I 2026-03-18 17:15:03,738] Trial 34 finished with value: -0.5695323917855915 and parameters: {'n_layers_yyx': 2, 'hidden_size_yyx_l0': 3, 'hidden_size_yyx_l1': 2, 'context_size_yyx': 4, 'num_mix_components_yyx': 4, 'context_extractor_yyx': 'lstm', 'activation_func_yyx': 'Tanh', 'L2_weight_yyx': 5.70771616814667e-06, 'L_entropy_weight_yyx': 2.7981943292751583e-05, 'L_sep_weight_yyx': 0.0002304191270350342, 'L_scale_weight_yyx': 1.4406979937510843e-09, 'learning_rate_yyx': 0.0033786313603972585}. Best is trial 3 with value: -0.5836324153936877.
[I 2026-03-18 17:15:09,859] Trial 35 pruned. 
[I 2026-03-18 17:15:13,617] Trial 21 finished with value: -0.4343365648582624 and parameters: {'n_layers_yyx': 2, 'hidden_size_yyx_l0': 4, 'hidden_size_yyx_l1': 3, 'context_size_yyx': 3, 'num_mix_components_yyx': 4, 'context_extractor_yyx': 'gru', 'activation_func_yyx': 'Tanh', 'L2_weight_yyx': 1.311647229334646e-07, 'L_entropy_weight_yyx': 5.5819978170753445e-06, 'L_sep_weight_yyx': 0.00011996170113181862, 'L_scale_weight_yyx': 1.2594264095670329e-05, 'learning_rate_yyx': 0.007023055677543144}. Best is trial 12 with value: -0.46022137621238873.
[I 2026-03-18 17:15:17,468] Trial 22 pruned. 
[I 2026-03-18 17:15:19,656] Trial 24 pruned. 
[I 2026-03-18 17:15:22,588] Trial 21 pruned. 
[I 2026-03-18 17:15:22,740] Trial 23 pruned. 
[I 2026-03-18 17:15:23,739] Trial 39 finished with value: -0.47300654077677534 and parameters: {'n_layers_yyx': 2, 'hidden_size_yyx_l0': 2, 'hidden_size_yyx_l1': 6, 'context_size_yyx': 1, 'num_mix_components_yyx': 5, 'context_extractor_yyx': 'lstm', 'activation_func_yyx': 'Tanh', 'L2_weight_yyx': 1.3243357442601103e-06, 'L_entropy_weight_yyx': 4.097019412472834e-06, 'L_sep_weight_yyx': 7.275838451276067e-05, 'L_scale_weight_yyx': 7.43332492589108e-05, 'learning_rate_yyx': 0.006274847125556654}. Best is trial 39 with value: -0.47300654077677534.
[I 2026-03-18 17:15:25,307] Trial 25 pruned. 
[I 2026-03-18 17:15:25,535] Trial 36 pruned. 
[I 2026-03-18 17:15:28,619] Trial 20 pruned. 
[I 2026-03-18 17:15:29,524] Trial 14 finished with value: -0.5673958884636671 and parameters: {'n_layers_yyx': 1, 'hidden_size_yyx_l0': 6, 'context_size_yyx': 4, 'num_mix_components_yyx': 4, 'context_extractor_yyx': 'gru', 'activation_func_yyx': 'GELU', 'L2_weight_yyx': 6.328277847980265e-09, 'L_entropy_weight_yyx': 0.0005128495011861502, 'L_sep_weight_yyx': 1.4304858117779021e-05, 'L_scale_weight_yyx': 2.9329499701280478e-06, 'learning_rate_yyx': 0.009939038017593282}. Best is trial 13 with value: -0.5746682860992306.
[I 2026-03-18 17:15:30,667] Trial 47 pruned. 
[I 2026-03-18 17:15:31,939] Trial 6 finished with value: -2.94782599113953 and parameters: {'n_layers_yyx': 1, 'hidden_size_yyx_l0': 4, 'context_size_yyx': 3, 'num_mix_components_yyx': 3, 'context_extractor_yyx': 'gru', 'activation_func_yyx': 'ReLU', 'L2_weight_yyx': 1.1278746076457821e-10, 'L_entropy_weight_yyx': 6.919308386578055e-06, 'L_sep_weight_yyx': 4.915974904870958e-08, 'L_scale_weight_yyx': 0.00039785505437147745, 'learning_rate_yyx': 0.0032867071574691053}. Best is trial 0 with value: -2.957957273051406.
[I 2026-03-18 17:15:33,575] Trial 25 pruned. 
