[I 2026-03-18 18:10:03,763] Trial 13 finished with value: -1.2383664002480217 and parameters: {'n_layers_yyx': 1, 'hidden_size_yyx_l0': 5, 'context_size_yyx': 4, 'num_mix_components_yyx': 2, 'context_extractor_yyx': 'lstm', 'activation_func_yyx': 'Tanh', 'L2_weight_yyx': 4.80538417335755e-07, 'L_entropy_weight_yyx': 9.897398289929572e-10, 'L_sep_weight_yyx': 3.102578791245932e-08, 'L_scale_weight_yyx': 1.332822389849528e-07, 'learning_rate_yyx': 0.004679801256792257}. Best is trial 2 with value: -1.266387742019625.
[I 2026-03-18 18:10:10,507] Trial 10 pruned. 
[I 2026-03-18 18:10:25,482] Trial 14 pruned. 
[I 2026-03-18 18:10:29,946] Trial 14 pruned. 
[I 2026-03-18 18:10:30,412] Trial 14 pruned. 
[I 2026-03-18 18:10:36,100] Trial 10 finished with value: -1.6603244362942178 and parameters: {'n_layers_yyx': 1, 'hidden_size_yyx_l0': 3, 'context_size_yyx': 3, 'num_mix_components_yyx': 3, 'context_extractor_yyx': 'gru', 'activation_func_yyx': 'Tanh', 'L2_weight_yyx': 0.0009703842191016478, 'L_entropy_weight_yyx': 1.8611546388918607e-10, 'L_sep_weight_yyx': 5.2150353190757865e-06, 'L_scale_weight_yyx': 5.589169948536947e-09, 'learning_rate_yyx': 0.008259587655486116}. Best is trial 2 with value: -1.6799626520210098.
[I 2026-03-18 18:10:36,646] Trial 29 finished with value: -1.258411456829078 and parameters: {'n_layers_yyx': 1, 'hidden_size_yyx_l0': 6, 'context_size_yyx': 3, 'num_mix_components_yyx': 2, 'context_extractor_yyx': 'lstm', 'activation_func_yyx': 'Tanh', 'L2_weight_yyx': 3.87775326883802e-08, 'L_entropy_weight_yyx': 1.0690250303733069e-07, 'L_sep_weight_yyx': 0.0001604099653127044, 'L_scale_weight_yyx': 7.712551913588358e-06, 'learning_rate_yyx': 0.0033563327274572317}. Best is trial 28 with value: -1.2590248897644156.
[I 2026-03-18 18:10:37,548] Trial 18 pruned. 
[I 2026-03-18 18:10:38,038] Trial 19 pruned. 
[I 2026-03-18 18:10:38,806] Trial 15 pruned. 
[I 2026-03-18 18:10:44,770] Trial 11 finished with value: -1.2542082668452519 and parameters: {'n_layers_yyx': 2, 'hidden_size_yyx_l0': 6, 'hidden_size_yyx_l1': 6, 'context_size_yyx': 3, 'num_mix_components_yyx': 5, 'context_extractor_yyx': 'lstm', 'activation_func_yyx': 'ReLU', 'L2_weight_yyx': 1.7546996809544232e-08, 'L_entropy_weight_yyx': 1.833427428583883e-05, 'L_sep_weight_yyx': 1.187450965312767e-10, 'L_scale_weight_yyx': 1.5219073073554318e-07, 'learning_rate_yyx': 0.008748947280160256}. Best is trial 5 with value: -1.2714442113851663.
[I 2026-03-18 18:10:48,169] Trial 19 pruned. 
[I 2026-03-18 18:10:49,330] Trial 13 finished with value: -1.6291208267211914 and parameters: {'n_layers_yyx': 1, 'hidden_size_yyx_l0': 2, 'context_size_yyx': 4, 'num_mix_components_yyx': 3, 'context_extractor_yyx': 'lstm', 'activation_func_yyx': 'Tanh', 'L2_weight_yyx': 6.563231692897664e-09, 'L_entropy_weight_yyx': 8.647952293474808e-08, 'L_sep_weight_yyx': 1.0044954118785436e-08, 'L_scale_weight_yyx': 5.6992275750305876e-05, 'learning_rate_yyx': 0.0007618430768829771}. Best is trial 0 with value: -1.6683178048964529.
[I 2026-03-18 18:10:57,063] Trial 11 pruned. 
[I 2026-03-18 18:10:58,578] Trial 30 pruned. 
[I 2026-03-18 18:11:01,464] Trial 15 pruned. 
[I 2026-03-18 18:11:03,347] Trial 16 pruned. 
[I 2026-03-18 18:11:04,630] Trial 20 pruned. 
[I 2026-03-18 18:11:06,058] Trial 6 finished with value: -1.659940621649572 and parameters: {'n_layers_yyx': 2, 'hidden_size_yyx_l0': 6, 'hidden_size_yyx_l1': 2, 'context_size_yyx': 1, 'num_mix_components_yyx': 3, 'context_extractor_yyx': 'gru', 'activation_func_yyx': 'Tanh', 'L2_weight_yyx': 1.8534905422633548e-05, 'L_entropy_weight_yyx': 8.00330689811896e-08, 'L_sep_weight_yyx': 3.62931865382568e-06, 'L_scale_weight_yyx': 1.1716133159708267e-05, 'learning_rate_yyx': 0.00812225555973396}. Best is trial 2 with value: -1.666246732076009.
[I 2026-03-18 18:11:08,988] Trial 18 pruned. 
[I 2026-03-18 18:11:10,093] Trial 18 pruned. 
[I 2026-03-18 18:11:12,574] Trial 16 pruned. 
[I 2026-03-18 18:11:17,600] Trial 17 pruned. 
[I 2026-03-18 18:11:25,508] Trial 9 finished with value: -2.6351331388383397 and parameters: {'n_layers_yyx': 1, 'hidden_size_yyx_l0': 3, 'context_size_yyx': 4, 'num_mix_components_yyx': 4, 'context_extractor_yyx': 'lstm', 'activation_func_yyx': 'ReLU', 'L2_weight_yyx': 0.0001942769300288291, 'L_entropy_weight_yyx': 2.243055628243076e-07, 'L_sep_weight_yyx': 7.711584232638838e-07, 'L_scale_weight_yyx': 1.8152816364696422e-10, 'learning_rate_yyx': 0.004542905460744361}. Best is trial 9 with value: -2.6351331388383397.
[I 2026-03-18 18:11:26,482] Trial 7 pruned. 
[I 2026-03-18 18:11:27,914] Trial 21 pruned. 
[I 2026-03-18 18:11:35,399] Trial 19 pruned. 
[I 2026-03-18 18:11:35,716] Trial 19 pruned. 
[I 2026-03-18 18:11:37,175] Trial 13 finished with value: -1.6606605940994101 and parameters: {'n_layers_yyx': 2, 'hidden_size_yyx_l0': 5, 'hidden_size_yyx_l1': 5, 'context_size_yyx': 3, 'num_mix_components_yyx': 5, 'context_extractor_yyx': 'lstm', 'activation_func_yyx': 'Tanh', 'L2_weight_yyx': 0.0009114685876429081, 'L_entropy_weight_yyx': 5.569040311394287e-08, 'L_sep_weight_yyx': 7.300671326303935e-07, 'L_scale_weight_yyx': 2.3361434409395764e-06, 'learning_rate_yyx': 0.008972532688312966}. Best is trial 2 with value: -1.6777834079951708.
[I 2026-03-18 18:11:45,053] Trial 17 pruned. 
[I 2026-03-18 18:11:51,594] Trial 18 pruned. 
[I 2026-03-18 18:11:52,848] Trial 20 pruned. 
[I 2026-03-18 18:11:53,721] Trial 8 finished with value: -1.5955879975099536 and parameters: {'n_layers_yyx': 1, 'hidden_size_yyx_l0': 4, 'context_size_yyx': 1, 'num_mix_components_yyx': 1, 'context_extractor_yyx': 'lstm', 'activation_func_yyx': 'GELU', 'L2_weight_yyx': 5.048572437902712e-06, 'L_entropy_weight_yyx': 6.213586938200911e-09, 'L_sep_weight_yyx': 3.1600315548174166e-07, 'L_scale_weight_yyx': 3.597037814119895e-08, 'learning_rate_yyx': 0.005200832059378224}. Best is trial 5 with value: -1.6649868297852268.
[I 2026-03-18 18:11:58,674] Trial 14 pruned. 
[I 2026-03-18 18:12:01,973] Trial 19 pruned. 
[I 2026-03-18 18:12:01,978] Trial 20 finished with value: -2.635415358426911 and parameters: {'n_layers_yyx': 2, 'hidden_size_yyx_l0': 4, 'hidden_size_yyx_l1': 6, 'context_size_yyx': 3, 'num_mix_components_yyx': 4, 'context_extractor_yyx': 'lstm', 'activation_func_yyx': 'GELU', 'L2_weight_yyx': 7.506653407722599e-06, 'L_entropy_weight_yyx': 1.0123851443989135e-10, 'L_sep_weight_yyx': 1.0640317501739189e-09, 'L_scale_weight_yyx': 2.835119262232645e-07, 'learning_rate_yyx': 0.009847052701634997}. Best is trial 20 with value: -2.635415358426911.
[I 2026-03-18 18:12:10,334] Trial 20 pruned. 
[I 2026-03-18 18:12:10,418] Trial 15 pruned. 
[I 2026-03-18 18:12:11,263] Trial 11 finished with value: -1.6540260565663962 and parameters: {'n_layers_yyx': 2, 'hidden_size_yyx_l0': 4, 'hidden_size_yyx_l1': 6, 'context_size_yyx': 1, 'num_mix_components_yyx': 4, 'context_extractor_yyx': 'gru', 'activation_func_yyx': 'ReLU', 'L2_weight_yyx': 0.0009551858790155362, 'L_entropy_weight_yyx': 0.0003418978626330102, 'L_sep_weight_yyx': 1.5998532820627747e-10, 'L_scale_weight_yyx': 4.765948136108562e-08, 'learning_rate_yyx': 0.009723882525482012}. Best is trial 7 with value: -1.6637274000173419.
[I 2026-03-18 18:12:12,128] Trial 18 pruned. 
[I 2026-03-18 18:12:15,431] Trial 22 pruned. 
[I 2026-03-18 18:12:16,082] Trial 31 pruned. 
[I 2026-03-18 18:12:16,555] Trial 9 pruned. 
[I 2026-03-18 18:12:20,164] Trial 12 finished with value: -1.6607000150854938 and parameters: {'n_layers_yyx': 2, 'hidden_size_yyx_l0': 4, 'hidden_size_yyx_l1': 6, 'context_size_yyx': 1, 'num_mix_components_yyx': 5, 'context_extractor_yyx': 'gru', 'activation_func_yyx': 'GELU', 'L2_weight_yyx': 2.3630239230353076e-05, 'L_entropy_weight_yyx': 1.1743961040938477e-10, 'L_sep_weight_yyx': 7.07836021737196e-08, 'L_scale_weight_yyx': 2.7044032395198617e-06, 'learning_rate_yyx': 0.009371359399480724}. Best is trial 11 with value: -1.6659153643654905.
[I 2026-03-18 18:12:26,659] Trial 10 finished with value: -1.6775257690694036 and parameters: {'n_layers_yyx': 2, 'hidden_size_yyx_l0': 2, 'hidden_size_yyx_l1': 4, 'context_size_yyx': 4, 'num_mix_components_yyx': 2, 'context_extractor_yyx': 'gru', 'activation_func_yyx': 'Tanh', 'L2_weight_yyx': 1.6445567545897896e-08, 'L_entropy_weight_yyx': 1.6213687167847304e-06, 'L_sep_weight_yyx': 5.345863528237693e-10, 'L_scale_weight_yyx': 1.3683729479779812e-05, 'learning_rate_yyx': 0.009808124791968202}. Best is trial 2 with value: -1.6820484414711034.
[I 2026-03-18 18:12:28,055] Trial 7 finished with value: -1.645046760074443 and parameters: {'n_layers_yyx': 2, 'hidden_size_yyx_l0': 4, 'hidden_size_yyx_l1': 2, 'context_size_yyx': 3, 'num_mix_components_yyx': 5, 'context_extractor_yyx': 'gru', 'activation_func_yyx': 'Tanh', 'L2_weight_yyx': 0.00043385436708459656, 'L_entropy_weight_yyx': 3.6872671370262466e-05, 'L_sep_weight_yyx': 1.4046848849249934e-09, 'L_scale_weight_yyx': 1.2931607222439719e-09, 'learning_rate_yyx': 0.0005680217158228097}. Best is trial 1 with value: -1.671168294287967.
[I 2026-03-18 18:12:30,837] Trial 19 pruned. 
[I 2026-03-18 18:12:30,841] Trial 15 finished with value: -2.643670173289397 and parameters: {'n_layers_yyx': 2, 'hidden_size_yyx_l0': 3, 'hidden_size_yyx_l1': 5, 'context_size_yyx': 4, 'num_mix_components_yyx': 3, 'context_extractor_yyx': 'gru', 'activation_func_yyx': 'ReLU', 'L2_weight_yyx': 0.00042224942782605055, 'L_entropy_weight_yyx': 4.515064404201409e-06, 'L_sep_weight_yyx': 1.204867510300896e-10, 'L_scale_weight_yyx': 3.081505979551161e-08, 'learning_rate_yyx': 0.001170817410993861}. Best is trial 10 with value: -2.6537577311197915.
[I 2026-03-18 18:12:34,090] Trial 13 pruned. 
[I 2026-03-18 18:12:34,585] Trial 16 pruned. 
[I 2026-03-18 18:12:40,737] Trial 32 pruned. 
[I 2026-03-18 18:12:42,552] Trial 21 pruned. 
[I 2026-03-18 18:12:44,525] Trial 11 finished with value: -1.6666733867509418 and parameters: {'n_layers_yyx': 1, 'hidden_size_yyx_l0': 3, 'context_size_yyx': 4, 'num_mix_components_yyx': 2, 'context_extractor_yyx': 'lstm', 'activation_func_yyx': 'Tanh', 'L2_weight_yyx': 1.2129992540609803e-10, 'L_entropy_weight_yyx': 2.4744393995935867e-07, 'L_sep_weight_yyx': 2.214458504702773e-09, 'L_scale_weight_yyx': 0.0006796875929675408, 'learning_rate_yyx': 0.00933074565562932}. Best is trial 9 with value: -1.6671910822907816.
[I 2026-03-18 18:12:54,358] Trial 13 pruned. 
[I 2026-03-18 18:12:57,189] Trial 11 finished with value: -1.6692650770200228 and parameters: {'n_layers_yyx': 2, 'hidden_size_yyx_l0': 5, 'hidden_size_yyx_l1': 4, 'context_size_yyx': 1, 'num_mix_components_yyx': 5, 'context_extractor_yyx': 'lstm', 'activation_func_yyx': 'Tanh', 'L2_weight_yyx': 1.896260679076643e-10, 'L_entropy_weight_yyx': 9.176464749162763e-09, 'L_sep_weight_yyx': 1.3336388611103786e-08, 'L_scale_weight_yyx': 1.2311576803419352e-08, 'learning_rate_yyx': 0.00757204790072991}. Best is trial 0 with value: -1.6746319320135328.
[I 2026-03-18 18:12:58,582] Trial 8 pruned. 
[I 2026-03-18 18:12:59,797] Trial 20 pruned. 
[I 2026-03-18 18:13:03,029] Trial 20 pruned. 
[I 2026-03-18 18:13:08,057] Trial 14 pruned. 
[I 2026-03-18 18:13:11,254] Trial 16 pruned. 
[I 2026-03-18 18:13:14,055] Trial 15 pruned. 
[I 2026-03-18 18:13:15,612] Trial 12 pruned. 
[I 2026-03-18 18:13:29,281] Trial 20 pruned. 
[I 2026-03-18 18:13:36,886] Trial 21 pruned. 
[I 2026-03-18 18:13:37,378] Trial 9 pruned. 
[I 2026-03-18 18:13:40,914] Trial 33 pruned. 
[I 2026-03-18 18:13:40,914] Trial 17 pruned. 
[I 2026-03-18 18:13:47,020] Trial 12 finished with value: -1.2614250958737074 and parameters: {'n_layers_yyx': 2, 'hidden_size_yyx_l0': 5, 'hidden_size_yyx_l1': 6, 'context_size_yyx': 3, 'num_mix_components_yyx': 5, 'context_extractor_yyx': 'lstm', 'activation_func_yyx': 'ReLU', 'L2_weight_yyx': 1.2965404602378447e-05, 'L_entropy_weight_yyx': 1.0382546707668843e-05, 'L_sep_weight_yyx': 1.7798042860083234e-10, 'L_scale_weight_yyx': 5.803757546014173e-07, 'learning_rate_yyx': 0.009102698924263608}. Best is trial 5 with value: -1.2714442113851663.
[I 2026-03-18 18:14:04,606] Trial 22 pruned. 
[I 2026-03-18 18:14:06,691] Trial 13 finished with value: -2.629292374950344 and parameters: {'n_layers_yyx': 2, 'hidden_size_yyx_l0': 2, 'hidden_size_yyx_l1': 3, 'context_size_yyx': 4, 'num_mix_components_yyx': 4, 'context_extractor_yyx': 'lstm', 'activation_func_yyx': 'GELU', 'L2_weight_yyx': 6.03938422724353e-08, 'L_entropy_weight_yyx': 1.0535870920497685e-10, 'L_sep_weight_yyx': 3.961977022996251e-09, 'L_scale_weight_yyx': 4.268974948553974e-09, 'learning_rate_yyx': 0.0023166230301355515}. Best is trial 11 with value: -2.635494617718387.
[I 2026-03-18 18:14:13,984] Trial 22 pruned. 
[I 2026-03-18 18:14:15,673] Trial 10 finished with value: -1.6605335635790122 and parameters: {'n_layers_yyx': 1, 'hidden_size_yyx_l0': 2, 'context_size_yyx': 4, 'num_mix_components_yyx': 4, 'context_extractor_yyx': 'lstm', 'activation_func_yyx': 'Tanh', 'L2_weight_yyx': 2.8376252505160113e-05, 'L_entropy_weight_yyx': 3.4556421494173916e-09, 'L_sep_weight_yyx': 5.906710782745626e-06, 'L_scale_weight_yyx': 0.0009337348780713205, 'learning_rate_yyx': 0.004074416940886314}. Best is trial 0 with value: -1.6702967433543936.
[I 2026-03-18 18:14:15,991] Trial 21 pruned. 
[I 2026-03-18 18:14:19,107] Trial 9 finished with value: -1.669138929497404 and parameters: {'n_layers_yyx': 2, 'hidden_size_yyx_l0': 5, 'hidden_size_yyx_l1': 2, 'context_size_yyx': 4, 'num_mix_components_yyx': 5, 'context_extractor_yyx': 'gru', 'activation_func_yyx': 'GELU', 'L2_weight_yyx': 3.621102894091572e-05, 'L_entropy_weight_yyx': 1.6374475484336562e-09, 'L_sep_weight_yyx': 1.2382538783882638e-08, 'L_scale_weight_yyx': 0.0004830711072250509, 'learning_rate_yyx': 0.005083687895207808}. Best is trial 2 with value: -1.6720916355195472.
[I 2026-03-18 18:14:22,359] Trial 15 pruned. 
[I 2026-03-18 18:14:26,061] Trial 13 pruned. 
[I 2026-03-18 18:14:26,510] Trial 13 finished with value: -1.6587117647642808 and parameters: {'n_layers_yyx': 1, 'hidden_size_yyx_l0': 5, 'context_size_yyx': 2, 'num_mix_components_yyx': 4, 'context_extractor_yyx': 'gru', 'activation_func_yyx': 'Tanh', 'L2_weight_yyx': 9.050698382413554e-05, 'L_entropy_weight_yyx': 4.002923527041023e-10, 'L_sep_weight_yyx': 1.3041938352265196e-08, 'L_scale_weight_yyx': 1.7063919825806148e-06, 'learning_rate_yyx': 0.005788236330817951}. Best is trial 10 with value: -1.6754296736951282.
[I 2026-03-18 18:14:45,730] Trial 10 pruned. 
[I 2026-03-18 18:14:46,868] Trial 23 pruned. 
[I 2026-03-18 18:14:47,155] Trial 23 pruned. 
[I 2026-03-18 18:14:47,495] Trial 10 finished with value: -2.6301519764852457 and parameters: {'n_layers_yyx': 2, 'hidden_size_yyx_l0': 2, 'hidden_size_yyx_l1': 6, 'context_size_yyx': 3, 'num_mix_components_yyx': 4, 'context_extractor_yyx': 'gru', 'activation_func_yyx': 'ReLU', 'L2_weight_yyx': 3.17732923913334e-08, 'L_entropy_weight_yyx': 1.1416157460274011e-10, 'L_sep_weight_yyx': 0.0004176327614636778, 'L_scale_weight_yyx': 2.894536698719711e-08, 'learning_rate_yyx': 0.00888350295534477}. Best is trial 9 with value: -2.6351331388383397.
[I 2026-03-18 18:14:52,690] Trial 10 pruned. 
[I 2026-03-18 18:14:53,836] Trial 11 pruned. 
[I 2026-03-18 18:14:59,532] Trial 14 pruned. 
[I 2026-03-18 18:15:01,817] Trial 11 finished with value: -2.630621734820482 and parameters: {'n_layers_yyx': 2, 'hidden_size_yyx_l0': 3, 'hidden_size_yyx_l1': 3, 'context_size_yyx': 4, 'num_mix_components_yyx': 5, 'context_extractor_yyx': 'lstm', 'activation_func_yyx': 'ReLU', 'L2_weight_yyx': 0.0003960354128439243, 'L_entropy_weight_yyx': 4.471006524076568e-09, 'L_sep_weight_yyx': 2.9751481884967754e-05, 'L_scale_weight_yyx': 0.0008706517238877817, 'learning_rate_yyx': 0.0026482373120561725}. Best is trial 6 with value: -2.642843521506465.
[I 2026-03-18 18:15:20,751] Trial 24 pruned. 
[I 2026-03-18 18:15:23,818] Trial 22 pruned. 
[I 2026-03-18 18:15:29,841] Trial 14 pruned. 
[I 2026-03-18 18:15:29,844] Trial 12 pruned. 
[I 2026-03-18 18:15:30,912] Trial 16 pruned. 
[I 2026-03-18 18:15:44,035] Trial 12 pruned. 
[I 2026-03-18 18:15:55,844] Trial 19 finished with value: -2.6343980726304945 and parameters: {'n_layers_yyx': 2, 'hidden_size_yyx_l0': 3, 'hidden_size_yyx_l1': 4, 'context_size_yyx': 2, 'num_mix_components_yyx': 4, 'context_extractor_yyx': 'lstm', 'activation_func_yyx': 'Tanh', 'L2_weight_yyx': 4.0673282663092965e-06, 'L_entropy_weight_yyx': 1.6699185714480585e-08, 'L_sep_weight_yyx': 0.0009270288602534539, 'L_scale_weight_yyx': 5.043058354136511e-09, 'learning_rate_yyx': 0.009702773747939146}. Best is trial 14 with value: -2.6415204441902964.
[I 2026-03-18 18:15:59,990] Trial 11 pruned. 
[I 2026-03-18 18:16:08,000] Trial 13 pruned. 
[I 2026-03-18 18:16:09,447] Trial 17 pruned. 
[I 2026-03-18 18:16:11,383] Trial 15 pruned. 
[I 2026-03-18 18:16:22,798] Trial 12 finished with value: -2.6367576393180125 and parameters: {'n_layers_yyx': 1, 'hidden_size_yyx_l0': 4, 'context_size_yyx': 3, 'num_mix_components_yyx': 5, 'context_extractor_yyx': 'gru', 'activation_func_yyx': 'Tanh', 'L2_weight_yyx': 4.890385983382148e-05, 'L_entropy_weight_yyx': 1.5740139905899853e-08, 'L_sep_weight_yyx': 8.290839451226569e-08, 'L_scale_weight_yyx': 1.313913109754938e-09, 'learning_rate_yyx': 0.00927519676322161}. Best is trial 10 with value: -2.640669339569724.
[I 2026-03-18 18:16:32,351] Trial 23 pruned. 
[I 2026-03-18 18:16:35,256] Trial 15 pruned. 
[I 2026-03-18 18:16:38,240] Trial 12 pruned. 
[I 2026-03-18 18:16:39,791] Trial 14 finished with value: -2.5974339295391458 and parameters: {'n_layers_yyx': 2, 'hidden_size_yyx_l0': 5, 'hidden_size_yyx_l1': 5, 'context_size_yyx': 3, 'num_mix_components_yyx': 1, 'context_extractor_yyx': 'lstm', 'activation_func_yyx': 'GELU', 'L2_weight_yyx': 4.9902090373485665e-06, 'L_entropy_weight_yyx': 1.4817360496390427e-08, 'L_sep_weight_yyx': 6.1646033390361886e-09, 'L_scale_weight_yyx': 6.159358540593646e-05, 'learning_rate_yyx': 0.006301681545270515}. Best is trial 11 with value: -2.635494617718387.
[I 2026-03-18 18:16:43,704] Trial 15 finished with value: -1.72713993893394 and parameters: {'n_layers_yyx': 2, 'hidden_size_yyx_l0': 3, 'hidden_size_yyx_l1': 5, 'context_size_yyx': 4, 'num_mix_components_yyx': 4, 'context_extractor_yyx': 'gru', 'activation_func_yyx': 'Tanh', 'L2_weight_yyx': 3.260764955263851e-07, 'L_entropy_weight_yyx': 4.0329335001615994e-08, 'L_sep_weight_yyx': 3.110475934342303e-06, 'L_scale_weight_yyx': 1.5793677584201703e-08, 'learning_rate_yyx': 0.003466367515701128}. Best is trial 15 with value: -1.72713993893394.
[I 2026-03-18 18:16:45,526] Trial 13 pruned. 
[I 2026-03-18 18:16:46,737] Trial 14 pruned. 
[I 2026-03-18 18:16:46,951] Trial 16 pruned. 
[I 2026-03-18 18:16:49,852] Trial 20 pruned. 
[I 2026-03-18 18:16:53,542] Trial 25 pruned. 
[I 2026-03-18 18:16:54,436] Trial 17 pruned. 
[I 2026-03-18 18:17:03,665] Trial 13 pruned. 
[I 2026-03-18 18:17:14,395] Trial 26 pruned. 
[I 2026-03-18 18:17:21,821] Trial 18 pruned. 
[I 2026-03-18 18:17:23,676] Trial 15 pruned. 
[I 2026-03-18 18:17:26,633] Trial 10 finished with value: -1.6687655903262744 and parameters: {'n_layers_yyx': 2, 'hidden_size_yyx_l0': 5, 'hidden_size_yyx_l1': 6, 'context_size_yyx': 4, 'num_mix_components_yyx': 2, 'context_extractor_yyx': 'gru', 'activation_func_yyx': 'Tanh', 'L2_weight_yyx': 1.3189086701861936e-10, 'L_entropy_weight_yyx': 8.336578464011203e-06, 'L_sep_weight_yyx': 1.2330901849285995e-08, 'L_scale_weight_yyx': 5.2481573946238296e-09, 'learning_rate_yyx': 0.0036660699572461596}. Best is trial 10 with value: -1.6687655903262744.
[I 2026-03-18 18:17:28,629] Trial 24 pruned. 
[I 2026-03-18 18:17:32,761] Trial 12 finished with value: -1.6645964610425732 and parameters: {'n_layers_yyx': 2, 'hidden_size_yyx_l0': 4, 'hidden_size_yyx_l1': 6, 'context_size_yyx': 3, 'num_mix_components_yyx': 4, 'context_extractor_yyx': 'gru', 'activation_func_yyx': 'ReLU', 'L2_weight_yyx': 0.0005033774127666554, 'L_entropy_weight_yyx': 5.976581477610583e-06, 'L_sep_weight_yyx': 6.200067184847837e-09, 'L_scale_weight_yyx': 1.3877411619400048e-07, 'learning_rate_yyx': 0.00501462128276085}. Best is trial 12 with value: -1.6645964610425732.
[I 2026-03-18 18:17:36,673] Trial 14 pruned. 
[I 2026-03-18 18:17:48,119] Trial 21 pruned. 
[I 2026-03-18 18:17:54,262] Trial 34 finished with value: -1.265282960563843 and parameters: {'n_layers_yyx': 1, 'hidden_size_yyx_l0': 5, 'context_size_yyx': 3, 'num_mix_components_yyx': 2, 'context_extractor_yyx': 'lstm', 'activation_func_yyx': 'Tanh', 'L2_weight_yyx': 9.225705000129928e-07, 'L_entropy_weight_yyx': 7.364426875809383e-07, 'L_sep_weight_yyx': 3.140645517965518e-10, 'L_scale_weight_yyx': 3.2725873890914315e-10, 'learning_rate_yyx': 0.006619379688829542}. Best is trial 34 with value: -1.265282960563843.
[I 2026-03-18 18:17:55,162] Trial 16 pruned. 
[I 2026-03-18 18:17:58,502] Trial 25 pruned. 
[I 2026-03-18 18:17:58,643] Trial 13 pruned. 
[I 2026-03-18 18:17:59,724] Trial 24 pruned. 
[I 2026-03-18 18:18:00,513] Trial 27 pruned. 
[I 2026-03-18 18:18:08,976] Trial 16 pruned. 
[I 2026-03-18 18:18:10,113] Trial 28 pruned. 
[I 2026-03-18 18:18:13,431] Trial 35 pruned. 
[I 2026-03-18 18:18:14,291] Trial 17 finished with value: -2.646340507814064 and parameters: {'n_layers_yyx': 2, 'hidden_size_yyx_l0': 3, 'hidden_size_yyx_l1': 2, 'context_size_yyx': 4, 'num_mix_components_yyx': 4, 'context_extractor_yyx': 'gru', 'activation_func_yyx': 'ReLU', 'L2_weight_yyx': 1.820183940447607e-09, 'L_entropy_weight_yyx': 0.0008038305196198051, 'L_sep_weight_yyx': 7.986270290845561e-07, 'L_scale_weight_yyx': 1.4614633111022327e-09, 'learning_rate_yyx': 0.009324898888322499}. Best is trial 10 with value: -2.6537577311197915.
