[I 2026-03-18 19:28:05,115] Trial 1 finished with value: -2.088685318135012 and parameters: {'n_layers_yyx': 2, 'hidden_size_yyx_l0': 4, 'hidden_size_yyx_l1': 6, 'context_size_yyx': 3, 'num_mix_components_yyx': 4, 'context_extractor_yyx': 'lstm', 'activation_func_yyx': 'ReLU', 'L2_weight_yyx': 9.129633141796004e-09, 'L_entropy_weight_yyx': 1.5528511926611474e-07, 'L_sep_weight_yyx': 1.1956444253776213e-10, 'L_scale_weight_yyx': 2.786131647570508e-07, 'learning_rate_yyx': 0.0008903184123373132}. Best is trial 0 with value: -2.110296626806576.
[I 2026-03-18 19:28:13,360] Trial 2 pruned. 
[I 2026-03-18 19:28:18,162] Trial 1 finished with value: -1.5888538343701561 and parameters: {'n_layers_yyx': 1, 'hidden_size_yyx_l0': 6, 'context_size_yyx': 1, 'num_mix_components_yyx': 1, 'context_extractor_yyx': 'gru', 'activation_func_yyx': 'GELU', 'L2_weight_yyx': 3.721916273971838e-08, 'L_entropy_weight_yyx': 4.861039843230199e-07, 'L_sep_weight_yyx': 3.2555273337432e-06, 'L_scale_weight_yyx': 1.2035486380904564e-06, 'learning_rate_yyx': 0.006523706799966855}. Best is trial 0 with value: -1.6116411666937693.
[I 2026-03-18 19:28:20,371] Trial 3 finished with value: -1.5976345101077096 and parameters: {'n_layers_yyx': 1, 'hidden_size_yyx_l0': 6, 'context_size_yyx': 3, 'num_mix_components_yyx': 3, 'context_extractor_yyx': 'gru', 'activation_func_yyx': 'Tanh', 'L2_weight_yyx': 9.19393780122874e-09, 'L_entropy_weight_yyx': 1.3965484746770887e-07, 'L_sep_weight_yyx': 4.988072168940404e-08, 'L_scale_weight_yyx': 0.0008271928711008718, 'learning_rate_yyx': 0.0014118647431976112}. Best is trial 0 with value: -1.6069830560914067.
[I 2026-03-18 19:28:21,256] Trial 1 finished with value: -2.0593034638366503 and parameters: {'n_layers_yyx': 2, 'hidden_size_yyx_l0': 2, 'hidden_size_yyx_l1': 3, 'context_size_yyx': 3, 'num_mix_components_yyx': 3, 'context_extractor_yyx': 'lstm', 'activation_func_yyx': 'GELU', 'L2_weight_yyx': 3.6131902884108604e-06, 'L_entropy_weight_yyx': 2.3526326476185253e-05, 'L_sep_weight_yyx': 3.6698340224398125e-06, 'L_scale_weight_yyx': 2.8188068042540575e-06, 'learning_rate_yyx': 0.006624630192665748}. Best is trial 1 with value: -2.0593034638366503.
[I 2026-03-18 19:28:21,266] Trial 1 finished with value: -1.5831512234926857 and parameters: {'n_layers_yyx': 2, 'hidden_size_yyx_l0': 3, 'hidden_size_yyx_l1': 6, 'context_size_yyx': 1, 'num_mix_components_yyx': 2, 'context_extractor_yyx': 'gru', 'activation_func_yyx': 'Tanh', 'L2_weight_yyx': 1.244750767165854e-08, 'L_entropy_weight_yyx': 2.904415386345274e-10, 'L_sep_weight_yyx': 0.0002728939276070235, 'L_scale_weight_yyx': 2.4109639973351003e-10, 'learning_rate_yyx': 0.0006562010077305638}. Best is trial 0 with value: -1.5869808281492195.
[I 2026-03-18 19:28:27,539] Trial 2 pruned. 
[I 2026-03-18 19:28:36,109] Trial 3 pruned. 
[I 2026-03-18 19:28:38,085] Trial 4 pruned. 
[I 2026-03-18 19:28:40,368] Trial 1 finished with value: -2.0819965339546846 and parameters: {'n_layers_yyx': 2, 'hidden_size_yyx_l0': 5, 'hidden_size_yyx_l1': 6, 'context_size_yyx': 3, 'num_mix_components_yyx': 3, 'context_extractor_yyx': 'lstm', 'activation_func_yyx': 'GELU', 'L2_weight_yyx': 3.1737191362563095e-05, 'L_entropy_weight_yyx': 6.500562889233957e-07, 'L_sep_weight_yyx': 6.47136779308058e-06, 'L_scale_weight_yyx': 3.131000690971297e-06, 'learning_rate_yyx': 0.0025886196370593284}. Best is trial 1 with value: -2.0819965339546846.
[I 2026-03-18 19:28:40,389] Trial 2 pruned. 
[I 2026-03-18 19:28:49,048] Trial 1 finished with value: -2.079617514109146 and parameters: {'n_layers_yyx': 2, 'hidden_size_yyx_l0': 4, 'hidden_size_yyx_l1': 2, 'context_size_yyx': 4, 'num_mix_components_yyx': 4, 'context_extractor_yyx': 'lstm', 'activation_func_yyx': 'ReLU', 'L2_weight_yyx': 5.688593262347994e-08, 'L_entropy_weight_yyx': 3.322019464072524e-05, 'L_sep_weight_yyx': 3.1708927642985097e-09, 'L_scale_weight_yyx': 0.000118591567495379, 'learning_rate_yyx': 0.0008897607879525105}. Best is trial 1 with value: -2.079617514109146.
[I 2026-03-18 19:28:53,280] Trial 4 finished with value: -2.05485079740503 and parameters: {'n_layers_yyx': 2, 'hidden_size_yyx_l0': 6, 'hidden_size_yyx_l1': 4, 'context_size_yyx': 1, 'num_mix_components_yyx': 4, 'context_extractor_yyx': 'gru', 'activation_func_yyx': 'Tanh', 'L2_weight_yyx': 1.844293624313519e-10, 'L_entropy_weight_yyx': 0.0009484194560442667, 'L_sep_weight_yyx': 4.679534250982387e-07, 'L_scale_weight_yyx': 0.0007478843398877113, 'learning_rate_yyx': 0.009273109853032934}. Best is trial 2 with value: -2.059868681386501.
[I 2026-03-18 19:28:54,149] Trial 2 finished with value: -2.0808155259071768 and parameters: {'n_layers_yyx': 2, 'hidden_size_yyx_l0': 3, 'hidden_size_yyx_l1': 2, 'context_size_yyx': 2, 'num_mix_components_yyx': 1, 'context_extractor_yyx': 'lstm', 'activation_func_yyx': 'GELU', 'L2_weight_yyx': 1.2467774259397536e-06, 'L_entropy_weight_yyx': 5.114885972868562e-05, 'L_sep_weight_yyx': 0.0003384478702492304, 'L_scale_weight_yyx': 9.280196610207303e-07, 'learning_rate_yyx': 0.0017795381135941649}. Best is trial 0 with value: -2.0812970228057153.
[I 2026-03-18 19:28:56,302] Trial 4 pruned. 
[I 2026-03-18 19:28:59,683] Trial 2 finished with value: -2.085195656623902 and parameters: {'n_layers_yyx': 1, 'hidden_size_yyx_l0': 6, 'context_size_yyx': 4, 'num_mix_components_yyx': 5, 'context_extractor_yyx': 'lstm', 'activation_func_yyx': 'GELU', 'L2_weight_yyx': 4.0211369471625527e-10, 'L_entropy_weight_yyx': 1.8733448677782973e-10, 'L_sep_weight_yyx': 7.944747104848306e-10, 'L_scale_weight_yyx': 0.00012115473369413115, 'learning_rate_yyx': 0.007721930605028649}. Best is trial 2 with value: -2.085195656623902.
[I 2026-03-18 19:29:09,595] Trial 4 finished with value: -1.6381294603893477 and parameters: {'n_layers_yyx': 1, 'hidden_size_yyx_l0': 5, 'context_size_yyx': 3, 'num_mix_components_yyx': 3, 'context_extractor_yyx': 'gru', 'activation_func_yyx': 'GELU', 'L2_weight_yyx': 8.314108058965062e-08, 'L_entropy_weight_yyx': 9.380550467011459e-06, 'L_sep_weight_yyx': 4.588908239474734e-06, 'L_scale_weight_yyx': 6.530094886518568e-09, 'learning_rate_yyx': 0.0011903234474083273}. Best is trial 0 with value: -1.6395011021807235.
[I 2026-03-18 19:29:22,072] Trial 1 finished with value: -1.6124784403717338 and parameters: {'n_layers_yyx': 1, 'hidden_size_yyx_l0': 4, 'context_size_yyx': 2, 'num_mix_components_yyx': 1, 'context_extractor_yyx': 'gru', 'activation_func_yyx': 'Tanh', 'L2_weight_yyx': 1.0724785293380352e-07, 'L_entropy_weight_yyx': 0.0002793354198237069, 'L_sep_weight_yyx': 3.7068781699322695e-09, 'L_scale_weight_yyx': 6.161653092686387e-07, 'learning_rate_yyx': 0.004088762120157992}. Best is trial 0 with value: -1.613474194617056.
[I 2026-03-18 19:29:24,541] Trial 1 finished with value: -2.0784323844165455 and parameters: {'n_layers_yyx': 2, 'hidden_size_yyx_l0': 2, 'hidden_size_yyx_l1': 6, 'context_size_yyx': 1, 'num_mix_components_yyx': 2, 'context_extractor_yyx': 'lstm', 'activation_func_yyx': 'Tanh', 'L2_weight_yyx': 2.5041183316111965e-07, 'L_entropy_weight_yyx': 0.00021547012591276445, 'L_sep_weight_yyx': 1.7063749869534047e-05, 'L_scale_weight_yyx': 0.00017578113730366786, 'learning_rate_yyx': 0.001024379723227513}. Best is trial 0 with value: -2.0940855781262293.
[I 2026-03-18 19:29:29,865] Trial 1 finished with value: -2.0818722135118497 and parameters: {'n_layers_yyx': 2, 'hidden_size_yyx_l0': 4, 'hidden_size_yyx_l1': 2, 'context_size_yyx': 2, 'num_mix_components_yyx': 3, 'context_extractor_yyx': 'gru', 'activation_func_yyx': 'ReLU', 'L2_weight_yyx': 3.0527714204025877e-09, 'L_entropy_weight_yyx': 7.708238116740987e-06, 'L_sep_weight_yyx': 1.3197490411069292e-10, 'L_scale_weight_yyx': 7.994853176256976e-05, 'learning_rate_yyx': 0.0013432393741262608}. Best is trial 0 with value: -2.08424706136736.
[I 2026-03-18 19:29:40,322] Trial 2 finished with value: -1.6133203092563246 and parameters: {'n_layers_yyx': 2, 'hidden_size_yyx_l0': 2, 'hidden_size_yyx_l1': 5, 'context_size_yyx': 3, 'num_mix_components_yyx': 5, 'context_extractor_yyx': 'gru', 'activation_func_yyx': 'GELU', 'L2_weight_yyx': 4.574952952202598e-07, 'L_entropy_weight_yyx': 1.5228858180843707e-05, 'L_sep_weight_yyx': 3.984048114222115e-06, 'L_scale_weight_yyx': 9.976524061201757e-05, 'learning_rate_yyx': 0.0011872251589486126}. Best is trial 2 with value: -1.6133203092563246.
[I 2026-03-18 19:29:56,205] Trial 1 finished with value: -2.068827207167993 and parameters: {'n_layers_yyx': 2, 'hidden_size_yyx_l0': 4, 'hidden_size_yyx_l1': 3, 'context_size_yyx': 2, 'num_mix_components_yyx': 2, 'context_extractor_yyx': 'lstm', 'activation_func_yyx': 'GELU', 'L2_weight_yyx': 1.095246105158594e-10, 'L_entropy_weight_yyx': 8.670015525177638e-06, 'L_sep_weight_yyx': 0.00012165143794228917, 'L_scale_weight_yyx': 4.278438521315611e-08, 'learning_rate_yyx': 0.0011733774945937511}. Best is trial 0 with value: -2.070886092188975.
[I 2026-03-18 19:29:59,685] Trial 6 finished with value: -1.6308195002147892 and parameters: {'n_layers_yyx': 2, 'hidden_size_yyx_l0': 6, 'hidden_size_yyx_l1': 6, 'context_size_yyx': 1, 'num_mix_components_yyx': 4, 'context_extractor_yyx': 'gru', 'activation_func_yyx': 'GELU', 'L2_weight_yyx': 3.813540886760891e-10, 'L_entropy_weight_yyx': 1.8099477060103348e-10, 'L_sep_weight_yyx': 0.00013687586270982988, 'L_scale_weight_yyx': 4.219060483160122e-10, 'learning_rate_yyx': 0.000720002206216163}. Best is trial 6 with value: -1.6308195002147892.
[I 2026-03-18 19:30:03,838] Trial 1 finished with value: -2.063904504794006 and parameters: {'n_layers_yyx': 1, 'hidden_size_yyx_l0': 3, 'context_size_yyx': 2, 'num_mix_components_yyx': 2, 'context_extractor_yyx': 'lstm', 'activation_func_yyx': 'ReLU', 'L2_weight_yyx': 6.0306828656091284e-05, 'L_entropy_weight_yyx': 5.4823434224760335e-05, 'L_sep_weight_yyx': 0.00010535267076404656, 'L_scale_weight_yyx': 5.084285689876886e-10, 'learning_rate_yyx': 0.0005173906020495474}. Best is trial 0 with value: -2.0701083356738468.
[I 2026-03-18 19:30:17,627] Trial 3 finished with value: -1.5876113715902485 and parameters: {'n_layers_yyx': 1, 'hidden_size_yyx_l0': 6, 'context_size_yyx': 1, 'num_mix_components_yyx': 2, 'context_extractor_yyx': 'gru', 'activation_func_yyx': 'Tanh', 'L2_weight_yyx': 2.250645878797082e-10, 'L_entropy_weight_yyx': 9.83756772139637e-10, 'L_sep_weight_yyx': 3.613659280032249e-08, 'L_scale_weight_yyx': 4.3195361741214047e-10, 'learning_rate_yyx': 0.0005205230439819354}. Best is trial 0 with value: -1.6134249177836442.
[I 2026-03-18 19:30:34,963] Trial 5 finished with value: -1.6067071883002895 and parameters: {'n_layers_yyx': 2, 'hidden_size_yyx_l0': 6, 'hidden_size_yyx_l1': 6, 'context_size_yyx': 3, 'num_mix_components_yyx': 3, 'context_extractor_yyx': 'lstm', 'activation_func_yyx': 'ReLU', 'L2_weight_yyx': 5.6935196761749074e-08, 'L_entropy_weight_yyx': 2.011776274014207e-10, 'L_sep_weight_yyx': 2.5140246613853154e-09, 'L_scale_weight_yyx': 3.6419757924799164e-08, 'learning_rate_yyx': 0.0018663334587427443}. Best is trial 0 with value: -1.6069830560914067.
[I 2026-03-18 19:30:40,629] Trial 5 finished with value: -1.6097443194596297 and parameters: {'n_layers_yyx': 1, 'hidden_size_yyx_l0': 6, 'context_size_yyx': 2, 'num_mix_components_yyx': 3, 'context_extractor_yyx': 'lstm', 'activation_func_yyx': 'GELU', 'L2_weight_yyx': 9.375229642111575e-09, 'L_entropy_weight_yyx': 4.6038629049092137e-10, 'L_sep_weight_yyx': 1.844529657746452e-06, 'L_scale_weight_yyx': 5.023667308796341e-10, 'learning_rate_yyx': 0.0031198526406965637}. Best is trial 5 with value: -1.6097443194596297.
[I 2026-03-18 19:30:48,876] Trial 3 finished with value: -1.6307942617099915 and parameters: {'n_layers_yyx': 1, 'hidden_size_yyx_l0': 6, 'context_size_yyx': 2, 'num_mix_components_yyx': 2, 'context_extractor_yyx': 'lstm', 'activation_func_yyx': 'ReLU', 'L2_weight_yyx': 0.00030740219655738, 'L_entropy_weight_yyx': 2.914097180242603e-08, 'L_sep_weight_yyx': 1.366858585432177e-09, 'L_scale_weight_yyx': 3.201722366785793e-08, 'learning_rate_yyx': 0.0009645992309099782}. Best is trial 3 with value: -1.6307942617099915.
[I 2026-03-18 19:30:50,621] Trial 6 pruned. 
[I 2026-03-18 19:30:56,547] Trial 3 finished with value: -2.105966210840233 and parameters: {'n_layers_yyx': 2, 'hidden_size_yyx_l0': 5, 'hidden_size_yyx_l1': 6, 'context_size_yyx': 3, 'num_mix_components_yyx': 5, 'context_extractor_yyx': 'gru', 'activation_func_yyx': 'ReLU', 'L2_weight_yyx': 3.4211079617318674e-10, 'L_entropy_weight_yyx': 2.4667884484796104e-09, 'L_sep_weight_yyx': 0.00017328237843797882, 'L_scale_weight_yyx': 3.6876861598316196e-06, 'learning_rate_yyx': 0.0016078125297796651}. Best is trial 0 with value: -2.110296626806576.
[I 2026-03-18 19:30:59,475] Trial 7 pruned. 
[I 2026-03-18 19:30:59,942] Trial 5 finished with value: -1.6364004635789198 and parameters: {'n_layers_yyx': 1, 'hidden_size_yyx_l0': 5, 'context_size_yyx': 4, 'num_mix_components_yyx': 2, 'context_extractor_yyx': 'lstm', 'activation_func_yyx': 'ReLU', 'L2_weight_yyx': 9.309715525768775e-07, 'L_entropy_weight_yyx': 3.9603041671216043e-07, 'L_sep_weight_yyx': 0.00016710674398354386, 'L_scale_weight_yyx': 0.0003029083730903227, 'learning_rate_yyx': 0.0036894413594764763}. Best is trial 0 with value: -1.6395011021807235.
[I 2026-03-18 19:31:01,953] Trial 3 finished with value: -2.0773221226590772 and parameters: {'n_layers_yyx': 2, 'hidden_size_yyx_l0': 6, 'hidden_size_yyx_l1': 3, 'context_size_yyx': 2, 'num_mix_components_yyx': 3, 'context_extractor_yyx': 'lstm', 'activation_func_yyx': 'ReLU', 'L2_weight_yyx': 4.619656055099654e-06, 'L_entropy_weight_yyx': 1.258872281287022e-09, 'L_sep_weight_yyx': 5.736852497081294e-06, 'L_scale_weight_yyx': 6.188091611787526e-08, 'learning_rate_yyx': 0.0005432109648757736}. Best is trial 0 with value: -2.091085118269155.
[I 2026-03-18 19:31:03,614] Trial 2 finished with value: -1.5877063301836525 and parameters: {'n_layers_yyx': 2, 'hidden_size_yyx_l0': 5, 'hidden_size_yyx_l1': 3, 'context_size_yyx': 2, 'num_mix_components_yyx': 1, 'context_extractor_yyx': 'lstm', 'activation_func_yyx': 'GELU', 'L2_weight_yyx': 0.00012758568905422394, 'L_entropy_weight_yyx': 1.0960706600457586e-07, 'L_sep_weight_yyx': 6.087952646592386e-10, 'L_scale_weight_yyx': 2.647686499466321e-07, 'learning_rate_yyx': 0.00140594984476459}. Best is trial 2 with value: -1.5877063301836525.
[I 2026-03-18 19:31:09,561] Trial 2 finished with value: -1.6107041229707568 and parameters: {'n_layers_yyx': 1, 'hidden_size_yyx_l0': 5, 'context_size_yyx': 3, 'num_mix_components_yyx': 3, 'context_extractor_yyx': 'lstm', 'activation_func_yyx': 'Tanh', 'L2_weight_yyx': 4.534148936504459e-05, 'L_entropy_weight_yyx': 1.4471138813104405e-09, 'L_sep_weight_yyx': 5.266171914131389e-10, 'L_scale_weight_yyx': 1.8709915118659685e-07, 'learning_rate_yyx': 0.009389391252389648}. Best is trial 0 with value: -1.613474194617056.
[I 2026-03-18 19:31:11,902] Trial 5 pruned. 
[I 2026-03-18 19:31:14,999] Trial 3 finished with value: -2.013570424014775 and parameters: {'n_layers_yyx': 2, 'hidden_size_yyx_l0': 6, 'hidden_size_yyx_l1': 2, 'context_size_yyx': 1, 'num_mix_components_yyx': 1, 'context_extractor_yyx': 'lstm', 'activation_func_yyx': 'Tanh', 'L2_weight_yyx': 1.681288239891013e-09, 'L_entropy_weight_yyx': 3.8176601786054917e-07, 'L_sep_weight_yyx': 9.699126923997221e-09, 'L_scale_weight_yyx': 5.0703020163223154e-05, 'learning_rate_yyx': 0.00397349511406754}. Best is trial 1 with value: -2.0593034638366503.
[I 2026-03-18 19:31:16,989] Trial 8 pruned. 
[I 2026-03-18 19:31:22,643] Trial 6 pruned. 
[I 2026-03-18 19:31:40,242] Trial 2 finished with value: -2.093203554819634 and parameters: {'n_layers_yyx': 1, 'hidden_size_yyx_l0': 6, 'context_size_yyx': 1, 'num_mix_components_yyx': 5, 'context_extractor_yyx': 'lstm', 'activation_func_yyx': 'GELU', 'L2_weight_yyx': 7.406323480146894e-06, 'L_entropy_weight_yyx': 5.0154804795586425e-06, 'L_sep_weight_yyx': 5.039104223714827e-06, 'L_scale_weight_yyx': 3.547937260460379e-06, 'learning_rate_yyx': 0.004760955462527725}. Best is trial 2 with value: -2.093203554819634.
[I 2026-03-18 19:31:42,914] Trial 5 finished with value: -2.0413609387706204 and parameters: {'n_layers_yyx': 1, 'hidden_size_yyx_l0': 5, 'context_size_yyx': 4, 'num_mix_components_yyx': 2, 'context_extractor_yyx': 'gru', 'activation_func_yyx': 'GELU', 'L2_weight_yyx': 0.00011460299348666952, 'L_entropy_weight_yyx': 6.067550905684812e-07, 'L_sep_weight_yyx': 5.73490730121507e-08, 'L_scale_weight_yyx': 4.53207539079614e-05, 'learning_rate_yyx': 0.001918027009078479}. Best is trial 2 with value: -2.059868681386501.
[I 2026-03-18 19:31:58,378] Trial 2 finished with value: -1.552079732919492 and parameters: {'n_layers_yyx': 1, 'hidden_size_yyx_l0': 3, 'context_size_yyx': 1, 'num_mix_components_yyx': 3, 'context_extractor_yyx': 'gru', 'activation_func_yyx': 'GELU', 'L2_weight_yyx': 6.801586799481572e-07, 'L_entropy_weight_yyx': 6.0458065337888043e-05, 'L_sep_weight_yyx': 4.13570893674383e-09, 'L_scale_weight_yyx': 0.0003929809130265008, 'learning_rate_yyx': 0.0005034571662082}. Best is trial 1 with value: -1.6113757535901372.
[I 2026-03-18 19:32:00,526] Trial 2 finished with value: -2.090226414982307 and parameters: {'n_layers_yyx': 2, 'hidden_size_yyx_l0': 2, 'hidden_size_yyx_l1': 4, 'context_size_yyx': 2, 'num_mix_components_yyx': 5, 'context_extractor_yyx': 'lstm', 'activation_func_yyx': 'Tanh', 'L2_weight_yyx': 4.368082277248793e-06, 'L_entropy_weight_yyx': 1.7456904767605478e-09, 'L_sep_weight_yyx': 2.677238412050646e-07, 'L_scale_weight_yyx': 0.000990412201948607, 'learning_rate_yyx': 0.007837241144951145}. Best is trial 2 with value: -2.090226414982307.
[I 2026-03-18 19:32:00,866] Trial 3 finished with value: -1.6122994976195748 and parameters: {'n_layers_yyx': 2, 'hidden_size_yyx_l0': 2, 'hidden_size_yyx_l1': 2, 'context_size_yyx': 3, 'num_mix_components_yyx': 2, 'context_extractor_yyx': 'gru', 'activation_func_yyx': 'ReLU', 'L2_weight_yyx': 3.2688787361607647e-10, 'L_entropy_weight_yyx': 1.1987716251669372e-08, 'L_sep_weight_yyx': 8.147203239512752e-06, 'L_scale_weight_yyx': 5.733305390556693e-07, 'learning_rate_yyx': 0.0014851012957197785}. Best is trial 3 with value: -1.6122994976195748.
[I 2026-03-18 19:32:02,786] Trial 3 pruned. 
[I 2026-03-18 19:32:10,478] Trial 3 pruned. 
[I 2026-03-18 19:32:17,421] Trial 4 finished with value: -1.6120032149146784 and parameters: {'n_layers_yyx': 2, 'hidden_size_yyx_l0': 3, 'hidden_size_yyx_l1': 6, 'context_size_yyx': 3, 'num_mix_components_yyx': 4, 'context_extractor_yyx': 'lstm', 'activation_func_yyx': 'Tanh', 'L2_weight_yyx': 7.339085037266256e-10, 'L_entropy_weight_yyx': 4.097431605495714e-09, 'L_sep_weight_yyx': 2.6767398483573126e-07, 'L_scale_weight_yyx': 1.8081922250751351e-09, 'learning_rate_yyx': 0.0016186702614582268}. Best is trial 0 with value: -1.6134249177836442.
[I 2026-03-18 19:32:38,274] Trial 3 finished with value: -2.0800699434466448 and parameters: {'n_layers_yyx': 2, 'hidden_size_yyx_l0': 4, 'hidden_size_yyx_l1': 6, 'context_size_yyx': 3, 'num_mix_components_yyx': 1, 'context_extractor_yyx': 'gru', 'activation_func_yyx': 'Tanh', 'L2_weight_yyx': 1.0466871418737294e-05, 'L_entropy_weight_yyx': 6.898596344081941e-05, 'L_sep_weight_yyx': 8.333469216884652e-06, 'L_scale_weight_yyx': 6.9656084873414006e-09, 'learning_rate_yyx': 0.002159109871517543}. Best is trial 0 with value: -2.0812970228057153.
[I 2026-03-18 19:32:45,861] Trial 3 finished with value: -1.606980072913495 and parameters: {'n_layers_yyx': 1, 'hidden_size_yyx_l0': 6, 'context_size_yyx': 2, 'num_mix_components_yyx': 5, 'context_extractor_yyx': 'gru', 'activation_func_yyx': 'Tanh', 'L2_weight_yyx': 2.600031697336955e-09, 'L_entropy_weight_yyx': 4.31257274079176e-10, 'L_sep_weight_yyx': 0.000344027680098637, 'L_scale_weight_yyx': 6.227975203933884e-06, 'learning_rate_yyx': 0.0007321332706875291}. Best is trial 2 with value: -1.6133203092563246.
[I 2026-03-18 19:32:48,913] Trial 7 finished with value: -1.6469855686269512 and parameters: {'n_layers_yyx': 2, 'hidden_size_yyx_l0': 5, 'hidden_size_yyx_l1': 6, 'context_size_yyx': 1, 'num_mix_components_yyx': 5, 'context_extractor_yyx': 'gru', 'activation_func_yyx': 'GELU', 'L2_weight_yyx': 3.7134116811571545e-06, 'L_entropy_weight_yyx': 1.417012885421177e-10, 'L_sep_weight_yyx': 1.6596821936339707e-10, 'L_scale_weight_yyx': 5.0709494212157135e-06, 'learning_rate_yyx': 0.00197626193944751}. Best is trial 7 with value: -1.6469855686269512.
[I 2026-03-18 19:32:56,262] Trial 3 finished with value: -1.6104712811479323 and parameters: {'n_layers_yyx': 2, 'hidden_size_yyx_l0': 6, 'hidden_size_yyx_l1': 3, 'context_size_yyx': 3, 'num_mix_components_yyx': 2, 'context_extractor_yyx': 'gru', 'activation_func_yyx': 'GELU', 'L2_weight_yyx': 2.2123428701016858e-08, 'L_entropy_weight_yyx': 1.8550668395896786e-07, 'L_sep_weight_yyx': 4.3981737726621117e-07, 'L_scale_weight_yyx': 3.730606911297e-07, 'learning_rate_yyx': 0.008731300048930203}. Best is trial 3 with value: -1.6104712811479323.
[I 2026-03-18 19:33:04,613] Trial 8 pruned. 
[I 2026-03-18 19:33:12,180] Trial 9 finished with value: -1.612120379168339 and parameters: {'n_layers_yyx': 1, 'hidden_size_yyx_l0': 5, 'context_size_yyx': 4, 'num_mix_components_yyx': 2, 'context_extractor_yyx': 'gru', 'activation_func_yyx': 'ReLU', 'L2_weight_yyx': 1.2252971133381407e-10, 'L_entropy_weight_yyx': 7.421684762963075e-06, 'L_sep_weight_yyx': 4.075025615703377e-09, 'L_scale_weight_yyx': 1.6721257048093179e-06, 'learning_rate_yyx': 0.007170398003516748}. Best is trial 9 with value: -1.612120379168339.
