[I 2026-03-18 17:55:11,221] Trial 5 finished with value: -2.594154638349729 and parameters: {'n_layers_yyx': 1, 'hidden_size_yyx_l0': 4, 'context_size_yyx': 4, 'num_mix_components_yyx': 4, 'context_extractor_yyx': 'lstm', 'activation_func_yyx': 'GELU', 'L2_weight_yyx': 2.2448375706069563e-05, 'L_entropy_weight_yyx': 1.1059133319638522e-10, 'L_sep_weight_yyx': 4.77283819045163e-10, 'L_scale_weight_yyx': 3.007348965062984e-09, 'learning_rate_yyx': 0.0008249968682872705}. Best is trial 1 with value: -2.6376398477844947.
[I 2026-03-18 17:55:15,717] Trial 8 pruned. 
[I 2026-03-18 17:55:20,426] Trial 8 pruned. 
[I 2026-03-18 17:55:21,985] Trial 5 finished with value: -1.708559724831883 and parameters: {'n_layers_yyx': 1, 'hidden_size_yyx_l0': 4, 'context_size_yyx': 2, 'num_mix_components_yyx': 5, 'context_extractor_yyx': 'lstm', 'activation_func_yyx': 'ReLU', 'L2_weight_yyx': 8.277737175509907e-05, 'L_entropy_weight_yyx': 0.00028390287753480203, 'L_sep_weight_yyx': 5.24200935183417e-07, 'L_scale_weight_yyx': 1.6520602137906201e-07, 'learning_rate_yyx': 0.0024769230044537757}. Best is trial 2 with value: -1.719859356457674.
[I 2026-03-18 17:55:25,649] Trial 6 pruned. 
[I 2026-03-18 17:55:38,057] Trial 3 finished with value: -1.6562766854411943 and parameters: {'n_layers_yyx': 1, 'hidden_size_yyx_l0': 6, 'context_size_yyx': 3, 'num_mix_components_yyx': 4, 'context_extractor_yyx': 'gru', 'activation_func_yyx': 'ReLU', 'L2_weight_yyx': 0.00011621313514828774, 'L_entropy_weight_yyx': 5.418797311478441e-05, 'L_sep_weight_yyx': 0.00032320233775454116, 'L_scale_weight_yyx': 2.0945533209353333e-10, 'learning_rate_yyx': 0.002965707580683029}. Best is trial 0 with value: -1.66519233145544.
[I 2026-03-18 17:55:40,962] Trial 9 pruned. 
[I 2026-03-18 17:55:40,963] Trial 5 pruned. 
[I 2026-03-18 17:55:42,766] Trial 9 pruned. 
[I 2026-03-18 17:55:44,465] Trial 6 pruned. 
[I 2026-03-18 17:55:47,907] Trial 7 pruned. 
[I 2026-03-18 17:55:49,311] Trial 7 pruned. 
[I 2026-03-18 17:55:52,831] Trial 4 pruned. 
[I 2026-03-18 17:56:05,437] Trial 11 finished with value: -2.6003384246610617 and parameters: {'n_layers_yyx': 1, 'hidden_size_yyx_l0': 2, 'context_size_yyx': 3, 'num_mix_components_yyx': 1, 'context_extractor_yyx': 'lstm', 'activation_func_yyx': 'GELU', 'L2_weight_yyx': 7.827808672672002e-08, 'L_entropy_weight_yyx': 3.0003928534997123e-07, 'L_sep_weight_yyx': 5.690248920194567e-08, 'L_scale_weight_yyx': 5.058572726057169e-07, 'learning_rate_yyx': 0.009009150142113027}. Best is trial 4 with value: -2.636739481451597.
[I 2026-03-18 17:56:10,888] Trial 8 pruned. 
[I 2026-03-18 17:56:18,004] Trial 7 finished with value: -1.6481304131986088 and parameters: {'n_layers_yyx': 1, 'hidden_size_yyx_l0': 5, 'context_size_yyx': 1, 'num_mix_components_yyx': 3, 'context_extractor_yyx': 'lstm', 'activation_func_yyx': 'ReLU', 'L2_weight_yyx': 2.4048772588385054e-06, 'L_entropy_weight_yyx': 2.988010542943904e-08, 'L_sep_weight_yyx': 3.26024619180162e-06, 'L_scale_weight_yyx': 1.3168556007669596e-10, 'learning_rate_yyx': 0.005264532472308898}. Best is trial 0 with value: -1.6656935052073152.
[I 2026-03-18 17:56:21,899] Trial 6 pruned. 
[I 2026-03-18 17:56:30,238] Trial 5 finished with value: -1.6595330178680272 and parameters: {'n_layers_yyx': 1, 'hidden_size_yyx_l0': 4, 'context_size_yyx': 3, 'num_mix_components_yyx': 2, 'context_extractor_yyx': 'lstm', 'activation_func_yyx': 'ReLU', 'L2_weight_yyx': 6.580935771463866e-10, 'L_entropy_weight_yyx': 8.690259185858562e-07, 'L_sep_weight_yyx': 1.567455821110751e-05, 'L_scale_weight_yyx': 2.554894948935056e-10, 'learning_rate_yyx': 0.006593688144582023}. Best is trial 2 with value: -1.6777834079951708.
[I 2026-03-18 17:56:33,916] Trial 9 pruned. 
[I 2026-03-18 17:56:36,129] Trial 10 pruned. 
[I 2026-03-18 17:56:40,526] Trial 8 pruned. 
[I 2026-03-18 17:56:42,343] Trial 7 pruned. 
[I 2026-03-18 17:56:42,906] Trial 5 finished with value: -1.6556714660585101 and parameters: {'n_layers_yyx': 2, 'hidden_size_yyx_l0': 2, 'hidden_size_yyx_l1': 4, 'context_size_yyx': 4, 'num_mix_components_yyx': 2, 'context_extractor_yyx': 'lstm', 'activation_func_yyx': 'GELU', 'L2_weight_yyx': 9.014109343339577e-08, 'L_entropy_weight_yyx': 1.2848469693617333e-08, 'L_sep_weight_yyx': 1.3357599886377172e-08, 'L_scale_weight_yyx': 1.9524295357935836e-08, 'learning_rate_yyx': 0.009576225787375279}. Best is trial 5 with value: -1.6556714660585101.
[I 2026-03-18 17:56:46,410] Trial 8 pruned. 
[I 2026-03-18 17:56:52,526] Trial 6 finished with value: -1.6633613079757616 and parameters: {'n_layers_yyx': 2, 'hidden_size_yyx_l0': 6, 'hidden_size_yyx_l1': 5, 'context_size_yyx': 1, 'num_mix_components_yyx': 3, 'context_extractor_yyx': 'gru', 'activation_func_yyx': 'ReLU', 'L2_weight_yyx': 4.9065369249249316e-08, 'L_entropy_weight_yyx': 1.7647163805622155e-06, 'L_sep_weight_yyx': 1.1047522229367946e-06, 'L_scale_weight_yyx': 0.00048609645398389685, 'learning_rate_yyx': 0.006404935645619461}. Best is trial 0 with value: -1.6641703377100456.
[I 2026-03-18 17:56:53,460] Trial 8 pruned. 
[I 2026-03-18 17:57:03,685] Trial 8 pruned. 
[I 2026-03-18 17:57:03,730] Trial 4 finished with value: -1.5798093650751783 and parameters: {'n_layers_yyx': 1, 'hidden_size_yyx_l0': 5, 'context_size_yyx': 1, 'num_mix_components_yyx': 4, 'context_extractor_yyx': 'lstm', 'activation_func_yyx': 'GELU', 'L2_weight_yyx': 0.0001302745814980615, 'L_entropy_weight_yyx': 1.232853970884768e-10, 'L_sep_weight_yyx': 0.00043463561603156734, 'L_scale_weight_yyx': 0.00029617214822644873, 'learning_rate_yyx': 0.0028386728423728147}. Best is trial 0 with value: -1.6746319320135328.
[I 2026-03-18 17:57:05,571] Trial 6 pruned. 
[I 2026-03-18 17:57:05,814] Trial 4 finished with value: -2.6320736881627935 and parameters: {'n_layers_yyx': 1, 'hidden_size_yyx_l0': 5, 'context_size_yyx': 2, 'num_mix_components_yyx': 2, 'context_extractor_yyx': 'gru', 'activation_func_yyx': 'Tanh', 'L2_weight_yyx': 8.805431978813595e-10, 'L_entropy_weight_yyx': 3.30630567015652e-05, 'L_sep_weight_yyx': 1.3080437314662414e-07, 'L_scale_weight_yyx': 2.2023592162324513e-09, 'learning_rate_yyx': 0.005239792542705377}. Best is trial 0 with value: -2.633521153514828.
[I 2026-03-18 17:57:09,293] Trial 7 pruned. 
[I 2026-03-18 17:57:12,543] Trial 9 pruned. 
[I 2026-03-18 17:57:13,079] Trial 7 pruned. 
[I 2026-03-18 17:57:16,226] Trial 10 pruned. 
[I 2026-03-18 17:57:19,281] Trial 9 pruned. 
[I 2026-03-18 17:57:23,639] Trial 9 pruned. 
[I 2026-03-18 17:57:24,543] Trial 5 pruned. 
[I 2026-03-18 17:57:24,607] Trial 13 finished with value: -2.6313673750055218 and parameters: {'n_layers_yyx': 2, 'hidden_size_yyx_l0': 4, 'hidden_size_yyx_l1': 4, 'context_size_yyx': 2, 'num_mix_components_yyx': 5, 'context_extractor_yyx': 'gru', 'activation_func_yyx': 'Tanh', 'L2_weight_yyx': 8.469064344814262e-10, 'L_entropy_weight_yyx': 0.0008031310422569741, 'L_sep_weight_yyx': 3.090849337818276e-05, 'L_scale_weight_yyx': 6.890219142096368e-09, 'learning_rate_yyx': 0.005584389803088965}. Best is trial 0 with value: -2.6330643191486622.
[I 2026-03-18 17:57:26,128] Trial 5 finished with value: -1.221507031904351 and parameters: {'n_layers_yyx': 2, 'hidden_size_yyx_l0': 6, 'hidden_size_yyx_l1': 6, 'context_size_yyx': 1, 'num_mix_components_yyx': 3, 'context_extractor_yyx': 'gru', 'activation_func_yyx': 'ReLU', 'L2_weight_yyx': 5.43624997244689e-06, 'L_entropy_weight_yyx': 1.8566018020933505e-05, 'L_sep_weight_yyx': 2.7811645825570734e-08, 'L_scale_weight_yyx': 8.194167313416811e-05, 'learning_rate_yyx': 0.007065376318522023}. Best is trial 4 with value: -1.2631978019107952.
[I 2026-03-18 17:57:31,150] Trial 5 pruned. 
[I 2026-03-18 17:57:39,464] Trial 10 pruned. 
[I 2026-03-18 17:57:45,505] Trial 10 pruned. 
[I 2026-03-18 17:57:46,336] Trial 6 pruned. 
[I 2026-03-18 17:57:55,105] Trial 3 finished with value: -1.5933344439891122 and parameters: {'n_layers_yyx': 2, 'hidden_size_yyx_l0': 4, 'hidden_size_yyx_l1': 2, 'context_size_yyx': 4, 'num_mix_components_yyx': 1, 'context_extractor_yyx': 'gru', 'activation_func_yyx': 'GELU', 'L2_weight_yyx': 6.267960890443621e-09, 'L_entropy_weight_yyx': 1.5326083717743985e-07, 'L_sep_weight_yyx': 0.00011423846750056875, 'L_scale_weight_yyx': 7.054579485868283e-05, 'learning_rate_yyx': 0.0021386387309157485}. Best is trial 1 with value: -1.671168294287967.
[I 2026-03-18 17:58:03,306] Trial 10 finished with value: -2.6537577311197915 and parameters: {'n_layers_yyx': 2, 'hidden_size_yyx_l0': 2, 'hidden_size_yyx_l1': 6, 'context_size_yyx': 4, 'num_mix_components_yyx': 5, 'context_extractor_yyx': 'gru', 'activation_func_yyx': 'ReLU', 'L2_weight_yyx': 8.534523917371864e-10, 'L_entropy_weight_yyx': 1.3196449341577061e-05, 'L_sep_weight_yyx': 2.5407958690060504e-06, 'L_scale_weight_yyx': 1.5722706804802874e-10, 'learning_rate_yyx': 0.009990601594137944}. Best is trial 10 with value: -2.6537577311197915.
[I 2026-03-18 17:58:07,815] Trial 7 pruned. 
[I 2026-03-18 17:58:12,554] Trial 10 pruned. 
[I 2026-03-18 17:58:38,071] Trial 4 finished with value: -1.66296153669752 and parameters: {'n_layers_yyx': 1, 'hidden_size_yyx_l0': 6, 'context_size_yyx': 3, 'num_mix_components_yyx': 2, 'context_extractor_yyx': 'lstm', 'activation_func_yyx': 'ReLU', 'L2_weight_yyx': 2.2156550893824274e-05, 'L_entropy_weight_yyx': 0.00024752492573106277, 'L_sep_weight_yyx': 2.4006467938161672e-05, 'L_scale_weight_yyx': 2.798415347460371e-05, 'learning_rate_yyx': 0.007219711620599383}. Best is trial 4 with value: -1.66296153669752.
[I 2026-03-18 17:58:48,170] Trial 6 finished with value: -1.6579568255280392 and parameters: {'n_layers_yyx': 1, 'hidden_size_yyx_l0': 4, 'context_size_yyx': 1, 'num_mix_components_yyx': 5, 'context_extractor_yyx': 'gru', 'activation_func_yyx': 'GELU', 'L2_weight_yyx': 1.0685481568344365e-07, 'L_entropy_weight_yyx': 0.00010381619875984792, 'L_sep_weight_yyx': 2.556945214443352e-07, 'L_scale_weight_yyx': 2.995597409237862e-10, 'learning_rate_yyx': 0.0022075167018370174}. Best is trial 0 with value: -1.6702967433543936.
[I 2026-03-18 17:58:49,731] Trial 8 pruned. 
[I 2026-03-18 17:58:51,214] Trial 11 pruned. 
[I 2026-03-18 17:58:56,266] Trial 26 finished with value: -1.2463320310807713 and parameters: {'n_layers_yyx': 1, 'hidden_size_yyx_l0': 4, 'context_size_yyx': 2, 'num_mix_components_yyx': 2, 'context_extractor_yyx': 'lstm', 'activation_func_yyx': 'Tanh', 'L2_weight_yyx': 8.525675246946393e-09, 'L_entropy_weight_yyx': 8.924220252353217e-09, 'L_sep_weight_yyx': 5.5396820628315026e-05, 'L_scale_weight_yyx': 0.0001173609314409107, 'learning_rate_yyx': 0.008146608597800559}. Best is trial 3 with value: -1.2569327504269077.
[I 2026-03-18 17:59:04,142] Trial 3 finished with value: -1.6556902675243155 and parameters: {'n_layers_yyx': 2, 'hidden_size_yyx_l0': 3, 'hidden_size_yyx_l1': 2, 'context_size_yyx': 1, 'num_mix_components_yyx': 5, 'context_extractor_yyx': 'gru', 'activation_func_yyx': 'Tanh', 'L2_weight_yyx': 0.00016851874327105453, 'L_entropy_weight_yyx': 4.013340857349917e-07, 'L_sep_weight_yyx': 1.623862662250689e-06, 'L_scale_weight_yyx': 2.8540078808146284e-09, 'learning_rate_yyx': 0.007494830154302103}. Best is trial 2 with value: -1.6820484414711034.
[I 2026-03-18 17:59:17,231] Trial 12 pruned. 
[I 2026-03-18 17:59:22,106] Trial 4 pruned. 
[I 2026-03-18 17:59:24,147] Trial 8 finished with value: -1.3030293492170482 and parameters: {'n_layers_yyx': 1, 'hidden_size_yyx_l0': 5, 'context_size_yyx': 4, 'num_mix_components_yyx': 4, 'context_extractor_yyx': 'gru', 'activation_func_yyx': 'Tanh', 'L2_weight_yyx': 2.396931545813173e-05, 'L_entropy_weight_yyx': 5.2186397866727865e-09, 'L_sep_weight_yyx': 4.0730158729970015e-07, 'L_scale_weight_yyx': 8.41765331008921e-05, 'learning_rate_yyx': 0.003406176792020364}. Best is trial 8 with value: -1.3030293492170482.
[I 2026-03-18 17:59:28,467] Trial 27 pruned. 
[I 2026-03-18 17:59:37,993] Trial 6 pruned. 
[I 2026-03-18 17:59:38,883] Trial 7 pruned. 
[I 2026-03-18 17:59:41,017] Trial 5 pruned. 
[I 2026-03-18 17:59:42,423] Trial 13 pruned. 
[I 2026-03-18 17:59:56,085] Trial 11 finished with value: -2.6035725141905535 and parameters: {'n_layers_yyx': 1, 'hidden_size_yyx_l0': 6, 'context_size_yyx': 4, 'num_mix_components_yyx': 2, 'context_extractor_yyx': 'lstm', 'activation_func_yyx': 'GELU', 'L2_weight_yyx': 4.562219856589162e-06, 'L_entropy_weight_yyx': 0.0008143664667961155, 'L_sep_weight_yyx': 1.8361707308218737e-10, 'L_scale_weight_yyx': 2.0770224523643373e-05, 'learning_rate_yyx': 0.005788672739635025}. Best is trial 0 with value: -2.631078101143863.
[I 2026-03-18 17:59:56,527] Trial 8 pruned. 
[I 2026-03-18 18:00:00,349] Trial 7 pruned. 
[I 2026-03-18 18:00:11,359] Trial 4 pruned. 
[I 2026-03-18 18:00:15,719] Trial 6 finished with value: -2.642843521506465 and parameters: {'n_layers_yyx': 2, 'hidden_size_yyx_l0': 4, 'hidden_size_yyx_l1': 5, 'context_size_yyx': 2, 'num_mix_components_yyx': 3, 'context_extractor_yyx': 'lstm', 'activation_func_yyx': 'Tanh', 'L2_weight_yyx': 1.0405448524655447e-08, 'L_entropy_weight_yyx': 7.82040301202126e-05, 'L_sep_weight_yyx': 6.702891301976275e-06, 'L_scale_weight_yyx': 2.458721352397217e-10, 'learning_rate_yyx': 0.00594610425141634}. Best is trial 6 with value: -2.642843521506465.
[I 2026-03-18 18:00:20,874] Trial 8 finished with value: -2.635128406780887 and parameters: {'n_layers_yyx': 2, 'hidden_size_yyx_l0': 3, 'hidden_size_yyx_l1': 6, 'context_size_yyx': 2, 'num_mix_components_yyx': 3, 'context_extractor_yyx': 'lstm', 'activation_func_yyx': 'GELU', 'L2_weight_yyx': 5.409822052694009e-10, 'L_entropy_weight_yyx': 1.718117847968e-07, 'L_sep_weight_yyx': 6.96561873952341e-09, 'L_scale_weight_yyx': 2.1778586834167384e-05, 'learning_rate_yyx': 0.0057384431219227264}. Best is trial 1 with value: -2.6371932379943503.
[I 2026-03-18 18:00:27,161] Trial 5 pruned. 
[I 2026-03-18 18:00:29,389] Trial 12 finished with value: -2.6375437257353878 and parameters: {'n_layers_yyx': 1, 'hidden_size_yyx_l0': 4, 'context_size_yyx': 4, 'num_mix_components_yyx': 2, 'context_extractor_yyx': 'gru', 'activation_func_yyx': 'GELU', 'L2_weight_yyx': 1.513995244348499e-08, 'L_entropy_weight_yyx': 0.000702459869424384, 'L_sep_weight_yyx': 1.8548229818022115e-07, 'L_scale_weight_yyx': 2.4259624205237604e-05, 'learning_rate_yyx': 0.004880101215707389}. Best is trial 12 with value: -2.6375437257353878.
[I 2026-03-18 18:00:30,302] Trial 9 pruned. 
[I 2026-03-18 18:00:30,888] Trial 7 finished with value: -1.7197133356408227 and parameters: {'n_layers_yyx': 2, 'hidden_size_yyx_l0': 5, 'hidden_size_yyx_l1': 6, 'context_size_yyx': 3, 'num_mix_components_yyx': 1, 'context_extractor_yyx': 'lstm', 'activation_func_yyx': 'GELU', 'L2_weight_yyx': 4.462619287781978e-05, 'L_entropy_weight_yyx': 0.0003055044880139116, 'L_sep_weight_yyx': 0.00011730648017982402, 'L_scale_weight_yyx': 1.2152878155311321e-08, 'learning_rate_yyx': 0.005541163669136465}. Best is trial 2 with value: -1.719859356457674.
[I 2026-03-18 18:00:31,782] Trial 10 finished with value: -1.6586919386187233 and parameters: {'n_layers_yyx': 2, 'hidden_size_yyx_l0': 6, 'hidden_size_yyx_l1': 2, 'context_size_yyx': 4, 'num_mix_components_yyx': 5, 'context_extractor_yyx': 'lstm', 'activation_func_yyx': 'Tanh', 'L2_weight_yyx': 0.0006348621007928336, 'L_entropy_weight_yyx': 8.870945882750222e-07, 'L_sep_weight_yyx': 2.6158162240714806e-05, 'L_scale_weight_yyx': 1.3135567684284166e-10, 'learning_rate_yyx': 0.009929753814417503}. Best is trial 2 with value: -1.6745893480229308.
[I 2026-03-18 18:00:38,557] Trial 14 finished with value: -2.599923274197645 and parameters: {'n_layers_yyx': 1, 'hidden_size_yyx_l0': 4, 'context_size_yyx': 2, 'num_mix_components_yyx': 5, 'context_extractor_yyx': 'lstm', 'activation_func_yyx': 'GELU', 'L2_weight_yyx': 4.452131544101679e-10, 'L_entropy_weight_yyx': 0.0006399088072862356, 'L_sep_weight_yyx': 1.7971607084818923e-05, 'L_scale_weight_yyx': 3.0517498590526463e-09, 'learning_rate_yyx': 0.004945360691939183}. Best is trial 0 with value: -2.6330643191486622.
[I 2026-03-18 18:00:42,741] Trial 6 pruned. 
[I 2026-03-18 18:00:42,827] Trial 4 finished with value: -1.58224742107373 and parameters: {'n_layers_yyx': 2, 'hidden_size_yyx_l0': 3, 'hidden_size_yyx_l1': 2, 'context_size_yyx': 2, 'num_mix_components_yyx': 1, 'context_extractor_yyx': 'lstm', 'activation_func_yyx': 'Tanh', 'L2_weight_yyx': 1.1202119377814595e-07, 'L_entropy_weight_yyx': 3.8803766008017464e-07, 'L_sep_weight_yyx': 7.915628785121665e-10, 'L_scale_weight_yyx': 9.592897547804094e-08, 'learning_rate_yyx': 0.003451629273396455}. Best is trial 2 with value: -1.6799626520210098.
[I 2026-03-18 18:00:48,135] Trial 10 pruned. 
[I 2026-03-18 18:00:48,758] Trial 8 pruned. 
[I 2026-03-18 18:00:51,159] Trial 11 finished with value: -1.6620612635534469 and parameters: {'n_layers_yyx': 2, 'hidden_size_yyx_l0': 3, 'hidden_size_yyx_l1': 6, 'context_size_yyx': 1, 'num_mix_components_yyx': 5, 'context_extractor_yyx': 'gru', 'activation_func_yyx': 'Tanh', 'L2_weight_yyx': 1.358034705058395e-07, 'L_entropy_weight_yyx': 1.484327352308858e-05, 'L_sep_weight_yyx': 5.358498940364498e-08, 'L_scale_weight_yyx': 2.0683232370428017e-07, 'learning_rate_yyx': 0.009530287718161418}. Best is trial 0 with value: -1.6656935052073152.
[I 2026-03-18 18:00:51,504] Trial 9 pruned. 
[I 2026-03-18 18:00:51,514] Trial 13 pruned. 
[I 2026-03-18 18:01:03,113] Trial 7 pruned. 
[I 2026-03-18 18:01:04,184] Trial 5 pruned. 
[I 2026-03-18 18:01:12,204] Trial 11 pruned. 
[I 2026-03-18 18:01:12,511] Trial 8 finished with value: -1.6664572634068215 and parameters: {'n_layers_yyx': 1, 'hidden_size_yyx_l0': 6, 'context_size_yyx': 3, 'num_mix_components_yyx': 3, 'context_extractor_yyx': 'gru', 'activation_func_yyx': 'Tanh', 'L2_weight_yyx': 1.2085027245552931e-08, 'L_entropy_weight_yyx': 1.9309102038794964e-10, 'L_sep_weight_yyx': 2.401128523753784e-07, 'L_scale_weight_yyx': 5.59102449648474e-07, 'learning_rate_yyx': 0.0028853600566650134}. Best is trial 3 with value: -1.6716727072281603.
[I 2026-03-18 18:01:13,365] Trial 9 pruned. 
[I 2026-03-18 18:01:27,104] Trial 8 pruned. 
[I 2026-03-18 18:01:28,839] Trial 6 pruned. 
[I 2026-03-18 18:01:29,454] Trial 5 finished with value: -1.6649868297852268 and parameters: {'n_layers_yyx': 2, 'hidden_size_yyx_l0': 6, 'hidden_size_yyx_l1': 6, 'context_size_yyx': 3, 'num_mix_components_yyx': 2, 'context_extractor_yyx': 'lstm', 'activation_func_yyx': 'GELU', 'L2_weight_yyx': 1.1837853405533793e-09, 'L_entropy_weight_yyx': 4.706195344644353e-06, 'L_sep_weight_yyx': 1.527357271322568e-08, 'L_scale_weight_yyx': 1.2687385622114497e-09, 'learning_rate_yyx': 0.00958033534697676}. Best is trial 5 with value: -1.6649868297852268.
[I 2026-03-18 18:01:35,485] Trial 9 pruned. 
[I 2026-03-18 18:01:35,509] Trial 10 pruned. 
[I 2026-03-18 18:01:35,729] Trial 12 pruned. 
[I 2026-03-18 18:01:40,222] Trial 12 pruned. 
[I 2026-03-18 18:01:45,528] Trial 3 finished with value: -1.5870777322340381 and parameters: {'n_layers_yyx': 1, 'hidden_size_yyx_l0': 3, 'context_size_yyx': 2, 'num_mix_components_yyx': 2, 'context_extractor_yyx': 'gru', 'activation_func_yyx': 'Tanh', 'L2_weight_yyx': 4.08416896481344e-09, 'L_entropy_weight_yyx': 8.401383835714495e-08, 'L_sep_weight_yyx': 2.172998301444459e-06, 'L_scale_weight_yyx': 1.3674146266274214e-07, 'learning_rate_yyx': 0.0005425649003871324}. Best is trial 2 with value: -1.666246732076009.
[I 2026-03-18 18:01:48,828] Trial 9 pruned. 
[I 2026-03-18 18:01:49,352] Trial 14 pruned. 
[I 2026-03-18 18:02:03,450] Trial 6 finished with value: -1.5836457572841554 and parameters: {'n_layers_yyx': 1, 'hidden_size_yyx_l0': 2, 'context_size_yyx': 4, 'num_mix_components_yyx': 2, 'context_extractor_yyx': 'gru', 'activation_func_yyx': 'ReLU', 'L2_weight_yyx': 0.00012892922149085925, 'L_entropy_weight_yyx': 2.1040339862249938e-08, 'L_sep_weight_yyx': 2.7009524347222938e-08, 'L_scale_weight_yyx': 6.8539791209207895e-09, 'learning_rate_yyx': 0.0014504544008088057}. Best is trial 2 with value: -1.6720916355195472.
[I 2026-03-18 18:02:05,743] Trial 4 pruned. 
[I 2026-03-18 18:02:07,643] Trial 8 finished with value: -1.580571006650071 and parameters: {'n_layers_yyx': 1, 'hidden_size_yyx_l0': 3, 'context_size_yyx': 2, 'num_mix_components_yyx': 1, 'context_extractor_yyx': 'lstm', 'activation_func_yyx': 'ReLU', 'L2_weight_yyx': 1.3329338025488427e-08, 'L_entropy_weight_yyx': 8.768096680001865e-07, 'L_sep_weight_yyx': 1.3304472526762027e-10, 'L_scale_weight_yyx': 0.0008504640483779271, 'learning_rate_yyx': 0.006156013229234234}. Best is trial 0 with value: -1.6746319320135328.
[I 2026-03-18 18:02:10,871] Trial 7 pruned. 
[I 2026-03-18 18:02:13,110] Trial 15 pruned. 
[I 2026-03-18 18:02:13,794] Trial 6 pruned. 
[I 2026-03-18 18:02:20,238] Trial 11 finished with value: -1.2417579411138229 and parameters: {'n_layers_yyx': 2, 'hidden_size_yyx_l0': 5, 'hidden_size_yyx_l1': 6, 'context_size_yyx': 1, 'num_mix_components_yyx': 1, 'context_extractor_yyx': 'gru', 'activation_func_yyx': 'Tanh', 'L2_weight_yyx': 7.886345547558379e-08, 'L_entropy_weight_yyx': 2.48400062870676e-06, 'L_sep_weight_yyx': 2.0076710236139748e-08, 'L_scale_weight_yyx': 1.895621319165419e-08, 'learning_rate_yyx': 0.0035143181837983648}. Best is trial 3 with value: -1.2710647653519778.
[I 2026-03-18 18:02:21,312] Trial 7 finished with value: -1.6637274000173419 and parameters: {'n_layers_yyx': 2, 'hidden_size_yyx_l0': 4, 'hidden_size_yyx_l1': 5, 'context_size_yyx': 3, 'num_mix_components_yyx': 3, 'context_extractor_yyx': 'lstm', 'activation_func_yyx': 'GELU', 'L2_weight_yyx': 1.3779605381068401e-05, 'L_entropy_weight_yyx': 3.3542701934979424e-07, 'L_sep_weight_yyx': 1.8528108546401817e-08, 'L_scale_weight_yyx': 1.9184178208529562e-07, 'learning_rate_yyx': 0.009447418869147059}. Best is trial 7 with value: -1.6637274000173419.
