[I 2026-03-18 19:12:50,264] Trial 29 finished with value: -1.7791796997376252 and parameters: {'n_layers_yyx': 2, 'hidden_size_yyx_l0': 4, 'hidden_size_yyx_l1': 4, 'context_size_yyx': 4, 'num_mix_components_yyx': 2, 'context_extractor_yyx': 'gru', 'activation_func_yyx': 'Tanh', 'L2_weight_yyx': 1.6497428277173906e-06, 'L_entropy_weight_yyx': 4.401577453874815e-10, 'L_sep_weight_yyx': 4.701104182465852e-10, 'L_scale_weight_yyx': 0.00013028777925280555, 'learning_rate_yyx': 0.007159324561982033}. Best is trial 4 with value: -1.7807932306351817.
[I 2026-03-18 19:12:52,358] Trial 39 pruned. 
[I 2026-03-18 19:12:53,740] Trial 47 pruned. 
[I 2026-03-18 19:12:53,740] Trial 25 pruned. 
[I 2026-03-18 19:12:54,426] Trial 34 pruned. 
[I 2026-03-18 19:12:54,734] Trial 30 pruned. 
[I 2026-03-18 19:12:57,565] Trial 15 pruned. 
[I 2026-03-18 19:12:57,964] Trial 29 pruned. 
[I 2026-03-18 19:12:59,182] Trial 35 pruned. 
[I 2026-03-18 19:12:59,182] Trial 40 pruned. 
[I 2026-03-18 19:12:59,637] Trial 30 finished with value: -0.8342147669376616 and parameters: {'n_layers_yyx': 1, 'hidden_size_yyx_l0': 5, 'context_size_yyx': 4, 'num_mix_components_yyx': 5, 'context_extractor_yyx': 'lstm', 'activation_func_yyx': 'GELU', 'L2_weight_yyx': 1.7958839295315778e-07, 'L_entropy_weight_yyx': 6.6537073773633156e-09, 'L_sep_weight_yyx': 3.428400606888599e-10, 'L_scale_weight_yyx': 1.0960905177907457e-06, 'learning_rate_yyx': 0.0017216571978883406}. Best is trial 30 with value: -0.8342147669376616.
[I 2026-03-18 19:13:00,827] Trial 23 finished with value: -2.2848368650550794 and parameters: {'n_layers_yyx': 2, 'hidden_size_yyx_l0': 2, 'hidden_size_yyx_l1': 5, 'context_size_yyx': 4, 'num_mix_components_yyx': 5, 'context_extractor_yyx': 'gru', 'activation_func_yyx': 'Tanh', 'L2_weight_yyx': 6.61023663288129e-08, 'L_entropy_weight_yyx': 1.3619684387272398e-09, 'L_sep_weight_yyx': 6.444043384396606e-06, 'L_scale_weight_yyx': 2.2887779913856044e-05, 'learning_rate_yyx': 0.006618192421899886}. Best is trial 22 with value: -2.2897814149518054.
[I 2026-03-18 19:13:01,394] Trial 17 finished with value: -2.2823941439718483 and parameters: {'n_layers_yyx': 2, 'hidden_size_yyx_l0': 4, 'hidden_size_yyx_l1': 6, 'context_size_yyx': 4, 'num_mix_components_yyx': 5, 'context_extractor_yyx': 'gru', 'activation_func_yyx': 'ReLU', 'L2_weight_yyx': 1.278492466325803e-08, 'L_entropy_weight_yyx': 1.3146875466128557e-08, 'L_sep_weight_yyx': 0.00014121565098919932, 'L_scale_weight_yyx': 9.955216317981631e-05, 'learning_rate_yyx': 0.006310662309991771}. Best is trial 1 with value: -2.2866954714752907.
[I 2026-03-18 19:13:01,520] Trial 48 pruned. 
[I 2026-03-18 19:13:03,699] Trial 26 pruned. 
[I 2026-03-18 19:13:07,050] Trial 36 pruned. 
[I 2026-03-18 19:13:07,316] Trial 31 pruned. 
[I 2026-03-18 19:13:07,743] Trial 30 pruned. 
[I 2026-03-18 19:13:09,071] Trial 21 finished with value: -1.7829282078598485 and parameters: {'n_layers_yyx': 2, 'hidden_size_yyx_l0': 2, 'hidden_size_yyx_l1': 5, 'context_size_yyx': 1, 'num_mix_components_yyx': 5, 'context_extractor_yyx': 'gru', 'activation_func_yyx': 'ReLU', 'L2_weight_yyx': 0.00016878621509008561, 'L_entropy_weight_yyx': 1.8915759931377646e-05, 'L_sep_weight_yyx': 8.187506417658086e-07, 'L_scale_weight_yyx': 1.2245699752867582e-08, 'learning_rate_yyx': 0.00985917571380476}. Best is trial 4 with value: -1.784507205847538.
[I 2026-03-18 19:13:12,334] Trial 24 pruned. 
[I 2026-03-18 19:13:14,027] Trial 32 pruned. 
[I 2026-03-18 19:13:14,433] Trial 45 pruned. 
[I 2026-03-18 19:13:18,576] Trial 30 pruned. 
[I 2026-03-18 19:13:20,207] Trial 37 pruned. 
[I 2026-03-18 19:13:21,619] Trial 46 pruned. 
[I 2026-03-18 19:13:22,638] Trial 44 pruned. 
[I 2026-03-18 19:13:22,727] Trial 18 pruned. 
[I 2026-03-18 19:13:26,497] Trial 27 pruned. 
[I 2026-03-18 19:13:27,006] Trial 38 pruned. 
[I 2026-03-18 19:13:29,043] Trial 45 pruned. 
[I 2026-03-18 19:13:32,341] Trial 41 pruned. 
[I 2026-03-18 19:13:34,169] Trial 47 pruned. 
[I 2026-03-18 19:13:34,483] Trial 49 pruned. 

Source events: 3618
Target events: 18269
Full model ln_yyx : 144.69258 nats/sec, 7.12810 nats/event
Full model Log loss : -0.80359
Full model ln_yyx : 146.93875 nats/sec, 7.23876 nats/event
Full model Log loss : -0.81492
Full model ln_yyx : 148.04943 nats/sec, 7.29347 nats/event
Full model Log loss : -0.83701
Full model ln_yyx : 144.69259 nats/sec, 7.12810 nats/event
Full model Log loss : -0.80540
Full model ln_yyx : 143.59477 nats/sec, 7.07402 nats/event
Full model Log loss : -0.82091
Full model ln_yyx : 140.55924 nats/sec, 6.92448 nats/event
Full model Log loss : -0.77328
Full model ln_yyx : 147.25134 nats/sec, 7.25416 nats/event
Full model Log loss : -0.81441
Full model ln_yyx : 149.12761 nats/sec, 7.34659 nats/event
Full model Log loss : -0.82885
Full model ln_yyx : 146.78763 nats/sec, 7.23131 nats/event
Full model Log loss : -0.81432
Full model ln_yyx : 145.09236 nats/sec, 7.14780 nats/event
Full model Log loss : -0.81375
Full model ln_yyx : 149.68493 nats/sec, 7.37405 nats/event
Full model Log loss : -0.83208
Optimization finished. Config saved to results/opt-full/opt_full_196_best_config.txt
[I 2026-03-18 19:13:34,916] Trial 39 pruned. 
[I 2026-03-18 19:13:40,766] Trial 48 pruned. 
[I 2026-03-18 19:13:41,862] Trial 40 pruned. 
[I 2026-03-18 19:13:47,453] Trial 16 pruned. 
[I 2026-03-18 19:13:47,770] Trial 46 pruned. 
[I 2026-03-18 19:13:50,502] Trial 19 finished with value: -2.2574640896795715 and parameters: {'n_layers_yyx': 2, 'hidden_size_yyx_l0': 3, 'hidden_size_yyx_l1': 6, 'context_size_yyx': 1, 'num_mix_components_yyx': 5, 'context_extractor_yyx': 'lstm', 'activation_func_yyx': 'Tanh', 'L2_weight_yyx': 3.0248185631552264e-09, 'L_entropy_weight_yyx': 1.416004543006582e-09, 'L_sep_weight_yyx': 0.000792163441934009, 'L_scale_weight_yyx': 3.390175608333465e-10, 'learning_rate_yyx': 0.005592641709256738}. Best is trial 2 with value: -2.272224617884258.
[I 2026-03-18 19:13:52,780] Trial 49 pruned. 

Source events: 3618
Target events: 1872
Full model ln_yyx : 15.63945 nats/sec, 7.51897 nats/event
Full model Log loss : -0.91480
Full model ln_yyx : 14.83689 nats/sec, 7.13312 nats/event
Full model Log loss : -0.84710
Full model ln_yyx : 15.35104 nats/sec, 7.38031 nats/event
Full model Log loss : -0.89683
Full model ln_yyx : 15.28562 nats/sec, 7.34886 nats/event
Full model Log loss : -0.88998
Full model ln_yyx : 15.60443 nats/sec, 7.50213 nats/event
Full model Log loss : -0.91724
Full model ln_yyx : 15.58943 nats/sec, 7.49492 nats/event
Full model Log loss : -0.90293
Full model ln_yyx : 15.53510 nats/sec, 7.46880 nats/event
Full model Log loss : -0.91483
Full model ln_yyx : 15.89764 nats/sec, 7.64309 nats/event
Full model Log loss : -0.91543
Full model ln_yyx : 16.15075 nats/sec, 7.76478 nats/event
Full model Log loss : -0.91170
Full model ln_yyx : 15.59574 nats/sec, 7.49795 nats/event
Full model Log loss : -0.91531
Optimization finished. Config saved to results/opt-full/opt_full_198_best_config.txt
[I 2026-03-18 19:13:53,198] Trial 22 pruned. 
[I 2026-03-18 19:13:54,158] Trial 47 pruned. 
[I 2026-03-18 19:13:54,218] Trial 16 finished with value: -2.270180568438265 and parameters: {'n_layers_yyx': 1, 'hidden_size_yyx_l0': 5, 'context_size_yyx': 2, 'num_mix_components_yyx': 4, 'context_extractor_yyx': 'gru', 'activation_func_yyx': 'ReLU', 'L2_weight_yyx': 2.582000089327753e-07, 'L_entropy_weight_yyx': 1.8337199167200897e-07, 'L_sep_weight_yyx': 3.6311414645263174e-08, 'L_scale_weight_yyx': 1.558128507293382e-06, 'learning_rate_yyx': 0.0018315092450806448}. Best is trial 10 with value: -2.2831751549112607.
[I 2026-03-18 19:13:55,230] Trial 17 pruned. 
[I 2026-03-18 19:14:00,765] Trial 23 pruned. 
[I 2026-03-18 19:14:03,011] Trial 18 pruned. 
[I 2026-03-18 19:14:03,025] Trial 17 pruned. 
[I 2026-03-18 19:14:05,532] Trial 25 pruned. 
[I 2026-03-18 19:14:06,510] Trial 48 pruned. 
[I 2026-03-18 19:14:09,635] Trial 20 pruned. 
[I 2026-03-18 19:14:12,268] Trial 49 pruned. 

Source events: 3618
Target events: 12539
Full model ln_yyx : 98.62573 nats/sec, 7.07897 nats/event
Full model Log loss : -0.81241
Full model ln_yyx : 100.62668 nats/sec, 7.22259 nats/event
Full model Log loss : -0.82464
Full model ln_yyx : 101.57906 nats/sec, 7.29094 nats/event
Full model Log loss : -0.82387
Full model ln_yyx : 100.25946 nats/sec, 7.19623 nats/event
Full model Log loss : -0.82579
Full model ln_yyx : 100.73397 nats/sec, 7.23029 nats/event
Full model Log loss : -0.82107
Full model ln_yyx : 100.60352 nats/sec, 7.22092 nats/event
Full model Log loss : -0.81891
Full model ln_yyx : 100.71501 nats/sec, 7.22893 nats/event
Full model Log loss : -0.82028
Full model ln_yyx : 101.14611 nats/sec, 7.25987 nats/event
Full model Log loss : -0.82658
Full model ln_yyx : 101.67071 nats/sec, 7.29752 nats/event
Full model Log loss : -0.83391
Full model ln_yyx : 99.25917 nats/sec, 7.12443 nats/event
Full model Log loss : -0.81526
Optimization finished. Config saved to results/opt-full/opt_full_201_best_config.txt
[I 2026-03-18 19:14:14,463] Trial 15 finished with value: -2.2836040757900973 and parameters: {'n_layers_yyx': 2, 'hidden_size_yyx_l0': 3, 'hidden_size_yyx_l1': 5, 'context_size_yyx': 4, 'num_mix_components_yyx': 4, 'context_extractor_yyx': 'lstm', 'activation_func_yyx': 'GELU', 'L2_weight_yyx': 1.3542812544644108e-05, 'L_entropy_weight_yyx': 4.844450150823089e-07, 'L_sep_weight_yyx': 6.631694042359474e-05, 'L_scale_weight_yyx': 0.00014712874572456438, 'learning_rate_yyx': 0.005784417882712102}. Best is trial 15 with value: -2.2836040757900973.
[I 2026-03-18 19:14:15,607] Trial 19 pruned. 
[I 2026-03-18 19:14:21,132] Trial 35 pruned. 
[I 2026-03-18 19:14:22,760] Trial 24 finished with value: -1.7848361051925505 and parameters: {'n_layers_yyx': 1, 'hidden_size_yyx_l0': 4, 'context_size_yyx': 1, 'num_mix_components_yyx': 5, 'context_extractor_yyx': 'gru', 'activation_func_yyx': 'Tanh', 'L2_weight_yyx': 1.317199823411648e-06, 'L_entropy_weight_yyx': 2.4521732356243946e-07, 'L_sep_weight_yyx': 5.0435823115122e-07, 'L_scale_weight_yyx': 9.672743159408124e-08, 'learning_rate_yyx': 0.007938693589193609}. Best is trial 12 with value: -1.7867913016887627.
[I 2026-03-18 19:14:24,659] Trial 20 pruned. 
[I 2026-03-18 19:14:26,241] Trial 26 pruned. 
[I 2026-03-18 19:14:26,475] Trial 31 finished with value: -1.7751781144414742 and parameters: {'n_layers_yyx': 2, 'hidden_size_yyx_l0': 5, 'hidden_size_yyx_l1': 5, 'context_size_yyx': 3, 'num_mix_components_yyx': 2, 'context_extractor_yyx': 'lstm', 'activation_func_yyx': 'ReLU', 'L2_weight_yyx': 4.244281472475181e-10, 'L_entropy_weight_yyx': 3.213656794093132e-05, 'L_sep_weight_yyx': 3.1466073164395274e-09, 'L_scale_weight_yyx': 7.0538970454866955e-06, 'learning_rate_yyx': 0.007322900764763818}. Best is trial 4 with value: -1.7775746924677662.
[I 2026-03-18 19:14:26,573] Trial 36 pruned. 
[I 2026-03-18 19:14:29,176] Trial 21 pruned. 
[I 2026-03-18 19:14:30,143] Trial 25 pruned. 
[I 2026-03-18 19:14:33,963] Trial 42 finished with value: -0.8181333105180253 and parameters: {'n_layers_yyx': 1, 'hidden_size_yyx_l0': 2, 'context_size_yyx': 4, 'num_mix_components_yyx': 4, 'context_extractor_yyx': 'gru', 'activation_func_yyx': 'ReLU', 'L2_weight_yyx': 7.056606870087014e-09, 'L_entropy_weight_yyx': 2.851343339238804e-06, 'L_sep_weight_yyx': 0.0001385339082357332, 'L_scale_weight_yyx': 1.7483842792942178e-10, 'learning_rate_yyx': 0.008780307012807135}. Best is trial 10 with value: -0.8371109842725836.
[I 2026-03-18 19:14:34,806] Trial 21 finished with value: -2.2771983737126913 and parameters: {'n_layers_yyx': 2, 'hidden_size_yyx_l0': 6, 'hidden_size_yyx_l1': 5, 'context_size_yyx': 4, 'num_mix_components_yyx': 3, 'context_extractor_yyx': 'gru', 'activation_func_yyx': 'ReLU', 'L2_weight_yyx': 5.871080305761296e-09, 'L_entropy_weight_yyx': 6.442219193036424e-08, 'L_sep_weight_yyx': 3.940517803515235e-06, 'L_scale_weight_yyx': 1.143843105933698e-06, 'learning_rate_yyx': 0.0028520532276559555}. Best is trial 3 with value: -2.278758564192965.
[I 2026-03-18 19:14:35,212] Trial 16 pruned. 
[I 2026-03-18 19:14:36,140] Trial 31 finished with value: -2.2832125380106336 and parameters: {'n_layers_yyx': 1, 'hidden_size_yyx_l0': 6, 'context_size_yyx': 4, 'num_mix_components_yyx': 4, 'context_extractor_yyx': 'gru', 'activation_func_yyx': 'Tanh', 'L2_weight_yyx': 0.0001163711746284548, 'L_entropy_weight_yyx': 6.078503665151526e-09, 'L_sep_weight_yyx': 1.152111222324467e-09, 'L_scale_weight_yyx': 8.104146181784187e-07, 'learning_rate_yyx': 0.009514102083140507}. Best is trial 1 with value: -2.2881647079635865.
[I 2026-03-18 19:14:36,303] Trial 20 finished with value: -2.2648782597384445 and parameters: {'n_layers_yyx': 2, 'hidden_size_yyx_l0': 3, 'hidden_size_yyx_l1': 5, 'context_size_yyx': 2, 'num_mix_components_yyx': 5, 'context_extractor_yyx': 'lstm', 'activation_func_yyx': 'ReLU', 'L2_weight_yyx': 2.380476128336804e-09, 'L_entropy_weight_yyx': 8.478202774341427e-05, 'L_sep_weight_yyx': 2.350947815548953e-06, 'L_scale_weight_yyx': 0.0008523182123531032, 'learning_rate_yyx': 0.006046402540251541}. Best is trial 18 with value: -2.2732639198985773.
[I 2026-03-18 19:14:44,332] Trial 21 pruned. 
[I 2026-03-18 19:14:44,655] Trial 20 finished with value: -2.2699498534052927 and parameters: {'n_layers_yyx': 1, 'hidden_size_yyx_l0': 5, 'context_size_yyx': 3, 'num_mix_components_yyx': 1, 'context_extractor_yyx': 'lstm', 'activation_func_yyx': 'ReLU', 'L2_weight_yyx': 7.132317382896736e-05, 'L_entropy_weight_yyx': 1.212898040634767e-06, 'L_sep_weight_yyx': 1.293460619973286e-07, 'L_scale_weight_yyx': 1.2332913236889074e-09, 'learning_rate_yyx': 0.009822488379883086}. Best is trial 8 with value: -2.2706079849369587.
[I 2026-03-18 19:14:45,426] Trial 32 pruned. 
[I 2026-03-18 19:14:46,582] Trial 43 pruned. 
[I 2026-03-18 19:14:48,091] Trial 33 finished with value: -0.8313402319588372 and parameters: {'n_layers_yyx': 1, 'hidden_size_yyx_l0': 5, 'context_size_yyx': 4, 'num_mix_components_yyx': 4, 'context_extractor_yyx': 'lstm', 'activation_func_yyx': 'GELU', 'L2_weight_yyx': 3.3259902190761306e-10, 'L_entropy_weight_yyx': 1.8125444155096938e-09, 'L_sep_weight_yyx': 1.6602266553051218e-08, 'L_scale_weight_yyx': 3.0591205574321753e-06, 'learning_rate_yyx': 0.0017760599048181848}. Best is trial 30 with value: -0.8342147669376616.
[I 2026-03-18 19:14:48,883] Trial 22 pruned. 
[I 2026-03-18 19:14:53,296] Trial 46 pruned. 
[I 2026-03-18 19:14:53,934] Trial 17 pruned. 
[I 2026-03-18 19:14:54,200] Trial 34 pruned. 
[I 2026-03-18 19:14:58,132] Trial 23 pruned. 
[I 2026-03-18 19:14:58,417] Trial 37 pruned. 
[I 2026-03-18 19:14:58,488] Trial 32 finished with value: -1.766392896369014 and parameters: {'n_layers_yyx': 2, 'hidden_size_yyx_l0': 6, 'hidden_size_yyx_l1': 3, 'context_size_yyx': 2, 'num_mix_components_yyx': 1, 'context_extractor_yyx': 'lstm', 'activation_func_yyx': 'ReLU', 'L2_weight_yyx': 1.5555170313745492e-09, 'L_entropy_weight_yyx': 4.5017991736806897e-10, 'L_sep_weight_yyx': 2.224222133350241e-08, 'L_scale_weight_yyx': 5.060677142140923e-08, 'learning_rate_yyx': 0.007271113671677699}. Best is trial 1 with value: -1.7684712210476057.
[I 2026-03-18 19:14:59,389] Trial 47 pruned. 
[I 2026-03-18 19:15:00,876] Trial 35 pruned. 
[I 2026-03-18 19:15:03,218] Trial 22 pruned. 
[I 2026-03-18 19:15:04,288] Trial 38 pruned. 
[I 2026-03-18 19:15:05,072] Trial 33 pruned. 
[I 2026-03-18 19:15:05,959] Trial 48 pruned. 
[I 2026-03-18 19:15:07,280] Trial 36 pruned. 
[I 2026-03-18 19:15:09,946] Trial 26 pruned. 
[I 2026-03-18 19:15:12,044] Trial 23 pruned. 
[I 2026-03-18 19:15:13,288] Trial 37 pruned. 
[I 2026-03-18 19:15:13,361] Trial 18 pruned. 
[I 2026-03-18 19:15:13,393] Trial 16 pruned. 
[I 2026-03-18 19:15:17,269] Trial 49 pruned. 
[I 2026-03-18 19:15:17,282] Trial 27 pruned. 

Source events: 3618
Target events: 13628
Full model ln_yyx : 109.49055 nats/sec, 7.23081 nats/event
Full model Log loss : -0.83243
Full model ln_yyx : 105.68782 nats/sec, 6.97968 nats/event
Full model Log loss : -0.76962
Full model ln_yyx : 110.85137 nats/sec, 7.32068 nats/event
Full model Log loss : -0.82945
Full model ln_yyx : 107.65746 nats/sec, 7.10975 nats/event
Full model Log loss : -0.80997
Full model ln_yyx : 111.39682 nats/sec, 7.35670 nats/event
Full model Log loss : -0.82374
Full model ln_yyx : 109.95030 nats/sec, 7.26117 nats/event
Full model Log loss : -0.80832
Full model ln_yyx : 111.67548 nats/sec, 7.37510 nats/event
Full model Log loss : -0.82072
Full model ln_yyx : 111.40722 nats/sec, 7.35739 nats/event
Full model Log loss : -0.82943
Full model ln_yyx : 110.22885 nats/sec, 7.27957 nats/event
Full model Log loss : -0.81906
Full model ln_yyx : 111.55456 nats/sec, 7.36712 nats/event
Full model Log loss : -0.81090
Full model ln_yyx : 110.35385 nats/sec, 7.28782 nats/event
Full model Log loss : -0.81529
Full model ln_yyx : 111.44183 nats/sec, 7.35967 nats/event
Full model Log loss : -0.83403
Full model ln_yyx : 110.53693 nats/sec, 7.29991 nats/event
Full model Log loss : -0.81869
Full model ln_yyx : 110.05888 nats/sec, 7.26834 nats/event
Full model Log loss : -0.82785
Full model ln_yyx : 110.01010 nats/sec, 7.26512 nats/event
Full model Log loss : -0.82760
Optimization finished. Config saved to results/opt-full/opt_full_197_best_config.txt
[I 2026-03-18 19:15:19,926] Trial 38 pruned. 
[I 2026-03-18 19:15:21,022] Trial 28 finished with value: -2.2640319898925183 and parameters: {'n_layers_yyx': 2, 'hidden_size_yyx_l0': 5, 'hidden_size_yyx_l1': 6, 'context_size_yyx': 2, 'num_mix_components_yyx': 2, 'context_extractor_yyx': 'lstm', 'activation_func_yyx': 'GELU', 'L2_weight_yyx': 4.5863593153424446e-08, 'L_entropy_weight_yyx': 1.575389071949542e-05, 'L_sep_weight_yyx': 3.4958499455168683e-06, 'L_scale_weight_yyx': 0.0009159118449070161, 'learning_rate_yyx': 0.006433945086670257}. Best is trial 10 with value: -2.2853422092545133.
[I 2026-03-18 19:15:25,762] Trial 27 pruned. 
[I 2026-03-18 19:15:30,618] Trial 31 finished with value: -1.7780345894439875 and parameters: {'n_layers_yyx': 2, 'hidden_size_yyx_l0': 4, 'hidden_size_yyx_l1': 4, 'context_size_yyx': 4, 'num_mix_components_yyx': 2, 'context_extractor_yyx': 'gru', 'activation_func_yyx': 'Tanh', 'L2_weight_yyx': 1.6250894352863967e-08, 'L_entropy_weight_yyx': 4.575932900123314e-10, 'L_sep_weight_yyx': 3.8599731593076905e-10, 'L_scale_weight_yyx': 0.0001240564445470068, 'learning_rate_yyx': 0.007314049176328035}. Best is trial 4 with value: -1.7807932306351817.
[I 2026-03-18 19:15:34,274] Trial 39 pruned. 
[I 2026-03-18 19:15:35,630] Trial 28 pruned. 
[I 2026-03-18 19:15:40,257] Trial 28 pruned. 
[I 2026-03-18 19:15:40,860] Trial 33 pruned. 
[I 2026-03-18 19:15:42,505] Trial 29 pruned. 
[I 2026-03-18 19:15:42,636] Trial 41 finished with value: -0.8314914900583918 and parameters: {'n_layers_yyx': 1, 'hidden_size_yyx_l0': 3, 'context_size_yyx': 2, 'num_mix_components_yyx': 5, 'context_extractor_yyx': 'gru', 'activation_func_yyx': 'Tanh', 'L2_weight_yyx': 6.041776123517303e-10, 'L_entropy_weight_yyx': 6.922306290464599e-10, 'L_sep_weight_yyx': 5.663600746313174e-07, 'L_scale_weight_yyx': 8.88318200499265e-10, 'learning_rate_yyx': 0.006830832481846694}. Best is trial 10 with value: -0.8355233715063007.
[I 2026-03-18 19:15:47,171] Trial 44 finished with value: -0.8283169181519456 and parameters: {'n_layers_yyx': 1, 'hidden_size_yyx_l0': 3, 'context_size_yyx': 4, 'num_mix_components_yyx': 4, 'context_extractor_yyx': 'gru', 'activation_func_yyx': 'ReLU', 'L2_weight_yyx': 3.184808252787481e-07, 'L_entropy_weight_yyx': 3.457973612385188e-07, 'L_sep_weight_yyx': 0.0009518411867047606, 'L_scale_weight_yyx': 4.905489933400311e-10, 'learning_rate_yyx': 0.00957163311145038}. Best is trial 10 with value: -0.8371109842725836.
[I 2026-03-18 19:15:49,238] Trial 42 pruned. 
[I 2026-03-18 19:15:50,868] Trial 32 finished with value: -1.750775960623576 and parameters: {'n_layers_yyx': 2, 'hidden_size_yyx_l0': 5, 'hidden_size_yyx_l1': 4, 'context_size_yyx': 3, 'num_mix_components_yyx': 2, 'context_extractor_yyx': 'lstm', 'activation_func_yyx': 'ReLU', 'L2_weight_yyx': 2.35397854550894e-10, 'L_entropy_weight_yyx': 1.3819745725358366e-05, 'L_sep_weight_yyx': 6.941617068935719e-10, 'L_scale_weight_yyx': 6.119902993440712e-05, 'learning_rate_yyx': 0.005575261248558972}. Best is trial 4 with value: -1.7775746924677662.
[I 2026-03-18 19:15:50,920] Trial 29 pruned. 
[I 2026-03-18 19:15:50,928] Trial 24 pruned. 
[I 2026-03-18 19:15:51,095] Trial 23 finished with value: -1.7728884324121612 and parameters: {'n_layers_yyx': 1, 'hidden_size_yyx_l0': 4, 'context_size_yyx': 3, 'num_mix_components_yyx': 3, 'context_extractor_yyx': 'gru', 'activation_func_yyx': 'ReLU', 'L2_weight_yyx': 8.627647532270577e-09, 'L_entropy_weight_yyx': 0.0009831780745637342, 'L_sep_weight_yyx': 8.044762892435325e-09, 'L_scale_weight_yyx': 5.838633649184529e-05, 'learning_rate_yyx': 0.0016041331845487146}. Best is trial 2 with value: -1.776406202226865.
[I 2026-03-18 19:15:52,003] Trial 30 pruned. 
[I 2026-03-18 19:15:52,310] Trial 29 pruned. 
[I 2026-03-18 19:15:53,297] Trial 45 pruned. 
[I 2026-03-18 19:16:00,396] Trial 25 pruned. 
[I 2026-03-18 19:16:03,684] Trial 22 finished with value: -2.273490465387195 and parameters: {'n_layers_yyx': 2, 'hidden_size_yyx_l0': 6, 'hidden_size_yyx_l1': 5, 'context_size_yyx': 4, 'num_mix_components_yyx': 3, 'context_extractor_yyx': 'gru', 'activation_func_yyx': 'ReLU', 'L2_weight_yyx': 7.483859344521808e-09, 'L_entropy_weight_yyx': 6.648344071239487e-08, 'L_sep_weight_yyx': 1.238930588449975e-06, 'L_scale_weight_yyx': 6.629239351739827e-07, 'learning_rate_yyx': 0.003999366619655168}. Best is trial 3 with value: -2.278758564192965.
