[I 2026-03-18 17:05:12,183] Trial 36 finished with value: -2.8057050921877558 and parameters: {'n_layers_yyx': 2, 'hidden_size_yyx_l0': 5, 'hidden_size_yyx_l1': 3, 'context_size_yyx': 4, 'num_mix_components_yyx': 5, 'context_extractor_yyx': 'lstm', 'activation_func_yyx': 'Tanh', 'L2_weight_yyx': 1.335498723555387e-05, 'L_entropy_weight_yyx': 2.2782513728321008e-07, 'L_sep_weight_yyx': 1.4195443362197535e-09, 'L_scale_weight_yyx': 1.949521259523379e-05, 'learning_rate_yyx': 0.008314358074941387}. Best is trial 5 with value: -2.8058216093098.
[I 2026-03-18 17:05:17,138] Trial 43 pruned. 
[I 2026-03-18 17:05:17,401] Trial 45 finished with value: -2.8009245027473657 and parameters: {'n_layers_yyx': 1, 'hidden_size_yyx_l0': 6, 'context_size_yyx': 4, 'num_mix_components_yyx': 5, 'context_extractor_yyx': 'lstm', 'activation_func_yyx': 'Tanh', 'L2_weight_yyx': 3.7053124962817954e-07, 'L_entropy_weight_yyx': 6.502350281001809e-05, 'L_sep_weight_yyx': 0.0005052736234717712, 'L_scale_weight_yyx': 2.0784739007201134e-09, 'learning_rate_yyx': 0.008698663808660084}. Best is trial 45 with value: -2.8009245027473657.
[I 2026-03-18 17:05:18,338] Trial 42 pruned. 
[I 2026-03-18 17:05:20,052] Trial 49 pruned. 

Source events: 31112
Target events: 1872
Full model ln_yyx : 263.12195 nats/sec, 126.50094 nats/event
Full model Log loss : -2.76903
Full model ln_yyx : 265.06461 nats/sec, 127.43491 nats/event
Full model Log loss : -2.77224
Full model ln_yyx : 267.21453 nats/sec, 128.46852 nats/event
Full model Log loss : -2.77769
Full model ln_yyx : 265.60242 nats/sec, 127.69347 nats/event
Full model Log loss : -2.77414
Full model ln_yyx : 265.91057 nats/sec, 127.84162 nats/event
Full model Log loss : -2.77417
Full model ln_yyx : 264.80454 nats/sec, 127.30988 nats/event
Full model Log loss : -2.78067
Full model ln_yyx : 264.94356 nats/sec, 127.37671 nats/event
Full model Log loss : -2.77591
Full model ln_yyx : 264.52298 nats/sec, 127.17451 nats/event
Full model Log loss : -2.78091
Full model ln_yyx : 264.95314 nats/sec, 127.38132 nats/event
Full model Log loss : -2.77940
Full model ln_yyx : 265.21458 nats/sec, 127.50701 nats/event
Full model Log loss : -2.77726
Optimization finished. Config saved to results/opt-full/opt_full_11_best_config.txt
[I 2026-03-18 17:05:22,668] Trial 44 pruned. 
[I 2026-03-18 17:05:23,825] Trial 43 pruned. 
[I 2026-03-18 17:05:24,662] Trial 46 finished with value: -2.8008878193204363 and parameters: {'n_layers_yyx': 1, 'hidden_size_yyx_l0': 3, 'context_size_yyx': 4, 'num_mix_components_yyx': 4, 'context_extractor_yyx': 'gru', 'activation_func_yyx': 'ReLU', 'L2_weight_yyx': 3.0076414582290646e-08, 'L_entropy_weight_yyx': 2.5526834853593696e-05, 'L_sep_weight_yyx': 2.860655172778311e-09, 'L_scale_weight_yyx': 3.3493540715401487e-06, 'learning_rate_yyx': 0.008133811749059201}. Best is trial 41 with value: -2.8073655760360414.
[I 2026-03-18 17:05:25,127] Trial 42 pruned. 
[I 2026-03-18 17:05:25,286] Trial 37 pruned. 
[I 2026-03-18 17:05:26,941] Trial 39 finished with value: -2.8034032323338964 and parameters: {'n_layers_yyx': 1, 'hidden_size_yyx_l0': 6, 'context_size_yyx': 3, 'num_mix_components_yyx': 3, 'context_extractor_yyx': 'lstm', 'activation_func_yyx': 'Tanh', 'L2_weight_yyx': 0.0002746852476719621, 'L_entropy_weight_yyx': 5.286838420090471e-10, 'L_sep_weight_yyx': 1.8356321052364284e-06, 'L_scale_weight_yyx': 6.360287681256223e-09, 'learning_rate_yyx': 0.006713305396181413}. Best is trial 24 with value: -2.806529472032402.
[I 2026-03-18 17:05:29,114] Trial 44 pruned. 
[I 2026-03-18 17:05:30,862] Trial 38 pruned. 
[I 2026-03-18 17:05:35,540] Trial 45 pruned. 
[I 2026-03-18 17:05:36,313] Trial 39 pruned. 
[I 2026-03-18 17:05:38,207] Trial 43 pruned. 
[I 2026-03-18 17:05:41,087] Trial 46 pruned. 
[I 2026-03-18 17:05:41,632] Trial 40 pruned. 
[I 2026-03-18 17:05:46,583] Trial 36 finished with value: -2.805114955836555 and parameters: {'n_layers_yyx': 2, 'hidden_size_yyx_l0': 5, 'hidden_size_yyx_l1': 3, 'context_size_yyx': 4, 'num_mix_components_yyx': 5, 'context_extractor_yyx': 'lstm', 'activation_func_yyx': 'ReLU', 'L2_weight_yyx': 1.338719811901439e-08, 'L_entropy_weight_yyx': 9.903185526949512e-07, 'L_sep_weight_yyx': 5.210399301382449e-06, 'L_scale_weight_yyx': 8.353363365444591e-07, 'learning_rate_yyx': 0.009588297269419035}. Best is trial 6 with value: -2.805382927239302.
[I 2026-03-18 17:05:52,697] Trial 46 pruned. 
[I 2026-03-18 17:05:53,149] Trial 47 pruned. 
[I 2026-03-18 17:05:58,447] Trial 48 pruned. 
[I 2026-03-18 17:06:00,206] Trial 47 pruned. 
[I 2026-03-18 17:06:06,208] Trial 49 finished with value: -2.799173347563612 and parameters: {'n_layers_yyx': 1, 'hidden_size_yyx_l0': 5, 'context_size_yyx': 4, 'num_mix_components_yyx': 4, 'context_extractor_yyx': 'lstm', 'activation_func_yyx': 'Tanh', 'L2_weight_yyx': 1.9030968758880958e-05, 'L_entropy_weight_yyx': 8.015128636522086e-07, 'L_sep_weight_yyx': 1.90411500157023e-10, 'L_scale_weight_yyx': 5.665425077135966e-05, 'learning_rate_yyx': 0.00980796760180417}. Best is trial 46 with value: -2.7997979326210474.

Source events: 31112
Target events: 10752
Full model ln_yyx : 1529.57460 nats/sec, 128.03359 nats/event
Full model Log loss : -2.79457
Full model ln_yyx : 1515.48677 nats/sec, 126.85436 nats/event
Full model Log loss : -2.77082
Full model ln_yyx : 1522.99350 nats/sec, 127.48271 nats/event
Full model Log loss : -2.77586
Full model ln_yyx : 1535.10119 nats/sec, 128.49619 nats/event
Full model Log loss : -2.79501
Full model ln_yyx : 1518.17258 nats/sec, 127.07918 nats/event
Full model Log loss : -2.77797
Full model ln_yyx : 1521.82200 nats/sec, 127.38465 nats/event
Full model Log loss : -2.78055
Full model ln_yyx : 1528.72169 nats/sec, 127.96219 nats/event
Full model Log loss : -2.79447
Full model ln_yyx : 1527.72848 nats/sec, 127.87906 nats/event
Full model Log loss : -2.79606
Full model ln_yyx : 1529.17506 nats/sec, 128.00014 nats/event
Full model Log loss : -2.79793
Full model ln_yyx : 1547.06125 nats/sec, 129.49731 nats/event
Full model Log loss : -2.79744
Full model ln_yyx : 1547.32049 nats/sec, 129.51901 nats/event
Full model Log loss : -2.79917
Full model ln_yyx : 1540.13942 nats/sec, 128.91792 nats/event
Full model Log loss : -2.79969
Full model ln_yyx : 1540.44989 nats/sec, 128.94391 nats/event
Full model Log loss : -2.79980
Full model ln_yyx : 1533.12276 nats/sec, 128.33059 nats/event
Full model Log loss : -2.79350
Full model ln_yyx : 1546.99117 nats/sec, 129.49145 nats/event
Full model Log loss : -2.79917
Optimization finished. Config saved to results/opt-full/opt_full_8_best_config.txt
[I 2026-03-18 17:06:09,440] Trial 37 finished with value: -2.6619668984779454 and parameters: {'n_layers_yyx': 2, 'hidden_size_yyx_l0': 5, 'hidden_size_yyx_l1': 6, 'context_size_yyx': 3, 'num_mix_components_yyx': 1, 'context_extractor_yyx': 'lstm', 'activation_func_yyx': 'Tanh', 'L2_weight_yyx': 1.9497863793476783e-05, 'L_entropy_weight_yyx': 1.238294408244547e-09, 'L_sep_weight_yyx': 2.9126505479635004e-09, 'L_scale_weight_yyx': 1.048368697241904e-09, 'learning_rate_yyx': 0.006478014333065639}. Best is trial 21 with value: -2.786583013031271.
[I 2026-03-18 17:06:11,121] Trial 49 pruned. 

Source events: 31112
Target events: 8618
Full model ln_yyx : 1224.48665 nats/sec, 127.87630 nats/event
Full model Log loss : -2.79159
Full model ln_yyx : 1216.73207 nats/sec, 127.06647 nats/event
Full model Log loss : -2.77191
Full model ln_yyx : 1231.86517 nats/sec, 128.64686 nats/event
Full model Log loss : -2.79291
Full model ln_yyx : 1226.27962 nats/sec, 128.06355 nats/event
Full model Log loss : -2.79376
Full model ln_yyx : 1233.25958 nats/sec, 128.79248 nats/event
Full model Log loss : -2.79648
Full model ln_yyx : 1225.09628 nats/sec, 127.93997 nats/event
Full model Log loss : -2.79421
Full model ln_yyx : 1225.63807 nats/sec, 127.99655 nats/event
Full model Log loss : -2.79421
Full model ln_yyx : 1227.45260 nats/sec, 128.18605 nats/event
Full model Log loss : -2.79125
Full model ln_yyx : 1232.78142 nats/sec, 128.74255 nats/event
Full model Log loss : -2.79676
Full model ln_yyx : 1226.54988 nats/sec, 128.09177 nats/event
Full model Log loss : -2.79426
Full model ln_yyx : 1231.86168 nats/sec, 128.64650 nats/event
Full model Log loss : -2.79502
Optimization finished. Config saved to results/opt-full/opt_full_12_best_config.txt
[I 2026-03-18 17:06:13,523] Trial 48 pruned. 
[I 2026-03-18 17:06:14,021] Trial 44 pruned. 
[I 2026-03-18 17:06:17,058] Trial 41 pruned. 
[I 2026-03-18 17:06:19,163] Trial 45 pruned. 
[I 2026-03-18 17:06:21,904] Trial 38 pruned. 
[I 2026-03-18 17:06:24,579] Trial 46 pruned. 
[I 2026-03-18 17:06:25,800] Trial 49 pruned. 

Source events: 31112
Target events: 12731
Full model ln_yyx : 1814.73179 nats/sec, 128.28989 nats/event
Full model Log loss : -2.80272
Full model ln_yyx : 1819.73335 nats/sec, 128.64347 nats/event
Full model Log loss : -2.80418
Full model ln_yyx : 1811.01095 nats/sec, 128.02685 nats/event
Full model Log loss : -2.78777
Full model ln_yyx : 1818.26585 nats/sec, 128.53973 nats/event
Full model Log loss : -2.78631
Full model ln_yyx : 1817.93866 nats/sec, 128.51660 nats/event
Full model Log loss : -2.79957
Full model ln_yyx : 1815.59115 nats/sec, 128.35064 nats/event
Full model Log loss : -2.80068
Full model ln_yyx : 1823.23674 nats/sec, 128.89114 nats/event
Full model Log loss : -2.79523
Full model ln_yyx : 1824.09718 nats/sec, 128.95196 nats/event
Full model Log loss : -2.80355
Full model ln_yyx : 1821.73919 nats/sec, 128.78527 nats/event
Full model Log loss : -2.80707
Full model ln_yyx : 1818.17230 nats/sec, 128.53311 nats/event
Full model Log loss : -2.80157
Full model ln_yyx : 1826.06540 nats/sec, 129.09111 nats/event
Full model Log loss : -2.80736
Full model ln_yyx : 1825.97478 nats/sec, 129.08470 nats/event
Full model Log loss : -2.80736
Full model ln_yyx : 1810.56848 nats/sec, 127.99557 nats/event
Full model Log loss : -2.80224
Full model ln_yyx : 1826.20735 nats/sec, 129.10114 nats/event
Full model Log loss : -2.80737
Full model ln_yyx : 1813.36739 nats/sec, 128.19344 nats/event
Full model Log loss : -2.80089
Optimization finished. Config saved to results/opt-full/opt_full_1_best_config.txt
[I 2026-03-18 17:06:26,889] Trial 39 pruned. 
[I 2026-03-18 17:06:27,945] Trial 42 finished with value: -2.8016457164933684 and parameters: {'n_layers_yyx': 2, 'hidden_size_yyx_l0': 5, 'hidden_size_yyx_l1': 5, 'context_size_yyx': 2, 'num_mix_components_yyx': 3, 'context_extractor_yyx': 'lstm', 'activation_func_yyx': 'Tanh', 'L2_weight_yyx': 3.5300027357328323e-09, 'L_entropy_weight_yyx': 2.6936435310295453e-06, 'L_sep_weight_yyx': 8.877964892579801e-06, 'L_scale_weight_yyx': 5.84228630111912e-09, 'learning_rate_yyx': 0.008314165672034194}. Best is trial 5 with value: -2.805070761203844.
[I 2026-03-18 17:06:29,456] Trial 42 pruned. 
[I 2026-03-18 17:06:32,061] Trial 40 pruned. 
[I 2026-03-18 17:06:34,634] Trial 43 pruned. 
[I 2026-03-18 17:06:36,865] Trial 47 pruned. 
[I 2026-03-18 17:06:44,571] Trial 41 pruned. 
[I 2026-03-18 17:06:52,626] Trial 37 finished with value: -2.7988339378720237 and parameters: {'n_layers_yyx': 2, 'hidden_size_yyx_l0': 5, 'hidden_size_yyx_l1': 4, 'context_size_yyx': 3, 'num_mix_components_yyx': 4, 'context_extractor_yyx': 'lstm', 'activation_func_yyx': 'ReLU', 'L2_weight_yyx': 7.977052304247107e-09, 'L_entropy_weight_yyx': 1.7573655639764206e-05, 'L_sep_weight_yyx': 6.331976574079224e-06, 'L_scale_weight_yyx': 1.2236807159622333e-06, 'learning_rate_yyx': 0.009893782871945417}. Best is trial 6 with value: -2.805382927239302.
[I 2026-03-18 17:07:01,426] Trial 43 pruned. 
[I 2026-03-18 17:07:05,900] Trial 47 finished with value: -2.7992702028175933 and parameters: {'n_layers_yyx': 1, 'hidden_size_yyx_l0': 5, 'context_size_yyx': 4, 'num_mix_components_yyx': 5, 'context_extractor_yyx': 'gru', 'activation_func_yyx': 'Tanh', 'L2_weight_yyx': 3.9007434696001924e-07, 'L_entropy_weight_yyx': 4.6549012671911214e-05, 'L_sep_weight_yyx': 0.0004255612441156922, 'L_scale_weight_yyx': 1.3837039080587307e-10, 'learning_rate_yyx': 0.00750163708015177}. Best is trial 45 with value: -2.8009245027473657.
[I 2026-03-18 17:07:06,548] Trial 40 finished with value: -2.8002283644617627 and parameters: {'n_layers_yyx': 1, 'hidden_size_yyx_l0': 6, 'context_size_yyx': 3, 'num_mix_components_yyx': 3, 'context_extractor_yyx': 'gru', 'activation_func_yyx': 'ReLU', 'L2_weight_yyx': 3.601213060739176e-05, 'L_entropy_weight_yyx': 3.392377673920811e-10, 'L_sep_weight_yyx': 3.570850539132699e-08, 'L_scale_weight_yyx': 6.24558664847969e-09, 'learning_rate_yyx': 0.0063370440821122875}. Best is trial 24 with value: -2.806529472032402.
[I 2026-03-18 17:07:07,729] Trial 45 pruned. 
[I 2026-03-18 17:07:10,911] Trial 48 pruned. 
[I 2026-03-18 17:07:13,573] Trial 44 pruned. 
[I 2026-03-18 17:07:19,617] Trial 46 pruned. 
[I 2026-03-18 17:07:24,642] Trial 47 pruned. 
[I 2026-03-18 17:07:29,554] Trial 48 pruned. 
[I 2026-03-18 17:07:39,651] Trial 48 pruned. 
[I 2026-03-18 17:07:41,709] Trial 49 pruned. 

Source events: 31112
Target events: 14713
Full model ln_yyx : 2087.57078 nats/sec, 127.69753 nats/event
Full model Log loss : -2.79640
Full model ln_yyx : 2101.31627 nats/sec, 128.53834 nats/event
Full model Log loss : -2.80256
Full model ln_yyx : 2070.58955 nats/sec, 126.65878 nats/event
Full model Log loss : -2.78566
Full model ln_yyx : 2095.58272 nats/sec, 128.18762 nats/event
Full model Log loss : -2.79962
Full model ln_yyx : 2099.38645 nats/sec, 128.42030 nats/event
Full model Log loss : -2.80737
Full model ln_yyx : 2093.84988 nats/sec, 128.08162 nats/event
Full model Log loss : -2.80405
Full model ln_yyx : 2092.98302 nats/sec, 128.02860 nats/event
Full model Log loss : -2.79736
Full model ln_yyx : 2079.92646 nats/sec, 127.22992 nats/event
Full model Log loss : -2.78320
Full model ln_yyx : 2097.65931 nats/sec, 128.31465 nats/event
Full model Log loss : -2.80314
Full model ln_yyx : 2117.25609 nats/sec, 129.51339 nats/event
Full model Log loss : -2.80546
Full model ln_yyx : 2101.21653 nats/sec, 128.53224 nats/event
Full model Log loss : -2.80264
Optimization finished. Config saved to results/opt-full/opt_full_2_best_config.txt
[I 2026-03-18 17:07:44,868] Trial 49 pruned. 

Source events: 31112
Target events: 29032
Full model ln_yyx : 4130.21610 nats/sec, 128.03784 nats/event
Full model Log loss : -2.79225
Full model ln_yyx : 4123.79545 nats/sec, 127.83880 nats/event
Full model Log loss : -2.78891
Full model ln_yyx : 3887.46801 nats/sec, 120.51258 nats/event
Full model Log loss : -2.65369
Full model ln_yyx : 4068.24632 nats/sec, 126.11676 nats/event
Full model Log loss : -2.76525
Full model ln_yyx : 4063.79122 nats/sec, 125.97865 nats/event
Full model Log loss : -2.77858
Full model ln_yyx : 4158.75786 nats/sec, 128.92264 nats/event
Full model Log loss : -2.80295
Full model ln_yyx : 4163.30615 nats/sec, 129.06364 nats/event
Full model Log loss : -2.80847
Full model ln_yyx : 4156.43465 nats/sec, 128.85062 nats/event
Full model Log loss : -2.80277
Full model ln_yyx : 4136.23161 nats/sec, 128.22432 nats/event
Full model Log loss : -2.80560
Full model ln_yyx : 4152.89076 nats/sec, 128.74076 nats/event
Full model Log loss : -2.80226
Full model ln_yyx : 4160.62705 nats/sec, 128.98058 nats/event
Full model Log loss : -2.80236
Full model ln_yyx : 4154.21871 nats/sec, 128.78192 nats/event
Full model Log loss : -2.80719
Full model ln_yyx : 4149.43338 nats/sec, 128.63358 nats/event
Full model Log loss : -2.80737
Optimization finished. Config saved to results/opt-full/opt_full_4_best_config.txt
[I 2026-03-18 17:07:55,963] Trial 44 finished with value: -2.8067996499971875 and parameters: {'n_layers_yyx': 2, 'hidden_size_yyx_l0': 4, 'hidden_size_yyx_l1': 4, 'context_size_yyx': 4, 'num_mix_components_yyx': 5, 'context_extractor_yyx': 'lstm', 'activation_func_yyx': 'Tanh', 'L2_weight_yyx': 1.1733754106738027e-06, 'L_entropy_weight_yyx': 0.00044723123647516684, 'L_sep_weight_yyx': 7.921142201519912e-05, 'L_scale_weight_yyx': 9.926674822910852e-05, 'learning_rate_yyx': 0.008675829017764359}. Best is trial 44 with value: -2.8067996499971875.
[I 2026-03-18 17:08:08,237] Trial 45 pruned. 
[I 2026-03-18 17:08:13,485] Trial 46 pruned. 
[I 2026-03-18 17:08:13,751] Trial 49 pruned. 

Source events: 31112
Target events: 11540
Full model ln_yyx : 1605.48331 nats/sec, 125.21100 nats/event
Full model Log loss : -2.75602
Full model ln_yyx : 1647.86340 nats/sec, 128.51621 nats/event
Full model Log loss : -2.79479
Full model ln_yyx : 1654.72478 nats/sec, 129.05133 nats/event
Full model Log loss : -2.79142
Full model ln_yyx : 1640.56618 nats/sec, 127.94710 nats/event
Full model Log loss : -2.78357
Full model ln_yyx : 1644.24550 nats/sec, 128.23405 nats/event
Full model Log loss : -2.79441
Full model ln_yyx : 1646.43766 nats/sec, 128.40502 nats/event
Full model Log loss : -2.79128
Full model ln_yyx : 1660.53035 nats/sec, 129.50410 nats/event
Full model Log loss : -2.79959
Full model ln_yyx : 1646.46324 nats/sec, 128.40701 nats/event
Full model Log loss : -2.79693
Full model ln_yyx : 1654.48177 nats/sec, 129.03237 nats/event
Full model Log loss : -2.79208
Full model ln_yyx : 1659.39751 nats/sec, 129.41575 nats/event
Full model Log loss : -2.79869
Full model ln_yyx : 1646.67505 nats/sec, 128.42353 nats/event
Full model Log loss : -2.79558
Full model ln_yyx : 1654.30257 nats/sec, 129.01840 nats/event
Full model Log loss : -2.79954
Full model ln_yyx : 1646.84301 nats/sec, 128.43663 nats/event
Full model Log loss : -2.79563
Full model ln_yyx : 1657.30866 nats/sec, 129.25284 nats/event
Full model Log loss : -2.80092
Full model ln_yyx : 1648.64809 nats/sec, 128.57741 nats/event
Full model Log loss : -2.79927
Optimization finished. Config saved to results/opt-full/opt_full_15_best_config.txt
[I 2026-03-18 17:08:15,439] Trial 42 finished with value: -2.784642221454628 and parameters: {'n_layers_yyx': 2, 'hidden_size_yyx_l0': 4, 'hidden_size_yyx_l1': 6, 'context_size_yyx': 3, 'num_mix_components_yyx': 1, 'context_extractor_yyx': 'gru', 'activation_func_yyx': 'Tanh', 'L2_weight_yyx': 1.4616983615699335e-06, 'L_entropy_weight_yyx': 2.8722667529411704e-09, 'L_sep_weight_yyx': 1.738168677161662e-09, 'L_scale_weight_yyx': 1.5953300926655497e-08, 'learning_rate_yyx': 0.007030716614771418}. Best is trial 21 with value: -2.786583013031271.
[I 2026-03-18 17:08:24,918] Trial 47 pruned. 
[I 2026-03-18 17:08:27,418] Trial 43 pruned. 
[I 2026-03-18 17:08:30,054] Trial 48 pruned. 
[I 2026-03-18 17:08:34,900] Trial 38 finished with value: -2.794122035794827 and parameters: {'n_layers_yyx': 2, 'hidden_size_yyx_l0': 4, 'hidden_size_yyx_l1': 5, 'context_size_yyx': 1, 'num_mix_components_yyx': 5, 'context_extractor_yyx': 'lstm', 'activation_func_yyx': 'ReLU', 'L2_weight_yyx': 7.430205640177437e-08, 'L_entropy_weight_yyx': 9.992796465506082e-07, 'L_sep_weight_yyx': 2.5970506401841437e-05, 'L_scale_weight_yyx': 3.526886679558542e-07, 'learning_rate_yyx': 0.008076122168134062}. Best is trial 6 with value: -2.805382927239302.
[I 2026-03-18 17:08:36,833] Trial 41 finished with value: -2.8074335121698404 and parameters: {'n_layers_yyx': 1, 'hidden_size_yyx_l0': 6, 'context_size_yyx': 3, 'num_mix_components_yyx': 3, 'context_extractor_yyx': 'lstm', 'activation_func_yyx': 'Tanh', 'L2_weight_yyx': 0.00022384420087120179, 'L_entropy_weight_yyx': 2.4179739441373487e-10, 'L_sep_weight_yyx': 1.2884061366093028e-06, 'L_scale_weight_yyx': 1.9762387187382385e-08, 'learning_rate_yyx': 0.009016650386000802}. Best is trial 41 with value: -2.8074335121698404.
[I 2026-03-18 17:08:37,183] Trial 45 finished with value: -2.804040049616475 and parameters: {'n_layers_yyx': 2, 'hidden_size_yyx_l0': 6, 'hidden_size_yyx_l1': 5, 'context_size_yyx': 3, 'num_mix_components_yyx': 3, 'context_extractor_yyx': 'lstm', 'activation_func_yyx': 'Tanh', 'L2_weight_yyx': 3.803136101396857e-10, 'L_entropy_weight_yyx': 1.0133819446344046e-07, 'L_sep_weight_yyx': 6.265942546937936e-07, 'L_scale_weight_yyx': 2.0955484799232092e-10, 'learning_rate_yyx': 0.008902716925889276}. Best is trial 5 with value: -2.805070761203844.
[I 2026-03-18 17:08:39,287] Trial 44 pruned. 
[I 2026-03-18 17:08:40,071] Trial 39 pruned. 
[I 2026-03-18 17:08:44,405] Trial 45 pruned. 
[I 2026-03-18 17:08:51,667] Trial 40 pruned. 
[I 2026-03-18 17:09:01,354] Trial 49 pruned. 

Source events: 31112
Target events: 27060
Full model ln_yyx : 3833.76856 nats/sec, 127.50893 nats/event
Full model Log loss : -2.79015
Full model ln_yyx : 3882.61254 nats/sec, 129.13345 nats/event
Full model Log loss : -2.80377
Full model ln_yyx : 3831.96753 nats/sec, 127.44903 nats/event
Full model Log loss : -2.79206
Full model ln_yyx : 3867.76502 nats/sec, 128.63963 nats/event
Full model Log loss : -2.80582
Full model ln_yyx : 3856.13859 nats/sec, 128.25295 nats/event
Full model Log loss : -2.80370
Full model ln_yyx : 3868.86012 nats/sec, 128.67606 nats/event
Full model Log loss : -2.80395
Full model ln_yyx : 3849.16641 nats/sec, 128.02106 nats/event
Full model Log loss : -2.79768
Full model ln_yyx : 3894.61077 nats/sec, 129.53251 nats/event
Full model Log loss : -2.80211
Full model ln_yyx : 3890.67458 nats/sec, 129.40159 nats/event
Full model Log loss : -2.80239
Full model ln_yyx : 3850.96743 nats/sec, 128.08096 nats/event
Full model Log loss : -2.80450
Full model ln_yyx : 3841.21410 nats/sec, 127.75657 nats/event
Full model Log loss : -2.80446
Full model ln_yyx : 3842.19815 nats/sec, 127.78930 nats/event
Full model Log loss : -2.80418
Full model ln_yyx : 3867.03256 nats/sec, 128.61527 nats/event
Full model Log loss : -2.80234
Full model ln_yyx : 3866.34726 nats/sec, 128.59248 nats/event
Full model Log loss : -2.80484
Full model ln_yyx : 3860.86621 nats/sec, 128.41018 nats/event
Full model Log loss : -2.80571
Full model ln_yyx : 3881.86467 nats/sec, 129.10858 nats/event
Full model Log loss : -2.80680
Optimization finished. Config saved to results/opt-full/opt_full_7_best_config.txt
[I 2026-03-18 17:09:17,351] Trial 46 pruned. 
[I 2026-03-18 17:09:22,353] Trial 47 pruned. 
