[I 2026-03-18 16:56:38,826] Trial 36 pruned. 
[I 2026-03-18 16:56:45,765] Trial 27 pruned. 
[I 2026-03-18 16:56:47,370] Trial 44 finished with value: -2.806502993768921 and parameters: {'n_layers_yyx': 1, 'hidden_size_yyx_l0': 6, 'context_size_yyx': 4, 'num_mix_components_yyx': 1, 'context_extractor_yyx': 'lstm', 'activation_func_yyx': 'ReLU', 'L2_weight_yyx': 4.5373641622532113e-08, 'L_entropy_weight_yyx': 7.34439145036521e-07, 'L_sep_weight_yyx': 1.054506220961291e-09, 'L_scale_weight_yyx': 5.548939975585156e-07, 'learning_rate_yyx': 0.007076757281031916}. Best is trial 13 with value: -2.8082553050147787.
[I 2026-03-18 16:56:49,229] Trial 47 pruned. 
[I 2026-03-18 16:56:55,730] Trial 31 finished with value: -2.802554554652886 and parameters: {'n_layers_yyx': 2, 'hidden_size_yyx_l0': 4, 'hidden_size_yyx_l1': 5, 'context_size_yyx': 4, 'num_mix_components_yyx': 4, 'context_extractor_yyx': 'lstm', 'activation_func_yyx': 'Tanh', 'L2_weight_yyx': 3.894396634355343e-06, 'L_entropy_weight_yyx': 0.00012026861323393052, 'L_sep_weight_yyx': 8.215471051807308e-10, 'L_scale_weight_yyx': 0.0006801810590140868, 'learning_rate_yyx': 0.00493896006490575}. Best is trial 5 with value: -2.8051328142627483.
[I 2026-03-18 16:56:56,377] Trial 41 finished with value: -2.7979303694211133 and parameters: {'n_layers_yyx': 1, 'hidden_size_yyx_l0': 5, 'context_size_yyx': 4, 'num_mix_components_yyx': 3, 'context_extractor_yyx': 'lstm', 'activation_func_yyx': 'Tanh', 'L2_weight_yyx': 0.00030375225725165576, 'L_entropy_weight_yyx': 8.625301798251603e-07, 'L_sep_weight_yyx': 1.6725420386094377e-10, 'L_scale_weight_yyx': 0.0001823670545639816, 'learning_rate_yyx': 0.007910129203029068}. Best is trial 41 with value: -2.7979303694211133.
[I 2026-03-18 16:57:00,437] Trial 24 finished with value: -2.806529472032402 and parameters: {'n_layers_yyx': 2, 'hidden_size_yyx_l0': 5, 'hidden_size_yyx_l1': 5, 'context_size_yyx': 3, 'num_mix_components_yyx': 3, 'context_extractor_yyx': 'lstm', 'activation_func_yyx': 'Tanh', 'L2_weight_yyx': 0.0002638057742246434, 'L_entropy_weight_yyx': 1.1461424004968227e-10, 'L_sep_weight_yyx': 0.0001695896140652463, 'L_scale_weight_yyx': 4.946861499682392e-09, 'learning_rate_yyx': 0.007627415607385959}. Best is trial 24 with value: -2.806529472032402.
[I 2026-03-18 16:57:02,505] Trial 33 pruned. 
[I 2026-03-18 16:57:05,069] Trial 34 pruned. 
[I 2026-03-18 16:57:10,583] Trial 32 pruned. 
[I 2026-03-18 16:57:10,779] Trial 36 finished with value: -2.8014575207297803 and parameters: {'n_layers_yyx': 2, 'hidden_size_yyx_l0': 6, 'hidden_size_yyx_l1': 6, 'context_size_yyx': 4, 'num_mix_components_yyx': 1, 'context_extractor_yyx': 'lstm', 'activation_func_yyx': 'ReLU', 'L2_weight_yyx': 1.3543260493939767e-06, 'L_entropy_weight_yyx': 5.534225492772109e-09, 'L_sep_weight_yyx': 1.5540134958870918e-07, 'L_scale_weight_yyx': 4.756809952213623e-10, 'learning_rate_yyx': 0.00275589637166069}. Best is trial 0 with value: -2.8067502106217272.
[I 2026-03-18 16:57:16,824] Trial 37 pruned. 
[I 2026-03-18 16:57:18,479] Trial 35 pruned. 
[I 2026-03-18 16:57:24,857] Trial 33 pruned. 
[I 2026-03-18 16:57:26,366] Trial 48 pruned. 
[I 2026-03-18 16:57:30,476] Trial 38 pruned. 
[I 2026-03-18 16:57:30,931] Trial 34 pruned. 
[I 2026-03-18 16:57:32,192] Trial 28 finished with value: -2.7890431437354257 and parameters: {'n_layers_yyx': 2, 'hidden_size_yyx_l0': 6, 'hidden_size_yyx_l1': 2, 'context_size_yyx': 4, 'num_mix_components_yyx': 5, 'context_extractor_yyx': 'lstm', 'activation_func_yyx': 'Tanh', 'L2_weight_yyx': 3.734499403920363e-10, 'L_entropy_weight_yyx': 4.810797164821424e-10, 'L_sep_weight_yyx': 3.927590660664159e-09, 'L_scale_weight_yyx': 0.0008354939689172519, 'learning_rate_yyx': 0.009295415570021871}. Best is trial 6 with value: -2.805382927239302.
[I 2026-03-18 16:57:33,258] Trial 36 pruned. 
[I 2026-03-18 16:57:38,963] Trial 37 pruned. 
[I 2026-03-18 16:57:40,585] Trial 49 pruned. 

Source events: 31112
Target events: 9421
Full model ln_yyx : 1329.23223 nats/sec, 126.98323 nats/event
Full model Log loss : -2.78047
Full model ln_yyx : 1332.06758 nats/sec, 127.25409 nats/event
Full model Log loss : -2.77030
Full model ln_yyx : 1342.45898 nats/sec, 128.24680 nats/event
Full model Log loss : -2.78249
Full model ln_yyx : 1346.98814 nats/sec, 128.67947 nats/event
Full model Log loss : -2.79270
Full model ln_yyx : 1348.98382 nats/sec, 128.87012 nats/event
Full model Log loss : -2.79572
Full model ln_yyx : 1347.75127 nats/sec, 128.75238 nats/event
Full model Log loss : -2.79147
Full model ln_yyx : 1341.77319 nats/sec, 128.18128 nats/event
Full model Log loss : -2.79631
Full model ln_yyx : 1352.48060 nats/sec, 129.20418 nats/event
Full model Log loss : -2.79877
Full model ln_yyx : 1354.69358 nats/sec, 129.41558 nats/event
Full model Log loss : -2.79658
Full model ln_yyx : 1349.72271 nats/sec, 128.94071 nats/event
Full model Log loss : -2.79268
Full model ln_yyx : 1353.89908 nats/sec, 129.33968 nats/event
Full model Log loss : -2.79430
Full model ln_yyx : 1351.58268 nats/sec, 129.11840 nats/event
Full model Log loss : -2.79302
Optimization finished. Config saved to results/opt-full/opt_full_13_best_config.txt
[I 2026-03-18 16:57:41,318] Trial 31 finished with value: -2.8023617677140473 and parameters: {'n_layers_yyx': 2, 'hidden_size_yyx_l0': 2, 'hidden_size_yyx_l1': 6, 'context_size_yyx': 4, 'num_mix_components_yyx': 3, 'context_extractor_yyx': 'lstm', 'activation_func_yyx': 'Tanh', 'L2_weight_yyx': 3.547787250833316e-09, 'L_entropy_weight_yyx': 3.8339350051670375e-08, 'L_sep_weight_yyx': 1.5912028654996088e-07, 'L_scale_weight_yyx': 1.2261457863377353e-10, 'learning_rate_yyx': 0.003798641662060846}. Best is trial 9 with value: -2.8084722793451675.
[I 2026-03-18 16:57:44,095] Trial 26 finished with value: -2.7859203514450774 and parameters: {'n_layers_yyx': 2, 'hidden_size_yyx_l0': 4, 'hidden_size_yyx_l1': 5, 'context_size_yyx': 3, 'num_mix_components_yyx': 2, 'context_extractor_yyx': 'lstm', 'activation_func_yyx': 'Tanh', 'L2_weight_yyx': 3.9259891633444105e-05, 'L_entropy_weight_yyx': 7.159505172892638e-10, 'L_sep_weight_yyx': 2.312649684398847e-08, 'L_scale_weight_yyx': 3.3092167636770435e-07, 'learning_rate_yyx': 0.009718668485745423}. Best is trial 21 with value: -2.786583013031271.
[I 2026-03-18 16:57:44,958] Trial 38 pruned. 
[I 2026-03-18 16:57:45,064] Trial 38 pruned. 
[I 2026-03-18 16:57:45,235] Trial 35 pruned. 
[I 2026-03-18 16:57:51,148] Trial 45 finished with value: -2.8054103136569815 and parameters: {'n_layers_yyx': 1, 'hidden_size_yyx_l0': 6, 'context_size_yyx': 4, 'num_mix_components_yyx': 1, 'context_extractor_yyx': 'lstm', 'activation_func_yyx': 'Tanh', 'L2_weight_yyx': 3.947359551901709e-08, 'L_entropy_weight_yyx': 3.901396550049078e-07, 'L_sep_weight_yyx': 8.403295070493413e-09, 'L_scale_weight_yyx': 0.0009982237285038587, 'learning_rate_yyx': 0.008958717668160766}. Best is trial 13 with value: -2.8082553050147787.
[I 2026-03-18 16:57:56,530] Trial 25 finished with value: -2.8023396590165275 and parameters: {'n_layers_yyx': 2, 'hidden_size_yyx_l0': 4, 'hidden_size_yyx_l1': 5, 'context_size_yyx': 3, 'num_mix_components_yyx': 5, 'context_extractor_yyx': 'lstm', 'activation_func_yyx': 'Tanh', 'L2_weight_yyx': 2.0939738915557502e-05, 'L_entropy_weight_yyx': 1.1786738258418818e-05, 'L_sep_weight_yyx': 0.0003388683441677978, 'L_scale_weight_yyx': 0.00047043321923860955, 'learning_rate_yyx': 0.007677593842479643}. Best is trial 5 with value: -2.8058216093098.
[I 2026-03-18 16:57:58,379] Trial 39 pruned. 
[I 2026-03-18 16:57:59,367] Trial 36 pruned. 
[I 2026-03-18 16:57:59,387] Trial 39 pruned. 
[I 2026-03-18 16:58:02,372] Trial 26 pruned. 
[I 2026-03-18 16:58:03,871] Trial 27 finished with value: -2.805455058788711 and parameters: {'n_layers_yyx': 1, 'hidden_size_yyx_l0': 5, 'context_size_yyx': 4, 'num_mix_components_yyx': 2, 'context_extractor_yyx': 'lstm', 'activation_func_yyx': 'ReLU', 'L2_weight_yyx': 3.0707478677159476e-10, 'L_entropy_weight_yyx': 1.7357390525003535e-07, 'L_sep_weight_yyx': 1.7432945480795687e-08, 'L_scale_weight_yyx': 0.0002927977796413093, 'learning_rate_yyx': 0.0030386993684568737}. Best is trial 7 with value: -2.8073737460176833.
[I 2026-03-18 16:58:05,043] Trial 25 finished with value: -2.801874004242168 and parameters: {'n_layers_yyx': 2, 'hidden_size_yyx_l0': 5, 'hidden_size_yyx_l1': 5, 'context_size_yyx': 3, 'num_mix_components_yyx': 2, 'context_extractor_yyx': 'lstm', 'activation_func_yyx': 'Tanh', 'L2_weight_yyx': 5.607148584192093e-05, 'L_entropy_weight_yyx': 2.4385108987449777e-10, 'L_sep_weight_yyx': 0.0002951882565366728, 'L_scale_weight_yyx': 4.1089451620218125e-09, 'learning_rate_yyx': 0.009878759093505492}. Best is trial 24 with value: -2.806529472032402.
[I 2026-03-18 16:58:05,145] Trial 37 pruned. 
[I 2026-03-18 16:58:11,125] Trial 38 pruned. 
[I 2026-03-18 16:58:16,452] Trial 27 pruned. 
[I 2026-03-18 16:58:17,008] Trial 39 pruned. 
[I 2026-03-18 16:58:22,389] Trial 34 finished with value: -2.802237404405222 and parameters: {'n_layers_yyx': 1, 'hidden_size_yyx_l0': 3, 'context_size_yyx': 4, 'num_mix_components_yyx': 4, 'context_extractor_yyx': 'lstm', 'activation_func_yyx': 'ReLU', 'L2_weight_yyx': 2.4657992022498928e-08, 'L_entropy_weight_yyx': 4.632218544380629e-06, 'L_sep_weight_yyx': 2.2754022662980315e-09, 'L_scale_weight_yyx': 1.5947397329078453e-06, 'learning_rate_yyx': 0.0067807658668665475}. Best is trial 32 with value: -2.8073595833844704.
[I 2026-03-18 16:58:23,024] Trial 40 pruned. 
[I 2026-03-18 16:58:27,869] Trial 35 pruned. 
[I 2026-03-18 16:58:30,443] Trial 28 pruned. 
[I 2026-03-18 16:58:35,285] Trial 37 pruned. 
[I 2026-03-18 16:58:36,767] Trial 40 pruned. 
[I 2026-03-18 16:58:36,887] Trial 29 finished with value: -2.8004279032878725 and parameters: {'n_layers_yyx': 2, 'hidden_size_yyx_l0': 6, 'hidden_size_yyx_l1': 3, 'context_size_yyx': 4, 'num_mix_components_yyx': 5, 'context_extractor_yyx': 'lstm', 'activation_func_yyx': 'GELU', 'L2_weight_yyx': 1.6890584469725234e-09, 'L_entropy_weight_yyx': 5.418980990377754e-09, 'L_sep_weight_yyx': 3.1838580318968893e-06, 'L_scale_weight_yyx': 9.561192517144045e-05, 'learning_rate_yyx': 0.0074945213476604235}. Best is trial 6 with value: -2.805382927239302.
[I 2026-03-18 16:58:41,485] Trial 28 pruned. 
[I 2026-03-18 16:58:47,655] Trial 42 finished with value: -2.7974416458873725 and parameters: {'n_layers_yyx': 1, 'hidden_size_yyx_l0': 5, 'context_size_yyx': 4, 'num_mix_components_yyx': 4, 'context_extractor_yyx': 'lstm', 'activation_func_yyx': 'Tanh', 'L2_weight_yyx': 0.0002744960452114439, 'L_entropy_weight_yyx': 5.108411885708393e-07, 'L_sep_weight_yyx': 1.015235911659051e-09, 'L_scale_weight_yyx': 0.00016971455949230368, 'learning_rate_yyx': 0.008212698337123058}. Best is trial 41 with value: -2.7979303694211133.
[I 2026-03-18 16:58:49,117] Trial 38 pruned. 
[I 2026-03-18 16:58:52,784] Trial 37 finished with value: -2.796764404134978 and parameters: {'n_layers_yyx': 1, 'hidden_size_yyx_l0': 4, 'context_size_yyx': 4, 'num_mix_components_yyx': 4, 'context_extractor_yyx': 'lstm', 'activation_func_yyx': 'GELU', 'L2_weight_yyx': 1.111862345068173e-07, 'L_entropy_weight_yyx': 1.3856566223418713e-09, 'L_sep_weight_yyx': 3.3284560621188033e-07, 'L_scale_weight_yyx': 9.609344859486642e-08, 'learning_rate_yyx': 0.008941851131131417}. Best is trial 37 with value: -2.796764404134978.
[I 2026-03-18 16:58:54,721] Trial 46 finished with value: -2.805319804642755 and parameters: {'n_layers_yyx': 1, 'hidden_size_yyx_l0': 6, 'context_size_yyx': 4, 'num_mix_components_yyx': 1, 'context_extractor_yyx': 'lstm', 'activation_func_yyx': 'Tanh', 'L2_weight_yyx': 5.969886047775344e-08, 'L_entropy_weight_yyx': 5.066954849281921e-07, 'L_sep_weight_yyx': 7.110063423746214e-09, 'L_scale_weight_yyx': 6.255875632622292e-05, 'learning_rate_yyx': 0.008788829407049137}. Best is trial 13 with value: -2.8082553050147787.
[I 2026-03-18 16:58:58,640] Trial 38 pruned. 
[I 2026-03-18 16:58:59,923] Trial 39 finished with value: -2.8011782032400587 and parameters: {'n_layers_yyx': 2, 'hidden_size_yyx_l0': 4, 'hidden_size_yyx_l1': 5, 'context_size_yyx': 4, 'num_mix_components_yyx': 2, 'context_extractor_yyx': 'gru', 'activation_func_yyx': 'ReLU', 'L2_weight_yyx': 5.930041247308266e-07, 'L_entropy_weight_yyx': 1.009282194395621e-07, 'L_sep_weight_yyx': 1.1025785840958702e-08, 'L_scale_weight_yyx': 5.274895472292088e-07, 'learning_rate_yyx': 0.006586393770571513}. Best is trial 0 with value: -2.8067502106217272.
[I 2026-03-18 16:59:05,811] Trial 40 pruned. 
[I 2026-03-18 16:59:05,917] Trial 36 pruned. 
[I 2026-03-18 16:59:06,062] Trial 27 finished with value: -2.777335728178362 and parameters: {'n_layers_yyx': 2, 'hidden_size_yyx_l0': 4, 'hidden_size_yyx_l1': 5, 'context_size_yyx': 2, 'num_mix_components_yyx': 2, 'context_extractor_yyx': 'lstm', 'activation_func_yyx': 'Tanh', 'L2_weight_yyx': 2.7670164493364548e-05, 'L_entropy_weight_yyx': 1.292657274245462e-08, 'L_sep_weight_yyx': 1.2138846565207169e-07, 'L_scale_weight_yyx': 2.793520677261685e-07, 'learning_rate_yyx': 0.007142258112402276}. Best is trial 21 with value: -2.786583013031271.
[I 2026-03-18 16:59:11,417] Trial 41 pruned. 
[I 2026-03-18 16:59:12,209] Trial 39 pruned. 
[I 2026-03-18 16:59:14,498] Trial 30 pruned. 
[I 2026-03-18 16:59:14,508] Trial 41 pruned. 
[I 2026-03-18 16:59:18,729] Trial 29 pruned. 
[I 2026-03-18 16:59:22,473] Trial 32 finished with value: -2.8071907109669234 and parameters: {'n_layers_yyx': 2, 'hidden_size_yyx_l0': 2, 'hidden_size_yyx_l1': 6, 'context_size_yyx': 4, 'num_mix_components_yyx': 3, 'context_extractor_yyx': 'lstm', 'activation_func_yyx': 'Tanh', 'L2_weight_yyx': 1.1705999851818935e-08, 'L_entropy_weight_yyx': 2.684700692884646e-08, 'L_sep_weight_yyx': 1.006637112884477e-06, 'L_scale_weight_yyx': 3.409205168528526e-10, 'learning_rate_yyx': 0.006172540553644353}. Best is trial 9 with value: -2.8084722793451675.
[I 2026-03-18 16:59:24,319] Trial 43 pruned. 
[I 2026-03-18 16:59:24,365] Trial 30 pruned. 
[I 2026-03-18 16:59:25,351] Trial 42 pruned. 
[I 2026-03-18 16:59:27,425] Trial 26 finished with value: -2.802098289695946 and parameters: {'n_layers_yyx': 2, 'hidden_size_yyx_l0': 5, 'hidden_size_yyx_l1': 5, 'context_size_yyx': 2, 'num_mix_components_yyx': 2, 'context_extractor_yyx': 'lstm', 'activation_func_yyx': 'Tanh', 'L2_weight_yyx': 0.00029881956270340105, 'L_entropy_weight_yyx': 1.4149995303909012e-10, 'L_sep_weight_yyx': 1.0586996932483877e-05, 'L_scale_weight_yyx': 6.586546893636048e-08, 'learning_rate_yyx': 0.009927190087856202}. Best is trial 24 with value: -2.806529472032402.
[I 2026-03-18 16:59:30,102] Trial 31 pruned. 
[I 2026-03-18 16:59:31,225] Trial 43 pruned. 
[I 2026-03-18 16:59:35,846] Trial 32 pruned. 
[I 2026-03-18 16:59:37,101] Trial 44 pruned. 
[I 2026-03-18 16:59:41,337] Trial 40 pruned. 
[I 2026-03-18 16:59:41,486] Trial 27 pruned. 
[I 2026-03-18 16:59:41,766] Trial 33 pruned. 
[I 2026-03-18 16:59:43,665] Trial 41 finished with value: -2.802406864397871 and parameters: {'n_layers_yyx': 2, 'hidden_size_yyx_l0': 4, 'hidden_size_yyx_l1': 5, 'context_size_yyx': 4, 'num_mix_components_yyx': 4, 'context_extractor_yyx': 'lstm', 'activation_func_yyx': 'Tanh', 'L2_weight_yyx': 4.7349567674419665e-06, 'L_entropy_weight_yyx': 0.00021252872022959596, 'L_sep_weight_yyx': 1.1289393332721668e-09, 'L_scale_weight_yyx': 0.0008121855505779027, 'learning_rate_yyx': 0.004695942665444633}. Best is trial 5 with value: -2.8051328142627483.
[I 2026-03-18 16:59:43,719] Trial 37 pruned. 
[I 2026-03-18 16:59:49,551] Trial 38 pruned. 
[I 2026-03-18 16:59:50,692] Trial 40 pruned. 
[I 2026-03-18 16:59:53,175] Trial 42 pruned. 
[I 2026-03-18 16:59:55,935] Trial 28 pruned. 
[I 2026-03-18 16:59:58,052] Trial 47 finished with value: -2.8053490288069156 and parameters: {'n_layers_yyx': 1, 'hidden_size_yyx_l0': 6, 'context_size_yyx': 4, 'num_mix_components_yyx': 1, 'context_extractor_yyx': 'lstm', 'activation_func_yyx': 'Tanh', 'L2_weight_yyx': 4.1481442849174585e-08, 'L_entropy_weight_yyx': 6.87118391515102e-07, 'L_sep_weight_yyx': 8.869580122782827e-09, 'L_scale_weight_yyx': 0.0008345248813493411, 'learning_rate_yyx': 0.008812051204822218}. Best is trial 13 with value: -2.8082553050147787.
[I 2026-03-18 17:00:01,362] Trial 39 finished with value: -2.7986918660736335 and parameters: {'n_layers_yyx': 1, 'hidden_size_yyx_l0': 6, 'context_size_yyx': 4, 'num_mix_components_yyx': 4, 'context_extractor_yyx': 'lstm', 'activation_func_yyx': 'Tanh', 'L2_weight_yyx': 1.9532656216861458e-08, 'L_entropy_weight_yyx': 7.165722657503416e-05, 'L_sep_weight_yyx': 0.0004183307276052536, 'L_scale_weight_yyx': 6.73403883802962e-07, 'learning_rate_yyx': 0.0065317542384198376}. Best is trial 14 with value: -2.7995943704403503.
[I 2026-03-18 17:00:06,868] Trial 43 pruned. 
[I 2026-03-18 17:00:09,930] Trial 29 pruned. 
[I 2026-03-18 17:00:11,636] Trial 28 finished with value: -2.7836583404439086 and parameters: {'n_layers_yyx': 2, 'hidden_size_yyx_l0': 5, 'hidden_size_yyx_l1': 5, 'context_size_yyx': 3, 'num_mix_components_yyx': 2, 'context_extractor_yyx': 'lstm', 'activation_func_yyx': 'Tanh', 'L2_weight_yyx': 9.221399212322494e-05, 'L_entropy_weight_yyx': 1.2896185828625417e-09, 'L_sep_weight_yyx': 1.7962216162420578e-08, 'L_scale_weight_yyx': 6.612380581123685e-06, 'learning_rate_yyx': 0.005750956077569564}. Best is trial 21 with value: -2.786583013031271.
[I 2026-03-18 17:00:15,459] Trial 28 finished with value: -2.8006749706727425 and parameters: {'n_layers_yyx': 1, 'hidden_size_yyx_l0': 4, 'context_size_yyx': 3, 'num_mix_components_yyx': 3, 'context_extractor_yyx': 'gru', 'activation_func_yyx': 'GELU', 'L2_weight_yyx': 5.231092947238904e-10, 'L_entropy_weight_yyx': 6.260112095882775e-08, 'L_sep_weight_yyx': 1.2692365726550383e-06, 'L_scale_weight_yyx': 0.0009965626240479371, 'learning_rate_yyx': 0.0015957874411917177}. Best is trial 5 with value: -2.805070761203844.
[I 2026-03-18 17:00:16,392] Trial 30 pruned. 
[I 2026-03-18 17:00:20,043] Trial 34 pruned. 
[I 2026-03-18 17:00:21,465] Trial 29 pruned. 
[I 2026-03-18 17:00:21,967] Trial 29 pruned. 
[I 2026-03-18 17:00:27,229] Trial 30 pruned. 
[I 2026-03-18 17:00:27,559] Trial 39 pruned. 
[I 2026-03-18 17:00:27,902] Trial 30 pruned. 
[I 2026-03-18 17:00:33,291] Trial 31 pruned. 
[I 2026-03-18 17:00:33,459] Trial 40 pruned. 
[I 2026-03-18 17:00:33,723] Trial 35 pruned. 
[I 2026-03-18 17:00:39,905] Trial 40 pruned. 
[I 2026-03-18 17:00:40,924] Trial 44 finished with value: -2.799169708774652 and parameters: {'n_layers_yyx': 1, 'hidden_size_yyx_l0': 5, 'context_size_yyx': 4, 'num_mix_components_yyx': 4, 'context_extractor_yyx': 'lstm', 'activation_func_yyx': 'Tanh', 'L2_weight_yyx': 3.645785436554307e-05, 'L_entropy_weight_yyx': 2.1948626705654464e-06, 'L_sep_weight_yyx': 2.536446397148159e-10, 'L_scale_weight_yyx': 2.2036575668770987e-05, 'learning_rate_yyx': 0.009898515165348743}. Best is trial 44 with value: -2.799169708774652.
[I 2026-03-18 17:00:41,248] Trial 31 finished with value: -2.80386722585297 and parameters: {'n_layers_yyx': 2, 'hidden_size_yyx_l0': 5, 'hidden_size_yyx_l1': 3, 'context_size_yyx': 4, 'num_mix_components_yyx': 5, 'context_extractor_yyx': 'lstm', 'activation_func_yyx': 'ReLU', 'L2_weight_yyx': 4.609712411283837e-10, 'L_entropy_weight_yyx': 3.4625309952368234e-07, 'L_sep_weight_yyx': 8.039574089934866e-07, 'L_scale_weight_yyx': 0.00013466328871856385, 'learning_rate_yyx': 0.005395143368542406}. Best is trial 6 with value: -2.805382927239302.
[I 2026-03-18 17:01:02,305] Trial 48 finished with value: -2.8055184410668264 and parameters: {'n_layers_yyx': 1, 'hidden_size_yyx_l0': 6, 'context_size_yyx': 4, 'num_mix_components_yyx': 1, 'context_extractor_yyx': 'lstm', 'activation_func_yyx': 'Tanh', 'L2_weight_yyx': 6.664051236070386e-08, 'L_entropy_weight_yyx': 7.942414734095649e-07, 'L_sep_weight_yyx': 7.282427357704653e-08, 'L_scale_weight_yyx': 0.0007732993968364854, 'learning_rate_yyx': 0.009311747710077494}. Best is trial 13 with value: -2.8082553050147787.
[I 2026-03-18 17:01:04,207] Trial 42 finished with value: -2.803477012802039 and parameters: {'n_layers_yyx': 2, 'hidden_size_yyx_l0': 4, 'hidden_size_yyx_l1': 5, 'context_size_yyx': 4, 'num_mix_components_yyx': 4, 'context_extractor_yyx': 'lstm', 'activation_func_yyx': 'Tanh', 'L2_weight_yyx': 9.67708771337022e-05, 'L_entropy_weight_yyx': 0.000151047863714591, 'L_sep_weight_yyx': 1.891328451627684e-09, 'L_scale_weight_yyx': 0.0001896212828636042, 'learning_rate_yyx': 0.00633945077559004}. Best is trial 5 with value: -2.8051328142627483.
[I 2026-03-18 17:01:07,192] Trial 31 pruned. 
