[I 2026-03-18 19:10:12,447] Trial 49 pruned. 

Source events: 3618
Target events: 11540
Full model ln_yyx : 90.43371 nats/sec, 7.05289 nats/event
Full model Log loss : -0.78500
Full model ln_yyx : 91.13842 nats/sec, 7.10785 nats/event
Full model Log loss : -0.79022
Full model ln_yyx : 92.63388 nats/sec, 7.22448 nats/event
Full model Log loss : -0.82779
Full model ln_yyx : 92.27479 nats/sec, 7.19647 nats/event
Full model Log loss : -0.81221
Full model ln_yyx : 91.32637 nats/sec, 7.12251 nats/event
Full model Log loss : -0.80091
Full model ln_yyx : 91.00722 nats/sec, 7.09762 nats/event
Full model Log loss : -0.79896
Full model ln_yyx : 93.80124 nats/sec, 7.31552 nats/event
Full model Log loss : -0.82787
Full model ln_yyx : 92.66911 nats/sec, 7.22723 nats/event
Full model Log loss : -0.81470
Full model ln_yyx : 92.91352 nats/sec, 7.24629 nats/event
Full model Log loss : -0.82228
Full model ln_yyx : 92.00303 nats/sec, 7.17528 nats/event
Full model Log loss : -0.81072
Full model ln_yyx : 92.91488 nats/sec, 7.24639 nats/event
Full model Log loss : -0.82906
Optimization finished. Config saved to results/opt-full/opt_full_202_best_config.txt
[I 2026-03-18 19:10:14,036] Trial 29 pruned. 
[I 2026-03-18 19:10:14,890] Trial 22 finished with value: -2.2831488881292077 and parameters: {'n_layers_yyx': 1, 'hidden_size_yyx_l0': 6, 'context_size_yyx': 4, 'num_mix_components_yyx': 4, 'context_extractor_yyx': 'gru', 'activation_func_yyx': 'Tanh', 'L2_weight_yyx': 0.00017761714864264052, 'L_entropy_weight_yyx': 9.426709936065605e-09, 'L_sep_weight_yyx': 1.6891998277976823e-09, 'L_scale_weight_yyx': 9.790253757794788e-07, 'learning_rate_yyx': 0.009924780547236445}. Best is trial 1 with value: -2.2881647079635865.
[I 2026-03-18 19:10:15,271] Trial 12 finished with value: -2.2744839279567013 and parameters: {'n_layers_yyx': 1, 'hidden_size_yyx_l0': 5, 'context_size_yyx': 4, 'num_mix_components_yyx': 2, 'context_extractor_yyx': 'gru', 'activation_func_yyx': 'GELU', 'L2_weight_yyx': 1.1897380085389027e-10, 'L_entropy_weight_yyx': 2.056968247018585e-10, 'L_sep_weight_yyx': 1.318054503917251e-05, 'L_scale_weight_yyx': 2.0958220451541494e-05, 'learning_rate_yyx': 0.009268904670663002}. Best is trial 11 with value: -2.287895645272338.
[I 2026-03-18 19:10:18,224] Trial 16 pruned. 
[I 2026-03-18 19:10:19,289] Trial 42 pruned. 
[I 2026-03-18 19:10:22,334] Trial 15 finished with value: -2.2578508251131764 and parameters: {'n_layers_yyx': 2, 'hidden_size_yyx_l0': 5, 'hidden_size_yyx_l1': 2, 'context_size_yyx': 3, 'num_mix_components_yyx': 3, 'context_extractor_yyx': 'lstm', 'activation_func_yyx': 'ReLU', 'L2_weight_yyx': 1.1011590091069397e-10, 'L_entropy_weight_yyx': 0.00016303753279285965, 'L_sep_weight_yyx': 8.20567875588619e-06, 'L_scale_weight_yyx': 1.5793968151232745e-08, 'learning_rate_yyx': 0.006204248137154055}. Best is trial 8 with value: -2.2706079849369587.
[I 2026-03-18 19:10:23,636] Trial 22 finished with value: -2.2897814149518054 and parameters: {'n_layers_yyx': 2, 'hidden_size_yyx_l0': 3, 'hidden_size_yyx_l1': 5, 'context_size_yyx': 4, 'num_mix_components_yyx': 4, 'context_extractor_yyx': 'gru', 'activation_func_yyx': 'Tanh', 'L2_weight_yyx': 8.180737948684306e-08, 'L_entropy_weight_yyx': 3.4126663622096805e-09, 'L_sep_weight_yyx': 9.438669251166633e-06, 'L_scale_weight_yyx': 0.000333215924807832, 'learning_rate_yyx': 0.005787489008409955}. Best is trial 22 with value: -2.2897814149518054.
[I 2026-03-18 19:10:27,051] Trial 43 pruned. 
[I 2026-03-18 19:10:27,903] Trial 13 finished with value: -2.2826614137086905 and parameters: {'n_layers_yyx': 1, 'hidden_size_yyx_l0': 5, 'context_size_yyx': 3, 'num_mix_components_yyx': 5, 'context_extractor_yyx': 'gru', 'activation_func_yyx': 'Tanh', 'L2_weight_yyx': 2.989891730257781e-06, 'L_entropy_weight_yyx': 1.0049487264450607e-10, 'L_sep_weight_yyx': 5.897807476884019e-05, 'L_scale_weight_yyx': 3.581708354494857e-05, 'learning_rate_yyx': 0.009440627792389812}. Best is trial 1 with value: -2.2866954714752907.
[I 2026-03-18 19:10:28,050] Trial 31 finished with value: -0.8224603830447401 and parameters: {'n_layers_yyx': 1, 'hidden_size_yyx_l0': 3, 'context_size_yyx': 4, 'num_mix_components_yyx': 3, 'context_extractor_yyx': 'gru', 'activation_func_yyx': 'ReLU', 'L2_weight_yyx': 7.020525792395227e-08, 'L_entropy_weight_yyx': 4.6753625285081243e-07, 'L_sep_weight_yyx': 0.0008465642441126022, 'L_scale_weight_yyx': 2.021448973374093e-10, 'learning_rate_yyx': 0.009947201952411888}. Best is trial 10 with value: -0.8371109842725836.
[I 2026-03-18 19:10:28,548] Trial 23 pruned. 
[I 2026-03-18 19:10:28,551] Trial 17 pruned. 
[I 2026-03-18 19:10:30,050] Trial 28 finished with value: -1.7796757824737626 and parameters: {'n_layers_yyx': 2, 'hidden_size_yyx_l0': 4, 'hidden_size_yyx_l1': 4, 'context_size_yyx': 4, 'num_mix_components_yyx': 1, 'context_extractor_yyx': 'gru', 'activation_func_yyx': 'Tanh', 'L2_weight_yyx': 1.3558578416314238e-06, 'L_entropy_weight_yyx': 4.766623732323194e-10, 'L_sep_weight_yyx': 2.0470346950113556e-09, 'L_scale_weight_yyx': 0.00010506671025670526, 'learning_rate_yyx': 0.007381102179741916}. Best is trial 4 with value: -1.7807932306351817.
[I 2026-03-18 19:10:31,577] Trial 30 pruned. 
[I 2026-03-18 19:10:32,850] Trial 34 finished with value: -0.9153118448100168 and parameters: {'n_layers_yyx': 1, 'hidden_size_yyx_l0': 5, 'context_size_yyx': 2, 'num_mix_components_yyx': 2, 'context_extractor_yyx': 'lstm', 'activation_func_yyx': 'GELU', 'L2_weight_yyx': 2.5047145601689924e-05, 'L_entropy_weight_yyx': 4.1688172331939284e-10, 'L_sep_weight_yyx': 5.910722416646298e-07, 'L_scale_weight_yyx': 2.339980518308133e-05, 'learning_rate_yyx': 0.0039771889853383886}. Best is trial 12 with value: -0.9172403773089042.
[I 2026-03-18 19:10:32,864] Trial 16 pruned. 
[I 2026-03-18 19:10:33,823] Trial 49 pruned. 

Source events: 3618
Target events: 27060
Full model ln_yyx : 222.09279 nats/sec, 7.38668 nats/event
Full model Log loss : -0.82796
Full model ln_yyx : 212.48591 nats/sec, 7.06716 nats/event
Full model Log loss : -0.80428
Full model ln_yyx : 215.62983 nats/sec, 7.17172 nats/event
Full model Log loss : -0.79916
Full model ln_yyx : 215.73014 nats/sec, 7.17506 nats/event
Full model Log loss : -0.81280
Full model ln_yyx : 215.76267 nats/sec, 7.17614 nats/event
Full model Log loss : -0.80525
Full model ln_yyx : 218.63806 nats/sec, 7.27178 nats/event
Full model Log loss : -0.81147
Full model ln_yyx : 215.50769 nats/sec, 7.16766 nats/event
Full model Log loss : -0.80783
Full model ln_yyx : 218.39522 nats/sec, 7.26370 nats/event
Full model Log loss : -0.83691
Full model ln_yyx : 201.80584 nats/sec, 6.71195 nats/event
Full model Log loss : -0.76462
Optimization finished. Config saved to results/opt-full/opt_full_194_best_config.txt
[I 2026-03-18 19:10:34,254] Trial 48 finished with value: -0.8277948962708872 and parameters: {'n_layers_yyx': 2, 'hidden_size_yyx_l0': 4, 'hidden_size_yyx_l1': 5, 'context_size_yyx': 4, 'num_mix_components_yyx': 1, 'context_extractor_yyx': 'gru', 'activation_func_yyx': 'ReLU', 'L2_weight_yyx': 0.00011864959878356326, 'L_entropy_weight_yyx': 1.5705186981470899e-09, 'L_sep_weight_yyx': 4.401435515758551e-07, 'L_scale_weight_yyx': 3.0274010440512905e-09, 'learning_rate_yyx': 0.00885639338070345}. Best is trial 46 with value: -0.8404465961315432.
[I 2026-03-18 19:10:35,247] Trial 32 pruned. 
[I 2026-03-18 19:10:36,671] Trial 23 pruned. 
[I 2026-03-18 19:10:38,310] Trial 17 pruned. 
[I 2026-03-18 19:10:39,192] Trial 14 pruned. 
[I 2026-03-18 19:10:40,562] Trial 29 finished with value: -0.7950240435241068 and parameters: {'n_layers_yyx': 2, 'hidden_size_yyx_l0': 6, 'hidden_size_yyx_l1': 5, 'context_size_yyx': 1, 'num_mix_components_yyx': 3, 'context_extractor_yyx': 'gru', 'activation_func_yyx': 'Tanh', 'L2_weight_yyx': 1.0587177108051506e-10, 'L_entropy_weight_yyx': 3.313888865599335e-08, 'L_sep_weight_yyx': 2.6729972367446036e-06, 'L_scale_weight_yyx': 0.00014219383795207336, 'learning_rate_yyx': 0.005035115310478747}. Best is trial 11 with value: -0.831068616497992.
[I 2026-03-18 19:10:40,589] Trial 35 pruned. 
[I 2026-03-18 19:10:41,348] Trial 49 pruned. 

Source events: 3618
Target events: 40082
Full model ln_yyx : 321.52317 nats/sec, 7.21947 nats/event
Full model Log loss : -0.80879
Full model ln_yyx : 325.20311 nats/sec, 7.30210 nats/event
Full model Log loss : -0.82287
Full model ln_yyx : 312.60345 nats/sec, 7.01919 nats/event
Full model Log loss : -0.80849
Full model ln_yyx : 327.94652 nats/sec, 7.36370 nats/event
Full model Log loss : -0.82107
Full model ln_yyx : 317.66505 nats/sec, 7.13284 nats/event
Full model Log loss : -0.80722
Full model ln_yyx : 322.92204 nats/sec, 7.25088 nats/event
Full model Log loss : -0.80796
Full model ln_yyx : 326.31327 nats/sec, 7.32703 nats/event
Full model Log loss : -0.83065
Full model ln_yyx : 314.88661 nats/sec, 7.07045 nats/event
Full model Log loss : -0.79704
Full model ln_yyx : 329.94599 nats/sec, 7.40860 nats/event
Full model Log loss : -0.84045
Full model ln_yyx : 329.55491 nats/sec, 7.39982 nats/event
Full model Log loss : -0.82779
Optimization finished. Config saved to results/opt-full/opt_full_192_best_config.txt
[I 2026-03-18 19:10:41,910] Trial 24 pruned. 
[I 2026-03-18 19:10:43,559] Trial 17 pruned. 
[I 2026-03-18 19:10:46,554] Trial 31 pruned. 
[I 2026-03-18 19:10:47,488] Trial 36 pruned. 
[I 2026-03-18 19:10:47,672] Trial 18 pruned. 
[I 2026-03-18 19:10:50,166] Trial 25 pruned. 
[I 2026-03-18 19:10:50,523] Trial 13 finished with value: -2.269044110717473 and parameters: {'n_layers_yyx': 2, 'hidden_size_yyx_l0': 2, 'hidden_size_yyx_l1': 6, 'context_size_yyx': 4, 'num_mix_components_yyx': 4, 'context_extractor_yyx': 'lstm', 'activation_func_yyx': 'GELU', 'L2_weight_yyx': 5.322986250002737e-06, 'L_entropy_weight_yyx': 0.0009565341768156575, 'L_sep_weight_yyx': 0.0006328405184170643, 'L_scale_weight_yyx': 0.00029877939335492816, 'learning_rate_yyx': 0.009495819848225966}. Best is trial 10 with value: -2.2811953358201777.
[I 2026-03-18 19:10:54,264] Trial 37 pruned. 
[I 2026-03-18 19:10:57,874] Trial 24 pruned. 
[I 2026-03-18 19:11:00,562] Trial 15 pruned. 
[I 2026-03-18 19:11:02,709] Trial 31 finished with value: -0.8341429807586895 and parameters: {'n_layers_yyx': 1, 'hidden_size_yyx_l0': 2, 'context_size_yyx': 2, 'num_mix_components_yyx': 5, 'context_extractor_yyx': 'gru', 'activation_func_yyx': 'Tanh', 'L2_weight_yyx': 0.000268436124092715, 'L_entropy_weight_yyx': 1.852366068749641e-08, 'L_sep_weight_yyx': 7.615607545881825e-07, 'L_scale_weight_yyx': 2.670075402986274e-10, 'learning_rate_yyx': 0.009623846173099873}. Best is trial 21 with value: -0.8346943481986244.
[I 2026-03-18 19:11:03,725] Trial 18 pruned. 
[I 2026-03-18 19:11:05,272] Trial 19 pruned. 
[I 2026-03-18 19:11:06,462] Trial 26 pruned. 
[I 2026-03-18 19:11:08,255] Trial 38 pruned. 
[I 2026-03-18 19:11:10,285] Trial 32 pruned. 
[I 2026-03-18 19:11:11,977] Trial 13 pruned. 
[I 2026-03-18 19:11:12,479] Trial 40 finished with value: -0.8278542635535913 and parameters: {'n_layers_yyx': 2, 'hidden_size_yyx_l0': 5, 'hidden_size_yyx_l1': 6, 'context_size_yyx': 4, 'num_mix_components_yyx': 3, 'context_extractor_yyx': 'lstm', 'activation_func_yyx': 'Tanh', 'L2_weight_yyx': 7.251314379284797e-08, 'L_entropy_weight_yyx': 1.7508195379442563e-06, 'L_sep_weight_yyx': 5.370737639363685e-05, 'L_scale_weight_yyx': 9.726947395733922e-08, 'learning_rate_yyx': 0.00187592878256183}. Best is trial 37 with value: -0.8340322474785358.
[I 2026-03-18 19:11:13,513] Trial 18 pruned. 
[I 2026-03-18 19:11:14,128] Trial 20 pruned. 
[I 2026-03-18 19:11:14,928] Trial 43 finished with value: -0.813749327441262 and parameters: {'n_layers_yyx': 2, 'hidden_size_yyx_l0': 2, 'hidden_size_yyx_l1': 6, 'context_size_yyx': 1, 'num_mix_components_yyx': 1, 'context_extractor_yyx': 'lstm', 'activation_func_yyx': 'Tanh', 'L2_weight_yyx': 2.113797506578709e-08, 'L_entropy_weight_yyx': 2.1697968295956272e-09, 'L_sep_weight_yyx': 3.311017241318459e-05, 'L_scale_weight_yyx': 2.1325406618669497e-10, 'learning_rate_yyx': 0.005332884022387189}. Best is trial 2 with value: -0.8370103483890325.
[I 2026-03-18 19:11:15,593] Trial 39 pruned. 
[I 2026-03-18 19:11:18,983] Trial 32 pruned. 
[I 2026-03-18 19:11:22,202] Trial 16 pruned. 
[I 2026-03-18 19:11:22,954] Trial 19 pruned. 
[I 2026-03-18 19:11:29,221] Trial 44 pruned. 
[I 2026-03-18 19:11:31,555] Trial 20 pruned. 
[I 2026-03-18 19:11:32,559] Trial 33 pruned. 
[I 2026-03-18 19:11:34,504] Trial 14 pruned. 
[I 2026-03-18 19:11:36,875] Trial 14 finished with value: -1.863716537233383 and parameters: {'n_layers_yyx': 2, 'hidden_size_yyx_l0': 3, 'hidden_size_yyx_l1': 5, 'context_size_yyx': 3, 'num_mix_components_yyx': 2, 'context_extractor_yyx': 'lstm', 'activation_func_yyx': 'GELU', 'L2_weight_yyx': 8.150560677333794e-09, 'L_entropy_weight_yyx': 4.5465000483446676e-07, 'L_sep_weight_yyx': 5.6160564288021665e-08, 'L_scale_weight_yyx': 8.201255268419125e-09, 'learning_rate_yyx': 0.005654052622170016}. Best is trial 5 with value: -1.864091702761834.
[I 2026-03-18 19:11:39,003] Trial 33 finished with value: -0.8262103037080525 and parameters: {'n_layers_yyx': 1, 'hidden_size_yyx_l0': 2, 'context_size_yyx': 4, 'num_mix_components_yyx': 4, 'context_extractor_yyx': 'gru', 'activation_func_yyx': 'ReLU', 'L2_weight_yyx': 2.1805147768792163e-07, 'L_entropy_weight_yyx': 2.1957746012207113e-06, 'L_sep_weight_yyx': 0.0002863301923751849, 'L_scale_weight_yyx': 1.0321128283781613e-10, 'learning_rate_yyx': 0.009893735222354642}. Best is trial 10 with value: -0.8371109842725836.
[I 2026-03-18 19:11:42,607] Trial 45 pruned. 
[I 2026-03-18 19:11:45,427] Trial 15 pruned. 
[I 2026-03-18 19:11:45,563] Trial 14 pruned. 
[I 2026-03-18 19:11:46,193] Trial 15 pruned. 
[I 2026-03-18 19:11:48,583] Trial 40 pruned. 
[I 2026-03-18 19:11:50,665] Trial 21 pruned. 
[I 2026-03-18 19:11:50,818] Trial 27 pruned. 
[I 2026-03-18 19:11:52,800] Trial 34 pruned. 
[I 2026-03-18 19:11:53,417] Trial 25 pruned. 
[I 2026-03-18 19:11:58,200] Trial 19 pruned. 
[I 2026-03-18 19:11:58,758] Trial 44 pruned. 
[I 2026-03-18 19:11:59,045] Trial 28 pruned. 
[I 2026-03-18 19:12:03,953] Trial 26 pruned. 
[I 2026-03-18 19:12:07,532] Trial 19 finished with value: -2.266666131749542 and parameters: {'n_layers_yyx': 2, 'hidden_size_yyx_l0': 6, 'hidden_size_yyx_l1': 5, 'context_size_yyx': 2, 'num_mix_components_yyx': 5, 'context_extractor_yyx': 'lstm', 'activation_func_yyx': 'Tanh', 'L2_weight_yyx': 2.2777790971679912e-07, 'L_entropy_weight_yyx': 0.0007137833886250378, 'L_sep_weight_yyx': 9.61200328364132e-09, 'L_scale_weight_yyx': 4.87486306225778e-06, 'learning_rate_yyx': 0.006651343421711487}. Best is trial 18 with value: -2.2732639198985773.
[I 2026-03-18 19:12:07,640] Trial 22 pruned. 
[I 2026-03-18 19:12:07,992] Trial 16 pruned. 
[I 2026-03-18 19:12:08,040] Trial 18 finished with value: -2.2703585094332634 and parameters: {'n_layers_yyx': 2, 'hidden_size_yyx_l0': 3, 'hidden_size_yyx_l1': 6, 'context_size_yyx': 2, 'num_mix_components_yyx': 4, 'context_extractor_yyx': 'lstm', 'activation_func_yyx': 'Tanh', 'L2_weight_yyx': 3.6224296050995248e-09, 'L_entropy_weight_yyx': 2.1108258654454756e-09, 'L_sep_weight_yyx': 0.00011108244064100459, 'L_scale_weight_yyx': 4.555828723999427e-10, 'learning_rate_yyx': 0.005375698183538865}. Best is trial 2 with value: -2.272224617884258.
[I 2026-03-18 19:12:08,097] Trial 35 pruned. 
[I 2026-03-18 19:12:10,077] Trial 19 finished with value: -1.7806417939157198 and parameters: {'n_layers_yyx': 1, 'hidden_size_yyx_l0': 5, 'context_size_yyx': 2, 'num_mix_components_yyx': 4, 'context_extractor_yyx': 'lstm', 'activation_func_yyx': 'GELU', 'L2_weight_yyx': 6.979416482419839e-05, 'L_entropy_weight_yyx': 3.2803238629492386e-06, 'L_sep_weight_yyx': 1.4926946744054165e-05, 'L_scale_weight_yyx': 0.0004659548339305, 'learning_rate_yyx': 0.009777059468151642}. Best is trial 18 with value: -1.7861539220328282.
[I 2026-03-18 19:12:14,127] Trial 45 pruned. 
[I 2026-03-18 19:12:15,431] Trial 36 pruned. 
[I 2026-03-18 19:12:20,197] Trial 41 pruned. 
[I 2026-03-18 19:12:25,116] Trial 23 pruned. 
[I 2026-03-18 19:12:26,609] Trial 27 pruned. 
[I 2026-03-18 19:12:27,652] Trial 42 pruned. 
[I 2026-03-18 19:12:28,363] Trial 20 pruned. 
[I 2026-03-18 19:12:28,652] Trial 34 finished with value: -0.7976058216179491 and parameters: {'n_layers_yyx': 1, 'hidden_size_yyx_l0': 4, 'context_size_yyx': 1, 'num_mix_components_yyx': 5, 'context_extractor_yyx': 'gru', 'activation_func_yyx': 'Tanh', 'L2_weight_yyx': 6.475284198747237e-05, 'L_entropy_weight_yyx': 1.9203903858665975e-08, 'L_sep_weight_yyx': 9.906163972344963e-05, 'L_scale_weight_yyx': 0.0001983353448945477, 'learning_rate_yyx': 0.007740564029670331}. Best is trial 10 with value: -0.8355233715063007.
[I 2026-03-18 19:12:29,149] Trial 20 finished with value: -2.2777204395928403 and parameters: {'n_layers_yyx': 2, 'hidden_size_yyx_l0': 6, 'hidden_size_yyx_l1': 5, 'context_size_yyx': 4, 'num_mix_components_yyx': 3, 'context_extractor_yyx': 'gru', 'activation_func_yyx': 'ReLU', 'L2_weight_yyx': 4.802073468760108e-09, 'L_entropy_weight_yyx': 8.443998101054329e-08, 'L_sep_weight_yyx': 3.992313233413975e-06, 'L_scale_weight_yyx': 6.920870161457906e-07, 'learning_rate_yyx': 0.002573214696419257}. Best is trial 3 with value: -2.278758564192965.
[I 2026-03-18 19:12:29,565] Trial 13 finished with value: -2.2087701790537877 and parameters: {'n_layers_yyx': 1, 'hidden_size_yyx_l0': 3, 'context_size_yyx': 4, 'num_mix_components_yyx': 4, 'context_extractor_yyx': 'lstm', 'activation_func_yyx': 'Tanh', 'L2_weight_yyx': 1.396692484965582e-08, 'L_entropy_weight_yyx': 1.6339993458565464e-07, 'L_sep_weight_yyx': 0.0009034124391347526, 'L_scale_weight_yyx': 2.355463110239034e-10, 'learning_rate_yyx': 0.005263127113733482}. Best is trial 12 with value: -2.2168161654612635.
[I 2026-03-18 19:12:30,717] Trial 37 pruned. 
[I 2026-03-18 19:12:30,841] Trial 31 finished with value: -1.7657681747574216 and parameters: {'n_layers_yyx': 2, 'hidden_size_yyx_l0': 6, 'hidden_size_yyx_l1': 4, 'context_size_yyx': 2, 'num_mix_components_yyx': 1, 'context_extractor_yyx': 'lstm', 'activation_func_yyx': 'ReLU', 'L2_weight_yyx': 1.15670963480572e-09, 'L_entropy_weight_yyx': 5.804380139481248e-10, 'L_sep_weight_yyx': 1.490500472405653e-08, 'L_scale_weight_yyx': 2.7333586768223227e-08, 'learning_rate_yyx': 0.008425443953961288}. Best is trial 1 with value: -1.7684712210476057.
[I 2026-03-18 19:12:32,775] Trial 24 finished with value: -2.2796383431666922 and parameters: {'n_layers_yyx': 2, 'hidden_size_yyx_l0': 5, 'hidden_size_yyx_l1': 5, 'context_size_yyx': 3, 'num_mix_components_yyx': 3, 'context_extractor_yyx': 'lstm', 'activation_func_yyx': 'ReLU', 'L2_weight_yyx': 4.921755096464928e-10, 'L_entropy_weight_yyx': 4.7805304061849044e-05, 'L_sep_weight_yyx': 4.105740165294973e-08, 'L_scale_weight_yyx': 7.002995276748378e-10, 'learning_rate_yyx': 0.005535914392048462}. Best is trial 10 with value: -2.2853422092545133.
[I 2026-03-18 19:12:33,556] Trial 41 finished with value: -0.8275979068818086 and parameters: {'n_layers_yyx': 2, 'hidden_size_yyx_l0': 5, 'hidden_size_yyx_l1': 6, 'context_size_yyx': 4, 'num_mix_components_yyx': 3, 'context_extractor_yyx': 'lstm', 'activation_func_yyx': 'Tanh', 'L2_weight_yyx': 6.003735732068967e-08, 'L_entropy_weight_yyx': 3.320119125707568e-06, 'L_sep_weight_yyx': 3.06060392140497e-05, 'L_scale_weight_yyx': 4.5304207039530097e-10, 'learning_rate_yyx': 0.001793095422443931}. Best is trial 37 with value: -0.8340322474785358.
[I 2026-03-18 19:12:34,882] Trial 43 pruned. 
[I 2026-03-18 19:12:36,362] Trial 21 pruned. 
[I 2026-03-18 19:12:38,299] Trial 38 pruned. 
[I 2026-03-18 19:12:38,795] Trial 14 pruned. 
[I 2026-03-18 19:12:40,131] Trial 46 finished with value: -0.8320776799933068 and parameters: {'n_layers_yyx': 2, 'hidden_size_yyx_l0': 5, 'hidden_size_yyx_l1': 5, 'context_size_yyx': 1, 'num_mix_components_yyx': 4, 'context_extractor_yyx': 'lstm', 'activation_func_yyx': 'Tanh', 'L2_weight_yyx': 6.5163850555734914e-09, 'L_entropy_weight_yyx': 1.3530724516090142e-10, 'L_sep_weight_yyx': 1.108461202722268e-06, 'L_scale_weight_yyx': 2.2953317550340007e-06, 'learning_rate_yyx': 0.0072585422204885395}. Best is trial 2 with value: -0.8370103483890325.
[I 2026-03-18 19:12:40,317] Trial 33 finished with value: -0.8347344222413913 and parameters: {'n_layers_yyx': 1, 'hidden_size_yyx_l0': 2, 'context_size_yyx': 2, 'num_mix_components_yyx': 5, 'context_extractor_yyx': 'gru', 'activation_func_yyx': 'Tanh', 'L2_weight_yyx': 0.0003225166194740707, 'L_entropy_weight_yyx': 2.597351731657473e-09, 'L_sep_weight_yyx': 5.207312353082413e-07, 'L_scale_weight_yyx': 5.103592413510476e-10, 'learning_rate_yyx': 0.00888495307086026}. Best is trial 33 with value: -0.8347344222413913.
[I 2026-03-18 19:12:41,404] Trial 42 pruned. 
[I 2026-03-18 19:12:41,605] Trial 44 pruned. 
[I 2026-03-18 19:12:45,766] Trial 29 pruned. 
[I 2026-03-18 19:12:47,188] Trial 28 pruned. 
[I 2026-03-18 19:12:48,303] Trial 22 finished with value: -1.7556932389468891 and parameters: {'n_layers_yyx': 1, 'hidden_size_yyx_l0': 5, 'context_size_yyx': 2, 'num_mix_components_yyx': 3, 'context_extractor_yyx': 'gru', 'activation_func_yyx': 'GELU', 'L2_weight_yyx': 8.959970330801658e-10, 'L_entropy_weight_yyx': 8.348620514536762e-06, 'L_sep_weight_yyx': 9.549087404750041e-08, 'L_scale_weight_yyx': 1.016788588067716e-10, 'learning_rate_yyx': 0.0038887216802110155}. Best is trial 2 with value: -1.776406202226865.
[I 2026-03-18 19:12:48,642] Trial 43 pruned. 
