[I 2026-03-18 18:26:24,602] Trial 18 finished with value: -1.6545060588647236 and parameters: {'n_layers_yyx': 2, 'hidden_size_yyx_l0': 6, 'hidden_size_yyx_l1': 5, 'context_size_yyx': 3, 'num_mix_components_yyx': 4, 'context_extractor_yyx': 'gru', 'activation_func_yyx': 'GELU', 'L2_weight_yyx': 1.4103884586577662e-05, 'L_entropy_weight_yyx': 2.5641538286511337e-08, 'L_sep_weight_yyx': 9.434013460359184e-10, 'L_scale_weight_yyx': 1.8163497059612005e-10, 'learning_rate_yyx': 0.002912199709896247}. Best is trial 12 with value: -1.6645964610425732.
[I 2026-03-18 18:26:27,633] Trial 28 pruned. 
[I 2026-03-18 18:26:32,105] Trial 28 pruned. 
[I 2026-03-18 18:26:49,220] Trial 14 pruned. 
[I 2026-03-18 18:26:49,548] Trial 28 pruned. 
[I 2026-03-18 18:26:49,816] Trial 14 pruned. 
[I 2026-03-18 18:26:53,958] Trial 15 pruned. 
[I 2026-03-18 18:26:58,183] Trial 19 pruned. 
[I 2026-03-18 18:27:01,898] Trial 22 pruned. 
[I 2026-03-18 18:27:07,445] Trial 26 finished with value: -1.2682363612374183 and parameters: {'n_layers_yyx': 1, 'hidden_size_yyx_l0': 5, 'context_size_yyx': 3, 'num_mix_components_yyx': 2, 'context_extractor_yyx': 'lstm', 'activation_func_yyx': 'Tanh', 'L2_weight_yyx': 0.0002633489243672907, 'L_entropy_weight_yyx': 6.080929419276316e-08, 'L_sep_weight_yyx': 1.1145406259348268e-05, 'L_scale_weight_yyx': 4.169347736631299e-08, 'learning_rate_yyx': 0.00743854665452409}. Best is trial 26 with value: -1.2682363612374183.
[I 2026-03-18 18:27:07,606] Trial 13 pruned. 
[I 2026-03-18 18:27:09,149] Trial 33 finished with value: -1.2895097099817716 and parameters: {'n_layers_yyx': 1, 'hidden_size_yyx_l0': 5, 'context_size_yyx': 4, 'num_mix_components_yyx': 3, 'context_extractor_yyx': 'gru', 'activation_func_yyx': 'Tanh', 'L2_weight_yyx': 5.3882372224598085e-09, 'L_entropy_weight_yyx': 3.9748179596870475e-09, 'L_sep_weight_yyx': 2.7203119444585805e-07, 'L_scale_weight_yyx': 5.6973133505797934e-05, 'learning_rate_yyx': 0.009856051339857234}. Best is trial 8 with value: -1.3030293492170482.
[I 2026-03-18 18:27:20,371] Trial 20 pruned. 
[I 2026-03-18 18:27:28,217] Trial 16 pruned. 
[I 2026-03-18 18:27:31,510] Trial 20 pruned. 
[I 2026-03-18 18:27:32,877] Trial 28 pruned. 
[I 2026-03-18 18:27:35,213] Trial 16 finished with value: -2.6341902984777215 and parameters: {'n_layers_yyx': 1, 'hidden_size_yyx_l0': 4, 'context_size_yyx': 4, 'num_mix_components_yyx': 3, 'context_extractor_yyx': 'gru', 'activation_func_yyx': 'Tanh', 'L2_weight_yyx': 2.313880608306253e-07, 'L_entropy_weight_yyx': 2.2524827668562985e-05, 'L_sep_weight_yyx': 4.230982167686672e-06, 'L_scale_weight_yyx': 8.5337677758724e-10, 'learning_rate_yyx': 0.0030108409155856944}. Best is trial 9 with value: -2.6351331388383397.
[I 2026-03-18 18:27:51,778] Trial 29 pruned. 
[I 2026-03-18 18:27:54,625] Trial 15 pruned. 
[I 2026-03-18 18:28:15,794] Trial 29 pruned. 
[I 2026-03-18 18:28:16,600] Trial 14 pruned. 
[I 2026-03-18 18:28:17,093] Trial 34 pruned. 
[I 2026-03-18 18:28:18,485] Trial 15 pruned. 
[I 2026-03-18 18:28:25,224] Trial 16 pruned. 
[I 2026-03-18 18:28:28,813] Trial 17 pruned. 
[I 2026-03-18 18:28:30,013] Trial 30 pruned. 
[I 2026-03-18 18:28:31,261] Trial 23 pruned. 
[I 2026-03-18 18:28:32,963] Trial 21 pruned. 
[I 2026-03-18 18:28:49,373] Trial 17 pruned. 
[I 2026-03-18 18:28:49,803] Trial 16 pruned. 
[I 2026-03-18 18:28:57,490] Trial 29 pruned. 
[I 2026-03-18 18:29:02,875] Trial 40 finished with value: -1.2736812175532146 and parameters: {'n_layers_yyx': 2, 'hidden_size_yyx_l0': 5, 'hidden_size_yyx_l1': 6, 'context_size_yyx': 4, 'num_mix_components_yyx': 2, 'context_extractor_yyx': 'lstm', 'activation_func_yyx': 'GELU', 'L2_weight_yyx': 0.0002261491599479342, 'L_entropy_weight_yyx': 4.448177109325085e-10, 'L_sep_weight_yyx': 1.0857966712636583e-10, 'L_scale_weight_yyx': 3.981960049599791e-09, 'learning_rate_yyx': 0.007085517014702092}. Best is trial 40 with value: -1.2736812175532146.
[I 2026-03-18 18:29:03,513] Trial 35 pruned. 
[I 2026-03-18 18:29:13,787] Trial 30 pruned. 
[I 2026-03-18 18:29:15,717] Trial 15 pruned. 
[I 2026-03-18 18:29:15,839] Trial 17 pruned. 
[I 2026-03-18 18:29:17,579] Trial 17 pruned. 
[I 2026-03-18 18:29:18,087] Trial 26 pruned. 
[I 2026-03-18 18:29:18,236] Trial 18 pruned. 
[I 2026-03-18 18:29:18,626] Trial 21 pruned. 
[I 2026-03-18 18:29:18,664] Trial 18 pruned. 
[I 2026-03-18 18:29:19,267] Trial 24 pruned. 
[I 2026-03-18 18:29:20,235] Trial 41 pruned. 
[I 2026-03-18 18:29:23,828] Trial 17 finished with value: -1.6560723467212783 and parameters: {'n_layers_yyx': 2, 'hidden_size_yyx_l0': 3, 'hidden_size_yyx_l1': 4, 'context_size_yyx': 4, 'num_mix_components_yyx': 1, 'context_extractor_yyx': 'lstm', 'activation_func_yyx': 'ReLU', 'L2_weight_yyx': 1.2109019314000396e-05, 'L_entropy_weight_yyx': 0.00018607472548336267, 'L_sep_weight_yyx': 1.90079920696907e-09, 'L_scale_weight_yyx': 0.00013553499405106418, 'learning_rate_yyx': 0.001826382539332574}. Best is trial 0 with value: -1.6683178048964529.
[I 2026-03-18 18:29:29,907] Trial 18 pruned. 
[I 2026-03-18 18:29:32,549] Trial 12 finished with value: -1.6602015747716499 and parameters: {'n_layers_yyx': 1, 'hidden_size_yyx_l0': 2, 'context_size_yyx': 4, 'num_mix_components_yyx': 4, 'context_extractor_yyx': 'lstm', 'activation_func_yyx': 'Tanh', 'L2_weight_yyx': 8.14860017687876e-09, 'L_entropy_weight_yyx': 1.52215045437872e-08, 'L_sep_weight_yyx': 3.977913453427605e-06, 'L_scale_weight_yyx': 3.251839292177048e-09, 'learning_rate_yyx': 0.003911727167155161}. Best is trial 0 with value: -1.6702967433543936.
[I 2026-03-18 18:29:33,609] Trial 19 finished with value: -1.2329257323429017 and parameters: {'n_layers_yyx': 2, 'hidden_size_yyx_l0': 5, 'hidden_size_yyx_l1': 5, 'context_size_yyx': 1, 'num_mix_components_yyx': 4, 'context_extractor_yyx': 'gru', 'activation_func_yyx': 'Tanh', 'L2_weight_yyx': 1.6050422303503777e-10, 'L_entropy_weight_yyx': 2.81730685571616e-07, 'L_sep_weight_yyx': 4.596821841702441e-05, 'L_scale_weight_yyx': 1.507880637833635e-10, 'learning_rate_yyx': 0.005814993008039288}. Best is trial 3 with value: -1.2710647653519778.
[I 2026-03-18 18:29:35,898] Trial 27 pruned. 
[I 2026-03-18 18:29:36,065] Trial 18 pruned. 
[I 2026-03-18 18:29:38,573] Trial 36 pruned. 
[I 2026-03-18 18:29:40,193] Trial 19 pruned. 
[I 2026-03-18 18:29:47,091] Trial 21 finished with value: -2.630810401142299 and parameters: {'n_layers_yyx': 2, 'hidden_size_yyx_l0': 3, 'hidden_size_yyx_l1': 3, 'context_size_yyx': 4, 'num_mix_components_yyx': 5, 'context_extractor_yyx': 'lstm', 'activation_func_yyx': 'ReLU', 'L2_weight_yyx': 0.0009770076412564685, 'L_entropy_weight_yyx': 7.107856828064579e-10, 'L_sep_weight_yyx': 1.5681766741781284e-05, 'L_scale_weight_yyx': 0.0008772318206859835, 'learning_rate_yyx': 0.0027700996767544128}. Best is trial 6 with value: -2.642843521506465.
[I 2026-03-18 18:29:53,653] Trial 22 finished with value: -1.71878662109375 and parameters: {'n_layers_yyx': 2, 'hidden_size_yyx_l0': 5, 'hidden_size_yyx_l1': 5, 'context_size_yyx': 3, 'num_mix_components_yyx': 3, 'context_extractor_yyx': 'gru', 'activation_func_yyx': 'GELU', 'L2_weight_yyx': 8.891796094784004e-07, 'L_entropy_weight_yyx': 4.04070940688537e-05, 'L_sep_weight_yyx': 0.00011221775115638195, 'L_scale_weight_yyx': 8.622480472703878e-10, 'learning_rate_yyx': 0.006214601346686004}. Best is trial 15 with value: -1.72713993893394.
[I 2026-03-18 18:29:55,964] Trial 16 pruned. 
[I 2026-03-18 18:29:56,607] Trial 22 pruned. 
[I 2026-03-18 18:29:57,155] Trial 16 finished with value: -1.671157546864896 and parameters: {'n_layers_yyx': 1, 'hidden_size_yyx_l0': 3, 'context_size_yyx': 3, 'num_mix_components_yyx': 5, 'context_extractor_yyx': 'lstm', 'activation_func_yyx': 'GELU', 'L2_weight_yyx': 8.634114212085373e-09, 'L_entropy_weight_yyx': 3.0288289614190236e-07, 'L_sep_weight_yyx': 1.1009883754899158e-08, 'L_scale_weight_yyx': 4.738686108313804e-08, 'learning_rate_yyx': 0.001895115151247995}. Best is trial 13 with value: -1.6722197537243195.
[I 2026-03-18 18:29:57,418] Trial 18 pruned. 
[I 2026-03-18 18:29:57,760] Trial 19 pruned. 
[I 2026-03-18 18:29:58,096] Trial 20 pruned. 
[I 2026-03-18 18:29:58,496] Trial 25 pruned. 
[I 2026-03-18 18:29:59,423] Trial 31 pruned. 
[I 2026-03-18 18:29:59,850] Trial 23 finished with value: -2.613219794451035 and parameters: {'n_layers_yyx': 2, 'hidden_size_yyx_l0': 3, 'hidden_size_yyx_l1': 6, 'context_size_yyx': 3, 'num_mix_components_yyx': 2, 'context_extractor_yyx': 'gru', 'activation_func_yyx': 'ReLU', 'L2_weight_yyx': 3.985600775234532e-09, 'L_entropy_weight_yyx': 6.577056059691212e-06, 'L_sep_weight_yyx': 3.765059442489392e-07, 'L_scale_weight_yyx': 4.811477164992508e-10, 'learning_rate_yyx': 0.005192690992351606}. Best is trial 10 with value: -2.6537577311197915.
[I 2026-03-18 18:30:00,414] Trial 28 pruned. 
[I 2026-03-18 18:30:01,283] Trial 20 pruned. 
[I 2026-03-18 18:30:01,376] Trial 21 finished with value: -1.6755234531993701 and parameters: {'n_layers_yyx': 1, 'hidden_size_yyx_l0': 5, 'context_size_yyx': 4, 'num_mix_components_yyx': 3, 'context_extractor_yyx': 'lstm', 'activation_func_yyx': 'Tanh', 'L2_weight_yyx': 6.908107571449964e-07, 'L_entropy_weight_yyx': 3.4012524352587043e-09, 'L_sep_weight_yyx': 1.2831660402388105e-07, 'L_scale_weight_yyx': 5.947686758703203e-09, 'learning_rate_yyx': 0.006571119732095103}. Best is trial 21 with value: -1.6755234531993701.
[I 2026-03-18 18:30:01,827] Trial 19 finished with value: -1.6674850489567747 and parameters: {'n_layers_yyx': 2, 'hidden_size_yyx_l0': 5, 'hidden_size_yyx_l1': 6, 'context_size_yyx': 3, 'num_mix_components_yyx': 2, 'context_extractor_yyx': 'gru', 'activation_func_yyx': 'Tanh', 'L2_weight_yyx': 0.00029964685072122733, 'L_entropy_weight_yyx': 4.231371633762358e-09, 'L_sep_weight_yyx': 1.7906998915436108e-09, 'L_scale_weight_yyx': 7.974559721771788e-07, 'learning_rate_yyx': 0.005546794202947265}. Best is trial 19 with value: -1.6674850489567747.
[I 2026-03-18 18:30:08,414] Trial 19 pruned. 
[I 2026-03-18 18:30:09,155] Trial 18 pruned. 
[I 2026-03-18 18:30:14,630] Trial 22 pruned. 
[I 2026-03-18 18:30:17,419] Trial 13 pruned. 
[I 2026-03-18 18:30:18,384] Trial 19 pruned. 
[I 2026-03-18 18:30:32,041] Trial 24 pruned. 
[I 2026-03-18 18:30:42,810] Trial 17 pruned. 
[I 2026-03-18 18:30:44,139] Trial 19 pruned. 
[I 2026-03-18 18:30:46,253] Trial 17 pruned. 
[I 2026-03-18 18:30:48,563] Trial 20 pruned. 
[I 2026-03-18 18:30:50,341] Trial 30 pruned. 
[I 2026-03-18 18:31:00,778] Trial 29 pruned. 
[I 2026-03-18 18:31:02,756] Trial 22 pruned. 
[I 2026-03-18 18:31:05,358] Trial 32 pruned. 
[I 2026-03-18 18:31:08,289] Trial 25 pruned. 
[I 2026-03-18 18:31:17,079] Trial 18 pruned. 
[I 2026-03-18 18:31:17,079] Trial 14 pruned. 
[I 2026-03-18 18:31:22,379] Trial 20 pruned. 
[I 2026-03-18 18:31:32,438] Trial 29 finished with value: -2.6012235425491057 and parameters: {'n_layers_yyx': 2, 'hidden_size_yyx_l0': 3, 'hidden_size_yyx_l1': 3, 'context_size_yyx': 2, 'num_mix_components_yyx': 3, 'context_extractor_yyx': 'lstm', 'activation_func_yyx': 'ReLU', 'L2_weight_yyx': 4.414639187989147e-08, 'L_entropy_weight_yyx': 6.113306206925209e-07, 'L_sep_weight_yyx': 2.3200607604244573e-07, 'L_scale_weight_yyx': 9.573360532084087e-08, 'learning_rate_yyx': 0.007221910092041568}. Best is trial 0 with value: -2.6330643191486622.
[I 2026-03-18 18:31:34,138] Trial 15 finished with value: -1.6611100528192015 and parameters: {'n_layers_yyx': 2, 'hidden_size_yyx_l0': 5, 'hidden_size_yyx_l1': 6, 'context_size_yyx': 4, 'num_mix_components_yyx': 4, 'context_extractor_yyx': 'gru', 'activation_func_yyx': 'Tanh', 'L2_weight_yyx': 1.466690438420515e-05, 'L_entropy_weight_yyx': 1.3735583802484999e-05, 'L_sep_weight_yyx': 4.941497587895974e-05, 'L_scale_weight_yyx': 8.60055217537071e-07, 'learning_rate_yyx': 0.007537658949853752}. Best is trial 2 with value: -1.6720916355195472.
[I 2026-03-18 18:31:37,913] Trial 37 pruned. 
[I 2026-03-18 18:31:37,916] Trial 11 finished with value: -1.655733538228412 and parameters: {'n_layers_yyx': 2, 'hidden_size_yyx_l0': 5, 'hidden_size_yyx_l1': 6, 'context_size_yyx': 3, 'num_mix_components_yyx': 5, 'context_extractor_yyx': 'lstm', 'activation_func_yyx': 'ReLU', 'L2_weight_yyx': 0.0009283302793664572, 'L_entropy_weight_yyx': 1.1133737583371936e-05, 'L_sep_weight_yyx': 2.801034159801572e-10, 'L_scale_weight_yyx': 1.042627266482041e-10, 'learning_rate_yyx': 0.0022641231606010505}. Best is trial 9 with value: -1.6703570914822956.
[I 2026-03-18 18:31:38,476] Trial 20 pruned. 
[I 2026-03-18 18:31:39,484] Trial 21 finished with value: -2.6369691359046414 and parameters: {'n_layers_yyx': 1, 'hidden_size_yyx_l0': 4, 'context_size_yyx': 3, 'num_mix_components_yyx': 5, 'context_extractor_yyx': 'gru', 'activation_func_yyx': 'Tanh', 'L2_weight_yyx': 2.298484126370339e-05, 'L_entropy_weight_yyx': 1.626934086549346e-08, 'L_sep_weight_yyx': 3.9947358296369756e-08, 'L_scale_weight_yyx': 1.049465093612237e-09, 'learning_rate_yyx': 0.009890178166604686}. Best is trial 10 with value: -2.640669339569724.
[I 2026-03-18 18:31:41,803] Trial 26 pruned. 
[I 2026-03-18 18:31:45,138] Trial 19 pruned. 
[I 2026-03-18 18:31:45,172] Trial 19 pruned. 
[I 2026-03-18 18:31:46,713] Trial 18 pruned. 
[I 2026-03-18 18:31:58,108] Trial 21 finished with value: -1.2492570365863453 and parameters: {'n_layers_yyx': 2, 'hidden_size_yyx_l0': 5, 'hidden_size_yyx_l1': 4, 'context_size_yyx': 3, 'num_mix_components_yyx': 4, 'context_extractor_yyx': 'lstm', 'activation_func_yyx': 'ReLU', 'L2_weight_yyx': 8.872143121004367e-06, 'L_entropy_weight_yyx': 3.250456178484608e-05, 'L_sep_weight_yyx': 1.178188920005438e-10, 'L_scale_weight_yyx': 4.099306014884333e-07, 'learning_rate_yyx': 0.006547309029902415}. Best is trial 5 with value: -1.2714442113851663.
[I 2026-03-18 18:32:04,844] Trial 20 pruned. 
[I 2026-03-18 18:32:12,502] Trial 17 pruned. 
[I 2026-03-18 18:32:12,812] Trial 21 pruned. 
[I 2026-03-18 18:32:13,333] Trial 27 finished with value: -1.2356003921706222 and parameters: {'n_layers_yyx': 1, 'hidden_size_yyx_l0': 5, 'context_size_yyx': 4, 'num_mix_components_yyx': 1, 'context_extractor_yyx': 'lstm', 'activation_func_yyx': 'Tanh', 'L2_weight_yyx': 9.263755298963044e-07, 'L_entropy_weight_yyx': 3.9222827004072535e-08, 'L_sep_weight_yyx': 1.154127294460206e-06, 'L_scale_weight_yyx': 4.221248238975566e-08, 'learning_rate_yyx': 0.007490113964208885}. Best is trial 26 with value: -1.2682363612374183.
[I 2026-03-18 18:32:16,624] Trial 20 pruned. 
[I 2026-03-18 18:32:17,437] Trial 20 pruned. 
[I 2026-03-18 18:32:27,307] Trial 20 pruned. 
[I 2026-03-18 18:32:28,605] Trial 30 finished with value: -2.6425987874926125 and parameters: {'n_layers_yyx': 1, 'hidden_size_yyx_l0': 3, 'context_size_yyx': 3, 'num_mix_components_yyx': 5, 'context_extractor_yyx': 'lstm', 'activation_func_yyx': 'ReLU', 'L2_weight_yyx': 0.00039039967916461164, 'L_entropy_weight_yyx': 2.565423351211611e-08, 'L_sep_weight_yyx': 1.264217208338985e-09, 'L_scale_weight_yyx': 7.502212286564809e-05, 'learning_rate_yyx': 0.0095976977758401}. Best is trial 30 with value: -2.6425987874926125.
[I 2026-03-18 18:32:37,382] Trial 38 pruned. 
[I 2026-03-18 18:32:42,676] Trial 18 pruned. 
[I 2026-03-18 18:32:46,570] Trial 22 pruned. 
[I 2026-03-18 18:32:53,172] Trial 19 pruned. 
[I 2026-03-18 18:32:55,861] Trial 31 finished with value: -2.602695286058777 and parameters: {'n_layers_yyx': 1, 'hidden_size_yyx_l0': 6, 'context_size_yyx': 4, 'num_mix_components_yyx': 2, 'context_extractor_yyx': 'gru', 'activation_func_yyx': 'GELU', 'L2_weight_yyx': 2.2489781832708248e-08, 'L_entropy_weight_yyx': 2.491870978058932e-10, 'L_sep_weight_yyx': 0.00011628656659381048, 'L_scale_weight_yyx': 8.634656265164146e-09, 'learning_rate_yyx': 0.006301208403126528}. Best is trial 12 with value: -2.6375437257353878.
[I 2026-03-18 18:33:00,487] Trial 39 pruned. 
[I 2026-03-18 18:33:03,451] Trial 28 pruned. 
[I 2026-03-18 18:33:08,543] Trial 30 pruned. 
[I 2026-03-18 18:33:16,988] Trial 21 pruned. 
[I 2026-03-18 18:33:20,147] Trial 40 pruned. 
[I 2026-03-18 18:33:25,143] Trial 42 finished with value: -1.272832944520961 and parameters: {'n_layers_yyx': 2, 'hidden_size_yyx_l0': 5, 'hidden_size_yyx_l1': 5, 'context_size_yyx': 4, 'num_mix_components_yyx': 2, 'context_extractor_yyx': 'lstm', 'activation_func_yyx': 'GELU', 'L2_weight_yyx': 0.00042325221988654955, 'L_entropy_weight_yyx': 3.722737980085499e-10, 'L_sep_weight_yyx': 4.09383911023192e-10, 'L_scale_weight_yyx': 3.0190543548951035e-09, 'learning_rate_yyx': 0.0071422544323801445}. Best is trial 40 with value: -1.2736812175532146.
[I 2026-03-18 18:33:26,315] Trial 22 finished with value: -1.6503838072036698 and parameters: {'n_layers_yyx': 2, 'hidden_size_yyx_l0': 4, 'hidden_size_yyx_l1': 6, 'context_size_yyx': 3, 'num_mix_components_yyx': 3, 'context_extractor_yyx': 'gru', 'activation_func_yyx': 'ReLU', 'L2_weight_yyx': 2.9645479569163994e-05, 'L_entropy_weight_yyx': 5.6568140879581687e-05, 'L_sep_weight_yyx': 3.7266183160960595e-09, 'L_scale_weight_yyx': 6.933388378758043e-07, 'learning_rate_yyx': 0.007831807743410598}. Best is trial 12 with value: -1.6645964610425732.
[I 2026-03-18 18:33:27,115] Trial 19 pruned. 
[I 2026-03-18 18:33:36,908] Trial 16 pruned. 
[I 2026-03-18 18:33:46,611] Trial 22 pruned. 
[I 2026-03-18 18:33:49,732] Trial 20 pruned. 
[I 2026-03-18 18:33:58,878] Trial 30 pruned. 
[I 2026-03-18 18:34:00,153] Trial 17 pruned. 
[I 2026-03-18 18:34:02,713] Trial 21 pruned. 
[I 2026-03-18 18:34:07,598] Trial 21 pruned. 
[I 2026-03-18 18:34:09,533] Trial 23 pruned. 
[I 2026-03-18 18:34:23,319] Trial 18 pruned. 
[I 2026-03-18 18:34:28,270] Trial 24 pruned. 
[I 2026-03-18 18:34:32,652] Trial 27 finished with value: -2.651279437853208 and parameters: {'n_layers_yyx': 2, 'hidden_size_yyx_l0': 4, 'hidden_size_yyx_l1': 6, 'context_size_yyx': 4, 'num_mix_components_yyx': 5, 'context_extractor_yyx': 'gru', 'activation_func_yyx': 'ReLU', 'L2_weight_yyx': 3.2102421130684335e-10, 'L_entropy_weight_yyx': 0.0002118074905982545, 'L_sep_weight_yyx': 2.143952557870887e-08, 'L_scale_weight_yyx': 2.1436650454295367e-09, 'learning_rate_yyx': 0.008014242612883374}. Best is trial 10 with value: -2.6537577311197915.
[I 2026-03-18 18:34:36,304] Trial 21 finished with value: -1.6724319898588824 and parameters: {'n_layers_yyx': 2, 'hidden_size_yyx_l0': 2, 'hidden_size_yyx_l1': 6, 'context_size_yyx': 4, 'num_mix_components_yyx': 2, 'context_extractor_yyx': 'lstm', 'activation_func_yyx': 'Tanh', 'L2_weight_yyx': 1.1401357673875781e-10, 'L_entropy_weight_yyx': 3.9392196710144584e-08, 'L_sep_weight_yyx': 5.091247201251103e-06, 'L_scale_weight_yyx': 9.18978567779035e-09, 'learning_rate_yyx': 0.009898979286451585}. Best is trial 11 with value: -1.6739410945609627.
[I 2026-03-18 18:34:41,367] Trial 22 pruned. 
[I 2026-03-18 18:34:49,925] Trial 31 pruned. 
[I 2026-03-18 18:34:50,096] Trial 23 finished with value: -1.7267383430577532 and parameters: {'n_layers_yyx': 2, 'hidden_size_yyx_l0': 6, 'hidden_size_yyx_l1': 6, 'context_size_yyx': 4, 'num_mix_components_yyx': 2, 'context_extractor_yyx': 'lstm', 'activation_func_yyx': 'ReLU', 'L2_weight_yyx': 1.1186373291808073e-07, 'L_entropy_weight_yyx': 6.195688660245663e-08, 'L_sep_weight_yyx': 5.236709647737001e-06, 'L_scale_weight_yyx': 1.8808381320319347e-06, 'learning_rate_yyx': 0.0037346002157012345}. Best is trial 15 with value: -1.72713993893394.
[I 2026-03-18 18:34:50,881] Trial 23 pruned. 
[I 2026-03-18 18:34:50,900] Trial 31 pruned. 
[I 2026-03-18 18:34:52,967] Trial 33 finished with value: -2.6330751044783898 and parameters: {'n_layers_yyx': 2, 'hidden_size_yyx_l0': 3, 'hidden_size_yyx_l1': 4, 'context_size_yyx': 1, 'num_mix_components_yyx': 4, 'context_extractor_yyx': 'lstm', 'activation_func_yyx': 'Tanh', 'L2_weight_yyx': 4.7785714227585383e-05, 'L_entropy_weight_yyx': 9.255165068084542e-09, 'L_sep_weight_yyx': 0.00019156254133302953, 'L_scale_weight_yyx': 1.1712514729559934e-09, 'learning_rate_yyx': 0.006674448360576165}. Best is trial 14 with value: -2.6415204441902964.
[I 2026-03-18 18:34:57,104] Trial 43 pruned. 
[I 2026-03-18 18:34:57,263] Trial 22 pruned. 
[I 2026-03-18 18:35:00,690] Trial 23 pruned. 
[I 2026-03-18 18:35:03,236] Trial 23 pruned. 
[I 2026-03-18 18:35:18,569] Trial 34 pruned. 
[I 2026-03-18 18:35:26,554] Trial 24 pruned. 
[I 2026-03-18 18:35:28,926] Trial 21 pruned. 
[I 2026-03-18 18:35:37,330] Trial 44 pruned. 
[I 2026-03-18 18:35:38,959] Trial 23 pruned. 
[I 2026-03-18 18:35:40,770] Trial 32 pruned. 
[I 2026-03-18 18:35:45,499] Trial 24 pruned. 
[I 2026-03-18 18:35:46,032] Trial 20 finished with value: -2.6298959927220653 and parameters: {'n_layers_yyx': 1, 'hidden_size_yyx_l0': 6, 'context_size_yyx': 4, 'num_mix_components_yyx': 5, 'context_extractor_yyx': 'lstm', 'activation_func_yyx': 'Tanh', 'L2_weight_yyx': 1.2919317399044194e-05, 'L_entropy_weight_yyx': 4.674352210432318e-07, 'L_sep_weight_yyx': 1.0760217648796995e-09, 'L_scale_weight_yyx': 1.2548800451583288e-09, 'learning_rate_yyx': 0.0042497091506896205}. Best is trial 15 with value: -2.6388607085013045.
[I 2026-03-18 18:35:51,431] Trial 22 pruned. 
[I 2026-03-18 18:35:59,890] Trial 23 finished with value: -2.637582350481317 and parameters: {'n_layers_yyx': 2, 'hidden_size_yyx_l0': 4, 'hidden_size_yyx_l1': 4, 'context_size_yyx': 3, 'num_mix_components_yyx': 5, 'context_extractor_yyx': 'lstm', 'activation_func_yyx': 'ReLU', 'L2_weight_yyx': 0.00019008623066494885, 'L_entropy_weight_yyx': 8.853266852169557e-10, 'L_sep_weight_yyx': 9.263578636413773e-07, 'L_scale_weight_yyx': 6.49888531175285e-06, 'learning_rate_yyx': 0.006333100079926328}. Best is trial 6 with value: -2.642843521506465.
[I 2026-03-18 18:36:02,731] Trial 25 pruned. 
[I 2026-03-18 18:36:04,321] Trial 19 pruned. 
[I 2026-03-18 18:36:13,801] Trial 35 pruned. 
