[I 2026-03-18 17:46:01,358] Trial 1 finished with value: -1.671168294287967 and parameters: {'n_layers_yyx': 1, 'hidden_size_yyx_l0': 3, 'context_size_yyx': 4, 'num_mix_components_yyx': 3, 'context_extractor_yyx': 'gru', 'activation_func_yyx': 'Tanh', 'L2_weight_yyx': 1.9387687729831806e-09, 'L_entropy_weight_yyx': 1.0677046084564722e-08, 'L_sep_weight_yyx': 1.5705454164470102e-06, 'L_scale_weight_yyx': 2.591471517555325e-08, 'learning_rate_yyx': 0.0036534611830838113}. Best is trial 1 with value: -1.671168294287967.
[I 2026-03-18 17:46:04,607] Trial 2 finished with value: -1.266387742019625 and parameters: {'n_layers_yyx': 1, 'hidden_size_yyx_l0': 2, 'context_size_yyx': 3, 'num_mix_components_yyx': 2, 'context_extractor_yyx': 'gru', 'activation_func_yyx': 'Tanh', 'L2_weight_yyx': 7.290329186654401e-09, 'L_entropy_weight_yyx': 5.90106487695967e-09, 'L_sep_weight_yyx': 0.0003530760496455976, 'L_scale_weight_yyx': 2.8966853681847865e-10, 'learning_rate_yyx': 0.00346206423036392}. Best is trial 2 with value: -1.266387742019625.
[I 2026-03-18 17:46:10,607] Trial 4 finished with value: -2.636739481451597 and parameters: {'n_layers_yyx': 2, 'hidden_size_yyx_l0': 6, 'hidden_size_yyx_l1': 6, 'context_size_yyx': 2, 'num_mix_components_yyx': 5, 'context_extractor_yyx': 'gru', 'activation_func_yyx': 'GELU', 'L2_weight_yyx': 2.2729456937681693e-08, 'L_entropy_weight_yyx': 3.7074182826943475e-06, 'L_sep_weight_yyx': 1.2346298789419667e-07, 'L_scale_weight_yyx': 9.882482338919416e-09, 'learning_rate_yyx': 0.005879062937888543}. Best is trial 4 with value: -2.636739481451597.
[I 2026-03-18 17:46:18,746] Trial 13 pruned. 
[I 2026-03-18 17:46:22,166] Trial 2 pruned. 
[I 2026-03-18 17:46:51,538] Trial 2 finished with value: -1.658351114326308 and parameters: {'n_layers_yyx': 2, 'hidden_size_yyx_l0': 2, 'hidden_size_yyx_l1': 5, 'context_size_yyx': 3, 'num_mix_components_yyx': 1, 'context_extractor_yyx': 'lstm', 'activation_func_yyx': 'ReLU', 'L2_weight_yyx': 2.025439417725037e-07, 'L_entropy_weight_yyx': 2.8498233632271157e-05, 'L_sep_weight_yyx': 6.670109213714947e-05, 'L_scale_weight_yyx': 1.3144571091357163e-07, 'learning_rate_yyx': 0.008234920581943896}. Best is trial 0 with value: -1.6702967433543936.
[I 2026-03-18 17:46:52,388] Trial 5 pruned. 
[I 2026-03-18 17:46:53,798] Trial 14 pruned. 
[I 2026-03-18 17:46:57,008] Trial 3 pruned. 
[I 2026-03-18 17:47:03,252] Trial 1 finished with value: -1.6496353397240882 and parameters: {'n_layers_yyx': 2, 'hidden_size_yyx_l0': 6, 'hidden_size_yyx_l1': 6, 'context_size_yyx': 3, 'num_mix_components_yyx': 1, 'context_extractor_yyx': 'lstm', 'activation_func_yyx': 'Tanh', 'L2_weight_yyx': 0.0001427587684458084, 'L_entropy_weight_yyx': 1.6113628205164332e-07, 'L_sep_weight_yyx': 0.00028572285675339894, 'L_scale_weight_yyx': 1.2929702637629547e-06, 'learning_rate_yyx': 0.0006300907616895927}. Best is trial 0 with value: -1.6521224388144589.
[I 2026-03-18 17:47:06,501] Trial 2 pruned. 
[I 2026-03-18 17:47:13,103] Trial 4 finished with value: -1.5735317758921825 and parameters: {'n_layers_yyx': 1, 'hidden_size_yyx_l0': 6, 'context_size_yyx': 2, 'num_mix_components_yyx': 1, 'context_extractor_yyx': 'gru', 'activation_func_yyx': 'ReLU', 'L2_weight_yyx': 2.918548240371024e-07, 'L_entropy_weight_yyx': 1.2551088502620734e-09, 'L_sep_weight_yyx': 1.1878369328624129e-09, 'L_scale_weight_yyx': 5.019632642368573e-06, 'learning_rate_yyx': 0.0037092749924307234}. Best is trial 0 with value: -1.6683178048964529.
[I 2026-03-18 17:47:27,402] Trial 3 pruned. 
[I 2026-03-18 17:47:31,739] Trial 6 pruned. 
[I 2026-03-18 17:47:40,049] Trial 2 pruned. 
[I 2026-03-18 17:47:42,967] Trial 5 finished with value: -1.6632071138001956 and parameters: {'n_layers_yyx': 2, 'hidden_size_yyx_l0': 3, 'hidden_size_yyx_l1': 5, 'context_size_yyx': 2, 'num_mix_components_yyx': 5, 'context_extractor_yyx': 'gru', 'activation_func_yyx': 'Tanh', 'L2_weight_yyx': 7.571875186159591e-07, 'L_entropy_weight_yyx': 1.9739965916457206e-05, 'L_sep_weight_yyx': 1.0444544241672201e-07, 'L_scale_weight_yyx': 1.0970959159835289e-08, 'learning_rate_yyx': 0.007055609882921094}. Best is trial 0 with value: -1.6656935052073152.
[I 2026-03-18 17:47:43,368] Trial 4 pruned. 
[I 2026-03-18 17:47:44,457] Trial 2 finished with value: -1.2544020196206027 and parameters: {'n_layers_yyx': 2, 'hidden_size_yyx_l0': 5, 'hidden_size_yyx_l1': 4, 'context_size_yyx': 3, 'num_mix_components_yyx': 5, 'context_extractor_yyx': 'gru', 'activation_func_yyx': 'GELU', 'L2_weight_yyx': 1.2063656430540226e-05, 'L_entropy_weight_yyx': 1.285899694254028e-08, 'L_sep_weight_yyx': 0.00013922826889027545, 'L_scale_weight_yyx': 1.3482787522029635e-10, 'learning_rate_yyx': 0.0006176434375212634}. Best is trial 0 with value: -1.2615266048974338.
[I 2026-03-18 17:47:46,847] Trial 5 pruned. 
[I 2026-03-18 17:47:53,750] Trial 15 pruned. 
[I 2026-03-18 17:48:02,752] Trial 4 pruned. 
[I 2026-03-18 17:48:05,358] Trial 2 pruned. 
[I 2026-03-18 17:48:05,571] Trial 4 finished with value: -2.6053823888937933 and parameters: {'n_layers_yyx': 2, 'hidden_size_yyx_l0': 5, 'hidden_size_yyx_l1': 5, 'context_size_yyx': 4, 'num_mix_components_yyx': 3, 'context_extractor_yyx': 'gru', 'activation_func_yyx': 'ReLU', 'L2_weight_yyx': 0.0008070038509142991, 'L_entropy_weight_yyx': 1.9168767237749383e-05, 'L_sep_weight_yyx': 4.8995469334200296e-05, 'L_scale_weight_yyx': 2.174083522340726e-08, 'learning_rate_yyx': 0.003406513949272366}. Best is trial 1 with value: -2.6371932379943503.
[I 2026-03-18 17:48:16,444] Trial 3 pruned. 
[I 2026-03-18 17:48:18,499] Trial 6 pruned. 
[I 2026-03-18 17:48:22,095] Trial 3 finished with value: -2.595833775826192 and parameters: {'n_layers_yyx': 2, 'hidden_size_yyx_l0': 6, 'hidden_size_yyx_l1': 2, 'context_size_yyx': 1, 'num_mix_components_yyx': 4, 'context_extractor_yyx': 'gru', 'activation_func_yyx': 'Tanh', 'L2_weight_yyx': 6.416324867079028e-07, 'L_entropy_weight_yyx': 3.411957076593947e-05, 'L_sep_weight_yyx': 5.988401136905612e-09, 'L_scale_weight_yyx': 6.772474083002828e-10, 'learning_rate_yyx': 0.002792164105300263}. Best is trial 0 with value: -2.631078101143863.
[I 2026-03-18 17:48:24,088] Trial 4 finished with value: -2.601442577327305 and parameters: {'n_layers_yyx': 1, 'hidden_size_yyx_l0': 4, 'context_size_yyx': 2, 'num_mix_components_yyx': 1, 'context_extractor_yyx': 'gru', 'activation_func_yyx': 'ReLU', 'L2_weight_yyx': 3.236751082332402e-09, 'L_entropy_weight_yyx': 3.4065300214960005e-08, 'L_sep_weight_yyx': 2.526591411720102e-09, 'L_scale_weight_yyx': 3.643140815339488e-08, 'learning_rate_yyx': 0.004776029219129623}. Best is trial 1 with value: -2.6376398477844947.
[I 2026-03-18 17:48:33,853] Trial 3 pruned. 
[I 2026-03-18 17:48:36,630] Trial 5 pruned. 
[I 2026-03-18 17:48:41,679] Trial 3 finished with value: -1.2710647653519778 and parameters: {'n_layers_yyx': 1, 'hidden_size_yyx_l0': 2, 'context_size_yyx': 4, 'num_mix_components_yyx': 3, 'context_extractor_yyx': 'gru', 'activation_func_yyx': 'Tanh', 'L2_weight_yyx': 1.5554235412695763e-10, 'L_entropy_weight_yyx': 1.915551035211306e-06, 'L_sep_weight_yyx': 1.3142663992633468e-05, 'L_scale_weight_yyx': 8.194954166892384e-09, 'learning_rate_yyx': 0.0033406829275801305}. Best is trial 3 with value: -1.2710647653519778.
[I 2026-03-18 17:48:46,633] Trial 5 pruned. 
[I 2026-03-18 17:48:50,525] Trial 6 finished with value: -2.6325565967930986 and parameters: {'n_layers_yyx': 2, 'hidden_size_yyx_l0': 4, 'hidden_size_yyx_l1': 5, 'context_size_yyx': 4, 'num_mix_components_yyx': 2, 'context_extractor_yyx': 'lstm', 'activation_func_yyx': 'GELU', 'L2_weight_yyx': 6.928247233760904e-10, 'L_entropy_weight_yyx': 1.7676082866980425e-09, 'L_sep_weight_yyx': 7.370560882682898e-08, 'L_scale_weight_yyx': 4.2436612346023636e-06, 'learning_rate_yyx': 0.008123923874410535}. Best is trial 6 with value: -2.6325565967930986.
[I 2026-03-18 17:48:56,500] Trial 7 pruned. 
[I 2026-03-18 17:48:59,315] Trial 16 pruned. 
[I 2026-03-18 17:49:06,503] Trial 2 pruned. 
[I 2026-03-18 17:49:17,504] Trial 4 pruned. 
[I 2026-03-18 17:49:29,103] Trial 7 pruned. 
[I 2026-03-18 17:49:32,640] Trial 2 finished with value: -1.6675552426908198 and parameters: {'n_layers_yyx': 2, 'hidden_size_yyx_l0': 3, 'hidden_size_yyx_l1': 5, 'context_size_yyx': 1, 'num_mix_components_yyx': 4, 'context_extractor_yyx': 'gru', 'activation_func_yyx': 'ReLU', 'L2_weight_yyx': 3.312184926289089e-07, 'L_entropy_weight_yyx': 1.8618217570260926e-08, 'L_sep_weight_yyx': 3.108888324262184e-08, 'L_scale_weight_yyx': 1.0733643674215059e-08, 'learning_rate_yyx': 0.0074408177609073005}. Best is trial 0 with value: -1.6746319320135328.
[I 2026-03-18 17:49:36,887] Trial 17 pruned. 
[I 2026-03-18 17:49:38,358] Trial 8 pruned. 
[I 2026-03-18 17:49:39,092] Trial 4 pruned. 
[I 2026-03-18 17:49:50,222] Trial 5 pruned. 
[I 2026-03-18 17:49:53,459] Trial 3 finished with value: -2.626351510537249 and parameters: {'n_layers_yyx': 1, 'hidden_size_yyx_l0': 5, 'context_size_yyx': 1, 'num_mix_components_yyx': 2, 'context_extractor_yyx': 'gru', 'activation_func_yyx': 'GELU', 'L2_weight_yyx': 7.006332457128266e-06, 'L_entropy_weight_yyx': 4.8924362403840086e-05, 'L_sep_weight_yyx': 1.2646147316829715e-10, 'L_scale_weight_yyx': 5.307443855227782e-07, 'learning_rate_yyx': 0.0008536655791500673}. Best is trial 0 with value: -2.633521153514828.
[I 2026-03-18 17:50:06,429] Trial 3 pruned. 
[I 2026-03-18 17:50:07,292] Trial 18 pruned. 
[I 2026-03-18 17:50:19,202] Trial 6 pruned. 
[I 2026-03-18 17:50:20,131] Trial 3 finished with value: -2.6380424367763933 and parameters: {'n_layers_yyx': 2, 'hidden_size_yyx_l0': 5, 'hidden_size_yyx_l1': 4, 'context_size_yyx': 1, 'num_mix_components_yyx': 5, 'context_extractor_yyx': 'gru', 'activation_func_yyx': 'Tanh', 'L2_weight_yyx': 7.282596839997382e-07, 'L_entropy_weight_yyx': 3.3696068360523925e-06, 'L_sep_weight_yyx': 1.4160431911430727e-05, 'L_scale_weight_yyx': 8.513289113192313e-09, 'learning_rate_yyx': 0.00784561033949965}. Best is trial 3 with value: -2.6380424367763933.
[I 2026-03-18 17:50:35,580] Trial 19 pruned. 
[I 2026-03-18 17:50:46,819] Trial 9 pruned. 
[I 2026-03-18 17:51:00,262] Trial 11 finished with value: -2.603671841256675 and parameters: {'n_layers_yyx': 2, 'hidden_size_yyx_l0': 2, 'hidden_size_yyx_l1': 6, 'context_size_yyx': 4, 'num_mix_components_yyx': 5, 'context_extractor_yyx': 'gru', 'activation_func_yyx': 'Tanh', 'L2_weight_yyx': 2.6642393507816506e-09, 'L_entropy_weight_yyx': 1.5057391388472602e-10, 'L_sep_weight_yyx': 0.0006101492932765724, 'L_scale_weight_yyx': 2.509595077055875e-08, 'learning_rate_yyx': 0.00982069543350042}. Best is trial 0 with value: -2.6330643191486622.
[I 2026-03-18 17:51:04,741] Trial 2 finished with value: -1.6720916355195472 and parameters: {'n_layers_yyx': 1, 'hidden_size_yyx_l0': 4, 'context_size_yyx': 3, 'num_mix_components_yyx': 2, 'context_extractor_yyx': 'gru', 'activation_func_yyx': 'Tanh', 'L2_weight_yyx': 8.063220891900636e-09, 'L_entropy_weight_yyx': 6.866057073420469e-06, 'L_sep_weight_yyx': 1.643814778554662e-05, 'L_scale_weight_yyx': 0.0006813512744687492, 'learning_rate_yyx': 0.006291144965080507}. Best is trial 2 with value: -1.6720916355195472.
[I 2026-03-18 17:51:05,252] Trial 4 pruned. 
[I 2026-03-18 17:51:34,025] Trial 3 pruned. 
[I 2026-03-18 17:51:34,026] Trial 20 pruned. 
[I 2026-03-18 17:51:38,694] Trial 8 finished with value: -2.64772205025879 and parameters: {'n_layers_yyx': 2, 'hidden_size_yyx_l0': 5, 'hidden_size_yyx_l1': 6, 'context_size_yyx': 2, 'num_mix_components_yyx': 5, 'context_extractor_yyx': 'gru', 'activation_func_yyx': 'Tanh', 'L2_weight_yyx': 2.0730300451612776e-08, 'L_entropy_weight_yyx': 1.7596955182561457e-07, 'L_sep_weight_yyx': 0.0008513487143781952, 'L_scale_weight_yyx': 1.6650900383541442e-10, 'learning_rate_yyx': 0.008622807547319616}. Best is trial 8 with value: -2.64772205025879.
[I 2026-03-18 17:51:56,807] Trial 3 finished with value: -1.6702219180124556 and parameters: {'n_layers_yyx': 1, 'hidden_size_yyx_l0': 3, 'context_size_yyx': 3, 'num_mix_components_yyx': 5, 'context_extractor_yyx': 'lstm', 'activation_func_yyx': 'GELU', 'L2_weight_yyx': 3.5453647431875717e-06, 'L_entropy_weight_yyx': 1.636256305770938e-08, 'L_sep_weight_yyx': 9.470269408815239e-09, 'L_scale_weight_yyx': 2.0723101669851437e-06, 'learning_rate_yyx': 0.003428807521249871}. Best is trial 2 with value: -1.6745893480229308.
[I 2026-03-18 17:51:56,807] Trial 5 finished with value: -1.6602788517633462 and parameters: {'n_layers_yyx': 1, 'hidden_size_yyx_l0': 6, 'context_size_yyx': 1, 'num_mix_components_yyx': 5, 'context_extractor_yyx': 'gru', 'activation_func_yyx': 'GELU', 'L2_weight_yyx': 0.0003259977260100893, 'L_entropy_weight_yyx': 1.8318951109687588e-06, 'L_sep_weight_yyx': 1.8568478439527102e-10, 'L_scale_weight_yyx': 1.7500959527644702e-06, 'learning_rate_yyx': 0.0058424655041495206}. Best is trial 0 with value: -1.6641703377100456.
[I 2026-03-18 17:51:59,680] Trial 21 pruned. 
[I 2026-03-18 17:52:01,183] Trial 4 finished with value: -2.601084242175187 and parameters: {'n_layers_yyx': 1, 'hidden_size_yyx_l0': 4, 'context_size_yyx': 3, 'num_mix_components_yyx': 4, 'context_extractor_yyx': 'gru', 'activation_func_yyx': 'Tanh', 'L2_weight_yyx': 0.000761990454321749, 'L_entropy_weight_yyx': 7.847024960433348e-07, 'L_sep_weight_yyx': 1.3135294599738836e-06, 'L_scale_weight_yyx': 0.00022220080410791137, 'learning_rate_yyx': 0.007301443164052348}. Best is trial 0 with value: -2.631078101143863.
[I 2026-03-18 17:52:01,855] Trial 4 pruned. 
[I 2026-03-18 17:52:25,891] Trial 4 pruned. 
[I 2026-03-18 17:52:32,260] Trial 6 finished with value: -1.2866238557375393 and parameters: {'n_layers_yyx': 1, 'hidden_size_yyx_l0': 4, 'context_size_yyx': 4, 'num_mix_components_yyx': 3, 'context_extractor_yyx': 'lstm', 'activation_func_yyx': 'Tanh', 'L2_weight_yyx': 2.810200606046596e-05, 'L_entropy_weight_yyx': 7.513774324413609e-08, 'L_sep_weight_yyx': 5.984448661226283e-08, 'L_scale_weight_yyx': 1.538290239080462e-07, 'learning_rate_yyx': 0.0005609252542925595}. Best is trial 1 with value: -1.2947146562429575.
[I 2026-03-18 17:52:39,909] Trial 2 finished with value: -1.6820484414711034 and parameters: {'n_layers_yyx': 2, 'hidden_size_yyx_l0': 3, 'hidden_size_yyx_l1': 5, 'context_size_yyx': 4, 'num_mix_components_yyx': 2, 'context_extractor_yyx': 'gru', 'activation_func_yyx': 'Tanh', 'L2_weight_yyx': 9.461408825519888e-06, 'L_entropy_weight_yyx': 0.00010379482745306767, 'L_sep_weight_yyx': 2.744430766856953e-07, 'L_scale_weight_yyx': 3.2887683178895696e-06, 'learning_rate_yyx': 0.003195465711578728}. Best is trial 2 with value: -1.6820484414711034.
[I 2026-03-18 17:52:43,735] Trial 9 pruned. 
[I 2026-03-18 17:52:48,995] Trial 2 finished with value: -1.666246732076009 and parameters: {'n_layers_yyx': 2, 'hidden_size_yyx_l0': 3, 'hidden_size_yyx_l1': 6, 'context_size_yyx': 1, 'num_mix_components_yyx': 5, 'context_extractor_yyx': 'lstm', 'activation_func_yyx': 'Tanh', 'L2_weight_yyx': 5.05645244288361e-10, 'L_entropy_weight_yyx': 1.7108361914300953e-06, 'L_sep_weight_yyx': 1.8395810307176756e-10, 'L_scale_weight_yyx': 2.5052123672649075e-10, 'learning_rate_yyx': 0.001515676817263133}. Best is trial 2 with value: -1.666246732076009.
[I 2026-03-18 17:52:54,135] Trial 5 pruned. 
[I 2026-03-18 17:52:54,817] Trial 22 pruned. 
[I 2026-03-18 17:53:03,322] Trial 5 pruned. 
[I 2026-03-18 17:53:09,015] Trial 4 pruned. 
[I 2026-03-18 17:53:09,804] Trial 5 pruned. 
[I 2026-03-18 17:53:10,445] Trial 3 finished with value: -1.6716727072281603 and parameters: {'n_layers_yyx': 1, 'hidden_size_yyx_l0': 5, 'context_size_yyx': 4, 'num_mix_components_yyx': 4, 'context_extractor_yyx': 'lstm', 'activation_func_yyx': 'GELU', 'L2_weight_yyx': 9.545545474201782e-05, 'L_entropy_weight_yyx': 4.5720103045123615e-09, 'L_sep_weight_yyx': 3.489660677639519e-06, 'L_scale_weight_yyx': 3.4810687362063326e-09, 'learning_rate_yyx': 0.006805104906461157}. Best is trial 3 with value: -1.6716727072281603.
[I 2026-03-18 17:53:18,206] Trial 2 finished with value: -1.6799626520210098 and parameters: {'n_layers_yyx': 1, 'hidden_size_yyx_l0': 3, 'context_size_yyx': 3, 'num_mix_components_yyx': 2, 'context_extractor_yyx': 'gru', 'activation_func_yyx': 'Tanh', 'L2_weight_yyx': 9.557519393229841e-05, 'L_entropy_weight_yyx': 1.371130046091175e-09, 'L_sep_weight_yyx': 0.00028460819198206967, 'L_scale_weight_yyx': 6.024006743536287e-09, 'learning_rate_yyx': 0.007808144105727918}. Best is trial 2 with value: -1.6799626520210098.
[I 2026-03-18 17:53:21,571] Trial 23 pruned. 
[I 2026-03-18 17:53:21,571] Trial 7 pruned. 
[I 2026-03-18 17:53:31,096] Trial 10 finished with value: -2.6003764674495518 and parameters: {'n_layers_yyx': 2, 'hidden_size_yyx_l0': 5, 'hidden_size_yyx_l1': 6, 'context_size_yyx': 3, 'num_mix_components_yyx': 1, 'context_extractor_yyx': 'gru', 'activation_func_yyx': 'GELU', 'L2_weight_yyx': 1.709988556957326e-07, 'L_entropy_weight_yyx': 1.7102973801671763e-06, 'L_sep_weight_yyx': 0.0007523829452593207, 'L_scale_weight_yyx': 0.00041767631973034606, 'learning_rate_yyx': 0.00933698210176159}. Best is trial 4 with value: -2.636739481451597.
[I 2026-03-18 17:53:40,571] Trial 4 pruned. 
[I 2026-03-18 17:53:41,630] Trial 6 pruned. 
[I 2026-03-18 17:53:42,424] Trial 12 finished with value: -2.600413300130924 and parameters: {'n_layers_yyx': 2, 'hidden_size_yyx_l0': 2, 'hidden_size_yyx_l1': 6, 'context_size_yyx': 4, 'num_mix_components_yyx': 5, 'context_extractor_yyx': 'gru', 'activation_func_yyx': 'Tanh', 'L2_weight_yyx': 1.957882499972863e-09, 'L_entropy_weight_yyx': 5.274241845701442e-09, 'L_sep_weight_yyx': 0.00018071644206055096, 'L_scale_weight_yyx': 7.198575693170594e-08, 'learning_rate_yyx': 0.005037662087610846}. Best is trial 0 with value: -2.6330643191486622.
[I 2026-03-18 17:53:43,743] Trial 5 pruned. 
[I 2026-03-18 17:53:47,979] Trial 3 pruned. 
[I 2026-03-18 17:53:49,293] Trial 24 pruned. 
[I 2026-03-18 17:53:50,060] Trial 6 pruned. 
[I 2026-03-18 17:54:04,662] Trial 3 finished with value: -1.2376297335527742 and parameters: {'n_layers_yyx': 1, 'hidden_size_yyx_l0': 4, 'context_size_yyx': 2, 'num_mix_components_yyx': 3, 'context_extractor_yyx': 'gru', 'activation_func_yyx': 'GELU', 'L2_weight_yyx': 4.863817262303322e-07, 'L_entropy_weight_yyx': 5.870995329550559e-07, 'L_sep_weight_yyx': 8.110198226461463e-10, 'L_scale_weight_yyx': 4.540495349689124e-05, 'learning_rate_yyx': 0.0008978715060929351}. Best is trial 2 with value: -1.2599548227024606.
[I 2026-03-18 17:54:13,980] Trial 25 pruned. 
[I 2026-03-18 17:54:14,700] Trial 7 pruned. 
[I 2026-03-18 17:54:16,167] Trial 6 pruned. 
[I 2026-03-18 17:54:18,890] Trial 3 finished with value: -1.6556967348864264 and parameters: {'n_layers_yyx': 1, 'hidden_size_yyx_l0': 6, 'context_size_yyx': 3, 'num_mix_components_yyx': 3, 'context_extractor_yyx': 'lstm', 'activation_func_yyx': 'ReLU', 'L2_weight_yyx': 4.98326462680871e-10, 'L_entropy_weight_yyx': 5.388863380120994e-07, 'L_sep_weight_yyx': 5.325131455553495e-06, 'L_scale_weight_yyx': 2.772769978718448e-07, 'learning_rate_yyx': 0.0034513708517042697}. Best is trial 3 with value: -1.6556967348864264.
[I 2026-03-18 17:54:34,717] Trial 3 finished with value: -1.2329006653396126 and parameters: {'n_layers_yyx': 2, 'hidden_size_yyx_l0': 2, 'hidden_size_yyx_l1': 2, 'context_size_yyx': 1, 'num_mix_components_yyx': 4, 'context_extractor_yyx': 'gru', 'activation_func_yyx': 'ReLU', 'L2_weight_yyx': 1.3697275886823442e-08, 'L_entropy_weight_yyx': 1.1036996191682401e-05, 'L_sep_weight_yyx': 2.2205179818059795e-09, 'L_scale_weight_yyx': 4.884663354953992e-05, 'learning_rate_yyx': 0.0019581405352620323}. Best is trial 2 with value: -1.266387742019625.
[I 2026-03-18 17:54:35,729] Trial 5 pruned. 
[I 2026-03-18 17:54:47,013] Trial 7 pruned. 
[I 2026-03-18 17:54:48,272] Trial 6 finished with value: -2.633962282802201 and parameters: {'n_layers_yyx': 2, 'hidden_size_yyx_l0': 3, 'hidden_size_yyx_l1': 3, 'context_size_yyx': 2, 'num_mix_components_yyx': 4, 'context_extractor_yyx': 'lstm', 'activation_func_yyx': 'ReLU', 'L2_weight_yyx': 7.763479176793183e-06, 'L_entropy_weight_yyx': 2.966253929296688e-10, 'L_sep_weight_yyx': 3.8458290175168603e-10, 'L_scale_weight_yyx': 1.2482569684815566e-06, 'learning_rate_yyx': 0.003459439231975056}. Best is trial 1 with value: -2.6371932379943503.
[I 2026-03-18 17:54:56,643] Trial 6 finished with value: -1.6613175811620717 and parameters: {'n_layers_yyx': 1, 'hidden_size_yyx_l0': 3, 'context_size_yyx': 3, 'num_mix_components_yyx': 3, 'context_extractor_yyx': 'lstm', 'activation_func_yyx': 'ReLU', 'L2_weight_yyx': 6.891847068857691e-10, 'L_entropy_weight_yyx': 7.292285750560384e-05, 'L_sep_weight_yyx': 1.7777254144323567e-10, 'L_scale_weight_yyx': 2.2221195839539944e-05, 'learning_rate_yyx': 0.008030024860785658}. Best is trial 0 with value: -1.6683178048964529.
[I 2026-03-18 17:54:57,883] Trial 7 finished with value: -1.2388420316516362 and parameters: {'n_layers_yyx': 2, 'hidden_size_yyx_l0': 5, 'hidden_size_yyx_l1': 5, 'context_size_yyx': 1, 'num_mix_components_yyx': 2, 'context_extractor_yyx': 'lstm', 'activation_func_yyx': 'ReLU', 'L2_weight_yyx': 2.2442443159910855e-07, 'L_entropy_weight_yyx': 6.4528226560459165e-09, 'L_sep_weight_yyx': 2.6051290569502727e-10, 'L_scale_weight_yyx': 1.4203841095631025e-07, 'learning_rate_yyx': 0.003433658424252232}. Best is trial 3 with value: -1.2710647653519778.
[I 2026-03-18 17:55:00,259] Trial 4 pruned. 
[I 2026-03-18 17:55:03,463] Trial 4 finished with value: -1.2631978019107952 and parameters: {'n_layers_yyx': 2, 'hidden_size_yyx_l0': 6, 'hidden_size_yyx_l1': 5, 'context_size_yyx': 3, 'num_mix_components_yyx': 3, 'context_extractor_yyx': 'lstm', 'activation_func_yyx': 'ReLU', 'L2_weight_yyx': 0.0006765094954785092, 'L_entropy_weight_yyx': 0.0003739059882008214, 'L_sep_weight_yyx': 0.0005830104345003299, 'L_scale_weight_yyx': 6.189154941967312e-10, 'learning_rate_yyx': 0.0013477906105819693}. Best is trial 4 with value: -1.2631978019107952.
