[I 2026-03-18 18:40:34,873] Trial 26 finished with value: -1.6602139293975389 and parameters: {'n_layers_yyx': 1, 'hidden_size_yyx_l0': 3, 'context_size_yyx': 3, 'num_mix_components_yyx': 5, 'context_extractor_yyx': 'lstm', 'activation_func_yyx': 'GELU', 'L2_weight_yyx': 2.1084108180105885e-09, 'L_entropy_weight_yyx': 6.151961114672453e-06, 'L_sep_weight_yyx': 1.5587390117860751e-09, 'L_scale_weight_yyx': 2.847593339240167e-07, 'learning_rate_yyx': 0.007820227984450296}. Best is trial 13 with value: -1.6722197537243195.
[I 2026-03-18 18:40:36,433] Trial 33 pruned. 
[I 2026-03-18 18:40:38,255] Trial 26 pruned. 
[I 2026-03-18 18:40:39,104] Trial 29 pruned. 
[I 2026-03-18 18:40:39,762] Trial 34 finished with value: -2.632204447674276 and parameters: {'n_layers_yyx': 1, 'hidden_size_yyx_l0': 5, 'context_size_yyx': 4, 'num_mix_components_yyx': 2, 'context_extractor_yyx': 'gru', 'activation_func_yyx': 'GELU', 'L2_weight_yyx': 2.6644693941947016e-07, 'L_entropy_weight_yyx': 5.319149675407516e-08, 'L_sep_weight_yyx': 9.948242956533905e-06, 'L_scale_weight_yyx': 7.540183581256159e-08, 'learning_rate_yyx': 0.007587284284187995}. Best is trial 12 with value: -2.6375437257353878.
[I 2026-03-18 18:40:39,871] Trial 40 pruned. 
[I 2026-03-18 18:40:45,391] Trial 24 pruned. 
[I 2026-03-18 18:40:45,780] Trial 37 pruned. 
[I 2026-03-18 18:40:47,277] Trial 47 pruned. 
[I 2026-03-18 18:40:51,255] Trial 30 pruned. 
[I 2026-03-18 18:40:56,794] Trial 27 pruned. 
[I 2026-03-18 18:40:56,917] Trial 31 finished with value: -1.2563130066707702 and parameters: {'n_layers_yyx': 2, 'hidden_size_yyx_l0': 6, 'hidden_size_yyx_l1': 6, 'context_size_yyx': 3, 'num_mix_components_yyx': 5, 'context_extractor_yyx': 'lstm', 'activation_func_yyx': 'ReLU', 'L2_weight_yyx': 3.7808546666287186e-08, 'L_entropy_weight_yyx': 9.939828682699166e-06, 'L_sep_weight_yyx': 2.8073776882782717e-10, 'L_scale_weight_yyx': 1.3782743779389e-07, 'learning_rate_yyx': 0.007981016551237924}. Best is trial 5 with value: -1.2714442113851663.
[I 2026-03-18 18:40:57,473] Trial 48 pruned. 
[I 2026-03-18 18:40:58,395] Trial 27 pruned. 
[I 2026-03-18 18:41:02,804] Trial 27 finished with value: -2.6346152593561185 and parameters: {'n_layers_yyx': 1, 'hidden_size_yyx_l0': 5, 'context_size_yyx': 2, 'num_mix_components_yyx': 5, 'context_extractor_yyx': 'gru', 'activation_func_yyx': 'Tanh', 'L2_weight_yyx': 3.042238333990858e-08, 'L_entropy_weight_yyx': 1.428468949106342e-08, 'L_sep_weight_yyx': 7.82886171134309e-07, 'L_scale_weight_yyx': 7.883845144447272e-06, 'learning_rate_yyx': 0.007314598054059476}. Best is trial 10 with value: -2.640669339569724.
[I 2026-03-18 18:41:03,839] Trial 25 pruned. 
[I 2026-03-18 18:41:15,471] Trial 26 pruned. 
[I 2026-03-18 18:41:17,825] Trial 27 finished with value: -1.6489696999487649 and parameters: {'n_layers_yyx': 2, 'hidden_size_yyx_l0': 4, 'hidden_size_yyx_l1': 6, 'context_size_yyx': 3, 'num_mix_components_yyx': 5, 'context_extractor_yyx': 'gru', 'activation_func_yyx': 'ReLU', 'L2_weight_yyx': 0.0002142414639047306, 'L_entropy_weight_yyx': 2.099395227252273e-06, 'L_sep_weight_yyx': 8.245661279467866e-10, 'L_scale_weight_yyx': 1.63853565051739e-08, 'learning_rate_yyx': 0.007777233562503689}. Best is trial 12 with value: -1.6645964610425732.
[I 2026-03-18 18:41:20,536] Trial 38 pruned. 
[I 2026-03-18 18:41:24,044] Trial 31 finished with value: -2.6505396688822733 and parameters: {'n_layers_yyx': 2, 'hidden_size_yyx_l0': 4, 'hidden_size_yyx_l1': 6, 'context_size_yyx': 4, 'num_mix_components_yyx': 5, 'context_extractor_yyx': 'gru', 'activation_func_yyx': 'ReLU', 'L2_weight_yyx': 5.763836148364828e-10, 'L_entropy_weight_yyx': 0.00032009687718545586, 'L_sep_weight_yyx': 1.744682162596816e-08, 'L_scale_weight_yyx': 2.6469434872838693e-09, 'learning_rate_yyx': 0.008276690725435505}. Best is trial 10 with value: -2.6537577311197915.
[I 2026-03-18 18:41:25,078] Trial 27 pruned. 
[I 2026-03-18 18:41:26,956] Trial 32 finished with value: -2.642474658626379 and parameters: {'n_layers_yyx': 1, 'hidden_size_yyx_l0': 3, 'context_size_yyx': 3, 'num_mix_components_yyx': 5, 'context_extractor_yyx': 'lstm', 'activation_func_yyx': 'ReLU', 'L2_weight_yyx': 0.0003406861395211491, 'L_entropy_weight_yyx': 5.618943951859347e-08, 'L_sep_weight_yyx': 1.6748312701130673e-09, 'L_scale_weight_yyx': 7.157365856835756e-05, 'learning_rate_yyx': 0.0096120420211842}. Best is trial 31 with value: -2.642702042239214.
[I 2026-03-18 18:41:29,799] Trial 25 pruned. 
[I 2026-03-18 18:41:31,932] Trial 39 pruned. 
[I 2026-03-18 18:41:33,692] Trial 28 pruned. 
[I 2026-03-18 18:41:34,313] Trial 28 finished with value: -1.6636425647974245 and parameters: {'n_layers_yyx': 2, 'hidden_size_yyx_l0': 5, 'hidden_size_yyx_l1': 5, 'context_size_yyx': 3, 'num_mix_components_yyx': 2, 'context_extractor_yyx': 'lstm', 'activation_func_yyx': 'ReLU', 'L2_weight_yyx': 4.688501806134648e-08, 'L_entropy_weight_yyx': 1.3912415718896681e-05, 'L_sep_weight_yyx': 2.4633694759898316e-06, 'L_scale_weight_yyx': 1.8274314920508175e-08, 'learning_rate_yyx': 0.00593124283874634}. Best is trial 11 with value: -1.6687842250673444.
[I 2026-03-18 18:41:38,891] Trial 13 finished with value: -1.6705420913622362 and parameters: {'n_layers_yyx': 2, 'hidden_size_yyx_l0': 4, 'hidden_size_yyx_l1': 5, 'context_size_yyx': 4, 'num_mix_components_yyx': 5, 'context_extractor_yyx': 'lstm', 'activation_func_yyx': 'ReLU', 'L2_weight_yyx': 2.2129484259460196e-06, 'L_entropy_weight_yyx': 0.00023965070481227546, 'L_sep_weight_yyx': 2.036671069189055e-08, 'L_scale_weight_yyx': 8.434083008875528e-08, 'learning_rate_yyx': 0.003480637157828457}. Best is trial 13 with value: -1.6705420913622362.
[I 2026-03-18 18:41:40,798] Trial 28 pruned. 
[I 2026-03-18 18:41:40,897] Trial 30 pruned. 
[I 2026-03-18 18:41:42,629] Trial 40 pruned. 
[I 2026-03-18 18:41:43,443] Trial 31 pruned. 
[I 2026-03-18 18:41:43,444] Trial 26 pruned. 
[I 2026-03-18 18:41:45,096] Trial 39 pruned. 
[I 2026-03-18 18:41:48,606] Trial 29 pruned. 
[I 2026-03-18 18:41:50,898] Trial 29 pruned. 
[I 2026-03-18 18:41:51,544] Trial 28 pruned. 
[I 2026-03-18 18:41:53,760] Trial 29 pruned. 
[I 2026-03-18 18:41:54,670] Trial 24 finished with value: -1.6754733132444057 and parameters: {'n_layers_yyx': 2, 'hidden_size_yyx_l0': 6, 'hidden_size_yyx_l1': 6, 'context_size_yyx': 4, 'num_mix_components_yyx': 2, 'context_extractor_yyx': 'gru', 'activation_func_yyx': 'Tanh', 'L2_weight_yyx': 0.0005502387064128556, 'L_entropy_weight_yyx': 1.0968768040999047e-05, 'L_sep_weight_yyx': 3.402355539093956e-06, 'L_scale_weight_yyx': 7.622944174479813e-08, 'learning_rate_yyx': 0.002472140857143674}. Best is trial 2 with value: -1.6820484414711034.
[I 2026-03-18 18:41:55,049] Trial 32 finished with value: -1.2520119108245906 and parameters: {'n_layers_yyx': 2, 'hidden_size_yyx_l0': 6, 'hidden_size_yyx_l1': 6, 'context_size_yyx': 3, 'num_mix_components_yyx': 5, 'context_extractor_yyx': 'lstm', 'activation_func_yyx': 'ReLU', 'L2_weight_yyx': 9.577889431299637e-09, 'L_entropy_weight_yyx': 2.5330214467739723e-05, 'L_sep_weight_yyx': 3.0965596071933264e-10, 'L_scale_weight_yyx': 1.507865422863274e-08, 'learning_rate_yyx': 0.007709314704244365}. Best is trial 5 with value: -1.2714442113851663.
[I 2026-03-18 18:41:56,655] Trial 27 pruned. 
[I 2026-03-18 18:41:57,238] Trial 30 pruned. 
[I 2026-03-18 18:41:58,495] Trial 41 pruned. 
[I 2026-03-18 18:42:00,369] Trial 30 pruned. 
[I 2026-03-18 18:42:00,579] Trial 41 pruned. 
[I 2026-03-18 18:42:00,977] Trial 32 pruned. 
[I 2026-03-18 18:42:05,412] Trial 35 pruned. 
[I 2026-03-18 18:42:05,646] Trial 31 pruned. 
[I 2026-03-18 18:42:05,734] Trial 37 finished with value: -1.6682759891689913 and parameters: {'n_layers_yyx': 1, 'hidden_size_yyx_l0': 3, 'context_size_yyx': 4, 'num_mix_components_yyx': 3, 'context_extractor_yyx': 'gru', 'activation_func_yyx': 'GELU', 'L2_weight_yyx': 0.00014647425408261037, 'L_entropy_weight_yyx': 8.389536441648814e-07, 'L_sep_weight_yyx': 8.936233848400812e-09, 'L_scale_weight_yyx': 7.024534095710186e-05, 'learning_rate_yyx': 0.004141920412818319}. Best is trial 2 with value: -1.6745893480229308.
[I 2026-03-18 18:42:08,828] Trial 31 finished with value: -1.2665373966125375 and parameters: {'n_layers_yyx': 1, 'hidden_size_yyx_l0': 4, 'context_size_yyx': 4, 'num_mix_components_yyx': 4, 'context_extractor_yyx': 'gru', 'activation_func_yyx': 'Tanh', 'L2_weight_yyx': 0.0009404305813173686, 'L_entropy_weight_yyx': 0.0008844243961870156, 'L_sep_weight_yyx': 2.7222907305874266e-07, 'L_scale_weight_yyx': 0.00046298397364654456, 'learning_rate_yyx': 0.005017885665978882}. Best is trial 6 with value: -1.270142151555821.
[I 2026-03-18 18:42:09,139] Trial 25 finished with value: -1.6639938354492188 and parameters: {'n_layers_yyx': 1, 'hidden_size_yyx_l0': 4, 'context_size_yyx': 3, 'num_mix_components_yyx': 3, 'context_extractor_yyx': 'gru', 'activation_func_yyx': 'GELU', 'L2_weight_yyx': 2.0359974953588764e-06, 'L_entropy_weight_yyx': 1.6876840138802305e-08, 'L_sep_weight_yyx': 1.1276046874598343e-10, 'L_scale_weight_yyx': 3.248566115416664e-08, 'learning_rate_yyx': 0.007185668032386852}. Best is trial 2 with value: -1.6799626520210098.
[I 2026-03-18 18:42:09,180] Trial 26 finished with value: -1.6654031072475224 and parameters: {'n_layers_yyx': 2, 'hidden_size_yyx_l0': 5, 'hidden_size_yyx_l1': 5, 'context_size_yyx': 3, 'num_mix_components_yyx': 4, 'context_extractor_yyx': 'gru', 'activation_func_yyx': 'Tanh', 'L2_weight_yyx': 7.871557554438583e-08, 'L_entropy_weight_yyx': 5.803095566564415e-06, 'L_sep_weight_yyx': 9.469465211653564e-08, 'L_scale_weight_yyx': 0.000250342868222332, 'learning_rate_yyx': 0.006836041217184091}. Best is trial 0 with value: -1.6683178048964529.
[I 2026-03-18 18:42:12,989] Trial 25 pruned. 
[I 2026-03-18 18:42:13,979] Trial 26 finished with value: -1.7245504413073576 and parameters: {'n_layers_yyx': 1, 'hidden_size_yyx_l0': 3, 'context_size_yyx': 4, 'num_mix_components_yyx': 4, 'context_extractor_yyx': 'lstm', 'activation_func_yyx': 'ReLU', 'L2_weight_yyx': 7.69084376581849e-10, 'L_entropy_weight_yyx': 6.322508962993375e-09, 'L_sep_weight_yyx': 1.477336617151855e-06, 'L_scale_weight_yyx': 1.4342982383439453e-06, 'learning_rate_yyx': 0.002708082614278161}. Best is trial 15 with value: -1.72713993893394.
[I 2026-03-18 18:42:15,968] Trial 40 pruned. 
[I 2026-03-18 18:42:16,076] Trial 49 finished with value: -1.2598737083948575 and parameters: {'n_layers_yyx': 2, 'hidden_size_yyx_l0': 5, 'hidden_size_yyx_l1': 5, 'context_size_yyx': 4, 'num_mix_components_yyx': 1, 'context_extractor_yyx': 'gru', 'activation_func_yyx': 'Tanh', 'L2_weight_yyx': 7.662027527451322e-09, 'L_entropy_weight_yyx': 1.007950049794288e-08, 'L_sep_weight_yyx': 1.4059012898984653e-06, 'L_scale_weight_yyx': 0.000368152573335936, 'learning_rate_yyx': 0.004936710441735284}. Best is trial 8 with value: -1.3030293492170482.

Source events: 5634
Target events: 1872
Full model ln_yyx : 28.87048 nats/sec, 13.88004 nats/event
Full model Log loss : -1.26783
Full model ln_yyx : 29.09667 nats/sec, 13.98878 nats/event
Full model Log loss : -1.29471
Full model ln_yyx : 28.90544 nats/sec, 13.89685 nats/event
Full model Log loss : -1.28608
Full model ln_yyx : 29.44193 nats/sec, 14.15477 nats/event
Full model Log loss : -1.28662
Full model ln_yyx : 29.74202 nats/sec, 14.29905 nats/event
Full model Log loss : -1.30303
Full model ln_yyx : 29.35409 nats/sec, 14.11254 nats/event
Full model Log loss : -1.28137
Full model ln_yyx : 28.73795 nats/sec, 13.81632 nats/event
Full model Log loss : -1.26236
Full model ln_yyx : 28.99316 nats/sec, 13.93902 nats/event
Full model Log loss : -1.28987
Full model ln_yyx : 29.22400 nats/sec, 14.05000 nats/event
Full model Log loss : -1.28951
Full model ln_yyx : 29.56615 nats/sec, 14.21450 nats/event
Full model Log loss : -1.28388
Full model ln_yyx : 29.18442 nats/sec, 14.03097 nats/event
Full model Log loss : -1.25987
Optimization finished. Config saved to results/opt-full/opt_full_96_best_config.txt
[I 2026-03-18 18:42:19,965] Trial 18 finished with value: -1.6576565383602726 and parameters: {'n_layers_yyx': 1, 'hidden_size_yyx_l0': 6, 'context_size_yyx': 3, 'num_mix_components_yyx': 5, 'context_extractor_yyx': 'lstm', 'activation_func_yyx': 'Tanh', 'L2_weight_yyx': 1.31627695672224e-10, 'L_entropy_weight_yyx': 7.556027844895915e-10, 'L_sep_weight_yyx': 0.00029879868159995104, 'L_scale_weight_yyx': 1.2246887153345851e-06, 'learning_rate_yyx': 0.0029073964166835206}. Best is trial 15 with value: -1.6735151417560596.
[I 2026-03-18 18:42:22,352] Trial 26 pruned. 
[I 2026-03-18 18:42:24,815] Trial 27 pruned. 
[I 2026-03-18 18:42:25,586] Trial 32 pruned. 
[I 2026-03-18 18:42:26,523] Trial 14 pruned. 
[I 2026-03-18 18:42:26,530] Trial 38 pruned. 
[I 2026-03-18 18:42:28,943] Trial 42 pruned. 
[I 2026-03-18 18:42:29,225] Trial 34 pruned. 
[I 2026-03-18 18:42:30,615] Trial 19 pruned. 
[I 2026-03-18 18:42:33,680] Trial 27 pruned. 
[I 2026-03-18 18:42:33,958] Trial 27 finished with value: -1.619786161545725 and parameters: {'n_layers_yyx': 2, 'hidden_size_yyx_l0': 4, 'hidden_size_yyx_l1': 6, 'context_size_yyx': 2, 'num_mix_components_yyx': 1, 'context_extractor_yyx': 'gru', 'activation_func_yyx': 'Tanh', 'L2_weight_yyx': 1.9849967282596494e-05, 'L_entropy_weight_yyx': 1.0764038169212212e-06, 'L_sep_weight_yyx': 4.574112210211048e-07, 'L_scale_weight_yyx': 4.084959083049179e-07, 'learning_rate_yyx': 0.0018145281758843914}. Best is trial 19 with value: -1.6674850489567747.
[I 2026-03-18 18:42:33,982] Trial 38 finished with value: -1.2412424140408387 and parameters: {'n_layers_yyx': 1, 'hidden_size_yyx_l0': 6, 'context_size_yyx': 2, 'num_mix_components_yyx': 4, 'context_extractor_yyx': 'gru', 'activation_func_yyx': 'ReLU', 'L2_weight_yyx': 2.0520841145577406e-08, 'L_entropy_weight_yyx': 2.3815129241914704e-08, 'L_sep_weight_yyx': 1.2768723474227166e-06, 'L_scale_weight_yyx': 1.285944782140791e-07, 'learning_rate_yyx': 0.006041190221151771}. Best is trial 26 with value: -1.2682363612374183.
[I 2026-03-18 18:42:37,417] Trial 33 pruned. 
[I 2026-03-18 18:42:42,128] Trial 20 pruned. 
[I 2026-03-18 18:42:42,415] Trial 27 finished with value: -1.65932824774587 and parameters: {'n_layers_yyx': 2, 'hidden_size_yyx_l0': 6, 'hidden_size_yyx_l1': 4, 'context_size_yyx': 1, 'num_mix_components_yyx': 3, 'context_extractor_yyx': 'lstm', 'activation_func_yyx': 'Tanh', 'L2_weight_yyx': 0.0008166878176005524, 'L_entropy_weight_yyx': 0.000329406765983583, 'L_sep_weight_yyx': 5.8215613932929035e-09, 'L_scale_weight_yyx': 6.564873652085664e-06, 'learning_rate_yyx': 0.009768874626988886}. Best is trial 22 with value: -1.6757910143766872.
[I 2026-03-18 18:42:44,119] Trial 27 pruned. 
[I 2026-03-18 18:42:46,095] Trial 43 pruned. 
[I 2026-03-18 18:42:47,072] Trial 28 pruned. 
[I 2026-03-18 18:42:47,184] Trial 33 pruned. 
[I 2026-03-18 18:42:48,263] Trial 39 pruned. 
[I 2026-03-18 18:42:49,114] Trial 42 pruned. 
[I 2026-03-18 18:42:49,279] Trial 21 pruned. 
[I 2026-03-18 18:42:49,546] Trial 27 finished with value: -1.6742712595465095 and parameters: {'n_layers_yyx': 2, 'hidden_size_yyx_l0': 4, 'hidden_size_yyx_l1': 6, 'context_size_yyx': 4, 'num_mix_components_yyx': 4, 'context_extractor_yyx': 'lstm', 'activation_func_yyx': 'Tanh', 'L2_weight_yyx': 2.3142073572646207e-09, 'L_entropy_weight_yyx': 3.260648350476333e-08, 'L_sep_weight_yyx': 0.0005366157239393767, 'L_scale_weight_yyx': 4.98469920626204e-10, 'learning_rate_yyx': 0.005577233100661748}. Best is trial 27 with value: -1.6742712595465095.
[I 2026-03-18 18:42:52,721] Trial 32 pruned. 
[I 2026-03-18 18:42:52,760] Trial 28 pruned. 
[I 2026-03-18 18:42:54,928] Trial 33 pruned. 
[I 2026-03-18 18:42:57,051] Trial 28 pruned. 
[I 2026-03-18 18:42:57,811] Trial 40 pruned. 
[I 2026-03-18 18:42:58,797] Trial 43 pruned. 
[I 2026-03-18 18:42:59,667] Trial 34 pruned. 
[I 2026-03-18 18:43:05,472] Trial 34 pruned. 
[I 2026-03-18 18:43:06,059] Trial 29 pruned. 
[I 2026-03-18 18:43:07,946] Trial 44 pruned. 
[I 2026-03-18 18:43:08,414] Trial 33 pruned. 
[I 2026-03-18 18:43:13,666] Trial 29 pruned. 
[I 2026-03-18 18:43:14,084] Trial 30 pruned. 
[I 2026-03-18 18:43:14,399] Trial 36 finished with value: -2.599904252116524 and parameters: {'n_layers_yyx': 1, 'hidden_size_yyx_l0': 5, 'context_size_yyx': 4, 'num_mix_components_yyx': 1, 'context_extractor_yyx': 'lstm', 'activation_func_yyx': 'Tanh', 'L2_weight_yyx': 8.918520417713015e-07, 'L_entropy_weight_yyx': 2.8426112097120053e-07, 'L_sep_weight_yyx': 7.680857713456559e-07, 'L_scale_weight_yyx': 1.932424821336844e-09, 'learning_rate_yyx': 0.008015382740883351}. Best is trial 12 with value: -2.6375437257353878.
[I 2026-03-18 18:43:14,780] Trial 39 pruned. 
[I 2026-03-18 18:43:14,986] Trial 41 pruned. 
[I 2026-03-18 18:43:14,998] Trial 31 finished with value: -1.6634490092977867 and parameters: {'n_layers_yyx': 2, 'hidden_size_yyx_l0': 6, 'hidden_size_yyx_l1': 6, 'context_size_yyx': 3, 'num_mix_components_yyx': 2, 'context_extractor_yyx': 'gru', 'activation_func_yyx': 'GELU', 'L2_weight_yyx': 4.83148058692671e-09, 'L_entropy_weight_yyx': 7.522203383860827e-05, 'L_sep_weight_yyx': 4.385488478370261e-09, 'L_scale_weight_yyx': 2.2012884471982076e-09, 'learning_rate_yyx': 0.009866010193544984}. Best is trial 11 with value: -1.6687842250673444.
[I 2026-03-18 18:43:16,518] Trial 45 pruned. 
[I 2026-03-18 18:43:17,011] Trial 28 pruned. 
[I 2026-03-18 18:43:18,430] Trial 34 pruned. 
[I 2026-03-18 18:43:18,582] Trial 33 pruned. 
[I 2026-03-18 18:43:23,180] Trial 35 pruned. 
[I 2026-03-18 18:43:24,194] Trial 40 pruned. 
[I 2026-03-18 18:43:26,855] Trial 32 finished with value: -2.653104206203135 and parameters: {'n_layers_yyx': 2, 'hidden_size_yyx_l0': 4, 'hidden_size_yyx_l1': 6, 'context_size_yyx': 4, 'num_mix_components_yyx': 5, 'context_extractor_yyx': 'gru', 'activation_func_yyx': 'ReLU', 'L2_weight_yyx': 1.1645034228204607e-09, 'L_entropy_weight_yyx': 0.00028397784928039973, 'L_sep_weight_yyx': 2.5856922832221252e-08, 'L_scale_weight_yyx': 8.942685571279705e-10, 'learning_rate_yyx': 0.0057258985115999465}. Best is trial 10 with value: -2.6537577311197915.
[I 2026-03-18 18:43:27,348] Trial 42 pruned. 
[I 2026-03-18 18:43:27,348] Trial 46 pruned. 
[I 2026-03-18 18:43:27,865] Trial 28 finished with value: -1.6514208704606057 and parameters: {'n_layers_yyx': 2, 'hidden_size_yyx_l0': 4, 'hidden_size_yyx_l1': 6, 'context_size_yyx': 3, 'num_mix_components_yyx': 1, 'context_extractor_yyx': 'gru', 'activation_func_yyx': 'ReLU', 'L2_weight_yyx': 2.503680017906953e-08, 'L_entropy_weight_yyx': 2.7521073132918364e-05, 'L_sep_weight_yyx': 5.018000082306584e-06, 'L_scale_weight_yyx': 1.2579821610036883e-05, 'learning_rate_yyx': 0.004047854443265714}. Best is trial 23 with value: -1.675936991716372.
[I 2026-03-18 18:43:33,140] Trial 28 pruned. 
[I 2026-03-18 18:43:33,321] Trial 29 pruned. 
[I 2026-03-18 18:43:33,739] Trial 41 pruned. 
[I 2026-03-18 18:43:34,465] Trial 30 pruned. 
[I 2026-03-18 18:43:35,611] Trial 31 pruned. 
[I 2026-03-18 18:43:35,946] Trial 47 pruned. 
[I 2026-03-18 18:43:36,281] Trial 31 finished with value: -1.67178506181146 and parameters: {'n_layers_yyx': 1, 'hidden_size_yyx_l0': 5, 'context_size_yyx': 4, 'num_mix_components_yyx': 3, 'context_extractor_yyx': 'lstm', 'activation_func_yyx': 'Tanh', 'L2_weight_yyx': 6.689221282962063e-07, 'L_entropy_weight_yyx': 3.9645715538535886e-08, 'L_sep_weight_yyx': 7.69814532005382e-08, 'L_scale_weight_yyx': 4.109306242465705e-09, 'learning_rate_yyx': 0.00907207497482807}. Best is trial 23 with value: -1.6757874282308216.
[I 2026-03-18 18:43:36,567] Trial 29 pruned. 
[I 2026-03-18 18:43:36,878] Trial 22 pruned. 
[I 2026-03-18 18:43:39,888] Trial 34 pruned. 
[I 2026-03-18 18:43:43,036] Trial 23 finished with value: -2.636624749536474 and parameters: {'n_layers_yyx': 1, 'hidden_size_yyx_l0': 4, 'context_size_yyx': 4, 'num_mix_components_yyx': 5, 'context_extractor_yyx': 'gru', 'activation_func_yyx': 'Tanh', 'L2_weight_yyx': 0.00011155238324800166, 'L_entropy_weight_yyx': 0.0001864508466783558, 'L_sep_weight_yyx': 1.2174437298715717e-07, 'L_scale_weight_yyx': 5.715297504367456e-09, 'learning_rate_yyx': 0.007152601455491635}. Best is trial 21 with value: -2.6405605351488926.
[I 2026-03-18 18:43:45,680] Trial 32 pruned. 
[I 2026-03-18 18:43:45,840] Trial 37 pruned. 
[I 2026-03-18 18:43:48,357] Trial 35 pruned. 
[I 2026-03-18 18:43:49,825] Trial 42 pruned. 
[I 2026-03-18 18:43:54,875] Trial 33 pruned. 
[I 2026-03-18 18:43:57,239] Trial 23 pruned. 
[I 2026-03-18 18:44:02,195] Trial 35 pruned. 
[I 2026-03-18 18:44:10,189] Trial 36 pruned. 
[I 2026-03-18 18:44:10,311] Trial 34 pruned. 
[I 2026-03-18 18:44:15,607] Trial 36 pruned. 
[I 2026-03-18 18:44:17,641] Trial 38 pruned. 
[I 2026-03-18 18:44:18,391] Trial 28 finished with value: -2.636764521573349 and parameters: {'n_layers_yyx': 1, 'hidden_size_yyx_l0': 4, 'context_size_yyx': 3, 'num_mix_components_yyx': 5, 'context_extractor_yyx': 'lstm', 'activation_func_yyx': 'GELU', 'L2_weight_yyx': 3.7965346386810943e-08, 'L_entropy_weight_yyx': 1.0952560082550697e-09, 'L_sep_weight_yyx': 2.3713877338355943e-06, 'L_scale_weight_yyx': 6.8479864341638975e-06, 'learning_rate_yyx': 0.009948070446468378}. Best is trial 6 with value: -2.642843521506465.
[I 2026-03-18 18:44:21,282] Trial 44 finished with value: -2.5973209878151984 and parameters: {'n_layers_yyx': 2, 'hidden_size_yyx_l0': 4, 'hidden_size_yyx_l1': 4, 'context_size_yyx': 1, 'num_mix_components_yyx': 4, 'context_extractor_yyx': 'lstm', 'activation_func_yyx': 'ReLU', 'L2_weight_yyx': 2.934908815603905e-06, 'L_entropy_weight_yyx': 6.433854254423403e-08, 'L_sep_weight_yyx': 0.0004258224323422243, 'L_scale_weight_yyx': 8.390142963074175e-09, 'learning_rate_yyx': 0.004568121915949313}. Best is trial 14 with value: -2.6415204441902964.
[I 2026-03-18 18:44:21,453] Trial 37 pruned. 
