[I 2026-03-18 16:51:25,029] Trial 17 finished with value: -2.804520504776223 and parameters: {'n_layers_yyx': 2, 'hidden_size_yyx_l0': 4, 'hidden_size_yyx_l1': 2, 'context_size_yyx': 3, 'num_mix_components_yyx': 3, 'context_extractor_yyx': 'gru', 'activation_func_yyx': 'ReLU', 'L2_weight_yyx': 2.7586063959957776e-10, 'L_entropy_weight_yyx': 4.8724076758682975e-08, 'L_sep_weight_yyx': 4.086224411415772e-08, 'L_scale_weight_yyx': 1.1201864920050322e-09, 'learning_rate_yyx': 0.0045778303423925975}. Best is trial 6 with value: -2.805382927239302.
[I 2026-03-18 16:51:26,002] Trial 17 pruned. 
[I 2026-03-18 16:51:26,135] Trial 17 finished with value: -2.796926931130639 and parameters: {'n_layers_yyx': 2, 'hidden_size_yyx_l0': 5, 'hidden_size_yyx_l1': 5, 'context_size_yyx': 2, 'num_mix_components_yyx': 5, 'context_extractor_yyx': 'lstm', 'activation_func_yyx': 'Tanh', 'L2_weight_yyx': 6.394588897729226e-07, 'L_entropy_weight_yyx': 1.5126864331249235e-06, 'L_sep_weight_yyx': 1.0721290149595514e-07, 'L_scale_weight_yyx': 6.679252262428484e-05, 'learning_rate_yyx': 0.00929415438310474}. Best is trial 14 with value: -2.7995943704403503.
[I 2026-03-18 16:51:30,878] Trial 18 pruned. 
[I 2026-03-18 16:51:33,062] Trial 37 pruned. 
[I 2026-03-18 16:51:40,126] Trial 18 pruned. 
[I 2026-03-18 16:51:40,544] Trial 25 finished with value: -2.798419282521981 and parameters: {'n_layers_yyx': 2, 'hidden_size_yyx_l0': 5, 'hidden_size_yyx_l1': 5, 'context_size_yyx': 3, 'num_mix_components_yyx': 5, 'context_extractor_yyx': 'gru', 'activation_func_yyx': 'ReLU', 'L2_weight_yyx': 3.774877730345191e-06, 'L_entropy_weight_yyx': 2.0893458543926452e-07, 'L_sep_weight_yyx': 1.4940658471513773e-05, 'L_scale_weight_yyx': 5.232064284790377e-08, 'learning_rate_yyx': 0.004721186701463655}. Best is trial 5 with value: -2.803729491226789.
[I 2026-03-18 16:51:45,070] Trial 19 pruned. 
[I 2026-03-18 16:51:46,030] Trial 19 pruned. 
[I 2026-03-18 16:51:46,466] Trial 26 pruned. 
[I 2026-03-18 16:51:46,728] Trial 38 pruned. 
[I 2026-03-18 16:51:52,060] Trial 20 pruned. 
[I 2026-03-18 16:51:52,579] Trial 31 finished with value: -2.8053162490028227 and parameters: {'n_layers_yyx': 1, 'hidden_size_yyx_l0': 6, 'context_size_yyx': 4, 'num_mix_components_yyx': 2, 'context_extractor_yyx': 'gru', 'activation_func_yyx': 'ReLU', 'L2_weight_yyx': 4.882854694046883e-09, 'L_entropy_weight_yyx': 6.293283432356806e-08, 'L_sep_weight_yyx': 1.6655617121667977e-10, 'L_scale_weight_yyx': 9.644180201753176e-08, 'learning_rate_yyx': 0.006235204683884471}. Best is trial 13 with value: -2.8082553050147787.
[I 2026-03-18 16:51:57,968] Trial 21 pruned. 
[I 2026-03-18 16:52:03,147] Trial 34 pruned. 
[I 2026-03-18 16:52:03,903] Trial 22 pruned. 
[I 2026-03-18 16:52:12,238] Trial 24 pruned. 
[I 2026-03-18 16:52:12,241] Trial 19 finished with value: -2.78319763173606 and parameters: {'n_layers_yyx': 1, 'hidden_size_yyx_l0': 2, 'context_size_yyx': 1, 'num_mix_components_yyx': 1, 'context_extractor_yyx': 'lstm', 'activation_func_yyx': 'ReLU', 'L2_weight_yyx': 2.8084120358170627e-07, 'L_entropy_weight_yyx': 2.5825184316067076e-07, 'L_sep_weight_yyx': 3.1216825460002318e-06, 'L_scale_weight_yyx': 0.0008891972456642834, 'learning_rate_yyx': 0.001490478474984692}. Best is trial 7 with value: -2.8073737460176833.
[I 2026-03-18 16:52:16,074] Trial 29 finished with value: -2.801567825469696 and parameters: {'n_layers_yyx': 1, 'hidden_size_yyx_l0': 5, 'context_size_yyx': 4, 'num_mix_components_yyx': 5, 'context_extractor_yyx': 'lstm', 'activation_func_yyx': 'ReLU', 'L2_weight_yyx': 4.11362488286309e-08, 'L_entropy_weight_yyx': 2.759451663855593e-09, 'L_sep_weight_yyx': 1.2822605621320628e-07, 'L_scale_weight_yyx': 7.290665000257795e-06, 'learning_rate_yyx': 0.00527927171523434}. Best is trial 26 with value: -2.8070715765499714.
[I 2026-03-18 16:52:18,443] Trial 23 pruned. 
[I 2026-03-18 16:52:19,790] Trial 20 finished with value: -2.804499290789662 and parameters: {'n_layers_yyx': 2, 'hidden_size_yyx_l0': 5, 'hidden_size_yyx_l1': 4, 'context_size_yyx': 3, 'num_mix_components_yyx': 5, 'context_extractor_yyx': 'lstm', 'activation_func_yyx': 'Tanh', 'L2_weight_yyx': 0.0001962757802089945, 'L_entropy_weight_yyx': 9.092536908762625e-07, 'L_sep_weight_yyx': 9.834999491843078e-05, 'L_scale_weight_yyx': 6.856032677841846e-06, 'learning_rate_yyx': 0.004351680356993306}. Best is trial 5 with value: -2.8058216093098.
[I 2026-03-18 16:52:23,375] Trial 35 pruned. 
[I 2026-03-18 16:52:24,379] Trial 20 pruned. 
[I 2026-03-18 16:52:24,806] Trial 24 pruned. 
[I 2026-03-18 16:52:25,180] Trial 39 pruned. 
[I 2026-03-18 16:52:26,033] Trial 21 pruned. 
[I 2026-03-18 16:52:26,263] Trial 20 pruned. 
[I 2026-03-18 16:52:27,445] Trial 21 finished with value: -2.786583013031271 and parameters: {'n_layers_yyx': 2, 'hidden_size_yyx_l0': 4, 'hidden_size_yyx_l1': 6, 'context_size_yyx': 3, 'num_mix_components_yyx': 1, 'context_extractor_yyx': 'gru', 'activation_func_yyx': 'Tanh', 'L2_weight_yyx': 1.4401639309171586e-06, 'L_entropy_weight_yyx': 1.3069826133631588e-09, 'L_sep_weight_yyx': 6.135894663947648e-09, 'L_scale_weight_yyx': 7.460661947229058e-09, 'learning_rate_yyx': 0.006180079535409514}. Best is trial 21 with value: -2.786583013031271.
[I 2026-03-18 16:52:28,692] Trial 18 finished with value: -2.792082504257388 and parameters: {'n_layers_yyx': 2, 'hidden_size_yyx_l0': 5, 'hidden_size_yyx_l1': 6, 'context_size_yyx': 3, 'num_mix_components_yyx': 5, 'context_extractor_yyx': 'lstm', 'activation_func_yyx': 'Tanh', 'L2_weight_yyx': 2.1916987143179206e-06, 'L_entropy_weight_yyx': 2.1143196056248923e-06, 'L_sep_weight_yyx': 8.982283337068992e-09, 'L_scale_weight_yyx': 1.5224061120742612e-07, 'learning_rate_yyx': 0.009896003462007771}. Best is trial 14 with value: -2.7995943704403503.
[I 2026-03-18 16:52:30,506] Trial 21 pruned. 
[I 2026-03-18 16:52:30,741] Trial 36 pruned. 
[I 2026-03-18 16:52:31,180] Trial 32 pruned. 
[I 2026-03-18 16:52:32,050] Trial 21 pruned. 
[I 2026-03-18 16:52:36,675] Trial 22 pruned. 
[I 2026-03-18 16:52:37,284] Trial 20 pruned. 
[I 2026-03-18 16:52:38,028] Trial 22 pruned. 
[I 2026-03-18 16:52:39,460] Trial 18 finished with value: -2.795632322219236 and parameters: {'n_layers_yyx': 2, 'hidden_size_yyx_l0': 6, 'hidden_size_yyx_l1': 4, 'context_size_yyx': 2, 'num_mix_components_yyx': 5, 'context_extractor_yyx': 'lstm', 'activation_func_yyx': 'Tanh', 'L2_weight_yyx': 1.3893756237002885e-06, 'L_entropy_weight_yyx': 8.588927110757592e-07, 'L_sep_weight_yyx': 4.228583771453751e-06, 'L_scale_weight_yyx': 2.4314362731731746e-09, 'learning_rate_yyx': 0.001109762773392549}. Best is trial 11 with value: -2.8017587322763102.
[I 2026-03-18 16:52:39,701] Trial 25 pruned. 
[I 2026-03-18 16:52:44,182] Trial 23 pruned. 
[I 2026-03-18 16:52:45,364] Trial 19 pruned. 
[I 2026-03-18 16:52:45,368] Trial 33 pruned. 
[I 2026-03-18 16:52:45,999] Trial 26 pruned. 
[I 2026-03-18 16:52:46,943] Trial 31 finished with value: -2.7992072201383773 and parameters: {'n_layers_yyx': 2, 'hidden_size_yyx_l0': 5, 'hidden_size_yyx_l1': 6, 'context_size_yyx': 4, 'num_mix_components_yyx': 1, 'context_extractor_yyx': 'lstm', 'activation_func_yyx': 'ReLU', 'L2_weight_yyx': 6.062543925186064e-09, 'L_entropy_weight_yyx': 6.964017475853286e-07, 'L_sep_weight_yyx': 7.530741549835574e-08, 'L_scale_weight_yyx': 2.1890611153814655e-07, 'learning_rate_yyx': 0.006410694908375914}. Best is trial 0 with value: -2.8067502106217272.
[I 2026-03-18 16:52:49,593] Trial 25 pruned. 
[I 2026-03-18 16:52:51,043] Trial 21 pruned. 
[I 2026-03-18 16:52:51,385] Trial 34 pruned. 
[I 2026-03-18 16:52:52,351] Trial 27 pruned. 
[I 2026-03-18 16:52:55,608] Trial 30 pruned. 
[I 2026-03-18 16:52:57,146] Trial 35 pruned. 
[I 2026-03-18 16:52:58,722] Trial 20 pruned. 
[I 2026-03-18 16:53:00,536] Trial 22 finished with value: -2.800225986988548 and parameters: {'n_layers_yyx': 2, 'hidden_size_yyx_l0': 5, 'hidden_size_yyx_l1': 5, 'context_size_yyx': 2, 'num_mix_components_yyx': 3, 'context_extractor_yyx': 'lstm', 'activation_func_yyx': 'Tanh', 'L2_weight_yyx': 6.929920214083678e-09, 'L_entropy_weight_yyx': 6.763007841619517e-08, 'L_sep_weight_yyx': 8.31753217389189e-07, 'L_scale_weight_yyx': 3.220320580958529e-08, 'learning_rate_yyx': 0.0059609016960575}. Best is trial 5 with value: -2.805070761203844.
[I 2026-03-18 16:53:00,571] Trial 29 pruned. 
[I 2026-03-18 16:53:03,288] Trial 40 pruned. 
[I 2026-03-18 16:53:08,507] Trial 19 pruned. 
[I 2026-03-18 16:53:10,944] Trial 36 pruned. 
[I 2026-03-18 16:53:11,409] Trial 37 pruned. 
[I 2026-03-18 16:53:12,575] Trial 21 pruned. 
[I 2026-03-18 16:53:14,954] Trial 23 pruned. 
[I 2026-03-18 16:53:17,276] Trial 41 pruned. 
[I 2026-03-18 16:53:18,413] Trial 22 pruned. 
[I 2026-03-18 16:53:20,954] Trial 24 pruned. 
[I 2026-03-18 16:53:23,350] Trial 20 pruned. 
[I 2026-03-18 16:53:28,950] Trial 26 pruned. 
[I 2026-03-18 16:53:30,905] Trial 42 pruned. 
[I 2026-03-18 16:53:35,069] Trial 25 pruned. 
[I 2026-03-18 16:53:35,086] Trial 27 pruned. 
[I 2026-03-18 16:53:38,797] Trial 21 pruned. 
[I 2026-03-18 16:53:49,382] Trial 37 pruned. 
[I 2026-03-18 16:53:52,663] Trial 32 finished with value: -2.802289260816816 and parameters: {'n_layers_yyx': 2, 'hidden_size_yyx_l0': 6, 'hidden_size_yyx_l1': 6, 'context_size_yyx': 4, 'num_mix_components_yyx': 1, 'context_extractor_yyx': 'lstm', 'activation_func_yyx': 'ReLU', 'L2_weight_yyx': 1.0732764333387926e-08, 'L_entropy_weight_yyx': 9.371465238715474e-08, 'L_sep_weight_yyx': 1.5635358818757875e-08, 'L_scale_weight_yyx': 1.8407656051233144e-09, 'learning_rate_yyx': 0.007989179885328598}. Best is trial 0 with value: -2.8067502106217272.
[I 2026-03-18 16:53:53,896] Trial 22 pruned. 
[I 2026-03-18 16:54:00,453] Trial 23 pruned. 
[I 2026-03-18 16:54:03,935] Trial 38 pruned. 
[I 2026-03-18 16:54:05,252] Trial 22 finished with value: -2.7851124408648027 and parameters: {'n_layers_yyx': 2, 'hidden_size_yyx_l0': 4, 'hidden_size_yyx_l1': 6, 'context_size_yyx': 3, 'num_mix_components_yyx': 1, 'context_extractor_yyx': 'gru', 'activation_func_yyx': 'Tanh', 'L2_weight_yyx': 1.2984499283194866e-06, 'L_entropy_weight_yyx': 6.734267890058599e-10, 'L_sep_weight_yyx': 5.437371987535548e-09, 'L_scale_weight_yyx': 5.378979148852335e-08, 'learning_rate_yyx': 0.00912489344500329}. Best is trial 21 with value: -2.786583013031271.
[I 2026-03-18 16:54:09,179] Trial 33 pruned. 
[I 2026-03-18 16:54:09,773] Trial 43 pruned. 
[I 2026-03-18 16:54:12,020] Trial 22 finished with value: -2.8024177213242534 and parameters: {'n_layers_yyx': 2, 'hidden_size_yyx_l0': 4, 'hidden_size_yyx_l1': 5, 'context_size_yyx': 4, 'num_mix_components_yyx': 4, 'context_extractor_yyx': 'lstm', 'activation_func_yyx': 'Tanh', 'L2_weight_yyx': 4.110898480253448e-06, 'L_entropy_weight_yyx': 0.00015616813740708418, 'L_sep_weight_yyx': 1.1723153688255832e-09, 'L_scale_weight_yyx': 0.0009034125673131638, 'learning_rate_yyx': 0.004696984546799309}. Best is trial 5 with value: -2.8051328142627483.
[I 2026-03-18 16:54:13,845] Trial 22 finished with value: -2.804460418456472 and parameters: {'n_layers_yyx': 2, 'hidden_size_yyx_l0': 4, 'hidden_size_yyx_l1': 4, 'context_size_yyx': 4, 'num_mix_components_yyx': 5, 'context_extractor_yyx': 'lstm', 'activation_func_yyx': 'Tanh', 'L2_weight_yyx': 4.9133922219664145e-06, 'L_entropy_weight_yyx': 0.0001563879501009643, 'L_sep_weight_yyx': 0.0008185411139400328, 'L_scale_weight_yyx': 4.818579797163307e-05, 'learning_rate_yyx': 0.006964653679457977}. Best is trial 5 with value: -2.8058216093098.
[I 2026-03-18 16:54:15,157] Trial 28 pruned. 
[I 2026-03-18 16:54:15,520] Trial 24 pruned. 
[I 2026-03-18 16:54:18,278] Trial 39 pruned. 
[I 2026-03-18 16:54:19,049] Trial 27 finished with value: -2.804336680449664 and parameters: {'n_layers_yyx': 2, 'hidden_size_yyx_l0': 4, 'hidden_size_yyx_l1': 6, 'context_size_yyx': 3, 'num_mix_components_yyx': 3, 'context_extractor_yyx': 'gru', 'activation_func_yyx': 'Tanh', 'L2_weight_yyx': 1.034560126086329e-06, 'L_entropy_weight_yyx': 0.0009708218470286218, 'L_sep_weight_yyx': 2.089245908411342e-07, 'L_scale_weight_yyx': 2.879343979232884e-06, 'learning_rate_yyx': 0.0014474697267916645}. Best is trial 27 with value: -2.804336680449664.
[I 2026-03-18 16:54:20,236] Trial 23 pruned. 
[I 2026-03-18 16:54:21,018] Trial 29 pruned. 
[I 2026-03-18 16:54:24,380] Trial 40 pruned. 
[I 2026-03-18 16:54:26,324] Trial 23 pruned. 
[I 2026-03-18 16:54:27,069] Trial 30 pruned. 
[I 2026-03-18 16:54:31,022] Trial 25 pruned. 
[I 2026-03-18 16:54:31,987] Trial 38 finished with value: -2.7960579209962226 and parameters: {'n_layers_yyx': 1, 'hidden_size_yyx_l0': 5, 'context_size_yyx': 4, 'num_mix_components_yyx': 4, 'context_extractor_yyx': 'lstm', 'activation_func_yyx': 'Tanh', 'L2_weight_yyx': 5.5638112031643075e-05, 'L_entropy_weight_yyx': 4.712892884182522e-08, 'L_sep_weight_yyx': 7.507396774679887e-10, 'L_scale_weight_yyx': 0.0008444388209843671, 'learning_rate_yyx': 0.006229909226531618}. Best is trial 38 with value: -2.7960579209962226.
[I 2026-03-18 16:54:32,243] Trial 24 pruned. 
[I 2026-03-18 16:54:33,432] Trial 28 pruned. 
[I 2026-03-18 16:54:37,822] Trial 26 pruned. 
[I 2026-03-18 16:54:38,836] Trial 31 finished with value: -2.8073570664708107 and parameters: {'n_layers_yyx': 1, 'hidden_size_yyx_l0': 3, 'context_size_yyx': 4, 'num_mix_components_yyx': 5, 'context_extractor_yyx': 'lstm', 'activation_func_yyx': 'ReLU', 'L2_weight_yyx': 1.899145634864698e-08, 'L_entropy_weight_yyx': 1.9293802381013816e-06, 'L_sep_weight_yyx': 1.1900609665830986e-09, 'L_scale_weight_yyx': 1.131494830224656e-06, 'learning_rate_yyx': 0.009909044472605497}. Best is trial 31 with value: -2.8073570664708107.
[I 2026-03-18 16:54:39,363] Trial 29 pruned. 
[I 2026-03-18 16:54:40,021] Trial 26 finished with value: -2.8015693835591047 and parameters: {'n_layers_yyx': 2, 'hidden_size_yyx_l0': 5, 'hidden_size_yyx_l1': 3, 'context_size_yyx': 4, 'num_mix_components_yyx': 5, 'context_extractor_yyx': 'lstm', 'activation_func_yyx': 'ReLU', 'L2_weight_yyx': 8.390816232973863e-10, 'L_entropy_weight_yyx': 3.414776215747367e-07, 'L_sep_weight_yyx': 1.0714633616771728e-06, 'L_scale_weight_yyx': 0.0001254035782198172, 'learning_rate_yyx': 0.005228940527384451}. Best is trial 6 with value: -2.805382927239302.
[I 2026-03-18 16:54:41,380] Trial 31 pruned. 
[I 2026-03-18 16:54:44,615] Trial 27 pruned. 
[I 2026-03-18 16:54:45,320] Trial 30 pruned. 
[I 2026-03-18 16:54:46,281] Trial 25 pruned. 
[I 2026-03-18 16:54:47,251] Trial 32 pruned. 
[I 2026-03-18 16:54:47,298] Trial 39 pruned. 
[I 2026-03-18 16:54:50,776] Trial 28 pruned. 
[I 2026-03-18 16:54:51,293] Trial 31 pruned. 
[I 2026-03-18 16:54:52,321] Trial 26 pruned. 
[I 2026-03-18 16:54:53,323] Trial 33 pruned. 
[I 2026-03-18 16:54:57,232] Trial 32 pruned. 
[I 2026-03-18 16:55:00,598] Trial 30 pruned. 
[I 2026-03-18 16:55:02,901] Trial 40 pruned. 
[I 2026-03-18 16:55:03,379] Trial 41 pruned. 
[I 2026-03-18 16:55:03,645] Trial 23 finished with value: -2.787004594816911 and parameters: {'n_layers_yyx': 2, 'hidden_size_yyx_l0': 4, 'hidden_size_yyx_l1': 6, 'context_size_yyx': 1, 'num_mix_components_yyx': 2, 'context_extractor_yyx': 'lstm', 'activation_func_yyx': 'Tanh', 'L2_weight_yyx': 1.949128997877615e-08, 'L_entropy_weight_yyx': 4.6594590248789236e-08, 'L_sep_weight_yyx': 6.750179304959095e-07, 'L_scale_weight_yyx': 7.158612215620145e-08, 'learning_rate_yyx': 0.004977039234399806}. Best is trial 5 with value: -2.805070761203844.
[I 2026-03-18 16:55:05,306] Trial 29 pruned. 
[I 2026-03-18 16:55:06,577] Trial 27 pruned. 
[I 2026-03-18 16:55:08,231] Trial 31 pruned. 
[I 2026-03-18 16:55:08,238] Trial 34 pruned. 
[I 2026-03-18 16:55:09,827] Trial 24 pruned. 
[I 2026-03-18 16:55:11,039] Trial 30 pruned. 
[I 2026-03-18 16:55:11,073] Trial 33 pruned. 
[I 2026-03-18 16:55:12,326] Trial 28 pruned. 
[I 2026-03-18 16:55:13,714] Trial 35 pruned. 
[I 2026-03-18 16:55:15,476] Trial 23 finished with value: -2.80552417652027 and parameters: {'n_layers_yyx': 2, 'hidden_size_yyx_l0': 6, 'hidden_size_yyx_l1': 5, 'context_size_yyx': 4, 'num_mix_components_yyx': 3, 'context_extractor_yyx': 'lstm', 'activation_func_yyx': 'Tanh', 'L2_weight_yyx': 0.00024754714517564606, 'L_entropy_weight_yyx': 5.539450863649663e-10, 'L_sep_weight_yyx': 0.0009863462813769434, 'L_scale_weight_yyx': 4.984244859217902e-10, 'learning_rate_yyx': 0.0027493856319421523}. Best is trial 23 with value: -2.80552417652027.
[I 2026-03-18 16:55:17,278] Trial 31 pruned. 
[I 2026-03-18 16:55:18,803] Trial 29 pruned. 
[I 2026-03-18 16:55:24,201] Trial 32 pruned. 
[I 2026-03-18 16:55:24,853] Trial 44 finished with value: -2.793021885305029 and parameters: {'n_layers_yyx': 1, 'hidden_size_yyx_l0': 4, 'context_size_yyx': 4, 'num_mix_components_yyx': 4, 'context_extractor_yyx': 'lstm', 'activation_func_yyx': 'ReLU', 'L2_weight_yyx': 3.6071400578995195e-07, 'L_entropy_weight_yyx': 1.0364034629416999e-05, 'L_sep_weight_yyx': 5.0421277421007286e-05, 'L_scale_weight_yyx': 6.0590632777099044e-05, 'learning_rate_yyx': 0.0056334628108271655}. Best is trial 24 with value: -2.798767703717539.
[I 2026-03-18 16:55:30,743] Trial 45 pruned. 
[I 2026-03-18 16:55:31,816] Trial 34 finished with value: -2.8000319687985806 and parameters: {'n_layers_yyx': 2, 'hidden_size_yyx_l0': 6, 'hidden_size_yyx_l1': 5, 'context_size_yyx': 4, 'num_mix_components_yyx': 2, 'context_extractor_yyx': 'lstm', 'activation_func_yyx': 'ReLU', 'L2_weight_yyx': 1.8887538337525863e-08, 'L_entropy_weight_yyx': 2.2477109736210123e-08, 'L_sep_weight_yyx': 1.2335239679115112e-09, 'L_scale_weight_yyx': 2.1432040089981222e-09, 'learning_rate_yyx': 0.005081722529553149}. Best is trial 0 with value: -2.8067502106217272.
[I 2026-03-18 16:55:33,229] Trial 30 pruned. 
[I 2026-03-18 16:55:37,658] Trial 28 finished with value: -2.802260945271563 and parameters: {'n_layers_yyx': 2, 'hidden_size_yyx_l0': 4, 'hidden_size_yyx_l1': 3, 'context_size_yyx': 3, 'num_mix_components_yyx': 5, 'context_extractor_yyx': 'lstm', 'activation_func_yyx': 'Tanh', 'L2_weight_yyx': 7.16127183306903e-09, 'L_entropy_weight_yyx': 1.6310594396676852e-05, 'L_sep_weight_yyx': 5.816337383986403e-07, 'L_scale_weight_yyx': 7.269739380484604e-07, 'learning_rate_yyx': 0.0043928174891360765}. Best is trial 9 with value: -2.8084722793451675.
[I 2026-03-18 16:55:39,115] Trial 33 pruned. 
[I 2026-03-18 16:55:42,952] Trial 42 pruned. 
[I 2026-03-18 16:55:44,357] Trial 29 pruned. 
[I 2026-03-18 16:55:45,009] Trial 34 pruned. 
[I 2026-03-18 16:55:46,085] Trial 35 pruned. 
[I 2026-03-18 16:55:46,121] Trial 23 finished with value: -2.7857480198841693 and parameters: {'n_layers_yyx': 2, 'hidden_size_yyx_l0': 4, 'hidden_size_yyx_l1': 6, 'context_size_yyx': 3, 'num_mix_components_yyx': 1, 'context_extractor_yyx': 'gru', 'activation_func_yyx': 'Tanh', 'L2_weight_yyx': 5.494004169733349e-05, 'L_entropy_weight_yyx': 6.843052787452708e-10, 'L_sep_weight_yyx': 6.711135780369148e-09, 'L_scale_weight_yyx': 7.774963411445925e-08, 'learning_rate_yyx': 0.009940567580884978}. Best is trial 21 with value: -2.786583013031271.
[I 2026-03-18 16:55:48,617] Trial 24 finished with value: -2.803136382042884 and parameters: {'n_layers_yyx': 2, 'hidden_size_yyx_l0': 5, 'hidden_size_yyx_l1': 2, 'context_size_yyx': 4, 'num_mix_components_yyx': 2, 'context_extractor_yyx': 'lstm', 'activation_func_yyx': 'ReLU', 'L2_weight_yyx': 2.0401575190345598e-08, 'L_entropy_weight_yyx': 2.1871053253633502e-08, 'L_sep_weight_yyx': 4.756259181276097e-09, 'L_scale_weight_yyx': 0.00017578834819219387, 'learning_rate_yyx': 0.0018633226555957747}. Best is trial 7 with value: -2.8073737460176833.
[I 2026-03-18 16:55:48,911] Trial 43 pruned. 
[I 2026-03-18 16:55:51,748] Trial 25 pruned. 
[I 2026-03-18 16:55:51,773] Trial 36 pruned. 
[I 2026-03-18 16:55:54,416] Trial 25 pruned. 
[I 2026-03-18 16:55:54,422] Trial 32 pruned. 
[I 2026-03-18 16:55:57,537] Trial 37 pruned. 
[I 2026-03-18 16:55:58,881] Trial 30 pruned. 
[I 2026-03-18 16:56:00,028] Trial 24 pruned. 
[I 2026-03-18 16:56:00,660] Trial 26 pruned. 
[I 2026-03-18 16:56:00,755] Trial 33 pruned. 
[I 2026-03-18 16:56:01,166] Trial 27 finished with value: -2.8024681414662083 and parameters: {'n_layers_yyx': 2, 'hidden_size_yyx_l0': 6, 'hidden_size_yyx_l1': 3, 'context_size_yyx': 4, 'num_mix_components_yyx': 5, 'context_extractor_yyx': 'lstm', 'activation_func_yyx': 'ReLU', 'L2_weight_yyx': 4.558370482162976e-10, 'L_entropy_weight_yyx': 4.2582931438693815e-09, 'L_sep_weight_yyx': 8.907648161343931e-07, 'L_scale_weight_yyx': 0.00013715484193008837, 'learning_rate_yyx': 0.005359713391287581}. Best is trial 6 with value: -2.805382927239302.
[I 2026-03-18 16:56:06,443] Trial 26 pruned. 
[I 2026-03-18 16:56:07,977] Trial 34 pruned. 
[I 2026-03-18 16:56:10,825] Trial 46 pruned. 
[I 2026-03-18 16:56:14,668] Trial 24 finished with value: -2.8041825392031274 and parameters: {'n_layers_yyx': 2, 'hidden_size_yyx_l0': 4, 'hidden_size_yyx_l1': 4, 'context_size_yyx': 4, 'num_mix_components_yyx': 5, 'context_extractor_yyx': 'lstm', 'activation_func_yyx': 'Tanh', 'L2_weight_yyx': 2.787064391042966e-07, 'L_entropy_weight_yyx': 8.369154506502792e-08, 'L_sep_weight_yyx': 0.00014579628201683804, 'L_scale_weight_yyx': 7.287769410210439e-05, 'learning_rate_yyx': 0.007478736094139471}. Best is trial 5 with value: -2.8058216093098.
[I 2026-03-18 16:56:14,716] Trial 25 pruned. 
[I 2026-03-18 16:56:23,220] Trial 32 finished with value: -2.8073595833844704 and parameters: {'n_layers_yyx': 1, 'hidden_size_yyx_l0': 3, 'context_size_yyx': 4, 'num_mix_components_yyx': 5, 'context_extractor_yyx': 'lstm', 'activation_func_yyx': 'ReLU', 'L2_weight_yyx': 1.4573001088131878e-08, 'L_entropy_weight_yyx': 1.4454225513588363e-06, 'L_sep_weight_yyx': 2.1767648192687465e-09, 'L_scale_weight_yyx': 1.1457313602680272e-06, 'learning_rate_yyx': 0.009862571931632995}. Best is trial 32 with value: -2.8073595833844704.
[I 2026-03-18 16:56:24,682] Trial 35 pruned. 
[I 2026-03-18 16:56:28,084] Trial 35 pruned. 
[I 2026-03-18 16:56:37,339] Trial 36 pruned. 
