[I 2026-03-18 17:09:51,818] Trial 46 finished with value: -2.8011825209224557 and parameters: {'n_layers_yyx': 2, 'hidden_size_yyx_l0': 6, 'hidden_size_yyx_l1': 5, 'context_size_yyx': 3, 'num_mix_components_yyx': 2, 'context_extractor_yyx': 'lstm', 'activation_func_yyx': 'ReLU', 'L2_weight_yyx': 3.915352492054815e-10, 'L_entropy_weight_yyx': 2.2452356842232674e-05, 'L_sep_weight_yyx': 2.2167922957383686e-07, 'L_scale_weight_yyx': 1.7929086823368402e-10, 'learning_rate_yyx': 0.008771796313835673}. Best is trial 5 with value: -2.805070761203844.
[I 2026-03-18 17:09:51,967] Trial 41 finished with value: -2.8033849971810567 and parameters: {'n_layers_yyx': 2, 'hidden_size_yyx_l0': 5, 'hidden_size_yyx_l1': 3, 'context_size_yyx': 4, 'num_mix_components_yyx': 5, 'context_extractor_yyx': 'lstm', 'activation_func_yyx': 'ReLU', 'L2_weight_yyx': 1.5648183191738667e-08, 'L_entropy_weight_yyx': 4.950008572560942e-07, 'L_sep_weight_yyx': 1.2187979496703173e-07, 'L_scale_weight_yyx': 4.130651089768708e-08, 'learning_rate_yyx': 0.006496979984385901}. Best is trial 6 with value: -2.805382927239302.
[I 2026-03-18 17:10:15,384] Trial 42 finished with value: -2.8074211351799243 and parameters: {'n_layers_yyx': 1, 'hidden_size_yyx_l0': 6, 'context_size_yyx': 3, 'num_mix_components_yyx': 3, 'context_extractor_yyx': 'lstm', 'activation_func_yyx': 'Tanh', 'L2_weight_yyx': 0.00016170416609065074, 'L_entropy_weight_yyx': 2.721407421522685e-09, 'L_sep_weight_yyx': 1.6056022198031783e-07, 'L_scale_weight_yyx': 1.1880431588939822e-08, 'learning_rate_yyx': 0.007058652557756449}. Best is trial 41 with value: -2.8074335121698404.
[I 2026-03-18 17:10:23,665] Trial 47 pruned. 
[I 2026-03-18 17:10:32,425] Trial 48 finished with value: -2.7852564870952845 and parameters: {'n_layers_yyx': 2, 'hidden_size_yyx_l0': 3, 'hidden_size_yyx_l1': 6, 'context_size_yyx': 4, 'num_mix_components_yyx': 4, 'context_extractor_yyx': 'gru', 'activation_func_yyx': 'Tanh', 'L2_weight_yyx': 1.530922947341742e-08, 'L_entropy_weight_yyx': 1.0221624343041503e-09, 'L_sep_weight_yyx': 6.840064396656998e-06, 'L_scale_weight_yyx': 5.07284295100889e-09, 'learning_rate_yyx': 0.009860203833651588}. Best is trial 21 with value: -2.786583013031271.
[I 2026-03-18 17:10:35,366] Trial 48 pruned. 
[I 2026-03-18 17:10:47,134] Trial 49 pruned. 

Source events: 31112
Target events: 16159
Full model ln_yyx : 2314.60205 nats/sec, 128.91527 nats/event
Full model Log loss : -2.79816
Full model ln_yyx : 2311.39225 nats/sec, 128.73650 nats/event
Full model Log loss : -2.79972
Full model ln_yyx : 2295.58774 nats/sec, 127.85624 nats/event
Full model Log loss : -2.78719
Full model ln_yyx : 2307.98964 nats/sec, 128.54698 nats/event
Full model Log loss : -2.80507
Full model ln_yyx : 2320.70063 nats/sec, 129.25494 nats/event
Full model Log loss : -2.79175
Full model ln_yyx : 2319.71193 nats/sec, 129.19987 nats/event
Full model Log loss : -2.80124
Full model ln_yyx : 2310.23795 nats/sec, 128.67220 nats/event
Full model Log loss : -2.79811
Full model ln_yyx : 2295.20075 nats/sec, 127.83469 nats/event
Full model Log loss : -2.79194
Full model ln_yyx : 2302.64115 nats/sec, 128.24909 nats/event
Full model Log loss : -2.79911
Full model ln_yyx : 2321.84396 nats/sec, 129.31862 nats/event
Full model Log loss : -2.80023
Full model ln_yyx : 2300.66317 nats/sec, 128.13892 nats/event
Full model Log loss : -2.78700
Full model ln_yyx : 2308.88165 nats/sec, 128.59666 nats/event
Full model Log loss : -2.80067
Full model ln_yyx : 2297.76147 nats/sec, 127.97731 nats/event
Full model Log loss : -2.79547
Full model ln_yyx : 2336.58441 nats/sec, 130.13961 nats/event
Full model Log loss : -2.80165
Full model ln_yyx : 2307.71462 nats/sec, 128.53166 nats/event
Full model Log loss : -2.80404
Full model ln_yyx : 2312.28856 nats/sec, 128.78642 nats/event
Full model Log loss : -2.80118
Optimization finished. Config saved to results/opt-full/opt_full_16_best_config.txt
[I 2026-03-18 17:10:47,699] Trial 43 pruned. 
[I 2026-03-18 17:10:49,040] Trial 42 finished with value: -2.805434603871349 and parameters: {'n_layers_yyx': 2, 'hidden_size_yyx_l0': 5, 'hidden_size_yyx_l1': 3, 'context_size_yyx': 4, 'num_mix_components_yyx': 5, 'context_extractor_yyx': 'lstm', 'activation_func_yyx': 'ReLU', 'L2_weight_yyx': 2.5717352415733735e-10, 'L_entropy_weight_yyx': 2.2750661538932803e-07, 'L_sep_weight_yyx': 1.1714984490733146e-05, 'L_scale_weight_yyx': 4.770619759785749e-07, 'learning_rate_yyx': 0.009364883169060355}. Best is trial 42 with value: -2.805434603871349.
[I 2026-03-18 17:11:05,055] Trial 49 pruned. 

Source events: 31112
Target events: 3403
Full model ln_yyx : 484.34746 nats/sec, 128.09660 nats/event
Full model Log loss : -2.78225
Full model ln_yyx : 480.31343 nats/sec, 127.02971 nats/event
Full model Log loss : -2.76822
Full model ln_yyx : 464.47896 nats/sec, 122.84192 nats/event
Full model Log loss : -2.66120
Full model ln_yyx : 482.41846 nats/sec, 127.58643 nats/event
Full model Log loss : -2.77339
Full model ln_yyx : 483.13800 nats/sec, 127.77673 nats/event
Full model Log loss : -2.77511
Full model ln_yyx : 482.26114 nats/sec, 127.54482 nats/event
Full model Log loss : -2.77628
Full model ln_yyx : 480.68029 nats/sec, 127.12673 nats/event
Full model Log loss : -2.76398
Full model ln_yyx : 482.88104 nats/sec, 127.70877 nats/event
Full model Log loss : -2.78467
Full model ln_yyx : 483.66012 nats/sec, 127.91481 nats/event
Full model Log loss : -2.78658
Full model ln_yyx : 483.37600 nats/sec, 127.83967 nats/event
Full model Log loss : -2.78511
Full model ln_yyx : 484.22104 nats/sec, 128.06316 nats/event
Full model Log loss : -2.78575
Full model ln_yyx : 483.41876 nats/sec, 127.85098 nats/event
Full model Log loss : -2.78592
Full model ln_yyx : 485.08954 nats/sec, 128.29285 nats/event
Full model Log loss : -2.77734
Full model ln_yyx : 483.51709 nats/sec, 127.87699 nats/event
Full model Log loss : -2.78366
Full model ln_yyx : 484.03181 nats/sec, 128.01311 nats/event
Full model Log loss : -2.78124
Full model ln_yyx : 485.19519 nats/sec, 128.32080 nats/event
Full model Log loss : -2.78039
Full model ln_yyx : 462.87667 nats/sec, 122.41816 nats/event
Full model Log loss : -2.66197
Full model ln_yyx : 482.80247 nats/sec, 127.68799 nats/event
Full model Log loss : -2.78464
Full model ln_yyx : 485.63457 nats/sec, 128.43700 nats/event
Full model Log loss : -2.78526
Optimization finished. Config saved to results/opt-full/opt_full_3_best_config.txt
[I 2026-03-18 17:11:19,032] Trial 44 pruned. 
[I 2026-03-18 17:11:56,859] Trial 43 finished with value: -2.807728091505073 and parameters: {'n_layers_yyx': 2, 'hidden_size_yyx_l0': 5, 'hidden_size_yyx_l1': 4, 'context_size_yyx': 4, 'num_mix_components_yyx': 5, 'context_extractor_yyx': 'lstm', 'activation_func_yyx': 'ReLU', 'L2_weight_yyx': 2.4051078334635973e-10, 'L_entropy_weight_yyx': 2.3462777949426143e-06, 'L_sep_weight_yyx': 1.4565574397580014e-05, 'L_scale_weight_yyx': 4.426971557326268e-07, 'learning_rate_yyx': 0.009768149178039904}. Best is trial 43 with value: -2.807728091505073.
[I 2026-03-18 17:12:31,402] Trial 45 finished with value: -2.8034494810862 and parameters: {'n_layers_yyx': 1, 'hidden_size_yyx_l0': 6, 'context_size_yyx': 3, 'num_mix_components_yyx': 3, 'context_extractor_yyx': 'lstm', 'activation_func_yyx': 'Tanh', 'L2_weight_yyx': 0.00046992378829484343, 'L_entropy_weight_yyx': 3.1266996949145857e-09, 'L_sep_weight_yyx': 4.788669901490697e-07, 'L_scale_weight_yyx': 2.6566915685041124e-08, 'learning_rate_yyx': 0.007137952153136854}. Best is trial 41 with value: -2.8074335121698404.
[I 2026-03-18 17:12:35,302] Trial 44 finished with value: -2.797755680074865 and parameters: {'n_layers_yyx': 2, 'hidden_size_yyx_l0': 6, 'hidden_size_yyx_l1': 5, 'context_size_yyx': 4, 'num_mix_components_yyx': 4, 'context_extractor_yyx': 'lstm', 'activation_func_yyx': 'ReLU', 'L2_weight_yyx': 1.475554323001122e-09, 'L_entropy_weight_yyx': 2.0977431201092916e-07, 'L_sep_weight_yyx': 1.97368957458547e-05, 'L_scale_weight_yyx': 3.5708607838917325e-07, 'learning_rate_yyx': 0.009830055323030303}. Best is trial 43 with value: -2.807728091505073.
[I 2026-03-18 17:12:43,055] Trial 46 pruned. 
[I 2026-03-18 17:12:46,639] Trial 45 pruned. 
[I 2026-03-18 17:14:03,158] Trial 46 finished with value: -2.8064147020357755 and parameters: {'n_layers_yyx': 2, 'hidden_size_yyx_l0': 4, 'hidden_size_yyx_l1': 5, 'context_size_yyx': 4, 'num_mix_components_yyx': 4, 'context_extractor_yyx': 'lstm', 'activation_func_yyx': 'Tanh', 'L2_weight_yyx': 2.5786252315820878e-08, 'L_entropy_weight_yyx': 7.994108971543998e-08, 'L_sep_weight_yyx': 9.960267929492089e-06, 'L_scale_weight_yyx': 8.897277043469342e-07, 'learning_rate_yyx': 0.008451010635168621}. Best is trial 43 with value: -2.807728091505073.
[I 2026-03-18 17:14:15,250] Trial 47 finished with value: -2.801308721718878 and parameters: {'n_layers_yyx': 1, 'hidden_size_yyx_l0': 6, 'context_size_yyx': 3, 'num_mix_components_yyx': 2, 'context_extractor_yyx': 'lstm', 'activation_func_yyx': 'GELU', 'L2_weight_yyx': 4.017757437175609e-05, 'L_entropy_weight_yyx': 9.60514847858774e-10, 'L_sep_weight_yyx': 1.890276837200247e-07, 'L_scale_weight_yyx': 7.036785092214624e-07, 'learning_rate_yyx': 0.008723238864034557}. Best is trial 41 with value: -2.8074335121698404.
[I 2026-03-18 17:14:20,008] Trial 48 pruned. 
[I 2026-03-18 17:14:31,186] Trial 49 pruned. 

Source events: 31112
Target events: 20800
Full model ln_yyx : 2971.18706 nats/sec, 128.56098 nats/event
Full model Log loss : -2.79163
Full model ln_yyx : 2945.62290 nats/sec, 127.45484 nats/event
Full model Log loss : -2.78751
Full model ln_yyx : 2798.53273 nats/sec, 121.09036 nats/event
Full model Log loss : -2.65880
Full model ln_yyx : 2967.90821 nats/sec, 128.41911 nats/event
Full model Log loss : -2.79913
Full model ln_yyx : 2896.76373 nats/sec, 125.34074 nats/event
Full model Log loss : -2.77603
Full model ln_yyx : 2968.78583 nats/sec, 128.45708 nats/event
Full model Log loss : -2.80116
Full model ln_yyx : 2984.49277 nats/sec, 129.13671 nats/event
Full model Log loss : -2.80176
Full model ln_yyx : 2976.75448 nats/sec, 128.80188 nats/event
Full model Log loss : -2.80029
Full model ln_yyx : 2960.50187 nats/sec, 128.09864 nats/event
Full model Log loss : -2.80139
Full model ln_yyx : 2955.66840 nats/sec, 127.88950 nats/event
Full model Log loss : -2.79563
Full model ln_yyx : 2959.18292 nats/sec, 128.04157 nats/event
Full model Log loss : -2.80552
Full model ln_yyx : 2980.65463 nats/sec, 128.97063 nats/event
Full model Log loss : -2.80653
Full model ln_yyx : 2989.33329 nats/sec, 129.34615 nats/event
Full model Log loss : -2.80187
Full model ln_yyx : 2999.30369 nats/sec, 129.77756 nats/event
Full model Log loss : -2.80210
Full model ln_yyx : 2951.41212 nats/sec, 127.70533 nats/event
Full model Log loss : -2.80046
Full model ln_yyx : 2975.58651 nats/sec, 128.75134 nats/event
Full model Log loss : -2.80611
Full model ln_yyx : 2967.96442 nats/sec, 128.42154 nats/event
Full model Log loss : -2.80340
Full model ln_yyx : 2952.87297 nats/sec, 127.76854 nats/event
Full model Log loss : -2.80023
Full model ln_yyx : 2987.58990 nats/sec, 129.27072 nats/event
Full model Log loss : -2.80743
Full model ln_yyx : 2985.67108 nats/sec, 129.18769 nats/event
Full model Log loss : -2.80742
Full model ln_yyx : 2961.92567 nats/sec, 128.16025 nats/event
Full model Log loss : -2.80345
Full model ln_yyx : 2980.74360 nats/sec, 128.97448 nats/event
Full model Log loss : -2.80131
Optimization finished. Config saved to results/opt-full/opt_full_0_best_config.txt
[I 2026-03-18 17:14:34,235] Trial 47 pruned. 
[I 2026-03-18 17:14:45,607] Trial 48 pruned. 
[I 2026-03-18 17:14:56,701] Trial 49 pruned. 

Source events: 31112
Target events: 40082
Full model ln_yyx : 5626.00240 nats/sec, 126.32609 nats/event
Full model Log loss : -2.78349
Full model ln_yyx : 5727.44318 nats/sec, 128.60383 nats/event
Full model Log loss : -2.80104
Full model ln_yyx : 5641.15626 nats/sec, 126.66635 nats/event
Full model Log loss : -2.77947
Full model ln_yyx : 5751.97826 nats/sec, 129.15474 nats/event
Full model Log loss : -2.79884
Full model ln_yyx : 5703.69318 nats/sec, 128.07055 nats/event
Full model Log loss : -2.79752
Full model ln_yyx : 5707.95486 nats/sec, 128.16624 nats/event
Full model Log loss : -2.79163
Full model ln_yyx : 5709.19605 nats/sec, 128.19411 nats/event
Full model Log loss : -2.80538
Full model ln_yyx : 5729.71109 nats/sec, 128.65476 nats/event
Full model Log loss : -2.79229
Full model ln_yyx : 5717.70678 nats/sec, 128.38521 nats/event
Full model Log loss : -2.80452
Full model ln_yyx : 5719.37399 nats/sec, 128.42265 nats/event
Full model Log loss : -2.80157
Full model ln_yyx : 5741.71540 nats/sec, 128.92430 nats/event
Full model Log loss : -2.80247
Full model ln_yyx : 5677.69323 nats/sec, 127.48675 nats/event
Full model Log loss : -2.78904
Full model ln_yyx : 5731.55929 nats/sec, 128.69626 nats/event
Full model Log loss : -2.80043
Full model ln_yyx : 5745.98096 nats/sec, 129.02008 nats/event
Full model Log loss : -2.80387
Full model ln_yyx : 5729.01820 nats/sec, 128.63920 nats/event
Full model Log loss : -2.80437
Full model ln_yyx : 5750.08639 nats/sec, 129.11226 nats/event
Full model Log loss : -2.80054
Full model ln_yyx : 5705.66463 nats/sec, 128.11482 nats/event
Full model Log loss : -2.80511
Full model ln_yyx : 5748.72633 nats/sec, 129.08172 nats/event
Full model Log loss : -2.79883
Full model ln_yyx : 5720.81509 nats/sec, 128.45501 nats/event
Full model Log loss : -2.79412
Full model ln_yyx : 5727.21464 nats/sec, 128.59870 nats/event
Full model Log loss : -2.80338
Full model ln_yyx : 5712.29514 nats/sec, 128.26370 nats/event
Full model Log loss : -2.80543
Full model ln_yyx : 5757.92850 nats/sec, 129.28835 nats/event
Full model Log loss : -2.80773
Full model ln_yyx : 5764.09077 nats/sec, 129.42672 nats/event
Full model Log loss : -2.79776
Full model ln_yyx : 5729.36222 nats/sec, 128.64692 nats/event
Full model Log loss : -2.80641
Optimization finished. Config saved to results/opt-full/opt_full_5_best_config.txt
