[I 2026-03-18 19:58:57,720] Trial 18 pruned. 
[I 2026-03-18 19:58:59,396] Trial 9 pruned. 
[I 2026-03-18 19:59:05,132] Trial 13 finished with value: -2.7634455568314094 and parameters: {'n_layers_yyx': 2, 'hidden_size_yyx_l0': 3, 'hidden_size_yyx_l1': 6, 'context_size_yyx': 4, 'num_mix_components_yyx': 4, 'context_extractor_yyx': 'gru', 'activation_func_yyx': 'Tanh', 'L2_weight_yyx': 0.0006357624138762941, 'L_entropy_weight_yyx': 3.0194639601849297e-05, 'L_sep_weight_yyx': 9.551172424353879e-06, 'L_scale_weight_yyx': 0.0007790249215011686, 'learning_rate_yyx': 0.0018708492446164475}. Best is trial 0 with value: -2.7678615354442075.
[I 2026-03-18 19:59:12,520] Trial 11 finished with value: -2.7267330581164098 and parameters: {'n_layers_yyx': 1, 'hidden_size_yyx_l0': 4, 'context_size_yyx': 2, 'num_mix_components_yyx': 1, 'context_extractor_yyx': 'lstm', 'activation_func_yyx': 'Tanh', 'L2_weight_yyx': 6.092720263672041e-06, 'L_entropy_weight_yyx': 1.6722695984998745e-08, 'L_sep_weight_yyx': 7.286561372180014e-09, 'L_scale_weight_yyx': 1.1276388124684238e-10, 'learning_rate_yyx': 0.002861028731035772}. Best is trial 7 with value: -2.766072426816335.
[I 2026-03-18 19:59:21,627] Trial 28 pruned. 
[I 2026-03-18 19:59:24,154] Trial 24 pruned. 
[I 2026-03-18 19:59:42,476] Trial 19 pruned. 
[I 2026-03-18 19:59:47,829] Trial 10 pruned. 
[I 2026-03-18 19:59:48,508] Trial 14 pruned. 
[I 2026-03-18 19:59:52,612] Trial 14 finished with value: -2.7639988842983763 and parameters: {'n_layers_yyx': 1, 'hidden_size_yyx_l0': 4, 'context_size_yyx': 4, 'num_mix_components_yyx': 3, 'context_extractor_yyx': 'gru', 'activation_func_yyx': 'Tanh', 'L2_weight_yyx': 1.7193680075168691e-06, 'L_entropy_weight_yyx': 1.9422855503119003e-06, 'L_sep_weight_yyx': 2.7921745007080016e-08, 'L_scale_weight_yyx': 1.4295193106771701e-08, 'learning_rate_yyx': 0.009692992112433317}. Best is trial 3 with value: -2.764943250652336.
[I 2026-03-18 20:00:02,436] Trial 29 pruned. 
[I 2026-03-18 20:00:10,472] Trial 14 pruned. 
[I 2026-03-18 20:00:17,326] Trial 20 pruned. 
[I 2026-03-18 20:00:30,367] Trial 23 finished with value: -2.7650132791369924 and parameters: {'n_layers_yyx': 2, 'hidden_size_yyx_l0': 6, 'hidden_size_yyx_l1': 4, 'context_size_yyx': 4, 'num_mix_components_yyx': 1, 'context_extractor_yyx': 'lstm', 'activation_func_yyx': 'GELU', 'L2_weight_yyx': 8.487642759012343e-07, 'L_entropy_weight_yyx': 0.000258067168601784, 'L_sep_weight_yyx': 0.000999986280566728, 'L_scale_weight_yyx': 2.179119016382228e-05, 'learning_rate_yyx': 0.0038848390964921573}. Best is trial 1 with value: -2.766161832317774.
[I 2026-03-18 20:00:33,436] Trial 11 pruned. 
[I 2026-03-18 20:00:34,475] Trial 9 finished with value: -2.4089761792998954 and parameters: {'n_layers_yyx': 2, 'hidden_size_yyx_l0': 5, 'hidden_size_yyx_l1': 4, 'context_size_yyx': 4, 'num_mix_components_yyx': 3, 'context_extractor_yyx': 'lstm', 'activation_func_yyx': 'Tanh', 'L2_weight_yyx': 1.8938568341507199e-06, 'L_entropy_weight_yyx': 0.00025678033855291266, 'L_sep_weight_yyx': 8.758479108745013e-09, 'L_scale_weight_yyx': 4.796997770533011e-10, 'learning_rate_yyx': 0.0033335424033165183}. Best is trial 9 with value: -2.4089761792998954.
[I 2026-03-18 20:00:38,837] Trial 15 pruned. 
[I 2026-03-18 20:00:47,865] Trial 13 finished with value: -2.759767527352958 and parameters: {'n_layers_yyx': 1, 'hidden_size_yyx_l0': 4, 'context_size_yyx': 2, 'num_mix_components_yyx': 2, 'context_extractor_yyx': 'gru', 'activation_func_yyx': 'ReLU', 'L2_weight_yyx': 3.2094578480887023e-07, 'L_entropy_weight_yyx': 1.166427760741042e-05, 'L_sep_weight_yyx': 2.3781237113330198e-06, 'L_scale_weight_yyx': 1.3092009185256981e-06, 'learning_rate_yyx': 0.008389545921695787}. Best is trial 8 with value: -2.7661304184127817.
[I 2026-03-18 20:00:50,661] Trial 16 finished with value: -2.7633831818898518 and parameters: {'n_layers_yyx': 2, 'hidden_size_yyx_l0': 6, 'hidden_size_yyx_l1': 4, 'context_size_yyx': 3, 'num_mix_components_yyx': 3, 'context_extractor_yyx': 'lstm', 'activation_func_yyx': 'GELU', 'L2_weight_yyx': 5.393517774684018e-05, 'L_entropy_weight_yyx': 1.2340450962426922e-08, 'L_sep_weight_yyx': 3.6962572061600232e-06, 'L_scale_weight_yyx': 4.1441940980772175e-05, 'learning_rate_yyx': 0.007639417793080346}. Best is trial 3 with value: -2.7657987594604494.
[I 2026-03-18 20:00:58,055] Trial 13 finished with value: -0.8270922707313977 and parameters: {'n_layers_yyx': 1, 'hidden_size_yyx_l0': 5, 'context_size_yyx': 3, 'num_mix_components_yyx': 4, 'context_extractor_yyx': 'lstm', 'activation_func_yyx': 'Tanh', 'L2_weight_yyx': 1.4157630588400783e-06, 'L_entropy_weight_yyx': 2.774310177062168e-08, 'L_sep_weight_yyx': 1.5090227864633494e-10, 'L_scale_weight_yyx': 1.4110568360141262e-07, 'learning_rate_yyx': 0.009738022923150708}. Best is trial 13 with value: -0.8270922707313977.
[I 2026-03-18 20:01:03,330] Trial 13 pruned. 
[I 2026-03-18 20:01:13,651] Trial 20 pruned. 
[I 2026-03-18 20:01:15,152] Trial 12 pruned. 
[I 2026-03-18 20:01:16,889] Trial 24 pruned. 
[I 2026-03-18 20:01:18,223] Trial 22 pruned. 
[I 2026-03-18 20:01:27,470] Trial 11 pruned. 
[I 2026-03-18 20:01:28,376] Trial 30 pruned. 
[I 2026-03-18 20:01:34,683] Trial 14 pruned. 
[I 2026-03-18 20:01:36,616] Trial 17 pruned. 
[I 2026-03-18 20:01:43,108] Trial 6 finished with value: -2.3906580841846954 and parameters: {'n_layers_yyx': 2, 'hidden_size_yyx_l0': 2, 'hidden_size_yyx_l1': 6, 'context_size_yyx': 1, 'num_mix_components_yyx': 3, 'context_extractor_yyx': 'lstm', 'activation_func_yyx': 'ReLU', 'L2_weight_yyx': 0.00029683565465680914, 'L_entropy_weight_yyx': 4.1098573759327354e-10, 'L_sep_weight_yyx': 8.691929800320883e-09, 'L_scale_weight_yyx': 5.493844331736502e-09, 'learning_rate_yyx': 0.008109186431970988}. Best is trial 5 with value: -2.394261756310096.
[I 2026-03-18 20:02:22,365] Trial 12 pruned. 
[I 2026-03-18 20:03:08,271] Trial 13 pruned. 
[I 2026-03-18 20:03:08,853] Trial 10 finished with value: -2.7641032856582273 and parameters: {'n_layers_yyx': 1, 'hidden_size_yyx_l0': 5, 'context_size_yyx': 1, 'num_mix_components_yyx': 4, 'context_extractor_yyx': 'lstm', 'activation_func_yyx': 'Tanh', 'L2_weight_yyx': 1.8987735852080348e-07, 'L_entropy_weight_yyx': 0.0005930862663719196, 'L_sep_weight_yyx': 3.44695540121449e-10, 'L_scale_weight_yyx': 4.7219700504090045e-08, 'learning_rate_yyx': 0.0035794504239547178}. Best is trial 9 with value: -2.765185642429061.
[I 2026-03-18 20:03:16,119] Trial 10 pruned. 
[I 2026-03-18 20:03:20,588] Trial 21 pruned. 
[I 2026-03-18 20:03:26,535] Trial 13 pruned. 
[I 2026-03-18 20:03:29,769] Trial 23 pruned. 
[I 2026-03-18 20:03:29,907] Trial 15 pruned. 
[I 2026-03-18 20:03:36,797] Trial 16 finished with value: -0.8220237607970019 and parameters: {'n_layers_yyx': 1, 'hidden_size_yyx_l0': 3, 'context_size_yyx': 2, 'num_mix_components_yyx': 4, 'context_extractor_yyx': 'lstm', 'activation_func_yyx': 'Tanh', 'L2_weight_yyx': 4.636404169051616e-06, 'L_entropy_weight_yyx': 1.0927418178522824e-10, 'L_sep_weight_yyx': 5.678221641239959e-07, 'L_scale_weight_yyx': 7.098549158561884e-09, 'learning_rate_yyx': 0.009366911346375672}. Best is trial 4 with value: -0.8236861799457048.
[I 2026-03-18 20:03:51,210] Trial 18 pruned. 
[I 2026-03-18 20:03:53,381] Trial 9 finished with value: -0.7550443708456426 and parameters: {'n_layers_yyx': 2, 'hidden_size_yyx_l0': 5, 'hidden_size_yyx_l1': 2, 'context_size_yyx': 1, 'num_mix_components_yyx': 1, 'context_extractor_yyx': 'lstm', 'activation_func_yyx': 'ReLU', 'L2_weight_yyx': 1.5124558774030988e-05, 'L_entropy_weight_yyx': 0.00016547636856068418, 'L_sep_weight_yyx': 1.6344552393000203e-10, 'L_scale_weight_yyx': 1.43581335403224e-06, 'learning_rate_yyx': 0.0071233533678706894}. Best is trial 5 with value: -0.8480365026296506.
[I 2026-03-18 20:03:58,114] Trial 7 pruned. 
[I 2026-03-18 20:04:13,122] Trial 14 pruned. 
[I 2026-03-18 20:04:23,938] Trial 14 pruned. 
[I 2026-03-18 20:04:35,297] Trial 24 pruned. 
[I 2026-03-18 20:04:44,194] Trial 15 pruned. 
[I 2026-03-18 20:05:05,460] Trial 19 pruned. 
[I 2026-03-18 20:05:12,538] Trial 11 finished with value: -2.388186909008295 and parameters: {'n_layers_yyx': 1, 'hidden_size_yyx_l0': 5, 'context_size_yyx': 3, 'num_mix_components_yyx': 4, 'context_extractor_yyx': 'gru', 'activation_func_yyx': 'Tanh', 'L2_weight_yyx': 0.0007111217648506343, 'L_entropy_weight_yyx': 5.543162316755403e-08, 'L_sep_weight_yyx': 0.0005956672290089399, 'L_scale_weight_yyx': 7.655557326517517e-06, 'learning_rate_yyx': 0.00549892364170772}. Best is trial 4 with value: -2.393031095621557.
[I 2026-03-18 20:05:26,585] Trial 11 pruned. 
[I 2026-03-18 20:05:26,586] Trial 22 pruned. 
[I 2026-03-18 20:05:30,421] Trial 15 pruned. 
[I 2026-03-18 20:05:33,368] Trial 11 pruned. 
[I 2026-03-18 20:05:55,886] Trial 14 pruned. 
[I 2026-03-18 20:05:55,886] Trial 16 pruned. 
[I 2026-03-18 20:06:12,424] Trial 8 pruned. 
[I 2026-03-18 20:06:22,333] Trial 31 pruned. 
[I 2026-03-18 20:06:22,632] Trial 8 finished with value: -2.7663050128086293 and parameters: {'n_layers_yyx': 2, 'hidden_size_yyx_l0': 3, 'hidden_size_yyx_l1': 4, 'context_size_yyx': 1, 'num_mix_components_yyx': 2, 'context_extractor_yyx': 'gru', 'activation_func_yyx': 'GELU', 'L2_weight_yyx': 4.418411873954144e-10, 'L_entropy_weight_yyx': 8.35231770535902e-06, 'L_sep_weight_yyx': 1.814743483012608e-06, 'L_scale_weight_yyx': 3.809617910812546e-05, 'learning_rate_yyx': 0.0008476610282860292}. Best is trial 8 with value: -2.7663050128086293.
[I 2026-03-18 20:06:31,382] Trial 23 pruned. 
[I 2026-03-18 20:06:43,430] Trial 12 pruned. 
[I 2026-03-18 20:06:46,148] Trial 21 finished with value: -2.752638720372173 and parameters: {'n_layers_yyx': 2, 'hidden_size_yyx_l0': 5, 'hidden_size_yyx_l1': 4, 'context_size_yyx': 1, 'num_mix_components_yyx': 4, 'context_extractor_yyx': 'gru', 'activation_func_yyx': 'Tanh', 'L2_weight_yyx': 0.00070247820721763, 'L_entropy_weight_yyx': 1.540941960627406e-05, 'L_sep_weight_yyx': 1.8303188067392454e-07, 'L_scale_weight_yyx': 1.6634097216562832e-08, 'learning_rate_yyx': 0.006507066908453935}. Best is trial 6 with value: -2.7665796528518882.
[I 2026-03-18 20:06:51,066] Trial 25 pruned. 
[I 2026-03-18 20:06:57,958] Trial 19 pruned. 
[I 2026-03-18 20:07:11,615] Trial 9 finished with value: -2.7322688498947887 and parameters: {'n_layers_yyx': 2, 'hidden_size_yyx_l0': 3, 'hidden_size_yyx_l1': 3, 'context_size_yyx': 2, 'num_mix_components_yyx': 1, 'context_extractor_yyx': 'gru', 'activation_func_yyx': 'Tanh', 'L2_weight_yyx': 1.6432798881550706e-05, 'L_entropy_weight_yyx': 3.044961452523073e-10, 'L_sep_weight_yyx': 1.4325169291320008e-07, 'L_scale_weight_yyx': 2.384554981178776e-07, 'learning_rate_yyx': 0.007425660187242304}. Best is trial 2 with value: -2.7647061180279695.
[I 2026-03-18 20:07:13,441] Trial 20 pruned. 
[I 2026-03-18 20:07:19,700] Trial 12 pruned. 
[I 2026-03-18 20:07:23,681] Trial 16 finished with value: -2.764212669696495 and parameters: {'n_layers_yyx': 2, 'hidden_size_yyx_l0': 2, 'hidden_size_yyx_l1': 4, 'context_size_yyx': 4, 'num_mix_components_yyx': 4, 'context_extractor_yyx': 'gru', 'activation_func_yyx': 'GELU', 'L2_weight_yyx': 8.958261854687885e-09, 'L_entropy_weight_yyx': 2.6790407799376328e-06, 'L_sep_weight_yyx': 1.6767959695410928e-06, 'L_scale_weight_yyx': 4.577443620956355e-09, 'learning_rate_yyx': 0.007036229927785412}. Best is trial 0 with value: -2.7678615354442075.
[I 2026-03-18 20:07:24,606] Trial 14 finished with value: -2.7663552897814294 and parameters: {'n_layers_yyx': 2, 'hidden_size_yyx_l0': 4, 'hidden_size_yyx_l1': 3, 'context_size_yyx': 2, 'num_mix_components_yyx': 4, 'context_extractor_yyx': 'gru', 'activation_func_yyx': 'ReLU', 'L2_weight_yyx': 1.1577659295279795e-08, 'L_entropy_weight_yyx': 1.1890371498731143e-08, 'L_sep_weight_yyx': 6.12807625718475e-05, 'L_scale_weight_yyx': 4.564601173792933e-09, 'learning_rate_yyx': 0.0031276297430866693}. Best is trial 14 with value: -2.7663552897814294.
[I 2026-03-18 20:07:26,707] Trial 16 pruned. 
[I 2026-03-18 20:07:44,863] Trial 12 pruned. 
[I 2026-03-18 20:08:06,037] Trial 26 pruned. 
[I 2026-03-18 20:08:12,553] Trial 9 pruned. 
[I 2026-03-18 20:08:19,080] Trial 25 finished with value: -2.7330829578829747 and parameters: {'n_layers_yyx': 1, 'hidden_size_yyx_l0': 6, 'context_size_yyx': 3, 'num_mix_components_yyx': 1, 'context_extractor_yyx': 'lstm', 'activation_func_yyx': 'GELU', 'L2_weight_yyx': 1.648998696234444e-06, 'L_entropy_weight_yyx': 0.00047560156218000207, 'L_sep_weight_yyx': 2.0072584027305738e-05, 'L_scale_weight_yyx': 3.407564414636829e-05, 'learning_rate_yyx': 0.006962963609597394}. Best is trial 1 with value: -2.766161832317774.
[I 2026-03-18 20:08:27,372] Trial 32 pruned. 
[I 2026-03-18 20:08:27,372] Trial 13 pruned. 
[I 2026-03-18 20:08:32,558] Trial 17 pruned. 
[I 2026-03-18 20:08:38,863] Trial 15 pruned. 
[I 2026-03-18 20:08:45,597] Trial 13 finished with value: -2.5388472431328815 and parameters: {'n_layers_yyx': 2, 'hidden_size_yyx_l0': 3, 'hidden_size_yyx_l1': 5, 'context_size_yyx': 3, 'num_mix_components_yyx': 4, 'context_extractor_yyx': 'gru', 'activation_func_yyx': 'Tanh', 'L2_weight_yyx': 2.9255347232821052e-06, 'L_entropy_weight_yyx': 1.4529770475819317e-06, 'L_sep_weight_yyx': 4.109100282191979e-07, 'L_scale_weight_yyx': 1.1259334724820322e-05, 'learning_rate_yyx': 0.0010516641103991864}. Best is trial 6 with value: -2.5462433457735516.
[I 2026-03-18 20:08:52,207] Trial 20 pruned. 
[I 2026-03-18 20:08:55,202] Trial 12 finished with value: -2.7636289372923724 and parameters: {'n_layers_yyx': 1, 'hidden_size_yyx_l0': 5, 'context_size_yyx': 1, 'num_mix_components_yyx': 4, 'context_extractor_yyx': 'lstm', 'activation_func_yyx': 'Tanh', 'L2_weight_yyx': 2.053163515417055e-08, 'L_entropy_weight_yyx': 7.532091279903942e-09, 'L_sep_weight_yyx': 9.625760704847748e-09, 'L_scale_weight_yyx': 2.781078654459085e-09, 'learning_rate_yyx': 0.009920771985042322}. Best is trial 7 with value: -2.766072426816335.
[I 2026-03-18 20:09:03,314] Trial 13 pruned. 
[I 2026-03-18 20:09:13,801] Trial 27 pruned. 
[I 2026-03-18 20:09:31,880] Trial 14 pruned. 
[I 2026-03-18 20:09:55,378] Trial 14 pruned. 
[I 2026-03-18 20:10:05,879] Trial 13 pruned. 
[I 2026-03-18 20:10:22,487] Trial 14 pruned. 
[I 2026-03-18 20:10:36,066] Trial 18 pruned. 
[I 2026-03-18 20:10:44,829] Trial 25 finished with value: -2.762886536950096 and parameters: {'n_layers_yyx': 2, 'hidden_size_yyx_l0': 2, 'hidden_size_yyx_l1': 3, 'context_size_yyx': 3, 'num_mix_components_yyx': 5, 'context_extractor_yyx': 'lstm', 'activation_func_yyx': 'Tanh', 'L2_weight_yyx': 1.8510334971812958e-07, 'L_entropy_weight_yyx': 4.443997098011275e-10, 'L_sep_weight_yyx': 4.655436928369934e-06, 'L_scale_weight_yyx': 1.5238087379919213e-08, 'learning_rate_yyx': 0.007369781816492868}. Best is trial 25 with value: -2.762886536950096.
[I 2026-03-18 20:10:52,075] Trial 9 pruned. 
[I 2026-03-18 20:11:05,563] Trial 14 finished with value: -2.357295940118519 and parameters: {'n_layers_yyx': 2, 'hidden_size_yyx_l0': 5, 'hidden_size_yyx_l1': 5, 'context_size_yyx': 4, 'num_mix_components_yyx': 2, 'context_extractor_yyx': 'lstm', 'activation_func_yyx': 'Tanh', 'L2_weight_yyx': 1.5502751012630653e-10, 'L_entropy_weight_yyx': 3.061925203662461e-06, 'L_sep_weight_yyx': 5.962774166708673e-05, 'L_scale_weight_yyx': 1.0286073391885162e-08, 'learning_rate_yyx': 0.0011784213620747081}. Best is trial 11 with value: -2.4030680672323603.
[I 2026-03-18 20:11:24,161] Trial 11 finished with value: -2.4010421208672135 and parameters: {'n_layers_yyx': 2, 'hidden_size_yyx_l0': 6, 'hidden_size_yyx_l1': 4, 'context_size_yyx': 3, 'num_mix_components_yyx': 4, 'context_extractor_yyx': 'lstm', 'activation_func_yyx': 'GELU', 'L2_weight_yyx': 3.3300661982996116e-07, 'L_entropy_weight_yyx': 2.405053174022262e-05, 'L_sep_weight_yyx': 0.0007781169748474584, 'L_scale_weight_yyx': 0.0007218931102445031, 'learning_rate_yyx': 0.0028890377245997458}. Best is trial 11 with value: -2.4010421208672135.
[I 2026-03-18 20:11:35,632] Trial 15 finished with value: -2.392055861673091 and parameters: {'n_layers_yyx': 1, 'hidden_size_yyx_l0': 5, 'context_size_yyx': 1, 'num_mix_components_yyx': 4, 'context_extractor_yyx': 'lstm', 'activation_func_yyx': 'Tanh', 'L2_weight_yyx': 3.220620824072241e-05, 'L_entropy_weight_yyx': 1.3288447762912884e-05, 'L_sep_weight_yyx': 7.330844447390392e-07, 'L_scale_weight_yyx': 7.799452638863233e-10, 'learning_rate_yyx': 0.0032163451823700776}. Best is trial 9 with value: -2.4237415519893895.
[I 2026-03-18 20:11:53,016] Trial 10 finished with value: -0.7967287567904993 and parameters: {'n_layers_yyx': 2, 'hidden_size_yyx_l0': 3, 'hidden_size_yyx_l1': 6, 'context_size_yyx': 1, 'num_mix_components_yyx': 4, 'context_extractor_yyx': 'gru', 'activation_func_yyx': 'Tanh', 'L2_weight_yyx': 2.1761158496088561e-07, 'L_entropy_weight_yyx': 6.91401225845558e-06, 'L_sep_weight_yyx': 5.145017404986243e-06, 'L_scale_weight_yyx': 0.0005312054070267234, 'learning_rate_yyx': 0.002130243476590658}. Best is trial 5 with value: -0.8480365026296506.
[I 2026-03-18 20:11:55,036] Trial 10 pruned. 
[I 2026-03-18 20:11:58,103] Trial 10 finished with value: -2.4114769060587147 and parameters: {'n_layers_yyx': 1, 'hidden_size_yyx_l0': 5, 'context_size_yyx': 3, 'num_mix_components_yyx': 5, 'context_extractor_yyx': 'lstm', 'activation_func_yyx': 'Tanh', 'L2_weight_yyx': 1.0210099074828393e-07, 'L_entropy_weight_yyx': 3.2663473974399145e-06, 'L_sep_weight_yyx': 0.0002202255792587817, 'L_scale_weight_yyx': 1.544022222923415e-10, 'learning_rate_yyx': 0.008895771739293745}. Best is trial 10 with value: -2.4114769060587147.
[I 2026-03-18 20:12:06,978] Trial 15 pruned. 
[I 2026-03-18 20:12:23,325] Trial 22 pruned. 
[I 2026-03-18 20:12:26,904] Trial 10 finished with value: -2.765471259452738 and parameters: {'n_layers_yyx': 1, 'hidden_size_yyx_l0': 6, 'context_size_yyx': 4, 'num_mix_components_yyx': 2, 'context_extractor_yyx': 'gru', 'activation_func_yyx': 'ReLU', 'L2_weight_yyx': 0.00021084426882543028, 'L_entropy_weight_yyx': 3.234605194417221e-06, 'L_sep_weight_yyx': 6.461242140642081e-08, 'L_scale_weight_yyx': 0.0007117262006441336, 'learning_rate_yyx': 0.009076471950887987}. Best is trial 10 with value: -2.765471259452738.
[I 2026-03-18 20:12:33,766] Trial 12 pruned. 
[I 2026-03-18 20:12:50,913] Trial 15 pruned. 
[I 2026-03-18 20:13:04,429] Trial 9 finished with value: -2.764811935325334 and parameters: {'n_layers_yyx': 1, 'hidden_size_yyx_l0': 3, 'context_size_yyx': 4, 'num_mix_components_yyx': 5, 'context_extractor_yyx': 'lstm', 'activation_func_yyx': 'ReLU', 'L2_weight_yyx': 0.0002960292659279025, 'L_entropy_weight_yyx': 9.232997877925152e-06, 'L_sep_weight_yyx': 8.082030550411672e-05, 'L_scale_weight_yyx': 6.399261682181787e-06, 'learning_rate_yyx': 0.008180396261753141}. Best is trial 8 with value: -2.7663050128086293.
[I 2026-03-18 20:13:06,360] Trial 26 pruned. 
[I 2026-03-18 20:13:36,040] Trial 33 pruned. 
[I 2026-03-18 20:13:55,938] Trial 21 finished with value: -2.763925854365031 and parameters: {'n_layers_yyx': 2, 'hidden_size_yyx_l0': 5, 'hidden_size_yyx_l1': 5, 'context_size_yyx': 4, 'num_mix_components_yyx': 5, 'context_extractor_yyx': 'gru', 'activation_func_yyx': 'ReLU', 'L2_weight_yyx': 7.221149755707385e-07, 'L_entropy_weight_yyx': 8.653912333541031e-10, 'L_sep_weight_yyx': 6.774761524914174e-09, 'L_scale_weight_yyx': 6.826739393543984e-07, 'learning_rate_yyx': 0.0069278723748750146}. Best is trial 3 with value: -2.7657987594604494.
[I 2026-03-18 20:13:56,103] Trial 17 finished with value: -0.8111939873970065 and parameters: {'n_layers_yyx': 1, 'hidden_size_yyx_l0': 5, 'context_size_yyx': 2, 'num_mix_components_yyx': 4, 'context_extractor_yyx': 'lstm', 'activation_func_yyx': 'ReLU', 'L2_weight_yyx': 0.00010461128206285233, 'L_entropy_weight_yyx': 1.599649464593392e-10, 'L_sep_weight_yyx': 5.627645545349691e-07, 'L_scale_weight_yyx': 5.752194916401361e-09, 'learning_rate_yyx': 0.008543604318133398}. Best is trial 4 with value: -0.8236861799457048.
[I 2026-03-18 20:13:59,018] Trial 11 pruned. 
[I 2026-03-18 20:14:09,918] Trial 16 pruned. 
[I 2026-03-18 20:14:16,547] Trial 10 pruned. 
[I 2026-03-18 20:14:34,750] Trial 14 finished with value: -2.765995399859815 and parameters: {'n_layers_yyx': 1, 'hidden_size_yyx_l0': 3, 'context_size_yyx': 4, 'num_mix_components_yyx': 1, 'context_extractor_yyx': 'lstm', 'activation_func_yyx': 'GELU', 'L2_weight_yyx': 2.709366294020236e-09, 'L_entropy_weight_yyx': 1.275146380687317e-05, 'L_sep_weight_yyx': 4.390482502151928e-06, 'L_scale_weight_yyx': 1.0215487925109436e-09, 'learning_rate_yyx': 0.0015717591785455762}. Best is trial 14 with value: -2.765995399859815.
[I 2026-03-18 20:14:42,284] Trial 15 pruned. 
[I 2026-03-18 20:14:50,881] Trial 34 pruned. 
[I 2026-03-18 20:14:51,338] Trial 16 finished with value: -0.8216463029824824 and parameters: {'n_layers_yyx': 1, 'hidden_size_yyx_l0': 4, 'context_size_yyx': 4, 'num_mix_components_yyx': 3, 'context_extractor_yyx': 'gru', 'activation_func_yyx': 'Tanh', 'L2_weight_yyx': 1.9475753495290094e-05, 'L_entropy_weight_yyx': 1.4001351581382589e-05, 'L_sep_weight_yyx': 3.0461596899844456e-07, 'L_scale_weight_yyx': 9.578111493126589e-06, 'learning_rate_yyx': 0.006215862270413301}. Best is trial 13 with value: -0.8270922707313977.
[I 2026-03-18 20:15:13,199] Trial 16 finished with value: -2.765372299178425 and parameters: {'n_layers_yyx': 2, 'hidden_size_yyx_l0': 6, 'hidden_size_yyx_l1': 4, 'context_size_yyx': 4, 'num_mix_components_yyx': 3, 'context_extractor_yyx': 'lstm', 'activation_func_yyx': 'Tanh', 'L2_weight_yyx': 2.052618401165944e-08, 'L_entropy_weight_yyx': 9.14269896914109e-06, 'L_sep_weight_yyx': 2.7377246639381396e-05, 'L_scale_weight_yyx': 4.7969422892948085e-09, 'learning_rate_yyx': 0.009828271280723907}. Best is trial 14 with value: -2.7663552897814294.
