[I 2026-03-18 22:38:51,634] Trial 61 finished with value: -1.868627675736103 and parameters: {'n_layers_yyx': 2, 'hidden_size_yyx_l0': 4, 'hidden_size_yyx_l1': 2, 'context_size_yyx': 2, 'num_mix_components_yyx': 5, 'context_extractor_yyx': 'lstm', 'activation_func_yyx': 'ReLU', 'L2_weight_yyx': 6.759380815301315e-05, 'L_entropy_weight_yyx': 5.269352610043847e-08, 'L_sep_weight_yyx': 1.5429634097822997e-07, 'L_scale_weight_yyx': 0.0009773161707007894, 'learning_rate_yyx': 0.007368673680438542}. Best is trial 5 with value: -1.89157565728699.
[I 2026-03-18 22:38:52,653] Trial 57 pruned. 
[I 2026-03-18 22:38:54,688] Trial 64 finished with value: -1.848031939639625 and parameters: {'n_layers_yyx': 2, 'hidden_size_yyx_l0': 2, 'hidden_size_yyx_l1': 6, 'context_size_yyx': 4, 'num_mix_components_yyx': 4, 'context_extractor_yyx': 'lstm', 'activation_func_yyx': 'ReLU', 'L2_weight_yyx': 1.1270876280854254e-09, 'L_entropy_weight_yyx': 6.710511850357567e-05, 'L_sep_weight_yyx': 1.2972986369127742e-05, 'L_scale_weight_yyx': 1.4145309500210138e-06, 'learning_rate_yyx': 0.007982994772442728}. Best is trial 60 with value: -1.8490650754743791.
[I 2026-03-18 22:38:55,828] Trial 69 pruned. 
[I 2026-03-18 22:38:56,216] Trial 69 pruned. 
[I 2026-03-18 22:38:57,448] Trial 69 pruned. 
[I 2026-03-18 22:38:58,008] Trial 58 pruned. 
[I 2026-03-18 22:39:02,149] Trial 47 finished with value: -1.9352030291906768 and parameters: {'n_layers_yyx': 2, 'hidden_size_yyx_l0': 4, 'hidden_size_yyx_l1': 4, 'context_size_yyx': 2, 'num_mix_components_yyx': 2, 'context_extractor_yyx': 'lstm', 'activation_func_yyx': 'GELU', 'L2_weight_yyx': 7.610256992355732e-05, 'L_entropy_weight_yyx': 5.118356591242953e-07, 'L_sep_weight_yyx': 8.536298249952719e-07, 'L_scale_weight_yyx': 1.0824013807314337e-09, 'learning_rate_yyx': 0.009760140322005895}. Best is trial 47 with value: -1.9352030291906768.
[I 2026-03-18 22:39:02,212] Trial 70 pruned. 
[I 2026-03-18 22:39:02,288] Trial 57 pruned. 
[I 2026-03-18 22:39:03,083] Trial 80 pruned. 

Source events: 14713
Target events: 3618
Full model ln_yyx : 190.18246 nats/sec, 47.30907 nats/event
Full model Log loss : -1.93664
Full model ln_yyx : 191.14193 nats/sec, 47.54774 nats/event
Full model Log loss : -1.93714
Full model ln_yyx : 189.74057 nats/sec, 47.19915 nats/event
Full model Log loss : -1.93548
Full model ln_yyx : 189.91788 nats/sec, 47.24325 nats/event
Full model Log loss : -1.93621
Full model ln_yyx : 191.13197 nats/sec, 47.54527 nats/event
Full model Log loss : -1.93714
Full model ln_yyx : 190.66700 nats/sec, 47.42960 nats/event
Full model Log loss : -1.93646
Full model ln_yyx : 191.15937 nats/sec, 47.55208 nats/event
Full model Log loss : -1.93706
Full model ln_yyx : 190.66361 nats/sec, 47.42876 nats/event
Full model Log loss : -1.93615
Full model ln_yyx : 191.15522 nats/sec, 47.55105 nats/event
Full model Log loss : -1.93707
Full model ln_yyx : 190.50156 nats/sec, 47.38845 nats/event
Full model Log loss : -1.93992
Optimization finished. Config saved to results/opt-full/opt_full_239_best_config.txt
[I 2026-03-18 22:39:03,517] Trial 68 pruned. 
[I 2026-03-18 22:39:04,952] Trial 62 pruned. 
[I 2026-03-18 22:39:06,458] Trial 65 pruned. 
[I 2026-03-18 22:39:07,262] Trial 48 pruned. 
[I 2026-03-18 22:39:08,358] Trial 70 pruned. 
[I 2026-03-18 22:39:09,164] Trial 58 pruned. 
[I 2026-03-18 22:39:09,450] Trial 71 pruned. 
[I 2026-03-18 22:39:10,234] Trial 59 pruned. 
[I 2026-03-18 22:39:10,415] Trial 70 pruned. 
[I 2026-03-18 22:39:11,888] Trial 66 pruned. 
[I 2026-03-18 22:39:13,322] Trial 71 pruned. 
[I 2026-03-18 22:39:14,927] Trial 60 pruned. 
[I 2026-03-18 22:39:15,932] Trial 64 finished with value: -1.7802579259390783 and parameters: {'n_layers_yyx': 2, 'hidden_size_yyx_l0': 6, 'hidden_size_yyx_l1': 6, 'context_size_yyx': 2, 'num_mix_components_yyx': 5, 'context_extractor_yyx': 'gru', 'activation_func_yyx': 'GELU', 'L2_weight_yyx': 1.202713040349859e-09, 'L_entropy_weight_yyx': 8.935741013911817e-06, 'L_sep_weight_yyx': 4.2007113681923995e-05, 'L_scale_weight_yyx': 2.5250281595979736e-06, 'learning_rate_yyx': 0.00910751371901552}. Best is trial 4 with value: -1.7875800731928662.
[I 2026-03-18 22:39:15,945] Trial 69 pruned. 
[I 2026-03-18 22:39:18,777] Trial 49 pruned. 
[I 2026-03-18 22:39:25,215] Trial 61 finished with value: -1.8373969085333832 and parameters: {'n_layers_yyx': 2, 'hidden_size_yyx_l0': 6, 'hidden_size_yyx_l1': 5, 'context_size_yyx': 3, 'num_mix_components_yyx': 2, 'context_extractor_yyx': 'lstm', 'activation_func_yyx': 'GELU', 'L2_weight_yyx': 3.8383393040022026e-10, 'L_entropy_weight_yyx': 9.464944440607487e-05, 'L_sep_weight_yyx': 0.00032910644058418563, 'L_scale_weight_yyx': 1.821160390426333e-06, 'learning_rate_yyx': 0.003800288121394001}. Best is trial 1 with value: -1.8555367853768732.
[I 2026-03-18 22:39:26,370] Trial 61 pruned. 
[I 2026-03-18 22:39:27,610] Trial 66 finished with value: -1.851238248088834 and parameters: {'n_layers_yyx': 2, 'hidden_size_yyx_l0': 6, 'hidden_size_yyx_l1': 5, 'context_size_yyx': 3, 'num_mix_components_yyx': 4, 'context_extractor_yyx': 'lstm', 'activation_func_yyx': 'Tanh', 'L2_weight_yyx': 8.201196203959954e-05, 'L_entropy_weight_yyx': 4.193053944526661e-06, 'L_sep_weight_yyx': 3.2871934170555274e-09, 'L_scale_weight_yyx': 2.7064338265839175e-07, 'learning_rate_yyx': 0.00919010141387804}. Best is trial 9 with value: -1.8570869006965198.
[I 2026-03-18 22:39:33,243] Trial 67 pruned. 
[I 2026-03-18 22:39:43,584] Trial 82 finished with value: -1.801304256809835 and parameters: {'n_layers_yyx': 2, 'hidden_size_yyx_l0': 5, 'hidden_size_yyx_l1': 5, 'context_size_yyx': 3, 'num_mix_components_yyx': 3, 'context_extractor_yyx': 'gru', 'activation_func_yyx': 'GELU', 'L2_weight_yyx': 2.453376245208986e-05, 'L_entropy_weight_yyx': 1.1170943176884623e-06, 'L_sep_weight_yyx': 9.98530080525788e-06, 'L_scale_weight_yyx': 7.168871317633579e-06, 'learning_rate_yyx': 0.00930937065828447}. Best is trial 27 with value: -1.8062570642302185.
[I 2026-03-18 22:39:43,996] Trial 72 pruned. 
[I 2026-03-18 22:39:45,650] Trial 71 finished with value: -1.8589943867959005 and parameters: {'n_layers_yyx': 2, 'hidden_size_yyx_l0': 5, 'hidden_size_yyx_l1': 6, 'context_size_yyx': 4, 'num_mix_components_yyx': 1, 'context_extractor_yyx': 'lstm', 'activation_func_yyx': 'ReLU', 'L2_weight_yyx': 0.0001409458692218834, 'L_entropy_weight_yyx': 2.456999283319616e-08, 'L_sep_weight_yyx': 3.3643307118429846e-07, 'L_scale_weight_yyx': 3.823690107820447e-05, 'learning_rate_yyx': 0.009145899248176185}. Best is trial 11 with value: -1.8610449438696508.
[I 2026-03-18 22:39:46,226] Trial 65 pruned. 
[I 2026-03-18 22:39:49,918] Trial 73 pruned. 
[I 2026-03-18 22:39:51,024] Trial 66 pruned. 
[I 2026-03-18 22:39:55,516] Trial 62 pruned. 
[I 2026-03-18 22:39:55,856] Trial 67 pruned. 
[I 2026-03-18 22:39:56,312] Trial 63 finished with value: -1.8491150135383223 and parameters: {'n_layers_yyx': 2, 'hidden_size_yyx_l0': 5, 'hidden_size_yyx_l1': 2, 'context_size_yyx': 4, 'num_mix_components_yyx': 5, 'context_extractor_yyx': 'gru', 'activation_func_yyx': 'ReLU', 'L2_weight_yyx': 9.802312729507674e-10, 'L_entropy_weight_yyx': 3.1942888507157074e-08, 'L_sep_weight_yyx': 3.1504795678378134e-10, 'L_scale_weight_yyx': 4.5850883874547905e-06, 'learning_rate_yyx': 0.007733848969244449}. Best is trial 0 with value: -1.8516305051550026.
[I 2026-03-18 22:39:57,488] Trial 72 finished with value: -1.8946649178691295 and parameters: {'n_layers_yyx': 2, 'hidden_size_yyx_l0': 4, 'hidden_size_yyx_l1': 5, 'context_size_yyx': 4, 'num_mix_components_yyx': 3, 'context_extractor_yyx': 'lstm', 'activation_func_yyx': 'ReLU', 'L2_weight_yyx': 2.9504319157029675e-06, 'L_entropy_weight_yyx': 1.6688593768012176e-09, 'L_sep_weight_yyx': 2.5102626005766938e-09, 'L_scale_weight_yyx': 3.472691526971933e-09, 'learning_rate_yyx': 0.007460165613314243}. Best is trial 55 with value: -1.8982689846521137.
[I 2026-03-18 22:39:58,240] Trial 62 pruned. 
[I 2026-03-18 22:40:03,946] Trial 63 pruned. 
[I 2026-03-18 22:40:09,446] Trial 67 finished with value: -1.8488497552274614 and parameters: {'n_layers_yyx': 2, 'hidden_size_yyx_l0': 2, 'hidden_size_yyx_l1': 6, 'context_size_yyx': 4, 'num_mix_components_yyx': 4, 'context_extractor_yyx': 'lstm', 'activation_func_yyx': 'ReLU', 'L2_weight_yyx': 2.136543065622383e-09, 'L_entropy_weight_yyx': 0.00029065205880735956, 'L_sep_weight_yyx': 2.8972707088247183e-05, 'L_scale_weight_yyx': 4.7051786400729654e-07, 'learning_rate_yyx': 0.007040956065809886}. Best is trial 60 with value: -1.8490650754743791.
[I 2026-03-18 22:40:09,452] Trial 64 pruned. 
[I 2026-03-18 22:40:13,935] Trial 83 pruned. 
[I 2026-03-18 22:40:21,258] Trial 65 pruned. 
[I 2026-03-18 22:40:21,922] Trial 72 finished with value: -1.8590154297551758 and parameters: {'n_layers_yyx': 2, 'hidden_size_yyx_l0': 5, 'hidden_size_yyx_l1': 6, 'context_size_yyx': 4, 'num_mix_components_yyx': 1, 'context_extractor_yyx': 'lstm', 'activation_func_yyx': 'ReLU', 'L2_weight_yyx': 0.0001725396202548605, 'L_entropy_weight_yyx': 2.336643646394571e-08, 'L_sep_weight_yyx': 3.6754342075646484e-07, 'L_scale_weight_yyx': 4.059338333493282e-05, 'learning_rate_yyx': 0.009063283665957253}. Best is trial 11 with value: -1.8610449438696508.
[I 2026-03-18 22:40:22,721] Trial 68 pruned. 
[I 2026-03-18 22:40:26,404] Trial 68 pruned. 
[I 2026-03-18 22:40:27,044] Trial 66 pruned. 
[I 2026-03-18 22:40:34,043] Trial 50 finished with value: -1.9346319007723232 and parameters: {'n_layers_yyx': 2, 'hidden_size_yyx_l0': 4, 'hidden_size_yyx_l1': 2, 'context_size_yyx': 3, 'num_mix_components_yyx': 3, 'context_extractor_yyx': 'lstm', 'activation_func_yyx': 'ReLU', 'L2_weight_yyx': 1.3281232589384856e-05, 'L_entropy_weight_yyx': 3.144834250446453e-07, 'L_sep_weight_yyx': 7.131806165952304e-07, 'L_scale_weight_yyx': 9.070308213699758e-10, 'learning_rate_yyx': 0.009901333956444047}. Best is trial 47 with value: -1.9352030291906768.
[I 2026-03-18 22:40:34,664] Trial 68 finished with value: -1.8508983461376038 and parameters: {'n_layers_yyx': 2, 'hidden_size_yyx_l0': 6, 'hidden_size_yyx_l1': 4, 'context_size_yyx': 3, 'num_mix_components_yyx': 5, 'context_extractor_yyx': 'lstm', 'activation_func_yyx': 'Tanh', 'L2_weight_yyx': 1.8124452550201053e-06, 'L_entropy_weight_yyx': 4.174136274867368e-08, 'L_sep_weight_yyx': 2.3309744604226716e-10, 'L_scale_weight_yyx': 0.0009590161678085546, 'learning_rate_yyx': 0.008295285101689384}. Best is trial 9 with value: -1.8570869006965198.
[I 2026-03-18 22:40:37,100] Trial 69 pruned. 
[I 2026-03-18 22:40:40,277] Trial 41 finished with value: -1.8588545304243547 and parameters: {'n_layers_yyx': 1, 'hidden_size_yyx_l0': 4, 'context_size_yyx': 4, 'num_mix_components_yyx': 4, 'context_extractor_yyx': 'lstm', 'activation_func_yyx': 'Tanh', 'L2_weight_yyx': 1.41552978436298e-10, 'L_entropy_weight_yyx': 0.0001171312872215698, 'L_sep_weight_yyx': 2.7483473196252617e-10, 'L_scale_weight_yyx': 1.8733435984977643e-09, 'learning_rate_yyx': 0.009683929610105505}. Best is trial 40 with value: -1.861402018567546.
[I 2026-03-18 22:40:40,297] Trial 69 pruned. 
[I 2026-03-18 22:40:41,586] Trial 70 pruned. 
[I 2026-03-18 22:40:42,850] Trial 63 finished with value: -1.8904236404180188 and parameters: {'n_layers_yyx': 2, 'hidden_size_yyx_l0': 5, 'hidden_size_yyx_l1': 3, 'context_size_yyx': 2, 'num_mix_components_yyx': 5, 'context_extractor_yyx': 'lstm', 'activation_func_yyx': 'Tanh', 'L2_weight_yyx': 0.00020313099744203233, 'L_entropy_weight_yyx': 1.780248165588912e-08, 'L_sep_weight_yyx': 6.28952499184767e-10, 'L_scale_weight_yyx': 3.6227861501612664e-06, 'learning_rate_yyx': 0.00411244533808796}. Best is trial 5 with value: -1.89157565728699.
[I 2026-03-18 22:40:45,698] Trial 73 finished with value: -1.8951234159798458 and parameters: {'n_layers_yyx': 2, 'hidden_size_yyx_l0': 4, 'hidden_size_yyx_l1': 4, 'context_size_yyx': 4, 'num_mix_components_yyx': 3, 'context_extractor_yyx': 'lstm', 'activation_func_yyx': 'Tanh', 'L2_weight_yyx': 2.2044991414341526e-06, 'L_entropy_weight_yyx': 1.0171753833360967e-10, 'L_sep_weight_yyx': 9.132623399534679e-10, 'L_scale_weight_yyx': 3.0395135382141275e-10, 'learning_rate_yyx': 0.009314305907931444}. Best is trial 55 with value: -1.8982689846521137.
[I 2026-03-18 22:40:47,098] Trial 71 pruned. 
[I 2026-03-18 22:40:48,012] Trial 64 pruned. 
[I 2026-03-18 22:40:49,388] Trial 84 finished with value: -1.7991985309715741 and parameters: {'n_layers_yyx': 2, 'hidden_size_yyx_l0': 5, 'hidden_size_yyx_l1': 6, 'context_size_yyx': 3, 'num_mix_components_yyx': 3, 'context_extractor_yyx': 'gru', 'activation_func_yyx': 'GELU', 'L2_weight_yyx': 0.0001664197272395856, 'L_entropy_weight_yyx': 4.950681239586187e-07, 'L_sep_weight_yyx': 2.6861456589259e-05, 'L_scale_weight_yyx': 3.9872864136938445e-05, 'learning_rate_yyx': 0.00958549069976587}. Best is trial 27 with value: -1.8062570642302185.
[I 2026-03-18 22:40:51,663] Trial 59 pruned. 
[I 2026-03-18 22:40:51,962] Trial 70 pruned. 
[I 2026-03-18 22:40:52,458] Trial 70 pruned. 
[I 2026-03-18 22:40:54,242] Trial 65 pruned. 
[I 2026-03-18 22:40:57,562] Trial 71 pruned. 
[I 2026-03-18 22:40:58,113] Trial 67 pruned. 
[I 2026-03-18 22:41:01,573] Trial 73 finished with value: -1.8595072851359473 and parameters: {'n_layers_yyx': 2, 'hidden_size_yyx_l0': 5, 'hidden_size_yyx_l1': 6, 'context_size_yyx': 4, 'num_mix_components_yyx': 1, 'context_extractor_yyx': 'lstm', 'activation_func_yyx': 'ReLU', 'L2_weight_yyx': 0.0009767346310262841, 'L_entropy_weight_yyx': 9.800672716835443e-09, 'L_sep_weight_yyx': 2.590916639514868e-05, 'L_scale_weight_yyx': 0.00027334300496726006, 'learning_rate_yyx': 0.008018139139751268}. Best is trial 11 with value: -1.8610449438696508.
[I 2026-03-18 22:41:02,062] Trial 72 pruned. 
[I 2026-03-18 22:41:03,844] Trial 68 pruned. 
[I 2026-03-18 22:41:04,109] Trial 51 pruned. 
[I 2026-03-18 22:41:04,996] Trial 64 finished with value: -1.848844094559452 and parameters: {'n_layers_yyx': 2, 'hidden_size_yyx_l0': 5, 'hidden_size_yyx_l1': 2, 'context_size_yyx': 4, 'num_mix_components_yyx': 5, 'context_extractor_yyx': 'gru', 'activation_func_yyx': 'ReLU', 'L2_weight_yyx': 1.470507625325001e-09, 'L_entropy_weight_yyx': 2.8766403246639722e-08, 'L_sep_weight_yyx': 1.2590809664514597e-10, 'L_scale_weight_yyx': 1.0981272363277696e-05, 'learning_rate_yyx': 0.007859010153545919}. Best is trial 0 with value: -1.8516305051550026.
[I 2026-03-18 22:41:05,258] Trial 60 pruned. 
[I 2026-03-18 22:41:08,167] Trial 66 pruned. 
[I 2026-03-18 22:41:09,610] Trial 52 pruned. 
[I 2026-03-18 22:41:10,747] Trial 63 finished with value: -1.788814882220644 and parameters: {'n_layers_yyx': 2, 'hidden_size_yyx_l0': 2, 'hidden_size_yyx_l1': 3, 'context_size_yyx': 4, 'num_mix_components_yyx': 3, 'context_extractor_yyx': 'gru', 'activation_func_yyx': 'Tanh', 'L2_weight_yyx': 1.4483922555183926e-08, 'L_entropy_weight_yyx': 4.79270121499516e-10, 'L_sep_weight_yyx': 6.788653322153587e-07, 'L_scale_weight_yyx': 2.880263008125594e-05, 'learning_rate_yyx': 0.007552736642928887}. Best is trial 16 with value: -1.790272919625947.
[I 2026-03-18 22:41:10,962] Trial 69 finished with value: -1.8459589645636587 and parameters: {'n_layers_yyx': 2, 'hidden_size_yyx_l0': 2, 'hidden_size_yyx_l1': 5, 'context_size_yyx': 4, 'num_mix_components_yyx': 3, 'context_extractor_yyx': 'lstm', 'activation_func_yyx': 'ReLU', 'L2_weight_yyx': 5.282207360084345e-10, 'L_entropy_weight_yyx': 0.0006723076257701007, 'L_sep_weight_yyx': 1.3802932767495898e-06, 'L_scale_weight_yyx': 1.8278495876537637e-05, 'learning_rate_yyx': 0.005891434580073285}. Best is trial 60 with value: -1.8490650754743791.
[I 2026-03-18 22:41:13,411] Trial 73 pruned. 
[I 2026-03-18 22:41:14,796] Trial 74 finished with value: -1.7831515595407197 and parameters: {'n_layers_yyx': 2, 'hidden_size_yyx_l0': 6, 'hidden_size_yyx_l1': 5, 'context_size_yyx': 1, 'num_mix_components_yyx': 3, 'context_extractor_yyx': 'lstm', 'activation_func_yyx': 'Tanh', 'L2_weight_yyx': 1.0121193580263441e-07, 'L_entropy_weight_yyx': 0.000526012602193909, 'L_sep_weight_yyx': 1.1389245559551779e-09, 'L_scale_weight_yyx': 0.00028286170079049077, 'learning_rate_yyx': 0.00857881641859348}. Best is trial 50 with value: -1.7853193803267045.
[I 2026-03-18 22:41:16,092] Trial 74 pruned. 
[I 2026-03-18 22:41:16,919] Trial 70 pruned. 
[I 2026-03-18 22:41:18,777] Trial 74 pruned. 
[I 2026-03-18 22:41:19,260] Trial 85 pruned. 
[I 2026-03-18 22:41:20,723] Trial 75 pruned. 
[I 2026-03-18 22:41:22,358] Trial 64 pruned. 
[I 2026-03-18 22:41:23,441] Trial 75 pruned. 
[I 2026-03-18 22:41:29,340] Trial 75 pruned. 
[I 2026-03-18 22:41:33,137] Trial 65 pruned. 
[I 2026-03-18 22:41:33,764] Trial 69 pruned. 
[I 2026-03-18 22:41:35,893] Trial 72 finished with value: -1.7788505415482954 and parameters: {'n_layers_yyx': 2, 'hidden_size_yyx_l0': 6, 'hidden_size_yyx_l1': 5, 'context_size_yyx': 4, 'num_mix_components_yyx': 5, 'context_extractor_yyx': 'gru', 'activation_func_yyx': 'ReLU', 'L2_weight_yyx': 1.6349609209888145e-09, 'L_entropy_weight_yyx': 0.0004938026420967316, 'L_sep_weight_yyx': 7.949505884614633e-06, 'L_scale_weight_yyx': 1.9788294603577157e-06, 'learning_rate_yyx': 0.006372693831859993}. Best is trial 4 with value: -1.7875800731928662.
[I 2026-03-18 22:41:38,102] Trial 66 pruned. 
[I 2026-03-18 22:41:38,599] Trial 74 finished with value: -1.8588848365154518 and parameters: {'n_layers_yyx': 2, 'hidden_size_yyx_l0': 5, 'hidden_size_yyx_l1': 6, 'context_size_yyx': 4, 'num_mix_components_yyx': 1, 'context_extractor_yyx': 'lstm', 'activation_func_yyx': 'ReLU', 'L2_weight_yyx': 0.0007105116872018597, 'L_entropy_weight_yyx': 3.613598246919243e-09, 'L_sep_weight_yyx': 4.03504228106594e-05, 'L_scale_weight_yyx': 0.00014043003387982533, 'learning_rate_yyx': 0.006795060519496318}. Best is trial 11 with value: -1.8610449438696508.
[I 2026-03-18 22:41:45,096] Trial 70 pruned. 
[I 2026-03-18 22:41:47,629] Trial 67 pruned. 
[I 2026-03-18 22:41:49,350] Trial 67 pruned. 
[I 2026-03-18 22:41:49,576] Trial 61 finished with value: -1.8693173668173764 and parameters: {'n_layers_yyx': 1, 'hidden_size_yyx_l0': 6, 'context_size_yyx': 4, 'num_mix_components_yyx': 4, 'context_extractor_yyx': 'lstm', 'activation_func_yyx': 'ReLU', 'L2_weight_yyx': 3.229972343075798e-09, 'L_entropy_weight_yyx': 3.062809799789976e-09, 'L_sep_weight_yyx': 2.2948232274722464e-06, 'L_scale_weight_yyx': 1.765722975627012e-05, 'learning_rate_yyx': 0.009071753131525011}. Best is trial 42 with value: -1.8699069075199783.
[I 2026-03-18 22:41:50,888] Trial 71 pruned. 
[I 2026-03-18 22:41:51,599] Trial 76 pruned. 
[I 2026-03-18 22:41:51,990] Trial 71 finished with value: -1.8534318972856572 and parameters: {'n_layers_yyx': 1, 'hidden_size_yyx_l0': 5, 'context_size_yyx': 4, 'num_mix_components_yyx': 4, 'context_extractor_yyx': 'gru', 'activation_func_yyx': 'Tanh', 'L2_weight_yyx': 9.364211514316746e-07, 'L_entropy_weight_yyx': 0.00044023168526337086, 'L_sep_weight_yyx': 2.1602907939610106e-05, 'L_scale_weight_yyx': 8.372778159601891e-08, 'learning_rate_yyx': 0.006567247325145766}. Best is trial 53 with value: -1.855205638988598.
[I 2026-03-18 22:41:59,652] Trial 75 finished with value: -1.840171005026962 and parameters: {'n_layers_yyx': 2, 'hidden_size_yyx_l0': 6, 'hidden_size_yyx_l1': 6, 'context_size_yyx': 4, 'num_mix_components_yyx': 5, 'context_extractor_yyx': 'lstm', 'activation_func_yyx': 'ReLU', 'L2_weight_yyx': 0.00098679271943694, 'L_entropy_weight_yyx': 1.087448754067001e-08, 'L_sep_weight_yyx': 1.3223857270066971e-05, 'L_scale_weight_yyx': 1.0240425973738117e-09, 'learning_rate_yyx': 0.007955519681255135}. Best is trial 11 with value: -1.8610449438696508.
[I 2026-03-18 22:42:00,057] Trial 68 pruned. 
[I 2026-03-18 22:42:06,448] Trial 76 pruned. 
[I 2026-03-18 22:42:07,904] Trial 65 finished with value: -1.849643716544006 and parameters: {'n_layers_yyx': 2, 'hidden_size_yyx_l0': 5, 'hidden_size_yyx_l1': 2, 'context_size_yyx': 4, 'num_mix_components_yyx': 5, 'context_extractor_yyx': 'gru', 'activation_func_yyx': 'ReLU', 'L2_weight_yyx': 1.1093377982089632e-09, 'L_entropy_weight_yyx': 2.081762121904084e-08, 'L_sep_weight_yyx': 1.205851343664753e-10, 'L_scale_weight_yyx': 1.406345341959388e-06, 'learning_rate_yyx': 0.007764676186580907}. Best is trial 0 with value: -1.8516305051550026.
[I 2026-03-18 22:42:09,992] Trial 71 finished with value: -1.8485146916467188 and parameters: {'n_layers_yyx': 2, 'hidden_size_yyx_l0': 2, 'hidden_size_yyx_l1': 6, 'context_size_yyx': 4, 'num_mix_components_yyx': 4, 'context_extractor_yyx': 'lstm', 'activation_func_yyx': 'ReLU', 'L2_weight_yyx': 2.933721808892642e-09, 'L_entropy_weight_yyx': 0.00031991495576325454, 'L_sep_weight_yyx': 4.975950133772433e-07, 'L_scale_weight_yyx': 8.063474440274007e-07, 'learning_rate_yyx': 0.007043156612421289}. Best is trial 60 with value: -1.8490650754743791.
[I 2026-03-18 22:42:11,079] Trial 76 pruned. 
[I 2026-03-18 22:42:15,950] Trial 77 pruned. 
[I 2026-03-18 22:42:18,427] Trial 42 finished with value: -1.8592291162481591 and parameters: {'n_layers_yyx': 1, 'hidden_size_yyx_l0': 4, 'context_size_yyx': 4, 'num_mix_components_yyx': 4, 'context_extractor_yyx': 'lstm', 'activation_func_yyx': 'Tanh', 'L2_weight_yyx': 1.2457688600978112e-10, 'L_entropy_weight_yyx': 0.00021840624236272313, 'L_sep_weight_yyx': 6.057206746982052e-10, 'L_scale_weight_yyx': 1.5710139903999624e-09, 'learning_rate_yyx': 0.009800613077454794}. Best is trial 40 with value: -1.861402018567546.
