[I 2026-03-18 22:24:37,045] Trial 62 finished with value: -1.4500626314603366 and parameters: {'n_layers_yyx': 1, 'hidden_size_yyx_l0': 4, 'context_size_yyx': 4, 'num_mix_components_yyx': 5, 'context_extractor_yyx': 'gru', 'activation_func_yyx': 'Tanh', 'L2_weight_yyx': 2.5237911472496715e-06, 'L_entropy_weight_yyx': 9.460262206637412e-06, 'L_sep_weight_yyx': 9.18651081093201e-09, 'L_scale_weight_yyx': 3.276861496498392e-09, 'learning_rate_yyx': 0.008855633975823363}. Best is trial 29 with value: -1.4683670278695913.
[I 2026-03-18 22:24:37,874] Trial 81 pruned. 
[I 2026-03-18 22:24:38,409] Trial 67 pruned. 
[I 2026-03-18 22:24:38,751] Trial 61 pruned. 
[I 2026-03-18 22:24:38,885] Trial 78 pruned. 
[I 2026-03-18 22:24:39,094] Trial 71 finished with value: -1.390860431599167 and parameters: {'n_layers_yyx': 2, 'hidden_size_yyx_l0': 6, 'hidden_size_yyx_l1': 5, 'context_size_yyx': 4, 'num_mix_components_yyx': 3, 'context_extractor_yyx': 'gru', 'activation_func_yyx': 'ReLU', 'L2_weight_yyx': 3.069164262867661e-05, 'L_entropy_weight_yyx': 2.1815038762041925e-08, 'L_sep_weight_yyx': 1.6586440760052932e-06, 'L_scale_weight_yyx': 0.000372436459565574, 'learning_rate_yyx': 0.007388886336436181}. Best is trial 24 with value: -1.4518791534615763.
[I 2026-03-18 22:24:39,497] Trial 55 pruned. 
[I 2026-03-18 22:24:41,641] Trial 68 pruned. 
[I 2026-03-18 22:24:45,901] Trial 62 pruned. 
[I 2026-03-18 22:24:46,021] Trial 79 pruned. 
[I 2026-03-18 22:24:47,229] Trial 56 pruned. 
[I 2026-03-18 22:24:47,485] Trial 67 finished with value: -1.5340940129290273 and parameters: {'n_layers_yyx': 2, 'hidden_size_yyx_l0': 5, 'hidden_size_yyx_l1': 6, 'context_size_yyx': 2, 'num_mix_components_yyx': 5, 'context_extractor_yyx': 'gru', 'activation_func_yyx': 'Tanh', 'L2_weight_yyx': 1.679330391087365e-05, 'L_entropy_weight_yyx': 2.300072537705067e-10, 'L_sep_weight_yyx': 9.399621845994737e-06, 'L_scale_weight_yyx': 3.141167846588335e-06, 'learning_rate_yyx': 0.007858673064588295}. Best is trial 26 with value: -1.584650032885134.
[I 2026-03-18 22:24:48,413] Trial 59 finished with value: -1.4591312349759615 and parameters: {'n_layers_yyx': 2, 'hidden_size_yyx_l0': 3, 'hidden_size_yyx_l1': 6, 'context_size_yyx': 1, 'num_mix_components_yyx': 3, 'context_extractor_yyx': 'lstm', 'activation_func_yyx': 'Tanh', 'L2_weight_yyx': 3.28394704840637e-06, 'L_entropy_weight_yyx': 8.618387268196874e-07, 'L_sep_weight_yyx': 1.8430404890394347e-08, 'L_scale_weight_yyx': 2.1237358441796776e-10, 'learning_rate_yyx': 0.008057696535377969}. Best is trial 32 with value: -1.4612882173978365.
[I 2026-03-18 22:24:53,710] Trial 82 pruned. 
[I 2026-03-18 22:24:57,320] Trial 83 pruned. 
[I 2026-03-18 22:24:57,435] Trial 68 finished with value: -1.447804941030649 and parameters: {'n_layers_yyx': 1, 'hidden_size_yyx_l0': 4, 'context_size_yyx': 3, 'num_mix_components_yyx': 3, 'context_extractor_yyx': 'lstm', 'activation_func_yyx': 'Tanh', 'L2_weight_yyx': 4.935001206297759e-05, 'L_entropy_weight_yyx': 9.222169737813096e-05, 'L_sep_weight_yyx': 9.117216313893204e-08, 'L_scale_weight_yyx': 1.1294779442851032e-08, 'learning_rate_yyx': 0.00779441696557363}. Best is trial 7 with value: -1.4538350266676683.
[I 2026-03-18 22:24:57,668] Trial 57 finished with value: -1.331038536658654 and parameters: {'n_layers_yyx': 1, 'hidden_size_yyx_l0': 5, 'context_size_yyx': 4, 'num_mix_components_yyx': 1, 'context_extractor_yyx': 'lstm', 'activation_func_yyx': 'Tanh', 'L2_weight_yyx': 2.615867947761867e-08, 'L_entropy_weight_yyx': 0.0007990406601590338, 'L_sep_weight_yyx': 1.4754332692376584e-06, 'L_scale_weight_yyx': 1.4193353838506374e-07, 'learning_rate_yyx': 0.0014347575540617484}. Best is trial 12 with value: -1.460441659780649.
[I 2026-03-18 22:24:58,650] Trial 69 pruned. 
[I 2026-03-18 22:25:01,847] Trial 58 pruned. 
[I 2026-03-18 22:25:04,418] Trial 68 pruned. 
[I 2026-03-18 22:25:04,814] Trial 69 pruned. 
[I 2026-03-18 22:25:05,318] Trial 60 pruned. 
[I 2026-03-18 22:25:07,502] Trial 72 finished with value: -1.386278860224118 and parameters: {'n_layers_yyx': 2, 'hidden_size_yyx_l0': 6, 'hidden_size_yyx_l1': 5, 'context_size_yyx': 4, 'num_mix_components_yyx': 3, 'context_extractor_yyx': 'gru', 'activation_func_yyx': 'ReLU', 'L2_weight_yyx': 6.35534850050001e-05, 'L_entropy_weight_yyx': 5.558055547965685e-07, 'L_sep_weight_yyx': 1.7028744286231456e-06, 'L_scale_weight_yyx': 0.0006171034745135587, 'learning_rate_yyx': 0.008060106081817016}. Best is trial 24 with value: -1.4518791534615763.
[I 2026-03-18 22:25:08,429] Trial 63 finished with value: -1.4483954326923076 and parameters: {'n_layers_yyx': 1, 'hidden_size_yyx_l0': 4, 'context_size_yyx': 4, 'num_mix_components_yyx': 5, 'context_extractor_yyx': 'gru', 'activation_func_yyx': 'Tanh', 'L2_weight_yyx': 1.0026567758903347e-06, 'L_entropy_weight_yyx': 3.7890471463402814e-05, 'L_sep_weight_yyx': 3.187917796449213e-09, 'L_scale_weight_yyx': 4.6528512215321905e-09, 'learning_rate_yyx': 0.007778389239788527}. Best is trial 29 with value: -1.4683670278695913.
[I 2026-03-18 22:25:08,524] Trial 61 pruned. 
[I 2026-03-18 22:25:08,626] Trial 61 pruned. 
[I 2026-03-18 22:25:11,066] Trial 42 pruned. 
[I 2026-03-18 22:25:11,852] Trial 80 finished with value: -1.4473619666466346 and parameters: {'n_layers_yyx': 2, 'hidden_size_yyx_l0': 5, 'hidden_size_yyx_l1': 5, 'context_size_yyx': 3, 'num_mix_components_yyx': 4, 'context_extractor_yyx': 'lstm', 'activation_func_yyx': 'Tanh', 'L2_weight_yyx': 0.0001322491514687769, 'L_entropy_weight_yyx': 1.8987821635361985e-06, 'L_sep_weight_yyx': 1.3222472750056857e-07, 'L_scale_weight_yyx': 6.619519646868434e-05, 'learning_rate_yyx': 0.00765792042788249}. Best is trial 32 with value: -1.4672450138972355.
[I 2026-03-18 22:25:12,257] Trial 70 pruned. 
[I 2026-03-18 22:25:13,761] Trial 63 finished with value: -1.4433802678034855 and parameters: {'n_layers_yyx': 1, 'hidden_size_yyx_l0': 5, 'context_size_yyx': 4, 'num_mix_components_yyx': 4, 'context_extractor_yyx': 'lstm', 'activation_func_yyx': 'Tanh', 'L2_weight_yyx': 5.1698029750160165e-09, 'L_entropy_weight_yyx': 4.110754421770406e-09, 'L_sep_weight_yyx': 0.00032184952681742944, 'L_scale_weight_yyx': 2.5126310312148434e-05, 'learning_rate_yyx': 0.008496130055106703}. Best is trial 49 with value: -1.4726762272761418.
[I 2026-03-18 22:25:14,098] Trial 84 pruned. 
[I 2026-03-18 22:25:14,562] Trial 43 pruned. 
[I 2026-03-18 22:25:14,778] Trial 63 finished with value: -1.4364236215444712 and parameters: {'n_layers_yyx': 2, 'hidden_size_yyx_l0': 3, 'hidden_size_yyx_l1': 4, 'context_size_yyx': 2, 'num_mix_components_yyx': 4, 'context_extractor_yyx': 'lstm', 'activation_func_yyx': 'Tanh', 'L2_weight_yyx': 1.1020063098738197e-09, 'L_entropy_weight_yyx': 1.3354481455989212e-09, 'L_sep_weight_yyx': 0.00011572009339377023, 'L_scale_weight_yyx': 1.4765529319180474e-08, 'learning_rate_yyx': 0.005589654252913116}. Best is trial 19 with value: -1.4628589806189904.
[I 2026-03-18 22:25:14,797] Trial 70 pruned. 
[I 2026-03-18 22:25:15,582] Trial 81 pruned. 
[I 2026-03-18 22:25:15,873] Trial 71 pruned. 
[I 2026-03-18 22:25:21,012] Trial 64 pruned. 
[I 2026-03-18 22:25:21,064] Trial 85 pruned. 
[I 2026-03-18 22:25:21,613] Trial 71 pruned. 
[I 2026-03-18 22:25:23,504] Trial 72 pruned. 
[I 2026-03-18 22:25:25,173] Trial 62 pruned. 
[I 2026-03-18 22:25:25,235] Trial 65 pruned. 
[I 2026-03-18 22:25:27,211] Trial 73 pruned. 
[I 2026-03-18 22:25:28,071] Trial 36 finished with value: -2.4904948477568163 and parameters: {'n_layers_yyx': 2, 'hidden_size_yyx_l0': 5, 'hidden_size_yyx_l1': 4, 'context_size_yyx': 3, 'num_mix_components_yyx': 4, 'context_extractor_yyx': 'gru', 'activation_func_yyx': 'Tanh', 'L2_weight_yyx': 1.171463671034521e-10, 'L_entropy_weight_yyx': 3.4446549683483134e-05, 'L_sep_weight_yyx': 3.901786259082818e-09, 'L_scale_weight_yyx': 1.9646584235140777e-08, 'learning_rate_yyx': 0.009964841470700224}. Best is trial 35 with value: -2.497237209565205.
[I 2026-03-18 22:25:28,257] Trial 86 pruned. 
[I 2026-03-18 22:25:29,964] Trial 32 finished with value: -2.475194051078045 and parameters: {'n_layers_yyx': 1, 'hidden_size_yyx_l0': 4, 'context_size_yyx': 4, 'num_mix_components_yyx': 2, 'context_extractor_yyx': 'gru', 'activation_func_yyx': 'ReLU', 'L2_weight_yyx': 6.533543127386357e-06, 'L_entropy_weight_yyx': 6.883073399649505e-07, 'L_sep_weight_yyx': 1.0956972633225578e-06, 'L_scale_weight_yyx': 3.8812212349634586e-08, 'learning_rate_yyx': 0.009191834068503636}. Best is trial 32 with value: -2.475194051078045.
[I 2026-03-18 22:25:32,452] Trial 66 pruned. 
[I 2026-03-18 22:25:32,508] Trial 57 finished with value: -2.455849079114819 and parameters: {'n_layers_yyx': 1, 'hidden_size_yyx_l0': 6, 'context_size_yyx': 3, 'num_mix_components_yyx': 4, 'context_extractor_yyx': 'gru', 'activation_func_yyx': 'ReLU', 'L2_weight_yyx': 0.0003615238263349114, 'L_entropy_weight_yyx': 3.0141790809129855e-07, 'L_sep_weight_yyx': 3.477319726530543e-05, 'L_scale_weight_yyx': 9.631840273432298e-08, 'learning_rate_yyx': 0.00783289417974242}. Best is trial 46 with value: -2.4875562296733595.
[I 2026-03-18 22:25:32,564] Trial 69 finished with value: -1.5667817329596794 and parameters: {'n_layers_yyx': 2, 'hidden_size_yyx_l0': 5, 'hidden_size_yyx_l1': 5, 'context_size_yyx': 2, 'num_mix_components_yyx': 5, 'context_extractor_yyx': 'gru', 'activation_func_yyx': 'Tanh', 'L2_weight_yyx': 2.368286138557689e-06, 'L_entropy_weight_yyx': 1.2532305069619685e-10, 'L_sep_weight_yyx': 1.695126666687702e-05, 'L_scale_weight_yyx': 8.696294980597478e-06, 'learning_rate_yyx': 0.008752660390254071}. Best is trial 26 with value: -1.584650032885134.
[I 2026-03-18 22:25:33,428] Trial 59 finished with value: -1.4467008385291467 and parameters: {'n_layers_yyx': 1, 'hidden_size_yyx_l0': 6, 'context_size_yyx': 3, 'num_mix_components_yyx': 5, 'context_extractor_yyx': 'gru', 'activation_func_yyx': 'Tanh', 'L2_weight_yyx': 3.3460554844319945e-09, 'L_entropy_weight_yyx': 1.0065965626539574e-07, 'L_sep_weight_yyx': 5.007846893710688e-07, 'L_scale_weight_yyx': 8.775779861467175e-07, 'learning_rate_yyx': 0.007618454373101976}. Best is trial 12 with value: -1.460441659780649.
[I 2026-03-18 22:25:34,228] Trial 74 pruned. 
[I 2026-03-18 22:25:35,385] Trial 73 finished with value: -1.382231370458063 and parameters: {'n_layers_yyx': 2, 'hidden_size_yyx_l0': 6, 'hidden_size_yyx_l1': 5, 'context_size_yyx': 4, 'num_mix_components_yyx': 3, 'context_extractor_yyx': 'gru', 'activation_func_yyx': 'ReLU', 'L2_weight_yyx': 3.181391522583252e-05, 'L_entropy_weight_yyx': 1.0282517133947865e-07, 'L_sep_weight_yyx': 1.09549757017633e-06, 'L_scale_weight_yyx': 0.0003446324629052854, 'learning_rate_yyx': 0.007662772912339204}. Best is trial 24 with value: -1.4518791534615763.
[I 2026-03-18 22:25:37,144] Trial 60 pruned. 
[I 2026-03-18 22:25:38,134] Trial 72 pruned. 
[I 2026-03-18 22:25:40,003] Trial 58 pruned. 
[I 2026-03-18 22:25:40,871] Trial 61 pruned. 
[I 2026-03-18 22:25:41,408] Trial 75 pruned. 
[I 2026-03-18 22:25:41,687] Trial 64 finished with value: -1.4545999849759614 and parameters: {'n_layers_yyx': 1, 'hidden_size_yyx_l0': 4, 'context_size_yyx': 4, 'num_mix_components_yyx': 5, 'context_extractor_yyx': 'gru', 'activation_func_yyx': 'Tanh', 'L2_weight_yyx': 6.3449923803968384e-06, 'L_entropy_weight_yyx': 7.294716186975765e-08, 'L_sep_weight_yyx': 6.447964636079395e-08, 'L_scale_weight_yyx': 1.0587196726270606e-10, 'learning_rate_yyx': 0.0066957570592182086}. Best is trial 29 with value: -1.4683670278695913.
[I 2026-03-18 22:25:44,622] Trial 37 pruned. 
[I 2026-03-18 22:25:44,625] Trial 44 finished with value: -1.2958448204627404 and parameters: {'n_layers_yyx': 2, 'hidden_size_yyx_l0': 2, 'hidden_size_yyx_l1': 5, 'context_size_yyx': 4, 'num_mix_components_yyx': 1, 'context_extractor_yyx': 'gru', 'activation_func_yyx': 'Tanh', 'L2_weight_yyx': 1.5174311566062759e-05, 'L_entropy_weight_yyx': 6.373816823378495e-05, 'L_sep_weight_yyx': 5.549197915488784e-06, 'L_scale_weight_yyx': 2.1342475856927312e-07, 'learning_rate_yyx': 0.006671261059762298}. Best is trial 13 with value: -1.4421805044320914.
[I 2026-03-18 22:25:47,860] Trial 59 pruned. 
[I 2026-03-18 22:25:48,386] Trial 76 pruned. 
[I 2026-03-18 22:25:51,471] Trial 82 finished with value: -1.4536221548227164 and parameters: {'n_layers_yyx': 2, 'hidden_size_yyx_l0': 6, 'hidden_size_yyx_l1': 5, 'context_size_yyx': 3, 'num_mix_components_yyx': 4, 'context_extractor_yyx': 'lstm', 'activation_func_yyx': 'Tanh', 'L2_weight_yyx': 9.327457113417711e-08, 'L_entropy_weight_yyx': 1.4623581909454314e-08, 'L_sep_weight_yyx': 6.173300504471668e-05, 'L_scale_weight_yyx': 3.598270231080702e-08, 'learning_rate_yyx': 0.009679781099012448}. Best is trial 32 with value: -1.4672450138972355.
[I 2026-03-18 22:25:51,984] Trial 38 pruned. 
[I 2026-03-18 22:25:52,025] Trial 74 pruned. 
[I 2026-03-18 22:25:54,507] Trial 64 finished with value: -1.4476447941706732 and parameters: {'n_layers_yyx': 2, 'hidden_size_yyx_l0': 3, 'hidden_size_yyx_l1': 4, 'context_size_yyx': 2, 'num_mix_components_yyx': 4, 'context_extractor_yyx': 'lstm', 'activation_func_yyx': 'Tanh', 'L2_weight_yyx': 1.5853950547337898e-09, 'L_entropy_weight_yyx': 8.380185014500698e-09, 'L_sep_weight_yyx': 0.0004042222685177659, 'L_scale_weight_yyx': 3.8219622223076006e-08, 'learning_rate_yyx': 0.007899371524273642}. Best is trial 19 with value: -1.4628589806189904.
[I 2026-03-18 22:25:55,230] Trial 70 finished with value: -1.5625680536562014 and parameters: {'n_layers_yyx': 2, 'hidden_size_yyx_l0': 6, 'hidden_size_yyx_l1': 6, 'context_size_yyx': 3, 'num_mix_components_yyx': 5, 'context_extractor_yyx': 'gru', 'activation_func_yyx': 'Tanh', 'L2_weight_yyx': 1.4219635548518515e-05, 'L_entropy_weight_yyx': 2.715444818205285e-10, 'L_sep_weight_yyx': 2.7653011548147876e-05, 'L_scale_weight_yyx': 1.0848234753886084e-05, 'learning_rate_yyx': 0.0061674472225244975}. Best is trial 26 with value: -1.584650032885134.
[I 2026-03-18 22:25:58,313] Trial 62 pruned. 
[I 2026-03-18 22:25:59,371] Trial 39 pruned. 
[I 2026-03-18 22:26:00,722] Trial 62 finished with value: -2.475346086817453 and parameters: {'n_layers_yyx': 2, 'hidden_size_yyx_l0': 6, 'hidden_size_yyx_l1': 6, 'context_size_yyx': 4, 'num_mix_components_yyx': 3, 'context_extractor_yyx': 'gru', 'activation_func_yyx': 'ReLU', 'L2_weight_yyx': 9.247976611951107e-09, 'L_entropy_weight_yyx': 1.5260754555136676e-06, 'L_sep_weight_yyx': 1.0939897587251224e-10, 'L_scale_weight_yyx': 0.00028129439429844374, 'learning_rate_yyx': 0.008757719102310497}. Best is trial 25 with value: -2.4764732316599813.
[I 2026-03-18 22:26:01,481] Trial 65 pruned. 
[I 2026-03-18 22:26:01,641] Trial 71 pruned. 
[I 2026-03-18 22:26:02,081] Trial 63 pruned. 
[I 2026-03-18 22:26:04,472] Trial 60 pruned. 
[I 2026-03-18 22:26:05,350] Trial 77 pruned. 
[I 2026-03-18 22:26:06,577] Trial 73 finished with value: -1.4402182241586539 and parameters: {'n_layers_yyx': 2, 'hidden_size_yyx_l0': 6, 'hidden_size_yyx_l1': 5, 'context_size_yyx': 2, 'num_mix_components_yyx': 3, 'context_extractor_yyx': 'lstm', 'activation_func_yyx': 'ReLU', 'L2_weight_yyx': 3.6218267525343192e-06, 'L_entropy_weight_yyx': 0.00015641756794457522, 'L_sep_weight_yyx': 5.0948750808335325e-06, 'L_scale_weight_yyx': 0.0002742877529558458, 'learning_rate_yyx': 0.009454508215600108}. Best is trial 27 with value: -1.4597027822641226.
[I 2026-03-18 22:26:08,741] Trial 75 pruned. 
[I 2026-03-18 22:26:09,128] Trial 78 pruned. 
[I 2026-03-18 22:26:14,165] Trial 63 finished with value: -1.4621721942608172 and parameters: {'n_layers_yyx': 2, 'hidden_size_yyx_l0': 3, 'hidden_size_yyx_l1': 4, 'context_size_yyx': 1, 'num_mix_components_yyx': 3, 'context_extractor_yyx': 'lstm', 'activation_func_yyx': 'Tanh', 'L2_weight_yyx': 2.659536077199592e-05, 'L_entropy_weight_yyx': 1.8650552805265497e-06, 'L_sep_weight_yyx': 1.0729225545422669e-07, 'L_scale_weight_yyx': 7.737847539994642e-10, 'learning_rate_yyx': 0.005707177079355613}. Best is trial 63 with value: -1.4621721942608172.
[I 2026-03-18 22:26:15,552] Trial 45 finished with value: -1.4586368032602164 and parameters: {'n_layers_yyx': 2, 'hidden_size_yyx_l0': 3, 'hidden_size_yyx_l1': 6, 'context_size_yyx': 4, 'num_mix_components_yyx': 2, 'context_extractor_yyx': 'gru', 'activation_func_yyx': 'Tanh', 'L2_weight_yyx': 0.00043696708366065004, 'L_entropy_weight_yyx': 0.00017864246392463123, 'L_sep_weight_yyx': 0.00013886467534313533, 'L_scale_weight_yyx': 1.0394391577841792e-07, 'learning_rate_yyx': 0.008271907645567352}. Best is trial 45 with value: -1.4586368032602164.
[I 2026-03-18 22:26:16,809] Trial 65 finished with value: -1.45673093355619 and parameters: {'n_layers_yyx': 1, 'hidden_size_yyx_l0': 4, 'context_size_yyx': 4, 'num_mix_components_yyx': 5, 'context_extractor_yyx': 'gru', 'activation_func_yyx': 'Tanh', 'L2_weight_yyx': 5.1296902218929976e-05, 'L_entropy_weight_yyx': 9.444549885333757e-09, 'L_sep_weight_yyx': 1.9139563610308323e-08, 'L_scale_weight_yyx': 1.6387427371990582e-09, 'learning_rate_yyx': 0.009021456708242958}. Best is trial 29 with value: -1.4683670278695913.
[I 2026-03-18 22:26:16,847] Trial 79 pruned. 
[I 2026-03-18 22:26:19,056] Trial 64 pruned. 
[I 2026-03-18 22:26:20,839] Trial 80 pruned. 
[I 2026-03-18 22:26:21,392] Trial 64 pruned. 
[I 2026-03-18 22:26:21,973] Trial 87 finished with value: -1.5267760855252626 and parameters: {'n_layers_yyx': 1, 'hidden_size_yyx_l0': 4, 'context_size_yyx': 3, 'num_mix_components_yyx': 2, 'context_extractor_yyx': 'lstm', 'activation_func_yyx': 'Tanh', 'L2_weight_yyx': 2.223227867171566e-06, 'L_entropy_weight_yyx': 7.709777911298564e-07, 'L_sep_weight_yyx': 9.010545079062925e-05, 'L_scale_weight_yyx': 1.7260910304367882e-09, 'learning_rate_yyx': 0.009290291486461464}. Best is trial 67 with value: -1.5294848582783684.
[I 2026-03-18 22:26:22,325] Trial 61 pruned. 
[I 2026-03-18 22:26:22,862] Trial 65 pruned. 
[I 2026-03-18 22:26:23,502] Trial 66 pruned. 
[I 2026-03-18 22:26:25,924] Trial 76 pruned. 
[I 2026-03-18 22:26:26,699] Trial 66 pruned. 
[I 2026-03-18 22:26:27,503] Trial 67 finished with value: -1.4163655677208533 and parameters: {'n_layers_yyx': 2, 'hidden_size_yyx_l0': 5, 'hidden_size_yyx_l1': 2, 'context_size_yyx': 4, 'num_mix_components_yyx': 4, 'context_extractor_yyx': 'lstm', 'activation_func_yyx': 'Tanh', 'L2_weight_yyx': 1.1588740976155144e-09, 'L_entropy_weight_yyx': 4.814709798258245e-10, 'L_sep_weight_yyx': 5.930381884087793e-05, 'L_scale_weight_yyx': 0.0005830141920948162, 'learning_rate_yyx': 0.0036081844320040254}. Best is trial 49 with value: -1.4726762272761418.
[I 2026-03-18 22:26:27,966] Trial 81 pruned. 
[I 2026-03-18 22:26:28,011] Trial 83 finished with value: -1.4437777005709134 and parameters: {'n_layers_yyx': 2, 'hidden_size_yyx_l0': 6, 'hidden_size_yyx_l1': 5, 'context_size_yyx': 3, 'num_mix_components_yyx': 4, 'context_extractor_yyx': 'lstm', 'activation_func_yyx': 'Tanh', 'L2_weight_yyx': 3.2009806147371654e-08, 'L_entropy_weight_yyx': 1.840224538560425e-08, 'L_sep_weight_yyx': 0.00021628853166851284, 'L_scale_weight_yyx': 1.1013878953573015e-08, 'learning_rate_yyx': 0.008528210393654563}. Best is trial 32 with value: -1.4672450138972355.
[I 2026-03-18 22:26:28,765] Trial 65 pruned. 
[I 2026-03-18 22:26:29,033] Trial 77 pruned. 
[I 2026-03-18 22:26:31,250] Trial 72 finished with value: -1.5875397135778677 and parameters: {'n_layers_yyx': 2, 'hidden_size_yyx_l0': 5, 'hidden_size_yyx_l1': 5, 'context_size_yyx': 2, 'num_mix_components_yyx': 5, 'context_extractor_yyx': 'gru', 'activation_func_yyx': 'Tanh', 'L2_weight_yyx': 4.3210974636772724e-05, 'L_entropy_weight_yyx': 1.4755310377902814e-10, 'L_sep_weight_yyx': 5.804075766810146e-07, 'L_scale_weight_yyx': 2.7094240971714994e-07, 'learning_rate_yyx': 0.008396852641163343}. Best is trial 72 with value: -1.5875397135778677.
[I 2026-03-18 22:26:32,573] Trial 66 pruned. 
[I 2026-03-18 22:26:32,994] Trial 46 pruned. 
[I 2026-03-18 22:26:33,594] Trial 67 pruned. 

Source events: 3403
Target events: 31112
Full model ln_yyx : 313.85533 nats/sec, 9.07913 nats/event
Full model Log loss : -1.45366
Full model ln_yyx : 312.41402 nats/sec, 9.03743 nats/event
Full model Log loss : -1.44373
Full model ln_yyx : 311.04087 nats/sec, 8.99771 nats/event
Full model Log loss : -1.43835
Full model ln_yyx : 309.14162 nats/sec, 8.94277 nats/event
Full model Log loss : -1.41146
Full model ln_yyx : 313.61622 nats/sec, 9.07221 nats/event
Full model Log loss : -1.44947
Full model ln_yyx : 315.18442 nats/sec, 9.11757 nats/event
Full model Log loss : -1.44745
Full model ln_yyx : 298.34081 nats/sec, 8.63033 nats/event
Full model Log loss : -1.33104
Full model ln_yyx : 309.08703 nats/sec, 8.94119 nats/event
Full model Log loss : -1.44670
Optimization finished. Config saved to results/opt-full/opt_full_240_best_config.txt
[I 2026-03-18 22:26:35,271] Trial 68 pruned. 
[I 2026-03-18 22:26:37,916] Trial 74 finished with value: -1.4512747896634615 and parameters: {'n_layers_yyx': 2, 'hidden_size_yyx_l0': 6, 'hidden_size_yyx_l1': 4, 'context_size_yyx': 2, 'num_mix_components_yyx': 3, 'context_extractor_yyx': 'lstm', 'activation_func_yyx': 'ReLU', 'L2_weight_yyx': 1.8099613482758357e-06, 'L_entropy_weight_yyx': 0.0004917029583275841, 'L_sep_weight_yyx': 5.421165216227539e-07, 'L_scale_weight_yyx': 0.000342999888124138, 'learning_rate_yyx': 0.006887235264675632}. Best is trial 27 with value: -1.4597027822641226.
[I 2026-03-18 22:26:38,586] Trial 66 finished with value: -1.4471868661733773 and parameters: {'n_layers_yyx': 2, 'hidden_size_yyx_l0': 3, 'hidden_size_yyx_l1': 4, 'context_size_yyx': 2, 'num_mix_components_yyx': 4, 'context_extractor_yyx': 'lstm', 'activation_func_yyx': 'Tanh', 'L2_weight_yyx': 3.3214626090201513e-09, 'L_entropy_weight_yyx': 1.2963992624407371e-06, 'L_sep_weight_yyx': 0.00028395454568599904, 'L_scale_weight_yyx': 4.0206606198609246e-08, 'learning_rate_yyx': 0.009017545545387928}. Best is trial 19 with value: -1.4628589806189904.
[I 2026-03-18 22:26:39,574] Trial 88 pruned. 
