[I 2026-03-18 19:55:45,030] Trial 20 finished with value: -2.0612839941220296 and parameters: {'n_layers_yyx': 1, 'hidden_size_yyx_l0': 3, 'context_size_yyx': 3, 'num_mix_components_yyx': 3, 'context_extractor_yyx': 'lstm', 'activation_func_yyx': 'GELU', 'L2_weight_yyx': 1.8511865674008599e-09, 'L_entropy_weight_yyx': 1.545826424886232e-10, 'L_sep_weight_yyx': 9.638911849811392e-07, 'L_scale_weight_yyx': 1.0900640624009114e-05, 'learning_rate_yyx': 0.008041237373409218}. Best is trial 1 with value: -2.0819965339546846.
[I 2026-03-18 19:55:46,439] Trial 31 finished with value: -2.0582502854357867 and parameters: {'n_layers_yyx': 2, 'hidden_size_yyx_l0': 2, 'hidden_size_yyx_l1': 5, 'context_size_yyx': 2, 'num_mix_components_yyx': 3, 'context_extractor_yyx': 'lstm', 'activation_func_yyx': 'GELU', 'L2_weight_yyx': 4.056044341408068e-09, 'L_entropy_weight_yyx': 1.8277043784279733e-09, 'L_sep_weight_yyx': 6.401535994028843e-05, 'L_scale_weight_yyx': 8.714582056579318e-05, 'learning_rate_yyx': 0.006187928971192693}. Best is trial 2 with value: -2.059868681386501.
[I 2026-03-18 19:55:46,738] Trial 29 pruned. 
[I 2026-03-18 19:55:46,969] Trial 31 pruned. 
[I 2026-03-18 19:55:50,173] Trial 35 finished with value: -1.596134768109559 and parameters: {'n_layers_yyx': 2, 'hidden_size_yyx_l0': 6, 'hidden_size_yyx_l1': 5, 'context_size_yyx': 3, 'num_mix_components_yyx': 3, 'context_extractor_yyx': 'gru', 'activation_func_yyx': 'ReLU', 'L2_weight_yyx': 0.00012053986752985723, 'L_entropy_weight_yyx': 1.1566582633752887e-07, 'L_sep_weight_yyx': 8.306065337789368e-10, 'L_scale_weight_yyx': 6.59419476837218e-10, 'learning_rate_yyx': 0.008220214056741663}. Best is trial 7 with value: -1.6077896387869492.
[I 2026-03-18 19:55:50,390] Trial 13 pruned. 
[I 2026-03-18 19:55:51,496] Trial 22 finished with value: -2.0815283582745923 and parameters: {'n_layers_yyx': 1, 'hidden_size_yyx_l0': 6, 'context_size_yyx': 4, 'num_mix_components_yyx': 5, 'context_extractor_yyx': 'lstm', 'activation_func_yyx': 'ReLU', 'L2_weight_yyx': 1.5633014828639068e-09, 'L_entropy_weight_yyx': 7.247781605666399e-09, 'L_sep_weight_yyx': 1.527477213325898e-05, 'L_scale_weight_yyx': 0.0002228422550530162, 'learning_rate_yyx': 0.00722683139920571}. Best is trial 13 with value: -2.092152629106611.
[I 2026-03-18 19:55:52,669] Trial 32 pruned. 
[I 2026-03-18 19:55:52,925] Trial 30 pruned. 
[I 2026-03-18 19:55:53,507] Trial 18 pruned. 
[I 2026-03-18 19:55:54,631] Trial 23 finished with value: -1.6040246267221197 and parameters: {'n_layers_yyx': 1, 'hidden_size_yyx_l0': 6, 'context_size_yyx': 1, 'num_mix_components_yyx': 2, 'context_extractor_yyx': 'gru', 'activation_func_yyx': 'GELU', 'L2_weight_yyx': 5.959869638631345e-08, 'L_entropy_weight_yyx': 1.1701261395547143e-10, 'L_sep_weight_yyx': 8.647786646400697e-10, 'L_scale_weight_yyx': 2.008076763314648e-09, 'learning_rate_yyx': 0.002101411167372742}. Best is trial 1 with value: -1.6113757535901372.
[I 2026-03-18 19:55:55,818] Trial 19 pruned. 
[I 2026-03-18 19:55:56,593] Trial 36 pruned. 
[I 2026-03-18 19:55:56,595] Trial 15 finished with value: -2.1220150931106305 and parameters: {'n_layers_yyx': 1, 'hidden_size_yyx_l0': 4, 'context_size_yyx': 2, 'num_mix_components_yyx': 5, 'context_extractor_yyx': 'gru', 'activation_func_yyx': 'Tanh', 'L2_weight_yyx': 2.1711865848817722e-05, 'L_entropy_weight_yyx': 5.382502530450802e-05, 'L_sep_weight_yyx': 2.0470819009782043e-08, 'L_scale_weight_yyx': 0.0005664379329401989, 'learning_rate_yyx': 0.009835517774520044}. Best is trial 10 with value: -2.123509279126982.
[I 2026-03-18 19:55:58,840] Trial 24 pruned. 
[I 2026-03-18 19:55:59,283] Trial 31 pruned. 
[I 2026-03-18 19:56:00,379] Trial 19 pruned. 
[I 2026-03-18 19:56:01,756] Trial 36 pruned. 
[I 2026-03-18 19:56:06,026] Trial 33 pruned. 
[I 2026-03-18 19:56:07,580] Trial 37 pruned. 
[I 2026-03-18 19:56:07,610] Trial 20 pruned. 
[I 2026-03-18 19:56:07,680] Trial 24 pruned. 
[I 2026-03-18 19:56:11,071] Trial 16 pruned. 
[I 2026-03-18 19:56:12,307] Trial 25 pruned. 
[I 2026-03-18 19:56:12,703] Trial 32 pruned. 
[I 2026-03-18 19:56:13,894] Trial 25 pruned. 
[I 2026-03-18 19:56:15,444] Trial 22 pruned. 
[I 2026-03-18 19:56:17,878] Trial 21 finished with value: -1.6169303846739371 and parameters: {'n_layers_yyx': 2, 'hidden_size_yyx_l0': 6, 'hidden_size_yyx_l1': 5, 'context_size_yyx': 4, 'num_mix_components_yyx': 3, 'context_extractor_yyx': 'lstm', 'activation_func_yyx': 'Tanh', 'L2_weight_yyx': 1.206614197355089e-07, 'L_entropy_weight_yyx': 1.4565511714491456e-10, 'L_sep_weight_yyx': 7.652302167053863e-09, 'L_scale_weight_yyx': 0.00013337636067282363, 'learning_rate_yyx': 0.006079028344200393}. Best is trial 21 with value: -1.6169303846739371.
[I 2026-03-18 19:56:17,910] Trial 26 finished with value: -1.6114725766718334 and parameters: {'n_layers_yyx': 2, 'hidden_size_yyx_l0': 3, 'hidden_size_yyx_l1': 5, 'context_size_yyx': 4, 'num_mix_components_yyx': 5, 'context_extractor_yyx': 'lstm', 'activation_func_yyx': 'Tanh', 'L2_weight_yyx': 1.20315447671657e-05, 'L_entropy_weight_yyx': 2.1061355709694056e-07, 'L_sep_weight_yyx': 0.0001251061748267592, 'L_scale_weight_yyx': 1.1973573413147086e-07, 'learning_rate_yyx': 0.006888544686253124}. Best is trial 20 with value: -1.6161773654609999.
[I 2026-03-18 19:56:19,065] Trial 23 pruned. 
[I 2026-03-18 19:56:19,206] Trial 33 pruned. 
[I 2026-03-18 19:56:20,150] Trial 26 pruned. 
[I 2026-03-18 19:56:20,152] Trial 38 pruned. 
[I 2026-03-18 19:56:21,011] Trial 27 pruned. 
[I 2026-03-18 19:56:21,636] Trial 21 pruned. 
[I 2026-03-18 19:56:23,603] Trial 19 pruned. 
[I 2026-03-18 19:56:23,824] Trial 27 pruned. 
[I 2026-03-18 19:56:24,787] Trial 26 pruned. 
[I 2026-03-18 19:56:24,868] Trial 24 pruned. 
[I 2026-03-18 19:56:25,191] Trial 34 pruned. 
[I 2026-03-18 19:56:25,393] Trial 17 pruned. 
[I 2026-03-18 19:56:25,541] Trial 27 pruned. 
[I 2026-03-18 19:56:27,594] Trial 28 pruned. 
[I 2026-03-18 19:56:29,619] Trial 18 pruned. 
[I 2026-03-18 19:56:29,812] Trial 20 pruned. 
[I 2026-03-18 19:56:30,053] Trial 23 pruned. 
[I 2026-03-18 19:56:30,343] Trial 20 pruned. 
[I 2026-03-18 19:56:32,043] Trial 25 pruned. 
[I 2026-03-18 19:56:32,071] Trial 35 pruned. 
[I 2026-03-18 19:56:34,956] Trial 22 pruned. 
[I 2026-03-18 19:56:35,897] Trial 21 pruned. 
[I 2026-03-18 19:56:36,079] Trial 19 pruned. 
[I 2026-03-18 19:56:36,157] Trial 18 finished with value: -2.077424401678778 and parameters: {'n_layers_yyx': 2, 'hidden_size_yyx_l0': 2, 'hidden_size_yyx_l1': 5, 'context_size_yyx': 3, 'num_mix_components_yyx': 1, 'context_extractor_yyx': 'gru', 'activation_func_yyx': 'GELU', 'L2_weight_yyx': 3.0993695557716634e-07, 'L_entropy_weight_yyx': 4.159761287056563e-06, 'L_sep_weight_yyx': 1.5043659300952555e-09, 'L_scale_weight_yyx': 0.00012699500649250006, 'learning_rate_yyx': 0.0023634361405924014}. Best is trial 8 with value: -2.0851807543284644.
[I 2026-03-18 19:56:36,830] Trial 28 pruned. 
[I 2026-03-18 19:56:36,991] Trial 21 pruned. 
[I 2026-03-18 19:56:38,380] Trial 36 pruned. 
[I 2026-03-18 19:56:38,761] Trial 21 finished with value: -2.0697218429773656 and parameters: {'n_layers_yyx': 2, 'hidden_size_yyx_l0': 5, 'hidden_size_yyx_l1': 6, 'context_size_yyx': 4, 'num_mix_components_yyx': 3, 'context_extractor_yyx': 'lstm', 'activation_func_yyx': 'Tanh', 'L2_weight_yyx': 3.201208796694126e-08, 'L_entropy_weight_yyx': 8.652063540840875e-10, 'L_sep_weight_yyx': 6.8717680444915185e-06, 'L_scale_weight_yyx': 8.72854578894787e-06, 'learning_rate_yyx': 0.009822683690935856}. Best is trial 1 with value: -2.0819965339546846.
[I 2026-03-18 19:56:38,825] Trial 14 finished with value: -2.0936086041286655 and parameters: {'n_layers_yyx': 1, 'hidden_size_yyx_l0': 6, 'context_size_yyx': 4, 'num_mix_components_yyx': 4, 'context_extractor_yyx': 'gru', 'activation_func_yyx': 'Tanh', 'L2_weight_yyx': 3.682209713907975e-09, 'L_entropy_weight_yyx': 2.376276048698765e-09, 'L_sep_weight_yyx': 2.442889530521433e-09, 'L_scale_weight_yyx': 1.533441939859012e-10, 'learning_rate_yyx': 0.009881548475705777}. Best is trial 14 with value: -2.0936086041286655.
[I 2026-03-18 19:56:39,047] Trial 26 pruned. 
[I 2026-03-18 19:56:41,634] Trial 23 pruned. 
[I 2026-03-18 19:56:42,194] Trial 29 pruned. 
[I 2026-03-18 19:56:44,813] Trial 24 pruned. 
[I 2026-03-18 19:56:46,618] Trial 27 pruned. 
[I 2026-03-18 19:56:48,974] Trial 32 finished with value: -1.6112133259262207 and parameters: {'n_layers_yyx': 2, 'hidden_size_yyx_l0': 2, 'hidden_size_yyx_l1': 5, 'context_size_yyx': 4, 'num_mix_components_yyx': 2, 'context_extractor_yyx': 'gru', 'activation_func_yyx': 'GELU', 'L2_weight_yyx': 1.5021336754421818e-09, 'L_entropy_weight_yyx': 2.5956251388921238e-08, 'L_sep_weight_yyx': 6.97632450937177e-07, 'L_scale_weight_yyx': 0.00011667515345800088, 'learning_rate_yyx': 0.009924468275567835}. Best is trial 21 with value: -1.6119054721666712.
[I 2026-03-18 19:56:48,975] Trial 17 finished with value: -2.069708707124051 and parameters: {'n_layers_yyx': 2, 'hidden_size_yyx_l0': 3, 'hidden_size_yyx_l1': 5, 'context_size_yyx': 4, 'num_mix_components_yyx': 1, 'context_extractor_yyx': 'gru', 'activation_func_yyx': 'Tanh', 'L2_weight_yyx': 8.874837732446677e-10, 'L_entropy_weight_yyx': 1.3763556621196064e-07, 'L_sep_weight_yyx': 1.7944707342795714e-09, 'L_scale_weight_yyx': 1.3191666074149054e-05, 'learning_rate_yyx': 0.005488532453457174}. Best is trial 11 with value: -2.095012278283745.
[I 2026-03-18 19:56:49,495] Trial 29 pruned. 
[I 2026-03-18 19:56:50,918] Trial 22 pruned. 
[I 2026-03-18 19:56:51,680] Trial 19 pruned. 
[I 2026-03-18 19:56:51,681] Trial 22 pruned. 
[I 2026-03-18 19:56:53,776] Trial 22 pruned. 
[I 2026-03-18 19:56:55,577] Trial 33 pruned. 
[I 2026-03-18 19:56:55,685] Trial 24 pruned. 
[I 2026-03-18 19:56:56,900] Trial 30 pruned. 
[I 2026-03-18 19:56:57,337] Trial 37 finished with value: -1.612323960337204 and parameters: {'n_layers_yyx': 1, 'hidden_size_yyx_l0': 6, 'context_size_yyx': 4, 'num_mix_components_yyx': 5, 'context_extractor_yyx': 'lstm', 'activation_func_yyx': 'GELU', 'L2_weight_yyx': 6.051334122442776e-08, 'L_entropy_weight_yyx': 3.680731452733917e-08, 'L_sep_weight_yyx': 2.886593877708389e-10, 'L_scale_weight_yyx': 0.0002261478713284715, 'learning_rate_yyx': 0.008963085465482943}. Best is trial 26 with value: -1.6132763574564741.
[I 2026-03-18 19:56:59,710] Trial 28 pruned. 
[I 2026-03-18 19:57:01,511] Trial 28 pruned. 
[I 2026-03-18 19:57:07,960] Trial 29 pruned. 
[I 2026-03-18 19:57:08,152] Trial 23 pruned. 
[I 2026-03-18 19:57:08,560] Trial 21 pruned. 
[I 2026-03-18 19:57:09,754] Trial 38 pruned. 
[I 2026-03-18 19:57:10,131] Trial 25 pruned. 
[I 2026-03-18 19:57:12,476] Trial 29 pruned. 
[I 2026-03-18 19:57:13,416] Trial 23 finished with value: -2.08157089184097 and parameters: {'n_layers_yyx': 1, 'hidden_size_yyx_l0': 6, 'context_size_yyx': 4, 'num_mix_components_yyx': 5, 'context_extractor_yyx': 'lstm', 'activation_func_yyx': 'ReLU', 'L2_weight_yyx': 4.914538411791804e-10, 'L_entropy_weight_yyx': 9.864626949986788e-10, 'L_sep_weight_yyx': 0.0001590356911110336, 'L_scale_weight_yyx': 0.0008525275152958875, 'learning_rate_yyx': 0.0077242057449364975}. Best is trial 13 with value: -2.092152629106611.
[I 2026-03-18 19:57:14,268] Trial 30 pruned. 
[I 2026-03-18 19:57:15,056] Trial 22 pruned. 
[I 2026-03-18 19:57:16,963] Trial 26 pruned. 
[I 2026-03-18 19:57:18,859] Trial 30 pruned. 
[I 2026-03-18 19:57:19,439] Trial 24 pruned. 
[I 2026-03-18 19:57:21,852] Trial 23 pruned. 
[I 2026-03-18 19:57:22,135] Trial 39 pruned. 
[I 2026-03-18 19:57:23,317] Trial 25 pruned. 
[I 2026-03-18 19:57:30,223] Trial 26 pruned. 
[I 2026-03-18 19:57:31,188] Trial 27 pruned. 
[I 2026-03-18 19:57:31,606] Trial 31 pruned. 
[I 2026-03-18 19:57:33,708] Trial 25 pruned. 
[I 2026-03-18 19:57:35,074] Trial 24 pruned. 
[I 2026-03-18 19:57:36,406] Trial 37 finished with value: -1.6338651762779575 and parameters: {'n_layers_yyx': 2, 'hidden_size_yyx_l0': 6, 'hidden_size_yyx_l1': 5, 'context_size_yyx': 4, 'num_mix_components_yyx': 4, 'context_extractor_yyx': 'lstm', 'activation_func_yyx': 'ReLU', 'L2_weight_yyx': 2.3757499259075877e-05, 'L_entropy_weight_yyx': 1.0263199056409697e-05, 'L_sep_weight_yyx': 1.9463963692415172e-08, 'L_scale_weight_yyx': 2.474185407118353e-07, 'learning_rate_yyx': 0.0078009883751546764}. Best is trial 13 with value: -1.640321681328409.
[I 2026-03-18 19:57:37,586] Trial 28 pruned. 
[I 2026-03-18 19:57:40,543] Trial 26 pruned. 
[I 2026-03-18 19:57:42,906] Trial 27 finished with value: -1.6485523746486923 and parameters: {'n_layers_yyx': 2, 'hidden_size_yyx_l0': 4, 'hidden_size_yyx_l1': 5, 'context_size_yyx': 4, 'num_mix_components_yyx': 5, 'context_extractor_yyx': 'gru', 'activation_func_yyx': 'ReLU', 'L2_weight_yyx': 0.0001548607652612232, 'L_entropy_weight_yyx': 0.0002867400380369762, 'L_sep_weight_yyx': 5.8541083426711497e-05, 'L_scale_weight_yyx': 4.900310282317144e-05, 'learning_rate_yyx': 0.005144183253972027}. Best is trial 12 with value: -1.6531010225123595.
[I 2026-03-18 19:57:43,041] Trial 38 pruned. 
[I 2026-03-18 19:57:43,644] Trial 34 pruned. 
[I 2026-03-18 19:57:44,376] Trial 29 pruned. 
[I 2026-03-18 19:57:44,632] Trial 24 pruned. 
[I 2026-03-18 19:57:49,068] Trial 28 pruned. 
[I 2026-03-18 19:57:53,891] Trial 27 pruned. 
[I 2026-03-18 19:57:55,327] Trial 29 pruned. 
[I 2026-03-18 19:57:56,359] Trial 39 pruned. 
[I 2026-03-18 19:57:57,444] Trial 14 finished with value: -2.087390911661656 and parameters: {'n_layers_yyx': 1, 'hidden_size_yyx_l0': 5, 'context_size_yyx': 3, 'num_mix_components_yyx': 5, 'context_extractor_yyx': 'lstm', 'activation_func_yyx': 'ReLU', 'L2_weight_yyx': 2.588926253097601e-06, 'L_entropy_weight_yyx': 1.0826054214205661e-06, 'L_sep_weight_yyx': 3.420495467743814e-06, 'L_scale_weight_yyx': 6.232177129020886e-09, 'learning_rate_yyx': 0.00301720531374756}. Best is trial 14 with value: -2.087390911661656.
[I 2026-03-18 19:57:58,068] Trial 18 finished with value: -2.1129477654162 and parameters: {'n_layers_yyx': 1, 'hidden_size_yyx_l0': 6, 'context_size_yyx': 1, 'num_mix_components_yyx': 4, 'context_extractor_yyx': 'gru', 'activation_func_yyx': 'GELU', 'L2_weight_yyx': 0.0009741729996015425, 'L_entropy_weight_yyx': 5.046273295715014e-06, 'L_sep_weight_yyx': 9.601936402307283e-07, 'L_scale_weight_yyx': 0.0008829624699553458, 'learning_rate_yyx': 0.006867878281551094}. Best is trial 10 with value: -2.123509279126982.
[I 2026-03-18 19:57:58,156] Trial 39 finished with value: -1.6090295482077699 and parameters: {'n_layers_yyx': 2, 'hidden_size_yyx_l0': 5, 'hidden_size_yyx_l1': 2, 'context_size_yyx': 1, 'num_mix_components_yyx': 2, 'context_extractor_yyx': 'lstm', 'activation_func_yyx': 'Tanh', 'L2_weight_yyx': 1.4681225723951507e-05, 'L_entropy_weight_yyx': 2.8177482899333417e-05, 'L_sep_weight_yyx': 2.5638783508664707e-10, 'L_scale_weight_yyx': 2.1459789267446448e-08, 'learning_rate_yyx': 0.009986935372196576}. Best is trial 39 with value: -1.6090295482077699.
[I 2026-03-18 19:57:58,453] Trial 25 pruned. 
[I 2026-03-18 19:57:58,774] Trial 34 finished with value: -1.611842517835889 and parameters: {'n_layers_yyx': 2, 'hidden_size_yyx_l0': 3, 'hidden_size_yyx_l1': 5, 'context_size_yyx': 4, 'num_mix_components_yyx': 1, 'context_extractor_yyx': 'gru', 'activation_func_yyx': 'GELU', 'L2_weight_yyx': 7.663667252999104e-09, 'L_entropy_weight_yyx': 2.2816690578997774e-07, 'L_sep_weight_yyx': 3.3224490310699335e-07, 'L_scale_weight_yyx': 2.106307516272639e-05, 'learning_rate_yyx': 0.009918850259987719}. Best is trial 21 with value: -1.6119054721666712.
[I 2026-03-18 19:58:00,302] Trial 15 finished with value: -2.081373835300184 and parameters: {'n_layers_yyx': 1, 'hidden_size_yyx_l0': 5, 'context_size_yyx': 4, 'num_mix_components_yyx': 4, 'context_extractor_yyx': 'gru', 'activation_func_yyx': 'Tanh', 'L2_weight_yyx': 9.663502723236805e-10, 'L_entropy_weight_yyx': 3.036070787740328e-09, 'L_sep_weight_yyx': 1.8427608140223192e-09, 'L_scale_weight_yyx': 1.3467051968310408e-10, 'learning_rate_yyx': 0.009506788073746275}. Best is trial 14 with value: -2.0936086041286655.
[I 2026-03-18 19:58:02,186] Trial 30 pruned. 
[I 2026-03-18 19:58:02,534] Trial 40 pruned. 
[I 2026-03-18 19:58:05,554] Trial 35 pruned. 
[I 2026-03-18 19:58:06,163] Trial 23 finished with value: -1.6150631494919108 and parameters: {'n_layers_yyx': 2, 'hidden_size_yyx_l0': 6, 'hidden_size_yyx_l1': 5, 'context_size_yyx': 4, 'num_mix_components_yyx': 4, 'context_extractor_yyx': 'lstm', 'activation_func_yyx': 'Tanh', 'L2_weight_yyx': 5.1075656191928146e-08, 'L_entropy_weight_yyx': 7.584868980101705e-10, 'L_sep_weight_yyx': 1.8669296786402636e-10, 'L_scale_weight_yyx': 1.4307834710301645e-06, 'learning_rate_yyx': 0.005662592446305843}. Best is trial 21 with value: -1.6169303846739371.
[I 2026-03-18 19:58:07,228] Trial 16 pruned. 
[I 2026-03-18 19:58:07,742] Trial 27 pruned. 
[I 2026-03-18 19:58:09,579] Trial 25 pruned. 
[I 2026-03-18 19:58:11,186] Trial 40 pruned. 
[I 2026-03-18 19:58:14,729] Trial 15 pruned. 
[I 2026-03-18 19:58:14,990] Trial 28 pruned. 
[I 2026-03-18 19:58:15,033] Trial 26 pruned. 
[I 2026-03-18 19:58:16,221] Trial 26 pruned. 
[I 2026-03-18 19:58:17,783] Trial 40 finished with value: -1.6124195811809745 and parameters: {'n_layers_yyx': 1, 'hidden_size_yyx_l0': 6, 'context_size_yyx': 4, 'num_mix_components_yyx': 5, 'context_extractor_yyx': 'lstm', 'activation_func_yyx': 'GELU', 'L2_weight_yyx': 5.81308705651796e-08, 'L_entropy_weight_yyx': 8.393483586114298e-10, 'L_sep_weight_yyx': 2.3822232956296943e-10, 'L_scale_weight_yyx': 2.7262975989409466e-05, 'learning_rate_yyx': 0.0084227802058871}. Best is trial 26 with value: -1.6132763574564741.
[I 2026-03-18 19:58:17,881] Trial 41 pruned. 
[I 2026-03-18 19:58:18,401] Trial 20 finished with value: -2.081901737546831 and parameters: {'n_layers_yyx': 1, 'hidden_size_yyx_l0': 4, 'context_size_yyx': 4, 'num_mix_components_yyx': 2, 'context_extractor_yyx': 'gru', 'activation_func_yyx': 'ReLU', 'L2_weight_yyx': 4.37031751665404e-09, 'L_entropy_weight_yyx': 0.0001426276591176782, 'L_sep_weight_yyx': 7.533856886045248e-08, 'L_scale_weight_yyx': 2.278037721660612e-06, 'learning_rate_yyx': 0.009937379837113092}. Best is trial 8 with value: -2.0851807543284644.
[I 2026-03-18 19:58:18,565] Trial 31 finished with value: -2.096397587865949 and parameters: {'n_layers_yyx': 1, 'hidden_size_yyx_l0': 4, 'context_size_yyx': 4, 'num_mix_components_yyx': 5, 'context_extractor_yyx': 'lstm', 'activation_func_yyx': 'Tanh', 'L2_weight_yyx': 1.947558931187992e-08, 'L_entropy_weight_yyx': 1.895376605282497e-08, 'L_sep_weight_yyx': 2.118029216613986e-08, 'L_scale_weight_yyx': 1.0087651946549041e-10, 'learning_rate_yyx': 0.00899578941980747}. Best is trial 21 with value: -2.0975034066716556.
[I 2026-03-18 19:58:19,257] Trial 30 pruned. 
[I 2026-03-18 19:58:23,239] Trial 41 pruned. 
[I 2026-03-18 19:58:25,515] Trial 23 pruned. 
[I 2026-03-18 19:58:25,576] Trial 32 pruned. 
[I 2026-03-18 19:58:30,067] Trial 29 pruned. 
[I 2026-03-18 19:58:30,237] Trial 28 pruned. 
[I 2026-03-18 19:58:30,459] Trial 41 pruned. 
[I 2026-03-18 19:58:31,440] Trial 27 pruned. 
[I 2026-03-18 19:58:32,744] Trial 42 pruned. 
[I 2026-03-18 19:58:33,876] Trial 21 pruned. 
[I 2026-03-18 19:58:35,413] Trial 42 pruned. 
[I 2026-03-18 19:58:37,226] Trial 30 pruned. 
[I 2026-03-18 19:58:37,464] Trial 29 pruned. 
[I 2026-03-18 19:58:39,133] Trial 24 pruned. 
[I 2026-03-18 19:58:39,938] Trial 33 pruned. 
[I 2026-03-18 19:58:40,358] Trial 31 pruned. 
[I 2026-03-18 19:58:40,699] Trial 22 finished with value: -1.6339605357080298 and parameters: {'n_layers_yyx': 1, 'hidden_size_yyx_l0': 6, 'context_size_yyx': 3, 'num_mix_components_yyx': 3, 'context_extractor_yyx': 'lstm', 'activation_func_yyx': 'Tanh', 'L2_weight_yyx': 0.00018889119893347354, 'L_entropy_weight_yyx': 4.369703209629971e-07, 'L_sep_weight_yyx': 7.289259990311471e-05, 'L_scale_weight_yyx': 9.832819575449596e-10, 'learning_rate_yyx': 0.0018208972412705271}. Best is trial 22 with value: -1.6339605357080298.
[I 2026-03-18 19:58:41,683] Trial 22 pruned. 
[I 2026-03-18 19:58:41,858] Trial 24 pruned. 
[I 2026-03-18 19:58:44,484] Trial 28 pruned. 
[I 2026-03-18 19:58:45,425] Trial 30 pruned. 
[I 2026-03-18 19:58:45,902] Trial 25 pruned. 
[I 2026-03-18 19:58:47,046] Trial 17 pruned. 
[I 2026-03-18 19:58:47,263] Trial 23 pruned. 
[I 2026-03-18 19:58:50,067] Trial 32 finished with value: -1.6089319319871331 and parameters: {'n_layers_yyx': 2, 'hidden_size_yyx_l0': 6, 'hidden_size_yyx_l1': 5, 'context_size_yyx': 4, 'num_mix_components_yyx': 3, 'context_extractor_yyx': 'lstm', 'activation_func_yyx': 'ReLU', 'L2_weight_yyx': 1.8931412393934389e-06, 'L_entropy_weight_yyx': 5.517272598618801e-10, 'L_sep_weight_yyx': 7.024518413566702e-05, 'L_scale_weight_yyx': 1.188534136497091e-08, 'learning_rate_yyx': 0.003755526626932899}. Best is trial 1 with value: -1.6113757535901372.
[I 2026-03-18 19:58:51,248] Trial 31 pruned. 
[I 2026-03-18 19:58:51,941] Trial 26 pruned. 
[I 2026-03-18 19:58:52,868] Trial 24 pruned. 
[I 2026-03-18 19:58:54,151] Trial 34 pruned. 
[I 2026-03-18 19:58:56,481] Trial 33 pruned. 
[I 2026-03-18 19:58:56,972] Trial 29 pruned. 
[I 2026-03-18 19:58:57,072] Trial 32 pruned. 
[I 2026-03-18 19:58:58,953] Trial 25 pruned. 
[I 2026-03-18 19:59:00,031] Trial 31 pruned. 
[I 2026-03-18 19:59:01,802] Trial 31 pruned. 
[I 2026-03-18 19:59:03,277] Trial 33 pruned. 
[I 2026-03-18 19:59:11,931] Trial 19 finished with value: -2.0939852852587046 and parameters: {'n_layers_yyx': 1, 'hidden_size_yyx_l0': 5, 'context_size_yyx': 2, 'num_mix_components_yyx': 2, 'context_extractor_yyx': 'gru', 'activation_func_yyx': 'Tanh', 'L2_weight_yyx': 1.6039911570390463e-06, 'L_entropy_weight_yyx': 8.318977457628993e-07, 'L_sep_weight_yyx': 6.682054076916625e-08, 'L_scale_weight_yyx': 5.995040932969965e-08, 'learning_rate_yyx': 0.007108087529228152}. Best is trial 10 with value: -2.123509279126982.
