[I 2026-03-18 19:02:05,984] Trial 12 finished with value: -0.8313634018778273 and parameters: {'n_layers_yyx': 1, 'hidden_size_yyx_l0': 2, 'context_size_yyx': 4, 'num_mix_components_yyx': 3, 'context_extractor_yyx': 'gru', 'activation_func_yyx': 'ReLU', 'L2_weight_yyx': 9.85311328872759e-07, 'L_entropy_weight_yyx': 1.1505422878414506e-06, 'L_sep_weight_yyx': 0.0009883421881948997, 'L_scale_weight_yyx': 2.417247326183648e-10, 'learning_rate_yyx': 0.009078557968076863}. Best is trial 10 with value: -0.8371109842725836.
[I 2026-03-18 19:02:06,234] Trial 32 finished with value: -0.815329277004766 and parameters: {'n_layers_yyx': 1, 'hidden_size_yyx_l0': 6, 'context_size_yyx': 3, 'num_mix_components_yyx': 4, 'context_extractor_yyx': 'lstm', 'activation_func_yyx': 'Tanh', 'L2_weight_yyx': 0.00025380781268828406, 'L_entropy_weight_yyx': 0.00022629813389887538, 'L_sep_weight_yyx': 4.6334242619918315e-08, 'L_scale_weight_yyx': 9.239191811106987e-09, 'learning_rate_yyx': 0.006247705351351101}. Best is trial 1 with value: -0.8328681168211087.
[I 2026-03-18 19:02:06,868] Trial 16 pruned. 
[I 2026-03-18 19:02:08,285] Trial 20 pruned. 
[I 2026-03-18 19:02:08,597] Trial 25 pruned. 
[I 2026-03-18 19:02:11,785] Trial 24 pruned. 
[I 2026-03-18 19:02:11,829] Trial 12 pruned. 
[I 2026-03-18 19:02:12,440] Trial 27 pruned. 
[I 2026-03-18 19:02:12,797] Trial 11 pruned. 
[I 2026-03-18 19:02:14,746] Trial 26 pruned. 
[I 2026-03-18 19:02:15,162] Trial 8 finished with value: -1.7259690656565656 and parameters: {'n_layers_yyx': 1, 'hidden_size_yyx_l0': 6, 'context_size_yyx': 1, 'num_mix_components_yyx': 3, 'context_extractor_yyx': 'lstm', 'activation_func_yyx': 'GELU', 'L2_weight_yyx': 3.213261396911326e-05, 'L_entropy_weight_yyx': 0.00013347783363997626, 'L_sep_weight_yyx': 5.26292099747043e-07, 'L_scale_weight_yyx': 1.475092386650305e-09, 'learning_rate_yyx': 0.005781856494735248}. Best is trial 4 with value: -1.784507205847538.
[I 2026-03-18 19:02:16,944] Trial 17 pruned. 
[I 2026-03-18 19:02:18,487] Trial 28 pruned. 
[I 2026-03-18 19:02:20,177] Trial 16 finished with value: -1.7772173710235877 and parameters: {'n_layers_yyx': 1, 'hidden_size_yyx_l0': 5, 'context_size_yyx': 3, 'num_mix_components_yyx': 1, 'context_extractor_yyx': 'lstm', 'activation_func_yyx': 'GELU', 'L2_weight_yyx': 0.0001443951069774178, 'L_entropy_weight_yyx': 2.712087537579709e-08, 'L_sep_weight_yyx': 2.8911223694977835e-07, 'L_scale_weight_yyx': 1.381463212369679e-05, 'learning_rate_yyx': 0.002044496345910244}. Best is trial 4 with value: -1.7807932306351817.
[I 2026-03-18 19:02:21,773] Trial 7 finished with value: -2.275863068964257 and parameters: {'n_layers_yyx': 2, 'hidden_size_yyx_l0': 5, 'hidden_size_yyx_l1': 2, 'context_size_yyx': 4, 'num_mix_components_yyx': 4, 'context_extractor_yyx': 'lstm', 'activation_func_yyx': 'ReLU', 'L2_weight_yyx': 6.210364851411138e-08, 'L_entropy_weight_yyx': 1.475578069240369e-08, 'L_sep_weight_yyx': 3.02219647185022e-05, 'L_scale_weight_yyx': 2.076624346155715e-06, 'learning_rate_yyx': 0.00348515972214748}. Best is trial 1 with value: -2.279694369835903.
[I 2026-03-18 19:02:22,248] Trial 11 finished with value: -2.2851079298787487 and parameters: {'n_layers_yyx': 2, 'hidden_size_yyx_l0': 5, 'hidden_size_yyx_l1': 6, 'context_size_yyx': 4, 'num_mix_components_yyx': 3, 'context_extractor_yyx': 'lstm', 'activation_func_yyx': 'ReLU', 'L2_weight_yyx': 3.28324868098538e-08, 'L_entropy_weight_yyx': 0.0009455854655239944, 'L_sep_weight_yyx': 1.95811707532607e-08, 'L_scale_weight_yyx': 5.179754080100607e-10, 'learning_rate_yyx': 0.009911384142484391}. Best is trial 10 with value: -2.2853422092545133.
[I 2026-03-18 19:02:23,386] Trial 9 pruned. 
[I 2026-03-18 19:02:24,025] Trial 24 finished with value: -0.8190630824034112 and parameters: {'n_layers_yyx': 1, 'hidden_size_yyx_l0': 6, 'context_size_yyx': 3, 'num_mix_components_yyx': 5, 'context_extractor_yyx': 'gru', 'activation_func_yyx': 'ReLU', 'L2_weight_yyx': 1.3288445451295383e-08, 'L_entropy_weight_yyx': 4.472333423466378e-09, 'L_sep_weight_yyx': 1.0625451052276195e-10, 'L_scale_weight_yyx': 6.357135530044744e-07, 'learning_rate_yyx': 0.006002912181100741}. Best is trial 0 with value: -0.8324342893885016.
[I 2026-03-18 19:02:24,249] Trial 11 pruned. 
[I 2026-03-18 19:02:25,845] Trial 9 finished with value: -1.7799091747553661 and parameters: {'n_layers_yyx': 2, 'hidden_size_yyx_l0': 3, 'hidden_size_yyx_l1': 2, 'context_size_yyx': 3, 'num_mix_components_yyx': 1, 'context_extractor_yyx': 'lstm', 'activation_func_yyx': 'ReLU', 'L2_weight_yyx': 0.0001946093217799039, 'L_entropy_weight_yyx': 2.5999073412861627e-10, 'L_sep_weight_yyx': 1.7601416557805873e-09, 'L_scale_weight_yyx': 3.1743824527888226e-06, 'learning_rate_yyx': 0.002223540080857024}. Best is trial 3 with value: -1.785882901278409.
[I 2026-03-18 19:02:26,807] Trial 32 finished with value: -0.8078252209166128 and parameters: {'n_layers_yyx': 2, 'hidden_size_yyx_l0': 3, 'hidden_size_yyx_l1': 6, 'context_size_yyx': 3, 'num_mix_components_yyx': 1, 'context_extractor_yyx': 'lstm', 'activation_func_yyx': 'ReLU', 'L2_weight_yyx': 3.98864782654497e-06, 'L_entropy_weight_yyx': 0.000199504222301926, 'L_sep_weight_yyx': 3.337106194320506e-05, 'L_scale_weight_yyx': 0.00026897661721612585, 'learning_rate_yyx': 0.006275433115100187}. Best is trial 0 with value: -0.8279563193835395.
[I 2026-03-18 19:02:27,692] Trial 27 pruned. 
[I 2026-03-18 19:02:29,260] Trial 8 finished with value: -2.2706079849369587 and parameters: {'n_layers_yyx': 2, 'hidden_size_yyx_l0': 4, 'hidden_size_yyx_l1': 3, 'context_size_yyx': 3, 'num_mix_components_yyx': 2, 'context_extractor_yyx': 'lstm', 'activation_func_yyx': 'ReLU', 'L2_weight_yyx': 0.0007521793956239402, 'L_entropy_weight_yyx': 1.1422413377440631e-06, 'L_sep_weight_yyx': 1.7778750850310021e-07, 'L_scale_weight_yyx': 4.3396940793395937e-10, 'learning_rate_yyx': 0.0068173605205648176}. Best is trial 8 with value: -2.2706079849369587.
[I 2026-03-18 19:02:30,158] Trial 9 pruned. 
[I 2026-03-18 19:02:30,865] Trial 8 pruned. 
[I 2026-03-18 19:02:31,323] Trial 25 pruned. 
[I 2026-03-18 19:02:31,455] Trial 28 pruned. 
[I 2026-03-18 19:02:31,858] Trial 11 pruned. 
[I 2026-03-18 19:02:32,769] Trial 12 pruned. 
[I 2026-03-18 19:02:32,936] Trial 29 pruned. 
[I 2026-03-18 19:02:33,128] Trial 33 pruned. 
[I 2026-03-18 19:02:36,495] Trial 33 pruned. 
[I 2026-03-18 19:02:39,360] Trial 13 pruned. 
[I 2026-03-18 19:02:39,455] Trial 21 pruned. 
[I 2026-03-18 19:02:39,896] Trial 28 pruned. 
[I 2026-03-18 19:02:41,082] Trial 12 pruned. 
[I 2026-03-18 19:02:41,548] Trial 13 pruned. 
[I 2026-03-18 19:02:43,655] Trial 26 pruned. 
[I 2026-03-18 19:02:43,955] Trial 12 pruned. 
[I 2026-03-18 19:02:46,433] Trial 30 pruned. 
[I 2026-03-18 19:02:46,507] Trial 29 pruned. 
[I 2026-03-18 19:02:48,297] Trial 14 pruned. 
[I 2026-03-18 19:02:48,744] Trial 7 finished with value: -2.2149018094999913 and parameters: {'n_layers_yyx': 1, 'hidden_size_yyx_l0': 2, 'context_size_yyx': 4, 'num_mix_components_yyx': 3, 'context_extractor_yyx': 'lstm', 'activation_func_yyx': 'Tanh', 'L2_weight_yyx': 1.4916039573471631e-06, 'L_entropy_weight_yyx': 9.449976611939637e-09, 'L_sep_weight_yyx': 0.0003243177780756358, 'L_scale_weight_yyx': 6.866917741664628e-05, 'learning_rate_yyx': 0.009926376293434456}. Best is trial 7 with value: -2.2149018094999913.
[I 2026-03-18 19:02:50,367] Trial 34 pruned. 
[I 2026-03-18 19:02:50,963] Trial 9 pruned. 
[I 2026-03-18 19:02:51,399] Trial 7 finished with value: -1.7738877369149384 and parameters: {'n_layers_yyx': 1, 'hidden_size_yyx_l0': 3, 'context_size_yyx': 4, 'num_mix_components_yyx': 5, 'context_extractor_yyx': 'lstm', 'activation_func_yyx': 'ReLU', 'L2_weight_yyx': 2.8596786038181098e-08, 'L_entropy_weight_yyx': 0.00030422706654161875, 'L_sep_weight_yyx': 1.2538724301953738e-06, 'L_scale_weight_yyx': 3.7701810792859696e-09, 'learning_rate_yyx': 0.0073357648825504865}. Best is trial 2 with value: -1.776406202226865.
[I 2026-03-18 19:02:51,836] Trial 15 finished with value: -1.7724861454746401 and parameters: {'n_layers_yyx': 2, 'hidden_size_yyx_l0': 4, 'hidden_size_yyx_l1': 6, 'context_size_yyx': 3, 'num_mix_components_yyx': 2, 'context_extractor_yyx': 'lstm', 'activation_func_yyx': 'GELU', 'L2_weight_yyx': 5.913403366918937e-10, 'L_entropy_weight_yyx': 9.07097155399443e-09, 'L_sep_weight_yyx': 0.000520736814716322, 'L_scale_weight_yyx': 0.000904949535769187, 'learning_rate_yyx': 0.006287026516333324}. Best is trial 4 with value: -1.7775746924677662.
[I 2026-03-18 19:02:52,534] Trial 14 pruned. 
[I 2026-03-18 19:02:53,219] Trial 22 pruned. 
[I 2026-03-18 19:02:53,465] Trial 30 pruned. 
[I 2026-03-18 19:02:58,910] Trial 23 pruned. 
[I 2026-03-18 19:03:00,539] Trial 16 pruned. 
[I 2026-03-18 19:03:02,357] Trial 29 pruned. 
[I 2026-03-18 19:03:02,712] Trial 17 pruned. 
[I 2026-03-18 19:03:03,863] Trial 35 pruned. 
[I 2026-03-18 19:03:04,957] Trial 15 pruned. 
[I 2026-03-18 19:03:05,361] Trial 34 pruned. 
[I 2026-03-18 19:03:07,642] Trial 8 pruned. 
[I 2026-03-18 19:03:07,723] Trial 10 pruned. 
[I 2026-03-18 19:03:10,119] Trial 30 pruned. 
[I 2026-03-18 19:03:10,247] Trial 13 finished with value: -0.8299201277897664 and parameters: {'n_layers_yyx': 1, 'hidden_size_yyx_l0': 3, 'context_size_yyx': 4, 'num_mix_components_yyx': 3, 'context_extractor_yyx': 'gru', 'activation_func_yyx': 'ReLU', 'L2_weight_yyx': 6.01786320219999e-08, 'L_entropy_weight_yyx': 3.3896511542834767e-07, 'L_sep_weight_yyx': 0.0006372920501573555, 'L_scale_weight_yyx': 1.6763251888118898e-10, 'learning_rate_yyx': 0.009682786574151506}. Best is trial 10 with value: -0.8371109842725836.
[I 2026-03-18 19:03:11,815] Trial 18 pruned. 
[I 2026-03-18 19:03:12,036] Trial 24 pruned. 
[I 2026-03-18 19:03:12,672] Trial 9 finished with value: -1.783613157946654 and parameters: {'n_layers_yyx': 1, 'hidden_size_yyx_l0': 3, 'context_size_yyx': 1, 'num_mix_components_yyx': 5, 'context_extractor_yyx': 'gru', 'activation_func_yyx': 'ReLU', 'L2_weight_yyx': 1.317197988627795e-05, 'L_entropy_weight_yyx': 2.0023038563618673e-10, 'L_sep_weight_yyx': 0.00022320278812257315, 'L_scale_weight_yyx': 1.566342916507506e-10, 'learning_rate_yyx': 0.0017888101395700012}. Best is trial 2 with value: -1.7858329634232954.
[I 2026-03-18 19:03:16,750] Trial 11 pruned. 
[I 2026-03-18 19:03:17,617] Trial 17 pruned. 
[I 2026-03-18 19:03:18,000] Trial 31 pruned. 
[I 2026-03-18 19:03:19,561] Trial 25 pruned. 
[I 2026-03-18 19:03:19,653] Trial 8 finished with value: -1.8628065321180556 and parameters: {'n_layers_yyx': 2, 'hidden_size_yyx_l0': 6, 'hidden_size_yyx_l1': 4, 'context_size_yyx': 4, 'num_mix_components_yyx': 1, 'context_extractor_yyx': 'lstm', 'activation_func_yyx': 'GELU', 'L2_weight_yyx': 5.928918710844736e-08, 'L_entropy_weight_yyx': 9.850746018706835e-09, 'L_sep_weight_yyx': 2.642770501946584e-10, 'L_scale_weight_yyx': 3.3075950091794037e-09, 'learning_rate_yyx': 0.007898747766635033}. Best is trial 5 with value: -1.864091702761834.
[I 2026-03-18 19:03:19,737] Trial 35 pruned. 
[I 2026-03-18 19:03:19,965] Trial 15 pruned. 
[I 2026-03-18 19:03:21,076] Trial 10 finished with value: -0.8188573254088003 and parameters: {'n_layers_yyx': 2, 'hidden_size_yyx_l0': 5, 'hidden_size_yyx_l1': 6, 'context_size_yyx': 4, 'num_mix_components_yyx': 2, 'context_extractor_yyx': 'lstm', 'activation_func_yyx': 'ReLU', 'L2_weight_yyx': 1.26013682459958e-10, 'L_entropy_weight_yyx': 2.3713680683162567e-10, 'L_sep_weight_yyx': 3.655388915148843e-08, 'L_scale_weight_yyx': 7.183697217904605e-06, 'learning_rate_yyx': 0.008704582833131778}. Best is trial 1 with value: -0.8235284532014517.
[I 2026-03-18 19:03:21,305] Trial 9 pruned. 
[I 2026-03-18 19:03:21,432] Trial 10 pruned. 
[I 2026-03-18 19:03:24,603] Trial 14 pruned. 
[I 2026-03-18 19:03:25,090] Trial 32 pruned. 
[I 2026-03-18 19:03:25,436] Trial 26 pruned. 
[I 2026-03-18 19:03:25,440] Trial 9 pruned. 
[I 2026-03-18 19:03:26,221] Trial 16 pruned. 
[I 2026-03-18 19:03:26,278] Trial 31 pruned. 
[I 2026-03-18 19:03:29,988] Trial 11 pruned. 
[I 2026-03-18 19:03:31,136] Trial 10 pruned. 
[I 2026-03-18 19:03:32,159] Trial 27 pruned. 
[I 2026-03-18 19:03:32,939] Trial 13 pruned. 
[I 2026-03-18 19:03:33,845] Trial 36 pruned. 
[I 2026-03-18 19:03:34,063] Trial 17 pruned. 
[I 2026-03-18 19:03:34,869] Trial 9 pruned. 
[I 2026-03-18 19:03:35,085] Trial 10 pruned. 
[I 2026-03-18 19:03:36,082] Trial 18 pruned. 
[I 2026-03-18 19:03:36,298] Trial 8 pruned. 
[I 2026-03-18 19:03:36,736] Trial 15 pruned. 
[I 2026-03-18 19:03:37,053] Trial 16 pruned. 
[I 2026-03-18 19:03:38,925] Trial 28 pruned. 
[I 2026-03-18 19:03:39,013] Trial 12 pruned. 
[I 2026-03-18 19:03:39,383] Trial 25 pruned. 
[I 2026-03-18 19:03:39,613] Trial 33 pruned. 
[I 2026-03-18 19:03:40,030] Trial 18 pruned. 
[I 2026-03-18 19:03:41,508] Trial 27 finished with value: -0.8109014108226782 and parameters: {'n_layers_yyx': 1, 'hidden_size_yyx_l0': 3, 'context_size_yyx': 4, 'num_mix_components_yyx': 5, 'context_extractor_yyx': 'gru', 'activation_func_yyx': 'ReLU', 'L2_weight_yyx': 1.0760351492042547e-08, 'L_entropy_weight_yyx': 1.074661843261447e-08, 'L_sep_weight_yyx': 1.540746577094554e-07, 'L_scale_weight_yyx': 7.479530258468094e-08, 'learning_rate_yyx': 0.00828900592508187}. Best is trial 0 with value: -0.8324342893885016.
[I 2026-03-18 19:03:42,831] Trial 14 pruned. 
[I 2026-03-18 19:03:43,223] Trial 11 pruned. 
[I 2026-03-18 19:03:47,786] Trial 34 pruned. 
[I 2026-03-18 19:03:48,325] Trial 12 finished with value: -1.7618306060615772 and parameters: {'n_layers_yyx': 2, 'hidden_size_yyx_l0': 4, 'hidden_size_yyx_l1': 4, 'context_size_yyx': 3, 'num_mix_components_yyx': 4, 'context_extractor_yyx': 'lstm', 'activation_func_yyx': 'Tanh', 'L2_weight_yyx': 1.0457130005362114e-05, 'L_entropy_weight_yyx': 4.912064099060453e-06, 'L_sep_weight_yyx': 8.201315189823555e-06, 'L_scale_weight_yyx': 2.0019007532232208e-07, 'learning_rate_yyx': 0.00985372834340434}. Best is trial 1 with value: -1.7684712210476057.
[I 2026-03-18 19:03:49,414] Trial 11 finished with value: -2.282624150139611 and parameters: {'n_layers_yyx': 1, 'hidden_size_yyx_l0': 5, 'context_size_yyx': 3, 'num_mix_components_yyx': 5, 'context_extractor_yyx': 'gru', 'activation_func_yyx': 'ReLU', 'L2_weight_yyx': 1.7716782438953468e-10, 'L_entropy_weight_yyx': 7.390949934902972e-09, 'L_sep_weight_yyx': 7.673947213208176e-09, 'L_scale_weight_yyx': 1.0110467984127515e-08, 'learning_rate_yyx': 0.008497997890492819}. Best is trial 10 with value: -2.2831751549112607.
[I 2026-03-18 19:03:50,420] Trial 17 pruned. 
[I 2026-03-18 19:03:52,181] Trial 15 pruned. 
[I 2026-03-18 19:03:52,740] Trial 31 finished with value: -0.8202788946019318 and parameters: {'n_layers_yyx': 2, 'hidden_size_yyx_l0': 3, 'hidden_size_yyx_l1': 6, 'context_size_yyx': 3, 'num_mix_components_yyx': 3, 'context_extractor_yyx': 'gru', 'activation_func_yyx': 'Tanh', 'L2_weight_yyx': 2.2995427739574866e-08, 'L_entropy_weight_yyx': 1.6163601537595986e-08, 'L_sep_weight_yyx': 1.4063769229446717e-08, 'L_scale_weight_yyx': 3.889633454847209e-08, 'learning_rate_yyx': 0.0035347369538585396}. Best is trial 8 with value: -0.8257869568321871.
[I 2026-03-18 19:03:53,211] Trial 28 pruned. 
[I 2026-03-18 19:03:55,128] Trial 9 pruned. 
[I 2026-03-18 19:03:55,144] Trial 35 pruned. 
[I 2026-03-18 19:03:56,520] Trial 13 pruned. 
[I 2026-03-18 19:03:57,676] Trial 7 finished with value: -2.2792192998393515 and parameters: {'n_layers_yyx': 2, 'hidden_size_yyx_l0': 6, 'hidden_size_yyx_l1': 4, 'context_size_yyx': 3, 'num_mix_components_yyx': 4, 'context_extractor_yyx': 'gru', 'activation_func_yyx': 'ReLU', 'L2_weight_yyx': 2.2104372267002004e-06, 'L_entropy_weight_yyx': 2.1894297128315865e-07, 'L_sep_weight_yyx': 1.0913299639684683e-10, 'L_scale_weight_yyx': 0.0005817500038576956, 'learning_rate_yyx': 0.0020419372165256335}. Best is trial 5 with value: -2.2873410844744493.
[I 2026-03-18 19:03:59,054] Trial 36 finished with value: -0.8295417684219789 and parameters: {'n_layers_yyx': 1, 'hidden_size_yyx_l0': 5, 'context_size_yyx': 2, 'num_mix_components_yyx': 2, 'context_extractor_yyx': 'lstm', 'activation_func_yyx': 'ReLU', 'L2_weight_yyx': 5.4459971477893e-06, 'L_entropy_weight_yyx': 1.8298598140532199e-06, 'L_sep_weight_yyx': 1.2447115548166109e-07, 'L_scale_weight_yyx': 7.374168372656205e-09, 'learning_rate_yyx': 0.007446373762617616}. Best is trial 1 with value: -0.8328681168211087.
[I 2026-03-18 19:04:00,173] Trial 12 pruned. 
[I 2026-03-18 19:04:01,957] Trial 36 pruned. 
[I 2026-03-18 19:04:03,930] Trial 10 finished with value: -1.7802471985479797 and parameters: {'n_layers_yyx': 2, 'hidden_size_yyx_l0': 6, 'hidden_size_yyx_l1': 6, 'context_size_yyx': 4, 'num_mix_components_yyx': 4, 'context_extractor_yyx': 'gru', 'activation_func_yyx': 'Tanh', 'L2_weight_yyx': 2.236474616133886e-08, 'L_entropy_weight_yyx': 6.712381527397874e-08, 'L_sep_weight_yyx': 3.623734328230297e-08, 'L_scale_weight_yyx': 7.821350625131184e-06, 'learning_rate_yyx': 0.0033764758051152547}. Best is trial 3 with value: -1.785882901278409.
[I 2026-03-18 19:04:04,731] Trial 14 pruned. 
[I 2026-03-18 19:04:06,034] Trial 37 pruned. 
[I 2026-03-18 19:04:06,608] Trial 29 pruned. 
[I 2026-03-18 19:04:09,589] Trial 37 pruned. 
[I 2026-03-18 19:04:09,722] Trial 16 pruned. 
[I 2026-03-18 19:04:10,119] Trial 29 pruned. 
[I 2026-03-18 19:04:12,642] Trial 37 pruned. 
[I 2026-03-18 19:04:13,400] Trial 11 finished with value: -0.831068616497992 and parameters: {'n_layers_yyx': 2, 'hidden_size_yyx_l0': 5, 'hidden_size_yyx_l1': 6, 'context_size_yyx': 4, 'num_mix_components_yyx': 2, 'context_extractor_yyx': 'lstm', 'activation_func_yyx': 'ReLU', 'L2_weight_yyx': 1.3027825558037173e-10, 'L_entropy_weight_yyx': 1.1744262709493713e-10, 'L_sep_weight_yyx': 2.3837612193043514e-08, 'L_scale_weight_yyx': 5.018667429986042e-06, 'learning_rate_yyx': 0.009783843106581919}. Best is trial 11 with value: -0.831068616497992.
[I 2026-03-18 19:04:13,751] Trial 30 pruned. 
[I 2026-03-18 19:04:16,476] Trial 10 pruned. 
[I 2026-03-18 19:04:16,616] Trial 13 finished with value: -2.2834055495524788 and parameters: {'n_layers_yyx': 2, 'hidden_size_yyx_l0': 6, 'hidden_size_yyx_l1': 6, 'context_size_yyx': 4, 'num_mix_components_yyx': 3, 'context_extractor_yyx': 'lstm', 'activation_func_yyx': 'ReLU', 'L2_weight_yyx': 3.532576174963716e-08, 'L_entropy_weight_yyx': 0.0008377070439556352, 'L_sep_weight_yyx': 1.4103659421108174e-08, 'L_scale_weight_yyx': 1.3343686504753417e-10, 'learning_rate_yyx': 0.009161900555578821}. Best is trial 10 with value: -2.2853422092545133.
[I 2026-03-18 19:04:16,919] Trial 8 pruned. 
[I 2026-03-18 19:04:17,868] Trial 13 pruned. 
[I 2026-03-18 19:04:18,220] Trial 19 finished with value: -1.7756683171144005 and parameters: {'n_layers_yyx': 2, 'hidden_size_yyx_l0': 5, 'hidden_size_yyx_l1': 4, 'context_size_yyx': 3, 'num_mix_components_yyx': 4, 'context_extractor_yyx': 'lstm', 'activation_func_yyx': 'Tanh', 'L2_weight_yyx': 4.5313291737107013e-07, 'L_entropy_weight_yyx': 1.4732561067201152e-10, 'L_sep_weight_yyx': 8.488469886911048e-08, 'L_scale_weight_yyx': 2.2169025539459097e-09, 'learning_rate_yyx': 0.007083397696050197}. Best is trial 4 with value: -1.7807932306351817.
[I 2026-03-18 19:04:21,705] Trial 13 pruned. 
[I 2026-03-18 19:04:21,876] Trial 38 pruned. 
[I 2026-03-18 19:04:22,187] Trial 30 pruned. 
[I 2026-03-18 19:04:25,035] Trial 11 pruned. 
[I 2026-03-18 19:04:25,559] Trial 32 finished with value: -0.8146962288387417 and parameters: {'n_layers_yyx': 2, 'hidden_size_yyx_l0': 6, 'hidden_size_yyx_l1': 5, 'context_size_yyx': 4, 'num_mix_components_yyx': 1, 'context_extractor_yyx': 'lstm', 'activation_func_yyx': 'Tanh', 'L2_weight_yyx': 1.1930769054743506e-08, 'L_entropy_weight_yyx': 6.166082380990529e-05, 'L_sep_weight_yyx': 0.0003165003456342346, 'L_scale_weight_yyx': 6.314499146518667e-10, 'learning_rate_yyx': 0.009530924454799871}. Best is trial 18 with value: -0.8278672008429884.
[I 2026-03-18 19:04:25,661] Trial 14 pruned. 
[I 2026-03-18 19:04:25,751] Trial 20 pruned. 
[I 2026-03-18 19:04:28,695] Trial 31 pruned. 
[I 2026-03-18 19:04:34,469] Trial 21 pruned. 
[I 2026-03-18 19:04:35,544] Trial 39 pruned. 
[I 2026-03-18 19:04:36,781] Trial 14 pruned. 
[I 2026-03-18 19:04:37,420] Trial 12 finished with value: -2.2844907053243575 and parameters: {'n_layers_yyx': 1, 'hidden_size_yyx_l0': 4, 'context_size_yyx': 2, 'num_mix_components_yyx': 4, 'context_extractor_yyx': 'gru', 'activation_func_yyx': 'Tanh', 'L2_weight_yyx': 0.0006134117191012159, 'L_entropy_weight_yyx': 5.2665582157891596e-08, 'L_sep_weight_yyx': 9.035773788620881e-09, 'L_scale_weight_yyx': 2.1298967155665245e-05, 'learning_rate_yyx': 0.006307773708547113}. Best is trial 1 with value: -2.2881647079635865.
[I 2026-03-18 19:04:38,702] Trial 14 pruned. 
[I 2026-03-18 19:04:39,538] Trial 33 pruned. 
[I 2026-03-18 19:04:39,633] Trial 17 pruned. 
[I 2026-03-18 19:04:42,186] Trial 32 pruned. 
[I 2026-03-18 19:04:42,480] Trial 22 pruned. 
[I 2026-03-18 19:04:43,786] Trial 15 pruned. 
[I 2026-03-18 19:04:45,661] Trial 12 pruned. 
[I 2026-03-18 19:04:46,085] Trial 18 pruned. 
[I 2026-03-18 19:04:46,472] Trial 31 pruned. 
[I 2026-03-18 19:04:46,884] Trial 15 pruned. 
[I 2026-03-18 19:04:47,889] Trial 18 finished with value: -2.2836039100749694 and parameters: {'n_layers_yyx': 1, 'hidden_size_yyx_l0': 5, 'context_size_yyx': 4, 'num_mix_components_yyx': 4, 'context_extractor_yyx': 'gru', 'activation_func_yyx': 'ReLU', 'L2_weight_yyx': 1.3546609076769317e-06, 'L_entropy_weight_yyx': 1.0798905208367337e-07, 'L_sep_weight_yyx': 2.8215892722097654e-05, 'L_scale_weight_yyx': 0.0006917854794024507, 'learning_rate_yyx': 0.004861634875058076}. Best is trial 1 with value: -2.2840327548863986.
[I 2026-03-18 19:04:48,545] Trial 33 pruned. 
[I 2026-03-18 19:04:49,346] Trial 40 pruned. 
