[I 2026-03-18 19:16:04,581] Trial 24 finished with value: -1.7824687302714646 and parameters: {'n_layers_yyx': 2, 'hidden_size_yyx_l0': 2, 'hidden_size_yyx_l1': 6, 'context_size_yyx': 1, 'num_mix_components_yyx': 5, 'context_extractor_yyx': 'gru', 'activation_func_yyx': 'ReLU', 'L2_weight_yyx': 0.00021788825675625985, 'L_entropy_weight_yyx': 7.863177646478496e-06, 'L_sep_weight_yyx': 1.3992354116266813e-05, 'L_scale_weight_yyx': 7.133749619501123e-09, 'learning_rate_yyx': 0.009983822353833417}. Best is trial 4 with value: -1.784507205847538.
[I 2026-03-18 19:16:06,823] Trial 46 pruned. 
[I 2026-03-18 19:16:09,042] Trial 19 pruned. 
[I 2026-03-18 19:16:09,474] Trial 30 pruned. 
[I 2026-03-18 19:16:10,207] Trial 39 finished with value: -0.801408257759128 and parameters: {'n_layers_yyx': 2, 'hidden_size_yyx_l0': 2, 'hidden_size_yyx_l1': 6, 'context_size_yyx': 2, 'num_mix_components_yyx': 5, 'context_extractor_yyx': 'lstm', 'activation_func_yyx': 'Tanh', 'L2_weight_yyx': 2.8744600618401505e-05, 'L_entropy_weight_yyx': 8.336044426985248e-08, 'L_sep_weight_yyx': 1.405974576242726e-07, 'L_scale_weight_yyx': 1.6446753898598612e-09, 'learning_rate_yyx': 0.0023902901272542195}. Best is trial 33 with value: -0.8347344222413913.
[I 2026-03-18 19:16:12,581] Trial 30 pruned. 
[I 2026-03-18 19:16:14,569] Trial 22 finished with value: -1.759496799045139 and parameters: {'n_layers_yyx': 1, 'hidden_size_yyx_l0': 6, 'context_size_yyx': 1, 'num_mix_components_yyx': 5, 'context_extractor_yyx': 'lstm', 'activation_func_yyx': 'GELU', 'L2_weight_yyx': 0.0007769642648919163, 'L_entropy_weight_yyx': 2.8532170164597307e-10, 'L_sep_weight_yyx': 0.00033167605253508207, 'L_scale_weight_yyx': 1.4325849260388348e-05, 'learning_rate_yyx': 0.0010824465901422588}. Best is trial 18 with value: -1.7861539220328282.
[I 2026-03-18 19:16:22,114] Trial 40 pruned. 
[I 2026-03-18 19:16:23,947] Trial 34 pruned. 
[I 2026-03-18 19:16:25,483] Trial 23 pruned. 
[I 2026-03-18 19:16:26,119] Trial 31 pruned. 
[I 2026-03-18 19:16:29,036] Trial 17 finished with value: -2.288314778247399 and parameters: {'n_layers_yyx': 1, 'hidden_size_yyx_l0': 4, 'context_size_yyx': 4, 'num_mix_components_yyx': 2, 'context_extractor_yyx': 'gru', 'activation_func_yyx': 'ReLU', 'L2_weight_yyx': 2.1395913816733147e-06, 'L_entropy_weight_yyx': 2.1858706952489068e-08, 'L_sep_weight_yyx': 8.713162117289771e-07, 'L_scale_weight_yyx': 1.008523674542463e-05, 'learning_rate_yyx': 0.0015339091437167496}. Best is trial 17 with value: -2.288314778247399.
[I 2026-03-18 19:16:31,379] Trial 23 pruned. 
[I 2026-03-18 19:16:35,284] Trial 41 pruned. 
[I 2026-03-18 19:16:36,391] Trial 24 pruned. 
[I 2026-03-18 19:16:38,512] Trial 18 pruned. 
[I 2026-03-18 19:16:38,950] Trial 40 finished with value: -0.8318000241255654 and parameters: {'n_layers_yyx': 1, 'hidden_size_yyx_l0': 4, 'context_size_yyx': 4, 'num_mix_components_yyx': 4, 'context_extractor_yyx': 'lstm', 'activation_func_yyx': 'GELU', 'L2_weight_yyx': 5.379998960239946e-06, 'L_entropy_weight_yyx': 3.612988076874043e-07, 'L_sep_weight_yyx': 0.0006650639757805204, 'L_scale_weight_yyx': 2.33780590403162e-05, 'learning_rate_yyx': 0.0057843330815173025}. Best is trial 30 with value: -0.8342147669376616.
[I 2026-03-18 19:16:39,627] Trial 24 pruned. 
[I 2026-03-18 19:16:41,110] Trial 35 pruned. 
[I 2026-03-18 19:16:43,909] Trial 19 finished with value: -1.8600361173115079 and parameters: {'n_layers_yyx': 1, 'hidden_size_yyx_l0': 5, 'context_size_yyx': 3, 'num_mix_components_yyx': 1, 'context_extractor_yyx': 'lstm', 'activation_func_yyx': 'Tanh', 'L2_weight_yyx': 4.5573520122258616e-05, 'L_entropy_weight_yyx': 1.2461882822291092e-06, 'L_sep_weight_yyx': 0.00015542866873317465, 'L_scale_weight_yyx': 1.3715661913899917e-06, 'learning_rate_yyx': 0.007497996389777433}. Best is trial 5 with value: -1.864091702761834.
[I 2026-03-18 19:16:47,454] Trial 25 pruned. 
[I 2026-03-18 19:16:48,320] Trial 31 pruned. 
[I 2026-03-18 19:16:48,363] Trial 19 pruned. 
[I 2026-03-18 19:16:50,499] Trial 17 finished with value: -2.1612253143661126 and parameters: {'n_layers_yyx': 1, 'hidden_size_yyx_l0': 6, 'context_size_yyx': 1, 'num_mix_components_yyx': 2, 'context_extractor_yyx': 'lstm', 'activation_func_yyx': 'GELU', 'L2_weight_yyx': 8.675645575425735e-09, 'L_entropy_weight_yyx': 3.2938448351097327e-07, 'L_sep_weight_yyx': 6.988185110909581e-06, 'L_scale_weight_yyx': 3.367068159315717e-08, 'learning_rate_yyx': 0.006665499229781053}. Best is trial 12 with value: -2.2168161654612635.
[I 2026-03-18 19:16:50,684] Trial 41 pruned. 
[I 2026-03-18 19:16:53,021] Trial 20 pruned. 
[I 2026-03-18 19:16:53,078] Trial 43 finished with value: -0.8269851887419798 and parameters: {'n_layers_yyx': 1, 'hidden_size_yyx_l0': 4, 'context_size_yyx': 3, 'num_mix_components_yyx': 5, 'context_extractor_yyx': 'gru', 'activation_func_yyx': 'Tanh', 'L2_weight_yyx': 9.707319563018528e-10, 'L_entropy_weight_yyx': 1.0395312691330398e-09, 'L_sep_weight_yyx': 4.337257852725718e-09, 'L_scale_weight_yyx': 6.931001435225078e-10, 'learning_rate_yyx': 0.008597786378968415}. Best is trial 10 with value: -0.8355233715063007.
[I 2026-03-18 19:16:59,007] Trial 42 pruned. 
[I 2026-03-18 19:17:01,534] Trial 32 pruned. 
[I 2026-03-18 19:17:02,596] Trial 21 pruned. 
[I 2026-03-18 19:17:07,501] Trial 26 pruned. 
[I 2026-03-18 19:17:07,514] Trial 42 pruned. 
[I 2026-03-18 19:17:07,746] Trial 44 pruned. 
[I 2026-03-18 19:17:10,506] Trial 22 pruned. 
[I 2026-03-18 19:17:11,350] Trial 33 pruned. 
[I 2026-03-18 19:17:11,876] Trial 18 pruned. 
[I 2026-03-18 19:17:12,187] Trial 43 pruned. 
[I 2026-03-18 19:17:15,919] Trial 27 pruned. 
[I 2026-03-18 19:17:15,941] Trial 47 finished with value: -0.8070948613447135 and parameters: {'n_layers_yyx': 2, 'hidden_size_yyx_l0': 4, 'hidden_size_yyx_l1': 4, 'context_size_yyx': 4, 'num_mix_components_yyx': 3, 'context_extractor_yyx': 'gru', 'activation_func_yyx': 'Tanh', 'L2_weight_yyx': 4.964480533246588e-06, 'L_entropy_weight_yyx': 5.080597626502969e-07, 'L_sep_weight_yyx': 0.00018053360059223827, 'L_scale_weight_yyx': 0.0002427782609947708, 'learning_rate_yyx': 0.007670085552456391}. Best is trial 10 with value: -0.8371109842725836.
[I 2026-03-18 19:17:16,471] Trial 21 pruned. 
[I 2026-03-18 19:17:18,541] Trial 44 pruned. 
[I 2026-03-18 19:17:18,775] Trial 23 pruned. 
[I 2026-03-18 19:17:21,144] Trial 19 pruned. 
[I 2026-03-18 19:17:21,663] Trial 43 pruned. 
[I 2026-03-18 19:17:21,698] Trial 34 finished with value: -2.2649098203698745 and parameters: {'n_layers_yyx': 2, 'hidden_size_yyx_l0': 6, 'hidden_size_yyx_l1': 2, 'context_size_yyx': 3, 'num_mix_components_yyx': 3, 'context_extractor_yyx': 'gru', 'activation_func_yyx': 'Tanh', 'L2_weight_yyx': 0.0004879026959922013, 'L_entropy_weight_yyx': 1.178730962123184e-10, 'L_sep_weight_yyx': 5.464076079921295e-09, 'L_scale_weight_yyx': 6.355798496910256e-08, 'learning_rate_yyx': 0.009899256654560724}. Best is trial 1 with value: -2.2881647079635865.
[I 2026-03-18 19:17:22,347] Trial 48 pruned. 
[I 2026-03-18 19:17:25,041] Trial 28 pruned. 
[I 2026-03-18 19:17:29,438] Trial 20 pruned. 
[I 2026-03-18 19:17:31,308] Trial 45 pruned. 
[I 2026-03-18 19:17:32,364] Trial 29 pruned. 
[I 2026-03-18 19:17:32,462] Trial 18 finished with value: -2.274317960143819 and parameters: {'n_layers_yyx': 1, 'hidden_size_yyx_l0': 3, 'context_size_yyx': 2, 'num_mix_components_yyx': 5, 'context_extractor_yyx': 'gru', 'activation_func_yyx': 'ReLU', 'L2_weight_yyx': 9.146228882941272e-10, 'L_entropy_weight_yyx': 2.103888168665699e-09, 'L_sep_weight_yyx': 7.697482421899205e-08, 'L_scale_weight_yyx': 6.030264111408144e-08, 'learning_rate_yyx': 0.0036880509444349764}. Best is trial 10 with value: -2.2831751549112607.
[I 2026-03-18 19:17:33,961] Trial 25 pruned. 
[I 2026-03-18 19:17:35,212] Trial 49 pruned. 
[I 2026-03-18 19:17:35,213] Trial 32 finished with value: -1.7780428753361268 and parameters: {'n_layers_yyx': 2, 'hidden_size_yyx_l0': 4, 'hidden_size_yyx_l1': 5, 'context_size_yyx': 4, 'num_mix_components_yyx': 3, 'context_extractor_yyx': 'gru', 'activation_func_yyx': 'Tanh', 'L2_weight_yyx': 7.012492185863783e-07, 'L_entropy_weight_yyx': 1.0731988672683552e-10, 'L_sep_weight_yyx': 9.586845309304948e-10, 'L_scale_weight_yyx': 8.135676326920974e-05, 'learning_rate_yyx': 0.006686600372773099}. Best is trial 4 with value: -1.7807932306351817.

Source events: 3618
Target events: 10752
Full model ln_yyx : 81.63945 nats/sec, 6.83366 nats/event
Full model Log loss : -0.71697
Full model ln_yyx : 84.98361 nats/sec, 7.11358 nats/event
Full model Log loss : -0.81000
Full model ln_yyx : 85.16875 nats/sec, 7.12908 nats/event
Full model Log loss : -0.80707
Full model ln_yyx : 83.29442 nats/sec, 6.97219 nats/event
Full model Log loss : -0.78952
Full model ln_yyx : 87.00331 nats/sec, 7.28264 nats/event
Full model Log loss : -0.83711
Full model ln_yyx : 88.00890 nats/sec, 7.36682 nats/event
Full model Log loss : -0.83112
Full model ln_yyx : 88.03108 nats/sec, 7.36867 nats/event
Full model Log loss : -0.83136
Full model ln_yyx : 87.01396 nats/sec, 7.28353 nats/event
Full model Log loss : -0.82992
Full model ln_yyx : 83.80712 nats/sec, 7.01511 nats/event
Full model Log loss : -0.78696
Full model ln_yyx : 87.27958 nats/sec, 7.30577 nats/event
Full model Log loss : -0.81371
Full model ln_yyx : 88.31028 nats/sec, 7.39204 nats/event
Full model Log loss : -0.82246
Full model ln_yyx : 86.84696 nats/sec, 7.26956 nats/event
Full model Log loss : -0.82621
Full model ln_yyx : 88.28159 nats/sec, 7.38964 nats/event
Full model Log loss : -0.81813
Full model ln_yyx : 88.15691 nats/sec, 7.37921 nats/event
Full model Log loss : -0.82832
Full model ln_yyx : 88.87745 nats/sec, 7.43952 nats/event
Full model Log loss : -0.80709
Optimization finished. Config saved to results/opt-full/opt_full_195_best_config.txt
[I 2026-03-18 19:17:35,642] Trial 22 pruned. 
[I 2026-03-18 19:17:38,330] Trial 46 pruned. 
[I 2026-03-18 19:17:42,594] Trial 35 pruned. 
[I 2026-03-18 19:17:42,764] Trial 20 finished with value: -2.276480542797575 and parameters: {'n_layers_yyx': 1, 'hidden_size_yyx_l0': 6, 'context_size_yyx': 4, 'num_mix_components_yyx': 4, 'context_extractor_yyx': 'lstm', 'activation_func_yyx': 'ReLU', 'L2_weight_yyx': 8.958089629010731e-08, 'L_entropy_weight_yyx': 1.9540278161922292e-10, 'L_sep_weight_yyx': 0.0001807785960389033, 'L_scale_weight_yyx': 0.00013032065410320981, 'learning_rate_yyx': 0.006777242407992059}. Best is trial 15 with value: -2.2836040757900973.
[I 2026-03-18 19:17:43,228] Trial 26 pruned. 
[I 2026-03-18 19:17:44,000] Trial 20 pruned. 
[I 2026-03-18 19:17:44,246] Trial 23 pruned. 
[I 2026-03-18 19:17:47,709] Trial 33 finished with value: -1.7738251263382223 and parameters: {'n_layers_yyx': 2, 'hidden_size_yyx_l0': 6, 'hidden_size_yyx_l1': 5, 'context_size_yyx': 4, 'num_mix_components_yyx': 1, 'context_extractor_yyx': 'lstm', 'activation_func_yyx': 'ReLU', 'L2_weight_yyx': 7.501531526151532e-10, 'L_entropy_weight_yyx': 0.00013099722466981107, 'L_sep_weight_yyx': 5.553985007127237e-09, 'L_scale_weight_yyx': 0.00035047151747295504, 'learning_rate_yyx': 0.004300766040191356}. Best is trial 4 with value: -1.7775746924677662.
[I 2026-03-18 19:17:48,165] Trial 21 finished with value: -2.2734326463096424 and parameters: {'n_layers_yyx': 2, 'hidden_size_yyx_l0': 3, 'hidden_size_yyx_l1': 5, 'context_size_yyx': 3, 'num_mix_components_yyx': 4, 'context_extractor_yyx': 'lstm', 'activation_func_yyx': 'Tanh', 'L2_weight_yyx': 6.738024982403274e-08, 'L_entropy_weight_yyx': 0.00022211861221275214, 'L_sep_weight_yyx': 1.1608423303444144e-10, 'L_scale_weight_yyx': 2.1984161923734597e-06, 'learning_rate_yyx': 0.0034018192764980817}. Best is trial 21 with value: -2.2734326463096424.
[I 2026-03-18 19:17:49,750] Trial 47 pruned. 
[I 2026-03-18 19:17:51,500] Trial 44 pruned. 
[I 2026-03-18 19:17:52,003] Trial 36 pruned. 
[I 2026-03-18 19:17:52,022] Trial 33 pruned. 
[I 2026-03-18 19:17:53,355] Trial 21 pruned. 
[I 2026-03-18 19:18:04,015] Trial 24 finished with value: -2.274279053033201 and parameters: {'n_layers_yyx': 1, 'hidden_size_yyx_l0': 6, 'context_size_yyx': 2, 'num_mix_components_yyx': 4, 'context_extractor_yyx': 'gru', 'activation_func_yyx': 'Tanh', 'L2_weight_yyx': 6.069850833405249e-06, 'L_entropy_weight_yyx': 7.469393894636922e-09, 'L_sep_weight_yyx': 1.85840987308303e-05, 'L_scale_weight_yyx': 0.0006318544695607555, 'learning_rate_yyx': 0.009965570010291351}. Best is trial 1 with value: -2.2866954714752907.
[I 2026-03-18 19:18:04,253] Trial 24 pruned. 
[I 2026-03-18 19:18:07,720] Trial 22 pruned. 
[I 2026-03-18 19:18:08,735] Trial 34 pruned. 
[I 2026-03-18 19:18:12,837] Trial 37 pruned. 
[I 2026-03-18 19:18:16,784] Trial 30 pruned. 
[I 2026-03-18 19:18:18,741] Trial 31 finished with value: -2.2827430528993267 and parameters: {'n_layers_yyx': 2, 'hidden_size_yyx_l0': 3, 'hidden_size_yyx_l1': 5, 'context_size_yyx': 3, 'num_mix_components_yyx': 5, 'context_extractor_yyx': 'gru', 'activation_func_yyx': 'Tanh', 'L2_weight_yyx': 2.968249885251758e-07, 'L_entropy_weight_yyx': 2.4828486889971494e-08, 'L_sep_weight_yyx': 3.196265976766128e-06, 'L_scale_weight_yyx': 0.00030594123505054284, 'learning_rate_yyx': 0.007986512108507458}. Best is trial 22 with value: -2.2897814149518054.
[I 2026-03-18 19:18:21,331] Trial 48 pruned. 
[I 2026-03-18 19:18:21,856] Trial 45 finished with value: -0.8312789037977751 and parameters: {'n_layers_yyx': 1, 'hidden_size_yyx_l0': 3, 'context_size_yyx': 1, 'num_mix_components_yyx': 5, 'context_extractor_yyx': 'gru', 'activation_func_yyx': 'Tanh', 'L2_weight_yyx': 1.0452929097197829e-10, 'L_entropy_weight_yyx': 9.832409776682032e-09, 'L_sep_weight_yyx': 5.465540107245058e-06, 'L_scale_weight_yyx': 1.8370752146115642e-07, 'learning_rate_yyx': 0.008788122598047062}. Best is trial 10 with value: -0.8355233715063007.
[I 2026-03-18 19:18:24,071] Trial 45 pruned. 
[I 2026-03-18 19:18:29,236] Trial 35 pruned. 
[I 2026-03-18 19:18:30,453] Trial 46 pruned. 
[I 2026-03-18 19:18:31,681] Trial 26 finished with value: -2.253260172067209 and parameters: {'n_layers_yyx': 2, 'hidden_size_yyx_l0': 3, 'hidden_size_yyx_l1': 5, 'context_size_yyx': 1, 'num_mix_components_yyx': 4, 'context_extractor_yyx': 'gru', 'activation_func_yyx': 'Tanh', 'L2_weight_yyx': 5.944821813373432e-09, 'L_entropy_weight_yyx': 6.132551436124707e-09, 'L_sep_weight_yyx': 0.000949347730660522, 'L_scale_weight_yyx': 8.199742932706169e-09, 'learning_rate_yyx': 0.0031808641632691333}. Best is trial 2 with value: -2.272224617884258.
[I 2026-03-18 19:18:33,621] Trial 34 pruned. 
[I 2026-03-18 19:18:35,710] Trial 32 finished with value: -1.7835692866161617 and parameters: {'n_layers_yyx': 1, 'hidden_size_yyx_l0': 4, 'context_size_yyx': 1, 'num_mix_components_yyx': 5, 'context_extractor_yyx': 'gru', 'activation_func_yyx': 'Tanh', 'L2_weight_yyx': 1.4760820400680693e-06, 'L_entropy_weight_yyx': 2.2958479058692927e-06, 'L_sep_weight_yyx': 2.091800099970953e-07, 'L_scale_weight_yyx': 8.347054017258761e-08, 'learning_rate_yyx': 0.00981717294577087}. Best is trial 12 with value: -1.7867913016887627.
[I 2026-03-18 19:18:36,008] Trial 38 pruned. 
[I 2026-03-18 19:18:36,925] Trial 47 pruned. 
[I 2026-03-18 19:18:37,102] Trial 46 pruned. 
[I 2026-03-18 19:18:40,032] Trial 27 pruned. 
[I 2026-03-18 19:18:43,155] Trial 47 pruned. 
[I 2026-03-18 19:18:44,886] Trial 34 finished with value: -2.2817740805729803 and parameters: {'n_layers_yyx': 2, 'hidden_size_yyx_l0': 5, 'hidden_size_yyx_l1': 6, 'context_size_yyx': 4, 'num_mix_components_yyx': 2, 'context_extractor_yyx': 'lstm', 'activation_func_yyx': 'ReLU', 'L2_weight_yyx': 9.679333260592676e-07, 'L_entropy_weight_yyx': 0.0002578793455035103, 'L_sep_weight_yyx': 1.2460124019415664e-10, 'L_scale_weight_yyx': 1.6155061797320957e-07, 'learning_rate_yyx': 0.008254603168970634}. Best is trial 10 with value: -2.2853422092545133.
[I 2026-03-18 19:18:45,065] Trial 39 pruned. 
[I 2026-03-18 19:18:46,583] Trial 36 pruned. 
[I 2026-03-18 19:18:50,070] Trial 48 pruned. 
[I 2026-03-18 19:18:50,428] Trial 35 pruned. 
[I 2026-03-18 19:18:52,185] Trial 33 pruned. 
[I 2026-03-18 19:18:53,679] Trial 35 pruned. 
[I 2026-03-18 19:18:55,036] Trial 37 pruned. 
[I 2026-03-18 19:18:56,980] Trial 36 finished with value: -1.764658451471493 and parameters: {'n_layers_yyx': 2, 'hidden_size_yyx_l0': 6, 'hidden_size_yyx_l1': 4, 'context_size_yyx': 2, 'num_mix_components_yyx': 1, 'context_extractor_yyx': 'lstm', 'activation_func_yyx': 'ReLU', 'L2_weight_yyx': 1.1318441542979355e-10, 'L_entropy_weight_yyx': 0.0003162807864253031, 'L_sep_weight_yyx': 2.2009925730876493e-08, 'L_scale_weight_yyx': 2.733784898236221e-09, 'learning_rate_yyx': 0.007597298465118989}. Best is trial 1 with value: -1.7684712210476057.
[I 2026-03-18 19:18:59,956] Trial 24 finished with value: -1.7754799259277543 and parameters: {'n_layers_yyx': 1, 'hidden_size_yyx_l0': 3, 'context_size_yyx': 2, 'num_mix_components_yyx': 4, 'context_extractor_yyx': 'gru', 'activation_func_yyx': 'Tanh', 'L2_weight_yyx': 2.901699908455445e-10, 'L_entropy_weight_yyx': 0.00011368425113581981, 'L_sep_weight_yyx': 2.338613044232803e-07, 'L_scale_weight_yyx': 9.681097641280979e-08, 'learning_rate_yyx': 0.007702615886764369}. Best is trial 2 with value: -1.776406202226865.
[I 2026-03-18 19:19:00,076] Trial 34 pruned. 
[I 2026-03-18 19:19:00,848] Trial 28 pruned. 
[I 2026-03-18 19:19:01,192] Trial 25 pruned. 
[I 2026-03-18 19:19:02,183] Trial 49 pruned. 

Source events: 3618
Target events: 9421
Full model ln_yyx : 75.90283 nats/sec, 7.25109 nats/event
Full model Log loss : -0.81676
Full model ln_yyx : 75.98168 nats/sec, 7.25863 nats/event
Full model Log loss : -0.83481
Full model ln_yyx : 74.43009 nats/sec, 7.11040 nats/event
Full model Log loss : -0.80165
Full model ln_yyx : 75.21288 nats/sec, 7.18518 nats/event
Full model Log loss : -0.82697
Full model ln_yyx : 74.51201 nats/sec, 7.11823 nats/event
Full model Log loss : -0.82319
Full model ln_yyx : 75.74327 nats/sec, 7.23585 nats/event
Full model Log loss : -0.83552
Full model ln_yyx : 76.52479 nats/sec, 7.31051 nats/event
Full model Log loss : -0.83064
Full model ln_yyx : 75.35706 nats/sec, 7.19896 nats/event
Full model Log loss : -0.80447
Full model ln_yyx : 76.77292 nats/sec, 7.33421 nats/event
Full model Log loss : -0.83206
Full model ln_yyx : 75.07070 nats/sec, 7.17160 nats/event
Full model Log loss : -0.83031
Full model ln_yyx : 74.21191 nats/sec, 7.08956 nats/event
Full model Log loss : -0.79761
Full model ln_yyx : 76.23425 nats/sec, 7.28275 nats/event
Full model Log loss : -0.83149
Full model ln_yyx : 74.78397 nats/sec, 7.14421 nats/event
Full model Log loss : -0.82699
Full model ln_yyx : 76.85638 nats/sec, 7.34219 nats/event
Full model Log loss : -0.83128
Optimization finished. Config saved to results/opt-full/opt_full_200_best_config.txt
[I 2026-03-18 19:19:08,729] Trial 36 pruned. 
[I 2026-03-18 19:19:08,917] Trial 25 pruned. 
[I 2026-03-18 19:19:10,397] Trial 29 pruned. 
[I 2026-03-18 19:19:11,047] Trial 26 pruned. 
[I 2026-03-18 19:19:11,889] Trial 38 pruned. 
[I 2026-03-18 19:19:11,992] Trial 25 finished with value: -1.7844676254734848 and parameters: {'n_layers_yyx': 2, 'hidden_size_yyx_l0': 3, 'hidden_size_yyx_l1': 4, 'context_size_yyx': 2, 'num_mix_components_yyx': 4, 'context_extractor_yyx': 'gru', 'activation_func_yyx': 'ReLU', 'L2_weight_yyx': 2.0327325188726244e-06, 'L_entropy_weight_yyx': 6.633768610517345e-05, 'L_sep_weight_yyx': 5.435555602367941e-08, 'L_scale_weight_yyx': 4.612848458306583e-10, 'learning_rate_yyx': 0.0026370549694485356}. Best is trial 4 with value: -1.784507205847538.
[I 2026-03-18 19:19:14,967] Trial 48 pruned. 
[I 2026-03-18 19:19:17,615] Trial 35 pruned. 
[I 2026-03-18 19:19:24,824] Trial 26 pruned. 
[I 2026-03-18 19:19:25,611] Trial 37 pruned. 
[I 2026-03-18 19:19:30,303] Trial 27 pruned. 
[I 2026-03-18 19:19:30,502] Trial 49 finished with value: -0.7900196340270725 and parameters: {'n_layers_yyx': 1, 'hidden_size_yyx_l0': 6, 'context_size_yyx': 3, 'num_mix_components_yyx': 3, 'context_extractor_yyx': 'gru', 'activation_func_yyx': 'Tanh', 'L2_weight_yyx': 1.890028998916339e-09, 'L_entropy_weight_yyx': 2.074125256403258e-06, 'L_sep_weight_yyx': 0.0005876386175886614, 'L_scale_weight_yyx': 4.65844057569961e-06, 'learning_rate_yyx': 0.004583116063550108}. Best is trial 30 with value: -0.8342147669376616.

Source events: 3618
Target events: 38515
Full model ln_yyx : 304.93091 nats/sec, 7.12548 nats/event
Full model Log loss : -0.79710
Full model ln_yyx : 311.65713 nats/sec, 7.28265 nats/event
Full model Log loss : -0.82353
Full model ln_yyx : 311.89097 nats/sec, 7.28812 nats/event
Full model Log loss : -0.81083
Full model ln_yyx : 288.08600 nats/sec, 6.73186 nats/event
Full model Log loss : -0.75109
Full model ln_yyx : 306.49372 nats/sec, 7.16200 nats/event
Full model Log loss : -0.81796
Full model ln_yyx : 304.35135 nats/sec, 7.11194 nats/event
Full model Log loss : -0.81291
Full model ln_yyx : 330.48836 nats/sec, 7.72269 nats/event
Full model Log loss : -0.81886
Full model ln_yyx : 322.98188 nats/sec, 7.54729 nats/event
Full model Log loss : -0.83107
Full model ln_yyx : 321.74869 nats/sec, 7.51847 nats/event
Full model Log loss : -0.81695
Full model ln_yyx : 314.32792 nats/sec, 7.34506 nats/event
Full model Log loss : -0.80526
Full model ln_yyx : 309.19857 nats/sec, 7.22520 nats/event
Full model Log loss : -0.79502
Full model ln_yyx : 319.44166 nats/sec, 7.46456 nats/event
Full model Log loss : -0.83421
Full model ln_yyx : 318.49456 nats/sec, 7.44243 nats/event
Full model Log loss : -0.83134
Full model ln_yyx : 316.42242 nats/sec, 7.39401 nats/event
Full model Log loss : -0.83180
Full model ln_yyx : 308.81504 nats/sec, 7.21624 nats/event
Full model Log loss : -0.79002
Optimization finished. Config saved to results/opt-full/opt_full_193_best_config.txt
[I 2026-03-18 19:19:33,999] Trial 27 pruned. 
