[I 2026-03-18 19:55:41,211] Trial 31 finished with value: -2.1118940309610252 and parameters: {'n_layers_yyx': 1, 'hidden_size_yyx_l0': 4, 'context_size_yyx': 3, 'num_mix_components_yyx': 3, 'context_extractor_yyx': 'lstm', 'activation_func_yyx': 'Tanh', 'L2_weight_yyx': 5.721148459778162e-08, 'L_entropy_weight_yyx': 3.993155352475611e-09, 'L_sep_weight_yyx': 1.97117908748472e-07, 'L_scale_weight_yyx': 2.085360231450732e-05, 'learning_rate_yyx': 0.0019133096218639466}. Best is trial 0 with value: -2.1143376288427875.
[I 2026-03-18 19:55:41,339] Trial 36 pruned. 
[I 2026-03-18 19:55:41,557] Trial 19 pruned. 
[I 2026-03-18 19:55:45,218] Trial 26 pruned. 
[I 2026-03-18 19:55:48,239] Trial 29 pruned. 
[I 2026-03-18 19:55:50,629] Trial 43 pruned. 
[I 2026-03-18 19:55:52,825] Trial 16 pruned. 
[I 2026-03-18 19:55:55,657] Trial 24 pruned. 
[I 2026-03-18 19:55:58,477] Trial 30 pruned. 
[I 2026-03-18 19:56:00,551] Trial 18 pruned. 
[I 2026-03-18 19:56:04,143] Trial 43 pruned. 
[I 2026-03-18 19:56:04,442] Trial 32 pruned. 
[I 2026-03-18 19:56:05,628] Trial 23 pruned. 
[I 2026-03-18 19:56:05,702] Trial 37 pruned. 
[I 2026-03-18 19:56:10,618] Trial 27 pruned. 
[I 2026-03-18 19:56:11,000] Trial 44 pruned. 
[I 2026-03-18 19:56:11,219] Trial 24 finished with value: -2.513150573787995 and parameters: {'n_layers_yyx': 1, 'hidden_size_yyx_l0': 6, 'context_size_yyx': 4, 'num_mix_components_yyx': 2, 'context_extractor_yyx': 'gru', 'activation_func_yyx': 'GELU', 'L2_weight_yyx': 2.5379584046085024e-08, 'L_entropy_weight_yyx': 0.0002864342611915943, 'L_sep_weight_yyx': 5.187626895435773e-09, 'L_scale_weight_yyx': 2.5389395712153425e-10, 'learning_rate_yyx': 0.007516280135669394}. Best is trial 23 with value: -2.513824905841335.
[I 2026-03-18 19:56:14,322] Trial 39 pruned. 
[I 2026-03-18 19:56:15,451] Trial 44 finished with value: -1.6719664280830469 and parameters: {'n_layers_yyx': 1, 'hidden_size_yyx_l0': 5, 'context_size_yyx': 4, 'num_mix_components_yyx': 5, 'context_extractor_yyx': 'gru', 'activation_func_yyx': 'Tanh', 'L2_weight_yyx': 1.2546530041371133e-06, 'L_entropy_weight_yyx': 2.4526445710555075e-05, 'L_sep_weight_yyx': 5.250251462447097e-07, 'L_scale_weight_yyx': 0.00016022318782609585, 'learning_rate_yyx': 0.006478167060608542}. Best is trial 30 with value: -1.6758763736283075.
[I 2026-03-18 19:56:15,538] Trial 44 pruned. 
[I 2026-03-18 19:56:17,682] Trial 23 pruned. 
[I 2026-03-18 19:56:20,136] Trial 43 pruned. 
[I 2026-03-18 19:56:20,459] Trial 21 pruned. 
[I 2026-03-18 19:56:21,230] Trial 45 pruned. 
[I 2026-03-18 19:56:24,709] Trial 40 pruned. 
[I 2026-03-18 19:56:28,000] Trial 33 pruned. 
[I 2026-03-18 19:56:28,184] Trial 19 pruned. 
[I 2026-03-18 19:56:28,657] Trial 33 pruned. 
[I 2026-03-18 19:56:29,786] Trial 38 pruned. 
[I 2026-03-18 19:56:31,700] Trial 46 pruned. 
[I 2026-03-18 19:56:32,023] Trial 44 pruned. 
[I 2026-03-18 19:56:34,238] Trial 24 pruned. 
[I 2026-03-18 19:56:35,218] Trial 45 pruned. 
[I 2026-03-18 19:56:38,929] Trial 34 pruned. 
[I 2026-03-18 19:56:40,140] Trial 25 pruned. 
[I 2026-03-18 19:56:40,468] Trial 34 pruned. 
[I 2026-03-18 19:56:41,307] Trial 14 finished with value: -2.5143058697757126 and parameters: {'n_layers_yyx': 1, 'hidden_size_yyx_l0': 5, 'context_size_yyx': 1, 'num_mix_components_yyx': 4, 'context_extractor_yyx': 'lstm', 'activation_func_yyx': 'ReLU', 'L2_weight_yyx': 1.956019795823995e-09, 'L_entropy_weight_yyx': 1.3643992728846364e-10, 'L_sep_weight_yyx': 4.633235784487105e-09, 'L_scale_weight_yyx': 1.0365552639942419e-10, 'learning_rate_yyx': 0.006463003075691444}. Best is trial 12 with value: -2.51518345292619.
[I 2026-03-18 19:56:41,564] Trial 37 finished with value: -1.6716173163748085 and parameters: {'n_layers_yyx': 1, 'hidden_size_yyx_l0': 5, 'context_size_yyx': 2, 'num_mix_components_yyx': 3, 'context_extractor_yyx': 'gru', 'activation_func_yyx': 'Tanh', 'L2_weight_yyx': 1.4619618339099242e-09, 'L_entropy_weight_yyx': 0.00013161326444194153, 'L_sep_weight_yyx': 2.600249063040173e-05, 'L_scale_weight_yyx': 1.4754669932153128e-05, 'learning_rate_yyx': 0.0023698245885261492}. Best is trial 10 with value: -1.6769862653887198.
[I 2026-03-18 19:56:41,669] Trial 39 pruned. 
[I 2026-03-18 19:56:42,039] Trial 47 pruned. 
[I 2026-03-18 19:56:43,880] Trial 45 pruned. 
[I 2026-03-18 19:56:51,236] Trial 35 pruned. 
[I 2026-03-18 19:56:52,988] Trial 20 pruned. 
[I 2026-03-18 19:56:56,327] Trial 46 pruned. 
[I 2026-03-18 19:56:56,736] Trial 20 pruned. 
[I 2026-03-18 19:56:59,851] Trial 37 finished with value: -1.6930970162604573 and parameters: {'n_layers_yyx': 1, 'hidden_size_yyx_l0': 2, 'context_size_yyx': 3, 'num_mix_components_yyx': 5, 'context_extractor_yyx': 'lstm', 'activation_func_yyx': 'GELU', 'L2_weight_yyx': 7.530554982628842e-05, 'L_entropy_weight_yyx': 5.444356524284551e-10, 'L_sep_weight_yyx': 1.7411038580136203e-05, 'L_scale_weight_yyx': 7.187852271349653e-08, 'learning_rate_yyx': 0.008525060444834306}. Best is trial 18 with value: -1.7002973458681911.
[I 2026-03-18 19:57:09,284] Trial 45 pruned. 
[I 2026-03-18 19:57:10,178] Trial 38 pruned. 
[I 2026-03-18 19:57:10,787] Trial 21 finished with value: -2.5132035092741223 and parameters: {'n_layers_yyx': 2, 'hidden_size_yyx_l0': 6, 'hidden_size_yyx_l1': 5, 'context_size_yyx': 4, 'num_mix_components_yyx': 4, 'context_extractor_yyx': 'gru', 'activation_func_yyx': 'ReLU', 'L2_weight_yyx': 5.366119280126681e-09, 'L_entropy_weight_yyx': 6.087735929616881e-10, 'L_sep_weight_yyx': 0.00011673458621100125, 'L_scale_weight_yyx': 4.780099014686234e-05, 'learning_rate_yyx': 0.009973997099191036}. Best is trial 21 with value: -2.5132035092741223.
[I 2026-03-18 19:57:12,929] Trial 28 pruned. 
[I 2026-03-18 19:57:15,053] Trial 36 pruned. 
[I 2026-03-18 19:57:15,333] Trial 27 finished with value: -2.5473035265515733 and parameters: {'n_layers_yyx': 2, 'hidden_size_yyx_l0': 4, 'hidden_size_yyx_l1': 2, 'context_size_yyx': 2, 'num_mix_components_yyx': 5, 'context_extractor_yyx': 'gru', 'activation_func_yyx': 'Tanh', 'L2_weight_yyx': 4.3880521397154556e-08, 'L_entropy_weight_yyx': 5.801005803739209e-07, 'L_sep_weight_yyx': 1.2622101703165716e-08, 'L_scale_weight_yyx': 1.488200149330155e-06, 'learning_rate_yyx': 0.0035170428458326554}. Best is trial 16 with value: -2.5482089436137594.
[I 2026-03-18 19:57:19,541] Trial 39 pruned. 
[I 2026-03-18 19:57:28,955] Trial 46 pruned. 
[I 2026-03-18 19:57:29,284] Trial 24 finished with value: -1.6746781114086058 and parameters: {'n_layers_yyx': 2, 'hidden_size_yyx_l0': 5, 'hidden_size_yyx_l1': 5, 'context_size_yyx': 4, 'num_mix_components_yyx': 4, 'context_extractor_yyx': 'gru', 'activation_func_yyx': 'Tanh', 'L2_weight_yyx': 2.0005297475034605e-07, 'L_entropy_weight_yyx': 1.0774982019744462e-10, 'L_sep_weight_yyx': 5.002543398256208e-05, 'L_scale_weight_yyx': 0.0001455726574196836, 'learning_rate_yyx': 0.005666125865553643}. Best is trial 15 with value: -1.6819845856754096.
[I 2026-03-18 19:57:30,700] Trial 40 pruned. 
[I 2026-03-18 19:57:32,519] Trial 31 finished with value: -1.6774622538180262 and parameters: {'n_layers_yyx': 2, 'hidden_size_yyx_l0': 5, 'hidden_size_yyx_l1': 5, 'context_size_yyx': 3, 'num_mix_components_yyx': 5, 'context_extractor_yyx': 'lstm', 'activation_func_yyx': 'Tanh', 'L2_weight_yyx': 3.3869614465608015e-06, 'L_entropy_weight_yyx': 7.185396413227095e-08, 'L_sep_weight_yyx': 1.599584765584066e-08, 'L_scale_weight_yyx': 2.042799333591483e-08, 'learning_rate_yyx': 0.00611577659996926}. Best is trial 7 with value: -1.6801514889058558.
[I 2026-03-18 19:57:36,219] Trial 38 pruned. 
[I 2026-03-18 19:57:36,296] Trial 29 pruned. 
[I 2026-03-18 19:57:37,923] Trial 25 finished with value: -2.504659714809684 and parameters: {'n_layers_yyx': 1, 'hidden_size_yyx_l0': 6, 'context_size_yyx': 4, 'num_mix_components_yyx': 4, 'context_extractor_yyx': 'lstm', 'activation_func_yyx': 'Tanh', 'L2_weight_yyx': 4.15732090715233e-10, 'L_entropy_weight_yyx': 0.0001540150440039375, 'L_sep_weight_yyx': 0.0009884644823622208, 'L_scale_weight_yyx': 7.788715836801638e-08, 'learning_rate_yyx': 0.009636643152530221}. Best is trial 25 with value: -2.504659714809684.
[I 2026-03-18 19:57:38,427] Trial 24 finished with value: -2.5100715946409635 and parameters: {'n_layers_yyx': 2, 'hidden_size_yyx_l0': 5, 'hidden_size_yyx_l1': 3, 'context_size_yyx': 4, 'num_mix_components_yyx': 4, 'context_extractor_yyx': 'lstm', 'activation_func_yyx': 'GELU', 'L2_weight_yyx': 0.0009088328972670078, 'L_entropy_weight_yyx': 0.0009332132454736342, 'L_sep_weight_yyx': 8.08565898455808e-06, 'L_scale_weight_yyx': 2.235892631543742e-09, 'learning_rate_yyx': 0.00441339761277163}. Best is trial 1 with value: -2.5125601952756833.
[I 2026-03-18 19:57:38,545] Trial 47 pruned. 
[I 2026-03-18 19:57:40,470] Trial 28 pruned. 
[I 2026-03-18 19:57:40,566] Trial 41 pruned. 
[I 2026-03-18 19:57:42,703] Trial 22 finished with value: -2.035686918726176 and parameters: {'n_layers_yyx': 1, 'hidden_size_yyx_l0': 6, 'context_size_yyx': 4, 'num_mix_components_yyx': 5, 'context_extractor_yyx': 'lstm', 'activation_func_yyx': 'ReLU', 'L2_weight_yyx': 5.110932728810804e-08, 'L_entropy_weight_yyx': 6.291648020062747e-10, 'L_sep_weight_yyx': 8.438139306012866e-09, 'L_scale_weight_yyx': 1.0707945547951771e-07, 'learning_rate_yyx': 0.007935738171213215}. Best is trial 8 with value: -2.0365283470022115.
[I 2026-03-18 19:57:45,952] Trial 39 pruned. 
[I 2026-03-18 19:57:45,952] Trial 31 pruned. 
[I 2026-03-18 19:57:46,397] Trial 38 pruned. 
[I 2026-03-18 19:57:50,234] Trial 26 pruned. 
[I 2026-03-18 19:57:51,984] Trial 25 pruned. 
[I 2026-03-18 19:57:53,318] Trial 29 pruned. 
[I 2026-03-18 19:57:53,442] Trial 41 finished with value: -1.730878583570371 and parameters: {'n_layers_yyx': 1, 'hidden_size_yyx_l0': 4, 'context_size_yyx': 3, 'num_mix_components_yyx': 4, 'context_extractor_yyx': 'lstm', 'activation_func_yyx': 'ReLU', 'L2_weight_yyx': 1.2968234340903677e-05, 'L_entropy_weight_yyx': 1.378001886107047e-06, 'L_sep_weight_yyx': 2.735249622185979e-10, 'L_scale_weight_yyx': 0.00022074072860577655, 'learning_rate_yyx': 0.007115536101238053}. Best is trial 41 with value: -1.730878583570371.
[I 2026-03-18 19:57:57,047] Trial 39 pruned. 
[I 2026-03-18 19:58:01,189] Trial 30 pruned. 
[I 2026-03-18 19:58:01,758] Trial 46 pruned. 
[I 2026-03-18 19:58:02,105] Trial 42 pruned. 
[I 2026-03-18 19:58:04,587] Trial 40 pruned. 
[I 2026-03-18 19:58:06,024] Trial 41 finished with value: -1.674908822686096 and parameters: {'n_layers_yyx': 1, 'hidden_size_yyx_l0': 6, 'context_size_yyx': 4, 'num_mix_components_yyx': 5, 'context_extractor_yyx': 'gru', 'activation_func_yyx': 'ReLU', 'L2_weight_yyx': 1.0256913752453748e-06, 'L_entropy_weight_yyx': 1.0270282102810934e-05, 'L_sep_weight_yyx': 6.175300458683675e-10, 'L_scale_weight_yyx': 2.5479281037994413e-09, 'learning_rate_yyx': 0.007217074268634365}. Best is trial 13 with value: -1.6789194095140463.
[I 2026-03-18 19:58:07,149] Trial 30 pruned. 
[I 2026-03-18 19:58:07,433] Trial 23 pruned. 
[I 2026-03-18 19:58:07,489] Trial 32 pruned. 
[I 2026-03-18 19:58:12,088] Trial 43 pruned. 
[I 2026-03-18 19:58:12,270] Trial 31 finished with value: -2.022381762402845 and parameters: {'n_layers_yyx': 1, 'hidden_size_yyx_l0': 3, 'context_size_yyx': 3, 'num_mix_components_yyx': 4, 'context_extractor_yyx': 'gru', 'activation_func_yyx': 'Tanh', 'L2_weight_yyx': 6.32296550911892e-05, 'L_entropy_weight_yyx': 9.558245359051684e-05, 'L_sep_weight_yyx': 1.9391817331890406e-09, 'L_scale_weight_yyx': 0.00030450064727897665, 'learning_rate_yyx': 0.007643031447784937}. Best is trial 29 with value: -2.0228596854332306.
[I 2026-03-18 19:58:13,031] Trial 40 finished with value: -1.981662123185251 and parameters: {'n_layers_yyx': 2, 'hidden_size_yyx_l0': 4, 'hidden_size_yyx_l1': 6, 'context_size_yyx': 3, 'num_mix_components_yyx': 4, 'context_extractor_yyx': 'lstm', 'activation_func_yyx': 'Tanh', 'L2_weight_yyx': 1.23893885083371e-05, 'L_entropy_weight_yyx': 3.110330366023692e-07, 'L_sep_weight_yyx': 4.2060802509154615e-10, 'L_scale_weight_yyx': 8.428144245336447e-08, 'learning_rate_yyx': 0.006557125274780885}. Best is trial 1 with value: -1.9828018961884801.
[I 2026-03-18 19:58:14,547] Trial 42 pruned. 
[I 2026-03-18 19:58:14,671] Trial 35 finished with value: -1.6747009555976131 and parameters: {'n_layers_yyx': 1, 'hidden_size_yyx_l0': 5, 'context_size_yyx': 4, 'num_mix_components_yyx': 5, 'context_extractor_yyx': 'lstm', 'activation_func_yyx': 'Tanh', 'L2_weight_yyx': 2.009132002044937e-09, 'L_entropy_weight_yyx': 4.57731578667605e-05, 'L_sep_weight_yyx': 5.061743311525143e-10, 'L_scale_weight_yyx': 9.770587223998668e-07, 'learning_rate_yyx': 0.008643557845218301}. Best is trial 22 with value: -1.6797879616381284.
[I 2026-03-18 19:58:15,866] Trial 22 finished with value: -2.4928890835688082 and parameters: {'n_layers_yyx': 2, 'hidden_size_yyx_l0': 2, 'hidden_size_yyx_l1': 6, 'context_size_yyx': 1, 'num_mix_components_yyx': 5, 'context_extractor_yyx': 'gru', 'activation_func_yyx': 'GELU', 'L2_weight_yyx': 1.1269159268062345e-05, 'L_entropy_weight_yyx': 6.541221140177362e-10, 'L_sep_weight_yyx': 0.00014281206600939714, 'L_scale_weight_yyx': 0.0002031779618208254, 'learning_rate_yyx': 0.007729824571092674}. Best is trial 7 with value: -2.4950542279753494.
[I 2026-03-18 19:58:16,594] Trial 41 pruned. 
[I 2026-03-18 19:58:18,563] Trial 33 pruned. 
[I 2026-03-18 19:58:19,852] Trial 31 pruned. 
[I 2026-03-18 19:58:21,839] Trial 25 pruned. 
[I 2026-03-18 19:58:23,466] Trial 47 pruned. 
[I 2026-03-18 19:58:24,407] Trial 32 pruned. 
[I 2026-03-18 19:58:25,398] Trial 36 pruned. 
[I 2026-03-18 19:58:28,385] Trial 42 pruned. 
[I 2026-03-18 19:58:28,447] Trial 26 finished with value: -2.4960788622540644 and parameters: {'n_layers_yyx': 1, 'hidden_size_yyx_l0': 6, 'context_size_yyx': 4, 'num_mix_components_yyx': 2, 'context_extractor_yyx': 'lstm', 'activation_func_yyx': 'GELU', 'L2_weight_yyx': 2.4556010660317766e-07, 'L_entropy_weight_yyx': 0.00037550860551632944, 'L_sep_weight_yyx': 1.2920048396080424e-07, 'L_scale_weight_yyx': 6.555155707507765e-08, 'learning_rate_yyx': 0.0077114124420137676}. Best is trial 23 with value: -2.513824905841335.
[I 2026-03-18 19:58:30,149] Trial 24 finished with value: -2.0138113468986676 and parameters: {'n_layers_yyx': 1, 'hidden_size_yyx_l0': 6, 'context_size_yyx': 4, 'num_mix_components_yyx': 2, 'context_extractor_yyx': 'gru', 'activation_func_yyx': 'GELU', 'L2_weight_yyx': 1.3927630031639944e-05, 'L_entropy_weight_yyx': 8.945962598230522e-05, 'L_sep_weight_yyx': 5.6891014905158564e-05, 'L_scale_weight_yyx': 0.0007462196963005737, 'learning_rate_yyx': 0.0066718987966016925}. Best is trial 0 with value: -2.0138799336866504.
[I 2026-03-18 19:58:30,223] Trial 47 finished with value: -1.9817752715286772 and parameters: {'n_layers_yyx': 1, 'hidden_size_yyx_l0': 4, 'context_size_yyx': 4, 'num_mix_components_yyx': 4, 'context_extractor_yyx': 'gru', 'activation_func_yyx': 'Tanh', 'L2_weight_yyx': 1.6649252156546463e-05, 'L_entropy_weight_yyx': 4.987864409623168e-10, 'L_sep_weight_yyx': 7.074886613633377e-06, 'L_scale_weight_yyx': 3.331079622849533e-05, 'learning_rate_yyx': 0.00999890529017861}. Best is trial 11 with value: -1.9852781357200364.
[I 2026-03-18 19:58:30,910] Trial 48 pruned. 
[I 2026-03-18 19:58:31,059] Trial 24 pruned. 
[I 2026-03-18 19:58:32,333] Trial 32 pruned. 
[I 2026-03-18 19:58:39,155] Trial 34 pruned. 
[I 2026-03-18 19:58:40,642] Trial 40 pruned. 
[I 2026-03-18 19:58:42,814] Trial 49 pruned. 

Source events: 10752
Target events: 39192
Full model ln_yyx : 1352.47192 nats/sec, 31.05799 nats/event
Full model Log loss : -1.66853
Full model ln_yyx : 1339.80016 nats/sec, 30.76700 nats/event
Full model Log loss : -1.66354
Full model ln_yyx : 1339.79191 nats/sec, 30.76681 nats/event
Full model Log loss : -1.65939
Full model ln_yyx : 1349.14716 nats/sec, 30.98164 nats/event
Full model Log loss : -1.67342
Full model ln_yyx : 1345.68012 nats/sec, 30.90202 nats/event
Full model Log loss : -1.67229
Full model ln_yyx : 1349.99802 nats/sec, 31.00118 nats/event
Full model Log loss : -1.65686
Full model ln_yyx : 1354.35634 nats/sec, 31.10126 nats/event
Full model Log loss : -1.67250
Full model ln_yyx : 1352.70998 nats/sec, 31.06346 nats/event
Full model Log loss : -1.67588
Full model ln_yyx : 1347.69977 nats/sec, 30.94840 nats/event
Full model Log loss : -1.67158
Full model ln_yyx : 1357.09412 nats/sec, 31.16413 nats/event
Full model Log loss : -1.67190
Full model ln_yyx : 1356.61572 nats/sec, 31.15315 nats/event
Full model Log loss : -1.67213
Full model ln_yyx : 1351.68204 nats/sec, 31.03985 nats/event
Full model Log loss : -1.67197
Optimization finished. Config saved to results/opt-full/opt_full_310_best_config.txt
[I 2026-03-18 19:58:43,869] Trial 25 pruned. 
[I 2026-03-18 19:58:45,977] Trial 23 pruned. 
[I 2026-03-18 19:58:47,822] Trial 37 pruned. 
[I 2026-03-18 19:58:49,506] Trial 40 pruned. 
[I 2026-03-18 19:58:49,819] Trial 22 finished with value: -2.4968814889402684 and parameters: {'n_layers_yyx': 2, 'hidden_size_yyx_l0': 6, 'hidden_size_yyx_l1': 6, 'context_size_yyx': 4, 'num_mix_components_yyx': 4, 'context_extractor_yyx': 'gru', 'activation_func_yyx': 'ReLU', 'L2_weight_yyx': 2.744572742666314e-10, 'L_entropy_weight_yyx': 9.877962698803744e-10, 'L_sep_weight_yyx': 0.00012663377492429936, 'L_scale_weight_yyx': 0.00020572281054498308, 'learning_rate_yyx': 0.004647561279854283}. Best is trial 21 with value: -2.5132035092741223.
[I 2026-03-18 19:58:55,055] Trial 48 pruned. 
[I 2026-03-18 19:59:00,211] Trial 35 pruned. 
[I 2026-03-18 19:59:00,423] Trial 33 pruned. 
[I 2026-03-18 19:59:03,270] Trial 48 pruned. 
[I 2026-03-18 19:59:05,258] Trial 26 pruned. 
[I 2026-03-18 19:59:06,580] Trial 49 pruned. 

Source events: 18269
Target events: 31112
Full model ln_yyx : 2057.93120 nats/sec, 59.53131 nats/event
Full model Log loss : -1.95234
Full model ln_yyx : 2082.74397 nats/sec, 60.24909 nats/event
Full model Log loss : -1.98283
Full model ln_yyx : 2100.56870 nats/sec, 60.76472 nats/event
Full model Log loss : -1.97937
Full model ln_yyx : 2066.80787 nats/sec, 59.78809 nats/event
Full model Log loss : -1.98316
Full model ln_yyx : 2066.59200 nats/sec, 59.78185 nats/event
Full model Log loss : -1.98528
Full model ln_yyx : 2088.24342 nats/sec, 60.40817 nats/event
Full model Log loss : -1.98110
Full model ln_yyx : 2075.74534 nats/sec, 60.04663 nats/event
Full model Log loss : -1.98189
Full model ln_yyx : 2085.90627 nats/sec, 60.34056 nats/event
Full model Log loss : -1.98377
Full model ln_yyx : 2061.85630 nats/sec, 59.64485 nats/event
Full model Log loss : -1.98209
Full model ln_yyx : 2075.55856 nats/sec, 60.04123 nats/event
Full model Log loss : -1.98163
Full model ln_yyx : 2087.58166 nats/sec, 60.38903 nats/event
Full model Log loss : -1.98037
Full model ln_yyx : 2084.68377 nats/sec, 60.30520 nats/event
Full model Log loss : -1.98337
Full model ln_yyx : 2071.86916 nats/sec, 59.93450 nats/event
Full model Log loss : -1.98178
Optimization finished. Config saved to results/opt-full/opt_full_312_best_config.txt
[I 2026-03-18 19:59:06,949] Trial 43 pruned. 
[I 2026-03-18 19:59:07,512] Trial 38 pruned. 
[I 2026-03-18 19:59:07,674] Trial 26 pruned. 
[I 2026-03-18 19:59:08,841] Trial 21 finished with value: -2.5091374993369246 and parameters: {'n_layers_yyx': 1, 'hidden_size_yyx_l0': 5, 'context_size_yyx': 4, 'num_mix_components_yyx': 2, 'context_extractor_yyx': 'gru', 'activation_func_yyx': 'ReLU', 'L2_weight_yyx': 1.3672070166461214e-06, 'L_entropy_weight_yyx': 3.4610742758650326e-06, 'L_sep_weight_yyx': 1.0095183243875952e-08, 'L_scale_weight_yyx': 3.484578521616131e-07, 'learning_rate_yyx': 0.006799892401222194}. Best is trial 1 with value: -2.511856338115334.
[I 2026-03-18 19:59:10,507] Trial 41 pruned. 
[I 2026-03-18 19:59:14,109] Trial 26 pruned. 
[I 2026-03-18 19:59:14,118] Trial 21 finished with value: -2.5135727074032737 and parameters: {'n_layers_yyx': 1, 'hidden_size_yyx_l0': 4, 'context_size_yyx': 4, 'num_mix_components_yyx': 3, 'context_extractor_yyx': 'gru', 'activation_func_yyx': 'ReLU', 'L2_weight_yyx': 0.00017462713307002934, 'L_entropy_weight_yyx': 2.7439269225245646e-08, 'L_sep_weight_yyx': 0.0008873058100246512, 'L_scale_weight_yyx': 4.725990496744856e-10, 'learning_rate_yyx': 0.009350948705412433}. Best is trial 5 with value: -2.5140323195684524.
[I 2026-03-18 19:59:14,267] Trial 15 finished with value: -2.510781615865781 and parameters: {'n_layers_yyx': 1, 'hidden_size_yyx_l0': 6, 'context_size_yyx': 1, 'num_mix_components_yyx': 3, 'context_extractor_yyx': 'lstm', 'activation_func_yyx': 'Tanh', 'L2_weight_yyx': 3.339937507272744e-08, 'L_entropy_weight_yyx': 4.394458305244676e-09, 'L_sep_weight_yyx': 1.1021595333820991e-08, 'L_scale_weight_yyx': 1.0016110651886657e-08, 'learning_rate_yyx': 0.006667634128248348}. Best is trial 12 with value: -2.51518345292619.
[I 2026-03-18 19:59:14,984] Trial 48 pruned. 
[I 2026-03-18 19:59:19,222] Trial 28 finished with value: -2.5110013731973315 and parameters: {'n_layers_yyx': 1, 'hidden_size_yyx_l0': 5, 'context_size_yyx': 3, 'num_mix_components_yyx': 4, 'context_extractor_yyx': 'lstm', 'activation_func_yyx': 'Tanh', 'L2_weight_yyx': 1.2928142271325143e-05, 'L_entropy_weight_yyx': 0.00019680642211546918, 'L_sep_weight_yyx': 3.57791272003359e-08, 'L_scale_weight_yyx': 2.961109866564314e-08, 'learning_rate_yyx': 0.004874650235043538}. Best is trial 23 with value: -2.5132993257512335.
[I 2026-03-18 19:59:19,503] Trial 32 finished with value: -1.6813953661792613 and parameters: {'n_layers_yyx': 2, 'hidden_size_yyx_l0': 4, 'hidden_size_yyx_l1': 5, 'context_size_yyx': 3, 'num_mix_components_yyx': 5, 'context_extractor_yyx': 'lstm', 'activation_func_yyx': 'Tanh', 'L2_weight_yyx': 2.7133902111615367e-06, 'L_entropy_weight_yyx': 1.0429854940827321e-07, 'L_sep_weight_yyx': 2.7520232746645107e-10, 'L_scale_weight_yyx': 9.61638959351213e-08, 'learning_rate_yyx': 0.008227906099380884}. Best is trial 32 with value: -1.6813953661792613.
