[I 2026-03-18 19:19:50,196] Trial 8 finished with value: -2.7246290417070282 and parameters: {'n_layers_yyx': 1, 'hidden_size_yyx_l0': 5, 'context_size_yyx': 2, 'num_mix_components_yyx': 1, 'context_extractor_yyx': 'gru', 'activation_func_yyx': 'GELU', 'L2_weight_yyx': 0.00021700614366378825, 'L_entropy_weight_yyx': 3.5964460944101818e-09, 'L_sep_weight_yyx': 1.4236325410914633e-09, 'L_scale_weight_yyx': 1.5800348730503023e-07, 'learning_rate_yyx': 0.0008928514717653319}. Best is trial 0 with value: -2.7678615354442075.
[I 2026-03-18 19:19:50,563] Trial 7 finished with value: -2.760235046625448 and parameters: {'n_layers_yyx': 1, 'hidden_size_yyx_l0': 2, 'context_size_yyx': 2, 'num_mix_components_yyx': 1, 'context_extractor_yyx': 'gru', 'activation_func_yyx': 'GELU', 'L2_weight_yyx': 2.850237774475954e-08, 'L_entropy_weight_yyx': 0.0002267176587535183, 'L_sep_weight_yyx': 0.0005209214030775658, 'L_scale_weight_yyx': 3.56954033430094e-08, 'learning_rate_yyx': 0.001507893913461621}. Best is trial 1 with value: -2.766246985643131.
[I 2026-03-18 19:20:29,563] Trial 14 pruned. 
[I 2026-03-18 19:21:03,739] Trial 13 finished with value: -0.8291683675971658 and parameters: {'n_layers_yyx': 2, 'hidden_size_yyx_l0': 3, 'hidden_size_yyx_l1': 5, 'context_size_yyx': 1, 'num_mix_components_yyx': 4, 'context_extractor_yyx': 'lstm', 'activation_func_yyx': 'Tanh', 'L2_weight_yyx': 4.5582547337036266e-09, 'L_entropy_weight_yyx': 3.288434841372705e-10, 'L_sep_weight_yyx': 1.4545801121211693e-10, 'L_scale_weight_yyx': 5.149477030283898e-06, 'learning_rate_yyx': 0.001083337411830156}. Best is trial 1 with value: -0.8307161542478305.
[I 2026-03-18 19:22:22,155] Trial 8 finished with value: -2.7661304184127817 and parameters: {'n_layers_yyx': 2, 'hidden_size_yyx_l0': 6, 'hidden_size_yyx_l1': 6, 'context_size_yyx': 3, 'num_mix_components_yyx': 2, 'context_extractor_yyx': 'lstm', 'activation_func_yyx': 'Tanh', 'L2_weight_yyx': 1.436091062731638e-07, 'L_entropy_weight_yyx': 0.0006926592853825986, 'L_sep_weight_yyx': 4.01125808133524e-06, 'L_scale_weight_yyx': 8.004352178210478e-10, 'learning_rate_yyx': 0.004045659797496757}. Best is trial 8 with value: -2.7661304184127817.
[I 2026-03-18 19:22:22,308] Trial 21 pruned. 
[I 2026-03-18 19:22:46,213] Trial 11 pruned. 
[I 2026-03-18 19:23:35,213] Trial 5 finished with value: -0.8480365026296506 and parameters: {'n_layers_yyx': 2, 'hidden_size_yyx_l0': 3, 'hidden_size_yyx_l1': 4, 'context_size_yyx': 1, 'num_mix_components_yyx': 5, 'context_extractor_yyx': 'lstm', 'activation_func_yyx': 'Tanh', 'L2_weight_yyx': 5.285607274404086e-06, 'L_entropy_weight_yyx': 9.763412444062406e-07, 'L_sep_weight_yyx': 2.0401756459623802e-05, 'L_scale_weight_yyx': 1.8182735517505934e-09, 'learning_rate_yyx': 0.00436273636112201}. Best is trial 5 with value: -0.8480365026296506.
[I 2026-03-18 19:25:28,359] Trial 22 pruned. 
[I 2026-03-18 19:25:51,350] Trial 19 pruned. 
[I 2026-03-18 19:26:07,722] Trial 9 pruned. 
[I 2026-03-18 19:26:44,317] Trial 17 finished with value: -2.733071570501339 and parameters: {'n_layers_yyx': 2, 'hidden_size_yyx_l0': 5, 'hidden_size_yyx_l1': 2, 'context_size_yyx': 4, 'num_mix_components_yyx': 2, 'context_extractor_yyx': 'lstm', 'activation_func_yyx': 'GELU', 'L2_weight_yyx': 9.091782899380872e-06, 'L_entropy_weight_yyx': 0.00011442774864459283, 'L_sep_weight_yyx': 8.835032241786916e-05, 'L_scale_weight_yyx': 1.0140677678504726e-05, 'learning_rate_yyx': 0.004155986255267959}. Best is trial 1 with value: -2.766161832317774.
[I 2026-03-18 19:27:20,310] Trial 15 pruned. 
[I 2026-03-18 19:28:33,146] Trial 11 finished with value: -0.8086446426819839 and parameters: {'n_layers_yyx': 1, 'hidden_size_yyx_l0': 3, 'context_size_yyx': 3, 'num_mix_components_yyx': 4, 'context_extractor_yyx': 'gru', 'activation_func_yyx': 'Tanh', 'L2_weight_yyx': 1.6828352731027755e-08, 'L_entropy_weight_yyx': 3.723193662773124e-06, 'L_sep_weight_yyx': 1.6913978701500727e-08, 'L_scale_weight_yyx': 1.499448693213157e-08, 'learning_rate_yyx': 0.004560545578032401}. Best is trial 0 with value: -0.8180432904242061.
[I 2026-03-18 19:29:25,351] Trial 23 pruned. 
[I 2026-03-18 19:29:40,086] Trial 9 pruned. 
[I 2026-03-18 19:29:44,430] Trial 14 finished with value: -2.730037701142344 and parameters: {'n_layers_yyx': 1, 'hidden_size_yyx_l0': 5, 'context_size_yyx': 4, 'num_mix_components_yyx': 2, 'context_extractor_yyx': 'lstm', 'activation_func_yyx': 'Tanh', 'L2_weight_yyx': 2.2383595683301e-09, 'L_entropy_weight_yyx': 1.4571391014237893e-07, 'L_sep_weight_yyx': 4.705380916722197e-05, 'L_scale_weight_yyx': 3.38143926464237e-08, 'learning_rate_yyx': 0.0038921937148144138}. Best is trial 6 with value: -2.7665796528518882.
[I 2026-03-18 19:29:46,871] Trial 12 pruned. 
[I 2026-03-18 19:29:59,931] Trial 20 pruned. 
[I 2026-03-18 19:30:27,554] Trial 18 pruned. 
[I 2026-03-18 19:30:35,624] Trial 6 pruned. 
[I 2026-03-18 19:31:20,623] Trial 16 pruned. 
[I 2026-03-18 19:31:56,257] Trial 11 finished with value: -2.7629356025306495 and parameters: {'n_layers_yyx': 2, 'hidden_size_yyx_l0': 6, 'hidden_size_yyx_l1': 4, 'context_size_yyx': 3, 'num_mix_components_yyx': 4, 'context_extractor_yyx': 'lstm', 'activation_func_yyx': 'Tanh', 'L2_weight_yyx': 0.0009507574913331523, 'L_entropy_weight_yyx': 6.695283814430861e-06, 'L_sep_weight_yyx': 2.0346979877224105e-05, 'L_scale_weight_yyx': 6.608570235463105e-05, 'learning_rate_yyx': 0.005194288089759239}. Best is trial 3 with value: -2.764943250652336.
[I 2026-03-18 19:32:27,354] Trial 10 finished with value: -2.731241522541384 and parameters: {'n_layers_yyx': 2, 'hidden_size_yyx_l0': 6, 'hidden_size_yyx_l1': 6, 'context_size_yyx': 4, 'num_mix_components_yyx': 2, 'context_extractor_yyx': 'lstm', 'activation_func_yyx': 'ReLU', 'L2_weight_yyx': 3.475265202331935e-06, 'L_entropy_weight_yyx': 1.6962518656613462e-10, 'L_sep_weight_yyx': 0.0007554681272235721, 'L_scale_weight_yyx': 1.6508789653694327e-10, 'learning_rate_yyx': 0.009682151150789926}. Best is trial 0 with value: -2.76381727105261.
[I 2026-03-18 19:33:14,564] Trial 24 pruned. 
[I 2026-03-18 19:33:41,025] Trial 10 pruned. 
[I 2026-03-18 19:33:47,628] Trial 10 pruned. 
[I 2026-03-18 19:34:03,166] Trial 15 pruned. 
[I 2026-03-18 19:34:08,044] Trial 21 pruned. 
[I 2026-03-18 19:34:44,377] Trial 12 finished with value: -2.731820487976074 and parameters: {'n_layers_yyx': 2, 'hidden_size_yyx_l0': 4, 'hidden_size_yyx_l1': 2, 'context_size_yyx': 4, 'num_mix_components_yyx': 4, 'context_extractor_yyx': 'lstm', 'activation_func_yyx': 'GELU', 'L2_weight_yyx': 2.8335223589753446e-08, 'L_entropy_weight_yyx': 2.6375325758866906e-08, 'L_sep_weight_yyx': 1.5459319931906575e-05, 'L_scale_weight_yyx': 4.2670777434810596e-05, 'learning_rate_yyx': 0.004337521186882764}. Best is trial 3 with value: -2.7657987594604494.
[I 2026-03-18 19:35:34,666] Trial 8 finished with value: -2.7651471750675345 and parameters: {'n_layers_yyx': 1, 'hidden_size_yyx_l0': 6, 'context_size_yyx': 4, 'num_mix_components_yyx': 4, 'context_extractor_yyx': 'lstm', 'activation_func_yyx': 'ReLU', 'L2_weight_yyx': 1.5581967922475502e-10, 'L_entropy_weight_yyx': 5.11733186641404e-08, 'L_sep_weight_yyx': 5.764999465518254e-05, 'L_scale_weight_yyx': 2.5813374240929813e-09, 'learning_rate_yyx': 0.00337055852135721}. Best is trial 1 with value: -2.76558573285036.
[I 2026-03-18 19:35:44,957] Trial 5 finished with value: -2.3927098431585994 and parameters: {'n_layers_yyx': 2, 'hidden_size_yyx_l0': 6, 'hidden_size_yyx_l1': 6, 'context_size_yyx': 1, 'num_mix_components_yyx': 4, 'context_extractor_yyx': 'lstm', 'activation_func_yyx': 'Tanh', 'L2_weight_yyx': 2.253674290047753e-08, 'L_entropy_weight_yyx': 0.0003372750746979628, 'L_sep_weight_yyx': 6.228580781570513e-05, 'L_scale_weight_yyx': 9.141518981296936e-06, 'learning_rate_yyx': 0.0054144858113109925}. Best is trial 2 with value: -2.39978509736055.
[I 2026-03-18 19:37:13,616] Trial 25 pruned. 
[I 2026-03-18 19:37:13,998] Trial 13 pruned. 
[I 2026-03-18 19:37:37,045] Trial 14 pruned. 
[I 2026-03-18 19:37:45,036] Trial 11 pruned. 
[I 2026-03-18 19:38:02,761] Trial 7 pruned. 
[I 2026-03-18 19:38:07,470] Trial 11 pruned. 
[I 2026-03-18 19:38:19,364] Trial 19 pruned. 
[I 2026-03-18 19:39:38,176] Trial 6 finished with value: -2.406664661525451 and parameters: {'n_layers_yyx': 2, 'hidden_size_yyx_l0': 4, 'hidden_size_yyx_l1': 6, 'context_size_yyx': 1, 'num_mix_components_yyx': 4, 'context_extractor_yyx': 'lstm', 'activation_func_yyx': 'ReLU', 'L2_weight_yyx': 3.9018062963406176e-10, 'L_entropy_weight_yyx': 2.386590097165687e-09, 'L_sep_weight_yyx': 1.415270685752601e-09, 'L_scale_weight_yyx': 2.274240626721297e-06, 'learning_rate_yyx': 0.0026240759133776045}. Best is trial 2 with value: -2.407757820050741.
[I 2026-03-18 19:39:52,804] Trial 6 pruned. 
[I 2026-03-18 19:40:09,501] Trial 11 pruned. 
[I 2026-03-18 19:41:52,502] Trial 8 finished with value: -2.764600633518841 and parameters: {'n_layers_yyx': 2, 'hidden_size_yyx_l0': 6, 'hidden_size_yyx_l1': 2, 'context_size_yyx': 3, 'num_mix_components_yyx': 4, 'context_extractor_yyx': 'lstm', 'activation_func_yyx': 'ReLU', 'L2_weight_yyx': 2.132303086418913e-09, 'L_entropy_weight_yyx': 0.00022253433833860703, 'L_sep_weight_yyx': 1.1689157290161635e-10, 'L_scale_weight_yyx': 4.2175684733568544e-07, 'learning_rate_yyx': 0.007493456268284184}. Best is trial 7 with value: -2.766072426816335.
[I 2026-03-18 19:42:14,701] Trial 12 pruned. 
[I 2026-03-18 19:42:30,954] Trial 20 pruned. 
[I 2026-03-18 19:43:07,072] Trial 10 finished with value: -2.539561611084186 and parameters: {'n_layers_yyx': 1, 'hidden_size_yyx_l0': 4, 'context_size_yyx': 4, 'num_mix_components_yyx': 2, 'context_extractor_yyx': 'lstm', 'activation_func_yyx': 'GELU', 'L2_weight_yyx': 2.2471649123571127e-10, 'L_entropy_weight_yyx': 3.036808665063706e-06, 'L_sep_weight_yyx': 2.5502283847152242e-06, 'L_scale_weight_yyx': 2.2287292440241397e-06, 'learning_rate_yyx': 0.009221301863010655}. Best is trial 6 with value: -2.5462433457735516.
[I 2026-03-18 19:43:12,492] Trial 9 pruned. 
[I 2026-03-18 19:43:55,464] Trial 7 pruned. 
[I 2026-03-18 19:43:56,762] Trial 7 pruned. 
[I 2026-03-18 19:45:07,662] Trial 9 finished with value: -2.765185642429061 and parameters: {'n_layers_yyx': 1, 'hidden_size_yyx_l0': 4, 'context_size_yyx': 1, 'num_mix_components_yyx': 4, 'context_extractor_yyx': 'lstm', 'activation_func_yyx': 'Tanh', 'L2_weight_yyx': 9.239693095166725e-08, 'L_entropy_weight_yyx': 2.8648804543276497e-05, 'L_sep_weight_yyx': 1.5386951708071505e-10, 'L_scale_weight_yyx': 4.247407684172393e-09, 'learning_rate_yyx': 0.005562604464168229}. Best is trial 9 with value: -2.765185642429061.
[I 2026-03-18 19:45:22,366] Trial 26 pruned. 
[I 2026-03-18 19:46:06,177] Trial 9 pruned. 
[I 2026-03-18 19:48:03,673] Trial 12 pruned. 
[I 2026-03-18 19:48:22,981] Trial 10 pruned. 
[I 2026-03-18 19:49:17,581] Trial 12 finished with value: -2.399275110123005 and parameters: {'n_layers_yyx': 2, 'hidden_size_yyx_l0': 5, 'hidden_size_yyx_l1': 6, 'context_size_yyx': 1, 'num_mix_components_yyx': 2, 'context_extractor_yyx': 'lstm', 'activation_func_yyx': 'Tanh', 'L2_weight_yyx': 1.402578453464722e-06, 'L_entropy_weight_yyx': 1.7402646571068743e-06, 'L_sep_weight_yyx': 0.0006384902545739728, 'L_scale_weight_yyx': 4.576574036004226e-09, 'learning_rate_yyx': 0.0035538377231026045}. Best is trial 11 with value: -2.4030680672323603.
[I 2026-03-18 19:49:30,198] Trial 17 pruned. 
[I 2026-03-18 19:50:01,522] Trial 10 pruned. 
[I 2026-03-18 19:50:17,260] Trial 22 finished with value: -2.724197567210478 and parameters: {'n_layers_yyx': 2, 'hidden_size_yyx_l0': 4, 'hidden_size_yyx_l1': 4, 'context_size_yyx': 3, 'num_mix_components_yyx': 2, 'context_extractor_yyx': 'lstm', 'activation_func_yyx': 'ReLU', 'L2_weight_yyx': 9.346315394592108e-10, 'L_entropy_weight_yyx': 4.5009798627024835e-09, 'L_sep_weight_yyx': 0.00016654172868079515, 'L_scale_weight_yyx': 1.0135322073492621e-08, 'learning_rate_yyx': 0.005304624540528353}. Best is trial 15 with value: -2.7581294911430483.
[I 2026-03-18 19:50:19,266] Trial 12 pruned. 
[I 2026-03-18 19:50:27,672] Trial 11 pruned. 
[I 2026-03-18 19:51:04,257] Trial 10 pruned. 
[I 2026-03-18 19:51:18,916] Trial 8 pruned. 
[I 2026-03-18 19:51:25,070] Trial 9 finished with value: -2.384372141371621 and parameters: {'n_layers_yyx': 2, 'hidden_size_yyx_l0': 6, 'hidden_size_yyx_l1': 5, 'context_size_yyx': 4, 'num_mix_components_yyx': 4, 'context_extractor_yyx': 'lstm', 'activation_func_yyx': 'Tanh', 'L2_weight_yyx': 6.059076949131388e-10, 'L_entropy_weight_yyx': 3.5381081148168714e-06, 'L_sep_weight_yyx': 7.662860438175837e-08, 'L_scale_weight_yyx': 1.1143642975114571e-10, 'learning_rate_yyx': 0.0015849587822554267}. Best is trial 4 with value: -2.393031095621557.
[I 2026-03-18 19:51:44,377] Trial 16 pruned. 
[I 2026-03-18 19:52:21,239] Trial 6 finished with value: -2.4106829240783707 and parameters: {'n_layers_yyx': 2, 'hidden_size_yyx_l0': 2, 'hidden_size_yyx_l1': 4, 'context_size_yyx': 4, 'num_mix_components_yyx': 5, 'context_extractor_yyx': 'gru', 'activation_func_yyx': 'GELU', 'L2_weight_yyx': 0.0008638082775766553, 'L_entropy_weight_yyx': 5.660162666921247e-05, 'L_sep_weight_yyx': 6.330439269810216e-06, 'L_scale_weight_yyx': 3.6954824378501824e-06, 'learning_rate_yyx': 0.008928593742628724}. Best is trial 2 with value: -2.4109094575005234.
[I 2026-03-18 19:52:40,587] Trial 18 pruned. 
[I 2026-03-18 19:53:08,311] Trial 15 pruned. 
[I 2026-03-18 19:53:09,836] Trial 12 pruned. 
[I 2026-03-18 19:53:23,978] Trial 11 pruned. 
[I 2026-03-18 19:53:26,245] Trial 11 pruned. 
[I 2026-03-18 19:53:29,081] Trial 13 pruned. 
[I 2026-03-18 19:53:33,098] Trial 17 pruned. 
[I 2026-03-18 19:53:43,853] Trial 16 pruned. 
[I 2026-03-18 19:53:54,105] Trial 10 pruned. 
[I 2026-03-18 19:54:03,328] Trial 13 pruned. 
[I 2026-03-18 19:54:07,177] Trial 13 finished with value: -2.7637028058369952 and parameters: {'n_layers_yyx': 2, 'hidden_size_yyx_l0': 6, 'hidden_size_yyx_l1': 5, 'context_size_yyx': 3, 'num_mix_components_yyx': 3, 'context_extractor_yyx': 'gru', 'activation_func_yyx': 'Tanh', 'L2_weight_yyx': 0.0008060168588419768, 'L_entropy_weight_yyx': 5.852652110209325e-07, 'L_sep_weight_yyx': 8.612020915536802e-09, 'L_scale_weight_yyx': 2.013519384260579e-08, 'learning_rate_yyx': 0.009827447705015539}. Best is trial 3 with value: -2.7657987594604494.
[I 2026-03-18 19:54:18,988] Trial 17 pruned. 
[I 2026-03-18 19:54:24,442] Trial 7 finished with value: -2.7626721708316366 and parameters: {'n_layers_yyx': 2, 'hidden_size_yyx_l0': 5, 'hidden_size_yyx_l1': 2, 'context_size_yyx': 3, 'num_mix_components_yyx': 4, 'context_extractor_yyx': 'gru', 'activation_func_yyx': 'Tanh', 'L2_weight_yyx': 0.0004134108862790734, 'L_entropy_weight_yyx': 5.024472548594294e-10, 'L_sep_weight_yyx': 0.00042902924010558595, 'L_scale_weight_yyx': 6.45377275804348e-09, 'learning_rate_yyx': 0.0016685121528850692}. Best is trial 7 with value: -2.7626721708316366.
[I 2026-03-18 19:54:27,878] Trial 8 pruned. 
[I 2026-03-18 19:54:29,213] Trial 19 pruned. 
[I 2026-03-18 19:54:29,651] Trial 21 pruned. 
[I 2026-03-18 19:54:30,429] Trial 5 finished with value: -2.394261756310096 and parameters: {'n_layers_yyx': 1, 'hidden_size_yyx_l0': 6, 'context_size_yyx': 3, 'num_mix_components_yyx': 3, 'context_extractor_yyx': 'gru', 'activation_func_yyx': 'Tanh', 'L2_weight_yyx': 2.5601871183124238e-05, 'L_entropy_weight_yyx': 2.5912165622485685e-08, 'L_sep_weight_yyx': 8.137009475561562e-06, 'L_scale_weight_yyx': 1.064560143185735e-06, 'learning_rate_yyx': 0.0010324203692567042}. Best is trial 5 with value: -2.394261756310096.
[I 2026-03-18 19:54:49,378] Trial 14 pruned. 
[I 2026-03-18 19:54:51,330] Trial 12 pruned. 
[I 2026-03-18 19:55:09,767] Trial 8 pruned. 
[I 2026-03-18 19:55:15,911] Trial 12 finished with value: -0.822893917472535 and parameters: {'n_layers_yyx': 1, 'hidden_size_yyx_l0': 4, 'context_size_yyx': 3, 'num_mix_components_yyx': 4, 'context_extractor_yyx': 'gru', 'activation_func_yyx': 'Tanh', 'L2_weight_yyx': 3.4435151288061867e-07, 'L_entropy_weight_yyx': 6.176152514894944e-06, 'L_sep_weight_yyx': 1.9292075234944616e-10, 'L_scale_weight_yyx': 2.7741357050519462e-08, 'learning_rate_yyx': 0.005152352175424194}. Best is trial 12 with value: -0.822893917472535.
[I 2026-03-18 19:55:49,623] Trial 9 pruned. 
[I 2026-03-18 19:55:49,816] Trial 14 finished with value: -2.7990203233567716 and parameters: {'n_layers_yyx': 1, 'hidden_size_yyx_l0': 5, 'context_size_yyx': 2, 'num_mix_components_yyx': 4, 'context_extractor_yyx': 'gru', 'activation_func_yyx': 'Tanh', 'L2_weight_yyx': 1.0098457501659126e-10, 'L_entropy_weight_yyx': 0.000465783227035099, 'L_sep_weight_yyx': 6.775976704470766e-08, 'L_scale_weight_yyx': 1.2049345944178044e-10, 'learning_rate_yyx': 0.002875845296915562}. Best is trial 0 with value: -2.8001684201127572.
[I 2026-03-18 19:55:59,864] Trial 20 pruned. 
[I 2026-03-18 19:56:03,415] Trial 22 pruned. 
[I 2026-03-18 19:56:14,414] Trial 14 finished with value: -0.8118919924759971 and parameters: {'n_layers_yyx': 1, 'hidden_size_yyx_l0': 5, 'context_size_yyx': 3, 'num_mix_components_yyx': 4, 'context_extractor_yyx': 'lstm', 'activation_func_yyx': 'GELU', 'L2_weight_yyx': 1.6661597241922264e-07, 'L_entropy_weight_yyx': 7.552655047529117e-05, 'L_sep_weight_yyx': 0.0006160217997629785, 'L_scale_weight_yyx': 4.013476772882067e-06, 'learning_rate_yyx': 0.0033379402138204095}. Best is trial 4 with value: -0.8236861799457048.
[I 2026-03-18 19:56:20,975] Trial 15 pruned. 
[I 2026-03-18 19:56:21,725] Trial 7 finished with value: -2.3803608032132155 and parameters: {'n_layers_yyx': 1, 'hidden_size_yyx_l0': 4, 'context_size_yyx': 4, 'num_mix_components_yyx': 1, 'context_extractor_yyx': 'lstm', 'activation_func_yyx': 'Tanh', 'L2_weight_yyx': 3.014957709442966e-10, 'L_entropy_weight_yyx': 4.252585952687679e-05, 'L_sep_weight_yyx': 1.6707420048420512e-09, 'L_scale_weight_yyx': 4.8594028331604755e-06, 'learning_rate_yyx': 0.009801909229041356}. Best is trial 2 with value: -2.4109094575005234.
[I 2026-03-18 19:56:30,720] Trial 10 pruned. 
[I 2026-03-18 19:56:35,169] Trial 8 finished with value: -2.7229950833550403 and parameters: {'n_layers_yyx': 2, 'hidden_size_yyx_l0': 2, 'hidden_size_yyx_l1': 2, 'context_size_yyx': 1, 'num_mix_components_yyx': 3, 'context_extractor_yyx': 'lstm', 'activation_func_yyx': 'Tanh', 'L2_weight_yyx': 6.159142456207231e-07, 'L_entropy_weight_yyx': 2.018213955081515e-05, 'L_sep_weight_yyx': 3.885518842338152e-06, 'L_scale_weight_yyx': 1.9607441437448263e-10, 'learning_rate_yyx': 0.002632289654984979}. Best is trial 2 with value: -2.7647061180279695.
[I 2026-03-18 19:56:38,342] Trial 15 pruned. 
[I 2026-03-18 19:56:54,003] Trial 15 pruned. 
[I 2026-03-18 19:57:04,618] Trial 8 pruned. 
[I 2026-03-18 19:57:07,840] Trial 12 pruned. 
[I 2026-03-18 19:57:11,680] Trial 18 pruned. 
[I 2026-03-18 19:57:22,256] Trial 18 pruned. 
[I 2026-03-18 19:57:23,962] Trial 16 pruned. 
[I 2026-03-18 19:57:32,474] Trial 21 pruned. 
[I 2026-03-18 19:57:57,143] Trial 23 finished with value: -2.762432828689004 and parameters: {'n_layers_yyx': 2, 'hidden_size_yyx_l0': 2, 'hidden_size_yyx_l1': 5, 'context_size_yyx': 3, 'num_mix_components_yyx': 3, 'context_extractor_yyx': 'lstm', 'activation_func_yyx': 'Tanh', 'L2_weight_yyx': 5.4674415405265896e-05, 'L_entropy_weight_yyx': 6.9013836376161855e-09, 'L_sep_weight_yyx': 8.166543568591042e-07, 'L_scale_weight_yyx': 1.2137073328635653e-09, 'learning_rate_yyx': 0.00825465081525871}. Best is trial 23 with value: -2.762432828689004.
[I 2026-03-18 19:58:04,559] Trial 9 finished with value: -0.8056491868710765 and parameters: {'n_layers_yyx': 2, 'hidden_size_yyx_l0': 2, 'hidden_size_yyx_l1': 4, 'context_size_yyx': 1, 'num_mix_components_yyx': 3, 'context_extractor_yyx': 'gru', 'activation_func_yyx': 'Tanh', 'L2_weight_yyx': 4.884160301883831e-09, 'L_entropy_weight_yyx': 0.0009987501984797683, 'L_sep_weight_yyx': 1.8328677802909305e-09, 'L_scale_weight_yyx': 8.471848184219365e-06, 'learning_rate_yyx': 0.001324311546240052}. Best is trial 7 with value: -0.830295985347235.
[I 2026-03-18 19:58:08,302] Trial 12 finished with value: -2.390665058760425 and parameters: {'n_layers_yyx': 1, 'hidden_size_yyx_l0': 5, 'context_size_yyx': 1, 'num_mix_components_yyx': 1, 'context_extractor_yyx': 'lstm', 'activation_func_yyx': 'Tanh', 'L2_weight_yyx': 4.4532665231817406e-05, 'L_entropy_weight_yyx': 5.780503098370268e-08, 'L_sep_weight_yyx': 1.2568578997933136e-10, 'L_scale_weight_yyx': 2.548156925993094e-07, 'learning_rate_yyx': 0.005181012767752276}. Best is trial 9 with value: -2.4237415519893895.
[I 2026-03-18 19:58:09,323] Trial 17 pruned. 
[I 2026-03-18 19:58:10,941] Trial 8 pruned. 
[I 2026-03-18 19:58:27,526] Trial 8 finished with value: -2.4273341123673466 and parameters: {'n_layers_yyx': 1, 'hidden_size_yyx_l0': 4, 'context_size_yyx': 2, 'num_mix_components_yyx': 2, 'context_extractor_yyx': 'gru', 'activation_func_yyx': 'GELU', 'L2_weight_yyx': 1.3676705203457568e-08, 'L_entropy_weight_yyx': 4.5883661896499807e-07, 'L_sep_weight_yyx': 2.0466783602627224e-05, 'L_scale_weight_yyx': 6.854276821127899e-10, 'learning_rate_yyx': 0.007584812244387113}. Best is trial 0 with value: -2.431222564426635.
[I 2026-03-18 19:58:27,880] Trial 9 pruned. 
[I 2026-03-18 19:58:36,409] Trial 13 pruned. 
[I 2026-03-18 19:58:39,732] Trial 27 finished with value: -2.3931108595102857 and parameters: {'n_layers_yyx': 1, 'hidden_size_yyx_l0': 4, 'context_size_yyx': 4, 'num_mix_components_yyx': 5, 'context_extractor_yyx': 'gru', 'activation_func_yyx': 'Tanh', 'L2_weight_yyx': 7.556274300070013e-08, 'L_entropy_weight_yyx': 1.0871425795488686e-10, 'L_sep_weight_yyx': 3.510863913347997e-07, 'L_scale_weight_yyx': 2.5065674428361516e-07, 'learning_rate_yyx': 0.0041225290949204445}. Best is trial 0 with value: -2.4076941594397367.
[I 2026-03-18 19:58:43,900] Trial 10 pruned. 
[I 2026-03-18 19:58:45,391] Trial 19 pruned. 
[I 2026-03-18 19:58:50,920] Trial 13 pruned. 
