[I 2026-03-18 19:42:34,267] Trial 32 finished with value: -1.6619963425006645 and parameters: {'n_layers_yyx': 2, 'hidden_size_yyx_l0': 6, 'hidden_size_yyx_l1': 6, 'context_size_yyx': 4, 'num_mix_components_yyx': 3, 'context_extractor_yyx': 'gru', 'activation_func_yyx': 'Tanh', 'L2_weight_yyx': 4.880982896014236e-08, 'L_entropy_weight_yyx': 1.0347966243323215e-05, 'L_sep_weight_yyx': 4.84598591851829e-09, 'L_scale_weight_yyx': 2.0225868892097043e-09, 'learning_rate_yyx': 0.009905692355837116}. Best is trial 23 with value: -1.668135777403489.
[I 2026-03-18 19:42:35,462] Trial 18 pruned. 
[I 2026-03-18 19:42:35,801] Trial 23 pruned. 
[I 2026-03-18 19:42:36,266] Trial 17 pruned. 
[I 2026-03-18 19:42:40,620] Trial 13 finished with value: -2.500515782756654 and parameters: {'n_layers_yyx': 2, 'hidden_size_yyx_l0': 4, 'hidden_size_yyx_l1': 3, 'context_size_yyx': 3, 'num_mix_components_yyx': 4, 'context_extractor_yyx': 'lstm', 'activation_func_yyx': 'Tanh', 'L2_weight_yyx': 1.4252014422565598e-06, 'L_entropy_weight_yyx': 1.2905392494026866e-08, 'L_sep_weight_yyx': 1.148533452194856e-08, 'L_scale_weight_yyx': 5.842325259578711e-09, 'learning_rate_yyx': 0.0010661830330973955}. Best is trial 1 with value: -2.511856338115334.
[I 2026-03-18 19:42:50,102] Trial 15 pruned. 
[I 2026-03-18 19:42:50,511] Trial 18 pruned. 
[I 2026-03-18 19:42:51,510] Trial 31 pruned. 
[I 2026-03-18 19:42:56,372] Trial 11 finished with value: -2.034964821555398 and parameters: {'n_layers_yyx': 1, 'hidden_size_yyx_l0': 6, 'context_size_yyx': 4, 'num_mix_components_yyx': 4, 'context_extractor_yyx': 'lstm', 'activation_func_yyx': 'ReLU', 'L2_weight_yyx': 4.798273790456054e-10, 'L_entropy_weight_yyx': 3.175611794829425e-06, 'L_sep_weight_yyx': 8.536362515418411e-09, 'L_scale_weight_yyx': 2.8265586323238308e-08, 'learning_rate_yyx': 0.0065453108382046935}. Best is trial 8 with value: -2.0365283470022115.
[I 2026-03-18 19:42:56,400] Trial 14 pruned. 
[I 2026-03-18 19:42:57,495] Trial 29 finished with value: -1.697610248515358 and parameters: {'n_layers_yyx': 1, 'hidden_size_yyx_l0': 2, 'context_size_yyx': 4, 'num_mix_components_yyx': 5, 'context_extractor_yyx': 'lstm', 'activation_func_yyx': 'Tanh', 'L2_weight_yyx': 1.7382453059898463e-05, 'L_entropy_weight_yyx': 1.2659374724023984e-09, 'L_sep_weight_yyx': 2.711393806765855e-06, 'L_scale_weight_yyx': 5.441342884524306e-09, 'learning_rate_yyx': 0.007616800082561253}. Best is trial 18 with value: -1.7002973458681911.
[I 2026-03-18 19:43:00,380] Trial 32 pruned. 
[I 2026-03-18 19:43:01,464] Trial 21 finished with value: -1.6743329518807157 and parameters: {'n_layers_yyx': 1, 'hidden_size_yyx_l0': 5, 'context_size_yyx': 4, 'num_mix_components_yyx': 5, 'context_extractor_yyx': 'gru', 'activation_func_yyx': 'GELU', 'L2_weight_yyx': 1.0829189798356685e-08, 'L_entropy_weight_yyx': 3.963153509312245e-09, 'L_sep_weight_yyx': 3.855341044333576e-09, 'L_scale_weight_yyx': 2.622936949950174e-10, 'learning_rate_yyx': 0.009294952116144095}. Best is trial 15 with value: -1.67837664463496.
[I 2026-03-18 19:43:04,550] Trial 16 pruned. 
[I 2026-03-18 19:43:07,625] Trial 19 pruned. 
[I 2026-03-18 19:43:16,201] Trial 13 finished with value: -2.4929275467309266 and parameters: {'n_layers_yyx': 2, 'hidden_size_yyx_l0': 2, 'hidden_size_yyx_l1': 6, 'context_size_yyx': 1, 'num_mix_components_yyx': 4, 'context_extractor_yyx': 'gru', 'activation_func_yyx': 'GELU', 'L2_weight_yyx': 0.0009900695629818505, 'L_entropy_weight_yyx': 3.0847072599698295e-10, 'L_sep_weight_yyx': 0.00010358433581798878, 'L_scale_weight_yyx': 0.0008121325701855995, 'learning_rate_yyx': 0.009315551530071613}. Best is trial 7 with value: -2.4950542279753494.
[I 2026-03-18 19:43:27,019] Trial 19 pruned. 
[I 2026-03-18 19:43:33,585] Trial 15 finished with value: -2.5039785932200824 and parameters: {'n_layers_yyx': 1, 'hidden_size_yyx_l0': 5, 'context_size_yyx': 4, 'num_mix_components_yyx': 4, 'context_extractor_yyx': 'lstm', 'activation_func_yyx': 'Tanh', 'L2_weight_yyx': 4.743670623964804e-10, 'L_entropy_weight_yyx': 3.445154398458399e-05, 'L_sep_weight_yyx': 7.317121575365818e-05, 'L_scale_weight_yyx': 1.1071166406952368e-06, 'learning_rate_yyx': 0.00663907473984129}. Best is trial 15 with value: -2.5039785932200824.
[I 2026-03-18 19:43:35,634] Trial 12 pruned. 
[I 2026-03-18 19:43:36,440] Trial 25 finished with value: -1.6711568910304542 and parameters: {'n_layers_yyx': 1, 'hidden_size_yyx_l0': 6, 'context_size_yyx': 3, 'num_mix_components_yyx': 4, 'context_extractor_yyx': 'lstm', 'activation_func_yyx': 'ReLU', 'L2_weight_yyx': 0.0009143715105698917, 'L_entropy_weight_yyx': 2.4282219116752194e-06, 'L_sep_weight_yyx': 3.335727821548719e-05, 'L_scale_weight_yyx': 1.8727221213655474e-09, 'learning_rate_yyx': 0.009529254889283988}. Best is trial 13 with value: -1.6789194095140463.
[I 2026-03-18 19:43:38,091] Trial 14 pruned. 
[I 2026-03-18 19:43:39,092] Trial 12 finished with value: -2.5110428417324457 and parameters: {'n_layers_yyx': 2, 'hidden_size_yyx_l0': 4, 'hidden_size_yyx_l1': 2, 'context_size_yyx': 3, 'num_mix_components_yyx': 4, 'context_extractor_yyx': 'lstm', 'activation_func_yyx': 'GELU', 'L2_weight_yyx': 3.165764677365587e-05, 'L_entropy_weight_yyx': 1.998916653283248e-06, 'L_sep_weight_yyx': 0.00012836399294028042, 'L_scale_weight_yyx': 1.32596838842759e-08, 'learning_rate_yyx': 0.004107837753523236}. Best is trial 1 with value: -2.5125601952756833.
[I 2026-03-18 19:43:46,658] Trial 20 pruned. 
[I 2026-03-18 19:43:47,166] Trial 20 pruned. 
[I 2026-03-18 19:43:47,565] Trial 35 finished with value: -1.6715790044224532 and parameters: {'n_layers_yyx': 2, 'hidden_size_yyx_l0': 6, 'hidden_size_yyx_l1': 5, 'context_size_yyx': 3, 'num_mix_components_yyx': 5, 'context_extractor_yyx': 'lstm', 'activation_func_yyx': 'Tanh', 'L2_weight_yyx': 8.62375529801669e-06, 'L_entropy_weight_yyx': 0.0008915187397245581, 'L_sep_weight_yyx': 1.7980958885136595e-06, 'L_scale_weight_yyx': 2.2614307193824564e-05, 'learning_rate_yyx': 0.008140746988089677}. Best is trial 30 with value: -1.6758763736283075.
[I 2026-03-18 19:43:50,861] Trial 30 pruned. 
[I 2026-03-18 19:43:54,448] Trial 13 pruned. 
[I 2026-03-18 19:43:54,742] Trial 26 pruned. 
[I 2026-03-18 19:43:55,528] Trial 33 pruned. 
[I 2026-03-18 19:43:57,625] Trial 23 pruned. 
[I 2026-03-18 19:44:02,386] Trial 13 pruned. 
[I 2026-03-18 19:44:13,989] Trial 32 pruned. 
[I 2026-03-18 19:44:14,793] Trial 34 pruned. 
[I 2026-03-18 19:44:22,189] Trial 14 pruned. 
[I 2026-03-18 19:44:23,689] Trial 31 pruned. 
[I 2026-03-18 19:44:26,676] Trial 21 pruned. 
[I 2026-03-18 19:44:28,538] Trial 27 pruned. 
[I 2026-03-18 19:44:30,155] Trial 33 pruned. 
[I 2026-03-18 19:44:42,659] Trial 32 pruned. 
[I 2026-03-18 19:44:47,541] Trial 28 pruned. 
[I 2026-03-18 19:44:47,610] Trial 34 pruned. 
[I 2026-03-18 19:44:54,829] Trial 28 pruned. 
[I 2026-03-18 19:45:07,320] Trial 22 pruned. 
[I 2026-03-18 19:45:11,161] Trial 29 pruned. 
[I 2026-03-18 19:45:12,157] Trial 26 finished with value: -2.111894999126998 and parameters: {'n_layers_yyx': 1, 'hidden_size_yyx_l0': 4, 'context_size_yyx': 3, 'num_mix_components_yyx': 3, 'context_extractor_yyx': 'lstm', 'activation_func_yyx': 'Tanh', 'L2_weight_yyx': 8.132708155615627e-08, 'L_entropy_weight_yyx': 2.353436305223005e-09, 'L_sep_weight_yyx': 1.223305623374966e-07, 'L_scale_weight_yyx': 1.4052798050152992e-05, 'learning_rate_yyx': 0.0019140032741608469}. Best is trial 0 with value: -2.1143376288427875.
[I 2026-03-18 19:45:12,179] Trial 23 finished with value: -2.5132993257512335 and parameters: {'n_layers_yyx': 1, 'hidden_size_yyx_l0': 6, 'context_size_yyx': 1, 'num_mix_components_yyx': 5, 'context_extractor_yyx': 'lstm', 'activation_func_yyx': 'ReLU', 'L2_weight_yyx': 7.152836236627759e-05, 'L_entropy_weight_yyx': 1.568497532659425e-07, 'L_sep_weight_yyx': 2.384002469382529e-09, 'L_scale_weight_yyx': 5.309772400884018e-08, 'learning_rate_yyx': 0.007175906358110819}. Best is trial 23 with value: -2.5132993257512335.
[I 2026-03-18 19:45:12,476] Trial 15 pruned. 
[I 2026-03-18 19:45:12,867] Trial 16 finished with value: -1.6802968030248566 and parameters: {'n_layers_yyx': 2, 'hidden_size_yyx_l0': 4, 'hidden_size_yyx_l1': 4, 'context_size_yyx': 4, 'num_mix_components_yyx': 4, 'context_extractor_yyx': 'gru', 'activation_func_yyx': 'Tanh', 'L2_weight_yyx': 7.1546055691135725e-09, 'L_entropy_weight_yyx': 2.2710018736948995e-10, 'L_sep_weight_yyx': 0.00019266012234755392, 'L_scale_weight_yyx': 9.707857313542267e-07, 'learning_rate_yyx': 0.009993467362959205}. Best is trial 15 with value: -1.6819845856754096.
[I 2026-03-18 19:45:20,069] Trial 35 pruned. 
[I 2026-03-18 19:45:23,426] Trial 16 finished with value: -2.5122727476198836 and parameters: {'n_layers_yyx': 2, 'hidden_size_yyx_l0': 3, 'hidden_size_yyx_l1': 3, 'context_size_yyx': 4, 'num_mix_components_yyx': 3, 'context_extractor_yyx': 'gru', 'activation_func_yyx': 'Tanh', 'L2_weight_yyx': 1.3038702734182822e-10, 'L_entropy_weight_yyx': 6.738578083450036e-06, 'L_sep_weight_yyx': 0.0001124889897630859, 'L_scale_weight_yyx': 2.2206980067127413e-05, 'learning_rate_yyx': 0.00977082757006575}. Best is trial 16 with value: -2.5122727476198836.
[I 2026-03-18 19:45:24,120] Trial 25 finished with value: -1.6773747119234481 and parameters: {'n_layers_yyx': 1, 'hidden_size_yyx_l0': 4, 'context_size_yyx': 3, 'num_mix_components_yyx': 4, 'context_extractor_yyx': 'lstm', 'activation_func_yyx': 'Tanh', 'L2_weight_yyx': 8.428572624605121e-09, 'L_entropy_weight_yyx': 3.599612014315168e-07, 'L_sep_weight_yyx': 1.3319928654132608e-08, 'L_scale_weight_yyx': 5.317142494585419e-10, 'learning_rate_yyx': 0.006296025990145311}. Best is trial 12 with value: -1.6796893990996478.
[I 2026-03-18 19:45:27,029] Trial 30 pruned. 
[I 2026-03-18 19:45:27,412] Trial 23 pruned. 
[I 2026-03-18 19:45:30,595] Trial 27 pruned. 
[I 2026-03-18 19:45:36,553] Trial 36 pruned. 
[I 2026-03-18 19:45:41,698] Trial 35 pruned. 
[I 2026-03-18 19:45:43,015] Trial 31 finished with value: -1.9833680481110858 and parameters: {'n_layers_yyx': 1, 'hidden_size_yyx_l0': 4, 'context_size_yyx': 4, 'num_mix_components_yyx': 5, 'context_extractor_yyx': 'lstm', 'activation_func_yyx': 'Tanh', 'L2_weight_yyx': 0.00010085932089307985, 'L_entropy_weight_yyx': 5.269454483473621e-05, 'L_sep_weight_yyx': 4.220626884789322e-09, 'L_scale_weight_yyx': 3.1101020895443646e-05, 'learning_rate_yyx': 0.009951156636104757}. Best is trial 11 with value: -1.9852781357200364.
[I 2026-03-18 19:45:53,105] Trial 37 pruned. 
[I 2026-03-18 19:46:01,174] Trial 16 pruned. 
[I 2026-03-18 19:46:05,914] Trial 13 finished with value: -2.510499848865327 and parameters: {'n_layers_yyx': 1, 'hidden_size_yyx_l0': 5, 'context_size_yyx': 4, 'num_mix_components_yyx': 2, 'context_extractor_yyx': 'gru', 'activation_func_yyx': 'ReLU', 'L2_weight_yyx': 0.00039549598428750214, 'L_entropy_weight_yyx': 1.5162740868614066e-10, 'L_sep_weight_yyx': 6.64806895453565e-05, 'L_scale_weight_yyx': 4.942126044946846e-09, 'learning_rate_yyx': 0.009739789055519163}. Best is trial 5 with value: -2.5140323195684524.
[I 2026-03-18 19:46:06,047] Trial 28 pruned. 
[I 2026-03-18 19:46:07,241] Trial 24 pruned. 
[I 2026-03-18 19:46:18,156] Trial 32 pruned. 
[I 2026-03-18 19:46:18,170] Trial 12 finished with value: -2.51518345292619 and parameters: {'n_layers_yyx': 1, 'hidden_size_yyx_l0': 5, 'context_size_yyx': 1, 'num_mix_components_yyx': 4, 'context_extractor_yyx': 'lstm', 'activation_func_yyx': 'ReLU', 'L2_weight_yyx': 2.055967540808614e-10, 'L_entropy_weight_yyx': 5.73193360664639e-09, 'L_sep_weight_yyx': 1.1792945576462367e-08, 'L_scale_weight_yyx': 1.5928679743514214e-10, 'learning_rate_yyx': 0.009852412830614693}. Best is trial 12 with value: -2.51518345292619.
[I 2026-03-18 19:46:20,129] Trial 17 pruned. 
[I 2026-03-18 19:46:22,874] Trial 24 finished with value: -1.9792004972237294 and parameters: {'n_layers_yyx': 2, 'hidden_size_yyx_l0': 3, 'hidden_size_yyx_l1': 6, 'context_size_yyx': 3, 'num_mix_components_yyx': 3, 'context_extractor_yyx': 'lstm', 'activation_func_yyx': 'Tanh', 'L2_weight_yyx': 1.9126649956147596e-10, 'L_entropy_weight_yyx': 1.1465327686785625e-08, 'L_sep_weight_yyx': 1.8207166680449034e-08, 'L_scale_weight_yyx': 0.00010165976854107605, 'learning_rate_yyx': 0.00812026341447144}. Best is trial 1 with value: -1.9828018961884801.
[I 2026-03-18 19:46:25,002] Trial 36 finished with value: -1.6718997249575775 and parameters: {'n_layers_yyx': 1, 'hidden_size_yyx_l0': 5, 'context_size_yyx': 4, 'num_mix_components_yyx': 5, 'context_extractor_yyx': 'gru', 'activation_func_yyx': 'Tanh', 'L2_weight_yyx': 9.255055156309809e-05, 'L_entropy_weight_yyx': 0.0005052978574383178, 'L_sep_weight_yyx': 2.4776944835672915e-07, 'L_scale_weight_yyx': 0.0008781269774853512, 'learning_rate_yyx': 0.005071416897749131}. Best is trial 30 with value: -1.6758763736283075.
[I 2026-03-18 19:46:25,361] Trial 19 pruned. 
[I 2026-03-18 19:46:27,383] Trial 14 pruned. 
[I 2026-03-18 19:46:35,005] Trial 34 finished with value: -1.726637325144171 and parameters: {'n_layers_yyx': 1, 'hidden_size_yyx_l0': 4, 'context_size_yyx': 3, 'num_mix_components_yyx': 4, 'context_extractor_yyx': 'lstm', 'activation_func_yyx': 'ReLU', 'L2_weight_yyx': 1.6739636618664225e-05, 'L_entropy_weight_yyx': 9.431609361442586e-07, 'L_sep_weight_yyx': 2.874369688216643e-10, 'L_scale_weight_yyx': 0.00022368464971855278, 'learning_rate_yyx': 0.006890624401213463}. Best is trial 8 with value: -1.7294919135267302.
[I 2026-03-18 19:46:37,087] Trial 17 pruned. 
[I 2026-03-18 19:46:37,098] Trial 24 finished with value: -2.534451331291999 and parameters: {'n_layers_yyx': 2, 'hidden_size_yyx_l0': 3, 'hidden_size_yyx_l1': 5, 'context_size_yyx': 3, 'num_mix_components_yyx': 3, 'context_extractor_yyx': 'gru', 'activation_func_yyx': 'Tanh', 'L2_weight_yyx': 1.3574935483743133e-09, 'L_entropy_weight_yyx': 0.00014264814358969376, 'L_sep_weight_yyx': 7.324300867444407e-06, 'L_scale_weight_yyx': 1.1782403245564263e-07, 'learning_rate_yyx': 0.006402127906577227}. Best is trial 16 with value: -2.5482089436137594.
[I 2026-03-18 19:46:41,554] Trial 37 pruned. 
[I 2026-03-18 19:46:42,099] Trial 25 pruned. 
[I 2026-03-18 19:46:42,855] Trial 18 pruned. 
[I 2026-03-18 19:46:51,465] Trial 31 pruned. 
[I 2026-03-18 19:46:54,240] Trial 18 pruned. 
[I 2026-03-18 19:46:57,754] Trial 30 finished with value: -1.6958436877423515 and parameters: {'n_layers_yyx': 1, 'hidden_size_yyx_l0': 2, 'context_size_yyx': 4, 'num_mix_components_yyx': 5, 'context_extractor_yyx': 'lstm', 'activation_func_yyx': 'Tanh', 'L2_weight_yyx': 0.00047231894680244526, 'L_entropy_weight_yyx': 1.1562234560463057e-09, 'L_sep_weight_yyx': 1.217699603554377e-06, 'L_scale_weight_yyx': 6.137942618486187e-09, 'learning_rate_yyx': 0.007644773167230329}. Best is trial 18 with value: -1.7002973458681911.
[I 2026-03-18 19:46:58,401] Trial 22 finished with value: -1.6797879616381284 and parameters: {'n_layers_yyx': 2, 'hidden_size_yyx_l0': 4, 'hidden_size_yyx_l1': 3, 'context_size_yyx': 3, 'num_mix_components_yyx': 5, 'context_extractor_yyx': 'lstm', 'activation_func_yyx': 'Tanh', 'L2_weight_yyx': 1.1520047149667841e-09, 'L_entropy_weight_yyx': 1.4088870773239255e-05, 'L_sep_weight_yyx': 5.977370163266116e-10, 'L_scale_weight_yyx': 1.4483610598007538e-09, 'learning_rate_yyx': 0.006968523704210539}. Best is trial 22 with value: -1.6797879616381284.
[I 2026-03-18 19:46:59,671] Trial 26 pruned. 
[I 2026-03-18 19:47:03,507] Trial 19 pruned. 
[I 2026-03-18 19:47:03,527] Trial 14 finished with value: -2.4633235546690915 and parameters: {'n_layers_yyx': 1, 'hidden_size_yyx_l0': 4, 'context_size_yyx': 1, 'num_mix_components_yyx': 5, 'context_extractor_yyx': 'gru', 'activation_func_yyx': 'ReLU', 'L2_weight_yyx': 1.193818369195399e-09, 'L_entropy_weight_yyx': 2.9737381181877514e-08, 'L_sep_weight_yyx': 3.6133873335865036e-07, 'L_scale_weight_yyx': 4.2305916014838636e-08, 'learning_rate_yyx': 0.0008584011789656241}. Best is trial 0 with value: -2.511745534136428.
[I 2026-03-18 19:47:06,941] Trial 24 pruned. 
[I 2026-03-18 19:47:07,313] Trial 19 finished with value: -2.5137010982416355 and parameters: {'n_layers_yyx': 1, 'hidden_size_yyx_l0': 5, 'context_size_yyx': 4, 'num_mix_components_yyx': 3, 'context_extractor_yyx': 'gru', 'activation_func_yyx': 'GELU', 'L2_weight_yyx': 6.359823993318992e-07, 'L_entropy_weight_yyx': 1.3829132422897137e-05, 'L_sep_weight_yyx': 3.805127566178719e-08, 'L_scale_weight_yyx': 4.905951366399784e-10, 'learning_rate_yyx': 0.003961441069440755}. Best is trial 19 with value: -2.5137010982416355.
[I 2026-03-18 19:47:07,670] Trial 32 pruned. 
[I 2026-03-18 19:47:13,895] Trial 21 finished with value: -1.982840438411203 and parameters: {'n_layers_yyx': 1, 'hidden_size_yyx_l0': 5, 'context_size_yyx': 4, 'num_mix_components_yyx': 4, 'context_extractor_yyx': 'gru', 'activation_func_yyx': 'Tanh', 'L2_weight_yyx': 1.208723344115976e-07, 'L_entropy_weight_yyx': 4.465356130608455e-05, 'L_sep_weight_yyx': 1.4482167748082168e-07, 'L_scale_weight_yyx': 1.884086322504562e-06, 'learning_rate_yyx': 0.008170497204684673}. Best is trial 12 with value: -1.983840502266522.
[I 2026-03-18 19:47:16,311] Trial 33 finished with value: -1.991986523877393 and parameters: {'n_layers_yyx': 2, 'hidden_size_yyx_l0': 4, 'hidden_size_yyx_l1': 4, 'context_size_yyx': 3, 'num_mix_components_yyx': 5, 'context_extractor_yyx': 'gru', 'activation_func_yyx': 'Tanh', 'L2_weight_yyx': 2.116460664649456e-05, 'L_entropy_weight_yyx': 2.3868715274186605e-09, 'L_sep_weight_yyx': 1.1895450955766682e-09, 'L_scale_weight_yyx': 1.7688907815012962e-05, 'learning_rate_yyx': 0.00445485408202963}. Best is trial 15 with value: -1.9940496908651817.
[I 2026-03-18 19:47:20,367] Trial 17 finished with value: -2.0128524624747843 and parameters: {'n_layers_yyx': 1, 'hidden_size_yyx_l0': 4, 'context_size_yyx': 4, 'num_mix_components_yyx': 2, 'context_extractor_yyx': 'gru', 'activation_func_yyx': 'GELU', 'L2_weight_yyx': 9.588972281823451e-06, 'L_entropy_weight_yyx': 1.4459141278901633e-06, 'L_sep_weight_yyx': 9.79933887874734e-07, 'L_scale_weight_yyx': 0.0007431377625546664, 'learning_rate_yyx': 0.005394680388389453}. Best is trial 0 with value: -2.0138799336866504.
[I 2026-03-18 19:47:20,746] Trial 17 pruned. 
[I 2026-03-18 19:47:26,647] Trial 20 pruned. 
[I 2026-03-18 19:47:28,502] Trial 19 pruned. 
[I 2026-03-18 19:47:31,731] Trial 15 finished with value: -2.511306840355502 and parameters: {'n_layers_yyx': 2, 'hidden_size_yyx_l0': 3, 'hidden_size_yyx_l1': 6, 'context_size_yyx': 2, 'num_mix_components_yyx': 4, 'context_extractor_yyx': 'gru', 'activation_func_yyx': 'Tanh', 'L2_weight_yyx': 7.050007990566325e-10, 'L_entropy_weight_yyx': 4.493791695450949e-10, 'L_sep_weight_yyx': 6.197481783224724e-05, 'L_scale_weight_yyx': 0.00013257157544622295, 'learning_rate_yyx': 0.0058362135323948745}. Best is trial 10 with value: -2.5122732552574223.
[I 2026-03-18 19:47:38,256] Trial 29 finished with value: -1.670629205295869 and parameters: {'n_layers_yyx': 1, 'hidden_size_yyx_l0': 5, 'context_size_yyx': 4, 'num_mix_components_yyx': 3, 'context_extractor_yyx': 'lstm', 'activation_func_yyx': 'GELU', 'L2_weight_yyx': 2.7279872688272457e-05, 'L_entropy_weight_yyx': 7.682338777723416e-06, 'L_sep_weight_yyx': 2.3603529612812564e-08, 'L_scale_weight_yyx': 8.338580026976723e-09, 'learning_rate_yyx': 0.0057718779073422264}. Best is trial 13 with value: -1.6789194095140463.
[I 2026-03-18 19:47:46,828] Trial 25 pruned. 
[I 2026-03-18 19:47:47,225] Trial 21 pruned. 
[I 2026-03-18 19:47:49,694] Trial 20 pruned. 
[I 2026-03-18 19:47:52,994] Trial 34 pruned. 
[I 2026-03-18 19:47:55,534] Trial 30 pruned. 
[I 2026-03-18 19:47:55,587] Trial 33 pruned. 
[I 2026-03-18 19:47:57,874] Trial 35 pruned. 
[I 2026-03-18 19:47:57,875] Trial 18 pruned. 
[I 2026-03-18 19:48:00,295] Trial 36 finished with value: -1.6645855811571983 and parameters: {'n_layers_yyx': 2, 'hidden_size_yyx_l0': 5, 'hidden_size_yyx_l1': 6, 'context_size_yyx': 4, 'num_mix_components_yyx': 1, 'context_extractor_yyx': 'lstm', 'activation_func_yyx': 'ReLU', 'L2_weight_yyx': 2.0649537172569624e-07, 'L_entropy_weight_yyx': 4.598029786435675e-07, 'L_sep_weight_yyx': 4.777452083169216e-10, 'L_scale_weight_yyx': 1.2546115955562674e-09, 'learning_rate_yyx': 0.005794602698708072}. Best is trial 23 with value: -1.668135777403489.
[I 2026-03-18 19:48:04,847] Trial 21 pruned. 
[I 2026-03-18 19:48:05,651] Trial 18 pruned. 
[I 2026-03-18 19:48:06,245] Trial 26 pruned. 
[I 2026-03-18 19:48:08,169] Trial 38 pruned. 
[I 2026-03-18 19:48:08,644] Trial 22 pruned. 
[I 2026-03-18 19:48:12,806] Trial 36 pruned. 
[I 2026-03-18 19:48:19,081] Trial 31 pruned. 
[I 2026-03-18 19:48:20,663] Trial 23 pruned. 
[I 2026-03-18 19:48:21,020] Trial 25 pruned. 
[I 2026-03-18 19:48:21,021] Trial 22 pruned. 
[I 2026-03-18 19:48:24,204] Trial 27 pruned. 
[I 2026-03-18 19:48:27,718] Trial 19 pruned. 
[I 2026-03-18 19:48:28,114] Trial 31 pruned. 
[I 2026-03-18 19:48:28,950] Trial 14 pruned. 
[I 2026-03-18 19:48:32,502] Trial 27 pruned. 
[I 2026-03-18 19:48:35,227] Trial 32 pruned. 
[I 2026-03-18 19:48:43,609] Trial 28 pruned. 
[I 2026-03-18 19:48:43,610] Trial 39 pruned. 
[I 2026-03-18 19:48:43,617] Trial 32 pruned. 
[I 2026-03-18 19:48:48,631] Trial 16 finished with value: -2.5019373324490335 and parameters: {'n_layers_yyx': 1, 'hidden_size_yyx_l0': 4, 'context_size_yyx': 4, 'num_mix_components_yyx': 4, 'context_extractor_yyx': 'lstm', 'activation_func_yyx': 'Tanh', 'L2_weight_yyx': 8.993045014016599e-10, 'L_entropy_weight_yyx': 2.3918366765669763e-05, 'L_sep_weight_yyx': 6.63751540444352e-05, 'L_scale_weight_yyx': 1.1482960832621183e-06, 'learning_rate_yyx': 0.005384917562181496}. Best is trial 15 with value: -2.5039785932200824.
[I 2026-03-18 19:48:50,093] Trial 20 pruned. 
[I 2026-03-18 19:48:51,808] Trial 28 pruned. 
