Warning: Failed writing log files to directory [/var/log/nvidia-mps]. No logs will be available.
[I 2026-03-18 16:34:37,403] A new study created in RDB with name: opt_full-model_seed=42_task=51
[I 2026-03-18 16:34:38,292] A new study created in RDB with name: opt_full-model_seed=42_task=61
[I 2026-03-18 16:34:38,313] A new study created in RDB with name: opt_full-model_seed=42_task=53
[I 2026-03-18 16:34:38,336] A new study created in RDB with name: opt_full-model_seed=42_task=45
[I 2026-03-18 16:34:38,347] A new study created in RDB with name: opt_full-model_seed=42_task=41
[I 2026-03-18 16:34:38,358] A new study created in RDB with name: opt_full-model_seed=42_task=35
[I 2026-03-18 16:34:38,390] A new study created in RDB with name: opt_full-model_seed=42_task=60
[I 2026-03-18 16:34:38,392] A new study created in RDB with name: opt_full-model_seed=42_task=42
[I 2026-03-18 16:34:38,408] A new study created in RDB with name: opt_full-model_seed=42_task=47
[I 2026-03-18 16:34:38,435] A new study created in RDB with name: opt_full-model_seed=42_task=57
[I 2026-03-18 16:34:38,435] A new study created in RDB with name: opt_full-model_seed=42_task=55
[I 2026-03-18 16:34:38,435] A new study created in RDB with name: opt_full-model_seed=42_task=33
[I 2026-03-18 16:34:38,436] A new study created in RDB with name: opt_full-model_seed=42_task=38
[I 2026-03-18 16:34:38,436] A new study created in RDB with name: opt_full-model_seed=42_task=54
[I 2026-03-18 16:34:38,436] A new study created in RDB with name: opt_full-model_seed=42_task=50
[I 2026-03-18 16:34:38,436] A new study created in RDB with name: opt_full-model_seed=42_task=49
[I 2026-03-18 16:34:38,512] A new study created in RDB with name: opt_full-model_seed=42_task=63
[I 2026-03-18 16:34:38,512] A new study created in RDB with name: opt_full-model_seed=42_task=32
[I 2026-03-18 16:34:38,512] A new study created in RDB with name: opt_full-model_seed=42_task=58
[I 2026-03-18 16:34:38,512] A new study created in RDB with name: opt_full-model_seed=42_task=52
[I 2026-03-18 16:34:38,512] A new study created in RDB with name: opt_full-model_seed=42_task=37
[I 2026-03-18 16:34:38,512] A new study created in RDB with name: opt_full-model_seed=42_task=46
[I 2026-03-18 16:34:38,512] A new study created in RDB with name: opt_full-model_seed=42_task=34
[I 2026-03-18 16:34:38,513] A new study created in RDB with name: opt_full-model_seed=42_task=40
[I 2026-03-18 16:34:39,058] A new study created in RDB with name: opt_full-model_seed=42_task=43
[I 2026-03-18 16:34:39,103] A new study created in RDB with name: opt_full-model_seed=42_task=48
[I 2026-03-18 16:34:39,232] A new study created in RDB with name: opt_full-model_seed=42_task=44
[I 2026-03-18 16:34:39,307] A new study created in RDB with name: opt_full-model_seed=42_task=56
[I 2026-03-18 16:34:39,332] A new study created in RDB with name: opt_full-model_seed=42_task=39
[I 2026-03-18 16:34:39,347] A new study created in RDB with name: opt_full-model_seed=42_task=36
[I 2026-03-18 16:34:39,425] A new study created in RDB with name: opt_full-model_seed=42_task=59
[I 2026-03-18 16:34:39,425] A new study created in RDB with name: opt_full-model_seed=42_task=62
[I 2026-03-18 16:38:02,571] Trial 0 finished with value: -0.5748618229547262 and parameters: {'n_layers_yyx': 1, 'hidden_size_yyx_l0': 6, 'context_size_yyx': 4, 'num_mix_components_yyx': 5, 'context_extractor_yyx': 'lstm', 'activation_func_yyx': 'Tanh', 'L2_weight_yyx': 4.466832523015318e-10, 'L_entropy_weight_yyx': 8.225920732869862e-05, 'L_sep_weight_yyx': 0.00042483400074358246, 'L_scale_weight_yyx': 2.6760989567124367e-05, 'learning_rate_yyx': 0.005372232811304103}. Best is trial 0 with value: -0.5748618229547262.
[I 2026-03-18 16:38:40,144] Trial 0 finished with value: -0.5683049722747593 and parameters: {'n_layers_yyx': 2, 'hidden_size_yyx_l0': 4, 'hidden_size_yyx_l1': 5, 'context_size_yyx': 2, 'num_mix_components_yyx': 5, 'context_extractor_yyx': 'gru', 'activation_func_yyx': 'ReLU', 'L2_weight_yyx': 2.264053285014753e-05, 'L_entropy_weight_yyx': 0.00024081347246173896, 'L_sep_weight_yyx': 2.1302962344503033e-05, 'L_scale_weight_yyx': 1.29904537589199e-10, 'learning_rate_yyx': 0.0041651335594789386}. Best is trial 0 with value: -0.5683049722747593.
[I 2026-03-18 16:38:47,199] Trial 1 pruned. 
[I 2026-03-18 16:39:00,874] Trial 0 finished with value: -0.5660314966592697 and parameters: {'n_layers_yyx': 1, 'hidden_size_yyx_l0': 5, 'context_size_yyx': 4, 'num_mix_components_yyx': 2, 'context_extractor_yyx': 'gru', 'activation_func_yyx': 'ReLU', 'L2_weight_yyx': 1.0074969736971943e-06, 'L_entropy_weight_yyx': 0.000350261265332206, 'L_sep_weight_yyx': 4.1365761763993465e-05, 'L_scale_weight_yyx': 0.00017301831499508022, 'learning_rate_yyx': 0.004236316556324767}. Best is trial 0 with value: -0.5660314966592697.
[I 2026-03-18 16:39:18,299] Trial 0 finished with value: -0.5744275876219695 and parameters: {'n_layers_yyx': 1, 'hidden_size_yyx_l0': 4, 'context_size_yyx': 2, 'num_mix_components_yyx': 3, 'context_extractor_yyx': 'gru', 'activation_func_yyx': 'GELU', 'L2_weight_yyx': 2.603012971555513e-07, 'L_entropy_weight_yyx': 1.5725091754899053e-06, 'L_sep_weight_yyx': 2.3799736439876713e-08, 'L_scale_weight_yyx': 1.2121419222884997e-06, 'learning_rate_yyx': 0.006530180920966654}. Best is trial 0 with value: -0.5744275876219695.
[I 2026-03-18 16:39:38,652] Trial 0 finished with value: -0.4346305445620888 and parameters: {'n_layers_yyx': 1, 'hidden_size_yyx_l0': 5, 'context_size_yyx': 3, 'num_mix_components_yyx': 1, 'context_extractor_yyx': 'gru', 'activation_func_yyx': 'Tanh', 'L2_weight_yyx': 0.00047295769295198267, 'L_entropy_weight_yyx': 6.106249630411891e-08, 'L_sep_weight_yyx': 2.450118899309252e-05, 'L_scale_weight_yyx': 0.0005538694430276171, 'learning_rate_yyx': 0.0044270256254613765}. Best is trial 0 with value: -0.4346305445620888.
[I 2026-03-18 16:39:41,448] Trial 0 finished with value: -0.5716951519783786 and parameters: {'n_layers_yyx': 1, 'hidden_size_yyx_l0': 6, 'context_size_yyx': 1, 'num_mix_components_yyx': 5, 'context_extractor_yyx': 'lstm', 'activation_func_yyx': 'ReLU', 'L2_weight_yyx': 0.00027036773403037824, 'L_entropy_weight_yyx': 2.2118456080548877e-06, 'L_sep_weight_yyx': 3.75017839670054e-09, 'L_scale_weight_yyx': 1.032014396100075e-06, 'learning_rate_yyx': 0.0033364868635417087}. Best is trial 0 with value: -0.5716951519783786.
[I 2026-03-18 16:39:43,095] Trial 0 finished with value: -0.543668891245594 and parameters: {'n_layers_yyx': 1, 'hidden_size_yyx_l0': 5, 'context_size_yyx': 1, 'num_mix_components_yyx': 3, 'context_extractor_yyx': 'lstm', 'activation_func_yyx': 'Tanh', 'L2_weight_yyx': 5.3449397968235304e-08, 'L_entropy_weight_yyx': 0.00027905902051874015, 'L_sep_weight_yyx': 0.0006692778943983827, 'L_scale_weight_yyx': 7.767333974146365e-06, 'learning_rate_yyx': 0.008498785105972547}. Best is trial 0 with value: -0.543668891245594.
[I 2026-03-18 16:40:02,047] Trial 1 pruned. 
[I 2026-03-18 16:40:10,752] Trial 0 finished with value: -0.5594635849313854 and parameters: {'n_layers_yyx': 1, 'hidden_size_yyx_l0': 5, 'context_size_yyx': 2, 'num_mix_components_yyx': 4, 'context_extractor_yyx': 'gru', 'activation_func_yyx': 'ReLU', 'L2_weight_yyx': 0.0005712237356679644, 'L_entropy_weight_yyx': 2.0078672155264713e-06, 'L_sep_weight_yyx': 5.3779173606733525e-09, 'L_scale_weight_yyx': 2.799094689854918e-09, 'learning_rate_yyx': 0.0012159537366395582}. Best is trial 0 with value: -0.5594635849313854.
[I 2026-03-18 16:40:17,924] Trial 2 pruned. 
[I 2026-03-18 16:40:33,538] Trial 1 pruned. 
[I 2026-03-18 16:40:49,814] Trial 2 pruned. 
[I 2026-03-18 16:40:51,266] Trial 1 pruned. 
[I 2026-03-18 16:41:02,003] Trial 0 finished with value: -0.5692585521419897 and parameters: {'n_layers_yyx': 1, 'hidden_size_yyx_l0': 4, 'context_size_yyx': 2, 'num_mix_components_yyx': 1, 'context_extractor_yyx': 'lstm', 'activation_func_yyx': 'ReLU', 'L2_weight_yyx': 4.19136842638266e-06, 'L_entropy_weight_yyx': 2.4481446980794273e-09, 'L_sep_weight_yyx': 2.511471622329064e-07, 'L_scale_weight_yyx': 9.85627414229993e-10, 'learning_rate_yyx': 0.0007995684179657641}. Best is trial 0 with value: -0.5692585521419897.
[I 2026-03-18 16:41:05,263] Trial 3 pruned. 
[I 2026-03-18 16:41:10,647] Trial 0 finished with value: -0.5683635517524394 and parameters: {'n_layers_yyx': 1, 'hidden_size_yyx_l0': 5, 'context_size_yyx': 1, 'num_mix_components_yyx': 5, 'context_extractor_yyx': 'gru', 'activation_func_yyx': 'GELU', 'L2_weight_yyx': 4.694807473283725e-05, 'L_entropy_weight_yyx': 0.00014247936773209054, 'L_sep_weight_yyx': 0.0008730829363642512, 'L_scale_weight_yyx': 5.56459483572843e-06, 'learning_rate_yyx': 0.0017560908889215471}. Best is trial 0 with value: -0.5683635517524394.
[I 2026-03-18 16:41:19,002] Trial 0 finished with value: -0.5765754458336916 and parameters: {'n_layers_yyx': 2, 'hidden_size_yyx_l0': 5, 'hidden_size_yyx_l1': 4, 'context_size_yyx': 4, 'num_mix_components_yyx': 4, 'context_extractor_yyx': 'gru', 'activation_func_yyx': 'ReLU', 'L2_weight_yyx': 1.6235504509580214e-10, 'L_entropy_weight_yyx': 1.3382128124607936e-06, 'L_sep_weight_yyx': 1.4019431831363737e-08, 'L_scale_weight_yyx': 5.51036063327414e-08, 'learning_rate_yyx': 0.0005000974666255972}. Best is trial 0 with value: -0.5765754458336916.
[I 2026-03-18 16:41:21,979] Trial 4 pruned. 
[I 2026-03-18 16:41:22,645] Trial 0 finished with value: -0.5442196453781862 and parameters: {'n_layers_yyx': 2, 'hidden_size_yyx_l0': 3, 'hidden_size_yyx_l1': 6, 'context_size_yyx': 2, 'num_mix_components_yyx': 1, 'context_extractor_yyx': 'lstm', 'activation_func_yyx': 'ReLU', 'L2_weight_yyx': 0.00038642812122135454, 'L_entropy_weight_yyx': 1.787512148267072e-05, 'L_sep_weight_yyx': 0.0008775077803169826, 'L_scale_weight_yyx': 3.7744716994259117e-10, 'learning_rate_yyx': 0.0008429986909216137}. Best is trial 0 with value: -0.5442196453781862.
[I 2026-03-18 16:41:33,775] Trial 1 finished with value: -0.3924974376572175 and parameters: {'n_layers_yyx': 2, 'hidden_size_yyx_l0': 5, 'hidden_size_yyx_l1': 3, 'context_size_yyx': 3, 'num_mix_components_yyx': 4, 'context_extractor_yyx': 'lstm', 'activation_func_yyx': 'Tanh', 'L2_weight_yyx': 4.590038150931693e-09, 'L_entropy_weight_yyx': 1.4863337630105763e-07, 'L_sep_weight_yyx': 1.2803463041186535e-07, 'L_scale_weight_yyx': 0.00010098897463859084, 'learning_rate_yyx': 0.008873597633218063}. Best is trial 0 with value: -0.4346305445620888.
[I 2026-03-18 16:41:34,586] Trial 1 pruned. 
[I 2026-03-18 16:41:42,145] Trial 1 finished with value: -0.5519072520847662 and parameters: {'n_layers_yyx': 1, 'hidden_size_yyx_l0': 5, 'context_size_yyx': 2, 'num_mix_components_yyx': 1, 'context_extractor_yyx': 'gru', 'activation_func_yyx': 'Tanh', 'L2_weight_yyx': 1.293715335910817e-10, 'L_entropy_weight_yyx': 2.8898544636612767e-09, 'L_sep_weight_yyx': 5.5069550743334216e-08, 'L_scale_weight_yyx': 4.6523231500797544e-05, 'learning_rate_yyx': 0.009859811855663852}. Best is trial 0 with value: -0.5594635849313854.
[I 2026-03-18 16:41:47,814] Trial 0 finished with value: -0.6083879021877229 and parameters: {'n_layers_yyx': 1, 'hidden_size_yyx_l0': 6, 'context_size_yyx': 1, 'num_mix_components_yyx': 1, 'context_extractor_yyx': 'gru', 'activation_func_yyx': 'Tanh', 'L2_weight_yyx': 0.00010058585696763649, 'L_entropy_weight_yyx': 9.97965849622169e-05, 'L_sep_weight_yyx': 3.981969964647744e-07, 'L_scale_weight_yyx': 2.941710042166974e-09, 'learning_rate_yyx': 0.0012089437128574051}. Best is trial 0 with value: -0.6083879021877229.
[I 2026-03-18 16:41:58,819] Trial 2 pruned. 
[I 2026-03-18 16:42:16,699] Trial 1 finished with value: -0.5530255618088838 and parameters: {'n_layers_yyx': 1, 'hidden_size_yyx_l0': 2, 'context_size_yyx': 3, 'num_mix_components_yyx': 1, 'context_extractor_yyx': 'gru', 'activation_func_yyx': 'Tanh', 'L2_weight_yyx': 2.1357624237113932e-09, 'L_entropy_weight_yyx': 9.40655148285988e-10, 'L_sep_weight_yyx': 0.0001776135490954927, 'L_scale_weight_yyx': 2.872513423110027e-06, 'learning_rate_yyx': 0.006432504008117165}. Best is trial 0 with value: -0.5660314966592697.
[I 2026-03-18 16:42:21,357] Trial 0 finished with value: -2.8971408338061018 and parameters: {'n_layers_yyx': 2, 'hidden_size_yyx_l0': 5, 'hidden_size_yyx_l1': 4, 'context_size_yyx': 2, 'num_mix_components_yyx': 4, 'context_extractor_yyx': 'gru', 'activation_func_yyx': 'ReLU', 'L2_weight_yyx': 8.397932982756191e-06, 'L_entropy_weight_yyx': 2.513119647999752e-05, 'L_sep_weight_yyx': 3.4737328967307093e-08, 'L_scale_weight_yyx': 8.312606818229605e-09, 'learning_rate_yyx': 0.009277337413769321}. Best is trial 0 with value: -2.8971408338061018.
[I 2026-03-18 16:42:28,528] Trial 3 finished with value: -0.5836324153936877 and parameters: {'n_layers_yyx': 1, 'hidden_size_yyx_l0': 6, 'context_size_yyx': 3, 'num_mix_components_yyx': 4, 'context_extractor_yyx': 'gru', 'activation_func_yyx': 'GELU', 'L2_weight_yyx': 7.71443206013456e-06, 'L_entropy_weight_yyx': 3.7086246129650397e-09, 'L_sep_weight_yyx': 5.831840870481041e-05, 'L_scale_weight_yyx': 7.567045528237647e-08, 'learning_rate_yyx': 0.004509755457879001}. Best is trial 3 with value: -0.5836324153936877.
[I 2026-03-18 16:42:33,555] Trial 2 pruned. 
[I 2026-03-18 16:42:36,745] Trial 0 finished with value: -2.357728543572515 and parameters: {'n_layers_yyx': 2, 'hidden_size_yyx_l0': 6, 'hidden_size_yyx_l1': 3, 'context_size_yyx': 2, 'num_mix_components_yyx': 1, 'context_extractor_yyx': 'gru', 'activation_func_yyx': 'Tanh', 'L2_weight_yyx': 2.1378797189748425e-07, 'L_entropy_weight_yyx': 1.2658965234335959e-09, 'L_sep_weight_yyx': 1.4182068940160828e-05, 'L_scale_weight_yyx': 8.585393952109966e-05, 'learning_rate_yyx': 0.0010300128768481744}. Best is trial 0 with value: -2.357728543572515.
[I 2026-03-18 16:42:41,784] Trial 0 finished with value: -0.3894785830849095 and parameters: {'n_layers_yyx': 1, 'hidden_size_yyx_l0': 5, 'context_size_yyx': 1, 'num_mix_components_yyx': 5, 'context_extractor_yyx': 'gru', 'activation_func_yyx': 'Tanh', 'L2_weight_yyx': 6.1827694382934934e-09, 'L_entropy_weight_yyx': 3.549222766724308e-10, 'L_sep_weight_yyx': 3.1925758117796604e-07, 'L_scale_weight_yyx': 1.455209502198761e-10, 'learning_rate_yyx': 0.0005204877727153868}. Best is trial 0 with value: -0.3894785830849095.
[I 2026-03-18 16:42:44,037] Trial 4 pruned. 
[I 2026-03-18 16:42:44,974] Trial 0 finished with value: -2.9702180140077377 and parameters: {'n_layers_yyx': 2, 'hidden_size_yyx_l0': 6, 'hidden_size_yyx_l1': 6, 'context_size_yyx': 3, 'num_mix_components_yyx': 2, 'context_extractor_yyx': 'gru', 'activation_func_yyx': 'Tanh', 'L2_weight_yyx': 2.8897837580637735e-06, 'L_entropy_weight_yyx': 1.1263910189547832e-08, 'L_sep_weight_yyx': 0.00024091777055791492, 'L_scale_weight_yyx': 4.4332523992881914e-10, 'learning_rate_yyx': 0.0037544661459170178}. Best is trial 0 with value: -2.9702180140077377.
[I 2026-03-18 16:42:45,177] Trial 2 finished with value: -0.55439027893822 and parameters: {'n_layers_yyx': 2, 'hidden_size_yyx_l0': 4, 'hidden_size_yyx_l1': 3, 'context_size_yyx': 4, 'num_mix_components_yyx': 3, 'context_extractor_yyx': 'gru', 'activation_func_yyx': 'ReLU', 'L2_weight_yyx': 4.821605678542635e-06, 'L_entropy_weight_yyx': 1.4410135642270774e-06, 'L_sep_weight_yyx': 5.889825468251088e-08, 'L_scale_weight_yyx': 5.4960014020674686e-08, 'learning_rate_yyx': 0.0005439119590167886}. Best is trial 0 with value: -0.5748618229547262.
[I 2026-03-18 16:43:00,629] Trial 5 pruned. 
[I 2026-03-18 16:43:03,769] Trial 1 pruned. 
[I 2026-03-18 16:43:04,976] Trial 0 finished with value: -2.9352535799904658 and parameters: {'n_layers_yyx': 1, 'hidden_size_yyx_l0': 6, 'context_size_yyx': 3, 'num_mix_components_yyx': 4, 'context_extractor_yyx': 'gru', 'activation_func_yyx': 'GELU', 'L2_weight_yyx': 0.0005610426313954214, 'L_entropy_weight_yyx': 1.4126112711452586e-05, 'L_sep_weight_yyx': 1.4595985330693737e-05, 'L_scale_weight_yyx': 7.645582742998956e-09, 'learning_rate_yyx': 0.009558163183872356}. Best is trial 0 with value: -2.9352535799904658.
[I 2026-03-18 16:43:06,181] Trial 0 finished with value: -2.894067869123881 and parameters: {'n_layers_yyx': 2, 'hidden_size_yyx_l0': 6, 'hidden_size_yyx_l1': 5, 'context_size_yyx': 2, 'num_mix_components_yyx': 3, 'context_extractor_yyx': 'gru', 'activation_func_yyx': 'ReLU', 'L2_weight_yyx': 1.397416203214547e-07, 'L_entropy_weight_yyx': 1.78003892356944e-07, 'L_sep_weight_yyx': 7.693328188746327e-09, 'L_scale_weight_yyx': 0.000966091612135008, 'learning_rate_yyx': 0.0012890870788607053}. Best is trial 0 with value: -2.894067869123881.
[I 2026-03-18 16:43:06,590] Trial 0 finished with value: -0.5471800498490157 and parameters: {'n_layers_yyx': 2, 'hidden_size_yyx_l0': 6, 'hidden_size_yyx_l1': 2, 'context_size_yyx': 2, 'num_mix_components_yyx': 1, 'context_extractor_yyx': 'gru', 'activation_func_yyx': 'Tanh', 'L2_weight_yyx': 9.659924835420238e-10, 'L_entropy_weight_yyx': 5.141817182438557e-06, 'L_sep_weight_yyx': 3.5537840462783054e-08, 'L_scale_weight_yyx': 1.803988764522363e-05, 'learning_rate_yyx': 0.0005246903499384986}. Best is trial 0 with value: -0.5471800498490157.
[I 2026-03-18 16:43:19,268] Trial 0 finished with value: -2.957957273051406 and parameters: {'n_layers_yyx': 2, 'hidden_size_yyx_l0': 4, 'hidden_size_yyx_l1': 6, 'context_size_yyx': 4, 'num_mix_components_yyx': 2, 'context_extractor_yyx': 'lstm', 'activation_func_yyx': 'ReLU', 'L2_weight_yyx': 3.905323547438093e-05, 'L_entropy_weight_yyx': 5.466597121453994e-05, 'L_sep_weight_yyx': 7.378407745288757e-09, 'L_scale_weight_yyx': 2.5179204814568772e-09, 'learning_rate_yyx': 0.006477960695727829}. Best is trial 0 with value: -2.957957273051406.
[I 2026-03-18 16:43:21,591] Trial 0 finished with value: -2.360530635893375 and parameters: {'n_layers_yyx': 1, 'hidden_size_yyx_l0': 2, 'context_size_yyx': 3, 'num_mix_components_yyx': 2, 'context_extractor_yyx': 'gru', 'activation_func_yyx': 'Tanh', 'L2_weight_yyx': 1.372888218655903e-07, 'L_entropy_weight_yyx': 9.859304002735991e-05, 'L_sep_weight_yyx': 4.4836763832397104e-10, 'L_scale_weight_yyx': 1.2185891589700875e-06, 'learning_rate_yyx': 0.000748627111386524}. Best is trial 0 with value: -2.360530635893375.
[I 2026-03-18 16:43:23,417] Trial 2 pruned. 
[I 2026-03-18 16:43:28,964] Trial 0 finished with value: -2.7836836461592025 and parameters: {'n_layers_yyx': 2, 'hidden_size_yyx_l0': 3, 'hidden_size_yyx_l1': 3, 'context_size_yyx': 1, 'num_mix_components_yyx': 2, 'context_extractor_yyx': 'lstm', 'activation_func_yyx': 'ReLU', 'L2_weight_yyx': 7.01950547778165e-05, 'L_entropy_weight_yyx': 0.0005588853250183153, 'L_sep_weight_yyx': 4.0207410920623856e-10, 'L_scale_weight_yyx': 2.383191598187213e-08, 'learning_rate_yyx': 0.0009429823135595738}. Best is trial 0 with value: -2.7836836461592025.
[I 2026-03-18 16:43:29,830] Trial 2 finished with value: -0.42497456553550694 and parameters: {'n_layers_yyx': 2, 'hidden_size_yyx_l0': 4, 'hidden_size_yyx_l1': 2, 'context_size_yyx': 3, 'num_mix_components_yyx': 5, 'context_extractor_yyx': 'gru', 'activation_func_yyx': 'Tanh', 'L2_weight_yyx': 3.2844213156778512e-09, 'L_entropy_weight_yyx': 3.4256605174647097e-06, 'L_sep_weight_yyx': 0.0001493416681082063, 'L_scale_weight_yyx': 6.6403337536509835e-06, 'learning_rate_yyx': 0.006497662928329958}. Best is trial 0 with value: -0.4346305445620888.
[I 2026-03-18 16:43:29,830] Trial 6 pruned. 
[I 2026-03-18 16:43:37,832] Trial 2 finished with value: -0.555546735634994 and parameters: {'n_layers_yyx': 2, 'hidden_size_yyx_l0': 5, 'hidden_size_yyx_l1': 6, 'context_size_yyx': 2, 'num_mix_components_yyx': 2, 'context_extractor_yyx': 'gru', 'activation_func_yyx': 'GELU', 'L2_weight_yyx': 8.4752967666452e-10, 'L_entropy_weight_yyx': 4.869331223754445e-08, 'L_sep_weight_yyx': 1.164737113794782e-10, 'L_scale_weight_yyx': 3.290462871384784e-06, 'learning_rate_yyx': 0.008974936016872541}. Best is trial 0 with value: -0.5765754458336916.
[I 2026-03-18 16:43:40,446] Trial 1 pruned. 
[I 2026-03-18 16:43:41,391] Trial 3 pruned. 
[I 2026-03-18 16:43:41,663] Trial 3 pruned. 
[I 2026-03-18 16:43:46,211] Trial 1 finished with value: -0.5818196838462861 and parameters: {'n_layers_yyx': 1, 'hidden_size_yyx_l0': 5, 'context_size_yyx': 1, 'num_mix_components_yyx': 5, 'context_extractor_yyx': 'gru', 'activation_func_yyx': 'GELU', 'L2_weight_yyx': 3.911558815646337e-09, 'L_entropy_weight_yyx': 1.4714564772863032e-05, 'L_sep_weight_yyx': 1.6095051850502462e-05, 'L_scale_weight_yyx': 1.8089790228183716e-06, 'learning_rate_yyx': 0.003569132604590705}. Best is trial 1 with value: -0.5818196838462861.
[I 2026-03-18 16:43:53,830] Trial 3 pruned. 
[I 2026-03-18 16:43:57,254] Trial 4 pruned. 
[I 2026-03-18 16:43:57,634] Trial 7 pruned. 
[I 2026-03-18 16:44:00,456] Trial 4 pruned. 
[I 2026-03-18 16:44:04,343] Trial 0 finished with value: -2.9085693359375 and parameters: {'n_layers_yyx': 1, 'hidden_size_yyx_l0': 6, 'context_size_yyx': 2, 'num_mix_components_yyx': 5, 'context_extractor_yyx': 'lstm', 'activation_func_yyx': 'Tanh', 'L2_weight_yyx': 1.2691577890349934e-10, 'L_entropy_weight_yyx': 1.8008507761083743e-10, 'L_sep_weight_yyx': 0.0002759091716612908, 'L_scale_weight_yyx': 5.170180330230347e-06, 'learning_rate_yyx': 0.0007098935464565533}. Best is trial 0 with value: -2.9085693359375.
[I 2026-03-18 16:44:13,506] Trial 5 pruned. 
[I 2026-03-18 16:44:28,310] Trial 8 pruned. 
[I 2026-03-18 16:44:29,798] Trial 1 finished with value: -0.6105640536538204 and parameters: {'n_layers_yyx': 1, 'hidden_size_yyx_l0': 6, 'context_size_yyx': 1, 'num_mix_components_yyx': 3, 'context_extractor_yyx': 'gru', 'activation_func_yyx': 'Tanh', 'L2_weight_yyx': 0.00018972316668099828, 'L_entropy_weight_yyx': 1.4366213276581932e-08, 'L_sep_weight_yyx': 0.0002008673225924062, 'L_scale_weight_yyx': 8.572945069579906e-07, 'learning_rate_yyx': 0.0044926420686178525}. Best is trial 1 with value: -0.6105640536538204.
[I 2026-03-18 16:44:30,044] Trial 6 pruned. 
