[I 2026-03-18 20:37:04,099] Trial 27 pruned. 
[I 2026-03-18 20:37:04,121] Trial 19 pruned. 
[I 2026-03-18 20:37:06,994] Trial 12 pruned. 
[I 2026-03-18 20:37:09,801] Trial 22 pruned. 
[I 2026-03-18 20:37:12,368] Trial 24 pruned. 
[I 2026-03-18 20:37:19,640] Trial 24 finished with value: -2.7313000361124673 and parameters: {'n_layers_yyx': 2, 'hidden_size_yyx_l0': 4, 'hidden_size_yyx_l1': 3, 'context_size_yyx': 4, 'num_mix_components_yyx': 5, 'context_extractor_yyx': 'gru', 'activation_func_yyx': 'ReLU', 'L2_weight_yyx': 9.066612083006825e-06, 'L_entropy_weight_yyx': 3.198146546673766e-09, 'L_sep_weight_yyx': 3.196186007781635e-08, 'L_scale_weight_yyx': 7.344301081341331e-06, 'learning_rate_yyx': 0.005324317167831164}. Best is trial 22 with value: -2.767345984776815.
[I 2026-03-18 20:37:29,986] Trial 21 finished with value: -2.767636902539113 and parameters: {'n_layers_yyx': 2, 'hidden_size_yyx_l0': 4, 'hidden_size_yyx_l1': 6, 'context_size_yyx': 4, 'num_mix_components_yyx': 4, 'context_extractor_yyx': 'gru', 'activation_func_yyx': 'GELU', 'L2_weight_yyx': 1.1195636899683571e-10, 'L_entropy_weight_yyx': 6.424507680959035e-05, 'L_sep_weight_yyx': 0.0005599241063204371, 'L_scale_weight_yyx': 2.690430242318972e-06, 'learning_rate_yyx': 0.007888630062957053}. Best is trial 0 with value: -2.7678615354442075.
[I 2026-03-18 20:37:30,163] Trial 13 finished with value: -2.7648604150301592 and parameters: {'n_layers_yyx': 1, 'hidden_size_yyx_l0': 5, 'context_size_yyx': 3, 'num_mix_components_yyx': 2, 'context_extractor_yyx': 'gru', 'activation_func_yyx': 'ReLU', 'L2_weight_yyx': 3.8083644454007894e-05, 'L_entropy_weight_yyx': 1.1116265978595581e-06, 'L_sep_weight_yyx': 5.889286624589181e-09, 'L_scale_weight_yyx': 1.1269245035989484e-07, 'learning_rate_yyx': 0.005855860105509802}. Best is trial 10 with value: -2.765471259452738.
slurmstepd: error: *** JOB 12215377 ON m08c02 CANCELLED AT 2026-03-18T20:37:32 DUE TO TIME LIMIT ***
slurmstepd: error: Detected 1 oom_kill event in StepId=12215377.batch. Some of the step tasks have been OOM Killed.
