[I 2026-03-18 20:15:27,965] Trial 26 finished with value: -2.7339365115747403 and parameters: {'n_layers_yyx': 2, 'hidden_size_yyx_l0': 6, 'hidden_size_yyx_l1': 4, 'context_size_yyx': 4, 'num_mix_components_yyx': 1, 'context_extractor_yyx': 'gru', 'activation_func_yyx': 'GELU', 'L2_weight_yyx': 5.746819678794051e-08, 'L_entropy_weight_yyx': 0.00029522526940610797, 'L_sep_weight_yyx': 9.156106511995743e-07, 'L_scale_weight_yyx': 2.6567581907621603e-07, 'learning_rate_yyx': 0.003899028226714372}. Best is trial 1 with value: -2.766161832317774.
[I 2026-03-18 20:15:33,528] Trial 17 pruned. 
[I 2026-03-18 20:15:40,699] Trial 11 pruned. 
[I 2026-03-18 20:15:57,097] Trial 14 pruned. 
[I 2026-03-18 20:16:01,424] Trial 17 pruned. 
[I 2026-03-18 20:16:11,207] Trial 18 pruned. 
[I 2026-03-18 20:16:16,393] Trial 17 finished with value: -2.7320807091047463 and parameters: {'n_layers_yyx': 1, 'hidden_size_yyx_l0': 4, 'context_size_yyx': 4, 'num_mix_components_yyx': 3, 'context_extractor_yyx': 'lstm', 'activation_func_yyx': 'Tanh', 'L2_weight_yyx': 2.4242323999623157e-05, 'L_entropy_weight_yyx': 4.554282535846382e-07, 'L_sep_weight_yyx': 2.871229007764311e-06, 'L_scale_weight_yyx': 0.0001267234826782519, 'learning_rate_yyx': 0.006031240131705645}. Best is trial 3 with value: -2.764943250652336.
[I 2026-03-18 20:16:41,546] Trial 27 pruned. 
[I 2026-03-18 20:16:51,882] Trial 18 pruned. 
[I 2026-03-18 20:16:56,520] Trial 12 pruned. 
[I 2026-03-18 20:17:08,573] Trial 15 pruned. 
[I 2026-03-18 20:17:09,358] Trial 15 finished with value: -2.4106804065158545 and parameters: {'n_layers_yyx': 2, 'hidden_size_yyx_l0': 6, 'hidden_size_yyx_l1': 4, 'context_size_yyx': 4, 'num_mix_components_yyx': 3, 'context_extractor_yyx': 'lstm', 'activation_func_yyx': 'GELU', 'L2_weight_yyx': 1.383440252075401e-07, 'L_entropy_weight_yyx': 1.1256224670619117e-09, 'L_sep_weight_yyx': 2.809994705670356e-06, 'L_scale_weight_yyx': 8.926228411344469e-08, 'learning_rate_yyx': 0.0071718788708501945}. Best is trial 2 with value: -2.4109094575005234.
[I 2026-03-18 20:17:18,367] Trial 21 finished with value: -0.7911685058954371 and parameters: {'n_layers_yyx': 2, 'hidden_size_yyx_l0': 5, 'hidden_size_yyx_l1': 6, 'context_size_yyx': 1, 'num_mix_components_yyx': 4, 'context_extractor_yyx': 'lstm', 'activation_func_yyx': 'Tanh', 'L2_weight_yyx': 1.7453941790546923e-05, 'L_entropy_weight_yyx': 3.251176126129707e-08, 'L_sep_weight_yyx': 6.991725092233795e-05, 'L_scale_weight_yyx': 1.7722444009869351e-06, 'learning_rate_yyx': 0.0020347328059101733}. Best is trial 1 with value: -0.8307161542478305.
[I 2026-03-18 20:17:22,367] Trial 15 pruned. 
[I 2026-03-18 20:17:27,450] Trial 19 pruned. 
[I 2026-03-18 20:17:36,008] Trial 18 pruned. 
[I 2026-03-18 20:17:41,702] Trial 17 pruned. 
[I 2026-03-18 20:18:08,995] Trial 13 pruned. 
[I 2026-03-18 20:18:14,686] Trial 11 finished with value: -2.764304786835154 and parameters: {'n_layers_yyx': 1, 'hidden_size_yyx_l0': 6, 'context_size_yyx': 4, 'num_mix_components_yyx': 2, 'context_extractor_yyx': 'gru', 'activation_func_yyx': 'ReLU', 'L2_weight_yyx': 0.000365762088883609, 'L_entropy_weight_yyx': 2.857746369818485e-06, 'L_sep_weight_yyx': 3.6446311003070194e-08, 'L_scale_weight_yyx': 8.882515074450969e-05, 'learning_rate_yyx': 0.00790899929650682}. Best is trial 10 with value: -2.765471259452738.
[I 2026-03-18 20:18:16,657] Trial 23 pruned. 
[I 2026-03-18 20:18:21,027] Trial 16 pruned. 
[I 2026-03-18 20:19:09,056] Trial 28 pruned. 
[I 2026-03-18 20:19:11,050] Trial 28 finished with value: -2.7624106365875507 and parameters: {'n_layers_yyx': 1, 'hidden_size_yyx_l0': 4, 'context_size_yyx': 3, 'num_mix_components_yyx': 3, 'context_extractor_yyx': 'gru', 'activation_func_yyx': 'ReLU', 'L2_weight_yyx': 5.659961874463047e-05, 'L_entropy_weight_yyx': 1.512927544934596e-08, 'L_sep_weight_yyx': 1.3089583900722323e-05, 'L_scale_weight_yyx': 2.5295180931831628e-05, 'learning_rate_yyx': 0.005782569874990075}. Best is trial 3 with value: -2.766124988596948.
[I 2026-03-18 20:19:16,983] Trial 12 pruned. 
[I 2026-03-18 20:19:23,576] Trial 14 pruned. 
[I 2026-03-18 20:19:27,297] Trial 17 finished with value: -2.7608858641624203 and parameters: {'n_layers_yyx': 1, 'hidden_size_yyx_l0': 6, 'context_size_yyx': 3, 'num_mix_components_yyx': 5, 'context_extractor_yyx': 'gru', 'activation_func_yyx': 'Tanh', 'L2_weight_yyx': 1.0302340955100115e-06, 'L_entropy_weight_yyx': 0.00024932095092090883, 'L_sep_weight_yyx': 1.4967862101719387e-07, 'L_scale_weight_yyx': 7.024984605239067e-05, 'learning_rate_yyx': 0.0036421864711434697}. Best is trial 0 with value: -2.7678615354442075.
[I 2026-03-18 20:19:30,073] Trial 16 pruned. 
[I 2026-03-18 20:19:46,565] Trial 15 finished with value: -2.5399479696713234 and parameters: {'n_layers_yyx': 2, 'hidden_size_yyx_l0': 5, 'hidden_size_yyx_l1': 6, 'context_size_yyx': 3, 'num_mix_components_yyx': 4, 'context_extractor_yyx': 'gru', 'activation_func_yyx': 'Tanh', 'L2_weight_yyx': 2.5809157151168796e-09, 'L_entropy_weight_yyx': 7.020346129974534e-07, 'L_sep_weight_yyx': 8.179076427284728e-08, 'L_scale_weight_yyx': 4.843613923971645e-07, 'learning_rate_yyx': 0.009853967276372675}. Best is trial 6 with value: -2.5462433457735516.
[I 2026-03-18 20:20:09,337] Trial 18 pruned. 
[I 2026-03-18 20:20:20,444] Trial 16 pruned. 
[I 2026-03-18 20:20:31,820] Trial 35 pruned. 
[I 2026-03-18 20:20:41,244] Trial 18 pruned. 
[I 2026-03-18 20:20:55,312] Trial 24 pruned. 
[I 2026-03-18 20:21:29,759] Trial 13 pruned. 
[I 2026-03-18 20:21:41,394] Trial 29 pruned. 
[I 2026-03-18 20:21:42,839] Trial 29 pruned. 
[I 2026-03-18 20:21:43,715] Trial 36 pruned. 
[I 2026-03-18 20:22:07,997] Trial 19 pruned. 
[I 2026-03-18 20:22:09,835] Trial 24 finished with value: -2.798059536675651 and parameters: {'n_layers_yyx': 1, 'hidden_size_yyx_l0': 6, 'context_size_yyx': 2, 'num_mix_components_yyx': 5, 'context_extractor_yyx': 'gru', 'activation_func_yyx': 'Tanh', 'L2_weight_yyx': 4.899153341876382e-10, 'L_entropy_weight_yyx': 1.9660458525497394e-06, 'L_sep_weight_yyx': 5.450166902714545e-09, 'L_scale_weight_yyx': 2.1520191847049883e-09, 'learning_rate_yyx': 0.0037403232536083407}. Best is trial 0 with value: -2.8001684201127572.
[I 2026-03-18 20:22:27,058] Trial 16 finished with value: -2.3914941525159814 and parameters: {'n_layers_yyx': 2, 'hidden_size_yyx_l0': 6, 'hidden_size_yyx_l1': 4, 'context_size_yyx': 3, 'num_mix_components_yyx': 2, 'context_extractor_yyx': 'lstm', 'activation_func_yyx': 'Tanh', 'L2_weight_yyx': 1.5224256083083277e-05, 'L_entropy_weight_yyx': 1.6535243177253591e-06, 'L_sep_weight_yyx': 5.401144811125631e-06, 'L_scale_weight_yyx': 3.951490461554003e-08, 'learning_rate_yyx': 0.005994439055671358}. Best is trial 11 with value: -2.4030680672323603.
[I 2026-03-18 20:22:39,282] Trial 27 finished with value: -2.7606781658641797 and parameters: {'n_layers_yyx': 2, 'hidden_size_yyx_l0': 3, 'hidden_size_yyx_l1': 5, 'context_size_yyx': 2, 'num_mix_components_yyx': 4, 'context_extractor_yyx': 'lstm', 'activation_func_yyx': 'Tanh', 'L2_weight_yyx': 1.514103154998974e-08, 'L_entropy_weight_yyx': 1.1765736241462677e-07, 'L_sep_weight_yyx': 6.680170304342815e-07, 'L_scale_weight_yyx': 1.001995421249414e-10, 'learning_rate_yyx': 0.007607526754015754}. Best is trial 25 with value: -2.762886536950096.
[I 2026-03-18 20:22:51,362] Trial 22 finished with value: -2.767345984776815 and parameters: {'n_layers_yyx': 2, 'hidden_size_yyx_l0': 5, 'hidden_size_yyx_l1': 4, 'context_size_yyx': 4, 'num_mix_components_yyx': 5, 'context_extractor_yyx': 'gru', 'activation_func_yyx': 'ReLU', 'L2_weight_yyx': 5.475002770966631e-07, 'L_entropy_weight_yyx': 7.59714807927784e-10, 'L_sep_weight_yyx': 2.514295310337682e-09, 'L_scale_weight_yyx': 7.549813200188835e-07, 'learning_rate_yyx': 0.007375755622605178}. Best is trial 22 with value: -2.767345984776815.
[I 2026-03-18 20:23:22,625] Trial 11 finished with value: -2.4108507923244202 and parameters: {'n_layers_yyx': 1, 'hidden_size_yyx_l0': 5, 'context_size_yyx': 3, 'num_mix_components_yyx': 5, 'context_extractor_yyx': 'lstm', 'activation_func_yyx': 'Tanh', 'L2_weight_yyx': 1.207832948981251e-07, 'L_entropy_weight_yyx': 2.4396092725153663e-06, 'L_sep_weight_yyx': 0.0004144556210994643, 'L_scale_weight_yyx': 1.0306460904675629e-10, 'learning_rate_yyx': 0.009352990732047775}. Best is trial 10 with value: -2.4114769060587147.
[I 2026-03-18 20:23:22,646] Trial 15 finished with value: -2.7647680619301256 and parameters: {'n_layers_yyx': 1, 'hidden_size_yyx_l0': 5, 'context_size_yyx': 3, 'num_mix_components_yyx': 5, 'context_extractor_yyx': 'gru', 'activation_func_yyx': 'Tanh', 'L2_weight_yyx': 1.3556501732657692e-10, 'L_entropy_weight_yyx': 2.5036422469479666e-08, 'L_sep_weight_yyx': 1.2842359129003142e-07, 'L_scale_weight_yyx': 3.0667747683736583e-10, 'learning_rate_yyx': 0.0021021524922304334}. Best is trial 8 with value: -2.7661304184127817.
[I 2026-03-18 20:23:23,966] Trial 16 pruned. 
[I 2026-03-18 20:23:35,857] Trial 25 pruned. 
[I 2026-03-18 20:23:38,182] Trial 25 pruned. 
[I 2026-03-18 20:23:42,928] Trial 13 finished with value: -2.4034606761310786 and parameters: {'n_layers_yyx': 2, 'hidden_size_yyx_l0': 6, 'hidden_size_yyx_l1': 4, 'context_size_yyx': 4, 'num_mix_components_yyx': 4, 'context_extractor_yyx': 'lstm', 'activation_func_yyx': 'GELU', 'L2_weight_yyx': 7.957918094273282e-05, 'L_entropy_weight_yyx': 3.595924759198488e-05, 'L_sep_weight_yyx': 0.00033836119749661603, 'L_scale_weight_yyx': 9.64348453825217e-05, 'learning_rate_yyx': 0.009014935499712527}. Best is trial 13 with value: -2.4034606761310786.
[I 2026-03-18 20:23:49,813] Trial 19 pruned. 
[I 2026-03-18 20:23:49,878] Trial 17 pruned. 
[I 2026-03-18 20:24:02,339] Trial 17 pruned. 
[I 2026-03-18 20:24:11,833] Trial 37 pruned. 
[I 2026-03-18 20:24:21,213] Trial 30 pruned. 
[I 2026-03-18 20:24:22,844] Trial 19 pruned. 
[I 2026-03-18 20:24:32,806] Trial 16 finished with value: -2.4230104559362475 and parameters: {'n_layers_yyx': 1, 'hidden_size_yyx_l0': 4, 'context_size_yyx': 4, 'num_mix_components_yyx': 2, 'context_extractor_yyx': 'lstm', 'activation_func_yyx': 'Tanh', 'L2_weight_yyx': 4.079764125216166e-07, 'L_entropy_weight_yyx': 1.971461952786545e-07, 'L_sep_weight_yyx': 5.976988263087085e-07, 'L_scale_weight_yyx': 1.3149878665994773e-06, 'learning_rate_yyx': 0.0099335498520046}. Best is trial 9 with value: -2.4237415519893895.
[I 2026-03-18 20:25:01,450] Trial 18 pruned. 
[I 2026-03-18 20:25:16,559] Trial 18 pruned. 
[I 2026-03-18 20:25:27,382] Trial 16 pruned. 
[I 2026-03-18 20:25:39,749] Trial 20 pruned. 
[I 2026-03-18 20:25:48,520] Trial 16 pruned. 
[I 2026-03-18 20:26:04,132] Trial 17 pruned. 
[I 2026-03-18 20:26:26,924] Trial 11 finished with value: -2.43991066579963 and parameters: {'n_layers_yyx': 2, 'hidden_size_yyx_l0': 6, 'hidden_size_yyx_l1': 5, 'context_size_yyx': 3, 'num_mix_components_yyx': 5, 'context_extractor_yyx': 'lstm', 'activation_func_yyx': 'Tanh', 'L2_weight_yyx': 5.647142382514665e-05, 'L_entropy_weight_yyx': 0.00035399451855552843, 'L_sep_weight_yyx': 1.130261347235874e-10, 'L_scale_weight_yyx': 6.893740511027473e-09, 'learning_rate_yyx': 0.009971544200676743}. Best is trial 11 with value: -2.43991066579963.
[I 2026-03-18 20:26:42,623] Trial 17 pruned. 
[I 2026-03-18 20:26:55,259] Trial 31 pruned. 
[I 2026-03-18 20:27:45,453] Trial 12 pruned. 
[I 2026-03-18 20:27:45,636] Trial 20 finished with value: -0.8145550005192946 and parameters: {'n_layers_yyx': 2, 'hidden_size_yyx_l0': 4, 'hidden_size_yyx_l1': 6, 'context_size_yyx': 3, 'num_mix_components_yyx': 5, 'context_extractor_yyx': 'lstm', 'activation_func_yyx': 'Tanh', 'L2_weight_yyx': 0.00015111179416922124, 'L_entropy_weight_yyx': 1.7570944791158278e-08, 'L_sep_weight_yyx': 5.7063521792407424e-05, 'L_scale_weight_yyx': 9.007717931786163e-10, 'learning_rate_yyx': 0.002495455252426666}. Best is trial 4 with value: -0.8236861799457048.
[I 2026-03-18 20:27:53,360] Trial 19 pruned. 
[I 2026-03-18 20:28:30,306] Trial 18 finished with value: -0.8265906915706933 and parameters: {'n_layers_yyx': 1, 'hidden_size_yyx_l0': 6, 'context_size_yyx': 3, 'num_mix_components_yyx': 3, 'context_extractor_yyx': 'lstm', 'activation_func_yyx': 'Tanh', 'L2_weight_yyx': 3.0578020863680873e-07, 'L_entropy_weight_yyx': 6.548391517535919e-09, 'L_sep_weight_yyx': 2.2646722259026882e-08, 'L_scale_weight_yyx': 3.158962486741099e-08, 'learning_rate_yyx': 0.005918014717945144}. Best is trial 13 with value: -0.8270922707313977.
[I 2026-03-18 20:28:40,129] Trial 19 finished with value: -2.7659779144187704 and parameters: {'n_layers_yyx': 2, 'hidden_size_yyx_l0': 6, 'hidden_size_yyx_l1': 4, 'context_size_yyx': 4, 'num_mix_components_yyx': 5, 'context_extractor_yyx': 'lstm', 'activation_func_yyx': 'GELU', 'L2_weight_yyx': 3.6119253029291983e-06, 'L_entropy_weight_yyx': 1.1096232528499486e-06, 'L_sep_weight_yyx': 4.8882991100561615e-06, 'L_scale_weight_yyx': 6.812034883505099e-05, 'learning_rate_yyx': 0.0017835240062269205}. Best is trial 19 with value: -2.7659779144187704.
[I 2026-03-18 20:28:51,239] Trial 28 pruned. 
[I 2026-03-18 20:28:53,214] Trial 14 finished with value: -0.8045719659486937 and parameters: {'n_layers_yyx': 2, 'hidden_size_yyx_l0': 4, 'hidden_size_yyx_l1': 5, 'context_size_yyx': 2, 'num_mix_components_yyx': 4, 'context_extractor_yyx': 'lstm', 'activation_func_yyx': 'Tanh', 'L2_weight_yyx': 2.6099382623811096e-06, 'L_entropy_weight_yyx': 8.123942004160449e-10, 'L_sep_weight_yyx': 5.6308525704479184e-08, 'L_scale_weight_yyx': 1.1388077517332154e-10, 'learning_rate_yyx': 0.008483940267874409}. Best is trial 5 with value: -0.8480365026296506.
[I 2026-03-18 20:29:00,023] Trial 23 pruned. 
[I 2026-03-18 20:29:06,001] Trial 18 pruned. 
[I 2026-03-18 20:29:08,877] Trial 12 finished with value: -2.7622557767016964 and parameters: {'n_layers_yyx': 1, 'hidden_size_yyx_l0': 5, 'context_size_yyx': 4, 'num_mix_components_yyx': 2, 'context_extractor_yyx': 'gru', 'activation_func_yyx': 'ReLU', 'L2_weight_yyx': 0.0006097948659145623, 'L_entropy_weight_yyx': 0.0009766542220084932, 'L_sep_weight_yyx': 5.672142072688288e-06, 'L_scale_weight_yyx': 0.00044530034733025075, 'learning_rate_yyx': 0.005104430162572719}. Best is trial 10 with value: -2.765471259452738.
[I 2026-03-18 20:29:28,110] Trial 17 pruned. 
[I 2026-03-18 20:29:28,572] Trial 26 pruned. 
[I 2026-03-18 20:29:42,265] Trial 20 pruned. 
[I 2026-03-18 20:29:43,247] Trial 38 pruned. 
[I 2026-03-18 20:29:50,105] Trial 21 pruned. 
[I 2026-03-18 20:30:06,901] Trial 13 finished with value: -2.7569388448726144 and parameters: {'n_layers_yyx': 1, 'hidden_size_yyx_l0': 6, 'context_size_yyx': 2, 'num_mix_components_yyx': 5, 'context_extractor_yyx': 'gru', 'activation_func_yyx': 'Tanh', 'L2_weight_yyx': 4.279627571592545e-06, 'L_entropy_weight_yyx': 1.3029340339352647e-09, 'L_sep_weight_yyx': 2.451541571827246e-10, 'L_scale_weight_yyx': 1.7727755256102866e-09, 'learning_rate_yyx': 0.0006531350295102997}. Best is trial 7 with value: -2.766072426816335.
[I 2026-03-18 20:30:16,712] Trial 20 finished with value: -2.767449043355407 and parameters: {'n_layers_yyx': 2, 'hidden_size_yyx_l0': 4, 'hidden_size_yyx_l1': 6, 'context_size_yyx': 4, 'num_mix_components_yyx': 4, 'context_extractor_yyx': 'gru', 'activation_func_yyx': 'GELU', 'L2_weight_yyx': 5.76634838946535e-10, 'L_entropy_weight_yyx': 5.2545849329091465e-05, 'L_sep_weight_yyx': 0.0008940752799633963, 'L_scale_weight_yyx': 2.1084826659076156e-06, 'learning_rate_yyx': 0.008032332489784808}. Best is trial 0 with value: -2.7678615354442075.
[I 2026-03-18 20:30:25,671] Trial 19 pruned. 
[I 2026-03-18 20:30:36,684] Trial 18 pruned. 
[I 2026-03-18 20:30:43,313] Trial 27 pruned. 
[I 2026-03-18 20:30:53,505] Trial 20 pruned. 
[I 2026-03-18 20:30:54,833] Trial 10 finished with value: -2.3925952461438302 and parameters: {'n_layers_yyx': 1, 'hidden_size_yyx_l0': 6, 'context_size_yyx': 4, 'num_mix_components_yyx': 2, 'context_extractor_yyx': 'gru', 'activation_func_yyx': 'Tanh', 'L2_weight_yyx': 0.0007013507195348217, 'L_entropy_weight_yyx': 5.215257362602688e-08, 'L_sep_weight_yyx': 6.65176602344641e-08, 'L_scale_weight_yyx': 6.727863975480912e-07, 'learning_rate_yyx': 0.000524329332358032}. Best is trial 5 with value: -2.394261756310096.
[I 2026-03-18 20:30:56,951] Trial 22 pruned. 
[I 2026-03-18 20:31:15,984] Trial 19 pruned. 
[I 2026-03-18 20:31:20,988] Trial 14 pruned. 
[I 2026-03-18 20:31:42,487] Trial 19 pruned. 
[I 2026-03-18 20:31:46,116] Trial 39 pruned. 
[I 2026-03-18 20:31:49,370] Trial 28 pruned. 
[I 2026-03-18 20:31:50,306] Trial 11 pruned. 
[I 2026-03-18 20:31:52,892] Trial 21 pruned. 
[I 2026-03-18 20:31:58,467] Trial 21 pruned. 
[I 2026-03-18 20:32:04,296] Trial 17 finished with value: -2.7312955221872546 and parameters: {'n_layers_yyx': 1, 'hidden_size_yyx_l0': 6, 'context_size_yyx': 3, 'num_mix_components_yyx': 4, 'context_extractor_yyx': 'lstm', 'activation_func_yyx': 'Tanh', 'L2_weight_yyx': 2.5466705314447793e-10, 'L_entropy_weight_yyx': 1.750648808364176e-07, 'L_sep_weight_yyx': 1.3409033241264186e-07, 'L_scale_weight_yyx': 3.187834080707106e-08, 'learning_rate_yyx': 0.006197598257708994}. Best is trial 8 with value: -2.7661304184127817.
[I 2026-03-18 20:32:24,052] Trial 32 pruned. 
[I 2026-03-18 20:32:31,250] Trial 18 finished with value: -2.3569189722098787 and parameters: {'n_layers_yyx': 1, 'hidden_size_yyx_l0': 5, 'context_size_yyx': 3, 'num_mix_components_yyx': 5, 'context_extractor_yyx': 'lstm', 'activation_func_yyx': 'GELU', 'L2_weight_yyx': 3.012004849704861e-08, 'L_entropy_weight_yyx': 5.423364318055386e-08, 'L_sep_weight_yyx': 6.706983222066134e-05, 'L_scale_weight_yyx': 5.2680725083608203e-05, 'learning_rate_yyx': 0.00709448904958257}. Best is trial 4 with value: -2.393031095621557.
[I 2026-03-18 20:32:53,726] Trial 20 pruned. 
[I 2026-03-18 20:33:13,334] Trial 20 pruned. 
[I 2026-03-18 20:33:19,669] Trial 30 finished with value: -2.765639526078908 and parameters: {'n_layers_yyx': 1, 'hidden_size_yyx_l0': 2, 'context_size_yyx': 4, 'num_mix_components_yyx': 5, 'context_extractor_yyx': 'gru', 'activation_func_yyx': 'ReLU', 'L2_weight_yyx': 0.0003860509762794543, 'L_entropy_weight_yyx': 3.2030015491820063e-09, 'L_sep_weight_yyx': 2.012296748237886e-06, 'L_scale_weight_yyx': 0.00010824107606192248, 'learning_rate_yyx': 0.007978186429516088}. Best is trial 3 with value: -2.766124988596948.
[I 2026-03-18 20:33:20,628] Trial 15 pruned. 
[I 2026-03-18 20:33:27,229] Trial 15 pruned. 
[I 2026-03-18 20:33:35,382] Trial 33 pruned. 
[I 2026-03-18 20:33:44,679] Trial 14 finished with value: -2.3967336371277184 and parameters: {'n_layers_yyx': 2, 'hidden_size_yyx_l0': 5, 'hidden_size_yyx_l1': 4, 'context_size_yyx': 4, 'num_mix_components_yyx': 4, 'context_extractor_yyx': 'lstm', 'activation_func_yyx': 'GELU', 'L2_weight_yyx': 0.0004036515763799788, 'L_entropy_weight_yyx': 2.4544920628159174e-05, 'L_sep_weight_yyx': 9.872769397696716e-06, 'L_scale_weight_yyx': 0.00011489431353121095, 'learning_rate_yyx': 0.00903465631475143}. Best is trial 13 with value: -2.4034606761310786.
[I 2026-03-18 20:33:47,110] Trial 40 pruned. 
[I 2026-03-18 20:33:55,140] Trial 12 pruned. 
[I 2026-03-18 20:33:55,141] Trial 20 pruned. 
[I 2026-03-18 20:33:59,405] Trial 29 pruned. 
[I 2026-03-18 20:34:08,098] Trial 29 pruned. 
[I 2026-03-18 20:34:09,096] Trial 22 pruned. 
[I 2026-03-18 20:34:15,948] Trial 18 pruned. 
[I 2026-03-18 20:34:28,187] Trial 16 pruned. 
[I 2026-03-18 20:34:44,267] Trial 15 pruned. 
[I 2026-03-18 20:34:47,657] Trial 22 finished with value: -0.8169241923525203 and parameters: {'n_layers_yyx': 2, 'hidden_size_yyx_l0': 5, 'hidden_size_yyx_l1': 5, 'context_size_yyx': 1, 'num_mix_components_yyx': 4, 'context_extractor_yyx': 'lstm', 'activation_func_yyx': 'Tanh', 'L2_weight_yyx': 0.0009207198183395978, 'L_entropy_weight_yyx': 2.279782928958719e-07, 'L_sep_weight_yyx': 5.0067769157693456e-05, 'L_scale_weight_yyx': 1.3006586944664676e-06, 'learning_rate_yyx': 0.0014902442897337174}. Best is trial 1 with value: -0.8307161542478305.
[I 2026-03-18 20:35:06,647] Trial 26 finished with value: -2.7967747560371308 and parameters: {'n_layers_yyx': 1, 'hidden_size_yyx_l0': 6, 'context_size_yyx': 2, 'num_mix_components_yyx': 5, 'context_extractor_yyx': 'gru', 'activation_func_yyx': 'Tanh', 'L2_weight_yyx': 2.594555747983075e-10, 'L_entropy_weight_yyx': 1.4390994755208094e-05, 'L_sep_weight_yyx': 1.1584489282015936e-05, 'L_scale_weight_yyx': 3.65714329936724e-09, 'learning_rate_yyx': 0.006434553384259071}. Best is trial 0 with value: -2.8001684201127572.
[I 2026-03-18 20:35:13,656] Trial 23 pruned. 
[I 2026-03-18 20:35:14,365] Trial 23 pruned. 
[I 2026-03-18 20:35:15,027] Trial 21 pruned. 
[I 2026-03-18 20:35:40,943] Trial 23 pruned. 
[I 2026-03-18 20:35:41,494] Trial 13 pruned. 
[I 2026-03-18 20:35:41,494] Trial 41 pruned. 
[I 2026-03-18 20:36:13,396] Trial 17 pruned. 
[I 2026-03-18 20:36:16,946] Trial 17 finished with value: -2.4207349036872494 and parameters: {'n_layers_yyx': 2, 'hidden_size_yyx_l0': 4, 'hidden_size_yyx_l1': 4, 'context_size_yyx': 4, 'num_mix_components_yyx': 4, 'context_extractor_yyx': 'lstm', 'activation_func_yyx': 'Tanh', 'L2_weight_yyx': 4.359610718069722e-06, 'L_entropy_weight_yyx': 8.250606099173921e-08, 'L_sep_weight_yyx': 1.2926699572013778e-09, 'L_scale_weight_yyx': 6.181340308044824e-05, 'learning_rate_yyx': 0.00943709071549138}. Best is trial 9 with value: -2.4237415519893895.
[I 2026-03-18 20:36:36,963] Trial 16 pruned. 
[I 2026-03-18 20:36:41,415] Trial 19 finished with value: -2.7634744017663664 and parameters: {'n_layers_yyx': 2, 'hidden_size_yyx_l0': 5, 'hidden_size_yyx_l1': 5, 'context_size_yyx': 2, 'num_mix_components_yyx': 4, 'context_extractor_yyx': 'gru', 'activation_func_yyx': 'Tanh', 'L2_weight_yyx': 4.251386727237532e-08, 'L_entropy_weight_yyx': 1.8712884316707235e-10, 'L_sep_weight_yyx': 1.8266467783358232e-06, 'L_scale_weight_yyx': 1.0420053061173559e-08, 'learning_rate_yyx': 0.0030757619016092684}. Best is trial 14 with value: -2.7663552897814294.
