[I 2026-03-18 19:33:15,862] Trial 3 finished with value: -2.065662642865651 and parameters: {'n_layers_yyx': 2, 'hidden_size_yyx_l0': 5, 'hidden_size_yyx_l1': 4, 'context_size_yyx': 1, 'num_mix_components_yyx': 1, 'context_extractor_yyx': 'gru', 'activation_func_yyx': 'Tanh', 'L2_weight_yyx': 2.034949687239876e-07, 'L_entropy_weight_yyx': 1.0259754230644838e-10, 'L_sep_weight_yyx': 0.0009821623358926385, 'L_scale_weight_yyx': 6.875361710021657e-07, 'learning_rate_yyx': 0.0008782810287103239}. Best is trial 2 with value: -2.085195656623902.
[I 2026-03-18 19:33:16,648] Trial 2 finished with value: -2.0694146609441373 and parameters: {'n_layers_yyx': 2, 'hidden_size_yyx_l0': 4, 'hidden_size_yyx_l1': 2, 'context_size_yyx': 3, 'num_mix_components_yyx': 2, 'context_extractor_yyx': 'lstm', 'activation_func_yyx': 'ReLU', 'L2_weight_yyx': 8.37591038229105e-08, 'L_entropy_weight_yyx': 1.6706529917777003e-07, 'L_sep_weight_yyx': 1.274407848662769e-07, 'L_scale_weight_yyx': 9.551655030438515e-09, 'learning_rate_yyx': 0.003334191671633428}. Best is trial 0 with value: -2.070886092188975.
[I 2026-03-18 19:33:26,017] Trial 4 pruned. 
[I 2026-03-18 19:33:27,167] Trial 3 pruned. 
[I 2026-03-18 19:33:29,412] Trial 2 finished with value: -2.065998068918163 and parameters: {'n_layers_yyx': 1, 'hidden_size_yyx_l0': 4, 'context_size_yyx': 2, 'num_mix_components_yyx': 4, 'context_extractor_yyx': 'gru', 'activation_func_yyx': 'ReLU', 'L2_weight_yyx': 0.000885341967498056, 'L_entropy_weight_yyx': 9.117606378757754e-07, 'L_sep_weight_yyx': 1.2695102270096481e-05, 'L_scale_weight_yyx': 2.946722814417496e-09, 'learning_rate_yyx': 0.0013815248259353874}. Best is trial 1 with value: -2.0819965339546846.
[I 2026-03-18 19:33:34,665] Trial 2 finished with value: -2.078102534337941 and parameters: {'n_layers_yyx': 1, 'hidden_size_yyx_l0': 3, 'context_size_yyx': 3, 'num_mix_components_yyx': 5, 'context_extractor_yyx': 'lstm', 'activation_func_yyx': 'Tanh', 'L2_weight_yyx': 0.00011752348142614154, 'L_entropy_weight_yyx': 1.3387674637469554e-06, 'L_sep_weight_yyx': 8.262993636737464e-05, 'L_scale_weight_yyx': 1.8908033407888712e-05, 'learning_rate_yyx': 0.0008465963686540853}. Best is trial 0 with value: -2.0940855781262293.
[I 2026-03-18 19:33:35,096] Trial 7 finished with value: -1.607815819361022 and parameters: {'n_layers_yyx': 2, 'hidden_size_yyx_l0': 4, 'hidden_size_yyx_l1': 4, 'context_size_yyx': 4, 'num_mix_components_yyx': 4, 'context_extractor_yyx': 'lstm', 'activation_func_yyx': 'ReLU', 'L2_weight_yyx': 0.0007630816641909043, 'L_entropy_weight_yyx': 3.764684313732834e-06, 'L_sep_weight_yyx': 8.622442844001913e-07, 'L_scale_weight_yyx': 0.0005685316050627428, 'learning_rate_yyx': 0.002361121078621736}. Best is trial 0 with value: -1.6116411666937693.
[I 2026-03-18 19:33:35,171] Trial 4 pruned. 
[I 2026-03-18 19:33:38,879] Trial 3 pruned. 
[I 2026-03-18 19:33:40,267] Trial 2 finished with value: -2.055616687272914 and parameters: {'n_layers_yyx': 2, 'hidden_size_yyx_l0': 4, 'hidden_size_yyx_l1': 4, 'context_size_yyx': 2, 'num_mix_components_yyx': 3, 'context_extractor_yyx': 'gru', 'activation_func_yyx': 'GELU', 'L2_weight_yyx': 1.2348261800804585e-06, 'L_entropy_weight_yyx': 3.923876811271657e-08, 'L_sep_weight_yyx': 0.00017802281052919623, 'L_scale_weight_yyx': 8.789699613301895e-08, 'learning_rate_yyx': 0.0005501530648666673}. Best is trial 0 with value: -2.0701083356738468.
[I 2026-03-18 19:33:44,823] Trial 5 pruned. 
[I 2026-03-18 19:33:46,979] Trial 4 finished with value: -1.6263158687027046 and parameters: {'n_layers_yyx': 2, 'hidden_size_yyx_l0': 2, 'hidden_size_yyx_l1': 2, 'context_size_yyx': 2, 'num_mix_components_yyx': 4, 'context_extractor_yyx': 'lstm', 'activation_func_yyx': 'Tanh', 'L2_weight_yyx': 0.0006781307948984916, 'L_entropy_weight_yyx': 3.649362934512646e-08, 'L_sep_weight_yyx': 1.9823257322862864e-08, 'L_scale_weight_yyx': 4.812820130808527e-10, 'learning_rate_yyx': 0.0060273482223505695}. Best is trial 3 with value: -1.6307942617099915.
[I 2026-03-18 19:33:47,820] Trial 5 pruned. 
[I 2026-03-18 19:33:48,903] Trial 4 pruned. 
[I 2026-03-18 19:33:53,871] Trial 4 finished with value: -2.1081271431202273 and parameters: {'n_layers_yyx': 2, 'hidden_size_yyx_l0': 3, 'hidden_size_yyx_l1': 3, 'context_size_yyx': 4, 'num_mix_components_yyx': 3, 'context_extractor_yyx': 'lstm', 'activation_func_yyx': 'ReLU', 'L2_weight_yyx': 1.2936703036237875e-09, 'L_entropy_weight_yyx': 0.00021158465526548975, 'L_sep_weight_yyx': 1.7271709624461194e-08, 'L_scale_weight_yyx': 1.2157323206864874e-05, 'learning_rate_yyx': 0.001419819865544157}. Best is trial 0 with value: -2.110296626806576.
[I 2026-03-18 19:33:58,112] Trial 6 pruned. 
[I 2026-03-18 19:34:04,982] Trial 3 finished with value: -2.0787080941221263 and parameters: {'n_layers_yyx': 1, 'hidden_size_yyx_l0': 4, 'context_size_yyx': 3, 'num_mix_components_yyx': 2, 'context_extractor_yyx': 'lstm', 'activation_func_yyx': 'ReLU', 'L2_weight_yyx': 7.586006146107834e-06, 'L_entropy_weight_yyx': 6.310448732056078e-07, 'L_sep_weight_yyx': 1.5468348555071022e-08, 'L_scale_weight_yyx': 0.0006410927474995063, 'learning_rate_yyx': 0.005350503961674828}. Best is trial 2 with value: -2.093203554819634.
[I 2026-03-18 19:34:06,155] Trial 5 pruned. 
[I 2026-03-18 19:34:07,010] Trial 7 pruned. 
[I 2026-03-18 19:34:14,851] Trial 3 finished with value: -1.607980757832474 and parameters: {'n_layers_yyx': 2, 'hidden_size_yyx_l0': 6, 'hidden_size_yyx_l1': 4, 'context_size_yyx': 4, 'num_mix_components_yyx': 2, 'context_extractor_yyx': 'lstm', 'activation_func_yyx': 'ReLU', 'L2_weight_yyx': 0.0005577128842055314, 'L_entropy_weight_yyx': 7.751209367497756e-05, 'L_sep_weight_yyx': 1.4614689125307299e-06, 'L_scale_weight_yyx': 0.00028779464733790124, 'learning_rate_yyx': 0.0035866754573136944}. Best is trial 1 with value: -1.6113757535901372.
[I 2026-03-18 19:34:29,237] Trial 4 finished with value: -2.05872102018063 and parameters: {'n_layers_yyx': 2, 'hidden_size_yyx_l0': 6, 'hidden_size_yyx_l1': 3, 'context_size_yyx': 3, 'num_mix_components_yyx': 2, 'context_extractor_yyx': 'gru', 'activation_func_yyx': 'ReLU', 'L2_weight_yyx': 2.7493072117474685e-08, 'L_entropy_weight_yyx': 1.569129104874279e-05, 'L_sep_weight_yyx': 1.6308048794435917e-07, 'L_scale_weight_yyx': 1.1126113487067223e-05, 'learning_rate_yyx': 0.0021187532884703523}. Best is trial 1 with value: -2.0593034638366503.
[I 2026-03-18 19:34:39,343] Trial 6 finished with value: -1.6046773525374933 and parameters: {'n_layers_yyx': 1, 'hidden_size_yyx_l0': 2, 'context_size_yyx': 3, 'num_mix_components_yyx': 2, 'context_extractor_yyx': 'gru', 'activation_func_yyx': 'Tanh', 'L2_weight_yyx': 0.0005426590315336816, 'L_entropy_weight_yyx': 1.4657866248100594e-09, 'L_sep_weight_yyx': 8.412041617185964e-05, 'L_scale_weight_yyx': 0.00028426855808933143, 'learning_rate_yyx': 0.00213370821696218}. Best is trial 0 with value: -1.6069830560914067.
[I 2026-03-18 19:34:41,780] Trial 4 finished with value: -2.094046664403649 and parameters: {'n_layers_yyx': 2, 'hidden_size_yyx_l0': 5, 'hidden_size_yyx_l1': 4, 'context_size_yyx': 4, 'num_mix_components_yyx': 5, 'context_extractor_yyx': 'lstm', 'activation_func_yyx': 'Tanh', 'L2_weight_yyx': 6.263462397023319e-09, 'L_entropy_weight_yyx': 9.622754514385022e-09, 'L_sep_weight_yyx': 2.9488771654916864e-09, 'L_scale_weight_yyx': 4.7323708247399895e-08, 'learning_rate_yyx': 0.006539488589029068}. Best is trial 4 with value: -2.094046664403649.
[I 2026-03-18 19:34:43,388] Trial 5 pruned. 
[I 2026-03-18 19:34:51,978] Trial 5 pruned. 
[I 2026-03-18 19:34:52,777] Trial 6 finished with value: -2.056028049851882 and parameters: {'n_layers_yyx': 1, 'hidden_size_yyx_l0': 3, 'context_size_yyx': 2, 'num_mix_components_yyx': 4, 'context_extractor_yyx': 'lstm', 'activation_func_yyx': 'Tanh', 'L2_weight_yyx': 3.7758630502012203e-08, 'L_entropy_weight_yyx': 1.4125179926528017e-09, 'L_sep_weight_yyx': 2.0957116891661996e-08, 'L_scale_weight_yyx': 1.3996613177553182e-06, 'learning_rate_yyx': 0.0053529140141914296}. Best is trial 2 with value: -2.059868681386501.
[I 2026-03-18 19:34:54,042] Trial 5 pruned. 
[I 2026-03-18 19:34:59,183] Trial 4 finished with value: -1.5883715404040841 and parameters: {'n_layers_yyx': 2, 'hidden_size_yyx_l0': 6, 'hidden_size_yyx_l1': 6, 'context_size_yyx': 1, 'num_mix_components_yyx': 2, 'context_extractor_yyx': 'lstm', 'activation_func_yyx': 'Tanh', 'L2_weight_yyx': 2.0257771012236093e-07, 'L_entropy_weight_yyx': 1.1965360738812027e-10, 'L_sep_weight_yyx': 1.3135784999348022e-07, 'L_scale_weight_yyx': 4.170056314061472e-09, 'learning_rate_yyx': 0.0025100648183202403}. Best is trial 3 with value: -1.6122994976195748.
[I 2026-03-18 19:35:00,402] Trial 4 pruned. 
[I 2026-03-18 19:35:03,013] Trial 7 pruned. 
[I 2026-03-18 19:35:05,471] Trial 4 finished with value: -1.5882877860056603 and parameters: {'n_layers_yyx': 2, 'hidden_size_yyx_l0': 6, 'hidden_size_yyx_l1': 5, 'context_size_yyx': 3, 'num_mix_components_yyx': 1, 'context_extractor_yyx': 'lstm', 'activation_func_yyx': 'GELU', 'L2_weight_yyx': 0.00010452124941054366, 'L_entropy_weight_yyx': 6.34521938822524e-05, 'L_sep_weight_yyx': 3.825072905815369e-10, 'L_scale_weight_yyx': 6.559363205189853e-08, 'learning_rate_yyx': 0.0012397381836906636}. Best is trial 0 with value: -1.613474194617056.
[I 2026-03-18 19:35:05,869] Trial 6 pruned. 
[I 2026-03-18 19:35:06,805] Trial 6 finished with value: -1.6138916292805545 and parameters: {'n_layers_yyx': 1, 'hidden_size_yyx_l0': 2, 'context_size_yyx': 3, 'num_mix_components_yyx': 1, 'context_extractor_yyx': 'lstm', 'activation_func_yyx': 'ReLU', 'L2_weight_yyx': 1.869398981824232e-05, 'L_entropy_weight_yyx': 2.028167787552986e-08, 'L_sep_weight_yyx': 8.63476114754486e-09, 'L_scale_weight_yyx': 1.6930127434160564e-07, 'learning_rate_yyx': 0.0008706349643164994}. Best is trial 0 with value: -1.6395011021807235.
[I 2026-03-18 19:35:07,165] Trial 4 finished with value: -1.6125985509637608 and parameters: {'n_layers_yyx': 1, 'hidden_size_yyx_l0': 2, 'context_size_yyx': 4, 'num_mix_components_yyx': 3, 'context_extractor_yyx': 'gru', 'activation_func_yyx': 'ReLU', 'L2_weight_yyx': 2.0245601268115073e-05, 'L_entropy_weight_yyx': 2.4259704508759516e-07, 'L_sep_weight_yyx': 1.4613185830384238e-07, 'L_scale_weight_yyx': 2.289806072914938e-06, 'learning_rate_yyx': 0.004800614978440318}. Best is trial 2 with value: -1.6133203092563246.
[I 2026-03-18 19:35:09,337] Trial 4 pruned. 
[I 2026-03-18 19:35:11,141] Trial 8 pruned. 
[I 2026-03-18 19:35:11,625] Trial 10 finished with value: -1.611395836721172 and parameters: {'n_layers_yyx': 1, 'hidden_size_yyx_l0': 4, 'context_size_yyx': 3, 'num_mix_components_yyx': 4, 'context_extractor_yyx': 'lstm', 'activation_func_yyx': 'ReLU', 'L2_weight_yyx': 1.3677801772639528e-10, 'L_entropy_weight_yyx': 2.0620683773709316e-07, 'L_sep_weight_yyx': 1.25813400056759e-10, 'L_scale_weight_yyx': 3.9994825455995825e-06, 'learning_rate_yyx': 0.0048178086415058535}. Best is trial 9 with value: -1.612120379168339.
[I 2026-03-18 19:35:14,007] Trial 6 pruned. 
[I 2026-03-18 19:35:17,027] Trial 7 pruned. 
[I 2026-03-18 19:35:17,080] Trial 5 pruned. 
[I 2026-03-18 19:35:21,096] Trial 5 pruned. 
[I 2026-03-18 19:35:24,263] Trial 9 pruned. 
[I 2026-03-18 19:35:25,645] Trial 11 pruned. 
[I 2026-03-18 19:35:28,794] Trial 4 finished with value: -2.079330650795324 and parameters: {'n_layers_yyx': 1, 'hidden_size_yyx_l0': 4, 'context_size_yyx': 1, 'num_mix_components_yyx': 1, 'context_extractor_yyx': 'lstm', 'activation_func_yyx': 'ReLU', 'L2_weight_yyx': 1.4111357164105306e-05, 'L_entropy_weight_yyx': 1.7172811398196335e-10, 'L_sep_weight_yyx': 0.00024528854618257896, 'L_scale_weight_yyx': 5.499597584769619e-09, 'learning_rate_yyx': 0.005696828028366695}. Best is trial 0 with value: -2.0812970228057153.
[I 2026-03-18 19:35:29,652] Trial 9 finished with value: -1.6332433794773524 and parameters: {'n_layers_yyx': 2, 'hidden_size_yyx_l0': 6, 'hidden_size_yyx_l1': 2, 'context_size_yyx': 3, 'num_mix_components_yyx': 2, 'context_extractor_yyx': 'gru', 'activation_func_yyx': 'GELU', 'L2_weight_yyx': 6.247377956664174e-10, 'L_entropy_weight_yyx': 4.6690553410429005e-08, 'L_sep_weight_yyx': 0.0002669201277859731, 'L_scale_weight_yyx': 4.073526444424914e-09, 'learning_rate_yyx': 0.009538801999527302}. Best is trial 7 with value: -1.6469855686269512.
[I 2026-03-18 19:35:34,222] Trial 7 pruned. 
[I 2026-03-18 19:35:34,223] Trial 6 pruned. 
[I 2026-03-18 19:35:36,520] Trial 10 pruned. 
[I 2026-03-18 19:35:40,498] Trial 12 pruned. 
[I 2026-03-18 19:35:49,217] Trial 8 pruned. 
[I 2026-03-18 19:35:49,570] Trial 7 pruned. 
[I 2026-03-18 19:35:50,236] Trial 4 finished with value: -1.6083902337046405 and parameters: {'n_layers_yyx': 2, 'hidden_size_yyx_l0': 6, 'hidden_size_yyx_l1': 4, 'context_size_yyx': 3, 'num_mix_components_yyx': 3, 'context_extractor_yyx': 'lstm', 'activation_func_yyx': 'GELU', 'L2_weight_yyx': 2.5783557515037425e-09, 'L_entropy_weight_yyx': 1.5004101250313371e-09, 'L_sep_weight_yyx': 8.952440538850437e-05, 'L_scale_weight_yyx': 4.786087000770783e-10, 'learning_rate_yyx': 0.0007054888158458268}. Best is trial 3 with value: -1.6104712811479323.
[I 2026-03-18 19:35:52,999] Trial 13 pruned. 
[I 2026-03-18 19:35:55,165] Trial 5 finished with value: -1.6144105896050156 and parameters: {'n_layers_yyx': 1, 'hidden_size_yyx_l0': 2, 'context_size_yyx': 3, 'num_mix_components_yyx': 3, 'context_extractor_yyx': 'gru', 'activation_func_yyx': 'Tanh', 'L2_weight_yyx': 2.235921510460468e-06, 'L_entropy_weight_yyx': 9.36806881303997e-07, 'L_sep_weight_yyx': 9.619162397885142e-08, 'L_scale_weight_yyx': 8.01578930477768e-10, 'learning_rate_yyx': 0.006894977708737074}. Best is trial 5 with value: -1.6144105896050156.
[I 2026-03-18 19:36:01,376] Trial 3 finished with value: -2.0809704616731484 and parameters: {'n_layers_yyx': 1, 'hidden_size_yyx_l0': 4, 'context_size_yyx': 2, 'num_mix_components_yyx': 4, 'context_extractor_yyx': 'lstm', 'activation_func_yyx': 'ReLU', 'L2_weight_yyx': 4.576891904635391e-08, 'L_entropy_weight_yyx': 1.3808477037136294e-08, 'L_sep_weight_yyx': 0.0003028759461953783, 'L_scale_weight_yyx': 1.2513758025204586e-05, 'learning_rate_yyx': 0.009684710094446417}. Best is trial 0 with value: -2.0940855781262293.
[I 2026-03-18 19:36:04,413] Trial 5 pruned. 
[I 2026-03-18 19:36:04,417] Trial 9 pruned. 
[I 2026-03-18 19:36:08,261] Trial 11 pruned. 
[I 2026-03-18 19:36:18,047] Trial 6 pruned. 
[I 2026-03-18 19:36:19,258] Trial 5 pruned. 
[I 2026-03-18 19:36:19,264] Trial 5 pruned. 
[I 2026-03-18 19:36:19,286] Trial 8 pruned. 
[I 2026-03-18 19:36:24,271] Trial 6 pruned. 
[I 2026-03-18 19:36:32,099] Trial 4 pruned. 
[I 2026-03-18 19:36:33,807] Trial 9 pruned. 
[I 2026-03-18 19:36:34,224] Trial 4 finished with value: -2.0838728149106776 and parameters: {'n_layers_yyx': 2, 'hidden_size_yyx_l0': 3, 'hidden_size_yyx_l1': 6, 'context_size_yyx': 4, 'num_mix_components_yyx': 1, 'context_extractor_yyx': 'gru', 'activation_func_yyx': 'ReLU', 'L2_weight_yyx': 1.6633792169132974e-10, 'L_entropy_weight_yyx': 2.9015647848288236e-05, 'L_sep_weight_yyx': 0.00036367869075534207, 'L_scale_weight_yyx': 2.3701876547490045e-09, 'learning_rate_yyx': 0.005241770926240704}. Best is trial 4 with value: -2.0838728149106776.
[I 2026-03-18 19:36:42,765] Trial 8 finished with value: -1.6134523538702668 and parameters: {'n_layers_yyx': 2, 'hidden_size_yyx_l0': 2, 'hidden_size_yyx_l1': 3, 'context_size_yyx': 4, 'num_mix_components_yyx': 3, 'context_extractor_yyx': 'gru', 'activation_func_yyx': 'Tanh', 'L2_weight_yyx': 2.176975887579419e-08, 'L_entropy_weight_yyx': 2.8625865432139396e-07, 'L_sep_weight_yyx': 7.533728764606253e-10, 'L_scale_weight_yyx': 2.059218551423872e-05, 'learning_rate_yyx': 0.0077020604284396225}. Best is trial 8 with value: -1.6134523538702668.
[I 2026-03-18 19:36:43,995] Trial 7 pruned. 
[I 2026-03-18 19:36:46,887] Trial 6 pruned. 
[I 2026-03-18 19:36:49,827] Trial 10 pruned. 
[I 2026-03-18 19:36:52,381] Trial 5 pruned. 
[I 2026-03-18 19:36:55,957] Trial 9 pruned. 
[I 2026-03-18 19:37:00,487] Trial 8 pruned. 
[I 2026-03-18 19:37:03,674] Trial 11 pruned. 
[I 2026-03-18 19:37:08,133] Trial 6 pruned. 
[I 2026-03-18 19:37:36,283] Trial 7 pruned. 
[I 2026-03-18 19:37:39,099] Trial 7 finished with value: -1.6077896387869492 and parameters: {'n_layers_yyx': 1, 'hidden_size_yyx_l0': 3, 'context_size_yyx': 4, 'num_mix_components_yyx': 4, 'context_extractor_yyx': 'gru', 'activation_func_yyx': 'Tanh', 'L2_weight_yyx': 0.0007923316343259957, 'L_entropy_weight_yyx': 1.2927127704563319e-08, 'L_sep_weight_yyx': 2.037873227685099e-10, 'L_scale_weight_yyx': 0.0007486505306735638, 'learning_rate_yyx': 0.009666886107753844}. Best is trial 7 with value: -1.6077896387869492.
[I 2026-03-18 19:37:49,659] Trial 8 pruned. 
[I 2026-03-18 19:37:50,054] Trial 10 finished with value: -1.6494968268544676 and parameters: {'n_layers_yyx': 2, 'hidden_size_yyx_l0': 4, 'hidden_size_yyx_l1': 6, 'context_size_yyx': 4, 'num_mix_components_yyx': 5, 'context_extractor_yyx': 'gru', 'activation_func_yyx': 'ReLU', 'L2_weight_yyx': 7.992176802076129e-06, 'L_entropy_weight_yyx': 0.0003350685704082171, 'L_sep_weight_yyx': 1.167925526750373e-10, 'L_scale_weight_yyx': 0.00034017984983699995, 'learning_rate_yyx': 0.004580035139885552}. Best is trial 10 with value: -1.6494968268544676.
[I 2026-03-18 19:38:27,395] Trial 10 finished with value: -2.0956159050676995 and parameters: {'n_layers_yyx': 1, 'hidden_size_yyx_l0': 4, 'context_size_yyx': 4, 'num_mix_components_yyx': 5, 'context_extractor_yyx': 'lstm', 'activation_func_yyx': 'Tanh', 'L2_weight_yyx': 1.7815142098981934e-08, 'L_entropy_weight_yyx': 1.4173993622267015e-08, 'L_sep_weight_yyx': 1.219211221802967e-08, 'L_scale_weight_yyx': 1.4867754503653643e-10, 'learning_rate_yyx': 0.009539233147589659}. Best is trial 10 with value: -2.0956159050676995.
[I 2026-03-18 19:38:29,980] Trial 6 finished with value: -2.0770656616902334 and parameters: {'n_layers_yyx': 2, 'hidden_size_yyx_l0': 5, 'hidden_size_yyx_l1': 5, 'context_size_yyx': 3, 'num_mix_components_yyx': 3, 'context_extractor_yyx': 'lstm', 'activation_func_yyx': 'Tanh', 'L2_weight_yyx': 9.455479444294463e-08, 'L_entropy_weight_yyx': 6.424171450662593e-08, 'L_sep_weight_yyx': 7.702275047391307e-07, 'L_scale_weight_yyx': 8.686356116897821e-09, 'learning_rate_yyx': 0.008713545452996789}. Best is trial 2 with value: -2.093203554819634.
[I 2026-03-18 19:38:31,321] Trial 8 finished with value: -2.076012831088607 and parameters: {'n_layers_yyx': 2, 'hidden_size_yyx_l0': 5, 'hidden_size_yyx_l1': 2, 'context_size_yyx': 2, 'num_mix_components_yyx': 1, 'context_extractor_yyx': 'gru', 'activation_func_yyx': 'GELU', 'L2_weight_yyx': 0.00033857442773323627, 'L_entropy_weight_yyx': 1.8406924529409134e-07, 'L_sep_weight_yyx': 4.62743141093172e-10, 'L_scale_weight_yyx': 2.1122600146615e-09, 'learning_rate_yyx': 0.004187963130652914}. Best is trial 2 with value: -2.085195656623902.
[I 2026-03-18 19:38:41,208] Trial 9 pruned. 
[I 2026-03-18 19:38:41,615] Trial 7 pruned. 
[I 2026-03-18 19:38:59,943] Trial 5 finished with value: -1.5874772591333246 and parameters: {'n_layers_yyx': 1, 'hidden_size_yyx_l0': 2, 'context_size_yyx': 4, 'num_mix_components_yyx': 2, 'context_extractor_yyx': 'gru', 'activation_func_yyx': 'ReLU', 'L2_weight_yyx': 8.462844402100044e-07, 'L_entropy_weight_yyx': 0.0005340031372311477, 'L_sep_weight_yyx': 8.993766667470206e-08, 'L_scale_weight_yyx': 1.4756405662749066e-09, 'learning_rate_yyx': 0.0025203903771887914}. Best is trial 3 with value: -1.6122994976195748.
[I 2026-03-18 19:39:02,868] Trial 12 finished with value: -2.0516367859113616 and parameters: {'n_layers_yyx': 2, 'hidden_size_yyx_l0': 5, 'hidden_size_yyx_l1': 6, 'context_size_yyx': 2, 'num_mix_components_yyx': 3, 'context_extractor_yyx': 'gru', 'activation_func_yyx': 'ReLU', 'L2_weight_yyx': 2.1910197868635584e-09, 'L_entropy_weight_yyx': 6.978760532501641e-06, 'L_sep_weight_yyx': 0.000955232761089069, 'L_scale_weight_yyx': 8.610027822697633e-08, 'learning_rate_yyx': 0.004748773559401648}. Best is trial 2 with value: -2.059868681386501.
[I 2026-03-18 19:39:03,607] Trial 7 pruned. 
[I 2026-03-18 19:39:07,818] Trial 6 finished with value: -1.6012851321643777 and parameters: {'n_layers_yyx': 2, 'hidden_size_yyx_l0': 2, 'hidden_size_yyx_l1': 3, 'context_size_yyx': 1, 'num_mix_components_yyx': 3, 'context_extractor_yyx': 'lstm', 'activation_func_yyx': 'Tanh', 'L2_weight_yyx': 1.032059773478923e-09, 'L_entropy_weight_yyx': 2.118891058144374e-09, 'L_sep_weight_yyx': 9.689575003851151e-08, 'L_scale_weight_yyx': 2.754605899708984e-05, 'learning_rate_yyx': 0.000986271928052461}. Best is trial 3 with value: -1.6307942617099915.
[I 2026-03-18 19:39:09,879] Trial 6 pruned. 
[I 2026-03-18 19:39:13,707] Trial 13 pruned. 
[I 2026-03-18 19:39:14,041] Trial 12 finished with value: -1.5867245794137672 and parameters: {'n_layers_yyx': 2, 'hidden_size_yyx_l0': 4, 'hidden_size_yyx_l1': 4, 'context_size_yyx': 4, 'num_mix_components_yyx': 2, 'context_extractor_yyx': 'lstm', 'activation_func_yyx': 'ReLU', 'L2_weight_yyx': 2.5304528374535097e-05, 'L_entropy_weight_yyx': 8.702226933862578e-08, 'L_sep_weight_yyx': 9.689546477834694e-06, 'L_scale_weight_yyx': 3.5960435645607377e-09, 'learning_rate_yyx': 0.004300127280784623}. Best is trial 1 with value: -1.6113757535901372.
[I 2026-03-18 19:39:14,849] Trial 6 finished with value: -1.611924096268822 and parameters: {'n_layers_yyx': 2, 'hidden_size_yyx_l0': 3, 'hidden_size_yyx_l1': 4, 'context_size_yyx': 2, 'num_mix_components_yyx': 4, 'context_extractor_yyx': 'lstm', 'activation_func_yyx': 'GELU', 'L2_weight_yyx': 2.1331882355960117e-06, 'L_entropy_weight_yyx': 1.9763959574767065e-05, 'L_sep_weight_yyx': 7.074606667903396e-05, 'L_scale_weight_yyx': 2.995079988675409e-05, 'learning_rate_yyx': 0.002203113103254374}. Best is trial 2 with value: -1.6133203092563246.
