Warning: Failed writing log files to directory [/var/log/nvidia-mps]. No logs will be available.
Result file already exists: results/opt-full/opt_full_132_best_config.txt
Result file already exists: results/opt-full/opt_full_131_best_config.txt
Result file already exists: results/opt-full/opt_full_151_best_config.txt
Result file already exists: results/opt-full/opt_full_133_best_config.txt
Result file already exists: results/opt-full/opt_full_156_best_config.txt
Result file already exists: results/opt-full/opt_full_129_best_config.txt
Result file already exists: results/opt-full/opt_full_141_best_config.txt
Result file already exists: results/opt-full/opt_full_138_best_config.txt
Result file already exists: results/opt-full/opt_full_159_best_config.txt
Result file already exists: results/opt-full/opt_full_142_best_config.txt
Result file already exists: results/opt-full/opt_full_143_best_config.txt
Result file already exists: results/opt-full/opt_full_149_best_config.txt
Result file already exists: results/opt-full/opt_full_130_best_config.txt
Result file already exists: results/opt-full/opt_full_140_best_config.txt
Result file already exists: results/opt-full/opt_full_137_best_config.txt
Result file already exists: results/opt-full/opt_full_155_best_config.txt
Result file already exists: results/opt-full/opt_full_157_best_config.txt
Result file already exists: results/opt-full/opt_full_153_best_config.txt
Result file already exists: results/opt-full/opt_full_135_best_config.txt
Result file already exists: results/opt-full/opt_full_139_best_config.txt
Result file already exists: results/opt-full/opt_full_150_best_config.txt
Result file already exists: results/opt-full/opt_full_145_best_config.txt
Result file already exists: results/opt-full/opt_full_146_best_config.txt
Result file already exists: results/opt-full/opt_full_144_best_config.txt
Result file already exists: results/opt-full/opt_full_154_best_config.txt
Result file already exists: results/opt-full/opt_full_148_best_config.txt
Result file already exists: results/opt-full/opt_full_136_best_config.txt
Result file already exists: results/opt-full/opt_full_147_best_config.txt
Result file already exists: results/opt-full/opt_full_134_best_config.txt
Result file already exists: results/opt-full/opt_full_158_best_config.txt
Result file already exists: results/opt-full/opt_full_152_best_config.txt
[I 2026-03-18 22:38:37,461] Using an existing study with name 'opt_full-model_seed=42_task=128' instead of creating a new one.
[I 2026-03-18 22:39:57,735] Trial 5 finished with value: -2.6286091809001446 and parameters: {'n_layers_yyx': 2, 'hidden_size_yyx_l0': 4, 'hidden_size_yyx_l1': 2, 'context_size_yyx': 2, 'num_mix_components_yyx': 3, 'context_extractor_yyx': 'gru', 'activation_func_yyx': 'GELU', 'L2_weight_yyx': 1.1955836614571956e-09, 'L_entropy_weight_yyx': 8.910304355064148e-07, 'L_sep_weight_yyx': 1.1688925820944006e-05, 'L_scale_weight_yyx': 8.089210542588213e-05, 'learning_rate_yyx': 0.006982974120035651}. Best is trial 5 with value: -2.6286091809001446.
[I 2026-03-18 22:41:06,643] Trial 6 finished with value: -2.630811118659865 and parameters: {'n_layers_yyx': 1, 'hidden_size_yyx_l0': 3, 'context_size_yyx': 2, 'num_mix_components_yyx': 5, 'context_extractor_yyx': 'gru', 'activation_func_yyx': 'Tanh', 'L2_weight_yyx': 1.6774966920843613e-09, 'L_entropy_weight_yyx': 1.006307527321647e-07, 'L_sep_weight_yyx': 0.00010518523587807845, 'L_scale_weight_yyx': 6.584314941485399e-08, 'learning_rate_yyx': 0.004525502575162633}. Best is trial 6 with value: -2.630811118659865.
[I 2026-03-18 22:41:36,802] Trial 7 finished with value: -2.6011969414344938 and parameters: {'n_layers_yyx': 2, 'hidden_size_yyx_l0': 5, 'hidden_size_yyx_l1': 5, 'context_size_yyx': 3, 'num_mix_components_yyx': 2, 'context_extractor_yyx': 'gru', 'activation_func_yyx': 'GELU', 'L2_weight_yyx': 2.7279299720014947e-10, 'L_entropy_weight_yyx': 2.58004070742611e-10, 'L_sep_weight_yyx': 1.5854001225884881e-06, 'L_scale_weight_yyx': 1.9681509306041524e-05, 'learning_rate_yyx': 0.008973484125784971}. Best is trial 6 with value: -2.630811118659865.
[I 2026-03-18 22:42:25,507] Trial 8 finished with value: -2.5965156159435416 and parameters: {'n_layers_yyx': 1, 'hidden_size_yyx_l0': 4, 'context_size_yyx': 1, 'num_mix_components_yyx': 3, 'context_extractor_yyx': 'gru', 'activation_func_yyx': 'GELU', 'L2_weight_yyx': 1.3541019923886955e-06, 'L_entropy_weight_yyx': 3.6266384533174825e-06, 'L_sep_weight_yyx': 6.885592663978216e-05, 'L_scale_weight_yyx': 5.683575598613192e-09, 'learning_rate_yyx': 0.007094798910248989}. Best is trial 6 with value: -2.630811118659865.
[I 2026-03-18 22:42:30,329] Trial 9 pruned. 
[I 2026-03-18 22:43:47,406] Trial 10 finished with value: -2.629847392538215 and parameters: {'n_layers_yyx': 1, 'hidden_size_yyx_l0': 6, 'context_size_yyx': 3, 'num_mix_components_yyx': 3, 'context_extractor_yyx': 'gru', 'activation_func_yyx': 'Tanh', 'L2_weight_yyx': 3.967320363386435e-06, 'L_entropy_weight_yyx': 6.612374290180132e-06, 'L_sep_weight_yyx': 1.4206562606318746e-08, 'L_scale_weight_yyx': 1.0078976409397614e-05, 'learning_rate_yyx': 0.002183084430031229}. Best is trial 6 with value: -2.630811118659865.
[I 2026-03-18 22:43:58,415] Trial 11 pruned. 
[I 2026-03-18 22:44:03,192] Trial 12 pruned. 
[I 2026-03-18 22:44:14,439] Trial 13 pruned. 
[I 2026-03-18 22:45:15,478] Trial 14 finished with value: -2.6003961739994303 and parameters: {'n_layers_yyx': 1, 'hidden_size_yyx_l0': 3, 'context_size_yyx': 3, 'num_mix_components_yyx': 2, 'context_extractor_yyx': 'gru', 'activation_func_yyx': 'Tanh', 'L2_weight_yyx': 1.0296818960122125e-10, 'L_entropy_weight_yyx': 1.1917283099915485e-05, 'L_sep_weight_yyx': 1.4140271614441805e-07, 'L_scale_weight_yyx': 8.773290056892067e-08, 'learning_rate_yyx': 0.004456719205283788}. Best is trial 6 with value: -2.630811118659865.
[I 2026-03-18 22:45:19,996] Trial 15 pruned. 
[I 2026-03-18 22:45:30,975] Trial 16 pruned. 
[I 2026-03-18 22:45:35,575] Trial 17 pruned. 
[I 2026-03-18 22:45:46,775] Trial 18 pruned. 
[I 2026-03-18 22:46:33,267] Trial 19 finished with value: -2.5981440515647103 and parameters: {'n_layers_yyx': 1, 'hidden_size_yyx_l0': 5, 'context_size_yyx': 3, 'num_mix_components_yyx': 4, 'context_extractor_yyx': 'lstm', 'activation_func_yyx': 'Tanh', 'L2_weight_yyx': 2.1459657605446794e-08, 'L_entropy_weight_yyx': 2.98312289488825e-09, 'L_sep_weight_yyx': 0.0004893382646998546, 'L_scale_weight_yyx': 5.3115880449471615e-09, 'learning_rate_yyx': 0.002483924949531864}. Best is trial 6 with value: -2.630811118659865.
[I 2026-03-18 22:46:37,880] Trial 20 pruned. 
[I 2026-03-18 22:46:42,425] Trial 21 pruned. 
[I 2026-03-18 22:46:53,596] Trial 22 pruned. 
[I 2026-03-18 22:47:04,783] Trial 23 pruned. 
[I 2026-03-18 22:47:29,914] Trial 24 finished with value: -2.6020679443896624 and parameters: {'n_layers_yyx': 2, 'hidden_size_yyx_l0': 4, 'hidden_size_yyx_l1': 4, 'context_size_yyx': 2, 'num_mix_components_yyx': 3, 'context_extractor_yyx': 'gru', 'activation_func_yyx': 'GELU', 'L2_weight_yyx': 7.697986239287501e-08, 'L_entropy_weight_yyx': 3.1977677339362687e-07, 'L_sep_weight_yyx': 5.43126393642896e-07, 'L_scale_weight_yyx': 1.0665495601639325e-05, 'learning_rate_yyx': 0.009926770604785584}. Best is trial 6 with value: -2.630811118659865.
[I 2026-03-18 22:48:17,255] Trial 25 finished with value: -2.5988337814489353 and parameters: {'n_layers_yyx': 2, 'hidden_size_yyx_l0': 5, 'hidden_size_yyx_l1': 2, 'context_size_yyx': 3, 'num_mix_components_yyx': 2, 'context_extractor_yyx': 'gru', 'activation_func_yyx': 'GELU', 'L2_weight_yyx': 2.681849687563696e-06, 'L_entropy_weight_yyx': 9.945138100277013e-06, 'L_sep_weight_yyx': 0.00020243399103207752, 'L_scale_weight_yyx': 3.659608502965272e-05, 'learning_rate_yyx': 0.005448109571951685}. Best is trial 6 with value: -2.630811118659865.
[I 2026-03-18 22:48:21,711] Trial 26 pruned. 
[I 2026-03-18 22:49:15,717] Trial 27 finished with value: -2.630722846972871 and parameters: {'n_layers_yyx': 2, 'hidden_size_yyx_l0': 6, 'hidden_size_yyx_l1': 3, 'context_size_yyx': 1, 'num_mix_components_yyx': 3, 'context_extractor_yyx': 'lstm', 'activation_func_yyx': 'Tanh', 'L2_weight_yyx': 1.4122014961452104e-10, 'L_entropy_weight_yyx': 1.6618942448810593e-06, 'L_sep_weight_yyx': 5.786147256092759e-10, 'L_scale_weight_yyx': 2.5241744558310794e-07, 'learning_rate_yyx': 0.002776580611720581}. Best is trial 6 with value: -2.630811118659865.
[I 2026-03-18 22:49:26,610] Trial 28 pruned. 
[I 2026-03-18 22:49:37,684] Trial 29 pruned. 
[I 2026-03-18 22:50:07,431] Trial 30 pruned. 
[I 2026-03-18 22:51:28,836] Trial 31 finished with value: -2.5963335849698406 and parameters: {'n_layers_yyx': 2, 'hidden_size_yyx_l0': 5, 'hidden_size_yyx_l1': 3, 'context_size_yyx': 1, 'num_mix_components_yyx': 2, 'context_extractor_yyx': 'lstm', 'activation_func_yyx': 'Tanh', 'L2_weight_yyx': 3.7974741270585425e-09, 'L_entropy_weight_yyx': 4.0917908628953185e-06, 'L_sep_weight_yyx': 1.4260235688468502e-08, 'L_scale_weight_yyx': 1.1298156406381576e-07, 'learning_rate_yyx': 0.001146322719286718}. Best is trial 6 with value: -2.630811118659865.
[I 2026-03-18 22:51:59,359] Trial 32 pruned. 
[I 2026-03-18 22:52:10,462] Trial 33 pruned. 
[I 2026-03-18 22:52:15,097] Trial 34 pruned. 
[I 2026-03-18 22:52:19,701] Trial 35 pruned. 
[I 2026-03-18 22:52:58,223] Trial 36 finished with value: -2.598506156396131 and parameters: {'n_layers_yyx': 2, 'hidden_size_yyx_l0': 4, 'hidden_size_yyx_l1': 4, 'context_size_yyx': 3, 'num_mix_components_yyx': 4, 'context_extractor_yyx': 'gru', 'activation_func_yyx': 'Tanh', 'L2_weight_yyx': 2.4728234962957505e-10, 'L_entropy_weight_yyx': 3.817159250600087e-08, 'L_sep_weight_yyx': 1.2081833264554614e-05, 'L_scale_weight_yyx': 9.222968708323395e-07, 'learning_rate_yyx': 0.004509900796601657}. Best is trial 6 with value: -2.630811118659865.
[I 2026-03-18 22:53:29,141] Trial 37 pruned. 
[I 2026-03-18 22:53:40,013] Trial 38 pruned. 
[I 2026-03-18 22:53:44,376] Trial 39 pruned. 
[I 2026-03-18 22:53:49,002] Trial 40 pruned. 
[I 2026-03-18 22:53:59,867] Trial 41 pruned. 
[I 2026-03-18 22:54:30,350] Trial 42 pruned. 
[I 2026-03-18 22:55:01,093] Trial 43 pruned. 
[I 2026-03-18 22:55:30,473] Trial 44 finished with value: -2.600922273637663 and parameters: {'n_layers_yyx': 2, 'hidden_size_yyx_l0': 5, 'hidden_size_yyx_l1': 4, 'context_size_yyx': 2, 'num_mix_components_yyx': 3, 'context_extractor_yyx': 'gru', 'activation_func_yyx': 'GELU', 'L2_weight_yyx': 9.158788943273993e-09, 'L_entropy_weight_yyx': 1.985791281026606e-08, 'L_sep_weight_yyx': 2.0004868682815136e-07, 'L_scale_weight_yyx': 7.643349909288618e-08, 'learning_rate_yyx': 0.009679956533245389}. Best is trial 6 with value: -2.630811118659865.
[I 2026-03-18 22:56:01,153] Trial 45 pruned. 
[I 2026-03-18 22:57:31,954] Trial 46 finished with value: -2.63402339835768 and parameters: {'n_layers_yyx': 2, 'hidden_size_yyx_l0': 4, 'hidden_size_yyx_l1': 2, 'context_size_yyx': 2, 'num_mix_components_yyx': 3, 'context_extractor_yyx': 'gru', 'activation_func_yyx': 'GELU', 'L2_weight_yyx': 2.8072004679243403e-08, 'L_entropy_weight_yyx': 2.8794552876645715e-07, 'L_sep_weight_yyx': 2.1545089481733957e-05, 'L_scale_weight_yyx': 5.975049721938985e-05, 'learning_rate_yyx': 0.00617859741790663}. Best is trial 46 with value: -2.63402339835768.
[I 2026-03-18 22:57:36,401] Trial 47 pruned. 
[I 2026-03-18 22:57:41,016] Trial 48 pruned. 
[I 2026-03-18 22:58:51,805] Trial 49 finished with value: -2.599593075293859 and parameters: {'n_layers_yyx': 1, 'hidden_size_yyx_l0': 5, 'context_size_yyx': 2, 'num_mix_components_yyx': 1, 'context_extractor_yyx': 'gru', 'activation_func_yyx': 'Tanh', 'L2_weight_yyx': 2.328645003740029e-09, 'L_entropy_weight_yyx': 6.929791283772249e-07, 'L_sep_weight_yyx': 6.775337119216285e-05, 'L_scale_weight_yyx': 4.592322844867206e-05, 'learning_rate_yyx': 0.0024347474122240827}. Best is trial 46 with value: -2.63402339835768.
[I 2026-03-18 22:58:56,383] Trial 50 pruned. 
[I 2026-03-18 22:59:07,340] Trial 51 pruned. 
[I 2026-03-18 22:59:11,847] Trial 52 pruned. 
[I 2026-03-18 23:00:19,412] Trial 53 finished with value: -2.600184402537773 and parameters: {'n_layers_yyx': 2, 'hidden_size_yyx_l0': 4, 'hidden_size_yyx_l1': 3, 'context_size_yyx': 2, 'num_mix_components_yyx': 3, 'context_extractor_yyx': 'gru', 'activation_func_yyx': 'GELU', 'L2_weight_yyx': 5.201347535599042e-09, 'L_entropy_weight_yyx': 2.0375508489645997e-07, 'L_sep_weight_yyx': 6.102088875519885e-06, 'L_scale_weight_yyx': 5.496885692153539e-07, 'learning_rate_yyx': 0.0056318410164625}. Best is trial 46 with value: -2.63402339835768.
[I 2026-03-18 23:01:17,558] Trial 54 finished with value: -2.6318090943111936 and parameters: {'n_layers_yyx': 2, 'hidden_size_yyx_l0': 4, 'hidden_size_yyx_l1': 2, 'context_size_yyx': 2, 'num_mix_components_yyx': 5, 'context_extractor_yyx': 'gru', 'activation_func_yyx': 'GELU', 'L2_weight_yyx': 2.2114861427504446e-08, 'L_entropy_weight_yyx': 3.9067834642868426e-07, 'L_sep_weight_yyx': 2.3668723244119665e-06, 'L_scale_weight_yyx': 5.838854504772631e-06, 'learning_rate_yyx': 0.008722441307580745}. Best is trial 46 with value: -2.63402339835768.

Source events: 32635
Target events: 18269
Full model ln_yyx : 2592.45841 nats/sec, 127.71430 nats/event
Full model Log loss : -2.62861
Full model ln_yyx : 2597.47552 nats/sec, 127.96146 nats/event
Full model Log loss : -2.63081
Full model ln_yyx : 2584.91078 nats/sec, 127.34248 nats/event
Full model Log loss : -2.60120
Full model ln_yyx : 2563.89265 nats/sec, 126.30704 nats/event
Full model Log loss : -2.59652
Full model ln_yyx : 2608.30240 nats/sec, 128.49484 nats/event
Full model Log loss : -2.62985
Full model ln_yyx : 2573.67539 nats/sec, 126.78898 nats/event
Full model Log loss : -2.60040
Full model ln_yyx : 2573.05107 nats/sec, 126.75822 nats/event
Full model Log loss : -2.59814
Full model ln_yyx : 2588.86335 nats/sec, 127.53719 nats/event
Full model Log loss : -2.60207
Full model ln_yyx : 2571.35601 nats/sec, 126.67472 nats/event
Full model Log loss : -2.59883
Full model ln_yyx : 2586.39427 nats/sec, 127.41556 nats/event
Full model Log loss : -2.63072
Full model ln_yyx : 2549.70670 nats/sec, 125.60819 nats/event
Full model Log loss : -2.59633
Full model ln_yyx : 2564.09603 nats/sec, 126.31706 nats/event
Full model Log loss : -2.59851
Full model ln_yyx : 2575.99743 nats/sec, 126.90337 nats/event
Full model Log loss : -2.60092
Full model ln_yyx : 2604.84240 nats/sec, 128.32438 nats/event
Full model Log loss : -2.63402
Full model ln_yyx : 2571.57380 nats/sec, 126.68545 nats/event
Full model Log loss : -2.59959
Full model ln_yyx : 2574.82332 nats/sec, 126.84553 nats/event
Full model Log loss : -2.60018
Full model ln_yyx : 2615.87575 nats/sec, 128.86793 nats/event
Full model Log loss : -2.63181
Optimization finished. Config saved to results/opt-full/opt_full_128_best_config.txt
