[I 2026-03-18 18:57:38,712] Trial 49 finished with value: -1.6762585800582108 and parameters: {'n_layers_yyx': 2, 'hidden_size_yyx_l0': 6, 'hidden_size_yyx_l1': 5, 'context_size_yyx': 3, 'num_mix_components_yyx': 4, 'context_extractor_yyx': 'lstm', 'activation_func_yyx': 'Tanh', 'L2_weight_yyx': 2.4961880411171657e-08, 'L_entropy_weight_yyx': 8.706389470438937e-05, 'L_sep_weight_yyx': 0.0009215912740374696, 'L_scale_weight_yyx': 1.7198217510515726e-08, 'learning_rate_yyx': 0.005970079822241807}. Best is trial 41 with value: -1.6811530321578319.

Source events: 10683
Target events: 20800
Full model ln_yyx : 710.72073 nats/sec, 30.75234 nats/event
Full model Log loss : -1.67463
Full model ln_yyx : 682.40465 nats/sec, 29.52712 nats/event
Full model Log loss : -1.57592
Full model ln_yyx : 703.05898 nats/sec, 30.42082 nats/event
Full model Log loss : -1.66756
Full model ln_yyx : 679.15114 nats/sec, 29.38635 nats/event
Full model Log loss : -1.57981
Full model ln_yyx : 682.97269 nats/sec, 29.55170 nats/event
Full model Log loss : -1.58057
Full model ln_yyx : 705.82432 nats/sec, 30.54048 nats/event
Full model Log loss : -1.65814
Full model ln_yyx : 708.13741 nats/sec, 30.64056 nats/event
Full model Log loss : -1.66927
Full model ln_yyx : 704.79102 nats/sec, 30.49577 nats/event
Full model Log loss : -1.66959
Full model ln_yyx : 703.14590 nats/sec, 30.42458 nats/event
Full model Log loss : -1.66944
Full model ln_yyx : 714.43232 nats/sec, 30.91294 nats/event
Full model Log loss : -1.67579
Full model ln_yyx : 698.27316 nats/sec, 30.21374 nats/event
Full model Log loss : -1.65933
Full model ln_yyx : 699.65237 nats/sec, 30.27342 nats/event
Full model Log loss : -1.66874
Full model ln_yyx : 708.32236 nats/sec, 30.64856 nats/event
Full model Log loss : -1.67662
Full model ln_yyx : 713.02234 nats/sec, 30.85193 nats/event
Full model Log loss : -1.68095
Full model ln_yyx : 699.18686 nats/sec, 30.25328 nats/event
Full model Log loss : -1.66266
Full model ln_yyx : 708.26126 nats/sec, 30.64592 nats/event
Full model Log loss : -1.68115
Full model ln_yyx : 700.36977 nats/sec, 30.30446 nats/event
Full model Log loss : -1.66567
Full model ln_yyx : 706.92399 nats/sec, 30.58806 nats/event
Full model Log loss : -1.67418
Full model ln_yyx : 705.16688 nats/sec, 30.51203 nats/event
Full model Log loss : -1.67797
Full model ln_yyx : 700.43106 nats/sec, 30.30711 nats/event
Full model Log loss : -1.66386
Full model ln_yyx : 710.68824 nats/sec, 30.75093 nats/event
Full model Log loss : -1.67626
Optimization finished. Config saved to results/opt-full/opt_full_102_best_config.txt
[I 2026-03-18 18:57:38,807] Trial 41 pruned. 
[I 2026-03-18 18:57:44,880] Trial 46 pruned. 
[I 2026-03-18 18:57:49,207] Trial 47 pruned. 
[I 2026-03-18 18:57:49,741] Trial 37 pruned. 
[I 2026-03-18 18:57:50,337] Trial 47 finished with value: -1.657786004926518 and parameters: {'n_layers_yyx': 1, 'hidden_size_yyx_l0': 4, 'context_size_yyx': 3, 'num_mix_components_yyx': 1, 'context_extractor_yyx': 'lstm', 'activation_func_yyx': 'GELU', 'L2_weight_yyx': 1.132980266135045e-10, 'L_entropy_weight_yyx': 4.554100612977924e-07, 'L_sep_weight_yyx': 2.1962776822333767e-09, 'L_scale_weight_yyx': 2.256746628014447e-06, 'learning_rate_yyx': 0.005370762565699536}. Best is trial 13 with value: -1.6722197537243195.
[I 2026-03-18 18:57:52,339] Trial 48 pruned. 
[I 2026-03-18 18:57:53,287] Trial 48 pruned. 
[I 2026-03-18 18:57:59,526] Trial 49 pruned. 

Source events: 10683
Target events: 27060
Full model ln_yyx : 923.06738 nats/sec, 30.70069 nats/event
Full model Log loss : -1.66417
Full model ln_yyx : 914.57535 nats/sec, 30.41825 nats/event
Full model Log loss : -1.65453
Full model ln_yyx : 914.61373 nats/sec, 30.41953 nats/event
Full model Log loss : -1.66028
Full model ln_yyx : 912.99722 nats/sec, 30.36576 nats/event
Full model Log loss : -1.66336
Full model ln_yyx : 907.86986 nats/sec, 30.19523 nats/event
Full model Log loss : -1.66719
Full model ln_yyx : 913.66342 nats/sec, 30.38792 nats/event
Full model Log loss : -1.66667
Full model ln_yyx : 909.67630 nats/sec, 30.25531 nats/event
Full model Log loss : -1.67222
Full model ln_yyx : 919.03065 nats/sec, 30.56643 nats/event
Full model Log loss : -1.67116
Full model ln_yyx : 917.24320 nats/sec, 30.50698 nats/event
Full model Log loss : -1.66021
Full model ln_yyx : 913.23882 nats/sec, 30.37380 nats/event
Full model Log loss : -1.66654
Full model ln_yyx : 913.85269 nats/sec, 30.39421 nats/event
Full model Log loss : -1.67081
Full model ln_yyx : 912.64088 nats/sec, 30.35391 nats/event
Full model Log loss : -1.67022
Full model ln_yyx : 910.10840 nats/sec, 30.26968 nats/event
Full model Log loss : -1.65779
Optimization finished. Config saved to results/opt-full/opt_full_109_best_config.txt
[I 2026-03-18 18:58:00,924] Trial 47 pruned. 
[I 2026-03-18 18:58:07,047] Trial 48 pruned. 
[I 2026-03-18 18:58:07,596] Trial 49 pruned. 

Source events: 10683
Target events: 38515
Full model ln_yyx : 1307.43790 nats/sec, 30.55158 nats/event
Full model Log loss : -1.67356
Full model ln_yyx : 1315.93928 nats/sec, 30.75024 nats/event
Full model Log loss : -1.68069
Full model ln_yyx : 1322.18320 nats/sec, 30.89614 nats/event
Full model Log loss : -1.68205
Full model ln_yyx : 1288.01075 nats/sec, 30.09762 nats/event
Full model Log loss : -1.65569
Full model ln_yyx : 1303.27650 nats/sec, 30.45434 nats/event
Full model Log loss : -1.67753
Full model ln_yyx : 1312.56103 nats/sec, 30.67129 nats/event
Full model Log loss : -1.68029
Full model ln_yyx : 1312.34039 nats/sec, 30.66614 nats/event
Full model Log loss : -1.68031
Full model ln_yyx : 1318.69005 nats/sec, 30.81451 nats/event
Full model Log loss : -1.67547
Full model ln_yyx : 1315.66554 nats/sec, 30.74384 nats/event
Full model Log loss : -1.68336
Full model ln_yyx : 1312.23700 nats/sec, 30.66372 nats/event
Full model Log loss : -1.68032
Full model ln_yyx : 1326.77283 nats/sec, 31.00339 nats/event
Full model Log loss : -1.68299
Full model ln_yyx : 1306.58321 nats/sec, 30.53161 nats/event
Full model Log loss : -1.67313
Full model ln_yyx : 1276.41226 nats/sec, 29.82659 nats/event
Full model Log loss : -1.59006
Optimization finished. Config saved to results/opt-full/opt_full_108_best_config.txt
[I 2026-03-18 18:58:12,718] Trial 49 pruned. 

Source events: 10683
Target events: 14713
Full model ln_yyx : 497.35887 nats/sec, 30.42364 nats/event
Full model Log loss : -1.67030
Full model ln_yyx : 495.94601 nats/sec, 30.33721 nats/event
Full model Log loss : -1.65516
Full model ln_yyx : 502.07658 nats/sec, 30.71222 nats/event
Full model Log loss : -1.65835
Full model ln_yyx : 492.34949 nats/sec, 30.11721 nats/event
Full model Log loss : -1.65796
Full model ln_yyx : 491.10408 nats/sec, 30.04103 nats/event
Full model Log loss : -1.65014
Full model ln_yyx : 494.56071 nats/sec, 30.25247 nats/event
Full model Log loss : -1.66053
Full model ln_yyx : 501.10341 nats/sec, 30.65269 nats/event
Full model Log loss : -1.65875
Full model ln_yyx : 493.84573 nats/sec, 30.20874 nats/event
Full model Log loss : -1.66020
Full model ln_yyx : 500.76344 nats/sec, 30.63190 nats/event
Full model Log loss : -1.67352
Full model ln_yyx : 496.03151 nats/sec, 30.34244 nats/event
Full model Log loss : -1.65766
Full model ln_yyx : 503.59769 nats/sec, 30.80527 nats/event
Full model Log loss : -1.67501
Full model ln_yyx : 495.40732 nats/sec, 30.30426 nats/event
Full model Log loss : -1.65624
Full model ln_yyx : 504.43393 nats/sec, 30.85642 nats/event
Full model Log loss : -1.67905
Full model ln_yyx : 501.61409 nats/sec, 30.68393 nats/event
Full model Log loss : -1.67050
Full model ln_yyx : 496.49009 nats/sec, 30.37049 nats/event
Full model Log loss : -1.66539
Full model ln_yyx : 502.31592 nats/sec, 30.72686 nats/event
Full model Log loss : -1.67732
Full model ln_yyx : 496.34432 nats/sec, 30.36158 nats/event
Full model Log loss : -1.66939
Full model ln_yyx : 495.45548 nats/sec, 30.30721 nats/event
Full model Log loss : -1.66190
Full model ln_yyx : 506.09215 nats/sec, 30.95786 nats/event
Full model Log loss : -1.67877
Full model ln_yyx : 494.38860 nats/sec, 30.24195 nats/event
Full model Log loss : -1.66962
Optimization finished. Config saved to results/opt-full/opt_full_104_best_config.txt
[I 2026-03-18 18:58:14,989] Trial 48 finished with value: -2.642413530429117 and parameters: {'n_layers_yyx': 2, 'hidden_size_yyx_l0': 2, 'hidden_size_yyx_l1': 5, 'context_size_yyx': 3, 'num_mix_components_yyx': 5, 'context_extractor_yyx': 'gru', 'activation_func_yyx': 'Tanh', 'L2_weight_yyx': 1.0843241138950253e-10, 'L_entropy_weight_yyx': 2.9241224808590568e-08, 'L_sep_weight_yyx': 0.0009569217400565436, 'L_scale_weight_yyx': 1.0380000951738208e-10, 'learning_rate_yyx': 0.008363972074748604}. Best is trial 46 with value: -2.64244432121314.
[I 2026-03-18 18:58:20,736] Trial 41 finished with value: -1.6634198177692503 and parameters: {'n_layers_yyx': 2, 'hidden_size_yyx_l0': 4, 'hidden_size_yyx_l1': 4, 'context_size_yyx': 4, 'num_mix_components_yyx': 5, 'context_extractor_yyx': 'lstm', 'activation_func_yyx': 'ReLU', 'L2_weight_yyx': 0.0008676391129260469, 'L_entropy_weight_yyx': 6.425581337127401e-05, 'L_sep_weight_yyx': 6.965890309372861e-09, 'L_scale_weight_yyx': 8.665367541619582e-07, 'learning_rate_yyx': 0.005026719905142125}. Best is trial 18 with value: -1.6716810843741248.
[I 2026-03-18 18:58:26,402] Trial 38 finished with value: -2.599461974762351 and parameters: {'n_layers_yyx': 1, 'hidden_size_yyx_l0': 4, 'context_size_yyx': 4, 'num_mix_components_yyx': 4, 'context_extractor_yyx': 'gru', 'activation_func_yyx': 'Tanh', 'L2_weight_yyx': 7.545006402718255e-05, 'L_entropy_weight_yyx': 1.9941179335402557e-06, 'L_sep_weight_yyx': 3.6351612188724004e-07, 'L_scale_weight_yyx': 1.0492581593255306e-06, 'learning_rate_yyx': 0.008115825650009467}. Best is trial 21 with value: -2.6405605351488926.
[I 2026-03-18 18:58:28,814] Trial 49 pruned. 

Source events: 32635
Target events: 29032
Full model ln_yyx : 4131.88170 nats/sec, 128.08947 nats/event
Full model Log loss : -2.63306
Full model ln_yyx : 4088.67267 nats/sec, 126.74998 nats/event
Full model Log loss : -2.59922
Full model ln_yyx : 4101.97811 nats/sec, 127.16245 nats/event
Full model Log loss : -2.60371
Full model ln_yyx : 4103.10503 nats/sec, 127.19739 nats/event
Full model Log loss : -2.60367
Full model ln_yyx : 4085.46235 nats/sec, 126.65046 nats/event
Full model Log loss : -2.60041
Full model ln_yyx : 4133.71084 nats/sec, 128.14617 nats/event
Full model Log loss : -2.63137
Full model ln_yyx : 4085.98813 nats/sec, 126.66676 nats/event
Full model Log loss : -2.59992
Full model ln_yyx : 4096.42097 nats/sec, 126.99018 nats/event
Full model Log loss : -2.62585
Full model ln_yyx : 4095.70115 nats/sec, 126.96786 nats/event
Full model Log loss : -2.62572
Full model ln_yyx : 4099.12312 nats/sec, 127.07395 nats/event
Full model Log loss : -2.60122
Full model ln_yyx : 4088.77832 nats/sec, 126.75325 nats/event
Full model Log loss : -2.60134
Full model ln_yyx : 4101.91190 nats/sec, 127.16040 nats/event
Full model Log loss : -2.60368
Full model ln_yyx : 4162.97138 nats/sec, 129.05326 nats/event
Full model Log loss : -2.63550
Full model ln_yyx : 4172.80589 nats/sec, 129.35813 nats/event
Full model Log loss : -2.64031
Full model ln_yyx : 4161.73317 nats/sec, 129.01488 nats/event
Full model Log loss : -2.64240
Full model ln_yyx : 4161.87791 nats/sec, 129.01936 nats/event
Full model Log loss : -2.64237
Full model ln_yyx : 4163.52427 nats/sec, 129.07040 nats/event
Full model Log loss : -2.64244
Full model ln_yyx : 4162.00011 nats/sec, 129.02315 nats/event
Full model Log loss : -2.64233
Full model ln_yyx : 4161.42609 nats/sec, 129.00536 nats/event
Full model Log loss : -2.64241
Optimization finished. Config saved to results/opt-full/opt_full_123_best_config.txt
[I 2026-03-18 18:58:31,916] Trial 39 pruned. 
[I 2026-03-18 18:58:40,052] Trial 45 finished with value: -2.643023597269061 and parameters: {'n_layers_yyx': 1, 'hidden_size_yyx_l0': 3, 'context_size_yyx': 4, 'num_mix_components_yyx': 4, 'context_extractor_yyx': 'lstm', 'activation_func_yyx': 'GELU', 'L2_weight_yyx': 1.2101028954322333e-09, 'L_entropy_weight_yyx': 1.4350172974894467e-09, 'L_sep_weight_yyx': 1.6914048318544793e-06, 'L_scale_weight_yyx': 2.7136757512230725e-10, 'learning_rate_yyx': 0.007551988760991856}. Best is trial 45 with value: -2.643023597269061.
[I 2026-03-18 18:58:44,851] Trial 40 pruned. 
[I 2026-03-18 18:59:04,671] Trial 42 finished with value: -1.679386952126673 and parameters: {'n_layers_yyx': 2, 'hidden_size_yyx_l0': 4, 'hidden_size_yyx_l1': 3, 'context_size_yyx': 4, 'num_mix_components_yyx': 5, 'context_extractor_yyx': 'lstm', 'activation_func_yyx': 'ReLU', 'L2_weight_yyx': 0.00047198084251717293, 'L_entropy_weight_yyx': 1.8110557757152016e-05, 'L_sep_weight_yyx': 3.31133670553741e-09, 'L_scale_weight_yyx': 8.859057169536551e-07, 'learning_rate_yyx': 0.007072968684790079}. Best is trial 42 with value: -1.679386952126673.
[I 2026-03-18 18:59:14,646] Trial 42 finished with value: -2.6428839042361845 and parameters: {'n_layers_yyx': 1, 'hidden_size_yyx_l0': 5, 'context_size_yyx': 3, 'num_mix_components_yyx': 5, 'context_extractor_yyx': 'lstm', 'activation_func_yyx': 'Tanh', 'L2_weight_yyx': 0.0001156017457976658, 'L_entropy_weight_yyx': 2.387135856671611e-05, 'L_sep_weight_yyx': 4.349933789488351e-08, 'L_scale_weight_yyx': 1.0478900731188668e-08, 'learning_rate_yyx': 0.008405981233705824}. Best is trial 40 with value: -2.643809374218382.
[I 2026-03-18 18:59:42,513] Trial 43 finished with value: -2.6332930417009965 and parameters: {'n_layers_yyx': 1, 'hidden_size_yyx_l0': 6, 'context_size_yyx': 3, 'num_mix_components_yyx': 5, 'context_extractor_yyx': 'lstm', 'activation_func_yyx': 'Tanh', 'L2_weight_yyx': 0.00012316959428484016, 'L_entropy_weight_yyx': 1.0317228046635989e-05, 'L_sep_weight_yyx': 1.325206800225695e-09, 'L_scale_weight_yyx': 9.57380061585897e-07, 'learning_rate_yyx': 0.00830521248397738}. Best is trial 40 with value: -2.643809374218382.
[I 2026-03-18 18:59:44,254] Trial 46 finished with value: -2.6349423067246898 and parameters: {'n_layers_yyx': 1, 'hidden_size_yyx_l0': 3, 'context_size_yyx': 4, 'num_mix_components_yyx': 4, 'context_extractor_yyx': 'lstm', 'activation_func_yyx': 'ReLU', 'L2_weight_yyx': 7.216511163515953e-10, 'L_entropy_weight_yyx': 2.647823377202192e-09, 'L_sep_weight_yyx': 7.824431710809691e-08, 'L_scale_weight_yyx': 2.1730428701717575e-10, 'learning_rate_yyx': 0.0075590443367269744}. Best is trial 45 with value: -2.643023597269061.
[I 2026-03-18 18:59:44,775] Trial 43 finished with value: -1.6563142473383468 and parameters: {'n_layers_yyx': 2, 'hidden_size_yyx_l0': 3, 'hidden_size_yyx_l1': 3, 'context_size_yyx': 4, 'num_mix_components_yyx': 5, 'context_extractor_yyx': 'lstm', 'activation_func_yyx': 'ReLU', 'L2_weight_yyx': 0.0002142314170170225, 'L_entropy_weight_yyx': 6.552879820269977e-06, 'L_sep_weight_yyx': 2.510201282742695e-09, 'L_scale_weight_yyx': 4.446066586559275e-06, 'learning_rate_yyx': 0.007609606262372528}. Best is trial 42 with value: -1.679386952126673.
[I 2026-03-18 18:59:49,905] Trial 47 pruned. 
[I 2026-03-18 18:59:59,247] Trial 44 pruned. 
[I 2026-03-18 19:00:06,668] Trial 41 finished with value: -2.6355845939793103 and parameters: {'n_layers_yyx': 1, 'hidden_size_yyx_l0': 4, 'context_size_yyx': 3, 'num_mix_components_yyx': 5, 'context_extractor_yyx': 'gru', 'activation_func_yyx': 'Tanh', 'L2_weight_yyx': 0.000128211842838211, 'L_entropy_weight_yyx': 7.735449341288118e-05, 'L_sep_weight_yyx': 3.943208387207552e-08, 'L_scale_weight_yyx': 8.864008072607817e-09, 'learning_rate_yyx': 0.008978644958625711}. Best is trial 21 with value: -2.6405605351488926.
[I 2026-03-18 19:00:17,352] Trial 44 pruned. 
[I 2026-03-18 19:00:19,443] Trial 42 pruned. 
[I 2026-03-18 19:00:23,069] Trial 45 pruned. 
[I 2026-03-18 19:00:33,625] Trial 45 finished with value: -1.6551158797833347 and parameters: {'n_layers_yyx': 2, 'hidden_size_yyx_l0': 5, 'hidden_size_yyx_l1': 3, 'context_size_yyx': 3, 'num_mix_components_yyx': 5, 'context_extractor_yyx': 'lstm', 'activation_func_yyx': 'ReLU', 'L2_weight_yyx': 0.0004774813306755955, 'L_entropy_weight_yyx': 3.886929414551876e-06, 'L_sep_weight_yyx': 1.255482072621277e-09, 'L_scale_weight_yyx': 1.3201274627183536e-07, 'learning_rate_yyx': 0.009979054368444644}. Best is trial 42 with value: -1.679386952126673.
[I 2026-03-18 19:00:33,901] Trial 48 finished with value: -2.6331169471177445 and parameters: {'n_layers_yyx': 2, 'hidden_size_yyx_l0': 3, 'hidden_size_yyx_l1': 3, 'context_size_yyx': 4, 'num_mix_components_yyx': 4, 'context_extractor_yyx': 'lstm', 'activation_func_yyx': 'ReLU', 'L2_weight_yyx': 1.5315581010119842e-09, 'L_entropy_weight_yyx': 1.0053811937383628e-10, 'L_sep_weight_yyx': 2.0725977603697436e-05, 'L_scale_weight_yyx': 1.1184024793995447e-09, 'learning_rate_yyx': 0.00911436382628864}. Best is trial 45 with value: -2.643023597269061.
[I 2026-03-18 19:00:36,052] Trial 46 pruned. 
[I 2026-03-18 19:00:38,466] Trial 47 pruned. 
[I 2026-03-18 19:00:46,483] Trial 49 pruned. 

Source events: 32635
Target events: 20800
Full model ln_yyx : 2949.40519 nats/sec, 127.61849 nats/event
Full model Log loss : -2.62991
Full model ln_yyx : 2961.42954 nats/sec, 128.13878 nats/event
Full model Log loss : -2.63764
Full model ln_yyx : 2927.35231 nats/sec, 126.66428 nats/event
Full model Log loss : -2.59890
Full model ln_yyx : 2932.53906 nats/sec, 126.88871 nats/event
Full model Log loss : -2.60144
Full model ln_yyx : 2912.34749 nats/sec, 126.01504 nats/event
Full model Log loss : -2.59415
Full model ln_yyx : 3003.93820 nats/sec, 129.97810 nats/event
Full model Log loss : -2.64284
Full model ln_yyx : 2908.86939 nats/sec, 125.86454 nats/event
Full model Log loss : -2.59513
Full model ln_yyx : 2942.11766 nats/sec, 127.30317 nats/event
Full model Log loss : -2.60221
Full model ln_yyx : 2972.94995 nats/sec, 128.63726 nats/event
Full model Log loss : -2.63062
Full model ln_yyx : 2973.64088 nats/sec, 128.66715 nats/event
Full model Log loss : -2.63081
Full model ln_yyx : 2980.99529 nats/sec, 128.98537 nats/event
Full model Log loss : -2.63758
Full model ln_yyx : 2967.59287 nats/sec, 128.40546 nats/event
Full model Log loss : -2.63289
Full model ln_yyx : 2963.83063 nats/sec, 128.24267 nats/event
Full model Log loss : -2.63676
Full model ln_yyx : 2921.52536 nats/sec, 126.41215 nats/event
Full model Log loss : -2.59837
Full model ln_yyx : 2987.04961 nats/sec, 129.24734 nats/event
Full model Log loss : -2.63723
Full model ln_yyx : 2981.48787 nats/sec, 129.00669 nats/event
Full model Log loss : -2.63749
Full model ln_yyx : 2987.18032 nats/sec, 129.25299 nats/event
Full model Log loss : -2.63709
Full model ln_yyx : 2992.15535 nats/sec, 129.46826 nats/event
Full model Log loss : -2.64302
Full model ln_yyx : 2963.33123 nats/sec, 128.22106 nats/event
Full model Log loss : -2.63494
Full model ln_yyx : 2970.79415 nats/sec, 128.54398 nats/event
Full model Log loss : -2.63312
Optimization finished. Config saved to results/opt-full/opt_full_119_best_config.txt
[I 2026-03-18 19:00:52,693] Trial 48 pruned. 
[I 2026-03-18 19:00:53,669] Trial 46 finished with value: -2.603323381499382 and parameters: {'n_layers_yyx': 1, 'hidden_size_yyx_l0': 6, 'context_size_yyx': 3, 'num_mix_components_yyx': 4, 'context_extractor_yyx': 'lstm', 'activation_func_yyx': 'Tanh', 'L2_weight_yyx': 5.515061401760007e-05, 'L_entropy_weight_yyx': 0.00010726511992395909, 'L_sep_weight_yyx': 3.728072511656902e-09, 'L_scale_weight_yyx': 4.469634512426665e-09, 'learning_rate_yyx': 0.008528906175870226}. Best is trial 40 with value: -2.643809374218382.
[I 2026-03-18 19:00:59,037] Trial 47 pruned. 
[I 2026-03-18 19:01:29,356] Trial 49 finished with value: -1.6620115938112718 and parameters: {'n_layers_yyx': 2, 'hidden_size_yyx_l0': 6, 'hidden_size_yyx_l1': 4, 'context_size_yyx': 4, 'num_mix_components_yyx': 5, 'context_extractor_yyx': 'lstm', 'activation_func_yyx': 'Tanh', 'L2_weight_yyx': 2.0871501254745133e-05, 'L_entropy_weight_yyx': 2.1028185973945068e-05, 'L_sep_weight_yyx': 2.0430134422400387e-08, 'L_scale_weight_yyx': 4.4832416034474344e-09, 'learning_rate_yyx': 0.0065197805291809675}. Best is trial 42 with value: -1.679386952126673.

Source events: 10683
Target events: 8618
Full model ln_yyx : 290.28019 nats/sec, 30.31471 nats/event
Full model Log loss : -1.61518
Full model ln_yyx : 288.87372 nats/sec, 30.16783 nats/event
Full model Log loss : -1.65592
Full model ln_yyx : 295.58038 nats/sec, 30.86822 nats/event
Full model Log loss : -1.66625
Full model ln_yyx : 282.73982 nats/sec, 29.52725 nats/event
Full model Log loss : -1.58708
Full model ln_yyx : 290.45087 nats/sec, 30.33253 nats/event
Full model Log loss : -1.65994
Full model ln_yyx : 289.14622 nats/sec, 30.19629 nats/event
Full model Log loss : -1.65096
Full model ln_yyx : 292.36922 nats/sec, 30.53287 nats/event
Full model Log loss : -1.67036
Full model ln_yyx : 292.82671 nats/sec, 30.58065 nats/event
Full model Log loss : -1.65573
Full model ln_yyx : 289.65453 nats/sec, 30.24937 nats/event
Full model Log loss : -1.65343
Full model ln_yyx : 295.35730 nats/sec, 30.84493 nats/event
Full model Log loss : -1.67054
Full model ln_yyx : 290.98924 nats/sec, 30.38876 nats/event
Full model Log loss : -1.66318
Full model ln_yyx : 294.45475 nats/sec, 30.75067 nats/event
Full model Log loss : -1.67168
Full model ln_yyx : 290.90270 nats/sec, 30.37972 nats/event
Full model Log loss : -1.65960
Full model ln_yyx : 291.09474 nats/sec, 30.39978 nats/event
Full model Log loss : -1.66342
Full model ln_yyx : 291.73527 nats/sec, 30.46667 nats/event
Full model Log loss : -1.67939
Full model ln_yyx : 291.01073 nats/sec, 30.39100 nats/event
Full model Log loss : -1.65631
Full model ln_yyx : 287.87669 nats/sec, 30.06371 nats/event
Full model Log loss : -1.65512
Full model ln_yyx : 293.33592 nats/sec, 30.63383 nats/event
Full model Log loss : -1.66201
Optimization finished. Config saved to results/opt-full/opt_full_114_best_config.txt
