[I 2026-03-18 16:38:16,443] Trial 43 finished with value: -0.4251734966833156 and parameters: {'n_layers_yyx': 2, 'hidden_size_yyx_l0': 2, 'hidden_size_yyx_l1': 4, 'context_size_yyx': 4, 'num_mix_components_yyx': 4, 'context_extractor_yyx': 'lstm', 'activation_func_yyx': 'Tanh', 'L2_weight_yyx': 2.1564377816388628e-10, 'L_entropy_weight_yyx': 0.0007766084231915796, 'L_sep_weight_yyx': 9.802640735950371e-06, 'L_scale_weight_yyx': 6.043512614164224e-05, 'learning_rate_yyx': 0.008422700037930093}. Best is trial 5 with value: -0.44982475540586303.
[I 2026-03-18 16:38:17,442] Trial 9 pruned. 
[I 2026-03-18 16:38:18,179] Trial 49 finished with value: -0.44763065491667475 and parameters: {'n_layers_yyx': 1, 'hidden_size_yyx_l0': 4, 'context_size_yyx': 2, 'num_mix_components_yyx': 5, 'context_extractor_yyx': 'lstm', 'activation_func_yyx': 'Tanh', 'L2_weight_yyx': 8.882337092264245e-05, 'L_entropy_weight_yyx': 1.5037313454349294e-06, 'L_sep_weight_yyx': 7.260341671713129e-07, 'L_scale_weight_yyx': 1.8090568110459813e-05, 'learning_rate_yyx': 0.008004951112478235}. Best is trial 49 with value: -0.44763065491667475.

Source events: 1783
Target events: 40082
Full model ln_yyx : 133.16723 nats/sec, 2.99013 nats/event
Full model Log loss : -0.42318
Full model ln_yyx : 132.84343 nats/sec, 2.98286 nats/event
Full model Log loss : -0.44041
Full model ln_yyx : 132.82113 nats/sec, 2.98236 nats/event
Full model Log loss : -0.39676
Full model ln_yyx : 130.73517 nats/sec, 2.93552 nats/event
Full model Log loss : -0.41401
Full model ln_yyx : 135.84214 nats/sec, 3.05020 nats/event
Full model Log loss : -0.42545
Full model ln_yyx : 134.42821 nats/sec, 3.01845 nats/event
Full model Log loss : -0.42191
Full model ln_yyx : 129.03095 nats/sec, 2.89726 nats/event
Full model Log loss : -0.44456
Full model ln_yyx : 133.57816 nats/sec, 2.99936 nats/event
Full model Log loss : -0.40451
Full model ln_yyx : 133.40904 nats/sec, 2.99556 nats/event
Full model Log loss : -0.43291
Full model ln_yyx : 133.73565 nats/sec, 3.00290 nats/event
Full model Log loss : -0.43115
Full model ln_yyx : 133.82976 nats/sec, 3.00501 nats/event
Full model Log loss : -0.43201
Full model ln_yyx : 132.68002 nats/sec, 2.97919 nats/event
Full model Log loss : -0.43128
Full model ln_yyx : 133.04378 nats/sec, 2.98736 nats/event
Full model Log loss : -0.42556
Full model ln_yyx : 130.12858 nats/sec, 2.92190 nats/event
Full model Log loss : -0.40155
Full model ln_yyx : 134.29553 nats/sec, 3.01547 nats/event
Full model Log loss : -0.44763
Optimization finished. Config saved to results/opt-full/opt_full_22_best_config.txt
[I 2026-03-18 16:38:18,433] Trial 31 pruned. 
[I 2026-03-18 16:38:18,640] Trial 45 pruned. 
[I 2026-03-18 16:38:21,120] Trial 32 pruned. 
[I 2026-03-18 16:38:21,341] Trial 6 pruned. 
[I 2026-03-18 16:38:22,287] Trial 44 finished with value: -0.4605777138157895 and parameters: {'n_layers_yyx': 1, 'hidden_size_yyx_l0': 5, 'context_size_yyx': 4, 'num_mix_components_yyx': 4, 'context_extractor_yyx': 'gru', 'activation_func_yyx': 'Tanh', 'L2_weight_yyx': 0.00014430052432762189, 'L_entropy_weight_yyx': 4.628333499766747e-06, 'L_sep_weight_yyx': 1.959126585690152e-06, 'L_scale_weight_yyx': 5.294998891402406e-10, 'learning_rate_yyx': 0.008789199021310711}. Best is trial 44 with value: -0.4605777138157895.
[I 2026-03-18 16:38:23,265] Trial 33 pruned. 
[I 2026-03-18 16:38:25,223] Trial 13 pruned. 
[I 2026-03-18 16:38:25,458] Trial 34 pruned. 
[I 2026-03-18 16:38:26,514] Trial 44 pruned. 
[I 2026-03-18 16:38:27,700] Trial 11 pruned. 
[I 2026-03-18 16:38:27,920] Trial 7 pruned. 
[I 2026-03-18 16:38:27,920] Trial 7 pruned. 
[I 2026-03-18 16:38:28,729] Trial 5 pruned. 
[I 2026-03-18 16:38:29,474] Trial 35 pruned. 
[I 2026-03-18 16:38:30,578] Trial 45 pruned. 
[I 2026-03-18 16:38:31,788] Trial 36 pruned. 
[I 2026-03-18 16:38:31,870] Trial 14 pruned. 
[I 2026-03-18 16:38:33,887] Trial 38 finished with value: -0.4296416763919795 and parameters: {'n_layers_yyx': 1, 'hidden_size_yyx_l0': 3, 'context_size_yyx': 1, 'num_mix_components_yyx': 3, 'context_extractor_yyx': 'gru', 'activation_func_yyx': 'Tanh', 'L2_weight_yyx': 6.237466137444327e-10, 'L_entropy_weight_yyx': 6.48685527122465e-08, 'L_sep_weight_yyx': 1.1410071837208342e-08, 'L_scale_weight_yyx': 2.923293708251986e-05, 'learning_rate_yyx': 0.006904254815853417}. Best is trial 38 with value: -0.4296416763919795.
[I 2026-03-18 16:38:34,471] Trial 12 pruned. 
[I 2026-03-18 16:38:34,695] Trial 46 pruned. 
[I 2026-03-18 16:38:35,703] Trial 37 pruned. 
[I 2026-03-18 16:38:37,071] Trial 45 finished with value: -0.46048861760473103 and parameters: {'n_layers_yyx': 1, 'hidden_size_yyx_l0': 5, 'context_size_yyx': 4, 'num_mix_components_yyx': 4, 'context_extractor_yyx': 'gru', 'activation_func_yyx': 'Tanh', 'L2_weight_yyx': 0.0001493221122554962, 'L_entropy_weight_yyx': 3.2872825765229037e-06, 'L_sep_weight_yyx': 2.136118844941524e-06, 'L_scale_weight_yyx': 5.029112110527017e-10, 'learning_rate_yyx': 0.008732028605434162}. Best is trial 44 with value: -0.4605777138157895.
[I 2026-03-18 16:38:37,797] Trial 38 pruned. 
[I 2026-03-18 16:38:38,330] Trial 47 pruned. 
[I 2026-03-18 16:38:38,571] Trial 15 pruned. 
[I 2026-03-18 16:38:39,946] Trial 46 pruned. 
[I 2026-03-18 16:38:40,254] Trial 39 pruned. 
[I 2026-03-18 16:38:42,173] Trial 48 pruned. 
[I 2026-03-18 16:38:42,423] Trial 40 pruned. 
[I 2026-03-18 16:38:43,895] Trial 39 pruned. 
[I 2026-03-18 16:38:43,989] Trial 10 finished with value: -2.7995713136723226 and parameters: {'n_layers_yyx': 1, 'hidden_size_yyx_l0': 6, 'context_size_yyx': 3, 'num_mix_components_yyx': 4, 'context_extractor_yyx': 'lstm', 'activation_func_yyx': 'ReLU', 'L2_weight_yyx': 3.5163966083232286e-10, 'L_entropy_weight_yyx': 1.0228250070553591e-10, 'L_sep_weight_yyx': 0.0007439352187923328, 'L_scale_weight_yyx': 8.42004613742396e-09, 'learning_rate_yyx': 0.007278218768174172}. Best is trial 1 with value: -2.804181999864486.
[I 2026-03-18 16:38:44,285] Trial 49 pruned. 

Source events: 1783
Target events: 1872
Full model ln_yyx : 5.89974 nats/sec, 2.83642 nats/event
Full model Log loss : -0.42013
Full model ln_yyx : 6.05170 nats/sec, 2.90947 nats/event
Full model Log loss : -0.43080
Full model ln_yyx : 6.13926 nats/sec, 2.95157 nats/event
Full model Log loss : -0.38655
Full model ln_yyx : 5.88349 nats/sec, 2.82860 nats/event
Full model Log loss : -0.38704
Full model ln_yyx : 6.04866 nats/sec, 2.90801 nats/event
Full model Log loss : -0.44982
Full model ln_yyx : 6.04575 nats/sec, 2.90661 nats/event
Full model Log loss : -0.44105
Full model ln_yyx : 6.04565 nats/sec, 2.90656 nats/event
Full model Log loss : -0.42865
Full model ln_yyx : 6.21450 nats/sec, 2.98774 nats/event
Full model Log loss : -0.40725
Full model ln_yyx : 6.04867 nats/sec, 2.90801 nats/event
Full model Log loss : -0.42848
Full model ln_yyx : 6.07141 nats/sec, 2.91895 nats/event
Full model Log loss : -0.42123
Full model ln_yyx : 5.95844 nats/sec, 2.86464 nats/event
Full model Log loss : -0.44267
Full model ln_yyx : 5.90895 nats/sec, 2.84084 nats/event
Full model Log loss : -0.40687
Full model ln_yyx : 5.93832 nats/sec, 2.85496 nats/event
Full model Log loss : -0.41116
Full model ln_yyx : 5.89477 nats/sec, 2.83402 nats/event
Full model Log loss : -0.41201
Full model ln_yyx : 5.92237 nats/sec, 2.84729 nats/event
Full model Log loss : -0.42517
Optimization finished. Config saved to results/opt-full/opt_full_28_best_config.txt
[I 2026-03-18 16:38:45,921] Trial 46 pruned. 
[I 2026-03-18 16:38:47,628] Trial 40 pruned. 
[I 2026-03-18 16:38:47,885] Trial 47 pruned. 
[I 2026-03-18 16:38:49,956] Trial 47 pruned. 
[I 2026-03-18 16:38:51,831] Trial 48 pruned. 
[I 2026-03-18 16:38:53,886] Trial 49 pruned. 

Source events: 1783
Target events: 9421
Full model ln_yyx : 31.77639 nats/sec, 3.03564 nats/event
Full model Log loss : -0.41437
Full model ln_yyx : 30.69115 nats/sec, 2.93196 nats/event
Full model Log loss : -0.37988
Full model ln_yyx : 28.95553 nats/sec, 2.76616 nats/event
Full model Log loss : -0.31565
Full model ln_yyx : 30.90475 nats/sec, 2.95237 nats/event
Full model Log loss : -0.44963
Full model ln_yyx : 30.66096 nats/sec, 2.92908 nats/event
Full model Log loss : -0.30518
Full model ln_yyx : 30.65404 nats/sec, 2.92842 nats/event
Full model Log loss : -0.43067
Full model ln_yyx : 30.97563 nats/sec, 2.95914 nats/event
Full model Log loss : -0.44001
Full model ln_yyx : 31.21817 nats/sec, 2.98231 nats/event
Full model Log loss : -0.40878
Full model ln_yyx : 30.50327 nats/sec, 2.91402 nats/event
Full model Log loss : -0.40543
Full model ln_yyx : 31.02230 nats/sec, 2.96360 nats/event
Full model Log loss : -0.44402
Full model ln_yyx : 31.11650 nats/sec, 2.97260 nats/event
Full model Log loss : -0.44059
Full model ln_yyx : 30.26847 nats/sec, 2.89158 nats/event
Full model Log loss : -0.45375
Full model ln_yyx : 31.04314 nats/sec, 2.96559 nats/event
Full model Log loss : -0.43504
Full model ln_yyx : 30.57732 nats/sec, 2.92109 nats/event
Full model Log loss : -0.45713
Full model ln_yyx : 30.56295 nats/sec, 2.91972 nats/event
Full model Log loss : -0.44393
Full model ln_yyx : 30.25809 nats/sec, 2.89059 nats/event
Full model Log loss : -0.45545
Full model ln_yyx : 30.56895 nats/sec, 2.92029 nats/event
Full model Log loss : -0.45540
Full model ln_yyx : 30.72586 nats/sec, 2.93528 nats/event
Full model Log loss : -0.44422
Full model ln_yyx : 30.71166 nats/sec, 2.93392 nats/event
Full model Log loss : -0.46058
Full model ln_yyx : 30.70551 nats/sec, 2.93334 nats/event
Full model Log loss : -0.46049
Optimization finished. Config saved to results/opt-full/opt_full_30_best_config.txt
[I 2026-03-18 16:38:55,426] Trial 41 finished with value: -0.41139887287151705 and parameters: {'n_layers_yyx': 2, 'hidden_size_yyx_l0': 5, 'hidden_size_yyx_l1': 5, 'context_size_yyx': 2, 'num_mix_components_yyx': 1, 'context_extractor_yyx': 'gru', 'activation_func_yyx': 'Tanh', 'L2_weight_yyx': 1.6385687790838327e-09, 'L_entropy_weight_yyx': 2.0202584607530383e-09, 'L_sep_weight_yyx': 4.530389289418973e-08, 'L_scale_weight_yyx': 1.9001926183671486e-10, 'learning_rate_yyx': 0.004280446176025554}. Best is trial 26 with value: -0.43197839695602747.
[I 2026-03-18 16:38:58,950] Trial 42 pruned. 
[I 2026-03-18 16:39:00,084] Trial 11 pruned. 
[I 2026-03-18 16:39:01,904] Trial 48 finished with value: -0.41732977049269543 and parameters: {'n_layers_yyx': 2, 'hidden_size_yyx_l0': 3, 'hidden_size_yyx_l1': 5, 'context_size_yyx': 4, 'num_mix_components_yyx': 2, 'context_extractor_yyx': 'lstm', 'activation_func_yyx': 'Tanh', 'L2_weight_yyx': 4.4451652183877874e-09, 'L_entropy_weight_yyx': 1.4398264425525968e-07, 'L_sep_weight_yyx': 0.0008090862924397661, 'L_scale_weight_yyx': 4.148106096333724e-06, 'learning_rate_yyx': 0.005931814626209273}. Best is trial 9 with value: -0.4271615326589106.
[I 2026-03-18 16:39:05,693] Trial 49 pruned. 

Source events: 1783
Target events: 29032
Full model ln_yyx : 96.72132 nats/sec, 2.99839 nats/event
Full model Log loss : -0.37375
Full model ln_yyx : 96.34513 nats/sec, 2.98673 nats/event
Full model Log loss : -0.36081
Full model ln_yyx : 95.71455 nats/sec, 2.96718 nats/event
Full model Log loss : -0.42374
Full model ln_yyx : 95.84365 nats/sec, 2.97118 nats/event
Full model Log loss : -0.42240
Full model ln_yyx : 96.08158 nats/sec, 2.97856 nats/event
Full model Log loss : -0.32092
Full model ln_yyx : 96.62614 nats/sec, 2.99544 nats/event
Full model Log loss : -0.42178
Full model ln_yyx : 96.61384 nats/sec, 2.99506 nats/event
Full model Log loss : -0.42716
Full model ln_yyx : 93.97476 nats/sec, 2.91324 nats/event
Full model Log loss : -0.39536
Full model ln_yyx : 95.89858 nats/sec, 2.97288 nats/event
Full model Log loss : -0.41624
Full model ln_yyx : 96.50950 nats/sec, 2.99182 nats/event
Full model Log loss : -0.42454
Full model ln_yyx : 96.48205 nats/sec, 2.99097 nats/event
Full model Log loss : -0.41733
Optimization finished. Config saved to results/opt-full/opt_full_21_best_config.txt
[I 2026-03-18 16:39:07,845] Trial 43 pruned. 
[I 2026-03-18 16:39:08,333] Trial 10 finished with value: -2.774143289624226 and parameters: {'n_layers_yyx': 2, 'hidden_size_yyx_l0': 5, 'hidden_size_yyx_l1': 6, 'context_size_yyx': 4, 'num_mix_components_yyx': 4, 'context_extractor_yyx': 'lstm', 'activation_func_yyx': 'Tanh', 'L2_weight_yyx': 7.669332808716168e-07, 'L_entropy_weight_yyx': 0.0009412485855406051, 'L_sep_weight_yyx': 5.532433410357588e-08, 'L_scale_weight_yyx': 2.2223425441938318e-08, 'learning_rate_yyx': 0.00902148420333975}. Best is trial 4 with value: -2.777686147163457.
[I 2026-03-18 16:39:08,513] Trial 7 finished with value: -2.80084571769578 and parameters: {'n_layers_yyx': 2, 'hidden_size_yyx_l0': 6, 'hidden_size_yyx_l1': 4, 'context_size_yyx': 3, 'num_mix_components_yyx': 4, 'context_extractor_yyx': 'gru', 'activation_func_yyx': 'GELU', 'L2_weight_yyx': 3.730641652379745e-05, 'L_entropy_weight_yyx': 6.037414386295791e-10, 'L_sep_weight_yyx': 2.908181606500123e-08, 'L_scale_weight_yyx': 2.0879700273480028e-07, 'learning_rate_yyx': 0.006217938928891682}. Best is trial 5 with value: -2.803729491226789.
[I 2026-03-18 16:39:11,509] Trial 44 pruned. 
[I 2026-03-18 16:39:11,912] Trial 41 pruned. 
[I 2026-03-18 16:39:15,112] Trial 12 pruned. 
[I 2026-03-18 16:39:15,328] Trial 42 pruned. 
[I 2026-03-18 16:39:19,574] Trial 45 pruned. 
[I 2026-03-18 16:39:21,406] Trial 46 pruned. 
[I 2026-03-18 16:39:22,103] Trial 16 finished with value: -2.8015090775087956 and parameters: {'n_layers_yyx': 2, 'hidden_size_yyx_l0': 6, 'hidden_size_yyx_l1': 2, 'context_size_yyx': 2, 'num_mix_components_yyx': 3, 'context_extractor_yyx': 'gru', 'activation_func_yyx': 'GELU', 'L2_weight_yyx': 4.373478613958903e-05, 'L_entropy_weight_yyx': 2.046275774696291e-09, 'L_sep_weight_yyx': 2.966293282479281e-05, 'L_scale_weight_yyx': 4.038784994413115e-05, 'learning_rate_yyx': 0.007463830030158957}. Best is trial 0 with value: -2.8067502106217272.
[I 2026-03-18 16:39:22,717] Trial 8 pruned. 
[I 2026-03-18 16:39:23,447] Trial 43 pruned. 
[I 2026-03-18 16:39:27,139] Trial 44 pruned. 
[I 2026-03-18 16:39:28,499] Trial 45 pruned. 
[I 2026-03-18 16:39:29,502] Trial 13 pruned. 
[I 2026-03-18 16:39:29,722] Trial 47 pruned. 
[I 2026-03-18 16:39:31,652] Trial 48 pruned. 
[I 2026-03-18 16:39:33,639] Trial 49 pruned. 

Source events: 1783
Target events: 10752
Full model ln_yyx : 35.45960 nats/sec, 2.96816 nats/event
Full model Log loss : -0.42366
Full model ln_yyx : 34.62847 nats/sec, 2.89859 nats/event
Full model Log loss : -0.38540
Full model ln_yyx : 35.10160 nats/sec, 2.93819 nats/event
Full model Log loss : -0.34490
Full model ln_yyx : 36.10079 nats/sec, 3.02183 nats/event
Full model Log loss : -0.39156
Full model ln_yyx : 35.20292 nats/sec, 2.94667 nats/event
Full model Log loss : -0.36131
Full model ln_yyx : 35.17255 nats/sec, 2.94413 nats/event
Full model Log loss : -0.40076
Full model ln_yyx : 35.30716 nats/sec, 2.95540 nats/event
Full model Log loss : -0.43100
Full model ln_yyx : 33.15642 nats/sec, 2.77537 nats/event
Full model Log loss : -0.38793
Full model ln_yyx : 35.56996 nats/sec, 2.97740 nats/event
Full model Log loss : -0.39276
Full model ln_yyx : 35.33208 nats/sec, 2.95748 nats/event
Full model Log loss : -0.40664
Full model ln_yyx : 35.35156 nats/sec, 2.95912 nats/event
Full model Log loss : -0.41174
Full model ln_yyx : 34.21081 nats/sec, 2.86363 nats/event
Full model Log loss : -0.35694
Full model ln_yyx : 35.55950 nats/sec, 2.97652 nats/event
Full model Log loss : -0.43198
Full model ln_yyx : 35.34474 nats/sec, 2.95854 nats/event
Full model Log loss : -0.41140
Optimization finished. Config saved to results/opt-full/opt_full_25_best_config.txt
[I 2026-03-18 16:39:36,587] Trial 17 pruned. 
[I 2026-03-18 16:39:36,720] Trial 46 pruned. 
[I 2026-03-18 16:39:37,754] Trial 47 pruned. 
[I 2026-03-18 16:39:41,441] Trial 48 pruned. 
[I 2026-03-18 16:39:43,077] Trial 49 pruned. 

Source events: 1783
Target events: 12731
Full model ln_yyx : 41.99624 nats/sec, 2.96886 nats/event
Full model Log loss : -0.38956
Full model ln_yyx : 40.93498 nats/sec, 2.89384 nats/event
Full model Log loss : -0.39807
Full model ln_yyx : 42.15032 nats/sec, 2.97976 nats/event
Full model Log loss : -0.42895
Full model ln_yyx : 39.59858 nats/sec, 2.79937 nats/event
Full model Log loss : -0.33751
Full model ln_yyx : 40.11604 nats/sec, 2.83595 nats/event
Full model Log loss : -0.36682
Full model ln_yyx : 43.64263 nats/sec, 3.08525 nats/event
Full model Log loss : -0.38308
Full model ln_yyx : 41.46124 nats/sec, 2.93104 nats/event
Full model Log loss : -0.40602
Full model ln_yyx : 40.68541 nats/sec, 2.87620 nats/event
Full model Log loss : -0.39297
Full model ln_yyx : 42.31915 nats/sec, 2.99169 nats/event
Full model Log loss : -0.42046
Full model ln_yyx : 42.30437 nats/sec, 2.99065 nats/event
Full model Log loss : -0.41958
Full model ln_yyx : 42.31508 nats/sec, 2.99140 nats/event
Full model Log loss : -0.42019
Full model ln_yyx : 42.31410 nats/sec, 2.99134 nats/event
Full model Log loss : -0.42012
Full model ln_yyx : 42.28550 nats/sec, 2.98931 nats/event
Full model Log loss : -0.41874
Full model ln_yyx : 41.61882 nats/sec, 2.94218 nats/event
Full model Log loss : -0.40987
Full model ln_yyx : 41.88806 nats/sec, 2.96122 nats/event
Full model Log loss : -0.42964
Optimization finished. Config saved to results/opt-full/opt_full_18_best_config.txt
[I 2026-03-18 16:39:48,778] Trial 5 pruned. 
[I 2026-03-18 16:39:54,689] Trial 11 finished with value: -2.7741674975814106 and parameters: {'n_layers_yyx': 2, 'hidden_size_yyx_l0': 5, 'hidden_size_yyx_l1': 6, 'context_size_yyx': 4, 'num_mix_components_yyx': 4, 'context_extractor_yyx': 'lstm', 'activation_func_yyx': 'Tanh', 'L2_weight_yyx': 8.464233488335727e-07, 'L_entropy_weight_yyx': 0.0007692530987786537, 'L_sep_weight_yyx': 3.8218325619509256e-08, 'L_scale_weight_yyx': 6.2489959366060125e-09, 'learning_rate_yyx': 0.009518413746684492}. Best is trial 4 with value: -2.777686147163457.
[I 2026-03-18 16:39:57,884] Trial 8 finished with value: -2.791748086852178 and parameters: {'n_layers_yyx': 2, 'hidden_size_yyx_l0': 3, 'hidden_size_yyx_l1': 6, 'context_size_yyx': 1, 'num_mix_components_yyx': 1, 'context_extractor_yyx': 'gru', 'activation_func_yyx': 'Tanh', 'L2_weight_yyx': 0.0002097098613357691, 'L_entropy_weight_yyx': 0.0006966093023056644, 'L_sep_weight_yyx': 4.9479730671696045e-06, 'L_scale_weight_yyx': 3.904236331673118e-07, 'learning_rate_yyx': 0.004730181671797404}. Best is trial 5 with value: -2.805070761203844.
[I 2026-03-18 16:40:09,769] Trial 14 pruned. 
[I 2026-03-18 16:40:11,532] Trial 5 finished with value: -2.7937609118555207 and parameters: {'n_layers_yyx': 1, 'hidden_size_yyx_l0': 5, 'context_size_yyx': 4, 'num_mix_components_yyx': 4, 'context_extractor_yyx': 'lstm', 'activation_func_yyx': 'GELU', 'L2_weight_yyx': 9.070649500453783e-09, 'L_entropy_weight_yyx': 2.2064500020379803e-09, 'L_sep_weight_yyx': 8.542372960238488e-09, 'L_scale_weight_yyx': 0.00018615588841077666, 'learning_rate_yyx': 0.0028466061160164853}. Best is trial 5 with value: -2.7937609118555207.
[I 2026-03-18 16:40:19,476] Trial 16 finished with value: -2.795719508385717 and parameters: {'n_layers_yyx': 1, 'hidden_size_yyx_l0': 5, 'context_size_yyx': 4, 'num_mix_components_yyx': 4, 'context_extractor_yyx': 'lstm', 'activation_func_yyx': 'Tanh', 'L2_weight_yyx': 3.687493848933565e-07, 'L_entropy_weight_yyx': 4.4206512608990104e-10, 'L_sep_weight_yyx': 4.6333273473204465e-08, 'L_scale_weight_yyx': 0.0007061288303503577, 'learning_rate_yyx': 0.004155357248630771}. Best is trial 16 with value: -2.795719508385717.
[I 2026-03-18 16:40:23,655] Trial 15 pruned. 
[I 2026-03-18 16:40:32,729] Trial 13 finished with value: -2.8082553050147787 and parameters: {'n_layers_yyx': 1, 'hidden_size_yyx_l0': 6, 'context_size_yyx': 4, 'num_mix_components_yyx': 2, 'context_extractor_yyx': 'gru', 'activation_func_yyx': 'Tanh', 'L2_weight_yyx': 4.289032541472715e-09, 'L_entropy_weight_yyx': 6.676939990949199e-09, 'L_sep_weight_yyx': 4.387626974024814e-09, 'L_scale_weight_yyx': 3.576276727954351e-09, 'learning_rate_yyx': 0.005567762669825836}. Best is trial 13 with value: -2.8082553050147787.
[I 2026-03-18 16:40:37,676] Trial 16 pruned. 
[I 2026-03-18 16:40:38,892] Trial 14 pruned. 
[I 2026-03-18 16:40:39,045] Trial 8 finished with value: -2.8015930756686904 and parameters: {'n_layers_yyx': 2, 'hidden_size_yyx_l0': 4, 'hidden_size_yyx_l1': 6, 'context_size_yyx': 4, 'num_mix_components_yyx': 2, 'context_extractor_yyx': 'gru', 'activation_func_yyx': 'GELU', 'L2_weight_yyx': 7.02967914216001e-05, 'L_entropy_weight_yyx': 1.5670011951421695e-07, 'L_sep_weight_yyx': 1.6103592357735572e-09, 'L_scale_weight_yyx': 1.9548017807611092e-10, 'learning_rate_yyx': 0.00259631930147189}. Best is trial 5 with value: -2.8051328142627483.
[I 2026-03-18 16:40:43,506] Trial 17 pruned. 
[I 2026-03-18 16:40:49,483] Trial 6 pruned. 
[I 2026-03-18 16:40:57,274] Trial 18 pruned. 
[I 2026-03-18 16:41:04,038] Trial 7 pruned. 
[I 2026-03-18 16:41:05,599] Trial 10 finished with value: -2.780549000374413 and parameters: {'n_layers_yyx': 1, 'hidden_size_yyx_l0': 2, 'context_size_yyx': 3, 'num_mix_components_yyx': 3, 'context_extractor_yyx': 'gru', 'activation_func_yyx': 'ReLU', 'L2_weight_yyx': 0.0006953362908742847, 'L_entropy_weight_yyx': 1.1265156835023776e-10, 'L_sep_weight_yyx': 1.4929984912561916e-10, 'L_scale_weight_yyx': 9.570894230253574e-10, 'learning_rate_yyx': 0.0034531614772554276}. Best is trial 6 with value: -2.7950135081496006.
