[I 2026-03-18 22:28:23,394] Trial 50 finished with value: -1.8479536719224554 and parameters: {'n_layers_yyx': 2, 'hidden_size_yyx_l0': 5, 'hidden_size_yyx_l1': 2, 'context_size_yyx': 4, 'num_mix_components_yyx': 5, 'context_extractor_yyx': 'gru', 'activation_func_yyx': 'ReLU', 'L2_weight_yyx': 4.0041541989106793e-10, 'L_entropy_weight_yyx': 5.356388766326675e-08, 'L_sep_weight_yyx': 2.9422772260056083e-10, 'L_scale_weight_yyx': 2.592946966211454e-06, 'learning_rate_yyx': 0.007100151616551323}. Best is trial 0 with value: -1.8516305051550026.
[I 2026-03-18 22:28:28,147] Trial 40 finished with value: -1.7889945105350378 and parameters: {'n_layers_yyx': 2, 'hidden_size_yyx_l0': 6, 'hidden_size_yyx_l1': 4, 'context_size_yyx': 4, 'num_mix_components_yyx': 2, 'context_extractor_yyx': 'gru', 'activation_func_yyx': 'Tanh', 'L2_weight_yyx': 0.00047200451487524014, 'L_entropy_weight_yyx': 7.083357019797036e-10, 'L_sep_weight_yyx': 6.488191751781882e-08, 'L_scale_weight_yyx': 0.00012107641477308989, 'learning_rate_yyx': 0.005301101897300375}. Best is trial 16 with value: -1.790272919625947.
[I 2026-03-18 22:28:33,803] Trial 51 pruned. 
[I 2026-03-18 22:28:46,342] Trial 42 finished with value: -1.8699069075199783 and parameters: {'n_layers_yyx': 1, 'hidden_size_yyx_l0': 6, 'context_size_yyx': 4, 'num_mix_components_yyx': 4, 'context_extractor_yyx': 'lstm', 'activation_func_yyx': 'ReLU', 'L2_weight_yyx': 8.86621446856139e-10, 'L_entropy_weight_yyx': 1.0733183074982758e-08, 'L_sep_weight_yyx': 3.2856380499732377e-06, 'L_scale_weight_yyx': 2.791352216822046e-09, 'learning_rate_yyx': 0.009146844290491427}. Best is trial 42 with value: -1.8699069075199783.
[I 2026-03-18 22:28:53,067] Trial 53 finished with value: -1.9364600677883068 and parameters: {'n_layers_yyx': 1, 'hidden_size_yyx_l0': 6, 'context_size_yyx': 4, 'num_mix_components_yyx': 2, 'context_extractor_yyx': 'gru', 'activation_func_yyx': 'ReLU', 'L2_weight_yyx': 3.5982633528077834e-10, 'L_entropy_weight_yyx': 6.164899671450596e-09, 'L_sep_weight_yyx': 9.042669991881063e-07, 'L_scale_weight_yyx': 0.00023114824223399475, 'learning_rate_yyx': 0.009079651258201805}. Best is trial 10 with value: -1.9395614910230956.
[I 2026-03-18 22:28:55,187] Trial 48 finished with value: -1.8601687108156835 and parameters: {'n_layers_yyx': 2, 'hidden_size_yyx_l0': 4, 'hidden_size_yyx_l1': 3, 'context_size_yyx': 4, 'num_mix_components_yyx': 1, 'context_extractor_yyx': 'lstm', 'activation_func_yyx': 'Tanh', 'L2_weight_yyx': 2.621535540074296e-06, 'L_entropy_weight_yyx': 1.211042500379785e-06, 'L_sep_weight_yyx': 1.2777031069277593e-08, 'L_scale_weight_yyx': 6.840195657095604e-08, 'learning_rate_yyx': 0.008362175054830872}. Best is trial 11 with value: -1.8610449438696508.
[I 2026-03-18 22:28:57,110] Trial 57 finished with value: -1.8982531448890423 and parameters: {'n_layers_yyx': 2, 'hidden_size_yyx_l0': 3, 'hidden_size_yyx_l1': 6, 'context_size_yyx': 4, 'num_mix_components_yyx': 3, 'context_extractor_yyx': 'lstm', 'activation_func_yyx': 'ReLU', 'L2_weight_yyx': 1.6620138527171754e-06, 'L_entropy_weight_yyx': 2.0761303369521473e-10, 'L_sep_weight_yyx': 5.5638900380455104e-09, 'L_scale_weight_yyx': 8.717034164442441e-09, 'learning_rate_yyx': 0.008870379858819636}. Best is trial 55 with value: -1.8982689846521137.
[I 2026-03-18 22:29:04,167] Trial 35 finished with value: -1.9307886098105669 and parameters: {'n_layers_yyx': 2, 'hidden_size_yyx_l0': 5, 'hidden_size_yyx_l1': 5, 'context_size_yyx': 2, 'num_mix_components_yyx': 5, 'context_extractor_yyx': 'gru', 'activation_func_yyx': 'GELU', 'L2_weight_yyx': 2.5296636903690627e-06, 'L_entropy_weight_yyx': 0.0001275979999111187, 'L_sep_weight_yyx': 1.6960966680521886e-06, 'L_scale_weight_yyx': 1.253865820916491e-07, 'learning_rate_yyx': 0.00866168416885359}. Best is trial 14 with value: -1.9337542258067992.
[I 2026-03-18 22:29:04,757] Trial 53 finished with value: -1.8520987888053317 and parameters: {'n_layers_yyx': 1, 'hidden_size_yyx_l0': 6, 'context_size_yyx': 4, 'num_mix_components_yyx': 5, 'context_extractor_yyx': 'gru', 'activation_func_yyx': 'ReLU', 'L2_weight_yyx': 6.178674444000872e-06, 'L_entropy_weight_yyx': 2.560550573766348e-06, 'L_sep_weight_yyx': 1.2893799619979542e-10, 'L_scale_weight_yyx': 3.1930570111223856e-10, 'learning_rate_yyx': 0.00594024010059762}. Best is trial 1 with value: -1.8555367853768732.
[I 2026-03-18 22:29:09,077] Trial 53 finished with value: -1.7823286576704545 and parameters: {'n_layers_yyx': 2, 'hidden_size_yyx_l0': 6, 'hidden_size_yyx_l1': 6, 'context_size_yyx': 2, 'num_mix_components_yyx': 5, 'context_extractor_yyx': 'gru', 'activation_func_yyx': 'GELU', 'L2_weight_yyx': 1.4244646025527702e-10, 'L_entropy_weight_yyx': 0.0001113259203267419, 'L_sep_weight_yyx': 1.0168529197658437e-05, 'L_scale_weight_yyx': 6.946619432223052e-07, 'learning_rate_yyx': 0.007633029001546923}. Best is trial 4 with value: -1.7875800731928662.
[I 2026-03-18 22:29:14,453] Trial 36 pruned. 
[I 2026-03-18 22:29:18,965] Trial 49 pruned. 
[I 2026-03-18 22:29:20,106] Trial 41 pruned. 
[I 2026-03-18 22:29:25,775] Trial 32 finished with value: -1.8510445259712838 and parameters: {'n_layers_yyx': 2, 'hidden_size_yyx_l0': 5, 'hidden_size_yyx_l1': 5, 'context_size_yyx': 2, 'num_mix_components_yyx': 4, 'context_extractor_yyx': 'gru', 'activation_func_yyx': 'Tanh', 'L2_weight_yyx': 0.0003092480617197707, 'L_entropy_weight_yyx': 1.096379179098174e-10, 'L_sep_weight_yyx': 1.2088547543632759e-06, 'L_scale_weight_yyx': 4.829265857387387e-08, 'learning_rate_yyx': 0.008403844588394199}. Best is trial 29 with value: -1.8570256329045391.
[I 2026-03-18 22:29:26,981] Trial 54 pruned. 
[I 2026-03-18 22:29:29,939] Trial 54 pruned. 
[I 2026-03-18 22:29:30,654] Trial 50 pruned. 
[I 2026-03-18 22:29:31,581] Trial 51 finished with value: -1.8522769877750347 and parameters: {'n_layers_yyx': 2, 'hidden_size_yyx_l0': 6, 'hidden_size_yyx_l1': 4, 'context_size_yyx': 3, 'num_mix_components_yyx': 5, 'context_extractor_yyx': 'lstm', 'activation_func_yyx': 'Tanh', 'L2_weight_yyx': 1.1619055642497474e-06, 'L_entropy_weight_yyx': 5.268293632471903e-07, 'L_sep_weight_yyx': 1.0593655659891883e-10, 'L_scale_weight_yyx': 1.8996586933598343e-08, 'learning_rate_yyx': 0.007476781276990018}. Best is trial 9 with value: -1.8570869006965198.
[I 2026-03-18 22:29:34,753] Trial 37 pruned. 
[I 2026-03-18 22:29:38,274] Trial 50 finished with value: -1.7853193803267045 and parameters: {'n_layers_yyx': 2, 'hidden_size_yyx_l0': 5, 'hidden_size_yyx_l1': 4, 'context_size_yyx': 2, 'num_mix_components_yyx': 2, 'context_extractor_yyx': 'gru', 'activation_func_yyx': 'Tanh', 'L2_weight_yyx': 1.917355522755559e-07, 'L_entropy_weight_yyx': 7.081840345181968e-06, 'L_sep_weight_yyx': 7.710191102928714e-05, 'L_scale_weight_yyx': 1.2059035544024276e-05, 'learning_rate_yyx': 0.004098179260021699}. Best is trial 50 with value: -1.7853193803267045.
[I 2026-03-18 22:29:39,480] Trial 55 pruned. 
[I 2026-03-18 22:29:40,382] Trial 51 pruned. 
[I 2026-03-18 22:29:43,794] Trial 54 pruned. 
[I 2026-03-18 22:29:49,592] Trial 54 finished with value: -1.8475436754550525 and parameters: {'n_layers_yyx': 2, 'hidden_size_yyx_l0': 6, 'hidden_size_yyx_l1': 6, 'context_size_yyx': 3, 'num_mix_components_yyx': 3, 'context_extractor_yyx': 'gru', 'activation_func_yyx': 'Tanh', 'L2_weight_yyx': 8.338323579328153e-09, 'L_entropy_weight_yyx': 2.2143092830642088e-09, 'L_sep_weight_yyx': 1.0632296916104459e-07, 'L_scale_weight_yyx': 1.7157046963321222e-09, 'learning_rate_yyx': 0.0077924905541410724}. Best is trial 53 with value: -1.855205638988598.
[I 2026-03-18 22:29:51,212] Trial 54 finished with value: -1.848034309315156 and parameters: {'n_layers_yyx': 2, 'hidden_size_yyx_l0': 2, 'hidden_size_yyx_l1': 4, 'context_size_yyx': 3, 'num_mix_components_yyx': 5, 'context_extractor_yyx': 'lstm', 'activation_func_yyx': 'GELU', 'L2_weight_yyx': 3.839603694947497e-09, 'L_entropy_weight_yyx': 0.0003053030185057251, 'L_sep_weight_yyx': 0.0001712174086237441, 'L_scale_weight_yyx': 5.213875080186654e-10, 'learning_rate_yyx': 0.009982926783651926}. Best is trial 16 with value: -1.8488733665890609.
[I 2026-03-18 22:29:53,721] Trial 55 pruned. 
[I 2026-03-18 22:29:57,066] Trial 51 pruned. 
[I 2026-03-18 22:30:01,600] Trial 55 pruned. 
[I 2026-03-18 22:30:03,403] Trial 56 pruned. 
[I 2026-03-18 22:30:10,477] Trial 42 pruned. 
[I 2026-03-18 22:30:11,571] Trial 58 finished with value: -1.878412049392174 and parameters: {'n_layers_yyx': 2, 'hidden_size_yyx_l0': 3, 'hidden_size_yyx_l1': 6, 'context_size_yyx': 4, 'num_mix_components_yyx': 2, 'context_extractor_yyx': 'lstm', 'activation_func_yyx': 'ReLU', 'L2_weight_yyx': 1.404726687724968e-06, 'L_entropy_weight_yyx': 1.7415640025932948e-10, 'L_sep_weight_yyx': 4.95765753294176e-09, 'L_scale_weight_yyx': 8.456281524235087e-09, 'learning_rate_yyx': 0.008960027320693568}. Best is trial 55 with value: -1.8982689846521137.
[I 2026-03-18 22:30:14,227] Trial 57 pruned. 
[I 2026-03-18 22:30:15,606] Trial 43 finished with value: -1.8686555900721535 and parameters: {'n_layers_yyx': 1, 'hidden_size_yyx_l0': 6, 'context_size_yyx': 4, 'num_mix_components_yyx': 3, 'context_extractor_yyx': 'lstm', 'activation_func_yyx': 'ReLU', 'L2_weight_yyx': 6.65832233865499e-10, 'L_entropy_weight_yyx': 6.823947609357682e-10, 'L_sep_weight_yyx': 5.7725253277043124e-05, 'L_scale_weight_yyx': 0.0008712379506642791, 'learning_rate_yyx': 0.008468377894625366}. Best is trial 42 with value: -1.8699069075199783.
[I 2026-03-18 22:30:16,953] Trial 52 pruned. 
[I 2026-03-18 22:30:18,019] Trial 33 pruned. 
[I 2026-03-18 22:30:18,428] Trial 63 finished with value: -1.8027257777696755 and parameters: {'n_layers_yyx': 1, 'hidden_size_yyx_l0': 4, 'context_size_yyx': 3, 'num_mix_components_yyx': 5, 'context_extractor_yyx': 'gru', 'activation_func_yyx': 'GELU', 'L2_weight_yyx': 3.3595006185768127e-09, 'L_entropy_weight_yyx': 3.140156256785337e-07, 'L_sep_weight_yyx': 9.572915161538108e-05, 'L_scale_weight_yyx': 1.5742776124765712e-05, 'learning_rate_yyx': 0.002397960971648678}. Best is trial 27 with value: -1.8062570642302185.
[I 2026-03-18 22:30:24,121] Trial 38 pruned. 
[I 2026-03-18 22:30:27,940] Trial 56 pruned. 
[I 2026-03-18 22:30:29,390] Trial 43 pruned. 
[I 2026-03-18 22:30:29,751] Trial 48 pruned. 
[I 2026-03-18 22:30:32,275] Trial 52 pruned. 
[I 2026-03-18 22:30:34,386] Trial 58 pruned. 
[I 2026-03-18 22:30:34,588] Trial 52 finished with value: -1.8481800803621788 and parameters: {'n_layers_yyx': 2, 'hidden_size_yyx_l0': 5, 'hidden_size_yyx_l1': 2, 'context_size_yyx': 4, 'num_mix_components_yyx': 5, 'context_extractor_yyx': 'gru', 'activation_func_yyx': 'ReLU', 'L2_weight_yyx': 8.314012148107737e-10, 'L_entropy_weight_yyx': 4.4818526573761696e-08, 'L_sep_weight_yyx': 1.3787552884391587e-10, 'L_scale_weight_yyx': 2.1411118198108256e-06, 'learning_rate_yyx': 0.007361999028828691}. Best is trial 0 with value: -1.8516305051550026.
[I 2026-03-18 22:30:40,355] Trial 49 pruned. 
[I 2026-03-18 22:30:41,278] Trial 55 pruned. 
[I 2026-03-18 22:30:41,843] Trial 55 finished with value: -1.8501606159382038 and parameters: {'n_layers_yyx': 1, 'hidden_size_yyx_l0': 5, 'context_size_yyx': 4, 'num_mix_components_yyx': 4, 'context_extractor_yyx': 'gru', 'activation_func_yyx': 'ReLU', 'L2_weight_yyx': 0.0001717829290008944, 'L_entropy_weight_yyx': 9.674269878858766e-07, 'L_sep_weight_yyx': 1.2770404977444533e-10, 'L_scale_weight_yyx': 6.453915616612028e-09, 'learning_rate_yyx': 0.0082203591454225}. Best is trial 1 with value: -1.8555367853768732.
[I 2026-03-18 22:30:42,446] Trial 39 pruned. 
[I 2026-03-18 22:30:48,050] Trial 44 pruned. 
[I 2026-03-18 22:30:51,594] Trial 56 pruned. 
[I 2026-03-18 22:30:51,673] Trial 40 pruned. 
[I 2026-03-18 22:30:52,133] Trial 53 pruned. 
[I 2026-03-18 22:30:54,658] Trial 59 pruned. 
[I 2026-03-18 22:30:56,730] Trial 45 pruned. 
[I 2026-03-18 22:30:59,402] Trial 59 pruned. 
[I 2026-03-18 22:31:00,357] Trial 50 pruned. 
[I 2026-03-18 22:31:00,786] Trial 56 pruned. 
[I 2026-03-18 22:31:00,943] Trial 41 pruned. 
[I 2026-03-18 22:31:02,745] Trial 53 pruned. 
[I 2026-03-18 22:31:03,555] Trial 64 pruned. 
[I 2026-03-18 22:31:05,390] Trial 46 pruned. 
[I 2026-03-18 22:31:08,505] Trial 44 pruned. 
[I 2026-03-18 22:31:13,231] Trial 60 pruned. 
[I 2026-03-18 22:31:13,319] Trial 54 pruned. 
[I 2026-03-18 22:31:14,570] Trial 47 pruned. 
[I 2026-03-18 22:31:18,595] Trial 52 finished with value: -1.8522393219353668 and parameters: {'n_layers_yyx': 2, 'hidden_size_yyx_l0': 6, 'hidden_size_yyx_l1': 4, 'context_size_yyx': 3, 'num_mix_components_yyx': 5, 'context_extractor_yyx': 'lstm', 'activation_func_yyx': 'Tanh', 'L2_weight_yyx': 9.850030405946145e-07, 'L_entropy_weight_yyx': 6.609011800217061e-07, 'L_sep_weight_yyx': 7.349747967360867e-10, 'L_scale_weight_yyx': 1.661605959298675e-08, 'learning_rate_yyx': 0.007448381267869033}. Best is trial 9 with value: -1.8570869006965198.
[I 2026-03-18 22:31:19,095] Trial 42 pruned. 
[I 2026-03-18 22:31:21,060] Trial 51 pruned. 
[I 2026-03-18 22:31:21,249] Trial 65 pruned. 
[I 2026-03-18 22:31:23,751] Trial 48 pruned. 
[I 2026-03-18 22:31:23,888] Trial 53 pruned. 
[I 2026-03-18 22:31:27,648] Trial 45 pruned. 
[I 2026-03-18 22:31:30,349] Trial 66 pruned. 
[I 2026-03-18 22:31:31,840] Trial 61 pruned. 
[I 2026-03-18 22:31:35,514] Trial 55 pruned. 
[I 2026-03-18 22:31:40,002] Trial 67 pruned. 
[I 2026-03-18 22:31:41,656] Trial 49 pruned. 
[I 2026-03-18 22:31:42,020] Trial 52 pruned. 
[I 2026-03-18 22:31:44,524] Trial 60 finished with value: -1.895925258768016 and parameters: {'n_layers_yyx': 2, 'hidden_size_yyx_l0': 4, 'hidden_size_yyx_l1': 6, 'context_size_yyx': 4, 'num_mix_components_yyx': 3, 'context_extractor_yyx': 'lstm', 'activation_func_yyx': 'ReLU', 'L2_weight_yyx': 3.3401366049374522e-06, 'L_entropy_weight_yyx': 4.029250437925747e-10, 'L_sep_weight_yyx': 1.802820410127784e-09, 'L_scale_weight_yyx': 3.279999594195825e-08, 'learning_rate_yyx': 0.009976359587345503}. Best is trial 55 with value: -1.8982689846521137.
[I 2026-03-18 22:31:48,441] Trial 68 pruned. 
[I 2026-03-18 22:31:48,838] Trial 46 pruned. 
[I 2026-03-18 22:31:48,865] Trial 54 pruned. 
[I 2026-03-18 22:31:49,455] Trial 57 pruned. 
[I 2026-03-18 22:31:51,067] Trial 50 pruned. 
[I 2026-03-18 22:31:51,447] Trial 53 pruned. 
[I 2026-03-18 22:31:54,489] Trial 61 pruned. 
[I 2026-03-18 22:31:57,761] Trial 55 pruned. 
[I 2026-03-18 22:32:00,187] Trial 51 pruned. 
[I 2026-03-18 22:32:04,839] Trial 43 pruned. 
[I 2026-03-18 22:32:10,185] Trial 58 pruned. 
[I 2026-03-18 22:32:13,289] Trial 54 pruned. 
[I 2026-03-18 22:32:13,992] Trial 57 finished with value: -1.8469449417204988 and parameters: {'n_layers_yyx': 2, 'hidden_size_yyx_l0': 3, 'hidden_size_yyx_l1': 6, 'context_size_yyx': 3, 'num_mix_components_yyx': 4, 'context_extractor_yyx': 'lstm', 'activation_func_yyx': 'GELU', 'L2_weight_yyx': 1.34783617211778e-07, 'L_entropy_weight_yyx': 3.383907828732268e-06, 'L_sep_weight_yyx': 0.0002726214308048205, 'L_scale_weight_yyx': 2.0736796407491433e-10, 'learning_rate_yyx': 0.009896266177589765}. Best is trial 16 with value: -1.8488733665890609.
[I 2026-03-18 22:32:23,945] Trial 58 pruned. 
[I 2026-03-18 22:32:25,172] Trial 62 finished with value: -1.937060519937822 and parameters: {'n_layers_yyx': 1, 'hidden_size_yyx_l0': 6, 'context_size_yyx': 4, 'num_mix_components_yyx': 2, 'context_extractor_yyx': 'gru', 'activation_func_yyx': 'ReLU', 'L2_weight_yyx': 1.467838168137716e-10, 'L_entropy_weight_yyx': 4.708307570653784e-09, 'L_sep_weight_yyx': 6.0437187696929475e-05, 'L_scale_weight_yyx': 0.00037668757631122596, 'learning_rate_yyx': 0.009858947878697929}. Best is trial 10 with value: -1.9395614910230956.
[I 2026-03-18 22:32:32,232] Trial 56 finished with value: -1.8538230213950428 and parameters: {'n_layers_yyx': 1, 'hidden_size_yyx_l0': 6, 'context_size_yyx': 3, 'num_mix_components_yyx': 5, 'context_extractor_yyx': 'gru', 'activation_func_yyx': 'ReLU', 'L2_weight_yyx': 4.313221019459812e-09, 'L_entropy_weight_yyx': 5.494524758304947e-05, 'L_sep_weight_yyx': 0.00044227446468836097, 'L_scale_weight_yyx': 1.5267516289493634e-06, 'learning_rate_yyx': 0.006465858148463176}. Best is trial 1 with value: -1.8555367853768732.
[I 2026-03-18 22:32:32,845] Trial 34 finished with value: -1.8509743757241315 and parameters: {'n_layers_yyx': 2, 'hidden_size_yyx_l0': 4, 'hidden_size_yyx_l1': 5, 'context_size_yyx': 2, 'num_mix_components_yyx': 5, 'context_extractor_yyx': 'gru', 'activation_func_yyx': 'ReLU', 'L2_weight_yyx': 2.95217603072334e-05, 'L_entropy_weight_yyx': 3.127265378316263e-10, 'L_sep_weight_yyx': 1.0419816953829393e-07, 'L_scale_weight_yyx': 5.113699540093546e-06, 'learning_rate_yyx': 0.008425895456024152}. Best is trial 29 with value: -1.8570256329045391.
[I 2026-03-18 22:32:33,248] Trial 69 pruned. 
[I 2026-03-18 22:32:35,060] Trial 57 pruned. 
[I 2026-03-18 22:32:41,535] Trial 47 pruned. 
[I 2026-03-18 22:32:43,249] Trial 59 pruned. 
[I 2026-03-18 22:32:43,506] Trial 58 pruned. 
[I 2026-03-18 22:32:45,704] Trial 56 pruned. 
[I 2026-03-18 22:32:48,296] Trial 52 pruned. 
[I 2026-03-18 22:32:50,564] Trial 70 pruned. 
[I 2026-03-18 22:32:51,434] Trial 48 pruned. 
[I 2026-03-18 22:32:51,657] Trial 35 pruned. 
[I 2026-03-18 22:32:55,367] Trial 57 pruned. 
[I 2026-03-18 22:33:02,109] Trial 54 finished with value: -1.8439598202664005 and parameters: {'n_layers_yyx': 2, 'hidden_size_yyx_l0': 5, 'hidden_size_yyx_l1': 3, 'context_size_yyx': 4, 'num_mix_components_yyx': 5, 'context_extractor_yyx': 'gru', 'activation_func_yyx': 'ReLU', 'L2_weight_yyx': 5.345103472298405e-10, 'L_entropy_weight_yyx': 9.103778726283475e-08, 'L_sep_weight_yyx': 2.030242269544894e-10, 'L_scale_weight_yyx': 2.220883294843043e-06, 'learning_rate_yyx': 0.00993667634872611}. Best is trial 0 with value: -1.8516305051550026.
[I 2026-03-18 22:33:03,953] Trial 53 finished with value: -1.851221900141578 and parameters: {'n_layers_yyx': 2, 'hidden_size_yyx_l0': 6, 'hidden_size_yyx_l1': 4, 'context_size_yyx': 3, 'num_mix_components_yyx': 5, 'context_extractor_yyx': 'lstm', 'activation_func_yyx': 'Tanh', 'L2_weight_yyx': 9.661738346919265e-07, 'L_entropy_weight_yyx': 5.008474323078144e-07, 'L_sep_weight_yyx': 1.5593676494517868e-10, 'L_scale_weight_yyx': 2.0714500911850413e-08, 'learning_rate_yyx': 0.0076281337442537156}. Best is trial 9 with value: -1.8570869006965198.
[I 2026-03-18 22:33:08,921] Trial 59 finished with value: -1.8362627670488998 and parameters: {'n_layers_yyx': 2, 'hidden_size_yyx_l0': 5, 'hidden_size_yyx_l1': 5, 'context_size_yyx': 4, 'num_mix_components_yyx': 1, 'context_extractor_yyx': 'lstm', 'activation_func_yyx': 'ReLU', 'L2_weight_yyx': 0.0002856420327138854, 'L_entropy_weight_yyx': 1.053773050690525e-09, 'L_sep_weight_yyx': 2.9589319780201016e-08, 'L_scale_weight_yyx': 8.984029900886845e-10, 'learning_rate_yyx': 0.009971228214536124}. Best is trial 53 with value: -1.855205638988598.
[I 2026-03-18 22:33:11,246] Trial 49 pruned. 
[I 2026-03-18 22:33:18,494] Trial 63 finished with value: -1.9361495157952429 and parameters: {'n_layers_yyx': 1, 'hidden_size_yyx_l0': 6, 'context_size_yyx': 4, 'num_mix_components_yyx': 2, 'context_extractor_yyx': 'gru', 'activation_func_yyx': 'ReLU', 'L2_weight_yyx': 2.6181047162686215e-10, 'L_entropy_weight_yyx': 9.632681579475722e-10, 'L_sep_weight_yyx': 0.00013578806621483228, 'L_scale_weight_yyx': 0.00011555331741608, 'learning_rate_yyx': 0.009072826881920326}. Best is trial 10 with value: -1.9395614910230956.
[I 2026-03-18 22:33:18,764] Trial 60 pruned. 
[I 2026-03-18 22:33:20,982] Trial 50 pruned. 
[I 2026-03-18 22:33:26,301] Trial 56 finished with value: -1.8580038873007623 and parameters: {'n_layers_yyx': 2, 'hidden_size_yyx_l0': 3, 'hidden_size_yyx_l1': 3, 'context_size_yyx': 4, 'num_mix_components_yyx': 3, 'context_extractor_yyx': 'lstm', 'activation_func_yyx': 'GELU', 'L2_weight_yyx': 4.993550652344947e-06, 'L_entropy_weight_yyx': 2.3453484025506204e-08, 'L_sep_weight_yyx': 7.518920941846846e-08, 'L_scale_weight_yyx': 1.4236282894712957e-10, 'learning_rate_yyx': 0.0066229898164524206}. Best is trial 11 with value: -1.8610449438696508.
[I 2026-03-18 22:33:28,220] Trial 61 pruned. 
[I 2026-03-18 22:33:34,833] Trial 53 pruned. 
[I 2026-03-18 22:33:36,832] Trial 62 finished with value: -1.8980748297154217 and parameters: {'n_layers_yyx': 2, 'hidden_size_yyx_l0': 3, 'hidden_size_yyx_l1': 5, 'context_size_yyx': 4, 'num_mix_components_yyx': 3, 'context_extractor_yyx': 'lstm', 'activation_func_yyx': 'ReLU', 'L2_weight_yyx': 7.2782174306768165e-06, 'L_entropy_weight_yyx': 2.1695222017493133e-10, 'L_sep_weight_yyx': 2.734650579664584e-08, 'L_scale_weight_yyx': 2.5691194972331182e-09, 'learning_rate_yyx': 0.008874400525993713}. Best is trial 55 with value: -1.8982689846521137.
[I 2026-03-18 22:33:37,068] Trial 64 pruned. 
[I 2026-03-18 22:33:40,426] Trial 58 pruned. 
[I 2026-03-18 22:33:40,495] Trial 51 pruned. 
[I 2026-03-18 22:33:46,105] Trial 65 pruned. 
[I 2026-03-18 22:33:49,006] Trial 59 pruned. 
[I 2026-03-18 22:33:50,747] Trial 54 pruned. 
[I 2026-03-18 22:33:51,072] Trial 55 pruned. 
[I 2026-03-18 22:33:55,416] Trial 66 pruned. 
[I 2026-03-18 22:33:55,599] Trial 63 pruned. 
[I 2026-03-18 22:33:58,409] Trial 60 pruned. 
[I 2026-03-18 22:34:09,203] Trial 59 finished with value: -1.7817695509785354 and parameters: {'n_layers_yyx': 2, 'hidden_size_yyx_l0': 6, 'hidden_size_yyx_l1': 5, 'context_size_yyx': 3, 'num_mix_components_yyx': 5, 'context_extractor_yyx': 'gru', 'activation_func_yyx': 'ReLU', 'L2_weight_yyx': 1.712098996205584e-09, 'L_entropy_weight_yyx': 0.0004751429102783615, 'L_sep_weight_yyx': 2.5059897820515862e-06, 'L_scale_weight_yyx': 4.333874914403596e-07, 'learning_rate_yyx': 0.006385860925918568}. Best is trial 4 with value: -1.7875800731928662.
[I 2026-03-18 22:34:10,594] Trial 56 pruned. 
[I 2026-03-18 22:34:13,431] Trial 67 pruned. 
[I 2026-03-18 22:34:13,489] Trial 57 pruned. 
