[I 2026-03-18 22:30:24,116] Trial 86 pruned. 

Source events: 3403
Target events: 5634
Full model ln_yyx : 55.69511 nats/sec, 8.89698 nats/event
Full model Log loss : -1.42198
Full model ln_yyx : 56.66736 nats/sec, 9.05229 nats/event
Full model Log loss : -1.45572
Full model ln_yyx : 56.36076 nats/sec, 9.00332 nats/event
Full model Log loss : -1.45097
Full model ln_yyx : 57.30369 nats/sec, 9.15394 nats/event
Full model Log loss : -1.45647
Full model ln_yyx : 56.98498 nats/sec, 9.10303 nats/event
Full model Log loss : -1.45785
Full model ln_yyx : 56.84066 nats/sec, 9.07998 nats/event
Full model Log loss : -1.46001
Full model ln_yyx : 56.33950 nats/sec, 8.99992 nats/event
Full model Log loss : -1.45004
Full model ln_yyx : 55.91400 nats/sec, 8.93195 nats/event
Full model Log loss : -1.41111
Full model ln_yyx : 56.74756 nats/sec, 9.06510 nats/event
Full model Log loss : -1.45006
Full model ln_yyx : 56.48966 nats/sec, 9.02391 nats/event
Full model Log loss : -1.44840
Full model ln_yyx : 56.70654 nats/sec, 9.05855 nats/event
Full model Log loss : -1.45460
Full model ln_yyx : 57.43955 nats/sec, 9.17565 nats/event
Full model Log loss : -1.45673
Full model ln_yyx : 56.59713 nats/sec, 9.04107 nats/event
Full model Log loss : -1.43575
Full model ln_yyx : 57.61908 nats/sec, 9.20433 nats/event
Full model Log loss : -1.46311
Full model ln_yyx : 57.63884 nats/sec, 9.20748 nats/event
Full model Log loss : -1.46461
Full model ln_yyx : 57.83144 nats/sec, 9.23825 nats/event
Full model Log loss : -1.46538
Full model ln_yyx : 57.13805 nats/sec, 9.12748 nats/event
Full model Log loss : -1.45530
Full model ln_yyx : 57.74336 nats/sec, 9.22418 nats/event
Full model Log loss : -1.46289
Full model ln_yyx : 57.69079 nats/sec, 9.21578 nats/event
Full model Log loss : -1.46361
Optimization finished. Config saved to results/opt-full/opt_full_245_best_config.txt
[I 2026-03-18 22:30:30,089] Trial 49 pruned. 
[I 2026-03-18 22:30:31,234] Trial 58 finished with value: -1.4450364567683294 and parameters: {'n_layers_yyx': 2, 'hidden_size_yyx_l0': 3, 'hidden_size_yyx_l1': 4, 'context_size_yyx': 4, 'num_mix_components_yyx': 5, 'context_extractor_yyx': 'gru', 'activation_func_yyx': 'Tanh', 'L2_weight_yyx': 1.7985747111143826e-06, 'L_entropy_weight_yyx': 7.387437474176162e-05, 'L_sep_weight_yyx': 8.537250801142311e-10, 'L_scale_weight_yyx': 2.2895813936237542e-09, 'learning_rate_yyx': 0.00891667349771191}. Best is trial 45 with value: -1.4586368032602164.
[I 2026-03-18 22:30:39,575] Trial 37 finished with value: -2.4767462491063403 and parameters: {'n_layers_yyx': 1, 'hidden_size_yyx_l0': 5, 'context_size_yyx': 4, 'num_mix_components_yyx': 1, 'context_extractor_yyx': 'gru', 'activation_func_yyx': 'ReLU', 'L2_weight_yyx': 4.872780704724365e-05, 'L_entropy_weight_yyx': 2.5736846392128774e-07, 'L_sep_weight_yyx': 1.5678794629536764e-07, 'L_scale_weight_yyx': 1.5110566432429195e-08, 'learning_rate_yyx': 0.0076886171956735755}. Best is trial 34 with value: -2.477771523391826.
[I 2026-03-18 22:30:44,961] Trial 59 finished with value: -1.4605118267352764 and parameters: {'n_layers_yyx': 2, 'hidden_size_yyx_l0': 4, 'hidden_size_yyx_l1': 4, 'context_size_yyx': 4, 'num_mix_components_yyx': 5, 'context_extractor_yyx': 'gru', 'activation_func_yyx': 'Tanh', 'L2_weight_yyx': 1.8315193618037972e-06, 'L_entropy_weight_yyx': 6.837383811088574e-06, 'L_sep_weight_yyx': 4.22615132397347e-08, 'L_scale_weight_yyx': 1.527776595336246e-09, 'learning_rate_yyx': 0.008917282212436055}. Best is trial 59 with value: -1.4605118267352764.
[I 2026-03-18 22:30:50,579] Trial 74 finished with value: -2.474349366950352 and parameters: {'n_layers_yyx': 2, 'hidden_size_yyx_l0': 6, 'hidden_size_yyx_l1': 6, 'context_size_yyx': 4, 'num_mix_components_yyx': 3, 'context_extractor_yyx': 'gru', 'activation_func_yyx': 'ReLU', 'L2_weight_yyx': 5.827847122079826e-07, 'L_entropy_weight_yyx': 2.1025771767238686e-07, 'L_sep_weight_yyx': 5.427586844720423e-07, 'L_scale_weight_yyx': 0.00031575529070404756, 'learning_rate_yyx': 0.009305862579122503}. Best is trial 25 with value: -2.4764732316599813.
[I 2026-03-18 22:30:55,109] Trial 72 finished with value: -2.48396720782664 and parameters: {'n_layers_yyx': 1, 'hidden_size_yyx_l0': 6, 'context_size_yyx': 4, 'num_mix_components_yyx': 5, 'context_extractor_yyx': 'gru', 'activation_func_yyx': 'ReLU', 'L2_weight_yyx': 1.1092303508523442e-05, 'L_entropy_weight_yyx': 0.0002381170697226492, 'L_sep_weight_yyx': 3.34947721581731e-05, 'L_scale_weight_yyx': 1.60965672726329e-07, 'learning_rate_yyx': 0.008432886020670851}. Best is trial 46 with value: -2.4875562296733595.
[I 2026-03-18 22:30:57,823] Trial 60 finished with value: -1.4616529259314903 and parameters: {'n_layers_yyx': 2, 'hidden_size_yyx_l0': 4, 'hidden_size_yyx_l1': 4, 'context_size_yyx': 4, 'num_mix_components_yyx': 5, 'context_extractor_yyx': 'gru', 'activation_func_yyx': 'Tanh', 'L2_weight_yyx': 5.31993452556226e-07, 'L_entropy_weight_yyx': 7.135846192312663e-06, 'L_sep_weight_yyx': 6.412809882312647e-10, 'L_scale_weight_yyx': 1.0471017572875642e-09, 'learning_rate_yyx': 0.009204500358072614}. Best is trial 60 with value: -1.4616529259314903.
[I 2026-03-18 22:31:10,261] Trial 61 finished with value: -1.4472889122596153 and parameters: {'n_layers_yyx': 2, 'hidden_size_yyx_l0': 5, 'hidden_size_yyx_l1': 3, 'context_size_yyx': 4, 'num_mix_components_yyx': 5, 'context_extractor_yyx': 'lstm', 'activation_func_yyx': 'Tanh', 'L2_weight_yyx': 4.7225885455378415e-07, 'L_entropy_weight_yyx': 8.773266578288971e-06, 'L_sep_weight_yyx': 1.466372241899929e-08, 'L_scale_weight_yyx': 7.577077330078172e-10, 'learning_rate_yyx': 0.006636890184821946}. Best is trial 60 with value: -1.4616529259314903.
[I 2026-03-18 22:31:11,868] Trial 62 pruned. 
[I 2026-03-18 22:31:15,452] Trial 63 pruned. 
[I 2026-03-18 22:31:17,186] Trial 64 pruned. 
[I 2026-03-18 22:31:23,960] Trial 75 pruned. 
[I 2026-03-18 22:31:27,213] Trial 73 pruned. 
[I 2026-03-18 22:31:27,747] Trial 50 finished with value: -2.4915405001235302 and parameters: {'n_layers_yyx': 1, 'hidden_size_yyx_l0': 4, 'context_size_yyx': 3, 'num_mix_components_yyx': 5, 'context_extractor_yyx': 'gru', 'activation_func_yyx': 'GELU', 'L2_weight_yyx': 3.2178823695185417e-06, 'L_entropy_weight_yyx': 5.773157257871397e-07, 'L_sep_weight_yyx': 1.0192735871804024e-08, 'L_scale_weight_yyx': 1.4679791560292755e-06, 'learning_rate_yyx': 0.004030621877849438}. Best is trial 35 with value: -2.497237209565205.
[I 2026-03-18 22:31:29,233] Trial 76 pruned. 
[I 2026-03-18 22:31:29,989] Trial 38 finished with value: -2.476434736591828 and parameters: {'n_layers_yyx': 1, 'hidden_size_yyx_l0': 5, 'context_size_yyx': 4, 'num_mix_components_yyx': 1, 'context_extractor_yyx': 'gru', 'activation_func_yyx': 'ReLU', 'L2_weight_yyx': 7.093430577317992e-05, 'L_entropy_weight_yyx': 4.016986278877499e-08, 'L_sep_weight_yyx': 0.0003223961203618213, 'L_scale_weight_yyx': 1.0988712952251917e-08, 'learning_rate_yyx': 0.007077069226265149}. Best is trial 34 with value: -2.477771523391826.
[I 2026-03-18 22:31:36,978] Trial 65 finished with value: -1.415193105844351 and parameters: {'n_layers_yyx': 2, 'hidden_size_yyx_l0': 4, 'hidden_size_yyx_l1': 3, 'context_size_yyx': 4, 'num_mix_components_yyx': 4, 'context_extractor_yyx': 'lstm', 'activation_func_yyx': 'Tanh', 'L2_weight_yyx': 1.800906607646915e-06, 'L_entropy_weight_yyx': 8.85078273919037e-06, 'L_sep_weight_yyx': 1.979893699856884e-10, 'L_scale_weight_yyx': 2.742599164340123e-10, 'learning_rate_yyx': 0.007258131431182184}. Best is trial 60 with value: -1.4616529259314903.
[I 2026-03-18 22:31:38,729] Trial 51 pruned. 
[I 2026-03-18 22:31:39,412] Trial 74 pruned. 
[I 2026-03-18 22:31:40,255] Trial 66 pruned. 
[I 2026-03-18 22:31:42,482] Trial 39 pruned. 
[I 2026-03-18 22:31:49,603] Trial 52 pruned. 
[I 2026-03-18 22:31:51,307] Trial 75 pruned. 
[I 2026-03-18 22:31:52,900] Trial 67 finished with value: -1.4490064885066105 and parameters: {'n_layers_yyx': 2, 'hidden_size_yyx_l0': 5, 'hidden_size_yyx_l1': 4, 'context_size_yyx': 4, 'num_mix_components_yyx': 5, 'context_extractor_yyx': 'gru', 'activation_func_yyx': 'Tanh', 'L2_weight_yyx': 1.1899381165525013e-07, 'L_entropy_weight_yyx': 5.738607901686454e-06, 'L_sep_weight_yyx': 9.443049416448067e-10, 'L_scale_weight_yyx': 1.284815199391832e-09, 'learning_rate_yyx': 0.008987847102077146}. Best is trial 60 with value: -1.4616529259314903.
[I 2026-03-18 22:31:55,909] Trial 77 finished with value: -2.448277700179869 and parameters: {'n_layers_yyx': 2, 'hidden_size_yyx_l0': 6, 'hidden_size_yyx_l1': 6, 'context_size_yyx': 4, 'num_mix_components_yyx': 2, 'context_extractor_yyx': 'gru', 'activation_func_yyx': 'ReLU', 'L2_weight_yyx': 1.3694921730614712e-08, 'L_entropy_weight_yyx': 0.00021553367557161908, 'L_sep_weight_yyx': 1.8436047126761747e-07, 'L_scale_weight_yyx': 3.2670006990801336e-07, 'learning_rate_yyx': 0.008044384603133123}. Best is trial 25 with value: -2.4764732316599813.
[I 2026-03-18 22:32:01,271] Trial 78 pruned. 
[I 2026-03-18 22:32:03,363] Trial 76 pruned. 
[I 2026-03-18 22:32:06,370] Trial 68 finished with value: -1.4247083693284255 and parameters: {'n_layers_yyx': 2, 'hidden_size_yyx_l0': 5, 'hidden_size_yyx_l1': 4, 'context_size_yyx': 4, 'num_mix_components_yyx': 4, 'context_extractor_yyx': 'gru', 'activation_func_yyx': 'Tanh', 'L2_weight_yyx': 3.713031635931808e-08, 'L_entropy_weight_yyx': 2.1489434331224934e-06, 'L_sep_weight_yyx': 7.638814789403055e-10, 'L_scale_weight_yyx': 2.2385427429256311e-10, 'learning_rate_yyx': 0.008914565962872888}. Best is trial 60 with value: -1.4616529259314903.
[I 2026-03-18 22:32:08,122] Trial 69 pruned. 
[I 2026-03-18 22:32:13,552] Trial 79 pruned. 
[I 2026-03-18 22:32:15,554] Trial 40 pruned. 
[I 2026-03-18 22:32:16,518] Trial 70 pruned. 
[I 2026-03-18 22:32:19,867] Trial 71 pruned. 
[I 2026-03-18 22:32:27,689] Trial 41 pruned. 
[I 2026-03-18 22:32:34,130] Trial 72 finished with value: -1.452953866811899 and parameters: {'n_layers_yyx': 2, 'hidden_size_yyx_l0': 5, 'hidden_size_yyx_l1': 4, 'context_size_yyx': 4, 'num_mix_components_yyx': 5, 'context_extractor_yyx': 'gru', 'activation_func_yyx': 'Tanh', 'L2_weight_yyx': 5.568989294979946e-07, 'L_entropy_weight_yyx': 4.0718866152932274e-05, 'L_sep_weight_yyx': 1.2889116660808553e-09, 'L_scale_weight_yyx': 1.173793599593662e-09, 'learning_rate_yyx': 0.007461910641272064}. Best is trial 60 with value: -1.4616529259314903.
[I 2026-03-18 22:32:35,382] Trial 77 pruned. 
[I 2026-03-18 22:32:40,402] Trial 78 pruned. 
[I 2026-03-18 22:32:40,586] Trial 53 finished with value: -2.4934030560289124 and parameters: {'n_layers_yyx': 1, 'hidden_size_yyx_l0': 6, 'context_size_yyx': 4, 'num_mix_components_yyx': 5, 'context_extractor_yyx': 'gru', 'activation_func_yyx': 'GELU', 'L2_weight_yyx': 3.4525769947019425e-09, 'L_entropy_weight_yyx': 0.00015469394423743639, 'L_sep_weight_yyx': 6.847466606529752e-10, 'L_scale_weight_yyx': 4.5382571470700527e-07, 'learning_rate_yyx': 0.006643438822865415}. Best is trial 35 with value: -2.497237209565205.
[I 2026-03-18 22:32:47,310] Trial 80 pruned. 
[I 2026-03-18 22:32:48,855] Trial 73 finished with value: -1.43968994140625 and parameters: {'n_layers_yyx': 2, 'hidden_size_yyx_l0': 5, 'hidden_size_yyx_l1': 4, 'context_size_yyx': 4, 'num_mix_components_yyx': 5, 'context_extractor_yyx': 'gru', 'activation_func_yyx': 'Tanh', 'L2_weight_yyx': 2.893277799296786e-07, 'L_entropy_weight_yyx': 3.4948423896483424e-05, 'L_sep_weight_yyx': 1.5029757988791697e-09, 'L_scale_weight_yyx': 1.2722747877472299e-09, 'learning_rate_yyx': 0.007347660372679116}. Best is trial 60 with value: -1.4616529259314903.
[I 2026-03-18 22:32:52,364] Trial 79 pruned. 
[I 2026-03-18 22:33:02,951] Trial 74 finished with value: -1.4531946270282452 and parameters: {'n_layers_yyx': 2, 'hidden_size_yyx_l0': 5, 'hidden_size_yyx_l1': 4, 'context_size_yyx': 4, 'num_mix_components_yyx': 5, 'context_extractor_yyx': 'gru', 'activation_func_yyx': 'Tanh', 'L2_weight_yyx': 7.165698980403053e-08, 'L_entropy_weight_yyx': 6.239663362667924e-06, 'L_sep_weight_yyx': 1.0693184443243297e-09, 'L_scale_weight_yyx': 3.2845134178551986e-09, 'learning_rate_yyx': 0.009450566825504273}. Best is trial 60 with value: -1.4616529259314903.
[I 2026-03-18 22:33:12,105] Trial 54 finished with value: -2.4903858555225966 and parameters: {'n_layers_yyx': 1, 'hidden_size_yyx_l0': 6, 'context_size_yyx': 4, 'num_mix_components_yyx': 5, 'context_extractor_yyx': 'gru', 'activation_func_yyx': 'GELU', 'L2_weight_yyx': 1.5213389012406705e-09, 'L_entropy_weight_yyx': 0.0006565895441489969, 'L_sep_weight_yyx': 1.7705708002847456e-09, 'L_scale_weight_yyx': 1.969927545338816e-06, 'learning_rate_yyx': 0.007737960846496671}. Best is trial 35 with value: -2.497237209565205.
[I 2026-03-18 22:33:14,752] Trial 42 finished with value: -2.475945768615529 and parameters: {'n_layers_yyx': 1, 'hidden_size_yyx_l0': 5, 'context_size_yyx': 4, 'num_mix_components_yyx': 2, 'context_extractor_yyx': 'gru', 'activation_func_yyx': 'ReLU', 'L2_weight_yyx': 4.7865153043714064e-06, 'L_entropy_weight_yyx': 1.7560540780598447e-07, 'L_sep_weight_yyx': 1.374422175796521e-07, 'L_scale_weight_yyx': 1.3721079956852213e-08, 'learning_rate_yyx': 0.008018966480705676}. Best is trial 34 with value: -2.477771523391826.
[I 2026-03-18 22:33:15,316] Trial 75 finished with value: -1.448454355093149 and parameters: {'n_layers_yyx': 2, 'hidden_size_yyx_l0': 5, 'hidden_size_yyx_l1': 4, 'context_size_yyx': 4, 'num_mix_components_yyx': 5, 'context_extractor_yyx': 'gru', 'activation_func_yyx': 'Tanh', 'L2_weight_yyx': 4.6793827544826635e-09, 'L_entropy_weight_yyx': 4.383009288469962e-06, 'L_sep_weight_yyx': 1.057017166514384e-09, 'L_scale_weight_yyx': 3.178737655600518e-09, 'learning_rate_yyx': 0.009418499000701878}. Best is trial 60 with value: -1.4616529259314903.
[I 2026-03-18 22:33:20,806] Trial 81 pruned. 
[I 2026-03-18 22:33:24,079] Trial 80 pruned. 
[I 2026-03-18 22:33:28,844] Trial 81 pruned. 
[I 2026-03-18 22:33:31,104] Trial 76 finished with value: -1.4453667273888222 and parameters: {'n_layers_yyx': 2, 'hidden_size_yyx_l0': 6, 'hidden_size_yyx_l1': 4, 'context_size_yyx': 4, 'num_mix_components_yyx': 5, 'context_extractor_yyx': 'gru', 'activation_func_yyx': 'Tanh', 'L2_weight_yyx': 7.005257531795754e-10, 'L_entropy_weight_yyx': 3.212516735396131e-06, 'L_sep_weight_yyx': 1.0633464587104362e-10, 'L_scale_weight_yyx': 3.329791492847886e-09, 'learning_rate_yyx': 0.009438334684969537}. Best is trial 60 with value: -1.4616529259314903.

Source events: 3403
Target events: 24874
Full model ln_yyx : 240.91994 nats/sec, 8.71705 nats/event
Full model Log loss : -1.35141
Full model ln_yyx : 252.42988 nats/sec, 9.13351 nats/event
Full model Log loss : -1.43449
Full model ln_yyx : 252.52877 nats/sec, 9.13709 nats/event
Full model Log loss : -1.43081
Full model ln_yyx : 244.19519 nats/sec, 8.83556 nats/event
Full model Log loss : -1.39629
Full model ln_yyx : 236.44311 nats/sec, 8.55507 nats/event
Full model Log loss : -1.29584
Full model ln_yyx : 252.14511 nats/sec, 9.12320 nats/event
Full model Log loss : -1.45864
Full model ln_yyx : 238.70412 nats/sec, 8.63688 nats/event
Full model Log loss : -1.35438
Full model ln_yyx : 250.44916 nats/sec, 9.06184 nats/event
Full model Log loss : -1.44803
Full model ln_yyx : 252.59331 nats/sec, 9.13942 nats/event
Full model Log loss : -1.43703
Full model ln_yyx : 253.02748 nats/sec, 9.15513 nats/event
Full model Log loss : -1.43962
Full model ln_yyx : 248.60645 nats/sec, 8.99517 nats/event
Full model Log loss : -1.44511
Full model ln_yyx : 251.40572 nats/sec, 9.09645 nats/event
Full model Log loss : -1.45508
Full model ln_yyx : 251.46327 nats/sec, 9.09853 nats/event
Full model Log loss : -1.43886
Full model ln_yyx : 250.49748 nats/sec, 9.06359 nats/event
Full model Log loss : -1.44504
Full model ln_yyx : 255.16275 nats/sec, 9.23239 nats/event
Full model Log loss : -1.46051
Full model ln_yyx : 253.99306 nats/sec, 9.19007 nats/event
Full model Log loss : -1.46165
Full model ln_yyx : 249.64064 nats/sec, 9.03259 nats/event
Full model Log loss : -1.44729
Full model ln_yyx : 250.13403 nats/sec, 9.05044 nats/event
Full model Log loss : -1.41519
Full model ln_yyx : 250.79316 nats/sec, 9.07429 nats/event
Full model Log loss : -1.44901
Full model ln_yyx : 246.25977 nats/sec, 8.91026 nats/event
Full model Log loss : -1.42471
Full model ln_yyx : 253.09370 nats/sec, 9.15753 nats/event
Full model Log loss : -1.45295
Full model ln_yyx : 251.46220 nats/sec, 9.09850 nats/event
Full model Log loss : -1.43969
Full model ln_yyx : 250.23074 nats/sec, 9.05394 nats/event
Full model Log loss : -1.45319
Full model ln_yyx : 251.48228 nats/sec, 9.09922 nats/event
Full model Log loss : -1.44845
Full model ln_yyx : 254.12440 nats/sec, 9.19482 nats/event
Full model Log loss : -1.44537
Optimization finished. Config saved to results/opt-full/opt_full_248_best_config.txt
[I 2026-03-18 22:33:32,851] Trial 82 pruned. 
[I 2026-03-18 22:33:45,332] Trial 83 pruned. 
[I 2026-03-18 22:33:53,467] Trial 55 finished with value: -2.492335887315813 and parameters: {'n_layers_yyx': 1, 'hidden_size_yyx_l0': 6, 'context_size_yyx': 4, 'num_mix_components_yyx': 5, 'context_extractor_yyx': 'gru', 'activation_func_yyx': 'GELU', 'L2_weight_yyx': 1.9464956964854977e-10, 'L_entropy_weight_yyx': 7.122925144432179e-05, 'L_sep_weight_yyx': 1.4843445505092684e-10, 'L_scale_weight_yyx': 6.182086972608622e-07, 'learning_rate_yyx': 0.009033719805932913}. Best is trial 35 with value: -2.497237209565205.
[I 2026-03-18 22:33:57,517] Trial 84 pruned. 
[I 2026-03-18 22:34:02,875] Trial 85 pruned. 
[I 2026-03-18 22:34:04,266] Trial 56 pruned. 
[I 2026-03-18 22:34:05,879] Trial 43 finished with value: -2.476564937205101 and parameters: {'n_layers_yyx': 1, 'hidden_size_yyx_l0': 5, 'context_size_yyx': 4, 'num_mix_components_yyx': 1, 'context_extractor_yyx': 'gru', 'activation_func_yyx': 'ReLU', 'L2_weight_yyx': 3.0734536298941725e-07, 'L_entropy_weight_yyx': 1.5300131273747458e-07, 'L_sep_weight_yyx': 1.527662267931587e-07, 'L_scale_weight_yyx': 1.3484390858192809e-08, 'learning_rate_yyx': 0.008170147022022676}. Best is trial 34 with value: -2.477771523391826.
[I 2026-03-18 22:34:08,920] Trial 82 finished with value: -2.4841495952347286 and parameters: {'n_layers_yyx': 1, 'hidden_size_yyx_l0': 6, 'context_size_yyx': 4, 'num_mix_components_yyx': 5, 'context_extractor_yyx': 'gru', 'activation_func_yyx': 'ReLU', 'L2_weight_yyx': 0.0002177437874056106, 'L_entropy_weight_yyx': 0.00011215225507156017, 'L_sep_weight_yyx': 2.6562829558584907e-06, 'L_scale_weight_yyx': 8.544520879685187e-07, 'learning_rate_yyx': 0.009317442143108713}. Best is trial 46 with value: -2.4875562296733595.

Source events: 29032
Target events: 3828
Full model ln_yyx : 469.29104 nats/sec, 110.33488 nats/event
Full model Log loss : -2.48756
Full model ln_yyx : 467.89969 nats/sec, 110.00776 nats/event
Full model Log loss : -2.48486
Full model ln_yyx : 467.58193 nats/sec, 109.93306 nats/event
Full model Log loss : -2.45585
Full model ln_yyx : 469.03803 nats/sec, 110.27540 nats/event
Full model Log loss : -2.48410
Full model ln_yyx : 470.00815 nats/sec, 110.50348 nats/event
Full model Log loss : -2.48526
Full model ln_yyx : 466.93272 nats/sec, 109.78042 nats/event
Full model Log loss : -2.45458
Full model ln_yyx : 469.19598 nats/sec, 110.31253 nats/event
Full model Log loss : -2.48397
Full model ln_yyx : 466.77262 nats/sec, 109.74278 nats/event
Full model Log loss : -2.48415
Optimization finished. Config saved to results/opt-full/opt_full_255_best_config.txt
[I 2026-03-18 22:34:08,978] Trial 57 pruned. 
[I 2026-03-18 22:34:14,699] Trial 86 pruned. 
[I 2026-03-18 22:34:36,313] Trial 58 pruned. 
[I 2026-03-18 22:34:46,457] Trial 87 pruned. 
[I 2026-03-18 22:34:46,577] Trial 59 pruned. 
[I 2026-03-18 22:34:51,754] Trial 88 pruned. 
[I 2026-03-18 22:34:53,785] Trial 44 finished with value: -2.476624254199081 and parameters: {'n_layers_yyx': 1, 'hidden_size_yyx_l0': 5, 'context_size_yyx': 4, 'num_mix_components_yyx': 1, 'context_extractor_yyx': 'gru', 'activation_func_yyx': 'ReLU', 'L2_weight_yyx': 5.145428902643014e-07, 'L_entropy_weight_yyx': 1.3412566814585217e-08, 'L_sep_weight_yyx': 1.8832868354736254e-07, 'L_scale_weight_yyx': 1.3302392582743798e-07, 'learning_rate_yyx': 0.008371099485715813}. Best is trial 34 with value: -2.477771523391826.
[I 2026-03-18 22:34:56,692] Trial 60 pruned. 
[I 2026-03-18 22:34:58,832] Trial 45 pruned. 
[I 2026-03-18 22:35:03,641] Trial 89 pruned. 
[I 2026-03-18 22:35:03,850] Trial 46 pruned. 
[I 2026-03-18 22:35:07,014] Trial 61 pruned. 
[I 2026-03-18 22:35:15,419] Trial 90 pruned. 
[I 2026-03-18 22:35:15,732] Trial 47 pruned. 
[I 2026-03-18 22:35:34,655] Trial 62 pruned. 
[I 2026-03-18 22:35:47,206] Trial 48 pruned. 
[I 2026-03-18 22:35:52,236] Trial 49 pruned. 
[I 2026-03-18 22:35:54,080] Trial 91 finished with value: -2.4725548464852674 and parameters: {'n_layers_yyx': 1, 'hidden_size_yyx_l0': 6, 'context_size_yyx': 3, 'num_mix_components_yyx': 5, 'context_extractor_yyx': 'gru', 'activation_func_yyx': 'ReLU', 'L2_weight_yyx': 1.0259198172838259e-08, 'L_entropy_weight_yyx': 5.741732652613566e-09, 'L_sep_weight_yyx': 6.998230878229045e-07, 'L_scale_weight_yyx': 0.000418026285663619, 'learning_rate_yyx': 0.005819705911375211}. Best is trial 25 with value: -2.4764732316599813.
[I 2026-03-18 22:36:16,321] Trial 50 finished with value: -2.448339788811896 and parameters: {'n_layers_yyx': 1, 'hidden_size_yyx_l0': 5, 'context_size_yyx': 4, 'num_mix_components_yyx': 1, 'context_extractor_yyx': 'gru', 'activation_func_yyx': 'GELU', 'L2_weight_yyx': 0.0007941302531197222, 'L_entropy_weight_yyx': 7.091656064984869e-09, 'L_sep_weight_yyx': 4.4803215845052556e-05, 'L_scale_weight_yyx': 1.1256430813302712e-09, 'learning_rate_yyx': 0.008453565646389879}. Best is trial 34 with value: -2.477771523391826.
