[I 2026-03-18 19:59:19,563] Trial 23 pruned. 
[I 2026-03-18 19:59:19,654] Trial 42 pruned. 
[I 2026-03-18 19:59:19,768] Trial 36 pruned. 
[I 2026-03-18 19:59:23,812] Trial 34 pruned. 
[I 2026-03-18 19:59:25,402] Trial 33 pruned. 
[I 2026-03-18 19:59:26,298] Trial 16 pruned. 
[I 2026-03-18 19:59:26,898] Trial 39 pruned. 
[I 2026-03-18 19:59:29,397] Trial 37 pruned. 
[I 2026-03-18 19:59:29,556] Trial 27 finished with value: -2.5042011734127074 and parameters: {'n_layers_yyx': 1, 'hidden_size_yyx_l0': 6, 'context_size_yyx': 4, 'num_mix_components_yyx': 4, 'context_extractor_yyx': 'lstm', 'activation_func_yyx': 'Tanh', 'L2_weight_yyx': 2.9282619256867326e-08, 'L_entropy_weight_yyx': 1.914878863309761e-06, 'L_sep_weight_yyx': 1.623290237126653e-07, 'L_scale_weight_yyx': 6.046919576815622e-07, 'learning_rate_yyx': 0.0078103524207455005}. Best is trial 25 with value: -2.504659714809684.
[I 2026-03-18 19:59:33,613] Trial 27 pruned. 
[I 2026-03-18 19:59:35,335] Trial 22 pruned. 
[I 2026-03-18 19:59:35,422] Trial 35 pruned. 
[I 2026-03-18 19:59:35,883] Trial 25 finished with value: -2.515340441232565 and parameters: {'n_layers_yyx': 2, 'hidden_size_yyx_l0': 4, 'hidden_size_yyx_l1': 3, 'context_size_yyx': 4, 'num_mix_components_yyx': 4, 'context_extractor_yyx': 'gru', 'activation_func_yyx': 'ReLU', 'L2_weight_yyx': 8.719651321063434e-09, 'L_entropy_weight_yyx': 2.0984737257134586e-06, 'L_sep_weight_yyx': 1.4633982597756107e-07, 'L_scale_weight_yyx': 8.714569996061966e-05, 'learning_rate_yyx': 0.009283732975252026}. Best is trial 22 with value: -2.5155989726836543.
[I 2026-03-18 19:59:40,380] Trial 22 pruned. 
[I 2026-03-18 19:59:41,450] Trial 41 finished with value: -1.9827367418855888 and parameters: {'n_layers_yyx': 2, 'hidden_size_yyx_l0': 4, 'hidden_size_yyx_l1': 6, 'context_size_yyx': 3, 'num_mix_components_yyx': 4, 'context_extractor_yyx': 'lstm', 'activation_func_yyx': 'Tanh', 'L2_weight_yyx': 0.00012989694555893741, 'L_entropy_weight_yyx': 2.960354157877991e-07, 'L_sep_weight_yyx': 3.022891015248152e-10, 'L_scale_weight_yyx': 2.846806262634187e-08, 'learning_rate_yyx': 0.008724651330274525}. Best is trial 1 with value: -1.9828018961884801.
[I 2026-03-18 19:59:42,201] Trial 28 pruned. 
[I 2026-03-18 19:59:46,148] Trial 29 pruned. 
[I 2026-03-18 19:59:46,735] Trial 40 pruned. 
[I 2026-03-18 19:59:47,048] Trial 36 pruned. 
[I 2026-03-18 19:59:47,150] Trial 43 finished with value: -1.6702626130719531 and parameters: {'n_layers_yyx': 1, 'hidden_size_yyx_l0': 6, 'context_size_yyx': 4, 'num_mix_components_yyx': 4, 'context_extractor_yyx': 'gru', 'activation_func_yyx': 'ReLU', 'L2_weight_yyx': 2.3397779612212233e-07, 'L_entropy_weight_yyx': 4.410967981611442e-05, 'L_sep_weight_yyx': 1.1404896974726706e-09, 'L_scale_weight_yyx': 5.0200581240882984e-09, 'learning_rate_yyx': 0.008425329269003122}. Best is trial 13 with value: -1.6789194095140463.
[I 2026-03-18 19:59:47,899] Trial 34 pruned. 
[I 2026-03-18 19:59:48,528] Trial 23 pruned. 
[I 2026-03-18 19:59:50,364] Trial 24 pruned. 
[I 2026-03-18 19:59:52,452] Trial 28 pruned. 
[I 2026-03-18 19:59:53,823] Trial 44 pruned. 
[I 2026-03-18 19:59:57,213] Trial 41 pruned. 
[I 2026-03-18 19:59:57,590] Trial 44 pruned. 
[I 2026-03-18 19:59:58,682] Trial 24 pruned. 
[I 2026-03-18 19:59:59,144] Trial 35 pruned. 
[I 2026-03-18 19:59:59,724] Trial 37 pruned. 
[I 2026-03-18 20:00:00,803] Trial 24 pruned. 
[I 2026-03-18 20:00:01,124] Trial 31 finished with value: -1.982787863742868 and parameters: {'n_layers_yyx': 1, 'hidden_size_yyx_l0': 5, 'context_size_yyx': 4, 'num_mix_components_yyx': 4, 'context_extractor_yyx': 'gru', 'activation_func_yyx': 'Tanh', 'L2_weight_yyx': 4.693281478063908e-08, 'L_entropy_weight_yyx': 4.817927932142883e-05, 'L_sep_weight_yyx': 1.935998469917535e-07, 'L_scale_weight_yyx': 1.6707602898433297e-06, 'learning_rate_yyx': 0.008055455482724547}. Best is trial 12 with value: -1.983840502266522.
[I 2026-03-18 20:00:04,204] Trial 49 pruned. 

Source events: 10752
Target events: 10683
Full model ln_yyx : 369.30667 nats/sec, 31.11261 nats/event
Full model Log loss : -1.66285
Full model ln_yyx : 364.17829 nats/sec, 30.68056 nats/event
Full model Log loss : -1.63890
Full model ln_yyx : 369.80975 nats/sec, 31.15499 nats/event
Full model Log loss : -1.66436
Full model ln_yyx : 371.20629 nats/sec, 31.27264 nats/event
Full model Log loss : -1.66566
Full model ln_yyx : 366.67010 nats/sec, 30.89049 nats/event
Full model Log loss : -1.66688
Full model ln_yyx : 367.15372 nats/sec, 30.93123 nats/event
Full model Log loss : -1.66583
Full model ln_yyx : 368.69379 nats/sec, 31.06098 nats/event
Full model Log loss : -1.66814
Full model ln_yyx : 371.12533 nats/sec, 31.26582 nats/event
Full model Log loss : -1.66252
Full model ln_yyx : 372.22919 nats/sec, 31.35882 nats/event
Full model Log loss : -1.66200
Full model ln_yyx : 369.94596 nats/sec, 31.16647 nats/event
Full model Log loss : -1.66459
Full model ln_yyx : 364.87844 nats/sec, 30.73955 nats/event
Full model Log loss : -1.66614
Optimization finished. Config saved to results/opt-full/opt_full_306_best_config.txt
[I 2026-03-18 20:00:04,648] Trial 27 pruned. 
[I 2026-03-18 20:00:07,609] Trial 29 pruned. 
[I 2026-03-18 20:00:09,143] Trial 17 finished with value: -2.5105753043819217 and parameters: {'n_layers_yyx': 2, 'hidden_size_yyx_l0': 6, 'hidden_size_yyx_l1': 2, 'context_size_yyx': 2, 'num_mix_components_yyx': 4, 'context_extractor_yyx': 'gru', 'activation_func_yyx': 'Tanh', 'L2_weight_yyx': 0.0005211754282834041, 'L_entropy_weight_yyx': 1.7873793094715133e-08, 'L_sep_weight_yyx': 0.0009239951697465955, 'L_scale_weight_yyx': 1.0260651469317273e-07, 'learning_rate_yyx': 0.0080222670312965}. Best is trial 0 with value: -2.511745534136428.
[I 2026-03-18 20:00:09,537] Trial 36 pruned. 
[I 2026-03-18 20:00:11,730] Trial 29 pruned. 
[I 2026-03-18 20:00:12,056] Trial 45 pruned. 
[I 2026-03-18 20:00:12,399] Trial 27 pruned. 
[I 2026-03-18 20:00:14,981] Trial 28 pruned. 
[I 2026-03-18 20:00:15,353] Trial 44 finished with value: -1.6938615509167378 and parameters: {'n_layers_yyx': 1, 'hidden_size_yyx_l0': 3, 'context_size_yyx': 4, 'num_mix_components_yyx': 5, 'context_extractor_yyx': 'lstm', 'activation_func_yyx': 'Tanh', 'L2_weight_yyx': 1.841241928955777e-06, 'L_entropy_weight_yyx': 2.3690584731842705e-10, 'L_sep_weight_yyx': 4.567041605413401e-05, 'L_scale_weight_yyx': 3.7832276288079145e-10, 'learning_rate_yyx': 0.006594991422757794}. Best is trial 18 with value: -1.7002973458681911.
[I 2026-03-18 20:00:15,442] Trial 41 finished with value: -1.6780103163785627 and parameters: {'n_layers_yyx': 1, 'hidden_size_yyx_l0': 6, 'context_size_yyx': 4, 'num_mix_components_yyx': 4, 'context_extractor_yyx': 'lstm', 'activation_func_yyx': 'Tanh', 'L2_weight_yyx': 2.9393827876698075e-06, 'L_entropy_weight_yyx': 1.5446217874158637e-10, 'L_sep_weight_yyx': 3.638944719025026e-08, 'L_scale_weight_yyx': 1.3312038244096558e-08, 'learning_rate_yyx': 0.008720329885303425}. Best is trial 41 with value: -1.6780103163785627.
[I 2026-03-18 20:00:15,598] Trial 45 pruned. 
[I 2026-03-18 20:00:16,232] Trial 42 pruned. 
[I 2026-03-18 20:00:18,022] Trial 25 pruned. 
[I 2026-03-18 20:00:20,425] Trial 30 pruned. 
[I 2026-03-18 20:00:23,057] Trial 32 pruned. 
[I 2026-03-18 20:00:23,564] Trial 38 pruned. 
[I 2026-03-18 20:00:23,812] Trial 28 pruned. 
[I 2026-03-18 20:00:24,946] Trial 29 pruned. 
[I 2026-03-18 20:00:26,010] Trial 25 pruned. 
[I 2026-03-18 20:00:27,039] Trial 25 pruned. 
[I 2026-03-18 20:00:30,491] Trial 26 pruned. 
[I 2026-03-18 20:00:31,040] Trial 30 pruned. 
[I 2026-03-18 20:00:34,354] Trial 18 pruned. 
[I 2026-03-18 20:00:35,002] Trial 39 pruned. 
[I 2026-03-18 20:00:35,263] Trial 43 pruned. 
[I 2026-03-18 20:00:35,590] Trial 30 pruned. 
[I 2026-03-18 20:00:35,739] Trial 29 pruned. 
[I 2026-03-18 20:00:38,969] Trial 26 pruned. 
[I 2026-03-18 20:00:41,111] Trial 33 finished with value: -1.6789408898708742 and parameters: {'n_layers_yyx': 2, 'hidden_size_yyx_l0': 4, 'hidden_size_yyx_l1': 5, 'context_size_yyx': 3, 'num_mix_components_yyx': 5, 'context_extractor_yyx': 'lstm', 'activation_func_yyx': 'Tanh', 'L2_weight_yyx': 6.509563797937889e-07, 'L_entropy_weight_yyx': 1.2605746921723617e-08, 'L_sep_weight_yyx': 1.9355862622874992e-10, 'L_scale_weight_yyx': 1.7287130111673037e-07, 'learning_rate_yyx': 0.008282278020127327}. Best is trial 32 with value: -1.6813953661792613.
[I 2026-03-18 20:00:42,205] Trial 49 finished with value: -1.6959769388169765 and parameters: {'n_layers_yyx': 2, 'hidden_size_yyx_l0': 5, 'hidden_size_yyx_l1': 4, 'context_size_yyx': 3, 'num_mix_components_yyx': 2, 'context_extractor_yyx': 'lstm', 'activation_func_yyx': 'GELU', 'L2_weight_yyx': 1.469630130727526e-08, 'L_entropy_weight_yyx': 5.53368302938923e-06, 'L_sep_weight_yyx': 1.7422816652516978e-10, 'L_scale_weight_yyx': 0.00037509022953067134, 'learning_rate_yyx': 0.005892237488251847}. Best is trial 40 with value: -1.718781614615247.

Source events: 10752
Target events: 1783
Full model ln_yyx : 62.63379 nats/sec, 31.61548 nats/event
Full model Log loss : -1.71668
Full model ln_yyx : 63.20535 nats/sec, 31.90399 nats/event
Full model Log loss : -1.71380
Full model ln_yyx : 62.57931 nats/sec, 31.58798 nats/event
Full model Log loss : -1.71647
Full model ln_yyx : 62.42666 nats/sec, 31.51093 nats/event
Full model Log loss : -1.70932
Full model ln_yyx : 61.76714 nats/sec, 31.17803 nats/event
Full model Log loss : -1.69741
Full model ln_yyx : 62.39309 nats/sec, 31.49399 nats/event
Full model Log loss : -1.71815
Full model ln_yyx : 62.10139 nats/sec, 31.34675 nats/event
Full model Log loss : -1.70802
Full model ln_yyx : 61.79302 nats/sec, 31.19109 nats/event
Full model Log loss : -1.71878
Full model ln_yyx : 61.90662 nats/sec, 31.24843 nats/event
Full model Log loss : -1.69598
Optimization finished. Config saved to results/opt-full/opt_full_301_best_config.txt
[I 2026-03-18 20:00:42,567] Trial 25 finished with value: -1.9892947930306837 and parameters: {'n_layers_yyx': 1, 'hidden_size_yyx_l0': 6, 'context_size_yyx': 3, 'num_mix_components_yyx': 1, 'context_extractor_yyx': 'gru', 'activation_func_yyx': 'GELU', 'L2_weight_yyx': 2.4293991628366656e-07, 'L_entropy_weight_yyx': 6.922687846229727e-05, 'L_sep_weight_yyx': 5.1036712555463e-05, 'L_scale_weight_yyx': 4.6571942745495193e-08, 'learning_rate_yyx': 0.00765772524992188}. Best is trial 0 with value: -2.0138799336866504.
[I 2026-03-18 20:00:43,152] Trial 27 pruned. 
[I 2026-03-18 20:00:44,923] Trial 44 pruned. 
[I 2026-03-18 20:00:47,051] Trial 23 pruned. 
[I 2026-03-18 20:00:50,195] Trial 30 pruned. 
[I 2026-03-18 20:00:51,055] Trial 42 finished with value: -1.990559620900197 and parameters: {'n_layers_yyx': 2, 'hidden_size_yyx_l0': 4, 'hidden_size_yyx_l1': 4, 'context_size_yyx': 3, 'num_mix_components_yyx': 5, 'context_extractor_yyx': 'gru', 'activation_func_yyx': 'Tanh', 'L2_weight_yyx': 0.00013019113447827288, 'L_entropy_weight_yyx': 5.087850339042985e-10, 'L_sep_weight_yyx': 1.6362949368230894e-09, 'L_scale_weight_yyx': 2.0691703813276897e-05, 'learning_rate_yyx': 0.0033265659014781917}. Best is trial 15 with value: -1.9940496908651817.
[I 2026-03-18 20:00:53,341] Trial 45 pruned. 
[I 2026-03-18 20:00:59,541] Trial 46 pruned. 
[I 2026-03-18 20:01:00,152] Trial 30 pruned. 
[I 2026-03-18 20:01:02,097] Trial 26 pruned. 
[I 2026-03-18 20:01:03,131] Trial 37 finished with value: -2.112738058322693 and parameters: {'n_layers_yyx': 1, 'hidden_size_yyx_l0': 4, 'context_size_yyx': 2, 'num_mix_components_yyx': 3, 'context_extractor_yyx': 'lstm', 'activation_func_yyx': 'Tanh', 'L2_weight_yyx': 6.695290783922312e-09, 'L_entropy_weight_yyx': 3.157764104973889e-09, 'L_sep_weight_yyx': 3.487484766316754e-09, 'L_scale_weight_yyx': 1.7402802300887995e-06, 'learning_rate_yyx': 0.0021545851698416903}. Best is trial 0 with value: -2.1143376288427875.
[I 2026-03-18 20:01:05,351] Trial 27 finished with value: -2.5131427272325637 and parameters: {'n_layers_yyx': 1, 'hidden_size_yyx_l0': 6, 'context_size_yyx': 4, 'num_mix_components_yyx': 2, 'context_extractor_yyx': 'gru', 'activation_func_yyx': 'GELU', 'L2_weight_yyx': 1.0304553874811585e-05, 'L_entropy_weight_yyx': 2.144974496164754e-05, 'L_sep_weight_yyx': 2.925001540774691e-09, 'L_scale_weight_yyx': 9.430188944606747e-09, 'learning_rate_yyx': 0.007801383451023481}. Best is trial 23 with value: -2.513824905841335.
[I 2026-03-18 20:01:06,095] Trial 31 pruned. 
[I 2026-03-18 20:01:06,172] Trial 43 finished with value: -1.7026804526021162 and parameters: {'n_layers_yyx': 2, 'hidden_size_yyx_l0': 3, 'hidden_size_yyx_l1': 6, 'context_size_yyx': 3, 'num_mix_components_yyx': 1, 'context_extractor_yyx': 'lstm', 'activation_func_yyx': 'GELU', 'L2_weight_yyx': 4.512972309132657e-06, 'L_entropy_weight_yyx': 1.5018088512077625e-09, 'L_sep_weight_yyx': 2.7382613622197047e-09, 'L_scale_weight_yyx': 2.672572941788346e-07, 'learning_rate_yyx': 0.008157429473596727}. Best is trial 5 with value: -1.704671424204909.
[I 2026-03-18 20:01:10,001] Trial 28 pruned. 
[I 2026-03-18 20:01:11,456] Trial 43 pruned. 
[I 2026-03-18 20:01:12,669] Trial 38 pruned. 
[I 2026-03-18 20:01:15,210] Trial 42 finished with value: -1.9804622550799846 and parameters: {'n_layers_yyx': 2, 'hidden_size_yyx_l0': 4, 'hidden_size_yyx_l1': 6, 'context_size_yyx': 3, 'num_mix_components_yyx': 3, 'context_extractor_yyx': 'lstm', 'activation_func_yyx': 'Tanh', 'L2_weight_yyx': 9.173190068644136e-05, 'L_entropy_weight_yyx': 4.578840695337869e-07, 'L_sep_weight_yyx': 3.504523529958565e-10, 'L_scale_weight_yyx': 2.6221731298873413e-08, 'learning_rate_yyx': 0.008258890932827154}. Best is trial 1 with value: -1.9828018961884801.
[I 2026-03-18 20:01:15,400] Trial 33 pruned. 
[I 2026-03-18 20:01:16,068] Trial 47 pruned. 
[I 2026-03-18 20:01:24,594] Trial 48 pruned. 
[I 2026-03-18 20:01:31,707] Trial 39 pruned. 
[I 2026-03-18 20:01:32,810] Trial 26 pruned. 
[I 2026-03-18 20:01:33,082] Trial 26 finished with value: -2.4981356271071826 and parameters: {'n_layers_yyx': 2, 'hidden_size_yyx_l0': 4, 'hidden_size_yyx_l1': 3, 'context_size_yyx': 4, 'num_mix_components_yyx': 5, 'context_extractor_yyx': 'gru', 'activation_func_yyx': 'ReLU', 'L2_weight_yyx': 3.7179893475268584e-07, 'L_entropy_weight_yyx': 4.354450543011073e-07, 'L_sep_weight_yyx': 8.023828850967155e-08, 'L_scale_weight_yyx': 0.00013962758643493232, 'learning_rate_yyx': 0.00574800383914278}. Best is trial 22 with value: -2.5155989726836543.
[I 2026-03-18 20:01:33,103] Trial 31 pruned. 
[I 2026-03-18 20:01:42,861] Trial 49 pruned. 

Source events: 10752
Target events: 20158
Full model ln_yyx : 696.17994 nats/sec, 31.08255 nats/event
Full model Log loss : -1.67611
Full model ln_yyx : 696.33209 nats/sec, 31.08934 nats/event
Full model Log loss : -1.66954
Full model ln_yyx : 698.64643 nats/sec, 31.19267 nats/event
Full model Log loss : -1.67044
Full model ln_yyx : 695.83861 nats/sec, 31.06731 nats/event
Full model Log loss : -1.65043
Full model ln_yyx : 703.67217 nats/sec, 31.41705 nats/event
Full model Log loss : -1.66970
Full model ln_yyx : 695.73056 nats/sec, 31.06248 nats/event
Full model Log loss : -1.67892
Full model ln_yyx : 698.32252 nats/sec, 31.17821 nats/event
Full model Log loss : -1.67780
Full model ln_yyx : 700.81029 nats/sec, 31.28928 nats/event
Full model Log loss : -1.67481
Full model ln_yyx : 696.21296 nats/sec, 31.08402 nats/event
Full model Log loss : -1.67843
Full model ln_yyx : 695.89126 nats/sec, 31.06966 nats/event
Full model Log loss : -1.67116
Full model ln_yyx : 699.44224 nats/sec, 31.22820 nats/event
Full model Log loss : -1.67063
Full model ln_yyx : 699.98528 nats/sec, 31.25244 nats/event
Full model Log loss : -1.67491
Full model ln_yyx : 695.67244 nats/sec, 31.05989 nats/event
Full model Log loss : -1.67026
Optimization finished. Config saved to results/opt-full/opt_full_309_best_config.txt
[I 2026-03-18 20:01:47,545] Trial 44 pruned. 
[I 2026-03-18 20:01:47,751] Trial 31 finished with value: -2.0349688425711574 and parameters: {'n_layers_yyx': 1, 'hidden_size_yyx_l0': 6, 'context_size_yyx': 4, 'num_mix_components_yyx': 5, 'context_extractor_yyx': 'lstm', 'activation_func_yyx': 'ReLU', 'L2_weight_yyx': 1.1961986807834319e-08, 'L_entropy_weight_yyx': 1.1234426386150882e-08, 'L_sep_weight_yyx': 6.454639647386851e-08, 'L_scale_weight_yyx': 2.9782622828500502e-09, 'learning_rate_yyx': 0.009850091017662571}. Best is trial 8 with value: -2.0365283470022115.
[I 2026-03-18 20:01:48,104] Trial 46 finished with value: -1.7228210905840866 and parameters: {'n_layers_yyx': 1, 'hidden_size_yyx_l0': 5, 'context_size_yyx': 4, 'num_mix_components_yyx': 4, 'context_extractor_yyx': 'lstm', 'activation_func_yyx': 'ReLU', 'L2_weight_yyx': 1.4402049864872335e-06, 'L_entropy_weight_yyx': 2.6396057968744682e-08, 'L_sep_weight_yyx': 0.00022986021513851827, 'L_scale_weight_yyx': 1.376307223311058e-06, 'learning_rate_yyx': 0.0038222373905051964}. Best is trial 41 with value: -1.730878583570371.
[I 2026-03-18 20:01:59,615] Trial 42 finished with value: -1.6806136813660988 and parameters: {'n_layers_yyx': 1, 'hidden_size_yyx_l0': 6, 'context_size_yyx': 4, 'num_mix_components_yyx': 4, 'context_extractor_yyx': 'lstm', 'activation_func_yyx': 'Tanh', 'L2_weight_yyx': 7.464385898295198e-05, 'L_entropy_weight_yyx': 2.5881456909228927e-10, 'L_sep_weight_yyx': 3.511093438865295e-08, 'L_scale_weight_yyx': 3.825739685375544e-08, 'learning_rate_yyx': 0.006110086122117631}. Best is trial 42 with value: -1.6806136813660988.
[I 2026-03-18 20:02:10,371] Trial 27 pruned. 
[I 2026-03-18 20:02:16,410] Trial 34 finished with value: -1.6791607271530833 and parameters: {'n_layers_yyx': 2, 'hidden_size_yyx_l0': 4, 'hidden_size_yyx_l1': 6, 'context_size_yyx': 4, 'num_mix_components_yyx': 5, 'context_extractor_yyx': 'lstm', 'activation_func_yyx': 'Tanh', 'L2_weight_yyx': 5.835263595079108e-07, 'L_entropy_weight_yyx': 9.96293887600791e-09, 'L_sep_weight_yyx': 1.8215719690572092e-10, 'L_scale_weight_yyx': 2.8711628262768726e-07, 'learning_rate_yyx': 0.007779220473305807}. Best is trial 32 with value: -1.6813953661792613.
[I 2026-03-18 20:02:30,698] Trial 17 finished with value: -2.514835052058789 and parameters: {'n_layers_yyx': 1, 'hidden_size_yyx_l0': 6, 'context_size_yyx': 1, 'num_mix_components_yyx': 4, 'context_extractor_yyx': 'lstm', 'activation_func_yyx': 'ReLU', 'L2_weight_yyx': 2.4385176644279037e-08, 'L_entropy_weight_yyx': 3.86918733566588e-10, 'L_sep_weight_yyx': 1.3636213762638518e-06, 'L_scale_weight_yyx': 1.4002170178700633e-08, 'learning_rate_yyx': 0.0094905359431356}. Best is trial 12 with value: -2.51518345292619.
[I 2026-03-18 20:02:39,475] Trial 44 pruned. 
[I 2026-03-18 20:02:46,660] Trial 34 pruned. 
[I 2026-03-18 20:02:47,950] Trial 28 pruned. 
[I 2026-03-18 20:02:48,357] Trial 47 pruned. 
[I 2026-03-18 20:02:54,878] Trial 32 finished with value: -1.67279859301793 and parameters: {'n_layers_yyx': 2, 'hidden_size_yyx_l0': 4, 'hidden_size_yyx_l1': 5, 'context_size_yyx': 4, 'num_mix_components_yyx': 4, 'context_extractor_yyx': 'gru', 'activation_func_yyx': 'Tanh', 'L2_weight_yyx': 4.304115349610283e-08, 'L_entropy_weight_yyx': 6.72021260875324e-10, 'L_sep_weight_yyx': 8.555666861588806e-05, 'L_scale_weight_yyx': 2.404144974503656e-06, 'learning_rate_yyx': 0.008125436575215136}. Best is trial 15 with value: -1.6819845856754096.
[I 2026-03-18 20:02:57,813] Trial 38 finished with value: -1.6706270238976246 and parameters: {'n_layers_yyx': 2, 'hidden_size_yyx_l0': 5, 'hidden_size_yyx_l1': 2, 'context_size_yyx': 3, 'num_mix_components_yyx': 2, 'context_extractor_yyx': 'gru', 'activation_func_yyx': 'Tanh', 'L2_weight_yyx': 1.584203571983725e-09, 'L_entropy_weight_yyx': 2.3188600996447028e-09, 'L_sep_weight_yyx': 2.1498028572431883e-09, 'L_scale_weight_yyx': 5.285733401240968e-07, 'learning_rate_yyx': 0.007090123507703584}. Best is trial 12 with value: -1.6796893990996478.
[I 2026-03-18 20:02:59,570] Trial 48 pruned. 
[I 2026-03-18 20:03:05,035] Trial 45 pruned. 
[I 2026-03-18 20:03:17,936] Trial 40 pruned. 
[I 2026-03-18 20:03:23,830] Trial 39 pruned. 
[I 2026-03-18 20:03:29,678] Trial 40 finished with value: -2.5419648710664338 and parameters: {'n_layers_yyx': 2, 'hidden_size_yyx_l0': 4, 'hidden_size_yyx_l1': 6, 'context_size_yyx': 3, 'num_mix_components_yyx': 1, 'context_extractor_yyx': 'lstm', 'activation_func_yyx': 'ReLU', 'L2_weight_yyx': 2.0423088386192334e-10, 'L_entropy_weight_yyx': 8.781525563786463e-08, 'L_sep_weight_yyx': 1.7637895400182775e-05, 'L_scale_weight_yyx': 1.301953195525265e-10, 'learning_rate_yyx': 0.0075985197595287305}. Best is trial 16 with value: -2.5482089436137594.
[I 2026-03-18 20:03:30,768] Trial 49 pruned. 

Source events: 10752
Target events: 3618
Full model ln_yyx : 126.28494 nats/sec, 31.41416 nats/event
Full model Log loss : -1.72818
Full model ln_yyx : 125.00601 nats/sec, 31.09602 nats/event
Full model Log loss : -1.71241
Full model ln_yyx : 126.01664 nats/sec, 31.34742 nats/event
Full model Log loss : -1.72949
Full model ln_yyx : 125.36381 nats/sec, 31.18503 nats/event
Full model Log loss : -1.71030
Full model ln_yyx : 126.87069 nats/sec, 31.55987 nats/event
Full model Log loss : -1.72087
Full model ln_yyx : 127.20438 nats/sec, 31.64288 nats/event
Full model Log loss : -1.72761
Full model ln_yyx : 127.70523 nats/sec, 31.76747 nats/event
Full model Log loss : -1.72675
Full model ln_yyx : 126.36842 nats/sec, 31.43493 nats/event
Full model Log loss : -1.72664
Full model ln_yyx : 126.19843 nats/sec, 31.39265 nats/event
Full model Log loss : -1.72540
Full model ln_yyx : 126.32739 nats/sec, 31.42472 nats/event
Full model Log loss : -1.73088
Full model ln_yyx : 127.45711 nats/sec, 31.70575 nats/event
Full model Log loss : -1.72282
Optimization finished. Config saved to results/opt-full/opt_full_311_best_config.txt
[I 2026-03-18 20:03:32,862] Trial 35 pruned. 
[I 2026-03-18 20:03:35,113] Trial 45 pruned. 
[I 2026-03-18 20:03:39,508] Trial 46 pruned. 
[I 2026-03-18 20:03:42,605] Trial 32 pruned. 
[I 2026-03-18 20:03:42,623] Trial 27 pruned. 
