[I 2026-03-18 18:52:27,256] Trial 1 finished with value: -1.7684712210476057 and parameters: {'n_layers_yyx': 2, 'hidden_size_yyx_l0': 3, 'hidden_size_yyx_l1': 4, 'context_size_yyx': 2, 'num_mix_components_yyx': 2, 'context_extractor_yyx': 'lstm', 'activation_func_yyx': 'Tanh', 'L2_weight_yyx': 4.414998886681942e-07, 'L_entropy_weight_yyx': 4.710251618922085e-07, 'L_sep_weight_yyx': 1.1818722670381073e-05, 'L_scale_weight_yyx': 8.36957269109815e-08, 'learning_rate_yyx': 0.001532434214828351}. Best is trial 1 with value: -1.7684712210476057.
[I 2026-03-18 18:52:39,360] Trial 4 finished with value: -2.26804572750918 and parameters: {'n_layers_yyx': 2, 'hidden_size_yyx_l0': 3, 'hidden_size_yyx_l1': 6, 'context_size_yyx': 3, 'num_mix_components_yyx': 3, 'context_extractor_yyx': 'lstm', 'activation_func_yyx': 'GELU', 'L2_weight_yyx': 3.59851877192242e-07, 'L_entropy_weight_yyx': 1.5095871854447534e-06, 'L_sep_weight_yyx': 1.62170568907414e-10, 'L_scale_weight_yyx': 2.553215419488403e-07, 'learning_rate_yyx': 0.0031726697078270725}. Best is trial 1 with value: -2.2881647079635865.
[I 2026-03-18 18:53:08,910] Trial 2 finished with value: -0.8277896221842689 and parameters: {'n_layers_yyx': 1, 'hidden_size_yyx_l0': 3, 'context_size_yyx': 4, 'num_mix_components_yyx': 3, 'context_extractor_yyx': 'gru', 'activation_func_yyx': 'Tanh', 'L2_weight_yyx': 7.023959473859375e-06, 'L_entropy_weight_yyx': 2.6916358731583365e-10, 'L_sep_weight_yyx': 8.53936230947891e-05, 'L_scale_weight_yyx': 2.5869057563277892e-08, 'learning_rate_yyx': 0.0021373112279671302}. Best is trial 2 with value: -0.8277896221842689.
[I 2026-03-18 18:53:14,824] Trial 1 finished with value: -2.263337522483249 and parameters: {'n_layers_yyx': 2, 'hidden_size_yyx_l0': 3, 'hidden_size_yyx_l1': 6, 'context_size_yyx': 3, 'num_mix_components_yyx': 2, 'context_extractor_yyx': 'gru', 'activation_func_yyx': 'GELU', 'L2_weight_yyx': 1.087908699572964e-09, 'L_entropy_weight_yyx': 1.9418471133523376e-09, 'L_sep_weight_yyx': 5.978774460310828e-05, 'L_scale_weight_yyx': 1.254859096145122e-09, 'learning_rate_yyx': 0.0011331685045969171}. Best is trial 1 with value: -2.263337522483249.
[I 2026-03-18 18:53:17,292] Trial 2 finished with value: -2.2540069113356407 and parameters: {'n_layers_yyx': 1, 'hidden_size_yyx_l0': 3, 'context_size_yyx': 3, 'num_mix_components_yyx': 1, 'context_extractor_yyx': 'gru', 'activation_func_yyx': 'GELU', 'L2_weight_yyx': 1.9746772654103554e-07, 'L_entropy_weight_yyx': 1.5032095393344908e-09, 'L_sep_weight_yyx': 5.0592897827228125e-08, 'L_scale_weight_yyx': 3.9756769200961446e-10, 'learning_rate_yyx': 0.006198742161627242}. Best is trial 1 with value: -2.272496318017313.
[I 2026-03-18 18:53:19,588] Trial 7 pruned. 
[I 2026-03-18 18:53:21,732] Trial 3 pruned. 
[I 2026-03-18 18:53:31,645] Trial 2 pruned. 
[I 2026-03-18 18:53:32,179] Trial 9 finished with value: -0.8084891923597327 and parameters: {'n_layers_yyx': 2, 'hidden_size_yyx_l0': 5, 'hidden_size_yyx_l1': 2, 'context_size_yyx': 2, 'num_mix_components_yyx': 2, 'context_extractor_yyx': 'lstm', 'activation_func_yyx': 'Tanh', 'L2_weight_yyx': 3.585867968379855e-06, 'L_entropy_weight_yyx': 0.0009512556474766986, 'L_sep_weight_yyx': 0.000219880244446047, 'L_scale_weight_yyx': 2.411573120846497e-05, 'learning_rate_yyx': 0.0009507615383506298}. Best is trial 2 with value: -0.8228697107672868.
[I 2026-03-18 18:53:33,773] Trial 8 pruned. 
[I 2026-03-18 18:53:34,095] Trial 4 finished with value: -1.7775746924677662 and parameters: {'n_layers_yyx': 2, 'hidden_size_yyx_l0': 4, 'hidden_size_yyx_l1': 5, 'context_size_yyx': 1, 'num_mix_components_yyx': 1, 'context_extractor_yyx': 'lstm', 'activation_func_yyx': 'GELU', 'L2_weight_yyx': 1.3882957974663488e-09, 'L_entropy_weight_yyx': 0.0005058483851441155, 'L_sep_weight_yyx': 1.4178603832590802e-05, 'L_scale_weight_yyx': 0.00032613225923451485, 'learning_rate_yyx': 0.002213474134080905}. Best is trial 4 with value: -1.7775746924677662.
[I 2026-03-18 18:53:35,741] Trial 4 pruned. 
[I 2026-03-18 18:53:44,683] Trial 5 finished with value: -0.820425554779819 and parameters: {'n_layers_yyx': 1, 'hidden_size_yyx_l0': 6, 'context_size_yyx': 3, 'num_mix_components_yyx': 4, 'context_extractor_yyx': 'lstm', 'activation_func_yyx': 'GELU', 'L2_weight_yyx': 0.000827340386559842, 'L_entropy_weight_yyx': 5.729376046600545e-06, 'L_sep_weight_yyx': 1.3127577900901847e-08, 'L_scale_weight_yyx': 0.000813695913606063, 'learning_rate_yyx': 0.005379892111857575}. Best is trial 1 with value: -0.8328681168211087.
[I 2026-03-18 18:53:47,009] Trial 9 pruned. 
[I 2026-03-18 18:53:47,265] Trial 3 pruned. 
[I 2026-03-18 18:53:49,332] Trial 4 finished with value: -0.8099708050005193 and parameters: {'n_layers_yyx': 2, 'hidden_size_yyx_l0': 6, 'hidden_size_yyx_l1': 2, 'context_size_yyx': 3, 'num_mix_components_yyx': 5, 'context_extractor_yyx': 'lstm', 'activation_func_yyx': 'ReLU', 'L2_weight_yyx': 2.350812106266202e-07, 'L_entropy_weight_yyx': 0.0005676595015690948, 'L_sep_weight_yyx': 6.792572062625937e-05, 'L_scale_weight_yyx': 2.6753069375187434e-07, 'learning_rate_yyx': 0.0015418369783770237}. Best is trial 0 with value: -0.8324342893885016.
[I 2026-03-18 18:53:50,423] Trial 3 finished with value: -0.8053986001402096 and parameters: {'n_layers_yyx': 1, 'hidden_size_yyx_l0': 6, 'context_size_yyx': 4, 'num_mix_components_yyx': 2, 'context_extractor_yyx': 'lstm', 'activation_func_yyx': 'GELU', 'L2_weight_yyx': 3.1175944814060264e-07, 'L_entropy_weight_yyx': 4.111698254097029e-07, 'L_sep_weight_yyx': 1.700383205809427e-07, 'L_scale_weight_yyx': 7.892326580632067e-05, 'learning_rate_yyx': 0.001343972342710232}. Best is trial 2 with value: -0.8370103483890325.
[I 2026-03-18 18:53:52,224] Trial 3 finished with value: -0.8070720182387833 and parameters: {'n_layers_yyx': 1, 'hidden_size_yyx_l0': 4, 'context_size_yyx': 2, 'num_mix_components_yyx': 1, 'context_extractor_yyx': 'lstm', 'activation_func_yyx': 'Tanh', 'L2_weight_yyx': 2.7952184422464394e-10, 'L_entropy_weight_yyx': 2.0079334284606827e-05, 'L_sep_weight_yyx': 3.81123950197074e-08, 'L_scale_weight_yyx': 3.896160766172556e-08, 'learning_rate_yyx': 0.004768184911763194}. Best is trial 1 with value: -0.8100041624714388.
[I 2026-03-18 18:53:53,922] Trial 6 pruned. 
[I 2026-03-18 18:53:55,832] Trial 10 pruned. 
[I 2026-03-18 18:53:57,598] Trial 4 pruned. 
[I 2026-03-18 18:53:59,250] Trial 3 finished with value: -2.270069106439336 and parameters: {'n_layers_yyx': 1, 'hidden_size_yyx_l0': 5, 'context_size_yyx': 1, 'num_mix_components_yyx': 4, 'context_extractor_yyx': 'lstm', 'activation_func_yyx': 'Tanh', 'L2_weight_yyx': 5.8294500405330885e-06, 'L_entropy_weight_yyx': 1.4322532677773912e-07, 'L_sep_weight_yyx': 4.527930457053271e-07, 'L_scale_weight_yyx': 3.841642794216256e-08, 'learning_rate_yyx': 0.004533652825179772}. Best is trial 2 with value: -2.279533784042228.
[I 2026-03-18 18:54:03,942] Trial 7 pruned. 
[I 2026-03-18 18:54:04,823] Trial 2 finished with value: -2.268943519545594 and parameters: {'n_layers_yyx': 1, 'hidden_size_yyx_l0': 3, 'context_size_yyx': 4, 'num_mix_components_yyx': 1, 'context_extractor_yyx': 'lstm', 'activation_func_yyx': 'GELU', 'L2_weight_yyx': 8.745034065175999e-06, 'L_entropy_weight_yyx': 0.0004166938139294309, 'L_sep_weight_yyx': 6.53620550875982e-06, 'L_scale_weight_yyx': 9.044985742093227e-10, 'learning_rate_yyx': 0.0011748849243684255}. Best is trial 0 with value: -2.277465192778458.
[I 2026-03-18 18:54:05,519] Trial 4 finished with value: -1.7807932306351817 and parameters: {'n_layers_yyx': 2, 'hidden_size_yyx_l0': 3, 'hidden_size_yyx_l1': 4, 'context_size_yyx': 2, 'num_mix_components_yyx': 1, 'context_extractor_yyx': 'lstm', 'activation_func_yyx': 'GELU', 'L2_weight_yyx': 1.756961186103285e-05, 'L_entropy_weight_yyx': 1.6976576358408099e-09, 'L_sep_weight_yyx': 5.6003487069492825e-09, 'L_scale_weight_yyx': 1.8876336474961514e-08, 'learning_rate_yyx': 0.008192727456374565}. Best is trial 4 with value: -1.7807932306351817.
[I 2026-03-18 18:54:09,590] Trial 8 pruned. 
[I 2026-03-18 18:54:09,833] Trial 4 pruned. 
[I 2026-03-18 18:54:09,927] Trial 2 finished with value: -1.7379298847752385 and parameters: {'n_layers_yyx': 2, 'hidden_size_yyx_l0': 3, 'hidden_size_yyx_l1': 6, 'context_size_yyx': 4, 'num_mix_components_yyx': 2, 'context_extractor_yyx': 'gru', 'activation_func_yyx': 'GELU', 'L2_weight_yyx': 0.00033302853248283254, 'L_entropy_weight_yyx': 1.262520353632679e-10, 'L_sep_weight_yyx': 6.212459127683877e-07, 'L_scale_weight_yyx': 0.00013387646008051145, 'learning_rate_yyx': 0.005756267668664901}. Best is trial 1 with value: -1.7684712210476057.
[I 2026-03-18 18:54:13,112] Trial 3 finished with value: -2.1901279149118276 and parameters: {'n_layers_yyx': 1, 'hidden_size_yyx_l0': 5, 'context_size_yyx': 4, 'num_mix_components_yyx': 1, 'context_extractor_yyx': 'gru', 'activation_func_yyx': 'Tanh', 'L2_weight_yyx': 4.1265290654672895e-05, 'L_entropy_weight_yyx': 4.0129141202826e-10, 'L_sep_weight_yyx': 4.3353174063955687e-10, 'L_scale_weight_yyx': 2.449847732161154e-09, 'learning_rate_yyx': 0.004565678066374582}. Best is trial 2 with value: -2.2083321590322043.
[I 2026-03-18 18:54:14,408] Trial 3 pruned. 
[I 2026-03-18 18:54:19,891] Trial 3 finished with value: -0.8016466960597074 and parameters: {'n_layers_yyx': 2, 'hidden_size_yyx_l0': 2, 'hidden_size_yyx_l1': 2, 'context_size_yyx': 3, 'num_mix_components_yyx': 4, 'context_extractor_yyx': 'lstm', 'activation_func_yyx': 'GELU', 'L2_weight_yyx': 3.4958629382643656e-09, 'L_entropy_weight_yyx': 5.164679048499416e-10, 'L_sep_weight_yyx': 0.00027331614757691945, 'L_scale_weight_yyx': 0.0006217483941710571, 'learning_rate_yyx': 0.0012490721363946043}. Best is trial 1 with value: -0.8348051941729366.
[I 2026-03-18 18:54:23,411] Trial 9 pruned. 
[I 2026-03-18 18:54:23,756] Trial 5 pruned. 
[I 2026-03-18 18:54:27,384] Trial 3 pruned. 
[I 2026-03-18 18:54:29,042] Trial 10 finished with value: -0.8899790750986811 and parameters: {'n_layers_yyx': 1, 'hidden_size_yyx_l0': 3, 'context_size_yyx': 2, 'num_mix_components_yyx': 1, 'context_extractor_yyx': 'gru', 'activation_func_yyx': 'ReLU', 'L2_weight_yyx': 0.0005441897190942072, 'L_entropy_weight_yyx': 0.0009009208926387556, 'L_sep_weight_yyx': 0.00046571138758039914, 'L_scale_weight_yyx': 2.037885813916345e-10, 'learning_rate_yyx': 0.009181302083696729}. Best is trial 0 with value: -0.9147985592774902.
[I 2026-03-18 18:54:29,371] Trial 5 pruned. 
[I 2026-03-18 18:54:29,840] Trial 3 finished with value: -0.8320290186556615 and parameters: {'n_layers_yyx': 1, 'hidden_size_yyx_l0': 4, 'context_size_yyx': 2, 'num_mix_components_yyx': 3, 'context_extractor_yyx': 'gru', 'activation_func_yyx': 'GELU', 'L2_weight_yyx': 0.0005997953422265589, 'L_entropy_weight_yyx': 9.47915316629469e-07, 'L_sep_weight_yyx': 2.3729678968312924e-05, 'L_scale_weight_yyx': 5.994013990527945e-08, 'learning_rate_yyx': 0.0076126420632286985}. Best is trial 3 with value: -0.8320290186556615.
[I 2026-03-18 18:54:35,446] Trial 4 pruned. 
[I 2026-03-18 18:54:36,550] Trial 11 pruned. 
[I 2026-03-18 18:54:44,283] Trial 2 finished with value: -1.7858329634232954 and parameters: {'n_layers_yyx': 1, 'hidden_size_yyx_l0': 6, 'context_size_yyx': 1, 'num_mix_components_yyx': 4, 'context_extractor_yyx': 'gru', 'activation_func_yyx': 'GELU', 'L2_weight_yyx': 3.075898647564434e-08, 'L_entropy_weight_yyx': 5.388547604257424e-09, 'L_sep_weight_yyx': 5.2452711350608035e-05, 'L_scale_weight_yyx': 0.00014568037134375, 'learning_rate_yyx': 0.001994697714856468}. Best is trial 2 with value: -1.7858329634232954.
[I 2026-03-18 18:54:45,420] Trial 4 finished with value: -0.7510887946124619 and parameters: {'n_layers_yyx': 1, 'hidden_size_yyx_l0': 2, 'context_size_yyx': 2, 'num_mix_components_yyx': 5, 'context_extractor_yyx': 'gru', 'activation_func_yyx': 'Tanh', 'L2_weight_yyx': 5.044196888475559e-08, 'L_entropy_weight_yyx': 2.908226896056634e-07, 'L_sep_weight_yyx': 3.762318527179292e-06, 'L_scale_weight_yyx': 2.6004930746705304e-07, 'learning_rate_yyx': 0.0005681359728824342}. Best is trial 1 with value: -0.8235284532014517.
[I 2026-03-18 18:54:46,396] Trial 5 finished with value: -0.8122090687603859 and parameters: {'n_layers_yyx': 1, 'hidden_size_yyx_l0': 6, 'context_size_yyx': 4, 'num_mix_components_yyx': 3, 'context_extractor_yyx': 'gru', 'activation_func_yyx': 'Tanh', 'L2_weight_yyx': 0.0005950309380652647, 'L_entropy_weight_yyx': 2.336446091923177e-10, 'L_sep_weight_yyx': 0.0002846078356142717, 'L_scale_weight_yyx': 1.7071950655050846e-07, 'learning_rate_yyx': 0.005691327432873589}. Best is trial 2 with value: -0.8277896221842689.
[I 2026-03-18 18:54:48,688] Trial 5 pruned. 
[I 2026-03-18 18:54:49,113] Trial 2 finished with value: -2.280124353341111 and parameters: {'n_layers_yyx': 1, 'hidden_size_yyx_l0': 5, 'context_size_yyx': 3, 'num_mix_components_yyx': 4, 'context_extractor_yyx': 'lstm', 'activation_func_yyx': 'ReLU', 'L2_weight_yyx': 1.752812608629562e-05, 'L_entropy_weight_yyx': 4.125050485660084e-05, 'L_sep_weight_yyx': 1.0983300428110373e-06, 'L_scale_weight_yyx': 1.5048782264723754e-10, 'learning_rate_yyx': 0.000645317904663234}. Best is trial 1 with value: -2.2840327548863986.
[I 2026-03-18 18:54:51,069] Trial 4 pruned. 
[I 2026-03-18 18:54:51,753] Trial 3 finished with value: -2.2693473526430537 and parameters: {'n_layers_yyx': 2, 'hidden_size_yyx_l0': 6, 'hidden_size_yyx_l1': 6, 'context_size_yyx': 1, 'num_mix_components_yyx': 2, 'context_extractor_yyx': 'gru', 'activation_func_yyx': 'Tanh', 'L2_weight_yyx': 1.7076814726352479e-09, 'L_entropy_weight_yyx': 5.073889263644236e-10, 'L_sep_weight_yyx': 9.309091653027353e-10, 'L_scale_weight_yyx': 5.620283215248669e-07, 'learning_rate_yyx': 0.007333743300009575}. Best is trial 1 with value: -2.2866954714752907.
[I 2026-03-18 18:54:52,617] Trial 6 pruned. 
[I 2026-03-18 18:54:52,632] Trial 8 finished with value: -0.8257869568321871 and parameters: {'n_layers_yyx': 2, 'hidden_size_yyx_l0': 3, 'hidden_size_yyx_l1': 6, 'context_size_yyx': 3, 'num_mix_components_yyx': 2, 'context_extractor_yyx': 'gru', 'activation_func_yyx': 'Tanh', 'L2_weight_yyx': 2.2853823344818104e-06, 'L_entropy_weight_yyx': 2.2925815978013846e-06, 'L_sep_weight_yyx': 1.6413903772379226e-07, 'L_scale_weight_yyx': 8.336108513906298e-10, 'learning_rate_yyx': 0.000876817345166404}. Best is trial 8 with value: -0.8257869568321871.
[I 2026-03-18 18:54:52,691] Trial 4 finished with value: -1.784507205847538 and parameters: {'n_layers_yyx': 2, 'hidden_size_yyx_l0': 2, 'hidden_size_yyx_l1': 6, 'context_size_yyx': 1, 'num_mix_components_yyx': 2, 'context_extractor_yyx': 'lstm', 'activation_func_yyx': 'GELU', 'L2_weight_yyx': 0.00039914243618279914, 'L_entropy_weight_yyx': 3.938621064323191e-06, 'L_sep_weight_yyx': 7.641531978448734e-05, 'L_scale_weight_yyx': 4.049633913434989e-10, 'learning_rate_yyx': 0.003751072046529035}. Best is trial 4 with value: -1.784507205847538.
[I 2026-03-18 18:54:52,716] Trial 5 finished with value: -2.276108344648868 and parameters: {'n_layers_yyx': 2, 'hidden_size_yyx_l0': 2, 'hidden_size_yyx_l1': 2, 'context_size_yyx': 3, 'num_mix_components_yyx': 5, 'context_extractor_yyx': 'lstm', 'activation_func_yyx': 'ReLU', 'L2_weight_yyx': 5.376800192883444e-06, 'L_entropy_weight_yyx': 2.639580247667766e-05, 'L_sep_weight_yyx': 5.433588409289373e-06, 'L_scale_weight_yyx': 1.001531951999469e-06, 'learning_rate_yyx': 0.0034830842195429238}. Best is trial 5 with value: -2.276108344648868.
[I 2026-03-18 18:54:53,987] Trial 6 pruned. 
[I 2026-03-18 18:54:55,226] Trial 10 pruned. 
[I 2026-03-18 18:54:55,845] Trial 5 pruned. 
[I 2026-03-18 18:54:58,420] Trial 3 pruned. 
[I 2026-03-18 18:54:58,869] Trial 5 pruned. 
[I 2026-03-18 18:54:59,780] Trial 3 pruned. 
[I 2026-03-18 18:55:00,765] Trial 5 pruned. 
[I 2026-03-18 18:55:01,625] Trial 11 finished with value: -0.8127992029908488 and parameters: {'n_layers_yyx': 2, 'hidden_size_yyx_l0': 5, 'hidden_size_yyx_l1': 6, 'context_size_yyx': 4, 'num_mix_components_yyx': 1, 'context_extractor_yyx': 'gru', 'activation_func_yyx': 'GELU', 'L2_weight_yyx': 2.9103059101163212e-05, 'L_entropy_weight_yyx': 2.7730027998382976e-06, 'L_sep_weight_yyx': 1.786237516313257e-06, 'L_scale_weight_yyx': 2.2806319575146776e-05, 'learning_rate_yyx': 0.006416853642826166}. Best is trial 0 with value: -0.8279563193835395.
[I 2026-03-18 18:55:02,401] Trial 6 pruned. 
[I 2026-03-18 18:55:04,204] Trial 7 pruned. 
[I 2026-03-18 18:55:06,953] Trial 7 pruned. 
[I 2026-03-18 18:55:07,472] Trial 11 pruned. 
[I 2026-03-18 18:55:07,853] Trial 4 finished with value: -1.8640294358303218 and parameters: {'n_layers_yyx': 2, 'hidden_size_yyx_l0': 3, 'hidden_size_yyx_l1': 4, 'context_size_yyx': 2, 'num_mix_components_yyx': 2, 'context_extractor_yyx': 'gru', 'activation_func_yyx': 'Tanh', 'L2_weight_yyx': 7.286773224223711e-07, 'L_entropy_weight_yyx': 1.3442483334170554e-06, 'L_sep_weight_yyx': 1.4428113969391114e-06, 'L_scale_weight_yyx': 1.292335933403873e-09, 'learning_rate_yyx': 0.005626856930556301}. Best is trial 4 with value: -1.8640294358303218.
[I 2026-03-18 18:55:08,107] Trial 4 pruned. 
[I 2026-03-18 18:55:08,699] Trial 6 pruned. 
[I 2026-03-18 18:55:08,877] Trial 12 pruned. 
[I 2026-03-18 18:55:09,168] Trial 10 pruned. 
[I 2026-03-18 18:55:10,554] Trial 5 finished with value: -2.263271448515912 and parameters: {'n_layers_yyx': 2, 'hidden_size_yyx_l0': 6, 'hidden_size_yyx_l1': 4, 'context_size_yyx': 3, 'num_mix_components_yyx': 2, 'context_extractor_yyx': 'gru', 'activation_func_yyx': 'ReLU', 'L2_weight_yyx': 1.2548853804222729e-08, 'L_entropy_weight_yyx': 1.309905053546566e-10, 'L_sep_weight_yyx': 3.5307998657188927e-10, 'L_scale_weight_yyx': 1.3504696920416175e-09, 'learning_rate_yyx': 0.0018594381711412894}. Best is trial 1 with value: -2.2881647079635865.
[I 2026-03-18 18:55:12,259] Trial 7 pruned. 
[I 2026-03-18 18:55:12,792] Trial 5 finished with value: -0.820909981889598 and parameters: {'n_layers_yyx': 1, 'hidden_size_yyx_l0': 2, 'context_size_yyx': 4, 'num_mix_components_yyx': 5, 'context_extractor_yyx': 'gru', 'activation_func_yyx': 'Tanh', 'L2_weight_yyx': 1.6838076102438405e-09, 'L_entropy_weight_yyx': 1.284359272004507e-07, 'L_sep_weight_yyx': 7.192890055408558e-10, 'L_scale_weight_yyx': 1.759265849061295e-10, 'learning_rate_yyx': 0.008127050328814056}. Best is trial 2 with value: -0.8370103483890325.
[I 2026-03-18 18:55:13,724] Trial 8 pruned. 
[I 2026-03-18 18:55:13,873] Trial 12 pruned. 
[I 2026-03-18 18:55:16,176] Trial 6 pruned. 
[I 2026-03-18 18:55:16,652] Trial 13 pruned. 
[I 2026-03-18 18:55:20,264] Trial 9 pruned. 
[I 2026-03-18 18:55:20,632] Trial 13 pruned. 
[I 2026-03-18 18:55:20,942] Trial 6 pruned. 
[I 2026-03-18 18:55:21,130] Trial 9 pruned. 
[I 2026-03-18 18:55:21,515] Trial 5 pruned. 
[I 2026-03-18 18:55:23,448] Trial 14 pruned. 
[I 2026-03-18 18:55:24,310] Trial 5 pruned. 
[I 2026-03-18 18:55:25,604] Trial 6 pruned. 
[I 2026-03-18 18:55:27,175] Trial 10 pruned. 
[I 2026-03-18 18:55:28,009] Trial 14 pruned. 
[I 2026-03-18 18:55:28,343] Trial 6 pruned. 
[I 2026-03-18 18:55:30,166] Trial 15 pruned. 
[I 2026-03-18 18:55:34,132] Trial 3 finished with value: -2.2670862148017044 and parameters: {'n_layers_yyx': 2, 'hidden_size_yyx_l0': 5, 'hidden_size_yyx_l1': 4, 'context_size_yyx': 3, 'num_mix_components_yyx': 3, 'context_extractor_yyx': 'lstm', 'activation_func_yyx': 'ReLU', 'L2_weight_yyx': 5.751274413536946e-07, 'L_entropy_weight_yyx': 1.1662582140225298e-06, 'L_sep_weight_yyx': 6.36879167517802e-08, 'L_scale_weight_yyx': 2.3599526088762906e-09, 'learning_rate_yyx': 0.0015543455064584736}. Best is trial 2 with value: -2.272224617884258.
[I 2026-03-18 18:55:34,512] Trial 15 pruned. 
[I 2026-03-18 18:55:39,543] Trial 7 pruned. 
[I 2026-03-18 18:55:41,226] Trial 11 pruned. 
[I 2026-03-18 18:55:43,462] Trial 16 pruned. 
[I 2026-03-18 18:55:46,065] Trial 5 finished with value: -2.2612506635432053 and parameters: {'n_layers_yyx': 1, 'hidden_size_yyx_l0': 4, 'context_size_yyx': 2, 'num_mix_components_yyx': 3, 'context_extractor_yyx': 'gru', 'activation_func_yyx': 'GELU', 'L2_weight_yyx': 3.3210758840284507e-07, 'L_entropy_weight_yyx': 7.240882315075804e-06, 'L_sep_weight_yyx': 6.375848029380188e-08, 'L_scale_weight_yyx': 1.4074142356077395e-06, 'learning_rate_yyx': 0.0007464080065220184}. Best is trial 1 with value: -2.279694369835903.
[I 2026-03-18 18:55:47,116] Trial 16 pruned. 
[I 2026-03-18 18:55:49,456] Trial 4 pruned. 
[I 2026-03-18 18:55:50,865] Trial 10 pruned. 
[I 2026-03-18 18:55:54,310] Trial 17 pruned. 
[I 2026-03-18 18:55:54,980] Trial 4 pruned. 
[I 2026-03-18 18:55:56,035] Trial 2 finished with value: -1.776406202226865 and parameters: {'n_layers_yyx': 1, 'hidden_size_yyx_l0': 4, 'context_size_yyx': 3, 'num_mix_components_yyx': 4, 'context_extractor_yyx': 'gru', 'activation_func_yyx': 'Tanh', 'L2_weight_yyx': 6.971618437295122e-09, 'L_entropy_weight_yyx': 4.3019449184513904e-07, 'L_sep_weight_yyx': 4.930412493045188e-07, 'L_scale_weight_yyx': 4.557379041096696e-05, 'learning_rate_yyx': 0.0034081460037724423}. Best is trial 2 with value: -1.776406202226865.
[I 2026-03-18 18:55:57,119] Trial 4 pruned. 
[I 2026-03-18 18:55:57,837] Trial 11 pruned. 
[I 2026-03-18 18:56:01,753] Trial 18 pruned. 
[I 2026-03-18 18:56:05,042] Trial 5 pruned. 
[I 2026-03-18 18:56:05,278] Trial 5 pruned. 
[I 2026-03-18 18:56:06,109] Trial 12 pruned. 
[I 2026-03-18 18:56:09,544] Trial 5 pruned. 
[I 2026-03-18 18:56:10,191] Trial 19 pruned. 
[I 2026-03-18 18:56:11,849] Trial 6 pruned. 
