Warning: Failed writing log files to directory [/var/log/nvidia-mps]. No logs will be available.
[I 2026-03-18 19:07:03,121] A new study created in RDB with name: opt_full-model_seed=42_task=298
[I 2026-03-18 19:07:03,652] A new study created in RDB with name: opt_full-model_seed=42_task=300
[I 2026-03-18 19:07:03,928] A new study created in RDB with name: opt_full-model_seed=42_task=293
[I 2026-03-18 19:07:04,021] A new study created in RDB with name: opt_full-model_seed=42_task=301
[I 2026-03-18 19:07:04,141] A new study created in RDB with name: opt_full-model_seed=42_task=304
[I 2026-03-18 19:07:04,207] A new study created in RDB with name: opt_full-model_seed=42_task=299
[I 2026-03-18 19:07:04,243] A new study created in RDB with name: opt_full-model_seed=42_task=313
[I 2026-03-18 19:07:04,251] A new study created in RDB with name: opt_full-model_seed=42_task=306
[I 2026-03-18 19:07:04,260] A new study created in RDB with name: opt_full-model_seed=42_task=318
[I 2026-03-18 19:07:04,261] A new study created in RDB with name: opt_full-model_seed=42_task=311
[I 2026-03-18 19:07:04,261] A new study created in RDB with name: opt_full-model_seed=42_task=289
[I 2026-03-18 19:07:04,261] A new study created in RDB with name: opt_full-model_seed=42_task=317
[I 2026-03-18 19:07:04,268] A new study created in RDB with name: opt_full-model_seed=42_task=312
[I 2026-03-18 19:07:04,318] A new study created in RDB with name: opt_full-model_seed=42_task=302
[I 2026-03-18 19:07:04,322] A new study created in RDB with name: opt_full-model_seed=42_task=310
[I 2026-03-18 19:07:04,323] A new study created in RDB with name: opt_full-model_seed=42_task=291
[I 2026-03-18 19:07:04,342] A new study created in RDB with name: opt_full-model_seed=42_task=308
[I 2026-03-18 19:07:04,357] A new study created in RDB with name: opt_full-model_seed=42_task=305
[I 2026-03-18 19:07:04,358] A new study created in RDB with name: opt_full-model_seed=42_task=316
[I 2026-03-18 19:07:04,359] A new study created in RDB with name: opt_full-model_seed=42_task=295
[I 2026-03-18 19:07:04,359] A new study created in RDB with name: opt_full-model_seed=42_task=314
[I 2026-03-18 19:07:04,360] A new study created in RDB with name: opt_full-model_seed=42_task=294
[I 2026-03-18 19:07:04,365] A new study created in RDB with name: opt_full-model_seed=42_task=319
[I 2026-03-18 19:07:04,366] A new study created in RDB with name: opt_full-model_seed=42_task=307
[I 2026-03-18 19:07:04,366] A new study created in RDB with name: opt_full-model_seed=42_task=297
[I 2026-03-18 19:07:04,414] A new study created in RDB with name: opt_full-model_seed=42_task=309
[I 2026-03-18 19:07:04,415] A new study created in RDB with name: opt_full-model_seed=42_task=290
[I 2026-03-18 19:07:04,423] A new study created in RDB with name: opt_full-model_seed=42_task=315
[I 2026-03-18 19:07:04,832] A new study created in RDB with name: opt_full-model_seed=42_task=296
[I 2026-03-18 19:07:04,879] A new study created in RDB with name: opt_full-model_seed=42_task=288
[I 2026-03-18 19:07:04,880] A new study created in RDB with name: opt_full-model_seed=42_task=292
[I 2026-03-18 19:07:05,197] A new study created in RDB with name: opt_full-model_seed=42_task=303
[I 2026-03-18 19:08:51,580] Trial 0 finished with value: -1.9523362432398137 and parameters: {'n_layers_yyx': 1, 'hidden_size_yyx_l0': 6, 'context_size_yyx': 1, 'num_mix_components_yyx': 1, 'context_extractor_yyx': 'lstm', 'activation_func_yyx': 'GELU', 'L2_weight_yyx': 0.0006737933631638242, 'L_entropy_weight_yyx': 0.0002427408793608197, 'L_sep_weight_yyx': 5.345105043548221e-07, 'L_scale_weight_yyx': 1.6509945449326146e-10, 'learning_rate_yyx': 0.005903267406455868}. Best is trial 0 with value: -1.9523362432398137.
[I 2026-03-18 19:08:53,517] Trial 0 finished with value: -1.6893632543368602 and parameters: {'n_layers_yyx': 2, 'hidden_size_yyx_l0': 4, 'hidden_size_yyx_l1': 3, 'context_size_yyx': 2, 'num_mix_components_yyx': 2, 'context_extractor_yyx': 'lstm', 'activation_func_yyx': 'Tanh', 'L2_weight_yyx': 3.609631509466445e-05, 'L_entropy_weight_yyx': 1.4792950952379931e-09, 'L_sep_weight_yyx': 9.93683808446648e-09, 'L_scale_weight_yyx': 3.936513964353872e-08, 'learning_rate_yyx': 0.009230641315899185}. Best is trial 0 with value: -1.6893632543368602.
[I 2026-03-18 19:08:55,810] Trial 0 finished with value: -1.6885144001225116 and parameters: {'n_layers_yyx': 2, 'hidden_size_yyx_l0': 5, 'hidden_size_yyx_l1': 6, 'context_size_yyx': 1, 'num_mix_components_yyx': 2, 'context_extractor_yyx': 'gru', 'activation_func_yyx': 'ReLU', 'L2_weight_yyx': 7.575172252747107e-05, 'L_entropy_weight_yyx': 1.904250207670127e-06, 'L_sep_weight_yyx': 1.177886968993585e-08, 'L_scale_weight_yyx': 6.099311087044576e-07, 'learning_rate_yyx': 0.00881142835704151}. Best is trial 0 with value: -1.6885144001225116.
[I 2026-03-18 19:09:00,284] Trial 1 pruned. 
[I 2026-03-18 19:09:00,785] Trial 1 pruned. 
[I 2026-03-18 19:09:06,594] Trial 0 finished with value: -2.511745534136428 and parameters: {'n_layers_yyx': 1, 'hidden_size_yyx_l0': 5, 'context_size_yyx': 3, 'num_mix_components_yyx': 4, 'context_extractor_yyx': 'gru', 'activation_func_yyx': 'ReLU', 'L2_weight_yyx': 5.817988013006978e-10, 'L_entropy_weight_yyx': 5.345362887770188e-07, 'L_sep_weight_yyx': 2.7893417794723485e-05, 'L_scale_weight_yyx': 3.898263261547579e-09, 'learning_rate_yyx': 0.007978967708777075}. Best is trial 0 with value: -2.511745534136428.
[I 2026-03-18 19:09:08,143] Trial 0 finished with value: -1.6630848632988477 and parameters: {'n_layers_yyx': 1, 'hidden_size_yyx_l0': 3, 'context_size_yyx': 3, 'num_mix_components_yyx': 1, 'context_extractor_yyx': 'lstm', 'activation_func_yyx': 'ReLU', 'L2_weight_yyx': 1.0763817678640194e-05, 'L_entropy_weight_yyx': 4.932788172324632e-06, 'L_sep_weight_yyx': 5.097276571982175e-05, 'L_scale_weight_yyx': 1.0484005962434257e-07, 'learning_rate_yyx': 0.0016049559763769497}. Best is trial 0 with value: -1.6630848632988477.
[I 2026-03-18 19:09:15,906] Trial 0 finished with value: -1.7166840796377145 and parameters: {'n_layers_yyx': 1, 'hidden_size_yyx_l0': 4, 'context_size_yyx': 4, 'num_mix_components_yyx': 4, 'context_extractor_yyx': 'lstm', 'activation_func_yyx': 'ReLU', 'L2_weight_yyx': 4.80371050410376e-10, 'L_entropy_weight_yyx': 3.358036900265574e-08, 'L_sep_weight_yyx': 3.947963183253582e-08, 'L_scale_weight_yyx': 1.2025540244786072e-07, 'learning_rate_yyx': 0.0017197658093381413}. Best is trial 0 with value: -1.7166840796377145.
[I 2026-03-18 19:09:16,233] Trial 0 finished with value: -1.6761095192729139 and parameters: {'n_layers_yyx': 1, 'hidden_size_yyx_l0': 5, 'context_size_yyx': 4, 'num_mix_components_yyx': 2, 'context_extractor_yyx': 'lstm', 'activation_func_yyx': 'GELU', 'L2_weight_yyx': 5.583416279771522e-05, 'L_entropy_weight_yyx': 3.604169488894367e-09, 'L_sep_weight_yyx': 0.00017961790787329168, 'L_scale_weight_yyx': 2.046972517257745e-06, 'learning_rate_yyx': 0.0071799445749234705}. Best is trial 0 with value: -1.6761095192729139.
[I 2026-03-18 19:09:17,298] Trial 1 pruned. 
[I 2026-03-18 19:09:19,340] Trial 0 finished with value: -2.008555632877679 and parameters: {'n_layers_yyx': 1, 'hidden_size_yyx_l0': 3, 'context_size_yyx': 4, 'num_mix_components_yyx': 1, 'context_extractor_yyx': 'gru', 'activation_func_yyx': 'GELU', 'L2_weight_yyx': 2.1630035446111498e-05, 'L_entropy_weight_yyx': 7.036381009052675e-05, 'L_sep_weight_yyx': 0.0007399332455663769, 'L_scale_weight_yyx': 1.134643500837151e-10, 'learning_rate_yyx': 0.00313063352851128}. Best is trial 0 with value: -2.008555632877679.
[I 2026-03-18 19:09:22,077] Trial 0 finished with value: -1.6685281118368198 and parameters: {'n_layers_yyx': 2, 'hidden_size_yyx_l0': 6, 'hidden_size_yyx_l1': 6, 'context_size_yyx': 2, 'num_mix_components_yyx': 4, 'context_extractor_yyx': 'lstm', 'activation_func_yyx': 'ReLU', 'L2_weight_yyx': 2.0024768740980536e-09, 'L_entropy_weight_yyx': 8.868090191414883e-07, 'L_sep_weight_yyx': 2.4409987874378677e-05, 'L_scale_weight_yyx': 1.871230495888123e-09, 'learning_rate_yyx': 0.0018065348229626174}. Best is trial 0 with value: -1.6685281118368198.
[I 2026-03-18 19:09:24,161] Trial 1 pruned. 
[I 2026-03-18 19:09:28,140] Trial 2 pruned. 
[I 2026-03-18 19:09:29,694] Trial 1 pruned. 
[I 2026-03-18 19:09:30,855] Trial 2 pruned. 
[I 2026-03-18 19:09:37,757] Trial 3 pruned. 
[I 2026-03-18 19:09:39,954] Trial 3 pruned. 
[I 2026-03-18 19:09:41,556] Trial 0 finished with value: -2.1143376288427875 and parameters: {'n_layers_yyx': 1, 'hidden_size_yyx_l0': 4, 'context_size_yyx': 1, 'num_mix_components_yyx': 3, 'context_extractor_yyx': 'gru', 'activation_func_yyx': 'ReLU', 'L2_weight_yyx': 0.000371113555597443, 'L_entropy_weight_yyx': 9.817515663407494e-10, 'L_sep_weight_yyx': 1.2846469934797593e-08, 'L_scale_weight_yyx': 4.749460643213331e-10, 'learning_rate_yyx': 0.006803629494172267}. Best is trial 0 with value: -2.1143376288427875.
[I 2026-03-18 19:09:42,119] Trial 0 finished with value: -1.6784554536041303 and parameters: {'n_layers_yyx': 1, 'hidden_size_yyx_l0': 3, 'context_size_yyx': 3, 'num_mix_components_yyx': 5, 'context_extractor_yyx': 'gru', 'activation_func_yyx': 'GELU', 'L2_weight_yyx': 2.613697152753719e-09, 'L_entropy_weight_yyx': 6.648508000715266e-09, 'L_sep_weight_yyx': 1.7293089473895418e-10, 'L_scale_weight_yyx': 2.796645255560228e-07, 'learning_rate_yyx': 0.0033188032696185705}. Best is trial 0 with value: -1.6784554536041303.
[I 2026-03-18 19:09:48,648] Trial 1 pruned. 
[I 2026-03-18 19:09:52,437] Trial 0 finished with value: -1.7281774506604581 and parameters: {'n_layers_yyx': 1, 'hidden_size_yyx_l0': 2, 'context_size_yyx': 3, 'num_mix_components_yyx': 2, 'context_extractor_yyx': 'gru', 'activation_func_yyx': 'ReLU', 'L2_weight_yyx': 1.9905361895794545e-06, 'L_entropy_weight_yyx': 1.8568326932215258e-07, 'L_sep_weight_yyx': 2.9551623037244133e-05, 'L_scale_weight_yyx': 1.4141251338075776e-05, 'learning_rate_yyx': 0.007834398856575955}. Best is trial 0 with value: -1.7281774506604581.
[I 2026-03-18 19:09:52,832] Trial 0 finished with value: -2.4520858513292416 and parameters: {'n_layers_yyx': 1, 'hidden_size_yyx_l0': 5, 'context_size_yyx': 1, 'num_mix_components_yyx': 2, 'context_extractor_yyx': 'lstm', 'activation_func_yyx': 'GELU', 'L2_weight_yyx': 2.9684064229683565e-08, 'L_entropy_weight_yyx': 7.5468749549820755e-06, 'L_sep_weight_yyx': 6.384275847686143e-06, 'L_scale_weight_yyx': 0.00027513027518715724, 'learning_rate_yyx': 0.0028398398012047196}. Best is trial 0 with value: -2.4520858513292416.
[I 2026-03-18 19:09:55,762] Trial 2 pruned. 
[I 2026-03-18 19:09:56,341] Trial 0 finished with value: -1.6628499528155825 and parameters: {'n_layers_yyx': 2, 'hidden_size_yyx_l0': 4, 'hidden_size_yyx_l1': 2, 'context_size_yyx': 1, 'num_mix_components_yyx': 1, 'context_extractor_yyx': 'lstm', 'activation_func_yyx': 'Tanh', 'L2_weight_yyx': 5.300145796718791e-05, 'L_entropy_weight_yyx': 2.790237675450311e-07, 'L_sep_weight_yyx': 0.0002970366011971541, 'L_scale_weight_yyx': 0.00011447248147717753, 'learning_rate_yyx': 0.00909242142810211}. Best is trial 0 with value: -1.6628499528155825.
[I 2026-03-18 19:10:01,869] Trial 0 finished with value: -1.9571107956782938 and parameters: {'n_layers_yyx': 2, 'hidden_size_yyx_l0': 4, 'hidden_size_yyx_l1': 3, 'context_size_yyx': 3, 'num_mix_components_yyx': 1, 'context_extractor_yyx': 'gru', 'activation_func_yyx': 'GELU', 'L2_weight_yyx': 4.211983127542687e-06, 'L_entropy_weight_yyx': 5.951979720094565e-08, 'L_sep_weight_yyx': 3.5355340168029058e-09, 'L_scale_weight_yyx': 7.871811042448101e-10, 'learning_rate_yyx': 0.002269314767912374}. Best is trial 0 with value: -1.9571107956782938.
[I 2026-03-18 19:10:02,910] Trial 3 pruned. 
[I 2026-03-18 19:10:10,575] Trial 1 pruned. 
[I 2026-03-18 19:10:11,311] Trial 4 pruned. 
[I 2026-03-18 19:10:12,653] Trial 0 finished with value: -1.9690375628772083 and parameters: {'n_layers_yyx': 2, 'hidden_size_yyx_l0': 3, 'hidden_size_yyx_l1': 5, 'context_size_yyx': 2, 'num_mix_components_yyx': 1, 'context_extractor_yyx': 'gru', 'activation_func_yyx': 'Tanh', 'L2_weight_yyx': 5.835341809638954e-07, 'L_entropy_weight_yyx': 1.8918573959146978e-08, 'L_sep_weight_yyx': 1.9362634417183953e-07, 'L_scale_weight_yyx': 9.076378526255019e-06, 'learning_rate_yyx': 0.005280054333093501}. Best is trial 0 with value: -1.9690375628772083.
[I 2026-03-18 19:10:17,472] Trial 5 pruned. 
[I 2026-03-18 19:10:19,494] Trial 2 pruned. 
[I 2026-03-18 19:10:27,846] Trial 3 pruned. 
[I 2026-03-18 19:10:42,830] Trial 0 finished with value: -1.6662548089015947 and parameters: {'n_layers_yyx': 1, 'hidden_size_yyx_l0': 3, 'context_size_yyx': 3, 'num_mix_components_yyx': 3, 'context_extractor_yyx': 'lstm', 'activation_func_yyx': 'Tanh', 'L2_weight_yyx': 1.1296252870002487e-06, 'L_entropy_weight_yyx': 1.681690726689773e-06, 'L_sep_weight_yyx': 0.00031160422740428805, 'L_scale_weight_yyx': 1.2086176201525009e-05, 'learning_rate_yyx': 0.0005552408455251588}. Best is trial 0 with value: -1.6662548089015947.
[I 2026-03-18 19:10:44,210] Trial 0 finished with value: -1.971623403890498 and parameters: {'n_layers_yyx': 1, 'hidden_size_yyx_l0': 2, 'context_size_yyx': 2, 'num_mix_components_yyx': 1, 'context_extractor_yyx': 'gru', 'activation_func_yyx': 'GELU', 'L2_weight_yyx': 6.25443527650887e-09, 'L_entropy_weight_yyx': 2.212739595869409e-07, 'L_sep_weight_yyx': 4.884917647055243e-10, 'L_scale_weight_yyx': 2.9454424531736803e-07, 'learning_rate_yyx': 0.002030245860404195}. Best is trial 0 with value: -1.971623403890498.
[I 2026-03-18 19:10:47,209] Trial 2 finished with value: -1.9828319095557092 and parameters: {'n_layers_yyx': 1, 'hidden_size_yyx_l0': 4, 'context_size_yyx': 4, 'num_mix_components_yyx': 5, 'context_extractor_yyx': 'lstm', 'activation_func_yyx': 'Tanh', 'L2_weight_yyx': 0.00010819345632509097, 'L_entropy_weight_yyx': 4.698172357795093e-05, 'L_sep_weight_yyx': 3.0695227424680805e-09, 'L_scale_weight_yyx': 2.360854700583045e-05, 'learning_rate_yyx': 0.00966844762991659}. Best is trial 2 with value: -1.9828319095557092.
[I 2026-03-18 19:10:52,669] Trial 0 finished with value: -1.6755450137356964 and parameters: {'n_layers_yyx': 2, 'hidden_size_yyx_l0': 3, 'hidden_size_yyx_l1': 4, 'context_size_yyx': 4, 'num_mix_components_yyx': 3, 'context_extractor_yyx': 'gru', 'activation_func_yyx': 'ReLU', 'L2_weight_yyx': 1.2794573922432742e-06, 'L_entropy_weight_yyx': 2.736909421444785e-08, 'L_sep_weight_yyx': 2.672686903046649e-10, 'L_scale_weight_yyx': 8.236247518400952e-07, 'learning_rate_yyx': 0.0005925624731336436}. Best is trial 0 with value: -1.6755450137356964.
[I 2026-03-18 19:10:57,767] Trial 1 pruned. 
[I 2026-03-18 19:10:58,207] Trial 0 finished with value: -2.5120178855442976 and parameters: {'n_layers_yyx': 1, 'hidden_size_yyx_l0': 2, 'context_size_yyx': 3, 'num_mix_components_yyx': 4, 'context_extractor_yyx': 'gru', 'activation_func_yyx': 'GELU', 'L2_weight_yyx': 4.865971186270363e-10, 'L_entropy_weight_yyx': 7.140652407373332e-05, 'L_sep_weight_yyx': 1.0681179729055959e-10, 'L_scale_weight_yyx': 5.750873537198026e-10, 'learning_rate_yyx': 0.007121993086234927}. Best is trial 0 with value: -2.5120178855442976.
[I 2026-03-18 19:10:59,186] Trial 0 finished with value: -2.018971523147818 and parameters: {'n_layers_yyx': 1, 'hidden_size_yyx_l0': 3, 'context_size_yyx': 3, 'num_mix_components_yyx': 4, 'context_extractor_yyx': 'gru', 'activation_func_yyx': 'Tanh', 'L2_weight_yyx': 2.943157386831397e-07, 'L_entropy_weight_yyx': 1.772653169556252e-09, 'L_sep_weight_yyx': 3.2948322314221713e-09, 'L_scale_weight_yyx': 9.452248150903213e-08, 'learning_rate_yyx': 0.0013213598446898964}. Best is trial 0 with value: -2.018971523147818.
[I 2026-03-18 19:11:06,930] Trial 2 finished with value: -1.7032745841919907 and parameters: {'n_layers_yyx': 2, 'hidden_size_yyx_l0': 5, 'hidden_size_yyx_l1': 4, 'context_size_yyx': 1, 'num_mix_components_yyx': 2, 'context_extractor_yyx': 'gru', 'activation_func_yyx': 'ReLU', 'L2_weight_yyx': 0.00023549516372077146, 'L_entropy_weight_yyx': 4.322056400069982e-09, 'L_sep_weight_yyx': 0.00014272785567641204, 'L_scale_weight_yyx': 1.6756455815915892e-05, 'learning_rate_yyx': 0.0046047055542960385}. Best is trial 2 with value: -1.7032745841919907.
[I 2026-03-18 19:11:08,325] Trial 1 finished with value: -2.0346981000296678 and parameters: {'n_layers_yyx': 1, 'hidden_size_yyx_l0': 6, 'context_size_yyx': 3, 'num_mix_components_yyx': 5, 'context_extractor_yyx': 'lstm', 'activation_func_yyx': 'Tanh', 'L2_weight_yyx': 1.8951011470183022e-07, 'L_entropy_weight_yyx': 6.51387905441539e-08, 'L_sep_weight_yyx': 8.278282110339496e-06, 'L_scale_weight_yyx': 1.9321055601454798e-07, 'learning_rate_yyx': 0.009830626723871187}. Best is trial 1 with value: -2.0346981000296678.
[I 2026-03-18 19:11:10,981] Trial 0 finished with value: -1.6753394453643549 and parameters: {'n_layers_yyx': 2, 'hidden_size_yyx_l0': 4, 'hidden_size_yyx_l1': 2, 'context_size_yyx': 3, 'num_mix_components_yyx': 4, 'context_extractor_yyx': 'lstm', 'activation_func_yyx': 'Tanh', 'L2_weight_yyx': 4.078984330151649e-09, 'L_entropy_weight_yyx': 8.80632117958534e-05, 'L_sep_weight_yyx': 3.852290848188558e-08, 'L_scale_weight_yyx': 0.0009606148826972203, 'learning_rate_yyx': 0.002226989875168493}. Best is trial 0 with value: -1.6753394453643549.
[I 2026-03-18 19:11:15,721] Trial 0 finished with value: -2.498029528813278 and parameters: {'n_layers_yyx': 2, 'hidden_size_yyx_l0': 6, 'hidden_size_yyx_l1': 2, 'context_size_yyx': 1, 'num_mix_components_yyx': 3, 'context_extractor_yyx': 'gru', 'activation_func_yyx': 'GELU', 'L2_weight_yyx': 4.643017758179674e-06, 'L_entropy_weight_yyx': 4.00705946483936e-08, 'L_sep_weight_yyx': 4.5491737699016296e-05, 'L_scale_weight_yyx': 5.072881663721231e-08, 'learning_rate_yyx': 0.005500103965889781}. Best is trial 0 with value: -2.498029528813278.
[I 2026-03-18 19:11:16,452] Trial 1 finished with value: -1.9540290488853111 and parameters: {'n_layers_yyx': 1, 'hidden_size_yyx_l0': 5, 'context_size_yyx': 4, 'num_mix_components_yyx': 1, 'context_extractor_yyx': 'lstm', 'activation_func_yyx': 'GELU', 'L2_weight_yyx': 0.0007471310872518861, 'L_entropy_weight_yyx': 6.59096541148701e-08, 'L_sep_weight_yyx': 1.9921458598196739e-10, 'L_scale_weight_yyx': 1.8589676731910862e-08, 'learning_rate_yyx': 0.0030566481437381446}. Best is trial 0 with value: -1.9690375628772083.
[I 2026-03-18 19:11:20,843] Trial 0 finished with value: -2.0138799336866504 and parameters: {'n_layers_yyx': 1, 'hidden_size_yyx_l0': 5, 'context_size_yyx': 4, 'num_mix_components_yyx': 5, 'context_extractor_yyx': 'lstm', 'activation_func_yyx': 'GELU', 'L2_weight_yyx': 4.437500735419452e-08, 'L_entropy_weight_yyx': 1.4874589600179104e-10, 'L_sep_weight_yyx': 1.0600923245184888e-07, 'L_scale_weight_yyx': 1.2415848816651468e-06, 'learning_rate_yyx': 0.0009259440270619987}. Best is trial 0 with value: -2.0138799336866504.
[I 2026-03-18 19:11:21,546] Trial 3 pruned. 
[I 2026-03-18 19:11:23,951] Trial 0 finished with value: -2.510808245268653 and parameters: {'n_layers_yyx': 1, 'hidden_size_yyx_l0': 5, 'context_size_yyx': 3, 'num_mix_components_yyx': 1, 'context_extractor_yyx': 'gru', 'activation_func_yyx': 'ReLU', 'L2_weight_yyx': 4.424076402447567e-05, 'L_entropy_weight_yyx': 1.0010637675033783e-07, 'L_sep_weight_yyx': 1.603757024520771e-05, 'L_scale_weight_yyx': 0.000777946577947823, 'learning_rate_yyx': 0.0010026679547442037}. Best is trial 0 with value: -2.510808245268653.
[I 2026-03-18 19:11:25,318] Trial 2 pruned. 
[I 2026-03-18 19:11:28,103] Trial 4 pruned. 
[I 2026-03-18 19:11:33,685] Trial 1 finished with value: -1.7124108369213684 and parameters: {'n_layers_yyx': 1, 'hidden_size_yyx_l0': 4, 'context_size_yyx': 3, 'num_mix_components_yyx': 2, 'context_extractor_yyx': 'gru', 'activation_func_yyx': 'ReLU', 'L2_weight_yyx': 1.1857589529614403e-07, 'L_entropy_weight_yyx': 0.0006525788122196545, 'L_sep_weight_yyx': 0.00015010559536074702, 'L_scale_weight_yyx': 2.1420545277388202e-05, 'learning_rate_yyx': 0.007943538953321484}. Best is trial 0 with value: -1.7281774506604581.
[I 2026-03-18 19:11:33,761] Trial 0 finished with value: -2.4792033627986814 and parameters: {'n_layers_yyx': 2, 'hidden_size_yyx_l0': 4, 'hidden_size_yyx_l1': 3, 'context_size_yyx': 4, 'num_mix_components_yyx': 2, 'context_extractor_yyx': 'lstm', 'activation_func_yyx': 'Tanh', 'L2_weight_yyx': 1.238812746548059e-09, 'L_entropy_weight_yyx': 5.895569330387049e-09, 'L_sep_weight_yyx': 4.792606992828932e-08, 'L_scale_weight_yyx': 5.247886511655511e-06, 'learning_rate_yyx': 0.0014133989525771252}. Best is trial 0 with value: -2.4792033627986814.
[I 2026-03-18 19:11:38,462] Trial 1 pruned. 
[I 2026-03-18 19:11:39,183] Trial 4 finished with value: -1.6695399249992022 and parameters: {'n_layers_yyx': 2, 'hidden_size_yyx_l0': 3, 'hidden_size_yyx_l1': 4, 'context_size_yyx': 3, 'num_mix_components_yyx': 3, 'context_extractor_yyx': 'gru', 'activation_func_yyx': 'ReLU', 'L2_weight_yyx': 5.095892939398382e-10, 'L_entropy_weight_yyx': 3.7658293737175507e-10, 'L_sep_weight_yyx': 6.017435673869291e-08, 'L_scale_weight_yyx': 0.000938816586687694, 'learning_rate_yyx': 0.002532496437287209}. Best is trial 0 with value: -1.6761095192729139.
[I 2026-03-18 19:11:48,001] Trial 0 finished with value: -2.5448031658892867 and parameters: {'n_layers_yyx': 1, 'hidden_size_yyx_l0': 4, 'context_size_yyx': 4, 'num_mix_components_yyx': 5, 'context_extractor_yyx': 'gru', 'activation_func_yyx': 'Tanh', 'L2_weight_yyx': 3.077257763739825e-05, 'L_entropy_weight_yyx': 1.7341983172422474e-10, 'L_sep_weight_yyx': 0.0001747658654788715, 'L_scale_weight_yyx': 3.4113263997634914e-06, 'learning_rate_yyx': 0.000634513695571822}. Best is trial 0 with value: -2.5448031658892867.
