[I 2026-03-18 22:36:18,229] Trial 63 finished with value: -2.4927493748257907 and parameters: {'n_layers_yyx': 1, 'hidden_size_yyx_l0': 6, 'context_size_yyx': 4, 'num_mix_components_yyx': 5, 'context_extractor_yyx': 'gru', 'activation_func_yyx': 'GELU', 'L2_weight_yyx': 4.18779752447921e-09, 'L_entropy_weight_yyx': 0.000986696772124066, 'L_sep_weight_yyx': 6.152380955304127e-10, 'L_scale_weight_yyx': 1.1873188386925196e-08, 'learning_rate_yyx': 0.006349260857999865}. Best is trial 35 with value: -2.497237209565205.
[I 2026-03-18 22:36:21,209] Trial 51 pruned. 
[I 2026-03-18 22:36:24,891] Trial 92 finished with value: -2.4726485173787283 and parameters: {'n_layers_yyx': 1, 'hidden_size_yyx_l0': 6, 'context_size_yyx': 3, 'num_mix_components_yyx': 5, 'context_extractor_yyx': 'gru', 'activation_func_yyx': 'ReLU', 'L2_weight_yyx': 1.1200112853370384e-07, 'L_entropy_weight_yyx': 1.6176110575002715e-08, 'L_sep_weight_yyx': 2.00524925468595e-07, 'L_scale_weight_yyx': 0.0006501457942784942, 'learning_rate_yyx': 0.009965847323000649}. Best is trial 25 with value: -2.4764732316599813.
[I 2026-03-18 22:36:54,889] Trial 93 finished with value: -2.471872595487255 and parameters: {'n_layers_yyx': 1, 'hidden_size_yyx_l0': 6, 'context_size_yyx': 3, 'num_mix_components_yyx': 5, 'context_extractor_yyx': 'gru', 'activation_func_yyx': 'ReLU', 'L2_weight_yyx': 2.846881272412446e-07, 'L_entropy_weight_yyx': 1.0962627963602497e-08, 'L_sep_weight_yyx': 5.353752186114626e-06, 'L_scale_weight_yyx': 0.00024812066138114376, 'learning_rate_yyx': 0.0077692609840795705}. Best is trial 25 with value: -2.4764732316599813.
[I 2026-03-18 22:36:58,129] Trial 64 finished with value: -2.4922963808787757 and parameters: {'n_layers_yyx': 1, 'hidden_size_yyx_l0': 6, 'context_size_yyx': 4, 'num_mix_components_yyx': 5, 'context_extractor_yyx': 'gru', 'activation_func_yyx': 'GELU', 'L2_weight_yyx': 1.6086600763664508e-09, 'L_entropy_weight_yyx': 0.00015900162116108706, 'L_sep_weight_yyx': 1.1326990384606188e-09, 'L_scale_weight_yyx': 1.0814232103987474e-06, 'learning_rate_yyx': 0.008886048564461152}. Best is trial 35 with value: -2.497237209565205.
[I 2026-03-18 22:37:08,892] Trial 52 finished with value: -2.4763283936581004 and parameters: {'n_layers_yyx': 1, 'hidden_size_yyx_l0': 5, 'context_size_yyx': 4, 'num_mix_components_yyx': 2, 'context_extractor_yyx': 'gru', 'activation_func_yyx': 'ReLU', 'L2_weight_yyx': 1.3195287901028433e-07, 'L_entropy_weight_yyx': 2.1654527631630188e-07, 'L_sep_weight_yyx': 1.2325042779254272e-07, 'L_scale_weight_yyx': 1.783938641048978e-08, 'learning_rate_yyx': 0.008334672623211793}. Best is trial 34 with value: -2.477771523391826.
[I 2026-03-18 22:37:24,658] Trial 94 finished with value: -2.4726267405583515 and parameters: {'n_layers_yyx': 1, 'hidden_size_yyx_l0': 6, 'context_size_yyx': 3, 'num_mix_components_yyx': 5, 'context_extractor_yyx': 'gru', 'activation_func_yyx': 'ReLU', 'L2_weight_yyx': 1.7010227551707152e-07, 'L_entropy_weight_yyx': 2.315389625361678e-08, 'L_sep_weight_yyx': 4.0361819172290105e-06, 'L_scale_weight_yyx': 0.0004788504554038652, 'learning_rate_yyx': 0.009518722578983637}. Best is trial 25 with value: -2.4764732316599813.
[I 2026-03-18 22:37:25,049] Trial 65 pruned. 
[I 2026-03-18 22:37:35,021] Trial 66 pruned. 
[I 2026-03-18 22:37:39,276] Trial 67 pruned. 
[I 2026-03-18 22:37:49,255] Trial 68 pruned. 
[I 2026-03-18 22:37:53,000] Trial 53 finished with value: -2.476366543323801 and parameters: {'n_layers_yyx': 1, 'hidden_size_yyx_l0': 5, 'context_size_yyx': 4, 'num_mix_components_yyx': 2, 'context_extractor_yyx': 'gru', 'activation_func_yyx': 'ReLU', 'L2_weight_yyx': 1.406540333893842e-07, 'L_entropy_weight_yyx': 2.2388378862121033e-07, 'L_sep_weight_yyx': 8.197501210452927e-08, 'L_scale_weight_yyx': 2.302105190105327e-08, 'learning_rate_yyx': 0.009767962937991018}. Best is trial 34 with value: -2.477771523391826.
[I 2026-03-18 22:37:59,090] Trial 69 pruned. 
[I 2026-03-18 22:38:00,693] Trial 95 finished with value: -2.476324330438652 and parameters: {'n_layers_yyx': 1, 'hidden_size_yyx_l0': 6, 'context_size_yyx': 4, 'num_mix_components_yyx': 5, 'context_extractor_yyx': 'gru', 'activation_func_yyx': 'ReLU', 'L2_weight_yyx': 1.536059817137885e-07, 'L_entropy_weight_yyx': 3.933941177852588e-08, 'L_sep_weight_yyx': 0.0006661489140960872, 'L_scale_weight_yyx': 1.0343725370373494e-08, 'learning_rate_yyx': 0.00995109537962464}. Best is trial 25 with value: -2.4764732316599813.
[I 2026-03-18 22:38:12,263] Trial 96 pruned. 
[I 2026-03-18 22:38:17,192] Trial 97 pruned. 
[I 2026-03-18 22:38:22,125] Trial 98 pruned. 

Source events: 29032
Target events: 31112
Full model ln_yyx : 3831.12433 nats/sec, 110.82579 nats/event
Full model Log loss : -2.47268
Full model ln_yyx : 3831.12809 nats/sec, 110.82590 nats/event
Full model Log loss : -2.47261
Full model ln_yyx : 3817.51180 nats/sec, 110.43201 nats/event
Full model Log loss : -2.47307
Full model ln_yyx : 3830.31546 nats/sec, 110.80239 nats/event
Full model Log loss : -2.47487
Full model ln_yyx : 3818.48833 nats/sec, 110.46026 nats/event
Full model Log loss : -2.47541
Full model ln_yyx : 3811.65080 nats/sec, 110.26246 nats/event
Full model Log loss : -2.47535
Full model ln_yyx : 3818.30485 nats/sec, 110.45495 nats/event
Full model Log loss : -2.47435
Full model ln_yyx : 3787.65294 nats/sec, 109.56826 nats/event
Full model Log loss : -2.44828
Full model ln_yyx : 3828.46414 nats/sec, 110.74883 nats/event
Full model Log loss : -2.47255
Full model ln_yyx : 3831.35075 nats/sec, 110.83234 nats/event
Full model Log loss : -2.47265
Full model ln_yyx : 3812.78630 nats/sec, 110.29531 nats/event
Full model Log loss : -2.47187
Full model ln_yyx : 3828.27765 nats/sec, 110.74344 nats/event
Full model Log loss : -2.47263
Full model ln_yyx : 3829.30654 nats/sec, 110.77320 nats/event
Full model Log loss : -2.47632
Optimization finished. Config saved to results/opt-full/opt_full_252_best_config.txt
[I 2026-03-18 22:38:37,932] Trial 54 finished with value: -2.4769502404802393 and parameters: {'n_layers_yyx': 1, 'hidden_size_yyx_l0': 5, 'context_size_yyx': 4, 'num_mix_components_yyx': 1, 'context_extractor_yyx': 'gru', 'activation_func_yyx': 'ReLU', 'L2_weight_yyx': 2.431661144469503e-05, 'L_entropy_weight_yyx': 5.884908440871361e-07, 'L_sep_weight_yyx': 0.0007413148588792456, 'L_scale_weight_yyx': 3.596568684477093e-08, 'learning_rate_yyx': 0.009794664402016292}. Best is trial 34 with value: -2.477771523391826.
[I 2026-03-18 22:38:44,469] Trial 70 finished with value: -2.4929717392750357 and parameters: {'n_layers_yyx': 1, 'hidden_size_yyx_l0': 6, 'context_size_yyx': 4, 'num_mix_components_yyx': 5, 'context_extractor_yyx': 'gru', 'activation_func_yyx': 'GELU', 'L2_weight_yyx': 3.540392651097383e-08, 'L_entropy_weight_yyx': 2.2172103928802796e-05, 'L_sep_weight_yyx': 6.0205920541167914e-05, 'L_scale_weight_yyx': 3.200642454251559e-06, 'learning_rate_yyx': 0.007389963371206989}. Best is trial 35 with value: -2.497237209565205.
[I 2026-03-18 22:38:49,027] Trial 55 pruned. 
[I 2026-03-18 22:38:53,917] Trial 56 pruned. 
[I 2026-03-18 22:38:54,018] Trial 71 pruned. 
[I 2026-03-18 22:39:04,945] Trial 57 pruned. 
[I 2026-03-18 22:39:16,062] Trial 58 pruned. 
[I 2026-03-18 22:39:35,440] Trial 72 finished with value: -2.492808974734093 and parameters: {'n_layers_yyx': 1, 'hidden_size_yyx_l0': 6, 'context_size_yyx': 4, 'num_mix_components_yyx': 5, 'context_extractor_yyx': 'gru', 'activation_func_yyx': 'GELU', 'L2_weight_yyx': 2.157008714407632e-09, 'L_entropy_weight_yyx': 0.00033540721532369455, 'L_sep_weight_yyx': 1.1152486022529874e-10, 'L_scale_weight_yyx': 7.23791483400064e-07, 'learning_rate_yyx': 0.00793592791915593}. Best is trial 35 with value: -2.497237209565205.
[I 2026-03-18 22:40:12,148] Trial 59 finished with value: -2.4743034384337323 and parameters: {'n_layers_yyx': 1, 'hidden_size_yyx_l0': 5, 'context_size_yyx': 3, 'num_mix_components_yyx': 1, 'context_extractor_yyx': 'gru', 'activation_func_yyx': 'ReLU', 'L2_weight_yyx': 0.0003802905936274353, 'L_entropy_weight_yyx': 2.219546410555905e-08, 'L_sep_weight_yyx': 6.973539862317186e-05, 'L_scale_weight_yyx': 8.643087458795735e-09, 'learning_rate_yyx': 0.0048133717270944275}. Best is trial 34 with value: -2.477771523391826.
[I 2026-03-18 22:40:19,741] Trial 73 finished with value: -2.4930800262581085 and parameters: {'n_layers_yyx': 1, 'hidden_size_yyx_l0': 6, 'context_size_yyx': 4, 'num_mix_components_yyx': 5, 'context_extractor_yyx': 'gru', 'activation_func_yyx': 'GELU', 'L2_weight_yyx': 3.680244577761578e-09, 'L_entropy_weight_yyx': 6.228593533484985e-05, 'L_sep_weight_yyx': 7.802497011443215e-10, 'L_scale_weight_yyx': 4.096213761359638e-07, 'learning_rate_yyx': 0.007247569429681818}. Best is trial 35 with value: -2.497237209565205.
[I 2026-03-18 22:40:23,773] Trial 74 pruned. 

Source events: 29032
Target events: 1783
Full model ln_yyx : 220.00363 nats/sec, 111.05062 nats/event
Full model Log loss : -2.49040
Full model ln_yyx : 219.57617 nats/sec, 110.83486 nats/event
Full model Log loss : -2.48926
Full model ln_yyx : 220.04794 nats/sec, 111.07299 nats/event
Full model Log loss : -2.49326
Full model ln_yyx : 218.90534 nats/sec, 110.49624 nats/event
Full model Log loss : -2.49379
Full model ln_yyx : 218.08266 nats/sec, 110.08098 nats/event
Full model Log loss : -2.49724
Full model ln_yyx : 218.37287 nats/sec, 110.22747 nats/event
Full model Log loss : -2.49049
Full model ln_yyx : 220.36403 nats/sec, 111.23254 nats/event
Full model Log loss : -2.48521
Full model ln_yyx : 219.62649 nats/sec, 110.86026 nats/event
Full model Log loss : -2.49047
Full model ln_yyx : 218.48286 nats/sec, 110.28299 nats/event
Full model Log loss : -2.49296
Full model ln_yyx : 219.49868 nats/sec, 110.79575 nats/event
Full model Log loss : -2.49154
Full model ln_yyx : 218.48879 nats/sec, 110.28599 nats/event
Full model Log loss : -2.49340
Full model ln_yyx : 219.12530 nats/sec, 110.60728 nats/event
Full model Log loss : -2.49039
Full model ln_yyx : 217.14548 nats/sec, 109.60792 nats/event
Full model Log loss : -2.49234
Full model ln_yyx : 218.61022 nats/sec, 110.34728 nats/event
Full model Log loss : -2.49275
Full model ln_yyx : 217.12727 nats/sec, 109.59873 nats/event
Full model Log loss : -2.49230
Full model ln_yyx : 220.04032 nats/sec, 111.06914 nats/event
Full model Log loss : -2.49297
Full model ln_yyx : 218.63075 nats/sec, 110.35764 nats/event
Full model Log loss : -2.49281
Full model ln_yyx : 220.06667 nats/sec, 111.08245 nats/event
Full model Log loss : -2.49308
Optimization finished. Config saved to results/opt-full/opt_full_253_best_config.txt
[I 2026-03-18 22:40:57,416] Trial 60 finished with value: -2.476606624184503 and parameters: {'n_layers_yyx': 1, 'hidden_size_yyx_l0': 5, 'context_size_yyx': 4, 'num_mix_components_yyx': 1, 'context_extractor_yyx': 'gru', 'activation_func_yyx': 'ReLU', 'L2_weight_yyx': 6.000071570617832e-07, 'L_entropy_weight_yyx': 4.5943657092799764e-07, 'L_sep_weight_yyx': 1.5859924009349573e-05, 'L_scale_weight_yyx': 9.26857659253293e-08, 'learning_rate_yyx': 0.008415628493455165}. Best is trial 34 with value: -2.477771523391826.
[I 2026-03-18 22:41:01,800] Trial 61 pruned. 
[I 2026-03-18 22:41:12,394] Trial 62 pruned. 
[I 2026-03-18 22:42:22,434] Trial 63 finished with value: -2.4795843327041234 and parameters: {'n_layers_yyx': 1, 'hidden_size_yyx_l0': 5, 'context_size_yyx': 4, 'num_mix_components_yyx': 1, 'context_extractor_yyx': 'gru', 'activation_func_yyx': 'ReLU', 'L2_weight_yyx': 1.957414533976595e-06, 'L_entropy_weight_yyx': 1.5137924205446825e-06, 'L_sep_weight_yyx': 2.6976620022974817e-05, 'L_scale_weight_yyx': 1.3468856692822096e-07, 'learning_rate_yyx': 0.008814875755083964}. Best is trial 63 with value: -2.4795843327041234.
[I 2026-03-18 22:43:10,499] Trial 64 finished with value: -2.4772750485545116 and parameters: {'n_layers_yyx': 1, 'hidden_size_yyx_l0': 5, 'context_size_yyx': 4, 'num_mix_components_yyx': 1, 'context_extractor_yyx': 'gru', 'activation_func_yyx': 'ReLU', 'L2_weight_yyx': 1.777340635782273e-06, 'L_entropy_weight_yyx': 1.0823846947675434e-05, 'L_sep_weight_yyx': 1.8627368469628127e-05, 'L_scale_weight_yyx': 1.688044740517282e-07, 'learning_rate_yyx': 0.009131275052821032}. Best is trial 63 with value: -2.4795843327041234.
[I 2026-03-18 22:43:38,823] Trial 65 pruned. 
[I 2026-03-18 22:44:07,139] Trial 66 pruned. 
[I 2026-03-18 22:44:17,396] Trial 67 pruned. 
[I 2026-03-18 22:44:21,603] Trial 68 pruned. 
[I 2026-03-18 22:44:31,752] Trial 69 pruned. 
[I 2026-03-18 22:45:11,370] Trial 70 finished with value: -2.4760241065814728 and parameters: {'n_layers_yyx': 1, 'hidden_size_yyx_l0': 5, 'context_size_yyx': 4, 'num_mix_components_yyx': 2, 'context_extractor_yyx': 'gru', 'activation_func_yyx': 'ReLU', 'L2_weight_yyx': 2.0677181075032873e-06, 'L_entropy_weight_yyx': 4.580728500871762e-06, 'L_sep_weight_yyx': 4.4894627880031316e-06, 'L_scale_weight_yyx': 5.905917017306874e-08, 'learning_rate_yyx': 0.008963645340811182}. Best is trial 63 with value: -2.4795843327041234.

Source events: 29032
Target events: 20315
Full model ln_yyx : 2458.71038 nats/sec, 108.92638 nats/event
Full model Log loss : -2.44221
Full model ln_yyx : 2498.45732 nats/sec, 110.68726 nats/event
Full model Log loss : -2.47420
Full model ln_yyx : 2494.13480 nats/sec, 110.49576 nats/event
Full model Log loss : -2.47484
Full model ln_yyx : 2511.81551 nats/sec, 111.27905 nats/event
Full model Log loss : -2.47478
Full model ln_yyx : 2503.65575 nats/sec, 110.91756 nats/event
Full model Log loss : -2.47519
Full model ln_yyx : 2504.50375 nats/sec, 110.95513 nats/event
Full model Log loss : -2.47520
Full model ln_yyx : 2503.23447 nats/sec, 110.89889 nats/event
Full model Log loss : -2.47777
Full model ln_yyx : 2510.40688 nats/sec, 111.21665 nats/event
Full model Log loss : -2.47577
Full model ln_yyx : 2491.64146 nats/sec, 110.38530 nats/event
Full model Log loss : -2.47675
Full model ln_yyx : 2491.45121 nats/sec, 110.37687 nats/event
Full model Log loss : -2.47643
Full model ln_yyx : 2502.12308 nats/sec, 110.84966 nats/event
Full model Log loss : -2.47595
Full model ln_yyx : 2491.22735 nats/sec, 110.36695 nats/event
Full model Log loss : -2.47656
Full model ln_yyx : 2490.79297 nats/sec, 110.34771 nats/event
Full model Log loss : -2.47662
Full model ln_yyx : 2469.65924 nats/sec, 109.41144 nats/event
Full model Log loss : -2.44834
Full model ln_yyx : 2507.17747 nats/sec, 111.07358 nats/event
Full model Log loss : -2.47633
Full model ln_yyx : 2505.39030 nats/sec, 110.99440 nats/event
Full model Log loss : -2.47637
Full model ln_yyx : 2493.87215 nats/sec, 110.48412 nats/event
Full model Log loss : -2.47695
Full model ln_yyx : 2497.25401 nats/sec, 110.63395 nats/event
Full model Log loss : -2.47430
Full model ln_yyx : 2498.25273 nats/sec, 110.67819 nats/event
Full model Log loss : -2.47661
Full model ln_yyx : 2494.22548 nats/sec, 110.49978 nats/event
Full model Log loss : -2.47958
Full model ln_yyx : 2506.43102 nats/sec, 111.04051 nats/event
Full model Log loss : -2.47728
Full model ln_yyx : 2503.91124 nats/sec, 110.92888 nats/event
Full model Log loss : -2.47602
Optimization finished. Config saved to results/opt-full/opt_full_254_best_config.txt
