[I 2026-03-18 17:30:49,913] Trial 49 pruned. 

Source events: 3828
Target events: 3403
Full model ln_yyx : 25.06855 nats/sec, 6.62994 nats/event
Full model Log loss : -0.56926
Full model ln_yyx : 25.26680 nats/sec, 6.68237 nats/event
Full model Log loss : -0.58182
Full model ln_yyx : 24.51205 nats/sec, 6.48276 nats/event
Full model Log loss : -0.56214
Full model ln_yyx : 24.19488 nats/sec, 6.39888 nats/event
Full model Log loss : -0.56645
Full model ln_yyx : 24.37465 nats/sec, 6.44643 nats/event
Full model Log loss : -0.56430
Full model ln_yyx : 24.74597 nats/sec, 6.54463 nats/event
Full model Log loss : -0.57462
Full model ln_yyx : 24.64526 nats/sec, 6.51800 nats/event
Full model Log loss : -0.57284
Full model ln_yyx : 24.97837 nats/sec, 6.60609 nats/event
Full model Log loss : -0.57573
Full model ln_yyx : 23.98592 nats/sec, 6.34362 nats/event
Full model Log loss : -0.54884
Full model ln_yyx : 24.75353 nats/sec, 6.54663 nats/event
Full model Log loss : -0.57437
Full model ln_yyx : 24.94869 nats/sec, 6.59824 nats/event
Full model Log loss : -0.58442
Full model ln_yyx : 24.89969 nats/sec, 6.58528 nats/event
Full model Log loss : -0.55759
Full model ln_yyx : 24.43588 nats/sec, 6.46262 nats/event
Full model Log loss : -0.57322
Full model ln_yyx : 24.30634 nats/sec, 6.42836 nats/event
Full model Log loss : -0.57240
Full model ln_yyx : 24.45778 nats/sec, 6.46841 nats/event
Full model Log loss : -0.57332
Full model ln_yyx : 25.02323 nats/sec, 6.61796 nats/event
Full model Log loss : -0.58433
Optimization finished. Config saved to results/opt-full/opt_full_54_best_config.txt
[I 2026-03-18 17:30:50,308] Trial 19 pruned. 
[I 2026-03-18 17:30:52,630] Trial 22 pruned. 
[I 2026-03-18 17:30:56,223] Trial 14 finished with value: -2.9577338167178033 and parameters: {'n_layers_yyx': 1, 'hidden_size_yyx_l0': 5, 'context_size_yyx': 3, 'num_mix_components_yyx': 5, 'context_extractor_yyx': 'gru', 'activation_func_yyx': 'Tanh', 'L2_weight_yyx': 8.543562535841133e-10, 'L_entropy_weight_yyx': 6.266561757717814e-07, 'L_sep_weight_yyx': 7.11933621714123e-08, 'L_scale_weight_yyx': 1.112166576067722e-05, 'learning_rate_yyx': 0.005500096938935434}. Best is trial 4 with value: -2.961367919552152.
[I 2026-03-18 17:30:58,243] Trial 15 finished with value: -2.915498965326368 and parameters: {'n_layers_yyx': 2, 'hidden_size_yyx_l0': 4, 'hidden_size_yyx_l1': 6, 'context_size_yyx': 3, 'num_mix_components_yyx': 4, 'context_extractor_yyx': 'lstm', 'activation_func_yyx': 'ReLU', 'L2_weight_yyx': 1.9177480196262174e-08, 'L_entropy_weight_yyx': 1.2701926517384857e-06, 'L_sep_weight_yyx': 9.98016050017765e-06, 'L_scale_weight_yyx': 4.649334133031348e-07, 'learning_rate_yyx': 0.004276227542099209}. Best is trial 14 with value: -2.9272898002158976.
[I 2026-03-18 17:31:08,184] Trial 20 pruned. 
[I 2026-03-18 17:31:13,819] Trial 20 pruned. 
[I 2026-03-18 17:31:15,579] Trial 45 finished with value: -0.5558510298906035 and parameters: {'n_layers_yyx': 1, 'hidden_size_yyx_l0': 5, 'context_size_yyx': 3, 'num_mix_components_yyx': 4, 'context_extractor_yyx': 'lstm', 'activation_func_yyx': 'Tanh', 'L2_weight_yyx': 1.0810097098477554e-08, 'L_entropy_weight_yyx': 8.5540272683872e-05, 'L_sep_weight_yyx': 1.0717287059272535e-10, 'L_scale_weight_yyx': 7.40719957536325e-07, 'learning_rate_yyx': 0.00748230624850144}. Best is trial 35 with value: -0.5770481114866317.
[I 2026-03-18 17:31:16,175] Trial 16 pruned. 
[I 2026-03-18 17:31:17,013] Trial 21 pruned. 
[I 2026-03-18 17:31:21,424] Trial 46 pruned. 
[I 2026-03-18 17:31:21,753] Trial 15 pruned. 
[I 2026-03-18 17:31:22,834] Trial 21 pruned. 
[I 2026-03-18 17:31:26,135] Trial 22 pruned. 
[I 2026-03-18 17:31:27,095] Trial 47 pruned. 
[I 2026-03-18 17:31:29,146] Trial 24 finished with value: -2.9566377379109148 and parameters: {'n_layers_yyx': 2, 'hidden_size_yyx_l0': 4, 'hidden_size_yyx_l1': 3, 'context_size_yyx': 3, 'num_mix_components_yyx': 3, 'context_extractor_yyx': 'lstm', 'activation_func_yyx': 'ReLU', 'L2_weight_yyx': 8.63655654919222e-10, 'L_entropy_weight_yyx': 2.040775870057281e-08, 'L_sep_weight_yyx': 1.75376765887895e-05, 'L_scale_weight_yyx': 6.174841671631605e-07, 'learning_rate_yyx': 0.0076800144777392065}. Best is trial 6 with value: -2.966045431578574.
[I 2026-03-18 17:31:29,629] Trial 16 pruned. 
[I 2026-03-18 17:31:31,387] Trial 22 pruned. 
[I 2026-03-18 17:31:34,128] Trial 14 pruned. 
[I 2026-03-18 17:31:34,173] Trial 31 finished with value: -2.9435408491710793 and parameters: {'n_layers_yyx': 2, 'hidden_size_yyx_l0': 5, 'hidden_size_yyx_l1': 5, 'context_size_yyx': 3, 'num_mix_components_yyx': 5, 'context_extractor_yyx': 'gru', 'activation_func_yyx': 'ReLU', 'L2_weight_yyx': 2.774430798727255e-05, 'L_entropy_weight_yyx': 5.709865319971315e-10, 'L_sep_weight_yyx': 2.0934617174139238e-09, 'L_scale_weight_yyx': 0.0007328228203566629, 'learning_rate_yyx': 0.007920398573156687}. Best is trial 0 with value: -2.957957273051406.
[I 2026-03-18 17:31:38,022] Trial 17 pruned. 
[I 2026-03-18 17:31:39,088] Trial 23 pruned. 
[I 2026-03-18 17:31:46,385] Trial 25 pruned. 
[I 2026-03-18 17:31:46,725] Trial 18 pruned. 
[I 2026-03-18 17:31:49,849] Trial 23 pruned. 
[I 2026-03-18 17:31:52,208] Trial 32 pruned. 
[I 2026-03-18 17:31:55,188] Trial 19 pruned. 
[I 2026-03-18 17:31:57,672] Trial 24 pruned. 
[I 2026-03-18 17:32:03,526] Trial 17 pruned. 
[I 2026-03-18 17:32:13,098] Trial 20 pruned. 
[I 2026-03-18 17:32:14,113] Trial 48 finished with value: -0.5784843686194334 and parameters: {'n_layers_yyx': 2, 'hidden_size_yyx_l0': 3, 'hidden_size_yyx_l1': 6, 'context_size_yyx': 1, 'num_mix_components_yyx': 4, 'context_extractor_yyx': 'lstm', 'activation_func_yyx': 'GELU', 'L2_weight_yyx': 3.642029232660838e-06, 'L_entropy_weight_yyx': 3.047378247647497e-09, 'L_sep_weight_yyx': 3.9309265952501175e-09, 'L_scale_weight_yyx': 8.586299229204261e-10, 'learning_rate_yyx': 0.008496572777396579}. Best is trial 48 with value: -0.5784843686194334.
[I 2026-03-18 17:32:15,789] Trial 25 pruned. 
[I 2026-03-18 17:32:17,905] Trial 12 pruned. 
[I 2026-03-18 17:32:19,899] Trial 28 finished with value: -2.942295399568205 and parameters: {'n_layers_yyx': 1, 'hidden_size_yyx_l0': 5, 'context_size_yyx': 3, 'num_mix_components_yyx': 3, 'context_extractor_yyx': 'gru', 'activation_func_yyx': 'ReLU', 'L2_weight_yyx': 4.186421384448771e-09, 'L_entropy_weight_yyx': 1.2710266297768522e-05, 'L_sep_weight_yyx': 6.330129575177063e-07, 'L_scale_weight_yyx': 2.1164353148651713e-09, 'learning_rate_yyx': 0.009731222394157326}. Best is trial 15 with value: -2.9509930170610343.
[I 2026-03-18 17:32:24,211] Trial 26 pruned. 
[I 2026-03-18 17:32:28,884] Trial 29 pruned. 
[I 2026-03-18 17:32:31,039] Trial 21 pruned. 
[I 2026-03-18 17:32:31,957] Trial 27 pruned. 
[I 2026-03-18 17:32:37,243] Trial 30 pruned. 
[I 2026-03-18 17:32:40,182] Trial 49 pruned. 

Source events: 3828
Target events: 20800
Full model ln_yyx : 148.31549 nats/sec, 6.41750 nats/event
Full model Log loss : -0.54422
Full model ln_yyx : 147.55569 nats/sec, 6.38462 nats/event
Full model Log loss : -0.54679
Full model ln_yyx : 151.94771 nats/sec, 6.57466 nats/event
Full model Log loss : -0.55769
Full model ln_yyx : 149.76890 nats/sec, 6.48039 nats/event
Full model Log loss : -0.54623
Full model ln_yyx : 151.58694 nats/sec, 6.55905 nats/event
Full model Log loss : -0.55542
Full model ln_yyx : 148.66910 nats/sec, 6.43280 nats/event
Full model Log loss : -0.53712
Full model ln_yyx : 152.45560 nats/sec, 6.59664 nats/event
Full model Log loss : -0.56219
Full model ln_yyx : 152.51856 nats/sec, 6.59936 nats/event
Full model Log loss : -0.57467
Full model ln_yyx : 154.26824 nats/sec, 6.67507 nats/event
Full model Log loss : -0.56740
Full model ln_yyx : 151.11609 nats/sec, 6.53868 nats/event
Full model Log loss : -0.55792
Full model ln_yyx : 153.12674 nats/sec, 6.62568 nats/event
Full model Log loss : -0.57018
Full model ln_yyx : 154.05042 nats/sec, 6.66564 nats/event
Full model Log loss : -0.56685
Full model ln_yyx : 151.55874 nats/sec, 6.55783 nats/event
Full model Log loss : -0.57510
Full model ln_yyx : 152.24111 nats/sec, 6.58736 nats/event
Full model Log loss : -0.57705
Full model ln_yyx : 153.99099 nats/sec, 6.66307 nats/event
Full model Log loss : -0.55585
Full model ln_yyx : 151.51855 nats/sec, 6.55609 nats/event
Full model Log loss : -0.57848
Optimization finished. Config saved to results/opt-full/opt_full_51_best_config.txt
[I 2026-03-18 17:32:40,517] Trial 28 pruned. 
[I 2026-03-18 17:32:41,966] Trial 19 finished with value: -2.8861502105303725 and parameters: {'n_layers_yyx': 2, 'hidden_size_yyx_l0': 4, 'hidden_size_yyx_l1': 2, 'context_size_yyx': 3, 'num_mix_components_yyx': 3, 'context_extractor_yyx': 'gru', 'activation_func_yyx': 'ReLU', 'L2_weight_yyx': 2.147887235189573e-10, 'L_entropy_weight_yyx': 1.5201904745644937e-07, 'L_sep_weight_yyx': 4.310113938802204e-07, 'L_scale_weight_yyx': 2.2271668378163472e-10, 'learning_rate_yyx': 0.005011922568643977}. Best is trial 8 with value: -2.955956673037092.
[I 2026-03-18 17:32:44,355] Trial 35 finished with value: -2.8635768842288356 and parameters: {'n_layers_yyx': 2, 'hidden_size_yyx_l0': 5, 'hidden_size_yyx_l1': 6, 'context_size_yyx': 4, 'num_mix_components_yyx': 1, 'context_extractor_yyx': 'lstm', 'activation_func_yyx': 'Tanh', 'L2_weight_yyx': 1.5553496663351635e-08, 'L_entropy_weight_yyx': 1.9770468015271468e-07, 'L_sep_weight_yyx': 1.440966085027734e-07, 'L_scale_weight_yyx': 1.6476439900393625e-09, 'learning_rate_yyx': 0.0006067264463433972}. Best is trial 20 with value: -2.9549177653610377.
[I 2026-03-18 17:32:48,132] Trial 22 pruned. 
[I 2026-03-18 17:32:49,587] Trial 20 pruned. 
[I 2026-03-18 17:32:50,357] Trial 31 finished with value: -2.9490319202478883 and parameters: {'n_layers_yyx': 2, 'hidden_size_yyx_l0': 6, 'hidden_size_yyx_l1': 6, 'context_size_yyx': 3, 'num_mix_components_yyx': 5, 'context_extractor_yyx': 'gru', 'activation_func_yyx': 'Tanh', 'L2_weight_yyx': 5.956649697106532e-07, 'L_entropy_weight_yyx': 1.6910087111956846e-08, 'L_sep_weight_yyx': 8.895398071733047e-08, 'L_scale_weight_yyx': 4.047311609901791e-10, 'learning_rate_yyx': 0.005229560384746314}. Best is trial 12 with value: -2.9595510816550052.
[I 2026-03-18 17:32:53,447] Trial 17 finished with value: -2.9631792723501325 and parameters: {'n_layers_yyx': 1, 'hidden_size_yyx_l0': 5, 'context_size_yyx': 4, 'num_mix_components_yyx': 2, 'context_extractor_yyx': 'gru', 'activation_func_yyx': 'Tanh', 'L2_weight_yyx': 3.111272487500297e-08, 'L_entropy_weight_yyx': 1.0292999516591897e-10, 'L_sep_weight_yyx': 0.0008162703145261199, 'L_scale_weight_yyx': 8.055776265516755e-08, 'learning_rate_yyx': 0.006321054086303678}. Best is trial 17 with value: -2.9631792723501325.
[I 2026-03-18 17:32:53,991] Trial 31 pruned. 
[I 2026-03-18 17:32:55,516] Trial 23 pruned. 
[I 2026-03-18 17:32:57,027] Trial 29 pruned. 
[I 2026-03-18 17:33:01,546] Trial 18 pruned. 
[I 2026-03-18 17:33:01,713] Trial 36 pruned. 
[I 2026-03-18 17:33:02,021] Trial 32 pruned. 
[I 2026-03-18 17:33:02,683] Trial 13 pruned. 
[I 2026-03-18 17:33:04,422] Trial 30 pruned. 
[I 2026-03-18 17:33:07,743] Trial 21 pruned. 
[I 2026-03-18 17:33:11,484] Trial 14 pruned. 
[I 2026-03-18 17:33:11,930] Trial 24 pruned. 
[I 2026-03-18 17:33:20,697] Trial 15 finished with value: -2.9518350045648503 and parameters: {'n_layers_yyx': 1, 'hidden_size_yyx_l0': 5, 'context_size_yyx': 4, 'num_mix_components_yyx': 5, 'context_extractor_yyx': 'gru', 'activation_func_yyx': 'Tanh', 'L2_weight_yyx': 2.393085024620582e-10, 'L_entropy_weight_yyx': 1.1158979171599555e-06, 'L_sep_weight_yyx': 1.508739238393941e-07, 'L_scale_weight_yyx': 0.0007412875420166706, 'learning_rate_yyx': 0.005967000723592629}. Best is trial 4 with value: -2.961367919552152.
[I 2026-03-18 17:33:20,817] Trial 33 pruned. 
[I 2026-03-18 17:33:28,889] Trial 25 pruned. 
[I 2026-03-18 17:33:29,208] Trial 15 pruned. 
[I 2026-03-18 17:33:38,638] Trial 16 pruned. 
[I 2026-03-18 17:33:46,931] Trial 26 pruned. 
[I 2026-03-18 17:33:48,794] Trial 33 finished with value: -2.9014612179600827 and parameters: {'n_layers_yyx': 2, 'hidden_size_yyx_l0': 5, 'hidden_size_yyx_l1': 5, 'context_size_yyx': 2, 'num_mix_components_yyx': 4, 'context_extractor_yyx': 'gru', 'activation_func_yyx': 'ReLU', 'L2_weight_yyx': 0.00011910277290664044, 'L_entropy_weight_yyx': 8.390513253582133e-10, 'L_sep_weight_yyx': 3.873908689159818e-09, 'L_scale_weight_yyx': 0.00040942287980931676, 'learning_rate_yyx': 0.00863690218600877}. Best is trial 0 with value: -2.957957273051406.
[I 2026-03-18 17:33:52,220] Trial 22 finished with value: -2.9547466022224063 and parameters: {'n_layers_yyx': 1, 'hidden_size_yyx_l0': 5, 'context_size_yyx': 3, 'num_mix_components_yyx': 3, 'context_extractor_yyx': 'gru', 'activation_func_yyx': 'GELU', 'L2_weight_yyx': 1.8406392961484945e-10, 'L_entropy_weight_yyx': 6.840411794761574e-09, 'L_sep_weight_yyx': 6.648862182328819e-08, 'L_scale_weight_yyx': 9.037160739795256e-05, 'learning_rate_yyx': 0.009823853360792622}. Best is trial 3 with value: -2.95615718224045.
[I 2026-03-18 17:33:56,514] Trial 27 pruned. 
[I 2026-03-18 17:34:15,613] Trial 28 pruned. 
[I 2026-03-18 17:34:28,365] Trial 17 pruned. 
[I 2026-03-18 17:34:33,236] Trial 24 finished with value: -2.9620979508722423 and parameters: {'n_layers_yyx': 2, 'hidden_size_yyx_l0': 3, 'hidden_size_yyx_l1': 3, 'context_size_yyx': 2, 'num_mix_components_yyx': 5, 'context_extractor_yyx': 'gru', 'activation_func_yyx': 'Tanh', 'L2_weight_yyx': 1.0197871597178984e-07, 'L_entropy_weight_yyx': 5.358174822585602e-07, 'L_sep_weight_yyx': 1.9688658307736521e-07, 'L_scale_weight_yyx': 3.335339473318457e-07, 'learning_rate_yyx': 0.006615457491897757}. Best is trial 0 with value: -2.973312761552399.
[I 2026-03-18 17:34:39,683] Trial 34 pruned. 
[I 2026-03-18 17:34:40,805] Trial 23 pruned. 
[I 2026-03-18 17:34:48,633] Trial 26 finished with value: -2.9510978202415847 and parameters: {'n_layers_yyx': 2, 'hidden_size_yyx_l0': 4, 'hidden_size_yyx_l1': 3, 'context_size_yyx': 4, 'num_mix_components_yyx': 3, 'context_extractor_yyx': 'gru', 'activation_func_yyx': 'ReLU', 'L2_weight_yyx': 4.502044314926684e-08, 'L_entropy_weight_yyx': 2.3313939056313325e-07, 'L_sep_weight_yyx': 1.2102376364859939e-06, 'L_scale_weight_yyx': 0.00010690350989582604, 'learning_rate_yyx': 0.007943599745675753}. Best is trial 6 with value: -2.966045431578574.
[I 2026-03-18 17:34:52,937] Trial 25 pruned. 
[I 2026-03-18 17:34:55,653] Trial 22 finished with value: -2.9117218874509865 and parameters: {'n_layers_yyx': 2, 'hidden_size_yyx_l0': 3, 'hidden_size_yyx_l1': 5, 'context_size_yyx': 4, 'num_mix_components_yyx': 4, 'context_extractor_yyx': 'gru', 'activation_func_yyx': 'GELU', 'L2_weight_yyx': 0.0007846875313142802, 'L_entropy_weight_yyx': 6.688271925947986e-07, 'L_sep_weight_yyx': 1.2277871892659674e-06, 'L_scale_weight_yyx': 1.2054556404409616e-09, 'learning_rate_yyx': 0.009504556921094948}. Best is trial 8 with value: -2.955956673037092.
[I 2026-03-18 17:35:02,692] Trial 29 pruned. 
[I 2026-03-18 17:35:04,604] Trial 23 finished with value: -2.9542045708741957 and parameters: {'n_layers_yyx': 1, 'hidden_size_yyx_l0': 4, 'context_size_yyx': 4, 'num_mix_components_yyx': 4, 'context_extractor_yyx': 'lstm', 'activation_func_yyx': 'ReLU', 'L2_weight_yyx': 9.270137728355305e-09, 'L_entropy_weight_yyx': 3.35564720982642e-10, 'L_sep_weight_yyx': 7.949871201721502e-09, 'L_scale_weight_yyx': 1.766409163882978e-07, 'learning_rate_yyx': 0.0026823737813795033}. Best is trial 23 with value: -2.9542045708741957.
[I 2026-03-18 17:35:05,668] Trial 15 finished with value: -2.910849336055692 and parameters: {'n_layers_yyx': 1, 'hidden_size_yyx_l0': 3, 'context_size_yyx': 2, 'num_mix_components_yyx': 5, 'context_extractor_yyx': 'gru', 'activation_func_yyx': 'ReLU', 'L2_weight_yyx': 0.0001236213240558515, 'L_entropy_weight_yyx': 2.482321816959418e-08, 'L_sep_weight_yyx': 1.2958120960991221e-08, 'L_scale_weight_yyx': 4.7468981954481004e-09, 'learning_rate_yyx': 0.00624808495650605}. Best is trial 12 with value: -2.9416514371178453.
[I 2026-03-18 17:35:07,903] Trial 27 pruned. 
[I 2026-03-18 17:35:09,372] Trial 32 finished with value: -2.9492527610174766 and parameters: {'n_layers_yyx': 2, 'hidden_size_yyx_l0': 6, 'hidden_size_yyx_l1': 6, 'context_size_yyx': 3, 'num_mix_components_yyx': 5, 'context_extractor_yyx': 'gru', 'activation_func_yyx': 'Tanh', 'L2_weight_yyx': 6.364240152414484e-07, 'L_entropy_weight_yyx': 4.5455249866237106e-08, 'L_sep_weight_yyx': 5.181722730878373e-07, 'L_scale_weight_yyx': 6.869374408786739e-10, 'learning_rate_yyx': 0.005455194461794562}. Best is trial 12 with value: -2.9595510816550052.
[I 2026-03-18 17:35:13,064] Trial 24 pruned. 
[I 2026-03-18 17:35:20,961] Trial 30 pruned. 
[I 2026-03-18 17:35:22,459] Trial 25 pruned. 
[I 2026-03-18 17:35:29,765] Trial 33 pruned. 
[I 2026-03-18 17:35:30,404] Trial 31 pruned. 
[I 2026-03-18 17:35:31,767] Trial 26 pruned. 
[I 2026-03-18 17:35:31,807] Trial 18 finished with value: -2.936145807478804 and parameters: {'n_layers_yyx': 2, 'hidden_size_yyx_l0': 4, 'hidden_size_yyx_l1': 5, 'context_size_yyx': 3, 'num_mix_components_yyx': 4, 'context_extractor_yyx': 'lstm', 'activation_func_yyx': 'ReLU', 'L2_weight_yyx': 1.1559618071418125e-07, 'L_entropy_weight_yyx': 5.140440391766945e-05, 'L_sep_weight_yyx': 1.3576914297560719e-06, 'L_scale_weight_yyx': 3.820330833059329e-09, 'learning_rate_yyx': 0.0059210895585695335}. Best is trial 18 with value: -2.936145807478804.
[I 2026-03-18 17:35:31,992] Trial 35 pruned. 
[I 2026-03-18 17:35:38,287] Trial 32 pruned. 
[I 2026-03-18 17:35:40,445] Trial 27 pruned. 
[I 2026-03-18 17:35:41,143] Trial 26 pruned. 
[I 2026-03-18 17:35:45,049] Trial 23 pruned. 
[I 2026-03-18 17:35:46,549] Trial 33 pruned. 
[I 2026-03-18 17:35:48,047] Trial 34 pruned. 
[I 2026-03-18 17:35:54,070] Trial 24 pruned. 
[I 2026-03-18 17:35:57,552] Trial 28 pruned. 
[I 2026-03-18 17:35:58,574] Trial 24 finished with value: -2.9686238360537223 and parameters: {'n_layers_yyx': 2, 'hidden_size_yyx_l0': 6, 'hidden_size_yyx_l1': 3, 'context_size_yyx': 4, 'num_mix_components_yyx': 5, 'context_extractor_yyx': 'gru', 'activation_func_yyx': 'Tanh', 'L2_weight_yyx': 1.3122731872332802e-07, 'L_entropy_weight_yyx': 4.889610425062265e-06, 'L_sep_weight_yyx': 9.086052229179978e-06, 'L_scale_weight_yyx': 3.425640232846205e-08, 'learning_rate_yyx': 0.001973032344946567}. Best is trial 0 with value: -2.9702180140077377.
[I 2026-03-18 17:36:04,711] Trial 34 pruned. 
[I 2026-03-18 17:36:06,348] Trial 35 pruned. 
[I 2026-03-18 17:36:07,651] Trial 25 pruned. 
[I 2026-03-18 17:36:29,049] Trial 28 pruned. 
[I 2026-03-18 17:36:44,813] Trial 25 pruned. 
[I 2026-03-18 17:36:49,515] Trial 19 finished with value: -2.955651726196104 and parameters: {'n_layers_yyx': 1, 'hidden_size_yyx_l0': 5, 'context_size_yyx': 4, 'num_mix_components_yyx': 2, 'context_extractor_yyx': 'gru', 'activation_func_yyx': 'ReLU', 'L2_weight_yyx': 1.1501408032020884e-08, 'L_entropy_weight_yyx': 0.0001859376162766678, 'L_sep_weight_yyx': 4.837344576797847e-06, 'L_scale_weight_yyx': 1.8838005132037678e-09, 'learning_rate_yyx': 0.006134047309882025}. Best is trial 17 with value: -2.9631792723501325.
[I 2026-03-18 17:36:52,224] Trial 35 pruned. 
[I 2026-03-18 17:36:55,956] Trial 36 pruned. 
[I 2026-03-18 17:36:57,467] Trial 26 pruned. 
[I 2026-03-18 17:37:06,760] Trial 37 finished with value: -2.980594852387875 and parameters: {'n_layers_yyx': 2, 'hidden_size_yyx_l0': 3, 'hidden_size_yyx_l1': 4, 'context_size_yyx': 3, 'num_mix_components_yyx': 3, 'context_extractor_yyx': 'lstm', 'activation_func_yyx': 'Tanh', 'L2_weight_yyx': 9.12098900720985e-06, 'L_entropy_weight_yyx': 1.845180489453184e-06, 'L_sep_weight_yyx': 3.418113304243821e-05, 'L_scale_weight_yyx': 3.460368173637042e-09, 'learning_rate_yyx': 0.004706220500867913}. Best is trial 37 with value: -2.980594852387875.
[I 2026-03-18 17:37:08,727] Trial 20 pruned. 
[I 2026-03-18 17:37:08,801] Trial 16 finished with value: -2.963804985472295 and parameters: {'n_layers_yyx': 2, 'hidden_size_yyx_l0': 5, 'hidden_size_yyx_l1': 5, 'context_size_yyx': 2, 'num_mix_components_yyx': 5, 'context_extractor_yyx': 'gru', 'activation_func_yyx': 'Tanh', 'L2_weight_yyx': 2.2233234133177197e-08, 'L_entropy_weight_yyx': 7.326391590601618e-05, 'L_sep_weight_yyx': 4.828048997542333e-07, 'L_scale_weight_yyx': 7.769846455948419e-07, 'learning_rate_yyx': 0.004658216133633628}. Best is trial 5 with value: -2.9729516240610265.
[I 2026-03-18 17:37:11,078] Trial 34 finished with value: -2.96234983443252 and parameters: {'n_layers_yyx': 1, 'hidden_size_yyx_l0': 5, 'context_size_yyx': 3, 'num_mix_components_yyx': 3, 'context_extractor_yyx': 'gru', 'activation_func_yyx': 'GELU', 'L2_weight_yyx': 1.9290191062986e-08, 'L_entropy_weight_yyx': 1.021796803240122e-05, 'L_sep_weight_yyx': 0.0002857596719026457, 'L_scale_weight_yyx': 5.61987596242966e-08, 'learning_rate_yyx': 0.005049854102069508}. Best is trial 34 with value: -2.96234983443252.
[I 2026-03-18 17:37:11,206] Trial 36 pruned. 
[I 2026-03-18 17:37:16,465] Trial 31 finished with value: -2.933534930946246 and parameters: {'n_layers_yyx': 1, 'hidden_size_yyx_l0': 6, 'context_size_yyx': 2, 'num_mix_components_yyx': 3, 'context_extractor_yyx': 'gru', 'activation_func_yyx': 'GELU', 'L2_weight_yyx': 2.5119089769819575e-08, 'L_entropy_weight_yyx': 0.00018567565995699292, 'L_sep_weight_yyx': 2.4407235637395384e-05, 'L_scale_weight_yyx': 5.487692099287339e-07, 'learning_rate_yyx': 0.007782937578259984}. Best is trial 9 with value: -2.9510968045279404.
[I 2026-03-18 17:37:16,691] Trial 27 pruned. 
[I 2026-03-18 17:37:18,644] Trial 17 pruned. 
[I 2026-03-18 17:37:18,886] Trial 21 pruned. 
[I 2026-03-18 17:37:20,866] Trial 35 pruned. 
[I 2026-03-18 17:37:21,564] Trial 37 pruned. 
