[I 2026-03-18 17:15:37,245] Trial 27 finished with value: -0.5730684429940036 and parameters: {'n_layers_yyx': 1, 'hidden_size_yyx_l0': 6, 'context_size_yyx': 4, 'num_mix_components_yyx': 3, 'context_extractor_yyx': 'lstm', 'activation_func_yyx': 'GELU', 'L2_weight_yyx': 0.0003337264067335813, 'L_entropy_weight_yyx': 0.0009166168171161307, 'L_sep_weight_yyx': 5.680030586578356e-06, 'L_scale_weight_yyx': 1.479806546323214e-07, 'learning_rate_yyx': 0.0010834698701296035}. Best is trial 15 with value: -0.5780454108278886.
[I 2026-03-18 17:15:38,917] Trial 26 pruned. 
[I 2026-03-18 17:15:39,266] Trial 22 pruned. 
[I 2026-03-18 17:15:40,427] Trial 15 pruned. 
[I 2026-03-18 17:15:42,904] Trial 27 pruned. 
[I 2026-03-18 17:15:49,396] Trial 37 pruned. 
[I 2026-03-18 17:15:50,579] Trial 27 pruned. 
[I 2026-03-18 17:15:52,617] Trial 48 pruned. 
[I 2026-03-18 17:15:52,705] Trial 16 pruned. 
[I 2026-03-18 17:15:54,470] Trial 28 pruned. 
[I 2026-03-18 17:15:58,424] Trial 28 pruned. 
[I 2026-03-18 17:16:03,058] Trial 8 pruned. 
[I 2026-03-18 17:16:05,565] Trial 49 pruned. 

Source events: 3828
Target events: 8618
Full model ln_yyx : 62.83858 nats/sec, 6.56239 nats/event
Full model Log loss : -0.56603
Full model ln_yyx : 61.96135 nats/sec, 6.47078 nats/event
Full model Log loss : -0.55303
Full model ln_yyx : 61.54866 nats/sec, 6.42769 nats/event
Full model Log loss : -0.55576
Full model ln_yyx : 61.97621 nats/sec, 6.47234 nats/event
Full model Log loss : -0.56589
Full model ln_yyx : 61.54600 nats/sec, 6.42741 nats/event
Full model Log loss : -0.55739
Optimization finished. Config saved to results/opt-full/opt_full_63_best_config.txt
[I 2026-03-18 17:16:06,111] Trial 6 finished with value: -2.9579473841169066 and parameters: {'n_layers_yyx': 2, 'hidden_size_yyx_l0': 3, 'hidden_size_yyx_l1': 5, 'context_size_yyx': 3, 'num_mix_components_yyx': 2, 'context_extractor_yyx': 'gru', 'activation_func_yyx': 'GELU', 'L2_weight_yyx': 9.675607788343465e-08, 'L_entropy_weight_yyx': 1.3583537848077025e-08, 'L_sep_weight_yyx': 0.0009953419695404012, 'L_scale_weight_yyx': 5.8922084117307025e-06, 'learning_rate_yyx': 0.008691407670350117}. Best is trial 5 with value: -2.9729516240610265.
[I 2026-03-18 17:16:07,443] Trial 29 pruned. 
[I 2026-03-18 17:16:10,495] Trial 38 pruned. 
[I 2026-03-18 17:16:11,852] Trial 34 finished with value: -0.5735646579747679 and parameters: {'n_layers_yyx': 1, 'hidden_size_yyx_l0': 5, 'context_size_yyx': 2, 'num_mix_components_yyx': 4, 'context_extractor_yyx': 'lstm', 'activation_func_yyx': 'ReLU', 'L2_weight_yyx': 1.5487052040339373e-05, 'L_entropy_weight_yyx': 2.9181335078144257e-07, 'L_sep_weight_yyx': 1.7153648814590122e-09, 'L_scale_weight_yyx': 3.5223624808467303e-09, 'learning_rate_yyx': 0.005274658361962851}. Best is trial 15 with value: -0.5782953233469631.
[I 2026-03-18 17:16:14,711] Trial 28 pruned. 
[I 2026-03-18 17:16:16,536] Trial 22 pruned. 
[I 2026-03-18 17:16:18,076] Trial 24 pruned. 
[I 2026-03-18 17:16:18,142] Trial 30 pruned. 
[I 2026-03-18 17:16:19,540] Trial 16 pruned. 
[I 2026-03-18 17:16:20,703] Trial 39 pruned. 
[I 2026-03-18 17:16:30,582] Trial 9 pruned. 
[I 2026-03-18 17:16:32,105] Trial 4 finished with value: -2.8397157085224407 and parameters: {'n_layers_yyx': 1, 'hidden_size_yyx_l0': 5, 'context_size_yyx': 4, 'num_mix_components_yyx': 1, 'context_extractor_yyx': 'gru', 'activation_func_yyx': 'GELU', 'L2_weight_yyx': 9.579357360128442e-08, 'L_entropy_weight_yyx': 9.827480705645878e-08, 'L_sep_weight_yyx': 2.371688732781326e-06, 'L_scale_weight_yyx': 9.99543286042099e-07, 'learning_rate_yyx': 0.004525779537909431}. Best is trial 3 with value: -2.95615718224045.
[I 2026-03-18 17:16:36,632] Trial 29 pruned. 
[I 2026-03-18 17:16:37,018] Trial 23 pruned. 
[I 2026-03-18 17:16:38,814] Trial 31 pruned. 
[I 2026-03-18 17:16:42,767] Trial 40 pruned. 
[I 2026-03-18 17:16:43,919] Trial 40 finished with value: -0.47338191643587946 and parameters: {'n_layers_yyx': 2, 'hidden_size_yyx_l0': 2, 'hidden_size_yyx_l1': 6, 'context_size_yyx': 1, 'num_mix_components_yyx': 5, 'context_extractor_yyx': 'lstm', 'activation_func_yyx': 'Tanh', 'L2_weight_yyx': 3.3866910403813586e-05, 'L_entropy_weight_yyx': 4.795815917414246e-05, 'L_sep_weight_yyx': 7.934143006547618e-05, 'L_scale_weight_yyx': 7.207910548626184e-05, 'learning_rate_yyx': 0.006359774007201807}. Best is trial 40 with value: -0.47338191643587946.
[I 2026-03-18 17:16:45,242] Trial 11 finished with value: -2.9178526396091575 and parameters: {'n_layers_yyx': 2, 'hidden_size_yyx_l0': 4, 'hidden_size_yyx_l1': 5, 'context_size_yyx': 4, 'num_mix_components_yyx': 4, 'context_extractor_yyx': 'gru', 'activation_func_yyx': 'GELU', 'L2_weight_yyx': 0.0005618620164709527, 'L_entropy_weight_yyx': 2.4310734419012558e-06, 'L_sep_weight_yyx': 2.6415344812582397e-06, 'L_scale_weight_yyx': 6.800674349985911e-09, 'learning_rate_yyx': 0.008113619382128623}. Best is trial 8 with value: -2.955956673037092.
[I 2026-03-18 17:16:46,426] Trial 23 finished with value: -0.574758663466085 and parameters: {'n_layers_yyx': 1, 'hidden_size_yyx_l0': 3, 'context_size_yyx': 3, 'num_mix_components_yyx': 5, 'context_extractor_yyx': 'gru', 'activation_func_yyx': 'ReLU', 'L2_weight_yyx': 9.880072469470063e-07, 'L_entropy_weight_yyx': 1.210364409900511e-07, 'L_sep_weight_yyx': 0.0009298830754733719, 'L_scale_weight_yyx': 0.0002720782075172153, 'learning_rate_yyx': 0.005120662709981237}. Best is trial 17 with value: -0.5864613361174992.
[I 2026-03-18 17:16:46,777] Trial 7 pruned. 
[I 2026-03-18 17:16:50,272] Trial 29 pruned. 
[I 2026-03-18 17:16:50,501] Trial 32 pruned. 
[I 2026-03-18 17:16:53,319] Trial 14 finished with value: -2.9363110917899804 and parameters: {'n_layers_yyx': 2, 'hidden_size_yyx_l0': 3, 'hidden_size_yyx_l1': 5, 'context_size_yyx': 3, 'num_mix_components_yyx': 2, 'context_extractor_yyx': 'gru', 'activation_func_yyx': 'ReLU', 'L2_weight_yyx': 4.491880331378015e-07, 'L_entropy_weight_yyx': 9.233116237774905e-08, 'L_sep_weight_yyx': 1.0418578103341198e-05, 'L_scale_weight_yyx': 2.8755948589855946e-09, 'learning_rate_yyx': 0.0013200867569605817}. Best is trial 14 with value: -2.9363110917899804.
[I 2026-03-18 17:16:54,234] Trial 41 pruned. 
[I 2026-03-18 17:16:56,248] Trial 11 finished with value: -2.9218333865197934 and parameters: {'n_layers_yyx': 1, 'hidden_size_yyx_l0': 6, 'context_size_yyx': 2, 'num_mix_components_yyx': 4, 'context_extractor_yyx': 'gru', 'activation_func_yyx': 'GELU', 'L2_weight_yyx': 2.5082365016444237e-07, 'L_entropy_weight_yyx': 2.5630713845207873e-05, 'L_sep_weight_yyx': 5.099046421187249e-06, 'L_scale_weight_yyx': 4.2581401283136265e-06, 'learning_rate_yyx': 0.009873691907998926}. Best is trial 9 with value: -2.9510968045279404.
[I 2026-03-18 17:16:58,345] Trial 30 pruned. 
[I 2026-03-18 17:16:59,086] Trial 10 pruned. 
[I 2026-03-18 17:16:59,414] Trial 24 pruned. 
[I 2026-03-18 17:17:00,260] Trial 35 finished with value: -0.5641145771766464 and parameters: {'n_layers_yyx': 1, 'hidden_size_yyx_l0': 6, 'context_size_yyx': 3, 'num_mix_components_yyx': 5, 'context_extractor_yyx': 'lstm', 'activation_func_yyx': 'ReLU', 'L2_weight_yyx': 0.0002401734424969577, 'L_entropy_weight_yyx': 7.614445405793605e-07, 'L_sep_weight_yyx': 6.145808159874831e-07, 'L_scale_weight_yyx': 8.526755259742514e-05, 'learning_rate_yyx': 0.009969886630807714}. Best is trial 15 with value: -0.5782953233469631.
[I 2026-03-18 17:17:00,871] Trial 26 finished with value: -0.5702404667619498 and parameters: {'n_layers_yyx': 1, 'hidden_size_yyx_l0': 6, 'context_size_yyx': 4, 'num_mix_components_yyx': 4, 'context_extractor_yyx': 'lstm', 'activation_func_yyx': 'ReLU', 'L2_weight_yyx': 9.945153195486656e-08, 'L_entropy_weight_yyx': 9.152109227703053e-07, 'L_sep_weight_yyx': 6.642051127891921e-06, 'L_scale_weight_yyx': 2.2667332241878905e-10, 'learning_rate_yyx': 0.001326450916180653}. Best is trial 1 with value: -0.5777964847779832.
[I 2026-03-18 17:17:01,168] Trial 8 pruned. 
[I 2026-03-18 17:17:01,639] Trial 21 finished with value: -0.5743689032007608 and parameters: {'n_layers_yyx': 1, 'hidden_size_yyx_l0': 3, 'context_size_yyx': 4, 'num_mix_components_yyx': 3, 'context_extractor_yyx': 'gru', 'activation_func_yyx': 'Tanh', 'L2_weight_yyx': 1.9737596101321604e-09, 'L_entropy_weight_yyx': 4.222247253504864e-06, 'L_sep_weight_yyx': 3.7556221386894096e-09, 'L_scale_weight_yyx': 1.4438420209777012e-08, 'learning_rate_yyx': 0.00921611529912989}. Best is trial 1 with value: -0.5818196838462861.
[I 2026-03-18 17:17:04,887] Trial 42 pruned. 
[I 2026-03-18 17:17:08,003] Trial 9 pruned. 
[I 2026-03-18 17:17:09,062] Trial 31 pruned. 
[I 2026-03-18 17:17:10,655] Trial 33 pruned. 
[I 2026-03-18 17:17:11,784] Trial 30 pruned. 
[I 2026-03-18 17:17:12,055] Trial 11 pruned. 
[I 2026-03-18 17:17:16,407] Trial 25 finished with value: -0.5696770039680408 and parameters: {'n_layers_yyx': 2, 'hidden_size_yyx_l0': 3, 'hidden_size_yyx_l1': 5, 'context_size_yyx': 4, 'num_mix_components_yyx': 5, 'context_extractor_yyx': 'lstm', 'activation_func_yyx': 'Tanh', 'L2_weight_yyx': 4.5749588166826756e-08, 'L_entropy_weight_yyx': 5.171158378336771e-07, 'L_sep_weight_yyx': 4.435509636734679e-05, 'L_scale_weight_yyx': 3.153853239380499e-10, 'learning_rate_yyx': 0.008132693459598116}. Best is trial 0 with value: -0.5748618229547262.
[I 2026-03-18 17:17:17,310] Trial 9 pruned. 
[I 2026-03-18 17:17:21,137] Trial 23 finished with value: -0.3911238631965944 and parameters: {'n_layers_yyx': 2, 'hidden_size_yyx_l0': 4, 'hidden_size_yyx_l1': 4, 'context_size_yyx': 3, 'num_mix_components_yyx': 3, 'context_extractor_yyx': 'gru', 'activation_func_yyx': 'Tanh', 'L2_weight_yyx': 4.3336289898873975e-07, 'L_entropy_weight_yyx': 1.271785941271524e-06, 'L_sep_weight_yyx': 1.3082423882309101e-05, 'L_scale_weight_yyx': 1.942206283828694e-05, 'learning_rate_yyx': 0.0037073406841685386}. Best is trial 12 with value: -0.46022137621238873.
[I 2026-03-18 17:17:23,811] Trial 36 pruned. 
[I 2026-03-18 17:17:24,090] Trial 15 pruned. 
[I 2026-03-18 17:17:24,242] Trial 27 pruned. 
[I 2026-03-18 17:17:24,864] Trial 25 pruned. 
[I 2026-03-18 17:17:27,227] Trial 22 pruned. 
[I 2026-03-18 17:17:35,524] Trial 10 pruned. 
[I 2026-03-18 17:17:38,782] Trial 34 pruned. 
[I 2026-03-18 17:17:40,960] Trial 17 finished with value: -0.5579177877434018 and parameters: {'n_layers_yyx': 1, 'hidden_size_yyx_l0': 4, 'context_size_yyx': 4, 'num_mix_components_yyx': 3, 'context_extractor_yyx': 'gru', 'activation_func_yyx': 'GELU', 'L2_weight_yyx': 4.649249109172976e-09, 'L_entropy_weight_yyx': 0.00013099790218117958, 'L_sep_weight_yyx': 3.5043452801157542e-06, 'L_scale_weight_yyx': 2.9981493443320846e-09, 'learning_rate_yyx': 0.005318273721747106}. Best is trial 13 with value: -0.5746682860992306.
[I 2026-03-18 17:17:41,059] Trial 10 finished with value: -2.8615680066300024 and parameters: {'n_layers_yyx': 1, 'hidden_size_yyx_l0': 6, 'context_size_yyx': 4, 'num_mix_components_yyx': 1, 'context_extractor_yyx': 'gru', 'activation_func_yyx': 'Tanh', 'L2_weight_yyx': 0.0006420845844960161, 'L_entropy_weight_yyx': 1.8778497288469358e-06, 'L_sep_weight_yyx': 2.8852006172354783e-07, 'L_scale_weight_yyx': 1.1845809425992885e-06, 'learning_rate_yyx': 0.003873969529356212}. Best is trial 0 with value: -2.973312761552399.
[I 2026-03-18 17:17:41,476] Trial 31 pruned. 
[I 2026-03-18 17:17:41,825] Trial 28 pruned. 
[I 2026-03-18 17:17:45,781] Trial 35 pruned. 
[I 2026-03-18 17:17:50,609] Trial 24 pruned. 
[I 2026-03-18 17:17:52,559] Trial 35 pruned. 
[I 2026-03-18 17:17:54,000] Trial 11 pruned. 
[I 2026-03-18 17:17:54,370] Trial 32 pruned. 
[I 2026-03-18 17:17:55,919] Trial 26 pruned. 
[I 2026-03-18 17:18:00,806] Trial 36 pruned. 
[I 2026-03-18 17:18:02,287] Trial 16 pruned. 
[I 2026-03-18 17:18:05,906] Trial 25 pruned. 
[I 2026-03-18 17:18:07,349] Trial 18 pruned. 
[I 2026-03-18 17:18:09,563] Trial 29 pruned. 
[I 2026-03-18 17:18:10,410] Trial 27 pruned. 
[I 2026-03-18 17:18:11,997] Trial 43 pruned. 
[I 2026-03-18 17:18:16,301] Trial 11 finished with value: -2.9409785422182297 and parameters: {'n_layers_yyx': 1, 'hidden_size_yyx_l0': 3, 'context_size_yyx': 2, 'num_mix_components_yyx': 5, 'context_extractor_yyx': 'gru', 'activation_func_yyx': 'Tanh', 'L2_weight_yyx': 1.222997313596421e-10, 'L_entropy_weight_yyx': 1.0332649899172199e-06, 'L_sep_weight_yyx': 3.939453554490166e-07, 'L_scale_weight_yyx': 1.8238311433548766e-07, 'learning_rate_yyx': 0.00911523599922062}. Best is trial 11 with value: -2.9409785422182297.
[I 2026-03-18 17:18:17,446] Trial 32 finished with value: -0.5610606365387508 and parameters: {'n_layers_yyx': 2, 'hidden_size_yyx_l0': 4, 'hidden_size_yyx_l1': 6, 'context_size_yyx': 4, 'num_mix_components_yyx': 4, 'context_extractor_yyx': 'gru', 'activation_func_yyx': 'GELU', 'L2_weight_yyx': 1.8694853821056345e-07, 'L_entropy_weight_yyx': 9.440680564851634e-09, 'L_sep_weight_yyx': 4.822221922605824e-08, 'L_scale_weight_yyx': 0.0009809518226277527, 'learning_rate_yyx': 0.0066779690790936316}. Best is trial 22 with value: -0.5821973965945237.
[I 2026-03-18 17:18:17,869] Trial 26 pruned. 
[I 2026-03-18 17:18:18,845] Trial 36 pruned. 
[I 2026-03-18 17:18:21,267] Trial 33 pruned. 
[I 2026-03-18 17:18:27,599] Trial 37 pruned. 
[I 2026-03-18 17:18:27,899] Trial 41 finished with value: -0.4583461041051906 and parameters: {'n_layers_yyx': 2, 'hidden_size_yyx_l0': 2, 'hidden_size_yyx_l1': 6, 'context_size_yyx': 1, 'num_mix_components_yyx': 5, 'context_extractor_yyx': 'lstm', 'activation_func_yyx': 'Tanh', 'L2_weight_yyx': 3.76969716468718e-05, 'L_entropy_weight_yyx': 5.826336260948185e-05, 'L_sep_weight_yyx': 0.00010328094049313805, 'L_scale_weight_yyx': 7.152548803481299e-05, 'learning_rate_yyx': 0.008302374791788119}. Best is trial 40 with value: -0.47338191643587946.
[I 2026-03-18 17:18:31,053] Trial 33 pruned. 
[I 2026-03-18 17:18:32,827] Trial 19 pruned. 
[I 2026-03-18 17:18:35,516] Trial 28 pruned. 
[I 2026-03-18 17:18:36,612] Trial 17 pruned. 
[I 2026-03-18 17:18:43,920] Trial 37 pruned. 
[I 2026-03-18 17:18:46,108] Trial 34 pruned. 
[I 2026-03-18 17:18:46,864] Trial 10 pruned. 
[I 2026-03-18 17:18:52,184] Trial 18 finished with value: -2.90918451983461 and parameters: {'n_layers_yyx': 2, 'hidden_size_yyx_l0': 5, 'hidden_size_yyx_l1': 6, 'context_size_yyx': 2, 'num_mix_components_yyx': 4, 'context_extractor_yyx': 'lstm', 'activation_func_yyx': 'GELU', 'L2_weight_yyx': 1.1557444676464173e-09, 'L_entropy_weight_yyx': 2.140859363404721e-09, 'L_sep_weight_yyx': 1.4620356226102763e-07, 'L_scale_weight_yyx': 1.5985749215100677e-07, 'learning_rate_yyx': 0.004151078159292678}. Best is trial 6 with value: -2.966045431578574.
[I 2026-03-18 17:18:53,997] Trial 18 pruned. 
[I 2026-03-18 17:18:54,794] Trial 38 pruned. 
[I 2026-03-18 17:18:57,117] Trial 24 finished with value: -0.5735150406744326 and parameters: {'n_layers_yyx': 1, 'hidden_size_yyx_l0': 3, 'context_size_yyx': 3, 'num_mix_components_yyx': 4, 'context_extractor_yyx': 'gru', 'activation_func_yyx': 'ReLU', 'L2_weight_yyx': 6.059607805550219e-07, 'L_entropy_weight_yyx': 1.112228805627742e-07, 'L_sep_weight_yyx': 0.000819961989425981, 'L_scale_weight_yyx': 0.0009584686704206655, 'learning_rate_yyx': 0.005092657235212782}. Best is trial 17 with value: -0.5864613361174992.
[I 2026-03-18 17:18:58,337] Trial 20 pruned. 
[I 2026-03-18 17:19:00,741] Trial 29 pruned. 
[I 2026-03-18 17:19:01,082] Trial 37 pruned. 
[I 2026-03-18 17:19:03,486] Trial 11 pruned. 
[I 2026-03-18 17:19:04,172] Trial 26 finished with value: -0.5749519064797004 and parameters: {'n_layers_yyx': 1, 'hidden_size_yyx_l0': 6, 'context_size_yyx': 3, 'num_mix_components_yyx': 4, 'context_extractor_yyx': 'lstm', 'activation_func_yyx': 'Tanh', 'L2_weight_yyx': 3.094888714198474e-09, 'L_entropy_weight_yyx': 0.0001660495924559086, 'L_sep_weight_yyx': 4.238517358655227e-07, 'L_scale_weight_yyx': 2.2526511275794763e-09, 'learning_rate_yyx': 0.006961476019012906}. Best is trial 26 with value: -0.5749519064797004.
[I 2026-03-18 17:19:06,721] Trial 39 pruned. 
[I 2026-03-18 17:19:10,032] Trial 30 pruned. 
[I 2026-03-18 17:19:10,066] Trial 19 pruned. 
[I 2026-03-18 17:19:10,254] Trial 17 finished with value: -2.953840585651869 and parameters: {'n_layers_yyx': 2, 'hidden_size_yyx_l0': 6, 'hidden_size_yyx_l1': 5, 'context_size_yyx': 2, 'num_mix_components_yyx': 4, 'context_extractor_yyx': 'gru', 'activation_func_yyx': 'Tanh', 'L2_weight_yyx': 4.277663557316606e-09, 'L_entropy_weight_yyx': 8.025641752156563e-09, 'L_sep_weight_yyx': 1.3515177898311684e-07, 'L_scale_weight_yyx': 4.0810400933790855e-10, 'learning_rate_yyx': 0.009983299963458678}. Best is trial 12 with value: -2.9595510816550052.
[I 2026-03-18 17:19:10,490] Trial 44 pruned. 
[I 2026-03-18 17:19:10,605] Trial 35 pruned. 
[I 2026-03-18 17:19:13,811] Trial 38 pruned. 
[I 2026-03-18 17:19:18,058] Trial 40 pruned. 
[I 2026-03-18 17:19:19,976] Trial 25 pruned. 
[I 2026-03-18 17:19:20,281] Trial 21 pruned. 
[I 2026-03-18 17:19:21,567] Trial 42 pruned. 
[I 2026-03-18 17:19:22,864] Trial 19 pruned. 
[I 2026-03-18 17:19:23,017] Trial 45 pruned. 
[I 2026-03-18 17:19:23,415] Trial 30 pruned. 
[I 2026-03-18 17:19:25,430] Trial 39 pruned. 
[I 2026-03-18 17:19:26,275] Trial 11 finished with value: -2.968961453113181 and parameters: {'n_layers_yyx': 1, 'hidden_size_yyx_l0': 5, 'context_size_yyx': 3, 'num_mix_components_yyx': 2, 'context_extractor_yyx': 'gru', 'activation_func_yyx': 'GELU', 'L2_weight_yyx': 9.250802735274751e-06, 'L_entropy_weight_yyx': 1.2413971842746217e-06, 'L_sep_weight_yyx': 1.344055468034498e-10, 'L_scale_weight_yyx': 1.6647505987980578e-09, 'learning_rate_yyx': 0.0035572679123182594}. Best is trial 0 with value: -2.9702180140077377.
[I 2026-03-18 17:19:28,681] Trial 41 pruned. 
[I 2026-03-18 17:19:29,324] Trial 34 pruned. 
[I 2026-03-18 17:19:30,574] Trial 23 finished with value: -0.5844188202198138 and parameters: {'n_layers_yyx': 1, 'hidden_size_yyx_l0': 4, 'context_size_yyx': 4, 'num_mix_components_yyx': 3, 'context_extractor_yyx': 'gru', 'activation_func_yyx': 'Tanh', 'L2_weight_yyx': 8.411582100394747e-09, 'L_entropy_weight_yyx': 4.808248537187979e-05, 'L_sep_weight_yyx': 8.730123218068258e-10, 'L_scale_weight_yyx': 2.5491411671341975e-07, 'learning_rate_yyx': 0.003104731453978165}. Best is trial 23 with value: -0.5844188202198138.
[I 2026-03-18 17:19:33,663] Trial 36 pruned. 
[I 2026-03-18 17:19:35,135] Trial 12 pruned. 
[I 2026-03-18 17:19:35,724] Trial 46 pruned. 
[I 2026-03-18 17:19:36,779] Trial 31 pruned. 
[I 2026-03-18 17:19:37,659] Trial 40 pruned. 
[I 2026-03-18 17:19:40,879] Trial 38 pruned. 
[I 2026-03-18 17:19:40,982] Trial 12 pruned. 
[I 2026-03-18 17:19:43,422] Trial 22 pruned. 
[I 2026-03-18 17:19:48,619] Trial 47 pruned. 
[I 2026-03-18 17:19:50,709] Trial 13 pruned. 
[I 2026-03-18 17:19:53,164] Trial 39 pruned. 
[I 2026-03-18 17:19:53,213] Trial 24 pruned. 
[I 2026-03-18 17:19:56,500] Trial 13 pruned. 
[I 2026-03-18 17:19:57,519] Trial 37 pruned. 
[I 2026-03-18 17:19:58,459] Trial 32 pruned. 
[I 2026-03-18 17:19:58,838] Trial 48 pruned. 
[I 2026-03-18 17:20:06,505] Trial 31 pruned. 
[I 2026-03-18 17:20:08,437] Trial 38 pruned. 
[I 2026-03-18 17:20:09,153] Trial 14 pruned. 
[I 2026-03-18 17:20:10,196] Trial 43 pruned. 
[I 2026-03-18 17:20:11,776] Trial 26 pruned. 
[I 2026-03-18 17:20:12,138] Trial 17 pruned. 
[I 2026-03-18 17:20:12,759] Trial 25 pruned. 
[I 2026-03-18 17:20:15,106] Trial 27 finished with value: -0.43310513806416895 and parameters: {'n_layers_yyx': 2, 'hidden_size_yyx_l0': 4, 'hidden_size_yyx_l1': 3, 'context_size_yyx': 3, 'num_mix_components_yyx': 4, 'context_extractor_yyx': 'gru', 'activation_func_yyx': 'Tanh', 'L2_weight_yyx': 1.004604597289156e-05, 'L_entropy_weight_yyx': 1.0675812147223689e-07, 'L_sep_weight_yyx': 7.954306044717284e-06, 'L_scale_weight_yyx': 1.8828130784729187e-05, 'learning_rate_yyx': 0.0037709115946607643}. Best is trial 12 with value: -0.46022137621238873.
[I 2026-03-18 17:20:16,521] Trial 6 finished with value: -2.395621841330531 and parameters: {'n_layers_yyx': 2, 'hidden_size_yyx_l0': 3, 'hidden_size_yyx_l1': 2, 'context_size_yyx': 4, 'num_mix_components_yyx': 2, 'context_extractor_yyx': 'gru', 'activation_func_yyx': 'ReLU', 'L2_weight_yyx': 5.5836752684073184e-09, 'L_entropy_weight_yyx': 4.0751396555431845e-10, 'L_sep_weight_yyx': 4.597563150658648e-08, 'L_scale_weight_yyx': 1.3343766633712753e-10, 'learning_rate_yyx': 0.003161088528964804}. Best is trial 4 with value: -2.961367919552152.
[I 2026-03-18 17:20:18,190] Trial 5 pruned. 
[I 2026-03-18 17:20:18,300] Trial 39 pruned. 
[I 2026-03-18 17:20:25,989] Trial 18 pruned. 
[I 2026-03-18 17:20:26,554] Trial 18 pruned. 
[I 2026-03-18 17:20:29,176] Trial 41 pruned. 
[I 2026-03-18 17:20:29,351] Trial 7 pruned. 
[I 2026-03-18 17:20:29,605] Trial 35 finished with value: -0.5733195518693045 and parameters: {'n_layers_yyx': 2, 'hidden_size_yyx_l0': 5, 'hidden_size_yyx_l1': 6, 'context_size_yyx': 3, 'num_mix_components_yyx': 4, 'context_extractor_yyx': 'gru', 'activation_func_yyx': 'Tanh', 'L2_weight_yyx': 1.8745028774373788e-05, 'L_entropy_weight_yyx': 9.185952528630336e-08, 'L_sep_weight_yyx': 6.337835965424463e-10, 'L_scale_weight_yyx': 4.252648600825534e-05, 'learning_rate_yyx': 0.004161816526910072}. Best is trial 22 with value: -0.5821973965945237.
[I 2026-03-18 17:20:29,756] Trial 27 finished with value: -0.5752265017167082 and parameters: {'n_layers_yyx': 1, 'hidden_size_yyx_l0': 6, 'context_size_yyx': 3, 'num_mix_components_yyx': 4, 'context_extractor_yyx': 'lstm', 'activation_func_yyx': 'Tanh', 'L2_weight_yyx': 3.1131866582204914e-09, 'L_entropy_weight_yyx': 0.0003966466523984496, 'L_sep_weight_yyx': 4.851650325303392e-07, 'L_scale_weight_yyx': 2.0369070688961278e-08, 'learning_rate_yyx': 0.006991959961837457}. Best is trial 27 with value: -0.5752265017167082.
[I 2026-03-18 17:20:30,714] Trial 6 pruned. 
[I 2026-03-18 17:20:31,618] Trial 26 pruned. 
[I 2026-03-18 17:20:33,090] Trial 23 pruned. 
