[I 2026-03-18 22:42:21,018] Trial 76 finished with value: -1.8493180939164826 and parameters: {'n_layers_yyx': 2, 'hidden_size_yyx_l0': 6, 'hidden_size_yyx_l1': 5, 'context_size_yyx': 2, 'num_mix_components_yyx': 5, 'context_extractor_yyx': 'lstm', 'activation_func_yyx': 'Tanh', 'L2_weight_yyx': 1.1265974176581543e-06, 'L_entropy_weight_yyx': 5.2115860469143635e-05, 'L_sep_weight_yyx': 2.2233147273213232e-08, 'L_scale_weight_yyx': 1.1535962611186772e-08, 'learning_rate_yyx': 0.009867185841433689}. Best is trial 9 with value: -1.8570869006965198.
[I 2026-03-18 22:42:21,126] Trial 72 pruned. 
[I 2026-03-18 22:42:27,010] Trial 73 pruned. 
[I 2026-03-18 22:42:27,549] Trial 78 pruned. 
[I 2026-03-18 22:42:27,694] Trial 77 pruned. 
[I 2026-03-18 22:42:27,796] Trial 69 pruned. 
[I 2026-03-18 22:42:29,040] Trial 73 finished with value: -1.7792344095249368 and parameters: {'n_layers_yyx': 2, 'hidden_size_yyx_l0': 6, 'hidden_size_yyx_l1': 5, 'context_size_yyx': 3, 'num_mix_components_yyx': 5, 'context_extractor_yyx': 'gru', 'activation_func_yyx': 'ReLU', 'L2_weight_yyx': 7.897411126261603e-09, 'L_entropy_weight_yyx': 0.0007076740818936049, 'L_sep_weight_yyx': 2.6247679083416684e-06, 'L_scale_weight_yyx': 3.971032271628624e-07, 'learning_rate_yyx': 0.008042382303418132}. Best is trial 4 with value: -1.7875800731928662.
[I 2026-03-18 22:42:33,416] Trial 62 finished with value: -1.8682382119377972 and parameters: {'n_layers_yyx': 1, 'hidden_size_yyx_l0': 6, 'context_size_yyx': 4, 'num_mix_components_yyx': 4, 'context_extractor_yyx': 'lstm', 'activation_func_yyx': 'ReLU', 'L2_weight_yyx': 3.284308547817956e-09, 'L_entropy_weight_yyx': 4.522191513168266e-09, 'L_sep_weight_yyx': 1.1142204069597984e-06, 'L_scale_weight_yyx': 0.00019544564733888086, 'learning_rate_yyx': 0.009774801913272194}. Best is trial 42 with value: -1.8699069075199783.
[I 2026-03-18 22:42:33,892] Trial 77 finished with value: -1.8944662686051994 and parameters: {'n_layers_yyx': 2, 'hidden_size_yyx_l0': 3, 'hidden_size_yyx_l1': 5, 'context_size_yyx': 4, 'num_mix_components_yyx': 3, 'context_extractor_yyx': 'lstm', 'activation_func_yyx': 'ReLU', 'L2_weight_yyx': 1.1164702052922652e-06, 'L_entropy_weight_yyx': 2.722892587400904e-10, 'L_sep_weight_yyx': 1.594421035043625e-09, 'L_scale_weight_yyx': 1.061767591049416e-08, 'learning_rate_yyx': 0.007671926542571602}. Best is trial 55 with value: -1.8982689846521137.
[I 2026-03-18 22:42:34,075] Trial 78 pruned. 
[I 2026-03-18 22:42:35,328] Trial 86 finished with value: -1.8052091861509598 and parameters: {'n_layers_yyx': 2, 'hidden_size_yyx_l0': 4, 'hidden_size_yyx_l1': 5, 'context_size_yyx': 3, 'num_mix_components_yyx': 3, 'context_extractor_yyx': 'gru', 'activation_func_yyx': 'GELU', 'L2_weight_yyx': 9.19622270264209e-05, 'L_entropy_weight_yyx': 1.1233386847894797e-07, 'L_sep_weight_yyx': 6.872616721686067e-06, 'L_scale_weight_yyx': 5.6864243489926113e-08, 'learning_rate_yyx': 0.008440822621305332}. Best is trial 27 with value: -1.8062570642302185.
[I 2026-03-18 22:42:35,658] Trial 77 pruned. 
[I 2026-03-18 22:42:37,814] Trial 53 finished with value: -1.9347327602858426 and parameters: {'n_layers_yyx': 2, 'hidden_size_yyx_l0': 4, 'hidden_size_yyx_l1': 3, 'context_size_yyx': 3, 'num_mix_components_yyx': 2, 'context_extractor_yyx': 'lstm', 'activation_func_yyx': 'ReLU', 'L2_weight_yyx': 2.910810491417775e-05, 'L_entropy_weight_yyx': 3.8429862565245424e-07, 'L_sep_weight_yyx': 4.736876685914835e-06, 'L_scale_weight_yyx': 3.0367370755876795e-09, 'learning_rate_yyx': 0.009953475238702913}. Best is trial 47 with value: -1.9352030291906768.
[I 2026-03-18 22:42:39,025] Trial 79 pruned. 
[I 2026-03-18 22:42:39,087] Trial 70 pruned. 
[I 2026-03-18 22:42:39,943] Trial 79 pruned. 
[I 2026-03-18 22:42:41,132] Trial 78 pruned. 

Source events: 12731
Target events: 39192
Full model ln_yyx : 1678.48353 nats/sec, 38.54448 nats/event
Full model Log loss : -1.77912
Full model ln_yyx : 1672.54087 nats/sec, 38.40801 nats/event
Full model Log loss : -1.77763
Full model ln_yyx : 1684.84061 nats/sec, 38.69046 nats/event
Full model Log loss : -1.77765
Full model ln_yyx : 1697.50737 nats/sec, 38.98134 nats/event
Full model Log loss : -1.78532
Full model ln_yyx : 1695.28526 nats/sec, 38.93031 nats/event
Full model Log loss : -1.78156
Full model ln_yyx : 1676.85452 nats/sec, 38.50707 nats/event
Full model Log loss : -1.78368
Full model ln_yyx : 1687.38296 nats/sec, 38.74884 nats/event
Full model Log loss : -1.78315
Optimization finished. Config saved to results/opt-full/opt_full_226_best_config.txt
[I 2026-03-18 22:42:43,422] Trial 54 pruned. 
[I 2026-03-18 22:42:45,812] Trial 78 pruned. 
[I 2026-03-18 22:42:45,871] Trial 87 pruned. 
[I 2026-03-18 22:42:45,923] Trial 80 pruned. 
[I 2026-03-18 22:42:49,516] Trial 43 pruned. 
[I 2026-03-18 22:42:49,931] Trial 79 pruned. 
[I 2026-03-18 22:42:49,939] Trial 71 pruned. 
[I 2026-03-18 22:42:50,431] Trial 80 pruned. 

Source events: 14713
Target events: 20158
Full model ln_yyx : 1049.38725 nats/sec, 46.85229 nats/event
Full model Log loss : -1.86088
Full model ln_yyx : 1058.72873 nats/sec, 47.26936 nats/event
Full model Log loss : -1.85760
Full model ln_yyx : 1054.22385 nats/sec, 47.06823 nats/event
Full model Log loss : -1.86003
Full model ln_yyx : 1043.55428 nats/sec, 46.59187 nats/event
Full model Log loss : -1.86017
Full model ln_yyx : 1046.17711 nats/sec, 46.70897 nats/event
Full model Log loss : -1.85800
Full model ln_yyx : 1026.23115 nats/sec, 45.81844 nats/event
Full model Log loss : -1.83680
Full model ln_yyx : 1043.56237 nats/sec, 46.59223 nats/event
Full model Log loss : -1.85899
Full model ln_yyx : 1043.92191 nats/sec, 46.60828 nats/event
Full model Log loss : -1.85902
Full model ln_yyx : 1044.51657 nats/sec, 46.63483 nats/event
Full model Log loss : -1.85951
Full model ln_yyx : 1048.65590 nats/sec, 46.81964 nats/event
Full model Log loss : -1.85888
Full model ln_yyx : 1027.04266 nats/sec, 45.85467 nats/event
Full model Log loss : -1.84017
Optimization finished. Config saved to results/opt-full/opt_full_237_best_config.txt
[I 2026-03-18 22:42:52,758] Trial 72 finished with value: -1.8533231929533198 and parameters: {'n_layers_yyx': 1, 'hidden_size_yyx_l0': 5, 'context_size_yyx': 4, 'num_mix_components_yyx': 4, 'context_extractor_yyx': 'gru', 'activation_func_yyx': 'Tanh', 'L2_weight_yyx': 0.00021227262702594357, 'L_entropy_weight_yyx': 0.0002978380175526416, 'L_sep_weight_yyx': 3.0048555243723738e-05, 'L_scale_weight_yyx': 5.552296879186627e-07, 'learning_rate_yyx': 0.006820119541949493}. Best is trial 53 with value: -1.855205638988598.
[I 2026-03-18 22:42:54,393] Trial 44 pruned. 
[I 2026-03-18 22:42:55,417] Trial 55 pruned. 
[I 2026-03-18 22:42:55,885] Trial 74 pruned. 
[I 2026-03-18 22:42:59,512] Trial 45 pruned. 
[I 2026-03-18 22:43:00,021] Trial 72 pruned. 
[I 2026-03-18 22:43:00,507] Trial 75 pruned. 
[I 2026-03-18 22:43:03,010] Trial 63 pruned. 
[I 2026-03-18 22:43:04,205] Trial 46 pruned. 
[I 2026-03-18 22:43:04,693] Trial 72 finished with value: -1.8486684643751092 and parameters: {'n_layers_yyx': 2, 'hidden_size_yyx_l0': 2, 'hidden_size_yyx_l1': 6, 'context_size_yyx': 4, 'num_mix_components_yyx': 4, 'context_extractor_yyx': 'lstm', 'activation_func_yyx': 'ReLU', 'L2_weight_yyx': 3.1719225990970103e-09, 'L_entropy_weight_yyx': 0.00036567269735146, 'L_sep_weight_yyx': 6.78314364442794e-08, 'L_scale_weight_yyx': 6.186276363855314e-07, 'learning_rate_yyx': 0.007106768319713432}. Best is trial 60 with value: -1.8490650754743791.
[I 2026-03-18 22:43:05,264] Trial 76 pruned. 
[I 2026-03-18 22:43:06,325] Trial 56 pruned. 
[I 2026-03-18 22:43:08,990] Trial 47 pruned. 
[I 2026-03-18 22:43:09,392] Trial 73 pruned. 
[I 2026-03-18 22:43:10,722] Trial 66 finished with value: -1.8484441352693293 and parameters: {'n_layers_yyx': 2, 'hidden_size_yyx_l0': 5, 'hidden_size_yyx_l1': 2, 'context_size_yyx': 4, 'num_mix_components_yyx': 5, 'context_extractor_yyx': 'gru', 'activation_func_yyx': 'ReLU', 'L2_weight_yyx': 2.3379393831505548e-09, 'L_entropy_weight_yyx': 2.2584400863953626e-08, 'L_sep_weight_yyx': 1.0579496726599327e-10, 'L_scale_weight_yyx': 6.0318773747088515e-06, 'learning_rate_yyx': 0.009066793752530907}. Best is trial 0 with value: -1.8516305051550026.
[I 2026-03-18 22:43:11,066] Trial 74 finished with value: -1.7781086992976642 and parameters: {'n_layers_yyx': 2, 'hidden_size_yyx_l0': 6, 'hidden_size_yyx_l1': 6, 'context_size_yyx': 3, 'num_mix_components_yyx': 5, 'context_extractor_yyx': 'gru', 'activation_func_yyx': 'ReLU', 'L2_weight_yyx': 1.9812635650364537e-09, 'L_entropy_weight_yyx': 0.00011543003162926076, 'L_sep_weight_yyx': 1.7076694065073903e-06, 'L_scale_weight_yyx': 6.126827093375598e-10, 'learning_rate_yyx': 0.009016238751998364}. Best is trial 4 with value: -1.7875800731928662.
[I 2026-03-18 22:43:11,180] Trial 57 pruned. 
[I 2026-03-18 22:43:13,493] Trial 48 pruned. 
[I 2026-03-18 22:43:15,109] Trial 77 pruned. 
[I 2026-03-18 22:43:16,652] Trial 80 pruned. 
[I 2026-03-18 22:43:18,313] Trial 81 pruned. 
[I 2026-03-18 22:43:18,367] Trial 74 pruned. 
[I 2026-03-18 22:43:18,535] Trial 68 pruned. 
[I 2026-03-18 22:43:19,645] Trial 78 pruned. 
[I 2026-03-18 22:43:22,191] Trial 58 pruned. 
[I 2026-03-18 22:43:23,475] Trial 82 pruned. 
[I 2026-03-18 22:43:23,504] Trial 69 pruned. 
[I 2026-03-18 22:43:27,135] Trial 59 pruned. 
[I 2026-03-18 22:43:27,888] Trial 75 pruned. 

Source events: 12731
Target events: 20158
Full model ln_yyx : 860.31132 nats/sec, 38.41057 nats/event
Full model Log loss : -1.78301
Full model ln_yyx : 871.61289 nats/sec, 38.91515 nats/event
Full model Log loss : -1.78976
Full model ln_yyx : 852.74301 nats/sec, 38.07266 nats/event
Full model Log loss : -1.76396
Full model ln_yyx : 864.68741 nats/sec, 38.60595 nats/event
Full model Log loss : -1.78899
Full model ln_yyx : 871.76115 nats/sec, 38.92177 nats/event
Full model Log loss : -1.78802
Full model ln_yyx : 858.94930 nats/sec, 38.34976 nats/event
Full model Log loss : -1.78529
Full model ln_yyx : 866.08167 nats/sec, 38.66820 nats/event
Full model Log loss : -1.78881
Optimization finished. Config saved to results/opt-full/opt_full_225_best_config.txt
[I 2026-03-18 22:43:27,975] Trial 70 pruned. 
[I 2026-03-18 22:43:32,624] Trial 60 pruned. 
[I 2026-03-18 22:43:38,388] Trial 88 finished with value: -1.7924108104681533 and parameters: {'n_layers_yyx': 2, 'hidden_size_yyx_l0': 4, 'hidden_size_yyx_l1': 6, 'context_size_yyx': 3, 'num_mix_components_yyx': 2, 'context_extractor_yyx': 'gru', 'activation_func_yyx': 'GELU', 'L2_weight_yyx': 9.792765420951925e-05, 'L_entropy_weight_yyx': 1.5878112477424706e-07, 'L_sep_weight_yyx': 3.737916140519524e-06, 'L_scale_weight_yyx': 2.164016111555064e-08, 'learning_rate_yyx': 0.007920421790358421}. Best is trial 27 with value: -1.8062570642302185.
[I 2026-03-18 22:43:41,274] Trial 73 finished with value: -1.8533043283104318 and parameters: {'n_layers_yyx': 1, 'hidden_size_yyx_l0': 5, 'context_size_yyx': 4, 'num_mix_components_yyx': 4, 'context_extractor_yyx': 'gru', 'activation_func_yyx': 'Tanh', 'L2_weight_yyx': 0.00010333999173122586, 'L_entropy_weight_yyx': 0.00037228081104701433, 'L_sep_weight_yyx': 5.2920321246320074e-05, 'L_scale_weight_yyx': 2.52888103094063e-07, 'learning_rate_yyx': 0.007752211599733668}. Best is trial 53 with value: -1.855205638988598.
[I 2026-03-18 22:43:41,491] Trial 81 pruned. 
[I 2026-03-18 22:43:43,165] Trial 61 pruned. 
[I 2026-03-18 22:43:45,874] Trial 64 finished with value: -1.8681465839575444 and parameters: {'n_layers_yyx': 1, 'hidden_size_yyx_l0': 6, 'context_size_yyx': 4, 'num_mix_components_yyx': 4, 'context_extractor_yyx': 'lstm', 'activation_func_yyx': 'ReLU', 'L2_weight_yyx': 5.754052466829965e-09, 'L_entropy_weight_yyx': 1.1654021424853358e-08, 'L_sep_weight_yyx': 6.433981763516685e-06, 'L_scale_weight_yyx': 1.3442966477334532e-05, 'learning_rate_yyx': 0.008193418765153917}. Best is trial 42 with value: -1.8699069075199783.
[I 2026-03-18 22:43:46,582] Trial 89 pruned. 
[I 2026-03-18 22:43:47,824] Trial 62 pruned. 
[I 2026-03-18 22:43:50,094] Trial 73 finished with value: -1.8480695342217013 and parameters: {'n_layers_yyx': 2, 'hidden_size_yyx_l0': 2, 'hidden_size_yyx_l1': 6, 'context_size_yyx': 4, 'num_mix_components_yyx': 4, 'context_extractor_yyx': 'lstm', 'activation_func_yyx': 'ReLU', 'L2_weight_yyx': 2.040801683572094e-09, 'L_entropy_weight_yyx': 0.0009758064033776923, 'L_sep_weight_yyx': 9.00343081411428e-08, 'L_scale_weight_yyx': 1.8369557425150629e-07, 'learning_rate_yyx': 0.00713308085117969}. Best is trial 60 with value: -1.8490650754743791.
[I 2026-03-18 22:43:51,809] Trial 71 pruned. 
[I 2026-03-18 22:43:52,602] Trial 63 pruned. 
[I 2026-03-18 22:43:54,273] Trial 83 pruned. 

Source events: 14713
Target events: 32635
Full model ln_yyx : 1696.20325 nats/sec, 46.77748 nats/event
Full model Log loss : -1.85206
Full model ln_yyx : 1688.39660 nats/sec, 46.56219 nats/event
Full model Log loss : -1.84980
Full model ln_yyx : 1689.99699 nats/sec, 46.60632 nats/event
Full model Log loss : -1.85145
Full model ln_yyx : 1687.94610 nats/sec, 46.54976 nats/event
Full model Log loss : -1.85443
Full model ln_yyx : 1684.13010 nats/sec, 46.44453 nats/event
Full model Log loss : -1.85186
Full model ln_yyx : 1695.99407 nats/sec, 46.77171 nats/event
Full model Log loss : -1.85228
Full model ln_yyx : 1695.74798 nats/sec, 46.76492 nats/event
Full model Log loss : -1.85224
Full model ln_yyx : 1694.86463 nats/sec, 46.74056 nats/event
Full model Log loss : -1.85122
Full model ln_yyx : 1690.01604 nats/sec, 46.60685 nats/event
Full model Log loss : -1.85211
Full model ln_yyx : 1682.33185 nats/sec, 46.39493 nats/event
Full model Log loss : -1.85071
Full model ln_yyx : 1683.39202 nats/sec, 46.42417 nats/event
Full model Log loss : -1.85124
Full model ln_yyx : 1696.37571 nats/sec, 46.78223 nats/event
Full model Log loss : -1.85090
Full model ln_yyx : 1689.45896 nats/sec, 46.59148 nats/event
Full model Log loss : -1.84932
Optimization finished. Config saved to results/opt-full/opt_full_235_best_config.txt
[I 2026-03-18 22:43:54,630] Trial 90 pruned. 
[I 2026-03-18 22:43:54,921] Trial 65 pruned. 
[I 2026-03-18 22:43:56,909] Trial 64 pruned. 
[I 2026-03-18 22:43:58,089] Trial 91 pruned. 
[I 2026-03-18 22:43:59,132] Trial 66 pruned. 
[I 2026-03-18 22:44:01,375] Trial 65 pruned. 
[I 2026-03-18 22:44:01,621] Trial 67 finished with value: -1.8485045136779763 and parameters: {'n_layers_yyx': 2, 'hidden_size_yyx_l0': 5, 'hidden_size_yyx_l1': 2, 'context_size_yyx': 4, 'num_mix_components_yyx': 5, 'context_extractor_yyx': 'gru', 'activation_func_yyx': 'ReLU', 'L2_weight_yyx': 2.4015022540863797e-09, 'L_entropy_weight_yyx': 1.8223227781578357e-08, 'L_sep_weight_yyx': 3.943381701092702e-10, 'L_scale_weight_yyx': 4.055288926339908e-06, 'learning_rate_yyx': 0.009122660166752672}. Best is trial 0 with value: -1.8516305051550026.
[I 2026-03-18 22:44:01,624] Trial 72 pruned. 
[I 2026-03-18 22:44:02,142] Trial 75 finished with value: -1.7805064561631945 and parameters: {'n_layers_yyx': 2, 'hidden_size_yyx_l0': 6, 'hidden_size_yyx_l1': 4, 'context_size_yyx': 4, 'num_mix_components_yyx': 5, 'context_extractor_yyx': 'gru', 'activation_func_yyx': 'ReLU', 'L2_weight_yyx': 9.931784620607625e-10, 'L_entropy_weight_yyx': 0.00044914936798669307, 'L_sep_weight_yyx': 0.0002950028351874684, 'L_scale_weight_yyx': 4.707926206761265e-06, 'learning_rate_yyx': 0.0051165604244756855}. Best is trial 4 with value: -1.7875800731928662.
[I 2026-03-18 22:44:05,460] Trial 68 pruned. 
[I 2026-03-18 22:44:06,197] Trial 66 pruned. 
[I 2026-03-18 22:44:10,161] Trial 73 pruned. 

Source events: 14713
Target events: 5634
Full model ln_yyx : 293.19452 nats/sec, 46.83618 nats/event
Full model Log loss : -1.88998
Full model ln_yyx : 292.36331 nats/sec, 46.70340 nats/event
Full model Log loss : -1.88994
Full model ln_yyx : 290.50163 nats/sec, 46.40601 nats/event
Full model Log loss : -1.89053
Full model ln_yyx : 284.40941 nats/sec, 45.43281 nats/event
Full model Log loss : -1.82483
Full model ln_yyx : 293.93388 nats/sec, 46.95429 nats/event
Full model Log loss : -1.88980
Full model ln_yyx : 289.35623 nats/sec, 46.22304 nats/event
Full model Log loss : -1.86863
Full model ln_yyx : 291.35068 nats/sec, 46.54164 nats/event
Full model Log loss : -1.89042
Optimization finished. Config saved to results/opt-full/opt_full_233_best_config.txt
[I 2026-03-18 22:44:10,959] Trial 67 pruned. 
[I 2026-03-18 22:44:14,174] Trial 69 pruned. 
[I 2026-03-18 22:44:17,545] Trial 92 pruned. 
[I 2026-03-18 22:44:21,832] Trial 70 pruned. 
[I 2026-03-18 22:44:22,560] Trial 74 finished with value: -1.8537300094001754 and parameters: {'n_layers_yyx': 1, 'hidden_size_yyx_l0': 5, 'context_size_yyx': 4, 'num_mix_components_yyx': 4, 'context_extractor_yyx': 'gru', 'activation_func_yyx': 'Tanh', 'L2_weight_yyx': 1.5917455430555997e-05, 'L_entropy_weight_yyx': 0.00048596581256913376, 'L_sep_weight_yyx': 1.7818778073370227e-05, 'L_scale_weight_yyx': 5.665566077641528e-07, 'learning_rate_yyx': 0.009249435345804954}. Best is trial 53 with value: -1.855205638988598.
[I 2026-03-18 22:44:24,859] Trial 82 finished with value: -1.8980049484077541 and parameters: {'n_layers_yyx': 2, 'hidden_size_yyx_l0': 4, 'hidden_size_yyx_l1': 5, 'context_size_yyx': 4, 'num_mix_components_yyx': 3, 'context_extractor_yyx': 'lstm', 'activation_func_yyx': 'ReLU', 'L2_weight_yyx': 7.05223695517289e-06, 'L_entropy_weight_yyx': 3.993558213879111e-09, 'L_sep_weight_yyx': 1.3412974113158386e-08, 'L_scale_weight_yyx': 5.495355181699084e-09, 'learning_rate_yyx': 0.007858716516085697}. Best is trial 55 with value: -1.8982689846521137.

Source events: 14713
Target events: 3828
Full model ln_yyx : 197.65293 nats/sec, 46.47012 nats/event
Full model Log loss : -1.89708
Full model ln_yyx : 197.01386 nats/sec, 46.31987 nats/event
Full model Log loss : -1.89827
Full model ln_yyx : 197.60806 nats/sec, 46.45957 nats/event
Full model Log loss : -1.89825
Full model ln_yyx : 196.89034 nats/sec, 46.29083 nats/event
Full model Log loss : -1.87841
Full model ln_yyx : 197.99565 nats/sec, 46.55070 nats/event
Full model Log loss : -1.89593
Full model ln_yyx : 200.75094 nats/sec, 47.19850 nats/event
Full model Log loss : -1.89807
Full model ln_yyx : 199.44791 nats/sec, 46.89214 nats/event
Full model Log loss : -1.89679
Full model ln_yyx : 198.98672 nats/sec, 46.78371 nats/event
Full model Log loss : -1.89712
Full model ln_yyx : 199.70942 nats/sec, 46.95362 nats/event
Full model Log loss : -1.89723
Full model ln_yyx : 199.27969 nats/sec, 46.85259 nats/event
Full model Log loss : -1.89817
Full model ln_yyx : 198.93113 nats/sec, 46.77064 nats/event
Full model Log loss : -1.89466
Full model ln_yyx : 198.26872 nats/sec, 46.61490 nats/event
Full model Log loss : -1.89512
Full model ln_yyx : 198.74013 nats/sec, 46.72574 nats/event
Full model Log loss : -1.89447
Full model ln_yyx : 198.64015 nats/sec, 46.70223 nats/event
Full model Log loss : -1.89800
Optimization finished. Config saved to results/opt-full/opt_full_231_best_config.txt
[I 2026-03-18 22:44:25,503] Trial 71 pruned. 
[I 2026-03-18 22:44:27,520] Trial 79 pruned. 
[I 2026-03-18 22:44:27,632] Trial 74 finished with value: -1.8471663035725996 and parameters: {'n_layers_yyx': 2, 'hidden_size_yyx_l0': 2, 'hidden_size_yyx_l1': 6, 'context_size_yyx': 4, 'num_mix_components_yyx': 4, 'context_extractor_yyx': 'lstm', 'activation_func_yyx': 'ReLU', 'L2_weight_yyx': 1.9972366550205345e-09, 'L_entropy_weight_yyx': 0.0004199939836898484, 'L_sep_weight_yyx': 7.443561085351489e-08, 'L_scale_weight_yyx': 1.8726765690055183e-07, 'learning_rate_yyx': 0.003403600108159587}. Best is trial 60 with value: -1.8490650754743791.
[I 2026-03-18 22:44:30,438] Trial 75 pruned. 
[I 2026-03-18 22:44:33,706] Trial 67 finished with value: -1.8686035199247644 and parameters: {'n_layers_yyx': 1, 'hidden_size_yyx_l0': 6, 'context_size_yyx': 4, 'num_mix_components_yyx': 3, 'context_extractor_yyx': 'lstm', 'activation_func_yyx': 'ReLU', 'L2_weight_yyx': 4.970502884367756e-10, 'L_entropy_weight_yyx': 1.0397997620551522e-09, 'L_sep_weight_yyx': 2.503789632954377e-07, 'L_scale_weight_yyx': 5.640826939077336e-06, 'learning_rate_yyx': 0.009041431209970863}. Best is trial 42 with value: -1.8699069075199783.
[I 2026-03-18 22:44:40,061] Trial 68 pruned. 
[I 2026-03-18 22:44:44,366] Trial 76 finished with value: -1.7798682380445077 and parameters: {'n_layers_yyx': 2, 'hidden_size_yyx_l0': 6, 'hidden_size_yyx_l1': 3, 'context_size_yyx': 2, 'num_mix_components_yyx': 5, 'context_extractor_yyx': 'gru', 'activation_func_yyx': 'ReLU', 'L2_weight_yyx': 5.0915789754652946e-08, 'L_entropy_weight_yyx': 1.7012160081601426e-05, 'L_sep_weight_yyx': 0.0005866647400384165, 'L_scale_weight_yyx': 4.425430179568121e-07, 'learning_rate_yyx': 0.007537760172105337}. Best is trial 4 with value: -1.7875800731928662.
[I 2026-03-18 22:44:47,525] Trial 49 finished with value: -1.8552843756090827 and parameters: {'n_layers_yyx': 1, 'hidden_size_yyx_l0': 3, 'context_size_yyx': 3, 'num_mix_components_yyx': 3, 'context_extractor_yyx': 'lstm', 'activation_func_yyx': 'Tanh', 'L2_weight_yyx': 5.7993794870717135e-09, 'L_entropy_weight_yyx': 1.4735815798285356e-05, 'L_sep_weight_yyx': 3.673874817251558e-09, 'L_scale_weight_yyx': 3.241444098276432e-10, 'learning_rate_yyx': 0.009873458576709078}. Best is trial 40 with value: -1.861402018567546.
[I 2026-03-18 22:44:47,530] Trial 93 finished with value: -1.8025894132669973 and parameters: {'n_layers_yyx': 2, 'hidden_size_yyx_l0': 4, 'hidden_size_yyx_l1': 4, 'context_size_yyx': 3, 'num_mix_components_yyx': 3, 'context_extractor_yyx': 'gru', 'activation_func_yyx': 'GELU', 'L2_weight_yyx': 3.7932837271515515e-05, 'L_entropy_weight_yyx': 1.8652685721710544e-06, 'L_sep_weight_yyx': 8.057760151383473e-06, 'L_scale_weight_yyx': 3.87876991438106e-09, 'learning_rate_yyx': 0.00836745927410054}. Best is trial 27 with value: -1.8062570642302185.
[I 2026-03-18 22:44:52,928] Trial 50 pruned. 
