[I 2026-03-18 18:44:46,501] Trial 5 pruned. 
[I 2026-03-18 18:44:49,935] Trial 2 pruned. 
[I 2026-03-18 18:44:52,865] Trial 2 finished with value: -0.8228697107672868 and parameters: {'n_layers_yyx': 1, 'hidden_size_yyx_l0': 4, 'context_size_yyx': 4, 'num_mix_components_yyx': 1, 'context_extractor_yyx': 'gru', 'activation_func_yyx': 'ReLU', 'L2_weight_yyx': 3.7076506307605987e-06, 'L_entropy_weight_yyx': 1.1590554123975387e-09, 'L_sep_weight_yyx': 8.289204419395302e-09, 'L_scale_weight_yyx': 3.750086922942758e-09, 'learning_rate_yyx': 0.009156149180250841}. Best is trial 2 with value: -0.8228697107672868.
[I 2026-03-18 18:44:53,540] Trial 3 pruned. 
[I 2026-03-18 18:44:59,466] Trial 0 finished with value: -2.2596351878295255 and parameters: {'n_layers_yyx': 2, 'hidden_size_yyx_l0': 3, 'hidden_size_yyx_l1': 6, 'context_size_yyx': 1, 'num_mix_components_yyx': 2, 'context_extractor_yyx': 'gru', 'activation_func_yyx': 'Tanh', 'L2_weight_yyx': 4.531942150249603e-08, 'L_entropy_weight_yyx': 2.4118218506053236e-10, 'L_sep_weight_yyx': 5.1458764823223713e-08, 'L_scale_weight_yyx': 1.1746584114571798e-07, 'learning_rate_yyx': 0.001450307593062025}. Best is trial 0 with value: -2.2596351878295255.
[I 2026-03-18 18:44:59,832] Trial 6 pruned. 
[I 2026-03-18 18:45:00,918] Trial 0 finished with value: -2.2554395663426554 and parameters: {'n_layers_yyx': 2, 'hidden_size_yyx_l0': 5, 'hidden_size_yyx_l1': 2, 'context_size_yyx': 4, 'num_mix_components_yyx': 1, 'context_extractor_yyx': 'gru', 'activation_func_yyx': 'Tanh', 'L2_weight_yyx': 5.235975429130311e-06, 'L_entropy_weight_yyx': 0.00048132689197009486, 'L_sep_weight_yyx': 3.2263573314705324e-10, 'L_scale_weight_yyx': 0.00021354861122291008, 'learning_rate_yyx': 0.000538990365764674}. Best is trial 0 with value: -2.2554395663426554.
[I 2026-03-18 18:45:02,032] Trial 0 finished with value: -2.2628530626051866 and parameters: {'n_layers_yyx': 2, 'hidden_size_yyx_l0': 4, 'hidden_size_yyx_l1': 3, 'context_size_yyx': 2, 'num_mix_components_yyx': 1, 'context_extractor_yyx': 'gru', 'activation_func_yyx': 'Tanh', 'L2_weight_yyx': 6.532592540579125e-10, 'L_entropy_weight_yyx': 1.9824452940164134e-06, 'L_sep_weight_yyx': 8.394491738173792e-09, 'L_scale_weight_yyx': 7.681857327966575e-10, 'learning_rate_yyx': 0.0013142341550482235}. Best is trial 0 with value: -2.2628530626051866.
[I 2026-03-18 18:45:06,551] Trial 3 pruned. 
[I 2026-03-18 18:45:07,827] Trial 4 pruned. 
[I 2026-03-18 18:45:11,697] Trial 1 finished with value: -0.8235284532014517 and parameters: {'n_layers_yyx': 1, 'hidden_size_yyx_l0': 4, 'context_size_yyx': 2, 'num_mix_components_yyx': 5, 'context_extractor_yyx': 'lstm', 'activation_func_yyx': 'Tanh', 'L2_weight_yyx': 2.1430058559493352e-10, 'L_entropy_weight_yyx': 0.0009415038450946629, 'L_sep_weight_yyx': 5.330747945488847e-08, 'L_scale_weight_yyx': 1.8091676456938666e-07, 'learning_rate_yyx': 0.006114408177425494}. Best is trial 1 with value: -0.8235284532014517.
[I 2026-03-18 18:45:16,998] Trial 7 pruned. 
[I 2026-03-18 18:45:24,431] Trial 4 pruned. 
[I 2026-03-18 18:45:48,306] Trial 8 pruned. 
[I 2026-03-18 18:45:53,805] Trial 5 pruned. 
[I 2026-03-18 18:45:56,354] Trial 1 finished with value: -0.8149205127530119 and parameters: {'n_layers_yyx': 2, 'hidden_size_yyx_l0': 2, 'hidden_size_yyx_l1': 6, 'context_size_yyx': 3, 'num_mix_components_yyx': 3, 'context_extractor_yyx': 'lstm', 'activation_func_yyx': 'GELU', 'L2_weight_yyx': 4.247358892252475e-05, 'L_entropy_weight_yyx': 0.00012053412909170504, 'L_sep_weight_yyx': 5.220503185668464e-09, 'L_scale_weight_yyx': 1.1219701597082033e-10, 'learning_rate_yyx': 0.003721908201407826}. Best is trial 1 with value: -0.8149205127530119.
[I 2026-03-18 18:46:05,820] Trial 3 pruned. 
[I 2026-03-18 18:46:13,354] Trial 6 pruned. 
[I 2026-03-18 18:46:23,705] Trial 1 finished with value: -0.8042812600973966 and parameters: {'n_layers_yyx': 2, 'hidden_size_yyx_l0': 5, 'hidden_size_yyx_l1': 5, 'context_size_yyx': 3, 'num_mix_components_yyx': 1, 'context_extractor_yyx': 'gru', 'activation_func_yyx': 'Tanh', 'L2_weight_yyx': 0.00034965542355220203, 'L_entropy_weight_yyx': 3.7344838100002528e-06, 'L_sep_weight_yyx': 3.789824360929664e-07, 'L_scale_weight_yyx': 3.0812417592656726e-07, 'learning_rate_yyx': 0.0010198225098099615}. Best is trial 0 with value: -0.8279563193835395.
[I 2026-03-18 18:46:37,060] Trial 7 pruned. 
[I 2026-03-18 18:46:44,156] Trial 2 pruned. 
[I 2026-03-18 18:46:44,811] Trial 1 finished with value: -2.2840327548863986 and parameters: {'n_layers_yyx': 1, 'hidden_size_yyx_l0': 4, 'context_size_yyx': 3, 'num_mix_components_yyx': 5, 'context_extractor_yyx': 'lstm', 'activation_func_yyx': 'Tanh', 'L2_weight_yyx': 2.989237820742589e-07, 'L_entropy_weight_yyx': 3.2485924686835318e-06, 'L_sep_weight_yyx': 2.458456843017849e-06, 'L_scale_weight_yyx': 0.00031316275559175466, 'learning_rate_yyx': 0.008148379890939163}. Best is trial 1 with value: -2.2840327548863986.
[I 2026-03-18 18:46:56,056] Trial 8 pruned. 
[I 2026-03-18 18:46:56,819] Trial 1 finished with value: -0.7696244706079209 and parameters: {'n_layers_yyx': 1, 'hidden_size_yyx_l0': 3, 'context_size_yyx': 2, 'num_mix_components_yyx': 1, 'context_extractor_yyx': 'lstm', 'activation_func_yyx': 'GELU', 'L2_weight_yyx': 3.301045650787587e-09, 'L_entropy_weight_yyx': 1.2234530169630657e-05, 'L_sep_weight_yyx': 3.441386755073939e-08, 'L_scale_weight_yyx': 3.0749770695517825e-08, 'learning_rate_yyx': 0.001104084046187819}. Best is trial 0 with value: -0.8324342893885016.
[I 2026-03-18 18:47:21,901] Trial 1 finished with value: -0.8100041624714388 and parameters: {'n_layers_yyx': 1, 'hidden_size_yyx_l0': 2, 'context_size_yyx': 3, 'num_mix_components_yyx': 4, 'context_extractor_yyx': 'lstm', 'activation_func_yyx': 'ReLU', 'L2_weight_yyx': 1.1670216454313701e-05, 'L_entropy_weight_yyx': 1.3861013315927954e-10, 'L_sep_weight_yyx': 3.8122735254906924e-06, 'L_scale_weight_yyx': 5.906908260982591e-06, 'learning_rate_yyx': 0.000769502611921173}. Best is trial 1 with value: -0.8100041624714388.
[I 2026-03-18 18:47:26,540] Trial 1 finished with value: -1.7570972872855968 and parameters: {'n_layers_yyx': 2, 'hidden_size_yyx_l0': 4, 'hidden_size_yyx_l1': 5, 'context_size_yyx': 4, 'num_mix_components_yyx': 1, 'context_extractor_yyx': 'lstm', 'activation_func_yyx': 'ReLU', 'L2_weight_yyx': 2.0830094780467966e-09, 'L_entropy_weight_yyx': 6.830927350310682e-09, 'L_sep_weight_yyx': 6.840875876264882e-10, 'L_scale_weight_yyx': 9.273203052159473e-07, 'learning_rate_yyx': 0.0008842375712414198}. Best is trial 0 with value: -1.7793034017335003.
[I 2026-03-18 18:47:26,694] Trial 1 finished with value: -0.8348051941729366 and parameters: {'n_layers_yyx': 1, 'hidden_size_yyx_l0': 2, 'context_size_yyx': 1, 'num_mix_components_yyx': 5, 'context_extractor_yyx': 'lstm', 'activation_func_yyx': 'Tanh', 'L2_weight_yyx': 2.304505257022597e-10, 'L_entropy_weight_yyx': 2.744151163343724e-10, 'L_sep_weight_yyx': 2.9472915259507505e-05, 'L_scale_weight_yyx': 6.060554223083456e-08, 'learning_rate_yyx': 0.0027824362408412}. Best is trial 1 with value: -0.8348051941729366.
[I 2026-03-18 18:47:26,754] Trial 1 finished with value: -2.279694369835903 and parameters: {'n_layers_yyx': 2, 'hidden_size_yyx_l0': 3, 'hidden_size_yyx_l1': 4, 'context_size_yyx': 4, 'num_mix_components_yyx': 5, 'context_extractor_yyx': 'lstm', 'activation_func_yyx': 'GELU', 'L2_weight_yyx': 7.092421583058026e-10, 'L_entropy_weight_yyx': 4.846184723380124e-06, 'L_sep_weight_yyx': 4.311037644837414e-07, 'L_scale_weight_yyx': 2.8498747023835074e-05, 'learning_rate_yyx': 0.005110589460549529}. Best is trial 1 with value: -2.279694369835903.
[I 2026-03-18 18:47:29,645] Trial 2 finished with value: -1.7126383176991637 and parameters: {'n_layers_yyx': 2, 'hidden_size_yyx_l0': 4, 'hidden_size_yyx_l1': 4, 'context_size_yyx': 1, 'num_mix_components_yyx': 1, 'context_extractor_yyx': 'lstm', 'activation_func_yyx': 'GELU', 'L2_weight_yyx': 0.0007285959565635458, 'L_entropy_weight_yyx': 8.171156593266048e-10, 'L_sep_weight_yyx': 2.309477029747038e-07, 'L_scale_weight_yyx': 6.910885847325888e-08, 'learning_rate_yyx': 0.0049052290965767575}. Best is trial 0 with value: -1.7756637156059056.
[I 2026-03-18 18:47:40,755] Trial 2 pruned. 
[I 2026-03-18 18:47:51,802] Trial 2 pruned. 
[I 2026-03-18 18:47:56,262] Trial 3 pruned. 
[I 2026-03-18 18:48:06,776] Trial 1 finished with value: -0.7902196436195993 and parameters: {'n_layers_yyx': 2, 'hidden_size_yyx_l0': 5, 'hidden_size_yyx_l1': 4, 'context_size_yyx': 2, 'num_mix_components_yyx': 2, 'context_extractor_yyx': 'gru', 'activation_func_yyx': 'ReLU', 'L2_weight_yyx': 7.629105683486178e-07, 'L_entropy_weight_yyx': 0.0008201032056880086, 'L_sep_weight_yyx': 3.0350668608166237e-05, 'L_scale_weight_yyx': 6.928155160907258e-07, 'learning_rate_yyx': 0.0015361312162740267}. Best is trial 1 with value: -0.7902196436195993.
[I 2026-03-18 18:48:10,229] Trial 3 pruned. 
[I 2026-03-18 18:48:16,713] Trial 2 pruned. 
[I 2026-03-18 18:48:17,610] Trial 5 finished with value: -0.8238654312742337 and parameters: {'n_layers_yyx': 2, 'hidden_size_yyx_l0': 3, 'hidden_size_yyx_l1': 6, 'context_size_yyx': 3, 'num_mix_components_yyx': 3, 'context_extractor_yyx': 'gru', 'activation_func_yyx': 'Tanh', 'L2_weight_yyx': 4.874658216177243e-09, 'L_entropy_weight_yyx': 1.1647747598535503e-08, 'L_sep_weight_yyx': 4.382010449075371e-09, 'L_scale_weight_yyx': 3.4805748902700475e-08, 'learning_rate_yyx': 0.0034198953838520192}. Best is trial 1 with value: -0.8246437647494115.
[I 2026-03-18 18:48:22,446] Trial 4 pruned. 
[I 2026-03-18 18:48:27,960] Trial 1 finished with value: -1.863694296077806 and parameters: {'n_layers_yyx': 2, 'hidden_size_yyx_l0': 4, 'hidden_size_yyx_l1': 4, 'context_size_yyx': 4, 'num_mix_components_yyx': 5, 'context_extractor_yyx': 'lstm', 'activation_func_yyx': 'ReLU', 'L2_weight_yyx': 2.020878076669718e-09, 'L_entropy_weight_yyx': 0.0006501046754211699, 'L_sep_weight_yyx': 1.4933775375629497e-10, 'L_scale_weight_yyx': 0.0002314936198721398, 'learning_rate_yyx': 0.0014138562487034543}. Best is trial 1 with value: -1.863694296077806.
[I 2026-03-18 18:48:31,681] Trial 3 pruned. 
[I 2026-03-18 18:48:34,716] Trial 1 finished with value: -2.2881647079635865 and parameters: {'n_layers_yyx': 1, 'hidden_size_yyx_l0': 2, 'context_size_yyx': 3, 'num_mix_components_yyx': 2, 'context_extractor_yyx': 'gru', 'activation_func_yyx': 'Tanh', 'L2_weight_yyx': 1.67463804784068e-06, 'L_entropy_weight_yyx': 3.580051105564183e-08, 'L_sep_weight_yyx': 3.089792054211572e-10, 'L_scale_weight_yyx': 1.4515791579599813e-06, 'learning_rate_yyx': 0.007907381045011876}. Best is trial 1 with value: -2.2881647079635865.
[I 2026-03-18 18:48:40,802] Trial 5 pruned. 
[I 2026-03-18 18:48:43,868] Trial 2 pruned. 
[I 2026-03-18 18:48:51,325] Trial 4 pruned. 
[I 2026-03-18 18:48:52,401] Trial 9 finished with value: -0.8968342519414121 and parameters: {'n_layers_yyx': 2, 'hidden_size_yyx_l0': 3, 'hidden_size_yyx_l1': 4, 'context_size_yyx': 2, 'num_mix_components_yyx': 5, 'context_extractor_yyx': 'gru', 'activation_func_yyx': 'Tanh', 'L2_weight_yyx': 4.232448766479174e-06, 'L_entropy_weight_yyx': 3.7661753639208385e-09, 'L_sep_weight_yyx': 2.378260372880264e-06, 'L_scale_weight_yyx': 0.0008661615575249427, 'learning_rate_yyx': 0.0022686280289206224}. Best is trial 0 with value: -0.9147985592774902.
[I 2026-03-18 18:48:53,169] Trial 2 pruned. 
[I 2026-03-18 18:48:56,718] Trial 2 pruned. 
[I 2026-03-18 18:49:03,524] Trial 2 pruned. 
[I 2026-03-18 18:49:07,485] Trial 1 finished with value: -1.7817464685921718 and parameters: {'n_layers_yyx': 2, 'hidden_size_yyx_l0': 4, 'hidden_size_yyx_l1': 3, 'context_size_yyx': 4, 'num_mix_components_yyx': 1, 'context_extractor_yyx': 'lstm', 'activation_func_yyx': 'ReLU', 'L2_weight_yyx': 5.56324218569234e-06, 'L_entropy_weight_yyx': 1.509941892007687e-08, 'L_sep_weight_yyx': 3.379664117190181e-09, 'L_scale_weight_yyx': 1.940878766360261e-05, 'learning_rate_yyx': 0.0038970198851181912}. Best is trial 1 with value: -1.7817464685921718.
[I 2026-03-18 18:49:11,005] Trial 2 finished with value: -2.279533784042228 and parameters: {'n_layers_yyx': 1, 'hidden_size_yyx_l0': 4, 'context_size_yyx': 2, 'num_mix_components_yyx': 3, 'context_extractor_yyx': 'lstm', 'activation_func_yyx': 'GELU', 'L2_weight_yyx': 8.903361069899589e-10, 'L_entropy_weight_yyx': 3.387097013556054e-10, 'L_sep_weight_yyx': 2.850208800862147e-06, 'L_scale_weight_yyx': 2.4536602675345107e-06, 'learning_rate_yyx': 0.002774719584514961}. Best is trial 2 with value: -2.279533784042228.
[I 2026-03-18 18:49:12,407] Trial 2 finished with value: -0.8108250717997023 and parameters: {'n_layers_yyx': 1, 'hidden_size_yyx_l0': 5, 'context_size_yyx': 1, 'num_mix_components_yyx': 3, 'context_extractor_yyx': 'lstm', 'activation_func_yyx': 'ReLU', 'L2_weight_yyx': 2.286963051058408e-06, 'L_entropy_weight_yyx': 0.0002513446520727361, 'L_sep_weight_yyx': 1.9892931232295684e-05, 'L_scale_weight_yyx': 4.056312667499683e-05, 'learning_rate_yyx': 0.006015753525323326}. Best is trial 1 with value: -0.8235284532014517.
[I 2026-03-18 18:49:13,781] Trial 3 pruned. 
[I 2026-03-18 18:49:27,763] Trial 3 pruned. 
[I 2026-03-18 18:49:28,310] Trial 1 finished with value: -2.261185738959796 and parameters: {'n_layers_yyx': 1, 'hidden_size_yyx_l0': 5, 'context_size_yyx': 1, 'num_mix_components_yyx': 1, 'context_extractor_yyx': 'gru', 'activation_func_yyx': 'GELU', 'L2_weight_yyx': 2.460291010850763e-10, 'L_entropy_weight_yyx': 7.581384747008626e-06, 'L_sep_weight_yyx': 8.262451018646733e-10, 'L_scale_weight_yyx': 4.29481976906024e-05, 'learning_rate_yyx': 0.00919282071616327}. Best is trial 0 with value: -2.2633646515681303.
[I 2026-03-18 18:49:31,598] Trial 3 pruned. 
[I 2026-03-18 18:49:31,698] Trial 6 pruned. 
[I 2026-03-18 18:49:37,849] Trial 3 pruned. 
[I 2026-03-18 18:49:37,877] Trial 1 finished with value: -2.265174071966799 and parameters: {'n_layers_yyx': 2, 'hidden_size_yyx_l0': 4, 'hidden_size_yyx_l1': 6, 'context_size_yyx': 1, 'num_mix_components_yyx': 3, 'context_extractor_yyx': 'gru', 'activation_func_yyx': 'ReLU', 'L2_weight_yyx': 3.992412788695064e-09, 'L_entropy_weight_yyx': 7.244726113283859e-06, 'L_sep_weight_yyx': 1.8057228710460049e-06, 'L_scale_weight_yyx': 3.023620022298446e-05, 'learning_rate_yyx': 0.0007332299994718064}. Best is trial 0 with value: -2.277465192778458.
[I 2026-03-18 18:49:46,914] Trial 2 finished with value: -0.8370103483890325 and parameters: {'n_layers_yyx': 2, 'hidden_size_yyx_l0': 2, 'hidden_size_yyx_l1': 3, 'context_size_yyx': 2, 'num_mix_components_yyx': 4, 'context_extractor_yyx': 'lstm', 'activation_func_yyx': 'Tanh', 'L2_weight_yyx': 9.926740555830513e-08, 'L_entropy_weight_yyx': 3.3036189379257198e-06, 'L_sep_weight_yyx': 1.6433855896762187e-06, 'L_scale_weight_yyx': 4.971772463137617e-07, 'learning_rate_yyx': 0.007420826635822727}. Best is trial 2 with value: -0.8370103483890325.
[I 2026-03-18 18:49:50,662] Trial 7 pruned. 
[I 2026-03-18 18:49:56,746] Trial 1 finished with value: -1.761499812578914 and parameters: {'n_layers_yyx': 2, 'hidden_size_yyx_l0': 3, 'hidden_size_yyx_l1': 3, 'context_size_yyx': 1, 'num_mix_components_yyx': 1, 'context_extractor_yyx': 'gru', 'activation_func_yyx': 'GELU', 'L2_weight_yyx': 5.251353956593362e-09, 'L_entropy_weight_yyx': 0.0004437721111372886, 'L_sep_weight_yyx': 0.000686819107756123, 'L_scale_weight_yyx': 4.789997540496907e-09, 'learning_rate_yyx': 0.0021222938718420264}. Best is trial 1 with value: -1.761499812578914.
[I 2026-03-18 18:50:03,402] Trial 1 finished with value: -2.2866954714752907 and parameters: {'n_layers_yyx': 2, 'hidden_size_yyx_l0': 3, 'hidden_size_yyx_l1': 6, 'context_size_yyx': 3, 'num_mix_components_yyx': 4, 'context_extractor_yyx': 'gru', 'activation_func_yyx': 'Tanh', 'L2_weight_yyx': 4.782315811206194e-10, 'L_entropy_weight_yyx': 8.554339236248816e-10, 'L_sep_weight_yyx': 1.620156319590396e-05, 'L_scale_weight_yyx': 0.00028611642045042767, 'learning_rate_yyx': 0.004959461869118288}. Best is trial 1 with value: -2.2866954714752907.
[I 2026-03-18 18:50:16,841] Trial 2 pruned. 
[I 2026-03-18 18:50:19,509] Trial 2 pruned. 
[I 2026-03-18 18:50:20,848] Trial 3 finished with value: -2.259222210402004 and parameters: {'n_layers_yyx': 2, 'hidden_size_yyx_l0': 4, 'hidden_size_yyx_l1': 2, 'context_size_yyx': 3, 'num_mix_components_yyx': 2, 'context_extractor_yyx': 'lstm', 'activation_func_yyx': 'ReLU', 'L2_weight_yyx': 1.4277598917707936e-10, 'L_entropy_weight_yyx': 5.960955965917551e-06, 'L_sep_weight_yyx': 3.7189471799749104e-08, 'L_scale_weight_yyx': 2.002655483877557e-06, 'learning_rate_yyx': 0.0006509222546844644}. Best is trial 0 with value: -2.2740171920421512.
[I 2026-03-18 18:50:36,246] Trial 3 pruned. 
[I 2026-03-18 18:50:41,490] Trial 2 finished with value: -2.2083321590322043 and parameters: {'n_layers_yyx': 1, 'hidden_size_yyx_l0': 3, 'context_size_yyx': 2, 'num_mix_components_yyx': 4, 'context_extractor_yyx': 'lstm', 'activation_func_yyx': 'ReLU', 'L2_weight_yyx': 0.0005472771141911806, 'L_entropy_weight_yyx': 1.2082038834865634e-05, 'L_sep_weight_yyx': 2.867195979859237e-06, 'L_scale_weight_yyx': 6.976473508724455e-05, 'learning_rate_yyx': 0.0021230857032261924}. Best is trial 2 with value: -2.2083321590322043.
[I 2026-03-18 18:50:41,497] Trial 2 finished with value: -2.272224617884258 and parameters: {'n_layers_yyx': 2, 'hidden_size_yyx_l0': 4, 'hidden_size_yyx_l1': 3, 'context_size_yyx': 2, 'num_mix_components_yyx': 3, 'context_extractor_yyx': 'lstm', 'activation_func_yyx': 'Tanh', 'L2_weight_yyx': 3.80960084213228e-09, 'L_entropy_weight_yyx': 3.544894728922221e-07, 'L_sep_weight_yyx': 0.0008634541904846047, 'L_scale_weight_yyx': 1.6746197064180915e-09, 'learning_rate_yyx': 0.002478922423744931}. Best is trial 2 with value: -2.272224617884258.
[I 2026-03-18 18:50:47,791] Trial 3 finished with value: -0.8294512073961987 and parameters: {'n_layers_yyx': 1, 'hidden_size_yyx_l0': 6, 'context_size_yyx': 4, 'num_mix_components_yyx': 5, 'context_extractor_yyx': 'gru', 'activation_func_yyx': 'ReLU', 'L2_weight_yyx': 1.999523580329233e-06, 'L_entropy_weight_yyx': 1.4573386191621683e-09, 'L_sep_weight_yyx': 9.951771141312094e-07, 'L_scale_weight_yyx': 8.009539550091458e-10, 'learning_rate_yyx': 0.002444569664393931}. Best is trial 0 with value: -0.8324342893885016.
[I 2026-03-18 18:51:04,196] Trial 4 pruned. 
[I 2026-03-18 18:51:05,499] Trial 1 finished with value: -2.272496318017313 and parameters: {'n_layers_yyx': 2, 'hidden_size_yyx_l0': 6, 'hidden_size_yyx_l1': 6, 'context_size_yyx': 4, 'num_mix_components_yyx': 3, 'context_extractor_yyx': 'gru', 'activation_func_yyx': 'ReLU', 'L2_weight_yyx': 3.402472318201046e-10, 'L_entropy_weight_yyx': 0.00013510343134733575, 'L_sep_weight_yyx': 8.519954974680501e-06, 'L_scale_weight_yyx': 2.064044038376088e-06, 'learning_rate_yyx': 0.00120599410515641}. Best is trial 1 with value: -2.272496318017313.
[I 2026-03-18 18:51:22,762] Trial 2 finished with value: -0.7982230926017817 and parameters: {'n_layers_yyx': 2, 'hidden_size_yyx_l0': 3, 'hidden_size_yyx_l1': 5, 'context_size_yyx': 3, 'num_mix_components_yyx': 2, 'context_extractor_yyx': 'lstm', 'activation_func_yyx': 'Tanh', 'L2_weight_yyx': 2.3118086853087376e-05, 'L_entropy_weight_yyx': 8.117909930941041e-06, 'L_sep_weight_yyx': 1.4924102073293656e-08, 'L_scale_weight_yyx': 0.00017943994182747803, 'learning_rate_yyx': 0.0005622830087891117}. Best is trial 0 with value: -0.8245499130542028.
[I 2026-03-18 18:51:29,129] Trial 4 finished with value: -0.8221012267615629 and parameters: {'n_layers_yyx': 1, 'hidden_size_yyx_l0': 5, 'context_size_yyx': 3, 'num_mix_components_yyx': 3, 'context_extractor_yyx': 'lstm', 'activation_func_yyx': 'Tanh', 'L2_weight_yyx': 0.00042103477651044647, 'L_entropy_weight_yyx': 2.181623438906373e-09, 'L_sep_weight_yyx': 4.506163228123681e-07, 'L_scale_weight_yyx': 7.366884069888195e-07, 'learning_rate_yyx': 0.002107718603266031}. Best is trial 1 with value: -0.8328681168211087.
[I 2026-03-18 18:51:38,678] Trial 3 finished with value: -1.785882901278409 and parameters: {'n_layers_yyx': 2, 'hidden_size_yyx_l0': 4, 'hidden_size_yyx_l1': 3, 'context_size_yyx': 2, 'num_mix_components_yyx': 4, 'context_extractor_yyx': 'gru', 'activation_func_yyx': 'Tanh', 'L2_weight_yyx': 5.029041454056244e-07, 'L_entropy_weight_yyx': 4.82112441869543e-07, 'L_sep_weight_yyx': 1.4998098812465152e-09, 'L_scale_weight_yyx': 1.5919847510465838e-07, 'learning_rate_yyx': 0.0022991569343222447}. Best is trial 3 with value: -1.785882901278409.
[I 2026-03-18 18:51:53,945] Trial 2 pruned. 
[I 2026-03-18 18:51:59,813] Trial 4 pruned. 
[I 2026-03-18 18:52:07,298] Trial 6 finished with value: -0.799159806447332 and parameters: {'n_layers_yyx': 2, 'hidden_size_yyx_l0': 2, 'hidden_size_yyx_l1': 5, 'context_size_yyx': 2, 'num_mix_components_yyx': 5, 'context_extractor_yyx': 'gru', 'activation_func_yyx': 'ReLU', 'L2_weight_yyx': 0.0003401098420364088, 'L_entropy_weight_yyx': 2.843505914356396e-05, 'L_sep_weight_yyx': 4.16920678397146e-05, 'L_scale_weight_yyx': 1.514089537777243e-10, 'learning_rate_yyx': 0.0040239464235754885}. Best is trial 0 with value: -0.8279563193835395.
[I 2026-03-18 18:52:27,180] Trial 1 finished with value: -1.7737064478205895 and parameters: {'n_layers_yyx': 2, 'hidden_size_yyx_l0': 5, 'hidden_size_yyx_l1': 6, 'context_size_yyx': 1, 'num_mix_components_yyx': 5, 'context_extractor_yyx': 'gru', 'activation_func_yyx': 'GELU', 'L2_weight_yyx': 8.391102762875018e-08, 'L_entropy_weight_yyx': 1.4082428739210828e-10, 'L_sep_weight_yyx': 2.371724743690095e-10, 'L_scale_weight_yyx': 0.00019201464945021386, 'learning_rate_yyx': 0.0008801138152255603}. Best is trial 0 with value: -1.775654347633956.
