[I 2026-03-18 18:47:35,938] Trial 35 pruned. 
[I 2026-03-18 18:47:39,270] Trial 38 pruned. 
[I 2026-03-18 18:47:40,010] Trial 40 pruned. 
[I 2026-03-18 18:47:41,993] Trial 36 pruned. 
[I 2026-03-18 18:47:44,111] Trial 36 pruned. 
[I 2026-03-18 18:47:45,007] Trial 38 pruned. 
[I 2026-03-18 18:47:46,237] Trial 30 finished with value: -1.6626248786493032 and parameters: {'n_layers_yyx': 2, 'hidden_size_yyx_l0': 5, 'hidden_size_yyx_l1': 5, 'context_size_yyx': 4, 'num_mix_components_yyx': 4, 'context_extractor_yyx': 'gru', 'activation_func_yyx': 'Tanh', 'L2_weight_yyx': 2.6229427464957343e-06, 'L_entropy_weight_yyx': 1.4038032439584695e-07, 'L_sep_weight_yyx': 6.064875157956862e-07, 'L_scale_weight_yyx': 0.00011616508608229209, 'learning_rate_yyx': 0.004363277400025898}. Best is trial 0 with value: -1.6683178048964529.
[I 2026-03-18 18:47:46,891] Trial 17 pruned. 
[I 2026-03-18 18:47:48,823] Trial 38 pruned. 
[I 2026-03-18 18:47:54,568] Trial 25 pruned. 
[I 2026-03-18 18:47:57,519] Trial 33 finished with value: -1.655572197320257 and parameters: {'n_layers_yyx': 2, 'hidden_size_yyx_l0': 5, 'hidden_size_yyx_l1': 5, 'context_size_yyx': 1, 'num_mix_components_yyx': 4, 'context_extractor_yyx': 'gru', 'activation_func_yyx': 'GELU', 'L2_weight_yyx': 4.099251351377448e-09, 'L_entropy_weight_yyx': 4.43781154296446e-07, 'L_sep_weight_yyx': 4.240412425911246e-07, 'L_scale_weight_yyx': 7.09556471184488e-05, 'learning_rate_yyx': 0.009658039668614291}. Best is trial 23 with value: -1.675936991716372.
[I 2026-03-18 18:48:01,410] Trial 39 pruned. 
[I 2026-03-18 18:48:01,978] Trial 37 pruned. 
[I 2026-03-18 18:48:03,151] Trial 39 pruned. 
[I 2026-03-18 18:48:06,340] Trial 31 pruned. 
[I 2026-03-18 18:48:08,152] Trial 31 pruned. 
[I 2026-03-18 18:48:08,330] Trial 37 pruned. 
[I 2026-03-18 18:48:09,369] Trial 38 pruned. 
[I 2026-03-18 18:48:10,089] Trial 40 pruned. 
[I 2026-03-18 18:48:10,699] Trial 49 finished with value: -2.6311385653269723 and parameters: {'n_layers_yyx': 2, 'hidden_size_yyx_l0': 3, 'hidden_size_yyx_l1': 5, 'context_size_yyx': 3, 'num_mix_components_yyx': 5, 'context_extractor_yyx': 'lstm', 'activation_func_yyx': 'Tanh', 'L2_weight_yyx': 1.5211057421743668e-06, 'L_entropy_weight_yyx': 4.2140961565975776e-05, 'L_sep_weight_yyx': 6.059326225619993e-05, 'L_scale_weight_yyx': 5.276834523704007e-09, 'learning_rate_yyx': 0.006762861683753208}. Best is trial 14 with value: -2.6415204441902964.

Source events: 32635
Target events: 12731
Full model ln_yyx : 1795.77368 nats/sec, 126.94968 nats/event
Full model Log loss : -2.60045
Full model ln_yyx : 1792.25621 nats/sec, 126.70101 nats/event
Full model Log loss : -2.59864
Full model ln_yyx : 1796.12978 nats/sec, 126.97485 nats/event
Full model Log loss : -2.60101
Full model ln_yyx : 1821.19405 nats/sec, 128.74673 nats/event
Full model Log loss : -2.63804
Full model ln_yyx : 1816.26405 nats/sec, 128.39821 nats/event
Full model Log loss : -2.64152
Full model ln_yyx : 1814.66847 nats/sec, 128.28542 nats/event
Full model Log loss : -2.64099
Full model ln_yyx : 1819.90965 nats/sec, 128.65593 nats/event
Full model Log loss : -2.63440
Full model ln_yyx : 1810.25171 nats/sec, 127.97318 nats/event
Full model Log loss : -2.63110
Full model ln_yyx : 1808.57586 nats/sec, 127.85471 nats/event
Full model Log loss : -2.63308
Full model ln_yyx : 1784.36041 nats/sec, 126.14283 nats/event
Full model Log loss : -2.59732
Full model ln_yyx : 1819.39193 nats/sec, 128.61933 nats/event
Full model Log loss : -2.63114
Optimization finished. Config saved to results/opt-full/opt_full_120_best_config.txt
[I 2026-03-18 18:48:15,578] Trial 39 pruned. 
[I 2026-03-18 18:48:18,520] Trial 38 pruned. 
[I 2026-03-18 18:48:20,077] Trial 30 finished with value: -2.598368882908223 and parameters: {'n_layers_yyx': 2, 'hidden_size_yyx_l0': 6, 'hidden_size_yyx_l1': 4, 'context_size_yyx': 3, 'num_mix_components_yyx': 4, 'context_extractor_yyx': 'lstm', 'activation_func_yyx': 'Tanh', 'L2_weight_yyx': 9.550994754585457e-10, 'L_entropy_weight_yyx': 1.6943666062538982e-10, 'L_sep_weight_yyx': 2.029514295814014e-07, 'L_scale_weight_yyx': 0.000168186149545226, 'learning_rate_yyx': 0.0010314738019331707}. Best is trial 6 with value: -2.642843521506465.
[I 2026-03-18 18:48:23,353] Trial 49 finished with value: -1.6487152207327214 and parameters: {'n_layers_yyx': 2, 'hidden_size_yyx_l0': 4, 'hidden_size_yyx_l1': 6, 'context_size_yyx': 3, 'num_mix_components_yyx': 3, 'context_extractor_yyx': 'lstm', 'activation_func_yyx': 'ReLU', 'L2_weight_yyx': 0.0004903995474332599, 'L_entropy_weight_yyx': 0.00015008801530549934, 'L_sep_weight_yyx': 2.1508732760076864e-08, 'L_scale_weight_yyx': 0.00022495758852824745, 'learning_rate_yyx': 0.007167482237103898}. Best is trial 12 with value: -1.6645964610425732.

Source events: 10683
Target events: 3403
Full model ln_yyx : 113.61910 nats/sec, 30.04913 nats/event
Full model Log loss : -1.64313
Full model ln_yyx : 115.61658 nats/sec, 30.57741 nats/event
Full model Log loss : -1.65498
Full model ln_yyx : 114.68482 nats/sec, 30.33098 nats/event
Full model Log loss : -1.65567
Full model ln_yyx : 113.82065 nats/sec, 30.10244 nats/event
Full model Log loss : -1.66373
Full model ln_yyx : 114.06078 nats/sec, 30.16594 nats/event
Full model Log loss : -1.66044
Full model ln_yyx : 111.88507 nats/sec, 29.59053 nats/event
Full model Log loss : -1.65403
Full model ln_yyx : 114.81688 nats/sec, 30.36591 nats/event
Full model Log loss : -1.66460
Full model ln_yyx : 113.48820 nats/sec, 30.01451 nats/event
Full model Log loss : -1.65451
Full model ln_yyx : 113.83792 nats/sec, 30.10700 nats/event
Full model Log loss : -1.65038
Full model ln_yyx : 111.88117 nats/sec, 29.58950 nats/event
Full model Log loss : -1.64632
Full model ln_yyx : 111.59954 nats/sec, 29.51501 nats/event
Full model Log loss : -1.64897
Full model ln_yyx : 113.93561 nats/sec, 30.13284 nats/event
Full model Log loss : -1.64872
Optimization finished. Config saved to results/opt-full/opt_full_105_best_config.txt
[I 2026-03-18 18:48:23,755] Trial 33 finished with value: -1.6659352198831157 and parameters: {'n_layers_yyx': 2, 'hidden_size_yyx_l0': 4, 'hidden_size_yyx_l1': 6, 'context_size_yyx': 2, 'num_mix_components_yyx': 5, 'context_extractor_yyx': 'gru', 'activation_func_yyx': 'GELU', 'L2_weight_yyx': 6.299538030081981e-05, 'L_entropy_weight_yyx': 1.0692175739374382e-08, 'L_sep_weight_yyx': 3.243449668212582e-10, 'L_scale_weight_yyx': 8.746125095044454e-07, 'learning_rate_yyx': 0.009626474224899229}. Best is trial 19 with value: -1.6674850489567747.
[I 2026-03-18 18:48:24,593] Trial 40 pruned. 
[I 2026-03-18 18:48:24,605] Trial 41 pruned. 
[I 2026-03-18 18:48:30,615] Trial 34 pruned. 
[I 2026-03-18 18:48:33,214] Trial 42 finished with value: -1.2653968091813121 and parameters: {'n_layers_yyx': 1, 'hidden_size_yyx_l0': 6, 'context_size_yyx': 4, 'num_mix_components_yyx': 5, 'context_extractor_yyx': 'lstm', 'activation_func_yyx': 'GELU', 'L2_weight_yyx': 8.84436983488194e-08, 'L_entropy_weight_yyx': 0.00027634646991713186, 'L_sep_weight_yyx': 5.0070679589459905e-09, 'L_scale_weight_yyx': 1.827334287358123e-09, 'learning_rate_yyx': 0.0025068013427466582}. Best is trial 5 with value: -1.2714442113851663.
[I 2026-03-18 18:48:35,869] Trial 38 finished with value: -2.6429482367908306 and parameters: {'n_layers_yyx': 2, 'hidden_size_yyx_l0': 4, 'hidden_size_yyx_l1': 6, 'context_size_yyx': 1, 'num_mix_components_yyx': 2, 'context_extractor_yyx': 'gru', 'activation_func_yyx': 'ReLU', 'L2_weight_yyx': 3.5051837092371345e-05, 'L_entropy_weight_yyx': 6.138437356400382e-05, 'L_sep_weight_yyx': 3.649155406294157e-05, 'L_scale_weight_yyx': 1.0013596171573281e-10, 'learning_rate_yyx': 0.009975204484241622}. Best is trial 10 with value: -2.6537577311197915.
[I 2026-03-18 18:48:39,934] Trial 43 pruned. 
[I 2026-03-18 18:48:42,080] Trial 26 finished with value: -1.6790522813108588 and parameters: {'n_layers_yyx': 1, 'hidden_size_yyx_l0': 6, 'context_size_yyx': 4, 'num_mix_components_yyx': 5, 'context_extractor_yyx': 'lstm', 'activation_func_yyx': 'Tanh', 'L2_weight_yyx': 2.7301054438676595e-08, 'L_entropy_weight_yyx': 0.0007933814148471609, 'L_sep_weight_yyx': 0.00018748822969929605, 'L_scale_weight_yyx': 1.0833244739348545e-09, 'learning_rate_yyx': 0.007557122501040587}. Best is trial 26 with value: -1.6790522813108588.
[I 2026-03-18 18:48:45,445] Trial 32 pruned. 
[I 2026-03-18 18:48:45,533] Trial 31 pruned. 
[I 2026-03-18 18:48:48,004] Trial 39 pruned. 
[I 2026-03-18 18:48:49,386] Trial 39 finished with value: -1.2747256689723891 and parameters: {'n_layers_yyx': 1, 'hidden_size_yyx_l0': 6, 'context_size_yyx': 4, 'num_mix_components_yyx': 4, 'context_extractor_yyx': 'lstm', 'activation_func_yyx': 'GELU', 'L2_weight_yyx': 1.3306792009657257e-09, 'L_entropy_weight_yyx': 1.1200037523254773e-09, 'L_sep_weight_yyx': 1.6392116207083533e-10, 'L_scale_weight_yyx': 2.3788069799927917e-06, 'learning_rate_yyx': 0.007891913806293801}. Best is trial 39 with value: -1.2747256689723891.
[I 2026-03-18 18:48:49,398] Trial 34 finished with value: -1.6592762986551235 and parameters: {'n_layers_yyx': 2, 'hidden_size_yyx_l0': 3, 'hidden_size_yyx_l1': 4, 'context_size_yyx': 3, 'num_mix_components_yyx': 3, 'context_extractor_yyx': 'lstm', 'activation_func_yyx': 'GELU', 'L2_weight_yyx': 2.5088918102186267e-08, 'L_entropy_weight_yyx': 1.040278058114644e-10, 'L_sep_weight_yyx': 2.8737589297138836e-10, 'L_scale_weight_yyx': 3.599475487945666e-08, 'learning_rate_yyx': 0.006628166101298997}. Best is trial 2 with value: -1.6799626520210098.
[I 2026-03-18 18:48:50,612] Trial 41 pruned. 
[I 2026-03-18 18:48:52,131] Trial 33 pruned. 
[I 2026-03-18 18:48:52,339] Trial 40 pruned. 
[I 2026-03-18 18:48:52,401] Trial 34 finished with value: -1.6777112637722686 and parameters: {'n_layers_yyx': 1, 'hidden_size_yyx_l0': 5, 'context_size_yyx': 4, 'num_mix_components_yyx': 4, 'context_extractor_yyx': 'lstm', 'activation_func_yyx': 'Tanh', 'L2_weight_yyx': 4.401216436162911e-06, 'L_entropy_weight_yyx': 2.4600696159682567e-07, 'L_sep_weight_yyx': 2.9059294940570203e-09, 'L_scale_weight_yyx': 1.5662451441970395e-09, 'learning_rate_yyx': 0.006640117404001943}. Best is trial 34 with value: -1.6777112637722686.
[I 2026-03-18 18:48:53,186] Trial 41 finished with value: -1.2623396360499581 and parameters: {'n_layers_yyx': 1, 'hidden_size_yyx_l0': 4, 'context_size_yyx': 4, 'num_mix_components_yyx': 4, 'context_extractor_yyx': 'gru', 'activation_func_yyx': 'Tanh', 'L2_weight_yyx': 1.0988426312226347e-06, 'L_entropy_weight_yyx': 0.0009741493236758689, 'L_sep_weight_yyx': 3.531613666188023e-07, 'L_scale_weight_yyx': 0.0007905269402080756, 'learning_rate_yyx': 0.004395385367745511}. Best is trial 6 with value: -1.270142151555821.
[I 2026-03-18 18:48:54,778] Trial 35 pruned. 
[I 2026-03-18 18:48:58,293] Trial 35 pruned. 
[I 2026-03-18 18:49:01,523] Trial 42 pruned. 
[I 2026-03-18 18:49:06,056] Trial 34 pruned. 
[I 2026-03-18 18:49:10,930] Trial 36 pruned. 
[I 2026-03-18 18:49:11,281] Trial 40 finished with value: -2.6389502359323496 and parameters: {'n_layers_yyx': 1, 'hidden_size_yyx_l0': 5, 'context_size_yyx': 3, 'num_mix_components_yyx': 5, 'context_extractor_yyx': 'gru', 'activation_func_yyx': 'ReLU', 'L2_weight_yyx': 0.00021411664264323825, 'L_entropy_weight_yyx': 2.2577206205819388e-08, 'L_sep_weight_yyx': 1.022531283240807e-05, 'L_scale_weight_yyx': 4.56158091119385e-08, 'learning_rate_yyx': 0.009218373907655791}. Best is trial 40 with value: -2.6389502359323496.
[I 2026-03-18 18:49:13,108] Trial 43 finished with value: -2.6403061447515017 and parameters: {'n_layers_yyx': 2, 'hidden_size_yyx_l0': 3, 'hidden_size_yyx_l1': 5, 'context_size_yyx': 3, 'num_mix_components_yyx': 5, 'context_extractor_yyx': 'gru', 'activation_func_yyx': 'Tanh', 'L2_weight_yyx': 1.9186237047136927e-08, 'L_entropy_weight_yyx': 2.2906873513393353e-08, 'L_sep_weight_yyx': 0.0009058049999997443, 'L_scale_weight_yyx': 5.638442162836839e-10, 'learning_rate_yyx': 0.008534102175844105}. Best is trial 43 with value: -2.6403061447515017.
[I 2026-03-18 18:49:13,685] Trial 33 finished with value: -1.676624944281188 and parameters: {'n_layers_yyx': 2, 'hidden_size_yyx_l0': 6, 'hidden_size_yyx_l1': 4, 'context_size_yyx': 4, 'num_mix_components_yyx': 3, 'context_extractor_yyx': 'lstm', 'activation_func_yyx': 'Tanh', 'L2_weight_yyx': 2.564424522123712e-09, 'L_entropy_weight_yyx': 0.0003194370693633438, 'L_sep_weight_yyx': 5.951515952630271e-10, 'L_scale_weight_yyx': 6.137232938322337e-08, 'learning_rate_yyx': 0.005900080529768585}. Best is trial 33 with value: -1.676624944281188.
[I 2026-03-18 18:49:13,732] Trial 36 pruned. 
[I 2026-03-18 18:49:14,174] Trial 35 pruned. 
[I 2026-03-18 18:49:17,169] Trial 34 finished with value: -1.6543547269584356 and parameters: {'n_layers_yyx': 2, 'hidden_size_yyx_l0': 4, 'hidden_size_yyx_l1': 4, 'context_size_yyx': 3, 'num_mix_components_yyx': 5, 'context_extractor_yyx': 'gru', 'activation_func_yyx': 'GELU', 'L2_weight_yyx': 4.506780220379601e-10, 'L_entropy_weight_yyx': 5.8031844268097326e-08, 'L_sep_weight_yyx': 1.8929463085907407e-08, 'L_scale_weight_yyx': 0.0003967266397713694, 'learning_rate_yyx': 0.006376760448531314}. Best is trial 23 with value: -1.675936991716372.
[I 2026-03-18 18:49:19,041] Trial 37 pruned. 
[I 2026-03-18 18:49:21,361] Trial 46 pruned. 
[I 2026-03-18 18:49:22,622] Trial 37 pruned. 
[I 2026-03-18 18:49:24,970] Trial 39 pruned. 
[I 2026-03-18 18:49:27,856] Trial 32 pruned. 
[I 2026-03-18 18:49:29,840] Trial 18 finished with value: -1.6716810843741248 and parameters: {'n_layers_yyx': 2, 'hidden_size_yyx_l0': 6, 'hidden_size_yyx_l1': 5, 'context_size_yyx': 4, 'num_mix_components_yyx': 3, 'context_extractor_yyx': 'lstm', 'activation_func_yyx': 'GELU', 'L2_weight_yyx': 1.363279254631182e-05, 'L_entropy_weight_yyx': 2.1219692227415025e-06, 'L_sep_weight_yyx': 6.9603794888753e-05, 'L_scale_weight_yyx': 9.99052081083701e-10, 'learning_rate_yyx': 0.009978226781855675}. Best is trial 18 with value: -1.6716810843741248.
[I 2026-03-18 18:49:31,281] Trial 41 pruned. 
[I 2026-03-18 18:49:31,309] Trial 36 pruned. 
[I 2026-03-18 18:49:36,240] Trial 40 pruned. 
[I 2026-03-18 18:49:37,456] Trial 41 pruned. 
[I 2026-03-18 18:49:37,475] Trial 37 pruned. 
[I 2026-03-18 18:49:37,857] Trial 37 finished with value: -1.6754623372699344 and parameters: {'n_layers_yyx': 2, 'hidden_size_yyx_l0': 5, 'hidden_size_yyx_l1': 3, 'context_size_yyx': 3, 'num_mix_components_yyx': 3, 'context_extractor_yyx': 'gru', 'activation_func_yyx': 'Tanh', 'L2_weight_yyx': 3.1846593585870813e-09, 'L_entropy_weight_yyx': 1.9708407176635496e-05, 'L_sep_weight_yyx': 2.7728790432820847e-09, 'L_scale_weight_yyx': 3.1147639426196073e-09, 'learning_rate_yyx': 0.0037468572465332124}. Best is trial 37 with value: -1.6754623372699344.
[I 2026-03-18 18:49:40,649] Trial 35 finished with value: -1.656694704116366 and parameters: {'n_layers_yyx': 2, 'hidden_size_yyx_l0': 4, 'hidden_size_yyx_l1': 6, 'context_size_yyx': 2, 'num_mix_components_yyx': 4, 'context_extractor_yyx': 'gru', 'activation_func_yyx': 'GELU', 'L2_weight_yyx': 0.0002189996588524928, 'L_entropy_weight_yyx': 2.2661160389193375e-09, 'L_sep_weight_yyx': 5.162791632155444e-09, 'L_scale_weight_yyx': 2.4133211276181507e-07, 'learning_rate_yyx': 0.00967692251398409}. Best is trial 19 with value: -1.6674850489567747.
[I 2026-03-18 18:49:40,818] Trial 43 pruned. 
[I 2026-03-18 18:49:44,595] Trial 32 finished with value: -1.6718713578636308 and parameters: {'n_layers_yyx': 2, 'hidden_size_yyx_l0': 5, 'hidden_size_yyx_l1': 4, 'context_size_yyx': 4, 'num_mix_components_yyx': 5, 'context_extractor_yyx': 'gru', 'activation_func_yyx': 'Tanh', 'L2_weight_yyx': 2.1777775808275334e-05, 'L_entropy_weight_yyx': 1.6878886831569324e-07, 'L_sep_weight_yyx': 3.67054441321717e-07, 'L_scale_weight_yyx': 0.0002886095236717406, 'learning_rate_yyx': 0.006470957125697485}. Best is trial 32 with value: -1.6718713578636308.
[I 2026-03-18 18:49:45,836] Trial 38 pruned. 
[I 2026-03-18 18:49:47,791] Trial 36 pruned. 
[I 2026-03-18 18:49:49,884] Trial 33 finished with value: -2.635426111215327 and parameters: {'n_layers_yyx': 1, 'hidden_size_yyx_l0': 4, 'context_size_yyx': 3, 'num_mix_components_yyx': 5, 'context_extractor_yyx': 'gru', 'activation_func_yyx': 'Tanh', 'L2_weight_yyx': 0.00023087832789792884, 'L_entropy_weight_yyx': 7.005498835985845e-07, 'L_sep_weight_yyx': 0.0006283505166581154, 'L_scale_weight_yyx': 2.868971431596915e-10, 'learning_rate_yyx': 0.006256079942219447}. Best is trial 10 with value: -2.640669339569724.
[I 2026-03-18 18:49:51,894] Trial 42 finished with value: -1.2640789264671903 and parameters: {'n_layers_yyx': 1, 'hidden_size_yyx_l0': 4, 'context_size_yyx': 4, 'num_mix_components_yyx': 4, 'context_extractor_yyx': 'gru', 'activation_func_yyx': 'Tanh', 'L2_weight_yyx': 3.3657497589032416e-10, 'L_entropy_weight_yyx': 0.000973370337445301, 'L_sep_weight_yyx': 1.71893919260459e-08, 'L_scale_weight_yyx': 0.0009297567723653577, 'learning_rate_yyx': 0.005793735214565067}. Best is trial 6 with value: -1.270142151555821.
[I 2026-03-18 18:49:53,220] Trial 39 pruned. 
[I 2026-03-18 18:49:55,533] Trial 35 pruned. 
[I 2026-03-18 18:49:56,262] Trial 42 pruned. 
[I 2026-03-18 18:49:59,875] Trial 47 pruned. 
[I 2026-03-18 18:50:01,018] Trial 38 pruned. 
[I 2026-03-18 18:50:01,021] Trial 33 pruned. 
[I 2026-03-18 18:50:02,392] Trial 42 pruned. 
[I 2026-03-18 18:50:03,765] Trial 36 pruned. 
[I 2026-03-18 18:50:05,153] Trial 37 pruned. 
[I 2026-03-18 18:50:08,463] Trial 40 pruned. 
[I 2026-03-18 18:50:09,837] Trial 40 finished with value: -2.615456009949894 and parameters: {'n_layers_yyx': 1, 'hidden_size_yyx_l0': 6, 'context_size_yyx': 3, 'num_mix_components_yyx': 4, 'context_extractor_yyx': 'gru', 'activation_func_yyx': 'GELU', 'L2_weight_yyx': 1.3887477063034179e-08, 'L_entropy_weight_yyx': 1.0429659029737963e-06, 'L_sep_weight_yyx': 1.3263455428962893e-07, 'L_scale_weight_yyx': 2.3620858797681184e-05, 'learning_rate_yyx': 0.0048443411841341145}. Best is trial 10 with value: -2.6537577311197915.
[I 2026-03-18 18:50:16,071] Trial 40 finished with value: -1.2769194301527662 and parameters: {'n_layers_yyx': 1, 'hidden_size_yyx_l0': 6, 'context_size_yyx': 4, 'num_mix_components_yyx': 4, 'context_extractor_yyx': 'lstm', 'activation_func_yyx': 'GELU', 'L2_weight_yyx': 7.631748263378999e-10, 'L_entropy_weight_yyx': 2.3237508066985808e-09, 'L_sep_weight_yyx': 1.5596661105263016e-10, 'L_scale_weight_yyx': 0.0003423126571842099, 'learning_rate_yyx': 0.004770532164932756}. Best is trial 40 with value: -1.2769194301527662.
[I 2026-03-18 18:50:17,398] Trial 48 pruned. 
[I 2026-03-18 18:50:18,531] Trial 34 pruned. 
[I 2026-03-18 18:50:19,393] Trial 44 finished with value: -1.2757269811718388 and parameters: {'n_layers_yyx': 1, 'hidden_size_yyx_l0': 5, 'context_size_yyx': 4, 'num_mix_components_yyx': 4, 'context_extractor_yyx': 'lstm', 'activation_func_yyx': 'GELU', 'L2_weight_yyx': 1.708209239109942e-05, 'L_entropy_weight_yyx': 0.000764862388896179, 'L_sep_weight_yyx': 4.855678999794531e-09, 'L_scale_weight_yyx': 2.6756589595306418e-09, 'learning_rate_yyx': 0.002612203476164785}. Best is trial 44 with value: -1.2757269811718388.
[I 2026-03-18 18:50:19,413] Trial 27 finished with value: -1.6704954655842785 and parameters: {'n_layers_yyx': 1, 'hidden_size_yyx_l0': 6, 'context_size_yyx': 3, 'num_mix_components_yyx': 5, 'context_extractor_yyx': 'lstm', 'activation_func_yyx': 'Tanh', 'L2_weight_yyx': 9.814061353718992e-09, 'L_entropy_weight_yyx': 0.0005861954545187296, 'L_sep_weight_yyx': 3.3365894806349727e-05, 'L_scale_weight_yyx': 2.4960882353699482e-05, 'learning_rate_yyx': 0.0073758699799890744}. Best is trial 26 with value: -1.6790522813108588.
[I 2026-03-18 18:50:22,197] Trial 41 pruned. 
[I 2026-03-18 18:50:23,164] Trial 43 pruned. 
[I 2026-03-18 18:50:23,391] Trial 41 pruned. 
[I 2026-03-18 18:50:28,883] Trial 26 finished with value: -2.635805933839615 and parameters: {'n_layers_yyx': 1, 'hidden_size_yyx_l0': 4, 'context_size_yyx': 3, 'num_mix_components_yyx': 5, 'context_extractor_yyx': 'gru', 'activation_func_yyx': 'Tanh', 'L2_weight_yyx': 7.515627759349578e-05, 'L_entropy_weight_yyx': 0.00019312662169562156, 'L_sep_weight_yyx': 9.499363849612752e-08, 'L_scale_weight_yyx': 4.7903743220871846e-08, 'learning_rate_yyx': 0.009521295219411786}. Best is trial 21 with value: -2.6405605351488926.
[I 2026-03-18 18:50:28,952] Trial 42 pruned. 
[I 2026-03-18 18:50:31,192] Trial 45 pruned. 
[I 2026-03-18 18:50:32,248] Trial 34 finished with value: -1.6809483015043902 and parameters: {'n_layers_yyx': 2, 'hidden_size_yyx_l0': 6, 'hidden_size_yyx_l1': 5, 'context_size_yyx': 4, 'num_mix_components_yyx': 4, 'context_extractor_yyx': 'lstm', 'activation_func_yyx': 'Tanh', 'L2_weight_yyx': 1.0444449671041052e-10, 'L_entropy_weight_yyx': 1.9180286103315605e-05, 'L_sep_weight_yyx': 1.1034512267013983e-10, 'L_scale_weight_yyx': 1.921652601930179e-08, 'learning_rate_yyx': 0.008537438756117236}. Best is trial 34 with value: -1.6809483015043902.
[I 2026-03-18 18:50:33,929] Trial 44 pruned. 
[I 2026-03-18 18:50:33,990] Trial 35 pruned. 
[I 2026-03-18 18:50:36,023] Trial 41 finished with value: -2.629310459441085 and parameters: {'n_layers_yyx': 2, 'hidden_size_yyx_l0': 5, 'hidden_size_yyx_l1': 6, 'context_size_yyx': 3, 'num_mix_components_yyx': 4, 'context_extractor_yyx': 'lstm', 'activation_func_yyx': 'Tanh', 'L2_weight_yyx': 7.525636351948154e-05, 'L_entropy_weight_yyx': 0.00018933625877478845, 'L_sep_weight_yyx': 3.570787970106708e-10, 'L_scale_weight_yyx': 4.166630000557141e-10, 'learning_rate_yyx': 0.006536689899017708}. Best is trial 15 with value: -2.6388607085013045.
[I 2026-03-18 18:50:37,133] Trial 46 pruned. 
[I 2026-03-18 18:50:43,190] Trial 47 pruned. 
[I 2026-03-18 18:50:43,817] Trial 43 pruned. 
[I 2026-03-18 18:50:50,763] Trial 42 pruned. 
[I 2026-03-18 18:50:50,916] Trial 44 pruned. 
[I 2026-03-18 18:50:53,648] Trial 34 pruned. 
