[I 2026-03-17 17:25:35,521] Trial 49 pruned. 
Optimize task 22: group_id: POm, neuron_id: 56
Starting optimization for task 22...

--- Data Summary ---
Total events for target process 13628
Data Time: 900 seconds
Using device: cuda
Number of events in target process: 13628
Only one process provided, preparing dataloaders for the reduced model.
Reduced model ln_yy : 609.47512 nats/sec, 40.25004 nats/event
Reduced model Log loss : -1.70195
Number of events in target process: 13628
Only one process provided, preparing dataloaders for the reduced model.
Reduced model ln_yy : 617.64411 nats/sec, 40.78953 nats/event
Reduced model Log loss : -1.69954
Number of events in target process: 13628
Only one process provided, preparing dataloaders for the reduced model.
Number of events in target process: 13628
Only one process provided, preparing dataloaders for the reduced model.
Reduced model ln_yy : 612.75449 nats/sec, 40.46662 nats/event
Reduced model Log loss : -1.70299
Number of events in target process: 13628
Only one process provided, preparing dataloaders for the reduced model.
Number of events in target process: 13628
Only one process provided, preparing dataloaders for the reduced model.
Number of events in target process: 13628
Only one process provided, preparing dataloaders for the reduced model.
Reduced model ln_yy : 612.61506 nats/sec, 40.45741 nats/event
Reduced model Log loss : -1.70083
Number of events in target process: 13628
Only one process provided, preparing dataloaders for the reduced model.
Reduced model ln_yy : 616.82263 nats/sec, 40.73528 nats/event
Reduced model Log loss : -1.69790
Number of events in target process: 13628
Only one process provided, preparing dataloaders for the reduced model.
Number of events in target process: 13628
Only one process provided, preparing dataloaders for the reduced model.
Number of events in target process: 13628
Only one process provided, preparing dataloaders for the reduced model.
Reduced model ln_yy : 613.30879 nats/sec, 40.50322 nats/event
Reduced model Log loss : -1.70149
Number of events in target process: 13628
Only one process provided, preparing dataloaders for the reduced model.
Number of events in target process: 13628
Only one process provided, preparing dataloaders for the reduced model.
Number of events in target process: 13628
Only one process provided, preparing dataloaders for the reduced model.
Number of events in target process: 13628
Only one process provided, preparing dataloaders for the reduced model.
Number of events in target process: 13628
Only one process provided, preparing dataloaders for the reduced model.
Number of events in target process: 13628
Only one process provided, preparing dataloaders for the reduced model.
Number of events in target process: 13628
Only one process provided, preparing dataloaders for the reduced model.
Number of events in target process: 13628
Only one process provided, preparing dataloaders for the reduced model.
Number of events in target process: 13628
Only one process provided, preparing dataloaders for the reduced model.
Number of events in target process: 13628
Only one process provided, preparing dataloaders for the reduced model.
Reduced model ln_yy : 616.26360 nats/sec, 40.69836 nats/event
Reduced model Log loss : -1.70389
Number of events in target process: 13628
Only one process provided, preparing dataloaders for the reduced model.
Number of events in target process: 13628
Only one process provided, preparing dataloaders for the reduced model.
Number of events in target process: 13628
Only one process provided, preparing dataloaders for the reduced model.
Number of events in target process: 13628
Only one process provided, preparing dataloaders for the reduced model.
Number of events in target process: 13628
Only one process provided, preparing dataloaders for the reduced model.
Number of events in target process: 13628
Only one process provided, preparing dataloaders for the reduced model.
Number of events in target process: 13628
Only one process provided, preparing dataloaders for the reduced model.
Number of events in target process: 13628
Only one process provided, preparing dataloaders for the reduced model.
Number of events in target process: 13628
Only one process provided, preparing dataloaders for the reduced model.
Number of events in target process: 13628
Only one process provided, preparing dataloaders for the reduced model.
Reduced model ln_yy : 616.14203 nats/sec, 40.69033 nats/event
Reduced model Log loss : -1.70169
Number of events in target process: 13628
Only one process provided, preparing dataloaders for the reduced model.
Number of events in target process: 13628
Only one process provided, preparing dataloaders for the reduced model.
Number of events in target process: 13628
Only one process provided, preparing dataloaders for the reduced model.
Number of events in target process: 13628
Only one process provided, preparing dataloaders for the reduced model.
Number of events in target process: 13628
Only one process provided, preparing dataloaders for the reduced model.
Number of events in target process: 13628
Only one process provided, preparing dataloaders for the reduced model.
Number of events in target process: 13628
Only one process provided, preparing dataloaders for the reduced model.
Number of events in target process: 13628
Only one process provided, preparing dataloaders for the reduced model.
Number of events in target process: 13628
Only one process provided, preparing dataloaders for the reduced model.
Number of events in target process: 13628
Only one process provided, preparing dataloaders for the reduced model.
Number of events in target process: 13628
Only one process provided, preparing dataloaders for the reduced model.
Reduced model ln_yy : 615.98274 nats/sec, 40.67981 nats/event
Reduced model Log loss : -1.70112
Number of events in target process: 13628
Only one process provided, preparing dataloaders for the reduced model.
Reduced model ln_yy : 617.78761 nats/sec, 40.79901 nats/event
Reduced model Log loss : -1.70013
Number of events in target process: 13628
Only one process provided, preparing dataloaders for the reduced model.
Number of events in target process: 13628
Only one process provided, preparing dataloaders for the reduced model.
Number of events in target process: 13628
Only one process provided, preparing dataloaders for the reduced model.
Number of events in target process: 13628
Only one process provided, preparing dataloaders for the reduced model.
Number of events in target process: 13628
Only one process provided, preparing dataloaders for the reduced model.
Number of events in target process: 13628
Only one process provided, preparing dataloaders for the reduced model.
Number of events in target process: 13628
Only one process provided, preparing dataloaders for the reduced model.
Best trial:
  Value: -1.7038948064814108
  Params: {'n_layers_yy': 1, 'hidden_size_yy_l0': 2, 'context_size_yy': 2, 'num_mix_components_yy': 5, 'context_extractor_yy': 'gru', 'activation_func_yy': 'GELU', 'L2_weight_yy': 1.0986237955884808e-06, 'L_entropy_weight_yy': 2.2569655748055364e-06, 'L_sep_weight_yy': 3.350810974254629e-09, 'L_scale_weight_yy': 1.49102500283125e-08, 'learning_rate_yy': 0.009046744025103743}
Full best configuration saved to results/opt/opt_reduced_22_best_config.txt
Optimization finished.
[I 2026-03-17 17:25:39,402] Trial 47 finished with value: -1.9842696455605924 and parameters: {'n_layers_yy': 2, 'hidden_size_yy_l0': 2, 'hidden_size_yy_l1': 6, 'context_size_yy': 4, 'num_mix_components_yy': 3, 'context_extractor_yy': 'gru', 'activation_func_yy': 'ReLU', 'L2_weight_yy': 1.9362762714679167e-05, 'L_entropy_weight_yy': 1.6104991611702688e-06, 'L_sep_weight_yy': 3.129781428861488e-05, 'L_scale_weight_yy': 5.836768365232658e-09, 'learning_rate_yy': 0.007518725026877751}. Best is trial 24 with value: -1.9860150014876785.
[I 2026-03-17 17:25:40,857] Trial 29 pruned. 
[I 2026-03-17 17:25:46,432] Trial 44 finished with value: -2.639695928418474 and parameters: {'n_layers_yy': 1, 'hidden_size_yy_l0': 5, 'context_size_yy': 4, 'num_mix_components_yy': 4, 'context_extractor_yy': 'lstm', 'activation_func_yy': 'ReLU', 'L2_weight_yy': 1.5014170293221804e-06, 'L_entropy_weight_yy': 8.514993050209167e-09, 'L_sep_weight_yy': 5.0259863224704565e-06, 'L_scale_weight_yy': 0.00027980329962064, 'learning_rate_yy': 0.00893735717486313}. Best is trial 44 with value: -2.639695928418474.
[I 2026-03-17 17:25:47,262] Trial 30 pruned. 
[I 2026-03-17 17:25:47,851] Trial 32 pruned. 
[I 2026-03-17 17:25:50,209] Trial 22 finished with value: -2.974118816089101 and parameters: {'n_layers_yy': 1, 'hidden_size_yy_l0': 6, 'context_size_yy': 4, 'num_mix_components_yy': 4, 'context_extractor_yy': 'lstm', 'activation_func_yy': 'GELU', 'L2_weight_yy': 3.3632061694703386e-09, 'L_entropy_weight_yy': 1.0898899877910475e-05, 'L_sep_weight_yy': 9.995609650221875e-05, 'L_scale_weight_yy': 1.1012270871823313e-06, 'learning_rate_yy': 0.009723603546930913}. Best is trial 9 with value: -2.9754424140841684.
[I 2026-03-17 17:25:54,441] Trial 26 pruned. 
[I 2026-03-17 17:25:55,442] Trial 42 finished with value: -2.069735729296752 and parameters: {'n_layers_yy': 2, 'hidden_size_yy_l0': 5, 'hidden_size_yy_l1': 4, 'context_size_yy': 4, 'num_mix_components_yy': 5, 'context_extractor_yy': 'gru', 'activation_func_yy': 'ReLU', 'L2_weight_yy': 6.472026983013945e-09, 'L_entropy_weight_yy': 5.93265804261316e-08, 'L_sep_weight_yy': 2.1544202828043083e-08, 'L_scale_weight_yy': 6.1048126385308685e-06, 'learning_rate_yy': 0.004809711574471699}. Best is trial 41 with value: -2.093922187128181.
[I 2026-03-17 17:25:57,628] Trial 23 pruned. 
[I 2026-03-17 17:25:58,272] Trial 45 finished with value: -1.837656931834178 and parameters: {'n_layers_yy': 1, 'hidden_size_yy_l0': 4, 'context_size_yy': 1, 'num_mix_components_yy': 1, 'context_extractor_yy': 'lstm', 'activation_func_yy': 'Tanh', 'L2_weight_yy': 1.6956335944401247e-07, 'L_entropy_weight_yy': 2.5486636342504436e-05, 'L_sep_weight_yy': 1.5075357638388986e-07, 'L_scale_weight_yy': 2.9619756699993375e-09, 'learning_rate_yy': 0.006979513729024507}. Best is trial 10 with value: -1.8554935362796692.
[I 2026-03-17 17:25:59,105] Trial 48 finished with value: -1.9579512554201817 and parameters: {'n_layers_yy': 2, 'hidden_size_yy_l0': 2, 'hidden_size_yy_l1': 5, 'context_size_yy': 4, 'num_mix_components_yy': 3, 'context_extractor_yy': 'gru', 'activation_func_yy': 'ReLU', 'L2_weight_yy': 2.1426070913736412e-05, 'L_entropy_weight_yy': 6.726338319248129e-09, 'L_sep_weight_yy': 8.853335757281865e-05, 'L_scale_weight_yy': 7.579326938481608e-09, 'learning_rate_yy': 0.008689994674422401}. Best is trial 24 with value: -1.9860150014876785.
[I 2026-03-17 17:25:59,690] Trial 17 finished with value: -3.258882804361979 and parameters: {'n_layers_yy': 1, 'hidden_size_yy_l0': 5, 'context_size_yy': 4, 'num_mix_components_yy': 4, 'context_extractor_yy': 'gru', 'activation_func_yy': 'ReLU', 'L2_weight_yy': 2.2993597818697496e-09, 'L_entropy_weight_yy': 0.0009463354736065742, 'L_sep_weight_yy': 1.0708293934900867e-10, 'L_scale_weight_yy': 8.463003270975387e-10, 'learning_rate_yy': 0.005846081537471782}. Best is trial 16 with value: -3.2663029296875.
[I 2026-03-17 17:26:01,444] Trial 43 finished with value: -1.7803251262626263 and parameters: {'n_layers_yy': 2, 'hidden_size_yy_l0': 5, 'hidden_size_yy_l1': 5, 'context_size_yy': 3, 'num_mix_components_yy': 4, 'context_extractor_yy': 'lstm', 'activation_func_yy': 'GELU', 'L2_weight_yy': 0.0003146538442980254, 'L_entropy_weight_yy': 0.0002469257381091928, 'L_sep_weight_yy': 3.1314914504052877e-07, 'L_scale_weight_yy': 4.743517747034863e-06, 'learning_rate_yy': 0.007273835326366627}. Best is trial 8 with value: -1.786668244949495.
[I 2026-03-17 17:26:03,593] Trial 49 finished with value: -2.473193830732427 and parameters: {'n_layers_yy': 1, 'hidden_size_yy_l0': 6, 'context_size_yy': 4, 'num_mix_components_yy': 3, 'context_extractor_yy': 'lstm', 'activation_func_yy': 'Tanh', 'L2_weight_yy': 5.465309056749873e-09, 'L_entropy_weight_yy': 4.502774746592743e-05, 'L_sep_weight_yy': 1.164827869526252e-10, 'L_scale_weight_yy': 1.2446161261161088e-10, 'learning_rate_yy': 0.0020707563846850885}. Best is trial 2 with value: -2.476197165819489.
Optimize task 16: group_id: POm, neuron_id: 50
Starting optimization for task 16...

--- Data Summary ---
Total events for target process 29032
Data Time: 900 seconds
Using device: cuda
Number of events in target process: 29032
Only one process provided, preparing dataloaders for the reduced model.
Reduced model ln_yy : 3511.84345 nats/sec, 108.86811 nats/event
Reduced model Log loss : -2.44095
Number of events in target process: 29032
Only one process provided, preparing dataloaders for the reduced model.
Reduced model ln_yy : 3526.96040 nats/sec, 109.33674 nats/event
Reduced model Log loss : -2.44489
Number of events in target process: 29032
Only one process provided, preparing dataloaders for the reduced model.
Reduced model ln_yy : 3559.74519 nats/sec, 110.35308 nats/event
Reduced model Log loss : -2.47620
Number of events in target process: 29032
Only one process provided, preparing dataloaders for the reduced model.
Reduced model ln_yy : 3563.35638 nats/sec, 110.46503 nats/event
Reduced model Log loss : -2.47299
Number of events in target process: 29032
Only one process provided, preparing dataloaders for the reduced model.
Number of events in target process: 29032
Only one process provided, preparing dataloaders for the reduced model.
Number of events in target process: 29032
Only one process provided, preparing dataloaders for the reduced model.
Number of events in target process: 29032
Only one process provided, preparing dataloaders for the reduced model.
Number of events in target process: 29032
Only one process provided, preparing dataloaders for the reduced model.
Number of events in target process: 29032
Only one process provided, preparing dataloaders for the reduced model.
Reduced model ln_yy : 3562.42159 nats/sec, 110.43605 nats/event
Reduced model Log loss : -2.47065
Number of events in target process: 29032
Only one process provided, preparing dataloaders for the reduced model.
Number of events in target process: 29032
Only one process provided, preparing dataloaders for the reduced model.
Number of events in target process: 29032
Only one process provided, preparing dataloaders for the reduced model.
Number of events in target process: 29032
Only one process provided, preparing dataloaders for the reduced model.
Number of events in target process: 29032
Only one process provided, preparing dataloaders for the reduced model.
Number of events in target process: 29032
Only one process provided, preparing dataloaders for the reduced model.
Number of events in target process: 29032
Only one process provided, preparing dataloaders for the reduced model.
Number of events in target process: 29032
Only one process provided, preparing dataloaders for the reduced model.
Reduced model ln_yy : 3530.64647 nats/sec, 109.45101 nats/event
Reduced model Log loss : -2.44748
Number of events in target process: 29032
Only one process provided, preparing dataloaders for the reduced model.
Number of events in target process: 29032
Only one process provided, preparing dataloaders for the reduced model.
Number of events in target process: 29032
Only one process provided, preparing dataloaders for the reduced model.
Number of events in target process: 29032
Only one process provided, preparing dataloaders for the reduced model.
Number of events in target process: 29032
Only one process provided, preparing dataloaders for the reduced model.
Number of events in target process: 29032
Only one process provided, preparing dataloaders for the reduced model.
Number of events in target process: 29032
Only one process provided, preparing dataloaders for the reduced model.
Reduced model ln_yy : 3526.08080 nats/sec, 109.30948 nats/event
Reduced model Log loss : -2.44579
Number of events in target process: 29032
Only one process provided, preparing dataloaders for the reduced model.
Number of events in target process: 29032
Only one process provided, preparing dataloaders for the reduced model.
Number of events in target process: 29032
Only one process provided, preparing dataloaders for the reduced model.
Number of events in target process: 29032
Only one process provided, preparing dataloaders for the reduced model.
Number of events in target process: 29032
Only one process provided, preparing dataloaders for the reduced model.
Number of events in target process: 29032
Only one process provided, preparing dataloaders for the reduced model.
Reduced model ln_yy : 3526.59724 nats/sec, 109.32549 nats/event
Reduced model Log loss : -2.44719
Number of events in target process: 29032
Only one process provided, preparing dataloaders for the reduced model.
Number of events in target process: 29032
Only one process provided, preparing dataloaders for the reduced model.
Reduced model ln_yy : 3522.09239 nats/sec, 109.18583 nats/event
Reduced model Log loss : -2.44805
Number of events in target process: 29032
Only one process provided, preparing dataloaders for the reduced model.
Number of events in target process: 29032
Only one process provided, preparing dataloaders for the reduced model.
Number of events in target process: 29032
Only one process provided, preparing dataloaders for the reduced model.
Number of events in target process: 29032
Only one process provided, preparing dataloaders for the reduced model.
Number of events in target process: 29032
Only one process provided, preparing dataloaders for the reduced model.
Number of events in target process: 29032
Only one process provided, preparing dataloaders for the reduced model.
Reduced model ln_yy : 3574.20437 nats/sec, 110.80132 nats/event
Reduced model Log loss : -2.47197
Number of events in target process: 29032
Only one process provided, preparing dataloaders for the reduced model.
Number of events in target process: 29032
Only one process provided, preparing dataloaders for the reduced model.
Number of events in target process: 29032
Only one process provided, preparing dataloaders for the reduced model.
Reduced model ln_yy : 3552.98334 nats/sec, 110.14346 nats/event
Reduced model Log loss : -2.47089
Number of events in target process: 29032
Only one process provided, preparing dataloaders for the reduced model.
Reduced model ln_yy : 3574.48210 nats/sec, 110.80993 nats/event
Reduced model Log loss : -2.47200
Number of events in target process: 29032
Only one process provided, preparing dataloaders for the reduced model.
Number of events in target process: 29032
Only one process provided, preparing dataloaders for the reduced model.
Number of events in target process: 29032
Only one process provided, preparing dataloaders for the reduced model.
Number of events in target process: 29032
Only one process provided, preparing dataloaders for the reduced model.
Number of events in target process: 29032
Only one process provided, preparing dataloaders for the reduced model.
Number of events in target process: 29032
Only one process provided, preparing dataloaders for the reduced model.
Reduced model ln_yy : 3519.75770 nats/sec, 109.11346 nats/event
Reduced model Log loss : -2.44587
Number of events in target process: 29032
Only one process provided, preparing dataloaders for the reduced model.
Reduced model ln_yy : 3568.16427 nats/sec, 110.61408 nats/event
Reduced model Log loss : -2.47319
Best trial:
  Value: -2.476197165819489
  Params: {'n_layers_yy': 2, 'hidden_size_yy_l0': 6, 'hidden_size_yy_l1': 5, 'context_size_yy': 4, 'num_mix_components_yy': 3, 'context_extractor_yy': 'gru', 'activation_func_yy': 'ReLU', 'L2_weight_yy': 2.514964562721126e-07, 'L_entropy_weight_yy': 3.1863194593004153e-06, 'L_sep_weight_yy': 2.3814640967109104e-07, 'L_scale_weight_yy': 9.737697008772498e-05, 'learning_rate_yy': 0.005769686505608838}
Full best configuration saved to results/opt/opt_reduced_16_best_config.txt
Optimization finished.
[I 2026-03-17 17:26:06,911] Trial 24 finished with value: -2.4926837718550585 and parameters: {'n_layers_yy': 2, 'hidden_size_yy_l0': 3, 'hidden_size_yy_l1': 4, 'context_size_yy': 4, 'num_mix_components_yy': 5, 'context_extractor_yy': 'gru', 'activation_func_yy': 'GELU', 'L2_weight_yy': 6.885093703959191e-07, 'L_entropy_weight_yy': 2.7753811190250163e-09, 'L_sep_weight_yy': 9.822537148968771e-06, 'L_scale_weight_yy': 2.414049697895814e-06, 'learning_rate_yy': 0.009959145722324569}. Best is trial 24 with value: -2.4926837718550585.
[I 2026-03-17 17:26:07,735] Trial 33 pruned. 
[I 2026-03-17 17:26:14,480] Trial 34 pruned. 
