[I 2026-03-17 17:37:46,705] Trial 49 pruned. 
Optimize task 4: group_id: BC, neuron_id: 12
Starting optimization for task 4...

--- Data Summary ---
Total events for target process 54211
Data Time: 900 seconds
Using device: cuda
Number of events in target process: 54211
Only one process provided, preparing dataloaders for the reduced model.
Reduced model ln_yy : 14642.84674 nats/sec, 243.09756 nats/event
Reduced model Log loss : -3.11695
Number of events in target process: 54211
Only one process provided, preparing dataloaders for the reduced model.
Reduced model ln_yy : 14527.06610 nats/sec, 241.17540 nats/event
Reduced model Log loss : -3.10950
Number of events in target process: 54211
Only one process provided, preparing dataloaders for the reduced model.
Reduced model ln_yy : 14542.95795 nats/sec, 241.43923 nats/event
Reduced model Log loss : -3.11203
Number of events in target process: 54211
Only one process provided, preparing dataloaders for the reduced model.
Number of events in target process: 54211
Only one process provided, preparing dataloaders for the reduced model.
Reduced model ln_yy : 14591.36597 nats/sec, 242.24289 nats/event
Reduced model Log loss : -3.11832
Number of events in target process: 54211
Only one process provided, preparing dataloaders for the reduced model.
Number of events in target process: 54211
Only one process provided, preparing dataloaders for the reduced model.
Number of events in target process: 54211
Only one process provided, preparing dataloaders for the reduced model.
Reduced model ln_yy : 14568.74027 nats/sec, 241.86726 nats/event
Reduced model Log loss : -3.11870
Number of events in target process: 54211
Only one process provided, preparing dataloaders for the reduced model.
Number of events in target process: 54211
Only one process provided, preparing dataloaders for the reduced model.
Number of events in target process: 54211
Only one process provided, preparing dataloaders for the reduced model.
Number of events in target process: 54211
Only one process provided, preparing dataloaders for the reduced model.
Number of events in target process: 54211
Only one process provided, preparing dataloaders for the reduced model.
Reduced model ln_yy : 14712.15604 nats/sec, 244.24822 nats/event
Reduced model Log loss : -3.14680
Number of events in target process: 54211
Only one process provided, preparing dataloaders for the reduced model.
Reduced model ln_yy : 14598.92796 nats/sec, 242.36843 nats/event
Reduced model Log loss : -3.11688
Number of events in target process: 54211
Only one process provided, preparing dataloaders for the reduced model.
Number of events in target process: 54211
Only one process provided, preparing dataloaders for the reduced model.
Reduced model ln_yy : 14723.95831 nats/sec, 244.44416 nats/event
Reduced model Log loss : -3.14374
Number of events in target process: 54211
Only one process provided, preparing dataloaders for the reduced model.
Number of events in target process: 54211
Only one process provided, preparing dataloaders for the reduced model.
Number of events in target process: 54211
Only one process provided, preparing dataloaders for the reduced model.
Number of events in target process: 54211
Only one process provided, preparing dataloaders for the reduced model.
Number of events in target process: 54211
Only one process provided, preparing dataloaders for the reduced model.
Reduced model ln_yy : 14644.94198 nats/sec, 243.13235 nats/event
Reduced model Log loss : -3.11708
Number of events in target process: 54211
Only one process provided, preparing dataloaders for the reduced model.
Number of events in target process: 54211
Only one process provided, preparing dataloaders for the reduced model.
Reduced model ln_yy : 14724.82051 nats/sec, 244.45848 nats/event
Reduced model Log loss : -3.15238
Number of events in target process: 54211
Only one process provided, preparing dataloaders for the reduced model.
Number of events in target process: 54211
Only one process provided, preparing dataloaders for the reduced model.
Number of events in target process: 54211
Only one process provided, preparing dataloaders for the reduced model.
Number of events in target process: 54211
Only one process provided, preparing dataloaders for the reduced model.
Number of events in target process: 54211
Only one process provided, preparing dataloaders for the reduced model.
Number of events in target process: 54211
Only one process provided, preparing dataloaders for the reduced model.
Number of events in target process: 54211
Only one process provided, preparing dataloaders for the reduced model.
Number of events in target process: 54211
Only one process provided, preparing dataloaders for the reduced model.
Number of events in target process: 54211
Only one process provided, preparing dataloaders for the reduced model.
Reduced model ln_yy : 14573.41295 nats/sec, 241.94484 nats/event
Reduced model Log loss : -3.11870
Number of events in target process: 54211
Only one process provided, preparing dataloaders for the reduced model.
Reduced model ln_yy : 14579.25839 nats/sec, 242.04188 nats/event
Reduced model Log loss : -3.11813
Number of events in target process: 54211
Only one process provided, preparing dataloaders for the reduced model.
Reduced model ln_yy : 14781.49942 nats/sec, 245.39945 nats/event
Reduced model Log loss : -3.15350
Number of events in target process: 54211
Only one process provided, preparing dataloaders for the reduced model.
Number of events in target process: 54211
Only one process provided, preparing dataloaders for the reduced model.
Number of events in target process: 54211
Only one process provided, preparing dataloaders for the reduced model.
Number of events in target process: 54211
Only one process provided, preparing dataloaders for the reduced model.
Number of events in target process: 54211
Only one process provided, preparing dataloaders for the reduced model.
Number of events in target process: 54211
Only one process provided, preparing dataloaders for the reduced model.
Reduced model ln_yy : 14656.53852 nats/sec, 243.32487 nats/event
Reduced model Log loss : -3.14985
Number of events in target process: 54211
Only one process provided, preparing dataloaders for the reduced model.
Number of events in target process: 54211
Only one process provided, preparing dataloaders for the reduced model.
Reduced model ln_yy : 14633.37295 nats/sec, 242.94028 nats/event
Reduced model Log loss : -3.11905
Number of events in target process: 54211
Only one process provided, preparing dataloaders for the reduced model.
Reduced model ln_yy : 14785.73445 nats/sec, 245.46976 nats/event
Reduced model Log loss : -3.15001
Number of events in target process: 54211
Only one process provided, preparing dataloaders for the reduced model.
Number of events in target process: 54211
Only one process provided, preparing dataloaders for the reduced model.
Reduced model ln_yy : 14659.33741 nats/sec, 243.37134 nats/event
Reduced model Log loss : -3.15014
Number of events in target process: 54211
Only one process provided, preparing dataloaders for the reduced model.
Reduced model ln_yy : 14666.46961 nats/sec, 243.48975 nats/event
Reduced model Log loss : -3.15000
Number of events in target process: 54211
Only one process provided, preparing dataloaders for the reduced model.
Reduced model ln_yy : 14752.80290 nats/sec, 244.92303 nats/event
Reduced model Log loss : -3.14642
Number of events in target process: 54211
Only one process provided, preparing dataloaders for the reduced model.
Reduced model ln_yy : 14802.53436 nats/sec, 245.74867 nats/event
Reduced model Log loss : -3.15189
Number of events in target process: 54211
Only one process provided, preparing dataloaders for the reduced model.
Number of events in target process: 54211
Only one process provided, preparing dataloaders for the reduced model.
Best trial:
  Value: -3.153503458157452
  Params: {'n_layers_yy': 1, 'hidden_size_yy_l0': 5, 'context_size_yy': 4, 'num_mix_components_yy': 3, 'context_extractor_yy': 'gru', 'activation_func_yy': 'ReLU', 'L2_weight_yy': 5.292249247129385e-07, 'L_entropy_weight_yy': 5.987491978038624e-07, 'L_sep_weight_yy': 3.51242743189951e-07, 'L_scale_weight_yy': 3.809694569376972e-07, 'learning_rate_yy': 0.006518653913718873}
Full best configuration saved to results/opt/opt_reduced_4_best_config.txt
Optimization finished.
[I 2026-03-17 17:38:28,677] Trial 46 finished with value: -2.7606200998361152 and parameters: {'n_layers_yy': 2, 'hidden_size_yy_l0': 4, 'hidden_size_yy_l1': 3, 'context_size_yy': 2, 'num_mix_components_yy': 4, 'context_extractor_yy': 'lstm', 'activation_func_yy': 'Tanh', 'L2_weight_yy': 4.335949266659721e-08, 'L_entropy_weight_yy': 1.2293086107330101e-08, 'L_sep_weight_yy': 4.976962742059335e-06, 'L_scale_weight_yy': 4.964031136322864e-09, 'learning_rate_yy': 0.009505075134524763}. Best is trial 39 with value: -2.7644834187235348.
[I 2026-03-17 17:38:58,991] Trial 33 finished with value: -3.279313728841146 and parameters: {'n_layers_yy': 1, 'hidden_size_yy_l0': 6, 'context_size_yy': 4, 'num_mix_components_yy': 3, 'context_extractor_yy': 'gru', 'activation_func_yy': 'ReLU', 'L2_weight_yy': 4.5093104299384224e-08, 'L_entropy_weight_yy': 6.684326502732164e-07, 'L_sep_weight_yy': 6.38723819713476e-10, 'L_scale_weight_yy': 1.9210356269063102e-10, 'learning_rate_yy': 0.008196967974608107}. Best is trial 33 with value: -3.279313728841146.
[I 2026-03-17 17:39:09,422] Trial 34 pruned. 
[I 2026-03-17 17:39:13,184] Trial 35 pruned. 
[I 2026-03-17 17:39:18,361] Trial 47 finished with value: -2.7610537198477307 and parameters: {'n_layers_yy': 2, 'hidden_size_yy_l0': 4, 'hidden_size_yy_l1': 3, 'context_size_yy': 2, 'num_mix_components_yy': 4, 'context_extractor_yy': 'lstm', 'activation_func_yy': 'Tanh', 'L2_weight_yy': 1.3961163518764916e-08, 'L_entropy_weight_yy': 8.600055027139374e-09, 'L_sep_weight_yy': 1.2218519044964407e-05, 'L_scale_weight_yy': 0.000955685585310346, 'learning_rate_yy': 0.009837955918384777}. Best is trial 39 with value: -2.7644834187235348.
[I 2026-03-17 17:39:43,732] Trial 36 pruned. 
[I 2026-03-17 17:39:47,515] Trial 37 pruned. 
[I 2026-03-17 17:39:51,236] Trial 38 pruned. 
[I 2026-03-17 17:40:07,971] Trial 48 finished with value: -2.761008294015762 and parameters: {'n_layers_yy': 2, 'hidden_size_yy_l0': 4, 'hidden_size_yy_l1': 3, 'context_size_yy': 2, 'num_mix_components_yy': 4, 'context_extractor_yy': 'lstm', 'activation_func_yy': 'Tanh', 'L2_weight_yy': 9.631599557886916e-09, 'L_entropy_weight_yy': 1.5105010357433843e-08, 'L_sep_weight_yy': 3.412368298767729e-06, 'L_scale_weight_yy': 4.782693982746754e-09, 'learning_rate_yy': 0.009753816437876267}. Best is trial 39 with value: -2.7644834187235348.
[I 2026-03-17 17:40:21,623] Trial 39 pruned. 
[I 2026-03-17 17:40:25,605] Trial 40 pruned. 
[I 2026-03-17 17:40:39,488] Trial 49 pruned. 
Optimize task 10: group_id: BC, neuron_id: 8
Starting optimization for task 10...

--- Data Summary ---
Total events for target process 39192
Data Time: 900 seconds
Using device: cuda
Number of events in target process: 39192
Only one process provided, preparing dataloaders for the reduced model.
Reduced model ln_yy : 6950.14397 nats/sec, 159.60220 nats/event
Reduced model Log loss : -2.72940
Number of events in target process: 39192
Only one process provided, preparing dataloaders for the reduced model.
Reduced model ln_yy : 7050.89467 nats/sec, 161.91583 nats/event
Reduced model Log loss : -2.75220
Number of events in target process: 39192
Only one process provided, preparing dataloaders for the reduced model.
Number of events in target process: 39192
Only one process provided, preparing dataloaders for the reduced model.
Reduced model ln_yy : 7055.92507 nats/sec, 162.03135 nats/event
Reduced model Log loss : -2.75722
Number of events in target process: 39192
Only one process provided, preparing dataloaders for the reduced model.
Reduced model ln_yy : 6967.25520 nats/sec, 159.99514 nats/event
Reduced model Log loss : -2.72955
Number of events in target process: 39192
Only one process provided, preparing dataloaders for the reduced model.
Reduced model ln_yy : 6970.83019 nats/sec, 160.07724 nats/event
Reduced model Log loss : -2.73130
Number of events in target process: 39192
Only one process provided, preparing dataloaders for the reduced model.
Reduced model ln_yy : 6962.09016 nats/sec, 159.87653 nats/event
Reduced model Log loss : -2.72464
Number of events in target process: 39192
Only one process provided, preparing dataloaders for the reduced model.
Number of events in target process: 39192
Only one process provided, preparing dataloaders for the reduced model.
Number of events in target process: 39192
Only one process provided, preparing dataloaders for the reduced model.
Reduced model ln_yy : 7091.85657 nats/sec, 162.85647 nats/event
Reduced model Log loss : -2.76367
Number of events in target process: 39192
Only one process provided, preparing dataloaders for the reduced model.
Number of events in target process: 39192
Only one process provided, preparing dataloaders for the reduced model.
Number of events in target process: 39192
Only one process provided, preparing dataloaders for the reduced model.
Number of events in target process: 39192
Only one process provided, preparing dataloaders for the reduced model.
Number of events in target process: 39192
Only one process provided, preparing dataloaders for the reduced model.
Number of events in target process: 39192
Only one process provided, preparing dataloaders for the reduced model.
Number of events in target process: 39192
Only one process provided, preparing dataloaders for the reduced model.
Number of events in target process: 39192
Only one process provided, preparing dataloaders for the reduced model.
Number of events in target process: 39192
Only one process provided, preparing dataloaders for the reduced model.
Number of events in target process: 39192
Only one process provided, preparing dataloaders for the reduced model.
Number of events in target process: 39192
Only one process provided, preparing dataloaders for the reduced model.
Number of events in target process: 39192
Only one process provided, preparing dataloaders for the reduced model.
Number of events in target process: 39192
Only one process provided, preparing dataloaders for the reduced model.
Reduced model ln_yy : 7020.82889 nats/sec, 161.22540 nats/event
Reduced model Log loss : -2.75285
Number of events in target process: 39192
Only one process provided, preparing dataloaders for the reduced model.
Number of events in target process: 39192
Only one process provided, preparing dataloaders for the reduced model.
Number of events in target process: 39192
Only one process provided, preparing dataloaders for the reduced model.
Number of events in target process: 39192
Only one process provided, preparing dataloaders for the reduced model.
Number of events in target process: 39192
Only one process provided, preparing dataloaders for the reduced model.
Number of events in target process: 39192
Only one process provided, preparing dataloaders for the reduced model.
Number of events in target process: 39192
Only one process provided, preparing dataloaders for the reduced model.
Reduced model ln_yy : 6950.07475 nats/sec, 159.60061 nats/event
Reduced model Log loss : -2.72880
Number of events in target process: 39192
Only one process provided, preparing dataloaders for the reduced model.
Number of events in target process: 39192
Only one process provided, preparing dataloaders for the reduced model.
Number of events in target process: 39192
Only one process provided, preparing dataloaders for the reduced model.
Number of events in target process: 39192
Only one process provided, preparing dataloaders for the reduced model.
Number of events in target process: 39192
Only one process provided, preparing dataloaders for the reduced model.
Number of events in target process: 39192
Only one process provided, preparing dataloaders for the reduced model.
Number of events in target process: 39192
Only one process provided, preparing dataloaders for the reduced model.
Number of events in target process: 39192
Only one process provided, preparing dataloaders for the reduced model.
Number of events in target process: 39192
Only one process provided, preparing dataloaders for the reduced model.
Number of events in target process: 39192
Only one process provided, preparing dataloaders for the reduced model.
Reduced model ln_yy : 7060.29983 nats/sec, 162.13181 nats/event
Reduced model Log loss : -2.76448
Number of events in target process: 39192
Only one process provided, preparing dataloaders for the reduced model.
Number of events in target process: 39192
Only one process provided, preparing dataloaders for the reduced model.
Number of events in target process: 39192
Only one process provided, preparing dataloaders for the reduced model.
Number of events in target process: 39192
Only one process provided, preparing dataloaders for the reduced model.
Number of events in target process: 39192
Only one process provided, preparing dataloaders for the reduced model.
Number of events in target process: 39192
Only one process provided, preparing dataloaders for the reduced model.
Reduced model ln_yy : 7042.61591 nats/sec, 161.72572 nats/event
Reduced model Log loss : -2.75935
Number of events in target process: 39192
Only one process provided, preparing dataloaders for the reduced model.
Reduced model ln_yy : 7063.55435 nats/sec, 162.20654 nats/event
Reduced model Log loss : -2.76062
Number of events in target process: 39192
Only one process provided, preparing dataloaders for the reduced model.
Reduced model ln_yy : 7023.14522 nats/sec, 161.27859 nats/event
Reduced model Log loss : -2.76105
Number of events in target process: 39192
Only one process provided, preparing dataloaders for the reduced model.
Reduced model ln_yy : 7022.77496 nats/sec, 161.27009 nats/event
Reduced model Log loss : -2.76101
Number of events in target process: 39192
Only one process provided, preparing dataloaders for the reduced model.
Best trial:
  Value: -2.7644834187235348
  Params: {'n_layers_yy': 1, 'hidden_size_yy_l0': 3, 'context_size_yy': 2, 'num_mix_components_yy': 4, 'context_extractor_yy': 'gru', 'activation_func_yy': 'GELU', 'L2_weight_yy': 1.354293294920085e-08, 'L_entropy_weight_yy': 1.5719353393532017e-08, 'L_sep_weight_yy': 7.595539964555183e-05, 'L_scale_weight_yy': 2.73331078399562e-10, 'learning_rate_yy': 0.008602419486620652}
Full best configuration saved to results/opt/opt_reduced_10_best_config.txt
Optimization finished.
[I 2026-03-17 17:41:52,192] Trial 41 finished with value: -3.2776663736979166 and parameters: {'n_layers_yy': 1, 'hidden_size_yy_l0': 6, 'context_size_yy': 4, 'num_mix_components_yy': 3, 'context_extractor_yy': 'gru', 'activation_func_yy': 'ReLU', 'L2_weight_yy': 3.1596081309590353e-08, 'L_entropy_weight_yy': 2.7120716903233607e-07, 'L_sep_weight_yy': 8.471964212319347e-10, 'L_scale_weight_yy': 1.9099913251849568e-10, 'learning_rate_yy': 0.0068318239293219145}. Best is trial 33 with value: -3.279313728841146.
[I 2026-03-17 17:43:16,478] Trial 42 finished with value: -3.2775878255208335 and parameters: {'n_layers_yy': 1, 'hidden_size_yy_l0': 6, 'context_size_yy': 4, 'num_mix_components_yy': 3, 'context_extractor_yy': 'gru', 'activation_func_yy': 'ReLU', 'L2_weight_yy': 3.2447368027868156e-08, 'L_entropy_weight_yy': 1.3671731603645233e-07, 'L_sep_weight_yy': 1.0413634997156106e-09, 'L_scale_weight_yy': 4.036465181778729e-10, 'learning_rate_yy': 0.006404806648325554}. Best is trial 33 with value: -3.279313728841146.
[I 2026-03-17 17:44:33,369] Trial 43 finished with value: -3.280809130859375 and parameters: {'n_layers_yy': 1, 'hidden_size_yy_l0': 6, 'context_size_yy': 4, 'num_mix_components_yy': 3, 'context_extractor_yy': 'gru', 'activation_func_yy': 'ReLU', 'L2_weight_yy': 3.099111327924815e-08, 'L_entropy_weight_yy': 5.085821509509091e-07, 'L_sep_weight_yy': 1.1305118811003212e-09, 'L_scale_weight_yy': 3.1099180038125776e-10, 'learning_rate_yy': 0.007683899264880692}. Best is trial 43 with value: -3.280809130859375.
[I 2026-03-17 17:45:50,368] Trial 44 finished with value: -3.280752506510417 and parameters: {'n_layers_yy': 1, 'hidden_size_yy_l0': 6, 'context_size_yy': 4, 'num_mix_components_yy': 3, 'context_extractor_yy': 'gru', 'activation_func_yy': 'ReLU', 'L2_weight_yy': 3.5418117440936063e-07, 'L_entropy_weight_yy': 6.321216564296382e-07, 'L_sep_weight_yy': 1.058733088155269e-09, 'L_scale_weight_yy': 2.894873304909368e-10, 'learning_rate_yy': 0.007700380891255647}. Best is trial 43 with value: -3.280809130859375.
[I 2026-03-17 17:46:00,807] Trial 45 pruned. 
[I 2026-03-17 17:46:30,644] Trial 46 pruned. 
[I 2026-03-17 17:46:40,944] Trial 47 pruned. 
[I 2026-03-17 17:46:51,094] Trial 48 pruned. 
