[I 2026-03-17 17:29:07,965] Trial 49 finished with value: -2.837943970687746 and parameters: {'n_layers_yy': 1, 'hidden_size_yy_l0': 6, 'context_size_yy': 4, 'num_mix_components_yy': 3, 'context_extractor_yy': 'gru', 'activation_func_yy': 'ReLU', 'L2_weight_yy': 2.5566902877495106e-07, 'L_entropy_weight_yy': 8.218952638849817e-06, 'L_sep_weight_yy': 1.3530418622567913e-08, 'L_scale_weight_yy': 2.566211061570713e-09, 'learning_rate_yy': 0.00864195688018568}. Best is trial 35 with value: -2.838645471907643.
Optimize task 17: group_id: POm, neuron_id: 51
Starting optimization for task 17...

--- Data Summary ---
Total events for target process 40082
Data Time: 900 seconds
Using device: cuda
Number of events in target process: 40082
Only one process provided, preparing dataloaders for the reduced model.
Reduced model ln_yy : 7449.72009 nats/sec, 167.27579 nats/event
Reduced model Log loss : -2.81057
Number of events in target process: 40082
Only one process provided, preparing dataloaders for the reduced model.
Reduced model ln_yy : 7399.61189 nats/sec, 166.15066 nats/event
Reduced model Log loss : -2.80997
Number of events in target process: 40082
Only one process provided, preparing dataloaders for the reduced model.
Number of events in target process: 40082
Only one process provided, preparing dataloaders for the reduced model.
Number of events in target process: 40082
Only one process provided, preparing dataloaders for the reduced model.
Reduced model ln_yy : 7399.28175 nats/sec, 166.14325 nats/event
Reduced model Log loss : -2.80883
Number of events in target process: 40082
Only one process provided, preparing dataloaders for the reduced model.
Number of events in target process: 40082
Only one process provided, preparing dataloaders for the reduced model.
Number of events in target process: 40082
Only one process provided, preparing dataloaders for the reduced model.
Number of events in target process: 40082
Only one process provided, preparing dataloaders for the reduced model.
Number of events in target process: 40082
Only one process provided, preparing dataloaders for the reduced model.
Number of events in target process: 40082
Only one process provided, preparing dataloaders for the reduced model.
Number of events in target process: 40082
Only one process provided, preparing dataloaders for the reduced model.
Reduced model ln_yy : 7445.62945 nats/sec, 167.18394 nats/event
Reduced model Log loss : -2.83523
Number of events in target process: 40082
Only one process provided, preparing dataloaders for the reduced model.
Number of events in target process: 40082
Only one process provided, preparing dataloaders for the reduced model.
Reduced model ln_yy : 7494.18003 nats/sec, 168.27409 nats/event
Reduced model Log loss : -2.83371
Number of events in target process: 40082
Only one process provided, preparing dataloaders for the reduced model.
Number of events in target process: 40082
Only one process provided, preparing dataloaders for the reduced model.
Number of events in target process: 40082
Only one process provided, preparing dataloaders for the reduced model.
Number of events in target process: 40082
Only one process provided, preparing dataloaders for the reduced model.
Reduced model ln_yy : 7403.85379 nats/sec, 166.24591 nats/event
Reduced model Log loss : -2.81323
Number of events in target process: 40082
Only one process provided, preparing dataloaders for the reduced model.
Number of events in target process: 40082
Only one process provided, preparing dataloaders for the reduced model.
Reduced model ln_yy : 7407.38741 nats/sec, 166.32525 nats/event
Reduced model Log loss : -2.81041
Number of events in target process: 40082
Only one process provided, preparing dataloaders for the reduced model.
Number of events in target process: 40082
Only one process provided, preparing dataloaders for the reduced model.
Reduced model ln_yy : 7398.46100 nats/sec, 166.12482 nats/event
Reduced model Log loss : -2.81326
Number of events in target process: 40082
Only one process provided, preparing dataloaders for the reduced model.
Reduced model ln_yy : 7399.84120 nats/sec, 166.15581 nats/event
Reduced model Log loss : -2.81325
Number of events in target process: 40082
Only one process provided, preparing dataloaders for the reduced model.
Number of events in target process: 40082
Only one process provided, preparing dataloaders for the reduced model.
Number of events in target process: 40082
Only one process provided, preparing dataloaders for the reduced model.
Number of events in target process: 40082
Only one process provided, preparing dataloaders for the reduced model.
Reduced model ln_yy : 7492.86528 nats/sec, 168.24457 nats/event
Reduced model Log loss : -2.83629
Number of events in target process: 40082
Only one process provided, preparing dataloaders for the reduced model.
Number of events in target process: 40082
Only one process provided, preparing dataloaders for the reduced model.
Number of events in target process: 40082
Only one process provided, preparing dataloaders for the reduced model.
Number of events in target process: 40082
Only one process provided, preparing dataloaders for the reduced model.
Reduced model ln_yy : 7494.66384 nats/sec, 168.28495 nats/event
Reduced model Log loss : -2.83597
Number of events in target process: 40082
Only one process provided, preparing dataloaders for the reduced model.
Reduced model ln_yy : 7494.51598 nats/sec, 168.28163 nats/event
Reduced model Log loss : -2.83597
Number of events in target process: 40082
Only one process provided, preparing dataloaders for the reduced model.
Number of events in target process: 40082
Only one process provided, preparing dataloaders for the reduced model.
Number of events in target process: 40082
Only one process provided, preparing dataloaders for the reduced model.
Number of events in target process: 40082
Only one process provided, preparing dataloaders for the reduced model.
Reduced model ln_yy : 7503.50202 nats/sec, 168.48340 nats/event
Reduced model Log loss : -2.83865
Number of events in target process: 40082
Only one process provided, preparing dataloaders for the reduced model.
Number of events in target process: 40082
Only one process provided, preparing dataloaders for the reduced model.
Reduced model ln_yy : 7430.38625 nats/sec, 166.84167 nats/event
Reduced model Log loss : -2.80864
Number of events in target process: 40082
Only one process provided, preparing dataloaders for the reduced model.
Number of events in target process: 40082
Only one process provided, preparing dataloaders for the reduced model.
Reduced model ln_yy : 7514.16397 nats/sec, 168.72281 nats/event
Reduced model Log loss : -2.83570
Number of events in target process: 40082
Only one process provided, preparing dataloaders for the reduced model.
Reduced model ln_yy : 7503.42833 nats/sec, 168.48175 nats/event
Reduced model Log loss : -2.83543
Number of events in target process: 40082
Only one process provided, preparing dataloaders for the reduced model.
Number of events in target process: 40082
Only one process provided, preparing dataloaders for the reduced model.
Number of events in target process: 40082
Only one process provided, preparing dataloaders for the reduced model.
Number of events in target process: 40082
Only one process provided, preparing dataloaders for the reduced model.
Number of events in target process: 40082
Only one process provided, preparing dataloaders for the reduced model.
Reduced model ln_yy : 7505.90124 nats/sec, 168.53728 nats/event
Reduced model Log loss : -2.83511
Number of events in target process: 40082
Only one process provided, preparing dataloaders for the reduced model.
Number of events in target process: 40082
Only one process provided, preparing dataloaders for the reduced model.
Number of events in target process: 40082
Only one process provided, preparing dataloaders for the reduced model.
Number of events in target process: 40082
Only one process provided, preparing dataloaders for the reduced model.
Reduced model ln_yy : 7470.70173 nats/sec, 167.74691 nats/event
Reduced model Log loss : -2.83794
Best trial:
  Value: -2.838645471907643
  Params: {'n_layers_yy': 1, 'hidden_size_yy_l0': 6, 'context_size_yy': 4, 'num_mix_components_yy': 3, 'context_extractor_yy': 'gru', 'activation_func_yy': 'ReLU', 'L2_weight_yy': 1.0986045195181261e-09, 'L_entropy_weight_yy': 1.4516427239538372e-09, 'L_sep_weight_yy': 1.0219723078020309e-09, 'L_scale_weight_yy': 1.4906906605462781e-09, 'learning_rate_yy': 0.008273118930690673}
Full best configuration saved to results/opt/opt_reduced_17_best_config.txt
Optimization finished.
[I 2026-03-17 17:29:11,207] Trial 37 pruned. 
[I 2026-03-17 17:29:11,350] Trial 36 pruned. 
[I 2026-03-17 17:29:12,702] Trial 35 pruned. 
[I 2026-03-17 17:29:13,807] Trial 30 pruned. 
[I 2026-03-17 17:29:14,272] Trial 38 pruned. 
[I 2026-03-17 17:29:14,931] Trial 37 pruned. 
[I 2026-03-17 17:29:16,679] Trial 42 finished with value: -2.369662076173872 and parameters: {'n_layers_yy': 2, 'hidden_size_yy_l0': 2, 'hidden_size_yy_l1': 6, 'context_size_yy': 1, 'num_mix_components_yy': 4, 'context_extractor_yy': 'lstm', 'activation_func_yy': 'Tanh', 'L2_weight_yy': 4.3434600131299425e-10, 'L_entropy_weight_yy': 0.00035151322541159853, 'L_sep_weight_yy': 7.059157028742273e-09, 'L_scale_weight_yy': 1.4380339843073904e-07, 'learning_rate_yy': 0.007362793846751383}. Best is trial 22 with value: -2.3759054172258436.
[I 2026-03-17 17:29:17,312] Trial 39 pruned. 
[I 2026-03-17 17:29:22,443] Trial 21 finished with value: -3.264966552734375 and parameters: {'n_layers_yy': 1, 'hidden_size_yy_l0': 6, 'context_size_yy': 4, 'num_mix_components_yy': 4, 'context_extractor_yy': 'gru', 'activation_func_yy': 'ReLU', 'L2_weight_yy': 1.2608557055532282e-09, 'L_entropy_weight_yy': 1.927593691474682e-07, 'L_sep_weight_yy': 2.64716293267085e-10, 'L_scale_weight_yy': 8.626608697833213e-10, 'learning_rate_yy': 0.006418793701339763}. Best is trial 16 with value: -3.2663029296875.
[I 2026-03-17 17:29:22,881] Trial 43 pruned. 
[I 2026-03-17 17:29:27,295] Trial 37 pruned. 
[I 2026-03-17 17:29:33,180] Trial 38 pruned. 
[I 2026-03-17 17:29:39,177] Trial 36 pruned. 
[I 2026-03-17 17:29:40,325] Trial 40 pruned. 
[I 2026-03-17 17:29:40,325] Trial 44 pruned. 
[I 2026-03-17 17:29:42,429] Trial 31 finished with value: -2.910376413627159 and parameters: {'n_layers_yy': 1, 'hidden_size_yy_l0': 6, 'context_size_yy': 4, 'num_mix_components_yy': 5, 'context_extractor_yy': 'lstm', 'activation_func_yy': 'GELU', 'L2_weight_yy': 1.3451767036086952e-09, 'L_entropy_weight_yy': 9.224936510014857e-07, 'L_sep_weight_yy': 0.0001601922639562493, 'L_scale_weight_yy': 8.230906228083949e-05, 'learning_rate_yy': 0.009810539599020968}. Best is trial 9 with value: -2.9754424140841684.
[I 2026-03-17 17:29:43,282] Trial 41 pruned. 
[I 2026-03-17 17:29:46,226] Trial 42 pruned. 
[I 2026-03-17 17:29:48,740] Trial 32 pruned. 
[I 2026-03-17 17:29:49,172] Trial 43 pruned. 
[I 2026-03-17 17:29:50,356] Trial 38 finished with value: -2.4908565993954883 and parameters: {'n_layers_yy': 2, 'hidden_size_yy_l0': 4, 'hidden_size_yy_l1': 5, 'context_size_yy': 4, 'num_mix_components_yy': 5, 'context_extractor_yy': 'lstm', 'activation_func_yy': 'GELU', 'L2_weight_yy': 1.5805349230688938e-07, 'L_entropy_weight_yy': 1.0016404149410148e-08, 'L_sep_weight_yy': 5.3324982440730554e-05, 'L_scale_weight_yy': 7.274835814884882e-07, 'learning_rate_yy': 0.007865079112947674}. Best is trial 24 with value: -2.4926837718550585.
[I 2026-03-17 17:29:51,153] Trial 33 pruned. 
[I 2026-03-17 17:29:52,099] Trial 44 pruned. 
[I 2026-03-17 17:29:54,986] Trial 45 pruned. 
[I 2026-03-17 17:29:56,787] Trial 27 finished with value: -2.290475318189642 and parameters: {'n_layers_yy': 1, 'hidden_size_yy_l0': 6, 'context_size_yy': 4, 'num_mix_components_yy': 2, 'context_extractor_yy': 'lstm', 'activation_func_yy': 'GELU', 'L2_weight_yy': 0.0001546810466363547, 'L_entropy_weight_yy': 1.2442493296294998e-08, 'L_sep_weight_yy': 5.426142333325868e-06, 'L_scale_weight_yy': 3.932908482805081e-05, 'learning_rate_yy': 0.00718048815262317}. Best is trial 27 with value: -2.290475318189642.
[I 2026-03-17 17:29:57,463] Trial 34 pruned. 
[I 2026-03-17 17:29:57,813] Trial 39 pruned. 
[I 2026-03-17 17:29:57,953] Trial 45 pruned. 
[I 2026-03-17 17:29:59,843] Trial 35 pruned. 
[I 2026-03-17 17:30:00,507] Trial 40 pruned. 
[I 2026-03-17 17:30:02,051] Trial 36 pruned. 
[I 2026-03-17 17:30:03,255] Trial 46 pruned. 
[I 2026-03-17 17:30:04,047] Trial 46 pruned. 
[I 2026-03-17 17:30:06,213] Trial 47 pruned. 
[I 2026-03-17 17:30:06,402] Trial 47 pruned. 
[I 2026-03-17 17:30:09,080] Trial 48 pruned. 
[I 2026-03-17 17:30:12,416] Trial 48 pruned. 
[I 2026-03-17 17:30:14,632] Trial 28 pruned. 
[I 2026-03-17 17:30:14,734] Trial 49 pruned. 
Optimize task 9: group_id: BC, neuron_id: 7
Starting optimization for task 9...

--- Data Summary ---
Total events for target process 20158
Data Time: 900 seconds
Using device: cuda
Number of events in target process: 20158
Only one process provided, preparing dataloaders for the reduced model.
Reduced model ln_yy : 1645.58014 nats/sec, 73.47069 nats/event
Reduced model Log loss : -2.36401
Number of events in target process: 20158
Only one process provided, preparing dataloaders for the reduced model.
Number of events in target process: 20158
Only one process provided, preparing dataloaders for the reduced model.
Reduced model ln_yy : 1639.85082 nats/sec, 73.21489 nats/event
Reduced model Log loss : -2.34616
Number of events in target process: 20158
Only one process provided, preparing dataloaders for the reduced model.
Number of events in target process: 20158
Only one process provided, preparing dataloaders for the reduced model.
Reduced model ln_yy : 1658.20403 nats/sec, 74.03431 nats/event
Reduced model Log loss : -2.37055
Number of events in target process: 20158
Only one process provided, preparing dataloaders for the reduced model.
Number of events in target process: 20158
Only one process provided, preparing dataloaders for the reduced model.
Reduced model ln_yy : 1649.99854 nats/sec, 73.66796 nats/event
Reduced model Log loss : -2.37359
Number of events in target process: 20158
Only one process provided, preparing dataloaders for the reduced model.
Number of events in target process: 20158
Only one process provided, preparing dataloaders for the reduced model.
Number of events in target process: 20158
Only one process provided, preparing dataloaders for the reduced model.
Reduced model ln_yy : 1664.79629 nats/sec, 74.32864 nats/event
Reduced model Log loss : -2.37369
Number of events in target process: 20158
Only one process provided, preparing dataloaders for the reduced model.
Reduced model ln_yy : 1648.71636 nats/sec, 73.61071 nats/event
Reduced model Log loss : -2.34898
Number of events in target process: 20158
Only one process provided, preparing dataloaders for the reduced model.
Number of events in target process: 20158
Only one process provided, preparing dataloaders for the reduced model.
Number of events in target process: 20158
Only one process provided, preparing dataloaders for the reduced model.
Reduced model ln_yy : 1637.90285 nats/sec, 73.12792 nats/event
Reduced model Log loss : -2.34029
Number of events in target process: 20158
Only one process provided, preparing dataloaders for the reduced model.
Number of events in target process: 20158
Only one process provided, preparing dataloaders for the reduced model.
Reduced model ln_yy : 1656.44636 nats/sec, 73.95583 nats/event
Reduced model Log loss : -2.37276
Number of events in target process: 20158
Only one process provided, preparing dataloaders for the reduced model.
Number of events in target process: 20158
Only one process provided, preparing dataloaders for the reduced model.
Number of events in target process: 20158
Only one process provided, preparing dataloaders for the reduced model.
Number of events in target process: 20158
Only one process provided, preparing dataloaders for the reduced model.
Number of events in target process: 20158
Only one process provided, preparing dataloaders for the reduced model.
Number of events in target process: 20158
Only one process provided, preparing dataloaders for the reduced model.
Number of events in target process: 20158
Only one process provided, preparing dataloaders for the reduced model.
Reduced model ln_yy : 1667.03533 nats/sec, 74.42860 nats/event
Reduced model Log loss : -2.37591
Number of events in target process: 20158
Only one process provided, preparing dataloaders for the reduced model.
Number of events in target process: 20158
Only one process provided, preparing dataloaders for the reduced model.
Number of events in target process: 20158
Only one process provided, preparing dataloaders for the reduced model.
Number of events in target process: 20158
Only one process provided, preparing dataloaders for the reduced model.
Number of events in target process: 20158
Only one process provided, preparing dataloaders for the reduced model.
Number of events in target process: 20158
Only one process provided, preparing dataloaders for the reduced model.
Reduced model ln_yy : 1648.53976 nats/sec, 73.60283 nats/event
Reduced model Log loss : -2.36939
Number of events in target process: 20158
Only one process provided, preparing dataloaders for the reduced model.
Number of events in target process: 20158
Only one process provided, preparing dataloaders for the reduced model.
Reduced model ln_yy : 1637.42270 nats/sec, 73.10648 nats/event
Reduced model Log loss : -2.33565
Number of events in target process: 20158
Only one process provided, preparing dataloaders for the reduced model.
Number of events in target process: 20158
Only one process provided, preparing dataloaders for the reduced model.
Number of events in target process: 20158
Only one process provided, preparing dataloaders for the reduced model.
Number of events in target process: 20158
Only one process provided, preparing dataloaders for the reduced model.
Number of events in target process: 20158
Only one process provided, preparing dataloaders for the reduced model.
Number of events in target process: 20158
Only one process provided, preparing dataloaders for the reduced model.
Number of events in target process: 20158
Only one process provided, preparing dataloaders for the reduced model.
Number of events in target process: 20158
Only one process provided, preparing dataloaders for the reduced model.
Number of events in target process: 20158
Only one process provided, preparing dataloaders for the reduced model.
Reduced model ln_yy : 1652.33823 nats/sec, 73.77242 nats/event
Reduced model Log loss : -2.37402
Number of events in target process: 20158
Only one process provided, preparing dataloaders for the reduced model.
Number of events in target process: 20158
Only one process provided, preparing dataloaders for the reduced model.
Reduced model ln_yy : 1648.46638 nats/sec, 73.59955 nats/event
Reduced model Log loss : -2.37450
Number of events in target process: 20158
Only one process provided, preparing dataloaders for the reduced model.
Reduced model ln_yy : 1661.86051 nats/sec, 74.19756 nats/event
Reduced model Log loss : -2.36966
Number of events in target process: 20158
Only one process provided, preparing dataloaders for the reduced model.
Number of events in target process: 20158
Only one process provided, preparing dataloaders for the reduced model.
Number of events in target process: 20158
Only one process provided, preparing dataloaders for the reduced model.
Number of events in target process: 20158
Only one process provided, preparing dataloaders for the reduced model.
Number of events in target process: 20158
Only one process provided, preparing dataloaders for the reduced model.
Number of events in target process: 20158
Only one process provided, preparing dataloaders for the reduced model.
Number of events in target process: 20158
Only one process provided, preparing dataloaders for the reduced model.
Best trial:
  Value: -2.3759054172258436
  Params: {'n_layers_yy': 2, 'hidden_size_yy_l0': 6, 'hidden_size_yy_l1': 3, 'context_size_yy': 2, 'num_mix_components_yy': 3, 'context_extractor_yy': 'lstm', 'activation_func_yy': 'Tanh', 'L2_weight_yy': 7.998719454973881e-08, 'L_entropy_weight_yy': 8.849580848190812e-05, 'L_sep_weight_yy': 3.59849035700207e-10, 'L_scale_weight_yy': 3.8934504922921264e-07, 'learning_rate_yy': 0.007465066848497743}
Full best configuration saved to results/opt/opt_reduced_9_best_config.txt
Optimization finished.
[I 2026-03-17 17:30:19,368] Trial 22 finished with value: -3.258259065755208 and parameters: {'n_layers_yy': 1, 'hidden_size_yy_l0': 6, 'context_size_yy': 4, 'num_mix_components_yy': 4, 'context_extractor_yy': 'gru', 'activation_func_yy': 'ReLU', 'L2_weight_yy': 1.0425216693020323e-09, 'L_entropy_weight_yy': 6.865444805098381e-08, 'L_sep_weight_yy': 1.0581746894798595e-10, 'L_scale_weight_yy': 5.161103902007514e-10, 'learning_rate_yy': 0.007273900530274999}. Best is trial 16 with value: -3.2663029296875.
[I 2026-03-17 17:30:21,338] Trial 39 finished with value: -3.1498489731533956 and parameters: {'n_layers_yy': 1, 'hidden_size_yy_l0': 6, 'context_size_yy': 4, 'num_mix_components_yy': 4, 'context_extractor_yy': 'gru', 'activation_func_yy': 'ReLU', 'L2_weight_yy': 1.9462969234981453e-05, 'L_entropy_weight_yy': 5.801927119547389e-05, 'L_sep_weight_yy': 4.523148572574005e-07, 'L_scale_weight_yy': 2.3218510248020648e-06, 'learning_rate_yy': 0.006680927550078361}. Best is trial 33 with value: -3.153503458157452.
