[I 2026-03-17 17:16:08,321] Trial 11 finished with value: -2.9072961542742215 and parameters: {'n_layers_yy': 2, 'hidden_size_yy_l0': 6, 'hidden_size_yy_l1': 4, 'context_size_yy': 4, 'num_mix_components_yy': 5, 'context_extractor_yy': 'lstm', 'activation_func_yy': 'GELU', 'L2_weight_yy': 1.1992191727794854e-07, 'L_entropy_weight_yy': 2.6924863612812548e-06, 'L_sep_weight_yy': 0.00047803377856978817, 'L_scale_weight_yy': 0.0007126642418670909, 'learning_rate_yy': 0.009421689344383262}. Best is trial 9 with value: -2.9754424140841684.
[I 2026-03-17 17:16:09,199] Trial 21 pruned. 
[I 2026-03-17 17:16:12,598] Trial 9 finished with value: -2.4706525760718336 and parameters: {'n_layers_yy': 2, 'hidden_size_yy_l0': 4, 'hidden_size_yy_l1': 6, 'context_size_yy': 3, 'num_mix_components_yy': 5, 'context_extractor_yy': 'lstm', 'activation_func_yy': 'Tanh', 'L2_weight_yy': 0.0003994255576411184, 'L_entropy_weight_yy': 1.7065657885786113e-08, 'L_sep_weight_yy': 7.462454829216329e-07, 'L_scale_weight_yy': 4.3387184727256083e-10, 'learning_rate_yy': 0.0021446437640024714}. Best is trial 2 with value: -2.476197165819489.
[I 2026-03-17 17:16:13,955] Trial 25 pruned. 
[I 2026-03-17 17:16:16,728] Trial 26 pruned. 
[I 2026-03-17 17:16:17,342] Trial 18 finished with value: -1.9113758963969216 and parameters: {'n_layers_yy': 2, 'hidden_size_yy_l0': 5, 'hidden_size_yy_l1': 3, 'context_size_yy': 3, 'num_mix_components_yy': 4, 'context_extractor_yy': 'lstm', 'activation_func_yy': 'ReLU', 'L2_weight_yy': 7.027463088828838e-07, 'L_entropy_weight_yy': 4.519379351812088e-09, 'L_sep_weight_yy': 4.315274576883832e-07, 'L_scale_weight_yy': 4.1966414757735953e-10, 'learning_rate_yy': 0.009287414472287413}. Best is trial 18 with value: -1.9113758963969216.
[I 2026-03-17 17:16:17,676] Trial 10 pruned. 
[I 2026-03-17 17:16:18,086] Trial 22 finished with value: -1.6749225196673398 and parameters: {'n_layers_yy': 1, 'hidden_size_yy_l0': 6, 'context_size_yy': 4, 'num_mix_components_yy': 4, 'context_extractor_yy': 'gru', 'activation_func_yy': 'GELU', 'L2_weight_yy': 2.2419290149329283e-05, 'L_entropy_weight_yy': 0.00013519716409408672, 'L_sep_weight_yy': 1.1524223460871125e-07, 'L_scale_weight_yy': 3.676686091317389e-10, 'learning_rate_yy': 0.009118003191402397}. Best is trial 2 with value: -1.677622742403132.
[I 2026-03-17 17:16:18,375] Trial 13 pruned. 
[I 2026-03-17 17:16:18,655] Trial 49 pruned. 
Optimize task 11: group_id: BC, neuron_id: 9
Starting optimization for task 11...

--- Data Summary ---
Total events for target process 3618
Data Time: 900 seconds
Using device: cuda
Number of events in target process: 3618
Only one process provided, preparing dataloaders for the reduced model.
Reduced model ln_yy : 28.90412 nats/sec, 7.19008 nats/event
Reduced model Log loss : -0.82159
Number of events in target process: 3618
Only one process provided, preparing dataloaders for the reduced model.
Reduced model ln_yy : 28.38920 nats/sec, 7.06199 nats/event
Reduced model Log loss : -0.81067
Number of events in target process: 3618
Only one process provided, preparing dataloaders for the reduced model.
Reduced model ln_yy : 29.02126 nats/sec, 7.21922 nats/event
Reduced model Log loss : -0.83349
Number of events in target process: 3618
Only one process provided, preparing dataloaders for the reduced model.
Number of events in target process: 3618
Only one process provided, preparing dataloaders for the reduced model.
Number of events in target process: 3618
Only one process provided, preparing dataloaders for the reduced model.
Number of events in target process: 3618
Only one process provided, preparing dataloaders for the reduced model.
Number of events in target process: 3618
Only one process provided, preparing dataloaders for the reduced model.
Number of events in target process: 3618
Only one process provided, preparing dataloaders for the reduced model.
Reduced model ln_yy : 28.94749 nats/sec, 7.20087 nats/event
Reduced model Log loss : -0.81648
Number of events in target process: 3618
Only one process provided, preparing dataloaders for the reduced model.
Number of events in target process: 3618
Only one process provided, preparing dataloaders for the reduced model.
Number of events in target process: 3618
Only one process provided, preparing dataloaders for the reduced model.
Reduced model ln_yy : 29.29595 nats/sec, 7.28755 nats/event
Reduced model Log loss : -0.82325
Number of events in target process: 3618
Only one process provided, preparing dataloaders for the reduced model.
Reduced model ln_yy : 29.58649 nats/sec, 7.35982 nats/event
Reduced model Log loss : -0.81830
Number of events in target process: 3618
Only one process provided, preparing dataloaders for the reduced model.
Number of events in target process: 3618
Only one process provided, preparing dataloaders for the reduced model.
Number of events in target process: 3618
Only one process provided, preparing dataloaders for the reduced model.
Number of events in target process: 3618
Only one process provided, preparing dataloaders for the reduced model.
Number of events in target process: 3618
Only one process provided, preparing dataloaders for the reduced model.
Number of events in target process: 3618
Only one process provided, preparing dataloaders for the reduced model.
Reduced model ln_yy : 29.56209 nats/sec, 7.35375 nats/event
Reduced model Log loss : -0.82837
Number of events in target process: 3618
Only one process provided, preparing dataloaders for the reduced model.
Number of events in target process: 3618
Only one process provided, preparing dataloaders for the reduced model.
Reduced model ln_yy : 28.93346 nats/sec, 7.19738 nats/event
Reduced model Log loss : -0.82282
Number of events in target process: 3618
Only one process provided, preparing dataloaders for the reduced model.
Number of events in target process: 3618
Only one process provided, preparing dataloaders for the reduced model.
Number of events in target process: 3618
Only one process provided, preparing dataloaders for the reduced model.
Number of events in target process: 3618
Only one process provided, preparing dataloaders for the reduced model.
Number of events in target process: 3618
Only one process provided, preparing dataloaders for the reduced model.
Number of events in target process: 3618
Only one process provided, preparing dataloaders for the reduced model.
Number of events in target process: 3618
Only one process provided, preparing dataloaders for the reduced model.
Number of events in target process: 3618
Only one process provided, preparing dataloaders for the reduced model.
Number of events in target process: 3618
Only one process provided, preparing dataloaders for the reduced model.
Number of events in target process: 3618
Only one process provided, preparing dataloaders for the reduced model.
Number of events in target process: 3618
Only one process provided, preparing dataloaders for the reduced model.
Reduced model ln_yy : 28.36054 nats/sec, 7.05486 nats/event
Reduced model Log loss : -0.81398
Number of events in target process: 3618
Only one process provided, preparing dataloaders for the reduced model.
Number of events in target process: 3618
Only one process provided, preparing dataloaders for the reduced model.
Number of events in target process: 3618
Only one process provided, preparing dataloaders for the reduced model.
Number of events in target process: 3618
Only one process provided, preparing dataloaders for the reduced model.
Number of events in target process: 3618
Only one process provided, preparing dataloaders for the reduced model.
Number of events in target process: 3618
Only one process provided, preparing dataloaders for the reduced model.
Number of events in target process: 3618
Only one process provided, preparing dataloaders for the reduced model.
Number of events in target process: 3618
Only one process provided, preparing dataloaders for the reduced model.
Number of events in target process: 3618
Only one process provided, preparing dataloaders for the reduced model.
Number of events in target process: 3618
Only one process provided, preparing dataloaders for the reduced model.
Number of events in target process: 3618
Only one process provided, preparing dataloaders for the reduced model.
Number of events in target process: 3618
Only one process provided, preparing dataloaders for the reduced model.
Reduced model ln_yy : 29.56771 nats/sec, 7.35515 nats/event
Reduced model Log loss : -0.83059
Number of events in target process: 3618
Only one process provided, preparing dataloaders for the reduced model.
Reduced model ln_yy : 27.62888 nats/sec, 6.87286 nats/event
Reduced model Log loss : -0.74638
Number of events in target process: 3618
Only one process provided, preparing dataloaders for the reduced model.
Number of events in target process: 3618
Only one process provided, preparing dataloaders for the reduced model.
Reduced model ln_yy : 29.60823 nats/sec, 7.36523 nats/event
Reduced model Log loss : -0.82667
Number of events in target process: 3618
Only one process provided, preparing dataloaders for the reduced model.
Number of events in target process: 3618
Only one process provided, preparing dataloaders for the reduced model.
Number of events in target process: 3618
Only one process provided, preparing dataloaders for the reduced model.
Best trial:
  Value: -0.833493141163047
  Params: {'n_layers_yy': 2, 'hidden_size_yy_l0': 2, 'hidden_size_yy_l1': 3, 'context_size_yy': 2, 'num_mix_components_yy': 5, 'context_extractor_yy': 'gru', 'activation_func_yy': 'Tanh', 'L2_weight_yy': 3.9838963830469457e-05, 'L_entropy_weight_yy': 1.9909556531991214e-10, 'L_sep_weight_yy': 7.095693728013595e-05, 'L_scale_weight_yy': 1.8389597451172184e-10, 'learning_rate_yy': 0.004699811363429675}
Full best configuration saved to results/opt/opt_reduced_11_best_config.txt
Optimization finished.
[I 2026-03-17 17:16:19,035] Trial 6 pruned. 
[I 2026-03-17 17:16:20,698] Trial 12 pruned. 
[I 2026-03-17 17:16:21,270] Trial 23 pruned. 
[I 2026-03-17 17:16:21,738] Trial 14 pruned. 
[I 2026-03-17 17:16:22,152] Trial 49 finished with value: -1.460013169508714 and parameters: {'n_layers_yy': 1, 'hidden_size_yy_l0': 5, 'context_size_yy': 4, 'num_mix_components_yy': 3, 'context_extractor_yy': 'gru', 'activation_func_yy': 'Tanh', 'L2_weight_yy': 1.8740230937237102e-10, 'L_entropy_weight_yy': 2.6641066997922256e-05, 'L_sep_weight_yy': 5.328846015342558e-07, 'L_scale_weight_yy': 8.167160339906096e-06, 'learning_rate_yy': 0.004222417442880216}. Best is trial 49 with value: -1.460013169508714.
Optimize task 15: group_id: POm, neuron_id: 49
Starting optimization for task 15...

--- Data Summary ---
Total events for target process 3403
Data Time: 900 seconds
Using device: cuda
Number of events in target process: 3403
Only one process provided, preparing dataloaders for the reduced model.
Reduced model ln_yy : 33.93934 nats/sec, 8.97602 nats/event
Reduced model Log loss : -1.41485
Number of events in target process: 3403
Only one process provided, preparing dataloaders for the reduced model.
Reduced model ln_yy : 34.29392 nats/sec, 9.06980 nats/event
Reduced model Log loss : -1.45375
Number of events in target process: 3403
Only one process provided, preparing dataloaders for the reduced model.
Reduced model ln_yy : 33.79222 nats/sec, 8.93711 nats/event
Reduced model Log loss : -1.42065
Number of events in target process: 3403
Only one process provided, preparing dataloaders for the reduced model.
Number of events in target process: 3403
Only one process provided, preparing dataloaders for the reduced model.
Reduced model ln_yy : 34.12635 nats/sec, 9.02548 nats/event
Reduced model Log loss : -1.44337
Number of events in target process: 3403
Only one process provided, preparing dataloaders for the reduced model.
Number of events in target process: 3403
Only one process provided, preparing dataloaders for the reduced model.
Reduced model ln_yy : 34.28978 nats/sec, 9.06871 nats/event
Reduced model Log loss : -1.45182
Number of events in target process: 3403
Only one process provided, preparing dataloaders for the reduced model.
Number of events in target process: 3403
Only one process provided, preparing dataloaders for the reduced model.
Number of events in target process: 3403
Only one process provided, preparing dataloaders for the reduced model.
Number of events in target process: 3403
Only one process provided, preparing dataloaders for the reduced model.
Number of events in target process: 3403
Only one process provided, preparing dataloaders for the reduced model.
Reduced model ln_yy : 34.42601 nats/sec, 9.10473 nats/event
Reduced model Log loss : -1.44970
Number of events in target process: 3403
Only one process provided, preparing dataloaders for the reduced model.
Number of events in target process: 3403
Only one process provided, preparing dataloaders for the reduced model.
Number of events in target process: 3403
Only one process provided, preparing dataloaders for the reduced model.
Number of events in target process: 3403
Only one process provided, preparing dataloaders for the reduced model.
Number of events in target process: 3403
Only one process provided, preparing dataloaders for the reduced model.
Number of events in target process: 3403
Only one process provided, preparing dataloaders for the reduced model.
Reduced model ln_yy : 33.93059 nats/sec, 8.97371 nats/event
Reduced model Log loss : -1.43134
Number of events in target process: 3403
Only one process provided, preparing dataloaders for the reduced model.
Reduced model ln_yy : 33.80772 nats/sec, 8.94121 nats/event
Reduced model Log loss : -1.43015
Number of events in target process: 3403
Only one process provided, preparing dataloaders for the reduced model.
Number of events in target process: 3403
Only one process provided, preparing dataloaders for the reduced model.
Number of events in target process: 3403
Only one process provided, preparing dataloaders for the reduced model.
Reduced model ln_yy : 34.35127 nats/sec, 9.08497 nats/event
Reduced model Log loss : -1.45236
Number of events in target process: 3403
Only one process provided, preparing dataloaders for the reduced model.
Number of events in target process: 3403
Only one process provided, preparing dataloaders for the reduced model.
Number of events in target process: 3403
Only one process provided, preparing dataloaders for the reduced model.
Number of events in target process: 3403
Only one process provided, preparing dataloaders for the reduced model.
Reduced model ln_yy : 33.94029 nats/sec, 8.97627 nats/event
Reduced model Log loss : -1.42800
Number of events in target process: 3403
Only one process provided, preparing dataloaders for the reduced model.
Number of events in target process: 3403
Only one process provided, preparing dataloaders for the reduced model.
Number of events in target process: 3403
Only one process provided, preparing dataloaders for the reduced model.
Number of events in target process: 3403
Only one process provided, preparing dataloaders for the reduced model.
Number of events in target process: 3403
Only one process provided, preparing dataloaders for the reduced model.
Number of events in target process: 3403
Only one process provided, preparing dataloaders for the reduced model.
Number of events in target process: 3403
Only one process provided, preparing dataloaders for the reduced model.
Number of events in target process: 3403
Only one process provided, preparing dataloaders for the reduced model.
Number of events in target process: 3403
Only one process provided, preparing dataloaders for the reduced model.
Number of events in target process: 3403
Only one process provided, preparing dataloaders for the reduced model.
Number of events in target process: 3403
Only one process provided, preparing dataloaders for the reduced model.
Number of events in target process: 3403
Only one process provided, preparing dataloaders for the reduced model.
Number of events in target process: 3403
Only one process provided, preparing dataloaders for the reduced model.
Number of events in target process: 3403
Only one process provided, preparing dataloaders for the reduced model.
Number of events in target process: 3403
Only one process provided, preparing dataloaders for the reduced model.
Number of events in target process: 3403
Only one process provided, preparing dataloaders for the reduced model.
Number of events in target process: 3403
Only one process provided, preparing dataloaders for the reduced model.
Number of events in target process: 3403
Only one process provided, preparing dataloaders for the reduced model.
Number of events in target process: 3403
Only one process provided, preparing dataloaders for the reduced model.
Number of events in target process: 3403
Only one process provided, preparing dataloaders for the reduced model.
Number of events in target process: 3403
Only one process provided, preparing dataloaders for the reduced model.
Reduced model ln_yy : 34.44995 nats/sec, 9.11107 nats/event
Reduced model Log loss : -1.44282
Number of events in target process: 3403
Only one process provided, preparing dataloaders for the reduced model.
Number of events in target process: 3403
Only one process provided, preparing dataloaders for the reduced model.
Number of events in target process: 3403
Only one process provided, preparing dataloaders for the reduced model.
Reduced model ln_yy : 34.37517 nats/sec, 9.09129 nats/event
Reduced model Log loss : -1.46001
Best trial:
  Value: -1.460013169508714
  Params: {'n_layers_yy': 1, 'hidden_size_yy_l0': 5, 'context_size_yy': 4, 'num_mix_components_yy': 3, 'context_extractor_yy': 'gru', 'activation_func_yy': 'Tanh', 'L2_weight_yy': 1.8740230937237102e-10, 'L_entropy_weight_yy': 2.6641066997922256e-05, 'L_sep_weight_yy': 5.328846015342558e-07, 'L_scale_weight_yy': 8.167160339906096e-06, 'learning_rate_yy': 0.004222417442880216}
Full best configuration saved to results/opt/opt_reduced_15_best_config.txt
Optimization finished.
[I 2026-03-17 17:16:22,724] Trial 27 pruned. 
[I 2026-03-17 17:16:24,242] Trial 24 pruned. 
[I 2026-03-17 17:16:24,743] Trial 19 pruned. 
[I 2026-03-17 17:16:25,824] Trial 15 pruned. 
[I 2026-03-17 17:16:26,201] Trial 21 finished with value: -1.9695420596605426 and parameters: {'n_layers_yy': 1, 'hidden_size_yy_l0': 6, 'context_size_yy': 3, 'num_mix_components_yy': 5, 'context_extractor_yy': 'lstm', 'activation_func_yy': 'Tanh', 'L2_weight_yy': 1.4457037039053221e-06, 'L_entropy_weight_yy': 1.718692203712781e-05, 'L_sep_weight_yy': 2.5220643641480664e-07, 'L_scale_weight_yy': 9.55648172762447e-07, 'learning_rate_yy': 0.002536970288063556}. Best is trial 1 with value: -1.9741431522447364.
[I 2026-03-17 17:16:26,341] Trial 5 finished with value: -2.7312980263730755 and parameters: {'n_layers_yy': 1, 'hidden_size_yy_l0': 4, 'context_size_yy': 2, 'num_mix_components_yy': 2, 'context_extractor_yy': 'gru', 'activation_func_yy': 'Tanh', 'L2_weight_yy': 7.204051846873121e-09, 'L_entropy_weight_yy': 1.0537272328311713e-10, 'L_sep_weight_yy': 2.6455763493946677e-07, 'L_scale_weight_yy': 0.0007683214869513159, 'learning_rate_yy': 0.0050997874445040834}. Best is trial 3 with value: -2.757216847916007.
[I 2026-03-17 17:16:27,859] Trial 22 pruned. 
[I 2026-03-17 17:16:28,139] Trial 22 finished with value: -2.813254877913564 and parameters: {'n_layers_yy': 1, 'hidden_size_yy_l0': 5, 'context_size_yy': 4, 'num_mix_components_yy': 2, 'context_extractor_yy': 'lstm', 'activation_func_yy': 'Tanh', 'L2_weight_yy': 9.27344482978558e-07, 'L_entropy_weight_yy': 7.0041771517670774e-09, 'L_sep_weight_yy': 0.00010442425526836462, 'L_scale_weight_yy': 8.381361668609669e-09, 'learning_rate_yy': 0.009571481767905683}. Best is trial 11 with value: -2.8352269528025382.
[I 2026-03-17 17:16:28,717] Trial 31 finished with value: -1.6130665862739773 and parameters: {'n_layers_yy': 2, 'hidden_size_yy_l0': 5, 'hidden_size_yy_l1': 5, 'context_size_yy': 2, 'num_mix_components_yy': 2, 'context_extractor_yy': 'lstm', 'activation_func_yy': 'ReLU', 'L2_weight_yy': 4.209906744479307e-05, 'L_entropy_weight_yy': 8.176047749425353e-08, 'L_sep_weight_yy': 4.378688716943535e-09, 'L_scale_weight_yy': 4.7413586921385225e-08, 'learning_rate_yy': 0.007020500936413073}. Best is trial 12 with value: -1.6131555846140806.
[I 2026-03-17 17:16:28,987] Trial 16 pruned. 
[I 2026-03-17 17:16:29,872] Trial 11 pruned. 
[I 2026-03-17 17:16:30,572] Trial 6 finished with value: -2.512024489536699 and parameters: {'n_layers_yy': 2, 'hidden_size_yy_l0': 4, 'hidden_size_yy_l1': 5, 'context_size_yy': 4, 'num_mix_components_yy': 2, 'context_extractor_yy': 'lstm', 'activation_func_yy': 'ReLU', 'L2_weight_yy': 1.4213630738920279e-09, 'L_entropy_weight_yy': 4.463930032420465e-10, 'L_sep_weight_yy': 1.1215450441778275e-07, 'L_scale_weight_yy': 1.839643601315994e-08, 'learning_rate_yy': 0.008554473949149889}. Best is trial 6 with value: -2.512024489536699.
[I 2026-03-17 17:16:30,630] Trial 25 pruned. 
[I 2026-03-17 17:16:31,437] Trial 4 finished with value: -2.2763049719820994 and parameters: {'n_layers_yy': 2, 'hidden_size_yy_l0': 4, 'hidden_size_yy_l1': 6, 'context_size_yy': 2, 'num_mix_components_yy': 5, 'context_extractor_yy': 'gru', 'activation_func_yy': 'ReLU', 'L2_weight_yy': 8.393787017284514e-06, 'L_entropy_weight_yy': 2.326335652414593e-06, 'L_sep_weight_yy': 1.707447732779897e-05, 'L_scale_weight_yy': 1.8674027617912024e-05, 'learning_rate_yy': 0.0016678678718694963}. Best is trial 0 with value: -2.289111866011322.
[I 2026-03-17 17:16:31,896] Trial 7 pruned. 
[I 2026-03-17 17:16:33,407] Trial 26 pruned. 
[I 2026-03-17 17:16:34,763] Trial 12 pruned. 
[I 2026-03-17 17:16:35,055] Trial 23 pruned. 
[I 2026-03-17 17:16:35,426] Trial 32 pruned. 
[I 2026-03-17 17:16:35,886] Trial 7 pruned. 
[I 2026-03-17 17:16:36,626] Trial 23 pruned. 
