[I 2026-03-17 17:26:54,057] Trial 26 finished with value: -2.431508666941932 and parameters: {'n_layers_yy': 2, 'hidden_size_yy_l0': 3, 'hidden_size_yy_l1': 4, 'context_size_yy': 4, 'num_mix_components_yy': 5, 'context_extractor_yy': 'lstm', 'activation_func_yy': 'ReLU', 'L2_weight_yy': 9.554752345612526e-08, 'L_entropy_weight_yy': 1.3852412932052906e-09, 'L_sep_weight_yy': 6.047884109335622e-06, 'L_scale_weight_yy': 8.031880723148703e-05, 'learning_rate_yy': 0.00826249749265226}. Best is trial 24 with value: -2.4926837718550585.
[I 2026-03-17 17:26:57,233] Trial 27 pruned. 
[I 2026-03-17 17:26:59,324] Trial 44 finished with value: -2.0922178456886824 and parameters: {'n_layers_yy': 2, 'hidden_size_yy_l0': 4, 'hidden_size_yy_l1': 4, 'context_size_yy': 4, 'num_mix_components_yy': 5, 'context_extractor_yy': 'gru', 'activation_func_yy': 'ReLU', 'L2_weight_yy': 2.8666705680369605e-09, 'L_entropy_weight_yy': 2.8516793218605552e-08, 'L_sep_weight_yy': 1.012012619983031e-07, 'L_scale_weight_yy': 6.93144616774775e-05, 'learning_rate_yy': 0.008406658950956393}. Best is trial 41 with value: -2.093922187128181.
[I 2026-03-17 17:26:59,493] Trial 28 pruned. 
[I 2026-03-17 17:27:00,368] Trial 28 pruned. 
[I 2026-03-17 17:27:03,291] Trial 29 pruned. 
[I 2026-03-17 17:27:05,499] Trial 45 pruned. 
[I 2026-03-17 17:27:06,123] Trial 18 finished with value: -3.2575084798177083 and parameters: {'n_layers_yy': 1, 'hidden_size_yy_l0': 6, 'context_size_yy': 4, 'num_mix_components_yy': 4, 'context_extractor_yy': 'gru', 'activation_func_yy': 'ReLU', 'L2_weight_yy': 2.5341753801398573e-09, 'L_entropy_weight_yy': 1.0557481519106282e-06, 'L_sep_weight_yy': 1.1075313291901611e-10, 'L_scale_weight_yy': 6.640422972609732e-10, 'learning_rate_yy': 0.005623697000673872}. Best is trial 16 with value: -3.2663029296875.
[I 2026-03-17 17:27:06,272] Trial 22 finished with value: -2.752847783315028 and parameters: {'n_layers_yy': 1, 'hidden_size_yy_l0': 2, 'context_size_yy': 1, 'num_mix_components_yy': 2, 'context_extractor_yy': 'gru', 'activation_func_yy': 'GELU', 'L2_weight_yy': 8.015936997274935e-05, 'L_entropy_weight_yy': 0.00016302324891899955, 'L_sep_weight_yy': 0.0006607258260501044, 'L_scale_weight_yy': 1.0321583638071432e-09, 'learning_rate_yy': 0.0013889990678725953}. Best is trial 9 with value: -2.7636669680656607.
[I 2026-03-17 17:27:07,592] Trial 46 pruned. 
[I 2026-03-17 17:27:08,017] Trial 24 finished with value: -2.9630544934679146 and parameters: {'n_layers_yy': 1, 'hidden_size_yy_l0': 6, 'context_size_yy': 3, 'num_mix_components_yy': 4, 'context_extractor_yy': 'gru', 'activation_func_yy': 'Tanh', 'L2_weight_yy': 5.53364114181141e-09, 'L_entropy_weight_yy': 1.1280243048898365e-07, 'L_sep_weight_yy': 7.067818204381499e-07, 'L_scale_weight_yy': 6.837830644297793e-09, 'learning_rate_yy': 0.006940251589689242}. Best is trial 9 with value: -2.9754424140841684.
[I 2026-03-17 17:27:08,640] Trial 40 finished with value: -2.8354289021200114 and parameters: {'n_layers_yy': 1, 'hidden_size_yy_l0': 5, 'context_size_yy': 4, 'num_mix_components_yy': 4, 'context_extractor_yy': 'gru', 'activation_func_yy': 'ReLU', 'L2_weight_yy': 0.00022123095979671392, 'L_entropy_weight_yy': 1.8317756322896626e-10, 'L_sep_weight_yy': 2.9569796254086423e-08, 'L_scale_weight_yy': 3.0166393206304465e-10, 'learning_rate_yy': 0.006013607135940011}. Best is trial 35 with value: -2.838645471907643.
[I 2026-03-17 17:27:11,546] Trial 30 pruned. 
[I 2026-03-17 17:27:12,525] Trial 47 pruned. 
[I 2026-03-17 17:27:13,605] Trial 41 pruned. 
[I 2026-03-17 17:27:14,725] Trial 25 pruned. 
[I 2026-03-17 17:27:14,864] Trial 23 pruned. 
[I 2026-03-17 17:27:16,478] Trial 32 finished with value: -3.118129477251082 and parameters: {'n_layers_yy': 1, 'hidden_size_yy_l0': 6, 'context_size_yy': 4, 'num_mix_components_yy': 1, 'context_extractor_yy': 'gru', 'activation_func_yy': 'ReLU', 'L2_weight_yy': 2.188728763561814e-06, 'L_entropy_weight_yy': 1.6842202389192728e-09, 'L_sep_weight_yy': 5.887080155492032e-09, 'L_scale_weight_yy': 2.130420225345757e-06, 'learning_rate_yy': 0.006758329076779265}. Best is trial 22 with value: -3.1523755105572735.
[I 2026-03-17 17:27:17,231] Trial 45 pruned. 
[I 2026-03-17 17:27:17,400] Trial 48 pruned. 
[I 2026-03-17 17:27:17,999] Trial 19 pruned. 
[I 2026-03-17 17:27:18,354] Trial 24 pruned. 
[I 2026-03-17 17:27:18,604] Trial 42 pruned. 
[I 2026-03-17 17:27:19,471] Trial 49 pruned. 
Optimize task 13: group_id: POm, neuron_id: 47
Starting optimization for task 13...

--- Data Summary ---
Total events for target process 12731
Data Time: 900 seconds
Using device: cuda
Number of events in target process: 12731
Only one process provided, preparing dataloaders for the reduced model.
Reduced model ln_yy : 529.16958 nats/sec, 37.40889 nats/event
Reduced model Log loss : -1.71852
Number of events in target process: 12731
Only one process provided, preparing dataloaders for the reduced model.
Reduced model ln_yy : 543.10698 nats/sec, 38.39418 nats/event
Reduced model Log loss : -1.78022
Number of events in target process: 12731
Only one process provided, preparing dataloaders for the reduced model.
Reduced model ln_yy : 549.51041 nats/sec, 38.84686 nats/event
Reduced model Log loss : -1.78280
Number of events in target process: 12731
Only one process provided, preparing dataloaders for the reduced model.
Number of events in target process: 12731
Only one process provided, preparing dataloaders for the reduced model.
Reduced model ln_yy : 550.09091 nats/sec, 38.88790 nats/event
Reduced model Log loss : -1.78283
Number of events in target process: 12731
Only one process provided, preparing dataloaders for the reduced model.
Reduced model ln_yy : 548.95667 nats/sec, 38.80771 nats/event
Reduced model Log loss : -1.77988
Number of events in target process: 12731
Only one process provided, preparing dataloaders for the reduced model.
Number of events in target process: 12731
Only one process provided, preparing dataloaders for the reduced model.
Reduced model ln_yy : 548.10065 nats/sec, 38.74720 nats/event
Reduced model Log loss : -1.78091
Number of events in target process: 12731
Only one process provided, preparing dataloaders for the reduced model.
Reduced model ln_yy : 542.81006 nats/sec, 38.37319 nats/event
Reduced model Log loss : -1.78667
Number of events in target process: 12731
Only one process provided, preparing dataloaders for the reduced model.
Number of events in target process: 12731
Only one process provided, preparing dataloaders for the reduced model.
Number of events in target process: 12731
Only one process provided, preparing dataloaders for the reduced model.
Number of events in target process: 12731
Only one process provided, preparing dataloaders for the reduced model.
Number of events in target process: 12731
Only one process provided, preparing dataloaders for the reduced model.
Number of events in target process: 12731
Only one process provided, preparing dataloaders for the reduced model.
Number of events in target process: 12731
Only one process provided, preparing dataloaders for the reduced model.
Number of events in target process: 12731
Only one process provided, preparing dataloaders for the reduced model.
Number of events in target process: 12731
Only one process provided, preparing dataloaders for the reduced model.
Number of events in target process: 12731
Only one process provided, preparing dataloaders for the reduced model.
Reduced model ln_yy : 549.22241 nats/sec, 38.82650 nats/event
Reduced model Log loss : -1.78280
Number of events in target process: 12731
Only one process provided, preparing dataloaders for the reduced model.
Number of events in target process: 12731
Only one process provided, preparing dataloaders for the reduced model.
Number of events in target process: 12731
Only one process provided, preparing dataloaders for the reduced model.
Number of events in target process: 12731
Only one process provided, preparing dataloaders for the reduced model.
Number of events in target process: 12731
Only one process provided, preparing dataloaders for the reduced model.
Reduced model ln_yy : 546.40999 nats/sec, 38.62768 nats/event
Reduced model Log loss : -1.78241
Number of events in target process: 12731
Only one process provided, preparing dataloaders for the reduced model.
Number of events in target process: 12731
Only one process provided, preparing dataloaders for the reduced model.
Number of events in target process: 12731
Only one process provided, preparing dataloaders for the reduced model.
Number of events in target process: 12731
Only one process provided, preparing dataloaders for the reduced model.
Number of events in target process: 12731
Only one process provided, preparing dataloaders for the reduced model.
Number of events in target process: 12731
Only one process provided, preparing dataloaders for the reduced model.
Number of events in target process: 12731
Only one process provided, preparing dataloaders for the reduced model.
Reduced model ln_yy : 544.35316 nats/sec, 38.48227 nats/event
Reduced model Log loss : -1.77528
Number of events in target process: 12731
Only one process provided, preparing dataloaders for the reduced model.
Number of events in target process: 12731
Only one process provided, preparing dataloaders for the reduced model.
Number of events in target process: 12731
Only one process provided, preparing dataloaders for the reduced model.
Number of events in target process: 12731
Only one process provided, preparing dataloaders for the reduced model.
Number of events in target process: 12731
Only one process provided, preparing dataloaders for the reduced model.
Number of events in target process: 12731
Only one process provided, preparing dataloaders for the reduced model.
Number of events in target process: 12731
Only one process provided, preparing dataloaders for the reduced model.
Number of events in target process: 12731
Only one process provided, preparing dataloaders for the reduced model.
Number of events in target process: 12731
Only one process provided, preparing dataloaders for the reduced model.
Number of events in target process: 12731
Only one process provided, preparing dataloaders for the reduced model.
Number of events in target process: 12731
Only one process provided, preparing dataloaders for the reduced model.
Reduced model ln_yy : 546.69198 nats/sec, 38.64761 nats/event
Reduced model Log loss : -1.78230
Number of events in target process: 12731
Only one process provided, preparing dataloaders for the reduced model.
Number of events in target process: 12731
Only one process provided, preparing dataloaders for the reduced model.
Reduced model ln_yy : 546.89964 nats/sec, 38.66229 nats/event
Reduced model Log loss : -1.78033
Number of events in target process: 12731
Only one process provided, preparing dataloaders for the reduced model.
Reduced model ln_yy : 544.44466 nats/sec, 38.48874 nats/event
Reduced model Log loss : -1.78170
Number of events in target process: 12731
Only one process provided, preparing dataloaders for the reduced model.
Number of events in target process: 12731
Only one process provided, preparing dataloaders for the reduced model.
Number of events in target process: 12731
Only one process provided, preparing dataloaders for the reduced model.
Number of events in target process: 12731
Only one process provided, preparing dataloaders for the reduced model.
Number of events in target process: 12731
Only one process provided, preparing dataloaders for the reduced model.
Best trial:
  Value: -1.786668244949495
  Params: {'n_layers_yy': 2, 'hidden_size_yy_l0': 2, 'hidden_size_yy_l1': 6, 'context_size_yy': 1, 'num_mix_components_yy': 5, 'context_extractor_yy': 'gru', 'activation_func_yy': 'GELU', 'L2_weight_yy': 1.2487382032667461e-05, 'L_entropy_weight_yy': 3.225521192183634e-05, 'L_sep_weight_yy': 5.892133741615616e-09, 'L_scale_weight_yy': 1.3130531262149028e-09, 'learning_rate_yy': 0.0034758811719571136}
Full best configuration saved to results/opt/opt_reduced_13_best_config.txt
Optimization finished.
[I 2026-03-17 17:27:20,771] Trial 47 finished with value: -2.63965485570872 and parameters: {'n_layers_yy': 1, 'hidden_size_yy_l0': 5, 'context_size_yy': 4, 'num_mix_components_yy': 4, 'context_extractor_yy': 'lstm', 'activation_func_yy': 'ReLU', 'L2_weight_yy': 1.0851826276703666e-06, 'L_entropy_weight_yy': 2.599867522177554e-09, 'L_sep_weight_yy': 1.0942613517446583e-05, 'L_scale_weight_yy': 0.00038599832806693557, 'learning_rate_yy': 0.009352280747323147}. Best is trial 44 with value: -2.639695928418474.
[I 2026-03-17 17:27:22,506] Trial 24 finished with value: -2.2895590587228427 and parameters: {'n_layers_yy': 1, 'hidden_size_yy_l0': 6, 'context_size_yy': 4, 'num_mix_components_yy': 2, 'context_extractor_yy': 'lstm', 'activation_func_yy': 'GELU', 'L2_weight_yy': 3.726585736804011e-05, 'L_entropy_weight_yy': 2.1006867835151078e-08, 'L_sep_weight_yy': 0.00016280059514898646, 'L_scale_weight_yy': 0.0001414421190392277, 'learning_rate_yy': 0.006581174609596337}. Best is trial 24 with value: -2.2895590587228427.
[I 2026-03-17 17:27:23,101] Trial 46 pruned. 
[I 2026-03-17 17:27:23,394] Trial 43 pruned. 
[I 2026-03-17 17:27:34,828] Trial 31 pruned. 
[I 2026-03-17 17:27:36,520] Trial 44 pruned. 
[I 2026-03-17 17:27:36,988] Trial 39 finished with value: -2.3740229382349183 and parameters: {'n_layers_yy': 2, 'hidden_size_yy_l0': 2, 'hidden_size_yy_l1': 6, 'context_size_yy': 1, 'num_mix_components_yy': 3, 'context_extractor_yy': 'lstm', 'activation_func_yy': 'Tanh', 'L2_weight_yy': 3.0089280244960866e-09, 'L_entropy_weight_yy': 0.0008474428793609933, 'L_sep_weight_yy': 6.793650139192177e-09, 'L_scale_weight_yy': 1.4729314612740505e-07, 'learning_rate_yy': 0.008865667320337984}. Best is trial 22 with value: -2.3759054172258436.
[I 2026-03-17 17:27:39,192] Trial 40 pruned. 
[I 2026-03-17 17:27:42,524] Trial 23 pruned. 
[I 2026-03-17 17:27:42,837] Trial 32 pruned. 
[I 2026-03-17 17:27:45,652] Trial 25 pruned. 
[I 2026-03-17 17:27:46,956] Trial 24 pruned. 
[I 2026-03-17 17:27:49,405] Trial 48 finished with value: -2.6396947710365732 and parameters: {'n_layers_yy': 1, 'hidden_size_yy_l0': 5, 'context_size_yy': 4, 'num_mix_components_yy': 4, 'context_extractor_yy': 'lstm', 'activation_func_yy': 'ReLU', 'L2_weight_yy': 1.8403407761923583e-07, 'L_entropy_weight_yy': 1.83447704100611e-09, 'L_sep_weight_yy': 2.10329727333193e-06, 'L_scale_weight_yy': 0.00036837093834728217, 'learning_rate_yy': 0.009248215627148585}. Best is trial 44 with value: -2.639695928418474.
[I 2026-03-17 17:27:53,209] Trial 20 pruned. 
[I 2026-03-17 17:27:55,489] Trial 26 pruned. 
