[I 2026-03-17 17:15:34,903] Trial 44 finished with value: -0.7463837346086826 and parameters: {'n_layers_yy': 1, 'hidden_size_yy_l0': 5, 'context_size_yy': 2, 'num_mix_components_yy': 3, 'context_extractor_yy': 'lstm', 'activation_func_yy': 'ReLU', 'L2_weight_yy': 3.8597067518842074e-08, 'L_entropy_weight_yy': 6.474501015017024e-08, 'L_sep_weight_yy': 1.1864778918571734e-06, 'L_scale_weight_yy': 4.738793105212946e-10, 'learning_rate_yy': 0.008546817370173269}. Best is trial 2 with value: -0.833493141163047.
[I 2026-03-17 17:15:35,291] Trial 49 pruned. 
Optimize task 3: group_id: BC, neuron_id: 11
Starting optimization for task 3...

--- Data Summary ---
Total events for target process 3828
Data Time: 900 seconds
Using device: cuda
Number of events in target process: 3828
Only one process provided, preparing dataloaders for the reduced model.
Reduced model ln_yy : 27.24386 nats/sec, 6.40530 nats/event
Reduced model Log loss : -0.55109
Number of events in target process: 3828
Only one process provided, preparing dataloaders for the reduced model.
Reduced model ln_yy : 27.97991 nats/sec, 6.57835 nats/event
Reduced model Log loss : -0.56331
Number of events in target process: 3828
Only one process provided, preparing dataloaders for the reduced model.
Number of events in target process: 3828
Only one process provided, preparing dataloaders for the reduced model.
Reduced model ln_yy : 27.97099 nats/sec, 6.57625 nats/event
Reduced model Log loss : -0.57650
Number of events in target process: 3828
Only one process provided, preparing dataloaders for the reduced model.
Reduced model ln_yy : 27.37824 nats/sec, 6.43689 nats/event
Reduced model Log loss : -0.56492
Number of events in target process: 3828
Only one process provided, preparing dataloaders for the reduced model.
Number of events in target process: 3828
Only one process provided, preparing dataloaders for the reduced model.
Number of events in target process: 3828
Only one process provided, preparing dataloaders for the reduced model.
Number of events in target process: 3828
Only one process provided, preparing dataloaders for the reduced model.
Number of events in target process: 3828
Only one process provided, preparing dataloaders for the reduced model.
Number of events in target process: 3828
Only one process provided, preparing dataloaders for the reduced model.
Reduced model ln_yy : 27.88318 nats/sec, 6.55561 nats/event
Reduced model Log loss : -0.57317
Number of events in target process: 3828
Only one process provided, preparing dataloaders for the reduced model.
Number of events in target process: 3828
Only one process provided, preparing dataloaders for the reduced model.
Number of events in target process: 3828
Only one process provided, preparing dataloaders for the reduced model.
Number of events in target process: 3828
Only one process provided, preparing dataloaders for the reduced model.
Number of events in target process: 3828
Only one process provided, preparing dataloaders for the reduced model.
Number of events in target process: 3828
Only one process provided, preparing dataloaders for the reduced model.
Number of events in target process: 3828
Only one process provided, preparing dataloaders for the reduced model.
Number of events in target process: 3828
Only one process provided, preparing dataloaders for the reduced model.
Reduced model ln_yy : 28.41574 nats/sec, 6.68082 nats/event
Reduced model Log loss : -0.57598
Number of events in target process: 3828
Only one process provided, preparing dataloaders for the reduced model.
Number of events in target process: 3828
Only one process provided, preparing dataloaders for the reduced model.
Reduced model ln_yy : 28.42965 nats/sec, 6.68409 nats/event
Reduced model Log loss : -0.57962
Number of events in target process: 3828
Only one process provided, preparing dataloaders for the reduced model.
Number of events in target process: 3828
Only one process provided, preparing dataloaders for the reduced model.
Number of events in target process: 3828
Only one process provided, preparing dataloaders for the reduced model.
Reduced model ln_yy : 28.39396 nats/sec, 6.67570 nats/event
Reduced model Log loss : -0.57973
Number of events in target process: 3828
Only one process provided, preparing dataloaders for the reduced model.
Number of events in target process: 3828
Only one process provided, preparing dataloaders for the reduced model.
Number of events in target process: 3828
Only one process provided, preparing dataloaders for the reduced model.
Number of events in target process: 3828
Only one process provided, preparing dataloaders for the reduced model.
Number of events in target process: 3828
Only one process provided, preparing dataloaders for the reduced model.
Number of events in target process: 3828
Only one process provided, preparing dataloaders for the reduced model.
Number of events in target process: 3828
Only one process provided, preparing dataloaders for the reduced model.
Number of events in target process: 3828
Only one process provided, preparing dataloaders for the reduced model.
Number of events in target process: 3828
Only one process provided, preparing dataloaders for the reduced model.
Number of events in target process: 3828
Only one process provided, preparing dataloaders for the reduced model.
Number of events in target process: 3828
Only one process provided, preparing dataloaders for the reduced model.
Number of events in target process: 3828
Only one process provided, preparing dataloaders for the reduced model.
Number of events in target process: 3828
Only one process provided, preparing dataloaders for the reduced model.
Number of events in target process: 3828
Only one process provided, preparing dataloaders for the reduced model.
Number of events in target process: 3828
Only one process provided, preparing dataloaders for the reduced model.
Reduced model ln_yy : 28.01304 nats/sec, 6.58614 nats/event
Reduced model Log loss : -0.57868
Number of events in target process: 3828
Only one process provided, preparing dataloaders for the reduced model.
Number of events in target process: 3828
Only one process provided, preparing dataloaders for the reduced model.
Number of events in target process: 3828
Only one process provided, preparing dataloaders for the reduced model.
Number of events in target process: 3828
Only one process provided, preparing dataloaders for the reduced model.
Number of events in target process: 3828
Only one process provided, preparing dataloaders for the reduced model.
Reduced model ln_yy : 27.78354 nats/sec, 6.53218 nats/event
Reduced model Log loss : -0.58197
Number of events in target process: 3828
Only one process provided, preparing dataloaders for the reduced model.
Number of events in target process: 3828
Only one process provided, preparing dataloaders for the reduced model.
Number of events in target process: 3828
Only one process provided, preparing dataloaders for the reduced model.
Reduced model ln_yy : 28.40761 nats/sec, 6.67891 nats/event
Reduced model Log loss : -0.57745
Number of events in target process: 3828
Only one process provided, preparing dataloaders for the reduced model.
Number of events in target process: 3828
Only one process provided, preparing dataloaders for the reduced model.
Number of events in target process: 3828
Only one process provided, preparing dataloaders for the reduced model.
Best trial:
  Value: -0.5819698790244584
  Params: {'n_layers_yy': 1, 'hidden_size_yy_l0': 4, 'context_size_yy': 4, 'num_mix_components_yy': 3, 'context_extractor_yy': 'gru', 'activation_func_yy': 'Tanh', 'L2_weight_yy': 3.987208829466203e-09, 'L_entropy_weight_yy': 0.00012122421505187596, 'L_sep_weight_yy': 1.0989883823247263e-07, 'L_scale_weight_yy': 2.323188075836104e-10, 'learning_rate_yy': 0.006605292316292198}
Full best configuration saved to results/opt/opt_reduced_3_best_config.txt
Optimization finished.
[I 2026-03-17 17:15:36,022] Trial 23 pruned. 
[I 2026-03-17 17:15:37,245] Trial 5 pruned. 
[I 2026-03-17 17:15:37,392] Trial 45 pruned. 
[I 2026-03-17 17:15:41,082] Trial 24 pruned. 
[I 2026-03-17 17:15:41,479] Trial 29 pruned. 
[I 2026-03-17 17:15:41,828] Trial 6 pruned. 
[I 2026-03-17 17:15:42,012] Trial 21 finished with value: -2.813259676079899 and parameters: {'n_layers_yy': 1, 'hidden_size_yy_l0': 5, 'context_size_yy': 4, 'num_mix_components_yy': 2, 'context_extractor_yy': 'lstm', 'activation_func_yy': 'Tanh', 'L2_weight_yy': 1.9024629994077312e-08, 'L_entropy_weight_yy': 1.7284513150259654e-07, 'L_sep_weight_yy': 1.1825127153326233e-05, 'L_scale_weight_yy': 5.773798441351523e-09, 'learning_rate_yy': 0.009716805376577778}. Best is trial 11 with value: -2.8352269528025382.
[I 2026-03-17 17:15:44,355] Trial 10 finished with value: -1.7014888989844776 and parameters: {'n_layers_yy': 2, 'hidden_size_yy_l0': 2, 'hidden_size_yy_l1': 5, 'context_size_yy': 4, 'num_mix_components_yy': 3, 'context_extractor_yy': 'lstm', 'activation_func_yy': 'Tanh', 'L2_weight_yy': 2.7931416553187867e-07, 'L_entropy_weight_yy': 1.3745165106556334e-05, 'L_sep_weight_yy': 2.388862927751008e-06, 'L_scale_weight_yy': 2.104432772657321e-06, 'learning_rate_yy': 0.0072801021391587836}. Best is trial 3 with value: -1.702986696445342.
[I 2026-03-17 17:15:44,632] Trial 25 pruned. 
[I 2026-03-17 17:15:45,054] Trial 30 pruned. 
[I 2026-03-17 17:15:47,928] Trial 25 pruned. 
[I 2026-03-17 17:15:48,222] Trial 26 pruned. 
[I 2026-03-17 17:15:48,577] Trial 11 pruned. 
[I 2026-03-17 17:15:49,156] Trial 19 finished with value: -1.2744708951431811 and parameters: {'n_layers_yy': 1, 'hidden_size_yy_l0': 6, 'context_size_yy': 2, 'num_mix_components_yy': 4, 'context_extractor_yy': 'lstm', 'activation_func_yy': 'GELU', 'L2_weight_yy': 3.0961142115297203e-07, 'L_entropy_weight_yy': 0.0009499876500065552, 'L_sep_weight_yy': 0.0005654934568692552, 'L_scale_weight_yy': 3.3398516030853965e-07, 'learning_rate_yy': 0.008594674502465793}. Best is trial 19 with value: -1.2744708951431811.
[I 2026-03-17 17:15:50,045] Trial 47 pruned. 
[I 2026-03-17 17:15:51,117] Trial 21 finished with value: -1.675685965058209 and parameters: {'n_layers_yy': 1, 'hidden_size_yy_l0': 6, 'context_size_yy': 4, 'num_mix_components_yy': 4, 'context_extractor_yy': 'gru', 'activation_func_yy': 'GELU', 'L2_weight_yy': 5.883331069653467e-06, 'L_entropy_weight_yy': 2.4345725190787947e-06, 'L_sep_weight_yy': 1.6029961075799876e-08, 'L_scale_weight_yy': 1.0873556387613133e-10, 'learning_rate_yy': 0.008375656833976054}. Best is trial 2 with value: -1.677622742403132.
[I 2026-03-17 17:15:52,107] Trial 20 pruned. 
[I 2026-03-17 17:15:52,177] Trial 12 pruned. 
[I 2026-03-17 17:15:52,404] Trial 27 pruned. 
[I 2026-03-17 17:15:54,756] Trial 21 pruned. 
[I 2026-03-17 17:15:55,080] Trial 48 pruned. 
[I 2026-03-17 17:15:55,685] Trial 48 finished with value: -0.4274296243862471 and parameters: {'n_layers_yy': 1, 'hidden_size_yy_l0': 4, 'context_size_yy': 3, 'num_mix_components_yy': 1, 'context_extractor_yy': 'gru', 'activation_func_yy': 'GELU', 'L2_weight_yy': 8.830968695042265e-09, 'L_entropy_weight_yy': 1.6466181459676027e-08, 'L_sep_weight_yy': 3.363928799148622e-06, 'L_scale_weight_yy': 5.249662315821541e-10, 'learning_rate_yy': 0.005280071324934752}. Best is trial 38 with value: -0.44168936431223393.
[I 2026-03-17 17:15:55,946] Trial 28 pruned. 
[I 2026-03-17 17:15:57,863] Trial 49 pruned. 
Optimize task 1: group_id: BC, neuron_id: 1
Starting optimization for task 1...

--- Data Summary ---
Total events for target process 1783
Data Time: 900 seconds
Using device: cuda
Number of events in target process: 1783
Only one process provided, preparing dataloaders for the reduced model.
Reduced model ln_yy : 5.86374 nats/sec, 2.95982 nats/event
Reduced model Log loss : -0.39019
Number of events in target process: 1783
Only one process provided, preparing dataloaders for the reduced model.
Reduced model ln_yy : 5.83559 nats/sec, 2.94562 nats/event
Reduced model Log loss : -0.41264
Number of events in target process: 1783
Only one process provided, preparing dataloaders for the reduced model.
Reduced model ln_yy : 5.85176 nats/sec, 2.95378 nats/event
Reduced model Log loss : -0.41537
Number of events in target process: 1783
Only one process provided, preparing dataloaders for the reduced model.
Reduced model ln_yy : 5.78854 nats/sec, 2.92187 nats/event
Reduced model Log loss : -0.39166
Number of events in target process: 1783
Only one process provided, preparing dataloaders for the reduced model.
Number of events in target process: 1783
Only one process provided, preparing dataloaders for the reduced model.
Number of events in target process: 1783
Only one process provided, preparing dataloaders for the reduced model.
Reduced model ln_yy : 6.11661 nats/sec, 3.08746 nats/event
Reduced model Log loss : -0.41952
Number of events in target process: 1783
Only one process provided, preparing dataloaders for the reduced model.
Number of events in target process: 1783
Only one process provided, preparing dataloaders for the reduced model.
Number of events in target process: 1783
Only one process provided, preparing dataloaders for the reduced model.
Number of events in target process: 1783
Only one process provided, preparing dataloaders for the reduced model.
Reduced model ln_yy : 5.89059 nats/sec, 2.97338 nats/event
Reduced model Log loss : -0.43615
Number of events in target process: 1783
Only one process provided, preparing dataloaders for the reduced model.
Number of events in target process: 1783
Only one process provided, preparing dataloaders for the reduced model.
Number of events in target process: 1783
Only one process provided, preparing dataloaders for the reduced model.
Reduced model ln_yy : 5.91302 nats/sec, 2.98470 nats/event
Reduced model Log loss : -0.42787
Number of events in target process: 1783
Only one process provided, preparing dataloaders for the reduced model.
Number of events in target process: 1783
Only one process provided, preparing dataloaders for the reduced model.
Number of events in target process: 1783
Only one process provided, preparing dataloaders for the reduced model.
Number of events in target process: 1783
Only one process provided, preparing dataloaders for the reduced model.
Reduced model ln_yy : 5.95403 nats/sec, 3.00540 nats/event
Reduced model Log loss : -0.39198
Number of events in target process: 1783
Only one process provided, preparing dataloaders for the reduced model.
Number of events in target process: 1783
Only one process provided, preparing dataloaders for the reduced model.
Number of events in target process: 1783
Only one process provided, preparing dataloaders for the reduced model.
Reduced model ln_yy : 6.00258 nats/sec, 3.02991 nats/event
Reduced model Log loss : -0.42796
Number of events in target process: 1783
Only one process provided, preparing dataloaders for the reduced model.
Number of events in target process: 1783
Only one process provided, preparing dataloaders for the reduced model.
Number of events in target process: 1783
Only one process provided, preparing dataloaders for the reduced model.
Number of events in target process: 1783
Only one process provided, preparing dataloaders for the reduced model.
Number of events in target process: 1783
Only one process provided, preparing dataloaders for the reduced model.
Number of events in target process: 1783
Only one process provided, preparing dataloaders for the reduced model.
Number of events in target process: 1783
Only one process provided, preparing dataloaders for the reduced model.
Number of events in target process: 1783
Only one process provided, preparing dataloaders for the reduced model.
Number of events in target process: 1783
Only one process provided, preparing dataloaders for the reduced model.
Reduced model ln_yy : 5.61716 nats/sec, 2.83536 nats/event
Reduced model Log loss : -0.38263
Number of events in target process: 1783
Only one process provided, preparing dataloaders for the reduced model.
Number of events in target process: 1783
Only one process provided, preparing dataloaders for the reduced model.
Number of events in target process: 1783
Only one process provided, preparing dataloaders for the reduced model.
Number of events in target process: 1783
Only one process provided, preparing dataloaders for the reduced model.
Number of events in target process: 1783
Only one process provided, preparing dataloaders for the reduced model.
Number of events in target process: 1783
Only one process provided, preparing dataloaders for the reduced model.
Reduced model ln_yy : 5.85365 nats/sec, 2.95473 nats/event
Reduced model Log loss : -0.43779
Number of events in target process: 1783
Only one process provided, preparing dataloaders for the reduced model.
Reduced model ln_yy : 5.71749 nats/sec, 2.88600 nats/event
Reduced model Log loss : -0.38966
Number of events in target process: 1783
Only one process provided, preparing dataloaders for the reduced model.
Number of events in target process: 1783
Only one process provided, preparing dataloaders for the reduced model.
Reduced model ln_yy : 5.95193 nats/sec, 3.00434 nats/event
Reduced model Log loss : -0.44169
Number of events in target process: 1783
Only one process provided, preparing dataloaders for the reduced model.
Number of events in target process: 1783
Only one process provided, preparing dataloaders for the reduced model.
Number of events in target process: 1783
Only one process provided, preparing dataloaders for the reduced model.
Number of events in target process: 1783
Only one process provided, preparing dataloaders for the reduced model.
Number of events in target process: 1783
Only one process provided, preparing dataloaders for the reduced model.
Number of events in target process: 1783
Only one process provided, preparing dataloaders for the reduced model.
Number of events in target process: 1783
Only one process provided, preparing dataloaders for the reduced model.
Reduced model ln_yy : 5.89651 nats/sec, 2.97636 nats/event
Reduced model Log loss : -0.40797
Number of events in target process: 1783
Only one process provided, preparing dataloaders for the reduced model.
Number of events in target process: 1783
Only one process provided, preparing dataloaders for the reduced model.
Number of events in target process: 1783
Only one process provided, preparing dataloaders for the reduced model.
Reduced model ln_yy : 5.77315 nats/sec, 2.91410 nats/event
Reduced model Log loss : -0.42743
Number of events in target process: 1783
Only one process provided, preparing dataloaders for the reduced model.
Best trial:
  Value: -0.44168936431223393
  Params: {'n_layers_yy': 1, 'hidden_size_yy_l0': 5, 'context_size_yy': 2, 'num_mix_components_yy': 4, 'context_extractor_yy': 'lstm', 'activation_func_yy': 'ReLU', 'L2_weight_yy': 2.9563319996466178e-09, 'L_entropy_weight_yy': 1.4193155001933035e-09, 'L_sep_weight_yy': 2.5020061854267077e-09, 'L_scale_weight_yy': 1.1128681969701439e-09, 'learning_rate_yy': 0.009827079297374624}
Full best configuration saved to results/opt/opt_reduced_1_best_config.txt
Optimization finished.
[I 2026-03-17 17:16:00,166] Trial 46 finished with value: -0.8266710199668805 and parameters: {'n_layers_yy': 1, 'hidden_size_yy_l0': 5, 'context_size_yy': 2, 'num_mix_components_yy': 4, 'context_extractor_yy': 'lstm', 'activation_func_yy': 'ReLU', 'L2_weight_yy': 7.103003616286481e-09, 'L_entropy_weight_yy': 1.8574007953516972e-10, 'L_sep_weight_yy': 2.127072221429032e-08, 'L_scale_weight_yy': 5.733581317291025e-07, 'learning_rate_yy': 0.00703194797807532}. Best is trial 2 with value: -0.833493141163047.
[I 2026-03-17 17:16:01,689] Trial 22 pruned. 
[I 2026-03-17 17:16:02,503] Trial 12 finished with value: -1.835194123096955 and parameters: {'n_layers_yy': 1, 'hidden_size_yy_l0': 6, 'context_size_yy': 4, 'num_mix_components_yy': 1, 'context_extractor_yy': 'lstm', 'activation_func_yy': 'GELU', 'L2_weight_yy': 0.0003210561706242302, 'L_entropy_weight_yy': 2.2756458337432176e-05, 'L_sep_weight_yy': 1.0744031991960983e-10, 'L_scale_weight_yy': 3.432904372072892e-09, 'learning_rate_yy': 0.0036955028474772653}. Best is trial 10 with value: -1.8554935362796692.
[I 2026-03-17 17:16:03,173] Trial 20 pruned. 
[I 2026-03-17 17:16:04,506] Trial 13 finished with value: -3.116881273571248 and parameters: {'n_layers_yy': 1, 'hidden_size_yy_l0': 5, 'context_size_yy': 4, 'num_mix_components_yy': 2, 'context_extractor_yy': 'gru', 'activation_func_yy': 'ReLU', 'L2_weight_yy': 8.036263674389288e-06, 'L_entropy_weight_yy': 5.207464341903544e-09, 'L_sep_weight_yy': 2.261782028974567e-07, 'L_scale_weight_yy': 6.316063506588065e-07, 'learning_rate_yy': 0.004540684471877336}. Best is trial 12 with value: -3.1467977435352683.
[I 2026-03-17 17:16:04,731] Trial 47 pruned. 
[I 2026-03-17 17:16:04,809] Trial 23 pruned. 
[I 2026-03-17 17:16:05,175] Trial 29 pruned. 
[I 2026-03-17 17:16:05,950] Trial 5 finished with value: -2.4385125956058307 and parameters: {'n_layers_yy': 1, 'hidden_size_yy_l0': 3, 'context_size_yy': 1, 'num_mix_components_yy': 1, 'context_extractor_yy': 'lstm', 'activation_func_yy': 'GELU', 'L2_weight_yy': 0.0005267789984960935, 'L_entropy_weight_yy': 1.1556420373951383e-09, 'L_sep_weight_yy': 2.093460220657974e-09, 'L_scale_weight_yy': 3.790203469611742e-09, 'learning_rate_yy': 0.0008691074874895765}. Best is trial 2 with value: -2.489143682537181.
[I 2026-03-17 17:16:06,974] Trial 48 pruned. 
[I 2026-03-17 17:16:07,643] Trial 24 pruned. 
