[I 2026-03-17 17:26:17,463] Trial 49 pruned. 
Optimize task 21: group_id: POm, neuron_id: 55
Starting optimization for task 21...

--- Data Summary ---
Total events for target process 18269
Data Time: 900 seconds
Using device: cuda
Number of events in target process: 18269
Only one process provided, preparing dataloaders for the reduced model.
Reduced model ln_yy : 1209.53285 nats/sec, 59.58616 nats/event
Reduced model Log loss : -1.96133
Number of events in target process: 18269
Only one process provided, preparing dataloaders for the reduced model.
Reduced model ln_yy : 1210.54614 nats/sec, 59.63608 nats/event
Reduced model Log loss : -1.95354
Number of events in target process: 18269
Only one process provided, preparing dataloaders for the reduced model.
Reduced model ln_yy : 1207.76622 nats/sec, 59.49913 nats/event
Reduced model Log loss : -1.96131
Number of events in target process: 18269
Only one process provided, preparing dataloaders for the reduced model.
Number of events in target process: 18269
Only one process provided, preparing dataloaders for the reduced model.
Number of events in target process: 18269
Only one process provided, preparing dataloaders for the reduced model.
Reduced model ln_yy : 1225.50216 nats/sec, 60.37287 nats/event
Reduced model Log loss : -1.97974
Number of events in target process: 18269
Only one process provided, preparing dataloaders for the reduced model.
Number of events in target process: 18269
Only one process provided, preparing dataloaders for the reduced model.
Reduced model ln_yy : 1219.72507 nats/sec, 60.08827 nats/event
Reduced model Log loss : -1.98305
Number of events in target process: 18269
Only one process provided, preparing dataloaders for the reduced model.
Reduced model ln_yy : 1227.22543 nats/sec, 60.45776 nats/event
Reduced model Log loss : -1.97906
Number of events in target process: 18269
Only one process provided, preparing dataloaders for the reduced model.
Reduced model ln_yy : 1208.68713 nats/sec, 59.54450 nats/event
Reduced model Log loss : -1.94539
Number of events in target process: 18269
Only one process provided, preparing dataloaders for the reduced model.
Number of events in target process: 18269
Only one process provided, preparing dataloaders for the reduced model.
Number of events in target process: 18269
Only one process provided, preparing dataloaders for the reduced model.
Number of events in target process: 18269
Only one process provided, preparing dataloaders for the reduced model.
Number of events in target process: 18269
Only one process provided, preparing dataloaders for the reduced model.
Number of events in target process: 18269
Only one process provided, preparing dataloaders for the reduced model.
Number of events in target process: 18269
Only one process provided, preparing dataloaders for the reduced model.
Reduced model ln_yy : 1217.81261 nats/sec, 59.99405 nats/event
Reduced model Log loss : -1.98156
Number of events in target process: 18269
Only one process provided, preparing dataloaders for the reduced model.
Number of events in target process: 18269
Only one process provided, preparing dataloaders for the reduced model.
Number of events in target process: 18269
Only one process provided, preparing dataloaders for the reduced model.
Number of events in target process: 18269
Only one process provided, preparing dataloaders for the reduced model.
Reduced model ln_yy : 1217.58760 nats/sec, 59.98297 nats/event
Reduced model Log loss : -1.98505
Number of events in target process: 18269
Only one process provided, preparing dataloaders for the reduced model.
Number of events in target process: 18269
Only one process provided, preparing dataloaders for the reduced model.
Number of events in target process: 18269
Only one process provided, preparing dataloaders for the reduced model.
Number of events in target process: 18269
Only one process provided, preparing dataloaders for the reduced model.
Reduced model ln_yy : 1212.79940 nats/sec, 59.74708 nats/event
Reduced model Log loss : -1.98602
Number of events in target process: 18269
Only one process provided, preparing dataloaders for the reduced model.
Reduced model ln_yy : 1200.67387 nats/sec, 59.14973 nats/event
Reduced model Log loss : -1.96037
Number of events in target process: 18269
Only one process provided, preparing dataloaders for the reduced model.
Number of events in target process: 18269
Only one process provided, preparing dataloaders for the reduced model.
Number of events in target process: 18269
Only one process provided, preparing dataloaders for the reduced model.
Number of events in target process: 18269
Only one process provided, preparing dataloaders for the reduced model.
Reduced model ln_yy : 1224.01278 nats/sec, 60.29950 nats/event
Reduced model Log loss : -1.98393
Number of events in target process: 18269
Only one process provided, preparing dataloaders for the reduced model.
Number of events in target process: 18269
Only one process provided, preparing dataloaders for the reduced model.
Number of events in target process: 18269
Only one process provided, preparing dataloaders for the reduced model.
Number of events in target process: 18269
Only one process provided, preparing dataloaders for the reduced model.
Number of events in target process: 18269
Only one process provided, preparing dataloaders for the reduced model.
Number of events in target process: 18269
Only one process provided, preparing dataloaders for the reduced model.
Reduced model ln_yy : 1221.38180 nats/sec, 60.16988 nats/event
Reduced model Log loss : -1.98220
Number of events in target process: 18269
Only one process provided, preparing dataloaders for the reduced model.
Reduced model ln_yy : 1224.05847 nats/sec, 60.30175 nats/event
Reduced model Log loss : -1.98468
Number of events in target process: 18269
Only one process provided, preparing dataloaders for the reduced model.
Reduced model ln_yy : 1207.65022 nats/sec, 59.49342 nats/event
Reduced model Log loss : -1.95748
Number of events in target process: 18269
Only one process provided, preparing dataloaders for the reduced model.
Number of events in target process: 18269
Only one process provided, preparing dataloaders for the reduced model.
Reduced model ln_yy : 1206.66910 nats/sec, 59.44508 nats/event
Reduced model Log loss : -1.95926
Number of events in target process: 18269
Only one process provided, preparing dataloaders for the reduced model.
Number of events in target process: 18269
Only one process provided, preparing dataloaders for the reduced model.
Reduced model ln_yy : 1201.02897 nats/sec, 59.16723 nats/event
Reduced model Log loss : -1.95772
Number of events in target process: 18269
Only one process provided, preparing dataloaders for the reduced model.
Number of events in target process: 18269
Only one process provided, preparing dataloaders for the reduced model.
Number of events in target process: 18269
Only one process provided, preparing dataloaders for the reduced model.
Number of events in target process: 18269
Only one process provided, preparing dataloaders for the reduced model.
Number of events in target process: 18269
Only one process provided, preparing dataloaders for the reduced model.
Number of events in target process: 18269
Only one process provided, preparing dataloaders for the reduced model.
Reduced model ln_yy : 1220.80169 nats/sec, 60.14131 nats/event
Reduced model Log loss : -1.98427
Number of events in target process: 18269
Only one process provided, preparing dataloaders for the reduced model.
Reduced model ln_yy : 1213.47821 nats/sec, 59.78052 nats/event
Reduced model Log loss : -1.95795
Number of events in target process: 18269
Only one process provided, preparing dataloaders for the reduced model.
Best trial:
  Value: -1.9860150014876785
  Params: {'n_layers_yy': 2, 'hidden_size_yy_l0': 4, 'hidden_size_yy_l1': 5, 'context_size_yy': 4, 'num_mix_components_yy': 1, 'context_extractor_yy': 'gru', 'activation_func_yy': 'Tanh', 'L2_weight_yy': 4.510505783917802e-05, 'L_entropy_weight_yy': 4.032910051616316e-08, 'L_sep_weight_yy': 7.067590837117624e-06, 'L_scale_weight_yy': 4.45561409920854e-09, 'learning_rate_yy': 0.004443320640302025}
Full best configuration saved to results/opt/opt_reduced_21_best_config.txt
Optimization finished.
[I 2026-03-17 17:26:19,039] Trial 45 finished with value: -2.6396632060756544 and parameters: {'n_layers_yy': 1, 'hidden_size_yy_l0': 5, 'context_size_yy': 4, 'num_mix_components_yy': 4, 'context_extractor_yy': 'lstm', 'activation_func_yy': 'ReLU', 'L2_weight_yy': 1.3886645915508756e-06, 'L_entropy_weight_yy': 2.265474828931935e-09, 'L_sep_weight_yy': 6.95890724826082e-06, 'L_scale_weight_yy': 0.0003023344239457316, 'learning_rate_yy': 0.008926971153610358}. Best is trial 44 with value: -2.639695928418474.
[I 2026-03-17 17:26:21,171] Trial 35 pruned. 
[I 2026-03-17 17:26:23,654] Trial 36 pruned. 
[I 2026-03-17 17:26:24,547] Trial 23 finished with value: -2.287085976944997 and parameters: {'n_layers_yy': 1, 'hidden_size_yy_l0': 6, 'context_size_yy': 3, 'num_mix_components_yy': 2, 'context_extractor_yy': 'lstm', 'activation_func_yy': 'GELU', 'L2_weight_yy': 1.7379761008206367e-06, 'L_entropy_weight_yy': 7.699590057137254e-09, 'L_sep_weight_yy': 0.00020971414595922873, 'L_scale_weight_yy': 0.0001047414907355434, 'learning_rate_yy': 0.009640423076555356}. Best is trial 0 with value: -2.289111866011322.
[I 2026-03-17 17:26:24,660] Trial 46 finished with value: -1.8544034052456904 and parameters: {'n_layers_yy': 1, 'hidden_size_yy_l0': 6, 'context_size_yy': 2, 'num_mix_components_yy': 5, 'context_extractor_yy': 'lstm', 'activation_func_yy': 'Tanh', 'L2_weight_yy': 6.962285254273945e-07, 'L_entropy_weight_yy': 1.8861398944553525e-06, 'L_sep_weight_yy': 1.8871416426202128e-05, 'L_scale_weight_yy': 1.1662317283207323e-10, 'learning_rate_yy': 0.008988003121684603}. Best is trial 10 with value: -1.8554935362796692.
[I 2026-03-17 17:26:26,188] Trial 37 pruned. 
[I 2026-03-17 17:26:26,663] Trial 47 pruned. 
[I 2026-03-17 17:26:28,501] Trial 43 finished with value: -2.091679500438193 and parameters: {'n_layers_yy': 2, 'hidden_size_yy_l0': 4, 'hidden_size_yy_l1': 4, 'context_size_yy': 4, 'num_mix_components_yy': 5, 'context_extractor_yy': 'gru', 'activation_func_yy': 'ReLU', 'L2_weight_yy': 3.6482380774614298e-09, 'L_entropy_weight_yy': 2.7728448744776323e-08, 'L_sep_weight_yy': 1.3137835956803518e-07, 'L_scale_weight_yy': 1.3158717073244712e-05, 'learning_rate_yy': 0.008074809874089485}. Best is trial 41 with value: -2.093922187128181.
[I 2026-03-17 17:26:29,193] Trial 39 finished with value: -2.835695847600191 and parameters: {'n_layers_yy': 1, 'hidden_size_yy_l0': 6, 'context_size_yy': 4, 'num_mix_components_yy': 3, 'context_extractor_yy': 'gru', 'activation_func_yy': 'ReLU', 'L2_weight_yy': 1.1426055302688712e-07, 'L_entropy_weight_yy': 1.1242451016942674e-08, 'L_sep_weight_yy': 3.1151808270382156e-10, 'L_scale_weight_yy': 1.4538610356962089e-08, 'learning_rate_yy': 0.004826734422218112}. Best is trial 35 with value: -2.838645471907643.
[I 2026-03-17 17:26:31,300] Trial 25 pruned. 
[I 2026-03-17 17:26:37,179] Trial 31 finished with value: -3.118696528357516 and parameters: {'n_layers_yy': 1, 'hidden_size_yy_l0': 5, 'context_size_yy': 4, 'num_mix_components_yy': 2, 'context_extractor_yy': 'gru', 'activation_func_yy': 'ReLU', 'L2_weight_yy': 3.7117060753372268e-06, 'L_entropy_weight_yy': 2.776251862228368e-09, 'L_sep_weight_yy': 2.2083031248661798e-08, 'L_scale_weight_yy': 4.752595145286468e-07, 'learning_rate_yy': 0.006463947855160396}. Best is trial 22 with value: -3.1523755105572735.
[I 2026-03-17 17:26:37,842] Trial 21 pruned. 
[I 2026-03-17 17:26:40,714] Trial 48 pruned. 
[I 2026-03-17 17:26:42,686] Trial 49 pruned. 
Optimize task 14: group_id: POm, neuron_id: 48
Starting optimization for task 14...

--- Data Summary ---
Total events for target process 14713
Data Time: 900 seconds
Using device: cuda
Number of events in target process: 14713
Only one process provided, preparing dataloaders for the reduced model.
Reduced model ln_yy : 757.13890 nats/sec, 46.31448 nats/event
Reduced model Log loss : -1.85043
Number of events in target process: 14713
Only one process provided, preparing dataloaders for the reduced model.
Number of events in target process: 14713
Only one process provided, preparing dataloaders for the reduced model.
Reduced model ln_yy : 755.51622 nats/sec, 46.21522 nats/event
Reduced model Log loss : -1.85238
Number of events in target process: 14713
Only one process provided, preparing dataloaders for the reduced model.
Reduced model ln_yy : 755.64050 nats/sec, 46.22283 nats/event
Reduced model Log loss : -1.85181
Number of events in target process: 14713
Only one process provided, preparing dataloaders for the reduced model.
Number of events in target process: 14713
Only one process provided, preparing dataloaders for the reduced model.
Reduced model ln_yy : 758.07488 nats/sec, 46.37174 nats/event
Reduced model Log loss : -1.85219
Number of events in target process: 14713
Only one process provided, preparing dataloaders for the reduced model.
Reduced model ln_yy : 761.47736 nats/sec, 46.57987 nats/event
Reduced model Log loss : -1.85548
Number of events in target process: 14713
Only one process provided, preparing dataloaders for the reduced model.
Number of events in target process: 14713
Only one process provided, preparing dataloaders for the reduced model.
Reduced model ln_yy : 768.79822 nats/sec, 47.02769 nats/event
Reduced model Log loss : -1.84955
Number of events in target process: 14713
Only one process provided, preparing dataloaders for the reduced model.
Number of events in target process: 14713
Only one process provided, preparing dataloaders for the reduced model.
Reduced model ln_yy : 764.08004 nats/sec, 46.73908 nats/event
Reduced model Log loss : -1.85549
Number of events in target process: 14713
Only one process provided, preparing dataloaders for the reduced model.
Reduced model ln_yy : 762.86875 nats/sec, 46.66498 nats/event
Reduced model Log loss : -1.85442
Number of events in target process: 14713
Only one process provided, preparing dataloaders for the reduced model.
Reduced model ln_yy : 751.91136 nats/sec, 45.99471 nats/event
Reduced model Log loss : -1.83519
Number of events in target process: 14713
Only one process provided, preparing dataloaders for the reduced model.
Reduced model ln_yy : 760.31618 nats/sec, 46.50884 nats/event
Reduced model Log loss : -1.85187
Number of events in target process: 14713
Only one process provided, preparing dataloaders for the reduced model.
Number of events in target process: 14713
Only one process provided, preparing dataloaders for the reduced model.
Number of events in target process: 14713
Only one process provided, preparing dataloaders for the reduced model.
Number of events in target process: 14713
Only one process provided, preparing dataloaders for the reduced model.
Number of events in target process: 14713
Only one process provided, preparing dataloaders for the reduced model.
Number of events in target process: 14713
Only one process provided, preparing dataloaders for the reduced model.
Reduced model ln_yy : 764.59692 nats/sec, 46.77069 nats/event
Reduced model Log loss : -1.85485
Number of events in target process: 14713
Only one process provided, preparing dataloaders for the reduced model.
Number of events in target process: 14713
Only one process provided, preparing dataloaders for the reduced model.
Reduced model ln_yy : 764.99356 nats/sec, 46.79496 nats/event
Reduced model Log loss : -1.85479
Number of events in target process: 14713
Only one process provided, preparing dataloaders for the reduced model.
Reduced model ln_yy : 757.67198 nats/sec, 46.34709 nats/event
Reduced model Log loss : -1.85079
Number of events in target process: 14713
Only one process provided, preparing dataloaders for the reduced model.
Reduced model ln_yy : 759.96911 nats/sec, 46.48761 nats/event
Reduced model Log loss : -1.85483
Number of events in target process: 14713
Only one process provided, preparing dataloaders for the reduced model.
Number of events in target process: 14713
Only one process provided, preparing dataloaders for the reduced model.
Number of events in target process: 14713
Only one process provided, preparing dataloaders for the reduced model.
Number of events in target process: 14713
Only one process provided, preparing dataloaders for the reduced model.
Number of events in target process: 14713
Only one process provided, preparing dataloaders for the reduced model.
Number of events in target process: 14713
Only one process provided, preparing dataloaders for the reduced model.
Number of events in target process: 14713
Only one process provided, preparing dataloaders for the reduced model.
Number of events in target process: 14713
Only one process provided, preparing dataloaders for the reduced model.
Number of events in target process: 14713
Only one process provided, preparing dataloaders for the reduced model.
Reduced model ln_yy : 761.18138 nats/sec, 46.56176 nats/event
Reduced model Log loss : -1.85473
Number of events in target process: 14713
Only one process provided, preparing dataloaders for the reduced model.
Reduced model ln_yy : 763.43843 nats/sec, 46.69983 nats/event
Reduced model Log loss : -1.85448
Number of events in target process: 14713
Only one process provided, preparing dataloaders for the reduced model.
Number of events in target process: 14713
Only one process provided, preparing dataloaders for the reduced model.
Number of events in target process: 14713
Only one process provided, preparing dataloaders for the reduced model.
Reduced model ln_yy : 760.08954 nats/sec, 46.49498 nats/event
Reduced model Log loss : -1.85417
Number of events in target process: 14713
Only one process provided, preparing dataloaders for the reduced model.
Number of events in target process: 14713
Only one process provided, preparing dataloaders for the reduced model.
Reduced model ln_yy : 759.60791 nats/sec, 46.46551 nats/event
Reduced model Log loss : -1.85332
Number of events in target process: 14713
Only one process provided, preparing dataloaders for the reduced model.
Number of events in target process: 14713
Only one process provided, preparing dataloaders for the reduced model.
Number of events in target process: 14713
Only one process provided, preparing dataloaders for the reduced model.
Number of events in target process: 14713
Only one process provided, preparing dataloaders for the reduced model.
Reduced model ln_yy : 760.94446 nats/sec, 46.54727 nats/event
Reduced model Log loss : -1.85460
Number of events in target process: 14713
Only one process provided, preparing dataloaders for the reduced model.
Number of events in target process: 14713
Only one process provided, preparing dataloaders for the reduced model.
Number of events in target process: 14713
Only one process provided, preparing dataloaders for the reduced model.
Reduced model ln_yy : 752.81450 nats/sec, 46.04996 nats/event
Reduced model Log loss : -1.83766
Number of events in target process: 14713
Only one process provided, preparing dataloaders for the reduced model.
Reduced model ln_yy : 760.92352 nats/sec, 46.54599 nats/event
Reduced model Log loss : -1.85440
Number of events in target process: 14713
Only one process provided, preparing dataloaders for the reduced model.
Number of events in target process: 14713
Only one process provided, preparing dataloaders for the reduced model.
Number of events in target process: 14713
Only one process provided, preparing dataloaders for the reduced model.
Best trial:
  Value: -1.8554935362796692
  Params: {'n_layers_yy': 1, 'hidden_size_yy_l0': 6, 'context_size_yy': 4, 'num_mix_components_yy': 1, 'context_extractor_yy': 'lstm', 'activation_func_yy': 'Tanh', 'L2_weight_yy': 0.0002081040498734622, 'L_entropy_weight_yy': 0.00040755520048121375, 'L_sep_weight_yy': 1.0286525129244934e-10, 'L_scale_weight_yy': 3.9377147577509877e-10, 'learning_rate_yy': 0.009317540807220786}
Full best configuration saved to results/opt/opt_reduced_14_best_config.txt
Optimization finished.
[I 2026-03-17 17:26:45,687] Trial 38 pruned. 
[I 2026-03-17 17:26:47,522] Trial 22 pruned. 
[I 2026-03-17 17:26:49,690] Trial 46 finished with value: -2.63964668707944 and parameters: {'n_layers_yy': 1, 'hidden_size_yy_l0': 5, 'context_size_yy': 4, 'num_mix_components_yy': 4, 'context_extractor_yy': 'lstm', 'activation_func_yy': 'ReLU', 'L2_weight_yy': 1.2444835216572941e-06, 'L_entropy_weight_yy': 1.798067457431564e-09, 'L_sep_weight_yy': 5.625487410132029e-06, 'L_scale_weight_yy': 0.00023839420837438874, 'learning_rate_yy': 0.009018897657309498}. Best is trial 44 with value: -2.639695928418474.
[I 2026-03-17 17:26:50,534] Trial 27 finished with value: -2.4977853154821514 and parameters: {'n_layers_yy': 2, 'hidden_size_yy_l0': 5, 'hidden_size_yy_l1': 5, 'context_size_yy': 4, 'num_mix_components_yy': 1, 'context_extractor_yy': 'lstm', 'activation_func_yy': 'Tanh', 'L2_weight_yy': 1.0262248742743077e-09, 'L_entropy_weight_yy': 4.5612487049629183e-10, 'L_sep_weight_yy': 5.427039458571088e-06, 'L_scale_weight_yy': 1.3809758738497959e-08, 'learning_rate_yy': 0.007403961549965896}. Best is trial 21 with value: -2.5142283361436735.
[I 2026-03-17 17:26:51,383] Trial 44 finished with value: -1.7817012409248738 and parameters: {'n_layers_yy': 2, 'hidden_size_yy_l0': 6, 'hidden_size_yy_l1': 2, 'context_size_yy': 4, 'num_mix_components_yy': 3, 'context_extractor_yy': 'lstm', 'activation_func_yy': 'GELU', 'L2_weight_yy': 1.3745738086902697e-05, 'L_entropy_weight_yy': 1.8465194052295758e-05, 'L_sep_weight_yy': 5.359124002592344e-08, 'L_scale_weight_yy': 1.7972200537236543e-06, 'learning_rate_yy': 0.008452003769805337}. Best is trial 8 with value: -1.786668244949495.
