[I 2026-03-17 17:23:52,390] Trial 41 finished with value: -2.6394311749174797 and parameters: {'n_layers_yy': 1, 'hidden_size_yy_l0': 5, 'context_size_yy': 4, 'num_mix_components_yy': 4, 'context_extractor_yy': 'lstm', 'activation_func_yy': 'ReLU', 'L2_weight_yy': 1.7253619629600218e-06, 'L_entropy_weight_yy': 1.2626189460994054e-08, 'L_sep_weight_yy': 4.737328028673716e-06, 'L_scale_weight_yy': 1.4507448270633182e-05, 'learning_rate_yy': 0.007503876963823342}. Best is trial 41 with value: -2.6394311749174797.
[I 2026-03-17 17:23:53,099] Trial 41 finished with value: -2.4708878660093103 and parameters: {'n_layers_yy': 1, 'hidden_size_yy_l0': 6, 'context_size_yy': 4, 'num_mix_components_yy': 3, 'context_extractor_yy': 'lstm', 'activation_func_yy': 'Tanh', 'L2_weight_yy': 6.378171042623008e-08, 'L_entropy_weight_yy': 3.863123027571628e-05, 'L_sep_weight_yy': 1.7319058063731305e-06, 'L_scale_weight_yy': 2.1788723225197665e-10, 'learning_rate_yy': 0.0014404742863175506}. Best is trial 2 with value: -2.476197165819489.
[I 2026-03-17 17:23:53,100] Trial 13 pruned. 
[I 2026-03-17 17:23:53,103] Trial 28 finished with value: -2.3693876207971867 and parameters: {'n_layers_yy': 1, 'hidden_size_yy_l0': 5, 'context_size_yy': 3, 'num_mix_components_yy': 2, 'context_extractor_yy': 'gru', 'activation_func_yy': 'GELU', 'L2_weight_yy': 1.4163617727702683e-07, 'L_entropy_weight_yy': 1.166428443629277e-08, 'L_sep_weight_yy': 2.051143927757913e-09, 'L_scale_weight_yy': 9.909743848026465e-09, 'learning_rate_yy': 0.0017179906222704617}. Best is trial 22 with value: -2.3759054172258436.
[I 2026-03-17 17:23:53,400] Trial 40 pruned. 
[I 2026-03-17 17:23:56,757] Trial 39 finished with value: -2.0933789972841854 and parameters: {'n_layers_yy': 2, 'hidden_size_yy_l0': 4, 'hidden_size_yy_l1': 4, 'context_size_yy': 4, 'num_mix_components_yy': 5, 'context_extractor_yy': 'gru', 'activation_func_yy': 'ReLU', 'L2_weight_yy': 3.8576742813141387e-10, 'L_entropy_weight_yy': 5.951319472121238e-08, 'L_sep_weight_yy': 6.889118658115703e-08, 'L_scale_weight_yy': 7.495101858272743e-06, 'learning_rate_yy': 0.005869925364268324}. Best is trial 39 with value: -2.0933789972841854.
[I 2026-03-17 17:23:57,884] Trial 20 finished with value: -2.490696146538249 and parameters: {'n_layers_yy': 2, 'hidden_size_yy_l0': 2, 'hidden_size_yy_l1': 3, 'context_size_yy': 3, 'num_mix_components_yy': 5, 'context_extractor_yy': 'gru', 'activation_func_yy': 'GELU', 'L2_weight_yy': 0.00020922240102379418, 'L_entropy_weight_yy': 5.226044480905538e-09, 'L_sep_weight_yy': 1.6518279923506023e-06, 'L_scale_weight_yy': 4.470142904986028e-06, 'learning_rate_yy': 0.0035397216123071004}. Best is trial 18 with value: -2.4920728800472483.
[I 2026-03-17 17:24:00,509] Trial 14 pruned. 
[I 2026-03-17 17:24:01,238] Trial 21 pruned. 
[I 2026-03-17 17:24:01,831] Trial 39 finished with value: -1.9592643402364534 and parameters: {'n_layers_yy': 2, 'hidden_size_yy_l0': 3, 'hidden_size_yy_l1': 5, 'context_size_yy': 4, 'num_mix_components_yy': 2, 'context_extractor_yy': 'gru', 'activation_func_yy': 'ReLU', 'L2_weight_yy': 4.145687589197899e-08, 'L_entropy_weight_yy': 7.628605560415753e-09, 'L_sep_weight_yy': 6.808860313380306e-07, 'L_scale_weight_yy': 1.3650235785007526e-07, 'learning_rate_yy': 0.006762897458842226}. Best is trial 24 with value: -1.9860150014876785.
[I 2026-03-17 17:24:07,704] Trial 15 pruned. 
[I 2026-03-17 17:24:08,197] Trial 38 finished with value: -1.8533182018594616 and parameters: {'n_layers_yy': 1, 'hidden_size_yy_l0': 5, 'context_size_yy': 3, 'num_mix_components_yy': 4, 'context_extractor_yy': 'lstm', 'activation_func_yy': 'Tanh', 'L2_weight_yy': 7.050526996650838e-07, 'L_entropy_weight_yy': 0.0002473249904136259, 'L_sep_weight_yy': 9.629320721500157e-09, 'L_scale_weight_yy': 3.4092832992996512e-06, 'learning_rate_yy': 0.009909826584770614}. Best is trial 10 with value: -1.8554935362796692.
[I 2026-03-17 17:24:08,733] Trial 40 pruned. 
[I 2026-03-17 17:24:09,299] Trial 34 pruned. 
[I 2026-03-17 17:24:10,257] Trial 22 pruned. 
[I 2026-03-17 17:24:10,296] Trial 39 pruned. 
[I 2026-03-17 17:24:11,440] Trial 26 pruned. 
[I 2026-03-17 17:24:11,700] Trial 20 pruned. 
[I 2026-03-17 17:24:14,999] Trial 16 pruned. 
[I 2026-03-17 17:24:15,320] Trial 41 finished with value: -1.701119460887608 and parameters: {'n_layers_yy': 2, 'hidden_size_yy_l0': 2, 'hidden_size_yy_l1': 5, 'context_size_yy': 4, 'num_mix_components_yy': 3, 'context_extractor_yy': 'lstm', 'activation_func_yy': 'Tanh', 'L2_weight_yy': 2.1326983921089194e-07, 'L_entropy_weight_yy': 1.1696957000539654e-05, 'L_sep_weight_yy': 2.2562188697849203e-06, 'L_scale_weight_yy': 2.432139355104882e-06, 'learning_rate_yy': 0.006960838321390041}. Best is trial 20 with value: -1.7038948064814108.
[I 2026-03-17 17:24:15,924] Trial 40 pruned. 
[I 2026-03-17 17:24:15,979] Trial 35 pruned. 
[I 2026-03-17 17:24:16,204] Trial 35 finished with value: -2.838645471907643 and parameters: {'n_layers_yy': 1, 'hidden_size_yy_l0': 6, 'context_size_yy': 4, 'num_mix_components_yy': 3, 'context_extractor_yy': 'gru', 'activation_func_yy': 'ReLU', 'L2_weight_yy': 1.0986045195181261e-09, 'L_entropy_weight_yy': 1.4516427239538372e-09, 'L_sep_weight_yy': 1.0219723078020309e-09, 'L_scale_weight_yy': 1.4906906605462781e-09, 'learning_rate_yy': 0.008273118930690673}. Best is trial 35 with value: -2.838645471907643.
[I 2026-03-17 17:24:17,789] Trial 17 pruned. 
[I 2026-03-17 17:24:18,567] Trial 40 pruned. 
[I 2026-03-17 17:24:18,622] Trial 36 pruned. 
[I 2026-03-17 17:24:19,316] Trial 21 pruned. 
[I 2026-03-17 17:24:20,481] Trial 18 pruned. 
[I 2026-03-17 17:24:21,570] Trial 41 pruned. 
[I 2026-03-17 17:24:22,188] Trial 36 pruned. 
[I 2026-03-17 17:24:25,197] Trial 37 pruned. 
[I 2026-03-17 17:24:26,522] Trial 16 finished with value: -2.8104182726972877 and parameters: {'n_layers_yy': 1, 'hidden_size_yy_l0': 6, 'context_size_yy': 3, 'num_mix_components_yy': 3, 'context_extractor_yy': 'lstm', 'activation_func_yy': 'Tanh', 'L2_weight_yy': 2.4458328841779396e-08, 'L_entropy_weight_yy': 2.909994802486671e-09, 'L_sep_weight_yy': 1.593051980139751e-10, 'L_scale_weight_yy': 6.706760671055146e-09, 'learning_rate_yy': 0.009997364388539149}. Best is trial 16 with value: -2.8104182726972877.
[I 2026-03-17 17:24:28,785] Trial 42 finished with value: -2.472003883813601 and parameters: {'n_layers_yy': 1, 'hidden_size_yy_l0': 6, 'context_size_yy': 4, 'num_mix_components_yy': 3, 'context_extractor_yy': 'lstm', 'activation_func_yy': 'Tanh', 'L2_weight_yy': 4.379113673271201e-08, 'L_entropy_weight_yy': 0.00020168797171442218, 'L_sep_weight_yy': 1.7849104380227304e-06, 'L_scale_weight_yy': 1.9864556435431173e-10, 'learning_rate_yy': 0.001979777547883981}. Best is trial 2 with value: -2.476197165819489.
[I 2026-03-17 17:24:29,139] Trial 16 finished with value: -3.2663029296875 and parameters: {'n_layers_yy': 1, 'hidden_size_yy_l0': 6, 'context_size_yy': 4, 'num_mix_components_yy': 5, 'context_extractor_yy': 'gru', 'activation_func_yy': 'ReLU', 'L2_weight_yy': 3.425466890303381e-09, 'L_entropy_weight_yy': 1.2314265097520662e-07, 'L_sep_weight_yy': 0.0009118790337251897, 'L_scale_weight_yy': 1.2328739037147491e-09, 'learning_rate_yy': 0.005553311127503681}. Best is trial 16 with value: -3.2663029296875.
[I 2026-03-17 17:24:29,721] Trial 27 pruned. 
[I 2026-03-17 17:24:30,314] Trial 17 pruned. 
[I 2026-03-17 17:24:31,072] Trial 41 finished with value: -1.9577237281169053 and parameters: {'n_layers_yy': 2, 'hidden_size_yy_l0': 4, 'hidden_size_yy_l1': 6, 'context_size_yy': 4, 'num_mix_components_yy': 2, 'context_extractor_yy': 'gru', 'activation_func_yy': 'ReLU', 'L2_weight_yy': 6.612645782638814e-06, 'L_entropy_weight_yy': 3.515596622362595e-10, 'L_sep_weight_yy': 2.544763219756494e-06, 'L_scale_weight_yy': 1.4041024846422391e-08, 'learning_rate_yy': 0.0041453476126515594}. Best is trial 24 with value: -1.9860150014876785.
[I 2026-03-17 17:24:31,873] Trial 38 pruned. 
[I 2026-03-17 17:24:34,137] Trial 18 pruned. 
[I 2026-03-17 17:24:35,795] Trial 42 finished with value: -2.639563288626636 and parameters: {'n_layers_yy': 1, 'hidden_size_yy_l0': 5, 'context_size_yy': 4, 'num_mix_components_yy': 4, 'context_extractor_yy': 'lstm', 'activation_func_yy': 'ReLU', 'L2_weight_yy': 1.0336470118170112e-06, 'L_entropy_weight_yy': 6.925701464430359e-09, 'L_sep_weight_yy': 6.286761389357945e-06, 'L_scale_weight_yy': 0.00029654261737126404, 'learning_rate_yy': 0.006802399774404955}. Best is trial 42 with value: -2.639563288626636.
[I 2026-03-17 17:24:37,668] Trial 42 pruned. 
[I 2026-03-17 17:24:37,669] Trial 23 finished with value: -2.5116525144873645 and parameters: {'n_layers_yy': 2, 'hidden_size_yy_l0': 6, 'hidden_size_yy_l1': 6, 'context_size_yy': 1, 'num_mix_components_yy': 1, 'context_extractor_yy': 'lstm', 'activation_func_yy': 'Tanh', 'L2_weight_yy': 4.036144826449858e-09, 'L_entropy_weight_yy': 3.884484902067237e-10, 'L_sep_weight_yy': 1.0133888941004275e-06, 'L_scale_weight_yy': 1.4450267376436227e-10, 'learning_rate_yy': 0.007673230963373439}. Best is trial 21 with value: -2.5142283361436735.
[I 2026-03-17 17:24:38,414] Trial 43 pruned. 
[I 2026-03-17 17:24:38,457] Trial 39 pruned. 
[I 2026-03-17 17:24:41,352] Trial 40 pruned. 
[I 2026-03-17 17:24:42,132] Trial 42 finished with value: -1.7001261836509791 and parameters: {'n_layers_yy': 2, 'hidden_size_yy_l0': 2, 'hidden_size_yy_l1': 5, 'context_size_yy': 4, 'num_mix_components_yy': 2, 'context_extractor_yy': 'lstm', 'activation_func_yy': 'Tanh', 'L2_weight_yy': 4.981883838043586e-08, 'L_entropy_weight_yy': 3.3621824079029126e-05, 'L_sep_weight_yy': 5.646421043930358e-07, 'L_scale_weight_yy': 3.895271542572695e-06, 'learning_rate_yy': 0.006965871607358578}. Best is trial 20 with value: -1.7038948064814108.
[I 2026-03-17 17:24:42,160] Trial 44 pruned. 
[I 2026-03-17 17:24:45,934] Trial 45 pruned. 
[I 2026-03-17 17:24:53,914] Trial 29 pruned. 
[I 2026-03-17 17:24:53,937] Trial 19 finished with value: -2.2797817197540544 and parameters: {'n_layers_yy': 2, 'hidden_size_yy_l0': 3, 'hidden_size_yy_l1': 5, 'context_size_yy': 3, 'num_mix_components_yy': 1, 'context_extractor_yy': 'lstm', 'activation_func_yy': 'ReLU', 'L2_weight_yy': 6.478634670445895e-08, 'L_entropy_weight_yy': 1.0711006516076612e-05, 'L_sep_weight_yy': 6.373536913978642e-10, 'L_scale_weight_yy': 1.4728640446691162e-05, 'learning_rate_yy': 0.007133703243781086}. Best is trial 0 with value: -2.289111866011322.
[I 2026-03-17 17:24:55,731] Trial 46 pruned. 
[I 2026-03-17 17:24:56,733] Trial 20 pruned. 
[I 2026-03-17 17:24:56,832] Trial 43 pruned. 
[I 2026-03-17 17:24:56,924] Trial 42 finished with value: -1.854598100203569 and parameters: {'n_layers_yy': 1, 'hidden_size_yy_l0': 4, 'context_size_yy': 3, 'num_mix_components_yy': 4, 'context_extractor_yy': 'lstm', 'activation_func_yy': 'Tanh', 'L2_weight_yy': 4.2681466035415555e-07, 'L_entropy_weight_yy': 3.1711815199374107e-06, 'L_sep_weight_yy': 6.723871124404748e-06, 'L_scale_weight_yy': 2.2262108323567047e-10, 'learning_rate_yy': 0.009998357907035517}. Best is trial 10 with value: -1.8554935362796692.
[I 2026-03-17 17:24:57,369] Trial 43 pruned. 
[I 2026-03-17 17:24:59,165] Trial 43 pruned. 
[I 2026-03-17 17:24:59,243] Trial 47 pruned. 
[I 2026-03-17 17:25:03,179] Trial 19 pruned. 
[I 2026-03-17 17:25:03,933] Trial 44 pruned. 
[I 2026-03-17 17:25:10,406] Trial 45 pruned. 
[I 2026-03-17 17:25:10,769] Trial 41 finished with value: -2.093922187128181 and parameters: {'n_layers_yy': 2, 'hidden_size_yy_l0': 4, 'hidden_size_yy_l1': 4, 'context_size_yy': 4, 'num_mix_components_yy': 5, 'context_extractor_yy': 'gru', 'activation_func_yy': 'ReLU', 'L2_weight_yy': 4.7658845011481224e-09, 'L_entropy_weight_yy': 5.2352781815420604e-08, 'L_sep_weight_yy': 1.2867891704042007e-07, 'L_scale_weight_yy': 7.162319870803142e-06, 'learning_rate_yy': 0.004889880737598432}. Best is trial 41 with value: -2.093922187128181.
[I 2026-03-17 17:25:11,846] Trial 43 finished with value: -2.6396916719313195 and parameters: {'n_layers_yy': 1, 'hidden_size_yy_l0': 5, 'context_size_yy': 4, 'num_mix_components_yy': 4, 'context_extractor_yy': 'lstm', 'activation_func_yy': 'ReLU', 'L2_weight_yy': 1.1547675337227715e-06, 'L_entropy_weight_yy': 6.625830684385965e-09, 'L_sep_weight_yy': 5.825377479002909e-06, 'L_scale_weight_yy': 0.00029308778228853076, 'learning_rate_yy': 0.00891190628790522}. Best is trial 43 with value: -2.6396916719313195.
[I 2026-03-17 17:25:12,180] Trial 44 pruned. 
[I 2026-03-17 17:25:13,130] Trial 20 pruned. 
[I 2026-03-17 17:25:13,565] Trial 23 finished with value: -2.491416293537239 and parameters: {'n_layers_yy': 2, 'hidden_size_yy_l0': 3, 'hidden_size_yy_l1': 4, 'context_size_yy': 4, 'num_mix_components_yy': 5, 'context_extractor_yy': 'gru', 'activation_func_yy': 'GELU', 'L2_weight_yy': 0.0001846897714649061, 'L_entropy_weight_yy': 3.182475560468294e-09, 'L_sep_weight_yy': 5.6528005835316246e-06, 'L_scale_weight_yy': 3.1852523820993e-06, 'learning_rate_yy': 0.009628778228728947}. Best is trial 18 with value: -2.4920728800472483.
[I 2026-03-17 17:25:14,667] Trial 44 pruned. 
[I 2026-03-17 17:25:17,107] Trial 46 pruned. 
[I 2026-03-17 17:25:17,571] Trial 45 pruned. 
[I 2026-03-17 17:25:17,752] Trial 24 finished with value: -2.4974010298546476 and parameters: {'n_layers_yy': 2, 'hidden_size_yy_l0': 6, 'hidden_size_yy_l1': 6, 'context_size_yy': 2, 'num_mix_components_yy': 1, 'context_extractor_yy': 'lstm', 'activation_func_yy': 'Tanh', 'L2_weight_yy': 3.7963375619607916e-09, 'L_entropy_weight_yy': 5.177043763548972e-06, 'L_sep_weight_yy': 1.76979374334649e-06, 'L_scale_weight_yy': 1.0724179027381041e-10, 'learning_rate_yy': 0.007837107235593097}. Best is trial 21 with value: -2.5142283361436735.
[I 2026-03-17 17:25:18,243] Trial 21 pruned. 
[I 2026-03-17 17:25:19,379] Trial 37 finished with value: -2.8086363908933873 and parameters: {'n_layers_yy': 1, 'hidden_size_yy_l0': 6, 'context_size_yy': 1, 'num_mix_components_yy': 3, 'context_extractor_yy': 'gru', 'activation_func_yy': 'ReLU', 'L2_weight_yy': 2.473180944330777e-05, 'L_entropy_weight_yy': 1.2192958354340836e-09, 'L_sep_weight_yy': 7.811922817691113e-10, 'L_scale_weight_yy': 2.8929011758246197e-08, 'learning_rate_yy': 0.008293513991945467}. Best is trial 35 with value: -2.838645471907643.
[I 2026-03-17 17:25:20,504] Trial 41 finished with value: -1.7822951438210228 and parameters: {'n_layers_yy': 2, 'hidden_size_yy_l0': 6, 'hidden_size_yy_l1': 5, 'context_size_yy': 3, 'num_mix_components_yy': 4, 'context_extractor_yy': 'lstm', 'activation_func_yy': 'GELU', 'L2_weight_yy': 5.744920400301951e-05, 'L_entropy_weight_yy': 0.00032337322961554566, 'L_sep_weight_yy': 1.4759105053127385e-07, 'L_scale_weight_yy': 1.5315202377403794e-05, 'learning_rate_yy': 0.009981933934749889}. Best is trial 8 with value: -1.786668244949495.
[I 2026-03-17 17:25:22,639] Trial 28 pruned. 
[I 2026-03-17 17:25:22,739] Trial 46 pruned. 
[I 2026-03-17 17:25:24,659] Trial 48 finished with value: -2.4458735172242907 and parameters: {'n_layers_yy': 1, 'hidden_size_yy_l0': 5, 'context_size_yy': 4, 'num_mix_components_yy': 2, 'context_extractor_yy': 'lstm', 'activation_func_yy': 'GELU', 'L2_weight_yy': 2.712400517010437e-07, 'L_entropy_weight_yy': 0.00014300818732819318, 'L_sep_weight_yy': 4.1488313429532895e-10, 'L_scale_weight_yy': 8.602702695719988e-10, 'learning_rate_yy': 0.003681514440175622}. Best is trial 2 with value: -2.476197165819489.
[I 2026-03-17 17:25:25,317] Trial 22 pruned. 
[I 2026-03-17 17:25:25,389] Trial 30 finished with value: -2.335648019864759 and parameters: {'n_layers_yy': 1, 'hidden_size_yy_l0': 6, 'context_size_yy': 1, 'num_mix_components_yy': 1, 'context_extractor_yy': 'lstm', 'activation_func_yy': 'Tanh', 'L2_weight_yy': 1.960008709822192e-08, 'L_entropy_weight_yy': 1.582777665356591e-07, 'L_sep_weight_yy': 1.0481907900310521e-05, 'L_scale_weight_yy': 1.1123137258837416e-07, 'learning_rate_yy': 0.004177994718148831}. Best is trial 22 with value: -2.3759054172258436.
[I 2026-03-17 17:25:25,514] Trial 38 pruned. 
[I 2026-03-17 17:25:27,373] Trial 25 pruned. 
[I 2026-03-17 17:25:27,463] Trial 42 pruned. 
[I 2026-03-17 17:25:27,934] Trial 31 pruned. 
[I 2026-03-17 17:25:28,192] Trial 47 pruned. 
[I 2026-03-17 17:25:33,393] Trial 48 pruned. 
