[I 2026-03-17 17:30:24,720] Trial 29 finished with value: -2.728802095088405 and parameters: {'n_layers_yy': 1, 'hidden_size_yy_l0': 5, 'context_size_yy': 2, 'num_mix_components_yy': 1, 'context_extractor_yy': 'lstm', 'activation_func_yy': 'Tanh', 'L2_weight_yy': 7.358699184414174e-08, 'L_entropy_weight_yy': 6.461357284157469e-07, 'L_sep_weight_yy': 4.837950016165477e-10, 'L_scale_weight_yy': 1.8702299281914313e-08, 'learning_rate_yy': 0.0022717572676475245}. Best is trial 9 with value: -2.7636669680656607.
[I 2026-03-17 17:30:30,658] Trial 23 pruned. 
[I 2026-03-17 17:30:31,809] Trial 29 finished with value: -2.263652331796971 and parameters: {'n_layers_yy': 1, 'hidden_size_yy_l0': 6, 'context_size_yy': 4, 'num_mix_components_yy': 2, 'context_extractor_yy': 'lstm', 'activation_func_yy': 'GELU', 'L2_weight_yy': 0.00010164014391441415, 'L_entropy_weight_yy': 1.8251312253764502e-08, 'L_sep_weight_yy': 1.0569893286389907e-06, 'L_scale_weight_yy': 0.0003401311898188266, 'learning_rate_yy': 0.005625353908540176}. Best is trial 27 with value: -2.290475318189642.
[I 2026-03-17 17:30:33,153] Trial 49 pruned. 
Optimize task 19: group_id: POm, neuron_id: 53
Starting optimization for task 19...

--- Data Summary ---
Total events for target process 27060
Data Time: 900 seconds
Using device: cuda
Number of events in target process: 27060
Only one process provided, preparing dataloaders for the reduced model.
Reduced model ln_yy : 3096.96033 nats/sec, 103.00312 nats/event
Reduced model Log loss : -2.49116
Number of events in target process: 27060
Only one process provided, preparing dataloaders for the reduced model.
Reduced model ln_yy : 3120.10092 nats/sec, 103.77276 nats/event
Reduced model Log loss : -2.51025
Number of events in target process: 27060
Only one process provided, preparing dataloaders for the reduced model.
Number of events in target process: 27060
Only one process provided, preparing dataloaders for the reduced model.
Reduced model ln_yy : 3110.42893 nats/sec, 103.45107 nats/event
Reduced model Log loss : -2.50946
Number of events in target process: 27060
Only one process provided, preparing dataloaders for the reduced model.
Number of events in target process: 27060
Only one process provided, preparing dataloaders for the reduced model.
Reduced model ln_yy : 3126.36610 nats/sec, 103.98113 nats/event
Reduced model Log loss : -2.51147
Number of events in target process: 27060
Only one process provided, preparing dataloaders for the reduced model.
Reduced model ln_yy : 3133.02008 nats/sec, 104.20244 nats/event
Reduced model Log loss : -2.51202
Number of events in target process: 27060
Only one process provided, preparing dataloaders for the reduced model.
Number of events in target process: 27060
Only one process provided, preparing dataloaders for the reduced model.
Number of events in target process: 27060
Only one process provided, preparing dataloaders for the reduced model.
Number of events in target process: 27060
Only one process provided, preparing dataloaders for the reduced model.
Number of events in target process: 27060
Only one process provided, preparing dataloaders for the reduced model.
Number of events in target process: 27060
Only one process provided, preparing dataloaders for the reduced model.
Number of events in target process: 27060
Only one process provided, preparing dataloaders for the reduced model.
Number of events in target process: 27060
Only one process provided, preparing dataloaders for the reduced model.
Number of events in target process: 27060
Only one process provided, preparing dataloaders for the reduced model.
Number of events in target process: 27060
Only one process provided, preparing dataloaders for the reduced model.
Number of events in target process: 27060
Only one process provided, preparing dataloaders for the reduced model.
Number of events in target process: 27060
Only one process provided, preparing dataloaders for the reduced model.
Number of events in target process: 27060
Only one process provided, preparing dataloaders for the reduced model.
Number of events in target process: 27060
Only one process provided, preparing dataloaders for the reduced model.
Number of events in target process: 27060
Only one process provided, preparing dataloaders for the reduced model.
Reduced model ln_yy : 3125.07444 nats/sec, 103.93817 nats/event
Reduced model Log loss : -2.51423
Number of events in target process: 27060
Only one process provided, preparing dataloaders for the reduced model.
Reduced model ln_yy : 3102.25020 nats/sec, 103.17905 nats/event
Reduced model Log loss : -2.51057
Number of events in target process: 27060
Only one process provided, preparing dataloaders for the reduced model.
Reduced model ln_yy : 3121.00180 nats/sec, 103.80272 nats/event
Reduced model Log loss : -2.51165
Number of events in target process: 27060
Only one process provided, preparing dataloaders for the reduced model.
Reduced model ln_yy : 3115.40048 nats/sec, 103.61642 nats/event
Reduced model Log loss : -2.49740
Number of events in target process: 27060
Only one process provided, preparing dataloaders for the reduced model.
Number of events in target process: 27060
Only one process provided, preparing dataloaders for the reduced model.
Number of events in target process: 27060
Only one process provided, preparing dataloaders for the reduced model.
Reduced model ln_yy : 3106.61429 nats/sec, 103.32420 nats/event
Reduced model Log loss : -2.49779
Number of events in target process: 27060
Only one process provided, preparing dataloaders for the reduced model.
Number of events in target process: 27060
Only one process provided, preparing dataloaders for the reduced model.
Reduced model ln_yy : 3110.84757 nats/sec, 103.46500 nats/event
Reduced model Log loss : -2.51138
Number of events in target process: 27060
Only one process provided, preparing dataloaders for the reduced model.
Number of events in target process: 27060
Only one process provided, preparing dataloaders for the reduced model.
Number of events in target process: 27060
Only one process provided, preparing dataloaders for the reduced model.
Number of events in target process: 27060
Only one process provided, preparing dataloaders for the reduced model.
Number of events in target process: 27060
Only one process provided, preparing dataloaders for the reduced model.
Number of events in target process: 27060
Only one process provided, preparing dataloaders for the reduced model.
Number of events in target process: 27060
Only one process provided, preparing dataloaders for the reduced model.
Number of events in target process: 27060
Only one process provided, preparing dataloaders for the reduced model.
Number of events in target process: 27060
Only one process provided, preparing dataloaders for the reduced model.
Number of events in target process: 27060
Only one process provided, preparing dataloaders for the reduced model.
Number of events in target process: 27060
Only one process provided, preparing dataloaders for the reduced model.
Number of events in target process: 27060
Only one process provided, preparing dataloaders for the reduced model.
Number of events in target process: 27060
Only one process provided, preparing dataloaders for the reduced model.
Number of events in target process: 27060
Only one process provided, preparing dataloaders for the reduced model.
Number of events in target process: 27060
Only one process provided, preparing dataloaders for the reduced model.
Number of events in target process: 27060
Only one process provided, preparing dataloaders for the reduced model.
Number of events in target process: 27060
Only one process provided, preparing dataloaders for the reduced model.
Number of events in target process: 27060
Only one process provided, preparing dataloaders for the reduced model.
Number of events in target process: 27060
Only one process provided, preparing dataloaders for the reduced model.
Number of events in target process: 27060
Only one process provided, preparing dataloaders for the reduced model.
Best trial:
  Value: -2.5142283361436735
  Params: {'n_layers_yy': 2, 'hidden_size_yy_l0': 6, 'hidden_size_yy_l1': 5, 'context_size_yy': 1, 'num_mix_components_yy': 2, 'context_extractor_yy': 'lstm', 'activation_func_yy': 'Tanh', 'L2_weight_yy': 3.1801419939158256e-09, 'L_entropy_weight_yy': 1.336308743924069e-06, 'L_sep_weight_yy': 1.5031910162007554e-06, 'L_scale_weight_yy': 1.2067971876387202e-09, 'learning_rate_yy': 0.005108387768153293}
Full best configuration saved to results/opt/opt_reduced_19_best_config.txt
Optimization finished.
[I 2026-03-17 17:30:36,376] Trial 30 pruned. 
[I 2026-03-17 17:30:39,719] Trial 41 finished with value: -2.4919600944157834 and parameters: {'n_layers_yy': 2, 'hidden_size_yy_l0': 4, 'hidden_size_yy_l1': 5, 'context_size_yy': 4, 'num_mix_components_yy': 5, 'context_extractor_yy': 'lstm', 'activation_func_yy': 'GELU', 'L2_weight_yy': 7.442644436758623e-08, 'L_entropy_weight_yy': 3.320677250486729e-08, 'L_sep_weight_yy': 4.769553604849884e-05, 'L_scale_weight_yy': 6.068649364027269e-07, 'learning_rate_yy': 0.007644865365067818}. Best is trial 24 with value: -2.4926837718550585.
[I 2026-03-17 17:30:43,772] Trial 37 finished with value: -2.8051642753589836 and parameters: {'n_layers_yy': 2, 'hidden_size_yy_l0': 5, 'hidden_size_yy_l1': 3, 'context_size_yy': 3, 'num_mix_components_yy': 3, 'context_extractor_yy': 'lstm', 'activation_func_yy': 'ReLU', 'L2_weight_yy': 1.5727455074162842e-09, 'L_entropy_weight_yy': 1.6961483740819168e-07, 'L_sep_weight_yy': 1.8984278429205055e-07, 'L_scale_weight_yy': 0.0007627645521042556, 'learning_rate_yy': 0.009806313337422698}. Best is trial 16 with value: -2.8104182726972877.
[I 2026-03-17 17:30:49,444] Trial 30 pruned. 
[I 2026-03-17 17:30:55,564] Trial 31 pruned. 
[I 2026-03-17 17:30:57,577] Trial 37 pruned. 
[I 2026-03-17 17:30:59,914] Trial 38 pruned. 
[I 2026-03-17 17:31:01,501] Trial 32 pruned. 
[I 2026-03-17 17:31:02,145] Trial 39 pruned. 
[I 2026-03-17 17:31:02,968] Trial 24 pruned. 
[I 2026-03-17 17:31:07,664] Trial 33 pruned. 
[I 2026-03-17 17:31:08,202] Trial 40 pruned. 
[I 2026-03-17 17:31:09,312] Trial 40 pruned. 
[I 2026-03-17 17:31:09,697] Trial 31 pruned. 
[I 2026-03-17 17:31:09,966] Trial 34 pruned. 
[I 2026-03-17 17:31:14,528] Trial 41 pruned. 
[I 2026-03-17 17:31:19,140] Trial 42 finished with value: -2.4917246982265078 and parameters: {'n_layers_yy': 2, 'hidden_size_yy_l0': 4, 'hidden_size_yy_l1': 5, 'context_size_yy': 4, 'num_mix_components_yy': 5, 'context_extractor_yy': 'lstm', 'activation_func_yy': 'GELU', 'L2_weight_yy': 7.074302427381325e-08, 'L_entropy_weight_yy': 1.4641784018735807e-08, 'L_sep_weight_yy': 3.158507521685729e-06, 'L_scale_weight_yy': 5.70289182963063e-07, 'learning_rate_yy': 0.007126562849421296}. Best is trial 24 with value: -2.4926837718550585.
[I 2026-03-17 17:31:27,462] Trial 35 pruned. 
[I 2026-03-17 17:31:29,798] Trial 36 pruned. 
[I 2026-03-17 17:31:31,459] Trial 38 finished with value: -2.803424249048846 and parameters: {'n_layers_yy': 2, 'hidden_size_yy_l0': 6, 'hidden_size_yy_l1': 3, 'context_size_yy': 4, 'num_mix_components_yy': 3, 'context_extractor_yy': 'lstm', 'activation_func_yy': 'ReLU', 'L2_weight_yy': 2.1502408356766816e-09, 'L_entropy_weight_yy': 1.7170291769862028e-07, 'L_sep_weight_yy': 7.850262311972807e-10, 'L_scale_weight_yy': 0.0005447741351539314, 'learning_rate_yy': 0.009790659604878954}. Best is trial 16 with value: -2.8104182726972877.
[I 2026-03-17 17:31:32,047] Trial 37 pruned. 
[I 2026-03-17 17:31:32,532] Trial 42 pruned. 
[I 2026-03-17 17:31:34,873] Trial 39 pruned. 
[I 2026-03-17 17:31:35,697] Trial 25 pruned. 
[I 2026-03-17 17:31:38,581] Trial 43 pruned. 
[I 2026-03-17 17:31:39,669] Trial 26 pruned. 
[I 2026-03-17 17:31:43,341] Trial 32 pruned. 
[I 2026-03-17 17:31:44,246] Trial 40 pruned. 
[I 2026-03-17 17:31:44,724] Trial 44 pruned. 
[I 2026-03-17 17:31:46,008] Trial 41 finished with value: -3.1190525428471276 and parameters: {'n_layers_yy': 1, 'hidden_size_yy_l0': 6, 'context_size_yy': 4, 'num_mix_components_yy': 5, 'context_extractor_yy': 'gru', 'activation_func_yy': 'ReLU', 'L2_weight_yy': 4.1235297189849373e-07, 'L_entropy_weight_yy': 0.000246272116448859, 'L_sep_weight_yy': 1.8895268835430943e-06, 'L_scale_weight_yy': 5.9243773788225286e-06, 'learning_rate_yy': 0.005956417748918399}. Best is trial 33 with value: -3.153503458157452.
[I 2026-03-17 17:31:47,337] Trial 33 pruned. 
[I 2026-03-17 17:31:47,620] Trial 41 pruned. 
[I 2026-03-17 17:31:49,538] Trial 38 pruned. 
[I 2026-03-17 17:31:55,632] Trial 39 pruned. 
[I 2026-03-17 17:31:58,406] Trial 34 pruned. 
[I 2026-03-17 17:31:58,416] Trial 43 finished with value: -2.4905195491409144 and parameters: {'n_layers_yy': 2, 'hidden_size_yy_l0': 4, 'hidden_size_yy_l1': 5, 'context_size_yy': 4, 'num_mix_components_yy': 5, 'context_extractor_yy': 'lstm', 'activation_func_yy': 'GELU', 'L2_weight_yy': 1.5751232696612358e-08, 'L_entropy_weight_yy': 4.975796578344666e-08, 'L_sep_weight_yy': 2.8970570784251155e-05, 'L_scale_weight_yy': 6.72584497562215e-07, 'learning_rate_yy': 0.005889062897521567}. Best is trial 24 with value: -2.4926837718550585.
[I 2026-03-17 17:32:02,397] Trial 45 pruned. 
[I 2026-03-17 17:32:09,737] Trial 35 pruned. 
[I 2026-03-17 17:32:12,961] Trial 40 pruned. 
[I 2026-03-17 17:32:19,692] Trial 44 pruned. 
[I 2026-03-17 17:32:20,878] Trial 36 pruned. 
[I 2026-03-17 17:32:25,037] Trial 37 pruned. 
[I 2026-03-17 17:32:32,428] Trial 42 finished with value: -3.1500149754587117 and parameters: {'n_layers_yy': 1, 'hidden_size_yy_l0': 6, 'context_size_yy': 4, 'num_mix_components_yy': 4, 'context_extractor_yy': 'gru', 'activation_func_yy': 'ReLU', 'L2_weight_yy': 2.0761739065786985e-07, 'L_entropy_weight_yy': 0.0001031234979410624, 'L_sep_weight_yy': 5.163528266809635e-06, 'L_scale_weight_yy': 1.2865376665433614e-06, 'learning_rate_yy': 0.004507943913876418}. Best is trial 33 with value: -3.153503458157452.
[I 2026-03-17 17:32:37,653] Trial 27 finished with value: -3.252384114583333 and parameters: {'n_layers_yy': 1, 'hidden_size_yy_l0': 6, 'context_size_yy': 3, 'num_mix_components_yy': 3, 'context_extractor_yy': 'gru', 'activation_func_yy': 'ReLU', 'L2_weight_yy': 7.860336316072315e-10, 'L_entropy_weight_yy': 2.2722454905014168e-07, 'L_sep_weight_yy': 3.8013379268597734e-10, 'L_scale_weight_yy': 3.7719874832320107e-08, 'learning_rate_yy': 0.005488410867417144}. Best is trial 16 with value: -3.2663029296875.
[I 2026-03-17 17:32:52,783] Trial 41 finished with value: -2.2880324775761167 and parameters: {'n_layers_yy': 1, 'hidden_size_yy_l0': 6, 'context_size_yy': 4, 'num_mix_components_yy': 2, 'context_extractor_yy': 'lstm', 'activation_func_yy': 'GELU', 'L2_weight_yy': 1.9688762384165673e-06, 'L_entropy_weight_yy': 9.801303364699312e-09, 'L_sep_weight_yy': 0.000129076289334305, 'L_scale_weight_yy': 0.00011811667357023559, 'learning_rate_yy': 0.009859181430812495}. Best is trial 27 with value: -2.290475318189642.
[I 2026-03-17 17:32:57,036] Trial 46 pruned. 
[I 2026-03-17 17:32:57,487] Trial 38 pruned. 
[I 2026-03-17 17:32:59,248] Trial 47 pruned. 
[I 2026-03-17 17:33:01,602] Trial 48 pruned. 
[I 2026-03-17 17:33:01,697] Trial 42 finished with value: -2.7939229599096405 and parameters: {'n_layers_yy': 2, 'hidden_size_yy_l0': 5, 'hidden_size_yy_l1': 2, 'context_size_yy': 3, 'num_mix_components_yy': 3, 'context_extractor_yy': 'lstm', 'activation_func_yy': 'ReLU', 'L2_weight_yy': 3.4190305016077e-08, 'L_entropy_weight_yy': 2.716617183577411e-08, 'L_sep_weight_yy': 4.772673895327807e-07, 'L_scale_weight_yy': 2.780970651766661e-10, 'learning_rate_yy': 0.005418781615158839}. Best is trial 16 with value: -2.8104182726972877.
[I 2026-03-17 17:33:03,032] Trial 45 finished with value: -2.490387779540513 and parameters: {'n_layers_yy': 2, 'hidden_size_yy_l0': 4, 'hidden_size_yy_l1': 5, 'context_size_yy': 4, 'num_mix_components_yy': 5, 'context_extractor_yy': 'lstm', 'activation_func_yy': 'GELU', 'L2_weight_yy': 4.3208916454613336e-08, 'L_entropy_weight_yy': 3.942352626688286e-08, 'L_sep_weight_yy': 6.642329218527448e-07, 'L_scale_weight_yy': 1.9594938336170373e-07, 'learning_rate_yy': 0.005240107502905529}. Best is trial 24 with value: -2.4926837718550585.
[I 2026-03-17 17:33:05,009] Trial 43 pruned. 
