[I 2026-03-17 17:22:36,230] Trial 49 pruned. 
Optimize task 24: group_id: POm, neuron_id: 58
Starting optimization for task 24...

--- Data Summary ---
Total events for target process 8618
Data Time: 900 seconds
Using device: cuda
Number of events in target process: 8618
Only one process provided, preparing dataloaders for the reduced model.
Reduced model ln_yy : 261.83317 nats/sec, 27.34391 nats/event
Reduced model Log loss : -1.90101
Number of events in target process: 8618
Only one process provided, preparing dataloaders for the reduced model.
Reduced model ln_yy : 262.26283 nats/sec, 27.38878 nats/event
Reduced model Log loss : -1.90440
Number of events in target process: 8618
Only one process provided, preparing dataloaders for the reduced model.
Reduced model ln_yy : 260.75197 nats/sec, 27.23100 nats/event
Reduced model Log loss : -1.89913
Number of events in target process: 8618
Only one process provided, preparing dataloaders for the reduced model.
Number of events in target process: 8618
Only one process provided, preparing dataloaders for the reduced model.
Reduced model ln_yy : 263.57365 nats/sec, 27.52568 nats/event
Reduced model Log loss : -1.90766
Number of events in target process: 8618
Only one process provided, preparing dataloaders for the reduced model.
Number of events in target process: 8618
Only one process provided, preparing dataloaders for the reduced model.
Number of events in target process: 8618
Only one process provided, preparing dataloaders for the reduced model.
Number of events in target process: 8618
Only one process provided, preparing dataloaders for the reduced model.
Number of events in target process: 8618
Only one process provided, preparing dataloaders for the reduced model.
Number of events in target process: 8618
Only one process provided, preparing dataloaders for the reduced model.
Number of events in target process: 8618
Only one process provided, preparing dataloaders for the reduced model.
Number of events in target process: 8618
Only one process provided, preparing dataloaders for the reduced model.
Number of events in target process: 8618
Only one process provided, preparing dataloaders for the reduced model.
Reduced model ln_yy : 262.72503 nats/sec, 27.43705 nats/event
Reduced model Log loss : -1.89995
Number of events in target process: 8618
Only one process provided, preparing dataloaders for the reduced model.
Number of events in target process: 8618
Only one process provided, preparing dataloaders for the reduced model.
Reduced model ln_yy : 261.38030 nats/sec, 27.29662 nats/event
Reduced model Log loss : -1.89665
Number of events in target process: 8618
Only one process provided, preparing dataloaders for the reduced model.
Number of events in target process: 8618
Only one process provided, preparing dataloaders for the reduced model.
Reduced model ln_yy : 261.52358 nats/sec, 27.31158 nats/event
Reduced model Log loss : -1.89881
Number of events in target process: 8618
Only one process provided, preparing dataloaders for the reduced model.
Reduced model ln_yy : 262.46517 nats/sec, 27.40992 nats/event
Reduced model Log loss : -1.91138
Number of events in target process: 8618
Only one process provided, preparing dataloaders for the reduced model.
Number of events in target process: 8618
Only one process provided, preparing dataloaders for the reduced model.
Reduced model ln_yy : 260.56066 nats/sec, 27.21102 nats/event
Reduced model Log loss : -1.90170
Number of events in target process: 8618
Only one process provided, preparing dataloaders for the reduced model.
Reduced model ln_yy : 260.39271 nats/sec, 27.19348 nats/event
Reduced model Log loss : -1.90769
Number of events in target process: 8618
Only one process provided, preparing dataloaders for the reduced model.
Reduced model ln_yy : 261.83259 nats/sec, 27.34385 nats/event
Reduced model Log loss : -1.90586
Number of events in target process: 8618
Only one process provided, preparing dataloaders for the reduced model.
Number of events in target process: 8618
Only one process provided, preparing dataloaders for the reduced model.
Number of events in target process: 8618
Only one process provided, preparing dataloaders for the reduced model.
Reduced model ln_yy : 261.12901 nats/sec, 27.27038 nats/event
Reduced model Log loss : -1.91098
Number of events in target process: 8618
Only one process provided, preparing dataloaders for the reduced model.
Number of events in target process: 8618
Only one process provided, preparing dataloaders for the reduced model.
Number of events in target process: 8618
Only one process provided, preparing dataloaders for the reduced model.
Number of events in target process: 8618
Only one process provided, preparing dataloaders for the reduced model.
Number of events in target process: 8618
Only one process provided, preparing dataloaders for the reduced model.
Number of events in target process: 8618
Only one process provided, preparing dataloaders for the reduced model.
Number of events in target process: 8618
Only one process provided, preparing dataloaders for the reduced model.
Number of events in target process: 8618
Only one process provided, preparing dataloaders for the reduced model.
Number of events in target process: 8618
Only one process provided, preparing dataloaders for the reduced model.
Number of events in target process: 8618
Only one process provided, preparing dataloaders for the reduced model.
Number of events in target process: 8618
Only one process provided, preparing dataloaders for the reduced model.
Number of events in target process: 8618
Only one process provided, preparing dataloaders for the reduced model.
Number of events in target process: 8618
Only one process provided, preparing dataloaders for the reduced model.
Reduced model ln_yy : 261.12213 nats/sec, 27.26966 nats/event
Reduced model Log loss : -1.89370
Number of events in target process: 8618
Only one process provided, preparing dataloaders for the reduced model.
Number of events in target process: 8618
Only one process provided, preparing dataloaders for the reduced model.
Number of events in target process: 8618
Only one process provided, preparing dataloaders for the reduced model.
Number of events in target process: 8618
Only one process provided, preparing dataloaders for the reduced model.
Number of events in target process: 8618
Only one process provided, preparing dataloaders for the reduced model.
Reduced model ln_yy : 261.03586 nats/sec, 27.26065 nats/event
Reduced model Log loss : -1.90319
Number of events in target process: 8618
Only one process provided, preparing dataloaders for the reduced model.
Number of events in target process: 8618
Only one process provided, preparing dataloaders for the reduced model.
Number of events in target process: 8618
Only one process provided, preparing dataloaders for the reduced model.
Number of events in target process: 8618
Only one process provided, preparing dataloaders for the reduced model.
Number of events in target process: 8618
Only one process provided, preparing dataloaders for the reduced model.
Number of events in target process: 8618
Only one process provided, preparing dataloaders for the reduced model.
Best trial:
  Value: -1.9113758963969216
  Params: {'n_layers_yy': 2, 'hidden_size_yy_l0': 5, 'hidden_size_yy_l1': 3, 'context_size_yy': 3, 'num_mix_components_yy': 4, 'context_extractor_yy': 'lstm', 'activation_func_yy': 'ReLU', 'L2_weight_yy': 7.027463088828838e-07, 'L_entropy_weight_yy': 4.519379351812088e-09, 'L_sep_weight_yy': 4.315274576883832e-07, 'L_scale_weight_yy': 4.1966414757735953e-10, 'learning_rate_yy': 0.009287414472287413}
Full best configuration saved to results/opt/opt_reduced_24_best_config.txt
Optimization finished.
[I 2026-03-17 17:22:36,777] Trial 49 pruned. 
Optimize task 26: group_id: POm, neuron_id: 60
Starting optimization for task 26...

--- Data Summary ---
Total events for target process 12539
Data Time: 900 seconds
Using device: cuda
Number of events in target process: 12539
Only one process provided, preparing dataloaders for the reduced model.
Reduced model ln_yy : 570.84858 nats/sec, 40.97326 nats/event
Reduced model Log loss : -1.96515
Number of events in target process: 12539
Only one process provided, preparing dataloaders for the reduced model.
Reduced model ln_yy : 574.38677 nats/sec, 41.22722 nats/event
Reduced model Log loss : -1.97414
Number of events in target process: 12539
Only one process provided, preparing dataloaders for the reduced model.
Reduced model ln_yy : 569.69195 nats/sec, 40.89024 nats/event
Reduced model Log loss : -1.96306
Number of events in target process: 12539
Only one process provided, preparing dataloaders for the reduced model.
Number of events in target process: 12539
Only one process provided, preparing dataloaders for the reduced model.
Reduced model ln_yy : 558.90490 nats/sec, 40.11599 nats/event
Reduced model Log loss : -1.95277
Number of events in target process: 12539
Only one process provided, preparing dataloaders for the reduced model.
Number of events in target process: 12539
Only one process provided, preparing dataloaders for the reduced model.
Reduced model ln_yy : 568.25214 nats/sec, 40.78690 nats/event
Reduced model Log loss : -1.96961
Number of events in target process: 12539
Only one process provided, preparing dataloaders for the reduced model.
Reduced model ln_yy : 572.59841 nats/sec, 41.09886 nats/event
Reduced model Log loss : -1.97050
Number of events in target process: 12539
Only one process provided, preparing dataloaders for the reduced model.
Number of events in target process: 12539
Only one process provided, preparing dataloaders for the reduced model.
Number of events in target process: 12539
Only one process provided, preparing dataloaders for the reduced model.
Reduced model ln_yy : 569.22219 nats/sec, 40.85653 nats/event
Reduced model Log loss : -1.96948
Number of events in target process: 12539
Only one process provided, preparing dataloaders for the reduced model.
Number of events in target process: 12539
Only one process provided, preparing dataloaders for the reduced model.
Number of events in target process: 12539
Only one process provided, preparing dataloaders for the reduced model.
Reduced model ln_yy : 569.24350 nats/sec, 40.85805 nats/event
Reduced model Log loss : -1.97137
Number of events in target process: 12539
Only one process provided, preparing dataloaders for the reduced model.
Number of events in target process: 12539
Only one process provided, preparing dataloaders for the reduced model.
Number of events in target process: 12539
Only one process provided, preparing dataloaders for the reduced model.
Number of events in target process: 12539
Only one process provided, preparing dataloaders for the reduced model.
Number of events in target process: 12539
Only one process provided, preparing dataloaders for the reduced model.
Number of events in target process: 12539
Only one process provided, preparing dataloaders for the reduced model.
Number of events in target process: 12539
Only one process provided, preparing dataloaders for the reduced model.
Number of events in target process: 12539
Only one process provided, preparing dataloaders for the reduced model.
Reduced model ln_yy : 570.21419 nats/sec, 40.92773 nats/event
Reduced model Log loss : -1.96954
Number of events in target process: 12539
Only one process provided, preparing dataloaders for the reduced model.
Reduced model ln_yy : 572.12257 nats/sec, 41.06470 nats/event
Reduced model Log loss : -1.96949
Number of events in target process: 12539
Only one process provided, preparing dataloaders for the reduced model.
Number of events in target process: 12539
Only one process provided, preparing dataloaders for the reduced model.
Number of events in target process: 12539
Only one process provided, preparing dataloaders for the reduced model.
Number of events in target process: 12539
Only one process provided, preparing dataloaders for the reduced model.
Number of events in target process: 12539
Only one process provided, preparing dataloaders for the reduced model.
Number of events in target process: 12539
Only one process provided, preparing dataloaders for the reduced model.
Reduced model ln_yy : 566.19814 nats/sec, 40.63947 nats/event
Reduced model Log loss : -1.95946
Number of events in target process: 12539
Only one process provided, preparing dataloaders for the reduced model.
Number of events in target process: 12539
Only one process provided, preparing dataloaders for the reduced model.
Number of events in target process: 12539
Only one process provided, preparing dataloaders for the reduced model.
Reduced model ln_yy : 570.06330 nats/sec, 40.91690 nats/event
Reduced model Log loss : -1.97428
Number of events in target process: 12539
Only one process provided, preparing dataloaders for the reduced model.
Reduced model ln_yy : 570.24394 nats/sec, 40.92986 nats/event
Reduced model Log loss : -1.97413
Number of events in target process: 12539
Only one process provided, preparing dataloaders for the reduced model.
Number of events in target process: 12539
Only one process provided, preparing dataloaders for the reduced model.
Number of events in target process: 12539
Only one process provided, preparing dataloaders for the reduced model.
Number of events in target process: 12539
Only one process provided, preparing dataloaders for the reduced model.
Number of events in target process: 12539
Only one process provided, preparing dataloaders for the reduced model.
Number of events in target process: 12539
Only one process provided, preparing dataloaders for the reduced model.
Number of events in target process: 12539
Only one process provided, preparing dataloaders for the reduced model.
Number of events in target process: 12539
Only one process provided, preparing dataloaders for the reduced model.
Number of events in target process: 12539
Only one process provided, preparing dataloaders for the reduced model.
Number of events in target process: 12539
Only one process provided, preparing dataloaders for the reduced model.
Number of events in target process: 12539
Only one process provided, preparing dataloaders for the reduced model.
Number of events in target process: 12539
Only one process provided, preparing dataloaders for the reduced model.
Number of events in target process: 12539
Only one process provided, preparing dataloaders for the reduced model.
Number of events in target process: 12539
Only one process provided, preparing dataloaders for the reduced model.
Number of events in target process: 12539
Only one process provided, preparing dataloaders for the reduced model.
Number of events in target process: 12539
Only one process provided, preparing dataloaders for the reduced model.
Reduced model ln_yy : 566.68612 nats/sec, 40.67450 nats/event
Reduced model Log loss : -1.96355
Number of events in target process: 12539
Only one process provided, preparing dataloaders for the reduced model.
Best trial:
  Value: -1.9742766261003297
  Params: {'n_layers_yy': 1, 'hidden_size_yy_l0': 4, 'context_size_yy': 4, 'num_mix_components_yy': 3, 'context_extractor_yy': 'lstm', 'activation_func_yy': 'ReLU', 'L2_weight_yy': 1.5398656300628746e-09, 'L_entropy_weight_yy': 0.00021958378379981303, 'L_sep_weight_yy': 1.4339389310222512e-08, 'L_scale_weight_yy': 3.711855987586791e-07, 'learning_rate_yy': 0.009981075486558294}
Full best configuration saved to results/opt/opt_reduced_26_best_config.txt
Optimization finished.
[I 2026-03-17 17:22:39,282] Trial 36 pruned. 
[I 2026-03-17 17:22:41,777] Trial 17 pruned. 
[I 2026-03-17 17:22:43,994] Trial 33 pruned. 
[I 2026-03-17 17:22:44,712] Trial 37 pruned. 
[I 2026-03-17 17:22:45,002] Trial 23 pruned. 
[I 2026-03-17 17:22:45,804] Trial 34 pruned. 
[I 2026-03-17 17:22:46,214] Trial 15 pruned. 
[I 2026-03-17 17:22:48,959] Trial 34 pruned. 
[I 2026-03-17 17:22:49,057] Trial 35 pruned. 
[I 2026-03-17 17:22:50,900] Trial 31 pruned. 
[I 2026-03-17 17:22:51,316] Trial 13 finished with value: -2.8006909806918365 and parameters: {'n_layers_yy': 1, 'hidden_size_yy_l0': 6, 'context_size_yy': 2, 'num_mix_components_yy': 4, 'context_extractor_yy': 'lstm', 'activation_func_yy': 'ReLU', 'L2_weight_yy': 0.0002996777045730565, 'L_entropy_weight_yy': 3.983734023018903e-08, 'L_sep_weight_yy': 7.85039096013276e-09, 'L_scale_weight_yy': 1.615132668658096e-08, 'learning_rate_yy': 0.005876843380446671}. Best is trial 12 with value: -2.806977931381423.
[I 2026-03-17 17:22:51,889] Trial 33 finished with value: -1.854476622054747 and parameters: {'n_layers_yy': 1, 'hidden_size_yy_l0': 6, 'context_size_yy': 4, 'num_mix_components_yy': 4, 'context_extractor_yy': 'lstm', 'activation_func_yy': 'Tanh', 'L2_weight_yy': 0.00017406192822127872, 'L_entropy_weight_yy': 1.3724886107417193e-05, 'L_sep_weight_yy': 2.0022742785969108e-05, 'L_scale_weight_yy': 3.46228868961992e-08, 'learning_rate_yy': 0.005222090437915284}. Best is trial 10 with value: -1.8554935362796692.
[I 2026-03-17 17:22:53,681] Trial 34 pruned. 
[I 2026-03-17 17:22:53,726] Trial 27 pruned. 
[I 2026-03-17 17:22:53,948] Trial 32 pruned. 
[I 2026-03-17 17:22:54,112] Trial 35 pruned. 
[I 2026-03-17 17:22:55,883] Trial 35 pruned. 
[I 2026-03-17 17:22:57,043] Trial 36 pruned. 
[I 2026-03-17 17:22:59,104] Trial 38 pruned. 
[I 2026-03-17 17:22:59,129] Trial 36 pruned. 
[I 2026-03-17 17:23:00,573] Trial 36 finished with value: -1.9846813551219897 and parameters: {'n_layers_yy': 2, 'hidden_size_yy_l0': 3, 'hidden_size_yy_l1': 6, 'context_size_yy': 4, 'num_mix_components_yy': 2, 'context_extractor_yy': 'gru', 'activation_func_yy': 'ReLU', 'L2_weight_yy': 5.7002070617853894e-06, 'L_entropy_weight_yy': 1.9912925196015704e-09, 'L_sep_weight_yy': 1.9898500901600642e-05, 'L_scale_weight_yy': 1.974046873694285e-07, 'learning_rate_yy': 0.0067220359113558965}. Best is trial 24 with value: -1.9860150014876785.
[I 2026-03-17 17:23:00,942] Trial 37 pruned. 
[I 2026-03-17 17:23:01,147] Trial 14 pruned. 
[I 2026-03-17 17:23:01,191] Trial 37 pruned. 
[I 2026-03-17 17:23:02,352] Trial 24 pruned. 
[I 2026-03-17 17:23:03,330] Trial 38 pruned. 
[I 2026-03-17 17:23:04,018] Trial 39 pruned. 
[I 2026-03-17 17:23:04,771] Trial 15 pruned. 
[I 2026-03-17 17:23:05,217] Trial 18 pruned. 
[I 2026-03-17 17:23:07,491] Trial 38 finished with value: -2.4719692773840753 and parameters: {'n_layers_yy': 1, 'hidden_size_yy_l0': 6, 'context_size_yy': 4, 'num_mix_components_yy': 3, 'context_extractor_yy': 'lstm', 'activation_func_yy': 'Tanh', 'L2_weight_yy': 4.048227160136266e-08, 'L_entropy_weight_yy': 3.740960977752331e-05, 'L_sep_weight_yy': 7.576689046933585e-09, 'L_scale_weight_yy': 9.86282475039562e-09, 'learning_rate_yy': 0.001963242465856459}. Best is trial 2 with value: -2.476197165819489.
[I 2026-03-17 17:23:08,471] Trial 39 pruned. 
[I 2026-03-17 17:23:08,599] Trial 38 pruned. 
[I 2026-03-17 17:23:08,999] Trial 40 pruned. 
[I 2026-03-17 17:23:10,550] Trial 33 pruned. 
[I 2026-03-17 17:23:11,026] Trial 39 pruned. 
[I 2026-03-17 17:23:14,709] Trial 40 pruned. 
[I 2026-03-17 17:23:16,711] Trial 22 finished with value: -2.5105669976179605 and parameters: {'n_layers_yy': 2, 'hidden_size_yy_l0': 6, 'hidden_size_yy_l1': 5, 'context_size_yy': 1, 'num_mix_components_yy': 3, 'context_extractor_yy': 'lstm', 'activation_func_yy': 'Tanh', 'L2_weight_yy': 4.8040758096378045e-08, 'L_entropy_weight_yy': 1.169975002248796e-06, 'L_sep_weight_yy': 2.7999073473273348e-06, 'L_scale_weight_yy': 1.6075155365085284e-09, 'learning_rate_yy': 0.005405427692322229}. Best is trial 21 with value: -2.5142283361436735.
[I 2026-03-17 17:23:18,252] Trial 19 pruned. 
[I 2026-03-17 17:23:20,184] Trial 25 pruned. 
[I 2026-03-17 17:23:26,014] Trial 34 pruned. 
[I 2026-03-17 17:23:26,015] Trial 37 finished with value: -1.9574824418383332 and parameters: {'n_layers_yy': 2, 'hidden_size_yy_l0': 3, 'hidden_size_yy_l1': 5, 'context_size_yy': 4, 'num_mix_components_yy': 4, 'context_extractor_yy': 'gru', 'activation_func_yy': 'ReLU', 'L2_weight_yy': 1.6800048673425295e-06, 'L_entropy_weight_yy': 5.5534118002815374e-09, 'L_sep_weight_yy': 1.5185599578829858e-05, 'L_scale_weight_yy': 3.324702505011524e-07, 'learning_rate_yy': 0.007903170441473345}. Best is trial 24 with value: -1.9860150014876785.
[I 2026-03-17 17:23:26,589] Trial 36 finished with value: -1.8541650593652548 and parameters: {'n_layers_yy': 1, 'hidden_size_yy_l0': 6, 'context_size_yy': 4, 'num_mix_components_yy': 4, 'context_extractor_yy': 'lstm', 'activation_func_yy': 'Tanh', 'L2_weight_yy': 2.893819658309059e-05, 'L_entropy_weight_yy': 3.6209938246657794e-05, 'L_sep_weight_yy': 0.00010680527819381594, 'L_scale_weight_yy': 2.718316076031109e-09, 'learning_rate_yy': 0.008434930019495421}. Best is trial 10 with value: -1.8554935362796692.
[I 2026-03-17 17:23:28,444] Trial 38 pruned. 
[I 2026-03-17 17:23:31,084] Trial 20 pruned. 
[I 2026-03-17 17:23:40,532] Trial 10 finished with value: -2.2820171454253364 and parameters: {'n_layers_yy': 1, 'hidden_size_yy_l0': 5, 'context_size_yy': 3, 'num_mix_components_yy': 3, 'context_extractor_yy': 'lstm', 'activation_func_yy': 'GELU', 'L2_weight_yy': 1.5525685788875047e-06, 'L_entropy_weight_yy': 1.0948902420446732e-09, 'L_sep_weight_yy': 0.0008061226965285647, 'L_scale_weight_yy': 2.20459491032413e-06, 'learning_rate_yy': 0.009603040901135321}. Best is trial 0 with value: -2.289111866011322.
[I 2026-03-17 17:23:42,770] Trial 37 pruned. 
[I 2026-03-17 17:23:43,280] Trial 11 pruned. 
[I 2026-03-17 17:23:44,003] Trial 21 pruned. 
[I 2026-03-17 17:23:46,539] Trial 18 pruned. 
[I 2026-03-17 17:23:49,728] Trial 19 pruned. 
[I 2026-03-17 17:23:50,159] Trial 33 pruned. 
[I 2026-03-17 17:23:50,670] Trial 12 pruned. 
