[I 2026-03-17 17:33:08,057] Trial 49 pruned. 
Optimize task 2: group_id: BC, neuron_id: 10
Starting optimization for task 2...

--- Data Summary ---
Total events for target process 20315
Data Time: 900 seconds
Using device: cuda
Number of events in target process: 20315
Only one process provided, preparing dataloaders for the reduced model.
Reduced model ln_yy : 1962.54779 nats/sec, 86.94526 nats/event
Reduced model Log loss : -2.97155
Number of events in target process: 20315
Only one process provided, preparing dataloaders for the reduced model.
Reduced model ln_yy : 1912.24856 nats/sec, 84.71689 nats/event
Reduced model Log loss : -2.90542
Number of events in target process: 20315
Only one process provided, preparing dataloaders for the reduced model.
Number of events in target process: 20315
Only one process provided, preparing dataloaders for the reduced model.
Number of events in target process: 20315
Only one process provided, preparing dataloaders for the reduced model.
Number of events in target process: 20315
Only one process provided, preparing dataloaders for the reduced model.
Number of events in target process: 20315
Only one process provided, preparing dataloaders for the reduced model.
Number of events in target process: 20315
Only one process provided, preparing dataloaders for the reduced model.
Reduced model ln_yy : 1867.34058 nats/sec, 82.72737 nats/event
Reduced model Log loss : -2.79958
Number of events in target process: 20315
Only one process provided, preparing dataloaders for the reduced model.
Number of events in target process: 20315
Only one process provided, preparing dataloaders for the reduced model.
Reduced model ln_yy : 1958.91756 nats/sec, 86.78444 nats/event
Reduced model Log loss : -2.97544
Number of events in target process: 20315
Only one process provided, preparing dataloaders for the reduced model.
Number of events in target process: 20315
Only one process provided, preparing dataloaders for the reduced model.
Reduced model ln_yy : 1913.86860 nats/sec, 84.78867 nats/event
Reduced model Log loss : -2.90730
Number of events in target process: 20315
Only one process provided, preparing dataloaders for the reduced model.
Number of events in target process: 20315
Only one process provided, preparing dataloaders for the reduced model.
Reduced model ln_yy : 1961.77610 nats/sec, 86.91107 nats/event
Reduced model Log loss : -2.96570
Number of events in target process: 20315
Only one process provided, preparing dataloaders for the reduced model.
Reduced model ln_yy : 1966.55512 nats/sec, 87.12280 nats/event
Reduced model Log loss : -2.97493
Number of events in target process: 20315
Only one process provided, preparing dataloaders for the reduced model.
Reduced model ln_yy : 1960.21682 nats/sec, 86.84200 nats/event
Reduced model Log loss : -2.96760
Number of events in target process: 20315
Only one process provided, preparing dataloaders for the reduced model.
Number of events in target process: 20315
Only one process provided, preparing dataloaders for the reduced model.
Number of events in target process: 20315
Only one process provided, preparing dataloaders for the reduced model.
Number of events in target process: 20315
Only one process provided, preparing dataloaders for the reduced model.
Number of events in target process: 20315
Only one process provided, preparing dataloaders for the reduced model.
Number of events in target process: 20315
Only one process provided, preparing dataloaders for the reduced model.
Number of events in target process: 20315
Only one process provided, preparing dataloaders for the reduced model.
Reduced model ln_yy : 1958.95983 nats/sec, 86.78631 nats/event
Reduced model Log loss : -2.97412
Number of events in target process: 20315
Only one process provided, preparing dataloaders for the reduced model.
Number of events in target process: 20315
Only one process provided, preparing dataloaders for the reduced model.
Reduced model ln_yy : 1964.69884 nats/sec, 87.04056 nats/event
Reduced model Log loss : -2.96305
Number of events in target process: 20315
Only one process provided, preparing dataloaders for the reduced model.
Number of events in target process: 20315
Only one process provided, preparing dataloaders for the reduced model.
Reduced model ln_yy : 1950.01895 nats/sec, 86.39021 nats/event
Reduced model Log loss : -2.96927
Number of events in target process: 20315
Only one process provided, preparing dataloaders for the reduced model.
Number of events in target process: 20315
Only one process provided, preparing dataloaders for the reduced model.
Number of events in target process: 20315
Only one process provided, preparing dataloaders for the reduced model.
Number of events in target process: 20315
Only one process provided, preparing dataloaders for the reduced model.
Number of events in target process: 20315
Only one process provided, preparing dataloaders for the reduced model.
Reduced model ln_yy : 1925.70757 nats/sec, 85.31316 nats/event
Reduced model Log loss : -2.91038
Number of events in target process: 20315
Only one process provided, preparing dataloaders for the reduced model.
Number of events in target process: 20315
Only one process provided, preparing dataloaders for the reduced model.
Number of events in target process: 20315
Only one process provided, preparing dataloaders for the reduced model.
Number of events in target process: 20315
Only one process provided, preparing dataloaders for the reduced model.
Number of events in target process: 20315
Only one process provided, preparing dataloaders for the reduced model.
Number of events in target process: 20315
Only one process provided, preparing dataloaders for the reduced model.
Number of events in target process: 20315
Only one process provided, preparing dataloaders for the reduced model.
Number of events in target process: 20315
Only one process provided, preparing dataloaders for the reduced model.
Number of events in target process: 20315
Only one process provided, preparing dataloaders for the reduced model.
Number of events in target process: 20315
Only one process provided, preparing dataloaders for the reduced model.
Number of events in target process: 20315
Only one process provided, preparing dataloaders for the reduced model.
Number of events in target process: 20315
Only one process provided, preparing dataloaders for the reduced model.
Number of events in target process: 20315
Only one process provided, preparing dataloaders for the reduced model.
Number of events in target process: 20315
Only one process provided, preparing dataloaders for the reduced model.
Number of events in target process: 20315
Only one process provided, preparing dataloaders for the reduced model.
Number of events in target process: 20315
Only one process provided, preparing dataloaders for the reduced model.
Number of events in target process: 20315
Only one process provided, preparing dataloaders for the reduced model.
Number of events in target process: 20315
Only one process provided, preparing dataloaders for the reduced model.
Best trial:
  Value: -2.9754424140841684
  Params: {'n_layers_yy': 2, 'hidden_size_yy_l0': 6, 'hidden_size_yy_l1': 3, 'context_size_yy': 4, 'num_mix_components_yy': 5, 'context_extractor_yy': 'gru', 'activation_func_yy': 'Tanh', 'L2_weight_yy': 8.789780667177671e-06, 'L_entropy_weight_yy': 6.227979304441126e-08, 'L_sep_weight_yy': 1.1228874168969943e-07, 'L_scale_weight_yy': 1.159101240238555e-07, 'learning_rate_yy': 0.0056707017823368865}
Full best configuration saved to results/opt/opt_reduced_2_best_config.txt
Optimization finished.
[I 2026-03-17 17:33:10,485] Trial 46 pruned. 
[I 2026-03-17 17:33:14,481] Trial 44 pruned. 
[I 2026-03-17 17:33:17,735] Trial 47 pruned. 
[I 2026-03-17 17:33:18,495] Trial 43 pruned. 
[I 2026-03-17 17:33:20,410] Trial 48 pruned. 
[I 2026-03-17 17:33:22,863] Trial 49 pruned. 
Optimize task 8: group_id: BC, neuron_id: 6
Starting optimization for task 8...

--- Data Summary ---
Total events for target process 24874
Data Time: 900 seconds
Using device: cuda
Number of events in target process: 24874
Only one process provided, preparing dataloaders for the reduced model.
Reduced model ln_yy : 2624.86030 nats/sec, 94.97364 nats/event
Reduced model Log loss : -2.47161
Number of events in target process: 24874
Only one process provided, preparing dataloaders for the reduced model.
Reduced model ln_yy : 2606.19410 nats/sec, 94.29825 nats/event
Reduced model Log loss : -2.47444
Number of events in target process: 24874
Only one process provided, preparing dataloaders for the reduced model.
Reduced model ln_yy : 2634.59204 nats/sec, 95.32576 nats/event
Reduced model Log loss : -2.48914
Number of events in target process: 24874
Only one process provided, preparing dataloaders for the reduced model.
Reduced model ln_yy : 2623.75917 nats/sec, 94.93380 nats/event
Reduced model Log loss : -2.47175
Number of events in target process: 24874
Only one process provided, preparing dataloaders for the reduced model.
Number of events in target process: 24874
Only one process provided, preparing dataloaders for the reduced model.
Reduced model ln_yy : 2576.04031 nats/sec, 93.20722 nats/event
Reduced model Log loss : -2.43851
Number of events in target process: 24874
Only one process provided, preparing dataloaders for the reduced model.
Number of events in target process: 24874
Only one process provided, preparing dataloaders for the reduced model.
Number of events in target process: 24874
Only one process provided, preparing dataloaders for the reduced model.
Number of events in target process: 24874
Only one process provided, preparing dataloaders for the reduced model.
Number of events in target process: 24874
Only one process provided, preparing dataloaders for the reduced model.
Number of events in target process: 24874
Only one process provided, preparing dataloaders for the reduced model.
Number of events in target process: 24874
Only one process provided, preparing dataloaders for the reduced model.
Number of events in target process: 24874
Only one process provided, preparing dataloaders for the reduced model.
Number of events in target process: 24874
Only one process provided, preparing dataloaders for the reduced model.
Number of events in target process: 24874
Only one process provided, preparing dataloaders for the reduced model.
Reduced model ln_yy : 2573.65116 nats/sec, 93.12077 nats/event
Reduced model Log loss : -2.43372
Number of events in target process: 24874
Only one process provided, preparing dataloaders for the reduced model.
Number of events in target process: 24874
Only one process provided, preparing dataloaders for the reduced model.
Reduced model ln_yy : 2607.83630 nats/sec, 94.35767 nats/event
Reduced model Log loss : -2.49071
Number of events in target process: 24874
Only one process provided, preparing dataloaders for the reduced model.
Reduced model ln_yy : 2631.98405 nats/sec, 95.23139 nats/event
Reduced model Log loss : -2.49207
Number of events in target process: 24874
Only one process provided, preparing dataloaders for the reduced model.
Reduced model ln_yy : 2623.93731 nats/sec, 94.94024 nats/event
Reduced model Log loss : -2.48870
Number of events in target process: 24874
Only one process provided, preparing dataloaders for the reduced model.
Reduced model ln_yy : 2633.17471 nats/sec, 95.27447 nats/event
Reduced model Log loss : -2.49070
Number of events in target process: 24874
Only one process provided, preparing dataloaders for the reduced model.
Number of events in target process: 24874
Only one process provided, preparing dataloaders for the reduced model.
Number of events in target process: 24874
Only one process provided, preparing dataloaders for the reduced model.
Reduced model ln_yy : 2635.43756 nats/sec, 95.35635 nats/event
Reduced model Log loss : -2.49142
Number of events in target process: 24874
Only one process provided, preparing dataloaders for the reduced model.
Reduced model ln_yy : 2624.31018 nats/sec, 94.95373 nats/event
Reduced model Log loss : -2.49268
Number of events in target process: 24874
Only one process provided, preparing dataloaders for the reduced model.
Number of events in target process: 24874
Only one process provided, preparing dataloaders for the reduced model.
Reduced model ln_yy : 2598.73998 nats/sec, 94.02854 nats/event
Reduced model Log loss : -2.43151
Number of events in target process: 24874
Only one process provided, preparing dataloaders for the reduced model.
Number of events in target process: 24874
Only one process provided, preparing dataloaders for the reduced model.
Number of events in target process: 24874
Only one process provided, preparing dataloaders for the reduced model.
Number of events in target process: 24874
Only one process provided, preparing dataloaders for the reduced model.
Number of events in target process: 24874
Only one process provided, preparing dataloaders for the reduced model.
Number of events in target process: 24874
Only one process provided, preparing dataloaders for the reduced model.
Number of events in target process: 24874
Only one process provided, preparing dataloaders for the reduced model.
Reduced model ln_yy : 2617.68560 nats/sec, 94.71404 nats/event
Reduced model Log loss : -2.49179
Number of events in target process: 24874
Only one process provided, preparing dataloaders for the reduced model.
Number of events in target process: 24874
Only one process provided, preparing dataloaders for the reduced model.
Number of events in target process: 24874
Only one process provided, preparing dataloaders for the reduced model.
Number of events in target process: 24874
Only one process provided, preparing dataloaders for the reduced model.
Number of events in target process: 24874
Only one process provided, preparing dataloaders for the reduced model.
Reduced model ln_yy : 2637.68323 nats/sec, 95.43760 nats/event
Reduced model Log loss : -2.49086
Number of events in target process: 24874
Only one process provided, preparing dataloaders for the reduced model.
Number of events in target process: 24874
Only one process provided, preparing dataloaders for the reduced model.
Number of events in target process: 24874
Only one process provided, preparing dataloaders for the reduced model.
Reduced model ln_yy : 2635.28956 nats/sec, 95.35099 nats/event
Reduced model Log loss : -2.49196
Number of events in target process: 24874
Only one process provided, preparing dataloaders for the reduced model.
Reduced model ln_yy : 2633.08277 nats/sec, 95.27115 nats/event
Reduced model Log loss : -2.49172
Number of events in target process: 24874
Only one process provided, preparing dataloaders for the reduced model.
Reduced model ln_yy : 2638.97728 nats/sec, 95.48442 nats/event
Reduced model Log loss : -2.49052
Number of events in target process: 24874
Only one process provided, preparing dataloaders for the reduced model.
Number of events in target process: 24874
Only one process provided, preparing dataloaders for the reduced model.
Reduced model ln_yy : 2635.72874 nats/sec, 95.36688 nats/event
Reduced model Log loss : -2.49039
Number of events in target process: 24874
Only one process provided, preparing dataloaders for the reduced model.
Number of events in target process: 24874
Only one process provided, preparing dataloaders for the reduced model.
Number of events in target process: 24874
Only one process provided, preparing dataloaders for the reduced model.
Number of events in target process: 24874
Only one process provided, preparing dataloaders for the reduced model.
Best trial:
  Value: -2.4926837718550585
  Params: {'n_layers_yy': 2, 'hidden_size_yy_l0': 3, 'hidden_size_yy_l1': 4, 'context_size_yy': 4, 'num_mix_components_yy': 5, 'context_extractor_yy': 'gru', 'activation_func_yy': 'GELU', 'L2_weight_yy': 6.885093703959191e-07, 'L_entropy_weight_yy': 2.7753811190250163e-09, 'L_sep_weight_yy': 9.822537148968771e-06, 'L_scale_weight_yy': 2.414049697895814e-06, 'learning_rate_yy': 0.009959145722324569}
Full best configuration saved to results/opt/opt_reduced_8_best_config.txt
Optimization finished.
[I 2026-03-17 17:33:23,448] Trial 45 pruned. 
[I 2026-03-17 17:33:32,206] Trial 46 pruned. 
[I 2026-03-17 17:33:35,435] Trial 47 pruned. 
[I 2026-03-17 17:33:36,077] Trial 42 finished with value: -2.288168293872399 and parameters: {'n_layers_yy': 1, 'hidden_size_yy_l0': 6, 'context_size_yy': 4, 'num_mix_components_yy': 2, 'context_extractor_yy': 'lstm', 'activation_func_yy': 'GELU', 'L2_weight_yy': 4.2878785124059806e-05, 'L_entropy_weight_yy': 1.997402389046957e-08, 'L_sep_weight_yy': 0.00012705053016769636, 'L_scale_weight_yy': 0.0008798024694234729, 'learning_rate_yy': 0.00809162510064829}. Best is trial 27 with value: -2.290475318189642.
[I 2026-03-17 17:33:42,048] Trial 43 pruned. 
[I 2026-03-17 17:33:44,195] Trial 48 pruned. 
