[I 2026-03-17 17:27:59,058] Trial 49 pruned. 
Optimize task 7: group_id: BC, neuron_id: 5
Starting optimization for task 7...

--- Data Summary ---
Total events for target process 32635
Data Time: 900 seconds
Using device: cuda
Number of events in target process: 32635
Only one process provided, preparing dataloaders for the reduced model.
Reduced model ln_yy : 4631.88805 nats/sec, 127.73707 nats/event
Reduced model Log loss : -2.62843
Number of events in target process: 32635
Only one process provided, preparing dataloaders for the reduced model.
Reduced model ln_yy : 4673.22991 nats/sec, 128.87718 nats/event
Reduced model Log loss : -2.63215
Number of events in target process: 32635
Only one process provided, preparing dataloaders for the reduced model.
Number of events in target process: 32635
Only one process provided, preparing dataloaders for the reduced model.
Number of events in target process: 32635
Only one process provided, preparing dataloaders for the reduced model.
Number of events in target process: 32635
Only one process provided, preparing dataloaders for the reduced model.
Number of events in target process: 32635
Only one process provided, preparing dataloaders for the reduced model.
Reduced model ln_yy : 4576.07261 nats/sec, 126.19780 nats/event
Reduced model Log loss : -2.59662
Number of events in target process: 32635
Only one process provided, preparing dataloaders for the reduced model.
Reduced model ln_yy : 4653.43213 nats/sec, 128.33121 nats/event
Reduced model Log loss : -2.63268
Number of events in target process: 32635
Only one process provided, preparing dataloaders for the reduced model.
Number of events in target process: 32635
Only one process provided, preparing dataloaders for the reduced model.
Number of events in target process: 32635
Only one process provided, preparing dataloaders for the reduced model.
Number of events in target process: 32635
Only one process provided, preparing dataloaders for the reduced model.
Number of events in target process: 32635
Only one process provided, preparing dataloaders for the reduced model.
Number of events in target process: 32635
Only one process provided, preparing dataloaders for the reduced model.
Number of events in target process: 32635
Only one process provided, preparing dataloaders for the reduced model.
Number of events in target process: 32635
Only one process provided, preparing dataloaders for the reduced model.
Number of events in target process: 32635
Only one process provided, preparing dataloaders for the reduced model.
Number of events in target process: 32635
Only one process provided, preparing dataloaders for the reduced model.
Number of events in target process: 32635
Only one process provided, preparing dataloaders for the reduced model.
Number of events in target process: 32635
Only one process provided, preparing dataloaders for the reduced model.
Number of events in target process: 32635
Only one process provided, preparing dataloaders for the reduced model.
Number of events in target process: 32635
Only one process provided, preparing dataloaders for the reduced model.
Number of events in target process: 32635
Only one process provided, preparing dataloaders for the reduced model.
Number of events in target process: 32635
Only one process provided, preparing dataloaders for the reduced model.
Number of events in target process: 32635
Only one process provided, preparing dataloaders for the reduced model.
Number of events in target process: 32635
Only one process provided, preparing dataloaders for the reduced model.
Number of events in target process: 32635
Only one process provided, preparing dataloaders for the reduced model.
Number of events in target process: 32635
Only one process provided, preparing dataloaders for the reduced model.
Number of events in target process: 32635
Only one process provided, preparing dataloaders for the reduced model.
Reduced model ln_yy : 4622.88798 nats/sec, 127.48887 nats/event
Reduced model Log loss : -2.60238
Number of events in target process: 32635
Only one process provided, preparing dataloaders for the reduced model.
Number of events in target process: 32635
Only one process provided, preparing dataloaders for the reduced model.
Number of events in target process: 32635
Only one process provided, preparing dataloaders for the reduced model.
Reduced model ln_yy : 4623.41136 nats/sec, 127.50330 nats/event
Reduced model Log loss : -2.60239
Number of events in target process: 32635
Only one process provided, preparing dataloaders for the reduced model.
Reduced model ln_yy : 4641.49563 nats/sec, 128.00202 nats/event
Reduced model Log loss : -2.60207
Number of events in target process: 32635
Only one process provided, preparing dataloaders for the reduced model.
Number of events in target process: 32635
Only one process provided, preparing dataloaders for the reduced model.
Reduced model ln_yy : 4667.99893 nats/sec, 128.73293 nats/event
Reduced model Log loss : -2.63839
Number of events in target process: 32635
Only one process provided, preparing dataloaders for the reduced model.
Number of events in target process: 32635
Only one process provided, preparing dataloaders for the reduced model.
Number of events in target process: 32635
Only one process provided, preparing dataloaders for the reduced model.
Number of events in target process: 32635
Only one process provided, preparing dataloaders for the reduced model.
Number of events in target process: 32635
Only one process provided, preparing dataloaders for the reduced model.
Number of events in target process: 32635
Only one process provided, preparing dataloaders for the reduced model.
Number of events in target process: 32635
Only one process provided, preparing dataloaders for the reduced model.
Reduced model ln_yy : 4686.21513 nats/sec, 129.23529 nats/event
Reduced model Log loss : -2.63943
Number of events in target process: 32635
Only one process provided, preparing dataloaders for the reduced model.
Reduced model ln_yy : 4685.19287 nats/sec, 129.20710 nats/event
Reduced model Log loss : -2.63956
Number of events in target process: 32635
Only one process provided, preparing dataloaders for the reduced model.
Reduced model ln_yy : 4667.79274 nats/sec, 128.72724 nats/event
Reduced model Log loss : -2.63969
Number of events in target process: 32635
Only one process provided, preparing dataloaders for the reduced model.
Reduced model ln_yy : 4668.17115 nats/sec, 128.73768 nats/event
Reduced model Log loss : -2.63970
Number of events in target process: 32635
Only one process provided, preparing dataloaders for the reduced model.
Reduced model ln_yy : 4667.97681 nats/sec, 128.73232 nats/event
Reduced model Log loss : -2.63966
Number of events in target process: 32635
Only one process provided, preparing dataloaders for the reduced model.
Reduced model ln_yy : 4670.05411 nats/sec, 128.78960 nats/event
Reduced model Log loss : -2.63965
Number of events in target process: 32635
Only one process provided, preparing dataloaders for the reduced model.
Reduced model ln_yy : 4686.24357 nats/sec, 129.23607 nats/event
Reduced model Log loss : -2.63965
Number of events in target process: 32635
Only one process provided, preparing dataloaders for the reduced model.
Reduced model ln_yy : 4668.61473 nats/sec, 128.74991 nats/event
Reduced model Log loss : -2.63969
Number of events in target process: 32635
Only one process provided, preparing dataloaders for the reduced model.
Best trial:
  Value: -2.639695928418474
  Params: {'n_layers_yy': 1, 'hidden_size_yy_l0': 5, 'context_size_yy': 4, 'num_mix_components_yy': 4, 'context_extractor_yy': 'lstm', 'activation_func_yy': 'ReLU', 'L2_weight_yy': 1.5014170293221804e-06, 'L_entropy_weight_yy': 8.514993050209167e-09, 'L_sep_weight_yy': 5.0259863224704565e-06, 'L_scale_weight_yy': 0.00027980329962064, 'learning_rate_yy': 0.00893735717486313}
Full best configuration saved to results/opt/opt_reduced_7_best_config.txt
Optimization finished.
[I 2026-03-17 17:27:59,256] Trial 25 pruned. 
[I 2026-03-17 17:28:03,542] Trial 26 pruned. 
[I 2026-03-17 17:28:04,895] Trial 27 pruned. 
[I 2026-03-17 17:28:07,690] Trial 45 finished with value: -2.835105347578859 and parameters: {'n_layers_yy': 1, 'hidden_size_yy_l0': 6, 'context_size_yy': 4, 'num_mix_components_yy': 4, 'context_extractor_yy': 'gru', 'activation_func_yy': 'ReLU', 'L2_weight_yy': 1.7121215304014285e-09, 'L_entropy_weight_yy': 5.670802116805767e-10, 'L_sep_weight_yy': 3.990623687545839e-08, 'L_scale_weight_yy': 9.224511606385962e-10, 'learning_rate_yy': 0.006453188147888027}. Best is trial 35 with value: -2.838645471907643.
[I 2026-03-17 17:28:07,752] Trial 29 finished with value: -2.511381164033047 and parameters: {'n_layers_yy': 2, 'hidden_size_yy_l0': 5, 'hidden_size_yy_l1': 4, 'context_size_yy': 1, 'num_mix_components_yy': 2, 'context_extractor_yy': 'lstm', 'activation_func_yy': 'GELU', 'L2_weight_yy': 5.705726585963365e-10, 'L_entropy_weight_yy': 3.4979133240620545e-08, 'L_sep_weight_yy': 0.0003540955494201563, 'L_scale_weight_yy': 2.156332712276082e-10, 'learning_rate_yy': 0.008707440507836903}. Best is trial 21 with value: -2.5142283361436735.
[I 2026-03-17 17:28:07,862] Trial 27 pruned. 
[I 2026-03-17 17:28:08,221] Trial 28 pruned. 
[I 2026-03-17 17:28:11,955] Trial 46 pruned. 
[I 2026-03-17 17:28:12,038] Trial 47 finished with value: -2.0921868047600203 and parameters: {'n_layers_yy': 2, 'hidden_size_yy_l0': 4, 'hidden_size_yy_l1': 4, 'context_size_yy': 3, 'num_mix_components_yy': 5, 'context_extractor_yy': 'gru', 'activation_func_yy': 'ReLU', 'L2_weight_yy': 5.5185685660992944e-08, 'L_entropy_weight_yy': 5.606079463437953e-08, 'L_sep_weight_yy': 4.707828111095521e-07, 'L_scale_weight_yy': 6.363274662876838e-05, 'learning_rate_yy': 0.007371292307024164}. Best is trial 41 with value: -2.093922187128181.
[I 2026-03-17 17:28:15,374] Trial 25 finished with value: -2.289226107089581 and parameters: {'n_layers_yy': 1, 'hidden_size_yy_l0': 6, 'context_size_yy': 4, 'num_mix_components_yy': 2, 'context_extractor_yy': 'lstm', 'activation_func_yy': 'GELU', 'L2_weight_yy': 9.269825021486915e-05, 'L_entropy_weight_yy': 8.256039973467918e-09, 'L_sep_weight_yy': 0.00010956010926005966, 'L_scale_weight_yy': 0.0001108910067182919, 'learning_rate_yy': 0.007296976624732865}. Best is trial 24 with value: -2.2895590587228427.
[I 2026-03-17 17:28:16,291] Trial 47 pruned. 
[I 2026-03-17 17:28:20,059] Trial 33 finished with value: -2.4917917640280853 and parameters: {'n_layers_yy': 2, 'hidden_size_yy_l0': 2, 'hidden_size_yy_l1': 4, 'context_size_yy': 4, 'num_mix_components_yy': 5, 'context_extractor_yy': 'gru', 'activation_func_yy': 'GELU', 'L2_weight_yy': 1.8271116994914135e-05, 'L_entropy_weight_yy': 5.88077934984034e-10, 'L_sep_weight_yy': 5.629600522682924e-09, 'L_scale_weight_yy': 1.7857121491915644e-05, 'learning_rate_yy': 0.007549343594059666}. Best is trial 24 with value: -2.4926837718550585.
[I 2026-03-17 17:28:25,032] Trial 26 finished with value: -2.969271953696262 and parameters: {'n_layers_yy': 1, 'hidden_size_yy_l0': 6, 'context_size_yy': 3, 'num_mix_components_yy': 4, 'context_extractor_yy': 'lstm', 'activation_func_yy': 'Tanh', 'L2_weight_yy': 8.6812728321818e-06, 'L_entropy_weight_yy': 7.938503270466807e-06, 'L_sep_weight_yy': 0.00015548600882871698, 'L_scale_weight_yy': 7.71660460621663e-08, 'learning_rate_yy': 0.009644710087994723}. Best is trial 9 with value: -2.9754424140841684.
[I 2026-03-17 17:28:27,328] Trial 48 pruned. 
[I 2026-03-17 17:28:28,186] Trial 48 pruned. 
[I 2026-03-17 17:28:29,543] Trial 41 finished with value: -2.3744969436239853 and parameters: {'n_layers_yy': 2, 'hidden_size_yy_l0': 2, 'hidden_size_yy_l1': 6, 'context_size_yy': 1, 'num_mix_components_yy': 3, 'context_extractor_yy': 'lstm', 'activation_func_yy': 'Tanh', 'L2_weight_yy': 6.168709342331717e-10, 'L_entropy_weight_yy': 0.00030143958940526393, 'L_sep_weight_yy': 5.47411559716558e-09, 'L_scale_weight_yy': 8.023852046182026e-08, 'learning_rate_yy': 0.007416366677951004}. Best is trial 22 with value: -2.3759054172258436.
[I 2026-03-17 17:28:33,383] Trial 30 pruned. 
[I 2026-03-17 17:28:35,425] Trial 29 pruned. 
[I 2026-03-17 17:28:38,779] Trial 30 pruned. 
[I 2026-03-17 17:28:42,105] Trial 31 pruned. 
[I 2026-03-17 17:28:42,154] Trial 31 pruned. 
[I 2026-03-17 17:28:42,500] Trial 28 pruned. 
[I 2026-03-17 17:28:42,688] Trial 49 pruned. 
Optimize task 28: group_id: POm, neuron_id: 62
Starting optimization for task 28...

--- Data Summary ---
Total events for target process 16159
Data Time: 900 seconds
Using device: cuda
Number of events in target process: 16159
Only one process provided, preparing dataloaders for the reduced model.
Reduced model ln_yy : 968.49465 nats/sec, 53.94178 nats/event
Reduced model Log loss : -2.07819
Number of events in target process: 16159
Only one process provided, preparing dataloaders for the reduced model.
Reduced model ln_yy : 983.77289 nats/sec, 54.79272 nats/event
Reduced model Log loss : -2.08937
Number of events in target process: 16159
Only one process provided, preparing dataloaders for the reduced model.
Reduced model ln_yy : 991.56478 nats/sec, 55.22670 nats/event
Reduced model Log loss : -2.08514
Number of events in target process: 16159
Only one process provided, preparing dataloaders for the reduced model.
Number of events in target process: 16159
Only one process provided, preparing dataloaders for the reduced model.
Number of events in target process: 16159
Only one process provided, preparing dataloaders for the reduced model.
Number of events in target process: 16159
Only one process provided, preparing dataloaders for the reduced model.
Reduced model ln_yy : 980.23318 nats/sec, 54.59557 nats/event
Reduced model Log loss : -2.09007
Number of events in target process: 16159
Only one process provided, preparing dataloaders for the reduced model.
Number of events in target process: 16159
Only one process provided, preparing dataloaders for the reduced model.
Number of events in target process: 16159
Only one process provided, preparing dataloaders for the reduced model.
Number of events in target process: 16159
Only one process provided, preparing dataloaders for the reduced model.
Number of events in target process: 16159
Only one process provided, preparing dataloaders for the reduced model.
Number of events in target process: 16159
Only one process provided, preparing dataloaders for the reduced model.
Number of events in target process: 16159
Only one process provided, preparing dataloaders for the reduced model.
Number of events in target process: 16159
Only one process provided, preparing dataloaders for the reduced model.
Number of events in target process: 16159
Only one process provided, preparing dataloaders for the reduced model.
Number of events in target process: 16159
Only one process provided, preparing dataloaders for the reduced model.
Number of events in target process: 16159
Only one process provided, preparing dataloaders for the reduced model.
Number of events in target process: 16159
Only one process provided, preparing dataloaders for the reduced model.
Number of events in target process: 16159
Only one process provided, preparing dataloaders for the reduced model.
Number of events in target process: 16159
Only one process provided, preparing dataloaders for the reduced model.
Number of events in target process: 16159
Only one process provided, preparing dataloaders for the reduced model.
Reduced model ln_yy : 978.60298 nats/sec, 54.50478 nats/event
Reduced model Log loss : -2.09181
Number of events in target process: 16159
Only one process provided, preparing dataloaders for the reduced model.
Reduced model ln_yy : 977.34574 nats/sec, 54.43475 nats/event
Reduced model Log loss : -2.09185
Number of events in target process: 16159
Only one process provided, preparing dataloaders for the reduced model.
Number of events in target process: 16159
Only one process provided, preparing dataloaders for the reduced model.
Number of events in target process: 16159
Only one process provided, preparing dataloaders for the reduced model.
Number of events in target process: 16159
Only one process provided, preparing dataloaders for the reduced model.
Number of events in target process: 16159
Only one process provided, preparing dataloaders for the reduced model.
Number of events in target process: 16159
Only one process provided, preparing dataloaders for the reduced model.
Number of events in target process: 16159
Only one process provided, preparing dataloaders for the reduced model.
Number of events in target process: 16159
Only one process provided, preparing dataloaders for the reduced model.
Number of events in target process: 16159
Only one process provided, preparing dataloaders for the reduced model.
Number of events in target process: 16159
Only one process provided, preparing dataloaders for the reduced model.
Number of events in target process: 16159
Only one process provided, preparing dataloaders for the reduced model.
Number of events in target process: 16159
Only one process provided, preparing dataloaders for the reduced model.
Number of events in target process: 16159
Only one process provided, preparing dataloaders for the reduced model.
Number of events in target process: 16159
Only one process provided, preparing dataloaders for the reduced model.
Number of events in target process: 16159
Only one process provided, preparing dataloaders for the reduced model.
Number of events in target process: 16159
Only one process provided, preparing dataloaders for the reduced model.
Number of events in target process: 16159
Only one process provided, preparing dataloaders for the reduced model.
Reduced model ln_yy : 976.74933 nats/sec, 54.40153 nats/event
Reduced model Log loss : -2.09338
Number of events in target process: 16159
Only one process provided, preparing dataloaders for the reduced model.
Number of events in target process: 16159
Only one process provided, preparing dataloaders for the reduced model.
Reduced model ln_yy : 978.58904 nats/sec, 54.50400 nats/event
Reduced model Log loss : -2.09392
Number of events in target process: 16159
Only one process provided, preparing dataloaders for the reduced model.
Reduced model ln_yy : 976.34288 nats/sec, 54.37890 nats/event
Reduced model Log loss : -2.06974
Number of events in target process: 16159
Only one process provided, preparing dataloaders for the reduced model.
Reduced model ln_yy : 981.15907 nats/sec, 54.64714 nats/event
Reduced model Log loss : -2.09168
Number of events in target process: 16159
Only one process provided, preparing dataloaders for the reduced model.
Reduced model ln_yy : 983.62504 nats/sec, 54.78449 nats/event
Reduced model Log loss : -2.09222
Number of events in target process: 16159
Only one process provided, preparing dataloaders for the reduced model.
Number of events in target process: 16159
Only one process provided, preparing dataloaders for the reduced model.
Number of events in target process: 16159
Only one process provided, preparing dataloaders for the reduced model.
Reduced model ln_yy : 990.41534 nats/sec, 55.16268 nats/event
Reduced model Log loss : -2.09219
Number of events in target process: 16159
Only one process provided, preparing dataloaders for the reduced model.
Number of events in target process: 16159
Only one process provided, preparing dataloaders for the reduced model.
Best trial:
  Value: -2.093922187128181
  Params: {'n_layers_yy': 2, 'hidden_size_yy_l0': 4, 'hidden_size_yy_l1': 4, 'context_size_yy': 4, 'num_mix_components_yy': 5, 'context_extractor_yy': 'gru', 'activation_func_yy': 'ReLU', 'L2_weight_yy': 4.7658845011481224e-09, 'L_entropy_weight_yy': 5.2352781815420604e-08, 'L_sep_weight_yy': 1.2867891704042007e-07, 'L_scale_weight_yy': 7.162319870803142e-06, 'learning_rate_yy': 0.004889880737598432}
Full best configuration saved to results/opt/opt_reduced_28_best_config.txt
Optimization finished.
[I 2026-03-17 17:28:42,760] Trial 34 pruned. 
[I 2026-03-17 17:28:44,744] Trial 27 pruned. 
[I 2026-03-17 17:28:45,386] Trial 32 pruned. 
[I 2026-03-17 17:28:45,433] Trial 35 pruned. 
[I 2026-03-17 17:28:47,274] Trial 28 pruned. 
[I 2026-03-17 17:28:50,962] Trial 32 pruned. 
[I 2026-03-17 17:28:53,458] Trial 33 finished with value: -3.153503458157452 and parameters: {'n_layers_yy': 1, 'hidden_size_yy_l0': 5, 'context_size_yy': 4, 'num_mix_components_yy': 3, 'context_extractor_yy': 'gru', 'activation_func_yy': 'ReLU', 'L2_weight_yy': 5.292249247129385e-07, 'L_entropy_weight_yy': 5.987491978038624e-07, 'L_sep_weight_yy': 3.51242743189951e-07, 'L_scale_weight_yy': 3.809694569376972e-07, 'learning_rate_yy': 0.006518653913718873}. Best is trial 33 with value: -3.153503458157452.
[I 2026-03-17 17:28:54,055] Trial 33 pruned. 
[I 2026-03-17 17:28:54,497] Trial 33 pruned. 
[I 2026-03-17 17:28:54,529] Trial 29 pruned. 
[I 2026-03-17 17:28:57,067] Trial 34 pruned. 
[I 2026-03-17 17:28:57,879] Trial 26 finished with value: -2.286178024833614 and parameters: {'n_layers_yy': 1, 'hidden_size_yy_l0': 6, 'context_size_yy': 4, 'num_mix_components_yy': 2, 'context_extractor_yy': 'gru', 'activation_func_yy': 'GELU', 'L2_weight_yy': 5.3514896650690575e-05, 'L_entropy_weight_yy': 6.417312631151558e-08, 'L_sep_weight_yy': 2.1799058453970247e-05, 'L_scale_weight_yy': 0.00018116743720114492, 'learning_rate_yy': 0.00612761713188139}. Best is trial 24 with value: -2.2895590587228427.
[I 2026-03-17 17:28:59,364] Trial 34 pruned. 
[I 2026-03-17 17:29:00,031] Trial 35 pruned. 
[I 2026-03-17 17:29:03,113] Trial 36 pruned. 
[I 2026-03-17 17:29:03,740] Trial 34 pruned. 
[I 2026-03-17 17:29:05,478] Trial 35 pruned. 
[I 2026-03-17 17:29:07,169] Trial 36 pruned. 
