[I 2026-03-17 17:10:44,180] Trial 1 finished with value: -2.260938665420364 and parameters: {'n_layers_yy': 2, 'hidden_size_yy_l0': 3, 'hidden_size_yy_l1': 3, 'context_size_yy': 1, 'num_mix_components_yy': 1, 'context_extractor_yy': 'gru', 'activation_func_yy': 'Tanh', 'L2_weight_yy': 2.848998529245302e-08, 'L_entropy_weight_yy': 0.0003933732451184576, 'L_sep_weight_yy': 3.6454512556677372e-06, 'L_scale_weight_yy': 0.0005331895529978681, 'learning_rate_yy': 0.0029000878808733924}. Best is trial 0 with value: -2.289111866011322.
[I 2026-03-17 17:10:46,729] Trial 36 pruned. 
[I 2026-03-17 17:10:47,441] Trial 4 pruned. 
[I 2026-03-17 17:10:51,673] Trial 37 pruned. 
[I 2026-03-17 17:10:52,903] Trial 24 pruned. 
[I 2026-03-17 17:10:54,346] Trial 38 pruned. 
[I 2026-03-17 17:10:56,281] Trial 4 finished with value: -1.9076621166627798 and parameters: {'n_layers_yy': 2, 'hidden_size_yy_l0': 3, 'hidden_size_yy_l1': 3, 'context_size_yy': 4, 'num_mix_components_yy': 3, 'context_extractor_yy': 'gru', 'activation_func_yy': 'ReLU', 'L2_weight_yy': 0.00026698347418029056, 'L_entropy_weight_yy': 1.8872635829403115e-06, 'L_sep_weight_yy': 9.547631820685315e-07, 'L_scale_weight_yy': 3.57436353214802e-09, 'learning_rate_yy': 0.005318295121241343}. Best is trial 4 with value: -1.9076621166627798.
[I 2026-03-17 17:10:57,043] Trial 39 pruned. 
[I 2026-03-17 17:10:57,284] Trial 1 finished with value: -2.444894981350762 and parameters: {'n_layers_yy': 2, 'hidden_size_yy_l0': 4, 'hidden_size_yy_l1': 6, 'context_size_yy': 1, 'num_mix_components_yy': 3, 'context_extractor_yy': 'gru', 'activation_func_yy': 'Tanh', 'L2_weight_yy': 3.196988496640063e-06, 'L_entropy_weight_yy': 6.506699282404206e-05, 'L_sep_weight_yy': 2.303131912147457e-07, 'L_scale_weight_yy': 1.2060935584103111e-08, 'learning_rate_yy': 0.0007654981428054013}. Best is trial 1 with value: -2.444894981350762.
[I 2026-03-17 17:10:58,989] Trial 11 finished with value: -2.8352269528025382 and parameters: {'n_layers_yy': 1, 'hidden_size_yy_l0': 4, 'context_size_yy': 3, 'num_mix_components_yy': 5, 'context_extractor_yy': 'lstm', 'activation_func_yy': 'Tanh', 'L2_weight_yy': 1.5096828530987686e-10, 'L_entropy_weight_yy': 3.095984589431548e-05, 'L_sep_weight_yy': 5.443950038683002e-07, 'L_scale_weight_yy': 1.3568118005212254e-10, 'learning_rate_yy': 0.009729084554768449}. Best is trial 11 with value: -2.8352269528025382.
[I 2026-03-17 17:10:59,751] Trial 40 pruned. 
[I 2026-03-17 17:10:59,808] Trial 25 pruned. 
[I 2026-03-17 17:11:00,209] Trial 20 finished with value: -0.42795947756929664 and parameters: {'n_layers_yy': 1, 'hidden_size_yy_l0': 4, 'context_size_yy': 4, 'num_mix_components_yy': 5, 'context_extractor_yy': 'lstm', 'activation_func_yy': 'GELU', 'L2_weight_yy': 4.497452914599119e-09, 'L_entropy_weight_yy': 3.183756245886909e-09, 'L_sep_weight_yy': 0.0008792916537114764, 'L_scale_weight_yy': 2.3145234357878538e-10, 'learning_rate_yy': 0.0022209424490721038}. Best is trial 10 with value: -0.4361472115059017.
[I 2026-03-17 17:11:00,713] Trial 5 pruned. 
[I 2026-03-17 17:11:01,712] Trial 5 finished with value: -1.852192921681447 and parameters: {'n_layers_yy': 1, 'hidden_size_yy_l0': 5, 'context_size_yy': 3, 'num_mix_components_yy': 2, 'context_extractor_yy': 'gru', 'activation_func_yy': 'ReLU', 'L2_weight_yy': 5.342940593046396e-10, 'L_entropy_weight_yy': 2.975687954638356e-10, 'L_sep_weight_yy': 6.640235901500961e-05, 'L_scale_weight_yy': 2.1117774661123664e-05, 'learning_rate_yy': 0.0022525333679875117}. Best is trial 2 with value: -1.852375329243005.
[I 2026-03-17 17:11:03,388] Trial 26 pruned. 
[I 2026-03-17 17:11:05,782] Trial 21 pruned. 
[I 2026-03-17 17:11:06,475] Trial 27 pruned. 
[I 2026-03-17 17:11:07,018] Trial 3 finished with value: -1.702986696445342 and parameters: {'n_layers_yy': 2, 'hidden_size_yy_l0': 2, 'hidden_size_yy_l1': 3, 'context_size_yy': 4, 'num_mix_components_yy': 3, 'context_extractor_yy': 'gru', 'activation_func_yy': 'Tanh', 'L2_weight_yy': 8.115254067097431e-06, 'L_entropy_weight_yy': 7.094823387207433e-05, 'L_sep_weight_yy': 3.224304112672027e-06, 'L_scale_weight_yy': 1.2844809885033883e-06, 'learning_rate_yy': 0.005257982293648384}. Best is trial 3 with value: -1.702986696445342.
[I 2026-03-17 17:11:07,052] Trial 12 pruned. 
[I 2026-03-17 17:11:08,651] Trial 22 pruned. 
[I 2026-03-17 17:11:09,112] Trial 4 finished with value: -3.1183171010782145 and parameters: {'n_layers_yy': 2, 'hidden_size_yy_l0': 3, 'hidden_size_yy_l1': 5, 'context_size_yy': 2, 'num_mix_components_yy': 5, 'context_extractor_yy': 'gru', 'activation_func_yy': 'GELU', 'L2_weight_yy': 5.97572608848008e-08, 'L_entropy_weight_yy': 1.09611775811531e-09, 'L_sep_weight_yy': 7.014480203841733e-06, 'L_scale_weight_yy': 3.79360791443315e-09, 'learning_rate_yy': 0.0073769828452411165}. Best is trial 4 with value: -3.1183171010782145.
[I 2026-03-17 17:11:11,149] Trial 23 pruned. 
[I 2026-03-17 17:11:11,362] Trial 12 finished with value: -1.793984389683143 and parameters: {'n_layers_yy': 2, 'hidden_size_yy_l0': 4, 'hidden_size_yy_l1': 6, 'context_size_yy': 3, 'num_mix_components_yy': 5, 'context_extractor_yy': 'gru', 'activation_func_yy': 'GELU', 'L2_weight_yy': 2.047679103931958e-08, 'L_entropy_weight_yy': 0.0009968627614131836, 'L_sep_weight_yy': 4.174238186318038e-09, 'L_scale_weight_yy': 2.104301540184107e-05, 'learning_rate_yy': 0.0053624483449900735}. Best is trial 2 with value: -1.824331576606496.
[I 2026-03-17 17:11:12,691] Trial 28 pruned. 
[I 2026-03-17 17:11:14,311] Trial 41 finished with value: -0.0015825504480406296 and parameters: {'n_layers_yy': 2, 'hidden_size_yy_l0': 6, 'hidden_size_yy_l1': 5, 'context_size_yy': 3, 'num_mix_components_yy': 5, 'context_extractor_yy': 'lstm', 'activation_func_yy': 'Tanh', 'L2_weight_yy': 0.0009363793242645961, 'L_entropy_weight_yy': 0.000379161214301918, 'L_sep_weight_yy': 2.043070731072824e-08, 'L_scale_weight_yy': 5.2520463677429655e-05, 'learning_rate_yy': 0.004260493363221876}. Best is trial 10 with value: -0.004261507544406625.
[I 2026-03-17 17:11:15,433] Trial 18 finished with value: -0.8283690730085049 and parameters: {'n_layers_yy': 2, 'hidden_size_yy_l0': 6, 'hidden_size_yy_l1': 3, 'context_size_yy': 2, 'num_mix_components_yy': 2, 'context_extractor_yy': 'lstm', 'activation_func_yy': 'ReLU', 'L2_weight_yy': 1.3076429828544783e-05, 'L_entropy_weight_yy': 3.4341990432479995e-10, 'L_sep_weight_yy': 2.678418890989832e-06, 'L_scale_weight_yy': 1.0819190512572477e-05, 'learning_rate_yy': 0.004452042249378721}. Best is trial 2 with value: -0.833493141163047.
[I 2026-03-17 17:11:15,737] Trial 24 pruned. 
[I 2026-03-17 17:11:16,289] Trial 29 pruned. 
[I 2026-03-17 17:11:18,169] Trial 18 finished with value: -1.4301481276292067 and parameters: {'n_layers_yy': 2, 'hidden_size_yy_l0': 5, 'hidden_size_yy_l1': 3, 'context_size_yy': 2, 'num_mix_components_yy': 4, 'context_extractor_yy': 'lstm', 'activation_func_yy': 'Tanh', 'L2_weight_yy': 1.0548861111116685e-10, 'L_entropy_weight_yy': 2.714589461180286e-07, 'L_sep_weight_yy': 7.04838961257854e-05, 'L_scale_weight_yy': 5.84278746015806e-06, 'learning_rate_yy': 0.0023939264803230676}. Best is trial 1 with value: -1.4537486853966346.
[I 2026-03-17 17:11:18,820] Trial 25 pruned. 
[I 2026-03-17 17:11:18,929] Trial 5 pruned. 
[I 2026-03-17 17:11:19,423] Trial 42 pruned. 
[I 2026-03-17 17:11:19,456] Trial 5 pruned. 
[I 2026-03-17 17:11:20,848] Trial 19 pruned. 
[I 2026-03-17 17:11:21,173] Trial 26 pruned. 
[I 2026-03-17 17:11:22,417] Trial 30 pruned. 
[I 2026-03-17 17:11:23,898] Trial 20 pruned. 
[I 2026-03-17 17:11:24,507] Trial 9 finished with value: -1.2718806099318753 and parameters: {'n_layers_yy': 1, 'hidden_size_yy_l0': 6, 'context_size_yy': 2, 'num_mix_components_yy': 3, 'context_extractor_yy': 'lstm', 'activation_func_yy': 'ReLU', 'L2_weight_yy': 9.146038419351588e-10, 'L_entropy_weight_yy': 6.023809582006368e-05, 'L_sep_weight_yy': 3.2945389595726806e-09, 'L_scale_weight_yy': 2.097005981391725e-10, 'learning_rate_yy': 0.005272207867369778}. Best is trial 9 with value: -1.2718806099318753.
[I 2026-03-17 17:11:26,452] Trial 27 pruned. 
[I 2026-03-17 17:11:27,781] Trial 10 pruned. 
[I 2026-03-17 17:11:28,537] Trial 6 pruned. 
[I 2026-03-17 17:11:31,888] Trial 28 pruned. 
[I 2026-03-17 17:11:33,818] Trial 43 finished with value: -0.006305112395175668 and parameters: {'n_layers_yy': 2, 'hidden_size_yy_l0': 6, 'hidden_size_yy_l1': 4, 'context_size_yy': 3, 'num_mix_components_yy': 5, 'context_extractor_yy': 'lstm', 'activation_func_yy': 'Tanh', 'L2_weight_yy': 9.143911174235583e-09, 'L_entropy_weight_yy': 0.0004916833719060641, 'L_sep_weight_yy': 3.321035309994078e-07, 'L_scale_weight_yy': 3.406488328682871e-05, 'learning_rate_yy': 0.005768963378745031}. Best is trial 43 with value: -0.006305112395175668.
[I 2026-03-17 17:11:33,955] Trial 4 pruned. 
[I 2026-03-17 17:11:36,565] Trial 9 finished with value: -1.6541952604967545 and parameters: {'n_layers_yy': 1, 'hidden_size_yy_l0': 5, 'context_size_yy': 2, 'num_mix_components_yy': 2, 'context_extractor_yy': 'lstm', 'activation_func_yy': 'GELU', 'L2_weight_yy': 9.566403366308474e-09, 'L_entropy_weight_yy': 5.97661448025634e-10, 'L_sep_weight_yy': 1.9536347303596862e-05, 'L_scale_weight_yy': 9.360523050732468e-08, 'learning_rate_yy': 0.0007038534542282552}. Best is trial 2 with value: -1.6677701443405077.
[I 2026-03-17 17:11:38,459] Trial 5 pruned. 
[I 2026-03-17 17:11:39,761] Trial 31 pruned. 
[I 2026-03-17 17:11:41,712] Trial 6 pruned. 
[I 2026-03-17 17:11:45,081] Trial 14 finished with value: -1.6118587091815904 and parameters: {'n_layers_yy': 1, 'hidden_size_yy_l0': 2, 'context_size_yy': 4, 'num_mix_components_yy': 3, 'context_extractor_yy': 'lstm', 'activation_func_yy': 'ReLU', 'L2_weight_yy': 0.00029394187135364964, 'L_entropy_weight_yy': 1.0379390535645503e-09, 'L_sep_weight_yy': 1.989123904077246e-09, 'L_scale_weight_yy': 2.6007519068544797e-08, 'learning_rate_yy': 0.003913035833750567}. Best is trial 12 with value: -1.6131555846140806.
[I 2026-03-17 17:11:45,102] Trial 7 pruned. 
[I 2026-03-17 17:11:46,697] Trial 44 pruned. 
[I 2026-03-17 17:11:46,870] Trial 2 finished with value: -2.278826134820609 and parameters: {'n_layers_yy': 2, 'hidden_size_yy_l0': 6, 'hidden_size_yy_l1': 4, 'context_size_yy': 3, 'num_mix_components_yy': 3, 'context_extractor_yy': 'lstm', 'activation_func_yy': 'ReLU', 'L2_weight_yy': 0.0008816462790007617, 'L_entropy_weight_yy': 4.829923535800266e-08, 'L_sep_weight_yy': 1.1338131541831496e-07, 'L_scale_weight_yy': 1.7754687985355307e-06, 'learning_rate_yy': 0.005914786671563647}. Best is trial 0 with value: -2.289111866011322.
[I 2026-03-17 17:11:48,126] Trial 6 finished with value: -2.0900655209905628 and parameters: {'n_layers_yy': 2, 'hidden_size_yy_l0': 3, 'hidden_size_yy_l1': 5, 'context_size_yy': 4, 'num_mix_components_yy': 4, 'context_extractor_yy': 'lstm', 'activation_func_yy': 'ReLU', 'L2_weight_yy': 0.0006377168762026114, 'L_entropy_weight_yy': 1.384073132568972e-07, 'L_sep_weight_yy': 4.706134351096742e-05, 'L_scale_weight_yy': 1.9586145408312675e-10, 'learning_rate_yy': 0.0047945483549060855}. Best is trial 6 with value: -2.0900655209905628.
[I 2026-03-17 17:11:48,457] Trial 7 finished with value: -2.7995753208916416 and parameters: {'n_layers_yy': 1, 'hidden_size_yy_l0': 2, 'context_size_yy': 1, 'num_mix_components_yy': 4, 'context_extractor_yy': 'gru', 'activation_func_yy': 'ReLU', 'L2_weight_yy': 0.0005691428576672595, 'L_entropy_weight_yy': 6.088130775426465e-05, 'L_sep_weight_yy': 4.706114402764887e-06, 'L_scale_weight_yy': 3.915561577832481e-09, 'learning_rate_yy': 0.005200031276853086}. Best is trial 0 with value: -2.971554416150561.
[I 2026-03-17 17:11:48,864] Trial 1 finished with value: -3.2261631673177082 and parameters: {'n_layers_yy': 2, 'hidden_size_yy_l0': 3, 'hidden_size_yy_l1': 5, 'context_size_yy': 3, 'num_mix_components_yy': 2, 'context_extractor_yy': 'lstm', 'activation_func_yy': 'GELU', 'L2_weight_yy': 1.4755577455505606e-07, 'L_entropy_weight_yy': 5.416112457574578e-07, 'L_sep_weight_yy': 0.0005667680119683849, 'L_scale_weight_yy': 1.0783674130451646e-10, 'learning_rate_yy': 0.0006303954103483569}. Best is trial 0 with value: -3.2443633626302084.
[I 2026-03-17 17:11:50,476] Trial 7 finished with value: -1.9830532325011814 and parameters: {'n_layers_yy': 2, 'hidden_size_yy_l0': 5, 'hidden_size_yy_l1': 6, 'context_size_yy': 1, 'num_mix_components_yy': 2, 'context_extractor_yy': 'gru', 'activation_func_yy': 'Tanh', 'L2_weight_yy': 1.062740963703322e-05, 'L_entropy_weight_yy': 1.5497168725106467e-06, 'L_sep_weight_yy': 7.494265886260194e-06, 'L_scale_weight_yy': 3.5679607824991437e-09, 'learning_rate_yy': 0.003224827824100096}. Best is trial 7 with value: -1.9830532325011814.
[I 2026-03-17 17:11:51,739] Trial 21 finished with value: -1.4523570838341346 and parameters: {'n_layers_yy': 1, 'hidden_size_yy_l0': 6, 'context_size_yy': 4, 'num_mix_components_yy': 4, 'context_extractor_yy': 'gru', 'activation_func_yy': 'ReLU', 'L2_weight_yy': 2.6427692427373205e-10, 'L_entropy_weight_yy': 4.100473779226364e-09, 'L_sep_weight_yy': 5.03231763616947e-06, 'L_scale_weight_yy': 4.939567014121694e-09, 'learning_rate_yy': 0.003793617169692525}. Best is trial 1 with value: -1.4537486853966346.
[I 2026-03-17 17:11:53,010] Trial 19 pruned. 
[I 2026-03-17 17:11:53,424] Trial 7 pruned. 
[I 2026-03-17 17:11:54,211] Trial 8 pruned. 
[I 2026-03-17 17:11:56,330] Trial 32 pruned. 
[I 2026-03-17 17:11:57,933] Trial 22 pruned. 
[I 2026-03-17 17:11:58,279] Trial 8 pruned. 
[I 2026-03-17 17:11:58,534] Trial 45 finished with value: -0.010956101639326228 and parameters: {'n_layers_yy': 2, 'hidden_size_yy_l0': 6, 'hidden_size_yy_l1': 4, 'context_size_yy': 3, 'num_mix_components_yy': 2, 'context_extractor_yy': 'lstm', 'activation_func_yy': 'Tanh', 'L2_weight_yy': 1.4534924251662164e-07, 'L_entropy_weight_yy': 5.095256867365438e-05, 'L_sep_weight_yy': 1.771931285326037e-07, 'L_scale_weight_yy': 2.174089403941853e-05, 'learning_rate_yy': 0.008079292312455317}. Best is trial 45 with value: -0.010956101639326228.
[I 2026-03-17 17:11:59,639] Trial 33 pruned. 
[I 2026-03-17 17:12:01,031] Trial 6 finished with value: -1.8554804452326426 and parameters: {'n_layers_yy': 2, 'hidden_size_yy_l0': 5, 'hidden_size_yy_l1': 4, 'context_size_yy': 4, 'num_mix_components_yy': 3, 'context_extractor_yy': 'lstm', 'activation_func_yy': 'Tanh', 'L2_weight_yy': 3.852562827985286e-06, 'L_entropy_weight_yy': 4.676783956860021e-05, 'L_sep_weight_yy': 5.010256913849138e-05, 'L_scale_weight_yy': 4.304664187915676e-09, 'learning_rate_yy': 0.009472119177458832}. Best is trial 6 with value: -1.8554804452326426.
[I 2026-03-17 17:12:02,946] Trial 34 pruned. 
[I 2026-03-17 17:12:03,742] Trial 9 pruned. 
[I 2026-03-17 17:12:03,843] Trial 23 pruned. 
[I 2026-03-17 17:12:04,615] Trial 7 finished with value: -1.9705012298858469 and parameters: {'n_layers_yy': 1, 'hidden_size_yy_l0': 6, 'context_size_yy': 3, 'num_mix_components_yy': 5, 'context_extractor_yy': 'lstm', 'activation_func_yy': 'Tanh', 'L2_weight_yy': 0.0004547126989201887, 'L_entropy_weight_yy': 1.2669693391308945e-05, 'L_sep_weight_yy': 3.3644044802738134e-07, 'L_scale_weight_yy': 9.63720296817001e-07, 'learning_rate_yy': 0.002370581870614494}. Best is trial 1 with value: -1.9741431522447364.
[I 2026-03-17 17:12:05,140] Trial 7 pruned. 
[I 2026-03-17 17:12:06,841] Trial 13 finished with value: -2.833713344489677 and parameters: {'n_layers_yy': 1, 'hidden_size_yy_l0': 5, 'context_size_yy': 3, 'num_mix_components_yy': 5, 'context_extractor_yy': 'lstm', 'activation_func_yy': 'ReLU', 'L2_weight_yy': 3.962625507801033e-06, 'L_entropy_weight_yy': 4.253651968902946e-08, 'L_sep_weight_yy': 1.8038040380348607e-07, 'L_scale_weight_yy': 1.473715815952029e-10, 'learning_rate_yy': 0.009903974251013591}. Best is trial 11 with value: -2.8352269528025382.
[I 2026-03-17 17:12:07,124] Trial 15 pruned. 
[I 2026-03-17 17:12:08,374] Trial 8 pruned. 
[I 2026-03-17 17:12:08,618] Trial 10 pruned. 
[I 2026-03-17 17:12:09,284] Trial 8 pruned. 
[I 2026-03-17 17:12:09,593] Trial 2 finished with value: -2.476197165819489 and parameters: {'n_layers_yy': 2, 'hidden_size_yy_l0': 6, 'hidden_size_yy_l1': 5, 'context_size_yy': 4, 'num_mix_components_yy': 3, 'context_extractor_yy': 'gru', 'activation_func_yy': 'ReLU', 'L2_weight_yy': 2.514964562721126e-07, 'L_entropy_weight_yy': 3.1863194593004153e-06, 'L_sep_weight_yy': 2.3814640967109104e-07, 'L_scale_weight_yy': 9.737697008772498e-05, 'learning_rate_yy': 0.005769686505608838}. Best is trial 2 with value: -2.476197165819489.
[I 2026-03-17 17:12:09,676] Trial 24 pruned. 
[I 2026-03-17 17:12:09,687] Trial 35 pruned. 
[I 2026-03-17 17:12:10,073] Trial 3 finished with value: -2.509458930530602 and parameters: {'n_layers_yy': 1, 'hidden_size_yy_l0': 5, 'context_size_yy': 1, 'num_mix_components_yy': 4, 'context_extractor_yy': 'gru', 'activation_func_yy': 'ReLU', 'L2_weight_yy': 1.107412626263064e-05, 'L_entropy_weight_yy': 1.3453452009506427e-07, 'L_sep_weight_yy': 5.855655189847871e-07, 'L_scale_weight_yy': 4.1037544826200984e-09, 'learning_rate_yy': 0.002477465321874805}. Best is trial 1 with value: -2.510248337726791.
[I 2026-03-17 17:12:13,177] Trial 9 pruned. 
[I 2026-03-17 17:12:13,670] Trial 7 finished with value: -2.6326792002135244 and parameters: {'n_layers_yy': 1, 'hidden_size_yy_l0': 5, 'context_size_yy': 4, 'num_mix_components_yy': 3, 'context_extractor_yy': 'gru', 'activation_func_yy': 'Tanh', 'L2_weight_yy': 8.305566777697937e-05, 'L_entropy_weight_yy': 0.000205190913458395, 'L_sep_weight_yy': 0.00018656095951787813, 'L_scale_weight_yy': 1.2497860691185343e-05, 'learning_rate_yy': 0.0007788059786830432}. Best is trial 7 with value: -2.6326792002135244.
[I 2026-03-17 17:12:13,782] Trial 2 finished with value: -2.489143682537181 and parameters: {'n_layers_yy': 2, 'hidden_size_yy_l0': 4, 'hidden_size_yy_l1': 6, 'context_size_yy': 1, 'num_mix_components_yy': 3, 'context_extractor_yy': 'gru', 'activation_func_yy': 'GELU', 'L2_weight_yy': 2.6746423579122984e-05, 'L_entropy_weight_yy': 5.114871857147911e-10, 'L_sep_weight_yy': 7.676507806880026e-05, 'L_scale_weight_yy': 1.2422405279422457e-09, 'learning_rate_yy': 0.007827571056249198}. Best is trial 2 with value: -2.489143682537181.
[I 2026-03-17 17:12:13,792] Trial 11 pruned. 
[I 2026-03-17 17:12:14,489] Trial 46 finished with value: -0.004453326380530069 and parameters: {'n_layers_yy': 2, 'hidden_size_yy_l0': 5, 'hidden_size_yy_l1': 4, 'context_size_yy': 3, 'num_mix_components_yy': 2, 'context_extractor_yy': 'lstm', 'activation_func_yy': 'Tanh', 'L2_weight_yy': 3.862237951231699e-08, 'L_entropy_weight_yy': 2.0243639904847974e-05, 'L_sep_weight_yy': 1.6384987545786707e-06, 'L_scale_weight_yy': 8.404682725281385e-06, 'learning_rate_yy': 0.009469264787855772}. Best is trial 45 with value: -0.010956101639326228.
[I 2026-03-17 17:12:16,093] Trial 4 pruned. 
[I 2026-03-17 17:12:16,423] Trial 9 pruned. 
[I 2026-03-17 17:12:16,935] Trial 10 pruned. 
[I 2026-03-17 17:12:19,098] Trial 12 pruned. 
[I 2026-03-17 17:12:20,829] Trial 7 finished with value: -1.6657708134575568 and parameters: {'n_layers_yy': 2, 'hidden_size_yy_l0': 3, 'hidden_size_yy_l1': 5, 'context_size_yy': 2, 'num_mix_components_yy': 4, 'context_extractor_yy': 'gru', 'activation_func_yy': 'Tanh', 'L2_weight_yy': 5.097688310464215e-10, 'L_entropy_weight_yy': 4.677414780090204e-06, 'L_sep_weight_yy': 3.469556021515863e-10, 'L_scale_weight_yy': 0.000910123633470255, 'learning_rate_yy': 0.000575468876845434}. Best is trial 2 with value: -1.677622742403132.
[I 2026-03-17 17:12:22,520] Trial 13 finished with value: -1.7920831228749488 and parameters: {'n_layers_yy': 1, 'hidden_size_yy_l0': 6, 'context_size_yy': 2, 'num_mix_components_yy': 4, 'context_extractor_yy': 'gru', 'activation_func_yy': 'GELU', 'L2_weight_yy': 3.4171562347829985e-06, 'L_entropy_weight_yy': 7.491968104779749e-09, 'L_sep_weight_yy': 2.8126313050636643e-09, 'L_scale_weight_yy': 3.4279059399393976e-08, 'learning_rate_yy': 0.0011565633275267201}. Best is trial 2 with value: -1.824331576606496.
[I 2026-03-17 17:12:22,789] Trial 29 finished with value: -0.3826302448662442 and parameters: {'n_layers_yy': 1, 'hidden_size_yy_l0': 4, 'context_size_yy': 1, 'num_mix_components_yy': 5, 'context_extractor_yy': 'gru', 'activation_func_yy': 'Tanh', 'L2_weight_yy': 2.319605731319858e-09, 'L_entropy_weight_yy': 1.395052980738199e-05, 'L_sep_weight_yy': 6.291710596083163e-09, 'L_scale_weight_yy': 4.45565418643224e-08, 'learning_rate_yy': 0.002811238089142112}. Best is trial 10 with value: -0.4361472115059017.
[I 2026-03-17 17:12:24,119] Trial 20 finished with value: -0.8228221989100581 and parameters: {'n_layers_yy': 2, 'hidden_size_yy_l0': 5, 'hidden_size_yy_l1': 4, 'context_size_yy': 2, 'num_mix_components_yy': 3, 'context_extractor_yy': 'gru', 'activation_func_yy': 'Tanh', 'L2_weight_yy': 0.00018645888811367472, 'L_entropy_weight_yy': 1.0078942706056608e-10, 'L_sep_weight_yy': 7.053396681710333e-08, 'L_scale_weight_yy': 1.8043831852348377e-05, 'learning_rate_yy': 0.00444710363509263}. Best is trial 2 with value: -0.833493141163047.
[I 2026-03-17 17:12:24,639] Trial 8 pruned. 
[I 2026-03-17 17:12:26,251] Trial 14 pruned. 
[I 2026-03-17 17:12:26,700] Trial 21 pruned. 
[I 2026-03-17 17:12:26,713] Trial 36 pruned. 
[I 2026-03-17 17:12:27,494] Trial 47 pruned. 
[I 2026-03-17 17:12:27,809] Trial 10 finished with value: -1.6702043966563191 and parameters: {'n_layers_yy': 2, 'hidden_size_yy_l0': 2, 'hidden_size_yy_l1': 6, 'context_size_yy': 1, 'num_mix_components_yy': 5, 'context_extractor_yy': 'gru', 'activation_func_yy': 'GELU', 'L2_weight_yy': 7.342770389995524e-06, 'L_entropy_weight_yy': 0.0009835525497780585, 'L_sep_weight_yy': 1.598957076233229e-10, 'L_scale_weight_yy': 4.172776124625413e-09, 'learning_rate_yy': 0.00992783544210595}. Best is trial 10 with value: -1.6702043966563191.
[I 2026-03-17 17:12:28,162] Trial 9 pruned. 
[I 2026-03-17 17:12:28,292] Trial 30 pruned. 
