[I 2026-03-17 17:07:08,857] Trial 1 finished with value: -1.611847058981261 and parameters: {'n_layers_yy': 2, 'hidden_size_yy_l0': 3, 'hidden_size_yy_l1': 6, 'context_size_yy': 2, 'num_mix_components_yy': 2, 'context_extractor_yy': 'lstm', 'activation_func_yy': 'Tanh', 'L2_weight_yy': 2.046057695513529e-09, 'L_entropy_weight_yy': 1.4604565798529508e-05, 'L_sep_weight_yy': 1.1704100001608988e-07, 'L_scale_weight_yy': 6.216665356020177e-10, 'learning_rate_yy': 0.009339968549123404}. Best is trial 1 with value: -1.611847058981261.
[I 2026-03-17 17:07:09,843] Trial 2 finished with value: -0.833493141163047 and parameters: {'n_layers_yy': 2, 'hidden_size_yy_l0': 2, 'hidden_size_yy_l1': 3, 'context_size_yy': 2, 'num_mix_components_yy': 5, 'context_extractor_yy': 'gru', 'activation_func_yy': 'Tanh', 'L2_weight_yy': 3.9838963830469457e-05, 'L_entropy_weight_yy': 1.9909556531991214e-10, 'L_sep_weight_yy': 7.095693728013595e-05, 'L_scale_weight_yy': 1.8389597451172184e-10, 'learning_rate_yy': 0.004699811363429675}. Best is trial 2 with value: -0.833493141163047.
[I 2026-03-17 17:07:13,196] Trial 3 pruned. 
[I 2026-03-17 17:07:15,033] Trial 1 finished with value: -1.667182624971098 and parameters: {'n_layers_yy': 1, 'hidden_size_yy_l0': 5, 'context_size_yy': 2, 'num_mix_components_yy': 3, 'context_extractor_yy': 'gru', 'activation_func_yy': 'ReLU', 'L2_weight_yy': 0.0002792857890571727, 'L_entropy_weight_yy': 4.398607399447795e-05, 'L_sep_weight_yy': 1.653293398173176e-08, 'L_scale_weight_yy': 7.912627445525788e-05, 'learning_rate_yy': 0.004394509149269059}. Best is trial 1 with value: -1.667182624971098.
[I 2026-03-17 17:07:15,899] Trial 4 pruned. 
[I 2026-03-17 17:07:17,615] Trial 2 pruned. 
[I 2026-03-17 17:07:20,259] Trial 11 pruned. 
[I 2026-03-17 17:07:21,136] Trial 3 pruned. 
[I 2026-03-17 17:07:24,591] Trial 3 pruned. 
[I 2026-03-17 17:07:26,879] Trial 4 finished with value: -0.5649226213583756 and parameters: {'n_layers_yy': 2, 'hidden_size_yy_l0': 2, 'hidden_size_yy_l1': 5, 'context_size_yy': 2, 'num_mix_components_yy': 5, 'context_extractor_yy': 'lstm', 'activation_func_yy': 'ReLU', 'L2_weight_yy': 4.1021431177960297e-07, 'L_entropy_weight_yy': 6.576193612496666e-05, 'L_sep_weight_yy': 2.2706397541068665e-08, 'L_scale_weight_yy': 4.3143493875284e-07, 'learning_rate_yy': 0.0013939171318778992}. Best is trial 3 with value: -0.5765003902220168.
[I 2026-03-17 17:07:28,218] Trial 0 finished with value: -2.971554416150561 and parameters: {'n_layers_yy': 1, 'hidden_size_yy_l0': 6, 'context_size_yy': 4, 'num_mix_components_yy': 4, 'context_extractor_yy': 'lstm', 'activation_func_yy': 'GELU', 'L2_weight_yy': 9.820070641729582e-10, 'L_entropy_weight_yy': 1.1482780804293083e-06, 'L_sep_weight_yy': 0.0008351596082386576, 'L_scale_weight_yy': 5.543690632943522e-05, 'learning_rate_yy': 0.00876811213292534}. Best is trial 0 with value: -2.971554416150561.
[I 2026-03-17 17:07:29,405] Trial 4 pruned. 
[I 2026-03-17 17:07:30,076] Trial 5 pruned. 
[I 2026-03-17 17:07:31,822] Trial 1 finished with value: -1.78021637271149 and parameters: {'n_layers_yy': 1, 'hidden_size_yy_l0': 4, 'context_size_yy': 3, 'num_mix_components_yy': 4, 'context_extractor_yy': 'gru', 'activation_func_yy': 'ReLU', 'L2_weight_yy': 1.7052486510855906e-08, 'L_entropy_weight_yy': 0.0007272794630079026, 'L_sep_weight_yy': 6.73694579300333e-07, 'L_scale_weight_yy': 9.627831503996892e-06, 'learning_rate_yy': 0.007314845756605969}. Best is trial 1 with value: -1.78021637271149.
[I 2026-03-17 17:07:33,103] Trial 5 pruned. 
[I 2026-03-17 17:07:36,094] Trial 6 pruned. 
[I 2026-03-17 17:07:36,438] Trial 6 pruned. 
[I 2026-03-17 17:07:36,640] Trial 2 finished with value: -0.4153653549336058 and parameters: {'n_layers_yy': 1, 'hidden_size_yy_l0': 3, 'context_size_yy': 4, 'num_mix_components_yy': 1, 'context_extractor_yy': 'lstm', 'activation_func_yy': 'Tanh', 'L2_weight_yy': 5.7064813223585866e-08, 'L_entropy_weight_yy': 6.991173107990454e-08, 'L_sep_weight_yy': 0.00044944982286956224, 'L_scale_weight_yy': 0.0007502079059588813, 'learning_rate_yy': 0.003293500340291434}. Best is trial 2 with value: -0.4153653549336058.
[I 2026-03-17 17:07:36,815] Trial 12 finished with value: -0.0004348366759544195 and parameters: {'n_layers_yy': 2, 'hidden_size_yy_l0': 6, 'hidden_size_yy_l1': 5, 'context_size_yy': 3, 'num_mix_components_yy': 5, 'context_extractor_yy': 'lstm', 'activation_func_yy': 'Tanh', 'L2_weight_yy': 0.0009651010567796541, 'L_entropy_weight_yy': 0.0007593126875371041, 'L_sep_weight_yy': 2.472075244311911e-08, 'L_scale_weight_yy': 3.454700244599609e-05, 'learning_rate_yy': 0.004076762405656022}. Best is trial 10 with value: -0.004261507544406625.
[I 2026-03-17 17:07:37,696] Trial 0 finished with value: -2.3640086480201146 and parameters: {'n_layers_yy': 1, 'hidden_size_yy_l0': 2, 'context_size_yy': 3, 'num_mix_components_yy': 5, 'context_extractor_yy': 'lstm', 'activation_func_yy': 'Tanh', 'L2_weight_yy': 1.806165507488641e-06, 'L_entropy_weight_yy': 2.070132657345438e-09, 'L_sep_weight_yy': 4.6361600977031715e-05, 'L_scale_weight_yy': 1.9622646561957027e-10, 'learning_rate_yy': 0.0006271265220314294}. Best is trial 0 with value: -2.3640086480201146.
[I 2026-03-17 17:07:42,761] Trial 7 pruned. 
[I 2026-03-17 17:07:42,864] Trial 0 finished with value: -1.7019540283753405 and parameters: {'n_layers_yy': 1, 'hidden_size_yy_l0': 3, 'context_size_yy': 3, 'num_mix_components_yy': 5, 'context_extractor_yy': 'lstm', 'activation_func_yy': 'GELU', 'L2_weight_yy': 5.617130753331682e-05, 'L_entropy_weight_yy': 2.8309613861083294e-10, 'L_sep_weight_yy': 2.358061714962037e-09, 'L_scale_weight_yy': 1.6125340772526126e-05, 'learning_rate_yy': 0.0005564606167793882}. Best is trial 0 with value: -1.7019540283753405.
[I 2026-03-17 17:07:44,945] Trial 1 finished with value: -2.632149061912318 and parameters: {'n_layers_yy': 1, 'hidden_size_yy_l0': 5, 'context_size_yy': 4, 'num_mix_components_yy': 2, 'context_extractor_yy': 'lstm', 'activation_func_yy': 'GELU', 'L2_weight_yy': 4.4557248647503074e-07, 'L_entropy_weight_yy': 2.1766907865538763e-08, 'L_sep_weight_yy': 3.4588778814108054e-09, 'L_scale_weight_yy': 8.221486569169184e-06, 'learning_rate_yy': 0.004036825900722907}. Best is trial 1 with value: -2.632149061912318.
[I 2026-03-17 17:07:46,104] Trial 8 pruned. 
[I 2026-03-17 17:07:48,703] Trial 1 pruned. 
[I 2026-03-17 17:07:49,551] Trial 13 pruned. 
[I 2026-03-17 17:07:50,602] Trial 1 finished with value: -1.953544264178889 and parameters: {'n_layers_yy': 2, 'hidden_size_yy_l0': 5, 'hidden_size_yy_l1': 3, 'context_size_yy': 1, 'num_mix_components_yy': 1, 'context_extractor_yy': 'gru', 'activation_func_yy': 'ReLU', 'L2_weight_yy': 2.025360399597817e-10, 'L_entropy_weight_yy': 0.00011038530015378467, 'L_sep_weight_yy': 2.220068152791679e-08, 'L_scale_weight_yy': 1.695622744523765e-07, 'learning_rate_yy': 0.0014929210081143249}. Best is trial 0 with value: -1.961334732726521.
[I 2026-03-17 17:07:50,614] Trial 1 finished with value: -1.904395168930737 and parameters: {'n_layers_yy': 1, 'hidden_size_yy_l0': 4, 'context_size_yy': 3, 'num_mix_components_yy': 5, 'context_extractor_yy': 'gru', 'activation_func_yy': 'Tanh', 'L2_weight_yy': 1.5612371538738885e-06, 'L_entropy_weight_yy': 0.0005235733537329126, 'L_sep_weight_yy': 1.416011239192039e-07, 'L_scale_weight_yy': 2.5758324155901704e-10, 'learning_rate_yy': 0.0013608038562654327}. Best is trial 1 with value: -1.904395168930737.
[I 2026-03-17 17:07:50,804] Trial 2 pruned. 
[I 2026-03-17 17:07:52,632] Trial 9 pruned. 
[I 2026-03-17 17:07:52,689] Trial 2 finished with value: -1.677622742403132 and parameters: {'n_layers_yy': 1, 'hidden_size_yy_l0': 4, 'context_size_yy': 4, 'num_mix_components_yy': 4, 'context_extractor_yy': 'lstm', 'activation_func_yy': 'GELU', 'L2_weight_yy': 1.3116402665074532e-06, 'L_entropy_weight_yy': 1.1483504562822486e-09, 'L_sep_weight_yy': 4.988332317996253e-09, 'L_scale_weight_yy': 4.729417271300235e-07, 'learning_rate_yy': 0.0024177947280452842}. Best is trial 2 with value: -1.677622742403132.
[I 2026-03-17 17:07:53,476] Trial 0 finished with value: -2.4716054100517186 and parameters: {'n_layers_yy': 2, 'hidden_size_yy_l0': 2, 'hidden_size_yy_l1': 2, 'context_size_yy': 3, 'num_mix_components_yy': 5, 'context_extractor_yy': 'gru', 'activation_func_yy': 'Tanh', 'L2_weight_yy': 2.5138533475400727e-08, 'L_entropy_weight_yy': 1.4192647590237313e-09, 'L_sep_weight_yy': 2.4952588671218037e-07, 'L_scale_weight_yy': 1.6172627734458535e-08, 'learning_rate_yy': 0.0018287425246646713}. Best is trial 0 with value: -2.4716054100517186.
[I 2026-03-17 17:07:53,588] Trial 0 finished with value: -2.289111866011322 and parameters: {'n_layers_yy': 1, 'hidden_size_yy_l0': 5, 'context_size_yy': 4, 'num_mix_components_yy': 1, 'context_extractor_yy': 'lstm', 'activation_func_yy': 'GELU', 'L2_weight_yy': 2.444058718195409e-07, 'L_entropy_weight_yy': 1.1460248629995053e-06, 'L_sep_weight_yy': 0.000280785766662144, 'L_scale_weight_yy': 0.0009709947068126187, 'learning_rate_yy': 0.0026572289757519005}. Best is trial 0 with value: -2.289111866011322.
[I 2026-03-17 17:07:54,492] Trial 14 pruned. 
[I 2026-03-17 17:07:55,089] Trial 2 pruned. 
[I 2026-03-17 17:07:55,925] Trial 5 pruned. 
[I 2026-03-17 17:07:56,766] Trial 3 pruned. 
[I 2026-03-17 17:07:58,503] Trial 6 pruned. 
[I 2026-03-17 17:07:59,363] Trial 15 pruned. 
[I 2026-03-17 17:08:01,184] Trial 7 pruned. 
[I 2026-03-17 17:08:02,237] Trial 16 pruned. 
[I 2026-03-17 17:08:02,408] Trial 0 finished with value: -3.2443633626302084 and parameters: {'n_layers_yy': 1, 'hidden_size_yy_l0': 4, 'context_size_yy': 2, 'num_mix_components_yy': 1, 'context_extractor_yy': 'gru', 'activation_func_yy': 'ReLU', 'L2_weight_yy': 1.2805430820566077e-08, 'L_entropy_weight_yy': 1.226730628414087e-07, 'L_sep_weight_yy': 7.515532411371717e-05, 'L_scale_weight_yy': 1.813764052946976e-10, 'learning_rate_yy': 0.008839844332907139}. Best is trial 0 with value: -3.2443633626302084.
[I 2026-03-17 17:08:06,804] Trial 0 finished with value: -2.794490723694976 and parameters: {'n_layers_yy': 2, 'hidden_size_yy_l0': 5, 'hidden_size_yy_l1': 4, 'context_size_yy': 2, 'num_mix_components_yy': 2, 'context_extractor_yy': 'lstm', 'activation_func_yy': 'GELU', 'L2_weight_yy': 5.706542085822513e-07, 'L_entropy_weight_yy': 0.00035631250590390396, 'L_sep_weight_yy': 4.7310726356777154e-07, 'L_scale_weight_yy': 0.0007827192777991951, 'learning_rate_yy': 0.001034841805833118}. Best is trial 0 with value: -2.794490723694976.
[I 2026-03-17 17:08:07,672] Trial 1 finished with value: -3.1094977822266543 and parameters: {'n_layers_yy': 1, 'hidden_size_yy_l0': 5, 'context_size_yy': 1, 'num_mix_components_yy': 3, 'context_extractor_yy': 'lstm', 'activation_func_yy': 'GELU', 'L2_weight_yy': 1.495323847664511e-08, 'L_entropy_weight_yy': 4.891027598378132e-07, 'L_sep_weight_yy': 5.526173820926724e-09, 'L_scale_weight_yy': 2.3763392700776105e-05, 'learning_rate_yy': 0.002010238452961456}. Best is trial 0 with value: -3.1169463448214536.
[I 2026-03-17 17:08:11,853] Trial 4 finished with value: -1.4433749389648438 and parameters: {'n_layers_yy': 1, 'hidden_size_yy_l0': 4, 'context_size_yy': 1, 'num_mix_components_yy': 5, 'context_extractor_yy': 'lstm', 'activation_func_yy': 'ReLU', 'L2_weight_yy': 1.4942301814887464e-08, 'L_entropy_weight_yy': 0.0003273748808436668, 'L_sep_weight_yy': 4.94488890793088e-10, 'L_scale_weight_yy': 0.0008693366593719527, 'learning_rate_yy': 0.005340220221371814}. Best is trial 1 with value: -1.4537486853966346.
[I 2026-03-17 17:08:14,837] Trial 17 finished with value: 0.005475762278534645 and parameters: {'n_layers_yy': 1, 'hidden_size_yy_l0': 6, 'context_size_yy': 3, 'num_mix_components_yy': 5, 'context_extractor_yy': 'lstm', 'activation_func_yy': 'Tanh', 'L2_weight_yy': 0.00014378303804946487, 'L_entropy_weight_yy': 1.9529583465455626e-06, 'L_sep_weight_yy': 1.0821621976254082e-07, 'L_scale_weight_yy': 2.1131109966494564e-08, 'learning_rate_yy': 0.0070568828846011445}. Best is trial 10 with value: -0.004261507544406625.
[I 2026-03-17 17:08:15,513] Trial 4 finished with value: -2.8088261393807943 and parameters: {'n_layers_yy': 2, 'hidden_size_yy_l0': 6, 'hidden_size_yy_l1': 6, 'context_size_yy': 1, 'num_mix_components_yy': 3, 'context_extractor_yy': 'lstm', 'activation_func_yy': 'ReLU', 'L2_weight_yy': 8.652020034416633e-10, 'L_entropy_weight_yy': 3.279982354973392e-08, 'L_sep_weight_yy': 3.6558663872073774e-05, 'L_scale_weight_yy': 4.398240957049714e-09, 'learning_rate_yy': 0.001381512530112966}. Best is trial 0 with value: -2.810569765121464.
[I 2026-03-17 17:08:16,735] Trial 2 finished with value: -1.824331576606496 and parameters: {'n_layers_yy': 2, 'hidden_size_yy_l0': 2, 'hidden_size_yy_l1': 5, 'context_size_yy': 2, 'num_mix_components_yy': 5, 'context_extractor_yy': 'gru', 'activation_func_yy': 'GELU', 'L2_weight_yy': 8.099959629893594e-08, 'L_entropy_weight_yy': 4.163334274769701e-10, 'L_sep_weight_yy': 2.328888827369102e-10, 'L_scale_weight_yy': 1.83361605570531e-06, 'learning_rate_yy': 0.0014265771164578037}. Best is trial 2 with value: -1.824331576606496.
[I 2026-03-17 17:08:16,838] Trial 2 finished with value: -2.3461585951729056 and parameters: {'n_layers_yy': 1, 'hidden_size_yy_l0': 5, 'context_size_yy': 2, 'num_mix_components_yy': 5, 'context_extractor_yy': 'gru', 'activation_func_yy': 'GELU', 'L2_weight_yy': 6.424448585369241e-09, 'L_entropy_weight_yy': 2.445181504297026e-09, 'L_sep_weight_yy': 5.257509164740358e-09, 'L_scale_weight_yy': 9.883480078138273e-05, 'learning_rate_yy': 0.009818787062304608}. Best is trial 0 with value: -2.3640086480201146.
[I 2026-03-17 17:08:17,635] Trial 10 finished with value: -0.5731681393462001 and parameters: {'n_layers_yy': 1, 'hidden_size_yy_l0': 4, 'context_size_yy': 4, 'num_mix_components_yy': 5, 'context_extractor_yy': 'lstm', 'activation_func_yy': 'Tanh', 'L2_weight_yy': 0.0009406336679316146, 'L_entropy_weight_yy': 3.6677611458951116e-06, 'L_sep_weight_yy': 5.7072378536930205e-06, 'L_scale_weight_yy': 1.0199161798535355e-08, 'learning_rate_yy': 0.0034136548384134506}. Best is trial 3 with value: -0.5765003902220168.
[I 2026-03-17 17:08:18,762] Trial 7 finished with value: -1.6125396512270607 and parameters: {'n_layers_yy': 2, 'hidden_size_yy_l0': 6, 'hidden_size_yy_l1': 5, 'context_size_yy': 2, 'num_mix_components_yy': 2, 'context_extractor_yy': 'lstm', 'activation_func_yy': 'ReLU', 'L2_weight_yy': 3.751265705788884e-05, 'L_entropy_weight_yy': 4.1697337244354445e-08, 'L_sep_weight_yy': 6.126072693790772e-09, 'L_scale_weight_yy': 7.229038932222853e-08, 'learning_rate_yy': 0.006667973216121376}. Best is trial 7 with value: -1.6125396512270607.
[I 2026-03-17 17:08:18,945] Trial 5 pruned. 
[I 2026-03-17 17:08:19,832] Trial 3 pruned. 
[I 2026-03-17 17:08:19,991] Trial 0 finished with value: -2.4409490172085038 and parameters: {'n_layers_yy': 1, 'hidden_size_yy_l0': 3, 'context_size_yy': 2, 'num_mix_components_yy': 3, 'context_extractor_yy': 'lstm', 'activation_func_yy': 'GELU', 'L2_weight_yy': 0.0004609508009982751, 'L_entropy_weight_yy': 1.2664638179896592e-05, 'L_sep_weight_yy': 2.939118076468103e-08, 'L_scale_weight_yy': 3.7636028765601765e-07, 'learning_rate_yy': 0.000731476335284179}. Best is trial 0 with value: -2.4409490172085038.
[I 2026-03-17 17:08:20,382] Trial 3 finished with value: -0.3916620071458374 and parameters: {'n_layers_yy': 1, 'hidden_size_yy_l0': 6, 'context_size_yy': 1, 'num_mix_components_yy': 4, 'context_extractor_yy': 'gru', 'activation_func_yy': 'Tanh', 'L2_weight_yy': 5.469671575264243e-05, 'L_entropy_weight_yy': 4.276898487269483e-07, 'L_sep_weight_yy': 5.7115958335845174e-05, 'L_scale_weight_yy': 3.55312404429433e-08, 'learning_rate_yy': 0.001633955097291645}. Best is trial 2 with value: -0.4153653549336058.
[I 2026-03-17 17:08:20,486] Trial 2 finished with value: -1.6677701443405077 and parameters: {'n_layers_yy': 1, 'hidden_size_yy_l0': 3, 'context_size_yy': 1, 'num_mix_components_yy': 4, 'context_extractor_yy': 'gru', 'activation_func_yy': 'Tanh', 'L2_weight_yy': 5.2363768609598e-10, 'L_entropy_weight_yy': 0.0001644325930923849, 'L_sep_weight_yy': 3.802780080860304e-07, 'L_scale_weight_yy': 1.1539073234230659e-10, 'learning_rate_yy': 0.008073498912660234}. Best is trial 2 with value: -1.6677701443405077.
[I 2026-03-17 17:08:20,519] Trial 11 pruned. 
[I 2026-03-17 17:08:22,201] Trial 8 pruned. 
[I 2026-03-17 17:08:22,790] Trial 5 pruned. 
[I 2026-03-17 17:08:23,842] Trial 3 pruned. 
[I 2026-03-17 17:08:25,988] Trial 4 pruned. 
[I 2026-03-17 17:08:27,116] Trial 12 pruned. 
[I 2026-03-17 17:08:27,138] Trial 3 pruned. 
[I 2026-03-17 17:08:27,358] Trial 4 pruned. 
[I 2026-03-17 17:08:27,558] Trial 18 pruned. 
[I 2026-03-17 17:08:28,491] Trial 5 pruned. 
[I 2026-03-17 17:08:30,230] Trial 13 pruned. 
[I 2026-03-17 17:08:30,249] Trial 9 pruned. 
[I 2026-03-17 17:08:30,975] Trial 2 finished with value: -1.852375329243005 and parameters: {'n_layers_yy': 1, 'hidden_size_yy_l0': 2, 'context_size_yy': 3, 'num_mix_components_yy': 4, 'context_extractor_yy': 'gru', 'activation_func_yy': 'Tanh', 'L2_weight_yy': 1.0281282103986923e-06, 'L_entropy_weight_yy': 9.206497724107581e-06, 'L_sep_weight_yy': 0.0003159844568224918, 'L_scale_weight_yy': 7.997060197728583e-07, 'learning_rate_yy': 0.0016437018557907664}. Best is trial 2 with value: -1.852375329243005.
[I 2026-03-17 17:08:32,799] Trial 19 pruned. 
[I 2026-03-17 17:08:33,618] Trial 14 pruned. 
[I 2026-03-17 17:08:33,817] Trial 10 pruned. 
[I 2026-03-17 17:08:35,305] Trial 20 pruned. 
[I 2026-03-17 17:08:36,900] Trial 15 pruned. 
[I 2026-03-17 17:08:37,531] Trial 11 pruned. 
[I 2026-03-17 17:08:37,679] Trial 4 pruned. 
[I 2026-03-17 17:08:39,605] Trial 16 pruned. 
[I 2026-03-17 17:08:39,730] Trial 8 finished with value: -0.8164812592319055 and parameters: {'n_layers_yy': 1, 'hidden_size_yy_l0': 2, 'context_size_yy': 3, 'num_mix_components_yy': 5, 'context_extractor_yy': 'gru', 'activation_func_yy': 'GELU', 'L2_weight_yy': 2.0633848592300163e-10, 'L_entropy_weight_yy': 2.907833050429732e-10, 'L_sep_weight_yy': 5.3699532740044326e-09, 'L_scale_weight_yy': 9.371724639518807e-07, 'learning_rate_yy': 0.0037898490130253986}. Best is trial 2 with value: -0.833493141163047.
[I 2026-03-17 17:08:39,875] Trial 4 pruned. 
[I 2026-03-17 17:08:42,491] Trial 9 pruned. 
[I 2026-03-17 17:08:42,926] Trial 6 pruned. 
[I 2026-03-17 17:08:43,189] Trial 17 pruned. 
[I 2026-03-17 17:08:43,549] Trial 5 pruned. 
[I 2026-03-17 17:08:44,213] Trial 1 finished with value: -2.089371130855073 and parameters: {'n_layers_yy': 2, 'hidden_size_yy_l0': 3, 'hidden_size_yy_l1': 4, 'context_size_yy': 4, 'num_mix_components_yy': 5, 'context_extractor_yy': 'lstm', 'activation_func_yy': 'GELU', 'L2_weight_yy': 8.181287228242445e-10, 'L_entropy_weight_yy': 5.804100417995279e-09, 'L_sep_weight_yy': 7.642927795869357e-06, 'L_scale_weight_yy': 3.3319750752432843e-06, 'learning_rate_yy': 0.0036142822435140973}. Best is trial 1 with value: -2.089371130855073.
[I 2026-03-17 17:08:44,367] Trial 3 finished with value: -1.2397739318734837 and parameters: {'n_layers_yy': 1, 'hidden_size_yy_l0': 6, 'context_size_yy': 3, 'num_mix_components_yy': 3, 'context_extractor_yy': 'gru', 'activation_func_yy': 'Tanh', 'L2_weight_yy': 1.3829630075458131e-05, 'L_entropy_weight_yy': 1.1960391149476226e-10, 'L_sep_weight_yy': 4.4660107294312684e-07, 'L_scale_weight_yy': 1.871661647812612e-10, 'learning_rate_yy': 0.004323856769937778}. Best is trial 1 with value: -1.260024502625527.
[I 2026-03-17 17:08:45,122] Trial 10 pruned. 
[I 2026-03-17 17:08:46,541] Trial 6 finished with value: -0.4195212727360681 and parameters: {'n_layers_yy': 2, 'hidden_size_yy_l0': 4, 'hidden_size_yy_l1': 6, 'context_size_yy': 4, 'num_mix_components_yy': 4, 'context_extractor_yy': 'lstm', 'activation_func_yy': 'GELU', 'L2_weight_yy': 0.0003941318007345506, 'L_entropy_weight_yy': 7.040741974122372e-10, 'L_sep_weight_yy': 2.6733716410039156e-07, 'L_scale_weight_yy': 8.817731441293637e-09, 'learning_rate_yy': 0.006118725226748319}. Best is trial 6 with value: -0.4195212727360681.
[I 2026-03-17 17:08:48,047] Trial 2 finished with value: -1.963057635752568 and parameters: {'n_layers_yy': 1, 'hidden_size_yy_l0': 3, 'context_size_yy': 1, 'num_mix_components_yy': 1, 'context_extractor_yy': 'gru', 'activation_func_yy': 'Tanh', 'L2_weight_yy': 0.00013658155785527522, 'L_entropy_weight_yy': 2.4671078309577064e-08, 'L_sep_weight_yy': 6.708245596813547e-08, 'L_scale_weight_yy': 0.0009499479831728483, 'learning_rate_yy': 0.0015850306535119985}. Best is trial 1 with value: -1.9741431522447364.
[I 2026-03-17 17:08:49,435] Trial 7 pruned. 
[I 2026-03-17 17:08:49,882] Trial 6 finished with value: -1.4518167349008413 and parameters: {'n_layers_yy': 1, 'hidden_size_yy_l0': 6, 'context_size_yy': 4, 'num_mix_components_yy': 4, 'context_extractor_yy': 'gru', 'activation_func_yy': 'ReLU', 'L2_weight_yy': 2.672422070143542e-10, 'L_entropy_weight_yy': 2.4460592423840916e-10, 'L_sep_weight_yy': 9.261134530283026e-07, 'L_scale_weight_yy': 7.675574684736315e-09, 'learning_rate_yy': 0.0029017777314475873}. Best is trial 1 with value: -1.4537486853966346.
[I 2026-03-17 17:08:50,936] Trial 7 pruned. 
[I 2026-03-17 17:08:51,841] Trial 21 finished with value: -0.0013505913490472839 and parameters: {'n_layers_yy': 2, 'hidden_size_yy_l0': 6, 'hidden_size_yy_l1': 5, 'context_size_yy': 3, 'num_mix_components_yy': 5, 'context_extractor_yy': 'lstm', 'activation_func_yy': 'Tanh', 'L2_weight_yy': 0.0005516144754554808, 'L_entropy_weight_yy': 0.000660845733336183, 'L_sep_weight_yy': 2.4193972489886636e-08, 'L_scale_weight_yy': 3.16908598919022e-05, 'learning_rate_yy': 0.0042038601199229685}. Best is trial 10 with value: -0.004261507544406625.
