[I 2026-03-17 17:18:46,036] Trial 28 finished with value: -1.9594610530825198 and parameters: {'n_layers_yy': 1, 'hidden_size_yy_l0': 6, 'context_size_yy': 2, 'num_mix_components_yy': 4, 'context_extractor_yy': 'lstm', 'activation_func_yy': 'GELU', 'L2_weight_yy': 9.881153474238642e-06, 'L_entropy_weight_yy': 2.981173315237656e-05, 'L_sep_weight_yy': 4.32647216988302e-07, 'L_scale_weight_yy': 1.1164629879960067e-06, 'learning_rate_yy': 0.0015174320300604584}. Best is trial 1 with value: -1.9741431522447364.
[I 2026-03-17 17:18:46,263] Trial 43 pruned. 
[I 2026-03-17 17:18:46,845] Trial 13 finished with value: -2.9656979651746878 and parameters: {'n_layers_yy': 1, 'hidden_size_yy_l0': 5, 'context_size_yy': 4, 'num_mix_components_yy': 4, 'context_extractor_yy': 'gru', 'activation_func_yy': 'GELU', 'L2_weight_yy': 3.091125214592646e-08, 'L_entropy_weight_yy': 2.323305484288961e-06, 'L_sep_weight_yy': 1.6668444258664175e-06, 'L_scale_weight_yy': 0.00011689307717915592, 'learning_rate_yy': 0.002764754444442189}. Best is trial 9 with value: -2.9754424140841684.
[I 2026-03-17 17:18:46,957] Trial 11 pruned. 
[I 2026-03-17 17:18:47,418] Trial 17 pruned. 
[I 2026-03-17 17:18:48,338] Trial 20 pruned. 
[I 2026-03-17 17:18:51,238] Trial 44 pruned. 
[I 2026-03-17 17:18:51,855] Trial 36 pruned. 
[I 2026-03-17 17:18:52,384] Trial 39 pruned. 
[I 2026-03-17 17:18:52,405] Trial 12 pruned. 
[I 2026-03-17 17:18:52,490] Trial 44 pruned. 
[I 2026-03-17 17:18:52,948] Trial 18 pruned. 
[I 2026-03-17 17:18:54,323] Trial 45 pruned. 
[I 2026-03-17 17:18:54,731] Trial 45 pruned. 
[I 2026-03-17 17:18:54,737] Trial 25 pruned. 
[I 2026-03-17 17:18:56,936] Trial 46 pruned. 
[I 2026-03-17 17:18:57,338] Trial 13 pruned. 
[I 2026-03-17 17:18:59,305] Trial 17 pruned. 
[I 2026-03-17 17:19:00,176] Trial 15 finished with value: -2.4337177802722314 and parameters: {'n_layers_yy': 1, 'hidden_size_yy_l0': 6, 'context_size_yy': 2, 'num_mix_components_yy': 2, 'context_extractor_yy': 'gru', 'activation_func_yy': 'GELU', 'L2_weight_yy': 0.0008202432455726265, 'L_entropy_weight_yy': 3.221176226832537e-05, 'L_sep_weight_yy': 1.7929042150749279e-06, 'L_scale_weight_yy': 1.4983498935225133e-09, 'learning_rate_yy': 0.0039021995702303576}. Best is trial 2 with value: -2.489143682537181.
[I 2026-03-17 17:19:00,699] Trial 40 pruned. 
[I 2026-03-17 17:19:01,341] Trial 46 pruned. 
[I 2026-03-17 17:19:01,903] Trial 19 pruned. 
[I 2026-03-17 17:19:03,137] Trial 14 pruned. 
[I 2026-03-17 17:19:04,107] Trial 22 finished with value: -2.091851226633791 and parameters: {'n_layers_yy': 2, 'hidden_size_yy_l0': 2, 'hidden_size_yy_l1': 4, 'context_size_yy': 1, 'num_mix_components_yy': 5, 'context_extractor_yy': 'lstm', 'activation_func_yy': 'ReLU', 'L2_weight_yy': 2.384199700151109e-07, 'L_entropy_weight_yy': 0.00017620148376180434, 'L_sep_weight_yy': 2.8426459871159685e-08, 'L_scale_weight_yy': 4.0698696215297956e-08, 'learning_rate_yy': 0.009636411993274653}. Best is trial 22 with value: -2.091851226633791.
[I 2026-03-17 17:19:05,139] Trial 29 pruned. 
[I 2026-03-17 17:19:05,880] Trial 26 pruned. 
[I 2026-03-17 17:19:07,805] Trial 47 pruned. 
[I 2026-03-17 17:19:07,832] Trial 30 pruned. 
[I 2026-03-17 17:19:08,584] Trial 15 pruned. 
[I 2026-03-17 17:19:10,521] Trial 27 pruned. 
[I 2026-03-17 17:19:10,539] Trial 23 pruned. 
[I 2026-03-17 17:19:11,111] Trial 48 pruned. 
[I 2026-03-17 17:19:13,417] Trial 16 pruned. 
[I 2026-03-17 17:19:13,485] Trial 49 pruned. 
Optimize task 27: group_id: POm, neuron_id: 61
Starting optimization for task 27...

--- Data Summary ---
Total events for target process 11540
Data Time: 900 seconds
Using device: cuda
Number of events in target process: 11540
Only one process provided, preparing dataloaders for the reduced model.
Reduced model ln_yy : 426.48490 nats/sec, 33.26139 nats/event
Reduced model Log loss : -1.60752
Number of events in target process: 11540
Only one process provided, preparing dataloaders for the reduced model.
Reduced model ln_yy : 427.63079 nats/sec, 33.35075 nats/event
Reduced model Log loss : -1.61185
Number of events in target process: 11540
Only one process provided, preparing dataloaders for the reduced model.
Number of events in target process: 11540
Only one process provided, preparing dataloaders for the reduced model.
Number of events in target process: 11540
Only one process provided, preparing dataloaders for the reduced model.
Number of events in target process: 11540
Only one process provided, preparing dataloaders for the reduced model.
Number of events in target process: 11540
Only one process provided, preparing dataloaders for the reduced model.
Number of events in target process: 11540
Only one process provided, preparing dataloaders for the reduced model.
Reduced model ln_yy : 427.41521 nats/sec, 33.33394 nats/event
Reduced model Log loss : -1.61254
Number of events in target process: 11540
Only one process provided, preparing dataloaders for the reduced model.
Number of events in target process: 11540
Only one process provided, preparing dataloaders for the reduced model.
Number of events in target process: 11540
Only one process provided, preparing dataloaders for the reduced model.
Number of events in target process: 11540
Only one process provided, preparing dataloaders for the reduced model.
Number of events in target process: 11540
Only one process provided, preparing dataloaders for the reduced model.
Reduced model ln_yy : 424.26202 nats/sec, 33.08803 nats/event
Reduced model Log loss : -1.61316
Number of events in target process: 11540
Only one process provided, preparing dataloaders for the reduced model.
Reduced model ln_yy : 423.41303 nats/sec, 33.02181 nats/event
Reduced model Log loss : -1.61258
Number of events in target process: 11540
Only one process provided, preparing dataloaders for the reduced model.
Reduced model ln_yy : 427.19681 nats/sec, 33.31691 nats/event
Reduced model Log loss : -1.61186
Number of events in target process: 11540
Only one process provided, preparing dataloaders for the reduced model.
Number of events in target process: 11540
Only one process provided, preparing dataloaders for the reduced model.
Number of events in target process: 11540
Only one process provided, preparing dataloaders for the reduced model.
Number of events in target process: 11540
Only one process provided, preparing dataloaders for the reduced model.
Reduced model ln_yy : 427.09017 nats/sec, 33.30859 nats/event
Reduced model Log loss : -1.61271
Number of events in target process: 11540
Only one process provided, preparing dataloaders for the reduced model.
Number of events in target process: 11540
Only one process provided, preparing dataloaders for the reduced model.
Number of events in target process: 11540
Only one process provided, preparing dataloaders for the reduced model.
Number of events in target process: 11540
Only one process provided, preparing dataloaders for the reduced model.
Number of events in target process: 11540
Only one process provided, preparing dataloaders for the reduced model.
Number of events in target process: 11540
Only one process provided, preparing dataloaders for the reduced model.
Number of events in target process: 11540
Only one process provided, preparing dataloaders for the reduced model.
Number of events in target process: 11540
Only one process provided, preparing dataloaders for the reduced model.
Number of events in target process: 11540
Only one process provided, preparing dataloaders for the reduced model.
Reduced model ln_yy : 428.81083 nats/sec, 33.44279 nats/event
Reduced model Log loss : -1.61227
Number of events in target process: 11540
Only one process provided, preparing dataloaders for the reduced model.
Number of events in target process: 11540
Only one process provided, preparing dataloaders for the reduced model.
Number of events in target process: 11540
Only one process provided, preparing dataloaders for the reduced model.
Number of events in target process: 11540
Only one process provided, preparing dataloaders for the reduced model.
Reduced model ln_yy : 425.04168 nats/sec, 33.14883 nats/event
Reduced model Log loss : -1.61307
Number of events in target process: 11540
Only one process provided, preparing dataloaders for the reduced model.
Number of events in target process: 11540
Only one process provided, preparing dataloaders for the reduced model.
Number of events in target process: 11540
Only one process provided, preparing dataloaders for the reduced model.
Number of events in target process: 11540
Only one process provided, preparing dataloaders for the reduced model.
Number of events in target process: 11540
Only one process provided, preparing dataloaders for the reduced model.
Number of events in target process: 11540
Only one process provided, preparing dataloaders for the reduced model.
Number of events in target process: 11540
Only one process provided, preparing dataloaders for the reduced model.
Number of events in target process: 11540
Only one process provided, preparing dataloaders for the reduced model.
Number of events in target process: 11540
Only one process provided, preparing dataloaders for the reduced model.
Number of events in target process: 11540
Only one process provided, preparing dataloaders for the reduced model.
Reduced model ln_yy : 428.03476 nats/sec, 33.38226 nats/event
Reduced model Log loss : -1.61253
Number of events in target process: 11540
Only one process provided, preparing dataloaders for the reduced model.
Number of events in target process: 11540
Only one process provided, preparing dataloaders for the reduced model.
Reduced model ln_yy : 428.60960 nats/sec, 33.42709 nats/event
Reduced model Log loss : -1.61184
Number of events in target process: 11540
Only one process provided, preparing dataloaders for the reduced model.
Number of events in target process: 11540
Only one process provided, preparing dataloaders for the reduced model.
Number of events in target process: 11540
Only one process provided, preparing dataloaders for the reduced model.
Number of events in target process: 11540
Only one process provided, preparing dataloaders for the reduced model.
Number of events in target process: 11540
Only one process provided, preparing dataloaders for the reduced model.
Number of events in target process: 11540
Only one process provided, preparing dataloaders for the reduced model.
Best trial:
  Value: -1.6131555846140806
  Params: {'n_layers_yy': 2, 'hidden_size_yy_l0': 2, 'hidden_size_yy_l1': 6, 'context_size_yy': 3, 'num_mix_components_yy': 3, 'context_extractor_yy': 'lstm', 'activation_func_yy': 'Tanh', 'L2_weight_yy': 0.0009041581724265024, 'L_entropy_weight_yy': 5.588857933938169e-09, 'L_sep_weight_yy': 4.260772437619117e-09, 'L_scale_weight_yy': 4.2290269748325855e-08, 'learning_rate_yy': 0.004056601406219838}
Full best configuration saved to results/opt/opt_reduced_27_best_config.txt
Optimization finished.
[I 2026-03-17 17:19:14,025] Trial 16 pruned. 
[I 2026-03-17 17:19:16,408] Trial 47 pruned. 
[I 2026-03-17 17:19:17,308] Trial 24 finished with value: -1.9860150014876785 and parameters: {'n_layers_yy': 2, 'hidden_size_yy_l0': 4, 'hidden_size_yy_l1': 5, 'context_size_yy': 4, 'num_mix_components_yy': 1, 'context_extractor_yy': 'gru', 'activation_func_yy': 'Tanh', 'L2_weight_yy': 4.510505783917802e-05, 'L_entropy_weight_yy': 4.032910051616316e-08, 'L_sep_weight_yy': 7.067590837117624e-06, 'L_scale_weight_yy': 4.45561409920854e-09, 'learning_rate_yy': 0.004443320640302025}. Best is trial 24 with value: -1.9860150014876785.
[I 2026-03-17 17:19:17,423] Trial 31 finished with value: -2.602390305447814 and parameters: {'n_layers_yy': 1, 'hidden_size_yy_l0': 6, 'context_size_yy': 4, 'num_mix_components_yy': 3, 'context_extractor_yy': 'lstm', 'activation_func_yy': 'ReLU', 'L2_weight_yy': 4.648309687520692e-07, 'L_entropy_weight_yy': 1.683185589014341e-08, 'L_sep_weight_yy': 8.964936075934949e-07, 'L_scale_weight_yy': 1.0873109887502534e-05, 'learning_rate_yy': 0.008222384437626828}. Best is trial 7 with value: -2.6326792002135244.
[I 2026-03-17 17:19:19,732] Trial 17 pruned. 
[I 2026-03-17 17:19:20,250] Trial 42 finished with value: -1.8197811037025013 and parameters: {'n_layers_yy': 2, 'hidden_size_yy_l0': 2, 'hidden_size_yy_l1': 2, 'context_size_yy': 3, 'num_mix_components_yy': 5, 'context_extractor_yy': 'lstm', 'activation_func_yy': 'ReLU', 'L2_weight_yy': 0.00016754494446745698, 'L_entropy_weight_yy': 5.722204279882662e-08, 'L_sep_weight_yy': 3.452626494834322e-10, 'L_scale_weight_yy': 0.00029516548856986107, 'learning_rate_yy': 0.005858547755344209}. Best is trial 2 with value: -1.824331576606496.
[I 2026-03-17 17:19:22,625] Trial 43 pruned. 
[I 2026-03-17 17:19:28,110] Trial 25 finished with value: -1.9109804614622201 and parameters: {'n_layers_yy': 2, 'hidden_size_yy_l0': 2, 'hidden_size_yy_l1': 4, 'context_size_yy': 3, 'num_mix_components_yy': 5, 'context_extractor_yy': 'lstm', 'activation_func_yy': 'ReLU', 'L2_weight_yy': 7.041862011470711e-07, 'L_entropy_weight_yy': 6.264781523088073e-06, 'L_sep_weight_yy': 1.3642075234747358e-09, 'L_scale_weight_yy': 8.293920783794237e-09, 'learning_rate_yy': 0.005177808050810728}. Best is trial 18 with value: -1.9113758963969216.
[I 2026-03-17 17:19:30,187] Trial 41 finished with value: -1.6752983397557608 and parameters: {'n_layers_yy': 1, 'hidden_size_yy_l0': 6, 'context_size_yy': 4, 'num_mix_components_yy': 4, 'context_extractor_yy': 'gru', 'activation_func_yy': 'GELU', 'L2_weight_yy': 2.6333248105096647e-06, 'L_entropy_weight_yy': 1.866937873918725e-06, 'L_sep_weight_yy': 1.196514609508922e-08, 'L_scale_weight_yy': 1.131824495979722e-10, 'learning_rate_yy': 0.009859003657258383}. Best is trial 2 with value: -1.677622742403132.
[I 2026-03-17 17:19:33,931] Trial 18 pruned. 
[I 2026-03-17 17:19:34,094] Trial 37 finished with value: -1.2682849016736042 and parameters: {'n_layers_yy': 1, 'hidden_size_yy_l0': 4, 'context_size_yy': 2, 'num_mix_components_yy': 4, 'context_extractor_yy': 'lstm', 'activation_func_yy': 'Tanh', 'L2_weight_yy': 4.746665576755724e-09, 'L_entropy_weight_yy': 8.355044820206037e-05, 'L_sep_weight_yy': 0.0001937301829946685, 'L_scale_weight_yy': 2.6009624585388687e-08, 'learning_rate_yy': 0.005983594591158381}. Best is trial 28 with value: -1.2748027526517012.
[I 2026-03-17 17:19:34,270] Trial 18 finished with value: -1.782803375552399 and parameters: {'n_layers_yy': 2, 'hidden_size_yy_l0': 5, 'hidden_size_yy_l1': 5, 'context_size_yy': 3, 'num_mix_components_yy': 4, 'context_extractor_yy': 'lstm', 'activation_func_yy': 'GELU', 'L2_weight_yy': 1.8506649660791627e-06, 'L_entropy_weight_yy': 5.314082509281624e-06, 'L_sep_weight_yy': 1.4624430692162844e-09, 'L_scale_weight_yy': 7.061682926887682e-07, 'learning_rate_yy': 0.009926467139435348}. Best is trial 8 with value: -1.786668244949495.
[I 2026-03-17 17:19:35,545] Trial 26 pruned. 
[I 2026-03-17 17:19:37,606] Trial 23 pruned. 
[I 2026-03-17 17:19:38,073] Trial 27 pruned. 
[I 2026-03-17 17:19:38,591] Trial 19 pruned. 
[I 2026-03-17 17:19:39,255] Trial 21 finished with value: -1.8547907860346826 and parameters: {'n_layers_yy': 1, 'hidden_size_yy_l0': 4, 'context_size_yy': 3, 'num_mix_components_yy': 4, 'context_extractor_yy': 'lstm', 'activation_func_yy': 'Tanh', 'L2_weight_yy': 5.394133040185198e-07, 'L_entropy_weight_yy': 1.4877739758004465e-06, 'L_sep_weight_yy': 1.1307548484292173e-05, 'L_scale_weight_yy': 1.0209533740202057e-09, 'learning_rate_yy': 0.009536309302761973}. Best is trial 10 with value: -1.8554935362796692.
[I 2026-03-17 17:19:39,456] Trial 10 finished with value: -3.2448391031901043 and parameters: {'n_layers_yy': 1, 'hidden_size_yy_l0': 5, 'context_size_yy': 4, 'num_mix_components_yy': 5, 'context_extractor_yy': 'gru', 'activation_func_yy': 'GELU', 'L2_weight_yy': 0.0009169960470521683, 'L_entropy_weight_yy': 1.0628993855131003e-10, 'L_sep_weight_yy': 3.604818321324318e-06, 'L_scale_weight_yy': 3.6993598315412006e-09, 'learning_rate_yy': 0.003388375992373571}. Best is trial 3 with value: -3.248812548828125.
[I 2026-03-17 17:19:39,877] Trial 38 pruned. 
[I 2026-03-17 17:19:40,390] Trial 24 finished with value: -2.44579140772574 and parameters: {'n_layers_yy': 2, 'hidden_size_yy_l0': 4, 'hidden_size_yy_l1': 5, 'context_size_yy': 4, 'num_mix_components_yy': 3, 'context_extractor_yy': 'lstm', 'activation_func_yy': 'Tanh', 'L2_weight_yy': 0.0008917894030875098, 'L_entropy_weight_yy': 2.0307397699207088e-08, 'L_sep_weight_yy': 2.995113920749841e-07, 'L_scale_weight_yy': 3.710931358179767e-08, 'learning_rate_yy': 0.004009791453985245}. Best is trial 2 with value: -2.476197165819489.
[I 2026-03-17 17:19:40,609] Trial 28 pruned. 
[I 2026-03-17 17:19:41,072] Trial 28 pruned. 
[I 2026-03-17 17:19:42,307] Trial 20 pruned. 
[I 2026-03-17 17:19:44,097] Trial 29 pruned. 
[I 2026-03-17 17:19:44,804] Trial 25 pruned. 
[I 2026-03-17 17:19:46,653] Trial 19 pruned. 
[I 2026-03-17 17:19:47,204] Trial 30 pruned. 
[I 2026-03-17 17:19:48,523] Trial 28 pruned. 
[I 2026-03-17 17:19:49,560] Trial 11 finished with value: -2.800033546863494 and parameters: {'n_layers_yy': 1, 'hidden_size_yy_l0': 6, 'context_size_yy': 3, 'num_mix_components_yy': 3, 'context_extractor_yy': 'lstm', 'activation_func_yy': 'ReLU', 'L2_weight_yy': 6.2028117134302e-08, 'L_entropy_weight_yy': 5.852870911509038e-07, 'L_sep_weight_yy': 3.7231466982794064e-10, 'L_scale_weight_yy': 1.1488958284406915e-10, 'learning_rate_yy': 0.009983218079553496}. Best is trial 3 with value: -2.804861466675104.
[I 2026-03-17 17:19:51,286] Trial 31 finished with value: -1.9742766261003297 and parameters: {'n_layers_yy': 1, 'hidden_size_yy_l0': 4, 'context_size_yy': 4, 'num_mix_components_yy': 3, 'context_extractor_yy': 'lstm', 'activation_func_yy': 'ReLU', 'L2_weight_yy': 1.5398656300628746e-09, 'L_entropy_weight_yy': 0.00021958378379981303, 'L_sep_weight_yy': 1.4339389310222512e-08, 'L_scale_weight_yy': 3.711855987586791e-07, 'learning_rate_yy': 0.009981075486558294}. Best is trial 31 with value: -1.9742766261003297.
[I 2026-03-17 17:19:51,527] Trial 48 finished with value: -1.6713392846967534 and parameters: {'n_layers_yy': 2, 'hidden_size_yy_l0': 2, 'hidden_size_yy_l1': 6, 'context_size_yy': 4, 'num_mix_components_yy': 4, 'context_extractor_yy': 'gru', 'activation_func_yy': 'GELU', 'L2_weight_yy': 7.033191171504218e-05, 'L_entropy_weight_yy': 0.00024171328492147452, 'L_sep_weight_yy': 7.441832176851098e-10, 'L_scale_weight_yy': 0.00011622084895454693, 'learning_rate_yy': 0.007533880049930335}. Best is trial 48 with value: -1.6713392846967534.
[I 2026-03-17 17:19:52,372] Trial 20 pruned. 
[I 2026-03-17 17:19:52,904] Trial 21 pruned. 
[I 2026-03-17 17:19:53,854] Trial 31 pruned. 
[I 2026-03-17 17:19:56,210] Trial 26 pruned. 
[I 2026-03-17 17:19:56,514] Trial 11 pruned. 
[I 2026-03-17 17:19:56,678] Trial 32 finished with value: -2.6020711836929213 and parameters: {'n_layers_yy': 1, 'hidden_size_yy_l0': 6, 'context_size_yy': 4, 'num_mix_components_yy': 2, 'context_extractor_yy': 'lstm', 'activation_func_yy': 'ReLU', 'L2_weight_yy': 3.0000313395075295e-07, 'L_entropy_weight_yy': 3.091481566672302e-09, 'L_sep_weight_yy': 6.227685749260808e-07, 'L_scale_weight_yy': 0.0001108039128685646, 'learning_rate_yy': 0.009837350295784468}. Best is trial 7 with value: -2.6326792002135244.
[I 2026-03-17 17:19:56,794] Trial 32 pruned. 
[I 2026-03-17 17:19:56,921] Trial 29 pruned. 
[I 2026-03-17 17:19:59,763] Trial 33 pruned. 
[I 2026-03-17 17:20:01,937] Trial 18 pruned. 
[I 2026-03-17 17:20:02,862] Trial 34 pruned. 
[I 2026-03-17 17:20:03,736] Trial 22 pruned. 
[I 2026-03-17 17:20:04,952] Trial 42 finished with value: -1.6752153329698012 and parameters: {'n_layers_yy': 1, 'hidden_size_yy_l0': 6, 'context_size_yy': 4, 'num_mix_components_yy': 4, 'context_extractor_yy': 'gru', 'activation_func_yy': 'GELU', 'L2_weight_yy': 4.3007013368829444e-05, 'L_entropy_weight_yy': 2.7456817650261247e-06, 'L_sep_weight_yy': 4.532466310834984e-09, 'L_scale_weight_yy': 2.347831521067345e-10, 'learning_rate_yy': 0.005754069088337731}. Best is trial 2 with value: -1.677622742403132.
[I 2026-03-17 17:20:05,740] Trial 35 pruned. 
[I 2026-03-17 17:20:08,201] Trial 27 pruned. 
[I 2026-03-17 17:20:08,673] Trial 36 pruned. 
[I 2026-03-17 17:20:09,643] Trial 44 finished with value: -1.7957302153990398 and parameters: {'n_layers_yy': 2, 'hidden_size_yy_l0': 2, 'hidden_size_yy_l1': 2, 'context_size_yy': 4, 'num_mix_components_yy': 5, 'context_extractor_yy': 'lstm', 'activation_func_yy': 'ReLU', 'L2_weight_yy': 0.00021256737166903443, 'L_entropy_weight_yy': 2.573471765023923e-07, 'L_sep_weight_yy': 2.9250308516210306e-10, 'L_scale_weight_yy': 3.0794194243693135e-05, 'learning_rate_yy': 0.0045930829537367225}. Best is trial 2 with value: -1.824331576606496.
[I 2026-03-17 17:20:09,912] Trial 25 finished with value: -1.9603743733427699 and parameters: {'n_layers_yy': 2, 'hidden_size_yy_l0': 3, 'hidden_size_yy_l1': 5, 'context_size_yy': 4, 'num_mix_components_yy': 1, 'context_extractor_yy': 'gru', 'activation_func_yy': 'Tanh', 'L2_weight_yy': 7.606522012497822e-05, 'L_entropy_weight_yy': 3.59693363535105e-08, 'L_sep_weight_yy': 4.848891912425008e-06, 'L_scale_weight_yy': 1.427339121187473e-10, 'learning_rate_yy': 0.004512043488900247}. Best is trial 24 with value: -1.9860150014876785.
[I 2026-03-17 17:20:10,535] Trial 39 finished with value: -1.2733718533612883 and parameters: {'n_layers_yy': 1, 'hidden_size_yy_l0': 5, 'context_size_yy': 4, 'num_mix_components_yy': 5, 'context_extractor_yy': 'lstm', 'activation_func_yy': 'GELU', 'L2_weight_yy': 2.8999995380655357e-10, 'L_entropy_weight_yy': 0.00015068676426634715, 'L_sep_weight_yy': 8.96130776417246e-07, 'L_scale_weight_yy': 3.407144192909939e-05, 'learning_rate_yy': 0.00868565456542358}. Best is trial 28 with value: -1.2748027526517012.
