[I 2026-03-17 17:13:54,112] Trial 13 finished with value: -1.899952738747668 and parameters: {'n_layers_yy': 1, 'hidden_size_yy_l0': 5, 'context_size_yy': 3, 'num_mix_components_yy': 4, 'context_extractor_yy': 'gru', 'activation_func_yy': 'Tanh', 'L2_weight_yy': 3.0473491533945895e-05, 'L_entropy_weight_yy': 0.0008072680298634394, 'L_sep_weight_yy': 1.1685455529056838e-06, 'L_scale_weight_yy': 1.39085006428795e-09, 'learning_rate_yy': 0.0021421911168300442}. Best is trial 4 with value: -1.9076621166627798.
[I 2026-03-17 17:13:54,607] Trial 16 finished with value: -1.2319929225167152 and parameters: {'n_layers_yy': 2, 'hidden_size_yy_l0': 3, 'hidden_size_yy_l1': 5, 'context_size_yy': 1, 'num_mix_components_yy': 3, 'context_extractor_yy': 'lstm', 'activation_func_yy': 'Tanh', 'L2_weight_yy': 5.097169445628341e-08, 'L_entropy_weight_yy': 7.082531325824802e-08, 'L_sep_weight_yy': 3.0840439276960757e-09, 'L_scale_weight_yy': 6.826533977693552e-05, 'learning_rate_yy': 0.001533459096540878}. Best is trial 9 with value: -1.2718806099318753.
[I 2026-03-17 17:13:57,409] Trial 33 pruned. 
[I 2026-03-17 17:13:57,889] Trial 14 pruned. 
[I 2026-03-17 17:13:58,018] Trial 19 pruned. 
[I 2026-03-17 17:13:58,158] Trial 17 pruned. 
[I 2026-03-17 17:13:58,579] Trial 42 pruned. 
[I 2026-03-17 17:13:58,904] Trial 35 pruned. 
[I 2026-03-17 17:13:59,024] Trial 40 pruned. 
[I 2026-03-17 17:13:59,387] Trial 9 pruned. 
[I 2026-03-17 17:13:59,457] Trial 17 pruned. 
[I 2026-03-17 17:14:01,188] Trial 20 pruned. 
[I 2026-03-17 17:14:01,587] Trial 36 pruned. 
[I 2026-03-17 17:14:02,582] Trial 34 pruned. 
[I 2026-03-17 17:14:03,847] Trial 41 pruned. 
[I 2026-03-17 17:14:04,149] Trial 37 pruned. 
[I 2026-03-17 17:14:05,810] Trial 3 finished with value: -2.757216847916007 and parameters: {'n_layers_yy': 1, 'hidden_size_yy_l0': 4, 'context_size_yy': 1, 'num_mix_components_yy': 2, 'context_extractor_yy': 'lstm', 'activation_func_yy': 'GELU', 'L2_weight_yy': 2.815776901178427e-10, 'L_entropy_weight_yy': 0.0002388673170043776, 'L_sep_weight_yy': 2.980230352638982e-08, 'L_scale_weight_yy': 9.288573664652663e-06, 'learning_rate_yy': 0.0020793010223990153}. Best is trial 3 with value: -2.757216847916007.
[I 2026-03-17 17:14:07,224] Trial 5 finished with value: -1.7798809629498107 and parameters: {'n_layers_yy': 1, 'hidden_size_yy_l0': 5, 'context_size_yy': 4, 'num_mix_components_yy': 3, 'context_extractor_yy': 'gru', 'activation_func_yy': 'Tanh', 'L2_weight_yy': 1.335652344331262e-07, 'L_entropy_weight_yy': 1.5429430020187893e-09, 'L_sep_weight_yy': 6.299150404472051e-06, 'L_scale_weight_yy': 5.859323465064344e-06, 'learning_rate_yy': 0.0021815163034050442}. Best is trial 4 with value: -1.7828340534248737.
[I 2026-03-17 17:14:08,778] Trial 14 pruned. 
[I 2026-03-17 17:14:08,880] Trial 21 pruned. 
[I 2026-03-17 17:14:09,286] Trial 38 pruned. 
[I 2026-03-17 17:14:12,410] Trial 6 pruned. 
[I 2026-03-17 17:14:12,596] Trial 18 pruned. 
[I 2026-03-17 17:14:12,762] Trial 19 pruned. 
[I 2026-03-17 17:14:14,250] Trial 39 pruned. 
[I 2026-03-17 17:14:14,712] Trial 35 pruned. 
[I 2026-03-17 17:14:15,677] Trial 42 pruned. 
[I 2026-03-17 17:14:16,483] Trial 15 pruned. 
[I 2026-03-17 17:14:16,584] Trial 40 pruned. 
[I 2026-03-17 17:14:17,002] Trial 22 pruned. 
[I 2026-03-17 17:14:17,908] Trial 9 finished with value: -1.9453853114717516 and parameters: {'n_layers_yy': 1, 'hidden_size_yy_l0': 3, 'context_size_yy': 1, 'num_mix_components_yy': 3, 'context_extractor_yy': 'lstm', 'activation_func_yy': 'GELU', 'L2_weight_yy': 0.0001343760432093513, 'L_entropy_weight_yy': 2.1616422826372166e-10, 'L_sep_weight_yy': 1.0115956270650162e-09, 'L_scale_weight_yy': 7.806842551686e-06, 'learning_rate_yy': 0.00857063087364654}. Best is trial 7 with value: -1.9830532325011814.
[I 2026-03-17 17:14:19,404] Trial 3 finished with value: -2.472986334259618 and parameters: {'n_layers_yy': 1, 'hidden_size_yy_l0': 6, 'context_size_yy': 3, 'num_mix_components_yy': 2, 'context_extractor_yy': 'lstm', 'activation_func_yy': 'GELU', 'L2_weight_yy': 0.0007635313436566471, 'L_entropy_weight_yy': 1.6851925556327146e-05, 'L_sep_weight_yy': 1.510631014864911e-07, 'L_scale_weight_yy': 2.2157180460501298e-10, 'learning_rate_yy': 0.0013634416674602797}. Best is trial 2 with value: -2.476197165819489.
[I 2026-03-17 17:14:19,917] Trial 36 pruned. 
[I 2026-03-17 17:14:20,566] Trial 23 pruned. 
[I 2026-03-17 17:14:21,162] Trial 3 finished with value: -2.804861466675104 and parameters: {'n_layers_yy': 1, 'hidden_size_yy_l0': 6, 'context_size_yy': 2, 'num_mix_components_yy': 3, 'context_extractor_yy': 'lstm', 'activation_func_yy': 'ReLU', 'L2_weight_yy': 7.1913627840521586e-06, 'L_entropy_weight_yy': 1.5189211952764382e-07, 'L_sep_weight_yy': 1.9808433394050615e-05, 'L_scale_weight_yy': 4.3914458367999345e-05, 'learning_rate_yy': 0.009418450370664884}. Best is trial 3 with value: -2.804861466675104.
[I 2026-03-17 17:14:21,425] Trial 41 pruned. 
[I 2026-03-17 17:14:24,210] Trial 42 pruned. 
[I 2026-03-17 17:14:24,229] Trial 24 pruned. 
[I 2026-03-17 17:14:24,587] Trial 16 pruned. 
[I 2026-03-17 17:14:25,042] Trial 37 pruned. 
[I 2026-03-17 17:14:26,740] Trial 4 pruned. 
[I 2026-03-17 17:14:27,477] Trial 38 pruned. 
[I 2026-03-17 17:14:27,749] Trial 15 finished with value: -1.8966549819263059 and parameters: {'n_layers_yy': 1, 'hidden_size_yy_l0': 5, 'context_size_yy': 4, 'num_mix_components_yy': 3, 'context_extractor_yy': 'gru', 'activation_func_yy': 'ReLU', 'L2_weight_yy': 0.0001080170758925104, 'L_entropy_weight_yy': 2.890262396469308e-10, 'L_sep_weight_yy': 8.038381726733293e-09, 'L_scale_weight_yy': 1.7920240811850247e-08, 'learning_rate_yy': 0.0027242865554248682}. Best is trial 4 with value: -1.9076621166627798.
[I 2026-03-17 17:14:28,252] Trial 43 pruned. 
[I 2026-03-17 17:14:28,939] Trial 3 finished with value: -2.285074849869951 and parameters: {'n_layers_yy': 2, 'hidden_size_yy_l0': 4, 'hidden_size_yy_l1': 4, 'context_size_yy': 3, 'num_mix_components_yy': 1, 'context_extractor_yy': 'lstm', 'activation_func_yy': 'ReLU', 'L2_weight_yy': 1.6312147863030647e-07, 'L_entropy_weight_yy': 4.1732650120685793e-10, 'L_sep_weight_yy': 6.409840448778303e-09, 'L_scale_weight_yy': 3.119784940336959e-08, 'learning_rate_yy': 0.0017012481045204913}. Best is trial 0 with value: -2.289111866011322.
[I 2026-03-17 17:14:30,472] Trial 39 pruned. 
[I 2026-03-17 17:14:30,926] Trial 13 finished with value: -1.9713707937145466 and parameters: {'n_layers_yy': 2, 'hidden_size_yy_l0': 6, 'hidden_size_yy_l1': 4, 'context_size_yy': 3, 'num_mix_components_yy': 3, 'context_extractor_yy': 'lstm', 'activation_func_yy': 'Tanh', 'L2_weight_yy': 1.0439041710128913e-06, 'L_entropy_weight_yy': 2.6743300310061332e-05, 'L_sep_weight_yy': 2.183717891371831e-09, 'L_scale_weight_yy': 1.2754794190758987e-07, 'learning_rate_yy': 0.0011445924156433306}. Best is trial 1 with value: -1.9741431522447364.
[I 2026-03-17 17:14:31,436] Trial 43 finished with value: -0.5819698790244584 and parameters: {'n_layers_yy': 1, 'hidden_size_yy_l0': 4, 'context_size_yy': 4, 'num_mix_components_yy': 3, 'context_extractor_yy': 'gru', 'activation_func_yy': 'Tanh', 'L2_weight_yy': 3.987208829466203e-09, 'L_entropy_weight_yy': 0.00012122421505187596, 'L_sep_weight_yy': 1.0989883823247263e-07, 'L_scale_weight_yy': 2.323188075836104e-10, 'learning_rate_yy': 0.006605292316292198}. Best is trial 43 with value: -0.5819698790244584.
[I 2026-03-17 17:14:31,550] Trial 16 pruned. 
[I 2026-03-17 17:14:32,707] Trial 40 pruned. 
[I 2026-03-17 17:14:32,816] Trial 44 pruned. 
[I 2026-03-17 17:14:34,047] Trial 44 pruned. 
[I 2026-03-17 17:14:34,121] Trial 14 pruned. 
[I 2026-03-17 17:14:36,621] Trial 43 pruned. 
[I 2026-03-17 17:14:36,765] Trial 45 pruned. 
[I 2026-03-17 17:14:37,020] Trial 7 finished with value: -1.6979041554531955 and parameters: {'n_layers_yy': 2, 'hidden_size_yy_l0': 6, 'hidden_size_yy_l1': 3, 'context_size_yy': 1, 'num_mix_components_yy': 5, 'context_extractor_yy': 'gru', 'activation_func_yy': 'GELU', 'L2_weight_yy': 1.4066303674003404e-05, 'L_entropy_weight_yy': 2.862471704770993e-07, 'L_sep_weight_yy': 6.349430488983304e-08, 'L_scale_weight_yy': 7.613861629226897e-08, 'learning_rate_yy': 0.0017268605252937907}. Best is trial 3 with value: -1.702986696445342.
[I 2026-03-17 17:14:37,021] Trial 4 finished with value: -2.7295484335499185 and parameters: {'n_layers_yy': 2, 'hidden_size_yy_l0': 5, 'hidden_size_yy_l1': 5, 'context_size_yy': 4, 'num_mix_components_yy': 5, 'context_extractor_yy': 'lstm', 'activation_func_yy': 'ReLU', 'L2_weight_yy': 0.0002101327278108392, 'L_entropy_weight_yy': 4.501857839925295e-08, 'L_sep_weight_yy': 9.031776081300254e-10, 'L_scale_weight_yy': 1.878673079057408e-10, 'learning_rate_yy': 0.005585558395309203}. Best is trial 3 with value: -2.757216847916007.
[I 2026-03-17 17:14:37,374] Trial 41 pruned. 
[I 2026-03-17 17:14:38,495] Trial 15 pruned. 
[I 2026-03-17 17:14:38,822] Trial 44 pruned. 
[I 2026-03-17 17:14:39,988] Trial 9 finished with value: -2.373689101517566 and parameters: {'n_layers_yy': 2, 'hidden_size_yy_l0': 6, 'hidden_size_yy_l1': 5, 'context_size_yy': 2, 'num_mix_components_yy': 2, 'context_extractor_yy': 'gru', 'activation_func_yy': 'ReLU', 'L2_weight_yy': 6.935367402382412e-08, 'L_entropy_weight_yy': 1.90671891224352e-07, 'L_sep_weight_yy': 6.815719947803095e-05, 'L_scale_weight_yy': 2.2859280840680115e-10, 'learning_rate_yy': 0.005624439185624703}. Best is trial 9 with value: -2.373689101517566.
[I 2026-03-17 17:14:40,913] Trial 8 pruned. 
[I 2026-03-17 17:14:41,716] Trial 16 pruned. 
[I 2026-03-17 17:14:42,132] Trial 19 finished with value: -2.810408216519558 and parameters: {'n_layers_yy': 1, 'hidden_size_yy_l0': 4, 'context_size_yy': 4, 'num_mix_components_yy': 5, 'context_extractor_yy': 'lstm', 'activation_func_yy': 'GELU', 'L2_weight_yy': 0.000103535802441903, 'L_entropy_weight_yy': 1.8699358929072913e-07, 'L_sep_weight_yy': 8.845268467821299e-08, 'L_scale_weight_yy': 3.317661054226036e-07, 'learning_rate_yy': 0.005767103830897805}. Best is trial 11 with value: -2.8352269528025382.
[I 2026-03-17 17:14:43,807] Trial 25 pruned. 
[I 2026-03-17 17:14:44,506] Trial 10 pruned. 
[I 2026-03-17 17:14:46,168] Trial 17 pruned. 
[I 2026-03-17 17:14:46,857] Trial 26 pruned. 
[I 2026-03-17 17:14:48,376] Trial 20 finished with value: -1.796459767386977 and parameters: {'n_layers_yy': 2, 'hidden_size_yy_l0': 3, 'hidden_size_yy_l1': 3, 'context_size_yy': 2, 'num_mix_components_yy': 4, 'context_extractor_yy': 'gru', 'activation_func_yy': 'Tanh', 'L2_weight_yy': 6.280817240457497e-09, 'L_entropy_weight_yy': 5.695127085066939e-08, 'L_sep_weight_yy': 5.479233870593088e-10, 'L_scale_weight_yy': 0.00010041147163074544, 'learning_rate_yy': 0.0069712375796472615}. Best is trial 2 with value: -1.824331576606496.
[I 2026-03-17 17:14:48,576] Trial 11 pruned. 
[I 2026-03-17 17:14:48,761] Trial 19 pruned. 
[I 2026-03-17 17:14:49,481] Trial 10 finished with value: -1.8554935362796692 and parameters: {'n_layers_yy': 1, 'hidden_size_yy_l0': 6, 'context_size_yy': 4, 'num_mix_components_yy': 1, 'context_extractor_yy': 'lstm', 'activation_func_yy': 'Tanh', 'L2_weight_yy': 0.0002081040498734622, 'L_entropy_weight_yy': 0.00040755520048121375, 'L_sep_weight_yy': 1.0286525129244934e-10, 'L_scale_weight_yy': 3.9377147577509877e-10, 'learning_rate_yy': 0.009317540807220786}. Best is trial 10 with value: -1.8554935362796692.
[I 2026-03-17 17:14:50,192] Trial 42 pruned. 
[I 2026-03-17 17:14:50,241] Trial 17 pruned. 
[I 2026-03-17 17:14:51,730] Trial 20 pruned. 
[I 2026-03-17 17:14:52,099] Trial 45 pruned. 
[I 2026-03-17 17:14:53,839] Trial 17 finished with value: -1.6711897239648343 and parameters: {'n_layers_yy': 2, 'hidden_size_yy_l0': 2, 'hidden_size_yy_l1': 5, 'context_size_yy': 3, 'num_mix_components_yy': 3, 'context_extractor_yy': 'gru', 'activation_func_yy': 'GELU', 'L2_weight_yy': 6.857621869264529e-07, 'L_entropy_weight_yy': 2.3145313531950588e-05, 'L_sep_weight_yy': 7.747489761512134e-09, 'L_scale_weight_yy': 3.387568845649874e-08, 'learning_rate_yy': 0.007025151354618229}. Best is trial 17 with value: -1.6711897239648343.
[I 2026-03-17 17:14:54,021] Trial 20 pruned. 
[I 2026-03-17 17:14:54,181] Trial 18 pruned. 
[I 2026-03-17 17:14:56,921] Trial 45 finished with value: -0.4079706528607537 and parameters: {'n_layers_yy': 1, 'hidden_size_yy_l0': 5, 'context_size_yy': 2, 'num_mix_components_yy': 5, 'context_extractor_yy': 'lstm', 'activation_func_yy': 'Tanh', 'L2_weight_yy': 8.069916046080552e-08, 'L_entropy_weight_yy': 5.068114280736774e-09, 'L_sep_weight_yy': 1.5999374405783022e-07, 'L_scale_weight_yy': 1.276322618184153e-09, 'learning_rate_yy': 0.005338477874751055}. Best is trial 38 with value: -0.44168936431223393.
[I 2026-03-17 17:14:57,360] Trial 4 pruned. 
[I 2026-03-17 17:14:57,509] Trial 18 pruned. 
[I 2026-03-17 17:14:58,419] Trial 21 pruned. 
[I 2026-03-17 17:15:01,277] Trial 19 pruned. 
[I 2026-03-17 17:15:02,797] Trial 9 finished with value: -2.9754424140841684 and parameters: {'n_layers_yy': 2, 'hidden_size_yy_l0': 6, 'hidden_size_yy_l1': 3, 'context_size_yy': 4, 'num_mix_components_yy': 5, 'context_extractor_yy': 'gru', 'activation_func_yy': 'Tanh', 'L2_weight_yy': 8.789780667177671e-06, 'L_entropy_weight_yy': 6.227979304441126e-08, 'L_sep_weight_yy': 1.1228874168969943e-07, 'L_scale_weight_yy': 1.159101240238555e-07, 'learning_rate_yy': 0.0056707017823368865}. Best is trial 9 with value: -2.9754424140841684.
[I 2026-03-17 17:15:03,214] Trial 19 pruned. 
[I 2026-03-17 17:15:04,260] Trial 18 finished with value: -1.2611008677597186 and parameters: {'n_layers_yy': 2, 'hidden_size_yy_l0': 5, 'hidden_size_yy_l1': 3, 'context_size_yy': 1, 'num_mix_components_yy': 2, 'context_extractor_yy': 'gru', 'activation_func_yy': 'Tanh', 'L2_weight_yy': 1.07013358764683e-09, 'L_entropy_weight_yy': 1.358725812145279e-07, 'L_sep_weight_yy': 3.9558005302757105e-08, 'L_scale_weight_yy': 1.2142930487326752e-08, 'learning_rate_yy': 0.005487578116459921}. Best is trial 9 with value: -1.2718806099318753.
[I 2026-03-17 17:15:05,309] Trial 5 pruned. 
[I 2026-03-17 17:15:07,077] Trial 9 pruned. 
[I 2026-03-17 17:15:08,344] Trial 22 pruned. 
[I 2026-03-17 17:15:08,944] Trial 46 pruned. 
[I 2026-03-17 17:15:09,245] Trial 12 finished with value: -3.1467977435352683 and parameters: {'n_layers_yy': 1, 'hidden_size_yy_l0': 4, 'context_size_yy': 2, 'num_mix_components_yy': 5, 'context_extractor_yy': 'gru', 'activation_func_yy': 'ReLU', 'L2_weight_yy': 3.7137603593085404e-06, 'L_entropy_weight_yy': 3.4087794834255837e-09, 'L_sep_weight_yy': 1.2970132055734275e-06, 'L_scale_weight_yy': 2.1758701942647403e-08, 'learning_rate_yy': 0.009347958958812224}. Best is trial 12 with value: -3.1467977435352683.
[I 2026-03-17 17:15:09,945] Trial 20 pruned. 
[I 2026-03-17 17:15:10,282] Trial 5 pruned. 
[I 2026-03-17 17:15:11,404] Trial 46 finished with value: -0.5774500032238652 and parameters: {'n_layers_yy': 1, 'hidden_size_yy_l0': 3, 'context_size_yy': 4, 'num_mix_components_yy': 3, 'context_extractor_yy': 'gru', 'activation_func_yy': 'Tanh', 'L2_weight_yy': 7.937383996788246e-07, 'L_entropy_weight_yy': 9.285182327303133e-05, 'L_sep_weight_yy': 2.128708077214567e-08, 'L_scale_weight_yy': 1.3181219999321104e-09, 'learning_rate_yy': 0.006469520334475692}. Best is trial 43 with value: -0.5819698790244584.
[I 2026-03-17 17:15:12,119] Trial 18 pruned. 
[I 2026-03-17 17:15:13,272] Trial 21 pruned. 
[I 2026-03-17 17:15:13,429] Trial 3 finished with value: -3.248812548828125 and parameters: {'n_layers_yy': 1, 'hidden_size_yy_l0': 6, 'context_size_yy': 2, 'num_mix_components_yy': 5, 'context_extractor_yy': 'gru', 'activation_func_yy': 'GELU', 'L2_weight_yy': 1.8824462034518758e-10, 'L_entropy_weight_yy': 4.3097582367083507e-10, 'L_sep_weight_yy': 0.0003681268567773277, 'L_scale_weight_yy': 0.0007051137741951086, 'learning_rate_yy': 0.0026263882658393717}. Best is trial 3 with value: -3.248812548828125.
[I 2026-03-17 17:15:13,609] Trial 47 pruned. 
[I 2026-03-17 17:15:15,276] Trial 6 pruned. 
[I 2026-03-17 17:15:15,455] Trial 46 finished with value: -1.4428230403019833 and parameters: {'n_layers_yy': 2, 'hidden_size_yy_l0': 3, 'hidden_size_yy_l1': 3, 'context_size_yy': 4, 'num_mix_components_yy': 4, 'context_extractor_yy': 'lstm', 'activation_func_yy': 'ReLU', 'L2_weight_yy': 5.726463649991929e-09, 'L_entropy_weight_yy': 5.62563453457083e-08, 'L_sep_weight_yy': 3.9830347656073715e-09, 'L_scale_weight_yy': 1.0885646260284958e-08, 'learning_rate_yy': 0.00782074474432685}. Best is trial 1 with value: -1.4537486853966346.
[I 2026-03-17 17:15:16,341] Trial 12 pruned. 
[I 2026-03-17 17:15:17,381] Trial 47 pruned. 
[I 2026-03-17 17:15:17,794] Trial 10 pruned. 
[I 2026-03-17 17:15:20,264] Trial 48 pruned. 
[I 2026-03-17 17:15:20,281] Trial 4 pruned. 
[I 2026-03-17 17:15:20,616] Trial 19 pruned. 
[I 2026-03-17 17:15:20,684] Trial 7 pruned. 
[I 2026-03-17 17:15:21,014] Trial 20 finished with value: -1.6749326640857292 and parameters: {'n_layers_yy': 1, 'hidden_size_yy_l0': 6, 'context_size_yy': 4, 'num_mix_components_yy': 1, 'context_extractor_yy': 'lstm', 'activation_func_yy': 'GELU', 'L2_weight_yy': 5.574495915824911e-07, 'L_entropy_weight_yy': 8.815123949016476e-06, 'L_sep_weight_yy': 1.081743115775403e-10, 'L_scale_weight_yy': 8.439044172884714e-08, 'learning_rate_yy': 0.002752568742757789}. Best is trial 2 with value: -1.677622742403132.
[I 2026-03-17 17:15:21,433] Trial 22 pruned. 
[I 2026-03-17 17:15:22,106] Trial 17 finished with value: -1.8988120918843283 and parameters: {'n_layers_yy': 1, 'hidden_size_yy_l0': 4, 'context_size_yy': 4, 'num_mix_components_yy': 4, 'context_extractor_yy': 'gru', 'activation_func_yy': 'Tanh', 'L2_weight_yy': 0.00013267697852980035, 'L_entropy_weight_yy': 2.4902485259198986e-07, 'L_sep_weight_yy': 0.0008548814634402227, 'L_scale_weight_yy': 4.946086274240895e-08, 'learning_rate_yy': 0.0017377254978470581}. Best is trial 4 with value: -1.9076621166627798.
[I 2026-03-17 17:15:23,956] Trial 43 finished with value: -0.8305945347119645 and parameters: {'n_layers_yy': 1, 'hidden_size_yy_l0': 5, 'context_size_yy': 2, 'num_mix_components_yy': 2, 'context_extractor_yy': 'lstm', 'activation_func_yy': 'ReLU', 'L2_weight_yy': 3.700087610270681e-08, 'L_entropy_weight_yy': 5.330525908867448e-08, 'L_sep_weight_yy': 8.371743204331711e-07, 'L_scale_weight_yy': 1.3623706980620458e-09, 'learning_rate_yy': 0.008945100659497445}. Best is trial 2 with value: -0.833493141163047.
[I 2026-03-17 17:15:24,015] Trial 20 pruned. 
[I 2026-03-17 17:15:25,275] Trial 23 pruned. 
[I 2026-03-17 17:15:25,823] Trial 8 pruned. 
[I 2026-03-17 17:15:25,939] Trial 10 finished with value: -2.3489780387020307 and parameters: {'n_layers_yy': 2, 'hidden_size_yy_l0': 6, 'hidden_size_yy_l1': 2, 'context_size_yy': 4, 'num_mix_components_yy': 1, 'context_extractor_yy': 'gru', 'activation_func_yy': 'ReLU', 'L2_weight_yy': 6.110772593619778e-08, 'L_entropy_weight_yy': 0.0005734196748801759, 'L_sep_weight_yy': 6.218295872671642e-06, 'L_scale_weight_yy': 4.438698534859929e-09, 'learning_rate_yy': 0.007605276458114579}. Best is trial 9 with value: -2.373689101517566.
[I 2026-03-17 17:15:26,168] Trial 13 pruned. 
[I 2026-03-17 17:15:28,744] Trial 24 pruned. 
[I 2026-03-17 17:15:29,370] Trial 11 finished with value: -1.8544230523905816 and parameters: {'n_layers_yy': 1, 'hidden_size_yy_l0': 6, 'context_size_yy': 4, 'num_mix_components_yy': 1, 'context_extractor_yy': 'lstm', 'activation_func_yy': 'Tanh', 'L2_weight_yy': 0.0008627989754518222, 'L_entropy_weight_yy': 0.00066883849863917, 'L_sep_weight_yy': 2.122387750623648e-10, 'L_scale_weight_yy': 3.720818497804553e-10, 'learning_rate_yy': 0.009556525118485187}. Best is trial 10 with value: -1.8554935362796692.
[I 2026-03-17 17:15:29,720] Trial 5 finished with value: -2.51146662475701 and parameters: {'n_layers_yy': 1, 'hidden_size_yy_l0': 2, 'context_size_yy': 1, 'num_mix_components_yy': 3, 'context_extractor_yy': 'gru', 'activation_func_yy': 'ReLU', 'L2_weight_yy': 3.147368736811797e-10, 'L_entropy_weight_yy': 4.950525263255344e-09, 'L_sep_weight_yy': 1.4707233077111684e-09, 'L_scale_weight_yy': 0.00014597100169193406, 'learning_rate_yy': 0.0035955960039477106}. Best is trial 5 with value: -2.51146662475701.
[I 2026-03-17 17:15:29,939] Trial 14 pruned. 
[I 2026-03-17 17:15:30,095] Trial 11 pruned. 
[I 2026-03-17 17:15:30,616] Trial 27 finished with value: -1.6122660066724563 and parameters: {'n_layers_yy': 2, 'hidden_size_yy_l0': 2, 'hidden_size_yy_l1': 4, 'context_size_yy': 3, 'num_mix_components_yy': 3, 'context_extractor_yy': 'lstm', 'activation_func_yy': 'Tanh', 'L2_weight_yy': 9.299754952093766e-05, 'L_entropy_weight_yy': 1.0810754906774842e-08, 'L_sep_weight_yy': 6.927486924492776e-10, 'L_scale_weight_yy': 6.398715111489247e-06, 'learning_rate_yy': 0.005368240762772822}. Best is trial 12 with value: -1.6131555846140806.
[I 2026-03-17 17:15:32,821] Trial 7 finished with value: -1.7809123707780934 and parameters: {'n_layers_yy': 2, 'hidden_size_yy_l0': 3, 'hidden_size_yy_l1': 6, 'context_size_yy': 4, 'num_mix_components_yy': 2, 'context_extractor_yy': 'lstm', 'activation_func_yy': 'Tanh', 'L2_weight_yy': 2.4527296548084084e-07, 'L_entropy_weight_yy': 6.307295368851779e-10, 'L_sep_weight_yy': 6.748013920973647e-07, 'L_scale_weight_yy': 1.2576275899450032e-10, 'learning_rate_yy': 0.007919272640000509}. Best is trial 4 with value: -1.7828340534248737.
[I 2026-03-17 17:15:34,072] Trial 15 pruned. 
[I 2026-03-17 17:15:34,294] Trial 28 pruned. 
[I 2026-03-17 17:15:34,556] Trial 12 pruned. 
