[I 2026-03-17 17:33:47,182] Trial 49 pruned. 
Optimize task 0: group_id: BC, neuron_id: 0
Starting optimization for task 0...

--- Data Summary ---
Total events for target process 31112
Data Time: 900 seconds
Using device: cuda
Number of events in target process: 31112
Only one process provided, preparing dataloaders for the reduced model.
Reduced model ln_yy : 4435.13467 nats/sec, 128.29844 nats/event
Reduced model Log loss : -2.79449
Number of events in target process: 31112
Only one process provided, preparing dataloaders for the reduced model.
Reduced model ln_yy : 4430.94729 nats/sec, 128.17731 nats/event
Reduced model Log loss : -2.80179
Number of events in target process: 31112
Only one process provided, preparing dataloaders for the reduced model.
Reduced model ln_yy : 4448.22825 nats/sec, 128.67721 nats/event
Reduced model Log loss : -2.80485
Number of events in target process: 31112
Only one process provided, preparing dataloaders for the reduced model.
Reduced model ln_yy : 4434.91623 nats/sec, 128.29213 nats/event
Reduced model Log loss : -2.80486
Number of events in target process: 31112
Only one process provided, preparing dataloaders for the reduced model.
Number of events in target process: 31112
Only one process provided, preparing dataloaders for the reduced model.
Number of events in target process: 31112
Only one process provided, preparing dataloaders for the reduced model.
Number of events in target process: 31112
Only one process provided, preparing dataloaders for the reduced model.
Reduced model ln_yy : 4427.58058 nats/sec, 128.07992 nats/event
Reduced model Log loss : -2.79669
Number of events in target process: 31112
Only one process provided, preparing dataloaders for the reduced model.
Number of events in target process: 31112
Only one process provided, preparing dataloaders for the reduced model.
Number of events in target process: 31112
Only one process provided, preparing dataloaders for the reduced model.
Number of events in target process: 31112
Only one process provided, preparing dataloaders for the reduced model.
Reduced model ln_yy : 4431.07007 nats/sec, 128.18086 nats/event
Reduced model Log loss : -2.80003
Number of events in target process: 31112
Only one process provided, preparing dataloaders for the reduced model.
Reduced model ln_yy : 4438.83206 nats/sec, 128.40540 nats/event
Reduced model Log loss : -2.80698
Number of events in target process: 31112
Only one process provided, preparing dataloaders for the reduced model.
Reduced model ln_yy : 4442.29028 nats/sec, 128.50544 nats/event
Reduced model Log loss : -2.80069
Number of events in target process: 31112
Only one process provided, preparing dataloaders for the reduced model.
Number of events in target process: 31112
Only one process provided, preparing dataloaders for the reduced model.
Number of events in target process: 31112
Only one process provided, preparing dataloaders for the reduced model.
Reduced model ln_yy : 4496.23175 nats/sec, 130.06585 nats/event
Reduced model Log loss : -2.81042
Number of events in target process: 31112
Only one process provided, preparing dataloaders for the reduced model.
Number of events in target process: 31112
Only one process provided, preparing dataloaders for the reduced model.
Number of events in target process: 31112
Only one process provided, preparing dataloaders for the reduced model.
Number of events in target process: 31112
Only one process provided, preparing dataloaders for the reduced model.
Number of events in target process: 31112
Only one process provided, preparing dataloaders for the reduced model.
Number of events in target process: 31112
Only one process provided, preparing dataloaders for the reduced model.
Number of events in target process: 31112
Only one process provided, preparing dataloaders for the reduced model.
Number of events in target process: 31112
Only one process provided, preparing dataloaders for the reduced model.
Number of events in target process: 31112
Only one process provided, preparing dataloaders for the reduced model.
Number of events in target process: 31112
Only one process provided, preparing dataloaders for the reduced model.
Number of events in target process: 31112
Only one process provided, preparing dataloaders for the reduced model.
Number of events in target process: 31112
Only one process provided, preparing dataloaders for the reduced model.
Number of events in target process: 31112
Only one process provided, preparing dataloaders for the reduced model.
Number of events in target process: 31112
Only one process provided, preparing dataloaders for the reduced model.
Number of events in target process: 31112
Only one process provided, preparing dataloaders for the reduced model.
Number of events in target process: 31112
Only one process provided, preparing dataloaders for the reduced model.
Number of events in target process: 31112
Only one process provided, preparing dataloaders for the reduced model.
Number of events in target process: 31112
Only one process provided, preparing dataloaders for the reduced model.
Number of events in target process: 31112
Only one process provided, preparing dataloaders for the reduced model.
Number of events in target process: 31112
Only one process provided, preparing dataloaders for the reduced model.
Number of events in target process: 31112
Only one process provided, preparing dataloaders for the reduced model.
Reduced model ln_yy : 4454.65357 nats/sec, 128.86308 nats/event
Reduced model Log loss : -2.80516
Number of events in target process: 31112
Only one process provided, preparing dataloaders for the reduced model.
Reduced model ln_yy : 4448.02261 nats/sec, 128.67126 nats/event
Reduced model Log loss : -2.80342
Number of events in target process: 31112
Only one process provided, preparing dataloaders for the reduced model.
Number of events in target process: 31112
Only one process provided, preparing dataloaders for the reduced model.
Number of events in target process: 31112
Only one process provided, preparing dataloaders for the reduced model.
Number of events in target process: 31112
Only one process provided, preparing dataloaders for the reduced model.
Reduced model ln_yy : 4404.21854 nats/sec, 127.40411 nats/event
Reduced model Log loss : -2.79392
Number of events in target process: 31112
Only one process provided, preparing dataloaders for the reduced model.
Number of events in target process: 31112
Only one process provided, preparing dataloaders for the reduced model.
Number of events in target process: 31112
Only one process provided, preparing dataloaders for the reduced model.
Number of events in target process: 31112
Only one process provided, preparing dataloaders for the reduced model.
Number of events in target process: 31112
Only one process provided, preparing dataloaders for the reduced model.
Number of events in target process: 31112
Only one process provided, preparing dataloaders for the reduced model.
Number of events in target process: 31112
Only one process provided, preparing dataloaders for the reduced model.
Best trial:
  Value: -2.8104182726972877
  Params: {'n_layers_yy': 1, 'hidden_size_yy_l0': 6, 'context_size_yy': 3, 'num_mix_components_yy': 3, 'context_extractor_yy': 'lstm', 'activation_func_yy': 'Tanh', 'L2_weight_yy': 2.4458328841779396e-08, 'L_entropy_weight_yy': 2.909994802486671e-09, 'L_sep_weight_yy': 1.593051980139751e-10, 'L_scale_weight_yy': 6.706760671055146e-09, 'learning_rate_yy': 0.009997364388539149}
Full best configuration saved to results/opt/opt_reduced_0_best_config.txt
Optimization finished.
[I 2026-03-17 17:33:59,207] Trial 44 pruned. 
[I 2026-03-17 17:34:03,588] Trial 44 finished with value: -3.1501423966098554 and parameters: {'n_layers_yy': 1, 'hidden_size_yy_l0': 6, 'context_size_yy': 4, 'num_mix_components_yy': 4, 'context_extractor_yy': 'gru', 'activation_func_yy': 'ReLU', 'L2_weight_yy': 1.016752826665728e-06, 'L_entropy_weight_yy': 2.7005511030233914e-05, 'L_sep_weight_yy': 4.496179848734427e-05, 'L_scale_weight_yy': 2.7972715973080943e-07, 'learning_rate_yy': 0.006856065950217909}. Best is trial 33 with value: -3.153503458157452.
[I 2026-03-17 17:34:03,832] Trial 28 finished with value: -3.259461319986979 and parameters: {'n_layers_yy': 1, 'hidden_size_yy_l0': 5, 'context_size_yy': 4, 'num_mix_components_yy': 4, 'context_extractor_yy': 'gru', 'activation_func_yy': 'ReLU', 'L2_weight_yy': 5.664907375691544e-10, 'L_entropy_weight_yy': 3.7612206623524655e-08, 'L_sep_weight_yy': 4.288215277041243e-09, 'L_scale_weight_yy': 1.2274551038354629e-06, 'learning_rate_yy': 0.0070217176254176745}. Best is trial 16 with value: -3.2663029296875.
[I 2026-03-17 17:34:23,019] Trial 39 finished with value: -2.7644834187235348 and parameters: {'n_layers_yy': 1, 'hidden_size_yy_l0': 3, 'context_size_yy': 2, 'num_mix_components_yy': 4, 'context_extractor_yy': 'gru', 'activation_func_yy': 'GELU', 'L2_weight_yy': 1.354293294920085e-08, 'L_entropy_weight_yy': 1.5719353393532017e-08, 'L_sep_weight_yy': 7.595539964555183e-05, 'L_scale_weight_yy': 2.73331078399562e-10, 'learning_rate_yy': 0.008602419486620652}. Best is trial 39 with value: -2.7644834187235348.
[I 2026-03-17 17:34:35,294] Trial 29 pruned. 
[I 2026-03-17 17:34:39,117] Trial 30 pruned. 
[I 2026-03-17 17:34:48,644] Trial 45 finished with value: -3.149995535609303 and parameters: {'n_layers_yy': 1, 'hidden_size_yy_l0': 6, 'context_size_yy': 4, 'num_mix_components_yy': 4, 'context_extractor_yy': 'gru', 'activation_func_yy': 'ReLU', 'L2_weight_yy': 1.1249174509784175e-06, 'L_entropy_weight_yy': 0.0009377845903528935, 'L_sep_weight_yy': 5.986822381017264e-05, 'L_scale_weight_yy': 3.5305309469542535e-06, 'learning_rate_yy': 0.006859360050108094}. Best is trial 33 with value: -3.153503458157452.
[I 2026-03-17 17:34:55,083] Trial 40 pruned. 
[I 2026-03-17 17:35:05,924] Trial 41 pruned. 
[I 2026-03-17 17:35:09,975] Trial 42 pruned. 
[I 2026-03-17 17:35:11,532] Trial 45 finished with value: -2.289321133673118 and parameters: {'n_layers_yy': 1, 'hidden_size_yy_l0': 5, 'context_size_yy': 4, 'num_mix_components_yy': 2, 'context_extractor_yy': 'lstm', 'activation_func_yy': 'GELU', 'L2_weight_yy': 7.407054043350106e-08, 'L_entropy_weight_yy': 5.7239384782947645e-06, 'L_sep_weight_yy': 3.841287195111398e-07, 'L_scale_weight_yy': 0.0003265601983203932, 'learning_rate_yy': 0.006654187374841723}. Best is trial 27 with value: -2.290475318189642.
[I 2026-03-17 17:35:17,342] Trial 46 pruned. 
[I 2026-03-17 17:35:21,066] Trial 43 pruned. 
[I 2026-03-17 17:35:23,390] Trial 47 pruned. 
[I 2026-03-17 17:35:29,165] Trial 48 pruned. 
[I 2026-03-17 17:35:32,149] Trial 44 pruned. 
[I 2026-03-17 17:35:35,016] Trial 49 pruned. 
Optimize task 12: group_id: POm, neuron_id: 46
Starting optimization for task 12...

--- Data Summary ---
Total events for target process 20800
Data Time: 900 seconds
Using device: cuda
Number of events in target process: 20800
Only one process provided, preparing dataloaders for the reduced model.
Reduced model ln_yy : 1724.24875 nats/sec, 74.60692 nats/event
Reduced model Log loss : -2.28911
Number of events in target process: 20800
Only one process provided, preparing dataloaders for the reduced model.
Reduced model ln_yy : 1697.60681 nats/sec, 73.45414 nats/event
Reduced model Log loss : -2.26094
Number of events in target process: 20800
Only one process provided, preparing dataloaders for the reduced model.
Reduced model ln_yy : 1727.52574 nats/sec, 74.74871 nats/event
Reduced model Log loss : -2.27883
Number of events in target process: 20800
Only one process provided, preparing dataloaders for the reduced model.
Reduced model ln_yy : 1711.65439 nats/sec, 74.06197 nats/event
Reduced model Log loss : -2.28507
Number of events in target process: 20800
Only one process provided, preparing dataloaders for the reduced model.
Reduced model ln_yy : 1706.18034 nats/sec, 73.82511 nats/event
Reduced model Log loss : -2.27630
Number of events in target process: 20800
Only one process provided, preparing dataloaders for the reduced model.
Number of events in target process: 20800
Only one process provided, preparing dataloaders for the reduced model.
Number of events in target process: 20800
Only one process provided, preparing dataloaders for the reduced model.
Number of events in target process: 20800
Only one process provided, preparing dataloaders for the reduced model.
Reduced model ln_yy : 1697.05347 nats/sec, 73.43020 nats/event
Reduced model Log loss : -2.27165
Number of events in target process: 20800
Only one process provided, preparing dataloaders for the reduced model.
Reduced model ln_yy : 1718.67718 nats/sec, 74.36584 nats/event
Reduced model Log loss : -2.26875
Number of events in target process: 20800
Only one process provided, preparing dataloaders for the reduced model.
Reduced model ln_yy : 1710.49474 nats/sec, 74.01179 nats/event
Reduced model Log loss : -2.28202
Number of events in target process: 20800
Only one process provided, preparing dataloaders for the reduced model.
Number of events in target process: 20800
Only one process provided, preparing dataloaders for the reduced model.
Number of events in target process: 20800
Only one process provided, preparing dataloaders for the reduced model.
Number of events in target process: 20800
Only one process provided, preparing dataloaders for the reduced model.
Number of events in target process: 20800
Only one process provided, preparing dataloaders for the reduced model.
Number of events in target process: 20800
Only one process provided, preparing dataloaders for the reduced model.
Number of events in target process: 20800
Only one process provided, preparing dataloaders for the reduced model.
Number of events in target process: 20800
Only one process provided, preparing dataloaders for the reduced model.
Number of events in target process: 20800
Only one process provided, preparing dataloaders for the reduced model.
Reduced model ln_yy : 1718.30488 nats/sec, 74.34973 nats/event
Reduced model Log loss : -2.27978
Number of events in target process: 20800
Only one process provided, preparing dataloaders for the reduced model.
Number of events in target process: 20800
Only one process provided, preparing dataloaders for the reduced model.
Number of events in target process: 20800
Only one process provided, preparing dataloaders for the reduced model.
Number of events in target process: 20800
Only one process provided, preparing dataloaders for the reduced model.
Reduced model ln_yy : 1719.00670 nats/sec, 74.38010 nats/event
Reduced model Log loss : -2.28709
Number of events in target process: 20800
Only one process provided, preparing dataloaders for the reduced model.
Reduced model ln_yy : 1720.24067 nats/sec, 74.43349 nats/event
Reduced model Log loss : -2.28956
Number of events in target process: 20800
Only one process provided, preparing dataloaders for the reduced model.
Reduced model ln_yy : 1705.36535 nats/sec, 73.78985 nats/event
Reduced model Log loss : -2.28923
Number of events in target process: 20800
Only one process provided, preparing dataloaders for the reduced model.
Reduced model ln_yy : 1731.15433 nats/sec, 74.90572 nats/event
Reduced model Log loss : -2.28618
Number of events in target process: 20800
Only one process provided, preparing dataloaders for the reduced model.
Reduced model ln_yy : 1727.52157 nats/sec, 74.74853 nats/event
Reduced model Log loss : -2.29048
Number of events in target process: 20800
Only one process provided, preparing dataloaders for the reduced model.
Number of events in target process: 20800
Only one process provided, preparing dataloaders for the reduced model.
Reduced model ln_yy : 1701.07707 nats/sec, 73.60430 nats/event
Reduced model Log loss : -2.26365
Number of events in target process: 20800
Only one process provided, preparing dataloaders for the reduced model.
Number of events in target process: 20800
Only one process provided, preparing dataloaders for the reduced model.
Number of events in target process: 20800
Only one process provided, preparing dataloaders for the reduced model.
Number of events in target process: 20800
Only one process provided, preparing dataloaders for the reduced model.
Number of events in target process: 20800
Only one process provided, preparing dataloaders for the reduced model.
Number of events in target process: 20800
Only one process provided, preparing dataloaders for the reduced model.
Number of events in target process: 20800
Only one process provided, preparing dataloaders for the reduced model.
Number of events in target process: 20800
Only one process provided, preparing dataloaders for the reduced model.
Number of events in target process: 20800
Only one process provided, preparing dataloaders for the reduced model.
Number of events in target process: 20800
Only one process provided, preparing dataloaders for the reduced model.
Number of events in target process: 20800
Only one process provided, preparing dataloaders for the reduced model.
Number of events in target process: 20800
Only one process provided, preparing dataloaders for the reduced model.
Reduced model ln_yy : 1715.30229 nats/sec, 74.21981 nats/event
Reduced model Log loss : -2.28803
Number of events in target process: 20800
Only one process provided, preparing dataloaders for the reduced model.
Reduced model ln_yy : 1715.85033 nats/sec, 74.24352 nats/event
Reduced model Log loss : -2.28817
Number of events in target process: 20800
Only one process provided, preparing dataloaders for the reduced model.
Number of events in target process: 20800
Only one process provided, preparing dataloaders for the reduced model.
Number of events in target process: 20800
Only one process provided, preparing dataloaders for the reduced model.
Reduced model ln_yy : 1732.17319 nats/sec, 74.94980 nats/event
Reduced model Log loss : -2.28932
Number of events in target process: 20800
Only one process provided, preparing dataloaders for the reduced model.
Number of events in target process: 20800
Only one process provided, preparing dataloaders for the reduced model.
Number of events in target process: 20800
Only one process provided, preparing dataloaders for the reduced model.
Number of events in target process: 20800
Only one process provided, preparing dataloaders for the reduced model.
Best trial:
  Value: -2.290475318189642
  Params: {'n_layers_yy': 1, 'hidden_size_yy_l0': 6, 'context_size_yy': 4, 'num_mix_components_yy': 2, 'context_extractor_yy': 'lstm', 'activation_func_yy': 'GELU', 'L2_weight_yy': 0.0001546810466363547, 'L_entropy_weight_yy': 1.2442493296294998e-08, 'L_sep_weight_yy': 5.426142333325868e-06, 'L_scale_weight_yy': 3.932908482805081e-05, 'learning_rate_yy': 0.00718048815262317}
Full best configuration saved to results/opt/opt_reduced_12_best_config.txt
Optimization finished.
[I 2026-03-17 17:35:42,972] Trial 46 finished with value: -3.1464230814878067 and parameters: {'n_layers_yy': 1, 'hidden_size_yy_l0': 6, 'context_size_yy': 4, 'num_mix_components_yy': 4, 'context_extractor_yy': 'gru', 'activation_func_yy': 'Tanh', 'L2_weight_yy': 1.3968386928346208e-06, 'L_entropy_weight_yy': 0.0009579045061754254, 'L_sep_weight_yy': 7.127691485189332e-05, 'L_scale_weight_yy': 3.370846941152433e-05, 'learning_rate_yy': 0.0030948859847832}. Best is trial 33 with value: -3.153503458157452.
[I 2026-03-17 17:36:15,302] Trial 31 finished with value: -3.2635159261067708 and parameters: {'n_layers_yy': 1, 'hidden_size_yy_l0': 5, 'context_size_yy': 4, 'num_mix_components_yy': 4, 'context_extractor_yy': 'gru', 'activation_func_yy': 'ReLU', 'L2_weight_yy': 2.7029886038189e-08, 'L_entropy_weight_yy': 2.583867517996168e-07, 'L_sep_weight_yy': 4.95962539577594e-10, 'L_scale_weight_yy': 1.6313566864095387e-10, 'learning_rate_yy': 0.007185752082465205}. Best is trial 16 with value: -3.2663029296875.
[I 2026-03-17 17:36:47,063] Trial 47 finished with value: -3.1518945206861124 and parameters: {'n_layers_yy': 1, 'hidden_size_yy_l0': 6, 'context_size_yy': 4, 'num_mix_components_yy': 4, 'context_extractor_yy': 'gru', 'activation_func_yy': 'ReLU', 'L2_weight_yy': 1.3928021697187261e-08, 'L_entropy_weight_yy': 2.5432152036761483e-05, 'L_sep_weight_yy': 0.00014489304014639863, 'L_scale_weight_yy': 7.997224554805182e-06, 'learning_rate_yy': 0.00535395428655917}. Best is trial 33 with value: -3.153503458157452.
[I 2026-03-17 17:37:31,980] Trial 48 pruned. 
[I 2026-03-17 17:37:34,176] Trial 32 finished with value: -3.27877421875 and parameters: {'n_layers_yy': 1, 'hidden_size_yy_l0': 6, 'context_size_yy': 4, 'num_mix_components_yy': 3, 'context_extractor_yy': 'gru', 'activation_func_yy': 'ReLU', 'L2_weight_yy': 5.714408003169351e-08, 'L_entropy_weight_yy': 5.033333744064336e-07, 'L_sep_weight_yy': 4.574119601469976e-10, 'L_scale_weight_yy': 1.0043428741080172e-10, 'learning_rate_yy': 0.007393905487563901}. Best is trial 32 with value: -3.27877421875.
[I 2026-03-17 17:37:36,753] Trial 45 finished with value: -2.7593495784956192 and parameters: {'n_layers_yy': 2, 'hidden_size_yy_l0': 4, 'hidden_size_yy_l1': 3, 'context_size_yy': 2, 'num_mix_components_yy': 4, 'context_extractor_yy': 'lstm', 'activation_func_yy': 'Tanh', 'L2_weight_yy': 1.1274305507353762e-08, 'L_entropy_weight_yy': 4.628833878795046e-05, 'L_sep_weight_yy': 0.0001781155203949724, 'L_scale_weight_yy': 4.285092385140085e-09, 'learning_rate_yy': 0.0010908012491698338}. Best is trial 39 with value: -2.7644834187235348.
