[I 2026-03-17 17:08:51,853] Trial 2 finished with value: -1.9613086163113012 and parameters: {'n_layers_yy': 1, 'hidden_size_yy_l0': 6, 'context_size_yy': 2, 'num_mix_components_yy': 2, 'context_extractor_yy': 'gru', 'activation_func_yy': 'GELU', 'L2_weight_yy': 2.502682694477318e-06, 'L_entropy_weight_yy': 2.318268657437957e-10, 'L_sep_weight_yy': 5.950873854518761e-10, 'L_scale_weight_yy': 1.5643425777803237e-08, 'learning_rate_yy': 0.0027992573073340804}. Best is trial 0 with value: -1.961334732726521.
[I 2026-03-17 17:08:52,579] Trial 7 pruned. 
[I 2026-03-17 17:08:54,455] Trial 8 pruned. 
[I 2026-03-17 17:08:54,699] Trial 22 pruned. 
[I 2026-03-17 17:08:55,883] Trial 8 pruned. 
[I 2026-03-17 17:08:56,444] Trial 3 pruned. 
[I 2026-03-17 17:08:56,457] Trial 3 pruned. 
[I 2026-03-17 17:08:57,695] Trial 3 pruned. 
[I 2026-03-17 17:08:58,949] Trial 5 pruned. 
[I 2026-03-17 17:09:00,114] Trial 9 pruned. 
[I 2026-03-17 17:09:00,732] Trial 4 pruned. 
[I 2026-03-17 17:09:00,974] Trial 2 finished with value: -1.8991288916744402 and parameters: {'n_layers_yy': 1, 'hidden_size_yy_l0': 3, 'context_size_yy': 3, 'num_mix_components_yy': 2, 'context_extractor_yy': 'lstm', 'activation_func_yy': 'ReLU', 'L2_weight_yy': 0.0008617082154669348, 'L_entropy_weight_yy': 2.019048846755842e-08, 'L_sep_weight_yy': 3.4449363597083874e-08, 'L_scale_weight_yy': 3.028002906093834e-08, 'learning_rate_yy': 0.0015619188527088608}. Best is trial 1 with value: -1.904395168930737.
[I 2026-03-17 17:09:02,118] Trial 6 pruned. 
[I 2026-03-17 17:09:02,652] Trial 9 pruned. 
[I 2026-03-17 17:09:03,826] Trial 1 finished with value: -2.510248337726791 and parameters: {'n_layers_yy': 2, 'hidden_size_yy_l0': 6, 'hidden_size_yy_l1': 5, 'context_size_yy': 1, 'num_mix_components_yy': 2, 'context_extractor_yy': 'lstm', 'activation_func_yy': 'Tanh', 'L2_weight_yy': 1.6419054113767445e-09, 'L_entropy_weight_yy': 1.2859106464434975e-05, 'L_sep_weight_yy': 2.162753152010922e-06, 'L_scale_weight_yy': 7.789414924594802e-10, 'learning_rate_yy': 0.004781296443487178}. Best is trial 1 with value: -2.510248337726791.
[I 2026-03-17 17:09:05,544] Trial 10 pruned. 
[I 2026-03-17 17:09:05,868] Trial 23 finished with value: 0.006200405054314192 and parameters: {'n_layers_yy': 2, 'hidden_size_yy_l0': 6, 'hidden_size_yy_l1': 6, 'context_size_yy': 3, 'num_mix_components_yy': 4, 'context_extractor_yy': 'lstm', 'activation_func_yy': 'Tanh', 'L2_weight_yy': 0.0008955318635286615, 'L_entropy_weight_yy': 0.00015144034130079223, 'L_sep_weight_yy': 4.882841465105368e-09, 'L_scale_weight_yy': 0.00018981009770890496, 'learning_rate_yy': 0.0049467588475879285}. Best is trial 10 with value: -0.004261507544406625.
[I 2026-03-17 17:09:07,252] Trial 4 pruned. 
[I 2026-03-17 17:09:09,183] Trial 3 pruned. 
[I 2026-03-17 17:09:09,877] Trial 2 pruned. 
[I 2026-03-17 17:09:11,174] Trial 8 pruned. 
[I 2026-03-17 17:09:11,671] Trial 5 pruned. 
[I 2026-03-17 17:09:12,947] Trial 1 finished with value: -2.9054178842918716 and parameters: {'n_layers_yy': 1, 'hidden_size_yy_l0': 6, 'context_size_yy': 2, 'num_mix_components_yy': 5, 'context_extractor_yy': 'lstm', 'activation_func_yy': 'ReLU', 'L2_weight_yy': 1.8654323961219166e-06, 'L_entropy_weight_yy': 2.4090153702658364e-10, 'L_sep_weight_yy': 1.948193849952907e-10, 'L_scale_weight_yy': 6.9041043182721e-10, 'learning_rate_yy': 0.004981253479696968}. Best is trial 0 with value: -2.971554416150561.
[I 2026-03-17 17:09:14,213] Trial 18 finished with value: -0.5759780443026242 and parameters: {'n_layers_yy': 1, 'hidden_size_yy_l0': 4, 'context_size_yy': 4, 'num_mix_components_yy': 3, 'context_extractor_yy': 'gru', 'activation_func_yy': 'Tanh', 'L2_weight_yy': 1.075536546076239e-10, 'L_entropy_weight_yy': 1.0644073160751762e-08, 'L_sep_weight_yy': 1.5562777904019313e-06, 'L_scale_weight_yy': 9.297100527527356e-08, 'learning_rate_yy': 0.004562543145155442}. Best is trial 3 with value: -0.5765003902220168.
[I 2026-03-17 17:09:17,366] Trial 19 pruned. 
[I 2026-03-17 17:09:18,625] Trial 24 pruned. 
[I 2026-03-17 17:09:18,916] Trial 9 pruned. 
[I 2026-03-17 17:09:19,328] Trial 2 pruned. 
[I 2026-03-17 17:09:23,638] Trial 25 pruned. 
[I 2026-03-17 17:09:24,091] Trial 10 finished with value: -0.4361472115059017 and parameters: {'n_layers_yy': 1, 'hidden_size_yy_l0': 4, 'context_size_yy': 3, 'num_mix_components_yy': 5, 'context_extractor_yy': 'lstm', 'activation_func_yy': 'GELU', 'L2_weight_yy': 1.1492278666113954e-10, 'L_entropy_weight_yy': 5.1521307505061476e-09, 'L_sep_weight_yy': 4.7235259884556945e-07, 'L_scale_weight_yy': 1.332918763379881e-10, 'learning_rate_yy': 0.008634897348540983}. Best is trial 10 with value: -0.4361472115059017.
[I 2026-03-17 17:09:25,464] Trial 3 pruned. 
[I 2026-03-17 17:09:27,185] Trial 11 pruned. 
[I 2026-03-17 17:09:27,939] Trial 1 finished with value: -1.6995445497944157 and parameters: {'n_layers_yy': 2, 'hidden_size_yy_l0': 4, 'hidden_size_yy_l1': 2, 'context_size_yy': 3, 'num_mix_components_yy': 1, 'context_extractor_yy': 'gru', 'activation_func_yy': 'Tanh', 'L2_weight_yy': 2.816012384101534e-10, 'L_entropy_weight_yy': 4.0634869769115915e-10, 'L_sep_weight_yy': 7.40057585612134e-05, 'L_scale_weight_yy': 1.5338220851244522e-07, 'learning_rate_yy': 0.004114953928194925}. Best is trial 0 with value: -1.7019540283753405.
[I 2026-03-17 17:09:29,731] Trial 12 pruned. 
[I 2026-03-17 17:09:30,113] Trial 5 pruned. 
[I 2026-03-17 17:09:30,628] Trial 2 finished with value: -3.112028763352754 and parameters: {'n_layers_yy': 2, 'hidden_size_yy_l0': 4, 'hidden_size_yy_l1': 5, 'context_size_yy': 2, 'num_mix_components_yy': 1, 'context_extractor_yy': 'lstm', 'activation_func_yy': 'GELU', 'L2_weight_yy': 3.512595862517941e-09, 'L_entropy_weight_yy': 1.4203927853662417e-07, 'L_sep_weight_yy': 3.1841788296454998e-06, 'L_scale_weight_yy': 1.0221226221256761e-10, 'learning_rate_yy': 0.0015904221508151986}. Best is trial 0 with value: -3.1169463448214536.
[I 2026-03-17 17:09:30,745] Trial 11 finished with value: -0.8232482729845596 and parameters: {'n_layers_yy': 1, 'hidden_size_yy_l0': 6, 'context_size_yy': 1, 'num_mix_components_yy': 1, 'context_extractor_yy': 'lstm', 'activation_func_yy': 'ReLU', 'L2_weight_yy': 1.6836648809706523e-06, 'L_entropy_weight_yy': 1.829173942786847e-08, 'L_sep_weight_yy': 0.0006947067624414012, 'L_scale_weight_yy': 1.2847402273102253e-10, 'learning_rate_yy': 0.007467795026542183}. Best is trial 2 with value: -0.833493141163047.
[I 2026-03-17 17:09:31,993] Trial 4 pruned. 
[I 2026-03-17 17:09:34,685] Trial 7 finished with value: -1.7952211441532258 and parameters: {'n_layers_yy': 2, 'hidden_size_yy_l0': 2, 'hidden_size_yy_l1': 6, 'context_size_yy': 2, 'num_mix_components_yy': 3, 'context_extractor_yy': 'gru', 'activation_func_yy': 'ReLU', 'L2_weight_yy': 2.9230905101610014e-07, 'L_entropy_weight_yy': 0.0004891213260087064, 'L_sep_weight_yy': 5.842003947675952e-07, 'L_scale_weight_yy': 4.227626822449956e-09, 'learning_rate_yy': 0.009509954436795927}. Best is trial 2 with value: -1.824331576606496.
[I 2026-03-17 17:09:35,878] Trial 11 finished with value: -1.4496956693209135 and parameters: {'n_layers_yy': 1, 'hidden_size_yy_l0': 6, 'context_size_yy': 4, 'num_mix_components_yy': 4, 'context_extractor_yy': 'gru', 'activation_func_yy': 'ReLU', 'L2_weight_yy': 1.2701979998255813e-10, 'L_entropy_weight_yy': 4.020666894595333e-09, 'L_sep_weight_yy': 4.905170889513673e-06, 'L_scale_weight_yy': 4.310588908558808e-09, 'learning_rate_yy': 0.0035456841546639443}. Best is trial 1 with value: -1.4537486853966346.
[I 2026-03-17 17:09:36,794] Trial 26 pruned. 
[I 2026-03-17 17:09:38,246] Trial 6 pruned. 
[I 2026-03-17 17:09:38,748] Trial 12 pruned. 
[I 2026-03-17 17:09:39,220] Trial 12 finished with value: -1.6131555846140806 and parameters: {'n_layers_yy': 2, 'hidden_size_yy_l0': 2, 'hidden_size_yy_l1': 6, 'context_size_yy': 3, 'num_mix_components_yy': 3, 'context_extractor_yy': 'lstm', 'activation_func_yy': 'Tanh', 'L2_weight_yy': 0.0009041581724265024, 'L_entropy_weight_yy': 5.588857933938169e-09, 'L_sep_weight_yy': 4.260772437619117e-09, 'L_scale_weight_yy': 4.2290269748325855e-08, 'learning_rate_yy': 0.004056601406219838}. Best is trial 12 with value: -1.6131555846140806.
[I 2026-03-17 17:09:40,396] Trial 4 pruned. 
[I 2026-03-17 17:09:40,500] Trial 10 pruned. 
[I 2026-03-17 17:09:40,533] Trial 3 pruned. 
[I 2026-03-17 17:09:41,537] Trial 13 pruned. 
[I 2026-03-17 17:09:41,743] Trial 7 pruned. 
[I 2026-03-17 17:09:42,232] Trial 27 pruned. 
[I 2026-03-17 17:09:44,463] Trial 14 pruned. 
[I 2026-03-17 17:09:45,020] Trial 28 pruned. 
[I 2026-03-17 17:09:45,279] Trial 8 pruned. 
[I 2026-03-17 17:09:47,073] Trial 5 finished with value: -1.9797399345147981 and parameters: {'n_layers_yy': 1, 'hidden_size_yy_l0': 6, 'context_size_yy': 2, 'num_mix_components_yy': 4, 'context_extractor_yy': 'lstm', 'activation_func_yy': 'ReLU', 'L2_weight_yy': 6.052545488096514e-07, 'L_entropy_weight_yy': 7.402322190913291e-07, 'L_sep_weight_yy': 2.2956747697828768e-07, 'L_scale_weight_yy': 1.1420273287477692e-06, 'learning_rate_yy': 0.00806988514677899}. Best is trial 5 with value: -1.9797399345147981.
[I 2026-03-17 17:09:47,170] Trial 5 pruned. 
[I 2026-03-17 17:09:47,724] Trial 15 pruned. 
[I 2026-03-17 17:09:47,847] Trial 29 pruned. 
[I 2026-03-17 17:09:49,417] Trial 1 finished with value: -2.4744414717830128 and parameters: {'n_layers_yy': 1, 'hidden_size_yy_l0': 6, 'context_size_yy': 4, 'num_mix_components_yy': 4, 'context_extractor_yy': 'gru', 'activation_func_yy': 'Tanh', 'L2_weight_yy': 2.9328150810644525e-06, 'L_entropy_weight_yy': 7.733882994149386e-05, 'L_sep_weight_yy': 7.561253764748537e-10, 'L_scale_weight_yy': 7.76860280212359e-07, 'learning_rate_yy': 0.0007472426633053396}. Best is trial 1 with value: -2.4744414717830128.
[I 2026-03-17 17:09:49,747] Trial 20 finished with value: -0.5796154079935738 and parameters: {'n_layers_yy': 1, 'hidden_size_yy_l0': 4, 'context_size_yy': 4, 'num_mix_components_yy': 3, 'context_extractor_yy': 'gru', 'activation_func_yy': 'Tanh', 'L2_weight_yy': 1.3400993964997038e-10, 'L_entropy_weight_yy': 1.5950599784489037e-08, 'L_sep_weight_yy': 2.0067360793585517e-07, 'L_scale_weight_yy': 1.4679405218199106e-10, 'learning_rate_yy': 0.008134483135789157}. Best is trial 20 with value: -0.5796154079935738.
[I 2026-03-17 17:09:51,671] Trial 13 finished with value: -0.4278714206565644 and parameters: {'n_layers_yy': 1, 'hidden_size_yy_l0': 4, 'context_size_yy': 4, 'num_mix_components_yy': 5, 'context_extractor_yy': 'lstm', 'activation_func_yy': 'GELU', 'L2_weight_yy': 2.1337443498975374e-09, 'L_entropy_weight_yy': 7.768757575877776e-09, 'L_sep_weight_yy': 1.0240030190380232e-06, 'L_scale_weight_yy': 1.8017699044293001e-09, 'learning_rate_yy': 0.00589559770672725}. Best is trial 10 with value: -0.4361472115059017.
[I 2026-03-17 17:09:51,674] Trial 6 pruned. 
[I 2026-03-17 17:09:53,052] Trial 30 pruned. 
[I 2026-03-17 17:09:53,344] Trial 6 pruned. 
[I 2026-03-17 17:09:54,252] Trial 14 pruned. 
[I 2026-03-17 17:09:54,407] Trial 3 finished with value: -1.8518123296260502 and parameters: {'n_layers_yy': 2, 'hidden_size_yy_l0': 3, 'hidden_size_yy_l1': 2, 'context_size_yy': 4, 'num_mix_components_yy': 4, 'context_extractor_yy': 'gru', 'activation_func_yy': 'ReLU', 'L2_weight_yy': 1.841776758957418e-05, 'L_entropy_weight_yy': 5.73478775095174e-08, 'L_sep_weight_yy': 1.3303765450370337e-06, 'L_scale_weight_yy': 3.5687469447217386e-05, 'learning_rate_yy': 0.0014463443295024212}. Best is trial 2 with value: -1.852375329243005.
[I 2026-03-17 17:09:56,135] Trial 21 pruned. 
[I 2026-03-17 17:09:56,480] Trial 2 pruned. 
[I 2026-03-17 17:09:56,710] Trial 15 pruned. 
[I 2026-03-17 17:09:58,385] Trial 4 pruned. 
[I 2026-03-17 17:09:59,297] Trial 16 pruned. 
[I 2026-03-17 17:10:02,887] Trial 2 finished with value: -1.7827982954545454 and parameters: {'n_layers_yy': 1, 'hidden_size_yy_l0': 4, 'context_size_yy': 2, 'num_mix_components_yy': 4, 'context_extractor_yy': 'gru', 'activation_func_yy': 'Tanh', 'L2_weight_yy': 0.00010595771513930018, 'L_entropy_weight_yy': 6.856525672391088e-08, 'L_sep_weight_yy': 7.73620174215815e-07, 'L_scale_weight_yy': 3.683645913014303e-06, 'learning_rate_yy': 0.0018067118478949033}. Best is trial 2 with value: -1.7827982954545454.
[I 2026-03-17 17:10:03,392] Trial 22 pruned. 
[I 2026-03-17 17:10:04,623] Trial 16 pruned. 
[I 2026-03-17 17:10:05,377] Trial 6 finished with value: -2.5966211297149253 and parameters: {'n_layers_yy': 1, 'hidden_size_yy_l0': 4, 'context_size_yy': 4, 'num_mix_components_yy': 2, 'context_extractor_yy': 'lstm', 'activation_func_yy': 'Tanh', 'L2_weight_yy': 0.0001580867885867202, 'L_entropy_weight_yy': 2.800429390765483e-10, 'L_sep_weight_yy': 7.843392213988312e-10, 'L_scale_weight_yy': 2.1118676306013806e-09, 'learning_rate_yy': 0.0015770490473543148}. Best is trial 1 with value: -2.632149061912318.
[I 2026-03-17 17:10:05,740] Trial 4 finished with value: -1.9527666243196802 and parameters: {'n_layers_yy': 1, 'hidden_size_yy_l0': 2, 'context_size_yy': 1, 'num_mix_components_yy': 2, 'context_extractor_yy': 'gru', 'activation_func_yy': 'Tanh', 'L2_weight_yy': 0.00022401628658786008, 'L_entropy_weight_yy': 3.018251870528317e-06, 'L_sep_weight_yy': 7.6083268553260376e-06, 'L_scale_weight_yy': 0.0009569867550048377, 'learning_rate_yy': 0.0017615337775109736}. Best is trial 1 with value: -1.9741431522447364.
[I 2026-03-17 17:10:08,146] Trial 31 finished with value: -0.0010883447735808617 and parameters: {'n_layers_yy': 2, 'hidden_size_yy_l0': 6, 'hidden_size_yy_l1': 5, 'context_size_yy': 3, 'num_mix_components_yy': 5, 'context_extractor_yy': 'lstm', 'activation_func_yy': 'Tanh', 'L2_weight_yy': 0.0008489232459711484, 'L_entropy_weight_yy': 0.000913943954766293, 'L_sep_weight_yy': 2.323386860867468e-08, 'L_scale_weight_yy': 3.783125469789645e-05, 'learning_rate_yy': 0.004173565985660219}. Best is trial 10 with value: -0.004261507544406625.
[I 2026-03-17 17:10:09,751] Trial 5 pruned. 
[I 2026-03-17 17:10:12,630] Trial 8 finished with value: -1.7962948156224372 and parameters: {'n_layers_yy': 1, 'hidden_size_yy_l0': 6, 'context_size_yy': 4, 'num_mix_components_yy': 2, 'context_extractor_yy': 'lstm', 'activation_func_yy': 'Tanh', 'L2_weight_yy': 1.3227395634228629e-09, 'L_entropy_weight_yy': 3.2107907718233485e-10, 'L_sep_weight_yy': 0.0005697766432549331, 'L_scale_weight_yy': 0.0004908169833935627, 'learning_rate_yy': 0.0020086182152386782}. Best is trial 2 with value: -1.824331576606496.
[I 2026-03-17 17:10:13,427] Trial 32 pruned. 
[I 2026-03-17 17:10:14,132] Trial 3 pruned. 
[I 2026-03-17 17:10:16,020] Trial 9 pruned. 
[I 2026-03-17 17:10:18,033] Trial 12 finished with value: -0.8183012022753762 and parameters: {'n_layers_yy': 1, 'hidden_size_yy_l0': 5, 'context_size_yy': 2, 'num_mix_components_yy': 3, 'context_extractor_yy': 'lstm', 'activation_func_yy': 'ReLU', 'L2_weight_yy': 3.068345639926838e-06, 'L_entropy_weight_yy': 1.0384755246952532e-08, 'L_sep_weight_yy': 0.0008122988242569823, 'L_scale_weight_yy': 3.379541614687603e-08, 'learning_rate_yy': 0.0063315383385519316}. Best is trial 2 with value: -0.833493141163047.
[I 2026-03-17 17:10:18,889] Trial 13 finished with value: -1.6125775076204745 and parameters: {'n_layers_yy': 2, 'hidden_size_yy_l0': 2, 'hidden_size_yy_l1': 5, 'context_size_yy': 4, 'num_mix_components_yy': 3, 'context_extractor_yy': 'lstm', 'activation_func_yy': 'ReLU', 'L2_weight_yy': 0.0007883843472824355, 'L_entropy_weight_yy': 2.404908003685552e-09, 'L_sep_weight_yy': 2.9358731860803766e-09, 'L_scale_weight_yy': 3.686748322103395e-08, 'learning_rate_yy': 0.004565603406537268}. Best is trial 12 with value: -1.6131555846140806.
[I 2026-03-17 17:10:20,193] Trial 17 finished with value: -0.39197684367743807 and parameters: {'n_layers_yy': 1, 'hidden_size_yy_l0': 3, 'context_size_yy': 4, 'num_mix_components_yy': 3, 'context_extractor_yy': 'lstm', 'activation_func_yy': 'GELU', 'L2_weight_yy': 8.548523376612134e-10, 'L_entropy_weight_yy': 1.2637145248517545e-05, 'L_sep_weight_yy': 6.212433859824606e-05, 'L_scale_weight_yy': 8.440389760769988e-09, 'learning_rate_yy': 0.007752537150141753}. Best is trial 10 with value: -0.4361472115059017.
[I 2026-03-17 17:10:20,760] Trial 13 pruned. 
[I 2026-03-17 17:10:22,731] Trial 1 finished with value: -2.8017948470867085 and parameters: {'n_layers_yy': 2, 'hidden_size_yy_l0': 4, 'hidden_size_yy_l1': 6, 'context_size_yy': 4, 'num_mix_components_yy': 4, 'context_extractor_yy': 'lstm', 'activation_func_yy': 'ReLU', 'L2_weight_yy': 2.6691882258160436e-06, 'L_entropy_weight_yy': 3.668256859596191e-05, 'L_sep_weight_yy': 2.9236680173688933e-05, 'L_scale_weight_yy': 0.0004970852925909666, 'learning_rate_yy': 0.001732073998436813}. Best is trial 1 with value: -2.8017948470867085.
[I 2026-03-17 17:10:22,957] Trial 5 finished with value: -1.2410345800262281 and parameters: {'n_layers_yy': 2, 'hidden_size_yy_l0': 5, 'hidden_size_yy_l1': 4, 'context_size_yy': 4, 'num_mix_components_yy': 1, 'context_extractor_yy': 'lstm', 'activation_func_yy': 'ReLU', 'L2_weight_yy': 1.5479675408121763e-05, 'L_entropy_weight_yy': 6.275056872602039e-07, 'L_sep_weight_yy': 0.00010265499817521236, 'L_scale_weight_yy': 0.0003330698344583729, 'learning_rate_yy': 0.005962508837745588}. Best is trial 1 with value: -1.260024502625527.
[I 2026-03-17 17:10:24,030] Trial 2 finished with value: -2.085143293953302 and parameters: {'n_layers_yy': 2, 'hidden_size_yy_l0': 2, 'hidden_size_yy_l1': 4, 'context_size_yy': 2, 'num_mix_components_yy': 5, 'context_extractor_yy': 'lstm', 'activation_func_yy': 'ReLU', 'L2_weight_yy': 7.073681233587752e-07, 'L_entropy_weight_yy': 6.846689274168897e-05, 'L_sep_weight_yy': 5.917900973190081e-09, 'L_scale_weight_yy': 5.748620623980484e-08, 'learning_rate_yy': 0.008903406572901918}. Best is trial 1 with value: -2.089371130855073.
[I 2026-03-17 17:10:25,268] Trial 18 pruned. 
[I 2026-03-17 17:10:25,291] Trial 4 finished with value: -2.3705481780818634 and parameters: {'n_layers_yy': 2, 'hidden_size_yy_l0': 3, 'hidden_size_yy_l1': 6, 'context_size_yy': 2, 'num_mix_components_yy': 5, 'context_extractor_yy': 'gru', 'activation_func_yy': 'Tanh', 'L2_weight_yy': 1.1101447780206659e-07, 'L_entropy_weight_yy': 5.363425427931035e-06, 'L_sep_weight_yy': 2.2267972923994128e-10, 'L_scale_weight_yy': 1.6146908172314048e-06, 'learning_rate_yy': 0.001278296738852674}. Best is trial 4 with value: -2.3705481780818634.
[I 2026-03-17 17:10:25,481] Trial 6 pruned. 
[I 2026-03-17 17:10:25,787] Trial 14 pruned. 
[I 2026-03-17 17:10:25,985] Trial 6 pruned. 
[I 2026-03-17 17:10:28,112] Trial 33 finished with value: 0.014069365900616313 and parameters: {'n_layers_yy': 2, 'hidden_size_yy_l0': 6, 'hidden_size_yy_l1': 5, 'context_size_yy': 3, 'num_mix_components_yy': 5, 'context_extractor_yy': 'lstm', 'activation_func_yy': 'Tanh', 'L2_weight_yy': 0.00010977898677896567, 'L_entropy_weight_yy': 0.0001297833489478521, 'L_sep_weight_yy': 1.3959701477199208e-07, 'L_scale_weight_yy': 7.031380759692122e-05, 'learning_rate_yy': 0.0018648050627445014}. Best is trial 10 with value: -0.004261507544406625.
[I 2026-03-17 17:10:29,506] Trial 5 pruned. 
[I 2026-03-17 17:10:29,585] Trial 7 pruned. 
[I 2026-03-17 17:10:30,547] Trial 19 pruned. 
[I 2026-03-17 17:10:31,113] Trial 15 pruned. 
[I 2026-03-17 17:10:32,665] Trial 17 finished with value: -1.431339627779447 and parameters: {'n_layers_yy': 2, 'hidden_size_yy_l0': 6, 'hidden_size_yy_l1': 3, 'context_size_yy': 4, 'num_mix_components_yy': 3, 'context_extractor_yy': 'gru', 'activation_func_yy': 'ReLU', 'L2_weight_yy': 5.687901059591403e-07, 'L_entropy_weight_yy': 1.0513787572358864e-10, 'L_sep_weight_yy': 0.0007403550854152348, 'L_scale_weight_yy': 1.5088347390030442e-09, 'learning_rate_yy': 0.0046633408237214576}. Best is trial 1 with value: -1.4537486853966346.
[I 2026-03-17 17:10:33,114] Trial 34 pruned. 
[I 2026-03-17 17:10:33,803] Trial 16 pruned. 
[I 2026-03-17 17:10:35,000] Trial 10 pruned. 
[I 2026-03-17 17:10:35,607] Trial 35 pruned. 
[I 2026-03-17 17:10:35,757] Trial 3 pruned. 
[I 2026-03-17 17:10:36,683] Trial 23 finished with value: -0.579728663049669 and parameters: {'n_layers_yy': 1, 'hidden_size_yy_l0': 4, 'context_size_yy': 4, 'num_mix_components_yy': 3, 'context_extractor_yy': 'gru', 'activation_func_yy': 'Tanh', 'L2_weight_yy': 5.801459368245047e-08, 'L_entropy_weight_yy': 3.423752611680112e-08, 'L_sep_weight_yy': 6.33035155092737e-08, 'L_scale_weight_yy': 7.060119213648161e-05, 'learning_rate_yy': 0.007883533912736976}. Best is trial 23 with value: -0.579728663049669.
[I 2026-03-17 17:10:36,708] Trial 8 pruned. 
[I 2026-03-17 17:10:37,075] Trial 1 finished with value: -2.7521982412446278 and parameters: {'n_layers_yy': 1, 'hidden_size_yy_l0': 3, 'context_size_yy': 1, 'num_mix_components_yy': 2, 'context_extractor_yy': 'gru', 'activation_func_yy': 'GELU', 'L2_weight_yy': 3.2225966391569975e-05, 'L_entropy_weight_yy': 0.0001572488644118451, 'L_sep_weight_yy': 0.0003197494833993093, 'L_scale_weight_yy': 2.8221364148161874e-09, 'learning_rate_yy': 0.0011125535478581498}. Best is trial 1 with value: -2.7521982412446278.
[I 2026-03-17 17:10:38,303] Trial 11 pruned. 
[I 2026-03-17 17:10:38,888] Trial 17 pruned. 
[I 2026-03-17 17:10:39,102] Trial 6 finished with value: -1.969607611318543 and parameters: {'n_layers_yy': 1, 'hidden_size_yy_l0': 4, 'context_size_yy': 4, 'num_mix_components_yy': 3, 'context_extractor_yy': 'lstm', 'activation_func_yy': 'ReLU', 'L2_weight_yy': 4.840325494951554e-10, 'L_entropy_weight_yy': 0.00023447208377958247, 'L_sep_weight_yy': 1.8051415083482516e-08, 'L_scale_weight_yy': 4.0399739250252245e-07, 'learning_rate_yy': 0.008401472524888737}. Best is trial 1 with value: -1.9741431522447364.
[I 2026-03-17 17:10:42,775] Trial 2 pruned. 
