[I 2026-03-17 17:12:28,812] Trial 11 finished with value: -1.2688432577136703 and parameters: {'n_layers_yy': 2, 'hidden_size_yy_l0': 6, 'hidden_size_yy_l1': 6, 'context_size_yy': 2, 'num_mix_components_yy': 4, 'context_extractor_yy': 'lstm', 'activation_func_yy': 'Tanh', 'L2_weight_yy': 4.450407257120512e-09, 'L_entropy_weight_yy': 4.925520200916991e-09, 'L_sep_weight_yy': 7.329693260706103e-09, 'L_scale_weight_yy': 4.8781380892741857e-08, 'learning_rate_yy': 0.0018193633178924709}. Best is trial 9 with value: -1.2718806099318753.
[I 2026-03-17 17:12:29,244] Trial 2 finished with value: -2.8048498209555515 and parameters: {'n_layers_yy': 1, 'hidden_size_yy_l0': 5, 'context_size_yy': 3, 'num_mix_components_yy': 3, 'context_extractor_yy': 'lstm', 'activation_func_yy': 'ReLU', 'L2_weight_yy': 2.330551256886016e-06, 'L_entropy_weight_yy': 5.544202032698929e-07, 'L_sep_weight_yy': 1.5467570203387621e-07, 'L_scale_weight_yy': 2.6426913342239895e-10, 'learning_rate_yy': 0.005565928797454786}. Best is trial 2 with value: -2.8048498209555515.
[I 2026-03-17 17:12:29,544] Trial 16 pruned. 
[I 2026-03-17 17:12:29,776] Trial 4 finished with value: -1.7828340534248737 and parameters: {'n_layers_yy': 2, 'hidden_size_yy_l0': 2, 'hidden_size_yy_l1': 2, 'context_size_yy': 1, 'num_mix_components_yy': 2, 'context_extractor_yy': 'lstm', 'activation_func_yy': 'Tanh', 'L2_weight_yy': 2.2655062030648394e-06, 'L_entropy_weight_yy': 5.8573953952553315e-08, 'L_sep_weight_yy': 2.0121909639746217e-05, 'L_scale_weight_yy': 1.314577695975491e-06, 'learning_rate_yy': 0.009868682124470837}. Best is trial 4 with value: -1.7828340534248737.
[I 2026-03-17 17:12:30,793] Trial 31 pruned. 
[I 2026-03-17 17:12:30,955] Trial 13 pruned. 
[I 2026-03-17 17:12:33,225] Trial 17 pruned. 
[I 2026-03-17 17:12:33,568] Trial 32 pruned. 
[I 2026-03-17 17:12:34,794] Trial 25 finished with value: -1.4279976712740385 and parameters: {'n_layers_yy': 1, 'hidden_size_yy_l0': 6, 'context_size_yy': 4, 'num_mix_components_yy': 5, 'context_extractor_yy': 'gru', 'activation_func_yy': 'ReLU', 'L2_weight_yy': 9.207475570562803e-09, 'L_entropy_weight_yy': 1.0021187623546196e-06, 'L_sep_weight_yy': 8.642500380572667e-07, 'L_scale_weight_yy': 1.8772536738017742e-05, 'learning_rate_yy': 0.003950312426594542}. Best is trial 1 with value: -1.4537486853966346.
[I 2026-03-17 17:12:35,586] Trial 7 finished with value: -3.118696402050166 and parameters: {'n_layers_yy': 1, 'hidden_size_yy_l0': 5, 'context_size_yy': 4, 'num_mix_components_yy': 2, 'context_extractor_yy': 'gru', 'activation_func_yy': 'ReLU', 'L2_weight_yy': 6.137304098243918e-06, 'L_entropy_weight_yy': 1.983920695311597e-09, 'L_sep_weight_yy': 1.1419228600525503e-08, 'L_scale_weight_yy': 1.1148929656515935e-06, 'learning_rate_yy': 0.006563397254278725}. Best is trial 7 with value: -3.118696402050166.
[I 2026-03-17 17:12:35,758] Trial 12 pruned. 
[I 2026-03-17 17:12:36,262] Trial 14 pruned. 
[I 2026-03-17 17:12:37,692] Trial 26 pruned. 
[I 2026-03-17 17:12:38,792] Trial 33 pruned. 
[I 2026-03-17 17:12:39,185] Trial 11 pruned. 
[I 2026-03-17 17:12:39,266] Trial 13 pruned. 
[I 2026-03-17 17:12:40,000] Trial 48 pruned. 
[I 2026-03-17 17:12:40,729] Trial 2 pruned. 
[I 2026-03-17 17:12:41,657] Trial 34 pruned. 
[I 2026-03-17 17:12:41,661] Trial 22 pruned. 
[I 2026-03-17 17:12:42,591] Trial 14 pruned. 
[I 2026-03-17 17:12:42,823] Trial 14 pruned. 
[I 2026-03-17 17:12:43,221] Trial 12 pruned. 
[I 2026-03-17 17:12:43,543] Trial 37 pruned. 
[I 2026-03-17 17:12:43,563] Trial 27 pruned. 
[I 2026-03-17 17:12:44,261] Trial 8 pruned. 
[I 2026-03-17 17:12:45,969] Trial 15 pruned. 
[I 2026-03-17 17:12:47,038] Trial 6 finished with value: -1.700829440718034 and parameters: {'n_layers_yy': 1, 'hidden_size_yy_l0': 5, 'context_size_yy': 4, 'num_mix_components_yy': 2, 'context_extractor_yy': 'lstm', 'activation_func_yy': 'Tanh', 'L2_weight_yy': 0.0005387220723439726, 'L_entropy_weight_yy': 3.747077503586572e-10, 'L_sep_weight_yy': 7.181165762811742e-05, 'L_scale_weight_yy': 1.405579414606583e-07, 'learning_rate_yy': 0.001390491947504155}. Best is trial 3 with value: -1.702986696445342.
[I 2026-03-17 17:12:47,052] Trial 28 pruned. 
[I 2026-03-17 17:12:48,436] Trial 10 pruned. 
[I 2026-03-17 17:12:49,872] Trial 15 pruned. 
[I 2026-03-17 17:12:52,732] Trial 49 pruned. 
Optimize task 23: group_id: POm, neuron_id: 57
Starting optimization for task 23...

--- Data Summary ---
Total events for target process 1872
Data Time: 900 seconds
Using device: cuda
Number of events in target process: 1872
Only one process provided, preparing dataloaders for the reduced model.
Reduced model ln_yy : 3.93609 nats/sec, 1.89235 nats/event
Reduced model Log loss : 0.05985
Number of events in target process: 1872
Only one process provided, preparing dataloaders for the reduced model.
Number of events in target process: 1872
Only one process provided, preparing dataloaders for the reduced model.
Number of events in target process: 1872
Only one process provided, preparing dataloaders for the reduced model.
Number of events in target process: 1872
Only one process provided, preparing dataloaders for the reduced model.
Number of events in target process: 1872
Only one process provided, preparing dataloaders for the reduced model.
Number of events in target process: 1872
Only one process provided, preparing dataloaders for the reduced model.
Reduced model ln_yy : 4.18562 nats/sec, 2.01232 nats/event
Reduced model Log loss : 0.03994
Number of events in target process: 1872
Only one process provided, preparing dataloaders for the reduced model.
Reduced model ln_yy : 4.21317 nats/sec, 2.02556 nats/event
Reduced model Log loss : 0.00372
Number of events in target process: 1872
Only one process provided, preparing dataloaders for the reduced model.
Number of events in target process: 1872
Only one process provided, preparing dataloaders for the reduced model.
Reduced model ln_yy : 4.10023 nats/sec, 1.97126 nats/event
Reduced model Log loss : -0.00332
Number of events in target process: 1872
Only one process provided, preparing dataloaders for the reduced model.
Reduced model ln_yy : 4.11055 nats/sec, 1.97623 nats/event
Reduced model Log loss : -0.00426
Number of events in target process: 1872
Only one process provided, preparing dataloaders for the reduced model.
Number of events in target process: 1872
Only one process provided, preparing dataloaders for the reduced model.
Reduced model ln_yy : 4.00957 nats/sec, 1.92768 nats/event
Reduced model Log loss : -0.00043
Number of events in target process: 1872
Only one process provided, preparing dataloaders for the reduced model.
Number of events in target process: 1872
Only one process provided, preparing dataloaders for the reduced model.
Number of events in target process: 1872
Only one process provided, preparing dataloaders for the reduced model.
Number of events in target process: 1872
Only one process provided, preparing dataloaders for the reduced model.
Number of events in target process: 1872
Only one process provided, preparing dataloaders for the reduced model.
Reduced model ln_yy : 4.20089 nats/sec, 2.01966 nats/event
Reduced model Log loss : 0.00548
Number of events in target process: 1872
Only one process provided, preparing dataloaders for the reduced model.
Number of events in target process: 1872
Only one process provided, preparing dataloaders for the reduced model.
Number of events in target process: 1872
Only one process provided, preparing dataloaders for the reduced model.
Number of events in target process: 1872
Only one process provided, preparing dataloaders for the reduced model.
Reduced model ln_yy : 4.01575 nats/sec, 1.93065 nats/event
Reduced model Log loss : -0.00135
Number of events in target process: 1872
Only one process provided, preparing dataloaders for the reduced model.
Number of events in target process: 1872
Only one process provided, preparing dataloaders for the reduced model.
Reduced model ln_yy : 4.10317 nats/sec, 1.97268 nats/event
Reduced model Log loss : 0.00620
Number of events in target process: 1872
Only one process provided, preparing dataloaders for the reduced model.
Number of events in target process: 1872
Only one process provided, preparing dataloaders for the reduced model.
Number of events in target process: 1872
Only one process provided, preparing dataloaders for the reduced model.
Number of events in target process: 1872
Only one process provided, preparing dataloaders for the reduced model.
Number of events in target process: 1872
Only one process provided, preparing dataloaders for the reduced model.
Number of events in target process: 1872
Only one process provided, preparing dataloaders for the reduced model.
Number of events in target process: 1872
Only one process provided, preparing dataloaders for the reduced model.
Number of events in target process: 1872
Only one process provided, preparing dataloaders for the reduced model.
Reduced model ln_yy : 4.00905 nats/sec, 1.92743 nats/event
Reduced model Log loss : -0.00109
Number of events in target process: 1872
Only one process provided, preparing dataloaders for the reduced model.
Number of events in target process: 1872
Only one process provided, preparing dataloaders for the reduced model.
Reduced model ln_yy : 4.01244 nats/sec, 1.92906 nats/event
Reduced model Log loss : 0.01407
Number of events in target process: 1872
Only one process provided, preparing dataloaders for the reduced model.
Number of events in target process: 1872
Only one process provided, preparing dataloaders for the reduced model.
Number of events in target process: 1872
Only one process provided, preparing dataloaders for the reduced model.
Number of events in target process: 1872
Only one process provided, preparing dataloaders for the reduced model.
Number of events in target process: 1872
Only one process provided, preparing dataloaders for the reduced model.
Number of events in target process: 1872
Only one process provided, preparing dataloaders for the reduced model.
Number of events in target process: 1872
Only one process provided, preparing dataloaders for the reduced model.
Number of events in target process: 1872
Only one process provided, preparing dataloaders for the reduced model.
Reduced model ln_yy : 4.00749 nats/sec, 1.92668 nats/event
Reduced model Log loss : -0.00158
Number of events in target process: 1872
Only one process provided, preparing dataloaders for the reduced model.
Number of events in target process: 1872
Only one process provided, preparing dataloaders for the reduced model.
Reduced model ln_yy : 4.13180 nats/sec, 1.98644 nats/event
Reduced model Log loss : -0.00631
Number of events in target process: 1872
Only one process provided, preparing dataloaders for the reduced model.
Number of events in target process: 1872
Only one process provided, preparing dataloaders for the reduced model.
Reduced model ln_yy : 4.16209 nats/sec, 2.00100 nats/event
Reduced model Log loss : -0.01096
Number of events in target process: 1872
Only one process provided, preparing dataloaders for the reduced model.
Reduced model ln_yy : 4.01089 nats/sec, 1.92831 nats/event
Reduced model Log loss : -0.00445
Number of events in target process: 1872
Only one process provided, preparing dataloaders for the reduced model.
Number of events in target process: 1872
Only one process provided, preparing dataloaders for the reduced model.
Number of events in target process: 1872
Only one process provided, preparing dataloaders for the reduced model.
Best trial:
  Value: -0.010956101639326228
  Params: {'n_layers_yy': 2, 'hidden_size_yy_l0': 6, 'hidden_size_yy_l1': 4, 'context_size_yy': 3, 'num_mix_components_yy': 2, 'context_extractor_yy': 'lstm', 'activation_func_yy': 'Tanh', 'L2_weight_yy': 1.4534924251662164e-07, 'L_entropy_weight_yy': 5.095256867365438e-05, 'L_sep_weight_yy': 1.771931285326037e-07, 'L_scale_weight_yy': 2.174089403941853e-05, 'learning_rate_yy': 0.008079292312455317}
Full best configuration saved to results/opt/opt_reduced_23_best_config.txt
Optimization finished.
[I 2026-03-17 17:12:53,581] Trial 29 pruned. 
[I 2026-03-17 17:12:53,581] Trial 9 pruned. 
[I 2026-03-17 17:12:53,759] Trial 16 pruned. 
[I 2026-03-17 17:12:54,979] Trial 23 pruned. 
[I 2026-03-17 17:12:56,033] Trial 11 pruned. 
[I 2026-03-17 17:12:57,909] Trial 8 pruned. 
[I 2026-03-17 17:12:57,917] Trial 24 pruned. 
[I 2026-03-17 17:12:58,941] Trial 35 finished with value: -0.4377863266888787 and parameters: {'n_layers_yy': 2, 'hidden_size_yy_l0': 5, 'hidden_size_yy_l1': 6, 'context_size_yy': 1, 'num_mix_components_yy': 4, 'context_extractor_yy': 'lstm', 'activation_func_yy': 'GELU', 'L2_weight_yy': 3.976882409375745e-09, 'L_entropy_weight_yy': 3.9411699683259035e-10, 'L_sep_weight_yy': 1.801321106992904e-08, 'L_scale_weight_yy': 8.364503147747257e-10, 'learning_rate_yy': 0.008857746877941271}. Best is trial 35 with value: -0.4377863266888787.
[I 2026-03-17 17:12:59,602] Trial 10 finished with value: -1.9694787288238451 and parameters: {'n_layers_yy': 2, 'hidden_size_yy_l0': 5, 'hidden_size_yy_l1': 6, 'context_size_yy': 2, 'num_mix_components_yy': 4, 'context_extractor_yy': 'lstm', 'activation_func_yy': 'Tanh', 'L2_weight_yy': 8.781868581445029e-06, 'L_entropy_weight_yy': 1.1074087128459671e-10, 'L_sep_weight_yy': 1.024007240655122e-10, 'L_scale_weight_yy': 1.295164326028413e-08, 'learning_rate_yy': 0.004075086427475739}. Best is trial 1 with value: -1.9741431522447364.
[I 2026-03-17 17:13:00,029] Trial 30 pruned. 
[I 2026-03-17 17:13:02,050] Trial 6 finished with value: -2.3735855196151263 and parameters: {'n_layers_yy': 1, 'hidden_size_yy_l0': 5, 'context_size_yy': 1, 'num_mix_components_yy': 2, 'context_extractor_yy': 'lstm', 'activation_func_yy': 'Tanh', 'L2_weight_yy': 1.7635315860782141e-09, 'L_entropy_weight_yy': 5.258531599386802e-06, 'L_sep_weight_yy': 6.781164842136726e-09, 'L_scale_weight_yy': 0.00010902700719135698, 'learning_rate_yy': 0.001106792639817646}. Best is trial 6 with value: -2.3735855196151263.
[I 2026-03-17 17:13:02,281] Trial 10 pruned. 
[I 2026-03-17 17:13:02,708] Trial 31 pruned. 
[I 2026-03-17 17:13:03,248] Trial 25 pruned. 
[I 2026-03-17 17:13:05,488] Trial 26 pruned. 
[I 2026-03-17 17:13:05,535] Trial 32 pruned. 
[I 2026-03-17 17:13:07,622] Trial 11 pruned. 
[I 2026-03-17 17:13:07,856] Trial 27 pruned. 
[I 2026-03-17 17:13:08,288] Trial 15 pruned. 
[I 2026-03-17 17:13:10,047] Trial 28 pruned. 
[I 2026-03-17 17:13:10,578] Trial 15 pruned. 
[I 2026-03-17 17:13:12,093] Trial 7 pruned. 
[I 2026-03-17 17:13:13,936] Trial 36 finished with value: -0.3896618775169916 and parameters: {'n_layers_yy': 2, 'hidden_size_yy_l0': 6, 'hidden_size_yy_l1': 4, 'context_size_yy': 1, 'num_mix_components_yy': 5, 'context_extractor_yy': 'lstm', 'activation_func_yy': 'Tanh', 'L2_weight_yy': 6.809440541904202e-09, 'L_entropy_weight_yy': 2.475394363013063e-10, 'L_sep_weight_yy': 2.3913405950519373e-08, 'L_scale_weight_yy': 6.53485284558152e-10, 'learning_rate_yy': 0.008891742121615585}. Best is trial 35 with value: -0.4377863266888787.
[I 2026-03-17 17:13:15,025] Trial 29 pruned. 
[I 2026-03-17 17:13:15,101] Trial 11 finished with value: -1.6700141565287996 and parameters: {'n_layers_yy': 2, 'hidden_size_yy_l0': 2, 'hidden_size_yy_l1': 6, 'context_size_yy': 1, 'num_mix_components_yy': 5, 'context_extractor_yy': 'gru', 'activation_func_yy': 'GELU', 'L2_weight_yy': 8.252776427189769e-06, 'L_entropy_weight_yy': 0.0009930123960547946, 'L_sep_weight_yy': 1.1656785235543107e-10, 'L_scale_weight_yy': 3.835773163023319e-09, 'learning_rate_yy': 0.0096568391702986}. Best is trial 10 with value: -1.6702043966563191.
[I 2026-03-17 17:13:15,216] Trial 12 pruned. 
[I 2026-03-17 17:13:16,585] Trial 8 pruned. 
[I 2026-03-17 17:13:17,072] Trial 30 pruned. 
[I 2026-03-17 17:13:17,421] Trial 16 pruned. 
[I 2026-03-17 17:13:17,439] Trial 9 pruned. 
[I 2026-03-17 17:13:18,717] Trial 38 finished with value: -0.5786783042603378 and parameters: {'n_layers_yy': 1, 'hidden_size_yy_l0': 3, 'context_size_yy': 4, 'num_mix_components_yy': 4, 'context_extractor_yy': 'gru', 'activation_func_yy': 'Tanh', 'L2_weight_yy': 5.027860926730499e-09, 'L_entropy_weight_yy': 3.589488892564962e-05, 'L_sep_weight_yy': 1.0838951069317844e-08, 'L_scale_weight_yy': 1.7951929485099835e-06, 'learning_rate_yy': 0.004327700928077778}. Best is trial 23 with value: -0.579728663049669.
[I 2026-03-17 17:13:19,244] Trial 3 finished with value: -2.471746916631555 and parameters: {'n_layers_yy': 1, 'hidden_size_yy_l0': 6, 'context_size_yy': 4, 'num_mix_components_yy': 3, 'context_extractor_yy': 'lstm', 'activation_func_yy': 'ReLU', 'L2_weight_yy': 3.769088558884707e-08, 'L_entropy_weight_yy': 4.400146553814736e-08, 'L_sep_weight_yy': 2.721573699464115e-05, 'L_scale_weight_yy': 3.1488232759015205e-06, 'learning_rate_yy': 0.002994456274869783}. Best is trial 2 with value: -2.489143682537181.
[I 2026-03-17 17:13:20,902] Trial 8 finished with value: -1.9790622237949804 and parameters: {'n_layers_yy': 1, 'hidden_size_yy_l0': 4, 'context_size_yy': 1, 'num_mix_components_yy': 5, 'context_extractor_yy': 'lstm', 'activation_func_yy': 'ReLU', 'L2_weight_yy': 2.5312737741257046e-10, 'L_entropy_weight_yy': 1.209244965930572e-10, 'L_sep_weight_yy': 0.00014015772863669383, 'L_scale_weight_yy': 7.352907967064731e-10, 'learning_rate_yy': 0.003357357099893932}. Best is trial 7 with value: -1.9830532325011814.
[I 2026-03-17 17:13:21,817] Trial 17 pruned. 
[I 2026-03-17 17:13:22,052] Trial 12 pruned. 
[I 2026-03-17 17:13:22,764] Trial 12 finished with value: -1.6750823959944512 and parameters: {'n_layers_yy': 1, 'hidden_size_yy_l0': 6, 'context_size_yy': 4, 'num_mix_components_yy': 4, 'context_extractor_yy': 'gru', 'activation_func_yy': 'GELU', 'L2_weight_yy': 4.170537008381393e-06, 'L_entropy_weight_yy': 2.0564179536172216e-06, 'L_sep_weight_yy': 1.4779859880779023e-08, 'L_scale_weight_yy': 1.5223803220397306e-10, 'learning_rate_yy': 0.009413999506563768}. Best is trial 2 with value: -1.677622742403132.
[I 2026-03-17 17:13:24,740] Trial 4 pruned. 
[I 2026-03-17 17:13:24,949] Trial 11 pruned. 
[I 2026-03-17 17:13:25,422] Trial 18 pruned. 
[I 2026-03-17 17:13:25,466] Trial 37 pruned. 
[I 2026-03-17 17:13:25,653] Trial 13 pruned. 
[I 2026-03-17 17:13:25,892] Trial 10 pruned. 
[I 2026-03-17 17:13:28,657] Trial 14 pruned. 
[I 2026-03-17 17:13:28,771] Trial 13 pruned. 
[I 2026-03-17 17:13:34,076] Trial 11 pruned. 
[I 2026-03-17 17:13:34,078] Trial 39 pruned. 
[I 2026-03-17 17:13:34,189] Trial 17 finished with value: -2.81323174749621 and parameters: {'n_layers_yy': 1, 'hidden_size_yy_l0': 5, 'context_size_yy': 4, 'num_mix_components_yy': 2, 'context_extractor_yy': 'lstm', 'activation_func_yy': 'Tanh', 'L2_weight_yy': 5.319114184792766e-08, 'L_entropy_weight_yy': 2.0650108534643917e-07, 'L_sep_weight_yy': 1.0155892198453938e-05, 'L_scale_weight_yy': 4.5126904313771214e-09, 'learning_rate_yy': 0.009136672899606558}. Best is trial 11 with value: -2.8352269528025382.
[I 2026-03-17 17:13:36,058] Trial 15 pruned. 
[I 2026-03-17 17:13:36,500] Trial 14 pruned. 
[I 2026-03-17 17:13:37,041] Trial 40 pruned. 
[I 2026-03-17 17:13:39,675] Trial 31 finished with value: -0.8139819732620938 and parameters: {'n_layers_yy': 2, 'hidden_size_yy_l0': 5, 'hidden_size_yy_l1': 4, 'context_size_yy': 2, 'num_mix_components_yy': 3, 'context_extractor_yy': 'gru', 'activation_func_yy': 'Tanh', 'L2_weight_yy': 0.0001717417613434184, 'L_entropy_weight_yy': 2.3851813195471e-10, 'L_sep_weight_yy': 1.373441281529023e-07, 'L_scale_weight_yy': 2.704991269925219e-05, 'learning_rate_yy': 0.004063860652124925}. Best is trial 2 with value: -0.833493141163047.
[I 2026-03-17 17:13:39,858] Trial 15 pruned. 
[I 2026-03-17 17:13:41,168] Trial 33 pruned. 
[I 2026-03-17 17:13:41,459] Trial 38 finished with value: -0.44168936431223393 and parameters: {'n_layers_yy': 1, 'hidden_size_yy_l0': 5, 'context_size_yy': 2, 'num_mix_components_yy': 4, 'context_extractor_yy': 'lstm', 'activation_func_yy': 'ReLU', 'L2_weight_yy': 2.9563319996466178e-09, 'L_entropy_weight_yy': 1.4193155001933035e-09, 'L_sep_weight_yy': 2.5020061854267077e-09, 'L_scale_weight_yy': 1.1128681969701439e-09, 'learning_rate_yy': 0.009827079297374624}. Best is trial 38 with value: -0.44168936431223393.
[I 2026-03-17 17:13:41,922] Trial 12 pruned. 
[I 2026-03-17 17:13:42,631] Trial 16 pruned. 
[I 2026-03-17 17:13:42,649] Trial 18 pruned. 
[I 2026-03-17 17:13:46,141] Trial 34 pruned. 
[I 2026-03-17 17:13:46,900] Trial 16 pruned. 
[I 2026-03-17 17:13:46,967] Trial 16 pruned. 
[I 2026-03-17 17:13:49,460] Trial 13 pruned. 
[I 2026-03-17 17:13:50,665] Trial 17 pruned. 
[I 2026-03-17 17:13:50,669] Trial 18 finished with value: -1.612707132993281 and parameters: {'n_layers_yy': 2, 'hidden_size_yy_l0': 2, 'hidden_size_yy_l1': 5, 'context_size_yy': 3, 'num_mix_components_yy': 4, 'context_extractor_yy': 'lstm', 'activation_func_yy': 'Tanh', 'L2_weight_yy': 8.267104772983229e-05, 'L_entropy_weight_yy': 1.7786953672385547e-08, 'L_sep_weight_yy': 9.879517076135635e-07, 'L_scale_weight_yy': 2.3056858805228016e-07, 'learning_rate_yy': 0.002887789536321327}. Best is trial 12 with value: -1.6131555846140806.
[I 2026-03-17 17:13:50,782] Trial 19 pruned. 
[I 2026-03-17 17:13:50,924] Trial 8 finished with value: -1.8495463095682823 and parameters: {'n_layers_yy': 2, 'hidden_size_yy_l0': 5, 'hidden_size_yy_l1': 6, 'context_size_yy': 1, 'num_mix_components_yy': 3, 'context_extractor_yy': 'lstm', 'activation_func_yy': 'ReLU', 'L2_weight_yy': 8.534753653196373e-10, 'L_entropy_weight_yy': 3.3394336561714666e-08, 'L_sep_weight_yy': 1.4841968190539076e-06, 'L_scale_weight_yy': 8.476194317014186e-05, 'learning_rate_yy': 0.0012727774283541038}. Best is trial 6 with value: -1.8554804452326426.
[I 2026-03-17 17:13:52,847] Trial 41 pruned. 
[I 2026-03-17 17:13:52,863] Trial 32 pruned. 
[I 2026-03-17 17:13:53,445] Trial 18 pruned. 
[I 2026-03-17 17:13:54,048] Trial 39 pruned. 
