[I 2026-03-17 17:46:54,890] Trial 49 pruned. 
Optimize task 18: group_id: POm, neuron_id: 52
Starting optimization for task 18...

--- Data Summary ---
Total events for target process 38515
Data Time: 900 seconds
Using device: cuda
Number of events in target process: 38515
Only one process provided, preparing dataloaders for the reduced model.
Reduced model ln_yy : 7612.28586 nats/sec, 177.88024 nats/event
Reduced model Log loss : -3.24436
Number of events in target process: 38515
Only one process provided, preparing dataloaders for the reduced model.
Reduced model ln_yy : 7615.60873 nats/sec, 177.95788 nats/event
Reduced model Log loss : -3.22616
Number of events in target process: 38515
Only one process provided, preparing dataloaders for the reduced model.
Number of events in target process: 38515
Only one process provided, preparing dataloaders for the reduced model.
Reduced model ln_yy : 7616.50188 nats/sec, 177.97875 nats/event
Reduced model Log loss : -3.24881
Number of events in target process: 38515
Only one process provided, preparing dataloaders for the reduced model.
Number of events in target process: 38515
Only one process provided, preparing dataloaders for the reduced model.
Number of events in target process: 38515
Only one process provided, preparing dataloaders for the reduced model.
Reduced model ln_yy : 7622.44875 nats/sec, 178.11772 nats/event
Reduced model Log loss : -3.23996
Number of events in target process: 38515
Only one process provided, preparing dataloaders for the reduced model.
Number of events in target process: 38515
Only one process provided, preparing dataloaders for the reduced model.
Number of events in target process: 38515
Only one process provided, preparing dataloaders for the reduced model.
Number of events in target process: 38515
Only one process provided, preparing dataloaders for the reduced model.
Reduced model ln_yy : 7632.90655 nats/sec, 178.36209 nats/event
Reduced model Log loss : -3.24484
Number of events in target process: 38515
Only one process provided, preparing dataloaders for the reduced model.
Number of events in target process: 38515
Only one process provided, preparing dataloaders for the reduced model.
Reduced model ln_yy : 7690.92116 nats/sec, 179.71775 nats/event
Reduced model Log loss : -3.25385
Number of events in target process: 38515
Only one process provided, preparing dataloaders for the reduced model.
Number of events in target process: 38515
Only one process provided, preparing dataloaders for the reduced model.
Number of events in target process: 38515
Only one process provided, preparing dataloaders for the reduced model.
Number of events in target process: 38515
Only one process provided, preparing dataloaders for the reduced model.
Reduced model ln_yy : 7668.54678 nats/sec, 179.19491 nats/event
Reduced model Log loss : -3.26630
Number of events in target process: 38515
Only one process provided, preparing dataloaders for the reduced model.
Reduced model ln_yy : 7679.58138 nats/sec, 179.45277 nats/event
Reduced model Log loss : -3.25888
Number of events in target process: 38515
Only one process provided, preparing dataloaders for the reduced model.
Reduced model ln_yy : 7692.09572 nats/sec, 179.74519 nats/event
Reduced model Log loss : -3.25751
Number of events in target process: 38515
Only one process provided, preparing dataloaders for the reduced model.
Number of events in target process: 38515
Only one process provided, preparing dataloaders for the reduced model.
Number of events in target process: 38515
Only one process provided, preparing dataloaders for the reduced model.
Reduced model ln_yy : 7641.70060 nats/sec, 178.56759 nats/event
Reduced model Log loss : -3.26497
Number of events in target process: 38515
Only one process provided, preparing dataloaders for the reduced model.
Reduced model ln_yy : 7629.20397 nats/sec, 178.27557 nats/event
Reduced model Log loss : -3.25826
Number of events in target process: 38515
Only one process provided, preparing dataloaders for the reduced model.
Number of events in target process: 38515
Only one process provided, preparing dataloaders for the reduced model.
Number of events in target process: 38515
Only one process provided, preparing dataloaders for the reduced model.
Number of events in target process: 38515
Only one process provided, preparing dataloaders for the reduced model.
Number of events in target process: 38515
Only one process provided, preparing dataloaders for the reduced model.
Reduced model ln_yy : 7603.29334 nats/sec, 177.67010 nats/event
Reduced model Log loss : -3.25238
Number of events in target process: 38515
Only one process provided, preparing dataloaders for the reduced model.
Reduced model ln_yy : 7661.38109 nats/sec, 179.02747 nats/event
Reduced model Log loss : -3.25946
Number of events in target process: 38515
Only one process provided, preparing dataloaders for the reduced model.
Number of events in target process: 38515
Only one process provided, preparing dataloaders for the reduced model.
Number of events in target process: 38515
Only one process provided, preparing dataloaders for the reduced model.
Reduced model ln_yy : 7631.42822 nats/sec, 178.32755 nats/event
Reduced model Log loss : -3.26352
Number of events in target process: 38515
Only one process provided, preparing dataloaders for the reduced model.
Reduced model ln_yy : 7686.86169 nats/sec, 179.62289 nats/event
Reduced model Log loss : -3.27877
Number of events in target process: 38515
Only one process provided, preparing dataloaders for the reduced model.
Reduced model ln_yy : 7655.41232 nats/sec, 178.88799 nats/event
Reduced model Log loss : -3.27931
Number of events in target process: 38515
Only one process provided, preparing dataloaders for the reduced model.
Number of events in target process: 38515
Only one process provided, preparing dataloaders for the reduced model.
Number of events in target process: 38515
Only one process provided, preparing dataloaders for the reduced model.
Number of events in target process: 38515
Only one process provided, preparing dataloaders for the reduced model.
Number of events in target process: 38515
Only one process provided, preparing dataloaders for the reduced model.
Number of events in target process: 38515
Only one process provided, preparing dataloaders for the reduced model.
Number of events in target process: 38515
Only one process provided, preparing dataloaders for the reduced model.
Number of events in target process: 38515
Only one process provided, preparing dataloaders for the reduced model.
Reduced model ln_yy : 7618.18474 nats/sec, 178.01808 nats/event
Reduced model Log loss : -3.27767
Number of events in target process: 38515
Only one process provided, preparing dataloaders for the reduced model.
Reduced model ln_yy : 7620.86232 nats/sec, 178.08065 nats/event
Reduced model Log loss : -3.27759
Number of events in target process: 38515
Only one process provided, preparing dataloaders for the reduced model.
Reduced model ln_yy : 7725.96269 nats/sec, 180.53658 nats/event
Reduced model Log loss : -3.28081
Number of events in target process: 38515
Only one process provided, preparing dataloaders for the reduced model.
Reduced model ln_yy : 7732.09266 nats/sec, 180.67982 nats/event
Reduced model Log loss : -3.28075
Number of events in target process: 38515
Only one process provided, preparing dataloaders for the reduced model.
Number of events in target process: 38515
Only one process provided, preparing dataloaders for the reduced model.
Number of events in target process: 38515
Only one process provided, preparing dataloaders for the reduced model.
Number of events in target process: 38515
Only one process provided, preparing dataloaders for the reduced model.
Number of events in target process: 38515
Only one process provided, preparing dataloaders for the reduced model.
Best trial:
  Value: -3.280809130859375
  Params: {'n_layers_yy': 1, 'hidden_size_yy_l0': 6, 'context_size_yy': 4, 'num_mix_components_yy': 3, 'context_extractor_yy': 'gru', 'activation_func_yy': 'ReLU', 'L2_weight_yy': 3.099111327924815e-08, 'L_entropy_weight_yy': 5.085821509509091e-07, 'L_sep_weight_yy': 1.1305118811003212e-09, 'L_scale_weight_yy': 3.1099180038125776e-10, 'learning_rate_yy': 0.007683899264880692}
Full best configuration saved to results/opt/opt_reduced_18_best_config.txt
Optimization finished.
