[I 2026-03-17 17:21:42,992] Trial 49 pruned. 
Optimize task 20: group_id: POm, neuron_id: 54
Starting optimization for task 20...

--- Data Summary ---
Total events for target process 10752
Data Time: 900 seconds
Using device: cuda
Number of events in target process: 10752
Only one process provided, preparing dataloaders for the reduced model.
Reduced model ln_yy : 370.76518 nats/sec, 31.03503 nats/event
Reduced model Log loss : -1.67517
Number of events in target process: 10752
Only one process provided, preparing dataloaders for the reduced model.
Number of events in target process: 10752
Only one process provided, preparing dataloaders for the reduced model.
Reduced model ln_yy : 373.19178 nats/sec, 31.23815 nats/event
Reduced model Log loss : -1.67762
Number of events in target process: 10752
Only one process provided, preparing dataloaders for the reduced model.
Number of events in target process: 10752
Only one process provided, preparing dataloaders for the reduced model.
Number of events in target process: 10752
Only one process provided, preparing dataloaders for the reduced model.
Number of events in target process: 10752
Only one process provided, preparing dataloaders for the reduced model.
Number of events in target process: 10752
Only one process provided, preparing dataloaders for the reduced model.
Reduced model ln_yy : 368.13832 nats/sec, 30.81515 nats/event
Reduced model Log loss : -1.66577
Number of events in target process: 10752
Only one process provided, preparing dataloaders for the reduced model.
Number of events in target process: 10752
Only one process provided, preparing dataloaders for the reduced model.
Number of events in target process: 10752
Only one process provided, preparing dataloaders for the reduced model.
Number of events in target process: 10752
Only one process provided, preparing dataloaders for the reduced model.
Number of events in target process: 10752
Only one process provided, preparing dataloaders for the reduced model.
Reduced model ln_yy : 373.89957 nats/sec, 31.29740 nats/event
Reduced model Log loss : -1.67508
Number of events in target process: 10752
Only one process provided, preparing dataloaders for the reduced model.
Number of events in target process: 10752
Only one process provided, preparing dataloaders for the reduced model.
Number of events in target process: 10752
Only one process provided, preparing dataloaders for the reduced model.
Number of events in target process: 10752
Only one process provided, preparing dataloaders for the reduced model.
Number of events in target process: 10752
Only one process provided, preparing dataloaders for the reduced model.
Number of events in target process: 10752
Only one process provided, preparing dataloaders for the reduced model.
Number of events in target process: 10752
Only one process provided, preparing dataloaders for the reduced model.
Number of events in target process: 10752
Only one process provided, preparing dataloaders for the reduced model.
Reduced model ln_yy : 371.70289 nats/sec, 31.11352 nats/event
Reduced model Log loss : -1.67493
Number of events in target process: 10752
Only one process provided, preparing dataloaders for the reduced model.
Reduced model ln_yy : 373.88983 nats/sec, 31.29658 nats/event
Reduced model Log loss : -1.67569
Number of events in target process: 10752
Only one process provided, preparing dataloaders for the reduced model.
Reduced model ln_yy : 373.80697 nats/sec, 31.28965 nats/event
Reduced model Log loss : -1.67492
Number of events in target process: 10752
Only one process provided, preparing dataloaders for the reduced model.
Number of events in target process: 10752
Only one process provided, preparing dataloaders for the reduced model.
Number of events in target process: 10752
Only one process provided, preparing dataloaders for the reduced model.
Number of events in target process: 10752
Only one process provided, preparing dataloaders for the reduced model.
Number of events in target process: 10752
Only one process provided, preparing dataloaders for the reduced model.
Number of events in target process: 10752
Only one process provided, preparing dataloaders for the reduced model.
Number of events in target process: 10752
Only one process provided, preparing dataloaders for the reduced model.
Number of events in target process: 10752
Only one process provided, preparing dataloaders for the reduced model.
Number of events in target process: 10752
Only one process provided, preparing dataloaders for the reduced model.
Reduced model ln_yy : 373.92247 nats/sec, 31.29931 nats/event
Reduced model Log loss : -1.67516
Number of events in target process: 10752
Only one process provided, preparing dataloaders for the reduced model.
Reduced model ln_yy : 373.89924 nats/sec, 31.29737 nats/event
Reduced model Log loss : -1.67566
Number of events in target process: 10752
Only one process provided, preparing dataloaders for the reduced model.
Number of events in target process: 10752
Only one process provided, preparing dataloaders for the reduced model.
Number of events in target process: 10752
Only one process provided, preparing dataloaders for the reduced model.
Number of events in target process: 10752
Only one process provided, preparing dataloaders for the reduced model.
Number of events in target process: 10752
Only one process provided, preparing dataloaders for the reduced model.
Number of events in target process: 10752
Only one process provided, preparing dataloaders for the reduced model.
Number of events in target process: 10752
Only one process provided, preparing dataloaders for the reduced model.
Number of events in target process: 10752
Only one process provided, preparing dataloaders for the reduced model.
Number of events in target process: 10752
Only one process provided, preparing dataloaders for the reduced model.
Reduced model ln_yy : 373.87891 nats/sec, 31.29567 nats/event
Reduced model Log loss : -1.67530
Number of events in target process: 10752
Only one process provided, preparing dataloaders for the reduced model.
Reduced model ln_yy : 371.79044 nats/sec, 31.12085 nats/event
Reduced model Log loss : -1.67522
Number of events in target process: 10752
Only one process provided, preparing dataloaders for the reduced model.
Number of events in target process: 10752
Only one process provided, preparing dataloaders for the reduced model.
Number of events in target process: 10752
Only one process provided, preparing dataloaders for the reduced model.
Reduced model ln_yy : 371.01012 nats/sec, 31.05553 nats/event
Reduced model Log loss : -1.67863
Number of events in target process: 10752
Only one process provided, preparing dataloaders for the reduced model.
Number of events in target process: 10752
Only one process provided, preparing dataloaders for the reduced model.
Number of events in target process: 10752
Only one process provided, preparing dataloaders for the reduced model.
Number of events in target process: 10752
Only one process provided, preparing dataloaders for the reduced model.
Best trial:
  Value: -1.6786319708835615
  Params: {'n_layers_yy': 1, 'hidden_size_yy_l0': 5, 'context_size_yy': 4, 'num_mix_components_yy': 4, 'context_extractor_yy': 'gru', 'activation_func_yy': 'GELU', 'L2_weight_yy': 8.163342667154047e-06, 'L_entropy_weight_yy': 1.1431126275498101e-07, 'L_sep_weight_yy': 5.1012095903483466e-08, 'L_scale_weight_yy': 5.254157077180578e-10, 'learning_rate_yy': 0.006580081996240567}
Full best configuration saved to results/opt/opt_reduced_20_best_config.txt
Optimization finished.
[I 2026-03-17 17:21:43,612] Trial 31 pruned. 
[I 2026-03-17 17:21:44,650] Trial 22 finished with value: -2.3759054172258436 and parameters: {'n_layers_yy': 2, 'hidden_size_yy_l0': 6, 'hidden_size_yy_l1': 3, 'context_size_yy': 2, 'num_mix_components_yy': 3, 'context_extractor_yy': 'lstm', 'activation_func_yy': 'Tanh', 'L2_weight_yy': 7.998719454973881e-08, 'L_entropy_weight_yy': 8.849580848190812e-05, 'L_sep_weight_yy': 3.59849035700207e-10, 'L_scale_weight_yy': 3.8934504922921264e-07, 'learning_rate_yy': 0.007465066848497743}. Best is trial 22 with value: -2.3759054172258436.
[I 2026-03-17 17:21:46,227] Trial 32 pruned. 
[I 2026-03-17 17:21:46,479] Trial 32 finished with value: -2.448054481067969 and parameters: {'n_layers_yy': 2, 'hidden_size_yy_l0': 6, 'hidden_size_yy_l1': 6, 'context_size_yy': 3, 'num_mix_components_yy': 1, 'context_extractor_yy': 'gru', 'activation_func_yy': 'ReLU', 'L2_weight_yy': 3.168984551925719e-06, 'L_entropy_weight_yy': 2.9446655399074878e-05, 'L_sep_weight_yy': 1.232452320840995e-07, 'L_scale_weight_yy': 1.5924194796918578e-06, 'learning_rate_yy': 0.0014950115033158856}. Best is trial 2 with value: -2.476197165819489.
[I 2026-03-17 17:21:46,589] Trial 31 pruned. 
[I 2026-03-17 17:21:49,197] Trial 33 pruned. 
[I 2026-03-17 17:21:52,184] Trial 43 finished with value: -1.903191063724347 and parameters: {'n_layers_yy': 2, 'hidden_size_yy_l0': 3, 'hidden_size_yy_l1': 6, 'context_size_yy': 3, 'num_mix_components_yy': 5, 'context_extractor_yy': 'lstm', 'activation_func_yy': 'ReLU', 'L2_weight_yy': 1.7712727135146631e-07, 'L_entropy_weight_yy': 5.394357882233511e-07, 'L_sep_weight_yy': 8.293243431665315e-07, 'L_scale_weight_yy': 1.8620533833724423e-10, 'learning_rate_yy': 0.007330581975040017}. Best is trial 18 with value: -1.9113758963969216.
[I 2026-03-17 17:21:54,471] Trial 42 pruned. 
[I 2026-03-17 17:21:55,842] Trial 34 pruned. 
[I 2026-03-17 17:21:56,345] Trial 43 pruned. 
[I 2026-03-17 17:21:56,846] Trial 33 pruned. 
[I 2026-03-17 17:21:57,230] Trial 31 pruned. 
[I 2026-03-17 17:21:58,292] Trial 21 finished with value: -2.5142283361436735 and parameters: {'n_layers_yy': 2, 'hidden_size_yy_l0': 6, 'hidden_size_yy_l1': 5, 'context_size_yy': 1, 'num_mix_components_yy': 2, 'context_extractor_yy': 'lstm', 'activation_func_yy': 'Tanh', 'L2_weight_yy': 3.1801419939158256e-09, 'L_entropy_weight_yy': 1.336308743924069e-06, 'L_sep_weight_yy': 1.5031910162007554e-06, 'L_scale_weight_yy': 1.2067971876387202e-09, 'learning_rate_yy': 0.005108387768153293}. Best is trial 21 with value: -2.5142283361436735.
[I 2026-03-17 17:22:01,429] Trial 31 finished with value: -2.835966405270213 and parameters: {'n_layers_yy': 1, 'hidden_size_yy_l0': 5, 'context_size_yy': 4, 'num_mix_components_yy': 4, 'context_extractor_yy': 'gru', 'activation_func_yy': 'ReLU', 'L2_weight_yy': 3.7660442570165434e-05, 'L_entropy_weight_yy': 1.6963793316201887e-10, 'L_sep_weight_yy': 2.0058060378271972e-07, 'L_scale_weight_yy': 1.240618133442258e-10, 'learning_rate_yy': 0.008413961049473959}. Best is trial 26 with value: -2.836288688568588.
[I 2026-03-17 17:22:05,896] Trial 23 pruned. 
[I 2026-03-17 17:22:06,135] Trial 30 finished with value: -1.7016892064164044 and parameters: {'n_layers_yy': 2, 'hidden_size_yy_l0': 4, 'hidden_size_yy_l1': 5, 'context_size_yy': 3, 'num_mix_components_yy': 4, 'context_extractor_yy': 'gru', 'activation_func_yy': 'Tanh', 'L2_weight_yy': 2.555288313118098e-05, 'L_entropy_weight_yy': 3.0177998918643593e-06, 'L_sep_weight_yy': 0.00034932581783485647, 'L_scale_weight_yy': 2.5782004723003664e-05, 'learning_rate_yy': 0.004414880086311616}. Best is trial 20 with value: -1.7038948064814108.
[I 2026-03-17 17:22:07,013] Trial 44 pruned. 
[I 2026-03-17 17:22:07,653] Trial 34 pruned. 
[I 2026-03-17 17:22:09,687] Trial 45 pruned. 
[I 2026-03-17 17:22:09,874] Trial 15 pruned. 
[I 2026-03-17 17:22:10,904] Trial 44 pruned. 
[I 2026-03-17 17:22:11,651] Trial 46 pruned. 
[I 2026-03-17 17:22:12,795] Trial 45 pruned. 
[I 2026-03-17 17:22:14,336] Trial 32 pruned. 
[I 2026-03-17 17:22:14,367] Trial 32 finished with value: -1.8547265362756085 and parameters: {'n_layers_yy': 1, 'hidden_size_yy_l0': 6, 'context_size_yy': 4, 'num_mix_components_yy': 3, 'context_extractor_yy': 'lstm', 'activation_func_yy': 'Tanh', 'L2_weight_yy': 3.0395294651250813e-06, 'L_entropy_weight_yy': 6.643120902553091e-07, 'L_sep_weight_yy': 3.6154922069243144e-06, 'L_scale_weight_yy': 1.0959364799707181e-08, 'learning_rate_yy': 0.008264352903286814}. Best is trial 10 with value: -1.8554935362796692.
[I 2026-03-17 17:22:14,743] Trial 46 pruned. 
[I 2026-03-17 17:22:15,297] Trial 12 finished with value: -3.2538486653645835 and parameters: {'n_layers_yy': 1, 'hidden_size_yy_l0': 5, 'context_size_yy': 4, 'num_mix_components_yy': 5, 'context_extractor_yy': 'gru', 'activation_func_yy': 'GELU', 'L2_weight_yy': 2.4595438048772182e-06, 'L_entropy_weight_yy': 5.357208530451332e-09, 'L_sep_weight_yy': 7.411574985744993e-06, 'L_scale_weight_yy': 4.3141754598667264e-09, 'learning_rate_yy': 0.0028518043558961553}. Best is trial 12 with value: -3.2538486653645835.
[I 2026-03-17 17:22:17,498] Trial 47 pruned. 
[I 2026-03-17 17:22:18,035] Trial 34 finished with value: -2.6383927355289383 and parameters: {'n_layers_yy': 1, 'hidden_size_yy_l0': 4, 'context_size_yy': 3, 'num_mix_components_yy': 4, 'context_extractor_yy': 'lstm', 'activation_func_yy': 'ReLU', 'L2_weight_yy': 8.496549263871114e-06, 'L_entropy_weight_yy': 5.807501038443764e-09, 'L_sep_weight_yy': 1.4215035226585401e-07, 'L_scale_weight_yy': 3.848413157397737e-06, 'learning_rate_yy': 0.007713915173543084}. Best is trial 34 with value: -2.6383927355289383.
[I 2026-03-17 17:22:18,063] Trial 35 pruned. 
[I 2026-03-17 17:22:18,726] Trial 33 pruned. 
[I 2026-03-17 17:22:20,180] Trial 13 pruned. 
[I 2026-03-17 17:22:20,985] Trial 32 pruned. 
[I 2026-03-17 17:22:22,035] Trial 36 pruned. 
[I 2026-03-17 17:22:22,172] Trial 31 pruned. 
[I 2026-03-17 17:22:22,502] Trial 9 finished with value: -2.2687519423672735 and parameters: {'n_layers_yy': 2, 'hidden_size_yy_l0': 3, 'hidden_size_yy_l1': 4, 'context_size_yy': 4, 'num_mix_components_yy': 1, 'context_extractor_yy': 'gru', 'activation_func_yy': 'ReLU', 'L2_weight_yy': 1.2173083379866038e-08, 'L_entropy_weight_yy': 3.3997541739283356e-05, 'L_sep_weight_yy': 2.730801187578419e-05, 'L_scale_weight_yy': 0.0001857934295077275, 'learning_rate_yy': 0.0044181115234369584}. Best is trial 0 with value: -2.289111866011322.
[I 2026-03-17 17:22:23,431] Trial 16 pruned. 
[I 2026-03-17 17:22:23,735] Trial 35 pruned. 
[I 2026-03-17 17:22:26,308] Trial 47 pruned. 
[I 2026-03-17 17:22:26,869] Trial 22 finished with value: -3.1523755105572735 and parameters: {'n_layers_yy': 1, 'hidden_size_yy_l0': 6, 'context_size_yy': 4, 'num_mix_components_yy': 3, 'context_extractor_yy': 'gru', 'activation_func_yy': 'ReLU', 'L2_weight_yy': 1.1203956616499605e-06, 'L_entropy_weight_yy': 9.561006872192709e-10, 'L_sep_weight_yy': 2.024112331679607e-08, 'L_scale_weight_yy': 8.702738370061488e-06, 'learning_rate_yy': 0.006997748221931898}. Best is trial 22 with value: -3.1523755105572735.
[I 2026-03-17 17:22:27,132] Trial 24 pruned. 
[I 2026-03-17 17:22:27,907] Trial 32 pruned. 
[I 2026-03-17 17:22:28,333] Trial 17 pruned. 
[I 2026-03-17 17:22:29,271] Trial 30 finished with value: -1.7752846827651516 and parameters: {'n_layers_yy': 2, 'hidden_size_yy_l0': 3, 'hidden_size_yy_l1': 6, 'context_size_yy': 1, 'num_mix_components_yy': 5, 'context_extractor_yy': 'lstm', 'activation_func_yy': 'Tanh', 'L2_weight_yy': 3.858834975146488e-05, 'L_entropy_weight_yy': 6.126977206728536e-09, 'L_sep_weight_yy': 3.9638182678306525e-06, 'L_scale_weight_yy': 3.6088840842442083e-07, 'learning_rate_yy': 0.004153026068208264}. Best is trial 8 with value: -1.786668244949495.
[I 2026-03-17 17:22:30,577] Trial 25 pruned. 
[I 2026-03-17 17:22:30,778] Trial 15 finished with value: -2.967600858518107 and parameters: {'n_layers_yy': 2, 'hidden_size_yy_l0': 5, 'hidden_size_yy_l1': 6, 'context_size_yy': 3, 'num_mix_components_yy': 5, 'context_extractor_yy': 'gru', 'activation_func_yy': 'Tanh', 'L2_weight_yy': 1.3355630973568187e-05, 'L_entropy_weight_yy': 2.190836228628969e-08, 'L_sep_weight_yy': 4.251358244339521e-05, 'L_scale_weight_yy': 1.353118912192847e-10, 'learning_rate_yy': 0.001704487097262568}. Best is trial 9 with value: -2.9754424140841684.
[I 2026-03-17 17:22:31,620] Trial 48 finished with value: -1.9635485869787408 and parameters: {'n_layers_yy': 1, 'hidden_size_yy_l0': 5, 'context_size_yy': 3, 'num_mix_components_yy': 2, 'context_extractor_yy': 'lstm', 'activation_func_yy': 'GELU', 'L2_weight_yy': 1.5597308258737878e-05, 'L_entropy_weight_yy': 2.8690730864808757e-09, 'L_sep_weight_yy': 7.446715225867717e-07, 'L_scale_weight_yy': 7.565205524867947e-08, 'learning_rate_yy': 0.006980050783800973}. Best is trial 31 with value: -1.9742766261003297.
[I 2026-03-17 17:22:31,624] Trial 19 finished with value: -2.4886957437916517 and parameters: {'n_layers_yy': 2, 'hidden_size_yy_l0': 3, 'hidden_size_yy_l1': 4, 'context_size_yy': 4, 'num_mix_components_yy': 5, 'context_extractor_yy': 'gru', 'activation_func_yy': 'GELU', 'L2_weight_yy': 0.00012212167630406892, 'L_entropy_weight_yy': 6.228589912825654e-09, 'L_sep_weight_yy': 6.674972936382925e-08, 'L_scale_weight_yy': 3.268372902645114e-05, 'learning_rate_yy': 0.006156668906360235}. Best is trial 18 with value: -2.4920728800472483.
[I 2026-03-17 17:22:31,694] Trial 48 pruned. 
[I 2026-03-17 17:22:32,845] Trial 37 pruned. 
[I 2026-03-17 17:22:33,303] Trial 26 pruned. 
[I 2026-03-17 17:22:33,481] Trial 14 pruned. 
[I 2026-03-17 17:22:33,810] Trial 16 pruned. 
[I 2026-03-17 17:22:35,243] Trial 35 finished with value: -1.9822007400653703 and parameters: {'n_layers_yy': 2, 'hidden_size_yy_l0': 4, 'hidden_size_yy_l1': 4, 'context_size_yy': 2, 'num_mix_components_yy': 3, 'context_extractor_yy': 'gru', 'activation_func_yy': 'GELU', 'L2_weight_yy': 3.6534959045004036e-05, 'L_entropy_weight_yy': 4.1480315393911176e-10, 'L_sep_weight_yy': 4.933828456842861e-06, 'L_scale_weight_yy': 1.9288031471704248e-08, 'learning_rate_yy': 0.005328354218879366}. Best is trial 24 with value: -1.9860150014876785.
