Warning: Failed writing log files to directory [/var/log/nvidia-mps]. No logs will be available.
Error: Task ID 31 not found in hpc/tasks_reduced.csv
Warning: Task ID 31 not found in task file. Exiting.
Error: Task ID 29 not found in hpc/tasks_reduced.csv
Warning: Task ID 29 not found in task file. Exiting.
Error: Task ID 30 not found in hpc/tasks_reduced.csv
Warning: Task ID 30 not found in task file. Exiting.
[I 2026-03-17 17:04:24,883] A new study created in RDB with name: opt_reduced-model_seed=42_task=9
[I 2026-03-17 17:04:24,884] A new study created in RDB with name: opt_reduced-model_seed=42_task=6
[I 2026-03-17 17:04:24,890] A new study created in RDB with name: opt_reduced-model_seed=42_task=22
[I 2026-03-17 17:04:24,890] A new study created in RDB with name: opt_reduced-model_seed=42_task=3
[I 2026-03-17 17:04:24,897] A new study created in RDB with name: opt_reduced-model_seed=42_task=23
[I 2026-03-17 17:04:24,903] A new study created in RDB with name: opt_reduced-model_seed=42_task=1
[I 2026-03-17 17:04:24,914] A new study created in RDB with name: opt_reduced-model_seed=42_task=2
[I 2026-03-17 17:04:24,916] A new study created in RDB with name: opt_reduced-model_seed=42_task=14
[I 2026-03-17 17:04:24,917] A new study created in RDB with name: opt_reduced-model_seed=42_task=10
[I 2026-03-17 17:04:24,925] A new study created in RDB with name: opt_reduced-model_seed=42_task=25
[I 2026-03-17 17:04:24,927] A new study created in RDB with name: opt_reduced-model_seed=42_task=20
[I 2026-03-17 17:04:24,927] A new study created in RDB with name: opt_reduced-model_seed=42_task=17
[I 2026-03-17 17:04:24,927] A new study created in RDB with name: opt_reduced-model_seed=42_task=11
[I 2026-03-17 17:04:24,928] A new study created in RDB with name: opt_reduced-model_seed=42_task=12
[I 2026-03-17 17:04:24,927] A new study created in RDB with name: opt_reduced-model_seed=42_task=15
[I 2026-03-17 17:04:24,928] A new study created in RDB with name: opt_reduced-model_seed=42_task=27
[I 2026-03-17 17:04:24,932] A new study created in RDB with name: opt_reduced-model_seed=42_task=5
[I 2026-03-17 17:04:24,933] A new study created in RDB with name: opt_reduced-model_seed=42_task=0
[I 2026-03-17 17:04:24,935] A new study created in RDB with name: opt_reduced-model_seed=42_task=21
[I 2026-03-17 17:04:24,937] A new study created in RDB with name: opt_reduced-model_seed=42_task=18
[I 2026-03-17 17:04:24,938] A new study created in RDB with name: opt_reduced-model_seed=42_task=13
[I 2026-03-17 17:04:24,939] A new study created in RDB with name: opt_reduced-model_seed=42_task=8
[I 2026-03-17 17:04:24,942] A new study created in RDB with name: opt_reduced-model_seed=42_task=19
[I 2026-03-17 17:04:24,942] A new study created in RDB with name: opt_reduced-model_seed=42_task=7
[I 2026-03-17 17:04:24,947] A new study created in RDB with name: opt_reduced-model_seed=42_task=26
[I 2026-03-17 17:04:24,947] A new study created in RDB with name: opt_reduced-model_seed=42_task=4
[I 2026-03-17 17:04:24,959] A new study created in RDB with name: opt_reduced-model_seed=42_task=24
[I 2026-03-17 17:04:24,961] A new study created in RDB with name: opt_reduced-model_seed=42_task=16
[I 2026-03-17 17:04:24,978] A new study created in RDB with name: opt_reduced-model_seed=42_task=28
[I 2026-03-17 17:05:24,197] Trial 0 finished with value: 0.05984748795975086 and parameters: {'n_layers_yy': 1, 'hidden_size_yy_l0': 3, 'context_size_yy': 1, 'num_mix_components_yy': 1, 'context_extractor_yy': 'gru', 'activation_func_yy': 'GELU', 'L2_weight_yy': 5.814233035720725e-06, 'L_entropy_weight_yy': 3.0249211568132354e-08, 'L_sep_weight_yy': 1.0357151207337058e-06, 'L_scale_weight_yy': 6.124094210405555e-07, 'learning_rate_yy': 0.0044697819132871455}. Best is trial 0 with value: 0.05984748795975086.
[I 2026-03-17 17:05:25,786] Trial 0 finished with value: -2.810569765121464 and parameters: {'n_layers_yy': 2, 'hidden_size_yy_l0': 5, 'hidden_size_yy_l1': 2, 'context_size_yy': 2, 'num_mix_components_yy': 4, 'context_extractor_yy': 'lstm', 'activation_func_yy': 'ReLU', 'L2_weight_yy': 3.6013479219656437e-07, 'L_entropy_weight_yy': 9.608482284917342e-07, 'L_sep_weight_yy': 1.359018929703748e-06, 'L_scale_weight_yy': 4.6180188947530284e-08, 'learning_rate_yy': 0.009880567279404189}. Best is trial 0 with value: -2.810569765121464.
[I 2026-03-17 17:05:26,874] Trial 1 pruned. 
[I 2026-03-17 17:05:29,615] Trial 2 pruned. 
[I 2026-03-17 17:05:33,039] Trial 3 pruned. 
[I 2026-03-17 17:05:35,439] Trial 4 pruned. 
[I 2026-03-17 17:05:38,131] Trial 5 pruned. 
[I 2026-03-17 17:05:46,528] Trial 0 finished with value: -0.5510865202304258 and parameters: {'n_layers_yy': 1, 'hidden_size_yy_l0': 2, 'context_size_yy': 4, 'num_mix_components_yy': 2, 'context_extractor_yy': 'lstm', 'activation_func_yy': 'GELU', 'L2_weight_yy': 2.925729580894676e-09, 'L_entropy_weight_yy': 7.903337460126823e-08, 'L_sep_weight_yy': 0.00022606385826443346, 'L_scale_weight_yy': 1.2248490785767727e-06, 'learning_rate_yy': 0.001733946463573696}. Best is trial 0 with value: -0.5510865202304258.
[I 2026-03-17 17:05:49,808] Trial 0 finished with value: -0.8215855382922129 and parameters: {'n_layers_yy': 1, 'hidden_size_yy_l0': 6, 'context_size_yy': 1, 'num_mix_components_yy': 1, 'context_extractor_yy': 'lstm', 'activation_func_yy': 'ReLU', 'L2_weight_yy': 8.263704374658341e-10, 'L_entropy_weight_yy': 2.5060044979527897e-08, 'L_sep_weight_yy': 1.4297956303093265e-05, 'L_scale_weight_yy': 3.463471717607426e-10, 'learning_rate_yy': 0.00507789060298236}. Best is trial 0 with value: -0.8215855382922129.
[I 2026-03-17 17:05:51,687] Trial 0 finished with value: -1.4148540790264423 and parameters: {'n_layers_yy': 2, 'hidden_size_yy_l0': 5, 'hidden_size_yy_l1': 5, 'context_size_yy': 2, 'num_mix_components_yy': 4, 'context_extractor_yy': 'gru', 'activation_func_yy': 'ReLU', 'L2_weight_yy': 2.0707536438858286e-06, 'L_entropy_weight_yy': 1.0363183596676313e-05, 'L_sep_weight_yy': 1.8469279584121348e-10, 'L_scale_weight_yy': 5.53195858193121e-05, 'learning_rate_yy': 0.0010046314647866185}. Best is trial 0 with value: -1.4148540790264423.
[I 2026-03-17 17:05:53,534] Trial 0 finished with value: -1.2572372916004795 and parameters: {'n_layers_yy': 1, 'hidden_size_yy_l0': 4, 'context_size_yy': 4, 'num_mix_components_yy': 5, 'context_extractor_yy': 'gru', 'activation_func_yy': 'ReLU', 'L2_weight_yy': 1.3116036871143857e-05, 'L_entropy_weight_yy': 0.0005082751035700092, 'L_sep_weight_yy': 4.4889669198555086e-07, 'L_scale_weight_yy': 1.6643356084149317e-06, 'learning_rate_yy': 0.0008259789774597862}. Best is trial 0 with value: -1.2572372916004795.
[I 2026-03-17 17:05:57,450] Trial 6 finished with value: 0.039941053057825845 and parameters: {'n_layers_yy': 2, 'hidden_size_yy_l0': 5, 'hidden_size_yy_l1': 4, 'context_size_yy': 2, 'num_mix_components_yy': 3, 'context_extractor_yy': 'lstm', 'activation_func_yy': 'ReLU', 'L2_weight_yy': 9.152923498563243e-07, 'L_entropy_weight_yy': 9.540997675199518e-07, 'L_sep_weight_yy': 2.9762629562260373e-05, 'L_scale_weight_yy': 1.372049140550582e-07, 'learning_rate_yy': 0.0020984529897728893}. Best is trial 6 with value: 0.039941053057825845.
[I 2026-03-17 17:05:59,605] Trial 0 finished with value: -1.9651533923769036 and parameters: {'n_layers_yy': 2, 'hidden_size_yy_l0': 2, 'hidden_size_yy_l1': 3, 'context_size_yy': 4, 'num_mix_components_yy': 2, 'context_extractor_yy': 'lstm', 'activation_func_yy': 'GELU', 'L2_weight_yy': 0.00046057551853164147, 'L_entropy_weight_yy': 1.4838351483805982e-07, 'L_sep_weight_yy': 2.532656130498072e-05, 'L_scale_weight_yy': 2.336355770462198e-09, 'learning_rate_yy': 0.007689416263191666}. Best is trial 0 with value: -1.9651533923769036.
[I 2026-03-17 17:06:01,640] Trial 0 finished with value: -1.961334732726521 and parameters: {'n_layers_yy': 2, 'hidden_size_yy_l0': 6, 'hidden_size_yy_l1': 2, 'context_size_yy': 3, 'num_mix_components_yy': 3, 'context_extractor_yy': 'lstm', 'activation_func_yy': 'ReLU', 'L2_weight_yy': 6.104733595969552e-08, 'L_entropy_weight_yy': 7.750734522524042e-06, 'L_sep_weight_yy': 1.9991815476676897e-06, 'L_scale_weight_yy': 1.0166648704221481e-05, 'learning_rate_yy': 0.006153372786031771}. Best is trial 0 with value: -1.961334732726521.
[I 2026-03-17 17:06:04,231] Trial 0 finished with value: -1.6628407449878329 and parameters: {'n_layers_yy': 2, 'hidden_size_yy_l0': 6, 'hidden_size_yy_l1': 2, 'context_size_yy': 3, 'num_mix_components_yy': 2, 'context_extractor_yy': 'gru', 'activation_func_yy': 'ReLU', 'L2_weight_yy': 0.0009386935578742109, 'L_entropy_weight_yy': 0.0001587816033879889, 'L_sep_weight_yy': 1.843787000791932e-06, 'L_scale_weight_yy': 2.5331680751511607e-06, 'learning_rate_yy': 0.005170858016104387}. Best is trial 0 with value: -1.6628407449878329.
[I 2026-03-17 17:06:04,712] Trial 0 finished with value: -0.39018740816382064 and parameters: {'n_layers_yy': 2, 'hidden_size_yy_l0': 3, 'hidden_size_yy_l1': 6, 'context_size_yy': 1, 'num_mix_components_yy': 2, 'context_extractor_yy': 'gru', 'activation_func_yy': 'ReLU', 'L2_weight_yy': 1.232386687627442e-08, 'L_entropy_weight_yy': 9.647498627750907e-05, 'L_sep_weight_yy': 7.160237756984728e-10, 'L_scale_weight_yy': 8.578571653812534e-08, 'learning_rate_yy': 0.0005966194022866979}. Best is trial 0 with value: -0.39018740816382064.
[I 2026-03-17 17:06:08,348] Trial 0 finished with value: -1.6075221451116517 and parameters: {'n_layers_yy': 2, 'hidden_size_yy_l0': 5, 'hidden_size_yy_l1': 5, 'context_size_yy': 1, 'num_mix_components_yy': 2, 'context_extractor_yy': 'gru', 'activation_func_yy': 'GELU', 'L2_weight_yy': 1.2573230374198376e-10, 'L_entropy_weight_yy': 1.8703553594017006e-06, 'L_sep_weight_yy': 5.167990773718775e-05, 'L_scale_weight_yy': 2.544550792901191e-09, 'learning_rate_yy': 0.007359014302656116}. Best is trial 0 with value: -1.6075221451116517.
[I 2026-03-17 17:06:11,346] Trial 0 finished with value: -1.6751652231358496 and parameters: {'n_layers_yy': 1, 'hidden_size_yy_l0': 6, 'context_size_yy': 2, 'num_mix_components_yy': 4, 'context_extractor_yy': 'gru', 'activation_func_yy': 'ReLU', 'L2_weight_yy': 2.455864651768345e-07, 'L_entropy_weight_yy': 9.473097342724396e-05, 'L_sep_weight_yy': 6.681898987903764e-10, 'L_scale_weight_yy': 4.6281324273355206e-10, 'learning_rate_yy': 0.0021311874309233574}. Best is trial 0 with value: -1.6751652231358496.
[I 2026-03-17 17:06:11,576] Trial 0 finished with value: -2.628434736439846 and parameters: {'n_layers_yy': 1, 'hidden_size_yy_l0': 4, 'context_size_yy': 1, 'num_mix_components_yy': 2, 'context_extractor_yy': 'gru', 'activation_func_yy': 'Tanh', 'L2_weight_yy': 1.8297008350068053e-10, 'L_entropy_weight_yy': 1.35163903337784e-08, 'L_sep_weight_yy': 1.5949078270762036e-05, 'L_scale_weight_yy': 7.829751162145669e-09, 'learning_rate_yy': 0.004524321432627259}. Best is trial 0 with value: -2.628434736439846.
[I 2026-03-17 17:06:13,033] Trial 1 finished with value: -2.8099738700698103 and parameters: {'n_layers_yy': 1, 'hidden_size_yy_l0': 4, 'context_size_yy': 2, 'num_mix_components_yy': 3, 'context_extractor_yy': 'lstm', 'activation_func_yy': 'Tanh', 'L2_weight_yy': 3.266417506646088e-09, 'L_entropy_weight_yy': 0.0007003578504406902, 'L_sep_weight_yy': 1.999518380899418e-09, 'L_scale_weight_yy': 2.380557992843562e-10, 'learning_rate_yy': 0.007970643400059312}. Best is trial 0 with value: -2.810569765121464.
[I 2026-03-17 17:06:15,457] Trial 0 finished with value: -1.8504310866981766 and parameters: {'n_layers_yy': 2, 'hidden_size_yy_l0': 5, 'hidden_size_yy_l1': 6, 'context_size_yy': 3, 'num_mix_components_yy': 5, 'context_extractor_yy': 'gru', 'activation_func_yy': 'ReLU', 'L2_weight_yy': 5.9819895860300085e-06, 'L_entropy_weight_yy': 2.2087741365520143e-08, 'L_sep_weight_yy': 8.118644473303998e-05, 'L_scale_weight_yy': 2.3701344397710491e-07, 'learning_rate_yy': 0.0006890066289062405}. Best is trial 0 with value: -1.8504310866981766.
[I 2026-03-17 17:06:15,586] Trial 0 finished with value: -1.901013766616138 and parameters: {'n_layers_yy': 2, 'hidden_size_yy_l0': 6, 'hidden_size_yy_l1': 4, 'context_size_yy': 3, 'num_mix_components_yy': 2, 'context_extractor_yy': 'gru', 'activation_func_yy': 'ReLU', 'L2_weight_yy': 6.36280748317776e-10, 'L_entropy_weight_yy': 4.08653289737508e-05, 'L_sep_weight_yy': 5.708875709791986e-09, 'L_scale_weight_yy': 0.00029679973467226735, 'learning_rate_yy': 0.003508847878014368}. Best is trial 0 with value: -1.901013766616138.
[I 2026-03-17 17:06:16,826] Trial 0 finished with value: -3.1169463448214536 and parameters: {'n_layers_yy': 2, 'hidden_size_yy_l0': 3, 'hidden_size_yy_l1': 6, 'context_size_yy': 3, 'num_mix_components_yy': 4, 'context_extractor_yy': 'gru', 'activation_func_yy': 'ReLU', 'L2_weight_yy': 0.00011557302459592317, 'L_entropy_weight_yy': 2.6378749717442207e-10, 'L_sep_weight_yy': 1.557001488147142e-08, 'L_scale_weight_yy': 2.22180537631253e-06, 'learning_rate_yy': 0.0024666547778560695}. Best is trial 0 with value: -3.1169463448214536.
[I 2026-03-17 17:06:18,617] Trial 1 finished with value: -0.5633141099176839 and parameters: {'n_layers_yy': 2, 'hidden_size_yy_l0': 5, 'hidden_size_yy_l1': 4, 'context_size_yy': 1, 'num_mix_components_yy': 2, 'context_extractor_yy': 'gru', 'activation_func_yy': 'ReLU', 'L2_weight_yy': 6.973010228945161e-09, 'L_entropy_weight_yy': 0.00010450047485834493, 'L_sep_weight_yy': 9.366905950172652e-09, 'L_scale_weight_yy': 7.500040508658771e-06, 'learning_rate_yy': 0.006915930619572795}. Best is trial 1 with value: -0.5633141099176839.
[I 2026-03-17 17:06:19,289] Trial 1 pruned. 
[I 2026-03-17 17:06:19,745] Trial 0 finished with value: -1.7185170553188132 and parameters: {'n_layers_yy': 2, 'hidden_size_yy_l0': 2, 'hidden_size_yy_l1': 2, 'context_size_yy': 4, 'num_mix_components_yy': 1, 'context_extractor_yy': 'lstm', 'activation_func_yy': 'Tanh', 'L2_weight_yy': 1.19517394128892e-10, 'L_entropy_weight_yy': 3.512203045100065e-06, 'L_sep_weight_yy': 5.8729303748070305e-06, 'L_scale_weight_yy': 0.00010093624375957021, 'learning_rate_yy': 0.0024472139879996705}. Best is trial 0 with value: -1.7185170553188132.
[I 2026-03-17 17:06:20,039] Trial 1 finished with value: -1.4537486853966346 and parameters: {'n_layers_yy': 2, 'hidden_size_yy_l0': 5, 'hidden_size_yy_l1': 5, 'context_size_yy': 4, 'num_mix_components_yy': 5, 'context_extractor_yy': 'lstm', 'activation_func_yy': 'ReLU', 'L2_weight_yy': 3.668664360693696e-09, 'L_entropy_weight_yy': 1.953433328280304e-08, 'L_sep_weight_yy': 0.00011287100873028869, 'L_scale_weight_yy': 2.0376959585997074e-05, 'learning_rate_yy': 0.001598991856969018}. Best is trial 1 with value: -1.4537486853966346.
[I 2026-03-17 17:06:20,506] Trial 7 finished with value: 0.003721819367519645 and parameters: {'n_layers_yy': 1, 'hidden_size_yy_l0': 5, 'context_size_yy': 2, 'num_mix_components_yy': 4, 'context_extractor_yy': 'lstm', 'activation_func_yy': 'ReLU', 'L2_weight_yy': 2.4276574885520456e-08, 'L_entropy_weight_yy': 2.251263777354278e-10, 'L_sep_weight_yy': 1.708569026077332e-10, 'L_scale_weight_yy': 8.076290202013862e-10, 'learning_rate_yy': 0.0022339628735048036}. Best is trial 7 with value: 0.003721819367519645.
[I 2026-03-17 17:06:20,580] Trial 2 pruned. 
[I 2026-03-17 17:06:20,835] Trial 0 finished with value: -1.8164764621206944 and parameters: {'n_layers_yy': 1, 'hidden_size_yy_l0': 5, 'context_size_yy': 3, 'num_mix_components_yy': 4, 'context_extractor_yy': 'gru', 'activation_func_yy': 'GELU', 'L2_weight_yy': 1.612260752402152e-06, 'L_entropy_weight_yy': 0.0009394858480444011, 'L_sep_weight_yy': 1.4058558803102092e-10, 'L_scale_weight_yy': 3.406747291787334e-07, 'learning_rate_yy': 0.005553292906784707}. Best is trial 0 with value: -1.8164764621206944.
[I 2026-03-17 17:06:21,210] Trial 2 pruned. 
[I 2026-03-17 17:06:21,809] Trial 0 finished with value: -2.7293966247954415 and parameters: {'n_layers_yy': 2, 'hidden_size_yy_l0': 5, 'hidden_size_yy_l1': 2, 'context_size_yy': 2, 'num_mix_components_yy': 1, 'context_extractor_yy': 'lstm', 'activation_func_yy': 'Tanh', 'L2_weight_yy': 8.319326996364497e-07, 'L_entropy_weight_yy': 9.374023297840192e-08, 'L_sep_weight_yy': 5.80051938585406e-10, 'L_scale_weight_yy': 1.0268511388422124e-08, 'learning_rate_yy': 0.007262768000920342}. Best is trial 0 with value: -2.7293966247954415.
[I 2026-03-17 17:06:26,262] Trial 8 pruned. 
[I 2026-03-17 17:06:27,825] Trial 3 pruned. 
[I 2026-03-17 17:06:28,314] Trial 1 pruned. 
[I 2026-03-17 17:06:33,546] Trial 1 pruned. 
[I 2026-03-17 17:06:35,915] Trial 1 finished with value: -0.8106657898760616 and parameters: {'n_layers_yy': 1, 'hidden_size_yy_l0': 3, 'context_size_yy': 1, 'num_mix_components_yy': 5, 'context_extractor_yy': 'gru', 'activation_func_yy': 'ReLU', 'L2_weight_yy': 0.0004374740226541016, 'L_entropy_weight_yy': 8.442490061953604e-06, 'L_sep_weight_yy': 6.186701266877265e-06, 'L_scale_weight_yy': 1.3104304529394194e-06, 'learning_rate_yy': 0.0034893697365278027}. Best is trial 0 with value: -0.8215855382922129.
[I 2026-03-17 17:06:49,978] Trial 3 finished with value: -0.5765003902220168 and parameters: {'n_layers_yy': 1, 'hidden_size_yy_l0': 3, 'context_size_yy': 4, 'num_mix_components_yy': 4, 'context_extractor_yy': 'lstm', 'activation_func_yy': 'GELU', 'L2_weight_yy': 7.611440002386082e-05, 'L_entropy_weight_yy': 0.00048613870100311276, 'L_sep_weight_yy': 8.74060715855825e-07, 'L_scale_weight_yy': 1.4562257073990011e-06, 'learning_rate_yy': 0.008160582814356438}. Best is trial 3 with value: -0.5765003902220168.
[I 2026-03-17 17:06:50,587] Trial 9 finished with value: -0.0033154016317323196 and parameters: {'n_layers_yy': 2, 'hidden_size_yy_l0': 5, 'hidden_size_yy_l1': 4, 'context_size_yy': 3, 'num_mix_components_yy': 5, 'context_extractor_yy': 'lstm', 'activation_func_yy': 'Tanh', 'L2_weight_yy': 9.73710410577874e-05, 'L_entropy_weight_yy': 5.6815856777454055e-05, 'L_sep_weight_yy': 5.778730261018649e-08, 'L_scale_weight_yy': 0.0003093831406247082, 'learning_rate_yy': 0.0019002380435520496}. Best is trial 9 with value: -0.0033154016317323196.
[I 2026-03-17 17:06:54,950] Trial 1 finished with value: -1.260024502625527 and parameters: {'n_layers_yy': 2, 'hidden_size_yy_l0': 5, 'hidden_size_yy_l1': 5, 'context_size_yy': 4, 'num_mix_components_yy': 5, 'context_extractor_yy': 'lstm', 'activation_func_yy': 'Tanh', 'L2_weight_yy': 1.168726007285524e-10, 'L_entropy_weight_yy': 4.666984750941366e-10, 'L_sep_weight_yy': 2.616041561202025e-08, 'L_scale_weight_yy': 6.431675291591909e-08, 'learning_rate_yy': 0.0011538585349073168}. Best is trial 1 with value: -1.260024502625527.
[I 2026-03-17 17:06:57,544] Trial 1 finished with value: -0.4126387085338864 and parameters: {'n_layers_yy': 2, 'hidden_size_yy_l0': 5, 'hidden_size_yy_l1': 2, 'context_size_yy': 2, 'num_mix_components_yy': 1, 'context_extractor_yy': 'gru', 'activation_func_yy': 'ReLU', 'L2_weight_yy': 4.731985271977974e-09, 'L_entropy_weight_yy': 2.9475218084939556e-10, 'L_sep_weight_yy': 2.3769284579170965e-09, 'L_scale_weight_yy': 1.548633688044004e-06, 'learning_rate_yy': 0.0024710149353911826}. Best is trial 1 with value: -0.4126387085338864.
[I 2026-03-17 17:07:00,846] Trial 1 finished with value: -1.9741431522447364 and parameters: {'n_layers_yy': 2, 'hidden_size_yy_l0': 6, 'hidden_size_yy_l1': 4, 'context_size_yy': 3, 'num_mix_components_yy': 3, 'context_extractor_yy': 'lstm', 'activation_func_yy': 'Tanh', 'L2_weight_yy': 2.00261459032667e-06, 'L_entropy_weight_yy': 2.6290194696692276e-10, 'L_sep_weight_yy': 1.2893306870140493e-09, 'L_scale_weight_yy': 2.4876412026756086e-09, 'learning_rate_yy': 0.007693368880554098}. Best is trial 1 with value: -1.9741431522447364.
[I 2026-03-17 17:07:07,275] Trial 10 finished with value: -0.004261507544406625 and parameters: {'n_layers_yy': 2, 'hidden_size_yy_l0': 6, 'hidden_size_yy_l1': 6, 'context_size_yy': 3, 'num_mix_components_yy': 5, 'context_extractor_yy': 'lstm', 'activation_func_yy': 'Tanh', 'L2_weight_yy': 0.0008171337815143844, 'L_entropy_weight_yy': 8.465310930341598e-06, 'L_sep_weight_yy': 1.583748190418055e-08, 'L_scale_weight_yy': 0.0009512201078979519, 'learning_rate_yy': 0.004116277717777543}. Best is trial 10 with value: -0.004261507544406625.
[I 2026-03-17 17:07:07,320] Trial 0 finished with value: -2.4911625695835298 and parameters: {'n_layers_yy': 1, 'hidden_size_yy_l0': 5, 'context_size_yy': 1, 'num_mix_components_yy': 1, 'context_extractor_yy': 'gru', 'activation_func_yy': 'GELU', 'L2_weight_yy': 4.782835287044426e-10, 'L_entropy_weight_yy': 1.2291338542893827e-08, 'L_sep_weight_yy': 0.0003004925393271048, 'L_scale_weight_yy': 4.144939959269966e-05, 'learning_rate_yy': 0.00850885669103313}. Best is trial 0 with value: -2.4911625695835298.
[I 2026-03-17 17:07:07,655] Trial 2 finished with value: -1.4206473717322716 and parameters: {'n_layers_yy': 2, 'hidden_size_yy_l0': 3, 'hidden_size_yy_l1': 6, 'context_size_yy': 3, 'num_mix_components_yy': 4, 'context_extractor_yy': 'lstm', 'activation_func_yy': 'Tanh', 'L2_weight_yy': 2.5996042222188754e-09, 'L_entropy_weight_yy': 6.772597096653616e-05, 'L_sep_weight_yy': 0.0007363661395171172, 'L_scale_weight_yy': 2.437171480383268e-10, 'learning_rate_yy': 0.0013954036205184473}. Best is trial 1 with value: -1.4537486853966346.
[I 2026-03-17 17:07:08,827] Trial 0 finished with value: -2.078193208419579 and parameters: {'n_layers_yy': 1, 'hidden_size_yy_l0': 2, 'context_size_yy': 4, 'num_mix_components_yy': 2, 'context_extractor_yy': 'lstm', 'activation_func_yy': 'Tanh', 'L2_weight_yy': 0.0009392999523579929, 'L_entropy_weight_yy': 1.1499007192938364e-10, 'L_sep_weight_yy': 1.1456343875760419e-05, 'L_scale_weight_yy': 6.937939616685329e-10, 'learning_rate_yy': 0.0045067674162846206}. Best is trial 0 with value: -2.078193208419579.
