[I 2026-03-17 17:21:05,727] Trial 49 pruned. 
Optimize task 5: group_id: BC, neuron_id: 3
Starting optimization for task 5...

--- Data Summary ---
Total events for target process 5634
Data Time: 900 seconds
Using device: cuda
Number of events in target process: 5634
Only one process provided, preparing dataloaders for the reduced model.
Reduced model ln_yy : 88.67328 nats/sec, 14.16506 nats/event
Reduced model Log loss : -1.25724
Number of events in target process: 5634
Only one process provided, preparing dataloaders for the reduced model.
Reduced model ln_yy : 88.09672 nats/sec, 14.07296 nats/event
Reduced model Log loss : -1.26002
Number of events in target process: 5634
Only one process provided, preparing dataloaders for the reduced model.
Number of events in target process: 5634
Only one process provided, preparing dataloaders for the reduced model.
Reduced model ln_yy : 86.50156 nats/sec, 13.81814 nats/event
Reduced model Log loss : -1.23977
Number of events in target process: 5634
Only one process provided, preparing dataloaders for the reduced model.
Number of events in target process: 5634
Only one process provided, preparing dataloaders for the reduced model.
Reduced model ln_yy : 86.59447 nats/sec, 13.83298 nats/event
Reduced model Log loss : -1.24103
Number of events in target process: 5634
Only one process provided, preparing dataloaders for the reduced model.
Number of events in target process: 5634
Only one process provided, preparing dataloaders for the reduced model.
Number of events in target process: 5634
Only one process provided, preparing dataloaders for the reduced model.
Number of events in target process: 5634
Only one process provided, preparing dataloaders for the reduced model.
Reduced model ln_yy : 88.52216 nats/sec, 14.14092 nats/event
Reduced model Log loss : -1.27188
Number of events in target process: 5634
Only one process provided, preparing dataloaders for the reduced model.
Number of events in target process: 5634
Only one process provided, preparing dataloaders for the reduced model.
Reduced model ln_yy : 87.70505 nats/sec, 14.01039 nats/event
Reduced model Log loss : -1.26884
Number of events in target process: 5634
Only one process provided, preparing dataloaders for the reduced model.
Number of events in target process: 5634
Only one process provided, preparing dataloaders for the reduced model.
Number of events in target process: 5634
Only one process provided, preparing dataloaders for the reduced model.
Number of events in target process: 5634
Only one process provided, preparing dataloaders for the reduced model.
Number of events in target process: 5634
Only one process provided, preparing dataloaders for the reduced model.
Reduced model ln_yy : 87.12491 nats/sec, 13.91772 nats/event
Reduced model Log loss : -1.23199
Number of events in target process: 5634
Only one process provided, preparing dataloaders for the reduced model.
Number of events in target process: 5634
Only one process provided, preparing dataloaders for the reduced model.
Reduced model ln_yy : 88.49697 nats/sec, 14.13690 nats/event
Reduced model Log loss : -1.26110
Number of events in target process: 5634
Only one process provided, preparing dataloaders for the reduced model.
Reduced model ln_yy : 87.06991 nats/sec, 13.90893 nats/event
Reduced model Log loss : -1.27447
Number of events in target process: 5634
Only one process provided, preparing dataloaders for the reduced model.
Number of events in target process: 5634
Only one process provided, preparing dataloaders for the reduced model.
Number of events in target process: 5634
Only one process provided, preparing dataloaders for the reduced model.
Number of events in target process: 5634
Only one process provided, preparing dataloaders for the reduced model.
Number of events in target process: 5634
Only one process provided, preparing dataloaders for the reduced model.
Number of events in target process: 5634
Only one process provided, preparing dataloaders for the reduced model.
Number of events in target process: 5634
Only one process provided, preparing dataloaders for the reduced model.
Number of events in target process: 5634
Only one process provided, preparing dataloaders for the reduced model.
Number of events in target process: 5634
Only one process provided, preparing dataloaders for the reduced model.
Reduced model ln_yy : 89.23594 nats/sec, 14.25494 nats/event
Reduced model Log loss : -1.27480
Number of events in target process: 5634
Only one process provided, preparing dataloaders for the reduced model.
Number of events in target process: 5634
Only one process provided, preparing dataloaders for the reduced model.
Number of events in target process: 5634
Only one process provided, preparing dataloaders for the reduced model.
Reduced model ln_yy : 88.15264 nats/sec, 14.08189 nats/event
Reduced model Log loss : -1.26869
Number of events in target process: 5634
Only one process provided, preparing dataloaders for the reduced model.
Number of events in target process: 5634
Only one process provided, preparing dataloaders for the reduced model.
Reduced model ln_yy : 89.68940 nats/sec, 14.32738 nats/event
Reduced model Log loss : -1.26287
Number of events in target process: 5634
Only one process provided, preparing dataloaders for the reduced model.
Number of events in target process: 5634
Only one process provided, preparing dataloaders for the reduced model.
Number of events in target process: 5634
Only one process provided, preparing dataloaders for the reduced model.
Number of events in target process: 5634
Only one process provided, preparing dataloaders for the reduced model.
Reduced model ln_yy : 87.56880 nats/sec, 13.98863 nats/event
Reduced model Log loss : -1.26828
Number of events in target process: 5634
Only one process provided, preparing dataloaders for the reduced model.
Number of events in target process: 5634
Only one process provided, preparing dataloaders for the reduced model.
Reduced model ln_yy : 87.98464 nats/sec, 14.05505 nats/event
Reduced model Log loss : -1.27337
Number of events in target process: 5634
Only one process provided, preparing dataloaders for the reduced model.
Number of events in target process: 5634
Only one process provided, preparing dataloaders for the reduced model.
Reduced model ln_yy : 87.70576 nats/sec, 14.01050 nats/event
Reduced model Log loss : -1.27013
Number of events in target process: 5634
Only one process provided, preparing dataloaders for the reduced model.
Number of events in target process: 5634
Only one process provided, preparing dataloaders for the reduced model.
Number of events in target process: 5634
Only one process provided, preparing dataloaders for the reduced model.
Number of events in target process: 5634
Only one process provided, preparing dataloaders for the reduced model.
Number of events in target process: 5634
Only one process provided, preparing dataloaders for the reduced model.
Number of events in target process: 5634
Only one process provided, preparing dataloaders for the reduced model.
Number of events in target process: 5634
Only one process provided, preparing dataloaders for the reduced model.
Number of events in target process: 5634
Only one process provided, preparing dataloaders for the reduced model.
Best trial:
  Value: -1.2748027526517012
  Params: {'n_layers_yy': 2, 'hidden_size_yy_l0': 5, 'hidden_size_yy_l1': 6, 'context_size_yy': 1, 'num_mix_components_yy': 4, 'context_extractor_yy': 'lstm', 'activation_func_yy': 'Tanh', 'L2_weight_yy': 1.3255904275855953e-09, 'L_entropy_weight_yy': 5.821799129313137e-05, 'L_sep_weight_yy': 1.270248671579296e-07, 'L_scale_weight_yy': 2.9994504713927185e-08, 'learning_rate_yy': 0.008359142491044195}
Full best configuration saved to results/opt/opt_reduced_5_best_config.txt
Optimization finished.
[I 2026-03-17 17:21:07,410] Trial 25 pruned. 
[I 2026-03-17 17:21:08,881] Trial 45 finished with value: -1.6786319708835615 and parameters: {'n_layers_yy': 1, 'hidden_size_yy_l0': 5, 'context_size_yy': 4, 'num_mix_components_yy': 4, 'context_extractor_yy': 'gru', 'activation_func_yy': 'GELU', 'L2_weight_yy': 8.163342667154047e-06, 'L_entropy_weight_yy': 1.1431126275498101e-07, 'L_sep_weight_yy': 5.1012095903483466e-08, 'L_scale_weight_yy': 5.254157077180578e-10, 'learning_rate_yy': 0.006580081996240567}. Best is trial 45 with value: -1.6786319708835615.
[I 2026-03-17 17:21:10,454] Trial 26 pruned. 
[I 2026-03-17 17:21:11,434] Trial 46 pruned. 
[I 2026-03-17 17:21:11,853] Trial 12 pruned. 
[I 2026-03-17 17:21:11,930] Trial 29 pruned. 
[I 2026-03-17 17:21:13,361] Trial 27 pruned. 
[I 2026-03-17 17:21:14,215] Trial 25 pruned. 
[I 2026-03-17 17:21:14,270] Trial 47 pruned. 
[I 2026-03-17 17:21:16,848] Trial 40 pruned. 
[I 2026-03-17 17:21:18,173] Trial 26 pruned. 
[I 2026-03-17 17:21:18,967] Trial 41 pruned. 
[I 2026-03-17 17:21:19,571] Trial 29 finished with value: -1.9839340462066386 and parameters: {'n_layers_yy': 2, 'hidden_size_yy_l0': 4, 'hidden_size_yy_l1': 5, 'context_size_yy': 3, 'num_mix_components_yy': 3, 'context_extractor_yy': 'gru', 'activation_func_yy': 'GELU', 'L2_weight_yy': 2.575523755944907e-06, 'L_entropy_weight_yy': 6.246546868714695e-10, 'L_sep_weight_yy': 6.587963614400956e-05, 'L_scale_weight_yy': 1.742763498655986e-08, 'learning_rate_yy': 0.007480434624090018}. Best is trial 24 with value: -1.9860150014876785.
[I 2026-03-17 17:21:21,429] Trial 42 pruned. 
[I 2026-03-17 17:21:22,322] Trial 21 pruned. 
[I 2026-03-17 17:21:22,686] Trial 30 pruned. 
[I 2026-03-17 17:21:22,940] Trial 37 pruned. 
[I 2026-03-17 17:21:25,901] Trial 13 pruned. 
[I 2026-03-17 17:21:26,052] Trial 49 finished with value: -1.8196118137365875 and parameters: {'n_layers_yy': 2, 'hidden_size_yy_l0': 5, 'hidden_size_yy_l1': 6, 'context_size_yy': 4, 'num_mix_components_yy': 5, 'context_extractor_yy': 'lstm', 'activation_func_yy': 'ReLU', 'L2_weight_yy': 5.597256572057091e-06, 'L_entropy_weight_yy': 1.3784216888458792e-07, 'L_sep_weight_yy': 1.3526167757771722e-05, 'L_scale_weight_yy': 2.4742870219891006e-09, 'learning_rate_yy': 0.008520391876926431}. Best is trial 2 with value: -1.824331576606496.
Optimize task 25: group_id: POm, neuron_id: 59
Starting optimization for task 25...

--- Data Summary ---
Total events for target process 9421
Data Time: 900 seconds
Using device: cuda
Number of events in target process: 9421
Only one process provided, preparing dataloaders for the reduced model.
Reduced model ln_yy : 305.64848 nats/sec, 29.19898 nats/event
Reduced model Log loss : -1.81648
Number of events in target process: 9421
Only one process provided, preparing dataloaders for the reduced model.
Number of events in target process: 9421
Only one process provided, preparing dataloaders for the reduced model.
Reduced model ln_yy : 304.69417 nats/sec, 29.10782 nats/event
Reduced model Log loss : -1.82433
Number of events in target process: 9421
Only one process provided, preparing dataloaders for the reduced model.
Number of events in target process: 9421
Only one process provided, preparing dataloaders for the reduced model.
Number of events in target process: 9421
Only one process provided, preparing dataloaders for the reduced model.
Number of events in target process: 9421
Only one process provided, preparing dataloaders for the reduced model.
Number of events in target process: 9421
Only one process provided, preparing dataloaders for the reduced model.
Reduced model ln_yy : 301.68462 nats/sec, 28.82031 nats/event
Reduced model Log loss : -1.79522
Number of events in target process: 9421
Only one process provided, preparing dataloaders for the reduced model.
Reduced model ln_yy : 302.35929 nats/sec, 28.88476 nats/event
Reduced model Log loss : -1.79629
Number of events in target process: 9421
Only one process provided, preparing dataloaders for the reduced model.
Number of events in target process: 9421
Only one process provided, preparing dataloaders for the reduced model.
Number of events in target process: 9421
Only one process provided, preparing dataloaders for the reduced model.
Number of events in target process: 9421
Only one process provided, preparing dataloaders for the reduced model.
Reduced model ln_yy : 303.10517 nats/sec, 28.95602 nats/event
Reduced model Log loss : -1.79398
Number of events in target process: 9421
Only one process provided, preparing dataloaders for the reduced model.
Reduced model ln_yy : 300.87717 nats/sec, 28.74318 nats/event
Reduced model Log loss : -1.79208
Number of events in target process: 9421
Only one process provided, preparing dataloaders for the reduced model.
Number of events in target process: 9421
Only one process provided, preparing dataloaders for the reduced model.
Number of events in target process: 9421
Only one process provided, preparing dataloaders for the reduced model.
Number of events in target process: 9421
Only one process provided, preparing dataloaders for the reduced model.
Number of events in target process: 9421
Only one process provided, preparing dataloaders for the reduced model.
Number of events in target process: 9421
Only one process provided, preparing dataloaders for the reduced model.
Number of events in target process: 9421
Only one process provided, preparing dataloaders for the reduced model.
Reduced model ln_yy : 301.28838 nats/sec, 28.78246 nats/event
Reduced model Log loss : -1.79646
Number of events in target process: 9421
Only one process provided, preparing dataloaders for the reduced model.
Number of events in target process: 9421
Only one process provided, preparing dataloaders for the reduced model.
Number of events in target process: 9421
Only one process provided, preparing dataloaders for the reduced model.
Number of events in target process: 9421
Only one process provided, preparing dataloaders for the reduced model.
Number of events in target process: 9421
Only one process provided, preparing dataloaders for the reduced model.
Number of events in target process: 9421
Only one process provided, preparing dataloaders for the reduced model.
Number of events in target process: 9421
Only one process provided, preparing dataloaders for the reduced model.
Number of events in target process: 9421
Only one process provided, preparing dataloaders for the reduced model.
Number of events in target process: 9421
Only one process provided, preparing dataloaders for the reduced model.
Number of events in target process: 9421
Only one process provided, preparing dataloaders for the reduced model.
Reduced model ln_yy : 302.38860 nats/sec, 28.88756 nats/event
Reduced model Log loss : -1.79658
Number of events in target process: 9421
Only one process provided, preparing dataloaders for the reduced model.
Number of events in target process: 9421
Only one process provided, preparing dataloaders for the reduced model.
Number of events in target process: 9421
Only one process provided, preparing dataloaders for the reduced model.
Number of events in target process: 9421
Only one process provided, preparing dataloaders for the reduced model.
Number of events in target process: 9421
Only one process provided, preparing dataloaders for the reduced model.
Number of events in target process: 9421
Only one process provided, preparing dataloaders for the reduced model.
Number of events in target process: 9421
Only one process provided, preparing dataloaders for the reduced model.
Number of events in target process: 9421
Only one process provided, preparing dataloaders for the reduced model.
Number of events in target process: 9421
Only one process provided, preparing dataloaders for the reduced model.
Reduced model ln_yy : 306.43050 nats/sec, 29.27369 nats/event
Reduced model Log loss : -1.81852
Number of events in target process: 9421
Only one process provided, preparing dataloaders for the reduced model.
Number of events in target process: 9421
Only one process provided, preparing dataloaders for the reduced model.
Number of events in target process: 9421
Only one process provided, preparing dataloaders for the reduced model.
Reduced model ln_yy : 304.16927 nats/sec, 29.05767 nats/event
Reduced model Log loss : -1.81978
Number of events in target process: 9421
Only one process provided, preparing dataloaders for the reduced model.
Number of events in target process: 9421
Only one process provided, preparing dataloaders for the reduced model.
Reduced model ln_yy : 304.50674 nats/sec, 29.08991 nats/event
Reduced model Log loss : -1.79573
Number of events in target process: 9421
Only one process provided, preparing dataloaders for the reduced model.
Reduced model ln_yy : 305.96273 nats/sec, 29.22901 nats/event
Reduced model Log loss : -1.82392
Number of events in target process: 9421
Only one process provided, preparing dataloaders for the reduced model.
Number of events in target process: 9421
Only one process provided, preparing dataloaders for the reduced model.
Reduced model ln_yy : 302.33631 nats/sec, 28.88257 nats/event
Reduced model Log loss : -1.79515
Number of events in target process: 9421
Only one process provided, preparing dataloaders for the reduced model.
Number of events in target process: 9421
Only one process provided, preparing dataloaders for the reduced model.
Reduced model ln_yy : 306.48449 nats/sec, 29.27885 nats/event
Reduced model Log loss : -1.81961
Best trial:
  Value: -1.824331576606496
  Params: {'n_layers_yy': 2, 'hidden_size_yy_l0': 2, 'hidden_size_yy_l1': 5, 'context_size_yy': 2, 'num_mix_components_yy': 5, 'context_extractor_yy': 'gru', 'activation_func_yy': 'GELU', 'L2_weight_yy': 8.099959629893594e-08, 'L_entropy_weight_yy': 4.163334274769701e-10, 'L_sep_weight_yy': 2.328888827369102e-10, 'L_scale_weight_yy': 1.83361605570531e-06, 'learning_rate_yy': 0.0014265771164578037}
Full best configuration saved to results/opt/opt_reduced_25_best_config.txt
Optimization finished.
[I 2026-03-17 17:21:27,783] Trial 27 pruned. 
[I 2026-03-17 17:21:29,680] Trial 38 pruned. 
[I 2026-03-17 17:21:29,907] Trial 48 pruned. 
[I 2026-03-17 17:21:30,996] Trial 14 pruned. 
[I 2026-03-17 17:21:31,626] Trial 28 pruned. 
[I 2026-03-17 17:21:31,908] Trial 12 finished with value: -2.806977931381423 and parameters: {'n_layers_yy': 1, 'hidden_size_yy_l0': 6, 'context_size_yy': 3, 'num_mix_components_yy': 3, 'context_extractor_yy': 'lstm', 'activation_func_yy': 'ReLU', 'L2_weight_yy': 0.00020942527373482163, 'L_entropy_weight_yy': 1.0628736431547562e-07, 'L_sep_weight_yy': 3.4085640908542034e-08, 'L_scale_weight_yy': 2.0794026931985573e-08, 'learning_rate_yy': 0.005913827839212337}. Best is trial 12 with value: -2.806977931381423.
[I 2026-03-17 17:21:32,049] Trial 39 pruned. 
[I 2026-03-17 17:21:34,266] Trial 29 pruned. 
[I 2026-03-17 17:21:34,622] Trial 40 pruned. 
[I 2026-03-17 17:21:36,245] Trial 18 finished with value: -2.4920728800472483 and parameters: {'n_layers_yy': 2, 'hidden_size_yy_l0': 3, 'hidden_size_yy_l1': 4, 'context_size_yy': 3, 'num_mix_components_yy': 5, 'context_extractor_yy': 'gru', 'activation_func_yy': 'GELU', 'L2_weight_yy': 6.92166694564829e-05, 'L_entropy_weight_yy': 5.415727270834393e-09, 'L_sep_weight_yy': 5.0781710010944835e-08, 'L_scale_weight_yy': 3.0645839552700915e-05, 'learning_rate_yy': 0.007061757833050474}. Best is trial 18 with value: -2.4920728800472483.
[I 2026-03-17 17:21:36,623] Trial 28 pruned. 
[I 2026-03-17 17:21:39,768] Trial 41 pruned. 
[I 2026-03-17 17:21:40,375] Trial 29 pruned. 
[I 2026-03-17 17:21:40,599] Trial 30 pruned. 
[I 2026-03-17 17:21:42,134] Trial 30 pruned. 
