[I 2026-03-17 17:20:10,715] Trial 9 finished with value: -2.7636669680656607 and parameters: {'n_layers_yy': 2, 'hidden_size_yy_l0': 4, 'hidden_size_yy_l1': 6, 'context_size_yy': 4, 'num_mix_components_yy': 5, 'context_extractor_yy': 'gru', 'activation_func_yy': 'Tanh', 'L2_weight_yy': 2.3500762916909108e-07, 'L_entropy_weight_yy': 5.226340476112058e-08, 'L_sep_weight_yy': 1.7567001457243262e-09, 'L_scale_weight_yy': 9.73450536225898e-10, 'learning_rate_yy': 0.0025093792754949814}. Best is trial 9 with value: -2.7636669680656607.
[I 2026-03-17 17:20:10,958] Trial 22 finished with value: -1.8507858561874675 and parameters: {'n_layers_yy': 1, 'hidden_size_yy_l0': 5, 'context_size_yy': 3, 'num_mix_components_yy': 5, 'context_extractor_yy': 'lstm', 'activation_func_yy': 'Tanh', 'L2_weight_yy': 5.141800137629935e-06, 'L_entropy_weight_yy': 4.012349213354386e-06, 'L_sep_weight_yy': 4.73673674993704e-05, 'L_scale_weight_yy': 1.1155732237588092e-09, 'learning_rate_yy': 0.006801658311883578}. Best is trial 10 with value: -1.8554935362796692.
[I 2026-03-17 17:20:10,983] Trial 24 pruned. 
[I 2026-03-17 17:20:12,185] Trial 43 pruned. 
[I 2026-03-17 17:20:12,836] Trial 28 pruned. 
[I 2026-03-17 17:20:13,194] Trial 40 pruned. 
[I 2026-03-17 17:20:13,528] Trial 20 pruned. 
[I 2026-03-17 17:20:15,132] Trial 37 pruned. 
[I 2026-03-17 17:20:15,629] Trial 25 pruned. 
[I 2026-03-17 17:20:17,685] Trial 29 pruned. 
[I 2026-03-17 17:20:18,179] Trial 26 pruned. 
[I 2026-03-17 17:20:21,813] Trial 21 pruned. 
[I 2026-03-17 17:20:24,925] Trial 19 pruned. 
[I 2026-03-17 17:20:25,200] Trial 17 finished with value: -2.4907113236623224 and parameters: {'n_layers_yy': 2, 'hidden_size_yy_l0': 3, 'hidden_size_yy_l1': 4, 'context_size_yy': 4, 'num_mix_components_yy': 5, 'context_extractor_yy': 'gru', 'activation_func_yy': 'GELU', 'L2_weight_yy': 3.4101534983113654e-05, 'L_entropy_weight_yy': 5.138406667321569e-09, 'L_sep_weight_yy': 6.151132060863105e-08, 'L_scale_weight_yy': 1.6060139226573838e-06, 'learning_rate_yy': 0.006666170470119792}. Best is trial 17 with value: -2.4907113236623224.
[I 2026-03-17 17:20:25,532] Trial 10 pruned. 
[I 2026-03-17 17:20:26,363] Trial 27 pruned. 
[I 2026-03-17 17:20:26,527] Trial 49 finished with value: -1.6705580748997708 and parameters: {'n_layers_yy': 2, 'hidden_size_yy_l0': 2, 'hidden_size_yy_l1': 6, 'context_size_yy': 4, 'num_mix_components_yy': 4, 'context_extractor_yy': 'gru', 'activation_func_yy': 'GELU', 'L2_weight_yy': 9.667815352950554e-05, 'L_entropy_weight_yy': 3.962011162104642e-08, 'L_sep_weight_yy': 6.468117934475627e-10, 'L_scale_weight_yy': 5.793519328292578e-05, 'learning_rate_yy': 0.007388590538645124}. Best is trial 48 with value: -1.6713392846967534.
Optimize task 6: group_id: BC, neuron_id: 4
Starting optimization for task 6...

--- Data Summary ---
Total events for target process 10683
Data Time: 900 seconds
Using device: cuda
Number of events in target process: 10683
Only one process provided, preparing dataloaders for the reduced model.
Reduced model ln_yy : 363.65846 nats/sec, 30.63677 nats/event
Reduced model Log loss : -1.66284
Number of events in target process: 10683
Only one process provided, preparing dataloaders for the reduced model.
Reduced model ln_yy : 362.75310 nats/sec, 30.56050 nats/event
Reduced model Log loss : -1.66718
Number of events in target process: 10683
Only one process provided, preparing dataloaders for the reduced model.
Reduced model ln_yy : 364.90269 nats/sec, 30.74159 nats/event
Reduced model Log loss : -1.66777
Number of events in target process: 10683
Only one process provided, preparing dataloaders for the reduced model.
Number of events in target process: 10683
Only one process provided, preparing dataloaders for the reduced model.
Number of events in target process: 10683
Only one process provided, preparing dataloaders for the reduced model.
Number of events in target process: 10683
Only one process provided, preparing dataloaders for the reduced model.
Number of events in target process: 10683
Only one process provided, preparing dataloaders for the reduced model.
Number of events in target process: 10683
Only one process provided, preparing dataloaders for the reduced model.
Number of events in target process: 10683
Only one process provided, preparing dataloaders for the reduced model.
Reduced model ln_yy : 361.50082 nats/sec, 30.45500 nats/event
Reduced model Log loss : -1.65420
Number of events in target process: 10683
Only one process provided, preparing dataloaders for the reduced model.
Reduced model ln_yy : 365.05229 nats/sec, 30.75420 nats/event
Reduced model Log loss : -1.67020
Number of events in target process: 10683
Only one process provided, preparing dataloaders for the reduced model.
Reduced model ln_yy : 364.96363 nats/sec, 30.74673 nats/event
Reduced model Log loss : -1.67001
Number of events in target process: 10683
Only one process provided, preparing dataloaders for the reduced model.
Number of events in target process: 10683
Only one process provided, preparing dataloaders for the reduced model.
Number of events in target process: 10683
Only one process provided, preparing dataloaders for the reduced model.
Number of events in target process: 10683
Only one process provided, preparing dataloaders for the reduced model.
Number of events in target process: 10683
Only one process provided, preparing dataloaders for the reduced model.
Number of events in target process: 10683
Only one process provided, preparing dataloaders for the reduced model.
Reduced model ln_yy : 363.50468 nats/sec, 30.62381 nats/event
Reduced model Log loss : -1.67119
Number of events in target process: 10683
Only one process provided, preparing dataloaders for the reduced model.
Number of events in target process: 10683
Only one process provided, preparing dataloaders for the reduced model.
Number of events in target process: 10683
Only one process provided, preparing dataloaders for the reduced model.
Number of events in target process: 10683
Only one process provided, preparing dataloaders for the reduced model.
Number of events in target process: 10683
Only one process provided, preparing dataloaders for the reduced model.
Number of events in target process: 10683
Only one process provided, preparing dataloaders for the reduced model.
Number of events in target process: 10683
Only one process provided, preparing dataloaders for the reduced model.
Number of events in target process: 10683
Only one process provided, preparing dataloaders for the reduced model.
Number of events in target process: 10683
Only one process provided, preparing dataloaders for the reduced model.
Reduced model ln_yy : 358.93132 nats/sec, 30.23853 nats/event
Reduced model Log loss : -1.67035
Number of events in target process: 10683
Only one process provided, preparing dataloaders for the reduced model.
Number of events in target process: 10683
Only one process provided, preparing dataloaders for the reduced model.
Number of events in target process: 10683
Only one process provided, preparing dataloaders for the reduced model.
Number of events in target process: 10683
Only one process provided, preparing dataloaders for the reduced model.
Number of events in target process: 10683
Only one process provided, preparing dataloaders for the reduced model.
Number of events in target process: 10683
Only one process provided, preparing dataloaders for the reduced model.
Number of events in target process: 10683
Only one process provided, preparing dataloaders for the reduced model.
Number of events in target process: 10683
Only one process provided, preparing dataloaders for the reduced model.
Number of events in target process: 10683
Only one process provided, preparing dataloaders for the reduced model.
Number of events in target process: 10683
Only one process provided, preparing dataloaders for the reduced model.
Number of events in target process: 10683
Only one process provided, preparing dataloaders for the reduced model.
Number of events in target process: 10683
Only one process provided, preparing dataloaders for the reduced model.
Number of events in target process: 10683
Only one process provided, preparing dataloaders for the reduced model.
Number of events in target process: 10683
Only one process provided, preparing dataloaders for the reduced model.
Number of events in target process: 10683
Only one process provided, preparing dataloaders for the reduced model.
Number of events in target process: 10683
Only one process provided, preparing dataloaders for the reduced model.
Number of events in target process: 10683
Only one process provided, preparing dataloaders for the reduced model.
Number of events in target process: 10683
Only one process provided, preparing dataloaders for the reduced model.
Number of events in target process: 10683
Only one process provided, preparing dataloaders for the reduced model.
Number of events in target process: 10683
Only one process provided, preparing dataloaders for the reduced model.
Number of events in target process: 10683
Only one process provided, preparing dataloaders for the reduced model.
Number of events in target process: 10683
Only one process provided, preparing dataloaders for the reduced model.
Reduced model ln_yy : 360.99465 nats/sec, 30.41235 nats/event
Reduced model Log loss : -1.67134
Number of events in target process: 10683
Only one process provided, preparing dataloaders for the reduced model.
Reduced model ln_yy : 360.08838 nats/sec, 30.33600 nats/event
Reduced model Log loss : -1.67056
Best trial:
  Value: -1.6713392846967534
  Params: {'n_layers_yy': 2, 'hidden_size_yy_l0': 2, 'hidden_size_yy_l1': 6, 'context_size_yy': 4, 'num_mix_components_yy': 4, 'context_extractor_yy': 'gru', 'activation_func_yy': 'GELU', 'L2_weight_yy': 7.033191171504218e-05, 'L_entropy_weight_yy': 0.00024171328492147452, 'L_sep_weight_yy': 7.441832176851098e-10, 'L_scale_weight_yy': 0.00011622084895454693, 'learning_rate_yy': 0.007533880049930335}
Full best configuration saved to results/opt/opt_reduced_6_best_config.txt
Optimization finished.
[I 2026-03-17 17:20:27,509] Trial 26 pruned. 
[I 2026-03-17 17:20:29,963] Trial 28 pruned. 
[I 2026-03-17 17:20:31,180] Trial 11 pruned. 
[I 2026-03-17 17:20:31,649] Trial 44 pruned. 
[I 2026-03-17 17:20:32,860] Trial 14 finished with value: -2.9749341879117024 and parameters: {'n_layers_yy': 1, 'hidden_size_yy_l0': 6, 'context_size_yy': 4, 'num_mix_components_yy': 5, 'context_extractor_yy': 'gru', 'activation_func_yy': 'Tanh', 'L2_weight_yy': 1.1469964782242459e-05, 'L_entropy_weight_yy': 1.563779584196248e-06, 'L_sep_weight_yy': 1.574744313947596e-05, 'L_scale_weight_yy': 1.413753363778066e-10, 'learning_rate_yy': 0.006919424310370335}. Best is trial 9 with value: -2.9754424140841684.
[I 2026-03-17 17:20:34,680] Trial 8 finished with value: -2.2716534804830935 and parameters: {'n_layers_yy': 2, 'hidden_size_yy_l0': 4, 'hidden_size_yy_l1': 3, 'context_size_yy': 4, 'num_mix_components_yy': 1, 'context_extractor_yy': 'lstm', 'activation_func_yy': 'Tanh', 'L2_weight_yy': 1.8073455684462769e-10, 'L_entropy_weight_yy': 4.098918954109142e-06, 'L_sep_weight_yy': 4.146929434178603e-10, 'L_scale_weight_yy': 1.1226222160962095e-08, 'learning_rate_yy': 0.0015733373436579619}. Best is trial 0 with value: -2.289111866011322.
[I 2026-03-17 17:20:35,261] Trial 38 finished with value: -1.8937020828474813 and parameters: {'n_layers_yy': 2, 'hidden_size_yy_l0': 6, 'hidden_size_yy_l1': 3, 'context_size_yy': 3, 'num_mix_components_yy': 1, 'context_extractor_yy': 'lstm', 'activation_func_yy': 'GELU', 'L2_weight_yy': 9.914005999258402e-06, 'L_entropy_weight_yy': 1.3385049535314657e-09, 'L_sep_weight_yy': 3.836444700776182e-06, 'L_scale_weight_yy': 4.3316818979321913e-10, 'learning_rate_yy': 0.005365946788305805}. Best is trial 18 with value: -1.9113758963969216.
[I 2026-03-17 17:20:37,535] Trial 39 pruned. 
[I 2026-03-17 17:20:38,156] Trial 41 finished with value: -1.270133711273701 and parameters: {'n_layers_yy': 1, 'hidden_size_yy_l0': 6, 'context_size_yy': 4, 'num_mix_components_yy': 5, 'context_extractor_yy': 'lstm', 'activation_func_yy': 'GELU', 'L2_weight_yy': 1.2110150891479102e-09, 'L_entropy_weight_yy': 0.0002867720015371317, 'L_sep_weight_yy': 1.5232776692802158e-05, 'L_scale_weight_yy': 5.267792771646071e-05, 'learning_rate_yy': 0.008251115432941665}. Best is trial 28 with value: -1.2748027526517012.
[I 2026-03-17 17:20:38,300] Trial 27 pruned. 
[I 2026-03-17 17:20:39,165] Trial 45 finished with value: -1.823922484216956 and parameters: {'n_layers_yy': 2, 'hidden_size_yy_l0': 6, 'hidden_size_yy_l1': 6, 'context_size_yy': 3, 'num_mix_components_yy': 5, 'context_extractor_yy': 'lstm', 'activation_func_yy': 'ReLU', 'L2_weight_yy': 4.207527367382901e-06, 'L_entropy_weight_yy': 1.2622117246842515e-08, 'L_sep_weight_yy': 5.2368465719104656e-05, 'L_scale_weight_yy': 2.242881253792537e-09, 'learning_rate_yy': 0.00864047915674448}. Best is trial 2 with value: -1.824331576606496.
[I 2026-03-17 17:20:40,913] Trial 42 pruned. 
[I 2026-03-17 17:20:40,942] Trial 46 pruned. 
[I 2026-03-17 17:20:42,579] Trial 28 pruned. 
[I 2026-03-17 17:20:43,354] Trial 43 pruned. 
[I 2026-03-17 17:20:45,630] Trial 44 pruned. 
[I 2026-03-17 17:20:46,529] Trial 30 finished with value: -2.447192787139576 and parameters: {'n_layers_yy': 1, 'hidden_size_yy_l0': 5, 'context_size_yy': 4, 'num_mix_components_yy': 1, 'context_extractor_yy': 'lstm', 'activation_func_yy': 'GELU', 'L2_weight_yy': 1.1631638837682812e-07, 'L_entropy_weight_yy': 2.508269900907835e-07, 'L_sep_weight_yy': 1.629342506393517e-07, 'L_scale_weight_yy': 2.30739547393901e-05, 'learning_rate_yy': 0.005512268706298343}. Best is trial 2 with value: -2.476197165819489.
[I 2026-03-17 17:20:47,896] Trial 45 pruned. 
[I 2026-03-17 17:20:47,909] Trial 32 finished with value: -1.9741322228095615 and parameters: {'n_layers_yy': 1, 'hidden_size_yy_l0': 4, 'context_size_yy': 4, 'num_mix_components_yy': 3, 'context_extractor_yy': 'lstm', 'activation_func_yy': 'ReLU', 'L2_weight_yy': 3.84003230385025e-08, 'L_entropy_weight_yy': 0.00010207938312772639, 'L_sep_weight_yy': 1.1307007554088164e-07, 'L_scale_weight_yy': 4.893127737164556e-06, 'learning_rate_yy': 0.00977123136250961}. Best is trial 31 with value: -1.9742766261003297.
[I 2026-03-17 17:20:48,162] Trial 33 pruned. 
[I 2026-03-17 17:20:50,963] Trial 31 pruned. 
[I 2026-03-17 17:20:53,618] Trial 33 pruned. 
[I 2026-03-17 17:20:54,093] Trial 46 pruned. 
[I 2026-03-17 17:20:54,357] Trial 23 finished with value: -1.8548291497815423 and parameters: {'n_layers_yy': 1, 'hidden_size_yy_l0': 6, 'context_size_yy': 4, 'num_mix_components_yy': 4, 'context_extractor_yy': 'lstm', 'activation_func_yy': 'Tanh', 'L2_weight_yy': 1.3492445499170508e-05, 'L_entropy_weight_yy': 4.149029465819023e-07, 'L_sep_weight_yy': 2.8279360566019245e-06, 'L_scale_weight_yy': 2.527748517508445e-08, 'learning_rate_yy': 0.0049015940521513115}. Best is trial 10 with value: -1.8554935362796692.
[I 2026-03-17 17:20:57,024] Trial 47 pruned. 
[I 2026-03-17 17:20:58,370] Trial 47 finished with value: -1.795148495965606 and parameters: {'n_layers_yy': 2, 'hidden_size_yy_l0': 5, 'hidden_size_yy_l1': 6, 'context_size_yy': 3, 'num_mix_components_yy': 5, 'context_extractor_yy': 'lstm', 'activation_func_yy': 'ReLU', 'L2_weight_yy': 1.3495190958421685e-05, 'L_entropy_weight_yy': 2.5193412670705206e-10, 'L_sep_weight_yy': 3.619985156937906e-05, 'L_scale_weight_yy': 1.0142326657463455e-10, 'learning_rate_yy': 0.005222527365307491}. Best is trial 2 with value: -1.824331576606496.
[I 2026-03-17 17:20:59,330] Trial 48 pruned. 
[I 2026-03-17 17:20:59,829] Trial 34 pruned. 
[I 2026-03-17 17:21:00,068] Trial 30 finished with value: -2.8359719475786607 and parameters: {'n_layers_yy': 1, 'hidden_size_yy_l0': 5, 'context_size_yy': 4, 'num_mix_components_yy': 4, 'context_extractor_yy': 'gru', 'activation_func_yy': 'ReLU', 'L2_weight_yy': 3.39929469483473e-05, 'L_entropy_weight_yy': 1.1306947791949777e-10, 'L_sep_weight_yy': 2.3401695992696446e-07, 'L_scale_weight_yy': 1.0001658273336414e-10, 'learning_rate_yy': 0.00840281246194908}. Best is trial 26 with value: -2.836288688568588.
[I 2026-03-17 17:21:00,517] Trial 23 finished with value: -1.7824084349352904 and parameters: {'n_layers_yy': 2, 'hidden_size_yy_l0': 6, 'hidden_size_yy_l1': 5, 'context_size_yy': 3, 'num_mix_components_yy': 4, 'context_extractor_yy': 'lstm', 'activation_func_yy': 'GELU', 'L2_weight_yy': 4.3818672231889274e-05, 'L_entropy_weight_yy': 0.00013423764333918617, 'L_sep_weight_yy': 1.4945920447535697e-07, 'L_scale_weight_yy': 2.498886284527952e-05, 'learning_rate_yy': 0.009793684697222573}. Best is trial 8 with value: -1.786668244949495.
[I 2026-03-17 17:21:00,555] Trial 48 pruned. 
[I 2026-03-17 17:21:00,991] Trial 24 pruned. 
[I 2026-03-17 17:21:02,464] Trial 35 pruned. 
[I 2026-03-17 17:21:02,487] Trial 20 finished with value: -3.117078037457524 and parameters: {'n_layers_yy': 1, 'hidden_size_yy_l0': 5, 'context_size_yy': 3, 'num_mix_components_yy': 4, 'context_extractor_yy': 'gru', 'activation_func_yy': 'ReLU', 'L2_weight_yy': 0.0003269455020090914, 'L_entropy_weight_yy': 1.456779915773332e-07, 'L_sep_weight_yy': 0.0007204142029493426, 'L_scale_weight_yy': 1.8535222904044874e-08, 'learning_rate_yy': 0.00982328702616572}. Best is trial 12 with value: -3.1467977435352683.
[I 2026-03-17 17:21:03,858] Trial 29 pruned. 
[I 2026-03-17 17:21:04,341] Trial 24 pruned. 
[I 2026-03-17 17:21:05,071] Trial 36 pruned. 
