[I 2026-03-17 17:16:37,944] Trial 26 finished with value: -1.6703458534512414 and parameters: {'n_layers_yy': 2, 'hidden_size_yy_l0': 2, 'hidden_size_yy_l1': 6, 'context_size_yy': 1, 'num_mix_components_yy': 5, 'context_extractor_yy': 'lstm', 'activation_func_yy': 'GELU', 'L2_weight_yy': 6.254766041346875e-09, 'L_entropy_weight_yy': 6.795407601129673e-08, 'L_sep_weight_yy': 5.611074754711466e-08, 'L_scale_weight_yy': 5.759903663524144e-10, 'learning_rate_yy': 0.007674937312386903}. Best is trial 17 with value: -1.6711897239648343.
[I 2026-03-17 17:16:38,068] Trial 33 pruned. 
[I 2026-03-17 17:16:38,435] Trial 17 pruned. 
[I 2026-03-17 17:16:39,303] Trial 13 pruned. 
[I 2026-03-17 17:16:39,767] Trial 27 pruned. 
[I 2026-03-17 17:16:40,061] Trial 13 finished with value: -1.85186676638703 and parameters: {'n_layers_yy': 1, 'hidden_size_yy_l0': 6, 'context_size_yy': 4, 'num_mix_components_yy': 2, 'context_extractor_yy': 'lstm', 'activation_func_yy': 'Tanh', 'L2_weight_yy': 9.041222174736732e-05, 'L_entropy_weight_yy': 1.5002912982065082e-06, 'L_sep_weight_yy': 6.711671691547896e-06, 'L_scale_weight_yy': 5.0351079148563455e-09, 'learning_rate_yy': 0.004901918665137496}. Best is trial 10 with value: -1.8554935362796692.
[I 2026-03-17 17:16:40,971] Trial 8 pruned. 
[I 2026-03-17 17:16:42,292] Trial 16 finished with value: -1.9815610246276427 and parameters: {'n_layers_yy': 1, 'hidden_size_yy_l0': 6, 'context_size_yy': 4, 'num_mix_components_yy': 2, 'context_extractor_yy': 'lstm', 'activation_func_yy': 'Tanh', 'L2_weight_yy': 5.758650068492391e-07, 'L_entropy_weight_yy': 1.014298569063967e-05, 'L_sep_weight_yy': 1.5039043186551073e-08, 'L_scale_weight_yy': 5.017560736608618e-08, 'learning_rate_yy': 0.00241132650593355}. Best is trial 7 with value: -1.9830532325011814.
[I 2026-03-17 17:16:42,331] Trial 18 pruned. 
[I 2026-03-17 17:16:42,461] Trial 24 pruned. 
[I 2026-03-17 17:16:42,771] Trial 28 pruned. 
[I 2026-03-17 17:16:43,204] Trial 8 pruned. 
[I 2026-03-17 17:16:44,571] Trial 27 pruned. 
[I 2026-03-17 17:16:44,816] Trial 34 pruned. 
[I 2026-03-17 17:16:45,280] Trial 29 pruned. 
[I 2026-03-17 17:16:46,156] Trial 19 pruned. 
[I 2026-03-17 17:16:47,481] Trial 35 pruned. 
[I 2026-03-17 17:16:48,101] Trial 30 pruned. 
[I 2026-03-17 17:16:49,242] Trial 25 pruned. 
[I 2026-03-17 17:16:50,438] Trial 28 pruned. 
[I 2026-03-17 17:16:50,721] Trial 17 pruned. 
[I 2026-03-17 17:16:51,303] Trial 14 pruned. 
[I 2026-03-17 17:16:51,801] Trial 13 finished with value: -2.340292308471929 and parameters: {'n_layers_yy': 1, 'hidden_size_yy_l0': 5, 'context_size_yy': 2, 'num_mix_components_yy': 2, 'context_extractor_yy': 'gru', 'activation_func_yy': 'Tanh', 'L2_weight_yy': 1.2478311077688972e-10, 'L_entropy_weight_yy': 3.683132940772518e-07, 'L_sep_weight_yy': 9.87952126214495e-06, 'L_scale_weight_yy': 1.5186103898990614e-05, 'learning_rate_yy': 0.0021027485772407368}. Best is trial 9 with value: -2.373689101517566.
[I 2026-03-17 17:16:53,970] Trial 36 pruned. 
[I 2026-03-17 17:16:54,880] Trial 18 pruned. 
[I 2026-03-17 17:16:55,665] Trial 26 pruned. 
[I 2026-03-17 17:16:55,750] Trial 9 pruned. 
[I 2026-03-17 17:16:56,725] Trial 29 pruned. 
[I 2026-03-17 17:16:56,840] Trial 15 pruned. 
[I 2026-03-17 17:16:56,952] Trial 24 pruned. 
[I 2026-03-17 17:16:57,961] Trial 19 pruned. 
[I 2026-03-17 17:17:00,084] Trial 20 finished with value: -1.901699309847248 and parameters: {'n_layers_yy': 2, 'hidden_size_yy_l0': 5, 'hidden_size_yy_l1': 4, 'context_size_yy': 4, 'num_mix_components_yy': 3, 'context_extractor_yy': 'lstm', 'activation_func_yy': 'ReLU', 'L2_weight_yy': 6.785678722570137e-08, 'L_entropy_weight_yy': 2.637206353450695e-09, 'L_sep_weight_yy': 3.831217798485202e-07, 'L_scale_weight_yy': 2.0773344619899107e-07, 'learning_rate_yy': 0.007036020679815602}. Best is trial 18 with value: -1.9113758963969216.
[I 2026-03-17 17:17:00,694] Trial 30 finished with value: -1.7965786341046166 and parameters: {'n_layers_yy': 1, 'hidden_size_yy_l0': 2, 'context_size_yy': 3, 'num_mix_components_yy': 5, 'context_extractor_yy': 'gru', 'activation_func_yy': 'Tanh', 'L2_weight_yy': 3.3259711382507156e-05, 'L_entropy_weight_yy': 6.186847411998761e-07, 'L_sep_weight_yy': 2.7853585628541964e-10, 'L_scale_weight_yy': 3.479640897876087e-08, 'learning_rate_yy': 0.009959137283574277}. Best is trial 2 with value: -1.824331576606496.
[I 2026-03-17 17:17:00,704] Trial 14 pruned. 
[I 2026-03-17 17:17:01,288] Trial 14 pruned. 
[I 2026-03-17 17:17:01,405] Trial 16 pruned. 
[I 2026-03-17 17:17:01,941] Trial 28 finished with value: -1.2748027526517012 and parameters: {'n_layers_yy': 2, 'hidden_size_yy_l0': 5, 'hidden_size_yy_l1': 6, 'context_size_yy': 1, 'num_mix_components_yy': 4, 'context_extractor_yy': 'lstm', 'activation_func_yy': 'Tanh', 'L2_weight_yy': 1.3255904275855953e-09, 'L_entropy_weight_yy': 5.821799129313137e-05, 'L_sep_weight_yy': 1.270248671579296e-07, 'L_scale_weight_yy': 2.9994504713927185e-08, 'learning_rate_yy': 0.008359142491044195}. Best is trial 28 with value: -1.2748027526517012.
[I 2026-03-17 17:17:03,632] Trial 21 finished with value: -2.0918060120281896 and parameters: {'n_layers_yy': 2, 'hidden_size_yy_l0': 2, 'hidden_size_yy_l1': 4, 'context_size_yy': 1, 'num_mix_components_yy': 5, 'context_extractor_yy': 'lstm', 'activation_func_yy': 'ReLU', 'L2_weight_yy': 4.3392202997836404e-07, 'L_entropy_weight_yy': 0.0002014017468171487, 'L_sep_weight_yy': 1.7525938407234112e-08, 'L_scale_weight_yy': 8.354948125924329e-08, 'learning_rate_yy': 0.009459952560519692}. Best is trial 21 with value: -2.0918060120281896.
[I 2026-03-17 17:17:04,780] Trial 6 finished with value: -3.239959318033854 and parameters: {'n_layers_yy': 2, 'hidden_size_yy_l0': 4, 'hidden_size_yy_l1': 6, 'context_size_yy': 1, 'num_mix_components_yy': 3, 'context_extractor_yy': 'gru', 'activation_func_yy': 'Tanh', 'L2_weight_yy': 1.2020376647406253e-10, 'L_entropy_weight_yy': 1.644141625943577e-05, 'L_sep_weight_yy': 2.958042036145847e-07, 'L_scale_weight_yy': 2.3399621419380964e-07, 'learning_rate_yy': 0.007889070686351703}. Best is trial 3 with value: -3.248812548828125.
[I 2026-03-17 17:17:06,189] Trial 31 pruned. 
[I 2026-03-17 17:17:07,679] Trial 5 pruned. 
[I 2026-03-17 17:17:08,348] Trial 29 pruned. 
[I 2026-03-17 17:17:08,519] Trial 10 pruned. 
[I 2026-03-17 17:17:08,563] Trial 14 pruned. 
[I 2026-03-17 17:17:09,303] Trial 15 pruned. 
[I 2026-03-17 17:17:09,843] Trial 22 finished with value: -1.9694899077895032 and parameters: {'n_layers_yy': 2, 'hidden_size_yy_l0': 6, 'hidden_size_yy_l1': 4, 'context_size_yy': 3, 'num_mix_components_yy': 4, 'context_extractor_yy': 'lstm', 'activation_func_yy': 'Tanh', 'L2_weight_yy': 3.137316209396826e-05, 'L_entropy_weight_yy': 2.3957484187733575e-06, 'L_sep_weight_yy': 2.8686288670215564e-07, 'L_scale_weight_yy': 4.5603399616510105e-08, 'learning_rate_yy': 0.005171437029232997}. Best is trial 1 with value: -1.9741431522447364.
[I 2026-03-17 17:17:11,811] Trial 32 pruned. 
[I 2026-03-17 17:17:12,690] Trial 16 pruned. 
[I 2026-03-17 17:17:12,910] Trial 27 pruned. 
[I 2026-03-17 17:17:12,993] Trial 31 finished with value: -1.6751627227768537 and parameters: {'n_layers_yy': 1, 'hidden_size_yy_l0': 6, 'context_size_yy': 4, 'num_mix_components_yy': 4, 'context_extractor_yy': 'gru', 'activation_func_yy': 'GELU', 'L2_weight_yy': 3.467551543621457e-06, 'L_entropy_weight_yy': 2.0574559036794636e-06, 'L_sep_weight_yy': 1.0452824021398381e-08, 'L_scale_weight_yy': 1.2178124632967265e-10, 'learning_rate_yy': 0.009595695745400767}. Best is trial 2 with value: -1.677622742403132.
[I 2026-03-17 17:17:13,850] Trial 37 pruned. 
[I 2026-03-17 17:17:14,069] Trial 30 pruned. 
[I 2026-03-17 17:17:14,070] Trial 30 pruned. 
[I 2026-03-17 17:17:14,293] Trial 33 pruned. 
[I 2026-03-17 17:17:17,061] Trial 23 pruned. 
[I 2026-03-17 17:17:17,499] Trial 25 pruned. 
[I 2026-03-17 17:17:20,277] Trial 34 pruned. 
[I 2026-03-17 17:17:20,421] Trial 17 pruned. 
[I 2026-03-17 17:17:20,509] Trial 31 pruned. 
[I 2026-03-17 17:17:20,528] Trial 24 pruned. 
[I 2026-03-17 17:17:20,606] Trial 38 pruned. 
[I 2026-03-17 17:17:21,102] Trial 6 pruned. 
[I 2026-03-17 17:17:21,629] Trial 7 pruned. 
[I 2026-03-17 17:17:23,617] Trial 32 pruned. 
[I 2026-03-17 17:17:26,055] Trial 35 pruned. 
[I 2026-03-17 17:17:26,078] Trial 7 pruned. 
[I 2026-03-17 17:17:27,578] Trial 39 pruned. 
[I 2026-03-17 17:17:27,692] Trial 25 pruned. 
[I 2026-03-17 17:17:28,525] Trial 36 pruned. 
[I 2026-03-17 17:17:28,543] Trial 8 pruned. 
[I 2026-03-17 17:17:29,051] Trial 8 finished with value: -1.786668244949495 and parameters: {'n_layers_yy': 2, 'hidden_size_yy_l0': 2, 'hidden_size_yy_l1': 6, 'context_size_yy': 1, 'num_mix_components_yy': 5, 'context_extractor_yy': 'gru', 'activation_func_yy': 'GELU', 'L2_weight_yy': 1.2487382032667461e-05, 'L_entropy_weight_yy': 3.225521192183634e-05, 'L_sep_weight_yy': 5.892133741615616e-09, 'L_scale_weight_yy': 1.3130531262149028e-09, 'learning_rate_yy': 0.0034758811719571136}. Best is trial 8 with value: -1.786668244949495.
[I 2026-03-17 17:17:31,582] Trial 37 pruned. 
[I 2026-03-17 17:17:32,565] Trial 6 finished with value: -2.724642957378964 and parameters: {'n_layers_yy': 1, 'hidden_size_yy_l0': 6, 'context_size_yy': 1, 'num_mix_components_yy': 3, 'context_extractor_yy': 'gru', 'activation_func_yy': 'GELU', 'L2_weight_yy': 1.1342881187857179e-07, 'L_entropy_weight_yy': 3.287801599516992e-08, 'L_sep_weight_yy': 8.6654982635404e-06, 'L_scale_weight_yy': 2.08442711909591e-08, 'learning_rate_yy': 0.006277355764376055}. Best is trial 3 with value: -2.757216847916007.
[I 2026-03-17 17:17:33,342] Trial 9 pruned. 
[I 2026-03-17 17:17:34,471] Trial 26 pruned. 
[I 2026-03-17 17:17:34,731] Trial 40 pruned. 
[I 2026-03-17 17:17:35,233] Trial 9 pruned. 
[I 2026-03-17 17:17:37,674] Trial 38 pruned. 
[I 2026-03-17 17:17:37,703] Trial 10 pruned. 
[I 2026-03-17 17:17:39,720] Trial 32 finished with value: -1.6756593483334146 and parameters: {'n_layers_yy': 1, 'hidden_size_yy_l0': 6, 'context_size_yy': 4, 'num_mix_components_yy': 4, 'context_extractor_yy': 'gru', 'activation_func_yy': 'GELU', 'L2_weight_yy': 9.287460543388206e-06, 'L_entropy_weight_yy': 1.8130661919856147e-05, 'L_sep_weight_yy': 4.686188688031868e-09, 'L_scale_weight_yy': 5.801974955837642e-10, 'learning_rate_yy': 0.008345173123110053}. Best is trial 2 with value: -1.677622742403132.
[I 2026-03-17 17:17:40,038] Trial 18 pruned. 
[I 2026-03-17 17:17:40,156] Trial 7 finished with value: -2.7966873301283033 and parameters: {'n_layers_yy': 1, 'hidden_size_yy_l0': 5, 'context_size_yy': 1, 'num_mix_components_yy': 5, 'context_extractor_yy': 'gru', 'activation_func_yy': 'ReLU', 'L2_weight_yy': 9.960970228695218e-06, 'L_entropy_weight_yy': 1.3913561851132794e-08, 'L_sep_weight_yy': 7.380486333309461e-06, 'L_scale_weight_yy': 2.412271331210081e-06, 'learning_rate_yy': 0.0036638582447513232}. Best is trial 3 with value: -2.804861466675104.
[I 2026-03-17 17:17:41,669] Trial 21 finished with value: -1.9076895915928171 and parameters: {'n_layers_yy': 2, 'hidden_size_yy_l0': 4, 'hidden_size_yy_l1': 3, 'context_size_yy': 3, 'num_mix_components_yy': 5, 'context_extractor_yy': 'lstm', 'activation_func_yy': 'ReLU', 'L2_weight_yy': 4.501011202146256e-07, 'L_entropy_weight_yy': 3.2758402084783138e-06, 'L_sep_weight_yy': 3.445997564914633e-07, 'L_scale_weight_yy': 4.0126073569648534e-10, 'learning_rate_yy': 0.005295302033064284}. Best is trial 18 with value: -1.9113758963969216.
[I 2026-03-17 17:17:42,121] Trial 33 pruned. 
[I 2026-03-17 17:17:42,409] Trial 11 pruned. 
[I 2026-03-17 17:17:43,893] Trial 11 pruned. 
[I 2026-03-17 17:17:47,835] Trial 7 pruned. 
[I 2026-03-17 17:17:48,068] Trial 31 finished with value: -1.268692009550366 and parameters: {'n_layers_yy': 2, 'hidden_size_yy_l0': 6, 'hidden_size_yy_l1': 6, 'context_size_yy': 2, 'num_mix_components_yy': 4, 'context_extractor_yy': 'lstm', 'activation_func_yy': 'Tanh', 'L2_weight_yy': 1.1513713546725143e-09, 'L_entropy_weight_yy': 0.0007480352425124789, 'L_sep_weight_yy': 9.926189032001856e-09, 'L_scale_weight_yy': 3.1880952666429804e-08, 'learning_rate_yy': 0.008734829819946974}. Best is trial 28 with value: -1.2748027526517012.
[I 2026-03-17 17:17:48,634] Trial 12 pruned. 
[I 2026-03-17 17:17:48,989] Trial 34 pruned. 
[I 2026-03-17 17:17:51,949] Trial 12 pruned. 
[I 2026-03-17 17:17:55,535] Trial 20 finished with value: -1.98505175357371 and parameters: {'n_layers_yy': 2, 'hidden_size_yy_l0': 4, 'hidden_size_yy_l1': 5, 'context_size_yy': 4, 'num_mix_components_yy': 3, 'context_extractor_yy': 'gru', 'activation_func_yy': 'Tanh', 'L2_weight_yy': 0.0007904441752581274, 'L_entropy_weight_yy': 2.0543466702961277e-09, 'L_sep_weight_yy': 0.00013798789462349806, 'L_scale_weight_yy': 2.854443924025817e-09, 'learning_rate_yy': 0.004431917290767527}. Best is trial 20 with value: -1.98505175357371.
[I 2026-03-17 17:17:56,151] Trial 27 pruned. 
[I 2026-03-17 17:17:56,966] Trial 17 finished with value: -2.4474830982702267 and parameters: {'n_layers_yy': 2, 'hidden_size_yy_l0': 6, 'hidden_size_yy_l1': 5, 'context_size_yy': 3, 'num_mix_components_yy': 1, 'context_extractor_yy': 'gru', 'activation_func_yy': 'ReLU', 'L2_weight_yy': 3.3702411150576733e-06, 'L_entropy_weight_yy': 7.467006618667317e-05, 'L_sep_weight_yy': 1.0918800288118876e-07, 'L_scale_weight_yy': 1.2792548135626891e-06, 'learning_rate_yy': 0.0014119258382117223}. Best is trial 2 with value: -2.476197165819489.
[I 2026-03-17 17:17:57,069] Trial 33 pruned. 
[I 2026-03-17 17:17:59,873] Trial 13 pruned. 
[I 2026-03-17 17:18:02,367] Trial 13 pruned. 
[I 2026-03-17 17:18:03,695] Trial 32 pruned. 
[I 2026-03-17 17:18:04,311] Trial 21 pruned. 
[I 2026-03-17 17:18:04,697] Trial 14 pruned. 
[I 2026-03-17 17:18:07,105] Trial 28 finished with value: -2.6023761873016573 and parameters: {'n_layers_yy': 1, 'hidden_size_yy_l0': 6, 'context_size_yy': 4, 'num_mix_components_yy': 3, 'context_extractor_yy': 'lstm', 'activation_func_yy': 'ReLU', 'L2_weight_yy': 8.988709065002349e-07, 'L_entropy_weight_yy': 1.6761218849099536e-08, 'L_sep_weight_yy': 1.0547644556644029e-06, 'L_scale_weight_yy': 9.511820479904377e-06, 'learning_rate_yy': 0.007777147478923952}. Best is trial 7 with value: -2.6326792002135244.
[I 2026-03-17 17:18:07,532] Trial 35 pruned. 
[I 2026-03-17 17:18:08,417] Trial 22 pruned. 
[I 2026-03-17 17:18:09,183] Trial 20 finished with value: -1.7038948064814108 and parameters: {'n_layers_yy': 1, 'hidden_size_yy_l0': 2, 'context_size_yy': 2, 'num_mix_components_yy': 5, 'context_extractor_yy': 'gru', 'activation_func_yy': 'GELU', 'L2_weight_yy': 1.0986237955884808e-06, 'L_entropy_weight_yy': 2.2569655748055364e-06, 'L_sep_weight_yy': 3.350810974254629e-09, 'L_scale_weight_yy': 1.49102500283125e-08, 'learning_rate_yy': 0.009046744025103743}. Best is trial 20 with value: -1.7038948064814108.
[I 2026-03-17 17:18:09,704] Trial 18 pruned. 
[I 2026-03-17 17:18:10,593] Trial 36 pruned. 
[I 2026-03-17 17:18:10,594] Trial 41 finished with value: -1.6125313663398195 and parameters: {'n_layers_yy': 2, 'hidden_size_yy_l0': 6, 'hidden_size_yy_l1': 5, 'context_size_yy': 2, 'num_mix_components_yy': 2, 'context_extractor_yy': 'lstm', 'activation_func_yy': 'ReLU', 'L2_weight_yy': 3.2937327042206006e-05, 'L_entropy_weight_yy': 2.853007254038836e-08, 'L_sep_weight_yy': 5.755197316652902e-09, 'L_scale_weight_yy': 9.975572967825758e-08, 'learning_rate_yy': 0.007198427816011804}. Best is trial 12 with value: -1.6131555846140806.
[I 2026-03-17 17:18:12,132] Trial 23 pruned. 
[I 2026-03-17 17:18:13,371] Trial 42 pruned. 
[I 2026-03-17 17:18:13,702] Trial 29 pruned. 
[I 2026-03-17 17:18:14,337] Trial 37 pruned. 
[I 2026-03-17 17:18:14,644] Trial 19 pruned. 
[I 2026-03-17 17:18:14,881] Trial 34 pruned. 
[I 2026-03-17 17:18:16,222] Trial 8 pruned. 
[I 2026-03-17 17:18:16,806] Trial 38 pruned. 
[I 2026-03-17 17:18:17,746] Trial 35 pruned. 
[I 2026-03-17 17:18:19,149] Trial 21 pruned. 
[I 2026-03-17 17:18:20,787] Trial 30 pruned. 
[I 2026-03-17 17:18:21,475] Trial 22 finished with value: -1.9058621443563433 and parameters: {'n_layers_yy': 2, 'hidden_size_yy_l0': 3, 'hidden_size_yy_l1': 3, 'context_size_yy': 3, 'num_mix_components_yy': 4, 'context_extractor_yy': 'lstm', 'activation_func_yy': 'ReLU', 'L2_weight_yy': 3.329768358778486e-07, 'L_entropy_weight_yy': 2.5925181003674515e-06, 'L_sep_weight_yy': 5.432175085274172e-07, 'L_scale_weight_yy': 6.46983878775102e-10, 'learning_rate_yy': 0.0055206611706364655}. Best is trial 18 with value: -1.9113758963969216.
[I 2026-03-17 17:18:21,945] Trial 9 pruned. 
[I 2026-03-17 17:18:23,959] Trial 39 pruned. 
[I 2026-03-17 17:18:24,247] Trial 23 pruned. 
[I 2026-03-17 17:18:26,923] Trial 40 pruned. 
[I 2026-03-17 17:18:27,438] Trial 39 finished with value: -1.8185204223833038 and parameters: {'n_layers_yy': 2, 'hidden_size_yy_l0': 2, 'hidden_size_yy_l1': 2, 'context_size_yy': 3, 'num_mix_components_yy': 5, 'context_extractor_yy': 'lstm', 'activation_func_yy': 'ReLU', 'L2_weight_yy': 2.9243247274042372e-05, 'L_entropy_weight_yy': 2.525363730688042e-06, 'L_sep_weight_yy': 1.861791640022981e-10, 'L_scale_weight_yy': 0.0003406234041587248, 'learning_rate_yy': 0.006488971605525438}. Best is trial 2 with value: -1.824331576606496.
[I 2026-03-17 17:18:27,570] Trial 20 pruned. 
[I 2026-03-17 17:18:28,959] Trial 14 pruned. 
[I 2026-03-17 17:18:29,260] Trial 9 pruned. 
[I 2026-03-17 17:18:29,406] Trial 15 finished with value: -3.1437375346128067 and parameters: {'n_layers_yy': 1, 'hidden_size_yy_l0': 4, 'context_size_yy': 2, 'num_mix_components_yy': 5, 'context_extractor_yy': 'gru', 'activation_func_yy': 'ReLU', 'L2_weight_yy': 0.000133120366095838, 'L_entropy_weight_yy': 6.7865105184230585e-09, 'L_sep_weight_yy': 7.71103499882291e-07, 'L_scale_weight_yy': 1.2137825148661801e-08, 'learning_rate_yy': 0.005885968805272648}. Best is trial 12 with value: -3.1467977435352683.
[I 2026-03-17 17:18:29,434] Trial 22 pruned. 
[I 2026-03-17 17:18:30,644] Trial 40 pruned. 
[I 2026-03-17 17:18:31,821] Trial 24 pruned. 
[I 2026-03-17 17:18:32,853] Trial 21 pruned. 
[I 2026-03-17 17:18:32,874] Trial 15 pruned. 
[I 2026-03-17 17:18:32,965] Trial 8 pruned. 
[I 2026-03-17 17:18:33,325] Trial 41 pruned. 
[I 2026-03-17 17:18:33,577] Trial 23 pruned. 
[I 2026-03-17 17:18:33,682] Trial 41 pruned. 
[I 2026-03-17 17:18:33,874] Trial 10 pruned. 
[I 2026-03-17 17:18:34,190] Trial 33 finished with value: -1.2628672911807923 and parameters: {'n_layers_yy': 2, 'hidden_size_yy_l0': 5, 'hidden_size_yy_l1': 5, 'context_size_yy': 2, 'num_mix_components_yy': 5, 'context_extractor_yy': 'lstm', 'activation_func_yy': 'Tanh', 'L2_weight_yy': 1.462352959726708e-09, 'L_entropy_weight_yy': 5.257028239801984e-06, 'L_sep_weight_yy': 1.4628288158482214e-06, 'L_scale_weight_yy': 1.606109210580144e-07, 'learning_rate_yy': 0.00686213008293938}. Best is trial 28 with value: -1.2748027526517012.
[I 2026-03-17 17:18:34,361] Trial 10 pruned. 
[I 2026-03-17 17:18:34,912] Trial 36 pruned. 
[I 2026-03-17 17:18:35,442] Trial 26 finished with value: -2.836288688568588 and parameters: {'n_layers_yy': 1, 'hidden_size_yy_l0': 5, 'context_size_yy': 4, 'num_mix_components_yy': 4, 'context_extractor_yy': 'gru', 'activation_func_yy': 'Tanh', 'L2_weight_yy': 4.665420074761928e-10, 'L_entropy_weight_yy': 2.5084670712189697e-06, 'L_sep_weight_yy': 3.5887899351510224e-08, 'L_scale_weight_yy': 1.8170591260608552e-08, 'learning_rate_yy': 0.0047533226345750626}. Best is trial 26 with value: -2.836288688568588.
[I 2026-03-17 17:18:36,018] Trial 15 finished with value: -2.3727640569331943 and parameters: {'n_layers_yy': 2, 'hidden_size_yy_l0': 6, 'hidden_size_yy_l1': 2, 'context_size_yy': 2, 'num_mix_components_yy': 3, 'context_extractor_yy': 'lstm', 'activation_func_yy': 'Tanh', 'L2_weight_yy': 3.7216570645131257e-07, 'L_entropy_weight_yy': 0.00015521660371829493, 'L_sep_weight_yy': 1.178667031367854e-10, 'L_scale_weight_yy': 3.408168473866763e-08, 'learning_rate_yy': 0.005765224125808297}. Best is trial 9 with value: -2.373689101517566.
[I 2026-03-17 17:18:36,841] Trial 16 pruned. 
[I 2026-03-17 17:18:37,758] Trial 22 pruned. 
[I 2026-03-17 17:18:37,822] Trial 16 pruned. 
[I 2026-03-17 17:18:39,167] Trial 16 pruned. 
[I 2026-03-17 17:18:39,888] Trial 42 pruned. 
[I 2026-03-17 17:18:40,006] Trial 34 pruned. 
[I 2026-03-17 17:18:40,764] Trial 19 finished with value: -1.8548460264463682 and parameters: {'n_layers_yy': 1, 'hidden_size_yy_l0': 4, 'context_size_yy': 3, 'num_mix_components_yy': 4, 'context_extractor_yy': 'lstm', 'activation_func_yy': 'Tanh', 'L2_weight_yy': 5.668041270094562e-07, 'L_entropy_weight_yy': 2.404425816193917e-06, 'L_sep_weight_yy': 8.10047069969714e-06, 'L_scale_weight_yy': 1.3901412726965221e-09, 'learning_rate_yy': 0.00943174305110314}. Best is trial 10 with value: -1.8554935362796692.
[I 2026-03-17 17:18:41,483] Trial 37 pruned. 
[I 2026-03-17 17:18:43,444] Trial 17 pruned. 
[I 2026-03-17 17:18:44,113] Trial 24 pruned. 
[I 2026-03-17 17:18:44,179] Trial 27 pruned. 
[I 2026-03-17 17:18:45,074] Trial 38 pruned. 
[I 2026-03-17 17:18:45,083] Trial 43 finished with value: -1.611839868834422 and parameters: {'n_layers_yy': 2, 'hidden_size_yy_l0': 6, 'hidden_size_yy_l1': 6, 'context_size_yy': 2, 'num_mix_components_yy': 1, 'context_extractor_yy': 'lstm', 'activation_func_yy': 'ReLU', 'L2_weight_yy': 2.3379545319558695e-05, 'L_entropy_weight_yy': 4.746073496929827e-08, 'L_sep_weight_yy': 9.313586160081263e-10, 'L_scale_weight_yy': 2.400915180432849e-06, 'learning_rate_yy': 0.008729851870559866}. Best is trial 12 with value: -1.6131555846140806.
[I 2026-03-17 17:18:45,894] Trial 35 pruned. 
